title,url,press,summary,date
코로나19 충격에 1차 車부품사 실적도 '먹구름',/news/news_read.nhn?article_id=0004670990&office_id=277&mode=search&query=현대모비스&page=1,아시아경제,1일 업계에 따르면 국내 최대 자동차 부품업체인 현대모비스의 올해 1분기 매출액은 8조4230억원으로 전년동기대비 3.6% 감소했다. 영업이익은...,2020-05-01 08:00
코로나19 대유행에 삼성·LG전자 전장사업도 주춤,/news/news_read.nhn?article_id=0004616450&office_id=421&mode=search&query=현대모비스&page=1,뉴스1,"한편 현대차 계열의 자동차 부품 공급사인 현대모비스의 경우 올 1분기 매출은 전년 동기 대비 3.6% 감소한 8조4230억원, 영업이익은 26....",2020-05-01 12:34
코로나19에 전장사업도 흔들···공장 가동 중단 때문,/news/news_read.nhn?article_id=0003732109&office_id=011&mode=search&query=현대모비스&page=1,서울경제,한편 현대차 계열의 자동차 부품 공급사인 현대모비스(012330)도 현대기아차의 생산량이 감소하며 1·4분기 매출이 전년 동기 대비 3.6% 감...,2020-05-01 14:14
더 똑똑해지는 자동차의 ‘뇌’…뜨거워진 내비게이션 전쟁,/news/news_read.nhn?article_id=0003283943&office_id=020&mode=search&query=현대모비스&page=1,동아일보,"현대차그룹은 현대차와 현대엠엔소프트가 내비게이션 기술과 지도 정보를 확보하고, 현대모비스는 다양한 형태의 내비게이션 기기를 만든다. 운전석 전면 유리창에...",2020-05-01 17:01
1분기 자사주 매입 폭증…작년 전체의 1.5배,/news/news_read.nhn?article_id=0004567422&office_id=009&mode=search&query=현대모비스&page=1,매일경제,(8227억원)와 현대모비스(5258억원) 등으로 손꼽을 정도다. 전문가들은 소각 없는 자사주 매입은 주주환원과 상관 없는 방향으로 전개될 가능...,2020-05-01 17:13
