head,text,url
,"코스피가 장초반 상승세를 지키지 못하고 하락 마감, 1930선대로 밀렸다. 코스닥은 소폭 오르며 4거래일 연속 오름세를 이어갔다.11일 코스피 지수는 전장보다 10.42포인트(0.54%) 하락한 1935.40에 장을 종료했다.지수는 전장보다 7.69포인트(0.39%) 상승한 1953.51에 거래를 시작했다. 장초반 1960선을 찍기도 했지만 이후 상승폭을 줄이며 하락세로 전환했다.주말사이 국내에서 코로나19가 재확산될 수 있다는 불안감이 시장에 영향을 미쳤다.미국, 유럽 등 주요국의 경제봉쇄 재개 기대감 등의 영향으로 이날 일본, 홍콩 등 아시아 증시가 1%대 상승세를 보이고 미국 시간외 선물지수도 상승세를 보였음지만 코스피는 해외 증시 흐름과 다소 다른 양상을 띄었다.기관과 외국인이 둘이 합쳐 5000억원 넘게 순매도 했다.기관은 3639억원 팔았다. 금융투자 1516억원, 보험 809억원, 연기금 732억원, 투자신탁 357억원, 사모펀드에서 267억원을 순매도했다. 외국인도 1746억원의 주식을 팔며 하루만에 매도우위로 돌아섰다. 개인만 5122억원의 주식을 순매수했다.다수 업종이 하락세를 보인 가운데 유통업종이 1.83% 내리며 하락폭이 가장 컸다. 은행과 철강금속 업종도 각각 1.79%, 1.50% 하락했다. 반면 기계와 의료정밀 업종은 각각 1.93%, 1.31% 올랐다.시가총액 상위 종목 중에선 롯데케미칼(-4.35%)과 아모레퍼시픽(-3.31%)이 3~4%대 하락했다. 삼성물산(-2.84%), POSCO(-2.22%), 한국전력(-2.01%), 삼성전기(-2.10%), 하나금융지주(-2.23%) 등도 2% 넘게 내렸다.반면 한진칼은 6.57% 급등했고 엔씨소프트(+2.95%), 넷마블(+2.25%), 삼성에스디에스(+2.56%), LG유플러스(+2.67%) 등은 2% 넘게 올랐다.시가총액 1위인 삼성전자는 전날보다 0.82% 내린 4만8400원에 거래를 마쳤다. 2위인 SK하이닉스는 0.59% 하락한 8만4500원을 기록했다.코스피 시장과 달리 코스닥은 4거래일 연속 상승세를 보였다.코스닥 지수는 전 거래일보다 2.74포인트(0.40%) 오른 685.04에 거래를 종료했다. 	▶
/ ▶ 태기원(tae@joseilbo.com)저작권자 ⓒ 조세일보(http://www.joseilbo.com). 무단전재 및 재배포 금지",/news/news_read.nhn?article_id=0002223524&office_id=123&mode=search&query=SK하이닉스&page=1
수출 감소·코로나 확산 우려 부담···코스닥은 0.4% 상승,"[서울경제] 코스피가 11일 외국인과 기관의 동반 매도에 하락 마감했다.이날 코스피는 전 거래일보다 0.54%(10.42포인트) 내린 1,935.40포인트에 거래를 마쳤다.지수는 전장보다 0.40%(7.69포인트) 오른 1,953.51에서 출발해 장중 한때 1,960.46까지 올랐으나 이후 하락과 상승을 반복하다가 차츰 낙폭을 키웠다.유가증권시장에서는 개인이 5,122억원을 순매수했으나, 기관이 3,640억원, 외국인이 1.746억원어치를 각각 순매도했다. 개인은 5천122억원을 순매수했다.이경민 대신증권 연구원은 “5월 1~10일 수출이 작년 동기보다 큰 폭으로 감소한 것으로 나타나고 신종 코로나바이러스 감염증(코로나19) 확산 속도가 다시 빨라질 수 있다는 우려가 커지면서 증시에 부담으로 작용했다”고 평가했다.시가총액 상위 종목 중에는 네이버(0.23%)와 LG생활건강(1.13%), 삼성SDI(0.53%) 등이 올랐고, 삼성전자(-0.82%)와 SK하이닉스(-0.59%), 삼성바이오로직스(-0.34%) 등이 LG화학(-1.70%), 현대차(-0.85%), 삼성물산(-2.84%) 등이 내렸다. 셀트리온은 보합 마감했다.업종별로는 유통업(-1.83%)과 은행(-1.79%), 철강·금속(-1.50%), 비금속광물(-1.38%), 건설업(-1.35%), 전기·가스업(-1.29%), 증권(-1.21%), 종이·목재(-1.15%), 운수·장비(-1.11%), 화학(-1.09%) 등이 약세였고, 기계(1.93%)와 의료정밀(1.31%), 서비스업(1.26%), 운수·창고(1.00%) 등은 강세를 보였다.코스닥지수는 전장보다 0.40%(2.74포인트) 오른 685.04로 마감했다.이는 종가 기준으로 지난 2월 17일(692.59) 이후 약 3개월 만에 가장 높은 수준이다.지수는 전장보다 0.66%(4.51포인트) 오른 686.81로 개장해 장 초반 한때 하락세로 돌아섰다가 다시 상승세로 전환했다.코스닥시장에서도 개인은 1,508억원어치를 순매수했다. 반면 외국인은 1,047억원, 기관은 298억원을 각각 순매도했다. 시총 상위 종목 가운데는 알테오젠(16.14%)과 에이치엘비(13.25%)가 급등했고, 셀트리온제약(1.77%), 씨젠(1.31%), 셀트리온헬스케어(0.91%)도 상승했다.CJ ENM(-3.07%), 케이엠더블유(-2.71%), 스튜디오드래곤(-1.79%), SK머티리얼즈(-1.07%) 등은 내렸고, 펄어비스는 보합으로 마감했다.한편, 서울 외환시장에서 원·달러 환율은 전 거래일보다 0.6원 오른 달러당 1,220.5원에 마감했다./양사록기자 sarok@sedaily.com저작권자 ⓒ 서울경제, 무단 전재 및 재배포 금지",/news/news_read.nhn?article_id=0003735521&office_id=011&mode=search&query=SK하이닉스&page=1
,"[머니투데이 우경희 기자, 심재현 기자, 세종=최우영 기자] 올 2분기 '수출절벽'이 갈수록 가파라지고 있다. 반도체와 자동차, 백색가전을 가리지 않고 수출액이 급감하고 있는 것이다. 미국-중국-EU 등 주력시장이 마비돼 배를 띄워도 갈 곳조차 없다. 이대로 가다간 올 2분기 실적 쇼크가 예상보다 훨씬 강력할 수 있다. 코로나19(COVID-19) 잔혹사의 '본 게임'은 이제 시작이라는 지적이다. 11일 관세청에 따르면 5월 1~10일 누적 수출액은 지난해 같은 기간대비 46.3% 감소한 69억달러로 집계됐다. 근무일이 6.5일에서 5일로 줄어든 것을 감안해도 일평균 수출액이 30.2%나 줄었다. 수출의 3분의 1이 증발했다는 의미다. 석유제품(-75.6%)과 승용차(-80.4%)의 감소폭이 컸고, 반도체(-17.8%)와 무선통신기기(-35.9%)도 큰 폭 하락했다. 특히 주요 수출대상국 경제가 사실상 '셧다운'(일시 폐쇄) 상태여서 수출절벽은 당분간 이어질 전망이다.
5분의 1토막이 난 자동차 수출은 회복 조짐이 보이지 않는다. 전체 수출대상국 별 실적을 보면 미국 향 수출이 55%, EU(유럽연합) 향이 51%, 중국 향이 29% 줄었다. 현대·기아차를 중심으로 한 국내 완성차 업체들은 올 2분기 수출 타격으로 실적도 악영향을 받을 수밖에 없다. 실제 현대차는 올 1분기 판매가 9년만에 처음 100만대를 밑돌았다. 지난 2월까지는 코로나 여파가 없었는데도 그렇다. 그만큼 3월 이후 상황이 급격히 심각해졌고 아직도 이 상태는 현재진행형이다. 현대차의 올 1분기 당기순이익은 5527억원으로 전년 대비 42% 줄었다. 기아차 실적도 마찬가지로 크게 꺾였다. 반도체 수출 급감은 더 뼈아프다. 국내 산업 중 사실상 유일한 버팀목이 반도체였다. 한국 수출실적에서 반도체 비중은 20%에 달한다. 그런 반도체 수출길이 막히고 있다는 것은 전체 수출감소로 직결될 수 있다. 시장조사업체 카운터포인트리서치는 ""전 세계적으로 반도체 수요가 갈수록 위축되고 있다""며 ""올 1분기 스마트폰 시장은 전년 대비 13% 줄었다""고 밝혔다. 그나마 자동차는 수요가 회복되면 프로모션으로 판매 확대를 노릴 수 있지만 반도체는 그렇지 않다. 한 업계 관계자는 ""24시간 생산되는 반도체는 안 팔리면 곧바로 재고가 쌓인다""며 ""수출 감소는 근본적으로 수익 악화로 이어진다""고 말했다. 반도체업계는 5월 이후 수출 전망도 불안하다고 본다. 삼성전자와 SK하이닉스의 1분기 실적은 나쁘지 않았다. 하지만 4월부터 상황이 급변하며 미국과 EU의 경기부진이 심해졌다. 반도체 수출도 4월이후 먹구름이 깔리고 있는 것이다.
초유의 마이너스 유가를 기록 중인 정유산업도 수출 탈출구가 안 보인다. 전방산업들이 속속 무너지며 석유제품 수요는 바닥 났다. 국내 정유 4사(SK이노베이션, GS칼텍스, 에쓰오일, 현대오일뱅크)를 합하면 1분기 영업이익 4조원이 증발됐다. 올 2분기에 이어 3분기를 보는 시선들도 어둡다. 제조업 부진이 부정적 전망의 가장 큰 이유지만 반도체와 완성차, 석유화학 등의 수출이 뒷받침 해주지 못할 수 있기 때문이다.
한 업계 관계자는 ""일부 호황의 착시에 빠져 새로운 성장동력 발굴을 미뤘고, 민관의 위기 대응 속도도 느렸다""며 ""경제 전반이 '삼성전자 착시효과'에 젖어 기대치만 웃자랐는데 올 2분기부터 실제 타격이 이어질 것""이라고 밝혔다. 우경희 기자 cheerup@mt.co.kr, 심재현 기자 urme@mt.co.kr, 세종=최우영 기자 young@
<저작권자 ⓒ '돈이 보이는 리얼타임 뉴스' 머니투데이, 무단전재 및 재배포 금지>",/news/news_read.nhn?article_id=0004406923&office_id=008&mode=search&query=SK하이닉스&page=1
코스피 약세...0.54% 내린 1935.40 마감,"[더팩트ㅣ박경현 기자] 11일 국내증시가 엇갈린 결과를 보이며 장을 마감했다.외인과 기관의 동반 매수로 상승마감했던 지난 8일과 달리 이날은 외국인과 기관의 매도물량에 코스피지수가 낙폭을 키웠다.코스피는 전장 대비 10.42포인트(-0.54%) 내린 1935.40에 장을 마쳤다. 외국인과 기관이 매도포지션을 취해 각각 1702억 원, 3641억 원을 팔아치운 가운데 개인 홀로 5122억 원을 사들였다.시가총액 상위종목은 대부분 내렸다. 삼성전자(-0.82%), SK하이닉스(-0.59%), 삼성바이오로직스(-0.34%), 삼성전자우(-0.36%), LG화학(-1.70%), 현대차(-0.85%)가 내린 가운데 네이버(+0.23%), LG생활건강(+1.13%), 삼성SDI(+0.53%)는 올랐다. 셀트리온은 보합세로 마감했다.이날 업종은 가정용기기와 용품, 교육서비스, 생물공학, 소프트웨어가 3~4%가량 올랐다. 반면 독립전력생산 및 에너지거래, 건축제품, 호텔레스토랑레저, 식품과 기본식료품소매는 2~4%가량 내렸다.코스닥은 개인투자자의 매수포지션 전환에 강보합 마감했다. 코스닥은 전장대비 2.74포인트(+0.40%)오른 685.04에 장을 마쳤다.이날 개인은 1510억 원가량 사들인 가운데 외국인과 기관은 각각 1046억 원, 300억 원을 순매도했다.코스닥 시가총액 상위종목 주가는 엇갈린 결과를 나타냈다. 셀트리온헬스케어(+0.91%), 에이치엘비(+13.25%), 셀트리온제약(+1.77%), 씨젠(+1.31%), 알테오젠(+16.14%)은 오른 반면 CJ ENM(-3.07%), 케이엠더블유(-2.71%), 스튜디오드래곤(-1.79%), SK머티리얼즈(-1.07%)는 내렸다.pkh@tf.co.kr저작권자 ⓒ 특종에 강한 더팩트 & tf.co.kr 무단 전재 및 재배포 금지",/news/news_read.nhn?article_id=0000025361&office_id=629&mode=search&query=SK하이닉스&page=1
삼성SDI  293억 원 '매수'·LG화학763억 원 '매도',"[더팩트ㅣ박경현 기자] 11일 코스피는 외인과 기관이 매도포지션으로 전환한 가운데 지수낙폭을 키웠다. 이날 외국인과 기관은 각각 1702억 원, 3641억 원을 팔아치운 가운데 개인 홀로 5122억 원을 사들였다. 코스닥은 테마주 등 개별종목의 상승세에 힘입어 강보합 마감했다.이날 외국인투자자의 코스피시장 최대매수는 삼성 SDI로 향했다. 외인은 삼성SDI에 293억 원을 순매수했다. 이어 LG생활건강에 254억 원, SK하이닉스에 209억 원, 한진칼에 150억 원을 사들였다.반면 LG화학은 763억 원을 팔았다. 이어 삼성전자 615억 원, KB금융 188억 원, 삼성물산 97억 원, 셀트리온 95억 원 순으로 순매도 했다.코스닥시장에서는 에이치엘비(207억 원), 젬백스(51억 원), NHN한국사이버결제(50억 원)를 순매수했다. 반면 메디톡스(141억 원), 셀트리온헬스케어(122억 원), 씨젠(104억 원)은 순매도했다.이날 기관투자자는 SK케미칼에 48억 원, NHN은 42억 원을 사들였다. 반면 삼성전자 819억 원, 카카오 246억 원, 신세계 233억 원을 팔아치웠다.시가총액 상위종목은 대부분 내렸다. 삼성전자(-0.82%), SK하이닉스(-0.59%), 삼성바이오로직스(-0.34%), 삼성전자우(-0.36%), LG화학(-1.70%), 현대차(-0.85%)가 내린 가운데 네이버(+0.23%), LG생활건강(+1.13%), 삼성SDI(+0.53%)는 올랐다. 셀트리온은 보합세로 마감했다.pkh@tf.co.kr저작권자 ⓒ 특종에 강한 더팩트 & tf.co.kr 무단 전재 및 재배포 금지",/news/news_read.nhn?article_id=0000025379&office_id=629&mode=search&query=SK하이닉스&page=1
"하이실리콘, 매출 첫 '세계 톱10'메모리·시스템반도체 역량 강화","반도체 산업을 적극 육성한다는 중국의 '반도체 굴기'가 다시 속도를 내고 있다. 매출 등 양적 성장과 함께 기술력도 메모리와 시스템 반도체 등 폭넓은 분야에서 수준을 높이고 있다는 분석이 나온다.
 11일 관련 업계에 따르면 중국 반도체 기업들이 매출 성장세와 함께 잇따라 기술개발 역량 강화에 속도를 높이고 있다.
 시장조사업체 IC인사이츠의 글로벌 반도체시장 조사에서 중국 화웨이의 자회사인 하이실리콘이 매출규모 상위 10개 기업 순위에 처음으로 올랐다. 전 세계 반도체시장 상위 10개 기업 총매출액은 724억8700만달러(약 88조2000억원)를 기록했다. 삼성전자와 SK하이닉스는 각각 2위와 4위를 기록했고 1위는 미국의 인텔이 차지했다.
 하이실리콘은 올 1·4분기 기준 26억7000만달러(약 3조2500억원) 매출을 기록하며 전 세계 반도체 기업 매출순위가 지난해 같은 기간 15위에서 5단계 상승했다.
 특히 하이실리콘은 1·4분기 매출액이 전년(17억3500만달러) 대비 54% 증가했다. 상위 10개 기업의 평균 매출액 증가율이 16%를 기록한 점을 감안하면 3배 이상의 성장세를 나타낸 셈이다.
 하이실리콘 매출의 대부분은 화웨이의 주문인 것으로 전해졌다. 미국의 제재로 인해 화웨이가 자회사 팹리스(반도체 설계 전문)에 물량의 상당수를 몰아주는 상황인 것으로 분석된다.
 중국 기업들이 한국 기업들과 상대적으로 격차가 좁은 시스템반도체 분야에서도 경쟁력을 급격히 향상시키고 있다는 평가가 나온다. 더불어 중국 파운드리(반도체 위탁생산) 업체인 SMIC도 중국 기업들의 계약을 수주하면서 가파른 성장세를 보이고 있다는 분석도 제기된다.
 한국 기업들이 강세를 보이고 있는 메모리반도체 시장에서도 중국 업체들은 추격에 바짝 고삐를 쥐고 있는 모양새다.
 일부 외신들은 중국 창신메모리(CXMT)가 올 하반기 17나노미터(㎚) D램을 양산할 계획인 것으로 전해졌다. 지난해 D램 생산을 시작한 창신메모리가 17나노 D램 양산에 성공할 경우 한국 기업들과의 기술 격차는 3년가량으로 좁혀지게 된다. 또 양쯔메모리(YMTC)도 지난달 자사 홈페이지에서 128단 낸드플래시 개발에 성공했다고 공개하기도 했다.
 이러한 중국 업체들의 추격에 대해 삼성전자는 지난 실적 발표 후 콘퍼런스콜에서 양산 시기보다 고부가 제품의 안정적인 공급이 더 중요하다며 자신감을 내비친 바 있다. 업계 관계자는 ""공기술과 양산 시기뿐만 아니라 제품 생산의 수율 확보가 경쟁력을 판단하기 위한 가장 중요한 요소""라고 설명했다.


 ※ 저작권자 ⓒ 파이낸셜뉴스. 무단 전재-재배포 금지",/news/news_read.nhn?article_id=0004422511&office_id=014&mode=search&query=SK하이닉스&page=1
"■  반도체 '자국중심주의' 확산파운드리 亞의존 낮추려는 의도퀄컴 등 美기업 물량 확보 위해삼성도 오스틴 공장 증설 가능성""코로나 속 투자 리스크 커"" 지적도","[서울경제] 미국과 일본 정부가 신종 코로나바이러스 감염증(코로나19) 확산을 계기로 ‘반도체 자급자족’을 추진하면서 삼성전자와 SK하이닉스 등 국내 반도체 업체에 미칠 영향에 관심이 쏠린다. 특히 미국과 일본 모두 세계 최대 파운드리(반도체 위탁생산) 업체인 대만 TSMC 공장의 자국 내 유치를 추진함에 따라 TSMC를 추격하려 온힘을 쏟고 있는 삼성전자의 대응이 주목된다. 업계에서는 삼성전자가 TSMC와의 경쟁에서 뒤쳐지지 않기 위해 미국 텍사스주 오스틴 반도체 공장의 확장에 나설 가능성이 높은 것으로 보고 있다.
11일 업계 및 외신에 따르면 미국과 일본 정부가 반도체 자급자족을 위해 가장 공을 들이는 업체는 파운드리 분야의 절대 강자인 대만 TSMC다.
트럼프 정부는 파운드리 사업의 핵심 고객이 애플·퀄컴·AMD·엔비디아 등 미국 반도체 기업인 만큼 TSMC 공장 유치를 통해 반도체 공급망의 안정을 꾀하려는 것으로 풀이된다. 코로나19 확산으로 반도체 공급망 붕괴에 대한 우려가 커진 상황에서 TSMC와 삼성전자의 공장을 미국으로 불러들여 파운드리 분야의 한국·대만 의존도를 낮추겠다는 것이다. TSMC 공장 유치를 통해 ‘반도체 굴기’에 나선 중국을 견제하려는 의도도 있다. 특히 세계 최대 통신장비 업체이자 세계 2위 스마트폰 업체인 중국 화웨이는 자회사 하이실리콘이 설계한 반도체의 위탁생산을 TSMC에 맡기고 있다. 일본의 경우 세계 최고 수준의 반도체 장비·소재 업체를 보유한 만큼 TSMC와 인텔 공장 유치를 통해 자국 반도체 생태계를 강화하려는 포석으로 풀이된다. 문제는 미국과 일본 정부의 반도체 자급 추진의 불똥이 삼성전자로 튀고 있다는 점이다. 특히 삼성전자는 미국이 파운드리 사업 경쟁자인 TSMC의 미국 내 공장 유치는 물론 삼성전자의 미국 공장 확장에도 관심을 보이면서 고민에 빠진 분위기다. 삼성전자 입장에서는 이번 사안을 도널드 트럼프 행정부가 밀어붙이는데다 주요 고객인 인텔·퀄컴·엔비디아 등 미국 반도체 업체들이 힘을 보탤 경우 무시하기가 쉽지 않은 상황이다. 하지만 코로나19 사태로 반도체 수요 위축에 대한 우려가 커지는 가운데 수조원대 투자가 필요한 파운드리 생산라인 확장에 나서기에는 리스크가 크다는 지적도 나온다. 삼성전자는 오스틴에 반도체 설계업체의 주문을 받아 반도체 제품을 위탁생산하는 파운드리 공장을 두고 있다. 삼성전자의 유일한 해외 파운드리 공장이다. 삼성전자의 국내 화성사업장 극자외선(EUV) 전용 라인이 6·7나노급 반도체 등 10나노 이하 초미세공정 반도체를 만드는 반면 오스틴 공장은 14나노대 제품을 주로 생산한다. 업계에서는 TSMC가 미국 내 공장 신설에 나설 경우 삼성전자도 오스틴 공장을 확장할 가능성이 높은 것으로 보고 있다. TSMC가 미국에 파운드리 공장을 짓고 애플·퀄컴 등 미국 업체의 반도체 주문을 지금보다 더 가져갈 경우 TSMC를 제치고 2030년까지 시스템반도체 1위에 오른다는 삼성전자의 ‘반도체 비전 2030’ 달성이 물거품이 될 수 있어서다. 업계의 한 관계자는 “최근 퀄컴과 엔비디아 등 미국 반도체 업체들이 TSMC에 대한 의존도를 낮추는 차원에서 삼성전자에도 파운드리 물량을 맡기고 있는데 TSMC가 미국에 파운드리 공장을 지을 경우 미국 업체들의 위탁 물량이 다시 TSMC에 몰릴 수 있을 것”이라고 말했다. 업계에서는 이전부터 삼성전자가 오스틴 공장에 EUV 라인을 새로 도입할 수 있다는 관측이 제기되고 있다. 삼성전자는 최근 공장 확장과 설비 확충 등을 염두에 두고 오스틴 공장 인근에 추가 부지를 매입한 것으로 알려졌다.오스틴 공장 확대 가능성과 관련해 삼성전자 관계자는 “노코멘트”라고 밝혔다./이재용기자 jylee@sedaily.com저작권자 ⓒ 서울경제, 무단 전재 및 재배포 금지",/news/news_read.nhn?article_id=0003735621&office_id=011&mode=search&query=SK하이닉스&page=1
▶ 네이버 홈에서 [한국경제TV] 채널 구독하기 [생방송보기]▶ 대한민국 재테크 총집결! - [증권 / 주식상담 / 부동산],"[한국경제TV 신재근 기자]코스피가 코로나19의 2차 확산 우려에 하락 마감했다.11일 코스피는 전 거래일 대비 10.42포인트(-0.54%) 내린 1,935.40에 거래를 마쳤다.이날 시장에선 코로나19 공포가 다시금 부각됐다.이경민 대신증권 연구원은 ""코로나19 집단 감염에 대한 우려와 한국의 수출이 10일까지 전년 동기 대비 46% 줄어든 것이 시장의 하방 압력으로 작용했다""고 분석했다.코로나19 우려가 재차 확산되자 외국인(1,746억원 순매도)과 기관(3,639억원 순매도)은 유가증권시장에서 모두 팔자에 나섰다.반면 개인(5,122억원 순매수)은 외국인과 기관이 팔아치운 것으로 추정되는 매물을 대부분 받아냈다.코스피 시가총액 상위 종목에선 언택트 관련주로 주가가 급부상한 NAVER(0.23%)와 카카오(0.73%)가 상승한 가운데 LG생활건강(1.13%), 삼성SDI(0.53%)도 올랐다.삼성전자(-0.82%)와 SK하이닉스(-0.59%), 삼성바이오로직스(-0.34%), LG화학(-1.70%), 현대차(-0.85%), 삼성물산(-2.84%)은 하락 마감했다.코스닥은 소폭 올랐다.코스닥지수는 전장보다 2.74포인트(0.40%) 오른 685.04에 장을 마쳤다.개인이 1,508억원어치를 순매수하며 지수 상승을 주도했고, 외국인(1,046억원 순매도)과 기관(298억원 순매도)은 동반 순매도에 나섰다.이날 코스닥시장에선 한국판 뉴딜 정책 기대감이 일고 있는 소프트웨어 업종이 강세를 나타냈고, 온라인 교육주도 등교 연기 가능성에 강세를 보였다.코스닥 시총 상위 10개 종목에선 제약·바이오 종목이 두각을 나타냈다.셀트리온헬스케어(0.91%)와 에이치엘비(13.25%), 셀트리온제약(1.77%), 씨젠(1.31%), 알테오젠(16.14%)이 상승했다.그러나 CJ ENM(-3.07%)과 케이엠더블유(-2.71%), 스튜디오드래곤(-1.79%), SK머티리얼즈(-1.07%)는 하락 마감했고, 펄어비스는 보합을 기록했다.서울 외환시장에서 원/달러 환율은 전장보다 0.6원 오른 달러당 1,220.5원에 종가가 결정됐다.신재근기자 jkluv@wowtv.co.krⓒ 한국경제TV, 무단 전재 및 재배포 금지",/news/news_read.nhn?article_id=0000869946&office_id=215&mode=search&query=SK하이닉스&page=1
,"외국인 투자자는 11일 거래소에서 삼성SDI, LG생활건강, SK하이닉스 등을 중점적으로 사들인 것으로 나타났다.외국인 투자자의 순매수 상위 20개 종목은 삼성SDI, LG생활건강, SK하이닉스, KODEX 코스닥 150, 한진칼, 카카오, 엔씨소프트, 넷마블, 더존비즈온, 강원랜드등이다.이중에 서비스업 업종에 속한 종목이 7개 포함되어 있다.삼성SDI, LG생활건강, KODEX 코스닥 150 등은 전일 대비 주가가 상승했고, SK하이닉스, 강원랜드, 삼성화재 등은 주가가 하락했다.한경로보뉴스이 기사는 한국경제신문과 금융 AI 전문기업 씽크풀이 공동 개발한 기사 자동생성 알고리즘에 의해 실시간으로 작성된 것입니다.▶ ▶
 ▶
ⓒ 한국경제 & , 무단전재 및 재배포 금지",/news/news_read.nhn?article_id=0004338555&office_id=015&mode=search&query=SK하이닉스&page=1
