head,text,url
삼성·신한BNPP 기존 상품 리모델링e커머스·게임산업·미디어 ETF도 ‘눈길’코로나19 이후 주도 기업 비중 살펴야,"[이데일리 김윤지 기자] 국내 증시가 신종 코로나 바이러스 감염증(코로나19) 팬데믹 이전 수준까지 회복된 가운데 자산운용업계도 발빠르게 ‘포스트 코로나’ 채비에 나섰다. 방향성이 일부 부합하는 기존 펀드를 리모델링하는가 하면, 비대면 관련 종목을 담은 상장지수펀드(ETF)에 관심이 쏠리고 있다. 전문가들은 IT펀드나 헬스케어펀드 처럼 코로나19 이후의 시대를 주도할 기업들의 비중이 높은 펀드에 관심을 가질 필요가 있다고 조언했다. 22일 삼성자산운용에 따르면 ‘삼성언택트코리아’ 펀드를 지난 20일 새롭게 내놨다. 2010년 출시된 ‘삼성대한민국신수종산업’를 리모델링한 상품으로, 당시 삼성이 발표한 LED, 자동차전지, 태양전지, 의료기기, 바이오 등 5대 신수종 사업을 중심으로 투자했다. 4월 운용보고서 기준으로 삼성전자(005930), SK하이닉스(000660) 한국전력(015760) 현대차(005380) 등을 주로 담았다. 이번에는 언택트(비대면) 관련 기업에 주로 투자해 언택트 관련 기업의 미래 성과에 따른 수익 추구를 목적으로 탈바꿈했다. 비대면 라이프 스타일의 수혜인 업종인 온라인쇼핑, 콘텐츠, 핀테크, 간편식, 택배 관련주나 기반이 되는 5G통신망, 클라우드, 자동화, 무인화 관련주를 담겠다는 계획이다. 신한BNP파리바자산운용도 이달 ‘신한BNPP좋은아침코리아펀드’를 ‘신한BNPP코리아신경제펀드’로 리모델링했다. IT, 인터넷 콘텐츠, 제약·바이오 및 전기차, 대체에너지 및 배당주 등 사회 구조 변화에 수혜주에 집중할 예정이다. 신한BNPP 측은 “코로나19 이후의 삶의 변화에 초점을 맞춰 디지털 경제로의 파괴적 혁신에서 투자기회를 발굴할 계획”이라고 설명했다. 마켓포인트에 따르면 NH아문디자산운용의 ‘HANARO e커머스’ ETF는 이달 들어 11.35% 상승했다. 지난달에는 한달새 16.58%가 치솟았다. 온라인쇼핑, 유통, 인터넷 서비스 업종에 투자하는 ETF로 카카오(035720)(26.10%), NAVER(035420)(22.61%)를 주로 담고 있다. 둘 다 최근 비대면 수혜주로 부각되면서 52주 최고가를 연일 경신하고 있다. 김현빈 NH아문디자산운용 ETF전략팀 팀장은 “코로나19로 인해 온라인 쇼핑의 규모 및 비중이 늘고 있고 단기적 온라인 매출 상승 뿐 아니라 장기적으로 소비 패러다임이 바뀌고 있어 장기적으로 투자를 추천한다”고 말했다. 삼성자산운용의 ‘KODEX 게임산업’도 이달 12.80%, ‘KODEX 미디어&엔터테인먼트’도 15.39% 상승했다. 각각 엔씨소프트(036570), NAVER 등 호조세를 보이는 종목들을 담고 있다. 오광영 신영증권 연구원은 “기술적 반등이 마무리 돼가는 현 시점에선 리스크 관리를 하면서 투자 전략을 다시 수립할 시기”라면서 “불안 요소도 상존하고 있기 때문에 사회적, 구조적 변화를 고려해 코로나19 이후 시대를 끌고 갈 기업들을 포함한 포트폴리오의 펀드들을 추천한다”고 말했다.김윤지 (jay3@edaily.co.kr)＜ⓒ종합 경제정보 미디어 이데일리 - 무단전재 & 재배포 금지＞",/news/news_read.nhn?article_id=0004646246&office_id=018&mode=search&query=SK하이닉스&page=4
"불화수소, 국산화-수입처 다변화… 포토레지스트, 美듀폰과 손잡아급한 불 껐지만 앞으로가 더 문제… 日정부 허가 받고 수입 아직 많아국산화에 최소 5년 긴장 못 풀어… 한국 수출 막힌 日기업이 더 고전","“지금까지는 정부와 기업이 나름대로 대처하며 발등에 떨어진 급한 불은 껐는데 앞으로가 더 문제다.” 한국반도체디스플레이기술학회장인 박재근 한양대 융합전자공학부 교수는 21일 통화에서 일본의 수출 규제에 대한 한국의 대응 현황에 대해 이렇게 총평했다. 박 교수는 “일부 소재의 국산화에 성공했지만 아직도 많은 것이 ‘메이드 인 저팬’이다. 신종 코로나바이러스 감염증(코로나19)과 미중 분쟁 등의 대형 변수도 여전히 남아 있다”라고 설명했다. 지난해 7월 한국의 반도체와 디스플레이 산업을 겨냥해 시작된 일본의 수출 규제가 11개월째로 접어들었다. 시행 초기에 삼성전자, SK하이닉스, LG디스플레이 등은 일본 기업으로부터 공급받았던 고순도 불화수소(불산액), 포토레지스트(감광액), 플루오린 폴리이미드의 소재 재고가 줄어들자 ‘이삭줍기’하듯 재고를 모으느라 비상이 걸렸다.
시행 1년을 앞둔 현재 시점에서 산업계의 분위기는 다소 달라졌다. 각 기업이 소재·부품·장비 국산화 사업을 추진했고, 우회 수입 등 공급처 다변화에 나섰기 때문이다. 실제 반도체·디스플레이 공정에 쓰이는 고순도 불화수소는 솔브레인과 램테크놀로지의 제품 사용이 급증했다. 반도체 회로를 그릴 때 쓰이는 포토레지스트는 미국 듀폰이 충남 천안시에 생산 공장을 만들기로 했고, 동진쎄미켐도 품질 고도화에 주력하고 있다. 또 SKC는 일본 의존도가 90% 이상이었던 반도체 공정 소재 블랭크 마스크의 시제품 생산까지 마쳤다. 산업통상자원부에 따르면 소재·부품·장비 80대 품목의 재고량이 지난해 7월 1.3개월 치에서 올해 3월 말 기준 2.6개월 치로 9개월 만에 배로 늘어났다. 일본 내부에서도 이러한 움직임에 위협을 느끼고 있다. 니혼게이자이신문은 20일 “일본 제품을 계속 사용했던 한국 기업의 조달 전략 전환은 일본 소재 업체의 실적에도 그림자를 드리우고 있다”고 진단했다. 한국으로의 안정적인 수출길이 막히면서 일본 기업의 실적이 더 나빠졌다는 것이다. LG디스플레이에 불화수소를 공급했으나 수출 규제 이후 판매량이 줄며 올해 1분기(1∼3월) 영업이익이 전년 동기 대비 32% 줄어든 스텔라케미파 등이 대표적이다.
하지만 산업계는 일본의 수출 규제 조치가 이어지는 현재 상황에 대해 여전히 우려하고 있다. 반도체 시장 사정에 밝은 산업계 관계자는 “세부적으로 보면 수출 규제 품목 중 국산화에 성공한 것은 액체 형태의 불화수소 정도이며 기체 불화수소나 포토레지스트는 수입처를 다변화해 물량을 확보했다. 아직 수출 규제에 따른 위험은 여전히 존재하고 있고 일본 정부는 한국의 숨통을 쥘 카드를 다양하게 쥐고 있기 때문에 ‘극일(克日)’이라는 표현을 벌써부터 꺼내는 것은 말도 안 된다”고 했다.
산업부는 최근 일본 정부에 “수출 규제 문제 해결과 관련해 일본 측의 구체적인 입장을 밝혀 달라”며 31일까지 답변을 요구하기도 했지만 아직 별다른 움직임이 없는 것으로 전해졌다. 박 교수는 “소재·부품·장비 기술 개발과 국산화는 최소 5년을 바라봐야 하는 영역”이라며 “일부 성과가 있다고 해서 안심할 수 없기에 일본 정부와 협상해서 잘 풀어야 한다”고 강조했다.지민구 기자 warum@donga.comⓒ 동아일보 & donga.com, 무단 전재 및 재배포 금지",/news/news_read.nhn?article_id=0003287531&office_id=020&mode=search&query=SK하이닉스&page=4
,"5월 들어 20일까지 한국의 전체 수출이 전년 동기 대비 20% 넘게 감소했다. 코로나 사태로 소비·투자가 부진한 상황에서 마지막 버팀목인 수출마저 급감해 위기감이 커지고 있다. 지난 3~4월 두 달 연속 감소했던 수출은 코로나 여파가 본격화하면서 부진의 늪 속으로 빠져들고 있다.관세청은 ""이달 1~20일 수출액은 203억달러로 작년 같은 기간보다 20.3% 감소했다""고 21일 밝혔다. 주요 품목 중 승용차(-58.6%), 석유제품(-68.6%), 무선통신기기(-11.2%) 등이 코로나의 직격탄을 맞아 수출이 큰 폭으로 줄었다.다만 반도체는 수출이 13.4% 증가했다. 코로나 여파로 화상 회의, 재택근무, 온라인 수업, 원격의료, 동영상 시청 등이 급증하면서 이에 필수적인 메모리 반도체 수요가 늘어난 덕분이다.아마존·마이크로소프트·텐센트·알리바바 등 미국·중국 IT 업체들이 데이터센터 증설에 필요한 메모리 반도체의 대량 구매에 나서며, 지난달엔 D램 고정 거래가가 전월보다 11.9% 올랐다. SK하이닉스 관계자는 ""2분기까지는 메모리 반도체 가격이 견조할 것으로 보인다""고 말했다. 전문가들은 ""코로나 이후 비(非)대면 산업과 그렇지 않은 산업 간 성장 격차가 확대되는 '비대면 디바이드' 트렌드가 확연해질 것""이라고 전망했다. 선박(31.4%) 수출도 증가했는데 이는 과거 수주 물량을 인도한 데 따른 것이다.국가별로는 미국(-27.9%), 유럽연합(-18.4%), 일본(-22.4%) 등 주요 수출국에서 두자릿수 감소를 보였다. 대(對)중국 수출의 경우 코로나 사태를 가장 먼저 겪은 중국 경기가 조금씩 회복세를 보이면서 1.7% 감소하는 데 그쳤다. 하지만 미·중 무역 갈등이 고조되는 가운데 중국의 수출이 줄어들 경우, 중국에 중간재를 수출하는 한국 역시 타격을 받을 수밖에 없다.이달 1~20일 수입은 230억달러로 작년 같은 기간보다 16.9% 감소했지만 수출 감소 폭이 더 커 무역수지는 26억8000만달러 적자를 기록했다. 지난달 무역수지는 수출 급감으로 14억달러 적자를 기록, 2012년 1월 이후 99개월 만에 흑자 행진을 멈췄다.[최현묵 기자 seanch@chosun.com] [성호철 기자] 		▶
		▶ 		▶
	- Copyrights ⓒ 조선일보 & chosun.com, 무단 전재 및 재배포 금지 -",/news/news_read.nhn?article_id=0003533085&office_id=023&mode=search&query=SK하이닉스&page=4
"美中 반도체 전쟁에 반사이익TSMC, 화웨이 주문끊어 호재원유소비 정상화에 정유 개선車공장 가동 재개돼 `기저효과`","경제활동 봉쇄 지역 해제가 본격화하는 가운데 코로나19 치료제·백신에 대한 기대감이 지속되며 글로벌 증시 상승세가 이어지고 있다. 다만 제약·바이오, 플랫폼, 전자결제, 게임 등 언택트(비대면) 관련주 쪽으로 몰리던 수급이 미국 생명공학기업 모더나의 코로나19 백신 임상 1상에 대한 긍정적 소식 이후 낙폭 과대 경기 민감 업종 대표주 등으로 이동하며 당분간 언택트와 콘택트 기업들의 공존이 예상된다. ◆ 반도체미국의 화웨이 추가 제재안 발표로 화웨이 매출 비중이 큰 업체들의 단기 충격이 불가피하게 되면서 중국 반도체 굴기의 한 축인 화웨이의 반도체 개발은 사실상 좌초 위기를 맞게 됐다. 화웨이에서 나오는 매출 비중이 SK하이닉스는 13.7%, 삼성전자는 1.4%다. 단기적으로는 반도체 산업의 불확실성이 확대된 측면이 있지만, 한국 반도체 산업에 있어서는 장기적으로는 오히려 긍정적 효과가 기대된다. ◆ 스마트폰미국 상무부가 발표한 대화웨이 수출 규정 개정에 호응하는 조치로 TSMC가 화웨이에서 신규 주문을 받지 않겠다고 발표했다. 화웨이 스마트폰 생산이 타격을 입을 경우 오포, 비보 등 중국 로컬 업체들의 수혜 강도가 가장 클 것이며, 삼성전자도 일정 부분 반사이익이 예상된다. 파트론과 엠씨넥스, 와이솔, 한솔테크닉스, LG이노텍, 아이티엠반도체, 비에이치 등 삼성 협력업체들이 수혜 기업이 될 수 있다.
 ◆ 화학정유미국을 중심으로 위축됐던 원유 소비가 다시 정상화될 움직임을 보이고 있으며, 국내 정유·화학 업체들을 위협하던 주요국의 증설 스케줄이 지연되거나 취소될 가능성이 높아져 2020년 하반기 정유화학 업황 개선이 예상된다.
◆ 자동차유럽 4월 자동차 판매가 전년 대비 78% 감소했다. 유럽 내 확진자 수가 5월 들어 빠르게 둔화되고 있으며, 지난 4월 말 이후 유럽 내 주요 자동차기업의 공장 가동이 재개되고 있어 하반기 기저효과가 기대된다. ◆ 유통백화점은 방문 고객 수 감소 타격이 1분기를 저점으로 회복 중이다. 대형마트는 생필품 수요 급증에 따라 지난해 대비 이마트의 매출액 부진 폭이 완화됐다. 면세점은 2분기에도 매출 부진은 지속될 전망이지만 인천공항 면세점 임차료 20% 인하에 따라 영업손실 또한 축소될 것으로 보이며 하반기 기저효과가 기대된다.
◆ 제약·바이오코로나19 치료제·백신에 대한 기대감이 지속돼 제약·바이오 기업들에 대한 수급 개선은 당분간 지속될 전망이다. 합병 이슈가 있는 셀트리온 3인방과 실적 개선이 본격화하고 있는 삼성바이오로직스, 2020년 제조 백신의 성장이 기대되는 녹십자 등이 관심을 둘 기업이다.
◆ 철강금속코로나19 타격을 만회하기 위한 중국의 인프라스트럭처 투자는 건설·인프라 의존도가 높은 중국의 철강 수요를 유발한다. 이는 철광 생산을 자극하며 원재료인 철광석 가격 강세를 견인하게 된다. 하지만 선진국의 철강 수요는 글로벌 경기 타격 등으로 원가 전가가 쉽지 않다.
◆ 해운한국 해운사들은 1분기 어닝쇼크에 이어 2분기 어닝쇼크가 대기 중이나 저시황에서 장기계약 또는 스폿운용으로 영업량을 늘려 가고 있는 만큼 부도 리스크가 언급되지 않은 기업들에 대한 관심이 필요해 보인다. ※ 산업별·기업별 실시간 탐방 속보와 상세 자료는 매일경제TV 주식 앱 '주머니'에서 무료 확인 가능합니다. 플레이스토어 검색창에서 '주머니'를 검색하세요.[정영석 매일경제TV 기자] [ⓒ 매일경제 & mk.co.kr, 무단전재 및 재배포 금지]",/news/news_read.nhn?article_id=0004579945&office_id=009&mode=search&query=SK하이닉스&page=4
[현장에서],"학교 다닐 때 그런 친구가 꼭 있었다. 시험 문제가 아무리 어렵게 나와도 점수는 꼬박꼬박 잘 나오는 그런 친구.


코로나 바이러스 감염증(코로나19) 여파 속에서 경제가 어렵다는 뉴스가 쏟아지고, 만나는 기업인마다 “코로나 때문에 정말 힘들다”는 말로 대화가 시작된다. 재계 15대 그룹(자산기준, 농협 제외) 주력 계열사, 7개 산업별 상위 3~4개사의 1분기(1~3월) 실적을 분석하게 된 계기다. 코로나가 대한민국 산업계를 덮친 어려운 시험에서도 점수를 잘 받은 우등생은 여기서도 있지 않을까 하는 궁금증에서다.




 우등생은 진짜로 있었다. 한화솔루션(61.7%)ㆍCJ제일제당(54%)ㆍLG전자(21%)ㆍ현대자동차(4.7%)ㆍ삼성전자(3.4%)의 영업이익은 지난해 1분기와 비교해 늘었다. 특히 LG전자는 1년 전보다 매출(-1.3%)이 줄어든 가운데서도 영업이익을 늘렸다.


산업별 분석에선 반도체와 화학 분야에서 공통점이 눈에 띄었다. 글로벌 경쟁력이 높은 회사가 코로나19라는 외부 충격에 덜 흔들렸다는 것이다.




 반도체 시장(IC인사이츠 기준) 세계 2위 삼성전자는 1분기 영업이익이 증가한 반면, 세계 4위 SK하이닉스는 41.4% 줄었다. 화학 업계(C&EN 기준)에선 세계 10위 LG화학이 2365억원의 영업이익을 냈지만 롯데케미칼(20위)과 SK종합화학(34위)은 적자를 봤다.


오프라인 유통업은 편의점 GS25를 운영하는 GS리테일이 1분기의 주인공이었다. 유통 효율화에 따른 판매관리비 절감이 효과를 거뒀다는 평가를 받고 있다.

 1분기 재미를 본 회사들을 정리해보면 선제적 투자, 상품ㆍ사업 포트폴리오 구축, 글로벌 경쟁력이라는 기본기로 코로나 초기 여파를 견뎌냈다는 점을 확인할 수 있었다. 교과서에 나온 기본 개념을 충실히 익힌 학생이 시험 난이도에 흔들리지 않는 것처럼 말이다.




 이제 걱정은 2분기다. 코로나 확산이 세계적으로 수그러들더라도, 이번 사태에 따른 각국 폐쇄주의가 고개를 들고, 무역량 축소도 본격화 될 거란 관측이 나온다.


이달 1~20일 수출액이 1년 전보다 20.3% 줄었다는 건 이미 신호가 왔다는 증거다. 또 미ㆍ중 갈등이 기술ㆍ산업 분야로 번지는 현 상황도 한국 기업엔 악재다.


전문가들은 ”환경이 어려울수록 소비자와 기업은 검증된 상위 업체의 상품과 서비스를 찾을 것“ “실력 있는 기업은 어떤 여파가 와도 덜 흔들린다는 건 말하지 않아도 아는 사실”이라고 입을 모았다. 1분기 성적이 보여준 대로 꾸준한 효율화, 기술력 향상, 포트폴리오 다양화라는 교과서에 충실하란 얘기다. 일부 기업에선 정부의 공적자금 투입 여론을 만들려는 시도도 느껴지지만, 이는 임시방편일 뿐이란 것 또한 상식이다.


이를 의식한 듯 최근 각 기업 최고경영자(CEO)들이 현장을 뛰고 있다. 이재용 삼성전자 부회장은 중국 시안(西安) 반도체 사업장을 찾았고, 구광모 ㈜LG 대표는 충남 서산 LG화학 사고 현장에 직접 갔다. 신동빈 롯데그룹 회장은 70여일 만에 임원회의(19일)에 직접 참석해 계열사 상황을 점검했다.


 위기 극복 노력의 한 모습이란 게 각 기업 관계자들의 설명이다. 경영 위기 땐 최고 경영진의 리더십이 무엇보다 중요함을 이들은 잘 알고 있을 터다. 위기 때 무조건 덜 쓰고 자르고 축소한다고 사정이 나아지진 않는다. 2분기의 진짜 실력자가 될 한국 기업이 더 많아지길 기대한다.


최선욱 산업1팀 기자
▶ ▶
/ ⓒ중앙일보(https://joongang.co.kr), 무단 전재 및 재배포 금지",/news/news_read.nhn?article_id=0003002749&office_id=025&mode=search&query=SK하이닉스&page=3
,"21일 공개된 삼성전자의 EUV(극자외선) 파운드리(반도체 위탁생산) 라인 구축 계획의 밑바탕엔 시스템 반도체 세계 1위를 겨냥한 삼성의 ‘반도체 비전 2030’ 구상이 있다. 삼성전자가 지난해 4월 내놓은 반도체 비전 2030의 골자는 시스템 반도체 분야에 2030년까지 133조원을 투자해 ‘글로벌 톱’의 자리를 차지하는 것이다.


중국 시안 반도체 공장 방문을 마치고 김포공항을 통해 귀국한 이재용 삼성전자 부회장이 19일 오후 김포공항 인근 대기 장소에서 코로나19 검사를 받기 전 문진표를 작성해 제출하고 있다. 연합뉴스

◆세계 1위 파운드리 업체 TSMC 추격
 반도체 산업은 크게 메모리 반도체와 시스템 반도체(비메모리 반도체), 그외 장비·소재 분야 등으로 나눌 수 있다. 또 반도체를 생산하는 기업이나 공장은 크게 종합반도체(IDM), 팹리스(설계 전담), 파운드리(생산 전담) 등으로 구분한다. 삼성전자나 SK하이닉스는 직접 모든 공정을 담당할 역량을 갖춘 종합반도체업체이지만, 설계 쪽 특화성이 강조되는 시스템 반도체 분야에서는 파운드리에 집중하고 있다. 데이터 저장용인 메모리 반도체 쪽은 삼성전자가 최강이지만, 고도의 연산·처리를 담당하는 시스템 반도체 분야 설계는 인텔 등 미국 업체가 노하우를 갖고 있어서다.
 업계에서는 평택 라인(사진) 구축을 계기로 삼성전자가 세계 1위 파운드리 기업인 대만 TSMC 추격에 가속도를 높일 것이라는 분석이 나온다. 미국 기업들과 손을 잡고 있는 TSMC는 세계 파운드리 시장에서 50%대의 점유율을 차지하고 있다. 반면 삼성전자는 최근 10%대에서 정체된 상황이다. 삼성전자는 경기 화성과 평택에 연이어 EUV 파운드리 생산 라인을 구축하며 1위에 오른다는 구상이다. 삼성전자는 EUV 공정 기술에 자신감을 갖고 있다. EUV 공정은 파운드리 미세공정 한계 극복에 필수적인 기술로, 회로 선폭이 7나노미터(10억분의 1) 이하부터 적용되고 있다. 현재 7나노 이하 초미세 공정 기술을 보유하고 있는 파운드리 기업은 사실상 삼성전자와 TSMC뿐이다.
 삼성전자는 화성 V1 라인 가동으로 올해 말 기준 7나노 이하 제품 생산 규모가 지난해 대비 3배 이상 늘어날 것으로 보고 있다. 내년에 평택 파운드리 생산라인까지 가동되면 이 제품 생산 규모는 더욱더 가파르게 증가할 전망이다.

삼성전자 파운드리는 올해 들어 퀄컴 5G 모뎀칩 생산 계약을 따내는 등 구체적인 성과도 내고 있다. 올해 1분기 시스템 반도체 매출은 4조5000억원으로 역대 최고치를 기록하며 반도체 부문에서의 매출 비중도 처음으로 25%를 넘어섰다. 시스템 반도체뿐 아니라 메모리 제품도 평택 EUV 라인에서 생산될 가능성이 있다. 삼성전자는 차세대 D램부터 EUV 공정을 전면 적용한다고 밝힌 바 있다.
◆이재용 부회장, ‘뉴삼성’으로 광폭 행보 나서
 삼성전자의 이 같은 투자 결단은 이재용 부회장의 과감한 판단이 작용했다. 이 부회장은 이날 평택 파운드리 라인 투자 발표와 관련해 “4차 산업혁명을 선도하고 미래 반도체 수요에 대비하기 위해선 ‘기술 초격차’가 반드시 유지돼야 한다”며 “반도체 1등 기업이라는 자부심으로 실패를 두려워하지 말고 도전해달라”고 강조했다.
 그는 지난 6일 대국민 사과 기자회견 당시 과감한 신사업 도전을 바탕으로 한 뉴삼성을 선언한 이후 이를 실천하기 위한 공격적인 행보를 이어가고 있다. 기자회견 일주일 만인 지난 13일 현대차그룹 정의선 수석부회장을 만나 차세대 전기차 배터리 협업을 논의했으며, 코로나19가 완전히 진정되지 않은 상황임에도 지난 17일부터 2박3일간 중국 시안의 삼성반도체 공장을 찾았다.

삼성전자의 반도체 투자는 문재인정부의 ‘한국판 뉴딜’ 정책과도 맞닿아 있다. 문재인 대통령은 지난 10일 취임 3주년 특별연설에서 ‘한국판 뉴딜’ 정책의 일환으로 시스템 반도체, 바이오헬스, 미래차를 신성장 산업으로 육성하겠다고 밝혔다. 이에 앞서 이 부회장은 지난해 4월 문 대통령이 참석한 반도체 비전 2030 발표식에서 “파운드리를 포함한 시스템 반도체 분야에서도 확실히 1등을 하도록 하겠다”고 다짐한 바 있다.
 재계에서는 이 부회장의 과감한 경영 행보가 여기서 끝나지 않을 것이란 관측이 지배적이다. 일각에서는 추가적인 투자 발표나 반도체 부문 인수·합병(M&A) 등의 깜짝 발표가 이어질 것이란 전망도 나온다. 미·중 무역분쟁 심화 와중에 경쟁사인 대만 TSMC가 최근 미국 반도체 공장 건설 계획을 밝힌 만큼 삼성전자도 보폭을 더 넓힐 가능성이 있다는 이유에서다. 삼성전자는 현재 미국 텍사스주 오스틴에 파운드리 공장을 가동하고 있다. 그렇기에 우선 여기에 추가로 라인을 투자하는 방안도 거론된다.
 박세준 기자 3jun@segye.comⓒ 세상을 보는 눈,",/news/news_read.nhn?article_id=0003467596&office_id=022&mode=search&query=SK하이닉스&page=3
