head,text,url
"中, 국가보안법 제정에 미중 갈등 부각","(서울=뉴스1) 정은지 기자 = 2000선을 돌파하며 출발했던 코스피 지수가 미중 갈등 고조에 1% 넘게 하락하며 1960선까지 밀렸다. 21일 오후 1시 55분 기준 코스피 지수는 전일 대비 31.80p(1.59%) 하락한 1966.51에 거래되고 있다. 코스피 지수는 이틀 연속 2000선을 돌파하며 출발했으나 개장 이후 하락폭을 확대했다. 중국 전인대가 홍콩 의회를 대신해 국가보안법을 제정하기로 함에 따라 미중 관계가 악화될 것이라는 우려가 커진 영향으로 풀이된다.개인은 6593억원을 순매수하고 있는 반면 외국인과 기관은 각각 4067억원과 2376억원을 순매도 중이다. 시가총액 상위 종목 대부분 약세로 돌아섰다. 현대차(-2.67%), SK하이닉스(-2.40%), 삼성전자(-2.30%), 삼성전자우(-1.96%), 셀트리온(-1.83%) 순으로 하락폭이 크다. 반면 언택트(비대면) 수혜주인 카카오(2.95%), 네이버(1.78%)은 52주 신고가를 갈아치웠다. 특히 카카오는 현대차를 제치고 시가총액 10위에 올라섰다. 코스닥 지수는 11.02p(1.54%) 하락한 705.00을 가리키고 있다. 시총 상위 종목 중 케이엠더블유(-4.06%), CJENM(-3.82%), 스튜디오드래곤(-2.07%), 에이치엘비(-1.85%), 셀트리온헬스케어(-152%) 등 대부분 종목이 약세를 나타내고 있다.ejjung@news1.kr© 뉴스1코리아(), 무단 전재 및 재배포 금지",/news/news_read.nhn?article_id=0004652908&office_id=421&mode=search&query=SK하이닉스&page=2
,"한국광고주협회가 주최하고 문화체육관광부가 후원하는‘제28회 국민이 선택한 좋은 광고상’에서 동화약품의 활명수(사진) 광고가 TV 부문 대상을 수상했다.한국광고주협회(회장 이정치 일동제약 대표이사 회장)는 22일 광고상 수상작 34편을 선정, 발표했다. 국민이 선택한 좋은 광고상은 지난해 집행된 광고 중 국민의 온라인 추천 광고와 광고회사에서 출품한 작품 중에서 수상작을 뽑는다. TV부문 대상은 동화약품의‘활명수 오늘도 잘 소화하세요 캠페인’이 차지했다. 광고주협회는 “한국인에게 가장 중요한 음식이자 그 이상의 특별한 의미를 가지고 있는 ‘밥’을 통해 서로를 항상 아끼고 응원하는 모녀지간의 정겹고 따듯한 마음을 전해 대중의 높은 공감을 얻었다”고 선정 사유를 밝혔다. 온라인부문 대상은 GS칼텍스의‘GS칼텍스 마음이음 동화’가 이름을 올렸다. 고전동화 속에서 부정적인 계부모에 대한 편견을 해소하기 위해 실제 현실을 토대로 한 대안 동화를 통해 작은 인식의 변화가 세상을 바꾼다는 캠페인으로 큰 지지를 받았다. 문화체육관광부장관상 TV 부문은 SK하이닉스 의‘지역상생 캠페인’, 문화체육관광부장관상 온라인부문은 현대자동차그룹의 ‘세상에서 가장 조용한 택시’가 각각 수상했다. 여정성 심사위원장은 “올해 수상작들은 편견과 갈등의 사회분위기 속에서 서로를 배려하고 이해하려는 인식의 변화를 꾀해 건강한 미래를 향한 응원과 공감의 메시지를 전한 광고가 많은 사랑을 받았다”고 말했다.김온유 기자 kimonu@munhwa.com[Copyrightⓒmunhwa.com '대한민국 오후를 여는 유일석간 문화일보' 무단 전재 및 재배포 금지()]",/news/news_read.nhn?article_id=0002428936&office_id=021&mode=search&query=SK하이닉스&page=2
"장중 코스피 시가총액 9위, 현대차 위로 올라서코로나19로 산업 패러다임 변화","국내 증시에서 카카오의 시가총액이 현대차를 넘어섰다. 신종 코로나바이러스 감염증(코로나19) 사태에 따른 산업 지형의 변화가 반영됐다는 관측이다. 미중 무역분쟁과 코로나19는 탈(脫) 세계화와 비즈니스의 디지털화를 가속화시킬 것이란 전망이다.22일 장중 정보기술(IT) 기업인 카카오의 시총이 국내 대표 제조업 기업인 현대차를 넘어섰다. 이날 오후 2시3분 기준 카카오의 시총은 21조2885억원으로 코스피 9위(우선주 제외)다. 현대차는 20조2344억원으로 10위로 내려갔다. 코로나19 사태로 비대면(언택트) 생활 방식이 빠르게 퍼진 것이 주식 시장에서 카카오와 현대차의 자리를 바꿔놨다. 세계 각국의 '사회적 거리두기' 등 봉쇄 조치로 자동차를 이용한 이동 등 활동이 제한됐다.
코로나19가 확산한 시점을 기준으로 보면 변화가 두드러진다. 올해 첫 거래일인 1월2일 기준 시총 1위는 삼성전자다. 이어 SK하이닉스 NAVER 삼성바이오로직스 현대차 현대모비스 셀트리온 LG화학 POSCO 삼성물산 신한지주 LG생활건강 KB금융 SK텔레콤 한국전력 SK 기아차 삼성SDI 삼성에스디에스 순이다.하지만 이날 기준 시총 상위주 순위는 과거와는 다르다. 삼성바이오로직스가 3위로 올라왔고, 현대차 삼성물산 현대모비스 POSCO 등 전통적인 제조업 기업들은 10위권 밖으로 밀려났다. 코로나19의 수혜를 입은 바이오와 IT 등의 종목이 시총 상위권으로 몰려들고 있다.최유준 신한금융투자 연구원은 ""시총 상위 종목은 한국 산업의 지형을 한 눈에 보여준다""며 ""상위 10개 종목은 코스피 전체 시총의 30~50%를 차지하고 산업 패러다임 변화에 따라 순위가 바뀐다""고 말했다.과거 사례를 감안하면 새로운 종목이 시총 10위권에 들면 대체로 2년 이상 지위를 유지했다. 올해 승기를 잡은 종목이 '포스트 코로나' 시대의 주도주가 될 가능성이 높다는 판단이다. 카카오는 2006년 아이위랩이라는 이름으로 설립됐다. 국민 메신저 '카카오톡'의 흥행과 함께 본격 성장해, 1967년 창립 이후 글로벌 기업이 된 현대차 수준의 기업가치를 시장에서 인정받은 것이다. 현대차와 카카오를 바라보는 증권가(街)의 시선도 엇갈렸다. 금융정보 제공업체 에프앤가이드에 따르면 카카오의 올해 추정 매출은 3조8071억원으로 전년 대비 24.01% 늘어날 전망이다. 영업이익과 순이익도 각각 4158억원, 3177억원으로 10.08%, 흑자전환할 것으로 예상된다.성종화 이베스트투자증권 연구원은 ""코로나19가 초발한 언택트 시대의 가속화로 페이, 뱅크, 페이지 커머스 등 카카오의 언택트 비즈니스들이 모두 우호적 사업환경을 맞았다""며 ""고성장 에너지는 앞으로도 지속돼 손익이 더욱 가파르게 개선될 것""이라고 예상했다. 반면 현대차는 올해 매출 영업이익 순이익은 모두 급락할 전망이다. 올해 추정 매출은 전년 대비 3.05% 감소한 102조5177억원을 기록할 것으로 보인다. 영업이익과 순이익은 각각 6.65%. 11.64% 줄어든 3조3656억원, 2조8146억원으로 추산됐다. 이재일 유진투자증권 연구원은 ""코로나19 확산으로 공장 가동 중단과 수요가 줄어들면서 당장 2분기 실적이 부진할 것으로 예상된다""며 ""올해 연간 실적 역시 글로벌 수요 감소 영향으로 인한 악영향을 피하긴 어려울 것""이라고 했다이송렬 한경닷컴 기자 yisr0203@hankyung.com▶ ▶
 ▶
ⓒ 한국경제 & , 무단전재 및 재배포 금지",/news/news_read.nhn?article_id=0004345769&office_id=015&mode=search&query=SK하이닉스&page=2
,"[머니투데이 강민수 기자] 코스피 지수가 외인과 기관의 동반 매도에 1960선까지 후퇴했다. 미중 갈등 긴장감이 고조된데다 중국 최대 정치행사인 양회(전국인민대표대회와 전국인민정치협상회의)에서 나올 정책 기대감이 한풀 꺾인 영향으로 풀이된다. 22일 오후 2시 27분 현재 코스피 지수는 전일대비 34.98포인트(1.75%) 내린 1963.33을 나타내고 있다.이 시각 현재 개인이 홀로 7571억원 어치를 순매수하고 있다. 외국인과 기관은 각각 4485억원, 2938억원 매도 우위다.업종별로는 운수창고(0.24%), 서비스업(0.17%)을 제외한 모든 업종이 파란 불을 켰다. 특히 운송장비, 전기·전자, 기계, 금융업, 은행 등이 2%대 약세다. 증권은 3.44% 하락하며 가장 낙폭이 크다.시가총액 상위주도 삼성바이오로직스(1.31%), NAVER(2.00%), 카카오(2.95%)를 제외한 모두 내림세다. 특히 삼성전자와 SK하이닉스, 현대차, 현대모비스 등이 2% 넘게 떨어지고 있다. 코스닥 지수도 전일대비 9.18포인트(1.28%) 하락한 706.84를 나타내고 있다.코스닥시장에서도 개인이 2829억원을 사들이고 있고, 외국인과 기관은 각각 1517억원, 1214억원을 순매도 중이다. 코스닥 업종들은 기타제조(4.38%), 제약(0.01%)를 제외한 모든 업종이 약세다. 특히 방송서비스, 통신장비, 컴퓨터서비스, 종이·목재 등이 2~3%대 낙폭을 보인다. 코스닥 시총 상위종목들도 대부분 약세인 가운데 씨젠, 알테오젠, 에코프로비엠 등이 1~2%대 강세를 보인다. 대장주인 셀트리온헬스케어는 1% 안팎 하락 중이다. CJ ENM, 케이엠더블유도 3~4%대 약세다. 강민수 기자 fullwater7@mt.co.kr
<저작권자 ⓒ '돈이 보이는 리얼타임 뉴스' 머니투데이, 무단전재 및 재배포 금지>",/news/news_read.nhn?article_id=0004413171&office_id=008&mode=search&query=SK하이닉스&page=2
IC인사이츠 보고서···2024년 자급률도 20.7% 그칠 전망,"[서울경제] 오는 2025년까지 반도체 자급률을 70%로 끌어올리겠다는 중국의 ‘반도체 굴기’가 실현되기는 어려울 것이란 분석이 나왔다. 미국 정부가 화웨이에 대한 제재를 강화하고 있는 상황에서 중국은 반도체 자급률을 높이는 게 절실하지만 현실적으로 불가능하다는 지적이다. 22일 시장조사업체 IC인사이츠의 보고서에 따르면 중국의 반도체 자급률은 지난해 15.7%로 2014년보다 0.6%포인트 오르는 데 그쳤다. 중국 반도체 자급률은 중국 반도체 시장에서 중국 지역 생산량이 차지하는 비중이다. 보고서는 특히 오는 2024년에도 중국의 반도체 자급률은 20.7%에 불과할 것으로 전망했다. 중국이 ‘제조 2025’ 프로젝트에서 목표로 한 반도체 자급률 70%와 비교하면 3분의 1에도 미치지 못한다. 삼성전자·SK하이닉스 등 외국 기업이 중국에서 생산한 물량을 제외하고 순수하게 중국 기업의 생산량만 보면 지난해 중국의 반도체 자급률은 6.1%에 불과하다. 2024년에도 중국 내 반도체 생산량의 절반을 외국 기업이 차지할 것으로 전망됐다.IC인사이츠는 “앞으로 5년간 중국이 반도체 자급 수준을 극적으로 끌어올리는 것은 거의 불가능하다”며 “향후 10년 동안 어려울 수도 있다”고 내다봤다. 보고서에 따르면 최근 연내 17나노 D램을 양산할 것으로 알려진 중국 창신메모리(CXMT)는 연간 시설투자가 15억달러 수준으로 삼성전자, SK하이닉스, 마이크론의 합계 투자액(397억달러)의 3.8% 수준에 불과하다.또 중국의 비메모리 반도체 기술은 선두 기업과 비교할 때 수십년가량 뒤처져 있다고 보고서는 지적했다./이재용기자 jylee@sedaily.com저작권자 ⓒ 서울경제, 무단 전재 및 재배포 금지",/news/news_read.nhn?article_id=0003741441&office_id=011&mode=search&query=SK하이닉스&page=2
"[목표주가 앞지른 NAVER·카카오]코로나 이후 언택트 수혜주 떠올라이달 상승률 각각 16%·34% 달해現 주가, 상당수 증권사 눈높이 추월""미래 성장성 주목""...고평가 논란도","[서울경제] 와 카카오의 주가가 연일 급등하면서 증권사 목표주가를 잇따라 추월하고 있다. 특히 이달 들어 상승세가 가파른 카카오는 시가총액이 현대차를 앞질렀으며 두 종목의 시총을 합치면 국내 2위인 SK하이닉스보다 많아졌다. 인터넷 쌍두마차의 급등세에 대해 고평가 지적도 나오지만 성장성에 무게를 둘 경우 과하지 않다는 목소리도 만만치 않다.
22일 유가증권시장에서 카카오는 전날보다 4.00%(5,500원) 오른 24만7,000원을 기록했고 NAVER도 2.44%(5,500원) 상승한 23만500원으로 장을 마감했다. 이날 코스피지수가 미중 무역분쟁 격화와 전날까지 급등세로 1.04% 하락하며 1,970.13까지 밀렸지만 인터넷주는 보란 듯이 급등세를 이어갔다. 카카오는 이날 시총이 21조5,062억원을 기록하며 현대차(20조1,916억원)마저 넘어서면서 ‘시총 톱10’에 진입했다. NAVER 역시 시총이 37조6,984억원까지 불어나며
52주 최고가 행진을 이어갔다. 이날 두 회사의 시총을 합칠 경우 59조3,689억원으로 SK하이닉스(59조1,138억원)보다 2,500억원가량 많아졌다.
NAVER와 카카오의 질주는 증권사들의 목표주가도 뛰어넘을 정도로 속도가 빠른 상황이다. 이베스트투자증권은 전일 카카오 목표주가를 26만원에서 30만원으로 상향했다. 이베스트투자증권은 지난달 21만원으로 책정했던 카카오의 목표주가를 이달 8일 26만원으로 올렸으며 2주 만에 다시 15%가량 상향 조정했다. 메리츠증권은 같은 기간 22만2,000원에서 24만원을 거쳐 최근 27만원까지 목표주가를 끌어올렸으며 하나금융투자도 24만원에서 28만원으로 눈높이를 높였다. 현재까지 제시된 대부분의 증권사 목표주가는 지난 7일 카카오의 1·4분기 실적 발표 이튿날 기준치다. 당시 카카오의 주가는 20만6,000원으로 15% 정도의 차이가 있었다. 하지만 이후 카카오 주가가 연일 상승하면서 상황이 역전됐다. 대부분 증권사의 목표주가가 현재 23만5,000~25만원 선인 것을 고려하면 주가가 이미 상당수 증권사의 눈높이를 넘어섰다. 인터넷 ‘대장주’인 NAVER도 이날 급등세를 타면서 상당수 증권사의 목표주가를 이미 넘어선 상황이다. 카카오의 경우 지난달 22% 오른 뒤 이달 들어서도 34.2%나 상승했다. NAVER도 같은 기간 21%, 16% 수직 상승했다.
 가파른 주가 상승은 이들 종목이 언택트 수혜주로 1·4분기에 ‘어닝 서프라이즈’를 기록한데다 새로 진행하는 사업의 잠재력까지 인정받고 있기 때문이다. 안재민 NH투자증권 연구원은 “신종 코로나바이러스 감염증(코로나19) 사태를 계기로 비대면 접촉이 늘면서 카카오톡 사용량이 증가하고 커머스·광고·콘텐츠 영역에서도 큰 폭의 성장을 보였다”며 “비대면 활성화로 카카오페이와 카카오뱅크의 경쟁력이 더욱 견고해지며 의미 있는 성장이 나타날 것으로 기대한다”고 진단했다. 일부 증권사들의 경우 최근 2~3차례 목표주가를 상향했지만 가파른 주가 상승에 부담을 느끼는 모습이다. 목표주가는 결국 기업의 가치를 새롭게 산정하는 과정인데 현재 주가에 맞춰 올리는 것은 맞지 않기 때문이다. 한 증권사 관계자는 “단순히 현재 주가가 올랐다고 해서 목표주가를 다시 상향하지는 않는다”며 “현재 주가가 목표주가를 넘어서 있는 모습을 보는 것도 부담”이라고 말했다.따라서 언택트 관련주들이 고평가됐다는 목소리도 나온다. 증권가에서는 카카오의 경우 12개월 선행 주가수익비율(PER)이 56배가 넘는 것으로 추정하고 있으며 NAVER 역시 37배에 달하는 것으로 추산하고 있다. 하지만 주가가 미래 가치를 반영하고 있는 것인 만큼 문제 될 것이 없다는 주장도 강하다. 한 증권사 연구원은 “기업들의 이익이 감소하는 구간에서도 주가가 오르는 것은 투자자들이 결국 미래 가치를 높게 평가한다는 것”이라며 “기대보다 못한 결과를 받게 되면 자연스럽게 주가는 하락하게 될 것”이라고 말했다. /박성호기자 junpark@sedaily.com저작권자 ⓒ 서울경제, 무단 전재 및 재배포 금지",/news/news_read.nhn?article_id=0003741443&office_id=011&mode=search&query=SK하이닉스&page=2
"외국인·기관, '쌍끌이' 매도...개인, 9000억원 이상 '사자'삼성전자·SK하이닉스·셀트리온·LG화학 등 시총상위株↓","[이데일리 오희나 기자] 코스피 지수가 1970선에 턱걸이 하면서 하락 마감했다. 미국과 중국의 갈등 고조 우려에 외국인과 기관의 ‘쌍끌이’매도가 이어지고 시가총액 상위종목 대부분이 내리면서 지수의 발목을 잡았다.

22일 마켓포인트에 따르면 코스피 지수는 전 거래일 대비 28.22포인트(-1.41%) 내린 1970.09로 마감했다. 이날 코스피는 2001.60으로 상승 출발하면서 장초반 기대감을 높였다. 하지만 외국인과 기관의 차익실현 매물이 출회되면서 이내 약세로 전환, 낙폭을 확대하면서 6거래일만에 하락세로 마감했다.
 뉴욕증시에서 주요지수는 미국과 중국의 갈등 고조에 투자심리가 위축되면서 하락 마감했다. 중국이 홍콩 의회 대신 ‘홍콩 국가보안법’을 직접 제정할 것이란 방침을 밝힌 점도 긴장을 고조시켰다. 21일(현지시간) 뉴욕증권거래소에서 다우존스 30 산업평균지수는 전장보다 101.78포인트(0.41%) 하락한 2만4474.12에, 스탠더드앤드푸어스(S&P) 500 지수는 전장보다 23.1포인트(0.78%) 내린 2948.51에, 기술주 중심의 나스닥 지수는 90.90포인트(0.97%) 하락한 9284.88에 장을 마감했다.수급별로는 외국인과 기관이 각각 4677억원, 4547억원 순매도를 기록했다. 개인은 9377억원 순매수를 보였다. 프로그램은 차익이 555억원 순매도, 비차익이 3008억원 순매도를 보이면서 3563억원 매도우위를 나타냈다. 대부분의 업종이 내린 가운데 증권업종이 3%이상 하락했고 기계, 은행, 철강및금속, 운수장비, 전기전자 업종이 2% 이상 내렸다. 금융업, 화학, 종이목재, 통신, 제조업, 유통업 등도 하락했다. 서비스업, 운수창고, 비금속광물, 음식료품, 의약품 업종은 올랐다. 시가총액 상위 종목 대부분이 내린 가운데 삼성전자(005930) SK하이닉스(000660) 셀트리온(068270) LG화학(051910) LG생활건강(051900) 현대차(005380) 삼성물산(028260) 현대모비스(012330) 엔씨소프트(036570) SK텔레콤(017670) POSCO(005490) 한국전력(015760) 삼성에스디에스(018260) 등은 하락 마감했다. 반면 삼성바이오로직스(207940) NAVER(035420) 삼성SDI(006400) 카카오(035720) 등은 상승세를 보였다. 특히 삼성바이오는 이날 다국적제약사 GSK와 바이오의약품 위탁생산(CMO) 파트너십을 체결했다는 소식에 강세를 보였다. 전체 계약 규모는 8년 동안 2억3100만 달러 이상이다.카카오는 언택트 산업 성장 기대감에 연일 신고가를 기록하면서 현대차를 제치고 시가총액 10위권에 안착했다. 이날 거래량은 8억3239만주, 거래대금은 9조3269억원으로 집계됐다. 상한가 2개 종목을 포함해 155개 종목이 상승했다. 하한가 종목 없이 719개 종목이 하락했다. 29개 종목은 보합권에서 거래를 마쳤다.오희나 (hnoh@edaily.co.kr)＜ⓒ종합 경제정보 미디어 이데일리 - 무단전재 & 재배포 금지＞",/news/news_read.nhn?article_id=0004646758&office_id=018&mode=search&query=SK하이닉스&page=2
"코스피, 28.18p 하락 1970.13 마감코스닥 7.44p↓ 708.58…환율 6.1원↑ 1237.0원","(서울=뉴스1) 정은지 기자 = 2000선을 돌파하며 출발했던 코스피 지수가 미중 갈등 고조에 1% 넘게 하락하며 1970선에 턱걸이했다. 22일 코스피 지수는 전일 대비 28.18p(1.41%) 하락한 1970.13에 거래를 마치며 6거래일 만에 하락했다. 코스피 지수는 이틀 연속 2000선을 돌파하며 출발했으나 이후 하락폭을 확대했다.

중국 전인대가 홍콩 의회를 대신해 국가보안법을 제정하기로 함에 따라 미중 관계가 악화될 것이라는 우려가 커진 영향으로 풀이된다.이날 개인은 9377억원을 순매수한 반면 외국인과 기관은 각각 4677억원과 4647억원을 팔아치웠다. 시가총액 상위 종목 대부분 하락했다. 현대차(-2.78%), SK하이닉스(-2.52%), 삼성전자(-2.40%), 삼성전자우(-2.19%), 셀트리온(-1.14%) 순으로 하락폭이 크다. 반면 언택트(비대면) 수혜주인 카카오(4.00%), 네이버(2.44%)는 52주 신고가를 갈아치웠다. 특히 카카오는 현대차를 제치고 시가총액 10위에 올라섰다. 코스닥 지수는 7.44p(1.04%) 떨어진 708.58로 마감했다.시총 상위 종목 가운데 CJENM(-4.14%), 케이엠더블유(-3.73%), 스튜디오드래곤(-1.94%), 셀트리온헬스케어(-1.30%) 등은 내렸다. 반면 알테오젠(4.18%), 에코프로비엠(2.56%), 씨젠(2.43%) 등은 상승했다.노동길 NH투자증권 연구원은 ""중국은 이날 열린 전인대에서 미국 압박에 굴하지 않고 보복 조치로 대응하겠다는 의사를 밝혔고, 홍콩에 대해서는 국가보안법 발의로 지배권을 강화하려는 의도를 나타냈다""며 ""홍콩 자치권 및 인권 분야는 향후 미중 마찰에 핵심이 될 전망이며, 미중 마찰은 위험자산 투자심리에 부정적""이라고 말했다. 한편 서울외환시장에서 달러/원 환율은 6.1원 오른 1237.0원으로 거래를 마쳤다.ejjung@news1.kr© 뉴스1코리아(), 무단 전재 및 재배포 금지",/news/news_read.nhn?article_id=0004653183&office_id=421&mode=search&query=SK하이닉스&page=2
,"코스피가 1% 넘게 하락하며 2000선 문턱을 넘지 못했다.22일 코스피는 전 거래일보다 28.18포인트(1.41%) 내린 1970.13으로 거래를 마쳤다. 지수는 전장보다 3.29포인트(0.16%) 오른 2001.60으로 개장했으나 약세전환했다. 전일 지수는 코로나19 확산 둔화 및 글로벌 경제 회복 기대감에 장 초반 개인 중심의 매수세에 힘입어 2000선을 돌파하기도 했다. 지수가 장중 2000선 위에서 거래된 것은 지난 3월 6일 이후 약 두달 보름만이다. 그러나 미국과 중국 갈등 재부각 등 글로벌 경제 상황 악화에 약세 전환했다. 외국인과 기관은 물량을 대거 쏟아내면서 시장 불안감을 조성했다.서상영 키움증권 연구원은 ""그동안 증시 상승을 이끌던 관련 종목들의 차익 욕구 또한 높아질 것""이라며 ""여기에 중국 전인대 개막식에서 리커창 총리는 업무보고를 통해 올해 경제 성장 목표 등 주요 경제 운용 방향을 제시하는데 이 결과 미국과 중국의 마찰 재부각이나 홍콩 시위 확산 우려도 부담""이라고 진단했다.또 이날 열린 중국 베이징(北京) 인민대회당에서 열린 13기 전국인민대표대회(전인대) 3차 연례회의에서 중국 정부는 신종 코로나바이러스 감염증(코로나19) 여파로 올해 경제성장률 전망치를 제시하지 않는 등 녹록지 않은 경제 상황을 시사하기도 했다. 올해 1분기 경제성장률이 -6.8%로 근 반세기 만에 처음 마이너스 경제성장률을 경험하는 등 상황이 매우 좋지 않기 때문이다이날 유가증권시장에서는 업종별로 증권이 3% 넘게 빠졌고, 기계, 은행, 철강·금속, 운송장비, 전기·전자 등이 떨어졌다. 매매주체별로 개인이 9392억원 순매수했으나 외국인과 기관이 각각 4696억원, 4560억원 순매도했다. 프로그램 매매는 3562억원 매도 우위를 나타냈다.시가총액 상위 종목들 가운데 삼성바이오로직스, NAVER, 카카오, 삼성SDI 등만 오르고 삼성전자, SK하이닉스, 셀트리온, LG화학, LG생활건강 등은 약세 흐름을 보였다.이날 유가증권시장에서는 287개 종목이 올랐고 981개 종목이 하락했다.코스닥은 전일 대비 7.44포인트(1.04%) 오른 708.58에 마감했다.[김규리 기자 wizkim61@mkinternet.com] [ⓒ 매일경제 & mk.co.kr, 무단전재 및 재배포 금지]",/news/news_read.nhn?article_id=0004580405&office_id=009&mode=search&query=SK하이닉스&page=2
