head,text,url
일본 저가수출·보조금지급 제한D램값 상승 삼성전자 적자 탈출,"미국이 반도체 패권에 도전하는 국가를 주저앉힌 건 중국이 처음은 아니다. 이미 1980년대 로널드 레이건 행정부(1981~89년)는 1985년부터 일본 정부를 압박해 이듬해 8월 ‘미·일 반도체 협정’을 체결했다. 일본 기업의 D램 저가 수출을 중단하고, 일본 내 미국산 반도체 점유율을 5년 안에 기존 11%에서 20%대까지 끌어올려야 한다는 게 골자였다.



레이건 행정부의 압박으로 일본의 반도체 산업이 주춤한 사이 한국의 반도체는 약진했다. 일본이 미국과의 협정으로 1970년대 후반부터 자국 기업에 지급하던 2억 달러의 보조금을 끊자 30센트 선까지 떨어졌던 64KD램 값(원가 1달러30센트)이 반등했다. 당시 반도체 공급 과잉으로 누적 적자가 2000억원에 달했던 삼성전자는 D램값이 반등하면서 적자에서 탈출했다. 미·일 반도체 협정 체결 7년 뒤인 93년, 삼성전자는 D램 부문 세계 1위에 등극했다.


하지만 시스템 반도체(비메모리)나 장비 분야에선 미국이 최강자다. PC용 CPU에선 인텔·AMD가, 스마트폰용 AP 같은 비메모리 시장에선 퀄컴이 우세하다. 장비 시장에서는 램리서치나 어플라이드머티어리얼즈(AMAT) 등이 독점적 지위를 갖고 있다. 삼성전자의 3차원(3D) 낸드플래시 메모리도 램리서치의 미세공정 장비 없이는 양산이 불가능한 게 현실이다.


일본 역시 2012년 D램을 생산하던 엘피다(NEC·히타치 합작회사)가 파산하는 등 부침을 겪었지만 소재나 장비 시장에서의 영향력은 견고하다. 일본 소재 업체 JSR은 벨기에 연구기관인 IMEC와 공동으로 현지에서 극자외선(EUV)용 포토레지스트(감광액) 생산 합작법인을 운영 중이다. 한국과 일본 정부가 지난해 하반기 수출 규제로 충돌했을 때도 삼성전자는 JSR의 벨기에 합작법인에서 포토레지스트를 수입해 사용했다.


미·중 간 충돌이 격화하면서 삼성전자나 SK하이닉스는 중국의 IT기업 성장세가 둔화해 D램 수요가 침체할 가능성을 우려하고 있다. 삼성전자의 올 1분기 사업보고서에 따르면 삼성전자의 5대 매출처에서 화웨이가 2018년 2분기 이후 처음으로 빠졌다. 화웨이 매출이 줄면서 삼성전자의 중국 매출 비중도 30%대에서 24.5%로 떨어졌다. 삼성전자는 화웨이를 상대로 한 해 약 8조원어치의 메모리 반도체를 수출했던 것으로 알려져 있다. SK하이닉스의 경우 지난해 매출(26조9900억원) 중 절반에 가까운 12조5700억원(약 47%)이 중국에서 발생했다.


김영민 기자 bradkim@joongang.co.kr
▶ ▶ ▶ ⓒ중앙일보(https://joongang.co.kr), 무단 전재 및 재배포 금지",/news/news_read.nhn?article_id=0003003910&office_id=025&mode=search&query=SK하이닉스&page=3
"전문가 3인이 본 반도체 패권경쟁이종호 서울대 반도체공동연구소장한국처럼 ‘소부장’ 설움 느낀 중국기술력 오를 때까진 수모 참을 것조철 산업연구원 선임연구위원반도체는 안보·G2헤게모니와 직결미국, 화웨이 공격해 중국 약점 때려안기현 한국반도체산업협회 상무중국이 반도체 자립화 속도 내면삼성·하이닉스 인력유출 더 위험","미국은 왜 중국 ‘반도체 굴기’의 싹을 자르려는 것일까. 중국이 미국의 공세와 압력에도 반도체 굴기를 밀어붙이는 이유가 뭘까. 미·중 반도체 패권 경쟁의 소용돌이 속에서 한국 정부와 기업은 어떻게 대응해야 할까. 26일 국내 반도체 전문가 3명에게 물었다.























김태윤 기자 pin21@joongang.co.kr
▶ ▶ ▶ ⓒ중앙일보(https://joongang.co.kr), 무단 전재 및 재배포 금지",/news/news_read.nhn?article_id=0003003909&office_id=025&mode=search&query=SK하이닉스&page=3
"화웨이 비메모리 톱5 진입하자미국, 퀄컴·애플 따라잡힐까 우려TSMC 압박하고 화웨이 추가제재한국, 규제 풀어 비메모리 키워야트럼프, 중국 화웨이 압박에 이어한국에 뺏긴 메모리도 노릴 가능성시진핑은 ‘반도체 굴기’ 투자 독려","반도체를 둘러싸고 미국과 중국이 다시 정면충돌하고 있다. 반도체 기술을 지키려는 미국과 이에 도전하는 중국 모두 한 치도 물러설 기색이 없다. 미래 패권 확보를 위한 ‘반도체 신(新)냉전’ 시대다. 미·중 간 반도체 패권 전쟁이 격화할수록 틈바구니에 끼인 한국 반도체 산업의 위기감은 커져 가고 있다.


26일 홍콩 사우스차이나모닝포스트는 시진핑(習近平) 중국 국가주석이 “앞으로 완전한 내수 시스템 구축을 가속화하고 과학기술 및 다른 방면의 혁신을 대대적으로 추진해야 한다”고 주문했다고 보도했다. 중국공산당 전국인민정치협상회의(정협·政協) 전국위원회의 경제계 위원 연석회의에서다. 미국의 각종 거래 제한을 정면돌파하겠다는 뉘앙스다.


앞서 미국은 22일 중국 기업 33곳을 블랙리스트에 올리고 미국 기업과의 거래를 전면 제한했다. 33곳 중 24곳이 인공지능(AI), 보안 소프트웨어, 광학기술 등 첨단 IT(정보기술) 업체다. 트럼프 행정부는 또 화웨이에 대해 지난해 이후 꼭 1년 만에 더욱 강력한 추가 제재안을 내놨다. “미국의 기술을 활용해 비메모리 반도체를 화웨이에 공급할 때 승인을 받아야 한다”는 게 골자다. 중국 언론은 “미국이 반도체 공급을 차단해 화웨이의 숨통을 끊겠다는 것”이라며 발끈했다.


미·중 간 충돌로 당장 삼성전자는 발등에 불이 떨어졌다. 파운드리 업계 1위인 대만 TSMC는 미국에 120억 달러를 투자해 5나노 공정의 공장을 짓기로 했다. TSMC의 주요 고객인 애플·퀄컴·AMD·엔비디아·브로드컴 등 미국 반도체 업체들이 지금보다 TSMC에 주문을 더 늘릴 가능성이 크다. 반면에 TSMC를 뒤쫓는 삼성전자는 정부의 그린 뉴딜 정책에 호응해 평택에 13조원을 들여 5나노 공정 공장을 짓기로 했지만, 미국 정부는 여전히 삼성전자의 미국 오스틴 공장 확장을 직·간접 압박하고 있다.


조철 산업연구원 연구위원은 “미·중 충돌로 삼성전자나 SK하이닉스가 단기적으로 반사이익을 얻을 수 있지만 미국이나 중국이 서로 한국에 자기 편에 서라고 하면 난감한 상황에 처하게 된다”고 말했다. 미국이 중국을 견제하는 데서 나아가 ‘반도체 자급주의’를 추진하고, 일본까지 반도체 부흥에 나설 경우 상황은 더 복잡해진다.




 이종호(전기·정보공학부 교수) 서울대 반도체공동연구소장은 “미국은 오바마 행정부 때부터 반도체 주도권 회복 전략을 추진해 왔다”며 “중국 견제뿐 아니라 한국에 빼앗긴 메모리 반도체의 주도권을 다시 찾으려 할 수도 있다”고 말했다.


미·중 반도체 충돌은 미래 패권 확보를 위한 기술 전쟁이다. 미국의 속내는 트럼프 행정부가 지난 20일 공개한 ‘중국에 대한 미국의 전략적 접근’ 보고서에서 찾아볼 수 있다. 보고서는 화웨이를 직접 거론하며 “중국 정부가 혜택을 부여한 기업(화웨이)을 앞세워 세계 정보통신 업계를 장악하려 한다”고 강조했다. 박재근(한양대 융합전자공학부 교수) 한국 반도체·디스플레이기술학회장은 “중국이 4차 산업혁명 시대의 패권을 차지하기 위해 반도체를 비롯한 기술 확보에 나서자 미국이 절대 용납할 수 없다며 강경책을 펴는 것”이라고 말했다.


화웨이에 대한 미국의 집중 공세 배경으로는 중국 기술기업을 대표하는 화웨이의 상징성이 꼽힌다. 또 화웨이가 전통적으로 미국이 강세였던 스마트폰용 AP(애플리케이션 프로세서) 칩이나 반도체 설계 같은 비메모리 반도체 기술에서 무섭게 성장하고 있는 점도 작용한다. 특히 화웨이는 중국 당국을 등에 업는 ‘반칙’을 통해 세계 최고 5G 기술 업체로 성장했다는 것이 미국의 인식이다. 5G는 4차 산업혁명은 물론 군사·안보와도 직결된 기술이다. 화웨이는 비메모리 분야에서도 비슷한 성장 전략을 구사하고 있다. 그 결과 지난해 화웨이의 자회사인 하이실리콘은 비메모리이자 스마트폰의 핵심인 AP 칩 시장에서 세계 5위를 차지했다. 또 팹리스(반도체 설계 전문기업) 분야에서도 지난해 매출 기준 톱10에 이름을 올렸다. AP 칩과 팹리스는 각각 미국의 퀄컴과 인텔이 장악하고 있는 분야다. 박재근 교수는 “중국이 성능이 우수한 AP와 PC용 CPU(중앙처리장치)를 자체 개발하고 시장을 확대하고 있다”며 “미국으로서는 이대로 가면 인텔과 애플도 화웨이에 잡히는 것이 아니냐는 위기감 때문에 더 강력히 브레이크를 거는 것”이라고 말했다.


미국의 잇따른 견제와 압력에도 중국의 반도체 굴기를 향한 진군은 거침이 없다. 시진핑 국가주석은 “반도체는 사람의 심장과 같다”는 ‘반도체 심장론’을 주창하며 투자를 독려 중이다. 미국의 딴지로 칭화유니그룹의 미국 마이크론 인수가 무산되는 등 해외 반도체 기업의 인수합병(M&A)이 틀어지면서 기술 확보에 어려움을 겪고 있기 때문이다. 최근 미국은 세계 최고의 파운드리 기업인 대만의 TSMC에 화웨이와의 거래 중단을 압박했다. 하지만 중국은 그럴수록 천문학적인 돈을 퍼부으며 자국 기업 육성책으로 맞서고 있다. 닛케이 아시안리뷰에 따르면 중국과 상하이시 당국은 22억5000만 달러(약 2조7700억원)를 파운드리 업체 SMIC에 수혈했다.



안기현 한국반도체협회 상무는 “반도체 산업과 관련된 규제 환경을 찾아 개선하고, 메모리 반도체 분야에서는 후발주자들과 기술 격차를 벌려가면서 비메모리 분야로 영역을 넓히는 데 집중해야 한다”고 말했다.


김태윤 기자 pin21@joongang.co.kr
▶ ▶ ▶ ⓒ중앙일보(https://joongang.co.kr), 무단 전재 및 재배포 금지",/news/news_read.nhn?article_id=0003003999&office_id=025&mode=search&query=SK하이닉스&page=3
,"“1분기 급여가 3000만원이 넘으니 연봉이 어마하네. 부럽다”


최근 포털 사이트에 걸린 경제 뉴스 상위 목록에 있는 보도에 달린 한 댓글이다. SK그룹(19개 계열사)의 1분기 평균 급여가 지난해 같은 기간(4920만원)보다 31.9% 내린 3350만원이었다는 내용을 두고 한 얘기다. 31% 내린 1분기 급여가 3000만원이 넘는 다는 사실을 두고 “대기업이라고 다 같은 대기업이 아니다”, “생활은 가능한 연봉이네ㅎㅎ” 등의 반응이 이어졌다.


대기업집단 데이터 서비스 회사인 인포빅스가 최근 집계한 자료에 따르면 1분기 직원 평균 급여가 가장 많이 오른 곳은 HDC그룹이었다. 공시 자료에서 '급여 총액÷직원 수'로 계산한 결과 HDC그룹의 올해 1분기 평균 급여는 2470만원이었다. 2019년 1분기(1700만원)에 비해 44.9% 늘었다.


한때 시가총액 8위까지 올랐던 카카오(26일 기준 9위)의 1분기 평균 급여(2700만원)도 지난해 같은 기간(2188만원)에 비해 23.4% 오른 것으로 조사됐다. 이밖에 신세계(1061만→1167만원)가 9.9%, 현대자동차(1948만→2126만원)는 9.1% 각각 오른 상승률 상위 기업이다.




 이 회사들에 무슨 일이 있었던 걸까. 각 회사 관계자들은 “공개된 내용과 달리 실제 연봉엔 큰 변화가 없다”고 입을 모았다.


가장 인상 폭이 큰 HDC는 ""착시 효과""라고 설명했다. HDC 직원들은 통상 그해의 성과급을 그해 말에 받아왔는데, 2019년분 성과급은 올해 3월에 지급됐다. 직원 입장에선 지난해 받을 연봉 중 일부가 올해 1분기 급여로 계산됐다는 얘기다. HDC 관계자는 “성과급 효과를 빼면 실제로 전체적인 올해 연봉이 크게 오르는 건 아니다”고 설명했다.


카카오는 스톡옵션 효과로 급여액이 오른 것으로 공시됐다고 한다. 카카오 관계자는 “스톡옵션은 부여할 때가 아니라 임직원이 그것을 행사할 때 급여 지출이 된 것으로 기록된다”며 “올해 1분기에 이를 행사한 임직원이 많아 평균 급여가 오른 것으로 통계가 나온 것일 뿐 실제 체감하는 월급 인상 효과는 크지 않다”고 말했다.




 현대차는 급여를 주는 방식이 바뀌었을 뿐 전체적인 연봉 변화는 없다는 입장이다. 현대차 직원들은 지난해까지 상여금을 짝수달(연 6회)에 한 번씩 나눠 받았는데, 올해부터는 달마다(연 12회) 쪼개 받기로 노사가 합의했다고 한다. 현대차 관계자는 “지난해는 2월에 성과급 6분의 1을 받았다면, 올해는 1~3월 성과급 4분의 1을 받은 셈이기 때문에 1분기 급여가 올라간 것”이라며 “2020년 1년 치를 연말에 계산해보면 실제 직원들 주머니에 들어오는 총액은 큰 변화가 없을 것”이라고 말했다.


신세계는 공시 오류 때문에 급여가 9.9% 오른 것으로 집계되는 해프닝이 생겼다. 신세계 관계자는 ""7개 상장사 중 한 곳에서 급여 공시에 오류가 있었다""며 ""곧 수정 공시할 예정""이라고 전했다.


급여가 내려간 것으로 조사된 SK도 성과급 효과였다. 특히 SK하이닉스는 2019년 영업이익이 1년 전의 7분의 1(20조8000억→3조원) 수준으로 줄어들면서 성과급을 주지 않고, 대신 이보다 낮은 수준의 격려금을 지급한 것으로 알려졌다. SK 관계자는 “성과급이 줄었으니 급여 지급액도 떨어진 것으로 집계된 것으로 안다”며 “다만 직원들의 기본 연봉이 낮아진 것은 아니다”고 설명했다.


최선욱 기자 isotope@joongang.co.kr
▶ ▶ ▶ ⓒ중앙일보(https://joongang.co.kr), 무단 전재 및 재배포 금지",/news/news_read.nhn?article_id=0003004032&office_id=025&mode=search&query=SK하이닉스&page=3
비대면 경제 기대감에 ‘카카오’ 2배 상승… 제약·바이오 100위권 진입에 순위 재편,"[서울신문]지난 3월 19일 ‘코로나 충격’으로 1500선이 무너졌던 코스피가 종가 기준으로 두 달여 만에 2000선을 회복했다. 비대면 경제에 대한 기대감이 커지면서 정보기술(IT) 관련 종목이 증시 회복을 이끌었고, 제약·바이오 관련 종목도 급등했다. 반면 삼성전자와 SK하이닉스, 현대자동차, 포스코 등 IT 하드웨어와 제조업 기반의 대형주들은 회복 속도가 더뎠다.26일 코스피는 전 거래일 대비 35.18포인트(1.76%) 오른 2029.78로 마감됐다. 연중 최저점(3월 19일 1457.64)에서 39.3% 오른 것이다. 미국, 영국, 독일, 중국, 일본 등 세계 주요국과 비교했을 때 상대적으로 가장 빠른 회복세다.우리 증시가 빠른 속도로 반등한 것은 카카오, 엔씨소프트, NHN 등 비대면 경제로 성장이 예상되는 IT 소프트웨어 관련 종목의 영향이 컸다. 카카오 주가는 지난 3월 19일과 비교해 2배 넘게 뛰었다. NHN 주가도 같은 기간 63.8%, 엔씨소프트는 51.1% 올랐다.현대자동차(-21.8%)는 시가총액 10위권 밖으로 밀려났다. 삼성전자(-12.7%), SK하이닉스(-12.4%), 포스코(-20.4%) 등 IT 하드웨어와 제조업, 신한지주(-24.1%), KB금융(-25.8%)을 비롯한 금융업은 여전히 코로나19 확산 이전의 주가를 회복하지 못하고 있다. 다수의 바이오 기업들이 시총 100권에 진입했다. 씨젠은 220위에서 69위, 알티오젠은 195위에서 72위로, 셀트리온제약은 148위에서 66위로 약진했다.홍인기 기자 ikik@seoul.co.kr강윤혁 기자 yes@seoul.co.kr▶
▶
▶ⓒ 서울신문(www.seoul.co.kr), 무단전재 및 재배포금지",/news/news_read.nhn?article_id=0003093760&office_id=081&mode=search&query=SK하이닉스&page=3
제재 본격화되면 화웨이·TSMC '주춤'…삼성의 '기회''메모리 반도체' 시장으로 확전되면 '한국반도체' 위기,"[CBS노컷뉴스 최철 기자]미국이 글로벌 통신장비 1위 업체인 중국의 화웨이에 대해 전면적 제재조치를 가하는 등 미중간의 '테크(Tech·기술) 패권'을 놓고 '신냉전' 양상이 벌어지면서 향후 한국의 반도체산업에 미칠 영향 등을 계산하는 셈법이 복잡해지고 있다. 기대와 우려가 공존하는 모양새다. 앞서 미국은 지난 15일(현지시간) ""미국이 아닌 제3국에서 만든 반도체라도 미국 기술을 이용한 제품은 중국 화웨이에 수출할 수 없다""는 내용의 제재조치를 발표했다. 제재조치의 구체적인 내용을 살펴보면, 미국 정부는 오는 9월부터 화웨이와 자회사가 미국 기술을 이용해 반도체를 설계하는 것과 화웨이의 주문을 받은 업체가 미국의 기술을 이용해 제품을 납품해서는 안된다고 못박고 있다. 미국은 여기다 추가로 33개 중국 회사 및 기관을 거래제한 명단에 올리는 등 압박 수위를 높여가고 있는중이다. 앞서 언급했듯이 현재 미국의 제재는 '시스템 반도체'를 겨냥하고 있다. 그리고 미국의 제재조치는 즉각 효력을 발휘하고 있다. 화웨이에 AP(스마트폰 중앙처리장치) 등 시스템 반도체 특히 고성능 반도체를 납품해 온 대만의 TSMC가 미국 편에 섰기 때문이다. TSMC는 미국 애리조나에 5나노 공정 반도체 생산라인을 짓기로 했고, 외신들도 TSMC가 화웨이의 신규 주문을 받지 않기로 했다는 소식을 전하고 있다. 이같은 상황은 일단 2030년까지 시스템 반도체 1위를 목표로 뛰고 있는 삼성전자에게는 기회일 수 있다. TSMC가 최대 고객인 화웨이를 잃고 주춤하는 동안, 삼성이 격차를 줄이기 위해 나설 수 있기 때문이다. 시장조사기관 트렌드포스에 따르면 2020년 1분기 파운드리 시장점유율은 TSMC가 54.1%로 1위이고 그 뒤를 15.9%인 삼성전자가 잇고 있다. 현재 삼성전자의 파운드리 생산 라인은 경기도 기흥 2개, 화성 3개, 미국 오스틴 1개 등 모두 6개이다. 최근 평택캠퍼스에 7번째 생산라인을 구축하기로 한데 이어 미국 오스틴 증설 얘기도 꾸준히 나오고 있다. 또한 삼성전자는 5G 통신 시장에서는 화웨이와 경쟁을 벌이고 있다. 이미 전 세계 곳곳에서 치열한 5G 통신장비 수주전을 벌이고 있는데, 화웨이가 시스템 반도체 수급 불안정 등으로 차질이 생길 경우 삼성이 일정부분 반사이익을 얻을 수 있다. 시스템 반도체와는 달리 메모리 반도체는 미국이 오는 9월부터 시행할 예정인 '화웨이 제재'의 대상은 아니다. 이에따라 화웨이가 최근 삼성전자와 SK하이닉스에 ""안정적인 메모리 반도체 납품을 요구했다""는 이야기도 흘러나오고 있다. 이는 화웨이가 당장은 제재대상이 아니지만 향후 급변할 수 있는 상황을 대비해 '메모리 반도체'만이라도 미리 재고를 확보해놓겠다는 계산이 깔려있는 것으로 보인다. 이렇게 될 경우 글로벌 메모리 반도체 시장을 좌지우지하고 있는 삼성전자와 SK하이닉스에게는 호재가 될 수 있다. 실제 화웨이가 한국으로부터 구매하는 D램·낸드플래시 등 메모리 반도체 규모는 연간 10조원 안팎으로 추정된다.하지만 화웨이가 메모리 반도체 재고 확보에 나서는 모습에서 이미 '짙은 그림자'가 엿보인다는 관측도 존재한다. 지난해 미중 무역전쟁 당시 미국은 자국의 마이크론에 대해 ""화웨이에 메모리 반도체를 공급하지 말라""고 한 적이 있기 때문이다. 따라서 향후 미중이 반도체를 두고 싸움을 계속해 나갈 경우 '메모리 반도체'까지 제재 테이블에 올라갈 가능성도 완전히 배제할 수는 없다. 삼성전자와 SK하이닉스가 현재의 '신냉전'을 손놓고 바라볼 수만은 없는 이유인 것이다. 저작권자 © CBS 노컷뉴스 무단전재 및 재배포 금지",/news/news_read.nhn?article_id=0003364495&office_id=079&mode=search&query=SK하이닉스&page=3
,"올 1분기 대기업들의 생산실적이 급감한 것으로 나타났다. 글로벌 경기침체에 코로나바이러스 감염증까지 겹치면서 기업들의 생산활동이 크게 위축됐다는 분석이다. 특히 항공운송을 비롯해 자동차 및 부품 등 업종의 생산실적이 지난해에 비해 많게는 30% 이상에서 적게는 10% 안팎으로 감소해 심각한 타격을 받았다. 국내 10개 주력업종 29개 부문 중 절반이 넘는 17개 부문의 생산실적이 작년에 비해 감소했다. 이 중 스마트폰과 디스플레이, 생활용품, 항공운송, 타이어 등 8개 부문은 생산능력을 하향 조정했음에도 실적이 줄어들었다. 반면 반도체는 생산능력을 대폭 확대했음에도 100% 가동률을 기록했고, 택배와 석유화학, 제약 부문도 생산실적이 10% 이상 증가했다.기업평가사이트 CEO스코어는 27일 “국내 500대 기업 중 분기보고서를 제출하고 가동률을 공시하는 127개 기업을 조사한 결과, 올 1분기 가동률은 81.4%로 지난해 1분기(85.2%)와 비교해 3.8%포인트 하락했다”고 밝혔다. 기업들의 1분기 생산능력 대비 생산실적이 작년에 비해 악화된 것으로, 글로벌 경기침체 상황에서 코로나의 전세계적인 확산으로 공장 가동을 중단하거나 생산량 조절에 나섰기 때문인 것으로 풀이된다.생산실적(운송실적)이 가장 큰 폭으로 감소한 부문은 항공운송으로 작년보다 35.9% 급감했다. 30% 이상 감소한 부문은 항공운송이 유일하다. 여행 수요가 줄어들었기 때문으로, 항공운송은 전 산업군을 통틀어 코로나 충격을 가장 먼저 받았고 피해도 가장 크게 받은 것으로 분석된다.이어 스마트폰과 디스플레이도 지난해 같은 기간의 비해 각각 26.7%, 24.1% 줄었다. 생활용품(-21.5%), 기타설비(-14.9%), 건설기계(-13.9%), 타이어(-12.0%), 자동차부품(-10.5%), 비료(-10.0%) 등도 두 자릿수 감소율을 기록했다.반대로 반도체 부문은 작년보다 생산실적이 34.9% 늘어 대조됐다. 삼성전자 반도체 사업부문은 생산능력을 작년 1분기 1762억9900만개에서 2774억5000만개로 1년 새 57.4%, SK하이닉스는 5조1048억원에서 5조7343억원으로 12.3% 늘렸고, 두 회사 모두 생산능력의 100%를 생산한 것으로 나타났다.각 기업의 사업부문별 생산실적을 봐도 작년보다 가장 많이 줄어든 곳은 항공사였다. 특히 저비용항공사(LCC)의 감소폭이 두드러졌다. 진에어가 작년에 비해 54.2% 급감해 감소율 1위에 올랐고 제주항공이 -46.8%로 2위를 기록했다. 아시아나항공(-33.4%)과 대한항공(-32.7%)도 5~6위에 이름을 올렸다.또 ㈜한화(산업기계 부분) -37.1%, 두산중공업(원자력BG) -34.1%, LG디스플레이(디스플레이 부문) -28.1%, LG전자(휴대폰 부문) -27.5%, 두산인프라코어(건설기계 부문) -27.4% 등이 감소율 톱10에 포함됐다.반면 생산실적이 가장 많이 늘어난 곳은 세메스 반도체장비 부문으로 가동시간이 6만6900시간에서 올해 14만5065시간으로 116.8% 증가했다. 엘에스아이앤디(권선 부문) 105.7%, ㈜한화(방산 부문) 102.1% 등도 세 자릿수 증가율을 기록하며 톱3에 이름을 올렸다. 다음으로 LG이노텍(광학솔루션 부문) 92.2%, 현대일렉트릭(전기전자 부문) 83.8%, 효성첨단소재(산업자재 부문) 65.5%, 삼성전자(반도체 부문) 57.4%, LG화학(전지 부문) 51.6%, 삼성중공업(조선 부문) 51.1%, 한섬(패션 부문) 44.0% 등의 순이었다.[신은진 기자 momof@chosun.com] 		▶
		▶ 		▶
	- Copyrights ⓒ 조선일보 & chosun.com, 무단 전재 및 재배포 금지 -",/news/news_read.nhn?article_id=0003534233&office_id=023&mode=search&query=SK하이닉스&page=3
