head,text,url
,"문재인 대통령이 10일 신종 코로나바이러스 감염증(코로나19) 사태에 따른 국난극복 방안으로 시스템반도체와 바이오헬스, 미래차 등을 주요 신산업 육성 분야로 꼽았다. 신산업에 투자를 아끼지 않고 성장 동력으로 삼겠다는 의지의 표현이어서, 해당 분야에선 고무된 분위기가 역력하다.10일 관련 업계에 따르면 문 대통령의 취임 3주년 대국민 특별연설에 대해 “실적 악화로 투자가 불투명한 환경에서 대통령이 분명한 메시지를 줬다”며 반기고 있다.우선 시스템반도체 업계에선 정부와의 경제 협력에 희망을 걸고 있다. 올해부터 파운드리(반도체 위탁생산)와 팹리스(반도체 설계) 분야별 세부적 지원에 기대감을 높이고 있다. 지난해 4월 문 대통령은 삼성전자 화성사업장을 찾아 삼성의 ‘2030년 시스템반도체 1위 달성’ 목표에 힘을 보태겠다는 의지를 확실히 했다. 반도체 설계에 필요한 설계 자동화 소프트웨어(SW) 등을 중소기업들이 공동 사용할 수 있는 플랫폼을 정부가 지원하고 인공지능(AI), 바이오 등 첨단 분야 파운드리 신기술 개발에 대한 세액 공제가 점쳐진다.기업들의 움직임도 분주하다. 삼성전자와 SK하이닉스는 정부의 육성계획에 발맞춰 최근 1,000억원 규모의 펀드를 조성하기로 했다. 이를 통해 국내 유망 팹리스 기업들의 경쟁력을 배가시키시겠다는 복안이다. 올해 1분기에만 반도체 시설 투자로 전년보다 2조4,000억원 늘린 6조원을 집행한 삼성전자는 “계획된 투자를 차질 없이 집행하겠다”고 전했다. 반도체 업계 관계자는 “설계와 제조가 분업된 시스템반도체 분야에서 팹리스와 파운드리가 유기적으로 연결되면 상생 성장이 가능하다”고 말했다. 지난해 4월 ‘세계 최초’ 상용화에 이어 ‘세계 최고’ 인프라로 발돋움 하려는 5G 영역에도 ‘청신호’가 들어왔다. 현 정부의 주요 5G 지원 방안은 세액공제 혜택 강화와 전파 지원 확충 등이다. 대표적으로 수도권 기준 기존 1%였던 기업의 망 투자 세액공제율을 올해 2%로 확대한 조치가 있다. 올 연말 일몰 예정이지만 망 인프라 구축은 장기적 투자가 필수적인 만큼, 연장 가능성이 거론되고 있다.코로나19 사태에 경쟁력이 입증된 진단키트 등을 앞세운 국내 바이오헬스 산업은 이미 글로벌 시장 확대에 속도를 내고 있다. 실제 지난달 10억8,500만달러(약1조3,247억원) 수출하면서 전체 수출 품목 순위 8위까지 올라갔다. 정부는 올해 바이오헬스 산업에 전년대비 15% 늘어난 1조2,800억원을 예정대로 투자할 계획인 가운데 외국인 투자 유치 확대 등도 기대된다. 국내 자동차 업계 역시 긍정적이다. 차세대 먹거리로 지목한 ‘미래차’가 문 대통령의 신성장 산업 육성 리스트에 포함되면서다. 코로나19 여파로 잇따라 국내외 생산시설이 가동 중단되면서 최악의 상태에 빠진 국내 자동차 업계에선 ‘미래차’에 탑승하면서 분위기 반전까지 노릴 수 있게 됐다. 자율주행차 등 미래차가 탑재한 잠재성장성을 감안하면 코로나19에 직격탄을 맞은 자동차 업계가 ‘터닝포인트(전환점)’ 찾기도 가능할 것이란 전망이다. 다행스럽게도 국내 완성차 업체들은 대부분 생산시설 가동 본격화에, 노사가 합심해 줄어든 생산량을 공장 풀가동으로 극복하겠다는 방안도 수립한 상황이다. 국내 자동차 업계는 향후 10년간 미래차 생태계 전환을 위해 60조원 투자 계획까지 마련한 상태다.정부가 3,856억원을 들여 육성하겠다는 전기차 분야 전망 또한 밝아졌다. 전기차에는 제2의 반도체로 불리는 배터리 탑재가 필수여서, 글로벌 시장에서 선두 제조사로 자리잡고 있는 국내 배터리 업체들에게 시너지 효과를 가져올 수 있다. 이항구 산업연구원 선임연구위원은 “해외 시장이 회복하며 수요가 살아나야 한다는 전제가 있지만, 불확실성이 큰 기업들에게 방향제시를 했다는 데 의의가 있다”면서 “다만 문 대통령 발언에는 미래 산업에 대한 투자를 기업에게 유도하며 감원보다는 일자리 확충을 요구한 의미도 있다는 것을 알아야 한다”고 말했다. 박관규기자 ace@hankookilbo.com맹하경기자 hkm07@hankookilbo.com",/news/news_read.nhn?article_id=0000494978&office_id=469&mode=search&query=SK하이닉스&page=3
"두달간 개인투자자 14조, 연기금 4조 순매수1분기 신규편입 16곳, 대부분 수익률 하락세","동학개미와 쌍끌이 매수세를 이어갔던 국민연금의 주식성적표가 신종 코로나바이러스 감염증(코로나19) 여파로 직격탄을 입고 있다. 증시의 지렛대 역할을 톡톡히 했던 개미들의 주식성적표가 좋지 않았던 만큼 연기금 역시 부진한 수익률을 기록한 것으로 나타났다.11일 한국거래소에 따르면 개인투자자들은 지난 2개월간(3월8일~5월8일) 주식시장에서 14조원어치 주식을 쓸어담았다. 이 기간동안 연기금도 4조2585억원을 순매수하며 지수 방어 지렛대 역할을 톡톡히했다. 다만 이 기간동안 외국인이 16조5000억원 규모의 주식을 내다판 가운데 개인과 연기금이 외국인 자금을 대부분 받은 것으로 나타났다.특히 국민연금은 지난 1분기 비에이치, 한독, 아미코젠, 롯데정보통신 등 16개사를 신규편입하며 5~7% 이상 지분율 늘렸다. 하지만 이들 종목들의 주가는 대체로 부진했다. 작년말 처음 편입에 나선 이후 주가가 큰 폭으로 떨어졌다. 비에이치(-24.60%)를 비롯해 롯데정보통신(-12.73%), 삼화콘덴서(-6.41%), 일진다이아(-15.74%), 코스맥스엔비티(-25.49%), 보령제약(-21.08%), 성광벤드(-39.90%) 등이 낙폭을 확대했다.1분기에 지분율 늘린 종목들도 대부분 낮은 수익률을 기록했다. 국민연금은 지난 1분기에 아모텍 지분을 5.14%에서 8.64%로 늘렸지만 이 기간동안 주식 수익률은 -28.84%로 부진했다. 화승인더도 7.32%에서 10.02%로 2.7% 늘렸지만 주가는 -26.81%로 뒷걸음질쳤다. 경동나비엔도 8.17%에서 10.69%로 지분이 늘었지만 -21.46%를 기록했다. 제일기획도 8.13%에서 10.05%로 지분을 늘렸는데 -28.27%로 수익률이 부진했다.그나마 지분을 늘린 종목들 가운데 수익률 선방에 성공한 종목들도 일부 있었던 것으로 나타났다. 국민연금은 NHN을 작년말대비 3.6%나 지분을 늘렸는데 이 기간동안 주가는 19%가 올랐다. 새로 신규편입한 덕산네오룩스도 16.54%의 수익을 올렸다. 한독과 아미코젠도 각각 3.75%, 8.25% 등도 상승률을 기록했다. SK케미칼은 종전대비 2.09%의 지분을 늘렸는데 21%의 상승률을 나타냈다.코로나19 여파로 지분확대 종목들의 주가 수익률이 부진했지만 앞서 국민연금이 발표한 지난 2월말 기준 수익률도 -0.45%로 지지부진한 실적을 낸 것으로 나타났다. 자산군별로는 금액가중수익률 기준 국내주식 -7.75%, 해외주식 -2.95% 등이 마이너스 수익률을 기록했다.특히 국내 증시가 코로나19 확산에 따른 경기침체 우려로 고꾸라지면서 주가 수익률은 더욱 부진할 것이라는 분석이 나온다. 지난 두달간 연기금의 순매수 상위종목에 오른 삼성전자(-13.63%), SK하이닉스(8.21%), SK텔레콤(-6.97%), 현대차(-14.48%) 등이 하락세를 기록하며 수익률이 부진했다. 다만 네이버(19.22%), LG생활건강(10.59%), 셀트리온(18.59%) 등이 상승세를 기록하며 비교적 선방했다는 평가다.금융투자업계 관계자는 ""국민연금이 연기금들 가운데서 비교적 높은 수익을 내는 편이지만 이번 코로나19 여파로 주가수익 방어에 실패했다""며 ""올해 상반기까지 국내 경제가 역성장할 것으로 예상되는 만큼 주가수익률 반전을 이루기는 쉽지 않을 것""이라고 말했다.데일리안 이미경 기자 (esit917@dailian.co.kr)ⓒ (주)데일리안 - 무단전재, 변형, 무단배포 금지",/news/news_read.nhn?article_id=0002400702&office_id=119&mode=search&query=SK하이닉스&page=3
,"[머니투데이 세종=최우영 기자, 심재현 기자, 안정준 기자, 박소연 기자, 조성훈 기자, 박계현 기자] 문재인 대통령이 포스트 코로나시대의 첫번째 목표로 기업 유턴과 함께 글로벌 첨단기업 국내 유치를 꼽았다. 한국을 전세계 첨단기술의 보급창으로 만들어 세계의 산업지도를 바꾸겠다고 했다.이는 최근 코로나19 방역을 통해 얻은 자신감 덕분이다. 한국은 이번 사태에서 사이버 개학, 비대면 산업 등을 뒷받침하는 ICT(정보통신기술) 인프라와 뛰어난 방역을 통한 바이오산업 경쟁력을 확인했다. 더욱이 동요하지 않는 시민의식과 경제봉쇄 없이 난관을 헤쳐나가는 정부의 역량을 통해 그 어느 곳보다도 안전하고 투명한 생산기지로서의 자격을 전세계에 선보였다.◆대한민국=세계에서 가장 안전하고 투명한 생산기지문 대통령은 10일 청와대 춘추관에서 '대통령 취임 3주년 특별연설'을 통해 ""혁신 벤처와 스타트업이 주력이 돼 세계를 선도하는 '디지털 강국'으로 대한민국을 도약시키겠다""고 밝혔다.한국은 코로나19 사태 속에서 튼튼한 방역을 기초로 세계에서 가장 안전한 생산거점으로서의 가능성을 보였다. 일례로 완성차업계 중 GM, 폭스바겐 등 글로벌 업체들의 공장 중단율이 80%를 넘어섰지만 국내에서 공장을 상당수 운영하는 현대·기아차의 중단율은 35.3%에 그쳤다.문 대통령이 ""대한민국은 세계에서 가장 안전하고 투명한 생산기지가 됐다""고 밝힌 이유다. 문 대통령은 ""세계는 이제 값싼 인건비보다 혁신역량과 안심 투자처를 선호하기 시작했다""며 ""우리에겐 절호의 기회""라고 바라봤다.이어 ""한국 기업의 유턴은 물론 해외의 첨단산업과 투자를 유치하기 위해 과감한 전략을 추진하겠다""고 밝혔다.◆한국, 포스트 코로나 주인공 될 자격 '충분'한국이 코로나19 이후 글로벌 산업지형 재편 과정에서 주인공이 될 가능성은 충분하다. 지난해 일본의 수출규제로 촉발된 핵심기술 국산화를 계기로 정부도 고부가가치산업의 핵심공정 R&D(연구개발)에 그 어느 때보다 관심을 두고 투자하고 있다. 한국을 떠난 기업뿐 아니라 글로벌 기업의 투자를 유치하기 위한 특례제도 역시 일부 세제혜택 등을 넘는 수준으로 준비중이다.여기에 더해 자유무역협정(FTA)을 맺거나 협상을 진행하고 있는 나라만 59개국이다. 세계 주요국은 대부분 한국의 경제 영토에 엮여있다고 볼 수 있다. 이들만 합쳐도 전세계 국내총생산(GDP)의 77%가 넘는다. 2022년까지 전세계 GDP의 90% 수준까지 FTA 교역국 규모를 늘리는 게 정부의 목표다.유턴기업과 글로벌 기업들에 대한 구애, 비관세로 세계 주요국을 넘나들 수 있다는 점은 '안전하고 투명한 생산기지'로서의 한국의 입지 조건에 날개를 달아준다.◆세계의 공장 중국은 옛말…""한국이 기회 잡을 것""지리경제학 최고 석학인 장 폴 로드리그 미국 호프스트라대 교수는 최근 머니투데이와의 인터뷰에서 한국이 팬데믹 이후의 글로벌 경제 환경에서 유리할 것이라고 내다봤다. 또 글로벌 기업들의 중국에 대한 신뢰가 많이 줄어들 것이라고도 했다.로드리고 교수는 ""한국은 코로나19 대응 과정에서 매우 신뢰할 수 있는 나라로 여겨지고 있다""며 ""많은 글로벌 소비자들과 기업가들이 한국의 책임감을 기억할 것이고, 이는 향후 그들의 의사결정에 영향을 미치게 될 것""이라고 바라봤다.국내 기업들 그동안 값싼 인건비 등 해외 공장이 지니던 장점들이 줄어든다는 판단 아래 유턴 의사를 타진하고 있다. 최근 효성은 일부 공장의 베트남 진출 계획을 접고 울산 공장을 증설하는 쪽으로 방향을 돌리기도 했다.향후 국내에서 세제혜택과 기업하기 용이한 노동환경 등이 더 갖춰진다면 유턴기업과 글로벌 기업의 국내 유치에도 속도가 붙을 것으로 보인다. 문 대통령이 10일 연설에서 ""투자 활성화에 적극 나서겠다""며 ""제조업이 활력을 되찾도록 지원을 강화하겠다""고 밝힌 데 따라 향후 기업 유치를 위한 추가 대책이 나올 전망이다.세종=최우영 기자문재인 대통령이 10일 취임 3주년 특별연설에서 시스템반도체, 바이오헬스, 미래차 등 3대 신성장 산업 강화를 강조한 것은 '포스트 코로나' 국면에서 글로벌 선도형 경제모델로 미래시장경쟁력을 선점하겠다는 의지를 밝힌 것으로 해석된다.무엇보다 문 대통령이 코로나19 사태에 따른 경제위기를 ""경제 전시상황""으로 표현하면서 3대 신성장 산업을 해법으로 제시한 것을 두고 정부의 정책 지원이 본격화할 것이라는 관측이 나온다.국내 반도체업계에서 시스템반도체는 미개척 영토다. 삼성전자와 SK하이닉스 등이 전세계 시장 매출의 60~70%를 확보한 메모리반도체 부문과 달리 시스템반도체 시장에서 국내 업계의 매출 점유율은 4.1%(D램익스체인지 2018년 기준 집계)에 그친다. 그마저도 2009년 점유율 2.9%에서 10년째 제자리걸음이다.1위인 미국(60.1%)은 물론 반도체 후발주자인 중국(5.0%)에도 뒤진다. 국내 반도체산업의 위상이 글로벌 톱으로 올라서느냐, 제조 하청공장으로 전락하느냐의 갈림길에 섰다는 얘기가 나오는 이유다.정부가 지난해 4월 삼성전자와 손잡고 시스템반도체 비전을 발표한 이후 성과는 조금씩 쌓이고 있다. 2030년까지 시스템반도체 부문에서도 세계 1위 점유율을 확보하겠다는 게 정부와 업계의 목표다. 시장조사업체 트렌드포스에 따르면 시스템반도체의 한 분야인 파운드리(반도체 위탁생산) 시장에서 삼성전자는 올 1분기 점유율 15.9%로 대만의 TSMC(54.1%)에 이어 2위에 올랐다. 삼성전자의 반도체 매출에서 시스템반도체 매출 비중도 올 1분기 처음으로 25%를 넘어섰다.이종환 상명대 시스템반도체공학과 교수는 ""시스템반도체는 메모리반도체보다 선두업체와의 격차가 큰 분야지만 한번 입지를 다져놓으면 수익성이 보장된다""며 ""정부의 공격적인 지원과 업계의 속도감 있는 사업 추진이 절실하다""고 말했다.업계 전문가들은 친환경차와 자율주행차 등 미래차 산업과 바이오헬스 산업에서도 퍼스트 무버 전략을 밀도 있게 추진해야 한다고 입을 모은다. 지난 100여년 동안 내연기관 중심의 자동차산업에서 후발주자에 그쳤던 국내 자동차업계가 패러다임 시스트(대변혁)를 계기로 미래시장 선점을 노릴 절호의 기회라는 얘기다. 현대차를 필두로 한 수소전기차 글로벌 판매량은 지난해 1~10월 기준 3666대로 일본(2460대)을 제치고 처음으로 1위에 올랐다. 전기차 배터리는 올해 1분기 세계 점유율 1위에 오른 LG화학을 비롯해 삼성SDI와 SK이노베이션까지 '배터리 빅3' 모두 글로벌 10위권에 안착했다. 바이오헬스 부문에서도 코로나19 사태 극복 과정에서 증명된 'K-방역' 후광을 계기로 세계시장 도약이 예견된다. 지난 4월 바이오헬스 수출 실적은 지난해 같은 기간보다 29% 늘어난 10억8500만달러로 '나홀로' 독주했다. 정부는 바이오헬스 수출을 2018년 144억달러에서 2030년 500억달러로 키워 국내 5대 수출주력산업으로 육성한다는 목표다. 심재현 안정준 박소연 기자문재인 대통령이 취임 3주년 특별연설에서 '한국판 뉴딜'을 통해 디지털인프라를 구축하고 일자리를 창출하는 선순환 구조를 만들겠다고 밝히자 정보통신기술(ICT) 업계가 환영의 목소리를 내고 있다. IT전문가들은 디지털 뉴딜이 경제회생은 물론 4차 산업혁명시대 국가 경쟁력을 제고하는 목적인 만큼 과감한 발상의 전환과 함께 규제완화도 적극 검토해야한다고 강조했다.◆디지털뉴딜 장기적 국가혁신 기여할 대형IT프로젝트 과감히 추진해야먼저 이번 디지털뉴딜사업을 통해 무엇보다 데이터 산업의 기반을 닦는데 비중을 둬야한다는 목소리가 나온다.최재홍 강릉원주대 교수는 ""거창한 시스템이나 애플리케이션을 개발하는 것도 필요하겠지만 데이터 기반이야 말로 AI(인공지능), 융합산업의 근본 인프라인 만큼 이번 한국형 뉴딜의 방향은 옳다""고 평가했다. 최 교수는 이어 ""최근 일자리를 잃은 청년들이 많은데 이들에게 데이터를 정리, 가공, 분류시키고 다양한 AI 학습용 데이터를 만들도록해 연구, 산업계가 즉시 활용하도록 하면 자연스레 일자리 문제와 함께 데이터, AI에 익숙한 인력 기반을 다질 수 있을 것""이라며 기대감을 내비쳤다. 김재환 인터넷기업협회 정책실장도 ""기업 입장에서는 가명화한 데이터를 얼마나 더 잘 활용해 새로운 비즈니스를 창출할 수 있을지가 최대 관심사""라며 ""이번 기회에 정부가 이종산업간 데이터를 결합한 부가가치가 높은 빅데이터들을 만들어 국가차원의 데이터 경쟁력을 키워줬으면 한다""고 제안했다.◆과감한 발상의 전환 필요, 규제도 풀어야과감한 발상의 전환과 규제완화를 주문하는 목소리도 있다. 문정현 한국정보산업연합회 상무는 ""디지털 뉴딜이 단기 일자리 창출 보다는 장기적 국가혁신과 성장동력을 창출하는 사업으로 꾸려져야한다""고 조언했다.예컨대 디지털 헬스케어나 전자투표시스템, 전자주민증, 에듀테크 등 기존 재원문제나 각종 이해관계에 가로막혔던 대형 IT프로젝트도 발상을 전환해 과감히 추진해야 한다는 주장이다. 이를 통해 10년 뒤 전세계적으로 선도할 레퍼런스(구축사례)를 만들어 과거 전자정부를 한국이 주도한 것처럼 IT 기업과 인력이 해외에 진출할 교두보를 쌓아야 한다는 것이다. 채효근 IT서비스산업협회 부회장은 ""디지털뉴딜이 일자리 창출이라는 정책효과를 극대화하려면 대기업의 인프라 투자를 적극 유도하고 여기에 중소중견기업과 스타트업이 동참하도록하는 방안이 필요하다""며 현행 대기업의 공공IT사업 참여제한 완화를 주문했다. 채 부회장은 ""기존 공공사업이 정부주도형으로만 이뤄지다보니 나라 돈을 쓰는 뉴딜사업도 대기업만 과실을 따먹는게 아니냐는 부정적 시각이 있는 게 사실""이라며 ""만약 그런 우려가 있다면 일반 SOC(사회간접자본) 사업처럼 민간투자형 공공사업을 도입해 대기업이 자본과 인프라를 투자해 참여하도록 길을 열어주면 된다""고 말했다. ◆정보보안 등한시 안돼디지털뉴딜에서 정보보호를 등한시해서는 안된다는 의견도 있다. 언택트 산업에서 미국의 줌, 네트워크 산업에선 중국 화웨이가 성장가도를 달리다 보안 이슈로 발목이 잡힌 사례를 참고해야 한다는 것이다. 박춘식 아주대 사이버보안학과 교수는 ""정부가 언택트 산업을 육성하려면 개인정보보호, 정보보호산업이 반드시 병행돼야 한다""며 ""언택트 산업은 주로 의료분야, 학교, 공공기관 등을 중심으로 도입될 가능성이 높은데 보안 기술이 제대로 적용돼 있지 않으면 반드시 역풍을 맞게 돼 있다""고 조언했다. 한편 박영선 중소벤처기업부 장관은 이날 페이스북을 통해 ""코로나 19의 어려움 속에서도 위기를 기회로 만들기 위해 안간힘을 다하던 벤처 스타트업은 문재인 정부 3년간 가장 활발하게 성장했던 분야""라며 ""(이번 뉴딜에서도) 대한민국의 혁신 벤처스타트업들이 주력이 돼 바야흐로 세계를 선도하는 디지털강국으로 대한민국을 도약시키는 일에 중소벤처기업부가 최선을 다하겠다""고 밝혔다. 조성훈 박계현 기자세종=최우영 기자 young@, 심재현 기자 urme@mt.co.kr, 안정준 기자 7up@mt.co.kr, 박소연 기자 soyunp@mt.co.kr, 조성훈 기자 search@, 박계현 기자 unmblue@
<저작권자 ⓒ '돈이 보이는 리얼타임 뉴스' 머니투데이, 무단전재 및 재배포 금지>",/news/news_read.nhn?article_id=0004406436&office_id=008&mode=search&query=SK하이닉스&page=3
,"[서울=뉴시스] 류병화 기자 = 11일 오전 빅데이터로 분석한 주식시장 코스피 200종목의 시장심리지수(Market Sentiment Index·MSI)는 5단계 '약간 좋음'으로 나타났다.뉴시스와 코스콤이 공동으로 뽑아낸 빅데이터 MSI(http://m.newsis.com/stock.html, 모바일 전용)에 따르면 전 거래일 오후 4시부터 이날 오전 8시까지 집계된 코스피 MSI 레벨은 5단계로 전 거래일보다 한 단계 내렸다.대장주 삼성전자의 MSI 레벨은 7단계로 집계됐다. 시가총액 상위 종목 중 SK하이닉스는 3단계, LG화학은 2단계, 현대차는 6단계, 셀트리온은 7단계로 나타났다.뉴시스와 코스콤은 250개 주요 상장 기업에 대해 감성 사전을 만들어 해당 종목의 실시간 점수를 산출하고 이를 최근 1년간의 흐름과 비교해 MSI 레벨로 제시하고 있다.MSI는 총 7단계로 나뉜다. 1단계 '매우 나쁨', 2단계 '나쁨', 3단계 '약간 나쁨', 4단계 '보통', 5단계 '약간 좋음', 6단계 '좋음', 7단계 '매우 좋음' 등으로 분류된다.MSI 레벨이 가장 낮은 수준인 1단계에서 가장 높은 수준인 7단계 쪽으로 바뀌면 해당 종목에 대해 온라인상에서의 반응이 부정에서 긍정으로 바뀌고 있다는 뜻으로 풀이할 수 있다.한편, 2017년 8월1일부터 선보인 빅데이터 MSI 모바일 전용 버전은 구글플레이 또는 애플 앱스토어에서 '뉴시스' 앱을 내려받거나 뉴시스 모바일 홈페이지(m.newsis.com)에 접속한 뒤 메인화면의 '빅데이터 MSI'를 클릭해 이용하면 된다.※ 빅데이터MSI는 투자 참고용이며, 투자 결과에 책임을 지지 않습니다. 주식시장에서는 다양한 국내외 변수가 존재하기 때문에 한 지표로만 판단하면 뜻하지 않은 결과를 초래할 수 있습니다. hwahwa@newsis.com<ⓒ 공감언론 뉴시스통신사. 무단전재-재배포 금지>",/news/news_read.nhn?article_id=0009854814&office_id=003&mode=search&query=SK하이닉스&page=3
,"리서치알음은 11일 케이씨에 대해 올해 반도체 시장이 투자확대 국면에 진입하면서 수혜를 볼 것이라고 전망했다.케이씨는 반도체·디스플레이 장비 업체로 1997년 유가증권시장에 상장했다. 2017년 인적분할을 통해 반도체 웨이퍼 연마 장비 등의 사업부문을 케이씨텍으로 분리시켰다. 케이씨는 가스공급장치와 화학약품공급장치 사업 및 자회사 관리를 담당하는 사업지주회사다. 이재영 연구원은 ""최근 가격 하락의 주요 원인으로 작용했던 반도체 공급과잉 현상이 빠르게 해소되고 있어 주목이 필요하다""며 ""올해 반도체 업황 개선으로 삼성전자와 SK하이닉스의 신규 투자 확대가 기대된다""고 말했다. 신규 공장 증설에 적용되는 반도체 장비들은 대부분 3~7개월 이상 제작기간이 소요되기 때문에, 가장 먼저 국내 장비업체들의 수혜를 예상했다. 케이씨는 자회사 및 관계회사, 투자회사를 통해 장비부터 소재까지 다양한 분야에 연관돼 있다. 반도체 투자확대 국면의 수혜를 모두 누릴 수 있다고 봤다. 여기에 자산가치 재평가도 기대했다. 이 연구원은 ""지난해 개별 기준으로 케이씨가 보유하고 있는 현금성 자산은 1300억원 수준""이라며 ""또 현재의 시가총액 2155억원을 웃도는 2700억원 수준의 상장사 지분도 보유 중""이라고 했다. 최근 현대차그룹의 글로벌비즈니스센터(GBC) 신축 허가가 완료되면서, 자회사 케이씨앤씨가 보유한 600억원 규모의 삼성동 사옥도 재평가될 것으로 예상했다. 케이씨의 1차 적정주가로는 2만6500원을 제시했다.
한민수 한경닷컴 기자 hms@hankyung.com▶ ▶
 ▶
ⓒ 한국경제 & , 무단전재 및 재배포 금지",/news/news_read.nhn?article_id=0004337892&office_id=015&mode=search&query=SK하이닉스&page=3
