head,text,url
,"[서울=뉴시스] 김제이 기자 = 27일 오전 빅데이터로 분석한 주식시장 코스피 200종목의 시장심리지수(Market Sentiment Index·MSI)는 7단계 '매우 좋음'으로 나타났다.뉴시스와 코스콤이 공동으로 뽑아낸 빅데이터 MSI(http://m.newsis.com/stock.html, 모바일 전용)에 따르면 전 거래일 오후 4시부터 이날 오전 8시까지 집계된 코스피 MSI 레벨은 7단계로 전 거래일 대비 두 단계 올랐다.대장주 삼성전자의 MSI 레벨은 1단계로 집계됐다. 시가총액 상위 종목 중 SK하이닉스는 4단계, LG화학은 7단계, 현대차는 4단계, 셀트리온은 3단계로 나타났다.뉴시스와 코스콤은 250개 주요 상장 기업에 대해 감성 사전을 만들어 해당 종목의 실시간 점수를 산출하고 이를 최근 1년간의 흐름과 비교해 MSI 레벨로 제시하고 있다.MSI는 총 7단계로 나뉜다. 1단계 '매우 나쁨', 2단계 '나쁨', 3단계 '약간 나쁨', 4단계 '보통', 5단계 '약간 좋음', 6단계 '좋음', 7단계 '매우 좋음' 등으로 분류된다.MSI 레벨이 가장 낮은 수준인 1단계에서 가장 높은 수준인 7단계 쪽으로 바뀌면 해당 종목에 대해 온라인상에서의 반응이 부정에서 긍정으로 바뀌고 있다는 뜻으로 풀이할 수 있다.※ 빅데이터MSI는 투자 참고용이며, 투자 결과에 책임을 지지 않습니다. 주식시장에서는 다양한 국내외 변수가 존재하기 때문에 한 지표로만 판단하면 뜻하지 않은 결과를 초래할 수 있습니다. jey@newsis.com<ⓒ 공감언론 뉴시스통신사. 무단전재-재배포 금지>",/news/news_read.nhn?article_id=0009882633&office_id=003&mode=search&query=SK하이닉스&page=3
메리츠증권 보고서,"[이데일리 최정희 기자] 2008년 금융위기 이후 증시는 ‘비관→희망→정상화→낙관’ 등 4단계를 거쳐왔는데 현 증시는 ‘희망’ 단계에 있다는 분석이 나왔다. 내년 이익이 개선될 것이란 기대감에 증시가 오르면서 주가순이익비율(PER)이 개선되고 있다. 이익 개선 기대감이 충족되면 정상화 단계로 넘어가겠지만 충족되지 않을 경우엔 주가가 하향 조정될 수 있다. 이익 개선 정도에 따라 하반기 코스피 지수는 1800~2250선에서 움직일 것으로 예측됐다. 27일 메리츠증권에 따르면 2008년 금융위기 당시 증시 하락과 반등 사이클을 4단계로 나눈 결과 ‘비관’ 국면에선 PER와 주당순이익(EPS)가 동반 하락해 주가가 급락하고 그 다음엔 ‘희망’ 국면으로 EPS가 하향 조정되는 데도 주가가 올라 PER이 상승하게 된다. 이어 ‘정상화’ 국면에선 EPS가 상향 반등하며 PER이 다시 하락하게 된다. 마지막 ‘낙관’ 국면은 이익 상향이 지속되고 낙관론이 확산되며 EPS, PER이 동반 상승한다. 강봉주 메리츠증권 연구원은 “희망 국면에서 기업 이익이 상향 반전되지 못하면 주가 사이클은 정상화 단계로 진입하지 못하고 다시 하락하는 악순환이 전개된다”며 “현재 한국 증시는 희망 국면 중반부에 있다고 판단한다”고 설명했다. 이익 전망치 하향이 진행되고 추가 하향이 불가피하지만 주가가 빠르게 반등하며 PER이 전고점에 근접했다. 긍정적인 시나리오로 보면 올해와 내년 순이익 전망치는 현재 컨센서스 97조원, 137조원에서 27%, 15% 추가 하향 조정된 71조원, 116조원에 근접할 것으로 전망한다. 올해 이익이 워낙 낮다보니 2021년 이익 증가율이 64%로 높아진다. 12개월 예상 EPS도 5% 상승할 수 있다. 보수적인 시나리오에선 내년 순이익 전망치가 10조원 추가 하향될 수 있다. 이익 턴어라운드에 대한 기대감이 낮아져 PER 추가 상향 효과가 나타나지 않는다. EPS 전망치는 5% 감소할 것으로 예측된다. 강 연구원은 “긍정적 시나리오 하에서의 하반기 코스피 최대치는 2223포인트, 보수적 시나리오에서 최저치는 1829로 예상된다”고 설명했다. 한편 하반기에도 주도주는 IT 등이 될 것이란 전망이 나온다. 강 연구원은 “2월부터 ‘주도주 7형제’라는 이름으로 삼성전자(005930), SK하이닉스(000660), 네이버(035420), 카카오(035720), 엔씨소프트(036570), 삼성전기(009150), 삼성SDI(006400) 등 7개 종목이 뚜렷한 이익 성장세와 주가 모멘텀, 외국인의 지속적인 매수세로 주도주 역할을 지속할 것”이라며 “이중 네이버, 카카오, 엔씨소프트는 추가 이익 개선, PER 리레이팅이 지속되며 하반기 코스피 전체적인 멀티플 상승을 이끌 것”이라고 설명했다. 반도체 업종은 하반기로 갈수록 내녕 이익 개선 기대감이 부각돼 PER 상승 여력이 충분하다고 평가했다. 다만 시클리컬 업종으로 불리는 에너지, 소재, 산업재는 이익 전망치 하향폭이 가장 컸던 데 반해 주가 하락폭이 적어 PER이 크게 증가했다며 투자 매력이 가장 낮다고 설명했다.최정희 (jhid0201@edaily.co.kr)＜ⓒ종합 경제정보 미디어 이데일리 - 무단전재 & 재배포 금지＞",/news/news_read.nhn?article_id=0004649157&office_id=018&mode=search&query=SK하이닉스&page=3
,"[서울=뉴시스] 김동현 기자 = 한화투자증권은 27일 케이씨텍(281820)에 대해 ""디램, 낸드, 파운드리 등 반도체 번분야에 걸쳐 설비 투자가 확대될 것으로 예상됨에 따라 반도체 장비 업체들의 수주가 늘어날 것으로 기대된다. 특히 적층 증가, 공정 미세화로 인해 반도체 웨이퍼 연마(CMP) 장비 수요가 증가할 것으로 예상돼 수혜가 예상된다""고 밝혔다. 이순학 한화투자증권 연구원은 ""케이씨텍의 1분기 실적은 매출액 691억원, 영업이익 97억원을 기록했다. 신종 코로나바이러스 감염증(코로나19)로 인해 중국향 디스플레이 장비 공급이 다소 지연됐음에도 불구하고 기록한 호실적""이라고 밝혔다. 세부적으로 ""반도체 장비와 소재 매출 비중이 각각 36%, 37% 차지하면서 실적 개선을 이끌었다""며 ""반도체 장비 매출액은 249억원으로 2017~2018년 반도체 투자 사이클 이후로는 최고치를 나타냈다. 소재 매출액은 전년동기 대비 20% 성장했다. 영업이익률은 14%에 그쳤지만 일회성 충당금이 있었다는 점을 감안하면 양호한 수준""이라고 분석했다. 이 연구원은 케이씨텍이 올해 사상 최대 실적을 올릴 수 있다고 예상했다. 그는 ""동사의 연간 실적으로 매출액 3396억 원, 영업이익 643억원을 전망한다""며 ""이는 2018년 최고 실적에 버금가는 수준이며 경우에 따라 이를 뛰어넘는 최대 실적을 달성할 수도 있다""고 의견을 제시했다. 이어 ""삼성전자 낸드 투자가 본격화되고 있고, SK하이닉스도 디램과 낸드 투자를 진행하고 있어 동사의 CMP 장비 공급이 증가하고 있다. 최근 발표된 삼성전자 평택 EUV 라인에도 CMP 장비 공급이 가시화되고 있어 긍정적""이라고 이유를 설명했다. 그러면서 ""케이씨텍에 대한 목표 주가를 2만8000원으로 상향하고 투자의견은 매수로 제시한다""며 ""과거 동사의 밸류에이션은 주가수익비율(PER) 7~8배 수준에 머물렀다. 이는 디스플레이 장비 매출 비중이 40~50% 정도 차지했기 때문인데 이 비중은 이제 30% 수준으로 축소됐다. CMP 관련 수요가 상승함에 따라 밸류에이션 재평가가 필요하다""고 덧붙였다. oj1001@newsis.com<ⓒ 공감언론 뉴시스통신사. 무단전재-재배포 금지>",/news/news_read.nhn?article_id=0009882655&office_id=003&mode=search&query=SK하이닉스&page=3
,"[앵커] 매주 수요일 만나는 친절한 경제 시간입니다. 코로나19로 전 세계가 경제난을 겪는 와중에 엎친 데 덮친 격으로 미·중 무역전쟁까지 재발할 조짐을
보이고 있습니다. 양대 강국이자 우리나라의 수출 대상국 1, 2위인 두 나라의 갈등으로 가뜩이나 어려운 우리 경제 사정이 더 어려워지지 않을지 걱정인데요. 박대기 기자와 함께 지금 어떤 상황인지 알아봅니다. 박 기자, 코로나19를 극복하려면 세계가 힘을 모아도 힘든데, 다시 갈등이 재연됐군요?[기자] 지난해 미국과 중국의
무역전쟁 다들 기억하실 겁니다. 올해 초에 1단계 합의를 맺으면서 소강상태였는데요. 하지만 최근 갈등이 심화되는 모양새입니다. 이유는 두 가집니다. 먼저, 코로나19 발생은 중국 책임이라는 미국 입장이 있고요. 또 하나는 중국이 홍콩 보안법을 도입하겠다고 한 것입니다. 법 내용이 인권 침해적이고 중국이 약속한 일국 양제를 깬다는 것인데 근본적으로는 두 사안 모두 중국에 대한 불신이 깔렸습니다.[앵커] 그런 배경에서 미국이 다시 중국의 대표적인 기업, 화웨이 제재안을 발표한 것이죠? 그런데 화웨이로 반도체를 파는 것을 막아서 우리 기업도 해당하는 거 아니냐는 우려도 나오는데 어떨까요?[기자] 반도체 판매를 막은 것은 맞는데 한국기업은 해당이 안 됩니다. 반도체에는 여러 종류가 있는데요. 우리나라가 주로 만드는 것은 메모리반도체입니다. 이건 기성품이라 만들어진 대로 파는 겁니다. 그런데 비메모리 일부는 주문자의 설계대로 만들어주는 제품이 있습니다. 미국이 막은 것은 ""화웨이의 설계로 생산되는 반도체""이기 때문에 우리 주력제품과는 관계가 없죠. 이번 규제 도입 배경은 앞서 지난해 규제에 있습니다. 미국은 지난해 미국 기업이 화웨이로 반도체 등을 수출할 때 허가를 받으라고 규제했습니다. 그랬더니 화웨이가 필요한 반도체 설계도를
타이완의 TSMC 같은 업체에
보내서
조달했던 것입니다. 그래서 화웨이가 필요한 반도체를 설계대로 만들어주는 TSMC 같은 업체를 규제하려는 게 핵심입니다. 삼성전자도 설계대로 만들어주는 공장을 가지고는 있습니다. '파운드리'라고 하는 공장이 이런 공장인데요. 하지만 화웨이에는 메모리 반도체만 납품하고 비메모리 반도체는 납품하지 않기 때문에 규제에는 걸리지 않습니다.[앵커] 그럼 우리나라 업체들은 걱정할 필요가 없는 건가요?[기자] 당장은 그런데 무역전쟁이 장기화되면 안심할 수 없습니다. 특히 메모리반도체 중에 널리 쓰는 D램이 문제인데요. 세계 D램 생산은 우리나라의 두 업체와 미국의 마이크론, 단 3개 회사가 대부분을 차지합니다. 미국이 지난해 마이크론 D램의 화웨이 공급을 제한한 적이 있는데요. 나머지 두 업체인 우리 업체들의 화웨이 공급을 제한하면 화웨이가 사실상 생산 중단에 빠지기 때문에 미국이 규제 카드로 쓸 수도 있죠.[앵커] 지금은 아니지만 규제가 도입된다면 걱정스럽다는 것이군요. 반도체 수출에서 중국이 중요한 거죠?[기자] 그렇습니다. 우리나라 반도체 수출에서 중국이 차지하는 비율이 지난해 기준 40%가량 됩니다. 게다가 전체 수출 중 반도체가 차지하는 비율도 20%나 됩니다. 이외에도 우리 기업들이 중국 내에서 직접 생산하는 곳도 많은데요. 삼성전자와 SK하이닉스가 중국 시안과 충칭 등지에 반도체 공장을 가지고 있습니다. 이처럼 우리 반도체 기업과 중국이 떼려야 뗄 수 없는
관계에 있습니다.
코로나19 때문에 이달 들어 20일까지 우리나라의 수출은 1년 전보다 20% 이상 줄어든 상황입니다. 특히 자동차와 석유제품 판매가 반 토막이 난 상황인데요. 이런 가운데 반도체 수출은 10% 이상 늘면서 그나마 효자 노릇을 했습니다. 만에 하나 미국이 우리 반도체
수출까지 문제를 삼는다면 우리나라의 수출 부진은 앞으로 더 악화될 우려가 있습니다.[앵커] 우리나라 업체들이 미국의 규제 위험을 피해가려고 미국에 투자를 늘릴 거라는 분석도 있는데 어떻게 봐야 할까요?[기자] 실제로 타이완의 반도체 기업 TSMC는 최근에 미국에 새로 공장을 짓기로 했는데요. 트럼프 미국 대통령이 지난해 방한 당시에도 우리나라 기업 총수들을 직접 호명하면서 미국에 투자해달라고 부탁하기도 했죠. 이미 삼성전자는 미국 텍사스 주 오스틴에 공장이 있습니다. 추가 투자는 가능하지만, 반도체 공장 하나 건설하는데 1조 원 이상 들어가기 때문에 섣불리 결정하긴 어려운 상황입니다. 우리나라는 오랜 기간 자유무역의 이점을 살려 성장한 국가이기 때문에 관련국들의 갈등을 조정해나갈 필요가 있습니다.[앵커]잘 들었습니다.박대기 기자 (waiting@kbs.co.kr)",/news/news_read.nhn?article_id=0010841831&office_id=056&mode=search&query=SK하이닉스&page=3
▶ 네이버 홈에서 [한국경제TV] 채널 구독하기 [생방송보기]▶ 대한민국 재테크 총집결! - [증권 / 주식상담 / 부동산],"[한국경제TV 이민재 기자]메리츠증권이 내년 이익 턴어라운드 기대감 등을 반영해 하반기 코스피 상단이 2,250선이 될 것으로 내다봤다.강봉주 메리츠증권 연구원은 27일 보고서를 통해 ""하반기 코스피 상단 시나리오로는 투자자들의 내년 이익 턴어라운드 기대감으로 10%의 PER(주가수익비율) 상향과 12개월 예상 EPS(주당순이익)의 5% 상승 효과를 고려하면 코스피 2,223포인트를 전망한다""고 설명했다.강 연구원은 또 ""지난 2월부터 주도주 7형제라는 이름으로 삼성전자, SK하이닉스, NAVER, 카카오, 엔씨소프트, 삼성전기, 삼성SDI의 7종목이 뚜렷한 이익 성장세와 주가 모멘텀, 외국인의 지속적인 매수세에 힘입어 주도주 역할을 지속할 것으로 전망했었다""면서 ""이 중 NAVER, 카카오, 엔씨소프트는 추가 이익 개선, PER 리레이팅이 지속되며 하반기 코스피 전체적인 멀티플 상승을 이끌 것""이라고 분석했다.다만, 강 연구원은 ""하단 시나리오로는 내년 턴어라운드 기대감이 낮아지며 최대 PER이 현재의 11배에서 정체되고 EPS 5% 감소 효과가 반영된 코스피 1,829포인트를 전망한다""고 언급했다.이민재기자 tobemj@wowtv.co.krⓒ 한국경제TV, 무단 전재 및 재배포 금지",/news/news_read.nhn?article_id=0000873718&office_id=215&mode=search&query=SK하이닉스&page=3
,"[이데일리 유준하 기자] 한화투자증권은 27일 케이씨텍(281820)에 대해 반도체 전분야에 걸쳐 설비투자 확대가 예상됨에 따라 장비업체 수주가 늘어날 것으로 판단해 투자의견 ‘매수’를 유지하고 목표주가를 기존 2만4000원에서 16.6%(4000원) 올린 2만8000원으로 올려잡았다.케이씨텍의 올해 1분기 매출액과 영업이익은 각각 691억원, 97억원으로 전년 동기 대비 18.9%, 40.5% 증가했다. 이순학 한화투자증권 연구원은 “신종 코로나바이러스 감염증(코로나19)로 인해 중국향 디스플레이 장비 공급이 다소 지연됐음에도 불구하고 기록한 호실적”이라며 “반도체 장비와 소재 매출 비중이 각각 36%, 37% 차지하면서 실적 개선을 이끌었다”고 평가했다.이 연구원은 “반도체 장비 매출액은 249억원으로 2017~18년 반도체 투자 사이클 이후로는 최고치를 나타냈고 소재 매출액 역시 전년 동기 대비 20% 성장했다”면서 “영업이익률은 14%에 그쳤지만 일회성 충당금이 있었다는 점을 감안하면 양호한 수준”이라고 설명했다.이어 그는 “삼성전자(005930) 낸드 투자가 본격화되고 있고 SK하이닉스(000660)도 우시와 M15 팹(공장)에 디램과 낸드 투자를 진행하고 있어 동사의 평탄화공정(CMP) 장비 공급이 증가하고 있다”면서 “최근 발표된 삼성전자 평택 극자외선(EUV·Extreme Ultra Violet) 라인에도 CMP 장비 공급이 가시화되고 있어 긍정적”이라고 말했다.한편 한화투자증권이 추정한 올해 케이씨택의 매출액, 영업이익은 3396억원, 643억원으로 지난해보다 28.3%, 30.6%씩 증가한 수치다. 이 연구원은 “이는 2018년 최고 실적에 버금가는 수준으로 디램, 낸드, 파운드리 등 반도체 전분야에 걸친 설비투자 확대와 적층 증가, 공정의 미세화 등으로 인한 CMP 장비 수요 증가 수혜가 예상된다”면서 “제품별 예상 매출액은 반도체 장비 1250억원, 디스플레이 장비 976억원, 소재 1169억원으로 반도체 관련 비중이 증가하면서 수익성 개선도 기대된다”고 덧붙였다.유준하 (xylitol@edaily.co.kr)＜ⓒ종합 경제정보 미디어 이데일리 - 무단전재 & 재배포 금지＞",/news/news_read.nhn?article_id=0004649199&office_id=018&mode=search&query=SK하이닉스&page=3
,"[디지털타임스 박정일 기자] 올해 1분기 항공·스마트폰·디스플레이 등 주요 업종 대기업들의 생산실적이 급감한 것으로 나타났다. 글로벌 경기 침체에 코로나19 영향까지 겹치며 기업들의 생산실적이 크게 위축하고 있다는 분석이 나온다.27일 기업평가사이트 CEO스코어가 국내 500대 기업 가운데 분기보고서를 제출하고 생산능력과 생산실적을 공시하는 127개 기업을 조사한 결과, 올해 1분기 이들 기업의 평균 가동률은 81.4%로 지난해 1분기(85.2%)와 비교해 3.8%포인트 하락했다.이는 1분기 기업들의 생산능력 대비 생산실적이 작년보다 악화했다는 의미로, 글로벌 경기 침체 속에서 코로나19까지 확산하며 공장 가동을 중단하거나 생산(운송)량 조절에 나선 기업이 증가한 영향이다. 업종별로 보면 코로나로 인한 여행·출장 수요가 감소하면서 항공운송 부문이 가장 큰 타격을 받았다. 항공운송 부문의 생산실적(운항실적)은 작년보다 35.9% 감소해 전 산업군을 통틀어 감소폭이 가장 컸다.이어 스마트폰과 디스플레이가 지난해 같은 기간보다 각각 26.7%, 24.1% 줄었다. 이와 관련, 시장조사업체 카운터포인트는 1분기 세계 스마트폰 판매량은 2억9490만대로 작년 동기보다 13% 감소했고, 세계 1위인 삼성전자의 판매량 역시 지난해 같은 기간보다 19% 줄었다고 밝힌 적이 있다.생활용품의 경우 생산실적이 21.5% 감소했고 기타설비(-14.9%), 건설기계(-13.9%), 타이어(-12.0%), 자동차부품(-10.5%), 비료(-10.0%) 등도 코로나 등의 여파로 두 자릿수 감소율을 기록했다. CEO스코어 분석 결과 항공운송을 비롯해 자동차·스마트폰 등 국내 10개 주력업종 29개 부문 가운데 절반이 넘는 17개 부문의 생산실적이 작년보다 감소했다. 특히 스마트폰과 디스플레이 등 8개 부문은 올해 1분기 생산능력 자체를 작년보다 줄였는데도 가동률이 떨어진 것으로 나타났다. 상대적으로 반도체 부문은 선방했다. 코로나19 확산에 따른 '집콕' 수요와 온라인 수업 증가 등으로 올해 1분기 반도체 칩 생산실적은 34.9% 증가했다. 삼성전자의 반도체 사업부문의 경우 생산물량이 작년 1분기 1762억9900만개에서 올해 1분기 2774억5000만개로 57.4% 늘었는데도 100%를 가동했다. SK하이닉스도 반도체 생산능력을 작년보다 12.3% 늘렸으나 100% 생산목표를 달성했다. 코로나19가 호재로 작용한 택배(25.8%)와 석유화학(14.4%), 제약 부문(10.3%) 역시 생산실적이 10% 이상 증가했다. 기업별 생산실적을 보면 진에어가 작년보다 운항실적이 54.2% 급감해 감소율 1위에 올랐고 제주항공이 -46.8%로 2위를 기록하는 등 특히 저비용항공사(LCC)의 감소폭이 두드러졌다. 이어 아시아나항공(-33.4%)과 대한항공(-32.7%), ㈜한화(산업기계, -37.1%), 두산중공업(원자력, -34.1%), LG디스플레이(디스플레이, -28.1%), LG전자(휴대폰, -27.5%), 두산인프라코어(건설기계, -27.4%) 등이 감소율 상위 10위 안에 들었다. 이에 비해 1분기 세메스의 반도체장비 부문은 생산실적이 116.8% 증가했고, 엘에스아이앤디(권선 부문, 105.7%), ㈜한화(방산, 102.1%), LG이노텍(광학솔루션, 92.2%), 현대일렉트릭(전기전자, 83.8%), 효성첨단소재(산업자재, 65.5%), 삼성전자(반도체, 57.4%) 등은 생산실적이 증가해 대조를 이뤘다. 박주근 CEO스코어 대표는 ""기업들의 1분기 생산실적은 2분기 경영실적을 예측해볼 수 있는 중요 지표""라며 ""연초 코로나 팬데믹 여파가 항공·스마트폰·자동차 관련 기업들의 실적 악화로 이어질 가능성이 커졌다""고 말했다. 박정일기자 comja77@dt.co.kr 디지털타임스
/",/news/news_read.nhn?article_id=0002600567&office_id=029&mode=search&query=SK하이닉스&page=3
기관·외인 ‘팔자’…시총 상위주 하락세언택트·2차전지 대형주 2%대 하락,"[이데일리 김윤지 기자] 27일 코스피지수가 하락 출발했다. 외국인과 기관투자가의 동반 매도로 인해 지난 2거래일 간 상승세가 누그러졌다. 이날 마켓포인트에 따르면 오전 9시12분 현재 코스피지수는 전 거래일 대비 5.27포인트(0.26%) 내린 2024.51를 기록 중이다.서상영 키움증권 연구원은 “경제 재개 및 중국 부양정책 등이 전일 선반영이 된 점을 감안 매물 소화 과정은 불가피하다”고 설명했다. 유가증권시장에서 외인은 472억원, 기관은 1104억원을 순매도 중이다. 개인은 1576억원을 순매수 중이다. 프로그램 매매는 차익과 비차익을 합쳐 942억원 순매도 우위를 기록하고 있다.업종별로는 운수창고가 2% 넘게 오르고 있고 섬유의복, 의료정밀이 1%대 상승세를 그리고 있다. 건설업, 운수장비 등도 1% 미만으로 상승 중이다. 서비스업이 1% 넘게 빠지는 가운데 의약품, 전기전자, 통신업 등이 1% 미만으로 하락 중이다. 시가총액 상위 종목은 하락세다. 언택트 대형주 NAVER(035420)와 카카오(035720)가 2% 안팎으로 하락 중이며, 전일 큰 폭으로 상승한 LG화학(051910)과 삼성SDI(006400)도 2% 안팎으로 빠지고 있다. 삼성전자(005930)와 SK하이닉스(000660), 셀트리온(068270)이 1% 미만으로 하락 중이며, 삼성바이오로직스(207940)도 1%대 하락세를 그리고 있다. 지난 26일(미 동부 시각) 뉴욕증권거래소(NYSE)에서 다우존스 30 산업평균지수는 전장보다 529.95포인트(2.17%) 급등한 2만4995.11에 거래를 마쳤다. 스탠더드앤드푸어스(S&P) 500 지수는 전장보다 36.32포인트(1.23%) 상승한 2,991.77에, 기술주 중심의 나스닥은 15.63포인트(0.17%) 오른 9340.22에 장을 마감했다.김윤지 (jay3@edaily.co.kr)＜ⓒ종합 경제정보 미디어 이데일리 - 무단전재 & 재배포 금지＞",/news/news_read.nhn?article_id=0004649239&office_id=018&mode=search&query=SK하이닉스&page=3
