head,text,url
경제 재개·백신 개발 기대감,"[헤럴드경제=김현경 기자] 코스피가 27일 장중 2040선을 돌파했다. 글로벌 경제 재개와 코로나바이러스감염증-19(코로나19) 백신 개발 기대감이 지속되는 가운데 개인 투자자들이 대규모 순매수로 증시를 견인하고 있다.이날 오전 10시 10분 현재 코스피는 전거래일보다 12.90포인트(0.64%) 오른 2042.68을 가리켰다.지수는 전장보다 1.88포인트(-0.09%) 내린 2027.90으로 출발했으나 장 초반 상승세로 돌아서며 2043.44까지 올랐다. 코스피가 장중 2040선을 넘어선 것은 3월 6일 이후 54거래일 만이다.이날 현재 유가증권시장에서 개인은 2925억원을 순매수했다. 외국인은 1405억원, 기관은 1524억원을 순매도했다.시가총액 상위 종목 가운데는 삼성전자(+1.22%), SK하이닉스(+0.85%), 현대차(+1.43%)가 오르고 삼성바이오로직스(-1.55%), 네이버(-3.14%), LG화학(-1.69%) 등은 약세를 보였다.업종별로는 운수창고(+3.04%)가 전거래일에 이어 강세를 나타냈고 섬유의복(+2.66%), 기계(+2.50%), 은행(+1.91%) 등도 오름세를 보였다.같은 시각 코스닥지수는 전거래일보다 1.23포인트(0.17%) 오른 730.34를 나타냈다.지수는 전장보다 0.85포인트(-0.12%) 내린 728.26으로 출발했으나 반등해 보합세를 나타내고 있다.개인은 코스닥시장에서도 1847억원을 사들였다. 외국인은 1415억원, 기관은 291억원을 팔아치웠다.시총 상위종목 가운데는 알테오젠이 8.44% 급등하고 에이치엘비(+0.66%), CJ ENM(+2.45%), 에코프로비엠(+0.68%) 등도 상승세를 보였다.지난밤 뉴욕증시는 급등 마감했다.26일(현지시간) 뉴욕증권거래소(NYSE)에서 다우존스 30 산업평균지수는 전장보다 529.95포인트(2.17%) 상승한 24995.11에 거래를 마쳤다.스탠더드앤드푸어스(S&P) 500 지수는 전장보다 36.32포인트(1.23%) 상승한 2991.77에, 기술주 중심의 나스닥은 15.63포인트(0.17%) 오른 9340.22에 장을 마감했다.pink@heraldcorp.com
- Copyrights ⓒ 헤럴드경제 & heraldbiz.com, 무단 전재 및 재배포 금지 -",/news/news_read.nhn?article_id=0001678642&office_id=016&mode=search&query=SK하이닉스&page=2
중장기 관점에서 바라봐야 할 구간단기라면 SK하이닉스가 유리할 수도,[이데일리TV 성주원 기자] 27일 이데일리TV 굿머니는 코스피 시가총액 1위 삼성전자(005930)에 대한 투자전략을 정리했다. 중장기적인 관점에서 바라볼 필요가 있는 구간이며 외국인의 순매수 재개를 기다릴 필요가 있는 것으로 판단된다. 반도체주 중 단기 관점으로 본다면 SK하이닉스(000660)의 매력이 상대적으로 높을 수 있다. 매일 아침 7시 이데일리TV 굿머니 5월27일 방송성주원 (sjw1@edaily.co.kr)＜ⓒ종합 경제정보 미디어 이데일리 - 무단전재 & 재배포 금지＞,/news/news_read.nhn?article_id=0004649506&office_id=018&mode=search&query=SK하이닉스&page=2
작년 22조5000억 지급외국인 주주몫은 36%,"지난해 은행 등 지주회사가 반도체 업종을 제치고 12월 결산 상장법인 중 가장 많은 배당을 실시한 것으로 나타났다. 총 배당금은 22조원을 넘기는 했지만 7년 만에 감소세를 보였고, 이 가운데 외국인 주주에게 돌아간 배당금은 36.0% 수준을 기록했다.한국예탁결제원은 지난해 주주에게 현금배당(분기·중간배당 제외)을 지급한 12월 결산 코스피·코스닥 상장사는 총 1094곳이며 배당금은 22조5527억원으로 집계됐다고 27일 밝혔다. 총 배당금은 역대 최대를 기록했던 전년(22조9781억원)에 비해 1.9% 줄어든 것이다. 배당금이 전년 대비 감소한 것은 2012년(-0.8%) 이후 7년 만이다. 지난해 미·중 무역분쟁, 일본 수출규제 등 악재가 겹치면서 반도체를 비롯한 상장사 실적이 부진했기 때문으로 보인다.업종별로 보면 지주회사의 배당금이 3조8688억원으로 가장 많았다. 이는 총액의 17.2%에 해당한다. 그간 1위를 달렸던 반도체 제조업은 3조4964억원(15.5%)으로 2위로 밀려났다. 지주회사 배당금이 1년 전보다 30.5% 증가한 반면, 반도체 업종은 9.1% 감소하면서다. 주요 금융지주들이 지난해 역대 최대 실적을 기록하면서 배당 규모도 늘어난 것으로 풀이된다.지난해 외국인 주주에게는 1087곳이 총 8조1229억원을 배당했다. 전년 대비 4698억원(5.5%) 감소했지만, 전체 배당금 내 비중은 36.0%에 달했다. 다만 외국인 배당 비중은 2016년 41.0%로 정점을 찍은 이후 2017년 39.5%, 2018년 37.4% 등 매년 축소세를 보이고 있다.외국인 배당금이 가장 많은 기업은 1조4407억원을 배당한 삼성전자였다. 삼성전자와 함께 반도체 쌍두마차인 SK하이닉스의 외국인 배당금은 30.3% 급감한 3654억원으로 집계됐다. 순위는 3위에서 4위로 밀려났다.통상 외국인 지분이 많은 금융지주사들이 외국인 배당금 순위에서도 상위권을 차지했다. KB금융은 전년 대비 10.5% 증가한 5897억원을 배당해 2위를 유지했다. 이어 5731억원을 기록한 신한지주가 3위로 올라섰다. 하나금융지주는 2.3% 증가한 3189억원으로 전년에 이어 6위에 랭크됐다. 강승연 기자
- Copyrights ⓒ 헤럴드경제 & heraldbiz.com, 무단 전재 및 재배포 금지 -",/news/news_read.nhn?article_id=0001678763&office_id=016&mode=search&query=SK하이닉스&page=2
"코스피, 0.05% 내린 2028.81에 거래 중","[더팩트ㅣ박경현 기자] 국내 증시가 외국인과 기관의 쌍끌이 매도에 일제히 하락세로 전환했다.27일 오전 11시 33분 현재 코스피는 0.97포인트(-0.05%) 내린 2028.81에 거래 중이다. 코스피는 오전 중 상승 곡선을 보였지만 낙폭을 키우다 하락 전환했다.현재까지 개인 홀로 3477억 원을 사들인 반면 외국인과 기관은 각각 2394억 원, 1065억 원을 순매도 중이다.같은시각 코스닥은 4.30포인트(-0.59%) 내린 724.81을 나타내고 있다. 코스닥 역시 오전 중 혼조를 겪다가 현재 낙폭을 키우며 하락세를 보이고 있다.코스닥은 개인 홀로 3222억 원을 사들인 반면 외국인과 기관이 각각 2486억 원, 646억 원을 팔아치우고 있다.시가총액 상위종목 주가등락은 삼성전자(+0.81%)만 오름세를 보이고 있다. 반면 삼성바이오로직스(-2.02%), 네이버(-4.81%), 삼성전자우(-0.12%)는 하락세를, SK하이닉스 보합세에 거래 중이다.업종은 조선, 항공사, 에너지장비 및 서비스, 해운사가 3~5%가량 상승 중이다. 반면 양방향 미디어와 서비스, 전기제품, 건강관리기술은 2~4%가량 하락 중이다.pkh@tf.co.kr저작권자 ⓒ 특종에 강한 더팩트 & tf.co.kr 무단 전재 및 재배포 금지",/news/news_read.nhn?article_id=0000027185&office_id=629&mode=search&query=SK하이닉스&page=2
,"미국과 중국이 반도체를 놓고 맞붙으면서 한국 반도체 산업의 입지가 위기를 맞고 있다. 미국의 특히 장비 기술을 사용해야 하고 중국의 시장을 포기할 수 없다. 동시에 미국의 기술을 따라잡아야 하고 중국의 추격을 따돌려야 한다. 반도체 업계에서는 미·중간 신냉전 시대에 대비해 메모리는 '반도체 코리아'의 아성을 지키고 동시에 비메모리로 보폭을 내딛기 위한 치밀한 전략 마련을 서둘러야 한다고 지적한다.




먼저 ‘반도체 코리아’의 위상을 다시 살펴볼 필요가 있다. 지난해 전 세계 반도체 시장(매출 기준)은 4183억 달러(516조 5586억원), 이중 메모리 반도체가 26.7%(1116억 달러), 비메모리 반도체가 73.3%(3067억 달러)를 차지했다(시장조사업체 가트너). 반도체 시장이 대략 메모리 30%, 비메모리 70%의 비중으로 구성돼 있는 셈이다. 우리는 이 중 30% 시장의 강자일 뿐, 70% 시장의 점유율은 4%에 불과한 도전자다.




한국은 D램과 낸드플래시 위주의 메모리 반도체 시장에서 압도적인 점유율을 갖고 있다. 시장조사업체 트렌드포스에 따르면 올해 1분기 글로벌 D램 시장에서 삼성전자(44.1%)와 SK하이닉스(29.3%)의 점유율을 합치면 70%가 넘는다. 대부분의 국가에서 한국이 만든 D램을 사용하고 있는 셈이다. 적어도 메모리 분야에서만큼은 현재 한국을 위협할 나라가 없는 게 분명하다.



그러나 비메모리 시장으로 눈을 돌리면 이야기가 달라진다. 비메모리 반도체는 컴퓨터에 들어가는 CPU(중앙처리장치)나 스마트폰에 들어가는 AP(애플리케이션프로세서), 디지털 사진기에 들어가는 이미지센서 등 종류가 다양하다. 비메모리 시장은 이런 제품을 전문적으로 설계하는 팹리스(반도체 설계)와 파운드리(반도체 위탁생산) 사업으


 메모리 반도체는 미세 공정 기술 경쟁은 치열하고 가격의 부침이 심한 취약성을 갖고 있다. 2018년처럼 수요가 증가하면 가격이 폭등해 수퍼 호황을 누리지만 지난해처럼 시장이 침체하면 가격이 급락한다. 지난해 전 세계 반도체 시장에서 메모리를 앞세운 삼성전자가 64조9000억원(전체 시장 규모의 약 12%)을 쓸어담았지만, CPU를 앞세운 인텔(매출 약 80조9000억원·15%)에 반도체 기업 1위 자리를 내준 이유다.


 반면 설계(팹리스)와 위탁생산(파운드리)으로 양분되는 비메모리는 기술 장벽이 높고 가격도 안정적이다. 특히 성장가능성도 크다. 비메모리 분야는 5G 통신과 인공지능(AI), 자율주행차, 사물인터넷(IoT)의 등장에 따라 더욱 수요가 늘어날 것으로 전망된다. 한국 반도체 산업이 메모리 위주로 형성된 이유는 1970년대 반도체 투자 초기 일본을 따라 메모리에 집중했기 때문이란 분석이다. 메모리에 비해 상대적으로 투자 비용도 많고 기술 장벽이 높은 비메모리에 섣불리 뛰어들지 못한 결과다.



미·중 반도체 패권 충돌로 우리의 메모리 1위 입지는 갈수록 불안한 상황이다. 중국이 우선 메모리 반도체 자급자족을 외치며 막대한 자본을 투입하며 맹추격해오고 있기 때문이다. 중국 창신 메모리 테크놀로지(CXMT)는 지난해 상반기에만 D램(8GB DDR4) 생산 자주화를 위해 34조원을 투입했다. 또 YMTC(양쯔 메모리 테크놀로지)는 128단 적층형 낸드플래시 메모리를 지난달 공개하고 연말 양산을 공언했다. 128단 낸드는 삼성이나 하이닉스가 지난해부터 양산하기 시작했다. 박재근 한국 반도체ㆍ디스플레이기술학회장(한양대 융합전자공학부 교수)은 ""중국의 양산기술은 우리와 꽤 차이가 있긴 하지만, 기술 수준을 따라잡는 속도가 예상했던 것보다도 훨씬 빠르다""고 경계했다.




또 우리가 도전장을 낸 비메모리 시장에서는 미국이 기술 장벽을 높이고 있다. 미국은 우선 중국을 향해 미국 장비나 설계 기술이 담긴 제품의 대 중국 수출을 규제하기로 했다. 또 인텔이나 퀄컴 등의 비메모리칩을 위탁생산하는 대만 TSMC한테는 미국 내 공장 설립을 압박해 굴복시켰다. 미국이 우세한 장비 기술이나 파운드리 시장에서 큰손으로서의 입지를 앞세워 비메모리 분야의 반도체 패권에 도전하는 나라는 언제든지 가로막을 수 있다는 의지를 드러내 보인 것이다.


 하지만 비메모리는 한국 반도체가 가야 할 길이다. 삼성전자도 지난해 '반도체 비전 2030'을 내걸고 2030년까지 10년간 130조원을 투자해 비메모리 시장 1위를 달성하겠다고 선포했다. 삼성의 전략은 파운드리 시장을 우선 공략하는 것이다. 비메모리 반도체 중 설계분야에선 CPU와 AP 설계 1위 기업인 미국 인텔이나 퀄컴을 단번에 따라잡는 게 쉽지 않은 상황에서 그나마 파운드리 분야의 경쟁력을 확보하고 있기 때문이다.


 삼성이 파운드리 시장에서 입지를 다지기 위해서는 대만의 TSMC라는 커다란 산을 넘어야 한다. 파운드리 시장에서 올 1분기 삼성의 점유율은 15.9%지만 TSMC는 54.1%로 절반이 훌쩍 넘는다. 삼성은 파운드리 시장에서 경쟁력을 좌우하는 7나노 이하 미세 공정 기술에 기대를 걸고 있다. 7나노 기술을 보유한 TSMC의 유일한 경쟁자가 삼성이고, 삼성과 TSMC는 5나노 공정 기술을 놓고도 선점 경쟁을 펼치는 중이다.




한국이 반도체 강국 입지를 다지려면 메모리와 비메모리에 대해 균형을 잡고 투자를 계속해야 한다는 게 전문가들의 지적이다. 또 반도체 경쟁력을 확보할 수 있는 인재 양성도 필수적이다. 이종호 서울대 반도체공동연구소장은 ""메모리 분야에선 케파(생산 능력)를 늘리는 초격차 전략을 내세운다면, 비메모리 분야에선 우수한 인재를 많이 길러내 '신격차'를 만들어내야 한다""고 지적했다. 그는 또 ""반도체는 IT의 기간산업이고 한번 무너지면 재건이 매우 힘들다""면서 ""장기적인 안목을 갖고 반도체 분야의 전문 인력 양성이 중요하다""고 강조했다.



장주영 기자 jang.jooyoung@joongang.co.kr

▶ ▶ ▶ ⓒ중앙일보(https://joongang.co.kr), 무단 전재 및 재배포 금지",/news/news_read.nhn?article_id=0003004152&office_id=025&mode=search&query=SK하이닉스&page=2
▶ 헉! 소리나는 스!토리 뉴스 [헉스]▶ '아는 척'하고 싶은 당신을 위한 [두유노우],"[파이낸셜뉴스] 코스피가 개인 매수세에 힙입어 강보합세가 이어지고 있다.
 27일 오후 1시16분 기준 코스피는 2.23포인트(0.11%) 오른 2032.18을 기록 중이다. 이날 코스피는 전장보다 1.88포인트(-0.09%) 내린 2027.90로 출발했다.
 개인은 3729억을 순매수 하며 코스피를 끌어 올리고 있다. 반면 외국인과 기관은 각각 2732억원, 937억원 순매도 했다.
 규모별로 대형주(0.03%), 중형주(0.81% ), 소형주(0.41%) 모두 상승했다. 업종별로 섬유의복(3.16%), 기계(2.70%), 운수장비(1.97%) 등이 상승세다. 반면 의약품(-1.18%), 의료정밀(-0.45%) 등은 하락세다.
 시가총액 상위종목별로 삼성전자(1.12%), 현대차(0.41%), 포스코(1.99%) 등이 상승세다. 반면 SK하이닉스(-0.12%), 네이버(-3.97%) 등은 하락세다.
 코스닥은 전거래일 대비 3.36포인트(0.46%) 내린 725.82를 기록하고 있다.



 ※ 저작권자 ⓒ 파이낸셜뉴스. 무단 전재-재배포 금지",/news/news_read.nhn?article_id=0004432186&office_id=014&mode=search&query=SK하이닉스&page=2
,"환율 갈등·무역 분쟁 격화로 수출 감소 등 타격 미칠까 긴장 (서울=연합뉴스) 산업팀 = 미국과 중국의 패권 다툼이 환율 전쟁을 포함한 본격적인 무역 전쟁으로 치달을 조짐을 보이면서 국내 수출 기업들이 긴장하고 있다.

위안화 환율 상승이 당장 우리 기업에 악영향을 미칠 가능성은 낮지만 미국과 중국간 분쟁이 갈수록 격해지고 장기화할 조짐을 보이면서 국내 수출 전선에도 악영향을 미칠 가능성이 커졌기 때문이다.

 특히 미국이 최근 중국 통신기업 화웨이에 대한 제재 강화를 예고한 데 이어 홍콩보안법이 미중 갈등의 뇌관으로 부상하는 등 미중간 일촉즉발의 긴장이 이어지면서 국내 산업계가 안갯속으로 빠져들고 있다.◇ 산업계 ""위안화 평가절하의 영향은 제한적""

 지난해 한국은행 경제연구원이 발간한 '중국 위안화 환율 변동이 한국 수출에 미치는 영향' 보고서에 따르면 위안화 가치가 10% 떨어지면 경제협력개발기구(OECD) 시장에서 경쟁 수준 상위 10%인 한국 제품의 수출은 0.626% 감소하는 것으로 나타났다.

특히 중국과 경합도가 높은 석유 및 석유화학제품, 전자제품, 기계류, 철강산업 등의 영향이 클 것으로 예상됐다.

그러나 산업계는 당장 위안화 가치 하락으로 인한 국내 수출기업들의 타격은 크지 않을 것으로 보고 있다.

 반도체는 물론, 중국 시장 의존도가 높은 석유화학 제품들도 대부분 달러를 통해 결제가 이뤄져 우려하는 것보다 위안화 변동에 따른 영향이 크지 않다는 것이다.

특히 원화의 경우 위안화와 동조하는 경향이 있어 위안화 환율이 오르면(위안화 가치 하락) 일시적인 원화 약세로 국내 기업들의 수출 경쟁력에 도움이 될 가능성도 있다.

우리 수출 주력 상품인 반도체나 스마트폰의 경우 중국 기업들과 직접적으로 글로벌 시장에서 경쟁하는 경우도 많지 않다.

전자업계의 한 관계자는 ""유럽에서 스마트폰이 삼성전자와 화웨이가 1, 2위를 다투는 정도이지 가장 큰 시장인 미국과 중국에서는 중국 기업과 우리 기업간 경쟁은 거의 없다고 보면 된다""며 ""환율로 인한 타격은 크지 않다""고 말했다.

한국무역협회 관계자도 ""한국 제품과 중국 제품은 그동안 가격으로 경쟁한 것이 아니라 한국 제품이 중국보다 품질이 우수해 다소 높은 가격을 감수하고서라도 구매했던 것""이라며 위안화 가치 하락에 따른 수출 영향은 크지 않을 것으로 예상했다.◇ 미중간 무역 분쟁 악화 여부에 '촉각'

산업계는 위안화 가치 하락보다는 최근 악화하는 미·중 간 무역분쟁을 우려하고 있다.

 양대 강국의 갈등이 격화될수록 '샌드위치' 신세인 국내 기업들로 불똥이 튈 가능성이 크다는 것이다.

 미국은 앞서 우방국들로 산업 공급망을 재편하려는 '경제번영 네트워크(EPN·Economic Prosperity Network)에 한국의 참여를 요구할 것으로 알려져 대중국 수출 감소나 미국에 대한 투자 압박으로 확대될 가능성이 커진 상황이다.

전경련 관계자는 ""미중 환율 전쟁이 심화되면 보호무역주의가 강해져 우리 기업들에는 전반적으로 비우호적인 환경이 될 우려가 있다""며 ""현재는 위안화 절하가 중국 정부 개입의 결과가 아니라 중국 경기 부진에 따른 것이란 의견이 있지만 설사 후자라고 해도 미국이 무역갈등으로 몰고 갈 가능성이 있다""고 우려했다.

 작년처럼 미국이 중국을 환율조작국으로 지정하는 본격적인 환율 전쟁으로 치달을 경우 상호 간 강도높은 무역 제재로 인해 우리나라 경제와 수출 기업들에 타격을 줄 수 있다.

일단 산업계는 상황을 예의주시하며 대응책을 모색 중이다.

반도체 업계의 관계자는 ""현재는 미국의 제재 대상이 화웨이지만 환율 갈등이 격화하면 제재 대상이 확대될 가능성을 배제할 수 없다""며 ""대형 거래선이 타격받으면 연쇄 영향을 받을 수밖에 없다""고 말했다.

이 관계자는 그러면서 ""미중 분쟁 격화는 장기적으로 경기 하강으로 이어질 것""이라고 우려했다.

석유화학 업계도 코로나19로 글로벌 시장 수요가 감소하는 데 따른 직격탄을 맞고 있는 가운데, 미중 갈등에 따른 수출 감소를 우려하고 있다.

 중국이 가공해 미국 등 해외로 수출하는 각종 소비재에는 국내 석유화학사들이 생산한 석유화학 제품이 원료로 사용되고 있어서다.

 미중 무역분쟁이 격화돼 중국의 수출길이 막히면 연쇄적으로 국내 석유화학 기업들의 매출도 감소할 수밖에 없다.

석유화학 업계의 한 관계자는 ""코로나19로 급감했던 수요가 조금씩 되살아나고 곤두박질쳤던 유가도 오르며 업황 개선의 기대감을 키우고 있었는데 미중 갈등 격화라는 새로운 불확실성이 나날이 커지고 있어 걱정""이라고 말했다.

 철강업계도 미중 무역갈등을 예의주시하고 있다.

철강업계의 관계자는 ""중국이 많이 따라왔지만 국내 철강사들이 여전히 기술적으로 우위에 있어 중국과 수출 품목이 겹치지는 않는다""면서 ""당장 위안화 가치 하락으로 영향을 받는 것은 아니지만, 장기적으로 미·중 간 갈등 움직임을 지켜보고 있다""고 말했다.

자동차는 중국의 수출품이 아닌 만큼 위안화 평가 절하 등 무역·환율 전쟁에서 당장 영향은 크지 않다.

 자동차 업계에서는 오히려 중국 내수경제 부양효과가 있을 경우 현대·기아차의 중국 판매 증가도 기대하고 있다.

그러나 중국 자동차 시장에서 경쟁이 치열해지고 있어 경기 개선이 곧 현대기아차 실적으로 이어진다고 장담할 수 없고, 오히려 미중 무역갈등이 심화하면 불확실성이 확대되며 그에 따른 부작용이 클 수 있다고 우려한다. ◇ '홍콩보안법' 유탄 맞나 긴장

반도체 업계 등은 미국과 중국의 또 다른 갈등 요인인 홍콩보안법에 주목한다.

 미국이 중국의 홍콩 국가보안법 제정 강행을 저지하기 위해 무역과 투자 등과 관련해 홍콩에 부여했던 특별지위를 박탈하겠다고 경고하고 나선 때문이다.

 도널드 트럼프 미국 대통령은 26일(현지시간) 홍콩보안법 제정을 둘러싼 갈등과 관련해 이번 주중 강력한 대응 조치를 내놓을 계획이라고 압박했다.

 미국이 홍콩의 특별지위를 박탈할 경우 삼성전자나 SK하이닉스 등 메모리 반도체 기업의 중국 수출에 차질이 발생할 수 있다.

한국무역협회에 따르면 지난해 기준 우리나라의 홍콩 수출액은 319억달러에 달한다. 중국과 미국, 베트남 다음으로 4번째 수출국이다.

우리나라의 홍콩 수출 가운데 반도체와 메모리 반도체가 차지하는 비중이 각각 69.8%, 55.5%로 수출 비중이 특히 높다.

특히 홍콩은 대중국 수출의 중요한 우회지다. 2018년 기준 홍콩에서 수입한 한국 제품 가운데 82.6%가 중국으로 재수출되는 것으로 조사됐다.

 홍콩이 세계 3위 금융허브인 만큼 자금 조달이 용이하고, 무관세 혜택 및 낮은 법인세, 중국과 직접 거래에 따른 법적·제도적 리스크 완화 등의 이점이 있어서다.

 홍콩으로 가는 물량의 상당수가 중국을 목적지로 하는 만큼 홍콩과 본토 간 갈등이 장기화하면 우리 수출도 영향을 받을 수밖에 없다.

 무역협회 이유진 연구원은 ""지난해 홍콩송환법 때와 달리 미국 트럼프 대통령이 재선을 의식해 더 강경하게 나오고 있다. 미·중 간, 홍콩과 중국 본토 간 갈등이 더욱 격화해 물류까지 영향을 받을 경우 한국 수출 역시 영향을 받을 수밖에 없을 것""이라고 말했다.

미국이 실제로 홍콩에 부여한 특별 지위를 박탈할 경우 홍콩이 물류나 금융허브로서 기능을 상실할 가능성이 커 홍콩을 거쳐 중국으로 가는 한국 수출 전략도 다시 정비해야 할 것으로 전문가들은 보고 있다.

 반도체 업계의 한 관계자는 ""미국의 홍콩에 대한 제재가 현실화할 경우 수출 방식에 변화가 불가피하다""며 ""공급 차질 등 최악까지 갈 가능성은 적어 보이지만 물류비 증가 등의 불편은 있을 수 있다""고 말했다.

sms@yna.co.kr",/news/news_read.nhn?article_id=0011637257&office_id=001&mode=search&query=SK하이닉스&page=2
