head,text,url
21일 오후 2시까지 원서 접수 가능,"[서울=뉴시스] 오동현 기자 = 엔씨소프트가 2020년 하계 인턴사원을 공개 모집한다.인턴사원 지원자들은 8일부터 21일 오후 2시까지 엔씨 채용 사이트에서 원서를 접수할 수 있다.모집 분야는 총 18개 부문이다. ▲게임 개발 ▲서비스 플랫폼 개발 ▲Game AI ▲Speech AI ▲Vision AI ▲Knowledge AI
▲Language AI ▲데이터 엔지니어링(Data Engineering) ▲게임 기획 ▲컨셉 아트(Concept Art) ▲서비스 UX 기획 ▲엔터테인먼트 콘텐츠 기획 ▲개발 관리(Project Management) ▲게임 사업 ▲시큐리티 엔지니어링(Security Engineering) ▲시스템 엔지니어링(System Engineering) ▲인사 ▲홍보 등에 지원할 수 있다.채용 절차는 입사지원서 접수 및 서류 전형, NC TEST(온라인 인성 검사), 면접 순으로 진행한다. 지원자는 28일 서류 전형 결과를 확인할 수 있다.엔씨의 인턴십 프로그램은 채용연계형 프로그램이다. 최종 합격자는 7월 초부터 7주간 인턴십 프로그램에 참여한다. 인턴십 우수 수료자에게는 ‘엔씨 플래그십(NC Flagship)’ 제도를 통해 장학금 혜택과 2021년도 신입사원으로 입사할 수 있는 기회가 주어진다.엔씨는 다양한 언택트(Untact) 방식으로 채용정보를 제공한다. 지원 희망자는 12일, 13일 이틀간 열리는 ▲‘온라인 1:1 직무상담회’에 참여할 수 있다. 온라인 화상회의 플랫폼 ‘줌(Zoom)’을 통해 모집 분야별 선배 사원들과 1:1 화상 대화 형식으로 진행한다. 지원서를 작성하면서 궁금했던 점이나 팁 등을 직접 질문할 수 있다.엔씨는 ‘독취사’(네이버 취업카페)에서 채용 담당자와 ‘온라인 서면 인터뷰’도 진행한다. 인턴 채용전형과 근무환경, 지원서 관련 질문사항, 팁 등 정확한 정보를 얻을 수 있다. 13일까지 카페 내 상담 게시물에 댓글로 질문을 남기면, 15일 채용 담당자의 답변을 별도 포스팅으로 확인할 수 있다.엔씨는 지원 희망자들에게 추가 정보를 제공하기 위해 총 3편의 영상 콘텐츠를 공식 SNS 채널에 선보일 예정이다. 인턴십 프로그램 소개, 인턴 선배들의 인터뷰, 주요 질문들을 모은 Q&A 리뷰 등 3편의 영상을 통해 인턴 프로그램에 대한 궁금증을 해소할 수 있다.구현범 엔씨 CHRO(최고인사책임자)는 “다양한 방식으로 채용 정보를 소통해 우수한 인재와 함께 할 수 있도록 준비하고 있다”며 “엔씨와 함께 최고의 작품을 만들어 나갈 도전정신 넘치는 지원자들을 기다린다”고 말했다. odong85@newsis.com<ⓒ 공감언론 뉴시스통신사. 무단전재-재배포 금지>",/news/news_read.nhn?article_id=0009852410&office_id=003&mode=search&query=엔씨소프트&page=1
21일 오후 2시까지 엔씨 채용 사이트서 원서 접수,"[아시아경제 이진규 기자] 엔씨소프트(이하 엔씨)가 2020년 하계 채용연계형 인턴사원을 공개 모집한다.인턴 지원자들은 8일부터 21일 오후 2시까지 엔씨 채용 사이트에서 원서를 접수할 수 있다. 모집 분야는 모두 18개 부문이다. 게임 개발을 비롯해 ▲서비스플랫폼 개발 ▲게임 인공지능(AI) ▲스피치 AI ▲Vision AI ▲Knowledge AI
▲Language AI ▲데이터 엔지니어링 ▲게임 기획 ▲콘셉트 아트 ▲서비스 UX 기획 ▲엔터테인먼트 콘텐츠 기획 ▲개발 관리(PM) ▲게임 사업 ▲시큐리티 엔지니어링 ▲시스템 엔지니어링 ▲인사 ▲홍보 등이다.채용 절차는 입사지원서 접수와 서류 전형, 온라인 인성 검사(NC TEST), 면접 순으로 진행한다. 지원자는 오는 28일 서류전형 결과를 확인할 수 있다. 이번 인턴십 프로그램은 채용연계형 프로그램이다. 최종 합격자는 7월 초부터 7주간 인턴십 프로그램에 참여한다. 인턴십 우수 수료자에겐 '엔씨 플래그십' 제도를 통해 장학금 혜택과 2021년도 신입사원으로 입사할 수 있는 기회가 주어진다.엔씨는 다양한 비대면(언택트) 방식으로 채용정보를 제공한다. 지원 희망자는 12~13일 열리는 온라인 1대1 직무상담회에 참여할 수 있다. 온라인 화상회의 플랫폼 '줌'을 통해 모집 분야별 선배 사원들과 1대1 화상대화 형식으로 진행한다. 지원서를 작성하면서 궁금했던 점이나 팁 등을 직접 질문할 수 있다.엔씨는 네이버 취업카페 '독취사'에서 채용 담당자와 온라인 서면 인터뷰도 진행한다. 또 지원 희망자들에게 추가 정보를 제공하기 위해 총 3편의 영상 콘텐츠를 공식 소셜네트워크서비스(SNS) 채널에 선보일 예정이다. 구현범 엔씨 최고인사책임자(CHRO)는 ""다양한 방식으로 채용정보를 소통해 우수한 인재와 함께 할 수 있도록 준비하고 있다""며 ""엔씨와 함께 최고의 작품을 만들어 나갈 도전정신 넘치는 지원자들을 기다린다""고 말했다.이진규 기자 jkme@asiae.co.kr <ⓒ경제를 보는 눈, 세계를 보는 창 아시아경제 무단전재 배포금지>",/news/news_read.nhn?article_id=0004674614&office_id=277&mode=search&query=엔씨소프트&page=1
▶ 헉! 소리나는 [헉스] ▶ '너 그거 아니?' [두유노우]▶ 지금 파이낸셜뉴스 채널 구독하고 경품 GET!,"[파이낸셜뉴스] ㈜엔씨소프트가 2020년 하계 인턴사원을 공개 모집한다고 8일 밝혔다.
 인턴사원 지원자들은 8일부터 21일 오후 2시까지 엔씨 채용 사이트에서 원서를 접수할 수 있다.
 모집 분야는 총 18개 부문이다. 게임 개발, 서비스 플랫폼 개발, Game AI, Speech AI, Vision AI, Knowledge AI, Language AI, 데이터 엔지니어링, 게임 기획, 컨셉 아트, 서비스 UX 기획, 엔터테인먼트 콘텐츠 기획, 개발 관리(PM), 게임 사업, 시큐리티 엔지니어링, 시스템 엔지니어링, 인사, 홍보 등에 지원할 수 있다.
 채용 절차는 입사지원서 접수 및 서류 전형, 온라인 인성 검사(NC TEST), 면접 순으로 진행한다. 지원자는 오는 28일 서류 전형 결과를 확인할 수 있다.
 엔씨의 인턴십 프로그램은 채용연계형 프로그램이다. 최종 합격자는 7월 초부터 7주간 인턴십 프로그램에 참여한다. 인턴십 우수 수료자에게는 ‘엔씨 플래그십’ 제도를 통해 장학금 혜택과 2021년도 신입사원으로 입사할 수 있는 기회가 주어진다.
 엔씨는 다양한 언택트 방식으로 채용정보를 제공한다. 지원 희망자는 12일, 13일 이틀간 열리는 ‘온라인 1:1 직무상담회’에 참여할 수 있다. 온라인 화상회의 플랫폼 ‘줌’을 통해 모집 분야별 선배 사원들과 1:1 화상 대화 형식으로 진행한다. 지원서를 작성하면서 궁금했던 점이나 팁 등을 직접 질문할 수 있다.
 엔씨는 ‘독취사’(네이버 취업카페)에서 채용 담당자와 ‘온라인 서면 인터뷰’도 진행한다. 인턴 채용전형과 근무환경, 지원서 관련 질문사항, 팁 등 정확한 정보를 얻을 수 있다. 13일까지 카페 내 상담 게시물에 댓글로 질문을 남기면, 15일 채용 담당자의 답변을 별도 포스팅으로 확인할 수 있다.



 ※ 저작권자 ⓒ 파이낸셜뉴스. 무단 전재-재배포 금지",/news/news_read.nhn?article_id=0004421099&office_id=014&mode=search&query=엔씨소프트&page=1
,"[이데일리 노재웅 기자] 엔씨소프트(036570)는 2020년 하계 인턴사원을 공개 모집한다고 8일 밝혔다. 인턴사원 지원자들은 이날부터 5월21일 오후 2시까지 엔씨 채용 사이트에서 원서를 접수할 수 있다.모집 분야는 총 18개 부문이다. △게임 개발 △서비스 플랫폼 개발 △게임 인공지능(AI) △스피치 AI △비전 AI △지식 AI △언어 AI △데이터 엔지니어링 △게임 기획 △컨셉 아트 △서비스 UX 기획 △엔터테인먼트 콘텐츠 기획 △개발 관리(PM) △게임 사업 △시큐리티 엔지니어링 △시스템 엔지니어링 △인사 △홍보 등에 지원할 수 있다.채용 절차는 입사지원서 접수 및 서류 전형, NC TEST(온라인 인성 검사), 면접 순으로 진행한다. 지원자는 5월28일 서류 전형 결과를 확인할 수 있다.엔씨의 인턴십 프로그램은 채용연계형 프로그램이다. 최종 합격자는 7월 초부터 7주간 인턴십 프로그램에 참여한다. 인턴십 우수 수료자에게는 ‘엔씨 플래그십(NC Flagship)’ 제도를 통해 장학금 혜택과 2021년도 신입사원으로 입사할 수 있는 기회가 주어진다.엔씨는 다양한 언택트(Untact) 방식으로 채용정보를 제공한다. 지원 희망자는 5월 12일, 13일 이틀간 열리는 △‘온라인 1대:1 직무상담회’에 참여할 수 있다. 온라인 화상회의 플랫폼 ‘줌(Zoom)’을 통해 모집 분야별 선배 사원들과 1대1 화상 대화 형식으로 진행한다. 지원서를 작성하면서 궁금했던 점이나 팁 등을 직접 질문할 수 있다.엔씨(NC)는 ‘독취사’(네이버 취업카페)에서 채용 담당자와 ‘온라인 서면 인터뷰’도 진행한다. 인턴 채용전형과 근무환경, 지원서 관련 질문사항, 팁 등 정확한 정보를 얻을 수 있다. 5월13일까지 카페 내 상담 게시물에 댓글로 질문을 남기면, 15일 채용 담당자의 답변을 별도 포스팅으로 확인할 수 있다.구현범 엔씨 CHRO(최고인사책임자)는 “다양한 방식으로 채용 정보를 소통하여 우수한 인재와 함께 할 수 있도록 준비하고 있다”며 “엔씨와 함께 최고의 작품을 만들어 나갈 도전정신 넘치는 지원자들을 기다린다”고 말했다.노재웅 (ripbird@edaily.co.kr)＜ⓒ종합 경제정보 미디어 이데일리 - 무단전재 & 재배포 금지＞",/news/news_read.nhn?article_id=0004635887&office_id=018&mode=search&query=엔씨소프트&page=1
"개인, 차익실현 나서..나홀로 순매도의료정밀 3% 올라..운수장비·섬유의복·보험업종↑","[이데일리 오희나 기자] 코스피 지수가 상승 마감했다. 코로나19 둔화로 인한 경제 재개 기대감이 작용하면서 오랜만에 외국인과 기관의 쌍끌이 매수세가 유입됐다.
 8일 마켓포인트에 따르면 코스피 지수는 전 거래일 대비 17.21포인트(0.89%) 오른 1945.82로 마감했다. 이날 코스피는 1944.94로 상승 출발했다. 외국인과 기관의 매수세가 유입되면서 장중 1950선까지 올랐으나 오후 들어 상승폭이 다소 축소되면서 1945선으로 거래를 마쳤다.

뉴욕증시에서 주요 지수는 중국 수출 호조와 미국 실업자 증가 속도 둔화에 힘입어 상승했다.7일(현지시간) 뉴욕증권거래소(NYSE)에서 다우존스 30 산업평균지수는 전장보다 211.25포인트(0.89%) 상승한 2만3875.89에 거래를 마쳤다.스탠더드앤드푸어스(S&P) 500 지수는 전장보다 32.77포인트(1.15%) 오른 2881.19에, 기술주 중심의 나스닥은 125.27포인트(1.41%) 상승한 8979.66에 장을 마감했다.수급별로는 외국인과 기관이 각각 437억원, 1739억원 순매수를 기록했다. 개인은 2444억원 순매도를 보였다. 프로그램은 차익이 286억원 순매도, 비차익이 257억원 순매도를 보이면서 543억원 매도우위를 보이고 있다. 대부분의 업종이 오른 가운데 의료정밀이 3% 이상 올랐고 운수장비, 섬유의복, 보험, 제조업, 의료정밀, 전기전자, 찰강및금속, 기계, 화학, 비금속광물, 서비스업, 금융업, 운수창고 업종 등의 상승세가 컸다. 반면 음식료품, 전기가스 업종은 유일하게 내렸다. 시가총액 상위 종목 가운데 삼성전자(005930)는 보합세로 마감했고 SK하이닉스(000660) 삼성바이오로직스(207940) 셀트리온(068270) LG생활건강(051900) 현대차(005380) 삼성물산(028260) 삼성SDI(006400) 현대모비스(012330) 엔씨소프트(036570) KB금융(105560) 등은 올랐다. 반면 NAVER(035420) LG화학(051910) 한국전력(015760) 삼성에스디에스(018260) 등은 하락했다. 이날 거래량은 7억7519만주, 거래대금은 7조8258억원으로 집계됐다. 상한가 종목은 없고 588개 종목이 상승했다. 하한가 종목 없이 227개 종목이 하락했다. 82개 종목은 보합권에서 거래를 마쳤다.오희나 (hnoh@edaily.co.kr)＜ⓒ종합 경제정보 미디어 이데일리 - 무단전재 & 재배포 금지＞",/news/news_read.nhn?article_id=0004635924&office_id=018&mode=search&query=엔씨소프트&page=1
,"정보기술(IT)업계에 신종 코로나바이러스 감염증(코로나19) 확산 비상등이 켜졌다. 지난 6일 코로나19 확진 판정을 받은 경기도 용인 20대 남성(용인66번 확진자)이 다니던 IT기업에서 추가 확진자가 나와서다. IT기업 본사가 몰려 있는 경기 성남시 분당구 일대를 중심으로 코로나19가 확산되는 것 아니냐는 우려마저 나온다.


중앙재난안전대책본부는 8일 오전 브리핑에서 ""용인 확진 환자의 직장동료 1명과 클럽에서 접촉한 12명의 확진이 확인됐다""고 밝혔다.



용인 확진자가 재직 중인 경기도 분당구 금곡동 소재 IT회사는 총 2명의 확진자가 나온 8일 오전부터 회사 건물을 폐쇄하고 전 직원 무기한 재택근무에 돌입했다. 이 회사는 PC 운영체제(OS)를 만드는 중견 소프트웨어 회사다. 이 회사 건물에서 근무한 사람은 1000여명이다. 이중 용인 확진자의 사내 밀접접촉자로 분류된 직원은 44명이다. 이날 추가 확진 판정을 받은 1명을 제외하고 나머지 43명은 음성 판정을 받았다.


회사 관계자는 ""이전까지는 의심 증상이 있는 직원만 재택근무하고, 혼잡한 시간을 피해 출근 시간을 조정하는 탄력 근무제를 시행해 왔다""며 ""전 직원 재택근무가 처음이라 조금 혼란스럽지만, 상황이 상황인 만큼 스마트 워크(원격근무)를 할 수 밖에 없다""고 말했다.



 이 같은 사실이 공개된 8일 직장인 익명 커뮤니티 '블라인드'와 지역 맘 카페에는 회사 직원이 작성한 것으로 추정되는 비판 글이 올라왔다. 해당 작성자는 '확진자가 나온 부서만 감염 여부를 검사했다''다른 사업장은 폐쇄하지 않았다''사택에서 직원들이 단체 숙식한다'는 등의 의혹을 제기했다.


그러나 회사 관계자는 이를 부인했다. 그는 ""확진자가 나온 부서 외에도 밀접접촉자로 분류된 44명을 전부 검사했으며, 미금(금곡동)·수내·오리·선릉 4개 사업장을 모두 폐쇄했다""고 설명했다. 이어 ""확진자 2명 모두 금곡동 회사 근처 임대 아파트(사택)에 거주한 적이 없다""며 ""사택은 거실만 공동으로 쓰고 화장실·세탁·조리공간 등 위생 시설은 전부 각자 따로 쓰는 구조""라고 말했다. 현재 사택에는 금곡동 사업장 직원 300여명이 거주하고 있다. 이 관계자는 ""온라인상에 확인되지 않은 소문과 직원 신상 정보가 떠돌아다녀 2차 피해가 우려스러운 상황""이라고 전했다.


또 일부 언론에 보도된 '직원 일부가 회사에서 아직 근무 하고 있다'는 논란에 대해선 “4개 사업장 다 폐쇄한 거 맞지만 본사 홍보팀처럼 전화 대응해야하는 최소 필수 인력은 나오는 상황""이라고 해명했다.


 용인 확진자와 접촉한 것으로 알려진 경기도 판교 소재 한 게임사 직원은 8일 오전 음성 판정을 받았다. 해당 게임사와 같은 건물을 쓰는 다른 IT기업은 ""선제적으로 과잉 대응하겠다""며 건물 전체를 폐쇄하고 전원 재택근무에 돌입했다.


 다음주부터 정상 근무 복귀가 예정돼있는 분당·판교 소재 IT기업들은 ""우려스럽지만 상황을 지켜봐야 한다""며 조심스러운 입장이다. 11일부터 정상 출근 체제로 전환이 예정돼 있는 네이버·카카오는 ""변경 사항이 없다""며 ""추가 조치가 있으면 따로 공지하겠다""고 말했다. 6일부터 출퇴근 시간을 자율적으로 정하는 방식으로 정상 출근을 시작한 엔씨소프트도 ""출근 방침은 변함없지만, 직원들이 확진자와 접점이 있었는지 확인하는 등 예의주시하는 상황""이라고 설명했다.


주 3일 출근제를 시행하고 있는 넥슨 관계자는 ""판교는 마스크를 안 쓰면 눈치 주는 문화가 생길 만큼 다같이 신경 쓰는 분위기가 있어 크게 확산될 것 같진 않지만 상황을 지켜보고 있다""고 전했다. 스마일게이트 관계자도 ""우려는 하고 있지만 아직 상황을 지켜보는 단계""라며 ""돌봄이 필요한 가정과 임산부 직원을 제외하고는 정상 출근 체제""라고 설명했다. 판교 소재 한 중견게임사 직원은 ""군대에서 단체 기합받을 때 누군가 마지막 구호 생략을 자꾸 실수하는 느낌""이라며 ""(코로나19가) 끝났나 했더니 다시 터지는 건 아닌지 걱정된다""고 말했다.


김정민 기자 kim.jungmin4@joongang.co.kr
▶ ▶
/ ⓒ중앙일보(https://joongang.co.kr), 무단 전재 및 재배포 금지",/news/news_read.nhn?article_id=0002999139&office_id=025&mode=search&query=엔씨소프트&page=1
,"코스피가 기관과 외국인이 동반 순매수에 나서며 1% 가까이 상승, 1940선을 넘어섰다. 코스닥은 2% 넘게 오르며 680선을 돌파했다. 8일 코스피 지수는 전날보다 17.21포인트(0.89%) 상승한 1945.82에 장을 종료했다.지수는 전날보다 16.33포인트(0.84%) 상승한 1944.94에 거래를 시작 후 외국인과 기관이 동반 순매수에 나서며 상승폭을 확대, 장중 1950선을 돌파하기도 했다. 장 후반 외국인의 매수세가 축소되며 상승폭을 일부 반납, 1950선 아래에서 장을 마감했다.국내 증권시장은 전날 중국 수출이 호조를 보였다는 발표와 각 국 봉쇄 완화 움직임에 따른 경제 재개 기대감 속 유럽과 미국 증시가 일제히 1% 안팎 상승하며 투자심리가 살아나는 모습을 보였다. 장 중 시간외 미국 지수 선물이 1% 넘게 오르고 일본, 중국, 홍콩 등 아시아 주요국 증시도 일제히 상승한 점도 국내 증시에 우호적 영향을 미쳤다.기관과 외국인이 둘이 합쳐 2193억원의 주식을 사들이며 지수 상승을 주도했다.기관은 1739억원을 순매수했다. 금융투자와 연기금이 각각 1828억원, 442억원의 주식을 샀다.외국인도 454억원의 매수우위를 보이며 4거래일만에 순매수로 돌아섰다.개인만 2444억원을 순매도했다.대부분의 업종이 상승세를 보인 가운데 의약품 업종이 3.10% 오르며 상승폭이 가장 컸다. 운수장비와 섬유의복 업종도 각각 2.56%, 1.69% 상승했다.반면 음식료와 전기가스 업종은 각각 0.79%, 0.15% 하락했다.시가총액 상위 종목 중에선 기아차(+5.17%)와 엔씨소프트(+5.11%)가 5% 넘게 급등했다. SK하이닉스(+3.16%), 삼성바이오로직스(+3.70%), 셀트리온(+3.19%), 현대모비스(+3.53%), 삼성전기(+3.03%) 등도 3% 넘게 올랐다.반면 NAVER(-0.70%), LG화학(-0.42%), 한국전력(-0.45%), 삼성에스디에스(-0.56%) 등은 소폭 하락했다.시가총액 1위인 삼성전자의 주가는 전날과 같은 4만8800원에 거래를 마쳤다. 코스닥 시장은 3일 연속 1~2% 대 상승세를 보이며 훈풍이 불었다.코스닥 지수는 전날보다 14.13포인트(2.11%) 오른 682.30에 거래를 종료했다. 외국인과 기관이 둘이합쳐 동반 순매수에 나섰다. 코스닥이 종가 기준으로 680선을 돌파한 것은 지난 2월 20일 이후 약 2달 반 만이다.▶
/ ▶ 태기원(tae@joseilbo.com)저작권자 ⓒ 조세일보(http://www.joseilbo.com). 무단전재 및 재배포 금지",/news/news_read.nhn?article_id=0002223434&office_id=123&mode=search&query=엔씨소프트&page=1
하계 인턴사원 21일까지 접수,"엔씨소프트가 2020년 하계 인턴사원을 공개 모집한다고 8일 밝혔다.
 인턴사원 지원자들은 8일부터 21일 오후 2시까지 엔씨 채용 사이트에서 원서를 접수할 수 있다.
 모집 분야는 총 18개 부문이다. 게임 개발, 서비스 플랫폼 개발, Game AI, Speech AI, Vision AI, Knowledge AI, Language AI, 데이터 엔지니어링, 게임 기획, 컨셉 아트, 서비스 UX 기획, 엔터테인먼트 콘텐츠 기획, 개발 관리(PM), 게임 사업, 시큐리티 엔지니어링, 시스템 엔지니어링, 인사, 홍보 등에 지원할 수 있다.
 채용 절차는 입사지원서 접수 및 서류 전형, 온라인 인성 검사(NC TEST), 면접 순으로 진행한다. 지원자는 오는 28일 서류 전형 결과를 확인할 수 있다.
 엔씨의 인턴십 프로그램은 채용연계형 프로그램이다. 최종 합격자는 7월 초부터 7주간 인턴십 프로그램에 참여한다. 인턴십 우수 수료자에게는 '엔씨 플래그십' 제도를 통해 장학금 혜택과 2021년도 신입사원으로 입사할 수 있는 기회가 주어진다.
 엔씨는 다양한 언택트 방식으로 채용정보를 제공한다. 지원 희망자는 12일, 13일 이틀간 열리는 '온라인 1:1 직무상담회'에 참여할 수 있다. 온라인 화상회의 플랫폼 '줌'을 통해 모집 분야별 선배 사원들과 1:1 화상 대화 형식으로 진행한다. 지원서를 작성하면서 궁금했던 점이나 팁 등을 직접 질문할 수 있다.
 엔씨는 '독취사'(네이버 취업카페)에서 채용 담당자와 '온라인 서면 인터뷰'도 진행한다. 인턴 채용전형과 근무환경, 지원서 관련 질문사항, 팁 등 정확한 정보를 얻을 수 있다. 13일까지 카페 내 상담 게시물에 댓글로 질문을 남기면, 15일 채용 담당자의 답변을 별도 포스팅으로 확인할 수 있다.


 ※ 저작권자 ⓒ 파이낸셜뉴스. 무단 전재-재배포 금지",/news/news_read.nhn?article_id=0004421242&office_id=014&mode=search&query=엔씨소프트&page=1
SK하이닉스 1181억 원 '매수'·삼성전자 1086억 원 '매도',"[더팩트ㅣ박경현 기자] 8일 매수포지션으로 전환한 외국인투자자의 물량유입에 코스피가 1940선을 회복하며 상승 마감했다. 이날 외국인과 기관이 매수포지션을 취해 각각 438억 원, 1732억 원을 사들인 가운데 개인 홀로 2438억 원을 팔아치웠다. 코스닥 역시 외인과 기관 매수에 전날에 이어 강세를 지속했다.이날 외국인투자자의 코스피시장 최대매수는 SK하이닉스로 향했다. 외인은 SK하이닉스 1181억 원, 엔씨소프트 461억 원, 삼성바이오로직스 453억 원, 카카오 306억 원, 기아차 213억 원 순으로 순매수했다.반면 삼성전자는 1086억 원가량 팔아치웠다. 뒤를 이어 LG화학 727억 원, 한국전력 127억 원, 신한지주 103억 원, 삼성에스디에스 90억 원을 순매도했다.코스닥 시장에서는 셀트리온헬스케어(216억 원), 에이치엘비(98억 원), 씨젠(88억 원)을 사들인 반면 이노와이어리스(49억 원), SFA반도체(45억 원), 엠씨넥스(32억 원)를 팔았다.기관투자자는 이날 SK하이닉스를 707억 원가량 사들였다. 또한 삼성전자 518억 원, 삼성전기 290억 원, 현대차 237억 원을 샀다.반면 카카오는 204억 원을 팔았다. 뒤를 이어 신세계 184억 원, 네이버(NAVER) 149억 원을 순매도했다.이날 시가총액 상위종목은 대부분 올랐다. 삼성전자는 보합세로 마친 가운데 SK하이닉스(+3.16%), 삼성바이오로직스(+3.70%), 삼성전자우(+0.12%), 셀트리온(+3.19%), LG생활건강(+1.28%), 현대차(+2.05%), 삼성물산(+1.93%)이 올랐다. 반면 네이버(-0.70%), LG화학(-0.42%)은 내렸다.pkh@tf.co.kr저작권자 ⓒ 특종에 강한 더팩트 & tf.co.kr 무단 전재 및 재배포 금지",/news/news_read.nhn?article_id=0000025151&office_id=629&mode=search&query=엔씨소프트&page=1
,"외국인 투자자는 08일 거래소에서 SK하이닉스, 엔씨소프트, 삼성바이오로직스 등을 중점적으로 사들인 것으로 나타났다.외국인 투자자의 순매수 상위 20개 종목은 SK하이닉스, 엔씨소프트, 삼성바이오로직스, 카카오, 기아차, 셀트리온, LG이노텍, LG생활건강, 삼성전기, 현대차등이다.이중에 전기,전자 업종에 속한 종목이 5개 포함되어 있다.SK하이닉스, 엔씨소프트, 삼성바이오로직스 등은 전일 대비 주가가 상승했고, KODEX 200선물인버스2X 등은 주가가 하락했다.한경로보뉴스이 기사는 한국경제신문과 금융 AI 전문기업 씽크풀이 공동 개발한 기사 자동생성 알고리즘에 의해 실시간으로 작성된 것입니다.▶ ▶
 ▶
ⓒ 한국경제 & , 무단전재 및 재배포 금지",/news/news_read.nhn?article_id=0004337308&office_id=015&mode=search&query=엔씨소프트&page=1
