head,text,url
,"엔씨소프트는 지난 27∼28일 이틀간 ‘NCDP 2020(NCSOFT Developers Party 2020)’를 열었다고 29일 밝혔다.
 NCDP는 게임 개발에 대한 지식과 경험을 함께 나누는 엔씨 개발 문화의 대표 행사로 올해 3회를 맞이했다. 엔씨의 모든 구성원이 자율적으로 참여할 수 있는 행사로 올해는 모든 프로그램을 온라인으로 진행했다.
 올해 NCDP의 슬로건은 ‘테크놀로지(Technology)’다. 게임 개발과 관련된 모든 기술 분야의 노하우를 공유하고, 미래 기술에 대한 고민과 의견을 함께 나눴다.

 엔씨소프트 제공

올해 NCDP에서는 양일간 총 62개의 게임 개발 관련 콘퍼런스 강연이 열렸다. 직원들은 관심 있는 주제를 선택해 온라인으로 자유롭게 시청했다. 엔씨 직원들이 강연자로 나서, 게임 디자인, 프로그래밍, 보안, 데이터, AI(인공지능), 아트, 사운드 등을 포함한 11개 분야를 다뤘다. 엔씨 구성원은 모든 강연을 실시간 스트리밍으로 시청하고, 실시간 채팅 Q&A로 소통을 이어갔다.
 ’프로젝트 소개’ 프로그램에서는 엔씨에서 개발 중인 다양한 프로젝트를 공유하는 시간으로 구성됐다. ’미디어아트’를 통해 비주얼과 사운드 개발 기술을 공유하는 영상을 선보였다. 게임 개발에 적용할 수 있는 엔씨의 최신 비주얼, 사운드 기술과 트렌드를 확인했다.
 엔씨는 NCDP를 비롯한 다양한 프로그램을 통해 지식과 경험을 공유하는 개발 문화를 이어 나갈 예정이다.
 김준영 기자 papenique@segye.comⓒ 세상을 보는 눈,",/news/news_read.nhn?article_id=0003461236&office_id=022&mode=search&query=엔씨소프트&page=1
"개인 4월 한달간 5조5371억원 순매수…삼성전자 현대차 SK하이닉스 셀트리온헬스케어 순삼성바이오로직스 LG생활건강 LG화학 순매도 상위 ""차익 실현한듯""","(서울=뉴스1) 권혜정 기자 = 신종 코로나바이러스 감염증(코로나19) 팬데믹(세계적 대유행) 증시 폭락을 계기로 동학개미(개인투자자)들이 대거 유입된 가운데 최근 반등장에서 이들이 담은 종목에 관심이 쏠린다. 30일 한국거래소 마켓데이터에 따르면 이달 1일부터 29일까지 4월들어 20거래일 동안 개인투자자들은 국내 주식시장에서 5조5371억원어치를 순매수했다. 코스피 3조8173억원, 코스닥 1조7139억원이었다.개인들은 코스피시장에서 우량주를 담았다. 순매수 상위 10위 종목은 삼성전자(4367억), 현대차(3811억), SK하이닉스(3377억), KB금융 (1770억), 삼성전자우(1407억), 엔씨소프트 (1167억), 삼성SDI(1145억), 기아차(1120억), 현대모비스(1057억), POSCO(1023억) 등이다. 삼성전자와 현대차, SK하이닉스, 삼성전자우는 시가총위 10위 안에 드는 종목들이다. 남선알미늄(908억)과 셀트리온(890억)은 각각 순매수 12위와 13위에 올랐다. 남선알미늄은 4.15 총선과 관련해 이낙연 테마주로 주목받으며 개인들의 선택을 받았다. 셀트리온의 경우 신종 코로나바이러스 감염증(코로나19) 치료제에 대한 기대감 때문인 것으로 풀이된다. 개인들은 4월 한달동안 코스닥 시장에서 셀트리온헬스케어(3329억원)를 가장 많이 샀다. 셀트리온헬스케어는 코스닥 시가총액 1위 종목이다. 이어 스튜디오드래곤(1238억원), 메디톡스(1034억), 에스맥(490억), 제넥신(393억), 에코프로비엠(358억), 이더블유케이(308억), 솔브레인(278억), 네페스(258억), 레고켐바이오(249 억) 등의 순이었다. 반면 개인들은 코스피시장에서 삼성바이오로직스(1조8888억), LG생활건강(1조2380억), LG화학(8962억) 등을 주로 팔았다. 개인들이 차익 실현에 나섰던 것으로 보인다. 코스닥에서는 케이엠더블유(270억), 아이티엠반도체(265억), 펄어비스(243억) 등을 내다 팔았다. 강봉주 메리츠증권 연구원은 ""전통적으로 개인 투자자들은 기관 투자자에 비해 자금 동원력, 투자지식, 매매의 응집성과 일관성 등에서 열세에 있기 때문에 증시 영향력이 적은 것으로 평가돼 왔고, 이에 따라 '개미' 투자자로 불리곤 했다""면서 ""그러나 연초 이후 코로나19 폭락 국면에서 외국인 순매도 19조에 개인 투자자가 25조 순매수로 대응하며 '동학개미운동'이라는 신조어가 등장했다""고 밝혔다. 이어 ""올해 증시에서 개인 투자자들이 보이는 패턴은 과거와 상당히 다르다""며 ""신규 투자자 유입 규모도 기록적이며 뉴미디어를 통한 투자 학습 열기도 높은데 ETF, 해외투자, 레버리지를 활용한 투자방식 등은 과거에 비해 발전적이지만 단기 과잉매매나 소수 종목 집중 투자 패턴 등은 극복해야 할 과제""라고 했다.jung9079@news1.kr© 뉴스1코리아(), 무단 전재 및 재배포 금지",/news/news_read.nhn?article_id=0004614838&office_id=421&mode=search&query=엔씨소프트&page=1
"엔씨, 리니지2M 크로스 플레이 신규 기능 추가넥슨, '카운터사이드' 가정의달 특별 이벤트 진행넷마블, 'A3: 스틸얼라이브' 대규모 이벤트 마련","[아시아경제 이진규 기자] 게임 업계가 황금연휴를 맞이해 대규모 업데이트와 이벤트로 모바일 게임 유저 확보 경쟁에 나섰다.30일 업계에 따르면 엔씨소프트의 모바일 대작 '리니지2M'을 PC와 모바일에서 동시에 즐길 수 있는 크로스 플레이 서비스 '퍼플'의 신규 기능이 업데이트됐다. 엔씨는 '퍼플온(퍼플on)' 기능을 추가했다. 기존 모바일 스트리밍 서비스 '예티(Yeti)'의 기술력을 기반으로 개발했다. 게임이용자는 PC에서 실행 중인 리니지2M을 모바일 퍼플앱에서 실시간으로 확인할 수 있다. 게임이 종료된 상태이면 원격으로 게임을 켤 수 있다. 캐릭터가 사망하거나 다른 이용자에게 공격을 당하는 등의 상황에 따라 캐릭터 조작도 가능하다.채팅 기능인 '퍼플톡(퍼플talk)'도 업데이트했다. 이용자는 채팅방에 혈맹 단위로 이용자를 초대할 수 있다. 리니지2M의 핵심 콘텐츠인 이용자간대전(PvP)과 보스레이드(boss raid) 등에서 연합·동맹 채팅으로 소통할 수 있다. 엔씨는 향후 퍼플에 모바일 게임을 추가하고 라이브 방송 등 신규 기능을 업데이트할 계획이다.엔씨는 또 최근 업데이트로 추가한 월드서버 던전 '베오라의 유적'의 정복 이벤트를 진행한다. 게임이용자는 5월13일까지 베오라의 유적에서 몬스터를 처치해 '봉인된 구슬'을 모을 수 있다. '마법 연구소의 메시지' 이벤트도 시작됐다. 이용자는 월드 전역에서 '비밀 메시지의 단서' 아이템을 모아 컬렉션에 등록하고 방어력, 스킬 저항 등의 능력치를 높일 수 있다. 아이템 수집은 5월13일까지 가능하고, 컬렉션 효과는 5월27일까지 지속된다.넥슨은 어반 판타지 역할수행게임(RPG) '카운터사이드'의 특별 업데이트를 진행했다. 우선 '에디', '이유미', '실비아', '제인도우' 등 4개 캐릭터의 어린이날 기념 스킨을 출시했다. 어린 딸을 잃은 슬픔으로 떠돌이 용병이 된 에디가 자신의 딸과 행복했던 과거를 재현한 특별 스킨을 선보였다.또 5월21일까지 매일 고급 아이템을 지급하는 '가정의 달 출근체크' 이벤트도 진행한다. 이용자는 접속 날짜에 따라 '적성핵 상자', '함선 고급 자재' 등 캐릭터 성장과 함선 강화 재료 아이템을 얻을 수 있다. 넥슨은 신규 카운터 유닛 '나나하라 치나츠'와 '오오가미 마사키'를 추가했다. 나나하라 치나츠는 아군을 치료하는 동시에 적을 격퇴하는 서포터 클래스이며, 오오가미 마사키는 특수 기술로 적에게 광역 피해를 입히는 디펜더 클래스다.넷마블은 지난달 출시해 흥행에 성공한 배틀로열 다중접속역할수행게임(MMORPG) 'A3: 스틸얼라이브'의 대규모 이벤트를 진행한다. 이용자들은 7일 동안 출석만 해도 영웅 장신구 1개를 비롯해 블루 다이아 555개, 마나스톤 500만개, 최상급 마법석 상자 1개 등의 보상을 획득할 수 있다. 또 오는 14일까지 매일 슈퍼 핫타임 이벤트를 진행한다. 시간대 별로 경험치 획득량, 장비 획득 확률, 골드 획득량, 몬스터 카드 획득 확률 등이 증가돼 기존보다 더 많은 보상을 받을 수 있다. 특정 콘텐츠 이용 시 다양한 재화를 최대 2배까지 획득할 수 있는 이벤트도 함께 열린다. 이벤트 기간 동안 이용자들은 월드 보스 참여 보상을 2배로 획득할 수 있으며, 배틀로열 참여 시 획득하는 '헤이렌의 정수'도 2배로 늘어난다. 이 밖에도 메인 퀘스트 15챕터의 난이도가 하향돼 스토리 진행이 쉬워졌으며, '아드라실의 시련' 난이도도 소폭 하향돼 보다 많은 게임이용자들이 더욱 쉽게 즐길 수 있게 됐다.이진규 기자 jkme@asiae.co.kr <ⓒ경제를 보는 눈, 세계를 보는 창 아시아경제 무단전재 배포금지>",/news/news_read.nhn?article_id=0004670699&office_id=277&mode=search&query=엔씨소프트&page=1
임신부와 기저질환자 등 재택근무 지원,"[서울=뉴시스] 이재은 기자 = 엔씨소프트가 코로나19 확산이 지속된 이후 특별 유급 휴무와 재택 근무 등으로 대응한 가운데, 5월부터 정상 업무에 돌입한다.엔씨소프트는 다음 달부터 일상 근무제로 전환하고, 완전 자율 출퇴근제는 유지한다고 밝혔다.앞서 엔씨소프트는 지난 2월 말부터 순환 재택 근무제, 주4일 분산 근무제를 시행했다.근무 밀도를 줄이기 위해 직원들이 출/퇴근 시간을 정하는 '완전 자율 출퇴근제'는 지속 운영합니다. 기존 출근 시간(오전7시~11시)과 기본 근로 시간(1일 4시간)을 해제해 유연한 근로를 지원합니다.다만 임신부와 기저질환자 등 감염병에 취약한 사우에 대해 아직까지는 특별 보호가 필요하고 판단하여 재택 근무가 가능하도록 지원할 방침이다. lje@newsis.com<ⓒ 공감언론 뉴시스통신사. 무단전재-재배포 금지>",/news/news_read.nhn?article_id=0009841586&office_id=003&mode=search&query=엔씨소프트&page=1
