head,text,url
우리금융 제외시 순익 13.4조 14.8% 증가…수익성 안전성 모두 개선 10개 지주사 총자산 2628조원·임직원수 15만4127명,"(서울=뉴스1) 박기호 기자 = 지난해 10개의 금융지주회사 순이익은 15조2000억원으로 전년 대비 30.9% 증가한 것으로 나타났다. 또한 이들 지주회사들의 총자산은 2629조원으로 전년말 대비 27.1% 늘었다.금융감독원이 6일 발표한 2019년 금융지주회사 경영실적에 따르면 신한·KB·농협·하나·우리·BNK·DGB·JB·한투·메리츠 등 10개 금융지주회사의 자산과 수익이 크게 증가했다. 우리금융지주 설립, 신한금융지주의 오렌지라이프 편입 등이 영향을 미쳤다.지난해 설립된 우리금융지주를 제외할 경우 총자산은 2267조원으로 전년말 대비 9.6% 증가했고 당기순이익도 13조4000억원으로 14.8% 늘었다.우리금융을 포함한 연결당기순이익은 15조2338억원으로 전년(11조6410억원) 대비 3조5928억원(30.9%) 증가했다. 권역별로는 은행이 우리은행의 편입 영향으로 2조6153억원(29.4%) 증가했고 금융투자도 주가지수연계펀드 등 펀드 관련 손익 증가로 5676억원(22.6%) 늘었다.보험은 신한금융지주의 오렌지라이프 자회사 편입 등으로 전년 대비 4923억원(96.2%) 증가했다. 자회사 권역별 이익 비중은 은행이 64.3%로 가장 높고 금융투자 17.2%, 여전사 등 11.0%, 보험 5.6% 순이었다. 지난해말 바젤Ⅲ 기준을 적용받는 은행지주의 총자본과 기본자본, 보통주자본비율은 각각 13.54%, 12.10%, 11.10%였다. 위험가중자산 증가율(34.3%)이 총자본 증가율(26.5%)과 보통주 자본증가율(21.3%)을 넘어서 전년말 대비 총자본비율과 보통주 자본비율이 각각 0.84%p, 1.19%p 하락했다.지난해말 금융지주의 고정이하여신비율은 0.58%로 전년말 대비 0.16%p 하락했다. 대손충당금적립률은 고정이하여신의 감소, 대손충당금적립액 증가에 따라 같은 기간 116.77%에서 123.29%로 6.52%p 상승했다.부채비율은 신종자본증권 발행 증가 등으로 29.04%를 기록해 전년말(32.22%) 대비 3.18%p 하락했다. 이중레버리지비율도 120.26%로 전년말(122.86%) 대비 2.60%p 떨어졌다. 이중레버리지비율은 대손준비금 차감 후 자기자본 대비 자회사에 대한 출자총액을 뜻한다. 이 비율이 100%를 넘는다는 건 지주회사가 외부차입을 끌어와 자회사에 출자했다는 의미다.지난해 말 금융지주의 연결총자산은 2628조6000억원으로 전년말(2068조원) 대비 560조6000억원(27.1%) 증가했다.자회사 권역별로는 은행이 457조6000억원(30.0%) 증가했고 보험은 39조8000억원(21.9%), 금융투자는 27조6000억원(12.1%), 여전사 등은 27조원(22.8%) 증가했다. 권역별 자산 비중은 은행이 75.4%로 가장 높고 금융투자 9.7%, 보험 8.4%, 여전사 등이 5.5%를 차지했다.지난해 말 기준 금융지주회사는 자회사 등 소속 회사 수가 234개사, 점포 수는 8622개, 임직원 수는 15만4127명이었다. 소속회사 수는 전년말 대비 34개 증가했고 점포 수 역시 1418개(19.7%) 늘었다. 임직원도 전년말(12만1125명) 대비 3만3002명(27.2%) 증가했다.금감원은 ""지주사 소속 금융부문이 모두 자산 및 이익 증가를 시현하는 등 안정적으로 성장했다""면서도 ""신종 코로나바이러스 감염증에 따른 실물 및 금융부문 충격이 발생함에 따라 올해 실적이 악화될 가능성이 있다""고 진단했다. 이어 ""금융지주사가 위기 시 손실흡수 능력을 강화할 수 있게 현금배당 지급, 자사주 매입, 성과급 지급 자제 등 적정 수준의 자기자본 유지를 유도하고 금융지주 그룹 내부통제를 강화해 자체적인 금융소비자 보호 내실화를 유도할 것""이라고 전했다.goodday@news1.kr© 뉴스1코리아(), 무단 전재 및 재배포 금지",/news/news_read.nhn?article_id=0004565858&office_id=421&mode=search&query=신한지주&page=2
"10개 금융지주 총자산 27.1% 증가자본적정성 지표, 규제비율 웃돌아금감원 ""올해 지주 실적 악화 우려""""적정 자기자본 유지 유도할 계획""","[서울=뉴시스] 박은비 기자 = 지난해 금융지주회사의 순이익이 15조를 넘어섰다. 지난해 1월 우리금융지주회사가 출범하고, 신한·한국투자금융지주 등이 자회사 편입으로 덩치를 키운 영향이다.6일 금융감독원이 발표한 '2019년 금융지주회사 경영실적(잠정)'에 따르면 10개 금융지주회사의 지난해 연결당기순이익은 15조2338억원으로 전년 11조6410억원 대비 30.9%(3조5928억원) 증가했다. 자회사 권역별로 보면 은행은 우리은행 영향으로 29.4%(2조6153억원) 늘었고, 금융투자도 주가지수연계펀드 등 펀드 관련 손익 증가로 22.6%(5676억원) 증가했다. 보험은 신한금융지주의 오렌지라이프 자회사 편입 등으로 전년 대비 96.2%(4923억원) 뛰었다.총자산은 2628조6000억원으로 전년 2068조 대비 27.1%(560조6000억원) 증가했다. 자회사 권역별 자산 비중은 은행이 75.4%로 여전히 가장 높았다. 그 다음으로 금융투자 9.7%, 보험 8.4%, 여전사 등 5.5% 순이었다.10대 금융지주회사는 신한, KB, 하나, 우리, BNK, DGB, JB, 한국투자, 메리츠 등이다. 자회사 등 회사수는 243곳, 점포수는 8622개, 임직원수는 15만4127명이다. 회사수는 우리금융지주가 신설되고, 신한이 오렌지라이프생명 등을 인수한데다 한투도 한국투자부동산신탁 등을 편입하면서 전년 말 209개 대비 16.3%(34개) 늘었다.자본적정성 지표를 보면 지난해 말 현재 바젤Ⅲ 기준을 적용받는 은행지주의 총자본, 기본자본, 보통주자본비율은 각각 13.54%, 12.10%, 11.10%다. 규제비율(총자본비율 11.5%, 기본자본비율 9.5%, 보통주자본비율 8%)과 비교했을 때 양호한 수준이다.자산건전성도 개선됐다. 고정이하여신(NPL)비율은 0.58%로 전년 0.74% 대비 0.16%포인트 내려갔다. 고정이하여신비율은 부실채권 현황을 나타내는 지표로 각 지주들이 경기불확실성에 대비해 적극적으로 부실채권을 정리한 것으로 보인다.부채비율도 줄었다. 부채비율은 29.04%로 신종자본증권 발행 증가 등으로 전년 32.22% 대비 3.18%포인트 하락했다. 자회사 출자여력 지표로 활용되는 이중레버리지비율도 120.26%로 전년 122.86% 대비 2.60%포인트 떨어졌다.금감원은 은행, 금융투자, 보험 등 지주사 소속 금융부문이 모두 자산과 이익이 증가하는 등 안정적으로 성장했다고 보고 있다. 다만 신종 코로나바이러스 감염증(코로나19)에 따른 실물·금융부문 충격으로 올해 실적이 악화될 수 있다는 게 금감원 설명이다.금감원 관계자는 ""금융지주사의 경영전략과 자산·자본 건전성 점검으로 금융시스템의 안정적인 관리를 강화하겠다""며 ""금융지주사가 위기시 손실흡수 능력을 강화할 수 있도록 적정 수준의 자기자본 유지를 유도할 계획""이라고 말했다. silverline@newsis.com<ⓒ 공감언론 뉴시스통신사. 무단전재-재배포 금지>",/news/news_read.nhn?article_id=0009797516&office_id=003&mode=search&query=신한지주&page=2
"우리금융 편입에 자산·순익 일제히 증가…우리금융 제외 시 15% 상승코로나로 실적 악화 가능성…""'위기손실 흡수' 자기자본 유지 적극 유도""","지난해 금융지주사 당기순이익이 1년 전보다 30% 급증한 것으로 나타났다.6일 금융감독원이 발표한 '2019년 금융지주회사 경영실적(잠정, 연결기준)'에 따르면 국내 10개 금융지주회사(신한, KB, 농협, 하나, 우리, BNK, DGB, JB, 한투, 메리츠)의 지난해 당기순이익은 15조2338억원으로 전년 대비 30.9% 증가한 것으로 나타났다. 지난해 출범한 우리금융을 제외하면 지주사 순익 증가율은 14.8%(13조3616억원) 수준이다.권역별로 살펴보면 은행권 순익이 전년 대비 30%(2조6153억원) 증가한 것으로 파악됐다. 금융투자부문은 주가지수연계펀드 등 펀드관련손익 증가로22.6%(5676억원) 늘었고, 보험 역시 신한금융의 오렌지라이프 자회사 편입 등으로 96.2%(4923억원) 확대됐다. 전체 순익 가운데서는 은행권(64.3%), 금투사(17.2%), 여전사(11%), 보험(5.6%) 순으로 나타났다.자산규모 역시 증가했다. 2019년 말 현재 금융지주사 총 자산은 2629조원으로 27% 가량 늘었다. 자회사 가운데서는 은행 자산 증가폭(30%, 457조원)이 가장 높았고, 여전사(22.8%, 27조원), 보험사(21.9%, 40조원), 금투사(12.1%, 27조원) 순으로 나타났다. 지주사 자산비중의 4분의 3은 은행권이 차지했고 금융투자(9.7%), 보험(8.4%), 여전사(5.5%)가 그 뒤를 이었다.금융지주사의 총자본비율은 13.54%로 전년보다 0.84%p 하락한 것으로 나타났다. 기본자본과 보통주자본비율 역시 각각 12.1%와 11.1%로 0.9%p, 1.19%p 떨어졌다. 현행 규제비율 상 금융지주사의 총 자본비율은 11%, 기본자본비율은 9.5%, 보통주자본비율은 8.0%을 웃돌아야 한다. 금감원 측은 이에 대해 ""위험가중자산 증가율이 총자본증가율과 보통주자본증가율을 상회해 하락세를 나타냈으나 규제비율은 크게 웃돌고 있어 양호한 수준""이라고 설명했다.금융지주사의 부실채권 비율을 나타내는 고정이하여신비율은 0.58%로 1년 전보다 0.16%p 하락한 것으로 나타났다. 신용손실흡수 능력을 판단하는 지표인 대손충당금적립률 역시 123.29%로 작년 말(116.77%)보다 6.52%p 올랐다. 부실채권 비율이 감소하고 대손충당금적립액이 증가하면서 건전성도 개선된 것이다.금융지주회사들의 부채비율은 29.4%로 나타났다. 신종 자본증권 발행 증가 등 영향으로 전년 말(32.22%)보다 3.18%p 하락한 것이다. 자회사 출자여력 지표로 활용되는 이중레버리지비율은 120.26%로 전년 말(122.86%)보다 2.6%p 떨어졌다.한편 작년 말 기준 금융지주사 10곳 소속회사 수는 총 34곳이 증가했다. 지난해 금융권 점포 역시 비대면 거래 증가 및 통폐합에 의한 경영효율화 경향을 보였으나 우리금융 신설로 1418곳 늘었고 임직원 수는 3만3302명 늘었다. 우리금융지주 설립으로 우리금융지주 소속회사와 임직원이 신규 편입되고, 신한금융지주의 오렌지라이프 인수로 금융지주사의 자회사 편입이 지속된 데 따른 것이다.금융당국은 우리금융지주 설립과 신한금융의 오렌지라이프 편입 등으로 국내 금융시스템 내 비중이 더욱 확대된 것으로 보고 있다. 특히 은행과 금융투자회사, 보험사 등 지주 소속 금융부문이 안정적으로 성장했다고 평가했다. 다만 코로나19에 따른 실물 및 금융부문 충격으로 실적 악화 가능성도 배제할 수 없는 만큼 지주사들의 현금배당 지급, 자기주식 매입 및 경영진에 대한 과도한 성과급 지급 자제 등 위기시 손실흡수 능력 강화를 위한 자기자본 유지를 적극 유도한다는 방침이다.금감원 관계자는 ""금융지주사의 경영전략 및 자산‧자본 건전성 점검을 통해 금융시스템의 안정적인 관리를 강화해 나갈 예정""이라며 ""아울러 그룹내 내부통제를 강화해 자체적인 금융소비자보호 내실화를 유도할 것""이라고 밝혔다.데일리안 배근미 기자 (athena3507@dailian.co.kr)ⓒ (주)데일리안 - 무단전재, 변형, 무단배포 금지",/news/news_read.nhn?article_id=0002393863&office_id=119&mode=search&query=신한지주&page=2
10개 금융지주 지난해 순익 15조2338억전년 대비 31%↑…우리금융 빼면 15%↑,"[아시아경제 김효진 기자] 지난해 국내 금융지주회사들의 당기순이익이 우리금융지주 출범의 영향으로 2018년보다 30% 넘게 증가한 것으로 나타났다.금융감독원이 6일 발표한 '2019년 금융지주회사 경영실적(연결)'에 따르면 신한ㆍKBㆍ농협ㆍ하나ㆍ우리ㆍBNKㆍDGBㆍJBㆍ한투ㆍ메리츠 등 10개 금융지주의 지난해 당기순이익은 15조2338억원으로 전년(11조6410억원) 대비 3조5928억원(30.9%) 늘었다.자회사 권역별로는 은행들의 순익이 지난해 초 출범한 우리금융지주 내 우리은행의 영향으로 2조6153억원(전년 대비 29.4%) 증가했다.금융투자 또한 주가지수연계펀드 등 펀드 관련 손익의 증가로 5676억원(전년 대비 22.6%) 증가했다. 보험은 신한금융지주의 오렌지라이프 자회사 편입 등으로 순익이 4923억원(전년 대비 96.2%) 늘었다.우리금융지주를 제외하고 보면 순익은 13조3616억원으로 전년 대비 1조7206억원(14.8%) 증가했다.지난해 말 금융지주의 총자산은 2628조6000억원을 기록했다. 전년 말(2068조원) 대비 560조6000억원(27.1%) 불어났다.은행의 증가폭은 457조6000억원(30%)이다. 보험은 39조8000억원(21.9%), 금융투자는 27조6000억원(12.1%), 여전사 등은 27조원(22.8%) 증가했다.자회사 권역별로 보면 은행의 자산 비중이 75.4%로 가장 높다. 금융투자가 9.7%, 보험이 8.4%, 여전사 등이 5.5%다.우리금융지주를 빼면 총자산은 2266조6000억원으로 전년 대비 198조6000억원(9.6%) 증가했다.은행지주들의 지난해 말 총자본ㆍ기본자본ㆍ보통주자본비율은 13.54%, 12.10%, 11.10%로 전년 대비 각각 0.84%포인트, 0.90%포인트, 1.19%포인트 감소했다.위험가중자산 증가율(34.3%)이 총자본 증가율(26.5%)과 보통주자본 증가율(21.3%)을 상회한 결과다.지난해 말 금융지주의 고정이하여신비율은 0.58%로 부실채권 상각ㆍ매각 등에 따라 전년 말(0.74%) 대비 0.16%포인트 낮아졌다.대손충당금적립률은 고정이하여신의 감소, 대손충당금적립액 증가에 따라 전년말 116.77%에서 123.29%로 6.52%포인트 상승했다.은행ㆍ금융투자회사ㆍ보험사 등 지주사 소속 모든 부문의 자산 및 이익이 증가하는 등 안정적으로 성장했다는 것이 금감원의 평가다.금감원은 다만 신종 코로나바이러스감염증(코로나19)에 따른 실물 및 금융부문 충격으로 올해 실적은 악화할 가능성이 있다고 지적했다.금감원 관계자는 ""금융지주사가 위기시 손실흡수 능력을 강화할 수 있도록 적정 수준의 자기자본 유지를 유도하겠다""고 말했다.금감원은 이런 방침에 따라 현금배당 지급, 자기주식 매입 및 경영진에 대한 과도한 성과급 지급 자제 등을 금융지주들에 지속적으로 권고할 방침이다.금감원 관계자는 또 ""금융지주 그룹 내 내부통제를 강화해 자체적인 금융소비자보호 내실화를 유도하겠다""고 말했다.김효진 기자 hjn2529@asiae.co.kr <ⓒ경제를 보는 눈, 세계를 보는 창 아시아경제 무단전재 배포금지>",/news/news_read.nhn?article_id=0004656154&office_id=277&mode=search&query=신한지주&page=2
,"우리금융지주 신설 등 영향으로 금융지주사 자산·수익 급증금융지주 소속회사 234곳…점포 8천622곳, 임직원 15만4천127명(서울=연합뉴스) 성서호 기자 = 우리금융지주 신설 등의 영향으로 지난해 금융지주사들의 순이익이 31% 급증하며 15조원을 넘었다.

우리금융지주를 제외하더라도 순이익 증가율은 15%에 달했는데, 올해는 신종 코로나바이러스 감염증(코로나19) 여파로 실적이 악화할 것으로 전망된다.

6일 금융감독원이 공개한 2019년 금융지주회사 잠정 경영실적(연결기준)에 따르면 지난해 신한·KB·농협·하나·우리·BNK·DGB·JB·한투·메리츠 등 10개 금융지주회사의 순이익은 15조2천338억원이었다.

이 같은 순익은 금융지주회사가 9곳이던 2018년(11조6천410억원)보다 30.9% 늘어난 수치다.

신설된 우리금융지주를 빼면 순이익(13조3천616억원)이 1년 전보다 14.8% 증가했다.

지난해 순이익을 권역별로 보면 은행 부문이 우리은행의 영향으로 전년 대비 2조6천153억원(29.4%) 증가했다.

 금융투자 부문도 주가지수연계펀드 등의 영향으로 5천676억원(22.6%) 늘었다.

보험은 신한금융지주의 오렌지라이프 편입 효과 등으로 4천923억원(96.2%) 급증했다.금감원은 ""은행, 금융투자회사, 보험사 등 지주사 소속 금융 부문이 모두 안정적으로 성장했다""며 ""다만 올해는 코로나19에 따른 실물·금융 충격이 발생함에 따라 실적이 악화할 수 있다""고 전망했다.

금감원은 현금배당 지급과 자기주식 매입 및 과도한 경영진 성과급 지급을 자제하도록 하는 등 금융지주사가 손실흡수 능력을 강화하도록 유도한다는 방침이다.

자회사 가운데 이익 비중은 은행이 64.3%로 가장 컸다. 금융투자(17.2%), 여신전문금융회사(11.0%), 보험(5.6%) 등이 뒤를 이었다.지난해 말 현재 금융지주의 총자산은 2018년 말(2천68조원)보다 27.1% 증가한 2천628조6천억원이다.

자산 비중은 은행(1천982조9천억원·75.4%)이 대부분을 차지했다.

우리금융지주를 뺐을 때 총자산은 2천266조6천억원으로, 9.6% 늘었다.바젤Ⅲ 기준을 적용받는 은행지주의 총자본비율은 13.54%로, 0.84%포인트 내려갔다. 보통주 자본비율(11.1%)도 1.19%포인트 하락했다.

위험가중자산 증가율(34.3%)이 총자본증가율(26.5%)과 보통주자본증가율(21.3%)을 웃돈 영향이다.

고정이하여신비율(0.58%)은 부실채권 상각·매각 등으로 전년 말(0.74%)보다 0.08%포인트 하락했다.

대손충당금적립률(123.29%)은 고정이하여신 감소, 대손충당금 적립액 증가에 따라 6.52%포인트 올랐다.

금융지주의 부채비율은 신종자본증권 발행 증가 등의 영향으로 3.18%포인트 하락한 29.04%였다.

자본총계에서 자회사 출자총액이 차지하는 비중인 이중레버리지비율은 120.26%로, 2.60%포인트 하락했다.

지난해 말 기준 금융지주사 소속회사는 234곳, 점포는 8천622곳, 임직원은 15만4천127명이다.

점포는 비대면 거래 증가, 통폐합 등의 영향에도 우리금융지주의 신설로 19.7% 증가했고, 이에 따라 임직원 수도 27.2% 늘었다.

soho@yna.co.kr",/news/news_read.nhn?article_id=0011525163&office_id=001&mode=search&query=신한지주&page=2
우리금융 설립되고 신한금융의 오렌지라이프 편입 효과,"[아이뉴스24 서상혁 기자] 금융지주회사들이 지난해 뛰어난 실적을 거뒀다. 우리금융지주의 설립에 더해 오렌지라이프가 신한금융지주로 편입된 영향으로 풀이된다.6일 금융감독원에 따르면 10개 금융지주회사(신한, KB, 농협, 하나, 우리, BNK, DGB, JB, 한투, 메리츠)는 지난해 15조2천억원의 당기 순이익을 올렸다. 전년 대비 30.9% 증가한 수치다. 우리금융지주를 제외하면 9개 금융지주의 지난해 연결당기순익은 13조3천616억원으로 줄어든다.자회사 권역별로는 은행이 우리은행의 영향으로 2조6천153억원 증가했고, 금융투자 부문에서도 주가지수연계펀드 등 펀드관련 손익 증가로 5천676억원 늘었다. 보험 권역에선 신한금융지주의 오렌지라이프 자회사 편입 등으로 전년 대비 4천923억원 증가했다.자회사 권역별 이익 비중은 은행이 64.3%로 가장 높고, 금융투자 17.2%, 여전사 11.0%, 보험이 5.6%를 차지한다.총자산은 2천629조원으로 전년말 대비 27.1% 증가했다. 자회사 권역별로는 은행이 457조6천억원, 보험은 39조8천억원, 금융투자는 27조6천억원, 여전사 등은 27조원 늘었다. 자산 비중은 은행이 75.4%로 가장 높고, 금융투자 9.7%, 보험 8.4%, 여전사 등이 5.5%를 차지했다.2019년말 기준 바젤Ⅲ 기준을 적용받는 은행지주의 총자본, 기본자본, 보통주자본비율은 각각 13.54%, 12.10%, 11.10%다. 위험가중자산 증가율(34.3%)이 총자본증가율(26.5%)과 보통주자본증가율(21.3%)을 상회해 전년말 대비 총자본비율과 보통주자본비율은 각각 0.84%포인트, 1.19%포인트 떨어졌다.지난해 말 금융지주의 고정이하여신비율은 0.58%로 나타났다. 부실채권 상각·매각 등으로 전년말 대비 0.16%포인트 하락했다.금감원 관계자는 ""우리금융지주 설립, 신한금융지주의 오렌지라이프 편입 등으로 금융지주사의 자산과 수익이 크게 증대됐다""라며 ""다만 코로나19에 따른 실물·금융부문 충격이 발생함에 따라 올해 실적은 악화될 가능성이 있다""고 설명했다.이어 ""금융지주사의 경영전략과 자산·자본 건전성 점검을 통해 금융시스템의 안정적인 관리를 강화할 것이다""라고 밝혔다. hyuk@inews24.com [ⓒ 아이뉴스24 무단전재 및 재배포 금지]",/news/news_read.nhn?article_id=0000532948&office_id=031&mode=search&query=신한지주&page=2
"금융지주 연결당기순이익 15.2조원…전년比 30%↑'신설' 우리금융지주 빼도 순익 14.8% 늘어고정이하여신비율은 줄고 대손충당금적립금은 증가""코로나19 유의하며 배당금보다 자기자본 유지해야""","[이데일리 김인경 기자] 지난해 금융지주사들의 당기순이익이 15조원을 넘어서며 역대 최고치를 기록했다. 6일 금융감독원에 따르면 지난해 전체 금융지주의 연결당기순이익은 15조2238억원으로 2018년 말(11조6410억원)보다 30.9% 늘었다. 금융지주회사 당기순이익이번 발표는 KB·신한·농협·우리·하나·BNK·DGB·JB·한투·메리츠 총 10개의 금융지주회사를 대상으로 한다. 특히 지난해는 우리금융지주가 신설되며 지주사로 처음 편입된 만큼, 순이익 역시 증가한 것으로 풀이된다. 게다가 기존 금융지주도 몸집을 불렸는데 신한금융지주가 오렌지라이프생명을, 한국투자금융지주는 한국투자부동산신탁을 각각 편입한 바 있다. 하지만 우리금융지주를 제외해도 지난해 말 연결당기순이익은 13조3616억원으로 2018년 말보다 1조7206억원 증가하며 14.8%가 늘어났다. 즉, 기존 지주 모두 전체적으로 곳간이 불어난 셈이다.
특히 은행의 순이익이 11조5000억원을 기록하며 전년보다 29.4% 늘었다. 은행은 금융지주 순익에서 60% 이상을 차지하는 주력 사업이다. 증권사 등 금융투자업권의 순이익도 3조1000억원으로 전년보다 22.6% 늘었다. 펀드 관련 수익 증가가 주효했다.지난해 금융지주회사 10곳의 총자산은 2628조6000억원으로 2018년 말(2068조원)보다 27.1%(506조원) 늘어났다. 역시 우리금융지주를 제외하더라도 금융지주사들의 총자산은 2266조6000억원으로 전년 동기보다 9.6% 늘어났다. 총자산이 늘어난 만큼, 점포수나 임직원 수 모두 늘었다. 최근들어 비대면 거래가 늘어나고 경영효율화를 위한 점포 통폐합도 활발하게 이뤄지고 있지만 우리금융지주가 금융지주회사로 들어오며 금융지주회사의 총 점포수는 7204개로 나타났다. 2018년 말보다 1418개 늘어난 수치다. 임직원 역시 12만1125명으로 2018년 말보다 3만3002명이 증가했다. 덩치가 커지면서도 건전성은 강화됐다. 지난해 말 금융지주의 고정 이하 여신비율은 0.58%로 2018년 말(0.74%)보다 0.16%포인트 하락했다. 고정 이하 여신이 줄어들며 대손충당금적립금은 2018년 말 116.77%에서 지난해 말 123.29%로 상승했다. 은행 건전성지표 추이(단위:%)이와 함께 신종자본증권 발행 등을 통해 금융지주의 부채비율 역시 감소했다. 지난해 금융지주의 부채비율은 29.04%로 2018년 32.22%보다 3.18%포인트 줄었다. 금융당국은 지난해 지주사 소속 금융부문 모두 고르고 안정적인 성장을 했다고 평가했다. 다만 올해는 신종코로나바이러스 감염증(코로나19)에 따른 충격으로 실적이 악화할 가능성이 있는 만큼 주의해야 한다고 강조했다.이에 따라 금감원은 금융지주사의 경영 전략은 물론 자산과 자본의 건전성 점검을 통해 금융시스템의 안정적 관리를 강화해 나갈 방침이다. 이미 금감원은 금융지주사가 위기시 손실 흡수 능력을 강화하도록 배당금 지급이나 자사주 매입, 경영진에 대한 성과급 지급을 자제하고 적정수준의 자기자본 유지를 강조한 바 있다. 아울러 금융지주 그룹 내 내부통제를 강화해 자체적인 금융소비자 보호를 유도하겠다고 덧붙였다.김인경 (5tool@edaily.co.kr)＜ⓒ종합 경제정보 미디어 이데일리 - 무단전재 & 재배포 금지＞",/news/news_read.nhn?article_id=0004613401&office_id=018&mode=search&query=신한지주&page=2
