head,text,url
,"신한금융지주는 20일 서울 중구 세종대로 소재 본사에서 자회사경영관리위원회(자경위)를 열고 신임 신한금융투자 사장에 이영창 전 대우증권(미래에셋대우증권) 부사장을 추천했다고 밝혔다. 이날 자경위는 신한금융투자의 CEO 부재로 인한 경영공백을 최소화하는 것이 고객과 시장의 신뢰를 회복하는 토대가 될 것이라는데 의견을 모으고 후임 후보자들에 대해 심도있게 검토하며 논의하는 시간을 가졌다.자경위 관계자는 “최근 신한금융투자에 발생한 현안을 고객의 입장에서 신속하게 수습하고, 경영 정상화를 추진함과 동시에 고객의 신뢰를 회복할 수 있는 역량을 가진 인물을 선정했다”고 선정 배경을 밝혔다.이영창 부사장은 1990년에 입사해 약 25년간 대우증권에서 근무하며 업계에서 잔뼈가 굵은 정통 증권맨으로, 리테일, 주식운용, WM, 홀세일 등 증권업 전반에 거쳐 주요 사업분야를 두루 거쳤다.특히 과거 글로벌 금융위기 당시에는 기획본부장, 경영지원본부장을 맡아 위기를 정면 돌파하는 등 업계에서 강한 뚝심을 가진 인물로 평을 받고 있어, 현재 여러 이슈로 인해 어려움에 처해있는 신한금융투자를 위한 소방수로 적임자라는 평가를 받았다.자경위 관계자는 “이영창 내정자는 업계의 입지전적인 인물로 대우증권 시절 PB 중심의 리테일 혁신을 주도하고 HNW팀을 신설해 WM사업 초기 인프라를 구축하는 등 고객관리와 조직관리 모두에서 그 역량이 입증된 바 있다” 며 “고객의 입장에서 그 손실을 최소화하는데 최선의 노력을 기울여줄 것”이라고 밝혔다.이어 “지난해 그룹에서 신한금융투자에 실시한 증자 이후 전임 김병철 사장이 추진해온 조직과 시스템 혁신 과제도 계속해서 충실히 이행해 나갈 것으로 믿는다”고 기대감을 드러냈다.아울러 자경위는 신임 CEO와 함께 소비자보호와 내부통제 등 프로세스 개선을 차질없이 추진하기 위해 신한금융투자에서 경영지원그룹을 담당할 신임 부사장을 추천했다. 이남의 기자 namy85@mt.co.kr
<저작권자 ⓒ '성공을 꿈꾸는 사람들의 경제 뉴스' 머니S, 무단전재 및 재배포 금지>",/news/news_read.nhn?article_id=0000520639&office_id=417&mode=search&query=신한지주&page=2
,"이영창<사진> 전 대우증권 부사장이 신한금융투자 신임 사장 후보에 올랐다. 이 내정자는 신한금융투자 이사회의 심의를 거쳐 주주총회에서 대표이사에 확정된 후에 취임하게 된다.신한금융지주는 20일 오후 서울 중구 본사에서 자회사경영관리위원회를 열고 신임 신한금융투자 사장 후보에 이 전 부사장을 추천했다고 밝혔다. 앞서 김병철 신한금융투자 사장은 이날 오전 신한금융투자 이사회에서 사의를 표명했다. 신한금융은 ""이날 자경위에서는 신한금융투자가 CEO의 부재로 인한 경영공백을 최소화하는 것이 고객과 시장의 신뢰를 회복하는 토대가 될 것이라는데 의견을 모았다""고 밝혔다.이 내정자는 1990년에 대우증권에 입사해 약 25년간 리테일, 주식운용, WM, 홀세일 등 증권업 전반에 거쳐 주요 사업분야를 두루 거쳤다. 과거 글로벌 금융위기 때에는 기획본부장, 경영지원본부장을 맡아 위기를 정면 돌파하는 등 강한 뚝심을 가진 인물이라는 평가다. 이 내정자는 영훈고, 연세대 사회학과를 나왔다.자경위 관계자는 ""이영창 내정자는 업계의 입지전적인 인물로 대우증권 시절 PB 중심의 리테일 혁신을 주도하고, HNW팀을 신설해 WM사업 초기 인프라를 구축하는 등 고객관리와 조직관리 모두에서 그 역량이 입증된 바 있다""며 ""투자상품으로 손실이 발생한 고객의 입장에서 그 손실을 최소화하는데 최선의 노력을 기울여줄 것""이라고 밝혔다.이에 덧붙여 ""작년 그룹에서 신한금융투자에 실시한 증자 이후 전임 김병철 사장이 추진해온 조직과 시스템 혁신 과제도 계속해서 충실히 이행해 나갈 것으로 믿는다""고 기대감을 드러냈다.아울러 자경위는 신임 CEO와 함께 소비자보호와 내부통제 등 프로세스 개선을 차질없이 추진하기 위해 신한금융투자에서 경영지원그룹을 담당할 신임 부사장을 함께 추천했다.한용구 부사장 내정자는 현재 지주 원신한전략팀 본부장으로 신한금융투자 관련 현안에 이해가 높고, 경영관리 전문가라는 평가를 받고 있다.[이종현 기자 iu@chosunbiz.com]	[]	[]	[] 	chosunbiz.com",/news/news_read.nhn?article_id=0000491892&office_id=366&mode=search&query=신한지주&page=2
▶ 헉! 소리나는 스!토리 뉴스 [헉스]▶ '아는 척'하고 싶은 당신을 위한 [두유노우]▶ 한눈에 보는 [4·15총선 NEWS MAP],"[파이낸셜뉴스] 신한금융투자의 새 대표이사(사장)로 이영창 전 대우증권 부사장(사진)이 선임됐다.
 신한금융지주는 20일 서울 중구 본사에서 자회사경영관리위원회(자경위)를 열고 신임 신한금융투자 사장에 이영창 전 대우증권(현 미래에셋대우) 부사장을 추천했다.
 자경위는 이날 오전 신한금융투자 이사회에서 김병철 사장이 사의를 표명하면서 개최됐다.
 자경위 관계자는 ""최근 신한금융투자에 발생한 현안을 고객의 입장에서 신속하게 수습하고 경영 정상화를 추진함과 동시에 고객의 신뢰를 회복할 수 있는 역량을 가진 인물을 선정했다""고 말했다.
 이번 선임은 취임 전 신한금융투자에서 임원으로 재직했던 김 전 사장과 달리 외부에서 채용한 첫 사례다. 이 내정자는 1990년 대우증권에 입사해 업계에서 잔뼈가 굵은 정통 증권맨이다. 리테일, 주식운용, WM, 홀세일 등 주요 분야를 거쳤다.
 그는 과거 글로벌 금융위기 당시 대우증권에서 기획본부장, 경영지원본부장을 맡아 위기를 정면 돌파하는 등 업계에서 뚝심을 가진 인물로 평가된다. 라임자산운용 펀드 대규모 환매 사태로 어려움에 처한 회사에 소방수로 적임자라는 평이다.
 자경위 관계자는 ""이 내정자는 대우증권 시절 프라이빗뱅커(PB) 중심의 리테일 혁신을 주도하고, HNW(High Net Worth, 개인 고객 자산가)팀을 신설해 자산관리(WM)사업 초기 인프라를 구축하는 등 고객관리와 조직관리 모두에서 그 역량이 입증된 바 있다""며 ""투자상품으로 손실이 발생한 고객의 입장에서 그 손실을 최소화하는데 최선의 노력을 기울여줄 것""이라고 전했다.
 한편 자경위는 소비자보호와 내부통제 등 프로세스 개선을 추진하기 위해 신한금융투자에서 경영지원그룹을 담당할 신임 부사장도 추천했다.
 한용구 부사장 내정자는 신한금융지주 원신한전략팀 본부장을 지내며 그룹 사업 전반은 물론 신한금융투자 현안에 대한 이해가 높고, 특히 경영관리 분야에 전문역량을 보유했다는 평가를 받고 있다.
 이날 추천된 내정자는 신한금융투자 이사회의 심의를 거쳐 주주총회에서 대표이사로 확정된 후 취임한다. 임기는 내년 12월 31일까지다.



 ※ 저작권자 ⓒ 파이낸셜뉴스. 무단 전재-재배포 금지",/news/news_read.nhn?article_id=0004393753&office_id=014&mode=search&query=신한지주&page=2
라임사태 책임 지고 사임...신한금투 초대형 IB 도약 차질,"[아이뉴스24 이효정 기자] 신한금융투자의 신임 대표이사로 이영창 전 대우증권 부사장이 추천됐다.신한금융지주는 20일 서울 중구 세종대로의 본사에서 자회사경영관리위원회를 열고 신임 신한금융투자 사장에 이영창 대우증권(현 미래에셋대우증권) 부사장을 추천했다.이날 자경위는 김병철 사장이 라임자산운용 환매 중단 사태의 책임을 지고 물러난다고 밝혀 개최됐다.자경위 관계자는 “최근 신한금융투자에서 발생한 현안을 고객의 입장에서 신속하게 수습하고, 경영 정상화를 추진함과 동시에 고객의 신뢰를 회복할 수 있는 역량을 가진 인물을 선정했다”고 신임 대표이사 선정 배경을 밝혔다.신임 대표로 추천된 이 내정자는 1990년에 대우증권에 입사해 약 25년간 근무한 정통 증권맨으로, 리테일·주식운용·자산관리(WM)·홀세일 등 증권업 전반에 거쳐 주요 사업분야를 두루 거쳤다.특히 신한금융지주에 따르면 이 내정자는 과거 글로벌 금융위기 당시에는 기획본부장, 경영지원본부장을 맡아 위기를 정면 돌파하는 등 업계에서 강한 뚝심을 가진 인물로 평가받고 있다.자경위 관계자는 “이 내정자는 업계의 입지전적인 인물로 대우증권 시절에 PB 중심의 리테일 혁신을 주도하고, HNW팀을 신설해 WM사업 초기 인프라를 구축하는 등 고객관리와 조직관리 모두에서 그 역량이 입증된 바 있다”며 “투자상품으로 손실이 발생한 고객의 입장에서 그 손실을 최소화하는데 최선의 노력을 기울여줄 것이다”라고 밝혔다.이어 “작년 그룹에서 신한금융투자에 실시한 증자 이후 전임 김병철 사장이 추진해온 조직과 시스템 혁신 과제도 계속해서 충실히 이행해 나갈 것으로 믿는다”고 기대감을 드러냈다. 하지만 라임 스캔들에 휘말리면서 ‘초대형 IB’ 진출은 차질이 생길 가능성이 높다.아울러 자경위는 신임 대표와 함께 소비자보호와 내부통제 등 프로세스 개선을 차질없이 추진하기 위해 신한금융투자에서 경영지원그룹을 담당할 신임 부사장으로 한용구 부사장을 추천했다.한 내정자는 현재 지주 원신한전략팀 본부장으로 그룹 사업 전반은 물론 신한금융투자 현안에 대한 이해가 높고, 특히 경영관리 분야에 전문역량을 보유했다는 평가를 받고 있다.추천된 내정자는 신한금융투자 이사회의 심의를 거쳐 주주총회에서 대표이사로 확정된 후 취임할 예정이다. 임기는 2021년 12월 31일까지다. hyoj@inews24.com [ⓒ 아이뉴스24 무단전재 및 재배포 금지]",/news/news_read.nhn?article_id=0000530663&office_id=031&mode=search&query=신한지주&page=1
▶ 네이버 홈에서 [한국경제TV] 채널 구독하기 [생방송보기]▶ 대한민국 재테크 총집결! - [증권 / 주식상담 / 부동산],"[한국경제TV 권영훈 기자]신한금융투자 사장에 이영창 전 대우증권 부사장이 내정됐다.신한금융지주(회장 조용병)은 오늘(20일) 자회사경영관리위원회(이하 자경위)를 열어 신한금융투자 사장에 이영창 전 대우증권 부사장을 추천했다고 밝혔다.이날 자경위는 신한금융투자 이사회에서 김병철 사장이 라임 사태 책임을 지고 사의를 표명함에 따라 열렸다.자경위 관계자는 ""최근 신한금융투자에 발생한 현안을 고객의 입장에서 신속하게 수습하고, 경영 정상화를 추진함과 동시에 고객의 신뢰를 회복할 수 있는 역량을 가진 인물을 선정했다""고 설명했다.이영창 사장 내정자는 1961년 생으로 영훈고, 연세대 사회학과를 나와 1990년 대우증권에 입사해 2014년 준법감시본부장(부사장)을 끝으로 퇴임했으며 2017년부터 지난해까지 법무법인 대륙아주 고문으로 재직했다.이날 자경위는 또 신한금융투자 경영지원그룹을 맡을 부사장에 한용구 신한금융지주 원신한전략팀 본부장을 추천했다.한용구 부사장 내정자는 1966년 생으로 청주고, 성균관대 경제학과를 나와 1991년 신한은행에 입사해 현재 지주 원신한전략팀 본부장을 맡고 있다.이들 내정자는 신한금융투자 이사회와 주총을 거쳐 최종 확정되며 임기는 2021년 12월 31일이다.권영훈기자 yhkwon@wowtv.co.krⓒ 한국경제TV, 무단 전재 및 재배포 금지",/news/news_read.nhn?article_id=0000857729&office_id=215&mode=search&query=신한지주&page=1
부사장에 한용구 지주 본부장 내정주총 확정 후 취임,"[이데일리 박종오 기자] 신한금융그룹 증권 자회사인 신한금융투자 사장에 이영창(사진·60) 전 대우증권 부사장이 내정됐다. 신한금융지주는 20일 서울 중구 세종대로 본사에서 열린 자회사경영관리위원회(자경위)에서 이 전 부사장을 신한금융투자 신임 사장으로 추천했다고 밝혔다. 이 신임 사장 내정자는 연세대 사회학과를 졸업하고 1988년 대우증권(현 미래에셋대우)에 입사해 20년 넘게 일한 정통 증권맨이다. 소매(리테일)·주식 운용·자산관리(WM)·홀세일 등 증권업 주요 사업 분야를 두루 담당했다. 2008년 금융위기 당시 회사 기획본부장, 경영지원본부장을 맡아 위기 돌파를 이끌기도 했다. 자경위 관계자는 “최근 신한금융투자에서 발생한 현안을 고객 입장에서 신속하게 수습하고 경영 정상화를 추진하는 동시에 고객 신뢰를 회복할 수 있는 역량을 가진 인물을 선정했다”고 추천 배경을 설명했다. 이날 자경위는 한용구(54) 신한금융지주 원신한전략팀 본부장을 신한금융투자 신임 부사장으로 함께 추천했다. 성균관대 경제학과를 졸업하고 1991년 신한은행에 입행해 현재까지 근무 중인 ‘금융통’인 한 신임 부사장 내정자는 신한금융투자의 소비자 보호, 내부 통제 등을 개선하는 경영지원그룹 업무를 담당할 예정이다. 이번 자경위는 김병철 신한금융투자 사장이 이날 오전 회사 이사회에서 사의를 표명함에 따라 열렸다. 김 사장은 “라임자산운용 사모펀드 등 회사가 판매한 투자 상품으로 고객에게 끼친 손실에 대해 회사를 대표해 머리 숙여 사과 말씀을 드린다”며 사퇴 의사를 밝혔다. 신임 사장·부사장 내정자는 신한금융투자 이사회 심의를 거쳐 주주총회에서 대표이사로 확정한 후 취임할 예정이다. 임기는 내년 12월 31일까지다.박종오 (pjo22@edaily.co.kr)＜ⓒ종합 경제정보 미디어 이데일리 - 무단전재 & 재배포 금지＞",/news/news_read.nhn?article_id=0004602179&office_id=018&mode=search&query=신한지주&page=1
"글로벌 위기 당시 대우증권 기획본부장""고객 입장서 신속하게 현안 수습 기대""한용구 경영지원 신임 부사장 함께 추천","[서울=뉴시스] 박은비 기자 = 라임자산운용 펀드 사태로 곤경에 처한 신한금융투자 사장에 이영창 전 대우증권(현 미래에셋대우증권) 부사장이 내정됐다.신한금융지주는 20일 서울 중구 본사에서 자회사경영관리위원회(자경위)를 열고 이 전 부사장을 신한금투 사장 최종후보로 추천했다. 이 내정자는 신한금투 이사회 심의를 거쳐 주주총회에서 대표로 확정된 뒤 취임할 예정이다. 임기는 2021년 12월31일까지다.이번 자경위는 이날 오전에 열린 신한금융투자 이사회에서 김병철 신한금투 사장이 사의를 밝히면서 진행됐다. 자경위는 신한금투가 최고경영자(CEO) 부재로 생길 경영 공백을 최소화하는 게 고객과 시장 신뢰를 회복하는 토대가 될 것이라고 보고 서둘러 후임을 결정했다.자경위 관계자는 ""최근 신한금투에 발생한 현안을 고객의 입장에서 신속하게 수습하고, 경영 정상화를 추진함과 동시에 고객의 신뢰를 회복할 수 있는 역량을 가진 인물을 선정했다""고 추천 배경을 설명했다.이 내정자는 지난 1990년 대우증권에 입사해 25년간 근무했다. 업계에서 잔뼈가 굵은 정통 증권맨으로 불린다. 리테일, 주식운용, 자산관리(WM), 홀세일 등 주요 사업분야를 두루 거쳤다.특히 글로벌 금융위기 당시 기획본부장, 경영지원본부장을 맡아 위기를 정면 돌파하는 등 뚝심을 가진 인물이라는 평가를 받는다. 이 때문에 어려움에 처한 신한금투를 위한 소방수 역할을 할 적임자라는 게 자경위 판단이다.자경위는 이 내정자와 함께 소비자보호·내부통제 등 절차 개선을 추진할 경영지원그룹 담당 신임 부사장도 함께 추천했다. 신임 부서장 내정자는 한용구 신한금융지주 원신한전략팀 본부장이다. 그룹 사업 전반과 신한금투 현안에 대한 이해가 높은 점이 반영됐다. silverline@newsis.com<ⓒ 공감언론 뉴시스통신사. 무단전재-재배포 금지>",/news/news_read.nhn?article_id=0009768916&office_id=003&mode=search&query=신한지주&page=1
신임 부사장에 한용구 본부장,"(서울=뉴스1) 박기호 기자 = 신한금융투자 신임 사장에 이영창 전 대우증권(현 미래에셋대우증권) 부사장이 내정됐다.신한금융지주는 20일 서울 중구 세종대로에 위치한 본사에서 자회사경영관리위원회(자경위)를 열고 신임 신한금융투자 사장에 이 전 부사장을 추천했다.자경위는 이날 오전 김병철 사장이 사의를 표함에 따라 열렸다고 한다. 자경위 관계자는 ""최근 신한금융투자에 발생한 현안을 고객의 입장에서 신속하게 수습하고 경영 정상화를 추진함과 동시에 고객의 신뢰를 회복할 수 있는 역량을 가진 인물을 선정했다”고 전했다.신임 대표로 추천된 이영창 전 부사장은 1990년에 입사해 약 25년간 대우증권에서 근무하는 등 업계에서 잔뼈가 굵은 정통 증권맨이다. 이 전 부사장은 리테일, 주식운용, WM, 홀세일 등 증권업 전반에 거쳐 주요 사업분야를 두루 거쳤다.과거 글로벌 금융위기 당시에는 기획본부장, 경영지원본부장을 맡기도 했다. 이에 자경위에선 이 전 부사장이 어려움에 처해있는 신한금융투자를 위한 소방수로 적임자라는 평가를 내렸다.자경위 관계자는 ""이영창 내정자는 업계의 입지전적인 인물로 대우증권 시절 PB 중심의 리테일 혁신을 주도하고, HNW팀을 신설해 WM사업 초기 인프라를 구축하는 등 고객관리와 조직관리 모두에서 그 역량이 입증된 바 있다""고 소개했다. 그는 ""투자상품으로 손실이 발생한 고객의 입장에서 그 손실을 최소화하는데 최선의 노력을 기울여줄 것""이라고 기대했다.또 ""작년 그룹에서 신한금융투자에 실시한 증자 이후 전임 김병철 사장이 추진해온 조직과 시스템 혁신 과제도 계속해서 충실히 이행해 나갈 것으로 믿는다""고도 했다.또한 자경위는 신임 대표와 함께 소비자보호와 내부통제 등 프로세스 개선을 차질없이 추진하기 위해 신한금융투자에서 경영지원그룹을 담당할 신임 부사장으로 한용구 신한금융지주 원신한전략팀 본부장을 내정했다. 이들은 신한금융투자 이사회 심의와 주주총회를 거친 후 취임할 예정이다. 임기는 내년 12월31일까지다.앞서 김병철 신한금융투자 사장은 이날 이사회에서 최근 투자상품 판매에 따른 고객 손실발생에 대해 고객들에게 사과의 뜻을 표하며 대표이사직에서 사임했다.goodday@news1.kr© 뉴스1코리아(), 무단 전재 및 재배포 금지",/news/news_read.nhn?article_id=0004534861&office_id=421&mode=search&query=신한지주&page=1
,"신한금융, 자회사경영관리위 열어 후보 추천(서울=연합뉴스) 구정모 기자 = 신한금융지주는 20일 자회사경영관리위원회(이하 자경위)를 열고 신임 신한금융투자 사장에 이영창 전 대우증권(현 미래에셋대우증권) 부사장을 추천했다고 밝혔다.

이날 오전 김병철 신한금융투자 사장이 이사회에서 사의를 표명한데 따른 것이다.

이영창 전 부사장은 1990년에 대우증권에 입사해 25년간 근무하며 업계에서 잔뼈가 굵은 정통 '증권맨'이다.

 과거 글로벌 금융위기 당시 기획본부장, 경영지원본부장을 맡아 위기를 정면 돌파하는 등 강한 뚝심을 가진 인물이라는 평가를 받고 있어 현재 어려움에 부닥친 신한금융투자를 위한 소방수에 적임자로 낙점됐다고 신한금융지주는 전했다.

 자경위 관계자는 ""이영창 내정자는 업계의 입지전적인 인물로 대우증권의 리테일 혁신을 주도하고, WM(자산관리)사업 초기 인프라를 구축하는 등 고객관리와 조직관리 모두에서 역량이 입증된 바 있다""며 ""투자상품으로 손실이 발생한 고객의 입장에서 그 손실을 최소화하는 데 최선의 노력을 기울여줄 것""이라고 말했다.

이영창 내정자는 신한금융투자 이사회 심의를 거쳐 주주총회에서 대표이사로 확정된다.

 임기는 내년 12월 31일까지다.

자경위는 아울러 소비자 보호와 내부통제 등 프로세스 개선을 차질없이 추진하기 위해 신한금융투자에서 경영지원그룹을 담당할 신임 부사장에 한용구 신한금융지주 원신한전략팀 본부장을 추천했다.

한용구 부사장 내정자는 그룹 사업 전반은 물론 신한금융투자 현안에 대한 이해가 높고, 특히 경영관리 분야에 전문역량을 보유했다는 평가를 받고 있다.

pseudojm@yna.co.kr",/news/news_read.nhn?article_id=0011488035&office_id=001&mode=search&query=신한지주&page=1
,"신한금융투자 사령탑에 이영창 전 대우증권(미래에셋대우증권) 부사장이 깜짝 내정됐다.신한금융지주는 20일 자회사경영관리위원회(자경위)를 통해 이영창 부사장을 추천했다.이 내정자는 이 내정자는 1961년생으로 영훈고, 연세대 사회학과를 졸업했다. 1990년부터 약 25년간 대우증권에서 근무, 업계에서 잔뼈가 굵은 정통 증권맨으로 불린다. 리테일, 주식운용, WM, 홀세일 등 증권업 전반에 거쳐 주요 사업분야를 두루 거쳤다.특히 WM사업부문 대표 시절에는 전 직원을 대상으로 실시한 프라이빗뱅킹(PB) 지식테스트가 이 내정자가 직접 낸 아이디어로 알려져 화제가 되기도 했다.2014년엔 KDB대우증권 시절 차기 사장 후보에도 올랐던 인사다. 당시 3개월간 공석이던 대우증권 사장 후보 3인 중 한명으로 떠오르며 이목을 집중시켰다. 대우증권 준법감시본부장이었던 이 내정자는 당시 사장에는 오르지 못했다.하지만 글로벌 금융위기 당시엔, 기획본부장과 경영지원본부장 직을 맡아 위기를 정면 돌파하는 등 업계에서 강한 뚝심을 가진 인물로 평을 받았다.이에 따라 현재 여러 이슈로 인해 어려움에 처한 신한금융투자의 소방수가 될 것이라는 전망이다.자경위 관계자는 “이 내정자는 업계의 입지전적인 인물로 대우증권 시절 PB 중심의 리테일 혁신을 주도하고 HNW팀을 신설해 WM사업 초기 인프라를 구축하는 등 고객관리와 조직관리 모두에서 그 역량이 입증된 바 있다”며 “전임 김병철 사장이 추진해온 조직과 시스템 혁신 과제도 계속해서 충실히 이행해 나갈 것”이라고 말했다.송창범 기자
 <저작권자 ⓒ '성공을 꿈꾸는 사람들의 경제 뉴스' 머니S, 무단전재 및 재배포 금지>",/news/news_read.nhn?article_id=0000520646&office_id=417&mode=search&query=신한지주&page=1
,"(서울=연합뉴스) 신한금융지주가 20일 자회사경영관리위원회(이하 자경위)를 열고 신임 신한금융투자 사장에 이영창 전 대우증권(현 미래에셋대우증권) 부사장을 추천했다고 밝혔다. 2020.3.20 [신한금융 제공. 재판매 및 DB 금지]

photo@yna.co.kr",/news/news_read.nhn?article_id=0011488042&office_id=001&mode=search&query=신한지주&page=1
