head,text,url
"수보회의 취소, 간담회 결정…靑 ""금융권 신속 협조 필요 판단""금융권 적극적 역할 주문…소상공인 대출 신속 집행 지원 요청","[서울=뉴시스] 김태규 기자 = 문재인 대통령이 6일 민간 금융 관계자와 정책 금융 관계자를 소집해 신종 코로나바이러스 감염증(코로나19) 대응을 위한 기업·소상공인 긴급 금융지원 간담회를 주재했다. 문 대통령은 이날 오후 서울 중구 전국은행연합회에서 코로나19 대응을 위한 기업·소상공인 금융지원을 위한 긴급 현장 간담회를 주재하고 위기 극복을 위한 적극적인 금융지원 협조를 당부했다. 당초 문 대통령은 청와대에서 수석 비서관·보좌관 회의를 주재할 예정이었지만 이날 오전 금융지원 현장 간담회를 갖기로 최종 결정했다는 게 청와대의 설명이다. 실무 단위에서 수보 회의를 주재하는 방안, 금융지원 현장 간담회를 주재하는 방안 등 2가지 방안을 동시에 준비를 해왔지만 문 대통령의 결정에 따라 간담회 주재 쪽으로 결론이 난 것으로 전해졌다.청와대 관계자는 ""1·2차 비상경제회의를 통해 영세 소상공인의 대출 지원과 중소기업의 유동성 확보를 위해 마련한 대책들이 발표가 됐는데 현장에서 병목 현상 문제가 제기돼왔다""면서 ""금융권의 신속한 협조가 필요하다는 판단에 따라 간담회 주재를 결정했다""고 설명했다.앞서 문 대통령은 지난 1·2차 비상경제회의를 통해 코로나19의 경제 충격에 대비하기 위한 대책으로 100조원 규모의 민생·금융안정 패키지 프로그램을 발표했다.1차 회의에서는 영세 자영업자의 경색된 자금난 해소를 위한 대출 지원 등 금융지원 대책이, 2차 회의에서는 중소·중견·대기업의 유동성 확보를 위한 추가 금융지원 대책이 주로 담겼다.하지만 1차 회의에서 밝힌 소상공인 긴급 경영자금 지원, 중소·소상공인 특례보증 지원, 영세 소상공인 대출프로그램 신설 등 금융지원 정책 가운데 소상공인의 경영안정자금 대출이 폭발적으로 이뤄지면서 실제 은행창구에서 대출 병목 현상이 심각하다는 지적이 제기돼 왔다.정부는 대책 발표 이후 지난달 27일까지 소상공인을 위한 금융지원 접수 결과 29만여 건을 접수했고 그 가운데 9만 여건의 대출이 이뤄졌다. 지역신용보증재단을 통한 지원 방식이 속도가 더디자 시중은행과 기업은행, 소상공인시장진흥공단이 나눠 대출을 진행하는 긴급자금대출을 도입했다. 지난 1일부터 신용등급 정도를 따지지 않고 1.5%의 대출금리로 대출을 받을 수 있는 긴급자금대출 제도가 본격 시행 중이다. 이러한 상황을 감안해 금융권의 적극적인 협조를 특별 당부하기 위해 간담회가 마련됐다는 게 청와대의 설명이다. 문 대통령은 지난달 19일 1차 회의 때 ""결국 지원의 속도가 문제""라면서 ""보증심사가 쏠리면서 지체되는 병목현상을 개선하고 대출 심사 기준과 절차도 대폭 간소화해 적기에 도움이 되도록 감독을 잘해 주기 바란다""고 주문한 바 있다.문 대통령은 이날 코로나19로 인해 금융권도 어려움이 있는 상황에서 더 큰 어려움을 겪고 있는 기업과 소상공인을 위해 정부와 함께 대책을 마련해 준 것에 감사의 뜻을 전했다. 문 대통령은 또 향후 코로나19 극복을 위해 금융권이 더욱 적극적으로 나서줄 것을 당부했다. 특히 대출 수요가 많은 소상공인 초저금리 대출의 신속한 집행이 이루어질 수 있도록 최선의 노력을 다해 줄 것을 요청했다.이와 함께 기업, 일자리를 반드시 지키겠다는 대통령의 확고한 의지를 표명하고 이를 위한 금융권의 적극적인 역할을 강조했다. 이날 간담회에는 정부에서 홍남기 경제부총리 겸 기획재정부 장관, 박영선 중소벤처기업부 장관, 은성수 금융위원장, 윤석헌 금융감독원장 등이 참석했다.민간 금융을 대표해서는 김태영 은행연합회장, 윤종규 KB금융지주 회장, 조용병 신한금융지주 회장, 손태승 우리금융지주 회장, 김광수 농협금융지주 회장, 김정태 하나금융지주 회장 등 5대 금융지주 회장 등이 함께했다. 이동걸 KDB산업은행장, 방문규 한국수출입은행장, 윤종원 IBK중소기업은행장 등 3개 국책은행장과 윤대희 신용보증기금 이사장, 정윤모 기술보증기금 이사장 등 2개 보증기관 이사장이 각각 정책 금융 대표자로 참석했다.이외에도 조봉환 소상공인시장진흥공단 이사장, 김병근 신용보증재단중앙회 회장 등이 참석했다.한편 문 대통령은 코로나19 사태 이후 앞서 네 차례의 경제 관련 회의를 주재했지만 금융계만을 대상으로 한 별도의 간담회는 이번이 처음이다. 문 대통령은 경제계 간담회(2월13일)를 시작으로 내수·소비업계 간담회(2월21일), 경제·금융 특별점검회의(3월13일), 주요 경제주체 초청 원탁회의(3월18일)를 열어 각 주체별 경제 활성화 대책을 논의해왔다. kyustar@newsis.com<ⓒ 공감언론 뉴시스통신사. 무단전재-재배포 금지>",/news/news_read.nhn?article_id=0009799105&office_id=003&mode=search&query=신한지주&page=1
4대 금융지주 중 KB금융 제외 3곳 마이너스 전망지난해 순익 31% 급등 불구 올해는 실적악화 전망,"[파이낸셜뉴스] 금유지주사들이 지난해 순이익이 전년대비 31% 급증하면서 최고 실적을 기록했지만, 올들어 코로나19 여파와 고위험 상품 판매 제한 등으로 실적이 악화되면서 마이너스를 걱정해야 하는 처지가 됐다. 4대 금융지주사 중 KB금융을 제외한 3곳은 1·4분기 순이익이 전년동기대비 마이너스를 기록할 것으로 전망됐다.
 6일 금융당국과 관련 업계에 따르면 신한·KB국민·하나·우리금융지주 등 4대 금융지주의 올해 1·4분기 순이익은 2조8506억원(에프앤가이드 기준)으로 전년대비 4.3% 감소할 것으로 전망됐다. 에프앤가이드(추정기관 3곳이상) 실적 전망치에 따르면 KB금융지주만 순이익이 늘고 나머지 3곳은 감소할 것으로 예측됐다.
 1·4분기 순이익은 우리금융지주가 5380억원으로 전년대비 12.5% 줄고, 신한금융지주는 8940억원으로 전년대비 7.4%, 하나금융지주도 5433억원으로 1.9% 각각 감소할 것으로 전망됐다. 반면 KB금융지주는 순이익이 8753억원으로 전년대비 3.5% 증가할 것으로 전망됐다. 금융권 관계자는 ""코로나19로 금융사 여신지원이 확대되면 건전성 문제가 불거질 수 있다""며 ""기준금리 인하, 금융당국의 은행권 고위험 상품 판매 제한 등도 실적에 부정적인 영향을 미칠 전망""이라고 밝혔다.
 이는 지난해 금융지주들은 업황 개선 등으로 최고 실적을 기록한 것과 대비된다.
 금융감독원에 따르면 지난해 신한·KB·농협·하나·우리·BNK·DGB·JB·한투·메리츠 등 10개 금융지주의 잠정 경영실적(연결기준)은 우리금융지주 신설 등으로 순이익이 30.9%(15조2000억원) 급증한 것으로 나타났다. 우리금융지주를 제외해도 순이익은 13조3616억원으로 전년대비 14.8% 증가했다.
 지난해 순이익을 권역별로 보면 은행 부문은 우리은행의 영향으로 전년대비 2조6153억원(29.4%) 증가했다. 금융투자 부문도 주가지수연계펀드 등의 영향으로 5676억원(22.6%), 보험은 신한금융지주의 오렌지라이프 편입 효과 등으로 4923억원(96.2%) 각각 증가했다.
 하지만 올해는 코로나19 여파와 금융당국의 은행권 고위험 상품 판매 제한 등으로 실적 악화가 우려된다. 금감원 관계자는 ""은행, 금융투자회사, 보험사 등 지주사 소속 금융부문이 모두 자산 및 이익 증가를 시현하는 등 안정적으로 성장했다""면서도 ""그러나 올해는 코로나 여파에 따른 실물 및 금융부문 충격이 발생해 실적이 악화될 가능성이 있다""고 밝혔다.




 ※ 저작권자 ⓒ 파이낸셜뉴스. 무단 전재-재배포 금지",/news/news_read.nhn?article_id=0004403475&office_id=014&mode=search&query=신한지주&page=1
"공대위 ""은행법 위배되는 사항 알려달라"" 유권해석 요구했지만 답변 못받아","[아이뉴스24 이효정 기자] 외환파생상품인 키코(KIKO) 사태가 결국 장기화할 전망이다.신한은행과 하나은행은 6일 금융감독원의 키코 분쟁조정안 수용 여부에 대한 입장 회신 기한을 재연장해달라고 요청했다. 두 은행의 연장 요청은 이번이 4번째다.현재 금감원 분쟁조정안에 수락여부를 밝히지 않은 은행은 신한은행, 하나은행, 대구은행 3곳이다.이처럼 키코 사태가 장기화 되는 이유는 분쟁 조정안 수용 여부를 가르는 핵심 쟁점 중 하나인 '배임 문제'에 대해 은행권과 키코공동대책위원회의 줄다리기가 이어지고 있기 때문이다.은행들은 이미 종료된 사안에 대해 금융당국의 분쟁 조정안을 받아들이는 것이 주주에 대한 배임 문제가 발생할 수 있다고 주장한다.이에 키코공동대책위원회는 배임 문제에서 비롯된 은행법 조항의 해석에 대해 신한은행에 입장을 요구했지만 아직 공식적인 답변이 나오지 않고 있다.업계에 따르면 키코공동대책위원회는 지난달 25일 신한은행에 공문을 보내 배임 문제의 법적 근거로 활용되는 은행법 34조2항에 대한 해석의 근거를 요청했다. 하지만 현재까지 공식적인 답변을 받지 못했다.공대위 관계자는 ""키코 사태 분쟁 조정안의 수용 여부 일정을 미룬 은행 중 신한은행에 대해 유권해석 요청을 했다""며 ""신한은행이 키코 사태 분쟁 조정안은 은행법34조에 위배된다고 하니 명확히 무엇이 문제인지 짚기 위해 공문을 보낸 것이다""라고 설명했다.공대위는 상황을 지켜본 후 필요하면 금융위원회에 유권해석을 요청하겠다는 입장이다. 유권해석이란 보통 모호하거나 쟁점이 되는 법조항을 현실에 적용하기 위해 권위있는 기관이 법을 해석하는 것을 말한다. 공대위 관계자는 ""금융감독원에 문의한 결과 은행법에서는 문제되는 것이 없다는 답변을 받았다""며 ""신한은행의 입장을 바탕으로 금융위에 유권해석을 신청할 것이다""라고 말했다.이어 ""신한은행에서 답변이 없어 전화를 했더니 은행의 소비자지원 담당부서에서 최대한 전향적인 답변을 줄 수 있도록 노력을 하겠다는 얘기를 들었다""라고 덧붙였다.근본적으로 은행들은 이미 소멸시효가 끝난 문제에 대해 의무가 없는데도 배상한다는 것은 기업으로서는 주주로부터 형사상 배임 문제에 휘말릴 수 있다고 주장한다.특히 금감원이 내놓은 키코의 분쟁 조정안은 이미 법적 판결이 일단락된 키코 피해 기업들에게 추가 배상 등을 하는 것과 다름 없기에 증여 성격의 불건전 영업 행위에도 해당될 수 있다는 것이다.은행법34조3항을 보면 은행업무, 부수업무 또는 겸영업무와 관련해 은행 이용자에게 정상적인 수준을 초과해 재산상 이익을 제공하는 행위를 제한하고 있다.금감원 관계자는 ""키코 배상안은 불건전 영업 행위에 해당할 소지가 적다. 원인 관계 없이 배상하는 것도 아니고 시행령에 따라 이사회 의결 등 공식 절차를 따르면 규제 받을 대상이 아니다""라고 설명했다.신한은행은 공대위와 소통하고 있다며 신중한 입장이다. 신한은행 관계자는 ""유권해석에 대한 공문에 대해서 답변을 안한 것은 맞다. (하지만) 이번 키코 분쟁 조정안에 대해서는 아직 결정된 사항이 없다""며 ""(여러가지 부분을) 종합적으로 판단할 것이다""라고 말했다.아울러 ""신한지주 주주총회 이후 은행 임원이 공대위와 면담을 하는 등 꾸준히 소통하고 있다""며 의견을 계속 듣고 있다고 강조했다.키코는 환율 변동에 따른 위험을 줄이기 위한 환헤지 통화옵션 상품으로 상품 가입시 미리 정해진 약정 환율의 상·하한선 구간보다 환율이 오르거나 떨어지면 손실을 보는 상품이다.지난 2008년 글로벌 금융위기 당시 환율이 급등하자 환헤지 목적으로 수출 중소기업 919곳이 은행들을 통해 이 상품에 투자했다가 약 3조원의 투자 손실을 내면서 기업들이 줄도산했다.이후 이른바 '키코 사태'로 인해 금융상품의 불완전판매 논란이 일고 법적 분쟁으로 이어졌으나 2013년 대법원에서 '불공정거래 행위가 아니다'라는 확정 판결을 받으면서 마무리됐다.하지만 윤석헌 금감원장이 취임한 이후 재조사를 지시했고 지난해 12월 키코분쟁조정위원회를 열어 6개 시중은행에게 손실을 본 4개 기업에 대해 최대 41%를 배상하라고 권고했다. 상품 판매 과정에서 적합성 원칙과 설명의무를 위반했다고 본 것이다.이 중 우리은행이 조정안을 받아들였고, 외국계 은행인 씨티은행과 국책은행인 산업은행은 불수용했다.나머지 신한·하나·대구은행은 오늘(6일)까지 결정을 미룬 끝에 결국 회신 시한을 연장해달라고 요청한 것이다. 조정안에 따르면 신한은행의 배상액은 150억원이며, 하나은행 18억원, 대구은행 11억원이다.현재 은행권에서는 고민이 깊다. 이번 조정안의 수용은 과거 법적 판결과 반대로 불완전 판매를 받아들인다는 의미이기도 하기 때문이다.업계 관계자는 ""대법원에서 판결이 난 문제이기 때문에 배상을 다시 하면 배임 문제도 있을 수 있기 때문에 결정이 쉽지 않아 결과가 늦어지는 것이다""라고 말했다.이어 ""과거 키코 피해기업에 대해 채무유예 등 다양한 지원을 했다""며 ""오늘 마지막날인데 이사회 개최가 되는지에 대해서는 기다려봐야 하는 상황이다""라고 밝혔다. hyoj@inews24.com [ⓒ 아이뉴스24 무단전재 및 재배포 금지]",/news/news_read.nhn?article_id=0000533124&office_id=031&mode=search&query=신한지주&page=1
,"금융감독원. 권오철 기자 konplash@sportsseoul.com[스포츠서울 권오철 기자 ] 국내 금융지주회사들이 2019년 15조2338억원의 당기순이익을 기록한 것으로 나타났다. 이는 전년(11조6410억원) 대비 3조5928억원(30.9%) 증가한 액수다. 우리금융지주의 설립, 신한금융지주의 오렌지라이프 편입 등으로 금융지주사의 자산·수익이 크게 증가한 때문으로 분석된다. 금융감독원은 6일 신한, KB, 농협, 하나, 우리, BNK, DGB, JB, 한투, 메리츠 등 10개 금융지주사의 2019년 당기순이익에 대해 이 같이 밝혔다. 당기순이익과 관련해 은행은 우리은행의 영향으로 2조6153억원이 증가했고 금융투자도 주가지수연계펀드 등 펀드관련손익 증가로 5676억원이 증가했다. 보험은 신한의 오렌지라이프 자회사 편입 등으로 당기순이익이 4923억원 증가했다.이들 금융지주사의 자회사 등 소속 회사 수는 2019년 말 기준 243개사이며 점포 수는 8622개, 임직원 수는 15만4127명이다. 소속회사 수는 우리금융지주의 신설 영향으로 27개사, 신한의 오렌지라이프생명 등 편입으로 4개사, 한투의 한국투자부동산신탁 등 편입으로 3개사가 추가되는 등 전년 말 대비 34개사가 늘어났다. 점포 수는 비대면 거래 증가 및 점포 통폐합에 의한 경영효율화 경향에도 우리금융지주의 신설 등으로 1418개가 증가했다. 이에 임직원 수도 3만2002명이 추가됐다.금융지주의 2019년 말 연결총자산은 560조6000억원 늘어난 2628조6000억원으로 집계됐다. 자회사 권역별 자산 비중은 은행이 75.4%로 가장 높고 금융투자 9.7%, 보험 8.4%, 여신전문금융사 등이 5.5%를 차지했다.자본적정성을 나타내는 금융지주의 총자본비율(13.54%), 기본자본비율(12.10%), 보통주자본비율(11.10%)은 전년 대비 각각 0.84%p, 0.90%p, 1.19%p 낮아졌다. 자산건전성과 관련해 고정이하여신비율(0.58%)은 0.16%p 하락하고 대손충당금적립률(123.29%)은 6.52%p 상승했다. 부채비율은 29.04%로 신종자본증권 발행 증가 등으로 전년 대비 3.18%p 낮아졌다.금감원은 “금융지주사의 경영전략 및 자산·자본 건전성 점검을 통해 금융시스템의 안정적인 관리를 강화하겠다. 금융지주사가 위기시 손실흡수 능력을 강화할 수 있도록 적정 수준의 자기자본을 유지하도록 하고 금융지주 그룹내 내부통제를 강화해 자체적인 금융소비자보호 내실화를 유도하겠다”고 밝혔다. konplash@sportsseoul.com[기사제보 news@sportsseoul.com]
Copyright ⓒ 스포츠서울&",/news/news_read.nhn?article_id=0000645102&office_id=468&mode=search&query=신한지주&page=1
"지난해 업황개선 등으로 최고 실적4대 지주, 올해는  4.3% 감소 전망","금융지주사들이 지난해 순이익이 전년대비 31% 급증하면서 최고 실적을 기록했지만, 올들어 코로나19 여파와 고위험 상품 판매 제한 등으로 실적이 악화되면서 마이너스를 걱정해야 하는 처지가 됐다. 4대 금융지주사 중 KB금융을 제외한 3곳은 1·4분기 순이익이 전년동기대비 마이너스를 기록할 것으로 전망됐다.
 6일 금융당국과 관련 업계에 따르면 신한·KB국민·하나·우리금융지주 등 4대 금융지주의 올해 1·4분기 순이익은 2조8506억원(에프앤가이드 기준)으로 전년대비 4.3% 감소할 것으로 전망됐다. 에프앤가이드(추정기관 3곳이상) 실적 전망치에 따르면 KB금융지주만 순이익이 늘고 나머지 3곳은 감소할 것으로 예측됐다.
 1·4분기 순이익은 우리금융지주가 5380억원으로 전년대비 12.5% 줄고, 신한금융지주는 8940억원으로 전년대비 7.4%, 하나금융지주도 5433억원으로 1.9% 각각 감소할 것으로 전망됐다. 반면 KB금융지주는 순이익이 8753억원으로 전년대비 3.5% 증가할 것으로 전망됐다. 금융권 관계자는 ""코로나19로 금융사 여신지원이 확대되면 건전성 문제가 불거질 수 있다""며 ""기준금리 인하, 금융당국의 은행권 고위험 상품 판매 제한 등도 실적에 부정적인 영향을 미칠 전망""이라고 밝혔다.
 이는 지난해 금융지주들은 업황 개선 등으로 최고 실적을 기록한 것과 대비된다.
 금융감독원에 따르면 지난해 신한·KB·농협·하나·우리·BNK·DGB·JB·한투·메리츠 등 10개 금융지주의 잠정 경영실적(연결기준)은 우리금융지주 신설 등으로 순이익이 30.9%(15조2000억원) 급증한 것으로 나타났다. 우리금융지주를 제외해도 순이익은 13조3616억원으로 전년대비 14.8% 증가했다.
 지난해 순이익을 권역별로 보면 은행 부문은 우리은행의 영향으로 전년대비 2조6153억원(29.4%) 증가했다. 금융투자 부문도 주가지수연계펀드 등의 영향으로 5676억원(22.6%), 보험은 신한금융지주의 오렌지라이프 편입 효과 등으로 4923억원(96.2%) 각각 증가했다.
 하지만 올해는 코로나19 여파와 금융당국의 은행권 고위험 상품 판매 제한 등으로 실적 악화가 우려된다. 금감원 관계자는 ""은행, 금융투자회사, 보험사 등 지주사 소속 금융부문이 모두 자산 및 이익 증가를 시현하는 등 안정적으로 성장했다""면서도 ""그러나 올해는 코로나 여파에 따른 실물 및 금융부문 충격이 발생해 실적이 악화될 가능성이 있다""고 밝혔다.


 ※ 저작권자 ⓒ 파이낸셜뉴스. 무단 전재-재배포 금지",/news/news_read.nhn?article_id=0004403621&office_id=014&mode=search&query=신한지주&page=1
삼성전자 4분기 배당만 1.3조올 4월도 경상적자 가능성 쑥,"[서울경제] 국내 주요 기업들이 이달 외국인에 지급할 상장사 배당금이 5조원을 넘어서는 것으로 나타났다. 외국인 지분이 높은 상황에서 배당 확대에 수출감소가 겹치며 경상수지가 7년 만에 적자를 낸 지난해 4월에 이어 올해에도 같은 일이 벌어질 것으로 전망된다. 6일 금융감독원 전자공시시스템과 한국거래소에 따르면 배당금 상위 20대 기업의 외국인 배당금은 43억7,000만달러(5조3,818억원)로 집계됐다. 배당금을 분기마다 지급하는 는 이번에 지급하는 배당금이 총 2조4,054억원이다. 삼성전자의 지난해 연말 기준 외국인 주식 보유 비중이 56.9%다. 이에 따라 외국인은 배당금이 지급되는 오는 4월 중순께 1조3,686억원에 달하는 돈을 받을 것으로 예상된다. 분기 배당을 하는 포스코도 1,647억원을 외국인 배당금으로 지급한다.연말 결산 배당을 하는 는 외국인 배당금으로 5,692억원, 은 5,726억원, 는 3,154억원, SK하이닉스는 3,454억원을 지급한다. 올해에는 삼성전자·· 등 주요 기업이 배당금을 전년과 같게 유지하거나 올렸기 때문에 상장사의 외국인 배당금 총액은 지난해보다 늘었을 것으로 분석된다.금융투자업계에서는 외국인 배당금으로 달러가 빠져나가는 만큼 이달에는 경상수지도 적자를 낼 가능성이 클 것으로 보고 있다. 경상수지는 우리나라와 외국 사이 상품 거래만이 아니라 외국에 배당금·이자·임금을 얼마나 지급했는지에 따라서도 영향을 받는다. 수출이 수입보다 많아 상품수지가 흑자를 내도 배당을 대거 지급하면 전체 경상수지는 적자로 떨어질 수 있다. 지난해 4월에는 배당금이 67억달러 빠져나간데다 수출실적마저 나빠 유럽 재정위기가 닥친 지난 2012년 4월 이후 7년 만에 경상수지가 3억9,000만달러 적자를 낸 바 있다./양사록기자 sarok@sedaily.com저작권자 ⓒ 서울경제, 무단 전재 및 재배포 금지",/news/news_read.nhn?article_id=0003720369&office_id=011&mode=search&query=신한지주&page=1
