head,text,url
,"국민연금이 다음주 예정된 정기 주주총회에서 조용병 신한금융 회장과 손태승 우리금융 회장의 사내이사 선임안에 반대표를 던지기로 했다. 국민연금기금 수탁자책임 전문위원회는 제7차 위원회를 열고 이 같이 정했다고 19일 밝혔다. 위원회는 “기업가치 훼손과 주주권익 침해 이력이 있다고 판단했다”고 이유를 밝혔다. 다만 일부 위원들은 이견을 제시한 것으로 전해졌다.국민연금은 신한금융의 지분 9.38%를 가진 1대 주주고, 우리금융은 예금보험공사(17.25%) 다음으로 지분(7.71%)이 많은 2대 주주다. 국민연금은 지난해 말 두 회사 주식 보유 목적을 ’단순투자‘에서 ‘일반투자’로 변경하면서 적극적인 주주권 행사를 예고한 바 있다.국민연금의 이번 결정은 두 사람이 법원이나 금융당국으로부터 형사처벌이나 징계를 받았다는 점을 고려한 것으로 풀이된다. 조 회장은 채용 비리 혐의로 1심에서 징역 6월에 집행유예 2년을 선고 받아 항소한 상태고, 손 회장은 대규모 손실이 발생한 해외금리연계 파생결합증권(DLF)을 불완전 판매한 혐의로 중징계(문책경고)가 확정됐다. 세계 최대 의결권 자문사인 ISS(Institutional Shareholder Services)도 최근 조 회장과 손 회장의 연임 안건에 대해 반대의결권 행사를 권고하며 두 사람의 ‘법률 리스크’와 ‘제재 리스크’를 이유로 거론한 바 있다. ISS 권고는 대다수 연기금과 헤지펀드, 기관투자자가 투자 기업에 의결권을 행사할 때 참고 사항이 된다. 다만 국민연금과 ISS의 반대에도 회장 연임에는 문제가 없을 것이란 관측이 나온다. 신한지주는 BNP파리바(3.55%)와 우리사주(4.68%), 재일동포(약 15%) 등 우호지분이 많은 편이고, 우리금융 역시 약 30%에 달하는 과점주주를 비롯해 손 회장에 우호적인 지분이 많은 것으로 파악되기 때문이다. 금융권 관계자는 “국민연금이 일반투자자로 변경했을 때부터 예상됐던 수순”이라며 “상당수 기관투자자들이 찬성표를 위임한 상태여서 연임에 걸림돌이 되긴 힘들 것으로 보고 있다”고 말했다. 우리금융은 25일, 신한금융은 26일 주주총회를 연다.이날 국민연금은 조현준 효성 회장의 사내이사 선임에 대해서도 기업가치 훼손 이력과 기업가치 훼손에 대한 감시 의무 소홀, 과도한 겸임을 이유로 반대 결정을 내렸다. 조현준 회장의 동생인 조현상 사장 역시 비슷한 사유로 반대하기로 했다. 또한 정몽원 회장의 만도와 한라홀딩스 사내이사 선임안에는 기권을, 하나금융지주의 사외이사 선임안에는 모두 반대를 결정했다. 단, 허인 국민은행장에 대한 KB금융의 기타비상무이사 선임 건은 찬성을 하기로 했다.허경주 기자 fairyhkj@hankookilbo.com",/news/news_read.nhn?article_id=0000479180&office_id=469&mode=search&query=신한지주&page=4
,"국책은행인 기업은행 노사가 우한 코로나 사태 이후 업무량 증가 여부를 놓고 충돌했다. 기업은행 노조는 ""코로나 사태로 업무가 폭증해 52시간 근로제가 지켜지지 않는다""며 지난 18일 윤종원 IBK기업은행장을 서울지방고용노동청에 고발했다. 노조 측은 ""기업은행은 6000억원 규모의 우한 코로나 대출자금을 지원해주고 있는데 시간이 모자라는 직원들이 편법으로 야근을 하거나 대출서류를 집에 가져가 일을 하고 있는 상황""이라고 주장했다. 그러자 이날 밤 10시 기업은행 측은 ""52시간 근로제를 준수하기 위한 경영진의 의지를 전파하고, 위반자는 인사 조치를 실시하고 있다""며 노조 주장을 반박하는 보도자료를 냈다.기업은행을 비롯한 국책은행들은 매년 취업준비생들이 가장 가고 싶어 하는 '신의 직장'으로 뽑힌다. 처우는 연봉이 높은 금융권에서도 최고 수준이지만, 영업 압박 등 업무 부담은 상대적으로 적기 때문이다. 금융감독원 공시에 따르면, KDB산업·기업·수출입은행 등 3대 국책은행의 2018년 평균임금은 1억157만원으로, 신한·국민·하나·우리은행 등 4대 은행 평균임금(9300만원)보다 많았다.하지만 높은 연봉에도 불구하고 국책은행 직원들은 은행 경쟁력 강화에는 관심이 없다는 지적을 받는다. 강성 노조 뒤에 숨어 '권리만 주장하고 책임은 지려 하지 않는다'는 것이다. 지난 1월 윤종원 행장이 노조의 출근 저지를 중단시키기 위해 노조에 합의해준 내용이 대표적인 사례다. 당시 기업은행 노사는 '금융 공공성 강화를 위해 비이자 수익을 줄인다'고 합의했다. 시중은행들이 비이자 수익을 늘리기 위해 치열하게 영업 경쟁을 하는 상황에서 기업은행 노사는 '우리는 공공기관'이라며 오히려 수익을 줄이자고 합의한 것이다.합의문에는 '시중은행 대비 낮은 임금 및 복지 회복에 노력한다'는 문구도 들어있다. 국책은행들은 시중은행 평균연봉은 비정규직 직원까지 포함한 수치이고, 같은 정규직 직원 급여를 비교하면 낮기 때문에 임금을 더 올려야 한다는 것이다. 한 민간은행 직원은 ""일은 제대로 안 하면서 대우는 민간처럼 해달라는 얌체짓""이라고 말했다.국책은행은 능력과 무관하게 연차가 쌓일수록 높은 급여를 받는 호봉제를 고수하고 있다. 국책은행 노조는 다른 금융권 노조와 힘을 합쳐 직무급제 도입에 결사 반대하고 있다. 직무급제는 같은 일을 하는 사람에겐 연차에 관계없이 같은 임금을 주는 제도로 호봉제의 대안으로 거론돼왔다. 하지만 금융권 노조는 ""은행 업무를 직무에 따라 나눠 성과를 측정하기 어렵다""며 반대하고 있고, 국책은행도 이 입장에 동조하는 것이다. 금융업을 제외한 다른 업종이 그동안 꾸준히 호봉제 도입 비율을 50%로 낮춘 것과 달리, 금융권은 10년째 호봉제 비율 70%를 유지하고 있다. 젊고 능력 있는 직원들을 중심으로 ""연차보다는 성과와 직무를 중심으로 정당한 대우를 받고 싶다""는 움직임이 있지만, 노조의 완강한 반대에 막혀 제 목소리를 내지 못하고 있다.명예퇴직금 인상 요구도 국책은행 노조들의 단골 메뉴다. 현재 국책은행은 다른 공공기관처럼 남은 임금피크제 기간 동안 받을 월급 절반의 45%를 명예퇴직금으로 받을 수 있다. 그런데 이 금액이 시중은행보다 적어서 명퇴를 잘 안 하기 때문에 인력구조가 고령화된다는 것이 노조의 주장이다.우석진 명지대 경제학과 교수는 ""성과를 측정하기 어렵다는 핑계로 10년째 유지하고 있는 호봉제를 폐지하고 직무와 성과에 따라 임금을 주는 체계를 구축하는 것이 인력구조 문제 해결의 시작""이라고 말했다.국책은행 노조가 제 밥그릇 챙기기에 몰두하는 동안 은행 경쟁력은 시중은행에 비해 급격히 추락했다. 기업은행은 작년 순이익이 1조4017억원으로 전년 대비 7.2% 감소했고, 주가도 급락했다. 올해 1월 2일부터 우한 코로나 사태로 은행 주가가 급락하기 전인 2월 28일까지 기업은행 주가는 17.7% 하락했다. 같은 기간 신한지주(24.2%)와 DGB금융지주(20.3%)를 제외하면 은행주(株) 중 가장 큰 폭으로 떨어졌다.[윤진호 기자 jinho@chosun.com] 		[]		[]		[] 	- Copyrights ⓒ 조선일보 & chosun.com, 무단 전재 및 재배포 금지 -",/news/news_read.nhn?article_id=0003516211&office_id=023&mode=search&query=신한지주&page=4
기업가치 훼손·주주권익 침해 이유…  주총서 사내이사 선임 ‘반대’ 결정,"국민연금이 조용병 신한금융지주 회장과 손태승 우리금융지주 회장에 대해 ‘연임 반대’ 입장을 공식화했다. 이달 말에 열리는 금융지주별 주주총회에서 반대 의결권을 행사하기로 한 것이다. 국민연금이 주주권을 적극적으로 행사하겠다는 의지여서 금융 및 대기업 주주총회에 파장이 적지 않을 전망이다.국민연금 수탁자책임 전문위원회는 19일 제7차 위원회를 열고 조 회장과 손 회장의 사내이사 선임의 건에 대해 ‘반대’로 결정했다고 밝혔다. 수탁위는 두 사람에 대해 ‘기업가치 훼손 내지 주주권익 침해 이력이 있다’고 반대 이유를 설명했다. 수탁위는 국민연금이 투자한 주요 기업들에 대한 의결권 행사 등 주주활동을 결정하는 기구다.조 회장은 채용비리 혐의로 1심에서 징역 6개월에 집행유예 2년을 선고받고 항소한 상태다. 손 회장은 파생결합펀드(DLF) 사태와 관련해 금융 당국에서 중징계(문책 경고)를 받고 행정소송을 진행하고 있다. 국민연금은 신한금융 지분 9.76%를 보유한 1대 주주다. 우리금융 지분도 8.82%로 예금보험공사(17.25%)에 이어 2대 주주에 올라 있다. 국민연금은 이달 초 두 금융지주의 지분 보유 목적을 ‘단순 투자’에서 ‘일반 투자’로 바꾸며 적극적 주주활동을 예고한 바 있다.우리금융은 오는 25일, 신한금융은 26일 주주총회를 연다. 신한금융 이사회는 조 회장의 채용비리 혐의가 유죄로 확정된 게 아니라는 점을 들어 연임을 결정했다. 우리금융 이사회도 금융 당국의 중징계 결정에 대한 법적 판단을 받겠다며 손 회장의 연임을 추진해 왔다. 국민연금이 이들의 연임에 반대 의사를 밝히면서 두 금융지주의 주주총회는 표 대결이 본격화될 전망이다.국민연금은 하나금융지주 사외이사 선임의 건(윤성복, 박원구, 백태승, 김홍진, 양동훈, 허윤, 이정원)과 감사위원 선임의 건(차은영, 윤성복, 김홍진, 양동훈)에 대해서도 기업가치 훼손 등의 이유로 반대 의견을 내기로 했다.국민연금의 제동은 금융지주에만 그치지 않고 있다. 국민연금은 효성그룹 조현준 회장과 조현상 사장의 연임에 대해서도 기업가치 훼손 이력 및 감시 의무 소홀, 과도한 겸임 등에 해당한다고 보고 반대 의결권을 행사하기로 결정했다.양민철 기자 listen@kmib.co.krGoodNews paper ⓒ , 무단전재 및 재배포금지",/news/news_read.nhn?article_id=0001301634&office_id=005&mode=search&query=신한지주&page=4
,"[서울신문]국민연금이 조용병 신한금융지주 회장과 손태승 우리금융지주 회장, 조현준 효성 회장의 사내이사 선임에 반대표를 던지기로 했다. ‘기업가치 훼손’ 등의 이유를 들었다. 하지만 실제 연임을 부결시킬 수 있을지는 미지수다.국민연금기금 수탁자책임 전문위원회는 19일 제7차 위원회를 열고 정기주총 안건에 대한 의결권 행사 방향을 심의한 결과 이렇게 정했다고 밝혔다.수탁위는 신한금융지주의 사내이사 선임의 건에 대해 ‘기업가치를 훼손하고 주주 권익을 침해한 이력이 있다’는 이유로 조용병 회장의 사내이사 연임에 반대하기로 했다.손 회장에게도 같은 이유를 적용해 ‘반대’ 결정을 내렸다. 수탁위는 또 조현준 회장에 대해서도 기업가치 훼손 이력과 감시 의무 소홀, 과도한 겸임 등을 이유로 반대표를 던지기로 결정했다.국민연금이 보유한 지분은 각각 신한금융지주 9.76%, 우리금융지주 8.82%, 효성 10.00%다. 신한금융지주는 최대주주, 우리금융지주는 예금보험공사에 이은 2대 주주여서 주총에서 어느 정도 영향력을 발휘할 수 있을 것으로 보인다.하지만 효성은 조현준 회장 21.94%를 비롯해 특별관계인 지분이 54.96%에 달해 사내이사 연임을 부결시키긴 어려울 것으로 전망된다.이영준 기자 the@seoul.co.kr▶
▶
▶ⓒ 서울신문(www.seoul.co.kr), 무단전재 및 재배포금지",/news/news_read.nhn?article_id=0003075371&office_id=081&mode=search&query=신한지주&page=3
,"[03월 20일(06:34) '모바일한경'에 게재된 기사입니다] 모바일한경 기사 더보기 ▶ (김은정 마켓인사이트부 기자) 올해 기업들의 정기 주주총회에서 국내외 의결권 자문사들이 목소리를 높이고 있습니다. 자산운용사 등 기관투자가와 소액주주들에게 의결권 행사 방향을 적극 권고하면서입니다.투자자들이 꼭 의결권 자문사의 권고대로 행동하는 건 아닙니다. 하지만 투심에는 직간접적으로 영향을 미칠 수밖에 없어 기업들은 의결권 자문사의 의견에 촉각을 곤두세우고 있죠. 국내외 의결권 자문사들이 가장 많이 반대표 행사를 권고하는 안건 중 하나가 사외이사 선임입니다. 의결권 자문사가 기업이 추천한 사외이사 후보를 반대하는 이유는 다양합니다. 국내 의결권 자문사 중 한 곳인 좋은기업지배구조연구소의 사례를 보면 쉽게 이해를 할 수 있습니다.

좋은기업지배구조연구소는 신한금융지주 이사회가 사외이사로 추천한 박안순 후보를 반대했습니다. 박 후보는 대성상사의 회장으로 재직하고 있습니다. 재일본대한민국민단 중앙본부 의장을 역임했습니다. 은행지주회사인 신한금융지주는 지배주주가 없습니다. 최대주주는 국민연금이죠.좋은기업지배구조연구소 관계자는 ""신한은행은 재일교포의 자금으로 설립됐다""며 ""사실상 재일교포 주주들이 신한금융지주의 지배주주 역할을 하고 있는 것으로 볼 수 있다""고 말했습니다. 박 후보를 포함해 재일교포 주주들이 추천한 사외이사가 총 4명으로 전체 사외이사의 40%에 달한다는 게 좋은기업지배구조연구소의 설명입니다. 좋은기업지배구조연구소는 분산된 지분 구조 아래서 특정 주주들이 사실상 지배주주 역할을 하는 경우 해당 주주집단이 추천한 사외이사는 독립성이 떨어질 수 있다고 판단했습니다.에쓰오일 이사회가 추천한 사외이사 후보에 대한 반대 이유도 눈에 띕니다. 좋은기업지배구조연구소는 이승원 사외이사 후보를 반대했습니다. 반대 사유는 ""정년과 비교해 과도한 재직""이랍니다.이 후보는 2015년부터 에쓰오일의 사외이사를 맡고 있습니다. 좋은기업지배구조연구소는 일반적으로 임직원의 정년 상한이 65세라는 점을 감안해 65세에 비해 상당히 고령이면 사외이사 선임을 반대하고 있습니다. 이 후보는 1932년생으로 올해 88세입니다.아울러 DB하이텍의 오규원 사외이사 후보에 대해선 ""계열회사 재직에 따른 독립성 훼손""을 이유로 반대했습니다. 오 후보는 KDB산업은행에서 퇴직한 이후 동부전자 부사장, 동부 부사장, 동부그룹의 재무 담당 부회장을 지냈습니다. 좋은기업지배구조연구소는 ""과거 계열회사 임원을 지냈으면 사외이사로 독립성이 없다고 판단한다""고 설명했습니다.이노션 이사회가 사외이사로 추천한 류재욱 후보도 반대했는데요. 류 후보는 네모파트너즈 컨설팅 그룹의 총괄 대표로 휴젤의 사외이사를 맡고 있습니다. 현행 상법은 해당 상장사 외의 2개 이상의 다른 회사의 이사로 재직 중이면 사외이사로 선임될 수 없도록 하고 있습니다. 좋은기업지배구조연구소 역시 다른 법인의 임원 2개를 초과해 겸직하면 사외이사 선임에 반대하고 있답니다.좋은기업지배구조연구소 관계자는 ""류 후보는 현재 휴젤의 사외이사 재선임 안건이 상정돼 있으며 네모파트너즈 그룹의 총괄 대표를 맡고 있어 이노션 외에 2개 회사의 이사를 맡고 있다""고 말했습니다. 법령 위반 우려와 과도한 겸직으로 인해 류 후보를 반대한다는 얘기입니다. (끝)/kej@hankyung.com은 프리미엄 채널입니다. [] [] ⓒ 한국경제신문 & hankyung.com, 무단 전재 및 재배포 금지",/news/news_read.nhn?article_id=0004309609&office_id=015&mode=search&query=신한지주&page=3
"20일 KB·하나금융, 25일 우리금융, 26일 신한금융체온측정 등 코로나19 대비","국내 4대 금융지주의 정기 주주총회 시즌이 시작됐다. 20일 KB금융지주와 하나금융지주를 시작으로 25일 우리금융지주, 26일 신한금융지주가 주총을 연다. 신종 코로나바이러스 감염증(코로나19) 여파로 참석자 규모가 줄어들 것으로 예상되는 가운데 최고 경영자(CEO)의 사내이사 선임안에 관심이 집중된다.KB금융은 20일 오전 10시 서울 영등포구 국민은행 여의도본점 4층 강당에서 제12기 주총을 진행한다. 재무제표 승인, 사외이사 선임, 감사위원 선임, 이사 보수한도 등의 안건이 다뤄진다.ESG(환경·사회책임·기업지배구조)위원회를 신설한다는 내용이 포함된 정관 변경안이 올라와 있다. ESG위원회는 기업의 환경보호(E·environ-ment), 사회적 책임(S·social), 지배구조 투명성(G·governance) 활동을 밀도 있게 챙겨보자는 취지로 만들어졌다. 금융사 가운데 처음으로 그룹 사내외 이사 전원이 참여한다.같은 시간 하나금융지주는 서울 중구 하나금융 명동사옥 4층 강당에서 제15기 주총을 개최한다. 재무제표 승인, 사외이사 선임, 감사위원 선임, 이사 보수한도 등이 통과될 전망이다. 이달로 임기가 끝나는 사외이사 8명 전원이 재선임된다. 하나금융은 지난달 지배구조 내부규범 개정을 통해 사외이사 임기를 최대 5년에서 6년으로 바꿨다. 하나금융 회장추천위원장인 윤성복 사외이사의 임기가 내년으로 연장된다.우리금융은 오는 25일 오전 10시 서울 중구 우리은행 본점 5층 시너지홀에서 제1기 정기주총을 계획한 상태다. 재무제표 승인, 이사 선임, 이사 보수한도 등에 대한 결의가 이뤄진다.손태승 우리금융 회장의 사내이사 선임에 대한 관심이 집중된다. 손 회장은 이달 초 해외금리 연계 파생결합펀드(DLF) 사태와 관련해 금융감독원의 중징계(문책 경고)를 받은 상태다. 법원에 효력정지 가처분신청 등을 접수했는데 법원 판단은 이날 오후 나올 것으로 전망된다.우리금융 2대 주주(지분 8.82%)인 국민연금이 전날 손 회장의 사내이사 선임안에 반대 의견을 냈다. 하지만 30%에 달하는 과점주주를 비롯해 손 회장에 대한 우호적인 지분이 많은 것으로 알려져 손 회장 연임은 무리 없다는 관측이 많다.26일 오전 10시 서울 중구 신한은행 20층 대강당에서 진행되는 신한금융 제19기 주총도 비슷해 보인다. 재무제표 승인, 이사 선임, 이사 보수한도 등의 안건이 다뤄지는데 조용병 신한금융 회장의 사내이사 선임이 최대 관심사다.국민연금과 세계 최대 의결권 자문사인 ISS(Institutional Shareholder Services)가 조 회장 연임에 반대했지만, 20% 넘는 우호지분이 조 회장 연임을 지지하는 것으로 전해졌다.한편 금융사들은 코로나19 사태에 대한 방안으로 주총 참석자 전원에 대한 체온측정과 마스크 착용 등을 권고한 상태다. 또 증상이 있는 주주가 참석할 경우를 대비해 별도의 공간을 마련했다.윤진우/차은지 한경닷컴 기자 jiinwoo@hankyung.com▶ ▶
 ▶
ⓒ 한국경제 & , 무단전재 및 재배포 금지",/news/news_read.nhn?article_id=0004309964&office_id=015&mode=search&query=신한지주&page=3
"국민연금, 전날 이어 추가로 36곳 의결권 찬반 공시삼성증권, 국민연금 반대했지만 원안대로 승인의결LS산전·코스맥스·BNK금융 등 사외이사 선임안 반대","[서울=뉴시스] 류병화 기자 = 국민연금이 20일부터 26일까지 주주총회를 여는 상장사 36곳에 일부 반대 의결권을 행사한다. 삼성증권 사재훈 부사장 선임안 등에 반대 의결권을 행사한 것으로 나타났다.20일 국민연금 기금운용본부 공시에 따르면 국민연금은 이날부터 26일까지 주총을 개최하는 삼성증권, LS산전, 제이콘텐트리 36곳의 주총에서 의결권을 행사한다. 국민연금 수탁자책임전문위원회(수탁위)가 지난 19일 7곳의 의결권 찬반을 결정한 데 이어 추가 의결권 행사에 나선 것이다.국민연금은 사재훈 삼성증권 부사장의 사내이사 선임안 등에 반대표를 던졌다. 국민연금은 지난해 말 기준 삼성증권 지분 12.01%를 들고 있는 2대주주지만 이날 열린 주주총회에서 사 부사장의 선임안은 원안대로 찬성 의결됐다.국민연금은 사 삼성증권 부사장에 대해 삼성증권 배당 사고 당시 이사로 근무해 일정한 책임이 있는 것으로 봤다. 국민연금은 사 부사장에 '기업가치 훼손 이력 내지 주주권익 침해 행위에 대한 감시 의무 소홀'로 반대했다.아울러 국민연금은 LS산전의 문승일 사외이사 선임안, 코스맥스의 이건주 사외이사 선임안, BNK금융지주의 손광익 사외이사 선임안 등에 반대했다.국민연금은 문승일 사외이사에 대해 연구용역 등 회사와의 이해관계로 인해 독립성 취약 우려가 있다고 판단했다. 또 이건주 사외이사에 대해 중요한 거래관계에 있는 회사에 최근 5년 이내 상근임직원으로 지내 독립성 취약 우려가 있다고 지적했다.이어 손광익 사외이사에 대해 최초 선임 시 중요한 지분관계에 있는 회사에 최근 5년 이내 상근 임직원으로 재직해 독립성 훼손 우려가 있다고 봤다.아울러 국민연금은 LS산전, LG이노텍, 제이콘텐트리, 한국단자공업의 이사보수 한도액 승인안과 제이콘텐트리의 정관변경안 등에 대해 반대했다.국민연금은 나머지 27곳 상장사에 대해 모두 찬성을 결정했다. 태영건설, 아세아의 경우 각각 위탁운용사가 의결권 행사 찬반을 결정했다. 태영건설 윤석민 회장의 사내이사 선임에 찬성(97.76%), 반대(2.24%)를 결정했고 아세아의 이사 보수 한도액 승인에 99.72% 찬성, 0.28% 반대했다.국민연금 수탁위는 지난 19일 조용병 신한금융지주 회장, 손태승 우리금융지주 회장, 조현준 효성 회장의 사내이사 선임안에 반대 의결권을 행사하기로 한 바 있다.또 정몽원 회장의 만도와 한라홀딩스 사내이사 선임안에 기권을, 하나금융지주의 사외이사 선임안에 모두 반대를 결정했다.수탁위는 신한금융지주, 우리금융지주, KB금융지주, 하나금융지주, 효성, 만도, 한라홀딩스 등 7곳에 의결권 행사 결정을 공개했다. 43곳 중 7곳은 수탁위가, 36곳은 국민연금 기금운용본부와 위탁운용사가 의결권을 심의했다.앞서 국민연금은
삼성전기 등 지난 18~19일 정기 주주총회를 여는 상장사 12곳에 대해 의결권 찬반 여부를 사전 공시했다. 국민연금은 삼성전기와 효성첨단소재를 제외한 10곳에 대해 모두 찬성 의결권을 행사했다.국민연금은 삼성전기의 유지범 성균관대학교 신소재공학부 교수의 사외이사 연임 안건에 대해 반대 의결권을 행사했다. 효성첨단소재의 이사 보수한도액 승인 안건에도 반대했다. 국민연금이 반대표를 던진 이들 안건은 주총에서 원안대로 의결됐다. hwahwa@newsis.com<ⓒ 공감언론 뉴시스통신사. 무단전재-재배포 금지>",/news/news_read.nhn?article_id=0009767948&office_id=003&mode=search&query=신한지주&page=3
