head,text,url
,"삼성전자 이달 중순께 외국인 배당금 약 1.4조원 지급전문가 ""만성적 적자로 이어지진 않을 것""(서울=연합뉴스) 정수연 기자 = 지난해 4월 외국인 배당금 지급과 수출감소에 경상수지가 7년 만에 적자를 낸 데 이어 올해에도 같은 일이 벌어진다는 우려가 나온다. 국내 주요 기업들이 이번 달 지급하는 외국인 배당금이 5조원을 넘어선 데다 신종 코로나바이러스 감염증(코로나19)에 수출도 부진할 것으로 예상되기 때문이다.

6일 금융감독원 전자공시시스템과 한국거래소에 따르면 배당금 상위 20대 기업의 4월 외국인 배당금은 5조3천818억원이다. 국내 기업들은 3월 주총 이후 한 달 이내 배당금을 지급해야 해 외국인은 이번 달 20대 기업으로부터 43억7천만달러가량을 챙기게 된다.

배당금을 분기마다 지급하는 삼성전자는 이번에 지급하는 배당금이 총 2조4천54억원이고, 외국인 주식 보유 비중이 56.9%다. 외국인은 배당금이 지급되는 4월 중순께 1조3천686억7천만원에 달하는 돈을 받을 것으로 예상된다. 분기 배당을 하는 포스코도 1천647억원을 외국인 배당금으로 지급한다.

연말 결산 배당을 하는 신한지주는 외국인 배당금으로 5천692억원, KB금융은 5천726억원, 현대차는 3천154억원, SK하이닉스는 3천454억원을 지급한다.

이번 달 외국인 배당금으로 달러가 썰물처럼 빠져나가는 만큼 경상수지도 적자를 낼 가능성이 크다.

경상수지는 우리나라와 외국 사이 상품 거래만이 아니라 외국에 배당금, 이자, 임금을 얼마나 지급했는지에 따라서도 영향을 받는다. 수출이 수입보다 많아 상품수지가 흑자를 내도 배당을 대거 지급하면 전체 경상수지는 적자로 떨어질 수 있다.

작년 4월에는 배당금이 67억달러 빠져나간 데다 수출실적마저 나빠 유럽 재정위기가 닥친 2012년 4월 이후 7년 만에 경상수지가 3억9천만달러 적자를 냈다.

올해에는 삼성전자, SK텔레콤, 삼성물산 등이 배당금을 전년과 같게 유지하거나 올렸기 때문에 상장사의 외국인 배당금 총액은 작년보다 늘었을 것으로 분석된다.

다만 최근 국제유가가 폭락해 원유를 사 오는 데 써야 하는 달러가 줄어든 점은 경상수지에 긍정적으로 작용할 수 있다.전문가들은 이번 달 경상수지 적자 우려는 경제위기 직전 나타난 상황과는 다르다고 봤다.

한국은 과거 1995년부터 1997년까지 경상적자였고 경제 기초체력에 대한 불신이 퍼져 결국 외환위기를 겪었다. 금융위기 직전인 2008년 4월부터 그해 8월까지도 경상수지가 적자였다.

김소영 서울대 교수는 ""이번 달에는 계절적인 요인이 있어 과거 외환위기처럼 만성적인 적자로 이어지진 않을 것""이라면서도 ""향후 코로나19에 따른 수출둔화 영향도 봐야 한다""고 말했다.

성태윤 연세대 교수는 ""경상적자를 내더라도 한미 통화스와프 계약이 체결된 만큼 당장 외환시장에 미치는 부정적인 영향은 크지 않겠다""면서 ""유가 하락이 당장은 긍정적이겠으나 석유화학 업황이 나빠져 장기적으로는 좋다고 볼 수 없다""고 말했다.[표] 배당금 상위 20대 기업의 외국인 배당금 총액

※ 자료 : 배당금 총액은 금융감독원 전자공시시스템 각 기업 공시, 2019년 12월 30일 기준 외국인 상장주식 보유 비중은 한국거래소

삼성전자와 POSCO 제외 18개 기업은 연말 결산 배당

jsy@yna.co.kr",/news/news_read.nhn?article_id=0011525183&office_id=001&mode=search&query=신한지주&page=2
"금감원 ""올해는 코로나19로 실물 및 금융부문 충격..실적 악화 가능성""","[파이낸셜뉴스] 우리금융지주 신설 등으로 지난해 금융지주사 순이익이 31% 급증하며 15조2000억원을 기록했다.
 우리금융지주를 제외해도 순이익은 15%늘어났다. 하지만 올해는 코로나19와 저금리 등으로 실적이 악화될 전망이다.
 금융감독원은 신한·KB·농협·하나·우리·BNK·DGB·JB·한투·메리츠 등 10개 금융지주회사의 2019년 금융지주회사 잠정 경영실적(연결기준)은 순이익은 15조2338억원이었다고 6일 밝혔다.
 지난해 우리금융지주가 설립되면서 금융지주사는 10개로 늘어나면서 당기순이익은 2018년 보다 30.9% 늘어났다. 우리금융지주를 제외해도 순이익은 13조3616억원으로 전년대비 14.8% 증가했다.
 지난해 순이익을 권역별로 보면 은행 부문은 우리은행의 영향으로 전년 대비 2조6153억원(29.4%) 증가했다.
 금융투자 부문은 주가지수연계펀드 등의 영향으로 5676억원(22.6%) 늘었다.
 보험은 신한금융지주의 오렌지라이프 편입 효과 등으로 4923억원(96.2%) 급증했다.
 자회사 권역별 이익 비중은 은행이 64.3%로 가장 높고, 금융투자 17.2%, 여전사 등 11.0%, 보험이 5.6%를 차지했다.
 금감원측은 ""은행, 금융투자회사, 보험사 등 지주사 소속 금융부문이 모두 자산 및 이익 증가를 시현하는 등 안정적으로 성장했다""며 ""올해는 코로나19에 따른 실물 및 금융부문 충격이 발생해 실적이 악화될 가능성이 있다""고 밝혔다.


 ※ 저작권자 ⓒ 파이낸셜뉴스. 무단 전재-재배포 금지",/news/news_read.nhn?article_id=0004402968&office_id=014&mode=search&query=신한지주&page=2
"지난해 지주편입 2.9조실질증가율은 한자릿수코로나19, 올해는 ‘흐림’","[헤럴드경제=김성훈 기자] 지난해 금융지주회사 순이익이 15조원을 넘어섰다. 전년대비 30% 이상 늘어난 듯 보이지만, 새롭게 금융지주가 된 우리금융과 신한지주에 편입된 오렌지라이프로 인한 착시현상이 크다.6일 금융감독원에 따르면, 지난해 10개 금융지주회사의 연결당기순이익은 15조2338억원으로 전년(11조6410억원) 대비 30.9%(3조5928억원) 증가했다. 연결총자산은 2628조6000억원으로 전년말(2068조원) 대비 27.1%(560조6000억원) 늘었다.지난해 말 기준 10대 금융지주는 신한, KB, 농협, 하나, 우리, BNK, DGB, JB, 한투, 메리츠다. 우리금융지주(27개사)가 설립되는 등 지주회사 소속 회사 수가 34개 늘어났다. 우리은행과 오렌지라이프를 제외한 순이익 12조3469억원으로 따지면 전년대비 6.06% 늘어난 수준이다.자회사 권역별 당기순이익을 보면 은행이 우리은행의 편입으로 2조6153억원(29.4%) 증가한 11조5070억원을 기록했다. 금융투자는 주가지수연계펀드 등 펀드 관련 손익 증가로 5676억원(22.6%) 증가해 3조759억원으로 나타났다. 보험은 신한금융지주의 오렌지라이프(2716억원) 자회사 편입 등으로 전년 대비 4923억원(96.2%) 늘어난 1조39억원이었다.자본적정성 지표를 보면 지난해 말 현재 바젤Ⅲ 기준을 적용받는 은행지주의 총자본, 기본자본, 보통주자본비율은 각각 13.54%, 12.10%, 11.10%다. 규제비율(총자본비율 11.5%, 기본자본비율 9.5%, 보통주자본비율 8%)과 비교했을 때 양호한 수준이다.자산건전성은 개선됐다. 부실채권 현황을 나타내는 지표인 고정이하여신(NPL)비율은 0.58%로 전년 0.74% 대비 0.16%포인트(p) 내려갔다.부채비율도 줄었다. 부채비율은 29.04%로 신종자본증권 발행 증가 등으로 전년 32.22% 대비 3.18%p 하락했다. 자회사 출자여력 지표로 활용되는 이중레버리지비율도 120.26%로 전년 122.86% 대비 2.60%p 떨어졌다.금감원은 “은행, 금융투자, 보험 등 지주사 소속 금융부문이 모두 자산과 이익이 증가하는 등 안정적으로 성장했다”고 평가했다. 다만 “신종 코로나바이러스 감염증(코로나19)에 따른 실물·금융부문 충격으로 올해 실적이 악화될 수 있다”는 게 금감원의 전망이다.금감원 측은 “금융지주사의 경영전략과 자산·자본 건전성 점검으로 금융시스템의 안정적인 관리를 강화하겠다”며 “현금배당 지급, 자기주식 매입 및 경영진에 대한 과도한 성과급 지급 자제 등을 통해 금융지주사가 위기시 손실흡수 능력을 강화할 수 있도록 적정 수준의 자기자본 유지를 유도할 계획”이라고 밝혔다.paq@heraldcorp.com
- Copyrights ⓒ 헤럴드경제 & heraldbiz.com, 무단 전재 및 재배포 금지 -",/news/news_read.nhn?article_id=0001658084&office_id=016&mode=search&query=신한지주&page=2
,"[머니투데이 방윤영 기자] 지난해 금융지주회사에 우리금융지주회사가 새롭게 편입되면서 당기순이익이 연결기준 15조원을 넘어섰다. 전년보다 30% 늘어난 규모다.6일 금융감독원 '2019년 금융지주회사 경영실적'에 따르면 금융지주 10개사의 당기순이익은 15조2000억원으로 조사됐다. 직전 연도 11조6000억원에 비해 30.9% 성장했다.지난해 우리금융지주가 새롭게 포함된 영향이 컸다. 우리금융지주를 제외한 연결당기순이익은 13조3616억원으로, 전년 대비 14% 증가했다.자회사 권역별 당기순이익은 은행이 우리은행의 영향으로 2조6153억원(29.4%)이 늘었다. 금융투자는 주가지수연계펀드 등 펀드 관련 손익이 늘어 5675억원(22.6%) 증가했다.보험은 신한금융지주가 오렌지라이프를 자회사로 편입하면서 전년 대비 4923억원(96.2%) 급증했다.자회사 권역별 이익 비중은 은행이 64.3%로 가장 높았다. 금융투자 17.2%, 카드사·캐피탈사 등 여신전문금융회사(여전사) 11%, 보험 5.6% 순이었다.금융지주사 몸집도 커졌다. 지난해 금융지주사 연결총자산은 2628조6000억원이다. 전년 말 대비 560조6000억원(27.1%) 불어났다. 우리금융지주를 제외하면 연결총자산은 2266조6000억원이다.자회사 권역별 자산 비중은 은행이 75.4%로 가장 높았다. 금융투자 9.7%, 보험 8.4%, 여전사 5.5% 등 순서로 차지했다.자산 건정성을 보여주는 고정이하여신비율은 0.58%로, 부실채권 상각·매각 등으로 전년 말 대비 0.16%p(포인트) 개선됐다.대손충당금 적립률은 123.29%로 전년 말과 비교해 6.52%p 향상됐다. 고정이하여신이 감소하고 대손충당금 적립액이 증가하면서다. 금감원은 100%를 넘는 경우 문제여신이 은행경영에 크게 영향을 미치지 않는 것으로 판단한다.부채비율은 29.04%로 신종자본증권 발행 증가 등에 영향을 받아 전년보다 3.18%포인트 낮아졌다. 대손준비금 차감 후 자기자본 대비 자회사에 대한 출자총액을 뜻하는 '이중레버리지비율'은 120.26%로 전년에 비해 2.6%포인트 나아졌다.금감원은 우리금융지주 설립, 신한금융지주의 오렌지라이프 편입 등으로 금융지주사의 자산·수익이 크게 증가했다고 밝혔다.금감원은 ""은행과 금투사, 보험사 등 지주사 소속 금융부문이 모두 안정적으로 성장하고 있다""며 ""다만 코로나19에 따라 올해 실적이 악화될 가능성이 있다""고 밝혔다.방윤영 기자 byy@mt.co.kr
<저작권자 ⓒ '돈이 보이는 리얼타임 뉴스' 머니투데이, 무단전재 및 재배포 금지>",/news/news_read.nhn?article_id=0004389575&office_id=008&mode=search&query=신한지주&page=2
,"[헤럴드경제 = 이태형 기자] 배당금 상위 20대 기업의 4월 외국인 배당금이 5조원 이상인 것으로 집계됐다. 그 중 삼성전자가 1.3조원으로 가장 많은 비중을 차지했다.6일 금융감독원 전자공시시스템 및 한국거래소 등에 따르면, 배당금 상위 20개 기업 4월 외국인 배당금은 총 5조3818억원으로 나타났다. 배당금을 분기 지급하는 삼성전자는 총 2조4054억원의 배당금 중 1조3686억원(외국인 주식 보유 비중 56.9%)을 외국인에 배당한다.연말 결산으로 배당하는 신한지주는 5692억원, KB금융은 5726억원, 현대차는 3154억원, SK하이닉스는 3454억원을 지급하게 된다.외국인 배당시즌은 통상 환율과 경상수지에 악영향을 끼치는 요인으로 꼽힌다. 배당금 역송금에 따라 달러 수요가 단기간에 급증할 수 있어서다. 원달러 환율은 급등세에서 한미 통화 스와프 체결 등의 조치로 최근 변동 폭을 줄인 상태이지만, 여전히 안심할 순 없는 상태다.주식시장에서 외국인 순매도도 연일 이어지고 있어 배당금 역송금까지 겹칠 경우 재차 국내 원달러 수급 여건이 꼬일 수 있다.경상수지에도 악영향을 끼칠 전망이다. 작년 4월엔 외국인 배당금으로 67억달러가 빠져나간 데다 수출 실적까지 부진해 경상수지 적자를 기록했다.경상수지는 상품 거래 뿐 아니라 배당금, 이자, 임금 등까지 포함된다. 올해엔 삼성전자, SK텔레콤, 삼성물산 등이 배당금을 전년과 같게 유지하거나 올렸기 때문에 상장사 외국인 배당금 총액은 전년 대비 증가할 것으로 예상된다.thlee@heraldcorp.com
- Copyrights ⓒ 헤럴드경제 & heraldbiz.com, 무단 전재 및 재배포 금지 -",/news/news_read.nhn?article_id=0001658089&office_id=016&mode=search&query=신한지주&page=2
,"원·달러 환율이 오르고 있다. 원유 감산 회의 연기, 배당에 따른 외국인 투자자의 역송금 수요 등이 환율 상승 요인으로 작용해서다.6일 오전 9시13분 서울외환시장에서 원·달러 환율은 전날보다 6.9원 오른 1237.8원에 거래되고 있다.OPEC+(OPEC과 10개 주요 산유국 연대체)가 감산 협상을 위한 긴급회의를 오는 9일로 연기하면서 유가 선물이 하락, 환율 시장에 부담을 주고 있다. 인베스팅닷컴에 따르면 이날 오전 9시13분 기준 5월물 서부 텍사스산 원유 선물은 전날보다 배럴당 2.31달러(8.15%) 하락한 26.03달러에 거래되고 있다. 브렌트유도 같은 시간 배럴당 2.89달러(8.30%) 내린 31.94달러를 기록 중이다.배당기간을 맞아 외국인들의 역송금 수요도 환율을 밀어 올리는 요인이다. 이번 주(6~10일) KB금융지주 신한금융지주 하나금융지주 우리금융지주 등이 1조5000억원 규모로 배당금을 지급한다.국내 증시에서 외국인 투자자도 23거래일째 '팔자'를 기록하고 있다. 외국인은 이날 75억원 순매도 중이다.전승지 삼성선물 연구원은 ""코로나19에 따른 대외 불확실성이 지속되는 가운데 유가 등이 환율의 변수로 작용하는 상황""이라며 ""외국인 주식 매도, 배당기간에 따른 외국인 역송금 수요 등도 원·달러 환율에 상승 압박을 주고 있다""라고 했다.이송렬 한경닷컴 기자 yisr0203@hankyung.com▶ ▶
 ▶
ⓒ 한국경제 & , 무단전재 및 재배포 금지",/news/news_read.nhn?article_id=0004319082&office_id=015&mode=search&query=신한지주&page=2
"[금감원, 2019 금융지주 경영실적]당기순이익 15.2조로 30.9%↑우리금융 제외해도 13.4조로 14.8%↑금감원 ""실물, 금융충격으로 실적 악화할 수도...경영진 성과급 지급 등 자제 유도""","[서울경제] 지난해 금융지주사의 당기순이익이 15조원을 돌파하며 전년보다 30.9% 급증했다. 작년 설립된 우리금융지주를 제외해도 13조 4,000억원으로 14.8% 늘었다. 다만 올해는 신종 코로나 바이러스 감염증(코로나19) 여파로 실적이 악화할 것으로 보인다. 금융감독원이 6일 공개한 2019년 금융지주회사 잠정 경영실적(연결기준)에 따르면 지난해 신한·KB·농협·하나·우리·BNK·DGB·JB·한투·메리츠 등 10개 금융지주회사의 순이익은 15조 2,338억원이었다. 2018년보다 30.9% 늘어난 수치다. 신설된 우리금융지주를 빼도 순이익은 13조 3,616억원으로 1년 전보다 14.8% 증가했다.순이익을 권역별로 보면 은행이 우리은행 편입 영향으로 전년 보다 2조 6,153억(29.4%) 증가했다. 금융투자 부문도 주가지수연계펀드 등의 영향으로 5,676억원(22.6%) 늘었다. 보험은 신한금융지주의 오렌지라이프 편입 등으로 4,923억원(96.2%) 급증했다. 금융지주사 자회사 중 이익 비중은 은행이 64.3%로 가장 컸고 금융투자(17.2%), 여신전문금융회사(11.0%), 보험(5.6%) 등의 순이었다. 금감원은 “은행, 금융투자회사, 보험사 등이 모두 안정적으로 성장했다”며 “다만 올해는 코로나19에 따른 실물·금융 충격이 발생함에 따라 실적이 악화할 수 있다”고 내다봤다. 금감원은 현금배당 지급과 자기주식 매입 및 과도한 경영진 성과급 지급을 자제하도록 하는 등 금융지주사가 손실흡수 능력을 강화하도록 유도할 계획이다.지난해 말 현재 금융지주의 총자산은 2018년 말(2.068조원)보다 27.1% 증가한 2,628조 6,000억원이었다. 자산 비중은 은행(1,982조 9,000억원·75.4%)이 대부분을 차지했다. 우리금융지주를 뺐을 때 총자산은 2,266조6,000억원으로, 9.6% 늘었다.바젤Ⅲ 기준을 적용받는 은행지주의 총자본비율은 13.54%로, 0.84%포인트 빠졌다. 보통주 자본비율(11.1%)도 1.19%포인트 하락했다. 위험가중자산 증가율(34.3%)이 총자본증가율(26.5%)과 보통주자본증가율(21.3%)을 웃돈 영향이다. 고정이하여신비율(0.58%)은 부실채권 상각·매각 등으로 전년 말(0.74%)보다 0.08%포인트 하락했다. 대손충당금적립률(123.29%)은 고정이하여신 감소, 대손충당금 적립액 증가에 따라 6.52%포인트 올랐다.금감원 관계자는 “금융지주사의 경영전략 및 자산, 자본 건전성 점검을 통해 금융시스템의 안정적인 관리를 강화할 것”이라며 “금융지주 그룹 내 내부통제도 강화해 자체적인 금융소비자보호 내실화도 유도할 것”이라고 강조했다. /이태규기자 classic@sedaily.com저작권자 ⓒ 서울경제, 무단 전재 및 재배포 금지",/news/news_read.nhn?article_id=0003719918&office_id=011&mode=search&query=신한지주&page=1
,"지난해 4월 외국인 배당금 지급과 수출감소로 경상수지가 7년 만에 적자를 낸 데 이어 올해도 같은 일이 벌어질 수 있다는 우려가 나옵니다. 국내 주요 기업들이 이번 달 지급하는 외국인 배당금이 5조원을 넘어선 데다 코로나19에 수출도 부진할 것으로 예상되기 때문입니다. 금융감독원 전자공시시스템과 한국거래소 자료를 보면 배당금 상위 20대 기업의 이 달 외국인 배당금은 5조3천818억원으로 집계됐습니다. 배당금을 분기마다 지급하는 삼성전자는 이번에 지급하는 배당금이 총 2조4천54억원이고, 외국인 주식 보유 비중이 56.9%입니다. 외국인은 배당금이 지급되는 이 달 중순쯤 1조3천686억7천만원에 달하는 돈을 받을 것으로 예상됩니다.
이 밖에 분기 배당을 하는 포스코도 1천647억원을 외국인 배당금으로 지급하고 신한지주는 5천692억원, KB금융은 5천726억원, 현대차는 3천154억원, SK하이닉스는 3천454억원을 지급할 예정입니다. 이번 달 외국인 배당금으로 달러가 빠져나가는 만큼 경상수지도 적자를 낼 가능성이 높습니다. 경상수지는 우리나라와 외국 사이 상품 거래만이 아니라 외국에 배당금, 이자, 임금을 얼마나 지급했는지에 따라서도 영향을 받기 때문입니다.
수출이 수입보다 많아 상품수지가 흑자를 내도 배당을 대거 지급하면 전체 경상수지는 적자로 떨어질 수 있습니다. 지난해 4월에는 배당금이 67억달러 빠져나간 데다 수출실적마저 나빠 유럽 재정위기가 닥친 2012년 4월 이후 7년 만에 경상수지가 3억9천만달러 적자를 냈습니다. 올해에는 삼성전자, SK텔레콤, 삼성물산 등이 배당금을 지난해와 같게 유지하거나 올렸기 때문에 상장사의 외국인 배당금 총액은 늘었을 것으로 분석됩니다. 다만 최근 국제유가가 폭락해 원유를 사 오는 데 써야 하는 달러가 줄어든 점은 경상수지에 긍정적으로 작용할 수 있습니다. [사진 출처 : 연합뉴스]오수호 기자 (oasis@kbs.co.kr)",/news/news_read.nhn?article_id=0010814854&office_id=056&mode=search&query=신한지주&page=1
"우리금융, 온라인 펀딩플랫폼 활용…장애인 면역력 증지 지원등신한금융, 임직원 동참해 50억원 목표…DGB도 경북도 지원","(서울=뉴스1) 송상현 기자 = '버스·지하철 기사 마스크 및 영영제 지원, 장애인 면역력 증진 지원…'금융권이 신종 코로나바이러스 감염증(코로나19) 확산으로 피해를 보거나 어려움을 겪는 사람들을 돕기 위한 '착한 크라우드펀딩' 행렬에 동참하고 있다. 우리금융그룹은 코로나19 취약계층을 지원하는 '클릭! 우리투게더' 크라우드펀딩을 실시한다고 6일 밝혔다. 크라우드펀딩은 자금을 필요로 하는 수요자가 온라인 플랫폼 등을 통해 불특정 다수 대중에게 자금을 모으는 방식으로 운영된다.이번 펀딩은 우리종합금융에서 운영하는 크라우드펀딩 플랫폼 위비크라우드에서 진행된다.클릭! 우리투게더는 6개 NGO 단체의 프로젝트로 실시된다. 버스·지하철 기사의 마스크 및 영양제 지원과 긴급생활키트 지원, 장애인 면역력 증진 지원 등 코로나19 감염에 취약한 이들을 위한 프로젝트로 구성됐다. 펀딩에 참여하려면 우리종합금융 위비크라우드 인터넷 홈페이지에서 회원에 가입하면 된다. 프로젝트 응원 클릭은 1000원, 댓글 작성과 SNS 공유는 각각 2000원씩 후원된다. 우리금융은 프로젝트당 최대 5000원까지 펀딩 참여자의 후원금을 지원한다. 추가 후원은 최소 1000원부터 카드결제로 할 수 있으며, 추가분에 한해 연말정산 소득공제와 기부금 영수증 발급도 된다.손태승 우리금융그룹 회장은“금융지주 중 유일한 자체 온라인 펀딩플랫폼을 통해 코로나19로 어려움을 겪고 있는 취약계층을 도울 수 있어 기쁘다”며 “그룹 역량을 총동원해 코로나19 피해복구를 지원하겠다”고 말했다.신한금융지주도 지난달 5일부터 코로나19 극복을 위한 지원금 총 50억원을 4개월 동안 모으는 '호프 투게더(Hope Together) 캠페인'을 이어가고 있다.신한금융 그룹사가 매주 '릴레이 기부' 형식으로 총 20억원을 지원하고, 크라우드펀딩 플랫폼 '와디즈'에서 일반인도 손쉽게 동참할 수 있다. 캠페인 시작 20일 만에 14억원이 모였다.기부금은 향후 사회복지공동모금회를 통해 전국 의료시설 등에 전달된다. 이 캠페인에는 조용병 신한금융그룹 회장, 진옥동 신한은행장 등 임직원도 참여했다.DGB금융그룹은 경북도와 손잡고 '경북도 사회적경제 크라우드펀딩 대회'를 후원한다. 경북 지역 사회적경제기업의 자금 조달 및 투자금 조성, 판로 개척 등을 위한 경북 최초의 크라우드펀딩 대회다. 오는 10일까지 오마이컴퍼니 사이트에서 누구나 참여할 수 있다.songss@news1.kr© 뉴스1코리아(), 무단 전재 및 재배포 금지",/news/news_read.nhn?article_id=0004566198&office_id=421&mode=search&query=신한지주&page=1
