head,text,url
작년 순익 실질증가 6%코로나19로 건전성 비상금감원 주주환원에 제동지난해 수준서 유지될듯,"[헤럴드경제=홍석희·김성훈 기자] 지난해 금융지주회사 순이익이 15조원을 넘어섰다. 숫자로만 보면 전년대비 30% 이상 불어났다. 하지만 지난해 새롭게 금융지주가 된 우리금융지주와, 신한지주에 편입된 오렌지라이프를 제외하면 실질 증가폭은 6% 안팎에 머문다. 올해엔 코로나19 여파로 금융지주사들의 경영환경은 더 어렵다. 금융감독원은 이미 건전성 악화 대비를 명분으로 올해 은행 감독방향에 ‘배당 축소’를 명문화 했다. 이익증가 둔화에 이어 배당축소 우려까지 겹치는 모습이다. ▶‘사상 최강’ 건전성에도 이익성장 6%대=6일 금감원에 따르면 지난해 10개 금융지주회사의 연결당기순이익은 15조2338억원으로 전년(11조6410억원) 대비 30.9%(3조5928억원) 증가했다. 연결총자산은 2628조6000억원으로 전년말(2068조원) 대비 27.1%(560조6000억원) 늘었다.지난해 말 기준 10대 금융지주는 신한, KB, 농협, 하나, 우리, BNK, DGB, JB, 한투, 메리츠다. 우리금융지주(27개사)가 설립되는 등 지주회사 소속 회사 수가 34개 늘어났다. 우리은행과 오렌지라이프를 제외한 순이익 12조3469억원으로 따지면 전년대비 6.06% 늘어난 수준이다.사상 최강의 건전성이 바탕인 점을 감안하면 상대적으로 부진한 성적이다. 부실채권 현황을 나타내는 지표인 고정이하여신(NPL)비율은 0.58%로 전년 0.74% 대비 0.16%포인트(p) 내려갔다. 부채비율은 29.04%로 신종자본증권 발행 증가 등으로 전년 32.22% 대비 3.18%p 하락했다.▶올해 ‘배당 줄이라’ 감독 방향=윤석헌 금감원장은 지난 2일 내부 회의에서 “국내 은행도 (배당금 지급이나 자사주 매입을 자제하는) 글로벌 흐름을 참고해 충분한 손실흡수와 자금 공급 능력을 유지해야 한다”고 강조했다.금감원이 이날 밝힌 올해의 은행 감독 방향에도 현금배당 지급과 자기주식 매입 및 경영진에 대한 과도한 성과급 지급을 자제하라는 내용이 담겼다. 최근 유럽중앙은행(ECB)과 영국 건전성감독청(PRA)은 감독을 받는 은행에 배당금 지급이나 자사주 매입, 성과급 지급을 중단토록 했다.올해는 코로나19로 건전성이 지난해보다 나빠질 가능성이 크다. 그만큼 이익에 부담이다. 이익성장이 둔화되면 최근 급락한 주가를 끌어올릴 방법은 배당 밖에 없다. 배당성향을 낮출 경우 주가순자비율(PBR) 0.3배 안팎인 4대 금융지주사 기업가치는 더 떨어질 수 있다. PBR 0.2배는 사실상 순자산의 80%를 무수익 또는 잠재부실로 본다는 뜻이다.하지만 지난해 수준의 배당만 유지해도 4대 금융지주의 현재 시가배당률은 무려 연 7~9%로 투자매력을 높게 유지할 수 있다. 주가반등의 단초가 충분히 될 수 있는 셈이다.금감원 관계자는 “단순 권고일 뿐 배당을 줄이라고 강제할 수는 없다”고 말했다.금융지주사 관계자는 “지난해 말 예정됐던 배당과 자사주 매입과 소각 절차만 마치면 모든 주가부양책을 당분간 보류할 예정”이라고 말했다.
- Copyrights ⓒ 헤럴드경제 & heraldbiz.com, 무단 전재 및 재배포 금지 -",/news/news_read.nhn?article_id=0001658244&office_id=016&mode=search&query=신한지주&page=1
1월20일 이후 42거래일 18조8497억 매도최근 22일 연속 매도세 13조619억 매도,"[서울=뉴시스] 김동현 기자 = 외국인 투자자들이 최근 23일 거래일 연속 매도세를 보이며 역대 4번째 매도 최장 기록과 타이를 이뤘다. 외인의 매도세가 2거래일 더 추가되면 역대 3번째 매도 최장 기록을 돌파하게 된다. 6일 금융투자업계에 따르면 외인들은 지난 1월20일 국내에서 신종 코로나바이러스 감염증(코로나19) 확진자가 처음 나온 이후 52거래일 중 42거래일에서 매도 우위를 보이며 18조8497억원 어치의 주식을 팔았다. 최근에는 22거래일 연속 매도세를 보이며 13조619억원 어치의 국내 주식을 팔았다. 6일 오전에도 매도 우위를 보이고 있다는 점을 포함한 23거래일 연속 매도는 역대 사례를 살펴봐도 4번째로 긴 기간이다. 역대 사례를 살펴보면 외인들은 글로벌 금융위기가 불거졌던 2008년 6월9일부터 7월23일까지 33거래일 연속 순매도 행보를 보이며 8조9834억원에 달하는 주식을 팔아치워 최장기간 1위를 기록하고 있다. 2위는 미국과 중국 증시 불안이 동시에 나타난 가중된 2015년 8월5일부터 9월15일까지다. 이때 외인들은 29거래일 동안 5조5431억원의 주식을 팔아치우기도 했다. 3위는 미국의 연속적인 금리인상, IT분야에서의 실적 불확실성이 높았던 2005년9월22일부터 같은해 10월26일까지 24거래일 연속 3조3010만원의 주식을 팔아치운 사례가 이름을 올린다. 특히 올해 외인들은 두달이 조금 넘는 기간동안 19조원에 달하는 국내 주식을 팔아치우며 기간대비 규모로 역대 최대 수준의 팔자 행보를 보인 것으로 분석된다. 외인들이 이 기간동안 가장 많이 팔아치운 주식은 삼성전자로 7조4746억원 어치의 주식을 시장에 내다판 것으로 확인됐다. 뒤를 이어 SK하이닉스 1조3243억원, 삼성전자우 1조2608억원 등이다. 외인 매도 상위 10개 종목에는 현대차 8005억원, SK이노베이션 6930억원, 삼성SDI 5022억원, 신한지주 4028억원, NAVER 3988억원, 한국전력 2861억원, 현대모비스 2709억원 등이다. 외국인들이 국내 주식을 모두 내다팔기만 한 것은 아니지만 최근 들어 사들인 종목의 규모는 매도 규모에 비해 턱 없이 모자란 것으로 분석된다. 외인 매수 상위 10개 종목에는 한진칼 2479억원, 셀트리온 1945억원, 삼성바이오로직스 1795억원, 삼성물산 1457억원, 삼성전기 1312억원, LG유플러스 901억원, KT&G 668억원, 넷마블 646억원, LG디스플레이 610억원, LG 586억원 등이다. 증권가에서는 코로나19 여파가 국내에 국한되지 않고 미국을 비롯해 유럽 등 주요 국가에서 확산됨에 따라 자금 확보 차원에서 외인들의 매도 행보가 이어지고 있다는 분석이 나온다. 또 코로나19 사태와 함께 발생한 국제유가 하락세로 인해 재정난에 빠진 산유국이 국부펀드의 자산을 현금화하면서 외인 매도세를 강화시켰다는 의견도 제시된다. 국제유가 정상화 이전에는 외인 매도세가 이어질 수 있다는 관측이다. 염동찬 이베스트투자증권 연구원은 ""최근 금융시장 안정화 흐름속에서도 유가 하락으로 인해 중동에서의 국부펀드 현금화 가능성 등으로 인해 외국인은 매도세를 이어가고 있다""며 ""유가가 안정될때까지 대형주·대표주 위주의 외국인 매도는 좀 더 이어질 수 있다. 외국인 매수 종목은 매도 안정화 이후 긍정적인 흐름을 기대할 수 있어 우호적인 접근이 필요하다""고 말했다. 방인성 케이프투자증권 연구원은 ""코노나19 확산 이후 주요국 주가 지수는 동조화 현상을 보이고 있다""며 ""특히 최근 유가 급락은 외국인들의 순매도 강도를 높이는 트리거로 작용하고 있다. 유가는 역사적으로 한국 수출과 상관계수가 높게 나타나기 때문이다. 유가 반등이 외국인 순매수를 위한 선제조건으로 판단한다""고 의견을 제시했다. oj1001@newsis.com<ⓒ 공감언론 뉴시스통신사. 무단전재-재배포 금지>",/news/news_read.nhn?article_id=0009798072&office_id=003&mode=search&query=신한지주&page=1
작년 순익 실질증가폭 6% 안팎코로나19 따른 건전성 악화 대비금감원 ‘주주환원 자제’ 권고지난해 수준 유지해도 투자 매력,"지난해 금융지주회사 순이익이 15조원을 넘어섰다. 숫자로만 보면 전년대비 30% 이상 불어났다. 하지만 지난해 새롭게 금융지주가 된 우리금융지주와, 신한지주에 편입된 오렌지라이프를 제외하면 실질 증가폭은 6% 안팎에 머문다. 올해엔 코로나19 여파로 금융지주사들의 경영환경은 더 어렵다. 금융감독원은 이미 건전성 악화 대비를 명분으로 올해 은행 감독방향에 ‘배당 축소’를 명문화 했다. 이익증가 둔화에 이어 배당축소 우려까지 겹치는 모습이다.▶‘사상 최강’ 건전성에도 이익성장 6%대=6일 금감원에 따르면 지난해 10개 금융지주회사의 연결당기순이익은 15조2338억원으로 전년(11조6410억원) 대비 30.9%(3조5928억원) 증가했다. 연결총자산은 2628조6000억원으로 전년말(2068조원) 대비 27.1%(560조6000억원) 늘었다.지난해 말 기준 10대 금융지주는 신한, KB, 농협, 하나, 우리, BNK, DGB, JB, 한투, 메리츠다. 우리금융지주(27개사)가 설립되는 등 지주회사 소속 회사 수가 34개 늘어났다. 우리은행과 오렌지라이프를 제외한 순이익 12조3469억원으로 따지면 전년대비 6.06% 늘어난 수준이다.사상 최강의 건전성이 바탕인 점을 감안하면 상대적으로 부진한 성적이다. 부실채권 현황을 나타내는 지표인 고정이하여신(NPL)비율은 0.58%로 전년 0.74% 대비 0.16%포인트(p) 내려갔다. 부채비율은 29.04%로 신종자본증권 발행 증가 등으로 전년 32.22% 대비 3.18%p 하락했다.▶올해 ‘배당 줄이라’ 감독 방향=윤석헌 금감원장은 지난 2일 내부 회의에서 “국내 은행도 (배당금 지급이나 자사주 매입을 자제하는) 글로벌 흐름을 참고해 충분한 손실흡수와 자금 공급 능력을 유지해야 한다”고 강조했다.금감원이 이날 밝힌 올해의 은행 감독 방향에도 현금배당 지급과 자기주식 매입 및 경영진에 대한 과도한 성과급 지급을 자제하라는 내용이 담겼다. 최근 유럽중앙은행(ECB)과 영국 건전성감독청(PRA)은 감독을 받는 은행에 배당금 지급이나 자사주 매입, 성과급 지급을 중단토록 했다.올해는 코로나19로 건전성이 지난해보다 나빠질 가능성이 크다. 그만큼 이익에 부담이다. 이익성장이 둔화되면 최근 급락한 주가를 끌어올릴 방법은 배당 밖에 없다. 배당성향을 낮출 경우 주가순자비율(PBR) 0.3배 안팎인 4대 금융지주사 기업가치는 더 떨어질 수 있다. PBR 0.2배는 사실상 순자산의 80%를 무수익 또는 잠재부실로 본다는 뜻이다.하지만 지난해 수준의 배당만 유지해도 4대 금융지주의 현재 시가배당률은 무려 연 7~9%로 투자매력을 높게 유지할 수 있다. 주가반등의 단초가 충분히 될 수 있는 셈이다.금감원 관계자는 “단순 권고일 뿐 배당을 줄이라고 강제할 수는 없다”고 말했다.금융지주사 관계자는 “지난해 말 예정됐던 배당과 자사주 매입과 소각 절차만 마치면 모든 주가부양책을 당분간 보류할 예정”이라고 말했다.홍석희·김성훈 기자
- Copyrights ⓒ 헤럴드경제 & heraldbiz.com, 무단 전재 및 재배포 금지 -",/news/news_read.nhn?article_id=0001658300&office_id=016&mode=search&query=신한지주&page=1
"금감원, 지난해 10개 금융지주사 경영실적 분석 순이익은 30% 급증, 우리지주 제외시 15% 증가 총자본비율은 13.54%로 전년대비 0.84%p 하락","지난해 금융지주회사들은 순이익은 큰폭으로 증가했으나, 손실흡수 능력을 보여주는 자본적정성 지표는 하락한 것으로 나타났다.금융감독원이 6일 발표한 ‘2019년 금융지주회사 경영실적’을 보면, 10개 금융지주회사의 지난해 당기순이익(연결 기준)은 15조2338억원으로 전년보다 30.9% 증가했다. 자회사 권역별로는 은행이 29% 증가했고 금융투자는 펀드 관련 수익 증가로 23%가 늘었다. 보험은 신한금융지주의 오렌지라이프 자회사 편입 등으로 96% 증가했다. 다만, 지난해 출범한 우리금융지주 실적을 제외하면 금융지주의 당기순이익은 13조3616억원으로 전년보다 14.8% 증가한 것으로 집계됐다. 자회사 권역별로는 은행이 8%, 금융투자 22%, 보험 96% 각각 증가했다.지난해 말 현재 바젤Ⅲ 기준을 적용받은 은행지주의 자본적정성 지표는 하락했다. 총자본비율은 13.54%로 전년보다 0.84%포인트 하락했다. 금감원은 위험가중치 계산방법이 다른 우리금융지주의 편입과 기업·가계 대출 등 위험가중자산이 증가한 데 영향받은 것으로 설명했다.금감원은 “우리금융지주 설립, 신한금융지주의 오렌지라이프 편입 등으로 금융지주사의 자산·수익이 크게 증가해 국내 금융시스템 내 금융지주사의 비중이 더욱 확대됐다”며 “다만 코로나19에 따른 실물 및 금융부문 충격이 발생함에 따라 올해 실적은 악화할 가능성이 있다”고 밝혔다.금감원은 “금융지주사가 위기 시 손실흡수 능력을 강화할 수 있도록 적정 수준의 자기자본 유지를 유도할 것”이라며, 구체적으로 현금배당 지급, 자기주식 매입 및 경영진에 대한 과도한 성과급 지급 자제 등을 예시했다.박현 기자 hyun21@hani.co.kr[ⓒ한겨레신문 : 무단전재 및 재배포 금지]",/news/news_read.nhn?article_id=0002492374&office_id=028&mode=search&query=신한지주&page=1
20대기업 4월 외국인 배당금,"배당금 상위 20대 기업의 4월 외국인 배당금이 5조원 이상인 것으로 집계됐다. 그 중 삼성전자가 1.3조원으로 가장 많은 비중을 차지했다.6일 금융감독원 전자공시시스템 및 한국거래소 등에 따르면, 배당금 상위 20개 기업 4월 외국인 배당금은 총 5조3818억원으로 나타났다. 배당금을 분기 지급하는 삼성전자는 총 2조4054억원의 배당금 중 1조3686억원(외국인 주식 보유 비중 56.9%)을 외국인에 배당한다.연말 결산으로 배당하는 신한지주는 5692억원, KB금융은 5726억원, 현대차는 3154억원, SK하이닉스는 3454억원을 지급하게 된다.외국인 배당시즌은 통상 환율과 경상수지에 악영향을 끼치는 요인으로 꼽힌다. 배당금 역송금에 따라 달러 수요가 단기간에 급증할 수 있어서다. 주식시장에서 외국인 순매도도 연일 이어지고 있어 배당금 역송금까지 겹칠 경우 재차 국내 원달러 수급 여건이 꼬일 수 있다.올해엔 삼성전자, SK텔레콤, 삼성물산 등이 배당금을 전년과 같게 유지하거나 올렸기 때문에 상장사 외국인 배당금 총액은 전년 대비 증가할 것으로 예상된다. 이태형 기자
- Copyrights ⓒ 헤럴드경제 & heraldbiz.com, 무단 전재 및 재배포 금지 -",/news/news_read.nhn?article_id=0001658319&office_id=016&mode=search&query=신한지주&page=1
,"지난해 금융지주회사의 순이익이 전년 대비 31% 늘어나며 15조 원을 넘어섰다. 지난해 1월 우리금융지주가 출범하고 지주사들이 자회사를 편입하면서 덩치를 키운 영향으로 풀이된다.6일 금융감독원이 발표한 ‘2019년 금융지주회사 경영실적(잠정)’에 따르면 10개 금융지주회사의 지난해 연결 당기순이익은 15조2338억 원으로 나타났다. 지주회사가 총 9곳이던 2018년 대비 30.9%(3조5928억 원) 증가한 수준이다. 10개 금융지주회사는 신한, KB, 농협, 하나, 우리, BNK, DGB, JB, 한국투자, 메리츠 등이다. 신설된 우리금융지주를 제외하더라도 지난해 연결 당기순이익이 13조3616억 원으로 전년 대비 14.8%(1조7206억 원) 늘어났다. 총자산은 지난해 말 2628조6000억 원으로 전년 말 대비 27.1%(560조6000억 원) 증가했다. 지난해 신한은 오렌지라이프생명 등 4개사, 한투는 한국투자부동산신탁 등 3개 사를 편입했다.지난해 말 바젤Ⅲ 기준을 적용받는 은행지주의 총자본과 기본자본, 보통주자본비율은 각각 13.54%, 12.10%, 11.10%였다. 위험가중자산 증가율(34.3%)이 총자본 증가율(26.5%)과 보통주 자본증가율(21.3%)을 넘어서 전년 말 대비 총자본비율과 보통주 자본비율이 각각 0.84%포인트, 1.19%포인트 하락했다.금감원은 “우리금융지주 설립, 신한금융지주의 오렌지라이프 편입 등으로 금융지주사의 자산·수익이 크게 증가하는 등 국내 금융시스템 내 비중이 더욱 확대됐다”며 “다만 코로나19에 따른 실물 및 금융부문 충격이 발생함에 따라 금년도 실적이 악화될 가능성이 있다”고 설명했다. 국내은행 총자산 중 지주사 소속 은행의 비중은 2016년 말 57.1%에서 지난해 말 70.9%로 늘어났다. 금감원은 현금배당 지급과 자기주식 매입 및 과도한 경영진 성과급 지급을 자제하도록 하는 등 금융지주사가 손실흡수 능력을 강화할 수 있도록 유도한다는 방침이다. 송정은 기자 euni@munhwa.com[Copyrightⓒmunhwa.com '대한민국 오후를 여는 유일석간 문화일보' 무단 전재 및 재배포 금지()]",/news/news_read.nhn?article_id=0002423533&office_id=021&mode=search&query=신한지주&page=1
,"[머니투데이 김사무엘 기자]
코로나19(COVID-19)로 인한 폭락장을 겪으면서 자사주 매입을 결정한 기업들이 크게 늘었다. 자사주 매입은 대표적인 주주친화 정책 중 하나로 주가 상승효과가 있다. 금융당국도 자본시장 안정을 위한 자사주 규제 완화를 시행한 만큼 증권가에서는 향후 자사주 매입 가능성이 높은 기업에 주목해야 한다고 분석한다.6일 한국거래소에 따르면 올들어 지난 3일까지 자사주 매입 공시 건수는 376건, 누적 매입금액은 1조4279억원으로 집계된다. 이는 지난해 같은 기간 60건 5587억원보다 크게 늘어난 수준으로 금액 기준으로는 2.5배 이상 급증했다.자사주 매입은 회사가 잉여 현금으로 자사가 발행한 주식을 일부 매입하는 것인데, 유통주식수 감소로 주식 가치가 상승하는 효과가 있어 주가가 급락하거나 지지부진할 때 회사가 주가를 방어하는 수단으로 자주 활용한다. 올해 자사주 매입이 급증한 것으로 코로나19로 인한 주가 폭락 때문이다. 올해 1~2월 자사주 매입 공시는 61건에 불과했는데, 본격적인 폭락장이 시작된 3월 이후에는 315건으로 폭발적으로 늘었다. 특히 금융위원회가 증시 안정을 위해 지난 16일부터 자사주 매입 규제를 완화하면서 기업들의 자사주 매입을 유도했다. 기존에는 자사주 취득신고를 해도 하루에 매입할 수 있는 수량은 최대 발행주식 총수의 1%까지였지만 지난 16일부터 6개월 간은 1일 주식 매수 한도가 없어지고 취득신고한 주식 전체를 한번에 매수할 수 있게 된다. 이 같은 대책이 나오면서 지난 16일 이후 246건의 자사주 매입 공시가 나왔다. 이는 올해 전체 자사주 매입 공시의 65%에 해당하는 규모다.증시가 폭락 이후 최근 2주일 간 반등하면서 자사주 매입 효과도 서서히 빛을 보는 중이다. 많은 종목이 이 기간 주가가 올랐지만 자사주 매입을 실시한 종목은 대부분 전체 지수보다 높은 초과 수익률을 기록했다.DB손해보험의 경우 지난 2월 255억원 자사주 매입을 실시한 이후에도 주가 하락이 계속되자 지난달 19일 추가로 926억원 규모의 자사주 매입을 공시했다. 이후 전체 시장이 반등하면서 DB손해보험 주가도 지난달 19일 2만3800원에서 지난 3일 3만4850원으로 46.4% 올랐는데, 이 기간 코스피 상승률(18.4%)보다 28.1%포인트 높은 수익률이었다.휠라홀딩스는 지난달 23일 200억원 규모의 자사주 매입을 공시했고 이후 주가는 44.4% 올랐다. 역시 같은 기간 코스피 상승률보다 28%포인트 높은 수준이다. 미래에셋대우, 대한해운, 아이마켓코리아 등도 최근 자사주 매입을 공시한 이후 코스피 상승률보다 10%포인트 이상 높은 주가 상승폭을 기록했다. 한국타이어앤테크놀로지, 효성, 유니드, 뷰웍스, 지누스 등도 자사주 매입으로 주가 상승 효과를 본 기업들이다.자사주 매입 기업들은 공시 이후에도 주가가 꾸준히 올라 단기적으로 대표지수를 초과하는 수익률을 올리고 있다는 점에서 최근 자사주 매입을 공시한 기업이나 자사주 매입이 예상되는 기업에 주목할 필요가 있다는 분석도 나온다.KB증권에 따르면 최근 1년 동안 주주가치 제고를 위해 자사주 매입 또는 소각을 실시했거나, 자사주 매입·소각량이 컸던 기업 중 PER(주가순수익비율)이 낮아 추가 매입 여력이 있는 기업들은 현대차, 현대모비스, 이마트, 현대백화점, 대신증권, 키움증권, 메리츠화재, KB금융, 하나금융지주, 신한지주 등이다.김민규 KB증권 연구원은 ""자사주 매입 한도 완화로 주주가치 방어에 적극적인 기업들이 더 적극적인 자사주 매입에 나설 수 있게 됐다""며 ""최근 자사주 매입을 시행한 기업 중 주가가 저평가된 기업들은 추가 자사주 매입 가능성이 있다""고 분석했다.김사무엘 기자 samuel@mt.co.kr
<저작권자 ⓒ '돈이 보이는 리얼타임 뉴스' 머니투데이, 무단전재 및 재배포 금지>",/news/news_read.nhn?article_id=0004389958&office_id=008&mode=search&query=신한지주&page=1
