head,text,url
다음주 슈퍼위크 돌입...긴장하는 기업들상장사 1523곳 개최 몰려27일엔 한진칼·LG 등 670곳 국민연금 의결권 행사 주목한진그룹 지분 2.9% 보유 경영권 분쟁 변수 급부상신한지주·우리금융 회장들 사내이사 선임에 '반대' 예고,"[아시아경제 박지환 기자, 이민지 기자] 상장사들의 정기 주주총회가 다음 주에 집중된다. 무려 1523곳의 주총이 예정돼 있다. 오는 27일 하루에만 한진칼, 네이버, 롯데지주, LG, GS 등 670곳이 주총을 여는 등 '슈퍼주총데이'도 예정돼 있다. 올해 주총은 신종 코로나바이러스감염증(코로나19) 여파로 크게 바뀐 주총 분위기와 개별 기업의 경영권 분쟁이나 이사 선임 안건을 두고 국민연금의 목소리가 가장 큰 관심사로 떠올랐다.20일 재계에 따르면 올해 주총 시즌에는 '큰손' 국민연금의 의결권 행사에 관심이 집중되고 있다. 국민연금은 스튜어드십 코드(기관투자가의 의결권 행사 지침) 도입에 따라 지배구조 개선은 물론 배당 등 주주환원 대책에 대한 요구를 할 수 있다. 국민연금은 이달 7일 기업 56곳에 대한 주식 보유 목적을 '단순 투자'에서 배당이나 지배구조 개선에 관여할 수 있는 '일반 투자'로 변경했다. 삼성전자, SK하이닉스, 현대차, 대한항공 등 주요 대기업들이 대거 포함됐다. 포스코, KT&G, 신한지주 등 9개사의 경우에는 최대주주가 국민연금이다. 기업들은 국민연금의 입김에 크게 흔들릴 수 있는 상황이 된 것이다.다음 주 국민연금의 의결권 행사와 관련해 관심이 몰리는 곳은 단연 한진그룹이다. 한진그룹의 지주회사인 한진칼과 주주연합(KCGIㆍ반도건설ㆍ조현아 전 대한항공 부사장)은 오는 27일 주총에서 경영권을 놓고 치열한 표 대결을 벌일 전망이다. 지분 2.9%을 보유한 국민연금은 한진칼 정기 주총에서 의결권을 직접 행사하기로 하면서 막판 경영권 분쟁의 변수로 떠올랐다. 현재 3자 연합이 의결권을 행사할 수 있는 한진칼 지분은 31.98%로 조원태 회장 측의 우호 지분 33.45%와 비교해 불과 1.47%포인트 밖에 차이가 나지 않기 때문이다. 하지만 경영권 분쟁을 놓고 재계에서는 조원태 회장 쪽으로 무게 중심이 기울었다는 평가가 나온다. 국민연금의 의결권 자문사인 ISS와 KCGS 등 영향력 있는 국내외 의결권 자문사들이 조원태 회장의 손을 들어줬기 때문이다. 이밖에 글로벌 협력사, 대한항공 임직원ㆍ노조까지 조원태 회장 편에 섰다.국민연금이 신한지주와 우리금융 주총에서 조용병 회장과 손태승 회장의 사내이사 선임의 건에 대해 반대 의결권을 행사하기로 한 것도 큰 관심사다. 두 후보 모두 기업가치 훼손 내지는 주주권익 침해 이력이 있다는 게 국민연금의 판단이다. 신한지주는 국민연금이 9.76%의 지분을 보유해 최대주주이며, 우리금융은 예금보험공사(17.25%)에 이어 2대 주주(8.82%)이다.이 밖에 27일 주총을 앞둔 대림사업과 에스엠도 주목된다. 두 기업 모두 재무 건전성, 잉여현금흐름, 현금보유 수준을 고려했을 때 배당지급 여력이 크지만 배당 성향 및 배당수익률이 다른 업계 대비 낮다. 대림산업의 2018년 기준 배당 성향은 10%로 동종 업계 평균 배당 성향은 17% 수준이다. 에스엠은 현재 배당을 시행하지 않고 있어 지난해 한 차례 KB자산운용으로부터 주주 서한을 받기도 했다.현대백화점과 롯데쇼핑 주주총회에선 사내이사 선임 안건이 주목할 부분이다. 현대백화점은 정지선 현대백화점그룹 회장의 재선임 안건이 화두다. 주요 의결권 자문사들은 재선임 통과 시 현대백화점, 현대그린푸드의 등기임원으로 동시에 재직하게 돼 이해상충의 우려가 크다고 보고 있다.30일 열리는 분식회계 혐의 논란에 서 있는 KT&G 주총도 국민연금이 최대주주(11.01%)로서 목소리를 키운다. 지난 4일 금융감독원은 KT&G가 2011년 인수한 인도네시아 담배회사 트리삭티와 관련해 고의로 회계처리 기준을 위반했다고 결론 내렸다. 금감원은 KT&G에 대해 검찰 통보와 임원 해임 건의 등 중징계 조치를 통지한 상태다.올해 주총에서는 코로나19 확산으로 '언택트(Untactㆍ비대면)' 트렌드도 확산됐다. 다수 기업들은 사람간 접촉을 최대한 차단하기 위해 현장 참석보다는 전자투표를 독려 중이다. 전자투표를 진행하지 않거나 부득이 현장 주주총회에 참석할 경우에는 마스크 착용을 의무화 하는 등 주총장 풍경이 이전과는 확연히 달라졌다. 이외에도 소독 작업, 열화상카메라를 통한 참석자 체온 체크, 자리 띄어 앉기 등의 대대적인 방역 조치가 이뤄지고 있다. 일부 기업들은 온라인으로 주주총회를 생중계할 에정이다. SK텔레콤은 오는 26일 정기 주총을 실시간 동영상으로 온라인 중계한다. 최고경영자(CEO) 등 경영진이 현장에서 온라인으로 주주들의 질문에 답변하는 방식이다.박지환 기자 pjhyj@asiae.co.kr이민지 기자 ming@asiae.co.kr <ⓒ경제를 보는 눈, 세계를 보는 창 아시아경제 무단전재 배포금지>",/news/news_read.nhn?article_id=0004646446&office_id=277&mode=search&query=신한지주&page=3
"일반주주, 경영진 추천후보 신임사상초유 이사회 마비사태 모면조용병·손태승 연임가도 파란불","하나금융지주 주주들이 20일 열린 주주총회에서 경영진 추천 이사후보에 신임을 보냈다. 단독 최대주주인 국민연금이 반대했지만, 주주들의 동의를 얻지 못했다.국민연금 주장대로 부결됐다면 하나금융은 사상 초유의 이사회 기능 마비 사태에 처할 수 있었다.공적연금이 막강한 영향력만 믿고 일반 주주들의 동의를 구하는 과정 없이 ‘나를 따르라’는 식의 행보를 보인데 대해 시장이 제동을 걸었다는 평가다. 일방적으로 내주 열릴 신한지주와 우리금융지주 주총에서 최고경영자(CEO) 안건도 무난히 처리될 전망이다.하나금융은 20일 서울 명동사옥에서 주총을 열고 재무제표 승인 및 사외이사 선임 안건을 모두 통과시켰다. 이로써 하나금융 사외이사 전원은 연임에 성공했다. 내년 3월 임기가 끝나는 김정태 회장의 후임을 결정할 회장후보추천위원회(회추위)도 큰 변화 없이 유지될 전망이다.이번 주총은 ‘5% 룰’이 완화된 후 처음으로 국민연금이 적극적인 의결권을 행사하는 자리였다. 일반 주주들은 전자투표가 가능해 사실상 시장과 공적연금의 대결이었다.지분 9.94%를 쥐고 있는 국민연금은 전날 사외이사 선임의 건과 감사위원 선임의 건에 대해 ‘반대’ 의견을 밝혔다. 이유 설명은 ‘기업가치 훼손 내지 주주권익 침해 이력이 있고, 기업가치 훼손 내지 주주권익 침해행위에 대한 감시 의무를 소홀히 했다’는 단 한 줄 뿐이었다.하나금융그룹이 해외금리 연계 파생증권(DLF)과 채용비리를 겪은 사실이 배경으로 추정되지만, 이는 일반 주주들고 익히 하는 내용이다. 66.87%에 달하는 지분을 보유한 외국인 주주들 대부분도 국민연금에 동의하지 않았다. 하나금융 정관상 이사회 구성요건은 사외이사는 3명 이상, 전체 이사수의 과반이상이다.경영진 추천 이사 전원을 거부하는 국민연금의 주장이 관철됐다면 하나금융 이사회에는 김정태 회장과 차은영 사외이사만 남게 될 뻔 했다.내주 신한지주와 우리금융 주총에서도 국민연금이 다른 주주의 지지를 못 받을 가능성도 커졌다.신한금융은 국민연금이 9.76%의 지분을 갖는 최대주주이며, 블랙록 펀드가 6.13%, 우리사주조합이 5.07%를 보유 중이다.외국인 지분이 60%가 넘지만 신한은행을 설립한 재일교포 지분만 전체 주식의 약 15%를 점유하고 있다. BNP파리바 등도 현재 조용병 회장 연임을 추천한 이사회에 참여하고 있다. 이미 조 회장 연임에 찬성 위임장을 전달한 기관도 상당수 인 것으로 알려졌다. 금융권 관계자는 “의결권을 위임한 기관들과 외국인 주주들의 경우 적대적 인수·합병(M&A)이 아닌 이상 안건에 반대할 가능성이 낮다”고 말했다.우리금융은 국민연금(7.71%)이 예금보험공사(17.25%)에 이은 2대 주주다. 과점 주주들의 지분율이 높다.공적기구인 예보의 행보가 변수지만, 이사회에 참여해 손태승 회장 연임추천에 동참했다는 점에서 ‘자기부정’이 어려운 상황이다. 예보의 이탈만 없다면 손 회장의 과반확보는 무난하다. 이승환 기자
- Copyrights ⓒ 헤럴드경제 & heraldbiz.com, 무단 전재 및 재배포 금지 -",/news/news_read.nhn?article_id=0001651379&office_id=016&mode=search&query=신한지주&page=3
,"윤종규 KB금융지주 회장이 푸른덴셜생명 인수 참여에 대해 “굉장히 견실한 회사라 고심을 해 입찰을 했다”고 20일 말했다.





윤 회장은 이날 KB금융지주 주주총회에서 “보험은 여전히 괜찮은 비지니스로 본다”며 이같이 밝혔다. 이날 주총에서 푸르덴셜생명보험 인수는 안건이 아니었다. 이날 상정된 안건은 이사회 내 ‘ESG(환경·사회책임·기업지배구조)위원회’ 신설과 사외이사 선임 등이 주요 안건이었다.



그런데 주총에 참여한 KB손해보험 노동조합 김대성 위원장이 푸르덴셜생명 인수 문제를 꺼냈다. KB금융은 전날 푸르덴셜생명 본입찰에 참여한 상태다. 푸르덴셜생명의 인수가는 2조원가량으로 추정되고 있다.



▶김대성 위원장=“지금 금리가 떨어지고 있다. 앞으로 푸르덴셜생명은 엄청난 금리 역마진이 예상된다. 생명보험의 매각가는 지금이 최고가이고 앞으로 하락이 예상된다. 왜 지금 시점에 인수에 적극 나서야 하나”


김 위원장의 발언처럼 생명보험회사의 전망은 밝지 않다. 저금리가 지속되며 종신보험 등의 판매가 부진한 데다, 투자 수익을 거두기도 마땅치 않은 상황이다. 새 회계기준인 IFRS17이 2023년 도입되면 보험부채를 보험 판매시점의 원가가 아닌 현재 시가로 평가해야 한다. 보험판매시점보다 금리가 지속적으로 내려오고 있는 만큼 보험사의 부채는 크게 늘어나게 된다.


윤 회장은 “비가 온다고 모든 사람이 집에 있을 필요가 없다. 오히려 우산을 갖춘 사람은 비의 정취를 즐길 수 있다”고 맞섰다. 푸르덴셜생명이 견실한 매물이라는 취지다. 푸르덴셜생명은 지난해 9월 기준으로 보험건정성 지표인 지급여력비율이 515%로 업계 최고 수준인 알짜매물로 꼽힌다.


▶윤 회장=“제로금리와 저금리는 유럽과 일본이 이미 경험을 했다. 그런데 유럽과 일본 모두 생명보험사가 은행보다 주가순자산비율(PBR)이 높다. 어려운 환경일수록 뛰어난 회사는 기회가 있다. 보험에 대한 수요는 여전히 있다. 보험을 괜찮은 비즈니스로 보고 충분한 기회가 있다고 본다.”





윤 회장이 김 노조위원장 발언에 ‘발끈’하는 기류도 감지됐다. 김 노조위원장이 푸르덴셜생명 인수 배경에 대해 “혹시 (윤 회장의) 3연임 목적으로 1등 탈환, 성과 부풀리기용 인수합병이 아닌가”고 하면서다. 김 노조위원장은 “배임에 대한 검토는 했냐” 등의 발언도 했다.


윤 회장은 올해 11월 임기가 만료돼 3연임에 도전하게 된다. 신한지주와 KB금융이 벌이고 있는 리딩뱅크 다툼은 금융지주 회장의 주요 성과 지표 중 하나다. 지난해까지는 순이익 기준으로 신한지주가 앞서고 있다.


 이에 대해 윤 회장은 “앞으로 부담이 어떻게 될지를 정확하게 계산을 안 하고 비딩을 할 이유는 없다. 그건 손보노조위원장이 너무 경영진을 가볍게 보는 거 아닌가 생각을 한다”고 맞섰다. 그러면서 “우선 손해보험 쪽에 더 잘해주셨으면 하는 부탁 말씀을 드린다”고 했다.



윤 회장의 말처럼 손해보험사도 상황이 녹록지는 않다. 지난해 KB손해보험의 당기순이익은 2343억원으로 2018년(2624억원)보다 10.7% 줄었다.



안효성 기자 hyoza@joongang.co.kr
▶ ▶
/ ⓒ중앙일보(https://joongang.co.kr), 무단 전재 및 재배포 금지",/news/news_read.nhn?article_id=0002985822&office_id=025&mode=search&query=신한지주&page=3
≪이 기사는 03월20일(10:39) 자본시장의 혜안 ‘마켓인사이트’에 게재된 기사입니다≫,"국민연금이 최대주주로 있는 BNK금융지주와 2대 주주로 있는 삼성증권의 정기 주주총회에서 각각 반대표를 행사했다. 신한금융지주와 우리금융지주에 이어 금융사의 사내이사 연임 등에 적극 반대 의결권을 행사하는 모습이다.20일 증권업계에 따르면 국민연금은 이날 BNK금융지주의 정기 주총에서 사외이사이자 감사위원회 위원 선임 안건에 반대표를 던졌다.BNK금융지주는 이날 정기 주총에서 손광익 이스트드림시노펙스 회장을 사외이사이자 감사위원으로 재선임하는 안건을 올렸다. 손 회장은 호텔롯데 지원 및 마케팅 부문장과 롯데쇼핑 시네마사업본부 대표를 지냈다. 알펜시아 대표도 역임했다.국민연금 관계자는 ""최초 선임 때 중요한 지분 관계에 있는 회사의 최근 5년 이내 상근임직원으로 재직해 독립성 훼손 우려가 있다""고 설명했다.국민연금은 BNK금융지주의 최대주주다. 지난해 말 기준 국민연금은 BNK금융지주 지분 11.56%를 갖고 있다. 국민연금이 BNK금융지주 주식을 추가로 취득하면서 최대주주가 바뀌었다. 종전에는 부산롯데호텔 등 특수관계인(7개사)이 총 11.14%를 보유해 최대주주였다.또 국민연금은 이날 삼성증권의 정기 주총에서도 이사 선임 안건에 반대했다. 삼성증권은 사재훈 삼성증권 부사장을 사내이사로 재선임하는 안건을 올렸다. 국민연금은 ""기업 가치 훼손 이력 내지 주주 권익 침해 행위에 대한 감시 의무를 소홀하게 했다""는 이유로 반대표를 행사했다. 2018년 삼성증권 배당 사고 당시 내부통제 시스템 문제를 감안한 결정이다. 사 부사장은 당시 삼성증권의 사내이사였다.삼성증권의 최대주주는 삼성생명보험(지난해 말 기준 29.39%)다. 국민연금은 삼성증권 지분 11.36%를 갖고 있는 2대 주주다.한편 국민연금은 조용병 신한금융지주 회장과 손태승 우리금융지주 회장의 연임에도 반대표를 던지기로 입장을 정했다. 기업 가치 훼손 등이 이유다. 국민연금이 보유한 지분은 각각 신한금융지주 9.76%, 우리금융지주 8.82%다. 국민연금은 신한금융지주의 최대주주, 우리금융지주에 대해선 예금보험공사에 이은 2대 주주다.김은정 기자 kej@hankyung.com▶ ▶
 ▶
ⓒ 한국경제 & , 무단전재 및 재배포 금지",/news/news_read.nhn?article_id=0004310215&office_id=015&mode=search&query=신한지주&page=3
,"[앵커]신한금융지주와 우리금융지주는 다음 주 회장 연임을 결정할 주주총회를 엽니다.그런데 두 금융사에 지분이 있는 국민연금이 이들 연임에 반대 입장을 내면서 연임이 가능할지 주목됩니다.오정인 기자 연결합니다.적극적 주주권 행사를 예고한 국민연금이 결국 칼을 빼 들었네요?[기자]어제(19일) 국민연금은 조용병 신한금융지주 회장과 손태승 우리금융지주 회장의 사내이사 선임안에 반대표를 행사하기로 했습니다.국민연금은 지난해 9월 기준으로 신한금융 지분 9.38%를 보유한 1대 주주이고요.우리금융에서도 7.71%로, 예금보험공사(17.25%) 다음으로 지분이 많은 2대 주주입니다.그런 국민연금이 회장들의 사내이사 선임에 반대했단 건 연임에 제동이 걸릴 수 있다는 것으로 해석됩니다.[앵커]국민연금은 왜 이런 결정을 내렸을까요?[기자]조 회장과 손 회장이 기업가치를 훼손하고 주주권익을 침해했다고 판단했기 때문입니다.조 회장은 채용 비리 혐의로 1심에서 유죄를 선고받았고, 손 회장은 DLF 사태로 향후 연임을 못 할 수도 있는 중징계를 받았습니다.이에 두 사람 모두 연임을 위해 법적 대응에 나선 상황입니다.해외 연기금들에 이어 국민연금까지 반대 의사를 밝히면서 파장이 적지 않을 것으로 보이지만, 금융권 안팎에선 두 회장 우호 지분이 많아 무리 없이 진행될 것이란 관측도 나옵니다.[앵커]신한과 우리금융 주총이 다음 주죠?[기자]네, 우리금융이 오는 25일, 신한금융이 다음날인 26일 열립니다.그리고 KB금융과 하나금융은 오늘 오전 주총을 열었고요.다음다음 주인 오는 30일에는 농협금융지주 주총이 열릴 예정입니다.SBSCNBC 오정인입니다. 오정인 기자(jioh@sbs.co.kr) ▶ ▶ 저작권자 SBS미디어넷 & SBS I&M 무단전재-재배포 금지",/news/news_read.nhn?article_id=0000207702&office_id=374&mode=search&query=신한지주&page=3
,"[머니투데이 박광범 기자] 윤종규 KB금융지주 회장이 코로나19(COVID-19)로 주가가 폭락한 것과 관련, ""이럴 때일수록 KB의 체질을 강화하고, 체력을 단단히 하는 게 제 책무""라고 밝혔다.윤 회장은 20일 서울 여의도 KB금융 본사에서 열린 주주총회에서 일부 주주들이 저조한 주가에 대해 지적하자 ""작년 연말에 비해 반토막 되다시피 해서 민망하고, 당혹스러운 생각이 없지 않다""며 이 같이 말했다.KB금융 주가는 작년 연말 종가(4만7650원) 대비 지난 19일(2만6050원) 45.3% 하락했다. 주가 폭락은 KB금융 만의 문제는 아니다. 같은 기간 △신한지주 4만3350원→2만2450원 △하나금융 3만6900원→1만8550원 △우리금융 1만1600원→6560원 등 코로나19로 다른 금융주들도 맥을 못추고 있다.윤 회장은 ""모든 금융업이 (코로나19로 인한 주가하락을) 동일하게 겪고 있다""며 ""일관되게 말했듯이 앞으로도 주주 이익을 지켜나가고, 증대해 나갈 것""이라고 말했다.그는 주주 가치를 끌어올리기 위해 국내외에서 M&A(인수·합병)를 강화하고, 자사주 소각과 매입에도 유연하게 대응해나가겠다고 했다. 또 ""배당성향과 관련해서는 중장기적으로 30%에 근접해갈 수 있도록 노력을 계속하겠다""고 밝혔다.이날 주주총회에서는 푸르덴셜생명보험 인수 참여 적정성을 두고 논쟁이 벌어졌다.KB손해보험 노조 관계자는 새 국제회계기준(IFRS17)이 도입되면 시가평가 전환으로 부채 규모가 늘어날 뿐 아니라, 저금리 상황에서 역마진 우려도 있어 생보사를 인수할 시기가 아니라고 주장했다.이에 대해 윤 회장은 ""시가평가 시 자산이 어떻게 되고 앞으로 부담이 어떻게 될지 계산하지 않고 입찰에 참여했겠느냐""고 반박했다.그는 ""비가 온다고 해서 모든 사람이 집에 있을 이유는 없다""며 ""비가 올 때 우산, 장비를 갖춘 충실한 사람들은 비의 정취를 즐길 수 있다""고 강조했다. 그러면서 KB손해보험 노조관계자를 향해 ""손해보험을 인수한 지 4년이 됐는데, 잘 좀 해주시길 부탁드린다""고도 했다.한편 KB금융은 이날 주주총회에서 신임 사외이사로 권선주 전 기업은행장, 오규택 경영경제대학 교수를 신규 선임하는 안건을 의결했다. 특히 권 전 행장이 사외이사에 신규 합류하면서 KB금융의 여성 사외이사 비율은 14.3%에서 28.6%로 높아졌다.이사회 내에 'ESG(환경·사회·지배구조)위원회' 설치하는 안건도 통과됐다. ESG위원회는 윤 회장을 포함해 사내·사외이사로 구성된다. KB금융의 ESG 경영과 관련한 최고의사결정 기구다.박광범 기자 socool@mt.co.kr
<저작권자 ⓒ '돈이 보이는 리얼타임 뉴스' 머니투데이, 무단전재 및 재배포 금지>",/news/news_read.nhn?article_id=0004380042&office_id=008&mode=search&query=신한지주&page=3
,"[아시아경제 박지환 기자] 신한금융투자 김병철 사장이 20일 서울 여의도 본사에서 열린 이사회를 통해 최근 라임펀드 투자상품 판매에 따른 고객 손실발생에 대해 고객들에게 사과의 뜻을 표하며 대표이사직에서 물러 나겠다고 밝혔다.이날 김병철 사장은 ""고객 투자금 손실 발생에 대한 책임이 있고 없고를 떠나 신한금융투자가 고객의 신뢰를 되찾고 빠른 정상화를 위해서는 본인이 책임을 지고 물러나는 것이 맞다""며 사퇴의 뜻을 표명했다.김 사장은 ""신한금융투자에서 판매한 투자상품으로 고객님들에 끼친 손실에 대해 회사를 대표해서 머리숙여 사과의 말씀을 드린다""며 ""고객손실 최소화 방안을 준비하기 위해 그 동안 사퇴의사 표명을 미뤄왔다""고 밝혔다.아울러 ""신한금융투자는 앞으로 현재 검찰 수사가 진행중인 라임자산운용 사건에 대해 고객의 신뢰를 받는 금융기관으로서 책임있는 자세로 일말의 의혹이 남지 않도록 수사에 적극 협조할 것""이라고 강조했다.신한금융지주는 이날 오후 자회사경영관리위원회를 열어 김별정 사장 후임 후보를 추천할 예정이다.박지환 기자 pjhyj@asiae.co.kr <ⓒ경제를 보는 눈, 세계를 보는 창 아시아경제 무단전재 배포금지>",/news/news_read.nhn?article_id=0004646544&office_id=277&mode=search&query=신한지주&page=3
▶ 네이버 홈에서 [한국경제TV] 채널 구독하기 [생방송보기]▶ 대한민국 재테크 총집결! - [증권 / 주식상담 / 부동산],"[한국경제TV 방서후 기자]김병철 신한금융투자 사장이 물러난다.김병철 신한금융투자 사장은 오늘(20일) 서울 여의도 본사에서 열린 이사회에서 최근 투자상품 판매에 따른 고객 손실발생에 대해 고객들에게 사과의 뜻을 표하며 대표이사직에서 사임하겠다고 밝혔다.이날 오전에 열린 이사회에서 김병철 사장은 ""고객 투자금 손실 발생에 대한 책임이 있고 없고를 떠나 신한금융투자가 고객의 신뢰를 되찾고 빠른 정상화를 위해서는 본인이 책임을 지고 물러나는 것이 맞다""고 사퇴의 뜻을 표명했다.또한 김 사장은 ""신한금융투자에서 판매한 투자상품으로 고객님들에 끼친 손실에 대해 제가 회사를 대표해서 머리숙여 사과의 말씀을 드린다""며 ""고객손실 최소화 방안을 준비하기 위해 그 동안 사퇴의사 표명을 미뤄왔었다""고 덧붙였다.그는 이어 ""신한금융투자는 앞으로 현재 검찰 수사가 진행중인 라임자산운용 사건에 대해 고객의 신뢰를 받는 금융기관으로서 책임있는 자세로 일말의 의혹이 남지 않도록 수사에 적극 협조할 것""이라고 말했다.한편 신한금융지주는 김병철 사장의 사퇴 의사를 존중한다며 이날 오후 자회사경영관리위원회(이하 '자경위')를 열어 후임 대표이사 후보를 추천하기로 했다.신한금융 관계자는 ""신임 신한금융투자 사장은 무엇보다 최근 사태를 고객의 입장에서 신속하게 책임지고 해결할 수 있는 역량을 갖춘 인물로 선정할 것""이라며 ""고객 손실 최소화와 함께 떨어진 시장의 신뢰를 회복할 수 있도록 그룹 차원에서 최대한 지원을 아끼지 않을 것""이라고 밝혔다.방서후기자 shbang@wowtv.co.krⓒ 한국경제TV, 무단 전재 및 재배포 금지",/news/news_read.nhn?article_id=0000857606&office_id=215&mode=search&query=신한지주&page=3
