head,text,url
,"한국 증시가 단기 과열 부담에도 불구하고 유동성 모멘텀(전환 국면)에 경기 모멘텀이 가세해 2차 상승을 기대할 수 있다는 전망이 나왔다.30일 한국거래소에 따르면 지난 3월6일 2040.22포인트(종가 기준)였던 코스피 지수는 신종 코로나 바이러스 감염증(코로나19) 여파로 3월19일 1457.64포인트까지 폭락했었다.코로나19 여파와 미중 무역갈등 우려 등 악재가 산재한 상태에서 코스피 지수는 26일 2029.78포인트(종가 기준)로 상승했다. 2개월 반 만의 2000선 회복이며 올해 고점 대비 하락폭의 70% 이상을 회복한 수치다.불확실성이 해결되지 않은 상태에서 급등한 코스피 탓에 기업 실적 대비 주가 수준(밸류에이션)이 부담스럽다는 우려가 있다. 하지만 풍부한 유동성(자금)과 글로벌 정부들의 추가적인 경기부양정책으로 펜더멘털(경기) 장세가 펼쳐질 가능성이 있다는 전망도 나온다.이경민 대신증권 연구원은 ""한국을 비롯한 전 세계 증시의 1차 상승세(유동성 장세)가 예상보다 강하다""며 ""하반기 경제지표 반등과 전 세계 정부들의 추가적인 경기부양정책으로 인한
펜더멘털 장세로 진입 가능성이 높다""고 말했다.이 연구원은 숨 고르기 장세가 6월 중순까지 이어질 것으로 내다봤다. 그는 ""단기 등락은 유동성 장세에서 펜더멘털 장세로 전환되는 과정""이라며 ""6월 중순 이후 글로벌 실물경제지표 회복 강도에 따라 2차 상승추제 진입 시점과 강도가 결정될 것""이라고 전했다.지수 상승이 제한된 시기에는 소외주들의 관심이 높아진다. 이 연구원은 이번 조정 장세에서 주도주와 소외주의 격차가 줄어들고 하반기에는 기존 주도주인 소프트웨어, 반도체, 2차 전지 관련 종목이 강세를 보일 것으로 분석했다.윤경진 기자 youn1@mt.co.kr
<저작권자 ⓒ '성공을 꿈꾸는 사람들의 경제 뉴스' 머니S, 무단전재 및 재배포 금지>",/news/news_read.nhn?article_id=0000548918&office_id=417&mode=search&query=셀트리온&page=1
"코로나 잊은 코스닥, 730선 돌파로 연 고점 경신바이오에서 IT·미디어·엔터로 순환매 가능성","[이데일리 최정희 기자] 코스닥 지수가 신종 코로나 바이러스 감염증(코로나19)을 잊은 듯 연 고점을 경신했다. 두 달 반 만에 연 저점 대비 무려 70% 급등했다. 코스닥 랠리는 언제까지 지속할 수 있을까. 마켓포인트에 따르면 코스닥 지수는 29일 713.68에 마감, 연초 이후 6.6% 올랐다. 코로나19에 주가가 폭락하면서 3월 19일 장중 419.55까지 떨어졌으나 두 달 만에 70.1% 오른 것이다. 27일엔 장중 730.41을 기록, 연 고점을 경신했다. 두 달 반 동안 코스닥 지수는 별다른 조정 없이 가파른 우상향을 그린 터라 중요한 저항선들을 모두 돌파했다. 코스닥 지수는 중장기 주가 추세의 분기점으로 작용하는 5월초 250일 이동평균선을 뛰어넘었다. 250일 이동평균선은 1년간의 종가를 산술 평균한 값이다. 다만 코스닥이 장기 상승세로 이어지기 위해선 250일 이평선에 안착하는 과정이 필요하다. 정인지 유안타증권 연구원은 “지금까지 형성된 단기 상승세가 지속하기보다 일정 수준의 조정을 통해 바닥을 다지면서 장기 상승 추세 형성 가능성을 타진할 수 있을 것”며 “단기 상승이 좀 더 이어진다면 750선이 중요한 저항선이 될 것이고 조정이 진행된다면 650선에 위치한 250일 이평선에서 바닥을 다지게 될 것”이라고 설명했다. 코스닥 지수는 27일 장중 730.41을 찍은 후 28일 2%대 하락했으나 다시 상승하며 710선이 유지됐다. 최근 증시 수급을 이끄는 주체가 코스닥 매매의 80%를 차지하는 개인투자자인데다 실적 측면에서도 코스닥 지수가 코스피에 비해 우위에 있다는 분석이 나온다.코로나로 건강에 대한 관심이 높아지면서 제약·바이오주들이 대거 코스닥 시가총액 상위 종목에 포진했다. 작년말까지만 해도 시가총액 1~5위 종목은 셀트리온헬스케어(091990), 에이치엘비(028300), CJ ENM(035760), 펄어비스(263750), 스튜디오드래곤(253450) 등 바이오와 게임·미디어주가 주를 이뤘으나 최근엔 셀트리온헬스케어, 에이치엘비, 알테오젠(196170), 셀트리온제약(068760), 씨젠(096530)으로 모두 바이오주 및 코로나 진단키트주로 채워졌다. 실적이 뒷받침되고 있다. 셀트리온헬스케어는 올해 영업이익이 작년보다 3.4배 늘어나고 씨젠은 무려 17.7배 증가할 것으로 추정되고 있다. 다만 주가가 빠르게 상승한 탓에 밸류에이션은 높은 편이다. 김중원 현대차증권 연구원은 “코스닥의 12개월 선행 주가순이익비율(PER)은 16.7배로 최근 5년 평균 대비 9.6% 높은 상황”이라면서도 “밸류에이션 부담에도 이익 전망치가 상향 조정되고 있다면 추가 상승에 있어 밸류에이션 수준은 크게 부담되지 않는다”고 설명했다. 금융정보분석업체 에프앤가이드에 따르면 88개 코스닥 상장사의 올해 영업이익 전망치는 전년동기보다 34.6% 증가할 것으로 예상된다. 또 한 달 전 추정치 대비해서도 3.7% 가량 상향 조정되고 있다. 지금까진 바이오주가 주도주로 코스닥 상승을 이끌었다면 앞으론 IT·미디어·엔터테인먼트로 순환매가 일어날 것이란 전망도 나온다. 최성환 리서치알음 수석연구원은 “개인투자자 자금 중 스마트 머니 성격이 많은데 이들이 손바뀜하면서 코스닥 주도 섹터가 바이오에서 IT, 미디어, 엔터테인먼트로 갈 수 있다. K푸드 등 음식료 등도 해외에서 인기가 많다”고 설명했다. 이어 “미디어, 엔터테인먼트쪽은 지수 상승 만큼 회복되지 않았으나 실물 이동 없이 소비가 가능한데다 시진핑 중국 국가주석의 방한, 한한령 해제 이슈 등으로 충분히 주목을 받을 만 하다”며 “특히 CJ ENM, 스튜디오드래곤(253450)은 시총 10위권 내에 있어 지수를 끌어올릴 만하다”고 덧붙였다.최정희 (jhid0201@edaily.co.kr)＜ⓒ종합 경제정보 미디어 이데일리 - 무단전재 & 재배포 금지＞",/news/news_read.nhn?article_id=0004652192&office_id=018&mode=search&query=셀트리온&page=1
,"[이데일리 노희준 기자] 이번 한 주(5월25일~5월29일) 제약·바이오업계에서 주목받은 뉴스다 △ 이의경 식약처장 “‘렘데시비어’ 도입 추진…코로나19 임상 긍정적”정부가 신종 코로나바이러스 감염증(코로나19) 치료제가 될 수 있을 것으로 기대를 모으는 렘데시비어(Remdesivir)의 국내 도입을 추진하고 있다고 29일 밝혔다. 이의경 식품의약품안전처장은 이날 정부세종청사에서 열린 중앙방역대책본부 정례 브리핑에 참석, “미국과 한국에서 진행되는 렘데시비어 임상 결과가 긍정적으로 나와 이 약물의 도입을 준비하고 있다”고 말했다. 렘데시비어는 신종 인플루엔자 치료제 ‘타미플루’를 개발한 미국 제약업체 길리어드 사이언스가 또 다른 전염병인 에볼라 치료제로 개발하던 약물이다. 사람 세포 속에 들어온 코로나19 바이러스의 증식을 멈추는 기능을 하는 것으로 알려졌다. 현재 정부는 렘데시비어에 대한 긴급사용 승인과 특례수입을 검토하는 것으로 알려졌다. 긴급사용 승인은 감염병 유행 상황에서 국내에서 사용 허가를 받지 않은 제품을 한시적으로 제조·판매·사용할 수 있게 한 제도이다. 특례수입은 사전 신고 없이 외국에서 들여올 수 있게 한 제도다.△ ‘발암 추정 물질’ 검출 31개 당뇨약 판매 중지국내 유통 중인 ‘메트포르민’ 성분의 당뇨병 치료제 31개 제품에서 발암 추정 물질이 기준치를 초과해 나왔다. 이에 따라 해당 제품의 제조·판매가 중지됐고 처방이 제한됐다. 식품의약품안전처는 메트포르민의 국내 유통 원료의약품과 완제의약품을 모두 수거·검사한 결과, 완제의약품 288품목 중 국내 제품 31품목에서 NDMA(N-니트로소디메틸아민)가 잠정관리기준(0.038ppm)을 초과해 검출됐다며 26일 밝혔다. NDMA는 세계보건기구(WHO) 국제 암연구소(IARC)에서 지정한 인체 발암 추정물질에 해당한다. 이에 따라 식약처는 완제의약품 31품목에 대해 제조와 판매를 잠정적으로 중지하고 처방을 제한했다. 다만 식약처는 해당 31개 제품을 복용한 환자의 추가 암 발생 가능성은 매우 낮다고 설명했다. 해당 제품의 인체영향평가 결과 추가로 암이 발생할 가능성이 ‘10만명 중 0.21명’이라는 판단에서다. △ ‘공적 마스크 5부제’ 폐지...언제든 주당 3개 구매 출생연도에 따라 구매 요일을 달리하는 ‘공적 마스크 5부제’가 6월부터 폐지된다. 이에 따라 평일·주말 상관없이 언제든 일주일에 1인당 공적 마스크 3개를 구매할 수 있다. 식품의약품안전처는 마스크 수급상황이 개선됨에 따라 이같이 공적 마스크 제도를 개선한다고 29일 밝혔다. 우선 공적 마스크 요일별 구매 5부제가 다음달 1일부로 사라진다. 이에 따라 6월 1일부터는 출생연도와 상관없이 공적 마스크를 직접 또는 대리 구매할 수 있다. 다만 공평한 구매를 위해 마스크 중복구매 확인 제도는 계속 유지된다. 1인당 구매 수량도 현재 주당 3개인 채로 유지된다. 또한 2002년 이후 출생자인 18세 이하 초·중·고 학생, 유치원생 등은 다음달 1일부터 공적 마스크를 ‘1주일에 5개’ 구입할 수 있게 된다. △ 일양약품, ‘슈펙트’로 러시아서 코로나19 치료제 3상 나선다 일양약품(007570)이 자사의 백혈병 치료제 ‘슈펙트’로 러시아에서 신종 코로나바이러스 감염증(코로나19) 치료제 임상 3상에 나선다. 일양약품(007570)은 슈펙트가 러시아 정부에서 코로나19 치료제의 유효성을 입증하기 위한 임상 3상을 승인받았다고 28일 밝혔다. 앞서 일양약품은 러시아 제약사 알팜사와 함께 러시아 당국의 임상3상 허가를 받기 위해 임상시험계획(IND)을 신청했고 27일 러시아 당국으로부터 임상 3상허가를 취득했다. 이번 러시아 임상 승인은 국내 여러 회사의 코로나19 치료제 후보군 가운데 해외에서 임상 승인을 받은 첫 케이스다. △ 셀트리온 ‘트룩시마’ WHO 품질인증…수출탄력 셀트리온(068270)의 혈액암 치료제 ‘트룩시마’(성분명 리툭시맙)가 세계보건기구(WHO)의 품질 인증을 받아 해외 수출에 탄력이 붙을 전망이다. 27일 셀트리온에 따르면, 트룩시마는 지난 25일 WHO의 사전적격성평가(PQ·Pre-Qualification) 인증을 획득했다. WHO PQ는 엄격한 기준에 따라 백신과 의약품의 제조공정, 품질, 임상시험 결과를 평가해 안전성 및 유효성을 인증하는 제도다. PQ 인증을 획득하면 UN 산하기관이 주관하는 국제 입찰에 참여할 수 있다. 이를 통해 개발도상국에 의약품도 공급할 수 있다△ 셀트리온헬스케어, ‘트룩시마’ 브라질 출시…중남미 직판 활동 본격화셀트리온헬스케어(091990)가 혈액암 치료용 바이오시밀러 ‘트룩시마’(성분명 리툭시맙)를 브라질에 출시한다고 27일 밝혔다. 이로써 셀트리온헬스케어는 ‘램시마’(성분명 인플릭시맙), ‘트룩시마’, ‘허쥬마’(성분명 트라스투주맙) 등 3개 바이오시밀러 모두를 중남미 최대 시장인 브라질에서 판매하게 됐다. 셀트리온헬스케어는 이달 초 브라질 3개 주정부 에서 개최된 리툭시맙 입찰에서 경쟁사들을 제치고 낙찰에 성공했다. 해당 주정부들과의 공급 계약을 마무리 짓고 다음 달부터 향후 1년 간 이들 지역의 공공시장에서 ‘트룩시마’를 독점 판매하며 브라질 시장 확대에 본격 돌입할 계획이다.△ 셀트리온, ‘인천 스타트업 파크’ 조성 사업 참여셀트리온(068270)은 인천광역시와 인천경제자유구역청이 주관하는 ‘인천 스타트업 파크’ 사업에 참여해 역량 있는 스타트업 발굴 및 육성에 앞장선다. 셀트리온은 27일 송도 투모로우시티 스타트업 타워 II에서 열린 ‘인천 스타트업 파크 비전 선포식’에서 신한금융과 컨소시엄으로 스타트업 입주기업 유치를 지원하고 육성 프로그램 등을 운영할 계획이라고 밝혔다. 인천 스타트업 파크는 올해 연말 인천광역시 송도 투모로우시티에 개장 예정으로 송도에 공공 자원과 민간 역량이 융합된 자생적인 스타트업 지원 생태계를 조성해 한국형 실리콘밸리를 조성한다는 목표로 추진되는 사업이다. 셀트리온은 송도 바이오 클러스터에 위치한 대표 기업으로서 4년간 스타트업 파크의 민간 운영사로 참여해 송도 바이오 밸리 구축을 위한 교두보 역할을 수행할 예정이다.△ 광동제약, 女 성욕저하장애 치료제 임상 3상 계획 승인광동제약(009290)이 ‘여성용 비아그라’로 알려진 여성 성욕저하 장애 치료제 ‘바이리시’의 임상 3상 시험에 나설 수 있게 됐다. 광동제약은 ‘바이리시’의 국내 가교 임상 3상에 대한 임상시험계획(IND)을 식품의약품안전처에서 승인받았다고 25일 밝혔다. 이에 따라 회사는 성욕저하 장애가 있는 폐경 전 여성을 대상으로 바이리시의 유효성과 안전성을 평가할 예정이다. △ 삼성바이오에피스, ‘온트루잔트’ 4년 추적 임상 결과 발표삼성바이오에피스는 유방암 및 전이성 위함 치료제 허셉틴의 바이오시밀러 항암제인 ‘온트루잔트’(성분명 트라스투주맙)의 장기 추적 임상시험 결과, 오리지널 의약품에 못지않은 안전성과 효능을 확인했다고 30일 밝혔다. 29일(현지시간) 열린 미국 임상종양학회(ASCO) 학술 대회 포스터 세션에서다. 삼성바이오에피스는 온트루잔트와 오리지널 의약품의 안전성 및 효능을 비교하는 임상시험 이후 5년간의 추적 관찰에 동의한 환자 총 367명을 대상으로 추가 연구를 실시, 최초 4년간의 추적 관찰 결과를 공개했다. 약물 투여 후 부작용이나 암의 재발, 전이 등이 생기지 않고 생존하는 ‘무사건 생존율’은 온트루잔트 투여군에서 83.4%, 오리지널 의약품 투여군에서 80.7%였다. 치료 후 일정 기간이 지났을 때 환자가 생존하는 비율을 나타내는 ‘전체 생존율’은 온트루잔트 투여군에서 94.4%, 오리지널 의약품 투여군에서 89.6%로 나타났다. △ 대웅제약, 국내 바이오 신약 1호 할랄 인증대웅제약(069620) 인도네시아 합작법인 ‘대웅인피온이 당뇨병성 족부궤양 치료제 ‘이지에프외용액’의 인도네시아 할랄 인증을 받았다. 할랄은 아랍어로 ‘허용된 것’이라는 뜻으로 무슬림들이 먹고 쓸 수 있게 생산·가공된 제품을 말한다. 당뇨성 족부궤양은 당뇨병이 진행되면서 혈액순환이 잘 안 돼 모세혈관이나 말초신경 기능이 약화되면서 발 감각이 둔해지고 작은 상처나 감염으로 발생하는 궤양 등을 말한다. 25일 대웅제약에 따르면, 이지에프외용액은 2001년 식품의약품안전처로부터 당뇨병성 족부궤양 치료제로 허가 받은 국내 바이오 신약 1호다. △ JW바이오사이언스, 세계 최초 패혈증 진단기술 미국 특허 등록 JW홀딩스(096760)는 손자회사인 JW바이오사이언스가 세계 최초로 개발하고 있는 WRS(트립토판-tRNA 합성효소)를 활용한 패혈증 조기 진단키트 원천기술이 미국특허청(USPTO)으로부터 특허등록 결정을 받았다고 25일 밝혔다. 현재 JW바이오사이언스는 WRS 진단키트 개발을 위해 신촌세브란스병원, 가천대길병원, 서울성모병원 등에서 임상시험을 진행하고 있으며 올해 하반기 품목허가를 신청할 계획이다.△ 헬릭스미스,미국 임상시험 전문가 잇단 영입헬릭스미스가 미국의 임상시험 운영을 총괄할 본부장과 품질관리본부장 등을 영입하면서 미국 임상시험 준비에 만전을 기하고 있다. 헬릭스미스(084990)는 28일 “아담 러스킨 박사를 임상시험운영본부장으로, 품질보증(QA) 전문가인 호세 자파타를 품질관리본부장으로 각각 외부영입했다”고 밝혔다. 헬릭스미스는 당뇨병성 신경병증 치료제 ‘엔젠시스’에 대한 후속 임상3-2상을 빠르면 이달말, 늦어도 다음달 초에 실시할 예정이다. 이번에 임상시험운영본부장으로 영입된 아담 러스킨 박사는 전문성과 다양한 경험을 갖춘 임상시험 운영 전문가라는 게 회사측 설명이다.△ 파미셀, ‘수지상세포 기반 차세대 항암면역치료백신’ 개발 본격화 파미셀(005690)은 과학기술정보통신부가 시행하는 ‘2020년 바이오·의료기술개발사업’ 세부과제 참여를 통해 ‘수지상세포 기반 차세대 항암면역치료백신’에 대한 개발 및 임상연구를 진행하게 됐다고 29일 밝혔다. 연구 기간은 다음 달 1일부터 오는 2024년 12월 31일까지 총 55개월이다. 이번 과제 수행을 통해 파미셀은 췌장암과 유방암처럼 난치성암 치료를 위한 ‘수지상세포를 기반으로 하는 차세대 항암면역치료백신’을 개발한다. △ 대원제약(003220), 코로나19 치료목적 정맥 마취제 스웨덴 수출대원제약은 신종 코로나바이러스 감염증(코로나19) 치료 목적으로 사용되는 정맥 마취제 ‘프리폴MCT주(성분명 프로포폴)’를 스웨덴에 긴급 수출한다고 26일 밝혔다. 이번 수출은 이달 초 룩셈부르크에 이은 두 번째로, 스웨덴에서도 현재 코로나19의 치료 목적으로 프로포폴 수요가 급증함에 따라 성사됐다.△ 우진비앤지, 파보바이러스 특허로 “반려동물 백신 개발中”우진비앤지(018620)가 재조합 개 파보바이러스 관련 특허를 취득해 반려동물 백신 개발에 나섰다. 우진비앤지는 농림축산검역본부, 바이오앱과 ‘재조합 개 파보바이러스 2c 항원 단백질 및 이의 용도’에 관한 특허를 취득했다고 28일 밝혔다. 특허 기술을 통해 생산된 개 파보바이러스 항원 단백질의 진단용 조성물은 바이러스 오염이 없어 안전하고 대량 시료를 신속 정확하게 진단할 수 있어 진단용 키트로 활용도가 매우 높다고 회사측은 설명했다.노희준 (gurazip@edaily.co.kr)＜ⓒ종합 경제정보 미디어 이데일리 - 무단전재 & 재배포 금지＞",/news/news_read.nhn?article_id=0004652293&office_id=018&mode=search&query=셀트리온&page=1
"ASCO서 임상 결과 발표…무사건 생존율 83.4%, 전체 생존율은 94.4%4월 미국 시장에 출시…처방 확대에 긍정적 영향 기대""","(서울=뉴스1) 성재준 바이오전문기자 = 삼성바이오에피스가 개발한 바이오시밀러(복제약)가 오리지널 의약품과 안전성 및 효능을 비교한 임상시험 중 일부 항목에서 오히려 개선된 효능을 나타났다. 삼성바이오에피스는 29일(현지시간) 미국 임상종양학회(ASCO) 학술대회 포스터 세션에 참여해 유방암 치료제 바이오시밀러 '온트루잔트(성분 트라스트주맙)'의 새로운 추적 임상 결과를 공개했다고 30일 밝혔다. 온트루잔트는 다국적제약사 로슈가 판매하는 '허셉틴'의 바이오시밀러다. 허셉틴은 2019년 기준 글로벌 매출 약 7조2000억원을 기록한 블록버스터 항암제다.삼성바이오에피스는 기존 임상시험 이후 추적 관찰에 동의한 환자 367명을 대상으로 온트루잔트와 오리지널 의약품의 효능 및 안전성 등을 비교 연구 중이다. 총 추적 관찰 기간은 5년이며, 이번 발표는 그 중 53개월에 해당되는 첫 4년간의 수치를 집계한 것이다.연구 결과 심장의 이상 기능을 확인할 수 있는 지표인 좌심실 박출률 수치가 저하된 환자는 온트루잔트 투여군 중 1명, 오리지널 의약품 투여군 중 2명으로 둘 다 낮은 수치를 보였다. 다른 안전성 지표인 울혈성 심부전증 관련 이상 징후는 두 집단 모두 발견되지 않았다. 하지만 약효에서는 일부 차이가 나타났다. 치료 시작 후 심각한 부작용이나 재발, 전이 등이 발생하지 않고 생존하는 비율인 '무사건 생존율(EFS)'은 온트루잔트 투여군에서 83.4%, 오리지널 의약품을 투여군에서 80.7%의 결과를 보였다. 또한 '전체 생존율(OS)'은 온트루잔트 투여군이 94.4%, 오리지널 의약품 투여군은 89.6%를 기록했다. 한편 삼성바이오에피스는 지난 4월 세계 최대 의약품 시장인 미국서 온트루잔트 출시하며 본격적인 항암제 판매에 나섰다. 삼성바이오에피스는 미국 파트너사 머크(MSD로)와 협력을 강화하고 공급 및 품질관리 역량을 발휘해 시장 진입 활로를 뚫겠다는 전략이다.김희경 삼성바이오에피스 임상의학본부장은 ""바이오시밀러 개발을 통해 더 많은 환자들이 바이오의약품의 혜택을 받을 수 있기를 바라며, 당사의 연구 결과가 최근 미국 시장에 출시된 온트루잔트의 처방 확대에 긍정적인 영향을 줄 것으로 기대한다""고 전했다. 허셉틴은 온트루잔트와 셀트리온의 바이오시밀러 '허쥬마' 등 경쟁 제품이 출시되면서 2019년 유럽시장 매출이 전년 대비 약 43% 줄었다.jjsung@news1.kr© 뉴스1코리아(), 무단 전재 및 재배포 금지",/news/news_read.nhn?article_id=0004667233&office_id=421&mode=search&query=셀트리온&page=1
