head,text,url
5월 '대국민 사과' 이후 정의선 회동…넉달만에 해외 방문삼성 수사 '줄소환' 고삐 죈 檢…'미중 무역분쟁' 재개 촉각,"(서울=뉴스1) 주성호 기자 = 이재용 삼성전자 부회장이 '책임경영'에 속도를 높이고 있다. 5월에만 '대국민 사과' 기자회견 이후 1주일씩 간격으로 정의선 현대자동차그룹 수석부회장과 회동, 중국 시안 반도체 공장 방문 등 3차례나 대외 행보를 이어나갔다. 특히 이 부회장은 지난 1월 설 연휴 브라질 사업장을 들른 이후 신종 코로나바이러스 감염증(코로나19)으로 중단됐던 해외 사업장 현장경영도 4개월여만에 재개하며 ""시간이 없다""고 발빠른 위기대응을 강조했다. 코로나19로 글로벌 경제가 위축되며 올해 삼성전자의 실적부진이 예상되는 가운데, 미중 무역분쟁이 재개되는 움직임마저 보이며 삼성과 이 부회장을 둘러싼 대외 불확실성은 한층 짙어졌다는 평가다. 국내에서도 삼성바이오로직스 분식회계와 '삼성물산-제일모직' 합병 사건을 살펴보는 검찰의 수사망이 점점 좁혀오며 이 부회장의 운신의 폭이 좁아지는 게 아니냐는 관측이 나오고 있다. 하지만 잇따른 대내외 리스크에도 이 부회장은 총수로서 조직 안정화와 사업 점검, 위기관리를 위해 직접 발로 뛰는 과감한 행보에 나서며 책임경영에 집중하는 모습이다. 삼성전자는 이 부회장이 18일 진교영 삼성전자 메모리사업부장 사장 등 임직원들과 함께 중국 산시성에 위치한 시안(西安) 반도체 공장을 방문했다고 밝혔다. 이 곳은 삼성전자의 유일한 해외 메모리 생산기지로 중국 고객사를 위한 낸드플래시를 만들고 있다. 코로나19 사태 발생 이후 중국을 방문한 글로벌 기업인은 이 부회장이 처음이다. 특히 이 부회장은 지난 1월 브라질 생산법인을 들른 이후 4개월만에 해외 사업장을 방문했다. 최근 한중 외교당국이 기업인 입국절차 간소화에 합의하면서 이 부회장도 혜택을 받은 것으로 알려졌다. 이 부회장이 시안 사업장을 방문한 것은 2019년 2월 이후 1년 3개월여만이다. 평소 이 부회장은 스마트폰, TV, 반도체, 디스플레이 등 분야를 가리지 않고 꾸준히 국내외 사업장으로 현장경영에 나섰다. 하지만 올해는 코로나19 여파로 1월 브라질 방문 이후 해외공장 점검 길이 끊기고 말았다. 삼성전자는 이 부회장이 코로나19 장기화에 따른 반도체 사업 관련 영향 및 대책을 논의하고 임직원들을 격려했다고 밝혔다. 이 부회장은 임직원들에게 ""과거에 발목 잡히거나 현재에 안주하면 미래는 없다""면서 ""때를 놓치면 안 된다""고 빠른 위기대응을 강조했다. 코로나19에 따른 이해득실만 따져 현실에 안주하지 말고 과감한 기술개발(R&D) 투자와 인재 육성 등을 통해 미래 성장발판을 마련해야 한다는 의미로 해석된다. 공교롭게도 이 부회장이 중국 반도체 공장을 방문하는 시기에 미국과 중국의 '미중 무역분쟁'이 다시 불붙을 조짐도 보이고 있어 업계의 이목이 더욱 집중되는 모양새다. 삼성은 이에 대한 언급을 공식적으로 자제하고 있지만, 주요 고객사이며 경쟁자이기도 한 화웨이를 둘러싼 미국 정부의 새로운 제재를 두고 삼성전자의 고심도 깊어질 수밖에 없다는 평가다. 코로나19와 미중 무역분쟁 같은 사업적 불확실성 외에 국내에선 삼성을 겨냥한 검찰의 수사에도 탄력이 붙은 가운데, 재계에선 이 부회장의 경영 행보에 미칠 영향에도 촉각을 곤두세우고 있다. 삼성바이오 분식회계 및 삼성물산과 제일모직 합병 의혹과 관련해 전현직 고위 임원들을 줄소환한 가운데 지난 15일에는 정몽진 KCC 회장도 소환조사했다. 정 회장은 제일모직 2대 주주였던 KCC가 삼성물산이 보유한 자사주를 인수하는 과정에서 이 부회장 측 우호지분을 늘린 데 대한 거래관계를 둘러싼 의심을 받고 있다. 검찰은 삼성 관련 수사의 최종 '종착지'로 이 부회장의 소환조사 여부를 심도있게 검토 중인 것으로 알려졌다. 이 부회장의 또 다른 사법 리스크로 꼽히는 '파기환송심' 재판은 박영수 특별검사팀의 재판부 기피 신청이 대법원에 재항고되며 멈춘 상태다. 재계 한 관계자는 ""이 부회장이 시간이 없다고 강조한 것은 모든 것이 급변하는 상황에서 돌이키기 힘든 타격을 입을 수 있다는 위기감과 함께 절박한 현실 인식을 토로한 것으로 보인다""고 말했다. sho218@news1.kr© 뉴스1코리아(), 무단 전재 및 재배포 금지",/news/news_read.nhn?article_id=0004642852&office_id=421&mode=search&query=삼성물산&page=2
,"[디지털타임스 박상길 기자] 삼성물산 건설부문은 반포 3주구 아파트를 '대를 이어 살고 싶은 아파트'로 만들겠다고 18일 밝혔다. 삼성물산은 이를 위해 강력한 보안 환경을 구축, 입주민의 안전을 최우선으로 확보하고 원스톱 생활서비스 환경을 조성한다.먼저 단지 출입구와 놀이터, 주차장에는 500만 화소의 CCTV가 설치되며 에스원에서 제공하는 지능형 영상 감시 시스템과 연계해 외부인의 침입이나 화재, 쓰레기 방치, 쓰러짐 등의 상황을 자동으로 감지해 사고나 범죄를 예방한다. 단지와 상가로 직접 이어지는 지하철 9호선 구반포역 연결 통로에도 500만 화소의 CCTV를 설치한다. 삼성물산은 주차장에서 안전을 위해 모든 동 지하에서 커뮤니티센터까지 안전하게 이동할 수 있는 폭 1.5m 이상의 보행자 동선을 확보하고 안전한 주차를 위해 폭을 2.5m로 넓힌 안정적인 주차공간을 확보한다.각 동별 지하에 프라이빗 드롭-오프 존과 컨비니언트 로비를 설치하고 우편이나 택배보관함, 코인세탁실 및 세대창고를 제공한다.놀이터와 주차장에는 비상벨 시스템을 설치하고 엘리베이터 내부에 카드키 인식 시스템을 적용해 목적층으로만 접근이 가능하도록 운영한다. 각 세대에는 얼굴인식 출입 시스템이 적용되며 사물인터넷(IoT) 홈패드를 통해 외부인 침입 시 자동으로 녹화하는 기능을 도입한다.삼성물산은 입주민의 건강을 지키기 위한 안티-바이러스 기술도 적용한다. 동출입구에는 퓨어게이트를 설치해 고속의 바람으로 바이러스와 미세먼지를 털어내고 각 세대에는 중문과 에어드레서가 적용된 클린현관을 제공해 외투 등에 남아있는 잔여먼지와 바이러스를 제거한다.아이를 키우는 가족들을 위한 공간도 특별하게 만든다. 단지 내 유치원과 어린이집은 삼성 직원들이 이용하는 어린이집을 모델로 삼성물산이 개발한 안심보육 가이드라인을 활용해 안전한 보육환경을 조성한다. 미세먼지 등으로 야외 활동이 어려운 경우를 생각해 아이들이 실내에서 안전하게 놀 수 있는 키즈 플레이하우스도 설치한다.삼성물산 관계자는 ""래미안 20년 노하우를 담아 최상의 사업조건을 제안했으며, 반포를 대표하는 새로운 랜드마크 공사를 성공적으로 수행할 것""이라고 말했다.박상길기자 sweatsk@dt.co.kr 디지털타임스
/",/news/news_read.nhn?article_id=0002598657&office_id=029&mode=search&query=삼성물산&page=2
원스톱 생활서비스 환경 구축강력한 보안시스템 기술 등 적용,"삼성물산 건설부문(대표이사 이영호)은 18일 서울 서초구 반포동 반포주공1단지 3주구 재건축 조합에 입주민들의 안전을 최우선으로 확보하는 ‘원스톱 생활서비스 환경 조성 계획’을 제안했다고 밝혔다.삼성물산에 따르면 반포3주구 단지 출입구·놀이터·주차장에는 500만 화소의 CCTV가 설치되며, 에스원에서 제공하는 지능형 영상 감시 시스템과 연계해 침입이나 화재 등의 상황을 자동으로 감지하고 사고나 범죄를 예방할 계획이다.여기에 주차장 내에서의 안전을 위해 모든 동 지하에서 커뮤니티센터까지 안전하게 이동할 수 있는 폭 1.5m 이상의 보행자 동선을 확보했다. 놀이터와 주차장에는 비상벨 시스템을 설치하고, 엘리베이터 내부에 카드키 인식 시스템을 적용해 목적층으로만 접근이 가능하도록 운영한다. 각 세대에는 얼굴인식 출입 시스템이 적용된다.일상의 편리함도 극대화된다. 각 동별 지하에 ‘프라이빗 드롭·오프 존’과 ‘컨비니언트 로비’를 설치하고 우편이나 택배보관함·코인세탁실 및 세대창고를 제공해 원스톱 생활서비스 환경을 구축할 방침이다.입주민들의 건강을 지키기 위한 ‘안티 바이러스 기술’도 적용된다. 각 동 출입구에는 퓨어게이트를 설치해 바이러스와 미세먼지를 털어내고, 각 세대에는 중문과 에어드레서가 적용된 클린현관을 제공한다.단지 내 유치원과 어린이집 역시 삼성 직원들이 이용하는 어린이집을 모델로 삼성물산이 개발한 ‘안심보육 가이드라인’을 활용해 안전한 보육환경을 조성한다. 또한 아이들이 실내에서 안전하게 놀 수 있는 키즈 플레이하우스도 설치될 예정이다. 성연진 기자
- Copyrights ⓒ 헤럴드경제 & heraldbiz.com, 무단 전재 및 재배포 금지 -",/news/news_read.nhn?article_id=0001674736&office_id=016&mode=search&query=삼성물산&page=2
,"서울 서초구 반포주공 1단지 3주구 재건축 사업(반포3주구)에서 맞붙은 삼성물산과 대우건설의 수주전이 과열 양상으로 치달으면서 위험수위를 넘나들고 있다는 지적을 받고 있다. 반포3주구는 서초구 1109일대 1490가구를 재건축해 지하 3층∼지상 35층, 17개 동, 공동주택 2091가구와 상가 등 부대복리시설을 짓는 사업으로, 예상 공사비만 8087억 원에 달한다. 18일 재개발·재건축업계에 따르면 삼성물산과 대우건설은 오는 30일 시공사 선정(예정)을 앞둔 반포3주구 사업 수주를 둘러싸고 부적합 홍보물은 물론 상호 비방, 홍보관 건립(불법 가설물 설치 논란), 홍보직원 불법성 시비 등을 낳으며 치열한 공방전을 벌이고 있다.두 회사는 20일부터 약 10일 동안 운영하는 홍보관을 더욱 크고 화려하게 짓기 위해 가설건축물(홍보관) 축조 허가를 위한 신고도 하지 않았다가 서초구로부터 원상복구 명령(공동주택관리법 위반)을 받았다. 하지만 두 회사는 원상 복구 없이 20일 홍보관을 연다는 방침이어서 논란이 일고 있다.두 회사는 사업 추진 기간, 홍보요원 배치 관련 불법성 시비도 벌이고 있다. 사업 추진 기간과 관련, 삼성물산이 ‘공사도급계약 체결 이후 관리처분인가까지 3개월 만에 진행한다’고 하자 대우건설은 ‘3개월은 불가능하다’고 반박했다.단지 내 홍보요원 배치와 관련해 불법 홍보 공방을 벌인데 이어 재건축업계에 잘 알려진 특정인 A 씨의 홍보를 두고도 논란을 벌이고 있다. 대우건설이 A 씨가 삼성물산 대리 홍보를 했다며 수주업무 방해 등을 이유로 지난 7일 경찰에 고발한 것이다. 양측은 당초 3개씩만 보내기로 약속한, 조합원에게 보내는 홍보물 수량을 6개까지 발송했다고 상호 시비가 붙기도 했다.한 부동산컨설팅회사 대표는 “반포3주구는 지난 2월 서울시가 ‘클린수주 시범사업장’으로 지정했는데 수주경쟁이 혼탁·과열됐다”며 “시공사 확정 직후 관계 당국이 사업 전 과정을 점검해 탈·불법이 적발되면 시공권 박탈 등의 강력한 대응을 해야 한다”고 말했다. 김순환 기자 soon@munhwa.com[Copyrightⓒmunhwa.com '대한민국 오후를 여는 유일석간 문화일보' 무단 전재 및 재배포 금지()]",/news/news_read.nhn?article_id=0002428221&office_id=021&mode=search&query=삼성물산&page=2
▶ 헉! 소리나는 스!토리 뉴스 [헉스]▶ '아는 척'하고 싶은 당신을 위한 [두유노우],"- DK도시개발·DK아시아, 인천 서구에 대규모 도시개발사업 추진, 5대 메이저 시공사로 특화된 브랜드시티 조성 전략
- 최고 40층 4805가구 매머드급 대규모 단지로 대한민국 최초 휴양 리조트 도시 조성
- 6개월 후 전매 가능 단지로 공급규모, 브랜드, 교통, 환경, 단지특화, 학교, 생활인프까지 역대급 랜드마크 단지 요소 모두 갖춰, 전용 59㎡ 공급 비율 높여 공공성에도 기여
- 8월부터 분양권 전매강화, 규제 적용 전 마지막 분양단지에 관심 몰릴 듯


'성냥갑' 단지가 대부분이던 2000년, 서울 강남구 도곡동에 '타워팰리스'가 착공하면서 화려한 외관뿐 아니라 넓은 평형 구성, 고급 커뮤니티까지 조성해 '프리미엄 주거 공간'이라는 새로운 개념의 장을 열었다.
 그러고 20년이 지난 지금도 여전히 아파트 고급화 경쟁이 심화되고 있다.
 2016년 입주와 함께 한강변 대표 단지로 부상한 ‘아크로리버파크’, 4년 연속 국내 매매 최고 거래가 아파트에 오른 ‘한남더힐’ 등 ‘하이엔드 브랜드'의 잇딴 출현으로 아파트가 단순한 거주 대상이 아니라 선망의 대상이 됐고, 이제 지역을 상징하는 전국구 랜드마크 단지로 부상하게 된 것이다.
 이러한 유명 주거상품이 있는 곳은 해당 단지를 중심으로 지역 일대 아파트 시세가 동시 다발적으로 상승하는 경우가 많다. 특히 새로이 주거환경을 갖춘 곳에서 시그니처 단지 존재여부는 도시의 성패를 가늠할 수 있는 척도가 되기도 한다.
 타워팰리스로 대표되는 1세대 고급아파트가 부자임을 과시할 수 있는 외관 등의 하드웨어에 조금 더 치중했다면, 2세대 고급아파트부터는 점차 실생활의 편의성과 쾌적성을 높여주는 소프트웨어 설계에 힘쓰기 시작했다. 또 각종 주거서비스 강화로 이어지면서 상류층 주거 문화의 변화를 주도하고 있는 셈이다.
 이런 가운데 인천 최초 전국 대장주 아파트가 등장할 것으로 보여 실수요자 및 투자자들의 이목이 집중되고 있다.
 최근 전국에서 가장 핫한 인천 지역은 5월 첫주까지 8주 연속으로 전국 광역 자치단체 중 아파트 값이 가장 크게 오르고 있어 업계에서는 분양 성적을 계속 이어갈 수 있을지 주목하고 있다.
 특히 정부가 올해 8월부터 수도권과 광역시 대부분의 지역에서 분양권 전매를 금지하겠다는 추가 부동산 규제 방안을 발표하면서 적용 시점 이전 마지막 분양 단지에는 전국에서 청약자들이 대거 몰릴 것으로 예상되고 있다.
 ◆ DK도시개발·DK아시아, 인천 서구 검암역세권에 ‘검암역 로열파크씨티 푸르지오’ 5월 29일 분양 예정, 최고 40층 4805가구의 매머드급 전국 대장주 아파트 예약 완료
 DK도시개발·DK아시아가 인천 서구 검암역세권에서 5월 29일 분양 예정인 ‘검암역 로열파크씨티 푸르지오’는 최고 40층, 4805가구의 매머드급 대단지로 인천 최초 전국 대장주 아파트 등극을 예약하는 모습이다.
 이 아파트는 이른바 ‘5·11대책’ 규제 대상에 해당되지 않아 6개월 후 전매가 가능하고, 공급규모, 브랜드, 단지특화, 생활인프라 등 역대급 랜드마크 단지의 요소를 모두 갖췄다는 평가다. 여기에 ‘휴양’ 콘셉트에 맞춰 다양한 여가시설이 들어서는 대한민국 최초 ‘휴양 리조트 도시’로 조성될 예정으로 이미 올초부터 실수요자 및 투자자들의 관심을 꾸준히 받아 왔다.
 2023년말 단지가 준공되면 인천을 대표하는 전국구 단지로 올라설 것이라는 전망이 나오는 이유다.
 우선 검암역 로열파크씨티 푸르지오는 검암역에서 공항철도 이용할 경우 김포공항역까지 2개 정거장, 마곡나루역까지 3개 정거장 거리에 불과해 서울 접근성이 우수하다. 또한 검단신도시를 거쳐 불로지구까지 연장 계획 중인 인천지하철 2호선 독정역이 사업지와 바로 접해 있는 것도 장점이다.
 자연친화적 입지 여건과 단지 조경은 더욱 화려하다. 사업지 전면 폭 길이만 1km에 달하고 단지 서쪽에 바로 인접한 롯데월드 면적 6배 크기 자연 생태공원인 드림파크 야생화단지(30만평)와 36홀 드림파크 골프장(46만평) 등이 위치해 있다.
 대단지에 걸맞게 온가족이 산책할 수 있는 9.6km 둘레길과 단지내 약 1km 데크길이 들어서고 시공능력평가 조경 1위 삼성물산 리조트부문과 국내 아파트 단지 내 최초로 ‘미니 에버랜드’가 조성된다. 또 100만주에 가까운 꽃과 나무를 심어 단지 전체를 뒤덮는 ‘밀리언 파크'(Million Park) 등 고품격 조경을 선보인다.
 이외에도 각 분야 국내 최고 브랜드 기업과 손잡고 프리미엄 주거 명작을 완성한다는 계획이다.
 LG전자와 업무협약을 통해 차세대 IoT기술을 적용하고, 풀무원푸드앤컬처는 입주민들에게 인천 최초 고품격 삼식(三食) 서비스를 합리적인 가격으로 제공한다. 종로엠스쿨이 직영하는 학원은 입주민 자녀들에게 단지 내 학원가 등 프리미엄 사교육을 선보인다.
 3년간 무상으로 운영될 ‘돕다(DOPDA)’의 컨시어지 서비스는 입주민 자긍심은 물론 아파트의 가치와 품격도 한 차원 더 높일 예정이다.
 단지 내 커뮤니티시설도 압도적인 스케일을 자랑한다. 피트니스클럽, 수영장, 사우나 등 기본시설은 고급화했고, 도서관 내에 그리너리 라운지, 연회장 및 연회장과 연계한 루프탑, 파티룸, 티카페 및 펫카페, 게스트하우스 등도 적용된다.
 또 사업지 내 한들초(가칭) 및 한들유치원(가칭)을 건립 후 인천교육청에 기부채납도 계획돼 있다. 이들 학교는 단지 준공 시점에 맞춰 개교할 예정으로 입주민들은 자녀들을 안심하고 학교에 보낼 수 있을 전망이다.
 이 같은 주목도는 온라인상에서도 두드러지게 나타난다. 인천에서 그동안 볼 수 없었던 역대급 규모감 때문에 분양 홈페이지 일일 평균 방문객이 1만 2천여 명, 누적 방문객이 약 80만 명에 달하고, 부동산 정보 공유 사이트 ‘호갱노노’에서 최근 13일 기준 조회수가 65만회가 넘는 등 꾸준히 최상위권을 유지하며 전국적인 관심이 집중되고 있다.
 한편 이 아파트는 1∙2단지를 거쳐 공항철도 검암역까지 5분 간격(출퇴근 시간 기준)으로 운행하는 순환 셔틀버스(총 6대)도 제공하며, 1단지 정류장에서 셔틀버스 탑승시 검암역까지 5분이면 도착할 수 있다. 특히 셔틀버스 6대는 5년간 무상 운영된 후 단지에 기증될 예정이다.
 소규모 단지보다 관리비가 적게 드는 장점도 있다. 공동주택관리정보시스템(K-apt)에 따르면 4000가구에 달하는 ‘인천 S아파트’ 전용면적(㎡)당 관리비는 894원(2019년 12월 기준)으로 지역 내 소규모 아파트 보다 최대 20% 가량 저렴한 것으로 조사됐다.
 DK도시개발·DK아시아 김정모 회장은 “보다 진화된 삶을 최우선 가치로 도시를 만들어가는 라이프 씨티 크리에이터(Life City Creator)로서 또 다른 라이프스타일을 원하는 현대인들에게 4세대 아파트를 넘어 서울에서 가장 가까운 대한민국 최초 ‘차세대 휴양 리조트 도시’를 만들겠다“며 “단순히 잠을 자기 위한 집이 아니라 고급 리조트에서만 누리던 다양한 서비스를 제공해 입주민들이 단지 안에서 모든 것을 해결할 수 있는 ‘리조트 도시’로 조성할 계획”이라고 말했다.
 ◆ DK도시개발, 인천 서구에 대규모 도시개발사업 추진, 5대 메이저 시공사로 특화된 브랜드시티로 조성한다는 전략... 전용 59㎡ 공급 비율 높여 공공성에도 기여
 한편 DK도시개발은 최근 인천 서구 일대 431만9966㎡(약 130만평)부지의 대규모 도시개발 사업을 추진하면서 국내 5대 메이저 브랜드 시공사만 참여하는 특화된 메이저 브랜드시티로 조성한다는 전략을 세웠다.
 특히 광역교통망과 기반시설 부재, 낮은 브랜드 인지도 등 자족 기능을 갖추지 못해 ‘베드타운’화 된 기존 신도시의 문제점을 보완하고 젊은층에게 관심이 높은 전용 59㎡ 소형평형을 전체 가구의 50%를 공급해 공공성에도 기여한다는 방침이다.
 이를 통해 서민 주거 안정에 도움될 뿐만 아니라 다른 신도시의 공급물량과 겹치지 않아 공급과잉에 대한 우려도 말끔히 씻어낼 것이란 평가다.
 특히 지자체에서 하지 못한 소형평형 공급을 민간에서 주도적으로 추진하면서 소형부터 중대형까지 공급타입을 다양화함으로써 메이저 브랜드시티의 밸런스까지 맞출 계획이다.
 한편 DK도시개발이 민간 도시개발사업으로 진행하는 사업지들은 정부가 조성하는 신도시보다 더 특색있는 완벽한 생활 기반시설을 갖추고 ‘휴양’ 콘셉트에 맞춰 다양한 여가시설이 들어서는 대한민국 최초 ‘휴양 리조트’ 도시로 조성될 예정이다.
 또한 검암역 로열파크씨티 푸르지오 분양 이후 2차(리조트도시Ⅱ 4742가구), 3차(리조트도시Ⅲ 4119가구) 사업도 순차적으로 공급할 계획이다.


 ※ 저작권자 ⓒ 파이낸셜뉴스. 무단 전재-재배포 금지",/news/news_read.nhn?article_id=0004426410&office_id=014&mode=search&query=삼성물산&page=2
