head,text,url
"빈폴멘·레이디스 2020 S/S 온라인 전용 컬렉션스웨트셔츠, 피케 티셔츠 등 밀레니얼 취햘 저격자전거 로고, 깅엄 체크패턴 활용 커플 아이템도","새 자전거 로고 활용한 커플 아이템. (사진=삼성물산)[이데일리 이윤화 기자] 삼성물산 패션부문 ‘빈폴’이 일상 속에서 가장 사랑받는 스타일로 구성한 온라인 전용 컬렉션 ‘그린 빈폴(Green Beanpole)’을 출시했다고 16일 밝혔다.빈폴멘·레이디스는 20~30대 고객을 타깃으로, 그들이 선호할 만한 트렌디한 디자인에 가성비까지 갖춘 온라인 전용 상품을 매 시즌 선보이고 있다.올 봄·여름(S/S) 시즌 그린 빈폴은 일상에서 가장 즐겨 입는, 기본에 충실한 스타일들로 구성했다. 스웨트셔츠, 피케 티셔츠·원피스, 라운드넥 티셔츠, 캐주얼 셔츠 등 언제 어디서나 편안하게 활용할 수 있는 아이템들을 제안했다.빈폴멘은 군더더기 없는 디자인에 포켓·와펜 디테일을 더한 반팔 티셔츠, 컬러 블록을 넣어 캐주얼한 무드를 높인 반팔 럭비 피케 티셔츠, 청량감이 느껴지는 스트라이프 풀오버 셔츠 등을 출시했다.한편 빈폴레이디스는 자전거 자수로 포인트를 준 반팔 티셔츠, 경쾌한 느낌의 스프라이프 티셔츠, 깔끔하고 클래식한 기본 반팔 피케 원피스, 가벼운 아우터로도 활용 가능한 포멀 셔츠 원피스 등을 선보였다.특히 이번 시즌에는 동일한 컬러, 패턴, 소재를 활용해 자연스러운 시밀러룩을 연출할 수 있는 커플 아이템을 제안했다.빈폴멘·레이디스는 스웨트셔츠에 바퀴살을 없애 한층 간결해진 새 자전거 로고를 각각 남녀 버전으로 적용했다. 또한 블루 깅엄 체크 패턴의 시어서커 소재를 사용해 빈폴멘은 반팔 셔츠를, 빈폴레이디스는 셔츠 원피스를 선보였다.그린 빈폴 컬렉션은 스웨트셔츠 10만 9000원, 반팔 티셔츠 5만 9000원~12만 9000원, 캐주얼 셔츠 9만 9000원~15만 9000원, 원피스 15만 9000원~23만 9000원, 팬츠 10만 9000원~11만 9000원 등이다.반동수 빈폴멘 팀장은 “이번 시즌에는 밀레니얼 세대가 평소에 자주 입는 기본적인 아이템을 고품질과 가성비 함께 갖춰 기획했다”며 “일상 속 모든 순간에 자연스럽게 녹아 드는 ‘그린 빈폴’ 상품들을 통해 꾸민 듯 안 꾸민 듯 멋스러운 데일리룩을 연출할 수 있을 것”이라고 말했다.빈폴은 그린 빈폴 컬렉션 출시를 기념해 삼성물산 패션부문 통합 온라인몰 SSF샵에서 오는 31일까지 추가 10% 할인 및 무료 교환·반품 혜택을 제공한다.이윤화 (akfdl34@edaily.co.kr) | ＜ⓒ종합 경제정보 미디어 이데일리 - 무단전재 & 재배포 금지＞",/news/news_read.nhn?article_id=0004597874&office_id=018&mode=search&query=삼성물산&page=2
,"[아시아경제 조유진 기자] 삼성물산 패션부문의 트래디셔널 캐주얼 브랜드 빈폴이 온라인 전용 컬렉션 '그린 빈폴'을 출시했다고 16일 밝혔다.빈폴멘·레이디스는 20~30대 고객을 타깃으로 트렌디한 디자인에 가성비까지 갖춘 온라인 전용 상품을 매 시즌 선보이고 있다.올 봄여름 시즌 그린 빈폴은 스웨트셔츠, 캐주얼 셔츠등 일상에서 가장 즐겨 입는 기본에 충실한 스타일들로 구성했다.
빈폴멘은 군더더기 없는 디자인에 포켓 와펜 디테일을 더한 반팔 티셔츠, 컬러 블록을 넣어 캐주얼한 무드를 높인 반팔 럭비 피케 티셔츠, 청량감이 느껴지는 스트라이프 풀오버 셔츠 등을 출시했다.빈폴레이디스는 자전거 자수로 포인트를 준 반팔 티셔츠, 경쾌한 느낌의 스프라이프 티셔츠, 깔끔하고 클래식한 기본 반팔 피케 원피스, 가벼운 아우터로도 활용 가능한 포멀 셔츠 원피스 등을 선보였다.특히 이번 시즌에는 동일한 컬러, 패턴, 소재를 활용해 자연스러운 시밀러룩을 연출할 수 있는 커플 아이템을 제안했다.반동수 빈폴멘 팀장은 “이번 시즌에는 밀레니얼 세대가 평소에 자주 입는 기본적인 아이템을 고품질과 가성비 함께 갖춰 기획했다”며 “일상 속 모든 순간에 자연스럽게 녹아 드는 그린 빈폴 상품들을 통해 꾸민 듯 안 꾸민 듯 멋스러운 데일리룩을 연출할 수 있을 것” 이라고 말했다.빈폴은 ‘그린 빈폴’ 컬렉션 출시를 기념해 삼성물산 패션부문 통합 온라인몰 SSF샵에서 오는 31일까지 추가 10% 할인 및 무료 교환·반품 혜택을 제공한다.조유진 기자 tint@asiae.co.kr <ⓒ경제를 보는 눈, 세계를 보는 창 아시아경제 무단전재 배포금지>",/news/news_read.nhn?article_id=0004643096&office_id=277&mode=search&query=삼성물산&page=2
피케 티셔츠‧원피스 등 밀레니얼이 일상에서 즐겨 입는 상품 구성,"삼성물산 패션부문의 트래디셔널 캐주얼 브랜드 ‘빈폴’은 일상 속에서 가장 사랑받는 스타일로 구성한 온라인 전용 컬렉션 ‘그린 빈폴’을 출시했다고 16일 밝혔다.빈폴멘‧레이디스는 20~30대 고객을 타깃으로, 트렌디한 디자인에 가성비까지 갖춘 온라인 전용 상품을 매 시즌 선보이고 있다.올 봄여름 시즌 ‘그린 빈폴’은 일상에서 가장 즐겨 입는 기본에 충실한 스타일들로 구성했다. ▲스웨트셔츠 ▲피케 티셔츠‧원피스 ▲라운드넥 티셔츠 ▲캐주얼 셔츠 등 언제 어디서나 편안하게 활용할 수 있는 아이템들을 제안했다.특히 이번 시즌에는 동일한 컬러, 패턴, 소재를 활용해 자연스러운 시밀러룩을 연출할 수 있는 커플 아이템을 제안했다.빈폴맨‧레이디스는 스웨트셔츠에 바퀴살을 없애 한층 간결해진 새 자전거 로고를 각각 남녀 버전으로 적용했다.반동수 빈폴멘 팀장은 “이번 시즌에는 밀레니얼 세대가 평소에 자주 입는 기본적인 아이템을 고품질과 가성비 함께 갖춰 기획했다” 라며 “일상 속 모든 순간에 자연스럽게 녹아 드는 ‘그린 빈폴’ 상품들을 통해 꾸민 듯 안 꾸민 듯 멋스러운 데일리룩을 연출할 수 있을 것” 이라고 말했다.빈폴은 ‘그린 빈폴’ 콜렉션 출시를 기념해 삼성물산 패션부문 통합 온라인몰 SSF샵에서 오는 31일까지 추가 10% 할인 및 무료 교환‧반품 혜택을 제공한다.데일리안 임유정 기자 (irene@dailian.co.kr)ⓒ (주)데일리안 - 무단전재, 변형, 무단배포 금지",/news/news_read.nhn?article_id=0002389168&office_id=119&mode=search&query=삼성물산&page=2
,"[머니투데이 오정은 기자]
16일 삼성물산 패션부문의 트래디셔널 캐주얼 브랜드 ‘빈폴’이 일상 속에서 가장 사랑받는 스타일로 구성한 온라인 전용 컬렉션 ‘그린 빈폴(Green Beanpole)’을 출시했다.
빈폴멘/레이디스는 20~30대 고객을 타깃으로 그들이 선호할 만한 트렌디한 디자인에 가성비까지 갖춘 온라인 전용 상품을 매 시즌 선보이고 있다. 올 봄여름 시즌 ‘그린 빈폴’은 일상에서 가장 즐겨 입는 기본에 충실한 스타일들로 구성했다. 스웨트셔츠, 피케 티셔츠와 원피스, 라운드넥 티셔츠, 캐주얼 셔츠 등 언제 어디서나 편안하게 활용할 수 있는 아이템을 제안했다. 빈폴멘은 군더더기 없는 디자인에 포켓·와펜 디테일을 더한 반팔 티셔츠, 컬러 블록을 넣어 캐주얼한 무드를 높인 반팔 럭비 피케 티셔츠, 청량감이 느껴지는 스트라이프 풀오버 셔츠 등을 출시했다.빈폴레이디스는 자전거 자수로 포인트를 준 반팔 티셔츠, 경쾌한 느낌의 스프라이프 티셔츠, 깔끔하고 클래식한 기본 반팔 피케 원피스, 가벼운 아우터로도 활용 가능한 포멀 셔츠 원피스 등을 선보였다. 특히 이번 시즌에는 동일한 컬러, 패턴, 소재를 활용해 자연스러운 시밀러룩을 연출할 수 있는 커플 아이템을 제안했다.빈폴멘/레이디스는 스웨트셔츠에 바퀴살을 없애 한층 간결해진 새 자전거 로고를 각각 남녀 버전으로 적용했다. 또한 블루 깅엄 체크 패턴의 시어서커 소재를 사용해 빈폴멘은 반팔 셔츠를, 빈폴레이디스는 셔츠 원피스를 선보였다. ‘그린 빈폴’ 컬렉션은 스웨트셔츠 10만9000원, 반팔 티셔츠 5만9000원~12만9000원, 캐주얼 셔츠 9만9000원~15만9000원, 원피스 15만9000원~23만9000원, 팬츠 10만9000원~11만9000원 등이다. 반동수 빈폴멘 팀장은 “이번 시즌에는 밀레니얼 세대가 평소에 자주 입는 기본적인 아이템을 고품질과 가성비 함께 갖춰 기획했다”며 “일상 속 모든 순간에 자연스럽게 녹아 드는 ‘그린 빈폴’ 상품들을 통해 꾸민 듯 안 꾸민 듯 멋스러운 데일리룩을 연출할 수 있을 것”이라고 말했다.오정은 기자 agentlittle@mt.co.kr
<저작권자 ⓒ '돈이 보이는 리얼타임 뉴스' 머니투데이, 무단전재 및 재배포 금지>",/news/news_read.nhn?article_id=0004376326&office_id=008&mode=search&query=삼성물산&page=1
,"손희연 기자 son90@mt.co.kr
<저작권자 ⓒ '성공을 꿈꾸는 사람들의 경제 뉴스' 머니S, 무단전재 및 재배포 금지>",/news/news_read.nhn?article_id=0000518062&office_id=417&mode=search&query=삼성물산&page=1
,"글로벌 증시 반등에 힘입어 상승 출발한 코스피가 이내 하락전환됐다.16일 오전 9시 10분 현재 코스피는 전거래일대비 22.81포인트(1.29%) 하락한 1748.63에 머물고 있다.이날 33.99포인트 오른 1805.43에 개장한 지수는 상승세를 이어가나 했으나 이내 외국인과 기관을 중심으로 강한 매도세가 이어지면서 약세를 이어가고 있다. 소폭 오르며 1800선을 넘겼지만 코스피에 차익실현 매물이 쏟아지면서 지수 하락을 견인한 것으로 풀이된다.지난주 코스피는 물론 코스닥 시장은 유례없는 패닉장을 겪으며 장 낙폭을 보였다. 개장 직후 코스피에서는 지수가 급전직하하며 오전 9시 6분 프로그램 매매의 매도호가의 효력을 5분간 무효화하는 사이트카가, 10시 43분 모든 거래를 20분동안 정지시키는 서킷브레이커가 각각 발동됐다. 이 과정에서 지수는 1700선이 붕괴돼 1680.60까지 빠지기도 했다. 그러나 오후 들어 연기금을 중심으로 한 기관이 매수량을 늘리며 지수가 급반등했다. 오전에문재인 대통령이 홍남기 경제부총리와 이주열 한은 총재를 청와대로 불러 '경제·금융 상황 특별 점검 회의'를 열고, 한국은행이 임시 금융통화위원회 개최를 논의한다는 사실을 밝힌 점도 시장 안정에 힘을 보탠 것으로 보인다. 주말 새 증시 하락장을 보였던 글로벌 금융시장은 소폭 반등에 성공하기도 했다. 미국 주요 지수는 9% 이상 올랐고, 유럽 지수 또한 10% 내외 회복세를 나타냈다. 여기에 이날 새벽 미국 연방준비제도(Fed)는 신종 코로나바이러스 감염증(코로나19) 긴급조치로 기준금리 대폭 인하를 발표했다. 이에 기존 1.00%~1.25%에서 0.00%~0.25%로 1%포인트 인하한다고 밝혔다. 사실상 기준금리 제로 수준으로 2015년 12월 이후 처음이다.이와 함께 7000억달러 규모의 양적완화(QE) 프로그램을 시작하기로 했다. 연준의 이같은 조치는 오는 17일부터 이틀간 예정된 정례 연방공개시장위원회(FOMC)를 이틀 앞두고 전격적으로 이뤄졌다.이에 따라 코로나 19의 글로벌 공포가 가시화되면서 한국은행의 금리 인하 가능성이 강하게 대두되고 있다. 오는 17~18일 FOMC이후 한은 임시 금융통화위원회가 예상됐지만 미국의 긴급조치로 인해 회의 일정을 앞당길 수도 있다는 전망이다. 금리 조정 폭도 0.25%포인트보다는 0.50%포인트 수준일 가능성이 높아졌다. 기준금리가 0%대가 되면 사상 처음이다.소병은 NH투자증권 연구원은 ""국내 코로나 19 확진자수는 두자릿 수로 둔화되고 뉴욕증시가 반등에 성공한 것과 동시에 지난주 금융위원회가 이날부터 6개월간 국내 증시 상장 전체 종목에 공매도를 금지하는 법안을 상정한 것에 힘입어 코스피 급락세는 다소 되돌려질 것으로 예상된다""며 ""한국은행이 주요국 금리인하 기조에 편승해 이날 임시 금융통화정책위원회를 열어 금리인하를 단행할 경우 환율이 일시적으로 상승할 수 있어 원·달러 하락 압력으로 작용할 것""으로 전망했다.이날 유가증권시장 주요 업종 중에서는 보험, 은행, 금융업, 서비스업, 증권 등에서 낙폭이 이어지고 있고 음식료품, 의료정밀, 의약품, 종이·목재 등은 소폭 오르고 있다.투자 주체 별로는 개인이 3686억원 순매수 중이고, 외국인과 기관은 각각 1492억원, 2225억원 순매도 하고 있다. 이날까지 외국인은 8거래일 연속 순매도 행렬이다.프로그램 매매는 366억원 매도 우위다.시가총액 상위 종목 중에서는 삼성바이오로직스와 셀트리온을 제외한 전 종목이 하락세다. NAVER가 3% 대 약세고, 삼성전자, SK하이닉스, LG화학, 삼성SDI, 삼성물산 등이 줄줄이 떨어지고 있다.현재 코스피에서는 820개 종목이 오르고 427개 종목이 내리고 있다.코스닥은 전거래일 대비 1.25포인트(0.24%) 내린 522.75에 거래되고 있다. [디지털뉴스국 김규리 기자] [ⓒ 매일경제 & mk.co.kr, 무단전재 및 재배포 금지]",/news/news_read.nhn?article_id=0004537001&office_id=009&mode=search&query=삼성물산&page=1
,"[아시아경제 구은모 기자] 코스피가 미국 중앙은행인 연방준비제도(Fed·연준)의 적극적인 부양책에도 불구하고 힘을 내지 못하며 장 초반 1760선을 기록하고 있다. 반면 코스닥 지수는 개인 투자자의 순매수에 1% 안팎의 반등을 보이고 있다.16일 코스피는 전 거래일 대비 33.99포인트(1.92%) 상승한 1805.43으로 출발했다. 코스피는 이날 상승 출발했지만 이내 하락 전환했다. 이후 1770선 안팎에서 혼조세를 보이고 있다. 오전 9시25분 현재 전일 대비 2.80포인트(0.16%) 내린 1768.64를 기록 중이다.앞서 연준은 15일(현지시간) 신종 코로나바이러스감염증(코로나19) 여파에 대응하기 위해 기준금리를 ‘제로(0)’ 수준으로 전격 인하했다. 연준은 이날 기준금리를 기존 1.00%~1.25%에서 0.00%~0.25%로 1%포인트 인하한다고 밝혔다. 또한 유동성 공급 확대를 위해 7000억달러 규모의 국채와 주택저당증권(MBS)을 매입하기로 했다.이날 시장은 연준의 적극적인 부양책에도 불구하고 힘을 내지 못하는 모습이다. 서상영 키움증권 연구원은 미국의 코로나19 확진자 수가 급증하고 있으며, 이번 주부터 본격적으로 검진을 확대한다고 발표해 이러한 확진자 수 급증은 불가피하다는 점은 부담이라고 지적했다. 특히 유럽 곳곳이 폐쇄를 단행하고 있는 가운데 미국 내 코로나19 확진자 수 급증은 불확실성을 높일 수 있기 때문이다.현재 거래 주체별 매매 동향을 보면 기관과 외국인 투자자는 각각 2458억원, 1668억원 순매도하고 있다. 반면 개인 투자자가 4087억원 순매수하고 있다.업종별로는 음식료품, 의약품, 의료정밀 등이 오르고 있고, 보험, 금융업, 서비스업 등은 내리고 있다.시가총액 상위종목들은 대부분 내리고 있다. NAVER, LG생활건강, 현대모비스, 엔씨소프트, 삼성물산 등이 하락하고 있고, 셀트리온, 삼성바이오로직스 등은 오르고 있다.현재 코스피 시장에서는 상한가 종목 없이 497종목이 오르고 있고, 하한가 종목 없이 344종목은 내리고 있다. 56종목은 보합을 기록 중이다.반면 코스닥 지수는 개인 투자자의 순매수에 상승하고 있다. 이날 전 거래일 대비 14.68포인트(2.80%) 상승한 538.68로 출발한 코스닥 지수는 장 초반 1% 안팎의 상승폭을 유지하고 있다. 오전 9시25분 현재 전일 대비 8.05포인트(1.54%) 오른 532.05를 기록 중이다.현재 수급별 상황을 보면 개인과 외국인 투자자가 각각 459억원, 58억원 순매수하며 지수 상승을 이끌고 있다. 반면 기관 투자자는 512억원 순매도하고 있다.업종별로는 운송장비·부품, 종이·목재, 기타서비스 등이 오르고 있고, 방송서비스, 운송 등은 내리고 있다.시가총액 상위종목들 중에선 에이치엘비, 씨젠, 케이엠더블유, 원익IPS, 헬릭스미스 등이 오르고 있다. 반면 휴젤, SK머티리얼즈, CJ ENM 등은 하락하고 있다.현재 코스닥시장에서는 상한가를 기록한 1종목을 포함해 863종목이 오르고 있고, 하한가 종목 없이 399종목은 내리고 있다. 종목은 61보합을 기록 중이다.구은모 기자 gooeunmo@asiae.co.kr <ⓒ경제를 보는 눈, 세계를 보는 창 아시아경제 무단전재 배포금지>",/news/news_read.nhn?article_id=0004643148&office_id=277&mode=search&query=삼성물산&page=1
,"(서울=뉴스1) 배지윤 기자 = 삼성물산 패션부문의 트래디셔널 캐주얼 브랜드 빈폴이 온라인 전용 컬렉션 '그린 빈폴'을 출시했다고 16일 밝혔다.올 봄여름 시즌 그린 빈폴은 일상에서 가장 즐겨 입는, 기본에 충실한 스타일들로 구성했다. 스웨트셔츠·피케 티셔츠/원피스·라운드넥 티셔츠·캐주얼 셔츠 등 언제 어디서나 편안하게 활용할 수 있는 아이템들을 제안했다.먼저 빈폴멘은 군더더기 없는 디자인에 포켓/와펜 디테일을 더한 반팔 티셔츠부터 컬러 블록을 넣어 캐주얼한 무드를 높인 반팔 럭비 피케 티셔츠, 청량감이 느껴지는 스트라이프 풀오버 셔츠 등을 출시했다.빈폴레이디스는 자전거 자수로 포인트를 준 반팔 티셔츠·경쾌한 느낌의 스프라이프 티셔츠·깔끔하고 클래식한 기본 반팔 피케 원피스·가벼운 아우터로도 활용 가능한 포멀 셔츠 원피스 등을 선보였다.특히 이번 시즌에는 동일한 색상·패턴·소재를 활용해 자연스러운 시밀러룩을 연출할 수 있는 커플 아이템을 제안했다.빈폴멘·레이디스는 스웨트셔츠에 바퀴살을 없애 간결해진 새 자전거 로고를 각각 남녀 버전으로 적용했다. 또한 블루 깅엄 체크 패턴의 시어서커 소재를 사용해 빈폴멘은 반팔 셔츠를, 빈폴레이디스는 셔츠 원피스를 내놨다.그린 빈폴 컬렉션은 스웨트셔츠 10만9000원·반팔 티셔츠 5만9000원~12만9000원·캐주얼 셔츠 9만9000원~15만9000원, 원피스 15만9000원~23만9000원, 팬츠 10만9000원~11만9000원 등이다.반동수 빈폴멘 팀장은 ""이번 시즌에는 밀레니얼 세대가 평소에 자주 입는 기본적인 아이템을 고품질과 가성비 함께 갖춰 기획했다""며 ""일상 속 모든 순간에 자연스럽게 녹아 드는 그린 빈폴 상품들을 통해 꾸민 듯 안 꾸민 듯 멋스러운 데일리룩을 연출할 수 있을 것""이라고 말했다.jiyounbae@news1.kr© 뉴스1코리아(), 무단 전재 및 재배포 금지",/news/news_read.nhn?article_id=0004523805&office_id=421&mode=search&query=삼성물산&page=1
,"그린 빈폴 콜렉션. 제공|빈폴[스포츠서울 양미정 기자] 삼성물산 패션부문의 트래디셔널 캐주얼 브랜드 ‘빈폴’이 일상 속에서 가장 사랑받는 스타일로 구성한 온라인 전용 컬렉션 ‘그린 빈폴(Green Beanpole)’을 출시했다고 16일 밝혔다.빈폴멘·레이디스는 20~30대 고객을 타깃으로, 그들이 선호할 만한 트렌디한 디자인에 가성비까지 갖춘 온라인 전용 상품을 매 시즌 선보이고 있다.올 봄여름 시즌 그린 빈폴은 일상에서 가장 즐겨 입는, 기본에 충실한 스타일들로 구성했다. 스웨트셔츠, 피케 티셔츠·원피스, 라운드넥 티셔츠, 캐주얼 셔츠 등 언제 어디서나 편안하게 활용할 수 있는 아이템들을 제안했다.빈폴멘은 군더더기 없는 디자인에 포켓·와펜 디테일을 더한 반팔 티셔츠, 컬러 블록을 넣어 캐주얼한 무드를 높인 반팔 럭비 피케 티셔츠, 청량감이 느껴지는 스트라이프 풀오버 셔츠 등을 출시했다.한편 빈폴레이디스는 자전거 자수로 포인트를 준 반팔 티셔츠, 경쾌한 느낌의 스프라이프 티셔츠, 깔끔하고 클래식한 기본 반팔 피케 원피스, 가벼운 아우터로도 활용 가능한 포멀 셔츠 원피스 등을 선보였다.특히 이번 시즌에는 동일한 컬러, 패턴, 소재를 활용해 자연스러운 시밀러룩을 연출할 수 있는 커플 아이템을 제안했다.빈폴멘·레이디스는 스웨트셔츠에 바퀴살을 없애 한층 간결해진 새 자전거 로고를 각각 남녀 버전으로 적용했다. 또한 블루 깅엄 체크 패턴의 시어서커 소재를 사용해 빈폴멘은 반팔 셔츠를, 빈폴레이디스는 셔츠 원피스를 선보였다.반동수 빈폴멘 팀장은 “이번 시즌에는 밀레니얼 세대가 평소에 자주 입는 기본적인 아이템을 고품질과 가성비 함께 갖춰 기획했다”며 “일상 속 모든 순간에 자연스럽게 녹아 드는 그린 빈폴 상품들을 통해 꾸민 듯 안 꾸민 듯 멋스러운 데일리룩을 연출할 수 있을 것”이라고 말했다.certain@sportsseoul.com[기사제보 news@sportsseoul.com]
Copyright ⓒ 스포츠서울&",/news/news_read.nhn?article_id=0000636682&office_id=468&mode=search&query=삼성물산&page=1
▶ 헉! 소리나는 스!토리 뉴스 [헉스]▶ '아는 척'하고 싶은 당신을 위한 [두유노우],"삼성물산 패션부문의 트래디셔널 캐주얼 브랜드 ‘빈폴’이 일상 속에서 가장 사랑받는 스타일로 구성한 온라인 전용 컬렉션 ‘그린 빈폴’을 출시했다고 16일 밝혔다.
 빈폴멘/레이디스는 20~30대 고객을 타깃으로 그들이 선호할 만한 트렌디한 디자인에 가성비까지 갖춘 온라인 전용 상품을 매 시즌 선보이고 있다.
 올 봄여름 시즌 ‘그린 빈폴’은 일상에서 가장 즐겨 입는, 기본에 충실한 스타일들로 구성했다. 스웨트셔츠, 피케 티셔츠/원피스, 라운드넥 티셔츠, 캐주얼 셔츠 등 언제 어디서나 편안하게 활용할 수 있는 아이템들을 제안했다.
 빈폴멘은 군더더기 없는 디자인에 포켓/와펜 디테일을 더한 반팔 티셔츠, 컬러 블록을 넣어 캐주얼한 무드를 높인 반팔 럭비 피케 티셔츠, 청량감이 느껴지는 스트라이프 풀오버 셔츠 등을 출시했다.
 한편 빈폴레이디스는 자전거 자수로 포인트를 준 반팔 티셔츠, 경쾌한 느낌의 스프라이프 티셔츠, 깔끔하고 클래식한 기본 반팔 피케 원피스, 가벼운 아우터로도 활용 가능한 포멀 셔츠 원피스 등을 선보였다.
 특히 이번 시즌에는 동일한 컬러, 패턴, 소재를 활용해 자연스러운 시밀러룩을 연출할 수 있는 커플 아이템을 제안했다. 빈폴멘/레이디스는 스웨트셔츠에 바퀴살을 없애 한층 간결해진 새 자전거 로고를 각각 남녀 버전으로 적용했다. 또한 블루 깅엄 체크 패턴의 시어서커 소재를 사용해 빈폴멘은 반팔 셔츠를, 빈폴레이디스는 셔츠 원피스를 선보였다.
 반동수 빈폴멘 팀장은 “이번 시즌에는 밀레니얼 세대가 평소에 자주 입는 기본적인 아이템을 고품질과 가성비 함께 갖춰 기획했다”며 “일상 속 모든 순간에 자연스럽게 녹아 드는 ‘그린 빈폴’ 상품들을 통해 꾸민 듯 안 꾸민 듯 멋스러운 데일리룩을 연출할 수 있을 것”이라고 말했다.


 ※ 저작권자 ⓒ 파이낸셜뉴스. 무단 전재-재배포 금지",/news/news_read.nhn?article_id=0004390410&office_id=014&mode=search&query=삼성물산&page=1
