head,text,url
,"삼성물산-제일모직 합병, '경영권 승계'와 관련성이 쟁점검찰, 이달 말 사법처리 방향 결정 방침…이재용 처분 여부 주목

(서울=연합뉴스) 성도현 기자 = 삼성물산과 제일모직의 합병을 둘러싼 삼성의 경영권 승계 의혹을 놓고 1년6개월간 진행된 검찰의 수사가 종착역을 향하고 있다. 이제 사실상 이재용(52) 삼성전자 부회장의 소환만 남은 셈이다.

검찰은 이달 말까지 수사를 모두 마무리하고 공소유지 체제로 전환하기 위해 막판 혐의 다지기에 들어간 상태다. 실무자부터 삼성의 전·현직 고위급 임원까지 관련자 수백명에 대한 조사도 마쳤다.

◇ 검찰, 이르면 이번주 이재용 피의자 소환…비공개로 출석

10일 법조계에 따르면 서울중앙지검 경제범죄형사부(이복현 부장검사)는 이르면 이번주 중 이 부회장을 피의자 신분으로 불러 조사할 예정이다. 다만 지난해 11월 공개소환 전면 폐지로 출석은 비공개로 이뤄질 전망이다.

이 부회장이 검찰에서 피의자 조사를 받는 것은 2017년 2월 국정농단 사건 당시 박영수 특별검사팀의 조사 이후 약 3년3개월 만이다. 당시 이 부회장은 구속영장 재청구 끝에 특검에 구속됐다.

검찰은 이 부회장을 상대로 2015년 5월 삼성물산·제일모직의 합병 과정과 제일모직의 자회사인 삼성바이오로직스(삼성바이오) 분식회계 의혹이 경영권 승계 작업의 일환이었는지에 대해 집중적으로 조사할 것으로 관측된다.

검찰은 최근에는 최지성(69) 옛 삼성 미래전략실장(부회장), 김종중(64) 옛 미전실 전략팀장(사장), 최치훈(63) 삼성물산 이사회 의장, 이영호(61) 삼성물산 사장, 정현호(60) 삼성전자 사업지원TF장(사장), 김태한(63) 삼성바이오 사장 등을 줄줄이 소환했다.

검찰은 삼성바이오의 회계 사기 혐의는 물론 삼성물산-제일모직 합병 직전 삼성물산의 회사 가치가 비정상적으로 떨어진 것도 이 부회장의 지배력 강화를 위해 그룹 차원에서 계획한 일이라고 의심한다.

이 부회장은 지난 6일 대국민 사과에서 삼성을 둘러싼 많은 논란이 경영권 승계 문제에서 비롯됐다는 점을 인정하면서도 관련 의혹이나 혐의에 대해 구체적인 입장을 밝히지는 않았다.

이를 두고 법조계에서는 이 부회장이 검찰의 소환 조사에는 협조할 것으로 예상한다. 다만 일부 사실관계는 인정하더라도 혐의 유무에 대해서는 적극적으로 방어할 것이란 관측이 많다.

◇ 증선위 고발로 시작…분식회계 넘어 '경영권 승계' 수사 확대

수사의 출발점인 삼성바이오 분식회계 의혹은 2018년 11월 금융위원회 산하 증권선물위원회 고발로 불거졌다. 증선위는 삼성바이오가 2015년 말 자회사인 삼성바이오에피스(삼성에피스)의 회계처리 기준을 바꿀 때 고의적 분식회계가 있었다고 봤다.

삼성바이오는 2015년 말 삼성에피스에 대한 지배력을 상실했다며 종속회사(단독지배)에서 관계회사(공동지배)로 회계처리 기준을 바꿔 장부상 회사 가치를 4조5천억원 늘린 의혹을 받는다.

당시 서울중앙지검 특수2부(현 반부패수사2부)는 내용을 검토한 뒤 삼성바이오의 외부감사법 위반 등 혐의를 넘어 삼성물산·제일모직 합병 및 이 부회장의 승계 과정 연관성을 규명하는 쪽으로 수사를 확대했다.

이후 검찰 인사로 이 사건은 특수4부가 맡게 됐고, 올해 초 조직 개편으로 부서 이름 등이 바뀌면서 경제범죄형사부에서 수사를 이어왔다.

검찰은 합병을 전후한 시기의 사업실적 등 경영권 승계 의혹을 뒷받침할 단서를 찾아나갔다.

 이와 관련, 삼성물산은 2015년 상반기 신규주택 공급량이 300여 가구에 불과했으나 같은 해 7월 제일모직과 합병 후 서울에 1만994가구를 공급할 예정이라고 발표한 바 있다. 이는 2015년 하반기 서울 시내 전체 일반분양 물량 중 30%다.

2015년 1∼6월 삼성물산 매출액은 12조2천800억원으로 전년 같은 기간보다 11% 감소했다. 주가는 2015년 들어 다른 건설사들과 달리 오르지 못하다가 4월 중순 이후 계속 떨어졌다. 당시 합병 비율 1(제일모직) 대 0.35(삼성물산)는 자본시장법 규정에 따라 이사회 직전 1개월 주가를 기준으로 결정됐다.

검찰은 이 부회장이 지분을 보유한 제일모직의 가치를 부풀려 삼성물산과 합병하고, 이 부회장에게 유리하게 적용된 합병 비율을 정당화하려고 삼성바이오에서 분식회계를 벌였을 가능성도 살폈다.

◇ 김태한 영장 기각·조국 수사·코로나19 등 이유로 수사 지연

검찰은 지난해 5월과 7월 두 차례 김태한 삼성바이오 사장에 대한 구속영장을 청구했지만 기각됐다. 당시 검찰은 김 사장을 넘어 이 부회장 등 윗선을 겨냥한 수사에 속도를 내려고 했지만, 법원에서 제동이 걸렸다.

이후 검찰은 적극적으로 구속수사에 나서지 못했다. 다만 분식회계 의혹과 관련한 증거를 인멸한 혐의 등으로 삼성전자 재경팀 이모(57) 부사장 등 8명만 구속기소 했다. 이들은 지난해 말 모두 유죄를 선고받았다.

이에 법조계에서는 검찰이 윗선의 혐의를 제대로 입증하기 어려운 게 아니냐는 관측도 나왔다. 검찰의 분식회계 수사는 지난해 11월 말 마무리됐고 합병 관련 수사가 남았다고 했지만, 뚜렷하게 결론이 나온 것은 없었다.

물론 수사가 지연된 내부적인 이유도 있다. 서울중앙지검 특수부 전체가 지난해 초까지 사법행정권 남용 의혹 수사에 투입됐고, 지난해 중순 이후엔 조국 전 법무부 장관 관련 의혹 수사에도 대거 투입되면서 수사력이 분산된 측면도 있다.

올해 초 검찰 인사와 조직 개편도 영향을 미쳤다. 특수2부장으로 삼성바이오 수사를 지휘했던 송경호 3차장은 수원지검 여주지청장, 수사 초기부터 총괄했던 한동훈 대검찰청 반부패·강력부장은 부산고검 차장으로 전보됐다.

이 밖에도 올해 2월 말부터 신종 코로나바이러스 감염증(코로나19) 확산을 막기 위한 소환조사 최소화 등 방침이 일선에 내려지면서 전체적인 일정이 두 달가량 연기된 점도 있다.

검찰은 이 부회장을 조사한 내용을 토대로 구속영장 청구 여부를 포함한 신병처리 방향 등 사건 관련자들의 처분 수위를 결정할 방침이다. 법조계에서는 검찰이 관련자들에 대해 일괄적으로 불구속기소 하는 방안을 선택할 것이라는 관측이 제기되는 가운데, 이 부회장은 어떤 처분을 받을지 관심을 끌고 있다.

raphael@yna.co.kr",/news/news_read.nhn?article_id=0011597971&office_id=001&mode=search&query=삼성물산&page=2
,"삼성물산과 제일모직의 합병을 둘러싼 삼성의 경영권 승계 의혹을 놓고 1년6개월간 진행된 검찰의 수사가 종착역을 향하고 있습니다. 이제 사실상 52살 이재용 삼성전자 부회장의 소환만 남은 셈입니다.검찰은 이달 말까지 수사를 모두 마무리하고 공소유지 체제로 전환하기 위해 막판 혐의 다지기에 들어간 상태입니다. 실무자부터 삼성의 전·현직 고위급 임원까지 관련자 수백명에 대한 조사도 마쳤습니다.10일 법조계에 따르면 서울중앙지검 경제범죄형사부(이복현 부장검사)는 이르면 이번주 중 이 부회장을 피의자 신분으로 불러 조사할 예정입니다. 다만 지난해 11월 공개소환 전면 폐지로 출석은 비공개로 이뤄질 전망입니다.이 부회장이 검찰에서 피의자 조사를 받는 것은 2017년 2월 국정농단 사건 당시 박영수 특별검사팀의 조사 이후 약 3년3개월 만입니다. 당시 이 부회장은 구속영장 재청구 끝에 특검에 구속됐습니다.검찰은 이 부회장을 상대로 2015년 5월 삼성물산·제일모직의 합병 과정과 제일모직의 자회사인 삼성바이오로직스(삼성바이오) 분식회계 의혹이 경영권 승계 작업의 일환이었는지에 대해 집중적으로 조사할 것으로 관측됩니다.검찰은 삼성바이오의 회계 사기 혐의는 물론 삼성물산-제일모직 합병 직전 삼성물산의 회사 가치가 비정상적으로 떨어진 것도 이 부회장의 지배력 강화를 위해 그룹 차원에서 계획한 일이라고 의심합니다.이 부회장은 지난 6일 대국민 사과에서 삼성을 둘러싼 많은 논란이 경영권 승계 문제에서 비롯됐다는 점을 인정하면서도 관련 의혹이나 혐의에 대해 구체적인 입장을 밝히지는 않았습니다.이를 두고 법조계에서는 이 부회장이 검찰의 소환 조사에는 협조할 것으로 예상합니다. 다만 일부 사실관계는 인정하더라도 혐의 유무에 대해서는 적극적으로 방어할 것이란 관측이 많습니다.법조계에서는 검찰이 관련자들에 대해 일괄적으로 불구속기소 하는 방안을 선택할 것이라는 관측이 제기되는 가운데, 이 부회장은 어떤 처분을 받을지 관심을 끌고 있습니다.[MBN 온라인뉴스팀]< Copyright ⓒ MBN(www.mbn.co.kr) 무단전재 및 재배포 금지 >",/news/news_read.nhn?article_id=0001452823&office_id=057&mode=search&query=삼성물산&page=1
,"(서울=연합뉴스) 삼성물산 패션 부문 컨템포러리 멀티숍 비이커가 바이에딧과 협업해 '샐러드 에디션' 캡슐 컬렉션을 출시했다고 10일 밝혔다.

사진은 서울 용산구 비이커 바이에딧 한남 플래그십 스토어 내부 모습. 2020.5.10

[삼성물산 제공. 재판매 및 DB 금지]

photo@yna.co.kr",/news/news_read.nhn?article_id=0011598089&office_id=001&mode=search&query=삼성물산&page=1
,"(서울=연합뉴스) 삼성물산 패션 부문 컨템포러리 멀티숍 비이커가 바이에딧과 협업해 '샐러드 에디션' 캡슐 컬렉션을 출시했다고 10일 밝혔다.

사진은 서울 용산구 비이커 바이에딧 한남 플래그십 스토어 내부 모습. 2020.5.10

[삼성물산 제공. 재판매 및 DB 금지]

photo@yna.co.kr",/news/news_read.nhn?article_id=0011598090&office_id=001&mode=search&query=삼성물산&page=1
,"(서울=연합뉴스) 삼성물산 패션 부문 컨템포러리 멀티숍 비이커가 바이에딧과 협업해 '샐러드 에디션' 캡슐 컬렉션을 출시했다고 10일 밝혔다.

사진은 비이커 샐러드 에디션 에딧백. 2020.5.10

[삼성물산 제공. 재판매 및 DB 금지]

photo@yna.co.kr",/news/news_read.nhn?article_id=0011598091&office_id=001&mode=search&query=삼성물산&page=1
,"정부 발표후 문의 쇄도, 매물 거두고 호가 올리려는 집주인 등장일부는 ""금싸라기 땅에 임대아파트라니"" 불만도…'기대반 우려반'

(서울=연합뉴스) 홍국기 기자 = ""솔직히 이게 호재인지, 악재인지 잘 모르겠어요. 다만 정부 규제와 코로나 사태로 얼어붙었던 용산의 부동산 시장에 다시 관심이 쏠리는 것만큼은 분명합니다.""(서울 용산구 용산동5가 A공인중개사사무소 대표)

 국토교통부가 지난 6일 용산역 철도 정비창 부지(51만㎡)에 미니신도시급인 8천가구를 공급한다는 계획을 공개한 이후 용산 일대의 부동산 시장이 다시 들썩일 조짐을 보이고 있다.

인근 아파트 주민들은 급매물을 회수하는가 하면, 투자성 있는지 물어보는 수요자들의 문의도 이어졌다.

지난 8일 용산구 서부이촌동의 한 중개업소에는 전화문의가 빗발쳤다.

이 중개업소 대표는 ""정부 발표 다음 날에 전화 문의만 21통이 왔다""며 ""올해 들어 이렇게 전화를 많이 받은 것은 이번이 처음""이라고 했다.

 정비창 부지와 인접한 서부이촌동 중산시범아파트의 일부 집주인들은 내놨던 급매물을 거둬들이고 호가를 올리려는 것으로 파악됐다.

부지와 대로 하나를 두고 있는 용산동5가와 전통적 부촌인 동부이촌동의 일부 아파트에서도 비슷한 상황이다.

 용산파크타워와 용산시티파크 주상복합아파트의 경우 일부 집주인들이 내놨던 매물을 거둬들이고 있다는 게 현지 중개업소의 설명이다.

용산 정비창 부지 바로 앞에 위치한 용산정비창 전면1구역도 이번 정부의 이번 공급대책 발표로 매수 문의가 이전보다 늘었다.

해당 구역은 서울 내 다른 재개발 지역보다 상대적으로 용적률이 훨씬 높아 사업성이 좋고, 각종 교통·개발 호재가 많다는 이유로 이미 지분 거래 시세가 크게 오른 상태다.

 대지지분 3.3㎡당 단독주택은 8천500만∼1억원, 다세대주택(빌라)은 1억9천만∼2억원의 시세가 형성돼있다.

 전면1구역은 현재 재개발 조합 설립을 추진 중이다.

 예비 청약자들의 전화 문의도 이어졌다.

 정비창 부지 인근의 한 중개업소 사장은 ""서울의 요지에 아파트가 공급되다 보니 청약 대기자들의 관심이 높다""며 ""정부 발표 직후 정비창 부지를 방문하는 예비 청약자들이 부쩍 늘었다""고 설명했다.

 분위기가 달아오를 조짐을 보이면서 국토부와 서울시는 조만간 중앙도시계획위원회(중도위)를 열어 용산 정비창 부지와 인근 지역을 토지거래허가구역으로 지정할 것으로 알려졌다.

그러나 이 일대 중개사들은 아직 적극적인 매수 문의는 손에 꼽을 정도라고 입을 모았다.

 매물이 많지 않지만 당장 사겠다는 사람도 없다는 것이다. 이 때문에 아직 가격이 오르거나 거래가 성사되는 분위기로 보긴 어렵다.

정비창 전면1구역의 한 중개업소 대표는 ""단순한 가격 문의만 해올 뿐 아직 적극적으로 매수 의사를 밝히는 사람은 드물다""고 말했다.

 서부이촌동 중산시범아파트 근처에서 영업하는 또다른 중개업소 대표는 ""호재가 발표되면 집주인들이 일단은 매물을 거둬들였다가 다시 내놓는 일이 많다""며 ""들썩거렸던 분위기가 조만간 진정될 가능성도 있다""고 내다봤다.

주말을 거치면서 발표 직후 쏟아졌던 매수 문의가 줄었다는 중개업소도 있었다.

동부이촌동의 한 중개업소 대표는 ""용산구의 아파트값이 최근 계속해서 하락했는데 이번 공급대책이 어떤 영향을 미칠지 관심이 크다""며 ""다만 가격 변화는 좀 더 분위기를 지켜봐야 알 수 있을 것 같다""고 말했다.

 오히려 인근 집주인들은 이번 정부 발표가 '호재가 아닌 악재'라며 불만을 쏟아내는 경우도 적지 않았다.

 당초 정비창 부지는 2006년 당시 서울시의 '한강르네상스' 사업과 연계해 사업비 31조원이 투입되는 용산국제업무지구로 개발될 예정이었다.

이듬해 연말 삼성물산 컨소시엄이 개발사업자로 선정됐고, 2008년 서부 이촌동 주민들을 상대로 도시개발사업 동의서(토지소유자 동의율 56%)를 받기도 했으나 글로벌 금융위기 여파로 사업이 좌초했다.

 이후 2018년 박원순 서울시장이 '여의도·용산 개발 마스터플랜' 구상을 언급하면서 용산국제업무지구 개발 사업이 재차 주목을 받았지만, 서울 부동산 시장이 과열되자 관련 계획도 무기한 보류됐다.

이런 배경 때문에 용산 일대에서 수십 년간 부동산 중개업을 해온 토박이 중개사들은 ""평당(3.3㎡당) 1억원의 가치를 지닌 금싸라기 땅에 소규모 임대아파트가 웬 말이냐는 반응이 많다""는 분위기를 전했다.

 당초 국제업무지구 개발계획과 비교해 도시 경쟁력을 강화할만한 상업·업무 시설이 줄고, 전체 8천가구 가운데 2천가구 이상은 임대아파트가 들어설 것이라는 정부 발표에 일부 주민들이 반발하고 있다는 것이다.

 서부 이촌동의 한 대표는 ""과거 용산국제업무지구 사업 발표 직후에 투자자들이 구름같이 몰려오면서 이 일대가 들썩였다""며 ""지금은 집주인과 부동산 중개업소들이 정비창 부지 개발 방식에 대해 기대 반, 우려 반으로 술렁이는 분위기""라고 말했다.

redflag@yna.co.kr",/news/news_read.nhn?article_id=0011598169&office_id=001&mode=search&query=삼성물산&page=1
,"[아시아경제 임온유 기자] 신종 코로나바이러스감염증(코로나19) 확산으로 미뤄졌던 분양이 재개된다. 특히 5월에는 서울 흑석 뉴타운, 경기도 광명 뉴타운 등 재개발·재건축 알짜 단지가 분양을 앞두고 있다.10일 직방에 따르면 5월 전국 88개 단지에서 총 6만3560가구가 분양된다. 전년 동기 4만2082가구 대비 2만가구 넘게 증가한 규모다. 일반분양도 5만672가구로 전년 동기 2만3257가구 대비 3만가구 가까이 늘어난다. 5월 분양물량의 증가는 코로나19로 공급이 미뤄진 3ㆍ4월 물량이 몰렸기 때문이다. 4월에서 5월로 분양이 미뤄진 단지는 25곳으로 총 2만4187가구다. 직방은 ""코로나19 여파로 4월 분양을 준비하던 단지 중 절반 가까이가 분양일정을 조정하며 5월 분양 물량이 크게 늘어날 전망""이라고 설명했다.분양 단지 중에서도 눈길을 끄는 단지는 GS건설이 서울 동작구 흑석뉴타운 내 흑석3구역을 재개발해 공급하는 ‘흑석리버파크자이’다. 흑석뉴타운은 강남권 가까이에 들어서는 뉴타운으로 희소성이 높은 만큼 향후 미래가치가 뛰어나다는 평을 받고 있다. 흑석리버파크자이는 지상 5층~지상 20층, 26개 동, 39~120㎡(이하 전용면적), 총 1772가구 규모로 조성된다. 이 중 357가구가 일반 분양된다.이외에 서울에서는 동대문구 용두동 용두6구역을 재개발하는 삼성물산의 ‘래미안 엘리니티’가 분양된다. 롯데건설이 서초구 잠원동 신반포13차에 공급하는 재건축 단지 '신반포13차 롯데캐슬(가칭)'도 있다. 36~84㎡, 총 330가구 중 101가구가 일반분양 대상이다. 또 광진구 자양1구역 재건축이 분양에 나설 계획이다.경기도에서는 대우건설이 경기 광명시 광명뉴타운 15구역을 재개발해 ‘광명 푸르지오 센트베르’를 공급한다. 민간택지 분양가 상한제를 피한 광명뉴타운에 분양하는 첫 푸르지오 브랜드다. 분양가는 3.3㎡당 1900만 원대로 조합이 당초 원했던 2100만 원보다 200만원 정도 낮은 수준이다. 지하 3층, 지상 최고 37층, 12개동, 36~59㎡, 총 1335가구 규모로 조성되며 이 중 464가구가 일반 분양된다.재개발·재건축 단지는 교통과 교육, 생활환경 등 이미 완비된 주변 기반시설로 인해 분양시장에서 인기가 높다. 또한 정부의 분양가 규제로 새 아파트 가격이 시세보다 수억 원 저렴하게 책정되면서 이번에도 청약 열기가 뜨거울 것으로 예상된다. 단 정비사업 일반분양 물량의 대다수가 가점제로 공급되기 때문에 추첨제 물량을 노릴 수 밖에 없는 2030세대·1주택자 등은 당첨 기회가 극히 적을 것으로 보인다.임온유 기자 ioy@asiae.co.kr <ⓒ경제를 보는 눈, 세계를 보는 창 아시아경제 무단전재 배포금지>",/news/news_read.nhn?article_id=0004675148&office_id=277&mode=search&query=삼성물산&page=1
,"(서울=연합뉴스) 이신영 기자 = 삼성물산의 컨템포러리 멀티숍 '비이커'는 라이프스타일 브랜드 '바이에딧'과 손잡고 샐러드에서 영감을 받은 '샐러드 에디션 캡슐 컬렉션'을 출시한다고 10일 밝혔다.

 샐러드 에디션은 봄나물과 감자, 아스파라거스 등 샐러드에서 영감을 받은 독특한 색상과 프린트를 담은 제품이다.

 메신저 백과 에코백 등이 출시되며 내달 3일까지 한남·청담 플래그십 스토어와 온라인몰 SSF샵으로 판매된다.

 eshiny@yna.co.kr",/news/news_read.nhn?article_id=0011598500&office_id=001&mode=search&query=삼성물산&page=1
지난 2018년 수사 착수…장기 수사 진행분식회계→합병→경영권 승계 의혹까지이달 내 마무리 목표…이재용 소환 검토 중,"[서울=뉴시스] 김가윤 기자 = 삼성물산과 제일모직 합병 의혹 등을 확인 중인 검찰이 수사 마무리 단계에 접어들었다. 검찰은 합병 과정이 이재용 부회장의 경영권 승계 과정에 직결돼 있다고 보고 수사를 확대해왔다.검찰은 최종적으로 이 부회장을 소환한 뒤 1년6개월간 이뤄졌던 장기 수사를 마무리할 것으로 보인다. 법조계에서는 이르면 주중 이 부회장이 소환될 거란 전망도 나온다.10일 법조계에 따르면 서울중앙지검 경제범죄형사부(부장검사 이복현)는 의혹의 최종 책임자로 거론되는 이 부회장에 대한 조사 필요성을 검토하고 있는 것으로 알려졌다. 검찰은 이달 내 수사를 마무리하는 것을 목표로, 그간의 수사기록 등을 살펴보고 있는 것으로 전해졌다.검찰은 지난 2015년 발생한 삼성바이오로직스(삼성바이오) 분식회계 의혹 사건과 함께 삼성물산과 제일모직 합병 과정에 불법 행위가 있었는지 여부 등을 수사 중이다. 삼성바이오는 자회사 회계 처리 기준 변경을 통해 4조5000억원 규모의 분식회계를 저질렀다는 의혹을 받고 있다. 지난 2018년 금융위원회 산하 증권선물위원회가 삼성바이오를 검찰에 고발했고, 검찰은 같은 해 12월13일 삼성바이오 및 삼성물산 본사 등을 압수수색하면서 수사에 착수했다.지난해 4월25일에는 삼성바이오에피스 임직원을 대상으로 첫 구속영장을 청구했고, 증거인멸 등 혐의로 영장이 발부됐다. 이후 삼성바이오 공장을 압수수색해 은닉 자료를 확보했고, 관련 인물이 몇 차례 더 구속됐다.검찰은 분식회계 의혹이 삼성물산과 제일모직의 합병 과정과 연관이 있다고 보고 수사를 확대해갔다. 합병 당시 주식교환 비율을 산정하면서 제일모직의 자회사였던 삼성바이오의 기업 가치가 크게 반영된 바 있다. 이로 인해 이 부회장은 합병 이후 삼성물산 최대 주주로 올라섰고, 이 과정이 그룹 지배력을 강화하기 위한 일환이었다는 의혹이 나왔다. 이에 그룹 차원의 개입은 없었는지를 본격적으로 수사하기 위해 김태한 삼성바이오 대표에 대한 구속영장를 청구했다. 그러나 법원에서 구속영장이 두 차례나 기각되면서, 이 때부터 '윗선' 수사에 제동이 걸리게 됐다고 법조계는 분석하고 있다.내·외부적인 요인이 영향을 미친 측면도 있다. 분식회계 의혹과 합병 의혹을 연결짓는 단서를 확실하게 규명해야 하는 등 사안이 복잡한 데다 등장인물도 많아 집중적인 수사가 이뤄졌어야 했지만, 사법행정권 남용 의혹과 조국 전 법무부장관 일가 의혹 수사 등으로 서울중앙지검의 수사력이 다소 분산됐다는 지적이 있다.또 이 사건을 맡는 수사팀이 당시 서울중앙지검 특수2부에서 특수4부로 변경되는 등의 변화도 있었다. 아울러 올해 초 조직 개편이 진행됨에 따라 부서 이름이 경제범죄형사부로 바뀌기도 했다. 지난달까지는 신종 코로나바이러스 감염증(코로나19) 확산으로 소환조사가 이뤄지지 못하면서 수사 진행이 미뤄진 탓도 있다.수사가 장기간 진행된 만큼 재판에 넘겨지는 이들도 적지 않을 것으로 보인다. 검찰은 그간 삼성그룹 계열사와 관련 기관들에 대한 전방위 압수수색을 진행해 관련 자료를 확보했고, 수백명에 대해 1000회 안팎의 소환조사를 진행한 것으로 알려졌다. 검찰은 방대한 수사 기록 등을 통해 관여 정도 등을 살피면서 기소 대상자들을 추리고 있는 것으로 전해졌다.이미 소환조사가 이뤄졌던 이들을 재차 소환하는 등 막판 '혐의 다지기'에 집중하고 있는 만큼, 최종적인 책임 여부를 가리기 위해 검찰은 이 부회장을 조만간 소환해 조사할 것으로 보인다. 다만 지난해 말 시행된 형사사건공개금지 규정에 따라 이 부회장의 소환은 비공개로 이뤄질 전망이다. yoon@newsis.com<ⓒ 공감언론 뉴시스통신사. 무단전재-재배포 금지>",/news/news_read.nhn?article_id=0009854258&office_id=003&mode=search&query=삼성물산&page=1
