head,text,url
,"[아시아경제 최석진 기자] 삼성 준법감시위원회 위원으로 활동하는 것이 부적절하다는 지적이 제기된 봉욱(55·사법연수원 19기) 전 대검찰청 차장검사(변호사)가 “준법감시위는 재판에 영향을 끼치는 것을 오히려 경계하는 조직”이라며 “(이 같은 지적이) 타당하지는 않다고 생각된다”는 입장을 밝혔다.봉 변호사는 16일 아시아경제와의 통화에서 “기사에도 잠깐 언급된 대로 준법감시위라는 게 오히려 삼성에 쓴소리를 하고 파수꾼 역할을 하는 조직”이라며 “또 삼성과는 완전히 독립적으로 운영되는 기구”라고 해명했다.이어 그는 “준법감시위는 재판에 영향을 끼치는 것을 오히려 경계하는 그런 역할을 수행하는 조직”이라며 “지난주 위원회가 이재용 부회장 등에게 보낸 권고문 내용을 봐도 이를 알 수 있다”고 덧붙였다.이날 한 언론은 봉 변호사가 대검차장 시절 검찰의 삼성바이오로직스(삼성바이오) 수사 관련 내용을 보고 받았기 때문에 삼성의 준법감시위원으로 활동하는 것은 부적절하다고 보도했다.한편 준법감시위는 지난 11일 이 부회장과 삼성전자, 삼성전기, 삼성SDI, 삼성SDS, 삼성물산, 삼성생명, 삼성화재 등 7개 관계사에 권고문을 송부하면서 30일 이내에 회신할 것을 요청했다고 밝힌 바 있다.당시 준법감시위는 “위원회 활동과 총수 형사재판 관련성 논란을 불식시킬 수 있는 조치를 이 부회장과 관계사 모두가 마련해 공표해줄 것을 권고안으로 제시했다”고 밝혔다.검찰 조직 내에서 수사력과 기획력을 모두 인정받으며 대검찰청과 법무부의 요직을 두루 거친 봉 변호사는 김수남 전 검찰총장 사퇴 이후 검찰총장 직무대행을 맡다가 지난해 6월 퇴임했다.최석진 기자 csj0404@asiae.co.kr <ⓒ경제를 보는 눈, 세계를 보는 창 아시아경제 무단전재 배포금지>",/news/news_read.nhn?article_id=0004643269&office_id=277&mode=search&query=삼성물산&page=1
,"[아시아경제 조유진 기자] 이탈리아 내 신종 코로나바이러스감염증(코로나19) 확산이 국내 패션업체들의 이탈리아산 원단 수급 차질로 번질지 관련업계가 예의주시하고 있다. 코로나19 사태로 이탈리아가 전역에 봉쇄령을 내린 뒤 이탈리아산 원단을 사용하는 일부 브랜드의 경우 생산 자체가 불가능해 질 것이라는 최악의 관측까지 나오고 있다.16일 삼성물산 관계자는 ""이탈리아가 전국에 봉쇄령을 내리면서 현지에서 생산되는 원단 수급에 영향을 받을 수 있다""며 ""최악의 경우 관련 상품의 출시를 중단하는 상황도 가정하고 있다""고 말했다. 삼성물산의 의류 브랜드 빈폴의 경우 일부 제품에 이탈리아산 최고급 가죽을 사용하고 있다. 코로나의 급속한 확산으로 이탈리아 전역에 이동금지 조치 등이 내려진 가운데 정부의 방침에 따라 공장 가동 중단 등으로 원단 수급이 끊기는 상황까지 우려하는 것이다. 이 관계자는 ""올 봄·여름 신상 제품에 사용되는 원단 발주에는 현재 영향이 없는 것으로 파악되지만 상황이 장기화될 경우 미치는 파장을 가늠할 수 없다""고 말했다.LF도 원단 수급처가 이탈리아 전역에 걸쳐 있는 만큼 상황을 예의주시하겠다는 입장이다. 올 봄·여름 시즌 물량은 이미 작년에 주문이 완료된 상황이지만 6월초부터 입고가 시작되는 가을·겨울 시즌 물량이 문제다. LF관계자는 ""코로나 사태의 추가 확산으로 납기 기한이 한 달 이상 늦춰질 경우 항공으로 긴급 수송에 나서거나 포르투칼, 북유럽 등에서 대안을 찾는 방안을 고려중""이라고 말했다. 납기 기한을 맞추기 위해 수입 전량을 항공 수송으로 돌릴 경우 비용 증가에 따른 이익 감소가 불가피할 전망이다. LF는 헤지스, 닥스, 질스튜어트뉴욕, 마에스트로, 알레그리, 아떼바네사부르노 등 산하 6개 브랜드에서 이탈리아산 원단을 사용하고 있다.이탈리아에서 완제품을 구입해 국내 유통하는 업체들도 타격을 우려하고 있다. 신세계인터내셔날이 주세페 자노티 브랜드 완제품 전량을 이탈리아에서 수입 판매하고 있다. 신세계인터 관계자는 ""코로나19 사태가 급속히 확산되기 직전인 1월 말께 올 가을·겨울 수입 제품에 대한 구매를 완료된 상태라 현재로선 직접적인 피해는 없지만 사태가 길어질 경우를 대비해 매일 이탈리아
본사와 상황을 체크하고 있다""고 전했다.이탈리아는 중국 다음으로 코로나19의 확진자와 사망자 수가 많은 고위험 국가로 분류되고 있다. 코로나19가 무서운 속도로 확산하자 이탈리아 정부는 지난달 22일 확진자 발생이 집중된 북부지역에 대해 봉쇄령(주민 이동금지조치)을 내린 데 이어 지난 10일에는 봉쇄령을 전국으로 확대하고 모든 상점을 일시적으로 폐쇄하는 고강도 조치를 내놨다. 업계 관계자는 ""정부 봉쇄령을 내린 시점은 올 가을·겨울 시즌 원단 발주가 이뤄지는 시점이었다""면서 ""현재로선 생산에 차질이 없는 모습이지만 정부 방침에 따라 공장 가동 중단 등의 상황을 가정하지 않을 수 없는 상황""이라고 전했다.조유진 기자 tint@asiae.co.kr <ⓒ경제를 보는 눈, 세계를 보는 창 아시아경제 무단전재 배포금지>",/news/news_read.nhn?article_id=0004643291&office_id=277&mode=search&query=삼성물산&page=1
"""준법위 출범 전 과거일 몰두 아니냐는 우려""…과거사 문제만 집중 모양새","[아이뉴스24 이연춘 기자] 삼성이 창사 82년 만에 외부 준법경영 감시기구를 출범시키면서 국정농단 사태와 같은 정경유착의 단절을 선언했다.이재용 삼성전자 부회장의 파기환송심 재판부가 내준 숙제를 실행에 옮긴 행보다. 지난해 10월 환송심 재판부는 이 부회장에게 과감한 혁신, 재벌폐해 시정과 함께 기업범죄를 차단할 실효적인 준법감시제도 마련을 권고했다.다만, 애초 재계에서는 삼성준법감시위원회(이하 준법위)의 출범 이후 행보를 두고 재계 모범적인 선례로 윤리경영 파수꾼이 될 것이라는 기대가 컸다. 하지만 시간이흐르면서 기대보다는 우려가 앞서면서 과거사에만 집착하는 것 아니냐는 지적이 나오고 있다.16일 재계에 따르면 준법위는 지난 2월 5일 닻을 올렸다. 당시 김지형 준법위 위원장(법무법인 지평 대표변호사)은 간담회를 통해 준법위 설치 이후의 사안을 중심으로 다룰 방침이라고 설립 취지를 언급했다.준법위는 기업으로서는 경영을 두고 원리·원칙을 꼬치꼬치 따지는 '성가신 조직'이 아닐 수 없다는 관측이 적지않다. 최근 3차례 걸친 삼성을 향한 준법위의 칼날이 심상치 않다는 게 일각의 평가다.당초 취지와 달리 삼성의 치부를 드러내는 데에만 열중하고 있다는 관측이 나온다. 준법위 설치 이후의 의제를 논하기 보다는 과거사 문제를 집중하는 모양새로 무조건적인 사과에 나서고 있기 때문이다.준법위는 지난 11일 이 부회장에게 삼성그룹 경영권 승계 의혹에 대해 반성·사과하라고 권고했다. 또 삼성의 지속가능한 경영을 위해 '무노조 경영' 방침을 폐기할 것을 주문했다.준법위는 과거 삼성그룹의 불미스러운 일들이 대체로 경영권 승계와 관련이 있었다고 결론 내렸다. 이는 사법부에서 판단할 일이지 준법위가 나서서 결론 지을 일이 아니다는 분석이 법조 전문가들의 얘기다. 일각에서 준법위에 부여된 권한이 오히려 남용되고 있는 것 아니냐는 비판이 나오는 이유다.그러면서 과거 총수 일가의 그룹 경영권 승계 과정에서 준법의무를 위반하는 행위가 있었던 점에 대해 그룹 총수인 이 부회장의 반성과 사과를 주문했다. 위원회는 ""(이 부회장이) 향후 경영권 행사 및 승계 관련 준법의무 위반이 발생하지 않을 것임을 국민들에게 공표해달라""고 촉구했다.문제는 앞서 준법위는 출범 이후부터 발생하는 사안을 중심으로 다루겠다는 원칙은 사라졌고 또 현재 법원에서 다투고 있는 '경영권 승계'와 관련해서는 위법이라 단정지었다. 삼성은 2015년 삼성물산과 제일모직 합병 과정에서 이 부회장이 원활하게 경영권을 승계받도록 하기 위해 그룹 차원에서 관계사들을 움직였다는 의혹을 받고 있고 검찰은 지금도 이 부분을 수사하고 있다.재계 한 고위관계자는 ""준법위의 독립적인 활동 노력은 인정하지만 준법위가 본래의 출범 목적인 위법 사안 예방기능 보다는 과거의 경영 활동을 강조한 점에서 다소 문제가 있다""고 지적했다.앞서 지난달 삼성은 과거 2013년 미래전략실의 '임직원 시민단체 기부금 후원내역'을 무단 열람했던 것에 대해 공식 사과한 바 있다. 이는 준법위의 의견에 따른 첫 사과다.향후 발생할 위법 활동을 예방해야 할 준법위가 출범 이전의 과거 일에 지나치게 몰두하는 것 아니냐는 우려가 나온다. 미전실은 박근혜 전 대통령과 최순실(개명 후 최서원)씨의 국정농단 사건에 연루됐다는 의혹이 일자 2017년 2월 해체됐다.삼성은 7년 전 일임에도 준법위 권고를 받아들였다. 삼성은 ""절대 있어서는 안 될 명백한 잘못이었음을 인정한다”며 임직원들과 '불온 단체'로 규정됐던 시민단체, 관계자들에게 공식 사과했다. 이어 ""다시는 이와 같은 일이 재발하지 않도록 경영진부터 책임지고 앞장서서 대책을 수립해 이를 철저하고 성실하게 이행해 내부 체질과 문화를 확실히 바꾸도록 하겠다""며 재발방지를 약속했다.일각에선 삼성이 이미 사과한 노조 문제를 준법위가 재차 이 부회장에게 직접 사과하라고 요구한 것도 적절치 않다는 지적이 나온다. 삼성은 지난해 12월 입장문을 통해 ""노조에 대한 시각과 인식이 국민 눈높이와 사회의 기대에 미치지 못했다""고 사과했다.실제 삼성의 사과 이후 삼성전자·삼성화재·삼성디스플레이 등 계열사에 연이어 노조가 설립됐다. 그럼에도 준법위가 이 부회장이 노조 관련 과거 잘못을 반성·사과하고 앞으로 무노조 경영 방침 폐기를 표명하라는 요구는 엄밀해 따지면 과거 사건이라 준법위가 판단할 대상은 아니다고 재계 관계자는 주장했다.준법위가 정조준한 삼성을 향한 활동은 이뿐만이 아니다. 준법위는 노조, 경영권 승계, 시민사회 소통 문제를 중점 과제로 선정하면서 홈페이지를 오픈했다. 누구나 홈페이지를 통해 신고 혹은 제보할 수 있으며 제보자 익명성을 위해 신고시스템을 외부 전문업체에 위탁해 운영할 계획이다.재계에선 ""준법위의 독립적인 활동 노력은 인정하지만 준법위가 본래의 출범 목적인 위법 사안 예방기능 보다는 과거의 경영 활동을 강조한 점에서 다소 문제가 있다""며 ""준법위의 역할과 기능은 기업으로 하여금 적절한 균형을 유지토록 돕는 일일 것""이라고 했다.재계 곳곳에선 외부에 대놓고 이야기하지는 않지만 내부적으로는 준법위의 이런 여론몰이식에 대한 불만과 억울함을 우려하는 분위기가 역력하다.재계 관계자는 ""준법위가 재계에서 우려하는 무소불위의 감시기구가 아닌 건강하고 건전한 준법경영의 틀을 구축하는 순기능에 충실하고, 삼성의 변화를 함께 만들어가는 '파트너'로서 역할을 하는 선례를 만든다면 재계 전반에도 긍정적인 영향을 미칠 것""이라고 말했다. staykit@inews24.com [ⓒ 아이뉴스24 무단전재 및 재배포 금지]",/news/news_read.nhn?article_id=0000529778&office_id=031&mode=search&query=삼성물산&page=1
,"[아시아경제 구은모 기자] 미국 중앙은행인 연방준비제도(Fed)가 신종 코로나바이러스감염증(코로나19)의 여파에 대응하기 위해 기준금리를 '제로(0)' 수준으로 인하하는 등 조치를 취했지만 코스피를 비롯한 아시아 주요국 증시는 시큰둥한 모습이다.16일 코스피는 전 거래일 대비 33.99포인트(1.92%) 상승한 1805.43으로 출발했다. 이날 상승 출발한 코스피는 장 초반 등락을 거듭하며 1770선 안팎에서 혼조세를 보이고 있다. 오전 10시30분 현재 전일 대비 4.68포인트(0.26%) 오른 1776.12를 기록 중이다.현재 거래 주체별 매매 동향을 보면 기관과 외국인 투자자는 각각 3003억원, 2964억원 순매도하고 있다. 반면 개인 투자자가 5857억원 순매수하고 있다. 시가총액 상위종목들 가운데는 셀트리온, SK하이닉스, 삼성바이오로직스 등은 오르고 있는 반면 네이버, 삼성물산, 현대모비스 등은 내리고 있다.아시아 주요국 증시도 대체로 보합권에 머물고 있는 모습이다. 이날 일본 도쿄증시에서 전 거래일 대비 155.03포인트(0.88%) 오른 1만7586.08포인트로 출발한 니케이225지수(닛케이평균주가)는 코스피와 마찬가지로 혼조세를 보이고 있다. 오전 10시30분 현재 전 거래일 대비 9.46포인트(0.05%) 오른 1만7440.50포인트를 기록 중이다.앞서 Fed는 15일(현지시간) 코로나19 여파에 대응하기 위해 기준금리를 '제로' 수준으로 전격 인하했다. Fed는 이날 기준금리를 기존 1.00%~1.25%에서 0.00%~0.25%로 1%포인트 인하한다고 밝혔다. 또 유동성 공급 확대를 위해 7000억달러 규모의 국채와 주택저당증권(MBS)을 매입하기로 했다.Fed의 적극적인 부양책에도 불구하고 시장은 크게 반응하고 있지 않은 모습인데, 이는 Fed의 금리인하와 자산매입이 시장이 이미 예상했던 내용이기 때문이라는 분석이다. 김영환 KB증권 연구원은 ""지난주까지 금융시장을 봐도 금리선물시장은 제로금리 인하를 90% 반영하고 있었다""며 ""Fed의 부양책이 서프라이즈는 아니었기 때문에 시장을 급반등시키는 효과가 약한 것""이라고 설명했다.현재의 상황을 반등시키기 위해서는 결국 코로나19의 확산세 둔화와 백신 개발 그리고 정부의 강도 높은 재정정책 발표 등이 필요하다는 지적이다. 김 연구원은 ""지난주 금요일 미국 시장을 급반등시킨 것도 트럼프의 국가비상사태 선포의 영향이 크다""며 ""이는 시장이 그만큼 정부의 재정부양책에 대한 기대에 크다는 사실을 보여준다""고 말했다.구은모 기자 gooeunmo@asiae.co.kr <ⓒ경제를 보는 눈, 세계를 보는 창 아시아경제 무단전재 배포금지>",/news/news_read.nhn?article_id=0004643334&office_id=277&mode=search&query=삼성물산&page=1
,"삼성물산 건설부문은 서울 서초구 신반포15차 아파트 재건축사업인 ‘래미안 원 펜타스(조감도)’에 자사 아파트 브랜드 ‘래미안’이 갖고 있는 최고의 디자인 역량을 집중할 것이라고 16일 밝혔다. 삼성물산은 특히 래미안 원 펜타스에 독일 메르세데스-벤츠 박물관과 싱가포르 래플스 시티 등으로 유명한 네덜란드의 유엔 스튜디오(UN Studio)와 협업, 최고의 디자인을 선보일 예정이다. 외관 디자인의 경우 단지 북쪽은 한강, 남쪽은 반포 도심과 연결되는 단지의 특성을 살릴 계획이다. 구체적으로 북쪽은 한강의 고요한 느낌을 살릴 수 있는 자연스러운 색상을 적용하고, 남쪽은 도심지의 활력 있고 강한 느낌을 연출한다는 것이다.또 래미안 원 펜타스에는 건축물의 수직과 수평 디자인을 다르게 적용할 예정이다. 수직 디자인은 상승하는 반포의 이미지와 부합하는 강한 프레임을 살리고, 수평 디자인은 주동을 감싸는 유기적인 선형을 활용해 우아하고 아름다운 느낌을 줄 계획이다. 단지 입구에는 150m에 이르는 거대하고 유려한 문주를 설치, 단지를 빛내는 상징이 될 것으로 기대하고 있다. 래미안 원 펜타스에는 단지 주차장 입구에 호텔식의 ‘드롭-오프 존’도 만들 계획이다.
김순환 기자 soon@munhwa.com[Copyrightⓒmunhwa.com '대한민국 오후를 여는 유일석간 문화일보' 무단 전재 및 재배포 금지()]",/news/news_read.nhn?article_id=0002420856&office_id=021&mode=search&query=삼성물산&page=1
,"[서울Biz]●장훈 씨 별세, 장하균(전 삼성물산 상무)·상균(한국전력기술 부장)·인균·형균(한국무역보험공사 뉴욕지사장)씨 부친상, 양덕렬(전 한국통신 이사)·정범석 씨 장인상, 15일, 대전 유성선병원 장례식장 VIP 2호실, 발인 17일 오전 7시30분. 042-825-9494●김동칠(전 한국전력공사 지점장)씨 별세, 김성환(한국투자증권 부사장)·김석환(수풀림우드 대표이사)·김경환(마루글로벌 대표)씨 부친상, 16일 오전 4시, 서울성모병원 장례식장 31호, 발인 18일 오전 6시. (02)2258-5940●이성남씨 별세, 이보미(STN스포츠 기자)씨 부친상, 16일 오전, 강원 삼척의료원 장례식장 2층 2호실, 발인 18일 오전 9시. 033-570-7450●김필순씨 별세, 문정훈(현대자동차 전주공장장)씨 장모상, 15일 오전, 부산 침례병원 장례식장 6층 특1호실, 발인 18일 오전 6시 30분. 051-923-1334▶ [] ▶ [] ▶
ⓒ 서울신문(www.seoul.co.kr), 무단전재 및 재배포금지",/news/news_read.nhn?article_id=0003074113&office_id=081&mode=search&query=삼성물산&page=1
2030 고객 타깃으로 트렌디한 디자인·가성비 두루 갖춰,"[아이뉴스24 이현석 기자] 삼성물산 패션부문 '빈폴'이 2030세대 고객들이 선호하는 트렌디한 디자인과 가성비를 두루 갖춘 온라인 전용 컬렉션을 론칭한다.빈폴은 일상 속에서 가장 사랑받는 스타일로 구성한 온라인 전용 컬렉션 '그린 빈폴'을 론칭했다고 16일 밝혔다.그린 빈폴은 올 봄·여름 시즌을 겨냥한 그린 빈폴은 일상에서 가장 즐겨 입는 기본에 충실한 스타일의 아이템들로 기획됐다. 또 스웨트셔츠, 피케 티셔츠·원피스, 라운드넥 티셔츠, 캐주얼 셔츠 등 언제 어디서나 편안하게 활용할 수 있는 아이템들로 구성됐다.먼저 빈폴멘은 군더더기 없는 디자인에 포켓·와펜 디테일을 더한 반팔 티셔츠, 컬러 블록을 넣어 캐주얼한 무드를 높인 반팔 럭비 피케 티셔츠, 청량감이 느껴지는 스트라이프 풀오버 셔츠 등을 출시했다. 또 빈폴레이디스는 자전거 자수로 포인트를 준 반팔 티셔츠, 경쾌한 느낌의 스프라이프 티셔츠, 깔끔하고 클래식한 기본 반팔 피케 원피스, 가벼운 아우터로도 활용 가능한 포멀 셔츠 원피스 등을 선보였다.이와 함께 그린 빈폴은 동일한 컬러, 패턴, 소재를 활용해 자연스러운 시밀러룩을 연출할 수 있는 커플 아이템도 제안했다. 빈폴멘·레이디스는 스웨트셔츠에 바퀴살을 없애 한층 간결해진 새 자전거 로고를 각각 남녀 버전으로 적용했다. 또 블루 깅엄 체크 패턴의 시어서커 소재를 사용해 빈폴멘은 반팔 셔츠를, 빈폴레이디스는 셔츠 원피스를 선보였다.빈폴 관계자는 ""밀레니얼 세대가 평소에 자주 입는 기본적인 아이템을 고품질과 가성비를 함께 갖출 수 있도록 기획했다""라며 ""일상 속 모든 순간에 자연스럽게 녹아 드는 그린 빈폴 상품들을 통해 꾸민 듯 안 꾸민 듯 멋스러운 데일리룩을 연출할 수 있을 것""이라고 말했다.한편 빈폴은 그린 빈폴 컬렉션 출시를 기념해 삼성물산 패션부문 통합 온라인몰 SSF샵에서 오는 31일까지 추가 10% 할인 및 무료 교환·반품 혜택을 제공한다. tryon@inews24.com [ⓒ 아이뉴스24 무단전재 및 재배포 금지]",/news/news_read.nhn?article_id=0000529816&office_id=031&mode=search&query=삼성물산&page=1
,"[디지털타임스 박상길 기자] 코로나19도 강남권 재건축 수주 열기는 꺾지 못했다. 건설사들이 코로나19에 따른 경기 침체가 더 가속화되기 전, 비교적 분양성과 사업성이 보장될만한 강남권 재건축 사업장을 확보하기 위해 치열한 경쟁을 펼치고 있다.16일 부동산 업계에 따르면 총사업비 2400억원 규모의 신반포 15차 재건축 수주전이 뜨겁게 달아올랐다. 신반포 15차는 강남권 재건축 치고는 사업 규모가 크지 않지만 국내 주거 문화를 주도하는 반포 일대에 들어서는 상징성 때문에 건설사들이 수주에 총력을 기울이고 있다.특히 삼성물산 건설부문이 5년 만에 재건축 수주전에 뛰어들며 강력한 수주 의지를 드러냈다. 삼성물산 건설부문은 신반포 15차 조합에 선분양을 제시한 것으로 알려졌다. 또 래미안이 가진 최고의 디자인 역량을 쏟아붓겠다고 강조했다. 이외에도 미세먼지 저감 수종과 30평 규모의 글램핑이 가능한 공간 구성 등을 제안했다.대림산업은 641가구 단일 단지가 아닌, 국내 최고 주거단지 아크로리버파크와 함께 하는 2253가구 시그니처 브랜드타운을 형성하겠다며 맞불을 놨다. 신반포 15차를 시작으로 강남권 재건축 수주전은 더 뜨거워질 전망이다. 코로나19 확산세로 정비 사업장도 위축이 불가피해지면서 일감 확보가 쉽지 않아서다. 오는 30일 1020억원 규모의 신반포21차, 다음 달 10일 8087억원 규모의 반포주공1단지 3주구가 입찰을 마감하고 시공사 선정에 돌입할 예정이다. 삼성물산 건설부문은 반포주공 1단지 3주구 수주에도 강한 의지를 보여 수주 경쟁이 치열할 것으로 예상된다.함영진 직방 빅데이터랩장은 ""코로나19 여파로 정비 사업도 둔화될 수 있어 시공사 선정을 앞둔 사업지의 경우, 일감 확보 차원에서 건설사들이 치열한 경쟁을 펼칠 것""으로 전망했다.장재현 리얼투데이 리서치 본부장은 ""코로나 정국 속 분양가상한제 연기 등의 이야기까지 물 밑에서 나오고 있다""며 ""코로나 여파가 장기적으로 이어지고 금리 인하도 가속화되면 강남 재건축 수주전은 더욱 가열될 것""을 진단했다.박상길기자 sweatsk@dt.co.kr 디지털타임스
/",/news/news_read.nhn?article_id=0002588881&office_id=029&mode=search&query=삼성물산&page=1
