head,text,url
,"‘후분양’ 도입을 적극 반대하던 대형 건설업체가 최근 잇따라 ‘후분양’을 하겠다며 전략을 선회했다. 이 같은 전략은 서울 강남권 재건축 추진 아파트를 중심으로 추진 중이다. 사업 수주를 위해 재건축조합에 각종 금융혜택을 제안하며 금전적 부담을 최소화하겠다는 후분양 공약을 내걸었다. 몇년 전 국회에서 후분양 도입을 의무화하자는 논의가 나올 때만 해도 “시공비용 부담이 크다”는 이유로 반대했지만 강남 재건축 수주를 위해 비용 출혈도 각오하겠다는 태도로 돌변했다.최근 대형 건설업체의 잇딴 후분양 제안은 강남권 재건축 추진 단지에만 국한됐다.삼성물산 건설부문은 지난달 서울 서초구 반포동 반포주공1단지 3주구(반포3주구) 재건축사업 입찰제안서를 제출하며 조합에 후분양을 제안했다. 삼성물산은 일반적인 후분양과 달리 100% 준공 후 분양을 제시했으며 이를 위해 총회에서 결의하는 사업비 전체를 시공업체가 책임지고 조달하는 파격적인 제안을 내걸었다. 삼성물산 관계자는 “신용등급 AA+라는 건설업계 최고의 신용등급을 보유한 자사기 때문에 가능한 조건”이라고 강조했다. 삼성물산은 조합원 부담을 줄이기 위해 시공사 선정 이후 물가 상승 등의 요인에 따른 공사비 인상을 하지 않을 계획이다. 후분양을 선택해도 조합원 환급금을 조기 지급할 예정이며 조합원 부담금의 경우 입주할 때 납부하는 조건을 제안했다.대우건설은 조합원 선택의 폭을 넓혔다. 대우건설은 반포3주구 사업 수주를 위해 일반적인 선분양·후분양 방식에 더해 새 사업방식인 리츠(부동산투자신탁)를 통한 선택적 장기 후분양 방식까지 추가 제안했다. 재건축 리츠는 조합원 분양분을 제외한 일반분양분을 감정평가금액으로 리츠에 현물 출자해 일정기간 운용한 뒤 처분하는 방식이다. 수익성 확보에 사활을 건 조합 입장에선 대우건설의 제안이 솔깃할 수 있다는 분석이다. 다만 대우건설의 제안은 국토교통부와 서울시가 ‘불공정행위’로 규정지어 실제 도입은 어려울 전망이다. 포스코건설은 인근 신반포21차 재건축에 후분양을 제안했다. 포스코건설은 금융권 조달 없는 자체보유자금으로 골조공사 완료 시까지 공사를 수행하고 그 이후 일반분양해 공사비를 지급받음으로써 조합원은 입주 때까지 중도금이나 공사비 대출이자 부담이 전혀 없다고 설명한다.포스코건설 관계자는 “공사비 대출 없는 조건을 제안해 조합의 이자부담이 전혀 발생하지 않는 데다 대출 절차 일정이 불필요해져 사업 지연 가능성도 없다”고 강조했다.최근 일부 대형 건설업체의 후분양 추진에 앞서 정부도 2018년 후분양제 도입을 위한 중장기 로드맵을 마련한 바 있다. 이를 위해 당시 한국토지주택공사(LH)의 공공부문 단지(시흥장현, 춘천우두)와 화성동탄2 등 4개 택지에서 민간부문의 후분양제를 일부 도입했다.정부의 후분양제 도입 취지는 간단한다. 선분양제에서 반복되는 하자문제에 따른 소비자 선택권 제한 개선과 분양권 전매 등 투기세력을 차단하기 위함이다.후분양 시점은 공정률 60%가 기준이다. 공정률 60% 이상에서 진행되는 후분양의 경우는 기관이 자율적으로 시행하되 2022년 성과평가 후 공정률 상향이 검토된다.정부는 민간부문으로까지 전면 확대는 조심스럽지만 후분양제 공급을 우선 추진한 뒤 2022년까지 공공물량의 70%를 후분양으로 공급할 방침이다. 정부의 후분양제 도입 의지에 건설업계는 그동안 난색을 표했다. 중견건설업체 관계자는 “일정 시점까지 모든 비용을 건설업체가 부담해야 해 대형 건설업체보다 자금력이 부족한 중견·중소 건설업체는 미분양 부담에 따른 리스크가 크다”고 우려했다.대형 건설업체 관계자도 “신용등급이 낮거나 자금력이 달리면 대형 건설업체에도 후분양이 쉽지 않은 사안”이라고 귀띔했다.건설업계는 그동안 선분양을 통한 청약자의 중도금으로 시공비용을 조달한 만큼 후분양으로 전환하면 자금 압박에 시달릴 가능성이 높다며 후분양제 도입을 반대했다. 하지만 최근 들어 후분양제를 조건으로 내걸고 강남 재건축 수주에 혈안이다. 다만 소비자 권리 보호를 위한 정부의 후분양 도입 의지와 달리 이들은 일정 부분 금전적 출혈도 각오한다. 단지 ‘재건축 수주’에 초점을 맞춘 것.강남 재건축사업 수주를 위해 스스로 후분양 카드를 꺼냈지만 전면 도입 가능성도 적어 보인다. 10대 건설업체의 경우 대체로 한해 1만가구 이상의 아파트를 분양한다. 이를 모두 후분양으로 공급하면 아무리 대형 업체라도 금전적 무리가 뒤따른다. 최근 후분양을 제안한 대형 건설업체 관계자는 “후분양 제안은 전면도입을 위한 초석이 아니라 사업 수주를 위한 전략이라 사업성이 높은 강남권에 치중됐다”고 말했다. 이어 “사업 규모나 시장 상황에 따라 선별 도입 가능성은 있지만 현실적으로 전면 도입은 불가능하다”고 선을 그었다. 김창성 기자 solrali@mt.co.kr
<저작권자 ⓒ '성공을 꿈꾸는 사람들의 경제 뉴스' 머니S, 무단전재 및 재배포 금지>",/news/news_read.nhn?article_id=0000546002&office_id=417&mode=search&query=삼성물산&page=1
,"[머니투데이 김사무엘 기자] 코로나19(COVID-19)가 한국 증시의 지형도를 바꿔 놓았다. IT(정보기술) 플랫폼 기업 카카오가 현대차를 제치고 시가총액 상위 10위 이내에 진입했고, 삼성바이오로직스와 셀트리온 등 제약·바이오 종목들도 약진했다. 코로나19 사태에도 '서프라이즈' 실적을 실현한 LG생활건강도 시총 10위 내에 이름을 올렸다.반면 전통적인 제조업으로 분류되는 현대차와 현대모비스, POSCO(포스코), 삼성물산 등은 시총 순위가 추락했다. 코로나19가 가져온 사회 변화가 기업 가치에도 영향을 미치고 있다는 분석이다.23일 한국거래소에 따르면 코로나19 이후 코스피 시총 상위 주요 종목들의 순위가 대거 조정됐다. 지난해 말 시총 상위 10위 안에 들었던 포스코, 현대모비스, 삼성물산은 현재 10위권 밖으로 밀려났고 대신 카카오, 삼성SDI, LG생활건강이 새로 10위권 내에 진입했다.가장 눈에 띄는 종목은 카카오다. 카카오의 시총은 지난 22일 기준 21조5062억원으로 현대차(20조1916억원)를 제치고 시총 9위(삼성전자 우선주 제외)에 올랐다. 카카오는 지난해 말 시총 13조2338억원으로 22위였지만 불과 5달만에 주가가 60% 오르며 순위가 뛰어 올랐다.코로나19로 인한 언택트(Untact·비대면) 시대의 대표 수혜주로 주목받으면서 기업 가치가 크게 올랐다는 분석이다. 카카오페이, 카카오뱅크, 카카오페이지 등 카카오가 영위하고 있는 주요 사업들은 산업 사이클상 현재 고성장기에 진입한 상태인데, 여기에 코로나19 수혜가 가미되면서 폭발적인 성장세를 보여주고 있기 때문이다.카카오페이지는 지난해 영업이익률(매출액 대비 영업이익 비율)이 10%대까지 상승할 정도로 빠른 수익성 개선을 보이고 있다. 카카오뱅크는 지난해 1분기 처음으로 순손익분기점을 돌파한데 이어 올해 1분기 순이익은 185억원으로 전년 동기대비 180% 성장을 기록했다.성종화 이베스트투자증권 연구원은 ""코로나19가 촉발한 언택트 시대의 가속화로 페이, 뱅크, 페이지, 커머스 등 언택트 비즈니스들은 모두 매우 우호적인 사업환경을 맞이하고 있다""며 ""고성장 에너지는 향후에도 꺼지지 않고 지속될 것이며 손익도 더욱 가파르게 개선될 것""이라고 분석했다.코로나19 치료제 개발에 관심이 쏠리면서 제약·바이오 업체들도 크게 주목받았다. 삼성바이오로직스의 시총 순위는 지난해 말 4위에서 현재 3위로 올랐고 셀트리온 시총은 7위에서 5위로 점프했다. 두 기업은 모두 코로나19로 인한 폭락장에도 불구하고 지난해 말보다 주가가 올랐다는 공통점이 있다. 삼성바이오로직스와 셀트리온의 주가는 올들어 각각 42.7%, 19.3% 올랐다. 이 기간 코스피 지수가 10% 이상 하락한 것을 감안하면 상당한 성과다.생필품과 화장품 등을 생한하는 LG생활건강은 코로나19로 인한 수요 위축에 취약할 수밖에 없는 사업구조임에도 1분기 예상치를 뛰어넘는 실적으로 시장을 깜짝 놀라게 했다. LG생활건강의 1분기 영업이익은 전년 동기대비 3.6% 늘어난 3337억원을 기록했는데, 이는 지난해보다 30% 가량 줄어들 것으로 예상한 컨센서스(전망치)를 크게 상회하는 실적이었다.안정적 성장을 위한 LG생활건강의 사업 포트폴리오 분산이 코로나19 위기에서도 빛을 발했다. LG생활건강은 화장품, 생활용품, 음료 부문 매출 비중이 60%, 20%, 20%로 분산돼 있는데 한 사업 부문에서 위기가 오면 다른 사업 부문에서 이를 상쇄하는 실적으로 안정적 성장을 이끌어왔다.특히 이번 코로나19 사태에서는 위생용품 수요가 크게 늘면서 생활용품 부문 영업이익이 전년 대비 50.3% 증가한 652억원을 기록했다. 세정제와 물티슈 등 코로나19 관련 용품이 온라인을 중심으로 불티나게 팔려 나갔고, 국내 생활용품 시장 점유율 1위 지위도 더 견고히했다.반면 시총 순위가 하락한 기업들은 대부분 전통 제조업이었다. 현대차와 현대모비스는 자동차 공장 셧다운과 판매 급감의 여파로 올 들어 주가가 각각 21.6%, 28.1% 급락했다. 시총 순위도 현대차는 5위에서 10위로 떨어졌고 6위였던 현대모비스는 12위로 추락하며 10위권 밖으로 밀려났다.포스코는 코로나19로 인한 글로벌 경기 침체의 여파로 철강 수요가 위축되면서 주가 하락을 피할 수 없었다. 포스코의 시총은 지난해 말 20조6197억원에서 지난 22일 14조9961억원으로 줄었고 시총 순위도 9위에서 16위로 하락했다.김사무엘 기자 samuel@mt.co.kr
<저작권자 ⓒ '돈이 보이는 리얼타임 뉴스' 머니투데이, 무단전재 및 재배포 금지>",/news/news_read.nhn?article_id=0004413493&office_id=008&mode=search&query=삼성물산&page=1
