head,text,url
,"코스피가 신종코로나 바이러스 감염증(코로나19) 팬데믹(세계적 대유행) 선언에 또 다시 폭락 마감했다.12일 코스피는 전일 대비 73.94포인트(3.87%) 내린 1834.33에 마감했다.이날 지수는 20.30포인트 내린 1887.97에 개장해 장 초반 낙폭을 키웠다. 외국인의 매도 공세에 지수는 장중 1810선이 붕괴되는 등 폭락장을 연출했다.신종코로나바이러스 감염증(코로나19) 확산 여파로 글로벌 증시가 급락하면서 투자심리가 위축되는 것으로 풀이된다.특히 도널드 트럼프 대통령이 11일(현지시간) 대국민 연설 이후 국내 증시는 하락폭을 확대했다. 트럼프 대통령은 이날 연설을 통해 유럽 국가에서 미국으로 여행하는 것을 30일간 막겠다고 밝혔다.서상영 키움증권 연구원은 ""트럼프 대통령의 발언은 유럽과의 교류 중단을 발표하는 등 부정적인 부분이 더 많았다""며 ""미국의 특별조치와 함께 대규모 부양정책 등 적극적인 대응을 기대했던 시장에서 실망 매물이 출회하며 낙폭을 확대했다""고 설명했다.노동길 NH투자증권 연구원도 ""미국 주식시장 선물 지수는 트럼프 대통령의 성명 이후 급락했다""며 ""투자자들이 전일에 이어 구체적인 대응 방안 부재에 실망감을 보였다""고 분석했다.노 연구원은 ""이날 코스피 하락 시점도 트럼프 대통령의 성명 직후와 일치한다""며 ""금융시장이 두려워하고 있는 바는 코로나19 확산세 자체보다 민간 소비와 기업 투자 감소분을 메울 수 있을지 여부""라고 말했다.결국 한국거래소는 이날 오후 1시 4분 37초에 선물가격 하락으로 인해 5분간 유가증권시장에서 프로그램 매도 호가 효력이 일시 정지(사이드카 발동)된다고 공시했다.유가증권시장 사이드카는 코스피200 선물거래 종목 중 직전 거래일 거래량이 가장 많은 종목의 가격이 5% 이상 상승 또는 하락한 상태가 1분간 지속할 경우 발동된다.유가증권시장에서 매도 사이드카가 발동된 것은 그리스 채무불이행(디폴트) 우려가 커진 지난 2011년 10월 4일 이후 약 8년 5개월 만에 처음이다.증권가에서는 코로나 확산이 둔화되더라도 경제활동이 완전히 정상화되는 데에는 상당한 시간이 소요될 것으로 전망했다.박소연 한국투자증권 연구원은 ""코로나가 처음에는 바이러스 확산으로 인한 가동중단, 공급차질 정도의 이슈였는데 글로벌 판데믹으로 흐르고 경기침체 문제로 확대되더니 이제는 부채 문제와 금융위기 논란까지 시나리오가 번졌다""며 ""이 정도면 더 이상 나올 악재가 없을 정도""라고 분석했다.박 연구원은 ""코로나 확산이 완전히 종식될 때까지 중앙은행이 한계기업과 주체들에게 일종의 쿠션을 제공할 필요가 있다""며 ""이 때문에 오는 18일 미 연방공개시장원회(FOMC)에서 50~75bp 이상의 대폭적인 금리인하나 보다 직접적인 금융시장 개입과 유동성 공급이 이뤄져야 한다고 본다""고 말했다.이날 유가증권시장에서는 전업종이 파란불이 들어왔다. 기계, 의료정밀, 건설업, 은행, 화학, 종이·목재, 운송장비, 금융업 순으로 낙폭이 컸다.매매주체별로 개인과 기관은 5373억원, 2842억원 순매수한 반면 외국인은 8972억원 순매도했다. 프로그램 매매는 2327억원 매도 우위를 나타냈다.시가총액 상위 종목 중에서는 LG화학이 6%대 약세를 기록했고, 현대차, LG생활건강, 삼성물산, 현대모비스, 엔씨소프트 등도 약세를 보였다.이날 유가증권시장에서는 19개 종목이 상승했고 878개 종목이 떨어졌다.코스닥은 전일 대비 32.12포인트(5.39%) 내린 563.49에 마감했다.[디지털뉴스국 김현정 기자] [ⓒ 매일경제 & mk.co.kr, 무단전재 및 재배포 금지]",/news/news_read.nhn?article_id=0004535296&office_id=009&mode=search&query=삼성물산&page=2
,"삼성그룹이 신종 코로나바이러스감염증(코로나19) 확산으로 어려움을 겪고 있는 임직원들에게 격려 물품을 보냈다. 재택근무 또는 자가격리 중인 직원들, 확진자 급증으로 방문이 어려운 대구·경북 지역에 거주 중인 임직원의 가족이 대상이다.삼성전자는 12일 삼성전자, 삼성생명, 삼성물산 등 18개 계열사와 자회사 및 협력사 임직원 중 자가격리 중인 2500명과 재택근무자 5000명에 격려 물품을 보냈다고 밝혔다. 손소독제, 핸드워시 등 감염 예방 용품과 홍삼, 비타민 등 건강 보조식품, 그리고 컵밥과 간편식 등의 생활용품이 담긴 상자가 각 계열사 대표 명의의 편지와 함께 전달됐다.대구·경북 지역에 거주 중인 부모, 시부모, 처가를 둔 임직원들에게도 동일한 격려 물품을 순차적으로 발송 중이다. 일부 직원들은 직접 방문이 어려운 대신 마음을 담은 손편지를 함께 부치기도 했다.아울러 코로나 확진 후 치료 중인 임직원들과 교대가 이루어지지 않아 장기간 해외 체류 중인 출장자들의 가족에도 격려물품을 전달할 계획이다. 이재용() 삼성전자 부회장은 “모두가 힘을 모으면 반드시 이겨낼 수 있다”며 “각자의 자리에서 최선을 다해 활짝 웃으며 마주하자”고 말했다.권민지 기자 10000g@kmib.co.krGoodNews paper ⓒ , 무단전재 및 재배포금지",/news/news_read.nhn?article_id=0001298532&office_id=005&mode=search&query=삼성물산&page=2
,"12일 코스피가 4% 가까이 폭락하며 마감했다. 세계보건기구(WHO)가 신종 코로나바이러스 감염증(코로나 19) 세계적 대유행(팬데믹)을 선언한 뒤 첫 거래일이다.


이날 코스피는 전일보다 73.94포인트(3.87%) 떨어진 1834.33에 거래를 마쳤다.



장이 열릴 땐 전일보다 20.30포인트(1.06%)낮은 1887.97에서 시작했지만 오후 들어 추락세가 거세졌다. 오후 1시 4분에는 전일보다 99.37포인트(5.21%) 낮은 1808.90까지 떨어졌고 한국거래소는 매매 호가를 효력정지시키는 사이드카를 발동했다. 유가증권시장에서 사이드카가 발동된 것은 8년 5개월만이다.



이후 소폭 오른 지수로 장이 마감되긴 했지만, 장중 한때 1808.56까지 떨어지며 1800선마저 무너지는 것이 아니냐는 우려가 나오기도 했다.


하루동안 코스피 시장에서 외국인이 순매도한 금액은 8952억원어치다. 개인과 기관은 각각 5361억원과 2854억원어치 순매수했다.


시가총액 상위 종목들도 맥을 못추고 일제히 하락했다. 삼성전자는 전일보다 1300원(2.50%)내린 5만800원에 거래를 마쳤다. SK하이닉스(3.16%), 네이버(2.06%), LG화학(6.44%), 현대차(5.00%), 삼성물산(4.14%), LG생활건강(4.76%)의 주가도 모두 내렸다.


코스닥은 전날 내준 600선을 회복하지 못했다. 전날보다 32.11포인트(5.39%) 내린 563.50으로 장을 마쳤다. 외국인이 1482억원을 순매수했고, 개인과 기관이 697억원과 863억원 순매도했다.


이날 서울 외환시장에서 원화가치는 지난해 8월 이후 가장 큰 하락폭을 기록했다. 원화가치가 전날보다 13.5원 떨어져(환율은 상승) 달러당 1206.5원으로 거래를 마감했다.


문현경 기자 moon.hk@joongang.co.kr
▶ ▶
/ ⓒ중앙일보(https://joongang.co.kr), 무단 전재 및 재배포 금지",/news/news_read.nhn?article_id=0002983491&office_id=025&mode=search&query=삼성물산&page=1
▶ 네이버 홈에서 [한국경제TV] 채널 구독하기 [생방송보기]▶ 대한민국 재테크 총집결! - [증권 / 주식상담 / 부동산],"[한국경제TV 신재근 기자]코스피가 이틀 연속 크게 하락했다.12일 코스피는 전 거래일 대비 73.94포인트(-3.87%) 내린 1,834.33에 거래를 마쳤다.종가 기준으로 지수가 1,900선이 깨진 것은 지난 2016년 2월 17일(1,883.94) 이후 약 4년 만이다.이날 시장은 장 출발 전 선물·옵션 동시 만기와 간밤 WHO의 코로나19 팬데믹 선언을 주목했다.지수는 이날 시작과 함께 1,900선이 깨졌다.이어 오전 10시 트럼프 미국 대통령의 기자회견 이후 낙폭은 급격히 확대됐고, 코스피 시장에서 사이드카가 발동됐다.코스피에서 사이드카가 발동된 것은 지난 2011년 10월 4일 이후 8년 5개월 만이다노동길 NH투자증권 연구원은 이날 ""KOSPI 급락과 사이드카 발동은 트럼프 대통령 성명 실망감에 따른 주요 아시아 주식시장 하락 여파 및 개인 신용 매물 출회 우려, 선물옵션 동시 만기 변동성 등 국내 수급 절벽 요인이 복합적으로 작용한 탓""이라고 분석했다.수급 주체별로는 이날도 코스피 하락은 외국인이 주도했다.외국인은 코스피에서 전자·전기(-5,528억원) 업종을 중심으로 8,972억원을 순매도했다.반면, 개인(5,370억원)과 기관(2,845억원)은 순매수를 기록했다.장 막판 금융투자의 매수세가 커졌던 것이 이날 기관 수급의 특징이었다.코스피 시가총액 상위 10개 종목은 모두 하락했다.삼성전자(-2.50%)와 SK하이닉스(-3.16%), NAVER(-2.06%), LG화학(-6.44%), 현대차(-5.00%), 삼성SDI(-3.11%), 삼성물산(-4.14%), LG생활건강(-4.76%)이 약세인 가운데 삼성바이오로직스(-0.21%)와 셀트리온(-1.43%)도 하락했다.코스닥은 5% 넘게 떨어졌다.이날 코스닥지수는 전장보다 32.12포인트(-5.39%) 내린 563.49에 장을 마쳤다.코스피와 달리 외국인이 1,482억원을 순매수했지만 개인(-687억원)과 기관(-872억원)이 매도 우위를 보였다.업종별로는 코스닥 모든 업종이 하락했다.특히 IT종합(-6.24%)과 제조(-4.90%) 업종의 낙폭이 컸다.코스닥 시총 상위 10개 종목 가운데선 에이치엘비(2.65%)만 상승 마감했다.나머지 셀트리온헬스케어(-0.30%)와 CJ ENM(-7.05%), 펄어비스(-5.07%), 스튜디오드래곤(-5.94%), 케이엠더블유(-6.77%), 에코프로비엠(-0.38%), SK머티리얼즈(-5.68%), 씨젠(-4.24%), 휴젤(-5.85%)은 하락했다.원/달러 환율은 크게 뛰어 다시 달러당 1,200원을 돌파했다.이날 서울 외환시장에서 미국 달러화에 대한 원화 환율은 전날보다 13.5원 오른 달러당 1,206.5원에 종가가 결정됐다.신재근기자 jkluv@wowtv.co.krⓒ 한국경제TV, 무단 전재 및 재배포 금지",/news/news_read.nhn?article_id=0000855065&office_id=215&mode=search&query=삼성물산&page=1
"1,830대로 급락···코스닥 지수도 5.4% 떨어져","[서울경제] 신종코로나 바이러스 감염증(코로나19) 팬데믹(세계적 대유행) 충격에 12일 코스피가 3.9% 폭락했다. 증시는 장중 한때 1,810선이 무너지며 유가증권시장에서는 8년 5개월 만에 ‘사이드카’가 발동되기도 했다. 이날 코스피는 전 거래일보다 73.94포인트(3.87%) 떨어진 1,834.33에 거래를 마쳤다. 지수는 전장보다 20.30포인트(1.06%) 내린 1,887.97에서 출발해 낙폭을 키웠다. 오후 1시 무렵에는 장중 낙폭이 5%를 넘으면서 1,808.56까지 떨어지기도 했고 장중 한때 프로그램 매도 호가의 효력을 일시 중단시키는 ‘사이드카’가 발동되기도 했다. 사이드카란 시장 상황이 급변할 경우 프로그램 매매 호가를 일시적으로 제한하는 제도다. 유가증권시장에 사이드카가 발동된 것은 2011년 10월 4일 이후 약 8년 5개월 만이다.유가증권시장에서는 개인이 5,360억원, 기관이 2,853억원을 사들였으나, 외국인이 8,966억원을 순매도했다. 시가총액 상위종목중에는 삼성전자(-2.50%)와 SK하이닉스(-3.16%), 삼성바이오로직스(-0.21%),
네이버(-2.06%), LG화학(-6.44%), 셀트리온(-1.43%), 현대차(-5.00%), 삼성SDI(-3.11%), 삼성물산(-4.14%) 등 전부 다 하락세를 보였다. 코스닥지수는 전장보다 32.12포인트(5.39%) 내린 563.49로 마감했다.지수는 전장보다 6.41포인트(1.08%) 내린 589.20으로 개장해 우하향 곡선을 그렸다.코스닥시장에서는 외국인이 1,482억원을 순매수했으나, 개인과 외국인이 각각 697억원, 863억원을 순매도했다.시가총액 상위종목 중에는 에이치엘비(2.65%)만 상승했고, 셀트리온헬스케어(-0.31%)와 CJ ENM(-7.05%), 펄어비스(-5.07%), 스튜디오드래곤(-5.94%) 등 대부분이 내렸다. 한편, 서울 외환시장에서 이날 원·달러 환율은 전일 대비 13.5원 오른 1,206.5원으로 마감했다. /양사록기자 sarok@sedaily.com저작권자 ⓒ 서울경제, 무단 전재 및 재배포 금지",/news/news_read.nhn?article_id=0003708777&office_id=011&mode=search&query=삼성물산&page=1
코스피 장중 1810선 무너져…사이드카 발동,"[더팩트ㅣ박경현 기자] 국내 증시가 큰 폭으로 하락했다. 유가증권시장에서는 장중 한 때 지수가 1810선 밑으로 밀려났다. 선물 시장에서는 5% 이상 급락세가 1분간 지속돼 사이드카가 발동됐다. 이날 발표된 WHO(세계보건기구)의 코로나19 팬데믹(세계적 대유행) 선언에 트럼프 미국 대통령의 연설 실망감이 악재로 겹쳐 낙폭을 확대한 것으로 보인다.12일 코스피는 1890선에서 출발해 갈 수록 낙폭을 키우다 전장 대비 73.94포인트(-3.87%) 내린 1834.33에 마감했다. 이날 오후 1시 4분에는 지난 2011년 10월 이후 약 9년 만에 사이드카가 발동 돼 1800선 이하 하락을 막았다.외국인의 강한 매도세가 연일 이어지는 가운데 이날 외국인이 8955억 원을 팔아치우며 하락장을 주도했다. 개인과 기관은 각각 5370억 원, 2844억 원을 사들였다.시가총액별 시세는 상위 10개 종목이 모두 내렸다.특히 삼성전자 주가는 장중 5만 원선이 깨졌다가 전일대비 2.50% 하락한 5만800원에 마감했다. 뒤이어 SK하이닉스(-3.16%), 삼성전자우(-2.82%), 삼성바이오로직스(-0.21%), 네이버(-2.06%), LG화학(-6.44%), 셀트리온(-1.43%), 현대차(-5.00%), 삼성SDI(-3.11%), 삼성물산(-4.14%)이 줄줄이 하락세로 장을 마쳤다.이날 업종은 모든 업종이 내렸다. 특히 문구류(-8.87%), 창업투자(-8.20%), 건강관리기술(-7.93%), 독립전력생산 및 에너지거래(-7.58%), 레저용장비와 제품(-7.50%)이 급락한 가운데 전 업종이 2~9%가량 하락했다.코스닥 시장 역시 우하향 곡선을 그리며 약세장으로 마감했다.12일 코스닥은 장 후반으로 갈 수록 낙폭을 키우며 전 거래일 대비 32.12포인트(-5.39%) 하락한 563.49에 거래를 마감했다.코스닥 시장에서는 개인과 기관이 각각 687억 원, 872억 원을 매도한 가운데 외국인 홀로 1463억 원을 사들였다.이날 코스닥시장 시가총액 상위 10개 종목에서는 에이치엘비(+2.65%)만 상승했다.셀트리온헬스케어(-0.30%)와 CJ ENM(-7.05%), 펄어비스(-5.07%), 스튜디오드래곤(-5.94%), 케이엠더블유(-6.77%), 에코프로비엠(-0.38%), SK머티리얼즈(-5.68%), 씨젠(-4.24%), 휴젤(-5.85%)은 전부 내렸다.pkh@tf.co.kr저작권자 ⓒ 특종에 강한 더팩트 & tf.co.kr 무단 전재 및 재배포 금지",/news/news_read.nhn?article_id=0000018746&office_id=629&mode=search&query=삼성물산&page=1
[시황종합]코스피 한때 1810선 밑으로…3.87%하락 1834.33 마감 코스닥 5.39% 폭락 563.49…달러/원 환율 13.5원↑ 1206.5원,"(서울=뉴스1) 전민 기자 = 12일 코스피 시장이 급락하면서 매도 사이드카가 8년5개월 만에 발동하는 등 증시가 요동쳤다. 기대를 모았던 도널드 트럼프 미국 대통령의 신종 코로나바이러스 감염증(코로나19) 대책 발표가 오히려 실망감을 안겨주면서 금융시장을 강타했다.이날 코스피 지수는 전일대비 73.94p(3.87%) 내린 1834.33로 마감했다. 이는 2015년 8월24일(1829.81) 이후 4년7개월 만에 최저치다. 20.3p(1.06%) 하락한 1887.97로 출발해 트럼프 대통령의 담화 이후 외국인의 매도 규모가 커지면서 장중 한때 1808.56까지 추락하기도 했다. 코스피 시장에서는 오후 1시43분37초를 기해 사이드카가 발동되기도 했다. 지난 2011년 10월4일 이후 약 8년5개월 만의 일이다. 코스피시장 매도 사이드카는 코스피200 선물지수가 기준가격 대비 5% 이상 하락(또는 상승)해 1분간 지속되면 프로그램 매도호가 효력을 5분간 정지시키는 주식시장 보호장치다. 코스피 시장에서 외국인은 홀로 8952억원 순매도했다. 개인과 기관은 각각 5361억원, 2854억원 순매수했다. 외국인은 지난 5일부터 6일 연속으로 총 4조5966억원을 팔았다. 반면 개인은 6거래일 연속으로 4조3293억원을 순매수했다.시가총액 상위 10개 종목도 일제히 하락했다. 삼성전자(-2.50%), SK하이닉스(-3.16%), 삼성바이오로직스(-0.21%), NAVER(-2.06%), LG화학(-6.44%), 셀트리온(-1.43%), 현대차(-5.00%), 삼성SDI(-3.11%), 삼성물산(-4.14%) 등이 내렸다. 특히 대장주 삼성전자는 3개월여 만에 장중 5만원선을 내주기도 했다.업종별로는 기계(-7.29%), 의료정밀(-6.68%), 건설업(-6.02%), 은행(-6.01%), 화학(-5.64%) 등의 낙폭이 컸다. 상승한 업종은 하나도 없었다.간밤 세계보건기구(WHO)가 신종 코로나바이러스 감염증(코로나19)에 대해 팬데믹(세계적 대유행)을 선언하면서 미국 뉴욕증시 3대 지수가 4~5%대 급락했다.트럼프 대통령은 우리 시각으로 이날 오전 10시 코로나19 사태와 관련한 담화에서 유럽에서 미국으로의 입국을 13일부터 한달간 금지하겠다고 밝혔다. 또한 피해 중소업체 저금리 대출, 환자와 치료 종사자를 위한 긴급 금융지원 등을 담았다.그러나 트럼프 대통령 발언 이후 국내외 시장은 오히려 하락 폭이 커졌다. 유럽발 입국 금지가 주요 내용인데다 경기부양책과 관련해선 별다른 내용이 없었다는 실망감이 반영됐다. 담화 이전 1%대 하락세였던 뉴욕 3대지수의 시간 외 선물은 일제히 4%대까지 낙폭을 키웠다. 코스피 지수도 이에 동반 하락했다.노동길 NH투자증권 연구원은 ""이날 코스피 급락과 사이드카 발동은 트럼프 대통령 성명 실망감에 따른 주요 아시아 주식시장 하락 여파와 개인 신용매물 출회 우려, 선물옵션 동시 만기 변동성 등 국내 수급 절벽 요인이 복합적으로 작용한 탓""이라고 설명했다.코스닥 지수는 전일대비 32.12p(5.39%) 폭락한 563.49으로 마감했다. 6.41p(1.08%) 내린 589.20로 출발해 개인과 기관의 순매도에 낙폭이 커졌다. 이날 코스닥 시장의 낙폭과 하락률은 지난해 8월5일 이후 약 7개월 만에 가장 큰 수준이다.코스닥 시장에서 개인과 기관은 각각 693억원, 867억원 순매도했다. 외국인은 1463억원 순매수했다.시가총액 상위 10개 종목 중에서는 셀트리온헬스케어(-0.30%), CJ ENM(-7.05%), 펄어비스(-5.07%), 스튜디오드래곤(-5.94%), 케이엠더블유(-6.77%), 에코프로비엠(-0.38%), SK머티리얼즈(-5.68%), 씨젠(-4.24%), 휴젤(-5.85%) 등이 하락했다. 에이치엘비(2.65%)만 상승했다.안전자산의 등락은 엇갈렸다. 서울외환시장에서 달러/원 환율은 13.5원 오른 1206.5원에 마감했다. 이날 2.3원 내린 1190.7원에 거래를 시작했지만 트럼프 대통령의 담화 이후 상승 전환해 고점을 높였다. 이틀 만에 다시 1200원대로 올라섰다.KRX금시장에서 1kg짜리 금 현물의 1g당 가격은 전거래일 대비 400원(0.63%) 내린 6만3410원에 거래를 마쳤다.국고채 금리는 단기물과 장기물의 등락이 갈렸다. 채권시장에서 3년 만기 국고채 금리는 2.9bp(1bp=0.01%) 내린 연 1.064%에 거래 중이다. 5년물 금리도 1.187%로 1.1bp 하락세다. 반면 10년물은 1.4bp 오른 1.386%, 20년물은 1.8bp 상승한 1.437%를 기록 중이다.min785@news1.kr© 뉴스1코리아(), 무단 전재 및 재배포 금지",/news/news_read.nhn?article_id=0004519307&office_id=421&mode=search&query=삼성물산&page=1
"라주영 대표 ""태안 앞바다 기름 유출 때 도와주신 마음, 잊지 않고 보답""","태안의 수산물 전문업체 '맛수러움'이 코로나바이러스감염증-19(코로나19)로 사회적 거리두기에 동참 중인 대구경북민을 선정해 우럭매운탕 100개를 기부하고 나섰다.12일 맛수러움과 페이스북 '실시간대구' 등에 따르면 맛수러움은 대구경북민의 고통을 위로하고자 지난달 말부터 반조리 우럭매운탕 포장제품 기부 행사를 시작했다.기부 대상은 대구와 경북에 주소지를 둔 지역민 100명이다. 배송비까지 130만원 이상 들였다.맛수러움 측은 과거 '삼성1호-허베이 스피릿 호 원유 유출 사고', 이른바 태안 기름 유출 사고 때 대구경북 등 전국에서 이어진 온정에 보답하려 이번 행사를 마련했다.지난 2007년 12월 7일 충남 태안 앞바다에서 홍콩 유조선 '허베이 스피릿 호'와 삼성물산 '삼성 1호'가 충돌, 유조선 탱크에 있던 원유 1만2천㎘(7만8천918 배럴)가 해역에 새 나왔다.당시 전국 자원봉사자 200만 명이 삽과 흡착포, 헌 옷 등으로 오염된 해안가 기름 제거를 도왔다. 당초 회복까지 수십년이 예상됐으나, 국민 도움 덕에 사고 10년 만인 2017년에는 생태계가 대체로 원상회복됐다.라주영 맛수러움 대표는 당시 고등학생이었다. 그는 우럭 양식업을 하던 아버지가 2년여 만에 어렵게 사업을 회복했다고 설명했다.라 대표는 ""수많은 자원봉사자의 '기적' 덕에 태안 주민들이 우려보다 일찍 회복하는 모습을 보고 크게 감동했다. 이제 내가 어려움에 처한 대구경북민에게 보답해야 한다고 생각했다""고 설명했다.맛수러움은 당초 대구경북 의료진을 대상으로 이런 행사를 열려다 시민들에게로 대상을 바꿨다. 대구시·경북도에 기부 의사를 밝혔으나 ""의사들이 너무 바빠 가공식품조차도 마음편히 먹지 못하고 있다. 감사하지만 마음만 받겠다""는 답변이 돌아와서다.이날 실시간대구는 이 행사에 당첨된 대구 한 임신부 사연을 소개했다.현재 임신 초기라고 밝힌 이 시민은 ""얼마 전 인스타그램에서 코로나 때문에 대구분들 힘내시라고 무료로 우럭 매운탕거리를 보내주신다기에 '설마'하며 댓글을 달았다""고 말했다.그는 ""며칠이 지나 (업체에서) '오는 10일쯤 매운탕을 받아보실 수 있을 것'이라고 친절히 문자도 보내주시고, 오늘(10일) 우럭매운탕이 집으로 도착했다. 가게 사장님께 너무 고맙다""고 말했다.라 대표는 ""대구경북 시민들이 사회적 거리두기에 동참하며 외출마저 자제 중이라고 알고 있다. 집에서라도 따뜻하고 맛있는 음식을 드시고, 함께 힘내서 이 위기를 극복하셨으면 한다""고 전했다.홍준헌 기자 hjh@imaeil.comⓒ매일신문 - www.imaeil.com",/news/news_read.nhn?article_id=0000638204&office_id=088&mode=search&query=삼성물산&page=1
