head,text,url
,"삼성물산 건설부문 아파트 브랜드‘래미안’이 한국 산업의 브랜드파워 아파트 부문 19년 연속 1위를 지켰다.삼성물산은 2일 ‘래미안’이 한국능률협회컨설팅이 주관하는 ‘2020년 한국산업의 브랜드파워(K-BPI)’ 조사에서 아파트 부문 19년 연속 1위 자리에 올라 10년 연속 해당 업종 1위를 지킨 기업에 주는 ‘K-BPI 골든 브랜드’로 등극했다고 밝혔다.삼성물산은 래미안 브랜드가 지난 2000년 ‘자부심(Pride)’이라는 브랜드 철학을 바탕으로 론칭한 이후 한국 주택 업계의 패러다임 변화를 이끌어 온 것이 한국산업 브랜드 파워 19년 연속 1위의 배경이라고 설명했다. 혁신적인 상품 개발과 선도적인 주거 서비스, 고객과 소통을 강조하는 새로운 마케팅 활동이 ‘최초의 브랜드, 최고의 브랜드’로서 명성을 이어온 토대라고 강조했다.삼성물산은 래미안 브랜드가 고객에게 차별화된 경험을 제공하도록 다양한 상품도 개발하고 있다. 손목 착용형 아파트 출입시스템인 ‘웨어러블 원패스(Wearable One Pass)’, 사물인터넷(IoT) 기술과 주거 시스템을 결합한 ‘래미안 IoT 플랫폼’을 자체 개발, 주거시설에 도입했다. 또 브랜드 홍보관인 서울 송파구 래미안 갤러리 등에서 ‘래미안 클라스’ 등 부동산 포럼을 개최하고, 부산에서는 조깅하며 쓰레기를 줍는 공익 활동인 ‘래미안 플로깅(Plogging) 데이’ 행사도 진행했다. 김순환 기자 soon@munhwa.com[Copyrightⓒmunhwa.com '대한민국 오후를 여는 유일석간 문화일보' 무단 전재 및 재배포 금지()]",/news/news_read.nhn?article_id=0002423198&office_id=021&mode=search&query=삼성물산&page=1
올 여름 평년과 비슷하거나 높을 전망…사물인터넷 설비 효과↑,"[아이뉴스24 김서온 기자] 이른 더위가 예상되는 올해 관리비를 줄일 수 있는 에너지 절감형 아파트가 주목 받고 있다. 최근 건설사에서 도입하고 있는 사물인터넷(IoT) 설비나 건축물 에너지효율 1등급 인증 등을 적용한 신규 아파트는 관리비 절감 효과가 뛰어나다.2일 기상청이 올해 2월 발표한 '2020년 여름철 기후전망' 자료에 따르면 올해 여름 기온은 평년과 비슷하거나 높을 전망이다. 최근 낮 최고 기온이 22도까지 오르는 등 이른 더위가 시작될 것으로 보이면서 선풍기나 에어컨 등 냉방기기를 많이 사용하는 여름철 관리비에 대한 부담도 커지고 있다.실제 아파트 관리비는 꾸준히 상승하는 추세다. 공동주택관리정보시스템(K-apt) 자료를 보면 지난해 전국 공동주택 평균 관리비는 1㎡당 2천248원이다. 5년 전인 지난 2014년 평균 관리비 2천67원보다 약 8.76% 올랐다.건설업계에서도 입주민들의 관리비 부담을 덜 수 있는 에너지 절감형 설계 도입에 적극 나서고 있다. 실시간으로 에너지 사용량을 확인할 수 있는 사물인터넷(IoT) 설비가 대표적이다. 스마트폰 앱을 통해 외출 시에도 난방·가스, 전자제품 등을 모니터링하고 제어할 수 있다. 최근에는 에너지효율등급 1등급을 인증 받거나 LED 조명, 고성능 단열재 등을 적용한 단지들도 선보이고 있다.이러한 설비가 적용된 신규 단지들은 입주 10년 이상된 노후 아파트와 비교했을 때 관리비가 상대적으로 저렴하다. 경기도 안산시 '초지역 메이저타운 푸르지오 에코(2019년 6월 입주)'에는 푸르지오의 친환경 기술인 '그린 프리미엄'이 적용됐다. 각 세대에 전력 사용량을 확인할 수 있는 실시간 에너지모니터링 시스템, 공용부에는 엘리베이터의 이동에너지를 전기에너지로 변환하는 엘리베이터 전력회생 시스템과 물을 절약하는 친환경 물재생 시스템 등이 적용됐다. 공동주택관리정보시스템(K-apt) 자료를 보면 이 단지의 지난해 8월 관리비는 1㎡당 2천460원으로 인근에 위치한 'G(1987년 6월 입주)아파트'의 관리비 3천575원과 비교했을 때 약 45.33%나 저렴하다.올해 상반기 전국에서 관리비 절감이 가능한 신규 단지들이 분양을 앞두고 있다.현대건설은 이달 대구 북구 고성동1가 일원에서 '힐스테이트 대구역 오페라'를 분양할 예정이다. 단지는 지하 4층~지상 48층, 8개동, 아파트 전용면적 59~101㎡ 937세대, 오피스텔 전용면적 63~67㎡ 270실 등 모두 1천207세대로 구성된다. 힐스테이트 IoT(사물인터넷) 서비스인 하이오티(Hi-oT) 기술이 적용돼 스마트폰 앱을 통해 조명, 가스, 난방, 환기 등의 빌트인기기와 IoT 가전기기를 제어할 수 있어 에너지 절감효과를 기대할 수 있다. 또한 대구오페라하우스와 대구복합스포츠타운 등 문화시설이 인근에 위치해 있어 여가활동을 즐길 수 있다. 반경 1㎞ 내에 이마트, 롯데마트, 홈플러스 등 마트 3개소가 위치해 있다.대우건설은 지난달 27일 경기도 안산시 단원구 원곡동 일원에서 원곡연립1단지 재건축 정비사업으로 분양하는 '안산 푸르지오 브리파크'의 사이버 견본주택을 개관하고 본격 분양에 나섰다. 단지는 지하 3층~지상 최대 38층, 10개동, 전용면적 49~84㎡ 1천714가구 규모로 이중 전용면적 49~84㎡ 588가구를 일반분양으로 공급한다. 한국환경건축연구원으로부터 에너지효율 1등급, 녹색건축물 우수등급 예비인증을 받은 친환경 단지로 조성된다. 또한 실별로 각방 온도를 설정해 난방비 절감에 도움을 주는 실별온도제어 시스템과 실시간 에너지모니터링 시스템 등이 적용된다.GS건설은 이달 경기도 고양시 덕양구 덕은지구 A4, 7블록에서 'DMC리버파크자이', 'DMC리버포레자이'를 분양할 예정이다. DMC 리버파크 자이(A4블록) 지하 2층~지상 24층, 6개동, 전용면적 84~99㎡ 702가구, DMC 리버포레 자이(A7블록) 지하 2층, 지상 19~24층, 5개동, 전용면적 84㎡ 317가구 규모로 조성된다. 전기·급수 사용량을 체크해 스스로 절약하는 '자이 에너지 매니저'를 비롯 전력회생형 엘리베이터, 세대 내 주방 절수페달, 고효율 LED조명 등 다양한 에너지 절약 시스템이 적용된다.같은달 삼성물산은 서울 동대문구 용두6구역 재개발 사업을 통해 '래미안 용두6구역(가칭)'을 분양한다. 단지는 지하 2층~지상 최고 21층, 16개동, 1천48가구로 이중 전용면적 51~121㎡ 477가구를 일반분양한다. 래미안만의 사물인터넷(IoT) 플랫폼 기반의 스마트홈 상품이 적용돼 에너지사용량을 확인할 수 있다. summer@inews24.com [ⓒ 아이뉴스24 무단전재 및 재배포 금지]",/news/news_read.nhn?article_id=0000532667&office_id=031&mode=search&query=삼성물산&page=1
공조업체 GC 전면취출공조 방식바닥부터 공기 밀어올려 환기,"""기존의 천장공조와 바닥공조는 신선한 공기와 실내 공기를 혼합해 천장으로 배기하는 방식으로 바이러스 전염과 확산이 빠릅니다. 바닥 전면에서 신선한 공기를 저속으로 밀어 올리는 전면취출공조 방식으로 바꿔 가야 합니다.""김영주 GC 대표는 최근 기자와 만나 기존 공조 방식의 문제점을 조목조목 지적하며 이같이 말했다.건물 공조 방식은 기존에는 천장이나 바닥에서 공급되는 신선한 공기와 실내 공기를 빠른 속도로 혼합해 천장으로 배기하는 방식을 택했다. 이처럼 공기를 혼합해 환기하는 교반 공조 방식은 실내 근무자 중 바이러스 감염자가 있다면 주변으로의 바이러스 전염과 확산이 매우 빠르다.반면 전면취출공조는 바닥 전면에 깔려 있는 공조용 통기성 패널의 미세한 구멍에서 신선한 공기가 저속(0.02㎧)으로 밀어 올려지고, 실내 오염 공기와 혼합되지 않은 채 상승해 천장으로 배기된다. 공기 흐름이 밑에서 위로 일정하게 흐르는 만큼 바이러스가 옆으로 확산되는 것을 줄여준다.김 대표는 ""전면취출공조는 치환 방식으로, 기류 흐름이 반도체 클린룸에 적용되는 공조 방식과 동일하다""면서 ""천장 공조 대비 먼지 입자 수를 40%가량 감소시킬 수 있다""고 설명했다.치환 방식의 전면취출공조는 일본 시미즈건설 기술연구소에서 개발한 차세대 100대 기술 중 하나다. GC에 따르면 시미즈 본사에서 지난해 2월 전면취출공조를 적용한 실내의 초미세먼지를 측정한 결과, PM 0.5(0.5㎛) 기준 먼지 입자 수는 약 5만4000개로 측정됐다. 이 같은 효과를 인정받아 도요타 사옥, 올림푸스, 닛케이 사옥, 도쿄·오사카 유비쿼터스 콜센터 등에서 전면취출공조를 적용 중이다. 2010년 설립된 GC는 시미즈건설에서 기술을 이전받아 국산화에 성공했으며, 전면취출공조 독자 기술력을 확보했다. 전면취출공조는 바닥 공조의 바닥 취출구와 천장 공조의 천장 덕트가 필요 없어 300㎜가량 천장고를 높이는 효과가 있고, 건축비도 줄일 수 있다. 기존 바닥 공조가 적용된 건물은 공조설비 교체 없이 전면취출공조로 변경 가능하다.최근 국내에서도 건물 내 공조 방식의 중요성을 인식한 삼성물산이 2018년 서울 강동구 상일동 사옥 일부에 전면바닥취출공조 방식을 적용했다. 당시 GC는 공사를 맡아 성공적으로 완료했다.김 대표는 ""현재 삼성물산은 신축 공사 중인 판교 알파돔 6-1 블록에 입주자 안전과 실내 환경을 고려해 전면취출공조 제안을 적극 검토하고 있다""면서 ""공기질 향상, 바이러스 확산 예방, 미세먼지 저감, 온도 분포 균일 등 업무용 건축물에 적합한 전면취출공조 방식으로의 전환이 적극 요구된다""고 강조했다.[안병준 기자] [ⓒ 매일경제 & mk.co.kr, 무단전재 및 재배포 금지]",/news/news_read.nhn?article_id=0004549584&office_id=009&mode=search&query=삼성물산&page=1
"전날보다 2.34% 오른 1724.86p트럼프 ""유가전쟁 끝날 것"" 발언에 정유株 급등","[이데일리 전재욱 기자] 2일 코스피 지수는 상승 마감했다. 증권가에서는 증시안정 펀드가 본격적으로 투입되면서 수급이 개선된 점이 지수에 유리하게 반영된 것으로 봤다. 위험자산 ‘원유’의 가격이 반등하리라는 기대감도 주가에 영향을 준 것으로 풀이된다.2일 코스피지수 흐름(자료:신한hts)마켓포인트에 따르면 이날 코스피 지수는 전 거래일보다 2.34%(39.40포인트) 오른 1724.86포인트로 거래를 마쳤다. 상승 출발한 지수는 오전 장에서 1670선이 깨지며 하락했지만 반등에 성공했다. 종가를 기준으로 하루만에 다시 1700선을 회복한 것이다. 최유준 신한금융투자 연구원은 “기관에서 저점에서 매수하려는 자금이 유입하면서 지수를 끌어올리는 것으로 보인다”며 “개중에 증권시장 안정펀드 자금이 유입되는 흐름도 감지되는데, 지수에 긍정적인 영향을 준 것으로 보인다”고 말했다.박석현 ktb투자증권 팀장은 “코스피 수급에서 개인이 매수 주체로서 우위를 차지하고 있다 보니, 지수가 오전과 오후 뉴스에 민감하게 반응한 듯하다”며 “이런 수급 상황에서 지수 변동성은 당분간 커질 수 있다”고 말했다.수급을 보면 개인이 2732억원을 기관이 3151억원을 순매수한 가운데 외국인이 5763억원을 순매도했다. 개인은 7거래일 연속으로 주식을 샀고, 외국인은 21거래일 연속 주식을 팔았다. 기관 가운데 연기금이 1674억원을, 금융투자가 880억원을, 투신이 396억원을, 보험이 187억원을 각각 샀다.프로그램은 차익이 362억원 순매수, 비차익이 2531억원 순매도를 각각 기록해 2169억원 매도 우위였다.업종을 보면 보험과 건설업이 6.9%와 6.7% 각각 올랐고 통신업과 서비스업도 4% 대에서 올랐다. 화학 3.9%를 비롯해 금융업, 종이·목재, 음식료품, 철강 및 금속, 증권, 전기전자, 제조업이 2% 대에서 상승했다. 반면에 운수·창고가 1.5%, 기계가 0.2% 각각 내렸다.시가총액 상위 10종목은 상승이 많았다. 네이버(035420)가 6.4% 상승한 것을 비롯해 삼성전자(005930) 2.1%, SK하이닉스(000660) 2%, 삼성전자우(005935) 1%, 삼성바이오로직스(207940) 2.6%, 현대차(005380) 1.4%, LG생활건강(051900) 5.9%, 삼성물산(028260) 0.8% 각각 올랐다. 반대로 셀트리온(068270)과 LG화학(051910)은 1.5%와 0.3% 각각 내렸다.종목을 보면 정유업체 주가가 급등했다. 극동유화(014530) 23.4%, S-OIL(010950) 20%, 한국석유(004090) 19.9% 각각 올랐다. 외신은 도널드 트럼프 미국 대통령이 1일 기자회견에서 “수일 내로 유가 전쟁을 끝내는 데 합의할 것”이라고 발언했다고 전했다. 이로써 원유가격이 상승할 것이라는 기대가 커지면서 정유주 주가가 반응한 것으로 풀이된다.이날 거래량은 7억5229만주, 거래대금은 9조5492억원이다. 상한가 2종목을 포함해 706종목이 올랐고, 하한가 없이 154종목이 내렸다. 40종목은 보합이었다.전재욱 (imfew@edaily.co.kr)＜ⓒ종합 경제정보 미디어 이데일리 - 무단전재 & 재배포 금지＞",/news/news_read.nhn?article_id=0004611827&office_id=018&mode=search&query=삼성물산&page=1
,"코스피가 개인과 기관의 매수에 힘입어 1700선을 회복했다.2일 코스피는 전일대비 39.40%(2.34%) 오른 1724.86에 장을 마쳤다.이날 8.07포인트 오른 1693.53에 출발한 지수는 장초반 약세를 보이다 오후께 기관이 순매수 전환하고 개인이 물량을 사들이면서 우상향 곡선을 그렸다. 특히 개인 투자자는 이날까지 7거래일 연속 순매수 행렬을 이어갔다.신종 코로나바이러스 감염증(코로나19) 확진자가 미국에서 급증하고 이탈리아에 이어 독일, 프랑스 스페인 등으로 사태가 확산되면서 글로벌 증시는 흔들렸으나 국내 증시는 다소 선방하고 있는 셈이다.조연주 NH투자증권 연구원은 "" 미국 정부의 속도감 있는 정책 시행과 대규모 강도에도 불구하고 코로나19에 따른 경기 블랙아웃 피해도 빠르게 나타나고 연준의 기업 지원책이 실제 시행까지 1~2주가 걸릴 것이라는 보도에 기업들이 버틸 수 있을 지에 대한 의구심 확대되는 상황""이라며 ""당분간 변동성 장세 속에서 바이러스 불안감과 정책 안도감 사이에서 균형점을 찾아가는 과정이 지속될 것""이라고 분석했다.이날 유가증권시장에서는 대부분 업종이 상승했다. 보험과 건설업이 6% 이상 급등했고, 통신업, 서비스업, 화학, 종이·목재, 음식료품, 철강·금속, 증권, 전기·전자, 제조업, 섬유·의복, 유통업, 운송장비, 비금속광물 등이 올랐다. 매매주체별로 개인과 기관이 각각 2723억원, 3155억원 순매수했고, 외국인은 5764억원 순매도 했다. 프로그램 매매는 2171억원 매도 우위였다.시가총액 상위 종목 가운데 셀트리온과 LG화학은 제외한 전 종목이 올랐다. NAVER와 LG생활건강이 6% 이내 상승했고, 삼성전자, SK하이닉스, 삼성바이오로직스, 현대차, 삼성물산 등이 연이어 강세였다.이날 유가증권시장에서는 986개 종목이 올랐고 266개 종목이 하락했다.코스닥은 전일 대비 15.86포인트(2.87%) 오른 567.70에 거래를 끝냈다.[디지털뉴스국 김규리 기자] [ⓒ 매일경제 & mk.co.kr, 무단전재 및 재배포 금지]",/news/news_read.nhn?article_id=0004549619&office_id=009&mode=search&query=삼성물산&page=1
"코스피, 하루만에 1,700선 탈환개인·기관 동반 순매수외국인은 21거래일 연속 순매도코스닥도 2%대 반등","[한국경제TV 신재근 기자]코스피가 하루 만에 상승 반전했다.2일 코스피는 전 거래일 대비 39.40포인트(2.34%) 오른 1,724.86에 거래를 마쳤다.이날 지수는 코로나19 우려가 여전한 가운데 장 초반 1,660선까지 밀렸다.그러나 유동성 공급 기대감이 지수를 반전시켰다는 평가가 나온다.이경민 대신증권 연구원은 ""한국은행의 무제한 RP(환매조건부채권) 매입을 통한 유동성 공급 발표 이후 외국인의 선물 매수폭이 확대됐다""고 말했다.실제 외국인은 선물시장에서 4,148억원어치를 순매수했다.그럼에도 외국인의 현물 매도는 여전했다.외국인은 코스피에서 의약품(-2,192억원) 업종을 중심으로 5,762억원을 순매도했다.이로써 외국인은 21거래일 연속 순매도 행진을 이어가게 됐다.개인(2,732억원)과 기관(3,151억원)은 동반 순매수했다.업종별로는 통신(4.48%)과 건설(6.74%), 화학(3.92%) 업종이 강세를 보였다.코스피 시가총액 상위 10개 종목에선 셀트리온(-1.52%)과 LG화학(-0.34%)을 제외하고 모두 올랐다.삼성전자(2.18%)와 SK하이닉스(2.04%), 삼성바이오로직스(2.65%)가 2% 넘게 올랐고 외국인이 많이 산 NAVER(6.44%)와 LG생활건강(5.98%)은 강세를 기록했다.이어 현대차(1.41%)와 삼성물산(0.82%), 삼성SDI(0.87%)도 상승 마감했다.셀트리온은 블록딜(시간외대량매매) 소식에 장 초반 약세를 보이다 낙폭을 줄였다.코스닥도 2% 넘게 올랐다.이날 코스닥지수는 전장보다 15.86포인트(2.87%) 오른 567.70에 장을 마쳤다.코스피와 마찬가지로 외국인(-733억원)이 순매도를 한 가운데 개인(71억원)과 기관(793억원)이 지수를 떠받쳤다.코스닥에선 IT(3.68%)와 화학(3.75%), 기계·장비(4.15%) 업종 등이 강세를 나타냈다.코스닥 시총 상위 종목 가운데선 셀트리온헬스케어(2.03%)와 셀트리온제약(4.89%)이 블록딜에도 불구하고 상승 마감했다.이어 에이치엘비(7.52%)와 펄어비스(7.52%), 스튜디오드래곤(4.47%), 케이엠더블유(4.38%), CJ ENM(2.24%), 코미팜(5.21%), 헬릭스미스(3.88%) 등도 올랐다.반면 씨젠(-4.44%)은 하락 마감해 3일 연속 떨어졌다.원/달러 환율은 변동폭이 큰 하루였다.서울 외환시장에서 원/달러 환율은 전날보다 2.2원 내린 달러당 1,228.3원에 종가가 결정됐다.장중 한때 환율은 1,240원 선까지 치솟기도 했었다.신재근기자 jkluv@wowtv.co.krⓒ 한국경제TV, 무단 전재 및 재배포 금지",/news/news_read.nhn?article_id=0000861338&office_id=215&mode=search&query=삼성물산&page=1
,"[서울=뉴시스] 류병화 기자 = 코스피가 기관의 막판 매수세에 힘입어 상승 마감했다. 지수는 1720선을 회복했다. 2일 코스피지수는 전 거래일(1685.46)보다 39.40포인트(2.34%) 오른 1724.86에 마감했다. 지수는 8.07포인트(0.48%) 오른 1693.53에 출발해 장 막판 상승 폭을 늘리며 거래를 마쳤다.유가증권시장에서 외국인은 홀로 5763억원어치를 팔아치웠다. 반면 기관과 개인은 각각 3138억원, 2741억원을 순매수했다. 특히 기관은 오후 들어 순매수세를 늘리며 막판 상승을 이끌었다.업종별로는 운수창고(-1.54%), 기계(-0.2%)를 제외하고 모두 상승했다. 보험(6.9%), 건설업(6.74%), 통신업(4.48%), 서비스업(4.2%), 화학(3.92%), 금융업(2.49%) 등은 크게 올랐다.시가총액 상위 종목들은 대체로 올랐다. 대장주 삼성전자는 전 거래일 대비 1000원(2.18%) 오른 4만6800원에 거래를 마쳤다.SK하이닉스(2.04%), 삼성바이오로직스(2.65%), 네이버(6.44%), 현대차(1.41%), LG생활건강(5.98%), 삼성물산(0.92%) 등은 상승했다. 셀트리온과 LG화학은 각각 1.52%, 0.34% 하락했다.코스닥지수는 전 거래일(551.84)보다 15.86포인트(2.87%) 오른 567.70에 마감했다. 지수는 3.56포인트(0.65%) 오른 555.40에 출발해 상승 폭을 늘리며 장 마감했다. 코스닥시장에서 외국인은 홀로 733억원어치를 팔아치웠다. 기관과 개인은 각각 794억원, 70억원을 순매수했다.코스닥 시총 상위 10개 종목은 씨젠(-4.44%)을 제외하고 모두 강세로 장을 마쳤다. 셀트리온헬스케어(2.03%), 에이치엘비(5.71%), 펄어비스(7.52%), 셀트리온제약(4.89%), 스튜디오드래곤(4.47%), 케이엠더블유(4.38%), CJ ENM(2.24%), 코미팜(5.21%), 헬릭스미스(3.88%) 등이 올랐다.노동길 NH투자증권 연구원은 ""미국 주식시장은 코로나19 확산 가속화에 밤사이 변동성 확대를 겪었다""며 ""위험자산 가격 추세적 회복은 영구 손실 우려를 완화시킨 이후 가능할 듯하다""고 전했다.간밤 뉴욕증시는 도널드 트럼프 미국 대통령이 전날 미국의 코로나19 확산 추세와 관련해 향후 2주가 매우 힘든 시기가 될 것으로 예측하면서 부정적인 영향을 주며 폭락으로 장을 마감했다.또 백악관 전문가들은 이날 사회적 거리두기가 실행돼도 미국에서 10만명에서 최대 24만명의 사망자가 발생할 것으로 예측하며 경각심을 불러일으켰다.뉴욕증권거래소(NYSE)에서 1일(현지시간) 우량주 위주의 다우존스30 산업평균 지수는 973.65포인트(4.44%) 하락한 2만943.51에 장을 마감했다.대형주 위주 스탠더드앤드푸어스(S&P)500 지수는 114.09포인트(4.41%) 내린 2470.50에 장을 마쳤다. 기술주 위주인 나스닥 지수는 339.52포인트(4.41%) 하락한 7360.58에 거래를 마쳤다. hwahwa@newsis.com<ⓒ 공감언론 뉴시스통신사. 무단전재-재배포 금지>",/news/news_read.nhn?article_id=0009793112&office_id=003&mode=search&query=삼성물산&page=1
▶ 헉! 소리나는 스!토리 뉴스 [헉스]▶ '아는 척'하고 싶은 당신을 위한 [두유노우]▶ 한눈에 보는 [4·15총선 NEWS MAP],"[파이낸셜뉴스] 코스피가 2일 2% 넘게 상승하면서 하루 만에 1720선을 회복했다.
 2일 코스피지수는 전날보다 39.40포인트(2.34%) 오른 1724.86에 거래를 마쳤다.
 개인은 2732억원을 기관이 3151억원을 사들였다. 외국인은 5763억원을 순매도했다. 개인은 7거래일 연속으로 주식을 샀고, 외국인은 21거래일 연속 주식을 팔았다.
 업종별로 보면 보험과 건설업이 6.9%와 6.7% 각각 올랐고 통신업과 서비스업도 4% 대에서 상승했다. 화학 3.9%를 비롯해 금융업, 종이·목재, 음식료품, 철강 및 금속, 증권, 전기전자, 제조업이 2% 대에서 상승했다. 반면 운수·창고가 1.5%, 기계가 0.2% 각각 내렸다.
 시가총액 상위별로 보면 네이버가 6.4% 상승한 것을 비롯해 삼성전자 2.1%, SK하이닉스 2%, 삼성전자우 1%, 삼성바이오로직스 2.6%, 현대차 1.4%, LG생활건강 5.9%, 삼성물산 0.8% 올랐다. 반대로 셀트리온과 LG화학은 1.5%와 0.3% 각각 내렸다.
 코스닥지수는 장 후반 상승폭을 확대하며 전일 대비 15.86포인트(2.87%) 상승한 567.70으로 거래를 마쳤다.



 ※ 저작권자 ⓒ 파이낸셜뉴스. 무단 전재-재배포 금지",/news/news_read.nhn?article_id=0004401593&office_id=014&mode=search&query=삼성물산&page=1
