head,text,url
,"상반기 도시정비사업 수주 실적에 건설업계의 관심이 쏠리고 있다. 현대건설과 현대엔지니어링 등 ‘현대가(家)’ 형제들이 수주금액 1조원을 넘으며 독주하는 가운데 이를 따라잡는 롯데건설과 삼성물산의 움직임이 심상치 않아서다.18일 정비업계에 따르면 현대건설은 올해 1조541억원의 정비사업 수주 실적을 기록하며 수주액 1조원을 넘어섰다. 현대엔지니어링도 최근 인천 송림1·2구역 재개발사업을 따내며 1조23억원으로 사상 첫 1조원의 수주고를 올렸다.이들을 뛰어넘을 기세로 따라붙고 있는 곳은 롯데건설이다. 현재까지 울산 중구 B-05구역·부산 범일2구역 재개발 사업을 수주해 6632억원의 수주액을 기록한 롯데건설은 이달 말 서울 갈현1구역 재개발 사업의 수의계약 방식 수주를 앞두고 있다. 공사비만 약 9200억원에 달하는 이 사업장 수주에 성공할 경우 롯데건설의 올해 정비사업 수주액은 1조5000억원을 넘기면서 단숨에 1위로 올라서게 된다.2015년 서울 서초구 신반포3차·경남아파트 재건축 수주 이후 5년 만에 귀환한 삼성물산의 움직임도 향후 건설사 간 실적 순위에 큰 영향을 미칠 것으로 예상된다. 삼성물산은 지난달 말 호반건설과 대림산업을 제치고 총 공사비가 2400억원 규모인 서울 서초구 신반포15차 재건축 사업을 따냈다. 오는 30일 시공사 선정 총회가 예정된 서울 서초구 반포주공1단지 3주구 재건축 사업까지 따낼 경우 역시 단숨에 선두권으로 올라설 수 있다. 반포주공1단지 3주구는 공사비가 8000억원이 넘는 곳이다. 삼성물산에 대우건설까지 이 사업 수주에 총력을 기울이면서 진흙탕 싸움이 벌어지고 있기도 하다. 대우건설은 지난 7일 시공권을 두고 경쟁하는 삼성물산과 신반포1차(아크로리버파크) 조합장 한형기씨를 허위사실 유포 등 혐의로 고소·고발했다. 한씨는 대우건설을 상대로 명예훼손 혐의로 맞고소하겠다고 했다. GS건설과 대림산업은 올해 각각 1곳(3287억원), 2곳(3073억원)의 정비사업 수주 만을 따내면서 비교적 초라한 성적을 보이고 있다. 하지만 두 건설사는 총 사업비만 7조원에 달하는 서울 용산구 한남3구역 재개발 사업을 따내기 위해 현대건설과 3파전을 벌이고 있다. 이 사업지는 다음달쯤 시공사 선정이 예정돼 있다.한 대형 건설사 관계자는 ""정부 규제에 신종 코로나바이러스 감염증(코로나19) 사태까지 겹치면서 시공사 선정이 미뤄진 사업장이 많다""면서 ""강남과 강북을 가리지 않고 공사 규모가 큰 사업지들이 있어서 대형 건설사들의 수주 경쟁은 더 치열해질 것""이라고 말했다. [김민정 기자 mjkim@chosunbiz.com]	[]	[] 	chosunbiz.com",/news/news_read.nhn?article_id=0000524937&office_id=366&mode=search&query=삼성물산&page=1
"홍보물 논란부터 과장홍보, 경찰출동까지…19일 합동설명회 앞두고 소송전","[아이뉴스24 김서온 기자] 서울 서초구 반포주공1단지 3주구(이하 반포3주구) 재건축 사업 수주전이 점입가경으로 치닫고 있다. 상호 간의 비방과 불법 개별홍보, 현수막 제작, 홍보관 건립 논란, 소송 등으로 얼룩져 가고 있어서다. 특히 반포3주구는 서울시가 지정한 '클린수주 시범사업장 1호'임에도 불구하고 진흙탕 싸움으로 논란이 일면서 지정 취지가 무색해졌다는 지적이다.18일 정비업계에 따르면 서울시가 '클린수주 시범사업장 1호'로 지정한 반포3주구 수주전이 과열 양상을 띄면서 지난해 입찰무효 권고를 받은 서울 한남3구역 재개발 사업의 전철을 밟고 있는 것이 아니냐는 우려가 커지고 있다.반포3주구를 둘러싸고 수주전에 참여한 삼성물산과 대우건설 두 건설사는 시작부터 첨예한 대립으로 신경전을 펼쳐왔다.갈등이 표면적으로 드러난 것은 삼성물산에서 언론에 배포한 반포3주구 보도자료에 공사기간을 경쟁사 대비 압도적으로 줄일 수 있다는 내용이 포함되면서 부터다. 당시 삼성물산은 ""공사도급계약 체결 이후 관리처분인가까지 3개월 만에 진행하고, 실제 반포3주구 재건축 공사를 34개월 이내로 마무리할 것""이라고 했다. 이에 대우건설은 즉각 반박자료를 내고 ""필수 소요기간이라는 것이 있는데, 삼성물산의 3개월 공언은 실상 불가능하다""고 저격했다.오는 20일부터 29일까지 운영하게 될 홍보관을 규정과 달리 2층 이상의 규모로 조성한다는 의혹도 제기됐다. 지난달 29일 서초구청은 반포3주구 조합에 삼성물산과 대우건설의 홍보관을 1층 정도 최소 규모로 설치하거나 반포주공아파트 회의실을 사용하라는 권고문을 발송했다.삼성물산이 홍보관 건립을 위해 콘크리트 타설을 불사하고, 2층 이상의 대규모 홍보관을 축조한다는 것이다. 이와 관련해 삼성물산은 ""서초구청에서 보낸 공문 지침에 따라 현재 1층 규모로 홍보관을 건립하고 있다""고 답변했다.조합원에게 발송하는 홍보물 수량을 두고 양사가 논쟁을 벌이다 경찰이 출동하기도 했다.대우건설 관계자는 ""홍보물을 각사가 3개씩 조합원에게 발송하기로 합의해놓고, 발송 당일 우편물을 뜯어 확인해보니 삼성물산이 홍보물 3개 더해 발송하려고 했다""며 ""이 홍보물에는 반포3주구와 관련이 없는 신반포15차 관련 내용도 포함됐다""고 말했다.신반포15차는 지난 2017년 대우건설을 시공사로 선정했지만 설계 변경에 따른 공사비 증액을 두고 갈등을 겪다가 지난해 12월 계약을 해지하고 시공사 재선정에 나선 바 있다. 지난달 삼성물산이 대림산업, 호반건설과의 경합 끝에 최종 시공사로 선정됐다.'홍보직원(OS요원)' 활동을 둘러싼 잡음도 커지고 있다.홍보직원을 동원한 개별 홍보활동을 하지 않는 삼성물산과 달리 대우건설의 경우 OS요원이 상당부분 활동하고 있는 것으로 전해진다. 대우건설 측의 홍보요원으로 추정되는 담당자가 조합원의 집에 음식물을 배달하는가 하면, 조합원 집앞으로 찾아가 삼성물산 측의 제안서를 비방하는 내용이 담긴 동영상이 나왔기 때문이다.뿐만 아니라 대우건설이 과천에 분양한 한 단지에 조합원들을 데려가 카트를 이용해 단지 내 투어를 하는 등 불법 개별 홍보 활동을 하고 있다는 의혹이 커지고 있다. 이에 대우건설은 지난 7일 조합 이사회로부터 경고를 받았다.또 대우건설은 홍보대행사를 동원해 일부 언론사를 대상으로 건당 30~100만원의 조건을 제시하며 시공사 선정에 유리한 기사를 청탁하기도 했다는 의혹이 불거져 논란이 되기도 했다.외부인의 개입으로 양사간 소송전도 전개됐다.신반포1차 재건축사업(아크로리버파크)을 진두지휘한 A 씨가 반포3주구 조합원에게 대우건설이 시공사로 선정돼선 안 된다는 취지의 문자를 보내고, 대리 홍보를 펼쳤다는 의혹이 소송의 시작이다.대우건설은 A씨가 삼성물산과 공모해 이 같은 문자메시지를 보낸 것으로 판단하고, 삼성물산과 A씨를 지난 7일 서울방배경찰서에 명예훼손과 수주 업무 방해 등으로 고소·고발했다. 삼성물산은 ""사실이 아니다""고 일축했다.반포3주구 수주전이 점점 격화되자 결국 서울시가 나섰다.서울시는 변호사 등 전문가 10여명을 현장에 파견해 양사의 홍보활동 등에 대한 법적 위반사항 검토를 시작했다. 관할구청인 서초구청 역시 담당자가 매일 반포3주구 현장으로 나가 관리감독 하고 있다.한편, 반포3주구 재건축은 서초구 일대 1천490가구를 지하 3층~지상 35층, 17개동, 공동주택 2천91가구와 상가 등 부대복리시설로 새로 짓는 사업이다. 공사비는 8천87억 원 규모다. 조합은 오는 19일 1차 합동설명회를 열고, 20일부터 29일까지 공식 홍보관을 운영한 뒤 30일 최종 시공사를 선정할 계획이다. summer@inews24.com [ⓒ 아이뉴스24 무단전재 및 재배포 금지]",/news/news_read.nhn?article_id=0000538876&office_id=031&mode=search&query=삼성물산&page=1
"- DK도시개발·DK아시아, 인천 서구에 대규모 도시개발사업 추진, 5대 메이저 시공사로   특화된 브랜드시티 조성 전략- 최고 40층 4805가구 매머드급 대규모 단지로 대한민국 최초 휴양 리조트 도시 조성- 6개월 후 전매 가능 단지로 공급규모, 브랜드, 교통, 환경, 단지특화, 학교, 생활인프라까지   역대급 랜드마크 단지 요소 모두 갖춰, 전용 59㎡ 공급 비율 높여 공공성에도 기여 - 8월부터 분양권 전매강화","'성냥갑' 단지가 대부분이던 2000년, 서울 강남구 도곡동에 '타워팰리스'가 착공하면서 화려한 외관 뿐 아니라 넓은 평형 구성, 고급 커뮤니티까지 조성해 '프리미엄 주거 공간'이라는 새로운 개념의 장을 열었다.그러고 20년이 지난 지금도 여전히 아파트 고급화 경쟁이 심화되고 있다. 2016년 입주와 함께 한강변 대표 단지로 부상한 ‘아크로리버파크’, 4년 연속 국내 매매 최고 거래가 아파트에 오른 ‘한남더힐’ 등 ‘하이엔드 브랜드'의 잇딴 출현으로 아파트가 단순한 거주 대상이 아니라 선망의 대상이 됐고, 이제 지역을 상징하는 전국구 랜드마크 단지로 부상하게 된 것이다.이러한 유명 주거상품이 있는 곳은 해당 단지를 중심으로 지역 일대 아파트 시세가 동시 다발적으로 상승하는 경우가 많다. 특히 새로이 주거환경을 갖춘 곳에서 시그니처 단지 존재여부는 도시의 성패를 가늠할 수 있는 척도가 되기도 한다.타워팰리스로 대표되는 1세대 고급아파트가 부자임을 과시할 수 있는 외관 등의 하드웨어에 조금 더 치중했다면, 2세대 고급아파트부터는 점차 실생활의 편의성과 쾌적성을 높여주는 소프트웨어 설계에 힘쓰기 시작했다. 또 각종 주거서비스 강화로 이어지면서 상류층 주거 문화의 변화를 주도하고 있는 셈이다.이런 가운데 인천 최초 전국 대장주 아파트가 등장할 것으로 보여 실수요자 및 투자자들의 이목이 집중되고 있다.최근 전국에서 가장 핫한 인천 지역은 5월 첫주까지 8주 연속으로 전국 광역 자치단체 중 아파트 값이 가장 크게 오르고 있어 업계에서는 분양 성적을 계속 이어갈 수 있을지 주목하고 있다.특히 정부가 올해 8월부터 수도권과 광역시 대부분의 지역에서 분양권 전매를 금지하겠다는 추가 부동산 규제 방안을 발표하면서 적용 시점 이전 마지막 분양 단지에는 전국에서 청약자들이 대거 몰릴 것으로 예상되고 있다.◆ DK도시개발·DK아시아, 인천 서구 검암역세권에 ‘검암역 로열파크씨티 푸르지오’ 5월 29일 분양 예정, 최고 40층 4805가구의 매머드급 전국 대장주 아파트 예약 완료DK도시개발·DK아시아가 인천 서구 검암역세권에서 5월 29일 분양 예정인 ‘검암역 로열파크씨티 푸르지오’는 최고 40층, 4805가구의 매머드급 대단지로 인천 최초 전국 대장주 아파트 등극을 예약하는 모습이다.이 아파트는 이른바 ‘5·11대책’ 규제 대상에 해당되지 않아 6개월 후 전매가 가능하고, 공급규모, 브랜드, 단지특화, 생활인프라 등 역대급 랜드마크 단지의 요소를 모두 갖췄다는 평가다. 여기에 ‘휴양’ 콘셉트에 맞춰 다양한 여가시설이 들어서는 대한민국 최초 ‘휴양 리조트 도시’로 조성될 예정으로 이미 올초부터 실수요자 및 투자자들의 관심을 꾸준히 받아 왔다.2023년말 단지가 준공되면 인천을 대표하는 전국구 단지로 올라설 것이라는 전망이 나오는 이유다.우선 검암역 로열파크씨티 푸르지오는 검암역에서 공항철도 이용할 경우 김포공항역까지 2개 정거장, 마곡나루역 까지 3개 정거장 거리에 불과해 서울 접근성이 우수하다. 또한 검단신도시를 거쳐 불로지구까지 연장 계획 중인 인천지하철 2호선 독정역이 사업지와 바로 접해 있는 것도 장점이다.자연친화적 입지 여건과 단지 조경은 더욱 화려하다. 사업지 전면 폭 길이만 1km에 달하고 단지 서쪽에 바로 인접한 롯데월드 면적 6배 크기 자연 생태공원인 드림파크 야생화단지(30만평)와 36홀 드림파크 골프장(46만평) 등이 위치해 있다.대단지에 걸맞게 온가족이 산책할 수 있는 9.6km 둘레길과 단지내 약 1km 데크길이 들어서고 시공능력평가 조경 1위 삼성물산 리조트부문과 국내 아파트 단지 내 최초로 ‘미니 에버랜드’가 조성된다. 또 100만주에 가까운 꽃과 나무를 심어 단지 전체를 뒤덮는 ‘밀리언 파크'(Million Park) 등 고품격 조경을 선보인다.이외에도 각 분야 국내 최고 브랜드 기업과 손잡고 프리미엄 주거 명작을 완성한다는 계획이다.LG전자와 업무협약을 통해 차세대 IoT기술을 적용하고, 풀무원푸드앤컬처는 입주민들에게 인천 최초 고품격 삼식(三食) 서비스를 합리적인 가격으로 제공한다. 종로엠스쿨이 직영하는 학원은 입주민 자녀들에게 단지 내 학원가 등 프리미엄 사교육을 선보인다.3년간 무상으로 운영될 ‘돕다(DOPDA)’의 컨시어지 서비스는 입주민 자긍심은 물론 아파트의 가치와 품격도 한 차원 더 높일 예정이다.단지 내 커뮤니티시설도 압도적인 스케일을 자랑한다. 피트니스클럽, 수영장, 사우나 등 기본시설은 고급화했고, 도서관 내에 그리너리 라운지, 연회장 및 연회장과 연계한 루프탑, 파티룸, 티카페 및 펫카페, 게스트하우스 등도 적용된다.또 사업지 내 한들초(가칭) 및 한들유치원(가칭)을 건립 후 인천교육청에 기부채납도 계획돼 있다. 이들 학교는 단지 준공 시점에 맞춰 개교할 예정으로 입주민들은 자녀들을 안심하고 학교에 보낼 수 있을 전망이다.이 같은 주목도는 온라인상에서도 두드러지게 나타난다. 인천에서 그동안 볼 수 없었던 역대급 규모감 때문에 분양 홈페이지 일일 평균 방문객이 1만 2천여 명, 누적 방문객이 약 80만 명에 달하고, 부동산 정보 공유 사이트 ’호갱노노‘에서 최근 13일 기준 조회수가 65만회가 넘는 등 꾸준히 최상위권을 유지하며 전국적인 관심이 집중되고 있다.한편 이 아파트는 1?2단지를 거쳐 공항철도 검암역까지 5분 간격(출퇴근 시간 기준)으로 운행하는 순환 셔틀버스(총 6대)도 제공하며, 1단지 정류장에서 셔틀버스 탑승시 검암역까지 5분이면 도착할 수 있다. 특히 셔틀버스 6대는 5년간 무상 운영된 후 단지에 기증될 예정이다.소규모 단지보다 관리비가 적게 드는 장점도 있다. 공동주택관리정보시스템(K-apt)에 따르면 4000가구에 달하는 ‘인천 S아파트’ 전용면적(㎡)당 관리비는 894원(2019년 12월 기준)으로 지역 내 소규모 아파트 보다 최대 20% 가량 저렴한 것으로 조사됐다.DK도시개발·DK아시아 김정모 회장은 “보다 진화된 삶을 최우선 가치로 도시를 만들어가는 라이프 씨티 크리에이터(Life City Creator)로서 또 다른 라이프스타일을 원하는 현대인들에게 4세대 아파트를 넘어 서울에서 가장 가까운 대한민국 최초 ‘차세대 휴양 리조트 도시’를 만들겠다“며 “단순히 잠을 자기 위한 집이 아니라 고급 리조트에서만 누리던 다양한 서비스를 제공해 입주민들이 단지 안에서 모든 것을 해결할 수 있는 ‘리조트 도시’로 조성할 계획”이라고 말했다.◆ DK도시개발, 인천 서구에 대규모 도시개발사업 추진, 5대 메이저 시공사로 특화된 브랜드시티로 조성한다는 전략... 전용 59㎡ 공급 비율 높여 공공성에도 기여한편 DK도시개발은 최근 인천 서구 일대 431만9966㎡(약 130만평)부지의 대규모 도시개발 사업을 추진하면서 국내 5대 메이저 브랜드 시공사만 참여하는 특화된 메이저 브랜드시티로 조성한다는 전략을 세웠다.특히 광역교통망과 기반시설 부재, 낮은 브랜드 인지도 등 자족 기능을 갖추지 못해 ‘베드타운’화 된 기존 신도시의 문제점을 보완하고 젊은층에게 관심이 높은 전용 59㎡ 소형평형을 전체 가구의 50%를 공급해 공공성에도 기여한다는 방침이다.이를 통해 서민 주거 안정에 도움될 뿐만 아니라 다른 신도시의 공급물량과 겹치지 않아 공급과잉에 대한 우려도 말끔히 씻어낼 것이란 평가다. 특히 지자체에서 하지 못한 소형평형 공급을 민간에서 주도적으로 추진하면서 소형부터 중대형까지 공급타입을 다양화함으로써 메이저 브랜드시티의 밸런스까지 맞출 계획이다.한편 DK도시개발이 민간 도시개발사업으로 진행하는 사업지들은 정부가 조성하는 신도시보다 더 특색있는 완벽한 생활 기반시설을 갖추고 ‘휴양’ 콘셉트에 맞춰 다양한 여가시설이 들어서는 대한민국 최초 ‘휴양 리조트’ 도시로 조성될 예정이다.또한 검암역 로열파크씨티 푸르지오 분양 이후 2차(리조트도시Ⅱ 4742가구), 3차(리조트도시Ⅲ 4119가구) 사업도 순차적으로 공급할 계획이다.임소라 기자 mail00@asiae.co.kr <ⓒ경제를 보는 눈, 세계를 보는 창 아시아경제 무단전재 배포금지>",/news/news_read.nhn?article_id=0004680587&office_id=277&mode=search&query=삼성물산&page=1
,"DK도시개발과 DK아시아는 인천 서구 검암역세권에서 오는 29일 '검암역 로열파크씨티 푸르지오' 분양에 나선다고 18일 밝혔다. 이 단지는 최고 40층, 4805세대의 매머드급 대단지로 6개월 후 전매가 가능한 물량이다. 검암역에서 공항철도 이용 시 김포공항역까지 2개 정거장, 마곡나루역까지 3개 정거장 거리다. 검단신도시를 거쳐 불로지구까지 연장 계획 중인 인천지하철 2호선 독정역이 사업지와 접해 있다.대단지에 걸맞게 온가족이 산책할 수 있는 9.6km 둘레길과 단지내 약 1km 데크길이 들어서고 삼성물산 리조트부문과 국내 아파트 단지 내 최초로 '미니 에버랜드'를 조성한다. LG전자와는 업무협약을 통해 차세대 IoT기술을 적용하고, 풀무원푸드앤컬처는 입주민들에게 인천 최초 고품격 삼식(三食) 서비스를 합리적인 가격으로 제공할 방침이다. 종로엠스쿨이 직영하는 학원은 입주민 자녀들에게 단지 내 학원가 등 프리미엄 사교육을 제공하며, '돕다(DOPDA)'의 컨시어지 서비스는 3년간 무상으로 운영할 예정이다. 단지 내 커뮤니티시설에는 피트니스클럽, 수영장, 사우나 등 기본시설은 고급화하는 한편, 도서관 내에 그리너리 라운지, 연회장·연회장과 연계한 루프탑, 파티룸, 티카페·펫카페, 게스트하우스 등도 적용한다.또 사업지 내 한들초(가칭), 한들유치원(가칭)을 건립 후 인천교육청에 기부채납도 계획됐다. 이들 학교는 단지 준공 시점에 맞춰 개교할 예정이다. 1·2단지를 거쳐 공항철도 검암역까지 5분 간격(출퇴근 시간 기준)으로 운행하는 순환 셔틀버스(총 6대)는
5년간 무상 운영된 후 단지에 기증될 예정이다. 1단지 정류장에서 셔틀버스 탑승시 검암역까지 5분이면 도착할 수 있다. 김정모 DK도시개발·DK아시아 회장은 ""보다 진화된 삶을 최우선 가치로 도시를 만들어가는 라이프 씨티 크리에이터(Life City Creator)로서 또 다른 라이프스타일을 원하는 현대인들에게 4세대 아파트를 넘어 서울에서 가장 가까운 대한민국 최초 '차세대 휴양 리조트 도시'를 만들겠다""며 ""단순히 잠을 자기 위한 집이 아니라 고급 리조트에서만 누리던 다양한 서비스를 제공해 입주민들이 단지 안에서 모든 것을 해결할 수 있는 '리조트 도시'로 조성할 계획""이라고 말했다.준공은 2023년 말 예정이다. [디지털뉴스국 이미연 기자] [ⓒ 매일경제 & mk.co.kr, 무단전재 및 재배포 금지]",/news/news_read.nhn?article_id=0004577240&office_id=009&mode=search&query=삼성물산&page=1
