head,text,url
,"삼성물산 건설부문의 아파트 브랜드 ‘래미안'이 한국능률협회컨설팅이 주관하는 ‘2020년 한국산업의 브랜드파워(K-BPI)' 조사에서 아파트 부문 19년 연속 1위 자리를 지켰다.
 또한 래미안은 10년 연속 해당 업종 1위를 지킨 기업에 주는 ‘K-BPI 골든 브랜드’로 이름을 올렸다.
 래미안은 고객에게 차별화된 경험을 제공하기 위해 다양한 상품을 개발하고 있다.
 손목 착용형 아파트 출입시스템인 ‘웨어러블 원패스'(Wearable One Pass)를 도입하고, 2019년에는 사물인터넷 기술과 주거 시스템을 결합한 ‘래미안 IoT 플랫폼'을 자체 개발하여 입주민의 주거 편의성을 높였다.
 또한 래미안은 고객 가치 제고를 위해 다양한 프로그램들을 도입하고 있다.
 지난해에는 브랜드 홍보관인 래미안 갤러리에서 ‘래미안 클라스' 등 부동산 포럼을 개최하고, 부산에서는 조깅하며 쓰레기를 줍는 공익적 활동인 ‘래미안 플로깅(Plogging) 데이' 행사를 진행했다.
 2019년에는 새로운 고객층인 밀레니얼 세대의 라이프 스타일을 담는 주거 콘셉트인 ‘넥스트 래미안 라이프’(Next Raemian Life)를 발표했다.
 취향과 개성이 뚜렷한 밀레니얼 세대를 위해 소비자가 직접 선택하는 인테리어 상품과 디지털 문화에 익숙한 이들에게 최적화된 IoT 환경을 제공하는 내용을 담고 있다.
 래미안은 또한 한국산업의 브랜드파워 19년 연속 1위뿐 아니라 국가고객만족도(NCSI) 22년 연속 1위, 국가브랜드 경쟁력지수(NBCI) 17년 연속 1위, 한국서비스품질지수(KS-SQI) 5년 연속 1위를 수상하는 등 최고의 주거 브랜드임을 인정받고 있다.
 삼성물산 관계자는 “2020년에도 래미안은 서울, 부산 등에서 우수한 입지, 혁신적인 주거 상품과 서비스로 고객을 만날 준비를 하고 있으며, 신반포15차와 반포주공1단지 3주구 등 입지가 우수한 사업장을 대상으로 수주를 추진하고 있다”고 말했다.
 나기천 기자 na@segye.comⓒ 세상을 보는 눈,",/news/news_read.nhn?article_id=0003452783&office_id=022&mode=search&query=삼성물산&page=3
,"삼성물산 패션부문 '준지(Juun.J)'가 여성 단독 매장을 오픈한다. 지난해 도산에 첫 번째 플래그십 스토어를 오픈한 이후 여성 상품으로만 구성한 단독 매장을 서울 중구 롯데백화점 에비뉴엘 본점 4층에 마련한다. 준지 여성은 포멀 라인 70%, 캐주얼 라인 20%, 베이직 라인 10%로 구성했다. 포멀 라인은 차별화된 스커트 상품을 중심으로 재킷, 스커트 셋업 상품뿐만 아니라 다양한 팬츠와 착장할 수 있는 셔츠 상품으로 구성됐다. 또 다양한 워싱 기법과 봉제 디테일이 돋보이는 데님, 자체 개발한 프린트를 활용한 티셔츠 상품은 캐주얼 라인의 대표 아이템이다. [ⓒ 매일경제 & mk.co.kr, 무단전재 및 재배포 금지]",/news/news_read.nhn?article_id=0004549077&office_id=009&mode=search&query=삼성물산&page=3
,"시공능력평가 1위 삼성물산 건설부문이 서울 서초 신반포15차아파트 재건축사업에 뛰어들며 5년 만에 정비사업 수주전에 복귀했다. 삼성물산은 인근 반포주공1단지 3주구 수주전에도 나서 업계를 긴장시켰다. 경쟁사가 삼성물산을 비방하는 내용이 담긴 자료를 뿌렸다가 다시 회수하는 일까지 벌어졌다. 2015년 삼성물산과 제일모집의 합병 과정에 불법 행위가 있었는지 검찰이 수사 중인 상황에서 당시 삼성물산 건설부문은 자사 주식의 가치를 낮추려고 고의로 주택사업 매출을 떨어뜨렸는지 논란이 됐다. 그럼에도 삼성물산은 아랑곳하지 않고 ‘선별·클린수주’를 다짐했다.“주택사업 매각은 터무니없다. 선별 수주를 위해 기다리고 있을 뿐이다.”삼성물산 건설부문 관계자는 주택사업 매각설이 나돌던 몇년 전 이같이 말했다. 그의 말대로 삼성물산은 주택사업을 접지 않았다. 삼성물산은 업계 1위 아파트브랜드인 래미안을 앞세워 2000년대 초반부터 10년 넘게 활발한 아파트 수주전에 나섰다. 강남·서초 등 부촌을 중심으로 대단지 래미안아파트를 지으며 지역 랜드마크 입지를 다지는 동시에 압도적인 존재감을 과시했다.하지만 삼성물산은 2015년 서초 무지개아파트 입찰을 마지막으로 장기간 수주전에서 자취를 감췄다. 삼성그룹이 주택사업을 매각하려 한다는 소문이 퍼질 만큼 업계에서 한발 물러나 있었다. 그때마다 삼성물산은 업계의 과열 수주 경쟁을 벗어나 선별수주를 위한 사업성을 검토한다는 말로 진화에 나섰다.그러다 약 5년 만에 신반포15차아파트 수주전에 복귀하자 업계는 물론 조합도 술렁이는 분위기다. 신반포15차 조합원 A씨는 “한동안 재건축 수주전에 나서지 않았던 삼성물산이 경쟁에 뛰어들어 무게감이 높아졌다”고 반겼다.또 다른 조합원 B씨도 “업계 1위 건설사가 참여한다는 건 그만큼 우리 단지가 가치가 있다는 것”이라며 “강남권에서 보기 힘들던 호반건설까지 수주전에 참여해 조합 입장에서 선택의 폭이 다양해졌다”고 평가했다.삼성물산의 정비사업 복귀 무대는 신반포15차아파트 재건축사업. 삼성물산이 조합에 제안한 단지명은 ‘래미안 원 펜타스’(Raemian One Pentas)다. 래미안 원 펜타스는 반포 중심에서 빛나는 별과 같은 하이엔드 주거공간을 제공한다는 의미다.삼성물산은 이 단지에 래미안이 가진 디자인 역량을 쏟아부을 방침이다. 삼성물산은 래미안의 차별화된 디자인 역량과 메르세데스-벤츠 박물관, 싱가포르 래플스시티로 유명한 네덜란드 유엔 스튜디오(UN Studio)와 협업해 최고의 디자인을 선보인다는 계획이다.삼성물산 관계자는 “반포는 대한민국의 주거문화를 선도하는 지역으로 신반포15차를 빛낼 수 있도록 래미안이 가진 모든 역량을 동원할 것”이라고 강조했다.삼성물산은 신반포15차 외에 인근 반포주공1단지 3주구 수주전에도 나선다. 삼성물산이 이곳까지 품게 되면 래미안퍼스티지와 함께 대규모 래미안 브랜드타운이 형성될 전망이다.5년 동안 시장에 모습을 드러내지 않았지만 래미안 브랜드의 가치는 여전히 높다. 부동산114에 따르면 시공능력평가 상위권 건설사의 서울 강남권 주요 아파트값(2월 말 기준 3.3㎡당 평균 매매가)을 비교 분석한 결과 삼성물산이 지은 아파트의 매매 평균가격이 4447만원으로 가장 높았다. 경쟁사 아파트의 가격은 각각 ▲GS건설 3902만원 ▲현대건설 3466만원 ▲대림산업 3018만원 ▲대우건설 2414만원으로 조사됐다.삼성물산이 오랜만에 정비사업 수주전에 등장하자 경쟁사도 긴장한 모습이 역력하다. 삼성물산의 정비사업 재등판에 작은 해프닝도 있었다. 경쟁사에서 최근 삼성물산의 행보를 깎아내리는 내용의 자료를 배포했다가 긴급히 회수한 것. 실적하락에 따른 수주전 참여, 이재용 삼성전자 부회장의 삼성물산 합병 관련 재판 내용을 거론하며 경계했다.업계에서는 그만큼 삼성물산의 등장에 위기의식을 느낀다는 해석이다. 대형건설사 관계자는 “삼성물산이 최근 몇년간 정비사업에 나서지 않았지만 래미안 브랜드가 주는 무게감은 다르다”며 “각 조합 입장에서 래미안이 참여하면 아파트 가치를 높게 평가받는다는 기분이 들 것”이라고 평가했다.삼성물산은 불편한 기색을 감추지 않았지만 공식대응은 하지 않기로 했다. 삼성물산 관계자는 “해당 자료를 보고 황당했지만 맞대응하기보다는 브랜드가치로 정당하게 평가받을 것”이라고 자신했다.수주 자신감도 여전하다. 삼성물산은 그동안 정비사업을 떠난 것이 아니라고 선을 긋는다. 대형 프로젝트라고 무조건 수주에 나설 이유가 없다는 것. 삼성물산 관계자는 “건설사 간 과열경쟁에 따른 리스크를 피하고 선별·클린수주에 나서는 것이 내부 방침”이라고 설명했다. 이어 “우수한 사업성을 지닌 단지를 중심으로 계속해서 수주 로드맵을 그릴 것”이라고 강조했다.김창성 기자 solrali@mt.co.kr
<저작권자 ⓒ '성공을 꿈꾸는 사람들의 경제 뉴스' 머니S, 무단전재 및 재배포 금지>",/news/news_read.nhn?article_id=0000525759&office_id=417&mode=search&query=삼성물산&page=3
안드로이드 Play 스토어·iOS 앱스토어 통해서 설치 가능,"(서울=뉴스1) 권구용 기자 = 삼성 계열사들의 준법경영을 감시하기 위해 출범한 독립기구 '삼성 준법감시위원회'가 스마트폰 애플리케이션을 통해서도 신고를 접수 중이다. 2일 재계에 따르면 삼성 준법위원회는 사단법인 한국기업윤리경영연구원(KBEI)이 운영하는 애플리케이션을 통해 삼성 계열사의 임직원의 준법 의무 위반에 대한 신고와 제보를 받고 있다. 대상 계열사는 삼성전자 주식회사, 삼성물산 주식회사, 삼성SDI 주식회사, 삼성전기 주식회사, 삼성에스디에스 주식회사, 삼성생명보험 주식회사, 삼성화재해상보험 주식회사 등으로 위원회와 '삼성 준법감시위원회 설치 및 운영에 관한 협약'을 체결한 곳이다. 해당 애플리케이션은 안드로이드 운영체제용과 iOS용 두 가지가 나와 있어 각각 '구글 play 스토어'와 '앱스토어'를 통해 다운로드 할 수 있다. 차이점은 안드로이드의 경우 '삼성 준법감시위원회 신고'라는 앱이 별개로 존재하는 반면, iOS의 경우 KBEI가 운영하는 부정부패 신고 앱인 '케이휘슬 헬프라인' 안에서 '삼성 준법감시위원회'라는 기관을 검색한 후 신고하는 방식이다. 신고서는 Δ피신고자의 이름 Δ피신고자의 소속·직책 Δ신고내용 Δ기타 요청사항을 기재하게 돼 있으며, 익명여부와 신고에 대한 답변 수신을 선택할 수 있다. 앞서 지난달 23일 준법위원회는 자체 홈페이지를 개설하고 우편이나 이메일, 홈페이지를 통해 신고와 제보를 받으며 외부 접수도 한다는 방침을 밝힌 바 있다. 신고 애플리케이션 운영은 '외부 접수'의 한 방안인 것으로 보인다. 특히 휴대전화의 애플리케이션의 경우 PC를 이용한 홈페이지 접속이나 이메일 접수, 혹은 우편보다 손쉽게 가능하다는 점에서 유용한 소통 창구가 될 것으로 예상된다. 한편, 준법위원회의 자체 홈페이지는 현재 구글, 네이버, 다음과 같은 포털에서는 검색 결과로 나타나지 않는 상태이지만 이르면 다음 주 정도 표출이 될 전망이다.inubica@news1.kr© 뉴스1코리아(), 무단 전재 및 재배포 금지",/news/news_read.nhn?article_id=0004558505&office_id=421&mode=search&query=삼성물산&page=3
"회원사에 신규채용 독려하는 협조공문 발송주요 대기업, 화상면접 등 통한 공채 준비","현대자동차가 신입·경력 채용을 위해 화상면접을 진행하는 모습. (사진=현대차)[이데일리 김종호 기자] 전국경제인연합회는 신종 코로나바이러스 감염증(코로나19)으로 인한 청년 실업 급증을 우려해 회원사에 신규채용 계획 차질을 최소화해달라고 요청했다고 2일 밝혔다.전경련은 지난달 31일 회원사에 이같은 내용을 담은 협조공문을 발송했다. 전경련은 이 협조공문에서 △감염확산 진정 시 지연된 채용일정 재개 △채용 확정자에 대한 발령 연기·채용 취소 지양 △온라인 채용설명회, AI·화상면접 등 비대면 방식 ‘언택트 채용’ 시행 △수시채용 적극 활용 △어학·자격증 등 시험성적 제출기한 연장 △채용관련 정보 적극 전파 △채용장소 방역 철저 등을 강조했다.추광호 전경련 상무는 “경제위기 상황에서는 기업이 고용경직성으로 신규채용을 일차적으로 크게 줄이는 경향이 있어 청년실업이 급증할 우려가 크다”라며 “미래세대의 숙련기회 상실은 개별기업은 물론 경제전반의 생산성저하로 연결될 수 있으므로 기업의 적극적인 청년채용 노력이 요구된다”라고 말했다.한편 코로나19 사태가 장기화하면서 매년 대규모 신입 사원을 선발하는 대기업의 채용 풍경도 크게 달라지고 있는 것으로 나타났다. 코로나19 확산 우려 속에서도 우수 인재 채용을 이어가야 하는 만큼 온라인상에서 채용 홍보를 진행하고 화상 면접을 실시하거나 신규 입사자를 자택 대기 시키는 등 감염을 예방하는 방식으로 채용 절차를 선회해 실시 중이다. 삼성전자(005930)와 현대자동차(005380), SK(034730) 등 주요 대기업은 불확실한 글로벌 경영환경 속에서도 대규모 상반기 신입 공개채용을 통해 흔들림 없이 미래 준비에 나선다는 방침이다.실제 최근 삼성전자와 삼성SDI(006400) 등 삼성 주요 계열사는 올 상반기 공채를 앞두고 온라인 캠퍼스 리크루팅에 돌입했다. 캠퍼스 리크루팅이란 기업 인사담당자가 대학교를 찾아 취업준비생을 대상으로 채용설명과 즉석면접 등을 진행하는 활동이다. 삼성은 매년 2월 말 캠퍼스 리크루팅을 거쳐 상반기 채용을 실시해왔다. 하지만 올해는 코로나19 확산으로 전국 대학 개강이 연기되자 공채 일정을 한 달가량 미루고 캠퍼스 리크루팅을 온라인에서 대체해 실시하기로 했다.삼성전자 디바이스솔루션(DS) 부문의 메모리사업부는 이미 3월 중순부터 취업준비생 등을 대상으로 채용 사전 설문조사를 진행 중이다. 이 조사는 본격적인 채용에 앞서 지원자들의 학력과 전공, 희망 직무 등을 사전에 파악하기 위한 일종의 온라인 캠퍼스 리크루팅이다. 삼성전자는 이를 통해 입사 희망자를 사전 조사한 뒤 직무 소개 등 채용 관련 정보를 안내하기로 했다. 또 지원자를 현업 담당자와 연결, 유선면담 등을 진행해 캠퍼스 리크루팅의 공백을 최소화하기로 했다.삼성SDI도 지난달 27일부터 온라인 채용 상담에 들어갔다. 취업준비생이 상담을 신청하면 오는 8~10일 사흘간 소셜네트워크서비스(SNS)인 카카오톡을 활용해 인사담당자가 직접 채용 관련 상담을 진행할 예정이다. 삼성전자와 삼성SDI에 이어 삼성디스플레이와 삼성전기(009150), 삼성SDI(006400), 삼성물산(028260), 삼성화재(000810), 삼성생명(032830) 등 삼성의 다른 계열사도 조만간 온라인 리크루팅에 동참할 전망이다. 한편 지난달 30일부터 신규 채용을 재개한 현대차와 SK 등은 화상면접을 통한 비대면 방식으로 지원자를 선발하기로 했다. 지원자는 노트북이나 태블릿PC, 스마트폰 등을 통해 다수 면접관으로부터 질문을 받고 답할 수 있다. 이들 기업은 화상면접을 위해 이미 전용 공간과 고화질 카메라 및 마이크, 대형 스크린 등 다대일(多對一)·다대다(多對多) 면접이 가능한 화상면접 시스템을 마련했다.김종호 (kona@edaily.co.kr)＜ⓒ종합 경제정보 미디어 이데일리 - 무단전재 & 재배포 금지＞",/news/news_read.nhn?article_id=0004611109&office_id=018&mode=search&query=삼성물산&page=3
"상위 5개 건설사 지난해 해외 매출 1년 새 17.1% 급감""코로나19 종식·유가회복 시기 불투명해 장단기 실적 우려""","(서울=뉴스1) 국종환 기자 = 저유가 장기화로 해외 건설시장의 일감이 줄어들면서, 대형 건설사의 해외 매출이 크게 감소한 것으로 나타났다. 국내 상위 5개 건설사의 지난해 해외 매출 감소액만 무려 3조7000여억원에 달한다.전문가들은 예상치 못한 신종 코로나바이러스 감염증(코로나19) 여파로 신규 해외 수주도 어려워져, 장기간 해외사업 위축이 불가피할 것으로 보고 있다.2일 삼성물산과 현대건설, 대림산업, GS건설, 대우건설 등 시공능력평가 상위 5개 대형 건설사의 지난해 사업보고서를 분석한 결과, 이들 업체의 해외 사업 매출은 총 18조3099억원으로 전년(22조832억원)보다 3조7733억원(17.1%) 줄어든 것으로 나타났다.5대 건설사의 해외 매출은 2018년 1.7% 오르며 반등을 시도했으나, 지난해 다시 낙폭이 크게 늘어나면서 불안감이 커지고 있다.업체별로 보면 GS건설이 지난해 해외 매출이 3조840억원으로 전년(5조4981억원) 대비 2조4141억원(43.9%) 줄어 감소 폭이 가장 컸다. GS건설은 2018년 해외 매출이 1조8345억원(50.1%) 급증해 전반적인 업계 실적 상승을 주도했으나, 지난해엔 부진했다. 저유가 영향으로 중동 지역 매출이 2조729억원 급감했고, 중국 및 동남아 매출도 4556억원 줄었다.시공능력평가 1위인 삼성물산 건설부문도 지난해 해외 매출이 3조7940억원을 기록해 전년(5조910억원)에 비해 1조2970억원(25.5%) 감소했다. 2017년(5조6830억원)에 비해선 2조원 가까이 줄었다. 과거 해외 사업 부실을 경험한 이후 수익성 중심의 보수적인 경영을 펼치면서 매출은 축소됐다.대림산업은 1년간 해외 매출이 1조8534억원에서 1조7774억원으로 760억원(4.1%) 감소했다. 대우건설도 2018년 2조3536억원에서 지난해 2조3456억원으로 80억원(0.3%) 소폭 줄었다.5대 건설사 중에서 현대건설만 유일하게 해외 매출이 늘었다. 현대는 2018년 해외 매출이 7조2871억원이었는데, 지난해 7조3089억원으로 218억원 증가했다.국내 건설사의 해외 매출 감소는 더욱 심화할 것으로 보인다. 3년여 전부터 두드러진 신규 수주 감소세가 매출 실적에 본격적으로 반영되기 때문이다.국내 건설사의 해외 수주액은 2010년 716억달러로 고점을 찍었으나, 이후 부진을 나타내 2015년엔 461억달러로 곤두박질쳤다. 이어 2016년 282억달러로 급감한 뒤 지지부진한 상태(2017년 290억달러, 2018년 322억달러)다. 급기야 지난해 224억달러까지 떨어져, 2006년 이후 13년 만에 가장 저조한 실적을 기록했다.올해 전망도 밝지만은 않다. 연초 중동 지역 등에서 수주 낭보를 울리며 반등을 시도했으나, 예상치 못한 코로나19 팬데믹(세계적 대유행)으로 글로벌 경기 침체 우려가 확산하면서 상당수 해외 발주가 지연될 것이라는 전망이 나오고 있다. 해외건설협회 조사 결과 국내 건설사의 지난달 해외 수주액은 18억3000만달러로, 2016년~2018년 3월 평균 실적(53억3100만달러)의 절반에도 못 미쳤다.백재승 삼성증권 연구원은 ""코로나19가 전 세계적으로 확산돼 종식 시기를 가늠하기 어려울 뿐 아니라, 유가 회복 또한 불확실한 상황""이라며 ""국내외 공사 현장 일정 지연, 해외 발주처의 발주 여력 훼손 등으로 국내 건설업체들은 장단기 실적 모두 부정적인 영향을 받을 수 있다""고 말했다.jhkuk@news1.kr© 뉴스1코리아(), 무단 전재 및 재배포 금지",/news/news_read.nhn?article_id=0004558530&office_id=421&mode=search&query=삼성물산&page=3
"한남3·반포1 3주구 등 상반기 서울 대형 수주전 앞둬 관심 ↑""철저한 사업성 분석·역량 강화해 올해도 경쟁력 유지할 것""","(서울=뉴스1) 이동희 기자 = 현대건설이 지난 3월 재개발·재건축 시장에서 잇달아 사업권을 따내며 수주 청신호를 알렸다. 현대건설은 올해 상반기 서울에서만 용산구 한남3구역, 서초구 반포주공1단지 3주구 등 굵직한 수주전을 앞두고 있다. 2일 건설업계에 따르면 현대건설은 지난 3월 7000억원 이상의 도시정비사업을 수주했다. 서울 '신용산역 북측 제2구역' 도시환경정비사업과 부산 '범천 1-1구역 도시환경정비사업'이다. 신용산역 북측 제2구역 사업은 현대건설의 올해 첫 정비사업 수주다. 지난달 21일 시공사 선정 총회에서 전체 조합원 98명(81명 참석) 중 찬성 76표를 얻어 시공권을 따냈다. 이 프로젝트는 용산구 한강로 2가 2-194 일대에 지하 5층~지상 33층 아파트 340가구와 오피스텔 55실 등을 조성하는 사업이다. 총사업비는 3037억원으로 용산역 노른자 입지를 자랑한다. 수주 소식은 한 주 후에 바로 이어졌다. 지난달 28일 부산 진구 범천 1-1구역 조합은 총회에서 현대건설을 시공사로 선정했다. 현대건설은 경쟁사와 치열한 경쟁 끝에 전체 조합원 471명 중 238표(52.9%)를 받으면서 시공권을 거머쥐었다. 범천 1-1구역 도시환경정비사업은 진구 범천동 850-1 일대에 지하 6층~지상 49층 아파트 1323가구와 오피스텔 188실 등 총 1511가구 규모다. 총사업비는 4160억원이다. 범천 1-1구역은 더블역세권에 '초품아'(초등학교를 품은 아파트), 숲세권 등을 지닌 우수한 입지를 자랑한다. 사업성이 높아 수주전도 치열했다. 지난 3월 산뜻한 출발을 알리면서 현대건설의 올해 실적에도 관심이 쏠린다. 현대건설은 지난해 전국 10개 사업장 2조8293억원 규모의 신규 수주액을 쌓으며 이 분야 업계 1위를 차지했다. 지난 2017년 이후 2년 만에 다시 선두를 탈환한 것. 현대건설은 올해 상반기 서울 대형 정비사업에 이미 도전장을 내민 상태다. 공사비만 약 2조원에 달하는 용산구 한남3구역 재개발과 8000억여원 상당의 서초구 반포주공1단지 3주구 재건축 수주전이다. 한남3구역은 단군 이래 최대 규모 재개발 사업으로 현대건설을 비롯해 대림산업, GS건설이 시공권을 두고 경쟁 중이다. 애초 시공사 선정 총회는 4월26일 열릴 예정이었으나, 신종 코로나바이러스 감염증(코로나19) 여파로 5월 말에나 가능할 것으로 보인다. 강남 재건축인 반포주공1단지 3주구는 바로 옆 1·2·4주구(5124가구)를 현대건설이 수주했다는 점에서 놓칠 수 없는 곳이다. 현대건설은 3주구까지 수주해 반포주공1단지 전체(7241가구)를 '디에이치' 브랜드 타운으로 조성할 계획이다. 이 현장은 아직 입찰 마감 전이나 현대건설을 포함해 삼성물산, 대림산업, GS건설, 대우건설, 롯데건설 등 6곳이 수주 의지를 불태우고 있다. 현대건설 관계자는 ""2020년에도 철저한 사업성 분석과 역량을 더욱 강화해 전국 재개발·재건축 현장에서 최고의 수주 경쟁력을 이어가도록 하겠다""고 말했다.yagoojoa@news1.kr© 뉴스1코리아(), 무단 전재 및 재배포 금지",/news/news_read.nhn?article_id=0004558534&office_id=421&mode=search&query=삼성물산&page=3
