head,text,url
"이어진 수사·재판으로 정상적 경영이 어려운 상태 지속 '뉴 삼성' 향한 이 부회장 행보 지연되거나 올스톱 우려 각계서 ""무리한 수사로 기업 압박 행태 중단해야"" 지적","[서울=뉴시스] 김종민 고은결 기자 = 이재용 삼성전자 부회장이 삼성물산-제일모직 합병, 삼성바이오로직스 분식 등 경영권 승계를 둘러싼 의혹과 관련해 26일 검찰에 소환조사를 받으면서 재계와 학계 일각에선 우려의 목소리가 나오고 있다. 최근 글로벌 산업 생태계의 패러다임 변화에 코로나19 사태까지 겹치면서 '대공황 이후 100년만에 최대 위기'라는 말까지 나오고 있는 위기 속에서 검찰 수사와 재판이 겹쳤기 때문이다. 가뜩이나 대내외적인 악재와 변수가 이어지는 가운데 끝없이 이어지는 수사와 재판 등으로 인해 삼성은 사실상 정상적인 경영이 어려운 상태가 지속되고 있다. 삼성 측은 이날 이 부회장의 소환에 대해 ""입장이 없다""고 언급을 삼가고 있지만, 그룹 총수의 검찰 소환에 긴장감은 흘렀다. 불확실성 속에 사법 리스크까지 가중돼 '새로운 삼성'을 향한 이 부회장의 행보가 늦어지거나 아예 '올스톱' 되는 것이 아니냐는 구성원들의 걱정과 안타까움이 묻어났다. 재계와 학계 안팎에서도 기업이 모든 역량을 결집해도 위기 극복이 쉽지 않은 현실 속에서 검찰이 무리한 수사로 기업을 압박하는 행태를 중단해야 한다는 지적이 제기되고 있다. 이병태 카이스트 경영학과 교수는 ""삼바 분식 회계가 회계학적으로 말이 안되는 얘기였고, 이번 정권이 만든 정치적인 사안이지 범죄행위가 아니라고 본다""면서 ""그걸 주장한 참여연대 출신이 금감원장이 되면서 지난 정권에 금감원에서 아무 문제 없다는걸 다시 문제 삼은 것이기 때문에 원고와 재판관이 같았던 이슈다""라고 말했다. 이 교수는 ""삼성 이재용 부회장뿐 아니라 훌륭한 경영진들, 특히 미래전략실에 있던 경영진들 다 사법 관련 와중에 감옥에 가고 퇴출되면서 어마어마한 우수 경영 탤런트들이 유실되고 있는 상황이 4년째 지속됐다""면서 ""이것은 삼성뿐 아니라 대한민국 재계에도 불행한 상황""이라고 지적했다. 최준성 성균관대 법대교수는 ""삼성바이오와 물산 합병 두 건이 다 승계와 연관있다 보는게 검찰 시각인데, 이건 오해다""라며 ""삼성바이오는 IFRS(국제보험회계기준) 회계 기본원칙에 대한 이해 부족으로 빚어진 사태라고 본다""고 말했다. 최 교수는 ""삼성물산 사건은 어차피 주주총회 통해 잘 해결된 문제다. 가장 이해관계 있는 사람들인 주주들이 3분의 2가 찬성했는데 왜 문제가 되냐""며 반문하면서 ""합병비율이 문제라 하는데 자본시장법 시행령에 따라 정확한 비율 계산해 한 것""이라며 지적했다. 이어 최 교수는 ""대통령도 정부와 기업은 한 배를 탔다 말씀하시는데 (정부에서) 서로 간 손발이 안맞는 디커플링이 되는 것 같다""며 ""손발이 맞아야 기업도 기가 살 것""이라고 말했다. 홍기용 인천대 경영학부 교수는 ""이재용 부회장이 구속된다고 하면 글로벌 기업 삼성의 의사결정구조가 차질을 빚는 상당한 리스크를 받게 될 것""이라며 ""장기간의 경영 공백이 생긴다면 여러 어려움 속에서 잘 헤쳐나가야 하는 상황에서 삼성뿐 아니라 국내 경제 전체가 영향을 받을 수밖에 없다""고 말했다.홍 교수는 ""삼성의 재정적 역할 뿐 아니라 파생적 영향까지 생각하면 엄청난 역할을 한다""라며 ""신산업, 신기술은 최고경영자의 의사결정이 필요하므로 영향을 받을 수밖에 없다""라고 부연했다.재계와 금융투자업계에서도 이 부회장의 소환과 이어지는 재판에 대해 ""지나치다""는 비판을 내놓았다. 재계 관계자는 ""이번 소환으로 이재용 부회장의 국내외 위기극복 행보가 타격 받을까 우려된다""며 ""삼성을 마비시킬 정도로 몰아가는 것은 지나치다""고 지적했다. 이어 그는 ""리더의 영향력은 기업성과 중에 30% 이상 차지하는데, 중요한 시기인 만큼 그룹 총수의 역할이 더욱 중요하다""며 ""위기때 산업판도가 바뀌는데, 이때 과감한 투자와구조조정을 해야 큰 기회를 갖게 된다""고 덧붙였다. 법조계 관계자는 ""삼성물산 합병 무효소송에서 재판부는 합병 비율이 자본시장법에 따라 정당하게 정해졌다고 인정했다""며 ""이미 사법부 판단이 끝난 사안임에도 불구하고 합병 비율을 다시 문제삼고 있다""고 지적했다. 그는 ""이렇게 '자본시장법에 의거 주가에 따라 이뤄진 합병'을 부정하는 것은 법 준수를 감시해야 할 기관
스스로가 법을 무시하는 처사""라고 비판했다. 금융투자업계 관계자는 ""수사당국은 삼성이 바이오사업의 가치를 부풀려 무리한 합병을추진했다고 주장하며, 바이오사업의 '비전과 가능성'을 무시한 채 '사기'라고 몰아세우고 있다""면서 ""하지만 바이오사업이 본궤도에 오르면서 삼성의 '비전'이 현실화됐고, 삼성바이오로직스는 시가총액 기준으로 국내 3위, 40조 규모의 초대형 회사로 성장했다""고 말했다. 이어 그는 ""분식회계 의혹에도 불구 투자자들은 더욱 몰리고 있으며,문재인 정부도 반도체, 미래형 자동차와 더불어 바이오를 3대 미래 신성장산업으로 지정해 전폭적 육성 의지를 보이고 있다""고 ""합병은 정당한 절차에 따라 진행됐고, 분식회계로 사업가치를 부풀린게 아니며 경제활성화 국민기대와도 배치된다""고 강조했다.한편, 이재용 삼성전자 부회장은 이날 국정농단 사건 이후 3년여 만에 다시 검찰 조사를 받기 위해 출석했다. 2017년 진행된 특검 수사로 뇌물 공여 등 혐의 재판이 이어지고 있는 가운데, 또 다른 의혹 조사 대상이 돼 재차 수사기관에 소환된 것이다.당시에도 이 부회장의 경영권 승계를 둘러싼 의혹이 쟁점으로 부각됐는데, 이번 삼성물산·제일모직 합병 의혹에 대한 검찰 수사를 통해 종지부를 찍을지 주목된다. jmkim@newsis.com, keg@newsis.com<ⓒ 공감언론 뉴시스통신사. 무단전재-재배포 금지>",/news/news_read.nhn?article_id=0009882489&office_id=003&mode=search&query=삼성물산&page=4
"'이재용 경영승계' 재판·수사, 종지부 찍을 때 지났다","[더팩트 | 서재근 기자] '카렌시아(Querencia)'. 최근에는 일상에 지친 사람들이 몸과 마음을 쉴 수 있는 안식처를 찾는 현상을 일컫는 말로 쓰이지만, 본래 의미는 투우 경기장에서 생사의 갈림길에 서기 전 마지막으로 소가 잠시 쉬는 공간을 뜻한다. 아무리 긴박한 순간에라도 잠시나마 자신을 위해 쉴 수 있는 공간이 필요하다는 의미에서 이 말은 시공을 초월해 공감을 얻는 것 같다.요즘 국내 기업들이 처한 최근 불확실한 경제 안팎의 상황을 보고 있으면, 오로지 살고자 하는 일념 하나로 투우사와 맞서는 투우를 보는 것만 같다. 약육강식의 논리가 지배하는 '글로벌 시장'이라는 경기장에서 생존이라는 원초적인 목적을 달성하기 위해 동분서주하는 기업 총수들의 상황은 절박함에 내몰린 투우, 그 이상도 이하도 아니다.정상적 사회라면 '경제 전시 상황'에서 분투하는 그들을 격려하고 성원하는 것이 마땅하다. 그런데 우리 사회는 과연 그렇게 하고 있는가. 아니 힘을 북돋워주지는 못 할망정 최소한의 '카렌시아'라도 허용하고 있는가.최근 이재용 삼성전자 부회장의 중국 출장 행보에 경제계 이목이 쏠렸다. 신종 코로나바이러스 감염증(코로나19) 팬데믹으로 굴지의 글로벌 기업인들은 물론 설비엔지니어들조차 방문을 꺼리는 중국 출장길에 오른 이 부회장이 2박 3일 동안 중국과 한국을 오가며 받은 코로나19 검사 횟수만 3차례에 달한다.내부 경영진의 우려와 만류에도 이재용 부회장이 출장을 강행한 배경을 두고 재계 관계자들은 하나같이 ""삼성을 비롯한 국내 대기업이 처한 위기가 어느 정도로 심각한 수준인지 방증하는 사례""라고 입을 모았다.코로나19 여파 속에 미·중 무역갈등 재점화 가능성까지 제기되는 전례 없는 위기 상황 속에서 현장 경영에 고삐를 죄는 총수의 행보는 '자리'가 갖는 무게감과 책임을 고려할 때 어쩌면 당연한 일일 수도 있다.문제는 경영 외적인 요소다. 중국 출장을 마친지 일주일 만인 26일 이 부회장 발길은 공항이 아닌 검찰청을 향했다. 지난 2015년 삼성물산과 제일모직 합병 과정에서 불거진 여러 불법 의혹과 관련해 이 부회장이 과거 그룹 컨트롤타워 역할을 했던 미래전략실에서 지시나 보고를 받았을 가능성을 조사받기 위해서다.'이재용 소환'이라는 단편적인 사실만 두고 보면, 눈길을 끌만한 '이벤트'로 보일지 모르지만, 사실 해당 이슈는 이미 수 년째 이어지고 있는 이 부회장의 재판에서도 수를 헤아리기 어려울 만큼 많이 다뤄졌던 사안이다. 실제로 지난 2018년 6월 이 부회장의 1심 재판 당시 변호인단과 박영수 특별검사팀 양 측은 두 회사의 기업가치를 측정하고, 합병 비율을 산정하는 과정에서의 부당성 유무를 두고 수일에 걸쳐 많게는 기일별로 10시간을 훌쩍 걸친 마라톤 공방을 이어간 바 있다.재계 관계자들이 ""이재용 부회장과 삼성에서도 더는 소명할 것도 남아 있지 않을 것""이라며 측은한 시선을 보내는 것도 이상할 것 없다. 지난 2016년 국정 농단 의혹부터 무려 4년 동안 '삼성 경영권 승계'를 둘러싼 의혹과 관련해 재판을 치르고, 검찰이 별건의 수사를 진행하는 사이 '이재용'이라는 개인은 물론 삼성의 경영 시계는 완전히 멈춰 섰다.더 심각한 문제는 삼성을 향한 일각의 맹목적이면서도 도를 넘어선 비난이다. 최근 정부 여당 국회의원과 일부 시민단체들은 사법부(판사)를 향해 자신들이 '죄인'으로 단정한 이재용 부회장의 단죄를 촉구했다. 삼권분립 원칙 자체를 뒤흔드는 전례 없는 압박에 당시 법조계에서조차 우려의 목소리가 나왔다.어디 그뿐인가 삼성 서초사옥 앞은 이미 '집회의 장'으로 변한 지 오래다. 심지어 이제는 삼성 해고노동자들의 피해 보상 등을 요구하기 위해 구성된 시민단체가 이 부회장의 자택 앞에서 삼겹살에 술을 마시며 노래까지 부르는 사태까지 빚어졌다.범법행위로부터 면죄부를 받을 수 있는 사람은 없다. 그러나 대기업(총수)이라는 이유만으로 일방적인 시달림에 눈을 감을 필요도 없다. 목숨을 걸고 싸우는 투우에게도 잠시나마 '쉴 틈'은 주어진다. 초를 다투는 글로벌 경쟁 시대에 햇수로만 5년 가까이 '사법 리스크'에 발목이 잡혀있는 기업 총수에게 제대로 된 역할을 기대하는 것 자체가 어쩌면 어불성설일지 모른다.likehyo85@tf.co.kr저작권자 ⓒ 특종에 강한 더팩트 & tf.co.kr 무단 전재 및 재배포 금지",/news/news_read.nhn?article_id=0000027122&office_id=629&mode=search&query=삼성물산&page=3
"2015년 삼성물산·제일모직 합병 의혹이재용 첫 소환…특검 조사후 3년여만 각종 혐의 부인…""보고 받은 적 없다""","[서울=뉴시스] 강진아 기자 = 이재용 삼성전자 부회장이 삼성물산과 제일모직 합병 의혹 등과 관련해 검찰에 출석한지 17시간만에 귀가했다.27일 검찰에 따르면 서울중앙지검 경제범죄형사부(부장검사 이복현)는 전날 오전 8시30분부터 이 부회장을 비공개 소환해 조사했다. 이 부회장은 전날 오후 9시까지 검찰 조사를 받았고, 이날 오전 1시30분께까지 조서 열람을 마치고 귀가했다.이 부회장이 이번 사건과 관련해 검찰에 소환된 것은 처음이다. 지난 2017년 2월 국정농단 사건 관련 특검 조사를 받은 이후 3년3개월만이다.이 부회장의 조사는 서울중앙지검 내 영상녹화실에서 진행됐다. 검찰은 이 부회장의 진술내용 등을 살펴본 후 추가 조사 여부를 검토할 예정이다. 검찰 관계자는 ""추가 소환조사 여부 및 일정에 대해 아직 결정된 사항이 없다""고 밝혔다.검찰은 이 부회장을 상대로 삼성그룹 경영권 승계를 위해 삼성물산·제일모직 합병 과정 및 삼성바이오로직스 회계처리 과정 등에 관여했는지 여부를 전반적으로 조사한 것으로 전해졌다.이 부회장은 조사 과정에서 자신과 관련해 제기된 각종 혐의를 강하게 부인한 것으로 전해졌다. 이 부회장은 바이오로직스 회계처리 및 삼성물산·제일모직 합병 등 관련 의혹에 대해 ""보고 받거나 지시한 사실이 전혀 없다""고 진술한 것으로 알려졌다.검찰은 삼성물산과 제일모직이 2015년 합병할 당시, 주식교환 비율을 산정하면서 제일모직의 자회사였던 바이오로직스 기업 가치가 크게 반영된 점 등을 의심하고 있다. 당시 합병비율이 제일모직에 유리하게 이뤄지면서 제일모직 지분만 보유한 이 부회장이 이후 삼성물산의 최대 주주로 올라섰고, 이 과정이 그룹 지배력을 강화하기 위한 일환으로 보고 있다.또 검찰은 바이오로직스의 기업 가치가 높게 평가된 것과 관련해 2012년 미국 회사 바이오젠과 합작해 자회사 바이오에피스를 설립하면서 체결한 콜옵션(주식 주주간 약정) 공시를 고의로 누락했는지 여부도 살펴보고 있다.앞서 금융위원회 산하 증권선물위원회는 지난 2018년 11월 바이오로직스가 2015년 자회사 회계처리 기준을 변경하는 과정에서 고의적인 분식회계를 저질렀다고 보고, 대검찰청에 바이오로직스를 고발했다. 이 사건은 서울중앙지검에 배당됐고, 검찰은 같은 해 12월 바이오로직스와 삼성물산 등을 압수수색하며 강제수사에 본격 나섰다.이후에도 검찰은 삼성그룹 계열사와 국민연금공단, KCC 본사, 한국투자증권 등 여러 곳을 압수수색해 관련 자료를 확보했다.또 미래전략실과 삼성물산 등 그룹 임원들을 연달아 불러 조사했다. 미래전략실 최지성 전 실장(부회장), 장충기 전 차장(사장), 김종중 전 전략팀장(사장)을 비롯해 삼성물산 최치훈 이사회 의장(사장), 이영호 대표, 김신 전 대표 등이 조사를 받았다.검찰은 이 부회장의 조사 내용 등을 검토한 뒤 관련자들 기소 여부와 신병 처리 등을 결정하고 이 사건 수사를 마무리할 것으로 전망된다. akang@newsis.com<ⓒ 공감언론 뉴시스통신사. 무단전재-재배포 금지>",/news/news_read.nhn?article_id=0009882502&office_id=003&mode=search&query=삼성물산&page=3
"檢 ""당사자 요청·인권보호관 허가 거쳐…추가소환 미정""李, 각종 의혹들에 ""보고받거나 지시한 사실 전혀 없다""","(서울=뉴스1) 이장호 기자,서미선 기자 = 이재용 삼성전자 부회장의 삼성물산과 제일모직 합병 및 부정승계 의혹에 대한 검찰의 첫 소환조사가 17시간만에 종료됐다. 이 부회장은 검찰 조사에서 제기된 의혹을 전면 부인했다.27일 검찰에 따르면 서울중앙지검 경제범죄형사부(부장검사 이복현)는 전날(26일) 오전 8시30분께부터 오후 9시께까지 이 부회장을 배임 및 자본시장법 위반 등 혐의 피고발인 겸 피의자 신분으로 불러 조사했다.이 부회장은 이후 이날 오전 1시30분께까지 조서열람을 마친 뒤 조사 시작 17시간만에 귀가했다. 형사사건 공개를 원칙적으로 금지하는 법무부 훈령이 지난해 12월부터 시행됨에 따라 이 부회장은 전날 오전 8시께 검찰에 비공개 출석했다.검찰 관계자는 전날 11시39분 ""오늘 소환조사는 인권보호 수사규칙에 따른 당사자 서면요청과 인권보호관 허가 등 절차를 거쳐 자정 이후까지 진행될 예정""이라고 말했다. 검찰은 이 부회장의 이후 추가 소환조사 여부 및 일정은 아직 결정된 사항이 없다고 밝혔다.이 부회장이 검찰에 피의자로 출석한 것은 박근혜 전 대통령에게 뇌물을 건넨 혐의로 국정농단 특별조사팀이 2017년 2월 소환한 뒤 약 3년3개월 만이다.조사는 영상녹화실에서 진행됐다. 검찰은 이 부회장을 상대로 삼성물산-제일모직 합병 과정과 삼성바이오로직스 회계처리 기준 변경 등과 관련한 의사결정 과정 관여 여부 등을 조사한 것으로 전해졌다.이 부회장은 검찰 조사 과정에 본인에게 제기된 각종 혐의를 강하게 부인했다. 그는 삼성바이오로직스 회계처리 및 삼성물산 합병 등 관련 의혹에 대해 ""보고받거나 지시한 사실이 전혀 없다""고 진술한 것으로 알려졌다.검찰은 2015년 9월 삼성물산이 합병에 따른 회계처리를 하면서 삼성바이오로직스 콜옵션 공시누락 등으로 자본이 잠식되는 문제를 해결하기 위해 분식회계를 했다고 의심한다.이 '삼바 분식회계 의혹'은 삼성그룹 차원에서 이 부회장이 많은 지분을 보유하고 있던 제일모직 가치를 높이고 삼성물산은 낮춰 이 부회장의 경영권 승계에 유리한 합병비율을 도출했다는 정황을 주 배경으로 한다. 그러나 삼성은 합병은 승계작업과는 별개 사안이라고 주장해왔다.검찰은 이와 관련 지난해 9월 국민연금 기금운용본부, 삼성물산, KCC 본사, 삼성생명 본사, 삼성자산운용 등을 전방위 압수수색하며 관련 자료를 확보했다.최근엔 삼성 사장급 임원들을 잇따라 부르며 막판 혐의 다지기에도 나섰다. 이영호 삼성물산 대표와 고한승 삼성바이오에피스 대표, 윤용암 전 삼성증권 대표, 김태한 삼성바이오로직스 대표가 최근 검찰에 잇따라 출석했고 삼성물산 김신 전 대표와 최치훈 이사회 의장(사장), 옛 미래전략실 장충기 전 차장(사장) 등도 관련해 조사를 받았다.검찰은 당초 이달까지 이 사건 수사를 마무리한다는 목표를 세웠으나 신종 코로나바이러스 감염증(코로나19) 사태로 소환조사가 주춤했던데다 조사 내용이 방대해 종료시점은 다소 늦춰질 것으로 예상된다.검찰은 관련자들 구속과는 별개로 소환조사를 통해 혐의를 쌓고, 이 부회장을 조사한 뒤 일괄기소하는 방침을 세운 것으로 알려졌다.smith@news1.kr© 뉴스1코리아(), 무단 전재 및 재배포 금지",/news/news_read.nhn?article_id=0004659909&office_id=421&mode=search&query=삼성물산&page=3
"검찰 소환조사서 혐의 전면 부인檢, 핵심관계자 구속영장 가능성17시간 조사받고 27일 새벽 귀가","[서울경제] 이재용(52)
부회장이 검찰 소환 조사에서 관련 혐의를 전면 부인했다. 27일 법조계에 따르면 서울중앙지검 경제범죄형사부는 전날 오전 8시 30분쯤 이 부회장을 배임과 자본시장법 위반 등 혐의 피고발인 신분으로 불러 조사한 뒤 이날 오전 1시 30분쯤 돌려보냈다. 17시간에 걸친 조사였다. 이 부회장은 이날 검찰 조사에서 삼성바이오로직스 회계처리 및 삼성물산 합병 등을 둘러싼 의혹에 대해 “(해당 과정에 대해) 보고받거나 지시한 사실이 전혀 없다”고 답한 것으로 전해졌다. 이는 삼성의 기존입장과 같은 맥락이다. 삼성 측은 그동안 각종 의혹에 대해 사실이 아니라는 입장을 밝혀왔다. 기업 가치를 고의로 조작한 적이 없고 이른바 ‘승계 프레임’도 잘못된 확대해석이라는 주장이다. 애초 증권선물위원회가 제일모직 자회사인 삼성바이오로직스의 분식회계 의혹을 고발한 사건이 승계 프레임으로 변형했다는 것이었다.반면 검찰은 삼성물산·제일모직 합병 이후 삼성바이오로직스 회계 변경 과정에서 이 부회장이 그룹 미래전략실 등에서 보고를 받거나 지시를 내린 게 아닌지 의심하고 있다. 이들 과정이 모두 경영권 승계를 위함이고 그 한가운데 이 부회장이 자리하고 있지 않겠느냐는 것이다. 이에 따라 검찰은 이날 이 부회장을 불러 조사하면서 삼성물산·제일모직 합병 과정에서 불거진 각종 의혹에 그가 연루됐는지를 집중 조사했다. 이 부회장이 검찰에 출석한 건 해당 수사가 착수한 지 1년 6개월 만이다. 이 부회장은 지난 2017년 2월 박근혜 전 대통령에게 뇌물을 건넨 혐의로 박영수 특별검사팀에 구속돼 수사를 받은 지 3년 만에 검찰에 소환됐다. 다만 이날 소환은 ‘형사사건 공개금지 등에 관한 규정’에 따라 비공개로 이뤄졌다.법조계의 한 관계자는 “조사할 분량이 많은데다 양측이 첨예하게 대립하고 있어 검찰은 최소 한 차례 이상 이 부회장을 추가로 불러 조사할 가능성이 있다”고 분석했다. 이어 “검찰은 구속수사 시도 등 신병확보에 나설 수 있다”며 “다만 검찰·삼성 변호인단 간 치열한 공방이 이어질 수 있는데다 검찰 수뇌부와 수사팀도 이를 두고 의견충돌을 빚은 바 있어 결정이 쉽지 않다”고 덧붙였다. /안현덕·손구민기자 always@sedaily.com저작권자 ⓒ 서울경제, 무단 전재 및 재배포 금지",/news/news_read.nhn?article_id=0003743210&office_id=011&mode=search&query=삼성물산&page=3
삼바 회계 등 관련 3년만에 출석… 李 보고받거나 지시한 사실 없다,"삼성바이오로직스 관련 의혹을 수사 중인 검찰은 26일 이재용 삼성전자 부회장을 피고발인 신분으로 비공개로 불러 조사했다. 이 부회장이 검찰 조사를 받은 것은 2017년 2월 국정농단 사건 이후 약 3년 3개월 만이다.
서울중앙지검 경제범죄형사부(부장검사 이복현)는 이 부회장을 상대로 2015년 삼성물산과 제일모직 합병 과정, 제일모직 자회사인 삼성바이오의 분식회계 의혹 등을 조사했다. 검찰은 2015년 삼성물산과 제일모직 합병 당시 이 부회장이 최대 주주였던 제일모직 가치는 부풀리고 삼성물산 가치는 고의로 낮춘 것으로 보고 있다. 앞서 금융위원회 산하 증권선물위원회는 2018년 11월 삼성바이오의 분식회계 의혹을 검찰에 고발했다. 이 부회장은 검찰 조사에서 삼성물산 합병과 삼성바이오 회계 처리 의혹 등에 대해 “보고 받거나 지시한 사실이 전혀 없다”며 강하게 부인한 것으로 알려졌다.
삼성은 이 부회장의 조사에 대한 공식적인 입장은 밝히지 않았다. 다만 삼성은 그동안 “분식회계로 기업 가치를 높인 게 아니라는 것은 이미 현재의 기업 가치로 증명됐다”며 “삼성바이오가 시가총액 약 42조 원으로 국내 시총 3위 기업이 되면서 오히려 삼성바이오 주식 42%를 보유한 합병 삼성물산 주주들이 이익을 보고 있는 셈”이라고 밝힌 바 있다.신동진 shine@donga.com·김현수 기자ⓒ 동아일보 & donga.com, 무단 전재 및 재배포 금지",/news/news_read.nhn?article_id=0003288294&office_id=020&mode=search&query=삼성물산&page=3
