head,text,url
대형사 '격돌'…신반포21차·반포3주구·한남3구역 최종 시공사 선정,"[아이뉴스24 김서온 기자] 서울 강남권을 비롯해 대장주 단지의 정비사업 최종 시공사 선정을 위한 열띤 수주전 이어지고 있다. 지난달 말 신반포15차 재건축 수주전이 정비업계를 떠들썩하게 한 가운데 이달 말에는 주요 정비사업장의 최종 시공사 선정이 예정돼 있다.10일 정비업계에 따르면 공사비 8천87억원 규모의 서울 서초구 반포동 '반포3주구' 조합은 오는 30일 총회를 열고 시공사 선정에 나선다. 오는 19일 1차 합동설명회를 개최하고, 20일부터 단지 내 홍보관을 운영한다.반포3주구 재건축 수주전에는 대우건설과 삼성물산이 참여했다. 대우건설은 입찰 마감일 하루 전날 입찰을 마쳐 기호 1번을 받았다. 또 선분양, 후분양, 재건축리츠 등 조합원의 이익을 극대화 할 수 있는 다양한 분양방식을 제안해 눈길을 끌고 있다.지난달 23일 신반포15차 재건축 시공사 선정 총회에서 압도적인 표차이로 5년 만에 정비업계에 복귀한 삼성물산은 아파트 브랜드 '래미안'의 가치와 차별화된 시공능력을 내세웠다. 또한 삼성물산은 이번 입찰제안서에서 일반적인 후분양과 달리 '100% 준공 후 분양' 카드를 들고 나왔다. 일반적인 후분양은 골조공사가 완료된 시점에서 분양하나, 삼성물산은 골조공사가 아닌 전체 공사가 마무리 된 이후 분양하는 방안을 제시했다.이외에도 과열된 수주전 분위기로 한 차례 시공사 선정과정이 무산된 강북 재개발 '최대어' 한남3구역도 최종 시공사 선정 총회를 이달 말 연다. 서울 용산구 '한남3구역' 재개발 사업은 공사비 1조9천억원, 전체 사업비 7조원 규모로 역대 재개발 사업중 가장 큰 사업 규모를 자랑한다.한남3구역은 코로나19로 인해 한달 정도 연기된 오는 31일 총회를 열어 시공사를 정할 계획이다. 서울 용산구 한남동 일대 38만6천395㎡ 부지에 분양 4천940가구, 임대 876가구 등 5천816가구를 짓는 초대형 사업지다. 지난 3월 마감한 입찰에는 앞서 진행된 1차 입찰과 동일한 대림산업, 현대건설, GS건설 3곳이 출사표를 던졌다.신반포21차 재건축 수주전은 GS건설과 포스코건설의 2파전이다. 오는 28일 시공사 선정 총회를 열 계획이다. 서울 서초구 잠원동 일대를 재건축해 지하 4층∼지상 20층, 아파트 2개동, 275가구를 짓는 프로젝트다. 예상 공사비는 1천20억원 정도다.GS건설은 신반포21차 단지명을 '반포 프리빌리지 자이'로 제안하고 인근 자이 단지와 연계한 7천370여가구의 대규모 브랜드 타운 조성한다는 계획이다. 2개동, 275가구 규모에 불과한 소규모 단지 신반포21차를 반포자이와 GS건설이 수주한 신반포4지구와 연계해 단지의 가치를 높이겠다는 것이다.포스코건설은 신반포21차 조합원의 금융부담이 없는 후분양을 제안했다. 통상 후분양은 조합측에서 공사비를 조달해 이자를 부담해야 하지만 포스코건설은 공사비 대출 없는 조건을 제안해 조합의 이자부담을 없앴다. 대출 절차에 소요되는 일정도 없어 사업 지연 가능성을 낮췄다. summer@inews24.com [ⓒ 아이뉴스24 무단전재 및 재배포 금지]",/news/news_read.nhn?article_id=0000537544&office_id=031&mode=search&query=삼성물산&page=1
,"[디지털타임스 박상길 기자] 서울 용산 부동산 시장에 지난 2018년 박원순발 통개발 사태의 후폭풍이 재현될 조짐이다. 정부가 지난 6일 투기 수요 방지 대책도 없이 불쑥 용산 정비창 부지에 8000가구급 미니신도시를 짓겠다고 발표하면서다. 대형 호재에 한동안 잠잠했던 용산 일대 주택 시장이 달아오를 조짐을 보이자 부랴부랴 투기 억제책을 내놓겠다고 했지만, 이미 불붙은 가격 상승세를 진화하긴 어려울 것이란 지적이 나온다.10일 부동산 업계에 따르면 5·6 수도권 공급 대책이 발표된 직후 2∼3일간 용산 정비창 부지와 인접한 단지의 부동산 공인중개업소들은 일시적인 업무 마비를 겪었다. 정비창 부지와 가까운 서부이촌동 중산시범아파트 일부 집주인들은 급매물 회수에 나섰고 ""이번에는 정말 개발되는 건지"", ""투자성은 얼마나 되는지"" 등을 묻는 전화가 폭주했다. 정비창 부지와 대로 하나를 둔 용산동 5가와 동부이촌동 일부 아파트에서도 비슷한 상황이 연출됐다.용산 정비창 부지 바로 앞에 위치한 용산정비창 전면1구역도 대책 발표 이후 매수 문의가 늘었다. 서울 다른 재개발 지역보다 용적률이 높아 사업성이 좋은 데다, 교통·개발 호재가 많다는 이유로 지분 거래 시세가
크게 올랐다. 대지지분 3.3㎡당 시세는 단독주택이 8500만∼1억원, 다세대주택(빌라) 1억9000만∼2억원대다. 용산 정비창 부지는 워낙 입지가 좋다보니 예비 청약자들도 높은 관심을 보였다. 이처럼 용산 주택 시장이 다시 과열 조짐을 보이자 정부는 토지거래허가구역 지정을 검토하고 있다. 그러나 이 소식이 알려지자 용산 일대 부동산 중개사들은 아직 적극적인 매수 문의가 손에 꼽을 정도라며 과열 조짐을 일축했다.매물이 많지 않을뿐더러 단순한 가격 문의만 있을 뿐, 당장 사겠다는 사람도 없다는 게 공인중개업소의 설명이다. 공인중개업소들은 정부 발표로 주말간 잠시 주택 시장 분위기가 들썩거렸으나 빠르게 진정될 것으로 관측했다. 일부 공인중개업소에서는 이미 발표 직후 쏟아졌던 매수 문의가 줄고 있다.정비창 부지는 2006년 '한강르네상스' 사업과 연계해 사업비 31조원이 투입되는 용산국제업무지구로 개발될 예정이었다. 이듬해 연말 삼성물산 컨소시엄이 개발사업자로 선정됐고 2008년 서부 이촌동 주민들을 상대로 도시개발사업 동의서를 받기도 했으나 글로벌 금융위기 여파로 무산됐다. 이후 2018년 박원순 서울시장이 '여의도·용산 개발 마스터플랜' 구상을 언급하면서 용산국제업무지구 개발 사업이 재차 주목을 받았지만 정부가 시장 과열을 이유로 계획을 무기한 보류했다. 용산 아파트값은 통개발 사태로 롤러코스터를 탔다. 한국감정원에 따르면 2018년 6월 보합(0.00%)을 기록했던 용산 아파트 매매가격 변동률은 두 달 만에 0.45%까지 급등했다가 개발 계획 이 취소된 뒤 -0.02%로 급락했다. 이후 작년 6월까지 한동안 마이너스 하락장을 이어갔다.정비창 부지 인근 집주인들은 정부의 이번 대책이 호재가 아닌 악재라며 불만을 쏟아내고 있다. 당초 국제업무지구 개발계획과 비교해 경쟁력을 강화할만한 상업·업무 시설이 줄고 전체 8000가구 중 2000가구 이상은 임대아파트가 들어선다는 것은 얼토당토않은 소리라는 지적이다. 장재현 리얼투데이 리서치본부장은 ""정비창 부지에는 주거공간이 많지 않기 때문에 희소성이 높아 토지거래허가구역으로 묶는다 하더라도 가격 상승을 막기 어려울 것""이라고 말했다. 장재현 본부장은 ""정비창 부지를 규제하더라도 인근 아파트 단지의 가격이 호재로 급등하게 되면 새 아파트 분양가 자체가 높아져 '공공 아파트 공급'이라는 당초의 대책 취지도 무색해질 것""이라고 설명했다. 박상길기자 sweatsk@dt.co.kr 디지털타임스
/",/news/news_read.nhn?article_id=0002597064&office_id=029&mode=search&query=삼성물산&page=1
광명·부평·흑석·수색 등 뉴타운 지역 정비사업 주목,"오는 7월까지 서울 경기 인천 등 수도권에서 알짜 재개발 아파트가 쏟아진다. 신종 코로나바이러스 감염증(코로나19)으로 주춤했던 분양이 본격화된 데다 분양가 상한제가 시행되기 전 공급에 나서는 단지가 늘어날 것으로 보여서다. 주택법 시행령 일부 개정안에 따르면 7월 28일까지 일반분양분에 대한 입주자 모집 공고를 마칠 경우 분양가 상한제를 피할 수 있다.부동산114에 따르면 7월까지 수도권에 공급되는 재개발 아파트는 18곳, 1만7604가구다. 이 중 조합원 물량을 제외한 일반분양분은 7521가구다. 짧은 기간에 공급이 집중되는 만큼 청약가점이 상대적으로 낮은 30~40대에게는 기회가 될 전망이다. 분양가 상한제 이후에는 아파트값이 낮아지지만 그만큼 청약자가 몰리면서 청약가점 고점자만 당첨될 확률이 높아진다. 거주의무 기간도 있어 시세 차익을 감안한 청약자라면 오히려 부담이 될 수 있다. 또 조합들이 분양 시기를 저울질하거나 눈치 보기에 들어간다면 분양 시기를 가늠하기 어려울 수 있다.앞서 공급됐던 재개발 아파트들은 청약에서 높은 경쟁률을 나타냈다. 서울에서 재건축을 통해 공급되는 아파트는 주로 강남에 몰려 있다 보니 분양가가 높은 편이다. 재개발 아파트는 상대적으로 가격은 낮으면서도 강북 주거지역에서 주로 나오다 보니 실수요자들의 관심이 높다. 올해 첫 재개발 아파트는 양천구 신정재정비촉진지구 2의 2구역을 재개발한 ‘호반써밋 목동’이었다. 1순위에서 138가구 분양에 1만7671명이 신청했다. 평균 청약 경쟁률은 128 대 1을 기록했다.인천과 경기에서도 인기다. 인프라가 풍부한 도심권에서 주로 나오기 때문이다. 서울보다 상대적으로 대출이나 규제 부담이 덜한 게 장점이다. 일부 지역은 분양권 전매도 가능하다. 실수요자뿐만 아니라 투자자들의 관심이 높은 이유다. 지난달 인천 부평구 목련아파트를 재개발해 분양에 나선 ‘부평역 한라비발디 트레비앙’은 상반기 역대 최고 청약 경쟁률인 251 대 1로 1순위에서 청약을 마감했다. 특별공급을 제외한 53가구 모집에 1만3351명이 몰렸다. 지난 2월 경기 수원시 팔달8구역 ‘매교역 푸르지오 SK뷰’ 청약에서도 15만 명 이상이 몰리면서 지역 내 최고 경쟁률을 기록했다.분양권에 억대의 웃돈이 붙고 있다. 국토교통부 실거래가 공개시스템에 따르면 경기 광명시 광명뉴타운 16구역에 들어서는 ‘광명에코자이위브’ 전용 84㎡는 2월 분양가보다 2억5000만원 오른 7억9585만원에 거래됐다. 경기 부천시 계수 범박 재개발 단지인 ‘부천 일루미스테이트’ 전용 84㎡ 분양권도 전매제한이 풀린 3월 6억6113만원에 손바뀜했다. 분양가보다 1억원 이상 오른 가격이다.재개발 아파트는 도심과 가까운 곳이 많고 주거환경이 개선되다 보니 청약자들의 관심이 높다. 특히 이달부터 공급되는 재개발 아파트는 수도권 인기 뉴타운에서도 나온다. 주변에 개발이 동시에 진행 중이어서 뉴타운이 완성되면 미니 신도시를 기대할 수 있는 지역이다.대우건설은 이달 광명시 광명뉴타운 15구역을 재개발하는 ‘광명 푸르지오 센트베르’를 분양한다. 총 1335가구 중 464가구가 일반에 공급된다. SK건설과 한진중공업은 인천 부평구 부개서초교북측구역주택 일대를 재개발하는 ‘부평 SK뷰 해모로’를 내놓는다. 총 1559가구 중 883가구가 일반분양분이다.서울에서는 도심권 주요 지역에서 아파트가 공급된다. GS건설은 동작구 흑석동 흑석3구역을 재개발하는 ‘흑석 리버파크자이’를 선보인다. 1772가구 중 357가구를 일반에 공급한다. 삼성물산은 동대문구 용두6구역에서 ‘래미안 엘리니티’ 1048가구(일반분양 477가구)를 공급한다. 분양가 상한제 시행 전인 7월에는 GS건설이 증산2구역, 수색6구역, 수색7구역 등 은평구에서 막바지 분양에 나설 계획이다.김하나 한경닷컴 기자 hana@hankyung.com▶ ▶
 ▶
ⓒ 한국경제 & , 무단전재 및 재배포 금지",/news/news_read.nhn?article_id=0004337641&office_id=015&mode=search&query=삼성물산&page=1
6월 3일까지 한남 플래그십 스토어에서 '팝업 스토어'도,"(서울=뉴스1) 조현기 기자 = 삼성물산 패션부문 컨템포러리 멀티숍 '비이커'(Beaker)는 '바이에딧'(By Edit)과 협업해 '샐러드 에디션(Salad Edition) 캡슐 컬렉션'을 출시했다고 10일 밝혔다. 비이커는 회화적이고 아름다운 샐러드 한 그릇에서 이번 컬렉션의 영감을 받은 것을 가방 등 액세서리에 창의적으로 표현했다.
이번에 선보인 상품은 Δ에딧백·레터백 Δ메신저백 Δ큐빅백 Δ에코백 등 총 4개다. 한남 및 청담 플래그십 스토어와 삼성물산 패션부문 통합 온라인몰 SSF샵에서 구매할 수 있다.한편 비이커는 다음달 3일까지 한남 플래그십 스토어에서 '샐러드 에디션' 팝업 스토어를 연다.비이커 관계자는 ""신선하고 독창적인 문화 콘텐츠를 지속적으로 발굴해 밀레니얼 세대와 진정성있는 소통을 이어나갈 계획""이라고 강조했다.chohk@news1.kr© 뉴스1코리아(), 무단 전재 및 재배포 금지",/news/news_read.nhn?article_id=0004629516&office_id=421&mode=search&query=삼성물산&page=1
,"비이커 바이에딧 한남 플래그십 스토어. 제공|삼성물산 패션부문[스포츠서울 양미정 기자]삼성물산 패션부문의 컨템포러리 멀티숍 ‘비이커’가 재미있는 컬러 조합과 참신한 콘셉트로 유명한 ‘바이에딧’과 협업해 샐러드 에디션 캡슐 컬렉션을 출시했다.비이커는 매 시즌 밀레니얼 세대와의 차별화된 소통을 확대하는 차원에서 라이프스타일 브랜드와 협업을 진행하고 있는데 이번 시즌에는 다양한 수납공간과 컬러풀한 디자인이 특징인 바이에딧과 작업을 함께 했다. 특히 비이커는 회화적이고 아름다운 샐러드 한 그릇에서 영감을 받아 가방과 티셔츠 등에 동심을 담아 창의적으로 표현했다. 푸릇푸릇 한 봄나물, 핑크빛 샤퀴테리, 한여름의 감자, 우유빛 치즈와 화이트 아스파라거스, 태양을 한껏 머금은 가을 채소, 봄의 시작을 알리는 딸기 등 아이템별 독특한 컬러 매칭과 프린트가 인상적이다.샐러드 에디션은 크로스백과 토트백으로 활용이 가능하고 안주머니를 빼면 다른 스타일링이 가능한 시그니처 에딧백, 실용적인 수납과 스트링 디자인이 돋보이는 메신저백, 동그라미·세모 등 도형 포켓이 포인트인 숄더백 뿐 아니라 샐러드 디자인 프린트로 평범하지만 차별화된 디자인의 에코백 등으로 구성됐다. 에딧백, 레터백, 메신저백은 자두·오렌지·아보카도 등으로 디자인된 참(Charm)이 달려있어 가방의 아이덴티티를 한 번 더 강조한다.송태근 비이커 팀장은 “매 시즌 독창적인 협업으로 주목받고 있는데 이번 시즌에는 유니크한 컬러 조합과 참신한 콘셉트의 바이에딧과 작업을 진행했다. 신선하고 독창적인 문화 콘텐츠를 지속적으로 발굴해 밀레니얼 세대와 진정성있는 소통을 이어나갈 계획”이라고 말했다. certain@sportsseoul.com[기사제보 news@sportsseoul.com]
Copyright ⓒ 스포츠서울&",/news/news_read.nhn?article_id=0000656793&office_id=468&mode=search&query=삼성물산&page=1
,"[머니투데이 박소연 기자] [신사업 도전 주목…시스템반도체 등 대형 M&A 가능성] 이건희 삼성전자 회장이 병상에 누운 지 만 6년이 지났다. 아직까지 건강 회복 조짐은 보이지 않는다. 이재용 부회장은 최근 대국민 사과를 통해 '뉴(new) 삼성'을 선언하면서 삼성이 중대한 전환점을 맞고 있다. 10일 재계에 따르면 이건희 회장은 서울 강남구 삼성서울병원 VIP 병실에 만 6년째 입원 중이다. 여전히 의식은 없지만 자가호흡을 하며, 건강이 크게 악화되진 않은 것으로 알려졌다. 이 회장은 2014년 5월10일 서울 용산구 이태원동 자택에서 급성 심근경색으로 쓰러져 병원으로 옮겨졌고, 이후 이재용 부회장이 총수 역할을 맡아왔다.이 기간 삼성은 대격변을 겪었다. 삼성전자는 2017~2018년 메모리반도체 슈퍼 사이클을 맞으며 2년 연속 인텔을 누르고 글로벌 반도체 매출 1위를 차지했다. 하지만 2018년 하반기부터 D램과 낸드플래시 등 주력 제품이 하락하는 위기를 맞았고, 지난해에는 반도체 매출 1위 자리를 인텔에 내줬다. 2016년 말 불거진 국정농단 사태로 이 부회장이 2017년 2월 구속돼 삼성은 1년여간 총수 부재 사태를 겪어야 했다. 이같은 총수의 사법 리스크는 3년이 훨씬 지난 현재까지 끝나지 않았고, 파기환송심 재판이 진행 중이다. 이외에도 삼성전자서비스 노조 와해, 삼성바이오로직스 분식회계 등 다른 재판도 이어지며 사법 리스크가 삼성의 발목을 잡았다. 이 부회장은 조만간 삼성물산과 제일모직 합병을 둘러싼 삼성의 경영권 승계 논란과 관련해 검찰 소환 조사를 받을 전망이다. 이런 외환 속에서 이재용 부회장은 새로운 변화를 강조하고 나섰다. 지난 6일 이 부회장이 직접 발표한 대국민 사과에서 '뉴 삼성'으로의 변화 의지를 강하게 내비쳤다. 이 부회장은 '4세 경영 포기'와 '무노조 경영 종식'을 공식 선언했다. 이 부회장의 사과와 입장 표명에 삼성 준법감시위원회도 그 진정성을 인정했다. 이 부회장은 ""2014년 회장님(이건희 회장)이 쓰러지시고 난 뒤 미래 비전과 도전 의지를 갖게 됐다""며 ""한 차원 더 높게 비약하는 새로운 삼성을 꿈꾸고 있다""고 강조했다. 이 부회장은 뉴 삼성을 실현할 핵심 키워드로 '과감한 신사업 도전', '전문성, 통찰력을 갖춘 경영', '미래를 이끌 인재 영입'을 제시했다. 주력사업인 반도체의 경우 메모리반도체보다 발전 가능성이 큰 '시스템반도체' 분야의 비약적 발전을 추진할 방침이다. 오는 2030년까지 시스템반도체 1위에 오른다는 삼성의 '반도체 비전 2030' 달성을 위해 이 부회장은 앞으로 10년간 100조원을 반도체 투자에 쏟아붓는다.
 삼성전자가 대규모 인수합병(M&A)을 통해 뉴 삼성의 기치를 높일 수 있다는 관측도 나온다. 삼성전자가 보유한 순현금은 올해 1분기말 기준 97조5000억원으로 역대 최고 수준이다. 삼성전자는 2016년 미국의 하만을 9조원대 인수한 이후 대규모 인수합병에 나서지 않았다. 2016년 한 해 동안 1000억원이 넘는 M&A만 6건을 성사시켰으나 2017년부터 지난해까지 3년간은 인수합병이 연 2~3건 수준에 그쳤다. 그나마 인수한 기업들은 대부분 규모가 작은 스타트업으로 총수의 사법리스크가 적극적인 경영 행보를 가로 막았다는 진단도 들렸다. 업계 한 관계자는 ""삼성이 미래 성장동력 발굴에 사실상 손을 놨다는 얘기까지 나왔다""며 ""하지만 이 부회장이 뉴 삼성을 공식화한 만큼 이제 1조원 이상의 대형 M&A도 기대해본다""고 밝혔다.
재계에선 삼성전자가 인공지능(AI)이나 전장(전자 장비) 부품, 바이오, 5세대 이동통신(5G), QD(퀀텀닷)디스플레이, 시스템반도체 등을 우선 투자 대상으로 삼고 있다고 분석한다.
노화욱 반도체산업구조선진화연구회장은 ""삼성이 '반도체 비전 2030' 달성하기 위해선 유망한 해외 팹리스(반도체 설계 전문업체) 인수가 필수적""이라며 ""파운드리(반도체 위탁생산)는 삼성이 메모리 공정기술을 기반으로 독자적으로 성장시킬 수 있지만 팹리스는 미국에 크게 뒤처져 있다""고 밝혔다. 그는 ""삼성이 이 부회장을 서포트하는 내부 조직을 관리 중심에서 기술 중심으로 바꿔야 한다""며 ""미래 기술과 시장을 제대로 예측하고 삼성의 기술 로드맵을 전략적으로 세울 조직이 절실하다""고 덧붙였다.박소연 기자 soyunp@mt.co.kr
<저작권자 ⓒ '돈이 보이는 리얼타임 뉴스' 머니투데이, 무단전재 및 재배포 금지>",/news/news_read.nhn?article_id=0004406358&office_id=008&mode=search&query=삼성물산&page=1
