head,text,url
,"이촌현대. 출처|네이버부동산[스포츠서울 김효원기자]재개발·재건축·리모델링 등 도시정비사업을 둘러싸고 조합원과 시공사 사이에 갈등이 증폭되고 있다.정부의 고강도 재건축 규제로 인해 신규 건설시장이 축소되면서 재개발·재건축 등 도시정비사업을 놓고 건설사간 경쟁이 치열한 상황이다. 이미 수주를 한 건설사의 경우에는 조합과 시공사간 공방이 벌어지기도 하는 등 잡음이 지속적으로 발생하고 있다.최근 서울 용산구에 위치한 이촌동 현대아파트(이하 이촌현대)가 리모델링 사업을 두고 시공사인 포스코건설과 조합간 법적 공방을 예고했다. 이촌현대 리모델링조합은 23일 긴급총회를 열고 ‘포스코건설과의 공사 도급 가계약 및 공동사업 시행 협약 해지’ 안건을 논의했다. 이 안건은 조합원 89.7%가 찬성해 통과됐다. 조합측은 포스코건설과의 계약을 해지하는 사유로 공사비 증액과 증액 사유 소명 미비 등을 꼽았다. 포스코건설이 4년동안 35% 수준의 공사비 증액을 요구했으며 세부 내역을 알려주지 않았고 조합장을 미행하기도 했다고 조합측은 주장했다.조합의 이같은 결정에 포스코건설은 정부가 고시한 건설물가 상승분 및 법규 강화에 따라 추가 공사가 필요한 부분이 있어 불가피하게 증액됐다면서 조합장 미행·사찰은 사실이 아니라고 법적대응을 검토 중이라고 밝혔다. 또한 조합에서 계약해지를 일방적으로 진행하다면 시공사 지위를 유지하기 위한 법적조치도 마련하겠다는 입장이어서 진통이 예상된다.조합이 시공사를 교체한 사례는 그동안 꾸준히 있었다. 앞서 지난해 12월 신반포15차는 시공사인 대우건설과 설계변경 등으로 인한 증액 금액과 관련해 이견을 보이다 대우건설과 계약해지하고 최근 삼성물산 건설부문을 새로운 시공사로 선정했다. 반포3주구 역시 조합 측이 시공사였던 HDC현대산업개발과 계약을 해지하고 새로운 시공사를 선정하는 절차를 진행하고 있다.조합원이 조합장을 해임하는 사례도 잇따라 나오고 있다. 서울 동작구 흑석3구역 재개발 비상대책위원회(이하 흑석3비대위)는 지난 9일 임시총회를 열고 조합장 및 이사, 감사 등 해임안을 가결했다. 흑석3비대위 측은 흑석인근 재개발과 비교해 일반분양가가 낮고 사업 진행이 느리며 입찰 담합 의혹이 있다는 등의 사유를 들어 집행부를 해임했다. 흑석9구역 재개발 비상대책위원회 역시 지난 14일 조합장 해임안을 가결했다. 시공사의 설계 및 사업진행 속도 등이 조합원들의 기대에 미치지 못했다는 이유다.그런가 하면 조합장 해임 카드를 만지작거리는 조합도 있다. 강동구 둔촌주공아파트 재건축 조합이나 한남3구역 재건축 조합 역시 조합원들이 조합장 해임안을 논의 중인 것으로 알려져 있다. 한남3구역의 경우에는 시공사 선정 총회를 앞두고 있기 때문에 조합장 해임안이 시공사 선정 시기를 좌우할 수 있어 주목받고 있다.이처럼 도시정비 사업을 둘러싸고 시공사 교체나 조합장 교체 등 갈등이 지속되는 가운데 업계에서는 “시공사 교체는 법적인 공방 등으로 인한 비용 부담과 사업지연으로 인한 손해 등을 조합원이 떠안아야 한다는 점에서 신중하게 접근해야 하는 사안”이라고 진단했다.eggroll@sportsseoul.com[기사제보 news@sportsseoul.com]
Copyright ⓒ 스포츠서울&",/news/news_read.nhn?article_id=0000661934&office_id=468&mode=search&query=삼성물산&page=1
제기4구역은 현대건설 수주,"공사비 규모만 9200억원에 달하는 강북 '재개발 대어' 갈현1구역 재개발 시공사로 우여곡절 끝에 롯데건설이 최종 선정됐다. 24일 부동산 업계에 따르면 갈현1구역 재개발 조합은 지난 23일 서울 서대문구 스위스그랜드호텔에서 총회를 열고 롯데건설을 시공사로 최종 선정했다. 유일한 입찰후보인 롯데건설은 총회에 참석한 1769명 조합원 가운데 1555명(87.9%)의 지지를 얻어 수의계약 형태로 조합과 계약을 체결하게 됐다. 예정된 단지 이름은 '북한산 시그니처 캐슬'이다. 롯데건설 관계자는 ""끝까지 믿고 응원해주신 갈현1구역 조합원들께 감사하다""며 ""전폭적인 지지를 받은 만큼 최고의 단지를 만들어 보답하겠다""고 밝혔다.갈현1구역은 공사비 규모만 9200억원에 달해 강북 최대 재개발 사업지 중 한 곳으로 꼽힌다. 해당 구역은 지하 6층~지상 22층 32개동 4116가구 규모 새 아파트 단지로 거듭날 예정이다. 앞서 갈현1구역 입찰에는 롯데건설과 현대건설이 참여해 경쟁을 벌였다. 하지만 조합 측이 현대건설의 입찰제안서 내용에 하자가 있다는 이유로 지난해 10월 대의원회의를 열어 현대건설의 입찰 자격을 박탈했다. 이후 재입찰을 실시했지만 롯데건설이 단독 입찰하며 시공사 선정이 2회 연속 유찰돼 결국 수의계약 방식으로 전환됐다. 이후 조합원 총회에서 투표를 거쳐 유일한 후보였던 롯데건설이 시공사로 최종 선정된 것이다.한편 서울 동대문구 제기4구역 재개발 조합 역시 같은 날 세종대왕기념관에서 총회를 열고 현대건설을 시공사로 선정했다. 제기4구역은 지하 2층~지상 25층 11개동 909가구 규모 새 아파트 단지로 조성될 예정이다. 공사비는 1589억원 규모다. 향후 코로나19 사태로 총회 개최를 연기했던 조합들이 잇달아 시공사 선정에 나설 전망이다. 오는 30일에는 반포3주구 재건축 조합이 입찰 후보인 삼성물산, 대우건설을 놓고 시공사 선정에 나선다. 다음달 21일께에는 한남3구역 재개발 조합이 시공사를 선정할 예정이다.
 [정지성 기자] [ⓒ 매일경제 & mk.co.kr, 무단전재 및 재배포 금지]",/news/news_read.nhn?article_id=0004581016&office_id=009&mode=search&query=삼성물산&page=1
주요국 중 저점 대비 상승률 '최고'비대면·바이오株가 반등 이끌어,"한국 증시가 주요국 가운데 가장 빨리 신종 코로나바이러스 감염증(코로나19) 공포에서 벗어나고 있는 것으로 나타났다. ‘포스트 코로나’에 대한 기대로 정보기술(IT)과 바이오 관련주가 급등한 영향이다.코스피지수는 지난 22일 1970.13으로 마감했다. 코로나19 확산 소식에 연중 최저점(1457.64)을 찍었던 지난 3월 19일보다 35.2% 높은 수준이다. 코스닥지수는 더 크게 반등했다. 두 달 전 최저점(428.35) 대비 65.4% 상승한 708.58까지 회복했다.한국 증시의 저점 대비 상승률은 주요국 가운데 가장 높다. 미국 뉴욕증시의 다우존스30산업평균지수와 S&P500지수는 저점 대비 각각 31.5%, 32.1% 올랐다. 기술주 중심의 나스닥은 35.9% 상승했지만, 코스닥 상승률보다는 낮았다.독일 DAX지수(31.2%), 영국 FTSE 100(20.0%), 프랑스 CAC40(18.4%), 호주 ASX200(20.9%) 등도 한국 증시 반등 수준에 못 미쳤다. 아시아 시장에서도 마찬가지다. 일본 닛케이지수 상승률(23.2%)이 코스피지수보다 낮았다.한국 증시가 다른 나라들보다 상대적으로 크게 떨어졌기 때문에 반등폭이 컸던 측면도 있지만, 비대면·바이오 관련주도 증시 상승을 이끌었다. 올해 초만 해도 유가증권 시가총액 상위 종목에 이름을 올렸던 현대모비스, 포스코, 삼성물산 등 전통적 제조업이 10위 밖으로 밀려났고, 현대차는 간신히 턱걸이했다. 이들 대신 삼성SDI와 카카오 등이 10위권으로 들어왔다.삼성바이오로직스와 네이버가 전체 시총에서 차지하는 비중은 올해 초 1.94%와 2.06%에서 각각 3.09%와 2.86%로 높아졌다. 카카오는 코로나19 사태를 겪으며 시장 예상치를 웃도는 실적과 포스트 코로나 시대에 대한 기대로 9위까지 뛰어올랐다. 코스닥에서는 셀트리온제약과 씨젠, 알테오젠 등 바이오, 진단키트 관련주가 상위권을 장악했다.고재연 기자 yeon@hankyung.com▶ ▶
 ▶
ⓒ 한국경제 & , 무단전재 및 재배포 금지",/news/news_read.nhn?article_id=0004346350&office_id=015&mode=search&query=삼성물산&page=1
