head,text,url
"17시간 검찰조사 뒤 귀가…이 부회장 ""보고받거나 지시한 사실이 전혀 없다""","[아이뉴스24 이연춘 기자] 이재용 삼성전자 부회장의 검찰 소환을 두고 최근 '뉴삼성'을 선언한 뒤 보폭을 넓혀 가던 경영 행보에 제동이 걸리는 게 아니냐는 재계 일각의 우려가 나온다.이 부회장이 검찰에 출석하는 건 2017년 2월 박근혜 전 대통령에게 뇌물을 건넨 혐의로 박영수 특별검사팀에 구속돼 조사 받은 이후 3년 3개월 만이다.27일 재계에 따르면 이 부회장이 삼성물산-제일모직 합병과 경영권 승계 의혹 건으로 검찰에 소환된 것은 이번이 처음이라는 점에서 우려의 목소리가 적지않다. 이 부회장은 전날 오전 8시 30분경 배임과 자본시장법 위반 등 혐의로 검찰에 출석해 17시간 뒤인 이날 오전 1시 30분경 조사를 마치고 귀가했다.이 부회장은 제기된 의혹에 대해 ""보고받거나 지시한 사실이 전혀 없다""고 진술한 것으로 전해졌다.검찰은 삼성바이오로직스가 2012년 미국 기업 바이오젠과 함께 삼성바이오에피스를 설립하면서, 바이오젠이 보유한 콜옵션(주식을 정해진 값에 살 수 있는 권리)을 2014년까지 공시하지 않은 점을 분식회계로 판단하고 있다.삼성바이오로직스가 부채에 해당하는 콜옵션의 존재를 고의로 숨겼다는 것이다. 삼성바이오로직스가 2015년 말 회계처리 기준을 변경해 가치를 4조5천억원가량 부풀린 행위도 분식회계라고 검찰은 본다.시민단체인 사단법인 시장경제제도연구소는 ""삼성바이오로직스 사태는 회계의 본질을 망각한 정치적 공세""라며 ""사건을 바라보는 관점의 핵심은 단순히 회계분식의 문제가 아니라 해묵은 '삼성 때리기' 그 자체라는 사실""이라고 지적한다.경제 전문가들도 삼성바이오로직스의 분식회계 사태를 수사하는 검찰을 공개적으로 비판하고 있다.이동기 서울대 경영전문대학원 교수는 '합작기업의 지배구조와 삼바 이슈'에 대해 ""삼성바이오로직스 회계처리 문제의 핵심은 삼성바이오로직스가 2012년에 미국 바이오젠과 바이오시밀러 개발을 목적으로 설립한 합작 법인 삼성바이오에피스의 지배구조 이슈""라며 ""합작 기업의 지배구조에는 한 파트너가 경영을 주도하는 단독 지배구조와 파트너들이 대등한 공동경영을 하는 공동 지배 구조가 있다""고 했다.이 교수는 ""합작 기업의 지배구조가 어떤 유형에 속하는지는 지분율과 실질적 의사결정 구조를 종합적으로 고려해 판단한다""며 ""삼성바이오로직스는 합작 법인 삼성바이오에피스 설립 당시 지분율 85%, 이사 5명 중 4명 임명권, 대표이사 임명권 등을 확보해 실질적 지배력을 가진 것으로 보인다""고 설명했다.합작파트너인 바이오젠이 개발제품 신규 추가와 판권매각에 관한 동의권을 확보했으나 이는 다수 지분 파트너가 경영권을 독식하는 것을 막는 소수 지분파트너 보호장치로 판단해야 한다고 이 교수는 강조했다.이어 ""소수 지분이기는 하지만, 지분투자가 이뤄지는 만큼 최소한의 경영 참여장치는 있어야 한다는 의미""라며 ""이를 공동 지배 구조의 근거로 해석하는 것은 적절치 않고 바이오젠 입장에서 볼 때 초기 단계에선 기술 이전 계약 등을 통한 협력관계 구축에 더 큰 관심이 있었다고 보여진다""고 했다. 삼성바이오에피스 설립 당시 바이오젠은 삼바로부터 50% -1주까지 지분을 인수할 수 있는 콜옵션을 확보했다. 콜옵션은 불확실성과 리스크가 큰 사업분야에서의 단계적 투자전략이다고 이 교수는 설명했다.이병태 카이스트 경영공학부 교수는 투자자들에게 기업의 상태를 정확하게 전달한다는 회계정보 본질의 역할을 부정하고 있다고 지적했다. 이 교수는 스스로 논리를 3번이나 바꾼 당국에 검찰의 분식회계를 단정한 수사는 불법적이고 권력 남용의 사례일 뿐. 삼성을 겨냥한 정치적 공세로 볼 수밖에 없다고 꼬집었다.실제로 금융당국은 지난 3년간 삼성바이오의 회계처리에 대해 입장을 수 차례 번복해왔다. 2016년 12월 문제없다는 평가를 내렸으나, 2018년 7월, 2015년 이후의 회계처리에 문제를 제기했다. 이후 2018년 11월에는 아예 2012년 처음부터 문제였다고 말을 바꿨다.이 교수는 ""금감원은 삼성바이오에피스를 지분법에서 시장가격으로 재평가 한 평가 이익 4조5천억원은 회계변경이 불가하기 때문에 분식회계라고 주장한다""며 ""금감원은 부채와 자산은 동일한 삼성바이오에피스 주식 1천157만주를 자산으로 평가할 때는 2천650억원, 콜옵션 부채로 계산하는 523만주는 2조1천820억원으로 평가해야 한다는 황당한 주장을 하고 있다""고 했다. 결국 콜옵션 후의 삼성바이오로직스가 보유한 나머지 삼성바이오에피스 주식 634만주는 마이너스 1조9천억원이라는 궤변인 것이라고 그는 주장했다.재계 안팎에서 아직까지 국정농단 사건이 해결되지 않은 시점에서 이번 사건으로 다시 총수가 소환된 점을 우려한다. 이 부회장은 지난 2017년 2월 국정농단 뇌물 혐의로 구속됐다가 2018년 2월 집행유예를 선고받고 석방된 뒤 파기환송심이 진행 중이다.이 때문에 새로운 재판이 시작 될 경우 이 부회장의 '뉴삼성'의 차질이 불가피해 보인다. 이 부회장은 지난 6일 대국민 사과를 통해 과거 잘못과의 단절을 선언하고 새로운 삼성의 시작을 선언했다.재계는 특히 삼성을 둘러싸고 있는 현재의 대내외 상황을 주목하고 있다. 미·중 무역 분쟁 확대에 따라 세계 반도체 시장은 한 치 앞도 보기 어렵고, 코로나19 이후 경영 환경이 만만치 않은 상황에서 경영활동이 또다시 발목을 잡힐 수 있다는 것이다.대내외 위기를 극복하기 위해 이 부회장은 '비상 경영'을 내걸고 전국의 현장에 이어 최근 삼성전자의 유일한 해외 메모리 반도체 생산공장이 있는 중국 시안을 직접 찾았다.이 부회장은 시안 공장을 둘러본 뒤 ""시간이 없다. 때를 놓치면 안 된다""고 강조했다고 삼성은 전했다. 코로나19로 산업 생태계가 급변하고 있다는 점을 고려한 발언으로 해석된다. 또 ""과거에 발목 잡히거나 현재에 안주하면 미래가 없다""며 ""새로운 성장동력을 창출하기 위해서는 다가오는 거대한 변화에 선제 대비해야 한다""고 말했다.재계 한 관계자는 ""지난 2016년부터 이이진 수사와 재판 등 '삼성 때리기'라는 명분 앞에서는 경영의 방향키마저 잡지 못하고 있다""며 ""글로벌 무한경쟁 시대에 삼성의 경영활동 위축은 개별기업을 넘어 한국경제에 크나큰 악영향을 더하지 않을까 우려된다""고 했다. staykit@inews24.com [ⓒ 아이뉴스24 무단전재 및 재배포 금지]",/news/news_read.nhn?article_id=0000540196&office_id=031&mode=search&query=삼성물산&page=2
,"[아시아경제 문제원 기자] 서울역과 인천국제공항을 연결하는 공항철도 검암역세권의 대규모 도시개발사업인 '검암역 로열파크씨티 푸르지오'가 본격적인 분양일정에 돌입한다. 총 4805가구에 달하는 대단지인데다 분양권 전매제한이 6개월에 불과해 실수요자는 물론 투자자들의 관심이 집중될 것으로 예상된다.27일 DK도시개발ㆍDK아시아에 따르면 회사측은 오는 29일 검암역 로열파크씨티 푸르지오의 견본주택을 개관하고 분양 일정을 시작한다. 인천 서구 백석동 170-3에 들어어서는 이 아파트는 지하 2층~지상 최고 40층 25개동 4805가구의 대단지다. 아파트는 전용면적 59∼241㎡의 다양한 평면으로 구성된다.이 단지는 '휴양 리조트 도시'를
표방하고 있는 것이 특징이다. 단지 서쪽에는 롯데월드 6배 크기의 자연 생태공원 '드림파크 야생화단지'와 36홀 드림파크 골프장이 위치해 있다. 단지 내에는 9.6㎞ 길이의 둘레길이 조성된다. 시공능력평가 조경부문 1위인 삼성물산 리조트부문과 '미니 에버랜드 조경'을 꾸미는 한편 100만주에 가까운 꽃과 나무를 심어 단지 '밀리언 파크'도 조성할 예정이다.주요 기업과의 협업을 통해 차별화된 서비스도 제공한다는 방침이다.
LG전자와 업무협약을 맺어 차세대 사물인터넷(IoT) 기술을 적용하고, 풀무원푸드앤컬처를 통해 입주민들에게 품질 높은 식사를 합리적인 가격에 제공한다. 종로엠스쿨이 직영하는 학원도 단지 내 상가에 입주시킬 예정이라고 회사측은 설명했다.검암역에서 마곡나루역까지 3개 정거장에 불과한데다 서울역과 원스톱으로 연결돼 도심 출퇴근에도 어려움이 없다. 정부의 각종 규제에서 자유로운 것도 장점이다. 분양권 전매제한이 6개월로 짧고 최대 5년인 의무거주 규정도 적용되지 않는다.한편 회사측은 이번 분양에 이어 이 일대에 2차(4742가구), 3차(4119가구) 아파트도 추가로 공급해 대단지 랜드마크로 만들겠다는 방침이다.김정모 DK도시개발ㆍDK아시아 회장은 ""서울에서 가장 가까운 대한민국 최초 '차세대 휴양 리조트 도시'를 만들겠다""며 ""고급 리조트에서만 누리던 다양한 서비스를 제공해 입주민들이 단지 안에서 모든 것을 해결할 수 있는 도시로 조성할 계획""이라고 말했다.문제원 기자 nest2639@asiae.co.kr <ⓒ경제를 보는 눈, 세계를 보는 창 아시아경제 무단전재 배포금지>",/news/news_read.nhn?article_id=0004686314&office_id=277&mode=search&query=삼성물산&page=2
,"90년대에 유행했던 ‘벙거지’가 몇 년 전부터 스트리트 패션 브랜드 중심으로 인기를 얻은 게 시초다. 이제는 브랜드별 컨셉과 다양한 디자인들로 풀어낸 ‘버킷햇’으로 돌아왔다.버킷햇은 휴가철 스타일링을 완성해줄 뿐 아니라 원마일 웨어(one-mile wear), 즉  집 안이나 근처 1마일(약 1.6㎞) 반경 내로 가볍게 외출할 때 입기 좋은 옷차림의 필수품의 필수품이 됐다. 평상시에도 출근룩의 포인트로도 활용돼 그 패션성과 실용성을 인정받는 모습이다. 삼성물산 패션부문은 컬러, 소재, 디테일 등을 다채롭게 적용해 TPO에 따라 색다른 분위기를 연출해주는 만능 ‘버킷햇’ 스타일을 제안한다.‘빈폴레이디스’는 블랙 버킷햇을 리넨 체크 셋업과 매치해 편안하면서 감각적인 출근룩을 선보였다. 가벼운 외출시에도 활용하기 좋은 버킷햇은 이번 시즌 인기 아이템이다.올해는 코튼 소재의 리버서블 버킷햇과 함께 나일론 소재, 리본 디테일을 적용한 챙이 넓은 스타일을 추가 구성했다. 특히 나일론 소재의 버킷햇은 가벼운 데다 구김이 가지 않아 높은 실용성으로 소비자 반응이 좋다. 빈폴레이디스의 버킷햇은 블랙, 아이보리, 그레이 컬러 및 깅엄 체크 패턴 등으로 출시됐다. ‘구호’는 민낯을 완벽히 커버해주는 버킷햇을 출시했다. 버킷햇의 챙을 넓게 제작해 뜨거운 햇살로부터 피부를 보호하고 민낯 외출시 쓰기에 제격이다. 높이감이 있어 머리를 안정적으로 잡아주는 것도 장점이다. 간결한 외관에 스트링 디테일을 더해 캐주얼한 느낌을 줬고 스트링을 떼면 좀 더 깔끔하게 연출할 수 있다. 코튼 소재에 네이비, 베이지 컬러로 출시됐으며 두 컬러 모두 리오더에 들어갔을 정도로 인기 있다.골라 쓰는 재미를 느끼고 싶다면 ‘에잇세컨즈’의 버킷햇에 주목하자. 에잇세컨즈는 여행지에서의 즐거운 순간들을 주제로 한 이번 여름 컬렉션에서 청량한 리조트룩에 다양한 스타일의 버킷햇을 적극 활용했다.기본 솔리드 스타일 뿐 아니라 체크 패턴, 셔링·플리츠·프린지 디테일, 니트·데님 소재 등을 적용한 트렌디한 버킷햇 스타일을 선보였다.임수현 빈폴레이디스 디자인 디렉터는 “버킷햇은 올 여름 모든 복종에서 각광받는 아이템으로, 소재나 컬러, 디테일, 챙의 넓이 등에 따라 다채로운 분위기를 낸다”며 “챙이 넓고 끈이나 리본을 길게 늘어뜨려 여성스러운 느낌을 연출하거나 챙이 좁은 스타일로 영(young)한 레트로 감성을 표현할 수 있을 것”이라고 말했다.김경은 기자 silver@mt.co.kr
<저작권자 ⓒ '성공을 꿈꾸는 사람들의 경제 뉴스' 머니S, 무단전재 및 재배포 금지>",/news/news_read.nhn?article_id=0000547536&office_id=417&mode=search&query=삼성물산&page=2
李부회장 검찰 의혹 전면 부인‘K바이오’ 드림 등 차질 불가피,"이재용(52) 삼성전자 부회장이 26일 검찰이 제기한 삼성바이오로직스 회계처리 및 삼성물산 합병 등의 의혹에 대해 “보고 받거나 지시한 사실이 전혀 없다”고 전면 부인한 것으로 전해졌다.27일 검찰에 따르면, 서울중앙지검 경제범죄형사부(부장 이복현)는 전날 이 부회장을 특정경제범죄 가중처벌법상 배임, 자본시장법 위반 등 혐의 피의자 신분으로 불러 조사했다. 이 부회장은 조서 열람시간을 포함해 총 17시간을 검찰 청사에 머물렀다. 이 부회장은 조사 과정에서 검찰이 제기한 경영승계 의혹과 관련해 “보고를 받거나 지시한 사실이 전혀 없다”고 진술한 것으로 알려졌다.검찰은 이 부회장을 다시 불러 조사할 지에 관해 따로 밝히지 않았다. 다만 이 부회장이 스스로 요청해 자정을 넘겨 조사를 받은 만큼, 재소환 가능성은 높지 않을 것으로 법조계는 보고 있다.검찰은 이 부회장을 기소하는 쪽으로 가닥을 잡고 구속영장 청구 여부를 놓고 고심을 거듭하고 있는 것으로 알려졌다. 구속영장을 청구했다가 기각될 경우 수사팀에 부담이 크다는 점을 감안해야 하는 상황이다.재계에서는 코로나19와 미-중 반도체 신냉전 등 엄중한 대내외 경영여건 속에 사법 리스크가 커지며 이 부회장의 경영행보에 제동이 걸릴 수 있다는 우려가 나온다.전삼현 숭실대 교수(법학과)는 “삼성바이로직스 수사는 처음 분식회계 혐의였는데 현재는 증거인멸죄 혐의로 법정공방이 전개되고 있다”며 “별건수사의 방식으로 형사재판이 진행된다는 강한 의심을 받고 있다”고 지적했다.한 경제단체 관계자는 “무리한 검찰 수사가 장기화하는 것이 문제”라며 “경영권 승계와 관련해 불거진 의혹이 있다면 해소돼야 하는 것이 맞지만, 코로나19로 경제가 어려워진 시점에서 무리한 검찰 수사는 삼성그룹의 경영 정상화를 비롯한 일자리 창출 등에 차질을 빚을 수 있어 우리 경제에도 많은 악영향을 미칠 것으로 우려된다”고 말했다.천예선·안대용 기자
- Copyrights ⓒ 헤럴드경제 & heraldbiz.com, 무단 전재 및 재배포 금지 -",/news/news_read.nhn?article_id=0001678711&office_id=016&mode=search&query=삼성물산&page=2
삼성계열사의 역량 모아 입주민 주거 가치 상승독창적 외관 디자인과 압도적인 조경 설계 선보여준공 후 분양‧사업기간 단축으로 조합원 이익 극대화,"삼성물산은 반포3주구를 래미안 20년을 대표하는 기념비적 작품으로 만들어 주거의 새로운 패러다임을 제시한다는 계획이다. 27일 삼성물산에 따르면 반포3주구가 래미안 20년을 대표하는 작품이 될 수 있도록 글로벌 디자인회사와 협업해 독창적인 외관 디자인을 제안했고, 압도적인 단지 조경을 선보인다.단지 외관은 정제된 보석의 형태를 모티브로 한 커튼월룩과 경관조명을 통해 럭셔리함과 차별성을 부각하고, 샹들리에 디자인의 초대형 문주는 웅장하면서도 우아한 단지의 첫인상을 선사하며 상징성을 강조했다. 동출입구 또한 문주와 통일감 있는 디자인의 조명과 아트월을 적용해 랜드마크 디자인을 완성했다.단지 중앙에 축구장 3배 정도 크기인 약 2만㎡ 규모의 거대한 자연숲을 조성할 예정이며, 반포천 정화와 연계한 반포천 특화 조경과 5km에 이르는 단지내 산책로, 약 3000㎡의 수공간, 다수의 특색 있는 정원 배치 등 압도적인 조경을 선보였다.또한 대안설계를 통해 세대당 평균 8㎡의 확장 가능한 면적을 확보하고, 입주민의 취향에 맞춰 선택할 수 있는 평면을 제시했다. 또한 주방가구와 원목마루는 이탈리아산 최상위 브랜드 제품을 모든 세대에 제공하고 층간 소음 저감 솔루션도 제공했다.하이엔드 주거 단지에 걸맞는 차별화된 서비스를 준비해 주거의 패러다임을 선도할 예정이다. 전체 동에 적용된 동별 프라이빗 드롭-오프존과 우편‧택배‧세탁서비스가 가능한 컨비니언트 로비는 고급 호텔에서와 같이 편리한 동선과 기능을 제공했다.여기에 조‧중‧석식 서비스가 가능한 가든 카페와 복층형 골프연습장, 유튜브 크리에이터들을 위한 1인 스튜디오 등이 들어서는 복합문화공간, 펫 호텔 등 다양한 프리미엄 서비스가 가능한 커뮤니티시설을 계획했다. 아름다운 석양을 볼 수 있는 라운지와 테라스, 라이브러리, 프라이빗 피트니스와 스파, 게스트 스위트 등이 들어서는 스카이커뮤니티는 단지의 자부심이 될 예정이다.또한 반포3주구 상가를 세계적 디자인 회사를 비롯해 글로벌 상가 컨설팅사와 협업해 차별화된 디자인과 브랜드 구성, 활성화 솔루션을 제공하여 프리미엄 복합공간이 만들어질 수 있도록 적극 지원할 계획이다.삼성물산은 삼성계열사의 역량을 모아 입주민들에게 높은 주거 가치를 제공할 방침이다.삼성전자의 스마트싱스와 연계해 차별화된 주거 서비스를 제공하고, 삼성SDS와 인공지능을 기반으로한 IoT 플랫폼을 도입해 미래형 주거 문화를 선보인다는 계획이다.여기에 조경관리에 탁월한 능력을 보유하고 있는 리조트부문 조경사업팀과 협업할 예정이며, 삼성웰스토리의 조‧중‧석식 서비스, 에스원의 최첨단 보안시스템 등 삼성의 최고 DNA를 반포3주구 곳곳에 적용한다.삼성물산은 조합원의 이익을 최우선으로 준공 후 분양과 획기적인 사업기간 단축 등 파격적인 사업제안을 하고 차질 없이 추진할 계획이다.탄탄한 재무구조와 안정적인 자금 조달 역량을 바탕으로 100% 준공 후 분양을 추진할 예정이며, 2021년 5월 착공과 공사기간 34개월 등 획기적으로 사업기간을 단축해 조합원 이익을 극대화할 방침이다. 이를 위해 사업추진에 필요한 전체 사업비를 시공사가 책임지고 조달할 예정이다.아울러 조합원의 부담을 최대한 낮추기 위해 착공기준일까지의 기간과 실착공 이후에는 물가상승에 따른 공사비 인상이 없는 것으로 제안했으며, 조합원 분담금 역시 입주시점에 100% 납부할 수 있도록 했다.삼성물산 관계자는 “반포3주구는 래미안 20년을 대표하는 기념비적인 작품으로 만들기 위해 모든 역량을 동원했다”면서 “반포3주구에 제시한 최상의 사업제안을 반드시 이행해 나갈 것”라고 말했다.데일리안 이정윤 기자 (think_uni@dailian.co.kr)ⓒ (주)데일리안 - 무단전재, 변형, 무단배포 금지",/news/news_read.nhn?article_id=0002404029&office_id=119&mode=search&query=삼성물산&page=2
"삼성그룹 계열사의 역량 모아 입주민 주거 가치 상승준공 후 분양, 사업 기간 단축으로 조합원 이익 극대화","(서울=뉴스1) 국종환 기자 = 삼성물산 건설부문은 현재 재건축 입찰을 진행 중인 서울 '반포아파트 3주구'를 래미안 20년의 역사를 대표하는 기념비적 작품으로 짓겠다고 27일 밝혔다.삼성물산은 먼저 글로벌 디자인회사와 협업해 반포3주구에 독창적인 외관 디자인을 제안했고, 압도적인 단지 조경을 선보일 계획이다.단지 외관은 정제된 보석의 형태를 모티브로 한 커튼월룩과 경관조명을 통해 럭셔리함과 차별성을 부각한다. 샹들리에 디자인의 초대형 문주는 웅장하면서도 우아한 단지의 첫인상을 선사하며 상징성을 강조한다. 동 출입구 또한 문주와 통일감 있는 디자인의 조명과 아트월을 적용해 랜드마크 디자인을 완성할 계획이다.단지 중앙에는 축구장 3배 정도 크기인 약 2만㎡ 규모의 거대한 자연숲을 조성할 예정이다. 반포천 정화와 연계한 반포천 특화 조경과 5㎞에 이르는 단지 내 산책로, 약 3000㎡의 수공간, 다수의 특색있는 정원 배치 등 압도적인 조경을 선보인다.또 대안설계를 통해 가구당 평균 8㎡의 확장 가능한 면적을 확보하고, 입주민의 취향에 맞춰 선택할 수 있는 평면을 제시한다. 주방가구와 원목마루는 이탈리아산 최상위 브랜드 제품을 모든 가구에 제공하고 층간 소음 저감 솔루션도 도입한다.하이엔드 주거 단지에 걸맞은 차별화된 서비스를 준비해 주거의 패러다임을 선도한다. 전체 동에 적용된 동별 프라이빗 드롭-오프존과 우편·택배·세탁 서비스가 가능한 컨비니언트 로비는 고급 호텔과 같은 편리한 동선과 기능을 제공한다.여기에 조·중·석식 서비스가 가능한 가든 카페와 복층형 골프 연습장, 유튜브 크리에이터들을 위한 1인 스튜디오 등이 들어서는 복합문화공간, 펫 호텔 등 다양한 프리미엄 서비스가 가능한 커뮤니티 시설을 계획하고 있다. 아름다운 석양을 볼 수 있는 라운지와 테라스, 라이브러리, 프라이빗 피트니스와 스파, 게스트 스위트 등을 갖춘 스카이커뮤니티는 입주민들에게 자부심을 선사한다.반포3주구 상가는 세계적 디자인 회사를 비롯해 글로벌 상가 컨설팅사와 협업해 차별화된 디자인과 브랜드를 도입한다. 활성화 솔루션을 제공해 프리미엄 복합공간이 만들어질 수 있도록 적극 지원할 계획이다.삼성물산은 삼성 계열사의 역량을 모아 입주민들에게 높은 주거 가치를 제공할 방침이다.삼성전자의 스마트싱스와 연계해 차별화된 주거 서비스를 제공하고, 삼성SDS와 인공지능을 기반으로 한 IoT(사물인터넷) 플랫폼을 도입해 미래형 주거 문화를 선보인다. 조경 관리에 탁월한 능력을 보유한 리조트 부문 조경사업팀과 협업할 예정이며, 삼성웰스토리의 조·중·석식 서비스, 에스원의 최첨단 보안시스템 등 삼성의 최고 DNA를 반포3주구 곳곳에 적용한다.특히 삼성물산은 조합원의 이익을 최우선으로 내세워 준공 후 분양과 획기적인 사업 기간 단축 등 파격적인 사업 제안을 하고 차질없이 추진한다는 계획이다.탄탄한 재무구조와 안정적인 자금 조달 역량을 바탕으로 100% 준공 후 분양을 추진할 예정이다. 2021년 5월 착공과 공사 기간 34개월 등 획기적으로 사업 기간을 단축해 조합원 이익을 극대화할 방침이다. 이를 위해 사업추진에 필요한 전체 사업비를 시공사가 책임지고 조달한다.아울러 조합원의 부담을 최대한 낮추기 위해 착공기준일까지의 기간과 실 착공 이후에는 물가 상승에 따른 공사비 인상이 없는 것으로 제안했으며, 조합원 분담금 역시 입주 시점에 100% 납부할 수 있도록 했다.삼성물산 관계자는 ""반포3주구는 래미안 20년을 대표하는 기념비적인 작품으로 만들기 위해 모든 역량을 동원했다""며 ""반포3주구에 제시한 최상의 사업 제안을 반드시 이행해 나갈 것""이라고 말했다.jhkuk@news1.kr© 뉴스1코리아(), 무단 전재 및 재배포 금지",/news/news_read.nhn?article_id=0004660886&office_id=421&mode=search&query=삼성물산&page=2
