head,text,url
389억원 무상품목 지원 약속사업비 이자도 0.5% 저금리로강남 교두보 노려 역마진도 각오,"신반포15차 재건축 입찰에 참여한 호반건설이 파격적인 수준의 입찰조건을 제시하면서 쟁쟁한 경쟁사들(삼성물산, 대림산업)과 정면승부에 나섰다. 사실상 역마진을 각오한 수준의 무상품목을 제공하고 사업비도 기준금리의 절반 이하 수준으로 책정했다. 지난해 시공능력 10위권에 오르며 주목받고 있는 호반건설은 전사적 노력을 집중해 이번 기회에 강남권 교두보를 꼭 마련하겠다는 각오다.
12일 부동산 업계에 따르면 호반건설은 최근 신반포15차 재건축 조합에 제출한 입찰제안서에서 공사비 약 2500억원(부가세 포함)에 더해 389억원 규모의 무상품목 지원을 제안했다. 공사비 자체는 입찰에 참여한 삼성물산, 대림산업과 비슷한 수준이지만, 유일하게 무상제공 품목을 별도로 제안한 것이다. 건설업계에서 통상 재건축 시공이익을 최대 10% 수준으로 잡는 것을 고려하면 호반건설은 사실상 역마진을 각오한 셈이다. 시공이익을 공사비의 10%로 계산해도 약 150억원 가량 손해가 난다. 사업비 대출이자도 연 0.5%의 파격적인 수준으로 제공한다. 삼성물산은 연이자 1.9%를 제안했으며 대림산업은 CD+1.5% 또는 실제 조달 금융 비용 중 낮은 금리를 택할 수 있도록 제안했다.
호반건설은 이번 입찰 참여가 단순히 브랜드 이름을 알리려는 홍보 차원이 아닌 실제 수주를 위한 '실전'이라는 점을 강조하고 있다. 비록 경쟁사인 삼성물산(래미안)이나 대림산업(아크로)에 비해 브랜드 파워는 밀릴지라도 단지 고급화나 실속을 강조하면 충분히 승산이 있다고 보고 있다.
호반건설 관계자는 ""신반포 15차는 입지가 워낙 뛰어난만큼 시공사 브랜드보다는 실제 단지의 퀄리티에 따라 가치가 정해질 것으로 본다""며 ""호반만의 뛰어난 사업조건과 차별화된 특화 제안에 대한 조합원들의 좋은 평가가 기대된다""고 말했다.
한편 신반포15차 재건축 사업은 반포동 12번지 일대에 지하 4층~지상 35층 6개동 641가구 규모의 아파트를 짓는 사업이다. 지난해 12월 기존 시공사였던 대우건설과 계약을 해지한 뒤 새 시공사를 선정하는 절차를 진행 중이다. 신반포15차 재건축 시공사 선정 총회는 내달 1일 진행된다.[정지성 기자] [ⓒ 매일경제 & mk.co.kr, 무단전재 및 재배포 금지]",/news/news_read.nhn?article_id=0004535158&office_id=009&mode=search&query=삼성물산&page=2
,"자가격리·재택근무 중인 계열사·협력사 7천500명 대상대구·경북지역 거주 임직원 부모들에게도 위로 물품 전달

(서울=연합뉴스) 김준억 기자 = 신종 코로나바이러스 감염증(코로나19) 확산 방지를 위해 자가격리·재택근무 중인 삼성 계열사와 협력사 임직원은 물론 대구·경북에 사는 임직원의 양가 부모들에게 반가운 선물이 배달되고 있다.

삼성은 12일 삼성전자와 삼성생명, 삼성물산을 비롯한 18개 계열사와 자회사, 협력사 임직원 가운데 자가격리 중인 2천500여명과 임산부 1천800여명을 포함한 재택근무자 5천여명에게 격려물품을 발송했다고 밝혔다.

이 선물을 받는 삼성 협력사 직원들은 반도체 설비부터 스마트폰 부품 제조, 환경미화 등 삼성 사업장 안팎에서 다양한 업무를 맡은 인력들이다.

아울러 삼성은 임직원 가운데 코로나19 확진 판정을 받아 치료 중인 임직원에게도 격려 물품을 보냈다.

 또한 해외에서 자가격리 또는 재택근무 중인 현지 임직원 1천여명과 근무자 교대가 이뤄지지 않아 해외에서 장기 체류 중인 출장자들의 국내 가족들에게도 격려 물품을 전달한다.

격려 물품은 손 소독제와 홍삼, 비타민 등 면역력을 높이는 건강보조식품, 컵밥과 간편식 등 생활용품으로 구성됐으며 각 계열사 대표이사 명의의 격려 편지를 담았다.

김기남 삼성전자 부회장은 '우리는 함께 이겨내고 있습니다'라는 제목의 편지에서 코로나19 안정에 동참하고 있는 임직원에게 고마움을 표하며 ""모든 임직원이 다 함께 한 마음으로 이번 위기상황을 극복하자""고 격려했다.

자가격리 중인 2천500명 직원이 속한 부서의 부서장과 동료들은 격리의 고충을 위로하는 응원·안부 메시지를 영상으로 제작해 전달했다.

특히 삼성은 대구·경북 지역에 거주하는 임직원의 양가 부모를 대상으로도 격려 물품과 같은 구성의 위로 물품을 대표이사 편지와 함께 보냈다.

이는 대구·경북 주민들이 혹시 본인이 다른 지역에 피해를 줄 수도 있다는 걱정에 스스로 '고립'을 선택하고 있어 자녀의 방문이나 자녀의 집으로 가는 것도 거부하고 있는 상황을 고려해 마련한 것이다.

삼성은 이날부터 3만여 가구에 물품을 순차적으로 발송하고 있다.

삼성 경영진은 편지에서 ""회사는 자녀분들의 안전과 건강을 위해 다양한 노력을 하고 있으니 부모님의 안전과 건강을 먼저 챙기셨으면 좋겠습니다""라고 격려했다.

부모님 댁에 전달되는 물품에는 자녀들의 손편지도 함께 담겼다. 삼성 임직원들은 불안함에 떨고 있는 부모님들께 찾아가지 못하는 안타까움과 건강에 대한 걱정 등을 편지에 담았다.

 한 직원은 ""장인, 장모님 안녕하세요. 장 서방입니다. 코로나19 때문에 외출도 못 하시고 많이 답답하시죠? (중략) 손주랑 저희는 잘 있으니 걱정 안 하셔도 됩니다'라며 안부를 전했다.

 이들 편지에는 '손자와 손녀들 데리고, 두 손 가득 선물을 들고 이 봄이 가기 전에 찾아뵙길 바란다'는 바람을 담은 내용이 많았다고 삼성 관계자는 전했다.

 이재용 삼성전자 부회장은 ""모두가 힘을 모으면 반드시 이겨낼 수 있다""며 ""어려울 때일수록 주변에 조금 더 관심을 기울이고 서로를 응원하자. 각자의 자리에서 최선을 다해 활짝 웃으며 마주하자""고 말했다.

한편, 삼성은 임직원들의 건강 증진을 위해 다음 주부터 사내식당에서 면역력 강화 특별식을 제공할 계획이다.

삼성은 영덕연수원을 생활치료센터로 제공하고 의료진을 파견한 것을 비롯해 구호 물품과 성금 300억원 긴급 지원, 온누리상품권 300억원어치 구입 후 협력사 지급, '꽃 소비 늘리기'를 통한 화훼농가 지원, 1조원 펀드 조성해 협력사 운영자금 지원, 협력사 물품 대금 1조6천억원 조기 지급 등을 실시했다.

justdust@yna.co.kr",/news/news_read.nhn?article_id=0011468008&office_id=001&mode=search&query=삼성물산&page=2
"삼성, 코로나19 시달리는 직원들 위해 격려 물품 발송","[아이뉴스24 윤선훈 기자] 이재용 삼성전자 부회장이 코로나19로 어려움을 겪는 삼성 직원들에게 다시 한 번 당부의 메시지를 전달했다.이 부회장은 12일 ""모두가 힘을 모으면 반드시 이겨낼 수 있다""며 ""어려울 때일수록 주변에 조금 더 관심을 기울이고 서로를 응원하자""고 당부했다. 그러면서 ""각자의 자리에서 최선을 다해 활짝 웃으며 마주하자""고 임직원들을 격려했다.앞서 이 부회장은 지난 3일 경북 구미사업장을 직접 방문해 스마트폰 생산라인을 점검하고 현장 직원들과 차담회를 가진 바 있다. 구미사업장에서는 이 부회장이 다녀가기 이전까지 4명의 코로나19 확진자가 발생했다. 이 때문에 사업장이 며칠씩 폐쇄되는 등 어려움을 겪었다.이 부회장은 이 자리에서 ""저를 비롯한 회사는 여러분의 건강과 안전을 최우선으로 모든 노력을 다하겠다""며 ""모두 힘을 내서 함께 이 위기를 이겨내 조만간 마스크 벗고 활짝 웃으며 만나자""고 말했다.이날 삼성은 코로나19로 인해 자택에서 격리 중이거나 재택근무를 하고 있는 계열사·협력사 임직원들에게 격려 물품을 발송했다. 대상자는 삼성전자, 삼성생명, 삼성물산을 비롯한 18개 계열사와 자회사·협력사 임직원 가운데 자가격리 중인 2천500여명과 임산부 1천800여명을 포함한 재택근무자 5천여명이다. 이와 별도로 해외에서 자가격리 또는 재택근무 중인 현지 임직원 1천여명에게도 물품을 전달했다.또 삼성은 코로나19 확진 판정을 받아 치료를 받고 있는 임직원에게도 격려 물품을 보냈다. 아울러 이번 사태로 근무자 교대가 이뤄지지 않아 해외에서 장기 체류 중인 출장자들의 국내 가족들에게도 물품을 준비해 전달하기로 했다.격려 물품은 ▲손소독제와 핸드워시 등 감염 예방 용품 ▲홍삼과 비타민 등 개인 면역력을 높이는 건강 보조식품 ▲컵밥과 간편식 등 생활 용품으로 구성됐다. 각 물품에는 계열사별 대표이사 명의의 격려 편지가 동봉됐다.김기남 삼성전자 부회장은 '우리는 함께 이겨내고 있습니다'라는 제목의 편지에서 임직원들에게 고마움을 표하며 ""모든 임직원이 다 함께 한 마음으로 이번 위기상황을 극복하자""고 격려했다. 자가격리 중인 2천500명의 직원들이 속한 부서의 부서장과 동료들은 격리의 고충을 위로하는 '응원·안부 메시지'를 영상으로 제작해 해당 직원들에게 전달했다.삼성은 대구·경북 지역에 거주하는 임직원의 부모·처가·시부모에게도 격려 물품과 동일한 구성의 위로 물품을 대표이사 편지와 함께 보냈다. 삼성 관계자는 ""자녀들이 대구·경북 지역의 부모님들을 찾아뵙지 못하는 안타까운 상황을 고려해 마련한 조치""라고 말했다. 삼성은 12일부터 3만여가구에 물품을 순차적으로 발송하고 있다.각 사 사장들은 임직원 부모들에게 보낸 편지에서 ""회사는 자녀분들의 안전과 건강을 위하여 다양한 노력을 하고 있으니 부모님의 안전과 건강을 먼저 챙기셨으면 좋겠습니다""라고 언급했다.한편 삼성은 임직원들의 건강 증진을 위해 다음주부터 사내식당에서 면역력 강화 특별식을 제공할 계획이다. krel@inews24.com [ⓒ 아이뉴스24 무단전재 및 재배포 금지]",/news/news_read.nhn?article_id=0000529403&office_id=031&mode=search&query=삼성물산&page=2
,"코스피가 외국인의 매도 공세에 장중 5%대 급락하며 1810선도 붕괴됐다. 코스닥도 550선 위협받는 등 위태로운 흐름을 보이고 있다.12일 오후 2시16분 현재 코스피는 전일 대비 68.28포인트(3.58%) 내린 1839.99를 기록하고 있다.이날 지수는 전일 대비 20.30포인트(1.06%) 내린 1887.97에 개장해 급락세를 이어가고 있다. 장중 한때 5%대 급락하며 1808.56까지 떨어졌다.신종코로나바이러스 감염증(코로나19) 확산 여파로 글로벌 증시가 급락하면서 투자심리가 위축되는 것으로 풀이된다.특히 도널드 트럼프 대통령이 11일(현지시간) 대국민 연설 이후 국내 증시는 하락폭을 확대했다. 트럼프 대통령은 이날 연설을 통해 유럽 국가에서 미국으로 여행하는 것을 30일간 막겠다고 밝혔다.서상영 키움증권 연구원은 ""트럼프 대통령의 발언은 유럽과의 교류 중단을 발표하는 등 부정적인 부분이 더 많았다""며 ""미국의 특별조치와 함께 대규모 부양정책 등 적극적인 대응을 기대했던 시장에서 실망 매물이 출회하며 낙폭을 확대했다""고 설명했다.한국거래소는 이날 오후 1시 4분 37초에 선물가격 하락으로 인해 5분간 유가증권시장에서 프로그램 매도 호가 효력이 일시 정지(사이드카 발동)된다고 공시했다.유가증권시장 사이드카는 코스피200 선물거래 종목 중 직전 거래일 거래량이 가장 많은 종목의 가격이 5% 이상 상승 또는 하락한 상태가 1분간 지속할 경우 발동된다.유가증권시장에서 매도 사이드카가 발동된 것은 그리스 채무불이행(디폴트) 우려가 커진 지난 2011년 10월 4일 이후 약 8년 5개월 만에 처음이다.증권가에서는 코로나 확산이 둔화되더라도 경제활동이 완전히 정상화되는 데에는 상당한 시간이 소요될 것으로 전망했다.박소연 한국투자증권 연구원은 ""코로나가 처음에는 바이러스 확산으로 인한 가동중단, 공급차질 정도의 이슈였는데 글로벌 판데믹으로 흐르고 경기침체 문제로 확대되더니 이제는 부채 문제와 금융위기 논란까지 시나리오가 번졌다""며 ""이 정도면 더 이상 나올 악재가 없을 정도""라고 분석했다.박 연구원은 ""코로나 확산이 완전히 종식될 때까지 중앙은행이 한계기업과 주체들에게 일종의 쿠션을 제공할 필요가 있다""며 ""이 때문에 오는 18일 미 연방공개시장원회(FOMC)에서 50~75bp 이상의 대폭적인 금리인하나 보다 직접적인 금융시장 개입과 유동성 공급이 이뤄져야 한다고 본다""고 말했다.이날 유가증권시장에서는 업종별로 일제히 하락하고 있다. 음식료품, 섬유·의복, 종이·목재, 화학, 의약품, 비금속광물, 철강·금속이 약세를 보이고 있다.매매주체별로 개인과 기관이 4101억원, 2585억원 순매수하는 반면 외국인이 7185억원 순매도했다. 프로그램 매매는 1860억원 매도 우위를 보이고 있다.시가총액 상위 종목들은 대체로 하락하고 있다. LG생활건강, LG화학, 현대차가 4%대 약세를 보이는 반면 SK텔레콤, 삼성물산, 신한지주, POSCO, 현대모비스가 하락하고 있다.코스닥은 전일 대비 24.89포인트(4.18%) 내린 570.72를 기록 중이다.[디지털뉴스국 김현정 기자] [ⓒ 매일경제 & mk.co.kr, 무단전재 및 재배포 금지]",/news/news_read.nhn?article_id=0004535177&office_id=009&mode=search&query=삼성물산&page=2
,"삼성은 신종 코로나바이러스 감염증(코로나19)로 자택에 격리 중이거나 재택근무를 하는 임직원에게 격려 물품을 보냈다고 12일 밝혔다.이재용 삼성전자 부회장은 “모두가 힘을 모으면 반드시 이겨낼 수 있다”면서 “어려울 때일수록 주변에 조금 더 관심을 기울이고 서로를 응원하자. 각자의 자리에서 최선을 다해 활짝 웃으며 마주하자”고 말했다.격려 물품 전달 대상자는 자회사 및 협력사 임직원 가운데 자가격리 중인 2500여명과 임산부 1800여명을 포함한 재택근무자 5000여명이다.이번에 지원을 받는 삼성 협력사 직원들은 반도체 설비부터 스마트폰 부품 제조, 환경미화 등 삼성 사업장 안팎에서 다양한 업무를 맡고 있는 인력이라고 삼성은 설명했다.이밖에도 삼성은 임직원 중 코로나19 확진 판정을 받아 치료를 받고 있는 임직원 20여명에게도 격려 물품을 보냈으며, 이번 사태로 근무자 교대가 이뤄지지 않아 해외에서 장기 체류 중인 출장자들의 국내 가족들에게도 격려 물품을 준비해 전달하기로 했다.격려 물품은 ▲손 소독제와 핸드워시 등 감염 예방 용품 ▲홍삼과 비타민 등 개인 면역력을 높이는 건강 보조식품 ▲컵밥과 간편식 등 생활 용품으로 구성됐다. 각 계열사 대표이사 명의의 격려 편지도 담았다.김기남 삼성전자 부회장은 자가격리나 재택근무 중인 직원들에게 ‘우리는 함께 이겨내고 있습니다’라는 제목의 편지를 보내 코로나19 안정에 동참하고 있는 임직원들에게 고마움을 표하며 “모든 임직원이 다 함께 한 마음으로 이번 위기상황을 극복하자”고 격려했다.한편, 삼성은 임직원들의 건강 증진을 위해 다음 주부터 사내식당에서 면역력 강화 특별식을 제공할 계획이다.삼성은 특히 어려운 상황에 처해 있는 대구/경북 지역에 거주하는 임직원 부모/처가/시부모를 대상으로도 격려 물품과 동일한 구성의
위로 물품을 대표이사 편지와 함께 보냈다.이는 자녀들이 대구/경북 지역의 부모님들을 찾아 뵙지 못하는 안타까운 상황을 고려해 마련한 조치이며, 삼성은 12일부터 3만여 가구에 물품을 순차적으로 발송하고 있다.김준엽 기자 snoopy@kmib.co.krGoodNews paper ⓒ , 무단전재 및 재배포금지",/news/news_read.nhn?article_id=0001298443&office_id=005&mode=search&query=삼성물산&page=2
ㆍ재택 임직원·가족에 위로품…LG도 자가격리 직원에 편지·건강용품,"삼성그룹이 코로나19 발병 인구가 밀집한 대구·경북 지역에 거주하는 임직원들의 부모와 처가, 시가를 대상으로 위로물품을 발송했다. 또 코로나19로 자가격리 중이거나 재택근무를 하고 있는 계열사와 협력사 임직원들에게도 격려물품을 보냈다.삼성그룹은 임직원들이 대구·경북 지역에 있는 부모를 찾아가지 못하는 상황을 고려해 3만여가구에 순차적으로 위로물품을 발송 중이라고 12일 밝혔다. 코로나19 사내 감염을 예방하기 위해 삼성전자를 비롯한 그룹 계열사들은 임직원들의 대구·경북 지역 방문을 자제시키고 있다.위로물품은 손소독제와 핸드워시 등 감염 예방용품, 홍삼과 비타민 등 건강보조식품, 컵밥과 간편식 등 생활용품으로 구성됐다. 각 계열사 사장들은 동봉한 편지에 “회사는 자녀들의 안전과 건강을 위해 다양한 노력을 하고 있으니 부모님의 안전과 건강을 먼저 챙기셨으면 좋겠습니다”라고 썼다. 일부 직원들은 애틋한 마음을 담은 손편지를 함께 부치기도 했다.또 삼성그룹은 삼성전자, 삼성생명, 삼성물산을 비롯한 18개 계열사와 자회사 및 협력사 임직원들 가운데 자가격리 중인 2500여명과 임산부 1800여명을 포함한 재택근무자 5000여명 등 총 7500여명에게도 같은 물품을 발송했다. 이번에 지원을 받는 협력사 직원들은 반도체 설비부터 스마트폰 부품 제조, 환경미화 등 삼성 사업장 안팎에서 다양한 업무를 맡고 있다.삼성은 코로나19 확진 판정을 받아 치료 중인 임직원들과 이번 사태로 근무자 교대가 이뤄지지 않아 해외에서 장기 체류 중인 출장자들의 가족들에게도 격려물품을 전달할 계획이다. 이재용 삼성전자 부회장은 “모두가 힘을 모으면 반드시 이겨낼 수 있다”면서 “각자의 자리에서 최선을 다해 활짝 웃으며 마주하자”고 말했다.앞서 구광모 LG그룹 대표도 코로나19 여파로 자가격리 중인 임직원들에게 ‘함께 이겨냅시다’라는 제목의 편지와 함께 마스크, 손소독제, 액정닦이, 영양제 등 건강·위생용품을 보냈다.구교형 기자 wassup01@kyunghyang.com©경향신문(www.khan.co.kr), 무단전재 및 재배포 금지",/news/news_read.nhn?article_id=0002997363&office_id=032&mode=search&query=삼성물산&page=2
