head,text,url
,"두달 전 저점 대비 코스피 35%, 코스닥 65% 상승""언택트주 비중 높아…코로나가 시장 변화 가속화""(서울=연합뉴스) 김태종 기자 = 한국 증시가 주요국 가운데 코로나19 공포로 올해 최저점을 찍었던 2개월 전과 비교해 상승률이 가장 높은 것으로 나타났다.

언택트(비대면) 경제 확산 기대감에 IT, 바이오 관련주가 상승하면서 국내 증시에서 이들 주식의 비중이 크게 높아졌기 때문으로 분석된다.

24일 한국거래소에 따르면 코스피 지수는 지난 22일 1,970.13으로 마감했다. 코로나19 확산이 우려되면서 지난 3월 19일 기록한 연중 최저점(1,457.64)에서 35.2% 반등한 수준이다.코스닥의 상승폭은 더욱 컸다. 두 달 전 최저점(428.35) 대비 65.4% 상승한 708.58까지 회복했다.

 이 같은 한국 증시의 상승률은 주요국 가운데 가장 높다.

미국 뉴욕증시의 다우존스30 산업평균지수와 스탠더드앤드푸어스(S&P) 500 지수는저점 대비 각각 31.5%와 32.1% 올랐다. 기술주 중심의 나스닥도 35.9% 상승했지만, 코스닥 상승률보다는 낮다.

독일 DAX지수(31.2%), 영국 FTSE 100(20.0%), 프랑스 CAC40(18.4%), 호주 ASX200(20.9%) 등도 한국 증시 반등 수준에 못 미쳤다.

아시아 시장에서도 일본 닛케이지수(23.2%) 상승률은 코스피보다 낮고, 중국 상하이지수(5.8%)와 홍콩 항셍지수(5.7%)는 상승률이 한 자릿수에 불과하다.이처럼 한국 증시의 상승률이 높은 것은 다른 나라들보다 상대적으로 크게 내렸다가 반등한 탓도 있지만, 무엇보다 비대면 관련주의 비중이 크기 때문이란 분석이 나오고 있다.

 강재현 현대차증권 연구원은 ""코로나가 끝난 것이 아니기 때문에 경기민감주의 상승에는 한계가 있고 IT와 바이오 등 성장주이면서 코로나 영향을 덜 받는 섹터들이 많이 올랐다""며 ""이런 주식 비중이 우리나라에서 특히 높다""고 말했다.

실제 올해 초만 해도 코스피 시가총액 상위 종목에 이름을 올렸던 현대모비스, 포스코, 삼성물산 등 전통적 제조업이 10위 밖으로 밀려났고, 현대차는 간신히 턱걸이했다.

이들을 대신해 삼성SDI와 카카오 등이 자리했다. 삼성바이오로직스와 네이버는 전체 시총에서 차지하는 비중을 올해 초 1.94%와 2.06%에서 각각 3.09%와 2.86%로 높였다.

대표적인 언택트 주는 카카오다. 카카오는 올해 초 시가총액 순위가 20위 밖이었으나, 코로나 사태를 겪으면서 시장 예상치를 웃도는 실적과 기대감으로 단숨에 9위까지 뛰어올랐다.

시가총액 상위 10개 종목이 차지하는 비중도 올해 초 40.52%에서 43.14로 높아졌다.

코스닥에서도 올해 초 대비 셀트리온제약과 씨젠, 알테오젠 등 바이오, 진단키트 관련주가 상위권을 장악했다. 시총 10개 상위종목 비중도 12.49%에서 14.87%로 올라갔다.

정명지 삼성증권 투자정보팀장은 ""시가총액 상위종목이 바뀐 것을 보면 주식시장이 경제보다 훨씬 빨리 세상의 변화를 반영하고 있는 것 같다""며 ""코로나 사태가 점진적으로 진행돼 오던 주식시장의 지형 변화를 가속화하고 있다""고 말했다.<표> 주요국 증시의 올해 저점 대비 상승률※ 각 증시

taejong75@yna.co.kr",/news/news_read.nhn?article_id=0011629341&office_id=001&mode=search&query=삼성물산&page=1
,"한국 증시가 코로나19 대유행으로 최저점을 찍었던 2개월 전과 비교해 상승률이 톱인 것으로 조사됐다.


 24일 한국거래소에 따르면 코스피 지수는 지난 22일 1970.13으로 마감했다. 코로나19 확산이 우려되면서 지난 3월 19일 기록한 연중 최저점(1457.64)에서 35.2% 반등한 것이다.
 코스닥의 상승폭은 더욱 컸다. 두 달 전 최저점(428.35) 대비 65.4% 상승한 708.58까지 회복했다.

 이 같은 한국 증시의 상승률은 주요국 가운데 가장 높다.

미국 뉴욕증시의 다우존스30 산업평균지수와 스탠더드앤드푸어스(S&P) 500 지수는저점 대비 각각 31.5%와 32.1% 올랐다. 기술주 중심의 나스닥도 35.9% 올랐으나 코스닥 상승률보다는 낮다.

독일 DAX지수(31.2%), 영국 FTSE 100(20.0%), 프랑스 CAC40(18.4%), 호주 ASX200(20.9%) 등도 한국 증시 반등 수준에 못 미쳤다.

아시아 시장에서도 일본 닛케이지수(23.2%) 상승률은 코스피 보다 낮고, 중국 상하이지수(5.8%)와 홍콩 항셍지수(5.7%)는 상승률이 한 자릿수에 그쳤다. 이 같이 한국 증시의 상승률이 높은 것은 다른 나라들보다 상대적으로 크게 내렸다가 반등한 탓도 있으나 무엇보다 비대면 관련주의 비중이 크기 때문이란 분석이다.



실제 올해 초만 해도 코스피 시가총액 상위 종목에 이름을 올렸던 현대모비스, 포스코, 삼성물산 등 전통적 제조업이 10위 밖으로 밀려났고, 현대차는 간신히 턱걸이했다.

이들을 대신해 삼성SDI와 카카오 등이 자리했다. 삼성바이오로직스와 네이버는 전체 시총에서 차지하는 비중을 올해 초 1.94%와 2.06%에서 각각 3.09%와 2.86%로 높였다.

특히, 카카오는 올초 시가총액 순위가 20위 밖이었지만 코로나 사태를 겪으면서 시장 예상치를 웃도는 실적과 기대감으로 단숨에 9위까지 뛰어올랐다.[류영상 기자 ifyouare@mkinternet.com] [ⓒ 매일경제 & mk.co.kr, 무단전재 및 재배포 금지]",/news/news_read.nhn?article_id=0004580838&office_id=009&mode=search&query=삼성물산&page=1
,"[머니투데이 김사무엘 기자] 코로나19(COVID-19)가 한국 증시의 지형도를 바꿔 놓았다. IT(정보기술) 플랫폼 기업 카카오가 현대차를 제치고 시가총액 상위 10위 이내에 진입했고, 삼성바이오로직스와 셀트리온 등 제약·바이오 종목들도 약진했다. 코로나19 사태에도 '서프라이즈' 실적을 실현한 LG생활건강도 시총 10위 내에 이름을 올렸다.반면 전통적인 제조업으로 분류되는 현대차와 현대모비스, POSCO(포스코), 삼성물산 등은 시총 순위가 추락했다. 코로나19가 가져온 사회 변화가 기업 가치에도 영향을 미치고 있다는 분석이다.24일 한국거래소에 따르면 코로나19 이후 코스피 시총 상위 주요 종목들의 순위가 대거 조정됐다. 지난해 말 시총 상위 10위 안에 들었던 포스코, 현대모비스, 삼성물산은 현재 10위권 밖으로 밀려났고 대신 카카오, 삼성SDI, LG생활건강이 새로 10위권 내에 진입했다.가장 눈에 띄는 종목은 카카오다. 카카오의 시총은 지난 22일 기준 21조5062억원으로 현대차(20조1916억원)를 제치고 시총 9위(삼성전자 우선주 제외)에 올랐다. 카카오는 지난해 말 시총 13조2338억원으로 22위였지만 불과 5달만에 주가가 60% 오르며 순위가 뛰어 올랐다.코로나19로 인한 언택트(Untact·비대면) 시대의 대표 수혜주로 주목받으면서 기업 가치가 크게 올랐다는 분석이다. 카카오페이, 카카오뱅크, 카카오페이지 등 카카오가 영위하고 있는 주요 사업들은 산업 사이클상 현재 고성장기에 진입한 상태인데, 여기에 코로나19 수혜가 가미되면서 폭발적인 성장세를 보여주고 있기 때문이다.카카오페이지는 지난해 영업이익률(매출액 대비 영업이익 비율)이 10%대까지 상승할 정도로 빠른 수익성 개선을 보이고 있다. 카카오뱅크는 지난해 1분기 처음으로 순손익분기점을 돌파한데 이어 올해 1분기 순이익은 185억원으로 전년 동기대비 180% 성장을 기록했다.성종화 이베스트투자증권 연구원은 ""코로나19가 촉발한 언택트 시대의 가속화로 페이, 뱅크, 페이지, 커머스 등 언택트 비즈니스들은 모두 매우 우호적인 사업환경을 맞이하고 있다""며 ""고성장 에너지는 향후에도 꺼지지 않고 지속될 것이며 손익도 더욱 가파르게 개선될 것""이라고 분석했다.코로나19 치료제 개발에 관심이 쏠리면서 제약·바이오 업체들도 크게 주목받았다. 삼성바이오로직스의 시총 순위는 지난해 말 4위에서 현재 3위로 올랐고 셀트리온 시총은 7위에서 5위로 점프했다. 두 기업은 모두 코로나19로 인한 폭락장에도 불구하고 지난해 말보다 주가가 올랐다는 공통점이 있다. 삼성바이오로직스와 셀트리온의 주가는 올들어 각각 42.7%, 19.3% 올랐다. 이 기간 코스피 지수가 10% 이상 하락한 것을 감안하면 상당한 성과다.생필품과 화장품 등을 생한하는 LG생활건강은 코로나19로 인한 수요 위축에 취약할 수밖에 없는 사업구조임에도 1분기 예상치를 뛰어넘는 실적으로 시장을 깜짝 놀라게 했다. LG생활건강의 1분기 영업이익은 전년 동기대비 3.6% 늘어난 3337억원을 기록했는데, 이는 지난해보다 30% 가량 줄어들 것으로 예상한 컨센서스(전망치)를 크게 상회하는 실적이었다.안정적 성장을 위한 LG생활건강의 사업 포트폴리오 분산이 코로나19 위기에서도 빛을 발했다. LG생활건강은 화장품, 생활용품, 음료 부문 매출 비중이 60%, 20%, 20%로 분산돼 있는데 한 사업 부문에서 위기가 오면 다른 사업 부문에서 이를 상쇄하는 실적으로 안정적 성장을 이끌어왔다.특히 이번 코로나19 사태에서는 위생용품 수요가 크게 늘면서 생활용품 부문 영업이익이 전년 대비 50.3% 증가한 652억원을 기록했다. 세정제와 물티슈 등 코로나19 관련 용품이 온라인을 중심으로 불티나게 팔려 나갔고, 국내 생활용품 시장 점유율 1위 지위도 더 견고히했다.반면 시총 순위가 하락한 기업들은 대부분 전통 제조업이었다. 현대차와 현대모비스는 자동차 공장 셧다운과 판매 급감의 여파로 올 들어 주가가 각각 21.6%, 28.1% 급락했다. 시총 순위도 현대차는 5위에서 10위로 떨어졌고 6위였던 현대모비스는 12위로 추락하며 10위권 밖으로 밀려났다.포스코는 코로나19로 인한 글로벌 경기 침체의 여파로 철강 수요가 위축되면서 주가 하락을 피할 수 없었다. 포스코의 시총은 지난해 말 20조6197억원에서 지난 22일 14조9961억원으로 줄었고 시총 순위도 9위에서 16위로 하락했다.김사무엘 기자 samuel@mt.co.kr
<저작권자 ⓒ '돈이 보이는 리얼타임 뉴스' 머니투데이, 무단전재 및 재배포 금지>",/news/news_read.nhn?article_id=0004413619&office_id=008&mode=search&query=삼성물산&page=1
코로나19로 미뤄졌던 총회 재개선정 여부에 따라 건설사 수주순위도 바뀌어오는 30일 반포3주구 '시선집중',"신종 코로나 바이러스 감염증으로 미뤄졌던 서울 재개발·재건축 수주전이 스타트를 끊었다. 규모는 물론이고 상징적인 입지에서 벌어지는 수주전들이다. 일주일 정도의 기간동안 서울에서 시공사 들이 줄줄이 결정되는 것도 이례적이다.건설사들은 수주를 통해 미래 먹거리를 확보할 수 있고, 향후 수주전에 있어서도 유리한 입지를 다질 수 있다. 여러 번의 유찰과 우여곡절 끝에 수의계약 동의를 받는 곳도 있지만, 맞대결이 있는 곳에서는 조직의 명운을 가를 수 있다보니 경쟁이 치열한 상태다.더군다나 이르면 8월부터 서울에서 사업시행계획인가를 신청하는 재개발 예정 구역에서 임대주택 의무공급 비율이 기존 최대 20%에서 최대 30%로 높아진다. 임대주택이 늘어난 만큼 일반분양 수입은 줄어들 수밖에 없다. 건설사 입장에서는 사업장 확보를 더욱 서두르게 됐다.첫 포문을 연 곳은 롯데건설이다. 롯데건설은 약 1조원에 달하는 강북 최대 재개발사업인 서울 은평구 갈현1구역을 수주했다. 갈현1구역은 공사비 약 9255억원, 4116가구 규모에 달한다. 재개발을 통해 지하 6층~지상 22층, 32개 동의 아파트 단지가 될 전망이다.롯데건설은 지난 23일 서대문구 홍은동 스위스 그랜드 호텔에서 열린 갈현1구역 시공사 선정 총회에서 1769명의 조합원이 참석한 가운데 약 88%(찬성: 1555표)의 압도적인 지지로 시공사로 선정됐다. 갈현1구역 조합은 지난 3월 시공사 선정 총회를 준비했으나 코로나19 사태로 총회가 두 달여간 지체된 끝에 시공사 선정을 마무리했다. 롯데건설은 이번 수주로 올해 울산 중구 B-05 구역 재개발(1602억원), 부산 범일2구역 재개발(5030억원), 그리고 이번 갈현 1구역(9255억원)까지 수주하며 수주 금액 총 1조5887억원을 달성하게 됐다. 이로써 롯데건설은 국내 건설사 중 수주액 1위로 올라서게 됐다. 기존 1위였던 현대건설(1조541억원)을 따돌리게 됐다.롯데건설이 갈현1구역을 품기까지는 순탄치 않은 과정이 있었다. 지난 10월 이후 2회 연속 유찰됐기 때문이다. 1차 입찰에 현대건설이 참여했다. 그러나 현대건설의 제안에 문제가 있다고 본 조합이 입찰 자격을 박탈하면서 재입찰에 들어갔다.24일은 조국 전 법무부장관의 아파트로 유명세를 탄 방배삼익아파트의 재건축 시공사 선정총회가 열린다. 지난해 10월과 12월 두 차례 유찰을 거쳐 대림산업이 단독으로 나선 상태다. 방배삼익아파트는 준공 38년차 단지로 재건축을 통해 기존 408가구(4개동)를 721가구로 탈바꿈된다. 예정 공사비는 약 2314억원이다. 대림산업은 올해 누적수주액이 3073억원 정도다. 이번 수주를 비롯해 다음달 기대를 모으고 있는 한남3구역까지 총력을 다하겠다는 각오다. 오는 28일에는 서초구 잠원동 신반포21차 아파트의 재건축 시공사 선정총회가 열린다. GS건설과 포스코건설이 맞붙고 있다. 반포21차 아파트는 108가구 규모의 단지로, 재건축을 통해 지하4층~지상20층 2개동 총 275가구가 된다.기존 강남의 강자인 GS건설과 강남 입성을 노리는 포스코건설의 구도다. GS건설이 유리할 것으로 예상됐지만 포스코건설이 파격적인 조건들을 내세우면서 치열한 분위기가 조성되고 있다.오는 30일엔 반포주공1단지 3주구 조합이 시공사를 선정한다. 서울시 클린사업장으로 지정됐지만, 양사의 치열한 공방전에 분위기가 과열로 치닫고 있다. 그만큼 어떤 건설사가 선정될지도 관심사다. 반포3주구는 반포동 1109 일대의 노후 단지를 지하 3층~지상 35층 아파트 17개 동, 총 2091가구로 재건축한다. 총 공사비만 8087억원에 달하는 재건축사업이다. 삼성물산과 대우건설이 경쟁에 나섰다. 당초 판세는 5년 만에 정비사업 수주전에 뛰어든 삼성물산이 유리할 것으로 예상됐다. 하지만 대우건설이 파격적인 조건들을 내세우고 촘촘한 홍보전을 벌이면서 현장 분위기는 엎치락 뒤치락하는 양상이다.수주전이 본격적으로 시작되면서 양사의 비방과 불법 홍보, 소송 등으로 이어지고 있다. 대우건설과 삼성물산은 서울시로부터 각각 경고와 주의를 한 차례씩 받았다. 대우건설은 지난 7일 삼성물산과 인근의 재건축 조합장인 A씨를 명예훼손과 업무방해 등으로 고소했다. 삼성물산은 사실이 아니라고 선을 그었다. 반포3주구는 지난해 HDC현대산업개발을 우선협상대상자로 선정했던 곳이다. 그러나 공사비 등을 두고 갈등을 겪다 조합이 시공계약을 해지하면서 시공사를 재선정하고 있다.한편 다음 달에는 용산구 한남동 한남3구역 재개발 조합이 시공사를 선정한다. 지난해 이들 3사는 과열 수주전으로 입찰이 한 차례 무산되고, 검찰 조사까지 받았다. 참여한 회사는 현대건설, GS건설, 대림산업 등 3개사다. 오는 21일에는 시공사 선정을 위한 총회가 열릴 예정이다. 3개사 중 어떤 곳이 수주하더라도, 수주만 된다면 단숨에 누적 수주액 1위가 된다.한남3구역 재개발은 공사 예정 가격만 1조8880억원에 달하는 사업이다. 역대 재개발 사업 가운데 가장 큰 규모다. 서울 용산구 한남동 686일대에 지하 6층∼지상 22층, 197개 동, 5816가구(임대 876가구 포함)와 근린생활시설을 조성하게 된다.김하나 한경닷컴 기자 hana@hankyung.com▶ ▶
 ▶
ⓒ 한국경제 & , 무단전재 및 재배포 금지",/news/news_read.nhn?article_id=0004346202&office_id=015&mode=search&query=삼성물산&page=1
,"한국 증시가 주요국 가운데 코로나19 공포로 올해 최저점을 찍었던 2개월 전과 비교해 상승률이 가장 높은 것으로 나타났다. 언택트(비대면) 경제 확산 기대감에 IT, 바이오 관련주가 상승하면서 국내 증시에서 이들 주식의 비중이 크게 높아졌기 때문으로 분석된다.24일 한국거래소에 따르면 코스피 지수는 지난 22일 1970.13으로 마감했다. 코로나19 확산이 우려되면서 지난 3월 19일 기록한 연중 최저점(1457.64)에서 35.2% 반등한 수준이다. 코스닥의 상승폭은 더욱 컸다. 두 달 전 최저점(428.35) 대비 65.4% 상승한 708.58까지 회복했다. 이 같은 한국 증시의 상승률은 주요국 가운데 가장 높다. 미국 뉴욕증시의 다우존스30 산업평균지수와 스탠더드앤드푸어스(S&P) 500 지수는저점 대비 각각 31.5%와 32.1% 올랐다. 기술주 중심의 나스닥도 35.9% 상승했지만, 코스닥 상승률보다는 낮다. 독일 DAX지수(31.2%), 영국 FTSE 100(20.0%), 프랑스 CAC40(18.4%), 호주 ASX200(20.9%) 등도 한국 증시 반등 수준에 못 미쳤다. 아시아 시장에서도 일본 닛케이지수(23.2%) 상승률은 코스피보다 낮고, 중국 상하이지수(5.8%)와 홍콩 항셍지수(5.7%)는 상승률이 한 자릿수에 불과하다.이처럼 한국 증시의 상승률이 높은 것은 다른 나라들보다 상대적으로 크게 내렸다가 반등한 탓도 있지만, 무엇보다 비대면 관련주의 비중이 크기 때문이란 분석이 나오고 있다. 강재현 현대차증권 연구원은 “코로나가 끝난 것이 아니기 때문에 경기민감주의 상승에는 한계가 있고 IT와 바이오 등 성장주이면서 코로나 영향을 덜 받는 섹터들이 많이 올랐다”며 “이런 주식 비중이 우리나라에서 특히 높다”고 말했다. 실제 올해 초만 해도 코스피 시가총액 상위 종목에 이름을 올렸던 현대모비스, 포스코, 삼성물산 등 전통적 제조업이 10위 밖으로 밀려났고, 현대차는 간신히 턱걸이했다. 이들을 대신해 삼성SDI와 카카오 등이 자리했다. 삼성바이오로직스와 네이버는 전체 시총에서 차지하는 비중을 올해 초 1.94%와 2.06%에서 각각 3.09%와 2.86%로 높였다. 대표적인 언택트 주는 카카오다. 카카오는 올해 초 시가총액 순위가 20위 밖이었으나, 코로나 사태를 겪으면서 시장 예상치를 웃도는 실적과 기대감으로 단숨에 9위까지 뛰어올랐다.
시가총액 상위 10개 종목이 차지하는 비중도 올해 초 40.52%에서 43.14로 높아졌다. 코스닥에서도 올해 초 대비 셀트리온제약과 씨젠, 알테오젠 등 바이오, 진단키트 관련주가 상위권을 장악했다. 시총 10개 상위종목 비중도 12.49%에서 14.87%로 올라갔다. 정명지 삼성증권 투자정보팀장은 “시가총액 상위종목이 바뀐 것을 보면 주식시장이 경제보다 훨씬 빨리 세상의 변화를 반영하고 있는 것 같다”며 “코로나 사태가 점진적으로 진행돼 오던 주식시장의 지형 변화를 가속화하고 있다”고 말했다.임아영 기자 layknt@kyunghyang.com©경향신문(www.khan.co.kr), 무단전재 및 재배포 금지",/news/news_read.nhn?article_id=0003010711&office_id=032&mode=search&query=삼성물산&page=1
,"신종 코로나바이러스 감염증(코로나19) 충격으로 올해 세계 증시가 롤러코스터를 탄 가운데, 한국 증시의 회복력이 최고 수준으로 나타났다.


24일 한국거래소에 따르면 코로나19 사태 이후 코스닥 지수의 최저점 대비 상승률은 지난 22일 기준 65.4%로, 세계 9개 주요국 지수 가운데 1위였다. 지난 3월 19일 428.35에서 두 달여 만에 708.58까지 치솟았다. 같은 기간 코스피 지수는 35.2% 상승했다.


 다른 국가와 비교해도 한국이 상대적으로 선전했음을 알 수 있다. 미국 뉴욕증시의 다우존스30산업평균지수와 스탠더드앤드푸어스(S&P) 500지수는 저점 대비 각각 31.5%, 32.1% 올랐다. 기술주 중심의 나스닥 지수도 35.9% 상승했지만, 코스닥 상승률보다는 낮았다. 독일 DAX지수(31.2%)와 일본 닛케이(23.2%), 호주 ASX200(20.9%), 영국 FTSE 100(20%), 프랑스 CAC40(18.4%)도 한국 증시 상승률엔 못 미쳤다. 중국 상하이지수(5.8%), 홍콩 항셍지수(5.7%)는 한 자릿수 상승률로 저조한 성적을 보였다.


 한국 증시의 상승률이 높은 건 코로나19 영향을 덜 받는 비대면(언택트) 관련주 비중이 크기 때문이란 분석이다. 실제 올해 초만 해도 코스피 시가총액 상위 종목에 이름을 올렸던 현대모비스와 포스코, 삼성물산 등 전통적 제조업이 10위 밖으로 밀려났다. 이들을 대신해 삼성SDI와 카카오 등이 자리했다. 특히 카카오는 올해 초 시가총액 순위가 20위 밖이었으나, 코로나 사태를 겪으면서 9위까지 뛰어올랐다. 신승진 삼성증권 연구원은 ""코스피 주도주가 자동차, 철강 등 전통 제조업 중심에서 제약·바이오, 인터넷, 전기차 등 성장주 중심의 기업들로 바뀌고 있다""고 말했다.



코스닥 시장에서도 올해 초 대비 셀트리온제약과 씨젠, 알테오젠 등 바이오, 진단키트 관련주가 코로나 테마로 급등하며 상위권을 장악했다. 시총 10개 상위종목 비중도 12.49%에서 14.87%로 올라갔다.


황의영 기자 apex@joongang.co.kr
▶ ▶ ▶ ⓒ중앙일보(https://joongang.co.kr), 무단 전재 및 재배포 금지",/news/news_read.nhn?article_id=0003003103&office_id=025&mode=search&query=삼성물산&page=1
,"한국 증시가 주요국 가운데 가장 빨리 신종코로나바이러스 감염증(코로나19) 공포에서 벗어나고 있는 것으로 나타났다. 증시가 최저점을 찍었던 2개월 전과 비교해 상승률이 가장 높았다. 코스피 지수는 지난 22일 1970.13으로 마감했다. 코로나19 확산에 대한 두려움으로 연중 최저점(1,457.64)을 찍었던 지난 3월 19일보다 35.2% 반등한 것이다. 코스닥 지수 상승폭은 더 컸다. 두 달 전 최저점(428.35) 대비 65.4% 상승한 708.58까지 회복했다. 한국 증시 상승률은 주요국 가운데 가장 높다. 미국 뉴욕증시의 다우존스30 산업평균지수와 스탠더드앤드푸어스(S&P) 500 지수는 저점 대비 각각 31.5%, 32.1% 올랐다. 기술주 중심의 나스닥은 35.9% 상승했지만, 코스닥 상승률보다는 낮았다. 독일 DAX지수(31.2%), 영국 FTSE 100(20.0%), 프랑스 CAC40(18.4%), 호주 ASX200(20.9%) 등도 한국 증시 반등 수준에 못 미쳤다. 아시아 시장에서도 마찬가지다. 일본 닛케이지수 상승률(23.2%)이 코스피보다 낮았고, 중국 상하이지수(5.8%)와 홍콩 항셍지수(5.7%)는 상승률이 한 자릿수에 불과하다. 한국 증시가 다른 나라들보다 상대적으로 크게 떨어졌기 때문에 반등폭이 컸던 측면도 있지만, 비대면·바이오 관련주도 증시 상승을 이끌었다. 올해 초만 해도 코스피 시가총액 상위 종목에 이름을 올렸던 현대모비스, 포스코, 삼성물산 등 전통적 제조업이 10위 밖으로 밀려났고, 현대차는 간신히 턱걸이했다. 이들 대신 삼성SDI와 카카오 등이 10위권으로 들어왔다.삼성바이오로직스와 네이버가 전체 시총에서 차지하는 비중은 올해 초 1.94%와 2.06%에서 각각 3.09%와 2.86%로 높아졌다. 올해 초 시가총액 순위가 20위 밖이었던 카카오는
코로나 사태를 겪으면서 시장 예상치를 웃도는 실적과 '포스트 코로나 시대'에 대한 기대감으로 9위까지 뛰어올랐다.코스닥에서는 셀트리온제약과 씨젠, 알테오젠 등 바이오, 진단키트 관련주가 상위권을 장악했다. 정명지 삼성증권 투자정보팀장은 ""주식시장이 현실보다 더 빨리 세상의 변화를 반영하고 있다""며 ""코로나 사태가 주식시장의 지형 변화를 가속화한 것""이라고 내다봤다.고재연 기자 yeon@hankyung.com▶ ▶
 ▶
ⓒ 한국경제 & , 무단전재 및 재배포 금지",/news/news_read.nhn?article_id=0004346277&office_id=015&mode=search&query=삼성물산&page=1
