head,text,url
"- DK도시개발·DK아시아, 인천 서구에 대규모 도시개발사업 추진, 5대 메이저 시공사로   특화된 브랜드시티 조성 전략- 최고 40층 4805가구 매머드급 대규모 단지로 대한민국 최초 휴양 리조트 도시 조성- 6개월 후 전매 가능 단지로 공급규모, 브랜드, 교통, 환경, 단지특화, 학교, 생활인프라까지   역대급 랜드마크 단지 요소 모두 갖춰, 전용 59㎡ 공급 비율 높여 공공성에도 기여 - 8월부터 분양권 전매강화, 규제 적용 전 마지막 분양단지에 관심 몰릴 듯","'성냥갑' 단지가 대부분이던 2000년, 서울 강남구 도곡동에 '타워팰리스'가 착공하면서 화려한 외관 뿐 아니라 넓은 평형 구성, 고급 커뮤니티까지 조성해 '프리미엄 주거 공간'이라는 새로운 개념의 장을 열었다. 그러고 20년이 지난 지금도 여전히 아파트 고급화 경쟁이 심화되고 있다. 2016년 입주와 함께 한강변 대표 단지로 부상한 ‘아크로리버파크’, 4년 연속 국내 매매 최고 거래가 아파트에 오른 ‘한남더힐’ 등 ‘하이엔드 브랜드'의 잇딴 출현으로 아파트가 단순한 거주 대상이 아니라 선망의 대상이 됐고, 이제 지역을 상징하는 전국구 랜드마크 단지로 부상하게 된 것이다. 이러한 유명 주거상품이 있는 곳은 해당 단지를 중심으로 지역 일대 아파트 시세가 동시 다발적으로 상승하는 경우가 많다. 특히 새로이 주거환경을 갖춘 곳에서 시그니처 단지 존재여부는 도시의 성패를 가늠할 수 있는 척도가 되기도 한다. 타워팰리스로 대표되는 1세대 고급아파트가 부자임을 과시할 수 있는 외관 등의 하드웨어에 조금 더 치중했다면, 2세대 고급아파트부터는 점차 실생활의 편의성과 쾌적성을 높여주는 소프트웨어 설계에 힘쓰기 시작했다. 또 각종 주거서비스 강화로 이어지면서 상류층 주거 문화의 변화를 주도하고 있는 셈이다.이런 가운데 인천 최초 전국 대장주 아파트가 등장할 것으로 보여 실수요자 및 투자자들의 이목이 집중되고 있다. 최근 전국에서 가장 핫한 인천 지역은 5월 첫주까지 8주 연속으로 전국 광역 자치단체 중 아파트 값이 가장 크게 오르고 있어 업계에서는 분양 성적을 계속 이어갈 수 있을지 주목하고 있다. 특히 정부가 올해 8월부터 수도권과 광역시 대부분의 지역에서 분양권 전매를 금지하겠다는 추가 부동산 규제 방안을 발표하면서 적용 시점 이전 마지막 분양 단지에는 전국에서 청약자들이 대거 몰릴 것으로 예상되고 있다. ◆ DK도시개발·DK아시아, 인천 서구 검암역세권에 ‘검암역 로열파크씨티 푸르지오’ 5월 29일 분양 예정, 최고 40층 4805가구의 매머드급 전국 대장주 아파트 예약 완료DK도시개발·DK아시아가 인천 서구 검암역세권에서 5월 29일 분양 예정인 ‘검암역 로열파크씨티 푸르지오’는 최고 40층, 4805가구의 매머드급 대단지로 인천 최초 전국 대장주 아파트 등극을 예약하는 모습이다. 이 아파트는 이른바 ‘5·11대책’ 규제 대상에 해당되지 않아 6개월 후 전매가 가능하고, 공급규모, 브랜드, 단지특화, 생활인프라 등 역대급 랜드마크 단지의 요소를 모두 갖췄다는 평가다. 여기에 ‘휴양’ 콘셉트에 맞춰 다양한 여가시설이 들어서는 대한민국 최초 ‘휴양 리조트 도시’로 조성될 예정으로 이미 올초부터 실수요자 및 투자자들의 관심을 꾸준히 받아 왔다. 2023년말 단지가 준공되면 인천을 대표하는 전국구 단지로 올라설 것이라는 전망이 나오는 이유다. 우선 검암역 로열파크씨티 푸르지오는 검암역에서 공항철도 이용할 경우 김포공항역까지 2개 정거장, 마곡나루역 까지 3개 정거장 거리에 불과해 서울 접근성이 우수하다. 또한 검단신도시를 거쳐 불로지구까지 연장 계획 중인 인천지하철 2호선 독정역이 사업지와 바로 접해 있는 것도 장점이다.자연친화적 입지 여건과 단지 조경은 더욱 화려하다. 사업지 전면 폭 길이만 1km에 달하고 단지 서쪽에 바로 인접한 롯데월드 면적 6배 크기 자연 생태공원인 드림파크 야생화단지(30만평)와 36홀 드림파크 골프장(46만평) 등이 위치해 있다.
대단지에 걸맞게 온가족이 산책할 수 있는 9.6km 둘레길과 단지내 약 1km 데크길이 들어서고 시공능력평가 조경 1위 삼성물산 리조트부문과 국내 아파트 단지 내 최초로 ‘미니 에버랜드’가 조성된다. 또 100만주에 가까운 꽃과 나무를 심어 단지 전체를 뒤덮는 ‘밀리언 파크'(Million Park) 등 고품격 조경을 선보인다.
이외에도 각 분야 국내 최고 브랜드 기업과 손잡고 프리미엄 주거 명작을 완성한다는 계획이다. LG전자와 업무협약을 통해 차세대 IoT기술을 적용하고, 풀무원푸드앤컬처는 입주민들에게 인천 최초 고품격 삼식(三食) 서비스를 합리적인 가격으로 제공한다. 종로엠스쿨이 직영하는 학원은 입주민 자녀들에게 단지 내 학원가 등 프리미엄 사교육을 선보인다. 3년간 무상으로 운영될 ‘돕다(DOPDA)’의 컨시어지 서비스는 입주민 자긍심은 물론 아파트의 가치와 품격도 한 차원 더 높일 예정이다.
단지 내 커뮤니티시설도 압도적인 스케일을 자랑한다. 피트니스클럽, 수영장, 사우나 등 기본시설은 고급화했고, 도서관 내에 그리너리 라운지, 연회장 및 연회장과 연계한 루프탑, 파티룸, 티카페 및 펫카페, 게스트하우스 등도 적용된다.또 사업지 내 한들초(가칭) 및 한들유치원(가칭)을 건립 후 인천교육청에 기부채납도 계획돼 있다. 이들 학교는 단지 준공 시점에 맞춰 개교할 예정으로 입주민들은 자녀들을 안심하고 학교에 보낼 수 있을 전망이다. 이 같은 주목도는 온라인상에서도 두드러지게 나타난다. 인천에서 그동안 볼 수 없었던 역대급 규모감 때문에 분양 홈페이지 일일 평균 방문객이 1만 2천여 명, 누적 방문객이 약 80만 명에 달하고, 부동산 정보 공유 사이트 ’호갱노노‘에서 최근 13일 기준 조회수가 65만회가 넘는 등 꾸준히 최상위권을 유지하며 전국적인 관심이 집중되고 있다. 한편 이 아파트는 1·2단지를 거쳐 공항철도 검암역까지 5분 간격(출퇴근 시간 기준)으로 운행하는 순환 셔틀버스(총 6대)도 제공하며, 1단지 정류장에서 셔틀버스 탑승시 검암역까지 5분이면 도착할 수 있다. 특히 셔틀버스 6대는 5년간 무상 운영된 후 단지에 기증될 예정이다.
소규모 단지보다 관리비가 적게 드는 장점도 있다. 공동주택관리정보시스템(K-apt)에 따르면 4000가구에 달하는 ‘인천 S아파트’ 전용면적(㎡)당 관리비는 894원(2019년 12월 기준)으로 지역 내 소규모 아파트 보다 최대 20% 가량 저렴한 것으로 조사됐다. DK도시개발·DK아시아 김정모 회장은 “보다 진화된 삶을 최우선 가치로 도시를 만들어가는 라이프 씨티 크리에이터(Life City Creator)로서 또 다른 라이프스타일을 원하는 현대인들에게 4세대 아파트를 넘어 서울에서 가장 가까운 대한민국 최초 ‘차세대 휴양 리조트 도시’를 만들겠다“며 “단순히 잠을 자기 위한 집이 아니라 고급 리조트에서만 누리던 다양한 서비스를 제공해 입주민들이 단지 안에서 모든 것을 해결할 수 있는 ‘리조트 도시’로 조성할 계획”이라고 말했다.◆ DK도시개발, 인천 서구에 대규모 도시개발사업 추진, 5대 메이저 시공사로 특화된 브랜드시티로 조성한다는 전략... 전용 59㎡ 공급 비율 높여 공공성에도 기여한편 DK도시개발은 최근 인천 서구 일대 431만9966㎡(약 130만평)부지의 대규모 도시개발 사업을 추진하면서 국내 5대 메이저 브랜드 시공사만 참여하는 특화된 메이저 브랜드시티로 조성한다는 전략을 세웠다.특히 광역교통망과 기반시설 부재, 낮은 브랜드 인지도 등 자족 기능을 갖추지 못해 ‘베드타운’화 된 기존 신도시의 문제점을 보완하고 젊은층에게 관심이 높은 전용 59㎡ 소형평형을 전체 가구의 50%를 공급해 공공성에도 기여한다는 방침이다.이를 통해 서민 주거 안정에 도움될 뿐만 아니라 다른 신도시의 공급물량과 겹치지 않아 공급과잉에 대한 우려도 말끔히 씻어낼 것이란 평가다. 특히 지자체에서 하지 못한 소형평형 공급을 민간에서 주도적으로 추진하면서 소형부터 중대형까지 공급타입을 다양화함으로써 메이저 브랜드시티의 밸런스까지 맞출 계획이다. 한편 DK도시개발이 민간 도시개발사업으로 진행하는 사업지들은 정부가 조성하는 신도시보다 더 특색있는 완벽한 생활 기반시설을 갖추고 ‘휴양’ 콘셉트에 맞춰 다양한 여가시설이 들어서는 대한민국 최초 ‘휴양 리조트’ 도시로 조성될 예정이다.또한 검암역 로열파크씨티 푸르지오 분양 이후 2차(리조트도시Ⅱ 4742가구), 3차(리조트도시Ⅲ 4119가구) 사업도 순차적으로 공급할 계획이다.한경부동산 hkland@hankyung.com▶ ▶
 ▶
ⓒ 한국경제 & , 무단전재 및 재배포 금지",/news/news_read.nhn?article_id=0004342599&office_id=015&mode=search&query=삼성물산&page=1
네이버 4위·카카오 11위·NC 15위팬데믹 장기화로 게임·콘텐츠 강세포스트 코로나 '대장주' 등극 기대바이오·반도체·전기차 성장세 여전,"비대면(언택트) 관련 기술·서비스 기업이 시가총액 상위 구도를 바꿔놓고 있다. 이들 기업이 유가증권과 코스닥 시장에서 시총 상위기업으로 부상했다. 코로나19가 장기국면에 돌입하면서 차세대 대장주 역할을 할 것이라는 기대감도 커졌다.18일 한국거래소에 따르면 이달 유가증권시장에서 전통적인 시총 강자였던 현대차, 현대모비스, 삼성물산 등을 제치고 네이버가 4위에 올랐다. 상위권에 속하지 않았던 카카오가 11위로 상승했고 엔씨소프트 역시 15위로 진입했다. 모두 코로나19로 비대면 기술·서비스에 대한 관심이 커지면서 집중 조명받은 기업이다.코스닥 시장도 코로나19 영향으로 비대면 기업 관심이 커진 모습이다. 코로나19 치료제 개발 중요성이 커지면서 백신이나 진단키트를 개발·공급하는 기업도 새롭게 시총 상위로 성장했다.2018년 5월 초 기준 코스닥 시장 시총 상위 15위 기업 중 6개가 비 바이오·제약 부문이었으나 이달에는 7개사로 늘었다. 2018년 당시 CJ E&M(6위), 펄어비스(7위), 나노스(8위), 스튜디오드래곤(12위), 카카오M(13위), 컴투스(15위)가 코스닥 시총 상위권 비 바이오·제약 기업이었다.반면에 이달에는 펄어비스(5위), CJ E&M(6위), 케이엠더블유(8위), 스튜디오드래곤(9위), 에코프로비엠(10위), SK머티리얼즈(12위) 원익IPS(15위)로 나타났다. 코로나19로 비대면 관련 게임, 콘텐츠 기업이 새롭게 성장성을 주목받았다. 반도체와 전기차 시장 성장성이 흔들림 없이 조명받으면서 관련 부품·소재·장비 기업이 시총 상위기업으로 올라섰다.네이버와 카카오는 코로나19로 비대면 서비스 수요가 급증하면서 주목받고 있다. 두 회사 모두 1분기 실적도 성장해 중장기 전망이 밝다는 평가다. 테크핀 금융 서비스로 새로운 성장 발판을 마련하고 있는 점도 코로나19로 빨라지는 시장 변화 속에서 새로운 강자로 자리매김할 것이라는 기대를 받고 있다.시가총액이 급등한 곳도 다수였다. '국민주'로 등극한 삼성전자는 유가증권시장 시총 1위 자리를 유지하면서 규모가 지난해 274조원에서 올해 292조원으로 증가했다. 네이버는 20조원에서 35조원으로 껑충 뛰었다. 상위권에 없던 카카오는 시총 19조원대로 성장했다. 엔씨소프트도 시총 16조원대 진입을 앞뒀다.코스닥 시장에서는 코로나19 치료제 관련 사업을 영위하거나 비대면 관련 기술·서비스를 보유한 기업, 유망한 치료제 공급 기업 중심으로 시총이 증가했다.코스닥 시총 1위인 셀트리온헬스케어는 시가총액이 지난해 10조원에서 이달 14조원대로 상승했다. 에이치엘비는 3조원대(6위)에서 4조원대로 성장했다. 씨젠은 과거 시총 상위에 없었으나 코로나19로 조명받으면서 이달 시총 3조원대 기업(4위)으로 성장했다.금융투자 업계 전문가들은 '포스트 코로나' 기업에 선별 투자하라고 조언하고 있다. 이에 따라 코로나19 치료제 개발을 중심으로 비대면, 5G 통신, 인공지능, 반도체 등이 새로운 유망 투자 업종으로 떠올랐다.표. 유가증권시장 시총 변동 추이 (자료=한국거래소)배옥진기자 withok@etnews.com",/news/news_read.nhn?article_id=0002883188&office_id=030&mode=search&query=삼성물산&page=1
,"'성냥갑' 단지가 대부분이던 2000년, 서울 강남구 도곡동에 '타워팰리스'가 착공하면서 화려한 외관 뿐 아니라 넓은 평형 구성, 고급 커뮤니티까지 조성해 '프리미엄 주거 공간'이라는 새로운 개념의 장을 열었다.
그 후 20년이 지난 지금도 여전히 아파트 고급화 경쟁은 계속되고 있다. 2016년 입주와 함께 한강변 대표 단지로 부상한 ‘아크로리버파크’, 4년 연속 국내 매매 최고 거래가 아파트에 오른 ‘한남더힐’ 등 ‘하이엔드 브랜드'의 잇딴 출현으로 아파트가 단순한 거주 대상이 아니라 선망의 대상이 됐고, 이제 지역을 상징하는 전국구 랜드마크 단지로 부상하게 됐다.
타워팰리스로 대표되는 1세대 고급아파트가 부자임을 과시할 수 있는 외관 등의 하드웨어에 조금 더 치중했다면, 2세대 고급아파트부터는 점차 실생활의 편의성과 쾌적성을 높여주는 소프트웨어 설계에 힘쓰기 시작했다. 또 각종 주거서비스 강화로 이어지면서 상류층 주거 문화의 변화를 주도하고 있다. 이런 가운데 DK도시개발·DK아시아가 인천 서구 검암역세권에서 5월 29일 분양 예정인 ‘검암역 로열파크씨티 푸르지오’는 최고 40층, 4805가구의 매머드급 대단지로 인천 최초 전국 대장주 아파트 등극의 기대감을 낳고 있다.
이 아파트는 이른바 ‘5·11대책’ 규제 대상에 해당되지 않아 6개월 후 전매가 가능하고, 공급규모, 브랜드, 단지특화, 생활인프라 등 역대급 랜드마크 단지의 요소를 모두 갖췄다는 평가다. 여기에 ‘휴양’ 콘셉트에 맞춰 다양한 여가시설이 들어서는 대한민국 최초 ‘휴양 리조트 도시’로 조성될 예정이다. 2023년말 단지가 준공되면 인천을 대표하는 전국구 단지로 올라설 것이라는 전망이 나오는 이유다.
우선 검암역 로열파크씨티 푸르지오는 검암역에서 공항철도 이용할 경우 김포공항역까지 2개 정거장, 마곡나루역 까지 3개 정거장 거리에 불과해 서울 접근성이 우수하다. 또 검단신도시를 거쳐 불로지구까지 연장 계획 중인 인천지하철 2호선 독정역이 사업지와 바로 접해 있는 것도 장점이다. 자연친화적 입지 여건과 단지 조경은 더욱 화려하다. 사업지 전면 폭 길이만 1km에 달하고 단지 서쪽에 바로 인접한 롯데월드 면적 6배 크기 자연 생태공원인 드림파크 야생화단지(30만평)와 36홀 드림파크 골프장(46만평) 등이 위치해 있다.
 대단지에 걸맞게 온가족이 산책할 수 있는 9.6km 둘레길과 단지내 약 1km 데크길이 들어서고 삼성물산 리조트부문과 국내 아파트 단지 내 최초로 ‘미니 에버랜드’가 조성된다. 또 100만주에 가까운 꽃과 나무를 심어 단지 전체를 뒤덮는 ‘밀리언 파크'(Million Park) 를 선보인다.
 이외에도 각 분야 국내 최고 브랜드 기업과 손잡고 프리미엄 주거 명작을 완성한다는 계획이다. LG전자와 업무협약을 통해 차세대 IoT기술을 적용하고, 풀무원푸드앤컬처는 입주민들에게 인천 최초 고품격 삼식(三食) 서비스를 합리적인 가격으로 제공한다. 종로엠스쿨이 직영하는 학원은 입주민 자녀들에게 단지 내 학원가 등 프리미엄 사교육을 선보인다. 3년간 무상으로 운영될 ‘돕다(DOPDA)’의 컨시어지 서비스는 아파트의 가치와 품격을 높일 예정이다.
 단지 내 커뮤니티시설도 압도적인 스케일을 자랑한다. 피트니스클럽, 수영장, 사우나 등 기본시설은 고급화했고, 도서관 내에 그리너리 라운지, 연회장 및 연회장과 연계한 루프탑, 파티룸, 티카페 및 펫카페, 게스트하우스 등도 적용된다. 또 사업지 내 한들초(가칭) 및 한들유치원(가칭)을 건립 후 인천교육청에 기부채납도 계획돼 있다. 이들 학교는 단지 준공 시점에 맞춰 개교할 예정이다.
이 같은 주목도는 온라인상에서도 두드러지게 나타난다. 인천에서 그동안 볼 수 없었던 역대급 규모감 때문에 분양 홈페이지 일일 평균 방문객이 1만 2000여 명, 누적 방문객이 약 80만 명에 달한다. 또 부동산 정보 공유 사이트 ’호갱노노‘에서 최근 13일 기준 조회수가 65만회가 넘는 등 꾸준히 최상위권을 유지하고 있다.
이 아파트는 1∙2단지를 거쳐 공항철도 검암역까지 5분 간격(출퇴근 시간 기준)으로 운행하는 순환 셔틀버스(총 6대)도 제공하며, 1단지 정류장에서 셔틀버스 탑승시 검암역까지 5분이면 도착할 수 있다. 특히 셔틀버스 6대는 5년간 무상 운영된 후 단지에 기증될 예정이다.
 소규모 단지보다 관리비가 적게 드는 장점도 있다. 공동주택관리정보시스템(K-apt)에 따르면 4000가구에 달하는 ‘인천 S아파트’ 전용면적(㎡)당 관리비는 894원(2019년 12월 기준)으로 지역 내 소규모 아파트 보다 최대 20% 가량 저렴한 것으로 조사됐다.
DK도시개발·DK아시아 김정모 회장은 “보다 진화된 삶을 최우선 가치로 도시를 만들어가는 라이프 씨티 크리에이터(Life City Creator)로서 또 다른 라이프스타일을 원하는 현대인들에게 4세대 아파트를 넘어 서울에서 가장 가까운 대한민국 최초 ‘차세대 휴양 리조트 도시’를 만들겠다“며 “단순히 잠을 자기 위한 집이 아니라 고급 리조트에서만 누리던 다양한 서비스를 제공해 입주민들이 단지 안에서 모든 것을 해결할 수 있는 ‘리조트 도시’로 조성할 계획”이라고 말했다. 한편 DK도시개발은 최근 인천 서구 일대 431만9966㎡(약 130만평)부지의 대규모 도시개발 사업을 추진하면서 국내 5대 메이저 브랜드 시공사만 참여하는 특화된 메이저 브랜드시티로 조성한다는 전략을 세웠다. 특히 광역교통망과 기반시설 부재, 낮은 브랜드 인지도 등 자족 기능을 갖추지 못해 ‘베드타운’화 된 기존 신도시의 문제점을 보완하고 젊은층에게 관심이 높은 전용 59㎡ 소형평형을 전체 가구의 50%를 공급해 공공성에도 기여한다는 방침이다. 이를 통해 서민 주거 안정에 도움될 뿐만 아니라 다른 신도시의 공급물량과 겹치지 않아 공급과잉에 대한 우려도 말끔히 씻어낼 것이란 평가다. 지자체에서 하지 못한 소형평형 공급을 민간에서 주도적으로 추진하면서 소형부터 중대형까지 공급타입을 다양화함으로써 메이저 브랜드시티의 밸런스까지 맞출 계획이다.
DK도시개발이 민간 도시개발사업으로 진행하는 사업지들은 정부가 조성하는 신도시보다 더 특색있는 완벽한 생활 기반시설을 갖추고 ‘휴양’ 콘셉트에 맞춰 다양한 여가시설이 들어서는 대한민국 최초 ‘휴양 리조트’ 도시로 조성될 예정이다. 또 검암역 로열파크씨티 푸르지오 분양 이후 2차(리조트도시Ⅱ 4742가구), 3차(리조트도시Ⅲ 4119가구) 사업도 순차적으로 공급할 계획이다.
동아닷컴 최용석 기자 duck8@donga.comⓒ 동아일보 & donga.com, 무단 전재 및 재배포 금지",/news/news_read.nhn?article_id=0003286628&office_id=020&mode=search&query=삼성물산&page=1
,"서울 서초구 반포주공1단지 3주구(반포3주구) 재건축 사업 수주를 놓고 맞붙은 대우건설과 삼성물산이 각각 ‘호텔급 컨시어지(concierge, 안내원) 서비스’와 ‘안심 서비스’를 제안했다. 양사는 5월19일 반포3주구 조합원들을 대상으로 한 건설사 1차 합동설명회를 앞두고 파격적인 제안들을 쏟아내고 있다.대우건설은 반포3주구 조합에게 시공사로 선정될 경우 ‘최우수고객(VVIP) 호텔급 컨시어지 서비스’를 제공하겠다고 18일 밝혔다. 이를 위해 세계 1위 컨시어지 업체 ‘퀸터센셜리’와 계약까지 마친 상황이다. 영국 찰스 왕세자의 부인 카밀라 파커볼스의 조카인 벤 엘리엇이 설립한 퀸터센셜리는 전 세계 60여 개 국가에서 VVIP 회원 3만 명을 관리하고 있다.
대우건설은 퀸터센셜리와 손잡고 반포3주구 입주민에 특화된 전문 컨시어지 서비스를 제공한다는 계획이다. 여행·골프·식당 등 섭외 및 예약 대행 서비스, 의전·통역 서비스, 실생활 전 분야에서 맞춤 정보를 제공하는 비서 서비스, 스마트홈 애플리케이션을 연동한 하우스키핑 서비스, 발렛파킹 서비스 등을 포함한다. 대우건설은 또한 관련 기업과의 협업을 통해 호텔식 조식 서비스(신세계푸드), 단지 내 카페(SPC그룹), 고급 헬스 서비스(GOTO피트니스), 프라이빗 뱅킹 서비스(우리은행) 등도 제공할 계획이다. 대우건설 관계자는 “대우건설의 차별화된 컨시어지 서비스로 반포3주구 입주민에게 자부심과 삶의 질 향상뿐 아니라 재산 가치 상승 효과까지 제공할 것”이라고 전했다. 이에 맞서는 삼성물산은 강력한 보안 서비스와 원스톱 생활서비스를 내세웠다. 같은 날 삼성물산은 반포3주구 조합에게 강력한 보안 환경을 구축해 입주민들의 안전을 최우선으로 확보하고 원스톱 생활서비스 환경을 만들 예정이라고 밝혔다. 먼저 단지 출입구와 놀이터, 주차장을 비롯해 단지와 상가로 직접 이어지는 지하철 9호선 구반포역 연결통로에는 500만 화소의 CCTV가 설치된다. 놀이터와 주차장에는 비상벨 시스템을 설치하고, 엘리베이터 내부에 카드키 인식 시스템을 적용해 목적층으로만 접근이 가능하도록 운영한다. 각 가구에는 얼굴인식 출입 시스템을 적용해 외부인 침입 시 자동으로 녹화하는 기능을 도입할 계획이다. 입주민들의 건강을 지키기 위한 안티-바이러스 기술도 도입한다. 동 출입구에는 퓨어게이트, 각 가구에는 에어드레서가 적용된 클린현관을 설치해 고속의 바람으로 바이러스와 미세먼지를 털어낸다. 미세먼지 등으로 야외 활동이 어려울 경우 아이들이 실내에서 안전하게 놀 수 있는 키즈 플레이하우스도 설치한다. 삼성물산 관계자는 ""래미안 20년 노하우를 담아 최상의 사업조건을 제안했고, 반포를 대표하는 새로운 랜드마크 공사를 성공적으로 수행할 것""이라고 강조했다.반포3주구 재건축 사업은 서초구 1109일대 1490가구를 재건축해 지하 3층~지상 35층, 17개동, 아파트 2091가구와 상가 등 부대복리시설을 건설하는 내용이다. 총 공사비는 8087억 원 규모다. 조합은 오는 19일 1차 합동설명회를 열고 20~29일 공식 홍보관을 운영한 뒤 30일 최종 시공사를 선정할 계획이다.윤아영/정연일 기자 youngmoney@hankyung.com▶ ▶
 ▶
ⓒ 한국경제 & , 무단전재 및 재배포 금지",/news/news_read.nhn?article_id=0004342653&office_id=015&mode=search&query=삼성물산&page=1
