head,text,url
"반포 한강변 트리플 역세권에 최고 35층 총 2990가구 공급해외설계사와 협업해 차별화된 외관, 커뮤니티 시설 도입","(서울=뉴스1) 국종환 기자 = 삼성물산 건설부문은 서울 서초구 신반포3차·신반포23차·경남아파트 통합재건축인 ‘래미안원베일리’를 연내 분양할 계획이다.‘래미안원베일리’는 서초구 신반포로19길 10 일대에 기존 아파트 2433가구를 허물고, 최고 35층 규모의 새 아파트 2990가구를 다시 짓는 프로젝트다.'래미안 원베일리'(One Bailey)는 최고의 시설과 서비스로 고품격 주거공간을 만들고자 하는 삼성물산의 의지가 담긴 단지명이다. 베일리는 중세 성 중심부에 영주와 가족들이 거주하던 공간으로, 성의 핵심 지역을 의미한다. 단지 이름에 걸맞게 거주자들에게 품격 있는 공간을 제공하겠다는 것이다.'래미안 원베일리'는 반포대교 남단 한강 변에 위치해 한강 조망이 가능하다. 반포주공2단지를 재건축한 '래미안 퍼스티지'와 함께 반포대로 변 약 5400가구 규모의 래미안 라인을 구축하게 된다. 또 한강 건너편의 이촌동 '래미안 첼리투스'에 이어 새로운 한강 변 랜드마크 단지로 자리매김할 것으로 예상된다.'래미안 원베일리'는 서울지하철 3·7·9호선을 도보로 이용할 수 있는 트리플 역세권 단지로, 올림픽대로, 반포대로가 인접해 있는 교통의 요지다. 단지 인근에 계성초·잠원초·신반포중·세화여중고 등 명문학군이 형성돼 있다. 신세계백화점 강남점과 서울성모병원도 가까워 이용이 편리하다.'래미안 원베일리' 상가는 고속터미널 지하와 연결돼 입주민들은 날씨에 관계없이 지하 공간을 통해 이동할 수 있다. 이 지하도로는 단지를 거쳐 반포 한강공원까지 연결돼 안전하게 입주민의 안전한 이동을 돕는다.단지는 해외설계사(SMDP)와의 협업을 통해 차별화된 외관과 커뮤니티 디자인을 선보일 계획이다. 특히 커뮤니티시설은 국내 최고 수준으로 준비하고 있다. 게스트하우스와 스마트 오피스, 수영장, 피트니스, 사우나뿐 아니라 한강 조망이 가능한 스카이라운지와 루프탑 캠핑장 등이 들어설 예정이다. 조·중식 서비스 공간도 설치된다.각 세대에는 삼성물산이 자체 개발한 '사물인터넷(IoT) 스마트홈 시스템'이 적용된다. 실내 미세먼지를 측정할 수 있는 IoT 홈큐브를 제공하며 안면인식, 지문인식, 자동 환기 시스템을 적용할 예정이다.전용면적 59㎡ 주택형을 포함한 전 가구에 4베이 평면을 적용해 채광을 극대화했으며, 천정고를 일반 아파트보다 20㎝ 높인 2.5m로 설계했다. 밀레니얼 세대의 취향에 맞춰 다양한 옵션을 제공할 계획이며, 에너지 저감 시스템과 친환경 자재를 활용해 친환경 아파트로 짓는다.'래미안 원베일리'에는 ‘리조트 레인보우’라는 콘셉트의 조경을 적용할 계획이다. 세계적으로 인정받은 래미안의 조경 노하우를 활용해 7가지 컨셉에 맞춰 구역별 조경 특화를 선보인다.'래미안 원베일리'는 현재 이주와 철거를 마친 상태이며, 올해 본격적인 분양에 나설 계획이다.jhkuk@news1.kr© 뉴스1코리아(), 무단 전재 및 재배포 금지",/news/news_read.nhn?article_id=0004523434&office_id=421&mode=search&query=삼성물산&page=2
서울 신반포3·부산 거제2 등 뛰어난 입지 여건 갖춰 기대감↑,"(서울=뉴스1) 국종환 기자 = 삼성물산 건설부문은 올해 서울과 부산 4곳에서 총 9869가구의 래미안 아파트를 공급할 계획이다. 이 중 4133가구를 일반에 분양한다.삼성물산의 올해 분양단지 중 가장 눈길을 끄는 곳은 서울 서초구 신반포3차·경남아파트 통합재건축인 ‘래미안원베일리’다. 총 2990가구 규모의 한강 변 대단지로 이 중 225가구를 일반분양한다.‘래미안원베일리’는 지하철 3·7·9호선이 지나는 트리플 역세권 단지다. 여기에 고속버스터미널(경부·호남선)과 신세계백화점, 강남성모병원 등 편의시설이 인접해 있어 최고의 입지 조건을 자랑한다. 단지 주변에 계성초·잠원초·신반포중·세화여중고 등 명문학군이 형성돼 있다.이어 5월에는 서울 동대문구 '용두6구역 재개발사업'을 분양한다. 총 1048가구 규모이며, 477가구를 일반분양할 계획이다. 용두6구역은 지하철1·2호선과 경전철 우이신설선이 지나는 신설동역에 인접해 있다. 이마트와 홈플러스, 시립동부병원, 동대문도서관 등 도심 인프라 이용도 편리하다.부산에서는 지난해 '연지2구역 재개발'(래미안 어반파크)을 공급한 데 이어 총 2개의 래미안 단지를 선보일 계획이다.5월 분양 예정인 '거제2구역 재개발사업'은 전체 4470가구의 대단지로 HDC현대산업개발, 대림산업과 컨소시엄을 이뤄 사업을 진행한다. 삼성물산 지분은 전체 1788가구, 일반분양 물량 1104가구이다. 부산지하철3호선 종합운동장역과 거제역, 동해선 거제해맞이역을 도보로 이용할 수 있다. 홈플러스, 부산의료원, CGV 등의 생활편의시설과 시청, 법원, 검찰청 등이 인접해 있다.하반기에는 '부산온천4구역 재개발사업'을 분양할 계획이다. 이 단지는 총 4043가구의 대단지로, 일반분양 물량만 2327가구에 달한다. 부산 주요 도로인 중앙대로와 인접해 서면 상업지구와 구서 IC를 통한 경부고속도로 접근이 용이하다. 동래고·용인고·동래여고 등 학군이 우수하고, 롯데백화점, 홈플러스, CGV, 롯데마트, 금강공원, 허심청(온천관광지) 등이 인접해 있다.한편 삼성물산이 지난해 분양한 단지들은 높은 청약경쟁률을 기록하며 인기를 실감케 했다. 서울 강남구 상아2차아파트를 재건축한 '래미안 라클래시'는 평균 115대 1, 최고 144대 1의 청약경쟁률을 기록했고, 부산연지2구역을 재개발한 '래미안 어반파크'도 평균 13대 1로 마감됐다.삼성물산 관계자는 ""래미안은 아파트부문 국가고객만족도(NCSI) 22년 연속 1위, 한국산업 브랜드파워(K-BPI) 18년 연속 1위, 국가브랜드경쟁력지수(NBCI) 17년 연속 1위를 수상하는 등 최고의 아파트 브랜드로 자리매김하고 있다""며 ""2020년에는 새로운 소비 주체인 밀레니얼 세대의 라이프 스타일을 담는 주거공간을 기획하는 등 고객들과의 소통을 확대해 나갈 것""이라고 말했다.jhkuk@news1.kr© 뉴스1코리아(), 무단 전재 및 재배포 금지",/news/news_read.nhn?article_id=0004523448&office_id=421&mode=search&query=삼성물산&page=2
,"서울 서초구 반포동 신반포15차 재건축 수주전이 본격적으로 시작됐다. 정부 규제 여파로 오랜만에 나온 재건축인 데다, 건설사의 브랜드를 알리는 데 도움되는 한강변 단지라 업계의 관심이 뜨겁다.15일 주택정비업계에 따르면 신반포15차 시공사 입찰에 삼성물산, 대림산업, 호반건설 등 3곳이 참여했다. 이 중 가장 눈에 띄는 곳은 삼성물산이다. '래미안' 브랜드로 아파트 시장에서 이름을 날리던 삼성물산은 2015년 서초무지개아파트 수주전에 참여한 후 재건축 시장에서 모습을 감췄다가 5년 만에 신반포15차 재건축에 도전하는 것이다. 삼성물산은 '래미안 원 펜타스'라는 단지명을 제안했다.대림산업은 자사 고급 아파트 브랜드인 '아크로(ACRO)'를 내세워 '아크로 브랜드 타운'을 제안했다. 한강변 최고가 아파트 '아크로리버파크'와 맞닿은 신반포15차의 지리적 특성을 활용해 최고급 주거지로 만든다는 전략이다. 대림산업이 제안한 단지명은 '아크로 하이드원'이다.호반건설은 신반포15차를 강남 재건축 시장 진출의 교두보로 삼겠다는 전략이다. 지난해 처음으로 시공 능력 기준 10위권 건설사가 됐고 기업공개(IPO)도 준비하고 있는 만큼, 반드시 시공권을 따내겠다는 각오다. 호반건설은 입찰에 참여한 건설사 중 유일하게 390억원 규모 무상 지원을 제안했다. 실내 자재를 최고급 수준으로 업그레이드하고 비용은 받지 않는 방식이다.신반포15차는 지하 4층~지상 35층 6개동, 641가구 규모로 건설된다. 다음 달 1일 조합원 총회를 통해 시공사가 결정된다.[정순우 기자 snoopy@chosun.com] 	[]	[]	[] 	- Copyrights ⓒ 조선일보 & chosun.com, 무단 전재 및 재배포 금지 -",/news/news_read.nhn?article_id=0003515095&office_id=023&mode=search&query=삼성물산&page=2
코로나 사태 장기화로기업 실적 불안하지만삼성·현대차·SK·LG4대그룹 기부만 464억개인·기관 등 합치면1천억 넘는 손길 이어져,"코로나19 사태가 전 세계를 덮쳤다. 코로나19는 단순히 감염증에 그치는 게 아니라 전 세계 시장에 '팬데믹 금융위기' 공포를 야기하는 형국이다. 한국과 중국·일본뿐 아니라 미국·유럽도 비상이 걸리며 실물경제가 얼어붙고 있다.영국 경제 분석기관인 옥스퍼드 이코노믹스는 최근 올해 세계 경제성장률 전망치를 종전 2.5%에서 2.0%로 0.5%포인트나 낮췄다고 발표했다. 유엔무역개발회의(UNCTAD)도 코로나19로 세계 경제성장률이 0.5~1.5%포인트 둔화할 것으로 내다봤다. 또 올해 전 세계 외국인직접투자(FDI)가 전년 대비 최대 15%까지 감소할 것으로 추산했다. 세계 경제가 이 같은 충격을 받으면 수출주도형 경제인 한국에는 더욱 큰 타격이 우려된다.하지만 이런 가운데서도 기업들의 '나눔과 기부'는 끊이지 않고 있다. 기업들은 코로나19 확진·사망자가 집중된 대구·경북을 중심으로 전국 각지에 성금을 기부하고 마스크·손세정제 같은 방역 물품을 지원하고 있다. 병상이 부족하자 연수원 등 회사 시설을 흔쾌히 치료센터로 제공하는 기업도 잇따르고 있다.삼성, 현대자동차, SK, LG 등 4대 그룹이 기부한 성금·현물만 464억원이다. 이 밖에 기업과 기관, 개인들이 모두 낸 성금을 합치면 1000억원에 이를 것으로 추산된다.기업들은 코로나19 대응뿐 아니라 다양한 사회공헌 사업도 지속적으로 추진하고 있다. 한 대기업 관계자는 ""기업과 시민은 코로나19 사태에 함께 맞선 운명 공동체""라면서 ""코로나19로 인한 피해도 중요하지만 이런 상황에 자칫 소홀히 하기 쉬운 다른 사회공헌 사업에 기업이 적극 팔을 걷어붙일 것""이라고 강조했다.삼성은 지난달 26일 코로나19 사태를 극복하기 위해 의료용품과 생필품 등을 포함해 총 300억원을 긴급 지원하기로 했다. 코로나19 긴급 지원에는 삼성전자를 비롯해 삼성디스플레이, 삼성전기, 삼성SDI, 삼성SDS, 삼성생명, 삼성화재, 삼성카드, 삼성증권, 삼성물산, 삼성엔지니어링, 호텔신라, 제일기획, 에스원 등 14개 계열사가 참여했다.또 삼성은 코로나19로 어려움을 겪고 있는 협력사들이 경영을 안정적으로 이어갈 수 있도록 1조원 규모 펀드를 조성해 운영 자금을 지원하고 있다. 협력사를 위해 물품 대금 1조6000억원도 조기 지급했다. 삼성은 이어 경북 영덕군에 있는 300실 규모의 삼성인력개발원 연수원도 코로나19 경증환자를 위한 생활치료센터로 제공했다.삼성전자는 이 밖에 전국 청소년과 협력사를 위한 상생협력도 확대하고 있다. 삼성전자는 드림클래스, 스마트스쿨 등 사업을 벌여 작은 섬마을부터 대도시 저소득층까지 아이들이 교육을 받을 수 있는 기회를 확대해왔다. 또 스마트팩토리, 협력사 상생펀드 지원을 확대해 중소기업과 협력사가 함께 발전하며 성장하도록 토대를 제공하고 있다.이재용 삼성전자 부회장은 지난해 11월 19일 호암 이병철 회장 추도식에서 ""선대 회장님의 사업보국(事業報國) 이념을 기려 우리 사회와 나라에 보탬이 되도록 하자""며 기업의 사회적 책임과 역할을 강조한 바 있다.재계 2위 현대차그룹도 코로나19 예방과 피해 복구를 위해 힘을 아끼지 않고 있다. 현대차그룹은 지난달 코로나19 성금 50억원을 전국 재해구호협회에 기탁했다. 또 경북 지역에 위치한 그룹 연수원 2곳을 대구·경북 지역 코로나 경증환자 생활치료센터로 제공하기로 했다. 이 밖에 현대차그룹은 중소 부품 협력사를 위해 3080억원 규모 경영 자금 무이자 지원 △납품 대금 5870억원, 부품 양산 투자비 1050억원 조기 결제 등 총 1조원 규모 자금을 지원한다는 방침이다.SK는 코로나19 확산 방지와 피해 지원을 위해 성금 50억원을 제공했다. 이와 함께 경북 구미에 위치한 SK실트론은 대구·경북 지역을 위해 마스크 10만장과 손세정제 2만5000개 등 4억원 상당 현물을 지원하기로 했다.이 밖에 SK는 금융기관·대학과 함께 사회적 가치 개선에 힘쓰는 소셜 벤처기업을 집중 육성하는 방법도 추진하고 있다. SK와 신한금융그룹, KAIST SK사회적기업가센터, 옐로우독(YD)-SK-KDB 소셜밸류 투자조합은 4월 12일까지 소셜벤처와 예비 창업가를 대상으로 '임팩트 유니콘' 연합 모델을 공모하고 있다.SK는 협력사 상생을 위해서도 노력하고 있다. SK텔레콤은 코로나19 확산으로 어려움을 겪고 있는 전국 유통망, 네트워크 협력사 등 비즈니스 파트너를 위해 총 1130억원 규모의 종합 상생 방안을 마련했다. 11번가도 161개 중소 협력사·납품업체를 위해 50억원 규모의 조기 대금 지급을 결정했다.LG 역시 코로나19 감염 확산 예방과 피해 회복 지원에 총력을 다하고 있다. LG는 지주회사 (주)LG 및 계열사 CSR팀으로 상시 지원 태스크포스(TF)를 구성해 운영하며 코로나19 관련 지원 방안을 마련해 실행하고 있다. 특히 현재 가장 절실하고 시급하게 도움이 필요한 대구·경북 지역 의료 현장을 중점 지원하고 있다.LG는 대구·경북 지역 병상 부족 사태를 해결하는 데 힘을 보태기 위해 550실 규모인 경북 지역 기숙사와 연수원을 생활치료센터로 제공했다. 또 코로나19 사태를 맞아 싸우는 의료 관계자와 지역 방역을 위해 성금 50억원을 그룹 차원에서 기부했다.이와 함께 LG는 최일선에서 방호복 등 보호장구, 생필품, 건강관리 가전 제품, 업무 연락용 휴대폰을 긴급히 확보해 대구·경북에 급파된 의료인에게 지원하고 있다. LG생활건강은 현장 의료진의 불편을 덜어줄 소용량 생수, 휴대용 세면도구, 소독 제품을 3월 한 달간 매주 공급하기로 했다. LG유플러스는 의료진의 긴급 업무 연락 및 환자 상담용 휴대폰이 부족한 상황에 따라 대구시 등을 통해 임대폰 100대와 통신요금을 지원한다. LG전자는 건조기와 공기청정기 등 건강관리 가전 제품을 지원한다. 성금 외에 이 같은 현물 지원 규모는 총 10억원에 이른다.[기획취재팀 = 이호승 기자 / 김태성 기자 / 원호섭 기자 / 전경운 기자 / 이종혁 기자 / 이용익 기자 / 황순민 기자 / 박윤구 기자 / 임형준 기자 / 최근도 기자] [ⓒ 매일경제 & mk.co.kr, 무단전재 및 재배포 금지]",/news/news_read.nhn?article_id=0004536897&office_id=009&mode=search&query=삼성물산&page=2
,"[이데일리 경계영 기자] 3월 정기 주주총회 시즌이 본격화한 가운데 기업의 최고 의사결정 기구인 이사회 구성이 달라졌다. 주요 기업의 사외이사 4분의 1이 물갈이됐고 사외이사 후보자에 이름을 올린 여성이 많아졌다. 상법과 자본시장법, 국민연금법 시행령 개정이 불러온 변화의 일단이다. 이데일리가 15일 대기업집단 상위 9개 그룹(농협을 제외한 삼성·현대차·SK·LG·롯데·포스코·한화·GS·현대중공업)의 매출액 상위 3개사씩 총 27개 상장사를 분석한 결과, 15개사(55.6%)가 이달 정기 주주총회에서 신규 사외이사 선임 안건을 의결할 예정이다. 이 가운데 절반에 가까운 7개사가 6년 안팎을 함께한 사외이사를 바꾼다. 이는 정부가 연초 사외이사 임기를 6년(같은 기업집단 계열사의 경우 9년)으로 제한하는 내용의 상법 시행령 개정안을 실시했기 때문이다. 통상 사외이사 임기가 3년인 점을 고려하면 한 기업에서 세 번 이상 연임할 수 없게 된 셈이다. 이는 인원으로만 따져도 올해 임기가 만료되는 사외이사 50명 가운데 12명(24%)에 해당한다. 9년 동안
사외이사로 재임한 김성재 한국외국어대 경영학부 교수를 필두로 최종원 서울대 행정대학원 교수(), 신동규 전 NH농협금융지주 회장() 등이 이른바 ‘6년 제한 룰’에 걸려 사외이사직을 내려놓는다. 여성 사외이사는 이번 주총 이후 총 12명으로 지난해보다 2배 늘어날 전망이다. 오는 8월 자산총액 2조원 이상인 기업은 이사회 구성원 가운데 최소 1명 이상을 여성으로 포함하도록 한 자본시장법 개정안 시행을 앞두고 있어서다. 처음으로 여성 사외이사를 선임키로 한 을 포함해 6개사가 여성 사외이사를 신규 선임한다. 다만 관료 출신, 특히 친여권 인사를 사외이사로 ‘모시는’ 관행은 여전했다. 문재인정부에서 초대 법무부 차관을 지낸 이금로 법무법인 솔 대표변호사가
사외이사로 갔고 노무현 정부와 인연을 맺은 정병석 전 노동부 차관(), 박태주 전 대통령비서실 노동개혁태스크포스(TF)팀장(삼성SDI), 김상희 전 법무부 차관() 등도 신규 사외이사 선임안에 이름을 올렸다. 김윤경 한국경제연구원 연구위원은 “사외이사에겐 전문성도 중요한 덕목인데도 이번 법 개정으로 독립성을 강제했다”면서 “이는 다른 나라에서 유례를 찾기 어려울 뿐더러 기업의 자율적 정화 대신 정부가 먼저 방향을 정해 강제했다는 점에서 우려가 나올 수밖에 없다”고 지적했다. [그래픽=이데일리 이동훈 기자]경계영 (kyung@edaily.co.kr)＜ⓒ종합 경제정보 미디어 이데일리 - 무단전재 & 재배포 금지＞",/news/news_read.nhn?article_id=0004597767&office_id=018&mode=search&query=삼성물산&page=2
◇‘6년 제한’ 때문에…바뀌는 사외이사,"[이데일리 경계영 기자] “제가 경험한 네이버, 다음, 카카오 등 온라인 기업은 어떤 결정 전까지 기업의 이익과 사회적 기여에 대한 엄청난 의견과 논쟁을 마다하지 않는, 나름 바람직한 사외이사들이며 이사회였다. 분명히 해당 기업만의 이익만을 대변하지 않았음을 알고 있다.” 최재홍 강릉원주대 멀티미디어학과 교수가 지난달 26일 자신의 사회관계망서비스(SNS)에 6년간 재임했던
사외이사직을 떠나며 남긴 글이다. 최 교수는 카카오가 다음과 합병하기 전부터 사외이사를 맡아 카카오 성장을 지켜본 산증인이지만 이른바 ‘6년 제한 룰’에 걸려 사외이사에서 퇴임할 수밖에 없었다. 도입 22년을 맞은 사외이사 제도가 변곡점에 섰다. 한 기업에 6년 이상 사외이사로 재임하지 못하도록 하는 내용의 상법 개정안과 자산총액 2조원 이상인 상장사를 대상으로 이사회 등기임원 가운데 최소 1명 이상을 여성을 두도록 한 자본시장법 개정안이 올해부터 적용된다. 기업 경영을 감시·견제하려 임명됐지만 기업 입맛대로 찬성표를 던지는 등 제 역할을 하지 못하는 비판을 듣던 사외이사가 이들 법 개정으로 독립성·다양성을 확보하리란 긍정적 평가가 나온다. 반면 우리나라 인력 풀이 제한적인 데다 기업에 선택의 폭을 좁혀 지속가능하지 않은 제도라는 비판도 동시에 제기된다. 이데일리가 15일 대기업집단 상위 9개 그룹(농협을 제외한 삼성·현대차·SK·LG·롯데·포스코·한화·GS·현대중공업)의 매출액 상위 3개사씩 총 27개 상장사를 분석한 결과, 삼성물산·삼성SDI·SK텔레콤·SK하이닉스·LG유플러스·한화솔루션·GS리테일 등 7개사가 이달 정기 주주총회에서 6년 안팎을 재임한 사외이사 대신 신규 사외이사를 선임하는 안건을 의결할 것으로 나타났다. 의 경우 사외이사 4명 모두 이른바 ‘6년 제한 룰’에 걸려 교체한다. 2011년 3월부터 사외이사로 재임한 김성재 한국외국어대 경영학부 교수뿐 아니라 2014년 3월부터 재임한 김난도 서울대 소비자학과 교수·김재희 연세대 전기전자공학과 교수·홍석주 로커스캐피탈파트너스 대표도 사외이사에서 물러난다. 빈자리는 권오경 한양대 융합전자공학부 교수와 박태주 고려대 노동문제연구소 선임연구원, 최원욱 연세대 경영대학 교수 등이 메운다.
역시 사외이사직을 자진 사임한 빈자리 하나를 제외하면 장달중 서울대 정치학과 명예교수와 권재철 수원대 고용서비스대학원 석좌교수가 6년 임기를 다하고 사임하고 정병석 한양대 경제학부 특임·석좌교수, 이상승 서울대 경제학부 교수 등이 신규 선임된다. 6년 제한 룰에 해당되지 않는데도 신규 사외이사를 선임한 사례는 , , , , ,
정도였다. 이번에 임기 만료되는 사외이사가 없는 와 을 제외하면 ‘6년 제한 룰’에 걸리지 않는 기업 18개사는 사외이사 재선임을 택했다. 27개사의 여성 사외이사는 지난해 9월 말 기준 6명에 그쳤지만 이달 주주총회를 거쳐 12명으로 늘어날 예정이다. 자본시장법 개정으로 8월부터 자산총액 2조원 이상인 상장사는 여성 등기임원을 최소 1명 이상 선임해야 하기 때문이다. 오너 3세인 김동관 부사장이 등기임원으로 선임되는 등 이사회 기능 강화를 꾀하는 은 에너지분야에서 차세대 여성 리더로 꼽히는 어맨다 부시(Amanda Bush) 세인트 오거스틴 캐피탈 파트너스 파트너를 사외이사 후보로 올렸다. 여성 사외이사가 나오기는 한화그룹 가운데서도 처음일 정도로 이례적이다. 그는 미국의 41대 대통령인 조지 H.W. 부시의 아들인 젭 부시 전 플로리다 주지사의 며느리이기도 하다. 는 한애라 성균관대 법학전문대학원 교수를 이번에 신규 사외이사로 선임하는 안건을 내놓으면서 이사회 내 첫 여성 등기임원 탄생이 임박했다. 은 전영순 중앙대 경영대학 교수를, 은 중앙대학교 법학전문대학원 교수를 각각 첫 여성 사외이사로 선임할 계획이다. 삼성물산은 제니스 리 전 SC제일은행·금융지주 경영지원총괄 부행장을, 삼성SDI는 김덕현 민주화운동관련자명예회복및보상심의위원장을 각각 여성 사외이사 후보자로 이름을 올렸다. 이같이 이사회 내 여성 비중이 높아지고 종전에 6년 이상 재임하던 사외이사가 물갈이되는 등 이사회 구성이 다양해졌지만 우려의 목소리도 나온다. 김윤경 한국경제연구원 연구위원은 “사외이사 독립성 문제를 사외이사 추천 위원회를 비롯해 자발적으로 해소할 수 있는데도 정부가 기업 경영에 간섭하는 제도로 접근하는 덴 무리가 있다”며 “우리나라에서 전문성을 보유한 사외이사 인력 풀이 전직 고위 공직자, 교수, 최고경영자(CEO) 등으로 넓지 않은 데다 재임 기간을 제한해 기업 선택의 폭을 좁혔다”고 말했다. 반면 박주근 CEO스코어 대표는 “사외이사의 본래 목적을 달성하려면 전문성과 독립성이 필요한데 우리나라 사외이사는 둘 모두 약하다”며 “사외이사 40%를 관료 출신이 차지하는 등 독립성 문제를 해결하고 다양성을 확대하는 데 상법·자본시장법의 개정이 긍정적 효과를 가져올 것”이라고 봤다. 경계영 (kyung@edaily.co.kr)＜ⓒ종합 경제정보 미디어 이데일리 - 무단전재 & 재배포 금지＞",/news/news_read.nhn?article_id=0004597768&office_id=018&mode=search&query=삼성물산&page=2
