head,text,url
,"[디지털타임스 이상현 기자] 올해 단일단지로는 사실상 최대 규모로 공급되는 '검암역 로열파크씨티 푸르지오'가 입주자 모집공고를 내고 본격적인 분양일정에 들어간다.국내 최초 리조트형 아파트를 표방하는 이 단지는, 인천광역시에서 가장 분양가가 높은 송도보다는 낮고, 인근 검단신도시보다는 상대적으로 높은 가격대에 분양가를 책정했다. 올해 인천 구도심 부평구에서 분양한 단지들과 비슷한 수준의 가격대여서, 국내 최초 리조트형 아파트라는 슬로건을 내건 DK도시개발·DK아시아의 승부수에 실수요자들이 얼마나 관심을 보일지가 관건이 될 전망이다.27일 DK도시개발·DK아시아에 따르면 검암역 로열파크씨티 푸르지오는 오는 29일 견본주택을 개관하고 분양일정에 들어간다.이 단지는 총 4805가구 규모로, 인천은 물론 전국을 기준으로도 올해 공급되는 새 아파트 단지 중 공급규모가 가장 큰 단지다.DK도시개발·DK아시아는 '국내 최초 리조트형 아파트'라는 슬로건을 내걸고 분양에 나설 계획이다. 이에 따라 단지에는 삼성물산 리조트부문과 협업한 다양한 조경시설을 비롯해 3끼 식사 서비스, 지하철역까지의 셔틀버스 등 다양한 서비스가 도입된다.분양가는 전용면적 84㎡타입을 기준으로 평균 1529만원에 책정됐다.1단지를 기준으로 전체 분양가를 살펴보면, 4억5470만~5억5260만원 선이다. 2단지를 기준으로는 4억5800만~5억5660만원 선으로, 4억원대 중반~5억원대 중반에 가격대가 형성됐다.해당 분양가는 같은 인천 서구의 검단신도시 분양단지들의 가격보다는 상대적으로 비싼 편이다.올해 초 인천 검단신도시에서 분양됐었던 검단신도시 우미린 에코뷰의 전용면적 84㎡평형의 분양가가 3억7900만~4억4150만원대에 분양됐다는 것을 감안하면 평균 1억원 가량 더 비싸다.분양가만 놓고 보면 오히려 올해 인천 구도심 부평구 일대에서 분양됐던 단지들과는 분양가가 비슷한 수준이다.올해 초 분양됐던 부평역 한라비발디(5억800만~5억6300만원), 부평역 중앙하이츠 프리미어(4억5340만~4억5980만원)의 같은평형(84㎡)분양가와 비교해보면 비슷하거나 소폭 높은 수준인 셈이다.푸르지오와 같은 대형 건설사 브랜드 아파트의 이름으로 분양된 힐스테이트 부평의 같은면적도 4억7650만~5억3980만원으로, 사실상 부평구에 분양됐던 아파트들의 분양가와 가장 유사한 수준이다.단지가 들어서는 인근의 검암역이나, 단지에서 가장 가까운 지하철역인 독정역 인근 단지들의 실거래가와 비교해도 저렴한 분양가는 아니다.이 단지는 단지명에 검암역이 들어가지만 직선거리로는 독정역이 오히려 더 가깝다. 독정역 바로 앞에 위치한 검단SK뷰 전용면적 84㎡A타입의 최근 실거래가는 3월(4억2000만~4억5900만원)으로 이 단지의 분양가보다 오히려 낮다. 검단SK뷰는 2017년 준공된 신축단지다.또다른 독정역 인근 단지인 검단힐스테이트4차의 경우 더 넓은 평형인 107㎡A타입의 이달 실거래가가 3억8000만~4억원으로, 검암역 로열파크씨티 푸르지오의 분양가보다 오히려 낮은 편이다.그는 ""분양가가 크게 매력적이게 나오지는 않았지만 단지의 장단점이 워낙 뚜렷한 편""이라며 ""아무래도 매립지에서 거리가 먼 2단지의 선호도가 더 높을 것으로 보인다""고 말했다.이상현기자 ishsy@dt.co.kr 디지털타임스
/",/news/news_read.nhn?article_id=0002600677&office_id=029&mode=search&query=삼성물산&page=1
"인천 부동산시장 판도 바꾸는 차세대 리조트단지전용 59~241㎡ 총 4805가구전용 85㎡ 이하 90% 공급, 84㎡기준 3.3㎡당 평균 1529만원","[파이낸셜뉴스]올해 아파트 분양시장 최대어로 꼽히며 인천 최초 대장주 아파트로 떠오른 ‘검암역 로열파크씨티 푸르지오’가 분양에 돌입한다.
 DK도시개발·DK아시아는 오는 29일 인천 서구 백석동 170-3번지 일대에 ‘검암역 로열파크씨티 푸르지오’ 견본주택을 열고 본격적인 분양에 나선다고 밝혔다.
 대우건설이 시공하는 이 아파트는 지하 2층~지상 최고 40층 25개 동, 전용면적 59~241㎡ 총 4805가구 매머드급 대단지로 오션뷰(정서진)와 리버뷰(아라뱃길)를 한눈에 누리는 대한민국 첫 번째 리조트 도시로 조성된다. 젊은층에게 인기가 많은 전용 85㎡ 이하 중소형 평형을 전체 가구의 90% 규모로 공급한다. 분양가는 84㎡기준 3.3㎡당 평균 1529만원이며, 계약금 10%, 중도금 60% 이자 후불제로 공급된다.
 추첨제 비율은 전체의 80%에 달해 청약 가점이 낮은 30~40대도 당첨 기회가 제공된다. 주택담보대출비율(LTV)도 최대 70%까지 가능하다. 예비 당첨자 비율을 공급가구수의 300%로 확대돼 수도권 거주자도 당첨을 노려볼 수 있다.
 이 단지가 주목 받는 가장 큰 이유는 규모, 조망, 교통, 생활인프라 등 모든 면에서 기존 주택과 차원이 다른 ‘하이엔드’ 아파트로 조성된다는 점이다.
 삼성물산 리조트부문은 아파트 단지 내 최초 ‘미니 에버랜드 조경’과 100만주에 가까운 꽃과 나무를 심는 ‘밀리언 파크'(Million Park) 조경을 선보인다. LG전자가 차세대 IoT기술을 적용하고, 풀무원푸드앤컬처의 삼식(三食) 서비스가 합리적인 가격으로 제공된다. 종로엠스쿨의 직영학원도 들어오며, 3년간 무상으로 ‘돕다(DOPDA)’ 컨시어지 서비스도 도입된다.
 기존 백석중, 백석고, 한국주얼리고 외에 기부채납 방식으로 (가칭)한들초등학교 및 (가칭)한들유치원이 새로 건립 후 준공에 맞춰 개교할 예정이다.
 인천 지하철2호선 독정역과 인접해 있고, 검암역 인천공항철도와 서울지하철 9호선 직결화 사업(예정)을 통해 환승 없이 강남으로 연결될 예정이다.
 정부가 최근 발표한 분양권 전매금지 규제 대상에 해당되지 않아 당첨자 발표 6개월 이후에는 횟수에 상관 없이 무제한 전매도 가능하다. 안심 전매프로그램 적용으로 1차 중도금 납부 전 전매가 가능하다. 수도권 분양가상한제 아파트에 적용하는 ‘최대 5년 거주 의무’ 규제도 적용받지 않아 실수요자는 물론 투자자들의 관심이 높다.
 DK도시개발·DK아시아 김정모 회장은 “도시를 만들어가는 라이프 씨티 크리에이터(Life City Creator)로서 현대인들에게 4세대 아파트를 넘어 서울에서 가장 가까운 대한민국 최초 ‘차세대 휴양 리조트 도시’를 만들겠다“며 “고급 리조트에서만 누리던 다양한 서비스를 제공해 입주민들이 단지 안에서 모든 것을 해결할 수 있는 인천 최초 전국 ‘대장주 아파트’로 조성할 계획”이라고 말했다.
 현장 견본주택은 코로나19 확산 방지를 위해 사전 예약제로 운영되며, 사이버 모델하우스도 동시 오픈한다. 사이버 모델하우스에서는 아나운서 이지애, 배우 조현재 부부, 배우 신다은 부부 등이 출현해 모형도, 입지, 커뮤니티, 단지 유니트 등 실제 견본주택을 둘러보며 실수요자 입장에서 소개하는 영상도 만나볼 수 있다.
 6월 8일 특별공급을 시작으로 9일 1순위, 10일 2순위 청약접수를 받는다. 입주는 2023년 6월 예정이다.



 ※ 저작권자 ⓒ 파이낸셜뉴스. 무단 전재-재배포 금지",/news/news_read.nhn?article_id=0004432295&office_id=014&mode=search&query=삼성물산&page=1
,"[머니투데이 조한송 기자]
반포3주구 재건축 사업 입찰에 참여한 삼성물산 건설부문이 반포3주구를 래미안 20년을 대표하는 기념비적 작품으로 만들겠다고 27일 밝혔다.먼저 단지 외관은 커튼월룩과 경관조명을 통해 럭셔리함과 차별성을 부각했다. 동출입구 또한 문주와 통일감 있는 디자인의 조명과 아트월을 적용해 랜드마크 디자인을 완성했다.단지 중앙에 축구장 3배 정도 크기인 약 2만㎡ 규모의 거대한 자연숲을 조성할 예정이다. 반포천 정화와 연계한 반포천 특화 조경과 5km에 이르는 단지내 산책로, 약 3000㎡의 수공간 등의 조경을 선보일 예정이다.대안 설계를 통해 세대당 평균 8㎡의 확장 가능한 면적을 확보하고 입주민의 취향에 맞춰 선택할 수 있는 평면을 제시했다. 주방가구와 원목마루는 이탈리아산 브랜드 제품을 모든 가구에 제공하고 층간 소음 저감 솔루션도 제공할 계획이다. 삼성물산 관계자는 ""글로벌 디자인회사와 협업해 독창적인 외관 디자인을 제안했다""며 ""반포3주구에 압도적인 단지 조경을 선보일 계획""이라고 설명했다. 조한송 기자 1flower@mt.co.kr
<저작권자 ⓒ '돈이 보이는 리얼타임 뉴스' 머니투데이, 무단전재 및 재배포 금지>",/news/news_read.nhn?article_id=0004415504&office_id=008&mode=search&query=삼성물산&page=1
반팔 티셔츠는 물론 아이스 청바지·레깅스 시원한 '냉감 소재'로 재활용 원단·동식물 보호친환경 정책으로 '착한 브랜드' 마케팅 확산,"완연한 초여름 날씨다. 올해 폭염과 열대야가 극심할 것이란 전망이 나오자 패션업체들이 분주해졌다. 특히 아웃도어 브랜드가 냉감 기능성 소재 제품을 잇달아 내놓고 있다. 이너웨어(속옷)는 물론 티셔츠, 레깅스, 청바지 등 다양한 제품을 쏟아내고 있다.냉감 기능성 의류 경쟁에 뛰어든 대표적인 아웃도어 브랜드는 K2와 아이더다. 매년 새로운 냉감 기능성 소재를 선보이며 경쟁하고 있다. 올해도 작년보다 개선된 기술을 적용한 신제품을 선보였다.K2는 냉감 의류 ‘오싹’ 제품에 특수 냉감 소재를 더한 ‘듀얼쿨링’ 시스템을 적용했다. 오싹 티셔츠는 몸에 닿으면 시원하게 느껴지는 냉감 소재로 제작한다. 안감엔 체온이 상승하면 열을 흡수하는 냉장 물질 가공을 했다. 바람이 잘 통하고 가볍게 제작했다. 남성용 오싹 폴로 티셔츠는 평소 출근용으로 입기에도 적합한 디자인이다. 땀이 많이 나는 등판엔 메시 소재를 사용했다. 여성들이 입기 좋은 오싹 레깅스는 가볍고 신축성이 뛰어나 여름에 입기 좋다. 얇고 시원한 소재로 제작했다. 단색뿐 아니라 스트라이프 무늬로도 나왔다.아이더도 매년 냉감 기능성 소재 신제품을 내놓고 있다. 올해는 티셔츠뿐 아니라 청바지, 레깅스 등으로 확대했다. 아이더의 ‘아이스 쿨넥 폴로 티셔츠 벤트’와 ‘아이스 데님 팬츠 텔포드’, ‘아이스 에어데님 조셉’ 등이 대표 제품이다. 반팔 티셔츠는 옷깃에 피부가 닿을 때마다 시원한 느낌이 들도록 제작한 것이 특징이다. 청바지는 여름에 더울 것이라는 선입견을 깬 아이스 데님은 아이더가 독점 개발한 메시 데님 소재를 썼다. 바람이 잘 통해 시원하다. 바지 안쪽에 프린트한 ‘버추얼 아이스 큐브’가 땀과 수분에 닿으면 체온을 떨어뜨리는 기능을 한다.유니클로도 여름철 베스트셀러인 ‘에어리즘’을 올해는 일상복으로 확대했다. 이너웨어뿐 아니라 레깅스, 반팔 티셔츠, U넥 티셔츠 등을 출시했다. 여성용 제품엔 자외선 차단 기능성 소재를 더했다. 홈트레이닝을 즐길 때, 가벼운 산책을 하거나 집 근처 외출할 때 입기에 좋다.최근 패션업체들은 ‘친환경’ 캠페인에 공을 들이고 있다. 착한 브랜드를 찾아 ‘가치 소비’를 하는 젊은 층이 늘어난 데 따른 것이다. 너무 많이 버려져 환경을 해치는 옷을 재활용해야 한다는 ‘착한 소비’ 운동도 확산하고 있다.코오롱스포츠는 국내 멸종 위기 동식물을 보호하는 캠페인 ‘노아 프로젝트’를 2016년부터 매년 진행하고 있다. 매번 한 종류의 동물이나 식물을 선정해 이를 옷 디자인에 적용하고 판매 수익금을 환경보호에 사용한다. 올해 봄·여름 노아 프로젝트의 주제는 ‘에버그린, 파인그린’이다. 코오롱스포츠의 로고에 들어간 상록수와 소나무를 보호하자는 취지다. 상품 포장지를 친환경 소재로 쓰고, 이산화탄소 배출량을 줄이는 재활용 원사로 제품을 만들고 있다. 쇼핑백도 100% 생분해성 수지로 제작해 일반 쓰레기와 함께 버릴 수 있게 했다. 옷걸이를 옥수수 전분 추출물을 사용한 생분해성 플라스틱으로 제작하는 등 곳곳에 친환경 정책을 반영하고 있다.삼성물산 패션 브랜드 구호도 시각장애 어린이들에게 기부하는 프로젝트 ‘하트 포 아이’를 2006년부터 매년 진행하고 있다. 유명인, 예술가와 협업한 제품을 캠페인 상품으로 제작해 그 수익금을 삼성서울병원에 기부한다. 기부금은 저소득층 시각장애 어린이의 개안 수술과 치료에 쓰인다.최근엔 등산을 즐기는 젊은 층이 늘었다. 신종 코로나바이러스 감염증(코로나19) 확산으로 혼자 산에 오르는 2030 ‘혼산족’이 증가했다. 자신을 돌아보고 몸과 마음을 가꾸기 위해 산을 찾는 것이다. 블랙야크의 산행 소셜 액티비티 플랫폼인 ‘블랙야크 알파인 클럽(BAC)’ 회원 수도 크게 늘었다. 이 앱에선 ‘명산100’ ‘백두대간 에코 트레일’ 등 산행 프로그램을 이용할 수 있다.민지혜 기자 spop@hankyung.com▶ ▶
 ▶
ⓒ 한국경제 & , 무단전재 및 재배포 금지",/news/news_read.nhn?article_id=0004348594&office_id=015&mode=search&query=삼성물산&page=1
▶ 네이버 홈에서 [한국경제TV] 채널 구독하기 [생방송보기]▶ 대한민국 재테크 총집결! - [증권 / 주식상담 / 부동산],"[한국경제TV 조연 기자]<앵커>공사비가 최대 수조원에 이르는 대규모 재개발·재건축 사업지를 중심으로 건설사들의 수주전이 한층 치열해지고 있습니다.'최고급 주거 명작', '새로운 랜드마크'를 앞다퉈 외치며 조합원들에게 구애를 펼치고 있는데요.먼저 조연 기자입니다.<기자>28일 열리는 서울 서초구 신반포21차 수주전은 GS건설과 포스코건설이 맞붙습니다.2개동, 사업비는 1천억 원 수준의 중소형 단지지만, 반포역 인근 대규모 '자이타운'을 꿈꾸는 GS건설과 강남 재건축 시장 진입을 노리는 포스코건설이 물러섬 없는 승부를 벌이고 있습니다.포스코건설은 자금력을 바탕으로 '후분양 카드'를 먼저 꺼내들었고, GS건설은 일반분양 시점을 조합이 선택하는 '프라임타임 분양제'으로 맞섰습니다.이어 30일에는 시장의 '뜨거운 감자', 반포3주구 조합이 시공사를 선정합니다.삼성물산과 대우건설이 자존심을 건 총력전에 나서며, 화려한 디자인과 각종 스마트 기술을 총망라한 단지 설계, 그리고 금융부담을 덜어줄 다양한 분양 방식 등을 앞다퉈 내놓았습니다.다만 비방과 고소전이 오고가는 등 수주전이 과열양상을 빚으며 '클린수주 시범사업장'이란 타이틀이 무색해지는 모습입니다.또 이에 앞서 조국 전 법무부 장관 거주지로 유명세를 탄 서초구 방배삼익 재건축 사업은 대림산업이, 공사규모가 9천억원 웃도는 은평구 갈현1구역은 롯데건설이 수주했습니다.재건축·재개발 수주전이 다시 활기를 띄면서 벌써 올해 정비사업 수주 규모가 1조원을 넘긴 건설사도 3곳이나 됩니다.현대건설과 현대엔지니어링, 그리고 롯데건설이 수주 1조 클럽에 자리하게 됐는데, 이번주 반포3주구와 다음달 있을 한남3구역 수주 결과에 따라 올 한해 건설사들의 도시정비 순위 싸움이 판가름 날 것이란 전망입니다.<인터뷰> 손태홍 건설산업연구원 미래기술전략연구실장""해외 건설시장에 대해 사업 포트폴리오 절반을 가지고 있는 상위 10대 건설사들은 불확실성이 커지고 하방압력에 시달리고 있습니다. 건설기업들이 내몰리고 있는 상황인거죠.""코로나19 사태로 해외 수주 리스크가 재부상하며 '캐시카우'인 주택사업 중요성이 더 커져가는 가운데,
분양가상한제 시행 전 마지막 알짜 사업장을 차지하기 위한 건설사들의 생존 싸움이 더욱 치열해지고 있습니다.한국경제TV 조연입니다.조연 기자 ycho@wowtv.co.krⓒ 한국경제TV, 무단 전재 및 재배포 금지",/news/news_read.nhn?article_id=0000873882&office_id=215&mode=search&query=삼성물산&page=1
,"삼성물산은 부산 거제2구역 주택재개발 정비사업조합 등 3개 주택정비사업조합, Samsung C&T Corporation Saudi Arabia 등 10개 해외법인이 The Saudi British Bank 등으로부터 빌린 7935억원에 대해서 채무보증을 결정했다고 27일 공시했다.채무보증 금액은 자기자본(26조 6921억원) 대비 2.97% 수준이며, 보증 기간은 미정이다.한편, 삼성물산은 장 마감 이후 해당 기업공시를 발표했으며 오늘 종가가 101,000원, 거래량은 443,600주로, 직전 거래일 대비 1,500원(-1.46%) 하락했다.공시 전문으로 이동스톡봇 기자※ 이 기사는 국민일보와 엠로보가 개발한 증권뉴스 전용 인공지능 로봇 ‘스톡봇’이 금융감독원 전자공시시스템(DART)과 한국거래소(KRX) 데이터를 토대로 작성한 것입니다. 지속적인 업그레이드를 통해 더욱 풍부하고 정확한 내용을 담아 가겠습니다.GoodNews paper ⓒ , 무단전재 및 재배포금지",/news/news_read.nhn?article_id=0001325678&office_id=005&mode=search&query=삼성물산&page=1
,[이데일리 경계영 기자] 삼성물산(028260)은 부산 거제2구역 재개발 정비사업조합 등 3개 정비사업조합과 사우디아라비아를 비롯한 10개 해외법인을 대상으로 7935억원 규모의 채무보증을 결정했다고 27일 공시했다. 이는 지난해 말 자기자본 대비 3.0%에 해당한다.경계영 (kyung@edaily.co.kr)＜ⓒ종합 경제정보 미디어 이데일리 - 무단전재 & 재배포 금지＞,/news/news_read.nhn?article_id=0004649844&office_id=018&mode=search&query=삼성물산&page=1
"시공사 투표 독려 위한 일부 조합OS, 대우건설 지지 발언…조합 측 ""엄중 조치""","[아이뉴스24 김서온 기자] 올해 정비시장 최대어 중 하나로 손꼽히는 반포주공1단지 3주구(이하 반포3주구) 최종 시공사 선정을 사흘 앞두고 조합에서 운영하는 일부 OS(외주 홍보직원)요원들이 특정 건설사에 편향성을 갖고 있다는 지적이 제기됐다. 현재 반포3주구 재건축 수주전은 대우건설과 삼성물산이 참가해 2파전 구도를 형성하고 있다.27일 반포3주구 조합에 따르면 조합 자체적으로 오는 30일 열리는 '2차 합동설명회와 최종 시공사 선정 총회' 참가율을 높이고, 통계 수치 조사를 위해 자체 OS요원을 고용했다.반포3주구는 서울시 클린 사업장 1호로 지정된 곳으로, 건설사들이 개별적으로 홍보요원을 동원하는 것은 불법에 해당된다. 조합측이 운영하는 OS요원 이외의 대우건설과 삼성물산 측이 직접 나서 OS요원을 통해 조합원을 개별적으로 접촉하는 것이 금지된 것이다.조합에서 직접 운영중인 조합OS는 1천490세대 규모를 자랑하는 대단지인 만큼, 최대한 많은 조합원의 투표를 독려하는 것이 목표다. 그러나 이 조합OS요원들이 일부 반포3주구 조합원들의 집에 직접 찾아가 대우건설을 지지하는 발언을 하며 투표를 독려해 논란을 사고 있다.반포3주구 조합원 A씨는 ""대우건설 측 OS가 조합원의 직장에 직접 찾아오는 것 뿐만 아니라 이제는 조합OS가 대우건설을 밀어주고 있다""며 ""이해되지 않는 상황""이라고 지적했다.또 조합OS요원들이 직접 조합원들의 집에 찾아 단지 내에 마련된 홍보관을 다녀왔는지, 최종 시공사 선정 총회에 참석할 것인지 질문한데 이어 대우건설과 삼성물산의 계약서를 직접 비교하기까지 했다. 공정한 활동을 해야 하는 조합OS요원들이 주어진 임무를 넘어선 과도한 활동을 한 셈이다.특히 이러한 조합OS요원들의 활동이 대우건설을 지지하는 조합원들을 중심으로 진행되고 있다. 조합원 투표를 독려하는 조합OS요원들이 대우건설 위주로 활동을 한다는 것이다.조합원 B씨는 ""삼성물산 측의 설계나 사업제안서를 마음에 들어하면 그 이후로 (조합OS요원들이) 연락도 오지 않는다""며 ""주변 다른 조합원들의 이야기를 들어봐도 대우건설을 지지하는 조합원들을 위주로 시공사 선정 총회 참가를 독려하고, 자세한 일정을 반복해 공지하고 있다""고 말했다.도를 넘은 조합OS요원들의 활동에 삼성물산 관계자들과 조합원들은 지난 24~25일 양일간 조합 사무실을 찾아 항의한 것으로 전해진다. 이에 조합 측은 ""엄중 조치하겠다""는 답변을 내놨다.한편, 반포3주구 재건축 사업은 서울 서초구 반포동 일대에 있는 1천490가구 아파트를 허물고 지하 3층∼지상 35층의 아파트 2천91가구로 탈바꿈하는 공사다. 공사비만 8천87억원에 달한다. 대우건설은 '트릴리언트 반포', 삼성물산은 '구반포 프레스티지 바이 래미안'으로 출사표를 던졌다. 오는 30일 삼성동 코엑스에서 '시공사 선정을 위한 2차 설명회 및 총회'를 개최하고 최종 시공사를 선정한다. summer@inews24.com [ⓒ 아이뉴스24 무단전재 및 재배포 금지]",/news/news_read.nhn?article_id=0000540271&office_id=031&mode=search&query=삼성물산&page=1
,"DK도시개발·DK아시아은 인천 서구 백석동 일대에 ‘검암역 로열파크씨티 푸르지오’ 본보기집을 개소한다고 27일 밝혔다.이 단지는 지하 2층~지상 최고 40층, 25개 동 전용 59~241㎡ 총 4805세대 규모로 조성된다. 오션뷰(정서진)와 리버뷰(아라뱃길)를 누리는 국내 첫 리조트 도시 콘셉트로 계획됐다. 분양가는 3.3㎡당 평균 1574만 원(전용 84㎡ 기준 평균 1529만 원)이다.검암역 로열파크씨티 푸르지오 주변에는 백석중고를 비롯해 한국주얼리고가 있고, 한들유치원·한들초교(가칭)가 기부체납 방식으로 준공에 맞춰 건립될 예정이다. 또 인천지하철2호선 독정역과 검암역 인천공항철도, 지하철 9호선 직결화 사업(예정)을 통해 서울 주요 업무지역으로 이동 가능하다. 여기에 삼성물산 리조트부문이 단지 안에 미니 에버랜드 조경과 100만주에 육박하는 꽃과 나무를 식재하는 밀리언 파크 조경을 선보일 계획이다. LG전자와 풀무원푸드앤컬처도 각각 차세대 IoT(사물인터넷) 기술과 삼식 서비스를 제공한다. 돕다 컨시어지 서비스도 3년간 무상으로 지원한다. 당첨자 발표 6개월 이후 전매를 할 수 있고, 안심 전매프로그램 적용으로 1차 중도금 납부 전 전매도 가능하다. 최대 5년 거주 의무 규제도 적용 받지 않는다.코로나19 확산 방지를 위해 현장 본보기집 사전 예약제를 실시하고, 온라인 홍보관을 통해 영상으로 모형도, 입지, 커뮤니티, 단지 유니트 등을 확인할 수 있다.
청약 일정은 내달 8일 특별공급을 시작으로 9일 1순위, 10일 2순위 청약접수를 받는다. 계약자에게는 계약금 10%, 중도금 60% 이자 후불제 혜택을 제공하며, 입주는 2023년 6월 예정이다. 분양 관계자는 “추첨제 비율이 전체의 80%에 달해 청약 가점이 낮은 30~40대도 당첨 기회를 제공한다”면서 “주택담보대출비율(LTV)도 최대 70%까지 가능하고, 예비 당첨자 비율을 공급가구수의 300%로 확대해 수도권 거주자도 당첨을 노려볼 수 있다”고 말했다.동아닷컴 정진수 기자 brjeans@donga.comⓒ 동아일보 & donga.com, 무단 전재 및 재배포 금지",/news/news_read.nhn?article_id=0003288528&office_id=020&mode=search&query=삼성물산&page=1
