head,text,url
"삼바 분식회계 및 삼성물산 합병 의혹검찰, 이재용 부회장 비공개 소환조사2018년 12월 첫 압색후 1년6개월 수사미래전략실·삼성물산 임원들 연일조사이재용 혐의부인…""보고·지시한적 없다""","[서울=뉴시스] 강진아 기자 = 검찰이 삼성물산과 제일모직 합병 의혹 등 이 사건 정점에 있는 이재용 삼성전자 부회장을 소환 조사하면서 1년6개월간 진행됐던 수사가 마무리 국면에 접어들었다. 검찰은 이 부회장의 추가 조사 필요성 검토와 함께 이 사건 처분 방향 등에 대한 종합적인 검토에 나설 전망이다.27일 법조계에 따르면 이 부회장은 전날 서울중앙지검에 비공개로 출석해 17시간여만에 귀가했다. 이 부회장은 전날 오전 8시30분부터 오후 9시까지 검찰 조사를 받았고, 이날 새벽 1시30분께까지 조서 열람을 종료했다. 검찰은 형사사건 공개금지 규정에 따라 이 부회장 소환 및 귀가시간을 사전에 알리지는 않았다.검찰은 이 부회장을 상대로 경영권 승계를 위해 삼성물산과 제일모직 합병 및 삼성바이오로직스 회계처리 과정에 관여했는지 여부 등 의혹 전반을 추궁한 것으로 전해졌다.이 부회장은 검찰 조사에서 이 같은 의혹을 모두 강하게 부인한 것으로 전해졌다. 이 부회장은 제기된 각종 혐의를 부인하며 ""보고 받거나 지시한 사실이 전혀 없다""고 진술한 것으로 알려졌다.지난 2018년 12월 바이오로직스와 삼성물산 등 압수수색에 나서며 본격적으로 시작된 검찰 수사는 애초 경영권 승계 의혹을 정조준했다는 전망이 지배적이었다. 분식회계 의혹 등에 따른 기업 가치 변경과 합병비율 산정 과정, 기업 지배력 강화 등 일련의 상황을 검찰이 들여다보면서 이 부회장을 직접 겨눴다는 예상이 나왔다.검찰은 바이오로직스와 자회사 삼성바이오에피스를 대상으로 증거인멸 및 분식회계 의혹부터 파헤쳤다. 삼성전자 TF 소속 임원들을 비롯한 여러 명의 임직원들이 구속돼 재판에 넘겨졌다. 김태한 바이오로직스 대표도 수차례 조사를 받고 구속영장이 두 번 청구됐으나 모두 기각됐고, 이로 인해 윗선을 향한 수사가 주춤하기도 했다.경영권 승계 의혹을 둘러싼 국정농단 사건 재판이 지난해 8월 대법원에서 이를 인정하는 취지로 파기되면서 수사가 탄력을 받을 것이라는 전망도 나왔다. 이 부회장 사건의 2심 재판부는 승계 작업이 존재하지 않았다고 봤지만, 대법원은 이 부회장 지배권 강화를 위한 삼성의 조직적인 승계작업이 있었다며 대가관계를 인정했다.이후 검찰은 분식회계 의혹과도 연관돼 있는 삼성물산과 제일모직 합병 과정을 집중적으로 수사해왔다. 지난 2015년 삼성물산과 제일모직 합병 당시 기업가치가 부풀려지고 축소되는 등의 정황을 포착, 관련 자료를 압수하고 관련자 조사를 통해 불법행위가 있었는지 여부를 조사해왔다.특히 지난 1월부터 미래전략실과 삼성물산 등 핵심 임원들이 잇따라 검찰에 출석하면서 이 부회장의 소환 조사가 임박했다는 관측이 나왔다. 미래전략실 최지성 전 실장(부회장)과 장충기 전 차장(사장), 김종중 전 전략팀장(사장)을 비롯해 삼성물산 최치훈 이사회 의장(사장), 이영호 대표, 김신 전 대표 등이 검찰에 여러 차례 소환돼 조사를 받았다. 윤용암 전 삼성증권 대표와 정현호 삼성전자 사업지원TF 사장, 고한승 바이오에피스 대표 등도 소환됐다.검찰은 이 부회장의 조사 내용을 바탕으로 이 사건 처분 방향 등을 결정할 것으로 보인다. 수사가 장기간 진행된 만큼 재판에 넘겨지는 이들도 적지 않을 것이라는 게 법조계 분석이다. 검찰은 그간 삼성그룹 계열사와 관련 기관들에 대한 전방위 압수수색을 진행해 관련 자료를 확보했고, 수백명에 대해 1000회 안팎의 소환조사를 진행한 것으로 알려졌다.이에 따라 이미 이 부회장 소환 조사 전 단계부터 방대한 기록을 검토해왔고, 기소 대상자 등을 추리는 작업을 진행해온 것으로 전해졌다. 검찰은 이 부회장의 추가 소환조사 여부는 아직 결정된 것이 없다는 입장이다. 이 부회장의 진술내용 등을 분석한 뒤 기소 및 신병처리 여부를 검토할 예정이며, 다음달께 수사를 마무리할 것으로 보인다. akang@newsis.com<ⓒ 공감언론 뉴시스통신사. 무단전재-재배포 금지>",/news/news_read.nhn?article_id=0009882648&office_id=003&mode=search&query=삼성물산&page=3
"시장심리 워스트5, 삼성물산·세아베스틸·국도화학·LG유플러스·금호타이어","[서울=뉴시스] 김제이 기자 = 27일 빅데이터 시장심리지수(MSI)가 가장 높은 톱5에 LG화학·카카오·삼성SDI·현대로템·SK이노베이션이 선정됐다.이는 뉴시스와 코스콤이 주요 상장기업 250곳에 대해 공동 분석해 산출해 낸 빅데이터 MSI(http://m.newsis.com/stock.html, 모바일 전용)로 전 거래일 오후 4시부터 이날 오전 8시까지 데이터를 취합한 결과다.LG화학의 시장심리지수는 전 거래일과 같은 7단계 '매우 좋음'을 나타냈다. 관련 키워드로는 안전, 환경안전, 사고, 배터리, 대책, 사업장, 삼성SDI, 긴급 등이 뽑혔다.카카오의 시장심리지수는 전 거래일 대비 1단계 오른 7단계로 집계됐다. 연관 키워드로는 서비스, 시총, 카카오페이, 플랫폼, 인증, 디지털, 설립, 온라인 등이 꼽혔다.삼성SDI의 시장심리지수는 7단계 '매우 좋음'으로 전 거래일과 같은 수준을 나타냈다. 온라인에서는 시총, 배터리, 전기차, 경제, 순위, 바이오, 삼성, 유럽 등이 주로 검색됐다.현대로템의 MSI지수도 전 거래일과 같은 7단계를 나타냈다. 핵심 키워드로는 전동차, 카이로, 이집트, 차량, 출고, 납품, 현지, 수주 등이 선정됐다.SK이노베이션의 MSI지수 역시 7단계 '매우 좋음'으로 나타났다. 주요 키워드로는 배터리, 환경, 전기차, 삼성SDI, 기술, 공모전, 공모, 비즈니스 등이 꼽혔다.시장심리가 낮은 '워스트5'에는 삼성물산·세아베스틸·국도화학·LG유플러스·금호타이어가 꼽혔다.삼성물산의 시장심리지수는 전 거래일보다 4단계 내린 1단계 '매우 나쁨'을 기록했다. 관련 키워드로는 검찰, 삼성, 합병, 제일모직, 조사, 수사, 의혹, 승계 등이 꼽혔다.세아베스틸의 시장심리지수는 1단계로 전 거래일과 같은 수준을 나타냈다. 연관 키워드로는 자동차, 생산, 생산량, 특수강, 전기, 철강, 군산공장, 전방산업 등이 뽑혔다.국도화학의 시장심리지수는 전 거래일과 같은 1단계를 나타냈다. 온라인에서는 회사채, 발행, 수요예측, 신용등급, KCC, 전반적, 모집, 기업그룹 등이 주로 검색됐다.LG유플러스의 MSI지수는 1단계로 전 거래일보다 2단계 하락했다. 핵심 키워드로는 인증, 서비스, 사은품, KT, 공인인증서, 아이즈원, 고객, 경쟁 등이 선정됐다.금호타이어의 MSI지수는 전 거래일보다 한 단계 내린 1단계 '매우 나쁨'을 기록했다. 키워드로 지원, 공장, 기안기금, 산업, 자동차, 예외조항, 업계, 홍보 등이 뽑혔다.MSI는 총 7단계로 나뉜다. 1단계 '매우 나쁨', 2단계 '나쁨', 3단계 '약간 나쁨', 4단계 '보통', 5단계 '약간 좋음', 6단계 '좋음', 7단계 '매우 좋음' 등으로 분류된다.MSI 레벨이 가장 낮은 수준인 1단계에서 가장 높은 수준인 7단계 쪽으로 바뀌면 해당 종목에 대해 온라인상에서의 반응이 부정에서 긍정으로 바뀌고 있다는 뜻으로 풀이할 수 있다.한편 2017년 8월1일부터 선보인 빅데이터 MSI 모바일 전용 버전은 구글플레이 또는 애플 앱스토어에서 '뉴시스' 앱을 내려받거나 뉴시스 모바일 홈페이지(m.newsis.com)에 접속한 뒤 메인화면의 '빅데이터 MSI'를 클릭해 이용하면 된다.※ 빅데이터MSI는 투자 참고용이며, 투자 결과에 책임을 지지 않습니다. 주식시장에서는 다양한 국내외 변수가 존재하기 때문에 한 지표로만 판단하면 뜻하지 않은 결과를 초래할 수 있습니다. jey@newsis.com<ⓒ 공감언론 뉴시스통신사. 무단전재-재배포 금지>",/news/news_read.nhn?article_id=0009882666&office_id=003&mode=search&query=삼성물산&page=3
10대 브랜드 73곳 분양해 71곳 1순위 마감분양권 전매제한 강화로 브랜드 수요 더 몰릴 듯,"[헤럴드경제=박일한 기자] 지방 분양시장을 10대 아파트 브랜드가 싹쓸이 하고 있다. 대부분 1순위 마감에 성공했고, 평균 경쟁률이 37대1을 기록했다.부동산114에 따르면 지난해부터 올해 5월까지(2019년1월1일~2020년5월25일) 지방 분양시장에 공급된 10대 브랜드 아파트는 총 73곳으로 평균 37대1의 청약 경쟁률을 기록하며, 단 두 곳을 제외하고 1순위 마감에 성공했다. 10대 브랜드를 제외한 단지가 총 197곳 분양해서 107곳 1순위 마감하고, 13대1의 평균 청약경쟁률을 기록한 것과 비교된다.10대 아파트 브랜드는 이 달 한국기업평판연구소가 실시한 국내 브랜드 아파트 평판 분석에서 10위 안에 드는 것이다. 현대건설 ‘힐스테이트’, 삼성물산 ‘래미안’, 대우건설 ‘푸르지오’, GS건설 ‘자이’, 대림산업 ‘e편한세상’, 현대산업개발 ‘아이파크’, 포스코건설 ‘더샵’, 롯데건설 ‘롯데캐슬’, 쌍용건설 ‘더플래티넘’, 두산건설 ‘위브’ 등이 속한다.권일 부동산인포 팀장은 “대형 브랜드 단지는 지역 내 교통, 교육, 상업 등 생활 인프라가 좋은 핵심 입지에 위치한 경우가 많고, 풍부한 시공 노하우와 꼼꼼한 사후 서비스로 만족도가 높아, 공급량이 적은 지방 시장에서 인기가 높다”고 분석했다.전문가들은 8월부터 지방광역시 민간택지에서 분양하는 아파트의 전매제한이 소유권 이전등기 때까지 강화될 예정이어서, 이런 현상은 더 심화할 것으로 본다. 수요자들이 청약통장을 더 신중하게 사용하려 하면서 신뢰도 높은 브랜드를 선택할 가능성이 크기 때문이다.권 팀장은 “5~6월 부산, 대구, 광주 등 지방광역시에서 10대 브랜드 아파트가 분양을 많이 한다”며 “대부분 입지가 좋은 역세권으로 관심을 가질 만하다”고 말했다.건설업계에 따르면, 대림산업은 이달 내 광주시에서 ‘e편한세상 무등산(전용면적 84~113㎡ 286가구)’ 견본주택을 열고 분양을 시작한다. GS건설은 대구에서 ‘대구용산자이(전용면적 84~100㎡, 429가구)’에 대한 청약접수를 내달 초 받는다. 롯데건설은 6월 부산시 부산진구 부암 1구역을 재개발해 ‘백양산 롯데캐슬 골드센트럴(전용면적 59~101㎡ 총 2195가구)’을, 같은 6월 포스코건설과 태영건설 컨소시엄은 경남 양산에서 ‘사송 더샵 데시앙 2차(전용면적 74~84㎡, 총 2084가구)’를 각각 분양한다.jumpcut@heraldcorp.com
- Copyrights ⓒ 헤럴드경제 & heraldbiz.com, 무단 전재 및 재배포 금지 -",/news/news_read.nhn?article_id=0001678487&office_id=016&mode=search&query=삼성물산&page=3
빈폴레이디스·구호·에잇세컨즈…TPO 따라 다채로운 스타일,"(서울=뉴스1) 강성규 기자 = 90년대 유행했던 '벙거지'가 최근 '버킷햇' 스타일로 진화하며 스트리트 패션의 중심으로 떠올랐다. 삼성물산 패션부문은 컬러·소재·디테일 등을 다채롭게 적용해 TPO(시간·공간·경우)에 따라 색다른 분위기를 연출해주는 만능 버킷햇 스타일을 선보인다고 27일 밝혔다.'빈폴레이디스'는 블랙 버킷햇을 리넨 체크 셋업과 매치해 편안하면서 감각적인 출근룩을 제안했다.올해는 코튼 소재의 리버서블 버킷햇과 함께 나일론 소재, 리본 디테일을 적용한 챙이 넓은 스타일을 추가 구성했다. 특히 나일론 소재의 버킷햇은 가벼운 데다 구김이 가지 않아 높은 실용성으로 소비자 반응이 좋다.'구호'는 민낯을 완벽히 커버해주는 버킷햇을 출시했다. 버킷햇의 챙을 넓게 제작해 뜨거운 햇살로부터 피부를 보호하고 민낯 외출시 쓰기에 제격이다. 또 높이감이 있어 머리를 안정적으로 잡아준다. 간결한 외관에 스트링 디테일을 더해 캐주얼한 느낌을 줬고 스트링을 떼면 좀 더 깔끔하게 연출할 수 있다.에잇세컨즈는 여행지에서의 즐거운 순간들을 주제로 한 이번 여름 컬렉션에서 청량한 리조트룩에 다양한 스타일의 버킷햇을 적극 활용했다.기본 솔리드 스타일 뿐 아니라, 체크 패턴, 셔링·플리츠·프린지 디테일, 니트·데님 소재 등을 적용한 트렌디한 버킷햇 스타일을 선보였다.임수현 빈폴레이디스 디자인 디렉터는 ""버킷햇은 올 여름 모든 복종에서 각광받는 아이템으로, 소재나 컬러, 디테일, 챙의 넓이 등에 따라 다채로운 분위기를 낸다""라며 ""챙이 넓고 끈·리본을 길게 늘어뜨려 여성스러운 느낌을 연출하거나 챙이 좁은 스타일로 영(young)한 레트로 감성을 표현할 수 있을 것""이라고 말했다.sgkk@news1.kr© 뉴스1코리아(), 무단 전재 및 재배포 금지",/news/news_read.nhn?article_id=0004660127&office_id=421&mode=search&query=삼성물산&page=3
,"[디지털타임스 심화영 기자] 1990년대 유행했던 '벙거지'가 브랜드별 컨셉과 다양한 디자인으로 풀어낸 '버킷햇'으로 돌아왔다. 최근 몇 년 간 가벼운 식물성 라탄 소재 모자가 여름 휴양지에서 인기였다면 올해는 버킷햇이 유력하게 떠오르고 있다.26일 삼성물산 패션부문은 컬러, 소재, 디테일 등을 다채롭게 적용해 색다른 분위기를 연출해주는 만능 '버킷햇'을 선보인다. '빈폴레이디스'는 검정 버킷햇을 리넨(아마사로 짠 직물의 총칭) 체크 셋업과 매치해 편안하면서 감각적인 출근룩을 선보였다. 가벼운 외출시에도 활용하기 좋은 버킷햇은 이번 시즌 인기 아이템이다.'구호'는 민낯을 완벽히 커버해주는 버킷햇을 출시했다. 버킷햇의 챙을 넓게 제작해 뜨거운 햇살로부터 피부를 보호하고 민낯 외출시 쓰기에 제격이다. 또 높이감이 있어 머리를 안정적으로 잡아준다. 간결한 외관에 스트링 디테일을 더해 캐주얼한 느낌을 줬고 스트링을 떼면 좀 더 깔끔하게 연출할 수 있다. 코튼 소재에 네이비·베이지 컬러로 출시됐으며, 두 컬러 모두 리오더에 들어갔을 정도로 인기다.'에잇세컨즈'는 여행지에서의 즐거운 순간들을 주제로 한 이번 여름 컬렉션에서 청량한 리조트룩에 다양한 스타일의 버킷햇을 적극 활용했다. 기본 솔리드 스타일 뿐 아니라, 체크 패턴, 셔링·플리츠·프린지 디테일, 니트·데님 소재 등을 적용한 트렌디한 버킷햇 스타일을 선보였다.임수현 빈폴레이디스 디자인 디렉터는 ""버킷햇은 올 여름 모든 복종에서 각광받는 아이템으로 소재나 색상, 디테일, 챙의 넓이 등에 따라 다채로운 분위기를 낸다""며 ""챙이 넓고 끈·리본을 길게 늘어뜨려 여성스러운 느낌을 연출하거나 챙이 좁은 스타일로 싱그러운 레트로 감성을 표현할 수 있을 것""이라고 말했다. 심화영기자 dorothy@dt.co.kr 디지털타임스
/",/news/news_read.nhn?article_id=0002600557&office_id=029&mode=search&query=삼성물산&page=3
,"올 여름 패피(패션피플의 줄임말)가 되기 위해선 '버킷햇' 하나쯤 장만해 보는 것은 어떨까.90년대에 유행했던 '벙거지'가 몇 년 전부터 스트리트 패션 브랜드 중심으로 인기를 얻더니 이젠 다양한 디자인들로 풀어낸 '버킷햇'으로 돌아왔다. 크리스챤 디올, 프라다 등 주요 해외 브랜드의 '20년 봄여름 시즌 런웨이는 물론, 최근 인플루언서들의 SNS와 길거리 패션까지 점령했을 정도다.버킷햇은 휴가철 스타일링을 완성해 줄 뿐 아니라, 원마일 웨어(one-mile wear, 집 안이나 근처 1마일 반경 내로 가볍게 외출할 때 입기 좋은 옷차림)의 필수품이 됐다. 최근에는 평상시 출근룩의 포인트로도 활용돼 그 패션성과 실용성을 인정받고 있다.
삼성물산 패션부문은 컬러, 소재, 디테일 등을 다채롭게 적용해 TPO에 따라 색다른 분위기를 연출해주는 만능 '버킷햇' 스타일을 제안한다.'빈폴레이디스'는 블랙 버킷햇을 리넨 체크 셋업과 매치해 편안하면서 감각적인 출근룩을 선보였다. 가벼운 외출시에도 활용하기 좋은 버킷햇은 이번 시즌 인기 아이템이다.올해는 코튼 소재의 리버서블 버킷햇과 함께 나일론 소재, 리본 디테일을 적용한 챙이 넓은 스타일을 추가 구성했다. 특히 나일론 소재의 버킷햇은 가벼운 데다 구김이 가지 않아 높은 실용성으로 소비자 반응이 좋다.빈폴레이디스의 버킷햇은 블랙, 아이보리, 그레이 컬러 및 깅엄 체크 패턴 등으로 출시됐다.'구호'는 민낯을 완벽히 커버해주는 버킷햇을 출시했다. 버킷햇의 챙을 넓게 제작해 뜨거운 햇살로부터 피부를 보호하고 민낯 외출시 쓰기에 제격이다. 또 높이감이 있어 머리를 안정적으로 잡아준다. 간결한 외관에 스트링 디테일을 더해 캐주얼한 느낌을 줬고 스트링을 떼면 좀 더 깔끔하게 연출할 수 있다.코튼 소재에 네이비와 베이지 컬러로 출시됐으며, 두 컬러 모두 리오더에 들어갔을 정도로 인기 있다.
골라 쓰는 재미를 느끼고 싶다면 '에잇세컨즈'의 버킷햇에 주목하자. 에잇세컨즈는 여행지에서의 즐거운 순간들을 주제로 한 이번 여름 컬렉션에서 청량한 리조트룩에 다양한 스타일의 버킷햇을 적극 활용했다.기본 솔리드 스타일 뿐 아니라, 체크 패턴, 셔링·플리츠·프린지 디테일·니트·데님 소재 등을 적용한 트렌디한 버킷햇 스타일을 선보였다.임수현 빈폴레이디스 디자인 디렉터는 ""버킷햇은 올 여름 모든 복종에서 각광받는 아이템으로, 소재나 컬러, 디테일, 챙의 넓이 등에 따라 다채로운 분위기를 낸다""며 ""챙이 넓고 끈·리본을 길게 늘어뜨려 여성스러운 느낌을 연출하거나 챙이 좁은 스타일로 영(young)한 레트로 감성을 표현할 수 있을 것"" 이라고 말했다.[방영덕 기자 byd@mkinternet.com] [ⓒ 매일경제 & mk.co.kr, 무단전재 및 재배포 금지]",/news/news_read.nhn?article_id=0004583032&office_id=009&mode=search&query=삼성물산&page=3
"지하 2층~지상 40층, 4805가구 대단지3.3㎡당 평균 1574만원…추첨제 비율 80%가점 낮은 3040세대에게도 기회","[헤럴드경제=양대근 기자] DK도시개발·DK아시아는 오는 29일 인천 서구 백석동 일원에 들어서는 ‘검암역 로열파크씨티 푸르지오’ 단지의 견본주택을 열고 분양에 나선다고 27일 밝혔다.대우건설이 시공하는 이 단지는 지하 2층~지상 최고 40층 25개 동, 전용면적 59~241㎡ 총 4805가구 매머드급 대단지다. 오션뷰(정서진)와 리버뷰(아라뱃길)를 동시에 누릴 수 있는 ‘리조트 도시’ 컨셉으로 조성된다. 전용 85㎡ 이하의 중소형을 전체 가구의 90% 규모로 공급한다.분양가는 3.3㎡당 평균 1574만원이며, 84㎡기준으로는 3.3㎡당 평균 1529만원이다. 계약금 10%, 중도금 60%는 이자 후불제로 공급된다.추첨제 비율은 전체 80%에 달해 청약 가점이 낮은 3040세대에게도 당첨 기회가 제공된다. 주택담보대출비율(LTV)도 최대 70%까지 가능하다. 예비 당첨자 비율을 공급가구수의 300%로 확대돼 수도권 거주자도 당첨을 노려볼 수 있다.DK도시개발 측은 삼성물산 리조트부문과 업무협약을 맺고 아파트 단지 내 최초로 ‘미니 에버랜드 조경’을 도입해, 100만 그루에 가까운 꽃과 나무를 심는 ‘밀리언 파크'(Million Park) 조경을 선보인다. 여기에 LG전자가 차세대 IoT(사물인터넷) 기술을 적용하고, 풀무원푸드앤컬처의 삼식(三食) 서비스가 합리적인 가격으로 제공된다. 종로엠스쿨의 직영학원도 들어오며, 3년간 무상으로 ‘돕다(DOPDA)’ 컨시어지 서비스도 도입된다.인천 지하철2호선 독정역과 인접해 있고, 검암역 인천공항철도와 서울지하철 9호선 직결화 사업(예정)을 통해 환승 없이 강남으로 연결될 예정이다.정부가 최근 발표한 분양권 전매금지 규제 대상에 해당되지 않아 당첨자 발표 6개월 이후에는 횟수에 상관 없이 무제한 전매도 가능하다. 특히 안심 전매 프로그램 적용으로 1차 중도금 납부 전 전매가 가능하다. 수도권 분양가상한제 아파트에 적용하는 ‘최대 5년 거주 의무’ 규제도 적용 받지 않는다.김정모 DK도시개발·DK아시아 회장은 “도시를 만들어가는 라이프 씨티 크리에이터(Life City Creator)로서 현대인들에게 4세대 아파트를 넘어 서울에서 가장 가까운 대한민국 최초 ‘차세대 휴양 리조트 도시’를 만들겠다“며 “고급 리조트에서만 누리던 다양한 서비스를 제공해 입주민들이 단지 안에서 모든 것을 해결할 수 있는 인천 최초 전국 ‘대장주 아파트’로 조성할 계획”이라고 말했다.현장 견본주택은 코로나19 확산 방지를 위해 사전 예약제로만 운영되며, 사이버 모델하우스도 동시 오픈한다. 사이버 모델하우스에서는 아나운서 이지애, 배우 조현재 부부, 배우 신다은 부부 등이 출현해 모형도, 입지, 커뮤니티, 단지 유니트 등 실제 견본주택을 둘러보며 실수요자 입장에서 소개하는 영상도 만나볼 수 있다.내달 8일 특별공급을 시작으로 9일 1순위, 10일 2순위 청약접수를 받는다. 입주는 오는 2023년 6월 예정이다.bigroot@heraldcorp.com
- Copyrights ⓒ 헤럴드경제 & heraldbiz.com, 무단 전재 및 재배포 금지 -",/news/news_read.nhn?article_id=0001678520&office_id=016&mode=search&query=삼성물산&page=3
■ 경제와이드 모닝벨 '김박사의 오늘의 키워드' - 진행 : 장연재 / 출연 : 김대호 글로벌이코노믹연구소장·경제학 박사,"- 삼성 이재용, 경영권 승계 의혹 관련 조사 뒤 귀가- 국정농단 이후 3년만에 피의자 신분 검찰 출석- 이재용, 17시간 검찰 조사 마쳐…출석·귀가 '비공개'- 검찰, 삼성물산·제일모직 합병 관련 집중 추궁- '1조 이혼소송' 최태원·노소영, 2차변론 불출석- 노소영, SK 지분 42.29% 요구…약 1조원- 노소영 변호인단 교체…'엘리트 판사' 출신- 재판 약 7분만에 끝나…재산 목록 제출 지시 (자세한 내용은 동영상을 시청하시기 바랍니다.) ▶ ▶ 저작권자 SBS미디어넷 & SBS I&M 무단전재-재배포 금지",/news/news_read.nhn?article_id=0000212390&office_id=374&mode=search&query=삼성물산&page=3
