head,text,url
"법 위반 않겠다 국민에 공표하고무노조 경영 폐기도 직접 선언을준법위, 삼성 7개사에 권고문","삼성 준법감시위원회가 이재용 삼성전자 부회장에게 경영권 승계 과정의 준법 위반 행위에 대한 반성과 직접적인 사과를 요구했다. 또 삼성의 지속가능한 경영을 위해 자유로운 노조활동을 보장하라며 무노조경영 원칙을 폐기하라고 권고했다.



이에 따라 이재용 부회장이 직접 경영권 승계의 위법성 사과와 무노조 경영 철폐를 약속할지 주목된다.


삼성 준법감시위는 11일 “삼성전자 이재용 부회장과 삼성전자·삼성전기·삼성SDI·삼성SDS·삼성물산·삼성생명·삼성화재 등 7개 관계사에 이같은 내용의 권고문을 보내고 30일 이내에 회신할 것을 요청했다”고 밝혔다. 준법감시위는 권고문에서 “위원회 출범 이후 지금까지 삼성 최고경영진에게 요구하는 최우선의 준법 의제에 대해 장시간 논의를 거듭한 끝에 경영권 승계와 노동, 시민사회 소통의 세 가지 의제를 선정하고 필요한 개선방안을 담은 권고안을 전달했다”고 설명했다.


먼저 경영권 승계와 관련, 준법감시위는 “그간 삼성그룹의 과거 불미스러운 일들이 대체로 경영권 승계와 관련이 있었다”고 지적했다. 이에 따라 준법감시위는 “과거 총수 일가의 그룹 경영권 승계 과정에서 준법의무를 위반하는 행위가 있었던 점에 대해 그룹 총수인 이재용 부회장의 반성과 사과를 권고하고, 향후 경영권 행사와 승계 관련 준법의무 위반이 발생하지 않을 것임을 국민들에게 공표해달라”고 주문했다. 또 “삼성 관계사가 일반 주주의 이익을 지배주주의 이익과 동일하게 존중하고 일부 지배주주의 이익을 위해 나머지 주주들의 이익을 침해하지 않도록 할 것”을 권고했다. 준법감시위의 지적은 각각 이재용 부회장의 최순실 국정농단 사건 연루와 옛 제일모직과 삼성물산 합병 과정의 문제를 거론한 것이란 분석이다.


또 삼성의 무노조 경영과 관련해서도 계열사에서 수차례 노동법규를 위반하는 등 준법의무 위반 리스크를 제대로 관리하지 못한 점에 대한 반성과 사과를 요구했다. 준법감시위는 “노동 관련 준법의무 위반 리스크의 재발 방지 방안을 노사 간의 충분한 소통을 통해 만들어 나갈 것이라는 약속과 함께 삼성그룹 사업장에서 ‘무노조 경영’ 방침이 더 이상 존재하지 않을 것이라는 선언 등을 이재용 부회장이 직접 표명할 것”을 제안했다. 삼성전자는 지난해 12월 삼성전자서비스노조 와해 사건 재판 직후 “노사문제로 많은 분들께 걱정과 실망을 끼쳐드려 대단히 죄송하다”며 “과거 회사 내에서 노조를 바라보는 시각과 인식이 국민 눈높이와 사회의 기대에 미치지 못했음을 겸허히 받아들인다”고 사과한 바 있다.


준법감시위는 진보 단체를 비롯한 시민사회와의 커뮤니케이션 방식 개선도 주문했다. 준법감시위는 “삼성이 그동안 시민사회와의 소통에 있어 신뢰관계를 구축하지 못했다”며 “이재용 부회장과 관계사 모두가 시민사회의 신뢰를 회복하기 위한 구체적인 실행방안을 마련하여 공표할 것”을 권고했다.


준법감시위는 마지막으로 “위원회의 활동과 총수의 형사재판과 관련된 논란과 관련해 사회 일각의 회의적인 시각을 불식시킬 필요가 있다”며 “이재용 부회장과 관계사 모두가 우려를 불식시킬 조치를 공표해달라”고 요구했다. 이는 준법감시위 활동이 이 부회장의 파기환송심 재판과 연계돼 있다는 지적을 의식한 것으로 보인다.


이에 대해 삼성전자는 공식적인 입장을 내놓지 않았다. 다만 삼성전자 고위 관계자는 “독립 기구인 준법위의 권고를 충실히 진지하게 검토하겠다”는 원론적인 답변만 내놨다.


김영민 기자 bradkim@joongang.co.kr
▶ ▶
/ ⓒ중앙일보(https://joongang.co.kr), 무단 전재 및 재배포 금지",/news/news_read.nhn?article_id=0002983250&office_id=025&mode=search&query=삼성물산&page=5
삼성측 충실히 검토하겠다재계 과거사안 다루는건 부적절… 집중감시 대상과 관련없는 내용,"삼성 준법감시위원회가 이재용 삼성전자 부회장에게 승계 의혹과 관련해 대국민 사과와 재발 방지 대책을 발표하라고 촉구했다. 또 이 부회장이 직접 ‘무노조 원칙’ 폐기를 선언하라고 권고했다. 삼성은 이에 대해 충실히 검토하겠다는 입장을 내놨다. 11일 삼성 준법감시위는 보도자료를 내고 이 같은 내용을 담아 이 부회장과 삼성전자, 삼성전기, 삼성SDI, 삼성SDS, 삼성물산, 삼성생명, 삼성화재 등 7개 관계사에 권고문을 보냈다. 준법감시위는 삼성 측에 30일 이내에 회신할 것도 요청했다. 준법감시위 측은 “출범 이후 지금까지 삼성 최고경영진에게 요구되는 최우선의 준법 의제에 대하여 장시간 논의한 끝에 △경영권 승계 △노동 △시민사회 소통이라는 세 가지 의제를 선정하고, 의제별 개선방안에 대한 의견을 담아 권고했다”고 밝혔다. 준법감시위는 김지형 전 대법관을 위원장으로 시민단체, 교수, 법조계 출신 외부 인사들이 주축이 돼 삼성의 준법 의무를 감시하기 위해 지난달 5일 출범했다. 준법위는 첫 활동으로 삼성이 2013년 자사 직원의 시민단체 후원 내용을 열람한 것에 대해 시정 권고를 했고 삼성은 사과한 바 있다. 이번 두 번째 권고에서는 승계, 노조 문제 등을 통틀어 이 부회장이 직접 사과하도록 요구한 것이다. 준법위는 승계 논란과 관련해 “이 부회장이 반성과 사과는 물론 향후 경영권 행사 및 승계와 관련해 준법 의무 위반이 발생하지 않을 것임을 국민들에게 공표해 달라”고 했다. 삼성은 “준법감시위 권고안을 충실히 검토하겠다”라는 짤막한 입장만 밝혔다. 재계에서는 삼성이 적지 않은 부담을 느낄 것이란 분석이 나온다. 준법감시위가 출범 준비를 하던 1월만 해도 김 위원장은 “더 논의는 필요하지만 위원회 설치 이후의 사안을 중심으로 하는 것을 원칙으로 하겠다”고 밝혔다. 또 지난달 확정한 운영규칙에 따르면 향후 준법감시위와 업무협약을 맺은 7개 회사에 대해 △대외후원금 △내부거래 △최고경영자의 준법의무 위반 여부 등을 집중 감시한다고 밝힌 바 있다. 하지만 이번 권고에서는 위원회 출범 이전의 과거 문제를 거론했고, 집중 감시한다고 한 내용과 관련 없는 승계 의혹 등을 주제로 삼았다. 한 재계 관계자는 “기업은 준법경영의 의미를 예방적 조치로 보는 반면 준법감시위는 과거에 대한 반성이 우선이라고 보는 것 같다”고 했다. 다른 관계자는 “승계 문제는 이미 검찰이 수사 중이거나 과거 대법원 판결까지 난 사안이라 준법감시위가 다루기에 부적절해 보인다. 무노조 경영과 관련해선 지난해 12월 삼성전자가 직접 폐기 의사를 밝혔다”라고 말했다. 권고안에는 “이 부회장과 관계사 모두가 우려를 불식시킬 수 있는 조치를 마련해 공표해야 한다”라고 적혀 있어 최근 시민단체를 중심으로 나온 준법감시위원회 역할에 대한 부정적 시선이 영향을 줬다는 분석도 있다. 지난달 경제정의실천시민연합은 “삼성은 준법감시위원회를 해체하라”며 위원들의 자진 사퇴를 요구한 바 있다.김현수 기자 kimhs@donga.com ⓒ 동아일보 & donga.com, 무단 전재 및 재배포 금지",/news/news_read.nhn?article_id=0003274788&office_id=020&mode=search&query=삼성물산&page=4
불미스러운 일 대체로 승계 관련… 무노조 경영 포기 선언도 주문,"삼성 준법감시위원회(위원장 김지형·이하 준법위)가 경영권 승계 의혹과 관련해 총수인 이재용 삼성전자 부회장에게 대국민 사과와 재발 방지를 권고했다. 무노조 경영 포기도 주문했다. 삼성은 충실히 검토하겠다는 입장이다. 재계에선 삼성이 준법위 설립 취지에 따라 권고를 받아들이고, 앞으로 경영권 승계 등에 대해 전향적인 태도를 취할 가능성이 높다고 보고 있다.준법위는 11일 이 부회장과 삼성전자, 삼성전기, 삼성SDI, 삼성SDS, 삼성물산, 삼성생명, 삼성화재 등 7개 관계사에 이런 내용의 권고문을 보내고 ‘30일 안에 회신해줄 것’을 요청했다고 밝혔다. 준법위는 “삼성그룹의 과거 불미스러운 일들이 대체로 승계와 관련이 있다”며 총수 일가의 경영권 승계 과정에서 준법 의무 위반 행위가 있었던 데 대해 이 부회장의 반성과 사과를 요구했다.준법위는 또 이 부회장에게 “향후 경영권 행사 및 승계와 관련해 준법의무 위반이 발생하지 않을 것이라고 국민에게 공표하라”고 주문했다. 준법위는 관계사들이 일반 주주의 이익을 지배주주의 이익과 동일하게 존중하고, 일부 지배주주의 이익을 위해 나머지 주주들의 이익을 침해하지 않도록 하라는 제안도 권고안에 포함했다.준법위는 이 부회장이 삼성그룹 사업장에서 무노조 경영 방침이 더 이상 존재하지 않을 것이라는 선언을 직접 하라는 권고했다. 아울러 노동 의제와 관련해 삼성 계열사에서 수차례 노동 법규를 위반한 점에 대한 반성을 하고 사과하라고도 했다.노동 관련 준법의무 위반이 기업가치에 커다란 손실을 입힐 수 있다고 지적한 준법위는 “노사가 노동 법규를 준수하고 화합·상생하는 것이 지속가능 경영에 도움이 되고 자유로운 노조활동이 거시적 관점에서 기업가치를 창출할 수 있다는 발상의 전환이 필요하다”고 강조했다. 이 부회장 파기환송심 형량 감경을 위한 ‘면피용’이라는 일각의 지적에 대해 준법위는 “이 같은 회의적 시각을 불식시키기 위해 이 부회장과 관계사 모두가 관련 조치를 마련해 공표하라”고 했다.삼성은 권고를 충실히 검토한다는 입장이다. 삼성 관계자는 “준법위 설립 이유 자체가 앞으로 위법한 행위를 하지 않겠다는 것”이라며 “권고안을 충실히 검토해 답변을 제출할 방침”이라고 말했다.재계는 삼성이 준법위 권고를 받아들일 가능성이 크다고 전망한다. 대기업 관계자는 “합법적 경영권 승계와 노조 허용은 시대 흐름에 따라야 할 것”이라며 “권고대로 이 부회장은 대주주가 되는 과정에서 있었던 탈법 논란에 대해 사과하고 무노조 경영 방침을 포기할 것 같다”고 말했다.다른 대기업 간부는 “한국을 대표하는 1등 기업인 삼성이 준법 경영 면에서도 글로벌 스탠더드가 될 필요가 있다”면서 “삼성의 기업 문화가 바뀐다면 국내 다른 기업에도 좋은 영향을 미칠 수 있다”고 기대했다. 하지만 한 재계 관계자는 “관련 재판과 수사가 진행 중인 상황에서 경영권 승계 관련 사과를 요구한 부분은 삼성이 민감하게 받아들일 수 있다”고 지적했다.강주화 기자 rula@kmib.co.krGoodNews paper ⓒ , 무단전재 및 재배포금지",/news/news_read.nhn?article_id=0001298230&office_id=005&mode=search&query=삼성물산&page=4
,"""총수 일가의 삼성그룹 경영권 승계 과정에서 준법 의무 위반 행위가 있었던 점에 대해 이재용 삼성전자 부회장이 대국민 반성·사과하라.""삼성 준법감시위원회는 11일 이 부회장과
등 7개 계열사에 이 같은 권고문을 보냈다. 준법감시위는 이 부회장의 횡령·뇌물 혐의 파기환송심 재판부가 삼성 측에 준법 경영에 대한 특단의 조치를 요구하자, 삼성이 만들어 7개 주요 계열사와 협약을 맺은 조직이다. 준법감시위는 최근 삼성이 2013년 당시 임직원의 시민단체 기부금 후원 내역을 무단으로 열람한 것에 대해 사과하라고 권고하는 등 삼성 입장에서 껄끄러운 요구를 계속하고 있다.한 재계 인사는 ""앞으로 발생할 준법 의무 위반 사례를 예방하겠다고 출범한 조직이 과거 사안이나 현재 검찰 수사 중인 사안에 대해 이 부회장이 직접 반성·사과하라고 하고 있다""며 ""삼성이 거절하기도 힘든 상황이라 '또 하나의 호랑이'를 만든 꼴""이라고 말했다. 노조 문제는 삼성이 이미 사과했고, 노조 설립도 이뤄지고 있는데 이 부회장이 다시 사과하고 노조 설립 허용을 선언하라는 것도 다소 과한 요구라는 지적이 나온다.준법감시위는 삼성 최고경영진에 경영권 승계, 노동, 시민사회 소통 등 3가지를 최우선으로 요구하겠다고 밝혔다. 경영권 승계와 관련, ""이 부회장이 승계 과정의 '준법 의무 위반'에 대해 반성·사과하고, 앞으로 이 같은 위반이 발생하지 않을 것임을 국민에게 공표하라""고 권고했고, 노조 관련은 ""이 부회장이 (과거의 일을) 반성·사과하고 앞으로 무노조 경영 방침을 없애겠다고 선언하라""고 했다. 또 ""준법감시위 활동과 총수 형사재판의 관련성에 대해 사회 일각에서 제기되는 우려를 불식시킬 조치를 발표하라""고 했다. 삼성 측은 ""준법감시위 권고안을 충실히 검토하겠다""고 밝혔다.[신은진 기자 momof@chosun.com] 	[]	[]	[] 	- Copyrights ⓒ 조선일보 & chosun.com, 무단 전재 및 재배포 금지 -",/news/news_read.nhn?article_id=0003514281&office_id=023&mode=search&query=삼성물산&page=4
7개 계열사에 ‘3대 의제 개선안’ 권고문,"[서울신문]삼성 준법감시위원회가 이재용 삼성전자 부회장에게 경영권 승계 문제에 대해 대국민 사과하고 무노조 경영 방침 폐기를 직접 선언하라고 요구했다. 이에 대해 삼성은 “충실히 따르는 방향으로 내부적으로 검토에 들어갈 것”이라고 밝혀 이 부회장이 조만간 실제 사과와 선언에 나설 것으로 보인다.준법위는 총수인 이 부회장과 삼성전자, 삼성전기, 삼성SDI, 삼성SDS, 삼성물산, 삼성생명, 삼성화재 등 7개 계열사에 이런 내용의 권고문을 보내고 30일 안에 회신하라고 요청했다고 11일 밝혔다. 위원회는 “출범 이후 삼성 최고경영진에 요구되는 최우선 준법 의제에 대해 장시간 논의했다”며 “그 결과 경영권 승계, 노동, 시민사회 소통 등 3대 의제를 선정해 개선 방안에 대한 의견을 담아 권고했다”고 설명했다.위원회가 경영권 승계에 대한 반성과 사과를 첫손에 꼽은 것은 과거 삼성의 불미스러운 일들이 대체로 승계와 관련 있다는 판단에서다. 준법위는 “이 부회장이 향후 경영권 행사와 승계와 관련해 준법의무 위반이 발생하지 않을 것이라고 국민에게 공표하라”고 했다. 삼성은 2015년 삼성물산과 제일모직 합병 과정에서 이 부회장에게 유리한 합병 비율을 만들기 위해 삼성물산이 합병 직전 회사 가치를 떨어뜨리고 삼성바이오로직스에서 분식회계를 벌였다는 의혹으로 검찰 수사를 받고 있다.노조 와해 사건 등 노사 문제와 관련해서는 “삼성의 ‘무노조 경영’ 방침이 더이상 존재하지 않는다고 이 부회장이 직접 선언하라”며 “삼성 계열사에서 노동 법규를 위반하는 등 준법 의무 위반 리스크를 제대로 관리하지 못한 점을 반성하고 사과하라”고 주문했다.전문가들은 “이는 삼성이 문제적 경영 방식에서 크게 변화하라는 요구로, 과거처럼 형식적인 사과와 선언에 그치지 말고 근본적인 체질 개선에 나서야 한다”고 요구했다. 준법위가 두루뭉술한 사과나 선언 촉구보다 삼성의 준법경영 실현을 위한 실효적인 시스템을 만드는 데 더 무게중심을 둬야 한다는 지적도 있다.김성희 고려대 노동대학원 교수는 “핵심 주제는 다 망라한 것 같으나 안으로 뜯어보면 준법위의 모호한 위상이나 역할을 드러냈고 역시 준법위가 총수의 면죄부 장치가 아닌가란 우려가 든다”며 “이재용을 비롯한 삼성 일가가 세습을 위해 편법과 불법, 사익을 취한 것 등을 어디까지 인정할지가 관건인데 권고안에서는 사법부에 회부돼 있는 문제를 어떻게 다루겠다는 건지, 무엇을 사과하고 무엇을 이행해야 한다는 건지가 불명확하다”고 지적했다.노동 문제와 관련, ‘노사 간의 충분한 소통’으로 노동 관련 준법 위반 사안의 재발을 방지하는 방안을 만들라는 권고도 마찬가지라는 평가다. 이병훈 중앙대 사회학과 교수는 “최근 노조 설립 과정에서 삼성의 여러 직원 통제·감시 행위가 알려진 만큼 삼성 계열사들이 구체적인 인사 노무 규정을 명시하면서 위법적인 통제를 금지하면 이번 권고안이 실질적인 힘을 발휘할 수 있을 것”이라며 “삼성의 선언이 선언 그 자체에 그치지 않으려면 사후 관리·감독을 철저히 해야 한다”고 조언했다.정서린 기자 rin@seoul.co.kr한재희 기자 jh@seoul.co.kr▶
▶
▶ⓒ 서울신문(www.seoul.co.kr), 무단전재 및 재배포금지",/news/news_read.nhn?article_id=0003073025&office_id=081&mode=search&query=삼성물산&page=4
,"삼성 준법감시위원회가 삼성그룹 경영권 승계 의혹과 관련해 총수인 이재용(사진) 부회장이 사과하고, ‘무노조 경영’ 방침이 더는 존재하지 않을 것이라는 점도 직접 선언하라고 권고했다.
삼성 준법감시위는 11일 이 부회장과 삼성전자, 삼성전기, 삼성SDI, 삼성SDS, 삼성물산, 삼성생명, 삼성화재 등 7개 관계사에 권고문을 보내고 30일 이내에 회신하라고 요청했다고 밝혔다.
준법감시위는 “삼성그룹의 과거 불미스러운 일들이 대체로 ‘승계’와 관련이 있다고 봤다”며 총수 일가의 경영권 승계 과정에서 준법 의무 위반 행위가 있었던 데 대해 이 부회장의 반성과 사과를 주문했다. 그러면서 이 부회장이 향후 경영권 행사, 승계와 관련해 준법 의무 위반이 발생하지 않을 것이라고 국민에게 공표하도록 권고했다.
준법감시위가 이 부회장 파기환송심 형량 감경을 위한 ‘면피용’이라는 일각의 지적에 대해서는 “이 같은 회의적 시각을 불식시키기 위해 이 부회장과 관계사 모두가 관련 조치를 마련해 공표하라”고 강조했다.
 박세준 기자ⓒ 세상을 보는 눈,",/news/news_read.nhn?article_id=0003446353&office_id=022&mode=search&query=삼성물산&page=4
2분기 상장 예비심사 청구 예정…공모 규모 1조원대 이를 전망,"(서울=뉴스1) 국종환 기자 = 호반건설이 연초부터 강남 재건축 수주전에 도전장을 내고, 금 거래소를 인수하는 등 다방면에서 적극적인 행보를 이어가 관심을 끈다. 이를 통해 기업 가치를 높이고 사업 다각화를 이뤄 연내 기업공개(IPO)를 마무리할 것이란 전망이다.12일 관련 업계에 따르면 호반건설은 지난 9일 서울 강남권 알짜 재건축으로 꼽히는 서초구 반포동 '신반포15차' 시공사 선정 입찰에 입찰 제안서와 보증금 500억원을 내며 최종 참여했다. 이날 입찰에는 국내 시공능력평가 1위인 삼성물산과 3위 대림산업도 함께했다. 호반건설은 이들 상위 대형사와 입찰 리스트에 나란히 이름을 올렸다.지난해 처음 시공능력평가순위 10위에 오르며 중견 건설사에서 대형사로 도약한 호반건설은 호시탐탐 강남 재건축 시장 진입을 노리고 있다. 그동안 탄탄한 재무건전성과 자금력, 시공능력을 바탕으로 단기간에 시평 순위를 끌어올렸으나 아파트 브랜드 선호도와 인지도가 대형사 대비 낮다는 것이 늘 아쉬움으로 남았었다. 강남 재건축 수주를 통해 기업 가치와 인지도를 높여 진정한 대형사 반열에 오른다는 목표다.호반은 인수합병(M&A)을 통한 사업 다각화도 활발하게 추진 중이다. 호반그룹 유통 계열사인 호반프라퍼티는 지난달 금 유통 전문기업인 '삼성금거래소' 인수 작업을 마무리했다. 금거래소 지분 43%에 해당하는 12만5460주를 현금 223억원에 매입했다.호반의 신사업 진출은 어제오늘 일이 아니다. 지난해 6월에는 가락시장 내 도매시장법인인 대아청과(주)를 인수해 농산물 유통 사업에 진출했다. 앞서 제주 퍼시픽랜드, 리솜 리조트, 덕평CC, 서서울CC 등을 차례로 인수하며 레저사업도 확대하고 있다. 또 KBC광주방송의 대주주로 미디어 사업에도 발을 들였다. 지속적인 사업 다각화로 사업 포트폴리오가 단조롭다는 우려를 해소했다는 평가다.호반건설은 기업가치 제고와 사업 다각화, 호실적 등을 바탕으로 연내 IPO를 마무리한다는 계획이다. 투자은행 업계에 따르면 호반은 올해 2분기 중에 유가증권 시장에 상장 예비심사를 청구할 예정이다. 예비심사를 통과하면 3분기에 상장할 것으로 전망된다. 이를 위해 지난달 중순부터 주관사단(미래에셋대우, KB증권, 대신증권)이 호반건설 본사에 파견돼 실무 작업을 진행 중이다.증권업계에선 호반건설의 공모 규모만 1조원에 달할 것으로 예상한다. 국내 IPO 시장에서 공모 금액이 1조원을 넘은 건 2017년 7월 상장한 셀트리온헬스케어가 마지막이었다. 호반건설은 2017년 자기자본이 1조3835억원이었지만, 2018년 호반(옛 호반건설주택)을 흡수합병하면서 3조1960억원으로 껑충 뛰었다. 지난해 순이익 유입으로 자기자본은 3조5000억원까지 늘어난 것으로 알려졌다.증권업계 한 관계자는 ""호반건설은 지난 몇 년 간 외형성장과 사업 다각화를 꾸준히 이뤄왔고, IPO를 위한 준비도 오랜 기간 진행해 왔기에 시장의 기대감도 높다""며 ""계획대로 하반기에 기업공개에 나설 경우 최대어로 꼽힐만한 규모와 인지도를 갖췄다""고 말했다.jhkuk@news1.kr© 뉴스1코리아(), 무단 전재 및 재배포 금지",/news/news_read.nhn?article_id=0004517318&office_id=421&mode=search&query=삼성물산&page=4
