head,text,url
"반포주공1단지 3주구 재건축조합은 당초 HDC현대산업개발을 시공사로 선정했지만 공사비 등에서 발생한 이견을 좁히지 못하고 재선정 절차를 밟아 삼성물산과 대우건설이 맞붙게 됐다. /사진=김창성 기자삼성·대우, 비방·고소 등 치열한 공방… 조합 표심은?","서울 서초구 반포주공1단지 3주구(반포3주구) 재건축 수주전에 나선 삼성물산 건설부문과 대우건설의 경쟁이 점입가경이다. 반포3주구 재건축사업은 서울 서초구 1109번지 일대에 위치한 1490가구 규모의 대단지를 허물고 지하 3층~지상 35층 17개동 2091가구로 다시 짓는 프로젝트로 총 공사비가 8000억원이 넘는다.조합은 당초 HDC현대산업개발을 시공사로 선정했지만 공사비 등에서 발생한 이견을 좁히지 못하고 재선정 절차를 밟아 삼성물산과 대우건설이 맞붙게 됐다. 두 회사는 국내 주택사업을 대표하는 대형 건설업체인 만큼 수주를 위한 치열한 경쟁을 예고했지만 일반적인 수주 경쟁의 수위를 벗어난 비방과 고소를 행해 눈살을 찌푸리게 했다. 최종 승자는 이달 말 조합 총회에서 가려진다.삼성물산은 높은 신용도와 안정적인 자금조달 역량을 강점으로 반포3주구에 준공 후 분양을 제안했다. 삼성물산은 일반적인 후분양과 달리 100% 준공 후 분양을 제시했고 이를 위해 총회에서 결의하는 사업비 전체를 시공사가 책임지고 조달하는 파격적인 제안을 내걸었다.삼성물산은 검증된 시공관리 역량을 토대로 빠른 착공과 공사기간 단축을 통해 사업기간을 경쟁사 대비 1년 이상 단축해 사업비 금융비용 등을 절감해 조합원의 부담을 최소화한다는 계획이다.삼성물산은 조합원 부담을 줄이기 위해 시공사 선정 이후 물가 상승 등의 요인에 따른 공사비 인상을 하지 않을 계획이다. 후분양을 선택하더라도 조합원 환급금을 조기 지급할 예정이며 조합원 부담금의 경우는 입주할 때 납부하는 조건으로 제안했다.삼성물산 관계자는 “시공능력평가 1위의 역량과 아파트브랜드 래미안 20년 노하우를 담아 최상의 사업조건을 제안했다”며 “반포를 대표하는 새로운 랜드마크 공사를 성공적으로 수행할 것”이라고 자신했다.경쟁사인 대우건설은 일찌감치 입찰보증금과 입찰제안서를 재출해 기호 1번을 받았다. 대우건설은 그동안 신속한 사업추진과 적극적인 문제 해결 등 정비사업에서 발생할 수 있는 다양한 변수에 기민하게 대처하는 모습으로 ‘신뢰’와 함께 ‘해결사’의 이미지를 쌓아왔다는 자신감을 내비쳤다.대우건설은 이를 바탕으로 사업제안 내용에도 차별성에 초점을 맞췄다. 대우건설은 선분양·후분양과 함께 ‘재건축 리츠사업’ 카드를 꺼냈다. 재건축 리츠는 조합의 일반분양분을 감정평가금액으로 리츠에 현물 출자하는 것으로 조합원 선택의 폭을 넓혔다. 다만 대우건설의 제안은 국토교통부와 서울시가 ‘불공정행위’로 규정 지어 실제 도입 여부는 미지수다. 대우건설 관계자는 “대우건설의 축적된 기술과 수많은 주택사업경험 등 모든 역량을 총집결한 하이엔드 주거문화를 반포의 중심에서 선보일 계획”이라며 “조합의 입찰 지침 완벽 준수를 기본으로 대우건설만의 차별화된 상품, 분양 특화 전략 등 조합원의 이익을 극대화할 수 있는 획기적인 제안을 마련했다”고 자신했다.시공능력평가 1위 건설업체인 삼성물산은 최근 신반포15차 재건축사업을 따내며 5년 만의 정비사업 복귀 신고를 무사히 마쳤다. 삼성물산은 이 기세를 몰아 반포3주구 재건축 수주 경쟁에 뛰어들었지만 난관에 부딪혔다.삼성물산은 신반포15차 재건축 수주전에서 경쟁사의 비방을 딛고 여유 있게 승리했지만 반포3주구에서는 대우건설과 공방전을 펼치는 모습이다. 대우건설은 최근 삼성물산과 한형기 신반포1차(아크로리버파크) 조합장을 명예훼손 및 업무방해, 입찰방해, 개인정보보호법 위반 등의 혐의로 방배경찰서에 고소·고발했다.대우건설은 한씨가 최근 반포3주구 조합원에게 ‘대우건설이 반포3주구 시공사로 선정돼선 안 된다’는 취지의 문자 메시지를 보냈고 이는 삼성물산과의 공모가 있었다고 주장한다. 대우건설 관계자는 “이 같은 내용은 회사에 대한 명예 훼손이자 업무 방해”라며 “삼성물산과의 연관성을 수사당국이 밝혀줘야 한다”고 강조했다.반면 삼성물산은 황당하다는 입장이다. 삼성물산 관계자는 “대우건설의 일방적인 주장이자 근거 없는 얘기”라고 맞섰다. 이어 “특별히 언급할 내용도 없고 아직 경찰서에서 어떤 연락도 받지 못했다”며 “내부적으로 내용을 충분히 검토해 대응할 것”이라고 말했다.두 회사는 최근 홍보물 배포를 두고도 잡음을 일으켰다. 조합과 논의해 홍보물을 각자 3개씩 발송하기로 합의하고 우체국에 모였는데 삼성물산의 홍보물에 대우건설을 비방하는 내용이 포함돼 문제가 불거졌다. 해당 우편물에는 최근 삼성물산이 수주한 신반포15차 시공사 해지 총회 관련 책자가 있었다. 당시 시공사 지위가 취소된 건설업체는 바로 대우건설이었다. 우편물을 확인한 대우건설은 강력히 항의했고 두 회사는 다시 우편물 작업을 마쳤다. 최근엔 관할 서초구청까지 나서 공문을 보내 두 회사의 과열 경쟁을 자제 시킬 만큼 공방이 치열한 모습이다. 대우건설은 홍보요원(OS) 불법 홍보활동과 관련된 잡음이 일었다. OS요원의 불법 홍보활동으로 추정되는 동영상까지 등장한 것. 해당 동영상은 자택에 들어가는 반포3주구 주민에게 한 여성이 삼성물산 제안서를 비판하는 내용이 담겼다. 대우건설은 해당 OS요원이 대우건설 측 사람이라는 증거가 어디에도 없다며 악의적인 추측이라고 반발했다. 대우건설은 홍보대행사를 동원해 기자들을 대상으로 시공사 선정에 유리한 기사를 청탁했다는 의혹도 일며 곤혹을 치렀지만 이 역시 관련 의혹을 강하게 부인했다. 두 회사의 치열한 공방에 조합 측은 혀를 내두르는 분위기다. 한 조합원은 “한번 시공사를 해지하고 다시 선정 절차를 밟고 있어 지연된 시간만큼 조합원들의 손해가 만만치 않다”며 “수주를 위한 경쟁을 존중하지만 지나친 공방으로 사업가치가 훼손될 수 있다는 점을 숙지하길 바란다”고 경고했다.김창성 기자 solrali@mt.co.kr
<저작권자 ⓒ '성공을 꿈꾸는 사람들의 경제 뉴스' 머니S, 무단전재 및 재배포 금지>",/news/news_read.nhn?article_id=0000543377&office_id=417&mode=search&query=삼성물산&page=3
,"[아시아경제 김혜원 기자] 이재용 삼성전자 부회장이 18일(현지시간) 중국 산시성에 위치한 시안 반도체 사업장을 찾고 글로벌 현장 경영을 재개했다.삼성전자에 따르면 이 부회장은 이날 중국 시안 반도체 공장을 방문해 신종 코로나바이러스감염증(코로나19) 장기화에 따른 영향과 대책을 논의하고 임직원을 격려하는 시간을 가졌다.이 부회장의 이번 해외 출장은 지난 1월 삼성전자 브라질 마나우스·캄피나스 공장을 찾아 중남미 사업을 점검한 이후 100여일 만이다.코로나19 사태 이후 중국을 방문한 글로벌 기업인은 이 부회장이 처음이다. 이 부회장은 지난해 2월에도 시안 반도체 현장을 찾고 설 명절에 근무하는 임직원들을 격려한 바 있다. 삼성전자 측은 ""이번 출장은 코로나19 위기 상황에 적극 대응하는 동시에 미래에 대비한 도전의 고삐를 늦추지 않겠다는 의지를 강조하기 위한 것""이라고 전했다.삼성전자 시안 공장은 삼성의 유일한 해외 메모리 반도체 생산기지로, 코로나19 사태 속에서도 2공장 증설 작업을 예정대로 진행 중이다. 지난달에는 2공장 증설에 필요한 엔지니어 200여명을 전세기로 파견했다.이 부회장은 코로나19 와중에도 국내 사업장을 잇따라 찾아 현장 경영을 지속했다. 지난 2월20일에는 '시스템 반도체 사업의 심장'과 같은 삼성전자 화성사업장 극자외선(EUV) 라인을 방문한 데 이어 3월3일에는 구미사업장에 들렀다. 이어 3월19일 충남 아산사업장과 3월25일 수원 삼성종합기술원을 찾았다. 지난 13일에는 정의선 현대자동차그룹 총괄 수석부회장을 삼성SDI 천안사업장으로 초청해 첫 단독 총수 회동을 갖고 차세대 전기차용 배터리인 전고체 전지 개발 현황과 방향성에 대한 의견을 교환했다.이 부회장의 이번 중국 시안행(行)은 지난 6일 경영권 승계 논란 등에 대한 대국민 사과와 함께 ""대한민국 국격에 어울리는 새로운 삼성을 만들겠다""는 언급 이후 첫 대외 행보이기도 하다. 특히 삼성물산과 제일모직 합병 의혹 등을 수사 중인 검찰의 이 부회장 소환조사가 임박한 가운데 이뤄진 것이다.김혜원 기자 kimhye@asiae.co.kr <ⓒ경제를 보는 눈, 세계를 보는 창 아시아경제 무단전재 배포금지>",/news/news_read.nhn?article_id=0004679891&office_id=277&mode=search&query=삼성물산&page=2
,"[디지털타임스 이상현 기자] 인천에서 4800여 가구의 대단지 아파트가 본격적으로 분양된다.DK도시개발·DK아시아는 인천 서구 검암역세권 일대에 짓는 '검암역 로열파크씨티 푸르지오'의 견본주택을 오는 29일 공개할 예정이라고 18일 밝혔다.이 단지는 최고 40층, 4805가구 규모의 매머드급 대단지로 조성된다.DK도시개발·DK아시아에 따르면 검암역 로열파크씨티 푸르지오는 검암역에서 공항철도를 이용할 경우 김포공항역까지 2개 정거장, 마곡나루역까지 3개 정거장이 소요된다.또 사업지 전면 폭 길이는 약 1㎞에 달하며, 단지 서쪽에 인접한 야생화 단지는 롯데월드 면적의 약 6배 크기 수준이다.단지 내부에는 9.6㎞ 둘레길과 단지 내 1㎞ 데크길이 들어서며 삼성물산 리조트부문과 국내 아파트 단지 내 최초로 '미니 에버랜드'가 조성된다. 이 밖에 100만주에 가까운 꽃과 나무를 심고 단지 전체를 뒤덮는 '밀리언파크(Million Park)'가 조성될 예정이다.이 밖에 DK도시개발·DK아시아는 LG전자와 업무협약을 통해 차세대 사물인터넷기술을 적용할 예정이며, 풀무원푸드앤컬쳐와 손잡고 입주민들에게 세 끼 식사 서비스 제공도 준비 중에 있다.단지 내 커뮤니티 시설은 피트니스크럽, 수영장, 사우나, 도서관, 그리너리라운지, 연회장, 루프탑, 파티룸, 티카페, 펫카페, 게스트하우스 등이 들어선다.이 밖에 1·2단지를 거쳐 공항철도 검암역까지 5분간격(출퇴근 시간 기준)으로 운행하는 순환 셔틀버스(총 6대)를 제공할 예정이다. 셔틀버스 6대는 5년간 무상으로 운영된 이후 단지에 기증된다.김정모 DK도시개발·DK아시아 회장은 "" 서울에서 가장 가까운 대한민국 최초 차세대 휴양 리조트 도시를 만들겠다""라며 ""단순히 잠을 자기 위한 집이 아니라 고급 리조트에서만 누리던 다양한 서비스를 제공해 입주민들이 단지 안에서 모든 것을 해결할 수 있는 '리조트 도시'로 조성할 계획""이라고 밝혔다.이상현기자 ishsy@dt.co.kr 디지털타임스
/",/news/news_read.nhn?article_id=0002598598&office_id=029&mode=search&query=삼성물산&page=2
"강력한 보안 시스템, 원스톱 생활서비스 환경 구축","[파이낸셜뉴스] 삼성물산은 서울 서초구 반포주공1단지 3주구 재건축사업에 강력한 보안 환경을 구축해 입주민들의 안전을 최우선으로 확보하고 원스톱 생활서비스 환경을 만들 예정이라고 18일 밝혔다.
 먼저 단지 출입구와 놀이터, 주차장에는 500만 화소의 CCTV가 설치된다. 에스원에서 제공하는 지능형 영상 감시 시스템과 연계, 침입이나 화재, 쓰레기 방치, 쓰러짐 등의 상황을 자동으로 감지해 사고나 범죄를 예방할 계획이다.
 단지와 상가로 직접 이어지는 9호선 구반포역 연결통로에도 500만 화소의 CCTV를 설치한다.
 주차장 내 안전을 위해 모든 동 지하에서 커뮤니티센터까지 안전하게 이동할 수 있는 폭 1.5m 이상의 보행자 동선을 확보하고 2.5m로 넓힌 안정적인 주차공간을 확보할 방침이다.
 각 동별 지하에 프라이빗 드롭-오프 존과 컨비니언트 로비를 설치하고 우편이나 택배보관함, 코인세탁실 및 세대창고를 제공해 원스톱 생활서비스 환경을 구축한다.
 놀이터와 주차장에는 비상벨 시스템을 설치하고, 엘리베이터 내부에 카드키 인식 시스템을 적용해 목적층으로만 접근이 가능하도록 운영한다.
 각 세대에는 얼굴인식 출입 시스템을 적용, IoT 홈패드를 통해 외부인 침입 시 자동으로 녹화하는 기능을 도입할 계획이다.
 입주민들의 건강을 지키기 위한 안티-바이러스 기술도 도입한다.
 동 출입구에는 퓨어게이트를 설치하여 고속의 바람으로 바이러스와 미세먼지를 털어내고 각 세대에는 중문과 에어드레서가 적용된 클린현관을 제공해 외투 등에 남아있는 잔여먼지와 바이러스를 제거할 수 있도록 한다.
 아이를 키우는 가족들을 위한 공간도 특별하게 조성한다.
 단지 내 유치원과 어린이집은 삼성직원들이 이용하는 어린이집을 모델로 삼성물산이 개발한 안심보육 가이드라인을 활용할 예정이다.
 미세먼지 등으로 야외 활동이 어려울 경우 아이들이 실내에서 안전하게 놀 수 있는 키즈 플레이하우스도 설치한다.
 삼성물산 관계자는 ""래미안 20년 노하우를 담아 최상의 사업조건을 제안했으며 반포를 대표하는 새로운 랜드마크 공사를 성공적으로 수행할 것""이라고 강조했다.
 한편 반포3주구 재건축 사업은 서초구 1109일대 1490가구를 재건축해 지하 3층~지상 35층, 17개동, 공동주택 2091가구와 상가 등 부대복리시설을 건설하는 내용이다. 총 공사비는 8087억 원 규모다.
 조합은 오는 19일 1차 합동설명회를 열고 20~29일 공식 홍보관을 운영한 뒤 30일 최종 시공사를 선정할 계획이다.



 ※ 저작권자 ⓒ 파이낸셜뉴스. 무단 전재-재배포 금지",/news/news_read.nhn?article_id=0004426057&office_id=014&mode=search&query=삼성물산&page=2
,"대우건설은 글로벌 컨시어지 1위 업체 '퀸터센셜리(Quintessentially)'와 계약하고, 수주를 추진 중인 반포1단지 3주구(단지명 '트릴리언트 반포')에 'VVIP 호텔급 컨시어지 서비스 제공'을 제안했다고 18일 밝혔다.
2000년 영국 런던에서 시작해 전 세계 60여개 국가에 지사를 두고 35개 자회사를 운영하는 퀸터센셜리는 각국의 최상류층 인사와 전문직 종사자, 셀러브리티 등 VVIP 회원 3만 명 이상을 보유한 글로벌 컨시어지 1위 기업이다. 영국 찰스 왕세자의 부인 카밀라 파커볼스의 조카인 '벤 엘리엇'이 공동창립한 회사로, 글로벌 네트워크를 활용해 최고급 수준의 실생활 지원 서비스를 제공하는 것으로 유명하다. 한국에는 2008년 진출했다.
대우건설은 퀸터센셜리와 손잡고 ▲여행, 골프, 식당 등의 섭외·예약 대행 서비스 ▲의전·통역 서비스 ▲실생활 전 분야에서 맞춤 정보를 제공하는 비서 서비스 ▲스마트홈 어플리케이션을 연동한 하우스키핑 서비스 ▲드롭 존(drop zone) 발렛파킹 서비스 등 반포3주구 입주민에게만 특화되고 차별화된 전문 컨시어지 서비스 제공을 제안했다.
이 외에도 대우건설은 ▲국내 최다 식음브랜드를 보유한 신세계푸드와 협력한 조식 서비스 ▲파리크라상 등 카페 브랜드를 보유하고 있는 SPC와 단지 내 카페 운영 ▲국내 최대 피트니스업체인 GOTO피트니스와 협업해 PT, GX프로그램, 수영장 운영·홈트레이닝 프로그램 마련 ▲우리은행의 자산관리, 세금·부동산 상담 등 PB(Private Banking) 서비스 등도 함께 제안했다. 자녀 돌봄, 실버케어, 비대면 건강관리 서비스 등을 더한 토털 컨시어지 서비스는 스마트홈 어플리케이션에 연동해 입주민들의 활용성과 편의성을 높인다는 계획이다.

대우건설 관계자는 ""반포3주구에 대한민국 최고의 주거 명작을 짓겠다고 약속했기 때문에 컨시어지 서비스도 그 격에 맞는 세계 1위 업체를 선정했다""며 ""현재 '나인원한남', '반포 아크로리버파크' 등 강남권 고급 공동주택에서 조식 서비스 등 일부 컨시어지 서비스를 제공하는 수준에 그치고 있다. 대우건설이 제안한 차별화된 토털 컨시어지 서비스는 반포3주구 입주민의 자부심과 삶의 질 향상뿐만 아니라 재산 가치까지 상승시키는 효과를 기대할 수 있을 것""이라고 말했다.대우건설과 삼성물산이 뛰어든 반포3주구 사업은 서초구 1109일대 1490세대를 지하 3층~지상 35층, 17개동, 2091세대로 재건축하는 물량으로 총 공사비는 8087억원 규모다. 조합 측은 오는 19일 1차 합동설명회를 열고 20일부터 29일까지 공식 홍보관을 운영한 뒤, 30일 최종 시공사를 선정할 계획이다. [디지털뉴스국 이미연 기자] [ⓒ 매일경제 & mk.co.kr, 무단전재 및 재배포 금지]",/news/news_read.nhn?article_id=0004576806&office_id=009&mode=search&query=삼성물산&page=2
,"반포3주구 투시도. 제공|삼성물산[스포츠서울 김효원기자]삼성물산 건설부문(대표 이영호)은 반포아파트 3주구 재건축사업에 강력한 보안 환경을 구축하는 안전아파트를 제안했다.안전 보안 환경을 위해 단지 출입구, 놀이터, 주차장에는 500만 화소의 CCTV를 설치한다. 이어 에스원에서 제공하는 지능형 영상 감시 시스템과 연계해 침입이나 화재, 쓰레기 방치 등 위험 상황을 자동으로 감지해 사고를 예방할 예정이다. 단지와 상가로 직접 이어지는 9호선 구반포역 연결통로에도 500만 화소의 CCTV를 설치해 안전하고 편리한 환경을 제공한다.주차장 내에서 안전하게 이동할 수 있도록 모든 동 지하에서 커뮤니티센터까지 폭 1.5m 이상의 보행자 동선을 설치하고, 주차공간은 폭을 2.5m로 넓혀 안정적인 주차를 돕는다.각 동별 지하에 프라이빗 드롭-오프 존과 컨비니언트 로비를 설치하고 우편이나 택배보관함, 코인세탁실 및 세대창고를 제공해 편리한 생활을 할 수 있게 한다.놀이터와 주차장에는 비상벨 시스템을 설치하고, 엘리베이터 내부에 카드키 인식 시스템을 통해 목적층으로만 접근할 수 있도록 한다. 각 세대에는 얼굴인식 출입 시스템이 적용되며, IoT 홈패드를 통해 외부인 침입 시 자동으로 녹화하는 기능도 도입한다.안티-바이러스 기술을 통해 입주민의 건강도 챙긴다. 동출입구에는 퓨어게이트를 설치해 고속의 바람으로 바이러스와 미세먼지를 털어내고, 각 세대에는 중문과 에어드레서를 설치해 잔여먼지와 바이러스를 제거해준다.단지 내 유치원과 어린이집은 삼성물산이 개발한 안심보육 가이드라인을 활용해 안전한 보육환경을 조성할한다. 미세먼지로 야외 활동이 어려운 경우 아이들이 실내에서 안전하게 놀 수 있는 키즈 플레이하우스도 설치한다.삼성물산 관계자는 “래미안 20년 노하우를 담아 최상의 사업조건을 제안했다. 반포를 대표하는 새로운 랜드마크 공사를 성공적으로 수행할 것”이라고 밝혔다.eggroll@sportsseoul.com[기사제보 news@sportsseoul.com]
Copyright ⓒ 스포츠서울&",/news/news_read.nhn?article_id=0000659585&office_id=468&mode=search&query=삼성물산&page=2
▶ 네이버 홈에서 [한국경제TV] 채널 구독하기 [생방송보기]▶ 대한민국 재테크 총집결! - [증권 / 주식상담 / 부동산],"반포아파트 3주구 재건축사업에 입찰한 삼성물산이 해당 단지에 강력한 보안 환경을 구축해 입주민들의 안전을 최우선으로 확보하고 원스톱 생활서비스 환경을 만들 예정이라고 공약했다.삼성물산의 입찰 계획에 따르면 반포3주구 단지 출입구와 놀이터, 주차장에는 500만 화소의 CCTV가 설치되며, 에스원에서 제공하는 지능형 영상 감시 시스템과 연계하여 침입이나 화재, 쓰레기 방치, 쓰러짐 등의 상황을 자동으로 감지하게 된다.또한 단지와 상가로 직접 이어지는 9호선 구반포역 연결통로에도 500만 화소의 CCTV를 설치한다.주차장 내에서의 안전을 위해 모든 동 지하에서 커뮤니티센터까지 안전하게 이동할 수 있는 폭 1.5m 이상의 보행자 동선을 확보하고, 안전한 주차를 위해 폭을 2.5m로 넓힌 안정적인 주차공간을 확보하도록 설계했다고 삼성물산은 설명했다.각 동별 지하에는 프라이빗 드롭-오프 존과 컨비니언트 로비를 설치하고 우편이나 택배보관함, 코인세탁실 및 세대창고를 제공해 원스톱 생활서비스 환경이 구축된다.놀이터와 주차장에는 비상벨 시스템을 설치하고, 엘리베이터 내부에 카드키 인식 시스템을 적용해 목적층으로만 접근이 가능하도록 운영할 방침이다. 세대에는 얼굴인식 출입 시스템이 적용되며, IoT 홈패드를 통해 외부인 침입 시 자동으로 녹화하는 기능을 도입할 계획이다.입주민들의 건강을 지키기 위한 안티-바이러스 기술도 적용한다. 동 출입구에는 퓨어게이트를 설치해 고속의 바람으로 바이러스와 미세먼지를 털어내고, 각 세대에는 중문과 에어드레서가 적용된 클린현관을 제공한다.단지 내 유치원과 어린이집은 삼성직원들이 이용하는 어린이집을 모델로 삼성물산이 개발한 안심보육 가이드라인을 활용해 안전한 보육환경을 조성할 계획으로, 미세먼지 등으로 야외 활동이 어려운 경우를 생각해 아이들이 실내에서 안전하게 놀 수 있는 키즈 플레이하우스도 설치할 예정이다.삼성물산 관계자는 ""래미안 20년 노하우를 담아 최상의 사업조건을 제안했으며, 반포를 대표하는 새로운 랜드마크 공사를 성공적으로 수행할 것""이라고 강조했다.ⓒ 한국경제TV, 무단 전재 및 재배포 금지",/news/news_read.nhn?article_id=0000871488&office_id=215&mode=search&query=삼성물산&page=2
