title,url,press,summary,date
삼성전자보다 비싼 '술값'…中마오타이 시총 289조 돌파,/news/news_read.nhn?article_id=0004635579&office_id=421&mode=search&query=삼성전자&page=7,뉴스1,"환산하면 2361억달러, 원화로는 289조2322억원으로 삼성전자 시가총액(285조6541억원)을 넘어섰다. 중국의 대표 고량주 '마오타이'를 ...",2020-05-13 14:39
선대에는 없던 이재용·정의선 회동…첨단산업 시대가 부른 변화,/news/news_read.nhn?article_id=0004635582&office_id=421&mode=search&query=삼성전자&page=7,뉴스1,이를 위해선 이종기업간 합종연횡이 필요한데 이재용 삼성전자 부회장과 정의선 현대차 수석부회장은 산업트렌드 변화를 누구보다 일찍 이해했다. 13일...,2020-05-13 14:39
믿었던 반도체마저 불안…코로나19에 업황 '안갯속',/news/news_read.nhn?article_id=0000538128&office_id=031&mode=search&query=삼성전자&page=7,아이뉴스24,"삼성전자와 SK하이닉스도 올해 1분기 실적 발표 컨퍼런스콜에서 서버 수요 증가에 따른 메모리 반도체 성장을 전망한 바 있다. 삼성전자는 ""서버 ...",2020-05-13 14:40
[TF특징주] '이재용-정의선' 차세대 배터리 기술 논의에 2차전지株 '급등',/news/news_read.nhn?article_id=0000025584&office_id=629&mode=search&query=삼성전자&page=7,더팩트,"에코프로비엠, 21.84% 오른 8만8800원에 거래 중 이재용 삼성전자 부회장과 정의선 현대차 수석부회장이 만나 전기차 배터리 사업과 관련해 ...",2020-05-13 14:42
이재용·정의선 만난다는 소식에 주가 들썩한 주식들,/news/news_read.nhn?article_id=0004408167&office_id=008&mode=search&query=삼성전자&page=7,머니투데이,이재용 삼성전자 부회장과 정의선 현대차 수석부회장의 만남에 2차 전지주가 들썩이고 있다. 이들이 전고체 배터리 기술을 논의했다는 소식이 들리고 있어서다....,2020-05-13 14:45
재계1·2위 ‘꿈의 배터리’ 협업 … 전기차 ‘글로벌 톱’ 노린다,/news/news_read.nhn?article_id=0002427700&office_id=021&mode=search&query=삼성전자&page=7,문화일보,이재용 삼성전자 부회장과 정의선 현대차그룹 수석부회장은 13일 오전 10시 삼성SDI 천안사업장에서 차세대 전기차용 배터리 사업 협업을 논의하기...,2020-05-13 14:51
"교보악사자산운용, 삼성전자와 소부장 기업에 투자하는 '삼성전자투게더 펀드' 출시",/news/news_read.nhn?article_id=0002882460&office_id=030&mode=search&query=삼성전자&page=7,전자신문,교보악사자산운용은 삼성전자의 장기 성장성에 투자하는 '교보악사삼성전자투게더증권투자신탁[채권혼합]' 펀드를 출시했다고 13일 밝혔다. 삼성전자와 ...,2020-05-13 14:52
정의선이 직접 찾은 '전고체 배터리'…미래 전기차 핵심 기술 평가,/news/news_read.nhn?article_id=0009860237&office_id=003&mode=search&query=삼성전자&page=6,뉴시스,"재계 1, 2위 총수인 이재용 삼성전자 부회장과 정의선 현대차그룹 수석부회장이 전격적인 회동을 갖는다. 그 배경에는 미래 전기차 핵심 기술로 꼽...",2020-05-13 14:55
"""삼성전자 작업환경보고서는 영업비밀, 공개대상 아냐""…2심도 삼성 승소",/news/news_read.nhn?article_id=0004677530&office_id=277&mode=search&query=삼성전자&page=6,아시아경제,삼성전자가 ‘작업환경 측정 결과 보고서’를 공개하라고 결정한 고용노동부를 상대로 낸 소송에서 법원이 1심에 이어 2심도 ‘영업비밀이라서 공개의무...,2020-05-13 14:55
세계 곳곳으로 향하는 삼성의 ‘선한 기업’ 행보…인도에 코로나 지원금 전달,/news/news_read.nhn?article_id=0002597864&office_id=029&mode=search&query=삼성전자&page=6,디지털타임스,삼성전자가 코로나19로 어려움을 겪고 있는 전 세계에 대한 지원을 확대하며 '선한 기업' 행보를 이어가고 있다. 글로벌 기업으로서 삼성전자가 책...,2020-05-13 15:02
[특징주] 이재용·정의선 회동에 배터리 관련주 급등,/news/news_read.nhn?article_id=0004635666&office_id=421&mode=search&query=삼성전자&page=6,뉴스1,이재용 삼성전자 부회장과 정의선 현대차그룹 수석 부회장이 전기자동차용 배터리 개발을 논의하기 위해 회동했다는 소식에 배터리 관련주가 강세를 보이...,2020-05-13 15:02
"LG전자 ""무선이어폰 나도 있다""…신제품으로 다시 도전장",/news/news_read.nhn?article_id=0004339785&office_id=015&mode=search&query=삼성전자&page=6,한국경제,"올 들어서 이미 삼성전자가 '갤럭시 버즈 플러스', 마이크로소프트가 '서피스 이어버즈'를 출시했다. 삼성은 올 하반기에도, 애플은 내년에 또다시...",2020-05-13 15:06
"[특징주] 재계 1,2위 오너가 회동에, 일진머티리얼즈 최대 수혜주 등극",/news/news_read.nhn?article_id=0000541905&office_id=417&mode=search&query=삼성전자&page=6,머니S,"이재용 삼성전자 부회장과 정의선 현대차그룹 수석부회장의 회동에 일진머티리얼즈 주가가 상승세를 탔다. 재계 1,2위 오너家 회동에 전기차 배터리사업 협력에 힘이...",2020-05-13 15:11
"삼성-현대차, '전기차 배터리'로 뭉치면 뭘 얻을 수 있나?",/news/news_read.nhn?article_id=0004408198&office_id=008&mode=search&query=삼성전자&page=6,머니투데이,""" 이재용 삼성전자 부회장과 정의선 현대자동차그룹 수석부회장의 13일 '배터리 회동'을 한 것을 두고 재계에서 나온 반응이다. 두 인물이 업무 ...",2020-05-13 15:15
이재용·정의선 '전기차 배터리' 협력...文대통령 '한국판 뉴딜'에 화답(종합),/news/news_read.nhn?article_id=0009860321&office_id=003&mode=search&query=삼성전자&page=6,뉴시스,이재용 삼성전자 부회장과 정의선 현대차그룹 수석부회장이 13일 회동을 갖고 전기차 배터리 사업 파트너십을 공식화 했다. 문재인 대통령이 지난 1...,2020-05-13 15:15
이재용·정의선 전격 회동에 2차 전지 관련주 '고공행진',/news/news_read.nhn?article_id=0000541910&office_id=417&mode=search&query=삼성전자&page=6,머니S,이재용 삼성전자 부회장과 정의선 현대차 수석부회장의 만남에 2차 전지 관련주가 고공행진하고 있다. 이들이 전고체 배터리 기술을 논의했다는 소식이...,2020-05-13 15:16
이재용-정의선 첫 단독회동…전기차 배터리 논의,/news/news_read.nhn?article_id=0000191630&office_id=449&mode=search&query=삼성전자&page=6,채널A,이재용 삼성전자 부회장과 정의선 현대차 수석부회장이 오늘 오전 10시 삼성SDI 천안사업장에서 만났습니다. 이 부회장이 삼성SDI 배터리 공장에...,2020-05-13 15:16
'재계 빅2' 협력 확대될까…이재용·정의선 첫 단독 회동,/news/news_read.nhn?article_id=0000025589&office_id=629&mode=search&query=삼성전자&page=6,더팩트,"이재용·정의선, 삼성SDI 천안사업장서 회동…전기차 배터리 논의 재계 1·2위 그룹 총수인 이재용 삼성전자 부회장과 정의선 현대자동차그룹(현대차...",2020-05-13 15:21
"""포스트 코로나 대비해야""…경총, 법인세 인하 등 정부에 호소(종합)",/news/news_read.nhn?article_id=0004639163&office_id=018&mode=search&query=삼성전자&page=6,이데일리,"회의에는 손경식 경총 회장을 비롯해 권오갑 현대중공업지주(267250) 회장, 김창범 한화솔루션(009830) 부회장, 윤여철 현대자동차(005...",2020-05-13 15:27
미래 성장에는 `아군·적군` 없다…`제2 반도체` 손잡은 이재용·정의선,/news/news_read.nhn?article_id=0002597888&office_id=029&mode=search&query=삼성전자&page=6,디지털타임스,이재용 삼성전자 부회장과 정의선 현대자동차그룹 수석부회장이 13일 총수 자격으로 처음 독대해 '제2의 반도체'로 꼽히는 차세대 친환경차용 배터리...,2020-05-13 15:35
"한국전자금화폐, 고경력과학기술인 윤대원 박사 자문 합류",/news/news_read.nhn?article_id=0003008823&office_id=032&mode=search&query=삼성전자&page=6,경향신문,"계획”이라며 “제조벤처였던 아이카이스트가 MIT출신, 삼성전자 임원 등을 적극 합류시켜 초고속 성장했던 기술경영모델을 계속 벤치마킹할 예정“이라...",2020-05-13 15:40
‘포스트 코로나 시대’ 준비하는 애플…중국서 공장 빼고 재택근무자도 복귀,/news/news_read.nhn?article_id=0003000383&office_id=025&mode=search&query=삼성전자&page=6,중앙일보,애플의 인도행은 삼성전자나 샤오미 등에도 영향이 미칠 전망이다. 애플이 인도에서 단순히 생산만 늘리는 게 아니라 시장도 적극 공략하고 나설 수 ...,2020-05-13 15:44
[코스피 마감]개인·기관 쌍끌이 매수에 1940선 회복,/news/news_read.nhn?article_id=0004639190&office_id=018&mode=search&query=삼성전자&page=6,이데일리,"삼성전자(005930)는 1%대, 셀트리온(068270), LG생활건강(051900), 현대차(005380)도 1%대 상승했다. 삼성바이오로직스...",2020-05-13 15:47
이재용·정의선 첫 단독 회동에 배터리 관련株 급등(종합),/news/news_read.nhn?article_id=0004635913&office_id=421&mode=search&query=삼성전자&page=6,뉴스1,이재용 삼성전자 부회장과 정의선 현대차그룹 수석 부회장이 전기자동차용 배터리 개발을 논의하기 위해 회동했다는 소식에 배터리 관련주들이 급등했다....,2020-05-13 15:47
[5스타전략] 코스피 투자전략 및 테마전략,/news/news_read.nhn?article_id=0000211375&office_id=374&mode=search&query=삼성전자&page=6,SBS CNBC,코스피지수에서 시가총액 비중이 가장 큰 삼성전자 상승이 약했기 때문입니다. 코스피지수가 상승하기 위해서는 삼성전자 상승이 필수적입니다. 삼성전자...,2020-05-13 15:50
'재고도 위험해'…당좌비율 높은 종목에 쏠리는 투심,/news/news_read.nhn?article_id=0000538157&office_id=031&mode=search&query=삼성전자&page=6,아이뉴스24,"종목은 삼성전자와 고영, 삼성에스디에스, 한전KPS, RFHIC, 천보 등 13개다. 이들 종목은 지난달 말부터 평균 수익률이 뛰기 시작해 현재...",2020-05-13 15:50
"코스피, 개인·기관 매수에 상승 마감…1,940선 회복(종합)",/news/news_read.nhn?article_id=0011606479&office_id=001&mode=search&query=삼성전자&page=6,연합뉴스,"시가총액 상위 종목 가운데는 삼성SDI(8.98%), LG화학(4.14%), 삼성바이오로직스(4.05%), 셀트리온(1.90%), 삼성전자(1....",2020-05-13 15:56
[시황종합] 코스피 1% 상승…코스닥 3개월만에 690선 회복,/news/news_read.nhn?article_id=0004635967&office_id=421&mode=search&query=삼성전자&page=5,뉴스1,"코스피 시가총액 상위 10개 종목 중 삼성SDI(8.98%), LG화학(4.14%), 삼성바이오로직스(4.05%), 셀트리온(1.90%), 삼성...",2020-05-13 15:56
"[TF시황] 코스피, 기관 매수 힘입어 1940선 '회복'",/news/news_read.nhn?article_id=0000025593&office_id=629&mode=search&query=삼성전자&page=5,더팩트,"삼성전자(+1.36%), 삼성바이오로직스(+4.05%), 삼성전자우(+0.49%), 셀트리온(+1.90%), LG화학(+4.14%), LG생활건...",2020-05-13 15:58
"코스피, 개인·기관 매수세에 1940.42로 상승 마감",/news/news_read.nhn?article_id=0004677624&office_id=277&mode=search&query=삼성전자&page=5,아시아경제,"시가총액 상위종목을 보면 삼성전자는 전 장보다 1.36% 오른 4만8550원에 거래를 끝마쳤다. 삼성바이오로직스(4.05%), 셀트리온(1.90...",2020-05-13 15:58
이재용·정의선 전기차 협력에…2차전지 관련株 급등,/news/news_read.nhn?article_id=0004339841&office_id=015&mode=search&query=삼성전자&page=5,한국경제,국내 양대 그룹 총수인 이재용 삼성전자 부회장과 정의선 현대차 수석부회장이 전기차 사업 협력을 위해 만났다는 소식에 국내 2차전지 관련주가 급등...,2020-05-13 16:02
"[마감시황] 코스피, 기관 매수 가담…1940 회복",/news/news_read.nhn?article_id=0000538163&office_id=031&mode=search&query=삼성전자&page=5,아이뉴스24,"삼성전자 1.36%, 삼성바이오로직스 4.05%, 삼성전자우 0.49%, 셀트리온 1.90%, LG화학 4.14%의 상승률을 보였다. 업종별로도 대부분 상승세를 나타냈다....",2020-05-13 16:03
"이재용 부회장 ""새 삼성"" 대국민 사과 이후 일주일 만에 현장경영(종합)",/news/news_read.nhn?article_id=0009860556&office_id=003&mode=search&query=삼성전자&page=5,뉴시스,"이재용 삼성전자 부회장과 정의선 현대차그룹 수석부회장이 13일 회동을 갖고 전기차 배터리 사업 파트너십을 공식화 했다. 재계 1, 2위 총수의 ...",2020-05-13 16:04
종목투자 강화하는 외국인…개인은 우량주로 피신,/news/news_read.nhn?article_id=0004339848&office_id=015&mode=search&query=삼성전자&page=5,한국경제,"월초부터 이날까지 순매수 1, 2위를 기록한 종목은 삼성전자(1조852억원), LG화학(3600억원)이었다. 지난달 KODEX WTI원유선물(H) ETF(1조2763억원)...",2020-05-13 16:05
이재용·정의선 회동… 전기차 협력 기대감에 ‘2차전지株’ 급등,/news/news_read.nhn?article_id=0000522737&office_id=366&mode=search&query=삼성전자&page=5,조선비즈,13일 이재용 삼성전자(005930)부회장과 정의선 현대차(005380)수석부회장이 만나 전기차 사업 협력 방안을 논의하면서 2차전지 관련 기업의 주가가 강세를...,2020-05-13 16:05
"[기업] 삼성전자, 시청각 장애인용 스마트 TV 공급자 선정",/news/news_read.nhn?article_id=0001439585&office_id=052&mode=search&query=삼성전자&page=5,YTN,삼성전자가 방송통신위원회의 '2020년 시청각 장애인용 TV 보급 사업' 공급자로 선정돼 연말까지 TV 만5천 대를 공급합니다. 이 TV에는 스마트 돋보기 기능이 탑재돼....,2020-05-13 16:06
수요절벽에 물류·환율도 안 도와주네…삼성·LG TV사업 '겹악재',/news/news_read.nhn?article_id=0004408279&office_id=008&mode=search&query=삼성전자&page=5,머니투데이,[4월 최악의 보릿고개 예상…5월 美·유럽시장 수요 반등 여부가 관건] 코로나19(COVID-19) 여파로 삼성전자와 LG전자의 TV 사업부문이...,2020-05-13 16:09
"[마감] 코스피, 1940선 회복… 개인이 또 살렸다",/news/news_read.nhn?article_id=0000541951&office_id=417&mode=search&query=삼성전자&page=5,머니S,"코스피 시가총액 10위권 종목에서는 삼성전자(1.36%), 삼성바이오로직스(4.05%), 삼성전자우(0.49%), 셀트리온(1.90%), LG화...",2020-05-13 16:10
"코스피, 연기금 매수세 확대에 1,940선 탈환",/news/news_read.nhn?article_id=0000870549&office_id=215&mode=search&query=삼성전자&page=5,한국경제TV,코스피 시가총액 상위 종목에선 SK하이닉스(-2.45%)와 NAVER(-0.46%)가 하락한 가운데 삼성전자(1.36%)와 삼성바이오로직스(4....,2020-05-13 16:11
"재계 1·2위, 文 대통령 '한국판 뉴딜' 즉각 화답…이재용-정의선 '맞손'",/news/news_read.nhn?article_id=0000538165&office_id=031&mode=search&query=삼성전자&page=5,아이뉴스24,이재용 삼성전자 부회장과 정의선 현대차그룹 수석부회장이 '한국판 뉴딜'의 대표 사업으로 꼽힌 전기차 산업 육성을 위해 맞손을 잡는다. 재계 1·...,2020-05-13 16:12
"[마감시황]코스피, 이틀만에 반등 성공…1940선 회복",/news/news_read.nhn?article_id=0009860579&office_id=003&mode=search&query=삼성전자&page=5,뉴시스,"삼성전자(1.36%), 삼성바이오로직스(4.05%), 셀트리온(1.90%), LG화학(4.14%), LG생활건강(1.27%), 삼성SDI(8.9...",2020-05-13 16:12
"코스피, 연기금 등판에 사흘 만에 상승…2차전지株 '강세'",/news/news_read.nhn?article_id=0004339853&office_id=015&mode=search&query=삼성전자&page=5,한국경제,이재용 삼성전자 부회장과 정의선 현대자동차 수석부회장과 만나 전기차 배터리 사업에 대해 논의했다는 소식에 삼성SDI(8.98%) LG화학(4.1...,2020-05-13 16:13
불편하던 삼성과 현대차 3세 경영에서 협력으로 돌아서,/news/news_read.nhn?article_id=0003736890&office_id=011&mode=search&query=삼성전자&page=5,서울경제,"반세기 가까이 재계 서열 1, 2위를 다투며 다양한 사업 분야에서 경쟁해왔던 현대와 삼성은 3세 경영인인 이재용 삼성전자(005930) 부회장과...",2020-05-13 16:13
"코스피, 개인·기관 매수세에 상승 마감…1940선 안착",/news/news_read.nhn?article_id=0002401353&office_id=119&mode=search&query=삼성전자&page=5,데일리안,"시가총액 상위 종목은 삼성전자(1.36%), 삼성바이오로직스(4.05%) 삼성전자우(0.49%), 셀트리온(1.90%), LG화학(4.14%),...",2020-05-13 16:16
"이재용-정의선 첫 단독 회동…재계 1, 2위 배터리 동맹?",/news/news_read.nhn?article_id=0001037531&office_id=214&mode=search&query=삼성전자&page=5,MBC,"""전기차에서 기회 찾자"" 머리 맞댄 이재용-정의선 이재용 삼성전자 부회장과 정의선 현대차 그룹 수석 부회장이 오늘 전기차 배터리 문제를 논의하기...",2020-05-13 16:17
"코스피, 전약후강 속 1940선 돌파…2차 전지주 강세",/news/news_read.nhn?article_id=0002223678&office_id=123&mode=search&query=삼성전자&page=5,조세일보,이날 차세대 전기차 사업 육성을 위한 협력방안과 관련 이재용 삼성전자 부회장과 정의선 현대차그룹 수석 부회장이 회동했다는 소식이 전해지며 2차전...,2020-05-13 16:18
이재용·정의선 손잡자 '전기차주' 찌릿찌릿,/news/news_read.nhn?article_id=0003736895&office_id=011&mode=search&query=삼성전자&page=5,서울경제,이날 이재용 삼성전자 부회장과 정의선 현대차그룹 수석부회장이 충남 천안에 위치한 삼성SDI 천안사업장에서 차세대 전기차용 배터리 개발 현황과 방향에 대해...,2020-05-13 16:21
이재용·정의선 첫 단독 회동… ‘전기차 배터리’ 손잡나,/news/news_read.nhn?article_id=0000541959&office_id=417&mode=search&query=삼성전자&page=4,머니S,이재용 삼성전자 부회장과 정의선 현대차그룹 수석부회장이 첫 단독회동을 가졌다. 재계 1·2위 기업 오너인 두사람이 사업과 관련한 만남을 가진 것...,2020-05-13 16:26
"'비대면 수혜주' 카카오, 시총 10위 첫 진입…계속 질주할까",/news/news_read.nhn?article_id=0004636048&office_id=421&mode=search&query=삼성전자&page=4,뉴스1,삼성전자 우선주를 포함하면 11위다. 외국인이 이날 하루에만 카카오를 168억원어치 순매수하는 등 7거래일 연속 매수세를 이어갔다. 지난 201...,2020-05-13 16:26
삼성 '에어드레서' 삼겹살 냄새까지 싹~…바이러스 살균·유해물질 제거 인증도 국내...,/news/news_read.nhn?article_id=0004339870&office_id=015&mode=search&query=삼성전자&page=4,한국경제,미세먼지가 기승을 부리는 봄을 맞아 외출 후 오염된 옷을 손쉽게 관리할 수 있는 삼성전자 에어드레서가 소비자들의 관심을 끌고 있다. 삼성 에어드...,2020-05-13 16:27
"삼성전자, 국내 유일 에너지 효율 1등급 건조기…3중 필터로 세균 걱정 없어요",/news/news_read.nhn?article_id=0004339871&office_id=015&mode=search&query=삼성전자&page=4,한국경제,삼성전자 건조기·의류청정기는 대표적인 위생·건강가전으로 지난 1분기 판매량이 전년 동기 대비 약 60% 늘어나는 등 큰 폭의 판매 증가세를 나타...,2020-05-13 16:27
"코로나 시대, 가전의 재발견",/news/news_read.nhn?article_id=0004339872&office_id=015&mode=search&query=삼성전자&page=4,한국경제,삼성전자는 에어살균 기능을 갖춘 AI 건조기를 출시했다. 코웨이는 빅데이터를 토대로 제품 관리서비스를 시행 중이다. LG전자는 유해세균을 완벽에...,2020-05-13 16:28
"이재용-정의선 배터리 의기투합, 테슬라 넘어 '1위 노린다'",/news/news_read.nhn?article_id=0002401359&office_id=119&mode=search&query=삼성전자&page=4,데일리안,국내 재계 1·2위 그룹 총수이자 각각 전자와 자동차 리딩기업을 이끌고 있는 이재용 삼성전자 부회장과 정의선 현대자동차그룹 수석부회장이 처음으로...,2020-05-13 16:30
"[마켓뷰] 코스피, 개인·기관 순매수에 1940선 회복",/news/news_read.nhn?article_id=0000522753&office_id=366&mode=search&query=삼성전자&page=4,조선비즈,이재용 삼성전자(005930)부회장과 정의선 현대차그룹 수석부회장이 차세대 배터리 사업 논의를 위해 만났다는 소식이 영향을 미쳤다. 언택트(비접...,2020-05-13 16:31
MSCI 편입 더존비즈온·셀트리온제약 vs 불발 한진칼 '희비교차',/news/news_read.nhn?article_id=0004636071&office_id=421&mode=search&query=삼성전자&page=4,뉴스1,"문종진 교보증권 연구원은 ""신규 편출되는 OCI 등 5개 종목은 600억원 내외의 리밸런싱 매도 자금 유출이 예상되며, 편출 종목 외에 삼성전자...",2020-05-13 16:31
‘전차 군단’ 이재용·정의선 전격 회동… 배경은?,/news/news_read.nhn?article_id=0003464763&office_id=022&mode=search&query=삼성전자&page=4,세계일보,13일 이재용 삼성전자 부회장과 정의선 현대자동차그룹 수석부회장의 회동이 전격 결정되면서 다양한 해석과 관측이 쏟아졌다. 명실상부한 대한민국 재...,2020-05-13 16:36
이재용·정의선 첫 단독 회동...‘전기차·배터리 드림팀’ 꾸릴까,/news/news_read.nhn?article_id=0003090184&office_id=081&mode=search&query=삼성전자&page=4,서울신문,국내 1·2위 그룹 총수인 이재용 삼성전자 부회장과 정의선 현대차그룹 수석부회장이 13일 사상 첫 단독 회동에 나섰다. 이 부회장이 삼성SDI ...,2020-05-13 16:37
"이병철-정주영에서 이재용-정의선까지…호형호제 하는 ""경쟁자인가, 협력자인가""",/news/news_read.nhn?article_id=0004408312&office_id=008&mode=search&query=삼성전자&page=4,머니투데이,[재계 1·2위 만남 주목…과거 반도체·자동차서 경쟁→실리적 협력관계 개선 기대] 이재용 삼성전자 부회장과 정의선 현대자동차그룹 총괄 수석부회장...,2020-05-13 16:37
예상 빗나간 MSCI 지수 변경…한진칼 울고 셀트리온제약 웃었다,/news/news_read.nhn?article_id=0004639290&office_id=018&mode=search&query=삼성전자&page=4,이데일리,반면 △삼성전자(005930) △NAVER(035420) △POSCO(005490) △미래에셋대우(006800) 등의 비중은 감소됐다. 다만 이...,2020-05-13 16:43
1회 충전에 800km 질주… 이재용·정의선 뭉치게 한 ‘전고체배터리’는?,/news/news_read.nhn?article_id=0000541976&office_id=417&mode=search&query=삼성전자&page=4,머니S,이재용 삼성전자 부회장과 정의선 현대차그룹 수석부회장이 13일 삼성SDI 천안사업장에서 만나 ’전고체배터리’와 관련한 논의를 한 것으로 알려지면...,2020-05-13 16:45
"일주일 만에 '뉴삼성' 시동 건 이재용…""배터리에 '미래' 있다""",/news/news_read.nhn?article_id=0004408325&office_id=008&mode=search&query=삼성전자&page=4,머니투데이,""" 이재용 삼성전자 부회장이 13일 정의선 현대차그룹 수석부회장과 전격 회동한 것은 '포스트 반도체'로 주목받는 전기차 배터리 사업을 적극 육성...",2020-05-13 16:49
강남권 재건축 당분간 없을 것…건설사들 불붙은 반포3주구 수주전,/news/news_read.nhn?article_id=0003285860&office_id=020&mode=search&query=삼성전자&page=4,동아일보,삼성물산은 이 외에도 △단지 중앙에 2만 ㎡ 규모의 자연숲 조성 △삼성전자와 협업한 ‘스마트 싱스’ 사물인터넷(IoT) 플랫폼 도입 △해외 디자...,2020-05-13 16:58
이재용·정의선 만나 삼성·현대차 '전기차 배터리 동맹' 공식화(종합2보),/news/news_read.nhn?article_id=0009860739&office_id=003&mode=search&query=삼성전자&page=4,뉴시스,"이재용 삼성전자 부회장과 정의선 현대차그룹 수석부회장이 13일 회동을 갖고 전기차 배터리 사업 파트너십을 공식화 했다. 13일 업계에 따르면, ...",2020-05-13 17:01
[BOOK IN BOOK] 대림산업 | 2020 아크로갤러리:컬렉터의 집-상위 0...,/news/news_read.nhn?article_id=0000065386&office_id=024&mode=search&query=삼성전자&page=4,매경이코노미,"삼성전자의 북미 프리미엄 빌트인 가전 브랜드 데이코(dacor), LG전자의 시그니처 키친 스위트와 오브제, 사운드 플랫폼 ODE 등 다양한 생...",2020-05-13 17:02
"삼성전자, 시청각 장애인용 TV 보급 사업 공급자로 선정",/news/news_read.nhn?article_id=0004408350&office_id=008&mode=search&query=삼성전자&page=4,머니투데이,삼성전자가 방송통신위원회의 '2020년 시청각 장애인용 TV 보급 사업' 공급자로 선정됐다고 13일 밝혔다. 이 사업은 저소득층 시청각 장애인의...,2020-05-13 17:03
