title,url,press,summary,date
이재용·정의선 첫 단독 공식회동…삼성-현대차 배터리 新동맹 급부상,/news/news_read.nhn?article_id=0000538075&office_id=031&mode=search&query=삼성전자&page=10,아이뉴스24,이재용 삼성전자 부회장과 정의선 현대차그룹 수석부회장이 13일 회동을 갖고 전기차 산업 육성을 위해 손을 맞잡는다. 이들 단둘이 공식 회동에 나...,2020-05-13 10:59
'작업환경보고서' 공개 취소…항소심도 삼성 승소,/news/news_read.nhn?article_id=0009859536&office_id=003&mode=search&query=삼성전자&page=10,뉴시스,삼성전자가 고용노동부를 상대로 제기한 '작업환경 측정 결과 보고서' 부분 공개 취소소송에서 항소심 법원도 1심과 마찬가지로 삼성전자의 손을 들어...,2020-05-13 11:02
현대차-삼성 총수들 만나 전기차 사업 방향 논의,/news/news_read.nhn?article_id=0010834307&office_id=056&mode=search&query=삼성전자&page=10,KBS,현대차그룹은 오늘(13일) 정의선 수석부회장이 삼성SDI 천안사업장을 방문해 이재용 삼성전자 부회장 등 경영진을 만나 차세대 전기차 배터리 개발...,2020-05-13 11:02
"[종합] 이재용 부회장, 대국민 사과 후 첫 현장경영 시동",/news/news_read.nhn?article_id=0000538079&office_id=031&mode=search&query=삼성전자&page=10,아이뉴스24,이재용 삼성전자 부회장과 정의선 현대차그룹 수석부회장이 13일 삼성SDI 천안사업장에서 첫 회동한다. 이 부회장과 정 부회장 단둘이 공식 회동하...,2020-05-13 11:04
이재용·정의선 '전기차 배터리' 협력...文대통령 '한국판 뉴딜'에 적극 화답,/news/news_read.nhn?article_id=0009859561&office_id=003&mode=search&query=삼성전자&page=10,뉴시스,이재용 삼성전자 부회장과 정의선 현대차그룹 수석부회장이 13일 회동을 갖고 전기차 배터리 사업 파트너십을 공식화 한다. 문재인 대통령이 지난 1...,2020-05-13 11:05
"손경식 경총 회장 ""기업활력 위해 법인세 인하해야""",/news/news_read.nhn?article_id=0002597822&office_id=029&mode=search&query=삼성전자&page=10,디지털타임스,"손 회장을 비롯해 이인용 삼성전자 사장, 윤여철 현대자동차 부회장, 권오갑 현대중공업지주 회장, 김창범 한화솔루션 부회장, 동현수 두산 부회장,...",2020-05-13 11:05
"이재용·정의선, 단독회동…미래 전기차 배터리 의기투합",/news/news_read.nhn?article_id=0002597823&office_id=029&mode=search&query=삼성전자&page=10,디지털타임스,이재용 삼성전자 부회장과 정의선 현대차그룹 수석부회장이 미래 전기자동차용 배터리 협력을 위해 직접 만난다. 우리나라 재계를 대표하는 이 부회장과...,2020-05-13 11:05
소니TV의 몰락…북미 점유율 1% `충격`,/news/news_read.nhn?article_id=0004573886&office_id=009&mode=search&query=삼성전자&page=10,매일경제,2006년 삼성전자에 글로벌 TV시장 1위를 내준 소니는 이후 지속적으로 영향력이 축소되고 있다. 소니는 2017년 OLED TV를 출시하며 반전을 노렸지만 점유율 하락세...,2020-05-13 11:09
"까사미아, 삼성카드 손잡고 '지금껏 없던 서비스' 선뵌다",/news/news_read.nhn?article_id=0003736670&office_id=011&mode=search&query=삼성전자&page=10,서울경제,작년에는 삼성전자와 협업해 가전과 까사미아 가구를 한 곳에서 판매하는 복합매장을 확대하고 있다. 지난 달에는 삼성전자와 스타벅스 등과 협업한.....,2020-05-13 11:09
"[증시신상품] 교보악사운용, 삼성전자·'소부장' 기업 투자 펀드",/news/news_read.nhn?article_id=0011605297&office_id=001&mode=search&query=삼성전자&page=10,연합뉴스,교보악사자산운용은 삼성전자와 소재·부품·장비(소부장) 기업 등에 투자하는 '교보악사삼성전자투게더증권투자신탁(채권혼합)' 펀드를 출시했다고 13일...,2020-05-13 11:10
"이재용·정의선, SDI 천안사업장서 단독 회동…삼성-현대차 전기차 맞손 잡나",/news/news_read.nhn?article_id=0004573896&office_id=009&mode=search&query=삼성전자&page=9,매일경제,정의선 삼성 사업장 첫 방문 전고체 배터리 기술 등 둘러봐 이재용 삼성전자 부회장과 정의선 현대자동차그룹 수석부회장이 13일 오전 삼성SDI 천안사업장에서 단독...,2020-05-13 11:13
이재용-정의선 첫 공식 회동…재계 '빅2' 미래차 함께 이끈다,/news/news_read.nhn?article_id=0004677317&office_id=277&mode=search&query=삼성전자&page=9,아시아경제,이재용 삼성전자 부회장과 정의선 현대자동차그룹 총괄 수석부회장이 13일 전격적으로 회동해 '꿈의 배터리'로 불리는 차세대 전기차용 전고체 전지 ...,2020-05-13 11:14
"까사미아, 삼성카드와 마케팅 업무제휴 협약 체결",/news/news_read.nhn?article_id=0004423701&office_id=014&mode=search&query=삼성전자&page=9,파이낸셜뉴스,"지난해부터 삼성전자와 함께 가전과 가구를 한자리에서 만나볼 수 있는 복합 스토어를 확장하고 있는 가운데, 지난달에는 용인 기흥에 삼성전자·스타벅...",2020-05-13 11:16
<안전경영이 기업 경쟁력이다>36년 무재해 기록… 글로벌 최고 수준 ‘ESH 시스...,/news/news_read.nhn?article_id=0002427598&office_id=021&mode=search&query=삼성전자&page=9,문화일보,"심리검사까지 임직원의 정신건강도 꾸준히 관리하고 있다. 권도경 기자 kwon@munhwa.com ／ 제작후원／ 삼성전자, 현대자동차그룹, SK,...",2020-05-13 11:18
<안전경영이 기업 경쟁력이다>협력 업체들과 산재예방 손 맞잡아… 사업장 위험 원천...,/news/news_read.nhn?article_id=0002427597&office_id=021&mode=search&query=삼성전자&page=9,문화일보,"대구·경북 지역 직원들을 위해 마스크 등 물품을 보내기도 했다. 곽선미 기자 gsm@munhwa.com ／ 제작후원／ 삼성전자, 현대자동차그룹,...",2020-05-13 11:18
"이재용·정의선 만났다 ""삼성-현대차 경쟁에서 협력으로""",/news/news_read.nhn?article_id=0004677327&office_id=277&mode=search&query=삼성전자&page=9,아시아경제,이재용 삼성전자 부회장과 정의선 현대자동차그룹 총괄 수석부회장이 사업을 목적으로 처음 독대하면서 삼성그룹과 현대차그룹의 관계도 재설정될 것이라는...,2020-05-13 11:19
삼성전자 ‘작업환경보고서’ 공개대상 아니다…삼성 2심도 승소,/news/news_read.nhn?article_id=0002401279&office_id=119&mode=search&query=삼성전자&page=9,데일리안,삼성전자가 고용노동부를 상대로 낸 ‘작업환경 측정 결과 보고서’ 정보 부분 공개 결정 취소소송에서 1심에 이어 2심에서도 승소했다. 수원고법 행...,2020-05-13 11:21
이재용-정의선 첫 단독회동…'한국판 뉴딜' 밑그림,/news/news_read.nhn?article_id=0000013660&office_id=586&mode=search&query=삼성전자&page=9,시사저널,삼성전자는 최근 1회 충전 주행거리가 800㎞에 이르는 전고체전지 혁신기술을 발표했다. 차세대 배터리로 주목받는 전고체전지는 배터리 양극과 음극...,2020-05-13 11:24
"삼성전자, 시청각 장애인용 TV 1만5,000대 공급",/news/news_read.nhn?article_id=0003736690&office_id=011&mode=search&query=삼성전자&page=9,서울경제,"삼성전자가 시청각 장애인용 TV 1만5,000대를 올 연말까지 공급한다. 삼성전자는 방송통신위원회의 ‘2020년 시청각 장애인용 TV 보급 사업...",2020-05-13 11:24
삼성전자 누른 '중국 술'…'보복소비'에 시총 1위 등극,/news/news_read.nhn?article_id=0000870472&office_id=215&mode=search&query=삼성전자&page=9,한국경제TV,중국을 대표하는 술인 마오타이(茅台)를 만드는 주류 회사 구이저우마오타이(貴州茅台)의 주가가 고공행진을 거듭해 시가총액이 세계적 기술기업인 한국...,2020-05-13 11:30
"[특징주] 에코프로비엠, 삼성·현대차 전기차 사업 육성 소식에 주가 7%↑'들썩'",/news/news_read.nhn?article_id=0000541792&office_id=417&mode=search&query=삼성전자&page=9,머니S,에코프로비엠 주가가 하락 출발 후 이재용 삼성전자 부회장과 정의선 현대차그룹 수석 부회장이 전기차 사업 육성에 나선다는 소식이 알려지면서 상승세...,2020-05-13 11:32
이재용-정의선 첫 단독회동…‘모빌리티’ 맞잡다,/news/news_read.nhn?article_id=0001672935&office_id=016&mode=search&query=삼성전자&page=9,헤럴드경제,이재용 삼성전자 부회장과 정의선 현대차그룹 수석부회장이 미래 모빌리티 사업 논의를 위해 전격적으로 손을 잡았다. 이 부회장은 13일 오전 삼성S...,2020-05-13 11:32
이재용-정의선 첫 단독 회동…전기차 배터리 논의한다,/news/news_read.nhn?article_id=0003464665&office_id=022&mode=search&query=삼성전자&page=9,세계일보,이재용 삼성전자 부회장과 정의선 현대자동차그룹 수석부회장이 13일 천안 삼성SDI 공장에서 만나 차세대 전기자동차용 배터리 개발을 논의한다. 재...,2020-05-13 11:33
"법원 ""삼성 작업환경보고서 비공개 정당…영업기밀에 해당""",/news/news_read.nhn?article_id=0004573924&office_id=009&mode=search&query=삼성전자&page=9,매일경제,삼성전자 1심 이어 2심서도 승소 법원이 삼성전자가 '작업환경 측정 결과 보고서'를 공개하라고 결정한 고용노동부를 상대로 낸 소송에서 1심에 이어 2심서도 원고...,2020-05-13 11:35
코로나19가 당겨온 '주도주 세대교체'...카카오 '톱10' 등극,/news/news_read.nhn?article_id=0003736708&office_id=011&mode=search&query=삼성전자&page=9,서울경제,13일 카카오가 시가총액 10위(삼성전자 우선주 제외)권에 입성한데다 삼성바이오로직스가 역대 최고가를 경신하는 등 ‘인터넷·바이오’로 대표되는 ...,2020-05-13 11:37
송성근 아이엘사이언스 대표사람·기술·투자…집념의 6년 세계 유일 실리콘렌즈 개발 ...,/news/news_read.nhn?article_id=0001672953&office_id=016&mode=search&query=삼성전자&page=9,헤럴드경제,"공대 졸업생들이 고스란히 삼성전자, 하이닉스 등 굴지의 기업에 들어갔던 ‘취업 성수기’ 시절인 2008년, 동기 한 명을 꾀어 창업을 했다. “...",2020-05-13 11:38
"이재용 부회장 ""새 삼성 꿈꾼다"" 대국민 사과 이후 일주일 만에 현장경영",/news/news_read.nhn?article_id=0009859677&office_id=003&mode=search&query=삼성전자&page=9,뉴시스,"이재용 삼성전자 부회장과 정의선 현대차그룹 수석부회장이 13일 회동을 갖고 전기차 배터리 사업 파트너십을 공식화 한다. 재계 1, 2위 총수의 ...",2020-05-13 11:39
"삼성-현대차, 미래성장동력 ‘전기차 배터리’ 선점",/news/news_read.nhn?article_id=0001672968&office_id=016&mode=search&query=삼성전자&page=9,헤럴드경제,이재용 삼성전자 부회장과 정의선 현대차그룹 수석 부회장이 13일 삼성SDI 천안사업장에서 전격 회동한 것은 ‘한국판 뉴딜’의 대표사업으로 꼽히는...,2020-05-13 11:43
비수기 영향 삼성전자…디스플레이·스마트폰 먹구름,/news/news_read.nhn?article_id=0000647075&office_id=088&mode=search&query=삼성전자&page=9,매일신문,"LG전자의 깜짝 실적 발표와는 대조적으로 삼성전자는 위기를 맞고 있다는 분석이 잇따랐다. 삼성전자의 가전 부문은 매출은 10조3천억원, 영업이익...",2020-05-13 11:46
삼성·현대차 '배터리 동맹'? 두살터울 이재용·정의선 손잡았다,/news/news_read.nhn?article_id=0003000311&office_id=025&mode=search&query=삼성전자&page=9,중앙일보,이재용(52) 삼성전자 부회장과 정의선(50) 현대차 수석부회장이 13일 오전 10시 충남 천안에서 만났다. 이 부회장이 삼성SDI 배터리 공장...,2020-05-13 11:48
"대기업 오너 3명 중 1명, 계열사 3곳 이상 등기이사 겸직",/news/news_read.nhn?article_id=0003359349&office_id=079&mode=search&query=삼성전자&page=8,노컷뉴스,"1년 새 등기이사에서 물러난 오너 일가는 지난해 은퇴한 김재철 동원그룹 명예회장을 비롯해 이재용 삼성전자 부회장, 이해욱 대림산업 회장, 채승석...",2020-05-13 11:50
"이재용·정의선, 첫 단독 회동…미래차 배터리 논의",/news/news_read.nhn?article_id=0004677374&office_id=277&mode=search&query=삼성전자&page=8,아시아경제,이재용 삼성전자 부회장과 정의선 현대자동차그룹 총괄 수석부회장이 차세대 전기차 사업의 방향성을 논의하기 위해 13일 삼성SDI 천안 사업장에서 ...,2020-05-13 11:51
코로나에 비대면 영업시대… ‘온라인 마케팅’ 大戰,/news/news_read.nhn?article_id=0002427604&office_id=021&mode=search&query=삼성전자&page=8,문화일보,"삼성전자, 홈피에서 ‘닷컴핫딜’ LG전자, 유튜브로 신제품 출시 롯데쇼핑, 플랫폼 ‘롯데온’출범 신세계, SSG닷컴 키우기 주력 한샘은 모델하우...",2020-05-13 11:51
이재용-정의선 첫 '단독 회동'...전기차 배터리 협력 논의,/news/news_read.nhn?article_id=0001439472&office_id=052&mode=search&query=삼성전자&page=8,YTN,삼성전자 이재용 부회장과 현대차그룹 정의선 수석부회장이 전기차 배터리 사업 협력을 위해 직접 만났습니다. 이 부회장과 정 수석부회장은 오늘 삼성SDI...,2020-05-13 11:51
"손경식 회장 ""코로나 극복 위해 법인세 인하 절실""",/news/news_read.nhn?article_id=0004423728&office_id=014&mode=search&query=삼성전자&page=8,파이낸셜뉴스,"이날 회의에는 손 회장을 비롯해 이인용 삼성전자 사장, 윤여철 현대자동차 부회장, 권오갑 현대중공업지주 회장, 김창범 한화솔루션 부회장, 동현수...",2020-05-13 11:55
"이재용·정의선, 오늘 회동…‘전기차 배터리 사업’ 논의",/news/news_read.nhn?article_id=0000211354&office_id=374&mode=search&query=삼성전자&page=8,SBS CNBC,이재용 삼성전자 부회장과 정의선 현대차그룹 수석부회장이 단독 회동했습니다. 두 사람은 삼성SDI 사업장을 찾아 전기차 배터리 사업에 대한 의견을...,2020-05-13 11:58
"대기업 오너일가 32%, 계열사 3곳 이상 등기이사 겸직",/news/news_read.nhn?article_id=0003566918&office_id=076&mode=search&query=삼성전자&page=8,스포츠조선,"한편 1년 새 등기이사에서 물러난 오너 일가는 지난해 은퇴한 김재철 동원그룹 명예회장과 이재용 삼성전자 부회장, 이해욱 대림산업 회장, 채승석 전 애경개발...",2020-05-13 11:59
손톱 크기 유연한 기판에 마이크로 LED 수천개 배열 성공,/news/news_read.nhn?article_id=0011605559&office_id=001&mode=search&query=삼성전자&page=8,연합뉴스,"성대·삼성전자 연구팀 전도성 접착제 개발…상용기술의 20배 집적도 ""상온·저압 공정 가능…유연한 마이크로 LED 디스플레이 등에 활용"" 한국연구...",2020-05-13 12:00
삼성 이재용 - 현대 정의선 ‘전기車’ 손잡다,/news/news_read.nhn?article_id=0002427653&office_id=021&mode=search&query=삼성전자&page=8,문화일보,삼성배터리 - 현대차 협력 전 세계 완성차 시장이 미래차로 떠오른 전기차로 빠른 속도로 재편되고 있는 가운데 이재용 삼성전자 부회장과 정의선 현...,2020-05-13 12:11
"코로나 올라탄 코스닥, 코스피 거래액 추월",/news/news_read.nhn?article_id=0004677392&office_id=277&mode=search&query=삼성전자&page=8,아시아경제,연초 삼성전자를 비롯한 우량주를 집중적으로 사들였던 개인 투자자들이 신종 코로나바이러스감염증(코로나19) 확산 이후 주가가 급등락한 제약ㆍ바이오...,2020-05-13 12:16
"이재용·정의선, 단독 회동…전기차 배터리 첫 논의",/news/news_read.nhn?article_id=0000428316&office_id=422&mode=search&query=삼성전자&page=8,연합뉴스TV,재계에 따르면 정의선 현대차그룹 부회장은 오늘(13일) 삼성SDI 천안사업장을 찾아 이재용 부회장 등 삼성전자 경영진을 만나 차세대 전기차용 배...,2020-05-13 12:21
"삼성·현대차, 2년전부터 '전고체 배터리' 공동투자 협력",/news/news_read.nhn?article_id=0004635248&office_id=421&mode=search&query=삼성전자&page=8,뉴스1,국내 1~2위 대기업 총수인 이재용 삼성전자 부회장과 정의선 현대자동차 수석부회장이 13일 전격 회동한 것은 양사가 서로 관심을 보여온 '전고체...,2020-05-13 12:32
"삼성전자, 시청각 장애인용 TV 연내 1만 5천 대 공급",/news/news_read.nhn?article_id=0000814271&office_id=055&mode=search&query=삼성전자&page=8,SBS,삼성전자가 방송통신위원회의 '2020년 시청각 장애인용 TV 보급 사업' 공급자로 선정돼 올 연말까지 시청각 장애인용 TV 1만 5천 대를 공급...,2020-05-13 12:40
이재용·정의선 첫 단독 회동…재계 '빅2' 3세 간 협력 물꼬 트나,/news/news_read.nhn?article_id=0009859827&office_id=003&mode=search&query=삼성전자&page=8,뉴시스,"삼성전자 종합기술원은 지난 3월에 1회 충전에 800km 주행, 1000회 이상 배터리 재충전이 가능한 전고체배터리 연구결과를 공개하기도 했다....",2020-05-13 12:42
'클린수주'무색한 반포3주구…삼성물산 '꼼수' 홍보 논란,/news/news_read.nhn?article_id=0000025571&office_id=629&mode=search&query=삼성전자&page=8,더팩트,"지난 6일 삼성 준법감시위원회의 권고에 따라 이재용 삼성전자 부회장은 경영권 승계 의혹, 노조 문제, 시민사회 소통 사안 등에 관해 대국민 사과...",2020-05-13 13:28
"성대·삼성전자 연구팀, 손톱 크기 유연한 기판에 마이크로 LED 수천개 배열 성공",/news/news_read.nhn?article_id=0011605734&office_id=001&mode=search&query=삼성전자&page=8,연합뉴스,한국연구재단이 성균관대 김태일 교수와 삼성전자 연구팀이 전도성 접착제를 이용해 손톱 크기의 유연한 기판 위에 마이크로 발광다이오드(LED) 수천...,2020-05-13 13:30
"성대·삼성전자 연구팀, 손톱 크기 유연한 기판에 마이크로 LED 수천개 배열 성공",/news/news_read.nhn?article_id=0011605735&office_id=001&mode=search&query=삼성전자&page=8,연합뉴스,한국연구재단이 성균관대 김태일 교수와 삼성전자 연구팀이 전도성 접착제를 이용해 손톱 크기의 유연한 기판 위에 마이크로 발광다이오드(LED) 수천...,2020-05-13 13:30
"교보악사자산운용, ‘삼성전자투게더 펀드’ 출시",/news/news_read.nhn?article_id=0004423772&office_id=014&mode=search&query=삼성전자&page=8,파이낸셜뉴스,교보악사자산운용은 삼성전자의 장기 성장성에 투자하는 ‘교보악사삼성전자투게더증권투자신탁[채권혼합]’펀드(이하‘교보악사삼성전자투게더 펀드’)를......,2020-05-13 13:36
에코프로비엠 등 2차전지株 '급등'…이재용-정의선 만났다,/news/news_read.nhn?article_id=0004339687&office_id=015&mode=search&query=삼성전자&page=8,한국경제,이재용 삼성전자 부회장과 정의선 현대차 수석부회장이 만나 전고체 배터리 기술을 논의했다는 소식이 전해져서다. 전고체 배터리는 차세대 배터리로 전...,2020-05-13 13:40
"삼성전자, 시청각 장애인용 TV 보급 사업 공급자 선정",/news/news_read.nhn?article_id=0003566952&office_id=076&mode=search&query=삼성전자&page=8,스포츠조선,삼성전자가 방송통신위원회의 '2020년 시청각 장애인용 TV 보급 사업' 공급자로 선정됐다고 13일 밝혔다. 방송통신위원회는 저소득층 시청각 장...,2020-05-13 13:41
"대기업 오너 일가 32%, 3개 이상 계열사에서 등기이사 겸직",/news/news_read.nhn?article_id=0002597840&office_id=029&mode=search&query=삼성전자&page=7,디지털타임스,"1년 새 등기이사에서 물러난 오너 일가는 지난해 은퇴한 김재철 동원그룹 명예회장을 비롯해 이재용 삼성전자 부회장, 이해욱 대림산업 회장, 채승석...",2020-05-13 13:42
`혼쇼에 셀프탑승까지`…오프라인에 부는 언택트 소비문화,/news/news_read.nhn?article_id=0002597841&office_id=029&mode=search&query=삼성전자&page=7,디지털타임스,"이와 관련, 삼성전자는 최근 1분기 실적발표 컨퍼런스콜에서 ""현재 많은 국가에서 온라인 판매 비중이 증가하는 추세""라며 ""홈스쿨링, 홈오피스 등...",2020-05-13 13:42
"[특징주] 삼성SDI, 이재용·정의선 '전기차 육성' 소식에 8% 상승",/news/news_read.nhn?article_id=0000541853&office_id=417&mode=search&query=삼성전자&page=7,머니S,이재용 삼성전자 부회장이 13일 충남 천안에서 차세대 전기차 배터리 사업과 관련해 정의선 현대자동차 수석부회장과 전격 회동하면서 삼성SDI 주가...,2020-05-13 13:55
"교보악사자산운용, '삼성전자투게더 펀드' 출시",/news/news_read.nhn?article_id=0003736770&office_id=011&mode=search&query=삼성전자&page=7,서울경제,교보악사자산운용이 삼성전자(005930)와 소부장(소재·부품.장비) 기업 투자하는 ‘교보악사삼성전자투게더증권투자신탁[채권혼합]’펀드를 출시했다고...,2020-05-13 13:58
삼성 이재용·현대차 정의선 단독 회동…재계 '빅2' 3세 간 협력 물꼬 트나(종합...,/news/news_read.nhn?article_id=0009860023&office_id=003&mode=search&query=삼성전자&page=7,뉴시스,"삼성전자 종합기술원은 지난 3월에 1회 충전에 800km 주행, 1000회 이상 배터리 재충전이 가능한 전고체배터리 연구 결과를 공개하기도 했다...",2020-05-13 14:06
"[특징주] 동국알앤에스, 삼성·현대차 '전기차 배터리 동맹' 공식화...삼성SDI...",/news/news_read.nhn?article_id=0004423815&office_id=014&mode=search&query=삼성전자&page=7,파이낸셜뉴스,이재용 삼성전자 부회장과 정의선 현대차그룹 수석부회장이 회동을 갖고 전기차 배터리 사업 파트너십을 공식화하면서 관련주가 오름세다. 특히 이 부회장이 이날...,2020-05-13 14:09
"[TF시황] 코스피, 개인·기관 매수세에 1920선 회복",/news/news_read.nhn?article_id=0000025581&office_id=629&mode=search&query=삼성전자&page=7,더팩트,삼성전자는 현재 0.31% 상승 중으로 오후들어 상승전환했다. SK하이닉스는 2.68%가량 하락 중인 반면 삼성바이오로직스는 3.55% 상승하고...,2020-05-13 14:09
"코스피, 연기금 매수세에 장중 상승 전환",/news/news_read.nhn?article_id=0004639080&office_id=018&mode=search&query=삼성전자&page=7,이데일리,"삼성전자(005930)가 0.42% 오르고 삼성바이오로직스(207940)가 3%대 상승중이다. LG화학(051910)은 3%대, 삼성SDI(006400)는 9%대 오르고 ...",2020-05-13 14:12
[특징주] 이재용·정의선 '전기차 배터리 협력'에 관련주 급등,/news/news_read.nhn?article_id=0002401320&office_id=119&mode=search&query=삼성전자&page=7,데일리안,이재용 삼성전자 부회장과 정의선 현대차그룹 수석 부회장이 손잡고 전기차 사업 육성에 나선다는 소식에 전기차 관련주가 급등세다. 13일 오후 2시...,2020-05-13 14:17
[특징주] 코스모신소재 +29% 상승폭 확대… 삼성전기·삼성SDI 최대 매출처,/news/news_read.nhn?article_id=0000541862&office_id=417&mode=search&query=삼성전자&page=7,머니S,이날 코스모신소재 주가는 이재용 삼성전자 부회장과 정의선 현대차그룹 수석부회장이 손잡고 전기차 사업 육성에 나선다는 소식이 투자심리에 영향을 미...,2020-05-13 14:19
[특징주] 이재용·정의선 회동에 삼성SDI·일진머티리얼즈 상승,/news/news_read.nhn?article_id=0003736797&office_id=011&mode=search&query=삼성전자&page=7,서울경제,이재용 삼성전자 부회장과 정의선 현대차그룹 수석부회장의 회동 소식에 삼성SDI(006400)·일진머티리얼즈(020150) 등 전기차 배터리주가 13일 오후 상승세다. 이날...,2020-05-13 14:25
"삼성전자, 시청각 장애인용 TV 공급자 선정…연내 1만5천대 공급",/news/news_read.nhn?article_id=0000211366&office_id=374&mode=search&query=삼성전자&page=7,SBS CNBC,삼성전자는 방송통신위원회의 '2020년 시청각 장애인용 TV 보급 사업' 공급자로 선정돼 연말까지 시청각 장애인용 TV 1만5천대를 공급할 계획이라고 오늘(13일)...,2020-05-13 14:29
"재계 1·2위 이재용-정의선 전기차로 뭉쳤다…""차세대 배터리 의견교환""",/news/news_read.nhn?article_id=0004635520&office_id=421&mode=search&query=삼성전자&page=7,뉴스1,이재용 삼성전자 부회장과 정의선 현대자동차그룹 총괄수석부회장이 13일 전격적으로 회동하면서 그 배경에 관심이 모아진다. 정의선 수석부회장이 삼성...,2020-05-13 14:31
