title,url,press,summary,date
"BHC치킨, 지난해 연매출 '3000억 원' 돌파…6년 만에 5배 '껑충'",/news/news_read.nhn?article_id=0000022690&office_id=629&mode=search&query=삼성전자&page=2,더팩트,홀로서기를 시작한 2013년 당시 프랜차이즈 업계는 오너 경영이 대부분이었으나 BHC치킨은 삼성전자 출신의 전문 경영인 박현종 회장을 영입해 빠...,2020-04-13 17:54
"DB금융투자, 신규고객 CMA 최대 연 5% 이벤트",/news/news_read.nhn?article_id=0002222141&office_id=123&mode=search&query=삼성전자&page=2,조세일보,DB금융투자는 다음달 15일까지 신규 개인고객을 대상으로 최대 연 5% CMA(RP형) 수익률을 제공하고 추첨을 통해 삼성전자 보통주 30주 상...,2020-04-13 18:09
"이마트, 집객효자 'e-워드' 캐시백 3차 프로모션... 선착순 1400명 대상",/news/news_read.nhn?article_id=0000077850&office_id=310&mode=search&query=삼성전자&page=1,여성신문,"기존 'e-ward' 캐시백은 삼성전자 가전만을 대상으로 했지만 이번에는 애플, SK매직, 바디프랜드 등 다양한 브랜드로 폭을 넓힌 것이 특징이...",2020-04-13 18:13
"삼성전자, 美구호단체에 430만달러 기부..코로나19 이겨내자",/news/news_read.nhn?article_id=0004619301&office_id=018&mode=search&query=삼성전자&page=1,이데일리,삼성전자 서초 사옥 (사진=이데일리DB)[이데일리 김종호 기자] 삼성전자(005930)가 신종 코로나바이러스 감염증(코로나19) 확산으로 위기를...,2020-04-13 18:21
"삼성전자, 美서 코로나19 구호 430만 달러 기부…""함께 극복할 것""",/news/news_read.nhn?article_id=0002593489&office_id=029&mode=search&query=삼성전자&page=1,디지털타임스,삼성전자가 코로나19로 어려움을 겪고 있는 미국 지역 파트너들을 지원하기 위해 430만 달러(약 52억원)의 구호금을 기부했다. 삼성은 지금까지...,2020-04-13 18:28
초·중·고 온라인 개학에 노트북 ‘반짝 특수’,/news/news_read.nhn?article_id=0000995920&office_id=082&mode=search&query=삼성전자&page=1,부산일보,롯데백화점 부산본점 9층 삼성전자 매장은 온라인 개학에 맞춰 다양한 노트북을 선보인다. 롯데쇼핑 제공 코로나19로 초·중·고 온라인 개학이 진행...,2020-04-13 18:37
"bhc치킨, 작년매출 3000억 첫 돌파",/news/news_read.nhn?article_id=0004407820&office_id=014&mode=search&query=삼성전자&page=1,파이낸셜뉴스,bhc치킨은 삼성전자 출신의 전문 경영인을 영입해 경영과 조직문화에 혁신을 추구하고 있다. bhc 박현종 회장(사진)은 과감한 전산 시스템 투자...,2020-04-13 18:41
"""애플·아마존 美주식, ‘스마트 개미’ 위한 좋은 투자처""",/news/news_read.nhn?article_id=0004407830&office_id=014&mode=search&query=삼성전자&page=1,파이낸셜뉴스,"KB증권은 투자자들에게 삼성전자, 현대차 등 국내 우량주뿐만 아니라 해외주식에도 관심을 가져볼 것을 권유했다. 특히 스마트폰, 뷰티, 헬스케어 등과 관련한 해외...",2020-04-13 18:49
가라앉는 삼성重… 어두운 해양플랜트 전망,/news/news_read.nhn?article_id=0002593522&office_id=029&mode=search&query=삼성전자&page=1,디지털타임스,"반면 다른 주요 계열사의 경우 삼성바이오로직스는 3월 이후 운용 주식수를 40.7% 늘렸고 삼성전자(-1.1%), 삼성물산(0.2%), 삼성SD...",2020-04-13 18:53
화훼농가 돕기 나선 권영수 LG 부회장,/news/news_read.nhn?article_id=0002593537&office_id=029&mode=search&query=삼성전자&page=1,디지털타임스,"지금까지 박 사장, 고동진 삼성전자 사장, 이석희 SK하이닉스 사장, 황각규 롯데 부회장, 전영현 삼성SDI 사장 등 주요 그룹 최고경영자(CE...",2020-04-13 18:53
"외국인, 3월 주식 13.4조 사상 최대 순매도",/news/news_read.nhn?article_id=0003082175&office_id=081&mode=search&query=삼성전자&page=1,서울신문,다만 외국인 투자자들은 지난 7~10일 4거래일 연속 1789억원 규모의 삼성전자 주식을 사들인 것으로 나타났다. 코로나19에도 삼성전자가 비교...,2020-04-13 19:11
"‘시스템 경영’ 도입한 bhc치킨, 작년 매출 3000억원 돌파",/news/news_read.nhn?article_id=0000509296&office_id=366&mode=search&query=삼성전자&page=1,조선비즈,bhc치킨은 2013년 삼성전자 출신인 박현종 bhc 회장을 CEO로 영입했고 그를 중심으로 기존 비합리적인 관행을 없애고 회사 운영 방식과 성...,2020-04-13 19:35
"""코로나 함께 극복""… 삼성전자, 美 파트너 구호금 52억원 기부",/news/news_read.nhn?article_id=0002593578&office_id=029&mode=search&query=삼성전자&page=1,디지털타임스,삼성전자가 코로나19로 어려움을 겪고 있는 미국 지역 파트너들을 지원하기 위해 430만 달러(약 52억원)의 구호금을 기부했다. 삼성은 지금까지...,2020-04-13 19:38
"삼성, 코로나19로 침체된 내수 살리기 앞장",/news/news_read.nhn?article_id=0004407847&office_id=014&mode=search&query=삼성전자&page=1,파이낸셜뉴스,삼성전자가 코로나19로 침체를 겪고 있는 내수 경기 활성화 움직임에 본격적으로 나섰다. 코로나19 극복을 위한 사회적 노력에 참여하는 것은 물론 침체된 지역사회...,2020-04-13 19:56
"""TV, 화질이 전부 아니다… 6개의 스피커가 새로운경험 선사""",/news/news_read.nhn?article_id=0004407844&office_id=014&mode=search&query=삼성전자&page=1,파이낸셜뉴스,"이젠 경험의 시대다"" 김현석 삼성전자 대표이사는 지난달 열린 삼성전자 주주총회에서 이렇게 강조했다. 삼성이 혁신 기술을 만들테니, 소비자는 새로...",2020-04-13 19:56
"안신영 HB인베스트먼트 대표 ""이젠 여성 심사역이 VC 업계 주도"" [벤투인 스토...",/news/news_read.nhn?article_id=0004407854&office_id=014&mode=search&query=삼성전자&page=1,파이낸셜뉴스,기술창업이 주를 이뤘던 1세대 벤처는 삼성전자와 관련한 반도체 기업이 많았다. 이 때문에 여성이 VC업계에 진출하는 것 자체가 어려웠다. 그럼에...,2020-04-13 19:59
급물살 탄 언택트 이코노미… 핵심은 전자증명·디지털화폐,/news/news_read.nhn?article_id=0004407861&office_id=014&mode=search&query=삼성전자&page=1,파이낸셜뉴스,"글로벌 스마트폰 제조사 삼성전자와 SK텔레콤 등 이동통신3사 및 대학·금융권이 참여 중인 '이니셜 DID 연합'은 DID와 모바일 금융을 결합,...",2020-04-13 20:01
코로나19 사태 후 주가 2배 이상 뛴 기업 28곳,/news/news_read.nhn?article_id=0002493441&office_id=028&mode=search&query=삼성전자&page=1,한겨레,"반면 국내 최대 주식부자인 이건희 삼성전자 회장의 주식재산은 1월20일 19조2607억원에서 4월9일 14조5843억원으로, 4조6764억원 줄...",2020-04-13 20:04
견조한 반도체 수요에 살아나는 검사장비株,/news/news_read.nhn?article_id=0004619341&office_id=018&mode=search&query=삼성전자&page=1,이데일리,매출이 1분기부터 발생하기 시작했다”며 “주력 고객사 삼성전자(005930)의 출시 일정 등을 감안하면 하반기부터 증가폭은 더욱 커질 것”이라고...,2020-04-13 20:10
생산기지 셧다운·얼어붙은 교역… 휘청거리는 수출 한국호,/news/news_read.nhn?article_id=0003456130&office_id=022&mode=search&query=삼성전자&page=1,세계일보,"더구나 삼성전자와 LG전자는 코로나19 확산으로 미주, 남미, 유럽 등 글로벌 생산기지 곳곳에서 생산에 차질을 빚고 있다. 삼성전자 브라질 캄피...",2020-04-13 20:24
"[코로나19] LG전자, 브라질 TV 공장 셧다운…미국 공장 재가동 연기",/news/news_read.nhn?article_id=0002395813&office_id=119&mode=search&query=삼성전자&page=1,데일리안,"이 밖에 LG전자 미국 디트로이트 자동차부품 공장은 이날까지 가동을 중단하고, 삼성전자의 사우스캐롤라이나 세탁기 공장은 19일까지 멈춘다. 한편...",2020-04-13 20:46
"3월에도 외국인들, 국내 주식 팔고 채권 사들였다",/news/news_read.nhn?article_id=0003003495&office_id=032&mode=search&query=삼성전자&page=1,경향신문,이처럼 국내 주식을 팔아치우는 외국인들은 최근 삼성전자 주식만큼은 사들이고 있는 것으로 나타났다. 한국거래소에 따르면 외국인 투자자들은 지난 7...,2020-04-13 21:25
