title,url,press,summary,date
"5대그룹 임원 재난지원금 기부…삼성·현대차 사장 ""임직원이 자발적으로""(종합)",/news/news_read.nhn?article_id=0009858914&office_id=003&mode=search&query=삼성전자&page=16,뉴시스,"주요 그룹 임원들이 긴급재난지원금을 기부할 것으로 알려진 가운데, 이인용 삼성전자 사장과 공영운 현대차 사장은 기부는 임직원들의 자발적 선택 사...",2020-05-13 00:00
OLED 장착 5G 아이폰이 80만원?,/news/news_read.nhn?article_id=0003000173&office_id=025&mode=search&query=삼성전자&page=16,중앙일보,애플의 잇따른 가격 공세로 삼성전자는 그동안 우세를 보였던 중간 가격대(500~1000달러) 스마트폰 시장에서 우위를 지키지 못하는 상황이 됐다...,2020-05-13 00:06
[경제 브리핑] 삼성 영덕연수원서 생활 치료 225명 코로나 완치,/news/news_read.nhn?article_id=0003000176&office_id=025&mode=search&query=삼성전자&page=16,중앙일보,"삼성전자는 12일 ‘이제 집으로 갑니다, 영덕 생활치료센터 두 달간의 기록’이란 7분 30초 분량의 영상(사진)을 공개했다. 경북 영덕의 삼성연...",2020-05-13 00:07
자발적으로 하고 싶은데ㅠㅠ 재계 재난지원금 억지기부 부글,/news/news_read.nhn?article_id=0001320559&office_id=005&mode=search&query=삼성전자&page=16,국민일보,삼성 관계자는 “방침을 공식 공유한 건 아니지만 삼성전자를 포함해 전 계열사 임원들은 지원금 지급 취지를 고려해 기부하기로 했다”고 밝혔다. 삼...,2020-05-13 00:20
"삼성 공채시험 온라인으로 본다, 커닝은 어떻게 막을까",/news/news_read.nhn?article_id=0003000185&office_id=025&mode=search&query=삼성전자&page=16,중앙일보,삼성전자는 12일 “정부와 사회 각계의 코로나19 확산 방지 노력에 동참하면서도 회사가 필요한 인재 채용 절차를 진행하기 위해 처음으로 GSAT...,2020-05-13 00:26
이재용 현장경영 재개…삼성SDI 찾아 '미래 먹거리' 점검,/news/news_read.nhn?article_id=0004339356&office_id=015&mode=search&query=삼성전자&page=16,한국경제,이재용 삼성전자 부회장(사진)이 삼성SDI 천안 사업장 방문을 시작으로 현장경영을 재개한다. 이 부회장은 반도체 이후 삼성을 떠받칠 주력 사업으...,2020-05-13 01:14
코로나 재확산 조짐에…'3분기 실적 반등' 전망 흔들,/news/news_read.nhn?article_id=0004638562&office_id=018&mode=search&query=삼성전자&page=16,이데일리,"대장주인 삼성전자(005930)도 3분기 영업이익 전망이 3개월간 19.8% 줄어들며, 지속적으로 감소했다. 3개월 전 영업이익 추정치는 12조...",2020-05-13 01:31
민간 주도 샌드박스 국내 첫 출범,/news/news_read.nhn?article_id=0003464533&office_id=022&mode=search&query=삼성전자&page=16,세계일보,"왼쪽부터 손병두 금융위원회 부위원장, 정승일 산업통상자원부 차관, 장석영 과학기술정보통신부 2차관, 정 총리, 박용만 대한상의 회장, 이인용 삼...",2020-05-13 02:03
규제에 발목 잡힌 기업의 손발이 되어드립니다,/news/news_read.nhn?article_id=0003285759&office_id=020&mode=search&query=삼성전자&page=16,동아일보,"한편 이날 행사에는 정세균 국무총리, 박용만 대한상의 회장을 비롯해 관계 부처 차관 및 이인용 삼성전자 사장, 공영운 현대자동차 사장 등 기업인...",2020-05-13 03:03
꽃 질감까지 세밀하게… 접사 카메라 인상적,/news/news_read.nhn?article_id=0003285777&office_id=020&mode=search&query=삼성전자&page=16,동아일보,‘가성비 왕’ 갤럭시 A51 5G 써보니 전문가급 다양한 촬영기능 매력… 무선충전-방수방진 안돼 아쉬워 7일 삼성전자가 국내 출시한 ‘갤럭시 A...,2020-05-13 03:04
[신문과 놀자!/주니어를 위한 사설 따라잡기]삼성의 약속과 사과,/news/news_read.nhn?article_id=0003285788&office_id=020&mode=search&query=삼성전자&page=16,동아일보,삼성전자 이재용 부회장이 6일 오후 대국민 사과문을 내고 “제 아이들에게 회사 경영권을 물려주지 않겠다”고 선언했다. 이날 사과문 발표는 시민단...,2020-05-13 03:04
"이건희의 약속 10년 후… 바이오·車전지 A학점, 의료기기·LED는 C학점",/news/news_read.nhn?article_id=0003530708&office_id=023&mode=search&query=삼성전자&page=16,조선일보,""" 지금으로부터 10년 전, 이건희 삼성전자 회장은 서울 이태원동 승지원에서 사장단 회의를 주재하며 이렇게 말했다. 삼성그룹 최고경영진은 이 회...",2020-05-13 03:45
"""불합리한 규제 없애자""… 민간이 주도하는 샌드박스 첫 출범",/news/news_read.nhn?article_id=0003530709&office_id=023&mode=search&query=삼성전자&page=16,조선일보,"이날 출범식에는 정세균 국무총리, 박용만 대한상의 회장, 이인용 삼성전자 사장, 공영운 현대자동차 사장 등이 참석했다. 박용만 회장은 ""어려운 환경에도 일을...",2020-05-13 03:46
내가 입소한 뒤 두 아들 울었다는 얘기에 뭉클,/news/news_read.nhn?article_id=0001320576&office_id=005&mode=search&query=삼성전자&page=16,국민일보,삼성전자는 12일 공식 뉴스룸에 ‘이제 집으로 갑니다: 영덕 생활치료센터 두 달간의 기록’이란 제목의 영상을 게재했다. 코로나19 확진자들의 생...,2020-05-13 04:03
공포지수가 증명한 '동학개미' 맷집···예상 못한 헤지펀드 폭망,/news/news_read.nhn?article_id=0003000216&office_id=025&mode=search&query=삼성전자&page=16,중앙일보,지금은 삼성전자 등 특정 종목에 직접 투자를 하는 방식으로 바뀐 것”이라고 설명했다. “미국이 재채기를 하면 아시아는 독감에 걸린다”는 믿음은 ...,2020-05-13 05:02
"文 '집나간 기업 오게 하라는데'…기업들, 왜 안올까?",/news/news_read.nhn?article_id=0003359178&office_id=079&mode=search&query=삼성전자&page=16,노컷뉴스,갤럭시 S20과 Z플립 등 신제품을 막 출시한 삼성전자의 발등에 불똥이 떨어졌다. 베트남 당국이 한국인 입국을 갑작스럽게 금지하면서 삼성전자 기...,2020-05-13 05:22
"대기업 오너 3명 중 1명, 계열사 3곳 이상 등기이사 겸직",/news/news_read.nhn?article_id=0011604549&office_id=001&mode=search&query=삼성전자&page=16,연합뉴스,"1년 새 등기이사에서 물러난 오너 일가는 지난해 은퇴한 김재철 동원그룹 명예회장을 비롯해 이재용 삼성전자 부회장, 이해욱 대림산업 회장, 채승석...",2020-05-13 05:31
K바이오 업고 짱짱한 상승세…개미군단 파워 700선 넘길까,/news/news_read.nhn?article_id=0004407771&office_id=008&mode=search&query=삼성전자&page=16,머니투데이,코스닥 전체 1412종목의 시총은 약 252조원으로 삼성전자의 보통주 시총(285조원)보다도 작다. 그만큼 저가의 기업이 많다는 의미다. 김학균...,2020-05-13 06:00
코로나19로 OTT 이용자 급증...대화면 폴더블폰 전환 가속,/news/news_read.nhn?article_id=0009858957&office_id=003&mode=search&query=삼성전자&page=16,뉴시스,폴더블 스마트폰은 대면적 화면에 초점을 맞추었다는 점에서 삼성전자의 갤럭시노트와 화웨이의 메이트 시리즈의 계보를 이어 갈 것으로 예상된다. 갤럭...,2020-05-13 06:00
"""스마트폰에 소독제 직접 뿌리면 디스플레이 손상될수도""",/news/news_read.nhn?article_id=0009858996&office_id=003&mode=search&query=삼성전자&page=16,뉴시스,"삼성전자에 따르면, 스마트폰 세척을 위해서는 가장 먼저 전원을 끄고, 케이스와 케이블 기타 액세서리 제품을 제거한 상태로 준비해야 한다. 이후 ...",2020-05-13 06:00
[삼성 준법위 100일] 계열사 감시활동 본격 돌입…이재용 사과도 이끌어,/news/news_read.nhn?article_id=0000537985&office_id=031&mode=search&query=삼성전자&page=15,아이뉴스24,지난 2월 5일 출범한 준법위는 삼성전자 등 삼성그룹 7개 계열사들에 대한 준법감시활동을 하는 조직으로 김지형 위원장(법무법인 지평 대표변호사)...,2020-05-13 06:01
씨젠과 6년전 아모레퍼시픽 주가 그래프 비교해보니,/news/news_read.nhn?article_id=0004407776&office_id=008&mode=search&query=삼성전자&page=15,머니투데이,삼성전자에 올인했던 동학개미 입장에선 속이 쓰리는 이야기다. 이번 코스닥 반등이 예상보다 클 수 있었던 것은 코로나19(COVID-19) 진단업...,2020-05-13 06:10
'형보다 나은 아우'…중소형주 '종목장세' 뚜렷,/news/news_read.nhn?article_id=0011604586&office_id=001&mode=search&query=삼성전자&page=15,연합뉴스,"연초 국내 증시의 상승세는 삼성전자, SK하이닉스 등 대형 IT주가 주도했으나, 코로나19 사태 이후 주도주가 바뀐 셈이다. 13일 한국거래소에...",2020-05-13 06:17
[삼성 준법위 100일] 일각선 설립 취지 뒷전…권한남용 우려도,/news/news_read.nhn?article_id=0000537986&office_id=031&mode=search&query=삼성전자&page=15,아이뉴스24,"이재용 삼성전자 부회장의 파기환송심 재판부가 내준 숙제를 실행에 옮긴 조치였다. 지난해 10월 환송심 재판부는 이 부회장에게 과감한 혁신, 재벌...",2020-05-13 06:31
"반도체 1위 사업자들, 코로나에도 설비투자 늘린다",/news/news_read.nhn?article_id=0003736448&office_id=011&mode=search&query=삼성전자&page=15,서울경제,올해 코로나19 확산에 따른 공급망 마비로 EUV 장비 도입 일정에 차질이 발생할 수 있다는 우려에도 불구하고 공격적인 장비 확보로 파운드리 2...,2020-05-13 07:01
"[삼성 준법위 100일] 두 번의 사과 ""의미 있다""…준법경영 본궤도",/news/news_read.nhn?article_id=0000537987&office_id=031&mode=search&query=삼성전자&page=15,아이뉴스24,특히 최근 이재용 삼성전자 부회장이 '대국민 사과'를 하면서 준법위의 활동에 탄력이 붙을 전망이다. 13일 재계에 따르면 삼성 준법위는 오는 1...,2020-05-13 07:01
‘집념의 CEO’ 송성근 아이엘사이언스 대표 6년 연구끝 세계 유일 실리콘렌즈 ...,/news/news_read.nhn?article_id=0001672617&office_id=016&mode=search&query=삼성전자&page=15,헤럴드경제,"공대 졸업생들이 고스란히 삼성전자, 하이닉스 등 굴지의 기업에 들어갔던 ‘취업 성수기’ 시절인 2008년, 동기 한 명을 꾀어 창업을 했다. “...",2020-05-13 07:03
‘부정승계 의혹’ 수사 종착점…이재용 부회장 소환 임박,/news/news_read.nhn?article_id=0000211306&office_id=374&mode=search&query=삼성전자&page=15,SBS CNBC,"검찰은 이르면 이번 주, 의혹의 핵심 당사자인 이재용 삼성전자 부회장을 소환 조사할 계획입니다. 산업계 소식 알아봅니다. 김동우 기자, 검찰이 ...",2020-05-13 07:12
"대기업 오너 중 30%, 계열사 3곳 이상 '등기이사' 겸직",/news/news_read.nhn?article_id=0004339368&office_id=015&mode=search&query=삼성전자&page=15,한국경제,"이재용 삼성전자 부회장, 김재철 동원그룹 명예회장, 이해욱 대림산업 회장 등이 1년 사이에 등기이사에서 물러났다. 윤진우 한경닷컴 기자 jiin...",2020-05-13 07:12
[빅데이터MSI]13일 오전 주식시장 심리 7단계 '매우 좋음',/news/news_read.nhn?article_id=0009859024&office_id=003&mode=search&query=삼성전자&page=15,뉴시스,"대장주 삼성전자의 MSI 레벨은 3단계로 집계됐다. 시가총액 상위 종목 중 SK하이닉스는 3단계, LG화학은 2단계, 현대차는 4단계, 셀트리온...",2020-05-13 07:52
'프리미엄'은 옛말…코로나 불황 맞은 스마트폰,/news/news_read.nhn?article_id=0000814189&office_id=055&mode=search&query=삼성전자&page=15,SBS,"미친 삼성전자 역시 새 5G 스마트폰 출고가를 50만 원대로 낮췄고, 프리미엄 전략을 고수해온 애플도 50만 원대 가격을 내세워 타사 고객을 뺏...",2020-05-13 07:54
"손경식 경총 회장 ""2분기 실물경제 지표 악화 본격화""",/news/news_read.nhn?article_id=0004407818&office_id=008&mode=search&query=삼성전자&page=15,머니투데이,"부회장, 이인용 삼성전자 사장, 이장한 종근당 회장, 조규옥 전방 회장, 최병오 패션그룹형지 회장, 황각규 롯데지주 부회장, 김용근 경총 상근부...",2020-05-13 08:00
"손경식 ""위기기업 유동성 지원, 필요한 만큼 충분히 이뤄져야""",/news/news_read.nhn?article_id=0011604644&office_id=001&mode=search&query=삼성전자&page=15,연합뉴스,"손 회장을 비롯해 이인용 삼성전자 사장, 윤여철 현대자동차 부회장, 권오갑 현대중공업지주 회장, 김창범 한화솔루션 부회장, 동현수 두산 부회장,...",2020-05-13 08:00
100만원 더 싼 ‘반값’ 갤폴드2 온다...폴더블 시장 뒤흔들까,/news/news_read.nhn?article_id=0003736460&office_id=011&mode=search&query=삼성전자&page=15,서울경제,삼성전자가 올해 하반기 100만원대 ‘반값’ 갤럭시 폴드를 출시할 것이라는 전망이 나왔다. IT개발자 전문 커뮤니티 XDA 디벨로퍼의 맥스 웨인...,2020-05-13 08:01
"디오스텍, 디오스홀딩스로 최대주주 변경…""책임경영 강화""",/news/news_read.nhn?article_id=0004573658&office_id=009&mode=search&query=삼성전자&page=15,매일경제,"한편, 디오스텍은 주력 고객사인 삼성전자의 갤럭시A 시리즈를 비롯한 보급형 스마트폰용 렌즈를 생산하는 기업이다. 스마트폰 멀티카메라 시장 성장과...",2020-05-13 08:19
"삼성전자·SK하이닉스, '반도체 자급자족' 확산 영향은?",/news/news_read.nhn?article_id=0002401202&office_id=119&mode=search&query=삼성전자&page=15,데일리안,13일 업계에 따르면 삼성전자와 SK하이닉스 등 국내 반도체 업체들은 최근 미국과 일본의 반도체 자급주의 선언으로 미칠 영향에 촉각을 곤두세우고...,2020-05-13 08:20
"손경식 ""코로나19 극복 위해 법인세 인하 고려해야""",/news/news_read.nhn?article_id=0004638676&office_id=018&mode=search&query=삼성전자&page=15,이데일리,"이날 회의에는 손 회장을 비롯해 권오갑 현대중공업지주(267250) 회장, 김창범 한화솔루션(009830) 부회장, 윤여철 현대자동차(00538...",2020-05-13 08:25
하반기 이익 전망치 비현실적..추가 하향 조정돼야,/news/news_read.nhn?article_id=0004638678&office_id=018&mode=search&query=삼성전자&page=15,이데일리,"유안타증권 유니버스 200개 종목 중 삼성전자(005930), SK하이닉스(000660)는 1분기 영업이익이 전망치를 상회했으나 그외 112개 ...",2020-05-13 08:26
"대기업 오너 3명 중 1명, 계열사 3곳 이상 등기이사 겸직",/news/news_read.nhn?article_id=0009859046&office_id=003&mode=search&query=삼성전자&page=15,뉴시스,"1년 새 등기이사에서 물러난 오너일가는 지난해 은퇴한 김재철 동원그룹 명예회장을 비롯해 이재용 삼성전자 부회장, 이해욱 대림산업 회장, 채승석 ...",2020-05-13 08:27
한국에서 세계 첫 '민간 샌드박스' 대한상의 지원센터 출범,/news/news_read.nhn?article_id=0001453933&office_id=057&mode=search&query=삼성전자&page=15,MBN,"이날 이인용 삼성전자 사장, 공영운 현대자동차 사장, 김기웅 위쿡 대표, 변창환 콰라소프트 대표, 이석우 두나무 대표 등 기업인들도 참석했습니다. 기업인들은 정세균...",2020-05-13 08:30
"디오스텍, 디오스홀딩스로 최대주주 변경 예정 ""책임경영 강화""",/news/news_read.nhn?article_id=0004407838&office_id=008&mode=search&query=삼성전자&page=14,머니투데이,디오스텍은 주력 고객사인 삼성전자의 갤럭시A 시리즈를 비롯한 보급형 스마트폰용 렌즈를 생산하는 기업이다. 스마트폰 멀티카메라 시장 성장과 고화소 흐름에...,2020-05-13 08:32
1분기 모바일 OLED패널 중 FHD급 해상도 제품이 73.1%,/news/news_read.nhn?article_id=0009859059&office_id=003&mode=search&query=삼성전자&page=14,뉴시스,"주요 제품은 삼성전자 갤럭시 S20 플러스, S20 울트라, 오포 Find X2 등이 있다. 2분기에는 FHD+급 해상도의 Flexible OL...",2020-05-13 08:32
"손경식 회장 ""위기기업 유동성 지원, 충분히 이뤄져야""…법인세 인하도 요구",/news/news_read.nhn?article_id=0009859061&office_id=003&mode=search&query=삼성전자&page=14,뉴시스,"손 회장을 비롯해 이인용 삼성전자 사장, 윤여철 현대자동차 부회장, 황각규 롯데지주 부회장, 권오갑 현대중공업지주 회장, 김창범 한화솔루션 부회...",2020-05-13 08:33
"손경식 회장 ""재난지원금 기부하겠다""",/news/news_read.nhn?article_id=0004423475&office_id=014&mode=search&query=삼성전자&page=14,파이낸셜뉴스,"이날 회의에 참석한 이인용 삼성전자 사장은 ""회사 차원에서 코로나19 위기 극복을 위한 방안을 제시하기보다는 들으러 온 자리""라고 말했다. 5대...",2020-05-13 08:35
"삼성전자, 시청각 장애인용 TV 보급 사업 공급자로 선정",/news/news_read.nhn?article_id=0011604704&office_id=001&mode=search&query=삼성전자&page=14,연합뉴스,삼성전자가 방송통신위원회의 '2020년 시청각 장애인용 TV 보급 사업' 공급자로 선정됐다고 13일 밝혔다. 시청자미디어재단이 소득 수준과 장애...,2020-05-13 08:38
"손경식 ""내년에도 코로나 이전 수준 회복 어려워…2분기 적자 전환 본격화 될 것""",/news/news_read.nhn?article_id=0003530754&office_id=023&mode=search&query=삼성전자&page=14,조선일보,"이날 회의에는 손 회장을 비롯해 이인용 삼성전자 사장, 윤여철 현대자동차 부회장, 권오갑 현대중공업지주 회장, 김창범 한화솔루션 부회장, 동현수...",2020-05-13 08:42
"손경식 경총 회장 ""포스트코로나 대비…투자매력 국가로 거듭나야""",/news/news_read.nhn?article_id=0000538004&office_id=031&mode=search&query=삼성전자&page=14,아이뉴스24,"부회장, 이인용 삼성전자 사장, 이장한 종근당 회장, 조규옥 전방 회장, 최병오 패션그룹형지 회장, 황각규 롯데지주 부회장, 김용근 경총 상근부...",2020-05-13 08:45
"삼성전자, ‘시청각 장애인용 TV 보급 사업 공급자’ 선정",/news/news_read.nhn?article_id=0004638707&office_id=018&mode=search&query=삼성전자&page=14,이데일리,삼성전자의 시청각 장애인용 TV인 ‘40인치 Full HD 스마트 TV’. (이미지=삼성전자)[이데일리 김종호 기자] 삼성전자(005930)는 ...,2020-05-13 08:49
"삼성전자, 시청각 장애인용 TV 보급 사업 공급자로 선정",/news/news_read.nhn?article_id=0009859084&office_id=003&mode=search&query=삼성전자&page=14,뉴시스,삼성전자는 방송통신위원회의 '2020년 시청각 장애인용 TV 보급 사업' 공급자로 선정됐다고 12일 밝혔다. 방송통신위원회는 저소득층 시청각 장...,2020-05-13 08:52
"이재용·정의선 '절친'의 공식 회동, 오늘 이뤄질까",/news/news_read.nhn?article_id=0004407848&office_id=008&mode=search&query=삼성전자&page=14,머니투데이,이재용 삼성전자 부회장이 대국민사과 이후 첫 현장행보로 미래 성장동력인 전기차용 배터리 사업장을 선택한 것으로 전해졌다. 정의선 현대차그룹 수석...,2020-05-13 08:53
"손경식 코로나 이전 회복 힘들어, 위기기업 유동성 지원 충분히 이뤄져야",/news/news_read.nhn?article_id=0003736488&office_id=011&mode=search&query=삼성전자&page=14,서울경제,"손 회장을 비롯해 이인용 삼성전자 사장, 윤여철 현대자동차 부회장, 권오갑 현대중공업지주 회장, 김창범 한화솔루션 부회장, 동현수 두산 부회장,...",2020-05-13 08:55
"삼성전자, 시청각 장애인에 TV 1만5000대 무료 공급",/news/news_read.nhn?article_id=0004634506&office_id=421&mode=search&query=삼성전자&page=14,뉴스1,삼성전자가 올해 정부에서 추진하는 시청각 장애인용 TV 보급 사업의 공급업체로 선정됐다. 삼성전자는 방송통신위원회의 '2020년 시청각 장애인 ...,2020-05-13 08:59
"삼성전자, 시청각 장애인용 TV 1만5000대 공급",/news/news_read.nhn?article_id=0004677097&office_id=277&mode=search&query=삼성전자&page=14,아시아경제,삼성전자는 방송통신위원회의 '2020년 시청각 장애인용 TV 보급 사업' 공급자로 선정됐다고 13일 밝혔다. 방송통신위원회는 저소득층 시청각 장...,2020-05-13 08:59
[단독]이태원 코로나에 삼성 계열사 첫 분산근무 돌입,/news/news_read.nhn?article_id=0004423500&office_id=014&mode=search&query=삼성전자&page=14,파이낸셜뉴스,앞서 삼성전자는 이태원 지역 방문 직원들은 신고해달라고 권유했다. 유흥시설뿐만 아니라 일반 기타 시설 방문도 신고 대상이다. LG전자와 SK도 ...,2020-05-13 09:01
"삼성전자, 시청각 장애인용 TV 보급 사업 공급자로 선정",/news/news_read.nhn?article_id=0001002118&office_id=082&mode=search&query=삼성전자&page=14,부산일보,삼성전자의 시청각 장애인용 스마트 TV.삼성전자 제공 삼성전자는 방송통신위원회의 ‘2020년 시청각 장애인용 TV 보급 사업’ 공급자로 선정됐다...,2020-05-13 09:03
"대기업 오너 3명 중 1명, 계열사 3곳 이상 등기이사 겸직",/news/news_read.nhn?article_id=0004634540&office_id=421&mode=search&query=삼성전자&page=14,뉴스1,"1년 새 등기이사에서 물러난 오너일가는 지난해 은퇴한 김재철 동원그룹 명예회장을 비롯해 이재용 삼성전자 부회장, 이해욱 대림산업 회장, 채승석 ...",2020-05-13 09:04
[개장 시황] 코스피 1897.50.. 외국인과 기관의 '팔자' 기조에 하락 출발...,/news/news_read.nhn?article_id=0003736502&office_id=011&mode=search&query=삼성전자&page=14,서울경제,"종목별로는 삼성전자가 1.36% 내린 4만 7250원에 거래되는 가운데, 한진칼(180640)(-7.10%), JW생명과학(234080)(-4....",2020-05-13 09:06
"삼성, 시청각장애인용 TV 보급사업 공급자 선정",/news/news_read.nhn?article_id=0004339431&office_id=015&mode=search&query=삼성전자&page=14,한국경제,삼성전자는 저소득층 시청각 장애인의 방송 접근성 향상을 위해 방송통신위원회가 시청각 장애인용 TV를 무료 보급하는 '2020년 시청각 장애인용 ...,2020-05-13 09:09
경총 회장단 회의,/news/news_read.nhn?article_id=0009859130&office_id=003&mode=search&query=삼성전자&page=14,뉴시스,"윗줄 왼쪽부터 김용근 경총 상근부회장, 이인용 삼성전자 사장 , 박진선 샘표식품 사장, 권오갑 현대중공업지주 회장, 황각규 롯데지주 부회장, 김...",2020-05-13 09:11
"삼성, '시청각 장애인용 TV 보급 사업' 공급자로 선정",/news/news_read.nhn?article_id=0000870381&office_id=215&mode=search&query=삼성전자&page=14,한국경제TV,삼성전자가 방송통신위원회의 '2020년 시청각 장애인용 TV 보급 사업' 공급자로 선정됐다고 13일 밝혔다. 방송통신위원회는 저소득층 시청각 장...,2020-05-13 09:12
"원익IPS, 소부장 대표주로 고성장 기대... 목표가↑",/news/news_read.nhn?article_id=0003736509&office_id=011&mode=search&query=삼성전자&page=13,서울경제,"이 연구원은 “코로나19로 인한 불확실성 증대에도 불구하고 최대 고객사인 삼성전자의 반도체 투자는 증가할 것으로 예상되고, 디스플레이 사업부에서...",2020-05-13 09:13
"코로나 재확산 우려..코스피, 1%대 하락 출발",/news/news_read.nhn?article_id=0004638758&office_id=018&mode=search&query=삼성전자&page=13,이데일리,"삼성전자(005930)가 1%대, SK하이닉스(000660)가 2%대 하락하고 있다. LG화학(051910), 삼성SDI(006400), 삼성물산(028260), 엔씨소프...",2020-05-13 09:13
"삼성, 시청각 장애인용 TV 공급사 선정...'40형 스마트TV' 1만5천대 제작",/news/news_read.nhn?article_id=0004423518&office_id=014&mode=search&query=삼성전자&page=13,파이낸셜뉴스,삼성전자가 2020년 시청각 장애인용 TV 보급 사업의 공급자로 최종 선정됐다. 13일 관련 업계 등에 따르면 삼성전자는 시청각 장애인용 TV ...,2020-05-13 09:13
"손경식 ""코로나19 내년도 회복 어려워…법인세 인하 등 기업 지원해야""",/news/news_read.nhn?article_id=0002401222&office_id=119&mode=search&query=삼성전자&page=13,데일리안,"한편 이날 회장단회의에는 손 회장을 비롯, 이인용 삼성전자 사장, 윤여철 현대자동차 부회장, 황각규 롯데지주 부회장, 권오갑 현대중공업지주 회장...",2020-05-13 09:15
"이재용 부회장, 오후 삼성SDI 천안사업장 방문예정",/news/news_read.nhn?article_id=0009859136&office_id=003&mode=search&query=삼성전자&page=13,뉴시스,"이재용 삼성전자 부회장이 삼성SDI 천안사업장을 방문해 전기차 배터리 사업을 현장 점검할 예정이다. 13일 업계에 따르면, 이 부회장은 이날 오...",2020-05-13 09:15
