head,text,url
,"[머니투데이 강민수 기자] 최근 국내 증시에서 외국인이 기록적인 '팔자' 행진 가운데서도 펄어비스를 1000억원 넘게 사들여 주목된다.
20일 한국거래소에 따르면 지난달 5일부터 지난 16일까지 외국인은 코스닥시장에서 펄어비스 주식 1087억원어치를 사들였다. 같은 기간 코스닥시장에서 외인은 7061억원을 팔아치웠다. 코스피와 비교하면 격차가 더 크다. 이 기간 외인은 유가증권시장에서 30거래일 연속 순매도하며 14조7638억원을 팔아치웠는데, 이는 2008년 6월 9일~7월23일(33일)에 이어 역대 2번째 최장 기록이다. 그러나 30거래일동안 외인이 펄어비스를 순매도한 날은 단 이틀(3월11일·4월8일)에 불과했다. 주가 흐름도 양호하다. 펄어비스의 주가는 올해 들어 지난 17일까지 11.66% 올랐는데, 같은 기간 코스닥지수(-5.23%)와 코스피지수(-12.88%) 변동 폭과 비교하면 선방했다. 전문가들은 펄어비스의 투자 매력으로 신작 기대감과 게임업종의 코로나19(COVID-19) 수혜 등을 꼽는다. 특히 펄어비스가 인수한 아이슬란드 게임 개발사 CCP게임즈의 '이브 온라인'이 지난달 중국 판호(게임영업 허가권) 승인을 받은 점이 강점이다. 이번 판호 획득으로 한국 게임사가 4년만에 중국 시장에 간접적으로 진출하게 됐다. 한국 게임업체는 THAAD(고고도미사일방어체계) 배치 문제로 경제 보복조치인 한한령(한류 제한령)이 이뤄진 이후 2017년부터 신규 외자 판호를 받지 못했다. 김민정 하이투자증권 연구원은 ""이브 온라인이 만료 전 서비스했던 2016년 연간 매출액이 150억원 수준으로 파악되는데, 이는 올해 펄어비스 예상 매출액에서 4%에 해당하는 비중""이라며 ""최근 중국에서 공상과학(SF) 장르가 인기를 끌고 있고 CCP게임즈는 SF장르의 운영 경쟁력을 갖추고 있어 안정적인 흥행을 달성할 것""이라고 예상했다. 신작 기대감도 유효하다. 펄어비스는 배틀로얄 액션 게임 '섀도우 아레나'의 CBT(비공개 베타테스트)를 지난 17일부터 이날까지 진행 중이고, 이후 상반기 내 글로벌 출시를 앞두고 있다. 지난 1월 OBT(공개 베타테스트)를 종료한 '이브에코스'도 연내 출시 목표는 기존대로 진행할 것으로 보인다. '붉은사막', '도깨비', '플랜8' 등 신작 공개는 글로벌 파트너사와 진행될 가능성이 높으며, 시점은 코로나19로 인해 하반기로 예상된다. 코로나19로 외부 활동이 줄며 게임업종이 수혜를 입게 된 점도 호재다. 게임 플랫폼 스팀의 지난달 마지막 주 동시접속자 수(PCU)는 전주 대비 15% 증가한 2268만명으로 역대 최대치를 경신했다. 스팀의 유저 수는 2003년 서비스를 시작한 이래 최초로 동시접속자 수가 2000만명을 돌파했다. 코로나19 확산 이후 중국 모바일 게임 총다운로드 수는 지난해 평균 대비 약 80% 급증했고, 국내 모바일 게임 다운로드 수도 약 35% 늘었다. 이진만 SK증권 연구원은 ""불황, 전염병 발생 등으로 내부 활동이 증가하고 성장이 둔화하는 기간에 게임 산업은 상대적으로 높은 성장률을 기록했다""며 ""활동 침체기에 간편하고 저렴한 엔터테인먼트인 게임 이용 증가하기 때문""이라고 분석했다. 강민수 기자 fullwater7@mt.co.kr
<저작권자 ⓒ '돈이 보이는 리얼타임 뉴스' 머니투데이, 무단전재 및 재배포 금지>",/news/news_read.nhn?article_id=0004397140&office_id=008&mode=search&query=SK&page=6
,"[머니투데이 김도윤 기자] 코로나19(COVID-19) 영향으로 위축된 IPO(기업공개) 시장이 점차 활기를 띠고 있다. 오는 5월 첫 째주부터 2개 기업이 공모 절차에 돌입한다. 코로나19가 최악의 시기를 지났다는 판단에 따른 결정인 셈이다. 반면 1분기 실적 우려와 주식 시장 불확실성을 고려하면 IPO 기업의 공모 전략에 대한 고민도 커질 수밖에 없다는 지적이다.20일 관련업계에 따르면 오는 5월 7일 드림씨아이에스와 소마젠이 나란히 기관투자자 대상 수요예측에 돌입한다. 4월에는 IPO 시장 투자 심리가 극도로 악화된 가운데 센코어테크 단 한 회사만이 공모 절차를 밟았다. 센코어테크는 수요예측을 실시했지만, 저조한 투자 심리를 확인하고 결국 상장을 철회했다. 지난 3월에는 수요예측 예정이던 6개 기업이 공모를 철회했다.드림씨아이에스와 소마젠의 공모 절차 돌입은 최근 국내 코로나19 확산세가 둔화된데다 코스피지수가 1900선을 회복하는 등 증시 반등에 따라 ""한 번 해볼 만하다""는 분위기가 IPO 시장에 점차 퍼지고 있기 때문이란 분석이다. 또 소마젠은 유전체 분석, 드림씨아이에스는 CRO(임상시험수탁기관) 회사라 코로나19 영향에서 비교적 자유롭다는 점도 영향을 끼친 것으로 해석된다.이미 상장 심사를 통과한 기업의 IPO 행보도 주목된다. 올해 최대어로 주목받는 SK바이오팜은 2019년 12월 30일 상장 심사 통과 뒤 현재 공모 전략을 수립하고 있다. 오는 6월 30일까지 상장 절차를 완료해야 하는 만큼 변수가 없을 경우 늦어도 오는 5월 중 증권신고서를 제출할 것으로 예상된다. 위더스제약, 마크로밀엠브레인도 지난 3월 상장 심사 승인을 받고, 증권신고서 제출 시기를 조율하고 있다. 지난 17일에도 신도기연, 원방테크가 상장 심사를 통과했다.IPO 시장 환경, 소마젠과 드림씨아이에스 공모 성적 등에 따라 오는 5월부터 IPO 시장의 멈춘 시계가 다시 돌아갈 수 있다.반면 여전한 시장 불확실성은 IPO 기업의 고민을 키우는 요인이다. 코스피지수가 1900을 회복했지만, 본격적으로 약세장을 극복했다고 장담할 수 없는 상황이다. 또 국내외 기업의 올해 1분기 실적 발표 시기가 다가오면서 코로나19 영향을 수치로 체감할 경우 다시 한 번 투자 심리 위축이 나타날 수 있다. 특히 올해 사업 환경과 실적에 대한 자신감이 떨어진 기업의 경우 공모 전략이나 계획을 수정할 수밖에 없을 것으로 보인다. 코로나19로 직격탄을 맞은 산업과 관련 있는 업종의 경우 밸류에이션에 악영향을 받을 수 있는 만큼 IPO 강행 여부에 대한 고민이 더 깊다. 앞서 코넥스 바이오 대표 기업 중 하나인 노브메타파마는 상장 심사 승인 효력을 연장했다. 증권업계 관계자는 ""국내 코로나19 확진자 수 둔화가 나타나고 있는 만큼 기관투자자 등을 대상으로 한 기업설명회 등이 앞으로 다소 원활해질 것이란 전망도 IPO 기업의 증권신고서 제출 등 행보에 영향을 미치는 것 같다""며 ""다만 공모 규모가 커 해외 IR(투자자관계)이 필수적인 기업은 여전히 고민이 클 수밖에 없고, 전반적으로 현재 주식 시장이 확실한 안정기에 접어들었다 보기 힘든 만큼 밸류에이션에 대한 어려움이 공모 전략을 확정하는 데 부담이 될 수 있다""고 말했다.김도윤 기자 justice@
<저작권자 ⓒ '돈이 보이는 리얼타임 뉴스' 머니투데이, 무단전재 및 재배포 금지>",/news/news_read.nhn?article_id=0004397141&office_id=008&mode=search&query=SK&page=6
,"[머니투데이 황국상 기자] 한국은행이 우량 회사채를 담보로 증권사 등에 직접 대출을 시행키로 한 가운데 회사채 발행시장의 투자심리에 기여할 것이라는 분석이 제기된다. 다만 코로나19(COVID-19) 이전까지 시장을 활성화시키기보다는 추가하락을 막는 수준에 그칠 것이라는 전망도 나온다.20일 금융투자업계에 따르면 이날 CJ대한통운, 메리츠증권, 포스코에너지, 롯데쇼핑 등 신용등급 AA-에서 AA0에 이르는 기업들이 기관투자자를 상대로 회사채 수요예측을 진행한다. CJ대한통운은 3년물 1500억원어치를, 메리츠증권은 1년물 1000억원어치를, 포스코에너지는 3년물과 5년물을 더해 1500억원어치를, 롯데쇼핑은 3년물 2400억원어치를 각각 조달할 예정이다.지난 주(13일~17일) 회사채 시장에서 코로나19로 인한 타격이 가장 극심할 것으로 우려된 호텔·정유업종 종목들이 무난히 자금조달에 성공하면서 일단 회사채 발행시장에 청신호가 켜졌다는 평가가 나온다. 호텔신라가 발행할 예정인 1500억원 규모의 회사채에 2500억원의 매수 주문이 몰렸다. 정유업종의 GS, SK에너지가 각각 3000억원, 2000억원 규모로 발행할 예정인 회사채에도 5000억원(GS) 9500억원(SK에너지)의 매수 주문이 이어졌다. 일각에서는 이번 주(20일~24일) 자금조달에 나서는 기업들도 원활히 수요자를 찾을 수 있을 것이라는 전망이 나온다. 일단 한국은행이 지난 16일 발표한 금융안정 특별대출 프로그램이 회사채 시장에까지 온기를 전달할 것이라는 기대가 커졌다. 한은은 AA- 등급 이상의 회사채를 담보로 최장 6개월간 은행 뿐 아니라 증권·보험 등 비금융기관에 통화안정증권 6개월물 금리에 85bp(0.85%포인트)를 더한 수준에 특별 대출을 집행하기로 했다.증권가에서는 이같은 조치로 인해 시장금리 하락 효과가 나타날 것으로 보고 있다. 비은행 금융사들의 유동성 불안을 진정시켜 이들이 다시 회사채 발행시장에서의 입찰에 보다 적극적으로 나서게 함으로써 일반 기업들이 자본시장에서 자금을 조달할 때 약정하는 금리가 낮아질 수 있다는 얘기다.이미선 하나금융투자 연구원은 ""통안금리가 안정적으로 유지돼야만 대출을 통한 금융시장 완화효과가 발휘될 것""이라며 ""단기금리가 낮게 유지돼야 할 명분이 높아졌다는 측면에서 채권시장 전반에 강세 재료""라고 봤다. 또 ""기준금리와 단기금리 스프레드가 정상화되면서 중장기 금리가 하락하고 평균 대비 벌어졌던 국고 3·5년, 3·10년 금리차도 추가로 축소될 전망""이라고 했다.그러나 한은의 발표만으로 회사채 시장이 코로나19 이전 수준으로 정상화될 것이라는 기대감은 시기상조라는 지적도 있다. 불과 두 달 전만 하더라도 AA 등급 기업은 물론이고 BBB 등급 기업들도 민평금리보다 60~120bp
낮은 수준에 자금을 조달할 수 있었지만 4월 들어 재개된 발행시장에서는 최소 10bp에서 많게는 60bp까지 얹은 수준에서 자금조달이 이어지고 있기 때문이다.신동수 유진투자증권 연구원은 ""한은의 지원책은 어디까지나 유동성 위기에 몰린 기업들이 활용할 수 있을 뿐 RP(환매조건부채권) 등을 통해 기준금리 플러스 10bp(0.1%포인트) 수준에 자금을 조달할 수 있는 금융사는 굳이 통안채 6월물 플러스 85bp(0.85%포인트) 수준에 자금을 조달할 필요가 없다""며 ""이번 조치만으로 회사채 시장의 안정을 넘어 활성화까지 도모하기에는 한계가 있다""고 말했다.신 연구원은 ""만약 한은이 SPV(특수목적기구) 등을 통한 회사채 직매입 단계까지 취하겠다고 한다면 분위기는 금방 달라질 것""이라며 ""그 전까지는 가시적인 신용 스프레드 축소 전환까지는 시간이 필요할 것""이라고 했다.황국상 기자 gshwang@mt.co.kr
<저작권자 ⓒ '돈이 보이는 리얼타임 뉴스' 머니투데이, 무단전재 및 재배포 금지>",/news/news_read.nhn?article_id=0004397143&office_id=008&mode=search&query=SK&page=6
순매수 상위 10종목 중 7개 상승…매도상위 10개 모두 하락,"[아이뉴스24 한상연 기자] 외국인이 유가증권시장에서 31거래일 만에 순매도 행진을 끝낸 가운데 이 기간 순매수 한 종목 종목들은 대부분 오른 반면 순매도 종목들은 하락세를 보였다.20일 금융투자업계에 따르면 외국인이 지난 3월 5일부터 4월 16일까지 30거래일 연속으로 유가증권에서 모두 14조7천647억원을 팔아치우는 동안 순매수 한 종목은 292개, 매도우위를 보인 종목은 595개로 집계됐다.순매수 상위 10개 종목은 셀트리온이 2천22억원으로 가장 많았으며, 한진칼(1천613억원) 넷마블(868억원) 삼성바이오로직스(512억원) LG디스플레이(257억원) 파미셀(257억원) 한온시스템(195억원) HMM(158억원) 부광약품(143억원) 삼성물산(135억원)이었다.이들 종목 중 LG디스플레이, 한온시스템, 부광약품을 제외한 7종목의 경우 개인은 순매도한 반면 기관은 외국인과 동반 순매수했다.외국인이 30거래일간 코스피에서 팔자를 이어가는 동안 순매수한 상위 10종목들의 주가는 대부분 올랐으며, 평균 14.3%의 상승률을 기록했다.종목별로는 부광약품(124.2%)이 가장 큰 상승률을 기록했으며 파미셀(99.6%) 셀트리온(23.2%) 삼성바이오로직스(10.4%) HMM(5.1%) 넷마블(2.0%) 한진칼(0.4%) 등이 상승했다. LG디스플레이(-20.9%), 한온시스템(-15.0%), 삼성물산(-13.8%)은 하락했다.외국인의 순매도 상위 10개 종목은 무려 4조3천945억원 어치를 팔아치운 삼성전자를 비롯해 SK하이닉스(9천225억원) 현대차(8천410억원) 삼성전자우(5천737억원) SK이노베이션(4천21억원) 삼성SDI(3천668억원) LG화학(3천329억원) 현대모비스(2천843억원) 카카오(2천748억원) 신한지주(2천538억원)였다.이들 종목들 중 SK하이닉스, 현대차, 현대모비스, 카카오를 제외한 6종목에서 개인이 순매수한데 반해 기관은 순매도 하는 양상을 보였다.이 기간 외국인 순매도 상위 10종목의 주가는 전부 하락세를 보였으며, 하락률은 평균 13.5%를 기록했다.종목별로 현대모비스(-16.5%)가 가장 크게 떨어졌으며 SK이노베이션(-15.9%) 신한지주(-15.4%) 삼성전자(-14.6%) 삼성SDI(-14.0%) SK하이닉스(-13.8%) LG화학(-12.5%) 현대차(-12.3%) 삼성전자우(-12.2%) 카카오(-7.8%) 순으로 낙폭이 컸다. hhch1113@inews24.com [ⓒ 아이뉴스24 무단전재 및 재배포 금지]",/news/news_read.nhn?article_id=0000534958&office_id=031&mode=search&query=SK&page=6
"삼성바이오에픽스, 항암제 ‘온트루잔트’ 15일 미 판매셀트리온, 항암제 ‘허쥬마’ 3월 출시 판매 본격화SK바이오팜, 2분기 100% 독자개발 뇌전증 신약 출시","[이데일리 노희준 기자] 국내 주요 제약 바이오 회사들이 2분기 세계 1위 제약시장 미국에서 본격적인 실력을 검증한다. 삼성바이오에피스와 셀트리온(068270)은 항암제 제품 판매를 본격화한다. 국내 첫 100% 독자개발로 지난해 FDA 품목허가를 따낸 SK바이오팜은 뇌전증 신약 판매에 나선다. K바이오의 한 축인 양대 바이오시밀러 산맥과 신약 개발의 최선봉에 서있는 대기업계열 회사의 ‘삼각편대’가 미국 시장 공략을 본격화한다는 평이다. 19일 관련업계에 따르면, 삼성바이오에피스는 유방암 및 위암 치료제 ‘온트루잔트’를 지난 15일(미국시간) 미국에 내놨다. 이 약은 블록버스터 의약품 허셉틴의 바이오시밀러다. 전세계 연매출이 7조2000억원(전세계)로 이중 미국시장 규모는 45%다. 셀트리온 역시 지난달 허셉틴 바이오시밀러 ‘허쥬마’를 내놓으면서 2분기부터 본격적인 판매에 돌입했다.두 약은 두 회사에 의미가 크다. 온트루잔트는 미국에 출시하는 삼성바이오에피스의 첫번째 항암제다. 특히 기존 자가면역질환 치료제에서 항암제로 제품군을 넓히는 계기가 되는 제품이다. 셀트리온 역시 허쥬마 출시로 ‘시밀러3총사’(자가면역질환 치료제 램시마, 혈액암 치료제 트룩시마, 허쥬마)의 제품군을 모두 미국에 내놓게 됐다. 세계 첫 바이오항체 시밀러 램시마를 2016년 11월 인플렉트라라는 상품명으로 미국에 내놓은 뒤 3년여만이다. 미국 허셉틴 바이오시밀러 시장은 경쟁이 치열하다. 삼성바이오에피스와 셀트리온 외에도 앞서 차례로 암젠(칸진티), 마일란·바이콘(오기브리), 화이자(트라지메라)등 3업체가 시장에 진입한 상태다. 삼성바이오에피스와 셀트리온은 미국의 허셉틴 도매가 대비 각각 15%, 10%씩 싼 가격경쟁력을 장점으로 내세우고 있다. 여기에 유럽 등에서의 풍부한 처방 데이터도 두 회사 공략 무기다.SK바이오팜은 2분기 중에 뇌전증(발작) 신약 엑스코프리를 출시한다. SK바이오팜은 이달 말이면 제품 출시를 위한 준비를 사실상 끝내는 것으로 알려졌다. 뇌전증 치료제 시장 규모는 61억달러(약 7조원)로 평가되고 미국 시장 비중은 50%를 넘는다.이 약은 SK바이오팜뿐만 아니라 K바이오에도 남다른 의미가 있다. 100% 독자 개발로 FDA 관문을 뚫은 약으로 국내 신약개발 수준을 한단계 끌어올린 데다 미국 시장의 직접판매(직판) 시험대에 오르는 첫 의약품이기 때문이다. 엑스코프리 판매는 미 현지법인 SK라이프사이언스가 맡는다. SK바이오팜은 기존 치료제 대비 뛰어난 임상 결과를 차별화 포인트로 내걸었다. 미국은 제약업계 메이저리그 시장이다. 2018년 전세계 제약시장 1조2048억달러(1418조원)규모에서 4849억달러(570조원 ,40%)를 차지하고 있다. 또한 오리지널 선호현상이 뚜렷해 유럽에 견줘 바이오시밀러 시장 진입 문턱이 높다. 국내 신약 가운데 미국 시장에 제대로 진입한 의약품도 SK바이오팜 엑스코프리가 사실상 처음이다. 업계 관계자는 “2분기는 삼성바이오에피스와 셀트리온이 본격적인 미국 시장 공략에 나서는 시점”이라며 “K바이오의 신약 개발 능력 역시 엑스코프리 판매 실적에서 처음으로 검증될 것”이라고 말했다.노희준 (gurazip@edaily.co.kr)＜ⓒ종합 경제정보 미디어 이데일리 - 무단전재 & 재배포 금지＞",/news/news_read.nhn?article_id=0004623542&office_id=018&mode=search&query=SK&page=5
"최대 3박4일 동안 시승 가능계약·출고 시 이용권 금액, 전액 SK Pay 포인트로 환급","(서울=뉴스1) 조재현 기자 = 폭스바겐코리아가 11번가와 티구안을 최대 3박4일간 체험할 수 있는 장기 시승 프로그램을 선보인다고 20일 밝혔다. 이번 장기 시승 프로그램은 티구안을 구매하기 전 충분히 경험하길 원하는 고객들을 위해 마련됐다. 기존 전시장에서 영업사원과 동승 하에 진행되는 30분 내외의 짧은 시승에서 벗어나 출퇴근 길이나 일상 생활에서 티구안을 이용할 수 있다.장기 시승 프로그램은 주말, 공휴일, 연휴 기간 등 다양한 일정 선택이 가능하며, 11번가에서 장기 시승권 구매를 통해 진행된다. 가격은 15만원부터다. 장기 시승 프로그램 이용 후 티구안을 계약·출고 할 경우 11번가 시승권 결제 금액의 100%를 SK 페이(Pay) 포인트로 전액 지급해준다.장기 시승권은 22일 오전 10시부터 11번가 모바일 애플리케이션 검색창에서 '티구안 체험권'을 검색하면 구매할 수 있다. 결제 이후 해피콜을 통해 시승 관련 구체적인 안내를 받을 수 있다. 시승은 5월1일부터 10월말까지 진행된다. 시승을 위한 픽업·딜리버리 서비스는 서울 지역 내에 한해 제공된다. 시승 체험 후 구매 상담을 원하는 고객은 11번가 비대면 상담예약을 통해 영업사원과 상담이 가능하다.7인승 모델이 출시되면 이에 맞춰 해당 차량도 추가 확보할 예정이다. 폭스바겐코리아는 11번가 내 레저·여행 상품 등과 연계해 장기 시승권 구매 고객이 여행 계획 시 참고할 수 있는 다양한 라이프스타일 상품전도 추가 구성할 계획이다.cho84@news1.kr© 뉴스1코리아(), 무단 전재 및 재배포 금지",/news/news_read.nhn?article_id=0004597048&office_id=421&mode=search&query=SK&page=5
,"[디지털타임스 김민주 기자] 11번가가 20일 아모레퍼시픽의 화장품 브랜드 '아이오페'와 함께 뷰티 라이브방송 프로모션을 단독으로 실시한다.이날 오후 7시 11번가 프로모션 페이지에서 시청할 수 있다. 120만명의 구독자를 보유한 뷰티 유튜버 '회사원A'가 출연해 아이오페의 스테디셀러 안티에이징 상품인 '스템3 앰플'로 직장인, 육아맘들을 위한 '지친 피부에 생기 주는 법'과 관련한 기초 피부관리 팁을 알려줄 예정이다.이날 소개되는 '스템3 앰플'은 11번가에서만 볼 수 있는 단독구성 세트로 온라인 최저가 수준에 선보인다. '스템3 앰플' 본품에 '숙면 3종 키트', '안티에이징 키트', '사피아노 파우치', '스타벅스 기프티콘'까지 더해진 '11번가 단독 세트'를 7만2000원에 판매한다. 라이브방송이 끝난 뒤 오는 26일까지는 아이오페 베스트 상품 70여종을 정가보다 최대 60% 저렴하게 구매할 수 있다. 기획전 상품에 적용할 수 있는 20% 할인 쿠폰과 카드사 10% 할인 쿠폰을 발급하고 라이브 방송 중 주문 고객에게 SK페이 포인트 10% 적립 등 파격적인 혜택까지 마련했다.온라인쇼핑이 화장품 구매의 주 채널로 급부상하면서 11번가는 최근 뷰티 영상 콘텐츠 강화에 속도를 내고 있다. 인플루언서가 전하는 생생한 후기, 제품 테스트 영상을 통해 고객들이 화장품을 실제 사용해보지 않고도 사용한 것 같은 쇼핑경험을 얻고 구매로 효과적으로 이어지도록 한다는 목표다.통계청에 따르면 지난해 화장품 온라인쇼핑 거래액이 전년 대비 25% 증가하며 처음으로 10조원을 돌파, 모바일 비중도 59.4%에 달했다. 상품군별 거래액 비중에서도 여행, 의류, 가전, 식료품 다음으로 다섯번째를 기록했다. '화장품은 써보고 산다', '오프라인에서 직접 발라보고 산다'는 공식이 깨진 지 오래다.김명식 11번가 라이프뷰티 담당은 ""영상 중심의 정보에 익숙한 밀레니얼, Z세대들을 겨냥한 다양한 시도를 이어 나갈 것""이라고 말했다.김민주기자 stella2515@dt.co.kr 디지털타임스
/",/news/news_read.nhn?article_id=0002594354&office_id=029&mode=search&query=SK&page=5
