head,text,url
"'가정 지키겠다' 입장 바꾼 노소영 관장최태원 측 ""감성팔이 여론전 펴지 말라""이혼소송 이미 재산분할 단계로 넘어가","[한국경제TV 김민수 기자]최태원 SK그룹 회장의 법률대리인은 노소영 아트센터 '나비' 관장이 이혼소송과 관련해 여론전을 펼치고 있다며 강하게 비판했다.비공개로 진행되고 있는 소송의 핵심진술 등 내용 일부를 외부에 흘리면서 재판의 공정성을 침해하고 있다는 것이다.법조계에 따르면 노소영 관장은 지난 7일 비공개로 진행된 이혼소송 법정에 나와 ""최 회장이 가정으로 돌아오면 반소를 취하할 것이며, 최 회장과 동거인 사이에 난 자녀도 받아들이겠다""고 말한 것으로 전해졌다. 노 과장은 이미 지난해 이혼 의사를 공개적으로 밝힌 바 있어, 갑작스런 입장 선회 배경에 관심이 쏠린다.계속해서 최 회장의 이혼 요구에 반대하던 노 관장은 지난해 12월 자신의 페이스북을 통해 ""이제는 남편이 저토록 간절히 원하는 ‘행복’을 찾아가게 하는 것이 맞지 않나 생각한다""며 이혼 의사를 밝혔다.이에 대해 최태원 회장의 법률대리인은 ""반소에 비추어 볼 때 실제로는 피고도 이혼 의사가 확고하면서도 언론에는 가정을 지키려는 것처럼 하는 것은 대중의 감성을 이용한 여론전일 뿐 그 진정성은 전혀 없다""고 비판했다.이어 ""노 관장이 동거인과의 사이에서 난 자녀도 받아들이겠다는 것은 법적으로도, 현실적으로도 맞지 않는 이야기일 뿐만 아니라 당사자인 자녀에 대한 배려는 조금도 없는 전근대적인 사고""라고 밝혔다.재판부 역시 노 관장이 이혼 소송을 취하할 의사가 없다고 보고 재판을 진행 중이다. 재판부는 지난 7일 최 회장과 노 관장 모두에게 재산 목록을 제출하라는 재산 명시 명령을 내렸다.이는 이혼 여부는 더 이상 이 소송의 쟁점이 아니며, 이제는 재산을 어떻게 분할할지만 집중적으로 보겠다는 뜻으로 해석된다.김민수기자 mskim@wowtv.co.krⓒ 한국경제TV, 무단 전재 및 재배포 금지",/news/news_read.nhn?article_id=0000863278&office_id=215&mode=search&query=SK&page=4
"업계 ""산소호흡기 달아줘서 감사하지만 더 급한 건 현금흐름 확보""학계 ""6개월은 지나야 평가 가능…그때도 불경기면 세금낭비 비판""정부·공사 10여년간의 뒷북·오판보다 나은 결정이란 데엔 이견없어","[아시아경제 문채석 기자]정부가 올해 비축유를 지난해보다 2.4배가량 많은 64만배럴 확보하겠다고 해 정유업계가 환영하고 있지만 일각에선 타이밍이 아쉽다는 지적이 나온다. 지난 10여년간 반복했던 비쌀 때 사고 쌀 때 파는 '뒷북' 만큼은 아니지만 산유국이 감산 합의를 하기 직전인 지금보다는 빨리 확보량을 늘려 기업의 현금흐름 확보를 도울 수 있었을 것이란 목소리가 나온다.10일 산업통상자원부에 따르면 한국석유공사는 올해 원유 49만배럴, 경유 15만배럴 등 총 64만배럴의 비축유 구매를 추진한다. 산업부가 출자한 예산 314억원이 들어간다. 공사는 제4차 석유비축계획에 따라 2025년까지 총 1억70만배럴의 비축유를 확보하기 위해 올해 36만배럴을 구매하려다 최근 유가가 낮아져 구매 물량을 계획의 1.8배인 64만배럴로 늘려 조기에 사기로 했다. 비축유는 전쟁이 나거나 산유국과 관계가 나빠져 석유 수입을 할 수 없을 때 국내의 수급을 조절하기 위해 비축창고 건설, 구입비에 대한 이자 지급 등의 비용을 감수하고라도 보유하는 물량을 뜻한다.업계는 정부가 일정 물량을 받아줘서 다행이지만 '격한 환영'은 아니라는 반응을 나타냈다. 신종 코로나바이러스감염증(코로나19) 때문에 해외에 덤핑을 해도 받아주는 곳을 찾기 어려울 정도로 수요가 급감했는데 그나마 정부가 받아주기로 해 급한 불은 껐다고 가슴을 쓸어내렸다. 다만 현금흐름 확보를 통한 자금 유동성 확보란 근본적인 문제를 해결할 수준은 아니라고 말했다. 현재 정유업계는 대표 4사(SK에너지·GS칼텍스·현대오일뱅크·S-Oil)의 1분기 영업손실이 증권가의 컨센서스(이익 추정치)인 2조원보다 훨씬 많은 '3조원 이상'일 것으로 본다. 함께 실적이 급감할 것으로 예상되는 정유사의 주 고객인 항공사가 매출채권을 받아주지 않으면 차입금 상환 등에 대한 자본시장의 압박이 거세질 것으로 우려하는데, 비축유 구매로 이를 덮긴 어려울 것으로 내다봤다.업계 관계자는 ""정부가 산소호흡기를 달아준 것은 다행스럽고 감사하지만 지금 가장 힘든 건 현금흐름 문제""라며 ""주고객인 항공사 결제가 뚝 끊긴 상황이라 1분기 실적이 심각하게 나쁠 것으로 예상되고 코로나19가 2분기 이후로 장기화하면 답이 없을 것 같아 걱정된다""고 털어놨다.유가가 쌀 때 비축유를 추가 구매하기로 한 정부의 이번 결정이 지난 10여년간보다는 낫다는 데엔 별다른 이견이 없다. 단, 전문가들은 최소 6개월은 지나야 이번 정책이 정유업계와 국익에 얼마나 도움이 됐는지 제대로 평가할 수 있다고 말한다. 코로나19 사태가 진정돼 경기가 좋아지면 비축유를 싼값에 사둔 게 적중했다는 평가를 받겠지만, 장기화돼 불경기가 이어지면 괜히 세금만 썼다는 비판이 일 수 있다는 지적이다. 경기가 둔화하면 휘발유 소비 등이 줄기 때문이다.이덕환 서강대 화학·과학커뮤니케이션 명예교수는 ""정부의 석유비축유 구매는 정유사 긴급수혈과 국익 차원에서 판단해야 하는데, 정유사들은 쏟아지는 물량을 넣어놓을 데가 없는 가운데 정부가 64만배럴이라도 빼주니까 환영하는 것""이라며 ""국익 측면에서 보면 코로나19 사태가 진정된 뒤 경기가 살아나면 정부가 유가가 쌀 때 비축을 잘 했다고 평가받겠지만, 오랫동안 불경기가 이어지면 결과적으로 애물단지로 전락할 비축유를 굳이 공적자금으로 사들였다는 비판을 받을 수 있다""고 말했다.앞서 정부와 석유공사는 지난 10여년간 ▲유가를 오판해 약 1조3000여억원의 손실을 냈고(석유공사, 2007·2009·2011·2013·2015년 국정감사) ▲저유가 때 머뭇거리다 비축유를 충분히 사지 못했다는 비판을 받았으며(정부, 2008·2015년) ▲유가 오판에 따른 손해에도 불구하고 직원복지에 400억원을 썼다가 감사원에 적발당했고(석유공사, 2008년) ▲실수를 만회하려 원유탐사 발견확률을 조작하다 감사원에 덜미를 잡히는(석유공사, 2009년) 등의 실수를 했다.세종=문채석 기자 chaeso@asiae.co.kr <ⓒ경제를 보는 눈, 세계를 보는 창 아시아경제 무단전재 배포금지>",/news/news_read.nhn?article_id=0004659333&office_id=277&mode=search&query=SK&page=4
,"[아시아경제 박소연 기자] 정부가 올해 전략비축유 64만배럴을 최저가 입찰로 구매하기로 하면서 정유 4사의 눈치싸움도 시작됐다.10일 한국석유공사와 정유업계에 따르면 석유공사는 올해 원유 49만배럴, 경유 15만배럴에 대한 최저가 입찰을 이르면 이달 중순부터 진행할 예정이다. 공사는 제4차 석유비축계획에 맞춰 2025년까지 총 1억70만배럴의 비축유를 확보하기 위해 올해 중 36만배럴을 구매할 예정이었다.하지만 최근 유가 급락과 함께 정유사들이 경영 위기에 봉착하자 구매 물량을 1.8배인 64만배럴로 늘리고 조기 구매하기로 했다.이에 따라 SK이노베이션, GS칼텍스, S-Oil, 현대오일뱅크 등 정유 4사는 국제 석유시장 가격, 국내시장 가격 추이 등을 종합해 석유공사 입찰 예정 가격 및 매출 산정 등 시뮬레이션 작업에 한창이다.국제 원유시장에서는 9일 기준 서부텍사스산원유(WTI)는 전날보다 9.3% 내린 배럴당 22.76달러, 두바이유는 0.2% 내린 배럴당 23.32달러, 브렌트유는 2.38% 내린 배럴당 31.48달러에 거래가 마감됐다.한 정유사 관계자는 ""정부 비축 물량이 생각보다 많이 나와서 인공호흡기를 단 것 같다""면서 ""입찰에 적극 임할 계획""이라고 밝혔다. 또 다른 정유사 관계자도 ""낙찰받기 위한 적정 가격을 산출 중""이라며 ""혹시 낙찰되지 못하더라도 그만큼 시장 물량이 줄어드는 것이라 도움이 될 것 같다""고 기대했다.공사 관계자는 ""정유사들의 업황을 고려해 골고루 판매하면 좋겠지만, 정부 예산으로 구매하는 것이라 최저가 입찰이 원칙""이라며 ""다만 적정한 가격에 낙찰한 정유사가 다른 정유사와 사적인 계약을 통해 물량을 나눌 수는 있을 것""이라고 귀띔했다.그는 ""한국 정유사의 경우 품질은 무조건 담보가 된다고 보고 가격 요인이 중요하다""면서 ""한국에서 바로 구매를 하는 것이기 때문에 운송료 등이 절감돼 해외 수출 판매되는 가격보다는 낮은 가격에 낙찰이 이뤄질 것으로 본다""고 말했다.박소연 기자 muse@asiae.co.kr <ⓒ경제를 보는 눈, 세계를 보는 창 아시아경제 무단전재 배포금지>",/news/news_read.nhn?article_id=0004659338&office_id=277&mode=search&query=SK&page=4
수집한 생체데이터 공개…가축 전염병 관리·추적 플랫폼 개발중,"반려견, 고양이, 호랑이 등 동물의 코로나19(COVID-19) 감염 사례가 잇달아 나오고 있다. 코로나바이러스가 유전자 돌연변이가 잦은 RNA 바이러스과에 속하는 탓이다. 이런 가운데 한 국내 벤처기업이 가축의 코로나바이러스 감염증을 조기 발견해 치료한 사례와 생체데이터를 공개해 눈길을 끈다. 유라이크코리아(대표 김희진)는 10일 축우 관련 감염 감지 사례와 데이터를 처음 공개했다. 이 회사는 ‘라이브케어’라는 가축 질병 감지·경보 시스템을 운영한다. 이는 바이오캡슐을 가축 입으로 투여해 생체데이터를 실시간 측정하고, 인공지능(AI) 기반으로 분석된 결과를 앱으로 농가에 제공한다. 생체데이터는 SK텔레콤의 장거리 사물인터넷(IoT)인 로라(LoRa)망을 활용해 DB서버로 전송된다. 이어 딥러닝을 통해 질병에 의한 이상을 감지하고 알려준다. 국내와 일본에서 이 라이브케어를 통해 소의 바이러스 감염증을 조기에 발견하고 치료한 사례가 잇달아 나왔다. 코로나바이러스과(Coronaviridae)에 속하는 코로나바이러스는 사람 외에도 소, 돼지, 말 등 동물과 조류를 감염시켜 질병을 유발한다. 현재의 신종 코로나 감염증(코로나19)과는 다른 부류지만 인간과 밀접한 가축에게도 소화기 및 호흡기 질환을 유발한다. 유라이크 김희진 대표는 “충남 공주 한우농가에서 48개월령 번식우가 코로나바이러스 증상인 체온상승이 지속되는 패턴을 통해 설사증상 발현을 감지했다. 음수 횟수가 평균보다 현저히 적은 이상상태가 확인됐다. 이후 신속한 처치를 해 증상 악화를 차단했다”고 소개했다. 또 “일본 나고야 와규목장에서 어린 송아지의 코로나바이러스 감염으로 인한 설사 및 고온 증상이 발견됐다. 즉시 해열제를 먹이고 이틀 뒤 만성열 진단을 받아 치료에 돌입했다. 나흘 후 정상 체온으로 회복됐다”고도 했다. 서울대 수의과대학 김단일 부교수는 “면역체계가 미확립된 송아지에게서 코로나 감염 사례가 많이 발생한다. 젖소의 유량 감소 및 허약상태 지속 땐 폐사위험이 높다”며 “육안 감별이 어려운 코로나바이러스의 경우 생체데이터 분석을 통한 조기 감지가 큰 도움이 된다”고 전했다. 김 대표는 “라이브케어는 농가 내 전염병 확산을 사전에 막고 항생제 사용을 줄이는 효과가 있다. 코로나 감염증 뿐 아니라 구제역, 돼지열병 등 법정가축전염병 관리체계를 확립할 것”이라며 “전 세계 가축전염병 관리 및 추적이 가능한 플랫폼을 만들겠다”고 밝혔다. 조문술 기자
- Copyrights ⓒ 헤럴드경제 & heraldbiz.com, 무단 전재 및 재배포 금지 -",/news/news_read.nhn?article_id=0001660454&office_id=016&mode=search&query=SK&page=4
"유재범 몬스터큐브 대표 인터뷰몬스터큐브, 지난 3월 암호화폐 지갑 서비스 `비트베리` 인수앰버코리아와 지난 8일 MOU…블록체인 기반 금융 서비스 제공","'간편 암호화폐 지갑'을 표방했던 비트베리가 기존 IT업체의 블록체인 도입을 돕겠다고 선언했다. 블록체인 업체에 한정 지었던 파트너사의 범위를 IT업체로까지 넓혀 엑셀러레이팅까지 지원하겠다는 포부다.비트베리는 지난 1월 경영난 등을 이유로 '서비스 종료'를 발표한 바 있다. 두 달 뒤인 3월 몬스터큐브가 비트베리 운영사 루트원소프트를 인수하면서 서비스는 재개됐다. 몬스터큐브는 지난 2017년 SK플래닛의 맛집 소개 플랫폼 '시럽테이블'을 인수한 블록체인 기술 기업으로 디앱판 시럽테이블인 '소다플레이'를 운영 중이다.유재범 몬스터큐브 대표(사진)는 최근 디스트리트와 인터뷰에서 ""블록체인 업체로만 한정했던 비트베리 판을 IT업체로 확대할 것""이라며 ""비트베리 응용프로그래밍인터페이스(API)를 웹하드 등 포인트 운영 업체 등에 적용해 암호화폐와 포인트 간의 교환도 지원하겠다""고 말했다.유 대표는 비트베리 인수 배경에 대해 '사업 확장성'을 꼽았다. 그는 ""비트베리가 서비스 종료를 선언하자마자 바로 인수할 생각이었다""며 ""향후 새로운 비즈니스 모델을 적용하면서 사업을 확장할 수 있는 가능성이 큰 것으로 판단했다""고 회상했다.
가장 먼저 '장외거래(OTC)'를 확대할 예정이다. 비트베리는 지난해 10월 사용자간 암호화폐를 교환할 수 있는 '비트베리 안전거래'서비스를 출시했다. 해당 서비스는 일종의 OTC 플랫폼으로 비트베리 사용자끼리는 암호화폐 거래소를 거치지 않고도 암호화폐를 교환할 수 있다. 판매자는 클릭 몇 번으로 거래 링크를 생성해 소셜네트워크서비스(SNS)에 공유할 수 있으며 구매자는 거래 내역을 승인하면 바로 거래할 수 있다. 특정 암호화폐 거래소에 회원 가입을 하지 않아도 거래할 수 있으며 거래소에서 거래되지 않는 암호화폐도 교환할 수 있다.유 대표는 ""몬스터큐브가 새롭게 출시하는 비트베리는 안전거래 서비스가 메인이 될 것""이라며 ""국내에서는 비트베리만큼 OTC 거래를 소화할 수 있는 곳이 없을 것""이라고 기대를 밝혔다. 이어 ""간단한 거래는 굳이 거래소를 거치지 않고 비트베리를 통해서만 안전하게 거래할 수 있도록 지원하겠다""며 ""이를 위해 글로벌 OTC 기업 3곳 이상 등과 파트너십을 준비 중""이라고 덧붙였다.몬스터큐브는 비트베리를 통해 고여있는 포인트의 활용 가치를 높일 방침이다. 유 대표는 ""소리바다·오투잼·투믹스 등 기존 포인트 사이트에는 연간 50억~100억 규모의 포인트가 쌓여있다""며 ""포인트 홍수 속 해당 업체들을 끌어들여 포인트의 활용 범위를 넓히겠다""고 설명했다. 이어 ""영화·음악·카페 등 여러 분야의 포인트도 활용할 수 있도록 계획 중""이라며 ""트랜잭션을 많이 일으키는 곳은 자체 암호화폐 발행부터 암호화폐 거래소 거래 지원까지 추천해 엑셀러레이팅할 것""이라고 덧붙였다.이를 통해 암호화폐의 사용 진입장벽을 낮추고 거래를 활성화하겠다는 목표다. 유 대표는 ""비트베리는 암호화폐를 포인트화 시킨 서비스""라며 ""굳이 블록체인 서비스만 지원할 필요는 없다""고 말했다. 그러면서 ""실제로 포인트 업체까지 비트베리에 합류한다면 개인 간 거래가 더 다양해지고 활성화될 것""이라고 전망했다. 암호화폐-암호화폐 간 거래만 지원했던 이전과 다르게 포인트-암호화폐·암호화폐-포인트 간 거래도 지원한다는 설명이다.
몬스터큐브는 서비스 확장을 통해 비트베리를 종합 금융 플랫폼으로 성장시킬 계획이다. 이를 위해 지난 8일에는 앰버코리아와의 업무 협약(MOU)을 공개했다. 앰버그룹은 모건 스탠리·골드만 삭스·블룸버그 등 전통 금융사 출신 7명의 공동창업자가 홍콩에 설립한 암호화폐 기반 종합금융서비스 기업이다. 현재 자동화 장외거래(OTC) 외에도 전자적 유동성 공급·자산 관리·암호화폐 담보대출 등 다양한 암호화폐 금융 서비스를 제공 중이다. 유 대표는 ""앰버그룹을 비롯해 글로벌 주요 OTC 기업 등과 함께 비트베리의 OTC 거래를 지원할 것""이라며 ""이들은 비트베리 OTC 호가창을 제시할 예정""이라고 말했다.이밖에 암호화폐 자산 운용서비스 등도 함께 제공할 예정이다. 비트베리를 통해 비트코인·이더리움·테더(USDT) 등을 보관만 해도 이자가 발생하는 블록체인 기반 금융서비스를 제공한다는 설명이다. 유 대표는 ""비트베리의 암호화폐 자산 운용 서비스는 자산운용 범위에서 나아가 언제든지 입출금 할 수 있는 서비스로 확대할 것""이라며 ""사용자는 서비스 이용만으로도 수익을 거둘 수 있을 것""이라고 설명했다.그러면서 ""기존에 비트베리가 운영하던 서비스 외에도 다양한 블록체인 금융 서비스를 지원할 계획""이라며 ""이를 통해 비트베리를 종합 대형 금융 플랫폼으로 키워 암호화폐계 토스가 되겠다""고 강조했다. [이지영 D.STREET(디스트리트) 기자] [ⓒ 매일경제 & mk.co.kr, 무단전재 및 재배포 금지]",/news/news_read.nhn?article_id=0004554607&office_id=009&mode=search&query=SK&page=4
,"[머니투데이 주명호 기자] [SK이노베이션 사내인터뷰] ""'코로나19(COVID-19' 사태를 계기로 예기치 못한 위험을 조기에 감지하고 체계적으로 대응할 수 있는 관리체계의 필요성을 절실히 인식했습니다. 앞으로 SHE(안전∙보건∙환경) 관리 패러다임을 전환하지 못한 기업은 도태될 것입니다.""유재영 SK이노베이션 SHE(안전∙보건∙환경)본부장은 10일 SK이노베이션 사내 뉴스채널과의 인터뷰에서 코로나19와 관련해 ""외부로부터 오는 더 큰 위험에 대비할 수 있는 대응체계를 보다 강화해야 한다""며 이같이 말했다. SK이노베이션은 코로나19 발생 초기부터 유 본부장의 지휘 아래 최고수위의 대책으로 대응해왔다. 국내 감염 확산이 이슈화되지 않았던 설 연휴 전부터 중국 우한지역을 중심으로 주재원과 주재원 가족들의 귀국을 유도하고 중국 출장을 다녀온 구성원은 반드시 2주간의 재택근무를 통해 선제적으로 예방격리를 실시했다. 이어 국내 코로나 발생 초기부터 구성원들의 마스크 착용과 손소독을 생활화하고 사내 출입자 전원에 대해 체온 측정을 실시하는 등 방역관리체계를 마련했다. 정부가 심각단계가 상향한 이후부터는 전 구성원을 대상으로 재택근무를 시행키도 했다. 유 본부장은 ""코로나19 사태 장기화가 불가피해지면서 보다 효과적으로 회사업무를 수행해 나갈 수 있게 하기 위해 현재는 정상 출근으로 단계적 전환을 진행 중""이라고 밝혔다. 유 본부장은 ""안전, 보건, 환경의 위협은 사회 시스템 공동의 문제며 함께 대응해 나가야 하는 대상""이라며 중요성을 강조했다. 그는 ""기업들도 사회 구성원으로서 역할과 책임에 대해 다시 한번 진지하게 고민하고 변화해야 할 시점""이라며 ""SHE와 관련된 사회안전망을 더욱 강화하는데 기여할 수 있도록 관리 범위를 확장해 나가겠다""고 밝혔다.주명호 기자 serene84@mt.co.kr
<저작권자 ⓒ '돈이 보이는 리얼타임 뉴스' 머니투데이, 무단전재 및 재배포 금지>",/news/news_read.nhn?article_id=0004392494&office_id=008&mode=search&query=SK&page=4
