head,text,url
,"SK매직(대표 류권주)은 한국경영인증원(KMR) 주관 ‘2020 이노스타-그린스타’ 인증에서 정수기, 식기세척기, 가스레인지, 전기레인지, 공기청정기, 비데 등 총 6개 품목에서 1위로 선정됐다고 20일 밝혔다.이노스타 인증은 인증 평가전문 기관인 한국경영인증원과 조사 전문기관 한국리서치에서 자체 개발한 지수 평가 도구(Tool)를 통해 혁신성을 평가하는 제도다. SK매직은 먼저 혁신성에 방점을 둔 이노스타 부문에서 정수기, 전기레인지, 식기 세척기가 소비자와 전문가를 대상으로 한 조사에서 가장 높은 성적을 받아 1위로 선정됐다고 전했다.SK매직과 KMR에 따르면 저수조를 없애고 정수기 유로(물길) 전부를 스테인리스로 바꾼
‘올인원 직수 정수기’는 정수기 부문에서 5년 연속 수상의 영예를 안았으며, 인덕션 히팅 방식으로 3구 모두 터보 기능을 갖춘
‘3구 프리미엄 인덕션 전기레인지 매직콘트롤’도 2년 연속 수상했다. 또 지난 1월 출시된 ‘트리플케어 식기세척기’도 지난해 11월, 세계 최대 가전 전시회 '2020 CES(Consumer Electronics Show)'에서 'CES 혁신상(CES Innovation Awards)'을 수상한데 이어 다시 한 번 혁신성을 인정받았다.친환경 상품과 서비스를 평가하는 그린스타 인증에서는 공기청정기, 가스레인지, 비데 3개 품목이 1위로 선정됐다. SK매직은 연소 중 CO(일산화탄소) 농도를 혁신적으로 저감시킨 ‘에코버너 가스레인지’로 9년 연속 수상 쾌거를 거뒀다. 이 밖에 국내 최초 스마트센서와 모션기술 등 최첨단 기능이 탑재된 ‘모션 공기청정기(4년 연속)’와 버블 세정과 전해수 살균으로 물통부터 도기까지 5중으로 완벽하게 살균 가능한 ‘도기살균 버블세정 비데(5년 연속)’도 1위로 선정되며 친환경 경쟁력을 인정받았다.SK매직 관계자는 “고객 가치를 최우선으로 한 친환경, 혁신 제품을 선보이기 위해 지속적으로 노력해왔다.”며 “앞으로도 소비자가 믿고 선택할 수 있는 제품을 개발할 수 있도록 혁신과 개선을 계속 이어 나갈 것”이라고 말했다.한편, SK매직은 ‘2020 이노스타-그린스타’ 1위 선정을 기념해 온라인 이벤트를 진행한다. 이벤트는 누구나 참여 가능하며, SK매직 공식 포스트를 통해 오는 21일까지 ‘이노스타-그린스타’ 인증 제품을 선택 후 선정 이유를 댓글 형식으로 작성하면 된다. 추첨을 통해 15명에게는 백화점 상품권, 영화관람권 등 푸짐한 경품을 제공한다. 또 공식 페이스북을 통해 ‘수상 제품명 맞추기’ 이벤트를 오는 29일까지 추가적으로 진행하며, 당첨자 20명에게는 스타벅스 기프티콘을 증정한다박해식 동아닷컴 기자 pistols@donga.comⓒ 동아일보 & donga.com, 무단 전재 및 재배포 금지",/news/news_read.nhn?article_id=0003281843&office_id=020&mode=search&query=SK&page=3
코로나19 위기극복 방안 논의,"김상조 청와대 정책실장이 오는 22일 삼성·현대차·SK·LG 등 주요 기업의 경영진을 만나 코로나19(신종 코로나바이러스 감염증)에 따른 경제적 충격 극복 방안을 논의한다.20일 청와대에 따르면 김 실장은 오는 22일 국내 주요 기업 핵심 경영진들과 조찬 회동을 한다. 이 모임에는 이인용 삼성전자 사장, 권영수 LG그룹 부회장, 장동현 SK 사장, 공영운 현대차 사장 등이 참석하는 것으로 알려졌다.김 실장은 이번 모임에서 기업들의 어려움을 듣고 정부의 대응에 이를 반영할 것으로 보인다. 김 실장은 지난해 8월 일본의 보복성 수출규제 조치로 기업들이 어려움을 겪을 때도 대기업 경영진과 회동하고 함께 대응책을 모색했다.김 실장은 이 자리에서 문재인 대통령이 코로나19 위기 속에서 고용의 중요성을 강조한 만큼 각 기업에 일자리 안정을 위한 협조를 당부할 가능성도 있다. 또 투자 역시 독려할 것으로 보인다.문 대통령은 지난 13일 청와대에서 주재한 수석·보좌관회의에서 ""일자리가 무너지면 국민 삶이 무너지고 그로부터 초래되는 사회적 비용은 이루 말할 수 없다""며 ""고용 유지 기업에 대한 최대의 지원책을 검토하라""고 주문한 바 있다.노정동 한경닷컴 기자 dong2@hankyung.com▶ ▶
 ▶
ⓒ 한국경제 & , 무단전재 및 재배포 금지",/news/news_read.nhn?article_id=0004327400&office_id=015&mode=search&query=SK&page=3
"3월 셋째주 이후 발행 없어 시장금리 반영 안돼채안펀드 가격보다 자금조달 `방점`…비싸지 않게 매수기관들, 등급하향 부담돼 일단 지켜보자 `관망세`","[이데일리 김재은 기자] 채권시장안정펀드(채안펀드)가 자금집행에 나선지 2주가 됐지만, 회사채 금리와 국고채 금리간 차이(스프레드)는 여전히 2012년 이후 최고 수준을 유지하고 있다. 위축된 회사채 시장이 좀처럼 풀리지 않고 있다는 의미다. 다만 채안펀드 덕에 한화솔루션(009830)을 제외한 발행사의 수요예측은 모두 발행예정금액을 웃돌며 자금조달엔 숨통이 트였다. 크레딧업계에서는 당분간 회사채 스프레드 확대가 이어지면서 밸류에이션 매력은 있겠지만 등급 하향 압력으로 인해 투자심리는 여전히 저조할 수 있다는 분석을 내놓고 있다. 자료:금융투자협회 (민평금리 기준)20일 금융투자협회에 따르면 지난 17일 기준 국고채 3년물과 AA- 회사채 3년물 금리는 각각 1.01%, 1.751%로 집계됐다. AA- 스프레드는 74.1bp(1bp=0.01%p)로 채안펀드가 자금집행에 나서기 시작한 지난 6일(63.7bp) 이후 줄곧 확대되는 모양새다. 남유럽 재정위기가 한창이던 2012년 1월 16일(75bp)이후 최대 수준으로 벌어진 상태다. 이는 지난 3월 중순 이후 회사채 발행이 중단됐던 만큼 뒤늦게 시장가격이 반영되는 현상으로 풀이된다. 특히 금융회사 등 민간자금으로 이뤄진 채안펀드가 가격까지 챙기기는 쉽지 않은 만큼 회사채 발행에(자금 조달) 방점을 둘 수밖에 없기 때문이다. 실제 지난 6일 첫 발행에 나선 롯데푸드(002270)는 A등급 민평금리에 30bp 높은 금리로 발행이 확정됐다. 호텔신라(008770)는 개별민평 금리보다 60bp 높은 수준에서 3500억원 증액발행에 나섰다. 이는 각 회사 측이 제시한 발행금리 밴드 상단이다. 윤원태 SK증권 연구원은 “16일 기준 회사채 수요예측 물량은 1조6000억원으로 3월과 비슷하지만 발행금리는 예사롭지 않다”며 “최근 수요예측에 나선 기업은 대부분 AA급 우량회사채였지만, 확정금리는 20~60bp 높은 수준의 약세를 보였다”고 분석했다. 이와 관련 윤 연구원은 △채안펀드(회사채)에서 수요예측 참가시 시장가대비 낮은 가격에 매수해야 한다는 원칙과 이를 이용한 기관들의 저가매수 수요 △4월 이후 신용등급 정기평정을 앞두고 신용등급 하향리스크에 따른 투자심리 악화 △3~4월 여전채에 반영됐던 스프레드 확대요인이 이제야 발행물을 통해 나타나고 있기 때문이라고 분석했다. 결국 시장의 매수세는 아직 ‘싸게 사자’ 분위기지만 최근 수요예측 물량이 발행되면서 민평금리에 반영되고 있으며, 민평금리가 시장 수준을 어느 정도 반영하게 되면 금리 매력으로 매수세가 확대될 수 있다고 내다봤다. 지난 17일 수요예측에 나선 SK(034730)에너지의 경우 `AA+` 등급에 부정적 꼬리표가 붙어있지만, 2400억원 규모의 수요예측에 1조원에 가까운 자금이 몰렸다. 수요예측 참여 금리도 발행금리 밴드(3년물 개별민평 ±60bp, 5·10년물 개별민평 ±70bp) 중간 이하인 20~25bp수준으로 강세를 보여 눈길을 끌었다.한 대형운용사 채권담당자는 “4월에는 수요예측에 참여할 계획이 없다”며 “기업 등급 하향 압박이 커지는 가운데 시장 불확실성이 커 업종과 기업을 보면서 자금 집행 여부를 판단할 것”이라고 말했다.
한광열 NH투자증권 연구원은 “회사채 스프레드는 2012년 이후 최고 수준으로 밸류에이션 매력이 높지만, 신용등급 하향 압력과 발행확대 가능성을 감안하면 투자심리가 전환되기는 쉽지 않다”며 “상위등급 회사채의 경우 완만한 추세로 스프레드가 축소될 가능성이 높다”고 전망했다.김재은 (aladin@edaily.co.kr)＜ⓒ종합 경제정보 미디어 이데일리 - 무단전재 & 재배포 금지＞",/news/news_read.nhn?article_id=0004623801&office_id=018&mode=search&query=SK&page=3
,"신종 코로나바이러스 감염증(코로나19)으로 폐렴이 생긴 국내 환자를 대상으로 SK케미칼의 항응고제 후탄을 사용하는 임상시험이 시작됐다.20일 식품의약품안전처에 따르면 배인규 경상대병원 감염내과 교수 등은 지난 17일 코로나19 폐렴 환자에게 SK케미칼의 후탄을 사용하는 연구자 임상시험 계획을 승인받았다.경상대병원을 포함해 경북대병원, 서울의료원, 단국대병원, 부산대병원, 양산부산대병원 등 6개 병원에서 84명의 환자에게 임상시험을 진행할 계획이다.대상환자는 코로나19에 감염돼 폐렴이 확인된 지 3일이 지나지 않은 성인 환자다. 이들 중 42명은 후탄 주사제를 수액과 함께 24시간 동안 투여한다. 대조군은 인간면역결핍바이러스(HIV) 치료제인 칼레트라 등을 활용해 표준치료를 한다.후탄은 SK케미칼이 2005년 일본 토리이로부터 도입해 국내에 처음 소개한 혈액 항응고제다. 췌장염 환자 치료 등에 사용되는 이 약은 14년 간 국내서 1257만 병 판매됐다. 2010년 이후 10년 연속 국내 매출 100억원을 기록한 스테디셀러다.후탄의 성분명은 나파모스탯이다. 일본 도쿄대 연구팀은 지난달 이 성분이 코로나19 바이러스가 세포에 침투하는 것을 막아준다는 내용의 연구 결과를 발표했다.이지현 기자 bluesky@hankyung.com▶ ▶
 ▶
ⓒ 한국경제 & , 무단전재 및 재배포 금지",/news/news_read.nhn?article_id=0004327415&office_id=015&mode=search&query=SK&page=3
코로나19發 유동성 위기에 다양한 자구책 마련,"[아이뉴스24 황금빛 기자] 대한항공이 신종 코로나바이러스감염증(코로나19) 사태로 인한 유동성 위기를 극복하기 위해 유상증자 검토를 비롯해 처음으로 선불 항공권 판매를 시작했다.20일 업계에 따르면 대한항공이 5천억 원에서 최대 1조 원 규모의 일반 공모 유상증자를 추진하고 있는 것으로 전해졌다.대한항공 관계자는 ""유동성 확보 차원에서 유상증자를 비롯해 다양한 것을 검토하고 있을 뿐 아직 확정한 것은 없다""고 밝혔다.이는 대한항공이 현재 코로나19 사태로 직격탄을 맞으면서 조만간 보유 현금이 소진될 수 있다는 점이 작용한 것으로 풀이된다.대한항공이 지난달 30일 발행한 6천억 원 규모의 항공운임채권 자산유동화증권(ABS)은 이달 말 모두 소진될 것으로 알려졌다. 하지만 하늘길이 막혀 추가 발행도 어려운 상황이다. 이러한 가운데 대한항공은 매달 고정비로 6천 억 원 가량이 발생하고 있고, 4월 만기가 도래하는 회사채만 2천400억 원 수준이다.유승우 SK증권 연구원은 ""대한항공의 유상증자는 당장 올 2분기와 3분기 만기가 도래하는 사채, ABS, 리스 물량을 상환하고 이자 비용을 충당하는데 단비가 될 것""이라고 평가했다.이와 함께 정부의 지원을 이끌어낼 수 있는 자구책이 될 수 있을 것이란 해석도 나온다.여기에 앞서 대한항공은 지난 17일부터 선불 항공권 판매도 시작했다. 대한항공에서 선불 항공권이 나온 것은 처음이다. 이 또한 유동성 확보 차원으로 해석되고 있다.해당 항공권은 5월 31일까지 판매하는데 출발 가능 기간은 7월 1일부터로 유효 기간은 구매일로부터 2년이다. 국제선 전 노선에 사용 가능하며 전 등급 사용 가능하다. 100만 원, 300만 원, 500만 원 권으로 구매가 가능한데 10%에서 15%까지 운임 할인 혜택을 제공한다.항공업계에서는 그간 선불 항공권은 아니지만 저비용항공사(LCC)들 가운데 유동성 확보 차원에서 무제한 항공권을 판매한 적 있다. 최근에는 코로나19 사태에 신생 LCC 플라이강원이 무제한 항공권인 인피니 티켓을 출시한 바 있다.황용식 세종대학교 경영학부 교수는 ""현재 위기는 대한항공 60년 역사상 처음 겪는 위기다""면서 ""그만큼 대한항공이 힘들다는 것을 방증하는 것이고, 유동성 확보 차원에서 고육지책이라고 할 수 있다""고 설명했다.한편 대한항공은 코로나19 영향으로 여객 수요가 지난 3월 전년동월대비 83%나 줄어들었다. 1분기 영업손실은 2천400여 억 원에 이를 것으로 전망되고, 올해 연간기준 영업손실이 9천892억 원을 기록할 것으로 추정된다. 이에 대한항공은 10월 15일까지 6개월 간 휴업에 들어가기로 한 상태다. gold@inews24.com [ⓒ 아이뉴스24 무단전재 및 재배포 금지]",/news/news_read.nhn?article_id=0000535023&office_id=031&mode=search&query=SK&page=3
"알파룸 활용 취미공간, 실내 환기시스템 등 갖춘 신규 단지 경쟁률↑","[아이뉴스24 김서온 기자] 코로나19 여파로 집에 머무는 시간이 늘어나면서 공간 활용에 대한 수요자들의 관심도 높아지고 있다. 집 안에서 근무와 자녀 학습, 취미활동 등을 모두 할 수 있는 이른바 '올인룸(All in room)' 현상이 확산되면서 주택시장도 다양한 특화 설계를 적용한 단지들이 인기를 끄는 모습이다.20일 부동산업계에 따르면 피데스개발은 지난해 12월 '2020~2021 주거공간 7대 트렌드' 중 하나로 '올인룸'을 꼽았다. 집 근처에서 다양한 생활 인프라를 누리는 '올인빌(All in vill)'을 넘어 내 방이 일하고, 쇼핑하고, 즐기는 만능공간이 된다는 의미다.이러한 현상들은 주택시장에도 영향을 미칠 전망이다. 예컨대 자녀를 위한 학습공간이나 사무실로 활용할 수 있는 알파룸, 또는 실내에서 정원을 가꾸며 취미생활을 할 수 있는 홈가든 등을 적용한 단지들의 인기가 예상된다. 나아가 실내 공기질을 개선시키는 환기설비나 보다 편리한 생활이 가능한 첨단 시스템 등도 필수품목으로 손꼽힌다.특화설계를 적용한 아파트들은 수요자들에게 높은 호응을 얻고 있다. 지난 2월 경기도 수원시에서 분양한 '매교역 푸르지오 SK뷰'는 전용면적 84㎡에 알파룸을 적용해 서재나 학습공간, 또는 수납공간 등으로 활용할 수 있게 했으며 침실1, 2 통합옵션을 무상으로 제공했다. 커뮤니티에는 회의실, 작은도서관, 독서실, 실내체육관 등을 마련해 단지 내에서 근무나 공부, 취미생활 등이 가능하다. 단지는 1순위 청약통장 15만6천505개가 몰렸으며, 평균 145.72대 1의 경쟁률을 기록했다.지난 3월 인천시 부평구에서 분양한 '힐스테이트 부평'의 경우 전용면적 84㎡에 알파룸이 적용돼 다양한 공간활용이 가능하다. 커뮤니티 내에 H아이숲과 상상도서관 등을 조성했다. 이밖에 환기장비에 공기청정기급 헤파(HEPA)필터를 적용해 실내 공기질에 신경 썼으며, 단지내 산책로를 조성해 건강한 생활이 가능하게 했다. 단지는 1순위 평균 84.29대 1의 높은 경쟁률을 기록했다.지방도 마찬가지다. 지난달 부산시 해운대구에서 분양한 '쌍용 더 플래티넘 해운대' 전용면적 84㎡A, B타입에 현관 팬트리와 복도 팬트리를 적용해 취미생활을 위한 물건들을 보관할 수 있게 공간을 마련했다. 또 2개의 팬트리를 하나로 합칠 수 있는 옵션을 무상으로 제공해 부피가 큰 물건도 보관할 수 있게 했다. 여기에 스마트폰, 태블릿PC 등을 이용해 전자책을 빌려 읽을 수 있는 시스템을 마련해 집 안에서 독서를 즐길 수 있다. 단지는 1순위 평균 226.45대 1의 경쟁률을 기록했다.올인룸 단지 인기가 높아지고 있는 가운데, 신규 분양을 앞둔 올인룸 아파트에 수요자들의 관심이 쏠리고 있다.현대건설은 이달 대구광역시 중구 동인동1가 일원에서 '힐스테이트 동인 센트럴'을 분양할 예정이다. 전 주택형에 현관창고(일부 타입 제외), 침실 반침장, 안방 드레스룸 등이 적용돼 넉넉한 수납공간을 자랑한다. 공기청정기급 헤파(HEPA)필터를 환기장비에 적용했으며, 천장형 시스템 에어컨에 공기청정기능이 추가된 유상옵션을 제공해 실내 미세먼지를 저감시킬 수 있어 깨끗한 실내 환경을 유지할 수 있다. 단지는 지하 4층~지상 최고 49층, 3개동, 아파트 전용면적 84~177㎡ 410세대, 오피스텔 전용면적 84㎡ 90실 등 500세대로 구성된다.반도건설은 내달 경상남도 창원시 사파지구 공1블록 일원에서 '성산 반도유보라 아이비파크'를 분양한다. 세대 내 팬트리, 알파룸, 가변형벽체, 안방서재 등 특화 설계가 적용돼 다양한 공간 활용이 가능하다. 또 미세먼지 저감시스템, 워터파크, 첨단인공지능 IOT 등 다양한 커뮤니티 시설도 들어선다. 단지는 지하 3층~지상 15층, 17개동, 전용면적 55~86㎡ 1천45가구로 구성된다.호반건설은 지난 17일 경기도 시흥시 시화 멀티테크노밸리(MTV) 공동2블록에 선보이는 '호반써밋 더 퍼스트 시흥'의 사이버 견본주택을 개관하고 분양에 나섰다. 세대 내부에 가변형 벽체를 적용해 라이프스타일에 맞춰 공간을 다양하게 구성할 수 있다. 주방 가구는 가사 동선을 배려해 배치되며 일부 세대에 주방 팬트리 등 수납공간이 제공된다. 커뮤니티 시설에는 피트니스 센터와 실내골프연습장, 주민카페, 독서실 등이 조성된다. 단지는 지하 2층~지상 29층, 6개동, 전용 59~84㎡, 578가구로 구성된다.중흥토건은 부산광역시 사상구 덕포1구역 주택재개발사업을 통해 ‘사상 중흥S-클래스 그랜드센트럴'을 분양 중이다. 일부 세대에 드레스룸과 팬트리가 적용돼 넉넉한 수납공간을 자랑한다. 커뮤니티로는 독서실, 피트니스센터, 키즈카페와 휴게실, 실내체육관, 실내골프연습장 등이 조성돼 단지 내에서 다양한 취미활동을 할 수 있다. 단지는 지하 3층~지상 최대 38층, 14개동, 전용 39~99㎡ 1천572세대 규모로 구성된다. summer@inews24.com [ⓒ 아이뉴스24 무단전재 및 재배포 금지]",/news/news_read.nhn?article_id=0000535025&office_id=031&mode=search&query=SK&page=3
"- 수도권 부동산 규제 탓에 인천으로 투자·수요자 몰려- 인천 서구에서 3.3㎡당 2,000만원 넘는 단지들도 등장","훈풍이 불고 있는 인천 부동산 시장이 서구의 대형 개발호재를 업고 날아오를 전망이다.한국감정원이 발표한 전국 아파트 거래량 자료에 따르면 지난 1월과 2월 인천에서 이뤄진 아파트 거래는 각각 1만 8,841건, 1만 3,637건으로, 자료수집이 시작된 지난 2006년 12월부터 지금까지 가장 높은 수치를 기록한 것으로 확인됐다.전국 기준 각 시도별로는 28시 3군으로 구성된 경기도가 9만 1,460건으로 가장 높았으며, 그 뒤를 서울(3만 4,060건)과 인천(3만 2,478건)이 나란히 차지했다. 거래량이 역대 최고 수준을 기록한 인천은 매매가도 꾸준한 상승세를 이어가고 있다. 한국감정원이 16일 발표한 주간 아파트 가격 동향에 따르면 인천은 0.21%의 집값 상승률을 기록하며 전국에서 가장 높은 상승세를 보였다.뜨거운 인천 부동산 시장과는 달리 서울 집값은 지난 2·20 부동산 대책의 영향으로 시세보다 4~5억 원 낮게 거래되면서 지난주 낙폭(-0.04%)보다 커진 -0.05% 하락하며 연속 3주 하락세를 보였다. 그 동안 꾸준히 상승하던 강남구와 서초구, 송파구와 강동구도 하락폭이 확대됐다. 전문가들은 인천 부동산 시장이 활황세를 이어가는 것은 서울 전역과 수도권 인기 지역에 정부의 부동산 규제가 거듭 되면서 대출 규제와 보유세 및 양도소득세 부담 등으로 매수심리가 꽁꽁 얼어붙으며 수요자들이 인천으로 눈을 돌렸기 때문인 것으로 분석했다.실제 신규 분양 사업지들은 청약성적도 우수해 눈길을 끌고 있다. 인천 서구의 경우 올해 총 4개 단지에서 청약을 접수해 전체 단지가 1순위에서 청약을 마감했다. 특히 4월 들어 분양에 나섰던 검단신도시우미린에코뷰와 인천검단신도시3차노블랜드리버파크는 각각 27.21대 1과 13.46대 1로 두 자리 수 경쟁률을 기록하며 흥행에 성공했다. 특히 이 단지들에서는 서울 인기 단지와 맞먹는 수준인 69점, 74점짜리 청약 통장(만점 84점)이 등장해 눈길을 끌었다. 실제로 강남 현금부자들이 청약에 몰렸던 ‘르엘신반포’는 청약 당첨가점이 최저 62점에서 최고 74점이었던 것으로 나타났다. 각종 규제로 반사이익을 얻고 있는 인천에서도 서구는 가장 잠재력이 높은 지역으로 평가 받고 있다. 인천 서구는 인천 2호선 연장, 인천공항철도와 지하철 9호선 직결화, 공항철도 고속화 등 다양한 철도 교통망 개선사업을 통해 서울 접근성이 대폭 개선될 전망이다.특히 교통호재의 영향권에 있는 검단·검암·루원시티·청라 등에 자리하고 있는 아파트 단지들에는 지난해 3월 대비 1년 동안 억대 프리미엄이 붙는 단지가 속출했다.검암동에 자리하고 있는 검암서해그랑블은 전용면적 70㎡ 기준 약 1억 1,000만 원 올라 3.3㎡당 1,640만 원대의 매매가를 기록한 것으로 나타났다. 루원시티에서는 루원시티SK리더스뷰 전용 75㎡가 지난 2월 5억 9,550만 원대에 실거래되면서 3.3㎡당 평균 1,980만원 선을 기록했다. 청라국제도시와 검단도 실거래가가 꾸준히 오름세를 유지하고 있다. 대우건설이 청라동에 공급한 청라푸르지오는 약 2억 4,000만원 가량(전용면적 95㎡ 기준)이 뛰어 3.3㎡당 가격은 2,100만원대에 형성된 것으로 나타났으며, 서구 당하동에 들어선 검단SK뷰에도 6,600여 만 원의 웃돈이 형성됐다. 이처럼 최근 들어 급격한 상승세를 기록하면서 잠재력이 높은 지역으로 평가 받고 있는 인천 서구는 지난 1월 ‘2040 서구 장기도시발전계획 수립 용역’, 2월 ‘스마트에코시티 조성 수립 용역’ 등이 시작돼 본격적인 개발 사업에 돌입했음을 알리며 기대감을 더했다.인천시 서구에서 발표된 2040 서구 장기도시발전계획에 따르면 서구는 인천 2호선 역세권(검암역, 서구청역, 석남역 등)과 경인고속도로 주변 지역에 대한 균형 발전계획과 함께 검암·검단·청라·가정·루원 등 신도심 발전 계획을 마련해 토지이용계획, 기반시설, 도심·주거환경, 환경보전·관리, 공원·녹지 등 총 9가지 분야의 정비계획을 수립할 계획이다. 또한, 서구 스마트 에코시티와 관련해 세어도, 경인아라뱃길 등 자원부문의 강점을 접목시켜 생태·문화·관광벨트 조성 방안을 함께 검토할 방침이다.이러한 긍정적인 평가 속에 부동산 전문가들은 “코로나19 등의 영향으로 연기됐던 신규 아파트 분양이 2분기에 쏟아질 것”이라며 “2분기 분양 성적에 따라 올해 분양시장의 흐름이 결정될 것”이라고 말했다. 한편, 부동산114의 신규 분양 물량 자료에 따르면 2분기 서울을 제외한 수도권 아파트 일반 분양 예정 물량은 총 4만여 가구로 확인됐다. 이 중 인천시 서구에는 5개 단지, 6,960가구가 분양을 준비하고 있으며, 1,000가구 이상 매머드급 아파트도 공급될 예정이다.한경부동산 hkland@hankyung.com▶ ▶
 ▶
ⓒ 한국경제 & , 무단전재 및 재배포 금지",/news/news_read.nhn?article_id=0004327419&office_id=015&mode=search&query=SK&page=2
