head,text,url
스위스 ID Quantique사와…세계 1위 양자암호통신 기업,"[아이뉴스24 문병언 기자] QRNG는 5G시대 최고의 보안 기술로 알려진 양자암호통신에서 가장 중요한 핵심기술이다. 해킹이 원천적으로 불가능한 암호키를 만들기 위해 불규칙한 난수 패턴을 생성하는 칩 솔루션이다.아이에이네트웍스는 QRNG 칩을 초소형으로 패키징할 수 있는 특허기술을 보유하고 있다. 2017년부터 현재까지 통신보안 암호화 센서에 적합한 소형 모듈 디자인 연구개발을 진행해왔으며 최근 ID Quantique과 양산 제품에 대한 기술 검증을 마쳤다.ID Quantique은 2018년 2월 SK텔레콤이 투자한 스위스의 양자암호통신 전문기업이다. 양자암호통신 관련 매출 및 특허 보유 세계 1위 업체다. 유럽연합의 양자암호 시험망 구축사업에 QKD(양자키분배기) 최대 공급사로 참여하는 등 QKD, QRNG를 중심으로 양자암호통신 핵심 기술을 고도화하고 있다.아이에이네트웍스와 ID Quantique 양사는 이번 MOU를 시작으로 아이에이네트웍스의 특허기술인 ‘NeoPAC 3D Thin 모듈’을 이용한 QRNG 개발 및 위탁생산에 대한 포괄적 협력을 구체화하기로 했다.ID Quantique는 아이에이네트웍스의 패키징 기술을 적용한 QRNG 신제품을 개발하고 적극적으로 시장개척에 나설 예정이며, 아이에이네트웍스는 해당제품의 성공적인 상용화를 위해 대량생산에 나설 계획이다.아이에이네트웍스 관계자는 “3년간의 선제적인 연구개발을 통해 초소형 QRNG 칩 개발을 위한 기술력과 요구사양을 갖췄다”며 “양사의 기술협력을 통해 현존 가장 작은 크기의 QRNG 칩을 양산 및 상용화할 수 있을 것으로 기대한다”고 말했다. moonnuri@inews24.com [ⓒ 아이뉴스24 무단전재 및 재배포 금지]",/news/news_read.nhn?article_id=0000527629&office_id=031&mode=search&query=SK&page=10
,"이미지센서 패키징 전문기업 아이에이네트웍스는 SK텔레콤 투자사인 세계 1위 양자암호통신 기업 ID Quantique과 초소형 QRNG(양자난수생성기) 양산 개발을 위한 업무협약(MOU)를 체결했다고 2일 밝혔다.QRNG는 5G시대 최고의 보안 기술로 알려진 양자암호통신에서 가장 중요한 핵심기술이다. 해킹이 원천적으로 불가능한 암호키를 만들기 위해 불규칙한 난수 패턴을 생성하는 칩 솔루션이다.아이에이네트웍스는 QRNG 칩을 초소형으로 패키징할 수 있는 특허기술을 보유하고 있다. 2017년부터 현재까지 통신보안 암호화 센서에 적합한 소형 모듈 디자인 연구개발을 진행해왔으며 최근 ID Quantique과 양산 제품에 대한 기술 검증을 마쳤다.ID Quantique은 2018년 2월 SK텔레콤이 투자한 스위스의 양자암호통신 전문기업이다. 양자암호통신 관련 매출 및 특허 보유 세계 1위 업체다. 유럽연합의 양자암호 시험망 구축사업에 QKD(양자키분배기) 최대 공급사로 참여하는 등 QKD, QRNG를 중심으로 양자암호통신 핵심 기술을 고도화하고 있다.아이에이네트웍스와 ID Quantique 양사는 이번 MOU를 시작으로 아이에이네트웍스의 특허기술인 'NeoPAC 3D Thin 모듈'을 이용한 QRNG 개발 및 위탁생산에 대한 포괄적 협력을 구체화하기로 했다. ID Quantique은 아이에이네트웍스의 패키징 기술을 적용한 QRNG 신제품을 개발하고 적극적으로 시장 개척에 나설 예정이며, 아이에이네트웍스는 해당제품의 성공적인 상용화를 위해 대량 생산에 나설 계획이다.아이에이네트웍스 관계자는 ""3년간의 선제적인 연구개발을 통해 초소형 QRNG 칩 개발을 위한 기술력과 요구사양(사이즈 및 신뢰성 기준)을 갖췄기 때문에 ID Quantique과 적시에 사업 협력을 진행할 수 있었다""며 ""양사의 기술 협력을 통해 현존 가장 작은 크기의 QRNG 칩을 양산 및 상용화할 수 있을 것으로 기대한다""고 말했다.이어 ""사업에 속도를 내기 위해 ID Quantique과 TF팀(태스크포스)을 구성해 지속적인 논의를 진행하고 있다""며 ""양자암호통신 시장이 연평균 40%씩 크게 성장하고 QRNG 칩이 스마트폰 외에도 자율주행차 등 다양한 커넥티드 디바이스에 폭넓게 적용됨에 따라 시장 성장에 따른 관련 사업에 대한 기대가 높다""고 덧붙였다.[디지털뉴스국 김경택 기자] [ⓒ 매일경제 & mk.co.kr, 무단전재 및 재배포 금지]",/news/news_read.nhn?article_id=0004527798&office_id=009&mode=search&query=SK&page=9
,"2019년에만 약 60여개 매장이 신규 오픈. 만 3년이 되지 않은 시점에 150여개의 매장을 확보, 백화점 3사 등 국내 주요 유통 채널에 대거 입점. 3년 여 만에 매출액 1200억원 돌파 확실시(2019년 기준). 스포츠 브랜드 ‘다이나핏’의 성장세를 보여주는 지표다. 다이나핏은 K2, 아이더, 와이드앵글 등으로 유명한 K2코리아가 2015년 독일 오버알프그룹과 국내 라이선스 계약을 체결, 본격적으로 전개한 브랜드다. 국내에서는 생소할 만한데 론칭 3년 만에 연매출 1000억원을 가뿐하게 넘어설 만큼 성장했다.

 ▷운동 마니아·전문가에게 어필 소셜미디어(SNS)에서 ‘#다이나핏’을 검색하면 헬스트레이너, 요가·피트니스 강사 등 전문가 혹은 실내 운동을 즐기는 마니아 영상이나 이미지가 주로 뜬다. 상당수가 2030세대다. 다이나핏은 이처럼 초기에는 전문가용 기록 향상 중심의 러닝·트레이닝 제품으로 인정받았다. 애초 이들을 타깃 삼아 확실한 주력 상품을 선정하고 최고급 소재와 젊은 디자인을 적용했다. 가격은 프리미엄대로 설정했다. 다이나핏 관계자는 “ ‘러닝크루(달리기 동호회)’ ‘운동하는_여자’ 같은 해시태그가 유행일 정도로 전문성을 띠는 운동 커뮤니티가 늘어나고 있다. 관련 트레이너, 리더도 각광받는 상황을 고려해서 이들을 1차 타깃으로 종전 브랜드 대비 기능성·품질을 대폭 향상시킨 제품으로 접근했더니 점차 그들의 폴로어까지 범위를 확장하면서 이들에게 전문 브랜드로 인식됐다”고 소개했다. ‘아이돌 트레이너’로 유명한 박엄지 강사는 “다양한 글로벌 브랜드 제품과 견줘도 뒤지지 않는 품질 덕분에 다이나핏 제품을 입은 채로 SNS에 과시하는 젊은 회원도 많이 있을 정도로 인기”라고 말했다. 베스트셀러인 트레이닝 슈트를 비롯, 요가·피트니스복 부문에서 다이나핏이 선전하면서 운동을 막 시작한 이들과 마니아 사이에 다이나핏이 몸매 과시용 ‘대세템’으로 자리매김하는 분위기다.

 ▷출시 첫해부터 TV 광고 집행
마케팅에 대한 과감한 투자도 급성장에 일조했다. 다이나핏은 초기부터 지금까지 TV를 중심으로 한 광고 캠페인을 진행해왔다. 또한 브랜드 아이덴티티를 부각시키기 위해 ‘더 스트롱맨 : 짐승들의 대결’ ‘다이나핏 파이어볼러 챔피언십’ 등 스포츠를 매개로 한 브랜디드 콘텐츠 프로그램을 기획·제작했다. 이를 2030세대가 익숙한 소셜미디어에 전개하면서 타깃 마케팅에도 성공했다. 브랜드 전개 초창기에는 인지도가 떨어진다는 점을 감안해 스포츠 마케팅에도 대대적인 공을 들였다. 국내 단일 프로스포츠 사상 최대 금액으로 프로야구단 SK와이번스와 대규모 스폰서십 계약을 체결한 것이 대표적이다. 적극적인 스포츠 후원을 통해 브랜드에 대한 호감을 높이고 자연스럽게 충성도 높은 잠재 고객을 확보한 점이 긍정적으로 작용했다는 평이다.김찬무 SK와이번스 고객가치혁신본부장은 “많은 팬에게 사랑받는 프로야구 구단을 직접 후원하면서 스포츠를 보고 즐기는 대중을 대상으로 한 직간접적인 홍보 효과를 노렸는데 구단 팬은 물론 일반 고객에게도 호감도가 올라간 것으로 파악된다”고 말했다. 박재명 HS애드 수석국장은 “TV, 디지털, 스포츠 마케팅 활동들은 신생 브랜드가 시장에서 빠르게 자리 잡을 수 있는 발판이 됐고 소비자들에게도 소위 ‘네임드(브랜드명 인식)’로 단기간에 자리매김하는 원동력이 됐다”고 분석했다.

 ▷150개 매장·노세일 전략도 한몫
아무리 브랜드가 많이 노출돼도 주위에서 쉽게 살 수 있어야 매출이 따른다. 특히 스포츠 브랜드는 소비자가 커뮤니티에 가입할 수 있는 경로가 쉽고 다양한 게 성장에 유리하다.이를 위해 다이나핏은 공격적인 유통망 확대에 힘을 쏟았다. 2019년에만 약 60여개 매장이 신규 오픈하며 만 3년이 되지 않은 시점에 150여개의 매장을 확보했다. 또 백화점 3사 등 국내 주요 유통 채널에 대거 입점했다. 젊은 층 호감도가 높은 온라인 플랫폼 역시 적극 공략했다. 지난해 11월 국내 대표 온라인 패션 스토어 무신사와 손을 잡은 게 대표적인 사례다.다이나핏 관계자는 “소비자 선호도를 파악해 무신사에는 브랜드 전체 상품 중 단 75개의 상품만 선별해 입고했다. 상대적으로 연령대가 낮은 타깃층의 소비 성향을 고려해 합리적인 가격대 제품 위주로 구성해 큰 호응을 얻었다”고 전했다. 최근에는 ‘스타일쉐어’에도 들어갔다. 이곳에서 고객은 직접 활발한 정보 수집을 통해 여러 스타일링 방법을 고민하고 직접 구매까지 할 수 있다.더불어 다이나핏은 ‘노세일’ 전략으로 차별화했다. 이 전략이 먹히면서 2018년부터 흑자 행진을 계속하고 있다. 회사 관계자는 “장기적인 관점에서 브랜드의 가치 보존과 지속적인 성장을 고민했을 때 꼭 필요한 부분이라 판단했다. 이는 소비자뿐 아니라 다이나핏 점주와 유통계에서 브랜드의 신뢰도를 높이는 계기가 됐다”고 말했다. ▶약점은 없나
▷지나친 오프라인 중심 매출은 흠 브랜드 인지도가 쌓이며 다이나핏은 올해 매출액 목표치를 2000억원으로 올려 잡았다. 하지만 최근 코로나19 여파로 스포츠 활동이 위축된 데다 나이키, 아디다스, 휠라 등 기존 브랜드의 확장세와도 싸워야 해 상황이 마냥 쉽지만은 않다고. 애초 오프라인 유통망 중심 영업을 해 온라인 판매 비중이 5%대에 불과한 것도 넘어야 할 산이다.더불어 다이나핏의 핵심 타깃이 MZ세대인데 스트리트 패션 등 이종 브랜드와 경쟁 구도가 형성될 수 있다는 점도 변수다. 간호섭 홍익대 교수는 “스포츠와 라이프스타일의 경계가 허물어지며 기능성 웨어 등 빼앗길 수 있는 영역도 발생할 수 있다. 무신사 등 디지털 기반의 유통업체는 물론 SPA 브랜드, DTC(소비자직접판매) 브랜드와 경쟁구도로 간다는 것은 영역 없는 전쟁이자 변수일 수 있다”고 분석했다. [박수호 기자
suhoz@mk.co.kr] [본 기사는 매경이코노미 제 2047호 (2020.02.26~2020.03.03일자) 기사입니다] [ⓒ 매일경제 & mk.co.kr, 무단전재 및 재배포 금지]",/news/news_read.nhn?article_id=0000064700&office_id=024&mode=search&query=SK&page=9
,"[머니투데이 김소연 기자] SK하이닉스가 7거래일만에 반등해 9만원을 회복했다. 2일 오전 9시9분 SK하이닉스는 전일대비 2200원(2.50%) 오른 9만100원을 나타내고 있다. 낙폭이 과도하다고 인식한데 따른 것으로 풀이된다. SK하이닉스는 외국인 매도세로 증시가 급락한 지난 24~28일간 주가가 10만3000원에서 8만7900원까지 14% 넘게 급락했다.
김소연 기자 nicksy@
<저작권자 ⓒ '돈이 보이는 리얼타임 뉴스' 머니투데이, 무단전재 및 재배포 금지>",/news/news_read.nhn?article_id=0004367246&office_id=008&mode=search&query=SK&page=9
"삼성전자 0.55%, SK하이닉스 1.59%코스닥도 상승 출발","[서울경제] 코스피가 2일 나흘 만에 상승으로 출발했다. 이날 오전 9시 3분 코스피는 전 거래일 보다 8.14포인트(0.41%) 상승한 1,995.15를 기록했다. 코스피는 10.02포인트(0.50%) 오른 1,997.03으로 장을 시작했다. 유가증권시장에서 기관이 373억원 규모를 순매수했고 개인도 316억원 규모를 사들였다. 반면 외국인은 692억원 규모를 순매도했다. 시가총액 상위 종목 중에서는 삼성전자 0.55%, SK하이닉스 1.59%, 삼성전자우 1.43%, 삼성바이오로직스 0.76%, NAVER 0.57%, LG화학 1.09% 등이 상승을 기록 중이다.
같은 시각 코스닥 지수도 7.27포인트(1.19%) 상승한 618.00을 가리켰다. 코스닥도 7.15포인트(1.17%) 오른 617.88로 장을 시작했고 강세를 이어가는 중이다. 코스닥 시장에서는 외국인이 90억원 규모를 사들였고 기관이 28억원 규모를 순매수했다. 반면 개인은 116억원 규모를 순매도했다.시총 상위 종목 가운데 셀트리온헬스케어 1.39%, 에이치엘비 1.14%, CJ ENM 1.75%, 펄어비스 0.68%, 스튜디오드래곤 0.81% 등의 오름폭을 기록 중이다.한편 이날 서울 외환시장에서 원달러 환율은 전 거래일보다 8.7원 내린 1,205.0원으로 장을 시작했다. /이완기기자 kingear@sedaily.com저작권자 ⓒ 서울경제, 무단 전재 및 재배포 금지",/news/news_read.nhn?article_id=0003702915&office_id=011&mode=search&query=SK&page=9
,[이데일리 박태진 기자] 아이에이네트웍스(123010)가 SK텔레콤 투자회사인 세계 1위 양자암호통신 기업 ID Quantique과 협업에 들어간다는 소식에 상승세다.마켓포인트에 따르면 2일 오전 9시 12분 현재 아이에이네트웍스는 전 거래일 대비 4.19% 오른 4600원에 거래되고 있다.아이에이네트웍스는 ID Quantique와 초소형 QRNG(양자난수생성기) 양산 개발을 위한 업무협약(MOU)를 체결했다고 이날 밝혔다. QRNG는 5G시대 최고의 보안 기술로 알려진 양자암호통신에서 가장 중요한 핵심기술이다. 해킹이 원천적으로 불가능한 암호키를 만들기 위해 불규칙한 난수 패턴을 생성하는 칩 솔루션이다.아이에이네트웍스와 ID Quantique 양사는 아이에이네트웍스의 특허기술인 ‘NeoPAC 3D Thin 모듈’을 이용한 QRNG 개발 및 위탁생산에 대한 포괄적 협력을 구체화하기로 했다. ID Quantique은 아이에이네트웍스의 패키징 기술을 적용한 QRNG 신제품을 개발하고 적극적으로 시장 개척에 나설 예정이다. 또 아이에이네트웍스는 해당제품의 성공적인 상용화를 위해 대량 생산에 나선다는 계획이다.박태진 (tjpark@edaily.co.kr) | ＜ⓒ종합 경제정보 미디어 이데일리 - 무단전재 & 재배포 금지＞,/news/news_read.nhn?article_id=0004587435&office_id=018&mode=search&query=SK&page=9
,"코스피 지수가 개인과 기관 매수세에 1990대 강세로 출발했다.2일 코스피 지수는 전 거래일 보다 11.1포인트(0.56.65%) 오른 1998.12에 거래를 출발했다. 개인과 기관은 각각 565억원과 358억원 순매수를, 외국인은 941억원 순매도 중이다. 
시총 상위종목에서는 현대차를 제외하고 모두 상승세를 나타냈다. 삼성전자(+10.55%), SK하이닉스(+2.16%), NAVER(+0.57%), LG화학(+1.09%), 삼성SDI(+1.19%) 등이 상승세를 나타내는 중이다. 
코스닥 지수는 전 거래일 보다 10.09포인트(1.65%) 상승한 620.82에 장을 출발했다. 개인은 218억원 순매도, 외국인은 163억원 순매수, 기관은 68억원 순매수 중이다. 
코스닥 시가총액 상위종목도 모두 상승세를 나타냈다. 셀트리온헬스케어(+0.15%), 메디톡스(+2.21%), CJ ENM(+1.75%), 스튜디오드래곤(+1.49%), 에이치엘비(+1.35%), 펄어비스(+1.07%), 케이엠더블유(+0.92%), 에코프로비엠(+2.09%) 등은 상승세를 보이고 있다.송창범 기자
 <저작권자 ⓒ '성공을 꿈꾸는 사람들의 경제 뉴스' 머니S, 무단전재 및 재배포 금지>",/news/news_read.nhn?article_id=0000511782&office_id=417&mode=search&query=SK&page=9
,"신종 코로나바이러스 감염증(코로나19) 공포에 지난 주 8.1% 폭락한 코스피지수가 상승 출발했다. 지난 달 25일 이후 4거래일만이다. 저가매수세가 유입되고 있는 것으로 풀이된다.2일 오전 9시5분 현재 코스피지수는 전거래일보다 11.15포인트(0.56%) 오른 1998.16에 거래되고 있다. 이날 1997.03에 상승 출발한 지수는 개장 이후 등락을 거듭하고 있다. 외국인은 900억원의 순매도고, 개인과 기관은 각각 564억원과 323억원의 매수 우위다.시가총액 상위권 종목들 모두 상승세다. 삼성전자 SK하이닉스 삼성바이오로직스 네이버 LG화학 셀트리온 LG생활건강 등이 오르고 있다. SK하이닉스의 경우 2%대 상승세를 기록 중이다. 현대모비스 SK텔레콤의 전거래일 보다 각각 4.76%, 0.24% 내려 거래되고 있다.코스닥지수 역시 오르고 있다. 같은 시간 코스닥지수는 전날보다 8.91포인트(1.46%) 상승한 619.64에 거래되고 있다. 외국인과 기관이 각각 164억원, 402억원 사들이고 있다. 개인은 217억원 팔고 있다.원·달러 환율은 하락 중이다. 서울외환시장에서 원·달러 환율은 전날보다 9.5원 내린 1204.2원에 거래되고 있다.윤진우 한경닷컴 기자 jiinwoo@hankyung.com▶ ▶
 ▶
ⓒ 한국경제 & , 무단전재 및 재배포 금지",/news/news_read.nhn?article_id=0004299224&office_id=015&mode=search&query=SK&page=9
외국인 6거래일째 매도 지속 와중 개인·기관 동반매수상승 출발하다 곧바로 하락 전환..변동성 커저,"[이데일리 권효중 기자] 2일 코스피 지수가 상승 출발했으나 곧바로 약보합권으로 전환되는 등 변동성이 커진 모습을 보이고 있다. 전 거래일이었던 지난달 28일 3% 넘게 하락하며 1990선 밑까지 내려간 바 있다. 2일 마켓포인트에 따르면 오전 9시 15분 현재 전 거래일보다 1.49포인트, 0.07% 하락한 1985.52에 거래되고 있다. 이날 코스피 지수는 1997선에 개장해 전 거래일보다 0.6% 가량 상승 출발했으나 얼마 못 가 다시 하락세로 전환됐다. 지난 28일(현지시간) 미국 증시는 코로나19에 대한 우려로 인해 하락세를 이어갔다. 지난 한 주간 다우존스 30 산업평균지수가 12.36%, S&P500 지수가 11.49% 떨어지는 등 주요 지수는 금융위기 당시인 2008년 이후 가장 큰 낙폭을 보여준 것이다. 이에 제롬 파월 연방준비제도(연준·Fed) 의장은 “경제를 지지하기 위해 적절한 행동을 할 것”이라고 예정에 없던 긴급 성명을 발표하기도 했다. 또한 중국의 2월 제조업 구매자관리지수(PMI)가 35.7포인트로 금융위기 직후보다 낮은 사상 최저치를 기록하며 코로나19의 영향이 확인됐다는 점 역시 시장의 불안감을 키웠다. 수급별로는 외국인이 901억원을 팔고 있으며 6거래일 연속 매도세를 유지하고 있다. 동반 매수에 나선 개인과 기관은 각각 565억원, 324억원어치를 사들이고 있다. 업종별로는 하락 우위 흐름이다. 의료정밀, 은행 등만 상승세를 보일 뿐 전기가스업, 건설업, 운수창고, 통신업, 서비스업, 운송장비, 철강금속, 기계, 비금속광물 등이 하락하고 있다. 시가총액 상위 종목들도 하락 우세다. 삼성전자(005930)가 0.37% 하락하고 LG화학(051910), 현대모비스(012330), POSCO(005490) 등이 1%대 떨어지고 있다. SK하이닉스(000660), 삼성물산(028260) 등은 1% 미만의 상승세를 보이고 있다.권효중 (khjing@edaily.co.kr) | ＜ⓒ종합 경제정보 미디어 이데일리 - 무단전재 & 재배포 금지＞",/news/news_read.nhn?article_id=0004587443&office_id=018&mode=search&query=SK&page=9
4억5000만달러 계약…전기차 분야 성장 예상,"(서울=뉴스1) 주성호 기자 = SK실트론은 미국 화학·소재기업 듀폰의 '실리콘 카바이드 웨이퍼'(Silicon Carbide Wafer·SiC 웨이퍼) 사업부 인수를 마무리했다고 2일 밝혔다. SK실트론은 SK그룹 계열의 국내 유일 반도체 실리콘 웨이퍼 제조업체다.SK실트론은 지난해 9월 이사회 결의를 통해 4억5000만달러(약 5400억원)에 SiC 웨이퍼 사업부 인수를 결의한 이후 지난달 29일 최종적으로 마무리했다. 회사 관계자는 ""인수 이후에도 관련분야 투자를 지속할 예정""이라며 ""생산량 증대와 미국에서의 추가 고용 창출이 예상된다""고 말했다. SiC 웨이퍼는 고경도, 내전압, 내열 특성을 갖고 있어 전기차, 5G 네트워크 등에 사용되는 전력반도체용 웨이퍼로 주목된다. 최근 자동차 및 전자업체들이 전기차 시장에 앞다퉈 진출하고 있는 상황에서 높은 성장이 예상되는 분야다. SK실트론 측은 ""듀폰이 보유한 R&D 및 생산역량과 기존 주력사업간 시너지를 극대화하는 한편 고성장 영역 진출을 통해 신규 성장 동력을 확보할 수 있을 것으로 기대된다""고 밝혔다.sho218@news1.kr© 뉴스1코리아(), 무단 전재 및 재배포 금지",/news/news_read.nhn?article_id=0004494818&office_id=421&mode=search&query=SK&page=9
"인수금액 5400억원…""관련 분야 투자 지속 예정"" 전기차·5G네트워크 필수부품 SiC 웨이퍼 시장 진출","[서울=뉴시스] 고은결 기자 = 반도체 실리콘 웨이퍼 제조사 SK실트론은 지난해 9월 이사회를 통해 결의한 미국 듀폰사의 실리콘 카바이드 웨이퍼(SiliconCarbide Wafer, 이하 SiC 웨이퍼) 사업부 인수가 지난달 29일
마무리됐다고 2일 밝혔다.인수금액은 4.5억달러(약 5400억원)로, 최근 정부와 사회의 소재기술 자립 요구에 부응하는 기술 투자 차원이라고 회사 측은 설명했다.SK실트론은 인수 이후에도 관련분야 투자를 지속할 예정이며, 이에 따라 SiC 웨이퍼 생산량 증대와 미국 내 추가 고용 창출이 예상된다고 전했다.SiC 웨이퍼는 고경도, 내전압, 내열 특성을 가진 전력반도체용 웨이퍼다. 전력반도체는 자동차 제조사들의 잇단 전기차 시장 진출, 통신 업체의 초고속 5G 보급 확대에 따라 수요가 빠르게 늘고 있다.SK실트론은 이번 인수를 통해 듀폰이 보유한 R&D 및 생산 역량과 주력 사업 간 시너지를 극대화하고, SiC 웨이퍼 시장 진출에 따라 새 성장 동력을 확보할 것으로 기대했다. keg@newsis.com<ⓒ 공감언론 뉴시스통신사. 무단전재-재배포 금지>",/news/news_read.nhn?article_id=0009731204&office_id=003&mode=search&query=SK&page=9
,"[머니투데이 한정수 기자] [[개장 시황]]상승 출발한 코스피 지수가 외국인 매도세에 장중 다시 약보합세로 돌아섰다. 2일 오전 9시15분 현재 코스피 지수는 전 거래일 대비 0.25포인트(0.01%) 떨어진 1986.76을 기록 중이다. 전날대비 10.02포인트(0.5%) 오른 1997.15로 출발하며 반등 장세에 대한 기대감이 커졌으나 10여분 만에 다시 하락세로 돌아서며 보합권에서 치열한 공방을 벌이고 있다. 외국인이 장 초반부터 1350억원에 가까운 순매도를 보이고 있다. 외국인은 지난 5거래일동안 총 3조4543억원 순매도세를 보였다. 하루 평균 6000억원 이상을 판 셈이다. 개인과 기관은 각각 922억, 390억원어치를 사면서 지수를 방어하고 있다. 대부분의 업종이 하락세를 보이고 있다. 통신업과 건설업이 0.8%대 내리고 있다. 화학, 철강 금속 전기가스업 등도 모두 약세다. 장 초반 상승했던 시가총액 상위 10개 종목도 대부분 약보합세로 돌아섰다. 다만 낙폭이 컸던 SK하이닉스가 7거래일만에 반등해 1%대 오름세다. 현대차와 삼성물산도 강보합세다. 코스닥 지수는 4.27포인트(0.7%) 오른 615.00을 나타내고 있다. 외국인과 기관이 각각 160억원, 87억원 매수 우위고 개인은 234억원 매도 우위다. 업종별로도 오락, 문화와 운송 등만 제외하고는 모두 강보합권에서 움직이고 있다. 제약, 인터넷, 반도체가 1%대 이상의 상승률을 보이고 있다. 시가총액 상위 10개 종목은 오름세가 우세하다. 셀트리온헬스케어와 케이엠더블유만 소폭 하락하고 있다. 메디톡스, 에코프로비엠, 휴젤 등은 2%대 상승하고 있다. 한정수 기자 jeongsuhan@
<저작권자 ⓒ '돈이 보이는 리얼타임 뉴스' 머니투데이, 무단전재 및 재배포 금지>",/news/news_read.nhn?article_id=0004367269&office_id=008&mode=search&query=SK&page=9
