head,text,url
■ 취재파일,"▶[송태희 / 앵커]1조 원대 재산분할 요구의 근거인 ‘재산 형성 기여도’ 부분을 집중 분석해보겠습니다.▶[송태희 / 앵커]김동우 기자, 노 관장 주장대로라면 SK그룹 성장의 상당 부분이 노 관장 덕분이었다. 그러니까 노 관장의 아버지인 노태우 전 대통령 덕분이었다, 이런 것 아닙니까?차근차근 살펴보죠.먼저 SK그룹 성장을 시기별로 나눠 볼까요?▷[김동우 / 기자]올해로 창립 67주년을 맞은 SK그룹은 재계 자산 순위 3위인데요.출발은 섬유 사업이었습니다.1973년 창립주, 최종건 회장이 타계하면서 고 최종현 선대회장이 사업을 확장했는데요.그룹이 급성장한 계기는 1980년에 삼성을 제치고, 대한석유공사, 유공을 인수한 것과 1994년 한국이동통신을 인수하며 이동통신 사업까지 진출하고 그리고, 하이닉스를 인수한 것입니다. 이 가운데 유공과 한국이동통신 인수 과정이 이번 재판의 최대 쟁점이 될 것으로 보입니다.▶[송태희 / 앵커]오수영 기자, 그럼 구체적으로 유공 인수 과정부터 살펴보죠.유공은 어떤 회사인지 부터 간략히 짚고 넘어갈까요?▷[오수영 / 기자]'유공'은 선경그룹이 국내 최대 국영에너지 기업 '대한석유공사'를 인수한 후 붙인 새로운 이름입니다. 1980년 인수한 '대한석유공사'는 당시 연매출이 1조 원에 이르는 국내 초대형 공기업이었는데요.한 해 전인 1979년 제2차 석유파동을 계기로 선경은 '대한석유공사'의 새 주인이 됐습니다. ▶[송태희 / 앵커]어떤 과정을 거쳐 유공이 SK의 품에 안기나요?▷[오수영 / 기자]지분과 경영권을 갖고 있던 미국의 걸프(GULF)사가 원유 공급난에 빠지자 갖고 있던 50%의 지분 전체를 팔고 철수하면서, 정부가 민영화를 추진했습니다. 정부는 인수 주체의 최우선 역량으로 '자금 확보 능력'과 '원유공급 능력'을 꼽았는데요.최종현 선대회장은 정유사업에 본격적으로 뛰어들며 쌓아왔던 사우디 왕실, 야마니 석유장관과의 친분을 최대한 활용했습니다.최종현 선대회장은 야마니 장관에게서 하루 5만 배럴 공급 약속을 받으면서 원유공급 능력을 인정받았고, '대한석유공사'를 손에 넣게 된 것이죠. ▶[송태희 / 앵커]그런데 유공 인수와 관련해서 특혜설이 불거지는 이유는 뭔가요?▷[오수영 / 기자]정부가 인수 주체를 발표했을 때 재계의 반응은 ‘새우가 고래를 삼켰다’였습니다.지난 1979년 연매출 3000억 원에 불과했던 선경이 몸집이 3배 이상인 기업을 인수했기 때문인데요. 그래서 일부에서는 인수 당시 신군부의 실세로 전두환 전 대통령에 이어 보안사령관을 역임했던 노태우 전 대통령의 입김이 작용했다는 이야기도 나왔습니다.▷[김동우 / 기자]하지만, SK는 정경유착이 아니라는 입장입니다.당시 강력한 라이벌 이었던 삼성을 제칠 수 있었던 이유는 선경의 안정적인 원유 공급 전략이었다는 거죠. [홍성추 / 재벌평론가 : 그때 당시에, 삼성은 중남미 석유를 들여오겠다는 것이었고, 선경은 중동 석유를 들여오겠다는 것이었고, 이것을, 안정적인 석유를 가져오는 게 어느 쪽이 편할 것이냐, 그리고 또 안정적이냐고 봤을 때 정부의 선택이 중동산 석유가 낫겠다, 이래서 중동산 석유를 선택하면서 선경이 인수하게 된 거죠.]▶[송태희 / 앵커]오수영 기자. 이번에는 당시 선경의 이동통신 사업 진출 짚어 볼까요?▷[오수영 / 기자]시기 먼저 짚어보겠습니다.두 사람은 1988년 결혼했습니다. 그런데 노태우 정부 마지막 해인 1992년, 경제계 최대 관심사였던 제2이동통신 사업자로 선경그룹, 그러니까 현재의 SK그룹이 선정됐습니다.그러자 사돈에 대한 특혜라는 비판 여론이 거셌습니다.여기에 당시 여당 대표이자 유력한 대권후보였던 김영삼 전 대통령까지 가세했습니다.결국 선경그룹은 제2이동통신 사업권을 1주일 만에 반납했습니다.그런데 1993년 김영삼 정부가 들어서고 변수가 생겼습니다.그해 12월 체신부는 미뤄뒀던 제2이동통신사업자 선정과 함께 당시 제1이동통신인 한국이동통신의 민영화를 동시에 추진하겠다는 계획을 발표했습니다.▶[송태희 / 앵커]그러면 당시 선경은 이동통신 사업권을 반납했다가 김영삼 정부에서 다시 이통사 선정에 뛰어 들었나요?▷[오수영 / 기자]과정이 복잡했는데요.당시 정부는 제2 이동통신 사업자 선정 권한을 전국경제인연합회, 전경련에 위임했습니다. 공교롭게도 당시 전경련 회장은 고 최종현 SK그룹 회장이었습니다.최 회장은 특혜 논란을 우려해 제2이동통신 사업권 참여를 포기했습니다. ▶[송태희 / 앵커]사업권을 반납했다가, 다시 사업권 참여를 포기하고 그러면 선경이 어떻게 이동통신사업에 진출한 것입니까?▷[오수영 / 기자]고 최종현 회장은 사업권 참여 대신 민영화되는 한국이동통신 주식 공개입찰경쟁에 뛰어들었습니다.제2 이동통신 사업 참여보다 한국이동통신 인수가 자금도 더 필요하고, 리스크도 더 클 것이라는 일각의 지적도 있었지만 고 최종현 회장은 이 방법을 택한 것입니다. 당시 한국이동통신의 주가는 민영화 발표 당시인 1993년 11월 8만 원 수준이었습니다.선경그룹은 1994년 1월 24일과 25일에 실시된 공개경쟁입찰에서 주식 총액 4271억 원에 인수해 숙원이었던 정보통신사업에 진출하게 됩니다.















한국이동통신의 주식 23%를 공개입찰 발표 당시보다 4배가량 비싸게 주당 33만 5천 원에 사들이는 승부수를 띄운 겁니다.▶[송태희 / 앵커]설명을 들으니까 노 관장 측이 유리하게 재판을 이끌려면 새로운 증거나 구체적 정황을 제시해야 할 것 같은데 공개한 것이 있나요?▷[오수영 / 기자]노 관장 측이 아직 구체적 증거나 정황을 공개한 것은 없습니다.노 관장의 소송 전략은 아버지가 SK의 자산 증식에 기여했다는 점을 입증하는 것으로 알려져 있습니다.그런 만큼 구체적 증거나 정황을 확보했어도 전략적으로 미리 공개하지 않고 재판 일정에 따라 제시할 가능성도 있습니다.노 관장 측 법률대리인을 직접 만나서 재산형성과정에서 기여도를 어떻게 증명할 것인지 물었는데요.그런 것을 지금 말씀드리기엔 ‘빠른 것 같다’고 답했습니다.아직 재판이 시작 단계이기 때문에 공개해봐야 상대방에게 반론 근거를 마련할 시간만 줄 수 있다는 것이죠. 앞으로 진행될 변론 과정에서 구체적인 증거나 증인이 나올 경우, 재판뿐만 아니라 당시 5공 정권에 대한 평가, 또 위법행위 등에 대한 상당한 파장이 예상됩니다.▶[송태희 / 앵커]그런데 노 관장 주장 구체적 근거 있다면 정경유착을 공개하고 이를 인정해야 하는 상황이죠?▷[오수영 / 기자]그렇습니다.노태우 전 대통령은 지난 2011년 내놓은 회고록에서 유공 등에 대한 특혜설을 부인한 바 있습니다. 하지만 노 관장은 재판에서 이기려면 부친과 다른 주장을 펴야 하고, 그 입증을 위해 자료를 수집해야 하는 상황입니다.(자세한 내용은 동영상을 시청하시기 바랍니다.)




김동우 기자(eastright@sbs.co.kr);오수영 기자(oh@sbs.co.kr); ▶ ▶ 저작권자 SBS미디어넷 & SBS I&M 무단전재-재배포 금지",/news/news_read.nhn?article_id=0000212639&office_id=374&mode=search&query=SK&page=2
■ 취재파일,"▶[송태희 / 앵커]이번 이혼소송이 주목을 끄는 건 천문학적인 재산분할 액수 때문만은 아닙니다.일부에서는 국내 3위 대기업 - SK의 지배구조가 흔들릴 수 있다는 지적도 나오고 있습니다. 만일, 재판부가 노 관장 손을 들어줄 경우, 최태원 회장 경영권에는 문제가 없을까요?▷[김동우 / 기자]현재 노소영 관장의 지분은 0.01%에 불과한데 재계에서는 재산 분할액이 어느 정도일지 주목하고 있습니다. 만약 법원이 노 관장의 요구를 100% 받아들일 경우 최 회장은 10.71%로 내려가고, 노 관장은 7.74%를 확보하면서 2대 주주로 올라서게 됩니다.하지만 최 회장의 여동생인 최기원 SK행복나눔재단 이사장, 최재원 SK 수석부회장 등 특수 관계인 28명의 지분으로도 경영권 방어가 가능할 것으로 보입니다.다만 문제는 국민연금입니다.▶[송태희 / 앵커]왜 그런 건가요?▷[김동우 / 기자]국민연금은 SK 주식 590만주, 의결권 있는 주식 약 8.46%를 보유하고 있는데요.지난해 3월 열린 SK 주주총회에서 최태원 회장의 사내이사 연임 안건이 통과되긴 했지만 국민연금은 “기업가치 훼손이나 주주권익 침해 이력”을 이유로 반대한 바 있습니다. ▶[송태희 / 앵커]해외투기 자본 공격에 취약해질 우려도 있죠?SK는 과거 소버린과 그룹 지배권을 두고 대결을 벌인 적이 있지 않습니까?▷[김동우 / 기자]네, 최태원 회장은 지난 2005년 뉴질랜드계 자산운용사인 소버린과 지분싸움을 벌인 적이 있습니다.소버린은 2003년부터 SK 지분을 늘려 15%에 가까운 지분을 확보한 다음 최 회장 등 SK경영진의 퇴진을 요구했는데요.당시 최 회장은 독자적인 지배구조 개선안을 내 주총에서 60.6%의 지지를 얻어 경영권 방어에 성공했습니다. ▶[송태희 / 앵커]현재 SK그룹은 지배구조 개선도 준비하고 있는 것으로 알려졌는데 여기에는 문제가 없을까요?▷[김동우 / 기자]네, SK그룹은 SK하이닉스를 인수합병에 활용하기 위해 손자회사에서 자회사로 편입하는 내용의 지배구조 개편을 준비 중인 것으로 알려졌습니다.유력한 방안으로는 SK하이닉스의 모회사인 SK텔레콤을 사업회사와 투자회사로 인적분할하고 투자회사를 지주사 SK와 합병시키는 안이 거론되는데요.이렇게 되면 SK지분을 가지고 있는 최 회장 등 특수관계인의 지분량이 낮아질 수밖에 없습니다.다만 이때도 방법은 있습니다.▶[송태희 / 앵커]어떤 방법이요?▷[김동우 / 기자]최태원 회장은 주주가치 제고를 위해 올해 초까지 자사주 7천억 원 어치를 매입했습니다.자사주만 1800만주, 총 발행량의 25.6%인데, 이걸 우호세력을 확보해 매각하는 방법이 있습니다.자사주는 의결권이 없지만 우호세력에게 넘기면 의결권이 있는 특수 관계인을 확보할 수 있습니다.앞서 소버린 사태 때도 최태원 회장은 자사주 9.7%를 하나은행에 매각해 우호지분을 확보한 바 있습니다. ▶[송태희 / 앵커]오수영 기자, 앞으로 재판 전망 방향 짚어 볼까요?하나 주목되는 게 노 관장 측이 일관되게 최 회장이 이혼소송을 취하면 재산분할 소송도 취하하겠다는 의사를 밝혔었잖아요?진의가 뭔지 궁금하네요?▷[오수영 / 기자]네, 앞서도 잠시 언급했지만 지난 4월, 첫 변론 기일에 재판부에 밝힌 내용을 지금까지 고수하고 있는데요.우선은 최 회장이 가정으로 돌아오기를 바라는 마음일 수 있습니다.다만 일각에서는 이혼의 책임이 최 회장 쪽에 있다는 메시지를 낸 것으로 보고 있습니다.향후 재산 분할에서 유리한 고지를 점하려는 것으로 분석되고 있습니다. [최단비 / 변호사 : 지금이라도 최태원 회장이 돌아와 달라는 진심일 수도 있고요. 노소영 관장 입장에서는 본인이 이혼을 원하지 않지만 어쩔 수 없는 사정 때문에 이혼을 당한다, 이번 이혼소송에서 피해자라는 점을 강조하고 이런 부분으로 인해서 재산분할을 더 받고자 하는 전략일 수도 있습니다.]▶[송태희 / 앵커]김동우 기자 앞서 쭉 짚어 보았습니다만, 이번 재산분할 소송의 핵심은 재산 형성 기여도.특히 부친들의 재산 형성 기여도 일텐데요.부친들의 기여도는 상속재산으로 볼 수 있는 것입니까?이 부분 법리적인 판단은 어떻게 진행될까요?▷[김동우 / 기자]우선 재산분할의 핵심 쟁점은 최 회장이 보유중인 SK 지분이 상속 또는 증여받은 재산인지 여부입니다.이 지분은 최 회장이 지난 1994년 대한텔레콤 지분 70%를 매입하면서 생긴 주식인데요.최 회장 측은 아버지에게 증여받은 현금으로 취득했다고 주장할 것으로 알려졌습니다.법원이 최 회장의 재산을 상속·증여 받은 재산으로 판단하면 특유재산으로 분류돼 재산분할 대상에서 제외됩니다. 만약 상속재산으로 판단하지 않을 경우 노 관장의 기여도를 어느 정도 볼지가 관건입니다.또 하나 혼인 기간도 변수입니다.별거 기간에는 재산 형성에 기여하기 어렵다고 볼 여지가 있기 때문입니다.최 회장은 지난 2015년 언론에 보낸 편지에서 “노 관장과 십년이 넘게 깊은 골을 사이에 두고 지내왔다”고 했고 2010년에는 혼외자를 낳기도 했습니다.이걸 보면 혼인 기간 중 약 절반이 별거 상태였던 것으로 보입니다.앞서 살펴본 이부진-임우재 이혼 소송에서도 법원이 재산 형성 과정 기여도를 판단하는 과정에서 혼인 기간 20년 중에 절반이 넘는 10년 이상을 별거 상태였다는 점이 반영된 것으로 추정됩니다. ▶[송태희 / 앵커]앞으로 재판 일정은 어떻게 되나요?▷[오수영 / 기자]오는 7월 21일 세 번째 변론기일이 잡혀 있습니다.두 번째 변론 때 이뤄진 재산목록 보완 요청에 따른 결과를 보고 추가 논의를 하게 될 예정입니다. 재판 전망 들어보시죠.[장희진 / 변호사 : 1조 4000억 원에 달하는 재산목록이 제출되었다는 점에서 치열한 법정 다툼이 목전에 다가온 것 같습니다. 그러나, (노 관장은) 여전히 최태원 회장이 이혼소송을 취하하면 본인 또한 소송을 없던 일로 하겠다는 입장인데요. 재산목록 보완 요청도 하고, 새로운 전관 변호사도 선임을 하면서도 이러한 입장을 유지한다는 것은 앞으로 재판과 협상 모두에서 우위를 계속해 점해나가겠다는 강한 의지로 보입니다.]▶[송태희 / 앵커]최태원 회장과 노소영 관장의 이혼과 재산분할 소송.어찌 됐건 안타까운 일입니다.조 단위 재산분할 소송, 결국 쉽게 말하면 노 관장 측의 지참금이 SK의 성장에 최 회장의 재산 형성에 기여 했냐는 것이 쟁점이 될 것으로 보입니다.앞으로 상황에 따라 당시 정경유착의 속살이 드러날 수도 있습니다.
하나 잊지 말아야 할 것이 있습니다.유공, 한국이동통신 모두 공기업이었습니다.거대 기업으로 성장한 SK텔레콤, SK이노베이션 그 뿌리는 국민의 것이었습니다.코로나19 때문에 대규모로 일자리가 줄고 있습니다.누구의 재산인지 국내 대기업 총수로서, 전직 대통령의 딸로서 진지한 성찰을 바랍니다.이번 주 취재파일 여기서 인사드립니다.함께 해주신 여러분, 감사합니다.(자세한 내용은 동영상을 시청하시기 바랍니다.)




오수영 기자(oh@sbs.co.kr);김동우 기자(eastright@sbs.co.kr); ▶ ▶ 저작권자 SBS미디어넷 & SBS I&M 무단전재-재배포 금지",/news/news_read.nhn?article_id=0000212640&office_id=374&mode=search&query=SK&page=2
총 7가지 색으로 선택지 다양화,"[헤럴드경제]LG전자가 휴대전화에서 ‘LG로고’를 떼고 이동통신사별로 색깔을 다르게 한 새로운 ‘LG벨벳’을 선보인다.30일 업계에 따르면 내달 5일 출시되는 새 LG벨벳은 휴대전화 후면에서 ‘LG’ 로고를 지우고 이통사별 단독 색상으로 나온다. LG전자는 LG벨벳이 디자인에 각별히 신경을 쓴 제품인 만큼 디자인의 가치를 살리기 위해 자사 로고를 과감히 빼기로 결정한 것으로 전해졌다.이에 SK텔레콤에서는 ‘오로라 블루’, KT에서는 ‘오로라 레드’, LG유플러스에서는 ‘오로라 핑크’가 출시된다.한 이통사 관계자는 “LG전자가 상반기 벨벳으로 확실히 승부수를 띄우려는 것 같다”며 “디자인에 민감한 20∼30대 소비자들 사이에서 반응이 좋다”고 말했다.5일 세 가지 색상이 새로 나오면 소비자는 총 7가지 색상 중에 LG벨벳을 고르게 된다. LG벨벳은 이달 15일 오로라 화이트, 오로라 그레이, 오로라 그린, 일루전 선셋 등 4가지 색상으로 먼저 출시됐다.일루전 선셋 색상은 시선 각도와 조명에 따라 달라 보이는 색상이다. 물방울이 떨어지는 모양의 LG벨벳 후면 카메라도 최근 스마트폰 카메라가 대부분 ‘인덕션 타입’에 ‘카툭튀’(카메라 부분이 툭 튀어나오는 디자인)인 것과 달라 인기를 얻고 있다.LG벨벳 가격은 89만9800원으로 공시지원금은 7만4000원∼24만원 수준이며 이통사별·요금제별로 다르다.onlinenews@heraldcorp.com
- Copyrights ⓒ 헤럴드경제 & heraldbiz.com, 무단 전재 및 재배포 금지 -",/news/news_read.nhn?article_id=0001680043&office_id=016&mode=search&query=SK&page=2
Z플립부터 초박형 글라스 UTG 사용UTG 제조공정 세계 최초 풀자동화한 장비 공급지문인식 센서 부착설비 FoD도 성장의 다른 한 축,"[이데일리 김재은 기자] 오는 6월 22일 코스닥 시장에 상장하는 엘이티가 삼성 Z플립 등 폴더블폰 확대의 수혜를 받을 것이라는 분석이 나왔다. 엘이티는 플렉서블 OLED와 FoD(Finger print On Display) 등 모듈 공정 디스플레이 제조설비 자동화 전문회사로 2001년 9월 LG생산기술원(현PRI) 출신 임직원이 설립했다. 주요 매출처는 삼성디스플레이로 레진 등을 디스플레이에 도포하고 이를 검사, 접합하는 핵심 기술을 보유하고 있어 관련 장비군으로 확대해나가고 있다. 2016년엔 플렉서블 OLED 제품의 신규 도포공정인 BPL Dispenser System을 수주해 OLED 시장에 진출했고, 이후 OLED 부문의 최신 기술인 광방식 지문센서 부착 설비(RIGID FoD), 초음파 방식 지문센서 부착설비(플렉서블 FoD)를 개발해 공급하고 있다. (그래픽=이동훈 기자)윤혁진 SK증권 연구원은 “삼성전자 폴더블폰의 핵심인 UTG(Ultra Thin Galss) 제조공정을 세계 최초로 풀자동화한 UTG 적층 라미네이션 장비를 공급하고 있다”며 “삼성전자의 폴더블폰 판매량 증가에 따른 UTG 생산라인 추가 증설이 필요하다”고 설명했다. SK증권은 엘이티 성장의 두축으로 △Fod부착기와 △UTG적층 라미네이션 장비를 꼽았다. 먼저 FoD 부착기는 지문인식 센서를 디스플레이 특정 위치에 정밀하게 부착하는 설비로 고객사에 독점 공급 중이다. 지난해 전체 스마트폰 중 FoD 채택율은 플래그십 3%, 보급형 5%로 전체 중 8%에 채택 중이지만, 향후 휴대폰 하단 가운데만 인식되는 FoD에서 하단 전부인 확장형 FoD, 전면 전체가 인식되는 전면 FoD로 변화할 것으로 예상했다. 그에 따라 FoD부착기 매출이 지속 발생할 것이란 전망이다. 이와 함께 삼성전자(005930)가 지난 2월
출시한 Z 플립부터 초박형 글라스인 UTG를 사용하는데 동사의 UTG 적층 라미네이션 장비는 UTG 양산 자동화 시스템으로 2019년 11월 첫 납품을 시작했다. 추후 삼성전자의 폴더블폰 판매량이 올해 400만대에서 2021년 1600만대로 급증할 전망이라 UTG 적층 라미네이션 장비도 올 하반기 추가발주가 나올 것으로 내다봤다. 윤 연구원은 “지난해 실적은 매출 469억원, 영업이익 109억원, 영업이익률 23.3%를 기록했지만 올해는 코로나19로 인한 고객사의 투자 지연으로 당초 예상보다 20%가량 감소한 매출 450억원, 영업이익률 15% 내외를 기록할 것”이라고 추정했다. 고객사의 투자가 하반기에 집중될 것으로 추정돼 올해말 이월 수주잔고는 300억~400억원 수준을 기록할 것으로 봤다.(그래픽=이동훈 기자) 그는 “코로나 19로 올해 실적이 부진하고, 상장 3개월후 벤처금융 지분 19.7%가 보호예수 해제될 예정”이라며 “단기적으로 주가가 부진할 수 있지만, 고객사의 폴더블폰 판매 급증과 FoD 채택 증가의 장기적 성장성을 주가에 반영해나갈 것”이라고 내다봤다.엘이티는 6월 4~5일 수요예측을 거쳐 공모가(6400~7800원)를 확정하고, 11~12일 청약을 받는다. 상장주관사는 미래에셋대우. 상장후 최대주주는 지분 52.57%를 보유한 에이치비테크놀러지, 이홍근 대표 등 특수관계인이다. (그래픽=이동훈 기자)김재은 (aladin@edaily.co.kr)＜ⓒ종합 경제정보 미디어 이데일리 - 무단전재 & 재배포 금지＞",/news/news_read.nhn?article_id=0004652212&office_id=018&mode=search&query=SK&page=1
,"전국 주간 단위 휘발유 가격이 18주 만에 상승 전환했습니다.한국석유공사 유가 정보 서비스 오피넷에 따르면 이달 넷째 주 전국 주유소 주간 단위 휘발유 판매 가격은 전주 대비 9.8원 오른 ℓ당 1천258.6원을 기록했습니다.지난 1월 말부터 이어져 온 하락세가 4개월여 만에 멈추고 반등한 겁니다.일간 단위 휘발윳값은 지난 16일을 기점으로 상승하기 시작했습니다.이번주 서울 주유소 휘발유 가격은 전주 대비 ℓ당 15.4원 상승한 1천357.3원으로 집계됐습니다.지난주에는 0원대의 미미한 상승폭으로 상승 반전한 뒤 이번 주에는 상승폭을 키웠습니다.최저가 지역인 대구 주유소 휘발유 가격은 지난주보다 ℓ당 11.3원 상승해 1천220.3원을 기록했습니다.상표별로는 알뜰주유소 휘발유 가격이 ℓ당 1천218.7원으로 가장 저렴했고, SK에너지 주유소 가격은 1천271.0원으로 가장 비쌌습니다.전국 주유소 경유 가격도 ℓ당 1천68.6원을 기록해 지난주보다 8.6원 올랐습니다.국제 유가는 국내 주유소 기름값에 약 2∼3주의 시차를 두고 반영됩니다.(사진=연합뉴스)김기태 기자(KKT@sbs.co.kr)",/news/news_read.nhn?article_id=0000818112&office_id=055&mode=search&query=SK&page=1
,"전국 주간 단위 휘발유 가격이 18주 만에 상승 전환했습니다.30일 한국석유공사 유가 정보 서비스 오피넷에 따르면 이달 넷째 주 전국 주유소 주간 단위 휘발유 판매 가격은 전주 대비 9.8원 오른 ℓ당 1천258.6원을 기록했습니다.지난 1월 말부터 이어져 온 하락세가 4개월여 만에 멈추고 반등한 것입니다. 일간 단위 휘발윳값은 지난 16일을 기점으로 상승하기 시작했습니다.이번주 서울 주유소 휘발유 가격은 전주 대비 ℓ당 15.4원 상승한 1천357.3원으로 집계됐습니다.지난주에는 0원대의 미미한 상승폭으로 상승 반전한 뒤 이번 주에는 상승폭을 키웠습니다.최저가 지역인 대구 주유소 휘발유 가격은 지난주보다 ℓ당 11.3원 상승해 1천220.3원을 기록했습니다.상표별로는 알뜰주유소 휘발유 가격이 ℓ당 1천218.7원으로 가장 저렴했고, SK에너지 주유소 가격은 1천271.0원으로 가장 비쌌습니다.전국 주유소 경유 가격도 ℓ당 1천68.6원을 기록해 지난주보다 8.6원 올랐습니다.정유 업계 관계자는 ""국제 휘발윳값이 4월 넷째 주를 저점으로 상승세를 이어가고 있다""며 ""당분간 국내 기름값 상승도 지속할 것""이라고 전망했습니다.국제 유가는 국내 주유소 기름값에 약 2∼3주의 시차를 두고 반영됩니다.한국석유공사 관계자는 ""미국의 정제가동률 상승 등의 영향으로 국제유가가 상승했다""면서도 ""석유수출국기구(OPEC) 플러스의 감산 규모 유지에 대한 러시아의 미온적 태도가 상승 폭을 제한했다""고 설명했습니다.[MBN 온라인뉴스팀]< Copyright ⓒ MBN(www.mbn.co.kr) 무단전재 및 재배포 금지 >",/news/news_read.nhn?article_id=0001460521&office_id=057&mode=search&query=SK&page=1
