head,text,url
"이혼소송 재판부, 양 측에 재산목록 제출요구","[아이뉴스24 이영웅 기자] 최태원 SK 회장과 노소영 아트센터 나비 관장의 이혼소송 첫 재판이 지난 7일 진행된 가운데, 양측이 충돌했다. 노 관장 측이 ""최 회장이 가정으로 돌아오면 소를 취하하겠다""고 밝히자, 최 회장 측은 ""비공개 재판 내용을 공개하며 여론전을 펴고 있다""고 반박했다.10일 법조계에 따르면 노 관장은 지난 7일 서울가정법원 가사2부(전연숙 부장판사) 심리로 진행된 이혼소송 첫 변론기일에서 ""사회적으로 남다른 혜택을 받은 두 사람이 이런 모습으로 서게 돼 참담하고 부끄럽다""며 ""최 회장이 이혼소송을 취하한다면 저도 위자료와 재산분할 소송을 취하하겠다""고 말했다.그러면서 동거인 김희영 티앤씨재단 이사장 사이에서 난 혼외자녀를 가족으로 받아들이겠다는 입장을 재판부에 전달한 것으로 알려졌다.최 회장 측은 반발하고 나섰다. 노 관장 측이 재산분할을 청구하는 반소를 낸 것 자체가 이혼 의사를 밝힌 것으로 여론전에 불과하다는 것이다. 더욱이 가사재판의 특성상 비공개가 원칙임에도 법정 진술을 외부에 알린 것은 잘못이라는 주장이다.최 회장 법률대리인은 ""반소에 비춰 볼 때 실제로는 피고도 이혼 의사가 확고하면서도 언론에는 가정을 지키려는 것처럼 하는 것은 대중의 감성을 이용한 여론전일 뿐 진정성은 전혀 없다""고 비판했다.최 회장 법률대리인은 ""노 관장이 동거인과의 사이에서 난 자녀도 받아들이겠다는 것은 법적으로도, 현실적으로도 맞지 않는 이야기일 뿐만 아니라 당사자인 자녀에 대한 배려는 조금도 없는 전근대적인 사고""라고 말했다.이어 ""비공개로 진행돼야 할 법정 내 진술 내용을 피고 측이 구체적으로 외부에 언급하는 것은 매우 유감""이라고 덧붙였다.재판부는 지난 7일 양측에 재산명시 명령을 내렸다. 양측의 재산목록을 받아 재산 분할과 관련된 심리를 진행하기 위해서다. 이날 재판에는 노 관장만 참석했다. 최 회장은 신종 코로나 바이러스 감염증(코로나19)에 따른 사회적 거리두기 차원에서 참석하지 않았다.앞서 노 관장은 지난해 12월4일 서울가정법원에 이혼과 함께 최 회장이 보유한 SK(주) 지분의 42.30%에 대한 재산분할을 청구하는 내용의 소장을 제출했다. 그동안 이혼을 거부하던 노 관장이 돌연 입장을 바꿔 천문학적 액수의 재산분할을 청구하는 반소를 제기하면서 이혼소송은 합의부로 이관, 다시 시작됐다.당시 노 관장은 자신의 페이스북을 통해 ""저의 지난 세월은 가정을 만들고 이루고 또 지키려고 애쓴 시간이었다""며 ""힘들고 치욕적인 시간에도 일말의 희망을 갖고 기다렸지만, 이제는 그 희망이 보이지 않게 됐다. 이제는 남편이 저토록 간절히 원하는 '행복'을 찾아가게 하는 것이 맞지 않나 생각한다""고 말했다. hero@inews24.com [ⓒ 아이뉴스24 무단전재 및 재배포 금지]",/news/news_read.nhn?article_id=0000533751&office_id=031&mode=search&query=SK&page=5
보건 관리 및 감염병 대응체계 강화해외 거점별 안전·보건 전문인력 육성안전·보건이 미래 기업 핵심 경쟁력,"[헤럴드경제 김현일 기자] 유재영〈사진〉 SK이노베이션 SHE 본부장(전무)은 신종 코로나바이러스 감염증(코로나19) 사태를 계기로 해외 사업장에 안전·보건·환경(SHE) 담당 주재원을 파견하고, 전문 인력을 육성할 계획이라고 밝혔다.유 본부장은 10일 사내 뉴스채널과의 인터뷰에서 “자연재해나 질환 등 예기치 못한 상황에서 조기에 위험을 감지하고 체계적으로 대응할 수 있는 위기 대응 시나리오와 관리체계 구축이 필요함을 절실히 인식했다”며 이같이 말했다.그는 우선 “전기차 배터리 공장이 있는 미국과 헝가리를 중심으로 해외 사업장에 SHE 주재원을 연내 파견하고 장기적으로는 해외 거점지역별로 SHE 전문 인력을 육성해 나갈 예정이다”고 밝혔다.아울러 “해외에 건설 중인 사업장과 인수한 사업장의 조기 안정화를 위해 ‘글로벌 사이트 SHE 관리체계’를 수립하고 프로젝트 단계별 현지 SHE 인력 운영방안을 검토하고 있다”고 강조했다.위험을 조기에 차단하기 위해 시스템 개선 계획도 밝혔다. 유 본부장은 “현장의 잠재된 위험요인을 사전에 찾아낼 수 있는 리스크 진단방법을 정립하고, 위험성평가를 보다 개선할 것”이라며 “중장기적으로는 디지털 전환(DT) 기술을 활용해 다양한 SHE 데이터베이스를 구축하고, 이를 통해 최적의 솔루션을 제공하는 리스크 예방관리체계를 구축해 나갈 계획”이라고 말했다.유 본부장은 “코로나19 이슈가 한창인 요즘 SHE 담당 구성원들은 눈을 뜨고 잔다는 표현이 더 정확할 만큼 바쁘게 움직이고 있다”며 “기존의 SHE 시스템으로는 대처할 수 없는 블랙스완(Black Swan)의 심각한 위협이 언제든 발생할 수 있다는 위기의식을 갖게 됐다”고 말했다.
- Copyrights ⓒ 헤럴드경제 & heraldbiz.com, 무단 전재 및 재배포 금지 -",/news/news_read.nhn?article_id=0001660336&office_id=016&mode=search&query=SK&page=5
,"[아시아경제 차민영 기자] 매년 4~5월 봄 시즌 잘 나가는 에어컨, 공기청정기 등의 계절가전과 봄 신상 패션상품 등을 준비했다. 십일절의 중요 이벤트인 ‘타임딜’은 일상 준비를 위한 상품들을 메인으로 오전 11시부터 매시간 5개씩 하루 동안 총 65개 상품을 최대 74% 할인된 특가로 판매한다.낮 12시에는 ‘에브리봇 엣지 물걸레 로봇청소기’, 오후 3시에는 ‘위니아 16평형 스탠드 에어컨’, 오후 8시에는 ‘리바트 로넌 전면 책상’, 오후 9시에는 ‘2020년형 다이나톤 디지털피아노’, 오후 11시에는 ‘샤오미 미에어 공기청정기’를 판매한다. 그 외 ‘안다르’ 봄 신상 의류, 디자이너 브랜드 ‘꼼파뇨’ 럭키박스 등 패션잡화부터 ‘애플워치5’, ‘브라운 전기면도기’ 등 인기 가전을 선보인다. 특히 최근 품귀현상을 빚고 있는 ‘닌텐도 스위치’는 오후 4시 본체를 판매하고, 오후 7시에는 ‘모여봐요 동물의 숲 타이틀’을 판매할 예정이다.‘신종 코로나바이러스감염증(코로나19)을 이겨내는 슬기로운 집콕 생활’을 주제로 ‘홈 트레이닝을 위한 운동 기구 추천’, ‘봄 맞이 옷장 정리’ 등에 대한 쇼핑 콘텐츠도 마련했다. 고객들이 쇼핑 정보를 얻으면서 관련 상품까지 바로 구매할 수 있도록 했다.쌍용자동차와 준비한 자동차 경품증정 이벤트도 선보인다. 월간 십일절 상품 구매 시 응모 가능하며 추첨을 통해 ‘쌍용자동차 리스펙 티볼리 가솔린 V:1트림(오토매틱)’ 차량 1대를 증정한다. 동영상 리뷰를 등록하거나 11번가 신한카드 첫 결제 등의 조건을 충족할 경우 최대 7회까지 추가 응모기회가 주어진다.특별히 이번 십일절에는 월간 십일절 단골 고객을 위한 혜택도 마련했다. 올해 1~3월 총 세 번의 월간십일절을 모두 이용한 고객에게는 SK페이 포인트 3000포인트를 선착순 3000명에게 지급한다. 두 번 구매 고객에게는 5000명 한정 2000포인트, 한 번 구매 고객에게는 1만명 한정 1000포인트를 지급한다. 6대 카드사 할인 혜택 및 SK페이 포인트 최대 19% 적립, T멤버십 최대 22% 할인 등도 있다. 지난달 시작한 ‘소통 프로젝트’도 이어간다.이상호 11번가 사장은 “빠른 시일 내 일상으로의 건강한 복귀를 바라는 마음에서 준비한 4월 십일절을 통해 고객들이 새로운 에너지를 얻을 수 있길 바란다”며 “4월에는 특별히 그 동안 십일절을 사랑해주신 단골 고객분들을 위한 혜택도 추가로 마련하고 소통 프로젝트도 이어가면서 더 많은 고객들에게 진심을 전하는 11번가가 되겠다”고 전했다. 차민영 기자 blooming@asiae.co.kr <ⓒ경제를 보는 눈, 세계를 보는 창 아시아경제 무단전재 배포금지>",/news/news_read.nhn?article_id=0004659222&office_id=277&mode=search&query=SK&page=5
,"미국 연방준비제도이사회(Fed)가 파격적인 유동성 정책을 내놓았지만 국제 유가가 재차 급락하면서 코스피가 보합권에 머물고 있다. 10일 오전 9시 5분 현재 코스피는 전일 대비 2.71포인트(0.15%) 오른 1838.92를 기록하고 있다.코스피는 코로나19가 미국, 유럽 등으로 확산하자 지난달 19일 1430선까지 하락했다. 하지만 최근 한달여동안 가파른 회복세를 보이면서 1850선 회복에 다가서고 있다. 연준은 최대 2조3000억 달러의 유동성을 시중에 공급할 수 있는 조치를 발표했다. 일부 투기등급 회사채(정크본드)와 상업용 주택저당증권(CMBS), 대출채권담보부증권(CLO)까지 매입하기로 해 파격적이라는 평가가 나오고 있다. 코로나 19 사태로 인해 신용경색 리스크 경고등이 켜진 기업, 가계 및 지방정부를 지원하기 위해 연준이 전격적으로 지원을 결정한 것이다. 특히 코로나 19 사태 이후 금융위기를 촉발시킬 수 있는 시한폭탄으로 지목되었던 대출채권담보부증권(CLO)마저 매입하기로 한 것은 미 연준의 금융 시스템 리스크를 선제적으로 차단하기 위한 목적으로 해석해 볼 수 있다. 또한 코로나 19 이후 신용등급이 정크본드로 강등된 기업들에 대해서도 구제의 손길을 던져주었다는 점은 미 정부와 연준의 기업 도산 방어 의지를 읽을 수 있는 부분이라고 평가받고 있다. 회원국 간 이견으로 지연되던 EU 경기부양 패키지도 합의에 도달했다. 패키지 규모는 5000억 달러로 주요 내용은 수개월 내 역내 기업들에게 추가 유동성을 제공하고, 정부의 고용 프로그램에 자금을 지원하며, 금융시장 접근이 어려운 유럽 정부에 비교적 유리한 조건으로 신용 라인을 제공하는 것이다. OPEC+는 5월1일부터 6월30일까지 두 달간 현재보다 하루 1000만 배럴의 원유를 감산하기로 합의했다. 이후 7월1일부터 올해 말까지 하루 800만 배럴, 내년 1월부터 2022년 4월까지는 하루 600만 배럴을 단계적으로 감산할 예정이다.감산이 확실시된 이번 OPEC+ 긴급회의가 시작되자 국제 유가는 10% 이상 상승했지만 회의 도중 감산량이 하루 1000만 배럴이라는 소식이 전해지면서 서부 텍사스산 원유(WTI)는 9.3%나 급락했다. 시장에서는 코로나19 우려에 기인한 글로벌 원유수요 감소분이 더욱 크기 때문에 이번 감산합의가 큰 효과를 발휘하지는 못할 것이란 평가가 나온다. 글로벌 원유수요 감소분은 약 2000만~2700만 배럴 규모인 것으로 추정된다.김병연 NH투자증권 연구원은 ""하락분의 50% 되돌림점인 1850포인트는 잠시 쉬어가는 구간으로 신용경색 우려, 우한 이동 재개와 라마단 등으로 인해 코로나19 재확산에 대한 경계감이 여전하다""라며 ""증안펀드 집행 미국 4차 재정정책 논의, OPEC+ 감산 합의 등 기대감도 높아 조정이 나타나더라도 하락분의 33% 되돌림점인 1700선 초반이 지지선으로 작용할 전망""이라고 말했다.업종별로 의약품, 철강·금속, 운송장비 등이 1~2% 오르고 있고 화학, 음식료품, 유통업 등은 떨어지고 있다.매매주체별로 개인과 외국인이 각각 559억원, 4억원을 순매수하고 있고 기관은 554억원을 순매도하고 있다. 프로그램 매매는 558억원 매도 우위다.시가총액 상위 종목들은 혼조세다. 삼성전자, SK하이닉스, NAVER, LG생활건강 등은 떨어지고 있고 삼성바이오로직스, 셀트리온, LG화학, 현대차 등은 오르고 있다.이날 유가증권시장에서는 416개 종목이 상승하고 있고 356개 종목이 하락하고 있다.코스닥은 전일 대비 1.32포인트(0.21%) 오른 617.27을 기록 중이다.[디지털뉴스국 고득관 기자] [ⓒ 매일경제 & mk.co.kr, 무단전재 및 재배포 금지]",/news/news_read.nhn?article_id=0004554509&office_id=009&mode=search&query=SK&page=5
,"[머니투데이 강민수 기자] 제약바이오기업 제넥신이 이틀째 강세다. 전날 문재인 대통령이 주재한 코로나19 치료제 관련 회의에 참석한 영향으로 풀이된다. 10일 오전 9시 14분 현재 코스닥시장에서 제넥신 주가는 전일 대비 9000원(13.98%) 오른 7만3400원에 거래되고 있다.제넥신은 전날에도 9.15% 상승 마감했다. 이틀만에 주가가 24%가량 오른 것이다. 이는 성영철 제넥신 대표이사가 전날 문재인 대통령이 주재한 합동회의에 참석한 영향으로 풀이된다. 문 대통령은 지난 9일 오전 경기 성남 한국파스퇴르연구소에서 코로나19 치료제‧백신 개발을 위한 산·학·연+병원 합동회의를 가졌다. 업계에선 류왕식 한국파스퇴르연구소장, 서정진 셀트리온 회장, 성영철 제넥신 대표이사, 김훈 SK바이오사이언스 최고기술책임자(CTO) 등이 참석했다.문 대통령은 이 회의에서 ""우리 국민들의 성숙한 시민의식이 코로나19의 방역에서 국제적 모범과 표준을 만들어 주었다""며 ""코로나19 치료제와 백신 개발에서도 우리가 앞서갈 수 있고, 국제사회에 기여할 수 있다""고 밝혔다. 문 대통령은 이를 정부의 R&D(연구개발) 투자를 늘릴 뿐 아니라 신속한 임상 승인 절차를 도입할 예정이다. 제넥신은 국내 백신 개발 업체 중 가장 먼저 코로나19 백신의 동물실험에 들어갔다. 오는 6월쯤에는 사람을 대상으로 한 임상시험 또한 시작할 계획이라고 밝혔다. 강민수 기자 fullwater7@mt.co.kr
<저작권자 ⓒ '돈이 보이는 리얼타임 뉴스' 머니투데이, 무단전재 및 재배포 금지>",/news/news_read.nhn?article_id=0004392413&office_id=008&mode=search&query=SK&page=5
,"[이데일리 권효중 기자] 전날 정부의 신종 코로나바이러스 감염증(코로나19) 백신 관련 논의에 함께했던 제넥신(095700)의 주가가 장 초반 강세를 보이고 있다.10일 마켓포인트에 따르면 오전 9시 15분 현재 제넥신은 전 거래일 대비 14.13%(9100원) 오른 7만3500원에 거래중이다. 전날 9.15% 오른데에 이어 이날도 오름세를 유지중이다.앞서 전날 문재인 대통령은 경기도 성남 한국파스퇴르연구소를 방문해 ‘코로나19 극복을 위한 치료제·백신 개발 산·학·연·병(원) 합동 회의’를 했다. 이 자리에는 제넥신(095700), 셀트리온(068270), SK바이오사이언스 등을 비롯한 기업 관계자와 연구진이 참여했다. 정부는 코로나19 치료제와 백신을 신속히 확보할 수 있도록 관계부처가 협력해 종합적으로 지원하기로 밝혔다.한편 제넥신은 지난달 코로나19 백신의 동물실험에 들어가 오는 6월에는 사람을 대상으로 한 임상시험을 시작한다는 계획이다.권효중 (khjing@edaily.co.kr)＜ⓒ종합 경제정보 미디어 이데일리 - 무단전재 & 재배포 금지＞",/news/news_read.nhn?article_id=0004617276&office_id=018&mode=search&query=SK&page=5
,"OPEC+가 감산에 합의했지만 국제유가가 9% 하락한 가운데 정유주도 약세다.10일 오전 9시 2분 현재 흥구석유는 전일 대비 7980원(20.24%) 내린 7980원에 거래되고 있다. 같은 시각 중앙에너비스는 750원(7.50%) 하락한 9250원에 거래 중이다. 에쓰오일(-3.00%), 극동유화(-4.73%), SK이노베이션(-2.14%)도 줄줄이 약세다.전날 석유수출국기구(OPEC) 플러스(+)는 긴급 회의를 통해 다음달부터 2개월 동안 일평균 원유생산을 1000만배럴 줄이기로 합의했다. 감산이 확실시된 이번 OPEC+ 긴급회의가 시작되자 국제유가는 10% 이상 상승했다. 하지만 당초 시장 기대(2000만배럴 감산)에 못 미치는 하루 1000만 배럴이라는 소식이 전해지면서 유가는 곤두박질쳤다.이날 뉴욕상업거래소(NYMEX)에서 5월 인도분 서부 텍사스산 원유(WTI)는 배럴당 9.3%(2.33달러) 내린 22.76달러에 거래를 마쳤다.데일리안 백서원 기자 (sw100@dailian.co.kr)ⓒ (주)데일리안 - 무단전재, 변형, 무단배포 금지",/news/news_read.nhn?article_id=0002395102&office_id=119&mode=search&query=SK&page=5
,"SK그룹은 경영활동의 주체인 구성원의 행복과 이를 지속하기 위한 이해관계자의 행복을 강조하고 있다. 이와 관련 지난 2월 ▲행복경영 주체로서 구성원의 역할과 실천을 강조하고 ▲고객, 주주, 사회 및 비즈니스 파트너로 이해관계자 범위를 확장하며 ▲함께 추구해야 할 이해관계자 행복을 ‘사회적 가치’로 개념화하는 방향으로 그룹 경영철학인 SKMS를 개정했다.SKMS 개정에 따라 SK는 구성원의 행복과 함께 회사를 둘러싼 모든 이해관계자의 행복을 동시에 추구해 나가기로 했다. 사회적 가치는 이번 개정에서 이해관계자 행복을 위해 창출하는 모든 가치로 규정했다. 이 같은 사회적 가치를 만드는 일이야 말로 경제적 가치를 만드는 것에 더해 이해관계자가 기대하는 가치를 제공하는 것이라는 의미다.SKMS는 최종현 선대회장이 1979년 처음으로 정립한 이후 지난 41년간 경영 환경과 사회적 요구에 맞게 ▲인사 및 연구개발 관리 ▲SUPEX 추구개념 정립 ▲일처리 5단계 및 SUPEX추구법 확정 ▲이해관계자 행복 및 시스템 경영체계 도입 등으로 개정돼 왔다.SKMS에 담긴 사회적 가치와 관련 최태원 회장은 지난 1월 글로벌 리더들의 집합체인 ‘세계경제포럼’(다보스포럼)의 공식 세션에 참석해 “기업 경영의 목표와 시스템을 주주에서 이해관계자로 바꾸는 것은 선택이 아닌 의무가 됐다”며 “사회적 가치에 대한 측정을 고도화해 이해관계자 가치를 극대화해 나가자”고 역설한 바 있다.특히 2013년 다보스포럼에서 “사회적 가치를 창출한 기업에 인센티브를 제공, 사회문제 개선과 참여를 유도하자”고 제안한 사실을 상기시킨 뒤 7년간 SK의 성과를 소개했다.SK는 인센티브 지급을 위해 자체적인 사회적 가치 측정방법을 개발한 뒤 2014년 사회적기업, 2018년부터 SK관계사를 대상으로 이를 적용했다. 또 국제적으로 통용되는 표준화된 측정모델 개발을 위해 경제협력개발기구(OECD), 세계은행, 세계 4대 회계법인, 글로벌기업들과 비영리법인 VBA를 구성해 공동 협력하고 있다. 세션에 참가한 조지프 스티글리츠 컬럼비아대 교수는 기업이 주주 뿐 아니라 이해관계자들의 이익을 동시에 추구하도록 담보하는 체계를 갖춰야 한다고 강조하면서 SK 사례를 들었다. 그는 “우리가 원하는 것은 단순히 경제규모(GDP) 극대화가 아니라 넓은 의미에서 안위와 복지를 최대화하는 것”이라면서 “이를 위해 기업도 ESG(환경·사회·지배구조) 가치 등을 측정하는 것이 필요하다”고 말했다.로라 차 홍콩증권거래소 회장도 “기업의 사회적 책임 측면에서 SK그룹이 이미 많은 일을 해온 것처럼 다른 아시아 기업들도 의제로 상정해서 추진해 나가야 한다”고 말했다.최 회장은 이번 포럼에서 기업의 사회적 가치 창출을 위해선 벌칙보다는 혜택을 주는 방식이 더 효과적일 것이라고 말했다. 그는 220여개 사회적 기업을 대상으로 사회적 가치 창출에 비례해 현금을 인센티브로 지급하는 제도를 운영한 결과 더 많은 가치가 창출됐다고 말했다.SK 관계자는 “사회적 가치 경영의 방법론은 완결형이 아니라 현재 진행형”이라며 “앞으로도 최태원 회장과 SK그룹은 지속가능한 성장을 위한 방안인 사회적 가치 경영을 발전시켜서 모든 이해관계자들과 더 큰 행복을 나누겠다”고 말했다.이한듬 기자 mumford@mt.co.kr
<저작권자 ⓒ '성공을 꿈꾸는 사람들의 경제 뉴스' 머니S, 무단전재 및 재배포 금지>",/news/news_read.nhn?article_id=0000529425&office_id=417&mode=search&query=SK&page=5
,"정유주가 간밤에 열린 OPEC+(석유수출국기구와 비OPEC 산유국 등 10개국의 협의체) 화상회의에서 하루 1000만배럴 감산을 오는 6월말까지만 시행한다는, 기대에 못 미친 결과가 나온 영향으로 약세를 보이고 있다. 10일 오전 9시 10분 현재 S-Oil은 전일 대비 2300원(3.29%) 하락한 6만7600원에, SK이노베이션은 1600원(1.63%) 내린 9만6400원에 각각 거래되고 있다. 정유주로 분류되는 GS도 750원(1.90%) 하락한 3만8700원을 기록 중이다. 간밤에 열린 OPEC+ 화상회의를 앞두고 시장에서는 하루 2000만배럴의 원유 감산이 합의될 수 있다는 기대가 고조됐다. 이에 못 미친 결과가 나오자 뉴욕상업거래소에서 거래된 5월 인도부 서부텍사스산원유(WTI)는 전일 대비 배럴당 2.33달러(9.29%) 내린 22.76달러에 거래를 마쳤다. 박광래 신한금융투자 연구원은
""코로나10로 인한 원유 수요가 최대 하루 평균 3000만배럴까지 줄어들 수 있다는 분석이 나오는 가운데 1000만배럴 감산 발표에 그쳤다는 점은 유가 상승을 기대하는 투자자들 입장에서는 아쉬운 대목""이라며 ""절대적인 감산 물량도 기대치를 하회한 데다 기간도 다소 짧다""고 지적했다. 이번 감산합의는 오는 6월까지만 한정적으로 시행되고 7월 이후부터는 하루 800만배럴 이하로 감산 물량이 줄어들 가능성이 있다고 박 연구원은 예상했다. [디지털뉴스국 한경우 기자] [ⓒ 매일경제 & mk.co.kr, 무단전재 및 재배포 금지]",/news/news_read.nhn?article_id=0004554520&office_id=009&mode=search&query=SK&page=5
