head,text,url
,"지난27일 갤럭시S20 시리즈의 개통이 진행된 이후 각 통신사에서는 다양한 반응이 나오고 있다. 갤럭시S20 플러스의 SKT 사전 예약 결과 아우라 블루, 코스믹 그레이, 클라우드 블루, 클라우드 화이트 색상 중 SK 전용 색상인 아우라 블루가 가장 높은 인기를 얻은 것으로 집계되었다. 갤럭시S20 사전 예약 전체 고객 중 30~40대 남성 고객의 비중이 40%를 차지하며 1위로 나타났고, 30~40대 여성의 경우 20%를 기록했다.갤럭시S20 시리즈의 모델 별 예약 비중을 살펴보면 갤럭시S20 울트라, 갤럭시S20 플러스, 갤럭시S20 순으로 확인되었으며, 5:3:2의 비율을 보였다. 당초 예상과 같이 1억800만 화소의 카메라를 탑재한 갤럭시S20 울트라가 1위를 차지하였다. 갤럭시S20과 갤럭시S20 플러스에는 3배 광학 줌과 30배 디지털 줌이 장착된 반면, 갤럭시S20 울트라에는 확연한 차이를 보이는 수준의 10배 광학 줌과 100배 디지털 줌이 장착되었다.이러한 가운데 삼성전자는 구체적인 목표 수량을 언급하지는 않았으나, 외신 등에 따르면 40만대 가량의 목표를 잡고 있는 것으로 알려졌다. 반면 사전 예약 기간 동안 판매된 수량은 36만대로, 4만대 가량이 부족하다. 이에 따라 삼성전자는 ‘코로나19’ 사태로 인한 소비 심리 위축 등을 염두 하며 갤럭시S20 사전 예약 기간을 연장하였다.구형 모델에 대한 재고 정리에 박차를 가하고 있는 스마트폰 공동 구매 카페 ‘뉴버스폰’에서는 갤럭시노트9의 512GB 모델을 10만원대의 가격으로 선보이는 프로모션을 진행하며 구형 모델의 재고 정리 행사의 시작을 알렸다. 이후 갤럭시노트10까지 프로모션을 확대하여 40만원대로 구매가 가능해졌으며, 갤럭시S10 시리즈는 일반형 갤럭시S10이 7만원, 고급형 갤럭시S10 플러스가 10만원대의 가격으로 알려졌다.구형 모델의 재고 정리와 함께 갤럭시S20 시리즈에 대한 사전 예약 행사 또한 성황리에 진행되고 있다. 최대30만원 추가 지원금으로 인해 화제가 된 바 있는 해당 카페의 갤럭시S20 시리즈 사전 예약 행사는 무선 충전 패드를 추가 지급하고 있다.소비자의 이목을 사로 잡고 있는 혜택은 갤럭시Z플립 구매 고객 및 갤럭시S20 시리즈 사전 예약 고객 대상 갤럭시버즈2세대 추가 쿠폰 증정으로, 이를 통해 소비자 부담금 99,000원의 갤럭시버즈 플러스를 무료로 구매할 수 있다. 삼성전자의 사은품은 ‘갤럭시 홈 미니’ 또는 ‘네모닉 프린터’와 갤럭시버즈 플러스 할인 쿠폰이다.갤럭시S20 시리즈의 경우 공시 지원금은 최대27만원 수준으로 책정되었으며, 이로 인해 공시 지원금보다 선택 약정을 택하는 것이 높은 수준의 혜택을 받는 것이라는 의견이 제시되고 있다.더불어 해당 카페의 혜택은 전무후무한 프로모션으로 선보이고 있는 만큼 유사 업체 또한 많아 소비자의 주의 깊은 확인이 필요로 해 보인다. 함께 극소량의 물량이 유통될 것으로 전망되고 있어, 갤럭시S20 시리즈의 물량을 원활하게 확보하기 위해서는 빠른 선택이 필요로 해 보인다.자세한 사항은 네이버 카페 ‘뉴버스폰’에서 확인할 수 있다.임소라 기자 mail00@asiae.co.kr <ⓒ경제를 보는 눈, 세계를 보는 창 아시아경제 무단전재 배포금지>",/news/news_read.nhn?article_id=0004634228&office_id=277&mode=search&query=SK&page=11
,"아이젠카 에서 월 1천대 판매 돌파 기념 및 2020년 초특가 비교견적 및 무보증 장기렌터카 한정 프로모션 특가 행사를 선보였다.본 프로모션은 최저 견적으로 비교하여 고객의 니즈에 맞는 업체별 1등 견적을 제공하는 특별 프로모션 행사다. 또한 초기비용 ZERO 프로모션도 진행중이며 이는 초기비용이 일체없이 월 대여료나 리스료만 내면 신차 장기렌트카 와 자동차리스 이용이 가능하다.신차리스 및 장기렌트카는 최소 24개월에서 최대 60개월까지 렌트사 명의의 차량을 자신의 차처럼 이용한 후 계약 만기 시 인수나 반납을 선택할 수 있는 상품이다. 또한, 장기렌트카는 전자세금계산서가 발행되기 때문에 개인, 법인사업들은 비용 처리가 100% 가능하며 LPG 차종 또한 장기렌트카로 이용 가능하다. 경차밴을 제외한 화물차들은 렌트가 불가하지만 자동차 리스로는 이용이 가능하다.또한 '아이젠카’ 사업부에서는 신차장기렌트카 뿐 아니라 신차할부 및 신차자동차리스 프로그램도 가지고 있어 자동차 구입 시 차량가격을 비교 분석할 수 있는 시스템을 가동하고 있다. 렌터카 업체들의 특판 가격과 계약만료 시 차량가격을 비교 분석할 수 있는 시스템을 갖추고 있어 소비자들이 계약기간 종료 후 차량 금액을 미리 알아볼 수 있다. 여기에 무보증 장기렌트카(보증금 없는 장기렌트카) 이용을 권장하기 위하여 심사기준을 낮추고 무보증 이용시 보증보험증권도 가입하지 않아도 되는 상품을 출시하여 초기비용의 부담이 있는 소비자에게 큰 도움을 주고 있다.‘아이젠카’ 비교견적은 공정한 심사를 거쳐 검증된 곳에서만 제공받으며 여러 종류의 자동차 중에서도 자신의 현재 상황에 맞는 장기렌트카를 추천 받을 수 있다.아이젠카 에 제휴된 장기렌탈 업체로는 롯데렌터카(신차장), SK렌트카 등이 있고, 캐피탈사로는 현대캐피탈, 롯데캐피탈, 하나캐피탈, 메리츠캐피탈 등이 있다. 홈쇼핑으로는 AJ홈쇼핑, SK홈쇼핑, KT롯데홈쇼핑 등이 제휴되어 있어 리스렌터사별 견적 비교와 특판 할인까지 적용이 된다면 효율적인 비용으로 신차를 이용할 수 있다.또한 장기렌트카·자동차리스사 별 현재 진행되고 있는 프로모션 외에도 ‘아이젠카’의 단독 핫딜(렌터사와 업체의 콜라보 상품) 프로모션 등을 통해 합리적인 비용으로 신차오토리스와 장기렌트카를 이용할 수 있다.실제로 신차 장기렌트카·자동차리스는 초기비용 부담도 적거나 경우에 따라 전혀 없으며 개인, 법인사업자의 경우 경비처리도 가능해 개인, 법인사업자들이 이용하고 있다.‘아이젠카’ 특가 프로모션 중인 경차는 스파크, 레이, 모닝 이며, 승용차로는 K3, K5, K7, K9, 아반떼, 쏘나타, 그랜저IG, 제네시스가 준비되어 있다. 그리고 SUV는 싼타페,신형GV80 ,펠리세이드, 쏘렌토, 스포티지가 진행 중이며, 하이브리드로는 그랜저IG 하이브리드, K7 하이브리드, 니로 하이브리드 차량이 판매중이고 이외에도 특판대상 수입차 추천차종으로는 벤츠
GLC클래스, C클래스, E클래스, S클래스, BMW(3시리즈, 5시리즈, X3 M Spot, X4 M40d, X5 M50d 등), 지프 (레니게이드, 올뉴컴패스, 그랜드체로키 등), 랜드로버 (디스커버리, 이보크, 레인지로버) 아우디(A4, A5, Q7) 등이 있다.보다 자세한 내용은 대표번호나 아이젠카 홈페이지에서 문의 가능하다.임소라 기자 mail00@asiae.co.kr <ⓒ경제를 보는 눈, 세계를 보는 창 아시아경제 무단전재 배포금지>",/news/news_read.nhn?article_id=0004634230&office_id=277&mode=search&query=SK&page=11
,"[서울경제] 인터넷가입을 고민 중인 소비자라면, 인터넷가입 시 현금을 지급해준다는 내용의 문구를 한 번쯤은 보았을 것이다. 온라인 인터넷비교사이트들의 영업 방식이다.KT올레, SK브로드밴드, LG유플러스 등의 고객센터는 인터넷가입 시 모두 상품권으로 사은품이 지급되고 있으나, 온라인 인터넷비교사이트의 경우 상품권과 현금으로 나뉘어 지급되며 현금의 비중이 높아 이용자가 꾸준히 증가하는 추세다.또한, 고객센터 대비 평균 10만 원 이상의 사은품을 추가로 지급하고 있어 ‘인터넷가입 현금 많이주는 곳’ 등을 찾는 소비자에게 높은 인기를 얻고 있다.다만, 지난 2019년 6월 1일부터 시행된 ‘경품고시제’로 인해 사은품 금액도 큰 의미가 없어지고 있는 상황이다. 이 경품고시제로 인해 영업점은 방송통신위원회(이하 ‘방통위’)와 KT, SK, LG 등 통신3사가 규정한 사은품 금액의 최소 ?15%부터 최대 +15%까지만 소비자에게 지원할 수 있다.경품고시 가이드 미만의 사은품을 지급하거나, 초과 지급하는 경우에는 최소 100만원 이상의 패널티와 최대 영업정지까지 당할 수 있어 무조건 준수하여야 한다.가이드 수준은 통신사 및 신청 상품(요금제)에 따라 다르나, 소비자에게 지급 가능한 최대 사은품 금액은 SK브로드밴드와 LG유플러스가 최대 46만원, KT올레가 최대 43만원까지 지급 가능하다.이로 인해 현재 대부분의 인터넷비교사이트가 경품고시 가이드 최대 수준의 사은품을 내걸고 영업하고 있어 소비자들은 업체 선택에 고민이 늘고 있는 상황이다.기존에는 현금 사은품 많이 주는 곳을 찾았으나, 경품고시제 시행으로 모두 조건이 같아졌기 때문이다. 유선 시장 조사 결과에 따르면, 이러한 상황 속에서 설치 당일 현금사은품을 지급하고 있는 인터넷비교사이트가 인기를 끌고 있는 것으로 알려졌다.설치 당일 현금사은품을 지급하고 있는 인터넷비교사이트 중 대표적인 업체는 ‘펭귄통신’이다. 펭귄통신은 현재 15만명 이상의 회원이 활동 중인 네이버 인터넷가입 공식 카페를 운영 중이며, 2018년도부터 설치 당일 현금사은품 지급 서비스를 실시해 주목을 받고 있다.관계자에 따르면, “펭귄통신은 고객님의 편의를 위해 오후 4시 이전 설치건은 당일 현금 지원, 오후 4시 이후 설치건은 다음날에 지원하고 있다.”고 전했다.실제로, 펭귄통신에는 약 800건 이상의 고객 설치 후기가 올라와 있으며, 확인 시 설치 당일 현금사은품을 지급 받았다는 내용이 뒷받침되고 있어 높은 신뢰도를 보유하고 있는 것으로 알려졌다./김동호 기자 dongho@sedaily.com저작권자 ⓒ 서울경제, 무단 전재 및 재배포 금지",/news/news_read.nhn?article_id=0003702856&office_id=011&mode=search&query=SK&page=11
"◇ SRI펀드 20% 작년 출시, 업계 관심 반영됐지만…","[이데일리 김윤지 기자] 전세계 트렌드로 자리매김 중인 ESG(Environment·Social·Governance) 투자이지만 국내서는 기관 투자자에 머무는 등 아직 걸음마 단계다. ‘큰 손’ 국민연금이 지난해 말 기금운용위원회에서 기금운용 규정에 ESG 요소를 비롯해 지속가능성 원칙을 명시적으로 포함하기로 결정하고, 운용업계도 관련 상장지수펀드(ETF) 등을 내놓는 등 활성화 움직임을 보이지만 일반 투자자들은 밋밋한 반응이다. 업계 관계자들은 “ESG 투자가 글로벌 수준으로 뿌리내리기 위해선 사회적 합의가 필요하다”고 입을 모았다.1일 금융정보사 에프앤가이드에 따르면 지난달 28일 기준 사회책임투자(SRI) 펀드는 총 30개다. 이중 운용 펀드 5개와 ETF 1개가 지난해 설정됐다. 현재 운용 중인 SRI 펀드 중 20%가 지난해 출시됐다는 점이 업계의 관심을 반영한다. SRI 펀드는 기업의 재무적인 요소는 물론 비재무적 측면인 ESG까지 고려해 장기적 관점에서 투자하는 방식을 말한다. 지난해 11월 상장된 삼성자산운용 ‘KODEX 200ESG’ ETF’가 대표적이다. 코스피200 ESG 지수를 기초지수로 삼는 ETF로, KOSPI200 중 ESG 성과가 우량한 종목에 투자한다. 기준을 충족해도 도박, 담배, 주류, 군수산업 관련 주된 영업기준이 20% 이상인 종목은 제외한다는 원칙이 있다.액티브 펀드로는 ‘키움올바른증권투자신탁 1[주식]’, ‘KB아메리칸센추리글로벌리더스증권자투자신탁(주식)(H)(운용)’, ‘코레이트주주성장타겟증권투자신탁[주식]’, ‘KTB지배구조1등주증권투자신탁[주식](운)’, ‘한국투자글로벌착한기업ESG증권투자신탁(주식-재간접형)(모)’ 등이 지난해 출시됐다. ESG 평가 상위등급 기업이나 등급 상향 기업의 주식에 주로 투자한다. 재간접 펀드는 글로벌 ESG ETF에 분산투자하는 식이다. 규모는 다소 아쉽다. 이들의 전체 설정액은 3157억원으로, 코스닥벤처펀드(4415억원) 보다 적다. 최근 1년 동안 63억원의 자금이 유입된 정도다. 그나마 가장 설정액이 높은 펀드가 ‘마이다스책임투자증권투자신탁(주식)A1’으로 552억원 수준이다. 수익률은 나쁘지 않다. 지난달 기준 (7.55%), (7.30%), (2.47%) 등을 담아 1년 수익률 0.87%를 기록했다. 같은 기간 국내 주식형 펀드의 수익률은 -7.17%였다. 글로벌 ESG 투자자산은 2018년 말 주요 5개 시장 기준(유럽·미국·일본·캐나다·호주/뉴질랜드) 30조 달러를 넘었다. 그에 비해 국내 ESG 투자는 걸음마 단계다. 현업에 있는 펀드 매니저들은 취지나 방향성에는 동의하지만 수익률 극대화 전략 측면에선 의구심을 표한다. 투자할 종목이 다양하지 않다는 것도 고충이다. 대다수 SRI펀드가 저마다 콘셉트는 달라도 대형주인 삼성전자와 SK하이닉스를 보유하고 있다는 점이 이를 말해준다. 한 펀드 매니저는 “ESG가 의미있는 접근법은 맞지만 전략으로서는 의문이 있어 국내선 아직까진 기관 투자자 중심”이라면서 “사회적인 관심과 제도화 등이 병행돼야 할 것”이라고 말했다. 한국신용평가는 최근 발표한 보고서 ‘ESG 채권시장의 성장과 외부평가제도 도입의 필요성’를 통해 “ESG 시장은 태생적으로 공공적인 성격을 지니고 있어서 자유시장 논리에 근거한 자발적인 발전에는 한계가 있다”면서 “유관부서와 공적 투자기관을 중심으로 ESG 투자 관련 규제 및 인센티브 제도 도입, 기업의 ESG 관련 공시의무 강화 등 구체적인 제도적 뒷받침이 우선적으로 이루어져야 한다”고 강조했다. 그나마 ESG 관련 투자에 가장 적극적인 기관도 국민연금이다. 한신평에 따르면 2018년 말 기준 국내 3대 공적 연금·기금의 ESG 관련 투자는 약 27조원 수준으로, 국민연금 비중이 약 99%를 차지하고 있다. 한국거래소도 ESG 공시 전담팀을 최근 마련했다. 올해부터 실시되는 기업 지배구조 보고서 공시를 관리하고 환경(E)과 사회(S) 정보공개 확대를 위한 방안을 세운다는 계획이다. 외부 전문가로 구성된 ESG 전문 위원회도 만들 예정이다.김윤지 (jay3@edaily.co.kr)＜ⓒ종합 경제정보 미디어 이데일리 - 무단전재 & 재배포 금지＞",/news/news_read.nhn?article_id=0004587259&office_id=018&mode=search&query=SK&page=11
[3월 2일(월)],"◇ 무상권리락 = 모바일어플라이언스◇ 공모주청약 = SK제6호기업인수목적(SK) 플레이디(KB)◇ 상장폐지 = 한국제5호스팩◇ 무상기준일 = 모바일어플라이언스◇ 공모주청약 = SK제6호기업인수목적(SK) 플레이디(KB)---▶ ▶
 ▶
ⓒ 한국경제 & , 무단전재 및 재배포 금지",/news/news_read.nhn?article_id=0004299132&office_id=015&mode=search&query=SK&page=11
"SKT, 블루 모델로 3040세대 공략KT 온라인 첫날 절반이 레드 선택LGU+ 핑크, 판매량의 41% 차지","삼성전자의 플래그십 스마트폰 갤럭시S20이 신종 코로나바이러스 감염증(코로나19) 여파로 고전하는 가운데, SK텔레콤 KT LG유플러스 등 이동통신 3사가 ‘컬러 마케팅’을 앞세워 반전을 노리고 있다. 통산 3사는 자사에서만 구입이 가능한 블루(SK텔레콤), 레드(KT), 핑크(LG유플러스) 색깔의 전용폰을 각각 출시해 호응을 얻고 있다.
SK텔레콤은 지난해 갤럭시노트10에 이어 갤럭시S20까지 2년째 ‘블루’를 전면에 내세워 30, 40대를 공략하고 있다. 갤럭시S20 사전예약 고객 중 약 40%가 블루 모델을 선택했는데, 이는 지난해 갤럭시노트10 당시(약 35%)보다 ‘블루’ 선호가 늘어난 것이다. 특히 30, 40대는 50%가 블루를 골랐다.
SK텔레콤은 출시 전 삼성전자와 협의 과정에서 글로벌 색채전문 기업 팬톤이 ‘올해의 색’으로 선정한 블루를 채택해줄 것을 적극 요구한 것으로 전해졌다. SK텔레콤 관계자는 “한국 경제의 젊은 축인 30, 40대가 블루의 진취적인 이미지에 반응하고 있다”며 “컬러 마케팅이 코로나19라는 악재 극복의 촉매제가 되길 기대한다”고 말했다. KT는 레드 모델을 통해 20, 30대 고객 확대를 노리고 있다. KT에 따르면 사전개통 첫날인 27일 KT 공식 온라인몰 KT숍에서 갤럭시S20을 개통한 고객의 55%가 ‘레드’를 택했다. 특히 KT의 레드 전용 모델을 선택한 고객의 82%가 2030세대였다. KT는 2030세대에 인기가 높은 가수 제니(블랙핑크)를 모델로 내세웠고, 제니의 광고영상은 공개 10일 만에 누적 조회수 1000만 뷰를 돌파하는 등 호응을 얻고 있다. KT는 레드가 여성뿐 아니라 남성 고객 확장에도 효과적이라고 보고 있다. 개통 첫날 레드 모델 구입자의 60%가 남성이었을 정도다. KT관계자는 “한국 사람에게 레드는 성별을 넘어 보편적인 열정을 드러내는 색”이라고 설명했다.
LG유플러스는 올해 처음 ‘핑크’ 전용폰을 도입했다. 갤럭시S20 사전계약 단계에서 36.1%를 차지했던 ‘핑크’ 모델은 개통 첫날 판매량의 41%를 차지하며 인기를 이어갔다. 지난해 갤럭시S10 당시 가장 많이 팔린 실버(39%)를 넘어선 것이다. LG유플러스가 도입한 핑크는 미국의 IT전문매체인 안드로이드센트럴로부터 갤럭시 S20시리즈 중 ‘최고의 색상’으로 평가받기도 했다.
특히 LG유플러스는 디지털전문 광고대행사인 펜타클과 함께 핑크 알리기에 적극 나서고 있다. LG유플러스 관계자는 “스마트폰 시장에서 찾아보기 어려운 핑크 컬러처럼, LG유플러스를 선택하면 ‘선을 넘는 혜택과 기능’이 있다는 점을 강조하고 있다”고 말했다.유근형 기자 noel@donga.comⓒ 동아일보 & donga.com, 무단 전재 및 재배포 금지",/news/news_read.nhn?article_id=0003272789&office_id=020&mode=search&query=SK&page=11
,"경기 위례·수원 등 수도권 아파트 단지 청약에 수만명이 몰렸다.1일 한국감정원 '청약홈'에 따르면, 지난 28일 1순위 청약을 받은 경기 하남 위례신도시 '위례신도시 중흥S클래스'의 경우 426가구 모집에 4만4448명이 신청했다. 평균 경쟁률이 104대1을 기록했다. 이 아파트는 우한 코로나 바이러스 감염증 여파로 실물 모델하우스 없이 사이버 모델하우스만 열고 분양에 나섰는데도 청약 인원이 몰렸다.업계에서는 공공택지에 들어서 분양가 상한제 적용을 받은 이 아파트 가격이 주변 시세보다 저렴한 데다 공급 물량이 모두 대형으로 절반은 추첨제였기 때문에 청약 점수가 낮은 사람들도 대거 신청한 것으로 보고 있다.앞서 지난달 19일 순위 청약을 받은 경기 수원 팔달8구역 재개발 '매교역 푸르지오 SK뷰'에는 15만6506명이 신청했다. 수도권 분양 아파트 중 15만명 이상의 청약자가 몰린 것은 2006년 경기 성남 판교 봇들마을1단지(17만여명) 분양 이후 처음이다. 이 아파트도 사이버 모델하우스만 열고 분양에 나섰다. 지난달 27일 발표된 당첨자 가운데는 청약통장 만점자(84점)도 있었다.[이송원 기자 lssw@chosun.com] 	[]	[]	[] 	- Copyrights ⓒ 조선일보 & chosun.com, 무단 전재 및 재배포 금지 -",/news/news_read.nhn?article_id=0003511696&office_id=023&mode=search&query=SK&page=11
