head,text,url
코로나19로 공모주 시장 침체에도 IPO 추진 결단,"“건설업 영업이익률은 업계 1위 기업도 5%를 넘기기 어려울 만큼 빡빡한 게 현실입니다. 하지만 애플 같은 제조업체는 20%를 훌쩍 넘기죠. 건설업의 수익구조 패러다임을 제조업처럼 바꾸고 싶습니다.”기업공개(IPO)를 앞둔 건축구조 기술기업 센코어테크의 이승환 대표()가 밝힌 포부다. 현장에서 거푸집을 짜는 등 사람 손으로 ‘한땀한땀’ 건물의 뼈대를 만드는 대신 미리 공장에서 만든 부품을 조립만 하면 골조가 완성되도록 건축 방식을 송두리째 바꾸겠다는 아이디어다. 그리고 이 아이디어는 현장에서 그 효율성을 인정받았다. 전체 공사 기간 중 64%를 차지하는 건축구조 공사 기간을 절반으로 줄일 수 있어 공사기간이 생명인 대기업들로부터 ‘러브콜’이 끊이지 않고 있다. 센코어테크는 오는 29일 코스닥에 상장한다.센코어테크의 뿌리는 1973년 설립된 센구조연구소다. 이 대표의 부친인 이창남 대표가 설립한 구조엔지니어링 연구소다. 1988년 한국종합무역센터, 1991년 한국산업은행 본점 등을 여기서 설계했다. 센코어테크는 구조설계에서 한 발 더 나아가 구조를 짓는 데 필요한 모듈을 직접 생산하기 위해 2010년 설립됐다.센코어테크의 강점은 자체 개발한 최신 공법을 활용해 공사 기간을 획기적으로 단축할 수 있다는 점이다. 이 대표는 “건축현장에서 우리가 공급하는 모듈을 조립만 하면 건물의 뼈대가 되는 골조가 완성된다”며 “기존 방식으론 한 층당 4~5일이 걸리는 일을 우리 모듈을 쓰면 이틀이면 충분하다”고 했다. 공사기간을 줄일 수 있다보니 대기업이 자연스럽게 충성도 높은 고객이 됐다. 삼성을 비롯해 SK, LG 등 국내 대기업의 공사 다수를 도맡아했다. 지난해에만 삼성전자 및 삼성엔지니어링으로부터 3개, SK하이닉스로부터 1개 공사를 수주했다. 공장뿐 아니라 데이터센터, 물류창고 등 공사기간을 최대한 줄여야 하는 업체들도 센코어테크를 찾고 있다.센코어테크는 코로나19 확산으로 공모주 시장이 얼어붙자 거래소로부터 승인을 받은 IPO의 철회를 잠시 검토했으나, 결국 상장 기한 내 코스닥 입성을 추진하기로 결단을 내렸다. 기업가치를 제대로 평가받지 못할 수 있다는 우려에도 이 대표는 “높은 기업가치를 평가 받기 위해 IPO를 미루는 것보단 하루라도 빨리 상장사가 되는 것이 우리 회사에 더 중요하다고 판단했다”고 밝혔다. 그는 “회사 실적이 좋으면 주가는 자연스럽게 따라 오를 것”이라며 자신감을 드러내는 한편, “시장에서 검증 받은 상장사라는 점을 활용해 글로벌 마케팅에 본격적으로 나서겠다”고 말했다.센코어테크는 미국 등 선진국을 타깃으로 사업 영역을 확장한다는 계획이다. 이 대표는 “인건비가 높은 나라일수록 공사기간을 단축하는 게 중요해 사업에 유리하다”고 설명했다. 회사에 따르면 센코어테크의 공법을 사용하면 현장인력을 70% 가까이 감축하고 원부자재 소모 또한 20% 줄일 수 있다.이 회사는 지난해 3분기 기준 매출 2025억원, 영업이익 189억원, 순이익 162억원을 냈다. 2018년 연매출과 비교해 매출은 1081억원(114.6%) 늘고 영업이익은 59억원(45%), 순이익은 52억원(46.9%) 증가했다.희망공모가격은 1만2400~1만6500원이다. 이를 기준으로 한 공모예정금액은 272억~361억원이며 예상시가총액은 881억~1172억원이다. 오는 13~14일 수요예측(기관투자가 대상 사전청약)을 거친 뒤 20~21일 일반 청약을 받는다. 대표상장주관사는 삼성증권이다.이우상 기자 idol@hankyung.com ▶ ▶
 ▶
ⓒ 한국경제 & , 무단전재 및 재배포 금지",/news/news_read.nhn?article_id=0004322252&office_id=015&mode=search&query=SK&page=3
"웹툰 전성시대…광고 수익 짭짤브랜드 웹툰 광고료 최고 5000만원정부 부처, 대기업들 광고 집행 잇따라","네이버와 카카오의 웹툰 광고 단가가 5000만원을 호가하는 것으로 나타났다. 1조원 규모 시장을 기반으로 웹툰이 포털 업체 실적 성장을 이끄는 '황금알 낳는 거위'로 자리 잡았다.10일 업계에 따르면 네이버는 브랜드 웹툰 광고에 5000만원의 단가를 일괄 적용하고 있다. 브랜드 웹툰은 특정 기업이나 제품을 주제로 웹툰 시리즈를 제작·연재하는 상품. 기업이 알리고자 하는 이미지나 제품이 독자들에게 쉽고 재미있게 전달되도록 웹툰을 이용하는 형태다. 주1회씩 총 8회 연재되며 웹툰 작가에게 주어지는 작가료는 광고비와 별도로 계산한다. 작가료는 작가의 네임 밸류에 따라 천차만별이다.정부부처들의 브랜드 웹툰 수요가 이어졌다. 한국관광공사는 웹툰으로 걷기 여행을 알렸고 중소벤처기업부·창업진흥원은 창업경진대회를 웹툰 주제로 다뤘다. 행정안정부는 중앙부처·지방자치단체·공공기업이 함께 추진하는 정부 혁신을 웹툰을 통해 소개했다.대기업들도 뛰어들었다. 현대자동차 KT 한화케미칼 DB손해보험 비씨카드 등 주요 기업들이 네이버와 손잡고 브랜드 웹툰 광고를 진행했다.주호민, 기안84, 김규삼, 김양수, 이말년, 조석, 판다독 등 유명 웹툰 작가들이 브랜드 웹툰 작가로 나섰다.카카오는 다음 웹툰의 브랜드 웹툰 광고비를 8회 연재 기준 3200만원으로 책정했다. 네이버와 마찬가지로 제작비(작가료)는 제외했다. 제작비 단가는 웹툰 작가의 이름값에 따라 최소 400만원에서 1000만원 이상으로 구분된다.간접광고(PPL)도 수익이 쏠쏠하다. PPL은 연재 중인 작품의 스토리 내에 기업명이나 제품을 노출하는 방식이다. 독자의 거부감 없이 자연스러운 홍보 효과를 누릴 수 있다고 포털사는 설명한다.네이버는 작가에 따라 최소 400만원에서 최대 2500만원까지 PPL 광고단가를 구분했다. 브랜드 웹툰과 달리 작가료를 포함한다. SC제일은행 일동후디스 굽네치킨 푸마 등이 네이버 웹툰과 PPL을 진행했다.웹툰 독자에게 기업 광고 시청과 '캐시'를 맞바꿔 주는 것도 포털사의 웹툰 수익모델이다. 캐시는 유료 웹툰 결제시 현금 대신 사용할 수 있다. 영화 예고편을 감상하거나 기업 애플리케이션(앱)을 내려받는 등 기업 광고·이벤트에 참여하는 이용자에게 캐시를 지급하는 식이다. 롯데홈쇼핑 SK플래닛 스마일게이트 영화사 NEW 등이 다음 웹툰과 함께 캐시탭 광고를 진행했다.이처럼 포털사는 웹툰과 연계한 다양한 서비스를 통해 수익을 내고 있다. 광고와 유료결제, 지식재산권(IP) 사업 등으로 다각화하고 있다. 라인웹툰, 라인망가를 포함한 네이버웹툰의 작년 거래액은 6000억원에 달한다. 카카오는 카카오페이지, 다음웹툰, 픽코마(카카오재팬)를 통해 지난해 4300억원의 매출을 올렸다.대다수 산업이 코로나19(신종 코로나바이러스 감염증) 여파에 타격이 예상되지만 웹툰은 도리어 성장세를 지속하고 있다. '집콕족'이 증가하면서 웹툰을 찾는 이들도 따라 늘고 있어서다.주영훈 유진투자증권 연구원은 ""코로나19 사태로 재택근무와 실내활동이 늘면서 인터넷 사용량과 콘텐츠 소모량이 급증하고 있다""며 ""웹툰이 가파른 성장세를 보이는 등 콘텐츠 매출 성장이 포털사 실적 증가로 이어지는 추세""라고 말했다. 김은지 한경닷컴 기자 eunin11@hankyung.com기사제보 및 보도자료 open@hankyung.com▶ ▶
 ▶
ⓒ 한국경제 & , 무단전재 및 재배포 금지",/news/news_read.nhn?article_id=0004322256&office_id=015&mode=search&query=SK&page=3
▶ 네이버 홈에서 [한국경제TV] 채널 구독하기 [생방송보기]▶ 대한민국 재테크 총집결! - [증권 / 주식상담 / 부동산],"[한국경제TV 라이온봇 기자]코스피시장에서 SK(034730)이 장 막판에 큰 폭으로 상승했다.-0.88% 하락출발한 주가는 꾸준히 상승하여 오후 3시 17분 현재는 전일대비 5.26% 수준인 18만원을 기록하고 있다.차트를 살펴보면 중기 추세상으로는 역배열 구간에 있지만 단기적으로는 정배열 구간에서 상승흐름을 이어왔다.오늘 SK은 전체 주식수의 0.38%에 해당하는 26만9933주가 거래되고 있는데 전일 거래량 대비 148.26% 수준이다.14시 30분 잠정집계에 따르면, SK은 외국인과 기관이 각각 13,780주, 12,000주를 순매수 중이다. 기관 중에 투자신탁과 은행의 자금이 유입되었다.※ 사모펀드 등 일부 기관의 순매매량은 표시되지 않음이 시각 거래소에서 SK 이외에도 IHQ(7.14%), 조선내화(8.12%), 테라젠이텍스(29.67%), 대원(7.69%), TIGER 골드선물(H)(5.0%) 등이 상승세를 보이고 있다.※ 본 기사는 한국경제TV와 `금융 AI 전문기업 씽크풀`이 실시간으로 작성한 기사입니다.라이온봇기자 ⓒ 한국경제TV, 무단 전재 및 재배포 금지",/news/news_read.nhn?article_id=0000863362&office_id=215&mode=search&query=SK&page=2
,"(서울=연합뉴스) 고은지 기자 = 파주에코에너지는 도시가스가 공급되지 않는 사업소 인근 농촌 가구에 도시가스 배관망을 설치한다고 10일 밝혔다.

한국동서발전이 서울도시가스, SK건설과 합작 설립한 파주에코에너지는 2020년 준공을 목표로 파주시 도내리 서울도시가스 부지 내 8MW급 발전소를 1단계로 건설하고 있으며 2단계 사업도 조만간 추진할 예정이다.

이와 함께 파주에코에너지는 KF94 마스크 5천장을 파주시 취약계층에 기부했다.

기부한 마스크는 파주시 사회복지과를 통해 시내 사회복지시설과 저소득층에 전달될 예정이다.

eun@yna.co.kr",/news/news_read.nhn?article_id=0011539665&office_id=001&mode=search&query=SK&page=2
▶ 네이버 홈에서 [한국경제TV] 채널 구독하기 [생방송보기]▶ 대한민국 재테크 총집결! - [증권 / 주식상담 / 부동산],"최근 언택트(Untact) 채용이 주목을 받으면서, 채용 시장에서 대세로 떠오르고 있는 'AI 채용'의 전문 자격증이 국내 최초로 등록됐다.㈜다온컴퍼니(대표 최준형)는 최근 시장이 급성장하고 있는 AI 채용 분야의 전문가를 양성하고 구직자에게 정확한 정보를 제공하기 위해서 'AI 채용 컨설턴트 자격증(등록번호 제2019-006395호)'을 국내 최초로 등록했다고 9일 밝혔다.'AI 채용 컨설턴트' 자격증은 채용 전문가들에게 AI 채용에 대한 전문적인 지식을 전달하고 컨설턴트의 자격을 엄격히 검증해 발급되며, 현재 14기수 140여 명이 교육을 수료하고 79명이 자격증을 취득했다.AI 채용은 채용 프로세스의 시간과 과정을 효율적으로 개선하고 객관성과 공정성이 높다는 점에서 주목받고 있으며, AI역량검사의 경우 현재 300여 개 기관에서 도입해 채용에 활용하고 있다고 알려져 있다. AI 채용 시장은 점차 그 효과가 검증되기 시작하며 SK, LG, 롯데 등의 대기업을 비롯한 여러 기업에서 속속 도입하는 등 시장이 꾸준히 성장하고 있다.이 가운데 'AI역량검사', 'AI면접', 'AI자소서분석'등 다양한 솔루션이 출시돼 채용에 활용되고 있지만 정작 구직자들은 채용시장의 변화에 적응하지 못해 어려움을 겪고 있다. 또한, 구직자들을 지도해야 할 취업상담사, 취업컨설턴트, 취업 강사들도 흐름을 따라가지 못하고 있어 구직자들은 기댈 곳조차 없는 상황이다.특히 구직자의 불안한 마음을 이용해 기존 취업 전문가들이 AI 채용에 대한 전문적인 연구와 지식 없이 구직자를 지도하는 경우가 발생하고 있고, 이 과정에서 검증되지 않은 정보가 제공되며 구직자가 낭패를 보거나 불만을 갖는 등 부작용도 발생하고 있다.이런 상황에서 전문적인 지식과 최신 트렌드에 강한 AI 채용 컨설턴트는 이들의 만족도를 크게 높여줄 수 있을 것으로 기대된다.㈜다온컴퍼니의 AI 채용 컨설턴트 자격 과정은 현재 채용에 실제 활용되고 있는 AI 채용 솔루션 업체들과의 여러 차례 협업 끝에 론칭한 과정이며, 교육내용을 AI 솔루션 업체에 직접 검증받고 있어 신뢰도가 높다.일반적으로 AI면접만을 다루는 교육과는 다르게 'AI자소서분석', 'AI역량검사', 'AI면접' 등 다양한 솔루션을 다루고 있으며, 또한 각 분야별 대표 솔루션뿐만 아니라 출시된 대부분의 솔루션을 다루고 있어 AI 채용 전반에 대한 이해가 가능하다. AI 채용 컨설팅 과정에서 추가 비용을 들이지 않도록 ㈜다온컴퍼니에서 자체 개발한 자소서 분석 기법과 AI역량검사 대비법을 알려주고 있다.㈜다온컴퍼니 최준형 대표는 ""현재 AI 채용에 대한 기본적인 컨설팅을 제공할 수 있는 수준의 '어드밴스드(Advanced)' 과정으로 운영하고 있지만, 향후 AI 채용 솔루션을 직접 운영하고 활용할 수 있는 실습중심의 '프로(Pro)'과정을 준비하고 있다""고 밝혔다.'언택트' 시대가 본격적으로 열리면서 사람과 직접 접촉 없이 채용 프로세스를 진행하는 등 채용의 패러다임이 바뀌고 채용의 대안 중 AI채용이 주목 받고 있어 앞으로 취업교육 시장도 AI채용을 중심으로 재편될 것으로 전망된다.㈜다온컴퍼니는 앞으로도 취업 전문가들의 역량을 향상시킬 수 있는 다양한 과정을 지속적으로 개발하고 운영할 예정이며 온라인 교육 플랫폼인 줌(ZOOM)을 활용한 교육을 오는 4월 23일 진행한다고 전했다.디지털전략부ⓒ 한국경제TV, 무단 전재 및 재배포 금지",/news/news_read.nhn?article_id=0000863363&office_id=215&mode=search&query=SK&page=2
▶ 네이버 홈에서 [한국경제TV] 채널 구독하기 [생방송보기]▶ 대한민국 재테크 총집결! - [증권 / 주식상담 / 부동산],"[한국경제TV 송민화 기자]<앵커>코로나19 대유행으로 전 세계 공장들이 가동을 멈추고 있습니다.해외에 공장을 둔 우리 기업들은 전세기로 직원 수백 명을 급파하는 등 ‘셧 다운’을 막기 위해 고군분투하고 있습니다.송민화 기자의 보도입니다.<기자>지난 5일, SK이노베이션은 헝가리로 전세기를 띄워 국내 기술자 300여 명을 급파했습니다.유럽 전역으로 코로나19가 확산하면서 헝가리 코마롬 지역 전기차 배터리 공장 증설에도 차질이 예상됐기 때문입니다.이번에 투입한 건설·기술 관련 종사자들은 내년 상반기까지 현지에 머물며 2022년까지 공장 증설을 차질 없이 마무리한다는 계획입니다.<전화 인터뷰> 김병도 / SK이노베이션 홍보팀 부장“최근 인력 파견은 신설 중인 제2공장 내 특수 설비를 설치해야 하는 중대한 시점에 많은 한국 기술자가 필요했기 때문입니다. SK이노베이션은 헝가리 당국과 긴밀히 협조하면서 공장 건설 일정을 차질 없이 진행하고 있습니다.""SK이노베이션은 또 중국 난징 배터리 공장에도 국내 직원 50여 명을 보내 경영 정상화에 나섰습니다.이러한 행보는 다른 기업들도 마찬가지입니다.LG디스플레이는 지난달 대한항공 전세기를 띄워 중국 광저우에 위치한 OLED 패널 공장으로 엔지니어 290여 명을 보냈습니다.이 공장은 그동안 낮은 수율로 직원이 많이 필요하진 않았지만 OLED 양산 막바지 작업을 위해 대규모 인원이 요구되면서 이와 같은 결정을 내린 것으로 알려졌습니다.LG전자와 LG이노텍 등 LG그룹 전자 계열사 엔지니어 250여 명도 지난달 30일, 전세기를 타고 베트남에 입국했습니다.삼성디스플레이 역시 지난달, 베트남 플렉서블 OLED 공장 양산을 위해 180여 명의 엔지니어를 태운 전세기를 띄웠습니다.업계 관계자는 “많은 기업들이 자칫 커다란 실적 공백이 생기지 않도록 위기관리에 나서고 있는 상황”이라고 말했습니다.코로나19 대유행에 따른 영향을 최소화하기 위한 국내 기업들의 고군분투는 오늘도 이어지고 있습니다.한국경제TV 송민화입니다.송민화 기자 mhsong@wowtv.co.krⓒ 한국경제TV, 무단 전재 및 재배포 금지",/news/news_read.nhn?article_id=0000863371&office_id=215&mode=search&query=SK&page=2
,"미국 연방준비제도이사회(Fed)가 파격적인 유동성 정책을 내놓자 코스피가 강세를 보이며 한달여 만에 1860선을 회복했다. 10일 코스피는 전일 대비 24.49포인트(1.33%) 오른 1860.70에 거래를 마쳤다. 코스피는 코로나19가 미국, 유럽 등으로 확산하자 지난달 19일 1430선까지 하락했다. 하지만 최근 한달여동안 가파른 회복세를 보이면서 이날 1860선을 회복했다. 코스피가 1860선을 넘긴 것은 지난달 11일 이후 한달여 만이다. 지난밤 미 연준은 최대 2조3000억 달러의 유동성을 시중에 공급할 수 있는 조치를 발표했다. 일부 투기등급 회사채(정크본드)와 상업용 주택저당증권(CMBS), 대출채권담보부증권(CLO)까지 매입하기로 해 파격적이라는 평가가 나오고 있다. 코로나 19 사태로 인해 신용경색 리스크 경고등이 켜진 기업, 가계 및 지방정부를 지원하기 위해 연준이 전격적으로 지원을 결정한 것이다. 특히 코로나 19 사태 이후 금융위기를 촉발시킬 수 있는 시한폭탄으로 지목되었던 대출채권담보부증권(CLO)마저 매입하기로 한 것은 미 연준의 금융 시스템 리스크를 선제적으로 차단하기 위한 목적으로 해석해 볼 수 있다.회원국 간 이견으로 지연되던 EU 경기부양 패키지도 합의에 도달했다. 패키지 규모는 5000억 달러로 주요 내용은 수개월 내 역내 기업들에게 추가 유동성을 제공하고, 정부의 고용 프로그램에 자금을 지원하며, 금융시장 접근이 어려운 유럽 정부에 비교적 유리한 조건으로 신용 라인을 제공하는 것이다. OPEC+(석유수출국기구인 OPEC과 10개 주요 산유국의 연대체)는 9일(현지시간) 긴급 화상 회의에서 하루 1000만 배럴 규모의 감산안을 논의했으나 멕시코의 수용 거부로 합의 없이 회의를 끝냈다. 회의 초반에는 사우디아라비아와 러시아 주도로 잠정적인 합의가 이뤄졌으나 멕시코가 동참을 거부하고 회의에서 이탈하면서 합의안이 불발 위기에 처했다.이번 OPEC+ 긴급회의가 시작되자 국제 유가는 10% 이상 상승했지만 회의 도중 감산량이 하루 1000만 배럴이라는 소식이 전해지면서 서부 텍사스산 원유(WTI)는 9.3%나 급락했다. 시장에서는 코로나19 우려에 기인한 글로벌 원유수요 감소분이 더욱 크기 때문에 이번 감산합의가 큰 효과를 발휘하지는 못할 것이란 평가가 나온다. 글로벌 원유수요 감소분은 약 2000만~2700만 배럴 규모인 것으로 추정된다.김병연 NH투자증권 연구원은 ""하락분의 50% 되돌림점인 1850포인트는 잠시 쉬어가는 구간으로 신용경색 우려, 우한 이동 재개와 라마단 등으로 인해 코로나19 재확산에 대한 경계감이 여전하다""라며 ""증안펀드 집행 미국 4차 재정정책 논의, OPEC+ 감산 합의 등 기대감도 높아 조정이 나타나더라도 하락분의 33% 되돌림점인 1700선 초반이 지지선으로 작용할 전망""이라고 말했다.업종별로 보험, 의약품, 철강·금속 등이 4~8% 급등했고 종이·목재, 음식료품, 의료정밀 등은 떨어졌다. 매매주체별로 외국인과 기관이 각각 553억원, 2086억원을 순매도했고 개인은 2541억원을 순매수했다. 프로그램 매매는 3159억원 매도 우위를 나타냈다. 시가총액 상위 종목들은 혼조세를 나타냈다. 삼성바이오로직스가 16%나 급등했고 삼성전자, 현대차, 삼성물산도 상승했다. 반면 SK하이닉스, NAVER, 셀트리온, LG화학 등은 떨어졌다. 이날 유가증권시장에서는 466개 종목이 상승했고 386개 종목이 하락했다.코스닥은 전일 대비 4.69포인트(0.76%) 내린 611.26에 마감했다.[디지털뉴스국 고득관 기자] [ⓒ 매일경제 & mk.co.kr, 무단전재 및 재배포 금지]",/news/news_read.nhn?article_id=0004554912&office_id=009&mode=search&query=SK&page=2
■ 경제현장 오늘 '마감시황' - 전화연결 : SK증권 이재윤 연구위원,"하락 출발한 코스피가 반등했습니다. 자세한 상황 알아보죠. 현재 코스피는 1860.67로 전일대비 1.33% 상승했고, 코스닥은 611.20으로 전일대비 0.77% 하락했습니다. 오늘 코스피 내에서 투자자별 수급은 현재시각 기준으로 외국인이 693억원 가량 매도, 기관은 2000억원을 가량 매도했습니다.전일 미국 증시는 미국 연준의 경기부양책 소식에 상승 마감했는데요. 연준은 중소기업과 지방정부 등에 2.3조 달러 규모를 투입하겠다고 밝혔습니다. 특히 이를 위해 정크본드, CLO 등 위험자산까지 매입하겠다며 사상 유례가 없었던 파격적인 부양책을 발표했습니다.한편, 이날 발표된 주간 실업수당 청구 건수가 다시 660만 건에 달하면서 지난 3주간 미국 노동인구 중 10%가 실직하게 됐는데요. 하지만 그럼에도 불구하고 미국 시장은 연준의 파격적인 경기부양책에 집중하며 상승했습니다. 국내 증시도 미국 증시 상승 여파로 상승 출발했는데요. 다만, OPEC+가 원유 감산 최종 합의에 이르지 못할 수도 있다는 우려가 장중 상승폭을 제한하기도 했습니다. OPEC+ 화상회의에서 1000만배럴 정도 원유 감산에 대한 잠정 합의가 이뤄졌다는 보도가 나왔지만, 감산 규모가 갈수록 줄어들 것이란 발언이 나오고, 멕시코가 감산 합의에 거부한다는 소식이 나왔기 때문입니다. 오늘 코스피 내 특징적이었던 업종은 '보험' 업종입니다. 특히, '한화생명'과 '삼성생명'이 장중 10% 넘게 상승하면서 생명보험 업종의 상승이 두드러졌는데요. KB금융이 푸르덴셜생명을 2.3조원에 인수한다는 소식이 긍정적 영향을 미치고 있는 것으로 보입니다. 그동안 생명 보험사들은 금리하락으로 역마진 우려가 커지면서 하락세를 보였었는데, 이에 따른 저가 매수세도 유입됐습니다.EU 재무장관들이 5,400억 유로 규모의 구제금융에 극적으로 합의했습니다. 다만 코로나본드 발행에 대한 합의 도출에는 실패했는데요. 대신 유로안정화기금(ESM)을 통한 지원방안에는 합의에 도달하면서 EU는 급한 불을 껐습니다. EU는 구제자금을 통해 코로나19로 타격을 입은 국가들에 지원할 예정입니다. 미국 연준이 이번에도 2.3조 달러 규모의 지원책을 발표했습니다. 특히, 정크본드와 CLO(대출담보부증권), 상업용 모기지 채권까지 매입하겠다고 밝혔는데요. 매우 위험한 자산을 연준이 떠안겠다고 하는 것이기 때문에 이에 대한 우려는 있지만, 연준이 대책을 내놓았다는 사실에 시장은 긍정적으로 반응했습니다. 코로나19 확산세가 주춤한 가운데 각국의 정책적 지원들이 나오면서 투자심리가 개선됐습니다. SK증권은 이러한 환경이 단기적으로 주식시장에는 우호적일 것으로 보고 있습니다. 또, 낙폭 과대주보다는 기존 주도주에 대한 접근이 유효하다고 봅니다. 장기적으로도 코로나19 사태 이후 테크기업들의 영향력은 더 커질 것이라고 보는데요. 따라서 현금 창출 능력이 있는 신경제 업종에 대해 긍정적인 시각을 유지합니다.(자세한 내용은 동영상을 시청하시기 바랍니다.)
윤선영 기자(anable@sbs.co.kr) ▶ ▶ 저작권자 SBS미디어넷 & SBS I&M 무단전재-재배포 금지",/news/news_read.nhn?article_id=0000209272&office_id=374&mode=search&query=SK&page=2
