head,text,url
‘리스크’에 대한 입장 차이 좁히기 힘들어,"카카오페이와 의 디지털 손보사 합작이 무산됐다. 두 회사는 8개월 가까이 합작사 설립을 준비했지만 결국 이견을 좁히지 못했다. 카카오페이는 단독으로 디지털 손보사 설립에 나섰고, 삼성화재도 새로운 디지털 전략 수립에 나섰다.대형 금융사와 정보기술(IT) 기업의 합작사 설립이 무산된 건 이번이 처음이 아니다. 신한금융그룹과 비바리퍼블리카(토스)는 인터넷전문은행 설립을 위해 손을 잡았지만 작년 3월 갈라섰다. 국내 1위 금융그룹과 1위 핀테크 업체의 만남으로 주목받았지만 끝내 결과물을 내놓지 못했다. 신한금융과 토스에 이어 삼성화재와 카카오페이까지, 한국을 대표하는 금융사와 IT 기업의 '잘못된 만남'이 반복되는 이유는 무엇일까.신한금융그룹과 토스의 인터넷전문은행 설립 과정에서 이슈가 된 건 '리스크'에 대한 관점 차이였다. 금융사는 리스크를 철저한 관리대상으로 바라본다. 새로운 사업에 진출할 때면 늘 리스크에 대비해 헤지(손실을 막기 위한 행위) 전략을 마련하고, 리스크를 줄이는데 사업 계획을 초점을 둔다. 반면에 IT 기업이나 스타트업은 리스크를 사업을 확장하고 세를 넓힐 수 있는 기회로 보는 경향이 있다. '하이 리스크 하이 리턴'이라는 말은 금융에서는 금기어지만, IT 분야나 스타트업에서는 사훈처럼 쓰이는 말이다.문제는 리스크에 대해 전혀 다른 관점을 가진 두 조직이 함께 일을 할 때 생긴다. 신한금융그룹과 토스의 인터넷전문은행 설립 과정에서도 이 문제가 불거졌다. 당시 인터넷전문은행 설립 과정을 지근거리에서 지켜본 한 금융권 관계자는 'CRO'를 누가 맡을지를 놓고 두 회사 간에 이견이 좁혀지지 않았다고 말했다. CRO는 최고위험관리책임자를 말한다. 은행을 비롯한 금융사에서는 CRO의 역할이 매우 중요하다. 회사의 핵심 사업도 CRO의 승인 없이는 추진할 수 없다. 신한금융에서는 인터넷전문은행의 CRO는 신한 출신이 맡아야 한다고 주장했다.토스는 이에 반발했다. CRO를 은행 출신이 맡으면 새로운 도전에 나서야 하는 인터넷전문은행의 혁신에 걸림돌이 될 수 있다는 우려가 컸던 것으로 보인다. 결국 두 회사는 컨소시엄 구성을 끝내고 최종 사업 방향 발표까지 준비했다가 갈라섰다. 토스가 신한금융에 컨소시엄에서 나가달라고 요청했고, 신한금융도 이를 바로 수용했다.금융당국 관계자는 ""두 회사가 결별한 데에는 양측 모두의 책임이 있었다. 토스는 신한의 업무 방식이나 관행이 구태의연하다고 공공연하게 말하고 다녔고, 신한금융은 토스가 은행업을 할 만큼 꼼꼼하지 않고 리스크 관리도 부실하다고 불만이 컸다""고 말했다.대형 금융사와 IT 기업이 합작 프로젝트를 대하는 온도 차이는 작지 않다. 토스나 카카오페이에 합작사 설립은 회사의 방향성을 결정짓는 중요한 도전이다. 토스에 인터넷전문은행은 토스를 하나 새로 세우는 것에 맞먹는 작업이다. 당연히 최고경영자(CEO)부터 말단 직원까지 업무의 초점을 합작사 설립에 맞춰 재조정한다.반면 대형 금융사 입장에서 합작사 설립은 하나의 사업부가 추가되는 수준이다. 금융사의 본업은 합작사 설립과 무관하게 흘러간다. CEO가 합작 프로젝트에 힘을 실어줄 수는 있겠지만 프로젝트가 무산된다고 해서 회사가 휘청하거나 CEO가 짐을 쌀 일은 없다. 프로젝트에 투입됐던 직원들도 원대복귀하면 그만이다.문제는 합작 프로젝트가 금융사 기존 구성원의 이익을 위협할 때 생긴다. 삼성화재와 카카오페이의 디지털 손보사 설립 작업이 그랬다. 삼성화재는 이미 몇 년 전부터 온라인 채널(CM) 조직을 강화하는데 힘을 쏟았다. 덕분에 삼성화재는 국내 손보업계에서 CM 채널 점유율이 60%를 넘을 정도로 강한 경쟁력을 가지고 있다. 디지털 손보사가 삼성화재의 CM 채널 경쟁력을 갉아먹는 상황이 생기면 삼성화재 입장에서는 변죽만 울리고 얻을 수 있는 게 없는 셈이 된다.두 회사가 '자동차보험'을 판매를 놓고 갈등을 빚은 것도 이런 맥락에서 이해할 수 있다. 삼성화재는 다이렉트(온라인 전용) 자동차보험 시장에서 1위를 지키고 있는데 디지털 손보사가 자동차보험을 파면 삼성화재 입장에서는 자신들이 투자한 회사가 삼성화재의 점유율을 잠식하는 일이 벌어지게 된다. 한화손해보험과 SK텔레콤, 현대자동차가 공동으로 설립한 디지털 손보사인 캐롯손해보험이 자동차보험을 판매할 수 있었던 건 한화손해보험의 다이렉트 자동차보험 점유율이 미미했기 때문이다. 보험업계 관계자는 ""삼성화재 입장에선 기존 CM 채널의 경쟁력을 지키면서 디지털 손보사를 하고 싶어했고, 카카오페이 입장에선 그런 식으로는 디지털 손보사가 아무런 경쟁력을 갖출 수 없다고 봤기 때문에 이견이 컸다""고 설명했다.대형 금융사와 IT 기업의 합작 프로젝트는 두 회사의 CEO 레벨에서 추진되는 경우가 많다. CEO 레벨에서 사업 추진을 결정하면 실무진이 움직이는 순이다. 그런데 두 회사 간의 실무진 사이에서 갈등이 싹트기 시작하면 CEO 레벨에서 이를 걷잡을 수 없게 번지기도 한다.신한금융과 토스는 사업을 추진하는 과정에서 실무진 사이에 좁힐 수 없을 정도로 간극이 커졌다. 행사장에서 조용병 신한금융 회장을 만난 기자들이 사업 추진 현황을 묻는 말에 조 회장이 대답을 한 것을 놓고도 두 회사가 다퉜을 정도로 사소한 일 하나하나에서 충돌했다. 밑에서 시작된 갈등이 결국은 위로 번지면서 사업 자체가 엎어졌다.삼성화재와 카카오페이의 디지털 손보사 합작도 실무진 선에서는 조율이 쉽지 않았다고 한다. 금융권 관계자는 ""신한금융이나 삼성화재, 토스나 카카오페이 모두 자신들의 업계에서는 1, 2위를 다투는 기업들이라 실무진의 자존심이나 기싸움이 만만치 않았을 것""이라며 ""특히 지분율 등에서 주도권을 쥐지 못한 신한금융과 삼성화재 실무진에서 볼멘소리가 많이 나왔다""고 말했다. 인터넷전문은행 프로젝트의 경우 토스 측이 지분율 34%를 가진 최대주주로 참여하고 신한금융은 지분율 15%의 전략적투자자로 참여하려 했었다. 디지털 손보사도 카카오페이가 51% 이상의 지분을 가지고 경영권을 쥐고 삼성화재는 재무적투자자로 참여할 계획이었다.대형 금융사와 IT 기업의 합작이 늘 실패로 끝나는 건 아니다. SK텔레콤과 하나금융그룹이 힘을 합친 핀테크 업체 '핀크'는 성공적으로 자리를 잡고 있다. 금융권에서는 IT 기업과 합작사를 준비하는 금융사는 핀크의 성공 사례를 배워야 한다는 말도 나온다. 핀크는 SK텔레콤과 하나금융이 51%, SK텔레콤이 49%를 출자해 만든 회사지만 두 회사 모두의 간섭을 받지 않는다. 완전히 독립해 핀크만의 새로운 문화와 경영 전략을 만들어내고 있다. 작년까지는 하나금융 계열사 사장단 회의에 권영탁 핀크 대표가 참석했지만 올해부터는 이런 자리에도 참석하지 않고 있다. 권 대표는 ""금융사와 IT 기업의 문화를 잘 융합해서 장점만 활용하려고 한다""며 ""하나금융과 SK텔레콤에 핀크의 독립적인 경영을 보장해달라고 요청했고 이런 부분이 잘 지켜지는 게 핀크가 뿌리를 잘 내리는 이유 같다""고 말했다.[이종현 기자 iu@chosunbiz.com]	[]	[] 	chosunbiz.com",/news/news_read.nhn?article_id=0000530986&office_id=366&mode=search&query=SK&page=2
[비즈톡톡],"기업 총수가 타는 차량은 일반의 뜨거운 관심을 받습니다. 물론 총수들은 상황에 맞게 다양한 차량을 돌아가며 이용하지만, 어떤 차를 타는지에 따라 총수의 성향이나 사업적 메시지를 일부 엿볼 수 있기 때문입니다.최근에는 이재용 삼성전자 부회장이 주목을 받았습니다. 그는 지난 26일 삼성바이오로직스 회계 부정 의혹 조사를 받기 위해 검찰에 출석할 때 현대자동차의 제네시스 G90을 타고 왔습니다. 이 부회장은 얼마 전 정의선 현대차 수석부회장을 만나 전기차 배터리 사업과 관련한 논의를 했기 때문에, 이 부회장의 제네시스 G90 선택이 양사 간 협력을 강화하겠다는 메시지 아니냐는 관측이 나오기도 했습니다. 그만큼 대기업 총수들이 타는 차량은 설왕설래로 이어집니다. 지난 2016년 최순실 국정농단 사건과 관련해 국회에서 국정조사가 열렸을 당시에도 9대 기업 총수들이 타고 온 차량이 화제가 됐습니다. 30일 재계 관계자들에 따르면, 최근 기업 총수들이 가장 많이 타는 의전 차량은 제네시스 G90입니다. 이재용 부회장뿐 아니라 정의선 부회장, 구광모 LG그룹 회장, 허태수 GS그룹 회장, 정몽준 아산재단 이사장, 한성숙 네이버 대표 등이 이 모델을 이용하고 있습니다. G90이 인기가 높은 이유에 대해 자동차 업계 한 관계자는 ""고급스러운 디자인과 승차감이 우수하고 ‘회장님 차’란 이미지가 강하기 때문""이라고 설명했습니다. G90의 판매가는 출시 당시 기준 사양에 따라 7706만∼1억1878만원 수준입니다. 소위 ‘오너의 차’라고 불리는 G90은 현대차의 프리미엄 브랜드 제네시스의 플래그십(최고급형) 모델입니다. 비행기 퍼스트클래스 좌석을 벤치마킹해 좌석에는 천연 가죽시트를 적용했고, 내부도 원목의 색상과 질감을 살린 오픈 포어 리얼우드를 적용해 고급스럽게 꾸몄습니다. 또 양 좌석 앞에는 디스플레이가 달려 미디어 시청도 가능합니다. G90의 이전 모델인 제네시스 EQ900도 기업 총수들이 많이 타는 차량입니다. 최태원 SK 회장, 김승연 한화 회장 등이 의전 차량으로 EQ900을 탑니다. 이해진 네이버 글로벌투자책임자(GIO)도 지난해 손정의 소프트뱅크 회장과의 회동 자리에서 EQ900을 타고 등장하는 모습이 포착되기도 했습니다.과거에는 어땠을까요. 지금은 모두 단종됐지만, 현대차의 에쿠스와 쌍용차 체어맨을 기업 총수들이 많이 탔습니다. 특히 쌍용차의 플래그십 세단인 체어맨은 ‘회장’이란 이름 덕분에 기업 대표들 사이에서 인기가 높았다는 게 업계 얘기입니다. 이재용 부회장도 2007년 전무 시절부터 2015년까지 9년간 에쿠스를 이용하다 2015년 8월 체어맨으로 갈아탄 적이 있습니다. 이를 두고 호사가들 사이에선 당시 삼성동 한전 부지를 두고 삼성과 현대차가 경쟁하면서 관계가 소원해진 것 아니냐는 얘기가 나왔습니다. 외제차 세단 중에서는 메르세데스-벤츠가 기업 총수들이 가장 선호하는 브랜드 중 하나입니다. 과거 이건희 삼성전자 회장과 고(故) 구본무 LG그룹 회장 등이 벤츠의 최고급 브랜드인 ‘마이바흐’를 타면서 화제가 됐습니다. 이건희 회장은 2013년부터는 롤스로이스 팬텀으로 갈아타긴 했습니다. 벤츠 애호가로 알려진 신동빈 롯데그룹 회장은 여전히 벤츠 S600을 애용한다고 합니다.밴 차량 역시 기업 총수들이 자주 탑니다. 특히 덩치가 큰 총수들이 밴을 선택하는 경우가 많습니다. 정용진 신세계 부회장은 벤츠의 스프린터를 출퇴근 차량으로 이용하고 있습니다. 한진의 조원태 회장은 기아차의 카니발을 타는데요, 193cm에 달하는 큰 키 때문에 밴을 선호한 것으로 알려졌습니다. 이에 대해 한진그룹 한 관계자는 ""실용적인 스타일을 선호하기 때문""이라고 설명했습니다.최근 트렌드 중 하나는 기업 총수들이 차량을 렌트하는 경우가 많다는 점입니다. 과거에는 수많은 고가의 차량을 ‘수집’하는 총수가 적지 않았지만 최근에는 논란이 일 수 있다는 점을 우려해서인지 대부분이 렌트 차량을 이용한다고 합니다. 전문 업체를 이용하면 유지 관리 면에서 편리하다는 것도 장점입니다. 업계 관계자는 ""기업 대표들은 아무래도 (논란이 일어날 수 있기 때문에) 국산차를 선호하는 편""이라며 ""그중에서도 최고급 세단인 현대차 제네시스 G90, G80 그리고 기아차 K9 등을 많이 선택한다""고 말했습니다.그렇다면 ‘회장님 차량’을 렌터카 업체에서 대여할 경우 가격은 어떨까요. 일단 계약 조건에 따라 월 대여료가 크게 달라집니다. 48개월 렌트, 선납금 30%, 주행거리 3만km 기준으로, 제네시스 G90(프리미엄 럭셔리 모델)의 월 대여료는 약 120만원 수준입니다. 뒤이어 K9(가솔린 3.8 모델)이 약 85만원, 제네시스 G80(가솔린 3.5T 모델)이 약 80만원 수준이라고 합니다.[김우영 기자 young@chosunbiz.com]	[]	[] 	chosunbiz.com",/news/news_read.nhn?article_id=0000530985&office_id=366&mode=search&query=SK&page=2
,"[서울경제] <유가증권> ▲=434억원 규모 통영 죽림신도시 공동주택 신축사업 계약해지 공문 접수 ▲=증권으로부터 100억원 규모 MMT 매수 ▲=불성실공시법인 미지정 ▲=391억원 규모 주주배정후 실권주 일반공모 방식 유상증자 결정 ▲=2020년 7월20일 임시주주총회 소집 예정 이사 선임 및 정관 일부 변경(사업목적 추가 및 주식액면병합 등) 등 검토 중이지만 미확정, 유상증자 또는 사채발행 등 투자유치 방안 검토 중이지만 미확정, 전환사채 행사가액 조정 발생할 수 있지만 미확정 ▲=최대주주인 한앤코시멘트홀딩스 우선주 전량(154만3,685주) 장외에서 주당 1만5,500원에 매수 예정 ▲=현저한 시황변동에 대한 조회공시 요구 ▲현대차=현대차증권으로부터 300억원 규모 MMT 매수 ▲=성모 전 회장 김모 전 부사장에 대해 대법원 상고 기각, 성 전 회장 징역 2년, 벌금 700만원, 김 전 부사장 징역 1년에 집행유예 2년, 벌금 500만원 원심 확정 ▲=1,471억원 규모 화공플랜트 기자재 수주 ▲=자회사
울산우정동지역주택조합 아파트 신축공사 수주, 계약금액 1,085억원 ▲=와 약 18억원 규모 반도체 제조용 장비 공급 계약 ▲=중소기업은행과 918억원 규모 제주 더쇼어호텔 리노베이션 및 증축 공사 수주 ▲남영비비안=메디톡스와 204억원 규모 보건용 마스크 공급 계약(KF94등급) 체결<코스닥>▲=135억원 규모 주식CFD거래 평가손실 발생 ▲=위메스에 대한 흡수합병 안건 이사회에서 승인, 존속법인 상호 메가스터디교육, 합병비율 1대0, 합병기일 2020년 7월 1일 ▲=유안타증권 중국 CERCG 관련 ABCP 부도 발생으로 147억원 규모 부당이득반환 등 청구 소송 제기 ▲=김범철 대표이사 신규 선임 ▲=유건상 대표이사 신규 선임, 박상열, 유건상 각자 대표이사 ▲=서울남부지검 보도자료내용 중 대표 가장납입 혐의 포함돼 있지 않음, 한국거래소 상장적격성 실질심사 대상에 해당하는지 여부 심사 중, 조사기간 6월19일까지 연장 ▲=우진석 대표이사 1인에서 우진석, 김한흠 각자대표로 변경 ▲=28억원 규모 슈팅 몬스터 고양 인테리어 공사 수주 ▲=잔존혈액암세포 검사용 머신러닝 이미지 해석 기반 혈구 분석시스템 개발 협약체결 ▲=바이오써포트 외 4인에서 김덕상 외 1인으로 최대주주 변경 ▲에이프런티어=112억원 규모 유형자산 양수 결정 철회 ▲=현저한 시황변동에 대한 조회공시 요구 ▲=불성실공시법인지정 예고 ▲=유상증자 발행결정 철회설 관련 조회공시 요구 ▲=최대주주 디케이알파트너스제1호사모투자 합자회사에서 코르몬파트너스 외 1인으로 변경 ▲=코퍼스코리아 흡수합병 ▲=GHP GROUP과 207억원 규모 석유스토브 공급계약 체결 ▲=현대중공업과 719억원 규모 LNG 운반선 및 LNG 추진선용 초저온보냉재 공급계약 체결, 현대삼호중공업과 661억원 규모 LNG 운반선용 초저온보냉재 공급계약 ▲=네이버비즈니스플랫폼 과 약 23억원 규모 TESS TAS Appliance 1~3차 공급계약 체결 ▲=대표이사 이광호로 변경, 이에스브이에서 경남제약헬스케어로 상호변경, 이미지 개선 및 사업 다각화 목적 ▲=디지털 헬스케어용 비침습 복잡시료 전처리 자동화시스템 개발 관련, 침습성 액상시료 전자동 전처리 및 진단시스템 기술 개발 관련 국책과제 선정
 /이완기기자 kingear@sedaily.com저작권자 ⓒ 서울경제, 무단 전재 및 재배포 금지",/news/news_read.nhn?article_id=0003746064&office_id=011&mode=search&query=SK&page=2
"DDR4 32GB D램 이달 가격 143.1달러로 전월과 동일PC용 현물 가격은 두달새 20%가량 빠져언택트 수요에도 불구 서플라이 체인 붕괴가 D램 가격상승 제한마이크론의 실적 전망치 상향에도 불구, 코로나19에 미중무역분쟁 더해져 실적 반등 쉽지 않을 전망","[서울경제] 서버용 D램 가격이 각 국의 ‘언택트’ 수요에도 불구하고 제자리걸음을 하며 업계의 불안이 커지고 있다. 신종코로나바이러스감염증(코로나19) 확산에 따른 반도체 특수가 각 국의 인력이동 제한 조치 및 공장 가동 어려움으로 사실상 끝난것이 아니냐는 분석까지 나온다. 30일 시장조사기관인 D램 익스체인지에 따르면 이달 서버용 D램 DDR4 32GB 고정거래 가격은 143.1달러로 지난달과 같았다. 지난 4월 서버용 D램 가격 상승률이 18%에 달했다는 점에서 연초부터 이어져 오던 상승세가 멈춘 셈이다. 서버용 D램은 지난해 말 1개당 106.0달러를 기록한 후 올 1월(109.0달러), 2월(115.5달러), 3월(121.3달러), 4월(143.1달러) 등 매월 꾸준히 상승한 바 있다. 이달 PC용 D램 고정거래 가격은 1개당 3.31달러를 기록했다. 전월(3.29달러) 대비 0.6% 오르는데 그쳤으며 지난해 6월과 가격이 같다. 지난 2018년 9월 가격(8.19달러)의 절반에도 못 미친다. 김선우 메리츠증권 연구원은 “재택근무 활성화로 비디오스트리밍 수요 등이 증가하면서 클라우드 업체들의 수요 강세가 관찰됐으나 동남아에 자리한 각 업체들의 공장(서플라이 체인)이 완전히 회복되지 않아 D램 출하 속도가 둔화돼 가격 상승이 제한됐다”고 밝혔다. 와
등의 D램 공급사들은 제품 생산 수율 향상으로 올 하반기에는 D램 공급량을 추가로 늘릴 것으로 전망돼 가격이 하락할 수 있다는 분석도 나온다. 실제
D램익스체인지는 올 3분기 서버용 D램 판매가격이 제자리 걸음을 할 것이라 예상하는 등 시장 상황이 좋지 않다. 올 4분기 서버용 D램 가격은 공급량 증가에 따라 10% 가량 하락할 것이란 전망까지 나온다. PC용 D램 현물가격의 추이도 좋지않다. D램익스체인지에 따르면 PC용 D램(DDR4 8Gb 기준) 1개당 가격은 이날 3.06달러를 기록했다. ‘언택트’ 경제 활성화로 PC용 D램 수요가 급증했던 지난달 초 가격인 3.63달러와 비교해 20% 가량 떨어졌다. 특히 지난달 8일부터 가격 하락 추이가 계속돼 올 1월 3일 기록했던 가격(3.05달러) 수준까지 내려왔다.
PC용 D램은 서버와 모바일에 이어 D램 시장의 약 18% 가량을 차지하는 중요 시장이다. 업계에서는 현물가격 추이가 고정거래가격의 선행지표 역할을 한다는 점에서 반도체 가격이 전반적으로 하락할 수 있다는 분석도 내놓는다. 낸드플래시 고정거래가격(128Gb MLC 기준) 또한 두달째 제자리 걸음을 해 이달 4.68달러를 기록했다. 업계에서는 서버용 SSD에 강점이 있는 삼성전자를 제외하고는 여타 낸드플래시 업체들이 수익을 내지 못하는 것으로 보고있다. SK하이닉스는 SSD에 탑재되는 컨트롤러 경쟁력 강화를 통해 올 4분기 낸드플래시 부문 흑자전환을 전망하지만 지금과 같은 상황에서는 적자 탈출이 어려울 전망이다. 최근에는 미중 무역분쟁으로 SK하이닉스의 최대 고객사 중 하나인 화웨이에 D램 등 메모리 반도체 공급을 못 할 수 있다는 분석이 제기돼 올 하반기 매출이 크게 꺾일 수 있다는 우려도 나온다. 다만 업황 반등에 대한 기대도 여전하다. 글로벌 D램 시장에서 3위, 낸드플래시 시장에서 4위의 점유율을 자랑하는 마이크론은 최근 실적 발표 자리에서 2020년 회계기준 3·4분기(3~5월) 매출 전망치를 52억~54억 달러로 상향했다. 지난 3월 전망치(46억~52억달러) 대비 높아진 수치로 ‘언택트’ 경제 활성화에 따른 서버와 PC용 반도체 수요 급증을 기대하는 모습이다. 일각에서는 엔비디아와 AMD의 신규 그래픽처리장치(GPU)가 올 3·4분기에 출시될 예정인 만큼 그래픽용 D램은 GDDR6 등의 수요 확대를 기대한다. 마이크로소프트와 소니 등이 신규 콘솔 게임기를 올 연말께 내놓을 예정이라 관련 반도체 수요 상승도 기대된다. 반도체 업계 관계자는 “코로나19에 따른 파장에 미중 무역분쟁 관련 불확실성 등 반도체 업황에 부정적 환경이 조성되고 있다”며 “자동차, 정유, 화학 등 주요 산업이 모두 흔들리는 가운데 반도체 경기마저 흔들릴 경우 국내 경제성장률 예상치 추가 인하가 불가피해 보인다”고 밝혔다.
/양철민기자 chopin@sedaily.com저작권자 ⓒ 서울경제, 무단 전재 및 재배포 금지",/news/news_read.nhn?article_id=0003746065&office_id=011&mode=search&query=SK&page=2
,"5월 넷째 주 휘발유 판매 가격 전주보다 9.8원 올라(서울=연합뉴스) 최재서 기자 = 전국 주간 단위 휘발유 가격이 18주 만에 상승 전환했다.

30일 한국석유공사 유가 정보 서비스 오피넷에 따르면 이달 넷째 주 전국 주유소 주간 단위 휘발유 판매 가격은 전주 대비 9.8원 오른 ℓ당 1천258.6원을 기록했다.

지난 1월 말부터 이어져 온 하락세가 4개월여 만에 멈추고 반등한 것이다. 일간 단위 휘발윳값은 지난 16일을 기점으로 상승하기 시작했다.

이번주 서울 주유소 휘발유 가격은 전주 대비 ℓ당 15.4원 상승한 1천357.3원으로 집계됐다. 지난주에는 0원대의 미미한 상승폭으로 상승 반전한 뒤 이번 주에는 상승폭을 키웠다.

최저가 지역인 대구 주유소 휘발유 가격은 지난주보다 ℓ당 11.3원 상승해 1천220.3원을 기록했다.

상표별로는 알뜰주유소 휘발유 가격이 ℓ당 1천218.7원으로 가장 저렴했고, SK에너지 주유소 가격은 1천271.0원으로 가장 비쌌다.

전국 주유소 경유 가격도 ℓ당 1천68.6원을 기록해 지난주보다 8.6원 올랐다.

정유 업계 관계자는 ""국제 휘발윳값이 4월 넷째 주를 저점으로 상승세를 이어가고 있다""며 ""당분간 국내 기름값 상승도 지속할 것""이라고 전망했다.

국제 유가는 국내 주유소 기름값에 약 2∼3주의 시차를 두고 반영된다.

한국석유공사 관계자는 ""미국의 정제가동률 상승 등의 영향으로 국제유가가 상승했다""면서도 ""석유수출국기구(OPEC) 플러스의 감산 규모 유지에 대한 러시아의 미온적 태도가 상승 폭을 제한했다""고 설명했다.

acui721@yna.co.kr",/news/news_read.nhn?article_id=0011644223&office_id=001&mode=search&query=SK&page=2
