head,text,url
,"[서울=뉴시스] 이진영 기자 = 코로나19 확산을 막기 위해 재택근무를 시행하는 기업들이 늘고 있다. 하지만 재택근무는 일반 인터넷망이나 개인 PC를 이용하는 경우가 있어 회사에서 기업용 PC를 활용할 때보다 보안 위험이 높다. 더군다나 최근 코로나 이슈에 대한 관심을 악용해 악성코드를 유포하는 수법이 기승을 부리고 있다. 이에 따라 SK그룹 보안 서비스 계열사인 SK인포섹은 17일 공식 블로그를 통해 재택근무 시 보안 위험을 낮출 수 있는 팁 5가지를 제시했다. ◆①개인 방화벽 설정 강화해야재택근무 시 개인 PC를 이용한다면 업무용 PC와 동일한 수준으로 방화벽 설정을 강화해야 한다. 종종 사용 편의를 위해 개인 PC의 방화벽 수준이 낮춰진 경우가 있기 때문이다. 방화벽은 사용하고 있는 운영체제와 백신 프로그램에서 설정을 변경할 수 있다. 가령 PC 운영체제 윈도 10의 경우 [설정] -[업데이트 및 보안]- [방화벽 및 네트워크 보호] 메뉴에서 방화벽 설정을 변경할 수 있다.
◆②파일 열람 전 '주의' 재택근무 시 가상사설망(VPN)을 통해 기업 내부망을 접속하는 상황이라면 외부 이메일이나 첨부파일 열람에 더욱 주의를 기울여야 한다. 해킹 공격 상당수가 워드파일이나 PDF 파일을 활용하고 있는데, 검증되지 않은 첨부파일은 함부로 열지 않아야 한다. 특히 코로나19 정보를 사칭한 유사 이메일을 경계해야 한다. ◆③암호화는 습관적으로 특정 시간 동안 PC를 사용하지 않는 경우 비밀번호 8자리가 부여되는 화면보호기 장치를 활성화해야 한다. 자리를 비울 땐 장비가 완전히 로그아웃되도록 설정하는 것이 권장된다. 또한 근무자는 백신 설치 및 점검 등 운영체제를 항상 최신으로 업데이트하는 데 신경써야 한다. 아울러 회사 중요 자료인 경우 무단 열람하거나 부정 출력하지 못하게끔 열람 시 비밀번호를 설정하는 것도 방법이다.
◆④재택근무는 자택에서일반적으로 외부의 다양한 장소에서 장비를 사용하는 것보다 집에서만 사용하는 것이 보안 위험이 낮다. 재택근무는 코로나19 확산 방지를 위한 자발적 자가 격리의 일환이다. 업무는 가능한 집에서 하고 가정용 와이파이 비밀번호는 8자리 이상의 영문과 숫자 등으로 조합해 외부 침입을 방지해야 한다. 혹 보안 사고를 감지했다면 사내 보안 부서나 담당자에게 즉시 신고해야 한다. ◆⑤회사 정보는 개인장비에 저장 금물근로자는 회사 정보나 중요 기밀이 담긴 파일을 가정용 PC를 포함해 개인 소유 장비에 저장하지 않아야 한다. 또 재택근무를 마치고 회사에서 빌린 장비를 반납하는 경우에는 장비에 남아 있는 자료 및 정보가 유출되지 않도록 전부 폐기해야 한다. SK인포섹 관계자는 ""대부분의 재택근무는 일반 인터넷망을 통해 이뤄지므로 기업은 재택근무자가 사용하는 외부 통신망의 보안을 통제하기 어렵다""면서 ""일반 인터넷 접속을 통해 그룹웨어, 전사적자원관리(ERP) 시스템 등 회사의 각종 데이터가 저장된 내부 플랫폼 이용 시 더욱 유의해야 한다""라고 말했다. mint@newsis.com<ⓒ 공감언론 뉴시스통신사. 무단전재-재배포 금지>",/news/news_read.nhn?article_id=0009760129&office_id=003&mode=search&query=SK&page=10
,"[아시아경제 이민지 기자]하나금융투자는 17일 SK텔레콤에 대해 배당 감소는 현실적으로 불가능하다며 투자의견 매수와 목표주가 33만원을 유지했다.최근 SK텔레콤 주가를 보면 올해 배당 감소를 우려하는 투자자들이 많다. 이는 지난해 4분기 회사가 컨퍼런스를 통해 배당 지급 정책을 재검토할 필요가 있다고 언급했기 때문이다. 그러나 이는 배당을 줄이겠다는 의미가 아닌 배당 정책을 바꾸겠다는 의미로 이해해야 한다.김홍식 하나금융투자 연구원은 “배당정책은 중장기적 이익 전망을 토대로 산정하는데 회사의 내년도 영업이익 전망은 긍정적인 상황으로 배당을 줄일 가능성은 희박하다”며 “앞으로 중간배당은 자회사로부터 배당 유입분, 기말배당은 본사 통신 부문의 이익 현금흐름을 기준으로 지급해 나가겠다는 의미로 이해해야 할 것”이라고 말했다.올해 SK텔레콤의 주당 배당금은 지난해 수준인 만원을 유지할 것으로 전망된다. 올해 5월부터는 의미 있는 5G 순증 가입자 수 달성이 예상되고 3분기부터는 영업이익 개선이 기대되기 때문이다. 하이닉스 실적이 신종 코로나바이러스감염증(코로나19)으로 줄 수는 있겠지만 하이닉스의 배당금은 점차 늘어날 것으로 예상된다.아울러 2022년까지 자회사의 이익이 늘어난다고 가정했을 때 20201년에는 중간배당 증가가 나올 것으로 보인다. 김홍식 연구원은 “자회사 가치를 고려했을 때 현재 주가는 과도한 저평가 구간”이라며 “SK하이닉스, 티브로드, ADT캡스, 11번가의 현재 시가와 통신 부문에 대한 시가총액 반영 비중을 고려했을 때 회사 주가는 급등 가능성이 높다”고 내다봤다.이어 김 연구원은 “올해 회사의 기대 배당수익률은 5.2% 수준으로 저평가 구간임을 고려했을 때 분할매수가 필요하다”라고 덧붙였다.이민지 기자 ming@asiae.co.kr <ⓒ경제를 보는 눈, 세계를 보는 창 아시아경제 무단전재 배포금지>",/news/news_read.nhn?article_id=0004643786&office_id=277&mode=search&query=SK&page=10
,"[앵커]코로나19 확산을 막기 위해 지원에 나서는 기업들도 있습니다.인공지능과 클라우드 기술을 동원해 방역 업무를 돕는가 하면 자금 지원에 나서는 곳도 있습니다.재계의 이런 노력은 김창섭 기자가 취재했습니다.[기자]능동감시자에게 전화가 갑니다.[케어콜 녹음 음성 파일 : 안녕하세요? 성남시 보건소입니다. 혹시 지금 발열 증상이 있으세요?]네이버가 성남시에 지원하는 AI 기반 전화 서비스입니다.성남시는 하루에 두 번씩 이 전화로 능동감시자 80명을 점검하고 있습니다.[한석주 / 분당구보건소 건강증진과장 : 네이버에서 클로바 케어콜을 제공해주신 덕분에 초기 300명 능동감시자를 효율적으로 관리할 수 있었습니다. 클로바 케어콜이 도입된 지금은 선별 진료, 역학 조사 등에 직원을 집중적으로 배치할 수 있어 인력 30여 명의 절감 효과를….]NHN도 350여 개 중소기업에 재택근무를 할 수 있는 클라우드 기반 업무 플랫폼을 무료로 제공하고 있습니다.[백창열 / NHN 워크플레이스 개발센터장 : 중소기업들이 대면 업무를 많이 하므로 피해가 클 것으로 생각해서 저희가 무료 제공 결정을 했고요. 갑작스레 재택근무를 하게 돼 어려움을 겪고 있을 중소기업들에 저희 협업 도구가 도움이 됐으면 합니다.]기업들의 경제적 지원도 이어지고 있습니다.SK는 대구, 경북 지역 아동 1,500명에게 도시락을 지원하기로 했습니다.현대백화점은 21개 점포의 중소기업 매장 관리자에게 한 사람당 100만 원씩 지급하기로 했습니다.현대기아차는 서비스 협력사 2천여 곳에 가맹금을 감면해 줍니다.[김준명 / 현대·기아자동차 홍보실 책임 매니저 : 코로나19로 인해 경영 환경이 악화해서 서비스 협력사들이 많이 고통받고 있고 어려움을 겪고 있다는 것을 공감해서 이번에 3개월 동안 가맹금을 지원하기로 했습니다.]코로나19 사태 극복을 위한 기업들의 지원 행렬이 이어지고 있습니다.SBSCNBC 김창섭입니다. 김창섭 기자(cskim@sbs.co.kr) ▶ ▶ 저작권자 SBS미디어넷 & SBS I&M 무단전재-재배포 금지",/news/news_read.nhn?article_id=0000207380&office_id=374&mode=search&query=SK&page=10
,"[머니투데이 황국상 기자] 메리츠종금증권은 17일 급락장세가 이어지는 과정에서는 한국 증시 대표주와 재무 안정성이 높은 종목에 집중할 필요가 있다고 당부했다.강봉주.이정연 연구원은 ""주요국 증시가 이미 30% 안팎으로 하락하면서 PER(주가이익비율) 밸류에이션이 과거 평균 이하로 크게 하락했고 유럽, 일본 등은 과거 5년치 최저 수준까지 PER이 하락했다""며 ""향후 이익전망치 하향이 불가피하지만 주가는 이미 30% 전후의 이익 전망치 하향을 반영한 셈""이라고 했다.이들은 ""현재는 주가 하락의 끝이 보이지 않지만 투자자들이 바라듯 코로나로 인한 기업 이익 감소폭이 30% 이하로 방어된다면 주가 하락으로 인한 밸류에이션 매력을 다시 논하게 될 것""이라고 했다.또 삼성전자, SK하이닉스, 삼성SDI, 삼성전기, NAVER, 카카오, 엔씨소프트 등 7개 종목에 대해 ""2월 이후 강조한 한국 대장주 7형제 종목은 업종 대표주 중에서 2020년 이익과 ROE(자기자본이익률) 개선폭이 가장 크고 외국인 수급, 주가강도가 가장 우수한 7개 종목""이라며 ""대장주 7종목은 3월 증시 추가급락 구간에서도 소폭이지만 코스피 대비 초과수익 흐름을 지속했다""고 했다.아울러 이들은 유동성과 지급능력, 수익성, 레버리지, 활동성을 측정하는 5개 재무 데이터로 점수를 계산한 '알트만 스코어'가 높은 종목에 집중할 필요가 있다고 했다. 코로나 경기 둔화 우려로 투자심리가 악화된 상황에서 재무 우량 종목에 집중할 필요가 있다는 것이다.이들이 제시한 알트만 스코어 상위 종목은 엔씨소프트, 동서, 한국쉘석유, 강원랜드, LG생활건강, 에스원, 일진머티리얼즈, 고려아연, 애경산업, 아모레퍼시픽 등이 있다. 황국상 기자 gshwang@mt.co.kr
<저작권자 ⓒ '돈이 보이는 리얼타임 뉴스' 머니투데이, 무단전재 및 재배포 금지>",/news/news_read.nhn?article_id=0004377112&office_id=008&mode=search&query=SK&page=10
,"[앵커]코로나19 우려로 자세한 소식을 전해드리지 못하고 있지만, 이번 주는 300곳 가까운 상장회사들이 대거 주총을 여는 주간입니다.그런데 이번 주총, 코로나19 때문에 주주들이 제대로 모일 수 있을지도 우려되는 상황인데요.그런데 이번 코로나19 사태 때문에 그간 현장에 적응되는 속도가 느렸던 전자투표제 등 이른바 비대면 주총이 확산 조짐을 보이고 있습니다.오수영 기자입니다.[기자]정기주주총회 시즌이 본격 개막한 지난주에는 40곳이 주총을 열었습니다.이 중 2곳이 결국 정족수 미달로 안건이 부결되거나 주총이 무산됐습니다.[한국상장회사협의회 관계자 : 소액주주의 정족수 확보가 코로나 사태 때문에 어렵게 되다 보니 영향을 미쳤다고 볼 수 있죠. (주총이 무산된 회사는) 다시 감사 선임을 위한 임시 주주총회를 개최하든지 그런 조치를 해야 하겠죠.]이번 주에는 삼성전자와 현대차 등 상장사만 290곳이 주총을 엽니다.대형 상장사들의 주총이 몰려 있어 코로나19 감염 우려도 큰 상황입니다.SK텔레콤은 주총 현장을 온라인으로 생중계할 예정입니다.주총 현장에서 진행되는 안건처리는 전자 투표를 지원합니다.[SK텔레콤 관계자 : 원래는 오프라인으로 하는데, 참석하길 꺼리는 주주들이 많아서 온라인으로 하게 됐습니다. 웬만하면 안 나가려고 하잖아요, 사람들이. 그러다 보니까 주주들의 편의를 도우려고….]SK하이닉스는 주주 간 접촉을 최소화하기 위해 좌석 간격을 2m씩 두기로 했습니다.삼성전자도 최초로 주총장을 서초사옥이 아닌 외부 장소로 결정하고, 전자투표제를 도입했습니다.포스코인터내셔널은 주주들에게 주총 직접 참여 대신 전자투표제와 의결권 대리 행사를 권장하고 있습니다.이밖에 네이버와 현대글로비스·현대제철 등은 보건용 마스크를 반드시 착용하도록 했습니다.일회용 장갑 착용과 손 소독을 의무화하기도 했습니다.주총장 내 코로나19 감염 차단을 위해 기업들이 총력 대응에 나서고 있습니다.SBSCNBC 오수영입니다. 오수영 기자(oh@sbs.co.kr) ▶ ▶ 저작권자 SBS미디어넷 & SBS I&M 무단전재-재배포 금지",/news/news_read.nhn?article_id=0000207381&office_id=374&mode=search&query=SK&page=10
,[이데일리 증권시장부]증권시장부 (stock@edaily.co.kr) | ＜ⓒ종합 경제정보 미디어 이데일리 - 무단전재 & 재배포 금지＞,/news/news_read.nhn?article_id=0004598762&office_id=018&mode=search&query=SK&page=10
,"[이데일리 최정희 기자] 현대차증권은 스마트폰 수요 위축으로 SK하이닉스(000660)의 2분기 실적을 하향 조정키로 했다면서 목표주가도 12만원에서 10만5000원으로 낮췄다. 투자의견은 매수를 유지했다. 노근창 현대차증권 리서치센터장은 17일 보고서에서 “2분기까지 양호한 서버 수요에도 불구하고 스마트폰 수요 위축으로 SK하이닉스의 매출액과 영업이익이 기존 전망치 대비 각각 3.0%, 10.4% 하회하는 6조9000억원, 9820억원을 기록할 것”이라고 밝혔다. 2분기 중국 클라우드 회사들의 수요는 1분기 대비 20% 상승할 것으로 전망되나 애플, 화웨이의 스마트폰 출하량이 예상보다 부진할 전망이다. 애플은 2분기 아이폰SE2 출시에도 불구하고 상반기 생산량이 7500만대에 그칠 것으로 예측되고 있다. 화웨이도 8700만대가 예상된다. 이는 전년동기비 26.3% 감소한 수치다. 그나마 제품 가격 상승 효과에 이익 모멘텀은 유지될 것으로 보인다. 1분기 매출액과 영업이익은 디램(DRAM) 출하량 감소에도 불구하고 서버 디램과 낸드 가격 상승에 힘입어 기존 추정치를 충족시키는 6조8000억원, 4740억원을 기로할 전망이다. 노 센터장은 “메모리 반도체 대비 가격 탄력성이 약한 대만 파운드리회사들의 2월 매출액은 전월보다 9% 감소했고 홍하이의 2월 연결 매출액은 전년동월보다 40.3% 줄었다”며 “SK하이닉스의 경우 인프라 성격의 서버 수요로 실적 방어력이 크다는 점을 고려하면 지나치게 실적을 우려할 단계는 아니다”고 설명했다. 이어 “신종 코로나 바이러스 감염증(코로나19)이 유발한 경기침체 우려를 극복할 수 있는 방어주로서의 저점 매수 전략은 유효하다”고 덧붙였다.최정희 (jhid0201@edaily.co.kr) | ＜ⓒ종합 경제정보 미디어 이데일리 - 무단전재 & 재배포 금지＞",/news/news_read.nhn?article_id=0004598773&office_id=018&mode=search&query=SK&page=10
,"【서울=뉴시스】신항섭 기자 = SK증권은 17일 SK텔레콤(017670)에 대해 7년만에 두 자릿수의 영업이익 증가가 전망된다고 분석했다. 투자의견과 목표주가는 매수와 33만원으로 유지했다.최관순 SK증권 연구원은 ""SK텔레콤의 4분기 실적은 통신3사 중 가장 부진했으나 이후 주가하락 폭도 가장 컸다""면서 ""지난해 실적이 현 주가에 이미 반영된 것으로 판단된다""고 말했다.이어 ""올해 5G를 통한 실적개선은 통신3사 공통요인이나, 전체 연결매출 중 이동통신 매출비중이 지난해 통신3사 중 가장 높았다""며 ""올해 이익 레버리지 효과도 가장 클 것""이라고 전망했다.최 연구원은 ""보안, 커머스 등 다양한 정보통신기술(ICT) 부문에서 지난해 대비 수익성 개선이 예상되고, 티브로드와 SK브로드밴드 합병으로 유료방송 시장 내 규모의 경제효과가 기대된다""고 내다봤다.그는 또 ""이동통신 등 다양한 부문에서 실적개선이 되며 7년만에 영업이익 두 자릿수 장그가 전망된다""며 ""통신섹터의 탑픽으로 추천한다""고 강조했다. hangseob@newsis.com<ⓒ 공감언론 뉴시스통신사. 무단전재-재배포 금지>",/news/news_read.nhn?article_id=0009760149&office_id=003&mode=search&query=SK&page=10
,"[서울=뉴시스] 류병화 기자 = 17일 오전 빅데이터로 분석한 주식시장 코스피 200종목의 시장심리지수(Market Sentiment Index·MSI)는 4단계 '보통'으로 나타났다.뉴시스와 코스콤이 공동으로 뽑아낸 빅데이터 MSI(http://m.newsis.com/stock.html, 모바일 전용)에 따르면 전 거래일 오후 4시부터 이날 오전 8시까지 집계된 코스피 MSI 레벨은 4단계로 전 거래일 대비 3단계 올랐다.대장주 삼성전자의 MSI 레벨은 1단계로 집계됐다. 시가총액 상위 종목 중 SK하이닉스 1단계, LG화학 3단계, 현대차 3단계, 셀트리온 3단계 등을 나타냈다.뉴시스와 코스콤은 250개 주요 상장 기업에 대해 감성 사전을 만들어 해당 종목의 실시간 점수를 산출하고 이를 최근 1년간의 흐름과 비교해 MSI 레벨로 제시하고 있다.MSI는 총 7단계로 나뉜다. 1단계 '매우 나쁨', 2단계 '나쁨', 3단계 '약간 나쁨', 4단계 '보통', 5단계 '약간 좋음', 6단계 '좋음', 7단계 '매우 좋음' 등으로 분류된다.MSI 레벨이 가장 낮은 수준인 1단계에서 가장 높은 수준인 7단계 쪽으로 바뀌면 해당 종목에 대해 온라인상에서의 반응이 부정에서 긍정으로 바뀌고 있다는 뜻으로 풀이할 수 있다.한편 2017년 8월1일부터 선보인 빅데이터 MSI 모바일 전용 버전은 구글플레이 또는 애플 앱스토어에서 '뉴시스' 앱을 내려받거나 뉴시스 모바일 홈페이지(m.newsis.com)에 접속한 뒤 메인화면의 '빅데이터 MSI'를 클릭해 이용하면 된다.※ 빅데이터MSI는 투자 참고용이며, 투자 결과에 책임을 지지 않습니다. 주식시장에서는 다양한 국내외 변수가 존재하기 때문에 한 지표로만 판단하면 뜻하지 않은 결과를 초래할 수 있습니다. hwahwa@newsis.com<ⓒ 공감언론 뉴시스통신사. 무단전재-재배포 금지>",/news/news_read.nhn?article_id=0009760152&office_id=003&mode=search&query=SK&page=10
오토메이션애니웨어와 RPA 기반 디지털 전환 사업 MOU,"[아시아경제 이진규 기자] SK C&C가 제조·금융·통신·서비스 등 주요 산업별 시스템에 특화된 지능형 업무 로봇을 개발하기 위해 글로벌 리딩 기업과 손을 잡았다.SK C&C는 17일 로봇프로세스자동화(RPA) 분야 글로벌 1위 기업 오토메이션애니웨어와 'RPA 기반의 디지털 전환(DT) 사업 협력 MOU'를 체결했다고 밝혔다.오토메이션애니웨어는 전 세계 90여개 국가에 위치한 3500개 이상의 기업에 170만개 이상의 업무 로봇을 제공해 비즈니스 혁신을 주도하고 있는 글로벌 리딩 기업이다.이번 협약은 SK C&C가 보유한 인공지능(AI)·클라우드·빅데이터 기반의 종합 디지털 플랫폼·시스템 구축 역량에 오토메이션애니웨어의 RPA 기술 역량을 결합하고 산업별 업무 특성에 최적화된 '지능형 RPA 시스템 모델' 개발을 위해 추진됐다.단순 데이터 입력·정산·물품 구매 등 기계적 반복 업무의 자동화에 그쳤던 기존 RPA 도입 기업들은 최근 지능형 RPA 시스템을 검토하며 AI가 결합된 디지털 업무 시스템 구축을 추진하고 있다. 지능형 RPA 시스템은 ▲빅데이터 고급 분석 ▲다중 소스 데이터 분석을 위한 비지니스 인텔리전스 ▲AI 기반의 기업 핵심 업무 지원 등 주요 산업별 핵심 시스템에서 기업 업무 전반의 혁신을 이끌 시스템을 말한다.향후 양사는 기업별 업무 특성을 분석해 관행적으로 처리하던 반복 업무를 자동화하는 '핵심 업무별 최적의 RPA 적용 모델'을 개발할 계획이다. 기업들이 공통적으로 사용하는 ERP 영역에서의 자동화는 물론 각 산업별로 특화된 업무 영역에서의 자동화가 이에 해당된다.양사는 우선 대형 글로벌 플랜트 및 건설 분야 디지털 시스템 구축 사업에서 RPA 시스템을 개발해 SK건설 조달 업무에 적용할 예정이다. 양사는 한국에서 만들어질 RPA 시스템이 국내는 물론 글로벌 시장의 디지털 전환 시스템 구축 시장 개척에도 도움이 될 것으로 기대하고 있다.이상국 SK C&C 통신·서비스 Digital 부문장은 ""지능형 RPA 시스템 모델은 복잡하고 까다로운 한국 주요 기업의 핵심 시스템을 완벽히 수용하며 디지털 시스템의 완성도를 높여 줄 것""이라며 ""SK그룹 관계사들의 업무 자동화 사례를 공유하고, 이를 활용할 수 있는 플랫폼을 구현해 국내는 물론 글로벌 시장 개척도 추진할 것""이라고 말했다.이영수 오토메이션애니웨어 코리아 지사장은 ""차별화된 업무 자동화 기술력과 풍부한 구축 경험, 다양한 국내외 도입 사례를 기반으로 SK C&C와의 긴밀한 협력을 통해 국내 기업에 최적화된 업무 자동화 성공 사례들을 만들어 나갈 것""이라고 전했다.한편 양사는 검증된 업무 자동화 성공 사례를 협력사에도 전파하는 등 지능형 RPA 산업 생태계를 구축하고, 청년층 대상 업무 자동화 기술 교육 등의 사회적 가치(SV) 창출 활동도 추진할 계획이다.이진규 기자 jkme@asiae.co.kr <ⓒ경제를 보는 눈, 세계를 보는 창 아시아경제 무단전재 배포금지>",/news/news_read.nhn?article_id=0004643816&office_id=277&mode=search&query=SK&page=10
,"[머니투데이 김도윤 기자] SK증권은 17일 미국 증시가 또 급락했다며 미국 연방준비제도(연준·Fed)의 선제적인 조치도 불안 심리를 잠재우지 못 했다고 분석했다. 앞으로 자산 간 양극화가 뚜렷해질 것으로 전망했다.한대훈 SK증권 연구원은 연준이 제로금리와 함께 국채 5000억달러어치와 주택저당증권(MBS) 2000억달러어치를 사들이기로 했다며, 이는 2008년과 2010년, 2012년 세 차례 QE(양적완화)에 이은 본격적인 QE 시즌4라고 의미를 부여했다. 한 연구원은 2008년 금융위기의 원인은 모기지 채권 부실이라 당시 연준의 모기지 채권 매입이 효과를 봤다고 평가했다. 반면 2008년과 달리 이번 신용 위기의 핵심은 기업부채와 회사채 및 레버리지론의 부실이라 지난 주말 연준이 단행한 조치가 문제 해결과 다소 거리가 멀다는 점에서 불안감이 여전하다고 진단했다.한 연구원은 결국 시간과 싸움이라며, 한 번도 경험하지 못 한 길로 접어든 만큼 투자자의 공포 심리를 제어할 수단이 필요하다고 강조했다. 코로나 백신, 신용 리스크의 이연, 그리고 이를 아우를 정책이 중요하다고 진단했다. 미국 연준은 결국 회사채 매입을 비롯해 기업어음(CP)이나 주식을 매수하는 방식을 선택할 가능성도 배제할 수 없다고 예상했다. 다만 이 과정에서 자산 간 양극화가 심해질 것으로 내다봤다.한 연구원은 현금 및 현금성 자산이 많은 기업이 위험이 진정된 상황에서 주목 받을 수 있다고 조언했다. 현대모비스, SK텔레콤, SK, KT&G, 넷마블, 한국조선해양, 롯데케미칼, 한온시스템 등을 꼽았다.김도윤 기자 justice@
<저작권자 ⓒ '돈이 보이는 리얼타임 뉴스' 머니투데이, 무단전재 및 재배포 금지>",/news/news_read.nhn?article_id=0004377128&office_id=008&mode=search&query=SK&page=10
