head,text,url
,"[아시아경제 황윤주 기자] 전국 주유소에서 판매하는 평균 휘발유 가격이 18주 만에 상승했다. 올해 1월부터 이어져 온 하락세가 4개월 만에 오름세로 전환했다. 30일 한국석유공사 유가 정보 서비스 오피넷에 따르면 이달 넷째 주 전국 주유소 주간 단위 휘발유 판매 가격은 전주 대비 9.8원 오른 리터당 1258.6원을 기록했다.이번주 서울 주유소 휘발유 가격은 15.4원 상승한 1357.3원으로 집계됐다. 최저가 지역인 대구 주유소 휘발유 가격은 지난주보다 11.3원 상승해 1220.3원을 기록했다.상표별로는 알뜰주유소 휘발유 가격이 1218.7원으로 가장 저렴했고, SK에너지 주유소 가격은 1271.0원으로 가장 비쌌다.전국 주유소 경유 가격도 168.6원을 기록해 지난주보다 8.6원 올랐다.한국석유공사 관계자는 ""미국의 정제가동률 상승 등의 영향으로 국제유가가 상승했다""면서도 ""석유수출국기구(OPEC) 플러스의 감산 규모 유지에 대한 러시아의 미온적 태도가 상승 폭을 제한했다""고 설명했다.황윤주 기자 hyj@asiae.co.kr <ⓒ경제를 보는 눈, 세계를 보는 창 아시아경제 무단전재 배포금지>",/news/news_read.nhn?article_id=0004688439&office_id=277&mode=search&query=SK&page=1
,"[머니투데이 정인지 기자] [[베스트리포트]]5월 다섯째주 머니투데이 증권부가 선정한 베스트리포트는 총 3건입니다.△오린아 이베스트증권 연구원의 '현대백화점, SK바이오랜드 인수 추진 보도 코멘트' △박무현 하나금융투자 연구원의 '현대미포조선, 연타석 LPG추진선 대량 수주 계약 임박' △이은영 삼성증권 연구원의 '기아차, 인도의 재개방을 기다리며'입니다. 오린아 이베스트증권 연구원은 현대백화점의 SK바이오랜드 인수 영향을 발빠르고 시의적절하게 시장에 정보를 제공했다는 평가를 받았습니다. 다음은 보고서를 요약한 내용입니다. (원문보기)현대백화점은 화장품 원료 회사인 SK바이오랜드 인수를 추진하고 있는 것으로 알려졌다. SKC가 보유하고 있는 지분 27.9%를 전량 인수한다는 계획이다. 현대백화점은 이를 통해 화장품 사업을 향후 신성장 동력으로 삼겠다는 전략으로 해석된다. 실제로 지난 11일 현대백화점그룹 패션업체 한섬이 기능성 화장품 기업 클린젠코스메슈티칼의 지분 51%를 인수했고, 2021년 자체 스킨케어 브랜드를 출시할 것으로 알려졌다.이를 통해 현대백화점그룹 전반적으로 신성장동력 중 하나인 면세점과 의 시너지를 강화하고 기존 의류 중심의 백화점 사업에서 포트폴리오 다각화에 대한 노력 이 지속될 것으로 예상한다. 다만 화장품 사업은 판매 채널보다는 브랜드를 만드는 것이 매우 중요하다. 2016년 롯데백화점이 런칭했던 PB 화장품 엘앤코스가 2년만에 사업을 중단했던 것을 고려할 때 향후 전략을 지켜볼 필요는 있다.박무현 하나금융투자 연구원은 전세계에서 LPG추진선 발주가 지속되는 상황을 파악하고 현대미포조선이 수주를 할 수 있을 것으로 예상했습니다. 다음은 보고서를 요약한 내용입니다. (원문보기)이스턴 퍼시픽 쉽핑의 LPG추진선 용선계약 소식이 나오자마자 이번에는 인도네시아 국영에너지기업 페르타미나에서 22K급 LPG추진 선박의 대량발주를 준비하고 있다. 이들의 선박의 본계약 소식은 1주일 안에 있을 것으로 예상된다. 페르타미나 발주 선박 경쟁은 현대미포조선과 중국 지앙난 조선인데, 중국 조선소들은 지금도 건조지연이 3~6개월 발생하고 있다. 중국이 금융을 제공하지 않으면 해외 선주들이 중국 조선소를 선택해야 할 이유는 없다.연료는 LNG와 LPG로 달라져가고 있다. 유럽 최대 항구 로테르담에서는 LNG선 박연료 판매량이 급격히 늘어나고 있고 LPG선박은 추진연료 를 벙커C유에서 LPG로 교체하려는 움직임이 늘어나고 있다.현대미포조선의 주력 선종인 20-45K급 LPG선은 글로벌 수주잔고가 11척에 불과하며 중고 선박량 199척중 선령 16년 이상 노후선박 비율은 2024년이면 36%로 오르게 된다. 전통적으로 LPG선에서 강세를 보였던 일본 조선소들이 추진엔진 기술 변화를 따라가지 못하는 상황이라 현대미포조선은 중형 LPG선 수주시장을 독식하게 될 것으로 예상된다. 임은영 삼성증권 연구원은 인도의 시장이 재개방되면 기아차의 실적이 예상을 웃돌 것으로 판단했습니다.다음은 보고서를 요약한 내용입니다. (원문보기) 기아차의 인도 공장은 2019년 7월 가동을 시작해 '셀토스' 열풍에 힘입어 시장점유율 4위 업체로 등극했다. 2분기 봉쇄 해제가 길어지며 적자가 예상되나 2분기 '카니발CKD', '쏘넷' 생산으로 실적 회복을 이끌 것으로 보인다.코로나19(COVID-19) 팬데믹(세계적 대유행)이 본격화 되기 전인 올해 1분기 기아차는 중국 시장을 제외한 모든 시장에서 실적 호조를 보였다. 2019년 '텔루라이드', '셀토스'에서 2020년 '쏘렌토', '카니발'로 이어지는 RV(레져용 차량) 싸이클로 빠른 가동률 회복이 예상된다.중국 시장의 부진한 실적을 인도로 만회할 것으로 기대된다. 미국 시장 수익성은 향상 중이라는 점도 긍정적이다. 텔루라이드 등 신차 효과도 톡톡히 보고 있다.기아차는 미국 할부 금융사를 지분법대상법인으로 보유하고 있어 중고차 가치 하락시기에 유리하다. 텔루라이드의 경우 전장, 인테리어, 디자인에서 높은 평가를 받으며 재고가 거의 없다. 6월 생산 본격화가 기대된다.정인지 기자 injee@mt.co.kr
<저작권자 ⓒ '돈이 보이는 리얼타임 뉴스' 머니투데이, 무단전재 및 재배포 금지>",/news/news_read.nhn?article_id=0004417255&office_id=008&mode=search&query=SK&page=1
5월 고정거래가격 3.31달러 0.61%↑…낸드플래시는 가격 유지,"(서울=뉴스1) 권구용 기자 = D램 5월 고정거래가격이 직전 달 급등한데 이어 또다시 상승했다. 신종 코로나바이러스 감염증(코로나19)의 확산에 비대면 근무와 교육이 늘어남에 따라 PC향 수요가 강했다는 분석이다.
30일 반도체 전문 시장조사업체 D램익스체인지에 따르면 D램 PC향 범용제품(DDR4 8Gb 1Gx8 2133㎒)의 5월 고정거래가격은 3.31달러로 전월에 비해 0.61% 상승했다.지난 1월에 전월보다 1.07% 오른 2.84달러를 기록한 이후 5개월 연속 상승세가 이어졌지만, 4월 고정거래가격이 지난 달보다 11%이상 급등한 것과는 차이가 있다. 올해 가격 상승폭을 살펴보면 지난 1분기 Δ1월 1.07% Δ2월 1.41% Δ3월 2.08%, 2분기는 Δ4월 11.90% 등이다. D램익스체인지는 이에 대해 ""D램 가격 협상은 분기별로 이뤄지는데 4월 11% 이상의 상승 이후 또다시 가격이 상승했다""면서 ""PC 제조업체들의 긴급한 주문으로 PC D램 수요를 유지할 수 있었다""라고 설명했다.0.61%라는 상승폭이 시장의 둔화됐다는 의미가 아니라, 분기당 공급계약을 맺는 가격이 소폭이라도 상승한 것에 주목해 시장의 수요가 여전하다는 의미로 봐야한다는 뜻이다.실제로 반도체 호황기였던 2017년의 경우를 예로 들어보면 Δ1월(5.69달러) Δ2월(5.81달러) Δ3월(5.81달러) Δ4월(6.50달러) Δ5월(6.50달러) Δ6월(6.50달러) Δ7월(6.81달러) Δ8월(6.81달러) Δ(9월 6.81)달러 등으로 주로 분기 시작 달의 가격이 그대로 이어짐을 알 수 있다. 이와 함께 D램익스체인지는 차세대 표준인 DDR5(Double Date Rate 5) D램과 관련해 ""선도기업인 삼성과 SK하이닉스, 마이크론은 10나노 2세대(1y)와 3세대(1z) 공정을 이용해 샘플을 생산하는 단계""라면서도 ""인텔과 AMD에서 DDR5와 호환하는 메인스트림 플랫폼(CPU)의 지원이 2022년까지 불분명 할 것으로 보여 DDR5가 앞으로 2년간은 현재의 DDR4를 대체하지 못할 것으로 보인다""라고 전망했다. 한편, D램익스체인지에 따르면 낸드플래시 메모리카드·USB향 범용제품(128Gb 16Gx8 MLC)의 4월 고정거래가격은 4.68달러로 두달 연속 같은 자리에 머물렀다. D램익스체인지는 ""최종 제품에 대한 수요에서 중국의 통신망 건설 수요가 가장 크고 3분기에 가시적으로 나타날 것""이라면서도 ""유럽과 미국은 건설 일정의 지연과 함께 가전 제품 수요가 악화했다""라고 설명했다. 이어 ""SLC 낸드플래시는 6월 가격 협상에서 일정하거나 약간 감소할 수 있고, 소비자 수요에 주로 초점을 두고 있는 MLC 낸드플래시는 3분기 가격 인하 압력이 커질 것""이라고 전망했다.inubica@news1.kr© 뉴스1코리아(), 무단 전재 및 재배포 금지",/news/news_read.nhn?article_id=0004667058&office_id=421&mode=search&query=SK&page=1
,"지난 3월부터 입주가 시작된 ‘e편한세상 시티 인하대역’ 오피스텔이 최근 이사철을 맞아 관심을 모으고 있다. 이 단지는 지난 2017년 4월 분양해 최고 42대1의 경쟁률을 기록하는 등 전 타입 청약이 마감된 바 있다.총 848실로 구성된 e편한세상 시티 인하대역은 당초 계획보다 2개월가량 이른 3월부터 입주가 시작됐다. 최근 브랜드 오피스텔 선호현상에 힘입어 문의가 이어지고 있으며 입주도 빠르게 진행되고 있는 것으로 전해졌다.
단지는 인천 남구 용현동 665-19번지 일원에 조성됐다. 전용면적 19㎡부터 75㎡까지 다양하게 구성된 오피스텔로 일부는 3베이 판상형 구조가 적용돼 공간을 효율적으로 활용할 수 있다. 또한 남향 위주 단지 배치로 통풍과 채광을 극대화했고 일부 호실은 팬트리와 붙박이장, 파우더장 등을 마련해 가족 구성원과 라이프스타일에 따라 활용할 수 있도록 했다. 여기에 피트니스센터와 맘스카페, 게스트하우스, 공원 등 부대시설이 잘 갖춰져 아파트 단지에 버금가는 주거생활을 누릴 수 있다고 분양 관계자는 설명했다.입지의 경우 단지 내 상가 편의시설을 비롯해 도보 2분 거리에 인하대역이 있다. 주요 시설로는 인하대와 학익CGV, 복합멀티몰 시티필드(예정) 등이 반경 500m 이내에 위치했다. 1~2인 가구 주거 상품으로 적합한 상품성과 입지를 갖췄다는 평가다. 분양 관계자는 “용현과 학익지구 개발이 가시화되면서 주변 주택 가격이 상승하고 있는데 인접한 SK스카이뷰 아파트 전용 84㎡타입이 올해 1분기에만 약 1억 원(실거래가 기준) 상승하고 월 평균 10건 이상 거래가 이뤄지고 있는 상황”이라며 “주변 영향으로 e편한세상 시티 인하대역에 대한 관심도 함께 늘어나면서 매물 문의가 증가하는 것으로 보인다”고 말했다. 단지 관계자에 따르면 e편한세상 시티 인하대역은 현재 95% 수준 입주율을 보이고 있으며 입주지정기간이 끝나는 이달 말경에는 입주가 완료될 것으로 예상된다. 업계에서는 규모를 고려했을 때 입주율이 높은 수준으로 향후 SK스카이뷰와 함께 지역을 대표하는 단지가 될 것으로 전망된다.동아닷컴 김민범 기자 mbkim@donga.comⓒ 동아일보 & donga.com, 무단 전재 및 재배포 금지",/news/news_read.nhn?article_id=0003289135&office_id=020&mode=search&query=SK&page=1
"맥킨지, 중국 관련 특별 보고서 발표","[서울=뉴시스] 김지은 기자 = 코로나19로 중국이 사업 전반적으로 디지털화를 가속화하고 글로벌 의존도를 낮추고 있다는 진단이 나왔다. 중국의 젊은 세대는 불확실성에 대비해 저축은 늘리고 더욱 안전하고 자연친화적인 제품을 구매하는 '착한 소비'에 나서고 있다 평가다.SK이노베이션은 자사 미디어채널을 통해 글로벌 컨설팅업체인 맥킨지(McKinsey)가 최근 발표한 '코로나19가 가속화한 중국의 5가지 핵심 트렌드'라는 제목의 중국 관련 특별 보고서를 공유했다.맥킨지는 보고서에서 ""중국은 코로나19 사태로부터 회복하고 있는 국가 중 하나로서, 경제를 정상화시키기 위해 최전선에서 싸우고 있는 한편 팬데믹(Pandemic)으로 인해 야기된 사회적 변화를 가장 먼저 경험하고 있다""며 ""내수 경제 안정화를 위한 중국의 노력은 비교적 안정적으로 진행되고 있다""고 말했다30일 보고서에 따르면 맥킨지가 꼽은 중국 경제의 5대 사회 변화 트렌드는 디지털화, 글로벌 의존도의 감소, 기업 간 경쟁 심화, 성숙해진 소비자들, 민간 부문과 사회적 부문의 확대 등이다.팬데믹 이전부터 중국은 소비자와 직접적으로 연계된 분야에 있어서는 이미 디지털 강자였다. 세계 전자상거래 규모의 45%를 차지고 있으며 모바일 결제 사용량은 미국의 3배에 이른다. 중국 소비자를 대상으로 한 모바일 설문조사에 따르면 55% 정도의 소비자들이 코로나19로 인한 고비를 한 차례 넘겼음에도 불구하고 계속해서 온라인으로 장보기를 희망한다고 밝혔다.근무환경 또한 매우 빠르게 변화하고 있다. '알리바바'가 출시한 원격 화상회의 등이 가능한 협업 플랫폼 '딩토크(DingTalk)'는 이번 분기 동안 매달 사용자 수가 2배 가까이 늘어 1770만명에 도달했다. 헬스케어 분야에서도 디지털을 이용한 교류가 가속화됐다. 특히 배상 정책에 관련한 규제 변화 덕분에 온라인을 통한 상담이 급격히 증가하고 있으며, 제약판매업체와 의사간의 디지털 교류도 매우 활발해졌다. 코로나19의 확산으로 중국과 다른 국가 간의 관계 변화도 감지된다. 코로나19 이전에도 중국은 글로벌 의존도를 상대적으로 낮추고 있었다. 특히 내수 경제가 중국 경제 성장의 많은 부분을 이끌었다는 점, 생산공급망이 발달해 지역화가 되었다는 점, 이에 따라 혁신동력이 생겼다는 점이 주요한 것으로 꼽히고 있다.미-중 무역분쟁은 리스크와 불확실성을 높였는데, 이는 2019년 맥킨지가 기업들을 대상으로 실시한 설문조사를 보면 알 수 있다. 전체 기업 중 30~50%의 기업들이 새로운 대체 공급자를 찾거나 다른 지역으로 생산라인을 옮기는 등 공급망 관리와 관련해 새로운 전략을 취하겠다고 밝혔다. 주중미국상공회의소의 설문조사에 응한 기업 중 20%가량은 이 같은 '디커플링 현상(탈동조화)'이 일어날 것이라고 예측한다. 유럽상공회의소가 지난 2월에 발표한 보고서 또한 중국에 있는 수많은 유럽계 기업이 현재, 다각화 전략을 최우선 과제로 꼽았다.그럼에도 중국 시장의 크기와 성장 잠재력을 봤을 때, 다른 국가의 중국에 대한 생산공급망 및 혁신 관련 투자는 여전히 중요한 부분으로 남을 것으로 보인다. 반대로 중국 또한 지금과 같은 생산성 성장을 유지하기 위해서는 글로벌 기술 관련 정보 및 노하우가 끊임없이 중국으로 유입돼야 한다. 기업 간 경쟁은 더욱 치열해질 전망이다. 중국의 대기업들은 이윤과 투자자본수익률을 유지하고 있지만 살인적인 가격 인하 경쟁이 이들을 위협하기도 한다. 코로나19 사태로 인해 중국 내 기업 간 경쟁이 더욱 가속화됐는데, 이 같은 경쟁으로 인한 보상과 리스크 모두 증가할 것으로 보고 있다.전 세계 상위 5000여개 기업을 대상으로 한 조사에 따르면, 중국의 상위 10% 기업이 경제 전체에서 차지하는 비중은 90%에 육박한다. 이와 비교해 다른 나라는 이 수치가 70%대다. 예컨대 알리바바의 '프레시포(Freshippo)' 슈퍼마켓은 공급 과정에서의 여러 제약을 극복함으로써 온라인으로 과일을 배달 받기 원하는 수요를 맞출 수 있었다. 각종 컴퓨터 부품을 생산하는 '폭스콘(Foxconn)'은 회사의 주력 상품이 아닌 위생 마스크를 생산하는 데 이들의 공장을 가동했다. 글로벌 동영상 플랫폼인 '틱톡(TikTok)'은 코로나19가 최악으로 치닫던 가운데 1만여명의 직원을 신규로 채용했다. 반면 중국의 수많은 중소기업은 충분히 민첩하게 행동할 수 없는 상황이었다. 때문에 이들은 이번 코로나19 사태로 자금유동성의 감소, 실직 증가, 파산 등 여러 리스크에 매우 취약한 상태다.중국 젊은 세대의 소비 및 저축 행태도 달라지고 있다.중국의 20~30대 젊은 소비자들은 전통적으로 중국 소비 및 성장의 핵심이었는데, 이들의 소비에 대한 태도가 코로나19 사태로 인해 급변했다. 한 조사에 따르면 중국 내 젊은 소비자의 42% 가량이 판데믹을 계기로 저축을 늘릴 의향이 있다고 밝혔다. 소비자 대출 또한 감소 추세에 놓이는 한편, 중국인 소비자 5명 중 4명이 이번 위기 이후 더 많은 보험상품을 구매할 것이라는 의향을 내비쳤다. 실제로 가계 예치금이 2020년 1분기 동안 8%나 성장해 87조8000억 위안에 달했다. 또 코로나19로 인해 소비자는 보다 질 좋은 상품을 선호하기 시작했다. 맥킨지가 진행했던 코로나19 관련 조사에 따르면 약 70%의 응답자가 더욱 안전하고 자연친화적인 제품을 구매하기 위해 더 많은 돈과 시간을 투자할 용의가 있다고 답했다. 아울러 응답자의 4분의 3은 코로나19 이후 더 건강한 식습관을 가지고 싶다고 했다.이밖에 민간 부문과 사회적 부문의 확대도 눈에 띈다. 2003년 사스(SARS) 위기 당시 중국 경제 회복을 담당했던 주요 경제 주체는 정부와 공기업이었다. 지금은 민간 부문과 주요 IT 기업이 중심이 돼 경제를 재활성화하기 위해서 엄청난 규모의 기부를 하는 등 사회·경제 측면에서 다양한 기여를 하고 있다.2020년에 들어서는 민간 부문이 중국 경제 성장의 66%를 담당하고 있으며 신규 일자리의 90%를 창출하고 있다. 이는 경제 권력의 중심이 이동했음을 시사한다. 특히 주목할 점은 중국 정부와 대기업 간의 협업이 이번 판데믹에 대응하는 데 있어 큰 역할을 했다는 것이다. '알리페이(Alipay)'와 '위챗(WeChat)'은 코로나19 바이러스의 확산을 막기 위해 상하이시와 협력해 ‘쑤에이션마(Suishenma)’라는 헬스 관련 QR코드를 출시했다. 한편 빌 & 멀린다 게이츠 재단(Bill & Melinda Gates Foundation)과 반케 재단(Vanke Foundation)'을 비롯한 많은 사회적 기관 또한 코로나19로부터 회복하기 위해 수백만 달러를 기부했다. 앞으로 중국 사회를 형성해 나가는 데 있어 사회적 기관도 매우 중요한 역할을 할 것으로 전망된다. kje1321@newsis.com<ⓒ 공감언론 뉴시스통신사. 무단전재-재배포 금지>",/news/news_read.nhn?article_id=0009888921&office_id=003&mode=search&query=SK&page=1
,"[아시아경제 우수연 기자]SK네트웍스가 SK텔링크의 중고폰 사업을 인수했다.SK네트웍스는 지난 29일 SK텔링크와 중고폰 사업 양수도 계약을 체결하고 SK텔링크의 국내 사업 및 베트남 법인 일체를 양수하기로 했다고 밝혔다. 양수 금액 42억원이며 관련 절차는 오는 7월 1일까지 마무리될 예정이다.SK네트웍스 관계자는 ""정보통신 유통사업자로서 고객들에게 보다 편리하고 선도적인 가치를 제공하고 사회적 가치를 배가시킬 수 있다는 점과 글로벌 사업 확장 가능성 등을 고려해 이번 인수 결정을 내렸다""고 말했다.이로써 SK네트웍스는 현재 전국 400여 대형마트를 중심으로 운영 중인 민팃ATM의 거래 채널을 늘릴 수 있게 됐다. 또한 베트남 시장을 발판으로 휴대폰 제조사 및 유통점과 제휴를 통한 글로벌 중고폰 유통사업 확장 기반을 마련했다.SK네트웍스는 자사의 ICT 유통·마케팅 역량 및 디지털 기술력을 바탕으로 정보통신유통사업 본연의 경쟁력을 강화하는 동시에 리사이클 생태계 조성을 통한 사회적 가치 창출을 지속해나갈 계획이다.우수연 기자 yesim@asiae.co.kr <ⓒ경제를 보는 눈, 세계를 보는 창 아시아경제 무단전재 배포금지>",/news/news_read.nhn?article_id=0004688448&office_id=277&mode=search&query=SK&page=1
