head,text,url
경영 보폭 넓히는 재계 총수…대내외 경영 불확실성 커진 영향,"[더팩트ㅣ이성락 기자] 국내 대기업 총수들의 움직임이 바빠지고 있다. 최근 경제 불확실성이 높아진 상황을 '최악의 위기'로 규정하고 적극적인 현장 경영을 펼치며 생존 전략 마련에 고심하는 모습이다. 비교적 공식 행보가 노출되지 않았던 구광모 LG그룹 회장도 그룹 핵심 전략 기지를 방문하며 중장기 차원에서 미래 사업 전략을 점검했다.30일 재계와 LG그룹에 따르면 구광모 회장은 지난 28일 서울 마곡동 LG사이언스파크를 방문해 디지털 전환, 인공지능(AI) 사업 추진 전략과 현황, 우수 인재 확보 방안 등을 논의했다.지난 2018년 4월 출범한 LG사이언스파크는 디지털 전환, AI 분야 역량 강화 지원 등 그룹 차원의 디지털 혁신을 주도하는 핵심 연구단지로, 중소·스타트업들과 서로 도움이 될 수 있는 혁신 생태계를 만드는 개방형 혁신의 거점 역할을 맡고 있다. 또 미래 사업을 책임지는 AI 인력을 양성하고, 외부 전문가 채용 등 우수 인재 확보에도 적극 나서고 있다. LG사이언스파크는 고(故) 구본무 전 회장이 각별히 챙겼던 사업장으로, 미래 준비에 속도를 내는 구광모 회장 역시 지난 2018년 9월 취임 후 가장 먼저 방문할 정도로 기대감을 나타낸 곳이기도 하다.구광모 회장이 재차 LG사이언스파크를 방문한 것은 신종 코로나바이러스 감염증(코로나19) 확산, 미중 갈등 격화 등 세계 경제의 불확실성이 심화되는 상황에서 '미래 먹거리'를 다시 한번 챙기기 위함이다. LG그룹 관계자는 ""경제 위기 상황에서도 움츠러들지 말고 LG사이언스파크 본연의 역할을 흔들림 없이 수행하며, 미래 준비를 해나가는 방향에 대해 논의하는 자리였다""고 설명했다.구광모 회장은 LG사이언스파크 구성원에게 ""아무것도 하지 않는 것, 과감하게 도전하지 않는 것이 '실패'라고 볼 수 있다""며 ""사이언스파크만의 과감한 도전의 문화를 만들어 달라""고 말했다. 그룹의 미래 시드를 찾아 기회를 선점하는 LG사이언스파크의 역할을 당부한 것이다.구광모 회장 외에도 최근 이재용 삼성전자 부회장, 최태원 SK그룹 회장, 신동빈 롯데그룹 회장 등 다른 기업 총수 역시 현장 경영을 재개하고, 위기 극복 메시지를 잇달아 내놓으며 존재감을 드러내고 있다. 마찬가지로 초유의 복합 위기 속에서도 미래를 준비해야 한다는 절박함 섞인 행보라는 평가다.이재용 부회장은 5월 들어 현장 경영 보폭을 넓히며 위기 극복 전면에 나섰다. ""새로운 삼성으로 거듭나겠다""는 대국민 사과를 마치고 1주일 만에 충남 천안 삼성SDI 배터리 생산 공장에서 정의선 현대자동차그룹 수석부회장과 '깜짝 회동'을 가지며 차세대 배터리 사업을 논의했다. 이후 지난 17일 중국 시안으로 출장을 떠난 이재용 부회장은 코로나19 검사만 3차례 받는 복잡한 절차를 감수하며 직접 현장을 점검했다. 당시 코로나19 장기화에 따른 영향과 대책을 논의한 이재용 부회장은 ""과거에 발목 잡히거나 현재에 안주하면 미래는 없다""며 ""새로운 성장 동력을 만들기 위해서는 다가오는 거대한 변화에 선제적으로 대비해야 한다""고 당부했다.최태원 회장은 '언택트(비대면)' 트렌드에 맞게 화상·원격 경영을 최대한 활용하고 있다. 특히 미래 먹거리인 바이오산업에 대한 투자를 챙기며, 화상 간담회를 통해 코로나19 백신을 개발하고 있는 SK바이오사이언스 연구원들도 격려했다. 최태원 회장은 포스트 코로나 시대에 적절한 근무 형태를 찾기 위해 1주간 사무실에서 집중 근무하고 이후 3주간 오피스 프리 방식으로 일하는 '1+3 테스트'도 실시하고 있다. 내부적으로는 ""SK는 위기를 극복하면서 양적으로나 질적으로 크게 도약해 왔다""며 ""우리가 물려받은 치열함과 고귀한 정신, 단단한 저력으로 이번 코로나19 위기 극복은 물론 다시 한번 크게 도약하는 새로운 역사를 써 내려가자""고 독려했다.신동빈 회장은 지난 18일 국내 경영 복귀 직후 전 그룹사에 고강도 쇄신을 주문했다. 어려운 경영 환경 탓에 주력이 사업이 어려운 상황을 엄중하게 인식하고, 생존을 위한 변화를 촉구한 것이다. 신동빈 회장은 ""이번 위기만 잘 넘기자는 식의 안이한 생각을 해서는 안 된다""며 미래에 대한 철저한 대비를 지시했다.지난 23일 서울 송파구 잠실 롯데월드몰, 롯데백화점, 롯데마트, 롯데월드 어드벤처 등 인근 주요 사업장을 점검하는 등 현장 경영도 재개했다. 이와 함께 효율적 근무 방식으로의 전환을 위해 대기업 최초로 주 1회 재택근무를 도입했다. 신동빈 회장은 자신도 주 1회 재택근무를 적극 활용, 그동안 물리적 거리로 자주 방문하지 못했던 사업장들을 화상회의 등을 통해 점검한다는 계획이다.재계는 지금의 위기 수위를 고려했을 때 대기업 총수들의 활발한 현장 움직임이 당분간 지속될 것으로 보고 있다. 한 대기업 관계자는 ""현재 주요 기업들은 경제 위기에 따른 비상경영체제를 유지하고 있고, 이 체제는 하반기까지 이어질 것""이라며 ""이렇게 엄중한 시기에는 사태를 조기에 수습할 수 있는 총수가 전면에 나서는 경우가 많다""고 밝혔다.rocky@tf.co.kr저작권자 ⓒ 특종에 강한 더팩트 & tf.co.kr 무단 전재 및 재배포 금지",/news/news_read.nhn?article_id=0000027509&office_id=629&mode=search&query=SK&page=3
"자동차 미래 먹거리 쟁탈전전기차 협력 논의 삼성·현대차 총수전장 사업 시너지에도 깊은 관심LG도 전장 R&D에 6293억 투자올해 세계 전장시장 규모 377조디지털 콕핏, 2025년 40조 예상해외기업도 기술 확보·선점 경쟁","재계 1·2위 기업을 이끄는 이재용 삼성전자 부회장과 정의선 현대자동차그룹 부회장이 지난 13일 만났다. 충남 천안의 삼성SDI 사업장에서다. 두 사람이 사업 목적으로 따로 만난 것은 처음이었다. 이날 이들은 한 번 충전에 800㎞를 달리는 삼성SDI의 전고체 배터리(리튬이온이 이동하는 전해질을 고체로 만든 차세대 배터리) 기술을 살피고 3시간가량 전기차 분야 협력 방안을 논의한 것으로 알려졌다.

표면상 두 총수의 눈이 향한 곳은 전기차지만, 실제 이들은 반도체·스마트폰을 이을 한국의 ‘미래 먹거리’ 자동차 전자장비(전장) 분야 협력에도 깊은 관심을 가진 것으로 분석된다. 재계 고위 관계자는 “현대차그룹은 이미 LG화학·SK이노베이션과 전기차 배터리 분야에서 긴밀한 협력 관계라 삼성SDI가 여기 추가돼도 특별할 게 없다”라며 “미래차 시대에 핵심이 될 자동차 전장 분야 협력에도 (두 사람이) 교감한 것으로 안다”고 전했다. 세계 1위를 다투는 정보통신기술(ICT) 기업과 5위 완성차 기업이 자동차 전장으로 손잡으면 파급 효과가 전기차에서 협력할 때보다 훨씬 더 크다. 특히 ‘전장의 꽃’이라 불리는 디지털 콕핏(Digital Cockpit) 분야에서 시너지 효과를 낼 수 있다.





 디지털 콕핏은 사물인터넷(IoT) 등 ICT로 작동하는 자동차 조종석을 가리킨다. 터치 패널로 운전자가 주행 방식을 제어할 수 있어 다양한 맞춤형 운전이 가능해 자율주행 시대 핵심 기술이 집약된 곳이다. 또 뉴스·날씨 등 실시간 정보 검색, 음악·영화 감상까지 가능하게 한다. 삼성전자는 디지털 콕핏 시장을 선도할 만한 기술력을 쌓고 있다. 삼성전자는 2017년 약 9조원에 디지털 콕핏 제조가 장기인 세계 최대 자동차 전장 기업, 미국의 하만을 인수했다. 하만은 지난 1월 미국 라스베이거스에서 열린 ICT 박람회 ‘CES 2020’에서 삼성전자와 공동 개발한 5세대(5G) 이동통신 기반 디지털 콕핏을 선보였다. 내년에 양산되는 독일 BMW의 전기차에 탑재된다. 삼성전자는 자동차용 반도체 사업에도 대규모 투자를 계획하고 있다.


현대차그룹은 그룹 내 전장 부품 연구·개발(R&D)을 맡은 현대모비스가 디지털 콕핏을 지능화하는 데 집중하고 있다. 운전자의 건강 이상, 졸음 등 정상 운전이 불가능한 경우 자율주행 모드로 자동 전환해 안전한 곳으로 이동하는 DDREM(Departed Driver Rescue and Exit Maneuver) 시스템을 개발 중이다. 내년 상용화 예정이다.


삼성전자와 현대차가 손잡는 것과 별개로 국내 자동차 전장 산업은 미래가 밝은 것으로 평가된다. LG전자도 삼성전자와 현대차그룹 못잖게 자동차 전장 사업에 힘쓰고 있다. LG전자는 지난해 자동차 부품 솔루션 사업본부의 전장 분야 등 R&D와 상용화에 6293억원을 투자했다. 그 결과 미국 제너럴모터스(GM)의 프리미엄 브랜드 캐딜락에 초고해상도 플라스틱 유기발광다이오드(P-OLED) 디스플레이 기반 디지털 콕핏 시스템을 올해부터 공급하기로 했다. 메르세데스-벤츠의 모기업인 독일 다임러AG에는 자동차용 터치스크린 등을 공급하고 있다. 삼성전자가 5G와 반도체를 앞세웠다면, LG전자는 디스플레이라는 장기를 살리고 있다.





 시장 조사 업체들에 따르면 세계 자동차 전장 부품 시장 규모는 2015년 2390억 달러에서 올해 3033억 달러(약 377조원), 디지털 콕핏 시장 규모는 2018년 139억 달러에서 2025년 323억 달러(약 40조원)로 각각 커질 전망이다. 이에 해외 기업들도 기술 확보와 시장 선점에 열을 올리고 있다. 2014년 세계 최초로 디지털 콕핏을 상용화한 독일의 폴크스바겐은 아우디·스코다·람보르기니 등의 최신 차량에도 디지털 콕핏을 적용 중이다. 후발주자인 중국은 전기차 제조 기업 바이톤이 48인치 디스플레이의 초대형 디지털 콕핏을 제조하고 있다. 전기차 M-바이트에 탑재할 예정이다. 이 밖에 일본도 소니가 CES 2020에서 콘셉트 전기차(비전 S)를 공개해 전장 부품 사업 진출을 눈앞에 뒀다는 분석이다. 이를 위해 소니는 엔비디아와 퀄컴 등 미국 ICT 기업들과 협력 관계를 구축했다.

박철완 서정대 자동차학과 교수는 “자동차의 패러다임이 내연기관 중심에서 전장 중심으로 급격히 바뀌고 있어 기업들이 R&D와 상용화에 더 속도를 내야 하는 상황”이라며 “이를 위해 ICT 기업과 자동차 기업 간 협력 강화가 중요해졌다”고 분석했다. 신종 코로나바이러스 감염증(코로나19) 확산으로 세계 자동차 산업의 불확실성이 커진 만큼, 전장을 통한 새로운 성장동력 창출도 한층 중요해졌다는 분석이다.



다만 일각에선 대기업 간 협력뿐만 아니라 중소·중견기업 육성과 동반성장 노력도 절실해진 시점이라는 지적이 나온다. 윤병섭 서울벤처대학원대 융합산업학과 교수는 “규모는 작지만 기술이 뛰어난 강소기업들의 각종 전장 부품을 앞세워 미래차 시대에 선제 대응하고 있는 독일의 사례를 참고해야 한다”고 지적했다.



이창균 기자 smilee@joongang.co.kr▶ 중앙SUNDAY ▶
ⓒ중앙SUNDAY and 중앙일보 무단 전재 및 재배포 금지",/news/news_read.nhn?article_id=0000036992&office_id=353&mode=search&query=SK&page=3
,"SK가스는 다음달 1일부터 행복충전 멤버십에 가입한 소비자를 대상으로 ‘트리플 챌린지’(Triple Challenge) 이벤트를 진행한다고 29일 밝혔다.
 멤버십 가입 고객은 전국 202개 SK충전소에서 500㎖ 생수 1박스(20개입)를 OK캐쉬백 2990 포인트로 1일 1회 구입할 수 있다. 이벤트는 연말까지 이어지고 구입 가능한 물품은 추후 점차 늘려나갈 예정이다.
 LPG 신차 구매 고객을 위한 이벤트도 진행된다. SK가스는 기아자동차와 제휴를 통해 다음달부터 올해 8월까지 K5·K7 LPi 모델 출고 고객에게 전용 멤버십카드를 제공하고, 1년간 LPG 충전 시 OK캐쉬백을 2배 적립해준다. 또 충전소 이용 고객 중 추첨을 통해
LPG차량 1년 평균 충전비용에 해당하는 200만 포인트를 지급한다.
 모바일 시럽(Syrup) 앱을 통해 바로 가입할 수 있는 ‘행복충전’ 멤버십은 가입 즉시 3000포인트를 지급하며, 충전소 이용횟수에 따라 추가 포인트를 받을 수 있다. 또 ‘행복충전’ 가입 후 2만원 이상 충전한 고객을 대상으로 추첨을 통해 K5 2.0 LPi(1명), 차량용 공기청정기(20명), LPG충전쿠폰 등도 제공한다.
 이정우 기자 woolee@segye.comⓒ 세상을 보는 눈,",/news/news_read.nhn?article_id=0003470050&office_id=022&mode=search&query=SK&page=3
,"SK건설과 한진중공업은 인천 부평구 동수천로 67번길 12-1 일원에 분양하는 ‘부평 SK VIEW 해모로’의 사이버 견본주택을 29일부터 운영한다고 밝혔다.

인천 부개서초교북측구역을 재개발하는 부평 SK뷰 해모로는 지하2층~지상25층, 아파트 17개동 전용면적 36~84㎡ 총 1559가구 규모로 조성된다. 모든 가구가 실수요자들의 관심이 높은 전용면적 84㎡ 이하의 중소형 물량으로만 구성됐다. 이 중 전용 ▲36㎡ 112가구, ▲49㎡ 11가구, ▲51㎡ 40가구, ▲59㎡ 161가구, ▲74㎡ 178가구, ▲84㎡ 382가구 등 총 884가구가 일반 분양된다.
 6월 8일 특별공급 청약접수를 시작으로 9일 1순위, 10일 2순위 청약 접수를 진행한다. 16일 당첨자발표를 거쳐 6월 29일부터 7월 7일까지 주말을 제외한 7일간 계약이 진행된다. 입주는 2022년 12월 예정이다. 분양가는 3.3㎡당 평균 1670만원이며 중도금(분양가의 60%) 이자후불제 혜택이 제공된다.
 부평 SK뷰 해모로가 들어설 인천 부평구 일대는 비투기과열지구 및 비청약과열지구로 청약, 전매제한 등에 비교적 자유롭다는 평가다. 인천시 및 수도권(서울시, 경기도)에 거주하는 만 19세 이상이면 누구나 1순위 청약 신청이 가능하며, 유주택자도 청약이 가능하다. (동일순위 내 경쟁이 있을 경우 인천시 거주자 우선 당첨) 재당첨 제한이 없고, 분양권 전매제한 기간은 6개월이다.
 부평 SK뷰 해모로는 서울지하철 1호선과 인천도시철도 1호선 환승역인 부평역과 가깝고 부개역을 도보로 이용할 수 있다. 여기에 현재 계획 중인 GTX-B 노선이 부평역과 연결되면 향후 트리플 역세권으로 미래가치가 더욱 높아질 전망이다.
 나기천 기자 na@segye.comⓒ 세상을 보는 눈,",/news/news_read.nhn?article_id=0003470066&office_id=022&mode=search&query=SK&page=3
☞한·중 신속통로제,"한국과 중국 정부가 코로나 의무 격리 기간을 대폭 단축해주는 '신속통로' 제도를 지난 1일부터 도입했으나, 그 혜택은 전세기를 띄울 능력이 있는 대기업에만 돌아가고 있다. 신속통로 제도를 이용하면, 방역을 위한 의무 격리 기간 14일을 기다리지 않고, 하루 이틀 만에 활동을 개시할 수 있다. 하지만 양국 10개 항공사가 운항하는 일반 여객기 이용자는 한 명도 이 제도의 혜택을 보지 못했다. 10억원 정도 되는 중국행 전세기를 띄울 여력이 있는 이들만을 위한 반쪽짜리 제도라는 지적이 나온다.한·중 정부는 신속통로 제도를 코로나 시대 양국 경제 협력의 대표적 모범 사례로 꼽고 있다. 실제 지난 22일 삼성전자는 이 제도를 이용해 중국 시안 2공장 증설에 필요한 인력 300여명을 중국에 보냈다. 이재용 삼성전자 부회장도 지난 17일 신속통로 제도를 통해 중국 시안 반도체 공장을 다녀왔다. SK이노베이션과 기아차 임직원 220여명도 지난 21~22일 중국 장쑤성 옌청에 들어갔다.하지만 이 제도는 중소·중견기업엔 무용지물(無用之物)이다. 중국에 지사 및 공장을 갖고 있는 중견기업 A사는 이달 초 신속통로 제도가 시행된다는 보도를 접하고 즉각 행동에 들어갔다. 신속통로 이용을 위해 필요한 중국 지방 정부 초청장을 발급받으려고 신청서를 냈지만 거절당했다.A사 관계자는 ""초청장을 신청했던 중국 지방 정부로부터 '전세기를 띄우지 않으면 초청장을 내줄 수 없다'는 말을 들었다""며 ""전세기를 띄울 여력이 되지 않아 중국에 있는 한국 영사에게 도움을 요청했지만 '방법이 없다'는 답변만 들었다""고 말했다. 이 관계자는 ""알아보니 중국행 전세기를 띄우려면 10억원이 넘게 필요하던데, 그걸 감당할 수 있는 회사가 얼마나 되겠느냐""며 ""이럴 줄 알았으면 14일 격리를 감수하고라도 곧바로 일반 비자를 신청할걸 그랬다""고 말했다.산업통상자원부 관계자는 ""한·중 양국이 신속통로 제도를 합의할 때 꼭 전세기를 이용해야 한다는 조건을 달지는 않았다""고 말했다. 현재 한국과 중국을 오가는 여객기 노선은 10개 항공사(한국 3개·중국 7개)가 각각 1개 노선에 주 1회씩 운항 중이다. 하지만 일반 여객기로 중국에 입국하면 신속통로 제도를 이용하기가 사실상 불가능한 실정이다. 신속통로 제도 창구 역할을 하고 있는 한국무역협회 관계자는 ""신속통로를 이용한 기업인들은 모두 전세기를 이용한 것으로 파악됐다""며 ""일반 항공편을 이용한 사례는 없다""고 말했다.외교부에 따르면 지난 28일까지 한·중 신속통로 제도를 통해 중국에 들어간 기업인은 1240명이다. 하지만 신속통로 제도를 통해 중국에 들어간 중소기업은 대기업 협력사뿐이다. 산업부 관계자는 ""중국에 들어가려는 한국 기업인에 대한 초청장과 비자 발급 권한은 중국 쪽에 있다""며 ""중국 쪽에서 방역 관리 차원에서 초청장 발급을 깐깐하게 하고 있는 것 같다""고 말했다.중국에서 공장을 운영하고 있는 B사 관계자는 ""대기업에 비해 현지 주재원도 적고, 협상력도 약한 중소·중견기업을 위해 신속통로제도 이용 범위를 확대하도록 정부가 노력해줬으면 좋겠다""고 말했다.한국과 중국 기업인들이 상대방 국가에 입국할 때 의무격리 기간을 기존 14일에서 1~2일로 최소화한 제도. 양국 합의로 지난 1일부터 시행되고 있으며, 우리 기업인이 이용하려면 중국 19개 지방정부의 초청장을 받은 뒤 비자를 발급받으면 된다.[석남준 기자] 		▶
		▶ 		▶
	- Copyrights ⓒ 조선일보 & chosun.com, 무단 전재 및 재배포 금지 -",/news/news_read.nhn?article_id=0003535106&office_id=023&mode=search&query=SK&page=3
‘AI 기반 포스트 프로덕션 플랫폼’ 개발 MOU 체결,"SK텔레콤 김혁 5GX미디어사업그룹장(왼쪽)과 NEW ID 박준경 사업부문대표가 협약서에 서명하고 있다

SK텔레콤(대표이사 사장 박정호)은 디지털 콘텐츠 및 플랫폼유통 기업 NEW ID(대표이사 김우택)와 한류 콘텐츠 수출을 위한 ‘AI기반 포스트 프로덕션 플랫폼(Post Production Platform) 개발’ 관련 업무협약을 체결했다고 29일 밝혔다.
 이번 협약은 최근 급증하고 있는 한류 콘텐츠에 대한 해외의 관심 및 수요에 대응하고, 국내 미디어 산업의 기술적 기반을 조성하기 위해 마련됐다.
 영화, 드라마 등 콘텐츠의 한글 자막 및 저작권 음원 제거 등 포스트 프로덕션 작업은 한류 콘텐츠 수출에 있어 중요한 부분을 차지하고 있으나, 현재 대부분 수작업으로 이뤄져 높은 비용과 긴 소요기간으로 원활한 콘텐츠 수출에 장애 요인으로 작용하고 있다.

이에 양사는 SK텔레콤이 보유한 AI기반 미디어 요소기술과 NEW ID의 미디어 콘텐츠 유통 및 플랫폼 역량을 결합, AI를 통한 포스트 프로덕션 자동화 플랫폼 개발에 나서게 되었다.


SK텔레콤과 NEW ID는 29일 서울 강남구 소재 NEW ID 본사에서 ‘AI기반 포스트 프로덕션 플랫폼(Post Production Platform) 개발’ 관련 업무협약을 체결했다. 협약 체결 후 기념촬영 중인 SK텔레콤 김혁 5GX미디어사업그룹장(왼쪽)과 NEW ID 박준경 사업부문대표. SK텔레콤 제공

이를 위해 SK텔레콤은 보유한 AI기술을 활용해 ▲콘텐츠 內 한글 자막 제거 ▲보이스 손실 없는BGM 제거 ▲스포츠 중계화면 內 실시간 스코어보드 언어 변환 ▲Full HD영상을 4K·8K로 변환하는 업스케일링(Upscaling) 기술 등을 지원하며, 해당 기술을 통해 재가공 된 콘텐츠는 NEW ID의 채널을 통해 미국과 캐나다, 멕시코 등 11개국에 수출될 예정이다.
 양사는 이번 AI 기반 포스트 프로덕션 플랫폼 개발이 국내 콘텐츠의 현지화 작업에 필요한 시간과 비용을 크게 단축시켜 한류 콘텐츠의 해외 진출을 촉진하는 계기가 될 것으로 기대하고 있다.
 지차수 선임기자 chasoo@segye.comⓒ 세상을 보는 눈,",/news/news_read.nhn?article_id=0003470081&office_id=022&mode=search&query=SK&page=2
"코로나19 여파 '온라인 삼성고시'…오늘∼내일 4차례 진행생소한 방식에 응시생 '긴장'…온라인 모의시험도 등장시험 보는 모습, 스마트폰 원격 모니터링 시스템으로 감독","[앵커]이른바 '삼성고시'로 불리는 삼성의 신입사원 채용 필기시험, GSAT가 코로나19 여파로 오늘 사상 처음으로 온라인으로 치러집니다.삼성은 실시간 모니터링과 녹화 검증 등을 통해 부정행위를 막겠다는 방침인데, 취업 준비생과 업계의 관심이 집중되고 있습니다.보도에 이지은 기자입니다.[기자]매년 취업 준비생이 대거 몰린 삼성 직무적성검사 고사장.하지만 올해는 이 풍경을 볼 수 없습니다.삼성은 코로나19 확산에 따라 이번 시험을 30일과 31일, 네 차례로 나눠 온라인으로 진행하기로 했습니다.겪어본 적 없는 방식에 응시생들의 긴장감이 커진 가운데 모의시험도 등장했습니다.감독관은 시험을 보는 응시생의 모습을 스마트폰으로 연결된 원격 모니터링 시스템을 통해 실시간으로 지켜보게 됩니다.부정행위를 막기 위해 응시생은 상반신과 얼굴, 양손과 PC 화면이 모두 보이게 해야 합니다.감독관 한 명이 응시자 9명을 모니터링할 예정인데, 시험이 끝난 뒤에 녹화 화면을 다시 돌려보며 부정행위가 있는지 검증할 계획입니다.또 면접을 볼 때 기존 성적과 큰 차이가 있는지 다시 약식 시험을 보도록 했습니다.만약 부정행위가 적발되면 5년간 시험 응시가 금지됩니다.최근 SK이노베이션과 현대자동차가 화상 면접을 도입하는 등 '언택트 채용'은 확산하는 추세입니다.[박영진 / 인크루트 홍보팀장 : (언택트 채용은) 감염 우려를 낮출 수도 있고 기존 채용 절차에 들어갔던 시간과 비용을 줄일 수 있기 때문에 사실 코로나19로 본격화됐지만 현 시국 이후에도 계속해서 고려해볼 수 있는 카드가 되지 않을까라고 보고 있습니다.]국내 대기업 중 최대 규모 대졸 신입사원을 뽑는 삼성의 필기시험까지 온라인으로 진행되면서 앞으로 코로나19를 계기로 채용 시장에 큰 변화의 바람이 불 것으로 전망됩니다.YTN 이지은[jelee@ytn.co.kr]입니다.[저작권자(c) YTN & YTN PLUS 무단전재 및 재배포 금지]",/news/news_read.nhn?article_id=0001446280&office_id=052&mode=search&query=SK&page=2
