head,text,url
,"[서울경제] 오전 하락 출발했던 코스피가 상승세를 이어가지 못하고, 전 거래일(1714.86)보다 42.42p(-2.47%) 내린 1672.44로 하락 마감했다.투자자별 동향을 살펴보면 개인은 5,990억, 기관은 3,586억을 각각 순매수 했으나, 외국인은 10,093억을 순매도하며 하락장을 주도했다.업종별로는 (-5.02%), (-4.75%), (-4.52%) 등 대부분의 업종이 하락 마감했고,
일부 업종만이 강세를 보였다.종목별로는 삼성전자가 3.27% 내린 4만 7300원에 장을 마감한 가운데, (-15.49%), (-13.87%), (-13.22%) 도 내림세를 보였다. 반면 (+19.12%), (+12.34%), (+11.03%) 등은 상승 마감했다.금일 하락종목은 635개, 상승종목은 238개를 기록했다.[이 기사는 증시분석 전문기자 서경뉴스봇(newsbot@sedaily.com)이 실시간으로 작성했습니다.]/서경뉴스봇 newsbot@sedaily.com저작권자 ⓒ 서울경제, 무단 전재 및 재배포 금지",/news/news_read.nhn?article_id=0003710956&office_id=011&mode=search&query=SK&page=3
"佛 AI솔루션 업체 메트론과 제휴""에너지 최적화로 원가절감 가능""","[서울경제] 는 프랑스 인공지능(AI) 솔루션 업체 메트론(Metron SAS)과 전략적 제휴를 맺고 AI 기반 에너지 효율화 서비스를 국내에서 시작한다고 17일 밝혔다. 각 사업장에서 축적되는 방대한 데이터를 AI로 분석해 최적의 에너지 솔루션을 찾고 비용을 줄여주는 서비스다.국내 산업체들은 주로 오퍼레이터들의 경험을 토대로 에너지 절감 활동을 해왔다. 하지만 기존의 공장에너지관리시스템(FEMS)은 사업장의 에너지 사용 현황을 보여주거나 사전에 설정된 분석모델을 통해 사용패턴을 분석하는 데 그쳐 한계가 있었다.이와 달리 SK가스가 제공하는 솔루션은 최적의 제어 포인트를 수시로 제안한다. 실시간 분석 자료를 여러 담당자들에게 공유해 데이터 기반 의사결정 능력도 높였다. 이를 통해 최적의 설비 규모 산출, 정기 유지보수 성과 분석, 설비 등의 이상 파악 등도 가능해진다.SK가스 관계자는 “이 솔루션은 소프트웨어 형태로 제공되기 때문에 초기 구축 비용이 매우 저렴하고 단기간에 적용할 수 있다”며 “유틸리티 및 생산 공정 전반을 분석해 전기뿐 아니라 스팀·용수 등 모든 에너지원을 최적화할 수 있다”고 설명했다.이를 바탕으로 액화석유가스(LPG) 등의 공급자를 넘어 종합 에너지 플랫폼 서비스 사업자로 거듭난다는 게 SK가스의 계획이다. 이외에도 국내외 다양한 에너지 솔루션을 발굴하고 상용화해 SK가스 고유의 종합 에너지 서비스 플랫폼을 개발, 구축해 나간다.SK가스 측은 “AI 분석 기술과 인간의 축적된 경험을 결합해 에너지 관리 영역에서 제대로 된 스마트 팩토리를 구현하게 될 것”이라면서 “다양한 업종의 에너지 최적화를 구현해 원가절감뿐 아니라 온실가스 배출 감소 등 사회적 가치 제고에도 기여하겠다”고 강조했다.메트론은 에너지 데이터분석 솔루션 전문 스타트업으로 현재 7개국에 지사를 두고 22개국 100개 이상의 공장에 에너지효율화서비스를 제공하고 있다. 메트론에 따르면 이 서비스를 통해 에너지 비용의 5∼10%를 절감하는 성과를 내고 있다./박효정기자 jpark@sedaily.com저작권자 ⓒ 서울경제, 무단 전재 및 재배포 금지",/news/news_read.nhn?article_id=0003710961&office_id=011&mode=search&query=SK&page=3
개미 거래계좌 예탁금만 36兆코로나 사태 이후 30% 급증,"신종 코로나바이러스 감염증(코로나19) 사태로 주가가 연일 폭락하자 저가 매수를 노리는 개인투자자가 증시로 눈을 돌리면서 대기자금이 사상 최대 규모로 불어났다.17일 금융투자협회에 따르면 지난 13일 현재 증시 대기자금은 131조2306억원에 달한 것으로 집계됐다. 코로나19 사태가 본격화한 지난 1월 20일 이후 16조5350억원(14.4%) 늘어났다. 이 같은 증가폭은 역대 최대 수준이다.증시 대기자금은 투자자예탁금(36조1900억원), 파생상품거래예수금(10조616억원), 환매조건부채권(RP) 잔액(74조8131억원), 위탁매매 미수금(2864억원), 신용융자 잔액(9조8628억원), 신용대주 잔액(166억원) 등을 합한 것이다. 이 중 투자자가 주식을 사려고 증권사 거래계좌에 일시적으로 맡겨둔 돈인 투자자예탁금은 같은 기간 8조6442억원(31.4%) 대폭 증가했다. 주식시장이 약세로 진입하면서 저가매수 기회로 본 개인투자자 자금이 증시로 몰려들고 있는 것으로 분석된다.1월 20일부터 3월 16일까지 유가증권시장에서는 기관과 외국인이 모두 순매도를 보인 가운데 개인만 14조4191억원어치 순매수했다.코스닥시장에서도 개인은 2조2474억원어치를 순매수해 총 16조6555억원어치 주식을 쓸어담았다. 개인은 삼성전자와 SK하이닉스, 삼성SDI 등 우량주를 사들이고 있다. 이 기간 삼성전자의 개인 순매수 규모는 5조7288억원에 달했다. 삼성전자 주가는 같은 기간 21.6% 떨어졌다.설지연 기자 sjy@hankyung.com▶ ▶
 ▶
ⓒ 한국경제 & , 무단전재 및 재배포 금지",/news/news_read.nhn?article_id=0004307981&office_id=015&mode=search&query=SK&page=3
,"[디지털타임스 박정일 기자] 코로나19 사태 확산으로 반도체까지 L자형 불황에 빠질 수 있다는 공포가 점점 커지고 있다. 세계경제가 '복합위기'의 공포에 휩싸이는 가운데, 그나마 수출 버팀목이던 반도체까지 침체를 면치 못할 경우, 제조업 비중이 높은 국내 경제는 심각한 불황에 직면한다.17일 업계에 따르면 삼성전자와 SK하이닉스 등 주요 반도체 업체들은 코로나19가 미국과 유럽 등 주요시장에 빠르게 확산함에 따라 전방산업의 위축이 예상보다 클 가능성에 대비한 '컨틴전시 플랜'을 고민하고 있다. 업계 관계자는 ""아직 분기 단위 계약 기간이 남아 확연한 수요 감소 조짐은 아직 없지만 모바일고 PC용 수요는 줄어들 것으로 본다""며 ""다만 코로나19 사태가 장기화 하면 서버까지 포함한 전방산업 전반의 위축이 불가피할 것""이라고 말했다.실제로 시장조사업체 D램익스체인지에 따르면 이날 오전 11시 기준으로 D램(DDR4 8GB 2400Mbps)과 낸드플래시(MLC 32Gb 8GB) 현물거래가격은 전날보다 각각 0.11% 하락했다. 아직 고정거래가격은 상승 또는 보합세지만, 코로나19 사태가 장기화 조짐을 보일 경우 하락 가능성도 점쳐진다.이와 관련 D램익스체인지는 최근 보고서에서 스마트폰과 PC 판매 감소의 영향으로 올 3분기 낸드플래시 가격이 -5%, 4분기에는 -15%까지 하락할 것으로 내다봤다. D램 역시 전방산업의 재고 확보 움직임이 끝나는 올 4분기에는 정체 또는 소폭 하락할 가능성을 점쳤다.이 같은 전망은 코로나19의 영향으로 노트북과 스마트폰 판매량이 전년보다 각각 9.0%, 7.5% 감소할 것이라는 분석에서 나왔다. 코로나19 사태 직전까지는 각각 2.6%, 3.5% 감소를 점쳤지만, 감소폭이 더 커질 것으로 예상한 것이다. 메모리 수요를 이끌고 있는 서버 역시 코로나19 전에는 5.1% 증가를 예상했지만, 최근에는 3.1%로 상승폭을 낮췄다.마찬가지로 시장조사업체 IC인사이츠는 최근 보고서에서 ""코로나19 사태가 단기간에 끝나면 V자형이나 U자형 회복을 보이겠지만, 현재는 L자형 불황 가능성을 높게 보는 게 합리적""이라고 분석했다.이들은 4월 초나 5월 초에 코로나19 사태가 조기 종식될 경우 V자 또는 U자형의 시장이 형성되지만, 6월까지 갈 경우 L자형이 거의 확실하다고 내다봤다. 이 역시 세계보건기구(WHO)가 '팬데믹(세계적 유행)' 선언을 하기 직전 나온 보고서라 현 상황은 이보다 더 나쁘다.반도체까지 어려워질 경우 제조업·수출 중심의 우리 경제에는 치명타다. 이미 코로나19에 따른 판매 위축과 국제유가·정제마진 동반 하락으로 자동차, 정유화학 등 주력 제조업이 어려운 와중에 수출의 20% 안팎을 차지하는 반도체까지 위축하면 사실상 성장 동력이 없어진다.하지만 삼성전자와 SK하이닉스는 준비한 공정 고도화 일정을 차질없이 준비한다는 방침이다. 삼성전자는 이날 평택캠퍼스 P1 라인을 6세대 V낸드로 본격 전환하고, 중국 시안 신규 2라인(X2)에서도 5세대 V낸드 양산을 시작한다고 밝혔고, SK하이닉스도 올해 96단과 128단 낸드 생산량을 확대한다는 계획을 차질없이 진행한다는 방침이다.업계 관계자는 ""코로나19로 메모리 시장의 반등세가 약해졌지만, 단지 서버와 모바일 등의 수요 급증 시점이 조금 미뤄진 것""이라며 ""단기적으로는 시장 상황에 탄력 대응하고 중·장기적으로는 미세공정 경쟁력을 지속해 끌어올릴 것""이라고 말했다. 박정일기자 comja77@dt.co.kr 디지털타임스
/",/news/news_read.nhn?article_id=0002589127&office_id=029&mode=search&query=SK&page=3
'fnRASSI'는 금융 AI 전문기업 씽크풀과 파이낸셜뉴스의 협업으로 로봇기자가 실시간으로 생산하는 기사입니다.,"17일 코스피는 전일 대비 -42.42p 하락한 1,672.44에 거래를 마감했다. 당일 상승한 종목의 수는 238개, 하락 635개, 보합 32개이다. 상승한 종목으로 명문제약(017180) 19.1%, SK케미칼(285130) 12.3%, 한샘(009240) 11.0% 등이 있다.




 ※ 저작권자 ⓒ 파이낸셜뉴스. 무단 전재-재배포 금지",/news/news_read.nhn?article_id=0004391472&office_id=014&mode=search&query=SK&page=3
,"[아시아경제 황윤주 기자] 국내 전기차 배터리업계가 신종 코로나바이러스감염증(코로나19) 사태 장기화 여부에 촉각을 곤두세우고 있다. 유럽 내 코로나19 사태가 단기간에 진정되지 않을 경우 배터리 수주와 유럽 공장 증설 등에 영향을 미칠 것이란 판단에서다.17일 업계에 따르면 SK이노베이션은 이미 지난 달 코로나19 사태로 인해 유럽 생산 공장이 '셧다운'(일시정시) 될 것을 가정하고 올해 상반기 물량 수급에 차질이 없도록 대응 지침을 마련했다.SK이노베이션 고위 관계자는 ""일본의 수출 제한, 중국의 '셧다운' 사태 등을 경험한 뒤 해외 공장에서 비슷한 상황이 발생할 경우 생산에 차질이 없도록 매뉴얼을 미리 준비했다""며 ""지동섭 배터리사업 대표가 지난 1월 방문했을 때 헝가리 공장의 물류 및 이동 제한 등에 대한 점검을 이미 마쳤다""라고 말했다.삼성SDI 역시 코로나19 사태 당시 만들어진 태스크포스(TF)에서 헝가리 공장의 대응 방안과 방역 지침을 컨트롤하고 있다. LG화학은 폴란드 공장 내 코로나19 확진자가 발생하지 않도록 근로자들을 대상으로 발열검사 실시, 손 소독제 구비, 외부 식당 이용 자제 등 방역 체계를 강화했다.세계보건기구(WHO)에 따르면 전일(오후 4시) 기준 헝가리의 코로나19 확진자는 32명, 폴란드는 150명으로 늘었다. 코로나 19 확진자가 급증하자 헝가리 정부는 한국발 출국자의 입국을 금지했고, 폴란드는 외국인의 입국을 금지한 상태다.헝가리에는 SK이노베이션(코마롬)과 삼성SDI(괴드)가 배터리 공장을 가동 중이다. 폴란드에서는 LG화학(브로츠와프)이 배터리를 생산하고 있다. 올해 2분기부터 유럽 완성차 업체들이 전기차를 본격적으로 출시하기 때문에 국내 배터리업계는 일찌감치 동유럽에 생산 기지를 마련했다.유럽연합(EU)의 환경 규제로 유럽 완성차 업체들이 유럽에서 판매해야 하는 전기차 물량은 2020년 190만대, 2021년 240만대에 달한다. 이는 지난해(60만대)보다 3~4배에 달하는 규모다.문제는 유럽 내 코로나19 사태가 장기화될 경우다. 국내 배터리업계는 이미 유럽과 미국 확산을 염두하고 배터리 수급 및 공장 운영 대응책을 마련했지하반기까지 이어질 경우 배터리 수주는 물론 유럽 공장 증설에도 차질이 생길 전망이다.박연주 미래에셋대우 연구원은 ""내연기관 자동차 시장의 축소, 테슬라의 시장 지배력 확대를 감안할 때 자동차 업체들의 전기차 전략이 바뀌기는 어렵지만 코로나19 사태로 배터리 생산에 차질이 있을 경우 하반기에 더 많은 물량을 생산해야 한다""고 말했다.황윤주 기자 hyj@asiae.co.kr <ⓒ경제를 보는 눈, 세계를 보는 창 아시아경제 무단전재 배포금지>",/news/news_read.nhn?article_id=0004644323&office_id=277&mode=search&query=SK&page=3
,"한국은행의 사상 첫 제로금리 결정에도 불구하고, 추락하는 코스피 지수를 반등시키지는 못했다. 다만 뉴욕증시 대폭락에도 불구하고 1600선을 방어하며 그 아래로 떨어지지는 않았다. 코스닥은 코스피와 반대로 상승 전환에 성공했다. 코스피에서 빠져나간 외국인이 반대로 코스닥에선 ‘사자’가 형성됐다.코스피는 17일 전 거래일 대비 42.42포인트(-2.47%) 내린 1672.42에 거래를 마쳤다. 개인과 기관이 각각 5990억원, 3586억원을 순매수했지만, 외국인이 1조 넘게 빠져나갔다. 외국인은 1조93억원을 순매도했다.이날 시가총액 상위종목은 셀트리온(1.51%)과 LG생활건강이 상승 마감했다. 삼성전자(-3.27%), SK하이닉스(-0.25%), 삼성바이오로직스(-2.91%), 네이버(-2.58%), LG화학(-1.92%), 현대차(-3.38%), 삼성SDI(-2.77%) 등은 내림세를 나타냈다.코스닥은 전 거래일 대비 10.22포인트(2.03%) 오른 514.73에 거래를 마쳤다. 개인이 3343억원을 순매도했지만, 코스피와는 반대로 외국인은 2495억원 순매수하며 압도했다. 기관 또한 1840억원 순매수했다.코스닥 시가총액 상위종목은 코스피와 반대로 CJ ENM(-3.09%)을 제외하고는 모두 상승 그래프를 그렸다. 셀트리온헬스케어(4.44%), 에이치엘비(8.50%), 펄어비스(7.90%), 스튜디오드래곤(2.24%), 케이엠더불유(4.57%), 씨젠(10.52%), 휴젤(12.28%) 등 대부분 급등세를 보였다.송창범 기자
 <저작권자 ⓒ '성공을 꿈꾸는 사람들의 경제 뉴스' 머니S, 무단전재 및 재배포 금지>",/news/news_read.nhn?article_id=0000518917&office_id=417&mode=search&query=SK&page=3
,"[디지털타임스 박정일 기자] ""코로나19 영향으로 해외 수출길까지 막혀 매출에 파급력이 상당한 상황에서 불가피하게 현재 진행중인 모든 채용을 중단키로 결정했다."" 한 대기업 계열사는 최근 신입사원 채용 서류합격자들에게 이 같은 문자를 보내고 채용계획 연기를 통보했다.코로나19가 '팬데믹(세계적 대유행)'으로 확산하면서 청년 고용절벽이 현실화 하고 있다는 우려가 커지고 있다. 이미 주요 대기업들이 상반기 신입공채 시점을 연기하거나 정하지 못한 가운데, 진행 중인 채용절차도 중단하는 상황이 속출하고 있어서다.특히 수출 비중이 높은 제조업체들은 막막한 상황에 처했다. 그나마 인공지능(AI)이나 전기자동차용 배터리 개발 등 신성장 사업 관련 전문가 채용만 꾸준할 뿐 일반 영업이나 생산 관련 채용은 확연히 줄어든 모습이다. 17일 한 재계 관계자는 ""코로나19에 따른 경제위기가 이제 시작인 것 아니냐는 위기감이 커지고 있기 때문""이라며 ""글로벌 경기침체에 따른 고용절벽 문제를 해소하기 위해서는 정부가 신성장 사업이나 대규모 SOC(사회간접자본)와 같은 새로운 투자물꼬를 터주는 것 외엔 방법이 없다""고 말했다.실제로 주요 대기업들의 채용공고를 살펴보면 예년과 비교해 확연히 줄었음을 확인할 수 있었다. 신입 채용 연기는 물론이고 경력직도 일부 전문직 또는 단순 업무 보조 충원 차원의 소규모 채용공고만 있었다. 삼성의 경우 회계사 등 특수 전문직을 중심으로 단 5건의 채용공고만 있었고, 현대차그룹 역시 모빌리티나 빅데이터 소프트웨어 관련 상시채용이 전체의 절반 이상을 차지했다. SK나 LG 등도 상황은 크게 다르지 않았다.한 재계 관계자는 ""몇주 전까지만 해도 코로나19 확산을 막기 위해 채용을 연기했지만, 지금은 실적 부진에 대한 우려 때문에 신중한 상황""이라고 전했다.또 다른 조선업계 관계자는 ""수주를 하려면 선주도 만나고 해야 하는데 대부분 유럽에 몰려있다""며 ""화상회의 등으로 진행하려 하지만 한계가 있고, 미팅을 해야 유리한데 코로나로 막혀있는 상황""이라고 말했다.화학업계 관계자도 ""고부가 소재 연구·개발이나 배터리 같은 신성장 사업 외에는 거의 채용계획이 나오지 않는 것으로 안다""며 ""하지만 신성장 사업의 경우 오히려 인재 부족에 시달리고 있어 상시채용으로 전환해도 쉽지 않은 상황""이라고 전했다.관세청 등 집계에 따르면 우리나라는 3월 들어 하루 평균 수출액이 지난해보다 2.5% 감소하고 있다. 코로나19 여파로 2월에도 일평균 수출량이 전년보다 11.7% 감소했다.재계에 따르면 복수의 대기업들은 대부분 기업들은 아직 채용 일정이나 규모를 거의 정하지 못하고 있는 것으로 전해졌다. 이들 대기업들은 각 업종별로 시장 상황이 어떻게 변할지 모르고, 코로나19의 여파가 언제까지 이어질지도 예측하기 어려운 만큼 최대한 신중하게 채용계획을 짜고 있는 것으로 알려졌다. 한편 전국경제인연합회 산하 한국경제연구원이 매출액 기준 500대 기업을 상대로 조사한 바에 따르면, 응답 기업 4곳 중 1곳은 채용을 줄이거나 아얘 뽑을 계획이 없다고 답했다. 응답 기업들은 대졸 신규채용을 늘리기 위해 정부와 국회가 추진해야 할 정책으로 규제 완화를 통한 기업투자 활성화 유도(50.0%), 고용증가 기업에 세제 혜택 등의 인센티브 확대(49.2%) 등을 꼽았다. 박정일기자 comja77@dt.co.kr 디지털타임스
/",/news/news_read.nhn?article_id=0002589133&office_id=029&mode=search&query=SK&page=3
■ 경제현장 오늘 '마감시황' - 전화연결 : SK증권 이재윤 연구위원,"미국 증시 또 대폭락을 기록했죠. 다우지수가 13%가까이 폭락하면서 오늘(17일) 우리 증시도 4% 급락 출발해 장중 1630선까지 떨어졌습니다. 마감상황은 어떤지 알아보죠.현재 코스피는 1672.22로 전일대비 2.49% 하락했고, 코스닥은 514.56%로 전일대비 1.99% 하락했습니다. 오늘 코스피 내에서 투자자별 수급은 현재시각 기준으로 외국인이 600억원 매도한 반면, 기관은 2400억원을 매수했습니다. 오늘 코스피는 미국 경제에 대한 불안, 그리고 부진한 중국경제지표 소식에 하락했습니다. 전일 미국 증시는 트럼프 대통령의 코로나19에 대한 발언과 경제지표 쇼크로 12% 정도 급락했는데요. 트럼프 대통령은 코로나19 사태가 8월까지 길어질 수 있다고 우려를 나타냈고 일부 지역에 대한 봉쇄를 검토할 수 있다고 발언했습니다.미국 3월 뉴욕 제조업 지수가 전월 12.9에서 -21.5로 급락하면서 2009년 이후 가장 낮은 수준을 기록했습니다. 이날 특히 다우지수는 전일대비 12.93% 하락하면서 1987년 블랙먼데이 이후 최대 하락률을 기록했는데요. 개장 직후 서킷브레이커가 발동되었고, 3월에만 세 번 발동되었습니다. 다만, 한국 증시는 최근 급락으로 인한 저가 매수세가 유입되는 등 미국 증시보다는 낙폭이 덜했습니다. 오늘 코스피 시가총액 상위 종목 중 기계 업종에 속하는 '두산중공업' 종목이 크게 상승했습니다. 오늘 두산중공업이 부산항만공사와 트랜스퍼 크레인 12기를 공급하는 계약을 체결했다는 소식 때문인데요. 두산중공업은 수주 크레인을 2022년 3월까지 공급한다는 계획입니다.더불어 두산중공업은 경영난으로 일부 휴업을 검토한다는 소식에 이번 달 초부터 급락세를 이어왔는데요. 이에 따른 저가 매수세도 오늘 유입된 것으로 보입니다. SK증권은 코로나19로 인한 공포가 해소된 뒤 어떤 업종이 상승할 수 있을지에 초점을 맞추고자 합니다. 향후 유가는 수요·공급을 감안하면 저유가가 지속될 가능성이 있는데요. 최근 미 연준의 금리 인하 기조와 양적 완화는 장기 저금리로 이어질 가능성이 있습니다. 또한 코로나19로 인한 여파로 인한 여행 수요 감소는 남유럽 국가들에 피해가 예상되에 따라 이로 인한 유로화 약세, 달러 강세 압력으로 작용할 것이라고 전망합니다.SK증권은 이러한 저금리와 달러 강세 압력이 지속되는 환경에서 어떤 자산을 취하는 것이 필요한지 봤을 때반도체, 플랫폼, 5G 등 신경제 성장주 기업들에 매수 포지션을 취하는 전략이 좋다고 봅니다. 게다가 최근 중국이 신 인프라 투자 계획을 발표함에 따라 이러한 업종들이 정책적 수혜를 받을 것으로 예상합니다. 반면 유가 하락과 강달러의 압력으로 기존 전통산업이라고 부를 수 있는 에너지 등 시클리컬 업종에는 매도 포지션을 취하는 전략이 유효하다고 판단합니다. (자세한 내용은 동영상을 시청하시기 바랍니다.)
 윤선영 기자(anable@sbs.co.kr) ▶ ▶ 저작권자 SBS미디어넷 & SBS I&M 무단전재-재배포 금지",/news/news_read.nhn?article_id=0000207439&office_id=374&mode=search&query=SK&page=3
"외국인 1조 매도 폭탄코스피, 1700선도 붕괴원/달러 환율 급등…1,240원 돌파코스닥은 2% 넘게 반등","[한국경제TV 신재근 기자]코스피가 한국은행의 금리인하 결정에도 1,700선을 내줬다.17일 코스피는 전 거래일 대비 42.42포인트(-2.47%) 내린 1,672.44에 거래를 마쳤다.지수는 종가 기준으로 지난 2011년 10월 5일(1,666.52) 이후 최저치다.불과 일주일 만에 지수가 300포인트 이상 내린 것이다.이날 지수 하락은 원/달러 환율 급등에서 비롯됐다는 분석이다.이경민 대신증권 연구원은 이날 ""원/달러 환율이 1,240원 선을 넘어서며 외국인 매물 압력이 지속됐다""고 분석했다.이날 서울 외환시장에서 원/달러 환율은 전날보다 17.5원 오른 달러당 1,243.5원에 종가가 결정됐다.배민근 LG경제연구소 연구위원은 ""한국은행의 금리 인하와 갖가지 대책에도 미국 주식시장이 하락한 것이 원화 약세를 부추기는 요인으로 작용했다""고 말했다.외국인은 이날 1조92억원어치를 순매도하며 코스피에서 9거래일 연속 팔아치웠다.이 기간 외국인이 팔아치운 금액만 7조4,500억원에 달한다.개인(6,004억원)과 기관(3,569억원)은 동반 순매수에 나섰다.특히 기관은 선물시장에서도 5천억원 가까운 매수세를 보여줬다.업종별로는 코스피 전 업종이 파란불(주식시장에서 하락을 의미)이 들어왔다.운수창고(-4.52%)와 보험(-6.71%), 전기가스(-4.75%) 업종의 낙폭이 컸다.시가총액 상위 10개 종목은 삼성전자(-3.27%)와 SK하이닉스(-0.25%), 삼성바이오로직스(-2.91%), NAVER(-2.58%), LG화학(-1.92%), 삼성물산(-1.67%)이 하락 마감하며 5거래일 연속 내림세를 이어갔다.현대차(-3.38%)와 삼성SDI(-2.77%)는 8거래일 연속 떨어졌다.특히 현대차는 52주 신저가가 매일 바뀌고 있는 중이다.셀트리온헬스케어(1.51%)와 LG생활건강(0.09%)은 상승 마감했다.코스닥은 2% 넘게 반등했다.이날 코스닥지수는 전장보다 10.22포인트(2.03%) 오른 514.73에 장을 마쳤다.개인(-3,342억원)이 3천억원 넘게 팔았지만, 외국인(2,489억원)과 기관(840억원)이 동반 매수로 지수를 끌어올렸다.외국인과 기관은 특히 유통과 제조, 제약, IT 등 대부분의 업종에서 순매수를 기록했다.코스닥 시총 상위 10개 종목은 CJ ENM(-3.09%)을 제외하고 모두 올랐다.셀트리온헬스케어(4.44%)와 에이치엘비(8.50%), 펄어비스(6.90%), 스튜디오드래곤(2.24%), 케이엠더블유(4.57%), 씨젠(10.52%), 휴젤(12.28%), SK머티리얼즈(6.02%), 에코프로비엠(0.43%) 등이 크게 상승했다.신재근기자 jkluv@wowtv.co.krⓒ 한국경제TV, 무단 전재 및 재배포 금지",/news/news_read.nhn?article_id=0000856330&office_id=215&mode=search&query=SK&page=3
