head,text,url
,"주식시장이 신종 코로나바이러스 감염증(코로나19) 확산의 직격탄를 맞고 있는 가운데 국내 10대 그룹 총수들의 보유 지분 가치가 14조5000억원 이상 줄어든 것으로 나타났다. 특히 국내 주식 부호 1위인 이건희 삼성전자 회장의 주식 자산은 무려 2조7000억원이나 감소한 것으로 조사됐다.기업분석 전문기업 한국CXO연구소에 따르면, 국내 10대 그룹 총수의 주식평가액은 국내에서 첫 코로나19 확진자가 발생한 지난 1월20일 32조5650억원에서 40일 후인 지난 2월28일 27조9727억원으로 14.1%(4조5922억원) 증발했다.이건희 회장의 지난 1월20일 주식평가액은 19조2607억원으로 올해 처음으로 19조원을 넘으며 최고점을 달성했다. 이후 2월28일 16조5417억원으로 14% 감소했다. 코로나19 확산으로 삼성전자와 삼성생명의 주가가 폭락했기 때문이다.주식평가액 하락 폭이 가장 큰 총수는 신동빈 롯데그룹 회장이었다. 신 회장의 주식 평가액은 8736억원에서 6511억원으로 25.5%(2224억원)나 줄었다. 이명희 신세계그룹 회장도 보유 주식 가치가 1조1665억원에서 9568억원으로 18% 감소하면서 주식부호 '1조 클럽'에서 제외됐다. 이밖에 최태원 SK그룹 회장의 주식평가액은 3조1225억원에서 2조4929억원으로 20.2%, 정몽구 현대자동차그룹 회장은 3조8544억원에서 3조4196억원으로 11.3% 각각 감소했다.반면 조원태 한진그룹 회장은 코로나19 사태로 다른 총수들의 주식평가액이 하락하는 가운데서도 오히려 1167억원에서 2596억원으로 60% 가량 늘어났다. 조 회장이 누나인 조현아 전 대한항공 부사장과 경영권 분쟁을 벌이면서 그가 보유한 한진칼 주가가 단기간 내 폭등한 결과다.이처럼 총수들의 주식평가액이 폭락한 건 핵심 계열사들의 주가가 크게 하락 때문이다. 10대 그룹 핵심 계열사 10곳의 주가는 모두 하락했다. 평균 하락률은 16%에 육박했다. 그 중에서도 롯데쇼핑과 신세계의 주가 하락률이 각각 29.2%와 23.6%로 가장 컸다. 코로나19로 유통업계가 큰 타격을 받은 결과로 분석된다.이어 한국조선해양(-19.1%)과 대한항공(-16.9%), LG전자(-15.2%), 한화(-15%) 등은 15% 이상, 삼성전자(-13.1%)와 SK하이닉스(-12%)는 10% 이상 주가가 하락했다. 현대자동차그룹의 경우 주력 계열사인 현대차의 주가 하락률은 2.5%에 그쳤지만, 기아차(-12.9%)와 현대모비스(-14.6%)의 주가 하락률이 높게 나타났다.오일선 CXO연구소 소장은 ""코로나19 사태가 업종과 상관없이 주가 폭락을 몰고 왔다""며 ""코로나19가 전 세계에서 동시다발적으로 확산하고 있어 회복 국면으로 접어들더라도 우리 경제가 이전 수준으로 회복하는 시점은 하반기 이후가 될 수 있다""고 밝혔다.송응철 기자 sec@sisajournal.com<저작권자 ⓒ 시사저널, 무단 전재 및 재배포 금지>",/news/news_read.nhn?article_id=0000011990&office_id=586&mode=search&query=SK&page=6
5~6곳 예비입찰…참여 의향소비자간거래 중심 사업구조PEF로 재매각 시나리오 유력,"4년여만에 인수합병(M&A) 시장에 재도전장을 낸 로젠택배에 대한 시장의 반응이 미적지근하다. 지난해 말 재매각 작업이 공식화했을 당시 올해 주요 매물이 될 것이란 전망이 우세했지만 최근 이뤄진 예비입찰 흥행은 예상보다 부진했다.아울러 ‘코로나19’ 사태로 촉발된 배송전쟁에서도 확실한 승기를 잡기 어려운 로젠택배의 사업구조가 노출되면서, 인수전 열기가 식어가는 단계로 접어든 것 아니냐는 우려가 나온다.2일 투자은행(IB) 업계에 따르면 최근 진행한 로젠택배 예비입찰에서 전략적 투자자(SI)와 사모펀드(PEF) 등 재무적 투자자(FI) 5~6곳이 인수전 참여 의향을 나타낸 것으로 알려지고 있다. 거론되는 인수 후보는 JC파트너스와 키스톤PE, 위메프와 미국계 펀드 등이다.로젠택배는 적격예비인수후보(쇼트리스트)에 선정된 인수 후보들이 한 달여간의 예비실사를 마치면 본입찰 진행 후 우선협상대상자를 선정한다는 계획이다.앞서 로젠택배 지분 100%를 보유한 홍콩계 사모펀드 베어링PEA는 지난해 말부터 매각 작업을 개시했다. 베어링PEA는 지난 2016년 역시 PEF사인 CVC캐피탈파트너스와 주식매매계약(SPA)까지 맺었다가 인수가 최종 무산된 바 있다.시장이 예상하는 로젠택배의 매각가는 4000억원대에 이른다. CJ대한통운 등 대기업 물류회사의 EV/EBITDA 멀티플 10배 수준에서 산정될 것으로 전망된다.그러나 일각에서는 수천억원대 투자처로서 로젠택배의 인수 매력이 크지 않다는 지적이 나온다. 택배업계 빅3인 CJ대한통운과 한진, 롯데글로벌로직스에 비해 규모가 작아 규모의 경제를 기반으로 하는 수수료 경쟁에서 뒤쳐질 수밖에 없다는 평가가 우세하다. 지난해 기준 로젠택배의 시장점유율은 지난해 기준 8% 안팎에 머무르고 있다. 또 기업간거래(B2B) 중심으로 물량을 대거 받을 수 있는 CJ대한통운, 한진 등과 비교해 로젠택배는 소비자간거래(C2C) 중심의 사업구조를 유지하고 있다.특히 최근 신선배송·당일배송 등 대규모 유통업체들의 배송 경쟁이 심화된 가운데서도 물류 인프라나 플랫폼 확보를 위한 투자에서 다소 뒤쳐지고 있다는 점이 가장 큰 걸림돌이다. 이러한 사업구조 때문에 코로나19 국면에서 비대면 소비 시장 확대라는 절호의 기회가 왔지만, 정작 제대로 치고 나가기 어렵다는 평가도 받고 있다.이에 당초 투자가 점쳐졌던 카카오모빌리티와 SK에너지 등 대기업 계열회사들은 예비입찰에도 참여하지 않은 것으로 확인됐다.업계 관계자는 “두 회사 모두 물류 인프라 확보에 대한 니즈는 있지만 택배업체 인수보다 전략적 제휴 등 기타 전략으로 선회한 것으로 해석된다”며 “이런 측면에서 이번 로젠택배 인수전은 대기업 중심 전략적 투자보다는 PEF로의 재매각 시나리오가 유력할 것으로 보인다”고 전망했다.이세진 기자
- Copyrights ⓒ 헤럴드경제 & heraldbiz.com, 무단 전재 및 재배포 금지 -",/news/news_read.nhn?article_id=0001642701&office_id=016&mode=search&query=SK&page=6
美 듀폰사 웨이퍼 사업부 인수,"글로벌 반도체 웨이퍼 제조기업 SK실트론이 미국 듀폰사의 실리콘 카바이드 웨이퍼(Silicon Carbide Wafer· SiC 웨이퍼) 사업부 인수를 마무리했다고 2일 밝혔다.SK실트론는 이번 인수로 미국과 일본이 주도하고 있는 전기차·5G 반도체용 웨이퍼 시장 본격 진출할 계획이다.SiC 웨이퍼는 고경도, 내전압, 내열 특성을 가지고 있어 에너지 효율이 중요한 전기차, 5G 네트워크 등에 사용되는 전력반도체용 웨이퍼다.앞서 SK실트론은 지난해 9월 이사회에서 듀폰 SiC 사업부를 4억5000만달러(5400억원)에 인수하기로 결의했다.SK실트론은 이번 인수를 통해 듀폰이 보유한 R&D 및 생산 역량과 기존 주력 사업간 시너지를 극대화하는 동시에, 고성장 중인 전기차 반도체 시장 영역 진출을 통해 신규 성장 동력을 확보하게 됐다.아울러 이번 인수로 그룹 차원의 전기차 분야 사업 포트폴리오 강화에도 힘이 실릴 것으로 기대된다. SK그룹의 주요 계열사인 SK이노베이션은 전기차 배터리를 생산하고 있고, SKC는 최근 글로벌 1위 전기차 배터리 동박업체인 KCFT를 인수한 바 있다.SK실트론은 구미시에 본사를 두고 있는 국내 유일의 반도체 실리콘 웨이퍼 제조 기업으로 1983년에 설립되었다. 연매출 1조 5429억원의 글로벌 5대 웨이퍼 제조 기업 중 하나로(2019년 기준), 전 세계 실리콘 웨이퍼 판매량의 약 17%(300mm 기준)를 차지하고 있다.SK실트론 관계자는 “이번 인수 이후에도 관련분야 투자를 지속할 예정이며 이번 인수로 인해 SiC 웨이퍼의 생산량 증대와 미국 내 추가적인 고용 창출이 예상된다”고 말했다.정세희 기자
- Copyrights ⓒ 헤럴드경제 & heraldbiz.com, 무단 전재 및 재배포 금지 -",/news/news_read.nhn?article_id=0001642705&office_id=016&mode=search&query=SK&page=6
가격매력 상승 종목 매수 타이밍,"가격 매력이 높아진 ‘화학·자동차·반도체 업종’에 주목하라는 의견이 제기됐다.삼성증권은 2일 신종 코로나바이러스 감염증(코로나19) 사태로 코스피가 글로벌 금융위기 수준에 근접해 지금은 매도로 대응할 실익이 크지 않은 만큼 가격 매력이 높아진 업종에 주목해야 한다며 ‘화학·자동차·반도체 업종’을 추천했다.문동열 연구원은 “지난주 국내 증시 단기 낙폭이 예상보다 컸고 코스피가 2000선 아래로 내려가 12개월 예상 주가순자산비율(PBR)은 0.78배로 글로벌 금융위기 및 지난해 8월 저점 수준에 근접했다”며 “코로나19 사태에 따른 변동성이 글로벌 증시 대비 크게 나타나고 있다”고 진단했다.그러면서 “지금은 매도로 대응할 실익은 크지 않고 가격 매력이 높아진 업종 종목에 대한 정리가 필요한 타이밍”이라며 “중장기 세계 거시경제 회복 사이클에 대한 시각이 유효하고 주식시장 관심이 시장충격에서 정책 대응으로 이동할 가능성이 있기 때문”이라고 분석했다.문 연구원은 “가격 매력 확대를 기준으로 한 최선호 업종은 화학, 자동차, 반도체, IT하드웨어”라며 “이들 업종은 올해 고점 대비 낙폭이 15~20%에 육박하지만 실적 전망은 하향조정되지 않아 여전히 올해 30% 이상의 주당순이익(EPS) 성장이 예상된다”고 설명했다.종목별로는 화학 업종의 경우 에코프로비엠, SKC코오롱PI, SK케미칼의 가격 매력이 부각되고 있다고 봤고 자동차 업종에서는 현대차, S&T모티브를, 반도체 업종에서는 삼성전자, SK하이닉스, 원익IPS, 테스, 해성디에스를, IT하드웨어 업종에서는 삼성전기, LG이노텍, 에스에프에이 등을 각각 제시했다.문 연구원은 “이들은 단기적으로 실물경제 수요 둔화가 나타날 경우 일정 부분 타격이 불가피하겠지만 우려 대비 주가 조정 폭이 과도하다”며 “시장의 관심이 정책 대응으로 이동하는 단계에서 글로벌 대비, 또 타업종 대비 탄력적으로 주가가 반등할 가능성이 크다”고 덧붙였다. 김성미 기자
- Copyrights ⓒ 헤럴드경제 & heraldbiz.com, 무단 전재 및 재배포 금지 -",/news/news_read.nhn?article_id=0001642703&office_id=016&mode=search&query=SK&page=6
"KCC 10억, 한국타이어 5억, KBI 1억 성금 기탁네이버 비즈니스 플랫폼, 중소기업 1만4000여곳에 서버비용 50% 인하CJ그룹·교원구몬, 아이들에게 도시락 및 교육 물품 지원","[서울=뉴시스] 김정환 박미영 박주연 표주연 이진영 김혜경 이재은 기자 = 신종 코로나바이러스 감염증(코로나19) 확진 환자가 2일 현재 대구·경북 지역을 중심으로 4000명에 육박하는 등 연일 확산하는 가운데 위기를 함께 극복하려는 기업들의 온정의 손길이 3월 들어서도 계속되고 있다.
전날 KT, LG유플러스, 신세계그룹 등에 이어 2일에는 KCC, 한국타이어, KBI그룹, 네이버 비즈니스 플랫폼(NBP), CJ그룹, 교원구문 등의 기업들이 기부 행렬에 동참했다. 대구·경북 지역에서 코로나19와 사투를 벌이고 있는 의료진들 및 취약 계층을 지원하기 위한 성금기탁부터, 경영상 어려움을 겪는 중소기업 및 소상공인에 대한 지원, 학교가 개학을 연기하면서 식사 및 학습에 어려움을 겪는 취약 아동을 위한 도시락 배달 및 교육 물품 지급 등 기업들의 기부 방법도 다양했다. KCC는 이날 코로나 확산 방지와 피해 지원을 위해 사랑의 열매 사회복지공동모금회에 10억원을 기부했다. 성금은 대구∙경북 지역을 중심으로 전국의 의료지원 봉사자와 방역 인력 등을 위한 방호복, 마스크 등 의료물품 구매에 쓰일 예정이다. 보육원과 양로원 등 취약 계층과 자가 격리자들을 위한 생필품도 지원할 계획이다.한국타이어는 사회복지공동모금회에 후원금 5억원을 기탁했다. 후원금은 노인·장애인·저소득 가정 등 취약계층에게 마스크, 손 소독제 등 위생용품을 지원해 코로나19의 확산을 방지하고 피해를 최소화기 위한 활동에 쓰일 예정이다.KBI그룹(옛 갑을상사그룹)도 대구시에 1억원의 성금을 전달했다. 박한상 KBI그룹 부회장은 ""대구 경북 소재의 계열사들도 이번 사태로 힘들지만 작은 정성을 모아 전달한 만큼 시민들도 힘을 모아 반드시 이겨낼 것으로 믿는다""고 응원했다.네이버 비즈니스 플랫폼(NBP)은 코로나19 사태 장기화로 인해 사업에 어려움을 겪는 중소기업 지원에 나섰다. NBP는 현재 자사 클라우드 플랫폼을 사용하고 있는 중소기업 1만3000여 곳(월 이용요금 기준 200만원 이하)을 대상으로 서버 비용을 3~4월에 50% 인하하기로 했다. 또 원격근무를 지원하는 그룹웨어 '워크플레이스' 또한 무료 프로모션 혜택을 제공할 방침이다. NBP가 이번 프로모션으로 지원하는 서버 이용료는 최대 100억원 수준으로 알려졌다. 또 개학 연기로 비상이 걸린 학교나 학원에 온라인 강의도 지원할 계획이다. CJ그룹은 코로나19 여파로 학교는 물론 공부방까지 쉬게 되면서 식사에 어려움을 겪는 아이들의 건강 챙기기에 나섰다. CJ그룹은 전국 1000여 곳 방과 후 돌봄 공부방에 총 3억원 상당의 CJ기프트카드를 전달했다. CJ기프트카드는 CJ더마켓이나 뚜레쥬르 등에서 즉석식품 및 식사대용 간식, 빵 등을 구매하는데 사용할 수 있다. 구매한 제품은 도시락과 함께 아이들 가정으로 배송될 예정이다. CJ그룹은 지난달 성금 10억원을 전국재해구호협회에 기부한 바 있다. 교원구몬은 대구·경북 지역의 취약 아동을 위해 20억원 규모의 교육 물품과 구호 물품 지원을 위한 기금을 초록우산어린이재단에 기탁했다. 교원구몬은 지역아동센터 등 복지시설들이 전면 휴관에 들어가면서 가정에 고립된 아동들에게 교육 물품과 기초생활 유지를 위한 ‘교원구몬 안심KIT’를 지원한다. ‘교원구몬 안심KIT’는 결식 방지를 위한 간편식을 비롯해 손세정제, 제균 티슈 등 위생용품으로 구성됐다. 특히 교원구몬은 홈스터디가 가능한 교육 물품을 대폭 지원해 집 안에 홀로 남겨진 아동들의 학업 공백이 장기화되지 않을 수 있도록 적극 동참한다.이에 앞서 지난 1일 KT는 코로나19로 영업에 어려움을 겪는 대리점에 인건비·월세 등 운영자금을 지원한다고 밝혔다. 대구·경북지역 대리점에는 지난 2월 월세의 50%를, 나머지 지역 대리점에는 30%를 지원한다. KT는 코로나19로 인한 판매 감소에 따른 유통망의 어려움을 지원하기 위해 지난 2월 초부터 2회에 걸쳐 대리점 채권 여신기한 연장, 상생 지원책 강화 등 영업 정책 지원을 시행하고 있다. 전국에 소재하는 KT 대리점 매장은 2500여개로, 이번에 지원하는 월세 및 정책 지원 금액은 2월 초부터 시행한 지원과 합쳐 50억 수준이다. 아울러 KT는 방문 고객 감소 등 영업에 어려움을 겪고 있는 소상공인을 돕기 위해 KT 건물에 입주한 소상공인을 대상으로 3개월간 임대료를 대구·경북 지역 50%, 나머지 지역은 20% 감면한다고 밝힌 바 있다. LG유플러스 역시 영업에 어려움을 겪는 대구·경북 지역 비롯 전국 2000개 대리점 매장을 돕기 위해 2월 매장 운영자금 25억원을 긴급 지원했다. 지원 자금은 매장 운영 시 발생하는 인건비, 월세 등 비용 부담 경감에 이용된다. 신세계그룹은 코로나19로 경영상 어려움을 중소 협력 회사 사업장 방역을 지원하기로 했다. 신세계백화점, 이마트 등이 거래하는 협력사 신청을 받아 방역비 전액을 지원할 방침이다. 대상 협력사는 신세계백화점 400여 사, 이마트 500여 사 등 총 900여 사로 알려졌다. 신세계그룹은 지난달 대구광역시에 마스크 10만 장을 기부하고, 희망브리지 전국재난구호협회에 성금 10억원을 기부한 바 있다.제약업계도 대구·경북 등 지역사회 돕기에 나섰다. 유한양행은 최근 코로나19의 확산 방지와 조속한 피해복구를 위해 4억5000만원 상당 현금 및 현물을 기부했다. 한국콜마 역시 지난달 29일 대구지역을 방문해 손소독제 1만개를 전달했다. 한국콜마는세종시청과 서초구청에도 손소독제 각 5000개, 3000개를 기부한 바 있다. 또 종합기술원이 있는 서울 내곡동 인근 초등학교와 어린이집, 서울특별시어린이병원 등 지역 주민기관엔 2000개를 전달하기로 했다.이에 앞서 지난달에는 삼성, 현대자동차, SK, LG, 롯데, 한화, 포스코, 현대중공업, 두산을 비롯해 GS, LS, 효성, 유진, KT, 네이버, 신세계, 현대백화점, 아모레퍼시픽, 티웨이항공, 이스타항공, CJ, SPC, 농심 등 다양한 기업들이 코로나19 확산 방지를 위한 기부행렬에 동참했다. ace@newsis.com, mypark@newsis.com, pjy@newsis.com, pyo000@newsis.com, mint@newsis.com, chkim@newsis.com, lje@newsis.com<ⓒ 공감언론 뉴시스통신사. 무단전재-재배포 금지>",/news/news_read.nhn?article_id=0009731787&office_id=003&mode=search&query=SK&page=6
韓 배터리 3사 점유율 합계 사상 처음으로 30% 돌파,"(서울=뉴스1) 김동규 기자 = 한국 배터리 3사인 LG화학, 삼성SDI, SK이노베이션의 전기차용 배터리 글로벌 사용량 1월 합계가 사상 최초로 30%를 돌파했다. LG화학은 중국 배터리 업체 CATL을 제치고 1월 사용량 세계 2위에 올랐다. 2일 시장조사업체 SNE리서치에 따르면 올해 1월 판매된 글로벌 전기차(EV, PHEV, HEV)탑재 배터리 사용량 점유율 순위에서 한국 업체들이 약진했다. LG화학, 삼성SDI, SK이노베이션이 각각 2위, 4위, 7위에 올랐다. 이들 3사의 점유율 합계는 30.7%로 전년 동월 14.2% 대비 2배 이상 급증했다. 파나소닉이 27.6%의 점유율로 1위에 올랐고, LG화학이 22.9%로 2위에 올랐다. CATL은 21.8%로 3위에 올랐다. 삼성SDI와 SK이노베이션은 각각 5.1%, 2.8%의 점유율을 기록했다. 한국 배터리 3사의 약진은 각 사의 배터리를 탑재하고 있는 전기차 모델들의 판매 증가에 따른 것이다. LG화학은 르노 조에, 아우디 E-트론 EV 등의 판매 급증으로 사용량이 급격히 늘었다. 삼성SDI는 BMW 330e, 폭스바겐 파사트 GTE 등의 판매 호조가 성장세를 견인했다. SK이노베이션은 니로 EV와 소울 부스터 등의 판매 호조에 따라 성장했다. 올해 1월 세계 각국에 등록된 전기차 배터리 에너지 총량은 7.3GWh(기가와트시)로 전년 동월 대비 6.2% 감소했다. 세계 전기차 주요 시장 중 한곳인 중국에서의 침체가 원인으로 꼽힌다. 이런 이유에서 중국의 CATL, BYD등의 올해 1월 배터리 사용량 순위가 전년보다 떨어졌다. SNE리서치 관계자는 “작년에 이어 올해 들어서도 한국 배터리 업체들의 약진이 이어지고 있는 것으로 보인다”며 “다만 추후 중국 시장이 회복되면서 CATL을 비롯한 중국계 업체들의 반격이 시작될 것으로 보여 한국 업체들의 경쟁력 강화와 전략 가다듬기가 필요하다”고 설명했다.dkim@news1.kr© 뉴스1코리아(), 무단 전재 및 재배포 금지",/news/news_read.nhn?article_id=0004495407&office_id=421&mode=search&query=SK&page=6
"작년 수도권 민영아파트 177곳 전수조사1만명 이상 청약한 27곳, 전체의 70%","[아시아경제 최동현 기자] 수도권 주택 청약시장의 쏠림현상이 심화하고 있다. 청약자들이 일부 돈이 되는 단지에만 몰리면서 세 자릿수 경쟁률이 속출하는 분위기다. 특히 지난해의 경우 수도권 민영아파트 177개 단지 중 청약자 1만명 이상 몰린 단지는 27곳이었으며, 여기에 전체 청약자의 70%가 집중된 것으로 분석됐다.2일 아시아경제가 지난해 서울ㆍ인천ㆍ경기 등 수도권에서 공급(청약접수일 기준)된 177개 단지의 청약 결과를 전수 조사한 결과 청약접수가 1만건을 넘긴 단지는 ▲서울 12곳 ▲경기 10곳 ▲인천 5곳 등 총 27곳이었던 것으로 집계됐다. 서울의 경우 12곳 중 7곳이 강남권이었으며 경기도에서는 위례신도시 3곳이 포함됐다. 인천에서는 5곳 중 4곳이 송도국제도시 내 아파트였다. 특히 수도권 전체 청약자 98만4453명 가운데 이들 27개 단지에 신청한 사람은 67만6597명에 달했다. 청약자 수 기준 상위 15%의 아파트에 전체 청약자의 68%가 집중된 셈이다.쏠림현상은 경기도가 가장 심했다. 특히 위례를 비롯해 최근 수도권 집값 '풍선효과'로 조정대상지역에 지정된 수원ㆍ안양 등에서 특정 단지에 수만 명의 청약자가 집중됐다. 지난해 경기도에서 83개 단지가 분양했으나 이 중 신청자가 1만명이 넘은 단지는 10곳에 불과했다. 이들 10개 단지의 공급물량은 전체 3만8356가구의 17.3%인 6651가구였지만 전체 청약자 43만575명의 75%에 달하는 32만2930명이 몰렸다. 특히 청약자 수가 공급에 못미친 단지도 24곳(28.9%)에 달했다. 경기 지역에서 청약자가 집중된 곳은 위례신도시였다. 지난해 위례에서 공급된 4개 단지에 전체 경기도 아파트 청약자의 56%인 24만3928명이 신청했다. 힐스테이트 푸르지오 수원의 경우 수도권 전체를 통틀어 단일 단지로는 가장 많은 7만4519명의 청약통장이 쏟아지기도 했다.서울 역시 전체 56곳 중 21%인 12개 단지에 전체 청약자의 62%(20만9760명)가 신청했다. 전방위적인 집값 상승세에 비강남권 아파트에도 청약자가 몰리면서 그나마 특정단지 집중도가 낮았다.
인천은 인기-비인기 단지가 가장 극명하게 갈렸다. 전체 2만4716가구의 10.2%인 2535가구에 21만6241명의 66.5%인 14만3907명이 몰렸다. 반면 전체 분양 단지의 37%인 14곳에서는 청약자가 공급가구 수에 미치지 못하며 대거 미달사태를 빚었다.올해 역시 청약 쏠림현상은 올 들어 더욱 심화하는 분위기다. 지난달 28일 일반 1순위 청약을 받은 위례신도시 '중흥S클래스'는 466가구 공급에 4만4448명이 신청해 평균 104.3대 1의 경쟁률을 기록했다. 올 들어 경기도에서 세 자릿수 경쟁률을 기록한 것은 지난달 분양한 수원 매교역 푸르지오SK뷰(145.7대 1) 이후 두 번째다. 지난해 경기도에서 1순위 경쟁률이 세 자릿수를 기록한 것은 위례포레자이(130.3대 1) 한 곳뿐이었다.권대중 명지대 부동산대학원 교수는 ""올해도 정부의 핀셋 규제 기조와 분양가상한제 등의 여파로 쏠림현상은 더욱 심화될 것""이라며 ""반면 정부의 재건축 규제 강화와 스마트홈 등 기술 발달로 구축 단지의 미래가치는 더욱 떨어져 양극화 현상이 더 크게 나타날 것""이라고 전망했다. 관련기사☞<'무주택=서민' 프레임이 역차별 양산…'청무피사' 신조어까지>최동현 기자 nell@asiae.co.kr <ⓒ경제를 보는 눈, 세계를 보는 창 아시아경제 무단전재 배포금지>",/news/news_read.nhn?article_id=0004634572&office_id=277&mode=search&query=SK&page=6
