head,text,url
"CXO연구소, 국내 100大 그룹 재벌가 부인 90명 주식평가액 조사 삼성 홍라희 前 리움 관장 2조 6860억원 1위…종근당 정재정 · 동서 문혜영 여사 TOP 3 올라 노소영 아트센터 나비 관장 주식재산 22억 원 수준…90명 중 40명은 상장사 주식 미보유로 파악","[서울=뉴시스] 김종민 기자 = SK 최태원 회장과 노소영 아트센터 나비 관장 간 이혼 소송이 본격적으로 시작됐다. 이를 계기로 재벌가 부인들의 주식재산이 어느 정도 되는지도 세간의 관심사로 떠올랐다. 국내 주요 재벌가 부인 90명 중 10명은 주식재산이 100억 원 이상 되는 것으로 나타났다. 반면 40명은 상장사 주식을 단 1주도 보유하지 않은 것으로 파악됐다. 재벌가 안주인라고 해도 주식재산에 대해서만큼은 큰 차이를 보였다. 이 같은 결과는 기업분석 전문 한국CXO연구소(소장 오일선)가 ‘국내 주요 100대 그룹 재벌가 부인 주식재산 현황 조사’ 결과에서 도출됐다고 9일 밝혔다. 조사 대상은 공정거래위원회가 관리하는 59개 대기업집단을 포함해 총 100개 그룹을 대상으로 조사가 이뤄졌다. 조사 대상자는 오너가 부인 성함 파악이 가능한 90명이다. 오너 부인 성함은 공정위 공시 자료와 언론 기사 및 각종 인물 검색 등을 통해 파악했다. 주식 재산은 금융감독원에 보고된 주식 중 보통주 기준(우선주 제외)으로 조사가 이뤄졌고, 7일 종가를 곱해 주식평가액을 산정했다. 비상장사 주식가치는 이번 조사에서 제외했다. 또 여성 자신이 그룹 총수 내지 경영자로 활동하거나, 배우자가 고인(故人)이 된 경우 등은 조사에는 포함시켰으나 주식평가액 순위에는 제외했다.조사 결과 국내 주요 재벌가 안방마님 90명 중 주식부자 1위는 이건희 삼성전자 회장의 부인 홍라희 전(前) 리움미술관 관장인 것으로 나타났다. 홍 전 관장은 삼성전자 보통주 주식 5415만 3600주(0.91%)를 보유해 이달 7일 기준 주식재산 가치만 2조 6860억 원에 달했다.종근당그룹 이장한 회장의 부인 정재정 여사는 409억 원으로 넘버2를 차지했다. 정 여사는 종근당홀딩스 주식을 29만 1575주 보유하고 있는데, 7일 종가 10만 8000원으로 곱한 주식평가액만 해도 310억 원을 훌쩍 넘겼다. 94억 원 상당의 경보제약 주식도 함께 보유하고 있는 것으로 파악됐다. 커피 재벌로 유명한 동서그룹 김석수 회장의 부인 문혜영 여사는 336억 원으로 오너가 안방마님 주식부자 클럽 TOP 3에 이름을 올렸다. 문 여사는 (주)동서 주식을 200만 5935주(2.01%)를 갖고 있다. 농심그룹 신춘호 회장의 부인 김낙양, 한미약품그룹 임성기 회장의 부인 송영숙 여사는 200억 원대 주식평가액을 보유하며 다섯 손가락 안에 이름을 올렸다. 김낙양 여사는 율촌화학(145억 원), 농심홀딩스(98억 원), 농심(7억9000만 원) 세 곳의 주식종목에서 251억 원 상당의 주식평가액을 보였다. 송영숙 여사는 한미사이언스에서 231억 원 상당의 주식재산을 갖고 있는 것으로 확인됐다. 이어 6위 이병무 아세아그룹
회장 부인 이정자 여사 187억 원, 7위 김승연 한화그룹 회장 부인 서영민 여사 183억 원, 8위 김홍국 하림그룹 회장 부인 오수정 맥시칸 대표이사 170억 원, 9위 조석래 효성그룹 명예회장 부인 송광자 여사 156억 원, 10위 김상범 이수그룹 회장 부인 김선정 광주비엔날레 대표이사가 120억 원으로 100억 원대 주식재산을 보유하고 있는 것으로 조사됐다. 앞서 100억 원 이상 주식재산을 보유한 그룹 오너 부인 중 5% 이상 지분을 보유한 경우도 있었다. 2019년 사업보고서 기준 종근당홀딩스(5.82%)와 경보제약(5.42%) 주식을 보유한 정 여사와 이수페타시스(6.54%) 지분을 보유한 김 대표이사가 그 주인공이다. 여성이 그룹 총수내지 경영자이면서 100억 원 넘는 주식재산을 가진 이도 많다. 이명희 신세계 회장이 대표적이다. 이 회장은 7일 기준 이마트(5740억 원)와 신세계(4099억 원)에서 보유한 주식가치를 더하면 9840억 원 상당의 주식재산을 보유하고 있는 것으로 나타났다. 이화경 오리온 부회장은 오리온홀딩스(2677억 원)와 오리온(1928억 원) 주식을 더해 4605억 원의 주식평가액을 보였다. 현정은 현대 회장(1214억 원)과 장영신 애경 회장(202억 원)도 100억 원 넘는 것으로 조사됐다. 그룹 총수가 사별하면서 주식재산이 늘어난 사례도 있다. 고(故) 구본무 LG그룹 회장의 부인 김영식 여사가 대표적이다. 김 여사의 주식가치는 7일 기준 4475억 원으로 평가됐다. 김 여사는 LG 주식을 725만 3100주(4.2%) 보유 중이다. 고(故) 조양호 한진그룹 회장의 부인 이명희 정석기업 고문의 주식가치도 2705억 원으로 나타났다. 이 고문은 한진그룹의 지배격 회사인 한진칼 주식 지분을 5.31% 보유하고 있다. 이번 조사 대상 100대 그룹 재벌가 부인 중 주식재산이 10억 원 이상은 모두 33명으로 조사됐다. 이중에는 아직 법적 부부를 유지하고 있는 최태원 SK 회장의 부인 노소영 아트센터 나비 관장도 7일 기준 22억 원의 주식재산을 보유하고 있었다. 90명 중 40명의 재벌가 안방마님은 상장사 주식을 단 한 주도 갖고 있지 않은 것으로 조사됐다. 아직까지 상당수의 국내 그룹 총수 등은 회사 경영에 중요한 의미를 가지는 ‘주식 지분’에 대해서만큼은 부부 사이라도 매우 엄격하게 구분하고 있다는 것을 보여주는 방증으로 풀이된다.
 이번 조사와 관련해 오일선 소장은 “그룹 총수 배우자는 상황에 따라서는 그룹 전면에 나서거나 지분 등으로 경영에 깊이 관여해야 할 여지가 높은 특수관계자”라며 “특히 그룹 승계와 관련해 판도를 바꿀 수 있기 때문에 시장에서 그룹 총수 부인의 지분 동향에 관심이 높다”고 말했다. jmkim@newsis.com<ⓒ 공감언론 뉴시스통신사. 무단전재-재배포 금지>",/news/news_read.nhn?article_id=0009807373&office_id=003&mode=search&query=SK&page=7
"◇ 연기금 등, 코스피서 지난달부터 3.3조 순매수","[이데일리 최정희 기자] 연기금이 지난달 증시 급락장에서 3조원 가량을 순매수하면서 본격적인 매수세로 전환됐다. 개인투자자들이 11조1900억원 매수세를 보인 것에 비해선 미약하지만 장기투자자란 관점에서 연기금 매수세를 주목할 필요가 있다.
연기금은 ,
등 신종 코로나 바이러스 감염증(코로나19)에도 실적이 나오는 종목을 중심으로 매수세를 보인 반면 적자 가능성이 높은 , ,
등은 팔았다. 특히 경영권 분쟁이 붙은 에 대해선 연초 이후 보유 지분 전량을 매도했을 가능성이 제기된다.
9일 마켓포인트에 따르면 연기금 및 우정사업본부 등은 1~2월만 해도 코스피 시장에서 3000억원도 채 안 되는 순매수를 보였으나 3월에만 3조280억원 가량을 사들이며 ‘매수’에 본격적으로 가담하기 시작했다. 이달 들어서(1~9일)도 2700억원 가량의 순매수를 보이고 있다. 연기금이 주로 사들이는 종목을 살펴보면 코로나19 확산에도 실적을 내고 있는 종목들로 모아진다. 지난 달 이후 이달 9일까지 연기금은 삼성전자를 1조488억원 가량 순매수해 가장 많이 담았다. 도 5001억원의 매수세를 보여 삼성전자에 이어 두 번째로 많은 매수를 기록했다. 삼성전자는 1분기 잠정 영업이익이 6조4000억원을 기록, 코로나19 속에서도 반도체 업황이 견고함을 보여줬다. 이에 에 대한 실적 기대감도 올라간 상태다. ,
등 코로나19에 영향을 덜 받는 인터넷, 게임 업종도 대거 매수했다. NAVER는 1355억원을, 엔씨소프트는 935억원의 순매수를 기록했다. 김동희 메리츠증권 연구원은 “계절적 비수기인데다 코로나19로 대형광고주의 마케팅 집행이 축소됐음에도 네이버, 카카오는 쇼핑(커머스), 웹툰, 페이, 모빌리티 등 다양한 사업 포트폴리오로 안정적인 방어가 가능하다”며 “엔씨소프트의 경우도 2~3월 게임 이용시간과 데이터 사용량이 작년 말보다 25~40%가량 증가해 ‘리니지2M’과 같은 이용자 충성도 높은 컨텐츠가 수혜를 누렸다”고 밝혔다. 코로나19로 치료제에 대한 관심이 높아지면서 바이오주가 급등세를 보였는데 연기금은 바이오주 중에서도 대형주에 집중했다. 와 을 각각 1032억원, 1054억원 순매수했다. 특히 셀트리온은 코로나19 항체 후보군 300종을 확보했다며 7월 말까진 제품을 개발해 임상에 들어가겠다고 밝힌 상태다. 이에 셀트리온은 지난달에만 34.7% 올랐다. 삼성바이오는 바이오 업황이 개선된 데다 CMO(위탁생산) 가동률이 높아지면서 영업이익이 작년보다 두 배 증가할 것이란 전망이 나온다. 이밖에 , 도 각각 1287억원, 1060억원 가량 순매수했다. LG생활건강은 중국 판매 위축이 불가피하지만 화장품 부문 내에서 후, 숨, 오휘 등 럭셔리 브랜드 매출 비중이 71%에 달해 하반기 수요 회복시 수혜를 볼 것으로 예측되고 있다. 코로나19로 인해 인당 데이터 트래픽 증가와 마케팅 비용 축소에 통신주도 코로나 악재를 빗겨갔단 평가가 제기된다. 연기금은 2년 연속 적자가 예상되거나 코로나 악재를 정통으로 맞은 종목들은 대거 매도했다. 특히 한진칼은 지난 달 이후 467억원을 내다팔았다. 연초 이후로 보면 173만4300주 내다팔았다. 지분율로 보면 2.93% 수준이다. 시장이 예측하는 작년 말 국민연금 보유지분과 유사하다. 한진칼은 2년 연속 적자를 낸 데다 자회사
이익 악화 우려가 커졌다. 이에 비해 경영권 분쟁으로 주가가 높아진 상황이라 차익실현 욕구가 커졌을 것으로 분석된다. 한진칼 주가는 올 들어서만 111% 급등했다. 연기금은 대한항공에 대해서도 245억원 가량 매도했다. 이밖에 , , 에 대해서도 340억~370억원 가량 매도했다. LG디스플레이와 삼성중공업은 올해 적자가 예상되고 SK이노베이션은 국제유가가 연초 대비 반토막 이상 난 상황이라 정제마진이 감소하면서 영업이익이 반토막 날 것으로 예측되고 있다. 사실상 구조조정에 돌입한 에 대해서도 218억원 매도세가 나왔다. 최정희 (jhid0201@edaily.co.kr)＜ⓒ종합 경제정보 미디어 이데일리 - 무단전재 & 재배포 금지＞",/news/news_read.nhn?article_id=0004617097&office_id=018&mode=search&query=SK&page=7
,"‘동학개미운동’으로 일컫어지는 개인투자자들의 유례없는 주식투자 열풍을 감당하지 못하고 증권사 주식거래시스템이 먹통이 되는 사고가 속출하고 있다. 자칫 투자자들의 소송으로까지 이어질 수 있어 증권업계가 근본적인 해결책을 고민해야 한다는 목소리가 높다.9일 금융투자업계에 따르면 개인투자자 주식시장 점유율 1위인 키움증권은 지난달에만 최소 세 차례 이상 모바일트레이딩시스템(MTS)에 전산장애가 났다. 접속이 지연되거나 계좌 잔고와 거래내역이 제대로 조회되지 않는 일이 벌어진 것이다. 한국투자증권과 NH투자증권, 신한금융투자 등 대형증권사는 물론이고 SK증권과 유안타증권 등에서도 크고 작은 전산장애 사고가 일어났다.신종 코로나바이러스 감염증(코로나19) 여파로 주가가 급락하자 저가매수를 기대한 개인투자자들이 대거 증시로 몰리면서 서버에 과부하가 걸린 것으로 보인다. 지난달 일평균 주식거래량은 21억6,675만주(코스콤 집계)로 1월(일평균 16억6,249만주)보다 30% 가량 늘었다. 지난해 평균(12억9,540만주)과 비교하면 70% 가까이 폭증한 수준이다.문제는 전산장애로 인해 투자자들이 큰 손실을 볼 수도 있다는 점이다. 주가 변동성이 큰 시장에선 단 몇 초 차이로도 손익의 폭이 확대될 수 있다. 전산장애 사고가 금융거래 신뢰성을 떨어트리는 고질병으로 지목되는 이유다. 미국시장에서는 소송 움직임까지 나타나고 있다. 다우지수가 5% 이상 급등했던 지난달 2일 1,000만명 이상 이용자를 보유한 MTS ‘로빈후드’가 갑자기 멈추면서 매매 타이밍을 놓친 투자자들이 집단소송을 고심 중인 것으로 전해졌다. 로빈후드 측은 “예상치 못했던 주문의 폭증 때문”이라고 밝혔다. 투자자들의 원성이 커지자 금융당국도 조사에 나섰다. 금융감독원 관계자는 “거래량 급증을 이유로 댄 증권사의 경우, 정말 사고를 예측하기 힘든 상황이었는지 살펴보고 있다”며 “투자자 피해가 심각하다고 판단되면 향후 종합검사 등을 통해 조치가 이뤄질 것”이라고 말했다.전문가들은 전산장애 사고를 막는 해법은 간단하다고 입을 모은다. 증권사가 서버 용량을 늘리면 되기 때문이다. 하지만 대용량 서버를 유지하기 위해선 적지 않은 비용이 발생하는 문제가 있다. 증권사들 입장에선 현재와 같은 거래량이 유지될 지 확신할 수 없어 서버를 섣불리 늘리기가 쉽지 않은 셈이다. 김준석 자본시장연구원 자본시장실장은 “미국과 달리 고빈도 매매 비중이 적은 국내 주식시장에서 증권사가 최근과 같은 거래량 폭증을 사전에 대비하기란 쉽지 않다”고 말했다.장재진 기자 blanc@hankookilbo.com",/news/news_read.nhn?article_id=0000486134&office_id=469&mode=search&query=SK&page=7
이달 ‘힐스테이트 대구역 오페라’ 1207가구 분양,"현대건설은 이달 ‘힐스테이트 대구역 오페라’(투시도)를 분양한다. 대구 북구 고성동1가 114-33 일원에 지어지는 힐스테이트 대구역 오페라는 지하 4층~지상 48층, 8개동, 아파트 전용면적 59~101㎡ 937가구, 오피스텔 전용면적 63~67㎡ 270실 등 총 1207가구로 구성된다. 전용면적은 아파트의 경우 △59㎡ 178가구 △84㎡A 268가구 △84㎡B 311가구 △101㎡ 180가구 등 소형부터 중대형까지 다양한 평형으로 이뤄져 있다. 오피스텔은 △63㎡OA 180실 △67㎡OB 90실 등 주거형 오피스텔로 이뤄진다. 대구도시철도 3호선 달성공원역, 북구청역이 가깝고, 인근 대구역엔 대구권 광역철도가 2023년 개통을 목표로 착공 중이다. 반경 1㎞ 내 대형마트 3곳과 초·중·고교가 모두 위치했다. 힐스테이트 대구역 오페라의 견본주택은 대구 동구 신천동 328-2번지에 있다. 4월 중 사이버 견본주택을 운영할 예정이다.


 금호산업은 다음달 전북 군산 나운주공2단지를 재건축하는 ‘나운 금호어울림 센트럴’(조감도)을 분양한다. 군산의 강남으로 불리는 나운동에서 새 아파트가 공급되는 것은 14년 만이다. 나운동 831번지 일원에 지어지는 ‘나운 금호어울림 센트럴’은 지하 2층, 지상 최고 26층, 10개 동, 전용면적 59~84㎡, 총 993가구 규모로 조성된다. 이 중 392가구가 일반 분양될 예정이다. 전용면적은 △59㎡A 178가구 △59㎡B 82가구 △73㎡ 86가구 △84㎡A 36가구 △84㎡B 4가구 △84㎡C 6가구 등이다. 단지 바로 옆에 차병원과 동산시장 등이 있고, 10여개 초·중·고가 반경 1.5㎞ 이내에 밀집해 있다. 단지 내 중앙광장, 산책로, 운동시설 등 공원형 아파트로 꾸며진다. 월명산공원과 월명호수를 도보로 이용할 수 있다. 견본주택은 군산시 수송동 810-5번지(롯데마트 군산점 인근)에 마련된다. 입주는 2022년 8월 예정이다.


 SK건설은 세대 환기장치에 제균 기능을 더한 제균 환기시스템(사진)을 국내 최초로 개발했다. SK건설은 공기질 개선을 위해 지난해부터 ‘클린에어 솔루션’을 개발해 SK뷰 단지에 적용하고 있으며, 최근 자외선 발광다이오드(UV LED) 모듈을 적용한 ‘클린에어 솔루션 2.0 제균 환기시스템’을 개발해 특허 출원을 마쳤다. SK건설에 따르면 클린에어 솔루션 2.0 제균 환기시스템에는 공기 중의 초미세먼지를 99.95% 제거할 수 있는 헤파필터와 제균을 위한 UV LED 모듈이 탑재됐다. 여기에 최신 UV LED 기술이 적용돼 기존 UV 램프타입보다 전력소모가 적고, 환경 유해 물질인 수은을 포함하고 있지 않아 친환경적이라는 게 SK건설의 설명이다. 황색포도상구균, 대장균, 곰팡이를 99.99% 제균하고, 휘발성유기화합물(VOCs) 제거 및 탈취 기능도 갖췄다는 공인시험기관의 인증을 받았다. 이 시스템은 분양 예정인 SK뷰 단지와 지식산업센터 SK V1에 선별적으로 적용할 예정이다.


한화건설이 경남 거제시 장평동 337번지 일원을 재건축하는 ‘포레나 거제 장평’(조감도)의 2차분 일반분양을 진행한다. 이번 분양은 기존 조합원들이 소유했던 97가구를 일반분양으로 전환한 것으로 로열층이 다수 포함된 것이 특징이다. 포레나 거제 장평은 지하 3층~지상 25층, 9개 동, 총 817가구 규모이며 지난 1차 일반 분양에서 262가구가 일반분양된 바 있다. 최근 분양가를 3.3㎡당 860만~960만원대로 크게 낮추고 중도금 30% 무이자 혜택도 제공하는 등 다양한 혜택을 통해 대부분 계약이 완료된 상태다. 이번에 공급되는 97가구 역시 할인된 분양가가 적용되며, 중도금 30% 무이자 혜택도 그대로 적용된다. 타입 별 가구수는 △59㎡A 17가구 △59㎡B 3가구 △75㎡ 12가구 △84㎡A 51가구 △84㎡B 13가구 △99㎡ 1가구로 구성된다. 4월 13일 특별공급을 시작으로 14일 1순위, 16일 2순위 청약 접수를 받으며, 당첨자 발표는 4월 22일 이뤄질 예정이다. 견본주택은 거제시 상동동 202-1에 위치하고 있으며, 입주는 2021년 2월 예정이다.ⓒ 세상을 보는 눈,",/news/news_read.nhn?article_id=0003455197&office_id=022&mode=search&query=SK&page=7
시범 서비스로 얻은 현장 데이터 통해 빠른 시일 내 상용화할 것,"SK텔레콤은 코로나19에따른 온라인개학을 맞아 김포 신풍초등학교 3개 학급약 80명의어린이들을 대상으로 ‘서로’ 가상교실 시범 서비스를 시작한다고 9일 밝혔다. 신풍초등학교 교사와 학생들이 ‘서로’ 가상교실을 시연 하고 있다. SK텔레콤 제공

SK텔레콤(대표이사 사장 박정호)은 코로나19에 따른 온라인개학을 맞아 ‘서로’ 가상교실 시범 서비스를 시작한다고 9일 밝혔다.
 이번 시범 서비스는 경기도 김포시 소재 신풍초등학교 6학년 2학급, 5학년 1학급 등 총 3개 학급 약 80명의 어린이들을 대상으로 ’20년 1학기 종료 시까지 운영될 예정이다.

‘서로’ 가상교실 시범 서비스는 SK텔레콤의 ▲그룹 영상통화 ‘서로’ 서비스 ▲원격 수업용 단말기 ▲키즈 안심 앱 ‘ZEM’ 등으로 구성돼 학생들이 원격으로 쉽게 수업을 받을 수 있도록 했다.


신풍초등학교 교사와 학생들이 ‘서로’ 가상교실을 시연 하고 있다.

이번 시범 서비스에 활용되는 그룹 영상통화 ‘서로’는 SK텔레콤의 영상통화 기능 `콜라(callar)`와 다자간 통화 앱 ‘T그룹통화’의 경험을 바탕으로 만들어진 서비스다. ‘서로’는 최대 QHD 화질까지 선택 가능하며, 영상/음성 송수신 딜레이 절감 기술과 자체 렌더링을 통해 다수의 인원이 동시 접속해도 딜레이 없이 안정적인 영상 통화 품질을 제공한다.
 SK텔레콤 이현아 AI서비스단장은 “코로나19 장기화에 따라, 학생들의 학습공백 최소화를 위한 지원이 필요하다고 판단해 이번 시범 서비스를 준비했다”며, “시범 서비스를 바탕으로 빠른 시일 내에 누구나 쉽고 편리하게 이용할 수 있는 ‘서로’ 가상교실 서비스를 상용화하겠다”고 밝혔다
 지차수 선임기자 chasoo@segye.comⓒ 세상을 보는 눈,",/news/news_read.nhn?article_id=0003455212&office_id=022&mode=search&query=SK&page=7
김준 SK이노 사장 화상면접장 찾아,"김준 SK이노베이션 총괄 사장(사진)이 8일 신입사원 채용 화상면접장을 찾아 인력 채용 현장을 점검하고 ‘비상한 방식을 통한 위기 극복’을 주문했다.
김 사장은 이날 “코로나19 여파로 전통적인 대면 채용 절차는 중단됐지만 디지털 기술을 활용한 비대면 접촉 방식 채용이라는 획기적인 방법으로 전환해 채용을 진행할 수 있게 됐다”면서 “이처럼 비상한 시기에는 비상한 방식만으로 위기를 극복할 수 있을 것”이라며 혁신을 통한 위기 극복 방안을 주문했다. SK이노베이션은 코로나19 감염을 막기 위해 비대면 접촉 방식인 화상으로 신입사원 수시 채용 전형을 진행하고 있다. 김 사장은 또 “훌륭한 인력을 채용하는 것은 중요한 경영활동으로 중단돼서는 안 된다”며 “코로나19로 채용 일정이 지연돼 취업준비생들이 어려움을 겪어 안타깝다. SK이노베이션은 앞으로도 취업준비생들의 꿈과 행복을 응원하겠다”고 격려했다.서동일 기자 dong@donga.com ⓒ 동아일보 & donga.com, 무단 전재 및 재배포 금지",/news/news_read.nhn?article_id=0003280283&office_id=020&mode=search&query=SK&page=7
,"SK텔레콤은 비대면 생활에 유용한 ‘올프라임(AllPRIME)’ 멤버십을 오는 13일부터 신규 가입 고객 선착순 1만 명에게 1개월간 무료 제공한다고 밝혔다. ‘올프라임’으로 11번가 쇼핑을 하고 있는 모델. SK텔레콤 제공

SK텔레콤(대표이사 사장 박정호)은 비대면 생활에 유용한 ‘올프라임(AllPRIME)’ 멤버십을 오는 13일부터 신규 가입 고객 선착순 1만 명에게 1개월간 무료 제공한다고 밝혔다.
 ‘올프라임’은 월 9900원에 10가지 이상의 콘텐츠, 쇼핑, 생활 혜택을 제공하는 구독형 서비스이다. ▲웨이브, 플로, 원스토어 e북(택1) ▲11번가 쇼핑시 SK페이포인트 최대 6% 적립 ▲100여가지 상품을 최저가로 제공하는 전용 특가몰 ▲음식배달 할인 등이 대표적인 혜택이다.


SK텔레콤은 비대면 생활에 유용한 ‘올프라임(AllPRIME)’ 멤버십을 오는 13일부터 신규 가입 고객 선착순 1만 명에게 1개월간 무료 제공한다고 밝혔다. ‘올프라임’으로 11번가 쇼핑을 하고 있는 모델.

이번 프로모션은 사회적 거리 유지 및 재택 근무 등으로 댁내 생활이 늘어난 고객들을 응원하기 위해 기획됐다.
 김진우 SK텔레콤 통합서비스추진그룹장은 “앞으로도 올프라임에 신규 제휴사가 지속 추가될 예정”이라며, “올프라임을 고객에게 다양한 혜택을 제공하는 종합 멤버십 플랫폼으로 성장시킬 것”이라고 밝혔다.
 지차수 선임기자 chasoo@segye.comⓒ 세상을 보는 눈,",/news/news_read.nhn?article_id=0003455222&office_id=022&mode=search&query=SK&page=7
