head,text,url
"코스피 2002.51,  0.78%↑, 코스닥  2.77%↑외국인 6거래일 연속 순매도 행진, 4.2조 팔아치워각국 경기 부양책 기대감 커지며 원달러 환율 20원↓","[CBS노컷뉴스 임진수 기자]코로나19 확산에 따른 공포심리 유입으로 3거래일 연속 큰 폭으로 하락한 코스피가 2일 반등에 성공했다. 다만, 외국인의 대규모 매도세는 6거래일 연속 이어지고 있다.이날 코스피 지수는 전 거래일 보다 15.50포인트, 0.78% 오른 2002.51에 장을 마감하며 가까스로 2000선을 회복했다. 앞서 전 거래일인 지난달 28일 코스피는 3%대 폭락을 기록하며 1987.01에 장을 마쳐 반년 만에 2000선을 내준 바 있다.코스닥 지수는 전 거래일보다 16.93포인트, 2.77%나 상승한 627.66에 장을 마쳤다. 코스닥 지수도 같은날 4.30%나 폭락했다.시가총액 상위종목 가운데서는 삼성전자(1.48%), SK하이닉스(4.78%), LG화학(2.45%), 삼성SDI(3.22%) 등이 1~4%대 상승률을 보였다.이날 코스피 시장에서는 개인과 기관이 각각 4617억원과 2699억원을 순매수하며 지수 상승을 이끌었다. 외국인은 이날도 7832억원을 순매도하며 지수 추가 상승을 가로막았다.외국인은 코스피 시장에서 지난달 24일 7970억원을 순매도한 것을 시작으로 지난 6거래일 동안 모두 4조 2400억원을 순매도했다.따라서, 외국인의 대규모 매도세가 꺾이지 않는한 국내 증시는 당분간 상승 동력을 찾지 못하고 박스권에서 등락을 거듭할 수밖에 없을 것으로 보인다.한편, 이날 서울외환시장에서 원달러 환율은 전 거래일 종가보다 20.0원 내린 달러당 1193.7원에 거래를 마쳤다. 이는 지난 2017년 1월 5일 이후 3년 2개월 만에 하루 최대 하락폭이다.미국과 중국 등 전 세계 각국이 코로나19 확산에 따른 경기 하방 압력을 상쇄하기 위해 금리인하를 비롯한 각종 부양책을 쏟아낼 것이라는 기대감에 따른 것으로 분석된다.jslim@cbs.co.kr저작권자 © CBS 노컷뉴스 무단전재 및 재배포 금지",/news/news_read.nhn?article_id=0003330436&office_id=079&mode=search&query=SK&page=3
"삼성·LG·현대차·SK하이닉스 등 방역과 감염 확산 차단에 주력""제조업 특성상 대체사업장이나 근무시간 단축 힘들어""","(서울=뉴스1) 권구용 기자 = 신종 코로나바이러스 감염증(코로나19) 국내 확진자 수가 2일 0시 기준 4212명을 기록한 가운데 산업계에서도 확진자가 나오며 비상상황에 놓였다. 기업들은 비상 대응 체계를 가동하고는 있지만 생산라인을 중점으로 하는 제조업 특성상 감염을 예방하고 확진자가 발생했을 시 빠르게 대응해 확산을 막는 것 이외에 대책을 시행하기 쉽지는 않은 상황이다.2일 업계에 따르면 삼성전자는 구미2사업장에 근무하는 무선사업부 직원이 코로나19 확진판정을 받아 해당 사업장을 폐쇄하고 방역을 실시하고 있다. 이로써 삼성전자 구미사업장에서 지난달 22일부터 총 4명의 확진자가 발생했다. 전날에는 LG이노텍이 카메라모듈을 생산하는 구미1A공장에서 확진자 1명이 발생해 생산라인 가동을 중단하고 근무 중이던 직원 전원을 재택 대기하도록 조치했다. LG디스플레이 구미 사업장에서도 지난 29일 복지동 내에 입주한 은행 직원이 확진자로 판명됐다. 현재 구미국가산업단지에는 삼성전자와 삼성SDI, LG전자와 LG디스플레이 등 2600여 개사가 입주해 있다.또한 LG그룹의 경우 ㈜LG, LG전자, LG화학, LG디스플레이, LG경제연구원 등 주요 계열사가 입주한 서울 여의도 LG트윈타워 인근 파크원 공사 현장에 확진자가 나오면서 28일부터 트윈타워와 IFC 근무인원의 10%만 출근하고 나머지 인력은 재택근무하도록 했다. 현재 재택근무 인원은 업무에 지장이 없는 수준으로 조정됐지만, 예방책이 강화된 상태다. 이처럼 코로나19의 확산세가 산업계로 번지는 모양새지만 생산라인을 옮기거나 대체 사업장을 구하기 힘든 제조업의 특성상, 방역을 철저히 하고 감염의 확산을 막는 것 외에 뾰족한 대응책은 나오지 않고 있다.삼성전자의 경우 구미사업장 내 방역체계를 강화하고 있으며, 기숙사와 통근버스 등 임직원들의 접촉이 많은 다중시설에 대해 방역 조치를 강화하고 있다. 또한 직원들에게 건강상 이상 징후가 느껴지면 바로 보고를 하도록 주의를 당부하고 있다. LG이노텍 또한 출입자 전원 대상 체온측정·마스크 착용·손소독제 제공을 하고 사업장 내 일일 방역은 물론 확진자와 동선이 겹치는 임직원의 경우 자가 격리 조치하고 있다. 직원 중에 밀접접촉자가 나왔던 SK하이닉스의 경우도 해당 직원과 동선이 겹치는 인원을 선별해 자가격리하고 방역을 했다. 한 전자업계 관계자는 ""제조업 특성상 인력이 많고 공장이 있기 때문에 사실상 근무시간 단축이나 대체 사무실 이용은 힘들다""면서 ""철저하게 방역에 집중하면서 약간의 증상이라도 있으면 선제조치하고 모니터링을 비롯한 감지조치 등을 많이 해 안전과 건강 지키는 것이 최선""이라고 설명했다.
비상 대응을 하는 것은 전자업계뿐만이 아니다. 울산2공장 도장부 조합원이 양성 판정을 받은 현대자동차는 임산부와 기저질환자 같은 건강상 취약 직원들은 재택근무를 하는 한편, 서울 양재동 본사 및 서울·경기지역 근무자, 연구개발본부와 국내사업본부도 오는 6일까지 자율적 재택근무를 시행하면서 상황을 지켜보며 확대연장 시행 여부를 결정할 방침이다. 대우조선해양은 지난달 24일 전사 코로나19 대응위원회를 열고 상황을 '심각'으로 상향 조정했다. 이에 따라 출퇴근과 근무 시 마스크 착용 의무화, 개인위생 철저, 발열과 증상 의심시 선별 진료소 방문 독려, 대규모 모임 및 발생지역 방문 자제, 손 소독제 비치, 식당과 체력단련실 등 주기적 방역 등의 조치가 진행 중이다. 정유·화학 업체들 또한 여타 기업들과 마찬가지로 출입구 발열 체크, 주요 현장에 손소독제·위생용품 비치, 미열 발생시 재택근무 권장 등의 조치를 하고 있다.inubica@news1.kr© 뉴스1코리아(), 무단 전재 및 재배포 금지",/news/news_read.nhn?article_id=0004496895&office_id=421&mode=search&query=SK&page=3
"삼성전자·현대차·SK·LG 등 기업들 '셧다운 방지' 총력전삼성, 사업장 안전 상시 모니터링 구축현대차, 신차 출시 통해 위기 극복 나서SK, 감염병 백신 제조 기술 연구개발LG, 협력사에 마스크·항공운송비 지원","올해 ‘V’자 반등을 노리던 기업들이 신종 코로나바이러스 감염증(코로나19)이라는 암초를 만났다. 사태 초기 중국발(發) 부품난 수준이던 코로나19 피해는 국내 확산 여파로 공장 셧다운(일시적 가동 중단)까지 걱정해야 할 처지에 놓였다. 모건스탠리와 노무라증권 등은 최악의 시나리오를 가정해 올해 한국의 경제성장률이 0%대에 그칠 것이란 전망까지 내놓고 있다.삼성전자와 현대자동차, SK, LG 등 주요 기업은 코로나19 확산을 막기 위해 시차출근제와 재택근무제 등 일하는 방식부터 바꾸고 있다. 협력사 지원도 확대하고 있다. 고부가가치 제품 확대와 미래 시장 개척 등 본원적 경쟁력을 높여 코로나19발 경제 위기를 돌파한다는 목표를 세웠다.삼성전자는 코로나19 확산 위기 속에서도 업무에 집중할 수 있도록 사업장 안전에 각별한 신경을 쓰고 있다. 잠재된 위험 요소를 미리 파악해 개선대책을 수립한다. 상시적 모니터링 체계도 구축했다. 협력사의 안전이 삼성 제품의 품질과 신뢰도에까지 영향을 줄 수 있는 만큼 협력사 사업장 안전에도 지원을 아끼지 않고 있다.LG그룹도 코로나19 확산에 따른 협력사 피해를 줄이기 위해 지원에 나섰다. LG전자는 협력사에 마스크 공급, 항공 운송비 지원 등 협력사가 필요로 하는 부분을 신속하게 지원하고 있다. LG전자는 지난해 400억원 규모였던 무이자 자금을 올해 550억원으로 확대한다. 자금 지원 시점도 지난해보다 4개월 앞당겨 이달부터 진행한다. LG전자는 기업은행, 산업은행 등과 함께 저금리 대출을 위한 2000억원 규모 상생협력펀드도 운용하고 있다.현대자동차그룹은 코로나19 등 전염병을 비롯해 사고 위험 요인 등을 모바일 앱으로 제보할 수 있는 ‘안전신문고’를 운영하고 있다. 현대·기아차를 비롯한 그룹 내 13개 주요 계열사의 사업장에 적용됐다. ‘안전정보시스템’을 도입해 그룹 계열사의 안전 정보를 체계적으로, 통합적으로 관리하고 있다. SK이노베이션과 SK텔레콤 등 SK그룹 주요 계열사는 재택근무제를 도입해 코로나19 확산 방지에 총력을 기울이고 있다.삼성전자와 SK하이닉스 등 반도체 기업들은 코로나19 사태에도 불구하고 5세대 이동통신(5G)을 기반으로 실적 반등을 노린다. 5G는 향후 자율주행차나 증강현실(AR)·가상현실(VR) 등의 시장 확대를 촉발하는 핵심 인프라로 꼽힌다. 중앙처리장치(CPU), 모바일애플리케이션(AP) 또한 초미세공정 기반의 고사양이 요구돼 삼성전자가 2030년 1위를 노리는 파운드리(반도체 수탁생산) 시장 확대도 예상된다.LG전자도 OLED TV를 앞세워 중국발 추격을 따돌린다는 전략이다. 올해 OLED TV 출하량은 450만 대로 전년 대비 50% 증가할 전망이다. 2023년에는 OLED TV 출하량이 1150만 대로 올해보다 2.5배 이상 성장할 것으로 예상된다. 중대형 OLED TV패널은 세계에서 LG디스플레이만 유일하게 생산하고 있다. 삼성디스플레이는 13조원을 투자해 QD디스플레이에 투자할 방침이다.현대차는 신차 출시를 통해 위기를 헤쳐나가겠다는 전략이다. 현대차 고급 브랜드인 제네시스에서는 올해 상반기 신형 G80가 나온다. 2013년 2세대 출시 이후 7년 만에 선보이는 완전변경 모델이다. 지난달엔 준대형 SUV GV80도 선보였다. 현대차의 간판 준중형 세단인 아반떼 완전변경 모델도 조만간 출시될 예정이다. 2015년 이후 5년 만에 출시하는 7세대 모델이다.SK바이오사이언스는 신종 감염병 대유행 시 빠르게 적용이 가능한 백신 제조 기술 플랫폼을 확보하기 위해 신기술 연구개발(R&D)에 들어갔다. 이 회사는 질병관리본부가 코로나19 국책 과제로 추진 중인 ‘신종 코로나바이러스 면역항원 제작 및 평가기술 개발’ 사업에 지원했다. 신종 감염병 예방 백신 개발과정에서 긴밀히 협조하기 위해 국내외 유관기관과 업무 협의도 진행 중이다.김보형 기자 kph21c@hankyung.com▶ ▶
 ▶
ⓒ 한국경제 & , 무단전재 및 재배포 금지",/news/news_read.nhn?article_id=0004299697&office_id=015&mode=search&query=SK&page=3
,"코로나19의 확산으로 인해 출장과 미팅이 사라지고 화상회의와 재택근무가 급증하고 있다.  출처 | 픽사베이[스포츠서울 이상훈 기자] 2020년 1월 20일. 국내에서 첫 코로나19 확진자가 나왔다. 정부에서, 그리고 사회에서도 적잖이 당황했다. 중국에서 수많은 사람이 감염된 만큼 국내에서도 감염자가 발생할 것이라는 예상은 했지만 막상 국내에서 감염자가 나오자 사회 곳곳에 긴장감이 팽배해졌다. 지난 2015년 메르스 사태 때 국내에서 186명이 감염됐고 그 중 38명이 목숨을 잃었던 기억이 떠올랐기 때문이다. 그래서 사람들은 매일 코로나19와 관련된 뉴스를 경청했고 야외활동을 대폭 줄였으며 마스크 착용자가 눈에 띄게 늘었다. 지난 2월 13일. 문재인 대통령은 코로나19 대응 경제계 간담회 모두발언에서 “국내 방역관리는 어느 정도 안정적인 단계로 들어선 것 같다”면서 “코로나19는 머잖아 종식될 것”이라고 말했다. 그러나 그 후 신천지 사태가 발생하고 사태는 연일 급박하게 돌아가게 됐다. 하루 수백 명씩 감염자가 속출하면서 사회에는 ‘코로나19 포비아’가 확산됐다. 2일 0시 기준 국내 코로나19 감염자 수는 4000명을 넘어섰다(4212명). 결국 기업들도 코로나19의 리스크를 직시하기 시작했다. 대면업무를 최소화하고 미팅을 취소하라는 지침을 내리기 시작했다. 코로나19가 퍼트린 공포감이 국내 경제활동을 둔화시켰고 그 여파가 곳곳에 퍼지기 시작했다. SK텔레콤, 넷마블, 업비트, 삼성생명, 현대해상 등 업종을 가리지 않고 재택근무자들이 늘어났다. 서울 광화문 KMI의학연구소 건물,
영등포구 한국수출입은행 본점, 원주시에 위치한 한국관광공사 본사 건물, 용산 LS타워 등에서 확진자가 발생하자 방역을 위해 임시 폐쇄조치가 내려지기도 했다. 확진 환자 한 명이 본사에 방문하는 것만으로도 건물 폐쇄조치가 발생할 수 있고 임직원 감염으로 이어질 수 있는 만큼 기업들은 철저히 대면업무를 줄이고 있다. 지난 2월 29일에는 이탈리아 밀라노로 출장을 다녀온 30대 여성과 30대 남성이 코로나19 확진 판정을 받자 출장마저도 뚝 끊기게 됐다. 특히 해외 기업인 구글, 아마존, 우버는 코로나19 감염자가 많은 한국의 출장을 제한하는 등 조치를 취하기 시작했다. 미팅도 대폭 줄어들고 대신 업무용 메신저와 이메일을 통한 비대면 업무가 대폭 늘었다. 업계에 따르면 원격근무 서비스 제공업체인 알서포트는 코로나19 상황이 심각 단계로 격상한 후 재택근무 서비스 이용 신청 기업이 평일 기준 하루 200여 곳에 이르고 있다고 밝혔다. NHN이 코로나19 확산에 대응한 재택근무 시행을 앞둔 중소기업을 대상으로 클라우드 협업 플랫폼 ‘토스트 워크플레이스 두레이(TOAST Workplace Dooray!)’를 무상으로 서비스한다고 밝히자 해당 서비스 신규 고객사 유입량도 종전보다 4배 가량 증가했다. 기업에 따라 다소 차이가 있지만 불필요한 미팅과 출근을 줄이고 재택근무를 도입한 지 1~2주가 지나면서 많은 기업들은 새 업무환경에 적응해 가고 있다. 한 기업 관계자는 “처음에는 상황 추이를 보며 며칠간 재택근무한다는 지침이 내려왔는데 매일 확진자가 수백명씩 발생하고 있어 재택근무 기간이 연장됐다. 미팅과 회의가 줄고 필요한 업무만 메신저와 메일로 전달하다 보니 대신 업무효율은 올라갔다”고 설명했다. 한 스타트업 관계자는 “현재 재택근무가 가능한 이들을 최대한 재택근무시키며 출근 인원을 줄이고 있다. 또 대중교통 출근 시 최대한 사람이 붐비는 시간대를 피하도록 탄력근무제를 시행하고 있는데 업무에 차질이 없다면 탄력근무제를 앞으로도 계속 이어갈 가능성도 있다”고 말했다. party@sportsseoul.com[기사제보 news@sportsseoul.com]
Copyright ⓒ 스포츠서울&",/news/news_read.nhn?article_id=0000632416&office_id=468&mode=search&query=SK&page=2
"듀폰 SiC 웨이퍼 사업부 5천400억원에 인수 마무리전기차·5G네트워크 필수부품인 SiC 웨이퍼 시장 진출, 과감한 글로벌 기술 투자 평가, 추가 고용창출 예상","구미국가산업단지 내 ㈜SK실트론은 미국 듀폰의 SiC(실리콘 카바이드 웨이퍼) 사업부를 5천400억원에 인수 마무리했다고 2일 밝혔다.전기차·5G네트워크 필수부품인 SiC 웨이퍼 시장 진출을 위한 과감한 글로벌 기술 투자라는 평가와 함께 추가 고용창출이 예상된다.최근 자동차 업체들은 전기차 시장에 앞다투어 진출하고 있고, 통신 업체의 5G 보급 확대에 따라 전력반도체 수요가 빠르게 늘고 있다.SiC 웨이퍼는 고경도, 내전압, 내열 특성을 지녀 에너지 효율이 중요한 전기차, 5G 네트워크 등에 주로 사용돼 고성장이 예상되는 영역이다.SK실트론 측은 ""이번 인수로 듀폰이 보유한 R＆D 및 생산 역량과 기존 주력 사업간 시너지를 극대화해 신규 성장 동력을 확보할 수 있을 것으로 기대한다""고 밝혔다.SK실트론은 구미에 본사를 둔 국내 유일의 반도체 실리콘 웨이퍼 제조기업이다.1983년 설립돼 지난해 매출 1조5천429억원을 기록한 글로벌 5대 웨이퍼 제조기업 중 하나다.지난해 세계 300mm 실리콘 웨이퍼 판매량의 17% 정도를 차지하고 있다.미국·일본·중국·유럽·대만 등 총 5곳에 해외법인과 사무소를 두고 있으며, 2001년 설립된 미국법인은 인텔, 마이크론 등 8개 고객사에 실리콘 웨이퍼를 판매하고 있다.이창희 기자 lch888@imaeil.comⓒ매일신문 - www.imaeil.com",/news/news_read.nhn?article_id=0000636178&office_id=088&mode=search&query=SK&page=2
"작년 9월, 4억5천만弗에 인수 결정","SK실트론이 미국 듀폰의 전력반도체용 웨이퍼 사업부 인수를 완료하고 전 세계를 무대로 부품·소재사업을 확장한다.
 SK실트론은 지난달 29일 듀폰의 실리콘 카바이드 웨이퍼(SiC 웨이퍼) 사업부 인수를 마무리했다고 2일 밝혔다.
 앞서 SK실트론은 지난해 9월 이사회 결의를 통해 4억5000만달러(약 5400억원)를 주고 해당 사업 인수를 결정했다.
 SK실트론은 인수 이후에도 관련분야 투자를 지속할 예정이며, SiC 웨이퍼의 생산량 증대와 미국 내 추가적인 고용 창출이 예상된다고 설명했다.
 최근 전기차 시장 성장과 5G(5세대 통신) 보급 확대에 따라 전력반도체 수요가 늘어나고 있다고 회사 측은 설명했다.
 이에 고경도, 내전압, 내열 특성을 가지고 있는 SiC 웨이퍼가 전력반도체용으로 각광받고 있어 매년 두자릿수 이상의 고성장을 예상하고 있다.
 아울러 SK실트론은 이번 인수를 통해 듀폰이 보유한 연구개발(R&D) 및 생산 역량과 기존 주력 사업간 시너지를 극대화할 방침이다.
 SK실트론 관계자는 ""고성장 영역 진출을 통해 신규 성장 동력을 확보할 수 있을 것으로 기대하고 있다""고 설명했다.

 ※ 저작권자 ⓒ 파이낸셜뉴스. 무단 전재-재배포 금지",/news/news_read.nhn?article_id=0004382176&office_id=014&mode=search&query=SK&page=2
LG화학·삼성SDI·SK이노전년동월대비 14% 늘었지만中시장 침체로 에너지 총량은 ↓,"글로벌 전기차에 탑재된 배터리 사용량에서 한국 배터리 3사의 점유율이 사상 처음으로 30%를 돌파했다.
 2일 시장조사업체 SNE리서치에 따르면 지난달 세계 각국에 등록된 전기차의 배터리 에너지 총량은 7.3GWh로 전년 동월 대비 6.2% 감소했다. 중국 시장 침체가 반영된 것으로 분석된다.
 전기차에 가장 많은 용량의 배터리를 제공한 기업은 일본의 파나소닉으로, 미국에서 테슬라 모델3 물량이 급증한 데에 힘입어 1년전에 비해 두 배 이상의 급성장세를 나타냈다.
 반면 CATL을 비롯한 대다수 중국 업체들은 중국 시장 침체로 부진을 면치 못했다.
 LG화학은 1.7GWh로 전년 동월 대비 2.4배 가량 늘면서 CATL을 제치고 2위로 올라섰다. 삼성SDI는 0.4GWh로 22.7% 증가해 4위로 두 계단 상승했고, SK이노베이션은 2.1배 급증한 0.2GWh를 기록해 같은 기간 순위가 다섯 계단이나 뛰었다.
 이로써 한국의 LG화학과 삼성SDI, SK이노베이션 등 배터리 3사가 톱10에 진입했으며, 이들 3사의 점유율은 30.8%를 기록했다. 전년 동월의 14.2% 대비 두 배 이상 늘어난 수치다.
 SNE리서치는 ""3사의 성장세는 각 사의 배터리를 탑재하고 있는 모델들의 판매 증가에 따른 것""이라며 ""다만 중국 시장이 회복되면서 CATL을 비롯한 중국계 업체들이 다시 반격에 나설 것으로 예상된다""고 설명했다.


 ※ 저작권자 ⓒ 파이낸셜뉴스. 무단 전재-재배포 금지",/news/news_read.nhn?article_id=0004382178&office_id=014&mode=search&query=SK&page=2
"여신금융협, 현금지원 마케팅 광고 심의 중단 논의토스·PASS·카뱅 등 앱서 발급첫 거래 땐 쓴 만큼 캐시백 플랫폼서도 지원…12만원 주기도","‘처음 결제하면 12만원의 쇼핑 지원금을 드립니다.’SK텔레콤의 본인확인 앱 PASS에 소개된 ‘신한 미스터 라이프 카드’ 가입 혜택이다. 핀테크 업체와의 이런 제휴 마케팅은 한동안 인기를 끌었다. 카드사들도 제휴 플랫폼을 늘리는 데 주력했다. 하지만 경쟁이 과열되면서 상황이 바뀌기 시작했다. 핀테크 앱을 통해 고객을 모아도 카드 수익성에는 큰 도움이 안된다는 목소리가 늘어났다. ‘제휴 마케팅’의 수명이 다한 것 아니냐는 분석도 제기된다.1000만 명 이상의 실사용자를 확보한 ‘비대면 금융 플랫폼’이 카드 영업에 활용되기 시작한 건 지난해 초부터다. 핀테크 플랫폼을 통해 신규 가입자를 모으고, 오랫동안 카드를 사용하지 않는 회원을 깨우는 데 유용하다고 판단했다. 일정 금액을 사용하는 조건을 충족하면 적게는 5만원, 최대 15만원을 돌려주는 방식이다.효과는 ‘대박’이었다. 카드업계 관계자는 “은행계인 신한·KB국민·하나·우리카드는 은행 점포 한 곳에서 매달 50~70장 안팎의 카드를 파는데, 핀테크 플랫폼에선 하루에도 단일 카드가 수천 장씩 판매됐다”고 설명했다.모든 회사가 핀테크 제휴에 뛰어들면서 상황이 바뀌었다. 핀테크 플랫폼을 통해 모은 고객 대부분이 초기 혜택만 빼먹고 사용은 거의 하지 않는 ‘체리 피킹’ 고객이었다. 각 제휴카드에 중복 가입하고 혜택만 취한 고객도 상당수인 것으로 파악됐다.카드사들의 ‘자정’ 움직임도 나타나고 있다. 여신금융협회가 핀테크 플랫폼 제휴 마케팅에 대해 광고 심의를 내 주지 말아야 한다는 의견도 일부 카드사로부터 나오고 있다. 여신금융협회 관계자는 “아직 카드사별로 의견 수렴을 하고 있는 단계”라며 “광고 심의를 중단할지 여부는 확정하지 않았다”고 말했다.카드사 준법 담당자들은 여신전문금융업법(여전법) 위반 우려도 꾸준히 제기해왔다. 여전법 시행령(제6조7항)은 온라인 가입자에게 연회비의 100%를 넘는 경품을 주지 못하도록 하고 있기 때문이다.핀테크 제휴 마케팅에 상위권 카드사만큼의 ‘실탄’을 쓰지 못하는 중소형 카드사들의 불만이 두드러졌다. 중소형 카드사 관계자는 “핀테크 제휴가 일반화하면서 마케팅 경쟁이 더욱 뜨거워졌다”며 “고객에게 지나치게 많은 혜택을 돌려주는 ‘고비용 구조’를 없애라는 금융감독당국의 지침에도 반하는 것”이라고 설명했다.카드업계 관계자는 “핀테크 제휴 마케팅이 없어질 경우 일부 체리피커에게만 주어지던 혜택을 전 고객이 나눠가질 수 있고, 회사 간 상품력으로 승부하는 문화가 정착될 수 있다는 점에서 긍정적”이라고 설명했다.반대 의견도 적지 않다. 핀테크 플랫폼 사업자 등은 사용액에 따라 현금을 돌려주는 ‘캐시백’ 형태의 마케팅은 ‘가입자 경품’에 해당하지 않는다고 반박한다. 카드사가 핀테크 플랫폼에 발급 수수료를 주고 이 수수료를 고객에게 경품으로 주는 방식이어서 여전법 적용 대상이 아니라는 의견이다.향후 여신금융협회가 핀테크 제휴 현금 마케팅을 막는다면 그동안 경품 혜택을 받던 고객 사이에서 반발이 나올 가능성도 있다. 수수료 수익을 쏠쏠하게 올렸던 플랫폼사들도 불만을 제기할 수 있다.김대훈 기자 daepun@hankyung.com▶ ▶
 ▶
ⓒ 한국경제 & , 무단전재 및 재배포 금지",/news/news_read.nhn?article_id=0004299723&office_id=015&mode=search&query=SK&page=2
