head,text,url
이재용·정의선·최태원 '코로나 리스크' 속 부각하는 총수 리더십,"[더팩트 | 서재근 기자] 삼성과 현대자동차(현대차), SK그룹 등 주요 대기업 총수들이 임직원들과 소통을 강화하고, 적극적인 사회공헌활동을 주문하는 등 '코로나 리스크' 극복에 앞장서고 있다.신종 코로나바이러스 감염증(코로나19) 확산으로 글로벌 행보에 차질이 불가피한 상황이지만, 내부 소통 창구를 넓혀 우려와 불안을 불식하는 방향으로 일정을 선회해 대응책을 마련하는 데 집중하고 있다.16일 재계에 따르면 이달을 기점으로 주요 그룹에서 주관하거나 핵심 계열사 및 총수가 참여하는 글로벌 행사들이 코로나19 여파로 잇달아 연기되거나 취소되고 있다. 삼성전자의 경우 오는 5월로 예정된 '삼성 파운드리 포럼(SFF) 2020' 일정을 잠정 연기했다.현대차는 지난달 28일로 예정됐던 유럽 3대 모터쇼 가운데 하나로 꼽히는 스위스 제네바 모터쇼에 이어 다음 달로 예정된 뉴욕 모터쇼 등 굵직한 글로벌 행사가 모두 취소되면서 다양한 신차들의 데뷔 무대를 온라인화하는 데 집중하고 있다.이외에도 최태원 SK그룹 회장이 자문위원으로 매년 참가해 온 보아오포럼 역시 오는 24일부터 27일까지 나흘 동안 진행될 예정이었지만, 코로나19 감염 우려로 잠정 연기됐다.예년과 180도 달라진 분위기 속에 총수들의 해외 일정표에도 공란이 늘고 있지만, 내부 사기 진작을 위한 리더들의 움직임은 활발하다.이재용 삼성전자 부회장의 경우 코로나19 피해 극복을 위해 300억 원을 지원한 데 이어 재계에서 처음으로 대규모 연수원을 치료센터로 제공하는 등 '통 큰' 사회공헌을 주도한 데 이어 최근에는 삼성전자 핵심 사업장을 방문하며 내부 사기 진작을 위한 소통에 나서고 있다.실제로 지난 3일에는 코로나19 확진자가 발생한 삼성전자 구미사업장을 직접 찾아 ""어려운 상황에서도 최일선에서 묵묵히 일하는 여러분께 진심으로 감사드린다""라며 격려의 메시지를 전달했다. 지난 12일에는 ""모두가 힘을 모으면 반드시 이겨낼 수 있다""는 희망의 메시지와 함께 코로나19로 자택에서 격리 또는 재택근무를 하는 계열사 및 협력사 임직원 5000여 명에게 격려 물품을 전달한 바 있다.정의선 현대차그룹 총괄 수석부회장 역시 사내 임직원은 물론 어려움을 겪는 협력사들 지원에 팔을 걷어붙였다. 이날 현대차와 기아차는 코로나19로 경영 어려움을 겪고 있는 서비스협력사를 위해 22억 원 규모의 가맹금 지원에 나섰다.매출 손실을 겪고 있는 서비스협력사 블루핸즈와 오토큐의 어려움을 함께 극복하기 위해 오는 5월까지 3개월 동안 가맹금을 감면한다는 계획이다.'그룹 차원의 구체적인 지원'을 공언한 정의선 수석부회장의 지원 활동은 올해 들어 쉼 없이 이어지고 있다. 특히, 지난 9일에는 코로나19 확산에 따른 병상 문제를 해소하기 위해 오는 5월 정식 개소를 앞둔 경북지역 연수원 두 곳을 생활치료센터로 제공하는 결단을 내렸다.아울러 지난달에는 전국재해구호협회에 50억 원을 기탁했으며, 협력사들의 자금 조달 부담을 줄이기 위해 중소 부품 협력업체에 1조 원 규모의 자금을 긴급 지원한 바 있다.최태원 회장은 최우선 경영 가치로 여기는 '사회적 가치 창출'의 적용 범위를 코로나19 지원 활동으로 넓혔다. SK그룹은 오는 17일부터 대구 1000명과 경북 500명 등 지방자치단체 추천을 받은 어린이 1500명에게 도시락을 배달한다고 16일 밝혔다. '코로나 사태'로 개교가 미뤄지면서 끼니를 거를 수 있는 우려가 커진 아이들을 돕기 위해서다.또한, SK그룹은 사회성과인센티브(SPC) 제도를 적극적으로 활용해 피해복구를 지원한다. SPC는 사회적 기업 생태계 활성화를 위해 SK가 지난 2015년부터 운영해온 제도다. SK그룹은 인센티브 지급을 위해서는 사회적 가치를 제대로 측정해야 한다는 최 회장의 주문 이후 자체 측정 방법을 개발, 2014년 사회적기업을 대상으로 사회적 가치를 측정해 왔다.사회적 기업이 창출한 사회적 가치를 화폐단위로 측정해 그에 비례한 현금 인센티브를 지급하며, 지원 규모는 2020년 기준 연간 95억 원 안팎이다. 이번 피해복구에 참여한 사회적 기업들에는 특별 인센티브를 지급할 예정이다.'코로나 리스크' 해법을 찾기 위한 노력도 분주하다.조원태 한진그룹 회장의 경우 코로나19 여파로 노선 운휴와 감편으로 발이 묶인 여객기가 급증하는 상황을 해소하기 위해 운휴 여객기의 화물칸을 이용해 화물 수요 변화에 대응할 수 있는 방안을 내놨다.한진그룹에 따르면 최근 조 회장은 코로나19 대응 전략 수립 방안을 위해 경영 수뇌부와 소통을 한층 강화했다. 이번 운휴 여객기 활용 방안 역시 최근 진행된 임원 회의에서 조 회장이 직접 아이디어를 제시한 것으로 알려졌다.코로나19와 관련한 조원태 회장의 행보는 국내 감염자 확산세가 본격화하기 전부터 시작됐다. 특히 조원태 회장은 지난 1월 중국 우한에 체류 중인 교민 송환을 위해 자발적으로 지원에 나선 승무원들의 결단에 동참하기 위해 대한항공 전세기에 몸을 실은 바 있다.한 재계 관계자는 ""코로나19 팬데믹(세계적 대유행) 공포가 전 세계적으로 확산하고 있다. 특히, 국내의 경우 산업 분야를 막론하고 막대한 경제적 손실에 직면한 데다 대기업 주요 사업장을 중심으로 확진자가 발생하면서 임직원들이 체감하는 우려와 공포가 상대적으로 더욱 컸다""라며 ""성금지원을 넘어 기업 총수가 전면에서 임직원들을 찾아 격려와 감사의 메시지를 전달하는 것은 이 같은 불안 심리를 없애고, 사기를 진작하는 데 큰 역할을 할 것""이라고 말했다.likehyo85@tf.co.kr저작권자 ⓒ 특종에 강한 더팩트 & tf.co.kr 무단 전재 및 재배포 금지",/news/news_read.nhn?article_id=0000019136&office_id=629&mode=search&query=SK&page=12
의료 제품 수요 증가로 NB 라텍스 호황 전망…제조업 불황 기조는 경계해야,"[더팩트ㅣ이한림 기자] 금호석유화학이 코로나19 사태로 인한 유가 급락과 공장 가동률 저하로 석유화학업계가 고통 받고 있는 가운데 오히려 실적 개선 의지가 감지되며 눈길을 끌고 있다. 금호석유화학의 합성고무사업 중 하나인 NB 라텍스의 글로벌 수요와 판매량이 변화하고 있기 때문이다.16일 석유화학업계에 따르면 금호석유화학의 합성고무사업 내 NB 라텍스 수출량이 크게 증가하고 있다. 코로나19 여파로 의료 제품 수요가 늘어나면서 의료용 장갑 소재로 사용되는 NB(아크릴로니트릴 부타디엔) 라텍스의 판매가 늘어나고 있어서다.특히 금호석유화학의 NB 라텍스 주요 수출처이자 장갑업체가 몰려 있는 말레이시아를 중심으로 늘어나고 있다. 뉴스트레이트타임즈 등 외신에 따르면 세계 1위 장갑업체인 말레이시아의 톱글러브 역시 코로나19 이후 의료용 장갑 판매량이 증가하고 있어 공장 가동률을 100%로 높이기도 했다.이에 업계에서는 금호석유화학이 최근 이어지고 있는 NB 라텍스 제품의 판매량 증가에 따라 수익적인 부분에서도 수혜를 입을 것으로 보고 있다. 금호석유화학이 지난 2009년 NB 라텍스 생산기술을 개발한 뒤 지난해까지 세계 NB 라텍스 생산량 1위(35%)를 유지하고 있고, 지난해 말 공장 증설로 생산량 또한 15만 톤 가량을 늘렸기 때문이다.증권가에서도 올해 1월 국내 NB 라텍스 수출량 7만4000톤 중 상당량을 금호석유화학에서 맡았을 것으로 추정하며 이 회사의 수익성 개선 여지를 점치고 있다. 이를 통해 금호석유화학이 평소보다 10% 넘게 공장 가동률을 끌어 올렸고 수요 증가세가 지속된다면 장기적으로 원가 부담도 덜 수 있다는 해석이다.실제로 금호석유화학은 올해 실적 개선이 요구된다. 지난해 연간 영업이익이 전년 대비 33.6% 가량 떨어진 3680억 원에 그쳤기 때문이다. 최근 3년 간 회사의 수익성을 이끌다시피 했던 페놀유도체의 업황도 미중 무역분쟁 이후 중국발 공급 과잉으로 꺾여 있다. 사업 구조 재편과 합성고무, 스페셜티 등 고부가가치 사업으로 전환점을 맞이 해야한다는 목소리가 높다.이에 이번 NB 라텍스 부문의 호황 전망은 금호석유화학을 미소 짓게 한다. 올초 전자소재사업인 포토레지스트 사업부를 400억 원에 SK머티리얼즈에 매각하며 리스크를 덜어냈고, 지난해 투자를 통해 증설한 NB 라텍스 공정도 가동률이 높아지고 있기 때문이다.금호석유화학도 최근 주주총회를 통해 올해 손익 개선을 전망하고 있다고 자평했다. 금호석유화학 관계자는 ""코로나19 이슈가 변수로 작용할 전망이지만 올해 1분기 고원가 재고 해소 및 특수고무 부문에서 성수기에 진입하며 손익 개선이 예상된다""고 말했다.반면 금호석유화학의 올해 반등에 대해 의문을 보내는 시각도 존재한다. 페놀 유도체의 호황으로 최근 실적이 좋았던 100% 연결 자회사 금호피앤비화학이 미중무역분쟁에 이은 코로나19 악재로 글로벌 제조업이 부진하며 올해에도 부진할 것이라는 전망이 나오고 있어서다.일각에서는 글로벌 페놀 유도체 증설 규모가 지난해에만 50여만 톤이 늘었고 올해 하반기에도 60여 만톤의 신규 가동이 예정돼 있어 금호피앤비화학의 페놀 유도체 공정이 공급 과잉을 이겨내고 수익성을 올릴 수 있을지 미지수로 보고 있다. 금호피앤비화학은 이러한 기조에 따라 지난해 4분기 연결기준 영업이익이 전년 동기 대비 80.9% 급감한 161억 원에 그치기도 했다.석유화학업계 관계자는 ""올초 늘어난 NB 라텍스 제품 수요가 지난해 증설한 생산량과 맞아 떨어진다면 수익성 제고가 예상된다""며 ""다만 중국의 경제 둔화 및 주요국 보호무역주의 기조가 여전해 이에 따른 향후 세계 제조업 경쟁 심화 등 불확실성은 경계해야 한다""고 말했다.2kuns@tf.co.kr저작권자 ⓒ 특종에 강한 더팩트 & tf.co.kr 무단 전재 및 재배포 금지",/news/news_read.nhn?article_id=0000019140&office_id=629&mode=search&query=SK&page=12
방역회사 하루종일 출장소독 중경조사 챙기는것도 사치일 정도온라인주문 몰려 일손 부족한 배송알바생 하루 평균 1000명 더 필요,"코오롱베니트 정보보안팀의 김승렬 팀장은 요즘 밤잠을 설치는 일이 많다. 잘 때도 스마트폰을 머리맡에 두거나 손에 쥐고 잔다. 그가 스마트폰을 놓지 못하는 건 폰에 설정해 놓은 알람 때문. 코오롱그룹 내 IT 서비스망에 이상이 오면 즉시 그에게 알람이 온다.


최근 그의 주요 업무는 그룹 ‘가상 사설망(VPN)’을 확대하고 이를 유지하는 일. VPN은 인터넷 트래픽을 암호화하고 온라인상의 신호를 보호하는 툴이다. VPN이 없으면 사실상 재택근무는 불가능해진다.






 코오롱그룹은 최근 그룹 전반에 걸친 재택근무를 실시 중이다. 이에 대응해 기존 1000명의 유저가 동시에 접속해 사용할 수 있던 VPN 용량도 최근 3000명 유저 수준으로 확장했다. 사실상 그룹 내 사무직 직원 대부분이 재택근무에 들어간 데 따른 조치다. 그 바람에 김 팀장과 그의 팀원 입장에선 업무량이 기존보다 3배 이상 늘었다. 매일 비상대기 상태를 유지 중인 김 팀장은 15일 “팀원들끼리 ‘정보보안팀이 신종 코로나바이러스 감염증(코로나19) 대응팀으로 바뀌었다’는 농담을 주고받곤 한다”며 “VPN에 문제가 생기면 그룹 전체의 업무가 멈출 수 있는 만큼 매일 전쟁터에 가는 심정으로 임하고 있다”고 말했다.


코로나19 확산에 많은 직장인은 재택근무에 돌입한 가운데, 여전히 현장을 지키는 이들도 있다. 재택근무를 지원하거나 ‘대한민국 산업’이 멈추지 않고 불씨가 꺼지지 않도록 묵묵히 제 자리를 지키는 이들이다.


방역·방제기업인 세스코 직원들은 요즘 하루 24시간이 모자랄 만큼 바쁘다. 이 회사 100여 개 직영 지사와 3000여 명의 현장 직원들은 온종일 방역복을 입고 작업을 하다 보니 걸려오는 전화를 제때 받지 못하기 일쑤다.


경조사를 챙기는 일은 이미 사치가 됐다. 방역에 필요한 각종 소독액이 부족하지 않을까 고민하는 게 일상이 됐다. 세스코 관계자는 “산업 현장은 물론 각종 정부 기관에서도 방역 의뢰가 쏟아져 정말 매일매일 전쟁을 치르는 기분”이라며 “가용한 모든 인력이 현장에 투입돼 있어, 현업 직원들과는 일과 시간 중 통화도 어려울 정도”라고 전했다.



 매출이나 출하량이 줄었어도 공장을 세울 수 없는 곳이 있다. 24시간 공장을 돌려야 하는 정유·화학업체들이다. SK이노베이션의 울산 콤플렉스(이하 울산CLX)에서 근무하는 1600여 명의 오퍼레이터(운전원)들은 4조 3교대로 하루 24시간 공장을 지킨다. 울산CLX의 경우 경기 위축으로 코로나19 사태 이전보다 출하량이 15%가량 줄었다. 하지만 830만㎡(약 251만 평) 규모의 울산CLX는 국가 기간시설로 분류된 ‘국가보안목표 가급 시설’이다. 한 번 멈추면 재가동하는 데 최소 1~2주 이상이 걸리고, 가동 중단에 따른 생산 차질로 수백억원의 손실이 발생한다.


그래서 오퍼레이터를 포함한 사실상 전 직원은 정상 근무를 한다. 대신 불문율이 있다. 가급적 철저히 ‘홀로’ 일하는 것이다. 수도승 같은 면벽(面壁·벽을 봄) 식사와 근무는 기본이다. 출근해도 직원들은 가능한한 서로를 멀리하는 걸 원칙으로 했다. 감염자가 발생해도 피해를 최소화하기 위해서다.


구내식당에는 일일이 칸막이를 쳤다. 직원들은 자연스레 벽을 보며 홀로 식사를 해야 한다. 흡연실에서 담배를 피울 때도 잡담을 나누는 일도 없어졌다. 일과 이후에도 직원 상호 간 모임 등은 원칙적으로 금지다.






 재택근무 확산과 언택트(Untact·비접촉) 소비 등으로 더 바빠진 이들도 있다. 이마트 서울 성수점 수산코너에서 참치회를 떠주는 업무를 하는 김상훈(33) 실장은 출근하면 자리에 앉을 틈도 없이 바쁜 일상을 보내고 있다. 이마트 성수점의 평소 참치회 하루 판매량은 평일 20팩, 주말 50팩 수준이었지만, 이달 5~11일엔 평일 150여 팩, 주말 500여 팩으로 10배 이상 늘었다. 코로나19에 집에서 식사를 해결하거나 혼술을 하는 소비자가 늘어나서다.


오전 8시에 출근해 오후 4시 퇴근할 때까지 쉬지 않고 회를 썬다. “화장실에 갈 시간도 없을” 정도다. 참치회를 사려는 이들이 수산코너 앞에 길게 줄을 서는 모습에 동료들 사이에선 ‘수산 코너에서도 마스크를 파는 거냐’는 농담도 나온다고 했다.





쿠팡 서울 송파 3 캠프에서 일하는 송민수(29) 리더도 새로 일을 시작한 쿠팡맨과 배송 아르바이트 쿠팡 플렉스 직원들을 교육하느라 눈코 뜰 새 없이 바쁘다. 최근 쿠팡의 주문량은 하루 평균 300만 건으로 평소보다 30%가량 증가했다. 쿠팡 플렉스 지원자 역시 큰 폭으로 늘었다. 생업이 힘들어지자, 그나마 일거리가 있는 쿠팡 플렉스에 지원한 이가 늘어난 까닭도 있다. 코로나19 사태 이전 하루 평균 4000여 명의 쿠팡 플렉스가 배송에 참여했다면 최근에는 5000여 명을 훌쩍 넘어선 것으로 업계는 보고 있다.


이수기 기자 lee.sooki@joongang.co.kr
▶ ▶
/ ⓒ중앙일보(https://joongang.co.kr), 무단 전재 및 재배포 금지",/news/news_read.nhn?article_id=0002984549&office_id=025&mode=search&query=SK&page=12
,"SK텔레콤은 국제전기통신연합(ITU) 산하기관으로 통신 분야 표준을 정하는 ITU-T 회의에서 제안한 5G(5세대 이동통신) MEC(모바일 에지 컴퓨팅) 연동 플랫폼 기술이 국제 표준화 과제로 채택됐다고 16일 밝혔다. 국제 표준화 과제로 채택된 기술은 ITU-T에 참여하는 수십 개 국가의 논의를 거친 뒤 국제 표준이 된다.
MEC는 무선 데이터 전송 지름길을 만들어 클라우드 게임과 스마트팩토리, 자율 주행 및 차량 관제 등 초저지연 서비스의 성능을 높이는 5G 핵심 기술이다.
SK텔레콤은 ITU-T 회의에서 ‘연합 멀티 액세스 에지 컴퓨팅’ 표준을 제안했고 ITU-T는 이를 승인했다. 연합 멀티 액세스 에지 컴퓨팅은 통신사의 5G MEC 시스템을 연동하는 별도 플랫폼을 구축하고, 이를 통해 국가와 통신사와 관계없이 동일한 5G MEC 서비스를 제공하는 기술이다.
SK텔레콤은 이 기술을 2022년까지 국제 표준으로 완성하기 위해 ITU-T 내 연구반에서 연합 멀티 액세스 에지 컴퓨팅 기술의 구조와 신호 규격, 요구 사항 등의 연구를 진행한다.
 김준영 기자 papenique@segye.comⓒ 세상을 보는 눈,",/news/news_read.nhn?article_id=0003447691&office_id=022&mode=search&query=SK&page=12
"법인카드 발급 전표처리 없어 비용과 시간 줄여단거리 택시결제, 장거리 고속버스 결제 가능","[서울=뉴시스] 오동현 기자 = 법인카드나 전표 없이 업무 목적의 교통비용을 간편하게 처리할 수 있는 모바일 솔루션이 출시됐다. 국내 교통 결제서비스 사업자 티머니는 16일 기업 고객을 대상으로 소속 임직원들이 모바일 앱으로 택시, 고속버스 등 교통수단을 업무용으로 이용할 수 있는 '티머니 비즈페이(Biz.Pay)'를 선보였다.

티머니 비즈페이는 모바일 앱 설치만으로 소속 임직원들이 편리하게 교통결제를 할 수 있는 ‘업무용 모바일 교통 결제서비스’다. 교통카드처럼 택시 단말기에 스마트폰을 터치하는 방법과 앱에 표시된 'PIN번호'를 입력하는 방법으로 사용할 수 있다.
티머니 비즈페이를 이용하면 법인카드발급이나 전표처리가 필요 없다. 따라서 제반 비용과 잡무를 줄일 수 있고, 비용 관리의 투명성과 신속성을 높일 수 있다. 고속버스 장거리 출장에서도 사용 가능하다. '고속버스 티머니' 모바일 앱을 통한 예매가 가능하기 때문이다. 택시를 이용할 경우, 앱을 통한 호출탑승과 일반적인 택시 탑승 모두 결제가 가능하다. 티머니 비즈페이 이용 기업은 택시 이용금액의 최고 50%까지 교통유발 부담금을 감면받을 수 있다. 조직, 직원별로 한도금액, 사용가능 시간과 장소를 설정할 수 있어 다양한 활용이 가능하다.
 정성재 티머니 Payment&Platform사업부장(상무)은 ""티머니 비즈페이는 업무용 모바일 교통결제 서비스라는 새 시장 개척의 첫 발""이라며 ""티머니 비즈페이 서비스를 통해 코로나19 등 경기침체로 어려움을 겪고 있는 교통업계가 활력을 되찾길 바란다""고 말했다.티머니에 따르면, 티머니 비즈페이는 이미 여러 기업과 공공기관에서 이용하고 있으며, 관련 문의도 지속 증가하고 있다. 이용 기업은 청와대와 서울시, KDB산업은행을 비롯해 LG전자와 포스코, SK네트웍스 등 다양하다. 티머니는 기업 및 공공기관들과 전략적 제휴를 이어나갈 예정이다. 전국의 택시, 지하철, 시내버스와 공항버스, 고속도로 및 유료터널 통행료까지 서비스를 확대하고, 다양한 티머니 비즈페이 교통상품권과 요금제를 선보일 예정이다. odong85@newsis.com<ⓒ 공감언론 뉴시스통신사. 무단전재-재배포 금지>",/news/news_read.nhn?article_id=0009760054&office_id=003&mode=search&query=SK&page=12
[코로나19 팬데믹],"‘이번 위기에는 기업부채가 발화점이 될 수 있다.’ 사상 최대 규모로 불어난 각국의 기업부채가 신종 코로나바이러스 감염증(코로나19)으로 휘청거리는 세계 경제의 뇌관이 될 것이라는 경고가 나오고 있다. 오랜 저금리 시대에 빚으로 버텨온 기업들이 앞으로 매출 감소로 자금난을 겪게 되면 금융시스템 위기로 번질 수 있어서다.
16일 국제금융협회(IIF) 등에 따르면 지난해 9월 말 기준 전 세계의 비금융권 기업부채는 세계 국내총생산(GDP) 합계의 93%에 이르는 74조4000억 달러(약 9경1177조 원)로 집계됐다. 2007년과 비교하면 76% 급증한 수치다. 이 같은 막대한 기업부채는 2008년 글로벌 금융위기 직후 각국이 경기를 떠받치기 위해 엄청난 유동성을 공급한 결과다. 당시 세계의 구원투수 역할을 했던 중국은 4조 위안(약 700조 원) 규모의 경기부양책을 폈는데 그 결과 중국의 기업부채는 2008년 4조 달러에서 최근 20조 달러로 불어났다. 제로 금리와 양적 완화로 대응했던 미국의 기업부채도 지난해 9월 말 현재 약 16조 달러로 가계부채 규모를 앞질렀다.
재무구조가 취약해진 기업들은 코로나19로 인한 작은 충격에도 신용등급 하락, 채무불이행의 위험에 내몰릴 수 있다. 기업발(發) 실물위기가 금융위기로 전이될 수 있다는 것이다. 국제통화기금(IMF)이 글로벌 금융위기의 절반 정도 경제 충격을 가정해 스트레스 테스트를 한 결과 미국 중국 일본 등 주요 8개국의 기업부채 중 19조 달러가량에 채무불이행 위험이 있는 것으로 나타났다. 중국에선 이미 회사채 부도 규모가 지난해 사상 최대인 1300억 위안까지 늘었다. 파이낸셜타임스(FT)는 “코로나19가 계속 확산한다면 각국에 새로운 부채위기가 촉발될 우려가 크다”고 보도했다. 미국에서도 코로나19의 직격탄을 맞은 에너지 등의 업종을 중심으로 경고음이 울리고 있다. 최근 수년간 저금리로 급격하게 차입을 늘린 미국 셰일업체들은 코로나 위기에 최근 국제유가 폭락까지 겹치며 가장 큰 위험에 직면해 있다. 투자은행 모건스탠리는 체서피크에너지, 화이팅페트롤리엄 등을 부도 위험이 큰 회사로 꼽았고 옥시덴털, 아파치 등은 신용등급 강등이 예상된다고 봤다. 코로나19로 이동 제한이 확대되면서 항공, 호텔, 크루즈 등 관광 관련 기업들도 어려움을 겪고 있다. 국제신용평가사 피치는 부채가 많은 아메리칸항공과 알래스카항공을 주시하고 있다고 밝혔다. 스탠더드앤드푸어스(S&P)는 호텔 자산을 기반으로 하는 부동산투자신탁회사 등을 최근 등급 감시 대상으로 분류했다.
한국도 기업부채 리스크에서 자유롭지 못하다. IIF에 따르면 한국의 기업부채는 GDP의 101.6%로 가계부채(95.1%)보다 많다. 무디스는 최근 한국 기업 23%의 신용등급 전망을 ‘부정적’으로 평가했다. 최석원 SK증권 리서치센터장은 “신용등급이 하향 조정돼 자금조달 시장이 얼어붙으면 유동성이 부족한 기업들은 위기에 처할 것”이라고 분석했다. 글로벌 시장의 신용 경색으로 외국인 투자자들이 신흥국에서 돈을 빼내면 기업들의 자금 조달은 더 어려워질 수 있다. 물론 한국과 미국, 중국, 일본 등 각국 정부가 쏟아내는 통화 완화 정책이 당장 기업들의 자금난을 해소하는 데는 도움이 될 수 있다. 하지만 장기적으로는 한계기업을 더 연명시켜 근본적인 기업부채 위기를 더 악화시킬 수 있다는 지적도 나온다. FT는 “질 낮은 기업부채가 계속 축적되면 다음 경기침체를 더 악화시킬 수 있다”고 지적했다. 세종=주애진 jaj@donga.com·남건우 기자ⓒ 동아일보 & donga.com, 무단 전재 및 재배포 금지",/news/news_read.nhn?article_id=0003275549&office_id=020&mode=search&query=SK&page=12
