head,text,url
RPA 기반 DT사업 협력 MOU 체결,"[서울경제]
C&C는 로봇프로세스자동화(RPA) 전문기업 오토메이션애니웨어와 RPA 기반 디지털 전환(DT) 사업 협력 양해각서(MOU)를 체결했다고 17일 밝혔다. 양사는 SK C&C가 보유한 종합 디지털 플랫폼 구축 역량과 오토메이션애니웨어의 RPA 기술을 결합해 산업별 업무 특성에 최적화된 ‘지능형 RPA 시스템 모델’ 개발에 나설 계획이다. 단순 데이터 입력 등 기계적인 반복 업무 자동화에 그쳤던 기존 RPA와 달리 차세대 지능형 RPA는 △빅데이터 고급 분석 △비즈니스 인텔리전스 △인공지능(AI) 기반 기업 핵심 업무 지원 등이 가능하다. 양사는 먼저 대형 글로벌 플랜트·건설 분야 디지털 시스템 구축 사업에서 RPA 시스템을 개발해 SK건설 조달 업무에 처음 적용할 예정이다. 이상국 SK C&C 통신·서비스 디지털 부문장은 “SK그룹 관계자들의 업무 자동화 사례를 공유하고 이를 활용할 수 있는 플랫폼을 구현해 글로벌 개척도 추진할 것”이라고 밝혔다./권경원기자 nahere@sedaily.com저작권자 ⓒ 서울경제, 무단 전재 및 재배포 금지",/news/news_read.nhn?article_id=0003710647&office_id=011&mode=search&query=SK&page=7
,"03월 17일 SK증권의 나승두 애널리스트는 메탈라이프에 대해 ""① 안정적 Captive Market 보유, 동사의 최대주주는
RFHIC. 2019년 기준 RFHIC向 매출 비중은 56.5% ② 자체 개발한 적층 세라믹 기술 토대로 화합물 반도체 패키지 국산화에 성공한 국내 유일 기업 ③ 高주파수 대역을 활용하는 5G는 가장 빠르게 증가할 것으로 예상, RF 통신 성능을 좌우하는 핵심 요소, 글로벌 화합물 반도체 관련 선두 주자인 CREE와 RFHIC를 거래처로 확보함에 따라 동반 실적 성장 기대."" 이라고 분석했다.한경로보뉴스이 기사는 한국경제신문과 금융 AI 전문기업 씽크풀이 공동 개발한 기사 자동생성 알고리즘에 의해 실시간으로 작성된 것입니다.▶ ▶
 ▶
ⓒ 한국경제 & , 무단전재 및 재배포 금지",/news/news_read.nhn?article_id=0004307633&office_id=015&mode=search&query=SK&page=7
프랑스 메트론사와 제휴,"(서울=뉴스1) 김동규 기자 = SK가스가 산업체 대상의 최적 에너지공급 플랫폼 구축 사업을 발전시킨다. SK가스는 프랑스의 에너지전문 AI솔루션업체인 메트론사(Metron SAS)와 전략적 제휴 계약을 맺고, AI·빅데이터분석 소프트웨어를 기반으로 사업장 등 산업체 대상의 에너지효율화서비스를 국내에서 본격 시작한다고 17일 밝혔다.이에 따라 SK가스는 산업체를 대상으로 LPG와 연료전지 등 다양한 형태의 직접적인 에너지 공급뿐 아니라 첨단 데이터 분석기술 기반의 에너지최적화 솔루션을 통해 기업의 에너지 비용을 절감해주는 종합에너지플랫폼 서비스 사업자로 거듭나게 됐다.클라우드 기반의 솔루션(SaaS, Solution-as-a-Service) 형태로 제공되는 SK가스의 에너지효율화 서비스는 각 산업체에서 생성되고 축적되는 방대한 데이터를 분석해 AI 모델링을 하고, 여기에 오퍼레이터들의 축적된 경험을 더해 최적의 솔루션을 찾아 에너지 소비를 최적화할 수 있게 한다.SK가스가 제공하는 솔루션은 AI 모델을 통해 실시간으로 에너지사용 현황과 생산과정의 데이터를 분석해 최적의 제어포인트를 필요할 때마다 수시로 제안한다. 여기에 현장의 경험 많은 오퍼레이터들의 노하우를 결합하는 과정이 반복됨으로써 숨겨진 효율 제고 가능 영역을 찾아내 지속적으로 성과를 낼 수 있게 한다.SK가스는 지난 2018년부터 국내 산업체들을 대상으로 메트론사의 솔루션을 적용한 시범사업을 진행해 다양한 에너지최적화 아이템을 발굴하는 등 국내 사업장 환경에서의 적용 가능성을 성공적으로 검증했다.SK가스는 이번 서비스 제공을 시작으로 국내외의 다양한 유망 에너지솔루션을 지속적으로 발굴하고 상용화를 추진해 SK가스 고유의 종합에너지서비스 플랫폼을 개발, 구축해 나갈 예정이다.SK가스 관계자는 “새롭게 제공되는 이 서비스는 AI 분석기술과 인간의 축적된 경험이 결합돼 에너지관리 영역에서 스마트팩토리를 제대로 구현하는 것”이라며 “다양한 업종의 에너지 최적화를 구현해 원가절감뿐만 아니라 온실가스배출 감소 등의 사회적 가치 제고에도 기여할 것”이라고 말했다.dkim@news1.kr© 뉴스1코리아(), 무단 전재 및 재배포 금지",/news/news_read.nhn?article_id=0004526173&office_id=421&mode=search&query=SK&page=7
,"[서울=뉴시스] 이종희 기자 = SK가스가 산업체 대상의 최적에너지공급 플랫폼 구축 사업에 나선다.SK가스(대표이사 윤병석)는 17일 프랑스의 에너지전문 AI솔루션업체인 메트론사(Metron SAS)와 전략적 제휴 계약을 맺고 AI·빅데이터분석 소프트웨어를 기반으로 사업장 등 산업체 대상의 에너지효율화서비스(SK Gas ECO Energy Analytics powered by Metron)를 국내에서 본격 시작한다고 밝혔다.이에 따라 SK가스는 산업체를 대상으로 LPG와 연료전지 등 다양한 형태의 직접적인 에너지 공급뿐 아니라 첨단 데이터 분석기술 기반의 에너지최적화 솔루션을 통해 기업의 에너지 비용을 절감해주는 종합에너지플랫폼 서비스 사업자로 거듭나게 됐다.그동안 사업다각화를 통해 화학산업에 성공적으로 진입했고, 울산GPS 등 발전사업과 KET 등 LNG터미널 사업까지 확장하는 등 종합에너지화학 기업으로 변신하고 있는 SK가스는 이번 솔루션 제공을 통해 기존 에너지공급 서비스의 질을 한 단계 높여 나간다는 복안이다.클라우드 기반의 솔루션(SaaS, Solution-as-a-Service) 형태로 제공되는 SK가스의 에너지효율화 서비스는 각 산업체에서 생성되고 축적되는 방대한 데이터를 분석해 AI 모델링을 하고 여기에 오퍼레이터들의 축적된 경험을 더해 최적의 솔루션을 찾아 에너지 소비를 최적화할 수 있게 한다.현재 국내 산업체들에서는 주로 오퍼레이터들의 경험을 토대로 에너지 절감 활동이 진행되고 있다. 기존에 도입한 '공장에너지관리시스템(FEMS, Factory Energy Management System)'은 사업장의 에너지사용 현황을 보여주거나 사전에 설정된 분석모델을 통해 사용패턴을 분석하는 수준에 그치는 것이 일반적이다.SK가스가 제공하는 솔루션은 AI 모델을 통해 실시간으로 에너지사용 현황과 생산과정의 데이터를 분석해 최적의 제어포인트를 필요할 때마다 수시로 제안한다. 여기에 현장의 경험 많은 오퍼레이터들의 노하우를 결합하는 과정이 반복됨으로써 숨겨진 효율 제고 가능 영역을 찾아내 지속적으로 성과를 낼 수 있게 한다.특히, 실시간으로 분석되는 에너지사용 현황에 대한 동일한 자료가 기업의 여러 담당자들에게 손쉽게 공유됨으로써 데이터기반의 기업의사결정 능력을 높일 수 있다. 이 솔루션을 이용할 경우 에너지비용 절감뿐 아니라 다양한 데이터분석을 통해 최적의 설비 규모 산출, 정기유지보수 성과분석, 설비와 생산과정의 이상 파악 등 다양한 부가적인 효과도 얻을 수 있다.이 솔루션의 가장 큰 장점은 소프트웨어 형태로 제공되기 때문에 초기 구축비용이 매우 저렴하고 단기간에 적용이 가능하다는 점이다. 아울러, 유틸리티 및 생산 공정 전반에 대한 분석을 통해 전기뿐만 아니라 스팀, 용수 등 공장의 제품 생산에 필요한 모든 에너지원에 대한 실시간 최적화를 달성할 수 있다.SK가스는 지난 2018년부터 국내 산업체들을 대상으로 메트론사의 솔루션을 적용한 시범사업을 진행해 다양한 에너지최적화 아이템을 발굴하는 등 국내 사업장 환경에서의 적용 가능성을 성공적으로 검증했다.SK가스는 이번 서비스 제공을 시작으로 국내외의 다양한 유망 에너지솔루션을 지속적으로 발굴하고 상용화를 추진해 SK가스 고유의 종합에너지서비스 플랫폼을 개발, 구축해 나갈 예정이다. SK가스 관계자는 ""새롭게 제공되는 이 서비스는 AI 분석기술과 인간의 축적된 경험이 결합돼 에너지관리 영역에서 스마트팩토리를 제대로 구현하는 것""이라며 ""다양한 업종의 에너지 최적화를 구현해 원가절감뿐만 아니라 온실가스배출 감소 등의 사회적 가치 제고에도 기여할 것""이라고 강조했다.한편, 프랑스의 메트론사는 에너지 데이터분석 솔루션전문 스타트업(Start-up)으로 현재 7개국(일본, 싱가포르, 이탈리아, UAE, 콜롬비아, 브라질, 멕시코)에 지사를 두고 22개국 100여개 이상의 공장에 에너지 효율화 서비스를 제공하고 있다. 2papers@newsis.com<ⓒ 공감언론 뉴시스통신사. 무단전재-재배포 금지>",/news/news_read.nhn?article_id=0009760435&office_id=003&mode=search&query=SK&page=7
▶ 네이버 홈에서 [한국경제TV] 채널 구독하기 [생방송보기]▶ 대한민국 재테크 총집결! - [증권 / 주식상담 / 부동산],"[한국경제TV 라이온봇 기자]17일 오전 SK케미칼(285130)이 급등세를 보이고 있다. SK케미칼은 친환경 소재 및 에너지, 바이오의약품 제조업체로 알려져 있다.-4.05% 하락출발한 주가는 꾸준히 상승하여 오전 10시 0분 현재는 전일대비 6.26% 수준인 5만7700원을 기록하고 있다.차트를 살펴보면 5일, 20일, 60일 이동평균선이 역배열 상태로 하락 추세를 이어오다가 주가가 반등하는 모습이다.거래량은 전거래일 대비 64.52% 수준인 24만7064주를 넘어서고 있다.이 종목 전체 주식수의 2.1%에 해당하는 물량이다.이 시각 거래소에서 SK케미칼 이외에도 한독크린텍(6.81%), 네패스(5.85%), 까스텔바작(8.12%), 네오위즈(5.56%), 코나아이(5.32%) 등이 상승세를 보이고 있다.※ 본 기사는 한국경제TV와 `금융 AI 전문기업 씽크풀`이 실시간으로 작성한 기사입니다.라이온봇기자 ⓒ 한국경제TV, 무단 전재 및 재배포 금지",/news/news_read.nhn?article_id=0000856192&office_id=215&mode=search&query=SK&page=7
,"[서울경제] 오전 10시 0분 현재 총 18개 코스피 주요 업종 중 18개 업종이 내림세를 보이고 있는 가운데, (-4.49%), (-4.14%), (-3.43%)이 하락세를 보이고 있다. 반면
등은 상승 흐름을 보이고 있다.하락률이 가장 높은 은
외국인과 기관의 동반 매도세가 나타나고 있으며, 수급측면으로는 46(매도):54(매수)의 매수우위를 기록하고 있다. 한편 금융업은 최근 7일 동안 -17.40% 하락했으며(기간상승률 14위), 동일 기간 동안
외국인과 기관의 매도세가 강했던 것으로 나타났다. 내 주요 종목 동향을 보면 키움증권이 -0.54%로 약세를 보이고 있고, 유화증권(-0.49%), 상상인증권(-0.40%)이 역시 하락하는 추세다. 반면 웅진(+0.71%), SK디스커버리우(+0.41%), 부국증권(+0.32%) 등은 상대적으로 활발한 움직임을 보인 것으로 나타났다.이 시각 현재 외국인은 코스피시장에서 -1,341억 순매도를 기록 중이며, 과 을 주로 매수하고 있다.[이 기사는 증시분석 전문기자 서경뉴스봇(newsbot@sedaily.com)이 실시간으로 작성했습니다.]/서경뉴스봇 newsbot@sedaily.com저작권자 ⓒ 서울경제, 무단 전재 및 재배포 금지",/news/news_read.nhn?article_id=0003710657&office_id=011&mode=search&query=SK&page=7
,"[서울경제] 17일 오전 10시 0분 현재 코스피는 전일 대비 37.05p(-2.16%) 하락한 1677.81로, 48(매도):52(매수)의 매수우위를 기록 중이다. (※매수비율(%)=매수잔량/잔량합계*100, 매수우위=매수비율>매도비율)약세업종은 (-4.49%), (-4.14%), (-3.43%)이다. 수급측면으로는 이 26:74의 강한 매수우위세를 나타내고 있으며, 은 71:29의 강한 매도우위세를 기록 중이다.투자자별 동향을 살펴보면, 개인과 기관 동반 매수세를 보이고 있으나,
외국인의 '팔자' 기조에 밀리고 있다. 개인은 1,001억, 기관은 337억을 순매수 중이며, 외국인은 1,341억을 순매도하고 있다.종목별로는 이 6.74% 오른 1,900원을 기록 중이고, (+6.63%), (+6.29%)가 오름세를 보이고 있는 반면 (-12.59%), (-9.45%), (-9.06%) 등은 하락 중이다.현재 하락종목은 770개, 상승종목은 116개를 기록하고 있다.[이 기사는 증시분석 전문기자 서경뉴스봇(newsbot@sedaily.com)이 실시간으로 작성했습니다.]/서경뉴스봇 newsbot@sedaily.com저작권자 ⓒ 서울경제, 무단 전재 및 재배포 금지",/news/news_read.nhn?article_id=0003710658&office_id=011&mode=search&query=SK&page=7
,"증시가 17일 신종 코로나바이러스 감염증(코로나19) 사태로 급락하며 주요 대형주가 모두 약세인 가운데 현대차와 현대모비스가 4%대 하락률을 보이고 있다.이날 오전 9시 32분 현재 현대차는 전날 대비 3600원(-4.34%) 하락한 7만9300원에 거래되고 있다. 현대차는 장초반 5% 넘게 하락했다. 같은 시간 현대모비스도 7000원(-4.33%) 내린 15만3500원에 거래 중이다.코스피 대장주인 삼성전자(-2.15%), SK하이닉스(2.98%)도 이날 장초반 4% 넘게 빠지며 급락 출발했지만 소폭 반등한 상태다.간밤 미국 뉴욕증시가 13%대에 가까운 대폭락을 연출하면서 이날 코스피지수는 전날보다 74.02포인트(4.31%) 내린 1640.84로 개장했다. 2010년 6월 이후 최저치다. 코스닥지수도 전날보다 16.49포인트(3.27%) 내린 488.02로 출발했다. 2013년 12월 이후 최저다.데일리안 백서원 기자 (sw100@dailian.co.kr)ⓒ (주)데일리안 - 무단전재, 변형, 무단배포 금지",/news/news_read.nhn?article_id=0002389451&office_id=119&mode=search&query=SK&page=7
,"삼성, 현대차, SK, LG 등 4대 그룹 관련 주가 장 초반부터 급락, 최대 4% 가량 큰폭의 하락세를 보이고 있다.16일 오전 9시 52분 현재 삼성전자는 700원(-1.33%) 하락한 4만8250원에, 현대차는 3000원(-3.62%) 내린 7만9900원에 거래되고 있다. SK는 4500원(-3.09%) 내린 14만1500원에, LG는 2400원(-4.12%) 하락한 5만5900원에 거래 중이다.삼성전자는 4만6000원선까지 떨어졌고, 현대차는 8만원선이 깨졌다. SK와 LG도 최근 1년 새 최저 가격을 지속 경신 중이다.삼성전자는 지난 13일 4만원대로 떨어진 이후 회복하지 못하고 있는 상황이다. 4만6000원대까지 떨어진 것은 지난해 9월 이후 처음이다.현대차는 2009년 7월 이후 약 11년 만에 7만원대로 떨어졌다. 코로나19 확산과 유가하락으로 올해 연간실적 훼손이 불가피하다는 분석이 나왔다.SK는 최근 5년 새 13만원대를 찍은 것은 이날이 처음이다. LG도 최근 3년 새 5만5000원대까지 떨어진 적은 없었다.송창범 기자
 <저작권자 ⓒ '성공을 꿈꾸는 사람들의 경제 뉴스' 머니S, 무단전재 및 재배포 금지>",/news/news_read.nhn?article_id=0000518620&office_id=417&mode=search&query=SK&page=7
"코스피, 4%대 하락 출발 후 개인 매수에 점차 낙폭 축소코스닥, 3% 하락해 500선 붕괴 출발…이후 약보합선으로","[서울=뉴시스] 류병화 기자 = 코스피가 미국 증시의 12%대 폭락 여파에 4.5% 하락해 1650선 아래에서 출발했다. 이후 지수는 조금씩 낙폭을 좁히며 개장 초반 1660선에서 움직이고 있다. 17일 코스피지수는 전 거래일(1714.86)보다 74.02포인트(4.32%) 내린 1640.84에 출발했다. 지수는 개장 직후 4.49% 하락해 1637.88까지 내렸다. 이후 진정세를 보이며 오전 9시50분 현재 전일보다 2.92% 내린 1664.81을 가리키고 있다. 유가증권시장에서 개인은 홀로 1070억원어치를 사들이고 있다. 반면 외국인과 기관은 각각 1040억원, 61억원 매도 우위다.업종별로는 일제히 내림세다. 은행(-7.3%), 보험(-5.64%), 금융업(-5.26%), 운수장비(-5.13%), 증권(-4.95%), 기계(-4.79%), 철강금속(-4.31%), 건설업(-4.11%), 전기가스업(-4.04%), 운수창고(-3.71%) 등이 약세다.시가총액 상위 종목들도 모두 급락하고 있다. 대장주 삼성전자는 전 거래일 대비 1150원(2.35%) 내린 4만7750원에 거래되고 있다.SK하이닉스(-2.48%), 삼성바이오로직스(-3.72%), 네이버(-4.84%), LG화학(-4.16%), 셀트리온(-1.21%), 현대차(-4.10%), 삼성SDI(-3.16%), LG생활건강(-1.19%) 등이 약세를 보이고 있다.서상영 키움증권 연구원은 ""미국 증시는 신종 코로나바이러스 감염증(코로나19) 확진자수 증가 공포에 각국의 적극적인 지원 정책에도 지수 급락을 야기해 한국 증시에 부정적인 영향을 줄 것""이라며 ""공포에 장악된 심리적인 투매는 한국은행의 긴급 금리인하 등 적극적인 대응에도 불구하고 시장 안정을 찾지 못하게 할 개연성이 높기 때문""이라고 분석했다.코스닥지수는 전 거래일(504.51)보다 16.49포인트(3.27%) 내린 488.02에 개장했다. 지수는 낙폭을 축소하며 오전 9시50분 현재 전일 대비 0.79% 내린 500.51을 가리키고 있다.코스닥시장에서 개인은 홀로 1531억원어치를 팔아치우고 있다. 반면 외국인과 기관은 각각 1350억원, 203억원 매수 우위다.코스닥 시총 상위 10개 종목은 대체로 오름세다. 셀트리온헬스케어(1.74%), 에이치엘비(0.71%), 펄어비스(3.03%), 스튜디오드래곤(0.98%), 케이엠더블유(0.36%), 씨젠(7.41%), 휴젤(0.73%) 등이 오르고 있다. 반면 CJ ENM(-4.02%), 에코프로비엠(-1.28%), SK머티리얼즈(-1.20%) 등은 약세다.간밤
미국 뉴욕 증시는 코로나19 확산 여파에 경기 하방압력이 후반 이후까지 이어질 것이라는 경계감에 서킷 브레이커까지 발동되며 폭락해 마감했다.뉴욕증권거래소(NYSE)에서 이날 다우존스 30 산업 평균지수는 지난 13일 대비 2997.10 포인트, 12.93% 급락한 2만188.52로 폐장했다.스탠더드 앤드 푸어스(S&P) 500 지수는 324.89포인트(11.98%) 크게 밀려난 2386.13으로 거래를 끝냈다. 기술주 중심의 나스닥 종합지수는 970.28포인트(12.32%) 대폭 떨어진 6904.59로 장을 닫았다. hwahwa@newsis.com<ⓒ 공감언론 뉴시스통신사. 무단전재-재배포 금지>",/news/news_read.nhn?article_id=0009760478&office_id=003&mode=search&query=SK&page=7
≪이 기사는 03월17일(00:47) 자본시장의 혜안 ‘마켓인사이트’에 게재된 기사입니다≫,"국내 의결권 자문사인 좋은기업지배구조연구소가 SK하이닉스의 정기 주주총회 안건에 대해 무더기 반대표 행사를 권고했다.17일 증권업계에 따르면 좋은기업지배구조연구소는 SK하이닉스가 추천한 감사위원회 위원 후보자에 대한 반대 의견을 밝혔다. SK하이닉스는 오는 20일 정기 주총에서 하영구 전 전국은행연합회장을 2년 임기의 신규 감사위원으로 선임할 예정이다.한국씨티은행장을 지난 하 전 회장은 현재 김앤장법률사무소 고문으로 재직하고 있다. 김앤장법률사무소는 SK하이닉스와 계열사에 대한 다양한 법률 대리 및 자문 업무를 수행하고 있다. 좋은기업지배구조연구소 관계자는 ""하 전 회장의 경우 감사위원으로서 독립성이 결여됐다고 판단해 반대표 행사를 권고한다""고 말했다.아울러 좋은기업지배구조연구소는 SK하이닉스가 상정한 이사 보수 한도 승인 안건에 대해서도 반대 의견을 나타냈다. 독립된 보수 심사기구가 없다는 이유에서다. SK하이닉스는 올해 이사 9명에 대해 120억원의 보수 한도를 책정했다. 지난해에도 이사 9명에 대해 120억원을 책정했으며, 실제 지급된 보수 총액은 44억4300만원이다.또 주식매수선택권(스톡옵션) 부여 승인 안건에 대해선 ""행사 가격과 성과가 연동되지 않는다""는 이유로 반대 의사를 밝혔다. SK하이닉스는 오종훈 글로벌세일즈마케팅(GSM) 담당 부사장에게 보통주 5409주의 스톡옵션을 부여하기로 했다. 행사 기간은 2023년 3월 21일부터 2027년 3월 20일까지다. SK하이닉스 관계자는 ""기업가치 극대화를 위해 중요한 역할을 담당하는 사내이사에게 스톡옵션을 부여해 기업의 장기적인 가치 제고를 추진하려는 것""이라고 설명했다.김은정 기자 kej@hankyung.com▶ ▶
 ▶
ⓒ 한국경제 & , 무단전재 및 재배포 금지",/news/news_read.nhn?article_id=0004307671&office_id=015&mode=search&query=SK&page=7
코로나19 여파로 세계 경기 우려 높아져 목표주가 조정 나서삼성전자·SK하이닉스·네이버·셀트리온·현대차 등 목표주가↓,"[서울=뉴시스] 김동현 기자 = 국내 코스피에서 시가총액 10위에 이름을 올린 종목 중 7개 종목의 목표주가가 신종 코로나바이러스 감염증(코로나19) 확산 이후 낮아진 것으로 집계됐다. 17일 금융투자업계에 따르면 하나금융투자는 삼성전자를 반도체 대형주 최선호주에서 차선호주로 변경한다며 목표주가를 종전 6만7000원에서 6만3000원으로 하향조정했다. 하나금투는 코로나19 여파로 대외 활동 자제와 노동 집약적 생산라인의 가동 지연이 이뤄지고 있다는 점을 고려할 때 노트북 PC 및 스마트폰의 출하량이 역성장할 수 있다고 예상했다. 시총 2위 SK하이닉스도 코로나19 확산 이후 증권사 3곳에서 목표주가를 낮췄다. 하나금융투자가 7.14% 낮춘 10만4000원을 제시했고 신한금융투자와 유진투자증권이 각각 7.41%, 8.00% 낮춘 12만5000원, 11만5000원을 설정했다. SK하이닉스의 경우 코로나19 여파로 글로벌 반도체 수요와 공급 불확실성이 커진 상황에서 미국에서 코로나19 확산으로 실적 악화가 현실화될 수 있다는 점 등이 목표주가 하향 조정의 근거로 제시됐다. 시가총액 5위에 이름을 올리고 있는 네이버의 목표주가도 NH투자증권이 지난 11일 종전 제시액보다 4.00% 낮춘 24만원의 목표주가를 제시했다. NH투자증권은 광고 시장 부진에 따른 성장세 둔화가 예상되는 점을 고려해 목표주가를 소폭 하향 조정했다고 설명했다. 시가총액 7위에 올라와 있는 셀트리온의 목표주가도 낮아졌다. 신한금융투자는 지난달 28일 이 회사 목표주가로 21만원을 제시했다. 이는 종전 제시액보다 19.23% 낮아진 수치다. 신한금투는 셀트리온이 판매하고 있는 전 품목의 고른 성장에 수익성 개선이 기대되지만 현재 시장 상황을 감안해 목표주가를 낮춰 설정했다는 입장이다. 코스피 시총 8위에 올라와 있는 현대차도 3월들어 메리츠종금증권과 유진투자증권, 삼성증권이 목표주가를 각각 종전 제시액 대비 12%, 12.5%, 14.7% 하향 조정했다. 조정된 목표주가는 14만5000원, 16만원, 14만5000원 등이다. 현대차의 목표주가 하향은 코로나19 여파가 전세계 소비심리 위축 및 판매감소까지 확산되고 있어 실적 악화가 불가피할 것이라는 관측에서 비롯됐다. 시총 10위인 LG생활건강의 목표주가도 줄줄이 하락하고 있는 중이다. 대신증권(-10.59%), 신영증권(-6.25%), 한국투자증권(-8.24%), 하나금융투자(6.25%), DS투자증권(-3.47%), KB증권(-5.00%), SK증권(5.71%) 등이다. 목표주가를 낮춘 증권사들은 코로나19 영향으로 1분기 중국과 국내 면세점 매출이 큰 폭으로 역신장할 수 있으며 고정비 부담으로 전 채널 이익률이 감소될 수 있다는 분석을 제시했다. 이외에도 시총 4위 삼성바이오로직스, 6위 LG화학, 9위 삼성SDI 등에 대한 증권사 목표주가 조정은 상승 또는 유지로 제시되고 있는 것으로 확인됐다. 증권업계 관계자는 ""코로나19 여파로 글로벌 경기 악화를 예상하는 글로벌 조사기관 또는 정부들이 많아짐에 따라 최근 들어 목표주가를 낮춰 제시하는 리포트가 많아진 것 같다""고 말했다. oj1001@newsis.com<ⓒ 공감언론 뉴시스통신사. 무단전재-재배포 금지>",/news/news_read.nhn?article_id=0009760500&office_id=003&mode=search&query=SK&page=7
