head,text,url
,"[이데일리 박종오 기자] 지난주 국내 증시에서 주가가 가장 많이 오른 중소형 종목은 코오롱생명과학(102940)인 것으로 집계됐다. 1주 새 무려 2배 넘게 뛰었다. 관절염 유전자 치료제인 ‘인보사(인보사케이주)’의 미국 임상 3상 시험 재개로 미국 내 신약 시판이라는 기사회생의 기회를 잡았기 때문으로 풀이된다. 20일 SK증권에 따르면 지난주 코스피(유가증권)·코스닥시장에 상장된 시가총액 1000억원 이상~1조원 미만 중·소형주 가운데 주가 상승률 1위를 기록한 종목은 코오롱생명과학이었다. 지난 10일 1주당 2만700원이던 주가가 17일 종가 기준 4만8950원으로 무려 136.5% 급등했다. 코오롱생명과학은 인보사 개발과 미국 현지 임상 시험 등을 담당하는 코오롱티슈진(950160) 지분 12.55%를 보유하고 있다. 코오롱티슈진은 지난해 5월 인보사 논란으로 상장 적격성 실질 심사 대상이 되며 주식 거래가 정지됐다. 그러자 거래가 가능한 코오롱생명과학 주가가 대신 뛴 것이다. 코오롱티슈진의 최대 주주인 코오롱(002020)(지분율 27.21%) 주가도 50.9% 치솟으며 지난주 주가 상승률 2위를 차지했다. 인보사는 주사제의 2액 성분이 연골 성분이 아닌 신장(콩팥) 유래 세포라는 사실이 드러나 지난해 미국 식품의약국(FDA)이 임상 3상을 중단시켰었다. 그러나 지난 11일 FDA가 3상 보류 결정을 해제하며 11개월여 만에 미국 내 임상 시험을 계속할 수 있게 됐다. 자료=SK증권아난티(025980)(44.6%↑), 가비아(079940)(41.3%↑), 이수화학(005950)(37.9%↑) 등이 코오롱 그룹주 다음으로 주가가 많이 올랐다. 아난티는 총선 이후 남북 경협 및 대북 인도적 지원 재개 기대감이 주가에 반영됐다. 정보기술(IT) 인프라 서비스 전문 업체인 가비아는 인터넷 트래픽 증가 수혜 주로 꼽히며 주가가 올랐다. 이수화학은 신종 코로나 바이러스 감염증(코로나19)으로 인한 손 소독제 원료 ‘아이소프로필알코올(IPA)’ 수요 증가 기대감이 주가 상승의 동력이 됐다. 반면 지난주 주가가 가장 많이 내린 중소형 종목은 오상자이엘(053980)이었다. 한 주 새 32.6% 빠졌다. 신풍제약(019170)(31.6%↓), 수젠텍(253840)(23.5%↓), 한창제지(009460)(23.4%↓), EDGC(245620)(22.1%↓) 등도 급락세를 보였다. 코로나19 진단키트, 치료제 등 코로나 테마주 주가가 전반적으로 조정을 받은 것으로 분석된다. 나승두 SK증권 중소성장기업분석팀 연구원은 “이번 주에는 국가별 주요 경제 지표와 국내·외 주요 기업 실적 발표가 이어질 예정”이라며 “코로나19 영향과 그 파급 효과에 촉각을 기울일 필요가 있다”고 했다.박종오 (pjo22@edaily.co.kr)＜ⓒ종합 경제정보 미디어 이데일리 - 무단전재 & 재배포 금지＞",/news/news_read.nhn?article_id=0004623105&office_id=018&mode=search&query=SK&page=9
,"[이데일리 최정희 기자] 하나금융투자는 국내 투자자 관점에서 반도체 업종은 지난 한 달 간 계륵 같은 업종이라고 설명했다. 벤치마크인 코스피보다 수익률이 낮으나 코스피가 1900선으로 올라온 이상, 삼성전자(005930), SK하이닉스(000660)가 추가 상승할 가능성은 높지 않기 때문이다. 김경민 하나금융투자 연구원은 20일 보고서에서 “코스피 1개월 수익률은 14.5%인 반면 KRX 반도체 업종의 수익률은 9.4%로 반도체 업종의 1개월 수익률이 벤치마크 수익률을 하회했지만 그렇다고 반도체 업종의 비중을 줄이기에는 아까운 상황”이라고 밝혔다. SK하이닉스를 기준으로 분기 실적이 적어도 2분기까지 우상향한다는 점 때문이다. 김 연구원은 “신종 코로나 바이러스 감염증(코로나19) 발발이 하반기 수요에 어느 정도 영향을 미칠지, 주문 축소가 얼마나 발생할지 가늠하기 어려운 환경에서 일단 눈앞에 드러나는 실적이 양호하다는 점이 부각되고 있다”고 설명했다. 반도체 업종 중소형주에선 실적이 견조한 공정소재 공급사는 아웃퍼폼했다. 1개월 기준 티씨케이(064760)는 21.1% 올랐고 이엔에프는 19.6%, 원익머트리얼즈(104830)는 19.1% 상승했다. 김 연구원은 “코스피 지수가 1914.53까지 상승해버린 것은 반도체 섹터 담당 애널리스트에게 부담 요인”이라며 “시가총액 상위주인 삼성전자, SK하이닉스가 추가적으로 상승할 것이라고 주장하기 어렵기 때문”이라고 설명했다. 이어 “이런 주장이 설득력을 얻고 실제 주가에 영향을 끼치려면 연간 실적 컨센서스가 더 이상 하향 조정되지 않는다는 시그널이 등장했거나 악재가 주가에 모두 반영됐다는 시그널이 필요하다”고 덧붙였다. 일단 연간 실적 컨센서스의 경우 삼성전자는 한 차례 이상 하향 조정될 가능성이 높다. 2분기 스마트폰 판매량에 대한 눈높이가 낮아질 것으로 보이기 때문이다. 악재의 주가 반영 여부의 경우 1분기 기준으로 펀더멘털 요인 관련 악재는 주가에 반영된 상태다. 필라델피아 반도체 지수 편입 종목 중에서 애플 관련주, 아날로그 반도체 공급사, 공정장비 공급사가 분기 실적 가이던스를 하향 조정하거나 철회해 어닝 쇼크 가능성을 줄였다. 하반기 실적은 상반기에 비해 악영향이 덜 할 것으로 예측되지만 뚜껑은 열어봐야 한다는 불확실성이 남아 있다. 김 연구원은 “반도체 업종의 주가가 조정을 받더라도 조정폭은 제한적”이라며 “지수의 주도주가 ‘코로나 수혜주’에서 ‘코로나 피해주’로 바뀌더라도 반도체 업종의 주도적 지위는 유지될 전망”이라고 설명했다. 이어 “모바일 수요가 바닥을 통과한다면 하반기 실적의 가시성이 안정화되므로 주도주로서의 위상이 유지될 것으로 전망된다”고 덧붙였다.최정희 (jhid0201@edaily.co.kr)＜ⓒ종합 경제정보 미디어 이데일리 - 무단전재 & 재배포 금지＞",/news/news_read.nhn?article_id=0004623113&office_id=018&mode=search&query=SK&page=9
,"인천 ‘부평 SK뷰 해모로’ 현장 부지에 모듈을 조립하고 있다. 제공|SK건설[스포츠서울 김효원기자]SK건설은 지난 17일 국내 최초 모듈러 공법을 적용한 친환경 현장사무실 개소식 행사를 가졌다. 모듈러 공법은 현재 주목받고 있는 스마트 건축 기술 중 하나로, 단위 모듈을 외부 공장에서 사전 제작해 건설 현장으로 옮겨와 조립하는 기술이다.SK건설은 다음 달 분양 예정인 인천 ‘부평 SK뷰 해모로(SK VIEW 해모로)’ 현장 부지에 총 22개의 모듈을 활용해 740m2(약 224평) 규모의 현장사무실을 설치했다. 모듈러 공법으로 인해 기존보다 50% 이상 설치기간을 단축해 모듈 설치에 이틀이 걸렸다.주요 공정이 외부 공장에서 진행돼 균일한 품질 확보가 가능하고 현장 내 소음·분진 등의 공해가 없다. 현장사무실 이용이 끝난 후에도 모듈을 다른 현장에서 재활용할 수 있어 폐자재 발생을 70~80% 절감할 것으로 기대하고 있다.현장 구성원의 쾌적한 근무 환경을 위해 회의실, 사무실, 샤워실, 휴게실 및 화장실 등 내부 공간설계를 특화하고 외관 디자인에도 차별성을 두었다. 현장사무실 옥상에는 태양광 발전시스템을 설치해 사용 전력의 일부분을 친환경 신재생에너지로 대체했다. 전승태 SK건설 건축주택사업부문장은 “이번 현장사무실은 OSC(Off-Site Construction)개념을 도입한 첫 프로젝트로, 향후 이해관계자의 행복과 사회적 가치 실현을 위한 다양한 솔루션을 담아 건설산업의 진화모델을 제시하겠다”고 말했다.SK건설은 앞으로도 모듈러 공법과 같은 OSC 기반을 적극 확대해 지식산업센터와 물류센터 등에도 스마트건축을 본격화할 예정이다.eggroll@sportsseoul.com[기사제보 news@sportsseoul.com]
Copyright ⓒ 스포츠서울&",/news/news_read.nhn?article_id=0000649886&office_id=468&mode=search&query=SK&page=9
"""SK브로드밴드, ADT 캡스 등 시장에서 가치 인정받을 것""코로나19 영향으로 1분기 영업이익 감소는 불가피","[이데일리 고준혁 기자] 삼성증권은 SK텔레콤(017670)이 신종 코로나 바이러스 감염증(코로나19)에도 안정적인 매출을 올릴 수 있을 것으로 평가했다. 쇼핑몰 11번가가 흑자를 유지하고 있고 보안 사업 또한 올해 중반기 이후 성장이 예상되기 때문이다. 올해부터 이동통신(MNO) 사업과 신성장사업(뉴비즈)을 양대 축으로 삼는 듀얼OS 체제를 도입, 전반적인 효율성도 증대될 것으로 보인다. 이에 투자의견 ‘매수(Buy)’와 목표가격 30만원을 유지했다. 1분기 연결 기준 매출은 4조4680억원으로 전년 대비 3.1% 증가하고 같은 기간 영업이익은 2938억원으로 8.9% 감소해 시장 전망치에 부합할 것으로 전망된다. 이익이 줄어든 것은 코로나19의 영향을 피할 수 없었기 때문으로 풀이된다.최민하 삼성증권 연구원은 “코로나19 영향으로 오프라인 판매가 위축돼 5세대(5G) 가입자수 증가 속도는 당초 기대보단 낮을 것”이라며 “감가상각비 등 비용 증가 추세는 이어져 영업이익 감소는 예견된 부분”이라고 평가했다. 이어 “1분기말 가입자수는 263만명으로 전분기 대비 54만명 증가했으나 이는 지난해 3분기와 4분기 기준 늘어난 가입자수에 비하면 감소한 것”이라며 “마케팅비를 28개월에 걸쳐 안분 인식하는 회계 기준상 1분기 인당 가입자 유치비용은 줄었음에도, 마케팅비용이 전분기 대비 늘어날 것”이라고 설명했다. SK브로드밴드와 티브로드의 합병 효과가 클 것으로 기대되는 등 자회사의 안정적인 성장으로 전체 기업 가치가 높아질 전망이다. 최 연구원은 “시장 상황을 고려해 상장 추진 일정이 밀리긴 했지만 SK브로드밴드, ADT캡스 등은 시장에서 가치를 인정받아 전체 기업가치 제고를 견인할 가능성이 높다”고 분석했다.고준혁 (kotaeng@edaily.co.kr)＜ⓒ종합 경제정보 미디어 이데일리 - 무단전재 & 재배포 금지＞",/news/news_read.nhn?article_id=0004623159&office_id=018&mode=search&query=SK&page=9
,"[아시아경제 박소연 기자] SK이노베이션이 중국 베이징자동차그룹의 프리미엄 전기차 브랜드 아크폭스 스포츠유틸리티차량(SUV) '마크5'에 탑재될 전기차 배터리를 공급한다.20일 업계에 따르면 마크5는 SK이노베이션과 베이징자동차, 베이징전공이 합작해 중국 장쑤(江蘇)성 창저우(常州)에 설립한 배터리 공장 'BEST'에서 생산하는 배터리를 적용한다.해당 배터리(NCM811)는 배터리 양극재 핵심 원료인 니켈과 코발트, 망간 비율이 각각 80%, 10%, 10%다.마크5는 1회 충전에 최대 450∼500㎞를 달릴 수 있는 3세대 전기차로 올해 하반기에 출시된다.관련 업계에서는 한국 업체에 유독 진입장벽이 높은 중국 시장을 배터리 기술력으로 개척했다는 평가가 나온다.한편 SK이노베이션은 중국 창저우시에 이어 옌청에 추가 공장을 지으며 현지 투자에 매진하고 있다. 세계 최대 전기차 시장인 중국 공략을 위해서다. 미래에셋대우 리서치센터는 중국 전기차 판매량이 올해 150만대에서 2025년 580만대로 커질 것으로 전망했다.박소연 기자 muse@asiae.co.kr <ⓒ경제를 보는 눈, 세계를 보는 창 아시아경제 무단전재 배포금지>",/news/news_read.nhn?article_id=0004664141&office_id=277&mode=search&query=SK&page=9
-60년 업력 美 ‘벤틀리 네바다’와 협업-LTE·클라우드로 실시간 무선 모니터링-점검·보수 기간 및 운영 비용 절반 감소,"[헤럴드경제=정태일 기자] 제조 현장에서 발생하는 진동으로 설비 이상 여부를 실시간 확인하는 신개념 서비스가 나왔다.SK C&C는 제조 설비의 진동 데이터를 무선으로 실시간 분석·진단하는 ‘진동 감지 서비스’를 선보인다고 20일 밝혔다.SK C&C는 이번 서비스 개발을 위해 설비 감시 및 보호 분야의 세계적 선두 기업 벤틀리 네바다와 협업했다.벤틀리 네바다는 베이커 휴즈의 자회사로 60년 이상의 업력을 보유하고 있다. 전 세계적으로 22만5000개가 넘는 기계 진단 프로젝트를 진행했다.제조 공장의 회전 설비에서 진동이 발생하면 센서가 이를 감지해 LTE(롱텀에볼루션) 무선망을 통해 클라우드로 전송한다. 확보된 데이터를 실시간으로 분석·진단해 필요한 조치 사항을 안내하는 것이 이번 서비스의 핵심이다.특히 기존에는 설비 감시 시스템이 유선으로 연결됐지만, SK C&C 서비스는 무선 중심이어서 장비·설비의 상태에 따른 실시간 정비가 가능해졌다. 설비 고장 시 생산 손실 비용이 큰 반도체·디스플레이·플랜트 등에 맞춤형으로 구축됐다.여러 공장의 다양한 설비들을 확인하며 이상 유무를 한 눈에 파악할 수 있는 것도 특징이다.설비가 빨간색으로 표시되면 즉시 점검이 요구되는 이상 상황이다. 녹색은 수 일내 점검이 요구되는 경고 표시다. 이상 경고가 뜨면 장비 별 담당자의 스마트폰과 모니터링 장비 등에 설비 점검 알림이 즉시 전달된다.이와 함께 데이터 수집기, 무선통신 모듈, 방폭 기능의 기기·센서만 설치하면 공장 형태 관계 없이 적용되도록 표준화 했다.실제 시범 도입된 생산 공장의 경우 정기 설비 점검 및 보수 기간 등이 기존 대비 절반 이상 단축됐다. 도입 비용도 기존 유사 시스템 구축 대비 절반 이상 줄었다고 SK C&C는 설명했다.유해진 SK C&C 제조디지털 부문장은 “향후 온도, 압력 등으로 데이터 분석 범위를 넓혀 국내 제조 산업의 예지정비 수준을 높일 것”이라고 말했다.killpass@heraldcorp.com
- Copyrights ⓒ 헤럴드경제 & heraldbiz.com, 무단 전재 및 재배포 금지 -",/news/news_read.nhn?article_id=0001663809&office_id=016&mode=search&query=SK&page=9
하반기 출시 '마크5'에 NCM811 탑재,"SK이노베이션 전기자동차 배터리가 중국 베이징자동차그룹의 프리미엄 전기차 브랜드 아크폭스(ARCFOX) SUV '마크5'에 탑재된다.20일 업계에 따르면 SK이노베이션과 베이징자동차, 베이징전공이 합작해 중국 장쑤성 창저우에 설립한 배터리 공장 'BEST'에서 생산된 배터리는 마크5에 적용된다.탑재되는 배터리(NCM811)는 배터리 양극재 핵심 원료인 니켈과 코발트, 망간 비율이 각각 80%, 10%, 10%다. 통상적으로 니켈 비중이 높으면 먼 거리를 주행할 수 있지만 안전성이 낮아진다SK이노베이션은 니켈 비중을 높이면서 안전성을 높이는 안정화면에서 선도 기술을 보유해 양산하고 있다. 또한 NCM811보다 진화한 배터리(NCM9 1/2 1/2)도 지난해 세계 최초로 개발했다.마크5는 1회 충전에 최대 450∼500㎞를 달릴 수 있는 3세대 전기차로 올해 하반기에 출시된다.데일리안 박유진 기자 (rorisang@dailian.co.kr)ⓒ (주)데일리안 - 무단전재, 변형, 무단배포 금지",/news/news_read.nhn?article_id=0002397083&office_id=119&mode=search&query=SK&page=9
"개인, 하락장에서도 장초반부터 1000억원대 매수시총상위株 약세 우위…카카오 1%대↑","[이데일리 이슬기 기자] 20일 코스피 지수가 하락 출발했다. 미국 경제 재개 기대감으로 상승했던 부분들이 소폭 되돌림을 보이고 있는 것으로 해석된다.마켓포인트에 따르면 이날 오전 9시 7분 현재 코스피 지수는 전 거래일 대비 0.3%(5.77포인트) 떨어진 1908.76에 거래 중이다. 이는 지난 17일 미국 경제 재개 기대감이 코스피 지수가 3%대 상승한 것을 소폭 되돌리는 과정인 것으로 분석된다.지수가 소폭 하락하고 있음에도 불구하고 개인은 나홀로 매수세를 보이고 있다. 개인은 장 초반부터 1354억원 가량의 주식을 사들이며 강한 매수에 나서고 있다. 반면 기관과 외국인은 1193억원, 176억원 가량의 주식을 순매도 중이다.업종 별로 보면 대부분이 내림세를 띄고 있다. 은행업종은 1%대 하락 중이다. 전기전자, 운송장비, 제조, 증권, 의약품, 보험 등의 업종이 1% 미만의 하락세를 보이고 있다. 반면 전기가스, 섬유의복 업종은 1%대 오르고 있고, 통신, 기계, 서비스업 등은 1% 미만의 오름세를 보이고 있다.시가총액 상위종목들도 내리는 종목이 더 우세하다. SK하이닉스(000660) 셀트리온(068270) 현대차(005380)는 1%대 하락 중이다. 삼성전자(005930) 현대모비스(012330) LG화학(051910) 삼성물산(028260) LG생활건강(051900) 삼성바이오로직스(207940)는 1% 미만의 하락세를 보이고 있다. 반면 카카오(035720)는 1%대 오르고 있고, NAVER(035420) 삼성SDI(006400) POSCO(005490) SK텔레콤(017670)은 1% 미만으로 오르고 있다.이슬기 (surugi@edaily.co.kr)＜ⓒ종합 경제정보 미디어 이데일리 - 무단전재 & 재배포 금지＞",/news/news_read.nhn?article_id=0004623185&office_id=018&mode=search&query=SK&page=8
▶ 헉! 소리나는 스!토리 뉴스 [헉스]▶ '아는 척'하고 싶은 당신을 위한 [두유노우],"SK매직이 한국경영인증원(KMR) 주관 ‘2020 이노스타-그린스타’ 인증에서 정수기, 식기세척기, 가스레인지, 전기레인지, 공기청정기, 비데 등 총 6개 품목에서 1위로 선정됐다고 20일 밝혔다.
 이노스타 인증은 한국경영인증원에서 자체 개발한 지수를 통해 혁신성을 평가하는 제도로, SK매직은 이번 인증에 정수기, 전기레인지, 식기세척기 3개 품목이 소비자와 전문가를 대상으로 한 조사에서 가장 높은 성적을 받아 1위로 뽑혔다.
 저수조를 없애고 정수기 유로(물길) 전부를 스테인리스로 바꾼 ‘올인원 직수 정수기’는 정수기 부문에서 5년 연속 수상 영예를 안았으며, 인덕션 히팅 방식으로 3구 모두 터보 기능을 갖춘 ‘3구 프리미엄 인덕션 전기레인지 매직콘트롤’도 2년 연속 수상 쾌거를 거뒀다. 또 지난 1월 출시돼 5분에 1대 팔릴 만큼 시장서 돌풍을 일으키고 있는 ‘트리플케어 식기세척기’도 지난해 11월 세계 최대 가전 전시회 '2020 CES'에서 'CES 혁신상'을 수상한데 이어 다시 한 번 혁신성을 인정받았다.
 친환경 상품과 서비스를 평가하는 그린스타 인증에는 공기청정기, 가스레인지, 비데 3개 품목이 1위로 선정됐다. SK매직은 연소 중 CO(일산화탄소) 농도를 혁신적으로 저감시킨 ‘에코버너 가스레인지’로 9년 연속 수상 쾌거를 거뒀다. 이 밖에 국내 최초 스마트센서와 모션기술 등 최첨단 기능이 탑재된 ‘모션 공기청정기(4년 연속)’와 버블 세정과 전해수 살균으로 물통부터 도기까지 5중으로 살균 가능한 ‘도기살균 버블세정 비데(5년 연속)’도 1위로 선정되며 친환경 경쟁력을 인정받았다.
 SK매직 관계자는 “고객 가치를 최우선으로 한 친환경, 혁신 제품을 선보이기 위해 지속적으로 노력해왔다”며 “앞으로도 소비자가 믿고 선택할 수 있는 제품을 개발할 수 있도록 혁신과 개선을 계속 이어 나갈 것”이라고 말했다.
 한편 SK매직은 ‘2020 이노스타-그린스타’ 1위 선정을 기념해 온라인 이벤트를 진행한다. 이벤트는 누구나 참여 가능하며 SK매직 공식 포스트를 통해 오는 21일까지 ‘이노스타-그린스타’ 인증 제품을 선택 후 선정 이유를 댓글 형식으로 작성하면 된다.
 추첨을 통해 15명에게 백화점 상품권, 영화관람권 등 푸짐한 경품을 제공한다. 또 공식 페이스북을 통해 ‘수상 제품명 맞추기’ 이벤트를 오는 29일까지 추가로 진행하며 당첨자 20명에게는 스타벅스 기프티콘을 증정한다.



 ※ 저작권자 ⓒ 파이낸셜뉴스. 무단 전재-재배포 금지",/news/news_read.nhn?article_id=0004410897&office_id=014&mode=search&query=SK&page=8
,"코스피가 외국인과 기관의 동반 팔자에 약보합권에서 출발하고 있다.20일 오전 9시 3분 현재 코스피는 전 거래일 대비 3.61포인트(0.19%) 내린 1910.92를 기록하고 있다.이날 6.19포인트(0.32%) 하락 출발한 지수는 장 초반 1900포인트 부근 약보합권에서 거래되고 있다. 지난주 한국 증시는 코로나 여파로 인한 미국 실물 지표 및 기업 실적 부진에 불구하고 경제 재개 기대감이 지속되면서 상승했다. 주 초반 OPEC+의 감산 합의에 불구 유가 변동성이 이어지면서 부담을 보였지만 경제 재개 기대감이 유지되면서 낙폭은 제한됐다. 코스피는 2.89% 상승한 1914.53에, 코스닥은 3.85% 오른 634.79에 마감했다.서상영 키움증권 연구원은 ""한국 증시는 부진한 실적과 경제지표 결과 여파로 미 증시의 부진이 예상되고 있어 조정을 보일 것""이라면서 ""특히 지난 2월 19일 S&P500 기업들의 12개월 선행 주가수익비율(PER)이 19배를 기록한 이후 코로나19 여파로 급락했던 전례가 있어 17일 기준 PER이 19배를 넘어섰다는 점에서 미 증시는 악재성 재료에 민감한 반응을 보일 것으로 예상되기 때문""이라고 말했다. 특히 지난 17일 경제 재개 기대가 높아지자 그동안 상승을 이끌었던 아마존 등 일부 기업들이 부진을 보였던 점을 감안 차익 욕구 확산 우려 또한 배제할 수 없다고 진단했다.서 연구원은 ""더 나아가 21일 선물 만기를 앞두고 있는 WTI의 변동성 확대가 이어지는 등 상품 선물 시장의 변화도 부담""이라며 ""17일 연준이 발표한 국채 매입 규모 축소(주간 1500억달러→750억달러)도 투자심리 위축을 야기할 것으로 예상한다""고 덧붙였다.이날 유가증권시장에서는 업종별로 은행, 의약품, 전기전자, 화학 등이 내리고 있고
섬유의복, 전기가스업, 통신업, 비금속광물, 의료정밀 등은 오르고 있다.매매주체별로 외국인과 기관이 각각 145억원, 789억원 순매도 중이고 개인은 925억원 순매수 중이다. 프로그램 매매는 587억원 매도 우위다.시가총액 상위 종목들은 대체로 부진하다. 삼성전자, SK하이닉스, 삼성바이오로직스, 셀트리온, LG화학, 현대차, LG생활건강, 삼성물산, 현대모비스 등이 내리고 있고 NAVER, 삼성SDI, SK텔레콤 등이 오르고 있다.이날 유가증권시장에서는 442개 종목이 오르고 있고 318개 종목이 내리고 있다.코스닥은 전 거래일 대비 2.06포인트(0.32%) 오른 636.85를 기록 중이다.[디지털뉴스국 김경택 기자] [ⓒ 매일경제 & mk.co.kr, 무단전재 및 재배포 금지]",/news/news_read.nhn?article_id=0004559855&office_id=009&mode=search&query=SK&page=8
