title,url,press,summary,date
"""게임·인터넷株 코로나에도 선방할 듯… 엔씨소프트 성장 기대""",/news/news_read.nhn?article_id=0003513994&office_id=023&mode=search&query=엔씨소프트&page=1,조선일보,"안 연구원은 게임주 가운데에서도 엔씨소프트를 추천했다. 안 연구원은 ""작년 말 출시한 신작 게임인 '리니지2M'의 성과가 양호하고, 하반기 중 ...",2020-03-11 03:12
"매도 행렬 외인, 삼성전기·한진칼은 샀다",/news/news_read.nhn?article_id=0009749667&office_id=003&mode=search&query=엔씨소프트&page=1,뉴시스,"다음으로 삼성전자우(8068억원), 현대차(659억원), 삼성SDI(594억원), LG화학(508억원), SK이노베이션(322억원), SK(18...",2020-03-11 06:24
"증시 바닥론 '솔솔'…""아직은 신중""",/news/news_read.nhn?article_id=0000854584&office_id=215&mode=search&query=엔씨소프트&page=1,한국경제TV,"LG전자, 엔씨소프트, 농심, 덕산네오룩스, 콜마비앤에이치 등 최근 한 달간 주가 수익률이 양호했고, 1분기 외에도 연간 실적 전망치가 상향 조...",2020-03-11 10:39
[단독] 본격 상장 속도 내는 크래프톤…中사모펀드도 440억 베팅,/news/news_read.nhn?article_id=0004640701&office_id=277&mode=search&query=엔씨소프트&page=1,아시아경제,"앞서 크래프톤은 넥슨과 엔씨소프트, 넷마블 등 '3N' 만이 가능했던 매출 1조원을 2018년에 돌파하며 게임업계 빅4로 부상했다. 자회사 펍지...",2020-03-11 11:26
넷마블 'A3' 출격...韓게임 자존심 지킬까,/news/news_read.nhn?article_id=0003708251&office_id=011&mode=search&query=엔씨소프트&page=1,서울경제,"11일 기준 엔씨소프트의 ‘리니지2M’과 ‘리니지M’이 각각 1위와 2위를 지키고 있지만, 릴리즈게임즈의 ‘AFK 아레나’(3위)와 ‘라이즈 오...",2020-03-11 17:37
