head,text,url
,"[머니투데이 유영호 기자] 현대자동차와 기아자동차가 글로벌 기후변화 대응 최우수 기업으로 선정됐다.현대·기아차는 글로벌 환경경영 인증기관 탄소정보공개 프로젝트(CDP)가 실시한 2019년도 평가에서 ‘탄소경영 아너스 클럽(Honors Club)’으로 선정됐다고 28일 밝혔다. 아너스 클럽은 국내 기업 중 평가점수 상위 5개사에만 주어지는 최우수 등급이다. 특히 현대차는 2018년도 평가에 이어 2년 아너스 클럽에 선정되는 영예를 안았다.CDP는 다우존스 지속가능성지수(DJSI), FTSE4GOOD 지수 등과 함께 기업의 지속가능성을 평가하는 가장 공신력 있는 지표로 인정받는다. 전 세계 금융투자기관의 위임을 받아 각국 주요 상장기업을 대상으로 기후변화, 수자원 등 글로벌 환경 이슈 대응 등을 평가한다. 평가는 △리더십A △리더십A- △매니저먼트B △매니저먼트B-(Management B-) 등 8개 등급으로 구분한다. 리더십A 중 평가점수 상위 5개사는 별도로 ‘탄소경영 아너스 클럽’으로 선정한다.현대차는 이번 평가에서 △수소전기차·전기차 등 친환경차 개발 및 보급 △사업장별 온실가스 고효율 감축 설비 도입 △아산공장·울산공장 태양광 패널 설치 △아산공장 무방류시스템 등 중장기적인 환경경영 강화 활동 등에서 높은 평가를 받아 탄소경영과 수자원 부문에서 리더십A 등급을 받았다. 기아차는 △친환경차 시장 확대 주도 △생산공정 고효율 모터 및 터보 냉동기, 공조기 개선 등을 통한 온실가스 감축 △투명한 탄소배출량 정보공개 △구체적인 탄소경영 추진 등 선제적인 기후변화 대응 노력을 인정받아 탄소경영 부문에서 리더십A 등급을 받았다.전 세계 8300여개의 기업을 대상으로 진행한 올해 평가에서 탄소경영 부문 리더십A 등급을 받은 기업은 총 181개사다. 한국 기업은 현대·기아차를 포함해 총 9개사다. 수자원 부문에서 리더십 A 등급을 받은 기업은 총 72개사로 한국 기업은 현대차를 포함해 총 2개사다.현대∙기아차 관계자는 “이번 평가에서 현대∙기아차 모두 최고의 성적을 받으며 지속가능경영의 모범이 됐다”며 “앞으로도 생산부터 판매에 이르는 가치사슬 효율화, 신재생에너지 사용 확대 및 사업장 온실가스 감축 등을 보다 적극적으로 시행해 나갈 예정”이라고 말했다. 유영호 기자 yhryu@mt.co.kr
<저작권자 ⓒ '돈이 보이는 리얼타임 뉴스' 머니투데이, 무단전재 및 재배포 금지>",/news/news_read.nhn?article_id=0004401428&office_id=008&mode=search&query=기아차&page=2
현대차 2년 연속 선정…수자원 관리부문 최우수상,"[서울=뉴시스] 박주연 기자 = 현대∙기아차가 세계적인 지속가능경영 평가기관으로부터 국내 기업 최고의 평가를 받았다. 현대자동차와 기아자동차는 글로벌 환경경영 인증기관인 '탄소정보공개 프로젝트(CDP)'가 실시한 2019년도 평가에서 국내 기업 중 평가점수 상위 5개사에만 주어지는 '탄소경영 아너스 클럽'에 선정됐다고 28일 밝혔다.탄소정보공개 프로젝트(CDP)는 다우존스 지속가능성지수(DJSI), FTSE4GOOD 지수 등과 함께 기업의 지속가능성을 평가하는 가장 공신력 있는 지표로 인정받고 있다.전세계 금융투자기관의 위임을 받아 각국 주요 상장기업을 대상으로 기후변화, 수자원 등 글로벌 환경 이슈 대응과 관련된 평가를 시행하고, 결과에 따라 8개로 등급을 나누는 한편, 평가점수 상위 5개사는 탄소경영 아너스 클럽으로 선정한다. 올해는 전 세계에서 8300여개의 기업 평가가 진행됐다.현대차는 지난해에 이어 2년 연속 탄소경영 아너스 클럽에 선정되는 영예를 안았다.현대차는 이번 평가에서 ▲수소전기차·전기차 등 친환경차 개발 및 보급 ▲사업장별 온실가스 고효율 감축 설비 도입 ▲아산공장·울산공장 태양광 패널 설치 ▲아산공장 무방류시스템 등 중장기적인 환경경영 강화 활동 등을 인정받아 탄소경영과 수자원 부문에서 최고 등급인 리더십A를 획득하고 탄소경영 아너스 클럽의 영예를 안았다.특히 현대차는 올해 수자원 관리 부문에 처음으로 참여해 최고 등급인 리더십A를 획득하며 지속가능경영 최우수 기업으로 선정됐다.기아차는 이번 평가에서 ▲친환경차 판매를 통한 친환경차 시장 확대 주도 ▲생산공정 고효율 모터 및 터보 냉동기, 공조기 개선 등을 통한 온실가스 감축 ▲투명한 탄소배출량 정보공개 ▲구체적인 탄소경영 추진 등 선제적인 기후변화 대응 노력을 인정받았다.현대∙기아차 관계자는 ""이번 평가에서 현대∙기아차 모두 최고의 성적을 받으며 지속가능경영의 모범이 됐다""며, ""향후에도 생산부터 판매에 이르는 가치사슬 효율화, 신재생에너지 사용 확대 및 사업장 온실가스 감축 등을 보다 적극적으로 시행해 나갈 예정""이라고 말했다. pjy@newsis.com<ⓒ 공감언론 뉴시스통신사. 무단전재-재배포 금지>",/news/news_read.nhn?article_id=0009838158&office_id=003&mode=search&query=기아차&page=2
"탄소정보공개 프로젝트 평가서 상위 5개 회사로 꼽혀현대차, 2년 연속 탄소경영 아너스 클럽기아차, 기후변화 대응 노력…아너스 클럽 첫 선정","서울 양재동에 위치한 현대차그룹 사옥. (사진=이데일리DB)[이데일리 송승현 기자] 현대·기아자동차가 세계적인 지속가능경영 평가기관으로부터 국내 기업 최고의 평가를 받았다.현대자동차와 기아자동차(000270)는 글로벌 환경경영 인증기관인 ‘탄소정보공개 프로젝트‘(CDP)가 실시한 2019년도 평가에서 국내 기업 중 평가점수 상위 5개사에만 주어지는 ‘탄소경영 아너스 클럽’에 선정됐다고 28일 밝혔다.현대차(005380)는 지난해에 이어 2년 연속 탄소경영 아너스 클럽에 선정되는 영예를 안았다. 탄소정보공개 프로젝트는 다우존스 지속가능성지수(DJSI), FTSE4GOOD 지수 등과 함께 기업의 지속가능성을 평가하는 가장 공신력 있는 지표로 인정받고 있다.탄소정보공개 프로젝트는 전세계 금융투자기관의 위임을 받아 각국 주요 상장기업을 대상으로 기후변화, 수자원 등 글로벌 환경 이슈 대응과 관련된 평가를 시행한다. 클럽은 결과에 따라 리더십A, 리더십A-, 매니저먼트B, 매니저먼트B- 등 8개로 등급을 나누고, 평가점수 상위 5개사는 탄소경영 아너스 클럽으로 선정한다.현대차는 이번 평가에서 △수소전기차·전기차 등 친환경차 개발 및 보급 △사업장별 온실가스 고효율 감축 설비 도입 △아산공장·울산공장 태양광 패널 설치 △아산공장 무방류시스템 등 중장기적인 환경경영 강화 활동 등을 인정받아 탄소경영과 수자원 부문에서 최고 등급인 리더십A를 획득하고 탄소경영 아너스 클럽의 영예를 안았다.특히 현대차는 올해 수자원 관리 부문에 처음으로 참여해 최고 등급인 리더십A를 획득하며 지속가능경영 최우수 기업으로 선정됐다.기아차는 이번 평가에서 △친환경차 판매를 통한 친환경차 시장 확대 주도 △생산공정 고효율 모터 및 터보 냉동기, 공조기 개선 등을 통한 온실가스 감축 △투명한 탄소배출량 정보공개 △구체적인 탄소경영 추진 등 선제적인 기후변화 대응 노력을 인정받아 최고 등급인 리더십A를 획득하고 탄소경영 아너스 클럽의 영예를 안았다.올해는 전 세계에서 8300여개의 기업 평가가 진행됐으며, 기후변화 부문에서 리더십A 등급을 받은 기업은 총 181개사로 이 중 한국 기업은 현대차와 기아차를 포함해 총 9개사다.아울러 수자원 관리 부문에서 리더십 A등급을 받은 기업은 총 72개사이며, 이 중 한국 기업은 현대차를 포함해 총 2개사다.현대·기아차 관계자는 “이번 평가에서 현대?기아차 모두 최고의 성적을 받으며 지속가능경영의 모범이 됐다”며 “향후에도 생산부터 판매에 이르는 가치사슬 효율화, 신재생에너지 사용 확대 및 사업장 온실가스 감축 등을 보다 적극적으로 시행해 나갈 예정”이라고 말했다.송승현 (dindibug@edaily.co.kr)＜ⓒ종합 경제정보 미디어 이데일리 - 무단전재 & 재배포 금지＞",/news/news_read.nhn?article_id=0004629614&office_id=018&mode=search&query=기아차&page=2
▶ 헉! 소리나는 [헉스] ▶ '너 그거 아니?' [두유노우]▶ 지금 파이낸셜뉴스 채널 구독하고 경품 GET!,"[파이낸셜뉴스] 현대·기아차가 기후변화 대응 평가에서 최우수 기업으로 선정됐다.
 현대자동차와 기아자동차는 글로벌 환경경영 인증기관인 '탄소정보공개 프로젝트(CDP)'가 실시한 2019년도 평가에서 국내 기업 중 평가점수 상위 5개사에만 주어지는 '탄소경영 아너스 클럽'에 선정됐다고 28일 밝혔다.
 현대차는 지난해에 이어 2년 연속 탄소경영 아너스 클럽에 선정되는 영예를 안았다. 탄소정보공개 프로젝트(CDP)는 다우존스 지속가능성지수(DJSI), FTSE4GOOD 지수 등과 함께 기업의 지속가능성을 평가하는 가장 공신력 있는 지표로 인정받고 있다. 전세계 금융투자기관의 위임을 받아 각국 주요 상장기업을 대상으로 기후변화, 수자원 등 글로벌 환경 이슈 대응과 관련된 평가를 시행하고, 결과에 따라 8개로 등급을 나누는 한편, 평가점수 상위 5개사는 탄소경영 아너스 클럽으로 선정한다.
 현대차는 이번 평가에서 수소전기차·전기차 등 친환경차 개발 및 보급, 사업장별 온실가스 고효율 감축 설비 도입, 아산공장·울산공장 태양광 패널 설치, 아산공장 무방류시스템 등 중장기적인 환경경영 강화 활동 등을 인정받아 탄소경영과 수자원 부문에서 최고 등급인 리더십A를 획득했다. 특히 올해 수자원 관리 부문에 처음 참여해 최고 등급인 리더십A를 받아 지속가능경영 최우수 기업으로 선정됐다.
 기아차는 친환경차 판매를 통한 친환경차 시장 확대 주도, 생산공정 고효율 모터 및 터보 냉동기와 공조기 개선 등을 통한 온실가스 감축, 투명한 탄소배출량 정보공개, 구체적인 탄소경영 추진 등 선제적인 기후변화 대응 노력을 인정받아 최고 등급인 리더십A에 이름을 올렸다. 올해는 전 세계에서 8300여개의 기업 평가가 진행됐다. 이중 기후변화 부문에서 리더십A 등급을 받은 한국 기업은 현대차와 기아차를 포함해 총 9개사다. 수자원 관리 부문에서 리더십 A등급을 받은 한국 기업은 현대차를 포함해 총 2개사다.
 현대·기아차 관계자는 ""이번 평가에서 현대·기아차 모두 최고의 성적을 받으며 지속가능경영의 모범이 됐다""며 ""향후에도 생산부터 판매에 이르는 가치사슬 효율화, 신재생에너지 사용 확대 및 사업장 온실가스 감축 등을 적극 시행해 나갈 것""이라고 강조했다.



 ※ 저작권자 ⓒ 파이낸셜뉴스. 무단 전재-재배포 금지",/news/news_read.nhn?article_id=0004416045&office_id=014&mode=search&query=기아차&page=2
,"현대∙기아차가 세계적인 지속가능경영 평가기관으로부터 기후변화 대응 ‘최우수’ 등급을 받았다.현대자동차와 기아자동차는 글로벌 환경경영 인증기관인 ‘탄소정보공개 프로젝트(CDP)’가 실시한 2019년도 평가에서 국내 기업 중 평가점수 상위 5개사에만 주어지는 ‘탄소경영 아너스 클럽(Honors Club)’에 선정됐다고 28일 밝혔다. 현대차는 지난해에 이어 2년 연속 탄소경영 아너스 클럽에 올랐다.탄소정보공개 프로젝트(CDP)는 전세계 금융투자기관의 위임을 받아 각국 주요 상장기업을 대상으로 기후변화, 수자원 등 글로벌 환경 이슈 대응과 관련된 평가를 시행한다. 다우존스 지속가능성지수(DJSI), FTSE4GOOD 지수 등과 함께 기업의 지속가능성을 평가하는 가장 공신력 있는 지표로 인정받고 있다.현대차는 이번 평가에서 ▲수소전기차·전기차 등 친환경차 개발 및 보급 ▲사업장별 온실가스 고효율 감축 설비 도입 ▲아산공장·울산공장 태양광 패널 설치 ▲아산공장 무방류시스템 등 중장기적인 환경경영 강화 활동 등을 인정받아 탄소경영과 수자원 부문에서 최고 등급인 리더십A를 획득하고 탄소경영 아너스 클럽의 영예를 안았다. 특히 현대차는 올해 수자원 관리 부문에 처음으로 참여해 최고 등급인 리더십A를 획득하며 지속가능경영 최우수 기업 평가를 받았다.기아차는 이번 평가에서 ▲친환경차 판매를 통한 친환경차 시장 확대 주도 ▲생산공정 고효율 모터 및 터보 냉동기, 공조기 개선 등을 통한 온실가스 감축 ▲투명한 탄소배출량 정보공개 ▲구체적인 탄소경영 추진 등 선제적인 기후변화 대응 노력을 인정받아 최고 등급인 리더십A를 획득하고 탄소경영 아너스 클럽에 선정됐다.올해는 전 세계에서 8300여개 기업 평가가 진행됐으며, 기후변화 부문에서 리더십A 등급을 받은 기업은 총 181개사로 이 중 한국 기업은 현대차와 기아차를 포함해 총 9개사다. 수자원 관리 부문에서 리더십 A등급을 받은 기업은 총 72개사이며, 이 중 한국 기업은 현대차를 포함해 총 2개사다.현대∙기아차 관계자는 “이번 평가에서 현대∙기아차 모두 최고의 성적을 받으며 지속가능경영의 모범이 됐다”며 “향후에도 생산부터 판매에 이르는 가치사슬 효율화, 신재생에너지 사용 확대 및 사업장 온실가스 감축 등을 보다 적극적으로 시행해 나갈 예정”이라고 말했다.[디지털뉴스국 박소현 객원기자] [ⓒ 매일경제 & mk.co.kr, 무단전재 및 재배포 금지]",/news/news_read.nhn?article_id=0004565557&office_id=009&mode=search&query=기아차&page=2
,"현대자동차그룹이 사실상 무기한 ‘셧다운’ 중인 인도 공장의 재가동을 위해 인도 정부와 협의에 나섰다. 우리 정부도 외교 채널을 통해 방역 등을 한 후 조건부 재가동 요청을 한 것으로 알려졌다.


28일 자동차 업계에 따르면 현대차그룹은 지난주 인도 정부에 현재 가동 중단 상태인 완성차 공장의 재가동을 허가해 달라고 요청했다. 중앙정부와 함께 현대차 공장이 있는 타밀나두주, 기아차 공장이 있는 안드라프라데시주와도 협의를 시작했다.


현대차그룹 관계자는 “인도 중앙정부와 주 정부에 방역을 철저히 하고 유증상자 발생 시 즉각 차단 조치를 하는 등의 조건으로 공장을 재가동할 수 있게 해 달라고 요청했다”고 말했다. 이어 “지난주 성윤모 산업통상자원부 장관과 간담회에서 이런 의견을 전달했고 정부도 외교 채널을 통해 인도 정부에 이런 요청을 한 것으로 안다”고 말했다.




 현재 기아차의 글로벌 전략 스포츠유틸리티차량(SUV)인 셀토스는 인도산 클러스터(계기판 액정화면 부품) 공급이 중단되면서 생산을 하지 못하고 있다. 현대차그룹은 해당 부품 업체의 중국 공장으로 공급선을 바꾸는 방안을 검토했지만, 중국 공장 역시 인도산 부품이 필요해 포기한 상태다.


송호성 기아차 사장은 성 장관과 간담회에서 “인도가 지난달 23일부터 전국적인 ‘락다운(lockdown)에 들어가면서 국내 공장의 셀토스 생산이 중단됐다”며 “인도 중앙정부와 주 정부에 글로벌 소싱(부품 공급) 공장만이라도 가동할 수 있도록 정부가 나서달라”고 요청했다.





현대차그룹은 다음달 3일까지인 인도의 가동중단이 재연장되지 않도록, 그리고 셀토스 클러스터를 비롯한 인도산 핵심 부품의 생산을 조기에 재개할 수 있도록 협의 중이다. 이들 부품의 생산이 재개돼야 국내외 부품 생태계가 회복할 수 있다는 게 현대차그룹의 판단이다.


인도에 생산 시설을 갖고 있는 글로벌 완성차 업체들도 인도 정부에 조기 가동 재개를 요청하고 있다. 인도 최대 완성차 업체인 마루티스즈키를 비롯해 도요타·포드·메르세데스-벤츠 등이 “최소한 글로벌 소싱 부품 생산 재개라도 허가해 달라”는 입장을 인도 정부에 전달했다.


문제는 인도의 행정 절차가 오래 걸리기로 악명이 높은 데다 중앙정부와 지방정부의 협조도 원활하지 않다는 데 있다.





 현대차그룹 관계자는 “중앙정부에서는 인구가 밀집한 도심지역을 제외한 지방 생산시설의 락다운 해제를 긍정적으로 보고 있지만, 지방정부는 명확한 입장을 내놓지 않고 있다”며 “다음달 4일 이후 재가동을 위해 최선을 다해 협의하고 있다”고 말했다.


이동현 기자 offramp@joongang.co.kr

▶ ▶
/ ⓒ중앙일보(https://joongang.co.kr), 무단 전재 및 재배포 금지",/news/news_read.nhn?article_id=0002996594&office_id=025&mode=search&query=기아차&page=2
,"[서울경제] 현대·기아자동차는 글로벌 환경경영 인증기관인 ‘탄소정보공개 프로젝트(CDP·Carbon Disclosure Project)’가 실시한 2019년도 평가에서 상위 5개사에만 주어지는 ‘탄소경영 아너스 클럽’에 선정됐다고 28일 밝혔다. 특히 현대차는 지난해에 이어 2년 연속 탄소경영 아너스 클럽에 선정되는 영예를 안았다. CDP는 다우존스 지속가능성지수(DJSI), FTSE4GOOD 지수 등과 함께 기업의 지속가능성을 평가하는 가장 공신력 있는 지표로 인정받고 있다. 전 세계 금융투자기관의 위임을 받아 각국 주요 상장기업을 대상으로 기후변화, 수자원 등 글로벌 환경 이슈 대응과 관련된 평가를 한다. 결과에 따라 리더십A, 리더십A-, 매니저먼트B, 매니저먼트B- 등 8개로 등급을 나누는 한편, 평가점수 상위 5개사는 탄소경영 아너스 클럽으로 선정한다. 올해는 전 세계 8,300여 개의 기업 평가가 진행됐으며, 기후변화 부문에서 리더십A 등급을 받은 기업은 181개사로 이 중 한국 기업은 현대차와 기아차를 포함해 총 9개사다.현대차는 이번 평가에서 △수소전기차·전기차 등 친환경차 개발 및 보급 △사업장별 온실가스 고효율 감축 설비 도입 △아산공장·울산공장 태양광 패널 설치 △아산공장 무방류시스템 등 중장기적인 환경경영 강화 활동 등을 인정받아 탄소경영과 수자원 부문에서 최고 등급인 리더십A를 획득했다. 특히 현대차는 올해 수자원 관리 부문에 처음으로 참여해 최고 등급인 리더십A를 획득하며 지속가능경영 최우수 기업으로 선정됐다.기아차는 △친환경차 판매를 통한 친환경차 시장 확대 주도 △생산공정 고효율 모터 및 터보 냉동기, 공조기 개선 등을 통한 온실가스 감축 △투명한 탄소배출량 정보공개 등 선제적인 기후변화 대응 노력을 인정받아 최고 등급인 리더십A를 획득하고 탄소경영 아너스 클럽의 영예를 안았다.현대·기아차 관계자는 “이번 평가에서 현대·기아차 모두 최고의 성적을 받으며 지속가능경영의 모범이 됐다”며 “향후에도 생산부터 판매에 이르는 가치사슬 효율화, 신재생에너지 사용 확대, 사업장 온실가스 감축 등을 보다 적극적으로 시행해 나갈 예정”이라고 말했다./박한신기자 hspark@sedaily.com저작권자 ⓒ 서울경제, 무단 전재 및 재배포 금지",/news/news_read.nhn?article_id=0003730847&office_id=011&mode=search&query=기아차&page=2
"현대차, 2년 연속 탄소경영 아너스 클럽…수자원 관리 부문 최우수","[아시아경제 김지희 기자] 현대자동차와 기아자동차는 글로벌 환경경영 인증기관 ‘탄소정보공개 프로젝트(CDP)’가 실시한 2019년도 평가에서 국내기업 중 평가점수 상위 5개사에만 주어지는 ‘탄소경영 아너스 클럽’에 선정됐다고 28일 밝혔다. 특히 현대차는 지난해에 이어 2년 연속 탄소경영 아너스 클럽에 선정됐다.CDP는 다우존스 지속가능성지수(DJSI), FTSE4GOOD 지수 등과 함께 기업의 지속가능성을 평가하는 공신력 있는 지표로 인정받고 있다. 전세계 금융투자기관의 위임을 받아 각국 주요 상장기업을 대상으로 기후변화, 수자원 등 글로벌 환경 이슈 대응 관련 평가를 시행하고, 결과에 따라 리더십A, 리더십A-, 매니저먼트B 등 8개로 등급을 나눈다. 평가점수 상위 5개사는 탄소경영 아너스 클럽으로 선정한다.현대차는 이번 평가에서 ▲수소전기차·전기차 등 친환경차 개발 및 보급 ▲사업장별 온실가스 고효율 감축 설비 도입 ▲아산공장·울산공장 태양광 패널 설치 ▲아산공장 무방류시스템 등 중장기적인 환경경영 강화 활동 등을 인정받아 탄소경영과 수자원 부문에서 리더십A를 획득했다. 특히 현대차는 올해 수자원 관리 부문에 처음으로 참여해 리더십A를 받으며 지속가능경영 최우수 기업으로 선정됐다.기아차는 이번 평가에서 ▲친환경차 판매를 통한 친환경차 시장 확대 주도 ▲생산공정 고효율 모터 및 터보 냉동기, 공조기 개선 등을 통한 온실가스 감축 ▲투명한 탄소배출량 정보공개 ▲구체적인 탄소경영 추진 등 선제적인 기후변화 대응 노력을 인정받아 리더십A를 획득했다.올해는 전 세계 8300여개의 기업 평가가 진행됐으며, 기후변화 부문에서 리더십A 등급을 받은 기업은 181개사다. 이 가운데 한국 기업은 현대차와 기아차를 포함해 총 9곳이다. 수자원 관리 부문에서 리더십A 등급을 받은 기업은 총 72개사로, 한국 기업은 현대차를 포함해 두 곳에 불과하다.현대기아차 관계자는 “이번 평가에서 현대기아차 모두 최고의 성적을 받으며 지속가능경영의 모범이 됐다”며 “향후에도 생산부터 판매에 이르는 가치사슬 효율화, 신재생에너지 사용 확대 및 사업장 온실가스 감축 등을 보다 적극적으로 시행해 나갈 예정”이라고 말했다.김지희 기자 ways@asiae.co.kr <ⓒ경제를 보는 눈, 세계를 보는 창 아시아경제 무단전재 배포금지>",/news/news_read.nhn?article_id=0004669497&office_id=277&mode=search&query=기아차&page=2
