head,text,url
코로나로 줄어든 생산량 정상화경영 어려움 겪는 부품사 살리기노조에 주말특근 연장 협의 요청,"현대자동차가 최대 3개월 동안 한시적으로 주당 56시간 일하는 방식을 추진한다. 신종 코로나바이러스 감염증(코로나19)이 확산하면서 벤츠·폴크스바겐 등 외국 자동차 회사가 공장을 폐쇄하는 것과 달리 현대차는 공격적인 경영에 나선 셈이다. 기아차도 현대차와 같은 방안을 검토 중이다.


18일 현대자동차그룹에 따르면 현대차는 노동조합(금속노조 현대차지부)에 주 56시간으로 근로시간을 늘리는 방안에 대한 협의를 요청했다. 코로나19로 줄어든 생산량을 정상화하고 어려움을 겪는 부품사를 돕기 위해서다. 현재는 주 40시간 근무에 토요일 특근 8시간을 더해 주 48시간 체제로 운영 중이다. 현대차 관계자는 “토요일 특근을 더 늘리거나 일요일에 특근하는 방안이 검토되고 있다”며 “노조와 협의 과정에서 정해질 것”이라고 말했다.


현대차는 지난 12일 울산 지역 자동차 부품회사와 간담회를 한 뒤 특별연장근로 추진을 결정했다. 이날 간담회에는 현대차와 부품사의 노조도 참석했다. 부품사 노사는 “현대차의 생산 감소로 큰 어려움을 겪고 있다”며 “한시적이라도 생산량을 늘려 회생할 기반을 마련해달라”고 요청했다. 현대차는 지난달에만 부품 수급 문제 등으로 8만 대가량의 생산 차질을 빚었다.


생산량 만회를 위한 근로시간 연장을 실현하려면 노조가 동의해야 한다. 현재로선 분위기가 나쁘지 않다. 노조는 지난 12일 소식지를 통해 “고객이 없으면 노조도, 회사도 존재할 수 없다”며 “회사는 사활을 걸고 부품 공급을 책임져야 하며 조합원은 품질력을 바탕으로 생산성 만회에 적극적으로 나서야 한다”고 호소했다. 그러면서 “혹여 노사 생존을 위한 노조 호소에 조합원들이 결코 경직된 사고를 가져서는 안 된다”고 덧붙였다.


현대차 노조가 회사 측 계획에 동의하더라도 곧장 근로시간을 연장할 수 있는 것은 아니다. 현대차 노조는 금속노조 산하여서 최종 결정권은 상급단체인 금속노조에 있다. 그동안 민주노총과 금속노조는 주 52시간 근무제를 무력화하는 어떤 조치에도 반대한다는 입장을 견지해왔다. 업계 관계자는 “코로나19에 따른 비상시국인 점을 감안하면 지부(현대차 노조)가 결정할 경우 금속노조도 동의할 것으로 기대한다”고 말했다.


현대차는 노조와 협의가 끝나는 대로 고용노동부에 특별연장근로를 신청할 방침이다. 주당 근무시간이 최대 52시간을 넘길 경우 고용부의 인가를 받아야 하기 때문이다. 기아차도 현대차의 상황을 지켜보며 조만간 노조에 근로시간 연장 협의를 요청할 계획이다.


김기찬 고용노동전문기자 wolsu@joongang.co.kr
▶ ▶
/ ⓒ중앙일보(https://joongang.co.kr), 무단 전재 및 재배포 금지",/news/news_read.nhn?article_id=0002985291&office_id=025&mode=search&query=기아차&page=5
,"18일 열린 삼성전자 주총에서 한종희 영상디스플레이사업부장(사장)과 최윤호 경영지원실장(사장)이 사내 이사로 신규 선임됐다. 이로써 지난해 이재용 부회장이 등기이사직 재선임을 포기하면서 3명까지 줄어든 삼성전자의 사내 이사는 5명으로 늘었다. 박재완 신임 삼성전자 이사회 의장도 이날 사외이사 자격으로 참석했다. 이명박 정부에서 기획재정부 장관 등을 지낸 박 의장은 삼성전자의 첫 사외이사 출신 이사회 의장이다. 이재용 부회장은 올해에도 주총에 참석하지 않았다.


이날 수원컨벤션센터에서 열린 주총은 1969년 창사 이후 처음으로 회사 외부에서 열렸다. 지난해보다 참석자가 적었다. 올해 처음 전자투표제를 도입했고 신종 코로나바이러스 감염증(코로나19) 사태까지 겹친 결과로 보인다.





같은 날 열린 현대모비스 주총에선 정의선 현대차그룹 수석부회장이 사내이사로 재선임됐다. 현대모비스는 이날 서울 강남구 현대해상화재보험 대강당에서 주총을 열고 이같이 결정했다. 해외 연기금 등은 정 부회장이 현대모비스 외에 현대·기아차 등의 등기이사를 겸임하고 있다는 이유로 정 부회장의 사내이사 선임을 반대했지만, 원안대로 통과됐다. 임기는 2022년까지다.


정 부회장은 지난해 현대차·현대모비스 대표이사에 오른 후 그룹을 진두지휘하고 있다. 19일 현대차 주총 직후 열리는 이사회에서 의장직을 맡을지가 관심거리다. 정몽구 회장이 등기이사에서 물러남에 따라 공석이 된 이사회 의장을 이번에 새로 선임한다. 정 부회장이 아버지의 뒤를 이어 이사회 의장에 오르면 현대차그룹 최고경영자(CEO)를 ‘공식화’하는 자리가 된다.


현대차 안팎에선 “아직까진 가능성이 반반”이라는 의견이 팽배하다. 이원희 현대차 대표나 사외이사 중 한 사람이 의장직을 맡을 수도 있다는 전망도 있다. 최근 재계에서 이사회의 독립성을 높이기 위한 작업이 이뤄지고 있어서다.


김영주·김영민 기자 humanest@joongang.co.kr
▶ ▶
/ ⓒ중앙일보(https://joongang.co.kr), 무단 전재 및 재배포 금지",/news/news_read.nhn?article_id=0002985292&office_id=025&mode=search&query=기아차&page=5
,"[서울=뉴시스] 박주연 기자 = 신종 코로나바이러스 감염증(코로나19)의 여파로 세계 자동차 생산이 멈춰서고 있다. 미국과 유럽의 거대 완성차업체 생산라인이 멈춰서고, 유럽에서는 국경이 통제되며 현대·기아차의 해외 생산라인에도 비상등이 켜졌다.
18일 외신에 따르면 제너럴모터스(GM), 포드, 피아트크라이슬러(FCA) 등 미국 자동차 업체들과 전미자동차노조(UAW)는 코로나19 확산 방지를 위해 일부 생산시설에서 순환 셧다운을 실시, 같은 시간대에 근무하는 근로자 수를 제한키로 했다. UAW 소속 조합원은 약 15만명이다.당초 UAW는 2주간 공장 폐쇄를 요구했지만 미국 자동차업체들이 이에 대해 난색을 표명한 것으로 알려졌다. 양측은 생산시설의 순환 셧다운(폐쇄)과 시설에 대한 광역방역, 근무자 간 근로 간격 유지, 근로자간 접촉 피하기 등을 위한 광범위한 계획 수립에 합의했다. 폭스바겐, 르노, 푸조시트로엥, 피아트 크라이슬러 등 유럽 완성차업체 '빅4'는 2주 이상 공장 가동을 중단했다. 폭스바겐은 오는 23일부터 2~3주간 유럽 내 거의 모든 공장의 생산을 중단할 방침이고, 르노는 17일부터 프랑스 17개 전 공장의 가동을 무기한 중단키로 했다. 푸조시트로앵과 피아트 크라이슬러도 지난 16일부터 2주간 공장 가동을 중단한 상태다. 포드와 다임러, 토요타와 닛산 역시 유럽 공장의 생산 중단을 발표한 상태다. 현대차의 미국 앨러배마 공장과 체코 노쇼비체 공장, 기아차의 슬로바키아 공장은 아직 별다른 문제가 없다. 미국 공장의 경우 직원들이 UAW 소속이 아니라 순환 셧다운 대상이 아니고, 체코와 슬로바키아 공장도 현재까지는 정상적으로 가동되고 있는 것으로 알려졌다.다만 미국의 코로나19 확산 상황이 심각해지거나 생산라인 내 확진자가 나올 경우 생산차질이 우려되는 상황이다. 특히 유럽의 경우 국경통제로 부품 물류체인에 문제가 발생할 가능성이 있어 상황이 유동적이라는 것이 현대차 측의 설명이다. 미국과 유럽의 경우 마스크 등 방역물품을 구하기 힘든 것도 문제다. 업계 관계자는 ""현대, 기아차의 해외 공장들은 각국 정부 지침에 따라 강력한 방역을 시행하고 있다""며 ""가동률을 최대한 유지하기 위해 노력하고 있지만 물류체인 등에 문제가 생길 경우 생산라인 가동이 유동적일 수 있다""고 말했다. pjy@newsis.com<ⓒ 공감언론 뉴시스통신사. 무단전재-재배포 금지>",/news/news_read.nhn?article_id=0009764881&office_id=003&mode=search&query=기아차&page=5
코로나 여파로 주가 연일 폭락… 금호타이어-현대상선 등 제외,"올해 들어 국내에서 시가총액이 1조 원 이상인 상장사가 5분의 1 이상 줄어든 것으로 나타났다. 신종 코로나바이러스 감염증(코로나19)이 팬데믹(대유행)으로 번지고, 글로벌 금융시장이 불확실성에 휩싸이며 주가가 연일 폭락했기 때문이다.
18일 한국거래소에 따르면 전날 기준 시총 1조 원을 넘긴 상장사는 146개로 지난해 말(189개)보다 43개 줄어든 것으로 나타났다. 유가증권시장 및 코스닥시장에서 각각 41개, 2개씩 줄었다. 유가증권시장에서는 금호타이어(9623억 원), 현대상선(9497억 원) 등이, 코스닥시장에서는 에이치엘비생명과학(9294억 원) 등이 1조 클럽에서 제외됐다. 시총 1조 클럽에 남아 있는 상장사들도 시총 규모는 큰 폭으로 줄었다. 코스피의 두 ‘대장주’ 삼성전자와 SK하이닉스의 시총은 17일 기준 282조4000억 원, 58조5000억 원으로 올해 들어 각각 50조7000억 원, 10조 원가량 감소했다. 또 현대차(―8조6000억 원), 기아차(―7조7000억 원) 등 대형주들과 신한지주(―8조4000억 원), KB금융(―7조4000억 원) 등 금융주도 큰 폭으로 감소했다. 코로나19 확산 초기만 해도 대형주들을 중심으로 증시가 하락하면 저가매수가 이어지며 주가를 방어했다. 하지만 글로벌 증시가 동시에 패닉에 빠지면서 주가 하락 폭은 걷잡을 수 없이 커졌다. 실물경제의 충격이 금융시스템으로 전이될 수 있다는 우려마저 커지면서 대형주도 추락을 거듭하고 있는 상황이다. 올해 들어 18일까지 코스피와 코스닥지수는 각각 20.83%, 27.52% 하락했다.김자현 기자 zion37@donga.com ⓒ 동아일보 & donga.com, 무단 전재 및 재배포 금지",/news/news_read.nhn?article_id=0003276152&office_id=020&mode=search&query=기아차&page=5
"""오후 6시, 새로운 아침이다""일상의 변화 공략한 기아차시간에 대한 사고방식 바꿔주5일 이어 `주52시간` 시대새로운 라이프스타일 등장에광고가 선도적으로 시대 반영","라이프스타일의 변화는 늘 마케터의 1순위 관심사다. 요즘은 단연 주 52시간 근무제가 만들 변화에 촉각을 세우고 있다. 일과 여가의 함수관계가 만드는 트렌드의 변곡점은 늘 파장이 컸기 때문이다. 필자가 광고계에 막 들어선 2000년대 초반은 주 5일 근무제가 이슈였다. 지금이야 너무 당연한 것이고 얘깃거리도 안 되지만, 당시에는 우리의 일상에, 산업에, 유행에, 마케팅에 큰 영향을 준 사건이었다.하루에서 이틀로 늘어난 주말은, 가족 단위 레저활동 증가와 직결됐다. 금요일 저녁에 떠나 일요일 저녁에 돌아오는 2박3일 가족여행 계획은 주 5일 근무 시대의 대표적 상징처럼 회자되며 직장인들을 들뜨게 했다. 마케터들도 발 빠르게 움직였다. 광고에 가족을 많이 등장시켰다. 세련된 남자가 멋진 자동차에서 내리는 모습이 주를 이루던 자동차 광고가 줄고, 가족이 함께 차를 타고 어디론가 떠나거나, 차 안에서 같이 웃고 즐기는 모습이 묘사됐다. 주 5일 근무제의 주연은 분명 가족이었다.직장생활에서는 어떠했을까? '일할 땐 열심히 일하고, 놀 땐 확실하게 노는' 사람이 시대에 걸맞은 인재상으로 여겨지게 됐다. 경쟁이 치열했던 신용카드 시장에서 현대카드 광고가 새로운 가치관을 먼저 제시했다. ""열심히 일한 당신, 떠나라"" ""항상 바빴던 그녀. 모든 걸 잊고 쉬게 해주고 싶었다""라며 휴식과 여가의 권리를 지지했다. LG카드는 이영애 씨를 모델로 발탁해 진취적이고 트렌디한 삶을 보여주면서 여성 고객층을 끌어 모았다. 업종마다 기업마다 각자의 마케팅 방식으로 표출되었지만, 주 5일 근무 시대 새로운 가치관을 주도하려는 공통된 바람이 담겨 있었다.18년이 지난 지금, 필자는 다시 주 52시간제를 맞이했다. 20년 가까이 시차가 있지만, 주 5일제와 주 52시간제는 비슷하면서도 분명 다르게 느껴졌다. 주 5일 근무제가 특별한 주말에 대한 이야기라면, 주 52시간제가 만들 변화의 핵심은 데일리 루틴(Daily Routine), 즉 '일상의 변화'다. 우리 모두는 이제 특별한 사정이 없는 한, 오후 6시 이후에 일하지 않는다. 이것은 토요일을 쉬게 된 것과는 매우 다르며, 여름휴가가 7일에서 14일로 늘어나는 것과도 다른 차원의 얘기다.예상치 않게 생긴 저녁시간은 번개모임 아니면 TV 시청으로 소비되고 말겠지만, 매일 저녁 꼬박꼬박 4~5시간이 나에게 주어진다면 스토리 자체가 바뀐다. 누군가에겐 저녁 식탁에 모여 가족과 대화하는 시간이고, 누군가는 월화수목금 매일 저녁 알차고 화려한 시간표를 만들 것이고, 어떤 이는 수년이 걸리는 공부의 첫걸음을 시작할 수도 있다. 이제 우리는 적은 시간 더 효율적으로 일하는 방식을 고민하게 되고, 일터 밖의 또 다른 하루를 밀도 있게 계획하려 할 것이다. 일상에 대한, 시간에 대한 사고방식이 전환되는 시점이다. 새로운 시대정신이 태동한다.최근 기아자동차는 새로운 시대정신을 쏘렌토 광고캠페인에 투영시켰다. '오후 6시는 이제, 새로운 아침의 시작이다'라고 선언한 것이다. 지난 30년간 한결같이 청년정신으로 '배철수의 음악캠프(배캠)'를 이끌어온 DJ 배철수 씨가 캠페인 메시지의 화자로 등장했다. 배캠의 시그널송인 롤링 스톤스 곡 새티스팩션(Satisfaction(VSOP버전))을 마치 새로운 시대를 깨우는 팡파르처럼 광고의 BGM으로 사용했다. 배철수 씨 특유 음색의 광고 카피 ""주 52시간 시대. 오후 6시는 새로운 아침이 되었고, 매일 저녁 우리에게 꿈꾸지 못할 삶이란 없습니다. 자, 그럼 시동을 켜 볼까요? 밤하늘 아래 우리를 기다릴 새로운 날들을 향해 애프터 식스 라이프(After 6 Life). 지금 출발합니다""는 배캠의 실제 오프닝 멘트 같아 소비자들의 귀를 사로잡는다.
광고인지, 새로운 라이프스타일의 선언문인지, 소셜 무브먼트(Social Movement)인지 구분이 쉽지 않을 것 같다. 마케팅이 시대정신을 담아냈을 때, 그것은 커머셜(Commercial)과 소셜(Social)의 중간 어디쯤 위치한다. 마케터는 그 시대의 구성원이고, 마케팅은 시대정신의 산물이자 기록이다. 광고기획자인 필자는 한국에서 주 52시간 시대를 맞이한 직장인이기도 하다. 그렇다면 이번 기아차 캠페인은 광고기획자의 생각이었을까, 대한민국 직장인의 생각이었을까. 어느 쪽이든 이 캠페인이 시대의 흐름을 따라 스스로 살아 움직이며 사람들의 마음에 자연스럽게 녹아들길 바란다. 그래서 한 10년쯤 흐른 뒤에 어느 직장 후배가 이 광고를 꺼내 봤을 때, 새삼 너무나 당연하고 상식적인 얘기여서 헛웃음 치게 만들었으면 한다. 그렇게 돼야 우리의 마케팅이 성공한 것이다.[이정태 이노션 월드와이드 팀장] [ⓒ 매일경제 & mk.co.kr, 무단전재 및 재배포 금지]",/news/news_read.nhn?article_id=0004539448&office_id=009&mode=search&query=기아차&page=5
구매수요 줄어들자 공장가동 2주 중지,"[서울신문]코로나19가 세계 자동차산업의 심장부인 유럽을 덮치면서 독일의 자동차 명가 메르세데스벤츠마저 당분간 공장 문을 내리게 됐다. 이른바 ‘카데믹’(전 세계 자동차 공장 셧다운 사태)이 현실화하는 모습이다. 사태가 길어지면 국내 수입차 시장에도 타격이 불가피할 것으로 보인다.독일 슈투트가르트에 본사를 둔 다임러AG는 18일 유럽에 있는 모든 자회사의 공장 가동을 2주간 중지한다고 밝혔다. 메르세데스벤츠를 비롯한 승용차와 밴, 트럭·버스 등 상용차 공장이 모두 멈추는 셈이다. 이에 따른 경제적 피해는 분석 중이다.벤츠와 양대 산맥인 BMW도 결국 유럽과 남아프리카공화국 공장 가동을 중단했다. BMW 본사가 있는 독일 바이에른주에는 코로나19 확산에 따른 비상사태가 내려졌다.코로나19 피해가 가장 심각한 이탈리아의 럭셔리 자동차 브랜드도 속절없이 문을 닫게 됐다. 마세라티에 이어 페라리도 부품 공급 차질로 공장 2개를 폐쇄했다.유럽에 진출한 비유럽 국가의 자동차 브랜드 역시 맥을 못 추고 있다. 일본의 도요타는 포르투갈 공장과 프랑스 공장을 2주간 폐쇄했다. 미국 포드도 독일 쾰른과 자를루이 공장 가동을 중단하기로 했다. 현대차 체코 공장과 기아차 슬로바키아 공장은 아직까진 정상 가동 중이지만 코로나19가 서유럽에서 동유럽으로 빠르게 번지는 만큼 머지않아 해당 국가의 방침에 따라 휴업이 불가피해질 수도 있다.유럽의 자동차 공장이 조업을 중단하는 이유는 공장 내 코로나19 확산을 우려해서라기보다 구매 수요가 급감했기 때문이다. 특히 유럽의 자동차산업은 1400만명을 직간접 고용하는 유럽 제조업의 뼈대를 이루는 산업이다 보니 이번 셧다운에 따른 경제적 피해 역시 막대할 것으로 예상된다. 대규모 구조조정이 뒤따를 것이란 전망도 나온다.사태 장기화로 공급망이 무너지면 국내 수입차 시장에도 상당한 영향을 미칠 것으로 보인다. 한국수입자동차협회에 따르면 지난해 국내에서 판매된 유럽차는 18만 4147대로 수입차 전체 판매 대수 24만 4780대의 75.2%에 달했다. 특히 벤츠는 30%, BMW는 20% 안팎의 시장 점유율을 유지하고 있다.수입차 업계 관계자는 “유럽 공장 가동이 중단돼도 아직 재고가 남아 있기 때문에 당분간 공급 부족 사태는 없을 것으로 본다”면서도 “하지만 휴업이 2주 이상 지속되면 2~3개월 뒤에 신차 물량이 부족할 수 있어 대책을 마련하고 있다”고 말했다.이영준 기자 the@seoul.co.kr▶
▶
▶ⓒ 서울신문(www.seoul.co.kr), 무단전재 및 재배포금지",/news/news_read.nhn?article_id=0003075051&office_id=081&mode=search&query=기아차&page=5
"美 노조도 운영 중단 요구…공급망 붕괴·수요 감소 가속화현지 생산법인 가동 장담 어려워…""수요 급감 대비해야""","(서울=뉴스1) 조재현 기자 = 신종 코로나바이러스 감염증(코로나19)의 전 세계적 유행에 따라 유럽의 완성차 공장들의 '셧다운'(일시 가동 중단) 사태가 속출하고 있다. 중국과 함께 최대 자동차 제조 시장으로 꼽히는 유럽의 잇단 공장 폐쇄로 글로벌 공급망 붕괴와 얼어붙은 소비 심리에 따른 판매 부진이 가속화할 것이란 전망이다.미국에서도 노동조합을 중심으로 가동 중단 요구가 이어지고 있어 글로벌 자동차 산업 전체가 휘청거릴 가능성도 제기된다. 주요 자동차 시장의 위기는 수출 의존도가 높은 우리나라 완성차 업계로 고스란히 전가될 수 있다는 점에서 업계가 촉각을 곤두세우고 있다. 특히 현지에 생산라인을 둔 업체들의 고심도 깊어지고 있다. 19일 업계 및 주요 외신에 따르면 독일 최대 자동차 기업 중 하나인 폭스바겐은 오는 23일부터 2~3주간 독일을 포함해 유럽에서 모든 생산을 중단한다. 이후 독일과 체코 등 유럽 전역으로 공장 폐쇄 조치를 확대한다. 폭스바겐은 우선 이번 주 코로나19 사태가 급속도로 확산하는 이탈리아를 비롯해 스페인과 포르투갈, 슬로바키아 공장 가동을 중단하기로 했다. 코로나19 확산에 따라 각국 정부가 빗장을 걸어 잠그면서 부품 조달이 어려워진 데다, 판매 수요마저 큰 폭으로 줄었기 때문이다. 잇따르는 비상사태 선포로 직원 출근 및 영업점 운영이 중단된 것도 영향을 미쳤다는 분석이다. 이탈리아 피아트와 미국 크라이슬러의 합작법인인 피아트크라이슬러(FCA)도 이탈리아 내 생산공장 6곳과 세르비아, 폴란드 공장의 조업을 중단한다. 프랑스 최대 자동차 그룹 PSA도 유럽 15개국에 있는 모든 완성차 공장을 27일까지 폐쇄한다. 르노그룹 역시 프랑스 내 공장의 문을 닫았다. 일본 최대 자동차 기업인 토요타도 포르투갈 공장에 이어 프랑스 공장 가동을 이달 말까지 중단하기로 했다. 중국발 리스크가 잠잠해진 가운데 유럽발 '코로나19 쇼크'에 현지 생산법인을 둔 국내 업체의 위기감도 커지고 있다. 자칫 글로벌 자동차 부품 공급망이 붕괴될 수 있다는 우려가 있어서다. 현대차는 체코와 러시아에서, 기아차는 슬로바키아에서 각각 현지 생산공장을 운영 중이다.
무엇보다 현대·기아차는 유럽에서 전기차 모델 판매에 공을 들이고 있는데, 부품 조달에 차질이 생길 경우 정상적인 공장 가동을 장담할 수 없다. 체코공장에는 코나 일렉트릭, 슬로바키아 공장에서는 유럽 전략 차종인 씨드 플러그인하이브리가 생산된다. 현대·기아차는 각국 상황에 따라 대응하겠다는 전략이다. 회사 관계자는 ""현재는 사전 방역에 최선을 다하고 있고, 아직 가동 중단에 들어간 공장은 없다""면서도 ""코로나19 확산 여부에 따라 상황을 예단하기는 쉽지 않다. 유럽 각국의 국경 폐쇄 등에 따라 부품 조달 등에 문제가 발생할 수 있기에 유동적으로 대응할 수밖에 없다""고 설명했다. 코로나19 확산으로 유럽과 미국에서 소비 심리가 급격히 얼어붙고 있는 것도 큰 타격이다. 사태가 장기화할 경우 생산 및 판매 목표 달성에도 차질이 생길 수밖에 없다. 한국자동차산업협회에 따르면 국내 완성차 업계에 있어 유럽과 북미는 가장 큰 수출 시장이다. 전체 수출 중 72.5%를 차지했다. 지난해 유럽 수출량은 65만3286대, 북미 수출량은 108만6854대였다.
지난해 국내 자동차 생산량은 2009년 이후 처음으로 400만대를 밑돌았고, 연초부터 코로나19 여파로 생산 및 내수 판매 모두 부진에 빠진 상황인데, 유럽·미국발 위기에 또다시 흔들리는 것이다. 올 1~2월 국내 완성차 업계 수출은 전년 동기 대비 27.4% 감소한 27만1568대에 그쳤다. 같은 기간 자동차 생산량은 44만810대로 27.9% 급감했다. 완성차 업체의 생산·판매 부진에 협력사는 고사 위기에 놓일 수도 있다. 김필수 대림대 자동차학과 교수는 ""유럽의 코로나19 확산에 따른 위기는 전 세계적 수요 급감을 불러올 수 있다""며 ""이는 결국 국내 완성차 업체의 실적 악화로 이어질 수 있어 장기적인 대비가 필요한 시점""이라고 말했다.cho84@news1.kr© 뉴스1코리아(), 무단 전재 및 재배포 금지",/news/news_read.nhn?article_id=0004530735&office_id=421&mode=search&query=기아차&page=5
