head,text,url
,"정의선 현대차그룹 수석부회장이 아버지 정몽구 회장에 이어 현대차 이사회 의장직에 올랐다. 현대차는 19일 주총 직후 열린 이사회에서 정의선 수석부회장을 이사회 의장으로 선임했다고 밝혔다.



현대차 관계자는 ""이사회 안건과 운영 등에 대한 높은 이해도를 바탕으로 업무 집행 효율성이 제고될 것으로 기대된다""며 ""현대차는 이사회의 전문성·독립성·투명성 강화를 지속해 추진할 것""이라고 말했다. 단 ""이사회 의장을 경영권으로 보는 시각은 주관적인 것""이라고 덧붙였다.



이사회 의장이 나머지 이사회 구성원과 다른 차별적 권한을 갖는 것은 아니다. 하지만 정 부회장이 현대차그룹 CEO 자리를 '공식화' 했다는 점에서 의미가 작지 않다. 정 부회장은 지난해 정몽구 회장을 대신해 시무식을 주재하며 실질적으로 그룹 경영을 진두지휘했왔다. 이날 의장 선임으로 방점을 찍은 것으로 풀이된다.



현대차그룹 사정에 밝은 한 관계자에 따르면 정 부회장은 이날 이사회에서 ""코로나로 상황이 진중하니까 책임을 지고 의장을 맡아 회사를 경영하겠다""는 뜻을 밝혔다. 정 부회장은 2018년 9월엔 수석부회장으로 승진하며, 그룹 경영 전면에 나섰다. 지난해 주총에선 현대차와 현대모비스 대표이사를 맡아 책임경영을 강화했다.


 이호근 대덕대 자동차학과 교수는 ""국내외 어려움 속에서도 지난해 영업이익이 급등하는 등 최근의 경영 성과를 인정받았다고 볼 수 있다""며 ""정 부회장이 전면에 나선 이후 내놓은 팰리세이드·GV80·K5 등 신차가 모두 소비자의 호응을 얻고 있다는 점도 작용했을 것""이라고 말했다.



공식적으로 그룹 전면에 나선 정 부회장의 앞날은 1999년 정몽구 회장이 현대그룹에서 떨어져 나오며 현대차그룹을 출범할 때만큼이나 엄중하다. 정 부회장은 지난해 '2025 전략' 등 미래 비전을 제시하며 ""미래 현대차는 자동차 50%, 항공 모빌리티 30%, 로보틱스 20%로 가겠다""고 했다. 고태봉 하이투자증권 리서치센터장은 ""그룹 구성원과 미래 비전을 공유하고 성장 동력을 찾아야 하는 리더십이 요구된다""고 말했다.



당장 신종 코로나바이러스 감염증(코로나19)로 인한 현대차 안팎의 어려움이 정 부회장의 위기관리 능력에 대한 시험대가 될 것으로 보인다. 지난달 현대·기아차 판매량은 2018년 같은 기간보다 80~90% 감소했으며, 이런 추세는 이달 들어 미국·유럽까지 확산할 것으로 보인다.



 정몽구 회장때 현대차그룹의 성장 동력으로 꼽힌 '역발상 경영'이 정의선 체제에서 재등장할지도 주목된다. 고 센터장은 ""현대차 러시아공장(2008년), 기아차 조지아 공장(2006년), 터키 공장 증설(2013년)은 모두 글로벌 경쟁 업체가 위기에 처했을 때 결정됐다. 아들에게도 이런 DNA가 있는지 시험대가 될 것""이라며 ""글로벌 자동차 산업에 유례없는 위기가 닥친 상황에서 정 수석부회장이 어떤 선택을 할지 주목된다""고 말했다. 해외 공장 증설 등에 따라 현대차그룹은 2000년대 초반부터 10년 가까이 성장 가도를 달렸다.



노사 문제도 관건이다. 글로벌 경쟁이 가속하며, 원만한 노사 관계의 필요성은 더 중요해졌기 때문이다. 이 교수는 ""소비 측면에서 현대·기아차에 대한 성능에 대한 평가는 수입차만큼 올라왔다. 반면 '귀족 노조'에 대한 반감은 여전히 판매에 영향을 미치고 있다""며 ""새 시대에 맞는 노사관계를 정립하는 것도 중요하다""고 말했다.



김영주 기자 humanest@joongang.co.kr

▶ ▶
/ ⓒ중앙일보(https://joongang.co.kr), 무단 전재 및 재배포 금지",/news/news_read.nhn?article_id=0002985515&office_id=025&mode=search&query=기아차&page=3
,"[머니투데이 최석환 기자] 전기차 보급대수가 매년 증가하면서 1대당 지급되는 보조금은 줄고 있다. 실제로 환경부 최대 지원금은 지난해 900만원에서 올해 820만원으로 80만원이 감소했다. 초소형 전기차 역시 420만원에서 400만원으로 소폭 줄었다. 상황이 이렇다보니 전기차 제조사들의 판촉 경쟁도 갈수록 치열해지고 있다.
 르노삼성자동차는 전기차 'SM3 Z.E.'를 사는 고객들에게 자체적으로 준비한 특별 구매보조금 600만원을 추가로 지원한다. 여기에 국고보조금 616만원과 지방자치단체 보조금을 더하면 구매 비용은 더 낮아진다. 예를 들어 지난 1월말 지자체들 가운데 가장 먼저 올해 전기차 보조금 지원 규모(500만원)를 공고한 제주도에선 'SM3 Z.E.' SE 트림의 경우 1984만원, RE 트림은 2184만원에 각각 구입할 수 있다.
르노삼성은 또 초소형 전기차 트위지 구매고객을 대상으로 30만원 상당의 용품 구입비 지원이나 20만원 현금 할인 등을 선택할 수 있는 프로모션도 진행 중이다.르노삼성 관계자는 ""환경부 보조금이 20만원 줄어든 것에 대한 보상을 해주는 것""이라며 ""매달 이자만 납입하고 원금은 원하는 시기에 자유롭게 상환해도 되는 할부 구매 조건도 매력적""이라고 설명했다.한국GM은 대표 전기차 모델인 볼트 EV를 자체적으로 300만원 할인해 판매한다. 60개월 무이자 할부 프로그램도 운영한다.
기아차는 전기차 구매부터 차량 충전, 중고차 매각까지 책임지는 구매 프로그램 ‘스위치 온(Switch On)’을 마련했다. 이는 기아차 니로 EV와 쏘울 부스터 EV를 구매하는 개인 고객을 대상으로 △저금리 할부 △충전비 지원 △중고차 가격 보장 등의 혜택을 제공하는 것이다.최석환 기자 neokism@mt.co.kr
<저작권자 ⓒ '돈이 보이는 리얼타임 뉴스' 머니투데이, 무단전재 및 재배포 금지>",/news/news_read.nhn?article_id=0004379350&office_id=008&mode=search&query=기아차&page=3
,"[머니투데이 이건희 기자] [(종합)호세 무뇨스 북미권역본부 사장 ""이대로라면…연 판매 최대 20% 영향 받을 것""]코로나19 태풍이 미국 현대자동차를 덮친다. 앨라배마공장은 코로나19 양성 반응을 보인 직원으로 인해 가동을 중단했고, 딜러들의 영업 활동도 멈췄다. 현지에선 ""최악의 상황을 준비하고 있다""는 이야기가 나올 정도다. 19일 현대차에 따르면 미국 앨라배마공장(HMMA)은 18일 오전 10시30분(현지시간)을 기점으로 가동을 중단했다. HMMA는 연산 40만대 규모로 쏘나타, 엘란트라(아반떼), 싼타페 등 주력 차종을 생산하는 곳이다. HMMA는 직원 중 한 명이 코로나19 양성 반응을 보이면서 생산을 중단하고 추가 방역 조치를 진행했다. 앨라배마보건당국(ADPH) 및 질병통제예방센터(CDC)와 협의해 추가 조치도 이뤄지는 중이다. HMMA 측은 충분한 조치 후 생산 재개를 하기에 안전하다고 판단하면 알릴 것""이라고 말했다. 생산 중단은 현대차에만 국한된 것이 아니다. 기아차 공장도 영향권에 들었다. 현대차 관계자는 ""앨라배마 공장 방역을 위해 19일(현지시간) 가동이 중단될 예정""이라며 ""이 공장으로부터 엔진을 공급받는 기아차 조지아 공장도 같은 날 생산이 중단될 것""이라고 말했다. 미국 주요 자동차 업체들도 멈춰선다. 외신에 따르면 GM, 포드, FCA 등 미국 주요 자동차 업체들도 코로나19 확산 방지를 위해 일부 생산시설에서 순환 셧다운을 실시키로 했다.현대차 미국법인은 뉴스룸에 회사의 코로나19 대응 방안도 게재했다. 미국법인은 자동차 수리·지원 등 필수 업무를 제외한 전 직원에 재택근무 지침을 내렸다. 회사 시설과 차량의 청소가 강화했고, 회사 내 교육 프로그램도 중단했다. 고객들을 위한 프로그램도 준비됐다. 지난 14일 신차 구매자가 실직할 경우 6개월 할부금을 유예해주는 '어슈어런스 프로그램'이 코로나19 대응의 일환으로 마련됐다. 호세 무뇨스 현대차 글로벌 최고운영책임자(COO) 겸 북미권역본부장(사장)은 지난 17일 미국 자동차 전문매체와의 인터뷰에서 ""최악을 준비하고 있다""고 밝혔다. 지난 주말까지만 해도 '환상적인 실적'을 보이다가 상황이 급변했다는 것이다. 그는 ""이미 많은 소비자들이 판매·서비스 대리점 방문을 꺼려 하고 있다""며 ""사업에 영향을 미칠 것""이라고 설명했다. 실제로 지난 2월 현대차는 미국에서 전년 동월 대비 16% 증가한 5만3013대를 판매하며 상승세를 탔다. 아반떼·투싼·싼타페·팰리세이드 등이 골고루 팔리며 성장을 이끌었다. 현대차는 지난 17일에는 미국에서 신형 아반떼를 먼저 공개하며 주력 차종에 힘을 싣기도 했다. 그러나 코로나19가 발목을 잡았다. 무뇨스 사장은 ""최악의 시나리오는 코로나19 영향이 8월까지 지속되는 것""이라고 했다. 그러면서 ""아직 단언하기 어렵지만 지금 상태라면 연간 판매가 10~20% 영향을 받을 것 같다""고 우려했다. 업계에선 불확실성에 대한 걱정을 내놓고 있다. 김동하 한국투자증권 연구원은 ""미국의 소비 심리 및 여행 수요 위축으로 성수기인 2분기 자동차 판매가 줄어들 수 있다""며 ""신규 확진자 지속 증가가 불확실성을 키우는 상황""이라고 분석했다. 이건희 기자 kunheelee@mt.co.kr
<저작권자 ⓒ '돈이 보이는 리얼타임 뉴스' 머니투데이, 무단전재 및 재배포 금지>",/news/news_read.nhn?article_id=0004379368&office_id=008&mode=search&query=기아차&page=3
현대기아차 등 육성프로그램 활발혁신 기업문화 도모…새 성장기회 모색전용 투자펀드까지 갖춰 체계적 지원,"올해 국내 5개 대기업 그룹에서 분사한 벤처기업이 최대 30여개사에 이를 것으로 전망된다. 사내 창업 지원을 통해 도전하는 기업 문화를 만들고 새로운 비즈니스 실험까지 진행하겠다는 접근이다.19일 삼성, 현대·기아차, SK, LG, 롯데그룹에 따르면 올해 이들 그룹의 사내 스타트업 가운데 스핀오프(분사)를 준비하고 있는 기업이 적게는 최대 30여개사에 이를 것으로 집계됐다.주요 그룹이 사내 벤처를 육성하고 분사에 적극 나서고 있는 것은 새로운 성장 기회를 모색하기 위해서다. 단순 투자 지원 대상을 넘어 기업의 주요 핵심 기술을 초창기부터 함께 개발하는 파트너로서 동반성장 체제 구축으로 패러다임이 바뀌고 있다. 사내 유망 독자 기술을 독립시켜 세계적인 유니콘 기업으로 육성하겠다는 의지도 담겼다.현대·기아자동차가 사내 스타트업 독립에 가장 적극 나서고 있다. 올 상반기에만 최소 7개 팀이 분사할 예정이다. 루베스트, 젠스웰, 마이셀 등 3개 기업이 최종 심의를 통과했다. 나머지 기업은 심의 단계에 있다. 2000년 사내 스타트업 육성 프로그램인 '벤처플라자'를 가동한 이후 역대 최다 독립 기록을 작성할 것으로 전망된다.SK그룹에서는 SK하이닉스과 SK텔레콤에서 사내벤처 육성 프로젝트인 '하이게러지'와 '스타게이트' 프로그램을 각각 운영하고 있다. 출범 1년도 되지 않는 상황에서 이미 6개 독립법인을 탄생시켰다. 특히 SK텔레콤은 최근 헬스케어 전문 기업 인바이츠 헬스케어를 분사한 것을 비롯해 양자통신기술 전문 기업 IDQ를 합작투자 방식으로 분사했다. 두 기업 모두 SK텔레콤이 개발한 독자 기술을 바탕으로 독립했다. 올해 SK그룹은 3~5개 기업이 추가 분사할 예정이다.삼성그룹은 사내벤처 육성 프로그램 '크리에이티브 랩'(C랩)을 통해 현재까지 259개 과제를 진행했고, 1060명의 임직원이 참여했다. 259개 과제 가운데 40개는 회사에서 독립해 나가 스타트업으로 창업했다.삼성 측은 “임직원들이 AI, 자율주행, 사회공헌 등 다양한 분야를 주제로 매년 아이디어를 1000개 이상 제출하고 있다”면서 “현재 31개 과제가 수행되고 있으며, 이 가운데 일부가 분사할 것”이라고 말했다.롯데그룹은 스타트업 전문 육성 기관인 롯데액셀러레이터에서 1년 동안 인큐베이팅 과정을 거친 뒤 성과에 따라 분사를 추진하고 있다. 2016년 프로그램 가동 이후 2개사가 분사했고, 올해 추가로 롯데칠성 사내벤처로 이동식 주유 서비스를 제공하는 '풀업'과 롯데쇼핑 e커머스 사업본부에서 지난해 9월 첫선을 보인 중고거래 플랫폼 '마켓민트' 등이 분사 준비를 하고 있다.LG의 경우 LG CNS와 LG유플러스가 사내 벤처 프로그램을 가동, 지금까지 총 5개사가 분사했다. 올해 최소 2개사 이상이 분사할 것으로 예상된다.해를 거듭할수록 파격적인 혜택이 더해지고 있다. 최소 1년에서 3년간 현업에서 독립된 근무공간에서 '스타트업'처럼 근무할 수 있도록 자율성을 보장해준다. 또 예산이나 일정 관리 등 과제 운영에 대해서도 자율성이 확보된다. 무엇보다 창업 아이디어를 실현시키지 못하더라도, 분사 이후 자립화에 실패하더라도 회사에 복귀할 수 있다.그룹 내 별도의 투자 조직도 갖춰지고 있다. 롯데액셀러레이터의 경우 사내벤처 지원을 위한 전용 벤처펀드인 '롯데사내벤처1호 펀드'를 만들었다. 삼성벤처투자 역시 삼성 C랩 프로그램에 참여하는 스타트업에 일부 종잣돈을 투자한다. 투자 조직 및 계열사 차원에서 사내벤처에 대한 종잣돈 또는 시리즈A 단계 투자와 함께 인프라 제공과 국내외 네트워킹 등을 지원하는 셈이다. SK에서도 SK하이닉스가 자체 사내벤처 전용펀드를 설립, 지원 및 투자 규모를 확대했다.업계 관계자는 “최근 별도의 벤처투자 조직을 갖춘 대기업이 늘면서 사내벤처기업을 더욱 체계적으로 지원하고 있다”고 말했다.성현희기자 sunghh@etnews.com, 유근일기자 ryuryu@etnews.com",/news/news_read.nhn?article_id=0002873582&office_id=030&mode=search&query=기아차&page=3
,"코로나19 확산으로 미국 앨라배마주에 있는 현대차 공장 가동이 중단된 데 이어 조지아주에 있는 기아차 공장도 하루 휴업에 들어갑니다.현대차는 앨라배마공장 직원이 확진 판정을 받아, 현지 시간으로 18일 오전 10시 반부터 가동을 멈췄다고 밝혔습니다.이어 공장 전체 방역 작업을 진행했고, 주 보건당국과 질병통제예방센터와 협의해 추가 조치를 할 예정이지만 아직 가동 재개 시점은 미정이라고 설명했습니다.또 앨라배마공장에서 엔진을 공급받는 조지아주 기아차 공장도 현지시각 19일 하루 휴업할 예정입니다.현대차는 유럽 체코와 슬로바키아 공장은 정상적으로 가동되고 있다고 밝혔습니다.이지은 [jelee@ytn.co.kr][저작권자(c) YTN & YTN PLUS 무단전재 및 재배포 금지]",/news/news_read.nhn?article_id=0001416933&office_id=052&mode=search&query=기아차&page=3
"앨라배마 공장 가동 중단 여파엔진 수급 문제""향후 일정 미정""","[헤럴드경제 원호연 기자]코로나19 확진 직원이 발견돼 가동이 중단된 현대자동차의 앨라배마 공장에 이어 기아자동차의 조지아주 공장도 19일 가동 중단에 들어간다.현대차그룹은 ""기아차 조지아 공장은 현대차 앨라배마에서 엔진을 공급받는다""며 ""앨라배마 공장이 방역으로 19일 가동 중단돼 조지아 공장도 함께 가동 중단된다""고 밝혔다. 향후 생산 재개 여부에 대해서는 ""아직 미정인 상태""라고 전했다. 이날 생산 직원 한명이 코로나19 확진판정을 받은 앨라배마 공장은 공장 전체를 철저히 방역하는 과정에서 생산라인 가동을 멈췄다. 현대차 미국법인은 ""앨라바마 주 보건당국(ADPH) 및 질병통제예방센터(CDC)와 협의해 추가 조치를 치할 예정""이라고 밝힌 바 있다.
- Copyrights ⓒ 헤럴드경제 & heraldbiz.com, 무단 전재 및 재배포 금지 -",/news/news_read.nhn?article_id=0001650897&office_id=016&mode=search&query=기아차&page=3
▶ 헉! 소리나는 스!토리 뉴스 [헉스]▶ '아는 척'하고 싶은 당신을 위한 [두유노우],"[파이낸셜뉴스] 현대차의 미국 앨라바마 공장이 직원의 코로나19 확진으로 가동이 중단되면서 기아차 조지아 공장도 연쇄적으로 문을 닫게 됐다. 기아차 조지아 공장은 K5와 쏘렌토를 생산하는데 그 엔진을 현대차 앨라바마 공장으로부터 공급받고 있어서다.
 19일 관련 업계에 따르면 기아차의 조지아공장은 셧다운 된 현대차 앨라바마 공장에서 K5와 쏘렌토의 엔진을 더이상 공급받지 못하면서 함께 가동 중단에 돌입했다. 두 공장간 거리는 약 156.3km 정도 된다. 현대차와 기아차 공장 모두 아직 재가동 시기는 정해지지 않았다.
 현대차 앨라바마 공장은 직원의 코로나19 확진이 결정되면서 모든 시설에 방역 조치를 취했다.



 ※ 저작권자 ⓒ 파이낸셜뉴스. 무단 전재-재배포 금지",/news/news_read.nhn?article_id=0004393029&office_id=014&mode=search&query=기아차&page=3
,"창업 열기가 국내 대기업 그룹으로 빠르게 확산되고 있다. 분사(스핀오프) 사내벤처가 연이어 탄생하고 있는데다 창업에 시도하려는 참여 임직원도 빠르게 늘고 있다. 그룹 창업 공모 외 계열사 자발적 사내벤처 프로그램도 생겨나고 있다. 실패에 대한 책임을 묻지 않는 등 과감한 지원책으로 사내 임직원 아이디어 혁신에 '불쏘시개' 역할을 하고 있다.◇그룹별 사내 벤처 육성책 '풍성'…운영자율성 부과국내 5대 그룹들이 사내 벤처 육성에 적극 나서고 있다. 각 그룹마다 차별화된 지원책으로 독립 벤처 육성에 경쟁적으로 나서고 있는 모양새다.삼성그룹은 벤처 육성 프로그램 C랩(Creative Lab)을 통해 현재까지 259개 과제를 진행, 1060명의 임직원이 참여했다. 259개 과제 중 93개는 사내에서 활용됐고, 40개는 회사에서 독립해 나가 스타트업으로 창업했다. 매년 평균 5개사가 분사한 셈이다.C랩 과제에 참여하는 임직원은 1년간 현업에서 벗어나 수원 삼성 디지털시티와 서울 관악구 서울대학교 연구공원 내 삼성전자-서울대 공동연구소에 마련된 독립 공간에서 스타트업처럼 근무할 수 있다. 팀 구성, 예산 활용, 일정 관리 등 과제 운영에 대해 팀 내에서 자율적으로 운영할 수 있다. 직급이나 호칭에 구애 받지 않고 수평적인 분위기에서 일할 수 있다.재계 중에서 가장 먼저 사내 스타트업 육성에 나선 곳은 현대·기아자동차이다. 2000년 '벤처플라자' 프로그램을 시작으로 지난해 9월까지 총 11개사가 스핀오프했다. 지난해 '엠바이옴' '튠잇' '폴레드' 등 3개사가 동시 분사했다. 올해는 스타트업 육성 프로그램을 가동한 이후 연간 기준 역대 최다 독립이 이뤄질 예정이다.현대·기아차도 초반에는 분사가 활발히 이뤄지지 않았으나 지난해부터 속도를 내기 시작했다. 직원들의 혁신 아이디어를 접목할 수 있는 다양한 연구개발(R&D) 활동에 과감하게 투자 지원하면서다.롯데그룹은 신사업 발굴 활성화를 위해 2016년부터 '롯데 사내벤처 프로젝트'를 진행하고 있다. 또 스타트업 투자법인 롯데액셀러레이터를 통해 사내벤처펀드1호를 운용하며 임직원 아이디어 혁신에 마중물을 붓고 있다.롯데액셀러레이터는 전문가와의 1:1 멘토링, 벤처기업 관련 집중화 교육을 비롯한 다양한 창업지원을 제공한다. 사내벤처 프로젝트에서 최종 우승한 직원은 팀 멤버를 구성한 후 롯데액셀러레이터에 파견돼 1년 동안 독자적 사업 활동공간에서 내·외부 간섭 없이 신사업에 도전하게 된다. 1년 후에는 최종 사업화 타당성 검토 결과에 따라 분사하거나 원소속사로 복귀할 수 있다. 롯데는 우승한 직원이 효과적으로 사업을 발전시킬 수 있도록 사업초기지원금 및 투자금 3000만원을 지급한다.◇SK·LG, 계열사별 특성살려 사내벤처 독자 운영SK와 LG는 그룹 차원이 아닌 각 계열사별로 독자적으로 사내벤처 육성책을 추진하고 있다. 계열사별 비즈니스 특성을 반영해 차별화를 꾀했다.SK그룹은 '따로 또같이'라는 기업문화에 따라 계열사별로 가장 잘할 수 있는 분야에 역량을 집중, 그룹 전체의 연계 성과로 묶어낸다는 구상이다. SK하이닉스는 사내벤처 육성 프로젝트인 '하이게러지(HiGarage)'를 통해 4개 사내벤처를 이미 탄생시켰다.SK하이닉스는 자체 사내벤처 전용펀드를 설립해 지원 및 투자규모를 확대하고, 사내 구성원을 대상으로 공모전을 진행해 사내 스타트업을 선발, 전폭적인 지원에 나서고 있다. 4개 스타트업은 법인 설립을 마쳤고 본격적인 사업 전개를 앞두고 있다.SK텔레콤은 사내 유망 독자 기술을 독립시켜 세계적 유니콘 기업을 육성하겠다는 목표로 '스타게이트' 프로그램을 운영중이다. 스타게이트를 통해 광학엔진 전문기업 '옵틱스'가 설립을 준비하는 것을 비롯해 음원분리기술, 빅데이터 분석 기술 등이 사내벤처로 독립을 검토 중이다. 옵틱스의 경우 빔프로젝터 등에 탑재돼 최대 100인치 영상을 제공 가능한 기술력을 갖췄다.스타게이트는 정보통신기술(ICT) 전문기업으로서 장점을 살려 △기술 상용화 가능성 검증 △거점 시장 검토 △기술 스핀아웃 △성장 지원 등 4단계로 지원한다. 분사한 기술이 꾸준히 발전하도록 공간·장비·기술이 지원되며 외부 전문가와 연계해 사업 운영과 발전 방향에 대한 별도 코칭 프로그램을 제공하는 게 특징이다.LG그룹도 LG CNS, LG디스플레이, LG유플러스에서 사내 벤처 지원 프로그램을 운영하고 있다. 회사는 이들이 사내벤처 활동에만 전념할 수 있도록 별도 전담 조직을 만들었다. 사내벤처 설립 후에는 비용, 공간, 전문 멘토링과 아이디어를 제시한 임직원이 아이템 기획부터 사업화까지 직접 책임지고 수행할 수 있도록 지원한다. 사내벤처들은 회사 설립 후 최대 1년 동안 준비 과정을 거쳐 최종적으로 창업 혹은 사내 사업화라는 두갈래 길에서 선택한다.이 외에 롯데그룹 역시 최근 그룹 공모 외 계열사 자발적으로 사내벤처 프로그램을 추가 도입하고 있다.◇성실 실패에 “책임 묻지마”…재입사 문 열려대기업 그룹의 사내 창업 열풍이 지속되고 있는 주된 배경은 본사에서 창업 실패에 대한 책임을 묻지 않아 직원들의 부담감이 적기 때문이다. 창업 준비 과정에서 실패하더라도, 혹은 분사에 성공했으나 자립에 실패하더라도 부담이 없다.삼성의 경우 C랩에서 스타트업으로 분사할 때, 5년 내 희망 시 재입사가 가능하다. 현대·기아차, 롯데그룹도 분사 후 3년 내 희망 시 재입사 가능하다. 특히 롯데그룹의 경우 3년의 창업 기간을 '창업휴직제'로 적용, 재입사 시 부담감을 줄였다.LG의 경우 계열사별로 기준이 다르다. LG유플러스의 경우 분사 이후 2년 이내, LG CNS는 년도 제한 없이 복귀 가능하다.대기업 관계자는 “창업의 가장 큰 아킬레스건이 실패에 대한 두려움, 돌아갈 곳이 없을 것이라는 막연함”이라며 “임직원들이 자신의 아이디어로 창업까지 과감한 도전을 해볼 수 있는 기회를 제공해, 보다 진취적이고 도전적인 기업 문화를 이끌어 나가고자 하는 것”이라고 말했다.<표> 5대 그룹의 사내벤처 프로그램 운영 현황<자료:업계 취합>성현희기자 sunghh@etnews.com, 박소라기자 srpark@etnews.com, 박준호기자 junho@etnews.com, 박지성기자 jisung@etnews.com",/news/news_read.nhn?article_id=0002873596&office_id=030&mode=search&query=기아차&page=3
