head,text,url
"2019년 탄소정보공개 프로젝트 평가서 국내 기업 중 최고 성적 달성현대차, 2년 연속 탄소경영 아너스 클럽, 수자원 관리 부문 첫 참여 최우수상기아차, 선제적 기후변화 대응 노력 인정받아 탄소경영 아너스 클럽 첫 영예","[헤럴드경제 이정환 기자] 현대·기아차가 세계적인 지속가능경영 평가기관으로부터 국내 기업 최고의 평가를 받았다.현대자동차와 기아자동차는 글로벌 환경경영 인증기관인 ‘탄소정보공개 프로젝트(CDP, Carbon Disclosure Project)’가 실시한 2019년도 평가에서 국내 기업 중 평가점수 상위 5개사에만 주어지는 ‘탄소경영 아너스 클럽(Honors Club)’에 선정됐다고 28일 밝혔다.특히 현대차는 지난해에 이어 2년 연속 탄소경영 아너스 클럽에 선정되는 영예를 안았다.탄소정보공개 프로젝트(CDP)는 다우존스 지속가능성지수(DJSI), FTSE4GOOD 지수 등과 함께 기업의 지속가능성을 평가하는 가장 공신력 있는 지표로 인정받고 있다.전세계 금융투자기관의 위임을 받아 각국 주요 상장기업을 대상으로 기후변화, 수자원 등 글로벌 환경 이슈 대응과 관련된 평가를 시행하고, 결과에 따라 리더십A(Leadership A), 리더십A-(Leadership A-), 매니저먼트B(Management B), 매니저먼트B-(Management B-) 등 8개[1]로 등급을 나누는 한편, 평가점수 상위 5개사는 탄소경영 아너스 클럽으로 선정한다.현대차는 이번 평가에서 ▷수소전기차·전기차 등 친환경차 개발 및 보급 ▷사업장별 온실가스 고효율 감축 설비 도입 ▷아산공장·울산공장 태양광 패널 설치 ▷아산공장 무방류시스템 등 중장기적인 환경경영 강화 활동 등을 인정받아 탄소경영과 수자원 부문에서 최고 등급인 리더십A를 획득하고 탄소경영 아너스 클럽의 영예를 안았다.특히 현대차는 올해 수자원 관리 부문에 처음으로 참여해 최고 등급인 리더십A를 획득하며 지속가능경영 최우수 기업으로 선정됐다.기아차는 이번 평가에서 ▷친환경차 판매를 통한 친환경차 시장 확대 주도 ▷생산공정 고효율 모터 및 터보 냉동기, 공조기 개선 등을 통한 온실가스 감축 ▷투명한 탄소배출량 정보공개 ▷구체적인 탄소경영 추진 등 선제적인 기후변화 대응 노력을 인정받아 최고 등급인 리더십A를 획득하고 탄소경영 아너스 클럽의 영예를 안았다.올해는 전 세계에서 8300여개의 기업 평가가 진행됐으며, 기후변화 부문에서 리더십A 등급을 받은 기업은 총 181개사로 이 중 한국 기업은 현대차와 기아차를 포함해 총 9개사다.수자원 관리 부문에서 리더십 A등급을 받은 기업은 총 72개사이며, 이 중 한국 기업은 현대차를 포함해 총 2개사다.현대·기아차 관계자는 “이번 평가에서 현대·기아차 모두 최고의 성적을 받으며 지속가능경영의 모범이 됐다”며, “향후에도 생산부터 판매에 이르는 가치사슬 효율화, 신재생에너지 사용 확대 및 사업장 온실가스 감축 등을 보다 적극적으로 시행해 나갈 예정”이라고 말했다.
- Copyrights ⓒ 헤럴드경제 & heraldbiz.com, 무단 전재 및 재배포 금지 -",/news/news_read.nhn?article_id=0001667816&office_id=016&mode=search&query=기아차&page=2
쌍용차 내달 8영업일 휴무 예정현대차 울산3공장도 3일간 중단수요 줄어 재고 물량 조절 나서,"[서울경제] 국내 완성차 업체들이 신종 코로나바이러스 감염증(코로나19)발 수출 절벽에 오는 5월 공장 가동을 잇달아 멈춰 세운다.28일 업계에 따르면 현대·기아자동차, 르노삼성자동차, 가 다음달 4일 공장 문을 닫는다. 한국지엠(GM)도 4일 가동 중단안을 놓고 노사가 협의하고 있다. 국내 완성차 업체들이 내수를 비롯한 미국과 유럽 등 주요 수출국의 수요절벽으로 물량 조절에 나섰다는 분석이다. 다만 구체적인 휴무 일수는 업체·라인별 차종 판매 현황에 따라 차이가 난다. 쌍용차의 경우 다음달 4일 휴무를 포함해 5월 중 총 8영업일에 대해 휴무할 예정이다. 판매량 감소로 공장 가동률이 떨어지며 생산 물량 조절에 나섰다는 관측이 나온다.앞서 이달 30일부터 다음달 5일까지 징검다리 연휴에 국내 전체 공장을 휴업하기로 한 는 추가 휴무를 결정했다. 이날 현대차는 다음달 6~8일 울산 3공장의 가동을 추가로 중단하기로 했다. 수출 비중이 높은 i30·아이오닉·베뉴의 수출 물량이 감소해서다. 현대차 울산 4공장 포터 생산라인은 지난 27일부터 29일까지 사흘간 먼저 공장을 세웠다. 중동·아시아 등 수요 감소에 대응하기 위해서다.는 27일부터 다음달 8일까지 경기 광명 소하리 1·2공장과 광주 2공장을 멈춰 세운다. 광주 3공장 대형버스 생산라인은 27일부터 3일간 가동을 중단한다. 추가로 소하리 1·2공장은 다음달 22~25일에도 임시로 가동을 중단한다. 이들 공장은 수출 물량이 많은 곳으로 재고 조절을 위해 운영을 중단한다.르노삼성은 이달 30일부터 다음달 10일까지 총 11일간 가동을 중단한다. 영입일수로 따지면 나흘이다. 르노삼성 관계자는 “가정의 달을 맞아 직원 만족도를 높이기 위해 가동 중단을 결정했다”고 설명했다./서종갑기자 gap@sedaily.com저작권자 ⓒ 서울경제, 무단 전재 및 재배포 금지",/news/news_read.nhn?article_id=0003730929&office_id=011&mode=search&query=기아차&page=2
"현대·기아차, '탄소정보공개 프로젝트' 평가 '탄소경영 아너스 클럽' 선정","[더팩트 | 서재근 기자] 현대·기아자동차가 세계적인 지속가능경영 평가기관으로부터 국내 기업 최고의 평가를 받았다.현대자동차(현대차)와 기아자동차(기아차)는 글로벌 환경경영 인증기관인 '탄소정보공개 프로젝트(CDP_)'가 실시한 2019년도 평가에서 국내 기업 가운데 평가점수 상위 5개사에만 주어지는 '탄소경영 아너스 클럽'에 선정됐다고 28일 밝혔다.이로써 현대차는 지난해에 이어 2년 연속 탄소경영 아너스 클럽에 선정되는 영예를 안았다.CDP는 다우존스 지속가능성지수(DJSI), FTSE4GOOD 지수 등과 함께 기업의 지속가능성을 평가하는 공신력 있는 지표로 꼽힌다. 전 세계 금융투자기관의 위임을 받아 각국 주요 상장기업을 대상으로 기후변화, 수자원 등 글로벌 환경 이슈 대응과 관련된 평가를 시행한다. 결과에 따라 리더십A, 리더십A-, 매니저먼트B, 매니저먼트B- 등 8개로 등급을 나눠 평가점수 상위 5개사는 탄소경영 아너스 클럽으로 선정한다.현대차는 이번 평가에서 △수소전기차·전기차 등 친환경차 개발 및 보급 △사업장별 온실가스 고효율 감축 설비 도입 △아산공장·울산공장 태양광 패널 설치 △아산공장 무방류시스템 등 중장기적인 환경경영 강화 활동 등을 인정받아 탄소경영과 수자원 부문에서 최고 등급인 리더십A를 획득하고 탄소경영 아너스 클럽의 영예를 안았다.기아차는 이번 평가에서 △친환경차 판매를 통한 친환경차 시장 확대 주도 △생산공정 고효율 모터 및 터보 냉동기, 공조기 개선 등을 통한 온실가스 감축 △투명한 탄소배출량 정보공개 △구체적인 탄소경영 추진 등 선제적인 기후변화 대응 노력을 인정받아 최고 등급인 리더십A를 획득하고 탄소경영 아너스 클럽의 영예를 안았다.현대·기아차 관계자는 ""이번 평가에서 양사 모두 최고의 성적을 받으며 지속가능경영의 모범이 됐다""며 ""앞으로도 생산부터 판매에 이르는 가치사슬 효율화, 신재생에너지 사용 확대 및 사업장 온실가스 감축 등을 보다 적극적으로 시행해 나갈 예정""이라고 말했다.likehyo85@tf.co.kr저작권자 ⓒ 특종에 강한 더팩트 & tf.co.kr 무단 전재 및 재배포 금지",/news/news_read.nhn?article_id=0000024357&office_id=629&mode=search&query=기아차&page=2
,"(서울=뉴스1) = 현대자동차와 기아자동차는 글로벌 환경경영 인증기관인 ‘탄소정보공개 프로젝트(CDP, Carbon Disclosure Project)’가 실시한 2019년도 평가에서 국내 기업 중 평가점수 상위 5개사에만 주어지는 ‘탄소경영 아너스 클럽(Honors Club)’에 선정됐다고 28일 밝혔다. 최두하 현대차 상무(왼쪽)와 조정현 기아차 실장이 기념촬영을 하고 있다. (현대기아차 제공) 2020.4.28/뉴스1photo@news1.kr© 뉴스1코리아(), 무단 전재 및 재배포 금지",/news/news_read.nhn?article_id=0004611876&office_id=421&mode=search&query=기아차&page=2
,"국내 완성차들이 4월에 이어 5월에도 '셧다운'(일시 가동 중단)에 돌입한다. 코로나19 여파에 따른 생산량 조정 및 직원 사기 진작 차원이다.28일 업계에 따르면 쌍용자동차는 5월 중 최대 8일 휴업을 검토중이다. 라인별로 5월 4일 휴업을 포함해 총 8일간 가동을 중단한다.현대자동차는 이달 30일부터 내달 5일까지 대체 휴무와 연휴를 이용해 국내 사업장 가동을 중단한다.이중 i30, 베뉴, 아반떼 등을 생산하는 울산 3공장은 5월 6일부터 8일까지 추가로 임시 휴무를 단행한다. 이에 따라 3공장은 오는 5월 11일일부터 생산을 재개한다.앞서 포터 등을 생산하는 울산 4공장은 이달 27~29일까지 생산을 중단하고 내달 6일부터 생산을 재개하기로 했다.기아자동차는 소하리 1·2공장 가동을 총 8일간 중단한다. 구체적인 날짜는 4월 27~29일, 5월 6~8일·22일·25일이다.휴무일이 늘어나면서 소하리 공장은 5월 평일 기준 13일 가량만 가동될 것으로 보인다. 소하리 공장 내 완성차 생산과 연계된 부서 역시 이 기간 동안 휴업에 돌입한다.기아차 광주2공장도 가동 중단에 돌입한다. 광주2공장은 4월 27~29일과 5월 6~8일 총 6일간 가동을 중단할 예정이다.르노삼성자동차도 이달 30일부터 이어지는 황금연휴에 3일의 추가휴무를 더해 총 11일의 장기연휴에 돌입한다.이번 가동중단은 차량 수요 감소에 따른 생산량 조정보다는 직원 사기 진작을 위한 휴식 차원이 크다고 회사측은 강조했다.르노삼성 관계자는 “가정의 달을 맞아 직원들에게 충분한 휴식을 제공하기 위해 사흘의 휴무를 더해 장기 휴무를 실시하게 됐다”고 말했다.데일리안 조인영 기자 (ciy8100@dailian.co.kr)ⓒ (주)데일리안 - 무단전재, 변형, 무단배포 금지",/news/news_read.nhn?article_id=0002398927&office_id=119&mode=search&query=기아차&page=2
"현대·기아·르노·쌍용차, 내달 4일 휴업…한국지엠도 검토현대차 울산3·르노 부산·기아차 광주2·소하리공장 8일까지","[서울=뉴시스] 박주연 기자 = 완성차 국내공장들이 5월에도 생산 차질에서 빠져나오지 못할 전망이다. 지난 2월 중국산 부품 '와이어링 하네스' 수급 문제로 국내5개 완성차공장이 멈춰선 이후 가동 중단이 끊이지 않으며 타이어업계와 부품업계는 비명을 지르고 있다.
28일 업계에 따르면 현대·기아·르노삼성·쌍용차가 모두 징검다리 연휴인 다음달 4일 공장을 쉰다. 한국지엠 역시 4일 가동 중단을 검토하고 있다. 특히 현대차 울산3공장, 기아차 광주2공장과 소하리공장, 르노삼성 부산공장은 6~8일도 휴업한 후 11일 문을 열 예정이다. 영업일수로 따지면 4일과 6~8일 나흘간 가동을 중단하는 것이지만 실질적으로는 이달 30일 부처님오신날, 다음달 1일 노동절과 주말 등을 붙여 이달 30일부터 다음달 10일까지 11일간 공장 가동이 멈춰선다.미국과 유럽 등 전세계에서 신종 코로나바이러스 감염증 (코로나19)이 기승을 부리며 판매에 제동이 걸린 만큼 징검다리 연휴에 가동을 중단하고 수출 물량 생산을 조절하겠다는 구상이다. 현대차 울산3공장은 i30, 아이오닉, 베뉴의 생산이 이뤄지는 곳으로 코로나19로 인해 해외판매에 제동이 걸리며 가동 중단이 결정됐다. 현대차 측은 ""현대차 울산3공장이 6~8일 임시 휴업하기로 했다""며 ""수출 물량 감소 때문""이라고 설명했다.기아차 역시 다음달 4일 이후에도 대규모 휴업이 예정돼 있다. 기아차 광주2공장과 광명 소하리 1, 2공장은 다음달 8일까지 휴업한다.르노삼성 역시 8일까지 부산공장의 문을 닫는다. 르노삼성은 ""지난 2월 중국산 와이어링 하네스 부족 문제로 나흘간 문을 닫은 후에는 코로나19에도 불구하고 공장을 풀가동해왔다""며 ""5월 가정의 달이기도 하니 4일과 6~8일 나흘간 공장을 멈춰 직원 만족도를 높이고 작업환경 개선 등 공사를 할 예정""이라고 설명했다.이 관계자는 ""가동 중단 이후에는 XM3, QM3 등 대기물량이 많은 차종을 우선순위로 생산할 예정""이라고 덧붙였다.2월부터 시작된 완성차 국내공장의 조업차질이 5월까지 이어지며 부품업계는 비명을 지르고 있다. 완성차업체의 타격은 1, 2, 3차 협력사로 내려갈 수록 더욱 확산되며 파장을 일으킨다. 자동차산업협회에 따르면 올해 만기를 밪는 자동차부품사들의 채무는 2조4000억원으로, 매출 급감 사태가 이어지면 연쇄부도마저 우려되는 지경이다. 100대 자동차부품사의 절반가량이 신용등급 B+ 이하인 것도 문제다. 현대차그룹에 차량용 샤시와 바디 부품을 생산하는 1차 협력사 화신은 올해 말까지 2377억원의 차입금 만기가 돌아오지만 지난해 말 기준 현금성 자산은 712억원으로 빠듯하다. 부산주공 역시 올해 말까지 1000억원의 차임금 만기가 돌아오지만 현금성 자산은 220억원에 불과하다. 현대차 1차 협력사인 신원의 경우 단기차입금이 353억원이지만 현금성 자산은 12억원이다. 업계 관계자는 ""완성차업체들이 줄줄이 생산차질을 빚으며 기초체력이 약한 부품업체들이 위기를 맞고 있다""며 ""해외에 공장을 둔 업체들의 경우 타격은 더욱 크다""고 우려를 나타냈다. pjy@newsis.com<ⓒ 공감언론 뉴시스통신사. 무단전재-재배포 금지>",/news/news_read.nhn?article_id=0009838695&office_id=003&mode=search&query=기아차&page=1
,"(서울=연합뉴스) 현대자동차와 기아자동차가 글로벌 환경경영 인증기관인 '탄소정보공개 프로젝트(CDP, Carbon Disclosure Project)'에서 실시한 2019년도 평가에서 국내 기업 중 평가점수 상위 5개사에만 주어지는 '탄소경영 아너스 클럽(Honors Club)'에 선정됐다고 28일 밝혔다.사진은 현대자동차 최두하 상무(왼쪽), 기아자동차 조정현 실장이 기념 촬영을 하는 모습. 2020.4.28

 [현대기아차 제공. 재판매 및 DB 금지]

photo@yna.co.kr",/news/news_read.nhn?article_id=0011577612&office_id=001&mode=search&query=기아차&page=1
▶ 헉! 소리나는 [헉스] ▶ '너 그거 아니?' [두유노우]▶ 지금 파이낸셜뉴스 채널 구독하고 경품 GET!,"[파이낸셜뉴스] 완성차업계가 징검다리 연휴기간에 국내 조업을 중단한다. 최장 10일이상 가동 중단으로 수출 감소에 따른 재고물량 조절과 생산시설 보수 등 수요 대응 및 재정비에 나선다.
 28일 업계에 따르면 현대·기아차는 오는 5월4일에 휴업하기로 결정했다. 이에 따라 오는 30일부터 다음달 5일까지 이어지는 징검다리 연휴기간에 현대차는 국내 전 공장의 가동을 멈춘다. 기아차는 현대차보다 3일이 연장된 5월8일까지 생산을 중단한다. 이 경우 주말인 5월10일까지 이어져 연휴기간이 10일이 넘는다. 수출물량 감소로 이미 지난 27일부터 휴업에 들어간 기아차 소하리1,2공장, 광주 2공장, 광주3공장 버스라인은 평일 정상가동일 기준으로 7일가량 가동을 중단하게 된다.
 르노삼성차도 기아차와 마찬가지로 오는 30일부터 다음달 8일까지 휴업하기로 했다.
 르노삼성차 관계자는 ""직원들의 복지와 생산시설 보수 등을 위해 5월8일까지 조업을 쉬기로 했다""고 설명했다. 연휴기간에 생산라인을 정비해 XM3의 생산 비율을 확대할 것으로 전해졌다. 르노삼성차 부산공장은 단일 생산라인에서 7종의 차량을 혼류 생산하고 있다. 이날 쌍용차도 노동조합과 협의해 5월 4일에 대체휴가 사용을 확정지어 오는 30일부터 5월5일까지 국내 생산을 중단한다.
 한국GM은 연휴기간에 낀 5월4일에 생산을 멈출지 현재 검토중이다. 수출비중이 높은 미국 시장에 따라 탄력적으로 대응해야해서다. 미국의 경제재개 움직임이 가시화되면 수출이 늘어날 수도 있어 29일까지 상황을 지켜보자는 분위기이다.
 업계 관계자는 ""코로나19로 이달 1일부터 20일까지 승용차와 자동차부품 수출이 각각 28.5%, 49.8% 감소하는 등 수요가 크게 꺽이고 있다. 실제 수출물량이 줄어든 모델의 생산라인은 지난주이후 휴업에 들어가고 있다""며 ""연휴를 적극 활용해 조업일을 줄이고, 재고물량을 조절해야할 필요성이 커졌다""고 전했다.



 ※ 저작권자 ⓒ 파이낸셜뉴스. 무단 전재-재배포 금지",/news/news_read.nhn?article_id=0004416223&office_id=014&mode=search&query=기아차&page=1
"SK하이닉스 물경영 리더십 ALGD 기후변화대응, 물경영 우수","[서울경제] 현대·기아자동차와 LG전자가 글로벌 환경경영 인증기관인 ‘탄소정보공개 프로젝트(CDP·Carbon Disclosure Project)’가 실시한 2019년도 평가에서 상위 5개사에만 주어지는 ‘탄소경영 아너스 클럽’에 선정됐다고 28일 밝혔다. 특히 현대차는 지난해에 이어 2년 연속 탄소경영 아너스 클럽에 선정되는 영예를 안았다. CDP는 다우존스지속가능성지수(DJSI), FTSE4GOOD 지수 등과 함께 기업의 지속가능성을 평가하는 가장 공신력 있는 지표로 인정받고 있다. 전 세계 금융투자기관의 위임을 받아 각국 주요 상장기업을 대상으로 기후변화, 수자원 등 글로벌 환경 이슈 대응과 관련된 평가를 한다. 결과에 따라 리더십A, 리더십A-, 매니저먼트B, 매니저먼트B- 등 8개로 등급을 나누고 평가점수 상위 5개사는 탄소경영 아너스 클럽으로 선정된다. 올해는 전 세계 8,300여개의 기업 평가가 진행됐다.현대차는 이번 평가에서 △수소전기차·전기차 등 친환경차 개발 및 보급 △사업장별 온실가스 고효율 감축 설비 도입 △아산공장·울산공장 태양광 패널 설치 등 환경경영 강화 활동을 인정받았다. 기아차는 △친환경차 판매를 통한 친환경차 시장 확대 주도 △생산공정 고효율 모터 및 터보 냉동기, 공조기 개선 등을 통한 온실가스 감축 등이 높은 평가를 받았다. LG전자는 지난해 오는 2030년까지 탄소중립을 실천하는 ‘탄소중립 2030’을 선언했다. 동시에 2030년까지 제품 생산 단계에서 발생하는 탄소를 2017년 대비 50% 수준으로 줄일 계획이다. 수질 관리 분야에서는 SK하이닉스와 LG디스플레이가 돋보였다. SK하이닉스는 ‘2019 CDP 코리아 어워드’에서 ‘물 경영’ 부문 최고 등급인 ‘리더십A’를 받고 대상을 수상했다. SK하이닉스는 효율적인 수자원 관리를 위해 2018년 ‘2022 에코(ECO) 비전’을 발표했으며 2022년까지 국내 사업장의 일 평균 수자원 재활용량을 6만2,000톤까지 늘리겠다는 목표를 세운 바 있다. LG디스플레이는 기후변화 대응과 물경영 평가 부문 모두에서 우수 기업상을 수상했다./박한신기자 hspark@sedaily.com저작권자 ⓒ 서울경제, 무단 전재 및 재배포 금지",/news/news_read.nhn?article_id=0003730989&office_id=011&mode=search&query=기아차&page=1
,"신종 코로나바이러스 감염증(코로나19) 확산으로 가동을 멈췄던 미국과 유럽의 주요 완성차 공장들이 이달 말부터 다음달 초까지 단계적으로 가동을 재개한다. 하지만 조업자 간 거리두기 등 코로나19 방역대책을 모두 지켜가며 기존의 생산성을 유지할 수 있을지가 최대 과제로 떠올랐다.
28일 현대자동차에 따르면 체코 정부는 24일(현지 시간) 현대차 체코공장 근무를 위한 현대차, 협력업체 인력 786명의 입국을 허용하기로 했다. 체코공장은 유럽의 코로나19 확산이 심각해지면서 지난달 23일 가동을 멈췄다가 이달 14일 조업을 재개했다. 하지만 한국 인력이 없어 연내 출시를 목표로 하고 있는 스포츠유틸리티차량(SUV) 투싼의 현지 생산라인 설치 작업에 차질을 빚어왔다. 미국에서도 현대·기아차와 도요타자동차의 현지 공장들이 다음달 4일부터 가동을 재개하기로 했다. 또 유럽의 폭스바겐, 다임러, BMW 등도 이달 중순 차량 생산을 시작한 데 이어 GM과 포드도 미국 본사 공장을 5월 초 정상화한다.
하지만 조업 재개가 당장 코로나19 이전 수준의 생산량 회복으로 이어지긴 어려울 전망이다. 27일 조업을 재개한 폭스바겐 독일 볼프스부르크 본사 공장은 당분간 생산량을 코로나19 이전의 40%인 주당 6000대 선으로 유지하기로 했다. 소비심리 위축으로 인한 생산량 조절도 있지만, 근로자들의 건강이 최우선 고려사항이 됐기 때문이다. 근로시간을 단축하고 근로자들의 간격을 5m 이상 떨어뜨리며 교대시간마다 공구를 소독하는 과정에서 생산속도가 코로나19 이전에 비해 뒤쳐졌다.
현대·기아차를 비롯해 앞서 조업을 재개한 중국의 자동차 공장도 비슷한 상황이다. 시장조사업체 IHS마킷은 “근로자 건강을 위한 새로운 업무지침들이 생산량에 영향을 미칠 전망”이라고 분석했다.
한편 세계 자동차 업계는 ‘국제 분업’을 대신할 새로운 생산체제를 고민하기 시작했다. 코로나19 사태를 겪으면서 부품 1개만 공급이 끊기거나, 근로자 1명이 감염돼도 전체 생산이 멈추는 걸 경험했기 때문이다. 자동차 전문가들은 가격경쟁력을 위해 해외로 뻗어나갔던 부품 공급망이 자국 중심으로 재편될 가능성이 높다고 전망한다. 제조업 기반을 자국 내에 남겨 필요한 것을 스스로 만드는 것이 불확실성을 없애는 해결책이라는 것이다.
김필수 대림대 자동차과 교수는 “앞으로 자동차 생산구조는 국제 분업 대신 자국 중심의 제조업 기반 확대를 통해 부품공급 및 생산구조를 안정화시키는 게 중요해질 것”이라고 분석했다.서형석 기자 skytree08@donga.comⓒ 동아일보 & donga.com, 무단 전재 및 재배포 금지",/news/news_read.nhn?article_id=0003283417&office_id=020&mode=search&query=기아차&page=1
