head,text,url
,"최대 110만원의 가격 인하 효과를 누리게 된 쌍용 티볼리.  제공 | 쌍용차[스포츠서울 이상훈 기자] 정부는 지난달 28일 코로나19 확산으로 침체된 내수 경기 부양을 위해 ‘경기부양종합대책’을 발표했다. 이 중 자동차 산업에는 모든 승용차 구매 시 부과되는 개별소비세(개소세)를 100만원 한도 내에서 70%까지 인하하기로 했다. 개소세 인하는 1일부터 시작돼 6월 말일까지 3개월간 한시적으로 적용된다. 이에 따라 개소세 인하는 최대 100만원까지, 교육세는 30만원(개소세의 30%)까지 인하된다. 여기에 개소세와 교육세 합산금액의 10%인 부가가치세 13만원까지 할인받는다면 최대 143만원까지 저렴하게 차량을 구매할 수 있다. 개소세 인하가 적용된 쌍용차 판매가격표.  제공 | 쌍용차개소세 인하 정책이 결정된 직후 국내 완성차량 업체들은 일제히 인하된 차량 가격을 발표했다. 쌍용차는 차량 가격에서 개소세를 70%(현행 5%에서 1.5%로 인하 폭 확대) 인하하기로 했다. 그 결과 교육세 등을 포함한 차량 가격은 최저 73만원에서 최대 143만원까지 낮아지게 됐다. 차종별로는 G4 렉스턴이 143만원으로 가장 많이 할인되며 코란도 가솔린의 경우 옵션에 따라 98만~119만원, 디젤 모델은 96만~123만원을 할인받는다. 티볼리도 가솔린의 경우 73~102만원, 디젤은 89만~110만원을 할인받을 수 있다.개소세 인하가 적용된 르노삼성자동차 판매가격표.  제공 | 르노삼성자동차르노삼성자동차도 개소세 할인 혜택을 받을 수 있다. 르노삼성자동차는 엔진 및 트림별로 SM6는 92만9000원에서 최대 143만원까지, QM6는 103만원에서 최대 143만원까지 가격을 인하한다. 9일 정식 출시되는 XM3의 경우도 최종 가격 공개 때 개소세 인하분이 함께 반영돼 더욱 경쟁력 있는 가격대를 형성하게 됐다.2020년형 SM6는 프리미어 트림 선택 시 최대 할인 폭인 143만원의 가격 인하 효과를 받을 수 있다.  제공 | 르노삼성자동차한국지엠 역시 이번 개소세 인하로 쉐보레 차량 가격을 최소 77만~최대 143만원 낮추게 됐다. 쉐보레의 최신 출시 차량이자 뛰어난 가성비를 보여줬던 트레일블레이저의 경우 시작가가 기존 1995만원에서 1910만원으로 낮아지게 되며 트레일블레이저 구매자의 과반수 이상이 선택한 최고급 트림인 RS 모델의 경우 이전보다 110만원가량 낮출 수 있게 됐다. 더 뉴 말리부는 전 모델과 트림에 걸쳐 102만~142만원을, 이쿼녹스는 88만~119만원, 더 뉴 트랙스는 77만~106만원 등 개소세 인하 혜택을 보게 됐다. 쉐보레 차량 중 가격대가 높은 트래버스와 카마로 SS는 전 트림에 걸쳐 이번 개소세 인하 최대 혜택 폭인 143만원 할인을 받는다.개소세 인하가 적용된 한국지엠의 쉐보레 판매가격표.  제공 | 한국지엠현대·기아차 역시 전 차종에 걸쳐 최대 143만원의 가격 인하 효과를 볼 수 있다. 현대·기아차도 2일쯤 3월 판매조건과 더불어 개소세 할인 혜택이 더해진 구매조건을 발표할 예정이다. 업계에서는 이번 개소세 70% 인하가 코로나19로 어려움을 겪고 있는 자동차 업체의 판매를 촉진시키고 소비자의 구매부담을 낮춰줄 것으로 기대하고 있다. party@sportsseoul.com[기사제보 news@sportsseoul.com]
Copyright ⓒ 스포츠서울&",/news/news_read.nhn?article_id=0000632020&office_id=468&mode=search&query=기아차&page=1
,"[머니투데이 이건희 기자]
정부가 승용차 개별소비세(개소세) 인하 조치를 연장하고 인하폭도 확대하면서 국산 자동차 가격이 최대 143만원 저렴해진다. 1일 국산차 업계는 지난달 28일 정부의 경제활력대책회의에서 확정된 개별소비세 인하 확대 조치에 따라 일제히 현재 출시했거나 출시 예정인 차량에 대한 가격 수정에 나섰다. 차량 가격이 인하된다기보다는 세금이 줄어드는 것이지만 소비자 입장에서는 실제 차량 구입비가 줄어드는 만큼 개소세 인하 효과를 부각하는 데 발벗고 나선 분위기다.이번 조치는 이달부터 오는 6월까지 승용차를 구매하면 개소세를 5%에서 1.5%로 100만원 한도에서 70% 인하하는 내용이다. 이 기간 차량을 구매하면 △개소세 최대 100만원 △교육세 30만원(개소세의 30%) △부가가치세 13만원(개소세·교육세 합산액의 10%) 등 최대 143만원을 절약할 수 있다. 2018년 7월 중순부터 지난해 말까지 시행됐던 개소세 30% 인하 정책보다 인하 폭이 2배 이상 확대됐다. 정부는 약 4700억원 수준의 세금 혜택이 소비자에게 돌아갈 것으로 전망했다. 한국GM 쉐보레는 이날 신차 '트레일블레이저'의 가격이 85만~111만원 낮아진다고 알렸다. 기본 모델 가격은 1995만원에서 1910만원으로 내려갔다. 가장 인기 있는 최고급 RS 모델은 2620만원에서 2509만원이 됐다. 트래버스는 143만원, 더 뉴 말리부는 102만~142만원, 더 뉴 트랙스 77만~106만원의 가격인하 효과를 볼 수 있다. 르노삼성이 오는 9일 출시할 신차 'XM3'도 개소세 인하 적용 대상에 포함됐다. 지난달 사전계약 당시 공지한 책정가격(1795만~2695만원)이 70만원 가량 인하될 것으로 보인다.'SM6'는 92만9000~143만원, 'QM6'는 103만~143만원 낮은 가격에 살 수 있게 됐다.쌍용차 'G4 렉스턴' 최고급 하이엔드 모델은 4498만원에서 143만원 인하된 4355만원에 판매된다. '코란도 가솔린'은 2201만~2688만원으로 트림에 따라 98만~119만원 저렴해진다. '티볼리 가솔린'은 1710만~2399만원에서 1637만∼2297만원으로 73만~102만원의 개소세 인하 효과가 적용된다. 오는 2일 발표될 현대차와 기아차의 3월 승용차 판매가격에도 개소세 인하 효과가 반영된다. 현대·기아차 관계자는 ""개소세 70% 인하와 함께 3월 판매조건 혜택까지 더하면 소비자들이 누리는 혜택이 더 많아질 것""이라고 말했다. 업계에서는 이번 개소세 인하 정책이 자동차 내수 판매를 상당히 진작시킬 것으로 본다.한국자동차산업협회가 지난해 6월 발표한 결과에 따르면 2018년 7월 개소세 30% 인하 전 11개월(2017년 8월~2018년 6월) 동안 117만4325대였던 국내 자동차 판매 규모가 개소세 인하 후 11개월(2018년 7월~2019년 5월) 동안 118만8133대로 1만4000대가량 늘었다. 업계 관계자는
""지난해에도 세계 경제 불확실성에 생산 감소, 부품업체 경영난으로 어려운 상황에서 개소세 인하가 내수 진작에 상당한 도움이 됐던 만큼 이번 정책의 효과도 적잖을 것""이라고 말했다.이건희 기자 kunheelee@mt.co.kr
<저작권자 ⓒ '돈이 보이는 리얼타임 뉴스' 머니투데이, 무단전재 및 재배포 금지>",/news/news_read.nhn?article_id=0004367028&office_id=008&mode=search&query=기아차&page=1
,"[아시아경제 성기호 기자] 신종 코로나바이러스감염증(코로나19) 사태로 고전을 면하지 못하고 있는 자동차업계에 개별소비자세 인하라는 호재가 생겼다. 정부가 작년말 종료된 승용차 개소세를 연장하고 인하 폭도 2배 이상 확대하면서 국산차 가격은 최대 143만원까지 내려갈 전망이다.1일 자동차업계에 따르면 정부가 지난달 28일 경제활력대책회의를 통해 개소세 인하 방침을 결정하자 각 업체들은 파매 차량의 가격 수정에 나섰다.정부는 3월부터 6월까지 승용차 구매시 개소세를 5%에서 1.5%로 70% 인하하기로 했다. 이에 따라 개소세 최대 100만원, 교육세 30만원(개소세의 30%), 부가가치세 13만원(개소세·교육세 합산액의 10%) 등 최대 143만원을 감면받을 수 있다.개소세 인하 소식에 각 사들도 속속 가격인하에 나서고 있다. 쌍용자동차는 이날 차량 가격을 최소 73만원부터 143만원까지 낮춘다고 발표했다.G4 렉스턴은 3504만∼4498만원에서 3361만∼4355만원으로 최대인 143만원 인하되며, 코란도 가솔린은 2201만∼2688만원으로 트림(등급)에 따라 98만∼119만원 내려간다.특히 여성들에게 인기가 높은 티볼리 가솔린은 1637만∼2297만원으로 73만∼102만원의 개소세 인하 효과를 받을 것으로 기대된다.한국GM도 모델별로 77만∼143만원의 가격 인하에 나섰다. 최근 관심을 모으고 있는 신차 트레일블레이저는 시작가가 1995만원에서 1910만원으로 낮아졌고, 가장 인기 있는 최고급 트림인 RS 모델을 사는 경우 110만원 이상 값이 내려간다.더 뉴 말리부는 102만∼142만원, 이쿼녹스 88만∼119만원, 더 뉴 트랙스 77만∼106만원 등 가격 인하 효과를 볼 수 있다.트래버스와 카마로 SS는 143만원의 최대 인하 혜택이 돌아간다.르노삼성 역시 개소세 인하에 따라 최대 143만원까지 차량 구매 비용이 낮아진다.SM6는 92만9000원∼143만원, QM6는 103만∼143만원 인하된 가격에 살 수 있다. 3일 출시 예정으로 아직 가격을 공개하지 않은 신차 XM3도 당초 책정가격에서 70만원 안팎의 가격 인하 효과가 기대된다.현대·기아차 역시 전 차종에 걸쳐 최대 143만원의 가격 인하 효과를 볼 수 있다.자동차 업계는 코로나19로 어려움을 겪는 상황에서 개소세 인하가 차량 판매 촉진에 도움이 될 것으로 보고 있다. 한 업계 관계자는 ""개소세 인하의 폭이 기존의 2배 이상으로 큰다""며 ""차량 구입을 고민하던 고객들에게 구매를 결심하게 만드는 효과가 생길 것""이라고 기대했다.성기호 기자 kihoyeyo@asiae.co.kr <ⓒ경제를 보는 눈, 세계를 보는 창 아시아경제 무단전재 배포금지>",/news/news_read.nhn?article_id=0004634133&office_id=277&mode=search&query=기아차&page=1
,"신종 코로나바이러스 감염증(코로나19)이 확산되며 국내 완성차 업계 생산 정상화도 ‘시계 제로’ 상태에 직면했다. 중국에서 부품 조달 차질이 생기며 시작된 ‘코로나19 사태’가 국내 공장에서 확진자가 나오며 공장 가동이 중단으로 이어졌고, 이젠 유럽 공장도 영향을 받을 태세다.


지난달 28일(현지시간)에는 90년 역사의 제네바 모터쇼가 취소됐다. 미디어 사전공개 행사(2일)를 불과 사흘 앞두고 전격적으로 이뤄진 조치다. 스위스 정부가 코로나19 확산을 막기 위해 1000명 이상 모이는 행사를 금지한 데 따른 것이다.



제네바 국제 모터쇼는 최근 모터쇼에 대한 관심이 예전같지 않은 와중에도 매년 큰 기대를 모으는 유럽의 대표적인 신차 데뷔 무대다. 올해 제네바 모터쇼에선 메르세데스-AMG 73 최초 공개를 비롯해 BMW의 완전변경 4시리즈, 폴크스바겐 8세대 골프의 고성능 라인 3종 등이 선보일 예정이었다. 앞서 4월 베이징 모터쇼는 이미 취소됐고, 6월 디트로이트 모터쇼도 취소가 불가피할 거란 관측이다.


 코로나19 사태 초기 중국에서 와이어링 하니스(배선 뭉치) 조달이 어려워 생산에 차질을 빚었던 문제는 상대적으로 단기간에 해결됐다. 하지만 이어진 코로나19 국내 확산이 발목을 잡았다. 현대차 부품 협력업체 직원이 숨진 채 발견된 뒤 코로나19 양성 반응이 나오는가 하면, 울산공장에서 확진자가 나와 공장 가동이 중단됐다.


이젠 불똥이 유럽으로 튀었다. 코로나19 유럽 확산의 근거지인 이탈리아 북부 코도뇨에 있는 자동차 전장부품 회사 MTA가 최근 공장 가동을 멈췄다. 유럽 소재 자동차 부품회사들이 잇따라 조업을 중단하면서 유럽 완성차 업체도 연쇄 가동 중단에 들어갈 가능성이 커졌다.





유지웅 이베스트투자증권 연구원은 ""유럽산 전장 핵심부품 조달이 끊기면 와이어링 하니스 공급중단보다 충격이 훨씬 클 수 있다""며 ""현대·기아차 유럽 공장이 영향을 받을 가능성도 염두에 둬야 한다""고 말했다. 현대차는 체코와 터키에, 기아차는 슬로바키아에 생산 공장이 있다.


판매도 문제다. 코로나19로 세계 경기가 둔화하면 그렇지 않아도 줄어들고 있는 자동차 판매가 더 악화할 수 있다. 특히 유럽시장은 올해 환경규제 강화로 전기차 판매가 크게 늘 것으로 전망됐는데 장담할 수 없는 상황이 됐다.


영업점이 텅텅 비며 르노삼성차는 3∼4일 예정했던 XM3 출시 관련 미디어 행사를 취소했다. 현대·기아차도 쏘렌토, G80 신차 출시 행사를 두고 고심 중이다.


다만 지난달 28일 정부가 6월까지 승용차 구매 시 개별소비세를 5%에서 1.5%로 70% 인하하면서 완성차 업체도 가격 수정에 나섰다. 개소세 인하를 고려하면 모델에 따라 최대 143만원까지 인하되는 효과가 난다. 쌍용차 G4 렉스턴과 한국GM의 신차 트레일 블레이저 등이 가장 먼저 가격을 내렸다.


박성우 기자 blast@joongang.co.kr
 ▶ ▶
/ ⓒ중앙일보(https://joongang.co.kr), 무단 전재 및 재배포 금지",/news/news_read.nhn?article_id=0002979988&office_id=025&mode=search&query=기아차&page=1
,"[머니투데이 유영호 기자] [정송주 기아자동차 망우지점 영업부장]""K5 사러 왔다는 고객에게 그냥 K5 계약서를 내밀면 그 영업직원은 절대 좋은 딜러가 아닙니다.""자동차 딜러는 흔히 '영업의 꽃'으로 불린다. 대당 수천만원 하는 가격 때문에 소비자의 시선이 어느 제품보다 비판적이기 때문이다. 1달에 차를 1대도 팔지 못하는 영업직원이 숱하다. 하지만 아무리 어려운 분야라도 자신만의 원칙으로 해법을 찾는 고수들은 존재한다. 우리가 '명인'이라고 부르는 이들이다.정송주 기아자동차 망우지점 영업부장(49·)은 대표적인 자동차 판매 명인이다. 2006년부터 지난해까지 15년 연속 기아차 판매왕에 올랐다. 지난해에만 566대를 팔았다. 공휴일을 제외하고 매일 2대씩로 판매한 꼴이다. 1999년 영업 업무를 시작한 이래 지난해까지 누적판매가 6535대에 달한다.정 부장은 고등학교를 졸업한 뒤 태권도 사범으로 사회에 첫발을 내딛었다. 자신의 이름을 단 도장을 꿈꾼 그는 종잣돈을 마련하기 위해 1994년 기아차 화성공장에 용접공으로 입사했다.영업직으로 자리를 옮긴 건 1998년 외환위기 한파가 한창 불어닥칠 때였다. 태권도장 운영도 사람을 상대하는 일이라고 생각한 정 부장은 사람을 만나는 법을 배워야겠다는 생각에 주변의 만류를 뿌리치고 영업직으로 전직했다. 결과는 기대와 달리 처참했다. 생전 처음 하는 영업이 쉬울 리가 없었다. 첫 3개월 동안 단 1대도 팔지 못했다. 좌절할 법했지만 그는 더 부지런히 움직여야 한다고 생각했다. 1달에 구두 1켤레 굽이 다 달도록 뛰어다니자 조금씩 성과가 나타났다.정 부장은 ""진정한 영업은 물건을 팔기 전에 '내가 정말 괜찮은 사람입니다' 하고 나를 먼저 팔아야 한다는 것을 그 때 깨달았다""며 ""밤낮으로 동네를 누비면서 주민들에게 눈도장을 찍고 그게 쌓이고 쌓이니까 성과가 나기 시작했다""고 말했다.정 부장은 '이름'도 바꿨다. 누구에게나 강한 인상을 줘 기억하기 쉽게 하자는 생각에 명함에 현대그룹 창업주인 고(故) 정주영 명예회장의 이름을 팠다. ""불가능하다고? 이봐, 해보기나 해봤어?""라는 정 회장의 철학도 본받고 싶었다. 2003년 명함에 '정주영'이라는 이름을 새겼을 때부터 지금까지 그의 별명은 줄곧 '망우동 정주영'이다.정 부장이 15년 연속 판매왕에 오른 영업비결에 대해 ""한결같음""이라고 말했다.모든 고객을 항상 같은 마음가짐으로 대한다는 것. 정 부장은 ""누구에게나 똑같은 서비스를 제공하고 똑같은 답을 줄 수 있어야 좋은 딜러""며 ""상황에 맞춰 임기응변으로 변칙적으로 대응하면 결국 금세 한계에 도달한다""고 설명했다.고객 만족을 위한 '잔소리'도 그가 내세우는 영업비결이다. 차를 사려는 고객은 일반적으로 사전에 많은 정보를 접하고 영업점을 방문한다. 하지만 수십 년 동안 영업을 해온 영업직원의 정보량을 이기긴 어렵다. 정 부장은 ""고객들이 인터넷 등에서 많은 정보를 살피고 오지만 막상 본인의 주행여건이나 라이프사이클에 맞지 않는 차종과 옵션을 구매하려는 경우가 종종 있다""며 ""이때는 고객에게 솔직히 설명해 바로잡는 것이 딜러의 역할""이라고 말했다.코로나19 감염증 확산 사태로 최근 차 판매도 타격을 받을 수 있다는 우려가 높아지는 상황에서 정 부장은 고객들에게 직접 편지를 써 보내면서 상황을 돌파하고 있다고 귀띔했다. 이달에 보낸 편지만 6000통에 달한다.정 부장은 ""이달의 신차 정보와 조건에 인사말을 동봉해 보낸다""며 ""차를 더 팔겠다는 마음보다는 고객 안부를 묻는다는 마음가짐으로 꾸준히 보내고 있다""고 말했다.정 부장의 올해 목표는 고객만족이다. 정 부장은 ""지금 가장 큰 고민은 어떻게 하면 고객을 더 만족 시킬 수 있을까""라며 ""고객 만족을 높이면 판매대수는 자연스럽게 따라온다고 믿는다""고 말했다.유영호 기자 yhryu@mt.co.kr
<저작권자 ⓒ '돈이 보이는 리얼타임 뉴스' 머니투데이, 무단전재 및 재배포 금지>",/news/news_read.nhn?article_id=0004367038&office_id=008&mode=search&query=기아차&page=1
'제네바 국제 모터쇼' 공식 취소자동차업계 홍보·출시 등 초비상현대차 전기콘셉트카 공개 연기4세대 쏘렌토 마케팅도 차질예상폭스바겐·BMW 신차 일정 재검토,"[서울경제] 글로벌 완성차 업체들이 올해의 신차와 미래 콘셉트카를 발표하며 힘을 싣는 세계 최대 모터쇼인 ‘제네바 국제 모터쇼’가 신종 코로나바이러스 감염증(코로나19) 확산으로 공식 취소됐다. 디트로이트 모터쇼가 힘이 빠지며 6월로 개최 시기를 옮기면서 최고의 모터쇼로 꼽히는 제네바 모터쇼의 취소는 단순하게 행사 취소로 볼 수 없다. 글로벌 완성차 업체들이 올해 생산, 판매전략을 전면 수정해야 하는 신호탄이다. 코로나19가 완성차 업체의 글로벌 공급망을 무너뜨린 데 이어 수요의 시발점마저 주저앉혔다.1일 자동차 업계에 따르면 제네바 모터쇼 사무국은 지난달 28일(현지시간) “참가자 건강이 가장 중요하다”며 “제90회 제네바 모터쇼를 취소한다”고 발표했다. 제네바 모터쇼 사무국은 코로나19 확산에도 마지막까지 정상 개최를 하기 위해 노력했지만 결국 사전 언론 공개 행사를 사흘 앞두고 전격적으로 행사를 취소했다.제네바 모터쇼는 글로벌 완성차들이 세계 최초로 신차들을 발표(월드 프리미어)하며 위상을 더욱 높여가고 있는 세계 최고 모터쇼 중 하나다. 매해 1월 열리던 디트로이트 모터쇼는 북미 메이커들의 전통적 신차 출시 행사처럼 진행돼 의미가 예년만 못하다는 평가를 받고 있다. 올해부터는 국제가전박람회(CES·1월 개최)와 겹치지 않도록 6월로 개최 시기를 바꿨다.이 때문에 올해 제네바 모터쇼에서는 많은 글로벌 완성차 기업이 신차와 콘셉트카, 미래 비전을 최초로 발표하고 홍보에 나설 예정이었다. 세계 최대 자동차 업체인 폭스바겐은 세계 최초로 8세대 신형 골프 GTI·GTD 모델을 공개한 뒤 하반기부터 전 세계에 출시한다는 계획을 세웠지만 홍보·출시 일정을 다시 잡아야 할 상황이다. 자사의 고성능 브랜드 폭스바겐 R의 첫 번째 하이브리드 모델 투아렉 R도 마찬가지다.BMW도 제네바 모터쇼에 뉴 330e 투어링 등 4종의 플러그인하이브리드차량(PHEV) 모델을 내놓고 그룹 최대 목표인 전기화 비전을 적극적으로 홍보할 계획이었다. 고성능 M 퍼포먼스 모델인 뉴 M340d xDrive 세단과 뉴 M340d xDrive 투어링도 세계 최초 공개할 예정이었지만 모든 일정을 재고하게 됐다. 콤팩트 캠퍼 밴 마르코 폴로의 월드 프리미어 공개를 계획하던 메르세데스벤츠도 같은 상황이다.각각 전기 콘셉트카 프로페시(Prophecy)와 4세대 신형 쏘렌토를 공개할 예정이던 현대·기아차도 난처한 상황에 처했다. 자동차 업계의 한 관계자는 “전기차 본고장인 유럽에서 프로페시를 선보여 전기차 선도 업체로 자리매김하려던 계획이 다소 어그러졌다”며 “출시가 임박한 신형 쏘렌토의 경우 글로벌 홍보에도 영향이 있을 수 있다”고 말했다.코로나 19 확산세가 계속되면 유럽 지역 자동차 판매와 생산도 영향을 받을 가능성도 제기된다. 일본계 글로벌 부품사 덴소와 후지쓰의 스페인 공장은 중국산 부품 공급 부족으로 오는 16일부터 일부 부품 생산라인 가동을 중단할 계획이다. 유지웅 이베스트증권 애널리스트는 “유럽산 전장 핵심부품의 조달이 끊기면 와이어링 하네스 공급 부족보다 파급이 클 수 있다”며 “현대·기아차 유럽 공장도 영향을 받을 가능성을 염두에 둬야 한다”고 말했다.이탈리아를 중심으로 유럽 전체로 코로나19가 확산하면서 판매에도 영향을 줄 우려도 있다. 이항구 산업연구원 선임연구위원은 “세계 자동차 판매가 올해 9,000만대 아래로 떨어질 것으로 보인다”며 “이렇게 되면 현대·기아차도 경쟁력 있는 신차가 줄줄이 나오는 ‘골든 사이클’ 효과를 기대하기 어렵다”고 전망했다./박한신기자 hspark@sedaily.com저작권자 ⓒ 서울경제, 무단 전재 및 재배포 금지",/news/news_read.nhn?article_id=0003702678&office_id=011&mode=search&query=기아차&page=1
,"정부가 지난해 연말 종료된 승용차 개별소비세 인하 조치를 다시 연장하고 인하 폭도 배 이상 확대하면서 국산 자동차 가격이 최대 143만 원까지 내려간다. 이에 국산차 업계가 가격 인하 홍보에 본격적으로 나섰다.1일 자동차 업계에 따르면 정부가 지난달 28일 경제활력대책회의에서 개별소비세 인하 확대를 결정하면서 각 사는 판매 모델에 대한 가격 수정에 나섰다. 앞서 정부는 이달부터 6월까지 승용차 구매 시 개소세를 5%에서 1.5%로 70% 인하하기로 했다. 100만 원 한도 내에서다.이에 따라 개소세가 최대 100만 원, 교육세 30만 원(개소세의 30%), 부가가치세 13만 원(개소세·교육세 합산액의 10%) 등 최대 143만 원을 감면받을 수 있다.개소세 인하 방침이 발표되자 쌍용차가 가장 먼저 차량 가격을 최소 73만 원부터 143만 원까지 낮춘다고 발표했다. G4 렉스턴은 최대인 143만 원이 인하되며 코란도 가솔린은 트림(등급)에 따라 98만 원에서 119만 원 낮아진다.한국지엠(GM) 쉐보레도 개소세 인하에 따라 모델별로 77만~143만 원의 가격 인하 효과를 누릴 수 있다고 밝혔다. 쉐보레는 여기에 3월 판매조건으로 선수금과 이자를 없앤 ‘더블 제로 무이자 할부’ 프로그램을 다시 내놨다.르노삼성 역시 차량 구매 비용이 낮아진다. SM6는 92만 9000~143만 원, QM6는 103만~143만 원 인하된 가격에 살 수 있다. 3일 출시 예정으로 아직 가격을 공개하지 않은 신차 XM3도 애초 책정가격에서 70만 원 안팎의 가격 인하 효과가 기대된다.현대·기아차도 전 차종에 걸쳐 최대 143만 원의 가격 인하 효과를 볼 수 있다. 황상욱 기자",/news/news_read.nhn?article_id=0000985040&office_id=082&mode=search&query=기아차&page=1
