head,text,url
코로나19 확산에 자동차업계 ‘갑을문제’ 점검상생노력 강화한 유라코퍼레이션 치켜 세워현대차 하도급거래 전단계 상생 확산 노력,"조성욱 공정거래위원장이 지난 2월24일 경기도 화성시 소재 LG전자 1차 협력사인 유양디앤유를 방문해 코로나19사태에 따른 부품 공급 차질 문제 및 대기업과 상생협력 문제에 대해 논의했다. 공정위 제공[세종=이데일리 김상윤 기자] 조성욱 공정거래위원장은 19일 “태풍, 홍수, 화재, 방역 등 불가항력의 사유로 납품기한을 준수하지 못한 납품업체에 패널티를 물리지 못한다”고 밝혔다.조 위원장은 이날 자동차부품업체인 유라코퍼레이션, 현대자동차 등과 간담회를 갖은 자리에서 애로사항을 듣고 이같은 표준하도급계약서 내용을 소개했다.공정위가 권장하고 있는 표준하도급계약서는 풍·홍수·화재·방역 등 불가항력의 사유로 납기기한을 준수하지 못한 수급사업자에게 지체상금을 부과하지 않도록 규정하고 있다. 지체상금이란 계약 당사자가 예정된 납기를 지키지 못했을 때 내야 하는 일종의 벌금이다. 상대적 열위에 있는 수급사업자(납품업체)가 책임없는 사유로 불이익을 입지 않도록 만든 규정이다.공정위는 코로나19사태로 납품업체들이 제때 원사업자(원청업체)에 상품이나 용역을 공급하지 못하는 사태가 발생할 가능성을 우려하고 있다.앞서 공정위는 상생협력 노력을 장려하기 위해 코로나19 사태로 어려움을 겪는 협력사를 지원하는 기업에게 공정거래협약 평가 가점을 올해부터 바로 부여한다는 계획을 발표했다.유라코퍼레이션은 현대·기아차에 전장 부품을 공급하는 1차 협력사다. 현대차에 와이어링 하네스, 전장제어모듈, 전기자동차 부품 등을 공급하고 있다. 지난 2015년 부터 공정거래협약평가에 참여해 협력업체와 거래시 현금을 지급하고, 표준계약서 사용하는 등 상생협력 노력을 하고 있다. 조 위원장은 유라코퍼레이션을 치켜세우며 “어려운 상황에서도 하도급업체와 상생문화가 퇴보하지 않도록 지속적으로 노력해달라”고 당부했다.이날 간담회에 참석한 현대자동차(005380)도 1차 협력사들이 2·3차 협력사에도 납품대금을 앞당겨 지급하도록 유도하여 상생지원이 하도급거래 전(全) 단계로 확산될 수 있도록 하고 있다고 밝혔다. 현대차는 협력사에 대해 3000억 원의 무이자 경영자금 지원, 7000억 원의 납품대금 조기지급 등 상생 노력을 기울이고 있다.김상윤 (yoon@edaily.co.kr) | ＜ⓒ종합 경제정보 미디어 이데일리 - 무단전재 & 재배포 금지＞",/news/news_read.nhn?article_id=0004600804&office_id=018&mode=search&query=기아차&page=4
,"[서울=뉴시스] 박주연 기자 = 현대자동차 미국 앨라배마 공장에 신종 코로나바이러스 감염증(코로나19) 확진자가 발생, 공장가동이 중단됐다.
현대차 관계자는 19일 ""미국시간 18일 오전 10시30분 알라배마 공장에 확진자가 발생, 공장 가동이 중단됐다""며 ""생산 재개시점은 현지 방역당국과 논의해 결정될 것""이라고 밝혔다. 앨라배마 현대차 공장은 연산 40만대 규모로, 2900여명의 풀타임 직원과 500여명의 파트타임 직원이 일하고 있다. 기아차의 미국 조지아 공장은 현재까지 정상 가동되고 있지만 코로나19가 빠르게 확산되고 있는 만큼 아슬아슬하기는 마찬가지다. 유럽 상황도 심각하다. 현대차의 체코 노쇼비체 공장, 기아차의 슬로바키아 공장은 아직 별다른 문제가 없다. 유럽의 경우 국경통제로 부품 물류체인에 문제가 발생할 가능성이 있어 상황이 유동적이라는 것이 현대차 측의 설명이다. 미국과 유럽의 경우 마스크 등 방역물품을 구하기 힘든 것도 문제다. 업계 관계자는 ""현대, 기아차의 해외 공장들은 각국 정부 지침에 따라 강력한 방역을 시행하고 있다""며 ""가동률을 최대한 유지하기 위해 노력하고 있지만 물류체인 등에 문제가 생길 경우 생산라인 가동이 유동적일 수 있다""고 말했다.또다른 관계자는 ""코로나19 확산으로 미국과 유럽의 대다수 완성차 공장 생산이 제대로 이뤄지지 못하고 있는 상황""이라며 ""한국의 경우 확진자가 발생해도 하루 이틀 방역하고 밀접접촉자를 자가격리한 후 가동이 재개됐지만 미국, 유럽은 상황이 불투명하다""고 말했다.한편, 코로나19 여파로 세계 자동차 생산이 속속 멈춰서고 있다. 미국과 유럽의 거대 완성차업체 생산라인이 멈춰서고, 유럽에서는 국경이 통제되며 부품수급도 쉽지 않은 상태다. 외신에 따르면 제너럴모터스(GM), 포드, 피아트크라이슬러(FCA) 등 미국 자동차 업체들과 전미자동차노조(UAW)는 코로나19 확산 방지를 위해 일부 생산시설에서 순환 셧다운을 실시, 같은 시간대에 근무하는 근로자 수를 제한키로 했다. UAW 소속 조합원은 약 15만명이다.당초 UAW는 2주간 공장 폐쇄를 요구했지만 미국 자동차업체들이 이에 대해 난색을 표명한 것으로 알려졌다. 양측은 생산시설의 순환 셧다운(폐쇄)과 시설에 대한 광역방역, 근무자 간 근로 간격 유지, 근로자간 접촉 피하기 등을 위한 광범위한 계획 수립에 합의했다. 폭스바겐, 르노, 푸조시트로엥, 피아트 크라이슬러 등 유럽 완성차업체 '빅4'는 2주 이상 공장 가동을 중단했다. 폭스바겐은 오는 23일부터 2~3주간 유럽 내 거의 모든 공장의 생산을 중단할 방침이고, 르노는 17일부터 프랑스 17개 전 공장의 가동을 무기한 중단키로 했다. 푸조시트로앵과 피아트 크라이슬러도 지난 16일부터 2주간 공장 가동을 중단한 상태다. 포드와 다임러, 토요타와 닛산 역시 유럽 공장의 생산 중단을 발표한 상태다. pjy@newsis.com<ⓒ 공감언론 뉴시스통신사. 무단전재-재배포 금지>",/news/news_read.nhn?article_id=0009765315&office_id=003&mode=search&query=기아차&page=4
"현대차 앨라배마도 멈춰…해외공장들도 불안 불안1분기 영업이익 1조 예상서 8000억원대로 전망글로벌 자동차 업체, 유럽·미국공장 잇따라 '셧다운'","[헤럴드경제 이정환 기자] 미국에서 신종 코로나바이러스 감염증(코로나19) 사태가 확산되는 가운데 현대차 미국 앨라배마 공장도 지난 18일 오전부터 가동을 중단하면서 북미 자동차 시장에 비상이 걸렸다.이에 따라 최근 미국시장에서 호실적을 내고 있는 현대기아차에 악영향을 끼칠 것으로 예상된다.호세 무뇨스 현대차 글로벌 최고운영책임자(COO) 겸 북미권역본부장(사장)은 17일(현지시간) 미국 자동차 전문매체와의 인터뷰에서 코로나 19사태가 장기화될 시 연간 판매량이 최대 20%영향을 받을 것이라고 전망했다.현대차는 지난해 미국 시장에서 팰리세이드 등이 인기를 끈 기세를 몰아 올해는 입지를 확실히 높일 계획이었는데 코로나 19라는 큰 암초를 만났다. 지난달까지만 해도 현대차가 미국에서 역대 최대 월간 판매 실적을 거두는 등 목표 달성이 순조로웠다하지만 코로나19라는 변수로 실적에 비상등이 켜졌다.실제 미국에선 제너럴모터스(GM), 포드, 피아트크라이슬러(FCA) 등 미국 자동차 회사들과 전미자동차노조(UAW)가 코로나19에 대응해 생산을 줄이기로 합의했다.포드 자동차는 19일 밤부터 30일까지 미국과 멕시코, 캐나다 공장을 닫기로 했다. 미시간주 조립공장은 근로자 1명이 코로나19 확진자로 판명돼 잠정 폐쇄됐다.GM도 30일부터 모든 북미 공장 문을 닫는다. 피아트크라이슬러(FCA)도 미국공장을 닫을 것으로 알려졌다.현대차 미국 앨라배마 공장도 18일 직원 1명이 코로나19 양성판정을 받아서 가동을 중단했다. 재개 시점은 방역당국과 협의해 결정한다. 인근에는 기아차 조지아 공장도 있다.현대차 체코 공장은 아슬아슬한 상황이다. 다른 업체들이 문을 닫는 와중에 홀로 계속 가동한다고 해도 각국 이동제한 조치로 인해서 부품 조달이 지연될 것으로 보인다.북미와 유럽 등지서 해외 자동차업체들이 공장을 멈춰세우는 이유는 코로나19 확산 방지와 수요 감소 전망 두가지다.세계 금융시장에서 자산가격이 폭락하고 각국 정부와 중앙은행들이 강력한 처방을 내놔도 효과가 나지 않는 상황에서 고가 내구재인 자동차가 많이 팔릴 수가 없다.특히 이동제한 조치는 자동차에 영향이 크다. '집콕' 생활에 가전제품은 필요해도 자동차는 중요하지 않다. 자동차는 구매과정에서도 영업점을 방문해서 직접 살펴보고 시승까지 한 뒤 구매결정을 내리는 경우가 많다.국내 완성차 업체들은 지금은 국내 공장을 정상 가동하고 있다. 현대차는 2월 중단에 따른 공백을 메우기 위해 한시적으로 주 60시간 근무를 검토하는 정도다. GV80, 쏘렌토 등 인기 차종은 1년치 주문이 거의 다 들어와있고 팰리세이드도 여전히 수개월 대기해야 한다.하지만 코로나19 사태가 단시간에 잡히지 않을 것이라는 전망이 나오면서 해외발 수요감소 쓰나미를 피하기 어렵다.이미 현대차 주가는 추락하고 있고 실적전망치 하향조정 발표도 속속 나오고 있다.현대차 주가는 18일 기준 7만3500원으로 전날보다 8% 넘게 떨어졌다. 시가총액은 16조원대에 불과하다. 세계 금융위기 때인 2009년 7월 이후 가장 낮은 수준이다. 이달 5일(11만4000원) 이후 9 거래일 연속 급락이다.1분기 영업이익은 1조원이 훌쩍 넘는다는 것이 시장의 평균 예상이었는데 이제는 8000억원대 전망이 나온다.정만기 한국자동차산업협회 회장 ""한국은 코로나 확진자 증가세가 주춤하지만, 유럽은 이제 시작이라는 점에서 우려가 크다""며 ""해외 공장을 닫기 시작한 한국 완성차 업체는 물론 유럽에 주문자 생산방식(OEM) 방식으로 물량을 공급하는 부품사까지 타격이 예상된다""고 말했다.그는 또 ""글로벌 자동차 시장의 수요 위축에 판매량은 물론 실적까지 단기간에 무너질 수 있다""면서 ""문제는 2~3개월 뒤다. 한국처럼 코로나가 진정되는 시기가 되면 생산량이 폭증할 수 있어 기업의 유동성 강화를 위한 정부 지원이 절실할 것이다""고 덧붙였다.한편, 유럽도 이미 비상 상황이다. 코로나19 확산을 막기 위해 주요국이 도시 봉쇄 등 강력한 조치를 취하면서 이탈리아, 스페인, 프랑스 등 남부 유럽지역의 자동차 공장들이 먼저 문을 닫았다.
- Copyrights ⓒ 헤럴드경제 & heraldbiz.com, 무단 전재 및 재배포 금지 -",/news/news_read.nhn?article_id=0001650564&office_id=016&mode=search&query=기아차&page=4
현대차 앨라배마 공장 확진자 1명 발생…현지 생산 장담 어려워공급망 붕괴·판매 부진 가속화…국내 완성차 타격,"(서울=뉴스1) 조재현 기자 = 유럽과 미국에서 신종 코로나바이러스 감염증(코로나19)이 급속히 확산하면서 국내 완성차 업체들의 현지 생산과 수출에 적신호가 켜졌다. 현재 코로나19 여파로 유럽과 미국의 완성차 공장들의 '셧다운'(일시 가동 중단) 사태가 속출하는 가운데, 현대자동차도 미국 앨라배마 공장에서 직원 1명이 코로나19 양성판정을 받아 가동을 중단했다.국내 공장에 이어 해외 공장마저 가동 중단에 들어가면서 현대차의 생산 및 판매 계획도 차질을 빚게 됐다. 주요 자동차 시장의 위기는 수출 의존도가 높은 우리나라 완성차 업계로 고스란히 전가될 수 있다는 점에서 업계가 촉각을 곤두세우고 있다. 주요 자동차 시장의 위기로 글로벌 공급망 붕괴와 얼어붙은 소비 심리에 따른 판매 부진이 가속화할 것이란 전망도 나온다. 19일 업계 및 주요 외신에 따르면 독일 최대 자동차 기업 중 하나인 폭스바겐은 오는 23일부터 2~3주간 독일을 포함해 유럽에서 모든 생산을 중단한다. 이후 독일과 체코 등 유럽 전역으로 공장 폐쇄 조치를 확대한다. 폭스바겐은 우선 이번 주 코로나19 사태가 급속도로 확산하는 이탈리아를 비롯해 스페인과 포르투갈, 슬로바키아 공장 가동을 중단하기로 했다.코로나19 확산에 따라 각국 정부가 빗장을 걸어 잠그면서 부품 조달이 어려워진 데다, 판매 수요마저 큰 폭으로 줄었기 때문이다. 잇따르는 비상사태 선포로 직원 출근 및 영업점 운영이 중단된 것도 영향을 미쳤다는 분석이다.이탈리아 피아트와 미국 크라이슬러의 합작법인인 피아트크라이슬러(FCA)도 이탈리아 내 생산공장 6곳과 세르비아, 폴란드 공장의 조업을 중단한다. 프랑스 푸조시트로엥(PSA)그룹도 유럽 15개국에 있는 모든 완성차 공장을 27일까지 폐쇄한다. 르노그룹 역시 프랑스 내 공장의 문을 닫았다. 일본 최대 자동차 기업인 토요타도 포르투갈 공장에 이어 프랑스 공장 가동을 이달 말까지 중단하기로 했다.미국에서는 제너럴모터스(GM), 포드, FCA 등 '빅3' 자동차 회사가 북미 지역의 공장을 일시적으로 폐쇄하기로 했다. 포드는 이날 저녁부터 30일까지 미국과 멕시코, 캐나다 공장을 닫기로 했다. GM도 최소한 30일까지 모든 북미 공장 문을 닫는다. FCA도 미국공장을 폐쇄할 것으로 전해졌다.중국발 리스크가 잠잠해진 가운데 유럽·미국발 '코로나19 쇼크'가 덮치면서 현지 공장 가동 중단 위기는 현실이 됐다. 코로나19 확진자 발생으로 현지시간으로 18일 가동 중단에 들어간 현대차 앨라배마 공장의 재가동 시점은 현재까지 미정이다. 현대차는 앨라배마주 보건당국, 질병통제예방센터와 협의해 추가 조치를 취할 예정이다.앨라배마공장은 쏘나타, 아반떼(현지명 엘란트라), 싼타페 등을 생산한다. 연간 생산 규모는 37만대에 달한다. 현대차는 유럽에서 체코와 러시아, 터키, 미국에서는 앨라배마에 각각 생산 공장을 두고 있다. 기아차는 슬로바키아(유럽), 조지아(미국)에서 공장을 운영 중이다.
확진자 발생과 같은 직접적인 피해와 별개로 글로벌 부품 공급망이 붕괴할 우려도 있다. 무엇보다 현대·기아차는 유럽에서 전기차 모델 판매에 공을 들이고 있는데, 부품 조달에 차질이 생길 경우 정상적인 공장 가동을 장담할 수 없다. 유럽 현지 생산과 관련해 현대·기아차는 각국 상황에 따라 대응하겠다는 전략이다. 회사 관계자는 ""현재는 사전 방역에 최선을 다하고 있으나 코로나19 확산 여부에 따라 상황을 예단하기는 쉽지 않다""며 ""무엇보다 유럽 각국의 국경 폐쇄 등에 따라 부품 조달 등에 문제가 발생할 수 있기에 유동적으로 대응할 수밖에 없다""고 설명했다.코로나19 확산으로 유럽과 미국에서 소비 심리가 급격히 얼어붙고 있는 것도 큰 타격이다. 사태가 장기화할 경우 생산 및 판매 목표 달성에도 차질이 생길 수밖에 없다. 한국자동차산업협회에 따르면 국내 완성차 업계에 있어 유럽과 북미는 가장 큰 수출 시장이다. 전체 수출 중 72.5%를 차지했다. 지난해 유럽 수출량은 65만3286대, 북미 수출량은 108만6854대였다. 현대차가 지난해 올린 105조7000억원의 매출 중 두 지역 매출 비중은 51.7%에 달한다.호세 무뇨스 현대차 글로벌 최고운영책임자(COO) 겸 북미권역본부장(사장)도 최근 코로나19 확산과 관련, 한 현지 매체와의 인터뷰에서 연간 판매량의 10∼20%가 영향을 받을 수 있다고 언급하기도 했다.지난해 국내 자동차 생산량은 2009년 이후 처음으로 400만대를 밑돌았고, 연초부터 코로나19 여파로 생산 및 내수 판매 모두 부진에 빠진 상황인데, 유럽·미국발 위기로 또다시 흔들리는 것이다.올 1~2월 국내 완성차 업계 수출은 전년 동기 대비 27.4% 감소한 27만1568대에 그쳤다. 같은 기간 자동차 생산량은 44만810대로 27.9% 급감했다. 완성차 업체의 생산·판매 부진에 국내 협력사는 고사 위기에 놓일 수도 있다.김필수 대림대 자동차학과 교수는 ""주요 자동차 시장의 코로나19 확산에 따른 위기는 전 세계적 수요 급감을 불러올 수 있다""며 ""이는 결국 국내 완성차 업체의 실적 악화로 이어질 수 있어 장기적인 대비가 필요한 시점""이라고 말했다.cho84@news1.kr© 뉴스1코리아(), 무단 전재 및 재배포 금지",/news/news_read.nhn?article_id=0004531270&office_id=421&mode=search&query=기아차&page=4
"현대차, 美 앨라배마 공장 셧다운유럽·미국공장 잇단 ‘셧다운’ 직면1분기 영업익 1조 8000억대 전망생산량 폭증대비 유동성 지원 절실","미국에서 신종 코로나바이러스 감염증(코로나19) 사태가 확산되는 가운데 현대차 미국 앨라배마 공장도 지난 18일 오전부터 가동을 중단하면서 북미 자동차 시장에 비상이 걸렸다.이에 따라 최근 미국시장에서 호실적을 내고 있는 현대기아차에 악영향을 끼칠 것으로 예상된다.호세 무뇨스 현대차 글로벌 최고운영책임자(COO) 겸 북미권역본부장(사장)은 17일(현지시간) 미국 자동차 전문매체와의 인터뷰에서 코로나 19사태가 장기화될 시 연간 판매량이 최대 20%영향을 받을 것이라고 전망했다.현대차는 지난해 미국 시장에서 팰리세이드 등이 인기를 끈 기세를 몰아 올해는 입지를 확실히 높일 계획이었는데 코로나 19라는 큰 암초를 만났다. 지난달까지만 해도 현대차가 미국에서 역대 최대 월간 판매 실적을 거두는 등 목표 달성이 순조로웠다하지만 코로나19라는 변수로 실적에 비상등이 켜졌다.실제 미국에선 제너럴모터스(GM), 포드, 피아트크라이슬러(FCA) 등 미국 자동차 회사들과 전미자동차노조(UAW)가 코로나19에 대응해 생산을 줄이기로 합의했다.포드 자동차는 19일 밤부터 30일까지 미국과 멕시코, 캐나다 공장을 닫기로 했다. 미시간주 조립공장은 근로자 1명이 코로나19 확진자로 판명돼 잠정 폐쇄됐다.GM도 30일부터 모든 북미 공장 문을 닫는다. 피아트크라이슬러(FCA)도 미국공장을 닫을 것으로 알려졌다.현대차 미국 앨라배마 공장도 18일 직원 1명이 코로나19 양성판정을 받아서 가동을 중단했다. 재개 시점은 방역당국과 협의해 결정한다. 인근에는 기아차 조지아 공장도 있다.코로나19 사태가 단시간에 잡히지 않을 것이라는 전망이 나오면서 해외발 수요감소 쓰나미를 피하기 어렵다.이미 현대차 주가는 추락하고 있고 실적전망치 하향조정 발표도 속속 나오고 있다.현대차 주가는 18일 기준 7만3500원으로 전날보다 8% 넘게 떨어졌다. 시가총액은 16조원대에 불과하다. 세계 금융위기 때인 2009년 7월 이후 가장 낮은 수준이다. 이달 5일(11만4000원) 이후 9 거래일 연속 급락이다.1분기 영업이익은 1조원이 훌쩍 넘는다는 것이 시장의 평균 예상이었는데 이제는 8000억원대 전망이 나온다.정만기 한국자동차산업협회 회장은 “ “글로벌 자동차 시장의 수요 위축에 판매량은 물론 실적까지 단기간에 무너질 수 있다”면서 “문제는 2~3개월 뒤다. 한국처럼 코로나가 진정되는 시기가 되면 생산량이 폭증할 수 있어 기업의 유동성 강화를 위한 정부 지원이 절실할 것이다”고 말했다. 이정환 기자
- Copyrights ⓒ 헤럴드경제 & heraldbiz.com, 무단 전재 및 재배포 금지 -",/news/news_read.nhn?article_id=0001650658&office_id=016&mode=search&query=기아차&page=4
,"현대자동차와 기아자동차가 코로나19로 경영난을 겪고 있는 서비스협력사 블루핸즈와 오토큐의 가맹금을 감면한 데 이어 이번에는 택시업계 지원에 나선다.현대·기아차는 코로나19에 대한 우려가 커지는 가운데 승객 감소로 매출 손실을 겪고 있는 택시업계를 지원하기 위해 개인택시 및 법인택시 운전자 중 신청자를 대상으로 오는 4월부터 6월까지 3개월간 할부금 상환을 유예한다고 19일 밝혔다. 지원 대상은 개인택시의 경우 현대캐피탈 할부 상품을 이용하는 택시 사업자이며, 법인택시의 경우 현대캐피탈 할부 상품 및 현대·기아차 자체 할부 상품 이용 고객이다.신청 기간은 이달 20일부터 27일까지며 현대캐피탈 할부 상품 이용 고객은 현대캐피탈 고객센터에서, 현대·기아차 자체 할부 이용 고객은 각사 전국 지점에서 할부금 상환 유예를 신청할 수 있다.이와 함께 현대·기아차는 이달 20일부터 다음달 3일까지 전국 직영서비스센터, 블루핸즈, 오토큐에 입고된 개인택시와 법인택시의 일반수리비를 30% 할인하는 지원 방안도 마련했다. 신청은 현대·기아자동차 전국 서비스센터, 블루핸즈, 오토큐에서 가능하다. 최대 100만원 한도 내에서 할인을 지원하며 사고 수리, 보험 수리, 보증연장상품 구매 건은 제외된다.현대·기아차 관계자는 “코로나19 확산으로 어려움을 겪고 있는 택시업계의 경제적 부담을 덜어주기 위해 할부금 상환 유예와 일반수리비 지원을 결정했다”며 “앞으로도 고객들과 함께 어려움을 극복하고 고객들에게 실질적 도움을 줄 수 있는 다양한 방안을 모색할 것”이라고 전했다.앞서 지난달 현대자동차그룹은 코로나19 확산 방지와 피해 복구를 위해 전국재해구호협회에 50억원을 기탁했으며, 협력사들의 자금 조달 부담을 줄이기 위해 중소 부품 협력업체에 1조 원 규모의 자금을 긴급 지원했다. 이번 달에는 경북 소재 그룹 연수원 두 곳을 코로나19 경증환자 생활치료센터로 제공하는 등 코로나19 극복을 위해 다방면으로 지원을 이어가고 있다.[디지털뉴스국 박소현 객원기자] [ⓒ 매일경제 & mk.co.kr, 무단전재 및 재배포 금지]",/news/news_read.nhn?article_id=0004539707&office_id=009&mode=search&query=기아차&page=4
,"(서울=연합뉴스) 김동규 기자 = 현대·기아차는 신종 코로나바이러스 감염증(코로나19) 사태로 어려움을 겪는 택시업계를 지원하기 위해 차량 할부금 상환을 3개월 유예해 주기로 했다고 19일 밝혔다.

이에 따라 개인택시·법인택시 운전자 중 신청자를 대상으로 4월부터 6월까지 3개월간 차량 할부금 상환을 유예한다.

유예 대상은 개인택시는 현대캐피탈 할부 상품을 이용하는 고객이며, 법인택시는 현대캐피탈 할부 상품 및 현대·기아차 자체 할부 상품 이용 고객이다.

희망자는 이달 20∼27일 현대캐피탈 고객센터(☎ 1588-2114)나 현대·기아차 전국 지점에 신청하면 된다.

이와 함께 현대·기아차는 20일부터 다음달 3일까지 전국 직영 서비스센터와 블루핸즈, 오토큐에 입고된 개인택시와 법인택시의 일반수리비를 30% 할인해 준다.

dkkim@yna.co.kr",/news/news_read.nhn?article_id=0011483843&office_id=001&mode=search&query=기아차&page=4
