head,text,url
"현대·기아차 이어 삼성전자도 슬로바키아 공장 23일부터 가동 중단반도체·가전·자동차·배터리 업종 매출 타격… ""가까스로 버틴다""","(서울=뉴스1) 류정민 기자,권구용 기자 = 신종 코로나바이러스 감염증(코로나19)이 유럽과 미주에서 빠르게 확산하면서 한국 기업들의 공장 셧다운도 속출할 것으로 예상된다.이탈리아, 스페인, 독일, 프랑스 등 서유럽 국가들에 이어 미국의 확진자 수가 빠르게 늘어나고 있고, 동유럽 국가들의 확진자 수도 대부분 세자릿수를 넘고 있다.미국과 유럽은 반도체, 가전, 자동차, 배터리 등 한국의 주력 수출 업종 공장이 자리한 지역이어서 한국 산업 전반에 심각한 타격이 예상된다.22일 세계보건기구(WHO)에 따르면 20일 0시(스위스 현지시간) 집계 기준 전 세계 누적 확진자는 전날 대비 2만4247명이 증가한 23만4073명에 달했다. 신규 확진자 수 2만4247명은 전날 집계된 신규 확진자 1만6556명보다 46.4%나 늘어난 것으로 코로나19의 확산세는 날로 커지고 있다. 누적 사망자는 전날보다 1061명이 증가한 9840명에 달했다.코로나19는 특히 유럽과 미국에서 들불처럼 빠르게 퍼지고 있다. 유럽에서만 신규 확진자의 72%에 달하는 1만7506명의 확진자가 추가됐고, 누적 사망자도 전체의 49.8%인 4899명에 달했다. 미국은 하루 사이 이탈리아, 스페인 다음으로 많은 3355명의 확진자가 새로 발생, 누적 확진자가 1만명을 넘어선 1만442명으로 집계됐다. 캐나다는 167명 늘어난 736명, 브라질은 137명 늘어난 428명이다.유럽과 미국에서의 코로나19 확산으로 한국 기업들의 생산차질은 이미 현실이 되고 있다.이미 현대자동차가 18일(현지시간) 확진자 1명이 발생한 미국 앨라배마 공장에 이어, 앨라배마에서 엔진을 공급받는 기아차가 조지아 공장을 19일(현지시간)부터 가동을 중단했다. 또 현대차 체코공장과 기아차 슬로바키아 공장도 23일(현지시간)부터 2주간 문을 닫는다. 현대기아차는 유럽에서는 이번에 가동을 중단한 체코, 슬로바키아 외에 터키(현대차)와 러시아(현대차)에 생산법인을 두고 있다. 또 브라질(현대차)에서도 생산공장을 가동한다.삼성전자도 23일(현지시간)부터 1주일간 TV와 모니터를 생산하는 슬로바키아 공장의 가동을 중단한다. 삼성전자는 헝가리에도 TV 생산공장을 두고 있고, 폴란드에는 냉장고 등 가전공장을 가동하고 있다. 미국에는 샌디에이고에 TV 생산공장을, 오스틴에 반도체, 사우스캐롤라이나에 가전 공장을 운영하고 있다. 삼성전자는 멕시코에 TV공장을, 브라질에서는 TV와 스마트폰 공장을 각각 운영하고 있다.기업들이 현지 생산법인의 판단을 존중하고 있는 만큼 앞으로 가동 중단은 속출할 예정이다. 삼성전자 관계자는 ""현재 가동 중단을 결정한 슬로바키아 외에 폴란드 가전공장과 헝가리 TV 공장은 정상 운영하며, 미국 반도체와 가전공장도 정상적으로 가동하고 있다""며 ""23일부터 가동을 중단하기로 한 슬로바키아의 경우 현지에서 그만큼 분위기가 심각하다고 판단한 때문""이라고 설명했다.LG전자는 폴란드에 가전생산 공장을 두고 있다. 미국에서는 테네시에 세탁기 공장을, 앨라배마와 헌츠빌에서는 태양광 모듈 생산 공장을 운영한다. LG전자 관계자는 ""유럽과 미국에서는 아직 생산중단은 없다. 생산 차질이 발생하지 않도록 최선을 다하는 중""이라고 말했다.삼성, 현대차, LG 등 한국 주요 기업들의 매출에도 적잖은 타격이 예상된다. 금융감독원 전자공시에 따르면 지난해 삼성전자의 매출 230조원 중 유럽은 미주가 73조8000억원으로 32.0%, 유럽은 42조7000억원으로 18.5%를 차지하는 등 두 지역 매출 비중이 전체의 50.5%에 달했다. 현대차는 지난해 105조7000억원의 매출 중 북미가 35조9000억원, 유럽은 18조7000억원으로 두 지역의 매출 비중이 절반이 넘는 51.7%를 차지했다.LG전자는 지난해 61조8370억원의 매출 중 북미가 23.4%인 14조9889억원을 차지했고, 유럽은 14%인 8조6827억원에 달했다.LG화학, 삼성SDI, SK이노베이션 등 전기차 배터리 업체들도 코로나19로 생산차질을 우려하고 있다.LG화학은 미국 미시간과 폴란드, 삼성SDI는 미국과 헝가리 오스트리아에, SK이노베이션은 헝가리에서 전기차용 배터리 셀 생산 공장을 운영하지만 미국과 유럽의 완성차 업체들이 줄줄이 공장을 폐쇄하면서 공장가동 중단이 예상된다. 외신 등에 따르면 폭스바겐이 오는 23일(현지시간)부터 2~3주간 독일을 포함해 유럽 내 모든 생산을 중단하는 것을 비롯해 BMW, 메르세데스-벤츠, 르노, 푸조, 피아트 등이 업체별로 짧게는 2주, 길게는 무기한 공장 간동을 중단한다.미국에서는 제너럴모터스(GM), 포드, FCA 등 '빅3' 자동차 회사가 북미 지역의 공장을 일시적으로 폐쇄한다. 포드는 지난 19일(현지시간) 저녁부터 30일까지 미국과 멕시코, 캐나다 공장 가동을 중단한다. GM도 최소한 30일까지 모든 북미 공장 문을 닫는다. FCA도 미국공장을 폐쇄할 것으로 전해졌다.LG화학 관계자는 ""코로나로 인해 각국의 국가지침이 강화되면서 감염 확산을 막기 위해 임직원 출장 금지를 강화하고 있다""며 ""미국과 폴란드의 경우 정상 가동 중으로 미국 공장의 경우 물류에 차질이 없어 영향은 제한적이지만 만일의 사태에 대비해 상황을 예의주시하고 있다""고 밝혔다.SK이노베이션 관계자는 ""상황이 어렵지만, 공장이 셧다운 되지 않도록 최선을 다하고 있다""고 말했다.ryupd01@new1.kr© 뉴스1코리아(), 무단 전재 및 재배포 금지",/news/news_read.nhn?article_id=0004535693&office_id=421&mode=search&query=기아차&page=2
글로벌 판매 계획 수정 '불가피'…1분기 이어 2분기도 실적 타격 전망,"현대·기아자동차가 신종 코로나 바이러스 감염증(코로나19) 영향으로 미국과 유럽 공장 가동을 잇달아 중단하면서 올해 상반기 해외 판매에 제동이 걸릴 것으로 보인다.부진했던 중국 시장 대신 판매가 양호한 미국과 유럽 시장에 공을 들여왔던 양사는 공장 가동률 하락으로 올해 글로벌 판매 계획 수정은 물론, 실적 악화도 불가피할 것으로 예상된다.22일 업계에 따르면 현대·기아차는 23일부터 내달 3일까지 2주간 현대차 체코 공장과 기아차 슬로바키아 공장 가동을 중단한다. 유럽 지역 자동차업체들이 줄줄이 가동 중단에 들어가면서 현대·기아차도 유럽 공장 문을 닫기로 한 것이다.이들 공장에는 확진자 발생 등 문제가 불거지진 않았으나 체코와 슬로바키아 정부의 코로나19 확산 방지 정책 동참과 직원들의 안전, 국경 폐쇄로 인한 물류 영향 등을 고려한 결정이라고 회사측은 설명했다.현대·기아차는 앞서 현대차 앨라바마 공장과 기아차 조지아 공장을 주말인 22일까지 닫기로 했으며 재개 시점은 미정이라고 밝힌 바 있다.앨라배마 공장은 직원 1명이 코로나19 양성반응을 보여 18일(현지시간) 가동을 중단했다. 앨라배마 공장에서 엔진을 공급받는 조지아 공장도 19일부터 가동을 멈췄다.이처럼 주요 시장인 미국·유럽 지역 판매에 모두 제동이 걸리면서 양사의 사업계획 조정이 불가피할 전망이다. 지난해 현대차는 전체 판매량 중 미국과 유럽 판매 비중이 33.0%였고, 기아차도 두 지역 비중이 40.9%로 적지 않은 수준이다.두 지역에 대한 양사의 매출 의존도가 상당한 만큼 코로나19 여파로 올해 상반기 동안 악영향이 예상된다. 특히 유럽은 다른 완성차들이 잇달아 무기한 중단을 발표하면서 생산재개 시점이 늦춰질 가능성이 있다.현대·기아차는 아반떼, 쏘렌토 등 올해 주력 모델들이 풀체인지(완전변경)되는 신차 사이클에 힘입어 글로벌 판매량을 늘리겠다는 목표를 세웠으나 코로나19 확산으로 생산 자체를 걱정하는 상황이 됐다.지난해 마이너스 성장이었던 중국 시장 역시 올해에도 턴어라운드를 기대하기 힘들고, 그 외 신흥국도 코로나19에 따른 수요 악화가 예상된다.이러한 불확실성이 가중되면서 양사의 1분기 실적도 하향 조정됐다. 현대차의 1분기 연결 기준 영업이익 평균 컨센서스(추정치)는 전년 동기 대비 12.3% 증가한 9264억원이나 이 보다 낮은 7000억~8000억원대를 전망하는 곳도 있다.기아차의 1분기 영업익 컨센서스는 4436억원으로 전년 동기 보다 25.3% 떨어질 것으로 추정됐다. 코로나19에 대한 예측이 어려운 만큼 2분기에도 추가적으로 영향을 받을 것이라는 전망이다.현대·기아차는 우선적으로 밀린 물량을 소화하는 등 내수 시장 정상화에 힘을 쏟고 있다. 아반떼, 쏘렌토 등 신차 출시 행사는 온라인 생중계로 전환하는 등 비대면 마케팅을 강화하고 있다.현대차는 또 코로나19 사태로 줄어든 생산량을 만회하기 위해 노조에 최대 주 60시간 근무에 대한 실무협의를 제안했다. 기존 주 48시간에서 특근으로 최대 12시간을 더 늘리자는 내용이다. 노조가 동의하고 고용부가 인가하면 현대차는 1~3개월간 한시적으로 생산량을 늘릴 수 있다.업계 관계자는 ""미국·유럽 생산 제동으로 현대·기아차 뿐 아니라 계열사인 현대글로비스, 현대제철 등의 도미노 타격이 우려된다""면서 ""코로나19를 예측할 수 없는 만큼 각사들은 한동안 비상경영체제를 유지할 것으로 보인다""라고 말했다.데일리안 조인영 기자 (ciy8100@dailian.co.kr)ⓒ (주)데일리안 - 무단전재, 변형, 무단배포 금지",/news/news_read.nhn?article_id=0002390584&office_id=119&mode=search&query=기아차&page=2
,"대기업 속속 정상출근…""전대미문 복합위기, 재택근무로는 대처 한계""단기자금시장 신용경색 우려…기업들 자금조달·투자 여건 재점검이재용, 2주간 두 차례 현장점검…최태원, 금주 비상경영회의 소집

(서울=연합뉴스) 김준억 최윤정 김영신 기자 = 재계가 신종 코로나바이러스 감염증(코로나19) 사태로 가동한 비상체제가 글로벌 경제위기 대응으로 속속 모드를 전환하고 있다.

국내 주요 기업들은 코로나19 사태 초기에는 임직원의 안전과 국내 사업장 셧다운 방지 등 업무지속계획(BCP)을 최우선으로 대응해왔다.

그러나 유럽과 미주의 상황이 급격히 나빠지면서 글로벌 경제위기가 대두되자 재택근무를 속속 중단하는 등 위기 대응의 양상이 바뀌고 있다.

특히 기업의 실적악화 우려에 금융시장이 대혼란을 빚고, 자금시장 위축에 기업의 유동성 우려가 커지는 악순환 조짐에 기업들은 초긴장 상태다.◇ ""글로벌 셧다운에 '돈맥경화'까지 급한불이 많다""…재택근무 중단 잇달아

22일 재계에 따르면 주요 기업들은 코로나19가 팬데믹 상황에 글로벌 사업장들의 '셧다운'이 잇따르고 기업어음(CP)시장의 신용경색 우려마저 나오면서 복합위기에 대응하는 비상경영 체제를 가동하고 있다.

해외 사업장 셧다운 충격은 현대·기아차가 가장 큰 상황이다. 현대차와 기아차는 미국의 앨라배마와 조지아 공장의 생산을 18일부터 중단했으며 체코 공장과 슬로바키아 공장은 23일부터 2주간 문을 닫는다.

이에 따라 현대·기아차는 지난달 27일부터 시작한 자율 재택근무를 23일부터 중단하기로 했다.

다만, 코로나19 예방을 위해 출근 시간 범위를 오전 8∼10시에서 오전 8∼오후 1시로 넓히고, 필수근무시간(오전 10시∼오후 4시)을 없애는 확대된 유연근무로 전환한다.

현대차는 부문별 협업을 강화해서 사업운영 차질을 예방하는 동시에 출퇴근 시간을 최대한 분산해서 직원 접촉을 최소화할 방침이라고 말했다.

 코로나19로 자동차 산업이 직격탄을 맞아 비상이 걸린 가운데 효율성을 높여야 할 상황이라고 판단한 것으로 보인다.

 현대·기아차는 코로나19 초기부터 종합상황실을 운영해왔다. 초기에는 중국발 부품 공급망 중심으로 대응했지만, 최근에는 미주와 유럽까지 권역별 상황을 파악해서 신속 대응해야 하는 실정이다.

SK텔레콤도 지난달 24일부터 시작한 전 직원 재택근무를 23일부터 중단한다. 임신부 등 재택근무가 필요한 일부로 대상을 제한하는 자율적 재택근무로 전환한다.

아울러 국내 기업들은 CP와 회사채 시장을 중심으로 신용경색 우려가 나와 자금상황도 긴급 점검에 들어갔다.

최근 CP금리가 치솟으면서 신용경색 조짐이 나타나자 금융위원회는 20일 국내 증권사들과 함께 CP시장 긴급 점검회의를 개최한 바 있다.

익명을 요구한 모 대기업 자금 담당자는 ""CP시장 불안이 커지자 현금흐름이 좋은 기업들도 만약을 대비해 CP 발행 여건을 알아보는 태핑(사전 수요조사)에 나선다는 얘기들도 나온다""며 시장이 불안한 상황이라고 전했다.

회사채 발행도 위축되자 정부는 19일 제1차 비상경제회의에서 채권시장안정펀드를 조성한다는 계획도 밝혔다.

홍남기 부총리는 브리핑에서 ""금융시장이 얼어붙으면 회사채와 주식을 발행해 자금을 조달해야 하는 기업이 돈을 구하지 못하는 '돈맥경화'가 나타난다""면서 ""어려운 시장 상황에서는 누군가 채권을 사서 돈을 순환시키는 역할이 필요하다""고 말했다.

앞서 포스코그룹 계열사인 포스파워의 신용등급이 AA-로 우량하지만, 17일 기관투자자를 대상으로 진행한 수요예측에서 발행 목표액을 채우지 못했다.

아울러 코로나19 충격이 가장 큰 항공업계는 19일 국적 항공사들이 모여 경영자금 지원 건의안을 정부에 제출하기로 했다. 건의안에는 항공사가 자체 신용으로는 회사채를 발행하기 어렵기 때문에 국책은행의 지급 보증이 선행돼야 한다는 내용이 담겼다.◇ 총수들도 잰걸음…이재용 잇단 현장점검·최태원 비상회의 소집

주요 그룹 총수들은 글로벌 경기침체 우려가 커지면서 발걸음이 빨라졌다.

이재용 삼성전자 부회장은 19일 삼성디스플레이 아산사업장을 방문해 생산라인을 점검하고 핵심 투자 분야인 퀀텀닷(QD) 디스플레이 사업을 점검했다.

이 부회장은 ""잠시도 멈추면 안 된다. 위기 이후를 내다보는 지혜가 필요하다""며 코로나19 위기 대응과 함께 새로운 성장동력 육성을 강조했다.

앞서 이 부회장은 3일 경북 구미사업장을 찾아 스마트폰 생산라인을 점검하는 등 2주 동안 두 차례 현장경영에 나섰다.

삼성전자는 재택근무는 하지 않고 '코로나19 태스크포스(TF)'를 구성해 대응하고 있다. 최근에는 TF의 역할이 국내 사업장의 안전은 물론 해외 사업장의 예방과 글로벌 경제위기에 대응하는 것으로 확대되는 것으로 전해졌다.

삼성전자의 주력 사업부인 반도체는 유럽과 미국의 장비업체들이 코로나19로 생산에 차질을 빚으면서 공급망이 위태로운 상황에 놓였다.

 또한, 삼성전자는 23일부터 TV를 생산하는 슬로바키아 공장의 가동을 1주일 동안 중단하는 등 해외 가전공장도 초비상 상태다.

4대 그룹 가운데 재택근무를 가장 적극적으로 시행하고 있는 SK그룹은 핵심 계열사들이 초유의 위기를 맞아 비상경영 체제를 강화하기로 했다.

 최태원 SK그룹 회장은 이번 주 초반 주요 계열사들이 참여하는 비상경영회의를 준비시킨 것으로 전해졌다.

SK그룹의 주력 계열사인 SK이노베이션은 정제마진이 마이너스로 돌아서 원유를 정제해 휘발유를 만들면 만들수록 손해를 보는 실정이며 국제유가 폭락에 따라 재고자산 평가손실이 막대한 상황이다. 배터리 부문도 글로벌 완성차업체들의 전기차 생산 차질, 수요 감소 등으로 여건이 녹록지 않다.

SK이노베이션은 31일까지 재택근무를 연장했지만, 책임자들과 필수 인력들은 정상 출근하고 있으며 재택근무자들도 근무시간을 연장하며 비상 상황에 대응하고 있다.

SK하이닉스는 반도체업종 특성에 따라 재택근무를 하지 않았으며 코로나TF를 가동해 주6일 회의 체제를 운영하고 있다.

justdust@yna.co.kr",/news/news_read.nhn?article_id=0011489265&office_id=001&mode=search&query=기아차&page=2
,"공장 세운 글로벌 업체들, 사업계획 뒤엎고 정부에 SOS""현대차 1분기 영업이익 -20%…연간 판매 400만대 겨우 넘을듯""

(서울=연합뉴스) 최윤정 기자 = 신종 코로나바이러스 감염증(코로나19)이 유럽과 미국으로 본격 확산하자 세계 자동차 업계에서 비명이 들리기 시작했다.

중국 현지 공장 가동중단과 판매 감소까지는 버티던 미국과 유럽 업체들이 자국으로 사태가 번지는 상황을 맞게 되자 두손 두발을 들고 있다.

업체들은 기존 사업 계획을 전면 수정하고 정부에 지원을 요청하고 있다. 10여년 전 세계 금융위기 악몽이 어른거리는 분위기라는 얘기도 나온다. 현대차 등 국내 자동차업계도 비상 체제에 돌입했다.◇ 미·유럽 차 공장 거의 멈춰…IHS ""생산 144만대 감소""

22일 업계와 외신 등에 따르면 유럽과 북미 대륙에서는 문 닫은 자동차 공장보다 문을 연 공장을 찾는 게 더 빠른 정도다.

유럽은 이탈리아, 스페인에서 시작해 영국, 독일, 체코, 슬로바키아 등 대부분 공장이 멈췄다. 미 대륙도 캐나다와 미국 등 북미와 멕시코에 이어 브라질 등 남미까지 예외가 없다. 이제 인도의 타타도 가동중단을 검토하고 있고 터키 업체들도 불안하다.

현대·기아차도 미국과 유럽 공장을 세웠다. 현대차 터키공장과 현대·기아 인도공장도 아슬아슬하다.

생산을 멈추는 데에는 코로나19 예방뿐 아니라 판매 감소 전망과 부품조달 차질 등 복합적인 이유가 있다.

이동제한 조치가 나오는 국면에서 자동차 수요 급감은 불가피하다. 아예 영업점을 열 수 없는 지역도 있다.

시장조사업체 IHS 마르키트는 유럽과 미국의 자동차 공장이 6∼15일 멈추면 생산이 144만대 감소할 것으로 내다봤다. 지난해 세계 자동차 생산량은 8천900만대였다.

완성차 공장이 멈추면 부품사들도 연쇄 타격을 입는다. 특히나 지금과 같이 갑자기 문을 닫고 언제 다시 열지 알 수 없는 상황에서는 더욱 심각하다. 제품을 선적하던 업체들은 재고를 떠안아야 하는지 고민하고 있다. ◇ 차 업계 판매 급감 우려에 정부 지원요청

올해 세계 자동차 수요 전망치는 속속 하향조정되고 있다. 무디스는 -0.9%에서 -2.5%로 내렸고 LMC오토모티브는 0%에서 -4.3%로 바꿨다. 이 숫자들은 코로나19 확산 추이에 따라 얼마든지 더 나빠질 수 있을 것으로 보인다.

시장조사업체 제이디파워(JD파워)는 미국 판매가 줄어드는 속도가 매우 빠르다고 우려했다. JD파워는 ""이달 9일엔 판매 감소가 예상 수준이었는데 15일엔 36% 적었다""며 3월 판매량이 작년 같은 달에 비해 41% 감소할 것으로 내다봤다.

모건스탠리는 앞으로 석달간 미 판매 감소율이 90%에 달할 것이라는 전망을 내놨다.

 RBC 캐피털은 포드가 2009년 이후 처음으로 연간 적자를 내고 GM은 현금 35억달러를 쓰게 될 것으로 예상했다.

미국 자동차업계는 정부에 세제혜택과 미국·멕시코·캐나다 협정(USMCA) 적용 연기 등의 지원이 필요하다고 요구했다. 특히 부품사들의 자금난을 해소해줘야 한다고 아우성이다.

직간접 고용인원이 1천만명에 달하는 자동차 산업에서 대량 해고가 이뤄지면 이로 인해 미국 경기가 더 악화할 수 있다.

도널드 트럼프 미 대통령도 ""자동차 업계를 지켜보고 있으며 조금이라도 지원할 것""이라고 말했다.

유럽도 사정은 마찬가지다. 유럽 자동차제조협회는 ""1천400만명 일자리가 위험한 상황""이라며 유럽 각국과 유럽연합(EU)은 자동차 업계에 즉시 유동성을 지원해야 한다고 요구했다.

이베스트투자증권에 따르면 올해 유럽 자동차 판매는 1천430만대로 9.5% 감소할 것으로 예상된다. 세계 금융위기 때인 2008년(-7.9%)보다 감소율이 높다.

포드는 기존 실적전망을 아예 취소하고 4월 말에 다시 내놓기로 했다. 주주배당을 연기하고 유동성 15억4천만달러를 끌어왔다.

BMW는 최근 올해 실적이 작년보다 '상당히 낮을 것'이라고 밝혔다.

폭스바겐은 코로나19가 실적에 영향을 미칠 것이지만 불확실성이 워낙 커서 지금 전망을 하기는 어렵다고 밝혔다.

GM은 실적 전망치를 유지하면서 영업환경 변화에 대응해서 비용구조에 집중하겠다고 말했다.◇ 현대차 이익전망 가파르게 하향…국내 차 산업 비상

국내 자동차 산업에도 비상이 걸렸다. 대표업체인 현대차마저 이익 전망이 뚝뚝 떨어지고 주가는 한때 6만원대까지 추락했다.

삼성증권 임은영 애널리스트는 현대차 1분기 영업이익이 작년 동기보다 21% 낮은 6천520억원에 머물 것으로 전망했다. 시장 전망 평균치는 한때 1조원이 훌쩍 넘었다. 2분기 영업이익은 7천450억원으로 작년 동기(1조2천377억원) 대비 40% 줄 것으로 관측했다.

올해 생산대수는 441만4천대에서 402만2천대로 8.9% 낮춰 잡았다. 중국은 67만대에서 55만대로 내렸다.

 그는 현재 현대차 주가 수준은 세계적으로 신용 위험이 확산하는 상황을 반영한 것으로 분석했다.

삼성증권에 따르면 세계 금융위기 때 자동차 수요는 2007년 7천440만대에서 2009년 6천240만대로 16% 줄었다. 신차 구입시 대출을 이용하는 비중이 큰 미국과 유럽에서는 감소폭이 33%로 더 컸다. 그 과정에 미국 자동차 업계에선 파산이 잇따랐다.

현재 현대기아차 국내 공장은 정상가동 중이고 울산 등지에서는 근무시간을 60시간으로 늘리는 논의가 이뤄지고 있지만 언제 상황이 급변할지 예측불가다.

국내에선 당장 일부 신차가 관심을 받고 2월 생산 부족분을 만회할 필요가 있지만 정부가 마이너스 성장 가능성을 언급하는 시기에는 낙관적으로 전망하긴 어렵다.

현대차그룹은 다음 주부터 재택근무를 축소하고 유연근무제로 대체한다. 코로나 확산 위험을 막으면서 경영위기를 돌파한다는 두 마리 토끼를 동시에 잡아야 하는 상황이라는 판단으로 보인다.

유럽 시장을 개척해서 도약해 보려던 쌍용차는 앞이 막막해 보인다. 르노삼성차는 XM3 수출물량 확보가, 한국GM은 트레일블레이저 수출물량 유지가 이슈다.

영세한 부품업체들은 생존이 문제다.

자동차산업협회에 따르면 부품업체들은 3월 가동률이 전월보단 개선됐는데도 2차 협력업체는 60~70% 수준이다.

merciel@yna.co.kr",/news/news_read.nhn?article_id=0011489272&office_id=001&mode=search&query=기아차&page=2
