head,text,url
,"[머니투데이 유영호 기자] [편집자주] 현대차그룹이 국내 생산라인 뿐 아니라 미국과 유럽 생산기지마저 멈춰 세웠다. 코로나발 위기가 현대차 전체를 감염시키는 모습이다. 주가는 2008년 글로벌 금융위기 이후 최저가를 갈아치웠다. 그러나 전문가들은 여전히 현대차의 저력을 믿는다고 했다. 현대차가 코로나를 극복하며 다시 달릴 수 있는 3가지 처방전을 살펴본다.[[현대차는 멈추지 않는다]노사가 '한마음',
""위기야 비켜라""] 전국금속노동조합 현대자동차지부(이하 현대차 노조)가 지난 16일 소식지를 발간해 노조원에게 전달한 메시지다. 투쟁보다는 코로나19 감염 확산 사태에 따른 생산량 만회에 앞장서자는 의미가 담겨 있다. 전례 없는 감염병 위기 상황에 사측에 딴지를 걸기보다는 노사 화합으로 경영 정상화를 이루는 것이 조합원 이익을 극대화하는 지름길이라는 인식이다. 노조가 이런 입장을 선언한 것은 현대차가 코로나19 위기 사태를 극복하는데 구심점 역할을 할 수 있다. 현대차 노조는 국내 전 업종에 걸쳐 대표적 ‘강성 노조’로 분류돼왔다. 현대차 경영 불확실성을 얘기할 때면 늘 ‘노조 리스크’가 꼬리표처럼 붙어다녔다. 하지만 지난 1월 '8대 집행부'가 출범하며 이런 노조에 변화가 감지된다. 이상수 노조위원장이 이끄는 현 집행부는 ‘중도·실리’ 노선을 택하고 있다. 강경 투쟁 중심의 이전 집행부들과 달리 노조원 전체의 실익과 고용 안정을 중시한다는 평가다. 이 위원장은 실제로 당선 직후 ""명분도 실리도 없는 파업은 안하겠다""고 공식 선언했다. 그는 ""4차 산업시대에 내연기관 자동차가 많이 줄어드는 게 기정사실인데 고용 안정을 이어나가기가 쉽지 않다""며 ""정파와 계파 간 이념 및 명분에 집착해 현장과 동떨어진 상급단체의 '뻥' 파업에 무조건 따르지 않겠다""고 밝혔다. 이 위원장은 ""소모적이고 소득 없는 협상을 청산해 귀족노조라는 오명을 벗겠다""고도 했다. 현대차 노조의 이런 변화는 글로벌 자동차 산업의 변화와도 맞물린다. 전기차 같은 미래 모빌리티가 급격히 발전하면서 내연기관은 패러다임 자체가 바뀌고 있다. 특히 생산라인 근로자 감소가 불가피하다. 자동차업계는 현대차가 중장기 목표에 맞춰 현행 내연기관 차량을 전기차나 수소차 등 친환경차로 대체할 경우 현 생산인력 30~40%가 줄어들 것으로 본다. 상당수 조합원의 고용 자체가 흔들릴 가능성이 높다. 실제 미국 제네럴모터스(GM) 같은 글로벌 자동차 기업은 엄청난 감원에 나서고 있다. 현대차 노조가 ""현장 문화를 개선하고 품질력과 생산성 만회를 통해 고객신뢰를 회복하자""고 앞장 서는 이유도 ""바뀌지 않으면 퇴사""라는 위기감 때문이다. 특히 최근 유럽과 미국으로 코로나 감염이 확산되며 노조는 위기의식을 더 절실히 체감한다. 당장 중국산 부품 부족으로 현대·기아차가 입은 국내 공장 생산차질만 10만대에 달하는 것으로 추산된다. 피해액만 최대 1조5000억원이 넘는다. 코로나19로 공장이 휴업했지만 사측은 평균임금의 70%를 보전해줘 휴업이 길어질수록 고용은 더 불안해진다. 노조가 먼저 연장근로와 특근 필요성을 강조한 것도 이런 맥락에서다.현대차는 지난 7일부터 울산·아산공장에서 주말 특근을 재개했다. 지난 2월 코로나 사태 초기에 생산차질을 만회하기 위해 사측이 특근을 요청했는데 노조가 그대로 수용했다. 현대차 노조 관계자는 ""제네시스 GV80, 그랜저, 팰리세이드 등 신차들이 잘 팔리면서 모처럼 실적 기회를 잡았는데 코로나 때문에 날릴 순 없지 않느냐""며 ""경직된 논리에 집착하기보다 생산량 만회에 나서는 것이 노조원 전체 이익에도 부합한다""고 밝혔다. 사측은 이에 힘을 받아 추가로 특별연장근로를 시행하는 방안도 검토 중이다. 이에 대해 노조는 긍정적인 입장으로 알려졌다.하지만 노사의 고비는 아직 남아 있다. 이르면 내달부터 시작하는 ‘2020 임금 및 단체협약 협상’(임단협)이 최대 난제다. 현대차 노조는 오는 20일 대표·대의원 선거 당선자를 발표하고 이달 안에 임시대의원 대회를 거쳐 올해 임단협 요구안을 확정할 방침이다. 이 과정에서 노사 입장차가 커져 임단협 협상이 장기화한다면 노사 화합 분위기는 깨질 수 있다. 업계 관계자는 ""현대차 노조 집행부가 분명한 노선 차이로 많은 조합원들의 지지를 받는 것에 희망을 건다""며 ""단 임단협 시기에는 노조 강성파 목소리가 커지는 현상을 잘 넘겨야 한다""고 밝혔다. 유영호 기자 yhryu@mt.co.kr
<저작권자 ⓒ '돈이 보이는 리얼타임 뉴스' 머니투데이, 무단전재 및 재배포 금지>",/news/news_read.nhn?article_id=0004380879&office_id=008&mode=search&query=기아차&page=1
,"[머니투데이 우경희 기자] [편집자주] 현대차그룹이 국내 생산라인 뿐 아니라 미국과 유럽 생산기지마저 멈춰 세웠다. 코로나발 위기가 현대차 전체를 감염시키는 모습이다. 주가는 2008년 글로벌 금융위기 이후 최저가를 갈아치웠다. 그러나 전문가들은 여전히 현대차의 저력을 믿는다고 했다. 현대차가 코로나를 극복하며 다시 달릴 수 있는 3가지 처방전을 살펴본다.[[현대차는 멈추지 않는다]글로벌 금융위기 극복한 저력] 글로벌 금융위기로 극심한 경기침체를 겪었던 지난 2008년. 현대·기아차의 생존전략은 이 석 줄로 요약된다. 코로나19 감염 쇼크가 글로벌 시장을 뒤덮고 있는 2020년. 당시 극복 전략은 여전히 유효한 해법이라는 진단이다. 글로벌 금융위기 당시 현대차 상황을 더 들여다보자. 업종을 가리지 않고 경제 전반에 한파가 몰아쳤다. 다른 제품보다 비싼 자동차 수요가 훨씬 급감했다. 현대·기아차는 2008년 연간 480만대 판매를 목표로 했지만 결국 87% 수준인 420만대 판매에 그쳤다. 팔지 못한 차량들은 그대로 재고로 쌓였다. 2008년 연말 기준 해외판매 재고차량은 무려 4개월치 판매량인 106만대에 달할 정도였다. 절체절명 위기였다. 현대차그룹은 즉각 생산 유연화와 초긴축 대책을 내세웠다. 정몽구 회장이 직접
진두지휘했다. 노조도 정신을 똑바로 차렸다. 당시 현대차 노조는 울산공장 잉여인력에 대한 대규모 공장 간 전환배치에 처음 합의했다. 기아차 노조도 위기를 함께 헤쳐 나가자는 노사 합의문을 발표했다. 노사가 합의하자 전 공장에서 잔업은 물론 정상근무까지 줄이는 대규모 감산체제에 돌입했다. 주야 맞교대(8시간+8시간)였던 그랜저와 쏘나타 같은 완성차 생산라인은 주야 4시간 생산체제(4시간+4시간)으로 돌아섰다. 버스 생산라인도 2교대제에서 1교대제(8시간+0시간)로 줄였다. 이런 감산으로 인건비 절감과 조직 효율성을 되찾자 서서히 버틸 힘이 생겼다. 뼈를 깎는 긴축경영도 뒤따랐다. 임원들은 임금을 10%씩 자진 반납했고, 업무용 차량도 쓰지 않았다. 해외 출장 때 비즈니스 좌석을 이코노미로 바꿨다. 현장에서는 근무복과 안전화, 조끼까지 아껴 썼다. 셔틀버스도 멈춰 세우고 자전거로 다녔고, 전기료 같은 에너지 비용도 20%씩 줄였다. 전방위 긴축경영은 한동안 계속됐다. 그러나 직원 구조조정은 최소화했다. 경쟁사인 토요타자동차가 직원 6000명을 줄이고, 닛산도 1500명을 구조조정을 단행했지만 현대차그룹은 그렇게 하지 않았다. ""노사가 위기를 함께 넘는다""는 측면이 강했고, 경기가 돌아서면 수요가 얼마든지 늘어날 것이라는 믿음이 있었기 때문이다. 그러면서 현대차는 품질을 더 강조했다. 2008년 12월 글로벌 위기가 한창인데 정몽구 회장은 품질담당자 110명을 불러모아 '글로벌 위기극복 품질전략 회의'를 열었다. 품질로 위기를 넘겠다는 정 회장 특유의 뚝심이었다. 정 회장이 직접 품질을 챙기자 조직 전체가 바짝 긴장했다. 차량 품질을 3년 안에 세계 3위권으로, 브랜드 인지 품질은 5년 내에 세계 5위권으로 끌어올리자는 ‘지큐(GQ, Global Quality) 3·3·5·5’ 전략을 캐치프레이즈로 내걸었다. '10년 무고장 품질'로 꼽히는 MK식 품질경영 캠페인은 그렇게 글로벌 금융위기의 한복판에서 탄생했다. 김기찬 가톨릭대 교수(경영학부)는 ""2008년 당시 현대차 대응은 V자 반등의 토대가 됐다""며 ""코로나 사태도 현대차가 뉴노멀 시대에 맞게 바뀌는 기회로 삼는다면 오히려 성장의 기회가 될 것""이라고 말했다. 우경희 기자 cheerup@mt.co.kr
<저작권자 ⓒ '돈이 보이는 리얼타임 뉴스' 머니투데이, 무단전재 및 재배포 금지>",/news/news_read.nhn?article_id=0004380880&office_id=008&mode=search&query=기아차&page=1
23일부터 유연근무 확대…임산부는 재택근무 유지,"(서울=뉴스1) 김민석 기자 = '코로나19(신종 코로나바이러스 감염증) 확산을 막고자 재택근무를 실시해온 현대·기아자동차가 글로벌 경제위기에 대응하기 위해 자율 재택근무에서 확대된 유연근무제로 전환했다.'코로나 팬데믹(세계적 유행)'에 유럽과 미주 사업장 셧다운도 속출하면서 예측하기 힘든 복합적인 위기에 대응해야하는 상황에 직면한 탓이다.현대·기아자동차는 코로나19 확산을 막기 위해 지난달 27일부터 실시했던 자율 재택근무를 23일부터 중단한다고 22일 밝혔다.다만 코로나19 감염 예방을 위해 출근 시간 범위를 오전 8시∼10시에서 오전 8시∼오후 1시로 넓히고, 필수근무시간(오전 10시∼오후 4시)을 없애는 등 확대된 유연 근무를 시행하기로 했다. 임산부에 대해서는 지속적으로 재택근무를 시행한다.현대·기아차 관계자는 ""출퇴근 시간을 최대한 분산하고 회의 등 대면접촉은 자제해 직원 간 접촉을 최소화하고 있다""며 ""일일 5시간 근무를 유지하면서 월 기준 소정근무시간을 충족하면 된다""고 설명했다.ideaed@news1.kr© 뉴스1코리아(), 무단 전재 및 재배포 금지",/news/news_read.nhn?article_id=0004536556&office_id=421&mode=search&query=기아차&page=1
수요 전망치 속속 하향조정,"코로나19가 글로벌 자동차의 주력 생산공장이 있는 유럽과 미국으로 본격 확산되면서 세계 자동차 업계가 비틀거리고 있다.미국과 유럽 업체들은 중국 등 아시아에서 자국으로 사태가 번지면서 가동중단으로 인한 실적감소와 감원을 우려한다. 현지 공장이 있거나 판매 거점을 둔 현대·기아차 등 국내 자동차 업계도 급격히 움츠러들고 있다.22일 업계와 외신 등에 따르면 유럽은 이탈리아, 스페인에서 시작해 영국, 독일, 체코, 슬로바키아 등 대부분의 공장들이 멈췄다. 미 대륙도 캐나다와 미국 등 북미와 멕시코에 이어 브라질 등 남미까지 예외가 없다. 나머지 지역들도 안심할 수 없는 상황이다. 현대·기아차도 미국과 유럽의 주요 공장을 세웠다. 현대차 터키공장과 현대·기아차 인도공장도 생산중단이 임박한 상황이다. 완성차 공장이 문닫으면 부품사들도 연쇄 타격을 입는 것이 불가피하다.이에 따라 올해 세계 자동차 수요 전망치는 속속 하향조정된다. 무디스는 -0.9%에서 -2.5%로 내렸고 LMC오토모티브는 0%에서 -4.3%로 바꿨다. 코로나19 확산 추이에 따라 얼마든지 더 내려갈 수 있을 것으로 보인다. 미국 자동차업계는 정부에 세제혜택과 미국·멕시코·캐나다 협정(USMCA) 적용 연기 등의 지원이 필요하다고 요구했다. 유럽자동차제조협회도 “1400만 명 일자리가 위험한 상황”이라며 유럽 각국과 유럽연합(EU)은 자동차 업계에 즉시 유동성을 지원해야 한다고 촉구했다.국내 자동차 산업에도 비상이 걸렸다. 증권가에선 현대차의 1분기 영업이익이 작년 동기보다 21% 낮은 6520억 원에 머물 것이라는 전망이 나온다. 올해 생산대수는 441만 4000대에서 402만 2000대로 8.9% 낮춰 잡았다. 최근 유럽 시장 개척에 의지를 보였던 쌍용차도 주요 국가의 국경 봉쇄와 자동차 전시장 폐쇄 등으로 답답한 상황이 됐다.영세한 부품업체들은 생존을 걱정해야 하는 상황이다. 자동차산업협회에 따르면 부품업체들은 3월 가동률이 전월보단 개선됐는데도 2차 협력업체는 60~70% 수준으로 떨어졌다.업계 관계자는 “자동차 생산도 문제지만 부품업체와 판매점의 경영난도 무시할 수 없다”면서 “각국 정부의 지원이 없다면 제조사와 부품사 등에서 대규모 도산과 감원이 우려된다”고 분위기를 전했다. 배동진 기자 djbae@",/news/news_read.nhn?article_id=0000990442&office_id=082&mode=search&query=기아차&page=1
,"[앵커]코로나 사태로 전 세계 경제는 대공황에 버금갈 정도로 추락하고 있습니다. 지난 한달 간 세계 증시는 무려 3경2000조원이나 증발해 버렸죠. 그 끝을 알 수 없다는 게 우리를 더 큰 공포로 몰아넣고 있습니다. 소비가 줄고 고용이 감소해 경제가 마이너스 성장하는 패턴이 예상되는데, 이게 1929년 시작된 대공황과 비슷하다고 경제전문가들이 진단하기 시작했습니다. 국내 대기업들도 해외 공장문을 닫으면서 큰 피해가 예상됩니다. 이 소식은 임유진 기자가 취재했습니다.[리포트]관객도 취재진도 없는 텅 빈 행사장에서 신형 아반떼가 유튜브로 공개됩니다.호세 무뇨스 / 현대차 글로벌 최고운영책임자""많은 분들이 직접 와주셨으면 좋겠지만 쇼는 계속돼야 합니다."" 현대차는 주력 판매 모델에 실적 개선을 기대했지만, 바로 다음날 코로나19 확진자가 나오며 미국 공장 문을 닫게 됐습니다. 현대차 뿐 아니라 기아차까지 미국과 유럽 내 모든 공장으로 셧다운은 확산되고 있습니다. 삼성전자는 슬로바키아 TV 공장 문을 내일부터 일주일간 닫습니다.
지난달 세계 자동차 판매는 20% 줄었고, 스마트폰 출하량은 38%가 급감했습니다.생산차질과 소비감소에 따른 기업들의 타격은 코로나19가 미국과 유럽으로 확산된 이달부터 더 커질 전망입니다.
대외의존도가 높은 우리 경제는 연간 마이너스 성장을 할 것이란 전망까지 나왔습니다. 현실화 된다면 건국 이래 3번째가 됩니다.주원 / 현대경제연구원 경제연구실장""소비 심리가 많이 위축되면서 소비라든가 투자가 확연히 나빠지는 모습들이 보이고 있고요. 대중 수출이 마이너스가 크게 나올 가능성이 있고"" 공포에 질린 세계 증시에선 지난 한 달 동안 시가총액 3경 2000조원이 감소했습니다. 우리나라 증시 하락률은 86개국 가운데 18번째로 크게 나타났습니다. TV조선 임유진입니다.임유진 기자(limyj@chosun.com)* 뉴스제보 : 이메일(tvchosun@chosun.com), 카카오톡(tv조선제보), 전화(1661-0190)- Copyrights ⓒ TV조선. 무단전재 및 재배포 금지 -",/news/news_read.nhn?article_id=0000294331&office_id=448&mode=search&query=기아차&page=1
,"코로나19 사태로 전 세계 경제위기가 깊어지고 있는 가운데 현대·기아차 본사가 이번 주부터 정상출근으로 근무 방식을 바꿉니다.현대·기아차는 지난달 27일부터 시작한 자율 재택근무를 중단하고 내일(23일)부터 출근 시간 범위를 넓히고 필수근무시간을 없애는 유연 근무로 전환하기로 했습니다.현대·기아차는 코로나19 초기에는 중국발 부품 공급망 중심으로 대응했지만, 최근에는 미주와 유럽 공장가동 중단 등 권역별 상황에 신속 대응해야 하는 실정입니다.SK텔레콤 등 SK 계열사들은 대부분 재택근무를 이번 달 안으로 마무리 짓고 다음 달부터는 정상 근무 체제로 바꾸기로 했습니다.최태원 SK그룹 회장은 이번 주 초반 주요 계열사들이 참여하는 그룹 경영회의를 열고 세계 경제 위기에 맞서 대응 방안을 논의할 예정입니다.산업계는 기업의 실적악화 현실화와 전 세계 경제위기 가속화에 따라 비상 대응 강도를 최고 수위로 높여 나가고 있습니다.이광엽[kyuplee@ytn.co.kr][저작권자(c) YTN & YTN PLUS 무단전재 및 재배포 금지]",/news/news_read.nhn?article_id=0001418194&office_id=052&mode=search&query=기아차&page=1
코로나19 경제 직격탄,"재계가 코로나19 사태로 가동한 비상체제가 글로벌 경제 상황이 더욱 악화하면서 기존 대응 모드를 업그레이드하고 있다.국내 주요 기업들은 코로나19 사태 초기 임직원의 안전과 사업장 셧다운 방지 등 업무지속계획(BCP)을 최우선으로 실시했다. 그러나 유럽과 미주의 상황이 급격히 나빠지면서 글로벌 경제위기가 대두되자 재택근무를 속속 중단하거나 자사주 매입에 나서는 등 경제위기 장기화에 대비하는 모습을 보이고 있다.22일 재계에 따르면 주요 기업들은 코로나19가 팬데믹(세계적 대유행) 상황에 글로벌 사업장들의 셧다운이 잇따르고 기업어음(CP)시장의 신용경색 우려마저 나오면서 복합위기에 대응하는 비상경영 체제를 가동하고 있다.삼성전자는 23일부터 TV를 생산하는 슬로바키아 공장의 가동을 1주일 동안 중단하는 등 해외 가전공장도 초비상 상태다. 반도체 분야는 유럽과 미국의 장비업체들이 코로나19로 생산에 차질을 빚으면서 공급망이 위태로운 상황이다. 이에 이재용 부회장은 이달에만 스마트폰과 디스플레이 공장을 두 차례나 찾는 현장경영에 나서기도 했다.SK이노베이션은 31일까지 재택근무를 연장했지만, 책임자들과 필수 인력들은 정상 출근하고 있다. 재택근무자들도 근무시간을 연장하며 비상 상황에 대응하고 있다. 최태원 SK그룹 회장은 이번 주 초반 주요 계열사들이 참여하는 비상경영회의를 준비시킨 것으로 전해졌다.미국과 유럽 4곳의 공장을 폐쇄하거나 문닫을 예정인 현대·기아차는 지난달 27일부터 시작한 자율 재택근무를 23일부터 중단하기로 했다.코로나19의 직격탄을 맞고 있는 유통과 서비스를 주업종으로 하는 롯데그룹도 창립 이래 최대 위기를 맞고 있다. 롯데는 20일 신동빈 회장과 롯데지주 임원들의 급여 반납분으로 자사주 매입에 나서기도 했다.유동성 위기를 겪고 있는 항공업계도 19일 국적 항공사들이 모여 경영자금 지원 건의안을 정부에 내기로 했다.경제전문가들은 “이런 상황이 지속되면 3개월 후 살아남을 기업이 없을 것”이라며 “자금난을 겪고 있는 기업들에 대한 금융지원이 절실한 상황”이라고 입을 모으고 있다.배동진 기자 djbae@",/news/news_read.nhn?article_id=0000990459&office_id=082&mode=search&query=기아차&page=1
,"현대·기아차와 SK텔레콤 등 국내 주요 대기업들이 지난달 시작한 재택근무를 내일부터 중단합니다.
코로나19 확산에 따른 글로벌 경제위기 대응을 위한 것으로, 감염 예방을 위해 유연 근무제를 확대 시행하기로 했습니다.< Copyright ⓒ MBN(www.mbn.co.kr) 무단전재 및 재배포 금지 >",/news/news_read.nhn?article_id=0001435096&office_id=057&mode=search&query=기아차&page=1
,"신종 코로나바이러스 감염증(코로나19) 사태가 언제 진정될지, 또 그 여파를 짐작조차 할 수 없는 상황으로 치달으면서 재계가 비상경영체제 전환을 서두르고 있다. 재계는 세계 주요시장에 동시 충격을 준 코로나19가 야기할 경제위기 가능성까지 염두에 두고 대책 마련에 부심하는 모습이다.
22일 재계에 따르면 주요 기업들은 코로나19가 팬데믹(세계적 대유행) 상황에 글로벌 사업장들의 ‘셧다운’(가동 중단)이 잇따르고 기업어음(CP) 시장의 신용경색 우려가 불거지면서 복합위기에 대응하는 비상경영체제를 가동하고 있다.

 지난달 24일 울산시 북구 현대자동차 울산공장 명촌정문에서 오전 출근조 근로자들이 퇴근하고 있다. 뉴스1

현대·기아차는 23일부터 자율 재택근무를 중단한다. 지난달 27일부터 자택근무를 시작했지만, 현재의 상황이 적시성과 효율성이 떨어질 수 있는 비대면 근무 시스템으로 대응하기 어렵다는 판단에 따른 조치로 보인다.
현대·기아차는 코로나19 초기부터 종합상황실을 운영해왔다. 초기에는 중국발 부품 공급망 중심으로 대응했지만, 최근에는 미주와 유럽까지 권역별 상황을 파악해 신속 대응해야 하는 실정이다. 현대차와 기아차는 미국의 앨라배마와 조지아 공장의 생산을 18일부터 중단했으며, 체코 공장과 슬로바키아 공장은 23일부터 2주 동안 문을 닫는다.

한국의 효자 수출품목인 반도체의 유럽과 미국 등지의 공급망도 위태롭긴 마찬가지다. 미국과 유럽의 반도체 장비 공장 중 일부가 가동을 중단했거나, 순환 재택근무를 실시 중이라 안정적인 공급에 빨간불이 켜진 것이다. 시장조사업체 IDC는 최악의 시나리오에서 올해 글로벌 반도체 시장이 작년 대비 12% 이상 쪼그라들 것으로 예측했고, 역성장 확률은 80%에 달한다고 봤다.
CP와 회사채 시장을 중심으로 한 신용경색 우려도 걱정이다. 실제 포스코그룹의 신용등급 ‘AA-’ 우량 계열사인 포스파워가 지난 17일 기관투자자를 대상으로 진행한 수요예측에서 발행 목표액을 채우지 못하는 사례가 발생했다.

 이재용 삼성전자 부회장이 19일 충남 아산 삼성디스플레이 아산사업장에서 제품을 살펴보고 있다. 뉴스1

주요 그룹 총수도 속속 위기 대응 전면에 나서고 있다. 이재용 삼성전자 부회장은 19일 삼성디스플레이 아산사업장을 방문해 디스플레이 사업을 점검했다. 앞서 이 부회장은 3일 경북 구미사업장을 찾아 스마트폰 생산라인을 점검하는 등 2주 동안 두 차례 현장경영에 나섰다.
최태원 SK그룹 회장은 이번 주 초반 주요 계열사들이 참여하는 경영회의를 준비시킨 것으로 전해졌다. 전반적인 경영현황을 점검하는 자리로 알려졌다. SK의 주력 계열사인 SK이노베이션은 원유 정제마진이 마이너스로 돌아섰다. 국제유가 폭락에 따라 재고자산 평가손실도 커지고 있다. 배터리 부문도 글로벌 완성차업체들의 전기차 생산 차질, 수요 감소 등으로 여건이 녹록지 않다.
코로나19의 ‘불확실성’은 재계가 효과적인 대응책을 적기에 마련할 수 없게 만드는 한계다. 단기에 끝나 시장 영향이 제한적이었던 메르스(중동호흡기증후군) 등 과거 감염병과는 궤를 달리하고 있다. 재계 관계자는 “코로나19가 세계 전역으로 빠르게 확산하고 있고, 언제 진정될지 짐작조차 힘들다”며 “상황이 진정된다고 하더라도 그 영향이 과거 어느 때보다 크고, 자칫 주요국의 경기침체로 전이될 수 있다”고 말했다.
금융권도 초비상이다. 신한금융그룹은 코로나19 사태가 안정될 때까지 그룹 차원의 종합상황브리핑 회의를 운영하기로 했다. KB금융은 현시점에서 경영계획을 수정하는 작업을 진행하고 있지 않지만 주요 지표를 중심으로 경기와 금융시장을 매일 모니터링하고 있다. 우리금융은 그룹 위기관리 컨트롤타워인 비상경영대책위원회를 신설했다.
 나기천·조현일·김준영 기자 na@segye.comⓒ 세상을 보는 눈,",/news/news_read.nhn?article_id=0003449390&office_id=022&mode=search&query=기아차&page=1
