head,text,url
CDP 실시 '탄소경영 아너스 클럽' 선정…글로벌 지속가능경영 모범,"[아이뉴스24 황금빛 기자] 현대자동차와 기아자동차가 글로벌 환경경영 인증기관인 '탄소정보공개 프로젝트(CDP)'가 실시한 2019년도 평가에서 국내 기업 가운데 평가점수 상위 5개사에만 주어지는 '탄소경영 아너스 클럽'에 선정됐다고 28일 밝혔다.CDP는 다우존스 지속가능성지수(DJSI), FTSE4GOOD 지수 등과 함께 기업의 지속가능성을 평가하는 가장 공신력 있는 지표다. 전세계 금융투자기관의 위임을 받아 각국 주요 상장기업을 대상으로 기후변화, 수자원 등 글로벌 환경 이슈 대응과 관련된 평가를 시행한다.결과에 따라 리더십A, 리더십A-, 매니저먼트B, 매니저먼트B- 등 8개 등급으로 나뉜다. 평가점수 상위 5개 사는 탄소경영 아너스 클럽으로 선정한다.현대차는 이번 평가에서 ▲수소전기차·전기차 등 친환경차 개발과 보급 ▲사업장별 온실가스 고효율 감축 설비 도입 ▲아산공장·울산공장 태양광 패널 설치 ▲아산공장 무방류시스템 등 중장기적인 환경경영 강화 활동 등을 인정받아 탄소경영과 수자원 부문에서 최고 등급인 리더십A를 획득하고 탄소경영 아너스 클럽의 영예를 안았다.현대차는 지난해에 이어 2년 연속 탄소경영 아너스 클럽에 선정된 것인데 특히 올해는 수자원 관리 부문에 처음으로 참여해 최고 등급인 리더십A를 획득하며 지속가능경영 최우수 기업으로 선정됐다.기아차는 이번 평가에서 ▲친환경차 판매를 통한 친환경차 시장 확대 주도 ▲생산공정 고효율 모터 및 터보 냉동기, 공조기 개선 등을 통한 온실가스 감축 ▲투명한 탄소배출량 정보공개 ▲구체적인 탄소경영 추진 등 선제적인 기후변화 대응 노력을 인정받아 최고 등급인 리더십A를 획득하고 탄소경영 아너스 클럽의 영예를 안았다.올해는 전 세계 8천300여 개의 기업 평가가 진행됐고 기후변화 부문에서 리더십 A 등급을 받은 기업은 총 181개 사다. 이 가운데 한국 기업은 현대차와 기아차를 포함해 총 9개 사다.수자원 관리 부문에서 리더십 A등급을 받은 기업은 총 72개 사이며, 이 가운데 한국 기업은 현대차를 포함해 총 2개 사다.현대·기아차 관계자는 ""이번 평가에서 현대∙기아차 모두 최고의 성적을 받으며 지속가능경영의 모범이 됐다""며 ""향후에도 생산부터 판매에 이르는 가치사슬 효율화, 신재생에너지 사용 확대 및 사업장 온실가스 감축 등을 보다 적극적으로 시행해 나갈 예정""이라고 말했다. gold@inews24.com [ⓒ 아이뉴스24 무단전재 및 재배포 금지]",/news/news_read.nhn?article_id=0000536216&office_id=031&mode=search&query=기아차&page=2
,"현대자동차와 기아자동차가 세계적인 지속가능경영 평가기관으로부터 국내 기업 최고의 평가를 받았다.현대ㆍ기아차는 글로벌 환경경영 인증기관 ‘탄소정보공개 프로젝트(CDP)’가 실시한 2019년도 평가에서 국내 기업 중 평가점수 상위 5개사에만 주어지는 ‘탄소경영 아너스 클럽’에 선정됐다고 28일 밝혔다. 특히 현대차는 지난해에 이어 2년 연속 탄소경영 아너스 클럽에 선정됐다. CDP는 다우존스 지속가능성지수(DJSI), FTSE4GOOD 지수 등과 함께 기업의 지속가능성을 평가하는 가장 공신력 있는 지표로 인정받고 있다. 세계 금융투자기관 위임을 받아 각국 주요 상장기업을 대상으로 기후변화, 수자원 등 글로벌 환경 이슈 대응과 관련된 평가를 시행한다. 결과에 따라 8개 등급으로 나누고, 평가점수 상위 5개사를 탄소경영 아너스 클럽으로 선정한다. 현대차는 이번 평가에서 △수소전기차ㆍ전기차 등 친환경차 개발ㆍ보급 △사업장별 온실가스 고효율 감축 설비 도입 △아산ㆍ울산공장 태양광 패널 설치 △아산공장 무방류시스템 등 중장기적인 환경경영 강화 활동 등을 인정받아 탄소경영과 수자원 부문에서 최고 등급인 ‘리더십A’를 획득하고 탄소경영 아너스 클럽의 영예를 안았다.기아차는 이번 평가에서 △친환경차 판매를 통한 친환경차 시장 확대 주도 △생산공정 고효율 모터 및 터보 냉동기, 공조기 개선 등을 통한 온실가스 감축 △투명한 탄소배출량 정보공개 △구체적인 탄소경영 추진 등 선제적인 기후변화 대응 노력을 인정받아 최고 등급인 리더십A를 획득하고 탄소경영 아너스 클럽이 됐다.올해는 전 세계에서 8,300여개의 기업 평가가 진행됐다. 기후변화 부문에서 리더십A 등급을 받은 기업은 총 181개사로 이 중 한국 기업은 현대차와 기아차를 포함해 총 9개사다. 수자원 관리 부문에서 리더십 A등급을 받은 기업은 총 72개사이며, 이 중 한국 기업은 현대차를 포함해 총 2개사다.현대ㆍ기아차 관계자는 “이번 평가에서 현대ㆍ기아차 모두 최고의 성적을 받으며 지속가능경영의 모범이 됐다”며 “향후에도 생산부터 판매에 이르는 가치사슬 효율화, 신재생에너지 사용 확대 및 사업장 온실가스 감축 등을 보다 적극적으로 시행해 나갈 예정”이라고 말했다.류종은 기자 rje312@hankookilbo.com<사진설명> 현대·기아차, 기후변화 대응 평가서 최우수 기업 선정현대자동차와 기아자동차는 글로벌 환경경영 인증기관인 ‘탄소정보공개 프로젝트(CDP, Carbon Disclosure Project)’가 실시한 2019년도 평가에서 국내 기업 중 평가점수 상위 5개사에만 주어지는 ‘탄소경영 아너스 클럽(Honors Club)’에 선정됐다고 28일(화) 밝혔다.",/news/news_read.nhn?article_id=0000491618&office_id=469&mode=search&query=기아차&page=2
,"자동차는 생김새에 따라 다양한 종류로 나눌 수 있다. 세단, 해치백, 왜건, 쿠페, 컨버터블, SUV 등 익숙한 분류에 해치백의 고성능 모델인 ‘핫해치’, 2인승 컨버터블을 뜻하는 ‘로드스터’, 쿠페형 SUV ‘SAC(Sport Activity Coupe)’ 등 기존 범주에서 파생된 하위 개념도 있다. 흔히 알고 있는 차종도 나라에 따라 완전히 생소한 명칭으로 불리기도 한다.세단(Sedan)은 가장 일반적인 모습의 자동차다. 양쪽에 2개씩 총 4개의 문, 분리된 트렁크룸, 앞으로 돌출된 엔진룸의 형태를 갖췄으며 4∼5명이 탈 수 있다. 옆에서 봤을 때 차의 구조가 엔진룸, 객실, 트렁크 등 3개의 ‘상자’로 이뤄져 ‘3박스 카’라고도 불린다. 세단은 미국식 표현이고 영국에서는 살룬(Saloon), 이탈리아에선 베를리나(Berlina), 독일에서는 리무지네(Limousine) 등으로 불린다. 또 다른 표현으로는 노치백(Notchback)이 있다. 노치백은 천장에서 트렁크로 가는 라인이 급격히 꺾이는 디자인을 뜻하는데, 보통 세단이 이런 형태다. 하지만 세단과 노치백이 같은 말은 아니다. 패스트백(Fastback) 세단도 있기 때문이다. 스포츠 세단은 주행성능을 중점적으로 높인 고성능 세단으로, BMW 3시리즈가 대표적이다.해치백(Hatchback)은 ‘위로 잡아당겨 여는 문’을 의미하는 해치(Hatch)가 차의 뒤쪽(Back)에 있다는 뜻이다. 엔진룸과 객실·트렁크로 구분돼 ‘2박스 카’로도 불린다. 해치백은 뒷유리와 트렁크가 함께 열려 뒤에서도 객실로 탑승할 수 있다. 이에 트렁크도 ‘문’으로 계산돼 해치백은 3도어, 5도어 등 문의 개수가 홀수다. 폭스바겐 골프, BMW 1시리즈 등이 해치백 대표 모델이다. 완성차업체 관계자에 따르면, 해치백은 리어 오버행(Rear Overhang·뒤 차축 중심선부터 차량 뒤쪽 끝부분까지의 거리)이 짧아 뒤쪽에 실리는 무게가 줄어든다. 따라서 같은 엔진을 달아도 세단보다 운동성능 면에서 유리하다. 이런 장점을 극대화한 고성능 해치백이 핫해치(Hot Hatch)다. 작은 크기에 폭발적인 성능을 낸다고 해서 포켓 로켓(Pocket Rocket)이라고도 불린다. 아우디 RS3 등이 유명하다.왜건(Wagon)은 차체 뒷부분이 확장돼 넓은 적재공간을 갖춘 차다. 미국 서부개척 시대 포장마차에서 유래했는데, 옛날 포장마차와 구분하기 위해 현재의 왜건을 스테이션 왜건(Station Wagon)이라고도 한다. 영국에서는 에스테이트 카(Estate Car), 이탈리아에선 파밀리아레(Familiare), 독일에서는 콤비(Kombi) 등으로도 불린다. 브랜드별로도 호칭이 달라서 메르세데스-벤츠는 에스테이트(Estate), BMW는 투어링(Touring), 아우디는 아반트(Avant), 푸조는 SW, 볼보는 V시리즈가 왜건 모델이다. 왜건과 해치백의 가장 큰 차이점은 필러(Pillar)의 개수다. 필러는 차량 천장을 받치는 기둥이다. 앞유리와 앞 좌석 옆유리 사이에 A필러, 앞 좌석 옆유리와 뒷좌석 옆유리 사이에 B필러, 뒷좌석 옆유리와 뒷유리 사이에 C필러가 있다. 왜건에는 4번째 D필러가 있다. 최근에는 볼보가 차고를 높여 왜건과 SUV의 장점을 혼합한 V시리즈 크로스컨트리 모델을 출시, ‘왜건의 무덤’ 한국에서도 시장을 개척하고 있다.쿠페는 높이가 낮고 문은 2개이며, 운전석 뒤쪽으로 갈수록 급격히 낮아지는 라인을 가진 자동차다. 공기 저항을 줄이기 위한 디자인인데, 세단과 달리 B필러를 생략해 매끄러운 곡선을 그려내는 경우가 많다. 쿠페에도 노치드 쿠페와 패스트백이 있다. 원래 쿠페는 문이 2개지만, 최근에는 4도어 쿠페가 나와 인기를 끌고 있다. 벤츠 CLS가 4도어 쿠페의 개척자였다. 패스트백은 차종 분류의 범주가 아니고 디자인 개념이다. 패스트백은 차체 뒤쪽(Back)이 빨라(Fast) 보인다는 의미로, 천장부터 트렁크 뚜껑까지 매끄럽게 하나로 이어지는 유선형 디자인을 뜻한다. 1930년대 공기역학 개념이 자동차 디자인에 반영되면서 등장했다. 패스트백을 상징하는 모델은 1964∼1973년 생산된 1세대 포드 머스탱이다. 영화 불릿(Bullitt)에서 스티브 매퀸이 몰았던 차가 1968년식 머스탱이다. 1975년 현대차 최초의 고유 모델 포니 4도어는 패스트백 세단이었다. 기아차 3세대 K5도 패스트백 스타일의 세단이다.컨버터블(Convertible)은 지붕을 여닫을 수 있는 자동차다. 미국과 영국, 우리나라와 일본 등에서는 컨버터블로 부른다. 다른 이름 카브리올레(Cabriolet)는 2륜 마차란 뜻의 프랑스어로, 독일 등 유럽에서 주로 사용한다. 영국에서는 드롭헤드 쿠페(Drophead Coupe)란 명칭도 썼는데, 현재는 롤스로이스만 이 표현을 쓴다. 애스턴 마틴은 ‘비행하는’이라는 뜻의 이탈리아어 볼란테(Volante)로 부른다. 특히 컨버터블 중에서도 좌석이 2개 이하인 차를 일컫는 명칭이 로드스터(Roadster)다. 스파이더(Spider)라고도 부른다.컨버터블은 지붕 소재에 따라 하드톱(Hard Top)과 소프트톱(Soft Top)으로 나뉜다. 하드톱은 차체 강성과 안전성이 높지만, 지붕을 여느냐 닫느냐에 따라 무게중심이 바뀌는 단점이 있다. 반면 소프트톱은 가볍지만, 안전성이 낮고 소음 차단 성능도 떨어진다. 어느 경우든 지붕이 열리기 때문에 전복 사고에 대비해 A필러를 훨씬 튼튼하게 제작해야 한다.SUV는 스포츠 유틸리티 차량이란 뜻이다. 험로주행 능력이 뛰어나 여가 활동에 적합한 차다. 최초의 SUV로는 1935년 출시된 쉐보레 서버번이 꼽히지만, 사실 서버번은 밴(Van) 형태에 가까웠다. 현대적 SUV의 시초로 평가받는 차는 카이저(과거 지프를 소유했던 자동차 브랜드)가 만든 왜고니어다. 출시 2년 뒤인 1965년 왜고니어에 4륜구동 시스템이 적용돼 현재와 같은 SUV의 시작을 알렸다. 1990년 포드 익스플로러, 1993년 지프 그랜드 체로키가 등장하며 본격적으로 SUV라는 명칭이 사용됐다. SUV 수요 증가에 따라 SAC라는 새로운 장르도 탄생했다. 2007년 BMW가 X6를 출시하며 내놓은 개념으로, 쿠페형 SUV로 보면 된다. 정통 SUV와 달리 오프로드 주행보다는 도심 주행을 지향한다. BMW X시리즈 중 X6·X4·X2 등 짝수 모델, 벤츠의 GLE 쿠페와 GLC 쿠페, 마세라티 르반떼, 람보르기니 우르스, 애스턴 마틴 DBX 등이 쿠페형 SUV다.김성훈 기자 tarant@munhwa.com[Copyrightⓒmunhwa.com '대한민국 오후를 여는 유일석간 문화일보' 무단 전재 및 재배포 금지()]",/news/news_read.nhn?article_id=0002426106&office_id=021&mode=search&query=기아차&page=2
,"현대·기아차가 세계적인 지속가능경영 평가기관으로부터 국내 기업 최고의 평가를 받았다.현대자동차와 기아자동차는 글로벌 환경경영 인증기관인 '탄소정보공개 프로젝트(CDP, Carbon Disclosure Project)'가 실시한 2019년도 평가에서 국내 기업 중 평가점수 상위 5개사에만 주어지는 '탄소경영 아너스 클럽(Honors Club)'에 선정됐다고 28일(화) 밝혔다.특히 현대차는 지난해에 이어 2년 연속 탄소경영 아너스 클럽에 선정되는 영예를 안았다.탄소정보공개 프로젝트(CDP)는 다우존스 지속가능성지수(DJSI), FTSE4GOOD 지수 등과 함께 기업의 지속가능성을 평가하는 가장 공신력 있는 지표로 인정받고 있다.전세계 금융투자기관의 위임을 받아 각국 주요 상장기업을 대상으로 기후변화, 수자원 등 글로벌 환경 이슈 대응과 관련된 평가를 시행하고, 결과에 따라 리더십A(Leadership A), 리더십A-(Leadership A-), 매니저먼트B(Management B), 매니저먼트B-(Management B-) 등 8개로 등급을 나누는 한편, 평가점수 상위 5개사는 탄소경영 아너스 클럽으로 선정한다.현대차는 이번 평가에서 ▲수소전기차·전기차 등 친환경차 개발 및 보급 ▲사업장별 온실가스 고효율 감축 설비 도입 ▲아산공장·울산공장 태양광 패널 설치 ▲아산공장 무방류시스템 등 중장기적인 환경경영 강화 활동 등을 인정받아 탄소경영과 수자원 부문에서 최고 등급인 리더십A를 획득하고 탄소경영 아너스 클럽의 영예를 안았다.특히 현대차는 올해 수자원 관리 부문에 처음으로 참여해 최고 등급인 리더십A를 획득하며 지속가능경영 최우수 기업으로 선정됐다.기아차는 이번 평가에서 ▲친환경차 판매를 통한 친환경차 시장 확대 주도 ▲생산공정 고효율 모터 및 터보 냉동기, 공조기 개선 등을 통한 온실가스 감축 ▲투명한 탄소배출량 정보공개 ▲구체적인 탄소경영 추진 등 선제적인 기후변화 대응 노력을 인정받아 최고 등급인 리더십A를 획득하고 탄소경영 아너스 클럽의 영예를 안았다.올해는 전 세계에서 8천 3백여개의 기업 평가가 진행됐으며, 기후변화 부문에서 리더십A 등급을 받은 기업은 총 181개사로 이 중 한국 기업은 현대차와 기아차를 포함해 총 9개사다.수자원 관리 부문에서 리더십 A등급을 받은 기업은 총 72개사이며, 이 중 한국 기업은 현대차를 포함해 총 2개사다.현대·기아차 관계자는 ""이번 평가에서 현대?기아차 모두 최고의 성적을 받으며 지속가능경영의 모범이 됐다""며, ""향후에도 생산부터 판매에 이르는 가치사슬 효율화, 신재생에너지 사용 확대 및 사업장 온실가스 감축 등을 보다 적극적으로 시행해 나갈 예정""이라고 말했다. 이정혁 기자 jjangga@sportschosun.com- Copyrightsⓒ , 무단 전재 및 재배포 금지",/news/news_read.nhn?article_id=0003560403&office_id=076&mode=search&query=기아차&page=2
지난해 탄소정보공개 프로젝트 평가서 국내 기업 중 최고 성적,"현대∙기아차가 세계적인 지속가능경영 평가기관으로부터 국내 기업 최고의 평가를 받았다.현대자동차와 기아자동차는 글로벌 환경경영 인증기관인 ‘탄소정보공개 프로젝트(CDP, Carbon Disclosure Project)’가 실시한 2019년도 평가에서 국내 기업 중 평가점수 상위 5개사에만 주어지는 ‘탄소경영 아너스 클럽(Honors Club)’에 선정됐다고 28일 밝혔다.특히 현대차는 지난해에 이어 2년 연속 탄소경영 아너스 클럽에 선정되는 영예를 안았다.탄소정보공개 프로젝트(CDP)는 다우존스 지속가능성지수(DJSI), FTSE4GOOD 지수 등과 함께 기업의 지속가능성을 평가하는 가장 공신력 있는 지표로 인정받고 있다.전세계 금융투자기관의 위임을 받아 각국 주요 상장기업을 대상으로 기후변화, 수자원 등 글로벌 환경 이슈 대응과 관련된 평가를 시행하고, 결과에 따라 리더십A(Leadership A), 리더십A-(Leadership A-), 매니저먼트B(Management B), 매니저먼트B-(Management B-) 등 8개로 등급을 나누는 한편, 평가점수 상위 5개사는 탄소경영 아너스 클럽으로 선정한다.현대차는 이번 평가에서 수소전기차·전기차 등 친환경차 개발 및 보급, 사업장별 온실가스 고효율 감축 설비 도입, 아산공장·울산공장 태양광 패널 설치, 아산공장 무방류시스템 등 중장기적인 환경경영 강화 활동 등을 인정받아 탄소경영과 수자원 부문에서 최고 등급인 리더십A를 획득하고 탄소경영 아너스 클럽의 영예를 안았다.특히 현대차는 올해 수자원 관리 부문에 처음으로 참여해 최고 등급인 리더십A를 획득하며 지속가능경영 최우수 기업으로 선정됐다.기아차는 이번 평가에서 친환경차 판매를 통한 친환경차 시장 확대 주도, 생산공정 고효율 모터 및 터보 냉동기, 공조기 개선 등을 통한 온실가스 감축, 투명한 탄소배출량 정보공개, 구체적인 탄소경영 추진 등 선제적인 기후변화 대응 노력을 인정받아 최고 등급인 리더십A를 획득하고 탄소경영 아너스 클럽의 영예를 안았다.올해는 전 세계에서 8300여개의 기업 평가가 진행됐으며, 기후변화 부문에서 리더십A 등급을 받은 기업은 총 181개사로 이 중 한국 기업은 현대차와 기아차를 포함해 총 9개사다.수자원 관리 부문에서 리더십 A등급을 받은 기업은 총 72개사이며, 이 중 한국 기업은 현대차를 포함해 총 2개사다.현대∙기아차 관계자는 “이번 평가에서 현대∙기아차 모두 최고의 성적을 받으며 지속가능경영의 모범이 됐다”며 “향후에도 생산부터 판매에 이르는 가치사슬 효율화, 신재생에너지 사용 확대 및 사업장 온실가스 감축 등을 보다 적극적으로 시행해 나갈 예정”이라고 말했다.데일리안 조인영 기자 (ciy8100@dailian.co.kr)ⓒ (주)데일리안 - 무단전재, 변형, 무단배포 금지",/news/news_read.nhn?article_id=0002398898&office_id=119&mode=search&query=기아차&page=2
,"[디지털타임스 박정일 기자] 지난해 국내 100대 기업의 영업이익률이 2013년 이후 가장 저조한 것으로 조사됐다. 여기에 코로나19 팬데믹(세계적 대유행) 사태까지 겹치면서 올 2분기에는 사실상 모든 기업들이 최악의 위기를 겪을 것이라는 우려의 목소리가 나온다.28일 조직개발 전문업체 지속성장연구소가 기업분석 전문 한국CXO연구소에 의뢰해 2013년∼2019년 국내 100대 기업의 실적을 분석한 결과, 지난해 100대 기업의 영업이익은 43조6309억원으로 2017년(94조1213원), 2018년(97조6422억원)의 절반에도 못 미친 것으로 집계됐다.이는 2013년 이후 6년만에 최저 수준이다. 매출 하락이 영업이익 감소의 주 원인이고, 인건비 부담도 작용했다는 분석이다. 100대 기업의 인건비 규모는 2013년 57조2505억원에서 2018년 68조1949억원, 지난해에는 68조1528억원을 기록하는 등 매년 늘어났다.매출 역시 정체에 빠져 '외형성장'의 한계에 직면했다는 분석이 나온다. 지난해 100대 기업의 매출액은 964조원으로, 2018년 매출(1006조원)의 95.8% 수준이고, 2013년(995조원)과 2014년(978조원)보다 적은 것으로 나타났다.이처럼 이미 기업들의 기초체력이 약해진 상황에 코로나19 사태까지 겹치면서 주요 대기업들의 수익성 확보와 신용 등급에 비상이 걸렸다. 이날 금융감독원에 따르면 지난해 신용평가회사가 신용등급을 낮춘 기업은 54곳으로 신용등급을 올린 기업(37곳)보다 17곳 더 많았다. 등급이 하락한 기업은 전년보다 17곳 늘었고 등급이 상승한 기업은 7곳 줄었다.코로나19의 직격탄을 맞은 기업들도 속출하고 있다. 에쓰오일은 1분기 영업손실이 1조원을 넘으면서 창사 이후 최악의 성적표를 받았고, 아모레퍼시픽그룹 역시 1분기 영업이익이 전년 동기보다 67%나 급감했다. 기아차도 전년 동기와 비교해 1분기 순이익이 반토막(59%↓) 났다.삼성전자와 LG전자, SK하이닉스 등 전자·IT 업체들이 비교적 선방한 편이지만, 이들 역시 2분기 실적 악화가 불가피하다는 전망을 내놓았다. 대부분의 주요 대기업들이 2분기 실적 부진의 요인으로 '코로나19에 따른 불확실성'을 꼽았다.재계에서는 코로나19 사태를 계기로 우리 산업의 체질을 획기적으로 바꿔야 한다고 조언하고 있다. 유환익 전국경제인연합회 기업정책실장은 ""선제적이고 폭넓은 규제개혁으로, 코로나19의 위기를 우리 산업의 체질혁신 기회로 삼아야 한다""고 말했다. 박정일기자 comja77@dt.co.kr 디지털타임스
/",/news/news_read.nhn?article_id=0002595799&office_id=029&mode=search&query=기아차&page=2
