head,text,url
"LGD, 中에 전세기 띄울 준비","한국 간판 기업들이 글로벌 현장에서 코로나발(發) 연쇄 충격에 휩싸였다. 신종 코로나바이러스 감염증(코로나19) 확진자가 발생해 현지 공장 가동을 중단하는가 하면 세계 각국의 협력사가 ‘셧다운(생산 일시 중단)’하면서 글로벌 조달망까지 위협받고 있다. 중국과 유럽이 코로나19 차단을 위해 빗장을 걸어잠그면서 인력·물류의 이동길도 막혔다. 반도체, 디스플레이, 자동차, 배터리 등 한국 주력 산업의 사업 전략도 수정이 불가피해졌다.◆현대·기아차 해외 공장 줄줄이 셧다운19일 현대차에 따르면 미국 앨라배마 공장에서 직원 1명이 코로나19 양성 반응을 보임에 따라 18일(현지시간) 공장 가동을 중단했다. 현대차 관계자는 “미국 방역당국과 협의해 재개 시점을 정할 예정”이라고 말했다. 생산 재개까지 얼마의 시간이 걸릴지 알 수 없는 상황이다. 앨라배마 공장에서 엔진을 공급받는 기아차 조지아 공장도 19일부터 가동을 멈췄다. 생산 차질에 소비심리까지 꽁꽁 얼어붙으면서 북미 사업에 타격이 불가피할 전망이다. 호세 무뇨스 현대차 글로벌 최고운영책임자 겸 북미권역본부장(사장)은 “코로나19로 많은 소비자가 대리점 방문을 꺼리고 있다”며 “지금 상태로 간다면 연간 판매가 10~20% 영향을 받을 것”이라고 말했다.미국 뿐만이 아니다. 현대차 체코공장과 기아차 슬로바키아 공장도 23일부터 2주간 문을 닫는다. 확진자가 발생한 것은 아니지만 코로나19 확산 방지를 위한 각국 정부의 방침에 동참하기 위해서다. 체코와 슬로바키아정부는 국가비상사태를 선포한 상태로 체코는 국경을 폐쇄했고, 슬로바키아는 국경 출입국 관리를 강화한 상태다. 유럽 국가간 국경 폐쇄로 인해 부품조달에 차질이 생기는 상황도 고려했다고 회사측은 설명했다. 현재 독일 폭스바겐과 다임러, BMW 등 유럽 자동차 업체들도 공장 가동을 2~3주간 멈추기로 했다. 유럽 전기자동차 업체를 공략하기 위해 동유럽에 배터리 생산기지를 세운 SK이노베이션(헝가리), 삼성SDI(헝가리), LG화학(폴란드)도 물류 대란을 우려하고 있다. 국경 통제가 강화되면서 독일~폴란드의 국경을 통과하려는 물류 트럭의 줄이 65㎞ 이상 이어지는 상황도 연출됐다.◆공급 체인 붕괴 위기도글로벌 공급 체인도 무너질 위기다. 반도체 식각장비 세계 1위 기업인 램리서치는 지난 17일부터 미국 샌프란시스코에 있는 공장을 셧다운했다. 정부가 코로나19 확산 방지를 위해 자택 대피 명령을 내리면서다. 이들의 최대 고객사인 삼성전자와 SK하이닉스는 당장 제품을 납품받을 수 없게 됐다. 다급해진 미국 장비 회사들은 정부에 “고객사로의 납품 일정이 급한 만큼 공장 가동을 허용해 달라”고 요청한 것으로 알려졌다. 삼성전자의 ‘파운드리(반도체 수탁생산) 세계 1등’ 전략에도 제동이 걸렸다. 세계에서 유일하게 반도체용 극자외선(EUV) 노광장비를 생산하는 ASML은 네덜란드 회사다. 삼성전자 파운드리 부문이 반도체 회로 선폭을 3~5나노미터(㎚·1㎚=10억분의 1m) 수준까지 미세화하려면 EUV 노광장비가 필수적이다. 이 장비는 설치 및 안정화 과정이 까다롭기 때문에 네덜란드 본사 직원들이 한국으로 파견을 나와야 한다. 하지만 유럽 감염자가 속출하면서 이들 직원의 출장길이 사실상 막혔다. 카메라를 통해 화상으로 원격 조종을 하기도 하지만 역부족이다. 삼성전자는 매일 장비업체들과 대책회의를 하는 것으로 알려졌다. 반도체업계 관계자는 “코로나19 사태가 장기화하면 삼성전자가 경기 화성사업장에 구축하고 있는 EUV 전용라인의 안정화가 늦어질 수밖에 없다”고 설명했다. ◆자가격리 피하려 전세기 운항도기업들은 생존을 위한 ‘각자도생’에 나섰다. LG디스플레이는 중국 광저우 공장에 한국 연구원과 엔지니어 100여 명을 급파하기 위해 26일 전세기를 띄우는 방안을 중국 정부와 논의 중이다. 광저우 유기발광다이오드(OLED) 공장 양산을 더 이상 늦출 수 없다고 판단해서다. 한국에서 코로나19 음성판정서를 받은 직원은 현지에 도착해 2주의 격리 기간을 거치지 않고 바로 현업에 투입될 수 있도록 하기 위해 전세기를 띄우는 방안을 고안했다. LG디스플레이는 지난해 8월로 예정됐던 광저우 OLED 공장 양산 시점을 기술적인 문제로 올해 1분기까지 미룬 상태다. 하지만 코로나19로 조업에 차질을 빚으면서 양산 시점이 2분기로 또다시 늦춰질 가능성이 크다. 고재연
기자
yeon@hankyung.com▶ ▶
 ▶
ⓒ 한국경제 & , 무단전재 및 재배포 금지",/news/news_read.nhn?article_id=0004309428&office_id=015&mode=search&query=기아차&page=2
,"[5시뉴스]미국 판매 물량의 절반 이상을 생산하고 있는 현대차 미국 앨라배마 공장에서 직원 1명이 코로나 19 확진 판정을 받아 현지 시간 18일 가동을 중단했습니다.현대차는 공장 전체에 방역 작업을 실시했으며, 미국 보건 당국과 공장 재개 시점을 협의할 예정이라고 밝혔습니다. 앨라배마 공장이 멈추면서, 여기서 엔진을 공급받는 기아차 조지아 공장도 현지 시간 19일부터 가동을 중단할 예정입니다.조윤정 기자 (cyjung@imbc.com)[저작권자(c) MBC (https://imnews.imbc.com) 무단복제-재배포 금지]Copyright(c) Since 1996, & All rights reserved.",/news/news_read.nhn?article_id=0001024125&office_id=214&mode=search&query=기아차&page=2
■현대차 주총전동화 車 등 새 사업목적 추가실탄확보 위한 원가개선 추진도,"[서울경제] 정의선 현대차 총괄수석부회장이 대표이사와 이사회 의장을 겸직하며 경영 보폭이 한층 커질 것으로 전망된다. 재계에서는 ‘정의선 체제’로의 전환이 가속화하며 사실상 세대교체의 마무리 수순이라는 분석도 내놓는다. 정 수석부회장은 2018년 9월 현대차 부회장에서 현대차그룹 수석부회장으로 승진했고 지난해 주총에서 현대차와 현대모비스 대표이사로 선임된 뒤 사실상 그룹 경영을 진두지휘하고 있다. 정 수석부회장이 제시한 ‘미래 모빌리티 솔루션 기업’의 비전에 따라 현대차그룹의 변신도 속도가 붙을 것으로 보인다. 애초 업계에서는 정 수석부회장이 아닌 이원희 현대차 사장이나 사외이사 중 한 명이 의장을 맡을 수 있다는 관측이 나왔다. 삼성전자·SK이노베이션 등 주요 대기업들이 이사회의 독립성 보장 차원에서 사외이사를 의장으로 추대하는 모습을 보였기 때문이다. 그러나 정 수석부회장은 최근 신종 코로나바이러스 감염증(코로나19)로 대내외 경영환경이 급속히 악화하자 의장직을 맡기로 결심을 굳힌 것으로 전해졌다. 현대·기아차는 코로나19 여파로 올 2월 국내 공장 생산 차질, 중국 판매 실적 90% 이상 급감이라는 전례 없는 상황을 겪었다. 여기에 미국·유럽 공장까지 멈춰 서게 됐다. 현대차그룹은 생산과 수요가 모두 감소하는 전대미문의 위기를 ‘정의선 책임경영 체제’로 벗어난다는 계획이다.여기에 위기 이후도 고려됐다. 내연기관 중심의 자동차산업이 위기 이후 빠르게 미래차로 전환할 것이라는 전망에 따라 과감한 투자와 의사결정이 필요하다는 게 현대차의 판단이다. 위기 대응을 위한 신속한 조치, 미래차 사업 주도권을 쥐기 위한 과감한 투자를 맡을 적임자로 정 수석부회장이 등판한 것이다. 현대차 관계자는 “실질적으로 그룹을 이끄는 정 수석부회장이 이사회 의장이 된 만큼 이사회 안건과 운영에 대한 높은 이해도를 바탕으로 업무 집행 효율성이 제고될 것으로 기대하고 있다”고 말했다.정 수석부회장이 이끌고 있는 스마트 모빌리티 솔루션 전략도 한층 속도를 낼 것으로 전망된다. 이날 열린 현대차 주주총회에서는 이를 뒷받침하기 위한 정관상 사업 목적 변경과 신설 안건이 통과됐다. 현대차는 정관상 사업 목적에 도심 항공기 등 미래 모빌리티 사업을 본격 추진하기 위해 ‘각종 차량’ 외에 ‘기타 이동수단’의 제조·판매를 추가했다. 아울러 수소차와 전기차 등 전동화 차량 사업과 도심 모빌리티 인프라 사업을 위한 ‘전동화 차량 등의 충전 사업’도 새 사업 목적에 추가했다.현대차는 미래 사업 추진을 위한 재원 마련을 위해 과감하고 근본적인 원가 개선도 추진한다. 현대차는 지역별 판매 모델 수를 줄이고 파워트레인을 공유하는 차종을 늘려 재료·투자비를 대폭 절감할 계획이다. 이날 주총에 참석한 이 사장은 “생산 체계의 유연성을 확보해 수익성 중심의 의사 결정이 이뤄질 수 있도록 하겠다”고 말했다. 또 현대차는 전동화 사업 강화와 모빌리티 서비스의 실행을 올해부터 본격화한다.이날 주총에서는 사내이사·사외이사 선임 안건도 모두 승인됐다. 김상현 현대차 재경본부장이 사내이사로 선임됐고 최은수 법무법인 대륙아주 고문변호사가 사외이사로 선임됐다. 최 변호사는 현대차의 감사위원회 위원도 맡는다./서종갑기자 gap@sedaily.com저작권자 ⓒ 서울경제, 무단 전재 및 재배포 금지",/news/news_read.nhn?article_id=0003712409&office_id=011&mode=search&query=기아차&page=2
,"[머니투데이 유영호 기자] 현대자동차그룹유영호 기자 yhryu@mt.co.kr
<저작권자 ⓒ '돈이 보이는 리얼타임 뉴스' 머니투데이, 무단전재 및 재배포 금지>",/news/news_read.nhn?article_id=0004379609&office_id=008&mode=search&query=기아차&page=2
폭스바겐·다임러·르노·BMW공장내 감염우려에 일시 폐쇄美자동차 '빅3'도 2주간 휴업현대·기아차 美공장도 셧다운생산차질로 매출 감소 불가피부품업체등 협력사 연쇄 타격,"코로나19 확산과 함께 전 세계 자동차 생산망이 급속도로 붕괴되고 있다.
 폭스바겐, 르노 등 유럽 자동차 제조공장들이 생산을 중단한 데 이어 포드, 제너럴모터스(GM), 피아트크라이슬러(FCA) 등 미국의 빅3 자동차업체도 미국 공장 가동을 중단키로 했다. 미국 현지에 진출한 현대차와 기아차 공장도 직원의 코로나19 확진 및 엔진 조달 문제 등으로 인해 셧다운(일시정지)에 들어가는 등 거의 모든 자동차 제조업체들이 코로나19의 블랙홀 속으로 빠져들고 있다.
 이에 따라 완성차는 물론 자동차부품을 공급하는 수많은 협력사들의 도미노 피해가 우려된다.
 ■유럽 이어 미국 자동차공장 중단
 19일 외신 및 관련업계에 따르면 유럽 자동차 생산공장들이 거의 모두 가동중단에 들어갔다. 기간은 짧게는 2주부터 길게는 무기한이다. 프랑스의 르노는 전국 12곳에 있는 모든 공장에서 생산을 중단한다. 생산 재개시점은 미정이다. 푸조, 시트로앵, DS, 오펠 등의 브랜드를 소유한 PSA그룹은 유럽 전역의 공장을 순차적으로 닫고 독일의 폭스바겐, 다임러, BMW도 유럽 내 모든 공장의 가동을 중단키로 했다.
 유럽에 이어 포드, GM, FCA 등 3대 미국 자동차업체도 앞으로 2주간 공장 가동을 중단키로 했다. 이 업체들은 북미자동차노조(UAW)와 이달 말까지 일시적 생산중단에 합의했다. 빅3 공장 가동중단으로 근로자 15만명이 일손을 놨다.
 포드는 미시간주 웨인의 조립공장 직원 1명이 코로나19 양성반응을 보여 19~30일 북미 3개국에서 생산을 중단하고 공장 소독에 들어간다. GM도 위생문제 우려 등으로 30일까지 공장 가동을 멈출 예정이다. 피아트크라이슬러도 북미 공장 가동을 적어도 이달 말까지 중단키로 했다.
 ■부품산업까지도미노 피해
 현대차는 미국 앨라배마 공장 직원이 코로나19 양성반응을 보여 바로 셧다운에 들어갔다. 현지시간 기준 18~19일 이틀간 공장 가동을 하지 못한다. 현대차 앨라배마 공장이 멈추면서 이곳으로부터 엔진을 공급받는 기아차 조지아 공장도 19일 함께 멈춘다. 그동안 기아차는 현대차로부터 K5, 쏘렌토의 엔진을 공급받았다. 현대·기아차 관계자는 ""현대차 공장은 방역조치를 즉각 취했다""면서 ""미국 방역당국과 협의해 재개 시점을 결정할 것""이라고 말했다.
 현대차 체코공장과 기아차 슬로바키아 공장도 오는 23일부터 4월 3일까지 2주간 가동 중단하기로 했다. 유럽내 코로나바이러스감염증19 확산에 따라 체코·슬로바키아 정부의 방침에 적극 동참하고, 직원들의 안전과 코로나19 확산 방지, 국경 폐쇄로 인한 물류 영향을 고려해 이같이 결정했다.
 이 같은 영향으로 현대·기아차 계열사와 협력사들의 연쇄 타격이 예상된다. 완성차업체는 계열·협력사들이 생산하는 부품을 실시간으로 받아 쓰는 직서열 생산방식을 채택하고 있기 때문이다.
 한 협력사 관계자는 ""한국의 경우에는 직원이 코로나19 확진이 되면 격리 및 방역 조치를 취한 후 공장이 가동됐지만 미국 등은 어떻게 대처할지 알 수 없어 추후 상황을 예의주시하고 있다""면서 ""생산차질로 인한 매출 감소와 자동차 소비심리 위축으로 인한 영향 등으로 회사 사정이 안 좋아질까봐 우려된다""고 말했다.


 ※ 저작권자 ⓒ 파이낸셜뉴스. 무단 전재-재배포 금지",/news/news_read.nhn?article_id=0004393205&office_id=014&mode=search&query=기아차&page=2
,"[속보] 현대·기아차 체코·슬로바키아 공장도 2주간 가동중단한다김동우 기자 love@kmib.co.krGoodNews paper ⓒ , 무단전재 및 재배포금지",/news/news_read.nhn?article_id=0001301485&office_id=005&mode=search&query=기아차&page=2
,"[머니투데이 유영호 기자]
현대·기아자동차가 코로나19 감염 확산 여파로 유럽 생산공장을 2주간 가동중단한다. 국경 폐쇄에 따른 물류 문제와 근로자 안전 확보를 위한 조치다.현대·기아차는 오는 23일(현지시간)부터 다음달 3일까지 현대차 체코 노소비체 공장과 기아차 슬로바키아 질리나 공장의 가동을 중단한다고 19일 밝혔다. 이번 가동중단 조치는 유럽 내 코로나19 감염 확산에 대한 체코 및 슬로바키아 정부 지침에 따른 것이다. 체코 정부는 코로나19
감염 확산을 방지하기 위해 국가비상사태를 선포하고 △국경 폐쇄 △국민 및 장기비자 소유자 외 입국 금지 △통근 등 주요 사유 외 전역 통행금지 △재택근무 시행 권고 △30명 이상 단체행사 전면 금지 △ 오후 8시 이후 식당 운영 금지 △체육관 등 다중이용시설 폐쇄 △교육기관 무기한 휴교 △위험국가 방문자 2주 격리 의무화 등 강도 높은
대책을 추진 중이다.슬로바키아 정부도 국가비상사태를 선포하고 △전 상점 운영 중단 △전 국경 출입국 관리 및 외국인 입국금지 △입국자 전원 2주 자가격리 △3개 국제공항 및 국제철도·버스 중단 △임시 휴교 등 코로나19 감염 확산 방지대책을 시행하고 있다. 현대차 관계자는 “직원들의 안전과 코로나19 확산 방지, 국경 폐쇄로 인한 물류 영향 등을 고려해 유럽 생산공장의 가동을 2주간 중단하기로 했다”고 말했다. 실제 유럽 자동차기업들은 생산공장이 속속 가동중단하고 있다. 메르세데스-벤츠 등의 브랜드를 보유한 독일 다임러AG는 18일 유럽 내 모든 생산공장 가동을 2주간 중지하기로 했다. 독일 BMW와 아우디폭스바겐도 유럽 공장 가동을 전면 중단했다.미국 포드는 독일 쾰른·자를루이 생산공장 가동을 중단했으며, 일본 토요타도 포르투갈·프랑스 등 유럽 공장을 2주간 폐쇄했다. 유영호 기자 yhryu@mt.co.kr
<저작권자 ⓒ '돈이 보이는 리얼타임 뉴스' 머니투데이, 무단전재 및 재배포 금지>",/news/news_read.nhn?article_id=0004379616&office_id=008&mode=search&query=기아차&page=2
"유럽이어 북미 車공장 올스톱현대·기아차 美공장 일시중단테슬라는 직원 4분의 1만 출근ILO ""최대 2400만명 실직위기""","◆ 글로벌 코로나 패닉 ◆
벤츠, BMW 등 유럽 자동차 기업에 이어 미국 제조업의 상징인 제네럴모터스(GM)와 포드마저 미국 공장 컨베이어 벨트를 멈춘다. 현대·기아자동차 미국 공장도 코로나19 방역 작업 여파로 가동이 일시 중단된다. 코로나19 확산에 따른 글로벌 수요 급감이 지속되면서 자동차 업계에 실업난을 비롯해 가시적인 연쇄 타격이 예상된다.19일(현지시간) GM과 포드는 자사 홈페이지에 이달 말까지 북미 공장 전체 가동을 중단한다고 발표했다. 포드는 이날 밤부터 오는 30일까지 미국·멕시코·캐나다 공장을 닫고, GM도 최소 30일까지 모든 북미 공장 문을 닫는다고 전했다.미국 자동차 산업의 미래인 테슬라도 코로나19 사태의 후폭풍을 비켜 가지 못했다. 테슬라 캘리포니아 공장은 지역정부의 이동 제한 명령 조치가 강화되면서 사실상 문을 열어도 직원들이 이동할 수 없는 처지가 됐다. 이와 관련해 일론 머스크 테슬라 최고경영자(CEO)는 지난 16일 임직원들에게 보낸 이메일을 통해 공장 가동이 계속될 것이라고 밝혔지만 ""조금이라도 아프거나 불편한 느낌이 든다면 일하러 오지 않아도 된다""는 단서를 붙였다. 일본 자동차 회사인 혼다의 북미법인도 오는 23일부터 엿새간 미국 공장 가동을 중단하고, 닛산은 20일부터 다음달 6일까지 미국 내 생산시설 가동을 일시 중단한다. 이에 앞서 유럽 자동차 업체들은 이미 작업을 중단했다. 프랑스 르노는 전국 12곳에 있는 모든 공장에서 생산을 중단했고 푸조, 시트로엥, DS, 오펠 등 브랜드를 소유한 푸조시트로엥그룹(PSA)은 유럽 전역 공장을 순차적으로 닫는다. 독일 폭스바겐도 스페인, 포르투갈 등 유럽 공장을 2~3주간 닫는다. CNBC방송에 따르면 투자사인 RBC캐피털마켓은 코로나19가 소비자 수요에 파급효과를 미쳐 올해 글로벌 자동차 생산량이 최대 16%까지 감소할 것으로 추정했다.
해외에 있는 한국 자동차 제조 업체들 충격도 크다. 현대자동차에 따르면 지난 18일 오전 10시 30분부터 미국 앨라배마 공장이 멈춰섰다. 공장 내 근로자 한 명이 코로나19 양성 반응을 보여 내린 조치다. 현대차 앨라배마 공장은 싼타페, 쏘나타, 아반떼 등 주력 차종을 생산하는 북미 생산기지다. 앨라배마 공장이 멈춰서면서 이곳에서 엔진을 공급받는 기아자동차 조지아 공장도 19일 문을 닫는다. 또한 현대자동차 그룹은 오는 23일부터 다음달 3일까지 2주간 현대차 체코공장과 기아차 슬로바키아 공장 가동을 중단한다. 그룹 측은 유럽 내 코로나19 확산에 따라 체코와 슬로바키아 정부의 방침에 적극 동참하고, 직원들의 안전과 국경 폐쇄로 인한 물류 영향 등을 고려한 조치라고 설명했다. 미국 루이지애나주에서 '에탄크래커(ECC)' 공장을 운영하고 있는 롯데케미칼도 공장 내 코로나19 확진자 발생을 막기 위한 비상 경영을 시작했다. 롯데케미칼은 2016년 루이지애나주 레이크찰스 지역에 연간 에틸렌 100만t을 생산하는 규모의 ECC 공장을 건설했고 지난해 5월부터 가동하고 있다. 국제노동기구(ILO)는 이날 각국 정부가 신속하게 고용 관련 대응을 시행하지 않으면 코로나19 여파로 실업자가 최소 530만명에서 최대 2470만명까지 증가할 수 있다고 전망했다.[이재철 기자 / 원호섭 기자 / 박윤구 기자] [ⓒ 매일경제 & mk.co.kr, 무단전재 및 재배포 금지]",/news/news_read.nhn?article_id=0004540188&office_id=009&mode=search&query=기아차&page=2
팬데믹에 확진 근로자 잇달아미국차 '빅3'·혼다 등 셧다운현대·기아차도 美 공장 중단공장 재가동 시기 늦춰질수도,"[서울경제] 신종 코로나바이러스 감염증(코로나19)이 미국과 유럽에서 빠르게 확산하면서 현대·기아자동차의 현지 공장들이 잇달아 공장가동을 중단하고 있다. 미국의
앨라배마 공장과
조지아 공장은 코로나19 감염자 발생으로 긴급하게 공장가동을 중단했으며, 다음주에 일시중단을 결정할 가능성이 높다. 유럽 체코의 현대차 공장과 슬로바키아의 기아차 공장도 다음주부터 2주간 공장을 세우기로 결정했다. 19일 업계에 따르면 현대차 미국 앨라배마 공장 직원 한 명이 코로나19 양성반응을 보여 18일(현지시간) 공장가동을 중단했다. 현대차는 미국 방역 당국과 협의해 재가동 시점을 정할 예정이지만 아직 날짜가 정해지지 않았다. 현대차 앨라배마 공장에서 세타엔진을 공급받아 차량을 생산하는 기아차의 조지아공장 역시 엔진수급에 차질을 빚으면서 가동을 멈췄다. 현대·기아차는 두 공장에 대해 다음주부터 일정 기간 가동을 중단하는 방안을 검토하고 있다. 업계 관계자는 “이르면 이번주 말부터 혹은 다음주 중에 공장을 일시 폐쇄하는 방안을 검토하고 있다”며 “재가동 시기는 미국 방역당국과 협의를 통해 결정될 것”이라고 말했다. 제너럴모터스(GM)·포드자동차·피아트크라이슬러 등 미국의 ‘빅3’ 자동차 회사들도 전미자동차노동조합(UAW)이 2주간 공장을 셧다운 하자고 제안한 것을 받아들여 공장 일시 폐쇄를 결정했다. 미국 현지에 진출한 혼다자동차 등 글로벌 자동차 회사들도 다음 주부터 6일간 공장을 폐쇄한다. 현지 공장 가동 중단과 수요위축이 동시에 진행돼 현대·기아차의 미국 실적도 타격이 불가피하다. 호세 무뇨스 현대차 글로벌 최고운영책임자(COO) 겸 북미권역본부장(사장)은 17일(현지시간) 미국 자동차 전문매체 오토모티브 뉴스와 팟캐스트 인터뷰에서 “아직 단언하기는 어렵지만 지금 상태로 간다면 연간 판매가 10%~20% 영향을 받을 것 같다”고 밝혔다. 최근 전 세계에서 코로나19 확산세가 가장 가파른 유럽의 현대차 체코공장과 기아차 슬로바키아 공장은 오는 23일부터 다음달 3일까지 2주간 가동을 중단하기로 했다. 체코와 슬로바키아 정부는 국가비상사태를 선포하고 국경 폐쇄, 상점운영 중단 등을 시행하고 있다. 현대·기아차 관계자는 “코로나19 확산방지를 위한 체코·슬로바키아 정부의 방침에 동참하고 국경 폐쇄로 인한 물류 영향을 고려한 결정”이라고 설명했다. 이외에도 독일 BMW는 “자동차 수요 급감이 예상된다”며 유럽과 남아프리카공화국 공장 가동을 일시 중단하기로 했고 폭스바겐과 메르세데스벤츠의 모기업인 다임러도 유럽 공장 가동 중지 방침을 밝혔다. 업계의 한 관계자는 “유럽의 경우 육로를 통해 부품을 공급받는데 유럽 전 지역이 코로나19로 사실상 마비 상태”라며 “단일 국가인 미국과 달리 유럽은 여러 국가가 국경을 맞대고 있기 때문에 국가별로 코로나19 상황이 달라 물류 정상화와 공장 재가동 시기가 더 늦춰질 가능성이 높다”고 전했다. /김민형기자 kmh204@sedaily.com저작권자 ⓒ 서울경제, 무단 전재 및 재배포 금지",/news/news_read.nhn?article_id=0003712431&office_id=011&mode=search&query=기아차&page=2
