head,text,url
한국GM·르노삼성·쌍용차도 내수 확대 절박시장 특성상 파이 확대 한계…경쟁 심화 전망,"현대자동차와 기아자동차가 신종 코로나바이러스 감염증(코로나19) 사태에 따른 해외 판매 부진을 만회하기 위해 국내 시장 집중 공략에 나섰다. 이는 국내 자동차 시장 경쟁 심화로 이어져 나머지 완성차 중견 3사에게는 심한 압박 요인이 될 전망이다.28일 업계에 따르면 현대·기아차는 국내에서 인기가 높아 대기수요가 몰린 차종들을 중심으로 생산량을 조정할 방침이다.구자용 현대차 IR담당 전무는 최근 열린 현대차 1분기 실적발표 컨퍼런스콜에서 “국내에서 GV80, G80, 그랜저, 팰리세이드 등 판매 호조 차량 생산을 늘려 수익성 증대를 꾀할 것”이라고 말했다.현대차는 기존 출시된 인기차종 외에도 이달 출시된 신형 아반떼도 좋은 반응을 얻으며 국내에서만 약 12만대의 미출고(대기) 물량을 보유하고 있다.정성국 기아차 IR담당 상무 역시 기아차 실적발표 컨퍼런스콜에서 “재고관리를 타이트하게 유지하며 수출을 조절하고, 아직 판매 호조를 유지하고 있는 내수를 늘리는 등 유연생산으로 대응할 것”이라고 말했다. 기아차는 국내에서 신형 K5와 K7, 쏘렌토, 모하비 등의 계약이 밀려있다.이같은 움직임은 코로나19 사태로 북미와 유럽 등 주요 자동차 시장에서 판매가 부진을 보인 데 따른 것이다. 현대·기아차는 3월 한국을 제외한 대부분의 지역에서 판매 감소를 보였으며, 4월 이후에도 부진이 불가피하다.현대차 관계자는 “코로나19 확산이 본격화된 3월은 글로벌 수요가 40% 이상 감소했고, 앞으로 더 악화될 여지도 있다”며 “미국과 유럽은 딜러들이 단축영업을 하고, 소매점은 영업을 중단한 상태”라고 말했다.해외 시장 자체가 침체된 상황에서 판매를 늘릴 도리가 없으니 상대적으로 양호한 국내 시장에 주력하겠다는 게 현대·기아차의 전략이다.산업통상자원부에 따르면, 3월 자동차 내수 판매는 17만2956대로 전년 동월 대비 10.1% 증가했다. 우리나라는 코로나19가 안정적으로 관리되며 소비심리 위축이 크지 않은 데다, 완성차 업체들을 중심으로 경쟁력 있는 신차 출시가 잇따른 가운데 정부가 개별소비세를 70% 인하해주면서 판매에 탄력을 받은 덕이다.개소세 인하는 6월까지 계속될 예정이라 당분간 국내 시장은 다른 주요 국가들에 비해 상대적으로 호조를 보일 가능성이 높다.문제는 국내 시장이 호조를 보이더라도 전체 규모가 늘어나는 데는 한계가 있다는 점이다. 국내 자동차 시장은 지난 5년간 180만대 내외에서 소폭의 증감을 보이며 정체 상태였다.인구가 한정돼 있고, 이미 자동차 보급률이 세계 최상위 수준에 도달한 국내 시장의 특성상 획기적인 수요 확대는 기대하기 힘들다. 고가의 내구재인 자동차를 세금이 싸다는 이유로 필요 이상으로 구매하는 데도 한계가 있다.이런 국내 시장에서 압도적 점유율을 가진 현대·기아차가 판매를 더 늘리겠다는 것은 나머지 완성차 3사를 긴장시킬 만한 소식이다. 완성차 업계 내에서 현대·기아차의 점유율은 80%를 상회한다. 수입차의 경우 메르세데스 벤츠, BMW, 아우디 등 고가 차종을 판매하는 독일 럭셔리 3사가 시장의 절반 이상을 점유하고 있어 완성차 업계와의 간섭은 크지 않다.한국GM과 르노삼성자동차, 쌍용자동차도 당장 내수시장에 목을 매야 하는 형편이다.한국GM은 주력 수출시장인 미국이 꽁꽁 얼어붙은 상태인데다, 트랙스, 스파크 등 기존 수출 차종들이 모델 노후화로 경쟁력을 잃고 있다. 신차 트레일블레이저는 미국 출시 시기조차 가늠할 수 없는 상황이다.르노삼성자동차 역시 기존 수출의 대부분을 차지했던 닛산 로그 수탁생산물량이 지난달로 계약 종료되면서 내수 시장에서 활로를 찾아야 하는 형편이다. 쌍용차는 애초에 내수 의존도가 높은 업체라 어떻게든 내수 시장에서 승부를 봐야 한다.하지만 현대·기아차의 공세에 대항할 만한 무기가 마땅치 않다. 한국GM은 트레일블레이저, 르노삼성은 XM3가 큰 인기를 끌고 있지만, 이들 외에 볼륨 차급에서 현대·기아차와 맞서볼 만한 경쟁력을 갖춘 차종이 없다.기아차가 쏘렌토 생산을 늘리면 르노삼성 QM6의 설 곳이 좁아진다. K5 생산 확대는 한국GM 말리부와 르노삼성 SM6에게 위협 요인이다.쌍용차는 올해 신차가 한 종도 없어 내수 시장에서 고전을 면치 못하고 있다. 3월 판매량에서도 완성차 5사 중 유일하게 마이너스 성장을 보였다. 코란도와 티볼리에 인포테인먼트 기술을 추가한 연식변경 모델로 맞서고 있지만 신차 효과를 내기엔 역부족이다.현대차 아반떼, 기아차 셀토스 물량이 시장에 본격적으로 풀리면 이들과 가격대가 겹치는 쌍용차 티볼리가 타격을 입을 공산이 크다. 기아차가 모하비 생산을 늘리고, 현대차가 ‘없어서 못 팔던’ 팰리세이드 물량을 수출보다 내수에 집중하면 쌍용차 G4 렉스턴에게 악재가 된다.업계 한 관계자는 “코로나19 사태에 따른 미국, 유럽 시장의 침체로 완성차 5사 모두 내수 시장에 매달려야 하는 절박함이 있지만, 우리나라와 같은 성숙시장(mature market)에서 파이 확대에는 한계가 있다”면서 “결국 완성차 5사가 치열한 경쟁에 내몰리게 됐다”고 말했다.데일리안 박영국 기자 (24pyk@dailian.co.kr)ⓒ (주)데일리안 - 무단전재, 변형, 무단배포 금지",/news/news_read.nhn?article_id=0002398723&office_id=119&mode=search&query=기아차&page=3
,"[서울신문]27일 광주 서구 기아자동차 제2공장의 출입문이 닫힌 모습. 코로나19 사태로 수출에 차질이 생기면서 기아차 제2공장은 다음달 8일까지 ‘셧다운’에 들어갔다.광주 연합뉴스▶
▶
▶ⓒ 서울신문(www.seoul.co.kr), 무단전재 및 재배포금지",/news/news_read.nhn?article_id=0003086061&office_id=081&mode=search&query=기아차&page=3
,"[서울=뉴시스] 박주연 기자 = 신종 코로나바이러스 감염증(코로나19)으로 전 세계 자동차공장 10곳 중 7곳이 멈춰섰다. 유가와 환율이 요동치고 실업자가 쏟아져 나오며 신흥국은 물론 선진국의 소비심리도 악화일로다. 코로나19 감염을 막기 위한 세계 각국의 조치로 전세계 판매망도 제대로 가동되지 못하고 있다. 바야흐로 '카마겟돈(Car-mageddon)'이다. 카마겟돈은 자동차(car)와 대혼란을 뜻하는 아마겟돈(armageddon)의 합성어다. 대혼란 국면에 처한 자동차 산업을 비유하는 말이다. 완성차업체들은 이같은 상황에 대처하고 코로나19 이후의 상황에 대비하기 위해 '고부가가치' 차량의 생산과 판매에 집중하고 있다. 전세계 생산시설이 마비되고 해외발 부품 부족으로 국내공장 가동도 원활치 않은 상황에서 수요가 살아있는 고급차량의 생산과 판매에 공을 들이겠다는 '생존전략'이다.28일 업계에 따르면 코로나19로 소비가 직격탄을 맞았지만 국내 백화점 명품 매장 매출이 증가하는 등 고가 브랜드들은 여전히 선전하고 있다. 소비욕구가 억눌리며 명품 소비로 이어지고 있다는 분석이다. 고가의 프리미엄 자동차에 대한 선호도 역시 지속적으로 높아지고 있다. 일각에서는 고급차 소비가 자신의 재력을 과시하는 '카-플렉스(Car-Flex)'라고 우려 섞인 목소리를 내고 있지만 소비자들의 프리미엄 자동차 선호도는 지속적으로 상승하고 있다. 코로나19로 생산 자체가 위축된 만큼 업계 역시 고부가가치 차량을 최대한 생산, 판매해 손실을 최소화하겠다는 계획이다. 현대차는 지난 23일 1분기 실적발표 콘퍼런스콜에서 코로나가 장기화하면 어떤 신차 판매전략을 추진할 것인가""라는 질문을 받고 ""비우호적 시장 상황에 대응하기 위해 고수익 모델 중심으로 생산, 수익성을 방어할 것""이라고 밝혔다. 현대차에 따르면 지난해 하반기부터 국내와 미국에 출시된 그랜저와 팰리세이드, 제네시스 GV80과 G80은 판매단가 대비 수익성이 높은 고부가모델로, 소비자들로부터 큰 인기를 얻고 있다. 현대차가 2015년 '제네시스(Genesis)'라는 이름으로 프리미엄 브랜드를 공식 출범했다. 제네시스가 선보인 G70, G80, G90 등 세 종류의 세단은 미국 시장조사업체 제이디파워(J.D.Power)의 신차품질조사에서 프리미엄 브랜드 부문 3년 연속 1위 및 전체 브랜드 2년 연속 1위를 달성하는 등 제품력을 인정받았다.지난달 30일 시장에 나온 신형 G80은 출시 하루 만에 2만2000대의 주문이 몰리며 프리미엄 세단 시장 경쟁에 불을 붙였다. 소비자들 사이에서는 ""지금 계약하면 내년에나 차를 받을 수 있다""는 말이 나올 정도로 대기물량이 밀렸다. G80은 최근 각종 시승기를 통해 E-클래스(메르세데스-벤츠), 5시리즈(BMW), A6(아우디) 등 독일 3사 프리미엄 세단과의 경쟁에서 밀리지 않는다는 호평을 받고 있다. 제네시스 최초의 SUV인 GV80는 시장의 큰 호응을 받으며 1만5000대 계약을 달성했다. 현대차는 지난 1월 제네시스 브랜드의 GV80을 올해 첫 출시 차량으로 낙점하면서 국내 프리미엄 SUV 시장을 정조준했다. GV80의 경쟁 모델로는 메르세데스-벤츠 GLE, BMW X5, 아우디 Q7 등이 꼽힌다. 디자인과 상품성, 가격 측면에서 경쟁력이 있다는 것이 업계 평가다. 현대차는 인도 프리미엄카 시장을 공략하기 위한 '프리미엄 사업부'라는 별도 전담팀을 최근 신설했다. 국내에서 일고 있는 프리미엄 열풍을 시장 잠재력이 큰 인도 등 해외 시장까지 그대로 이어가겠다는 의지다.기아자동차 역시 미국에서 인기를 얻고 있는 텔루라이드와 셀토스, 곧 투입을 앞둔 신형 쏘렌토 등 고수익 레저차량(RV) 차종 판매에 집중하고, 전방위적 딜러 지원으로 판매 차질을 최소화할 계획이다.기아차는 국내 시장에서 프리미엄 라인업을 월 구독형 프로그램으로 경험할 수 있는 '기아 플렉스(KIA FLEX) 프리미엄'을 운영하고 있다. 올해 트렌드 키워드로 꼽히고 있는 '스트리밍 라이프'에 착안한 '기아 플렉스'는 월 129만원에 기아차의 고급차 라인업인 K9, 스팅어, 카니발 하이리무진을 매월 1회씩 교체해 이용할 수 있다.기아차는 K9 셀렉션 구매 프로그램 '프리미엄 릴렉스'를 출시하며 프리미엄 전략을 이어가고 있다. K9 셀렉션 구매 시 특별 금리 혜택과 고급 안마의자 구독 서비스를 결합한 '프리미엄 릴렉스'는 총 36개월의 할부 기간에 1.0%의 특별 금리 혜택을 받을 수 있다. 할부금 납입 기간에 최고급 안마의자를 무료로 구독할 수 있고, 36개월 무상 에프터서비스도 받을 수 있다. 수입차들도 프리미엄 신차에 대한 공격적 마케팅에 나서고 있다. 한국이 코로나19 충격에서 상대적으로 자유로운 만큼 공격적 신차경쟁이 벌어지고 있다는 분석이다. 메르세데스-벤츠는 대형 SUV GLS의 출시 초읽기에 돌입했다. GLS는 지난해 공개된 3세대 풀체인지 모델로,
메르세데스-벤츠 SUV 라인업 중 가장 고급스러운 플래그십이다. BMW는 모터 스포츠 기술을 장착한 'M4 쿠페 컴페티션'을 출시하며 국내에서 65대 한정 판매하고 있으며, 미니는 최고출력 306마력의 고성능 라인 'MINI JCW 클럽맨'을 출시했다. 아우디 역시 4-도어 쿠페 '더 뉴 아우디 A7 55 TFSI 콰트로 프리미엄'을 지난달 국내시장에 내놨다.프리미엄 중고차 브랜드에도 소비자의 수요가 몰리고 있다. 코로나19 충격이 커져가는 가운데 고급 신차 가격이 부담스러운 젊은 층이 자연스럽게 중고차로 눈길을 돌리고 있다는 분석이다. 오토플러스가 2018년 선보인 '리본카(Re:BORN Car)'는 국내 최초로 온라인 스토어에서 24시간 중고차 거래 전 과정이 가능한 신개념의 비대면 서비스를 도입했으며, 자동차 구매부터 처분까지 전 과정을 책임진다. 리본카는 133개 주요 항목을 진단하고 수준 높은 복원 작업을 통과한 최상의 중고차만을 엄선해 판매한다.'출고 5년 미만, 주행거리 12만㎞ 미만, 무사고 차량' 중 엄선된 차량만이 특허받은 중고차 품질관리 프로세스 AQI133을 거쳐 판매된다는 것이 리본카 측의 설명이다. '리본카'는 최근 검색부터 결제 및 배송에 이르기까지 중고차 구매와 관련된 모든 과정을 온라인 비대면만으로 진행한 1호 고객을 국내 최초로 배출했다.업계 관계자는 ""최근 자동차 업계에 '프리미엄'와 '언택트' 바람이 불고 있다""며 ""'리본카'를 비롯한 주요 수입차 브랜드의 인증 중고차 등 한층 높아진 소비자의 품질에 대한 니즈를 충족시킬 수 있는 프리미엄 중고차 시장도 본격적인 성장세를 보일 것""이라고 전망했다. 또다른 관계자는 ""코로나19가 아니더라도 자율주행과 이를 기반으로 한 카셰어링이 일상이 되면 자동차에 대한 수요가 감소할 수 밖에 없다""며 ""이는 자동차업계가 고부가가치 차량에 집중할 수 밖에 없는 이유""라고 설명했다. pjy@newsis.com<ⓒ 공감언론 뉴시스통신사. 무단전재-재배포 금지>",/news/news_read.nhn?article_id=0009837044&office_id=003&mode=search&query=기아차&page=3
"30일부터 내달 어린이날까지 가동 중단코로나19 여파, 글로벌 수요 감소 대비 차원","(서울=뉴스1) 조재현 기자 = 쌍용자동차가 오는 30일부터 내달 5일까지 평택공장 가동 중단에 들어간다. 부처님 오신 날, 노동자의 날 휴일과 주말 등 징검다리 연휴를 활용해 수출량 감소에 대비하려는 조치다. 쌍용차는 평택공장 1, 3 생산라인이 5월4일 대체휴가를 사용해 휴업한다고 28일 밝혔다. 쌍용차는 노동조합과 5월 연휴 휴업과 관련한 논의를 거친 뒤 이같이 결정했다. 휴업은 생산현장만 적용된다. 신종 코로나바이러스 감염증(코로나19) 확산으로 글로벌 수요가 급감하자, 생산량 조절 차원에서 휴업에 들어가는 것이다.평택공장은 3개 생산라인 가운데 1·3라인이 가동 중이다. 2라인은 단종된 체어맨 생산라인이라 수년 째 운영하지 않고 있다.쌍용차는 4월 한 달간 유럽산 부품 공급에 차질에 따라 순환 휴업도 실시한 바 있다.쌍용차에 앞서 현대·기아차도 내달 4일 국내 모든 공장을 휴업하기로 했다. 르노삼성자동차는 어린이날 뒤에 사흘을 더 붙여 8일까지 가동 중단을 이어간다. 주말을 포함하면 11일부터 재가동에 들어가는 것이다. 한국지엠(GM)도 내달 4일 휴업 논의를 논의 중이다. 완성차 업계의 휴업은 코로나19의 전 세계적 확산에 따라 미국과 유럽을 포함한 주요 자동차 시장 판매가 급감한 데 따른 것이다. 특히 2분기부터 코로나19 여파가 본격화할 것이란 게 업계 분석이다. 자동차산업연합회에 따르면 이달 국산차의 수출 물량 전망치는 전년 동월 대비 43.1% 감소한 12만6589대다.cho84@news1.kr© 뉴스1코리아(), 무단 전재 및 재배포 금지",/news/news_read.nhn?article_id=0004610277&office_id=421&mode=search&query=기아차&page=3
,"[KBS 광주][앵커]기아차 광주공장이 지난 2월에 이어 또 일부 생산라인의 가동을 중단했습니다.코로나 19 확산에 따른 수출 부진 때문인데요.협력업체의 도미노 피해도 현실화하고 있습니다.최정민 기자입니다.[리포트]수출을 주력으로 하는 기아차 광주 2공장.어제부터 스포티지와 쏘울 등의 생산라인 가동이 멈춰섰습니다.해외 소비 부진으로 다음달 8일까지 생산을 중단했기 때문입니다.이번 휴무로 예상되는 생산 감소량은 5천4백여 대.지난 2월 가동중단으로 생긴 생산차질을 더하면 만 5천여 대가 넘습니다.신차 효과를 톡톡히 누리고 있는 셀토스 역시 다음달 초순까지만 부품 재고가 확보돼 피해는 더 늘어날 전망입니다.기아차 가동중단은 타이어 업체 등 250여 개 협력업체로 번지면서 도미노 피해가 나타나고 있습니다.[기아차 협력업체/음성변조 : ""궁극적으로 탁상공론이 아닌 중소기업에 실질적인 도움이 되면 좋겠습니다. 이미 예산이 고갈이 되고 다음 기회로 미루는 경향이 많습니다.""]실제 올 2분기 광주의 제조업 경기 전망은 1분기보다 15포인트 하락했고, 실적은 더 악화될 것으로 전망됐습니다.[이후형/광주상의 본부장 : ""고용감소가 이어질 수 있습니다. 이같은 고용감소는 가계소득에 영향을 미쳐서 소비가 위축될 수 있기 때문에 경기회복이 더욱어려워질 수 있습니다.""]코로나 19 확산이 둔화돼 소비심리가 조금씩 회복될 기미를 보이고는 있지만 기아차 가동 중단으로 지역경제에 미칠 파장이 자못 클 것으로 보입니다.KBS 뉴스 최정민입니다.최정민 기자 (cjmin@kbs.co.kr)",/news/news_read.nhn?article_id=0010826447&office_id=056&mode=search&query=기아차&page=3
"현대캐피탈아메리카, 대출 상환 유예 및 3년간 특별대출판매 재량 가진 딜러 지원포스크 코로나 판매량 회복 전략적 포석","[헤럴드경제 원호연 기자]현대차그룹이 신종 코로나바이러스 감염증(코로나19) 쇼크로 인한 판매 부진에 시달리고 있는 딜러들에 금융지원에 나섰다. 28일 현대차그룹에 따르면 현대캐피탈의 미국법인인 현대캐피탈아메리카(HCA)는 최근 미국 시장에서 현대차, 기아차, 제네시스를 판매하는 현지 딜러들에 금융지원을 시작했다.지원 내용은 딜러들이 시장에 판매할 차량을 매입하는데 필요한 단기자금 대출(플로어플랜)을 60일 간 상환 유예하는 것을 골자로 한다. 기존에 현대캐피탈 상품을 사용하던 딜러 중 매장 임대료나 직원 고용에 필요한 운영자금이 부족한 경우 3년 동안 특별 대출도 지원한다.업계 관계자는 ""현대차그룹이 주요 전략 시장인 북미 시장에서의 판매 감소를 막기 위해 계열 금융사를 활용해 딜러 지원에 나선 것으로 보인다""고 전했다. 이 관계자는 ""이번 지원을 받은 딜러들은 코로나19 종식 이후 자동차 판매량이 회복될 때 현대기아차를 우선적으로 고객들에게 권할 가능성이 높다""고 전했다.미국의 경우 딜러들이 개별 브랜드에 종속되지 않고 여러 개의 브랜드 자동차를 판매한다. 브랜드 별 판매량이 딜러의 재량에 따라 크게 달라져 각 사는 판매 인센티브 등으로 자사 차량 판매를 독려해 왔다.시장조사업체 IHS 마킷에 따르면 올해 세계 승용차 판매량은 지난해보다 22% 줄어든 7030만 대에 그칠 것으로 전망되고 있다. 특히 셧다운(일시적 공장 가동 중단)과 대량 실직으로 수요 절벽에 직면한 미국 시장의 경우 판매 감소폭이 26.6%에 달할 것으로 우려되고 있다.중국 시장 대신 북미시장의 비중을 늘려온 현대차그룹도 생산과 판매 전략에 비상등이 켜졌다. 미국 시장 판매량이 급감하면서 기아차의 경우 수출 인기 차종을 생산하는 국내 공장 가동까지 일부 중단된 상황이다.미국 내 딜러들이 현금이 모자라 폐업하거나 직원을 대거 해고할 경우 코로나19 종식 이후에도 판매 회복세가 더딜 것으로 우려됐다. 이번 딜러 지원책은 이에 대한 대응책 성격이 짙다.한편, 현대캐피탈아메리카는 현대차에 이어 소비자 지원 프로그램도 추가로 내놨다. 신차를 구매하는 고객들에게 최장 120일 간 이자 납부를 면제한다. 현대차와 제네시스 미국법인은 지난달 현대캐피탈을 통해 신차를 구매하거나 리스한 신규 고객 중 직장을 잃은 이들을 대상으로 최장 6개월 간 할부금을 면제한 바 있다.로스 윌리엄스 현대캐피탈아메리카 사장은 코로나19 지원책에 대해 ""현대캐피탈은 현재와 같은 불확실성이 지속되면 고객들이 (자동차 구매 등) 주요 소비를 주저한다는 점을 잘 알고 있다""고 말했다. 그러면서 ""우리는 이번 위기 동안 고객과 딜러들을 지원하는데 최선을 다할 것""이라고 밝혔다.1989년 현대차가 미국에 진출하는 과정에서 설립된 현대캐피탈아메리카는 지분 100%를 현대차 미국법인(HMA)가 소유하고 있다.
- Copyrights ⓒ 헤럴드경제 & heraldbiz.com, 무단 전재 및 재배포 금지 -",/news/news_read.nhn?article_id=0001667427&office_id=016&mode=search&query=기아차&page=3
,", , 등 자동차 업계가 오는 30일부터 내달 5일까지 이어지는 징검다리 연휴 기간에 조업을 중단키로 했다.28일 쌍용차에 따르면 쌍용차는 노동조합과 협의해 5월 4일 대체휴가를 사용키로 했다. 5월 1일은 노동절이기 때문에 조업을 쉰다. 따라서 4월 30일~5월 5일까지 생산을 중단하게 된다.다른 자동차 회사들도 4일을 휴무일로 지정해 6일 이상 연속으로 쉰다. 현대차와 기아차는 쌍용차와 마찬가지로 4일 모든 국내 공장을 휴업키로 했다. 르노삼성자동차는 다음주 금요일인 8일까지 조업을 쉬기로 했다. 한국GM도 4일을 휴무일로 지정하는 방안을 협의중이다.자동차 회사들의 휴업은 신종 코로나바이러스 감염증(코로나19)로 수출이 줄고 내수가 부진한 상황에서 조업일을 줄이겠다는 판단에서 나온 것이다.[조귀동 기자 cao@chosunbiz.com]	[]	[] 	chosunbiz.com",/news/news_read.nhn?article_id=0000516647&office_id=366&mode=search&query=기아차&page=3
