head,text,url
,"현대자동차의 고성능 브랜드 ‘N’이 지난달 26일 신제품을 선보였습니다.



그런데 자동차가 아니고 자전거랍니다. 고성능 자동차 회사가 자전거라니요. 얼핏 이해가 안 갈 수도 있지만, 자전거를 만든 자동차 회사는 현대차가 처음은 아닙니다. 알고 보면 현대차의 형제 회사인 기아차는 국내에서 가장 오래된 자전거 회사이기도 합니다.


 알버트 비어만 현대·기아차 연구개발본부장(사장)은 BMW 출신입니다. 고성능 브랜드 ‘M’의 연구소장을 7년이나 했던 사람이죠. 그가 현대차그룹에 합류한 뒤 현대차는 BMW처럼 고성능 브랜드를 만들었습니다.



이름은 ‘N’. BMW의 M과 정말 ‘한 끗 차이’입니다. 몇 가지 컬러가 겹쳐지는 듯한 로고 모양 역시 M과 비슷하죠. 기분 탓이겠지만요.




어쨌거나 N 출범 이후 현대차는 세계에서 가장 인기 있는 모터스포츠 중 하나인 월드랠리챔피언십(WRC)에 복귀했고, 지난해엔 숙원이던 제조사 부문 우승을 차지했습니다. 완성차 업체들이 미래 차 개발에 돈을 쓰느라 WRC에 참여하는 브랜드가 줄어들긴 했지만 어쨌든 대단한 일입니다.


현대차가 선보인 자전거는 고성능 브랜드 N을 달고 있습니다. 안타깝게도 N이 직접 만든 자전거는 아닙니다. 박경래 전 한국 양궁 국가대표팀 감독이 만든 ‘위아위스’ 라는 자전거 회사와 컬래버레이션(협업)을 한 것이라고 하네요.


위아위스는 양궁 활 제작 기술에서 터득한 그래핀 나노 카본 소재를 프레임에 적용했다고 합니다. 벨로스터N의 시그니처 컬러인 ‘퍼포먼스 블루’와 썩 잘 어울립니다. N자전거는 로드 바이크(도로용 자전거)인 '프로N'과 MTB(산악자전거) '헥시온N'의 2종류로 나오게 됩니다.


물론 N의 롤모델로 의심되는 BMW의 M도 자전거를 만듭니다.



 BMW는 ‘모토라드’라는 모터바이크를 만듭니다. 모토GP 같은 세계 최대 바이크 레이싱에도 참여하니 바이크를 만드는 데에도 일가견이 있는 회사죠.


BMW M은 일찍부터 자전거를 만들었습니다. 현대차의 N처럼 로드 바이크와 MTB를 만들고 M 자동차와 협업한 제품을 선보이기도 하죠. 도로용인 ‘크루즈 바이크’에는 일본의 고급 자전거 부품사인 시마노의 변속 시스템이 들어갑니다.



이밖에 좀 더 스포티한 느낌의 M-바이크, 전기 자전거인 액티브 하이브리드 E-바이크도 있습니다. 어린이용 자전거도 만드는데 이쯤 되면 BMW와 M이 자전거를 만드는 이유를 짐작할 만합니다. 결국 ‘라이프 스타일’이란 거죠.


아빠는 M머신을 몰고, 아기는 어린이용 바이크를 탑니다. 아기는 자라서 BMW 산악자전거를 ‘첫차’인 BMW 소형차에 싣고 주말을 즐깁니다. 이런 걸 꿈꾸는 것 같긴 한데, 가격은 글쎄요.




 물론 독일 럭셔리 자동차의 대표주자인 메르세데스-벤츠도 자전거를 만듭니다. 독일의 고급 자전거 브랜드인 포커스와 협업한 제품인데요. MTB와 로드 바이크, 레저용 피트니스 바이크까지 라인업도 다양합니다.


BMW에 M이 있다면 메르세데스-벤츠에는 고성능 브랜드 AMG가 있지요. AMG도 고성능 머신의 이미지를 담은 자전거를 내놨습니다. 역시 독일 고급 자전거 브랜드 로트빌트와 함께 만든 제품입니다.



노란색 메르세데스-AMG GT S와 썩 잘 어울립니다. 로트빌트 자전거라면 굳이 AMG 배지를 달지 않아도 자전거 매니어들에겐 신뢰감이 가겠네요.



 좀 예전이긴 하지만 아우디도 멋진 자전거 콘셉트카를 내놓은 적이 있습니다. 아우디는 e-트론이란 이름의 전기차를 올해부터 양산할 예정입니다. 2012년에 아우디가 내놓은 e-바이크는 날렵한 디자인의 전기 자전거입니다



아우디의 전신 ‘아우토 유니온’은 아우디·반더러·호르히·DKW 등 4개 회사가 합병해 만들어졌습니다. 전륜구동 자동차 기술로 유명했던 DKW가 모터바이크로도 유명했던 걸 생각하면 아우디와 자전거는 나름의 인연이 있는 셈입니다.


 위에 적은 것처럼 현대차그룹도 자전거와 인연이 깊습니다. 한국 대표 자전거 회사인 삼천리자전거의 모태는 1944년 설립된 경성정공입니다. 이후 기아산업으로 이름을 바꿨지요. 1952년부터는 자전거와 자동차를 모두 생산하다가 1985년 삼천리자전거공업으로 분사했습니다.



외환위기 이후 기아차가 현대차그룹에 편입되긴 했지만 기아차 홈페이지에는 아직도 설립년도를 경성정공이 만들어진 1944년으로 적고 있습니다. 기아차가 한국에서 가장 오래된 자전거 회사라고 해도 과언은 아닙니다.


 한때 삼천리자전거와 협업해 쏘나타·투싼·쏘울 같은 이름의 자전거를 판매하기도 했습니다. 오랜만에 현대차그룹이 내놓은 자전거는 여러 이유로 관심이 갑니다. 독일 럭셔리 자동차들이 그렇듯, 고객의 라이프스타일을 책임지고, 무엇보다 자전거는 ‘움직이는 기계장치’의 원형에 가깝다는 점에서 말입니다.


이동현 기자 offramp@joongang.co.kr
 ▶ ▶
/ ⓒ중앙일보(https://joongang.co.kr), 무단 전재 및 재배포 금지",/news/news_read.nhn?article_id=0002979857&office_id=025&mode=search&query=기아차&page=1
,"한국인 입국제한·격리 70여개국 속출…해외출장 사실상 원천봉쇄""현지법인 주재원도 감염자 취급…바이어들 만나기 꺼려해""(서울=연합뉴스) 업계팀 = 신종 코로나바이러스 감염증(코로나19) 사태 악화가 기업들의 해외영업에도 충격을 주고 있다.

한국인 입국을 제한하는 국가들이 속출하고 입국하더라도 격리 조치당하는 사례들이 속속 나와 사실상 해외출장이 원천봉쇄됐기 때문이다. 한국 여행경보 격상으로 외국 기업들의 한국 방문 역시 제한되고 있다.

 심지어 해외에 진출한 현지법인의 한국인 주재원들도 감염자 취급을 당하며 바이어로부터 외면받는 사례도 나온다.◇ ""입국에 성공해도 2주 격리""…기업들, 해외출장 줄줄이 취소

1일 업계에 따르면 기업들은 코로나19 사태 초기에는 감염 위험이 높은 중국으로 출장을 자제했지만, 최근에는 한국에서 확진자가 급증함에 따라 해외출장길 자체가 막혔다.

이에 따라 해외영업이 주된 업무인 종합상사업계가 가장 큰 타격을 받고 있다. 출장뿐만 아니라 해외 바이어 초청도 차단됨에 따라 당분간 신규 영업이 중단돼 기존 거래처만 유지되는 상황이다.

삼성물산은 중국 후베이성 출장을 금지한 데 이어 임직원의 해외 출장을 잠정적으로 제한했다. 불가피하게 출장을 가야 하는 경우에는 사전에 출장지 현지와 인사팀 합의를 거치고 내부 결재를 받아야 한다.

또한, 외부 고객 미팅은 가급적 줄이고 전화나 컨퍼런스콜 등을 활용하도록 했다.

LG상사는 국내외 위험지역은 출장을 금지하고 현지 주재원이 국내로 들어오는 것이나 해외 사업장 간 방문도 가급적 자제하도록 했다.

대형 종합상사 관계자는 ""입국제한이 아닌 국가라도 격리 조처되는 경우가 있어 해외 출장을 줄줄이 취소했다""며 ""통상 팀별로 월간 출장이 20여건 정도지만, 3월 출장 계획은 0으로 제출했다""고 말했다.

이 관계자는 ""유럽과 동남아 지역의 해외지사 주재원들도 현지에서 '코로나'라고 불리며 감염자 취급을 당하는 사례들도 보고되고 있다""며 ""현지 거래업체들이 뚜렷한 이유를 대지 않고 방문을 거절하는 분위기""라고 설명했다.

업계에서는 중국 못지않게 교류가 많은 베트남도 한국인 입국을 제한함에 따라 기업들의 해외영업 활동에 상당한 타격이 있을 것으로 우려하고 있다.

실제로 베트남 주재원 커뮤니티에서는 현지 모 기업이 안내한 한국인의 방문 사전 승인서에 '베트남 입국 후 14일 이내 당사 방문은 불가능하다'고 고지한 것이 공유되고 있다.

베트남 현지법인 관계자는 ""현재 입국자는 여행이건 출장이건 비자 종류에 상관없이 격리되고 있다""며 ""일부 한국 회사가 건강진단서와 노동비자만 있다면 출장이 가능하다며 출장을 종용한다는 얘기가 있는데, 격리될 뿐만 아니라 현지 기업들도 한국인의 방문을 거부하고 있다""고 말했다.

베트남에 스마트폰과 TV, 생활가전 생산공장을 운영하는 삼성전자는 입국제한 조치에 따른 단기적 영향은 없다고 밝혔다.

삼성전자 관계자는 ""신제품 생산을 위한 라인 설치도 완료된 상황""이라며 ""다만, 장기화한다면 영향이 없기는 어려울 것""이라고 말했다.◇ ""해외 바이어 만날 기회 차단""…국제 전시회들도 취소 잇따라

한국의 코로나19 확진자 증가세가 중국을 추월하면서 해외 기업들의 방한 일정들도 잇따라 취소되는 것으로 전해졌다.

더버지 등 미국 언론들은 구글과 아마존 등이 코로나19가 확산한 한국을 비롯해 이탈리아, 이란, 일본 등으로 출장을 제한하고 있다고 보도했다. 외신에 따르면 아마존은 직원들에게 보낸 이메일에서 4월 말까지 출장 미팅 일정을 잡지 않도록 했다.

국내 기업들이 해외 고객사와 공급 계약을 맺거나 투자를 유치하기 위해 국내로 초청해야 하지만 기회가 차단되면서 어려움을 겪고 있다.

익명을 요구한 대기업 관계자는 ""한국의 코로나19 사태 악화에 따른 비즈니스 차질이 속속 발생하고 있다""며 ""구체적 사례를 언급하기 곤란하지만, 비즈니스 미팅이 많이 취소되거나 연기됐다""고 말했다.

국내 대기업 직원들이 속속 확진자로 판정되거나 확진자와 밀접촉해 사업장을 폐쇄하는 사례가 늘고 있어 외국 기업들을 초청할 여력도 없는 실정이다.

한 철강업계 관계자는 ""회사 내부적으로 코로나19 감염을 막고 확산을 최소화하기 위해 국내외 출장을 가급적 제한하고 있지만, 그렇지 않다고 해도 해외 바이어들이 만나기를 꺼리는 상황""이라고 밝혔다.

현대·기아차 관계자는 ""해외 관련 업무는 화상회의나 서류 검토 방식으로 진행한다""고 말했다. 두산밥캣과 같이 미국에 주요 사업장이 있는 경우도 마찬가지 상황인 것으로 전해졌다.

다만, 화상회의나 컨퍼런스콜 등 비대면 회의로는 정상적인 영업활동이 불가능하다고 업계에서는 우려하고 있다.

타이어 업계 한 관계자는 ""새로 거래를 시작하는 경우에는 국내 공장을 확인하는 등의 절차가 필요한 데 지금은 그런 업무는 어렵다고 봐야 한다""며 ""대기업들은 당분간 버틸 수 있지만, 판로를 뚫어야 하는 중소기업들이 고충이 클 것""이라고 말했다.

아울러 코로나19가 전 세계적 유행으로 확산하면서 제네바모터쇼가 취소되는 등 해외 비즈니스가 타격을 받고 있다.

배터리 업계 관계자는 ""제네바모터쇼가 취소돼 배터리 회사들이 전기차 업체 바이어를 만날 기회도 사라지게 됐다""며 ""베이징모터쇼는 무기한 연기됐고 4월 2일 개막 예정인 국내 EV 트렌드 코리아에도 해외 참가 기업이 줄어들면 프로모션과 협력이 줄어들게 된다""고 우려했다.

중동과 동남아시아 등지에 현장이 많은 대형 건설사들은 당장 현장 운영에는 문제가 없지만 입국 금지 등 사태가 장기화할 경우 인력 수급 등에 애로를 겪을 것으로 예상했다.

한 대형 건설사 관계자는 ""현장 상황에 따라 시간이 지나면 추가 인력을 투입해야 하고, 현지 근무자들이 국내로 휴가도 나와야 한다""며 ""입국 문제가 장기화하면 인력을 보낼 수도 없고, 한 번 들어온 휴가자들도 언제 재입국이 가능할지 알 수 없으니 문제가 될 수 있다""고 말했다.

justdust@yna.co.kr",/news/news_read.nhn?article_id=0011438138&office_id=001&mode=search&query=기아차&page=1
,"유럽산 부품부족으로 생산차질 빚어질까…글로벌 판매부진 우려 신차 출시도 차질…개소세 70% 인하 효과에 작은 기대(서울=연합뉴스) 최윤정 김동규 기자 = 신종 코로나바이러스 감염증(코로나19)이 아시아를 넘어 중동, 유럽 등지로 퍼지면서 국내 자동차 업계에 긴장감이 더욱 고조되고 있다.

1일 업계에 따르면 코로나19가 세계적으로 확산하면서 자동차산업은 글로벌 생산차질과 판매감소 우려가 커지고 있다.

중국산 부품 한 개가 없어서 공장을 세웠던 국내 완성차 업체들이 유럽산 부품 때문에 생산을 중단하거나 해외 공장이 확진자 한 명으로 인해 멈추는 상황을 겪을 수 있다.

코로나19 사태가 계속되며 주요국 경기가 가라앉으면 자동차 업체들은 불과 몇달 전에 잡은 판매목표를 줄줄이 낮춰야 할 것으로 보인다.◇ 완성차 생산차질 이어져…중국산 부품부족에서 국내 직원 감염까지

 자동차산업은 코로나19 사태 초기부터 직접 피해를 입고 있다.

처음엔 중국 내 완성차 공장가동 중단이나 중국산 부품 공급부족으로 인한 국내 생산차질 정도였는데 이제는 직원 중에 확진자가 나와서 국내공장을 닫는 일이 벌어졌다.

지난달 국내 완성차 업체들은 중국산 와이어링 하니스(배선 뭉치) 부족으로 공장 라인 가동 속도를 늦추다가 며칠씩은 아예 세워버렸다.

대기가 몇달씩 밀린 팰리세이드, GV80 등 인기차종을 생산하는 현대차 울산2공장도 지난달 7일과 10일, 21일 문을 닫았다.

중국 내 부품공장들이 조업을 재개하며 상황이 마무리되나 했는데 곧 국내에서 일이 터졌다.

 한 부품업체가 코로나19 관련으로 가동을 중단하며 현대차 포터 생산도 하루 멈췄다.

이어 28일엔 현대차 울산 2공장이 직원이 코로나19 양성 확진을 받은 여파로 멈췄다.

완성차 공장에선 직원들이 컨베이어 벨트 앞에 나란히 서서 일하기 때문에 전염이 빠르게 발생할 수 있다.

또 와이어링 하니스 사례에서 봤듯이 수많은 부품 중에 하나라도 빠지면 생산이 불가능하다.

완성차와 부품사들이 서로 영향을 받아 멈추는 악순환이 벌어질 수 있는 구조다.◇ 유럽서 확진 증가…유럽산 부품 공급차질·해외공장 중단 우려

중국과 한국에 한정됐던 완성차 생산차질 우려는 이제 세계적인 문제가 되고 있다.

이탈리아 등 유럽에서도 코로나19 확진자가 빠르게 늘어나고 있기 때문이다.

 국내 완성차·부품 업체도 해외 공장이 문을 닫거나, 유럽 등지에서 생산하는 부품의 공급이 원활치 않을 가능성이 커졌다.

유럽 완성차업체들도 피해가 코 앞으로 다가왔다. 피아트 크라이슬러 등에 납품하는 자동차 부품업체 MTA는 이탈리아 롬바르디아에 있는 공장이 폐쇄됐다.

 중국 코로나 여파도 뒤늦게 나타나는 것으로 보인다. 그동안 쌓아둔 재고가 소진돼가고 중국에서 다시 가져오는 데는 여러 주가 걸리기 때문이다.

 덴소와 후지쓰의 스페인 공장이 16일부터 자동차 오디오 부품 조립 생산라인 가동을 중단할 계획이다. 중국산 부품 부족 때문이다.

이베스트증권 유지웅 애널리스트는 ""유럽산 전장 핵심부품 조달이 끊기면 와이어링 하니스 때 보다 파급이 훨씬 클 수 있다""며 ""현대·기아차 유럽 공장이 코로나 영향을 받을 가능성도 염두에 둬야한다""고 말했다.

그는 ""자동차 부품사 중에도 이탈리아 등 유럽에 공장이 있거나 유럽 매출이 많은 업체들이 타격을 입을 우려가 있다""고 덧붙였다.◇ 코로나19 세계경제에 충격…국내외 판매감소 전망

코로나19로 인해 세계 경기가 고꾸라지면 가뜩이나 감소세인 자동차 판매가 더 쪼그라들 수 있다.

중국에서는 지난달 중순까지 승용차 판매가 90% 이상 추락했다.

국내에도 확진자가 늘어나며 영업점을 찾는 발걸음이 뚝 끊겼다. 2일 발표될 완성차 업체들의 판매 실적이 상당히 저조할 것으로 전망된다.

그동안에는 국내에서 잠시 부진해도 유럽과 미국에서 만회하면 된다는 분위기였는데 이제는 어디도 영향을 피할 곳이 없어 보인다.

유럽은 당장 5일부터 개최 예정이던 제네바 국제 모터쇼가 취소될 정도다. 미디어 행사가 열리기 불과 사흘전에 내려진 결정이다.

 국내에서도 업체들이 신차를 내놓고도 대대적으로 홍보를 하지 못하고 있다.

르노삼성차는 3∼4일 예정했던 XM3 출시 관련 미디어 행사를 취소했다.

 현대·기아차와 제네시스도 쏘렌토, G80, 아반떼 신차 출시 행사를 두고 고심 중이다.

이항구 산업연구원 선임연구위원은 ""세계 자동차 판매가 올해 9천만대 아래로 떨어질 것으로 보이고, 이렇게 되면 현대기아차도 경쟁력 있는 신차가 줄줄이 나오는 '골든 사이클' 효과를 기대하기 어렵다""고 말했다.

이항구 위원은 ""5년 이상 어려운 시기를 지나온 부품업계는 추가 구조조정이 불가피할 것""이라며 ""중소기업은 영업이익률이 지난해 조금 개선돼서 2%대인데 올해는 마이너스인 경우가 수두룩할 것으로 예상된다""고 말했다.

그나마 국내 업체들은 승용차 개별소비세 70% 인하 조치에 작은 기대를 걸고 있다. 정부는 코로나19로 인한 내수 충격이 커지자 작년 말로 종료했던 개소세 인하를 다시 꺼냈다.

merciel@yna.co.kr dkkim@yna.co.kr",/news/news_read.nhn?article_id=0011438181&office_id=001&mode=search&query=기아차&page=1
,"코로나19가 아시아를 넘어 중동, 유럽 등지로 퍼지면서 국내 자동차 업계에 긴장감이 더욱 고조되고 있다.1일 자동차업계에 따르면 코로나19가 세계적으로 확산하면서 자동차산업은 글로벌 생산차질과 판매감소 우려가 커지고 있다.자동차산업은 코로나19 사태 초기부터 직접 피해를 입고 있다.처음엔 중국 내 완성차 공장가동 중단이나 중국산 부품 공급부족으로 인한 국내 생산차질 정도였는데 이제는 직원 중에 확진자가 나와서 국내공장을 닫는 일이 벌어졌다. 지난달 국내 완성차 업체들은 중국산 와이어링 하니스(배선 뭉치) 부족으로 공장 라인 가동 속도를 늦추다가 며칠씩은 아예 세워버렸다.대기가 몇달씩 밀린 팰리세이드, GV80 등 인기차종을 생산하는 현대차 울산2공장도 지난달 7일과 10일, 21일 문을 닫았다.중국 내 부품공장들이 조업을 재개하며 상황이 마무리되나 했는데 곧 국내에서 일이 터졌다. 한 부품업체가 코로나19 관련으로 가동을 중단하며 현대차 포터 생산도 하루 멈췄다.이어 28일엔 현대차 울산 2공장이 직원이 코로나19 양성 확진을 받은 여파로 멈췄다.중국과 한국에 한정됐던 완성차 생산차질 우려는 이제 세계적인 문제가 되고 있다.이탈리아 등 유럽에서도 코로나19 확진자가 빠르게 늘어나고 있기 때문이다. 국내 완성차·부품 업체도 해외 공장이 문을 닫거나, 유럽 등지에서 생산하는 부품의 공급이 원활치 않을 가능성이 커졌다.유럽 완성차업체들도 피해가 코 앞으로 다가왔다. 피아트 크라이슬러 등에 납품하는 자동차 부품업체 MTA는 이탈리아 롬바르디아에 있는 공장이 폐쇄됐다. 코로나19로 인해 세계 경기가 고꾸라지면 가뜩이나 감소세인 자동차 판매가 더 쪼그라들 수 있다.중국에서는 지난달 중순까지 승용차 판매가 90% 이상 추락했다.국내에도 확진자가 늘어나며 영업점을 찾는 발걸음이 뚝 끊겼다. 2일 발표될 완성차 업체들의 판매 실적이 상당히 저조할 것으로 전망된다.유럽은 당장 5일부터 개최 예정이던 제네바 국제 모터쇼가 취소될 정도다. 미디어 행사가 열리기 불과 사흘전에 내려진 결정이다. 국내에서도 업체들이 신차를 내놓고도 대대적으로 홍보를 하지 못하고 있다.르노삼성차는 3∼4일 예정했던 XM3 출시 관련 미디어 행사를 취소했다. 현대·기아차와 제네시스도 쏘렌토, G80, 아반떼 신차 출시 행사를 두고 고심 중이다.[디지털뉴스국] [ⓒ 매일경제 & mk.co.kr, 무단전재 및 재배포 금지]",/news/news_read.nhn?article_id=0004527367&office_id=009&mode=search&query=기아차&page=1
