head,text,url
"베스트 파트너 3인의 와우밴드 종목진단삼성바이오로직스, 美·中·유럽 등 해외거점 확대카카오, 은행·게임 등 자회사 성장세 '든든'","신종 코로나바이러스 감염증(코로나19) 사태로 1분기 실적이 기존 예상치를 밑돌 가능성이 높지만 과거 사례를 비춰 볼 때 고환율 효과에 힘입어 큰 폭으로 반등할 것이란 기대도 있다. 원·달러 환율이 달러당 10원 오를 때마다 매출 3000억원, 영업이익은 5%가 증가하는 것으로 추산된다. 기존 내연기관 차량에서 전기·수소차로 전환되는 시기인 만큼 이번 코로나19 사태 이후 업황이 크게 개선될 가능성이 높다. 최근 지수 변동성이 확대되면서 기아차도 한 달 새 50% 하락했지만 2만5000원대 주가는 저평가 구간에 해당하며 분할 매수 전략이 유효하다는 판단이다.삼성그룹 계열사로 국내외 제약회사의 의약품을 위탁 생산한다. 지난해 6월 말 기준 36만2000L 규모의 생산 설비를 가동하면서 세계 1위에 올랐다. 연구개발(R&D) 자회사인 삼성바이오에피스와 아키젠바이오텍은 바이오시밀러 개발 및 상업화를 진행 중이다. 수백 개의 경영혁신 셀 조직을 통해 품질·원가·스피드에서 경쟁력을 높인다는 전략이다. 기존 설비의 생산성을 이론 한계치까지 높이고 원가를 최적화함으로써 매출과 이익을 극대화할 계획이다. 삼성바이오로직스는 올해 미국 샌프란시스코 위탁개발(CDO) R&D 센터 건립을 시작으로 미국 유럽 중국 등으로 해외 거점도 확대할 예정이다. 올해 매출은 9000억원대, 영업이익은 1800억원대로 전망된다.코로나19 사태로 글로벌 경기 침체 우려가 높아지고 있다. 그럼에도 인터넷 업종은 오히려 수혜가 기대된다는 평가도 있다. 다만 광고 쪽 실적이 코로나19 영향으로 부진할 가능성이 점쳐진다. 카카오 톡비즈보드는 모바일 메신저 특성상 매출 타격이 크지 않을 것으로 예상된다. 카카오뱅크, 카카오페이, 카카오페이지, 카카오M, 카카오게임즈 등 주요 자회사의 성장 동력이 강하기 때문에 코로나19로 하락한 주가가 빠르게 회복될 것으로 판단한다. 한국경제TV ‘와우밴드’ 앱을 설치한 후 종목 상담을 신청하면 와우넷 주간수익률 베스트파트너가 자세한 종목 진단을 해 드립니다.▶ ▶
 ▶
ⓒ 한국경제 & , 무단전재 및 재배포 금지",/news/news_read.nhn?article_id=0004311160&office_id=015&mode=search&query=기아차&page=1
,"[디지털타임스 박정일 기자] 재계가 코로나19 비상체제를 '확산 방지'에서 '경제위기 대응'으로 전환하고 있다. 유럽과 미주의 상황 악화로 글로벌 경제위기 가능성이 높아지자, 이제는 기업 생존을 걱정해야 할 상황에 처했기 때문이다.재계는 특히 실적악화에 자금시장 위축까지 겹치면 유동성에 심각한 문제가 발생할 것을 우려하고 있다. ◇코로나19 '감염 방지'서 '글로벌 경제위기 대응'으로…재택근무 등 최소화= 22일 재계에 따르면 주요 기업들은 코로나19가 팬데믹(세계적 대유행) 상황으로 커지면서 재택근무 등 감염 확산 방지 조치를 최소한으로 유지하면서, 생산차질을 최소화 하는 방향으로 비상경영 체제를 전환하고 있다. 이는 미주와 유럽을 중심으로 한 글로벌 밸류체인에서 심각한 문제가 발생할 수 있다는 우려에서다. 실제로 현대차와 기아차는 코로나19 확진자가 나오면서 미국의 앨라배마와 조지아 공장의 생산을 18일부터 중단했으며, 체코 공장과 슬로바키아 공장은 23일부터 2주간 문을 닫는다.이에 따른 생산 차질을 최소화 하기 위해 현대·기아차는 지난달 27일부터 시작한 국내 현장의 자율 재택근무를 23일부터 중단하기로 했다. 다만, 코로나19 예방을 위해 출근 시간 범위를 오전 8∼10시에서 오전 8∼오후 1시로 넓히고, 필수근무시간(오전 10시∼오후 4시)을 없애는 확대된 유연근무로 전환한다.현대차는 부문별 협업을 강화해서 사업운영 차질을 예방하는 동시에 출퇴근 시간을 최대한 분산해서 직원 접촉을 최소화할 방침이라고 말했다. 코로나19로 자동차 산업이 직격탄을 맞아 비상이 걸린 가운데 효율성을 높여야 할 상황이라고 판단한 것으로 보인다. 현대·기아차는 코로나19 초기부터 종합상황실을 운영해왔다. 초기에는 중국발 부품 공급망 중심으로 대응했지만, 최근에는 미주와 유럽까지 권역별 상황을 파악해서 신속 대응해야 하는 실정이다.SK텔레콤도 지난달 24일부터 시작한 전 직원 재택근무를 23일부터 중단한다. 임신부 등 재택근무가 필요한 일부로 대상을 제한하는 자율적 재택근무로 전환한다. SK이노베이션은 31일까지 재택근무를 연장했지만, 책임자들과 필수 인력들은 정상 출근하고 있으며 재택근무자들도 근무시간을 연장하며 비상 상황에 대응하고 있다.SK하이닉스는 반도체업종 특성에 따라 재택근무를 하지 않았으며 코로나TF를 가동해 주6일 회의 체제를 운영하고 있다. 삼성, LG는 '전사 출근' 체제이지만 임산부나 면역이 취약한 직원들 위주로 재택근무가 이뤄지고 있다. 다만 양 사는 '코로나19 태스크포스(TF)'를 꾸려 전 세계 주요 사업장의 상황과 대응방안 등을 점검하고 있다. ◇회사채 위축 등 '돈 줄 막힐까' 노심초사…정부에 SOS도= 아울러 국내 기업들은 CP와 회사채 시장을 중심으로 신용경색 우려가 나와 자금상황도 긴급 점검에 들어갔다. 최근 CP금리가 치솟으면서 신용경색 조짐이 나타나자 금융위원회는 20일 국내 증권사들과 함께 CP시장 긴급 점검회의를 개최한 바 있다.익명을 요구한 모 대기업 자금 담당자는 ""CP시장 불안이 커지자 현금흐름이 좋은 기업들도 만약을 대비해 CP 발행 여건을 알아보는 태핑(사전 수요조사)에 나선다는 얘기들도 나온다""며 시장이 불안한 상황이라고 전했다.회사채 발행이 위축될 조짐을 보이자 정부는 19일 제1차 비상경제회의에서 채권시장안정펀드를 조성한다는 계획도 밝혔다. 홍남기 부총리는 브리핑에서 ""금융시장이 얼어붙으면 회사채와 주식을 발행해 자금을 조달해야 하는 기업이 돈을 구하지 못하는 '돈맥경화'가 나타난다""면서 ""어려운 시장 상황에서는 누군가 채권을 사서 돈을 순환시키는 역할이 필요하다""고 말했다.앞서 포스코그룹 계열사인 포스파워의 신용등급이 AA-로 우량하지만, 17일 기관투자자를 대상으로 진행한 수요예측에서 발행 목표액을 채우지 못했다. 코로나19 충격이 가장 큰 항공업계는 19일 국적 항공사들이 모여 경영자금 지원 건의안을 정부에 제출하기로 했다. 건의안에는 항공사가 자체 신용으로는 회사채를 발행하기 어렵기 때문에 국책은행의 지급 보증이 선행돼야 한다는 내용이 담겼다.◇이재용 등 총수들도 잰걸음…사기진작+대책회의 분주= 주요 그룹 총수들도 글로벌 경기침체 우려가 커지면서 발걸음이 빨라졌다. 이재용 삼성전자 부회장은 지난 19일 삼성디스플레이 아산사업장을 방문해 생산라인을 점검하고 핵심 투자 분야인 퀀텀닷(QD) 디스플레이 사업을 점검했다.이 부회장은 ""잠시도 멈추면 안 된다. 위기 이후를 내다보는 지혜가 필요하다""며 코로나19 위기 대응과 함께 새로운 성장동력 육성을 강조했다. 이 부회장은 앞서 지난 3일에도 경북 구미사업장을 찾아 스마트폰 생산라인을 점검하는 등 코로나19 사태에 따른 직원들의 동요를 막기 위해 동분서주하고 있다.정의선 현대차그룹 수석부회장과 최태원 SK그룹 회장, 구광모 LG 회장 등도 월례회의와 화상회의 등으로 계열사 별 코로나19 대응상황을 수시로 점검하고 있는 것으로 전해졌다. 아울러 코로나19 치료를 위해 회사 시설을 제공하고 자가격리 중인 임직원에게 건강용품과 응원편지를 보내는 등 직원들 사기 진작을 위해 각별히 신경쓰고 있다. 주요 그룹 총수들은 지난달 13일 서울 세종대로 대한상의에서 열린 '코로나19 경제계 대응 간담회'에도 참석해 문재인 대통령에게 적극적인 지원과 규제 개선 등을 건의했다. 박정일기자 comja77@dt.co.kr 디지털타임스
/",/news/news_read.nhn?article_id=0002589842&office_id=029&mode=search&query=기아차&page=1
,"코로나 19 확산에 따라 재택근무를 했던 대기업들이 글로벌 경제위기 대응을 위해 재택근무를 속속 중단하고 있습니다. 현대·기아차는 지난달 27일부터 시작한 자율 재택근무를 내일(23일)부터 중단하기로 했습니다. 현대차는 다만, 감염 예방을 위해 출근 시간 범위를 오전 8∼10시에서 오전 8∼오후 1시로 넓히고, 필수근무시간(오전 10시∼오후 4시)을 없애는 확대된 유연 근무를 하기로 했습니다. 현대,기아차는 지난 18일부터 미국 앨라바마와 조지아 공장의 생산을 중단한 데 이어 내일부터 2주간 체코공장과 슬로바키아 공장의 문도 닫는 등 해외 공장의 차질이 확대되고 있습니다.
SK텔레콤도 지난달 24일부터 시작한 전 직원 재택근무를 내일부터 중단합니다. 임신부 등 재택근무가 필요한 일부로 대상을 제한하는 자율적 재택근무로 전환하는 것입니다. SK텔레콤은 코로나19 국면의 장기화에 대비해 차별적 서비스 발굴 등을 위해 일부 인력의 재택근무를 중단한다고 밝혔습니다. 아울러 국내 기업들은 CP와 회사채 시장을 중심으로 신용경색 우려가 나와 자금상황도 긴급 점검에 들어갔습니다. 최근 CP 금리가 치솟으면서 신용경색 조짐이 나타나자 금융위원회는 20일 국내 증권사들과 함께 CP 시장 긴급 점검회의를 개최한 바 있습니다.[사진 출처 : 게티이미지]▶ ‘ 코로나19 확산 우려’ 최신 기사 보기http://news.kbs.co.kr/news/list.do?icd=19588▶ ‘코로나19 팩트체크’ 제대로 알아야 이긴다 바로가기http://news.kbs.co.kr/issue/IssueView.do?icd=19589▶ 우리동네에서 무슨일이? KBS지역뉴스 바로가기http://news.kbs.co.kr/local/main.do박대기 기자 (waiting@kbs.co.kr)",/news/news_read.nhn?article_id=0010807405&office_id=056&mode=search&query=기아차&page=1
현대·기아차 본사직원 재택근무 중단…'유연 근무'로 전환최근 미주·유럽 공장가동 중단 등 신속 대응 필요성 커져SK텔레콤도 1주일 간격 연장하던 재택근무 한 달 만에 중단,"[앵커]지난달 코로나19 사태 악화 초기 재택근무를 시작했던 대기업들이 한 달 만에 정상 출근을 재개하기로 했습니다.미주와 유럽에서 감염증이 걷잡을 수 없이 확산하면서 전 세계 경제위기가 깊어지자 대기업들의 비상경영 태세로, 적극적인 자세전환을 하는 모습입니다.이광엽 기자의 보도입니다.[기자]현대·기아차가 지난달 27일부터 시작한 재택근무를 한 달 만에 중단했습니다.이번 주부터는 출근 시간 범위를 넓히고 오전 10시부터 오후 4시까지였던 집중 근무시간을 없애는 '유연 근무'로 전환합니다.코로나19 초기에는 임직원의 안전과 중국발 자동차부품 공급 문제에 매달렸는데 최근에는 미주와 유럽 공장가동 중단 등 해외 상황에 신속 대응해야 하는 실정입니다.[이현섭 / 현대차그룹 팀장 : 출퇴근 시간을 좀 자유롭게 하고 동시간대 근무하는 집중근무 시간 제도를 없앰으로써 직원들 간의 접촉을 최소화 하도록 했습니다.]SK텔레콤도 그동안 1주일 간격으로 재택근무를 연장하다 한 달 만에 정상 출근으로 전환했습니다.SK지주나 다른 계열사들도 대부분 이번 달 안에 정상근무 체제로 돌아설 계획입니다.최태원 SK그룹 회장은 이번 주 초 계열사들이 참여하는 그룹경영 회의를 열고 경영위기 대응 방안을 논의할 예정입니다.삼성전자는 그동안 재택근무는 하지 않고 '코로나19 태스크포스'를 구성해 대응해 왔는데 해외의 반도체 장비 공급에 차질이 빚어지지 않을까 바짝 긴장하고 있습니다.유럽과 미국의 세계 3대 반도체 장비 제조사들이 코로나19 대유행으로 공장가동을 일부 중단하거나 재택근무로 전환하고 있기 때문입니다.이재용 삼성전자 부회장은 최근 삼성디스플레이 아산사업장을 찾아 예상치 못한 변수로 힘들겠지만 잠시도 멈추면 안 된다고 강조했습니다.산업계는 기업의 실적악화 현실화와 신용경색 조짐, 그리고 전 세계 경제위기에 따라 비상 대응 강도를 최고 수위로 높여 나갈 것으로 보입니다.YTN 이광엽[kyuplee@ytn.co.kr]입니다.[저작권자(c) YTN & YTN PLUS 무단전재 및 재배포 금지]",/news/news_read.nhn?article_id=0001418158&office_id=052&mode=search&query=기아차&page=1
,"국내외 완성차 업체들이 ‘신차 효과’에 큰 기대를 걸고 있다. 부품 수급과 공장 셧다운 등 코로나19 확산이 몰고온 위기 상황을 신차 판매를 통해 극복하겠다는 것이다. 다만 신차 출시가 판매량을 반짝 올려주는 임시방편에 그칠 수 있어 코로나19 사태 장기화에 제대로 대비해야 한다는 의견도 나온다.22일 국내차 업계를 보면 일단 현대·기아자동차가 신차 출시에 가장 공격적인 행보를 보이고 있다. 주력 모델이 될 신차들의 경우 기존 형식이 아닌 대대적인 온라인 홍보와 출시로 대체하고 있다.현대차는 오는 25일부터 사전계약에 돌입하는 준중형 세단 아반떼의 신형 모델을 지난 18일 공개했다. 마치 스포츠카와 같은 파격적인 디자인이 호평을 받고 있어 기대가 크다. 기아차가 지난 17일 출시한 스포츠유틸리티차량(SUV) 쏘렌토는 사전계약만 2만6000대를 넘기며 인기몰이 중이다. 이밖에 고급 브랜드인 제네시스는 오는 30일 대형 세단 G80을 온라인 출시한다.르노삼성자동차는 국내 첫 쿠페형 SUV로 이름을 알린 XM3가 흥행을 이어가고 있다. 지난 9일 출시한 XM3는 사전계약으로만 8542대를 팔았고, 이날 현재 판매량은 약 1만5000대를 기록했다. 한국지엠은 지난 1월 내놓은 SUV 트레일블레이저에 대한 기대가 크다. 한국GM이 직접 개발부터 생산까지 도맡아 글로벌 신차로 출시했는데, 현재까지 사전계약만 6000대를 넘은 것으로 알려졌다.수입차 업계도 꾸준히 신차를 내놓고 있다. 폭스바겐은 이달 초 티구안 신형 모델을, BMW가 320i와 530e M 스포츠팩을 출시했다. 캐딜락은 지난 16일 대형 SUV인 XT6에 이어 상반기 2~3개의 신차를 추가로 출시할 계획이다.자동차 시장에서 얼어붙은 소비자의 구매심리를 그나마 자극할 수 있는 것은 결국 새 상품인 ‘신차’를 내놓은 것이다. 업계 한 관계자는 “최근 공개된 차량들은 출시와 함께 큰 관심을 받고 있으며, 실제 판매로도 이어지고 있다”며 “신차 출시가 코로나19로 주요 공장들이 멈추는 어려운 상황을 이겨내는데 도움을 줄 것”이라고 말했다.다만 신차 효과는 그 기간이 짧다는 게 한계다. 특히 경쟁 모델이 출시될 경우 일시적인 판매 증가 현상이 멈추는 경우도 많다. 이 관계자는 “생산에 차질을 줄 수 있는 해외 자동차 공장의 가동 여부와 주력시장의 상황을 예의주시하면서 비대면 마케팅을 강화하는 방안을 구상하고 있다”고 밝혔다.박구인 기자 captain@kmib.co.krGoodNews paper ⓒ , 무단전재 및 재배포금지",/news/news_read.nhn?article_id=0001302225&office_id=005&mode=search&query=기아차&page=1
현대·기아차는 재택근무 중단,"기업들이 신종 코로나바이러스 감염증(코로나19) 사태로 도입했던 재택근무를 속속 중단하고 있다. 그동안 임직원 안전과 국내 사업장 셧다운(일시 가동 중단) 방지를 최우선 순위에 두고 대응해왔지만, 글로벌 경제위기가 눈앞에 닥쳐오면서 재택근무로는 대처에 한계가 있다고 판단했기 때문이다.22일 산업계에 따르면 현대·기아자동차는 지난달 27일부터 시작한 자율 재택근무제를 23일부터 중단하기로 했다. 그 대신 코로나19 예방을 위해 출근시간 범위를 오전 8∼10시에서 오전 8시∼오후 1시로 넓힌다. 필수 근무시간(오전 10시~오후 4시)도 없애 근무시간을 유연하게 조정할 방침이다. 현대차 관계자는 “부문별 협업을 강화해 사업 운영 차질을 막는 동시에 출퇴근 시간을 최대한 분산해 직원 접촉을 최소화할 것”이라고 말했다.SK그룹은 핵심 계열사들이 어려운 상황에 처하자 위기 경영 체제를 강화하기로 했다. 최태원 회장은 이번주 초 주요 계열사가 참여하는 그룹 경영대책회의를 준비하도록 지시한 것으로 전해졌다. SK이노베이션은 국제 유가 폭락으로 원유 재고평가손실이 커지면서 1분기(1~3월)에 대규모 적자를 낼 가능성이 높아지자 바짝 긴장하고 있다. 배터리 부문도 글로벌 완성차 업체들의 생산 차질로 여건이 녹록지 않은 상황이다.삼성전자는 국내 사업장 안전을 중심에 뒀던 ‘코로나19 태스크포스(TF)’의 역할을 해외 사업장까지 확대하고 글로벌 경제위기 대응 방안도 마련 중인 것으로 알려졌다.최만수/홍윤정 기자 bebop@hankyung.com▶ ▶
 ▶
ⓒ 한국경제 & , 무단전재 및 재배포 금지",/news/news_read.nhn?article_id=0004311254&office_id=015&mode=search&query=기아차&page=1
"현대·기아차 본사직원 재택근무 중단…'유연 근무'로 전환최근 미주·유럽 공장가동 중단 등 신속 대응 필요성 커져SK텔레콤도 연장하던 재택근무 멈추고 '자율적 출근' 전환삼성전자, 해외 제조사의 반도체 장비 공급 차질 우려","[앵커]지난달 코로나19 사태 악화 초기 재택근무를 시작했던 대기업들이 한 달 만에 정상 출근을 재개하기로 했습니다.미주와 유럽에서 감염증이 걷잡을 수 없이 확산하면서 전 세계 경제위기가 깊어지자 대기업들의 비상경영 태세로, 적극적인 자세전환을 하는 모습입니다.이광엽 기자의 보도입니다.[기자]현대·기아차가 지난달 27일부터 시작한 재택근무를 한 달 만에 중단했습니다.이번 주부터는 출근 시간 범위를 넓히고 오전 10시부터 오후 4시까지였던 집중 근무시간을 없애는 '유연 근무'로 전환합니다.코로나19 초기에는 임직원의 안전과 중국발 자동차부품 공급 문제에 매달렸는데 최근에는 미주와 유럽 공장가동 중단 등 해외 상황에 신속 대응해야 하는 실정입니다.[이현섭 / 현대차그룹 팀장 : 출퇴근 시간을 좀 자유롭게 하고 동시간대 근무하는 집중근무 시간 제도를 없앰으로써 직원들 간의 접촉을 최소화 하도록 했습니다.]SK텔레콤도 그동안 1주일 간격으로 재택근무를 연장하다 한 달 만에 정상 출근으로 전환했습니다.SK지주나 다른 계열사들도 대부분 이번 달 안에 정상근무 체제로 돌아설 계획입니다.최태원 SK그룹 회장은 이번 주 초 계열사들이 참여하는 그룹경영 회의를 열고 경영위기 대응 방안을 논의할 예정입니다.삼성전자는 그동안 재택근무는 하지 않고 '코로나19 태스크포스'를 구성해 대응해 왔는데 해외의 반도체 장비 공급에 차질이 빚어지지 않을까 바짝 긴장하고 있습니다.유럽과 미국의 세계 3대 반도체 장비 제조사들이 코로나19 대유행으로 공장가동을 일부 중단하거나 재택근무로 전환하고 있기 때문입니다.이재용 삼성전자 부회장은 최근 삼성디스플레이 아산사업장을 찾아 예상치 못한 변수로 힘들겠지만 잠시도 멈추면 안 된다고 강조했습니다.산업계는 기업의 실적악화 현실화와 신용경색 조짐, 그리고 전 세계 경제위기에 따라 비상 대응 강도를 최고 수위로 높여 나갈 것으로 보입니다.YTN 이광엽[kyuplee@ytn.co.kr]입니다.[저작권자(c) YTN & YTN PLUS 무단전재 및 재배포 금지]",/news/news_read.nhn?article_id=0001418177&office_id=052&mode=search&query=기아차&page=1
