head,text,url
,"[머니투데이 한정수 기자] [[내일의 전략]]코스피지수가 이틀 연속 상승했다. 글로벌 증시의 변동성을 키운 국제유가가 반등하면서 긍정적인 영향을 미쳤다. 여기에 '한국판 뉴딜' 정책에 대한 기대감이 커진 점도 작용을 했다는 분석이다. 개인은 이날 오랜만에 순매도세를 보였다. 23일 코스피지수는 전 거래일 대비 18.58포인트(0.98%) 오른 1914.73으로 마감했다. 4거래일 만에 다시 1900선을 회복한 것이다. 지난 주 가파른 상승세를 보였던 코스피지수는 이번 주 들어 다소 지지부진한 흐름을 보였으나 이틀 연속으로 1% 안팎 오름세다. 개인 투자자들은 이날 168억원을 순매도했다. 외국인도 1054억원 매도 우위다. 이에 맞서 기관이 1003억원을 사들였다. 외국인 순매도액 규모가 상대적으로 줄어든 것이 지수에 긍정적인 영향을 주고 있다는 분석이다. 외국인은 지난 20일에는 4935억원을, 지난 21일에는 5296억원을 팔아치웠다. 그러나 전날 순매도액은 383억원에 그쳤다. 업종별로는 화학, 음식료품, 전기가스업 등이 3%대 강세를 보였다. 종이·목재, 보험, 운수창고, 유통업 등은 1%대 올랐다. 이 밖에 비금속광물, 건설업, 은행, 전기·전자 등은 소폭 하락했다. 시가총액 상위 10개 종목은 SK하이닉스, 현대차, 삼성SDI를 제외하고는 모두 올랐다. 삼성바이오로직스, NAVER가 3∼4%대 상승했다. 코로나19(COVID-19) 사태에도 역대 1분기 최대 실적을 낸 LG생활건강은 전 거래일보다 10만7000원(8%) 오른 144만4000원에 거래를 마쳤다. 코스닥지수도 전 거래일보다 8.63포인트(1.36%) 오른 643.79로 마감했다. 개인과 기관이 각각 465억원, 191억원을 순매수했다. 외국인은 331억원어치 팔았다.
업종별로는 인터넷, 소프트웨어, 통신서비스, 정보기기 등이 3∼5% 상승했다. 비금속, 건설 등이 하락세를 보였다. 코스닥 시가총액 상위 종목들 중에서는 셀트리온헬스케어, 에이치엘비, 씨젠이 소폭 하락했다. 나머지 종목들은 모두 상승했다. 특히 휴젤이 3%대 상승률을 보였다. 이날 서울 외환시장에서 원/달러 환율은 전 거래일 대비 2.5원 내린 1229.7원에 마감했다.코스피지수가 상승한 이유로는 국제유가 반등이 첫손에 꼽힌다. 도널드 트럼프 미국 대통령이 이란 함정들이 미 군함을 다시 도발할 경우 공격하라고 해군에 지시했다는 소식이 반등의 촉매가 됐다는 분석이다. 또 한국 1분기 실질 국내총생산(GDP) 증가율이 -1.4%였다는 것도 영향을 미쳤다. 2008년 글로벌 금융위기 이후 최저치이지만 이미 관련 충격이 증시에 충분히 반영돼 있는 만큼 부정적인 영향은 제한적이었다는 설명이다. 예상했던 것보다는 양호했다는 의견까지 나온다. 여기에 더해 전날 정부가 대규모 경기부양책을 발표하고 자영업자 생존자금 지원 대책까지 발표한 것이 투자심리에 긍정적인 영향을 줬다. 이날 강세를 보인 전기가스, 화학, 운수창고 등은 전날 정부가 지원을 약속한 7대 기간산업에 포함된 업종이다.그러나 코스피지수가 계속해서 상승세를 이어갈지는 미지수다. 여전히 코로나19 사태에 따른 공포심리가 시장에서 제거되지 않았기 때문이다. 증권업계 전문가들은 당분간 조정이 이어질 가능성이 높다고 내다봤다. 이날 국내 증시는 1%대 상승세를 이어가다 일부 상승분을 반납했다. 이에 대해 서상영 키움증권 연구원은 ""국제유가의 변동성 우려가 여전하고 이날 저녁에 있을 유럽연합(EU) 정상회담에 대한 부담에 기인한 것으로 추정된다""고 설명했다. 이날 EU 정상회담에서는 코로나19 대응과 관련해 이미 원칙적으로 합의했단 5400억유로(약 718조원) 규모의 구제 대책안의 구체적인 지원 내용이 논의된다. 다만 구체적 합의에 이르기 어려울 수도 있다는 보도들이 속속 나오며 불안감이 커지고 있다. 한편 증권업계에서는 당분간 IT 관련 산업이 주목을 받을 수 있다는 전망이 나온다. 정부가 디지털 인프라, 빅데이터 분야 등에 대한 중요성을 강조하면서다. 이경민 대신증권 연구원은 ""글로벌 정책 뿐 아니라 한국의 정책을 살펴봐도 IT 중심의 장기 프로젝트가 만들어질 가능성이 있다""며 ""반도체, 인터넷, 2차전지를 중심으로 포트폴리오 중심을 잡아갈 필요가 있다""고 강조했다. 한정수 기자 jeongsuhan@mt.co.kr
<저작권자 ⓒ '돈이 보이는 리얼타임 뉴스' 머니투데이, 무단전재 및 재배포 금지>",/news/news_read.nhn?article_id=0004399327&office_id=008&mode=search&query=LG생활건강&page=1
,"LG생활건강이 신종 코로나바이러스 감염증(코로나19)에도 역대 1분기 최대 실적을 올렸다. 23일 LG생활건강에 따르면 올해 1분기 연결기준 매출은 1조8,964억원으로 전년 동기 대비 1.2% 증가했다. 영업이익은 3,337억원로 전년 동기 대비 3.6% 성장했다. 코로나19로 국내외 사업 환경이 급속도로 위축된 상황에서도 역대 최고의 1분기 매출과 영업이익을 기록한 것이다. LG생활건강 측은 “코로나19의 영향으로 중국 시장이 정상적으로 가동되지 못하는 상황에서도 화장품 사업은 럭셔리 브랜드들에 대한 견고한 수요에 힘입어 매출과 영업이익 감소의 충격을 최소화했다”고 밝혔다. 화장품 사업의 매출은 전년 동기 대비 6.4% 감소한 1조655억원에 그쳤다. 영업이익은 10.0% 감소한 2,215억원을 기록했다. 지난 2월부터 본격화된 코로나19의 여파로 국내외 화장품 시장 내 주요 채널의 매출이 급감했고, 중국인을 포함한 외국인 관광객의 현저한 감소로 면세점이 큰 타격을 받았던 게 실적 감소로 이어졌다.하지만 ‘숨’과 ‘오휘’의 초고가 라인이 높은 수요를 기반으로 성장했고, 더마화장품 ‘CNP’ 역시 13%의 매출 성장을 이뤄내며 실적에 견인했다. 코로나19로 위생용품 수요가 늘면서 HPC(생활용품) 사업은 성장했다. 매출은 전년 동기 대비 19.4% 증가한 4,793억원, 영업이익은 50.7% 오른 653억원을 달성했다. 음료 사업의 매출은 전년 대비 5.0% 성장한 3,505억원, 영업이익은 43.9% 성장한 468억원을 기록했다. LG생활건강 측은 “코로나19로 인해 극장 이용과 야외 활동 및 외식 등이 줄어 어려움이 있었으나 배달음식, 온라인 등의 채널에서 수요를 늘리며 매출을 성장시켰다”고 설명했다. 강은영 기자 kiss@hankookilbo.com",/news/news_read.nhn?article_id=0000490280&office_id=469&mode=search&query=LG생활건강&page=1
코스피·코스닥 2거래일 연속 오름세서프라이즈 실적에 네이버·LG생건 강세,"[서울경제] 코스피가 1% 가까운 상승세를 보이며 1,910선을 회복했다.23일 코스피는 전 거래일보다 0.98%(18.58포인트) 오른 1,914.73원에 거래를 마쳤다. 이날 코스피는 상승 출발하며 장중 내 1,920선을 돌파하기도 했다. 유가증권시장에서 개인과 외국인이 각각 168억원, 1,055억원 순매도했다. 기관이 홀로 1,003억원을 순매수했다. 특히 연기금이 987억원을 순매수하며 지수 하락을 방어했다. 시가총액 상위종목에서는 애초 컨센서스를 웃도는 1·4분기 성적표를 받은 (4.4%), (8%)이 큰 폭의 오름세를 보였다. 수주 실적 확대 소식에 (3.62%)는 상장 후 최고가를 다시 썼다. 반면 (-1.55%), (-0.22%), (-0.35%)는 소폭 하락했다.전일 발표된 정부의 적극적인 부양책과 국제 유가가 진정세로 돌아서며 투자 심리 회복을 도왔다는 분석이다. 노동길 NH투자증권 연구원은 “전일 정부의 부양정책, 유가 반등, 반도체 기업의 1·4분기 서프라이즈 실적의 영향으로 코스피가 상승했다”고 설명했다.한편 코스닥 지수는 전장보다 1.36%(8.63포인트) 오른 643.79로 마감했다. 이날 개인과 기관이 각각 458억원, 191억원을 순매수했다. 반면 외국인은 331억원을 순매도했다./이승배기자 bae@sedaily.com저작권자 ⓒ 서울경제, 무단 전재 및 재배포 금지",/news/news_read.nhn?article_id=0003728851&office_id=011&mode=search&query=LG생활건강&page=1
,"오늘(23일) 코스피가 이틀째 1% 가까이 상승하며 1,910선을 회복했습니다.이날 코스피는 전 거래일보다 18.58포인트(0.98%) 오른 1,914.73으로 마감했습니다.지수는 전 거래일보다 11.30포인트(0.60%) 오른 1,907.45로 출발해 강세 흐름을 유지했습니다. 장중 한때는 1,923.53까지 올라 1,920선을 넘어서기도 했습니다.연기금을 중심으로 한 기관 투자자의 매수세가 주가 회복을 이끈 가운데 외국인은 이날도 순매도를 기록했습니다.이날 유가증권시장에서 기관은 1천3억원(장 종료 전 잠정치)을 순매수했습니다. 특히 연기금은 987억원가량을 순매수하며 주가 상승을 이끌었습니다.반면 외국인은 이날도 1천55억원어치를 순매도하며 나흘째 '팔자'를 이어갔습니다.전날까지 3거래일 연속 순매수를 기록했던 개인도 이날 168억원을 팔아치우며 소폭의 순매도로 돌아섰습니다.서상영 키움증권 연구원은 ""코스피는 국제유가 반등에 힘입어 상승세를 나타냈으나 원유시장 변동성에 대한 우려는 여전한 상황""이라며 ""경제 회생 대책을 논의하는 유럽연합(EU) 정상회의를 앞두고 합의 실패 가능성이 제기된 점도 다소 부담으로 작용했다""고 분석했습니다.이날 유가증권시장의 거래량은 6억2천여만주였고 거래대금은 약 8조7천881억원으로 집계됐습니다.종목별로 보면 주가가 오른 종목은 674개였고 내린 종목은 183개였습니다. 46개 종목은 보합 마감했습니다.시가총액 상위 종목 가운데는 1분기 양호한 실적을 기록한 네이버(4.40%)와 LG생활건강(8.00%)이 나란히 강세를 보였습니다. 삼성바이오로직스(3.62%)와 LG화학(1.69%), 카카오(4.80%) 등도 올랐습니다.그러나 역시 이날 실적을 발표한 SK하이닉스(-1.55%)와 현대차(-0.22%)는 약세로 마무리했습니다.업종별로는 화학(3.47%), 음식료품(3.31%), 전기·가스(3.23%), 의약품(1.77%) 등이 강세를 보였고 건설(-1.16%), 은행(-0.23%), 전기·전자(-0.21%) 등은 약세였습니다.프로그램 매매는 차익거래는 매수 우위, 비차익거래는 매도 우위로 전체적으로는 1천690억원의 순매도로 집계됐습니다.코스닥지수는 전 거래일보다 8.63포인트(1.36%) 오른 643.79로 종료했습니다.지수는 4.97포인트(0.78%) 오른 640.13으로 개장해 상승 폭을 키웠습니다.코스닥시장에서는 개인이 458억원, 기관이 191억원을 각각 순매수했습니다. 외국인은 331억원을 순매도했습니다.시가총액 상위 종목 가운데는 펄어비스(2.45%), 스튜디오드래곤(1.76%), 휴젤(3.39%), 제넥신(4.19%) 등이 올랐고 에이치엘비(-1.12%), 씨젠(-3.43%) 등은 내렸습니다.코스닥시장의 거래량은 약 15억9천만주, 거래대금은 9조8천50억원가량으로 집계됐습니다.이날 서울 외환시장에서 원/달러 환율은 전일보다 2.5원 내린 달러당 1,229.7원에 거래를 마쳤습니다.[MBN 온라인뉴스팀]< Copyright ⓒ MBN(www.mbn.co.kr) 무단전재 및 재배포 금지 >",/news/news_read.nhn?article_id=0001447549&office_id=057&mode=search&query=LG생활건강&page=1
,"코로나 팬데믹으로 금융시장이 크게 출렁이는 상황에서 주식시장의 ‘양극화 현상’이 뚜렷해지고 있다. 코로나19 치료제를 비롯해 언택트(비대면) 비즈니스 등 새로운 트렌드에 편승한 기업들에선 신고가가 속출하는 반면, 실적 악화에 시달리는 항공·금융주 등과 경기 침체의 여파가 미친 부동산 리츠(REITs) 등은 부진을 면치 못하고 있다.최근 ‘코로나 백신’ 개발 경쟁이 뜨거워지면서 가장 두드러진 주가 회복세를 보인 건 제약·바이오주였다. 올 1분기 ‘어닝 서프라이즈’를 기록한 삼성바이오로직스는 삼성전자 우선주를 제치고 코스피 시장 시가총액 3위로 뛰어올랐다. 주가도 23일 60만원을 돌파하며 신고가를 경신했다. 코로나19 치료제 임상시험 계획 2상 승인을 받은 부광약품도 연초 1만4050원 수준이던 주가가 현재 2만8300원까지 치솟은 상태다. 코로나 사태가 되레 주가 상승의 호재로 작용한 것이다.사회적 거리두기 영향으로 정보기술(IT)과 재택근무 관련 종목도 급등세를 보였다. 1분기 영업이익이 전년 동기 대비 7.4% 증가한 네이버는 이날 19만원까지 오르며 신고가를 기록했다. 재택근무 관련주인 알서포트도 20.88% 급등한 6600원에 마감하며 사상 최고가를 경신했다. 간편 결제 및 온라인 쇼핑, 재택근무 등으로 인해 코로나19 시국에도 실적이 증가한 덕분이다. 화장품 및 소비재를 생산하는 LG생활건강도 60분기 연속 성장 기록을 이어가면서 8% 오른 144만4000원에 거래를 마쳤다.그러나 코로나 사태의 직격탄을 맞고 있는 항공·면세점·여행업 등은 부진의 늪을 쉽게 벗어나지 못하고 있다. 증권사들은 이들 업종의 목표 주가를 속속 낮춰 잡고 있다. 초저금리
추세에 공적 자금 역할까지 강화된 금융회사들도 최근 정부의 배당 자제 권고 등이 겹치며 주가 반등 동력이 낮아진 상태다.실물 경제가 위축되면서 안전 자산으로 평가되던 리츠 수익률도 하락세를 이어가고 있다. 현재 거래소에 상장된 리츠 7곳의 평균 손실률은 18%에 달한다. 이리츠코크렙과 NH프라임리츠의 경우 20% 넘는 하락폭을 기록했다. 코스피 지수가 지닌달 중순 대비 30% 넘게 오른 상황에서 배당을 무기로 한 리츠의 수익률은 훨씬 낮았던 셈이다.한편 국제 유가가 반등 흐름을 보이며 코스피는 18.58 포인트 오른 1914.73에 마감했다. 연기금이 987억원어치를 사들이며 1900선 탈환을 주도했다. 코스닥 지수도 1.36% 상승한 643.79로 종료했다.양민철 기자 listen@kmib.co.krGoodNews paper ⓒ , 무단전재 및 재배포금지",/news/news_read.nhn?article_id=0001314596&office_id=005&mode=search&query=LG생활건강&page=1
▶ 헉! 소리나는 스!토리 뉴스 [헉스]▶ '아는 척'하고 싶은 당신을 위한 [두유노우],"강력한 자외선차단효과(SPF지수) 높이기에 공을 들이던 1세대 자외선차단제를 지나 저자극 무기자차가 2세대 자외선차단제로 각광받았다. 올 봄에는 기초화장품과의 경계가 무너지면서 에센스 기능에 미세먼지, 블루라이트 등 유해환경으로부터 피부를 보호해주는 기능까지 이른바 '멀티' 자외선차단제가 대세를 이루고 있다.
 화장품 사용 단계를 최소화 시키는 '스킵케어' 트렌드에다가 이른바 '꾸안꾸'(꾸민듯 안꾸민듯 자연스러운)메이크업의 유행까지 더해지면서 '하나'로 기초케어부터 자외선차단, 간단한 메이크업까지 가능하게 됐다. 마스크로 피부도 갑갑함을 느낄 올 봄, 3세대 멀티 자외선차단제로 가볍게 외출준비에 나서 보는 것은 어떨까.
 LG생활건강 후에서 선보인 '공진향:설 미백 톤업선' 역시 멀티 기능을 갖춘 자외선차단제다. 이 제품은 뛰어난 톤업 효과로 화사한 피부를 연출해줄 뿐 아니라 외부 환경으로부터 피부를 보호해주는 멀티 기능까지 갖췄다. 화사한 핑크빛 크림이 피부톤을 자연스러운 복숭아빛으로 가꿔주고, 피지 케어 성분이 마무리를 보송하게 해줘 메이크업 베이스 겸용으로도 활용하기 좋다. 발림성이 좋아 매일 편하게 이용할 수 있으며 급히 외출할 일이 생겼을 때 이 제품 하나면 '퀵 메이크업'이 가능하다.
 장시간 마스크 착용으로 인한 피부 트러블이 염려된다면 '보타닉힐보 더마 디펜스 판테놀 선크림'을 추천한다. 비타민 B5 유도체인 판테놀은 수분을 결합시키는 성질이 있어 피부 속 수분을 강화하고, 피부 진정에도 효과적인 것으로 알려져 있다. 이때문에 판테놀은 지난해까지만 해도 스킨·로션 등 기초화장품과 유아동 보습크림에 주로 사용되던 성분이지만 이번엔 자외선차단제에 적용됐다. 이에따라 지치고 자극 받은 피부를 관리해주고 특히 여름철 자외선에 노출돼 민감해진 피부를 진정 시켜준다. 이 때문에 이 제품은 올리브영에서 출시된 지 한달 만에 매출이 3배 이상 늘어나는 기염을 토했다.
 센텔리안24의 '마데카 더마 쉴드 선 에센스' 역시 자외선 차단 기능과 기미·잡티 케어, 수분 공급 및 진정 효과를 동시에 선사하는 멀티 선케어 제품이다. 이 제품은 시원하고 수분감 가득한 워터드롭 에센스 타입으로 정제수 대신 동국제약 병풀추출물 61%를 담은 센텔라 더마 에센스를 함유해 기초 화장품과 같이 수분 공급 및 진정에 도움을 준다. 또한 발림성이 좋은 촉촉한 에센스 제형으로 기존 자외선 차단제 특유의 백탁이나 번들거림, 끈적임 없이 마치 스킨케어를 한 듯 산뜻한 마무리감을 느낄 수 있으며, 유분감이 있는 피부에서 선케어 효과가 지속되는 것도 장점이다.


 ※ 저작권자 ⓒ 파이낸셜뉴스. 무단 전재-재배포 금지",/news/news_read.nhn?article_id=0004413728&office_id=014&mode=search&query=LG생활건강&page=1
1분기 화장품 소폭 부진했지만생활용품 매출 19% 깜짝 성장하반기 소비심리·中 회복 더딜땐신기록 행진 멈출 수도,"[서울경제] 이 신종 코로나바이러스 감염증(코로나19)으로 국내외 사업 환경이 위축된 상황에서도 역대 1·4분기 중 최대 실적을 기록하며 또 한 번 ‘차석용 매직’을 이어갔다. 지난 2005년 차석용 부회장 취임 후 중국 한한령(한류제한령)에도 끄덕 없이 지속됐던 신기록 행진은 코로나19에 가로막혀 15년 만에 마침표를 찍을 것으로 예상됐다. 그러나 화장품 사업의 부진을 생활용품 사업이 뒷받침하면서 올 1·4분기 깜짝 실적을 기록했다. 다만 화장품이 전체 매출의 60%를 차지하는 만큼 하반기 국내 소비 회복과 중국 소비 반등이 이뤄지지 않을 경우 연간 실적 하락이 불가피할 것이라는 분석도 나온다.LG생활건강은 올 1·4분기 전년 같은 기간 대비 1.2% 증가한 1조8,964억원의 매출을 기록했다고
23일 밝혔다. 같은 기간 영업이익은 3,337억원으로 3.6% 성장했다. 2005년 이후 15년 연속 증가한 것은 물론, 역대 1·4분기 실적 중 최고치다.=코로나19 영향으로 화장품 사업이 쪼그라든 가운데 실적의 연속 상승을 지속할 수 있었던 것은 생활용품 사업이 큰 폭으로 성장했기 때문이다. 1·4분기 생활용품 사업의 매출은 전년 동기 대비 19.4% 증가한 4,793억원, 영업이익은 50.7% 성장한 653억원을 기록했다. 전체 매출에서 차지하는 비중도 지난해 21%에서 25%로 늘었다. 생활용품 사업이 성장한 것은 코로나19로 소비심리가 위축됐지만 반대로 위생용품의 수요는 급증했기 때문이다. 토탈 보디케어 브랜드 온더바디는 항균 손세정제 등의 인기로 전년 동기 대비 약 22%의 성장을 달성했다. LG생활건강 관계자는 “생활용품은 온라인 판매 비중이 높은데다 화장품과 달리 코로나19 수혜를 받아 매출이 크게 늘었다”며 “유통재고 축소와 고정비 효율화 등의 성과도 맞물리면서 영업이익도 높은 성장을 달성할 수 있었다”고 설명했다.=전체 매출의 60%를 차지하는 화장품 사업의 매출은 전년 동기 대비 6.4% 감소한 1조665억원을 기록하며 부진을 피하지 못했다. 영업이익도 10% 줄어든 2,215억원을 기록했다. 화장품 사업은 코로나19 여파로 국내외 매출이 급감했고 중국인을 포함한 외국인 관광객이 감소하면서 매출의 40%를 차지하는 면세점 채널이 큰 타격을 받았다. 이에 대표 브랜드인 ‘후’의 매출도 8% 가량 하락한 것으로 알려졌다. 다만 코로나 영향이 본격화하기 전인 1월부터 2월 중순까지는 견고한 성장세를 지속해 매출 감소 폭이 시장의 예상보다 작았다. 여기에 초고가 라인이 높은 수요를 기반으로 꾸준한 성장세를 보인 것도 타격을 최소화하는데 한 몫 했다. 숨과 오휘의 초고가 라인인 ‘로시크숨마’와 ‘더퍼스트’는 각각 13%, 52% 성장했다. =다만 코로나19 여파가 하반기까지 지속될 수 있다는 우려는 불안 요인으로 꼽힌다. 생활용품 부문으로 리스크를 축소하고 있지만, 비중이 작아 화장품 매출의 타격을 메우기는 역부족이기 때문이다. 이에 올 하반기 국내외 소비 회복이 이뤄지지 않으면 연간 이익이 2004년 이후 처음으로 후퇴할 수 있다는 전망도 나오고 있다. LG생활건강 측도 중국뿐만 아니라 전 세계적으로 상황이 악화되어 2·4분기 실적을 1·4분기보다 더 보수적으로 잡고 있는 것으로 알려졌다. 아울러 1·4분기 실적에 크게 기여한 음료사업도 야유회 등의 단체 행사 매출이 크기 때문에 2·4분기 이후에도 코로나 영향이 계속된다면 매출 하락이 불가피하다. 올 1·4분기 음료사업의 매출은 전년 동기 대비 5% 성장한 3,505억원, 영업이익은 43.9% 증가한 468억원을 기록했다. 코로나19로 인해 야외활동은 줄었지만 배달음식과 온라인 수요가 급증한 덕분이다. /박민주기자 parkmj@sedaily.com저작권자 ⓒ 서울경제, 무단 전재 및 재배포 금지",/news/news_read.nhn?article_id=0003728884&office_id=011&mode=search&query=LG생활건강&page=1
"외인, '현대차' 460억 원가량 순매도","[더팩트ㅣ박경현 기자] 23일 코스피는 국제유가 급등에 상승 마감했다. 오후들어 연기금이 순매수세로 전환하면서 코스피지수가 1910선을 회복했다. 이날 기관 홀로 995억 원을 사들이며 상승장으로 이끌었고 개인과 외국인은 각각 154억 원, 1059억 원을 순매도했다.외국인투자자 코스피시장 기업 최대매도는 현대차로 향했다. 외인은 이날 현대차 460억 원, 삼성전자 457억 원, SK하이닉스 446억 원, 삼성전기 194억 원, 엔씨소프트 163억 원 순으로 순매도했다.반면 LG생활건강은 696억 원 사들였다. 뒤를 이어 카카오 375억 원, 삼성바이오로직스 316억 원, S-Oil 116억 원, 삼성전자우 65억 원을 순매수했다.코스닥시장에서는 NHN한국사이버결제 (67억 원), KG이니시스(39억 원), 톱텍(32억 원)을 사들인 반면 메디톡스(114억 원), 셀트리온헬스케어(66억 원), 덕산네오룩스(44억 원) 팔아치웠다.코스피, 코스닥 시장 모두 매수포지션을 취했던 기관은 이날 SK하이닉스에 1076억 원을 순매도했다. 또 삼성SDI 99억 원, 아모레퍼시픽도 88억 원가량 팔았다.반면 네이버(NAVER)에 467억 원, 삼성전자 352억 원, LG화학 208억 원 순매수했다.이날 시가총액 상위종목에서 삼성전자는 보합세로 마친 가운데 SK하이닉스(-1.55%), 현대차(-0.22%), 삼성SDI(-0.35%)는 내렸다. 반면 삼성바이오로직스(+3.62%), 삼성전자우(+0.12%), NAVER(+4.40%), LG화학(+1.69%), LG생활건강(+8.00%)은 오름세로 장을 마쳤다.pkh@tf.co.kr저작권자 ⓒ 특종에 강한 더팩트 & tf.co.kr 무단 전재 및 재배포 금지",/news/news_read.nhn?article_id=0000023902&office_id=629&mode=search&query=LG생활건강&page=1
