head,text,url
,"26일 인터넷 기업 카카오 주가는 5일 연속 상승 마감했다. 25일에는 8.5% 폭등했다. 코로나 팬데믹(대유행)으로 국내외를 막론하고 전통 제조 기업이 파산 위기에 몰렸지만, 카카오 주가는 올 들어 76% 올랐다. 시가총액(주가에 주식 수를 곱한 기업 가치)은 23조5000억원으로 기아차·KT&G의 두 배 안팎이다. 코스피 9위로 일찌감치 포스코·신한지주·한국전력을 제쳤고, 글로벌 5위 자동차 메이커 현대차마저 창업 10년 남짓한 인터넷 기업에 밀려났다.최근 5개월 사이 한국 부(富)의 지형도 급격히 바뀌고 있다. 미국 포브스에 따르면, 카카오 창업자인 김범수 이사회 의장의 보유 자산은 6조4200억원으로 현대차그룹 정몽구 회장(3조8300억원)과 정의선 수석부회장(2조3500억원) 두 사람을 합친 것보다 많다.				4차 산업혁명이라는 거센 물결이 국가 경제·산업 전체를 전통 굴뚝 산업 위주에서 테크 산업 중심으로 바꾸는 흐름에, 비대면(非對面)을 부추긴 코로나 사태가 가속도를 붙여 버린 것이다.본지가 올 초와 5월 26일의 코스피 시총을 비교해보니 현대차·포스코·현대모비스가 10위 내에서 탈락했고, 카카오·삼성SDI·LG생활건강이 새로 진입했다. 현재 코스피 시총 10위 가운데 9사는 테크·바이오 관련 기업이다. 반도체(삼성전자·삼성전자우·하이닉스), 바이오(삼성바이오·셀트리온), 전기차 배터리(LG화학·삼성SDI), 인터넷(네이버·카카오) 기업이다. 다른 한 곳은 LG생활건강뿐이다.주가는 미래 기업 가치를 반영하는 지표다. 시총 변화는 차기(次期) 한국 경제·산업을 이끌 대표 주자의 세대교체를 의미한다. 미국 컨설팅 업체인 보스턴컨설팅그룹의 고광범 파트너는 ""그동안 재무제표에서 안 보이던 숫자들이 코로나 사태를 계기로 뚜렷하게 투자자 눈에 드러난 것""이라며 ""한국이 나아갈 새 경제·산업의 틀과 방향은 명확해졌다""고 말했다.				10년 사이 한국 증시를 이끄는 대표 기업의 세대교체가 이뤄졌다. 코스피 시가총액 상위 기업 명단이 싹 바뀐 것이다.현재 시총 톱10과 2010년 1월 4일을 비교하면 과거나 지금이나 1위인 삼성전자만 건재하다. 2~9위(포스코·현대차·KB금융·한국전력·신한지주·LG전자·현대모비스·LG디스플레이) 기업은 10년 사이 명단에서 사라졌다. 10위였던 LG화학 정도가 여전히 10위로 턱걸이하고 있다. 화학에서 전기차 배터리로 사업을 확장한 덕분에 그나마 살아남을 수 있었다. 한국 증시 시총 상위권을 테크·바이오 기업이 장악한 데 대해 전문가들은 ""이미 3~4년 전 테크 기업 중심으로 재편한 미국 경제·산업 구조를 한국이 따라가는 모양새""라고 분석한다. 4차 산업이라는 글로벌 변화 조류에 따른 것이란 설명이다.미국은 시총 1조달러(약 1234조원) 안팎의 애플·마이크로소프트·아마존·구글·페이스북 등 테크 공룡 '빅5'가 증시를 독식한 지 오래다. 미국 테크 기업은 최근 코로나 확산과 맞물려 버크셔해서웨이, 존슨앤드존슨, 월마트, 엑손모빌 등 수십 년간 증시를 장악했던 금융·유통·석유 기업과 격차를 더 벌리고 있다. 알리바바·텐센트가 주도하는 중국 증시도 상황은 마찬가지다.일부에선 '코로나가 부른 비(非)대면 열풍의 버블'이란 말도 나온다. 20년 전 정보기술(IT) 버블 때처럼 코로나가 지나가면 금융·여행·항공·에너지와 같은 경기에 따라 주가가 움직이는 기업이 다시 살아나고 비대면 관련 기업은 한풀 꺾일 것이란 시각이다.한국 증시에서 시총 변화는 한국 산업 지형 변화를 고스란히 반영하고 있다. 한국이 과거 철강·조선·자동차·전자 등 4대 제조업 강국에서 테크·바이오 주도의 4차 산업 경제로 바뀌는 것이다.지난 50여년간 한국 경제는 포스코·현대제철, 삼성중공업·대우조선해양, 현대차·기아차·쌍용차·대우차, 삼성전자·LG전자·대우전자 등 4대 제조업 기업이 이끌어왔다. 하지만 포스코(철강)와 현대차(자동차)마저 시총 톱10에서 빠지면서 이제 4대 제조업 기업은 한국 대표 기업의 명단에서 서서히 잊혀가고 있다. 삼성전자는 여전히 확고한 '넘버원'이지만, TV·세탁기·냉장고·스마트폰과 같은 전자제품 제조사를 넘어 4차 산업의 근간이 되는 메모리 반도체 기업으로 현재 가치를 인정받고 있다.이병태 카이스트 경영학과 교수는 ""4대 제조업은 미국에서 일본으로, 그리고 우리나라로 왔다가 다시 중국으로 옮겨가는 단계""라며 ""대규모 자본과 노동력 바탕의 산업은 비용이 낮은 중국으로 흘러갈 수밖에 없다""고 말했다. 4차 산업의 주요 분야에서 세계 최고 기술력으로 살아남는 게 앞으로 한국 경제의 과제라는 것이다.코로나 사태가 불러온 '비대면'은 단순히 온라인 수업과 화상 회의만 뜻하는 게 아니다. 국가 경제·산업 지형을 통째로 바꿀 수 있는 근본적인 변화라는 게 전문가들 시각이다. 온라인 쇼핑몰인 쿠팡이나 마켓컬리가 과거 유통 공룡이었던 신세계·이마트·롯데와 경쟁하고, 카카오뱅크·네이버페이가 시중 4대 은행의 입지를 흔들고 있다. 원격의료가 허용되면 치료받는 방식도 바뀐다. 예컨대 네이버는 올 7~8월쯤 원격의료가 허용된 일본에서 자회사 라인을 통해 스마트폰이나 PC에서 의사의 진료를 받는 서비스를 시작한다. 의사 2000여 명이 라인 원격의료에 참여할 것이란 일본 언론 보도도 나왔다.경제·산업 지형 변화로 이건희 삼성그룹 회장 이후로 한동안 없었던 '10조원대 자산가'도 등장했다. 포브스는 셀트리온 서정진 회장과 김정주 NXC 대표의 자산을 각각 10조8600억원과 10조7400억원으로 평가했다.한국의 부자 순위에는 김범수 카카오 의장(6조4200억원·5위), 권혁빈 스마일게이트홀딩스 의장(3조7000억원·9위), 김택진 엔씨소프트 대표(2조8400억원·11위), 방준혁 넷마블 의장(1조9800억원·15위), 이해진 네이버 글로벌투자책임자(1조9800억원·16위) 등 테크·바이오 분야의 창업자가 즐비하다. 대다수가 1년 전과 비교해 자산 평가액이 증가했다.반면 같은 기간 삼성그룹·현대차그룹·SK그룹의 오너인 이건희 회장, 이재용 부회장, 정몽구 회장, 정의선 부회장, 최태원 회장의 자산 평가액은 감소했다.[성호철 기자 sunghochul@chosun.com] [최인준 기자] 		▶
		▶ 		▶
	- Copyrights ⓒ 조선일보 & chosun.com, 무단 전재 및 재배포 금지 -",/news/news_read.nhn?article_id=0003534229&office_id=023&mode=search&query=LG생활건강&page=1
"협력사 금융 지원, 스마트 팩토리 구축 등 지원금융 지원 외에 경영, 교육 분야 지원도 지속 방침","[서울=뉴시스] 고은결 기자 = LG는 협력사의 신종 코로나바이러스 감염증(코로나19) 극복에 도움을 주기 위해 협력사 금융 지원, 스마트 팩토리 구축 등 지원을 진행 중이다.LG전자는 지난 2018년부터 국내외 협력사가 생산라인을 자동화하고 정보화 시스템을 구축할 수 있도록 지원해 왔다. 올해는 2차 협력사까지 지원 대상을 확대해 약 100개 협력사에 인공지능, 빅데이터 등을 활용해 스마트 팩토리 솔루션과 자동화 시스템을 구축하는데 지원한다.생산기술 전문가를 협력사에 파견해 노하우를 전수하고, 협력사 직원을 위해 신설한 로봇 자동화 교육과정을 통해 로봇 조작과 운영, 생산라인 적용사례 학습 등 맞춤형 실습교육을 제공한다.LG전자는 자금 운영에 어려움을 겪는 협력사들이 안정적으로 운영될 수 있도록 협력사 대상 무이자 대출 규모를 당초 400억원에서 550억원으로 확대했으며, 자금 지원 일정도 4개월을 앞당겨 협력사가 설비 투자, 부품 개발 등을 차질 없이 이어가며 경영 안정성을 높일 수 있도록 했다. 저금리 대출을 위한 2000억원 규모의 상생협력 펀드도 운영하고 있다.또 코로나19 영향으로 해외에 있는 협력사가 국내로 돌아오거나 국내 생산을 확대할 경우 생산성 향상을 위해 컨설팅, 무이자 자금 등을 지원하고 구매 물량을 보장키로 했다. 지금까지 국내외 협력사에 마스크 12만장과 손세정제 등을 전달하며 협력사가 긴박하게 필요로 하는 분야에 신속하게 지원을 이어가고 있다.
LG화학은 코로나 확산 장기화로 자금난을 겪고 있는 협력사를 대상으로 1000억원 규모의 상생 펀드 및 혁신성장 펀드 등 금융지원을 조기 집행한다. 코로나19 이슈로 긴급하게 자금이 필요한 협력업체들에 심사를 최대한 간소화하는 등 상반기 중 금융지원이 이뤄질 수 있도록 조치할 계획이다. 공익성 및 지속가능성이 높은 친환경 분야 사회적 창업·벤처기업을 발굴하고 성장을 돕기 위해 LG전자와 함께 ‘LG소셜캠퍼스’도 운영 중이다. 특히 여러 친환경 분야의 사회적 창업·벤처기업들이 성장기반을 다질 수 있도록 자금지원, 무이자 대출, 사무공간 대여, 인재육성 등의 프로그램을 운영하고 있다. 2011년 시작 이래 9년간 150여개 기업에 총 140억원을 지원하고 있다.LG생활건강은 코로나19 확산으로 운영에 어려움을 겪는 지역사회와 협력사, 가맹점 등을 돕기 위해 전방위 지원에 나섰다. 화장품 가맹점 500여곳의 한 달 치 월세의 50%를 본사에서 지원했다. 지원 대상은 LG생활건강이 운영중인 화장품 가맹점인 전국 네이처컬렉션, 더페이스샵 매장 등 약 500곳이다.아울러 LG생활건강은 협력사에 대한 운영 자금도 지원한다. 자금난을 겪고 있는 방문판매화장품대리점, 생활용품대리점, 음료대리점 등 전국 대리점의 직원 인건비도 일부 지원한다.LG이노텍은 코로나19로 어려움을 겪는 중소 협력사들을 위해 총 1,500억 규모의 상생 금융 지원에 나섰다. 먼저 협력회사 자금 지원을 위해 운용중인 630억원 규모의 동반성장펀드를 협력사들이 긴급히 활용할 수 있도록 4월부터 조기 집행하고, 거래규모, 신용도 등의 심사 기준 완화, 자금 지급 절차 간소화할 예정이다. 이와 함께 4월부터 2개월간 협력사에 약 850억원 규모의 납품 대금과 금형비도 조기 지급한다. 협력사들은 비용 마감 후 5일 이내 납품 대금을 현금으로 받을 수 있게 되어 현금 흐름 개선에 도움이 될 전망이다.상생 금융 지원 외에 협력사의 경쟁력 제고를 위해 기술, 경영, 교육 분야 지원도 지속해 나갈 방침으로 협력사와 생산∙기술 혁신과제를 함께 추진하고 경영컨설팅, 온∙오프라인 교육을 무상 지원한다. LG유플러스는 코로나19로 어려움을 겪고 있는 중소 협력회사와 소상공인 등을 위해 850억원 규모의 상생 지원책을 마련해 긴급 시행하고 있다. 먼저 협력회사 자금 지원을 위해 운용 중인 동반성장펀드를 기존보다 250억원을 늘린 750억원으로 확대했다.또 자금난을 겪는 중소 협력사에는 최대 500억원 규모로 납품 대금 조기 지급 결제를 시행하고, 중소 협력사를 통한 모든 구매 및 공사대금 정산도 월 4회로 늘려 진행하고 있다.아울러 5000만원 이상 계약 체결 시 필수 요건이었던 보증보험 발행의 면제 대상 범위를 확대해 중소 협력사의 보험 발행 비용 부담도 줄여주고 있다. 기존 협력사 외에 추가로 350여개 중소 협력사가 혜택을 받을 것으로 전망된다.이와 함께 소규모 자영업자 지원을 위한 골목상권 상생 프로젝트인 'U+로드' 확대 및 전국 대리점 운영자금 지원 등에도 약 100억원 규모를 투입한다. 'U+로드'는 LG유플러스 모바일 고객들에게 최대 50% 할인, 1+1 혜택, 경품 이벤트 등을 제공하는 제휴 프로그램으로, LG유플러스는 코로나19로 내방 고객이 감소해 어려움을 겪는 전통시장과 구 시가지 상권 등을 중심으로 이 프로그램을 대폭 확대해 나갈 계획이다.또 코로나 확산이 한창이던 2월 말 대구·경북 지역 비롯 전국 2천 개 대리점 매장에 지원한 운영자금을 25억원에서 34억원으로 늘리고, 14억원 상당의 마스크 세정제 등 방역 물품도 지원하고 있으며, 오프라인 채널의 판매 감소로 경영에 어려움을 겪고 있는 알뜰폰 사업자들을 위해서도 미니공청기, 무선충전기, 손세정제 등 온라인 판촉물을 지원하고 있다. keg@newsis.com<ⓒ 공감언론 뉴시스통신사. 무단전재-재배포 금지>",/news/news_read.nhn?article_id=0009882573&office_id=003&mode=search&query=LG생활건강&page=1
■ 경제와이드 모닝벨 '조간 브리핑' - 장연재,"오늘(27일) 자 조간신문 펼쳐보겠습니다.매일경제 기사입니다.2000선을 돌파한 국내 증시 이야기부터 해보죠.코로나19로 폭락했던 우리 증시가 2000선을 회복했습니다.어제 코스피가 2029.78 포인트로 장을 마쳤는데요.81일 만입니다.매일경제신문은 한국 증시의 속성이 바뀌었다고 평가했습니다.그동안 외국인 위주로 움직이던 한국 증시가 이번에는 외국인의 매수 없이도 빠르게 회복했기 때문입니다.코로나발 증시 폭락이 이어진 지난 3개월 동안 외국인은 20조 원 넘게 국내 주식을 팔아치웠지만 동학 개미로 불리는 개인투자자들이 18조 5천억 원을 순매수하며 방어하는 모습이었습니다.또 코로나19로 비대면 산업에 대한 관심이 급부상하면서 언택트주가 힘을 받으며 상승장을 이끌었는데요.카카오 같은 경우 시가총액 10위권 안으로 껑충 뛰어올랐습니다.이로써 지난 3월 14일 1400선까지 떨어졌던 코스피는 두 달 반 만에 40%를 상승하며 미국이나 유럽 등 선진국과 비교해도 빠른 회복세를 보였는데요.다만2000선을 넘었다고 상승장이 계속 이어질 것으로 낙관하긴 이르다는 분석도 만만치 않습니다.코로나19 2차 재확산 우려, 그리고 미중 갈등까지 더해져 당분간 박스권 장세가 예상됩니다.동아일보 기사입니다.이른바 어린이 괴질이라 불리는 소아 청소년 다기관염증증후군 의심 사례 2건이 국내에서 처음으로 확인됐습니다.어린이 괴질은 신체 곳곳에서 염증이 나타나는 질병으로 가와사키 병과 증상이 유사한데요.아직까지 정확한 원인이 밝혀지지 않았습니다.어린이 괴질은 지난 4월 유럽에서 처음 보고된 후 약 한 달 동안 미국 등 13개국으로 확산돼 있는 상황인데요.해외 환자 대부분이 코로나19 진단 검사에서 양성으로 확인돼 세계 보건기구 WHO와 전문가들은 코로나19와 어린이 괴질의 연관성을 높게 보고 있습니다.국내 의심 환자 2명 모두 일단 코로나19 진단 검사에서 음성 판정이 나왔는데요.하지만 방역당국은 이들이 과거 코로나19에 걸렸다가 치유됐는지 확진자와 접촉했는지를 조사 중입니다.중앙일보 기사입니다.윤석열 검찰총장이 최근 불거진 정의연 사건에 대해 언론에 제기된 모든 의혹을 신고하게 수사하라고 지시한 걸로 알려집니다.정의연 수사와 관련해 윤 총장의 지시사항이 알려진 건 이번이 처음인데요.검찰의 수사는 정대협과 정의연 후원금, 정부 보조금 부실 회계 처리 의혹과
윤미향 더불어민주당 당선인의 개인 계좌 모금 의혹 그리고 안성 쉼터 고가 매입 의혹 등 크게 세 가지입니다.또 윤 당선인 가족이 아파트 5채를 전부 현금으로 구매했다는 곽상도 미래통합당 의원의 의혹 제기 사안 도 규명할 방침입니다.수사팀은 윤 당선인의 사적 유용 여부를 밝히기 위해 개인 계좌를 추적 중에 있으며 검찰은 어제 정의연 회계 담당자 A씨를 참고인 신분으로 소환해 조사한 걸로 알려집니다.윤 당선인은 나흘 뒤인 30일, 21대 국회가 개원하면 임기 중 불체포 특권을 갖게 되는데요.참고인 조사가 시작되면서 국회 개원 전 윤 당선인이 소환될 가능성이 높다는 관측이 나옵니다.조선일보 기사입니다.미국 포브스에 따르면 카카오의 창업자인 김범수 이사회 의장의 보유 자산은 6조 4천 200억 원으로 현대차그룹 정몽구 회장과 정의선 수석부회장 두 사람을 합친 것보다 많습니다.또 이건희 삼성그룹 회장 이후 한동안 없었던 10조 원대 자산가도 등장했습니다.셀트리온 서정진 회장 그리고 김정주 엔엑스씨 대표입니다.최근 5개월 사이 한국 부(富)의 지형이 급격히 바뀌고 있습니다. 4차 산업혁명으로 제조업에서 테크와 바이오 산업 중심으로 흐름이 바뀌었고 코로나 사태로 변화가 가속화됐기 때문인데요.시가총액 상위 기업 명단도 바뀌었습니다.올 초와 5월 26일, 어제 코스피 시총을 비교해보자면 현대차와 포스코, 현대 모비스가 10위권 밖으로 밀려났고요.비대면 수혜주로 꼽히는 카카오와 2차 전지 관련주인 삼성SDI 그리고 LG 생활 건강이 새로 진입했습니다.현재 코스피 시총 톱 텐 가운데 9개 기업은 반도체, 바이오, 전기차 배터리 이 세 종목 안에 포함돼있는 겁니다.시총 변화는 차기 한국 경제·산업을 이끌 대표 주자의 세대교체를 의미하는데요.전문가들은 ""이로써 한국이 나아갈 새 경제·산업의 틀과 방향은 명확해졌다""라고 말했습니다.한국경제 기사입니다.올해 정부가 기타소득을 필요경비로 인정해 주는 비율이 낮아지면서 종합소득세를 내야 하는 전문직 종사자와 직장인이 대폭 늘었습니다.기타 소득은 고용 관계를 맺지 않고 용역을 제공하고 받는 수당 등을 말하는데요.올해는 기타소득이 750만 원을 넘으면 종합소득을 합산해 신고해야 합니다.기타소득 외에 주택임대소득 때문에 ‘종합소득세 날벼락’을 맞은 직장인도 적지 않습니다. 그동안 주택임대소득이 연간 2000만 원 이하면 비과세 혜택을 받았지만 올해부터 종합소득세 대상에 포함돼서입니다.올해 종합소득세를 내는 직장인은 크게 늘어나 30만여 명이 처음으로 종소세를 납부할 것으로 나타났는데요.기타소득 등이 있는 전문직과 직장인은 종합소득세 추가 납부액이 수십만 원이지만 일부는 수백만 원을 넘는 경우도 있어 ‘종합소득세 쇼크’라는 아우성이 나오고 있습니다.
▶ ▶ 저작권자 SBS미디어넷 & SBS I&M 무단전재-재배포 금지",/news/news_read.nhn?article_id=0000212382&office_id=374&mode=search&query=LG생활건강&page=1
,"27일 코스피는 전 거래일보다 1.88포인트(0.09%) 내린 2027.9에 출발했다. 코스피시장에서 개인이 1874억원 순매수하고 있다. 외국인과 기관은 각각 645억원, 1240억원을 순매도했다.코스피 시가총액 상위 종목은 내림세를 보이고 있다. 삼성전자(-0.71%), SK하이닉스(-0.85%), 삼성바이오로직스(-1.40%), 네이버(-2.51%), 삼성전자우(-0.23%), LG화학(-1.69%), 셀트리온(-0.93%), 삼성SDI(-2.19%), 카카오(-2.04%)가 하락세다. LG생활건강(0.07%)만 상승세를 보이고 있다.코스닥지수는 전 거래일보다 0.85포인트(0.12%) 내린 728.26으로 출발해 하락세를 키우고 있다. 코스닥시장에서 개인이 홀로 1137억원을 순매수했다. 외국인은 963억원, 기관은 134억원을 순매도하고 있다.코스닥 시총 상위 종목은 혼조세를 보이고 있다. 알테오젠(7.20%), CJENM(0.34%), 케이엠더블유(2.87%), 스튜디오드래곤(0.90%)이 상승세다. 셀트리온헬스케어(-3.61%), 에이치엘비(-1.50%), 셀트리온제약(-2.03%), 씨젠(-0.35%), 펄어비스(-1.56%), 에코프로비엠(-2.13%)이 하락세를 보이고 있다.앞서 미국 뉴욕 증시는 신종 코로나바이러스 감염증(코로나19) 백신 기대감과 경제 정상화 움직임에 상승 마감했다.다우존스 30 산업평균 지수는 전 거래일보다 2.17%(529.95포인트) 오른 2만4995.11에 장을 마쳤다. 스탠더드앤드푸어스(S&P) 500 지수는 1.23%(36.32포인트) 상승한 2991.77, 나스닥 지수는 0.17%(15.63포인트) 오른 9340.22에 마감했다.윤경진 기자 youn1@mt.co.kr
<저작권자 ⓒ '성공을 꿈꾸는 사람들의 경제 뉴스' 머니S, 무단전재 및 재배포 금지>",/news/news_read.nhn?article_id=0000547438&office_id=417&mode=search&query=LG생활건강&page=1
,"[디지털타임스 김아름 기자] 이베이코리아가 G마켓, 옥션, G9 등 자사가 운영하는 3개 쇼핑사이트에서 진행하는 상반기 최대 할인 행사 '빅스마일데이'가 27일 종료된다.25, 26일 할인쿠폰을 사용하지 않은 소비자라면 각 사이트 별 할인쿠폰이 4종씩 제공된다. 프리미엄 멤버십 회원인 스마일클럽 회원에게는 최대 30만원, 3만원, 1만원이 할인되는 20% 할인쿠폰 3종을, 일반회원에게는 최대 5000원까지 할인되는 15% 할인쿠폰을 지급한다. G마켓과 옥션, G9에서 판매하는 상품 중 빅스마일데이 스티커가 부착된 모든 상품에 쿠폰이 적용된다. 스마일클럽 회원이 아니더라도 한 달 무료 체험을 신청하면 회원 전용 혜택을 모두 받을 수 있다.마지막 특가딜도 공개한다. 남은 할인쿠폰을 효율적으로 활용할 수 있도록 가격대별 인기 상품을 선별했다.우선 가격대가 높은 디지털, 가전 제품을 선보인다. 스마일클럽 쿠폰 적용 시 G마켓에서 'LG 퓨리케어 360 공기청정기+무빙휠'을 93만9000원에, '포스트모던 LED 수납침대SS'를 15만1200원에, '위닉스 제습기 16리터'를 32만9000원에 각각 구매할 수 있다. 옥션에서는 '브라운 전기면도기 시리즈9 9355s 패키지'를 클럽특별가 22만1600원에 판매한다.최대 3만원, 1만원 할인쿠폰을 활용할 수 있는 중저가 상품도 다양하다. G마켓에서는 '닥터자르트 화장품'을 1만5950원부터 판매하고, 옥션에서는 '비비고 사골곰탕 500g 18개'를 클럽특별가 1만2930원에, '헤지스 키즈 아동 반팔티셔츠'를 클럽특별가 2만590원에 각각 판매한다.G9에서는 크리넥스 3겹 데코앤소프트 화장지·하기스 2020년형 매직컴포트·LG생활건강 시리우스 반려동물 사료 등 다양한 생필품을 비롯해 QCY T6 블루투스 무선 이어폰·스타우브 4쿼트 라운드 냄비 4종 등 인기 해외직구 상품을 만나볼 수 있다.김태수 이베이코리아 영업본부장은 ""역대급 실적을 기록하고 있는 빅스마일데이가 오늘 밤 12시 종료된다""며 ""마지막 날에는 미처 사용하지 못한 쿠폰을 쓰려는 수요가 몰리는 점에 착안해 다양한 인기상품을 풍성하게 준비했다""고 말했다.김아름기자 armijjang@dt.co.kr 디지털타임스
/",/news/news_read.nhn?article_id=0002600583&office_id=029&mode=search&query=LG생활건강&page=1
