head,text,url
"▽ LG생활건강, 코로나19 불구 1분기 최대 실적▽ 매출 58분기·영업익 60분기 연속 성장 행진","LG생활건강이 신종 코로나바이러스감염증(코로나19) 사태에도 불구하고 1분기 사상 최대 매출과 영업이익을 달성했다. 실적이 전년 동기 대비 후퇴할 것이란 금융투자업계의 우려를 무색하게 하며 매출(전년 동기 대비)과 영업이익이 각각 58분기, 60분기 연속 성장했다. 코로나19 위기 속에서도 성장을 이어가면서 ‘기록의 사나이’, ‘매직맨’으로 불리는 차석용 LG생활건강 부회장의 경영 능력이 재조명받고 있다.LG생활건강은 1분기 연결 기준 매출과 영업이익이 전년 동기 대비 각각 1.2%, 3.6% 증가한 1조8964억원, 3337억원을 기록했다고 23일 공시했다. 당기순이익은 2342억원으로 3.7% 증가한 것으로 잠정 집계됐다.이는 코로나19 여파로 실적 후퇴가 불가피하다는 금융투자업계의 예상을 웃도는 호실적이다. 증권정보업체 에프앤가이드에 따르면 LG생활건강의 1분기 매출과 영업이익 컨센서스(국내 증권사 전망치 평균)는 각각 1조7394억원, 2324억원으로 집계됐다.
 이에 LG생활건강의 매출(전년 동기 대비)은 2005년 3분기 이후 58분기 연속 성장세를 이어갔다. 영업이익은 2005년 1분기 이후 60분기 증가세를 지속했다. 대표사업인 화장품 사업의 경우 성장세가 주춤했다. 화장품 사업 매출은 6.4% 감소한 1조665억원, 영업이익은 10.0% 줄어든 2215억원을 기록했다. 중국인을 포함한 외국인 관광객의 현저한 감소로 면세점 채널이 타격을 입은 타시다. 그러나 ‘숨’과 ‘오휘’의 초고가 라인이 높은 수요를 기반으로 성장했고, 더마화장품 ‘CNP’ 또한 13%의 매출 성장을 기록했다. LG생활건강은 ""코로나19 영향으로 중국 시장이 정상적으로 가동되지 못하는 상황에서도 화장품 사업은 럭셔리 브랜드들에 대한 견고한 수요에 힘입어 매출과 영업이익 감소의 충격을 최소화했다""고 밝혔다.생활용품 사업과 음료 사업의 호조가 화장품 부문 성장 공백을 메웠다. 코로나19로 위생 관련 생활용품 수요가 늘었고, 언택트(비대면) 소비 확산으로 배달음식 수요와 e커머스(전자상거래)를 통한 음료 소비가 증가한 덕이다.
생활용품 사업은 매출과 영업이익이 각각 4793억원, 653억원으로 19.4%, 50.7%씩 성장했다. 음료 사업 또한 매출과 영업이익이 각각 5.0%, 43.9% 개선된 3505억원, 468억원을 거뒀다.
 LG생활건강은 ""생활용품의 경우 코로나19로 인한 소비자 니즈 및 유통 변화에 즉각 대응한 핸드 새니타이저 겔, 핸드워시, 물티슈, 한장 행주 등 다양한 항균 위생용품의 출시로 호실적이 나타났다""고 설명했다.코로나19 속 깜짝 실적으로 차 부회장의 경영 능력이 재조명됐다. 차 부회장이 어떤 충격에도 견딜 수 있는 ‘내진설계’에 초점을 맞춰 조직을 구축한 효과가 이번 코로나19 위기에서도 드러났다는 평가다. 차 부회장은 2005년 취임해 20개 이상의 성공적으로 인수·합병(M&A)하며 LG생활건강의 성장을 이끌었다.시장에서는 '차석용 매직'이 2분기에도 이어질 수 있을지에 주목하고 있다. 1분기 선전에도 불구하고 코로나19 여파가 심화되고 있는 만큼 성장세 지속 여부를 확신하기 어렵다는 분석이다. 그러나 강한 경쟁력에 비춰 2분기에도 K뷰티 업계에서 가장 돋보이는 성적을 거둘 것이란 진단이 전문가들의 중론이다. 관건은 코로나19 충격파가 어느정도 지속될지에 달렸다. 희망적인 부분은 K뷰티 소비시장의 한 축인 중국 현지에서 외부활동과 소비 회복세가 빠르게 일어나고 있다는 점이다. 다만 지난달부터 코로나19가 세계적 대유행(팬데믹)으로 번지면서 추가적으로 확산된 미국, 일본 사업은 2분기에 부진이 우려되고 있다.손효주 한화투자증권 연구원은 ""중국과 국내 채널은 2분기에 회복될 가능성이 있으나, 면세 사업과 최근 코로나19가 확산되고 있는 미국, 일본 사업은 2분기에 타격을 입을 것""이라고 분석했다. 단기적으로 실적이 주춤하더라도 중장기 관점에서는 성장성이 유효하다는 진단이다.
조미진 NH투자증권 연구원은 ""코로나19로 중국 내에서 소비가 억제됐지만 사태 진정 후 보상심리가 작용하며 회복세를 나타낼 것""이라며 ""럭셔리 화장품 제품군에 대한 선호도 증가 추세는 변함이 없고, 이는 더욱 강화될 전망""이라고 예상했다. 오정민 한경닷컴 기자 blooming@hankyung.com기사제보 및 보도자료 open@hankyung.com▶ ▶
 ▶
ⓒ 한국경제 & , 무단전재 및 재배포 금지",/news/news_read.nhn?article_id=0004329571&office_id=015&mode=search&query=LG생활건강&page=3
사드 때도 中 럭셔리 75% 고성장백화점 영업중단 등 소비줄어든 탓,"LG생활건강이 신종 코로나바이러스 감염증(코로나19) 여파에도 올해 1분기 최대 실적을 달성한 반면 화장품부문 성장세는 큰 폭으로 꺾였다. 2017년 사드(THAAD·고고도미사일방어체계)때와 달리 국내 면세점 채널뿐 아니라 중국 내 판매량이 감소한 탓으로 풀이된다.23일 LG생활건강에 따르면 올해 1분기 화장품 사업 매출은 1조665억원으로 전년 동기대비 6.4% 감소했다. 영업이익은 2215억원으로 10% 가량 줄었다. 2019년 1분기 화장품 사업 매출과 영업이익이 전년대비 각각 20.3%, 16.1% 증가했던 것을 감안하면 감소 폭이 크다.다만 생활용품과 음료 사업이 고성장을 달성하며 전사적으로는 분기별 최대 실적을 기록했다. 올해 1분기 전사 매출은 1조8964억원으로 1.2% 늘었고, 영업이익은 3337억원으로 3.6% 증가했다. 같은 기간 생활용품과 음료 사업 영업이익은 각각 50.7%, 43.9% 급증했다.LG생활건강 관계자는 ""생활용품은 코로나19로 손 세정제와 핸드워시, 물티슈 등의 수요 증가에 즉각 대응해 다양한 제품을 출시한 게 주효했다""며 ""음료 사업은 극장 이용과 외식 등이 줄었으나 배달 음식과 온라인 등의 채널에서 수요를 늘리며 고성장을 달성했다""고 설명했다.LG생활건강 화장품 사업 실적이 뒷걸음친 건 11분기 만이다. 사드 여파로 방한 중국인이 급감함에 따라 2017년 2분기 LG생활건강 화장품 사업 매출은 7812억원으로 전년 동기대비 4.7% 줄어든 바 있다. 당시 영업이익은 1487억원으로 2.7% 감소했다.사드 때 보다 화장품 사업 타격이 큰 이유는 중국 내 수요 자체가 감소했기 때문으로 분석된다. 앞서 코로나19 확산 방지를 위해 중국 내 최대 판매처인 백화점 등은 영업을 중단했다. 국내 면세점 큰손인 중국 대리구매상(따이궁)의 발이 묶인 것도 영향을 미쳤다.실제 2017년 2분기 LG생활건강 중국 현지 럭셔리 브랜드 매출은 사드 사태에도 불구 75% 고성장을 이어간 바 있다. 반면 올해 1분기 럭셔리 라인인 '후'와 '숨'의 매출은 각각 8%, 31% 줄어들었다. LG생활건강은 올해 1분기 해외 실적을 별도로 발표하지 않았다.다만 오는 2분기 실적 전망은 밝다. 중국이 코로나19로 위축된 소비를 진작시키기 위한 정책을 내놓고 있기 때문이다. 오린아 이베스트증권 연구원은 ""3월부터 중국 내 소비가 활성화됨에 따라 LG생활건강의 럭셔리 기반 화장품 포트폴리오는 유리한 위치에 있다""고 분석했다. 여기에 LG생활건강이 지난 2월 인수한 글로벌 제약사 글락소스미스클라인(GSK)의 유럽 더마화장품 브랜드 '피지오겔'의 아시아와 북미 사업권 효과도 더해질 것으로 전망된다. 화장품업계 관계자는 ""2분기부터 중국 시장에서 그동안 움츠려있던 소비가 폭발하는 이른바 '보복 소비'가 나타날 것으로 보인다""며 ""이 경우 화장품 업종부터 반사이익을 얻을 것""이라고 말했다.[디지털뉴스국 신미진 기자] [ⓒ 매일경제 & mk.co.kr, 무단전재 및 재배포 금지]",/news/news_read.nhn?article_id=0004562704&office_id=009&mode=search&query=LG생활건강&page=2
,"LG생활건강이 ‘코로나19’ 악재에도 불구하고 사상 최대 분기 실적을 기록했다. LG생활건강은 올해 1분기 매출 1조8964억원, 영업이익 3337억원, 당기순이익 2342억원을 달성하며 전년동기 대비 각각 1.2%, 3.6%, 3.7% 성장했다고 23일 밝혔다. 코로나19로 국내외 사업 환경이 급속도로 위축된 상황에서도 역대 최고의 1분기 매출과 영업이익을 기록했다. 전년 동기 대비 매출은 2005년 3분기 이후 58분기 성장했고, 영업이익은 2005년 1분기 이후 60분기 증가세를 이어가고 있다. 코로나19의 영향으로 중국 시장이 정상적으로 가동되지 못하는 상황에서도 뷰티 사업은 럭셔리 브랜드들에 대한 견고한 수요에 힘입어 매출과 영업이익 감소의 충격을 최소화했다. 어려운 경영 환경에서도 시장의 수요 변화에 민첩하게 대응한 HPC(에이치피시: Home & Personal Care) 사업은 매출과 영업이익이 전년동기 대비 각각 19.4%, 50.7%의 성장을 기록, 큰 폭으로 성장하며 전사 실적을 견인했다. Refreshment(리프레시먼트) 사업 또한 주요 브랜드들의 안정적인 성장을 바탕으로 건실한 실적을 달성했다. 뷰티(화장품) 사업 매출은 전년동기 대비 6.4% 감소한 1조655억원, 영업이익은 10.0% 감소한 2,215억원을 기록했다. 지난 1·4분기 화장품 시장은 2월부터 본격화된 코로나19의 여파로 국내외 수요가 감소하며 주요 채널 매출이 급감했다. 특히 중국인을 포함한 외국인 관광객 유입이 거의 없어지면서 면세점 채널이 큰 타격을 받았다. 화장품 사업도 매출과 영업이익이 감소됐으나 주요 럭셔리 브랜드들의 경우 높은 수요를 기반으로 상대적으로 견조한 실적을 거뒀다. ‘숨’ 과 ‘오휘’ 의 초고가 라인인 ‘로시크숨마’와 ‘더 퍼스트’가 각각 13%, 52% 성장했고, 더마화장품 브랜드 ‘CNP’는 13%의 매출 성장을 달성했다. 생활용품은 코로나19로 어려운 가운데 높은 실적을 달성케 한 일등 공신이다. 생활용품 사업의 매출은 전년동기 대비 19.4% 성장한 4793억원, 영업이익은 50.7% 성장한 653억원을 달성했다. 소비심리가 위축되고 대형마트 등 다중 이용시설의 기피 현상이 두드러지는 한편 위생용품의 수요가 증가하고 온라인 및 소형 슈퍼의 이용률이 증가하는 시장의 변화가 있었다. 닥터그루트, 벨먼, 히말라야 핑크솔트 등 프리미엄 브랜드들의 꾸준한 성장이 뒷받침하는 가운데, 코로나바이러스로 인한 소비자 니즈 및 유통 변화에 즉각 대응한 핸드 새니타이저 겔, 핸드워시, 물티슈, 한장 행주 등 다양한 항균 위생용품의 출시로 높은 성장을 이루었다. 음료 매출 역시 코로나19로 배달음식 수요가 늘면서 고실적을 견인했다. 음료 매출은 전년동기 대비 5.0% 성장한 3505억원, 영업이익은 43.9% 성장한 468억원을 달성했다. 탄산음료는 ‘코카콜라’, ‘몬스터에너지‘, ‘씨그램’ 은 전년동기 대비 각각 8%, 115%, 23%의 성장률을 보이며 탄산은 전년동기 대비 9%의 높은 매출 성장을 이뤘다. LG생활건강 관계자는 ""코로나19로 사업 환경이 급속도로 위축된 상황에서도 역대 최고의 1분기 매출과 영업이익을 기록했다""며 ""럭셔리 화장품 브랜드들에 대한 견고한 수요와, 시장 수요 변화에 민첩하게 대응한 HPC 사업, 리프레시먼트 사업의 안정적인 성장을 바탕으로 건실한 실적을 달성했다""고 말했다. 김설아 기자 sasa7088@mt.co.kr
<저작권자 ⓒ '성공을 꿈꾸는 사람들의 경제 뉴스' 머니S, 무단전재 및 재배포 금지>",/news/news_read.nhn?article_id=0000534849&office_id=417&mode=search&query=LG생활건강&page=2
▶ 네이버 홈에서 [한국경제TV] 채널 구독하기 [생방송보기]▶ 대한민국 재테크 총집결! - [증권 / 주식상담 / 부동산],"오늘 오전 SK하이닉스와 NAVER가 1분기 깜짝실적을 내놓았습니다. 오늘 실적을 발표를 하는 기업들이 많은데요. 어닝데이로
주목 받고 있습니다. 그럼 주요 기업들의 실적과, 전망 짚어보겠습니다.SK하이닉스가 메모리 반도체 가격 상승에 힘입어 어닝서프라이즈를 기록했습니다. 매출액이 전년동기대비 6.3% 증가한 7조 1988억, 영업익이 41% 감소한 8000억원대를 기록했는데요. 당초 영업익이 5000억원대로 예상됐던만큼, 그 컨센서스를 크게 뛰어넘은 서프라이즈 실적을 기록한 겁니다.영업이익 추이를 보시면, SK하이닉스는 작년 1분기 1조 이상의 영업익을 기록한 다음, 크게 부진한 흐름을 보였습니다. 메모리 가격의 하락 때문이었는데요. 당초 이번 1분기도 코로나 타격이 불가피하기 때문에, 크게 부진할 것으로 예상했습니다. 하지만, 영업익 8천억을 기록하면서, 작년 1분기 이후 가장 좋은 실적을 발표했습니다.오늘 오전에 열린 SK하이닉스의 컨퍼런스콜 주요 내용을 살펴보죠. 코로나에 따른 급격한 환경 변화에도 불구하고 서버용 제품 판매 증가와 원가 절감 등에 힘입어 호실적을 냈다고 설명했습니다. 올해 들어 본격 상승한 D램·낸드플래시 가격이 호실적을 이끌었는데요. 모바일 D램 수요가 크게 줄었지만, 언택트 영향으로 서버용 D램과 SSD 수요가 크게 늘며 모바일 수요 감소를 상쇄했습니다. 또한 환율 효과도 꽤 컸던 것으로 보입니다. 2분기 실적에 대해선, 일단 재고량은 전분기 대비 줄어들 것으로 전망했고요. 낸드플래시는 하반기엔 흑자로 전환할 것으로 전망했습니다. 하지만 향후 실적 전망은 불투명하다는 게 중론인데요. 높아진 불확실성에 올해 총 메모리 수요 예측을 내놓기 힘들다는 입장입니다.이어서 NAVER 실적 확인해보겠습니다. 매출이 전년동기대비 14% 증가한 1조 7321억, 영업익은 7% 증가한 2215억을 기록했습니다. 영업익 컨센서스가 2천억이 되지 않고, 전년대비 감소할 것으로 예상됐었는데, 기대 이상의 깜짝실적을 발표한 겁니다.영업이익 추이를 보시죠. 네이버는 코로나로 인해 광고 사업이 타격을 받았지만, 쇼핑·간편결제 등 부문은 오히려 선전했는데요. 사회적 거리두기로 인한 언택트 트랜드의 확산으로, 수혜를 톡톡히 봤습니다. 직전분기보다도 크게 양호한 실적을 발표했습니다.주요 컨퍼런스 내용도 살펴보겠습니다. 네이버페이가 분기 거래액 5조원을 최초로 돌파하면서, 큰 성과를 이뤘습니다. 스마트스토어 이용자수가 1000만명을 돌파했다고 하는데요. 코로나로 인한 온라인 쇼핑 증가 영향이 컸습니다. 또한 사회적 거리두기 확대로 밴드 이용자가 많았다고 하는데요. 네이버는 코로나 영향이 2분기에 더 클 것으로 전망했습니다.다음은 HDC현대산업개발입니다. 사실 실적보다 아시아나항공 인수 이슈가 주가에 더 크게 작용하는 기업이죠? 최근 아시아나 인수를 미루면서, 앞으로의 행보에 대해서 주목받고 있습니다. 그런데 HDC현대산업개발의 1분기 실적, 예상치보다 잘나왔는데요. 매출액이 전년동기대비 14% 증가한 1조 6억, 영업익이 35% 증가한 1373억을 기록했습니다. 영업익 컨센이 900억대였기 때문에 사실상 서프라이즈 실적을 기록한 건데요. 영업이익 추이 보겠습니다.원래 건설업황 부진으로 영업이익 부진을 예상했습니다. 작년 2분기에는 2천억 가까운 영업익을 기록했지만, 3분기에는 천억원이 채 안되기도 했었는데요. 이번 1분기에는 천억원을 넘어서는 호실적을 기록했습니다.이어서 현대차 실적 확인해보겠습니다. 방금전에 실적을 발표했는데요. 먼저 예상치였던 전망부터 체크해보시면, 매출이 3% 감소한 23조원대를, 영업익 13% 감소한 7천억원대를 예상했습니다.그리고 방금전에 현대차 실적이 발표됐는데요. 예상보다 잘 나왔습니다. 매출이 25조 3194억, 영업이익이 8,638억원으로 전년동기대비 각각 +5.6%,+4.7% 증가했습니다.LG생활건강도 1분기 실적 10분전에 발표했습니다. 예상보다 잘 나왔는데요. 먼저 잠정치부터 확인해보면, 매출과 영업익 모두 감소할 것으로 전망됐었습니다. 특히 영업익이 27% 감소를 예상했는데요. 하지만 발표한 실적 확인해보시면요매출과 영업익 모두 실적이 개선됐습니다. 영업이익이 특히 3.6% 증가하면서 예상치보다 1천억원 이상 잘 나왔는데요. 3,337억원을 기록했습니다.[한국경제TV=손현정 캐스터]ⓒ 한국경제TV, 무단 전재 및 재배포 금지",/news/news_read.nhn?article_id=0000866356&office_id=215&mode=search&query=LG생활건강&page=2
,"(서울=연합뉴스) 윤지현 기자 = LG생활건강이 신종 코로나바이러스 감염증(코로나19)에 따른 시장 위축에도 올해 1분기 소폭의 실적 성장을 이뤄내며 역대 최대 실적을 갈아치웠다.

코로나19로 중국 시장이 흔들리면서 화장품 사업은 매출과 영업이익 모두 감소했으나, 손소독제·손세정제 등 생활용품 사업이 급성장하며 실적을 방어했다.

 LG생활건강은 1분기 매출이 1조8천964억원으로 전년 동기 대비 1.2% 늘었고, 영업이익은 3천337억원으로 3.6% 증가했다고 23일 밝혔다.

사업별로 보면 화장품 사업 매출은 전년 동기 대비 6.4% 감소한 1조665억원을, 영업이익은 10.0% 줄어든 2천215억원을 기록했다.

2월부터 본격화한 코로나19의 여파로 국내외 주요 채널의 매출이 감소하고, 특히 중국인을 포함한 외국인 관광객의 급감으로 면세점 채널이 큰 타격을 받았다.

 다만 '숨'과 '오휘' 등 초고가 라인과 더마화장품 'CNP' 등은 성장세를 이어갔다.

생활용품 사업 매출(4천793억원)과 영업이익(653억원)은 각각 19.4%, 50.7%의 높은 성장률을 기록하면서 전사 실적을 견인했다.

회사 관계자는 ""코로나19로 인한 소비자 수요 및 유통 변화에 발 빠르게 대응해 손소독제, 손세정제, 물티슈, 일회용 행주 등 다양한 항균 위생용품을 출시한 것이 효과를 봤다""고 설명했다.

음료 사업 매출은 5.0% 성장한 3천505억원, 영업이익은 43.9% 성장한 468억원을 달성했다.

yjh@yna.co.kr",/news/news_read.nhn?article_id=0011567618&office_id=001&mode=search&query=LG생활건강&page=2
,"[머니투데이 오정은 기자] ['코로나 쇼크' 이긴 차석용 매직…화장품 매출 감소, 생활용품이 방어 '삼각편대' 위력 ] LG생활건강이 전세계적인 코로나19(COVID-19) 확산이라는 초유의 위기에도 1분기 사상 최대 실적을 기록했다. 화장품 소비가 급감한 가운데 생활용품과 음료가 실적 방어에 나서며 '최강의 삼각편대' 사업 포트폴리오의 위력을 증명했다. LG생활건강은 1분기 매출액이 1조8964억원, 영업익 3337억원, 당기순익 2342억원으로 전년대비 각각 1.2%, 3.6%, 3.7% 성장했다고 23일 밝혔다. 이는 역대 최고 1분기 매출액과 영업이익으로 매출액은 2005년 3분기 이후 58분기 연속, 영업이익은 2005년 1분기 이후 60분기째 성장을 이어갔다. 1분기 매출액이 7%, 영업이익이 25% 이상 감소할 거란 증권가 애널리스트 전망을 훌쩍 뛰어넘는 수치다. 코로나19 확산으로 화장품의 주요 채널인 면세점 영업이 사실상 마비되고 중국 현지와 국내 오프라인 영업이 얼어붙은 상황에서 거둔 실적이라 시장은 더욱 놀라움을 표시하고 있다. 불황과 위기를 대비해 만든 LG생활건강의 사업 포트폴리오가 감염병이 글로벌 경제를 강타하는 와중에도 빛을 발한 것이다. 15년 전 부임한 차석용 LG생활건강 부회장은 업황의 부침을 피하기 위해 2009년 코카콜라를 인수해 생활용품, 화장품, 음료의 삼각편대를 완성했다. 차 부회장은 당시 ""두발자전거보다 세발자전거가 안정적""이라는 생각으로 사업 포트폴리오를 다각화해 '성장의 내진설계'를 완성했다. 실제로 1분기 코로나19 확산이 화장품 매출을 강타했지만 생활용품과 음료가 실적 방어에 나섰다. 생활용품·음료 카테고리는 성장성은 크지 않아도 불황에도 매출이 줄지 않는다는 강점이 있다. 특히 LG생건은 자체 마스크 브랜드와 위생용품까지 갖춰 다른 화장품 기업에 비해 코로나 불황에 대처할 수 있는 여지가 있었다. 사업부별로는 생활용품과 음료가 매출 성장을 기록했지만 화장품도 악화된 영업환경을 감안할 때 선방했다. 화장품 사업 매출액은 전년비 6.4% 감소한 1조665억원, 영업이익은 10.0% 감소한 2215억원을 기록했다. 중국 현지와 국내 오프라인, 면세점 매출이 줄어든 여파였다. 대표 화장품 브랜드 '후'의 1분기 매출액은 전년 동기 대비 8% 감소했다. HPC(생활용품) 사업은 화장품 매출 감소를 방어한 일등 공신이었다. HPC의 매출과 영업이익은 전년비 각각 19.4%, 50.7% 증가하며 전사 실적을 견인했다. 국내 생활용품 시장은 경쟁이 치열한 레드오션으로 성장이 힘든 영역으로 간주됐는데 코로나19 창궐로 위생용품 시장이 폭발적으로 커지자 HPC에 기회가 됐다. 바디케어 브랜드 온더바디의 매출이 22% 증가했고 헤어케어 브랜드 리엔, 엘라스틴이 각각 28%, 14% 성장했다. 섬유유연제 샤프란 아우라도 매출이 12% 늘었다. 음료 사업은 매출액은 전년비 5.0% 성장한 3505억원, 영업이익은 43.9% 늘어난 468억원을 달성했다. 코로나19로 극장 이용과 야외 활동 및 외식 등이 줄며 음료 수요가 감소했으나 배달음식 등 채널에서 수요를 늘리며 매출이 성장했다. ‘코카콜라’, ‘몬스터에너지’, ‘씨그램’ 판매량 증가가 돋보였다. 오정은 기자 agentlittle@mt.co.kr
<저작권자 ⓒ '돈이 보이는 리얼타임 뉴스' 머니투데이, 무단전재 및 재배포 금지>",/news/news_read.nhn?article_id=0004399258&office_id=008&mode=search&query=LG생활건강&page=2
