head,text,url
가정의달 선물·이벤트 어떤 것들 있나일상생활서 착용 가능한부담 없는 다이아몬드 인기마스크로 지친 피부 달래줄기능성 코스메틱 제품도 눈길백화점·마트·편의점 등최대 75% 할인 이벤트 잇달아,"산과 들의 신록과 함께 가정의 달이 일주일 앞으로 다가왔다. 올해 5월은 예년과는 느낌이 사뭇 다르다. 코로나19 확산에 '사회적 거리 두기'가 이어지며 떨어져 살던 가족들은 '사실상 이산가족'이 됐다. 지방의 부모님들은 한동안 자녀와 토끼 같은 손주의 모습을 볼 수 없었다. 개학까지 연기되며 학생들은 작은 모니터를 통해서만 선생님을 만나고 있다. 회사 대신 방 안에서 일하는 아빠는 끼니 때만 모습을 드러내 엄마에게 '삼식이'라며 눈치를 받는다. 어쩔 수 없이 소원했거나 괜한 짜증을 전한 이들이 있다면 다가오는 어린이날, 어버이날, 스승의날, 그리고 부부의날을 놓쳐선 안 된다. 정성스레 준비한 작은 선물 하나에 마음 한 점을 찍으면 '준비 완료'다.올해 선물은 늘 인기 있는 화장품·액세서리와 더불어 건강기능식품이 주목받을 것으로 예상된다. 구매 방식은 '언택트(비대면)' 활용이 많아질 전망이다. 이커머스 업체 티몬이 최근 30~50대 400명을 대상으로 실시한 설문조사에 따르면 51.8%가 온라인 채널에서 선물을 구입할 것이라고 답했다. 지난 밸런타인데이, 화이트데이에 이어 가정의 달에도 온라인을 통해 선물을 구매해 전하겠다는 이들이 많아지는 상황이다. 앞서는 마음과 달리 어떤 선물을 고를지 고민되는 것도 늘 반복되는 일이다. 고민을 거듭하는 이들을 위해 여러 업체들은 '가성비'에 '가심비'까지 더한 다양한 선물들을 추천하고 나섰다. 이른 여름을 준비하는 고객들을 위해 아모레퍼시픽은 기능성 선크림을 출시했다. 아모레퍼시픽의 남성용 화장품 브랜드 비레디(BeREADY)가 개발한 '슈퍼 마일드 선 프라이머 포 히어로즈'는 자외선 차단 기능은 물론 메이크업의 밀착력과 지속력을 높여주는 프라이머 기능도 함께 지닌 제품이다. LG생활건강의 천연 허브 브랜드 빌리프가 선보인 '아쿠아 밤 앰플 세럼' 2종도 가정의 달 선물로 제격이다. '브라이트닝'과 '리파이닝'으로 구성된 이번 앰풀 세럼은 고농축 허브 성분이 담겨 있어 수분 공급은 물론 피부 톤과 결을 동시에 관리해주는 제품이다. 사랑하는 이들의 건강을 챙기기 위한 선물도 눈에 띈다. 일동후디스 '하이뮨 프로틴 밸런스'는 산양유 연구를 통한 영양 설계 노하우로 5가지 엄선된 단백질과 기능성분 8종을 균형 있게 담았다. 최근 사회적 거리 두기로 활동량이 줄면서 약화된 면역력과 근육을 보충해준다. KGC인삼공사 정관장 제품 중 '홍삼톤골드'는 가정의 달 '인기 아이템'이다. 6년근 홍삼농축액을 주원료로 대추, 당귀, 버섯 등 다양한 식물성 원료를 배합했다. 패션 아이템도 빠질 수 없다. 아웃도어 브랜드 K2는 냉감 소재와 냉감 공법을 이중으로 적용한 '오싹(OSSAK)' 티셔츠를 선보였다. '오싹' 시리즈는 반복적인 듀얼쿨링 시스템으로 땀과 끈적임을 날려버리는 냉감 제품군이다. 네파는 스니커즈로 활용 가능한 스티오 고어텍스를 출시했다. 일반 아웃도어 신발과 달리 스포티한 분위기를 살린 날렵한 디자인에 경량성을 높여 데일리 슈즈로 신기에 적당하다. 아이더는 코로나19가 회복세를 보이며 외부 활동이 잦아질 것에 맞춰 티셔츠 '세이덤'과 '리엑토'를 선보였다. 태양열 반사 소재가 적외선 흡수를 막아 쿨링 효과를 발휘하는 '아이스 셰도 시스템'이 적용됐다.품격 있는 선물을 생각한다면 시계나 주얼리를 고려해볼 만하다. 스위스 시계 브랜드 'IWC 샤프하우젠'은 베스트셀러 제품인 포르투기저 크로노그래프 새 버전을 출시했다. 투명 백케이스로 무브먼트의 움직임 그 자체를 생생히 볼 수 있게 제작됐다는 점이 특징이다. 다이아몬드 주얼리 브랜드 엠디루사는 밀레니얼 세대 여성들에게 '나를 위한 선물'을 제안한다. 과거 다이아몬드는 주로 예물용이라는 인식이 강했지만, 최근 들어 평상시에도 착용할 수 있는 데일리 제품에도 다이아몬드가 폭넓게 활용될 만큼 대중화하고 있다. 다이아몬드 주얼리 입문자라면 쁘띠 다이아몬드를 활용한 경우 30만원대 제품도 주목할 만하다.백화점·마트·편의점 등 오프라인 유통채널에서는 가정의 달 할인행사가 진행된다. 롯데백화점은 4월 30일부터 5월 5일까지 구매 고객들을 대상으로 추첨을 통해 5월 말로 예정된 '미스터트롯' 콘서트 티켓을 제공한다. 오는 30일부터 다음달 5일까지는 다양한 화장품을 할인해 판매하는 '코스메틱 페어'도 진행한다. 롯데마트는 어린이날 완구 상품권 행사를 진행한다. 25일부터 다음달 5일까지 롯데·비씨·KB국민·신한·NH농협·현대카드로 완구를 6만원 이상 구입하면 1만원 상품권을 증정한다.
편의점과 슈퍼마켓도 가세한다. GS25리테일은 다음달부터 GS25, GS더프레시 전국 점포에서 가족들을 위한 아이템들을 할인해 판매한다. 플레이스테이션4 프로 '갓오브워' '더라스트오브어스 리마스터' 번들과 고프로 패키지를 50개 수량 한정으로 판매한다. CU는 어린이날 선물로 '손오공 핫휠레이싱 세트'와 '바비'의 캠핑카, '바비'의 핑크 옷장 등을 최대 50% 할인해 판매한다. 어버이날 상품으로는 '코지마' 안마의자, '정관장' 홍삼, '브라운' 면도기 등이 있다.
코로나19로 수요가 늘어난 온라인 쇼핑몰도 기획전을 진행한다. '집콕족'들 사이에서 큰 인기를 누리고 있는 닌텐도 게임 '동물의숲'과 면역력 증진을 위한 건강기능식품 등이 눈에 띈다. 이베이코리아가 운영하는 G마켓과 옥션은 다음달 5일까지 자녀와 부모님을 위한 선물들을 할인한다. 자녀들을 위한 브랜드로는 '레고' '미미' '매일유업' 등이 있다. 부모님을 위한 기획전에서는 '에이지투웨니스' '바디프렌드' '종근당건강' '세노비스' 'GNC' 등이 대폭 할인에 들어간다. 이번 세일에는 위 브랜드별로 최대 25% 중복 할인쿠폰이 제공된다.티몬도 다음달 15일까지 매일 50여 개 상품을 최대 75%까지 할인해 판매한다. '침향환 등 기력보환 시리즈 3종', '리웰 세로 손마사지기' 등이 대표적이다. 인터파크는 다음달 7일까지 '혜택 다(多) 가정' 프로모션을 진행한다. 가정의 달마다 수요가 눈에 띄게 증가하는 건강식품·안마용품·완구용품·화환상품 등에 할인 혜택을 집중한다. 12% 중복 할인 쿠폰을 매일 오전 10시에 선착순으로 제공하고, 톡집사(인터파크의 고객 상담 챗봇 서비스) 대화창에서 가정의 달 키워드를 입력하면 전용 30% 중복할인 쿠폰도 선착순으로 받을 수 있다. [심상대 기자 / 강인선 기자] [ⓒ 매일경제 & mk.co.kr, 무단전재 및 재배포 금지]",/news/news_read.nhn?article_id=0004562188&office_id=009&mode=search&query=LG생활건강&page=5
천연 허브 브랜드 `빌리프`촉촉함 강점 제품 2종 출시,"LG생활건강의 천연 허브 브랜드 빌리프가 '아쿠아 밤 앰플 브라이트닝 세럼'과 '아쿠아 밤 리파이닝 앰플 세럼'을 출시했다. 이들은 고농축 허브 성분을 담아 수분 공급은 물론 피부의 톤과 결을 집중적으로 관리해주는 제품이다. 무엇보다 이번 앰플의 가장 큰 특징은 빌리프의 대표 제품이자 베스트셀러 중 하나인 '더 트루크림-아쿠아 밤'의 핵심 제조법을 그대로 본떠 만들었다는 점이다. 더 트루크림-아쿠아 밤은 '수분 폭탄' 크림이라 불릴 정도로 촉촉함이 살아 있는 제품이다. 피부 톤을 투명하게 살리는 데 제격인 아쿠아 밤 브라이트닝 앰플 세럼은 8가지 허브 추출물과 비타민E 성분이 함유된 버블 오일 등으로 이뤄져 있다. 외부 환경으로부터 피부 스트레스를 다스리는 데 효과적이다. 또 다른 장점으로는 촉촉한 워터젤 제형이라 끈적임 없이 피부에 빠르게 스며든다는 점이 꼽힌다. 빌리프 브랜드 담당자는 ""탱글탱글한 윤기만 피부에 남긴다는 점이 특징""이라고 설명했다. 피부 결을 정돈하는 데 적합한 아쿠아 밤 리파이닝 앰플 세럼은 각질 제거를 도와주는 세린 성분과 마시멜로 뿌리 추출물이 함유된 앰플 세럼 등이 들어 있다. 강한 자극 없이도 피부를 부드럽고 매끄럽게 가꿔준다. 물방울 같은 젤 타입의 제형이 피부 표면에 수분막을 씌워 하루 종일 촉촉하면서도 편안한 수분감을 느낄 수 있다.빌리프 브랜드 담당자는 ""요즘엔 자연스러우면서 건강한 타입의 피부가 뷰티 트렌드로 떠오르고 있다""며 ""이를 위해선 계절 변화 등과 같은 외부 요인에 피부가 쉽게 지치지 않게 본연의 힘을 길러주고 생기를 충전해주는 것이 중요하다""고 말했다.
[심희진 기자] [ⓒ 매일경제 & mk.co.kr, 무단전재 및 재배포 금지]",/news/news_read.nhn?article_id=0004562181&office_id=009&mode=search&query=LG생활건강&page=5
,"[서울=뉴시스] 김제이 기자 = 신종 코로나바이러스 감염증(코로나19) 잠잠했던 중국 관련주들이 꿈틀대고 있다. 중국의 한한령 해제 기대감에 중국 관련주의 실적 개선 기대감이 올랐기 때문이다. 엔터 및 화장품 등 주요 중국 관련 업종들은 이달 들어 오름세를 기록 중이다.23일 금융투자업계에 따르면 오는 5월15일 서울·심천·도쿄 등 아시아 5대 도시에서 코로나19 극복 의지를 담은 '유앤미, 위아더월드(YOU&ME, We are the world)'가 개최될 예정이다.증권업계에서는 중화자선총회에서 글로벌 스타들에게 공식 초청장을 보내는 형태로 진행되는 이번 행사는 우리나라 기획사에는 한한령(중국 내 한류 금지령) 해제라는 상징적 의미도 담겨있다고 볼 수 있다고 평가했다.에스엠은 전날 전 거래일 대비 200원(0.78%) 오른 2만5700원에 마감했다. 와이지엔터테인먼트도 550원(1.92%) 오른 2만9250원에 거래를 마쳤다.이남수 키움증권 연구원은 ""에스엠은 케이팝의 근원지라 불릴 만큼 다양한 탑 아티스트를 보유하며 케이팝을 브랜드화시킨 저력을 발휘하고 있다""며 ""한한령 해제 분위기에 힘입어 보아, 동방신기, 슈퍼주니어, 샤이니, 엑소 등으로 이후 중국 시장을 공략할 엔시티(NCT)와 웨이션브이(WayV)의 높은 성장성에 주목할 시기""라고 말했다.대표적인 중국 관련주인 면세업종과 화장품업종 역시 한한령 해제 기대감에 최근 주가가 오름세를 기록했다. 올해 1월13일 종가 기준 32만4000원까지 올랐던 신세계는 코로나19 사태 여파 등으로 지난달 19일 주가가 20만4000원까지 떨어졌었다. 이후 한한령 기대감이 올라가면서 전날 25만2000원까지 상승했다.호텔신라 역시 지난달 23일 6만1800원까지 내렸던 주가가 전날 기준 7만7600원까지 오르며 25.57%가량 상승했다. LG생활건강은 지난달 106만6000원 내렸던 주가가 133만7000원까지 오르며 V자 회복세를 보였다. 아모레 역시 코로나19 사태 이후 급하락했던 주가가 오르며 조금씩 회복세를 보이며 에서 지난달 14만원대까지 내려갔던 주가가 전날 17만5000원으로 올라왔다.면세 및 화장품 업종은 코로나19 이후 따이공(중국 보따리상)의 면세점 수요증가 및 중국 온라인 수요 증가가 기대되고 있다는 평가다.성준원 신한금융투자 연구원은 ""LG생활건강의 화장품 판매 채널에서 가장 큰 매출 비중을 차지하는 것이 면세 채널로 면세 시장이 회복한다면 최대 수혜주""라면서 ""면세 채널이 2분기 또는 3분기 중에 회복을 시작한다면 LG생활건강은 큰 수혜를 받을 수 있는 회사""라고 강조했다. jey@newsis.com<ⓒ 공감언론 뉴시스통신사. 무단전재-재배포 금지>",/news/news_read.nhn?article_id=0009829780&office_id=003&mode=search&query=LG생활건강&page=5
,"지난해 30대 상장사 직원 평균 연봉이 가장 많이 오른 기업은 셀트리온인 것으로 조사됐다.취업포털 잡코리아가 시가총액 상위 30대 기업의 사업보고서를 분석한 결과 셀트리온의 지난해 평균 연봉이 6900만원으로 전년 대비 16.9% 올라 가장 상승폭이 컸다고 23일 밝혔다.이어 ‘삼성바이오로직스’가 평균 7500만원으로 전년(6500만원) 대비 15.4% 오른 것으로 나타났다. LG생활건강(12.7%), 네이버(9.7%), SK하이닉스(9.4%) 순으로 직원 연봉이 많이 오른 것으로 나타났다.남성 직원의 평균연봉 상승폭이 가장 큰 기업은 ‘삼성바이오로직스’다. 남성직원 연봉이 평균 8300만원으로 전년(7100만원) 대비 16.9% 상승한 것으로 조사됐다. 이어 셀트리온(12.5%), 네이버(9.5%), LG생활건강(9.0%), SK하이닉스(7.8%)와 삼성SDS(7.8%) 순으로 남성 직원 연봉이 많이 오른 것으로 나타났다.여성 직원 평균연봉이 가장 많이 오른 기업은 ‘셀트리온’으로 여성직원 연봉이 평균 6400만원으로 전년(5300만원)에 비해 20.8%의 높은 상승폭을 보였다. 이어 기아자동차(18.0%), 삼성바이오로직스(15.8%), LG생활건강(15.2%), 넷마블(12.1%) 순으로 직원 연봉이 많이 오른 것으로 조사됐다.지난해 국내 30대 상장사의 직원 연봉은 평균 9025만원으로 집계됐다. 전년(2018년) 동일 기업의 직원연봉 평균(9147만원)에 비해 1.3% 하락한 수준이다.한편 30대 상장사 중 지난해 직원 연봉이 가장 높은 기업은 ‘SK하이닉스’로 작년 직원 1인당 평균연봉이 1억1747만원이었다. 이어 SK텔레콤(1억1600만원)과 SK이노베이션(1억1600만원)이 높아 SK 계열사 3사가 1~3위를 차지했다. 에쓰오일(1억1032만원), 삼성전자(1억800만원)가 뒤를 이었다.[김강한 기자 kimstrong@chosun.com] 		▶
		▶ 		▶
	- Copyrights ⓒ 조선일보 & chosun.com, 무단 전재 및 재배포 금지 -",/news/news_read.nhn?article_id=0003525860&office_id=023&mode=search&query=LG생활건강&page=5
,"지난해 국내 30대 상장사 가운데 ‘셀트리온’의 직원연봉 상승폭이 가장 높은 것으로 나타났다. 23일 잡코리아가 시가총액 상위 30대 기업의 사업보고서를 분석한 결과 지난해 국내 30대 상장사의 직원연봉이 평균 9025만원으로 집계됐다. 전년 동일기업의 직원연봉 평균 9147만원에 비해 1.3% 하락한 것이다.남성 직원과 여성 직원의 평균연봉 격차는 약 3000만원에 가까웠다.남성 직원의 평균연봉은 9793만원으로 여성 직원의 평균연봉 6821만원 보다 2972만원이 높았다. 전년대비 연봉 상승폭은 남성 직원 평균연봉은 전년(9985만원) 대비 1.9% 하락했고 여성 직원 평균연봉은 전년(6708만원) 대비 1.7% 상승한 것으로 집계됐다.지난해 직원연봉이 가장 많이 오른 기업은 ‘셀트리온’으로 올해 직원연봉 평균은 6900만원으로 전년(평균 5900만원) 대비 16.9% 올라 평균연봉 상승폭이 가장 큰 것으로 조사됐다.이어 ‘삼성바이오로직스’도 올해 직원연봉이 평균 7500만원으로 전년(6500만원) 대비 평균연봉이 15.4% 오른 것으로 나타났다. 그 다음으로는 ▲LG생활건강(12.7%) ▲네이버(9.7%) ▲SK하이닉스(9.4%) 순으로 직원연봉이 많이 오른 것으로 나타났다.남성 직원의 평균연봉 상승폭이 가장 큰 기업은 ‘삼성바이오로직스’로 남성직원 연봉이 평균 8300만원으로 전년(7100만원) 대비 16.9% 상승한 것으로 조사됐다.이어 ▲셀트리온(12.5%) ▲네이버(9.5%) ▲LG생활건강(9.0%) ▲SK하이닉스(7.8%)와 삼성SDS(7.8%) 순으로 남성직원 연봉이 많이 오른 것으로 나타났다.여성 직원 평균연봉이 가장 많이 오른 기업은 ‘셀트리온’으로 여성직원 연봉이 평균 6400만원으로 전년(5300만원)에 비해 20.8%의 높은 상승폭을 보였다.이어 ▲기아자동차(18.0%) ▲삼성바이오로직스(15.8%) ▲LG생활건강(15.2%) ▲넷마블(12.1%) 순으로 여성직원연봉이 많이 오른 것으로 조사됐다.30대 상장사 중 지난해 직원연봉이 가장 높은 기업은 ‘SK하이닉스’로 작년 직원 1인당 평균연봉이 1억1747만원으로 가장 높았다. 이어 SK텔레콤(1억1600만원)과 SK이노베이션(1억1600만원)이 높아 SK 계열사 3사가 1~3위를 차지했다. 다음으로는 에쓰오일(1억1032만원), 삼성전자(1억800만원) 순으로 직원연봉이 높았다.이한듬 기자 mumford@mt.co.kr
<저작권자 ⓒ '성공을 꿈꾸는 사람들의 경제 뉴스' 머니S, 무단전재 및 재배포 금지>",/news/news_read.nhn?article_id=0000534512&office_id=417&mode=search&query=LG생활건강&page=5
30대 상장사 전체 직원의 연봉은 1.3% 감소해 ‘평균 9025만원’직원연봉이 가장 높은 기업 ‘SK하이닉스’ 평균 1억1747만원,"[서울=뉴시스] 김종민 기자 = 지난해 국내 30대 상장사의 직원연봉이 평균 1.3% 하락한 가운데, ‘셀트리온’과 ‘삼성바이오로직스’의 직원연봉 상승폭이 두드러져 눈길을 끌고 있다. 23일 잡코리아가 시가총액 상위 30대 기업의 사업보고서를 분석한 결과,
지난해 국내 30대 상장사의 직원연봉이 평균 9025만원으로 집계됐다. 전년(2018년) 동일기업의 직원연봉 평균(9147만원)에 비해 1.3% 하락한 수준이다.남성 직원과 여성 직원의 평균연봉 격차는 약 3000만원에 가까웠다. 지난해 직원연봉이 가장 많이 오른 기업은 ‘셀트리온’으로 올해 직원연봉 평균은 6900만원으로 전년(평균 5900만원) 대비 16.9% 올라, 평균연봉 상승폭이 가장 큰 것으로 조사됐다. 이어 ‘삼성바이오로직스’도 올해 직원연봉이 평균 7500만원으로 전년(6500만원) 대비 평균연봉이 15.4% 오른 것으로 나타났다.
그 다음으로는 ▲LG생활건강(12.7%) ▲네이버(9.7%) ▲SK하이닉스(9.4%) 순으로 직원연봉이 많이 오른 것으로 나타났다. 남성 직원의 평균연봉 상승폭이 가장 큰 기업은 ‘삼성바이오로직스’로 남성직원 연봉이 평균 8300만원으로 전년(7100만원) 대비 16.9% 상승한 것으로 조사됐다.이어 ▲셀트리온(12.5%) ▲NAVER(9.5%) ▲LG생활건강(9.0%) ▲SK하이닉스(7.8%)와 삼성SDS(7.8%) 순으로 남성직원 연봉이 많이 오른 것으로 나타났다.여성 직원 평균연봉이 가장 많이 오른 기업은 ‘셀트리온’으로 여성직원 연봉이 평균 6400만원으로 전년(5300만원)에비해 20.8%의 높은 상승폭을 보였다.이어 ▲기아자동차(18.0%) ▲삼성바이오로직스(15.8%) ▲LG생활건강(15.2%) ▲넷마블(12.1%) 순으로 직원연봉이 많이 오른 것으로 조사됐다. 한편, 30대 상장사 중 지난해 직원연봉이 가장 높은 기업은 ‘SK하이닉스’로 작년 직원 1인당 평균연봉이 1억1747만원으로가장 높았다. 이어 SK텔레콤(1억1600만원)과 SK이노베이션(1억1600만원)이높아 SK 계열사 3사가 1~3위를 차지했다. 다음으로는 S-Oil(1억1032만원), 삼성전자(1억800만원) 순으로 직원연봉이 높았다. jmkim@newsis.com<ⓒ 공감언론 뉴시스통신사. 무단전재-재배포 금지>",/news/news_read.nhn?article_id=0009829870&office_id=003&mode=search&query=LG생활건강&page=5
▶ 헉! 소리나는 스!토리 뉴스 [헉스]▶ '아는 척'하고 싶은 당신을 위한 [두유노우],"[파이낸셜뉴스] 지난해 국내 30대 상장사의 직원연봉이 평균 1.3% 하락한 가운데, ‘셀트리온’과 ‘삼성바이오로직스’의 직원연봉 상승폭이 두드러져 눈길을 끌고 있다. ‘셀트리온’과 ‘삼성바이오로직스’는 최근 코로나19 치료제와 백신을 개발중인 바이오.의료분야의 기업으로 각광받고 있기도 하다.
 취업성공 플랫폼 잡코리아가 시가총액 상위 30대 기업의 사업보고서를 분석한 결과, 지난해 국내 30대 상장사의 직원연봉이 평균 9025만원(천단위 절사)으로 집계됐다. 전년(2018년) 동일기업의 직원연봉 평균(9147만원)에 비해 1.3% 하락한 수준이다.
 남성 직원과 여성 직원의 평균연봉 격차는 약 3000만원에 가까웠다.
 남성 직원의 평균연봉은 9793만원으로 여성 직원의 평균연봉 6821만원 보다 2972만원이 높았다. 전년대비 연봉 상승폭은 남성 직원 평균연봉은 전년(9985만원) 대비 1.9% 하락했고, 여성 직원 평균연봉은 전년(6천708만원) 대비 1.7% 상승한 것으로 집계됐다.
 지난해 직원연봉이 가장 많이 오른 기업은 ‘셀트리온’으로 올해 직원연봉 평균은 6900만원으로 전년(평균5900만원) 대비 16.9% 올라, 평균연봉 상승폭이 가장 큰 것으로 조사됐다.
 이어 ‘삼성바이오로직스’도 올해 직원연봉이 평균 7500만원으로 전년(6500만원) 대비 평균연봉이 15.4% 오른 것으로 나타났다. 그 다음으로는 △LG생활건강(12.7%) △네이버(9.7%) △SK하이닉스(9.4%) 순으로 직원연봉이 많이 오른 것으로 나타났다.
 남성 직원의 평균연봉 상승폭이 가장 큰 기업은 ‘삼성바이오로직스’로 남성직원 연봉이 평균 8300만원으로 전년(7100만원) 대비 16.9% 상승한 것으로 조사됐다.
 이어 △셀트리온(12.5%) △NAVER(9.5%) △LG생활건강(9.0%) △SK하이닉스(7.8%)와 삼성SDS(7.8%) 순으로 남성직원 연봉이 많이 오른 것으로 나타났다.
 여성 직원 평균연봉이 가장 많이 오른 기업은 ‘셀트리온’으로 여성직원 연봉이 평균 6400만원으로 전년(5300만원)에 비해 20.8%의 높은 상승폭을 보였다.
 이어 △기아자동차(18.0%) △삼성바이오로직스(15.8%) △LG생활건강(15.2%) △넷마블(12.1%) 순으로 직원연봉이 많이 오른 것으로 조사됐다.
 한편, 30대 상장사 중 지난해 직원연봉이 가장 높은 기업은 ‘SK하이닉스’로 작년 직원 1인당 평균연봉이 1억1747만원으로 가장 높았다. 이어 SK텔레콤(1억1600만원)과 SK이노베이션(1억1600만원)이 높아 SK 계열사 3사가 1~3위를 차지했다. 다음으로는 S-Oil(1억1032만원), 삼성전자(1억800만원) 순으로 직원연봉이 높았다.




※ 저작권자 ⓒ 파이낸셜뉴스. 무단 전재-재배포 금지",/news/news_read.nhn?article_id=0004413182&office_id=014&mode=search&query=LG생활건강&page=5
