head,text,url
SK하이닉스영업익 기대치 높아도 주가 하락현대차·LG생활건강실적부진 전망에도 주가 올라,"23일 코스피 시가총액 상위기업들의 실적발표가 줄을 잇는다. 코로나19로 기업들의 실적 악화를 향한 우려가 끊임없이 나왔지만, 실제 시장에서는 ‘어닝쇼크’(실적 악화) 혹은 ‘어닝 서프라이즈’(실적 호전)로 불리는 ‘어닝 효과’는 제한됐다.이날 코스피 시총 순위 10위권 안에 있는 SK하이닉스, LG생활건강, 현대차가 실적을 발표한다. 그동안 코로나19 확산세 속에 비교적 건재했던 SK하이닉스와 달리 소비재를 생산하는 LG생활건강과 자동차 업종인 현대차는 상대적으로 주가 타격이 컸다.그러나 코로나19 확산 국면에서 미리 반영된 우려와 기대감으로 인해 이날 실적발표에 따른 주가 움직임은 제한됐다.이날 개장 전 실적을 발표한 SK하이닉스는 1분기 영업이익이 8003억100만원이라고 공시했다. 이는 지난해 1분기(1조3665억원)와 비교하면 41.4% 줄어든 수치지만, 시장 기대치(5091억원)을 훌쩍 웃도는 성적이다. 그러나 이날 주가는 전장대비 1.43% 상승한 8만5100원으로 장을 시작한 뒤, 장초반 1%대 하락폭으로 돌아섰다.이같이 사라진 어닝효과는 코로나19 증시에서 기업들의 개별 실적보다 글로벌 정세나 정책 대응의 영향력이 확대된 결과로 볼 수 있다.하인환 메리츠종금 연구원은 “현재 코스피는 어닝효과보다 전반적인 정책 대응과 유동성 공급 측면의 영향력이 큰 상황”이라며 “1분기 실적에서 선방했더라도 해외 코로나 확산이 본격화된 3월 이후 피해는 진행형인 만큼 2분기 우려감이 남아있어 주가 상승으로 이어지는 효과는 제한적”이라고 분석했다.실적하락이 점쳐진 LG생활건강, 현대차 등도 오히려 주가가 상승세를 보이며 ‘어닝 효과’를 무색하게 했다.자동차 업종 대장주인 현대차는 이날 오전 코스피 상승장에서 장중 1% 안팎 상승폭을 기록하며 지난 3거래일간의 하락폭을 일부 만회했다. 에프엔가이드의 1분기 시장컨센서스에 따르면 현대차 매출 전망치는 23조2212억, 영업이익 전망치는 7147억원이다.실적 부진이 예상되는 LG생활건강 역시 이날 전장대비 2.39% 상승한 136만9000원으로 장을 시작했다. 에프앤가이드에 따르면 LG생활건강의 1분기 매출과 영업이익 컨센서스는 각각 1조7394억원, 2324억원으로, 전년동기 대비 약 7%, 28% 줄었다. 김유진 기자
- Copyrights ⓒ 헤럴드경제 & heraldbiz.com, 무단 전재 및 재배포 금지 -",/news/news_read.nhn?article_id=0001665666&office_id=016&mode=search&query=LG생활건강&page=4
,"[머니투데이 한정수 기자]
올해 1분기 실적 발표를 앞둔 LG생활건강이 상승세를 이어가고 있다. 이달 들어 주가가 20% 넘게 상승했다. 코로나19(COVID-19) 사태가 지나면 성장세가 가팔라질 수 있다는 기대감이 주가에 긍정적인 영향을 주고 있다는 분석이 나온다. 23일 오전 11시 현재 LG생활건강은 전 거래일 대비 2만7000원(2.02%) 오른 136만4000원에 거래되고 있다. 주가는 이달 초 107만1000원에서 전날 133만7000원까지 급등했다. 이 기간 기관 투자자들이 1100억원 이상을 순매수하며 주가를 끌어올렸다. 이달 기관 매수 상위 종목 1위에 LG생활건강이 올라 있다. 대부분의 증권사들은 올해 1분기 LG생활건강이 코로나19로 인해 낮아진 시장 전망치에 부합하는 실적을 낼 것으로 전망하고 있다. 화장품의 면세점 매출이 줄어들 수밖에 없는 상황이지만 음료 부문과 생활용품 부문이 성장하면서 전체적으로는 양호한 실적을 낼 것이라는 전망이 우세하다. 일각에서는 '깜짝 실적'을 낼 가능성이 있다는 의견도 나온다. LG생활건강의 최근 상승세는 올해 하반기 이후 성장 가능성이 높다는 점이 부각된 결과라는 분석이다. LG생활건강은 포트폴리오 다각화를 시도 하고 있다. '후'와 '숨'으로 럭셔리 시장을 공략 중이다. 매출 비중이 큰 중국 시장의 변화에 발맞춘 행보다. 올해 중국 화장품 시장 내 프리미엄 제품 비중은 31.6%로 예상되는데 이는 5년 전에 비해 10%포인트 가까이 늘어난 수치다. 최근 인기가 높아지고 있는 더마화장품(의약품 수준의 기능성 화장품) 시장에도 진출했다. 2014년 인수한 '차앤박'의 지난 5년간의 연간 매출 성장률은 33.7%에 달한다. 최근에는 유럽 대표 더마화장품 브랜드 '피지오겔'의 아시아 및 북미 사업권을 인수하기로 결정했다. 이르면 올해 하반기부터는 실적에 반영될 전망이다. 이 밖에 코로나19 사태로 증시 변동성이 커지고 경기가 침체하면서 안정적인 성장을 이어온 기업에 대한 매력도가 높아졌다는 분석도 있다. LG생활건강은 필수재인 생활용품과 음료 부문 사업과 자유재인 화장품 사업이 적절한 조화를 이루고 있다는 평가를 받는다. 올해 예상 매출 비중을 살펴보면 화장품이 61.8%, 생활용품과 음료가 각각 19.1%다. 특히 LG생활건강은 지난 10여년간 매출과 영업이익이 큰 폭으로 성장해왔다. 메리츠증권에 따르면 2009년부터 지난해까지 LG생활건강의 연평균 성장률은 매출액 13.2%, 영업이익 17.3%에 달한다. 지난해 기준 자기자본이익률(ROE)은 20.1%로 경쟁사 평균 6.1%의 세 배가 넘는다. 이와 관련, 성준원 신한금융투자 연구원은 ""코로나19로 인한 업황 악화는 일시적일 것""이라며 ""화장품 수요는 하반기에 이연수요가 합쳐지면서 성장할 가능성이 높다""고 강조했다. 이어 ""코로나19 이후 면세점 수요와 중국 온라인 수요의 증가가 기대되기 때문에 매수를 추천한다""고 덧붙였다. 한편 LG생활건강은 올해 1분기 실적을 이날 오후 발표할 예정이다. 한정수 기자 jeongsuhan@mt.co.kr
<저작권자 ⓒ '돈이 보이는 리얼타임 뉴스' 머니투데이, 무단전재 및 재배포 금지>",/news/news_read.nhn?article_id=0004399068&office_id=008&mode=search&query=LG생활건강&page=4
,"LG생활건강은 2020년 1분기까지 (연결 기준) 매출액 1조 8964억원, 영업이익 3337억원을 기록했다고 4월 23일 발표했다.분기별 실적의 경우 2020년 1분기 매출액은 1조 8964억원으로 작년 4분기 매출액 2조 133억원 대비 1169억원(-5.8%) 감소했다. 2020년 1분기 영업이익은 3337억원으로 작년 4분기 영업이익 2410억원 대비 927억원 증가했다.한편, LG생활건강의 13시 19분 현재주가는 1,359,000원으로 직전 거래일 대비 22,000원(+1.65%) 상승이며, 거래량은 54,799주이다.공시 전문으로 이동스톡봇 기자※ 이 기사는 국민일보와 엠로보가 개발한 증권뉴스 전용 인공지능 로봇 ‘스톡봇’이 금융감독원 전자공시시스템(DART)과 한국거래소(KRX) 데이터를 토대로 작성한 것입니다. 지속적인 업그레이드를 통해 더욱 풍부하고 정확한 내용을 담아 가겠습니다.GoodNews paper ⓒ , 무단전재 및 재배포금지",/news/news_read.nhn?article_id=0001314467&office_id=005&mode=search&query=LG생활건강&page=4
코로나19 여파에도 매출·영업익 소폭 상승,"(서울=뉴스1) 배지윤 기자 = LG생활건강은 올해 1분기 연결 기준 영업이익이 3337억원을 기록했다고 23일 공시했다. 이는 전년동기(3221억원) 대비 약 3.6% 증가한 수치다. 같은 기간 매출은 1.2% 증가한 1조8964억원을 달성했다.jiyounbae@news1.kr© 뉴스1코리아(), 무단 전재 및 재배포 금지",/news/news_read.nhn?article_id=0004603098&office_id=421&mode=search&query=LG생활건강&page=4
,"[머니투데이 김은령 기자] LG생활건강은 지난 1분기 영업이익이 3337억원으로 전년동기 대비 3.6% 증가했다고 23일 공시했다. 매출액은 1조8964억원으로 1.2% 늘었고 당기 순이익은 2342억원으로 3.7% 증가했다. 김은령 기자 taurus@mt.co.kr
<저작권자 ⓒ '돈이 보이는 리얼타임 뉴스' 머니투데이, 무단전재 및 재배포 금지>",/news/news_read.nhn?article_id=0004399137&office_id=008&mode=search&query=LG생활건강&page=4
,"[아시아경제 조유진 기자] LG생활건강(대표 차석용)은 1분기 영업이익이 3337억원으로 전년동기대비 3.6% 성장했다고 23일 공시했다. 같은 기간 매출은 1조8964억원, 당기순이익 2342억원으로 전년동기대비 각각 1.2%, 3.7% 성장했다. 신종 코로나바이러스감염증(코로나19)로 국내외 사업 환경이 급속도로 위축된 상황에서도 소폭 성장세를 이어가며 1분기 최대 매출과 영업이익을 기록했다.LG생활건강은 ""코로나19의 영향으로 중국 시장이 정상적으로 가동되지 못하는 상황에서도 뷰티 사업은 럭셔리 브랜드들에 대한 견고한 수요에 힘입어 매출과 영업이익 감소의 충격을 최소화했다""고 말했다.생활용품 사업은 매출과 영업이익이 전년동기 대비 각각 19.4%, 50.7%의 성장을 기록, 큰 폭으로 성장하며 전사 실적을 견인했다. 음료 사업 또한 주요 브랜드들의 안정적인 성장을 바탕으로 건실한 실적을 달성했다.전년동기 대비 매출은 2005년 3분기 이후 58분기 성장했고, 영업이익은 2005년 1분기 이후 60분기 증가세를 이어가고 있다.부문별로 화장품 사업의 매출은 전년동기 대비 6.4% 감소한 1조 655억원, 영업이익은 10.0% 감소한 2215억원을 기록했다.지난 2월부터 본격화된 코로나19의 여파로 국내 및 해외 화장품 시장 내 주요 채널의 매출이 급감했고, 특히 중국인을 포함한 외국인 관광객의 현저한 감소로 면세점 채널이 큰 타격을 받았다. 반면 ‘숨’과 ‘오휘’의 초고가 라인이 높은 수요를 기반으로 성장하였고, 더마화장품 CNP 또한 13%의 매출 성장을 이뤘다.생활용품 사업의 매출은 전년동기 대비 19.4% 성장한 4793억원, 영업이익은 50.7% 성장한 653억원을 달성했다. 닥터그루트, 벨먼, 히말라야 핑크솔트 등 프리미엄 브랜드들의 꾸준한 성장이 뒷받침하는 가운데, 코로나19로 인한 소비자 니즈 및 유통 변화에 즉각 대응한 핸드 새니타이저 겔, 핸드워시, 물티슈, 한장 행주 등 다양한 항균 위생용품의 출시로 높은 성장을 이루었다.음료 사업의 매출은 전년 대비 5.0% 성장한 3505억원, 영업이익은 43.9% 성장한 468억원을 달성했다. 코로나19로 인해 극장 이용과 야외 활동 및 외식 등이 줄어 어려움이 있었으나, 배달음식, 온라인 등의 채널에서 수요를 늘리며 매출 성장을 이끌었다. 탄산은 ‘코카콜라’, ‘몬스터에너지’, ‘씨그램’ 등의 성장으로 매출이 전년동기 대비 9% 증가했고, 비탄산도 ‘파워에이드’와 ‘조지아 크래프트’ 등 주요 브랜드들이 꾸준한 성장세를 이어갔다.조유진 기자 tint@asiae.co.kr <ⓒ경제를 보는 눈, 세계를 보는 창 아시아경제 무단전재 배포금지>",/news/news_read.nhn?article_id=0004666748&office_id=277&mode=search&query=LG생활건강&page=4
,"[서울경제] 이 올해 1·4분기 매출 1조8,964억원, 영업이익 3,337억원을 기록했다고 23일 공시했다. 지난해 같은 기간 보다 각각 1.2%, 3.6% 증가한 것이다./이승배기자 bae@sedaily.com저작권자 ⓒ 서울경제, 무단 전재 및 재배포 금지",/news/news_read.nhn?article_id=0003728681&office_id=011&mode=search&query=LG생활건강&page=4
,[이데일리 김호준 기자] LG생활건강(051900)은 올 1분기 영업이익 3337억원을 달성했다고 23일 공시했다. 이는 전년 동기 대비 3.6% 증가한 수치다. 매출액은 1조9864억원으로 전년 동기 대비 1.2% 증가했다. 당기순이익은 2342억원을 기록하며 전년 동기 대비 3.7% 증가했다.김호준 (kazzyy@edaily.co.kr)＜ⓒ종합 경제정보 미디어 이데일리 - 무단전재 & 재배포 금지＞,/news/news_read.nhn?article_id=0004626293&office_id=018&mode=search&query=LG생활건강&page=4
,"시장 전망치 43.9% 상회(서울=연합뉴스) 코스피 상장사 LG생활건강은 연결 기준 올해 1분기 영업이익이 3천337억원으로 지난해 동기보다 3.6% 증가한 것으로 잠정 집계됐다고 23일 공시했다.

이번 영업이익은 연합인포맥스가 집계한 시장 전망치 2천320억원을 43.9% 상회했다.

매출은 1조8천964억원으로 작년 동기 대비 1.2% 증가했다. 순이익은 2천342억원으로 3.7% 늘었다.

※ 이 기사는 연합인포맥스와 한국거래소(KRX)의 데이터를 토대로 알고리즘에 의해 자동 작성돼 편집자의 데스킹을 거쳤습니다.",/news/news_read.nhn?article_id=0011567069&office_id=001&mode=search&query=LG생활건강&page=4
,"[서울=뉴시스] 이진영 기자 = 네이버가 물류업체와 협력에 본격 나섰다. 막강한 쇼핑 플랫폼을 바탕으로 이제 배송까지 손을 뻗은 것이다. 빠른 배송 경쟁력을 바탕으로 이커머스 강자가 된 쿠팡에 맞서 이커머스 시장을 장악하기 위해 속도를 내고 있다는 분석이다. 한성숙 네이버 대표는 23일 올해 1분기 실적 발표 직후 이뤄진 컨퍼런스콜에서 ""향후 비대면 라이브 커머스 분야를 강화함과 동시에 다양한 브랜드, 물류 업체들과도 협력을 확대할 계획이다""라고 밝혔다. 한 대표는 ""코로나19 의 확산은 광고 등 마케팅 수요 감소 측면에서 위기이지만 비대면 서비스 활성화 측면에서는 다양한 기회 요인으로 작용하고 있다""며 ""사회적 거리두기 영향으로 오프라인 활동이 감소하며 온라인 쇼핑에 대한 수요가 증가했고 네이버 스마트스토어의 거래액은 전년동기 대비 56% 성장했다""라고 알렸다. 이에 따라 ""1월 실사용자 수 800만명 내외로 소폭 성장세를 유지하던 스마트스토어 구매자 수는 2월 900만명에서 3월 1000만명까지 확대됐고, 특히 20대와 40대 이상의 첫 구매자가 큰 폭으로 늘었다""고 말했다. 아울러 ""3월 새롭게 개설된 스마트스토어는 역대 최고치인 3만7000개를 기록하며 언택트(비대면) 문화 확산이 온라인 쇼핑 창업으로 이어지는 모습도 확인할 수 있었다""라고 설명했다. 또 ""네이버 판매자 기반을 중소상공인에서 브랜드로 확장하고자 준비한 브랜드스토어는 1분기 30개가 오픈됐고 올해 200개 달성을 목표로 하고 있다""라고 전했다. 특히 한 대표는 ""이번에 새롭게 브랜드 스토어를 오픈한 LG생활건강은 온라인 수요가 급증하고 있는 생필품 영역에서 보다 빠른 배송과 편의성을 제공하기 위해 CJ대한통운과의 파트너십을 맺고, 자사 브랜드스토어에서 자정까지 주문한 상품을 24시간내 배송하는 서비스를 시작했다""라고 알렸다. 이어 ""브랜드스토어를 기반으로 진행되는 첫 물류 협력 사례인 만큼 그 성과와 개선점을 잘 모니터링해, 향후 생필품, 패션, 가전, 가구 등 상품군별로 상이한 배송 수요가 네이버쇼핑 안에서 잘 대응할 수 있도록 브랜드 물류업체들과 다양한 협력 방안을 모색해 나갈 계획이다""라고 언급했다. 이커머스 시장에서 네이버쇼핑과 쿠팡의 선두 경쟁이 치열한 가운데 네이버가 쿠팡이 절대 우위를 보이고 있는 배송 경쟁력에도 눈을 돌린 것이다. 하지만 쿠팡처럼 물류센터에 직접 투자를 하는 형태가 아닌 우선 대형 물류업체와 제휴하는 방식으로 방향을 잡으며 추격에 나선 모습이다. 한 대표는 ""네이버쇼핑은 일괄해서 단일한 형태로 배송해 제공하는 것이 아니라 스마트스토어들의 상품 특성, 기업 규모 등에 따라 다양한 배송 체계를 제공할 계획이다""라며 ""단순히 빠른 것 외에 정확하게, 고급스럽게 등 다양한 배송 수요가 있을 것이고, 협력 방안을 마련하고 있다""라고 말했다. 아울러 네이버는 1분기는 잘 견뎌냈지만 코로나 사태가 장기화될 경우 2분기부터는 사업에 타격이 미칠 수 있을 것에 대해 우려했다. 박상진 네이버 최고재무책임자(CFO) ""코로나 사태로 온라인 사업 영역은 기대한 것보다 좋은 성과를 냈지만 대형 광고주에 주로 의존하는 광고쪽은 매출이 주는 두 가지 상황이 합쳐지면서 영향이 중립적이었다""며 ""그러나 코로나 사태가 장기화될 경우 2분기부터는 부정적으로 작용할 수 있다""라고 내다봤다. 이어 박 CFO는 ""네이버는 이런 큰 위기 상황을 헤쳐나갈 수 있는 건전한 재무구조를 갖췄다""며 ""위험과 동시에 사업 기회를 검토해 성장을 위한 투자는 지속할 것""이라고 덧붙였다.한편 네이버의 이번 1분기 실적은 코로나 사태에도 성장세를 이어갔다. 네이버는 연결 재무제표 기준 올 1분기 영업이익이 2215억원으로 전년 동기에 비해 7.4% 증가한 것으로 잠정 집계됐다고 공시했다. 같은 기간 매출은 1조7321억원으로 14.6% 늘었다. 순이익은 1349억원으로 54.0% 확대됐다. mint@newsis.com<ⓒ 공감언론 뉴시스통신사. 무단전재-재배포 금지>",/news/news_read.nhn?article_id=0009830936&office_id=003&mode=search&query=LG생활건강&page=4
,"[헤럴드경제=박로명 기자] LG생활건강은 지난 1분기 영업이익이 3337억원으로 전년 대비 3.6% 증가했다고 23일 공시했다. 매출액은 1조8964억원으로 1.2% 늘었고 당기 순이익은 2342억원으로 3.7% 증가했다.LG생활건강은 “신종 코로나바이러스 감염증(코로나19)로 국내외 사업 환경이 급속도로 위축된 상황에서도 역대 최고의 1분기 매출과 영업이익을 기록했다”며 “중국 시장이 정상적으로 가동되지 못하는 상황에서도 뷰티 사업은 럭셔리 브랜드들에 대한 견고한 수요에 힘입어 매출과 영업이익 감소의 충격을 최소화했다”고 밝혔다.사업 부문 별로는 뷰티 사업의 매출이 전년 대비 6.4% 감소한 1조 665억원, 영업이익이 10% 감소한 2215억원을 기록했다. 지난 2월부터 본격화된 코로나19의 영향으로 국내 및 해외 화장품 시장 내 주요 채널의 매출이 급감했다. 특히 중국인을 포함한 외국인 관광객의 현저한 감소로 면세점 채널이 큰 타격을 받았다.생활용품 사업의 매출은 전년 대비 19.4% 성장한 4793억원, 영업이익은 50.7% 증가한 653억원을 기록했다. 코로나19 영향으로 위생용품의 수요가 증가하고 온라인 및 소형 슈퍼의 이용률이 증가하는 시장 변화가 있었다. 핸드 새니타이저 겔, 핸드워시, 물티슈, 한장 행주 등 다양한 항균 위생용품의 출시로 높은 성장을 이루었다.음료 사업의 매출은 전년 대비 5.0% 증가한 3505억원, 영업이익은 43.9% 성장한 468억원을 기록했다. 코로나19로 인해 극장 이용과 야외 활동 및 외식 등이 줄어 어려움이 있었으나, 배달음식, 온라인 등의 채널에서 수요를 늘리며 매출을 성장시켰다.dodo@heraldcorp.com
- Copyrights ⓒ 헤럴드경제 & heraldbiz.com, 무단 전재 및 재배포 금지 -",/news/news_read.nhn?article_id=0001665801&office_id=016&mode=search&query=LG생활건강&page=4
,"LG생활건강은 지난 1분기 영업이익이 3337억원으로 전년 동기대비 3.6% 증가했다고 23일 공시했다.같은 기간 매출은 1조8964억원으로 1.2% 늘었다. 당기순이익은 3.7% 증가한 2342억원을 기록했다.[디지털뉴스국 신미진 기자] [ⓒ 매일경제 & mk.co.kr, 무단전재 및 재배포 금지]",/news/news_read.nhn?article_id=0004562537&office_id=009&mode=search&query=LG생활건강&page=4
"2020년 1분기 매출 1조 8964억원·영업이익 3337억원화장품 총 매출 줄었지만 숨·오휘 등 초고가라인 성장개인위생 강화로 생활용품 수요 늘고, 배달로 음료도↑","LG생활건강 로고. (사진=LG생활건강)[이데일리 이윤화 기자] LG생활건강이 코로나19로 국내외 사업 환경이 급속도로 위축된 상황에서도 역대 최고의 1분기 매출과 영업이익을 기록했다.LG생활건강은 2020년 1분기 매출 1조 8964억원, 영업이익 3337억원, 당기순이익 2342억원을 달성하며 전년동기 대비 각각 1.2%, 3.6%, 3.7% 성장했다고 23일 밝혔다. 코로나19의 영향으로 중국 시장이 정상적으로 가동되지 못하는 상황에서도 뷰티 사업은 럭셔리 브랜드들에 대한 견고한 수요에 힘입어 매출과 영업이익 감소의 충격을 최소화했다. 생활용품인 HPC(에이치피시·Home & Personal Care) 사업은 매출과 영업이익이 전년동기 대비 각각 19.4%, 50.7%의 성장을 기록, 큰 폭으로 성장하며 전사 실적을 견인했다. 리프레시먼트(음료) 사업 또한 주요 브랜드들의 안정적인 성장을 바탕으로 건실한 실적을 달성했다. 전년동기 대비 매출은 2005년 3분기 이후 58분기 성장했고, 영업이익은 2005년 1분기 이후 60분기 증가세를 이어가고 있다. 세부 사업군별 실적을 살펴보면 화장품을 주력으로 한 뷰티 사업 매출은 전년 동기 대비 6.4% 감소한 1조 665억원, 영업이익은 10.0% 감소한 2215억원을 기록했다. 지난 2월부터 본격화된 코로나19의 여파로 국내 및 해외 화장품 시장 내 주요 채널의 매출이 급감했고, 특히 중국인을 포함한 외국인 관광객의 현저한 감소로 면세점 채널이 큰 타격을 받았다. 반면 ‘숨’과 ‘오휘’의 초고가 라인이 높은 수요를 기반으로 성장하였고, 더마화장품 ‘CNP’ 또한 13%의 매출 성장을 기록했다.
생활용품 사업의 매출은 전년동기 대비 19.4% 성장한 4793억원, 영업이익은 50.7% 성장한 653억원을 달성했다. 소비심리가 위축되고 대형마트 등 다중 이용시설의 기피 현상이 두드러지는 한편, 위생용품의 수요가 증가하고 온라인 및 소형 슈퍼의 이용률이 증가하는 시장의 변화가 있었다. 특히 닥터그루트, 벨먼, 히말라야 핑크솔트 등 프리미엄 브랜드들의 꾸준한 성장이 뒷받침하는 가운데, 코로나바이러스로 인한 소비자 니즈 및 유통 변화에 즉각 대응한 핸드 새니타이저 겔, 핸드워시, 물티슈, 한장 행주 등 다양한 항균 위생용품의 출시로 높은 성장을 이뤘다. 리프레시먼트 사업의 매출은 전년 대비 5.0% 성장한 3505억원, 영업이익은 43.9% 성장한 468억원을 달성했다. 코로나19로 인해 극장 이용과 야외 활동 및 외식 등이 줄어 어려움이 있었으나, 배달음식, 온라인 등의 채널에서 수요를 늘리며 매출을 성장시켰다. 탄산은 ‘코카콜라’, ‘몬스터에너지’, ‘씨그램’ 등의 성장으로 매출이 전년 동기 대비 9% 증가했고, 비탄산도 ‘파워에이드’와 ‘조지아 크래프트’ 등 주요 브랜드들이 꾸준한 성장세를 이어갔다.이윤화 (akfdl34@edaily.co.kr)＜ⓒ종합 경제정보 미디어 이데일리 - 무단전재 & 재배포 금지＞",/news/news_read.nhn?article_id=0004626309&office_id=018&mode=search&query=LG생활건강&page=4
