head,text,url
,"[머니투데이 세종=유선일 기자, 박준식 기자] [편집자주] 공정거래위원회가 관여하는 기업집단과 시장거래 사건의 전후 이야기를 전달합니다.[[공정위리포트]] 지난 6일 오후 조성욱 공정거래위원회 위원장은 송파구 쿠팡 본사를 찾아 김범석 대표를 직접 만났다. 조 위원장이 방문한 목적은 온라인 상품몰 대표격인 쿠팡에 자율규제를 당부하기 위해서였다. 코로나19 사태 이후 상당수 입점판매자들이 마스크 부당거래와 끼워팔기 등을 자행하고 있어서다. 코로나 사태가 확산한 이면에서 쿠팡은 최대실적을 갈아치우고 있다. 대면접촉을 기피 하는 시류를 올라타고 쿠팡의 지난달 결제 금액은 1조6300억원을 기록해 지난해 같은 기간 6793억원 보다 140% 가량 늘었다. 쿠팡과 로켓배송이 국민들 생필품을 긴요히 전달한 사회적 편익은 크다. 하지만 다른 측면에서 마스크나 손세정제 등 방역물품 부당거래의 온상이 되고 있다는 지적은 외면할 수 없는 문제다. 공정위가 이런 쿠팡에 일단 자정을 촉구하는 이유가 이 시기에 일방적인 제재를 하기보다는 자체적인 규율 마련을 지켜보겠다는 판단을 내린 것이라 볼 수 있다. 세계 최대 온라인 거래기업인 아마존도 자체적인 모니터링을 강화하고 있다. 아마존 사이트에서 손세정제 가격이 400달러까지 치솟자 부당거래업자를 발견하는 즉시 스스로 입점 상태에서 퇴출시키고 있다. 미국 규제 당국은 직접 개입을 고민하는 모양새다. 쿠팡은 2018년 ‘부당 반품’이 적발돼 공정위로부터 시정명령과 과징금 2100만원을 부과받았다. 공정위의 2018년 5월 24일자 의결서(재판 판결문에 해당)에 따르면 쿠팡은 6개 납품업자로부터 사들인 499개 상품(총 2000만원)을 일방적으로 반품시켰다. 반품 사유는 발주 오류, 딜오픈(판매시작) 지연, 거래방식 변경, 납품업자 요청 등으로 다양했다.공정위는 ""쿠팡에 귀책사유가 있거나, 쿠팡의 편의를 위한 것에 불과한 사유로 반품했다""고 지적했다. 쿠팡의 해명에 대해선 ""납품업체의 자발적 요청이 있었다고 볼 만한 객관적 증거가 없다""고 일축했다.공정위는 그러나 최초 9000만원으로 산정한 과징금을 80%나 삭감해줬다. 쿠팡이 적자기업이라는 이유로 벌금을 깎아준 것이다. 우선 ‘조사 협조’를 이유로 20%를 감경해줬고, 이후 '완전자본잠식과 5년 연속 순손실'이란 점을 감안해 총 80%를 감면했다.적자 대신 매출과 시장점유율을 늘리는 전략을 쓰는 쿠팡은 2017년 6389억, 2018년 1조970억이나 영업손실을 냈다.공정위 입장에서 쿠팡은 이른바 '뜨거운 감자'다. 소비자 편익을 위해 적자를 감수하고 있다는 기업이라 잘못을 했어도 쉽게 무거운 과징금을 매기기가 어렵다. 소비자 주권을 내세우지만 그러다 보니 급성장한 유니콘 기업으로 직원 관리 등에서 아마추어적인 행태가 드러난다. 지난 12일 쿠팡 배송직원이 새벽 근무 중 유명을 달리하는 사건이 일어났다. 민주노총은 즉각 계약직 쿠팡맨이 ‘무한경쟁’과 ‘비인간적 노동’에 내몰리고 있다고 목소리를 높였다.쿠팡에 직접고용 된 배송직원들은 최근 3년(2015~2017년)간 배송물량을 3.7배나 늘려왔다. 2015년 1월엔 1명이 평균 56.6개를 배달했지만, 2017년 12월엔 210.4개까지 늘었다. 코로나로 배송이 폭증한 올 2월 데이터는 아직 나오지 않았지만 2년여 전보다 두 배 이상 늘었을 거란 예측도 나온다. 쿠팡맨들은 새벽배송 중단과 노동자 휴식권 보장, 비정규직의 정규직화, 정규직 고용 원칙, 배송지 환경 등을 요구한다. 쿠팡은 ""개인 배송역량, 지역 여건을 종합해 업무를 배정하겠다""고 밝혔다.공정위는 내부적으로 쿠팡의 납품업체 대상 갑질 혐의 조사에 다시 착수했다. 지난해 이뤄진 4건 ‘무더기 신고’ 가운데 2건(신고자 LG생활건강, 크린랩)에 대해 불법이 의심된다며 증거 확보에 나선 것이다. 위법성이 확인되면 과징금을 무는 것은 물론, 검찰 고발까지 이뤄질 수 있다.지난해 우아한형제들(5월)과 위메프(6월), LG생활건강(6월), 크린랩(7월)이 잇달아 쿠팡을 갑질 혐의로 신고했다. 우아한형제들과 위메프 건은 각각 분쟁조정과 신고철회로 문제가 풀렸다. 이 과정에서 쿠팡이 경쟁 사업자들과 물밑협상을 했다는 관측도 나왔다. 그러나 나머지 2개사는 주장을 거두지 않았다.LG생활건강은 부당한 주문 취소를, 크린랩은 일방적 거래 중단을 이유로 쿠팡을 신고했다. 쿠팡은 혐의를 부인하지만 이번 공정위 내사는 정밀하게 이뤄지고 있는 것으로 알려졌다. 코로나 시국에서 시장 영향력이 배가된 이 기업에 지난번처럼 솜방망이 처벌이 이뤄질 수는 없을 것이란 예상이 나온다. 조성욱 위원장이 쿠팡을 직접 찾아 자정노력을 신신당부한 까닭에는 이런 배경이 있다.세종=유선일 기자 jjsy83@mt.co.kr, 박준식 기자 win0479@mt.co.kr
<저작권자 ⓒ '돈이 보이는 리얼타임 뉴스' 머니투데이, 무단전재 및 재배포 금지>",/news/news_read.nhn?article_id=0004380927&office_id=008&mode=search&query=LG생활건강&page=2
코스피 1470선 하락 출발…시총 상위종목 3~6%대 하락,"[아이뉴스24 한수연 기자] 코스피가 1470선에서 하락 출발한 가운데 시가총액 상위종목이 일제히 급락했다.23일 오전 9시3분 현재 유가증권시장에서 삼성물산은 전 거래일 대비 6.71%(5천400원) 내린 7만5천100원에 거래되고 있다. NAVER도 6.17%(9천500원) 빠진 14만4천500원을 기록 중이다.SK하이닉스(-5.75%)와 LG화학(-5.69%), 현대차(-5.06%)는 모두 5% 넘게 떨어지고 있다.이 외에도 삼성전자(-4.52%), LG생활건강(-3.69%), 셀트리온(-3.61%), 삼성SDI(-3.46%), 삼성바이오로직스(-3.02%) 등 모든 종목이 추락하고 있다.이날 코스피는 전 거래일 대비 5.86%(91.70포인트) 급락한 1474.45포인트에 거래를 시작했다. 외국인과 기관의 쌍끌이 매도에 주가는 계속 낙폭을 넓히고 있다. papyrus@inews24.com [ⓒ 아이뉴스24 무단전재 및 재배포 금지]",/news/news_read.nhn?article_id=0000530773&office_id=031&mode=search&query=LG생활건강&page=2
,"[아시아경제 조유진 기자] LG생활건강(대표 차석용)은 맞춤형 솔루션을 제공하는 더마코스메틱 브랜드 케어존의 신규 광고 모델로 배우 김동희를 발탁했다고 23일 밝혔다. 김동희는 JTBC 금토드라마 '이태원 클라쓰'에서 장근수 역을 맡아 섬세한 감정선의 입체적인 캐릭터로 많은 사랑을 받고 있다.케어존은 김동희의 ‘멍뭉미’ 넘치는 이미지를 살려 트러블·각질 케어 제품인 ‘아큐어 원샷 각질 토너패드’, ‘딥클린 젠틀 필링젤’의 홍보활동을 진행한다는 계획이다. 이 두 제품은 환절기 일교차와 더불어 상시 마스크 착용으로 잦아지는 피부 자극에 의해 발생한 피부 고민을 케어하고, 매끈 뽀얀 복숭아 피부로 가꿔주는 제품으로 ‘복숭아토너패드’ ‘복숭아필링젤’ 이라는 애칭을 가졌다. 올리브영 온라인몰에서는 신규 출시된 특별기획 제품을 구매한 고객에게 김동희 포토카드를 선착순 증정하는 이벤트도 진행중이다.케어존 마케팅 담당자는 “순수하고 친근한 매력의 김동희 씨는 순한 더마코스메틱 브랜드 케어존의 이야기를 전달하기에 가장 적합한 캐릭터”라면서 “신학기를 앞두고 여러 외부 환경으로 발생한 피부 고민 해결을 위해 준비한 이번 각질케어 기획제품을 영상과 다양한 프로모션을 통해 홍보할 계획”이라고 말했다.조유진 기자 tint@asiae.co.kr <ⓒ경제를 보는 눈, 세계를 보는 창 아시아경제 무단전재 배포금지>",/news/news_read.nhn?article_id=0004647390&office_id=277&mode=search&query=LG생활건강&page=2
,"[머니투데이 김사무엘 기자] 코로나19(신종 코로나바이럭스 감염증)의 글로벌 확진자가 급증하면서 국내 증시도 급락 출발했다.23일 오전 9시 20분 기준 코스피 지수는 전 거래일 대비 103.87포인트(6.61%) 내린 1461.18을 기록 중이다. 지난주 금요일에는 급락에 따른 기술적 반등으로 7%대 상승했으나 이날 급락 출발하며 전 거래일 상승폭을 대부분 반납했다. 투자자별로는 개인이 1369억원 순매수 중인 반면 외국인과 기관은 각각 653억원, 705억원 순매도 중이다.지난주 금요일 한국 증시는 한미 통화스와프 체결 소식에 강세를 보였다. 급등하던 환율이 진정되고 기업들의 신용 위기가 완화될 수 있다는 기대감 때문이었다. 하지만 미국 정부가 준비하던 2조달러(2500조원) 규모의 부양책이 22일(현지시간) 미국 상원에서 통과되지 못했다는 소식에 국내 증시도 약세를 나타내고 있는 것으로 풀이된다. 미국을 비롯한 글로벌 코로나19 환자가 급증 추세인 것도 하락에 영향을 미쳤다.업종별로는 섬유·의복과 의료정밀이 7%대 하락 중이고 음식료품, 화학, 의약품, 전기·전자, 기계, 유통업 등 대부분 종목이 5%대 하락하고 있다.시가총액 상위 주요 종목 중에서는 삼성전자가 5% 안팎 약세를 기록 중이고 SK하이닉스는 7%대 하락 중이다. 삼성바이오로직스, NAVER, 셀트리온, LG화학, LG생활건강, 현대차 등 시총 상위 대부분 업종이 약세다.코스닥 지수는 전일 대비 30.72포인트(6.57%) 내린 437.03을 나타내고 있다. 개인과 외국인이 253억원, 74억원 순매수 중이고 기관은 345억원 순매도를 기록 중이다.코스닥 역시 셀트리온헬스케어, 에이치엘비, 펄어비스, 스튜디오드래곤 등 시총 상위주 대부분이 약세다. 코로나19 진단키트를 공급하는 씨젠은 4%대 강세를 기록하고 있다.김사무엘 기자 samuel@mt.co.kr
<저작권자 ⓒ '돈이 보이는 리얼타임 뉴스' 머니투데이, 무단전재 및 재배포 금지>",/news/news_read.nhn?article_id=0004381017&office_id=008&mode=search&query=LG생활건강&page=2
,"코스피 지수가 장초반 6% 넘게 하락세다.23일 9시 23분 현재 코스피 지수는 97.16포인트(6.29%) 하락한 1467.61에 거래중이다.외국인과 기관이 각각 593억원, 761억원을 동반 순매도하는 가운데 개인이 홀로 1358억원을 사들이고 있다.시가총액 상위 종목들도 줄줄이 큰 폭으로 하락세다. 삼성전자가 5.73% 하락한 4만2800원에 거래중이고 SK하이닉스(-8.42%), 삼성바이오로직스(0-3.02%), 네이버(-8.77%), 셀트리온(-2.95%), LG화학(-6.97%), LG생활건강(-4.05%), 현대차(-06.33%) 등 줄줄이 약세다.코스닥 지수도 전장대비 29.02포인트(6.20%) 하락한 438.83을 기록중이다.지난 주말 미국증시는 또 급락했다. 20일(현지시간) 뉴욕증권거래소(NYSE)에서 다우존스30 산업평균지수는 4.55% 하락했다. 스탠더드앤드푸어스(S&P)500 지수는 4.34%, 나스닥 지수도 3.79% 급락했다.이날 미국 선물시장도 중단됐다. 시카고상품거래소(CME)에서 다우존스 산업평균지수 선물과 S&P500 지수선물은 시간 외 거래에서 개장 직후 가격제한폭인 5% 가까이 빠졌다. 일시적으로 거래를 중단하는 서킷브레이커가 발동됐다.한편 신종 코로나바이러스 감염증(코로나19) 여파로 미국 내 코로나19 감염자는 3만1057명, 사망자는 389명을 기록했다. 전날 2만6000명 수준에서 하루 만에 3만명대를 돌파한 것으로 나타났다.데일리안 이미경 기자 (esit917@dailian.co.kr)ⓒ (주)데일리안 - 무단전재, 변형, 무단배포 금지",/news/news_read.nhn?article_id=0002390709&office_id=119&mode=search&query=LG생활건강&page=2
,"[머니투데이 황국상 기자] [[특징주] ]전주말 급반등했던 한국증시가 재차 약세로 돌아서며 업종 대표주들의 주가가 동반 하락세다.23일 오전 9시25분 현재 전기전자 업종의 삼성전자, SK하이닉스가 각각 5.51%, 7.75% 하락했고 운수장비 업종의 현대차, 현대모비스, 기아차도 6~8%대 낙폭을 기록하고 있다. 주요 업종의 시가총액 상위 종목들이 동반 약세 흐름을 나타내고 있다.음식료 업종의 대장주인 오리온, CJ제일제당도 각각 8.63%, 10.11% 주가가 빠졌다. 섬유의복 업종의 F&F는 5.64%, 한섬은 20.32% 하락했다. 종이목재 업종의 대장주인 한솔제지, 아세아제지 및 화학업종 대표주인 LG화학, LG생활건강, 아모레퍼시픽 등도 3~65대 낙폭을 나타내고 있다.이날 코스피에서 외국인은 863억원 규모를 순매도하며 13거래일째 순매도 흐름을 이어가고 있다. 상대적으로 외국인이 순매수한 업종은 낙폭이 적은 편이다. 이날 매도규모가 거센 와중에서도 외국인은 의약품 업종에서 145억원을 순매수하고 있다. 의약품 업종 대표주인 삼성바이오로직스는 2.67%의 낙폭을 기록하며 여타 업종 대표주들에 비해 낙폭이 상대적으로 작다. 셀트리온도 0.98% 하락한 데 그쳤다. 이날 폭락장세에서도 부광약품, 일양약품, 신풍제약 등은 강보합 내지 강세흐름을 나타내고 있다.황국상 기자 gshwang@mt.co.kr
<저작권자 ⓒ '돈이 보이는 리얼타임 뉴스' 머니투데이, 무단전재 및 재배포 금지>",/news/news_read.nhn?article_id=0004381022&office_id=008&mode=search&query=LG생활건강&page=1
,"손희연 기자 son90@mt.co.kr
<저작권자 ⓒ '성공을 꿈꾸는 사람들의 경제 뉴스' 머니S, 무단전재 및 재배포 금지>",/news/news_read.nhn?article_id=0000521137&office_id=417&mode=search&query=LG생활건강&page=1
,"지난주 한미 통화스와프 효과 반납하고 1,500선 다시 붕괴코스피·코스닥시장 개장 6분 만에 매도 사이드카 발동(서울=연합뉴스) 황재하 기자 = 코스피가 23일 또다시 장 초반 6.9%가량 급락해 장중 1,450대로 떨어졌다.

이날 오전 9시 20분 현재 코스피는 지난 주말 종가보다 105.10포인트(6.71%) 내린 1,461.05를 나타냈다.

장중 한때는 107.74포인트(6.88%) 내린 1,458.41에 거래되며 1,460선도 무너졌다.

지수는 전장보다 91.70포인트(5.86%) 내린 1,474.45로 출발해 하락하고 있다.

이로써 코스피는 지난주 한미 통화스와프 체결 소식으로 급등했던 상승분을 반납하고 그 이전 급락했던 수준으로 돌아갔다.

유가증권시장에서는 기관이 705억원, 외국인이 655억원어치를 순매도했다. 개인은 1천368억원어치를 순매수했다.

지난 20일(현지시간) 뉴욕증시에서는 미국 신종 코로나바이러스 감염증(코로나19) 확산세가 계속되는 영향으로 다우존스30 산업평균지수(-4.55%), 스탠더드앤드푸어스(S&P)500 지수(-4.34%), 나스닥 지수(-3.79%) 모두 급락했다.

이영곤 하나금융투자 연구원은 ""미국 주식시장이 하락세를 이어갔고, 주말 동안 도널드 트럼프 미국 행정부의 2조 달러 규모 부양책에 대해 민주당과 공화당이 합의하지 못하면서 투자심리가 더 얼어붙은 것으로 보인다""고 설명했다.

미국 언론에 따르면 공화당과 민주당 지도부는 트럼프 행정부가 코로나19 대응을 위해 추진 중인 경기 부양 법안을 둘러싼 협상을 진행했으나 22일 오후까지 합의하지 못했다.

시가총액 상위 종목은 SK하이닉스(-7.75%), 네이버(-7.14%), 삼성물산(-6.71%), 현대차(-5.06%), 삼성전자(-4.96%), LG화학(-4.59%), 삼성SDI(-3.93%), LG생활건강(-3.33%), 삼성바이오로직스(-2.09%), 셀트리온(-1.97%) 등 10위 이내 모든 종목이 내렸다.

업종별로도 섬유·의복(-7.5%), 의료정밀(-6.89%), 증권(-6.71%), 금융업(-6.68%), 건설업(-6.68%), 운수·장비(-6.46%), 은행(-6.45%), 유통업(-6.02%) 등 전 종목이 약세다.

같은 시각 코스닥지수는 전 거래일보다 31.44포인트(6.72%) 내린 436.31을 가리켰다.

지수는 전장보다 24.24포인트(5.18%) 내린 443.51에서 출발해 하락세를 이어가고 있다.

한국거래소는 이날 오전 개장 직후 코스피와 코스닥시장에서 각각 5분간 프로그램 매도 호가 효력을 정지하는 매도 사이드카를 발동했다.

코스닥시장에도 기관이 294억원, 외국인이 55억원을 순매도했다. 개인은 335억원을 순매수했다.

시총 상위 종목 가운데는 휴젤(-8.55%), CJ ENM(-6.95%), 헬릭스미스(-5.46%), 에이치엘비(-4.12%), 펄어비스(-3.98%), 케이엠더블유(-3.04%), 스튜디오드래곤(-2.64%), 코미팜(-2.23%), 셀트리온헬스케어(-2.08%) 등 대부분이 내렸다.

상위 10개 종목 가운데는 씨젠(4.56%)만 올랐다.

jaeh@yna.co.kr",/news/news_read.nhn?article_id=0011490855&office_id=001&mode=search&query=LG생활건강&page=1
,"[머니투데이 오정은 기자] [LG생활건강 케어존, 새 광고 모델 김동희와 복숭아 캠페인 진행] LG생활건강이 맞춤형 솔루션을 제공하는 더마코스메틱 브랜드 ‘케어존’의 신규 광고 모델로 배우 김동희를 발탁했다. 김동희는 화제의 JTBC 금토드라마 '이태원 클라쓰'에서 ‘장근수’역을 맡아 섬세한 감정선의 입체적인 캐릭터로 많은 사랑을 받고 있는 대세 배우다. 케어존은 김동희의 ‘멍뭉미’ 넘치는 순둥순둥한 이미지를 살려 트러블 및 각질 케어 제품인 ‘아큐어 원샷 각질 토너패드’, ‘딥클린 젠틀 필링젤’ 2종의 홍보활동을 진행한다. 두 제품은 환절기 일교차와 더불어 상시 마스크 착용으로 잦아지는 피부 자극에 의해 발생한 피부 고민을 케어하고 매끈 뽀얀 복숭아 피부로 가꿔주는 제품으로 ‘복숭아토너패드’ ‘복숭아필링젤’ 이라는 애칭이 붙었다. 최근 ‘귀염뽀짝’한 복숭아 테마 증정품이 포함된 한정 기획 제품을 출시해 소장가치를 높였다.
앞서 공개된 바이럴 영상에서 김동희는 자체발광 피부를 지닌 훈남 선배로 자신의 피부 비결을 궁금해하는 새내기들에게 “나랑 복숭아할래?”라고 물으며 아큐어 원샷 각질 토너패드(복숭아토너패드)를 소개한다.
헬스&뷰티 스토어 올리브영 온라인몰에서는 신규 출시된 특별기획 제품을 구매한 고객에게 김동희 포토카드를 선착순 증정하는 이벤트도 진행중이다.오정은 기자 agentlittle@mt.co.kr
<저작권자 ⓒ '돈이 보이는 리얼타임 뉴스' 머니투데이, 무단전재 및 재배포 금지>",/news/news_read.nhn?article_id=0004381030&office_id=008&mode=search&query=LG생활건강&page=1
,"[서울신문]코스피가 23일 또다시 장 초반 6.9%가량 급락해 장중 1,450대로 떨어졌다.23일 오전 9시 20분 기준 코스피는 지난 주말 종가보다 105.10포인트(6.71%) 내린 1,461.05를 나타냈다. 장중 한때는 107.74포인트(6.88%) 내린 1,458.41에 거래되며 1,460선도 무너졌다. 지수는 전장보다 91.70포인트(5.86%) 내린 1,474.45로 출발해 하락하고 있다.한국거래소는 이날 오전 9시 6분 2초에 선물 가격이 5% 이상 하락한 상태가 1분 이상 지속하면서 이후 5분간 프로그램 매도 호가 효력을 정지하는 매도 사이드카를 발동했다고 밝혔다.이어 오전 9시 17분 34초에는 코스닥150 선물 가격 및 코스닥150 지수가 동반 급락하면서 코스닥시장에서도 프로그램 매도 호가 효력을 5분간 정지하는 매도 사이드카가 발동됐다.유가증권시장에서는 기관이 705억원,외국인이 655억원어치를 순매도했다. 개인은 1천368억원어치를 순매수했다.지난 20일(현지시간) 뉴욕증시에서는 미국 신종 코로나바이러스 감염증(코로나19) 확산세가 계속되는 영향으로 다우존스30 산업평균지수(-4.55%),스탠더드앤드푸어스(S&P)500 지수(-4.34%),나스닥 지수(-3.79%) 모두 급락했다.이영곤 하나금융투자 연구원은 “미국 주식시장이 하락세를 이어갔고, 주말 동안 도널드 트럼프 미국 행정부의 2조 달러 규모 부양책에 대해 민주당과 공화당이 합의하지 못하면서 투자심리가 더 얼어붙은 것으로 보인다”고 설명했다.미국 언론에 따르면 공화당과 민주당 지도부는 트럼프 행정부가 코로나19 대응을 위해 추진 중인 경기 부양 법안을 둘러싼 협상을 진행했으나 22일 오후까지 합의하지 못했다.시가총액 상위 종목은 SK하이닉스(-7.75%),네이버(-7.14%),삼성물산(-6.71%),현대차(-5.06%),삼성전자(-4.96%),LG화학(-4.59%),삼성SDI(-3.93%),LG생활건강(-3.33%),삼성바이오로직스(-2.09%),셀트리온(-1.97%) 등 10위 이내 모든 종목이 내렸다.이보희 기자 boh2@seoul.co.kr▶
▶
▶ⓒ 서울신문(www.seoul.co.kr), 무단전재 및 재배포금지",/news/news_read.nhn?article_id=0003076018&office_id=081&mode=search&query=LG생활건강&page=1
▶ 헉! 소리나는 스!토리 뉴스 [헉스]▶ '아는 척'하고 싶은 당신을 위한 [두유노우]▶ 한눈에 보는 [4·15총선 NEWS MAP],"LG생활건강은 맞춤형 솔루션을 제공하는 더마코스메틱 브랜드 ‘케어존’의 신규 광고 모델로 배우 김동희를 발탁했다고 23일 밝혔다. 김동희는 '이태원 클라쓰'에서 ‘장근수’역을 맡아 섬세한 감정선의 입체적인 캐릭터로 많은 사랑을 받고 있는 대세 배우다.
 케어존은 김동희의 ‘멍뭉미’ 넘치는 순둥순둥한 이미지를 살려 트러블 및 각질 케어 제품인 ‘아큐어 원샷 각질 토너패드’, ‘딥클린 젠틀 필링젤’ 2종의 홍보활동을 진행한다. 이 두 제품은 환절기 일교차와 더불어 상시 마스크 착용으로 잦아지는 피부 자극에 의해 발생한 피부 고민을 케어하고, 매끈 뽀얀 복숭아 피부로 가꿔주는 제품으로 ‘복숭아토너패드’ ‘복숭아필링젤’ 이라는 애칭이 붙었다. 최근, ‘귀염뽀짝’한 복숭아 테마 증정품이 포함된 한정 기획 제품을 출시해 더욱 소장가치를 높였다.
 앞서 공개된 바이럴 영상에서 김동희는 자체발광 피부를 지닌 훈남 선배로 자신의 피부 비결을 궁금해하는 새내기들에게 “나랑 복숭아할래?”라고 물으며 아큐어 원샷 각질 토너패드(복숭아토너패드)를 소개한다. 아큐어 원샷 각질 토너패드는 저자극, 고효능의 4세대 각질제거 성분인 아미노이븐필을 함유한 포뮬러가 피부톤과 결을 매끄럽고 맑게 관리해주고, 엠보면과 거즈면을 모두 갖춘 ‘양면’ 토너패드로 섬세한 피부 관리를 도와준다.
 헬스&뷰티 스토어 올리브영 온라인몰에서는 신규 출시된 특별기획 제품을 구매한 고객에게 김동희 포토카드를 선착순 증정하는 이벤트도 진행중이다.



 ※ 저작권자 ⓒ 파이낸셜뉴스. 무단 전재-재배포 금지",/news/news_read.nhn?article_id=0004394602&office_id=014&mode=search&query=LG생활건강&page=1
