head,text,url
▶ 헉! 소리나는 스!토리 뉴스 [헉스]▶ '아는 척'하고 싶은 당신을 위한 [두유노우],"중국의 사드 보복으로 어려움을 겪었던 K뷰티가 이번엔 코로나19 라는 대형 악재를 만났다. 주요 화장품 업체들의 1·4분기 실적발표가 다가온 가운데 코로나19로 인한 손실이 상당할 것으로 보인다. 주요 브랜드들의 중국 비중이 큰 만큼 앞으로는 중국 현지에서의 매출 회복 여부가 실적 반등의 중요한 조건이 될 전망이다.
 22일 화장품업계에 따르면 23일 LG생활건강을 시작으로 아모레퍼시픽, 에이블씨엔씨 등 주요 화장품 업체들의 실적 발표가 줄줄이 예정돼 있다.
 코로나19라는 예상치 못한 악재로 K뷰티도 상당한 타격을 입었을 것으로 예상된다. LG생활건강, 아모레퍼시픽 모두 면세점 의존도가 높은데 코로나19로 출입국 규제가 강화되면서 면세점 매출이 급감했기 때문이다. LG생활건강의 경우 화장품 영업이익의 50%가 면세점 채널이며 아모레퍼시픽은 다른 부문에서 적자를 내고 있어 사실상 면세점 이익 비중이 100%나 다름 없는 것으로 알려졌다.
 이에 따라 K뷰티 쌍두마차인 LG생활건강, 아모레퍼시픽 모두 이번 1·4분기에는 부진한 실적을 기록할 전망이다. 하나금융투자 박종대 연구원은 ""아모레퍼시픽의 영업이익은 전년동기대비 67% 하락한 610억원, LG생활건강의 영업이익은 34% 줄어든 2143억원까지 떨어질 것""이라고 내다봤다.
 매 분기 사상 최대 실적을 기록해 온 LG생활건강의 신기록 행진도 당분간은 주춤할 전망이다. 지난해 4·4분기에는 최초로 분기매출이 2조원을 넘어섰고 영업이익 역시 2410억원을 기록, 매출과 영업이익 모두 사상 최대 4·4분기 실적을 기록하며 15년 연속 성장이라는 대기록을 달성했다.
 다만 LG생활건강의 경우 화장품 이외에 생활용품, 음료 부문은 코로나19의 영향을 비교적 크게 받지 않은 만큼 다른 화장품 업체들 보다는 양호한 실적을 기록할 것으로 예상된다. 지난해 기준 LG생활건강의 생활용품, 음료부문 매출 비중은 전체의 약 39%에 달한다. LG생활건강 관계자는 ""생활용품의 경우 코로나19로 수요가 증가한 손소독제와 손세정제, 마스크 등의 품목이 속해 있고 음료 역시 배달 음식 수요가 늘어 화장품 부문의 손실을 어느 정도 상쇄해주는 효과가 있을 것으로 기대하고 있다""고 말했다.
 주요 채널인 면세점이 당분간 활성화되기 힘든 만큼 앞으로의 마케팅 방향은 중국 현지 유통 채널로 집중될 것으로 보인다. 박종대 연구원은 ""이들 업체의 향후 실적은 대 중국 브랜드력과 채널 및 마케팅 전략에 따라 차별화될 것으로 예상한다""며 ""두 회사는 모두 중국 현지 법인을 크게 두고 있으며 온·오프라인 채널망을 모두 갖춰 중국 수요만 회복한다면 충분히 그에 부합하는 현지 대응·공급이 가능하다""고 말했다.
 아모레퍼시픽은 올해 중국 현지에서 디지털 사업을 가속화해 나갈 방침이다. 실제 아모레퍼시픽그룹 서경배 회장의 장녀인 서민정 과장은 입사 전 중국에서 MBA과정을 마친 후 징둥닷컴에서 디지털 관련 업무를 배우기도 했다. 지난해 중국 전자상거래업체 알리바바와 업무협약을 맺은 아모레퍼시픽은 올해 라네즈와 마몽드를 시작으로 티몰 전용 제품을 내놓는다. 이어 설화수와 헤라 등 럭셔리 브랜드에서도 티몰과 공동으로 개발한 제품을 선보일 계획이다.
 LG생활건강 역시 중국 현지에서 오프라인 채널 뿐만 아니라 온라인에서의 영역 확장을 시도하고 있다. '후', '숨' 등 럭셔리 브랜드가 중심인 만큼 LG생활건강은 그간 백화점과 같은 오프라인 채널을 중심으로 마케팅을 펼쳐왔지만 앞으로는 온라인 마케팅을 적극적으로 활용해 포스트 코로나19 대비에 나설 계획이다.



 ※ 저작권자 ⓒ 파이낸셜뉴스. 무단 전재-재배포 금지",/news/news_read.nhn?article_id=0004412771&office_id=014&mode=search&query=LG생활건강&page=2
,"334명 완치 퇴소…의료진에 LG생활건강 화장품 세트 선물(서울=연합뉴스) 최재서 기자 = LG디스플레이 구미 동락원이 신종 코로나바이러스 감염증(코로나19) 치료센터 지원 임무를 마무리했다.

 22일 LG디스플레이에 따르면 이날 경북 구미 동락원의 생활치료센터 철수 현장에 권영진 대구시장, 장세용 구미시장, 구건희 보건소장 등이 찾아 의료진과 운영진에 감사의 인사를 전했다.

동락원에서는 지난달 9일부터 45일간 총 391명이 코로나19 치료를 받았으며 334명이 완치됐다.

 LG디스플레이는 철수하는 의료진들이 장시간 마스크 착용으로 피부가 손상된 점을 고려해 LG생활건강 화장품 세트를 선물했다.

LG디스플레이 경영지원그룹장 양재훈 부사장은 ""국가적 어려움이 있을 때 책임 있는 기업으로 사회공헌과 지원을 아끼지 않겠다""고 말했다.

동락원은 경북 구미에 위치한 LG디스플레이 기숙사로 383실 규모다.

acui721@yna.co.kr",/news/news_read.nhn?article_id=0011564646&office_id=001&mode=search&query=LG생활건강&page=2
45일간 391명 치료,"[서울경제]
구미 동락원이 신종 코로나바이러스 감염증(코로나19) 치료센터 지원 임무를 마무리했다.LG디스플레이는 대구·경북 지역의 코로나19 확진자 입원 병실 및 격리시설 부족을 해소하기 위해 지난달 9일부터 생활치료센터로 제공해온 구미 동락원이 45일간의 지원 임무를 완료했다고 22일 밝혔다. 동락원은 경북 구미에 자리한 LG디스플레이 기숙사로 383실 규모다. 이날 구미 생활치료센터 철수 현장에는 권영진 대구시장, 장세용 구미시장, 구건희 보건소장 등이 참석했다. 지금까지 391명이 동락원에서 치료를 받았으며 334명이 완치 후 무사히 퇴소했다.LG디스플레이는 의료진의 원활한 센터 운영을 위해 방호복 건조기 설치를 지원하고 반려식물화분 및 영양간식 세트를 제공했다. LG디스플레이는 이날 철수하는 의료진들이 장시간 마스크 착용으로 피부가 손상된 점을 고려해 LG생활건강 화장품 세트를 선물하기도 했다.양재훈 LG디스플레이 경영지원그룹장(부사장)은 “생활치료센터에서 감염병 확산을 막기 위해 불철주야 헌신한 의료진과 운영진 덕분에 많은 분들이 완치돼 기쁘게 생각한다”며 “LG디스플레이는 국가적 어려움이 있을 때 책임있는 기업으로 사회공헌 및 지원을 아끼지 않겠다”고 말했다. /양철민기자 chopin@sedaily.com저작권자 ⓒ 서울경제, 무단 전재 및 재배포 금지",/news/news_read.nhn?article_id=0003728097&office_id=011&mode=search&query=LG생활건강&page=1
"▽ 이번주 LG생활건강, 내주 아모레퍼시픽 실적 발표▽ ""면세점 부문 실적 회복 지연 전망""","1분기 실적 발표를 앞둔 K뷰티 업계의 표정이 어둡다. 럭셔리 화장품의 주요 판매처인 면세점이 신종 코로나바이러스 감염증(코로나19) 사태로 직격탄을 맞았기 때문이다. 앞서 발표된 글로벌 화장품 기업 실적 등에 비춰 앞으로 e커머스(전자상거래) 전략의 중요성이 한층 커졌다는 분석이 나온다.22일 금융투자업계에 따르면 오는 23일 LG생활건강이 1분기 실적을 발표하고 28일에는 아모레퍼시픽이 성적표를 공개한다.대표기업인 LG생활건강과 아모레퍼시픽을 비롯해 주요 K뷰티 기업들은 1분기 역성장이 불가피한 것으로 관측된다. 증권정보업체 에프앤가이드에 따르면 LG생활건강의 1분기 매출과 영업이익 컨센서스(국내 증권사 전망치 평균)는 각각 1조7376억원, 2328억원으로 집계됐다. 지난해 1분기보다 각각 7%, 28% 감소한 수치다. 이에 57분기 연속으로 이어진 매출 성장 기록과 59분기 연속 이어온 영업이익 증가세 기록도 끊어질 전망이다.손효주 한화투자증권 연구원은 ""중국 법인과 면세점 사업의 코로나19 타격으로 LG생활건강의 1분기 영업이익은 30% 감소한 1703억원에 그칠 것""이라며 ""지난해 하반기 인수한 에이본 사업 실적이 온기로 잡히면서 적자 비용이 더해져 이익 감소폭이 클 전망""이라고 분석했다.아모레퍼시픽의 경우 이익 감소폭이 한층 클 것으로 예상됐다. 매출과 영업이익 컨센서스는 1조2125억원과 820억원을 기록했다. 지난해 같은 기간 실적과 비교해 17%, 56% 줄어든 것으로 나타났다.조미진 NH투자증권 연구원은 ""중국 정부의 외국인 입국제한, 추가적인 항공 노선수 감소 등의 영향으로 당초 예상보다 면세점에서의 부진이 장기화돼 아모레퍼시픽의 실적 추정치를 하향 조정했다""며 ""영업시간 단축과 트래픽 감소로 예년의 판매 수준 회복까지는 시간이 소요될 것""이라고 관측했다.한 발 앞서 실적을 발표한 세계 최대 화장품기업 로레알과 프랑스 명품그룹 루이비통모에헤네시(LVMH)의 화장품 부문 역시 매출 감소를 면치 못했다. 그러나 e커머스 부문의 성장세가 이목을 끌었다.손효주 연구원은 ""로레알의 경우 코로나19 여파로 면세사업은 두 자릿수 감소했지만 e커머스 채널의 매출 성장률은 52.6%로 여전히 고성장세가 유지됐다""며 ""중국 매출도 6.4% 성장했다""고 전했다.LVMH의 경우 전체 화장품 매출은 감소했으나 '겔랑' 등 일부 브랜드는 온라인 채널 성장세를 바탕으로 아시아 시장에서 견고한 매출을 거둔 것으로 전해졌다. 특히 K뷰티 주요 소비시장의 한 축인 중국 화장품 업계 트렌드가 '고급화'와 '온라인화'에 맞춰져 있다는 점에서 향후 e커머스 전략의 중요도가 한층 커질 것으로 관측된다. 오린아 이베스트투자증권 연구원은 ""1분기 아모레퍼시픽의 국내 화장품 부문은 e커머스 부문을 제외하고 두자릿수의 역성장이 예상된다""면서 ""올해 아모레퍼시픽은 럭셔리 포트폴리오와 디지털 채널 중심의 전략 수정을 계획하고 있어 중국 소비 반등 시 이에 대한 수혜를 누릴 수 있다""고 진단했다. 오정민 한경닷컴 기자 blooming@hankyung.com기사제보 및 보도자료 open@hankyung.com▶ ▶
 ▶
ⓒ 한국경제 & , 무단전재 및 재배포 금지",/news/news_read.nhn?article_id=0004328744&office_id=015&mode=search&query=LG생활건강&page=1
,"[머니투데이 정인지 기자] 유가 급락으로 하락 출발했던 국내 증시가 상승으로 돌아섰다. 22일 오후 3시11분 현재 코스피지수는 전날보다 0.44% 오른 1887.7을 기록하고 있다. 코스닥지수는 0.63% 상승한 632.75를 나타내고 있다. 이날 새벽 국제유가가 또다시 급락하면서 국내 증시는 오전 1% 이상 하락했다. 그러나 오후 들어 개인의 매수세가 늘어나면서 증시는 상승 전환했다. 코스피시장에서 개인은 3834억원을 순매수 중이다. 기관은 813억원, 외국인은 3246억원 순매도 하고 있다. 업종별로는 건설업, 전기가스업, 통신업, 음식료업, 운수창고, 전기전자가 1~2% 상승 중이다. 반면 은행, 철강금속, 의료정밀, 운수장비는 1~2% 하락하고 있다. 시가총액 상위주는 대부분 상승하고 있다. SK하이닉스는 2.83%, LG생활건강은 3% 상승 중이다. 코스닥시장에서는 개인이 968억원 순매수하고 외국인과 기관이 각각 481억원, 253억원 순매도 중이다. 시총 상위주 중에서는 셀트리온헬스케어, CJ ENM, 씨젠이 3~4% 상승하고 있다. 정인지 기자 injee@mt.co.kr
<저작권자 ⓒ '돈이 보이는 리얼타임 뉴스' 머니투데이, 무단전재 및 재배포 금지>",/news/news_read.nhn?article_id=0004398569&office_id=008&mode=search&query=LG생활건강&page=1
,"[디지털타임스 박정일 기자] LG디스플레이는 대구·경북 지역의 코로나19 확진자 입원 병실과 격리시설 부족을 해소하기 위해 지난 3월 9일부터 지원해온 구미 동락원 생활치료센터가 45일간의 지원임무를 완료했다고 22일 밝혔다.회사 측은 321명의 코로나19 확진자가 입소(의료·운영진 70명)한 것을 시작으로 운영기간 동안 총 391명이 치료를 받았으며, 334명이 완치해 무사히 퇴소했다고 소개했다.LG디스플레이는 생활치료센터 시설지원 외에도 의료·운영진의 원활한 센터운영을 위해 방호복 건조기를 설치 지원하는 한편 환자와 의료진의 심리적 안정을 위해 반려식물(천량금)과 영양간식 세트를 지원했다. 생활치료센터에서 근무한 대구시 관계자는 ""환자와 의료진들을 위해 LG디스플레이에서 제공한 아낌없는 지원과 격려 덕분에 환자들이 무사히 회복할 수 있었다""며 고마움을 전했다.양재훈 LG디스플레이 경영지원그룹장 부사장은 ""생활치료센터에서 감염병 확산을 막기 위해 불철주야 헌신하신 의료진과 운영진 덕분에 많은 분들이 완치돼 기쁘게 생각한다""며 ""국가적 어려움이 있을 때 책임 있는 기업으로 사회공헌·지원을 아끼지 않겠다""고 말했다.한편 LG디스플레이는 이번 생활치료센터에서 철수하는 의료진들이 장시간 보호장구 착용으로 얼굴 피부가 손상된 점을 고려해 LG생활건강 화장품 세트를 선물했다.이날 구미 생활치료센터 철수현장에는 권영진 대구시장, 장세용 구미시장, 구건희 보건소장 등 대구·구미지역 주요인사가 방문해 수고한 의료진과 운영진, LG디스플레이 관계자에게 감사의 인사를 전했다. 박정일기자 comja77@dt.co.kr 디지털타임스
/",/news/news_read.nhn?article_id=0002594823&office_id=029&mode=search&query=LG생활건강&page=1
"코스피, 16.77p 오른 1896.15…정부 저신용 회사채 매입+美 선물 상승 영향코스닥 6.39p 오른 635.16…환율 2.5원 오른 1232.2원","(서울=뉴스1) 정은지 기자 = 코스피 지수가 장중 상승 전환하며 1900선 회복을 목전에 뒀다. 시간외 미국 뉴욕 증시 지수 선물이 상승 전환한 데다 정부가 저신용기업과 기간산업에 대한 대규모 지원에 나선다고 밝힌 영향으로 풀이된다. 22일 코스피 지수는 전일 대비 16.77p(0.89%) 오른 1896.15에 거래를 마쳤다. 개인이 3169억원을 순매수하며 3거래일 연속 매수세를 이어간 가운데 외국인과 기관은 각각 370억원과 3075억원을 순매도했다. 시가총액 상위 10개 종목 대부분 상승 마감했다. SK하이닉스(3.20%), LG생활건강(2.93%), 네이버(1.96%), 삼성전자(1.22%), 셀트리온(0.94%) 순으로 상승폭이 컸다. 코스닥 지수는 전일대비 6.39p(1.02%) 상승한 635.16으로 마감했다. 시총 상위 10개 종목 중 씨젠(4.71%), CJENM(4.17%), 셀트리온헬스케어(4.07%) 등의 상승세가 돋보였다. 업종별로는 건축자재(8.0%), 건강관리기술(6.76%), 전기유틸리티(3.70%), 건설(3.16%), 게임엔터테인먼트(2.61%) 등이 강세를 보였다.노동길 NH투자증권 연구원은 ""정부가 미국처럼 저신용 회사채를 매입한다고 밝히는 등의 조치가 나오면서 투자자들의 낙관적인 투자심리가 반영돼 상승 전환할 것으로 보인다""고 분석했다.정부는 코로나19발 경기침체를 극복하고 고용안정을 유지하기 위해 항공 등 7대 기간산업에 40조원을 투입한고 밝혔다. 또 7대 기간산업 외에 저신용등급 기업 지원을 위해 SPV(특수목적기구)를 설립해 신용등급이 낮은 회사채와 CP(기업어음) 20조원을 매입한다. 이를 위해 한국은행과 구체적인 매입기구의 구조, 매입 범위 등을 논의할 예정이다. 서울외환시장에서 달러/원 환율은 2.5원 오른 1232.2원에 거래를 마쳤다.ejjung@news1.kr© 뉴스1코리아(), 무단 전재 및 재배포 금지",/news/news_read.nhn?article_id=0004601468&office_id=421&mode=search&query=LG생활건강&page=1
장 초반 1%대 하락하다 상승 전환…개인만 '사자'시총상위株 상승 우위…대웅 '上',"[이데일리 이슬기 기자] 코스피 지수가 상승 마감했다. 간밤 국제유가와 미국 증시 급락에도 불구하고 장 후반 미국과 한국의 재정정책 확대 등에 힘입어 상승 전환했다. 개인만이 나홀로 매수에 나선 가운데 시가총액 상위종목들은 대부분 상승 마감했다.22일 코스피 지수 일일 추이(사진=대신증권 HTS)22일 마켓포인트에 따르면 이날 코스피 지수는 전 거래일 대비 0.89%(16.77포인트) 오른 1896.15에 장을 마쳤다. 코스피 지수는 간밤 국제유가 급락과 미국 증시 급락에 영향을 받아 장 초반만 해도 1%대 하락했으나 장 후반이 갈수록 낙폭을 줄였고, 급기야는 상승 전환에도 성공했다. 미국의 4840억달러 규모의 재정정책 확대와 각국의 경제 셧다운 완화 기대가 높아진 것이 영향을 미쳤다고 증권가에선 풀이했다. 여기에 한국 정부가 40조원 규모의 기간산업안정기금을 조성하기로 했다는 소식도 툰자심리를 녹이는데 한몫 했다. 수급을 보면 개인이 나홀로 매수하며 총 3169억원 가량의 주식을 순매수했다. 반면 기관과 외국인은 각각 3070억원, 382억원 가량의 주식을 팔아 치웠다. 기관 중에서는 금융투자(-3554억원), 투신(-256억원), 보험(-217억원) 등이 매도 우위를 보였다.업종별로 보면 오른 업종이 더 많았다. 비금속광물 업종은 5%대 상승했고, 건설업종은 3%대 올랐다. 전기가스, 통신업종은 2%대 올랐고, 음식료, 전기전자, 서비스, 운수창고, 섬유의복 업종은 1%대 상승했다. 제조, 의약, 화학, 종이목재, 증권 업종은 1% 미만으로 올랐다. 반면 은행, 철강금속 업종은 1%대 하락했고, 운송장비, 의료정밀, 기계, 보험, 금융업종은 1%미만으로 내렸다. 시가총액 상위종목들은 대부분 올랐다. 엔씨소프트(036570)는 전 거래일 대비 5%대나 상승했고, 삼성물산(028260) SK하이닉스(000660)는 3%대 올랐다. LG생활건강(051900) SK텔레콤(017670)은 2%대 상승했다. NAVER(035420) 삼성전자(005930)는 1%대 올랐다. 셀트리온(068270) 삼성SDI(006400) 카카오(035720) LG화학(051910) 삼성바이오로직스(207940)는 1% 미만으로 올랐다. 반면 현대차(005380)는 1% 미만으로 내렸고, 현대모비스(012330)는 보합권에서 장을 마쳤다.종목별로 보면 대웅(003090)이 보유한 물질 ‘니클로사마이드’가 코로나19 항바이러스 치료 효과가 있다는 분석에 상한가를 기록했다. 한진중공업(097230)은 채권단이 공동 매각을 추진한다는 소식에 17%대 올랐다. 정부가 대규모 자금을 공급한다는 소식에 아시아나항공(020560)은 4%대 상승했다.이날 거래량은 8억 581만주, 거래대금은 9조 2863억원을 기록했다. 상한가 3개 종목을 비롯해 435개 종목이 올랐고, 하한가 없이 404개 종목이 하락했다. 61개 종목은 보합권에서 장을 마쳤다.이슬기 (surugi@edaily.co.kr)＜ⓒ종합 경제정보 미디어 이데일리 - 무단전재 & 재배포 금지＞",/news/news_read.nhn?article_id=0004625597&office_id=018&mode=search&query=LG생활건강&page=1
,"[아시아경제 박지환 기자] 22일 오후 코스피가 장 막판에 다가갈수록 하락폭을 줄이면서 결국 상승 마감했다.이날 주식시장은 원유 시장 붕괴로 인한 투자심리 악화로 하락 출발했지만 오후들어 정부의 40조원 규모 재정정책 소식에 반등한 것으로 풀이된다.22일 코스피는 전일보다 0.89%(16.77포인트) 오른 1896.15에 마감했다. 이날 코스피는 전거래일 대비 23.87포인트(1.27%) 내린 1855.51로 출발한 후 점점 낙폭을 줄여가다가 상승 전환에 성공했다.이날 문재인 대통령은 비상경제회의를 주재하고 40조원 규모의 기간산업안정기금 조성 방안을 확정했다.유가증권시장에서는 개인이 3170억원을 순매수했다. 반면 외국인과 기관은 각각 383억원, 3071억원을 순매도했다. 시가총액 상위 10위 종목 중에서는 현대차(-0.96%)를 제외한 모든 종목이 올랐다. 삼성전자(1.22%), SK하이닉스(3.20%), 삼성바이오로직스(0.17%), 네이버(1.96%), 셀트리온(0.94%), LG화학(0.28%), LG생활건강(2.93%), 삼성SDI(0.88%), 삼성물산(3.30%) 등이 상승했다.유가증권시장에서는 상한가 3개 종목을 포함해 총 435개 종목이 올랐다. 404개 종목이 하락했으며 61개 종목은 보합을 나타냈다. 반면 코스닥은 전일보다 1.02%(6.39포인트) 오른 635.16에 장을 마쳤다. 전날 보다 9.82포인트(1.56%) 하락한 618.95로 장을 시작했으나 점차 낙폭을 줄여가며 상승 전환했다.코스닥시장 역시 개인의 매수세가 두드러졌다. 개인은 681억원을 순매수한 반면 외국인과 기관은 각각 248억원, 199억원 팔자에 나섰다.업종별로는 운송(0.74%), 유통(2.75%), 제약(1.22%), 금융(0.21%) 등은 상승했으며 금속(-0.20%)은 하락했다.시가총액 상위 10위 종목에서는 휴젤(-0.29%)를 제외한 대다수 종목이 상승했다. 셀트리온헬스케어(4.07%), 펄어비스(1.83%), 셀트리온제약(0.41%), 케이엠더블유(0.63%), CJ ENM(4.17%), 씨젠(4.17%), 스튜디오드래곤(0.76%) 등이 올랐다. SK머티리얼즈와 에이치엘비는 변동이 없었다.코스닥시장에서는 상한가 종목 4개를 포함해 총 691개 종목이 상승했다. 하한가 2개 종목을 포함해 총 520개 종목이 떨어졌으며 보합을 기록한 종목은 112개였다.박지환 기자 pjhyj@asiae.co.kr <ⓒ경제를 보는 눈, 세계를 보는 창 아시아경제 무단전재 배포금지>",/news/news_read.nhn?article_id=0004666138&office_id=277&mode=search&query=LG생활건강&page=1
