head,text,url
,"[서울=뉴시스] 김제이 기자 = 두 달 반만에 2000선을 돌파했던 코스피가 연속 상승마감에 성공하며 상승흐름을 이어가고 있다. 외국인의 매도세에도 개인의 매수세가 지수 하락을 방어한 것으로 풀이된다.27일 코스피지수는 전 거래일(2029.78)보다 1.42포인트(0.07%) 오른 2031.20에 마감했다. 지수는 전날 보다 1.88포인트(0.09%) 내린 2027.9에 출발해 반등한 후 상승흐름을 이어나갔다. 장 중에는 2043선까지 터치하며 오름 폭을 키우기도 했다.유가증권시장에서 개인은 기관과 외국인의 동반 매도세에도 불구하고 홀로 3496억원을 순매수했다. 이날 외국인은 2614억원, 기관은 725억원을 순매도했다.업종별로는 혼조세를 보였다. 이날 크게 오른 업종은 섬유의복(3.32%)이며 이 뒤로도 기계(2.74%), 은행(2.41%), 철강금속(2.29%), 건설업(2.19%) 등이 올랐다. 반면 의약품(-1.64%), 서비스업(-1.64%), 통신업(-1.16%) 등은 내림세가 두드러졌다.시가총액 상위 종목들은 대부분 내렸다. 삼성전자가 전 거래일 대비 650원(1.32%) 오른 4만9900원에 거래를 마쳤고, 현대차가 0.31% 오른 것을 제외하면 모두 하락했다. 내림 폭이 큰 순으로 삼성SDI(-5.93%), LG화학(-4.47%), 네이버(-4.39%), 카카오(-3.52%), 삼성바이오로직스(-3.26%), LG생활건강(-0.71%), 셀트리온(-0.70%), SK하이닉스(-0.61%) 등이다.김도현 삼성증권 연구원은 ""어제는 코스피 지수가 2000포인트를 넘어섰고, 미국 스탠더드앤드푸어스(S&P)500 지수 또한 고점기준으로 3000포인트를 돌파했다""며 ""아직까지 세계의 경제활동이 본격적으로 재개되지 않았다는 점을 고려한다면, 실로 마법 같은 투자심리의 회복이라고 할 만하다""고 평가했다.다만 김 연구원은 ""국내 및 미국 주식시장의 투자심리는 완연한 회복세를 보이고 있는데 반해, 중국 주식시장의 움직임은 다소 무거워 지고 있다""며 ""코로나19 사태에 대한 부담 이외에도 홍콩을 둘러 싼 미국과의 긴장관계가 고조되고 있다는 점이 투자심리에 부정적읶 영향을 미치고 있기 때문""이라고 진단했다.코스닥지수는 전 거래일(729.11)보다 4.52포인트(0.62%) 내린 724.59에 마감했다. 지수는 0.85포인트(0.12%) 내린 728.26에 출발해 장 중 잠깐 반등한 이후 하락 폭을 키우다 마감했다.코스닥시장에서 외국인과 기관은 각각 2917억원, 1276억원을 순매도했다. 개인은 홀로 4318억원을 순매도하며 이날 대량으로 코스닥을 사들였다.코스닥 시총 상위 10개 종목도 희비가 엇갈렸다. 알테오젠(9.38%)은 이날 큰 폭으로 올랐으며, 씨젠(1.60%), 에코프로비엠(1.28%), CJ ENM(1.18%), 스튜디오드래곤(0.90%) 등이 상승했다.반면, 케이엠더블유(-0.34%), 에이치엘비(-1.50%), 펄어비스(-1.99%), 셀트리온제약(-4.06%), 셀트리온헬스케어(-4.48%) 등은 내렸다. jey@newsis.com<ⓒ 공감언론 뉴시스통신사. 무단전재-재배포 금지>",/news/news_read.nhn?article_id=0009884230&office_id=003&mode=search&query=LG생활건강&page=1
코스피 소폭 상승…0.07% 오른 2031.20 마감,"[더팩트ㅣ박경현 기자] 27일 코스피가 혼조를 겪다 개인 수급에 힘입어 강보합 마감했다. 코스닥은 오전 중 하락세로 전환해 낙폭을 키우다 1% 미만 하락하며 장을 마쳤다.코스피는 이날 전장 대비 1.42포인트(+0.07%) 오른 2031.20에 마쳤다. 개인은 다시 매수로 전환해 3226억 원을 사들였다. 외국인과 기관은 동반 매도포지션을 취하며 각각 2173억 원, 866억 원을 팔아치웠다.시가총액 상위종목은 삼성전자(+1.32%)만이 올랐다. 반면 SK하이닉스(-0.61%), 삼성바이오로직스(-3.26%), 네이버(-4.39%), 셀트리온(-0.70%), LG화학(-4.47%), 삼성SDI(-5.93%), 카카오(-3.52%), LG생활건강(-0.71%)은 내렸다.업종은 조선, 우주항공과 국방, 건축제품, 해운사, 전자제품이 4~6%가량 올랐다. 반면 전기제품, 양방향미디어와 서비스, 가구, 복합유틸리티, 인터넷과 카탈로그소매가 2~4%가량 내려 약세였다.코스닥은 전장대비 4.52포인트(-0.62%) 내린 724.59에 장을 마쳤다.코스닥에서는 전날과 같이 개인이 매수를, 외국인과 기관은 매도포지션을 취했다. 이에 외국인과 기관은 각각 2910억 원, 1277억 원을 순매도하고 개인 홀로 4318억 원을 순매수했다.이날 코스닥 시가총액 상위종목 등락은 엇갈렸다. 셀트리온헬스케어(-4.48%), 에이치엘비(-1.50%), 셀트리온제약(-4.06%), 케이엠더블유(-0.34%)는 내림세를 보였다. 반면 알테오젠(+9.38%), 씨젠(+1.60%), CJ ENM(+1.18%), 에코프로비엠(+1.28%), 스튜디오드래곤(+0.90%)은 오름세를 보인 가운데 장을 마쳤다.pkh@tf.co.kr저작권자 ⓒ 특종에 강한 더팩트 & tf.co.kr 무단 전재 및 재배포 금지",/news/news_read.nhn?article_id=0000027224&office_id=629&mode=search&query=LG생활건강&page=1
,"27일 코스피지수는 전 거래일 대비 1.42포인트(0.07%) 오른 2031.2에 거래를 마쳤다. 개인이 3214억원을 순매수했고 외국인과 기관은 각각 2173억원, 859억원을 순매도했다.코스피 시가총액 상위 종목은 삼성전자(1.32%)를 제외하고 하락했다. SK하이닉스(-0.61%), 삼성바이오로직스(-3.26%), 네이버(-4.39%), 셀트리온(-0.70%), LG화학(-4.47%), 삼성SDI(-5.93%), 카카오(-3.52%), LG생활건강(-0.71%)이 하락했다.코스닥 지수는 이날 전일 대비 4.52포인트(0.62%) 내린 724.59에 마감했다. 개인이 4285억원을 순매수했고 외국인과 기관은 각각 2911억원, 1242억원을 순매도했다.코스닥 시가총액 상위 종목은 혼조세로 마감했다. 셀트리온헬스케어(-4.48%), 셀트리온제약(-4.06%)은 하락했고 알테오젠(9.38%), 씨젠(1.60%), 에코프로비엠(1.28%) 등은 상승했다.이날 서울 외환시장에서 원/달러 환율은 전날보다 0.1원 오른 달러당 1234.4원에 거래를 마쳤다.노동길 NH투자증권 연구원은 ""미중 마찰 고조를 앞두고 국내 주가가 상승 속도를 줄여가는 모습을 보였다""며 ""국내 주식시장 멀티플은 호재보다 악재에 민감한 수준으로 미중 마찰 범위를 확인할 필요가 있다""고 말했다.윤경진 기자 youn1@mt.co.kr
<저작권자 ⓒ '성공을 꿈꾸는 사람들의 경제 뉴스' 머니S, 무단전재 및 재배포 금지>",/news/news_read.nhn?article_id=0000547731&office_id=417&mode=search&query=LG생활건강&page=1
,"[서울=뉴시스] 김제이 기자 = 두 달 반만에 2000선을 돌파했던 코스피가 연속 상승마감에 성공하며 상승흐름을 놓치지 않았다. 외국인의 매도세에도 개인의 매수세가 지수 하락을 방어한 것으로 풀이된다. 증시 전문가들은 현재 장세가 개인이 이끄는 장세라고 분석하며 한동안 개인의 대량 매수세가 이어질 것으로 전망했다.27일 코스피지수는 전 거래일(2029.78)보다 1.42포인트(0.07%) 오른 2031.20에 마감했다. 지수는 전날 보다 1.88포인트(0.09%) 내린 2027.9에 출발해 반등한 후 상승흐름을 이어나갔다. 장 중에는 2043선까지 터치하며 오름 폭을 키우기도 했다.유가증권시장에서 개인은 기관과 외국인의 동반 매도세에도 불구하고 홀로 3496억원을 순매수했다. 이날 외국인은 2614억원, 기관은 725억원을 순매도했다.업종별로는 혼조세를 보였다. 이날 크게 오른 업종은 섬유의복(3.32%)이며 이 뒤로도 기계(2.74%), 은행(2.41%), 철강금속(2.29%), 건설업(2.19%) 등이 올랐다. 반면 의약품(-1.64%), 서비스업(-1.64%), 통신업(-1.16%) 등은 내림세가 두드러졌다.시가총액 상위 종목들은 대부분 내렸다. 삼성전자가 전 거래일 대비 650원(1.32%) 오른 4만9900원에 거래를 마쳤고, 현대차가 0.31% 오른 것을 제외하면 모두 하락했다. 내림 폭이 큰 순으로 삼성SDI(-5.93%), LG화학(-4.47%), 네이버(-4.39%), 카카오(-3.52%), 삼성바이오로직스(-3.26%), LG생활건강(-0.71%), 셀트리온(-0.70%), SK하이닉스(-0.61%) 등이다.증권업계에서는 코스피의 회복에 있어 개인투자자들의 역할이 크다고 분석했다. 상대적으로 빠르게 회복하는 증시에서 외국인은 계속 순매도세를 보이는 반면 개인들이 이를 꾸준히 받아내고 있기 때문이다.정용택 IBK투자증권 리서치센터장은 ""개인투자자들의 주식 쪽에 대한 매수는 이어질 것으로 보고 있다""며 ""기본적으로 자금이 단기 부동화되고 있고 금리가 계속 내려가고 있는 상황으로 시장에 여유자금이 있고 증시 상승에 대한 기대감이 남아있어 당분간 개인의 순매수세는 유지될 걸로 보인다""고 분석했다.반면, 외국인들의 순매도세가 이어지는 것에 대해서는 대외 리스크가 존재해 국내 증시에 불확실성 남아있다는 판단에서 기인한다고 진단했다.정 센터장은 ""외국인들의 코스피를 계속해서 매도하는 건 두 가지 이유가 있다""며 ""우선 코로나19가 전 세계적으로 지속되고 있다는 점이고 두 번째는 미중 무역 분쟁""이라고 강조했다.최근 언급되는 경제재개에 대한 기대감이 이머징 마켓(신흥국시장)으로 확대되려면 외국인들에게는 락다운(Lock down·이동제한) 이후에도 경제활동이 안정적이여야 한다는 증거가 있어야 한다는 것이다.미중 무역갈등에서는 우리나라가 지리적으로나 경제적으로나 중국과 밀접한 관계국으로 환율문제나 경제 관련 불확실성이 높다고 점이 외국인들이 국내 증시로 넘어오기 어려운 요건들이라는 해석이다. 이날 코스닥지수는 전 거래일(729.11)보다 4.52포인트(0.62%) 내린 724.59에 마감했다. 지수는 0.85포인트(0.12%) 내린 728.26에 출발해 장 중 잠깐 반등한 이후 하락 폭을 키우다 마감했다.코스닥시장에서 외국인과 기관은 각각 2917억원, 1276억원을 순매도했다. 개인은 홀로 4318억원을 순매도하며 이날 대량으로 코스닥을 사들였다.코스닥 시총 상위 10개 종목도 희비가 엇갈렸다. 알테오젠(9.38%)은 이날 큰 폭으로 올랐으며, 씨젠(1.60%), 에코프로비엠(1.28%), CJ ENM(1.18%), 스튜디오드래곤(0.90%) 등이 상승했다.반면, 케이엠더블유(-0.34%), 에이치엘비(-1.50%), 펄어비스(-1.99%), 셀트리온제약(-4.06%), 셀트리온헬스케어(-4.48%) 등은 내렸다. jey@newsis.com<ⓒ 공감언론 뉴시스통신사. 무단전재-재배포 금지>",/news/news_read.nhn?article_id=0009884350&office_id=003&mode=search&query=LG생활건강&page=1
삼성전자 1490억 원 매수·삼성SDI 2095억 원 매도,"[더팩트ㅣ박경현 기자] 27일 코스피는 매도물량이 커지자 상승폭이 제한되며 강보합 마감했다. 이날 개인은 다시 매수로 전환해 3226억 원을 사들인 반면 외국인과 기관은 동반 매도포지션을 취하며 각각 2173억 원, 866억 원을 팔아치웠다. 코스닥은 외인과 기관의 동반 매도에 하락 마감했다.이날 외국인투자자의 코스피시장 기업 최대매수는 삼성전자로 향했다. 외인은 이날 삼성전자에 1490억 원을 사들인데 이어 포스코(POSCO) 270억 원, LG전자 240억 원, 현대건설 160억 원, 셀트리온 137억 원을 사들였다.반면 삼성SDI는 2095억 원 가량을 팔아치웠다. 이어 네이버(NAVER) 527억 원, LG화학 323억 원, SK 304억 원, 삼성전자우 265억 원을 순매도 했다.코스닥 시장에서는 리노공업(25억 원), 케이엠더블유(22억 원), 파마리서치프로덕트(21억 원)를 사고, 셀트리온헬스케어(1993억 원), 콜마비앤에이치(74억 원), 아프리카TV(48억 원)를 팔았다.기관은 이날 KB금융에 286억 원 가량을 사들였다. 이어 한국조선해양 281억 원, 포스코(POSCO) 188억 원, 기아차 125억 원, 한국금융지주 111억 원 순으로 매수했다.반면 카카오는 724억 원가량 매도했다. 또한 네이버(NAVER) 460억 원, SK 360억 원, 셀트리온 248억 원을 팔았다.이날 시가총액 상위종목은 삼성전자(+1.32%)를 제외하고 대부분 내렸다. SK하이닉스(-0.61%), 삼성바이오로직스(-3.26%), 네이버(-4.39%), 셀트리온(-0.70%), LG화학(-4.47%), 삼성SDI(-5.93%), 카카오(-3.52%), LG생활건강(-0.71%)이 하락세로 장을 마쳤다.pkh@tf.co.kr저작권자 ⓒ 특종에 강한 더팩트 & tf.co.kr 무단 전재 및 재배포 금지",/news/news_read.nhn?article_id=0000027236&office_id=629&mode=search&query=LG생활건강&page=1
