head,text,url
,"[디지털타임스 박정일 기자] LG디스플레이는 대구·경북 지역의 코로나19 확진자 입원 병실과 격리시설 부족을 해소하기 위해 지난 3월 9일부터 지원해온 구미 동락원 생활치료센터가 45일간의 지원임무를 완료했다고 22일 밝혔다.회사 측은 321명의 코로나19 확진자가 입소(의료·운영진 70명)한 것을 시작으로 운영기간 동안 총 391명이 치료를 받았으며, 334명이 완치해 무사히 퇴소했다고 소개했다.LG디스플레이는 생활치료센터 시설지원 외에도 의료·운영진의 원활한 센터운영을 위해 방호복 건조기를 설치 지원하는 한편 환자와 의료진의 심리적 안정을 위해 반려식물(천량금)과 영양간식 세트를 지원했다. 생활치료센터에서 근무한 대구시 관계자는 ""환자와 의료진들을 위해 LG디스플레이에서 제공한 아낌없는 지원과 격려 덕분에 환자들이 무사히 회복할 수 있었다""며 고마움을 전했다.양재훈 LG디스플레이 경영지원그룹장 부사장은 ""생활치료센터에서 감염병 확산을 막기 위해 불철주야 헌신하신 의료진과 운영진 덕분에 많은 분들이 완치돼 기쁘게 생각한다""며 ""국가적 어려움이 있을 때 책임 있는 기업으로 사회공헌·지원을 아끼지 않겠다""고 말했다.한편 LG디스플레이는 이번 생활치료센터에서 철수하는 의료진들이 장시간 보호장구 착용으로 얼굴 피부가 손상된 점을 고려해 LG생활건강 화장품 세트를 선물했다.이날 구미 생활치료센터 철수현장에는 권영진 대구시장, 장세용 구미시장, 구건희 보건소장 등 대구·구미지역 주요인사가 방문해 수고한 의료진과 운영진, LG디스플레이 관계자에게 감사의 인사를 전했다. 박정일기자 comja77@ 디지털타임스
/",/news/news_read.nhn?article_id=0002594926&office_id=029&mode=search&query=LG생활건강&page=1
화장품업계 1분기 실적 부진 예상의존도 높은 면세점 매출 급감에아모레퍼시픽 영업익 67% ‘추락’LG생건 34%↓ 신기록행진 주춤마케팅 방향 中 유통 채널로 집중온라인 확장 ‘포스트 코로나’ 대비,"중국의 사드 보복으로 어려움을 겪었던 K뷰티가 이번엔 코로나19 라는 대형 악재를 만났다. 주요 화장품 업체들의 1·4분기 실적발표가 다가온 가운데 코로나19로 인한 손실이 상당할 것으로 보인다. 주요 브랜드들의 중국 비중이 큰 만큼 앞으로는 중국 현지에서의 매출 회복 여부가 실적 반등의 중요한 조건이 될 전망이다.
 22일 화장품업계에 따르면 코로나19라는 예상치 못한 악재로 K뷰티도 상당한 타격을 입었을 것으로 예상된다.
 23일 LG생활건강을 시작으로 아모레퍼시픽, 에이블씨엔씨 등 주요 화장품 업체들의 실적 발표가 침울할 것으로 우려된다. LG생활건강, 아모레퍼시픽 모두 면세점 의존도가 높은데 코로나19로 출입국 규제가 강화되면서 면세점 매출이 급감했기 때문이다.
 LG생활건강의 경우 화장품 영업이익의 50%가 면세점 채널이며 아모레퍼시픽은 다른 부문에서 적자를 내고 있어 사실상 면세점 이익 비중이 100%나 다름 없는 것으로 알려졌다.
 이에 따라 K뷰티 쌍두마차인 LG생활건강, 아모레퍼시픽 모두 이번 1·4분기에는 부진한 실적을 기록할 전망이다. 하나금융투자 박종대 연구원은 ""아모레퍼시픽의 영업이익은 전년동기대비 67% 하락한 610억원, LG생활건강의 영업이익은 34% 줄어든 2143억원까지 떨어질 것""이라고 내다봤다.
 매 분기 사상 최대 실적을 기록해 온 LG생활건강의 신기록 행진도 당분간은 주춤할 전망이다. 지난해 4·4분기에는 최초로 분기매출이 2조원을 넘어섰고 영업이익 역시 2410억원을 기록, 매출과 영업이익 모두 사상 최대 4·4분기 실적을 기록하며 15년 연속 성장이라는 대기록을 달성했다.
 다만 LG생활건강의 경우 화장품 이외에 생활용품, 음료 부문은 코로나19의 영향을 비교적 크게 받지 않은 만큼 다른 화장품 업체들 보다는 양호한 실적을 기록할 것으로 예상된다. 지난해 기준 LG생활건강의 생활용품, 음료부문 매출 비중은 전체의 약 39%에 달한다.
 LG생활건강 관계자는 ""생활용품의 경우 코로나19로 수요가 증가한 손소독제와 손세정제, 마스크 등의 품목이 속해 있고 음료 역시 배달 음식 수요가 늘어 화장품 부문의 손실을 어느 정도 상쇄해주는 효과가 있을 것으로 기대하고 있다""고 말했다.
 주요 채널인 면세점이 당분간 활성화되기 힘든 만큼 앞으로의 마케팅 방향은 중국 현지 유통 채널로 집중될 것으로 보인다.
 박 연구원은 ""이들 업체의 향후 실적은 대 중국 브랜드력과 채널 및 마케팅 전략에 따라 차별화될 것으로 예상한다""며 ""두 회사는 모두 중국 현지 법인을 크게 두고 있으며 온·오프라인 채널망을 모두 갖춰 중국 수요만 회복한다면 충분히 그에 부합하는 현지 대응·공급이 가능하다""고 말했다.
 아모레퍼시픽은 올해 중국 현지에서 디지털 사업을 가속화해 나갈 방침이다. 실제 아모레퍼시픽그룹 서경배 회장의 장녀인 서민정 과장은 입사 전 중국에서 MBA과정을 마친 후 징둥닷컴에서 디지털 관련 업무를 배우기도 했다. 지난해 중국 전자상거래업체 알리바바와 업무협약을 맺은 아모레퍼시픽은 올해 라네즈와 마몽드를 시작으로 티몰 전용 제품을 내놓는다. 이어 설화수와 헤라 등 럭셔리 브랜드에서도 티몰과 공동으로 개발한 제품을 선보일 계획이다.
 LG생활건강 역시 중국 현지에서 오프라인 채널 뿐만 아니라 온라인에서의 영역 확장을 시도하고 있다. '후', '숨' 등 럭셔리 브랜드가 중심인 만큼 LG생활건강은 그간 백화점과 같은 오프라인 채널을 중심으로 마케팅을 펼쳐왔지만 앞으로는 온라인 마케팅을 적극적으로 활용해 포스트 코로나19 대비에 나설 계획이다.


 ※ 저작권자 ⓒ 파이낸셜뉴스. 무단 전재-재배포 금지",/news/news_read.nhn?article_id=0004413053&office_id=014&mode=search&query=LG생활건강&page=1
