head,text,url
G마켓·옥션·G9 할인행사 27일 자정 종료마지막 날 쿠폰 소진 위해 수요 몰려다양한 금액대별 맞춤 특가딜 전진 배치,"(사진=이베이코리아)[이데일리 함지현 기자]이베이코리아는 G마켓, 옥션, G9 등이 지난 19일 동시 시작한 ‘빅스마일데이’가 마무리될 예정인 만큼 각 사이트에서 지급한 최대 30만원 할인 쿠폰을 사용할 기회도 곧 종료된다고 27일 밝혔다.이베이코리아에 따르면 할인쿠폰은 각 사이트 별 4종씩 제공된다. 프리미엄 멤버십 회원인 ‘스마일클럽’에게는 최대 30만원, 3만원, 1만원이 할인되는 ‘20% 할인쿠폰’ 3종을, 일반회원에게는 최대 5000원까지 할인되는 ‘15% 할인쿠폰’을 선보인다. G마켓과 옥션, G9에서 판매하는 상품 중 ‘빅스마일데이 스티커’가 부착된 모든 상품에 쿠폰이 적용된다. ‘스마일클럽’ 회원이 아니더라도 한 달 무료 체험을 신청하면 회원 전용 혜택을 모두 받을 수 있다.마지막 득템 ‘특가딜’도 공개한다. 특히 남은 할인쿠폰을 효율적으로 활용할 수 있도록 가격대별 인기 상품을 선별했다.우선, 가격대가 비교적 높은 디지털, 가전 제품을 선보인다. 해당 쿠폰 적용 시 G마켓에서 ‘LG 퓨리케어 360 공기청정기+무빙휠’을 93만 9000원에, ‘포스트모던 LED 수납침대SS’를 15만 1200원에, ‘위닉스 제습기 16리터’를 32만 9000원에 각각 구매 할 수 있다. 호텔 숙박권인 ‘히든 클리프 호텔네이처 제주’ 역시 클럽특별가 12만 8800원에 선보인다. 옥션에서는 ‘브라운 전기면도기 시리즈9 9355s 패키지’를 클럽특별가 22만 1600원에, ‘테팔 프로스타일 IH 프라이팬 세트’를 클럽특별가 3만 8690원에 판매한다.최대 3만원, 1만원 할인쿠폰을 활용할 수 있는 중저가 상품도 다양하다. 주로 패션, 뷰티, 생필품, 식품 등이 있다. 추천 상품을 클럽특별가로 살펴봤을 때, G마켓에서는 ‘닥터자르트 화장품’을 1만 5950원부터 판매하고, 옥션에서도 ‘비비고 사골곰탕 500g 18개’를 클럽특별가 1만 2930원에, ‘헤지스 키즈 아동 반팔티셔츠’를 클럽특별가 2만 590원에 각각 준비했다.G9에서는 크리넥스 3겹 데코앤소프트 화장지, 하기스 2020년형 매직컴포트, LG생활건강 시리우스 반려동물 사료 모음 등 다양한 생필품을 비롯해 QCY T6 블루투스 무선 이어폰·스타우브 4쿼트 라운드 냄비 4종 등 인기 해외직구 상품을 만나볼 수 있다.김태수 이베이코리아 영업본부 본부장은 “역대급 실적을 기록하고 있는 빅스마일데이가 오늘 밤 12시에 종료된다”며 “마지막 날에는 미처 사용하지 못한 쿠폰을 쓰려는 수요가 몰리는 점에 착안해 다양한 인기상품을 풍성하게 준비한 만큼 남은 혜택을 모두 누리시길 바란다”고 말했다.함지현 (hamz@edaily.co.kr)＜ⓒ종합 경제정보 미디어 이데일리 - 무단전재 & 재배포 금지＞",/news/news_read.nhn?article_id=0004649290&office_id=018&mode=search&query=LG생활건강&page=1
마지막 날 쿠폰 소진 위해 수요 몰려…다양한 금액대별 맞춤 특가딜 전진 배치,"국내 최대 온라인 쇼핑축제 ‘빅스마일데이’가 27일 단 하루만을 남기고 9일간의 대장정을 마무리한다.이베이코리아는 G마켓, 옥션, G9 등 자사가 운영하는 3개 쇼핑사이트에서 지난 19일 동시 시작한 빅스마일데이가 27일 자정(24시)에 종료된다도 밝혔다. 이에 따라, 각 사이트에서 지급한 최대 할인 쿠폰 사용할 기회도 26일이 마지막이다.할인쿠폰은 각 사이트 별 4종씩 제공된다. 프리미엄 멤버십 회원인 ‘스마일클럽’에게는 최대 30만원, 3만원, 1만원이 할인되는 ‘20% 할인쿠폰’ 3종을, 일반회원에게는 ‘15% 할인쿠폰’을 선보인다. G마켓과 옥션, G9에서 판매하는 상품 중 ‘빅스마일데이 스티커’가 부착된 모든 상품에 쿠폰이 적용된다. ‘스마일클럽’ 회원이 아니더라도 한 달 무료 체험을 신청하면 회원 전용 혜택을 모두 받을 수 있다.마지막 득템 ‘특가딜’도 공개한다. 특히 남은 할인쿠폰을 효율적으로 활용할 수 있도록 가격대별 인기 상품을 선별했다.우선, 가격대가 비교적 높은 디지털, 가전 제품을 선보인다. 스마일클럽 전용 최대 할인쿠폰을 활용하기 적절하다. 해당 쿠폰 적용 시 ▲G마켓에서 ‘LG 퓨리케어 360 공기청정기+무빙휠’ ▲‘포스트모던 LED 수납침대SS’ ▲‘위닉스 제습기 16리터’를 각각 저렴하게 구매 할 수 있다.또한 ▲호텔 숙박권인 ‘히든 클리프 호텔네이처 제주’ 역시 클럽특별가에 선보인다. 옥션에서는 ▲‘브라운 전기면도기 시리즈9 9355s 패키지’와 ▲‘테팔 프로스타일 IH 프라이팬28cm‧볶음팬28cm세트’를 클럽특별가에 판매한다.중저가 상품도 다양하다. 주로 패션, 뷰티, 생필품, 식품 등이 있다. 추천 상품을 클럽특별가로 살펴봤을 때 ▲G마켓에서는 ‘닥터자르트 화장품’을 판매하고 ▲옥션에서도 ‘비비고 사골곰탕 500g 18개’와 ‘헤지스 키즈 아동 반팔티셔츠’를 클럽특별가에 각각 판매한다.G9에서는 ▲크리넥스 3겹 데코앤소프트 화장지 ▲하기스 2020년형 매직컴포트 ▲LG생활건강 시리우스 반려동물 사료 모음 등 다양한 생필품을 비롯해 ▲QCY T6 블루투스 무선 이어폰 ▲스타우브 4쿼트 라운드 냄비 4종 등 인기 해외직구 상품을 만나볼 수 있다.김태수 이베이코리아 영업본부 본부장은 “역대급 실적을 기록하고 있는 빅스마일데이가 오늘 밤 12시에 종료된다”며 “마지막 날에는 미처 사용하지 못한 쿠폰을 쓰려는 수요가 몰리는 점에 착안해 다양한 인기상품을 풍성하게 준비한 만큼, 남은 혜택을 모두 누리시길 바란다”고 전했다.데일리안 임유정 기자 (irene@dailian.co.kr)ⓒ (주)데일리안 - 무단전재, 변형, 무단배포 금지",/news/news_read.nhn?article_id=0002403961&office_id=119&mode=search&query=LG생활건강&page=1
,"[아시아경제 차민영 기자] 이베이코리아가 운영하는 G마켓·옥션·G9의 연합 세일 행사 현재 사이트별로 4종씩 제공되고 있는 할인쿠폰도 이날 밤까지만 사용 가능하다. 이베이코리아는 프리미엄 멤버십 ‘스마일클럽’ 회원에게는 최대 30만원, 3만원, 1만원이 할인되는 ‘20% 할인쿠폰’ 3종을, 일반회원에게는 최대 5000원까지 할인되는 ‘15% 할인쿠폰’을 제공했다. G마켓과 옥션, G9에서 ‘빅스마일데이 스티커’가 부착된 모든 상품에 쿠폰이 적용된다. 클럽 회원이 아니더라도 한 달 무료 체험을 신청하면 회원 전용 혜택을 모두 받을 수 있다.마지막 ‘특가딜’도 공개한다. 특히 가격대가 비교적 높은 디지털·가전 제품을 선보인다. 스마일클럽 전용 쿠폰 활용 시 G마켓에서 ‘LG 퓨리케어 360 공기청정기+무빙휠’을 93만9000원에, ‘포스트모던 LED 수납침대SS’를 15만1200원에, ‘위닉스 제습기 16리터’를 32만9000원에 각각 구매할 수 있다. 호텔 숙박권인 ‘히든 클리프 호텔네이처 제주’ 역시 클럽 특별가 12만8800원에 선보인다. 옥션에서는 ‘브라운 전기면도기 시리즈9 9355s 패키지’를 클럽특별가 22만1600원에, ‘테팔 프로스타일 IH 프라이팬28cm·볶음팬28cm세트’를 클럽특별가 3만8690원에 판매한다.중저가 상품도 다양하다. 주로 패션, 뷰티, 생필품, 식품 등이 있다. 추천 상품을 클럽특별가로 살펴봤을 때 G마켓에서는 ‘닥터자르트 화장품’을 1만5950원부터 판매하고, 옥션에서도 ‘비비고 사골곰탕 500g 18개’를 클럽특별가 1만2930원에, ‘헤지스 키즈 아동 반팔티셔츠’를 클럽특별가 2만590원에 각각 판매한다. G9에서는 크리넥스 3겹 데코앤소프트 화장지, 하기스 2020년형 매직컴포트, LG생활건강 시리우스 반려동물 사료 모음 등 다양한 생필품을 비롯해 QCY T6 블루투스 무선 이어폰, 스타우브 4쿼트 라운드 냄비 4종 등 인기 해외직구 상품을 만나볼 수 있다.김태수 이베이코리아 영업본부 본부장은 “역대급 실적을 기록하고 있는 빅스마일데이가 오늘 밤 12시에 종료된다”며 “마지막 날에는 미처 사용하지 못한 쿠폰을 쓰려는 수요가 몰리는 점에 착안해 다양한 인기상품을 풍성하게 준비한 만큼 남은 혜택을 모두 누리시길 바란다”고 전했다.차민영 기자 blooming@asiae.co.kr <ⓒ경제를 보는 눈, 세계를 보는 창 아시아경제 무단전재 배포금지>",/news/news_read.nhn?article_id=0004686269&office_id=277&mode=search&query=LG생활건강&page=1
,"# ‘닷컴 버블’은 1990년대말 일이다. ‘닷컴’과 연이 닿기만 하면 주가가 뛰었다. 묻지도, 따지지도 않았다. 젊은 벼락부자들이 쏟아졌다. 대망의 밀레니엄(2000년대)에 버블이 터졌다.# ‘코로나 버블’은 지금 얘기다. 코로나발(發) 위기에 각국이 천문학적 규모로 돈을 풀면서다. 주가는 폭락 이전 수준을 회복하고, 더 뛰는 중이다. 경기는 안 좋다는데, 주가는 달린다. 이 버블이 언제 터질지는 의견이 갈린다. ‘곧’과 ‘2~3년 뒤’로.버블이라고 모든 기업의 주가가 뛰는 건 아니다. ‘닷컴 버블’ 때도 IT주와 굴뚝주의 희비가 엇갈렸다. 이어 ‘성장주 vs 가치주’ 논쟁이 불거졌다. ‘투자의 귀재’ 워런 버핏은 당시 IT주에 등을 돌리면서 버블에 올라타지 못했다. 버핏이 운영하는 투자회사 버크셔 해서웨이 고객들의 불만은 컸다. 하지만 버블이 꺼지자 고객들은 “역시 버핏!”을 외쳤다.‘코로나 버블’은 ‘닷컴 버블’과 판박이다. ‘언택트주’와 ‘콘택트주’(느슨하게 말하면 IT주와 굴뚝주의 다른 이름)의 희비가 갈리고 있고, ‘성장주 vs. 가치주’ 논쟁도 재현 중이다. 버핏의 이름도 다시 등장한다. 다만 버핏의 행보는 달라졌다. 닷컴 버블 때 IT주를 외면하고, 굴뚝주를 택했던 버핏은 이번에는 언택트주를 멀리 하는 동시에 콘택트주도 버렸다. 포트폴리오 내 주요 종목인 항공, 은행 등을 손절매했다. “시장이 암울해, 살 만한 주식이 없다”면서.버핏은 이번에도 마지막에 웃을까.한국 증시 투자자들은 버핏과 동행하지 않았다. 그 방증이 ‘카카오 열풍’이다. 언택트주의 대표주자 카카오 앞에는 ‘진격의’라는 수식어가 붙었다. 사업이든, 주가든, 펄펄 나는 중이다. 콘택트주를 대상으로 ‘도장 깨기’가 한창이다. 시가총액에서 현대차를 제치더니(9위), LG생활건강도 제쳤고(8위), 이제 삼성SDI를 추격 중이다. (7위 눈앞)언택트주의 레벨 업은 이제 시작일 수 있다. 옆 나라 중국이 1800조원에 달하는 부양책에 시동을 걸었고, 안에서는 한국판 뉴딜이 발걸음을 뗐다. 모두 5G, AI, 빅데이터, 친환경(2차전지), 바이오 등 언택트주와 맥이 닿아 있다.중국의 움직임은 한국에 미치는 영향이 절대적이다. 2009~2011년 한국 증시의 ‘차·화·정(자동차·화학·정유)’ 열풍이 중국발(發)이듯, 이번에는 언택트주들의 광풍을 예상하는 의견이 나온다.닷컴 버블 당시 ‘벽돌과 회반죽(brick & mortar)’, ‘벽돌과 클릭(brick & click)’이라는 표현이 사용됐다. ‘brick & mortar’는 전통기업을, ‘brick & click’은 전통기업의 IT 신사업 병행을 뜻했다.지금 미국에서는 ‘F·A·N·G(페이스북·애플·넷플릭스·구글)’이, 한국에서는 ‘언택트 3대장(네이버·카카오·엔씨소프트)’이 판을 뒤집고 있다. 성장성에 실적까지 검증받은 테크 자이언트들로, ‘click & click’으로 부를 만하다.뉴욕타임스는 ‘디지털 퍼스트’에 맞춰 모토를 바꿨다. ‘지면에 맞는 모든 뉴스(All the News That’s Fit to Print)’에서 ‘Print(지면)’만 ‘Click(온라인)’으로 바꿔 방향 전환을 알렸다.테크 자이언트들은 한 단어만 더 바꾸면 된다. ‘News’를 ‘Services’로.
- Copyrights ⓒ 헤럴드경제 & heraldbiz.com, 무단 전재 및 재배포 금지 -",/news/news_read.nhn?article_id=0001678756&office_id=016&mode=search&query=LG생활건강&page=1
,"[앵커]경제 회복 기대감에 단숨에 2000선을 회복한 코스피가 오늘도 양호한 흐름을 이어가고 있습니다.원 달러 환율도 소폭 하락 중입니다.현재 증시 상황, 류정훈 기자 연결해 알아봅니다.오늘(27일) 증시 분위기 어떻습니까?[기자]어제 2020선 안착에 성공한 코스피는 오늘 소폭 하락 출발했습니다.개인투자자의 매수세에 힘입어 반등한 코스피는 장중 2040선을 넘기도 했지만 하락세로 전환했습니다.개인이 3600억 원 가까이 순매수하고 있는 가운데 외국인과 기관투자자는 각각 2500억 원, 1100억 원가량 매도우위를 보이고 있습니다.전문가들은 미중 무역갈등 우려보다는 간밤 뉴욕증시 상승을 이끈 경기회복에 대한 기대감이 높은 상황이라고 분석했습니다.11시 30분 현재 코스피는 0.09% 내린 2027.88, 코스닥은 0.78% 내린 723.45에 거래 중입니다.[앵커]최근 네이버와 카카오의 주가 상승세가 심상치 않은 모습인데요.오늘은 어떤가요?[기자]네, 오늘은 두 종목 모두 그동안 상승 피로감으로 하락하고 있습니다.네이버는 전 거래일 대비 4.6%, 카카오는 3.7% 하락 중인데요.두 종목 모두 최근 코로나19 사태로 인해 언택트가 주목받으면서 가파르게 올랐습니다.코로나19 이후 온라인 서비스가 빠르게 자리 잡으면서 두 회사의 1분기 매출도 지난해보다 크게 올랐고요.이에 네이버는 시가총액 3위 삼성바이오로직스를 바로 턱밑까지 추격했고, 카카오는 현대차와 LG생활건강을 제치고 9위에 올랐습니다.[앵커]외환시장 분위기도 짚어주시죠?[기자]네, 서울 외환시장에서 원 달러 환율은 전거래일 대비 90전 내린 1235원 30전에 거래 중입니다.어제보다 3원 80전 하락하면서 출발했지만 이후 하락폭을 줄이는 모습인데요.경기 재개 기대감과 미중 무역분쟁 재점화에 대한 기대와 우려가 섞이면서 박스권 등락을 보이고 있습니다.SBSCNBC 류정훈입니다.
 류정훈 기자(you@sbs.co.kr) ▶ ▶ 저작권자 SBS미디어넷 & SBS I&M 무단전재-재배포 금지",/news/news_read.nhn?article_id=0000212406&office_id=374&mode=search&query=LG생활건강&page=1
"G마켓·옥션·G9, 최대 할인행사 27일 밤 12시 종료…금액대별 맞춤 특가딜 전진 배치","[CBS노컷뉴스 김연지 기자]국내 최대 이커머스인 이베코리아의 이쇼핑 축제 '빅스마일데이'가 27일 자정을 끝으로 9일간의 대장정을 마무리한다.27일 이베이코리아는 자사가 운영하는 G마켓, 옥션, G9 등 3개 쇼핑사이트에서 진행중인 '빅스마일데이'가 이날을 마지막으로 종료된다고 밝혔다.지난 19일부터 시작된 빅스마일데이는, G마켓, 옥션, G9 등 각 사이트에서 최대 30만원의 할인 쿠폰을 제공해왔다. 이베이코리아는 ""빅스마일데이를 선보인 이래, 올해 역대급 실적을 기록하고 있다""고 전했다.할인쿠폰은 각 사이트 별 4종씩 지급된다. 프리미엄 멤버십 회원인 '스마일클럽'에게는 최대 30만원, 3만원, 1만원이 할인되는 '20% 할인쿠폰' 3종을, 일반회원에게는 최대 5천원까지 할인되는 '15% 할인쿠폰'을 선보인다. G마켓과 옥션, G9에서 판매하는 상품 중 '빅스마일데이 스티커'가 부착된 모든 상품에 쿠폰이 적용된다. '스마일클럽' 회원이 아니더라도 한 달 무료 체험을 신청하면 회원 전용 혜택을 모두 받을 수 있다.마지막 득템 '특가딜'도 공개한다. 특히 남은 할인쿠폰을 효율적으로 활용할 수 있도록 가격대별 인기 상품을 선별했다.우선, 가격대가 비교적 높은 디지털, 가전 제품을 선보인다. 스마일클럽 전용 최대 30만원 할인쿠폰을 활용하기 적절하다. 해당 쿠폰 적용 시 G마켓에서 'LG 퓨리케어 360 공기청정기+무빙휠'을 93만9천원에, '포스트모던 LED 수납침대SS'를 15만1200원에, '위닉스 제습기 16리터'를 32만9천원에 각각 구매 할 수 있다. 호텔 숙박권인 '히든 클리프 호텔네이처 제주' 역시 클럽특별가 12만8800원에 선보인다. 옥션에서는 '브라운 전기면도기 시리즈9 9355s 패키지'를 클럽특별가 22만1600원에, '테팔 프로스타일 IH 프라이팬28㎝·볶음팬28㎝세트'를 클럽특별가 3만8690원에 판매한다.최대 3만원, 1만원 할인쿠폰을 활용할 수 있는 중저가 상품도 다양하다. 주로 패션, 뷰티, 생필품, 식품 등이 있다. 추천 상품을 클럽특별가로 살펴봤을 때, G마켓에서는 '닥터자르트 화장품'을 1만5950원부터 판매하고, 옥션에서도 '비비고 사골곰탕 500g 18개'를 클럽특별가 1만2930원에, '헤지스 키즈 아동 반팔티셔츠'를 클럽특별가 2만590원에 각각 판매한다.G9에서는 △크리넥스 3겹 데코앤소프트 화장지 △하기스 2020년형 매직컴포트 △LG생활건강 시리우스 반려동물 사료 모음 등 다양한 생필품을 비롯해 △QCY T6 블루투스 무선 이어폰 △스타우브 4쿼트 라운드 냄비 4종 등 인기 해외직구 상품을 만나볼 수 있다.이베이코리아 영업본부 김태수 본부장은 ""마지막 날에는 미처 사용하지 못한 쿠폰을 쓰려는 수요가 몰리는 점에 착안해 다양한 인기상품을 풍성하게 준비한 만큼, 남은 혜택을 모두 누리시길 바란다""고 전했다.anckyj@cbs.co.kr저작권자 © CBS 노컷뉴스 무단전재 및 재배포 금지",/news/news_read.nhn?article_id=0003364703&office_id=079&mode=search&query=LG생활건강&page=1
1.42포인트 오른 2031.20 마감개인 3200억원치 순매수시총 상위주 하락 우위…희토류·조선株 강세,"[이데일리 김윤지 기자] 27일 코스피 지수가 강보합 마감했다. 경제 재개 및 중국 부양정책에 대한 기대감과 미중 관계 악화 우려가 뒤섞이면서 증시는 방향성을 잡지 못했다. 그동안 상승을 주도했던 언택트·2차전지 대형주는 한템포 쉬어갔다. 마켓포인트에 따르면 이날 코스피지수는 전 거래일 대비 1.42포인트(0.07%) 오른 2031.20에 마감했다. 하락으로 출발해 한때 2019선까지 미끄러졌지만 2020~2040선 사이 박스권 등락을 반복했다 2031선에서 거래를 마쳤다. 노동길 NH투자증권 연구원은 “금일 국내 주식 시장은 미중 마찰 고조를 앞두고 상승 속도를 줄여가는 모습”이라면서 “과거와 달리 경기 침체에 진입한 미국이 실효성 있는 관세 부과 조치에 나서지 않으리라는 기대가 주식시장 영향을 제한하고 있으나 미국 제재 범위에 따라 대응하는 편이 낫다”고 판단했다. 유가증권시장에서 개인은 3214억원을 순매수했다. 기관은 859억원, 외국인은 2193억원을 순매도했다. 개인은 4818억원을 팔아치웠다. 프로그램 매매는 차익과 비차익을 합쳐 2226억원 순매도 우위를 기록했다.업종별로는 상승 우위를 보였다. 이날 상한가를 기록한 TBH글로벌(084870)을 포함한 섬유의복이 3.32% 오른 가운데 기계, 은행, 철강및금속, 건설업 등이 2%대 상승세를 그렸다. 의약품, 서비스업, 통신업이 1%대 빠졌고, 비금속광물과 화학이 1% 미만으로 하락했다.
시가총액 상위 종목에선 하락 우위였다. 삼성전자(005930)가 1.32%, 현대차(005380)가 0.31% 올랐지만 최근 강세를 보인 언택트 대형주 NAVER(035420)(-4.39%)와 카카오(035720)(-3.52%), 2차 전지 대형주 삼성SDI(006400)(-5.93%)와 LG화학(051910)(-4.47%) 모두 하락했다. 역시 최근 성과가 좋았던 삼성바이오로직스(207940)도 3%대 하락했다. SK하이닉스(000660), 셀트리온(068270), LG생활건강(051900)이 1% 미만으로 빠졌다. 종목별로는 희토류 관련주가 급부상했다. 미중 관계 악화 우려에 중국의 희토류 무기화 가능성이 제기되면서 유니온머티리얼(047400)이 17.56%, 대성화원이 10.17% 올랐다. 한국수출입은행이 조선산업에 대한 지원금을 당초 3조8000억원에서 5조2000억원으로 확대한다는 소식에 조선주도 강세였다. 현대미포조선(010620)(11.67%), 삼성중공업(010140)(11.53%), 대우조선해양(042660)(10.70%) 올랐다. 그린 뉴딜 기대감이 이어져 태양광 관련 업체인 신성이엔지(011930)도 24.87% 상승했다 . 이날 거래량은 11억6000만주, 거래대금은 12조4575억원으로 집계됐다. 상한가 1개 종목을 포함해 477개 종목이 상승했고 하한가 종목 없이 362개 종목이 하락했다. 65개 종목은 보합권에서 거래를 마쳤다.김윤지 (jay3@edaily.co.kr)＜ⓒ종합 경제정보 미디어 이데일리 - 무단전재 & 재배포 금지＞",/news/news_read.nhn?article_id=0004649770&office_id=018&mode=search&query=LG생활건강&page=1
▶ 네이버 홈에서 [한국경제TV] 채널 구독하기 [생방송보기]▶ 대한민국 재테크 총집결! - [증권 / 주식상담 / 부동산],"[한국경제TV 신재근 기자]코스피가 미중 갈등 고조 분위기 속에 소폭 올랐다.27일 코스피는 전 거래일 대비 1.42포인트(0.07%) 오른 2,031.20에 거래를 마쳤다.외국인(2,193억원 순매도)과 기관(859억원 순매도)이 하루 만에 팔자로 돌아섰지만 개인(3,213억원 순매수)이 지수 하락을 방어하는 모습이었다.이경민 대신증권 연구원은 ""코로나19 백신 관련 긍정적인 뉴스와 경제 활동 재개 기대감에 불구하고 시장은 미중 갈등에 주목했다""고 평가했다.미중 간의 긴장감이 확대되며 증시 상승폭이 제한적이었다는 것이다.업종별로는 철강·금속(2.29%)과 기계(2.74%), 건설(2.19%) 업종이 전날에 이어 강세를 보였다.코스피 시가총액 상위 10개 종목은 삼성전자(1.32%)와 현대차(0.31%)가 상승 마감했다.SK하이닉스(-0.61%)와 삼성바이오로직스(-3.26%), NAVER(-4.39%), 셀트리온(-0.70%), LG화학(-4.47%), 삼성SDI(-5.93%), 카카오(-3.52%), LG생활건강(-0.71%)은 내렸다.개별 종목에서는 현대미포조선(11.67%)과 삼성중공업(11.53%), 대우조선해양(10.70%) 등이 강세를 나타냈다.코스닥은 소폭 내렸다.코스닥지수는 전날보다 4.52포인트(-0.62%) 내린 724.59에 장을 마쳤다.코스피와 마찬가지로 개인(4,286억원 순매수) 자금이 유입됐지만 외국인(2,917억원 순매도)과 기관(1,244억원 순매도)이 동반 매도로 지수를 끌어내렸다.개인은 이날 유통(2,070억원 순매수)에 전체 순매수의 절반가량을 할애했다.코스닥 시총 상위 종목에선 알테오젠(9.38%)과 씨젠(1.60%), CJ ENM(1.18%), 에코프로비엠(1.28%), 스튜디오드래곤(0.90%)이 올랐다.셀트리온헬스케어(-4.48%)와 셀트리온제약(-4.06%)은 글로벌 사모펀드 원에쿼티파트너스의 셀트리온헬스케어 주식 블록딜(시간외 대량매매) 소식에 약세를 기록했다.에이치엘비(-1.50%)와 펄어비스(-1.99%), 케이엠더블유(-0.34%)도 하락했다.서울 외환시장에서 원/달러 환율은 전날보다 0.1원 오른 1,234.4원에 종가가 결정됐다.신재근기자 jkluv@wowtv.co.krⓒ 한국경제TV, 무단 전재 및 재배포 금지",/news/news_read.nhn?article_id=0000873886&office_id=215&mode=search&query=LG생활건강&page=1
