head,text,url
,"유통업계가 22일 ‘지구의 날’을 맞아 친환경 행보에 적극 나서고 있다. 4월 22일 지구의 날은 지구 환경오염 문제의 심각성을 알리기 위해 제정한 지구 환경보호의 날이다. 뷰티·생활용품 업계는 친환경 상품 비중을 높여 ‘착한 소비’를 유도하는 마케팅을 펼치고 있다. 아모레퍼시픽 프리메라는 생태습지 보호 친환경 캠페인 ‘러브 디 어스’ 한정판 에디션을 내놓았다. 생태습지 보호의 의미를 담은 디자인을 적용했으며 판매 수익금 일부를 동아시아 람사르 지역센터의 습지 보호 활동에 기부한다. LG생활건강 빌리프는 대표 상품인 ‘더 트루 크림-아쿠아밤’을 친환경 패키지에 담아 대용량 한정판 에디션으로 선보였다. 버려지는 자원을 업사이클링하는 친환경 라이프스타일 브랜드 큐클리프와 디자인 협업을 진행했다. 생활용품 업계의 움직임도 활발하다. 삼광글라스는 30일까지 글라스락 공식몰에서 ‘만원의 행복, 만원의 기부’ 환경 캠페인을 실시한다. 플라스틱 대신 재사용이 가능한 유리용기 사용을 권장하고자 마련했다. 이벤트 상품으로 지정된 글라스락 상품 3가지를 선택해 만원에 구입하면 동일한 상품이 여성환경연대에 기부된다. 락앤락도 27일까지 락앤락몰에서 환경 실천을 독려하기 위한 ‘텀블러 기획전’을 마련했다. 인기 텀블러와 머그컵 110여 개 상품을 최대 61% 할인가에 선보인다. 이경숙 락앤락 한국영업본부 상무는 “자신의 라이프스타일에 맞는 텀블러를 장만해 일상 속 친환경 실천을 이어가기 바란다”고 했다. 이밖에도 편의점 세븐일레븐은 20일 서울 성북본점에서 1년 간 전국 1만 여 가맹점에서 모금한 ‘미세먼지 예방 동전 모금액’ 약 8900만 원을 환경재단에 전달했다. 모금액은 미세먼지 취약계층인 어린이 통학차량에 공기청정기를 설치하는데 사용할 예정이다.정정욱 기자 jjay@donga.com / - Copyrights ⓒ
무단 전재 및 재배포 금지 -",/news/news_read.nhn?article_id=0000814980&office_id=382&mode=search&query=LG생활건강&page=2
"H&B스토어 적극 공략 ""국내외 시장서 고루 성장""'창업자' 이진욱·김소희 대표 '뚝심'…""남들이 안하는 것에 도전""","(서울=뉴스1) 배지윤 기자 = 세계가 주목한 K뷰티 브랜드 닥터자르트와 3CE(쓰리컨셉아이즈)가 지난해에도 매출이 30% 이상 늘어나며 '성공신화'를 이어갔다. 글로벌 화장품 업계가 경기 부진 여파로 고전하고 있는 상황이어서 이들의 성적표가 더 돋보인다. 22일 금융감독원 전자공시에 따르면 더마코스매틱 브랜드 닥터자르트를 운영 중인 해브앤비는 지난해 매출 6347억원을 기록했다. 이는 전년(4681억원) 대비 35.3% 증가한 것으로 미샤·어퓨를 운영 중인 에이블씨엔씨(4222억원)의 매출을 훌쩍 넘어섰다. 같은 기간 영업이익은 전년대비 8% 늘어난 1214억원을 달성했다. 회사 설립 이후 꾸준한 성장세를 이어가고 있다. 에스티로더가 해브앤비에 처음으로 지분 투자를 단행한 2015년 매출은 862억원 수준이었다. 2016년에는 전년 대비 175% 성장한 2370억원을 기록했다. 또한 2017년 3630억원, 지난해 4700억원을 기록하는 등 매년 매출 앞자리수를 갈아치우며 고공성장을 거듭했다.특히 지난해에는 에스티로더그룹이 해브앤비의 나머지 지분 66.7%를 전량 인수해 이목이 집중됐다. 구체적인 매각 금액은 알려지지 않았지만 1조원 이상일 것이란 게 대체적인 분석이다. 업계에서는 해브앤비의 기업 가치를 '2조원'으로 추정했다. 색조화장품 브랜드 3CE를 전개하는 난다도 지난해 2695억원의 매출을 기록했다. 이는 전년도(1967억원) 보다 37% 가량 늘어난 수치다. 같은 기간 영업이익은 전년(360억원) 대비 71.7% 늘어난 618억원을 기록했다.해브앤비와 3CE의 고공행진 뒤에는 H&B(헬스앤뷰티) 스토어가 있다. 인지도나 영업망이 부족한 단점을 H&B를 통해 극복한 셈이다. 먼저 닥터자르트는 미국의 뷰티 편집숍 세포라에 입점해 '피부과 화장품'이라는 점을 적극 내세워 관심몰이에 성공했다. 이후 한 번 써본 소비자들이 품질에 만족, 다시 찾기 시작하면서 글로벌 뷰티 브랜드 반열에 이름을 올렸다. 이후 중국 등 글로벌 시장에 순차적으로 진출했다. 3CE는 트렌디한 색상으로 중국 밀레니얼 세대들의 호응을 얻었다. 3CE 브랜드를 상징하는 특유의 '세모 마크'와 컬러를 박스 및 제품 발색력은 화려한 것을 좋아하는 중국인들의 눈길을 사로잡기에 충분했다.이처럼 해외 시장 진출 결과는 '대성공'이었다. 해브앤비(닥터자르트) 해외법인 실적 추이를 살펴보면 해외 실적도 매년 수직 상승하고 있다. 먼저 해브앤비의 상하이 법인은 지난 2018년 345억원의 매출을 기록한 데 이어 지난해에도 750억원을 기록하며 두배 가까이 성장했다. 미국 법인도 235억원의 매출을 냈다. 이 밖에 일본·미주·동남아·유럽 등 세계 38개국 9000여개 스토어에서 입지를 공고히 하고 있다. 그 결과 면세점 매출을 제외한 닥터자르트의 해외 매출 비중은 30%에 이른다.난다가 소유한 3CE 역시 절반 가까운 매출을 글로벌 시장에서 낼 수 있었던 이유는 중국 시장의 성공 덕분이다. 특히 '왕홍'(유명인사)을 통해 3CE 제품을 소개하면서 현지에서 안정적으로 안착하는 데 성공했다.이처럼 1세대 기성(아모레퍼시픽·LG생활건강) 화장품과 2세대 로드숍(더페이스샵·미샤 등) 화장품에 이어 닥터자르트·3CE 등 3세대 화장품의 성공은 창업주들의 '뚝심'에서 비롯됐다는 분석이 나온다. '남들이 안하는 것' 또는 '남들이 뭐라 하더라도' 과감한 도전을 이어나간 것이 성공 비결로 꼽힌다.실제로 이진욱 해브앤비 대표는 지난 2004년 중소 화장품 회사로 시작해 생소한 분야인 '더마코스메틱' 시장에 뛰어들어 닥터자르트 성공을 이끌어낸 주인공이다. 또한 다른 K뷰티 브랜드가 중국에 진출할 때 미국 시장에 진출해 새로운 시장을 개척하며 화장품 업계 '대박 신화'를 이뤘다.난다도 김소희 전 대표가 지난 2005년 22세의 나이로 동대문에서 시작, 규모를 키워 나갔다. 그는 창업 당시 주변에서 '잘 안 될 것'이라는 시선도 있었지만 ""내가 가는 길이 곧 길이 된다"" 일념으로 의류·화장품을 아우르는 브랜드로 난다를 키웠다.이후 김 전 대표는 지난 2017년 글로벌 화장품 회사인 '로레알'에 매각하며 손을 뗐다. 전문경영인이 필요하다 느낀 그는 로레알그룹이라는 새 주인에게 지분 전량을 넘겼다. 물론 매각 이후에도 꾸준한 인기를 얻으며 견조한 실적을 이어가고 있다.업계 관계자는 ""닥터자르트나 3CE는 더마 코스메틱 시장이나 색조 화장품 시장에서 타 브랜드와는 차별화된 경쟁력을 기반으로 화장품 시장에 '포지셔닝'하면서 주목받았다""면서 ""셀 수 없이 많은 화장품 브랜드들이 출시되고 있는 가운데 중소 화장품 업체들은 '제 2의 닥터자르트' '제 2의 3CE'를 꿈꾸며 화장품 사업을 전개하고 있다""고 말했다.jiyounbae@news1.kr© 뉴스1코리아(), 무단 전재 및 재배포 금지",/news/news_read.nhn?article_id=0004600095&office_id=421&mode=search&query=LG생활건강&page=2
장 초반 개인·외국인 '사자'…시총상위株 약세 우위,"[이데일리 이슬기 기자] 코스피 지수가 1%대 하락 출발했다. 국제유가 폭락과 이에 따른 미국 증시 하락의 영향을 받은 것으로 해석된다.22일 마켓포인트에 따르면 이날 오전 9시 7분 현재 코스피 지수는 전 거래일 대비 1.12% 내린 1858.31을 기록 중이다.간밤 미국 증시는 국제유가 폭락에 따른 하락세를 이어갔다. 나스닥지수는 전 거래일 대비 3.48% 떨어진 8263.23에 장을 마쳤고, S&P500 지수는 3.07% 떨어진 2736.56에 장을 마감했다. 이는 유가 폭락에 따른 것인데, 전날 배럴당 -37달러까지 떨어졌던 5월물 서부텍사스산원유(WTI)는 10.01달러로 다시 올라오며 만기를 맞았지만, 6월물 WTI는 전날 대비 43.4% 떨어진 11.57달러에 거래를 마쳤다. 장중엔 70% 가까이 밀리면서 6.50달러를 기록하기도 했다.장 초반 개인과 외국인은 각각 40억원, 60억원 가량의 주식을 사들이고 있다. 반면 기관은 115억원 어치 주식을 팔아치우는 중이다. 대부분의 업종이 내리고 있다. 운송장비, 은행, 증권, 비금속광물 업종은 2%대 하락 중이다. 금융, 섬유의복, 기계, 유통, 종이목재, 보험, 서비스, 화학, 통신, 제조, 전기전자, 음식료, 철강금속, 건설업 등은 1%대 하락 중이다. 반면 전기가스업은 1%대 상승, 운수창고 업종은 1% 미만으로 오르고 있다. 시가총액 상위종목들도 대부분 내리고 있다. 현대차(005380) 현대모비스(012330)는 3%대 하락 중이며, 삼성SDI(006400)와 NAVER(035420) POSCO(005490) 등은 2%대 내리고 있다. 카카오(035720) LG화학(051910) SK텔레콤(017670) 삼성물산(028260)은 1%대 하락 중이다. 삼성전자(005930)와 SK하이닉스(000660)는 1% 미만의 내림세를 보이고 있다. 반면 셀트리온(068270) 삼성바이오로직스(207940) LG생활건강(051900)은 1% 미만으로 오르고 있다.이슬기 (surugi@edaily.co.kr)＜ⓒ종합 경제정보 미디어 이데일리 - 무단전재 & 재배포 금지＞",/news/news_read.nhn?article_id=0004625101&office_id=018&mode=search&query=LG생활건강&page=2
,"외국인·기관 동반 순매도(서울=연합뉴스) 곽민서 기자 = 국제유가 하락으로 인한 금융시장의 불안이 이어지면서 22일 코스피가 1% 이상 떨어지는 급락세로 출발했다.

이날 오전 9시 15분 현재 코스피는 전 거래일보다 30.32포인트(1.61%) 내린 1,849.06을 가리켰다.

지수는 전장보다 23.87포인트(1.27%) 내린 1,855.51로 출발해 낙폭을 키우고 있다.

 21일(현지시간) 뉴욕 증시에서는 국제유가의 폭락세가 이어지면서 다우존스30 산업평균지수(-2.67%)와 스탠더드앤드푸어스(S&P)500 지수(-3.07%), 나스닥지수(-3.48%) 등 주요 지수가 일제히 급락했다.

 앞서 5월 인도분 서부 텍사스산 원유(WTI) 가격이 사상 처음으로 마이너스 를 기록한 데 이어 이날 6월물 WTI 가격과 북해산 브렌트유 가격도 급락하면서 시장 변동성은 더욱 확대됐다.

서상영 키움증권 연구원은 ""원유시장 붕괴에 따른 충격은 전날 증시에 어느 정도 반영됐지만, 투자심리 위축 우려가 이어지고 있다는 점은 부정적인 요인""이라고 지적했다.

이날 현재 유가증권시장에서는 기관이 509억원, 외국인이 226억원을 각각 순매도했다. 개인은 681억원을 순매수했다.

 시가총액 상위 종목 가운데는 삼성전자(-0.91%), SK하이닉스(-0.86%), 네이버(-2.24%), 현대차(-3.42%) 등이 내렸다.

 시총 10위권 내에서는 LG생활건강(0.62%)만 올랐다.

업종별로는 운송장비(-3.25%), 증권(-2.56%), 은행(-2.80%) 기계(-2.15%), 전기·전자(-1.57%) 등이 약세였고 전기·가스(0.68%)는 강세를 보였다.

 같은 시각 코스닥지수는 전 거래일보다 10.69포인트(1.70%) 내린 618.08을 나타냈다.

지수는 전장보다 9.82포인트(1.56%) 내린 618.95로 개장해 하락하고 있다.

코스닥시장에서도 기관이 177억원, 외국인이 330억원을 각각 순매도했다. 개인은 526억원을 순매수했다.

 시총 상위 종목 가운데는 에이치엘비(-0.41%), 스튜디오드래곤(-2.15%), 휴젤(-1.06%) 등이 내렸다.

씨젠(11.67%)은 이 회사의 신종 코로나바이러스 감염증(코로나19) 진단 시약이 미국 식품의약국(FDA)으로부터 긴급 사용 승인을 받았다는 소식이 전해지면서 10% 넘게 급등했다.

mskwak@yna.co.kr",/news/news_read.nhn?article_id=0011563567&office_id=001&mode=search&query=LG생활건강&page=2
▶ 네이버 홈에서 [한국경제TV] 채널 구독하기 [생방송보기]▶ 대한민국 재테크 총집결! - [증권 / 주식상담 / 부동산],"[한국경제TV 신재근 기자]코스피 시가총액 상위 종목이 장 초반 대체적으로 부진한 흐름이다.22일 오전 9시 15분 현재 삼성전자(-1.32%)와 SK하이닉스(-0.98%), NAVER(-2.52%), LG화학(-2.12%), LG생활건강(-0.23%), 현대차(-3.85%), 삼성SDI(-3.36%), 삼성물산(-1.28%) 등이 하락 중이다.간밤 국제유가가 급락하면서 주식시장 투자심리도 위축된 것으로 풀이된다.현지시간 21일 뉴욕상업거래소(NYMEX)에서 6월 인도분 WTI는 전날보다 배럴당 43.4%(8.86달러) 하락한 11.57달러에 거래를 마쳤다.신재근기자 jkluv@wowtv.co.krⓒ 한국경제TV, 무단 전재 및 재배포 금지",/news/news_read.nhn?article_id=0000865911&office_id=215&mode=search&query=LG생활건강&page=2
,"손희연 기자 son90@mt.co.kr
<저작권자 ⓒ '성공을 꿈꾸는 사람들의 경제 뉴스' 머니S, 무단전재 및 재배포 금지>",/news/news_read.nhn?article_id=0000534131&office_id=417&mode=search&query=LG생활건강&page=2
"LG전자, LG화학, LG유플러스 등 주요 12개 계열사, 로봇 사원 전면 도입클라우드 시스템과 디지털 협업 솔루션 '팀즈' 도입","[CBS노컷뉴스 김송이 기자]LG그룹이 변화의 속도를 높이고 있다. 새로운 성장 동력 발굴을 위해 박차를 가하는 동시에 전 계열사에서 '디지털 트랜스포메이션'을 추진중이다. 특히, 코로나19 확산에 따라 언택트(Untact∙비대면) 근무를 위한 디지털 업무 환경이 새로운 기업 트랜드로 확산되고 있는 가운데, LG가 로봇업무자동화 (Robotic Process Automation, 이하 RPA)와 클라우드 등 선제적으로 도입한 디지털 시스템을 통해 업무 차질을 최소화하고 있어 눈길을 끌고 있다.LG전자는 올해 말까지 약 400개 업무에 '로봇프로세스자동화(RPA, Robotic Process Automation)' 기술을 추가해 총 900개 업무에 도입할 계획이다.LG전자는 직원들이 보다 스마트하게 일할 수 있도록 지난 2018년부터 최근까지 회계, 인사, 영업, 마케팅, 구매 등 사무직 분야 약 500개 업무에 RPA 기술을 도입했다. LG전자는 특히 올해부터 RPA를 적용한 업무영역을 넓히기 위해 기존 RPA에 인공지능, 빅데이터 등을 결합한 '지능형 RPA(Intelligent RPA)'를 속속 도입하고 있다. 지능형 RPA는 단순, 반복 업무 외에도 비교, 분석 등 한층 고차원적인 업무를 수행할 수 있다.
예를 들어 지능형 RPA는 주요 국가에서 거래를 제재하고 있는 대상과 LG전자 거래선의 유사도를 분석한다. 전세계 글로벌 주요 사이트에 흩어져 게시돼 있는 7만여 제재 거래선 목록을 추출해 LG전자의 거래선과 대조한 뒤 제재 대상으로 의심되는 거래선이 있는지 알려준다.
기존 RPA의 경우 제재 거래선과 LG전자 거래선의 이름이 완벽히 일치해야만 확인이 가능했던 것에 비해 지능형 RPA는 머신러닝(Machine Learning) 기법을 활용해 거래선 명칭이 비슷한 경우에도 알려준다.LG생활건강의 '알파트장'은 사람이 컴퓨터(PC)로 처리하는 업무 프로세스를 학습해, 반복∙단순 업무를 수행한다. 실적 보고 등 사내에서 빈번하게 작업하는 엑셀 업무와 매출 및 주문 처리 등 특정 전산시스템의 입력 및 조회 등은 물론이고, 직원들이 요청한 자료를 다운로드 해 메일로 전송도 한다.
현재 알파트장은 영업, 회계, 마케팅 등 다양한 부서에 총 8대가 활약하며, 총 249개 업무를 수행하고 있다. 사람으로 치면 237명이 연간 3만 9천 시간을 투입해야 하는 업무를 대신하고 있는 것이다. 업무 성공률도 RPA 최고 수준인 95%를 기록하고 있다. 이들은 회사에 정식 인사 등록도 마쳐 사내 통신망에서 동료로서 '인명 검색'이 가능하며, 도움을 필요로 하는 업무를 신청할 수 있는 게시판 등을 통해 임직원들과 활발하게 소통하며 업무 범위를 넓혀가고 있다. LG는 현재 LG전자, LG디스플레이, LG화학, LG생활건강, LG유플러스, LG CNS, LG상사 등 12개 계열사에서 로봇 사원을 활용하고 있다. 임직원들이 단순반복업무에서 벗어나 문제 해결 등 더욱 가치 있는 일에 몰입하며 효율적으로 일할 수 있도록 하기 위해서다.코로나19 대응에도 로봇사원이 나섰다. LG CNS의 로봇사원은 2월말부터 LG 전 계열사 임직원의 코로나 일일자가진단을 실시하고 있다. 로봇사원이 매일 아침 9시 전 임직원에게 자가진단용 URL이 포함된 문자를 발송해 임직원들이 체크한 증상여부, 재택근무 여부, 확진지역 방문 여부 등을 취합하고, 이상이 있는 경우 각 계열사 담당 부서에 자동으로 알려주는 방식이다.LG는 현재 LG전자, LG화학, LG유플러스, LG CNS 등 17개 계열사가 클라우드 시스템을 적용하고 있으며, 해외 법인 포함해 약 14만명의 임직원이 사용하고 있다. 클라우드 시스템은 언제 어디서나 회사와 동일한 업무 환경을 구현할 수 있다는 장점과 함께 보안에도 강한 것이 특징이다. 회사 클라우드 시스템 접속하려면 금융거래 수준의 보안 인증 절차를 거쳐야 하기 때문에 해킹 우려가 없고, 또 클라우드 시스템에 접속한 이후에는 그 안에서만 업무 관련 파일을 작성하고 저장할 수 있기 때문에 유출 등의 보안 문제도 근본적으로 차단할 수 있다. LG 계열사들의 경우, 외부 인터넷을 통해 사내 클라우드 시스템에 접속할 때 개인ID 및 비밀번호와 함께 1분마다 숫자가 계속 바뀌는 6자리의 모바일 일회용 비밀번호(OTP: One Time Password)나 문자메시지를 통해 받은 인증번호를 함께 입력하도록 하는 등 이중 보안 인증 절차를 거치도록 하고 있다.LG는 클라우드 전환에 더욱 박차를 가해 2023년까지 계열사 IT시스템의 90% 이상을 전환할 계획으로, 이를 위해 올해는 전 계열사의 클라우드 전환율을 50% 이상으로 끌어올릴 예정이다.이와 함께 LG화학은 이달 1일부터 마이크로소프트의 메신저 기반 협업 솔루션인 '팀즈(Teams)'를 한국, 중국, 미국, 폴란드 등 전 세계 사업장의 사무기술직 임직원 1만 8,500명을 대상으로 전면 도입했다. 국내 기업의 팀즈 도입 사례 중 최대 규모이다.LG화학은 팀즈 도입으로 디지털 업무공간에서 누구나 검색 한 번으로 업무 히스토리는 물론 맥락까지 파악할 수 있게 돼, 장소나 시간에 구애 받지 않는 비대면(Untact), 무중단(Unstoppable), 무제한(Unlimited)의 '3U 업무 시스템' 구축이 가능할 것으로 기대하고 있다.또 LG화학은 임직원의 신속하고 효율적인 업무 소통을 지원하기 위해 사내 시스템에 다국어 번역 시스템도 도입했다. 이에 따라 임직원은 이메일, 메신저, 전자결재는 물론 첨부파일까지 사내 시스템에 올라온 다양한 정보를 클릭 한 번에 영어, 중국어, 폴란드어 등 최대 22개국어로 번역할 수 있다.특히 사내 번역 시스템에 적용된 AI 기능이 번역의 정확도를 높인다. 전세계 17개국, 60개 사업장에 근무 중인 LG화학 임직원은 업계 용어는 물론, 자주 사용하는 사내 용어까지 정교하게 번역된 결과물을 제공받게 된다.한편, LG는 제품∙서비스 가치를 혁신하기 위해 디지털 기술을 기반으로 일하는 방식 등을 변화시켜나가는 '디지털 트랜스포메이션(Digital Transformation)'을 적극 추진하며, 이 일환으로 IT시스템을 지속 강화하고 있다. 이와 관련, 구광모 LG 대표는 ""디지털 트랜스포메이션이 더 나은 고객 가치를 창출하는 핵심 수단이자, 우리의 경쟁력을 한 차원 끌어올리기 위해 꼭 필요한 변화 중 하나일 것""이라며, ""최고경영진이 몸소 '주체'가 되어, 실행 속도를 한 차원 높여가자""고 당부한 바 있다.onlysongyee@cbs.co.kr저작권자 © CBS 노컷뉴스 무단전재 및 재배포 금지",/news/news_read.nhn?article_id=0003352321&office_id=079&mode=search&query=LG생활건강&page=2
"""유가 변동성과 美 IT주 약세 영향"" 분석","[서울경제] 유가 변동성 우려 확대로 인해 국내 유가증권시장이 약세를 이어가고 있다.22일 오전 1시41분 현재 코스피는 전날보다 11.94포인트(0.64%) 내린 1,867.44를 기록하고 있다. 이날 코스피는 전장보다 23.87포인트 빠진 1,855.51포인트에 거래를 시작한 이후 오전 내내 1,840~1,850선을 왕복했다.지난 21일(현지시간) 미국 뉴욕상업거래소(NYMEX)에서 6월 인도분 서부텍사스산원유(WTI)가 전날보다 배럴당 8.86달러(43.4%) 하락한 11.57달러에 거래를 마치는 등 유가 불안이 커지고 있는 게 증시 약세에 영향을 끼쳤다. 그러나 이후 낙폭이 다소 줄어들며 코스피는 1,870선을 회복하기도 했다.투자자별로는 개인이 4,000억원을 순매수하고 있다. 기관은 3,200억원 순매도를 보이고 있으며 외국인 역시 970억원어치의 주식을 국내 유가증권시장에서 팔아치웠다.노동길 NH투자증권 연구원은 “오늘 국내 주식시장은 유가 변동성과 미국 정보기술(IT) 주가 하락 영향에 동반 하락 중”이라며 “지수 하락을 견인하고 있는 업종은 유가 영향력이 높은 민감주”라고 분석했다.시가총액 상위 종목 중에선 삼성전자가 0.51% 내린 가운데 SK하이닉스(1.85%), LG생활건강(2%), SK텔레콤(1.43%) 등이 강세를 보이고 있다. LG화학(-1.55%), 현대차(-1.28%), POSCO(-2.63%) 등은 전날보다 주가가 내렸다.같은 시각 코스닥 지수는 전날보다 1.42포인트(0.23%) 하락한 627.35를 나타내고 있다. 이날 코스닥 지수는 전날보다 9.82포인트 내린 618.95에 거래를 시작한 이후 계속 약세를 보였다. 그러나 오후 1시 들어 강세로 전환하는 등 오전에 비해선 낙폭을 줄였다. 거래주체별로는 개인이 1,150억원을 순매수하는 가운데 외국인(630억원), 기관(390억원)이 매도세를 보이고 있다.시가총액 상위 종목 중에선 씨젠이 10% 이상 오르며 전장 대비 강세를 보이고 있다. 셀트리온헬스케어(3.21%), CJ ENM(2.22%) 등도 전날보다 오른 모습이다./심우일기자 vita@sedaily.com저작권자 ⓒ 서울경제, 무단 전재 및 재배포 금지",/news/news_read.nhn?article_id=0003728040&office_id=011&mode=search&query=LG생활건강&page=2
