head,text,url
,"LG생활건강(대표: 차석용)은 더마코스메틱 브랜드 '케어존'의 신규 광고 모델로 배우 김동희를 발탁했다고 23일 밝혔다. 김동희는 화제의 JTBC 금·토 드라마 '이태원 클라쓰'에서 '장근수'역을 맡아 섬세한 감정선의 입체적인 캐릭터로 많은 사랑을 받고 있다.케어존은 김동희의 '멍뭉미' 넘치는 순둥순둥한 이미지를 살려 트러블 및 각질 케어 제품인 '아큐어 원샷 각질 토너패드', '딥클린 젠틀 필링젤' 2종의 홍보활동을 진행한다. 이 두 제품은 환절기 일교차와 더불어 상시 마스크 착용으로 잦아지는 피부 자극으로 발생한 피부 고민을 케어하고 매끈 뽀얀 복숭아 피부로 가꿔주는 제품으로 '복숭아토너패드' '복숭아필링젤'이라는 애칭이 붙었다. 최근 '귀염뽀짝'한 복숭아 테마 증정품이 포함된 한정 기획 제품을 출시해 소장가치를 높였다. 앞서 공개된 바이럴 영상에서 김동희는 자체발광 피부를 지닌 훈남 선배로 자신의 피부 비결을 궁금해하는 새내기들에게 “나랑 복숭아할래?”라고 물으며 아큐어 원샷 각질 토너패드(복숭아토너패드)를 소개한다. 아큐어 원샷 각질 토너패드는 저자극, 고효능의 4세대 각질 제거 성분인 아미노이븐필을 함유한 포뮬러가 피부톤과 결을 매끄럽고 맑게 관리해주고 엠보면과 거즈면을 모두 갖춘 양면 토너패드로 섬세한 피부 관리를 도와준다.올리브영 온라인몰에서는 신규 출시된 특별기획 제품을 구매한 고객에게 김동희 포토카드를 선착순 증정하는 이벤트도 진행 중이다.케어존 마케팅 담당자는 “순수하고 친근한 매력의 김동희 씨는 순한 더마코스메틱 브랜드 케어존의 이야기를 전달하기에 가장 적합한 캐릭터”라며 “신학기를 앞두고 외부 환경으로 발생한 피부 고민 해결을 위해 준비한 이번 각질 케어 기획제품을 영상과 다양한 프로모션으로 홍보할 계획”이라고 말했다.▶
/ ▶ 황상석(hss0916@joseilbo.com)저작권자 ⓒ 조세일보(http://www.joseilbo.com). 무단전재 및 재배포 금지",/news/news_read.nhn?article_id=0002220873&office_id=123&mode=search&query=LG생활건강&page=1
,"손희연 기자 son90@mt.co.kr
<저작권자 ⓒ '성공을 꿈꾸는 사람들의 경제 뉴스' 머니S, 무단전재 및 재배포 금지>",/news/news_read.nhn?article_id=0000521213&office_id=417&mode=search&query=LG생활건강&page=1
,"손희연 기자 son90@mt.co.kr
<저작권자 ⓒ '성공을 꿈꾸는 사람들의 경제 뉴스' 머니S, 무단전재 및 재배포 금지>",/news/news_read.nhn?article_id=0000521384&office_id=417&mode=search&query=LG생활건강&page=1
"아큐어 원샷 각질 토너 패드·딥 클린 젠틀 필링 젤 등김동희 순한 이미지 활용, 복숭아 캠페인","[서울=뉴시스] 김정환 기자 = 배우 김동희가 더마코스메틱 브랜드 '케어존'의 새로운 얼굴이 됐다.
LG생활건강(대표 차석용)은 맞춤형 솔루션을 제공하는 케어존 모델로 김동희를 발탁했다고 23일 밝혔다. 김동희는 JTBC 금토 드라마 '이태원 클라쓰'에서 장 회장의 서자 '장근수'를 맡아 섬세한 감정선의 입체적인 캐릭터를 표현해 사랑받는 대세 배우다. 케어존은 김동희의 '멍뭉미'(강아지를 연상시키는 귀여움) 넘치는 순한 이미지를 살려 '아큐어 원샷 각질 토너 패드' '딥 클린 젠틀 필링 젤' 등 제품 2종 홍보 활동을 진행한다. 이들 제품은 환절기 일교차와 더불어 상시 마스크 착용으로 잦아지는 피부 자극에 의해 발생한 피부 트러블과 각질을 케어해 매끈하면서 뽀얀 '복숭아 피부'로 가꿔주는 제품이다. 각각 '복숭아 토너 패드' '복숭아 필링 젤' 등으로 통한다. 앞서 공개된 바이럴 영상에서 김동희는 '자체 발광' 피부를 지닌 훈남 선배로 등장한다. 피부 비결을 궁금해하는 새내기들에게 그는 ""나랑 복숭아 할래?""라고 물으며 아큐어 원샷 각질 토너 패드(복숭아 토너 패드)를 소개한다. 아큐어 원샷 각질 토너 패드는 저자극, 고효능의 '제4세대 각질 제거 성분'인 아미노이븐필을 함유한 포뮬러로 피부 톤과 결을 매끄럽고 맑게 관리한다. 엠보 면과 거즈 면을 모두 갖춘 양면 토너 패드로 피부를 섬세히 관리할 수 있게 한다.케어존 관계자는 ""순수하고 친근한 매력의 김동희는 순한 더마코스메틱 브랜드 케어존의 이야기를 전달하기에 가장 적합한 캐릭터다""며 ""신학기를 앞두고 여러 외부 환경으로 인해 발생한 피부 고민 해결을 위해 준비한 이번 각질케어 기획 제품을 영상과 다양한 프로모션을 통해 알릴 계획이다""고 전했다.케어존은 이들 제품에 각각 최근 복숭아 테마 증정품을 포함해 특별 기획 상품을 한정 출시해 소장 가치를 높였다. '아큐어 원샷 각질 토너 패드 특별기획'은 토너 패드 60매(각질 원샷 토너 180㎖)와 증정품인 복숭아 파우치, 아큐어 마스크 2장 등으로 구성한다. 2만7000원대. '딥클린 젠틀 필링 젤 특별기획'은 필링 젤 130㎖와 증정품인 필링 젤 50㎖, 복숭아 세안 밴드 등으로 구성한다. 2만원대.헬스&뷰티 스토어 CJ올리브영 온라인 몰은 이들 특별 기획 제품 구매 고객에게 선착순으로 김동희 포토카드를 증정한다. ace@newsis.com<ⓒ 공감언론 뉴시스통신사. 무단전재-재배포 금지>",/news/news_read.nhn?article_id=0009772219&office_id=003&mode=search&query=LG생활건강&page=1
이달 외국인 10兆 '팔자'에도연기금은 2.5兆 순매수에 그쳐 삼성전자 9500억어치 담았지만15% 손실…위험관리 나선 듯낙폭 큰 유통·배당株는 사들여,"국내 주식시장이 출렁거릴 때마다 매수에 나서며 ‘소방수’ 역할을 해오던 연기금이 신종 코로나바이러스 감염증(코로나19)으로 인한 폭락장에서 몸을 사리고 있다. 초기에 대형주 중심의 매수세로 대응했지만 낙폭이 커지면서 연기금조차 대형주에 물려 있다는 분석이 나온다.23일 한국거래소에 따르면 국민연금·우정사업본부 같은 대형 기관이 포함된 연기금은 이달 들어 20일까지 2조4489억원을 순매수했다. 같은 기간 외국인의 순매도액 9조9995억원에 턱없이 못 미치는 수준이다. 8조4978억원을 순매수한 개인보다 몸을 사렸다.연기금을 대표하는 국민연금이 매수여력이 많음에도 불구하고 쉽사리 매수에 나서지 못하고 있어서다. 국민연금은 운용 계획상 올해 적립금 가운데 17.6%를 국내 주식에 투자하도록 돼 있다. 주가가 내려가면 자산 중 주식의 비중이 떨어지면서 추가 매수 여력이 생긴다. 연기금이 코스피지수 1900~2000선에서 매수세를 키웠던 이유다.하지만 이후 코스피지수가 1400대까지 떨어지면서 연기금도 개인투자자처럼 대형주에 ‘물린’ 상황이 됐다. 연기금은 이달 들어 20일까지 삼성전자를 9521억원어치 샀다. 평균 매수 단가는 주당 5만100원이다. 23일 삼성전자 종가인 4만2500원 대비 손실률은 15.16%다. 연기금이 두 번째로 많이 사들인 종목은 SK하이닉스다. 3월 들어 20일까지 4309억원어치를 사들였다. 연기금의 SK하이닉스 평균 매수단가는 주당 8만2340원으로 23일 종가(6만9400원) 대비 손실률은 15.71%다.연기금이 3월 들어 100억원 이상 순매수한 44개 상장사 가운데 연기금의 평균 매수 단가보다 주가가 오른 종목은 엔씨소프트 셀트리온 아모레퍼시픽 세 개뿐인 것으로 나타났다. 손실률이 커지면서 국민연금이 운용 원칙상 위험관리를 해야 하는 수준이 됐다는 게 전문가들의 지적이다. 공무원연금공단 등 연기금에 포함되는 기관 중 상당수는 국내 주식의 시장위험 한도가 내부운용 기준치를 넘어서면서 급히 대책 마련에 나선 것으로 전해졌다.증권업계에서는 코로나19 이후 반등장에서의 연기금 역할을 기대하고 있다. 외국인이 돌아오고 연기금이 받쳐주면 주가 상승폭이 커질 것이란 전망이다. 한 증권사 리서치센터장은 “바닥을 누구도 예측하기 어려운 변동성장이 이어지다 보니 국민연금도 섣불리 저가 매수에 나설 수 없을 것”이라며 “시장이 반등하기 시작하면 국민연금이 본격적인 상승세를 주도할 것”이라고 설명했다.연기금의 폭락장 속 포트폴리오를 좇아갈 만하다는 조언이 따르는 이유다. 연기금은 시가총액 상위주 가운데 업황 회복이 기대되는 종목을 주로 담았다. 3월 순매수액 중 56.4%가 반도체 대표주인 삼성전자와 SK하이닉스인 게 대표적 사례다.3월 들어 LG생활건강(805억원) 이마트(349억원) 호텔신라(324억원) 등 주요 유통 관련주를 순매수한 것도 눈여겨볼 만하다는 평가다. 유통주의 낙폭이 컸던 만큼 코로나19 사태 진정 후 ‘보복적 소비’에 따른 수혜를 기대할 수 있어서다. 연기금이 SK텔레콤 SK 포스코 맥쿼리인프라 등 고배당주를 폭락장 가운데서 사모으고 있다는 점도 참고할 만한 투자 포인로 꼽힌다.고윤상 기자 kys@hankyung.com▶ ▶
 ▶
ⓒ 한국경제 & , 무단전재 및 재배포 금지",/news/news_read.nhn?article_id=0004311733&office_id=015&mode=search&query=LG생활건강&page=1
"코스피 하루 만에 급락외국인+기관, 1조 순매도코스닥도 5% 이상 급락","[한국경제TV 신재근 기자]외국인의 매도 공세가 잡히지 않고 있는 가운데 코스피가 급락했다.23일 코스피는 전 거래일 대비 83.69포인트(-5.34%) 내린 1,482.46에 거래를 마쳤다.개장 전부터 시장을 둘러싼 상황은 낙관적이지 못했다.미국 선물지수가 가격제한폭까지 하락했고, 미국 경기부양책은 상원에서 합의에 실패했다.이 영향으로 코스피는 장 초반부터 5% 넘게 하락하며 지난 20일의 급등분을 대부분 반납했다.이로 인해 장중 코스피에는 사이드카가 발동되기도 했다.이경민 대신증권 연구원은 ""트럼프 행정부가 승인 요청한 2조 달러 규모의 경기부양책의 상원 투표 부결 소식이 증시에 악재로 작용했다""고 분석했다.외국인 자금 이탈은 이날도 계속됐다.외국인은 코스피에서 전기·전자(-4,419억원)를 중심으로 6,422억원을 순매도하며 13거래일 연속 매도세를 보였다.다만, 외국인은 코스피200 선물은 5천억원 가까이 순매수했다.기관 역시 금융투자(-2,752억원)와 투신(-897억원)에서 매도 물량이 나오며 3,620억원 매도우위를 기록했다.개인은 삼성전자(4,711억원)와 SK하이닉스(731억원) 등 모두 9,219억원을 순매수했다.업종별로는 의약품(4.25%)이 차별적인 강세를 보였다.코스피 시가총액 상위 종목에선 삼성전자(-6.39%)와 SK하이닉스(-7.22%), NAVER(-7.14%) 등 IT 업종의 낙폭이 컸다.이어 LG화학(-1.65%)과 LG생활건강(-3.96%), 현대차(-3.09%), 삼성물산(-7.45%)도 하락 마감했다.반면, 삼성바이오로직스(1.40%)와 셀트리온(14.75%), 삼성SDI(0.92%)는 상승했다.코스닥도 5% 이상 빠졌다.이날 코스닥지수는 전장보다 23.99포인트(-5.13%) 내린 443.76에 장을 마감했다.코스닥과 마찬가지로 외국인(-1,297억원)과 기관(-956억원)에서 매도 물량이 출회되며 낙폭이 커졌다.개인(2,114억원)은 IT와 제조업종을 중심으로 매수를 했다.업종별로는 유통(2.31%)을 제외하고 전 업종이 하락 마감했다.코스닥 시총 상위 10개 종목 가운데서는 셀트리온헬스케어(6.57%)와 씨젠(1.18%), 셀트리온제약(29.47%)이 상승했다.에이치엘비(-3.41%)와 펄어비스(-6.41%), 스튜디오드래곤(-5.28%), 케이엠더블유(-0.10%), CJ ENM(-7.83%), 휴젤(-11.25%), SK머티리얼즈(-8.42%)는 하락했다.주식시장 공포심리가 재차 확대되자 원/달러 환율은 크게 치솟았다.서울 외환시장에서 미국 달러화에 대한 원화 환율은 전장보다 20원 오른 달러당 1,166.5원에 거래를 마쳤다.신재근기자 jkluv@wowtv.co.krⓒ 한국경제TV, 무단 전재 및 재배포 금지",/news/news_read.nhn?article_id=0000858304&office_id=215&mode=search&query=LG생활건강&page=1
"삼성, 2조6000억원 긴급 수혈","""지금은 메르스, 사스와는 비교가 안 되는 비상 경제시국이다.""(3월13일), ""2008년 글로벌 금융위기 때보다 더 심각하다.""(3월17일) 문재인 대통령이 신종 코로나바이러스 감염증(코로나19) 사태에 따른 경제 타격을 두고 한 말이다. 보건·의료 현장 못지않게 경제 현장도 전쟁터다. 전염병이 몰고 온 사상 초유의 위기 앞에 중소기업은 물론 대기업도 휘청이고 있다. 문 대통령은 직접 나서 경제 대책을 챙기는 한편 ""정부 힘만으론 부족하다. 우리 경제의 핵심 주체들이 연대와 협력의 힘으로 위기 극복의 주역이 돼 주길 바란다""고 당부했다. 일상적인 사회·소비 활동이 마비된 소비자, 패닉 상태인 중소기업·소상공인이 당장 할 수 있는 일은 많지 않다. 결국 대기업들이 코앞의 경영위기 극복과 함께 사회적 책임을 다하는 일에도 발벗고 나서야 하는 상황이다. 기업들 입장에서도 물불 가릴 수 없게 됐다. 고객, 임직원, 협력사 등이 쓰러지면 대기업도 치명타를 입기 때문이다. 재계 1위 삼성전자는 3월18일 올해 정기 주주총회를 진행했다. 지난해 액면분할 이후 첫 주총에서 소액주주가 몰려 혼란을 빚은 것과 달리 올해는 코로나19 사태로 참석 주주가 확 줄었다. 하지만 코로나19로 인한 사업 악화를 우려하는 목소리는 여전했다. 김기남 대표는 코로나19 확산 우려에 관해 ""생산·판매 차질과 협력사 영향 등 글로벌 공급망 리스크가 최소화되도록 체계적이고 선제적으로 대응하는 동시에 임직원과 그 가족, 협력사와 지역사회의 건강과 안전을 최우선으로 생각하고 감염 예방을 위해 최선을 다하고 있다""고 밝혔다. 삼성은 국내 최대 기업답게 2조6000억원에 달하는 긴급 자금을 즉시 조달했다. 우선 협력사 운영자금 지원을 위해 1조원 규모 펀드를 조성했다. 협력사에 대한 물품 대금 1조6000억원도 조기에 지급해 숨통을 틔웠다. 자택에서 격리 중이거나 재택근무를 하는 계열사 및 협력사 임직원들에게는 격려 물품을 보냈다. 아울러 삼성전자와 삼성물산, 삼성생명 등 삼성 주요 계열사들은 지난 2월26일 임시이사회 및 경영위원회를 열어 코로나19 관련 기부금 300억원 지급을 의결했다. 삼성은 회사 바깥으로도 같은 규모의 기부금을 전달했다. 내수 경기 진작 차원에서 300억원 규모 온누리상품권을 구입해 협력사에 지급했다. 졸업식, 입학식 등 각종 행사가 취소·연기되면서 타격을 입은 화훼농가를 위해 꽃 소비 늘리기에도 참여했다. 이재용 삼성전자 부회장은 임직원들에게 ""국민 성원으로 성장한 삼성은 지금 같은 시기에 마땅히 우리 사회와 같이 나누고 함께해야 한다""면서 ""이번 일로 고통받거나 위기 극복에 헌신하는 사람들을 위해 모든 노력을 다하자""고 강조했다. LG는 3월4일 383실 규모 구미 LG디스플레이 기숙사와 167실 규모 울진 LG생활연수원을 코로나19 경증 환자 생활치료센터로 선뜻 내놔 화제를 모았다. 코로나19 사태 확산으로 대구·경북 지역 병상 부족 사태가 심각해진 상황에서 나온 단비 같은 소식이었다. SNS, 인터넷 커뮤니티 등에서는 LG를 칭찬하는 게시글들이 줄을 이었다. 구미 2공단에 위치한 LG디스플레이 기숙사는 연면적 2만5000㎡로 원룸 형태 267실, 아파트 형태 116실을 보유해 최대 499명을 수용할 수 있다. 울진의 임직원 휴양시설 LG생활연수원은 연면적 2만2000㎡에 독립 객실 167개를 갖췄다. LG 측은 ""지역사회의 어려움을 나누기 위해 현장에서 가장 절실하게 필요한 치료시설을 지원한다""며 ""대구·경북 병상 부족이 해결돼 확진자들이 신속하고 효율적인 진료를 받는 데 도움이 될 것으로 기대한다""고 밝혔다.LG는 코로나19 확산 방지 및 피해 지원을 위해 따로 50억원을 기부했다. 협력사와 소상공인 지원에도 팔을 걷어붙였다. LG전자는 협력사 대상 무이자 대출 규모를 기존 400억원에서 550억원으로 확대했다. LG유플러스도 850억원 규모 협력사 지원책을 마련했다. LG생활건강은 500여 개 가맹점의 월세 50%를 부담키로 결정했다. 포스코도 LG와 같은 50억원을 코로나19 성금으로 기탁했다. 포스코 본사(포항)와 주요 사업장들은 코로나19 직격탄을 맞은 경북 지역에 있다. 최정우 포스코 회장은 ""코로나19 피해 복구 지원에 힘쓰고 있는 의료진과 위기 극복을 위해 애쓰고 있는 지역주민들에게 보탬이 될 수 있도록 임직원들이 성금을 모았다""고 설명했다. 또 포스코는 포항과 광양 지역의 복지·상업시설 내 임대매장 총 135곳에 대한 임대료를 인하하기로 했다. CJ가 주력으로 삼는 문화·유통산업은 코로나19 국면에서 특히 피해 체감도가 높다. 지난해 말부터 비상경영을 해 왔던 CJ는 최근 코로나19까지 맞아 더욱 고삐를 죄는 모습이다. CJ는 성금 10억원을 기부하고 계열사별 사회공헌도 속속 실행에 옮기고 있다. 해외 실적 부진에 시달리던 화장품업계 1위 아모레퍼시픽에도 비상이 걸렸다. 아모레퍼시픽은 영업에 어려움을 겪는 가맹점 등 협력사에 80억원을 직접 지원하고, 2000억원 규모 결제 대금도 조기 지급하거나 선결제한다고 밝혔다. 5억원 상당의 현금과 현물도 기부했다. 서경배 아모레퍼시픽 회장은 ""코로나19는 전 세계 모두가 힘을 모아 극복해야 하는 중대 국면을 맞았다""면서 ""현 위기를 극복하기 위해 그룹 구성원을 비롯해 여러 피해자와 가족, 현장에서 고군분투하는 의료진을 돕는 데 최선을 다하겠다""고 말했다. 사업 특성을 활용해 코로나19 지원에 나선 기업도 있다. 파리바게뜨·던킨도너츠 등 브랜드를 운영하는 SPC는 빵과 생수 60만 개를 기부한다고 2월27일 밝혔다. 이에 따라 SPC그룹 계열 브랜드 빵이 3월 한 달간 매일 1만 개씩 대구·경북 지역에 전해지게 됐다. SPC의 해외 파트너사인 미국 던킨 브랜즈도 생수 30만 개를 기탁했다. 특히 SPC는 자체 물류망을 통해 청도 대남병원, 근로복지공단 대구병원, 대구 감염병관리지원단, 보건소 등 지원이 필요한 곳에 구호물품을 직접 전달하고 있다. 이 밖에 대한항공은 전 세계에서 가장 피해가 큰 중국 우한 지역에 마스크 4만 개를, 생활가전 제조업체인 아이리스코리아는 대구에 마스크 3만 개를 기부했다. 아이리스코리아 측은 ""긴급 지원이 가능한 마스크 3만 개를 우선 전달하지만, 공장의 생산 상황을 봐가며 추가 기부를 검토하고 있다""고 전했다. 코로나19의 팬데믹(세계적 대유행)은 이제 시작에 불과하다. 언제까지 지속될지 가늠조차 할 수 없는 상황이다. 대기업을 중심으로 경제계에서 힘을 보태고 있지만, 이런 움직임마저 바람 앞 촛불 신세다. 당장 기업들의 경영 상황이 급속도로 악화하고 있다. 기업들은 코로나19 사태가 본격화한 2월부터 일부 임직원의 자가격리, 공장·사업장 폐쇄 등으로 큰 타격을 입었다. 삼성의 경우 18개 계열사와 자회사 및 협력사 임직원 가운데 자가격리 중인 사람만 2500여 명에 이르는 것으로 알려졌다. 코로나19 확산 우려가 잦아들기는커녕 더 커지면서 대기업 상당수는 재택근무 기간을 계속 연장하고 있다. SK는 그룹 최고 의사결정기구인 수펙스추구협의회와 지주사 ㈜SK가 이미 재택근무 기간을 3월말까지로 늘렸다. SK이노베이션과 SK E&S 등 주요 계열사들도 각급 학교의 개학 연기에 맞춰 3월22일까지 재택근무를 연장했다. 현대·기아차는 2월말 시작한 재택근무를 3월20일까지 재연장했다. 당초 2월26일부터 3월6일까지 본사와 남양연구소 등 서울·경기 지역 일부 근무자를 대상으로 업무 수행에 차질이 없는 범위에서 자율적 재택근무를 했다. 이를 1차례 연장한 데 이어 이번에 다시 1주일 늘렸다. 두산도 코로나19 확산 방지를 위해 확대한 유연근무제를 당분간 지속하기로 했다. 코오롱은 필수 근무자를 제외한 재택근무를 1주 더 연장해 3월22일까지 실시한다. 급한 불부터 끄는 사이 대기업들의 시가총액은 순식간에 증발했다. 한국거래소에 따르면 3월18일 종가 기준으로 시가총액이 1조원 이상인 상장사는 139곳으로 지난해 말보다 50곳이 줄었다. 코로나19 충격 탓이다. 삼성전자 시총은 60조9000억원, SK하이닉스는 15조3000억원 감소했다. 현대차(10조400억원 감소), 기아차(7조7000억원 감소), 현대모비스(11조원 감소) 등의 시총도 일제히 깎였다. 삼성바이오로직스(-2조2000억원), 네이버(-6조8000억원), 셀트리온(-3조1000억원), LG화학(-2조6000억원), LG생활건강(-2조원), 삼성물산(-4조8000억원) 등 시총 상위 10위권 상장사 모두 시총 규모가 줄어들었다. 이 같은 경영위기는 '원흉'인 코로나19 사태가 끝나야만 해결될 수 있을 전망이다. 박상현 하이투자증권 연구원은 ""미국에서 (2008년) 금융위기 당시와 버금가는 각종 정책이 쏟아지는데도 현금화 수요만 강해지는 가장 큰 요인은 코로나19 팬데믹 여파로 촉발될 경기침체의 폭을 가늠하기 어렵기 때문""이라며 ""선진국의 코로나19 확산 추세가 진정되지 않으면 글로벌 금융위기보다 심각한 경기침체, 심각한 디플레이션 리스크가 현실화할 수 있다는 우려가 확산하고 있다""고 밝혔다. 그러면서 ""각국 정부와 중앙은행이 낼 수 있는 금융시장 안정책과 경기 부양책이 실시되고 있고 추가로 더욱 강력한 정책이 나올 수 있다""면서 ""이런 정책의 약효가 나타나려면 코로나19가 진정돼야 할 것""이라고 덧붙였다.오종탁 기자 amos@sisajournal.com<저작권자 ⓒ 시사저널, 무단 전재 및 재배포 금지>",/news/news_read.nhn?article_id=0000012491&office_id=586&mode=search&query=LG생활건강&page=1
