head,text,url
"전세자금대출 중단철회 불구 금융권 ""가려운 곳 긁어줬다""재난지원금 기부에 애매한 입장 보이던 금융권 잇단 동참","최근 금융권 이슈에 능동적으로 대응하는 신한금융그룹의 잇단 행보에 이목이 쏠리고 있다. 가계대출 제한 등 민감한 조치에 선제적으로 나서는 한편, 코로나19 관련 대응에서도 '리딩뱅크'로서의 존재감이 두드러지고 있다는 평가다.15일 금융권에 따르면 신한은행은 최근 아파트를 제외한 모든 주택에 대한 일반 전세자금대출을 중단하겠다고 발표했다가 여론에 밀려 하루 만에 철회했다.신한은행이 신종 코로나바이러스 감염증(코로나19) 여파로 은행권 대출이 폭증하자 선제적으로 나서서 대출조이기에 나섰지만, 여론 악화로 백지화할 수밖에 없었던 것으로 보인다. 신한은행 측은 ""최근 신규 취급액 비중이 증가하고 있는 아파트 외 주택 대상 일부 상품 제한을 통해 가계대출 속도를 조절하고자 했으나 서민 주거 안정에 대한 우려 목소리가 있어 대출 중단 계획을 잠정 보류한다""고 설명했다.하지만 금융권에선 ""신한의 조치는 옳았다""는 의견이 많다. 실제 신한은행의 경우, 전세자금대출 잔액이 지난해 말에 비해 2조6622억원이 늘어나면서 증가율이 13.7%에 달해 속도조절이 필요한 상황이었다.다른 시중은행들의 사정도 마찬가지다. 전날 금융감독원에 따르면 신한·국민·하나·우리·농협은행 등 5대 은행의 지난 4월 말 누적 기준 신규 원화대출 잔액은 1189조6815억원으로 지난해 말 보다 49조6264억원 급증했다. 국민은행은 4월 말까지 15조 6460억원 늘어 가장 큰 폭으로 늘었다.한국은행이 발표한 '2020년 4월중 금융시장 동향'에 따르면, 코로나19 사태 이후 사상 최대치를 경신했던 은행 가계대출 증가세는 4월들어 한풀 꺾였지만, 가계대출 잔액은 4조9000억원 늘어난 915조7000억원으로 '1000조 대출시대'에 한발 다가갔다. 신한은행은 이 같은 위험에 미리 경고음을 울린 셈이다.시중은행 한 관계자는 ""신한은행이 그 많은 대출 가운데 비(非)아파트 전세대출만 콕 집어서 중단하기로 한 것은 세련되지 못했다. 여론이나 당국의 반대를 예상했을 텐데 아쉽다""면서도 ""지금 상황에서 신한은행이 대출조이기는 옳은 방향""이라고 말했다.신한금융이 긴급재난지원금의 자발적 기부에 나선 이후 다른 금융사들도 잇따라 기부행렬에 동참하기 시작한 것도.눈길을 끈다.현재 신한금융에 이어 KB‧하나‧우리금융이 기부 동참을 선언했고, BNK금융그룹도 임직원 100여명이 기부 의사를 밝혔다. 이에 따라 국내 금융사 가운데 재난지원금 기부 뜻을 밝힌 곳은 9곳으로 늘었다.당초 금융권에선 농협과 메리츠금융이 임직원의 동의 절차를 밟지 않은 채 재난지원금 기부소식을 발표해 잡음이 일기도 했다. 하지만 '강제기부'논란에 머뭇거리던 금융사들도 리딩뱅크의 기부 결정에 따라갈 수 있는 분위기가 형성된 것이다.이에 주요 금융그룹에서 재난지원금 기부 발표를 이어갈 것으로 보인다. 금융권 한 관계자는 ""업계에선 '정무적 판단'이 필요할 때에는 신한이나 KB금융 등 대형 금융그룹의 움직임을 먼저 보고 따라가는 경우가 많다""고 말했다.또 다른 시중은행 관계자는 지난 2015년 정부 주도로 진행된 '청년희망펀드'를 비슷한 사례로 꼽았다.금융권 관계자는 ""당시 청년희망펀드 가입 열풍이 불었을 때 재계에선 삼성그룹이 가장 먼저 지원을 시작해 다른 기업들의 기부로 이어졌고, 금융권에선 KB‧신한‧하나금융부터 시작했다""며 ""사회적 이슈에 선제적으로 대응한다는 것은 업계 바로미터로 받아들여질 수 있는 부분""이라고 말했다.데일리안 이충재 기자 (cj5128@empal.com)ⓒ (주)데일리안 - 무단전재, 변형, 무단배포 금지",/news/news_read.nhn?article_id=0002401702&office_id=119&mode=search&query=KB금융&page=1
,"신종 코로나바이러스 감염증(코로나19) 여파로 부실채권과 연체율이 급증하면서 국내 금융지주와 은행이 비상대응 체제에 돌입했다. 수익성 하락을 대비하기 위한 사업전략 수정이 불가피해졌기 때문이다. 국내 금융시장은 코로나19 팬데믹(세계적 대유행)현상으로 기업과 개인의 신용 하락이 예상된다. 시중은행은 금융시장의 모니터링을 지속하면서 건전성 관리에 집중할 계획이다. KB금융그룹은 매주 비상대책위원회를 개최한다. KB국민은행은 코로나19 사태로 금융시장을 위기 수준으로 보고 비상대응 체제를 가동했다. 은행 전략기획부가 비상대책의 전반적인 대응을 총괄하며 건전성 관리 방안을 마련한다.여신은 코로나19로 운영 자금을 위한 수요가 증가해 올해 여신성장 목표치를 당초 계획보다 상향 조정한 5~6% 수준으로 변경했다. 늘어난 여신을 관리하기 위해 여신심사 조직은 세분화해 운영한다. 코로나19 피해기업의 신속한 금융지원을 위해 심사 신속지원반과 현장지원반을 신설하고 연체율 관리에 나선다. 신한금융그룹도 코로나19 사태가 종식될 때까지 종합상황브리핑 회의를 운영한다. 계열사 최고경영자(CEO), 최고재무책임자(CFO), 최고전략책임자(CSO), 최고리스크관리책임자(CRO) 등이 금융시장과 여신 상황을 점검한다.신한은행은 코로나19 사태로 가계대출과 개인대출과 중소기업 대출의 부실이 심화될 수 있는 만큼 리스크 관리에 나선다. 그룹사 차원의 ‘위기관리 시스템’을 통해 일선 영업점을 비롯해 대출심사부의 업무를 까다롭게 관리한다. 신한은행 관계자는 “실물경기 위축 우려가 커져 하반기에는 여신 성장 동력이 가라앉고 건전성도 나빠질 우려가 있다”며 “당분간 리스크 관리를 통한 내실다지기가 필수적”이라고 말했다. 하나금융그룹도 코로나19 사태의 추이를 예의주시하며 리스크 관리에 나선다. 올해 하나은행은 순이익 목표를 지난해 대비 5%가량 낮췄다. 우리금융그룹도 비상경영대책 위원회를 신설하고 금융시장의 주요 지표들을 실시간 모니터링해 위기 상황을 정확히 진단한다. 우리은행 관계자는 “포스트 코로나의 시나리오 점검, 경영목표 조정·관리, 금융당국과의 적극적 협조와 정책 제안과 함께 다양한 고객지원 방안도 모색할 예정이다”고 말했다.
시중은행의 비상경영 다음 단계는 포스트 코로나 시대를 기회로 삼을 수 있는 대안 마련이다. 코로나19로 ‘언택트 경제’가 급부상하면서 시중은행이 디지털금융 구축에 속도를 낸다. 차별화된 비대면 플랫폼을 활용해 코로나19에 필요한 대출 지원에 나선다.신한은행은 올해 8월 출시를 목표로 소상공인 지원을 위한 블록체인 기반 소상공인 정책자금 관리 플랫폼을 준비하고 있다. 은행과 소상공인시장진흥공단이 블록체인으로 고객 정보를 공유하고 실시간 대출 한도를 확인하면 고객은 은행을 방문해 열흘 안에 정책자금 대출을 받을 수 있다. 기존 정책자금 신청자가 기관에 방문하는 횟수는 평균 5회에 달한다. 블록체인 플랫폼이 생기면 고객의 방문 횟수는 평균 2.5회, 대출승인은 10일 내외로 줄어들 것으로 보인다.
IBK기업은행도 상반기에 비대면 기업대출 실행 프로세스를 도입한다. 기업은행 관계자는 “비대면으로 대출을 신청하고 스크래핑 등의 기술을 통해 대출심사 서류 제출을 간소화할 것”이라며 “영업점 방문이 어려운 고객들이 보다 편리하게 대출을 신청할 수 있다”고 말했다.우리은행은 코로나19 사태 위기를 기회로 전환하자는 취지로 그룹의 젊은 인재들로 구성된 블루팀(가칭)을 만들었다. 블루팀은 코로나19 이후 변화될 경영환경 속에서 고객, 채널, 기업문화, 사회적 역할 등 경영전반에 혁신적인 아이디어를 제안한다.
NH농협은행은 차세대 유니콘 스타트업 선정에 언택트 심사를 도입했다. 언택트 심사를 받은 기업은 원격 영상을 통해 자사 소개와 사업 전략 등을 발표한다. 농협은행은 공정한 평가를 위해 벤처캐피털리스트, 액셀러레이터, 연세대 기술지주 등 정보통신기술(ICT) 전문성을 보유한 전문가들이 심사위원으로 위촉해 까다로운 평가를 진행한다.농협은행 관계자는 “선정된 기업은 은행, 생명, 증권, 손해보험 등 5000여개 전국 네트워크를 통한 공동 사업을 진행할 수 있다”며 “코로나19로 투자가 위축된 스타트업계에 숨통을 불어넣을 것으로 기대한다”고 말했다.
국민은행은 허인 행장이 금융지주 디지털혁신총괄(CDIO)이자 은행의 디지털금융그룹장인 한동환 부행장과 올해 하반기 중 구축을 목표로 차세대 전산시스템인 The K 프로젝트를 준비한다. 이 프로젝트에는 마케팅 프로세스와 시스템을 고도화한다는 계획도 포함됐다. 지난달에는 디지털 심사 플랫폼인 기업여신 자동심사 지원시스템을 도입했다. 코로나19 확산으로 사실상 개점휴업 상태인 자산관리(WM)사업도 언택트를 기반으로 한 프로그램을 도입한다. SC제일은행은 고액자산가 고객들을 대상으로 진행한 웰스케어(Wealth Care) 세미나를 온라인 서비스로 확장한 웰스케어 웹 세미나를 선뵀다. 온라인 서비스의 특성을 감안해 SC제일은행 거래 여부 등의 참석 기준에도 제한을 두지 않았다.지난 4월 초 첫선을 보인 웹 세미나는 코로나가 바꿀 미래, 투자의 방향은(부제: 달러로 미래를 바꾸다)라는 주제로 진행됐으며 오프라인 세미나의 최대 5배 규모인 1000여명이 참여해 성황리에 마쳤다. 씨티은행은 14년간 이어온 씽크머니 프로그램을 비대면으로 제공한다. 씽크머니는 청소년들이 올바른 금융 가치관을 정립하고 주체적인 경제활동을 할 수 있도록 돕는 금융교육 프로그램이다. 올해는 금융 체험교육장인 펍핀 3호를 세종YWCA에 개소하고 지역사회 청소년을 위해 지방자치단체와 지역 교육기관 등 네트워크를 확장할 계획이다. 박진회 한국씨티은행장은 “학생들이 온라인에서 친숙하게 금융활동을 체험하고 많은 청소년들이 금융교육이 받을 수 있도록 디지털 금융 서비스 지원을 지속하겠다”고 전했다. 이남의 기자 namy85@mt.co.kr
<저작권자 ⓒ '성공을 꿈꾸는 사람들의 경제 뉴스' 머니S, 무단전재 및 재배포 금지>",/news/news_read.nhn?article_id=0000542599&office_id=417&mode=search&query=KB금융&page=1
,"국내 주식시장에 외국인 투자자가 돌아오지 않고 있다. 코스피 지수가 1900대에 안착하는 등 증시는 완만한 회복세를 나타내고 있지만 외국인의 ‘셀 코리아’는 지속되고 있다. 신종 코로나바이러스 감염증(코로나19) 사태 지속으로 인한 경기 불확실성, 원화 약세 등이 영향을 미치고 있다는 분석이 나온다.15일 한국거래소에 따르면 이날 오전 10시 현재 외국인은 코스피 시장에서 1605억 원을 팔아치우며 5거래일 연속 순매도를 나타내고 있다. 이달 들어 14일까지 외국인은 코스피 시장에서 2조9962억 원을 팔아치웠다. 지난 3∼4월 역사적인 순매도를 기록하며 5월에는 ‘외국인이 돌아올 것’이라는 기대감이 팽배했지만 ‘팔자’ 행진은 멈추지 않고 있다. 지난 3월과 4월 외국인은 코스피 시장에서 각각 12조5550억 원, 4조1001억 원을 팔았다.전문가들은 코로나19로 인한 경제 불확실성이 큰 상태가 지속되면서 외국인들이 위험자산인 신흥시장 주식을 계속 팔고 있다고 보고 있다. 특히 코로나19로 피해를 본 업종에서 매도세가 두드러지고 있다. 이달 들어 14일까지 외국인은 삼성전자(-7871억 원), LG화학(-3623억 원), SK하이닉스(-3221억 원), KB금융(-1843억 원), 삼성전자우선주(-1164억 원), 신한지주(-955억 원) 순으로 많이 팔았다. 김지산 키움증권 리서치센터장은 “코로나19가 전개되는 국면 속에서 미·중 무역분쟁에 대한 우려까지 불거지면서 외국인이 안전자산을 선호하고 주식을 파는 현상이 지속되고 있다”고 말했다.‘달러 확보 전쟁’에 따라 계속 높은 수준을 유지하고 있는 원·달러 환율도 걸림돌이 되고 있다. 윤지호 이베스트투자증권 리서치센터장은 “통화라는 것은 해당 국가의 펀더멘털(기초체력)을 반영하는데 현재 원·달러 환율이 1220원대일 정도로 원화 가치가 낮은 상태”라며 “현재 지속되는 위안화 약세가 이달 열리는 중국 양회(兩會)를 기점으로 달라진다면 원화 가치도 오를 수 있어 6월쯤 외국인이 국내 주식시장에 돌아올 것으로 보인다”고 말했다. 이날 오전 10시 현재 서울 외환시장에서 원·달러 환율은 전일 대비 1.0원 오른 1229.0원에 거래됐다.송정은 기자 euni@munhwa.com[Copyrightⓒmunhwa.com '대한민국 오후를 여는 유일석간 문화일보' 무단 전재 및 재배포 금지()]",/news/news_read.nhn?article_id=0002427996&office_id=021&mode=search&query=KB금융&page=1
보험순익 감소 영향,"[헤럴드경제=이승환 기자] KB금융그룹의 순이익이 1년 만에 1000억원 가량 줄었다. KB금융은 15일 공시한 1분기 분기보고서를 통해 당기순이익 7389억3700만원을 기록했다고 밝혔다. 전년동기(8459억3000만원) 대비 1069억9300만원 감소한 규모다. 보험부문 순익 감소가 결정적인 영향을 미쳤다. 1분기 순보험손익은 780억9400만원으로 전년동기(1087억원8300만원)보다 306억원8900만원 줄었다. 저금리 기조 속에 순이자마진(NIM)이 줄어드는 상황에서도 이자이익은 늘었다. 1분기 순이자이익은 2조3492억원으로 전년동기(2조2520억원)보다 972억원 늘었다. 비이자수익인 수수료이익은 크게 증가했다. 1분기 순수수료이익은 6701억원으로 전년동기(5506) 대비 21.7% 증가했다. nice@heraldcorp.com
- Copyrights ⓒ 헤럴드경제 & heraldbiz.com, 무단 전재 및 재배포 금지 -",/news/news_read.nhn?article_id=0001674163&office_id=016&mode=search&query=KB금융&page=1
"10위권 중 삼성전자만 유일 증가우량주 장기투자 고수익 보장 못해50위권에선 시총 증가 10곳 그쳐""코로나 이후 성장가능 산업 선별비대면·4차혁명 관련주 주목해야""","[서울경제] 10년 전 유가증권시장 시가총액 상위 10개 종목 가운데 최근 시총이 당시보다 증가한 종목은
단 한 종목에 불과한 것으로 나타났다. 우량주에 대한 장기 투자가 항상 고수익으로만 이어지지는 않는다는 것을 보여주는 결과다. 증시 전문가들은 우량주에 대한 장기투자가 수익 실현을 위한 대표적인 투자 방법이지만 업종 및 사업의 성장성을 잘 따져봐야 한다고 조언한다. 15일 한국거래소에 따르면 지난 2010년 11월30일 유가증권시장 시총 10위권 종목 중 최근 시총 10위권에 속해 있는 종목은 삼성전자··LG화학 3개에 불과하다. 2010년 11월30일 코스피 종가는 1,904.63포인트로 이달 14일의 1,924.96포인트와 비슷한 수준이다. 당시 시총 4위였다가 물적 분할이 이뤄진 현대중공업(현 )을 제외하고 ······이 10위권에 있었으나 14일 기준으로는 시총 순위 10위권 밖으로 밀려나 있다. 그 자리는 ····LG생활건강··로 채워졌다. 과거 철강·운수장비·금융 중심이었던 시총 상위 업종이 제약바이오·커뮤니케이션서비스·생활용품 등으로 변화한 것이다. 10년 전 시총이 121조6,692억원으로 1위였던 삼성전자는 14일 종가 기준으로 286조5,496억원에 달해 10년 새 135.5% 증가하면서 1위 자리를 지키고 있다. 유가증권시장 전체 시총은 현재 1,292조8,841억원으로 10년 전의 1,058조6,436억원보다 22.1% 늘어난 가운데 당시 50위권에 속해 있다가 최근 기준 시총이 증가한 종목은 삼성전자를 포함해 SK하이닉스(323%), NAVER(281.4%), LG생활건강(280.4%), (205.7%), 삼성SDI(180.9%), (62.1%),
(23.0%), (21.1%), (3.1%) 등 단 10개뿐이다. 한국거래소의 업종 분류 기준으로 보면 유가증권시장 전체에서 차지하는 비중이 10년 전보다 높아진 업종은 전체 18개 중 삼성전자·SK하이닉스가 속한 전기전자를 비롯해 서비스업·의약품 3개에 그친다. 전기전자 업종 시총은 전체의 34.1%에 해당하는 440조9,744억원으로 10년 전 20.3%에서 가장 큰 증가율을 기록했다. 자동차·중공업 등이 속한 운수장비 업종 시총 비중은 같은 기간 13.7%에서 5.7%로 줄어 감소율이 가장 컸다.
이러한 시총 변화는 성장 가능한 업종·종목에 대한 선별 투자의 중요성을 보여주는 결과로 평가된다. 조용준 하나금융투자 리서치센터장은 “성장성이 풍부한 사업 모델을 보유한 우량 종목에 대한 투자는 저금리 시대에 좋은 재테크 수단이 될 수 있다”며 “신종 코로나바이러스 감염증(코로나19) 사태를 계기로 ‘디지털 콘택트’가 확산되면서 더욱 가속화될 4차 산업혁명 관련 우량주에 주목할 필요가 있다”고 조언했다. 진입 시점이 중요하다는 의견도 있다. 업종·산업에 대한 고민 없이 그동안 상승한 종목에 투자를 하는 경우가 많지만 그렇게 하면 산업 변화에 따라 투자 종목의 실적이 둔화되면서 수익을 실현하지 못하게 될 수도 있다는 것이다. POSCO 같은 일부 종목의 경우 10년 전 주가를 아직 회복하지 못하고 있으며 당분간 전망도 밝지 않다는 평가가 나온다. 윤지호 이베스트투자증권 리서치센터장은 “성장이 가능한 우량종목의 주가가 기업가치보다 낮은 시점에서 투자하는 것이 바람직하다”면서 “올해 이익이 개선될 대표적인 분야는 헬스케어·커뮤니케이션서비스·IT하드웨어인데 그동안 주가가 많이 상승한 헬스케어·커뮤니케이션서비스 외에 IT하드웨어 업종의 대표주 삼성전자를 주목할 필요가 있다”고 설명했다. /박경훈기자 socool@sedaily.com저작권자 ⓒ 서울경제, 무단 전재 및 재배포 금지",/news/news_read.nhn?article_id=0003738214&office_id=011&mode=search&query=KB금융&page=1
코로나19에 3곳 모두 1분기 적자호텔롯데 호텔부문 -638억이마트 신세계조선호텔 -148억호텔신라 호텔·레저부문 -178억,"[아시아경제 차민영 기자] 신종 코로나바이러스감염증(코로나19) 사태에 국내 대형 호텔기업 3곳 실적이 모두 맥없이 주저앉았다. 과당 경쟁으로 수년간 적자 행보를 지속해오던 와중에 돌발 악재가 겹치면서 1분기 기준 최소 100억원이 넘는 영업적자를 봤다.15일 관련 업계에 따르면 호텔롯데 호텔사업부는 올해 1분기 전년 동기의 1769억원 대비 12.7% 줄어든 1544억원의 매출을 올렸다. 이 기간 영업손실 규모는 638억원에 달했다. 2018년 1분기(-349억원) 이후 작년 1분기(-275억원)까지 손실 폭을 줄였지만, 올해 적자 폭이 도로 확대됐다. 국내 최대 호텔 체인인 만큼 코로나 후폭풍이 컸다.가장 먼저 실적을 발표한 호텔신라도 면세(TR)와 호텔&레저부문 모두 실적이 고꾸라졌다. 호텔신라의 1분기 호텔&레저부문 영업이익은 고고도미사일방어체계(THAAD·사드) 사태가 심화됐던 2018년 1분기 34억원 적자를 기록했지만 2019년 1분기에는 -5억원으로 빠르게 회복되고 있었다. 하지만 코로나19 사태로 1분기 다시 적자가 늘어 178억원 규모의 영업손실을 냈다. 이마트 계열 신세계조선호텔은 올해 1분기 전년 동기(-56억원)에 이어 적자 폭을 확대하며 총 148억원의 영업손실을 기록했다. 같은 기간 매출은 전년 대비 115억원(25.4%) 줄어든 338억원에 그쳤다. 코로나 영향이 주효했다는 게 호텔 측 설명이다. 글로벌 이동 자제령으로 주요 고객인 비즈니스 고객 등 마이스(MICE) 수요가 줄은 것으로 관측된다.호텔업계의 부진은 올해 1월 코로나19가 발병, 확산한 이후부터 예견됐다. 한국호텔업협회는 3월 전국 호텔 평균 호텔 객실 가동률(OCC)이 21.3%로 곤두박질쳐 피해액 규모가 5800억원에 육박한 것으로 추산된다. 코로나19 발생 전인 1월 61.7%였던 OCC는 2월 44.4%, 3월 21.3%, 4월 25.3% 수준으로 정상 가동률 범위(60~70%)를 밑돌았다. 재산세와 인력비용 등 고정비 부담이 큰 특급호텔들의 피해가 더 컸다. 3월 한달 기준 OCC는 5성급 18.5%, 4성급 19.2%, 3성급 19.7%, 2성급 25.3%, 1성급 35.6%으로 나타났다. 3성급 이상 관광호텔들이 10%대 가동률을 기록한 셈이다.특히 코로나19 사태가 호텔업계에 미치는 영향이 과거 중동호흡기증후군(MERS·메르스)이나 중증급성호흡기증후군(SARS·사스) 때보다 클 것으로 관측됐다. 글로벌 인구 이동이 크게 제약됐기 때문이다. 가령 국내 여행객의 34%를 차지하는 중국인은 1월 31일 기준 입국자 수가 9506명으로 1만명 이하로 떨어졌다. 최근에는 중국인 입국자수가 하루 평균 1000명대로 10분의 1로 줄었다.류석재 KB금융지주 경영연구소 연구위원은 보고서에서 ""코로나19의 긴 잠복기간과 강한 전염력, 지역 감염사례 등을 고려했을 때 상당 기간 코로나19 확산 공포가 지속될 것""이라고 짚은 후 ""과거 사스나 메르스의 경우 확산세가 발병국 및 인접 지역을 중심으로 한정돼 영향력이 제한적이었으나 코로나19는 세계적 확산세가 지속되고 있어 더 큰 충격이 불가피하다""고 말했다.차민영 기자 blooming@asiae.co.kr <ⓒ경제를 보는 눈, 세계를 보는 창 아시아경제 무단전재 배포금지>",/news/news_read.nhn?article_id=0004679321&office_id=277&mode=search&query=KB금융&page=1
,"외국인 투자자는 15일 거래소에서 삼성전자, NAVER, SK텔레콤 등을 중점적으로 매도한 것으로 나타났다.외국인 투자자의 순매도 상위 20개 종목은 삼성전자, NAVER, SK텔레콤, 카카오, SK하이닉스, 한국전력, 셀트리온, 삼성SDI, KB금융, 아모레퍼시픽등이다.이중에 전기,전자 업종에 속한 종목이 4개 포함되어 있다.SK하이닉스, 셀트리온, KB금융 등은 전일 대비 주가가 상승했고, 삼성전자, NAVER, SK텔레콤 등은 주가가 하락했다.한경로보뉴스이 기사는 한국경제신문과 금융 AI 전문기업 씽크풀이 공동 개발한 기사 자동생성 알고리즘에 의해 실시간으로 작성된 것입니다.▶ ▶
 ▶
ⓒ 한국경제 & , 무단전재 및 재배포 금지",/news/news_read.nhn?article_id=0004341604&office_id=015&mode=search&query=KB금융&page=1
