head,text,url
"롯데마트, 전국 64개 문화센터 수강신청5월16일까지 접수하면 1만원 할인 등홈플러스도 전국 123개 매장서 접수","[서울경제] 대형마트 문화센터 여름학기 모집이 시작됐다.
지난 봄에는 신종 코로나바이러스 감염증(코로나19)으로 인해 취소된 강의가 많았지만 이번 여름학기는 철저한 방역으로 안전하게 즐길 수 있도록 마련했다.롯데마트는 송파점을 포함한 전국 64개 문화센터에서 2020년 여름학기 회원모집을 진행한다고 8일 밝혔다.롯데마트는 이번 여름학기 문화센터 테마를 ‘면역력 레벨업 클래스’, ‘슬기로운 취미생활’, ‘엔제리너스와 함께하는 커피랩(Coffe Lab)’, ‘파트너사 제품 콜라보레이션’ 등으로 정했다.
대표 강좌로는 ‘면역력 키우는 집안 정리 노하우’, ‘엄마표 간식이 최고’ 등 건강을 위한 강좌부터, ‘꼭 한번 배워보고 싶은 가야금’, ‘중국어’ 등의 취미생활 강좌, ‘정식품과 함께하는 쿠킹클래스’ 등 롯데마트 파트너사 제품과 콜라보레이션 한 강좌들이 있다.롯데마트는 평범한 일상으로의 회기와 함께 생활방역수칙을 준수 할 수 있도록 문화센터 회원에게 안전한 수업 환경 조성에 대한 안내문 게시, 방역 및 발열 체크를 진행한다. 더불어 문화센터 안심 수업 관리기준을 수립해 위생에 대해 중점적으로 관리할 방침이다.문화센터 수강을 원하는 고객은 롯데마트 문화센터 홈페이지 및 모바일 홈페이지를 통해 접수가 가능하며, 전국 64개점 문화센터 오프라인 매장에서도 수강신청 할 수 있다.한편 오는 16일까지 여름학기 수강 접수 시 강좌당 1만원 할인을, 6월 5일까지는 M쿠폰 신규 가입시 현장 방문 접수자에 한해 2만원 할인 혜택을 제공한다.홈플러스도 6월1일부터 8월29일까지 전국 123개 점포에서 진행되는 여름학기 회원 모집을 시작했다. 이번 학기는 코로나19 추가 확산을 방지하기 위해 방역 관리 체계를 강화한 것은 물론, 강좌 인원을 조정해 일대일 개인 맞춤 강좌를 새롭게 마련한 것이 특징이다.먼저 홈플러스는 그동안 사회적 거리두기로 인해 집에만 머물렀던 회원들이 미리 여름학기를 체험할 수 있는 ‘Preview Class’를 마련했다. 즉시 접수해 5월 11일부터 31일까지 3~4주간 진행되는 단기 강좌를 통해 다양한 체험과 가족 이벤트를 즐길 수 있다.3040세대 직장인을 위한 저녁 시간대 강좌도 1,300여개 마련했다. 여름 시즌 야간 활동이 많아지는 직장인을 위해 ▲건강한 다이어트 필라테스 및 자세교정 클래스 ▲세대별 맞춤 재테크 솔루션 등 알찬 여가 시간을 만들 수 있도록 다채롭게 구성했다.다양한 업체와 컬래버레이션을 통해 더욱 알찬 강좌도 준비됐다. 주요 강좌로는 ▲미미월드·영실업과 협업한 ‘키즈 장난감 빌리지’ ▲올품과 함께 하는 ‘올품 닭고기 활용 쿠킹 클래스’ ▲불스원과 함께 하는 여름철 차량 관리법 등이 있다. 또 KB금융공익재단과 손을 잡고 올바른 경제 생활에 도움이 되는 ‘경제 콘서트 전국 투어’를 진행한다. ▲어린이 체험형 경제교육 ‘용돈 관리왕’ ▲어린이 경제 인형극 ‘도토리가 다 어디갔지?’ ▲푼돈을 목돈으로 키우는 금융 노하우 등 유아부터 성인까지 참여할 수 있도록 다양한 형태로 마련했다.홈플러스는 보다 합리적인 가격으로 이번 강좌를 즐길 수 있도록 다양한 혜택도 마련했다. 먼저 마이홈플러스 멤버십 회원이 이번 여름학기를 수강할 경우에는 1만원 할인 혜택을 제공하고 70세 이상의 ‘액티브 시니어’ 회원에게는 강좌 당 2만원 할인해준다. 또한 문화센터 여름학기 수강회원이 홈플러스에서 쇼핑을 할 때 활용할 수 있도록 홈플러스 온라인몰·더클럽 앱에서 7만원 이상 구매 시 활용 가능한 5,000원 할인 쿠폰을 증정한다.현미옥 홈플러스 문화센터 담당자는 “코로나19로 인해 문화생활을 원활하게 즐길 수 없었던 수강회원을 위해 이번 여름학기는 더욱 알차게 마련했다”며 “1:1이나 소수 인원 위주의 강좌를 늘리고 방역체계를 강화했기 때문에 보다 안심하고 즐길 수 있을 것”이라고 말했다. /박민주기자 parkmj@sedaily.com 저작권자 ⓒ 서울경제, 무단 전재 및 재배포 금지",/news/news_read.nhn?article_id=0003734298&office_id=011&mode=search&query=KB금융&page=1
수요예측 결과 1000억 증액자본비율 개선,"[헤럴드경제=이승환 기자] KB금융지주가 4000억원 규모의 상각형 조건부자본증권(신종자본증권)을 8일 발행했다. 최근 수요예측 결과 기관투자자가 몰리면서 발행액을 1000억원 증액했다.KB금융은 이번 신종자본증권을 5년 만기(3250억원)과 10년 만기(750억원)으로 분산 발행했다. 발행 금리는 각각 3.3%와 3.43%다.올해 들어 KB금융은 자본조달 포트폴리오를 다양하게 구성하고 있다. 지난 2월 KB금융은 후순위채 4000억원을 발행했다.이번 신종자본증권 발행으로 자본의 질을 더욱 높일 전망이다. 후순위채(보완자본)는 잔존만기 5년 이내로 진입한 시점부터 자본인정비율이 매년 20%씩 차감되지만 신종자본증권은 보유중일 때 전액 자본으로 인정된다.이에 KB금융지주의 BIS비율이 높아질 전망이다. 2019년 말 BIS비율은 보통주자본비율 13.58%, 기본자본비율 13.86%, 총자본비율 14.48%이다.신종자본증권 발행을 감안한 2019년말 기준 예상 보통주자본비율은 13.58%, 기본자본비율은 14.02%(약 0.16%p 상승), 총자본비율은 14.63%(약 0.16%p 상승)가 될 것으로 추정된다.KB금융 관계자는 ""6000억원대 수요가 파악돼 증액을 결정하게 됐다""며 ""자기자본비율을 더욱 높이고, 푸르덴셜 생명 인수에 따른 자본확충 등에 필요한 자금""이라고 말했다.nice@heraldcorp.com
- Copyrights ⓒ 헤럴드경제 & heraldbiz.com, 무단 전재 및 재배포 금지 -",/news/news_read.nhn?article_id=0001671134&office_id=016&mode=search&query=KB금융&page=1
,"은행주가 개인과 외국인 투자자의 매수세에 V자 반등하고 있다. 올 1분기 깜짝 실적을 발표하면서 투자 매력이 높다는 판단에 매수세가 유입된 것으로 풀이된다.8일 한국거래소에 따르면 4대 금융지주는 KB금융을 제외하고 이달들어 두자릿수 상승했다. 하나금융지주가 약 22% 올랐고, 신한지주와 우리금융지주도 각각 12%, 10% 올랐다.당초 금융지주사들은 상품 판매 이익 감소, 순이자마진(NIM) 하락 등에 실적 저하가 예상됐지만 1분기 실적이 나름 선방했다는 평가를 받고 있다.반면 KB금융은 1분기 시장 기대치를 밑도는 부진한 실적을 발표하면서 2% 상승하는 것에 그쳤다.최근 개인과 외국인이 은행주를 집중 매수하면서 은행주들의 주가가 큰 폭으로 상승했다. 하지만 5월 들어 소폭 하락해 상승폭이 줄어든 상황이다.BNK투자증권은 은행주에 대해 금융위기 당시인 지난 2008년과 비교해서도 저평가가 심각하다며 '비중확대' 의견을 제시했다.김인 BNK투자증권 연구원은 ""신종 코로나바이러스 감염증(코로나19) 발생에 따른 경기둔화 우려가 확산되면서 은행주의 주가급락에 따라 PBR 및 PER은 각각 0.26배, 3.7배까지 하락한 상황""이라며 ""PBR과 ROE의 관계를 감안한 할인률도 25.9%에 이른다""고 평가했다.하나금융투자도 은행주의 추가 반등 가능성을 더 열어둬야 한다고 분석했다.최정욱 하나금융투자 연구원은 ""연초 이후 코스피는 11.4% 하락한 반면 은행주 하락 폭은 28.1%로 상승 여력이 여전하다""며 ""1분기 실적에서 보였듯이 대손비용 영향이 나타나지 않고 있어 호실적이 2~3분기까지는 지속될 가능성이 높다""고 밝혔다.최 연구원은 ""외국인들의 매도 공세가 일단 멈췄다는 점은 굉장히 의미가 크다""며 ""국내 기관들은 은행주 비중이 여전히 '비중축소(Underweight)' 상태로 추가 반등시 계속 추격 매수에 나설 수밖에 없어 매도 공백이 예상되고, 전반적인 수급 상황은 우호적일 수밖에 없다""고 말했다.다만 은행주들의 향후 위기 대응 능력이 주가의 변수가 될 것이라는 분석도 나온다. 정부의 국책은행과 시중 은행을 활용한 위기 극복 대책은 단기적으로 효과적이었으나 코로나 사태가 장기화될 경우 정책의 부작용이 나타날 것이라는 지적이다.서영수 키움증권 연구원은 ""4대 금융지주의 1분기 순이익은 전년 동기 대비 1.4% 감소해 시장 추정치 대비 양호한 실적을 기록했다""면서도 ""실적이 주가에 미치는 영향은 제한적일 것""이라고 설명했다.서 연구원은 ""미국과 달리 코로나 쇼크에 따라 예상되는 차주의 상환 능력 악화를 비용에 반영하지 않았고, 3조원대의 사모펀드 환매 중단으로 인해 입을 수 있는 1조원 수준의 손실을 반영하지 않았다""며 ""여기에 기준금리 인하, 저원가성 예금 순증 둔화로 순이자마진 하락이 2분기 이후 가속화될 것으로 예상된다""고 밝혔다.[디지털뉴스국 김현정 기자] [ⓒ 매일경제 & mk.co.kr, 무단전재 및 재배포 금지]",/news/news_read.nhn?article_id=0004571201&office_id=009&mode=search&query=KB금융&page=1
"개인, 차익실현 나서..나홀로 순매도의료정밀 3% 올라..운수장비·섬유의복·보험업종↑","[이데일리 오희나 기자] 코스피 지수가 상승 마감했다. 코로나19 둔화로 인한 경제 재개 기대감이 작용하면서 오랜만에 외국인과 기관의 쌍끌이 매수세가 유입됐다.
 8일 마켓포인트에 따르면 코스피 지수는 전 거래일 대비 17.21포인트(0.89%) 오른 1945.82로 마감했다. 이날 코스피는 1944.94로 상승 출발했다. 외국인과 기관의 매수세가 유입되면서 장중 1950선까지 올랐으나 오후 들어 상승폭이 다소 축소되면서 1945선으로 거래를 마쳤다.

뉴욕증시에서 주요 지수는 중국 수출 호조와 미국 실업자 증가 속도 둔화에 힘입어 상승했다.7일(현지시간) 뉴욕증권거래소(NYSE)에서 다우존스 30 산업평균지수는 전장보다 211.25포인트(0.89%) 상승한 2만3875.89에 거래를 마쳤다.스탠더드앤드푸어스(S&P) 500 지수는 전장보다 32.77포인트(1.15%) 오른 2881.19에, 기술주 중심의 나스닥은 125.27포인트(1.41%) 상승한 8979.66에 장을 마감했다.수급별로는 외국인과 기관이 각각 437억원, 1739억원 순매수를 기록했다. 개인은 2444억원 순매도를 보였다. 프로그램은 차익이 286억원 순매도, 비차익이 257억원 순매도를 보이면서 543억원 매도우위를 보이고 있다. 대부분의 업종이 오른 가운데 의료정밀이 3% 이상 올랐고 운수장비, 섬유의복, 보험, 제조업, 의료정밀, 전기전자, 찰강및금속, 기계, 화학, 비금속광물, 서비스업, 금융업, 운수창고 업종 등의 상승세가 컸다. 반면 음식료품, 전기가스 업종은 유일하게 내렸다. 시가총액 상위 종목 가운데 삼성전자(005930)는 보합세로 마감했고 SK하이닉스(000660) 삼성바이오로직스(207940) 셀트리온(068270) LG생활건강(051900) 현대차(005380) 삼성물산(028260) 삼성SDI(006400) 현대모비스(012330) 엔씨소프트(036570) KB금융(105560) 등은 올랐다. 반면 NAVER(035420) LG화학(051910) 한국전력(015760) 삼성에스디에스(018260) 등은 하락했다. 이날 거래량은 7억7519만주, 거래대금은 7조8258억원으로 집계됐다. 상한가 종목은 없고 588개 종목이 상승했다. 하한가 종목 없이 227개 종목이 하락했다. 82개 종목은 보합권에서 거래를 마쳤다.오희나 (hnoh@edaily.co.kr)＜ⓒ종합 경제정보 미디어 이데일리 - 무단전재 & 재배포 금지＞",/news/news_read.nhn?article_id=0004635924&office_id=018&mode=search&query=KB금융&page=1
,"은행주가 V자 반등하고 있다. 올 1분기 깜짝 실적을 발표하면서 투자 매력이 높다는 판단에 개인과 외국인 투자자의 매수세가 유입된 것으로 풀이됩니다. 오늘(8일) 한국거래소에 따르면 KB 금융을 제외하고 4대 금융지주가 이달들어 두자릿수 상승했습니다. 하나금융지주가 약 22% 올랐고, 신한지주와 우리금융지주도 각각 12%, 10% 올랐습니다.당초 금융지주사들은 상품 판매 이익 감소, 순이자마진(NIM) 하락 등에 실적 저하가 예상됐지만 1분기 실적이 나름 선방했다는 평가를 받고 있습니다.반면 KB금융은 1분기 시장 기대치를 밑도는 부진한 실적을 발표하면서 2% 상승에 그쳤습니다.최근 개인과 외국인이 은행주를 집중 매수하면서 은행주들의 주가가 큰 폭으로 상승했습니다. 하지만 5월 들어 소폭 하락해 상승폭이 줄어든 상황입니다.BNK투자증권은 은행주에 대해 금융위기 당시인 지난 2008년과 비교해서도 저평가가 심각하다며 '비중확대' 의견을 제시했습니다.김인 BNK투자증권 연구원은 ""신종 코로나바이러스 감염증(코로나19) 발생에 따른 경기둔화 우려가 확산되면서 은행주의 주가급락에 따라 PBR 및 PER은 각각 0.26배, 3.7배까지 하락한 상황""이라며 ""PBR과 ROE의 관계를 감안한 할인률도 25.9%에 이른다""고 평가했습니다.하나금융투자도 은행주의 추가 반등 가능성을 더 열어둬야 한다고 분석했습니다.최정욱 하나금융투자 연구원은 ""연초 이후 코스피는 11.4% 하락한 반면 은행주 하락 폭은 28.1%로 상승 여력이 여전하다""며 ""1분기 실적에서 보였듯이 대손비용 영향이 나타나지 않고 있어 호실적이 2~3분기까지는 지속될 가능성이 높다""고 전망했습니다.최 연구원은 ""외국인들의 매도 공세가 일단 멈췄다는 점은 굉장히 의미가 크다""며 ""국내 기관들은 은행주 비중이 여전히 '비중축소(Underweight)' 상태로 추가 반등시 계속 추격 매수에 나설 수밖에 없어 매도 공백이 예상되고, 전반적인 수급 상황은 우호적일 수밖에 없다""고 말했습니다.다만 은행주들의 향후 위기 대응 능력이 주가의 변수가 될 것이라는 분석도 나옵니다. 정부의 국책은행과 시중 은행을 활용한 위기 극복 대책은 단기적으로 효과적이었으나 코로나 사태가 장기화될 경우 정책의 부작용이 나타날 것이라는 지적입니다.서영수 키움증권 연구원은 ""4대 금융지주의 1분기 순이익은 전년 동기 대비 1.4% 감소해 시장 추정치 대비 양호한 실적을 기록했다""면서도 ""실적이 주가에 미치는 영향은 제한적일 것""이라고 설명했습니다.서 연구원은 ""미국과 달리 코로나 쇼크에 따라 예상되는 차주의 상환 능력 악화를 비용에 반영하지 않았고, 3조원대의 사모펀드 환매 중단으로 인해 입을 수 있는 1조원 수준의 손실을 반영하지 않았다""며 ""여기에 기준금리 인하, 저원가성 예금 순증 둔화로 순이자마진 하락이 2분기 이후 가속화될 것으로 예상된다""고 밝혔습니다.[MBN 온라인뉴스팀]< Copyright ⓒ MBN(www.mbn.co.kr) 무단전재 및 재배포 금지 >",/news/news_read.nhn?article_id=0001452522&office_id=057&mode=search&query=KB금융&page=1
