head,text,url
단순 입출금부터 인증서 없이 투자까지빅데이터 기반 금융서비스 다각화 검토온라인 문턱 낮추고 100% 비대면 준비'비대면 거래'도 고객 신뢰 확보가 관건,"[서울=뉴시스] 박은비 기자 = 신종 코로나바이러스 감염증(코로나19) 확산에 따른 언택트(un-contact·비대면) 활성화로 금융거래 영역이 확장될 전망이다.2일 금융권에 따르면 계좌 개설, 상품 가입, 입출금·송금 등 상당수 금융거래가 인터넷·모바일 등 온라인에서 가능하다. 공인인증서 없이 거래가 가능한 업체도 있다. 온라인 금융거래 확대는 금융회사들이 갈수록 점포수를 줄이는 이유이기도 하다. 하지만 금융거래에서 일정 부분 대면거래가 불가피한 면이 있다. 예를 들어 주택담보대출(주담대)의 경우 거래금액이 고액인 데다 관련 규제가 많아 대출하는 입장에서도, 받는 입장에서도 직접 눈으로 보고 안심하는 편이다. 법률 검토가 필요한 부분은 전산화하는 데 한계도 있다.이 때문에 윤호영 카카오뱅크 대표는 지난 27일 주담대 상품 출시를 묻는 취재진 질문에 ""주담대 모든 절차를 비대면으로 개발하는 작업은 생각보다 쉽지 않다. 특히 복잡한 규정이 얽혀 있어 더욱 어렵다""며 ""세계의 어느 은행도 아직 완전 비대면으로 주담대 상품을 운용하지 못하고 있다. 단기간에 해결될 문제가 아니라서 구체적인 출시 시기를 이야기하기에는 매우 이른 상황""이라고 말하기도 했다.하지만 앞으로가 기대되는 건 코로나19가 많은 것을 바꿔놨다는 점이다. 금융회사는 코로나19 관련 지원대책을 내놓을 때마다 비대면 신청이 가능한 점을 강조해왔다. 감염 예방 목적도 있지만, 얼마나 디지털 서비스가 앞서가는지 보여주는 계기도 됐다.당장은 아무래도 신규사업자들의 언택트 노력이 돋보인다. 온라인투자연계(P2P) 금융기업 렌딧 등은 온라인 거래를 전제로 한 사업인 만큼 빅데이터 분석 기반 신용평가모델을 만드는 등 간편 투자를 지향한다. 금융플랫폼 토스 등은 신용등급조회 서비스를 제공하면서 신용평가(CB)사 신용등급 평가에 대한 접근성을 높이고 사용자들의 빅데이터를 확보해 서비스 다각화를 모색 중이다. 인터넷전문은행 케이뱅크는 자금 조달 문제만 해결되면 100% 비대면 아파트담보대출이 가능하도록 준비하고 있다.시중은행들은 기존 관념을 탈피하기 위해 노력 중이다. 신한금융이 '디지털 후견인 제도'를 도입한 게 대표적이다. 각 그룹사 최고경영자(CEO)가 미래에 꼭 필요한 디지털 핵심기술을 하나씩 전담해 주도적으로 사업을 이끄는 방식이다.우리금융은 주요 자회사 임원들이 디지털 서비스에 친숙해질 수 있도록 '인사이드 리버스 멘토링' 프로그램을 실시하고 있다. 디지털 멘토 직원들과 외부전문가가 경영진을 교육한다. KB금융은 KB스타터스를 선정해 스타트업의 연구개발을 후원하고, 우수한 아이디어나 기술을 활용하는 방식으로 협업을 진행하고 있다. 실제적으로 고객들이 와닿게 언택트 거래 문턱을 낮춘 은행들도 있다. SC제일은행은 모바일·인터넷뱅킹 펀드상품 가입 최저금액을 1만원으로 낮췄다. 누구나 큰 부담 없이 손쉽게 투자를 시작할 수 있게 하겠다는 취지다. 전국 주요 도시에서 개최하던 투자전략 세미나 '웰쓰케어 세미나'도 최근 '웰쓰케어 웹 세미나'로 확대했다.향후 비대면 거래는 대면 거래 못지않게 고객들의 신뢰를 어떻게 담보할 수 있을지가 관건일 것으로 예상된다. P2P금융업계에 따르면 언택트 거래를 선호하는 투자자들도 연체율이 치솟는 등 문제가 생길 때마다 직접 본사를 찾는 경우가 적지 않다. 대면해서 직원들의 설명을 듣고 업체에 대한 인식이 나아진 경우가 많아 업체들도 미리 연락하고 내방하는 투자자들을 마다하지는 않는다고 한다. 코로나19 이전에는 P2P금융 관련 커뮤니티에서 모인 투자자들을 대상으로 소규모 투자설명회도 여러 차례 개최했다. 한 P2P금융업체 관계자는 ""아직까지는 (투자자들이) 직접 나서야 문제가 해결된다는 인식이 있어서 그런 것 같다""면서도 ""회사로 직접 찾아온 경우는 투자금액이 큰 법인투자자나 고령층이 대부분이고, 30·40대 투자자들은 거의 없다""고 말했다. 은행권 관계자는 ""(지금으로서는 비대면이 불가능해보이는 상품군도) 아예 비대면 검토를 안 할 수 없는 게 신규사업자들이 치고 나올 것이라는 긴장감이 있기 때문""이라며 ""코로나19 이전을 생각할 수 없을 만큼 많은 것이 변화할 것""이라고 내다봤다. silverline@newsis.com<ⓒ 공감언론 뉴시스통신사. 무단전재-재배포 금지>",/news/news_read.nhn?article_id=0009843460&office_id=003&mode=search&query=KB금융&page=1
자주 쓸수록 혜택 큰 ‘신한카드’-간편결제 등 일상생활 집중 ‘국민카드’연회비 부담? 무조건 할인 ‘삼성카드’…캐릭터 부담된다면 ‘씨티카드’,"카카오뱅크가 국내 카드사 4곳과 손을 잡고 카카오의 인기 캐릭터 ‘라이언’을 전면에 내세운 ‘카카오뱅크 신용카드’를 출시했다. 한날 한시에 출시됐지만 플레이트 디자인에서부터 혜택에 이르기까지 각사 특색에 따라 각양각색인 만큼 고객들은 취향과 소비패턴 등에 따라 자신만의 선택을 할 수 있다.2일 관련업계에 따르면 카카오뱅크 제휴 신용카드를 출시한 카드사는 신한카드와 KB국민카드, 삼성카드, 씨티카드 등 4곳이다. 우선 4개 카드사 가운데 가장 높은 연회비(해외겸용 1만7000원)를 책정한 신한카드의 경우 전월실적과 관계없이 이용횟수(국내가맹점)에 따라 최대 5만원의 캐시백 혜택을 제공받을 수 있다.매월 1일부터 말일까지 카카오뱅크 신한카드로 5000원 이상 쓴 횟수를 카운트해 10회 단위(10회 2000원, 20회 5000원, 30회 1만원)로 캐시백 받을 수 있는 금액이 높아지는 방식이다.또한 전월 40만원 이상 이용 시 배달의 민족 등 배달앱과 카카오T에서 5000원 이상 결제 시 3000원 추가 캐시백(월 2회, 최대 6000원) 혜택도 제공된다.KB금융그룹의 상징인 노란색을 바탕으로 3D 입체 문양의 라이언이 유일하게 후드를 입고 있는 KB국민카드의 연회비는 1만5000원 수준이다. 라이언에 호응하는 2030 고객을 겨냥한 이 상품은 젊은층이 자주 이용하는 간편결제와 배달앱 등 일상생활 혜택에 초점을 맞췄다.카뱅 국민카드의 경우 전월 실적에 따라 7개 주요생활영역에서 최대 5만원까지 할인받을 수 있다. 이 카드는 △카카오페이·편의점·영화·배달의민족·마켓컬리·커피·제과·패스트푸드점에서 1만원 이상 결제 시 건당 3000원 할인 △숙박앱·인터파크·멜론·지니·PC방·노래방·만화방서 1만원 이상 결제하면 건당 5000원의 할인이 적용된다. 전월 실적이 50만원 이상이면 총 3만원, 100만원 이상이면 총 5만원의 할인한도가 적용된다.파랑색 배경에 라이언을 카드 정중앙에 배치시킨 삼성카드는 카뱅 제휴 신용카드 중 씨티카드와 더불어 가장 저렴한 연회비(7000원)가 강점이다. 여기에 ‘조건없는 할인혜택’을 전면에 내세워 부담없이 카드를 사용할 수 있는 ‘실속파 고객’을 잡겠다는 전략이다.카뱅 삼성카드는 국내외 전 가맹점에서 기본 0.5% 할인해주고 편의점과 슈퍼마켓 등 생활필수업종에서는 1% 할인혜택을 무한도로 제공한다. 여기에 전월 이용금액이 50만원 이상일 경우 온라인쇼핑·배달앱·헬스&뷰티·신선식품배달 업종에서 3%(최대 5000원), 커피전문점과 대중교통에서 5%(최대 5000원) 할인혜택을 받을 수 있다. 아울러 넷플릭스, 멜론과 같은 스트리밍 업종과 영화관 할인도 함께 담았다.마지막으로 씨티카드의 경우 유일하게 라이언 캐릭터가 없는 은색 민무늬 플레이트를 차용했다. 특정 연령 고객군에 집중하기보다는 20대부터 50대까지도 아우를 수 있도록 범용성을 넓힌 것이다. 다만 연말까지 카드발급고객을 대상으로 카카오프렌즈 캐릭터 스티커를 제공하는 이벤트는 타 카드사와 동일하게 진행된다.카뱅 씨티카드는 전월 실적에 따라 월 최대 2만원 통합 할인한도 내에서 전세계 스타벅스와 따릉이·카카오 T 바이크 등 공유 자전거 이용 시 50% 청구할인을 받을 수 있다. 또 멜론·넷플릭스 등 스트리밍 서비스(25%), 대중교통 및 통신비, 배달앱, 편의점 등 생활밀착 업종(5%)에 대해서도 청구할인 혜택이 적용된다. 월 사용일수에 따른 최대 5000원 보너스 할인과 함께 해외서비스수수료 전액 면제를 포함하는 등 글로벌 금융회사로의 위용을 혜택에 담아냈다.한편 카카오뱅크와 카드사들은 출시를 기념해 27일부터 7월31일까지 카뱅 신용카드를 발급받고 6~10만원 이상 이용한 고객을 대상으로 최대 6만원을 현금으로 돌려주는 이벤트도 진행 중이다. 단 직전 1년간 해당 카드사의 카드를 이용한 실적이 없어야 한다. 이벤트 대상 및 조건은 카드사별로 다르므로 자세한 내용을 확인한 뒤 참여해야 한다.데일리안 배근미 기자 (athena3507@dailian.co.kr)ⓒ (주)데일리안 - 무단전재, 변형, 무단배포 금지",/news/news_read.nhn?article_id=0002399450&office_id=119&mode=search&query=KB금융&page=1
순익 각각 750%·345% 급증…하나생명 등 은행계 보험사들 선전,"[아이뉴스24 허재영 기자] 금융지주 계열 보험사 가운데 농협생명과 농협손해보험이 올 1분기 나란히 호실적을 기록했다. 하나생명과 KB손해보험도 어려운 업황 속에서 실적 방어에 성공했다.2일 보험업계에 따르면 1분기 NH농협금융의 농협생명 당기순이익은 51억원으로 전년(6억원) 대비 750% 증가했다.농협생명 관계자는 ""보장성 위주의 신상품 조기 출시 등 수익성 개선에 역량을 집중했다""며 ""전자약관 활용, 모바일 안내장 도입 등 지속적 DT(Digital Transformation) 추진으로 사업비차손익도 개선됐다""고 밝혔다.농협손해보험도 1분기 호실적을 기록했다. 농협손보는 89억원의 당기순이익을 거두며 전년(20억원) 대비 345% 순이익이 급증했다. 농협손보 관계자는 ""지난해 1분기 대형 화재 등의 영향으로 실적이 쪼그라들었지만 올해는 그러한 요인들이 없었다""며 ""또한 장기 보험 등에서 손해율도 안정되면서 실적이 개선됐다""고 말했다.양사는 지난해 실적 개선에 이어 올해 1분기에도 호실적을 거두며 좋은 흐름을 이어가게 됐다. 지난해 농협생명은 가치 중심 경영체제 전환 등 경영체질 개선 노력에 힘입어 순이익 401억원을 기록하며 전년도 적자에서 흑자로 전환했다. 농협손보도 지난해 68억원의 순익을 거두며 전년(20억원) 대비 242.3% 성장했다. 영업이익도 2018년 112억원에서 지난해 197억원으로 75.9% 뛰었다.하나금융 계열 보험사인 하나생명도 실적이 개선됐다. 하나생명의 올해 1분기 당기순이익은 190억원으로 전년 동기보다 171.4% 급증했다.이는 수익증권 환매로 특별배당수익이 들어온 일회성 요인이 크게 작용했지만 이를 제외하더라도 전년과 비슷한 수준으로 선방했다는 평가다. 지난해 1분기 하나생명의 금융자산투자수익은 137억원에서 올해 1분기에는 367억원으로 2배 가량 늘었다.KB금융 보험 계열사 중에서는 KB손해보험이 코로나19 확산에 따른 반사이익으로 실적 방어에 성공했다. KB손보의 1분기 당기순이익은 772억원으로 전년 동기(754억원) 대비 2.4%(18억원) 증가했다.이는 코로나19 사태로 사회적 거리두기가 시작되면서 차량 운행이 줄어들어 사고건수가 감소하면서 자동차보험 손해율이 하락한 영향이다. KB손보의 1분기 자동차보험 손해율은 84.7%로 전년 동기(85.9%)보다 1.2%포인트 개선됐다. huropa@inews24.com [ⓒ 아이뉴스24 무단전재 및 재배포 금지]",/news/news_read.nhn?article_id=0000536638&office_id=031&mode=search&query=KB금융&page=1
올해 대출 증가율 5% 전망비이자수익 증대 집중 계획,"[서울경제] 신종 코로나바이러스 감염증(코로나19)의 여파에도 국내 금융지주사들이 올해 1·4분기 대체로 선방한 가운데 이들의 시선은 벌써부터 연말을 향하고 있다. 코로나19가 금융에 미칠 영향력은 올해 연말께 돼야 알 수 있다고 전망하면서다. 이에 대비해 금융지주사들은 선제적으로 건전성 관리에 들어간 동시에 비이자수익을 통한 수익 확대에 집중하겠다는 방침이다.올해 1·4분기 실적 발표 이후 컨퍼런스콜을 진행한 KB·신한·하나금융그룹들은 컨콜에서 올 한해 전체 수익을 결정하는 요인으로 ‘비이자이익’을 꼽았다. 저금리 기조에 코로나19 여파까지 덮치면서 주 수익원이었던 예대마진(예금금리와 대출금리의 격차)이 축소되기 때문이다. 올해 1·4분기 실적에서 신한금융이 KB금융을 따돌리고 리딩 금융그룹 타이틀을 유지한 요인 중 하나도 비이자이익이었다. 신한금융의 비이자이익은 7,342억원으로 KB금융(3,929억원)의 2배 가량 많다. 신한금융은 이같은 기조를 이어나가 비이자이익 부문에 중점을 두고 올해 경영하겠다는 방침이다. KB금융 역시 “올해 같은 경우 지주사들이 수익성을 제고하려면 비이자이익 확대가 무엇보다도 중요하다”며 “은행과 증권, 카드의 영업력을 최대한 발휘해서 수수료 수익을 확대할 계획”이라고 말했다.금융지주사들은 코로나19의 여파로 대체로 올해 대출금이 전년보다 5%가량 증가할 것으로 내다봤다. 코로나19로 중소기업, 소상공인뿐만 아니라 대기업에서도 자금난을 겪어 은행 문을 두드리고 있기 때문이다.KB금융과 신한금융은 올해 기업의 유동성 확보와 정부의 정책적 지원확대 등을 고려해 대출금 목표를 당초보다 소폭 상향된 5%대로 설정했다고 밝혔다. 하나금융 역시 올해 대출성장률을 3~4%로 보고 보수적으로 자산 증가를 계획하고 있다. 늘어난 대출에 따른 연체율 관리도 관건이다. 올해 1·4분기 신한금융 연체율이 0.31%, KB금융이 0.24%, 하나금융이 0.31%, 우리금융이 0.35%를 기록했다. KB금융을 제외하고 모두 1bp에서 5bp 증가했다. 신한금융 측은 “현재 코로나19 관련 신규대출이 2조 2,000억원, 만기연장한 대출이 2조 5,000억원 가량 된다”며 “연말에 어느 정도 연체율이 나오고 얼마나 손익에 영향을 주는지가 걱정되는 상황”이라고 했다. 하나금융에서도 “중소기업·소호 분야에서 1·4분기보다 조금 연체 쪽에서 증가할 가능성에 대해 관리하고 있다”며 “4·4분기 이후 증가될 것을 대비해 선제적으로 관리하고 있다”고 설명했다. KB금융 측은 “카드사의 경우 코로나19로 직접적 피해가 큰 가맹점 미수금이 소폭 증가했다”며 “코로나19에 민감한 업종은 신규 대출의 취급기준을 강화하고 기존 대출을 사후관리하고 있다”고 언급했다. /김지영기자 jikim@sedaily.com저작권자 ⓒ 서울경제, 무단 전재 및 재배포 금지",/news/news_read.nhn?article_id=0003732216&office_id=011&mode=search&query=KB금융&page=1
▶ 헉! 소리나는 [헉스] ▶ '너 그거 아니?' [두유노우]▶ 지금 파이낸셜뉴스 채널 구독하고 경품 GET!,"[파이낸셜뉴스]
진입장벽이 낮은 PC방 산업이 다른 서비스업종보다 창업률과 폐업률 모두 높은 수준인 것으로 조사됐다. 코로나19 영향으로 위기를 맞은 현 상황의 극복 여부에 따라 향후 PC방 산업의 방향이 정해질 것이란 전망이다.
 2일 KB금융지주경영연구소가 발간한 'PC방의 무한변신' 보고서에 따르면 2020년 3월 기준 전국 PC방은 약 2만개가 영업 중이며, 2011년부터 2015년까지 감소 추세였으나, 2016년부터 다시 소폭 증가세가 나타난 것으로 나타났다.
 PC방 산업은 IMF 외환위기 당시 명예퇴직자들의 PC방 창업을 시작으로 이후 게임산업의 발전으로 2000년대 중반까지 꾸준한 증가세가 나타났다. 그러나 2009년 스마트폰 보급과 함께 PC방에 대한 수요가 낮아지며 PC방 수가 감소세로 전환했다.
 2013년 PC방 흡연 금지법 시행 이후 PC방의 트렌드가 바뀌며 2014년부터 신규 PC방 수가 다시 증가하기 시작했고, 2016년부터는 전국 영업중인 PC방 수가 증가했다.
 PC방은 진입장벽이 낮아 자본금만 있다면 누구든 쉽게 창업이 가능한 반면 폐업 수도 많은 편이다.
 PC방 폐업 수가 가장 많았던 해는 2011년으로 약 3900개의 PC방이 폐업했으며 2003년부터 2006년까지는 매년 폐업 수가 100개 미만일 정도로 PC방 산업이 호황이었다.
 2008년 금융위기 및 2009년부터 스마트폰 보급이 본격화되며 폐업 수가 급증하였으며, 이후 PC방 트렌드의 변화로 인해 신규 및 폐업 수 모두높은 추세다.
 2019년 기준 창업률은 16.4%로 타 업종 대비 높은 창업률을 보였으나 폐업률 또한 15.7%로 높은 폐업률을 기록했다. 자영업종인 커피숍(14.4%), 당구장(13.8%), 제과업(11.0%), 미용업(6.3%), 노래방(4.6%) 등보다 높았다.
 높은 창업률의 이유로는 적은 초기자본, 전문지식을 필요로 하지 않는 낮은 진입장벽 등이 있으며, 높은 폐업률의 이유로는 동일업종간 경쟁 심화, 인건비 상승 등이 꼽혔다.
 보고서는 ""PC방 산업은 각종 위기와 규제에도 위기를 기회로 만들어 생존하고 발전한 경험을 바탕으로 시장도 지속적으로 확대가 예상된다""면서 ""다만 코로나19 확산의 영향으로 사회적 거리두기 및 정부의 PC방 휴업 요청으로 인해 PC방 산업 은 다시 한 번 큰 위기를 맞이해 회복 여부가 향후 PC방 산업의 방향에 큰 부분을 차지할 것""으로 내다봤다.



 ※ 저작권자 ⓒ 파이낸셜뉴스. 무단 전재-재배포 금지",/news/news_read.nhn?article_id=0004417948&office_id=014&mode=search&query=KB금융&page=1
,"[아시아경제 조강욱 기자] 국내 금융지주의 올해 1분기 실적을 두고 엇갈린 해석이 나온다. 신종 코로나바이러스감염증(코로나19) 사태에도 불구, 선방했다는 시각이 있는 반면 이제부터 실물경제에서 시작된 충격이 금융권에서 본격화될 것이라는 시각도 존재한다.2일 금융권에 따르면 신한·KB·하나·우리금융 등 4대 금융지주의 올 1분기 총 순이익은 2조8371억원으로 3조원에 육박했다. 전년 동기(2조8788억원) 대비 1.4% 감소한 수준이다.신한지주가 9324억원을 기록하며 1위를 차지했고 이어 KB금융(7295억원), 하나금융지주(6570억원), 우리금융지주(5182억원)의 순이었다.4대 금융지주사의 이번 실적에 대해 전문가들 사이에서는 '나름 선방'했다는 시각이 우세하다. 실제로 이번 분기 두자릿수 급락이 예상됐던 우리금융의 1분기 순익 하락률은 8.9%에 그쳤다. 예상을 웃돈 결과에 실적 발표 후 금융주가는 뛰어올랐고 외국인 투자자들은 대형 금융주 순매수에 나섰다.김재우 삼성증권 연구원은 ""지난 주 KB금융을 비롯, 금융지주의 실적 발표 이후 은행주는 큰 폭으로 상승했다""면서 ""은행들의 실적 발표 이후, 2분기 실적에 대한 우려 완화와 더불어 최근 다른 업종들의 가파른 주가 회복 속에서 은행주의 상대적인 주가 매력도가 높아진 것에 기인한다""고 말했다.반면 2분기부터 본격적인 코로나 충격이 도래할 것이란 지적도 제기된다. 정부발(發) 코로나 지원책이 쏟아지면서 금융지원을 뒷받침하고 있는 은행의 수익성과 건전성 악화 우려가 커지고 있기 때문이다.국제 신용평가회사 피치는 최근 신종 코로나바이러스 감염증(코로나19) 확산의 부정적 영향을 고려해 국민은행과 신한은행의 장기발행자등급(IDR) 전망을 '안정적'에서 '부정적'으로 하향 조정했다.피치는 ""코로나19 확산이 경제에 미치는 여파가 향후 2년 동안 은행들의 신용도에 큰 압력을 가할 것""이라며 ""국내 은행업의 위험도가 높아졌다""고 분석했다.은행권이 기대이상의 1분기 실적을 내놨지만 이 부분이 신용도에 고려되지 않았다는 해석이 나온다. 1분기 실적에 코로나 사태 영향이 반영되지 않았고, 국책은행과 민간은행 주도의 위기 극복대책이 은행 신용에 부정적 영향을 끼친다고 본 것이다.서영수 키움증권 애널리스트는 ""코로나사태 이후 부동산 시장 침체로 부동산 PF, 임대사업자대출 등 부동산 금융의 부실화가 수면 위로 부상하고 있고, 수출 급감으로 부실화 우려가 항공, 운송 등에 이어 자동차, 철강 등 주요 대기업까지 확산되고 있다는 것은 해외 펀드 손실에 이어 다양한 형태로 은행의 펀더멘탈 훼손의 조짐이 나타나고 있음을 시사한다""면서 ""코로나사태 이후 은행의 펀더 멘탈 악화가 본격화되어 은행등급이 하향 조정된다면 해외 투자자에게 적지 않은 영향을 미칠 것""이라고 진단했다.이대기 한국금융연구원 은행ㆍ보험연구실장은 “코로나19로 인한 수출 감소, 내부 부진 등 경기침체로 중견ㆍ대기업에서 부실이 날 가능성이 높아지고 있다”며 “은행들이 손실에 대비해 2분기 또는 그 이후부터 대손충당금을 쌓아 나가야 하기 때문에 건전성과 수익성이 나빠질 수밖에 없다”고 지적했다.조강욱 기자 jomarok@asiae.co.kr <ⓒ경제를 보는 눈, 세계를 보는 창 아시아경제 무단전재 배포금지>",/news/news_read.nhn?article_id=0004671415&office_id=277&mode=search&query=KB금융&page=1
