head,text,url
이사회 논의 거쳐 위험가중자산산출 내부등급법 전환 금융당국에 승인 신청 BIS 1~2%p 개선 2조 추가출자 여력 추정…코로나19 피해기업 지원도 확대,"(서울=뉴스1) 장도민 기자,박기호 기자 = 우리금융지주가 이번주 중 이사회 논의를 거쳐 인수·합병(M&A) 실탄을 늘릴 수 있는 내부등급법 전환 승인을 금융당국에 정식 신청한다. 신용리스크에 대한 위험가중자산 산출방식이 현재의 표준등급법에서 내부등급법으로 바뀌면 우리금융의 국제결제은행(BIS) 자기자본비율이 1~2p% 높아져 2조원 가량의 추가 출자 여력이 생길 것으로 추정된다. 증권, 보험 등 비은행 부문 강화가 절실한 우리금융이 대규모 M&A에 나설 수 있는 발판이 마련되는 셈이다.
17일 은행권에 따르면 우리금융은 이번주 중 이사회를 열고 내부승인법 전환을 논의한 뒤 금융당국에 승인을 신청할 계획이다. 우리금융 내부등급법 전환과 관련해 지난달 29일까지 진행된 금융감독원의 1, 2차 현장실사에서 특별한 문제점이 발견되지 않은 것으로 알려져 금융권에선 전환 승인이 무난할 것으로 예상된다. 금감원은 향후 예정된 절차 등에서 꼼꼼히 점검한다는 방침이다.
 현재 우리금융은 위험가중자산 산출방식으로 표준등급법을 적용받고 있다. 현행 규제상 신설된 금융지주사는 최소 1년동안 위험가중자산을 보수적으로 평가하는 표준등급법을 적용해야한다. 반면 내부등급법은 자체 추정한 리스크 측정요소를 활용해 위험가중자산을 산출하기 때문에 표준등급법을 적용할 때보다 위험가중자산이 줄어든다.
위험가중자산이 감소하면 BIS 비율이 높아져 출자 여력이 커진다. BIS 비율은 자기자본을 위험가중자산으로 나눠서 구한다. 지난해 말 기준 우리금융의 BIS비율은 11.89%로 규제비율 하한선인 11.5%에 근접해 있다. 이는 KB금융(14.48%), 하나금융(13.95%), 신한금융(13.90%)에 비해 낮은 수준이다. 금융권에선 우리금융이 표준등급법에서 내부등급법으로 전환하면 BIS비율이 1~2%p 높아질 것으로 추정한다. 이 경우 약 2조원의 추가 출자 여력이 생길 것으로 예상된다. 여기에 지난해 하반기 6차례의 신종자본증권 등 채권발행으로 확보한 2조3500억원을 더하면 6조원 이상의 M&A 실탄을 확보하게 된다.우리금융은 내부등급법 전환을 승인받으면 신종 코로나바이러스 감염증(코로나19) 피해 자영업자와 중소기업 지원에도 적극적으로 나설 계획이다. 우리금융 관계자는 ""증권, 보험 등 대형 M&A의 경우 코로나19 등의 상황을 고려해 시간을 갖고 접근할 방침이다""고 말했다. 우리금융은 아주캐피탈 지분에 대한 우선매수청구권 행사도 신중하게 검토할 계획이다. 웰투시인베스트먼트는 지난 2017년 6월 웰투시제3호사모투자합자회사 펀드를 통해 아주캐피탈 지분 74%를 인수했다. 이후 우리은행은 이 펀드의 지분 49%를 약 1000억원에 인수했으며 나머지 지분에 대한 우선매수청구권도 보유하고 있다. 우리금융이 아주캐피탈을 인수하게 되면 100% 자회사인 아주저축은행까지 편입할 수 있어 비은행 계열사 두 곳을 동시에 확보할 수 있게 된다.jdm@news1.kr© 뉴스1코리아(), 무단 전재 및 재배포 금지",/news/news_read.nhn?article_id=0004641332&office_id=421&mode=search&query=KB금융&page=1
,"[아시아경제 송화정 기자]외국인이 국내 증시에서 2주 연속 매도세를 이어갔다.17일 한국거래소에 따르면 외국인은 지난 11일부터까지 15일까지 한 주 동안 국내 주식시장에서 약 2조632억원을 순매도했다. 유가증권시장에서 1조8326억원을, 코스닥시장에서는 2296억원을 각각 팔아치웠다.외국인이 지난 주 가장 많이 사들인 종목은 엔씨소프트였다. 외국인은 지난 주 엔씨소프트를 672억원 순매수했다. 뒤이어 카카오를 659억원 사들였다. 이밖에 LG생활건강(608억원), 삼성SDI(596억원), 삼성바이오로직스(564억원), 삼성화재(190억원), 오리온(127억원), 네오위즈(123억원), 포스코케미칼(118억원), NHN(116억원) 등을 순매수했다.지난 주 외국인이 가장 많이 판 종목은 삼성전자였다. 외국인은 지난 주 삼성전자를 3404억원 순매도했다. 이어 SK하이닉스를 3399억원 팔았다. 이밖에 LG화학(1846억원), NAVER(1035억원), KB금융(877억원), 삼성전자우(834억원), SK텔레콤(730억원), 한국전력(497억원), SK이노베이션(479억원), 현대차(468억원) 등이 외국인 순매도 상위에 올랐다.외국인이 돌아오기 위해서는 달러화 약세 전환, 이익추정치 상승 등의 조건이 필요하다는 의견이다. 하인환 메리츠증권 연구원은 ""증시의 상승 탄력이 다소 둔화된 모습""이라며 ""40조원 이상의 개인 자금이 여전히 대기중이라고 하지만 국내 증시가 또 한 차례 레벨업을 하기 위해서는 외국인이 언제 돌아오는지가 중요하다""고 말했다. 하 연구원은 ""외국인이 돌아오기 위해서는 달러화 약세 전환, 이익추정치 상승 전환 그리고 일부 신흥국(브라질, 인도, 남아공, 러시아 등)에서 신종 코로나바이러스감염증(코로나19) 신규 확진자 증가세 둔화가 필요하다""고 덧붙였다. 송화정 기자 pancake@asiae.co.kr <ⓒ경제를 보는 눈, 세계를 보는 창 아시아경제 무단전재 배포금지>",/news/news_read.nhn?article_id=0004679578&office_id=277&mode=search&query=KB금융&page=1
,"[머니투데이 한정수 기자] '투자의 귀재' 워런 버핏이 최근 항공주를 손절매한 데 이어 은행주의 비중도 줄였다. 그러나 국내 개인 투자자들은 이 같은 버핏의 움직임과 반대되는 투자 전략을 고수하고 있어 눈길을 끈다. 연일 국내외 항공주를 순매수하고 있는 개미들은 은행주도 대거 사들이고 있다.은행업종에 대한 증권업계 전문가들의 전망은 갈리고 있다. 코로나19(COVID-19) 사태에 따른 실물 경제 악화로 은행들의 실적이 더 나빠질 것이라는 우려가 나온다. 현재 은행 종목들의 주가가 역사상 최저 수준으로 떨어져 있는 만큼 조만간 반등의 기회가 올 것이라는 시각도 존재한다. 17일 한국거래소에 따르면 지난달 17일부터 이날까지 1개월간 개인들의 KB금융 순매수액은 2102억8200만원에 달한다. 최근 들어 순매수세가 더 강해졌다. 개인들은 지난 4일부터 전 거래일인 15일까지 9거래일 연속으로 KB금융 주식을 순매수했는데 이 기간 순매수액은 2152억원을 넘는다. 이 밖에 개인들의 최근 1개월간 하나금융지주 순매수액은 667억300만원, 우리금융지주 순매수액은 472억7600만원, 신한지주 순매수액은 441억8300만원인 것으로 파악됐다. 주가 흐름은 신통치 못하다. KB금융은 코로나19 사태로 국내 증시가 폭락했던 지난 3월 19일 저점인 2만6050원에서 지난 15일 3만1450원까지 20.7% 상승하는 데 그쳤다. 같은 기간 하나금융지주는 36.7%, 우리금융지주는 21.2%, 신한지주는 30.7% 올랐다. 이 기간 코스피지수가 32.2% 상승한 것과 비교하면 저조한 수익률이다. 전문가들은 실적이 나빠질 수 있다는 우려가 은행주들의 발목을 잡고 있다고 분석한다. 최근 워런 버핏이 골드만삭스 보유 지분의 84%를 매각하고 대형 지방은행 US뱅코프 지분을 판 것도 향후 은행업종의 부진이 길어질 수 있다는 판단 때문인 것으로 풀이된다. 특히 실물경제 악화로 자영업자나 중소기업을 대상으로 한 대출에 부실이 발생할 수 있다는 우려가 크다. 국제 신용평가사 피치는 지난달 말 국민은행과 신한은행의 등급 전망을 '부정적'으로 하향 조정하기도 했다. 두 은행은 자영업자 대출 비중이 상대적으로 높다. 그러나 현재 은행주들이 과도하게 저평가 상태라는 의견도 만만치 않다. 현재 KB금융 등 4개 은행지주의 PER(주가수익비율)은 2.9∼4.1배 사이로 나타났다. PER는 주가를 주당순이익(EPS)으로 나눈 수치로 미국과 유럽의 주요 은행들 평균 PER은 10배가 넘는다. 이에 국내 은행주들이 향후 제자리를 찾아갈 가능성이 높다는 분석이 나오는 것이다. 최정욱 하나금융투자 연구원은 ""은행주가 성장 모멘텀(성장동력)이 있는 업종은 아니지만 각종 우려들이 주가에 과도하게 반영됐다는 인식들이 확산될 것으로 예상된다""며 ""글로벌 경제활동 재개 및 미·중 무역협상 가능성 등이 매크로(거시) 지표들을 우호적으로 변화시킬 수 있다는 기대감이 커지면 코스피와의 낙폭 차이를 더 줄일 수 있다""고 강조했다. 배당 매력에 주목해봐야 한다는 조언도 나온다. 김인 BNK투자증권 연구원은 ""2% 미만의 시장금리를 감안할 때 보수적으로도 5%를 넘는 은행주 배당수익률이 무시를 당하고 있다""며 ""현재의 주가 수준은 취약한 수급 상황을 감안해도 이해하기 힘들다""고 지적했다. 한정수 기자 jeongsuhan@mt.co.kr
<저작권자 ⓒ '돈이 보이는 리얼타임 뉴스' 머니투데이, 무단전재 및 재배포 금지>",/news/news_read.nhn?article_id=0004409961&office_id=008&mode=search&query=KB금융&page=1
