head,text,url
◇ M&A로 시너지·자회사 지분확대 나서,"[이데일리 김재은 기자] 신종 코로나바이러스 감염증(코로나19) 팬데믹에 적지 않은 기업들이 타격을 입고 있지만, 되레 투자 확대에 나서는 곳도 있어 눈길을 끈다. 위기를 기회로 삼는 역발상 전략을 택한 것으로 보인다. 15일 금융감독원에 따르면 이달 들어 14일까지 타법인주식및지분취득(양수)을 신고(정정포함)한 상장사는 유가증권 5곳, 코스닥 11곳 등 총 16곳으로 집계됐다. 이는 전년동기(유가 4곳, 코스닥 14곳 등 18개사)에 비해 11.1% 줄어든 수준이지만 코로나19로 경제가 꽁꽁 얼어붙었다는 점을 감안하면 적지 않은 수준이라는 분석이 나온다. [그래픽=이데일리 김다은 기자]는 지난 7일 미국 면세점 브랜드 3Sixty로 알려진 트래블 리테일 그룹 홀딩스 지분 44%를 1417억원에 인수하기로 했다. 이미 지난해 10월 이사회 결의 이후 고심하다 인수 타이밍을 지금으로 잡은 것이다. 호텔과 면세사업 모두 코로나19 확산에 따른 대표 피해업종으로 꼽힌다. 이에 따라 한국신용평가와 한국기업평가는 최근 호텔신라의 등급전망을 ‘안정적’에서 ‘부정적’으로 낮추기도 했다. 코로나19 확산에 따라 호텔과 면세시장 수요가 급격히 저하됐고, 영업실적이 크게 부진할 것이란 전망에서다. 그럼에도 호텔신라는 면세사업 글로벌 경쟁력을 강화하고 미주 면세사업 진출을 위한 교두보 확보를 위해 인수를 결정했다.는 LG CNS 지분 매각으로 마련된 1조원 가운데 900억원을
지분 확대에 쓰기로 했다. LG는 LG유플러스 지분 853만여주(2%)를 장내에서 취득한다고 공시했다. 지난 1일 종가를 기준으로 할 때 900억원 규모로 금액은 다소 변동될 수 있다. 취득 후 LG의 LG유플러스 보유지분율은 종전 36%에서 38%(1조6590만7583주)로 높아진다. 도 자회사 심텍의 주주배정 유상증자에 222억원의 자금을 투입한다. 경영지배력 안정화와 재무구조 개선, 신규 시설투자 확보 등을 위해서다.코로나19로 기존 사업이 타격을 받으면서 사업다각화나 시장 개척에 나서는 곳들도 적지 않다. 강구조물(데크플레이트) 제작, 설치업체인 은 스파앤리조트 개발을 영위하는 이스트베이 지분 17%를 81억원을 들여 인수하기로 했다. 건축 강건재전문기업에서 리조트 등 개발사업으로 사업범위를 넓히는 것이다. 산업용 로봇제조업체인 은 150억원을 들여 네이버시스템 지분 51%를 인수, 시스템개발 사업에 뛰어든다. 는 183억원을 투자해 홍콩에 현지법인(SPC)을 설립하고, 중국 반도체 세정시장에 진출한다. SKC 솔믹스는 “1500만달러(183억원)를 홍콩 법인 설립에 투자하고, 중국 현지에서 950만 달러(116억원)를 차입해 중국 반도체 세정사업에 투자할 계획”이라고 밝혔다. 건강기능식품업체인 는 티씨엠생명과학 지분 22.25%를 159억원에 인수한다고 공시했다. 바이오 등 신규사업에 진출하려는 목적이다. 지난해 12월 상장한 도 호주에 미생물치료제 개발 현지법인을 설립하기로 했다. 천종식 천랩 대표는 “호주 시드니에 현지법인을 설립, 마이크로바이옴 신약개발에 5억원을 출자한다”며 “파킨슨병, 알츠하이머 등에 새로운 마이크로바이옴 치료제 후보물질을 발굴하겠다”고 말했다. 속옷업체인 은 사업다각화를 위해 소프트웨어 유통 판매업체인 포비스티앤씨 지분 26.14%를 575억원에 인수하기로 했다. 도 최근 2조원이 넘는 푸르덴셜생명 인수를 확정지었다. 은행에 편중된 금융지주 사업 포트폴리오를 다각화하는데 도움이 될 것이란 분석이다. 반면
자회사인 SK종합화학은 프랑스 아르케마(Arkema) 폴리머 사업 인수 위한 자회사 출자일정을 5월 11일로 한달가량 미루고 출자규모(1602억원)도 18.4%(362억원) 가량 줄였다. 는 자회사인 대우조선해양건설 지분 취득을 6월20일로 두달여 미뤘고, 대우조선해양건설 역시 우즈베키스탄 법인의 현물출자 일정도 6월로 연기했다. 금융투자업계 관계자는 “지금같은 시기는 좋은 물건을 싸게 살 수 있는 좋은 기회가 될 수 있다”면서도 “문제는 코로나19 여파가 어느정도일지 가늠하기 어려워 공격적인 투자 확대가 부메랑이 될 가능성도 배제하긴 어렵다”고 말했다.김재은 (aladin@edaily.co.kr)＜ⓒ종합 경제정보 미디어 이데일리 - 무단전재 & 재배포 금지＞",/news/news_read.nhn?article_id=0004620967&office_id=018&mode=search&query=KB금융&page=1
저성장·저출산·저금리와 코로나19로 실적 악화 우려 VS. 장기적으로 볼때 긍정적 평가,"[더팩트ㅣ정소양 기자] KB금융지주가 푸르덴셜생명보험을 인수하는 등 체급을 올리며 '리딩금융'인 신한금융지주 추격에 나섰다. 그러나 KB금융의 푸르덴셜생명 인수를 보는 시선은 '기대 반, 우려 반'이다. 일각에서는 저성장·저출산·저금리라는 삼중고를 겪고 있는 가운데 코로나19 여파까지 겹치면서 실적 악화를 우려하는 반면에 KB금융의 장기 포트폴리오 관점에서 보면 이번 인수가 긍정적이라는 평가도 나온다.KB금융그룹은 지난 10일 이사회에서 푸르덴셜생명보험 인수를 위한 '주식매매계약 체결 및 자회사 편입 승인 안건'을 결의하고 푸르덴셜생명에 대한 주식매매계약을 체결했다. 인수가는 총 2조3400억 원이다.지난해 말 기준 기업가치 평가액을 토대로 한 기초매매대금 2조2650억 원에 거래 종결일까지의 지분가치 상승을 감안한 이자 750억 원을 합친 금액이다. 다만, 거래 종결 때까지 발생하는 인수 관련 비용(사외유출금액)은 이자 지급분에서 뺄 예정이어서 최종 인수가는 2조3000억 원 안팎에서 확정될 것으로 전망된다.KB금융과 신한금융그룹이 '리딩금융' 경쟁이 뜨거워질 것으로 보고 있다. 푸르덴셜생명 인수로 KB금융의 올해 순익이 1000억 원 이상 증가할 것으로 전망되기 때문이다. 푸르덴셜생명의 지난해 순익은 약 1408억 원이다. KB금융의 지난해 당기순이익은 3조3118억 원으로 신한금융(3조4035억 원)에 917억 원 차이로 1위 금융지주 자리를 빼앗긴 바 있다.그러나 업계 안팎에서는 이번 KB금융의 푸르덴셜생명 인수에 대해 우려의 목소리가 나오고 있다. 국내 생명보험사들이 저성장·저출산·저금리라는 삼중고를 겪고 있는 가운데 코로나19 여파까지 겹쳤기 때문이다. 특히, KB금융의 재무적 부담이 커질 것이라는 예측도 나오고 있다.이미 국내 생명보험사들의 실적 악화는 현실화 되고 있다. 지난해 국내 생명보험사의 순이익 합계는 3조1140억 원으로 전년 대비 22.8%나 감소했다.보험업계 관계자는 ""푸르덴셜생명이 지난해 기준 지급여력(RBC) 비율 424.32%로 생보사 중 상위권이지만 현재 상황을 감안하면 자본 건전성을 장담할 수는 없는 상황""이라고 지적했다.이와 관련 KB금융 측은 ""철처한 자금조달 계획 이행을 통해 인수 후에도 안정적인 이중레버리지 비율과 BIS비율을 유지할 수 있을 것""으로 전망했다.윤종규 회장 역시 ""최근 심화되는 저금리기조 및 코로나19 여파로 생명보험사 인수를 놓고 우려가 많은 것도 사실이지만 그런 부분까지 다 감안해 면밀한 실사를 진행했다""고 밝힌 바 있다.인수자금 조달로 인한 재무부담 증가도 우려 요인으로 꼽힌다.KB금융의 이중레버리지 비율은 지난해 말 기준 126%로 다소 높은 편이지만, 이번 인수에 성공하면서 금융당국의 권고 수준인 130%를 넘길 것으로 보인다.김재우 삼성증권 연구원은 ""코로나19로 인해 저금리 기조가 심화되면서 생명보험 산업에 대한 우려가 여느 때보다 높은 데다 생보사들의 가치가 급락했다""며 ""단기적으로 KB금융지주의 푸르덴셜생명 인수는 시장에서 부정적으로 인식될 여지가 있다""고 분석했다.DB금융투자 이병건 연구원은 ""푸르덴셜생명 인수는 주주가치에 보탬이 되기 쉽지 않고 리스크를 확대시킬 수도 있는 부담스러운 면이 강하다고 본다""며 ""일단 당기순이익이 늘어나고 KB금융 기업가치에서 리스크 정도가 감내할만한 수준이라고는 판단한다""고 말했다. 이어 ""다만 일견 (인수)가격이 싸 보이지만, 생보사의 부채 평가가 적정한지 문제와 향후 역마진 부담이 가중될 수 있다는 점을 고려하면 겉보기만으로 평가할 상황은 아닌 것 같다""고 평가했다.다만 KB금융의 푸르덴셜생명을 긍정적으로 바라보는 시각도 있다.김도하 케이프증권 연구원은 ""KB금융은 푸르덴셜생명을 PBR 0.78배의 가격에 인수했다""며 ""순자산가치 확대 여력이 높고 K-ICS 도입시에도 자본안정성이 견조하므로 인수 가격이 정정하다고 판단된다""고 말했다.이어 ""단기 수익성보다는 장기 포트폴리오 관점이 우선해야 한다""며 ""증익 효과와 연금시장 확대 전략을 고려할 경우 인수는 긍정적""이라고 평가했다.jsy@tf.co.kr저작권자 ⓒ 특종에 강한 더팩트 & tf.co.kr 무단 전재 및 재배포 금지",/news/news_read.nhn?article_id=0000023143&office_id=629&mode=search&query=KB금융&page=1
‘OO페이’ 없인 결제하기 힘든 세상. 온라인 상거래 비중이 커지고 모바일 금융이 안착한 덕이다. 민간소비의 최접점인 유통업계와 금융업계는 간편결제를 도입해 이를 고도화하는 중이다. IT업계 역시 OO페이 대전에 참전했다. OO페이는 화수분이다. 유통업체는 간편결제로 쌓은 고객 데이터를 타깃 마케팅 자원으로 활용할 수 있다. 금융·IT업체는 간편결제를 디딤돌 삼아 종합금융플랫폼을 구축하고 있다. 국내 OO페이 현황을 진단하고 이를 둘러싼 업계의 속내도 들여다봤다. <편집자주>,"빅블러는 핀테크와 테크핀 활성화도 앞당겼다. 핀테크와 테크핀은 둘 다 금융(Finance)과 기술(technology)의 합성어지만 엄연히 다른 말이다. 얼핏 비슷해 보이는 두 단어는 주체가 금융업체냐 IT업체냐에 따라 의미가 달라진다.핀테크(금융)와 테크핀(IT)의 격전지는 간편결제다. 간편 송금에서 증권, 보험으로 영역을 확대해나가는 IT업체와 기존 금융서비스에 디지털을 더하는 금융업체. 이들의 협업과 경쟁이 간편결제의 진화를 견인하고 있다. 카카오페이와 토스, 네이버페이의 확장세가 무섭다. 지난 2월 말 카카오페이는 자회사 카카오페이증권과 함께 실명 계좌 기반의 증권서비스를 개시했다. 이용자 반응은 뜨거웠다. 카카오페이증권 계좌 개설수는 지난달 25일 기준으로 50만개를 넘어섰다. 지난 2월 증권업계 CMA(종합자산관리계좌) 계좌가 19만7000개 증가한 것과 비교하면 빠른 속도다.카카오페이 관계자는 “카카오톡 터치로 증권 계좌 개설과 펀드 투자가 가능하다는 접근성, 편리한 사용자 경험 등 낮은 진입장벽이 좋은 반응을 이끌어낸 요인으로 꼽힌다”고 설명했다.이처럼 카카오페이의 최대 강점은 접근성이다. ‘국민 메신저’ 카카오톡으로 송금, 보험관리, 대출비교 등을 할 수 있다. 카카오T(택시), 멜론, 카카오게임즈 등 ‘카카오 공동체’와의 연결성도 카카오페이만의 이점이다. 카카오페이는 최근 ‘통합조회’를 자산 및 지출 분석까지 가능한 ‘자산관리’ 서비스로 확대했다. 카카오페이 관계자는 “카카오페이와 카카오가 보유한 금융·비금융 정보와 빅데이터 역량을 접목해 정교한 자산관리 컨설팅을 할 수 있도록 힘쓸 것”이라고 강조했다.진은혜 기자 verdad89@mt.co.kr
<저작권자 ⓒ '성공을 꿈꾸는 사람들의 경제 뉴스' 머니S, 무단전재 및 재배포 금지>",/news/news_read.nhn?article_id=0000531815&office_id=417&mode=search&query=KB금융&page=1
"4대 금융지주 주가, 연초 대비 30% 빠져…저금리에 수익성 악화 우려주가 방어 나선 손태승·김정태 회장 자사주 매입…배당 등은 긍정 요인","(서울=뉴스1) 권혜정 기자 = 신종 코로나바이러스 감염증(코로나19) 사태로 은행 계열의 금융지주사 주가가 '반토막' 가까이 떨어졌다. 기준금리가 0%대에 진입해 수익성에 비상등이 켜졌고 코로나19 지원 등으로 자산건전성에도 먹구름이 꼈기 때문이다. 그러나 안정적인 배당, 주주친화 정책 등을 감안하면 금융지주 주식의 저가 메리트도 부각될 수 있다는 전망도 나온다.
16일 한국거래소에 따르면 지난 14일 KB금융지주 주가는 전날보다 650원(2.0%) 오른 3만3200원에 마감했다. 이는 연초 4만7650원에 비해 30.32% 떨어진 수치다. 신한금융지주도 550원(1.93%) 오른 2만9050원에 거래를 마쳤지만 이는 연초 4만3350원에 비해 32.98% 떨어진 수준이다. 하나금융지주는 같은기간 3만6900원에 비해 32.24% 떨어진 2만5000원, 우리금융지주는 1만1600원에서 25.77% 떨어진 8610원에 거래를 마쳤다. 올해들어 코스피 지수가 15% 가량 하락한 것에 비해 금융지주의 하락폭은 코스피의 2배 수준이다. 이처럼 주요 금융지주 주가가 큰폭으로 하락한 것은 코로나19 등으로 인한 실적 악화가 예상되기 때문이다. 증권정보업체 에프엔가이드에 따르면 KB·신한·하나·우리금융지주의 올해 1분기 당기순이익은 2조6967억원으로 전년 동기 대비(2조8887억원) 6.6% 가량 떨어졌을 것으로 추정됐다.
KB금융지주의 경우 올해 1분기 당기순이익이 전년 동기 대비 4.21% 감소한 8103억원으로 전망된다. 신한금융지주의 1분기 당기 순이익 추정치는 8641억원으로 10.53% 줄어들 것으로 추정됐다.
우리금융지주의 1분기 당기순이익 추정치도 21.07% 감소한 4850억원이었다. 4대 금융지주 중에는 하나금융지주가 감소치가 가장 적었는데, 올해 1분기 당기 순이익은 5373억원으로 전년동기 대비 3.01% 감소할 것으로 분석됐다. 은행 수익성을 가늠할 수 있는 순이자마진(NIM)도 1분기 소폭 하락할 전망이다. 백두산 한국투자증권 연구원은 ""1분기 은행 NIM은 전분기 대비 3bp 하락할 전망""이라며 ""이는 예상보다 적게 하락하는 것으로 1월까지만 해도 시장금리가 횡보했고, 예금은행 잔액기준 NIS(예대금리차)가 2.17%로 작년 4분기 대비 오히려 1bp 높았기 때문""이라고 설명했다. 문제는 2분기 실적이다. 백두산 연구원은 ""한국은행의 기준금리 50bp 인하와 이를 전후로 시장금리가 20~30bp 하락한 것은 주로 3월에 집중됐기 때문에 최근의 시장금리 하락은 주로 2분기 NIM에 영향을 미칠 것""이라고 전망했다. 그는 ""1분기 은행 합산 순이익은 3조4000억원으로 컨센서스를 12% 하회할 전망""이라며 ""당장은 이자이익보다 자본시장 변동성 상승과 각종 금융투자상품 수익률 저조로 주로 비이자이익 위주로 부진할 것으로 추정된다""고 밝혔다. 이어 ""2분기 실적은 전분기 대비 비이자이익은 개선되고 이자이익은 NIM 하락에 따라 감소할 전망""이라고 덧붙였다. 이같은 상황에 주요 금융지주 회장들은 자사주를 대거 매입하며 주가 방어에 나섰다. 우리금융그룹은 14일 손태승 회장이 자사주 5000주를 장내 매수했다고 공시했다. 올해 들어서만 세번째 자사주 매입으로, 보유 주식 규모는 7만8127주로 늘었다. 김정태 하나금융지주 회장도 지난 6일 자사주 5668주를 매입했고 KB금융도 임직원들이 자사주 매입을 계속 하고 있다. 김은갑 IBK투자증권 연구원은 ""은행주의 장점은 높은 배당수익률과 자사주 취득 등 주주친화정책 강화 등으로 은행주 아웃퍼폼(시장수익률 상회) 요인으로 생각해볼 만한 항목""이라며 ""주주친화정책이 여러 은행주에서 순차적으로 진행된다면 업종 투자심리를 전반적으로 호전시킬 수 있을 것""이라고 전망했다.jung9079@news1.kr© 뉴스1코리아(), 무단 전재 및 재배포 금지",/news/news_read.nhn?article_id=0004591042&office_id=421&mode=search&query=KB금융&page=1
,"푸르덴셜생명이 KB금융지주에 매각되는 과정에 예상치 못한 복병이 출현했다. 푸르덴셜생명 설계사들이 회사 매각에 대해 거세게 반발하고 나선 것이다.16일 업계에 따르면 푸르덴셜생명의 일부 설계사들이 KB금융의 인수에 반대하며 시위중이다. 푸르덴셜생명이 죽었다는 의미로 검정색 리본을 단 ‘근조 퍼포먼스’를 벌이고 있다. 보험왕 등으로 받은 상패들도 쌓아놨다.설계사 가운데서도 MDRT(Million Dollar Round Table·백만불 원탁회의) 회원 설계사의 반발이 가장 큰 것으로 전해졌다. MDRT는 1억9600만원 이상의 초회 보험료나 7800만원 이상의 수수료 실적을 올려야 회원으로 들어갈 수 있다. 지난해 한국 MDRT협회 등록 전체 회원 1686명 중 푸르덴셜은 288명으로 3위다.푸르덴셜생명은 재무설계사 조직이 강하고 자부심도 높은 편이다. 전문직·대졸 출신, 장기 근속자가 타 보험사에 비해 많다. 이들은 은행이 중심이 된 KB금융에 인수된 후 KB생명과 통합하면 전속 설계사를 가장 우대하는 기업 분위기가 바뀔 수 있다고 보고 있다. KB금융이 푸르덴셜생명의 인위적 구조조정을 지양하고 푸르덴셜생명의 직원과 재무설계사 등의 역량을 존중한다고 밝혔음에도 감정적인 반발인 셈이다.또 하나는 푸르덴셜생명 본사에 대한 불만이다. KB금융에 높은 가격에 팔릴 수 있었던 데에는 전속설계사들의 지분이 크기 때문에 이에 대한 경제적 보상을 달라는 것이다.KB금융그룹은 총 2조3400억원에 푸르덴셜을 인수했다. 2019년말 자본총계 대비 주가순자산비율(PBR) 0.78배의 가격으로 업계(상장 생보사 PBR 0.2)와 비교할때 높은 수준이다. 하지만 최근 보험사 인수·합병(M&A) 사례를 감안하면 합리적 수준이라는 진단도 나오고 있다. 한희라 기자
- Copyrights ⓒ 헤럴드경제 & heraldbiz.com, 무단 전재 및 재배포 금지 -",/news/news_read.nhn?article_id=0001662746&office_id=016&mode=search&query=KB금융&page=1
,"[머니투데이 한정수 기자] 코로나19(COVID-19) 사태로 국내 증시가 급락한 지 1개월여가 지나면서 대 다수 종목들이 회복세로 돌아섰다. 그러나 지난해 좋은 실적을 내며 전망이 밝았던 은행주들은 아직 만족할 만한 성과를 내지 못하고 있다. 기준금리 인하에 따른 수익성 악화 우려 등이 부정적인 영향을 끼치고 있다는 분석이 나온다. 16일 한국거래소에 따르면 지난 14일 9개 은행주로 구성된 KRX은행지수는 495.87을 기록했다. 올해 초에 비해 약 30% 떨어진 수치다. 지난달 19일 382.02를 기록한 이후에는 상승을 거듭했다. 올해 초 700대까지 올랐던 점을 감안하면 아직 은행주 전반의 상승세가 시장의 기대치에는 미치지 못하고 있다는 평가가 우세하다.4대 금융지주들 주가도 대체로 흡사한 흐름을 보이고 있다. KB금융은 올해 초 4만6550원에서 지난달 19일 2만6050원까지 떨어졌다. 이후 지난 14일 3만3200원까지 상승했다. 신한지주와 하나금융지주, 우리금융지주도 올해 들어 꾸준히 주가가 우하향하다가 코로나19 사태로 주가가 크게 하락했던 지난달 19일에서 23일 사이 최저점을 찍고 소폭 상승하는 모습이다. 지난 1개월간 개인 투자자들이 4대 금융지주 주가 상승을 기대하며 총 5000억원어치를 사들였다. 그러나 외국인 투자자들이 그와 비슷한 물량을 팔아 치우며 주가 상승을 방해했다. 은행주들이 최근 소폭 상승세를 타고는 있지만 장기적인 성장이 이어질지에 대해서는 의문이 남아있는 상황이다. 국내 10개 금융지주사들의 지난해 실적은 2018년에 비해 30% 넘게 늘어났다. 그러나 올해에는 하반기까지 실적 부진이 이어질 가능성이 높다는 전망이다. 코로나19 사태 탓이다. 국제신용평가사인 무디스는 최근 국내 은행업 신용등급 전망을 '부정적'으로 낮춘 바 있다. 실적 부진을 예상하는 대표적인 이유로는 기준금리 인하가 꼽힌다. 전염병의 전세계적 확산으로 경기가 침체하자 시중에 돈을 풀기 위해 한국은행이 기준금리를 인하하면서 금융지주사들을 지탱해주던 이자수익에 구멍이 뚫렸다. 여기에 더해 DLF(파생결합펀드) 대규모 손실 사태 등으로 은행의 고위험 상품 판매에 제한이 걸리면서 수익 감소가 불가피하다. 이와 관련, 김은갑 NH투자증권 연구원은 향후 은행주 실적 전망이 밝지 않다는 점을 강조하며 ""경기 둔화에서 벗어나도 기준금리를 인상하거나 시장 금리가 크게 올라 은행 수익성에 기여할 정도의 변화를 보일지 알 수 없다""고 밝혔다. 이어 ""코로나19 사태 이전에도 이미 저금리 국면이었고 글로벌 금리가 상승할지도 의문""이라며 ""뚜렷한 경기 회복도 만만치 않아 보인다""고 지적했다. 배당금 지급 등 주주 환원정책이 후퇴할 수 있다는 우려도 부정적인 영향을 주고 있다. 앞서 금융감독원은 코로나19 충격에 대응하기 위해 배당금 지급, 자사주 매입 등을 자제할 것을 권고한 바 있다. 높은 배당수익은 은행주 투자의 장점 중 하나인데 만약 주주 환원정책이 나빠진다면 개인 투자자들의 투자심리에 부정적 영향을 줄 수밖에 없다는 설명이다. 한편 현재의 주가 수준이 각종 악재에 대한 우려를 충분히 반영하고 있어 당분간 은행업종이 반등할 수 있을 것이라는 전망도 나온다. 전배승 이베스트투자증권 연구원은 ""은행업종 주가는 수익성 둔화 우려를 충분히 반영하고 있다""며 ""최근의 주가 급락에 신용위험 확대 우려가 선반영 된 데다 추가 금리 인하 여력이 축소됨에 따라 주가 반등 여건이 충족된 것으로 평가된다""고 강조했다. 한정수 기자 jeongsuhan@mt.co.kr
<저작권자 ⓒ '돈이 보이는 리얼타임 뉴스' 머니투데이, 무단전재 및 재배포 금지>",/news/news_read.nhn?article_id=0004395520&office_id=008&mode=search&query=KB금융&page=1
