head,text,url
,"김정태 하나금융지주 회장이 보수에서 5년만에 조정호 메리츠금융지주 회장을 추월했다. 김 회장의 대표이사 회장 취임 후 보수총액은 100억원을 훌쩍 넘어섰다.16일 하나금융지주의 2019년도 사업보고서에 따르면 김 회장의 2019년 보수총액은 24억9700만원이다. 급여가 8억원이고 단기 성과급 4억5000만원, 장기성과급 12억4500만원, 기타 근로소득 230만원 등으로 구성돼 있다. 급여와 단기성과급은 2018년과 동일한 데 비해 장기성과급이 2018년 5억100만원에서 두 배 이상 급증했다. 지난해 하나금융지주가 사상 최대 순이익을 달성한 것이 장기성과에 큰 영향을 미친 것으로 풀이된다.김 회장의 보수총액은 2013년 13억3800만원, 2014년 17억3700만원, 2015년 12억3600만원, 2016년 13억2100만원, 2017년 12억4200만원 등매 3년간(2014~2016, 2015~2017)의 장기성과 평가에 따른 장기성과급 영향이 컸다.김 회장이 보수총액에서 조 회장을 넘어선 것은 2014년 이후 5년만이다.메리츠금융지주 조 회장의 2019년 보수총액은 22억600만원으로 급여가 10억원이고 상여금이 11억7400만원이다. 역시 성과에 따른 상여가
늘어난 영향으로 전년 대비 2억3100만원 늘어났다.윤종규 KB금융지주 회장이 15억9500만원으로 금융지주 대표이사 보수총액 순위 3위를 차지했다. 윤 회장의 보수는 급여 8억원에 상여가 6억3800만원으로 성과급 비중이 상대적으로 떨어진다. 그나마 2017년까지 4억7300만원이던 급여가 2018년부터 오르면서 보수총액이 큰 폭으로 늘어났다.조용병 신한지주 회장의 2019년 보수총액은 12억6000만원으로 급여 8억원에 상여 4억5900만원으로 구성됐다. 우리금융지주 손태승 회장의 보수총액은 7억6200만원으로 BNK금융 김지완 회장(9억1100만원)에 미치지 못했다. NH금융지주 김광수 회장의 보수총액은 5억원을 넘지 않아 공시되지 않았다. 이 외에 DGB금융지주 김태오 회장과 김한 전 JB금융지주 회장이 각각 5억7800만원, 5억1000만원의 보수를 받았다. 김남구 한국투자금융지주 회장의 2019년 보수총액은 5억9174만원이다.김현동기자 citizenk@dt.co.kr 디지털타임스
/",/news/news_read.nhn?article_id=0002593886&office_id=029&mode=search&query=KB금융&page=1
,"KB금융그룹이 푸르덴셜생명보험을 인수하면서 양종희 KB금융지주 보험부문장의 위상 강화가 예상된다. 동시에 은행 중심의 사업 체계에서 보험 등 비은행 부문의 역할을 어떻게 조율할 지도 관심이다.KB금융지주는 지난 10일 푸르덴셜홀딩스(Prudential International Insurance Holdings)와 푸르덴셜생명 지분 100%를 취득하는 주식매매계약(SPA)를 체결했다. 감독당국의 인허가 일정 등을 감안해도 연내 푸르덴셜생명은 연내 KB금융지주의 자회사로 편입될 것이 확실시된다.푸르덴셜생명이 편입되면 KB금융지주의 보험 자회사는 KB생명·KB손해보험에 이어 3개사로 늘어나게 된다. 그룹 이익에서 보험 부문이 차지하는 비중도 푸르덴셜생명 편입 이전에는 7%대 수준에 불과하지만 푸르덴셜생명이 포함되면 비중이 12%(2019년 결산 기준)로 늘어난다. KB국민카드(10%)나 KB증권(8%)에 비해 떨어졌던 보험 부문의 비중이 단번에 비은행 부문 1위로 올라서는 셈이다.특히 KB금융지주가 사업부문제(매트릭스) 체제라는 점을 감안하면 보험부문의 위상이 크게 높아진다. KB금융의 사업부문은 디지털혁신 부문, 자본시장 부문, CIB 부문, 보험 부문, 개인고객 부문, WM 부문, SME 부문 등 7개의 부문으로 나뉘어져 있다. 대부분의 사업부문이 KB국민은행, KB국민카드, KB증권 중심인 데 비해 보험 부문은 KB손해보험, KB생명에 집중된 형태다. 푸르덴셜생명이 자회사로 더해지면 보험 부문장이 관할하는 법인은 3개나 된다.더구나 양 부문장은 2016년 KB손해보험 대표이사에 취임한 이후 5년간 최고경영자(CEO)를 맡아왔다는 점에서 보험 부문에 대한 이해도도 높다. 푸르덴셜생명 인수후통합(PMI) 작업에서도 양 부문의 역할이 절대적일 수 밖에 없다.금융권 관계자는 ""푸르덴셜생명 인수로 KB금융 내에서 보험 부문의 역할이 더 늘어날 것이고, 자연스럽게 양 부문장의 위상도 더 강화될 것""으로 전망했다.김현동기자 citizenk@dt.co.kr 디지털타임스
/",/news/news_read.nhn?article_id=0002593893&office_id=029&mode=search&query=KB금융&page=1
,"KB금융지주가 이사회에 환경·사회책임·기업지배구조(ESG) 위원회를 신설하고 ESG경영 선도 금융그룹이 되기 위한 노력을 하고 있다.16일 KB금융지주에 따르면 KB금융은 환경 보호·사회적 책임 등을 모두 포괄하는 ESG경영을 속도감 있고 지속적으로 추진하기 위해 ‘ESG 위원회’의 신설을 완료했다. ESG위원회는 윤종규 회장을 포함해 사내·외이사 9명으로 구성됐다. ESG위원회는 그룹 ESG 전략과 정책 수립, ESG 추진현황 관리·감독 등 중장기적 관점에서의 그룹 ESG경영에 대한 최고의사결정 역할을 수행할 예정이다.KB금융 관계자는 ""이사회 안에 ‘ESG 위원회’를 신설한 것은 KB금융의 ESG 경영이 단순 구호에 그치는 것이 아니라, 실질적이고 강력한 실천 의지를 가지고 있음을 의미한다""고 했다.KB금융그룹은 다방면으로 환경·사회 부문의 투자를 진행하고 있다. KB금융지주 관계자는 ""대출과 투자 승인 절차에도 ESG적 요인을 평가하고 있다""고 했다. 자체 여신기본강령및 모범규준에 따라 사회공익에 반하는 불건전기업에 대한 여신이나 투자는 엄격하게 제한하고 있다. 마약, 무기류 등 불법행위 등이 대표적이다.친환경 신재생 에너지 분야에도 힘쓰고 있다. KB국민은행은 2007년부터 현재까지 태양광, 풍력, 연료전지 등 다양한 신재생에너지 프로젝트의 금융자문 및 신디케이티드론 주선 역할을 활발히 수행하고 있다.또 미세먼지 문제해결에 동참하고자 적금과 신탁으로 구성된 KB맑은하늘 금융상품 패키지를 출시하기도 했다. KB맑은하늘적금은 종이통장을 미발행하거나, 대중교통 미션을 수행하는 등 고객이 미세먼지 저감 노력을 한 경우 우대이율을 제공하고, 대중교통 및 자전거 상해 관련 보험서비스 혜택을 제공한다.KB금융그룹의 ESG분야에 대한 적극적인 책임 이행 노력은 국내외에서 높게 평가받고 있다. 블룸버그 양성평등지수에 국내 기업으로는 최초로 2년 연속 선정된 바 있다. 또 한국기업지배구조원 ESG 평가 통합 부부문에서 A+등급을 받아,
2년 연속 지배구조 최우수 기업으로 선정됐다.[연지연 기자 actress@chosunbiz.com]	[]	[] 	chosunbiz.com",/news/news_read.nhn?article_id=0000510886&office_id=366&mode=search&query=KB금융&page=1
시총 상위 종목 희비 엇갈려21대 총선 여당 압승에 두산중공업 약세,"[이데일리 유현욱 기자] 16일 코스피 지수는 사실상 보합으로 하루를 마무리했다. 외국인은 지난달 5일부터 30거래일 연속 ‘팔자’ 행진을 이어갔다.마켓포인트에 따르면 코스피 지수는 전 거래일 대비 0.01포인트(0.00%) 내린 1857.07에 장을 마감했다. 이날 코스피지수는 뉴욕증시 하락에 1% 가까이 하락 출발했다. 오후 들어 점차 낙폭을 줄이더니 막판에 상승 전환하는 듯했으나 끝내 보합권에 머물렀다.투자자별로 보면 개인과 기관이 각각 3894억원과 1351억원 순매수했다. 기관 중에는 연기금 등이 2293억원을 사들였지만 금융투자가 1010억원을 팔아치웠다. 외국인은 5670억원 순매도했다. 지난 14일 300억원으로 줄었던 매도 규모도 다시 커졌다. 프로그램은 차익과 비차익을 합쳐 5403억원 매도 우위를 보였다.등락종목은 상승(452종목)이 하락(401종목)보다 다소 우세했다. 48종목은 보합이었다.시가총액 상위종목 역시 희비가 엇갈렸다. 포스코(005490) 신한지주(055550) KB금융(105560)은 3%대, SK하이닉스(000660) 현대모비스(012330)는 1%대 하락했다. 삼성바이오로직스(207940) 셀트리온(068270) 현대차(005380) LG생활건강(051900)도 ‘약세’였다. 삼성전자(005930) 삼성물산(028260)은 보합이었다. 반면 삼성SDI(006400)는 7%대 LG화학(051910)은 5%대 카카오는 3%대 네이버(035420) SK(034730)는 1%대 상승했다.이 밖에 두산솔루스(336370)는 장중 3만6850원으로 기록, 52주 신고가를 갈아치웠으나 조정을 받으면서 종가는 전 거래일과 같았다. 21대 총선에서 여당이 압승함에 따라 탈원전 정책이 한층 힘을 얻을 것이란 전망에 두산중공업(034020)(-8.46%)과 한국전력(015760)(-4.48%)이 부진했다.업종별로 보아도 상승과 하락이 비등했다. 전기가스업이 3% 하락했다. 은행과 보험 업종이 2%대 증권 운수장비가 1%대 내렸다. 반면 비금속광물이 5%대 상승했다. 섬유의복 의료정밀 서비스업 운수창고 업종이 1%대 올랐다.이날 거래량은 8억6439만주, 거래대금은 10조5177만5600만원으로 집계됐다.유현욱 (fourleaf@edaily.co.kr)＜ⓒ종합 경제정보 미디어 이데일리 - 무단전재 & 재배포 금지＞",/news/news_read.nhn?article_id=0004621605&office_id=018&mode=search&query=KB금융&page=1
"외인·기관, 각각 삼성SDI에 212억 원, 237억 원 순매수","[더팩트ㅣ박경현 기자] 16일 국내증시는 경제 위축에 대한 우려로 장 초반 낙폭을 키웠지만 오후 연기금 매수 유입으로 반등에 성공했다. 코스피는 보합권까지 올라왔고 코스닥은 총선 후 정치테마주 급부상에 2%대 상승 마감했다.이날도 코스피 시장에서 외국인은 매도포지션을 유지하며 5695억 원을 순매도한 반면 개인과 기관은 각각 3904억 원, 1355억 원을 순매수했다.외국인의 코스피기업 최대 매도는 SK하이닉스로 향했다. 외국인은 이날 SK하이닉스 893억 원, 삼성전자 534억 원, KB금융 402억 원, 포스코(POSCO) 292억 원, 현대차 257억 원 순으로 순매도 했다.반면 삼성SDI는 212억 원가량 사들였다. 뒤를 이어 LG화학 90억 원, 더존비즈온 74억 원, 삼성전기 71억 원을 순매수했다.코스닥 시장에서는 스튜디오드래곤(175억 원), 씨젠(96억 원), 에치에프알(60억 원)을 사들이고, 에이치엘비(111억 원), 솔브레인(29억 원), 웰크론(28억 원)은 팔았다.이날 기관투자자의 기업 순매도는 KB금융에 쏠렸다. 이날 기관은 은행주를 대량 순매도해 KB금융 126억 원, 하나금융지주 120억 원, 신한지주 60억 원 가량을 팔아치웠다.반면 기관 역시 삼성SDI를 237억 원가량 사들였다. 또한 LG화학 210억 원, 네이버(NAVER) 205억 원, 카카오 165억 원을 순매수했다.이에 이날 시총 상위종목 등락이 양극화됐다. 삼성전자는 이날 보합세로 마친 가운데 SK하이닉스(-1.22%), 삼성바이오로직스(-0.37%), 셀트리온(-0.46%), 현대차(-0.90%), LG생활건강(-0.75%)은 내렸고, 삼성전자우(+0.48%), 네이버(+1.19%), LG화학(+5.05%), 삼성SDI(+7.75%)는 상승하며 장을 마쳤다.pkh@tf.co.kr저작권자 ⓒ 특종에 강한 더팩트 & tf.co.kr 무단 전재 및 재배포 금지",/news/news_read.nhn?article_id=0000023232&office_id=629&mode=search&query=KB금융&page=1
AI기자가 고른 이번 주 화제 리포트,"인공지능(AI) 투자비서 MK라씨로는 바쁜 투자자들을 위해 일주일 동안 발표된 모든 증권사 리포트를 분석했다. 플레이스토어에서 내려받을 수 있는 MK라씨로 애플리케이션에서는 당일 발표된 리포트 중 현재가 대비 높은 목표가를 제시한 리포트만 분석한 정보를 매일 오후 4시에 확인할 수 있다.이번주 국내 25개 증권사에서 약 127개 기업에 대한 리포트가 발행됐다. 증권사들 관심이 집중된 종목은 KB금융, 포스코, 오리온, 고영 등이었다.
KB금융에 대해 현대차증권, 한국투자증권, 미래에셋대우, KTB투자증권, SK증권 등 9곳에서 리포트를 발표했다. 현대차증권이 가장 높은 목표가인 5만2000원을 제시했고, SK증권은 목표가 4만3000원을 제시했다. 김진상 현대차증권 연구원은 ""코로나19 사태로 인한 시장 불안에도 불구하고 이번 인수를 긍정적으로 평가한다""며 ""업계 최고 수준의 푸르덴셜생명 자본비율, 금리 하락 시에도 이차역마진 부담을 채권평가이익 증가로 상쇄, 생명보험 강화로 균형 잡힌 자회사 포트폴리오 완성, 주식 수 희석 없는 인수·합병(M&A)으로 주주 가치 제고 등의 이유 때문""이라고 밝혔다. 이어 ""적극적인 자본 정책과 상대적으로 높은 가계대출 비중(따라서 낮은 신용리스크)은 여전히 KB금융의 강점""이라고 밝혔다. 16일 종가를 기준으로 주가 대비 목표가가 높은 종목은 지트리비앤티, 제일기획, 화승엔터프라이즈, KT, 동양생명 순으로 나타났다.오병용 한양증권 연구원은 지트리비앤티에 대해 ""3월 25일 홈페이지를 통해 미국 비영리단체 'DRIVE'의 코로나19 치료제 후보물질 'EIDD-2801'에 대한 공동 개발을 논의 중에 있다고 발표했다""며 ""'EIDD-2801'은 이미 수많은 해외 언론에서 코로나19 치료제로 소개된 바 있는, 매우 유망한 후보물질로 만약 임상 개발을 진행하게 될 경우 국내 경쟁사들 대비 앞선 파이프라인을 확보하는 셈""이라고 분석했다. 이어 지트리비앤티 목표가를 4만7000원으로 제시했고, 주가는 16일 2만6250원으로 장을 마감했다. 이남수 키움증권 연구원은 제일기획에 대해 ""코로나19로 인해 글로벌 경제 및 기업 경기 악화 등에 따른 영향을 피하기 쉽지 않을 것""이라면서도 ""그룹 계열 물량의 광고가 꾸준히 유입되고 있고 지속적인 디지털 분야 성장이 이뤄지며 상대적으로 탄탄한 모습을 보일 것으로 예상한다""고 밝혔다. [ⓒ 매일경제 & mk.co.kr, 무단전재 및 재배포 금지]",/news/news_read.nhn?article_id=0004558380&office_id=009&mode=search&query=KB금융&page=1
,"외국인 투자자는 16일 거래소에서 SK하이닉스, 삼성전자, KB금융 등을 중점적으로 매도한 것으로 나타났다.외국인 투자자의 순매도 상위 20개 종목은 SK하이닉스, 삼성전자, KB금융, POSCO, 현대차, 한국전력, 삼성바이오로직스, 기아차, 신한지주, KT&G등이다.이중에 금융업 업종에 속한 종목이 4개 포함되어 있다.SK텔레콤, 삼성에스디에스 등은 전일 대비 주가가 상승했고, SK하이닉스, KB금융, POSCO 등은 주가가 하락했다.한경로보뉴스이 기사는 한국경제신문과 금융 AI 전문기업 씽크풀이 공동 개발한 기사 자동생성 알고리즘에 의해 실시간으로 작성된 것입니다.▶ ▶
 ▶
ⓒ 한국경제 & , 무단전재 및 재배포 금지",/news/news_read.nhn?article_id=0004325684&office_id=015&mode=search&query=KB금융&page=1
,"KB금융그룹이 푸르덴셜생명보험을 인수하면서 양종희 KB금융지주 보험부문장의 위상 강화가 예상된다. 동시에 은행 중심의 사업 체계에서 보험 등 비은행 부문의 역할을 어떻게 조율할 지도 관심이다.KB금융지주는 지난 10일 푸르덴셜홀딩스(Prudential International Insurance Holdings)와 푸르덴셜생명 지분 100%를 취득하는 주식매매계약(SPA)를 체결했다. 감독당국의 인허가 일정 등을 감안해도 연내 푸르덴셜생명은 연내 KB금융지주의 자회사로 편입될 것이 확실시된다.푸르덴셜생명이 편입되면 KB금융지주의 보험 자회사는 KB생명·KB손해보험에 이어 3개사로 늘어나게 된다. 그룹 이익에서 보험 부문이 차지하는 비중도 푸르덴셜생명 편입 이전에는 7%대 수준에 불과하지만 푸르덴셜생명이 포함되면 비중이 12%(2019년 결산 기준)로 늘어난다. KB국민카드(10%)나 KB증권(8%)에 비해 떨어졌던 보험 부문의 비중이 단번에 비은행 부문 1위로 올라서는 셈이다.특히 KB금융지주가 사업부문제(매트릭스) 체제라는 점을 감안하면 보험부문의 위상이 크게 높아진다. KB금융의 사업부문은 디지털혁신 부문, 자본시장 부문, CIB 부문, 보험 부문, 개인고객 부문, WM 부문, SME 부문 등 7개의 부문으로 나뉘어져 있다. 대부분의 사업부문이 KB국민은행, KB국민카드, KB증권 중심인 데 비해 보험 부문은 KB손해보험, KB생명에 집중된 형태다. 푸르덴셜생명이 자회사로 더해지면 보험 부문장이 관할하는 법인은 3개나 된다.더구나 양 부문장은 2016년 KB손해보험 대표이사에 취임한 이후 5년간 최고경영자(CEO)를 맡아왔다는 점에서 보험 부문에 대한 이해도도 높다. 푸르덴셜생명 인수후통합(PMI) 작업에서도 양 부문의 역할이 절대적일 수 밖에 없다.금융권 관계자는 ""푸르덴셜생명 인수로 KB금융 내에서 보험 부문의 역할이 더 늘어날 것이고, 자연스럽게 양 부문장의 위상도 더 강화될 것""으로 전망했다. 김현동기자 citizenk@dt.co.kr 디지털타임스
/",/news/news_read.nhn?article_id=0002593973&office_id=029&mode=search&query=KB금융&page=1
금융회사 임원보수금융지주,"김정태 하나금융지주 회장이 보수에서 5년만에 조정호 메리츠금융지주 회장을 추월했다. 김 회장의 대표이사 회장 취임 후 보수총액은 100억원을 훌쩍 넘어섰다.16일 하나금융지주의 2019년도 사업보고서에 따르면 김 회장의 2019년 보수총액은 24억9700만원이다. 급여가 8억원이고 단기 성과급 4억5000만원, 장기성과급 12억4500만원, 기타 근로소득 230만원 등으로 구성돼 있다. 급여와 단기성과급은 2018년과 동일한 데 비해 장기성과급이 2018년 5억100만원에서 두 배 이상 급증했다. 지난해 하나금융지주가 사상 최대 순이익을 달성한 것이 장기성과에 큰 영향을 미친 것으로 풀이된다.김 회장의 보수총액은 2013년 13억3800만원, 2014년 17억3700만원, 2015년 12억3600만원, 2016년 13억2100만원, 2017년 12억4200만원 등매 3년간(2014~2016, 2015~2017)의 장기성과 평가에 따른 장기성과급 영향이 컸다. 김 회장이 보수총액에서 조 회장을 넘어선 것은 2014년 이후 5년만이다.메리츠금융지주 조 회장의 2019년 보수총액은 22억600만원으로 급여가 10억원이고 상여금이 11억7400만원이다. 역시 성과에 따른 상여가
늘어난 영향으로 전년 대비 2억3100만원 늘어났다.윤종규 KB금융지주 회장이 15억9500만원으로 금융지주 대표이사 보수총액 순위 3위를 차지했다. 윤 회장의 보수는 급여 8억원에 상여가 6억3800만원으로 성과급 비중이 상대적으로 떨어진다. 그나마 2017년까지 4억7300만원이던 급여가 2018년부터 오르면서 보수총액이 큰 폭으로 늘어났다.조용병 신한지주 회장의 2019년 보수총액은 12억6000만원으로 급여 8억원에 상여 4억5900만원으로 구성됐다. 우리금융지주 손태승 회장의 보수총액은 7억6200만원으로 BNK금융 김지완 회장(9억1100만원)에 미치지 못했다. NH금융지주 김광수 회장의 보수총액은 5억원을 넘지 않아 공시되지 않았다. 이 외에 DGB금융지주 김태오 회장과 김한 전 JB금융지주 회장이 각각 5억7800만원, 5억1000만원의 보수를 받았다. 김남구 한국투자금융지주 회장의 2019년 보수총액은 5억9174만원이다.김현동기자 citizenk@dt.co.kr




















































































































































































































































































































































 디지털타임스
/",/news/news_read.nhn?article_id=0002593972&office_id=029&mode=search&query=KB금융&page=1
