title,url,press,summary,date
"이재용의 사과, 남겨진 5가지 물음",/news/news_read.nhn?article_id=0003009384&office_id=032&mode=search&query=삼성물산&page=1,경향신문,"하지만 이런 ‘헐값’에도 불구하고 에버랜드 주주였던 이건희 회장을 비롯한 삼성전자와 삼성물산, 중앙일보 등은 모두 이 헐값의 전환사채를 ‘포기’...",2020-05-17 13:18
5~6월 '3조7000억' 자존심 건 건설사 수주 전 본격,/news/news_read.nhn?article_id=0004425756&office_id=014&mode=search&query=삼성물산&page=1,파이낸셜뉴스,반포 주공1단지 3주구는 5년만에 정비사업에 복귀한 삼성물산과 대우건설이 총력을 기울이고 있는 사업지다. 반포3주구는 서초구 1109일대 149...,2020-05-17 13:51
[분양현장 NOW] 단지내 `미니 에버랜드`…인천 새 대표아파트,/news/news_read.nhn?article_id=0004576472&office_id=009&mode=search&query=삼성물산&page=1,매일경제,"삼성물산 리조트부문과 공동으로 국내 아파트 최초로 '미니 에버랜드'를 조성한다. 여기에는 55m 규모 유수풀, 스파를 갖춘 워터파크가 들어간다....",2020-05-17 17:21
5~6월 정비사업 3조7000억… 건설사 운명 건 수주전 펼친다,/news/news_read.nhn?article_id=0004425893&office_id=014&mode=search&query=삼성물산&page=1,파이낸셜뉴스,반포 주공1단지 3주구는 5년만에 정비사업에 복귀한 삼성물산과 대우건설이 총력을 기울이고 있는 사업지다. 반포3주구는 서초구 1109일대 149...,2020-05-17 17:26
"[시그널] MBK, ‘아픈 손가락’ 네파 매각 시간 3년 벌었다",/news/news_read.nhn?article_id=0003738559&office_id=011&mode=search&query=삼성물산&page=1,서울경제,국내 아웃도어 시장에 브랜드가 난립하면서 삼성물산이나 LF 등 대기업도 지난 5년간 이 시장에서 철수하는 상황이다. 여기에 신종 코로나바이러스 ...,2020-05-17 21:05
