head,text,url
,"LG화학은 폴란드 브로츠와프에 위치한 전기자동차용 배터리 공장 증설을 위해 주변에 있는 가전 공장을 인수하기로 결정했다고 3일 밝혔다. LG화학이 매입하는 곳은 터키 가전업체인 베스텔의 조립 공장이다. 터키 언론 등에 따르면 베스텔의 폴란드 공장 터는 약 22만 m² 크기다.
LG화학은 공장 인수 절차를 마무리한 뒤 추가 투자를 통해 TV 등 가전제품 조립 설비를 모두 배터리 생산 라인으로 바꿀 예정이다. 현재 가동 중인 폴란드 공장 배터리 생산 능력은 전기차 25만 대 분량인 15GWh다. LG화학은 올해 말까지 이 생산량을 4배 이상으로 확대한다는 계획을 갖고 있다. 지민구 기자 warum@donga.com ⓒ 동아일보 & donga.com, 무단 전재 및 재배포 금지",/news/news_read.nhn?article_id=0003273263&office_id=020&mode=search&query=LG화학&page=3
,"1989년에 코스피가 처음 1000을 넘었다. 지금이 2000 정도니까 31년 사이에 주가가 두 배가 된 셈이다. 같은 기간 다우지수는 2400에서 최고 3만에 육박하는 수준까지 올랐다. 시장 내부에서도 변화가 있었다. 1989년에 삼성전자 주가는 600원 내외였다. 최고 높은 때 6만3000원 가까이 됐으니까 100배 넘게 오른 셈이 된다. 삼성전자가 100배 오르는 사이 코스피가 두 배밖에 안 됐으니 다른 종목들이 얼마나 수난을 겪었을지 알 수 있다. 주식은 채권, 부동산, 예금 등 가격이 붙어 있는 다른 자산에 비해서도 수익률이 낮다. 다시 한 번 1989년으로 돌아가 주식과 채권, 서울지역 아파트에 1000만원씩을 투자했다고 가정해 보자. 지금 그 돈은 각각 2150만원과 7230만원, 5760만원으로 불어나 있을 것이다. 주식에 최대한 유리하도록 채권은 A등급 회사채의 이자만을 계산하고, 서울지역 아파트는 상승률이 낮은 부동산 지수를 썼음에도 결과가 그랬다. 어떤 기준으로 적용하더라도 주식이 오랜 시간 낮은 수익에 그쳤다는 사실은 바뀌지 않는다. 왜 이런 일이 벌어졌을까.미국 기업을 연구한 보고서를 보면 미국도 오랜 시간 성장하면서 시장 규모 확대에 기여한 기업은 전체의 5%밖에 되지 않았다고 한다. 나머지는 중간에 없어지거나 가격이 떨어져 시가총액을 오히려 까먹었다. 결국 5% 내외 기업의 높은 수익성이 시장을 탄탄하게 만들고 미래 시장 규모를 키우는 역할을 했다고 볼 수밖에 없다. 지난 10년간 미국시장에서는 애플과 아마존, 마이크로소프트 등이 그 역할을 했다. 그 덕분에 나스닥 지수가 한때 2000년 IT 버블 때의 두 배가 됐다. 우리 시장에서는 삼성전자만이 그 역할을 했다.
 지금 우리시장의 버팀목은 두 개다. 하나는 반도체. 전체 시가총액의 30%를 차지하고 있다. 다른 하나는 포스코를 비롯해 현대차, LG전자, 한국조선해양 같은 대형 제조업체. 이중 대형제조업체는 일정 수준의 이익만을 유지할 뿐 별다른 성장을 보이지 못하고 있다. 그 때문에 주가가 과거 최고치의 절반 수준에 그치고 있다. 여기에 LG화학 등 새롭게 투자를 했지만 아직 성과를 내지 못하고 있는 기업까지 포함하면 우리 기업 중에서 5% 내에 들어갈 곳은 많지 않다. 지금으로서는 반도체가 유일하다고 얘기해도 과언이 아니다. 사정이 이렇다 보니 성장이 기대되는 기업이 과거 성장 기업을 밀어내는 현상도 나타나지 않고 있다. 10여 년 전에 중국 특수를 기반으로 화장품을 비롯한 소비재 업체가 부상한 적이 있지만 지금은 존재가 미미하다. 이후 바이오가 올라섰지만 기업 내용이 시장의 기대에 못 미쳐 몇몇만이 성장 기업으로 남았다. 시장이 지지부진한 상태를 벗어나지 못하는 이유 중 하나다.종합주가지수가 처음 발표되고 45년이 지났다. 기간 중 고점이 계속 높아지는 대세 상승은 11년 4개월로 전체 기간의 4분의 1밖에 되지 않는다. 나머지 4분의 3은 주가가 떨어지거나 떨어졌다 회복하거나 횡보하는 형태였다. 주가가 크게 상승했던 때는 대부분 새로운 산업이 나와 우리 경제의 성장성을 높여 주던 때다. 1970년대 중반에 건설업이 그랬고 1980년대 중반에는 중화학 공업이 그 역할을 했다. 5%에 들어갈 가능성이 있는 기업이 다수 만들어지던 시기였다. 지금은 5% 내에 들어갈 수 있는 기업을 찾기 힘들다. 과거에는 우리 경제의 규모가 작아 국내시장만 차지해도 그 기준을 어느 정도 충족할 수 있었는데 지금은 세계적인 경쟁력을 갖춰야 한다. 영속성과 성장성을 동시에 갖춘 기업을 찾기 힘든 게 우리 시장이 힘을 쓰지 못하는 이유다.




 2000년 IT 버블 당시 나스닥 시장의 최고 회사는 시스코시스템즈였다. 네트워킹 하드웨어, 보안 서비스를 제공하는 미국의 다국적 기업으로 인터넷을 연결하기 위해 꼭 있어야 하는 기업이다. 지금은 그 자리를 애플과 아마존 등이 차지하고 있다. 이런 변화가 있어야만 경제도 시장도 발전할 수 있다.권소현 (juddie@edaily.co.kr)＜ⓒ종합 경제정보 미디어 이데일리 - 무단전재 & 재배포 금지＞",/news/news_read.nhn?article_id=0004589300&office_id=018&mode=search&query=LG화학&page=3
,"[서울신문]국내 전기차 배터리 3사가 세계 시장 점유율 30%를 돌파하며 승승장구하고 있다. LG화학과 SK이노베이션의 치열한 소송전과 수주 신경전이 국내 기업의 성장으로 이어진 게 아니냐는 분석이 나온다.3일 에너지전문 시장조사업체 SNE리서치에 따르면 LG화학은 지난 1월 세계 전기차 배터리 시장 점유율 2위(22.9%)에 올랐다. 국내 기업이 중국의 CATL(21.8%)을 제친 건 처음이다. 1위인 일본 파나소닉(27.6%)과의 격차도 4.7% 포인트로 좁혀졌다. 삼성SDI는 4위(5.1%)로 올라섰고 SK이노베이션도 10위권 밖에서 7위(2.8%)로 뛰어올랐다. 3사의 합산 점유율은 30.8%다.LG화학과 SK이노베이션은 그동안 소송전과 별도로 치열한 장외전을 벌여 왔다. LG화학은 이날 폴란드 전기차 배터리 공장을 증설하기 위해 현지에 있는 터키의 가전제품 조립 공장을 3140만 달러(약 374억원)에 인수한다고 밝혔다.이에 맞서 SK이노베이션은 현대차의 순수전기차 전용 플랫폼 ‘E-GMP’에 탑재될 배터리 50만대(10조원 규모) 물량을 수주했다. 현대차가 개발하는 개인비행체(PAV)의 배터리 공급사 자리도 노린다.양측의 소송전은 아직 끝나지 않았다. 지난달 14일 미국 국제무역위원회(ITC)로부터 조기 패소 판결을 받은 SK이노베이션은 이의를 제기한다. 이의제기 수용 여부는 다음달 중순쯤 판가름난다.이영준 기자 the@seoul.co.kr▶
▶
▶ⓒ 서울신문(www.seoul.co.kr), 무단전재 및 재배포금지",/news/news_read.nhn?article_id=0003070583&office_id=081&mode=search&query=LG화학&page=3
불황에 ‘선택과 집중’ 나선 화학업계,"LG화학, 롯데케미칼, 한화솔루션 등 주요 화학업체가 불황을 극복하기 위해 수익성이 낮은 비(非)핵심 사업 정리에 들어갔다. 업황 부진에 코로나 바이러스(코로나19)까지 겹쳐 실적이 나빠지자, 군살 빼기에 나선 것이다. 비핵심 사업은 과감하게 접고 성장성이 높은 사업에 주력해 경쟁력을 강화한다는 계획이다.LG화학은 액정표시장치(LCD) 사업을 정리하고 전기차 배터리를 중심으로 사업 구조 재편에 나섰다. LG화학은 지난달 LCD 유리기판 사업에서 철수하고, 중국에 LCD 컬러필터 감광재 사업을 매각했다. 중국의 저가 LCD 공세로 수익성이 나빠지자, LCD 사업에서 손을 떼기로 한 것이다. 이에 LG는 그룹 차원에서 ‘탈(脫)LCD’를 추진하고 유기발광다이오드(OLED)로 사업을 전환하고 있다.은 유리기판 사업 매각을 추진했지만, 개별 협상을 진행한 미국 코닝과 합의점을 찾지 못해 결국 지난달 사업 철수를 결정했다. 감광재 사업은 지난달 26일 중국 요케테크놀로지의 자회사인 시양인터내셔널에 580억원에 넘겼다. LG화학 관계자는 ""감광재 사업 매각 금액은 배터리 부문에 투자할 것""이라고 말했다.LG화학은 배터리 사업을 미래 성장 동력으로 꼽고 공격적인 투자에 나서고 있다. 지난해 LG화학은 배터리 부문에서 3조8000억원의 시설 투자를 집행했으며 올해는 3조원 정도 투입할 예정이다. 최근에는 LG화학의 유럽 전기차 시장의 전진기지인 폴란드 공장 증설을 위해 인근 가전 공장도 약 374억원에 인수했다.지난해 실적 부진을 겪은 롯데케미칼도 체질개선에 속도를 내고 있다. 롯데케미칼은 2030년까지 매출 50조원·세계 7위 화학사 진입이라는 중장기 목표 ‘비전 2030’을 내걸고 신규사업을 키우고 비핵심 사업은 정리하겠다고 선포했다.은 지난해 영국 소재 폴리에틸렌 테레프탈레이트(PET) 생산 판매 자회사 매각을 시작으로 비핵심 사업 구조조정에 돌입했다. 올해 1월에는 사업 효율화와 고도화를 목표로 소재 자회사인 롯데첨단소재를 흡수합병했다. 고부가 소재 분야 기술을 보유한 롯데첨단소재 합병으로 화학 분야 경쟁력을 높인다는 계획이다.신사업으로 모빌리티(운송) 분야도 눈여겨보는 중이다. 롯데케미칼은 지난달 실적발표 후 진행한 컨퍼런스콜에서 ""현대차를 포함한 글로벌 완성차 OEM과의 협업을 가속화해 모빌리티 사업을 적극 육성하겠다""고 밝혔다.한화케미칼도 한화큐셀앤드첨단소재를 합병하고 올해 초 한화솔루션으로 통합법인의 사명을 변경했다. 석유화학 업황 부진이 지속되자 첨단소재와 태양광으로 사업 포트폴리오를 다변화한 것이다. 집중 육성하고 있는 태양광 사업에서도 수년째 적자를 기록한 폴리실리콘 사업은 중단한다. 태양광 모듈의 원재료인 폴리실리콘은 중국의 저가 물량 공세로 가격이 손익분기점 아래로 떨어지면서 팔면 팔수록 손실이 커졌기 때문이다. 한화솔루션 측은 ""고부가가치 태양광 셀과 모듈 생산에 집중하겠다""고 했다.한편, 업계는 지난해 시작된 석유화학 다운사이클(하락국면)이 적어도 내년까지 지속될 것으로 보고 석유화학 공장 가동률을 낮추는 방식으로 대응하고 있다. 지난해 미·중 무역분쟁과 글로벌 공급 과잉으로 주요 석유화학 업체들의 영업이익이 전년 대비 30~60%씩 감소했는데 올해는 코로나 바이러스의 영향으로 중국 수요가 위축되면서 업황이 회복될 기미를 보이지 않고 있다.황규원 유안타증권 연구원은 ""코로나 바이러스의 영향으로 한국산 석유화학 제품을 중국으로 수출하지 못하면서 재고가 쌓이고 있다""며 ""재고 과잉 현상이 해소되려면 최소 5월까지 생산량을 줄여야 한다""고 말했다.[이재은 기자 jaeeunlee@chosunbiz.com]	[]	[]	[] 	chosunbiz.com",/news/news_read.nhn?article_id=0000481852&office_id=366&mode=search&query=LG화학&page=3
감염병 대유행의 경제학,"A : 지난달 초 현대자동차는 중국에서 코로나19가 확산되면서 생산 중단에 들어갔다. '와이어링 하니스'라는 부품 공급에 차질이 빚어졌기 때문이다. 자동차 한 대에는 2만여 개의 부품이 조립되어 만들어진다. 2만여 개 부품 가운데 단 하나의 부품이라도 제대로 공급되지 않으면 공장 전체가 멈춰 설 수밖에 없다. '와이어링 하니스'는 차체 내부에 들어가는 배선 뭉치로 자동차 전원을 공급하고 전기 신호를 각 전자제어 모듈에 전달해주는 역할을 한다. 국내에서 경신, 유라코퍼레이션 등과 같은 협력업체에서 현대차에 이 부품을 조달하고 있는데, 이들 협력업체는 국내뿐만 아니라 중국 등 해외에서 부품을 조달받고 있다. 이번에 와이어링 하니스의 생산이 특히 중국 공장(생산의 80%)에 몰리게 되면서 이 같은 상황이 벌어지게 된 것이다. 중국은 후베이성 이외에 14개 지역을 봉쇄 조치했는데, 국내 협력업체의 중국 공장이 많은 산둥성도 봉쇄되면서 작업에 차질을 빚게 된 것이다.
 A : 국내외 전문가들은 이번 코로나19는 2003년 발생한 사스보다 중국 및 세계 경제에 미치는 파급 영향이 더 클 것으로 예상하고 있다. 그동안 중국 경제 규모가 커지고 세계 경제에서 차지하는 비중이 높아졌기 때문이다. 현대경제연구원에 따르면 세계 GDP에서 중국 GDP가 차지하는 비중이 2003년 4.3%에서 2019년 16.3%로 확대됐다. KIEP는 중국의 세계 수출 또한 2002년 3256억달러에서 2018년 2조4885억달러로 확대됐다고 설명했다. 하이투자증권은 ""2003년 사스 당시 중국 경제는 일시적으로 충격을 받았지만 당시 중국 경제는 고정투자 붐(Boom) 사이클 초기 국면이어서 충격을 자생적으로 극복할 수 있는 경제적 완충력을 보유하고 있었다""면서 ""하지만 이번에는 중국이 미·중 무역갈등 충격에 이어 또 다른 대규모 경제적 충격을 받고 있다는 점에서 경제의 자생 능력만으로 충격을 쉽게 벗어나 빠른 반등을 하기는 쉽지 않은 상황""이라고 말했다.A : 현대차는 이번 긴급 상황에 대해 국내와 동남아시아 등에서 부품 조달을 확대하고, 협력업체의 중국 공장이 재가동됐을 때 부품 조달 소요 기간을 최소화해 이에 대응하겠다고 밝혔다. 하지만 이같이 갑작스러운 부품 공급 중단 상황이 발생하면 단기적으로 대응하기가 쉽지 않다. 기업은 비용을 절감하기 위해 필요할 때마다 부품을 공급하는 시스템을 운용하고 있다. 와이어링 하니스 재고를 쌓아놓을수록 보관비용 부담이 커지기 때문에 최소한의 부품만 보유하는 것이 일반적이다. 와이어링 하니스를 국내 생산으로 전환하기도 쉽지 않다. 이 제품이 특별한 제조기술이 필요한 첨단 부품은 아니지만 엄청난 수량의 전선을 차체 내부의 구조에 따라 묶고 구부려 고정해야 한다. 따라서 자동화에 한계가 있고, 복잡한 수작업이 필요하다. 인건비가 싸고 운송 거리가 멀지 않은 중국으로 생산공장을 대거 이전한 이유이기도 하다.A : 가치사슬(Value Chain)이란 마이클 포터(Michael E Porter) 하버드대 교수가 주창한 개념으로 기업이 원재료를 구매한 후 가공·판매해 부가가치를 창출하는 일련의 과정을 의미합니다. 가치사슬 활동은 한 기업 내에서 이뤄지기도 하지만 대부분 외부 업체와의 분업으로 이뤄진다. 이는 대내외적 환경이나 산업 특성 등에 따라 특정 활동이 경쟁우위 확보에 보다 결정적인 역할을 할 수 있기 때문이다. 가치사슬을 기업 외부로 확장함으로써 기업 내부의 자원을 핵심 활동에 집중할 수 있게 된다. 세계화가 급속히 진행되면서 기업의 가치사슬이 해외로 확장되는 글로벌 가치사슬이 형성됐다. 초기의 글로벌 가치사슬은 운송수단 및 정보통신기술의 발달, 각국의 수입관세 인하, 신흥개도국의 저렴한 노동임금 등의 영향을 받아 생산 및 운송비용 절감을 통해 경쟁우위를 창출할 수 있는 방식으로 구축됐다. 이 과정에서 중국은 글로벌 가치사슬의 중추적인 역할을 담당할 수 있었다.■
 A : 현재 글로벌 기업들은 본국에서 디자인, 설계, 연구개발, 마케팅, 판매 등 고부가가치 창출 활동을 수행하고, 중간재 부품 조달, 제품 조립 및 생산 등의 제조 관련 활동을 저임금 노동력이 풍부한 신흥개도국에 맡기는 방식으로 글로벌 가치사슬을 구축하고 있다. 특히 '메인드 인 차이나(made in china)' 상표가 부착된 글로벌 기업의 상품들이 전 세계로 유통되는 모습을 쉽게 발견할 수 있는 것은 상대적으로 숙련된 노동력과 저임금을 무기로 하는 중국이 전 세계 제조기업의 공장 역할을 수행하기 때문이다. 중국은 2002년 세계무역기구(WTO) 가입을 시작으로 경제개방을 본격화하면서 글로벌 가치사슬에서 중추적인 역할을 맡았다.
 A : 세계 경제는 최근 두 달 동안 큰 충격을 받았다. 코로나19의 유행으로 미국 애플은 중국 내 아이폰 생산 공장과 매장을 폐쇄했으며, 국내 최대 완성차 제조기업인 현대차도 중국에서 생산되는 부품 공급이 끊겨 모든 차종의 생산을 중단했다. 중국 내 금호석유화학, LG화학, SK이노베이션의 배터리 공장도 가동률을 낮추면서 물류 공급의 차질을 우려하고 있다. 이번 코로나19 유행으로 글로벌 가치사슬의 취약성이 확인되면서 글로벌 가치사슬 구조가 재편될 가능성이 크다. 특히 한국은 지리적·경제적인 이유로 중국에 대한 의존도가 높아 이러한 위험에 대한 대비가 반드시 필요하다. 이미 일본은 2011년 일본 대지진과 태국 홍수 등의 자연재해로 공급사슬(가치사슬 내 공급·조달·물류 등의 활동을 이르는 개념)의 취약성에 직면한 후 리스크 관리형 공급사슬을 구축하기 위해 노력한 끝에 생산라인 및 부품 조달망 다각화를 이뤘다. 한국도 국내 산업의 구조와 특성을 정확하게 파악하고, 개선책 마련에 대한 고민이 필요한 시점이다. ▶
 우한은 중국 후베이성의 성도로, 중국 대륙의 정중앙에 위치한 지리적 중요성으로 인해 '중국의 배꼽'이라고 불린다. 1978년 중국의 개혁개방으로 발전이 빨랐던 연해도시에 비해 상대적으로 경제 개발이 늦었지만 2000년대 이후 중국의 중부지역 개발정책에 따라 최근 빠른 경제성장을 이루고 있다. 최근 들어 중국 내륙의 '경제 1번지'로서 위상이 높아지고 있다. 중국의 정중앙에 위치한 지리적 이점으로 우한~광저우 고속철도가 개통(2009년 12월)됐고, 양쯔강을 따라 5000t급 선박이 운항된다. 우한은 내륙도시임에도 불구하고 고속도로, 기존 철도, 항공 등 다양한 교통수단이 발달돼 있다. 최근에는 경제적으로도 주목을 받고 있다. 중국 반도체와 바이오산업의 중심지로 성장하고 있다. 우한시는 300여 개 제약바이오 연구개발(R&D) 센터 및 기업이 자리해 중국의 바이오산업 전진 기지로 급부상하고 있다. 또한 우한에서는 석유화학 심층 가공 및 친환경 산업 클러스터 구축, 디지털 공작기계와 로봇 등 스마트 제조업 기지 건설, 자동차 R&D센터 등 다양한 산업을 육성하고 있다.[박기효 기자 / 이인혜 경제경영연구소 연구원 / 황서율 인턴 기자] [ⓒ 매일경제 & mk.co.kr, 무단전재 및 재배포 금지]",/news/news_read.nhn?article_id=0004529414&office_id=009&mode=search&query=LG화학&page=3
공장 내 나프타 분해시설 설비 이상으로 폭발 추정26여 명 다쳐 병원으로 이송…화재 진압 대응땀,"충남 서산시 대산읍 롯데케미칼 대산공장에서 폭발사고가 발생해 약 20여 명이 부상을 입고 병원으로 이송됐다.4일 충남소방본부와 롯데케미칼에 따르면 이날 새벽 3시께 충남 서산시 대산읍에 위치한 롯데케미칼 대산공장에서 폭발사고가 일어났다.폭발사고로 약 26여명이 다쳐 병원으로 이송됐으며, 화재 원인은 공장 나프타 분해시설 NCC설비 일부가 폭발하면서 일어난 것으로 확인된다.소방당국 관계자는 “NCC 설비 일부에서 공정 이상이 발생해 폭발이 일어난 것으로 보고 있다”며 “현재 화재 초기 진압 단계로 정확한 원인은 조사 중에 있다”고 밝혔다.소방당국은 대응 2단계를 발령하고 인력 250여 명과 차량 30대를 동원해 진화작업을 벌이고 있다.화재 발생에 따라 현장에는 오염 물질이 배출되고 있다. 공장을 중심으로 이산화탄소 배출량이 많아졌다는 게 소방당국의 설명이다.롯데케미칼 화학 공장 주변에는 LG화학과 한화, 현대정유 등 화학 업체가 밀집해 화재가 확산될 경우 추가 피해가 우려된다. 아직까지는 인근 공장으로 불이 번진 사례가 나타나지 않은 것으로 확인된다.롯데케미칼 관계자는 ""사고 소식 직후 비상대책반을 가동해 수습에 나서고 있다“며 ”임병연 대표이사를 비롯해 관련 임직원이 출근해 현재 사고 원인을 파악 중""이라고 말했다.데일리안 박유진 기자 (rorisang@dailian.co.kr)ⓒ (주)데일리안 - 무단전재, 변형, 무단배포 금지",/news/news_read.nhn?article_id=0002386644&office_id=119&mode=search&query=LG화학&page=3
,"[서울=뉴시스] 김제이 기자 = 4일 오전 빅데이터로 분석한 주식시장 코스피 200종목의 시장심리지수(Market Sentiment Index·MSI)는 2단계 '나쁨'으로 나타났다.뉴시스와 코스콤이 공동으로 뽑아낸 빅데이터 MSI(http://m.newsis.com/stock.html, 모바일 전용)에 따르면 전 거래일 오후 4시부터 이날 오전 8시까지 집계된 코스피 MSI 레벨은 2단계로 전 거래일 대비 한 단계 내렸다.대장주 삼성전자의 MSI 레벨은 3단계로 집계됐다. 시가총액 상위 종목 중 SK하이닉스는 5단계, LG화학 5단계, 현대차 3단계, 셀트리온 2단계 등을 나타냈다.뉴시스와 코스콤은 250개 주요 상장 기업에 대해 감성 사전을 만들어 해당 종목의 실시간 점수를 산출하고 이를 최근 1년간의 흐름과 비교해 MSI 레벨로 제시하고 있다.MSI는 총 7단계로 나뉜다. 1단계 '매우 나쁨', 2단계 '나쁨', 3단계 '약간 나쁨', 4단계 '보통', 5단계 '약간 좋음', 6단계 '좋음', 7단계 '매우 좋음' 등으로 분류된다.MSI 레벨이 가장 낮은 수준인 1단계에서 가장 높은 수준인 7단계 쪽으로 바뀌면 해당 종목에 대해 온라인상에서의 반응이 부정에서 긍정으로 바뀌고 있다는 뜻으로 풀이할 수 있다.한편 2017년 8월1일부터 선보인 빅데이터 MSI 모바일 전용 버전은 구글플레이 또는 애플 앱스토어에서 '뉴시스' 앱을 내려받거나 뉴시스 모바일 홈페이지(m.newsis.com)에 접속한 뒤 메인화면의 '빅데이터 MSI'를 클릭해 이용하면 된다.※ 빅데이터MSI는 투자 참고용이며, 투자 결과에 책임을 지지 않습니다. 주식시장에서는 다양한 국내외 변수가 존재하기 때문에 한 지표로만 판단하면 뜻하지 않은 결과를 초래할 수 있습니다. jey@newsis.com<ⓒ 공감언론 뉴시스통신사. 무단전재-재배포 금지>",/news/news_read.nhn?article_id=0009736261&office_id=003&mode=search&query=LG화학&page=3
