head,text,url
,"코스피가 기관과 개인의 매수세에 상승 마감했다. 18일 코스피는 전일 대비 9.83포인트(0.51%) 오른 1937.11에 거래를 마쳤다. 이날 코스피는 장 초반 상승과 하락을 오가다 오전 11시 이후부터 상승 쪽으로 방향을 잡았다. 특히 기관·개인이 각각 300억원 내외를 순매수하고 외국인의 순매도 금액도 800억원대에 불과할 정도로 관망 심리가 깔린 가운데, 기타법인이 289억원어치 주식을 사면서 지수가 상승세를 탔다. 지난 주말 마감된 뉴욕증시는 미중 무역 갈등이 다시 격화될 가능성이 부상하는 악재에 더해 주요 경제 지표가 악화돼 하락세를 보이다 장 후반으로 가면서 코로나19 극복 이후에 대한 기대감이 살아나면서 소폭 상승 마감했다. 미 상무부는 4월 소매판매가 전월 대비 16.4% 감소했다고 발표했다. 관련 통계가 집계된 이후 최대 폭 감소다. 의류 판매점 판매가 78.8% 감소하는 등 코로나19로 인한 봉쇄 조치의 충격파가 고스란히 드러났다.연방준비제도(Fed·연준)가 발표한 4월 산업생산도 11.2% 급감했다. 연준은 관련 통계가 집계된 이후 101년 역사상 가장 큰 월간 낙폭이라고 밝혔다. 시장의 예상 11.1% 감소보다도 소폭 부진했다.미국과 중국의 갈등 심화도 이어졌다. 미국 상무부는 중국 화웨이가 미국 기술로 제작된 반도체를 공급받지 못하도록 관련 규제를 강화한다고 밝혔다. 외국 기업이라도 미국의 장비 등을 활용해 반도체를 생산하는 경우 화웨이에 특정 제품을 판매하기 위해서는 미국 당국의 허가를 받도록 한 조치다.이에 중국은 즉각 반발했다. 중국 관영언론 글로벌타임스의 후시진 편집장은 자산의 트위터를 통해 ""미국이 화웨이에 대한 기술 공급을 추가로 막을 경우 중국은 '신뢰할 수 없는 실체 명단'을 활성화할 것""이라고 말했다.서상영 키움증권 연구원은 ""(이번주) 한국 증시는 중국 양회 개막과 파월 의장의 발언, 미국 기업들의 실적 발표 등에 따라 등락할 것""이라며 ""특히 전인대 개막식에서 리커창 총리가 코로나 이후 중국 경제에 대한 전망과 그 치유책을 위한 대규모 인프라 투자 발표가 있는지 주목할 필요가 있다""고 말했다. 중국 양회는 오는 21일 개막하며 전인대 개막식은 양회 개막 다음날인 22일이다. 리 총리가 전인대 개막식 연설에서 제시할 올해 중국의 GDP 성장률 목표치에 시장의 관심이 쏠리고 있다. 다만 일각에서는 성장률 목표치가 발표되지 않을 것이라는 분석도 나온다. 파월 의장은 18일(현지시간) 미 상원 금융위원회의 온라인 청문회에 참석해 지난 3월말 발표된 약 2조달러 규모의 코로나19 대응 정책의 필요성에 대해 답한다. 이날 코스피에서 주요 업종은 혼조세였다. 비금속광물, 전기·전자, 증권 등은 1% 이상 올랐지만, 종이·목재, 전기가스업, 은행, 섬유·의복, 의약품 등은 크게 하락했다. 투자주체 별로는 기관과 개인이 각각 341억원어치와 302억원어치 주식을 산 가운데, 외국인은 863억원어치 주식을 팔았다. 프로그램 매매는 1336억원 매도 우위였다. 시가총액 상위 종목들도 혼조세였다. 삼성SDI, LG화학, 삼성전자 등은 올랐다. 반면 LG생활건강, 엔씨소프트, 셀트리온, 삼성바이오로직스 등은 내렸다. 이날 코스피에서는 423개 종목이 오르고 424개 종목이 내리는 중이다. 코스닥은 전일 대비 1.08포인트(0.16%) 내린 690.88로 마감됐다. [디지털뉴스국 한경우 기자] [ⓒ 매일경제 & mk.co.kr, 무단전재 및 재배포 금지]",/news/news_read.nhn?article_id=0004577175&office_id=009&mode=search&query=LG화학&page=1
,"[아시아경제 박지환 기자] 이날 코스피는 전 거래일보다 9.83포인트(0.51%) 오른 1937.11로 거래를 마쳤다. 이날 코스피는 전장보다 7.23포인트(0.38%) 오른 1934.51로 출발했다. 장 초반 미국과 중국의 갈등 확산 우려에 등락을 거듭했지만 결국 상승 전환했다. 주요국들의 신종 코로나바이러스감염증(코로나19) 충격을 극복하기 위한 경제 정상화 기대감이 반영된 것으로 풀이된다.투자주체별로는 개인과 기관이 각각 298억원, 346억원 순매수했다. 외국인은 863억원어치 팔자에 나섰다. 업종별로는 전기·전자(1.59%), 비금속광물(1.98%), 증권(1.48%) 등이 상승했다. 반면 종이·목재(-3.98%), 전기가스업(-1.54%) 등은 하락세를 나타냈다.시가총액 상위 종목 중에서는 삼성전자(1.99%), 네이버(0.94%), LG화학(2.16%) 등이 상승했다. 반면 SK하이닉스(-0.98%), 삼성바이오로직스(-.1.32%), 셀트리온(-2.07%) 등은 하락으로 마감했다.코스닥은 전 거래일보다 1.08포인트(0.16%) 내린 690.85로 장을 끝냈다. 지수는 전장보다 3.24포인트(0.47%) 오른 695.17로 상승 출발했다. 이날 코스닥은 기관·외국인 동반매도에 약세를 지속했다. 투자주체별로는 개인이 1062억원 규모를 순매수했다. 반면 기관과 외국인은 각각 883억원, 112억원 순매도했다.시가총액 상위 종목 중에선 대다수가 하락세를 면치 못했다. 셀트리온헬스케어(-4.62%), 에이치엘비(-.051%), 씨젠(-1.86%), 셀트리온제약(3.87), 펄어비스(-1.31%) 등이 하락했다. CJ ENM(0.96%), 케이엠더블유(0.17%),, 에코프로비엠(8.64%) 등은 상승했다.박지환 기자 pjhyj@asiae.co.kr <ⓒ경제를 보는 눈, 세계를 보는 창 아시아경제 무단전재 배포금지>",/news/news_read.nhn?article_id=0004680528&office_id=277&mode=search&query=LG화학&page=1
"기관·개인 ‘사자’…비금속광물·전기전자↑시총 상위주 혼조세…SK, 자회사 상장 기대감에 11% 급등","[이데일리 박태진 기자] 코스피 지수가 상승 마감하며 1930선을 회복했다. 미국과 중국 간 갈등 재부각, 신종 코로나 바이러스 감염증(코로나19) 2차 확산 우려에도 주요국들의 경제 재개가 본격화된 데 따른 기대감이 반영된 것으로 풀이된다. 외국인이 내다 팔았지만 기관과 개인이 주식 매수에 나서 지수를 상승으로 이끌었다. 시가총액 상위 종목들은 혼조세로 마감했다. 자료=마켓포인트18일 마켓포인트에 따르면 코스피 지수는 전 거래일보다 9.83포인트(0.51%) 오른 1937.11로 마감했다. 지수는 장 초반 강보합으로 출발한 이후 미·중 갈등 등 불확실성 우려 영향에 보합권에서 등락을 반복했지만 오후로 접어들수록 상승폭이 확대됐다. 종가 기준으로 지난 13일(1940.42) 이후 3 거래일 만에 1930선을 회복했다. 이경민 대신증권 연구원은 “글로벌 경제활동 정상화가 시작되면서 경제지표 저점통과 시그널이 하나둘씩 확인될 것이며, 경제전망도 상향조정될 가능성이 높아질 것”이라며 “미·중 무역갈등, 코로나19 2차 확산에 대한 불안감보다 경제지표 흐름, 경제전망 변화가 글로벌 금융시장에 영향력이 크고 강한 모멘템이 된다”고 강조했다. 이어 “단기 등락, 속도조절이 더 이어지더라도 코스피 뿐 아니라 글로벌 증시 상승 동력은 강해질 것”이라고 덧붙였다. 수급주체별로 보면 기관과 개인이 각각 345억원, 299억원 순매수했다. 외국인은 863억원 순매도했다. 프로그램 매매는 차익과 비차익을 합쳐 1336억원 매도 우위를 기록 중이다.업종별로는 비금속광물, 전기·전자, 증권, 제조업, 금융업, 철강및금속, 화학, 건설업 등은 올랐다. 종이·목재, 전기가스업, 은행, 섬유·의복, 의약품, 음식료품, 보험 등은 하락했다. 시가총액 상위종목들은 보합세를 보였다. 대장주인 삼성전자(005930)를 비롯해 네이버(035420), 삼성전자우(005935), LG화학(051910), 삼성SDI(006400) 등은 상승했다. 특히 SK(034730)는 100% 자회사인 SK바이오팜 상장 기대감에 11.9% 급등했다. 반면 SK하이닉스(000660), 삼성바이오로직스(207940), 셀트리온(068270), LG생활건강(051900) 등은 하락했다. 개별종목별로는 한국단자(025540), 샘표식품(248170), 대양금속(009190) 등은 상승폭이 컸고, 신한(005450) 레버리지 WTI원유 선물 ETN(H), 한양증권우(001755), QV 인버스 레버리지 WTI원유 선물 ETN(H) 등도 하락률이 컸다. 이날 거래량은 7억5267만3000주, 거래대금은 9조2433억5900만원으로 집계됐다. 상한가 없이 총 423개 종목이 상승했고, 하한가 없이 총 424개 종목이 하락했다. 51개 종목은 보합권에서 거래를 마쳤다.박태진 (tjpark@edaily.co.kr)＜ⓒ종합 경제정보 미디어 이데일리 - 무단전재 & 재배포 금지＞",/news/news_read.nhn?article_id=0004643339&office_id=018&mode=search&query=LG화학&page=1
"코스피 9.83p 오른 1937.11…개인·기관 사고 외인 팔아 코스닥, 1.08p 하락 690.85…환율 1.4원 오른 1232.4원 마감","(서울=뉴스1) 정은지 기자 = 코스피 지수가 18일 소폭 상승하며 마감했다. 코스닥은 하락했다. 이날 코스피 지수는 등락을 거듭하다 전일 대비 9.83p(0.51%) 상승한 1937.11에 거래를 마쳤다. 개인과 기관이 각각 298억원과 346억원을 순매수한 반면 외국인은 933억원을 순매도했다. 시가총액 상위 종목 가운데 2차전지 관련주인 삼성SDI(3.64%), LG화학(2.16%) 등이 올랐다. 삼성전자(1.99%), 삼성전자우(1.59%), 네이버(0.94%) 등이 상승한 반면 LG생활건강(-2.58%), 셀트리온(-2.07%), 삼성바이오로직스(-1.32%), SK하이닉스(-0.98%) 등은 하락했다. 코스닥은 전거래일대비 1.08p(0.16%) 내린 690.85에 거래를 마쳤다. 시총 상위 종목 중 에코프로비엠이 전일 대비 7400원(8.64%) 오른 9만3000원에 거래를 마쳤으나 셀트리온헬스케어(-4.62%), 셀트리온제약(-3.87%), 알테오젠(-2.41%) 등은 낙폭이 컸다. 업종별로는 식품과 기본식료품 소매(5.54%), 무역회사와 판매업체(4.37%), 전기제품(3.72%), 전자제품(3.22%), 복합기업(2.72%) 등이 강세를 보였고 문구류(-2.57%), 종이와 목재(-2.18%), 가구(-1.94%) 등은 약세를 나타냈다. 노동길 NH투자증권 연구원은 ""주말 새 미중 간 파열음이 있다는 소식은 투자자들의 불안을 키웠다""며 ""양측 마찰이 관세 전쟁으로 치닫지 않는다면 경제적 여파는 최소화할 수 있다""고 말했다. 한편 서울외환시장에서 달러/원 환율은 1.4원 오른 1232.4원에 마감했다.ejjung@news1.kr© 뉴스1코리아(), 무단 전재 및 재배포 금지",/news/news_read.nhn?article_id=0004644216&office_id=421&mode=search&query=LG화학&page=1
,"코로나19 극복을 넘어서 '포스트 코로나(코로나 이후)' 시대를 준비하는 기업들의 움직임이 빨라졌다. 국내 5대 그룹 총수들도 현장 경영과 소통을 강화하고 있다. 코로나 이후 경제 상황이 회복되는 시기를 준비하는 재계 리더들의 움직임을 살펴봤다.이재용(51) 삼성전자 부회장은 18일 중국 시안(西安) 삼성 반도체 사업장을 방문해 코로나19 장기화 영향과 대책을 논의했다. 이 부회장은 ""과거에 발목 잡히거나 현재에 안주하면 미래는 없다""고 말했다. 그는 ""새로운 성장 동력을 만들기 위해서는 다가오는 거대한 변화에 선제적으로 대비해야 한다""고도 했다.시안 공장은 삼성전자의 유일한 해외 메모리 생산 기지다. 스마트폰, PC, 서버 등에서 데이터 저장장치로 활용되는 낸드플래시 메모리를 양산한다.신동빈(65) 롯데그룹 회장은 이달 서울로 복귀해 현장 경영을 강화한다. 그는 3월 일본으로 출국해 일본 롯데홀딩스 이사회 회장에 취임했다. 코로나19 확산으로 복귀 일정이 다소 늦어졌지만 화상 회의로 국내 상황을 챙겼다.신 회장은 ""그룹 전 계열사들이 국내·외 상황을 지속해서 체크하고 사업 전략을 재검토해야 한다""고 말했다. 롯데는 7월 하반기 밸류 크리에이션 미팅(사장단 회의)에서 그룹 중장기 전략을 발표할 계획이다. 계열사별로 강도 높은 구조조정을 준비할 것으로 알려졌다.구광모(42) LG그룹 회장은 업무 효율성 강화와 미래 먹거리 투자에 집중한다는 계획이다. 구 회장은 수시로 전략 회의를 열고 미래 전략을 고민하고 있다. LG전자는 올해 말까지 900개 업무에 로봇업무 자동화를 추진한다.로봇에 인공지능·빅데이터 기술을 결합하면 고차원적인 업무도 처리할 수 있다. LG그룹은 12개 계열사에서 로봇 사원을 활용하고 있다. 구 회장 주재로 열리는 계열사 사업 보고회도 매년 상·하반기 두 차례에서 한 차례로 통해 효율성을 높인다.최태원(59) SK그룹 회장은 코로나19를 계기로 화상 회의를 대폭 늘렸다. 사장단 업무지시부터 실무자 격려까지 온라인으로 소통하고 있다. 최 회장은 ""단순히 '잘 버텨보자'는 식의 태도를 버리고 완전히 새로운 씨줄과 날줄로 안전망을 짜야 할 시간이 왔다""며 계열사에 비상대응체제를 가동했다.제약·바이오 분야 진출에도 속도를 내고 있다. SK바이오팜은 12일 뇌전증 신약을 미국 시장에 출시했다고 밝혔다. 최 회장은 영상 메시지로 ""신약 개발로 미국에 성공적으로 진출하고 기업의 사회적 가치를 실현했다""고 격려했다.정의선(49) 현대자동차그룹 수석부회장도 이달 13일 이 부회장과 만나 차세대 전기자동차용 배터리 개발 협력을 논의했다. 재계는 전기차를 생산하고 있는 완성차 업체 현대차와 전기차 배터리를 생산하는 삼성 간 협업 가능성에 주목하고 있다. 현대차는 LG화학과 SK이노베이션이 만든 배터리를 사용하고 있다. 현대차는 1분기 실적은 선방했지만 코로나 타격이 본격적으로 반영되는 2분기 이후를 대비하고 있다.정우성 객원기자 wooseongeric@naver.com<저작권자 ⓒ 시사저널, 무단 전재 및 재배포 금지>",/news/news_read.nhn?article_id=0000013766&office_id=586&mode=search&query=LG화학&page=1
,"[일간스포츠 김두용]
이재용 삼성전자 부회장과 정의선 현대차그룹 수석부회장이 손을 맞잡았다. ‘전기차’를 매개로 한국의 재계 거물의 만남이라 시선이 집중됐다. 삼성과 현대차 두 총수의 사상 첫 단독회담은 '초당적 협력'과 더불어 미래를 향한 청사진을 제시하고 있다.



전기차는 '한국판 뉴딜'로 정부가 육성하는 사업이다. 이런 전기차의 핵심은 배터리다. 삼성SDI가는 차세대 전기차 배터리 생산에 심혈을 기울이고 있다. 지난 13일 이 부회장의 초청으로 정 부회장을 비롯한 현대차 핵심 임원들이 충남 천안사업장을 방문했다. 이 부회장이 개인적으로 연락해 정 부회장을 초청한 것으로 알려져 더욱 비상한 관심을 모았다.


초청에 흔쾌히 발걸음을 옮긴 현대차나 이 부회장의 ‘핫라인’을 가동한 삼성이나 상징적인 의미를 지닌 만남이다. 세계 전기차 부문 4위 현대차와 세계 배터리 부문 4위 삼성SDI는 전략적 협력을 통해 향후 글로벌 시장에서 윈윈 전략을 논의했다는 평가다. 삼성SDI는 정 부회장에게 차세대 전기차용 전지인 '전고체 배터리(All-Solid-State Battery)'에 대한 설명을 한 것으로 알려졌다.


전고체 배터리는 향후 전기차 시장을 선도할 차세대 모델로 꼽힌다. 배터리 1회 충전으로 800km 주행하고 1000회 이상 재충전할 수 있어 전기차 주행거리를 획기적으로 늘릴 수 있을 것이라는 기대감이 나오고 있다. 차세대 모빌리티로 꼽히는 전기차 부문에 올인을 선언한 현대차그룹의 시선을 사로잡을 수 있는 배터리 성능이다. 현대차는 제네시스 G80에 차세대 전기차 배터리를 사용할 가능성이 대두되고 있다.


현대와 삼성의 협력은 2025년 이후에나 이뤄질 전망이다. 현대차 관계자는 “당장 삼성SDI 배터리를 탑재하는 게 아니다. 5~6년 이후의 전략적 협력에 관해 논의를 했다”고 설명했다. 2025년 이후의 계약이라 해도 규모가 엄청나다. 현대차는 SK이노베이션과 내년부터 5년간 전기차 배터리 5년 50만대분 규모의 공급 계약을 했다. 금액으로 따지면 10조원을 뛰어넘는 규모다. 업계에서는 현대차와 삼성SDI의 계약에 대해 기본적으로 10조원을 능가할 것으로 내다보고 있다.


현대차는 국내 배터리 업체 중 LG화학과 SK이노베이션으로부터 전기차 배터리를 납품 받고 있다. 하지만 향후 삼성SDI 배터리로 장착될 가능성이 커지고 있다. 현대·기아차는 2025년까지 44종의 친환경차를 선보일 예정이다. 이 중 절반이 넘는 23종을 순수 전기차로 출시할 계획을 세우고 있다.

 글로벌 전기차 전문매체 EV세일즈에 따르면 현대·기아차는 올해 1분기에 총 2만4116대의 전기차를 판매해 글로벌 순위 4위를 기록한 바 있다. 현대차 관계자는 “현대·기아차는 세계 최고 성능의 전기차에 필요한 최적화된 배터리 성능 구현을 위해 연관 기술을 연구하고 있고, 관심이 집중돼 있다”고 설명했다.


김두용 기자 kim.duyong@joongang.co.kr



 ▶ ▶     ⓒ일간스포츠 무단 전재 및 재배포 금지",/news/news_read.nhn?article_id=0003024030&office_id=241&mode=search&query=LG화학&page=1
"기관, 코스닥서는 순매도 행렬 동참… 외국인 '팔자' 기조 여전","코스피가 개인과 기관의 '쌍끌이' 매수에 힘입어 18일 상승 마감했다. 외국인은 여전히 팔자 기조를 유지했다.이날 코스피는 전 거래일 대비 9.83포인트(0.51%) 오른 1937.11에 장을 마쳤다. 지수는 전장보다 7.23포인트(0.38%) 오른 1934.51로 거래를 시작했다. 장 초반 하락하던 지수는 개인과 기관의 매수세에 곧 상승 전환해 거래를 마무리했다.투자자별로는 개인과 기관은 '사자'에 힘을 실었고, 외국인은 '팔자' 기조를 이어나갔다.이날 개인과 기관은 코스피를 각각 298억원, 346억원 씩 순매수했다. 외국인은 863억원어치를 순매도했다.업종별 현황을 보면 비금속광물(2.26%), 건설업(1.27%), 음식료품(1.10%) 등 업종이 오름세를 나타냈다. 전기·전자(0.84%), 의료정밀(0.84%), 화학(0.70%) 등도 소폭 상승했다.반면, 종이·목재(-2.68%), 섬유·의복(-0.97%), 통신업(-0.93%), 전기가스업(-0.49%), 서비스업(-0.42%) 등은 하락했다.테마별로는 NFC(7.79%), 정보보안(6.09%), LBS(4.18%) 등 관련주가 올랐고, 국내상장 중국기업(-9.95%), 제지(-3.14%), 전자결제(-2.38%) 등 관련주는 내림세로 마감했다.시가총액 1위인 삼성전자는 1.99% 오른 4만8800원으로 장을 마감했다. 시총 상위 20개 종목 가운데 삼성SDI(3.64%), LG화학(2.17%) 등 8개 종목이 상승세를 나타냈다. LG생활건강(-2.58%), 엔씨소프트(-2.42%), 셀트리온(-2.07%) 등은 소폭 내렸다.한국단자(26.51%), 샘표식품(22.14%), 대양금속(18.79%) 등 종목의 상승폭이 가장 컸다. 한양증권우(-14.98%), 쌍용차(-10.58%), 깨끗한나라우(-7.91%) 등은 내림세를 보였다.이날 상승·하락 종목은 모두 421개로 같았다. 56개 종목은 보합 마감했다.코스닥지수는 전 거래일보다 1.08포인트(0.16%) 내린 690.85로 장을 끝냈다.지수는 전장보다 3.24포인트(0.47%) 오른 695.17로 개장한 후 상승세를 나타내다 약보합 마감했다. 개인은 1062억원을 순매수했고, 기관과 외국인은 각각 883억원, 112억원어치를 순매도했다.박상현 하이투자증권 연구원은 ""이날 증시는 지난 주 미국의 경제재개 예상으로 미 증시가 올라간 부분과 이번 주 계획된 중국 양회에 대한 기대감이 반영돼 상승한 것으로 보인다""며 ""최근에 인도, 브라질 등 코로나19 환자가 악화되고 있는 만큼 외국인이 쉽게 이머징 마켓에 손을 대기는 쉽지 않은 것으로 사료된다""고 말했다.데일리안 김민석 기자 (kms101@dailian.co.kr)ⓒ (주)데일리안 - 무단전재, 변형, 무단배포 금지",/news/news_read.nhn?article_id=0002402261&office_id=119&mode=search&query=LG화학&page=1
코스피 강보합세…0.51% 오른 1937.11 마감,"[더팩트ㅣ박경현 기자] 18일 코스피가 개인과 기관의 동반 매수에 상승 마감했다. 반면 코스닥은 개인이 매수포지션을 취하며 1000억 원 가량 사들였으나 지수하락 방어에 실패했다.이날 코스피는 전장 대비 9.83포인트(+0.51%) 오른 1937.11에 장을 마쳤다. 개인과 기관은 매수포지션을 유지하며 각각 302억 원, 342억 원을 사들였다. 반면 외국인은 933억 원을 팔았다.시가총액 상위종목 주가는 엇갈렸다. 삼성전자(+1.99%), 네이버(+0.94%), 삼성전자우(+1.59%), LG화학(+2.16%), 삼성SDI(+3.64%)는 오름세였던 반면 SK하이닉스(-0.98%), 삼성바이오로직스(-1.32%), 셀트리온(-2.07%), LG생활건강(-2.58%), 현대차(-0.43%)는 내렸다.이날 업종은 식품과 기본식료품소매, 무역회사와 판매업체, 전기제품, 전자제품, 복합기업이 3~5%가량 올랐다. 반면 문구류, 종이와목재, 가구, 전기유틸리티, 생명보험은 2%가량 내렸다.코스닥은 전장대비 1.08포인트(-0.16%) 내린 690.85에 장을 마쳤다.코스닥에서는 개인 홀로 1064억 원가량 순매수했지만 외국인과 기관이 각각 82억 원, 883억 원을 팔아치우며 지수를 끌어내렸다.이날 코스닥 시가총액 상위종목 주가는 대부분 내렸다. 셀트리온헬스케어(-4.62%), 에이치엘비(-0.51%), 씨젠(-1.86%), 셀트리온제약(-3.87%), 알테오젠(-2.41%)이 하락하며 장을 마쳤다. 반면 CJ ENM(+0.96%), 케이엠더블유(+0.17%), 에코프로비엠(+8.64%)은 올랐다. 스튜디오드래곤은 보합세로 마감했다.pkh@tf.co.kr저작권자 ⓒ 특종에 강한 더팩트 & tf.co.kr 무단 전재 및 재배포 금지",/news/news_read.nhn?article_id=0000026151&office_id=629&mode=search&query=LG화학&page=1
