head,text,url
,"[아이뉴스24 류은혁 기자] 코스피가 4일 미국 연방준비제도(Fed·연준)의 깜짝 기준금리 인하에도 하락 출발했지만 외국인 매수폭이 늘어나면서 급반등했다.4일 코스피지수는 전날(2014.15)보다 8.34포인트(0.41%) 내린 2005.81에 거래를 시작했다. 오전 9시40분 기준 외국인은 951억원을 순매수 중이며 개인과 기관은 각각 592억원과 359억원을 순매도하고 있다.시가총액 상위 종목에선 셀트리온(-0.29%)를 제외하고 대부분 상승세를 보이고 있다. 삼성전자(0.72%), SK하이닉스(0.11%), 삼성전자우(1.50%), 삼성바이오로직스(1.15%), NAVER(1.43%), LG화학(1.81%), 현대차(0.89%), 삼성SDI(1.62%), 삼성물산(0.94%) 등이 오름세를 보이고 있다.코스닥은 이날 전날(626.82) 대비 3.07포인트(0.49%) 내린 623.75로 출발했지만 외국인 매수폭이 늘어나자 상승세로 전환됐다. 9시40분 기준 외국인과 기관은 각각 322억원과 16억원을 순매수중이며 개인은 332억원을 팔고 있다.약세를 보이는 에이치엘비(-4.05%), 휴젤(-0.03%) 등을 제외하고 셀트리온헬스케어(1.26%), CJ ENM(0.24%), 펄어비스(2.56%), 스튜디오드래곤(1.56%), 케이엠더블유(0.51%), 에코프로비엠(1.30%), SK머티리얼즈(1.51%), 원익IPS(1.53%) 등이 강세를 보이고 있다.간밤 연준은 코로나19 확산 사태에 대응해 기준금리를 0.5%포인트 긴급 인하했다. 기존 0.25%포인트씩 금리를 조정하는 일명 '그린스펀의 베이비스텝' 원칙에서 벗어난 '0.5%포인트 빅컷'이자, 예정에 없던 '깜짝 인하'다. 이로써 미국의 기준금리는 기존 1.50~1.70%에서 1.00~1.25%로 내려갔다.이는 코로나19 공포로 글로벌 경제 불확실성이 커지자, 연준이 선제적인 처방을 내놓은 것이다. 다만 기준금리 인하에도 뉴욕증시는 일제히 급락세를 나타났다. 연준의 깜짝 기준금리 인하가 증시 불안감을 더 키웠다는 분석이다.뉴욕증권거래소(NYSE)에서 다우존스 30 산업평균지수는 전장보다 785.91포인트(2.94%) 급락한 25917.41에 거래를 마쳤다. 스탠더드앤드푸어스(S&P) 500 지수는 전장보다 86.86포인트(2.81%) 하락한 3003.37에, 기술주 중심의 나스닥도 268.07포인트(2.99%) 추락한 8684.09에 장을 마감했다. ehryu@inews24.com [ⓒ 아이뉴스24 무단전재 및 재배포 금지]",/news/news_read.nhn?article_id=0000528051&office_id=031&mode=search&query=LG화학&page=2
■ 경제와이드 이슈& '핫이슈 키워드' - 장연재,"이슈의 흐름을 살펴보는 핫이슈 키워드 시간입니다.인터넷과 SNS를 뜨겁게 달군 오늘(4일)의 키워드 알아봅니다오늘 오전 2시 59분경 충남 서산시 대산읍 롯데케미칼 대산 공장에서 폭발사고가 발생했습니다.이 불로 근로자와 인근 주민 등 26명이 다쳐 병원으로 옮겨진 것으로 알려졌습니다.화재 현장에서는 거대한 불기둥이 솟구치고, 인근 주민들은 지진 같은 진동이 느껴졌다고 합니다.해당 공장 주변에 LG화학과 한화, 현대정유 등 화학업체가 밀집해 있어 화재가 확산하면 추가 피해가 우려됩니다.경찰과 소방 당국은 압축 공정에서 문제가 생겨 설비 일부가 폭발한 것으로 보인다고 밝혔는데요.잔불 정리 작업을 마친 뒤, 보다 정확하게 화재 원인을 조사할 예정입니다.코로나 19로 혼란스러운 시기에 북한이 지난 2일 발사체를 발사했죠.청와대가 강한 우려를 표명했는데, 이에 대해서 북한 김정은 국무위원장의 여동생, 김여정 노동당 제1 부부장이 본인 명의의 첫 담화를 발표했습니다.김 제1부부장은 '청와대의 저능한 사고방식에 경악을 표한다'라는 제목의 담화를 내고, 북한의 화력 전투 훈련을 자위적 차원이라고 주장하며 청와대를 비난했습니다.김 제1부부장이 남쪽 청와대에서 '강한 유감'이니, '중단요구'니 하는 소리가 들려온 건 ""주제넘은 실없는 처사"", ""적반하장의 극치""라고 비판했는데요.교착상태에 들어간 남북관계가 풀릴 기미가 보이지 않네요.코로나 19가 전 세계로 확산하면서 올해 7, 8월 예정돼있는 도쿄 올림픽이 예정대로 진행할 수 있을지 우려의 목소리가 나오는데요.국제올림픽위원회 IOC가 현지 시간 3일, 도쿄 올림픽 성공을 위해 전력을 다할 것이라면서 전 세계 선수들에게 2020 도쿄올림픽을 준비하라고 독려했습니다.세계보건기구 WHO 역시 아직 올림픽에 대한 결정을 내리기에는 이르다고 밝혔습니다.한편 일본 정부는 처음으로 올림픽 연기를 시사했는데요.올림픽 담당 장관은 2020년 중에 열리면 연기가 가능한 것으로 해석된다며, IOC가 5월 말에 최종 결정하기로 했다고 전했습니다.1인당 국민소득이 4년 만에 뒷걸음질 쳤습니다.한국은행에 따르면, 지난해 1인당 명목 국민총소득, GNI는 3만 2,047달러로 전년 대비 4.1% 감소했습니다.이 같은 감소 폭은 2015년 이후 4년 만에 처음입니다.원화 기준으로 보면 1.5% 늘어 3천 737만 6천 원을 기록했지만, 이는 IMF 이후 21년 만에 최저 수준입니다.한편 한은은 지난해 경제성장률 잠정치가 2.0%라고 밝혔는데요.정부가 재정을 풀어 떠받친 덕에 2%를 가까스로 달성했지만, 체감성장률로 여겨지는 명목 GDP 성장률은1.1% 증가하는 데 그쳐 이 역시도 21년 만에 최저치까지 떨어졌습니다.코로나 19 확산세가 계속되면서 여러 공인도 자가격리에 들어갔습니다.일본 공연을 마친 지휘자 정명훈 씨는 이탈리아 지휘를 취소하고 프랑스에서 자가격리에 들어갔습니다.이탈리아 마지오 뮤지칼레 피오렌티노 오케스트라는 정 지휘자가 자가격리가 필요하다고 요청했다며, 지휘자를 교체했다고 전했습니다.정 지휘자는 코로나 증상이 없지만, 만일의 사태에 대비한 것으로 알려집니다.한편 최근 이탈리아 밀라노 패션위크에 참석했다, 가수 아이유 씨와 청하 씨가 귀국했는데요.아이유 씨는 한 행사에 불참했지만 자가격리 때문은 아니었다며 해명했고요.청하 씨는 검사를 받고 음성판정을 받았지만, 당국의 권유에 따라 자가격리 중이라고 전했습니다.
☞ SBSCNBC를 만나는 법 ☞ 경제를 실험한다~
저작권자 SBS미디어넷 & SBS I&M 무단전재-재배포 금지",/news/news_read.nhn?article_id=0000206386&office_id=374&mode=search&query=LG화학&page=2
"명노현 사장, 전기차 시장 성장성 주목자회사 상장 작업 적극 임할 것 주문스카이프·유튜브로 기업설명회 대체 분주","[헤럴드경제 김현일 기자] 명노현〈사진〉 LS전선 사장이 최근 신종 코로나 바이러스 감염증(코로나19) 사태 속에도 자회사 LS EV코리아의 상장을 예정대로 추진하겠다는 의지를 밝혔다.명 사장은 특히 전기차 시장의 성장성에 주목하며 이같이 독려한 것으로 전해졌다.명 사장은 이달 초 사내 회의에서 “전기차 관련 업체에 대한 투자자들의 관심이 높고, 향후 글로벌 전기차 시장의 성장 전망도 밝다”고 강조하며 직원들에게 LS EV코리아의 상장 작업이 차질없이 진행되도록 노력할 것을 당부했다.최근 예비 상장기업들이 코로나19 여파로 관련 일정을 연기하거나 취소하고 있는 상황이어서 명 사장의 이같은 메시지는 주목을 끈다.명 사장이 흥행에 대한 강한 확신을 보이면서 LS전선은 이달 말을 목표로 LS EV코리아 코스닥 상장 작업에 속도를 내고 있다.LS EV코리아 상장 담당자들은 최근 내부 회의를 거쳐 당초 오프라인으로 진행할 예정이었던 기업설명회와 기자간담회를 취소하는 대신 온라인을 통한 대체 수단을 총 동원하며 바쁘게 움직이고 있다.당장 4일 영상통화 플랫폼 스카이프를 통해 기관투자자들과 1:1 미팅을 진행하고, 노재훈 LS EV코리아 대표의 프레젠테이션 영상을 유튜브에 올려 관심 있는 투자자들에게 기업 정보를 적극 제공한다는 방침이다.명 사장의 이러한 자신감은 안정적인 실적에서 나온다. LS EV코리아는 LG화학을 비롯해 BYD, 폭스바겐, 볼보 등 글로벌 완성차 업체에 전기차용 와이어링 하네스와 배터리팩 부품, ESS용 부품 등을 공급하며 성장세를 달리는 중이다. 지난해 전기차·에너지저장장치(ESS) 부품 사업의 매출액은 전년보다 22.5% 증가한 750억원을 기록했다.LS전선 관계자는 “실제로 개인투자자들과 해외에서 상장 관련 문의가 많이 오고 있는 상황”이라며 “현재 내부에서도 LS EV코리아에 대한 기대가 높다”고 말했다. - Copyrights ⓒ 헤럴드경제 & heraldbiz.com, 무단 전재 및 재배포 금지 -",/news/news_read.nhn?article_id=0001643715&office_id=016&mode=search&query=LG화학&page=2
"외국인, 8거래일만에 순매수 전환","[이데일리 최정희 기자] 코스피 지수가 장중 1%대 상승하고 있다. 시가총액 상위 20위권 종목이 일제히 상승세다. 간밤 미국 연방준비제도(Fed·연준)가 기습적으로 기준금리를 내리면서 주요국의 정책 공조 기대감이 강화된 영향이다. 신종 코로나 바이러스 감염증(코로나19)
확산 우려가 커질 수록 통화 완화 및 확장적 재정정책 기대감이 커질 것으로 보인다. 4일 마켓포인트에 따르면 코스피 지수는 이날 오전 9시 44분 현재 전 거래일보다 28.42포인트, 1.41% 오른 2042.62에 거래되고 있다. 코스피 지수는 전 거래일보다 소폭 하락한 2005선에 개장했으나 점차 상승폭을 키워가고 있다. 수급으로 보면 외국인이 8거래일 만에 959억원 순매수에 나서고 있다. 개인과 기관은 각각 545억원, 417억원 순매도 흐름이다. 시가총액 상위 종목들은 대부분 상승세다. 삼성전자(005930), SK하이닉스(000660), NAVER(035420), 삼성물산(028260), 현대모비스(012330), POSCO(005490) 등은 1%대 오르고 삼성바이오로직스(207940), LG화학(051910), 삼성SDI(006400), SK텔레콤(017670) 등은 2%대 오르고 있다. LG생활건강(051900)은 3%대 반등중이다. 시가총액 상위 20위권 중 19개 종목이 상승하고 있다. 한국전력(015760)만 보합권에서 거래되고 있다. 업종별로 보면 보험, 섬유의복, 은행 등을 제외한 대다수 업종이 강세다. 운수창고가 2%대 오르고 통신업, 전기전자, 화학, 의약품, 비금속광물, 철강금속 등이 1%대 상승하고 있다.최정희 (jhid0201@edaily.co.kr) | ＜ⓒ종합 경제정보 미디어 이데일리 - 무단전재 & 재배포 금지＞",/news/news_read.nhn?article_id=0004589524&office_id=018&mode=search&query=LG화학&page=2
■ 경제와이드 이슈& '기업 이슈',"화제가 되는 기업 소식만 모아 전해드리는 기업이슈 시간입니다.어제(3일) 국내증시는 전강후약 장세로 거래를 마쳤습니다 그래도 2000선 지켜냈는데요.증시에 등락을 좌우했던 종목들 함께보시죠.일단 2차전지 관련주가 눈에 띄었습니다.어제 미국 전기차업체 대장주인 테슬라 주가가 크게 오른 영향으로 2차전지 관련주, 그중 전기차 배터리 관련주가 상승 마감했습니다.어제 뉴욕증시에서 테슬라는 전 장보다 11.32% 올라 743.62달러에 장을 마쳤죠.시장에서는 친환경 차 수요 확대로 올해 테슬라 등 전기차 관련 기업들의 실적이 크게 늘 수 있을 것으로 보고 있습니다.이에 따라 국내 증시에서 LG화학과 삼성SDI, SK이노베이션이 동반 상승 보여줬습니다.특히 LG화학은 급성장하는 유럽 전기차 시장을 대응하기 위해 폴란드 배터리 생산공장을 확충한다는 점, 호재로 작용했고요.SK이노베이션도 미국 국제무역위원회 ITC에 LG화학과의 배터리 소송전 조기패소 판결에 이의를 제기했다는 소식이 알려져 상승 마감했습니다.증권주가 상승세를 보여주기도 했습니다.미국의 기준금리 인하 기대감이 커지면서 증권주들이 동반 강세를 보였습니다.기준금리가 인하하면 증권사들은 전통적인 주식 위탁매매를 통한 수수료 수익 증가를 기대할 수 있고 채권평가이익이 늘어나게 되는데요.앞서 지난 주 제롬파월 미 연방준비제도 의장이 이례적인 긴급성명을 통해 ""경제를 뒷받침하기 위해 적절하게 행동하겠다""면서 금리인하를 강하게 시사한 바 있고 실제로 현지시간으로 3일 미 연준이 기준금리를 0.5% 포인트 인하했습니다.증권주의 상승세가 오늘까지 이어질 지 눈 여겨 보셔야겠는데요.세 번째로 알아볼 종목은 백신 관련주입니다.도널드 트럼프 미국 대통령이 미국 제약회사들에게 백신 개발 연구에 속도를 낼 것을 주문하면서 코로나19 백신 관련주가 전장에서 부각됐습니다.진원생명과학은 공동으로 메르스 DNA백신을 개발하고 있는 미국 바이오기업 이노비오가 오는 4월부터 코로나19 백신 임상에 들어간단 소식에 상한가를 기록했습니다.이노비오는 4월 미국을 시작으로 중국, 한국 순으로 백신 임상시험에 들어갈 것으로 전해졌습니다.또 신풍제약은 말라리아와 에볼라 치료제 2종이 코로나19에 도움이 된다는 중국언론의 보도가 나오면서 급상승했습니다.이 밖에 진앙제약과 백광산업 등 백신 관련주가 전반적으로 상승하는 모습이었네요.마지막으로 한진그룹주 알아봅니다.한진칼 어디까지 갔을까요. 어제 8만 원까지 갔습니다.한진칼의 무서운 상승세 어제 장에서 확인해볼 수 있었는데요.이번 달 정기 주주총회를 앞두고 경영권 분쟁이 계속 격화되는 모습입니다.어제 KCGI측의 지분 매입으로 3자 연합군의 지분율이 올랐다는 소식에 한진칼 주가가 장중 8만 원 선을 돌파했습니다.KCGI 산하 투자목적회사 그레이스홀딩스는 한진칼의 주식을 추가 매입해 보유 지분율이 17.68%로 상승했다고 공시했습니다.이에 따라 KCGI와 조현아 전 대한항공 부사장, 반도건설등 '3자 연합'의 지분율은 종전의 37.08%에서 37.63%로 늘었습니다.한진칼 사상최고가를 계속 경신하고 있습니다만 전문가들은 경영권 분쟁 이슈가 사그라드는 시점에서 주가 급락이 나타날 수 있다고 경고했습니다.



 ☞ SBSCNBC를 만나는 법 ☞ 경제를 실험한다~
저작권자 SBS미디어넷 & SBS I&M 무단전재-재배포 금지",/news/news_read.nhn?article_id=0000206391&office_id=374&mode=search&query=LG화학&page=2
,"오늘(4일) 오전 2시 59분경 충남 서산시 대산읍 롯데케미칼 대산 공장에서 폭발사고가 발생했습니다.이 불로 근로자와 인근 주민 등 31명이 중경상을 입은 것으로 알려졌습니다.화재 현장에서는 거대한 불기둥이 솟구치고, 인근 주민들은 지진 같은 진동이 느껴졌다고 합니다.해당 공장 주변에 LG화학과 한화, 현대정유 등 화학업체가 밀집해 있어 화재가 확산하면 추가 피해가 우려됩니다.경찰과 소방 당국은 압축 공정에서 문제가 생겨 설비 일부가 폭발한 것으로 보인다고 밝혔는데요.잔불 정리 작업을 마친 뒤, 보다 정확하게 화재 원인을 조사할 예정입니다.



 온라인 뉴스팀 기자(sbscnbcnews@sbs.co.kr) ☞ SBSCNBC를 만나는 법 ☞ 경제를 실험한다~
저작권자 SBS미디어넷 & SBS I&M 무단전재-재배포 금지",/news/news_read.nhn?article_id=0000206392&office_id=374&mode=search&query=LG화학&page=2
,"[서울경제] 국내 증시가 외국인 매수세가 돌아오면서 1%대 강세를 보이고 있다.4일 오전 10시3분 현재 코스피 지수는 30.42포인트(1.51%) 오른 2,044.57을 나타냈다. 이날 지수는 8.34포인트(0.41%) 내린 2,005.81에 출발했지만, 외국인 매수세가 살아나면서 다시 2,040선을 회복하고 반등에 나섰다.같은 시간 외국인 투자자는 1,087억원을 순매수하며 8거래일 만에 매수 포지션으로 전환했다. 반면 개인과 기관은 각각 662억원과 428억원을 순매도했다.간밤 뉴욕 증시에서는 미국 연방준비제도(Fed·연준)가 기준금리를 0.5%포인트 인하했음에도 불구하고 다우지수(-2.94%), 스탠더드앤드푸어스(S&P)500 지수(-2.81%), 나스닥 지수(-2.99%) 등이 모두 하락했다. 시장에서는 연준이 긴급하게 금리 인하에 나설 정도로 신종 코로나바이러스 감염증(코로나19)으로 인한 경제 충격이 크다는 뜻으로 전달됐다는 분석이다.코스피 시가총액 상위 종목들은 모두 상승 중이다. 삼성전자(2.17%), SK하이닉스(0.97%), 삼성바이오로직스(1.67%), 네이버(2.00%), LG화학(2.20%), 현대차(0.89%), 셀트리온(0.87%) 등이 오름세다.업종별로는 전기가스업(-0.16%)을 제외한 전 업종이 강세다. 코스닥 지수는 같은 시간 8.79포인트(1.40%) 오른 635.61을 나타냈다. 이날 지수는 3.07포인트(0.49%) 내린 623.75에 출발했다. 외국인과 기관이 각각 365억원과 103억원씩 사들였고, 개인은 459억원 순매도했다.이날 개장 시 환율은 8.2원 내린 1,187.0원이었다./신한나기자 hanna@sedaily.com저작권자 ⓒ 서울경제, 무단 전재 및 재배포 금지",/news/news_read.nhn?article_id=0003704297&office_id=011&mode=search&query=LG화학&page=2
,"국내 3대 석유화학단지인 충남 서산 대산공단에 있는 롯데케미칼 화학 공장에서 4일 오전 3시 쯤 원인을 알 수 없는 큰 폭발음과 함께 불이 나 사고 노동자와 인근 주민이 부상을 입었다.충남소방본부에 따르면 이번 사고로 당초 근로자 6명이 다친 것으로 알려졌지만 직원과 주민 등 31명이 부상을 입어 병원으로 이송됐다. 이 중 2명은 화상이 심해 중상이다. 사망자는 현재 없는 것으로 알려졌다.당시 사고를 목격한 주민들은 폭발이 일어난 대산 공장은 납사(나프타) 분해 센토로 폭발 당시 '쾅, 쾅' 소리가 두 번 나며 수십m 불기둥이 치솟았다고 증언했다. 창문이 깨지거나 지붕이 무너지는 등 건물 일부가 붕괴됐다. 공장 진입로에는 유리 파편에 튀면서 인근 주민은 사고의 충격파에 잠을 이루지 못했다고 했다.충남소방당국에 따르면, 진동이 대산공단에서 수십km 떨어진 당진과 태안에서 들릴 정도로 컸던 것으로 파악했다. 창문이 깨지거나 지붕이 무너지는 등 건물 일부가 붕괴됐다.소방당국은 인접 소방서 가용 인력과 장비까지 출동해 대응 2단계를 발령했으며 250여명과 차량 30대를 동원해 화재 2시간만에 큰 불길을 잡고 진화 작업을 벌이고 있다.경찰과 소방당국은 사고 원인을 화학제품 원료를 만드는 납사 분해 센터에서 공정 중 폭발 사고가 난 것으로 보고 정확한 사고 원인을 조사하고 있다. 원유에서 뽑아내는 납사는 1200도 이상 초고온으로 열분해하면 에틸렌, 프로필렌, 열분해 가솔린 등을 생산할 수 있다.롯데케미칼 화학 공장 주변에는 LG화학과 한화, 현대정유 등 화학 업체가 밀집해 화잭 확산할 경우 추가 피해가 우려되는 지역이다. 서산시는 누출된 유해화학물질이 없다는 안전 안내 문자를 지역 주민들에게 발송한 상태다.이와 관련해 롯데케미칼 측은 현재 대산공장 내 10개 시설 중 7개 시설의 가동을 중단했으며 재가동 일정은 납사 분해센터 정비 상황에 맞춰 정한다는 입장이다. 회사 측은 사고 발생에 대비해 비상대책반을 구성했으며 사고 현장은 대산 총괄공장장이 총괄하고 있으며 임병연 대표이사는 사고 현장으로 이동할 것이라고 밝혔다.회사 관계자는 ""현재 화재지역 잔불제거 중으로 2차 폭발 우려는 없다""며 ""사고 대응을 위해 비상대책반을 가동하고 있다""며 ""정부 당국과 협조 아래 사고 원인 및 규모를 파악 중으로 조속한 수습을 위해 노력하고 있다""고 말했다.조혜승 기자 chohs1021@womennews.co.kr<Copyright ⓒ 여성신문. 무단전재 및 재배포 금지>",/news/news_read.nhn?article_id=0000077080&office_id=310&mode=search&query=LG화학&page=2
외국인 홀로 1600억원대 순매수시총 상위종목들 줄줄이 상승세,"코스피 지수가 외국인 매수세에 힘입어 1%대 상승세를 보이고 있다. 3일(현지시간) 미국 3대 지수가 동반 급락한 것과는 정반대 흐름을 보이고 있다.4일 오전 11시 현재 코스피 지수는 전장대비 34.07포인트(1.69%) 상승한 2048.22를 기록중이다. 외국인이 홀로 1640억원을 순매수한 가운데 개인과 기관이 각각 746억원, 968억원을 동반 순매도 했다.이날 시가총액 상위 종목들은 줄줄이 상승세를 보이고 있다. 삼성전자(2.71%)를 비롯해, SK하이닉스(1.72%), 삼성바이오로직스(1.98%), 네이버(1.71%), LG화학(2.20%), 현대차(0.44%), 셀트리온(1.16%), 삼성SDI(2.76%), 삼성물산(2.35%) 등이 상승세다.코스닥 지수도 전장대비 9.13포인트(1.45%) 상승한 635.88을 기록중이다.전날 미국 중앙은행이 기준금리를 파격적으로 인하하면서 긴급처방전을 내놓았지만 오히려 미국 3대 지수는 동반 급락세로 장을 마쳤다. 신종 코로나바이러스 감염증(코로나19)으로 인한 경기 급락에 대한 우려가 연준의 처방전보다 더욱 컸다는 분석이 나온다.이미선 하나금융투자 연구원은 ""미국 증시가 급락한 것은 전세계로 확산되는 바이러스 문제 대응에 있어서 연준의 통화정책 만으로 부족할 것이라는 우려가 깔려있기 때문""이라며 ""금융시장이 글로벌 펜데믹 공포를 반영할 가능성이 높아진 만큼 전세계 중앙은행들의 적극적인 통화정책 대응이 예상되며 채권금리는 이를 반영하게 될 것""이라고 강조했다.데일리안 이미경 기자 (esit917@dailian.co.kr)ⓒ (주)데일리안 - 무단전재, 변형, 무단배포 금지",/news/news_read.nhn?article_id=0002386746&office_id=119&mode=search&query=LG화학&page=2
,"코스피 지수가 외국인 매수세에 힘입어 1.7%대 강세를 보이고 있다.4일 오전 11시 11분 현재 코스피 지수는 전 거래일보다 32.91포인트(1.70%) 오른 2048.39를 기록하고 있다. 개인은 648억원을 순매도 중이고, 외국인은 1681억원 순매수를, 기관은 1128억억원을 순매도 중이다. 이날 코스피는 전 거래일보다 13.83포인트(0.69%) 오른 2027.98에 개장했다.시가총액 상위종목은 모두 강세다. 삼성전자(2.17%), SK하이닉스(1.40%), 삼성전자우(3.00%), 삼성바이오로직스(1.77%), 네이버(1.14%), LG화학(1.94%), 현대차(0.89%) 등이 모두 상승세를 보이고 있다.코스닥 지수는 전 거래일보다 8.31포인트(1.3%) 오른 635.14를 가리키고 있다. 이날 코스닥 지수는 전 거래일보다 1.92포인트(0.31%) 상승한 628.74에 개장했다.코스닥 시가총액 상위종목 또한 에이치엘비(-4.15%), 휴젤(-2.15%)를 제외하고 모두 상승했다. 셀트리온헬스케어(1.26%), CJ ENM(1.02%), 펄어비스(1.31%), 스튜디오드래곤(2.08%), 케이엠더블유(1.84%) 등이 상승세를 나타냈다.송창범 기자
 <저작권자 ⓒ '성공을 꿈꾸는 사람들의 경제 뉴스' 머니S, 무단전재 및 재배포 금지>",/news/news_read.nhn?article_id=0000513071&office_id=417&mode=search&query=LG화학&page=2
