head,text,url
노트북·청소기 등 탑재 이어 규격이 표준화돼 대량 생산 용이,"노트북, 스마트폰 등 IT기기와 무선 청소기 등에 탑재되던 원통형 배터리가 전기차에 탑재되기 시작하면서 가파른 성장세를 보이고 있다 3년 안에 시장 규모가 2배에 달할 것이라는 전망도 나온다.30일 시장조사업체 SNE리서치에 따르면 원통형 전기차 배터리 시장이 올해 74.6GWh에서 2023년 150GWh로 성장할 전망이다. 기존의 대형 파우치 배터리를 주로 탑재하던 전기차들이 테슬라를 시작으로 소형 원통형 배터리를 채택하기 시작하면서다. 전기차의 선두 주자인 테슬라가 원통형 배터리를 탑재한 모델을 출시하고 이를 인정받자 후발 주자들도 원통형 배터리 탑재를 결정했다. 재규어, 루시드모터스, 리비안 등이 원통형 배터리를 채택했다.원통형 배터리는 흔히 보는 건전지 모양의 배터리다. 규격이 표준화돼 대량 생산이 용이하다. 지름 21㎜, 높이 70㎜ 크기의 ‘21700’이 국제 표준으로 자리잡았다. 이는 과거 ‘18650’ 모델의 용량을 50%까지 늘린 고출력 모델이다.전기차 1대에는 수천개의 원통형 배터리가 필요하다. 문제는 이 중 하나가 망가지면 전체를 교체해야 한다는 것이다. 이 때문에 관리비용이 높아 전기차에 원통형 배터리는 적절하지 않다는 평가를 받았다. 하지만 테슬라가 이를 보완할 수 있는 특허를 공개하면서 시장 판도가 바뀌었다. 테슬라는 2014년 원통형 배터리 급속충전 기술을 비롯해 배터리를 안전하게 관리하는 기술 등의 특허를 무료 공개했다.원통형 배터리에 대한 관심이 높아지자 이를 대량으로 공급할 수 있는 기업들에도 이목이 쏠린다. LG화학, 삼성SDI, 파나소닉 3곳만이 원통형 배터리 대량 생산체제를 갖춘 것으로 알려졌다. LG화학과 삼성SDI는 LG전자, 삼성전자 등의 스마트폰과 노트북에 탑재되는 원통형 배터리를 꾸준히 생산해 왔다.LG화학은 지난 2월 미국 루시드모터스의 ‘루시드 에어’ 표준형 모델에 2023년까지 원통형 배터리를 독점 공급하기로 계약했다. 테슬라의 모델3에도 LG화학의 원통형 배터리가 탑재된 것으로 알려졌다. 장승세 LG화학 전지 경영전략총괄 전무는 지난 28일 1분기 실적발표 콘퍼런스콜에서 “2분기 원통형 전지가 본격 출하될 것”이라고 말했다. 삼성SDI는 영국 재규어랜드로버에 배터리를 독점 공급 중이다.통상 전기차에 탑재되던 배터리는 파우치형(폴리머형)이었다. 디자인 변형이 쉽고 고용량·고밀도로 고출력이 가능함에도 안정성이 높아 주목받았다. 하지만 공정 난도가 높아 다른 전지에 비해 가격이 높다는 게 단점이다. 국내 기업 중에서는 LG화학과 SK이노베이션이 파우치형 배터리를 생산 중이다. BMW, 아우디 등에 탑재되는 각형 배터리도 있다. 상대적으로 제조원가가 낮다. 국내에서는 삼성SDI가, 해외에서는 중국의 BYD가 각형 배터리를 생산 중이다.권민지 기자 10000g@kmib.co.krGoodNews paper ⓒ , 무단전재 및 재배포금지",/news/news_read.nhn?article_id=0001317034&office_id=005&mode=search&query=LG화학&page=1
LG그룹 청사진 중책 맡아…주력 4개사 이사회 의장 선임까지,"[아이뉴스24 이연춘 기자] 2018년7월16일. 40년 LG맨 권영수 부회장이 LG그룹의 컨트롤타워(사령탑) 최고운영책임자(COO·부회장)의 자리를 꿰차며 그룹의 2인자로 급부상했다. 권 부회장은 40대 '젊은 총수'인 구광모 회장과 함께 LG그룹의 청사진(미래상)을 그려 나가는 중책을 맡으며 '경영 스승'으로 알려져있다.일각에선 당시 구 회장이 취임 보름여 만에 그룹 내 사실상 2인자인 ㈜LG 부회장을 전격 교체한 것은 자신의 색깔을 내기 위한 것이라는 분석을 내놓는다. 전임 하현회 부회장은 고(故) 구본무 회장, 구본준 부회장의 '복심'으로 LG를 이끌었으며 구본무 회장의 의중을 잘 알고 충실히 이행해 복심으로 불려왔기 때문이다.권 부회장의 급부상을 두고 LG그룹에 정통한 재계 관계자는 ""하 부회장은 선대 회장과 호흡을 맞춰온 경영인""이라며 ""구 회장이 자신과 보다 잘 맞는 사람으로 교체한 게 아닌가 싶다""고 말했다. 권 부회장은 구 회장이 LG전자 재경부문 대리로 입사했을 때 최고재무책임자(CFO)로 인연이 시작됐다.1일 재계에 따르면 LG그룹 내 권 부회장의 그룹 내 무게감이 커지고 있다. 권 부회장이 그룹 핵심계열사인 LG전자, LG디스플레이, LG유플러스에 이어 LG화학 이사회 의장까지 도맡으면서다.재계 4위의 LG그룹의 총수로 올라선 구 회장 입장에서 경영 스승이자 조력자가 필요했다는 분석이다. 수십년 경영노하우를 가진 선배 LG맨들 앞에서 강력한 리더십으로 의사결정을 주도하기에는 부담스러운 상황이기 때문이다.권 부회장은 LG전자, LG디스플레이, LG화학, LG유플러스 등 LG그룹의 주요 계열사를 두루 거친 인물로 구 회장이 '뉴 LG'를 이끌 밑거름을 만드는 역할을 맡기에 충분하다는 분석도 있다. 1979년 LG전자에 입사한 권 부회장은 LG전자 CFO까지 역임한 뒤 2007년부터 2011년까지는 LG디스플레이 사장을 역임했다. 2012년부터 2015년에는 LG화학 전지사업본부장(사장)을 지냈고 2016년부터 LG유플러스 대표이사 부회장을 맡았다.그룹 안팍에선 권 부회장이 경영자로서 책임감과 집념은 둘째가라면 서럽다고 평가한다.그는 계열사 CEO를 맡으면서 각 회사의 성장을 이끌었다. LG디스플레이는 LCD 패널 글로벌 시장 점유율 1위 회사로 성장시켰고 TV용 OLED 사업 육성을 시작했다. LG디스플레이에서 LG화학으로 이동할 때 LG는 ""LG디스플레이를 세계 최고의 기업으로 키웠듯 LG화학의 2차전지 사업도 세계 최고로 키워 달라는 구본무 회장의 당부와 믿음이 있었다""고 했다. 그가 LG화학을 맡은 시기 세계 전기차 배터리 시장은 급성장했고 LG화학은 중대형 배터리 사업 분야에서 세계적인 경쟁력을 갖추게 됐다.LG유플러스 CEO로 재임하면서는 2016년 가입자 1천200만명, 2017년 1천300만명을 달성했고 4차 산업혁명에 대비해 클라우드 드론 관제시스템을 선보이는 등 신사업 육성에도 힘을 쏟았다.경영안정화란 측면에서도 창업자 구인회 시대 이후 '구자경-구본무-구광모'로 이어지는 4대째 총수경영을 모두 경험한 그의 조력은 결과적으로 구 회장에게 더없는 안정감으로 될 것으로 전망된다.재계에서는 미래 성장동력 발굴, 기존 주력사업의 경쟁력 강화라는 과제를 안게 된 구 회장이 ‘어려운 일을 믿고 맡길 사람’으로 권 부회장을 낙점한 것으로 본다. 아울러 권 부회장의 가장 중요한 임무는 구 회장을 필두로 한 '4세 체제'를 안정적으로 안착시키는 것이다.재계 관계자는 ""권 부회장이 그룹의 안살림을 챙기고 계열사의 미래 먹거리사업을 조정하는 등 사령관의 역할을 할 것""이라며 ""구 회장을 도와 그룹 사업구조를 고도화하고 신성장동력을 발굴하는 데 집중할 수 있도록 도울 것""이라고 말했다.향후 재계 주요 그룹들의 경영판도는 2인자들의 각축전이 될 전망이다. 코로나19를 기점으로 미래사업을 구체화하고 경영현안을 해결해야 하는 기로에 서있다고 판단하고 있다.다른 관계자는 ""구 회장이 취임 3년차를 맞고 있지만 갑작스럽게 그룹 경영권을 승계해 경영 안정화에 시간이 다소 필요해 보인다""며 ""여러 계열사를 이끌었던 권 부회장의 경험을 어떻게 화답할지 관심이 집중된다""고 말했다. staykit@inews24.com [ⓒ 아이뉴스24 무단전재 및 재배포 금지]",/news/news_read.nhn?article_id=0000536589&office_id=031&mode=search&query=LG화학&page=1
1824년 첫 전기차 등장…내연기관차보다 5년 앞서 상용화석유 등장에 몰락 후 배터리 발전으로 재등장…이젠 대세,"(서울=뉴스1) 문창석 기자 = 최첨단 기술이 집약된 전기자동차가 이미 200여년 전에 나왔다면 믿을 수 있을까. 사실이 그렇다. 처음엔 주목받았지만 곧이어 몰락한 전기차는 100년 후 다시 화려하게 등장했다. 앞으로 전기차가 가솔린 차를 제칠 수 있는지 여부는 '배터리'가 관건이 됐다.1824년 헝가리의 아니오스 예들릭(Anyos Jedlik)는 자신이 발명한 전기모터로 구동하는 작은 모형 자동차를 만들었다. 실제 사람이 타진 못했지만 오늘날의 형태를 갖춘 전기차의 시초로 꼽힌다.이후 1884년 영국의 토마스 파커(Thomas Parker)가 공식적으로 세계 최초라 불리는 전기차를 공개했고 1886년 판매돼 일반인도 탈 수 있었다. 세계 최초의 가솔린 엔진 자동차 판매가 1891년 이뤄졌다는 점을 고려하면, 전기차는 내연기관 자동차보다 5년 먼저 탄생한 셈이다.전기차가 내연기관차보다 앞설 수 있었던 건 구조가 간단해서다. 실린더 안에서 폭발로 생긴 피스톤의 운동으로 바퀴를 돌리는 내연기관차는 엔진·클러치·변속기 등 복잡한 기계장치가 필요하다. 반면 전기차는 배터리와 모터만으로 움직이기에 훨씬 쉽게 개발할 수 있었다.대중도 내연기관차보다 전기차에 열광했다. 우선 가솔린 차보다 냄새가 적고 진동과 소음도 덜했다. 또 크랭크를 돌려야 하는 내연기관차보다 시동도 쉽게 켜졌고 기어 조작도 필요 없었다. 이 때문에 당시 유럽 상류층 여성들에게 큰 인기를 얻어 '마담차'로 불리기도 했다.성능도 뛰어났다. 1899년 벨기에의 카밀 제나치(Camille Jenatzy)는 자신이 개발한 전기차 '라 자메 콩탕트(la Jamais Contente)'를 타고 인류 처음으로 육상에서 시속 100km 이상의 속도로 달렸다. 포르쉐가 1898년 내놓은 첫 상용차도 전기차였다. 1900년 미국 시장에서 전기차의 점유율은 38%에 달할 정도로 전성기를 맞았다.하지만 전기차의 전성기는 오래가지 못했다. 우선 배터리가 무겁고 긴 충전시간 때문에 마음대로 운행하기엔 제약이 많았다. 또 20세기 초반 미국 텍사스에서 거대 유전이 발견되면서 휘발유 가격도 저렴해졌다. 결정적으로 1913년 미국의 포드가 '컨베이어 시스템'을 통해 대량 생산하면서 내연기관차의 단가가 크게 낮아졌다. 1916년 포드의 '모델T'는 440달러에 팔렸지만 전기차의 가격은 그보다 3배 이상 높았다. 자동차는 본격적으로 대중화됐지만, 전기차는 역사의 뒤안길로 사라졌다. 사라졌던 전기차가 다시 주목받게 된 건 100년이 지난 21세기 초반이다. 여기에는 '배터리'가 결정적인 역할을 했다. 빨리 충전되고 출력 밀도가 높으며 가볍기까지 한 리튬이온전지가 등장한 것이다. 전기차는 과거 몰락의 이유가 됐던 짧은 주행거리, 큰 차량 무게 등 문제를 해결할 수 있는 새로운 심장이 생겼다.여기에 '환경'이라는 바람도 불었다. 자동차 배기가스로 인한 환경오염 문제가 심각해지면서, 유럽·미국은 탄소 배출이 없는 전기차 개발에 자금을 지원하고 환경 규제도 강화했다. 2015년 파리기후협약으로 각국의 구체적인 탄소감축 목표량이 제시됐고, 일부 국가는 장기적으로 내연기관차를 퇴출시키는 정책을 연이어 발표하기도 했다.전기차 부흥의 선봉에는 미국의 테슬라가 섰다. 완성차 생산업체들은 자신들의 내연기관차 시장을 잠식할 수 있다는 우려에 전기차 개발에 소홀했지만, 2003년 창업한 테슬라는 처음부터 전기차에 뛰어들었다. 이후 5년 만에 최고 시속 209km, 한번 충전으로 400km를 주행할 수 있는 로드스터를 내놨다. 전기차가 내연기관차에 뒤지지 않는다는 걸 보여주면서 완성차 업체들을 단번에 따라잡았다.테슬라의 기업 가치도 수직상승했다. 전날(30일) 기준 테슬라의 시가 총액은 1474억달러(약 180조원)로, 폭스바겐(770억달러)의 두배가 넘는다. 같은 미국 기업인 GM(341억달러)과 포드(209억달러)를 모두 합쳐도 테슬라의 절반에 못 미친다. 상승 폭도 가파르다. 지난해 12월26일 기준 테슬라의 시가총액은 766억달러로 전세계 1위인 도요타(2309억달러)의 3분의1 수준이었다. 하지만 이날까지 도요타의 시가 총액(2056억달러·4월30일 기준)은 다소 하락했지만, 테슬라는 1474억달러로 급상승하며 4개월 만에 3분의 2 수준까지 따라왔다.전기차의 가장 큰 문제였던 주행거리는 배터리 기술 향상으로 빠르게 극복되고 있다는 평가다. 내연기관차와 비교하면 충전시간이 다소 길고 충전 인프라가 부족하다는 문제 정도가 남아있다. 조만간 이런 기술적 문제만 해결되면 내연기관차는 더 이상 전기차와 경쟁할 수 없을 것으로 보인다. 시장 조사기관 BNEF는 오는 2040년 전기차가 전세계 승용차 시장의 57%를 차지할 것으로 전망한다.전기차의 핵심인 배터리를 생산하는 한국 기업들도 이런 대세에 힘입어 약진하고 있다. 지난해 LG화학 등 국내 3사의 전세계 전기차 배터리 시장 점유율 합계는 15.8%로, 모두 10위 안에 들었다. 중국 등 경쟁 업체에 비해 기술력이 뛰어나다는 평가를 받는 국내 업체들은 해외 공장 증설 등 공격적인 투자에 나서며 입지를 굳히고 있다.themoon@news1.kr© 뉴스1코리아(), 무단 전재 및 재배포 금지",/news/news_read.nhn?article_id=0004615947&office_id=421&mode=search&query=LG화학&page=1
삼성전자 한 달 만에 5만원대 회복 주가상승률 16.4% 코스피상승률 반토막,"[서울=뉴시스] 강수윤 기자 = 개미(개인투자자) 순매수 1위 종목인 삼성전자가 실적은 선방했지만, 주가는 지지부진한 모습을 보이고 있다. 1일 한국거래소에 따르면 삼성전자 주가는 29일 전 거래일 대비 0.2% 하락한 5만원에 거래를 마쳤다. 이는 코스피지수가 저점을 찍은 지난달 19일 이후 16.4% 오른 가격이다. 같은 기간 코스피지수가 33.6% 오른 것에 비해 반토막 수준이다. 삼성전자는 28일에는 전일 대비 4.90% 오른 5만1400원에 장을 마쳤다. 삼성전자 주가가 종가 기준으로 5만원대를 회복한 것은 지난 3월12일(5만800원) 이후 25거래일 만이다. 지난달 12일 이후 한동안 4만원대에서 거래됐다.삼성바이오로직스(58.7%), LG화학(63.7%) 등 유가증권시장 시가총액 상위 10위권 내 종목 가운데 상승률이 가장 낮았다. 개인은 코로나19 사태에 조정장이 시작된 지난 2월17일부터 4월29일까지 삼성전자의 순매수규모는 7조2525억원에 이른다. 개인들은 29일 삼성전자 주식 260억원 어치를 순매도했다. 삼성전자 주가가 지지부진하면서 공매도 수량 상위종목에 랭크됐다. 28일 삼성전자 공매도 수량은 4만4411주로 가장 많다. 공매도 평균 가격은 4만9776원인 것을 감안하면 개인 투자자들이 하락에 무게를 두는 셈이다.삼성전자와 양대 반도체 대장주로 꼽히는 SK하이닉스도 마찬가지다. 개인은 같은 기간 SK하이닉스의 순매수 규모는 1조1755억원이었다. 개인들은 29일 하이닉스 주식도 800억원 어치 순매도했다. 반도체 종목의 주가가 힘을 받지 못하는 것은 외국인의 국내 증시 귀환이 늦어지고 있는 것과 무관치 않다. 삼성전자와 SK하이닉스의 외국인 주주 비중은 각각 55.2%, 48.6%에 달해 여전히 크다. 삼성전자는 지난 29일 발표한 연결 재무제표 기준 올해 1분기(1~3월) 영업이익은 전년 동기 대비 3.4% 증가한 6조4473억원으로 선방했다.1분기는 버텼지만 2분기가 문제다. 삼성전자도 이날 신종 코로나바이러스 감염증(코로나19) 영향으로 올해 2분기(4~6월) 실적이 1분기 대비 하락할 것이라고 전망했다. 어규진 DB금융투자 연구원은 ""3월 이후 본격화된 코로나 영향으로 삼성전자의 2분기 영업이익은 7조3000억원으로 시장 기대치(7조6000억원)를 미달할 전망""이라며 ""3월 이후 본격화된 코로나19에 2분기 실적도 영향을 미칠 것""이라고 말했다. shoon@newsis.com<ⓒ 공감언론 뉴시스통신사. 무단전재-재배포 금지>",/news/news_read.nhn?article_id=0009842401&office_id=003&mode=search&query=LG화학&page=1
,"[앵커] 국내 배터리 3사가 코로나19 사태 속에서도 해외 투자를 늘리고 있습니다. 자동차 배터리 수요 급증에 대비하기 위한 건데, 세계 1, 2위 배터리 생산국가인 중국과 일본을 견제하려는 측면도 있습니다. 배삼진 기자입니다. [기자]코로나19 여파에도 최근 폴란드에 기술자 200명을 급파한 LG화학.연말까지 전기 자동차에 들어가는 2차 전지의 생산 능력을 연간 100만대 수준까지 높이기 위한 조치입니다. SK이노베이션도 지난달 초 헝가리 코마롬 2공장 증설을 위해 300명의 기술 인력을 보냈습니다. 증설이 이뤄지면 연간 25만대의 자동차에 장착할 수 있는 배터리를 생산하게 됩니다.당장은 코로나19로 수요가 위축됐지만 향후 유럽시장의 급성장에 대비하기 위한 겁니다. 유럽시장이 매년 2배씩 성장한 가운데 2023년부터는 수요가 공급을 앞지를 것이란 전망도 나왔습니다. 국내 배터리 3사는 재규어는 물론 포르쉐와 폭스바겐, 아우디, 벤츠, 다임러 등 유럽 자동차 완성차 업체들과 속속 배터리 납품 계약을 맺었습니다.중국과 일본 기업이 중국과 미국시장을 선점한 만큼 유럽시장은 뺏기지 않겠다는 노림수도 있는 겁니다.또 코로나19 여파로 중국내 배터리 생산이 주춤하는 상황을 고려한 것으로 분석됩니다.<박철완 / 서정대 자동차학과 교수> ""유럽은 자동차 제작사들이 많잖아요. 사실상 형성되고 있는 시장이거든요. 선점이 반드시 필요합니다. 선점 이후 점유율 확충이 필요하고…""실제 현대차와 아우디, 폭스바겐 등 유럽에 있는 자동차 공장들이 공장 가동을 재개하고 있는 부분도 긍정적입니다.다만 경쟁이 심해지면 수익성이 떨어질 수 있고, 완성차 업체들의 배터리 자체 생산 계획에도 대응해야 하는 과제를 안고 있습니다. 연합뉴스TV 배삼진입니다. 연합뉴스TV 기사문의 및 제보 : 카톡/라인 jebo23",/news/news_read.nhn?article_id=0000426598&office_id=422&mode=search&query=LG화학&page=1
,"한국 배터리 3사가 고고도미사일방어체계(THAAD·사드) 사태 이후 4년 만에 세계 최대 중국 전기차 시장을 재공략한다. 지난 2016년 사드 사태 탓에 중국
시장에 빗장이 걸리면서 어려움을 겪었던 배터리 3사가 중국 시장 점유율을 되찾을 수 있을 지 관심이 쏠리고 있다.1일 관련 업계에 따르면 지난달 말 중국 공업신식화부는 ‘제5차 신에너지차 보급 응용추천 목록’을 통해 보조금 지급 대상인 친환경차 243개 모델을 발표했다. 공업신식화부는 한국의 산업통상자원부에 해당하는 중국 중앙부처다. 이번 목록에는 중국 베이징자동차 그룹의 전기차 브랜드 ‘아크폭스’가 오는 9월 출시하는 스포츠유틸리티차량(SUV) ‘알파-T’가 포함됐다. 아크폭스에 들어가는 배터리는 SK이노베이션과 베이징자동차의 합작사인 ‘베스트(BEST)’가 생산한다. SK이노베이션이 공급하는 배터리로 만든 전기차가 중국 정부의 보조금을 받게 된 것이다. 이 회사는 베이징자동차 그룹의 전기차가 출시되는 올 3분기 이후 중국 시장 점유율을 넓힐 수 있는 발판을 마련할 것으로 분석됐다.중국 정부는 2016년 12월 29일 이후 한국산 배터리가 탑재된 차량을 보조금 명단에서 제외했다. 중국에서는 전기차 보조금이 차량 가격의 절반을 차지하는 만큼 보조금을 받지 못하면 현지 판매가 불가능하다. 최근들어 중국 정부가 보조금 목록에 한국산 배터리를 탑재한 자동차를 속속 포함하면서 제재가 완화되는 것 아니냐는 전망도 나온다. LG화학이 테슬라 중국공장에 배터리를 공급하는 데 이어 삼성SDI도 중국 내 복수 공급선을 확보한 것으로 알려졌다. 국내 배터리 3사는 현지생산과 합작 등 현지화 전략으로 중국 시장을 적극 공략하겠다는 방침이다.권도경 기자 kwon@munhwa.com[Copyrightⓒmunhwa.com '대한민국 오후를 여는 유일석간 문화일보' 무단 전재 및 재배포 금지()]",/news/news_read.nhn?article_id=0002426479&office_id=021&mode=search&query=LG화학&page=1
"SK이노베이션, 중국 정부 보조금 받아사드 사태 이후 4년 만에 재공략","[서울경제] 한국 배터리 기업들이 4년 만에 중국 전기차 시장을 다시 공략한다. 국내 배터리 3사는 지난 2016년 고고도미사일방어체계(THAAD·사드) 사태가 불거지며 중국 시장 진출이 사실상 중단됐다.
1일 업계에 따르면 지난달 중국 공업신식화부는 ‘제5차 신에너지차 보급 응용추천 목록’을 통해 보조금 지급 대상인 친환경차 243개 모델을 발표했다. 공업신식화부는 한국의 산업통상자원부에 해당하는 중앙부처다. 이 목록에는 의 배터리가 들어가는 스포츠유틸리티차량(SUV) ‘알파-T’가 포함됐다. 이 차량은 중국 베이징자동차 그룹의 전기차 브랜드 ‘아크폭스’가 9월 출시하는 것으로, SK이노베이션과 베이징자동차의 합작사인 ‘베스트’가 생산하는 배터리가 탑재됐다. 결국 SK이노베이션이 공급하는 배터리로 만든 전기차가 중국 정부의 보조금을 받게 된 것이다. 중국 정부는 지난 2016년 12월 이후 한국산 배터리가 탑재된 차량에게는 보조금을 지급하지 않았다. 중국에서는 전기차 보조금이 차량 가격의 절반을 차지하는 만큼 보조금을 받지 못하면 가격 경쟁력이 없어 현지 판매가 불가능하다. 최근들어 중국 정부가 보조금 목록에 한국산 배터리를 탑재한 자동차를 속속 포함하며 제재가 완화되는 것으로 풀이된다.
아울러 LG화학이 테슬라 중국공장에 배터리를 공급하는 데 이어 도 중국 내 공급선을 확보한 것으로 알려졌다. 국내 배터리 3사는 현지생산과 합작 등 현지화 전략으로 중국 시장을 적극 공략할 것으로 예상된다. /박시진기자 see1205@sedaily.com저작권자 ⓒ 서울경제, 무단 전재 및 재배포 금지",/news/news_read.nhn?article_id=0003732114&office_id=011&mode=search&query=LG화학&page=1
