head,text,url
유치 적극 나선 충북 오창시민단체·학계 등 100만 서명KTX·고속도로 교통 사통팔달건설기간 2년 단축 이점도,"국내 최대 바이오 클러스터를 품고 있는 충청북도가 1조원 규모 국책사업인 다목적 '방사광 가속기' 유치에 팔을 걷어붙였다. 일본 수출규제로 촉발된 소재·부품·장비 원천기술 확보를 통한 제조 혁신과 기술 강국에 대한 국민적 염원, 시대적 요구를 담을 수 있는 최적지가 충북 오창이라는 판단에서다. 오창에 방사광 가속기가 조성되면 연구센터를 중심으로 평택~이천~천안~오창·오송~대전까지 아우르는 신산업 혁신벨트가 구축돼 대한민국 혁신성장의 퀀텀점프(대도약)를 보다 빠르고 쉽게 이끌어낼 수 있다는 것이다.이시종 충북지사는 ""입지 후보지인 오창은 수도권과 중부권의 활용산업 집적도, 화강암 지대로 지질학적 안정성, 대덕연구단지와 산업 지원 연구개발(R&D) 여건의 우수성, 전국 2시간 이내 접근성 등 모든 조성 요건을 고루 갖춰 대형 연구장비를 구축하는 데 입지 조건이 뛰어나다""며 ""오창과 인근 오송에는 반도체, 화학, 바이오, 화장품·뷰티, 미래 자동차, 2차전지 등 신산업군(群)이 모여 있어 이를 활용한 시너지 효과가 상상을 초월할 것""이라고 말했다. 그러면서 이 지사는 ""오창에 방사광 가속기가 조성되면 세계 3대 바이오 클러스터인 오송생명과학단지와 거대한 '바이오헬스 벨트'를 형성하고 정부의 바이오헬스 혁신전략, 강소연구개발특구 육성, 국제과학비즈니스벨트 마스터플랜과 연계해 R&D 활성화를 통한 국가 혁신성장 생태계 구축 비전을 실현할 키 플레이어(key player) 역할을 톡톡히 해낼 것""이라고 강조했다.
충북이 방사광 가속기 유치에 도전하는 것은 이번이 두 번째다. 충북은 2008년 누구도 관심을 두지 않을 때 정부에 4세대 방사광 가속기 설치를 제안해 유치에 나섰으나 우수한 접근성과 지질 안정성에도 불구하고 경북 포항에 밀려 고배를 마셨다. 이번에도 충북은 2018년 말부터 정부에 먼저 제안을 했다. 지난해 3월 유치 기본계획을 수립한 뒤 전문자문단을 구성하고 방사광 가속기 수요 확인, 정책 고도화, 의견 수렴 등을 거쳤다. 현재 정부의 방사광 가속기 유치전에는 충북 청주를 포함해 전남 나주, 강원 춘천, 경북 포항이 도전장을 내밀었다. 과학기술정보통신부는 전문가들로 독립적 선정평가위원회를 구성하고 4개 지방자치단체가 제출한 사업계획서를 평가해 오는 7일 후보지를 확정한다.11년 만에 재도전에 나선 충북도는 ""앞장서 준비해왔다""며 유치에 자신감을 보이고 있다. 충청권 4개 시도지사들은 지난 1월 16일 '중부권 방사광 가속기 공동유치 공동건의문'을 채택했고 시민단체와 경제계, 학계, 문화계 등도 유치 서명운동으로 힘을 보태고 있다. 3일 기준 100만명 이상이 서명에 동참할 정도로 열기도 뜨겁다.이 지사는 ""충북도는 일찌감치 차세대 방사광 가속기 구축사업을 기초연구 생태계 지원의 핵심 과제로 삼고 이를 유치하고자 지난 10여 년간 부단히 노력해왔다""고 말했다.충북이 차세대 방사광 가속기를 품기 위해 내놓은 용지는 청주시 청원구 오창테크노폴리스일반산업단지다. 이 단지 중 절반에 해당하는 53만9000㎡에 둘레가 800m인 원형 방사광 가속기를 2025년까지 구축하겠다는 것이다. 포항의 35개 빔라인(Beamline)을 넘는 60개 빔라인 수용, 세계 최고 수준의 4GeV급 규모, 연 1만명 이상 연구 수행 등이 가능한 차세대 방사광 가속기를 설치하는 것이 목표다. 이곳은 방사광 가속기 활용도가 높은 바이오헬스, 시스템반도체 업체와 연구기관이 즐비하다. SK하이닉스, LG화학, 셀트리온 등 대기업은 물론 바이오 기업 260개, 반도체 기업 90개, 화학 기업 657개 등 다목적 방사광 가속기를 필요로 하는 기업이 몰려 있다. 10㎞ 거리에 국가 바이오단지인 오송생명과학단지가 있고, 대덕연구단지를 포함한 38개 국책연구시설이 차로 30분 거리에 있다.
오창은 접근성과 편의성에서 뛰어난 여건을 갖추고 있는 것으로 평가받는다. 전국 어디에서나 2시간대로 접근할 수 있어 1일 분석권을 제공한다. KTX 오송역을 기점으로 경부·호남고속철도가 교차하고, 경부·중부·중부내륙·중앙고속도로 등 4개 고속도로망이 거미줄처럼 촘촘하게 연결돼 있다. 청주국제공항도 차로 5분 거리에 있어 세계 학자들과 기업 간 교류도 가능하다. [청주 = 조한필 기자] [ⓒ 매일경제 & mk.co.kr, 무단전재 및 재배포 금지]",/news/news_read.nhn?article_id=0004567956&office_id=009&mode=search&query=LG화학&page=1
,"산업설비 제조업체인 윤성에프앤씨가 코스닥시장 상장에 나선다. SK이노베이션과 LG화학 등 2차전지 제조업체에 턴키 방식으로 생산설비를 공급하는 업체다. 추정 기업가치는 수천억원대로 지금까지 소·부·장(소재·부품·장비 업계) 특례로 기업공개(IPO)를 시도한 기업 중 가장 규모가 크다.3일 투자은행(IB)업계에 따르면 윤성에프앤씨는 최근 미래에셋대우를 IPO 대표주관사로 선정했다. 올해부터 본격적인 IPO 채비에 나선 뒤 내년 소·부·장 특례제도를 통해 코스닥시장에 입성하겠다는 계획이다. 이전까지 소·부·장 특례제도를 통해 상장한 기업 중 가장 큰 공모금액을 모은 곳은 레몬(295억원)이었다.업계가 추정하는 윤성에프앤씨의 예상 공모 규모는 400억~500억원이다.윤성에프앤씨는 1999년 설립된 첨단 생산설비 제조업체다. 2차전지의 필수 구성물인 양극재와 음극재를 균일한 농도로 섞어주는 특수설비를 턴키 방식으로 SK이노베이션과 LG화학에 공급하고 있다. 지난해 매출 중 약 70%가 이 부문에서 나왔다. 윤성에프앤씨의 이 시장 국내 점유율은 약 50%다.윤성에프앤씨는 지난해 매출 1193억원, 영업이익 104억원, 순이익 77억원을 기록했다. 2018년과 비교해 매출은 640억원(115.8%) 늘었고 영업이익은 82억원(384%), 순이익은 59억원(321.4%) 증가했다. 이 회사의 최대주주는 박치영 대표(100%)다.이우상 기자 idol@hankyung.com▶ ▶
 ▶
ⓒ 한국경제 & , 무단전재 및 재배포 금지",/news/news_read.nhn?article_id=0004334023&office_id=015&mode=search&query=LG화학&page=1
상장사 1분기 성적표 '예상밖 선전'3곳 중 2곳 증권사 추정치 웃돌아,"신종 코로나바이러스 감염증(코로나19) 사태로 증시가 폭락하던 지난 3월 중순. 시장은 패닉에 빠졌다. 증권회사들은 연일 과거 위기와 비교하는 보고서를 내고, 실적 전망치를 떨어뜨렸다. 그러나 국내 대기업들이 내놓은 1분기 성적표는 ‘예상 밖 선전’이라는 평가를 받는다. 삼성전자 현대자동차 LG화학 LG생활건강 두산인프라코어 등 업종 대표기업이 줄줄이 증권사 기대치를 웃도는 실적을 내놨다. 금융정보업체 에프앤가이드에 따르면 3일까지 1분기 실적을 잠정 발표한 기업 세 곳 가운데 두 곳은 증권사 컨센서스(추정치 평균)보다 좋은 실적을 기록했다.실적을 발표한 상장사 중 증권사 세 곳 이상에서 추정치를 낸 98개 기업을 대상으로 조사한 결과다. 이 중 66개 기업(67.3%)은 컨센서스보다 높은 영업이익(증권·금융회사는 순이익)을 기록했다. 컨센서스를 50% 이상 웃돈 기업도 12개(12.2%)나 됐다. 일찍 코로나19를 겪은 중국 소비 회복, 방역 성공에 따른 내수의 상대적 선방, 환율효과, 낮아진 시장 기대치 등이 얽힌 결과였다.하지만 증권가는 조심스러워하는 분위기다. 최석원 SK증권 리서치센터장은 “미국 유럽의 회복이 더뎌 2분기 한국 경제에서 가장 중요한 수출이 타격을 입을 수 있다는 게 큰 위험 요인”이라고 말했다.LG생활건강은 지난해 4분기까지 ‘실적이 사상 최고가 아니라야 뉴스가 된다’는 평가를 받았다. 59분기 연속 영업이익 사상 최고치를 기록했기 때문이다. 올 들어 분위기가 달라졌다. 신종 코로나바이러스 감염증(코로나19)으로 다들 “이번에는 힘들다”고 했다. 하지만 LG생건은 또다시 사상 최대 실적을 발표했다. 화장품의 부진을 생활용품 부문이 만회했다.LG생활건강뿐 아니다. 지금까지 1분기 실적을 공개한 국내 대기업들이 내놓은 성적표는 기대 이상이다. 지난 3월 19일 1457선까지 폭락했다가 최근 1950선에 육박한 주가지수를 기업들이 실적으로 설명해주고 있다는 평가다.상장사 가운데 증권사 컨센서스가 3개 이상 있는 98개 기업 중 66곳(67.3%)이 전망치보다 높은 이익을 거뒀다. 증권사들이 일찌감치 전망치를 낮춘 영향도 있지만 중국의 빠른 소비 회복, 고환율, 방역 성공, 경쟁력 등을 선전의 이유로 꼽을 수 있다.우선 중국. LG이노텍은 일찌감치 코로나19의 타격을 받은 중국 경제가 회복된 효과를 본 대표적인 기업으로 꼽힌다. 이 회사는 1분기 컨센서스를 74.2% 웃도는 1379억원의 영업이익을 올렸다. 중국의 3월 스마트폰 판매량이 평년의 80% 수준으로 돌아왔고 애플이 상반기 신모델을 내놓은 게 실적에 긍정적 영향을 미쳤다.두산인프라코어 오리온 등도 중국 덕을 봤다. 정용택 IBK투자증권 리서치센터장은 “중국 내 소비심리가 개선되고 있어 다수의 국내 기업이 혜택을 봤다”며 “현지에서 부품을 조달 받아야 하는 전자제품·자동차 업체 등은 조업이 예상보다 일찍 재개된 게 긍정적 영향을 미쳤다”고 말했다.환율 효과도 있었다. 원·달러 환율은 3월 19일 달러당 1285원70전까지 치고 올라갔다. 글로벌 금융위기 직후인 2009년 6월 29일(1285원80전) 후 가장 높았다. 삼성전자, SK하이닉스 등이 환율 효과를 봤다. 삼성전자는 환율 덕에 1분기 매출이 3조원가량 늘었고, SK하이닉스는 환율 상승으로 전분기 대비 영업이익이 700억원 증가했다. 현대미포조선 한국조선해양 등도 환율 효과로 어닝 서프라이즈를 기록했다.현대자동차와 대우건설 등은 국내 수요 덕에 깜짝 실적을 냈다. 코로나19 사태로 망가질 줄 알았던 내수가 3월 들어 살아나며 실적 개선을 지원했다. 현대차는 올 1분기에 컨센서스 대비 20.9% 많은 8637억원의 영업이익을 올렸다. 현대차는 소비자 취향을 반영해 소형 세단을 과감히 정리하고 스포츠유틸리티차량(SUV)을 늘렸으며 대형 세단도 국내 시장에서 좋은 평가를 얻고 있다. 국내 판매가 전년 동기보다 늘고, 단가도 높아진 게 실적의 지지대 역할을 했다.대우건설은 1분기 주택부문 매출이 늘며 전년 동기보다 23% 증가한 1209억원의 영업이익을 기록해 증권사들로부터 좋은 평가를 받았다.이런 흐름을 반영해 증시는 최근 반등했다. 코스피지수는 지난달에만 11.0% 올랐다. 외국인의 매도세도 약해졌다. 외국인이 3월 삼성전자를 순매수한 날은 전체 22거래일 중 3일에 불과했다. 그러나 4월 들어서는 20거래일 가운데 절반이 넘는 11거래일 동안 순매수했다.하지만 코로나19로 직격탄을 맞은 업종도 여럿 있다. 여행·면세점·항공 업종이 여기 속한다. 이들 가운데 1분기 실적을 발표한 종목은 호텔신라뿐이다. 호텔신라는 올 1분기에 컨센서스(69억원)를 크게 밑돈 668억원의 영업손실을 기록했다. 유가 급락으로 에쓰오일은 1조원의 적자를 봤다고 발표하기도 했다.이번주에도 실적 발표가 이어진다. 오는 7일에는 카카오와 BGF리테일이 1분기 실적 잠정치를 발표한다. 카카오는 비대면(언택트)주에 속하고 BGF리테일은 코로나19 사태의 타격이 비교적 덜한 편의점주다. CJ ENM(7일), NHN(8일), CJ제일제당(14일) 등도 단기적인 이익 악화 우려는 크지 않다.다만 화장품 비중이 큰 애경산업(7일)과 카지노주 파라다이스(12일) 등의 실적 추정치는 좋지 않다. 애경산업의 1분기 영업이익 컨센서스는 전년 동기 대비 35.4% 낮은 149억원이다. 파라다이스는 92.1% 줄어든 41억원이 예상된다.양병훈/고윤상 기자 hun@hankyung.com▶ ▶
 ▶
ⓒ 한국경제 & , 무단전재 및 재배포 금지",/news/news_read.nhn?article_id=0004334048&office_id=015&mode=search&query=LG화학&page=1
2018년 법인세 최고세율 인상韓기업 7조3000억원 더 부담투자여력 그만큼 줄어든 셈,"◆ 바운스백 코리아 ⑨ / 한·미 주요기업 법인세 비교 ◆
글로벌 경쟁국과 비교해 무거운 법인세가 국내 주요 기업 경쟁력의 발목을 잡고 있는 것으로 나타났다.글로벌 주식정보 제공업체 S&P캐피털 IQ에 따르면 2017~2019년 삼성전자 등 한국 주요 기업들의 법인세 유효세율은 올라가고, 애플 등 미국 경쟁 기업들은 대부분 하락한 것으로 조사됐다. 유효세율은 법인세 비용을 법인세차감전순이익으로 나눈 값으로 수치가 높을수록 벌어들인 돈에 비해 세금을 많이 내는 것을 의미한다. 2017년 24.9%를 기록했던 삼성전자의 유효세율(연결 기준)은 2019년 28.6%로 3.7%포인트 증가했다. 같은 기간 네이버는 35.4%에서 53.8%로 18.4%포인트 상승했고 현대차(23.5%포인트), LG화학(11.8%포인트), 신한금융(3.5%포인트), 포스코(6.2%포인트), KB금융(7.7%포인트), 기아차(12.7%포인트) 등 대부분 주요 기업의 법인세 유효세율이 올랐다. 반면 미국 대표 기업이자 삼성전자 경쟁사인 애플은 같은 기간 유효세율이 24.5%에서 15.1%로 9.4%포인트 하락했다. 마이크로소프트는 46%포인트, 구글 모회사인 알파벳은 40.1%포인트 등 크게 줄었다. 아마존과 JP모건 또한 각각 3.2%포인트와 13.7%포인트 유효세율이 떨어졌다. 마이크로소프트는 지난해 영업이익이 493억달러로 삼성전자가 거둔 240억달러에 비해 2배가 넘었지만 법인세 비용은 55억3000만달러로 삼성전자의 75억3000만달러보다 적게 냈다. 애플 역시 지난해 영업이익이 삼성전자의 2.8배지만 법인세 비용은 1.4배에 불과했다. 벌어들인 수익에 비해 부담한 세금이 삼성전자보다 적었다는 얘기다. 이 같은 국내 기업의 세금 부담 증가에는 2018년 있었던 법인세 최고세율 인상이 크게 작용한 것으로 분석된다. 정부는 2018년부터 과세표준 3000억원을 초과하는 기업에 대해 최고 세율을 22%에서 25%로 3%포인트 끌어올렸다. 국세통계에 따르면 2017년 과세표준 5000억원에 해당하는 기업은 총 60곳으로 이들이 부담한 법인세는 17조6708억원 수준이었다. 하지만 2018년부터 과세표준 5000억원에 해당하는 기업 64곳은 증가된 최고 세율이 적용되면서 부담한 세액이 24조9723억원으로 늘었다. 세율이 올라가면서 기업들이 낸 세금이 무려 7조3015억원이나 증가한 셈이다. 그만큼 투자 여력 등이 감소했다고 볼 수 있다. 임동원 한국경제연구원 부연구위원은 ""경제협력개발기구(OECD) 국가 중 8위 정도인 법인세 부담을 낮추고, 31위로 최하위 수준인 소비세 부담은 높이는 방향으로 세제 개편의 밑그림을 그려가야 한다""고 지적했다. 특히 협소한 내수시장, 지정학적 리스크 등 다른 국가들에 비해 불리한 투자 환경을 고려하면 법인세 같은 세제상 혜택을 통해 외국 투자를 유치하고 한국 기업의 국내 투자를 유도할 필요가 있다는 지적이 나온다. 세금을 올리면서 국내 기업들의 탈한국 러시는 이어지고 있다. 기획재정부에 따르면 지난해 국내 기업의 해외 직접 투자액은 618억5000만달러로 전년 대비 21% 증가해 1980년 통계 집계 이후 최대치를 기록했다.[특별취재팀 = 이진우 산업부장 / 노영우 금융부장 / 황형규 부장 / 이승훈 기자 / 이재철 기자 / 박준형 기자 / 이승윤 기자] [ⓒ 매일경제 & mk.co.kr, 무단전재 및 재배포 금지]",/news/news_read.nhn?article_id=0004567993&office_id=009&mode=search&query=LG화학&page=1
