head,text,url
,"[이데일리 김영수 기자]
이사회가 지난 달 28일 미국 전기차 배터리 2공장에 대한 7억2700만달러(약8900억원) 규모의 투자계획을 결정하자 시장에서는 기대감보다 우려가 앞섰다. LG화학과의 배터리 분쟁이 해소되지 않은 만큼 불확실성 리스크가 큰 데다 매출비중이 큰 석유·화학 부문에서 조 단위 영업손실이 예고되고 있어서다. 유가하락에 따른 정제마진 악화가 지속되는 가운데 신종 코로나바이러스 감염증(코로나19) 여파가 하반기까지 이어질 경우 누적 적자 규모가 눈덩이처럼 불어날 우려 또한 큰 상황이다.
가장 큰 악재는 LG화학과의 배터리 분쟁이다. 앞서 미국 국제무역위원회(ITC)는 SK이노베이션의 조기패소 판결을 결정했으며 오는 10월 원안대로 최종 확정하면 SK이노베이션이 영업비밀을 침해해 생산했다고 인정되는 배터리 부품이나 소재는 미국 내 수입이 전면 금지된다. 이와 관련, SK이노베이션 측은 “글로벌 전기차 생산업체에 2023년부터 납품키로 약속한 일정을 고려하면 올해 7윌부터 착공해야 가능하다”며 “대외적으로 우려의 목소리가 크지만 이번 투자는 이미 계획했던 것을 구체화한 것”이라고 설명했다. 앞서 2018년 최태원 회장은 미국 전기차 배터리 공장 증설에 최대 50억달러(약6조1200억원) 규모의 투자 프로젝트를 밝힌 바 있다. 2022년 양산 시작을 목표로 작년 착공한 미국 조지아 1공장도 이같은 프로젝트의 일환이다. SK이노베이션은 다만 10월 ITC의 최종 결정 전까지 LG화학과의 배터리 분쟁이라는 불확실성을 해소하는데 노력하겠다는 입장도 내놓았다. 이에 따라 업계는 LG화학과의 분쟁 해소가 급물살을 탈 가능성에도 주목하고 있다.미국 조지아주에 건설 중인 SK이노베이션의 제1 배터리 공장 건설현장. 지난 해 착공한 1공장은 2022년 양산 시작을 목표로 하고 있다.(사진=SK이노베이션)올 1분기 최대 1조5000억원가량의 영업손실이 예상된다는 점도 향후 투자 계획에 차질이 빚어지는 것 아니냐는 우려도 나온다. 매출비중이 큰 석유·화학부문에서 대규모 적자가 지속될 경우 투자가 제때 이뤄질수 있겠느냐는 것이다. 이에 대해서도 SK이노베이션 측은 “자금투입이 한번에 이뤄지는 아니라 생산라인별로 순차적으로 진행되기 때문에 투자계획에는 전혀 문제가 없을 것”이라고 일축했다. 김준 SK이노베이션 사장 역시 “어려울 때 일수록 미래 성장동력에 과감한 투자를 진행하는 것이 사업의 본원적 경쟁력을 확보하고 위기를 극복하는 정공법”이라며 위기 속에서도 과감한 투자를 통한 딥체인지(Deep Change; 사업 구조의 근본적 혁신)를 역설하기도 했다. 재계는 SK이노베이션의 이같은 행보가 불투명한 미래에 대한 절박감의 표출로 해석하는 분위기다. 외부변수에 급격히 출렁이는 정유·화학에서 배터리 사업부문으로의 딥체인지를 본격화하는 행보로 읽힌다는 것이다. 실제 SK이노베이션은 2025년 생산량 100GWh 규모의 세계적인 배터리 업체로 성장하겠다는 목표를 세운 상태다.
SK이노베이션의 이번 결단이 3년후 어떤 결실을 맺을지 주목된다.김영수 (kys74@edaily.co.kr)＜ⓒ종합 경제정보 미디어 이데일리 - 무단전재 & 재배포 금지＞",/news/news_read.nhn?article_id=0004632113&office_id=018&mode=search&query=LG화학&page=1
,"[아시아경제 송화정 기자]외국인이 국내 증시에서 12주 만에 '사자'세로 돌아섰다.3일 한국거래소에 따르면 외국인은 지난달 27일부터까지 29일까지 한 주 동안 국내 주식시장에서 약 616억원을 순매수했다. 유가증권시장에서 1273억원을 사들였고 코스닥시장에서는 657억원을 팔았다.외국인이 지난 주 가장 많이 사들인 종목은 SK하이닉스였다. 외국인은 지난 주 SK하이닉스를 914억원 순매수했다. 뒤이어 LG화학을 680억원 사들였다. 이밖에 삼성전기(457억원), KB금융(410억원), 호텔신라(400억원), 하나금융지주(277억원), 삼성SDI(264억원), 삼성전자(214억원), NAVER(196억원), 한국조선해양(141억원) 등을 순매수했다.지난 주 외국인이 가장 많이 판 종목은 S-Oil이었다. 외국인은 지난 주 S-Oil을 700억원 순매도했다. 이어 한국전력을 335억원 팔았다. 이밖에 삼성전자우(325억원), 현대모비스(277억원), 메디톡스(257억원), KT&G(245억원), 엔씨소프트(219억원), 셀트리온헬스케어(202억원), 케어젠(151억원), 현대차(143억원) 등이 외국인 순매도 상위에 올랐다.외국인의 매수 유입은 시간 문제라는 분석이다. 이은택 KB증권 연구원은 ""아직은 매도세에서 크게 변하지 않았지만 미국의 실업수당청구건수가 지난 3월말이 고점이었다는 점을 감안할 때 고용이 안정되면 외국인들의 매수 유입은 시간 문제""라고 말했다. 송화정 기자 pancake@asiae.co.kr <ⓒ경제를 보는 눈, 세계를 보는 창 아시아경제 무단전재 배포금지>",/news/news_read.nhn?article_id=0004671437&office_id=277&mode=search&query=LG화학&page=1
,"[앵커] 전체 경제에 코로나19 후폭풍이 불기 시작했습니다. 다행히 주요 기업들 중 1분기엔 선방한 곳이 많았지만 2분기부터는 이 폭풍 피하기 쉽지 않다는 게 중론인데요. 한 주 기업계의 주요 소식, 기업기상도로 되짚어보시죠. 김종수 기자입니다.
 [기자] 한 주 기업뉴스 리뷰 주간 기업기상도입니다.황금연휴, 건강하게 보내고 계십니까? 사회적 거리두기는 여전해도 이전에 비하면 다니는 발길 많이 늘었는데요. 조용히 보낸 연휴가 경기 회복 앞당긴다는 믿음으로 이번 주 기업기상도 출발합니다. 먼저 대한항공입니다. 1조2,000억원 긴급 수혈로 위기를 넘겼습니다.이 회사가 상반기 갚을 빚만 1조2,000억원.연간 부족자금이 3조8,000억원입니다. 산업은행, 수출입은행이 이번에 지원하고 하반기 회사채 2,000억원도 별도로 인수합니다. 대한항공도 비용 절감과 1조원 유상증자 추진합니다.공교롭게 지원 발표일이 조원태 회장 경영권 승계 1년 되는 날이었습니다. 조 회장은 경영권 다툼 멈추고 공언한대로 위기 극복 전념하는 게 도리일 겁니다.이번엔 LG화학, 여기서 분사한 LG하우시스입니다. 코로나19 사태로 다들 허덕이는데 이 곳은 다른 세상입니다.LG화학 1분기 영업이익이 2,365억원, 작년보다는 줄었지만 시장 예상을 60% 이상 뛰어넘는 겁니다. 산업재, 건자재 회사 LG하우시스 영업이익은 208억원인데 1년 전보다 90% 급증했습니다. 둘 다 국제유가 폭락에 원재료 값 떨어진 덕 톡톡히 본 겁니다.증권사들은 일제히 주식 목표가 올렸지만 앞으로는 힘들 수 있습니다. 석유화학, 전기차 배터리, 건자재 뭣 하나 코로나19 사태 못 피할 품목들이니까요.이제 흐린 기업입니다.첫 흐린 기업 현대. 기아, 르노삼성 등등 완성차 회사들입니다. 2월엔 중국산 부품 끊겨 쉬었는데 이번엔 물량 줄어 세웁니다.새 차 인기 많아 몇 달씩 기다린다는데 뭔 소린가 싶으시죠. 문제는 해외입니다. 북미 수출 차량 끊어진 르노삼성은 10일까지, 현대는 전 라인 5일까지, 일부라인은 8일까지 쉽니다. 기아도 8일까지 여러 라인 멈추고 쌍용과 한국GM도 4일을 포함해 징검다리 연휴를 쉽니다.코로나19 종식되도 '대봉쇄' 끝나자마자 비싼 차 덥석 살 사람 세계에서 많지 않겠죠. 제조업 중 자동차산업 타격이 클 것으로 우려되는 이유입니다.다음은 미래에셋입니다. 호텔사업 투자 늘려 미국에 호텔 15개를 샀는데, 판 쪽과 송사를 벌이게 됐습니다.판 곳은 국내 금융에도 진출한 중국 안방보험인데, 미래에셋의 투자법인 상대로 미국에서 잔금 달라고 소송 걸었습니다. 미래에셋이 코로나19 사태로 돈 마련 힘들어 시간 더 달라 했다는 말도 흘렸습니다. 미래에셋 말은 다릅니다. 돈 문제는 없고 안방보험이 계약 조건인 제3자와 소송 문제 해결을 못해 늦어졌다는 겁니다. 해결 못 하면 계약해지권 있다고도 했습니다.진짜 내막은 양사 경영진만 알텐데요. 코로나19 사태로 직격탄 맞은 자금시장, 호텔산업 상황과 무관치 않다는 분석이 나옵니다.호텔 하나 더 보시겠습니다. 호텔신라인데요. 대형 면세점까지 낀 이 고급 호텔기업이 코로나19 사태로 20년 만에 분기 적자를 냈습니다.2000년 1분기 상장사 분기별 실적 공개 시작 뒤 이번에 처음 668억원 적자 났고 매출도 30% 급감했습니다. 이유는 말씀 안드려도 아실 겁니다. 국내외 관광객 다 끊어져 면세점이 치명타 입었고 호텔, 행사장도 텅텅 비었으니까요.이미 인천공항 1터미널 면세점도 포기했고 당장 실적 반전도 어렵습니다. 코로나19 조기 종식 외엔 답이 없어보입니다.마지막은 S-오일입니다. 역대급 위기 맞은 정유사 중 처음 1분기 실적 내놨는데요. 예상대로 역대 최악 실적이었습니다.1분기 영업손실이 1조73억원, 창사 이래 최악입니다. 그나마 유화부문서 조금 이익 나 정유 적자를 줄인 게 이 정도입니다. SK, GS는 아직 실적 안나왔는데요. 정유 4사 1분기 적자가 예상헸던 2조~3조가 아니라 4조원대가 될 것 같답니다.정유사들은 설비 보수로 가동률 낮추고 정제마진 회복 기다리는 쪽으로 경영전략 짜고 있습니다. 하반기엔 좀 나아진다는데, 그래도 석유 수요가 줄어 보릿고개가 될 전망입니다.막대한 재정적자와 금융부실 위험 무릅쓰고 200조원 가까운 돈을 경제에 쏟아붓는 것은 그만큼 절박하고 달리 길이 없는 탓입니다. 의견 대립도 있고 일도 벅차지만 제때 이 돈이 집행되지 않으면 돈만 날리고 경기는 악순환에 빠진다는 점 유념할 필요가 있습니다. 지금까지 주간 기업기상도였습니다.연합뉴스TV 기사문의 및 제보 : 카톡/라인 jebo23",/news/news_read.nhn?article_id=0000426835&office_id=422&mode=search&query=LG화학&page=1
,"(자료=식약처) 취소품목 제외[이데일리 노희준 기자] 지난해 국내에서 개발한 신약으로 식약처 허가를 받은 의약품이 단 하나도 없는 것으로 나타났다. 초기 개발 단계에서 신약 후보물질을 기술수출하거나 애초부터 미국시장을 공략할 목표로 식품의약국(FDA) 문을 두드리는 현상이 뚜렷해지기 때문으로 풀이된다. 3일 식약처의 국내 의약품 허가보고서에 따르면, 지난해 신약은 35개 품목이 허가됐다. 이 가운데 국내 제약 바이오 회사들이 자체 개발한 국산 신약은 없다. 나머지는 수입하거나 국내회사가 해외 신약 판권을 사들여 국내에서 제조해 허가를 받는 경우다. 국산신약은 1999년 SK케미칼의 위암 치료제 선플라주가 1호로 등장한 이후 대체로 매년 1개 이상이 나왔다. 2015년의 경우 크리스탈니노믹스의 골관절염 치료제 ‘아셀렉스캡슐’, 동화약품(000020)의 항균제 ‘자보란테정’, 동아에스티(170900)의 항균제 ‘시벡스트로정·주’, 동아에스티의 당뇨병치료제 ‘슈가논정’ 등 5개가 허가를 받았다.하지만 2018년 씨제이헬스케어의 위식도 역류질환 치료제 ‘케이캡정’ 이후에는 추가로 허가받은 제품이 없다. 이는 바이오기업을 중심으로 개발 단계부터 글로벌 시장(미국)을 목표로 해외에서 신약허가를 먼저 받고 국내는 나중에 허가받는 전략을 취하고 있기 때문으로 풀이된다.실제 신라젠, 헬릭스미스, HLB, 메즈온 등이 국내를 건너뛰고 미국, 유럽 등을 중심으로 신약개발에 도전하고 있다. 국산 첫 독자개발로 미 FDA 승인을 받은 SK바이오팜의 뇌전증 치료 신약 ‘세노바메이트’도 미국 현지화 채널을 통한 직접 개발로 FDA를 먼저 통과했다. 이른바 ‘식약처 패싱’ 현상이다. 이를 두고 일각에서는 국내 식약처의 심사능력과 심시기간 등에 대한 볼멘소리를 내놓는다. 하지만 이는 식약처의 무능이라기보다 결국 미국 시장이 세계 최다 의약품 시장인 데다 글로벌 시장을 공략해 제대로 된 성과를 내려면 FDA를 뚫지 않고서는 방법이 없기 때문이라는 목소리도 만만치 않다.실제 한 바이오업체 대표는 “아무리 식약처의 심사 능력이 개선되고 심사 기간이 단축되더라도 세계 시장으로 진출하려면 개발 단계부터 글로벌로 나가야 한다는 시각이 보편화됐다”이라며 “식약처 패싱은 사실 식약처와 아무 관련이 없는 것”이라고 말했다. 미국은 세계 제약시장의 40%를 차지해 가장 큰 시장이다. FDA는 세계에서 가장 까다로운 의약품 심사를 하는 허가기관으로 통한다. FDA를 통과하면 모든 국가의 시장에 진출이 가능하다는 게 일반적 통념이다. 반면 식약처 허가를 받더라도 FDA 허가를 받기 위해서는 글로벌 임상을 또다시 해야 하는 등 식약처 허가의 이점이 크지 않다.국산신약이 더 나오지 않는 것은 거꾸로 국산신약 개발 성공의 타이틀 보유가 별 의미가 없다는 인식이 퍼진 것과도 무관치 않다는 분석이다. 가령 1999년 SK케미칼의 위암 치료제 선플라주가 나올 때만 해도 ‘국산 신약00호’라는 간판이 주는 상징성이 적지 않았다. 이 때문에 실제 약의 효과나 판매 성과에 초점을 두기보다는 ‘간판용’으로 신약을 개발한 뒤 실제 판매에 나서지 않는 약이 나오기도 했다. 사실 국산 신약이 시장에서 성과를 내기 시작한 것은 2010년 보령제약(003850)의 고혈압 치료제 ‘카나브정’이 등장한 이후 LG화학(051910)의 당뇨병 치료제 ‘제미글로정’, 일양약품(007570)의 항궤양 치료제 ‘놀텍정’ 등의 제품에 이르러서라는 게 대체적 시각이다. 이와 함께 동물실험 단계나 임상 1상 등 초기 단계에 후보물질을 글로벌 제약회사에 이전하는 기술수출이 또다른 뚜렷한 신약개발 흐름을 형성하고 있는 것도 식약처 패싱 현상을 부르는 이유로 꼽힌다.노희준 (gurazip@edaily.co.kr)＜ⓒ종합 경제정보 미디어 이데일리 - 무단전재 & 재배포 금지＞",/news/news_read.nhn?article_id=0004632192&office_id=018&mode=search&query=LG화학&page=1
"카카오, 7일 실적 발표 앞두고 기대감BGF리테일, 지난달 매출 상승세 전환셀트리온헬스케어·시노펙스 등 '눈길'","[이데일리 유현욱 기자] 국내 신종 코로나 바이러스 감염증(코로나19) 신규 확진 환자 수가 안정세를 보이고 있지만 황금 연휴 이후에도 이같은 흐름이 이어질지 장담하지 못하고 있다. 이에 증권사들은 코로나19로 반사이익이 예상되는 업종 내 옥석 가리기에 나섰다. 기업들이 1분기 실적을 내놓으면서 코로나19에도 선방한 종목에도 눈길을 보내고 있다.3일 금융투자업계에 따르면 카카오(035720)는 이번 주 SK증권과 유안타증권 등으로부터 복수 추천을 받았다. 코로나19 영향을 일부 받고 있으나 쇼핑, 웹툰, 게임에서 상당 부분을 상쇄하고 있다고 판단했다. 지난해 실적, 주가 상승의 원동력인 채팅창 광고(톡비즈보드) 매출 역시 탄탄하다.카카오는 오는 7일 올해 1분기 실적 발표도 앞두고 있다. 앞서 네이버(035420)는 언택트 소비 증대로 컨센서스를 웃도는 1분기 실적을 올린 바 있다.유안타증권은 코스맥스(192820)도 주간추천주 목록에 올렸다. 세정제 관련 수요 급증에 따라 국내, 미국, 인도네시아법인의 수주 증가 가능성이 있기 때문이다. LG화학에 대해서는 배터리 부문에서 시장점유율 확대 전망이 유효하다며 외형 성장과 설비 가동률 개선에 따라 수익화 국면에 진입했다고 설명했다.SK증권은 시노펙스(025320)도 추천했다. 하반기 신규 고객사로 스마트폰용 FPCB 제품 공급을 결정할 것으로 예상하며 이에 따른 외형성장을 하리라는 기대감에서다.하나금투는 코로나19 사태 방어주인 데다 산업 업사이클 국면 최대 수혜가 예상된다며 BGF리테일을 추천했다. BGF리테일은 지난달 점포당 매출이 지난해 같은 기간보다 상승세로 전환했다. 시장 성장률도 추세적인 회복세다.하나금투는 지난주에도 추천주로 선정했던 셀트리온헬스케어에 대해 4월 발표된 트룩시마 3월 처방액 비중이 7.9%로 기대 이상이라고 평가하며 1분기 실적 기대감이 높아지고 있다고 했다. 기아자동차에 대해서는 신차 기반 판매대수 증가, 환율 효과 등으로 영업이익이 4445억원을 기록, 시장 예상치(컨센서스)를 793억원(21.71%) 웃돌았다며 매수를 권했다.유현욱 (fourleaf@edaily.co.kr)＜ⓒ종합 경제정보 미디어 이데일리 - 무단전재 & 재배포 금지＞",/news/news_read.nhn?article_id=0004632225&office_id=018&mode=search&query=LG화학&page=1
"◇ 국내 NCC, 미국 ECC보다 원가경쟁력 높아","[이데일리 최정희 기자] 2분기부터 화학주(株)가 저유가 수혜를 보면서 업황 턴어라운드를 본격화할 것이란 전망이다. 1분기 실적 악화에도 목표주가를 상향 조정하는 움직임까지 나타나고 있다.(그래픽=김다은 사원)3일 마켓포인트에 따르면 화학주들은 신종 코로나 바이러스 감염증(코로나19)으로 주가가 연 저점을 기록한 이후 최대 두 배 이상 급등했다. 는 3월 19일 연 저점 대비 지난달 29일까지 131.9% 올랐다. 6만원대 주식이 14만원대로 올라섰다. 도 88.2% 반등했다. , 도 각각 74.4%, 63.7% 상승했다.국제유가가 배럴당 10달러대로 급락하면서 원유에서 납사(나프타)를 추출해 에틸렌을 만들어 화학제품을 만드는 ‘나프타분해설비(NCC)’를 갖춘 국내 화학주들이 수혜를 볼 것이란 전망이 나온다. 납사 가격은 작년 4분기 톤당 542달러에서 1분기 447달러, 2분기 191달러로 낮아졌다.원재료 가격인 원유, 납사 가격은 하락하는데 코로나19에 택배 포장이 증가하면서 폴리에틸렌(PE) 수요는 늘어나고 중국의 재고 축적에 PE뿐 아니라 폴리프로필렌(PP)까지 수요가 늘고 있다. 이에 원재료인 납사와 제품인 PE, PP간 가격 차, 즉 스프레드가 벌어지면서 마진율을 개선하고 있다는 분석이다.반면 가스에서 에탄을 뽑아 에탄크래커(ECC) 방식으로 에탄올을 추출하는 미국, 유럽 회사들은 유가 급락에 셰일가스 생산이 줄면서 원재료인 에탄 가격이 올라 원가경쟁력이 낮아지고 있다는 평가다. 메리츠증권에 따르면 납사-에탄 스프레드는 4월 톤당 142달러 수준으로 감소했다. 2016~2018년의 5분의 1 수준으로 축소했다.황유식 NH투자증권 연구원은 “납사 가격이 톤당 200달러 이하에 머무르는 상태에서 에탄가스 가격 급등 시 NCC의 생산 원가가 미국 가스크래커보다 낮아지는 초유의 사태가 발생할 수 있다”고 말했다.코로나19도 화학주에 악재만은 아니었다. 마스크, 손 세정제, 니트릴 장갑 등의 수요가 급증한 탓에 관련 화학제품의 가격은 급등했다. 마스크 앞뒤 면에는 PP를 사용하고 손 세정제는 IPA, 니트릴 장갑엔 NB 라텍스가 필요하다. NB 라텍스 수출량은 1분기 22만3000톤으로 작년 4분기보다 17% 증가했다.윤재성 하나금융투자 연구원은 “NB 라텍스 생산 기준 글로벌 1위 업체(시장점유율 35%) 금호석유의 2분기 합성고무 사업부 영업이익률은 12.2%로 8년래 최대치를 기록할 것”이라고 설명했다. 이어 윤 연구원은 “손세정제용 원료인 IPA 가격 급등에 원재료 아세톤 마진도 급등세를 보이고 있다”고 덧붙였다.LG화학은 1분기 영업이익이 2365억원으로 시장 컨센서스(1590억원)보다 49% 더 많은 이익을 냈는데 원재료 가격 하락과 환율 효과, 아세톤, IPA, NB 라텍스 등의 반사이익이 영향을 미쳤단 분석이다. 하나금융투자와 DB금융투자는 LG화학 목표주가를 각각 38만원, 39만5000원에서 모두 43만원으로 상향 조정했다.1분기 457억원의 영업적자를 낸 대한유화에 대해서도 원가 개선 기대감에 목표가 상향 조정이 나왔다. 함형도 IBK투자증권 연구원은 “5월부터 저가 원재료 투입에 따른 실적 개선을 예상해 2분기 영업이익률이 11.6%로 전망한다”며 목표가를 15만원에서 16만5000원으로 올렸다.다만 화학 업종이 과거 저유가 시절처럼 호황기를 맞을 가능성은 작단 평가도 나온다. 한상원 대신증권 연구원은 “올해와 내년 예정된 신증설의 약 60%가 NCC 설비”라며 “공급 과잉이 이어지리라는 점을 고려하면 화학 업황이 호황기에 진입할 것이란 과도한 기대는 경계할 필요가 있다”고 말했다.최정희 (jhid0201@edaily.co.kr)＜ⓒ종합 경제정보 미디어 이데일리 - 무단전재 & 재배포 금지＞",/news/news_read.nhn?article_id=0004632313&office_id=018&mode=search&query=LG화학&page=1
