title,url,press,summary,date
"삼성바이오로직스, 美제약사 코로나 치료 후보물질 위탁생산",/news/news_read.nhn?article_id=0003280418&office_id=020&mode=search&query=삼성바이오로직스&page=1,동아일보,계약금 4418억… 내년부터 본격 생산 상장후 가장 큰 단일 수주 계약 삼성바이오로직스가 미국 제약업체가 개발하고 있는 신종 코로나바이러스 감염증(코로나19)...,2020-04-11 03:02
기업공시[4월 10일],/news/news_read.nhn?article_id=0003723146&office_id=011&mode=search&query=삼성바이오로직스&page=1,서울경제,"결정 ▲삼성바이오로직스(207940)=미국 비어(Vir) 바이오테크놀로지와 4,418억원 규모 신종 코로나바이러스 감염증(코로나19) 중화항체 제품 임상 및 상업물량......",2020-04-11 08:02
"[제약·바이오 이모저모] 삼성바이오, 코로나 치료제 생산기지로 진화",/news/news_read.nhn?article_id=0004618008&office_id=018&mode=search&query=삼성바이오로직스&page=1,이데일리,"이번 한 주(4월6일~4월10일) 제약·바이오업계에서 주목받은 뉴스다 ◇삼성바이오, 4400억 코로나 치료제 위탁생산 수주 삼성바이오로직스(20...",2020-04-11 12:31
"'코로나19' 백신 이달 국내서 임상…방대본 ""국내 연구환경 지원""",/news/news_read.nhn?article_id=0004580079&office_id=421&mode=search&query=삼성바이오로직스&page=1,뉴스1,"국내 헬스케어 기업인 셀트리온부터 미국의 연구개발회사 리제네론, 최근 삼성바이오로직스와 위탁생산계약을 맺은 비어 등 모두 코로나19에 효과를 보...",2020-04-11 16:26
유동성 장세...호실적 대형주에 투자자 '군침',/news/news_read.nhn?article_id=0004406789&office_id=014&mode=search&query=삼성바이오로직스&page=1,파이낸셜뉴스,"이외에도 외국인은 10일 삼성바이오로직스(1220억원), LG화학(2900만원, 4일 연속 822억원) 등 시가총액 상위 종목에 대한 매수세를 ...",2020-04-11 20:37
