head,text,url
108.51포인트 오른 1566.15에 마감개인 12거래일 연속 ‘사자’…의료정밀 13% 올라시총 상위주 하락세…삼성전자 4.5만원 대로,"[이데일리 김윤지 기자] 20일 코스피지수는 7%대 상승했다. 2008년 금융위기 이후 가장 큰 상승세다. 전날 체결된 한·미 통화스와프가 환율 안정 기대감이란 호재로 작용하면서 이날 코스피 시장에선 ‘매수 사이드카(Side car)’가 발동했다. 코스피 시장은 8년 3개월만이다. 마켓포인트에 따르면 이날 코스피지수는 전 거래일 대비 108.51포인트(7.44%) 오른 1566.15에 마감했다. 7.48%가 상승한 2008년 12월 8일 이후 최대폭 상승이다. 장 시작부터 상승 출발해 오후 들어 상승폭을 키워가나 1566선에 마감했다. 전날 11년 만에 1400선으로 미끄러졌지만 하루 만에 1500 고지를 회복하게 됐다. 전날 폭락장을 불러온 원-달러 환율은 진정되는 모양새를 보여줬다. 이날 원-달러 환율은 서울외환시장에서 전거래일 대비 39.2원 내린 1246.5원에 거래를 마쳤다. 한·미 통화스와프가 상승분을 대부분 되돌려 놨다. 3월20일 코스피 추이(그래프=신한HTS)다만 환율 안정에도 전문가들은 금융시장에 내재한 유동성 경색 우려를 지켜볼 필요가 있다고 말했다. 노동길 NH투자증권 연구원은 “원-달러 환율 하락 및 주식시장 반등에도 외국인은 금일까지 12거래일 연속 코스피 매도를 이어갔다”면서 “외국인의 국내 주식시장 및 채권시장 현물 순매수 추이는 금융위기와 비교했을 때 추가 매도 여력이 있어 주말 사이 1조 달러 재정지출 법안에 대한 미 의회 협상 진행 상황을 확인해야 한다”고 말했다. 유가증권시장에서 개인이 2006억원, 기관이 3068억원을 순매수했다. 외국인이 5856억원을 순매도했다. 프로그램 매매는 차익과 비차익을 합쳐 4934억원 순매도 우위를 기록했다.전 업종이 상승했다. 의료정밀이 13.29% 올라 가장 큰 폭으로 올랐다. 은행과 운수창고가 12%대 올랐다. 비금속광물과 의약품, 건설업 등도 11~10%대 올랐다. 3%대 안팎으로 오른 철강및금속과 통신업이 가장 덜 오른 종목이었다. 시가총액 상위 종목도 일제히 상승했다. LG화학(051910)이 18.48% 올라 전날 하락분을 만회했고, 삼성바이오로직스(207940)도 17.49% 올라 시총 3위를 다시 회복했다. 삼성전자(005930)와 SK하이닉스(000660)가 각각 5%대, 8%대 상승했다. NAVER(035420)가 6.94%, 셀트리온(068270)이 8.93% 올랐다. 종목별로는 25억원 규모의 자사주 장내 취득 결정을 공시한 세진중공업(075580)을 비롯해 AK홀딩스(006840), 지누스(013890) 등이 대폭 상승했다. 전날 급락한 한진칼(180640)(29.84%), 대한항공우(003495)(29.54%) 등 항공주도 크게 올랐다. 전날 유가가 큰 폭으로 오르고 증시까지 반등하면서 하락장에 베팅한 인버스 상장지수펀드(ETF)가 큰 폭으로 하락했다. 이날 거래량은 8억738만주, 거래대금은 10조4886억원으로 집계됐다. 상한가 11개 종목을 포함해 824개 종목이 상승했고 하한가 종목 없이 68개 종목이 하락했다. 8개 종목은 보합권에서 거래를 마쳤다.김윤지 (jay3@edaily.co.kr)＜ⓒ종합 경제정보 미디어 이데일리 - 무단전재 & 재배포 금지＞",/news/news_read.nhn?article_id=0004602121&office_id=018&mode=search&query=NAVER&page=1
"1,566.15로 마감","[서울경제] 코스피가 20일 한미 통화 스와프 계약 체결 소식 등에 힘입어 7% 넘게 반등해 1,560선을 넘었다. 이날 코스피는 전 거래일보다 108.51포인트(7.44%)나 급등한 1,566.15로 마감했다. 지수는 전장보다 40.85포인트(2.80%) 오른 1,498.49로 출발해 상승 폭을 키웠다. 유가증권시장에서 외국인은 5,855억원 규모를 순매도했고 기관은 3,067억원, 개인이 2,006억원 규모를 각각 순매수했다. 미국 연방준비제도(Fed·연준)가 한국을 비롯해 최근 경기 침체 우려가 높아졌던 호주 등 9개국과 통화스와프를 체결하면서 최근 높아졌던 금융시장의 불안감이 진정됐다는 분석이 나온다. 원·달러 환율은 전일보다 39.2원 내린 1,246.5원으로 마감했다. 유가증권시장 시가총액 상위 종목들도 높은 상승세로 장을 마쳤다. 가 5.7% 오른 4만 5,400원을 기록했고 그 외 (8.41%), (17.49%), (6.94%), (8.93%), (18.48%), (1.19%), (5.37%), (7.89%), (18.31%)가 상승 마감했다. 코스닥지수는 전 거래일보다 39.40포인트(9.20%) 오른 467.75로 종료했다. 지수는 전장보다 15.53포인트(3.63%) 오른 443.88로 개장해 급등세를 이어갔다.코스닥시장에서 외국인은 596억원, 기관 1,555억원 규모를 각각 순매수했다. 개인은
2,124억원 규모를 순매도했다. /박경훈기자 socool@sedaily.com저작권자 ⓒ 서울경제, 무단 전재 및 재배포 금지",/news/news_read.nhn?article_id=0003712852&office_id=011&mode=search&query=NAVER&page=1
,"유례없는 패닉장세를 겪고 있는 코스피가 한미 통화스와프 체결과 유가 폭등 소식에 급등세를 보였다. 코스피 시장에서는 9년 만에 매수 사이드카가 발동되는 등 모처럼 강한 반등세가 나타났지만 외국인 투자자가 여전히 순매도세를 보이는 등 불안요인도 상존하는 모습이다. 20일 코스피는 전일 대비 108.51포인트(7.44%) 오른 1566.15에 거래를 마쳤다.
코스피는 지난 6일부터 사상 초유의 투매 장세를 겪었다. 지수는 지난 6일 2060선에서 전날 1450선까지 불과 11거래일 동안 600포인트 넘게 빠졌다. 11거래일 가운데 단 하루를 제외한 10거래일 동안 급락장이 벌어졌고 이 가운데 6거래일은 하락폭이 3%가 넘는 폭락장이었다. 이날은 한미 통화 스와프 체결과 국제유가 폭등 소식에 투자심리가 다소 완화되면서 지수가 급반등하고 있는 것으로 풀이된다. 이날 오전 11시 22분경에는 한국거래소가 선물 가격 상승에 따라 5분간 프로그램 매수호가 효력을 일시 정지하는 매수 사이드카를 발동하기도 했다. 코스피200 선물이 전일 종가 대비 5% 이상 오른 데 따른 것이다. 전날에는 증시 폭락으로 사이드카가, 이날은 매수 사이드카가 발동됐다. 유가증권시장에서 선물 가격 상승에 따른 매수 사이드카가 발동된 것은 지난 2011년 12월 1일 이후 처음이다. 전날 한국은행은 미국 연방준비제도와 양자 간 통화 스와프 계약을 600억달러 규모로 체결하기로 했다고 밝혔다. 기간은 최소 6개월까지다.한은은 ""이번 통화 스와프 계약은 상설계약으로 맺어진 미 연준과 5개국 중앙은행 통화스와프 계약에 더해 최근 급격히 악화된 글로벌 달러자금시장의 경색 해소를 목적으로 한다""고 밝혔다.이번 통화 스와프를 통해 달러 수급불균형으로 불안정을 보였던 외환시장이 크게 안정됐다. 이날 원/달러 환율은 전일 39.20원 내린 1246.50원에 마감했다. 전날 24% 폭락했던 국제유가는 하루 만에 23% 폭등했다. 지난밤 뉴욕상업거래소(NYMEX)에서 4월 인도분 서부 텍사스산 원유(WTI)는 전날보다 배럴당 23.8%(4.85달러) 급등한 25.22달러에 거래를 마쳤다. 로이터통신은 역대 최고 상승이라고 전했다. 국제유가는 24.4% 폭락한 지 불과 하루 만에 23.8% 폭등하는 등 극도의 변동성 장세를 나타내고 있다. 이경민 대신증권 연구원은 ""한미 통화스와프를 통해 연일 패닉장세를 연출하고 있는 한국 금융시장의 불안심리가 일정부분 제어될 것""이라며 ""아직 코스피 추세반전을 논하기는 아직 이르다. 금융위기 당시에도 코스피는 2008년 10월 단기 저점 확인 이후 2009년 3월까지 5개월 간의 박스권 등락이 지속됐다""고 말했다.업종별로 전업종이 상승한 가운데 의료정밀, 은행, 운수창고, 비금속광물, 의약품, 건설업 등이 10% 넘는 급등세를 나타냈다. 매매주체별로 기관과 개인이 각각 3067억원, 2006억원을 순매수했고 외국인은 5855억원을 순매도했다. 프로그램 매매는 4933억원 매도 우위를 나타냈다. 시가총액 상위 종목들도 일제히 급등했다. 삼성바이오로직스, LG화학, 삼성SDI가 17~18% 올랐고 삼성전자, SK하이닉스, NAVER, 셀트리온, 삼성물산, 현대차 등은 5~8% 상승 마감했다.이날 유가증권시장에서는 11개 상한가를 포함해 824개 종목이 상승했고 68개 종목이 하락했다.코스닥은 전일대비 39.40포인트(9.20%) 오른 467.75에 마감했다.[디지털뉴스국 고득관 기자] [ⓒ 매일경제 & mk.co.kr, 무단전재 및 재배포 금지]",/news/news_read.nhn?article_id=0004540782&office_id=009&mode=search&query=NAVER&page=1
코스피 7% 넘게 급등외국인은 여전히 '팔자'원/달러 환율은 급락코스닥도 9% 이상 급등,"[한국경제TV 신재근 기자]코스피가 8거래일 만에 상승 전환했다.20일 코스피는 전 거래일 대비 108.51포인트(7.44%) 오른 1,566.15에 거래를 마쳤다.코스피200 선물 가격의 급등으로 이날 코스피 시장에는 '매수 사이드카'가 발동되기도 했다.개장 전부터 시장은 전날 이뤄진 한-미 통화 스와프 협정 체결을 주목했다.달러 유출로 환율 변동성이 급격히 확대된 상태에서 통화 스와프가 환율 폭등세를 잠재울 수 있을지 관심이 모아졌기 때문이다.개장과 함께 코스피는 3% 이상 오르며 단숨에 1,500선을 탈환했다.노동길 NH투자증권 연구원은 ""전날 가파른 주가 하락에 따른 매수 심리와 원/달러 환율의 하락이 국내 주식시장 반등으로 이어졌다""고 분석했다.이날 서울 외환시장에서 원/달러 환율은 전날보다 39.2원 내린 달러당 1,246.5원에 종가가 결정됐다.코스피가 큰 폭으로 상승했지만 외국인은 여전히 팔자 기조를 이어갔다.외국인(-5,854억원)은 코스피에서 6천억원 가까이 팔아치우며 12거래일 연속 순매도를 기록했다.외국인이 이 기간 순매도한 금액만 9조원이 넘는다.아직 코스피가 추세적인 상승을 기대하기에는 무리가 있다는 분석이 나오는 이유다.개인(1,994억원)과 기관(3,077억원)은 전기·전자와 제조 업종을 중심으로 순매수했다.코스피 시가총액 상위 10개 종목은 기술적 반등으로 전 종목이 상승 마감했다.코스피 양대산맥인 삼성전자(5.70%)와 SK하이닉스(8.41%)가 크게 올랐고, 삼성바이오로직스(17.49%)와 LG화학(18.48%), 삼성SDI(18.31%)는 급등했다.이어 NAVER(6.94%)와 셀트리온(8.93%), LG생활건강(1.19%), 삼성물산(5.37%), 현대차(7.89%)도 상승 전환했다.코스닥은 9% 이상 급등했다.이날 코스닥지수는 전장보다 39.40포인트(9.20%) 오른 467.75에 장을 마쳤다.코스피와 마찬가지로 코스닥 시장에도 '매수 사이드카'가 발동됐다.전날 10% 이상 하락한 데 따른 반발 매수세가 유입된 데 따른 것으로 보인다.외국인(596억원)과 기관(1,555억원)이 순매수로 지수를 끌어올렸고, 개인(-2,124억원)은 2천억원이 넘는 주식을 순매도했다.업종별로는 IT와 제조업 등에 외국인과 기관의 매수세가 몰렸다.코스닥 시총 상위주도 모두 올랐다.셀트리온헬스케어(9.09%)와 에이치엘비(5.20%), 펄어비스(4.47%), 스튜디오드래곤(9.70%), CJ ENM(11.29%), 케이엠더블유(12.05%), 씨젠(1.19%), 휴젤(15.77%), SK머티리얼즈(11.80%), 헬릭스미스(7.60%) 등이 전날의 낙폭을 일부 만회했다.신재근기자 jkluv@wowtv.co.krⓒ 한국경제TV, 무단 전재 및 재배포 금지",/news/news_read.nhn?article_id=0000857714&office_id=215&mode=search&query=NAVER&page=1
코스피 강세…전장 대비 7.44% 오른 1566.15 마감,"[더팩트ㅣ박경현 기자] 국내 증시가 급등하며 장 후반으로 갈수록 상승폭을 키웠다. 코스피 시장에서는 장중 한 때 코스피200선물이 5% 이상 상승해 '매수 사이드카'가 발동했다.20일 코스피는 반등 출발했다가 상승세를 유지하며 전장 대비 108.51포인트(+7.44%) 오른 1566.15에 마감했다.이날 외국인은 5850억 원을 팔아치우며 매도세를 키웠으나 개인과 기관이 각각 2010억 원, 3063억 원을 사들이며 상승세를 높였다.이날 오전 11시 22분에는 코스피200선물이 전일종가 197.50포인트에서 208.00포인트로 10.50포인트(5.31%) 상승한 후 1분간 지속되자 사이드카가 발동 됐다. 유가증권시장에서 매수 사이드카가 발동한 것은 지난 2011년 이후 처음이다.시가총액은 상위 20위까지 전부 상승했다. 삼성전자는 전 거래일 대비 5.70%까지 상승해 4만5400원에 장을 마감했다. 뒤를 이어 SK하이닉스(+8.41%), 삼성전자우(+7.19%), 삼성바이오로직스(+17.49%), NAVER(+6.94%), 셀트리온(+8.93%), LG화학(+18.48%), LG생활건강(+1.19%), 삼성물산(+5.37%), 현대차(+7.89%) 등 우량주들이 크게 올랐다.이날 업종은 담배(-1.74%)를 제외한 전 업종이 큰 폭으로 상승했다. 특히 독립전력생산 및 에너지거래(+22.54%), 항공사(+21.42%), 문구류(+18.30%), 해운사(+18.28%), 전기제품(+16.50%)을 비롯해 다수 업종이 10%가량 올랐다.이날 코스닥은 전 거래일 대비 39.40포인트(+9.20%)까지 오른 467.75에 거래를 마감했다.코스닥 시장에서는 개인 홀로 2125억 원을 매도한 반면 외국인과 기관이 각각 591억 원, 1555억 원을 매수했다.이날 코스닥시장 시가총액별 등락은 상위 70위까지 오르거나 보합 마감했다. 특히 상위 10위권 종목인 셀트리온헬스케어(+9.09%), 에이치엘비(+5.20%), 스튜디오드래곤(+9.70%), CJ ENM(+11.29%), 케이엠더블유(+12.05%), 씨젠(+1.19%), 휴젤(+15.77%), SK머티리얼즈(+11.80%), 헬릭스미스(+7.60%)가 큰 폭으로 오르며 장을 마감했다.pkh@tf.co.kr저작권자 ⓒ 특종에 강한 더팩트 & tf.co.kr 무단 전재 및 재배포 금지",/news/news_read.nhn?article_id=0000019669&office_id=629&mode=search&query=NAVER&page=1
▶ 네이버 홈에서 [한국경제TV] 채널 구독하기 [생방송보기]▶ 대한민국 재테크 총집결! - [증권 / 주식상담 / 부동산],"[한국경제TV 박준식 기자]코스피가 한미 통화스와프 체결에 반등으로 화답했다.20일 코스피가 7%를 넘는 큰 폭의 오름세로 장을 마쳤다전 거래일보다 108.51포인트(7.44%)나 급등한 1,566.15로 마감하며 8거래일 만에 반등에 성공했다.이날 코스피는 40포인트 넘게 오른 1,498.49로 출발하며 상승세를 예고했다.장중 한 때 코스피200 선물, 코스닥150 선물·현물가격이 급등해 프로그램 매수호가의 효력을 실시 정지하는 매수 사이드카가 동시 발동되기도 했다.시가총액 상위 10개 종목은 기술적 반등으로 전 종목이 상승 마감했다.삼성전자(5.70%)와 SK하이닉스(8.41%)의 상승폭이 컸고, 삼성바이오로직스(17.49%)와 LG화학(18.48%), 삼성SDI(18.31%)도 급등했다.NAVER(6.94%)와 셀트리온(8.93%), LG생활건강(1.19%), 삼성물산(5.37%), 현대차(7.89%)도 상승 전환했다.그러나 이날도 외국인은 5,851억원을 순매도하며 12거래일 연속 '팔자 행진'을 이어갔다.반면 개인은 2,006억원, 기관은 3,068억원을 각각 순매수했다.코스닥지수는 전 거래일보다 39.40포인트(9.20%) 오른 467.75로 종료했다.지수는 전장보다 15.53포인트(3.63%) 오른 443.88로 개장해 급등세를 이어갔다.코스피와 마찬가지로 '매수 사이드카'가 발동되기도 했다.외국인이 591억원, 기관이 1천555억원을 순매수하는 동안 개인은 2천125억원을 순매도했다.한편 이날 서울 외환시장에서 원/달러 환율은 전날보다 39.2원 내린 달러당 1,246.5원에 종가가 결정됐다.박준식기자 parkjs@wowtv.co.krⓒ 한국경제TV, 무단 전재 및 재배포 금지",/news/news_read.nhn?article_id=0000857717&office_id=215&mode=search&query=NAVER&page=1
[시황종합] 양 시장 급등에 매수 사이드카달러/원 환율 39.2원 내린 1246.5원,"(서울=뉴스1) 박응진 기자,전민 기자 = 한미 통화스와프 체결에 힘입어 주가와 원화 가치가 오랜만에 급상승했다. 20일 코스피는 7% 넘게 오르며 1560선에 올랐다. 코스피 시장 시가총액은 하루 만에 1000조원을 회복했다. 코스닥은 9% 이상 급등했다. 달러/원 환율은 40원 가까이 내렸다. 전날(19일) 밤 600억달러 규모의 한미 통화스와프가 체결되면서 국내 금융시장이 한숨을 돌린 모습이다. 이날 코스피는 전날(19일)과 비교해 108.51포인트(7.44%) 오른 1566.15로 마감했다. 지난 10일 이후 8거래일 만의 상승 마감이다. 코스피시장 시가총액은 전날(982조1697억원)보다 72조7231억원 가량 늘어난 1054조8928억원을 기록했다. 전날 약 8년5개월 만에 1000조원이 붕괴됐는데, 하루 만에 회복한 것이다. 기관과 개인이 각각 3068억원, 2006억원 순매수했고, 외국인이 홀로 5856억원 순매도했다. 개인은 12거래일 연속 순매수, 외국인은 12거래일 연속 순매도 행렬을 이었다. 기관은 2거래일 연속 순매수했다. 코스피 시가총액 상위 10개 종목은 모두 올랐다. 상승률은 LG화학(18.48%), 삼성바이오로직스(17.49%), 셀트리온(8.93%), SK하이닉스(8.41%), 현대차(7.89%), 삼성전자우(7.19%), NAVER(6.94%), 삼성전자(5.70%), 삼성물산(5.37%), LG생활건강(1.19%) 순으로 높았다. 업종별로 보면 의료정밀(13.29%), 은행(12.54%), 운수창고(12.03%), 비금속광물(11.56%) 등 순으로 상승률이 높았다. 코스닥은 전날 대비 39.40포인트(9.20%) 뛴 467.75로 마감했다. 지난 17일 이후 3거래일 만의 상승 마감이다. 기관과 외국인이 각각 1555억원, 597억원 순매수했고, 개인이 홀로 2125억원 순매도했다. 코스닥시장 시가총액은 171조3511억원으로 집계됐다.코스닥 시가총액 상위 10개 종목도 모두 올랐다. 상승률은 휴젤(15.77%), 케이엠더블유(12.05%), SK머티리얼즈(11.80%), CJ ENM(11.29%), 스튜디오드래곤(9.70%), 셀트리온헬스케어(9.09%), 헬릭스미스(7.60%), 에이치엘비(5.20%), 펄어비스(4.47%), 씨젠(1.19%) 순으로 높았다. 업종별로는 기타제조(15.22%), 컴퓨터서비스(13.18%), 방송서비스(12.63%), 인터넷(12.56%), 반도체(11.53%) 등 순으로 높았다. 이날 점심 시간 전후로 코스피·코스닥 시장에서는 각각 매수 사이드카(프로그램매매 호가 효력정지)가 발동돼 5분 간 프로그램매수호가가 정지됐다. 코스피 시장에서 주가가 상승해 사이드카가 발동된 것은 지난 2011년 12월1일 이후 약 8년3개월만이다. 코스닥 시장에서의 매수 사이드카 발동은 2018년이 마지막이었다.노동길 NH투자증권 연구원은 이날 국내 주식시장 급반등에 대해 ""전날 가파른 주가 하락에 따른 매수 심리, 원/달러 환율 하락 때문일 듯하다""고 분석했다. 외국인의 순매도 행렬에 대해서는 ""국내 주식시장 및 채권시장 현물 순매수 추이는 금융위기와 비교했을 때 추가 매도 여력을 갖고 있다""며 ""주말 새 1조달러 재정지출 법안에 대한 미 의회 협상 진행 상황을 확인해야 한다""고 했다.서울외환시장에서 달러/원 환율은 전날보다 39.2원 급락한 1246.5원으로 거래를 마쳤다.(원화 가치 상승) 32원 내린 1253.7원으로 출발해 장중 하락폭이 더욱 커졌다. 달러/원 환율은 전날 40원 급등하며 10년6개월 만의 최고치인 1285.7원을 기록했으나, 한미 통화스와프 체결로 전날 급등분을 반납했다.김효진 KB증권 연구원은 ""2008년 원화 가치 안정에 기여했던 미국과의 통화스와프 체결로 원화 가치는 안정될 것이 기대된다""면서 ""달러 강세와 글로벌 금융불안으로 원화가 재차 불안해질 가능성도 남아 있으나, 3분기로 가면서 달러/원은 하락하며 안정되는 흐름을 예상한다""고 밝혔다.한국은행은 미국 연방준비제도이사회(Fed, 연준)와 전날 밤 600억달러 규모의 양자 간 통화스와프 계약을 체결했다고 발표했다. 이는 최근 급격히 악화된 글로벌 달러 자금시장의 경색 해소를 위한 비상 조치로, 비상용 마이너스 통장을 개설하는 것과 비슷하다. 글로벌 금융위기였던 2008년 10월30일 체결에 이어 2번째다. 계약 기간은 최소 6개월(9월19일까지)이다. 간밤 뉴욕증시는 각국이 내놓은 위기 대응책에 대한 긍정적 평가가 이어지는 등 신종 코로나 바이러스 감염증(코로나19) 공포가 다소 누그러진 영향으로 소폭 반등했다. 다우지수는 189.63포인트(0.95%) 오른 2만0088.55를 기록했다. 스탠다드앤푸어스(S&P)500 지수도 11.4포인트(0.48%) 상승한 2409.5, 나스닥 지수 역시 160.73포인트(2.3%) 오른 7150.58에 거래를 마쳤다.pej86@news1.kr© 뉴스1코리아(), 무단 전재 및 재배포 금지",/news/news_read.nhn?article_id=0004534759&office_id=421&mode=search&query=NAVER&page=1
"코스피.코스닥 '매수' 사이드카 발동되며 폭등세외국인 12거래일 연속 순매도 행진은 여전히 부담한미 600억 달러 규모 통화스와프 체결 영향1300원선 위협하던 원달러 환율, 1246.5원으로 하락 美 코로나19 확진자 수 증가, 경기위축 우려 여전","[CBS노컷뉴스 임진수 기자]전날 1500선이 붕괴되며 '패닉'을 맛봤던 국내 증시가 20일 극적인 반등에 성공했다. 코스피 지수는 11년 만에 최대 상승률을 기록했다.이날 코스피 지수는 전 거래일 보다 108.51포인트(7.44%) 상승한 1566.15로 거래를 마쳤다. 코스피 지수가 1거래일 만에 7% 넘게 상승한 것은 지난 2008년 12월 이후 11년 만이다.전날 133.56포인트나 하락하며 사상 최대 하락폭을 기록한지 한지 하루 만에 다시 100포인트 넘는 상승률을 기록한 것.또, 코스피200 선물(최근월물)이 전 거래일 대비 5% 이상 급등하며 프로그램 매매가 중단되는 매수 사이드카가 발동되기도 했다. 1500선이 무너진 전날을 비롯해 최근 폭락장이 이어지며 몇차례 '매도' 사이드카가 발동되기는 했지만 주가가 올라 '매수' 사이드카가 발동된 것은 지나 2011년 12월 이후 처음이다.코스닥 지수 역시 39.40포인트(9,20%) 폭등한 467.75에 장을 마쳤다. 코스닥도 역시 선물 가격이 급등하며 지난 2018년 2월 이후 12년 만에 매수 사이드카가 발동됐다.시가총액 상위종목 가운데는 삼성전자(5.70%), SK하이닉스(8.41%), 현대차(7.89%), NAVER(6.94%), 셀트리온(8.93%) 등이 큰 폭의 상승률을 보였다.특히, LG화학(18.48%), 삼성SDI(18.31%), SK이노베이션(13.09%) 등 국내 2차전지 대표 3총사의 주가가 10% 이상 급등했다. 삼성바이오로직스 주가도 17.49% 폭등했다.이날도 코스피 시장에서 외국인의 매도행렬은 멈추지 않았다. 다만 순매도 규모가 5847억원으로 이전에 비해 다소 줄었다. 개인은 1981억원, 기관은 3084억원을 순매수했다.외국인은 지난 5일부터 12거래일 연속 순매도 행진을 이어가고 있으며 최근 한달간 순매도 누적액만 13조 2천억원에 달한다. 같은 시기 개인은 11조 9천억원을 순매수했다.이날 상승장은 전날 저녁 발표된 한미간 600억 달러 규모의 통화스와프 체결 합의에 따른 것으로 외환 수급의 불균형 우려가 일단 해소됐기 때문으로 분석된다.실제로 원달러 환율은 전날 1300원선을 위협하던 폭등세가 진정되며 큰 폭으로 하락했다. 이날 서울외환시장에서 원달러 환율은 전 거래일 대비 39.20원 내린 1246.50에 마감했다.다만, 아직 유럽과 미국에서 코로나19 확산세가 멈추질 않고 있고, 이로인한 실물경제 위축 우려가 큰 만큼 당분간 주가 변동성을 키울 수밖에 없을 것으로 전망된다.키움증권 서상영 투자전략팀장은 ""다음주에도 코로나19 확진자가 계속 늘어나면서 변동성을 키울 수밖에 없다""면서 ""또, 다음주에 우리나라 수출입 동향, 독일과 미국 등 주요국 제조업 지표가 나쁘게 나올 수밖에 없어 경기침체 이슈가 재부각될 것""이라고 설명했다.jslim@cbs.co.kr저작권자 © CBS 노컷뉴스 무단전재 및 재배포 금지",/news/news_read.nhn?article_id=0003338911&office_id=079&mode=search&query=NAVER&page=1
