head,text,url
,"[스포츠서울] Q. 가정주부 A(40).그녀는 몇 년 전 집을 처분하고, 전셋집에 살고 있다. 그래서 올해는 꼭 내 집 마련을 하려고 계획하고 있다. 하지만 코로나19 사태 때문에 집 장만을 할까, 말까? 고민하고 있다. 남편은 코로나19 사태가 진정될 때까지 내 집 마련을 늦추자고 한다. 코로나19 사태가 부동산 시장에는 어떠한 영향을 주는 것인지, 그리고 내 집 마련 시점은 언제쯤이 좋은지 궁금하다.A. 코로나19 사태로 인해 국내외 경제가 출렁이고 있다. 미국을 비롯한 유럽, 그리고 우리나라 주식시장은 변동성이 커지고 있다. 부동산 시장도 지난달부터 매수세가 줄어들면서 급매물이 나오기 시작했다. 일부에서는 1997년 IMF 때와 2008년 금융위기 때처럼, 이번 코로나19 사태로 인해 부동산 가격이 큰 폭으로 떨어질 것이라고 우려하는 목소리도 있다.그렇다. 코로나19 사태가 장기화될 경우에는 IMF나 금융위기 못지 않은 충격이 올 수도 있다. 그런데 이때 가장 직접적으로 영향을 받는 것은 상가·오피스·꼬마빌딩 등 수익형 부동산이 될 것으로 보인다. 왜냐하면, 온라인을 통해 상품을 구매하는 소비가 늘어나게 되면, 기존 상권은 침체될 수 있다. 그러면 수익형 부동산 시장은 다소 타격이 있을 것으로 보인다. 코로나19 사태가 아파트 시장에도 분명히 심리적인 영향은 줄 것이다. 그 영향으로 거래량은 급감할 수 있다. 그러면 가격도 당연히 조정받을 수 있다. 다시 말해 지난 2~3년간 급격하게 오른 서울 강남지역은 급매물 위주로 아파트 가격이 다소 조정될 것으로 보인다. 반면, 9억원 이하 중저가 아파트는 실수요자 시장이기 때문에 그 영향은 미미할 것 같다. 최근 아파트 거래량이 줄어든 것은 주택공급이 늘거나 수요가 줄어서 생긴 게 아니다. 코로나19라는 외부적 요인에 의한 영향이 큰 편이다. 즉, 코로나가 종식되면 아파트 시장은 종전처럼 우상향할 것으로 보인다. 따라서 코로나19 사태를 핑계로 내 집 마련을 미뤄뒀다가 내 집 마련 시점을 놓치는 우를 범하지 말아야 한다. 자금계획이 서있는 실수요자는 급매물 위주로 매수에 나서는 것이 좋다. 특히 상반기에 분양예정에 있는 아파트는 적극적으로 청약에 나서는 것이 유리하다. 참고로 기준금리의 인하는 분명 아파트 시장에는 호재다. 그런데 그 효과는 지역에 따라 차이가 다르게 나타날 것이다. 그 이유는 겹겹이 주택담보대출을 규제하고 있기 때문이다. 수도권 및 지방의 경우 9억원 미만 아파트가 많기 때문에 분명 금리 인하는 시장에 호재가 될 것이다. 하지만 9억원 이상의 아파트가 많은 서울지역은 금리 인하에 따른 영향은 제한적일 것으로 보인다. 카페 ‘Go부자’ (https://cafe.naver.com/gobuja6788)[기사제보 news@sportsseoul.com]
Copyright ⓒ 스포츠서울&",/news/news_read.nhn?article_id=0000638346&office_id=468&mode=search&query=NAVER&page=2
개인 12거래일 연속 ‘사자’…은행·화학↑시총 상위주 일제히 상승세,"[이데일리 김윤지 기자] 20일 코스피지수는 상승 출발했다. 전날 미 중앙은행인 연방준비제도(Fed·연준)이 한국을 포함해 9개국 중앙은행과 통화스와프 계약을 체결하면서 시장 관계자들의 불안 심리를 일부 진정시킨 것으로 보인다. 이날 마켓포인트에 따르면 오전 9시7분 현재 코스피지수는 전 거래일 대비 38.75포인트(2.66%) 오른 1496.39를 기록 중이다. 서상영 키움증권 연구원은 한미 통화스와프 계약이 주식시장에 긍정적인 영향을 미쳤다고 봤다. 서 연구원은 “코로나19로 인한 실물경제 타격으로 그 효과는 제한될 수 있지만 최근 공포에 휩싸인 금융시장 안정 가능성은 높다”고 말했다. 유가증권시장에서 기관은 83억원, 외국인은 13억원을 순매도 중이다. 개인은 108억원을 순매수 중이다. 프로그램 매매는 차익과 비차익을 합쳐 158억원 순매도 우위를 기록 중이다.전 업종이 상승 중이다. 은행이 5%대 상승 중으로 화학, 의료정밀, 증권, 비금속광물, 음식료품이 4%대 상승세를 보이고 있다. 운수창고, 서비스업, 통신업, 철강및금속, 기계가 2%대 올라 가장 덜 오른 업종이다. 시가총액 상위 종목도 상승세다. LG화학(051910)이 6%대 오르는 가운데 삼성전자(005930) SK하이닉스(000660) NAVER(035420)가 2%대 오름세다. 셀트리온(068270)은 3%대 오르고 있다. 전일 뉴욕증권거래소(NYSE)에서 다우존스 30 산업평균지수는 전 거래일 대비 188.27포인트(0.95%) 오른 2만87.19에 거래를 마쳤다. 하루 만에 2만 선을 되찾았다. 스탠더드앤드푸어스(S&P) 500지수와 기술주 중심의 나스닥 지수도 각각 11.29포인트(0.47%)와 160.73포인트(2.3%) 상승한 2409.39와 7150.58에 장을 마감했다.김윤지 (jay3@edaily.co.kr)＜ⓒ종합 경제정보 미디어 이데일리 - 무단전재 & 재배포 금지＞",/news/news_read.nhn?article_id=0004601675&office_id=018&mode=search&query=NAVER&page=2
,"유례없는 패닉장세를 겪고 있는 코스피가 한미 통화스와프 체결 소식에 급등세를 나타내고 있다. 특히 그동안 폭락장세를 이끌었던 외국인 투자자가 모처럼 순매수로 돌아서면서 기관 투자자와 함께 쌍끌이 저가 매수에 나서고 있다. 20일 오전 9시 5분 현재 49.40포인트(3.39%) 오른 1507.04를 기록하고 있다.코스피는 지난 6일부터 사상 초유의 투매 장세를 겪었다. 지수는 지난 6일 2060선에서 전날 1450선까지 불과 11거래일 동안 600포인트 넘게 빠졌다. 11거래일 가운데 단 하루를 제외한 10거래일 동안 급락장이 벌어졌고 이 가운데 6거래일은 하락폭이 3%가 넘는 폭락장이었다. 이날은 한미 통화 스와프 체결과 국제유가 폭등 소식에 투자심리가 다소 완화되면서 지수가 급반등하고 있는 것으로 풀이된다. 전날 한국은행은 미국 연방준비제도와 양자 간 통화 스와프 계약을 600억달러 규모로 체결하기로 했다고 밝혔다. 기간은 최소 6개월까지다.한은은 ""이번 통화 스와프 계약은 상설계약으로 맺어진 미 연준과 5개국 중앙은행 통화스와프 계약에 더해 최근 급격히 악화된 글로벌 달러자금시장의 경색 해소를 목적으로 한다""고 밝혔다.연준은 캐나다, 영국, 유럽(ECB), 일본, 스위스 등 6개국 중앙은행과 통화 스와프 계약을 맺은 상태다. 연준은 한국 이 외에도 덴마크, 노르웨이, 스웨덴, 호주, 뉴질랜드, 브라질, 멕시코 중앙은행 및 싱가포르 통화청 등 9개국과 스와프계약을 새로 체결했다.이번 통화 스와프를 통해 조달된 미 달러가 곧바로 공급되면 달러 수급불균형으로 불안정을 보였던 외환시장에 안정을 주는 효과를 기대해볼 수 있다. 시장에서도 이번 한미 통화스와프만으로 주식시장의 흐름을 바꿀수는 없겠지만, 안전판을 확보했다는 점에서 긍정적이라는 분석을 내놓고 있다.
전날 24% 폭락했던 국제유가는 하루 만에 23% 폭등했다. 지난밤 뉴욕상업거래소(NYMEX)에서 4월 인도분 서부 텍사스산 원유(WTI)는 전날보다 배럴당 23.8%(4.85달러) 급등한 25.22달러에 거래를 마쳤다. 로이터통신은 역대 최고 상승이라고 전했다. 국제유가는 24.4% 폭락한 지 불과 하루 만에 23.8% 폭등하는 등 극도의 변동성 장세를 나타내고 있다. 이경민 대신증권 연구원은 ""한미 통화스와프를 통해 연일 패닉장세를 연출하고 있는 한국 금융시장의 불안심리가 일정부분 제어될 것""이라며 ""아직 코스피 추세반전을 논하기는 아직 이르다. 금융위기 당시에도 코스피는 2008년 10월 단기 저점 확인 이후 2009년 3월까지 5개월 간의 박스권 등락이 지속됐다""고 말했다.업종별로 전업종이 상승하는 가운데 화학, 은행, 증권, 의약품 등이 4~5% 급등하고 있다. 매매주체별로 외국인과 기관이 각각 61억원, 121억원을 순매수하고 있고 개인은 174억원을 순매도하고 있다. 프로그램 매매는 36억원 매도 우위다.시가총액 상위 종목들은 일제히 급등세다. 삼성전자, SK하이닉스, 삼성바이오로직스, NAVER, 셀트리온, LG생활건강, LG화학 등이 2~6% 오르고 있다.이날 유가증권시장에서는 786개 종목이 상승하고 있고 78개 종목이 하락하고 있다.코스닥은 전일대비 20.20포인트(4.72%) 오른 448.55를 기록 중이다.[디지털뉴스국 고득관 기자] [ⓒ 매일경제 & mk.co.kr, 무단전재 및 재배포 금지]",/news/news_read.nhn?article_id=0004540401&office_id=009&mode=search&query=NAVER&page=2
LG화학 7%대 강세 눈에 띄네,"[아이뉴스24 한수연 기자] 코스피가 상승 출발한 가운데 시가총액 상위종목도 일제히 반등하고 있다.20일 오전 9시20분 현재 유가증권시장에서 LG화학은 전 거래일 대비 7.39%(1만7천원) 뛴 24만7천원에 거래되고 있다. 삼성바이오로직스(4.78%)와 LG생활건강(3.65%), NAVER(3.47%), 셀트리온(3.21%) 등도 3%대 강세를 나타내는 중이다.대장주 삼성전자는 전일 낙폭을 만회하려는 듯 2.91%(1천250원) 상승한 4만4천200원을 기록 중이다. 이외에도 SK하이닉스(2.91%), 현대차(2.43%), 삼성물산(2.09%) 등도 2% 넘게 오르고 있다.이날 코스피는 전일 대비 2.80%(40 87포인트) 오른 1498.49에 거래를 시작하며 개장 직후 1500선을 돌파했다가 이내 1400대에서 주춤하는 모습이다. papyrus@inews24.com [ⓒ 아이뉴스24 무단전재 및 재배포 금지]",/news/news_read.nhn?article_id=0000530529&office_id=031&mode=search&query=NAVER&page=2
,"손희연 기자 son90@mt.co.kr
<저작권자 ⓒ '성공을 꿈꾸는 사람들의 경제 뉴스' 머니S, 무단전재 및 재배포 금지>",/news/news_read.nhn?article_id=0000520337&office_id=417&mode=search&query=NAVER&page=1
▶ 네이버 홈에서 [한국경제TV] 채널 구독하기 [생방송보기]▶ 대한민국 재테크 총집결! - [증권 / 주식상담 / 부동산],"[한국경제TV 라이온봇 기자]20일 오전 인터넷 포털 1위의 네이버 운영업체로 알려진 NAVER(035420)이 큰 폭으로 상승했다.2.43% 상승출발한 주가는 꾸준히 올라 오전 10시 28분 현재 전일대비 5.21% 수준인 15만1500원을 기록하고 있다.차트를 살펴보면 5일, 20일, 60일 이동평균선이 역배열 상태로 하락 추세를 이어오다가 주가가 반등하는 모습이다.거래량은 19만2238주로 전거래일 대비 16.66% 수준이다.이는 NAVER 전체 주식수의 0.12%에 해당하는 물량이다.이 시각 거래소에서 NAVER 이외에도 덕산네오룩스(16.91%), 삼성전자우(5.5%), 하이록코리아(13.97%), 메지온(5.96%), 센트랄모텍(8.97%) 등이 상승세를 보이고 있다.※ 본 기사는 한국경제TV와 `금융 AI 전문기업 씽크풀`이 실시간으로 작성한 기사입니다.라이온봇기자 ⓒ 한국경제TV, 무단 전재 및 재배포 금지",/news/news_read.nhn?article_id=0000857482&office_id=215&mode=search&query=NAVER&page=1
,"일봉 차트의 모습은 단기와 중기 모두 역배열 구간에서 하락 추세를 이어오다가 반등하는 모습이다.최근 이 종목의 차트에서 단기급락 후 5MA 상향돌파, 주가 5MA 상향돌파 등의 특이사항이 발생했다.NAVER은 인터넷 포털 1위의 네이버 운영업체로 알려져 있다.한경로보뉴스이 기사는 한국경제신문과 금융 AI 전문기업 씽크풀이 공동 개발한 기사 자동생성 알고리즘에 의해 실시간으로 작성된 것입니다.▶ ▶
 ▶
ⓒ 한국경제 & , 무단전재 및 재배포 금지",/news/news_read.nhn?article_id=0004310002&office_id=015&mode=search&query=NAVER&page=1
"장중 1500선 넘기도, 10시 40분 현재 2%대 상승률원달러 환율 25.5원 하락한 1260.2원, 한.미 통화스와프 영향","[CBS노컷뉴스 임진수 기자]전날 사상 최대 하락폭을 기록했던 코스피가 20일 외국인 투자자들의 매도세가 주춤해지며 2%대 상승률을 보이고 있다.이날 코스피 지수는 전 거래일 대비 40.85포인트(2.8%) 상승한 1498.49로 장을 시작해 등락을 거듭하다 오전 10시 40분 현재 전 거래일 대비 41.14포인트(2.82%) 상승한 1498.78을 기록하고 있다. 장중 전날 무너진 1500선을 탈환하기도 했다.코스닥 지수도 전 거래일 대비 15.53포인트(3.63%) 오른 443.88로 출발한 뒤 같은 시각 16.06포인트(3.75%) 오늘 444.41에 거래되고 있다.시가총액 상위종목 가운데는 삼성전자와 SK하이닉스, 삼성바이오로직스, NAVER 등의 종목이 3~8%대 상승폭을 기록하고 있다.특히 전날 유럽공장 셧다운 우려로 10% 넘게 폭락했던 LG화학, 그리고 삼성SDI 등은 10%대 상승률을 기록하고 있다.이날도 코스피 시장에서 개인은 348억원을 순매수하며 지수 상승을 이끌고 있다. 기관도 37억원을 순매수 중이다.외국인은 여전히 매도세가 강하지만 이전에 비해 순매도 규모가 크게 줄었다. 오전 10시 40분 현재 외국인은 414억원을 순매도 중이다.코스닥 시장에서는 전날과 마찬가지로 외국인과 기관인 각각 569억원과 211억원을 순매수 중이지만 개인이 664억원을 순매도하고 있다.원달러 환율도 하락하며 안정을 찾아가는 모양새다. 이날 10시 35분 현재 서울 외환시장에서 원달러 환율은 전 거래일 대비 25.5원 내린 1260.2원에 거래되고 있다.이날 주가 상승과 원달러 환율 하락은 전날 저녁 한국과 미국이 600억달러 규모의 통화스와프에 합의하며 외환시장이 안정된데 따른 것으로 분석된다.jslim@cbs.co.kr저작권자 © CBS 노컷뉴스 무단전재 및 재배포 금지",/news/news_read.nhn?article_id=0003338644&office_id=079&mode=search&query=NAVER&page=1
▶ 네이버 홈에서 [한국경제TV] 채널 구독하기 [생방송보기]▶ 대한민국 재테크 총집결! - [증권 / 주식상담 / 부동산],"[한국경제TV 라이온봇 기자]20일 오전 국내 1위의 항공운송기업로 알려진 대한항공(003490)이 큰 폭으로 상승했다.보합으로 출발한 주가는 장중 한 때, 1만2800원(-5.88%)까지 밀렸다가 다시 회복하여 현재는 5.51% 상승한 1만4350원을 기록하고 있다.차트를 살펴보면 단기·중기 역배열 구간에서 하락세가 이어지다가 주가가 반등하는 모습을 보여주고 있다.거래량은 전거래일 대비 44.08% 수준인 230만5742주를 넘어서고 있다.이 종목 전체 주식수의 2.43%에 해당하는 물량이다.이 시각 거래소에서 대한항공 이외에도 진양폴리(5.3%), NAVER(6.94%), SK바이오랜드(5.23%), 셀리버리(8.6%), KR모터스(6.12%) 등이 상승세를 보이고 있다.※ 본 기사는 한국경제TV와 `금융 AI 전문기업 씽크풀`이 실시간으로 작성한 기사입니다.라이온봇기자 ⓒ 한국경제TV, 무단 전재 및 재배포 금지",/news/news_read.nhn?article_id=0000857525&office_id=215&mode=search&query=NAVER&page=1
▶ 네이버 홈에서 [한국경제TV] 채널 구독하기 [생방송보기]▶ 대한민국 재테크 총집결! - [증권 / 주식상담 / 부동산],"[한국경제TV 라이온봇 기자]20일 오전 제일기획(030000)이 급등세를 보이고 있다. 제일기획은 국내 광고 취급고 1위의 광고대행사로 알려져 있다.2.94% 상승출발한 주가는 장중 한 때, 1만1700원(-1.68%)까지 하락하였지만 다시 회복하여 현재는 5.04% 상승한 1만2500원을 기록하고 있다.차트를 살펴보면 단기·중기 역배열 구간에서 하락세가 이어지다가 주가가 반등하는 모습을 보여주고 있다.오늘 제일기획은 전체 주식수의 0.25%에 해당하는 29만2622주가 거래되고 있는데 전일 거래량 대비 23.28% 수준이다.11시 10분 잠정집계에 따르면, 외국인은 제일기획을 -71,470주 순매도하고 있고 기관은 42,000주 순매수 중이다. 기관 중에 보험과 투자신탁, 은행의 자금이 유입되었다.※ 사모펀드 등 일부 기관의 순매매량은 표시되지 않음이 시각 거래소에서 제일기획 이외에도 아나패스(14.76%), 램테크놀러지(7.05%), 서산(17.04%), NAVER(7.64%), 인포뱅크(7.36%) 등이 상승세를 보이고 있다.※ 본 기사는 한국경제TV와 `금융 AI 전문기업 씽크풀`이 실시간으로 작성한 기사입니다.라이온봇기자 ⓒ 한국경제TV, 무단 전재 및 재배포 금지",/news/news_read.nhn?article_id=0000857551&office_id=215&mode=search&query=NAVER&page=1
개인 매수세 줄어들어…의약품·의료정밀↑시총 상위주 일제히 상승세…삼바 16% 상승세,"[이데일리 김윤지 기자] 20일 코스피지수가 4%대 상승세를 기록 중이다. 전날 미 중앙은행인 연방준비제도(Fed·연준)이 한국을 포함해 9개국 중앙은행과 통화스와프 계약을 체결하면서 환율에 대한 불안함이 일부 해소된 것으로 보인다. 현재 원달러 환율은 전일대비 36.7원 내린 1253.4원에 거래되고 있다. 이날 마켓포인트에 따르면 오전 11시32분 현재 코스피지수는 전 거래일 대비 69.53포인트(4.77%) 오른 1527.17를 기록 중이다. 상승 출발해 상승 폭을 점진적으로 확대시켜 가면서 1533선까지 올랐다. 이에 따라 전일 1400대로 미끄러졌던 지수는 하루 만에 1500선을 회복했다. 코스피200 선물가격이 1분 이상 5% 이상 등락할 경우 5분간 프로그램 호가 효력을 정지하는 매수 사이드카도 발동됐다. 유가증권시장에서 매수 사이드카가 발동한 것은 2011년 이후 처음이다.유가증권시장에서 개인은 362억원, 기관은 424억원 순매수 중이다. 외인은 1023억원 순매도 중이다. 프로그램 매매는 차익과 비차익을 합쳐 1528억원 순매도 우위를 기록 중이다.전 업종이 상승 중이다. 의약품이 9%대 상승률로 가장 가파르고, 의료정밀, 비금속광물, 전기전자 등이 7%대 안팎으로 상승 중이다. 섬유의복과 기계가 1% 안팎으로 가장 덜 오르고 있다. 시가총액 상위 종목도 상승세다. 삼성바이오로직스(207940)가 16%, LG화학(051910)이 12%대 오르고 있다. 삼성전자(005930)와 셀트리온(068270)이 5%대, SK하이닉스(000660)가 7%대 상승 중이다. NAVER(035420)가 6%대 오르고 있다.김윤지 (jay3@edaily.co.kr)＜ⓒ종합 경제정보 미디어 이데일리 - 무단전재 & 재배포 금지＞",/news/news_read.nhn?article_id=0004601912&office_id=018&mode=search&query=NAVER&page=1
,"유례없는 패닉장세를 겪고 있는 코스피가 한미 통화스와프 체결과 유가 폭등 소식에 급등세를 보이고 있다. 코스피 시장에서는 9년 만에 매수 사이드카가 발동되는 등 모처럼 강한 반등세가 나타나고 있지만 외국인 투자자가 여전히 순매도세를 보이는 등 불안요인도 상존하는 모습이다. 20일 오후 1시 20분 현재 코스피는 전일 대비 67.07포인트(4.60%) 오른 1524.41을 기록 중이다. 코스피는 지난 6일부터 사상 초유의 투매 장세를 겪었다. 지수는 지난 6일 2060선에서 전날 1450선까지 불과 11거래일 동안 600포인트 넘게 빠졌다. 11거래일 가운데 단 하루를 제외한 10거래일 동안 급락장이 벌어졌고 이 가운데 6거래일은 하락폭이 3%가 넘는 폭락장이었다. 이날은 한미 통화 스와프 체결과 국제유가 폭등 소식에 투자심리가 다소 완화되면서 지수가 급반등하고 있는 것으로 풀이된다. 이날 오전 11시 22분경에는 한국거래소가 선물 가격 상승에 따라 5분간 프로그램 매수호가 효력을 일시 정지하는 매수 사이드카를 발동하기도 했다. 코스피200 선물이 전일 종가 대비 5% 이상 오른 데 따른 것이다. 전날에는 증시 폭락으로 사이드카가, 이날은 매수 사이드카가 발동됐다. 유가증권시장에서 선물 가격 상승에 따른 매수 사이드카가 발동된 것은 지난 2011년 12월 1일 이후 처음이다. 전날 한국은행은 미국 연방준비제도와 양자 간 통화 스와프 계약을 600억달러 규모로 체결하기로 했다고 밝혔다. 기간은 최소 6개월까지다.한은은 ""이번 통화 스와프 계약은 상설계약으로 맺어진 미 연준과 5개국 중앙은행 통화스와프 계약에 더해 최근 급격히 악화된 글로벌 달러자금시장의 경색 해소를 목적으로 한다""고 밝혔다.연준은 캐나다, 영국, 유럽(ECB), 일본, 스위스 등 6개국 중앙은행과 통화 스와프 계약을 맺은 상태다. 연준은 한국 이 외에도 덴마크, 노르웨이, 스웨덴, 호주, 뉴질랜드, 브라질, 멕시코 중앙은행 및 싱가포르 통화청 등 9개국과 스와프계약을 새로 체결했다.이번 통화 스와프를 통해 조달된 미 달러가 곧바로 공급되면 달러 수급불균형으로 불안정을 보였던 외환시장에 안정을 주는 효과를 기대해볼 수 있다. 시장에서도 이번 한미 통화스와프만으로 주식시장의 흐름을 바꿀수는 없겠지만, 안전판을 확보했다는 점에서 긍정적이라는 분석을 내놓고 있다.
전날 24% 폭락했던 국제유가는 하루 만에 23% 폭등했다. 지난밤 뉴욕상업거래소(NYMEX)에서 4월 인도분 서부 텍사스산 원유(WTI)는 전날보다 배럴당 23.8%(4.85달러) 급등한 25.22달러에 거래를 마쳤다. 로이터통신은 역대 최고 상승이라고 전했다. 국제유가는 24.4% 폭락한 지 불과 하루 만에 23.8% 폭등하는 등 극도의 변동성 장세를 나타내고 있다. 이경민 대신증권 연구원은 ""한미 통화스와프를 통해 연일 패닉장세를 연출하고 있는 한국 금융시장의 불안심리가 일정부분 제어될 것""이라며 ""아직 코스피 추세반전을 논하기는 아직 이르다. 금융위기 당시에도 코스피는 2008년 10월 단기 저점 확인 이후 2009년 3월까지 5개월 간의 박스권 등락이 지속됐다""고 말했다.업종별로 전업종이 상승하는 가운데 의약품이 10% 가까이 급등하고 있고 의료정밀, 운수창고, 비금속광물 등도 7%대 급등세다. 매매주체별로 외국인과 기관이 각각 2019억원, 347억원을 순매도하고 있고 개인은 1851억원을 순매수하고 있다. 프로그램 매매는 2997억원 매도 우위다.시가총액 상위 종목들은 일제히 급등세다. 삼성전자가 4% 이상 오르고 있고 SK하이닉스, NAVER, 셀트리온 등은 7%대 상승 중이다. 삼성바이오로직스, LG화학, 삼성SDI는 10% 넘는 급등세를 보이고 있다. 이날 유가증권시장에서는 3개 상한가를 포함해 763개 종목이 상승하고 있고 122개 종목이 하락하고 있다.코스닥은 전일대비 27.27포인트(6.37%) 오른 455.62를 기록 중이다.[디지털뉴스국 고득관 기자] [ⓒ 매일경제 & mk.co.kr, 무단전재 및 재배포 금지]",/news/news_read.nhn?article_id=0004540630&office_id=009&mode=search&query=NAVER&page=1
전 거래일 대비 4% 이상 상승,"[서울경제] 코스피가 20일 오후 상승폭을 키우며 1,500선을 회복했다. 이날 오후 1시 20분 기준 코스피는 전 거래일 보다 4.58%(66.69포인트) 상승한 1,524.33을 기록했다. 유가증권 시장에서는 개인 1,759억원 규모를 순매수했고 기관은 282억원, 외국인이 1,938억원을 각각 순매도했다. 시가총액 상위 10위권 종목은 모두 상승세다. 가 4.19% 올랐고 (7.68%), (16.39%), (7.29% ), (7.86%), (13.04%), (1.64% ), 삼성물산(3.27%), (2.73%), (14.75%)가 오르고 있다. 코스닥 지수는 전일보다 6.37%(27.27포인트) 하락한 455.62포인트를 나타냈다. 코스닥 시장에서는 외국인이 732억원, 기관은 491억원 규모를 각각 순매수했다. 개인은 1,140억원어치를 순매도했다.
/박경훈기자 socool@sedaily.com저작권자 ⓒ 서울경제, 무단 전재 및 재배포 금지",/news/news_read.nhn?article_id=0003712742&office_id=011&mode=search&query=NAVER&page=1
