head,text,url
,"[스포츠서울] Q. 중소기업에 다니는 J(34).그녀는 결혼 5년차 맞벌이 부부다. 아직은 전셋집에 살고 있지만, 올해는 반드시 내 집 마련을 하고 싶다. 하지만 종잣돈이 부족해 대출을 받아야 하는데, 한도가 줄어들어 난감한 상태다. 그렇다고 청약을 통해 내 집 마련을 하는 것도 만만치 않은 상황이다. 청약통장(1순위)은 있지만, 가점제가 발목을 잡고 있기 때문이다. 그런데 친구의 얘기로는 국민주택을 분양하는 경우에는 청약통장의 예치금만으로 당첨자를 결정한다고 한다. 어떤 경우에 예치금만 가지고서 입주자를 선정하는지 매우 궁금하다.A. 국민주택은 통상적으로 공공분양주택의 전용면적 85㎡ 이하를 뜻한다. 공공분양주택은 일반분양과 특별공급( ① 3자녀 이상 ② 노부모부양 ③ 신혼부부 ④ 생애최초 ⑤ 국가유공자 ⑥ 기관추천)으로 나눈다. 여기서 국민주택의 경우, 기본적으로 주택청약저축 가입기간과 납입금액에 따라 주택청약 1순위 자격이 부여된다.공공분양주택의 일반공급은 주택청약종합저축(청약저축 포함)에 가입한 무주택 세대주에게 주택을 공급한다. 여기서 입주자 선정 순위 중, 청약저축 1순위 자격은 통장 가입기간 2년 이상, 납입횟수 24회 이상인 경우 1순위 청약자격이 주어진다(수도권 기준). 비수도권 지역은 청약통장 가입기간 6개월 이상에 6회 이상 납입하면 된다. 또한 청약저축 가입기간 6개월 이상, 납입횟수 6회 이상이면, 청약저축 2순위 청약자격 조건이 생긴다. 공공분양주택의 일반공급 당첨자 선정기준은 전용면적에 따라 다소 차이는 있다. 우선 전용면적 40㎡ 초과의 당첨자 선정 기준은 ① 5년 이상 무주택 세대주로 청약저축 60회 이상 납입한 경우, 그 청약저축 총액이 많은 사람 ② 3년 이상 무주택 세대주로 청약저축 총액이 많은 사람 ③ 청약저축 총액이 많은 사람 ④ 청약저축 납입횟수가 많은 사람 ⑤ 부양가족이 많은 사람 ⑥ 해당 공공분양주택 건설지역에 장기간 거주한 사람 순이다. 여기서 청약저축 총액은 매월 납입금 10만원씩만 인정해준다. 예를 들어 납입금 총액을 높이기 위해서 한 번에 10만원 이상 납입해도 매월(1회 기준) 10만원씩만 인정해준다.또한 일반공급 전용면적 40㎡ 이하, 당첨자 선정기준은 ① 5년 이상 무주택 세대주로 납입횟수가 많은 사람 ② 3년 이상 무주택 세대주로 납입횟수가 많은 사람 ③ 청약저축 납입횟수가 많은 사람 ④ 부양가족이 많은 사람 ⑤ 해당 공공분양주택 건설지역에 장기간 거주한 사람 순이다.그렇다. 공공분양주택의 일반분양의 경우, 청약가점을 가지고 입주자를 선정하는 것은 아니다. 즉, 주택청약저축 가입기간이 길고 납입총액이 많은 사람을 기준으로 입주자를 선정하고 있다. 따라서 청약가점이 불리한 청년세대의 경우 공공분양주택 일반분양에 적극 참여해 보는 것도 내 집 마련을 앞당기는 지름길이 될 수 있다는 사실을 간과하지 말자.카페 ‘Go부자’ (https://cafe.naver.com/gobuja6788)[기사제보 news@sportsseoul.com]
Copyright ⓒ 스포츠서울&",/news/news_read.nhn?article_id=0000635986&office_id=468&mode=search&query=NAVER&page=1
전 종목 6~9% 추락,[아이뉴스24 한수연 기자] 코스피가 개장 직후 1600대로 추락한 가운데 시가총액 상위종목이 일제히 급락했다.13일 오전 9시3분 현재 유가증권시장에서 시총 1위 삼성전자는 전 거래일 대비 6.99%(3500원) 하락한 4만7250원에 거래되고 있다. NAVER는 9.31% 빠지며 가장 큰 낙폭을 보이고 있다.SK텔레콤(-8.27%) 현대차(-8.00%) POSCO(-7.87%) LG화학(-7.76%) LG생활건강(-7.50%) SK하이닉스(-7.25%) 등 시총 상위 주요 종목이 동반 추락 중이다.현대모비스(-6.67%) 삼성SDI(-6.79%) 삼성물산(-6.47%) 엔씨소프트(-6.40%) 등도 6% 넘게 급락하고 있다.이날 코스피는 개장과 동시에 1700선이 붕괴되며 1600대로 추락했다. 유가증권시장에선 전일에 이어 또 매도 사이드카가 발동됐다. papyrus@inews24.com [ⓒ 아이뉴스24 무단전재 및 재배포 금지],/news/news_read.nhn?article_id=0000529501&office_id=031&mode=search&query=NAVER&page=1
,"[머니투데이 김소연 기자] 코로나19(신종코로나바이러스 감염증) 확산 우려에 글로벌 정책 공조까지 미진하면서 증시가 급락하고 있다. 시가총액 상위주도 퍼렇게 공포에 질렸다. 13일 오전 9시13분 시총 상위 10개 종목들이 모두 급락하고 있다. 삼성전자가 전날보다 3200원(6.30%) 떨어진 4만7600원을 나타내고 있고 SK하이닉스는 6000원(7.25%) 급락해 7만6800원을 기록하고 있다. 시총 상위 10개 종목 중 NAVER는 9% 넘게 하락해 낙폭이 가장 크고 이어 현대차, LG화학, 삼성SDI 등이 6~8%대 하락세다. 김소연 기자 nicksy@
<저작권자 ⓒ '돈이 보이는 리얼타임 뉴스' 머니투데이, 무단전재 및 재배포 금지>",/news/news_read.nhn?article_id=0004375130&office_id=008&mode=search&query=NAVER&page=1
,"[이데일리 오희나 기자] 코스피 지수가 장초반 7% 가까이 급락하면서 시가총액 상위주들이 동반 급락세를 보이고 있다. 시가총액 100위권 종목 모두 하락세다.
13일 오전 9시14분 현재 삼성전자(005930)는 전날보다 3000원(-5.91%) 내린 4만7800원을 기록중이다.SK하이닉스(000660)도 전날보다 5400원(-6.52%) 내린 7만7400원에 거래되고 있다.삼성바이오로직스(207940)는 -4%, NAVER(035420)는 -8% 하락중이고, LG화학(051910), 셀트리온(068270) 현대차(005380) 삼성SDI(006400) 삼성모비스 LG생활건강(051900) 등 시가총액 100위 종목 모두 하락세를 보이고 있다.오희나 (hnoh@edaily.co.kr) | ＜ⓒ종합 경제정보 미디어 이데일리 - 무단전재 & 재배포 금지＞",/news/news_read.nhn?article_id=0004596619&office_id=018&mode=search&query=NAVER&page=1
,"코스피가 폭락하며 1700선마저 붕괴됐다. 코로나19 확산 사태에 대한 공포가 심화되는 가운데 이에 대응하기 위해 도널드 트럼프 미국 대통령과 유럽중앙은행(ECB)이 내놓은 정책이 실망스럽자 사흘째 폭락세가 이어졌다. 13일 오전 9시 2분 현재 코스피는 전일 대비 141.09포인트(7.69%) 하락한 1693.24에 거래되고 있다. 코스피는 지난 11~12일 장대음봉을 그린 뒤 이날도 전일 대비 6%대로 폭락한 1722.68으로 출발한 뒤 하락폭을 키우고 있다. 이에 이날 오전 9시 7분 코스피의 매도 사이트카가 발동됐다. 사이드카가 발동되면 5분동안 프로그램 매매의 매도 주문이 일시 정지된다. 이에 앞서 오전 9시 4분 코스닥에서는 모든 거래를 일시 정지시키는 서킷브레이커가 발동됐다. 코스닥은 전일 대비 47.27포인트(8.39%) 하락한 516.22를 기록하고 있다.전일 오전 10시부터 시작된 트럼프 대통령의 기자회견으로 이미 한 차례 충격을 받았지만, 간밤에 ECB가 기대에 미치지 못하는 통화정책을 발표하자 공포감이 더 커진 것으로 보인다.
 간밤에 뉴욕증시도 트럼프 대통령이 기자회견에서 영국과 아일랜드를 제외한 유럽에서의 미국 입국을 금지한 데 대한 우려와 적극적인 대책이 나오지 않은 데 대한 실망으로 다우지수가 9.99% 폭락했다. 지난 1987년 10월 19일 하루만에 지수가 22% 폭락한 블랙먼데이 이후 최대 하락폭이다. 트럼프 대통령은 전일 서명에서 영국과 아일랜드를 제외한 유럽 국가에서의 미국 입국을 30일간 금지한다고 발표했다. 회견 당시에는 무역도 금지 대상이라고 잘못 발언한 뒤 트위터를 통해 입국금지조치 대상은 사람 뿐이라고 정정했다. 이번 조치가 양 지역 경제에 미치는 충격파가 막대할 것이란 공포가 급부상했다.특히 유럽연합(EU)이 미국 조치에 강한 불만을 표했다. 아에 트럼프 대통령은 이날 코로나19 확산 상황에 따라 입국 금지 기간이 늘어날 수도 줄어들 수도 있다고 말했다.트럼프 대통령은 경제적인 지원책도 일부 내놨지만, 시장은 실망했다. 그는 중소기업청에 코로나19 영향을 받은 기업에 저금리 대출을 제공하도록 지시했으며, 이를 위한 기금을 추가로 500억달러 증액하는 안도 의회에 요청하겠다고 밝혔다.그는 또 코로나19로 영향 받은 일부 개인과 사업체가 이자나 벌금 없이 납세를 연기할 수 있도록 해 2000억 달러의 유동성을 제공하는 효과를 얻을 수 있다고 말했다.ECB의 조치도 기대에 못 미쳤다. ECB는 기준 금리인 레피(Refi) 금리를 0.0%, 예금 금리를 마이너스(-) 0.5%로 동결했다. 서상영 키움증권 연구원은 ""오늘 미 증시는 트럼프 대통령의 기자회견에 대한 실망감, 특히 현재 상황에 대한 인식이 너무 안일해 적극적인 대응이 부재할 것이라는 공포감으로 패닉에 빠졌다""며 ""여기에 코로나19 확진자가 유럽에서 급증하고 미국 또한 확진자 수가 1323명을 기록하는 등 관련 우려가 지속되고 있다는 점도 공포 심리를 더욱 자극했다""고 말했다. 이날 코스피에서 주요 업종은 모조리 폭락세를 보이고 있다. 특히 은행, 기계, 의료정밀 등이 9% 넘는 하락세를 보이고 있다. 투자주체 별로는 기관과 외국인이 각각 800억워어치와 517억원어치 주식을 팔고 있다. 개인만 1284억원어치 주식을 사는 중이다. 프로그램 매매는 603억원 매수 우위다. 시가총액 상위 종목 중에서는 NAVER, 현대차, 현대모비스, SK텔레콤, POSCO, SK하이닉스 등이 7% 넘는 하락세를 기록하고 있다. 이날 코스피에서는 8개 종목이 오르고 890개 종목이 내리고 있다.[디지털뉴스국 한경우 기자] [ⓒ 매일경제 & mk.co.kr, 무단전재 및 재배포 금지]",/news/news_read.nhn?article_id=0004535708&office_id=009&mode=search&query=NAVER&page=1
,"[아시아경제 이민우 기자] 신종 코로나바이러스감염증(코로나19) 확산과 국제유가 급락에 따른 세계 증시 불황 여파가 국내에도 그대로 작용했다. 장초반부터 코스피는 6% 이상 떨어지며 1700선이 무너졌고, 코스닥은 8% 이상 무너지며 프로그램 매도 호가 효력 일시 정지 조치(사이드카)가 발동됐다.13일 한국거래소에 따르면 코스피는 전날보다 6.09%(111.65) 떨어진 1722.68로 출발했다. 이후 2분 만에 1700선도 무너졌다. 오전 9시20분 현재 1717.33을 나타내고 있다. 유가증권시장에서는 개인이 1008억원을 순매수했다. 외국인과 기관은 각각 317억원, 719억원을 순매도했다.모든 업종이 급락세다. 기계의 경우 9.26%로 하락 폭이 가장 컸다. 이어 은행(9.23%), 의료정밀(8.48%), 섬유·의복(8.47%), 운송장비(8.33%) 등의 순이었다.시가총액 상위 10개 종목도 모두 떨어졌다. 현대차가 8.21%로 가장 많이 떨어지고 있다. 이어 NAVER(9.11%), SK하이닉스(6.88%), LG화학(6.73%), 삼성물산(6.47%), 삼성전자(6.00%) 등의 순이었다.코스닥은 하락폭이 더 컸다. 전장보다 4.77%(26.87) 떨어진 536.62로 출발한 뒤 3분만에 8% 이상 급락해 한국거래소가 사이드카를 발동할 정도였다. 오전 9시20분 기준 516.22를 보이고 있다.코스닥시장에서는 외국인이 4371억원을 순매수했다. 반면 개인과 기관은 4069억원, 481억원을 순매도했다.코스닥시장 역시 전(全) 업종이 하락세다. 비금속의 하락 폭이 10.79%로 가장 컸다. 이어 운송(10.35%), 소프트웨어(10.31%) 등도 두 자리수 하락률을 보였다. 그 밖에 금속(9.98%), 의료·정밀기기(9.53%), 일반전기전자(9.28%) 등의 순이었다.시가총액 상위 10개 종목 모두 떨어지고 있다.CJ ENM이 8.75%로 가장 많이 떨어졌다. 이어 케이엠더블유(8.13%), 씨젠(7.61%),
스튜디오드래곤(7.32%),SK머티리얼즈(7.23%) 등의 순이었다.이민우 기자 letzwin@asiae.co.kr <ⓒ경제를 보는 눈, 세계를 보는 창 아시아경제 무단전재 배포금지>",/news/news_read.nhn?article_id=0004642028&office_id=277&mode=search&query=NAVER&page=1
,"코스피 시장이 코로나19 글로벌 확산에 투매 장세를 보이고 있는 가운데 시가총액 상위 대형주들도 큰 폭의 하락세를 보이고 있다.13일 오전 9시 23분 현재 코스피 시총 1위 삼성전자는 전일 대비 2500원(4.92%) 내린 4만8300원에 거래되고 있다.삼성전자에 이어 시총 2위인 SK하이닉스도 6.04% 떨어지고 있다.삼성바이오로직스(-4.76%), NAVER(-7.21%), LG화학(6.30%) 등도 약세다. 셀트리온(-4.06%), 현대차(-7.58%), 삼성SDI(-5.71%), LG생활건강(-2.76%), 삼성물산(-6.06%) 등도 줄줄이 하락 중이다.[디지털뉴스국 고득관 기자] [ⓒ 매일경제 & mk.co.kr, 무단전재 및 재배포 금지]",/news/news_read.nhn?article_id=0004535721&office_id=009&mode=search&query=NAVER&page=1
,"신종 코로나바이러스 감염증(코로나19) 확산 공포로 증시가 급락세를 이어가면서 신저가 종목이 속출하고 있다.13일 오전 9시 21분 현재 코스피 시장에서는 총 676개 종목이 52주 신저가로 추락했다.이날 시가총액 상위 종목들이 일제히 파란불이 들어왔다. 현대차, NAVER, SK텔레콤이 8%대 급락하고 있고, 반도체 대장주인 SK하이닉스(-6.88%), 삼성전자(-6%) 등도 하락하고 있다. 그외 POSCO, LG화학, 현대모비스, 엔씨소프트도 6%대 약세다.이날 거래중인 코스피 상장사가 총 900곳이라는 점을 감안하면 2곳 중 1곳 꼴로 52주 신저가를 갈아치운 셈이다.코스닥 시장에서는 773개 종목이 52주 신저가로 추락했다.이날 코스피는 전 거래일 대비 108.71포인트(5.87%) 내린 1726.62에 거래 중이다. 코스닥도 8%대 급락하고 있다.[디지털뉴스국 김현정 기자] [ⓒ 매일경제 & mk.co.kr, 무단전재 및 재배포 금지]",/news/news_read.nhn?article_id=0004535720&office_id=009&mode=search&query=NAVER&page=1
,"손희연 기자 son90@mt.co.kr
<저작권자 ⓒ '성공을 꿈꾸는 사람들의 경제 뉴스' 머니S, 무단전재 및 재배포 금지>",/news/news_read.nhn?article_id=0000517336&office_id=417&mode=search&query=NAVER&page=1
,"[아시아경제 금보령 기자] 13일 코스피가 장중 1700선이 붕괴되는 등 국내 증시가 급락하면서 한때 매매거래가 일시 정지됐다.이날 오전 10시10분 코스피는 전장 대비 121.22포인트(6.61%) 내린 1713.11이었다.코스피는 전거래일보다 111.65포인트(6.09%) 내린 1722.68로 개장해 장중 한때 낙폭이 8%대를 뛰어 넘어 1684.56까지 내려갔다. 유가증권시장에서는 전날에 이어 이틀 연속 프로그램 매도호가 효력을 일시 정지하는 사이드카가 발동됐다. 이틀 연속 사이드카 발동한 건 지난 2011년 8월8~9일 이후 8년7개월 만에 처음 있는 일이다.유가증권시장에서 개인은 3386억원어치를 순매수했고, 외국인과 기관은 각각 3550억원, 92억원을 순매도했다.시가총액 상위 10개 기업은 모두 하락세를 보였다.삼성전자(5.61%), SK하이닉스(6.28%), 삼성바이오로직스(5.80%), NAVER(7.81%), LG화학(7.17%) 등이 내렸다.같은 시각 코스닥지수는 전장보다 40.74포인트(7.23%) 하락한 522.75를 기록했다.코스닥은 전장보다 26.87포인트(4.77%) 내린 536.62에서 출발한 뒤 약세가 짙어졌다.코스닥시장에서는 개인이 1328억원어치를 순매도했다. 반면 외국인과 기관은 각각 1045억원, 287억원을 순매수했다.시총 상위주 가운데 펄어비스(2.92%)만 유일하게 올랐다. 이 외에 셀트리온헬스케어(2.89%), 에이치엘비(4.46%), CJ ENM(6.61%), 스튜디오드래곤(6.03%) 등은 하락했다.이날 코스닥시장에서는 오전 9시 4분 1초 매매거래를 일시 중단하는 1단계 서킷브레이커가 발동했다. 코스닥시장에서 서킷브레이커가 발동된 것은 2016년 2월 12일 이후 4년 1개월 만이다.거래소는 ""코스닥 지수가 전일 종가 대비 8% 이상 하락한 상태로 1분간 지속돼 향후 20분 동안 코스닥시장의 매매거래가 중단된다""고 설명했다. 오전 9시 4분 당시 코스닥은 전 거래일보다 47.29포인트(8.39%) 하락한 516.20이었다. 1단계 서킷브레이커는 오전 9시 24분 1초에 해제됐다.이어 오전 9시38분34초에는 프로그램 매도호가 효력을 일시 정지하는 사이드카가 발동됐다. 코스닥150선물가격 및 현물지수(코스닥150)의 변동으로 인한 것이었다. 사이드카 발동 당시 코스닥150선물가격은 전일 대비 6.47%, 현물지수(코스닥150)는 7.33% 하락했다. 이에 5분 동안 코스닥시장의 프로그램 매도호가 효력이 정지됐다.금보령 기자 gold@asiae.co.kr <ⓒ경제를 보는 눈, 세계를 보는 창 아시아경제 무단전재 배포금지>",/news/news_read.nhn?article_id=0004642116&office_id=277&mode=search&query=NAVER&page=1
,"코스피에서 13일 장중 1700선이 재차 붕괴됐다. 개장 직후 지수가 전일 대비 8% 넘게 밀리며 1700선이 무너졌고 한국거래소가 사이드카를 발동한 뒤 회복했지만, 1시간 30분을 버티지 못하고 오전 10시 19분께 다시 1700선을 내준 뒤 자리를 잡았다. 이날 오전 10시 28분 현재 코스피는 전일 대비 137.70포인트(7.51%) 하락한 1696.63에 거래되고 있다. 코스닥의 낙폭도 전일 대비 51.34포인트(9.11%)까지 확대되며 512.15를 기록하고 있다. 코스닥 시장에서는 이날 오전 9시 4분 모든 매매거래를 20분동안 정지시키는 서킷브래이커가 발동됐고, 거래가 재개된 뒤에도 낙폭이 커지자 9시 38분 프로그램 매매의 매도 효력을 일시 정지하는 사이드카까지 발동됐지만 하락세를 막지 못하고 있다. 전일 도널드 트럼프 미국 대통령의 영국과 아일랜드를 제외한 유럽 사람의 미국 입국을 30일동안 금지하면서도 확실한 부양책을 내놓지 않은 실망감, 유럽중앙은행(ECB)가 금리를 동결한 데 대한 실망감 등이 겹치며 지수가 폭락하고 있다. 코스피 주요 업종이 모두 폭락하는 가운데 운송장비, 기계, 운수창고, 건설업, 의료정밀, 섬유·의복 등이 10% 내외의 하락세를 보이고 있다.투자 주체 별로는 외국인과 기관이 4144억원어치와 355억원어치의 주식을 파는 가운데, 개인이 홀로 4165억워어치의 주식을 사고 있다. 프로그램 매매는 1612억원 매도 우위다.시가총액 상위 종목 중에서는 현대차, 현대모비스, SK텔레콤, NAVER 등이 8~10%대의 낙폭을 기록하고 있다. 현재 코스피에서는 12개 종목이 오르고 888개 종목이 하락하고 있다.[디지털뉴스국 한경우 기자] [ⓒ 매일경제 & mk.co.kr, 무단전재 및 재배포 금지]",/news/news_read.nhn?article_id=0004535807&office_id=009&mode=search&query=NAVER&page=1
,"[머니투데이 정인지 기자] 한국 증시가 폭락하고 있다. 코스피지수는 8% 이상 떨어져 서킷브레이커가 발동됐고, 코스닥은 11% 이상 빠지며 500선이 붕괴됐다. 13일 오전 10시48분 현재 코스피지수는 전날보다 8.14% 떨어진 1685.08를 기록 중이다. 코스피시장에서 이날 오전 10시43분에 서킷브레이커가 발동돼 20분간 매매거래가 중단됐다. 코스피지수가 장중 1600대로 내려간 것은 2011년 이래 처음이다. 코스닥지수는 전날 대비 11.56% 떨어진 498.33를 나타나고 있다. 코스닥지수가 장중 500선을 밑돈 것은 2014년 1월 이래 처음이다. 코스피시장에서 외국인이 4692억원어치를 순매도 하고 있다. 기관도 470억원 순매도 중이다. 개인이 4744억원을 순매수하고 있다. 코스피 시총상위주 중에서는 삼성전자, SK하이닉스, 삼성바이오로직스, NAVER가 6~9%대 하락 중이다. 현대차는 11.58% 떨어진 8만4000원을 기록 중이다. 코스닥 시총상위주 중에서는 펄어비스가 홀로 2.5% 상승 중이다. 셀트리온헬스케어, 에이치엘비, CJ ENM, 스튜디오드래곤 등은 4~8% 하락 중이다. 정인지 기자 injee@mt.co.kr
<저작권자 ⓒ '돈이 보이는 리얼타임 뉴스' 머니투데이, 무단전재 및 재배포 금지>",/news/news_read.nhn?article_id=0004375265&office_id=008&mode=search&query=NAVER&page=1
,"[머니투데이 조준영 기자] 증시가 대폭락을 이어가자 높은 가격에 주식을 매수한 투자자들의 한숨이 깊어지고 있다. 지난해 말 만해도 미국 증시가 사상최고가를 연일 경신하며 증시 호황기를 누릴 것이라는 기대감이 높았던 모습과 극적으로 상반된다. 13일 코스피지수는 8% 이상 떨어져 서킷브레이커가 발동됐고 코스닥은 11% 이상 빠지며 500선이 붕괴됐다. 코로나19로 인한 증시 패닉 앞에 대장주도 속절없었다. 코스피 시가총액 상위주인 삼성전자, SK하이닉스, NAVER 등도 오전 중 6~9% 급락했다. 회원 11만명에 달하는 한 주식토론카페에는 대규모 손실에 허탈과 분노를 드러내는 글들이 줄지어 올라왔다. 한 투자자는 ""나는 왜 1월에 주식을 시작했을까. 지금 같은 하락장에 입문했으면 좋지 않았을까""라며 ""올 상반기는 호황일 거라는 말에 고점임에도 투자를 했는데 진정한 비자발적 장기투자자가 됐다""고 말했다.한 주식투자자 A씨(38)는 ""전문가들 추천까지 받고 산 주식인데 속절없이 무너지니 힘들다. 바닥 밑에 지하실이 있다고 말만 들었지 이럴 줄은 몰랐다""고 답답함을 드러냈다.한 대기업에 근무하는 B씨(33)는 ""회사 사정이 안 좋아 월급도 깎일 판에 유일한 희망으로 여겼던 주식마저 이렇게 떨어지니 말 그대로 삶의 의욕이 상실되는 기분""이라고 목소리를 높였다.여의도의 한 증권사 상품팀에 근무하는 C씨도 ""요새 재택근무를 하는 중에 장까지 이러니 상품을 추천할 수도 없다. 개인 투자금도 날아가서 너무 힘들다""며 ""아이가 얼마 전에 태어나 분유 값이라도 벌어야 하는데 차를 갖고 다니지 말까 고민 중""이라고 말했다.공매도를 향한 투자자들의 분노도 높았다. 지난 10일 청와대 국민청원에는 공매도폐지에 미온적인 은성수 금융위원장을 경질해야 한다는 청원들이 올라오기도 했다. 청원자는 ""누구를 위한 공무원이냐. 공매도세력만 옹호하며 수많은 국민의 피눈물을 보고만 있는 금융위원장은 직권남용을 하고 있다""고 지적했다. 해당 청원에는 13일 오전기준 7000명에 가까운 시민들이 동의했다.또 다른 투자자 D씨(35)는 ""주가가 이렇게 떨어질 때까지 금융위는 뭐하고 있었는지 모르겠다. 공매도를 막는다고 해놓고는 주가를 못 잡으면 개인투자자는 더 위축될 수 밖에 없지 않냐""며 ""한국 시장이 더 어려워지지 않을까 걱정""이라고 말했다.반면 크게 주식이 하락하는 지금이 투자기회라는 주장도 있다. 수도권의 한 공기업에 재직 중인 E씨(34)는 ""지금이 오히려 투자할 타이밍이고 대마불사인 우량기업들을 잡아야 하지 않을까 싶다""며 ""손실이 많다고 주변에서 아우성인데, 코로나19 확산 조짐이 있을 때 미리 포트폴리오 조정을 했으면 손실이 덜 났을 것""이라고 말했다.조준영 기자 cho@mt.co.kr
<저작권자 ⓒ '돈이 보이는 리얼타임 뉴스' 머니투데이, 무단전재 및 재배포 금지>",/news/news_read.nhn?article_id=0004375331&office_id=008&mode=search&query=NAVER&page=1
