head,text,url
,"[머니투데이 황국상 기자] 한화투자증권은 8일 철강·비철금속 업계가 글로벌 철강재 수요 급감으로 인한 고전이 예상된다고 했다. POSCO 목표가는 종전 대비 17.1% 하향된 29만원으로, 풍산 목표가는 종전 대비 16.7% 하향된 2만5000원으로, 현대제철 목표가는 종전 대비 34.2% 하향된 2만5000원으로 각각 제시됐다. 최선호주 고려아연 목표가는 종전대로 58만원으로 유지됐다.김유혁 연구원은 ""코로나19 확산으로 발생한 글로벌 공급망의 동시다발적 차질이 철강재 수요의 급감으로 나타나고 있다. 자연스럽게 재고가 쌓이면서 3월말 기준 중국의 유통재고는 2490만톤으로 전년 동기 대비 43%나 높다""며 ""1분기 강재 스프레드는 낮아진 원료 투입가 효과로 전분기 대비 개선은 되겠으나 상반기 내내 가격 하방 압력은 불가피할 것이다. 향후 재고감소 속도와 중국정부의 대규모 부양책 내용이 시황 개선 여부를 가늠할 것""이라고 했다.김 연구원은 ""코로나19가 글로벌 수요의 50%를 차지하는 중국 경제에 타격을 입히면서 주요 금속 가격이 연초 대비 10~19% 급락했다""며 ""아연과 연 제련수수료(TC) 상승세가 지속되는 점에 주목한다. 정광수급 초과공급 상태가 지속되면서 수수료 협상에서 제련소 우위가 지속되고 있기 때문""이라고 했다. 또 ""제련 수수료 상승으로 제련사 증익 기조는 지속될 것""이라며 고려아연을 업종 최선호주로 제시했다.고려아연은 1분기 매출이 전분기 대비 13.3% 감소한 1조5106억원, 영업이익이 8.4% 증가한 1918억원으로 예상됐다. 금속가격 급락하면서 관련 매출이 감소하겠으나 제련 수수료 상승이 이를 상쇄할 것으로 전망됐다.POSCO 1분기 연결 매출은 15조6245억원으로 전분기 대비 2.6% 줄고 영업이익은 5943억원으로 6.6% 증가할 것으로 전망됐다. 풍산은 1분기 연결 매출이 5342억원으로 전분기 대비 24.4% 줄고 영업이익은 66.6% 감소한 56억원으로 예상됐다. 현대제철 1분기 연결 매출은 4조6308억원으로 전분기 대비 4% 줄고 영업이익은 -127억원으로 적자상태가 지속될 것으로 예상됐다.황국상 기자 gshwang@mt.co.kr
<저작권자 ⓒ '돈이 보이는 리얼타임 뉴스' 머니투데이, 무단전재 및 재배포 금지>",/news/news_read.nhn?article_id=0004390922&office_id=008&mode=search&query=POSCO&page=1
,"[머니투데이 강민수 기자] 코스피 지수가 기관 매도세에 약보합 출발했다. 전날 뉴욕 증시가 뉴욕주 코로나19 신규 사망자 수 급증 여파로 이틀만에 내림세로 돌아선데다, 국제유가까지 9% 폭락한 영향으로 풀이된다.
8일 오전 9시13분 현재 코스피 지수는 전일대비 14.23포인트(0.78%) 내린 1809.37을 나타내고 있다.이 시각 현재 기관이 홀로 385억원어치를 순매도하고 있다. 개인과 외국인은 각각 301원, 98억원 매수 우위다.업종별로는 대부분 파란 불을 켠 가운데 종이·목재는 2%대 강세를, 의약품과 철강·금속은 강보합세를 기록 중이다. 화학, 증권, 의료정밀, 건설업 등은 1%대 약세를 보인다.시가총액 상위종목들도 대부분 내림세다. 삼성전자와 SK하이닉스가 0.7%대 하락세고, 현대차와 LG생활건강은 1%대 약세다. 시총 상위주 가운데는 삼성SDI와 POSCO만 강보합세를 보인다.코스닥 지수도 전일대비 4.00포인트(0.75%) 내린 602.35를 나타내고 있다.개인이 홀로 385억원 매수 우위고, 외국인과 기관은 각각 256억원, 55억원 순매도세다.코스닥 업종들도 모두 내림세를 보이는 가운데 통신서비스, 소프트웨어, 통신장비, 비금속 등이 1%대 약세를 보인다. 코스닥 시총 상위주들도 대부분 내리고 있다. 셀트리온헬스케어와 셀트리온제약은 각각 2%, 4%대 하락하고 있다. 단기 급등 이후 최근 주가 조정을 받고 있는 씨젠은 6%대 급락세다. 시총 상위주 가운데는 펄어비스, 스튜디오드래곤 등이 약보합세고, 에코프로비엠은 1%대 강세를 보인다. 강민수 기자 fullwater7@mt.co.kr
<저작권자 ⓒ '돈이 보이는 리얼타임 뉴스' 머니투데이, 무단전재 및 재배포 금지>",/news/news_read.nhn?article_id=0004390962&office_id=008&mode=search&query=POSCO&page=1
"삼성전자, 이달 2~7일 상승랠리에 차익실현주가 덜뛴 삼성전자우는 아직 매수중4月 순매수 쏠린 업종은 '2차 전지'","[헤럴드경제=김유진 기자] 지난달 삼성전자에 쏠렸던 개미 투자자들의 사랑이 4월 들어 코스피 대장주 전반으로 분산되고 있다. 삼성전자 주가 반등세가 지속되자 '오를 만큼 올랐다'는 판단 하에 일부 차익을 실현하고, 새로운 저가매수 사냥감을 찾아나선 것으로 분석된다. 4월 들어 개미 투자자의 관심은 삼성SDI, LG화학 등 2차 전지 관련주로 쏠렸다.4월 들어 개인 투자자들의 코스피 순매수 상위 종목에서 삼성전자가 순위권 밖으로 밀려난 것으로 나타났다. 삼성전자는 지난 1일부터 6일까지만 해도 개인 투자자 순매수 종목에서 5위를 차지했지만, 7일 불과 하루만에 913위로 순위가 폭락했다. 6~7일간 개인 순매도 물량은 4322억원에 달한다. 각각 6일 3333억원, 7일 988억원 규모다.개미들의 삼성전자 '팔자' 양상은 4월 들어 이어진 연이은 주가 상승에 일부 차익실현을 한데 기인한다. 이달 1일 대비 7일 종가가 약 8% 가까이 급등하면서, 개인 투자자들은 이전 약세장에서 사들인 물량들을 집중적으로 차익실현 하는 모습이다.특히 7일에 개인 순매도가 집중되면서 불과 하루 사이에 900위 넘는 순위 변동이 이뤄졌다. 지난달 네 차례나 1조원을 넘겼던 일별 순매수 금액도 이달 들어서는 7000억원을 넘지 않고 있다.반면 삼성전자 대비 주가 상승폭이 제한됐던 삼성전자 우선주의 상황은 조금 다르다. 개인 투자자들은 우선주에 대해서는 계속해서 순매수를 이어가고 있다. 이달 1일부터 7일까지 사들인 삼성전자 우선주는 262억1064만2000원 규모로, 전체 순매수 상위 종목 가운데 14위를 차지하고 있다.이달 개인 투자자들은 코스피 대장주 가운데 삼성전자 대비 주목을 덜 받은 종목들로 눈길을 돌렸다. 코로나19 바이러스 치료제 임상 계획을 밝히며 꾸준히 조명받아온 셀트리온 외에도 그간 저평가 구간이 이어졌던 2차 전지 관련주에도 개인 투자금이 집중됐다.이달 1일부터 7일까지 가장 많이 사들인 종목은 삼성SDI(953억원), 셀트리온(826억원), LG화학 (825억원) 등이다. 전기차와 2차전지 업계는 코로나19 이후 전기차 시장의 성장성이 재차 주목받을 것이란 전망에 최근 강세를 보이고 있다.이밖에 500억원 넘는 개인 투자금이 집중된 종목은 NAVER(766억), KB금융(762억원), 현대차 (669억원) 등이다. 개인투자자들은 이어 POSCO 447억원, 대림산업 362억원, 남선알미늄 339억원, SK이노베이션 293억원 규모로 순매수를 이어갔다.kacew@heraldcorp.com
- Copyrights ⓒ 헤럴드경제 & heraldbiz.com, 무단 전재 및 재배포 금지 -",/news/news_read.nhn?article_id=0001659285&office_id=016&mode=search&query=POSCO&page=1
삼성전자는 차익실현 나서4月 저가매수 업종은 ‘2차전지’삼성전자 우선주는 순매수 진행,"지난달 삼성전자에 쏠렸던 개미 투자자들의 사랑이 4월 들어 코스피 대장주 전반으로 분산되고 있다. 삼성전자 주가 반등세가 지속되자 ‘오를 만큼 올랐다’는 판단 하에 일부 차익을 실현하고, 새로운 저가매수 사냥감을 찾아나선 것으로 분석된다. 4월 들어 개미 투자자의 관심은 삼성SDI, LG화학 등 2차 전지 관련주로 쏠렸다.4월 들어 개인 투자자들의 코스피 순매수 상위 종목에서 삼성전자가 순위권 밖으로 밀려난 것으로 나타났다. 삼성전자는 지난 1일부터 6일까지만 해도 개인 투자자 순매수 종목에서 5위를 차지했지만, 7일 불과 하루만에 913위로 순위가 폭락했다. 6~7일간 개인 순매도 물량은 4322억원에 달한다. 각각 6일 3333억원, 7일 988억원 규모다.개미들의 삼성전자 ‘팔자’ 양상은 4월 들어 이어진 연이은 주가 상승에 일부 차익실현을 한데 기인한다. 이달 1일 대비 7일 종가가 약 8% 가까이 급등하면서, 개인 투자자들은 이전 약세장에서 사들인 물량들을 집중적으로 차익실현 하는 모습이다.특히 7일에 개인 순매도가 집중되면서 불과 하루 사이에 900위 넘는 순위 변동이 이뤄졌다. 지난달 네 차례나 1조원을 넘겼던 일별 순매수 금액도 이달 들어서는 7000억원을 넘지 않고 있다.반면 삼성전자 대비 주가 상승폭이 제한됐던 삼성전자 우선주의 상황은 조금 다르다. 개인 투자자들은 우선주에 대해서는 계속해서 순매수를 이어가고 있다. 이달 1일부터 7일까지 사들인 삼성전자 우선주는 262억1064만2000원 규모로, 전체 순매수 상위 종목 가운데 14위를 차지하고 있다.이달 개인 투자자들은 코스피 대장주 가운데 삼성전자 대비 주목을 덜 받은 종목들로 눈길을 돌렸다. 코로나19 바이러스 치료제 임상 계획을 밝히며 꾸준히 조명받아온 셀트리온 외에도 그간 저평가 구간이 이어졌던 2차 전지 관련주에도 개인 투자금이 집중됐다.이달 1일부터 7일까지 가장 많이 사들인 종목은 삼성SDI(953억원), 셀트리온(826억원), LG화학 (825억원) 등이다. 전기차와 2차전지 업계는 코로나19 이후 전기차 시장의 성장성이 재차 주목받을 것이란 전망에 최근 강세를 보이고 있다.이밖에 500억원 넘는 개인 투자금이 집중된 종목은 NAVER(766억), KB금융(762억원), 현대차 (669억원) 등이다. 개인투자자들은 이어 POSCO 447억원, 대림산업 362억원, 남선알미늄 339억원, SK이노베이션 293억원 규모로 순매수를 이어갔다.김유진 기자
- Copyrights ⓒ 헤럴드경제 & heraldbiz.com, 무단 전재 및 재배포 금지 -",/news/news_read.nhn?article_id=0001659462&office_id=016&mode=search&query=POSCO&page=1
