head,text,url
,"[서울=뉴시스] 오동현 기자 = 넥슨의 신작 모바일 캐주얼 레이싱게임 '카트라이더 러쉬플러스'가 글로벌 흥행을 예고했다. 17일 넥슨에 따르면 '카트라이더 러쉬플러스'는 글로벌 사전등록 시작 하루 만에 100만 명을 모집했다.이 게임은 넥슨의 인기 IP(지식재산권) '카트라이더'의 재미를 모바일에서도 즐길 수 있도록 제작한 게임이다.향상된 3D 카툰 그래픽과 모바일 디바이스에 최적화된 조작감을 갖췄다. 넥슨은 이 게임을 올 상반기 한국을 포함한 글로벌(중국, 일본, 베트남 제외)에서 서비스할 예정이다.한편, 구글 플레이는 공식 유튜브에서 추천 대작으로 '카트라이더 러쉬플러스'를 선정하며 사전등록 이벤트를 알리는 영상을 공개했다.넥슨과 SK텔레콤은'카트라이더 러쉬플러스' 공동 마케팅도 예고하고 있다. odong85@newsis.com<ⓒ 공감언론 뉴시스통신사. 무단전재-재배포 금지>",/news/news_read.nhn?article_id=0009822606&office_id=003&mode=search&query=SK텔레콤&page=1
,"[머니투데이 양성희 기자] [편집자주] 금융위원회가 금융규제 샌드박스 시행 이후 지정한 '혁신금융서비스'를 소개한다. 샌드박스란 어린이가 마음껏 놀 수 있는 모래 놀이터처럼, 신사업을 추진하는 기업에 일정 기간 규제를 면제해주는 제도다.[[금융이 바뀐다]통신사·CB(신용평가사) 협업 보이스피싱 방지 서비스] #. 지민씨(가명)는 수상쩍은 전화가 걸려오자 보이스피싱을 의심했다. 상대가 사기범이 맞는지 확인하고 싶었는데 방법을 몰라 난감했다. 포털사이트에 번호를 검색해 봤지만 소용 없었다. 이러한 경우 보이스피싱 여부를 어떻게 판별할까. 금융사기 피해를 막고 금융소비자를 보호하기 위해 SK텔레콤, KT, LG유플러스 등 통신 3사와 나이스평가정보가 손을 잡았다.통신사의 통신정보, 신용정보회사의 금융정보를 함께 활용해 금융사기 여부를 가리는 서비스가 오는 8월 정식으로 출시된다. 이는 금융위원회 '혁신금융 서비스'로 지정됐다. 전화, 문자 발신자에 대한 정보를 토대로 거래 매체와 주체를 검증하는 서비스다. 로밍 여부, 휴대전화 개통 주소지, 착신전환 등 통신정보와 대출사기, 보험사기, 데이터 명의도용 가해자 정보 등을 살핀다.
통신 3사가 함께 개발한 본인확인 서비스 패스(PASS) 앱(애플리케이션)을 활용하는 방식이다. 패스 앱을 이용하면 개인정보를 입력할 필요 없이 생체인증 비밀번호만으로 간편하게 본인확인을 할 수 있다. 통신사가 발신자 전화번호의 사기 위험 수준을 검증한 뒤 이상 여부가 탐지되면 수신자에게 1차로 위험을 알린다. 이 메시지를 받은 수신자는 패스 앱을 실행해 발신자의 이름 또는 계좌번호를 입력한 뒤 사기 위험 수준을 조회하면 된다. 이후 통신사는 발신자를 식별해 나이스평가정보에 전송한다. 나이스평가정보는 발신자가 기존에 대출사기, 보험사기 등 금융질서 문란 행위를 한 전력이 있는지 확인해 통신사에 알리고 통신사는 수신자에게 그 결과를 전달하게 된다. '신용정보의 이용 및 보호에 관한 법률'(신용정보법)상 개인신용정보를 수집하려면 정보주체의 동의가 필요하지만 통신사, 신용정보회사가 발신자 동의 없이 정보를 이용하도록 특례가 주어진 데 따른 것이다. 금융위는 이를 혁신금융 서비스로 지정하면서 악용 방지를 위해 부가조건을 붙였다. 지정일부터 2년간 이용자별 일 서비스 제공 횟수 등을 정해 지켜야 하고 서비스 운영상황을 모니터링한 뒤 금융위에 알려야 한다. 금융위는 ""이종산업간 정보공유를 통해 금융사기를 사전에 방지해 시너지 효과를 낼 것으로 기대된다""며 ""더욱 견고한 사회적 안전망이 구축될 것""이라고 밝혔다. 양성희 기자 yang@
<저작권자 ⓒ '돈이 보이는 리얼타임 뉴스' 머니투데이, 무단전재 및 재배포 금지>",/news/news_read.nhn?article_id=0004396373&office_id=008&mode=search&query=SK텔레콤&page=1
"""강력한 국정운영, 즉각적 대응 기대""여당 공약 살펴야…""주도주 내 부침""","[이데일리 김윤지 기자] 이번주 화제의 키워드는 ‘4·15 총선’이었다. 지난 15일 치러진 제 21대 국회의원 선거는 여당의 승리로 끝났다. 더불어민주당과 비례정당 더불어시민당이 단독으로 180석의 의석을 확보하면서 ‘거대 여당’으로 거듭났다. 미래통합당과 미래한국당은 개헌저지선인 100석보다 3석 많은 103석 확보에 그쳤다. 여당의 압승에 대해 증권가는 코로나19 후폭풍 차단 및 실물경기 진작에는 유리할 수 있다고 판단했다. 강력한 여당의 등장에 대해 김용구 하나금융투자 연구원은 단기적으로는 중립 이상의 증시 영향을 기대했다. 정부와 국회를 잇는 강력한 국정운영 콘트롤타워의 탄생을 의미했기 때문이다. 김용구 연구원은 “집권 여당의 국정 리더십 강화는 즉각적 정책대응과 정책 시차 단축을 통해 실질 정책효과 제고로 파급될 소지가 다분하다”면서 “향후 신흥국 내 거시 건전성 및 코로나19 정책대응 측면 안전지대가 바로 한국일 수 있음을 역설하는 대목”이라고 설명했다. 국제통화기금(IMF)은 지난 14일(현지시간) 발표한 ‘4월 세계경제전망(World Economic Outlook)’ 보고서에서 올해 한국 경제성장률 전망치를 -1.2%로 6개월 전보다 3.0%포인트 하향 조정했다. 안소은 IBK투자증권 연구원은 “경기 둔화 가능성의 근본적인 해결책은 코로나19 종식이지만 그전까지 경기 둔화를 방어하기 위한 부양책이 절실하다”면서 “총선 결과를 감안할 때 과반수 의석을 차지한 여당이 현 정부의 정책 추진을 가속화할 수 있다는 점도 긍정적”이라고 평가했다. 장기적 관점에서 주목할 만한 업종이나 종목은 무엇일까. 김성근 한국투자증권 연구원은 여당의 공약 중 벤처기업 투자 확대, 부동산, 환경 부분에 주목했다. 벤처기업 투자 확대는 2022년까지 기업가치 1조원 이상 K-유니콘기업 30개 육성을 목표로 혁신기업 성장 지원을 위한 12조원 규모의 스케일업 펀드 조성 등을 내용으로 한다. 김 연구원은 “바이오, 핀테크 등 4차 산업분야의 수혜 가능성이 제기될 수 있다”면서 “부동산 정책에 있어선 현 정부의 집값 안정화 기조가 유지될 것”이라고 내다봤다. 박승영 한화투자증권 연구원은 총선을 기점으로 정부가 반환점을 돌 듯 주식 시장의 성격도 변화할 것이라고 점쳤다. 새 정부가 들어설 때마다 수혜를 본 산업과 기업은 3년 차에 가장 강한 모멘텀을 보이다가 이후 약해지는 패턴이었다고 짚었다. 삼성전자(005930) 한국전력(015760) SK텔레콤(017670)처럼 안정적인 시장 점유율을 바탕으로 1995년부터 올해까지 한 번도 시총 30위 밖으로 밀려나지 않은 종목과 롯데쇼핑(023530) 강원랜드(035250) 등 30위 안에 오래 머무르지 못했던 종목들을 비교한 후 “이런 맥락에서 IT, 인터넷으로 대표되는 현재 주도 업종 안에서도 부침이 있을 것”이라고 설명했다.김윤지 (jay3@edaily.co.kr)＜ⓒ종합 경제정보 미디어 이데일리 - 무단전재 & 재배포 금지＞",/news/news_read.nhn?article_id=0004622520&office_id=018&mode=search&query=SK텔레콤&page=1
,"[이데일리 김성훈 기자] ◇코스피SK텔레콤(017670)-3분기 이후 영업이익 턴어라운드 유력. 단기 실적 우려로 지나치게 낮은 주가상황-장기적으로 봤을 때 SKB·티브로드 합병 법인, 자회사 가치 부각 등이 시장에서 부각될 것카카오(035720)-광고·콘텐츠 중심의 견조한 매출증가 지속. 커머스, 콘텐츠도 두드러진 성과 기록 중-신규비즈니스의 수익성 확보 가시화에 따른 투자심리 개선 기대 ◇코스닥SKC코오롱PI(178920)-하반기 애플 OLED 채택 비중 상승에 따른 방열 시트 및 PI필름 수요 증가-폴더블 스마트폰 및 5G 스마트폰 전용 PI필름 시장 초기 독점김성훈 (sk4he@edaily.co.kr)＜ⓒ종합 경제정보 미디어 이데일리 - 무단전재 & 재배포 금지＞",/news/news_read.nhn?article_id=0004622575&office_id=018&mode=search&query=SK텔레콤&page=1
"나의 성장과 회사의 성장을 함께 그려갈 수 있는 곳이에요. 제가 함께 일했던 분들은 ‘최대한 많은 것을 얻어 갔으면 좋겠어요’라는 말을 많이 하셨고, 실제로도 그런 마음을 많이 느꼈어요. 알고 있는 지식을 전사적으로 공유하며 서로 더 배워나가려는 문화를 위해 노력하고 있는 회사라는 것도 느껴졌고요","[서울경제] 2016년 설립된 빈티지랩은 고객사(기업)의 ‘디지털 전환’과 관련한 모든 컨설팅과 프로젝트를 진행하는 회사다. 디지털 전환이란 제조업이나 물류·유통업 등 기존 산업에 사물인터넷(IoT), 클라우드 컴퓨팅, 인공지능(AI), 빅데이터를 접목하는 것을 뜻한다. 아마존과 쿠팡 등에서 시행하고 있는 인공지능 기반 물류관리·상품추천 기능, 각 제조 기업에서 도입하고 있는 스마트팩토리 등 4차 산업혁명과 밀접한 연관이 있는 개념이기도 하다. 빈티지랩은 VC·엑셀러레이터와 메이저 컨설팅 업체의 역할을 동시에 하는 곳이다. 두 업종 대비 경영·운영 참여율이 훨씬 높고 핵심 인력의 직군 역시 폭넓은 편이다. 해외에서는 이미 디지털 맥킨지, BCG 디지털 벤처스, 이파운더스 등 빈티지랩과 비교적 유사한 비즈니스 모델이 각광을 받고 있다.아직 신생기업이지만 고난도의 업무를 수행하기 때문일까. 빈티지랩은 어느 유수의 기업 못지않은 인재풀을 보유했다는 평가를 받는다. 빈티지랩에는 60여명의 직원들이 근무 중이며, 조직은 사업을 수행하는 5개 센터와 사업을 지원하는 3개 실로 구성되어 있다. 각 센터는 DT(Digital Transformation) 기술 개발 및 적용 (DT 기술, DT 솔루션, 디지털운영)과 신사업 개발 및 육성을 위한 조직으로 구성되어 있으며 (사업개발, xDesign), 각 실은 전략, 인사, 교육 기능을 수행한다 (Innovation Drive, Employee eXperience, Venture Talent).빈티지랩의 기업문화 및 채용 방침을 좀 더 자세히 들어보기 위해 박영진 성장전략부문 부문장, 정세라 Employee eXperience실 매니저를 만나봤다.◇합류하게 된 계기는?박영진 부문장(이하 박 ) 대학 시절부터 창업에 대한 생각이 강해 실질적인 업무능력을 키울 수 있는 분야를 다양하게 겪어봤다. 대학 시절 보스턴컨설팅그룹 등 주요 컨설팅 회사에서 인턴만 3번을 했고 졸업 후에는 직토 CSO를 포함해 핀란드계 컨설팅 회사, 벤처투자회사, 블록체인 업체 등 다양한 업종에서 일했다. 여러 회사를 거치다 보니 정말 배울 점이 있는 사람들과 일하고 싶다는 생각이 확고해졌다. 대표님과 오랜 시간 대화를 나눈 후 합류하기로 최종 결정했다.정세라 HR매니저(이하 정) 전략사업팀에서 인턴을 하다 채용전환된 케이스다. 미국에서 대학을 나왔는데 아무래도 문과 출신이다보니 입사 전까지만 해도 고민이 많았다. 빈티지랩은 신사업 개발 초기부터 마무리까지 모든 단계를 경험할 수 있다는 점이 마음에 들었다. 특히 사내 블로그를 통해 인턴이어도 다양한 업무를 직접 해볼 수 있다는 후기에 주목했다. ◇빈티지랩은 다른 회사와 어떻게 다른가?박: 빈티지랩은 직원들을 ‘진심’으로 상호간에 돕는 기업문화를 갖고 있다. 믿고 따를 만한 사람이 많다는 의미다. 어느 회사에서도 겪을 수 없는 ‘차원이 다른’ 질적인 성장도 몸소 겪을 수 있다. 내로라하는 전문가들이 주요 직무에 포진해 있다. ‘동료에게 진심을 전달하고 공감을 얻는 법’, ‘우리가 믿는 가치와 장기적 이익을 위해 단기적 손해를 감수하는 것’ 등은 이전에 결코 배울 수 없던 것들이었다.
◇남들이 부러워할만한 회사들을 짧은 기간 안에 다양하게 겪어봤는데박: 입사 전에 블록체인 회사에서 일한 적이 있다. 직접 주도해 ICO에 성공했고 200억원 규모의 펀드 레이징도 담당해봤다. 이런 경험이 있다 보니 다른 블록체인업체에서 고연봉에 스카웃 제의가 오기도 했다. 하지만 여기에 머물면 기존에 배웠던 것을 계속 써먹기만 할 뿐이라는 생각을 지울 수가 없었다. 아직은 배워야 할 때라고 생각해 배울 점이 많은 사람들이 있는 기업을 찾다 보니 빈티지랩이라는 결론에 이르게 됐다.◇해외에서 대학을 나왔고 요즘 사회적으로 주목받는 이른바 ‘밀레니얼’ 세대다. 구직 시 어떤 점을 고려했나
정: 최근 구직자들은 취업 대상으로 스타트업이나 벤처기업을 선호한다. 대기업에서는 자기주도적 업무를 하려면 최소 5년 차는 넘어야 한다. 단기간에 압축적인 성장을 경험할 수 있다는 측면에서 스타트업에 대한 관심도가 늘어나는 것 같다. ◇스타트업이나 업력이 얼마 되지 않은 벤처기업은 신입직원(혹은 저연차 직원)에게는 기회의 문이 좁지 않을까박: 현실적으로 신입을 선호하지 않은 것은 맞다. 하지만 우리 회사와 잘 맞는다면 신입이라고 마다할 이유는 전혀 없다. 정 매니저의 경우 모든 직원들이 합류하는데 이견이 없었다. 이처럼 진심으로 열심히 일하려는 마음이 있는지, 선배들이 가르쳐줬을 때 잘 받아들여서 성장할 수 있는지 등의 조건에 부합한다면 채용 기회는 열려 있다.◇정식 직원이 되어 일해 보니 어떤 것이 다른지정: 이제 6개월이 조금 지났다. 교육과 채용문화 등의 업무를 담당하는데 신입이 이런 업무를 직접 주도하는 것은 흔한 기회가 아니다. 특히 회사가 새로운 파트너를 만나면서 조만간 조직이 큰 폭으로 확대개편할 예정이다. 전혀 성격이 다른 조직으로 변화하는 과정에서 새로운 기업문화 구축 등의 업무를 담당하게 된다. 잘 마무리만 된다면 개인적으로 큰 성장을 경험할 것으로 기대된다.◇채용 시 특별한 점이 있다면?박: 인터뷰 과정이 매우 타이트하다. 질문하는 우리들 역시 깊게 고민하고 질문한다. 지원자들이 논리적으로 문제를 해결할 수 있는 능력이 있는지를 약 40분 내에 파악하기 위해서다. 가령 한 지원자가 마이크로 뱅크에 관심이 있어서 인도에 갔다온 경험이 있다고 해보자. 우리는 지원자와 ‘한국에서는 마이크로 뱅크가 어려운 이유’에 대해 대화를 시도하며 면접이 진행된다.◇요즘 같은 취업난에 다소 사치스러운 이야기일 수 있지만 청년들은 여전히 어떤 진로를 택해야 하는지 고민이 크다. 만족할 만한 답을 찾디 못하다 보니 공무원이나 공기업을 선호하는 현상도 오히려 심화되고 있다. 박: 후배들을 대상으로 멘토링을 하는 경우가 종종 있다. △안정적인 공기업 희망자 △컨설팅 및 투자회사 △스타트업 희망자 등 크게 세 분류로 나뉘더라. 주목할 점은 스타트업 지원자가 늘어나고 있다는 점이다. 메이저 컨설팅 펌에서 일했던 과거 동료들도 대부분 스타트업으로 이직했다. 실제 우리 회사 역시 지원공고를 올리면 고스펙 인재들의 지원서가 몰린다. 구직자들은 나쁜 점이 없는 직장을 고르는 선택을 하기 쉽다. 그러다보면 결국 좋지도 나쁘지도 않은 결과에 종속된다. 자신의 철학에 맞고 자신이 좋아하는 일을 선택하는 게 좋다. 그래야 설사 실패를 하더라도 그 후에 더 좋은 선택을 할 수 있다.이와 별개로 권한과 책임을 동시에 주는 기업을 찾는 것이 해답이 될 수 있다. 대부분 기업들이 책임은 지우면서 권한을 주지는 않는다. ◇빈티지랩을 경험할 기회가 있나정: 정식 채용 외에 인턴제도를 꾸준히 운영하고 있다. 서울대 마케팅 석사 과정에 재학하다 지난해 인턴십 프로그램에 한 학생의 표현을 대신하고자 한다.“ ◇빈티지랩에서 앞으로 이루고 싶은 목표가 있다면박: 앞으로 빈티지랩과 함께 할 사람들이 지금까지 겪어본 회사 중 최고의 기업으로 느끼도록 만들겠다는 포부를 갖고 있다. 나 혹은 우리와 함께 일했던 경험이 배움의 기회로 느껴지도록 최선을 다할 것이다./박진용기자 yongs@sedaily.com저작권자 ⓒ 서울경제, 무단 전재 및 재배포 금지",/news/news_read.nhn?article_id=0003726300&office_id=011&mode=search&query=SK텔레콤&page=1
