head,text,url
,"[서울=뉴시스] 이진영 기자 = 오는 15일 치러지는 21대 국회의원 선거의 사전투표를 하루 앞둔 9일 이동통신 3사가 통신망 대비를 완비했다고 밝혔다. 9일 이동통신업계에 따르면 KT는 이날 전국 3500여 개의 사전투표소를 비롯해 250개 개표소와 선거관리위원회 업무망 등 유무선 회선 구축을 마쳤다고 발표했다. 또 선상투표를 위한 팩스망과 투표함 보관소 감시를 위한 CCTV 구축도 완료했다.특히 대구·경북 지역을 비롯해 전국의 코로나19 경증환자 생활치료센터 12곳에서도 원활한 사전투표가 이뤄지도록 무선통신망을 구축하고, 안정적인 선거 통신망 지원을 위한 별도 차량이동기지국을 추가 배치했다.또 선거 통신망의 안정적 운용을 위해 개표가 완료되는 16일까지 선거통신 종합상황실과 전국 6개 지역상황실에서 선거 통신망을 집중 감시한다. 선거기간 동안 전국 투표 현장과 주요 선거 거점에 통신전문 인력 약 2600명을 투입한다.아울러 디도스(DDoS)와 같은 사이버 위협으로부터 선거통신망을 보호하는 ‘사이버 공격 대응체계’를 구축하고 실시간 공격 감시태세를 강화한다. 중앙선거관리위원회 웹사이트를 비롯한 전체 업무망에 KT의 디도스 방어 서비스인 ‘클린존 서비스’를 적용하고, 공격에 대비한 사전 모의훈련도 진행했다. 또한 선거 관련 정보를 사칭한 스미싱 문자로부터 고객을 보호하기 위한 스미싱 차단 대응도 함께 진행하고 있다.김준호 KT 공공고객본부장은 ""21대 총선의 안정적 통신지원을 위해 전용 통신망 구축과 사전 점검을 모두 완료했다""며 ""선거관리위원회와 함께 전국 투표소와 개표소 등 주요 거점에 KT 전문인력이 상주하며 모든 통신서비스를 완벽하게 지원하겠다""고 말했다.SK텔레콤은 총선을 대비해 특별소통 상황실을 운영하며, 투표소/개표소 중심으로 트래픽 용량 예측 및 추가 용량을 확보하는 등 네트워크 품질 관리에 만전을 기했다고 이날 밝혔다.
또한 비상근무 인력을 각 투표소, 개표소 등 현장에 배치해 통화 품질을 집중 관리하고 있다. 이와 함께 유해 트래픽을 탐지하고 차단하는 모의 훈련, 해킹탐지패턴 업그레이드 등 디도스 공격 대비에도 만전을 기하고 있다고 SK텔레콤은 전했다. LG유플러스도 사전투표가 진행되는 10일과 11일, 선거 당일인 15일 비상상황실 체제를 운영하며 네트워크 품질 관리를 위해 만전을 기한다는 방침이다.또한 디도스(DDoS, 분산 서비스 거부) 공격 등 사이버위협에 대비하기 위한 보안서비스를 제공하고 있다고 LG유플러스는 덧붙였다. mint@newsis.com<ⓒ 공감언론 뉴시스통신사. 무단전재-재배포 금지>",/news/news_read.nhn?article_id=0009806670&office_id=003&mode=search&query=SK텔레콤&page=1
화훼농가 돕기 캠페인,"재계에 꽃바람이 불고 있다. 기업과 경제단체들이 신종 코로나바이러스감염증(코로나19) 확산으로 피해를 본 화훼 농가를 돕기 위해 ‘화훼농가 돕기 릴레이 캠페인’에 동참하면서다. 황각규 롯데지주 부회장은 9일 “코로나19로 각종 행사가 취소되면서 화훼농가가 어려움에 처해있는 이때에 릴레이에 함께할 수 있어 영광”이라며 화훼농가 돕기 릴레이 캠페인에 참여한다고 밝혔다.롯데는 이날 서울 잠실의 롯데월드타워 위생·방역 담당 파트너사 직원들에게 남대문 꽃시장에서 구매한 꽃다발과 함께 선물을 전달했다. 황 부회장은 “위생·방역 시스템 강화로 고생하시는 담당 파트너사 직원분들께 이번 기회를 통해 감사의 마음을 담은 꽃다발과 선물을 전하게 돼 기쁘다”며 “활짝 핀 봄꽃처럼 대한민국이 활력을 되찾기 바란다”고 말했다.이 캠페인은 코로나19로 졸업식과 입학식 등이 대부분 줄줄이 취소되면서 매출이 급감한 화훼농가를 돕기 위해 박원순 서울시장이 지난 2월 중순 처음 제안했다. ‘아이스버킷 챌린지’처럼 동참할 다음 사람을 지목하는 방식으로 진행된다. 황각규 부회장은 삼성전자 고동진 IM부문 대표(사장)의 지목을 받아 릴레이 캠페인에 참여했다.고 대표는 지난 3일 페이스북에 “삼성전자는 2월부터 각 사업장의 사무실, 회의실, 식당에 매주 꽃을 두고 있다”며 “꽃 한 송이로 사무실 분위기가 많이 바뀌었다는 임직원의 이야기를 듣고 꽃이 가진 힘을 다시 한번 느꼈다”고 했다. 고 대표는 박정호 SK텔레콤 사장의 지명을 받아 캠페인에 참여했다. 박 사장은 지난달 27일 김정태 하나금융그룹 회장의 지명을 받아 캠페인에 참여했다.1명이 다음 주자로 2명 이상을 지목하면서 아름다운 꽃다발 릴레이가 급속히 퍼지고 있다. 황 부회장은 릴레이 다음 주자로 권영수 LG그룹 부회장과 안병덕 코오롱그룹 부회장을 지목했다. 이날 정재송 코스닥협회 회장의 지명으로 캠페인에 참여한 박미경 한국여성벤처협회장은 다음 주자로 조홍래 이노비즈협회 회장과 석용찬 메인비즈협회 회장을 추천했다.코로나19로 2~3월 졸업과 입학 시즌 특수를 누리지 못했던 화훼농가들은 기업인들의 활발한 캠페인에 반색하고 있다. 이우곤 한국화훼협회 사무총장은 “기업인들이 너도나도 나서서 꽃 구매도 하고, 홍보도 해주시니까 참 고맙다”며 “꽃을 선물하는 캠페인이 확산되면서 꽃을 직접 받고 기쁨을 느낀 분들이 많아지면 앞으로 더 많은 분들이 꽃을 사실 거라고 믿는다”고 말했다.강주화 정진영 기자 rula@kmib.co.krGoodNews paper ⓒ , 무단전재 및 재배포금지",/news/news_read.nhn?article_id=0001309731&office_id=005&mode=search&query=SK텔레콤&page=1
,"[서울경제] 신종 코로나바이러스 감염증(코로나19)의 글로벌 확산세가 둔화될 것이라는 기대감에 국내 증시가 1% 넘게 상승 마감했다. 간밤 주요 산유국의 산유량 감축 합의 가능성에 WTI(서부텍사스산원유)가 반등한 것도 주식시장에 긍정적으로 작용9일 코스피 지수는 전거래일보다 1.61%(29.07포인트) 상승한 1,831.78에 장을 마감했다. 이날 지수는 전 거래일보다 1.71%(30.95포인트) 오른 1,838.09포인트로 출발해 1,830선을 전후로 등락을 거듭했지만, 1,830선을 사수하는 데 성공했다. 이날도 개인투자자들의 매수세가 지수 상승을 이끌었다. 유가증권시장에서는 개인이 3,031억원을 순매수했다. 외국인은 1,862억원, 기관은 1,342억원을 순매도했다. 외국인 투자자의 매도세는 이번 주 들어 일별 1,000억원대에 머물며 비교적 안정적인 수준을 유지하고 있다. 노동길 NH투자증권 연구원은 “국내 주식시장에서 외국인 순매수 전환까지는 좀 더 시간이 필요하지만, 주요국들이 산유량 감축에 합의할 경우 외국인 순매도가 감소할 것으로 기대된다”고 말했다.시가총액 상위 종목들은 대부분 상승세를 보였다. 삼성전자(1.03%), SK하이닉스(0.59%), 삼성바이오로직스(0.21%), 네이버(0.60%), 셀트리온(1.69%), LG화학(3.67%), 현대차(7.89%) 등이 올랐다. 반면 SK텔레콤(-0.26%)과 엔씨소프트(-1.21%)는 하락했다.코스닥지수는 전장보다 1.41%(8.58포인트) 오른 615.95를 나타냈다. 이날 지수는 1.53%(9.30포인트) 오른 616.67로 출발했다. 코스닥시장에서는 개인이 1,559억원어치를 순매수했고, 외국인과 기관이 각각 776억원, 711억원을 순매도했다. 시가총액 상위 종목 중에서는 셀트리온헬스케어(0.62%), 에이치엘비(1.22%), 펄어비스(1.43%), 씨젠(0.31%) 등이 상승 마감했다./신한나기자 hanna@sedaily.com저작권자 ⓒ 서울경제, 무단 전재 및 재배포 금지",/news/news_read.nhn?article_id=0003722357&office_id=011&mode=search&query=SK텔레콤&page=1
,"[머니투데이 강민수 기자] [[내일의 전략]]코스피 지수가 1830선까지 상승하며 사흘 연속 1800선을 사수했다. 외국인과 기관의 매도세에도 개인은 또 다시 지수 상승을 이끌었고, 금융통화위원회를 통한 한국은행의 유동성 공급이 호재가 되며 상승 폭을 키웠다. 이제 시장의 관심은 오늘밤 있을 OPEC+(석유수출국기구 OPEC와 비회원 10개국의 협의체) 긴급 회의에 쏠린다. 사우디아라비아, 러시아 등 주요 산유국의 감산 여부가 증시 향방을 가를 전망이다. 9일 코스피 지수는 전일 대비 8.58포인트(1.41%) 오른 1836.21에 장을 마쳤다. 외국인과 기관이 각각 1871억원, 1320억원어치를 팔아치운 가운데 개인이 홀로 3019억원을 순매수했다. 장 초반 외국인은 순매수세를 보였으나, 개장 1시간여 만에 팔자로 돌아섰다. 이로써 외국인은 26거래일 연속 순매도를 이어갔다. 업종별로는 음식료품(-1.18%)를 제외한 대부분이 빨간 불을 켰다. 특히 운송장비(5.73%), 운수창고(4.33%), 화학(2.71%) 등이 강세였다.
등이 4~5% 강세였다. 시가총액 상위주는 SK텔레콤(-0.26%), 엔씨소프트(-1.21%) 등을 빼고 모두 올랐다. 삼성전자는 1%가량 오르고 SK하이닉스는 강보합세였고, LG화학은 전날에 이어 3% 강세를 보였다. 현대차는 지난 7일 신형 아반떼 공개와 중국 우한 봉쇄 조치 해제에 따른 공장 재가동 등 기대감에 외국인 순매수가 200억가량 유입되며 7.89% 급등했다. 코스닥지수는 8.58포인트(1.41%) 오른 615.95로 마감했다. 코스닥시장에서도 개인이 1559억원을 사들였고, 외국인과 기관은 각각 776억원, 711억원 순매도했다. 업종별로는 전날 강세를 종이·목재(-0.28%)를 제외한 모든 업종이 강세를 보였다. 특히 컴퓨터서비스, 통신서비스, 소프트웨어 등이 2~3%대 올랐다. 코스닥 시총 상위주도 스튜디오드래곤(-0.80%), 휴젤(-0.60%)을 제외한 대부분이 올랐다. 제넥신은 무려 9% 뛰었고, 셀트리온제약, 헬릭스미스 등 바이오주가 3~5%대 상승세를 보였다. 서울 외환시장에서 원/달러 환율은 전거래일 대비 1.4원 내린 1219.5원에 거래를 마쳤다.이제 시장의 초점은 이날 밤 11시(한국시간)에 열릴 OPEC 긴급 회의에 쏠리고 있다. 전날 밤 5월 인도분 WTI(서부 텍사스산 원유)는 감산 합의 기대감에 6.2% 급등했다. OPEC 회원국인 알제리 석유장관이 ""산유국 회의에서 일평균 1000만 배럴 규모의 감산을 논의할 것""이라는 발언이 기대감을 더욱 키웠다. 시장이 유가에 주목하는 가장 큰 이유 중 하나는 신흥국 통화가치 상승이다. 글로벌 금융정보회사 레피니티브와 NH투자증권 자료에 따르면 WTI와 EME(신흥시장경제) 달러지수 간 상관관계는 2007년 이후 -0.8로 높다. 신흥국의 수출 비중이 높은 만큼 이들의 경제 방향성과 유가 간의 상관관계가 있다는 뜻이다. 노동길 NH투자증권 연구원은 ""주요 산유국들이 이번 주 산유량 감축에 합의한다면 유가 상승에 따른 외국인 수급 변화 가능성을 모색할 수 있다""고 예상했다. OPEC+회담에 대한 불확실성도 여전히 남아있는 상태다. 간밤 뉴욕증시 강세로 상승 출발한 국내 증시가 장중 상승 폭이 제한된 점도 이 때문이다. 서상영 키움증권 연구원은 ""미국 기업들의 경우 자연적인 감산 이외에는 감산을 반대한다고 밝혔고, 러시아는 미국의 감산이 전제되지 않으면 참여하지 않을 것이라고 했다""며 ""OPEC 의장 등이 언급한 1000~1500만 배럴 감산 논의를 두고도 일각에서는 그 정도로는 수요 감소 폭을 메꾸지 못한다는 주장이 있어 규모에 대한 논란도 많다""고 지적했다. 그러나 전문가들은 향후 주식시장에 대해서는 다소 긍정적인 전망을 내놨다. 지난달 글로벌 금융시장을 패닉으로 몰아넣었던 변수들이 완화되고 있다는 것이다. 이경민 대신증권 연구원은 ""유럽 코로나19 신규 확진자 수 증가세가 둔화되고 있고, 이달 중 미국까지 코로나19 진정 국면으로 진입할 가능성이 높다""며 ""경제지표, 실적 결과는 부진할 수밖에 없지만, 이보다 더 근본적인 문제들이 완화되고, 글로벌 유동성은 풍부해지고 있다는 점에 주목해야 한다""고 지적했다. 정부의 대규모 유동성 투입 역시 증시 안정화에 기여할 것으로 보인다. 이날 한국은행 금융통화위원회는 기준금리를 0.75%로 동결하고, 1조5000억원 국고채 단순매입을 실시하겠다고 밝혔다. 5대 금융지주사를 포함해 24개 기관이 출자한 10조 규모 증권시장안정펀드도 이날 조성됐다. 이 연구원은 ""코스피가 단기 낙폭의 50% 되돌림 수준인 1840~1850선에 근접했다는 점은 단기 과열 및 매물 소화 가능성을 높이는 부분""이라면서도 ""위기국면 이후 글로벌 금융시장이 정상화되는 데 가장 큰 힘은 유동성이었다""고 강조했다. 강민수 기자 fullwater7@mt.co.kr
<저작권자 ⓒ '돈이 보이는 리얼타임 뉴스' 머니투데이, 무단전재 및 재배포 금지>",/news/news_read.nhn?article_id=0004392186&office_id=008&mode=search&query=SK텔레콤&page=1
"일시에 접속자 몰리며 병목현상통신사 ""학습 공백 최소화 지원""트래픽 실시간 모니터링 등 만전","온라인 개학 첫날 일부에서는 사이트 접속 장애가 생기면서 학생들이 불편을 겪는 사례가 발생했다. 정부가 동시접속 가능인원을 300만명으로까지 늘리며 대비에 나섰지만 시스템 내 병목 현상까지는 막지 못해 생긴 결과다.
 9일 EBS에 따르면 온라인 개학 첫날 오전 EBS 온라인클래스 사이트가 한때 접속 지연을 겪었다. 접속 지연은 오전 9시50분부터 10시20분까지 약 30분간 발생했다. EBS는 서버 용량과는 상관이 없다는 입장이다. EBS 온라인클래스는 마이크로소프트(MS)의 클라우드 서버를 사용한다.
 실제 이날 발생한 접속 지연은 단순 시스템 오류로 볼 수 있다. 정부는 온라인 개학 전 동시접속 가능인원을 300만명까지 확대했다. 교육부에 따르면 지난해 기준 국내 중3과 고3 학생 수는 약 95만명 수준이다. 서버 용량만 놓고 보면 충분히 수용 가능한 수치다. 하지만 일시에 접속자가 몰리면서 시스템 내 병목 현상이 발생하면서 접속 지연이 생긴 것이다.
 일시 장애가 발생했지만 온라인 개학 첫날은 무난히 넘어간 것으로 평가된다. 관심은 앞으로 더욱 늘어날 학생이다. 오는 16일에는 고 1~2학년, 중 1~2학년, 초 4~6학년이 원격수업을 시작한다. 마지막으로 초 1∼3학년은 오는 20일 온라인 개학을 진행한다.
 통신업계는 클라우드로 연결되는 트래픽 관리에 긴장의 끊을 놓지 않고 있다. KT는 과천 사옥에 대응 종합상황실을 마련하고 6개 지역별 현장대응반을 가동하고 있다. SK텔레콤과 SK브로드밴드도 유무선 인터넷 트래픽 상황을 실시간 모니터링 체제로 대응하고 있다.
 LG유플러스 역시 마곡 사옥에 온라인 개학 관련 비상상황실을 구축하고 교육 데이터 트래픽에 대해 실시간 모니터링을 실시하고 있다. LG유플러스 관계자는 ""EBS 등 교육관련 콘텐츠 데이터 사용에 대해 무과금 처리를 하는 등 온라인 개학을 원활하게 진행하기 위한 네트워크 모니터링을 포함해 만전을 기하고 있다""고 설명했다.
 한편, SK텔레콤은 이날 온라인 개학을 맞아 서로 가상교실 시범 서비스를 시작했다. 이번 시범 서비스는 경기도 김포시 소재 신풍초등학교 6학년 2학급, 5학년 1학급 등 총 3개 학급 약 80명의 어린이들을 대상으로 올해 1학기 종료시까지 운영될 예정이다.
 서로 가상교실 시범 서비스는 SK텔레콤의 △그룹 영상통화 서로 서비스 △원격 수업용 단말기 △키즈 안심 앱 잼 등으로 구성돼 학생들이 원격으로 쉽게 수업을 받을 수 있도록 했다.
 이현아 SK텔레콤 AI서비스단장은 ""코로나19 장기화에 따라 학생들의 학습공백 최소화를 위한 지원이 필요하다고 판단해 이번 시범 서비스를 준비했다""며 ""시범 서비스를 바탕으로 빠른 시일 내에 누구나 쉽고 편리하게 이용할 수 있는 서로 가상교실 서비스를 상용화하겠다""고 말했다.


 ※ 저작권자 ⓒ 파이낸셜뉴스. 무단 전재-재배포 금지",/news/news_read.nhn?article_id=0004405875&office_id=014&mode=search&query=SK텔레콤&page=1
'올프라임' 1개월간 무료 제공,"SK텔레콤은 비대면 생활에 유용한 올프라임 멤버십을 오는 13일부터 신규 가입 고객 선착순 1만명에게 1개월간 무료 제공한다고 9일 밝혔다.
 올프라임은 월 9900원에 10가지 이상의 콘텐츠, 쇼핑, 생활 혜택을 제공하는 구독형 서비스다. 대표적인 혜택은 △웨이브, 플로, 원스토어 e북(택1) △11번가 쇼핑시 SK페이포인트 최대 6% 적립 △100여가지 상품을 최저가로 제공하는 전용 특가몰 △음식배달 할인 등이다.
 이번 프로모션은 사회적 거리 유지 및 재택 근무 등으로 댁내 생활이 늘어난 고객들을 응원하기 위해 기획됐다. 올프라임은 현재 사용 중인 통신사와 관계없이 누구나 11번가 애플리케이션(앱)이나 모바일웹에서 가입할 수 있다. 프로모션 신청 고객은 100원을 결제한 후 SK페이포인트로 100원을 돌려받는 방식으로 무료 혜택을 받는다.
 무료 혜택 기간이 지난 내달부터는 월 정액 요금이 정상 결제된다. 연장 이용을 원치 않는 고객은 유료 전환 전 사용 종료를 신청하면 된다. 가입 후에 혜택을 받지 않았을 경우 결제요금 전액 환불도 가능하다.
 김진우 SK텔레콤 통합서비스추진그룹장은 ""앞으로도 올프라임에 신규 제휴사가 지속 추가될 예정""이라며 ""올프라임을 고객에게 다양한 혜택을 제공하는 종합 멤버십 플랫폼으로 성장시킬 것""이라고 말했다.

 ※ 저작권자 ⓒ 파이낸셜뉴스. 무단 전재-재배포 금지",/news/news_read.nhn?article_id=0004405873&office_id=014&mode=search&query=SK텔레콤&page=1
,"기관 투자자는 09일 거래소에서 KODEX 200선물인버스2X, 삼성전자, TIGER MSCI Korea TR 등을 중점적으로 매도한 것으로 나타났다.기관 투자자의 순매도 상위 20개 종목은 KODEX 200선물인버스2X, 삼성전자, TIGER MSCI Korea TR, 엔씨소프트, 카카오, KODEX 코스닥150선물인버스, KODEX 인버스, SK하이닉스, 남선알미늄, SK텔레콤등이다.이중에 전기,전자 업종에 속한 종목이 6개 포함되어 있다.삼성전자, TIGER MSCI Korea TR, SK하이닉스 등은 전일 대비 주가가 상승했고, KODEX 200선물인버스2X, 엔씨소프트, KODEX 코스닥150선물인버스 등은 주가가 하락했다.한경로보뉴스이 기사는 한국경제신문과 금융 AI 전문기업 씽크풀이 공동 개발한 기사 자동생성 알고리즘에 의해 실시간으로 작성된 것입니다.▶ ▶
 ▶
ⓒ 한국경제 & , 무단전재 및 재배포 금지",/news/news_read.nhn?article_id=0004321811&office_id=015&mode=search&query=SK텔레콤&page=1
