head,text,url
20·30대 매출 비율 65.6%에 달해하루 평균 유동인구 32만명 기록,"강남대로 전경[이데일리 박민 기자] 서울 강남대로 상권 내 편의점의 월 평균 추정 매출이 7600만원에 이르는 것으로 나타났다.9일 수익형부동산 연구개발기업 상가정보연구소가 SK텔레콤 빅데이터 서비스 플랫폼 지오비전을 통해 강남구에 있는 편의점 월평균 매출을 추정한 결과 올해 2월 기준 5929만원으로 조사됐다.이중 서울의 대표 상권 중 한곳인 ‘강남대로’ 상권 편의점은 월평균 추정 매출이 7648만원에 달했다. 강남구 전체 평균 매출보다 28%(1719만원) 높은 수준이다. 강남대로는 강남구 신사동 ‘한남대교 남단’에서 서초구 양재동 ‘양재대로’까지 이르는 구간이다.강남대로 상권 편의점 매출 기여도가 가장 높은 연령대는 30대로 매출의 34.8% 비중을 차지했다. 20대의 매출도 30.8%를 기록하며 20·30대 매출 비중이 총 매출의 65.6%인 것으로 나타났다.같은 기간(2월 기준) 강남대로 상권 일평균 유동인구는 32만 3226명으로 조사됐다. 이는 월평균(30일 기준) 약 970만명의 유동인구가 강남대로 상권을 찾는 셈이다.상권 내 유동인구 구성이 가장 많은 연령대는 20대였으며 전체 유동인구 중 25.8%의 비중을 차지했다. 이어 △30대(24.4%) △40대(19.1%) △50대(14%) △60대 이상(13.4%) △10대(3.3%) 순이었다.풍부한 유동인구로 강남대로 상가의 투자수익률도 높은 편이다. 한국감정원 조사에 따르면 지난해 강남대로 중대형 상가(3층 이상이거나 연면적 330㎡ 초과인 건물)의 투자 수익률은 9.48%로 조사됐다. 이는 전국 투자수익률 평균 6.29% 대비 3.19% 높은 수치이며 서울 주요 상권 40곳 중 가장 높은 수익률이다.조현택 상가정보연구소 연구원은 “강남대로 상권은 일대 수많은 기업 내 고정적인 수요를 배후로 두고 있고, 국내외 관광객들도 방문하는 국내 유명 상권”이라며 “신종 코로나바이러스 감염증(코로나19) 확산으로 주말 매출은 줄었지만, 평일에 높은 매출을 기록하고 있다”고 말했다.그는 이어 “다만 내수경기 침체와 코로나19 확산 영향을 받아 과거처럼 활기를 띤 상권의 분위기는 보이지 못하고 있다“고 분서했다.박민 (parkmin@edaily.co.kr)＜ⓒ종합 경제정보 미디어 이데일리 - 무단전재 & 재배포 금지＞",/news/news_read.nhn?article_id=0004616477&office_id=018&mode=search&query=SK텔레콤&page=1
,"[서울=뉴시스] 이진영 기자 = SK텔레콤은 비대면 생활에 유용한 ‘올프라임'(AllPRIME)’ 멤버십을 13일부터 신규 가입 고객 선착순 1만명에게 1개월간 무료로 제공한다고 9일 밝혔다. 올프라임은 월 9900원에 10가지 이상의 콘텐츠, 쇼핑, 생활 혜택을 제공하는 구독형 서비스이다. ▲웨이브, 플로, 원스토어 e북(택1) ▲11번가 쇼핑시 SK페이포인트 최대 6% 적립 ▲100여가지 상품을 최저가로 제공하는 전용 특가몰 ▲음식배달 할인 등이 대표적인 혜택이다.이번 프로모션은 사회적 거리 유지 및 재택 근무 등으로 댁내 생활이 늘어난 고객들을 응원하기 위해 기획됐다.올프라임은 현재 사용 중인 통신사와 관계없이 누구나 11번가 앱이나 모바일웹에서 가입할 수 있다. 프로모션 신청 고객은 100원을 결제한 후 SK페이포인트로 100원을 돌려받는 방식으로 무료 혜택을 받는다.무료 혜택 기간이 지난 다음 달부터는 월 정액 요금이 정상 결제된다. 연장 이용을 원치 않는 고객은 유료 전환 전 사용 종료를 신청하면 된다. 가입 후에 혜택을 받지 않았을 경우 결제요금 전액 환불도 가능하다.김진우 SK텔레콤 통합서비스추진그룹장은 ""앞으로도 올프라임에 신규 제휴사가 지속 추가될 예정""이라며 ""올프라임을 고객에게 다양한 혜택을 제공하는 종합 멤버십 플랫폼으로 성장시킬 것""이라고 말했다. mint@newsis.com<ⓒ 공감언론 뉴시스통신사. 무단전재-재배포 금지>",/news/news_read.nhn?article_id=0009805298&office_id=003&mode=search&query=SK텔레콤&page=1
11번가 웹 ·앱에서 13일부터 신청 가능…통신사 관계없이 무료 혜택웨이브·배달 할인·11번가 포인트 혜택 등 비대면 생활 지원,"[헤럴드경제=김민지 기자] SK텔레콤은 비대면 생활에 유용한 ‘올프라임(AllPRIME)’ 멤버십을 오는 13일부터 신규 가입 고객 선착순 1만 명에게 1개월간 무료 제공한다고 밝혔다.이번 프로모션은 코로나19 사태로 ‘사회적 거리두기’ 및 재택 근무 등 ‘집콕’ 생활이 늘어난 고객들을 응원하기 위해 기획됐다.‘올프라임’은 월 9900원에 10가지 이상의 콘텐츠, 쇼핑, 생활 혜택을 제공하는 구독형 서비스다. ▷웨이브, 플로, 원스토어 e북(택1) ▷11번가 쇼핑시 SK페이포인트 최대 6% 적립 ▷100여가지 상품을 최저가로 제공하는 전용 특가몰 ▷음식배달 할인 등이 대표적인 혜택이다.‘올프라임’은 현재 사용중인 통신사와 관계없이 누구나 11번가 앱이나 모바일 웹에서 가입할 수 있다. 프로모션 신청 고객은 100원을 결제한 후 SK페이포인트로 100원을 돌려받는 방식으로 무료 혜택을 제공받는다.무료 혜택 기간이 지난 다음 달부터는 월 정액 요금이 정상 결제된다. 연장을 원치 않는 고객은 유료 전환 전에 사용 종료를 신청하면 된다. 가입 후에 혜택을 받지 않았을 경우 결제요금 전액 환불도 가능하다.김진우 SK텔레콤 통합서비스추진그룹장은 “앞으로 올프라임에 신규 제휴사가 지속 추가될 예정”이라며 “올프라임을 종합 멤버십 플랫폼으로 성장시킬 것”이라고 밝혔다.jakmeen@heraldcorp.com
- Copyrights ⓒ 헤럴드경제 & heraldbiz.com, 무단 전재 및 재배포 금지 -",/news/news_read.nhn?article_id=0001659914&office_id=016&mode=search&query=SK텔레콤&page=1
,"SK텔레콤이 코로나19에 따른 온라인개학을 맞아 '서로' 가상교실 시범 서비스를 시작한다고 9일 밝혔다. 시범 서비스는 경기도 김포시 소재 신풍초등학교 6학년 2학급, 5학년 1학급 등 총 3개 학급 약 80명의 어린이들을 대상으로 '20년 1학기 종료 시까지 운영될 예정이다. SK텔레콤에 따르면 서로 가상교실 시범 서비스는 그룹 영상통화 '서로' 서비스, 원격 수업용 단말기, 키즈 안심 앱 'ZEM' 등으로 구성돼 학생들이 원격으로 쉽게 수업을 받을 수 있도록 했다.시범 서비스에 활용되는 그룹 영상통화 서로는 SK텔레콤의 영상통화 기능 '콜라(callar)'와 다자간 통화 앱 'T그룹통화'의 경험을 바탕으로 만들어진 서비스다. 서로는 최대 QHD 화질까지 선택 가능하며, 영상/음성 송수신 딜레이 절감 기술과 자체 렌더링을 통해 다수의 인원이 동시 접속해도 딜레이 없이 안정적인 영상 통화 품질을 제공한다.SK텔레콤은 당초 서로를 하반기 중 일반 사용자용으로 출시 예정이었으나 코로나19로 인해 초중고 개학 지연과 온라인 개학 등 학생들의 학습공백이 우려되자 원격 교육용으로 먼저 선보이게 됐다.SK텔레콤은 시범 학급 학생 전원과 담당 교사에게 시범 기간 중 단말기를 제공하고 자녀 안심보호 애플리케이션인 'ZEM'을 설치해 지정된 교육 컨텐츠 외의 유해 컨텐츠에 대한 접근을 차단할 예정이다. SK텔레콤 관계자는 ""코로나19 장기화에 따라 학생들의 학습공백 최소화를 위한 지원이 필요하다고 판단해 시범 서비스를 준비했다""며 ""시범 서비스를 바탕으로 빠른 시일 내에 누구나 쉽고 편리하게 이용할 수 있는 서로 가상교실 서비스를 상용화하겠다""고 말했다. 김세형 기자 fax123@sportschosun.com- Copyrightsⓒ , 무단 전재 및 재배포 금지",/news/news_read.nhn?article_id=0003552551&office_id=076&mode=search&query=SK텔레콤&page=1
강남대로 편의점 月매출 7648만원강남구 평균보다 1719만원 높아,"강남대로 중대형 상가의 투자수익률이 9.48%로 서울 주요 상권 40곳 중 가장 높은 수익률을 기록했다.
강남대로는 서울시 강남구 신사동 527번지 한남대교 남단에서 서초구 양재동 352-3번지 양재대로에 이르는 길이 6.9㎞ 도대로이다. 가로변을 따라 각종 은행과 상업시설이 들어서 있으며, 한강변의 한강시민공원을 비롯하여 학동공원, 말죽거리공원, 바우뫼공원, 윤봉길의사기념관이 있는 양재시민의 숲 등의 공원이 있다. 강남대로는 대한민국 최고 상권 중 하나인 강남역이 위치해 있으며 많은 직장인, 관광객 등을 비롯한 유동인구가 강남대로 상권을 방문한다. 9일 한국감정원에 따르면 지난해 강남대로 중대형 상가의 투자수익률은 9.48%로 조사됐다. 이는 전국 투자수익률 평균 6.29% 대비 3.19% 높은 수치이며 서울 주요 상권 40곳 중 가장 높은 수익률이다.
SK텔레콤 빅데이터 서비스 플랫폼 지오비전 통계로 테헤란로 상권을 분석한 결과, 2월 기준 강남대로 상권 일평균 유동인구는 32만 3226명으로 조사됐다. 이는 월평균(30일 기준) 약 970만명의 유동인구가 강남대로 상권을 찾는 셈이다. 상권 내 유동인구 구성이 가장 많은 연령대는 20대였으며 전체 유동인구 중 25.8%의 비중을 차지했다. 이어 ▲30대(24.4%) ▲40대(19.1%) ▲50대(14%) ▲60대 이상(13.4%) ▲10대(3.3%) 순이었다. 이 상권 내 편의점 월평균 추정 매출은 2월 기준 7648만원으로 강남구 평균보다 1719만원 높았지만, 1회 방문 시 평균 결제금액은 7568원으로 강남구 평균 7261원 대비 307원 높았다.그만큼 많은 수의 소비자가 강남대로 상권 내 편의점을 방문하는 것으로 추정할 수 있다. 조현택 상가정보연구소 연구원은 ""강남대로 상권은 많은 수의 기업이 있어, 고정적인 직장인 수요가 있으며 관광객들도 방문하는 국내 유명 상권""이라며 ""편의점의 경우 코로나19 확산으로 주말 상권 방문객이 줄어 매출은 낮은 수치를 기록했지만, 평일에 높은 매출을 기록하며 강남구 평균 편의점 매출 대비 1700만원 이상 높았다""고 전했다.이어 ""그러나 강남대로 상권은 비교적 높은 수준의 임대료와 권리금도 있어 자영업자 상권 진입 장벽이 높으며, 내수경기 침체와 코로나19 확산 영향을 받아 과거처럼 활기를 띤 상권의 분위기는 보이지 못하고 있다""고 분석했다. [박윤예 기자] [ⓒ 매일경제 & mk.co.kr, 무단전재 및 재배포 금지]",/news/news_read.nhn?article_id=0004553821&office_id=009&mode=search&query=SK텔레콤&page=1
"강남대로 상권, 하루 평균 유동인구 32만명 기록총 월 매출 중 20·30대 비율 65.6%로 가장 높아","[서울=뉴시스] 이혜원 기자 = 서울 강남구에서 서초구로 이어지는 강남대로 상권 내 편의점의 월평균 매출이 7600만원을 상회하는 것으로 나타났다.9일 상가정보연구소가 한국감정원 통계를 분석한 결과 지난해 강남대로 중대형 상가의 투자수익률은 9.48%로 조사됐다. 이는 전국 투자수익률 평균 6.29% 대비 3.19%포인트(p) 높은 수치로, 서울 주요 상권 40곳 중에서도 가장 높은 수익률이다. 강남대로는 서울시 강남구 신사동 527번지 한남대교 남단에서 서초구 양재동 352-3번지 양재대로에 이르는 길이 6.9㎞의 대로다. 가로변을 따라 각종 은행과 상업시설이 들어서 있으며, 한강변의 한강시민공원을 비롯해 학동공원, 말죽거리공원, 바우뫼공원, 윤봉길의사기념관이 있는 양재시민의 숲 등의 공원이 있다. 상가정보연구소가 SK텔레콤 빅데이터 서비스 플랫폼 지오비전 통계를 통해 테헤란로 상권을 분석한 결과 지난 2월 기준 강남대로 상권 일평균 유동인구는 32만3226명으로 조사됐다. 이는 월평균(30일 기준) 약 970만명의 유동인구가 강남대로 상권을 찾는 셈이다. 상권 내 유동인구 구성이 가장 많은 연령대는 20대였으며 전체 유동인구 중 25.8%의 비중을 차지했다. 이어 ▲30대(24.4%) ▲40대(19.1%) ▲50대(14%) ▲60대 이상(13.4%) ▲10대(3.3%) 순이었다.강남대로 상권 내 편의점 월평균 추정 매출은 지난 2월 기준 7648만원으로 조사됐다. 이는 상권이 속한 강남구 편의점 월평균 추정 매출 5929만원 대비 1719만원 높은 매출이다. 매출 기여도가 가장 높은 연령대는 30대로 매출의 34.8% 비중을 차지했다. 20대의 매출도 30.8%를 기록하며 20·30대 매출이 총매출의 65.6%인 것으로 나타났다.상권 내 편의점 월평균 추정 매출은 강남구 평균보다 1719만원 많았고 1회 방문 시 평균 결제금액도 7568원으로 강남구 평균 7261원 대비 307원 높았다. 이는 많은 수의 소비자가 강남대로 상권 내 편의점을 방문하는 것으로 추정할 수 있다.조현택 상가정보연구소 연구원은 ""강남대로 상권은 많은 수의 기업이 있어, 고정적인 직장인 수요가 있으며 관광객들도 방문하는 국내 유명 상권""이라며 ""편의점의 경우 신종 코로나바이러스 감염증(코로나19) 확산으로 주말 상권 방문객이 줄어 매출은 낮은 수치를 기록했지만, 평일에 높은 매출을 기록하며 강남구 평균 편의점 매출 대비 1700만원 이상 높았다""고 말했다.이어 조 연구원은 ""그러나 강남대로 상권은 비교적 높은 수준의 임대료와 권리금도 있어 자영업자들의 상권 진입 장벽이 높으며, 내수경기 침체와 코로나19 확산 영향을 받아 과거처럼 활기를 띤 상권의 분위기는 보이지 못하고 있다""고 덧붙였다. march11@newsis.com<ⓒ 공감언론 뉴시스통신사. 무단전재-재배포 금지>",/news/news_read.nhn?article_id=0009805733&office_id=003&mode=search&query=SK텔레콤&page=1
,"[담양=뉴시스] 송창헌 기자 = 전남 담양의 플라타너스 별빛·달빛길이 한국관광공사가 선정한 야간 경관 100선(選)에 이름을 올렸다.관광공사는 침체된 관광산업 회복을 위해 올해 2월 중순부터 선정 작업에 착수, 전국 지방자치단체 추천과 SK텔레콤 T맵 야간시간대 목적지 빅데이터 분석을 토대로 매력도, 접근성, 치안·안전, 지역 기여도를 종합해 최종 100곳을 선정했다.죽녹원 앞 영산강 문화공원 일원에 마련된 300m 길이의 별빛·달빛길은 아름다운 플라타너스나무 아래 별이 쏟아지는 조명 연출과 스토리가 담긴 로고젝터(바닥에 특정 로고나 문구를 투영해 주는 장치)를 곳곳에 설치해 별이 쏟아지는 길을 음악을 감상하면서 걷는 재미가 쏠쏠하다.분수광장 옆에 마련된 초승달 포토존에는 사진을 찍기 위해 줄을 서서 기다리는 것을 흔히 볼 수 있다.군 관계자는 9일 ""플라타너스 별빛·달빛길이 국내 야간경관 100선에 이름을 올리게 된 것을 매우 뜻깊게 생각한다""며 ""100선 선정을 계기로 더 많은 관광객이 플라타너스길을 찾을 것으로 기대한다""고 말했다. 한편, 담양 플라타너스 별빛·달빛길은 야간관광 활성화를 위해 대한민국 테마여행 10선 남도 맛기행 '죽녹원 일원 야간경관 조명 콘텐츠사업'으로 조성했으며, 오후 7시부터 11시까지 감상할 수 있다. goodchang@newsis.com<ⓒ 공감언론 뉴시스통신사. 무단전재-재배포 금지>",/news/news_read.nhn?article_id=0009806016&office_id=003&mode=search&query=SK텔레콤&page=1
카운터포인트리서치 5G 스마트폰 출하량 전망 보고서플래그십 모델 뿐 아니라 중저가 라인업까지 채용 확대 건물 내 5G 장비 구축(인빌딩)과 전용 컨텐츠 개발 숙제,"[서울=뉴시스] 김종민 기자 = 2020년 한해 동안 국내에서 약 840만대의 5G 스마트폰이 판매될 것이란 전망이 나왔다. 이는 스마트폰 전체 예상 판매량의 48%에 해당하는 것으로, 작년 5G 스마트폰 판매 비중이 28%였던 것에 비해 큰 폭으로 증가한 수치다. 9일 글로벌 시장조사업체 카운터포인트리서치의 5G 스마트폰 출하량 전망보고서에 따르면, 올 한해 글로벌 시장의 5G 비중이 전체 스마트폰의 4%, 5G 선도시장인 미국와 중국이 각각 26%, 36%로 예상되는 것을 감안하면 한국의 5G 비중은 상당히 높은 편으로, 한국 시장은 글로벌 최초 5G 상용화 타이틀이 무색하지 않은 성장세를 보일 것으로 전망된다.국내 시장에서 특히 5G 스마트폰의 판매 비중이 높게 나타나는 이유는 삼성과 LG, 두개 국내 브랜드가 차지하는 시장 점유율이 약 80%에 이르는 것에 기인한 것으로, 올해의 경우 삼성과 LG에서 출시하는 새로운 전략모델들이 모두 5G이고, 여기에 중저가폰 라인업으로까지 5G 채택을 확대할 계획을 가지고 있다. 삼성은 A90 5G의 후속 모델인 A91 5G를 하반기에 출시할 예정이며, 상반기에도 A71과 A51의 중저가 모델에도 5G를 탑재할 것으로 알려져 있다. LG는 V60 5G를 국내에서는 출시하지 않는 대신, 상반기에 전략모델 G9을 5G 모델로 출시할 것으로 보이며, 하반기에는 중저가 라인업인 Q시리즈에서 1~2종에 5G를 채용할 것으로 전망된다. 여기에 하반기 애플의 첫 5G 모델 출시 또한 이러한 성장세를 가속화시킬 것으로 예상된다. 작년에는 삼성과 LG플래그십 중심으로 총 7종의 5G 모델이 출시되었으나 올해는 13종의 5G 모델이 국내 시장에 출시될 것으로 예상된다. 우리나라는 지난 해 4월3일 세계 최초로 5G 상용화에 성공했고, 그 기술력을 인정받은 SK텔레콤, KT, LGU+ 이통3사들은 세계 각국의 이통사들에게 그 기술과 노하우를 수출하고 있다. 또한 삼성은 스마트폰 제조사들 중 처음으로 5G 스마트폰인 갤럭시 S10 5G를 출시하며 5G 선두주자로 자리매김하였고, 그 결과 작년 글로벌 5G 스마트폰 전체 출하량의 39%를 차지하면서 5G 시장에서도 1위를 차지했다. 이렇듯 지난 1년간 성공이라 부를 만한 성과를 이뤘지만, 앞으로 해결해야 하는 숙제들도 많다. 카운터포인트리서치의 임수정 연구원은 “5G 상용화 1년이 지나면서, 5G 스마트폰 보급률이 빠르게 늘고 있지만, 이와 함께 5G 네트워크 품질 향상과 컨텐츠 확대에 대한 숙제가 여전히 남아있는 상황이다. 최근 카운터포인트리서치가 조사한 국내 5G 이용자 만족도 조사에 따르면, 상당 수의 이용자가 LTE와의 차이를 느끼지 못하거나 오히려 품질에 대한 불만이 있는 것으로 나타났다. 따라서, 올해는 단지 이용자수를 늘리는 경쟁에서 벗어나 이용자의 만족도를 높이기 위한 이통사의 경쟁이 가속화될 것으로 예상하며, 특히 건물 내부에서의 네트워크 품질 향상을 위한 인빌딩 5G 장비 구축과 LTE 서비스와 확실하게 구별될 수 있는 5G 전용 컨텐츠 개발에 진전이 있을 것으로 기대한다.” 라고 말했다.다만 전 세계적으로 확대 추세에 있는 코로나 19의 영향이 5G 시장 확대에 영향을 줄 가능성이 있다. 상반기 동안 스마트폰 판매량이 연초 예상 대비 큰 폭으로 감소될 것 예상되는데, 구매를 미뤘던 사용자들 중심으로 하반기 수요가 얼마나 빠르게 회복될 지가 관건이다. 임 연구원은 “5G 스마트폰의 경우에는 시장 선점을 위해 제조사와 통신사가 적극적으로 나설 수 밖에 없는 상황이고, 특히 하반기에는 애플의 첫 5G 아이폰에 대한 기대가 큰 상황이라, 코로나 19로부터 받는 영향이 다른 소비재에 비해 상대적으로 적을 것으로 예상된다”고 전망했다. jmkim@newsis.com<ⓒ 공감언론 뉴시스통신사. 무단전재-재배포 금지>",/news/news_read.nhn?article_id=0009806216&office_id=003&mode=search&query=SK텔레콤&page=1
,"[머니투데이 조성훈 기자] 9일 오후 경기도 성남 판교의 본투글로벌센터 화상회의실. 알체라와 비주얼캠프, 원투씨엠, 프라젠, 워프솔루션, 디토닉 등 통신기술 분야 스타트업 6개사가 긴장된 모습으로 프리젠테이션에 나섰다. 이들이 각자 개발한 기술과 비즈니스 모델을 소개하자 원격화상 시스템으로 SK텔레콤과 KT, LG유플러스 등 국내 이동통신사 관계자들이 발표를 지켜보고 질문했다. 이날 행사는 과기정통부가 정보통신기술(ICT) 벤처, 스타트업 지원을 위해 이동통신사들과 공동 개최한 '언택트(비대면) IR'이다. 직접 대면 IR에는 미치지 못하지만 최근 코로나 사태로 대기업이나 벤처캐피탈(VC) 등 잠재고객, 투자자와의 만남과 투자유치가 어려워진 가운데 가뭄의 단비같은 기회라는 평가다.과학기술정보통신부가 ICT 벤처와 스타트업 지원을 위해 대기업, 벤처캐피탈, 정책금융기관과 공동으로 이같은 언택트IR을 정기적으로 개최한다고 9일 밝혔다. 과기정통부는 이동통신·별정통신사, 대기업·기금사, 벤처캐피탈, 글로벌 VC·기업 등 총 4개 그룹으로 나누고, 각 그룹별 시행 일시를 통합해 매주 IR을 개최할 방침이다.1그룹인 이동통신사의 경우 한국통신사업자연합회(KTOA)의 주관으로 이통 3사(SKT, KT, LG U+) 및 3개 별정통신사(SK텔링크, KT파워텔, LG헬로비전이 참여해 이달부터 투자 또는 업무 협력을 희망하는 이동통신 관련 분야 기업을 발굴한다. 2그룹인 대기업·기금사는 정보통신산업진흥원(NIPA) 주관 ‘ICT 창업·벤처지원 민관협의체’ 소속 대기업·기금사와 신한금융그룹이 참여해 협력사업 발굴 트랙(대기업)과 투자유치 트랙(기금사)으로 나눠 내달 개최한다. 3그룹인 VC는 벤처기업협회(KOVA)의 주관으로 유관 VC(약 140개)가 참여해 연 5회 시행하던 대면 IR 행사를 온라인으로 대체해 이달부터 시행한다.4그룹인 해외 VC·기업은 본투글로벌센터(B2G)의 주관으로 해외 VC·대기업이 참여해 글로벌 시장에 적합한 기술·서비스 보유 국내 벤처·스타트업과 1:1 매칭 IR을 5월부터 7월까지 시행한다.첫 언택트 IR은 이날 오후 개최됐는데 총 6개 스타트업이 참여해 열띤 발표를 통해 자사 기술 및 비전을 선보였다. 온라인으로 참가한 이통사 관계자들은 자사와 협력을 위한 기술개발 방향 등 참가 기업에 별도의 컨설팅 시간도 가졌다.과기정통부 장석영 제2차관은 “코로나19 확산으로 실리콘밸리 등 전 세계적으로 벤처·스타트업에 대한 신규 투자 및 사업이 위축되고 있어 유망 기술기업도 어려움을 겪고 있다”면서 “대면으로 이루어지던 IR을 단순히 온라인으로 옮기는데 그치는게 아니라 동영상으로 편집·제작해 향후 기업 홍보자료로 활용하는 등 포스트 코로나 준비에 도움이 될 수 있도록 하겠다”고 밝혔다.조성훈 기자 search@
<저작권자 ⓒ '돈이 보이는 리얼타임 뉴스' 머니투데이, 무단전재 및 재배포 금지>",/news/news_read.nhn?article_id=0004392002&office_id=008&mode=search&query=SK텔레콤&page=1
