head,text,url
"SK텔레콤·KT, 자사주 매입 행렬에도 주가 반등 ""글쎄""LGU+, 3사중 하락폭 가장 적어…자사주 매입에 소극적증권가 ""통신업, 1분기 성적 부진…실적 이슈로 번질 것""","이른바 '동학개미운동' 효과를 보지 못하고 고전 중인 통신주가 고위 임원들을 앞세워 자사주 취득 경쟁을 벌이고 있다. 임원진들의 주가 부양 의지에도 좀처럼 반등하지 못하고 있다.13일 통신업계에 따르면 SK텔레콤과 KT 임원들은 릴레이 자사주 매입에 나서 주가 부양 의지를 드러냈다.SK텔레콤은 지난 2월 중순 박정호 사장의 자사주 매수를 시작으로 이달까지 40여명의 임원들이 회사 주식을 사들였다. 박 사장은 총 3억4100만원을 투입해 자사주 1500주를 장내 매입했다. SK텔레콤 윤풍영 최고재무책임자(CFO), 유영상 무선(MNO)사업부장을 비롯한 고위 임원 27명도 같은달 자사주를 함께 매수했다. 3월에도 김윤 AIX센터장을 필두로 임원 10여명이 회사 주식을 샀다. 4월 들어선 진요한 엔터프라이즈 AI 플랫폼 그룹장, 김성준 유통1본부장이 자사주 취득 행렬에 동참했다.SK텔레콤은 ""경영진의 책임경영에 대한 의지와 실적 개선, 미래 성장 가능성에 대한 자신감에 따른 것""이라고 설명했다. 회사 가치 대비 주가 하락이 과도하다는 판단이 뒷받침됐다.SK텔레콤 주가는 올 들어 계속 하락세다. 연초 23만4000원에 거래되던 주식은 지난달 13일 20만원 선이 붕괴된 데 이어 같은달 23일 장중 16만4000원까지 떨어졌다. 지금은 19만원선을 지키고 있다. 2월 중순 박정호 사장이 매입할 당시(22만7800원)보다도 약 16% 낮은 수준이다.KT도 주가 부양을 위해 임원들이 팔을 걷어붙였다. 3월 중순부터 4월 초까지 100여명에 이르는 임원 대부분이 회사 주식을 매입했다.지난달 열린 주주총회에서 신임 대표로 선임된 구현모 사장이 스타트를 끊었다. 구 사장은 지난달 20~24일 KT 주식 5234주를 장내 매수했다. 평균 취득단가는 1만8970원, 총 취득금액은 약 1억원이다.KT 역시 ""회사 주가가 기본체력에 비해 저평가됐다고 판단, 자사주 매입을 결정했다""며 ""책임경영을 강화해 KT 기업가치를 제고한다는 취지""라고 말했다.KT는 지난달 18일 상장 이후 처음 2만원 선이 붕괴됐다. 이후 23일 장중 1만7250원까지 내렸으나 이달 6일 2만원 선을 회복했다. 현재 주가는 2만1000원대로 연초 주가(2만6600원)와 비교하면 약 20% 떨어져 있다.통신 3사 가운데 LG유플러스는 비교적 자사주 매입에 소극적이다. 코로나19(신종 코로나바이러스 감염증) 확산으로 통신업종 주가가 본격 하락한 2월 중순부터 현재까지 고위 임원 2명만 자사주를 취득했다.
LG유플러스 이혁주 부사장이 3월23일 회사 주식 5000주를 4500만원에, 최택진 부사장이 같은달 5000주를 5000만원에 장내 매수했다. SK텔레콤, KT와는 확연히 다른 행보다. 통신 3사 중 주가 하락폭이 가장 작아 자사주 취득에 적극 나서지 않는 것으로 풀이된다.
LG유플러스 주가는 연초 1만3850원에서 지난달 19일 1만원 선이 무너졌지만 나흘 만에 다시 1만원 선을 회복했다. 이후 8거래일 만에 1만2000원대로 올라섰지만 주가는 여전히 하락세다. 현재는 1만1000원 선에 거래되고 있다.코로나19 사태 이후 개인투자자들이 국내 증시를 끌어올리는 동학개미운동이 이목을 끌지만 통신주의 반등은 당분간 쉽지 않아보인다. 임원들의 자사주 매입도 약발이 먹히지 않고 있다.부진한 1분기 실적이 발목을 잡고 있어서다. 통신 3사 모두 전년 대비 실적이 뒷걸음질칠 것으로 전망된다. 하나금융투자는 ""올 1분기 통신 3사 연결 영업이익 합계는 8328억원으로 전년 대비 9.4% 감소할 것""이라며 ""최근 5세대 이동통신(5G) 순증 가입자 수가 급감해 이동전화 매출액 정체 양상이 지속될 것이다. 1분기엔 결국 매출액 문제로 통신사 실적 이슈가 번질 것 같다""고 평가했다.김은지 한경닷컴 기자 eunin11@hankyung.com기사제보 및 보도자료 open@hankyung.com▶ ▶
 ▶
ⓒ 한국경제 & , 무단전재 및 재배포 금지",/news/news_read.nhn?article_id=0004323393&office_id=015&mode=search&query=SK텔레콤&page=1
"""꽃 구입해 LG 의인상 수상자에게 전달""한성숙 네이버 대표를 다음 주자로 지목","권영수 LG그룹 부회장(사진)이 신종 코로나바이러스 감염증(코로나19)으로 어려움을 겪는 화훼농가를 돕는 릴레이 캠페인에 합류했다.권 부회장은 13일 LG그룹 페이스북을 통해 캠페인 참가를 인증했다. 화훼농가에서 구입한 꽃들을 역대 ‘LG 의인상’ 수상자들에게 전달한다는 게 골자다. LG 의인상은 LG그룹이 ‘국가와 사회를 위해 희생한 의인에게 기업이 사회적 책임으로 보답해야 한다’는 고(故) 구본무 회장의 유지를 기념하기 위해 2015년 제정됐다. 권 부회장은 “LG 의인상 수상자분들이 사회에 따뜻한 온기를 불어넣었듯이 이번 릴레이 캠페인이 화훼농가에 조금이나마 도움이 되길 바란다”고 말했다.화훼농가 돕기 캠페인은 동참할 다음 사람을 지목하는 게 특징이다. 박정호 SK텔레콤 사장, 고동진 삼성전자 사장, 이석희 SK하이닉스 사장, 황각규 롯데 부회장, 전영현 삼성SDI 사장 등 주요 그룹 최고경영자(CEO)들이 참여했다. 권 부회장이 지목한 다음 주자는 한성숙 네이버 대표다.
송형석 기자 click@hankyung.com▶ ▶
 ▶
ⓒ 한국경제 & , 무단전재 및 재배포 금지",/news/news_read.nhn?article_id=0004323394&office_id=015&mode=search&query=SK텔레콤&page=1
"6개월 만기, 최대 연 2.8% 금리 제공SKT SUPER PASS WEEK 이벤트도 진행","Sh수협은행(은행장 이동빈)은 SK텔레콤과 손잡고 SKT PASS 가입고객 대상 전용상품인 ‘높이다, PASS정기적금’을 출시한다고 13일 밝혔다.‘높이다, PASS정기적금’은 6개월 만기 정액적립식 예금으로 월 최대 20만 원까지 적립이 가능하며, 우대조건에 따라 최대 연 2.8%의 금리를 제공한다.‘높이다, PASS정기적금’은 SKT PASS 앱의 ‘내자산’ 페이지에서만 가입 가능하며, 상품 가입 전 수협은행의 입출금계좌를 보유하고 있거나 SKT PASS 앱에서 수협은행의 ‘잇(it)딴주머니통장’을 개설해야 가입이 가능하다.한편, 수협은행과 SK텔레콤은 업무제휴 및 신상품 기간한정 출시를 기념해 총 1만 명의 고객에게 연 4.2% 상당의 PASS축하금을 만기 지급하는 ‘SKT SUPER PASS WEEK’ 이벤트를 진행한다.SKT SUPER PASS WEEK 이벤트는 오는 20일부터 24일까지 5일 동안 오전 10시에 오픈하여, 매일 선착순 2000 명에게 우대혜택을 제공한다. 선착순 우대쿠폰을 받은 고객은 쿠폰 발급일 포함 5일 이내에 ‘높이다, PASS정기적금’에 가입하면 된다.Sh수협은행 관계자는 “가입자가 1500만 명에 이르는 대한민국 No.1(넘버 원) 금융중개 플랫폼 PASS와 수협은행이 손을 맞잡고 저금리 기조에도 경쟁력 있는 금융 혜택을 고객에게 제공하게 되어 기쁘다”며 “수협은행은 앞으로도 고객 감동과 편의성을 극대화하는 디지털금융 상품을 지속적으로 출시하겠다”고 말했다.송현수 기자 songh@busan.com",/news/news_read.nhn?article_id=0000995773&office_id=082&mode=search&query=SK텔레콤&page=1
,"앞으로 넥슨의 카트라이더 게임을 SK텔레콤을 통해 VR로 즐길 수 있게 됐다.국내 게임과 이동통신 분야의 선두주자인 넥슨과 SK텔레콤이 가상현실(VR) 등 분야 협력을 위해 손잡았다. SK텔레콤과 넥슨 양사는 '전략적 제휴를 통한 공동 마케팅 및 사업추진 협력'을 목적으로 양해각서(MOU)를 체결했다고 13일 밝혔다.두 회사는 콘텐츠·상품 서비스·신작 게임 등 공동 마케팅을 펼치고 넥슨의 지적재산(IP)을 활용한 VR 게임 출시에 협력하기로 했다.먼저 넥슨의 신작 모바일 게임 '카트라이더 러쉬플러스'을 공동으로 마케팅하고 카트라이더에서 파생한 게임 '크레이지월드 VR'를 조만간 출시할 계획이다.이 밖에도 VR·클라우드 게임 영역에서 새로운 콘텐츠를 발굴하는 등 사업협력 분야를 점점 넓힐 예정이다.SK텔레콤이 '초실감 미디어 플랫폼'을 표방하고 내놓은 VR·AR 플랫폼 '점프'는 현재 누적 이용자 수 120만 명을 넘었다.또 '2020 카트라이더 리그 시즌1'의 타이틀 스폰서에 SK텔레콤이 참가하는 등 양측은 e스포츠 분야에도 협력할 계획이다.넥슨 김현 사업총괄 부사장은 ""이번 파트너십은 넥슨의 경쟁력을 한층 높이고 '초격차' 만들기에 힘을 보탤 기회라는 점에서 의미가 있다""며 ""양사가 긴밀히 협력해 이용자에게 새로운 재미와 경험을 제공해드릴 수 있도록 노력하겠다""고 말했다.SK텔레콤 전진수 5GX서비스사업본부장은 ""VR게임과 클라우드 게임의 등장으로 게임분야는 새로운 전환점을 맞고 있다""며 ""1등 게임사 넥슨과 SKT의 기술, 마케팅 협력으로 글로벌 게임시장을 향한 도전과 성과를 기대한다""고 밝혔다.박지훈 기자 lionking@busan.com",/news/news_read.nhn?article_id=0000995785&office_id=082&mode=search&query=SK텔레콤&page=1
역대 LG 의인상 수상자 120명에 반려식물 전달,"(서울=뉴스1) 주성호 기자 = 신종 코로나바이러스 감염증(코로나19)로 어려움을 겪는 화훼농가를 돕기 위한 재계의 릴레이 캠페인에 권영수 ㈜LG 부회장도 동참했다. 13일 LG그룹에 따르면 권 부회장은 황각규 롯데그룹 부회장의 지명을 받고 화훼농가 돕기 릴레이 캠페인에 동참했다. 권 부회장은 ""서로에 대한 격려와 응원이 필요한 이 시기에 저도 기회를 빌려 역대 120명에 달하는 LG 의인상 수상자 분들께 건강과 안녕을 기원하는 뜻에서 반려식물을 전해드리고자 한다""고 말했다. LG 의인상은 국가와 사회정의를 위해 희생한 의인에게 기업이 사회적 책임으로 보답하기 위해 고(故) 구본무 회장의 뜻을 반영해 2015년 제정된 것이다. 권 부회장은 ""LG 의인상 수상자 분들이 우리 사회에 따뜻한 온기를 불어넣었듯 이번 릴레이 캠페인이 화훼 농가에 조금이나마 도움이 되길 바란다""면서 다음 주자로 한성숙 네이버 대표를 지목했다. 재계의 화훼 농가 돕기 캠페인은 지난달 김정태 하나금융그룹 회장을 필두로 박정호 SK텔레콤 사장이 참여하며 본격 확대됐다. 박 사장의 지목을 받은 고동진 삼성전자 사장과 이석희 SK하이닉스 사장 등이 캠페인에 참여했고 황각규 부회장, 전영현 삼성SDI 사장 등도 화웨 농가 돕기에 나섰다.sho218@news1.kr© 뉴스1코리아(), 무단 전재 및 재배포 금지",/news/news_read.nhn?article_id=0004583390&office_id=421&mode=search&query=SK텔레콤&page=1
,"Sh수협은행(행장 이동빈)은 SK텔레콤과 손잡고 SKT 패스(PASS) 가입고객 대상 전용상품인 '높이다, PASS정기적금'을 출시한다.적금은 6개월 만기 정액적립식 예금으로 월 최대 20만원까지 적립이 가능하다. 우대조건에 따라 최대 연 2.8% 금리를 제공한다. SKT PASS 앱 '내자산' 페이지에서만 가입할 수 있다. 상품 가입 전 수협은행 입출금계좌를 보유하고 있거나 SKT PASS 앱에서 수협은행의 '잇(it)딴주머니통장'을 개설해야 한다.이영호기자 youngtiger@etnews.com",/news/news_read.nhn?article_id=0002877908&office_id=030&mode=search&query=SK텔레콤&page=1
"포스코건설 '철' 주제로 갤러리 꾸며삼성물산, 첨단기술 채용…대림산업, 미술작품 설치","국내 대형 건설사들이 서울 강남에 '브랜드 갤러리'를 잇따라 선보이고 있다. 건설사들의 프리미엄 브랜드를 보여줄 수 있는 동시에 기업의 이미지를 내세울 수 있는 장이 되기도 한다. 포스코건설은 13일 서울 강남구 신사동에 연면적 4966㎡의 '더샵갤러리'를 개관했다. 올해 초 주택브랜드인 더샵을 11년만에 리뉴얼한 데 이어 강남 한복판에 홍보관까지 설치한 것이다. 흥미로운 건 이 갤러리의 주제가 `철과 자연의 조화(STEEL MEETS NATURE)'라는 점이다. 건축용 철강재의 무궁무진한 변신을 통해 건축문화의 미래를 보여줬다는 설명이다. 포스코건설은 국내 최대 철강그룹인 포스코그룹 소속이다. '철'과 떼어놓을 수 없는 기업의 이미지를 아예 갤러리의 주제로 잡은 것이다.포스코건설 관계자는 ""더샵갤러리는 건물 자체가 하나의 커다란 건축용 철강재 종합전시관인 동시에 포스코그룹의 건축 홍보관이나 다름없다""며 ""홍보관의 건축설계는 포스코A&C가 담당했고, 내외부 주요 마감재는 포스코와 포스코강판이 최근 개발한 신제품을 적용했다. 스마트홈 관련 시스템의 장비와 운용기술은 포스코ICT가 공급했고 시설관리는 포스코O&M이 담당한다""고 설명했다.포스코건설이 '철'이라면 삼성물산은 삼성전자의 계열사답게 'IT'다. 삼성물산의 송파구 문정동에 자리한 '래미안 갤러리'에는 '래미안 AIoT 플랫폼'이 적용되어 있다. 인공지능(AI)과 사물인터넷(IoT) 기술을 결합한 래미안 자체의 플랫폼이다.개발에는 삼성SDS가 참여했다. 홈 IoT 플랫폼에 인공지능 시스템을 연결해 입주민의 생활패턴을 분석하고 고객에게 익숙한 맞춤형 환경을 제안하거나 자동으로 실행해줄 수 있다. 개방형 플랫폼으로 삼성전자 뿐만 아니라 KT, LG유플러스, SK텔레콤, 카카오, 네이버 등에서 제공하는 첨단 스마트홈 기술을 활용할 수 있다. 'e편한세상', '아크로(ACRO)' 브랜드로 알려진 대림산업도 기업의 이미지를 갤러리에 녹였다. 대림산업은 계열사로 글래드호텔앤리조트와 대림미술관을 가지고 있다. 미술관과 호텔을 가지고 있는만큼 이에 버금가는 분위기로 주택전시관을 꾸몄다.강남구 신사동에 마련된 '아크로 갤러리'를 상위 0.1%의 개성 있는 라이프스타일을 반영한 최상의 주거 공간으로 조성했다. 이번 콘셉트하우스는 ‘컬렉터의 집(Collectors’ House)’이다. 세계 유명 가구 및 가전 브랜드의 최신제품들이 단층형 펜트하우스와 복층형 펜트하우스까지 설치됐다. 곳곳에 프랭크 스텔라, 사라 모리스, 장 뒤비페, 파올로 라엘리, 스튜디오 로소, 이우환, 이강소 등의 작품들이 걸려있다. 김하나 한경닷컴 기자 hana@hankyung.com▶ ▶
 ▶
ⓒ 한국경제 & , 무단전재 및 재배포 금지",/news/news_read.nhn?article_id=0004323454&office_id=015&mode=search&query=SK텔레콤&page=1
,"Sh수협은행은 SK텔레콤과 패스(PASS) 가입고객 대상 전용상품인 ‘높이다, 패스 정기적금’을 출시한다고 13일 밝혔다.이 상품은 6개월 만기 정액적립식 예금으로 월 최대 20만원까지 적립 가능하며 우대조건에 따라 최대 연 2.8%의 금리를 제공한다.패스 애플리케이션(앱)의 ‘내자산’ 페이지에서만 가입 가능하며 상품 가입 전 수협은행의 입출금계좌를 보유하고 있거나 패스 앱에서 수협은행의 ‘잇(it)딴주머니통장’을 개설해야 가입할 수 있다.수협은행과 SK텔레콤은 업무제휴 및 신상품 출시를 기념해 고객 1만명에게 연 4.2% 상당의 패스 축하금을 만기 지급하는 이벤트도 연다.오는 20일부터 24일까지 5일 동안 오전 10시에 오픈해 매일 선착순 2000명에게 우대혜택을 제공한다. 선착순 우대쿠폰을 받은 고객은 쿠폰 발급일 포함 5일 이내에 적금에 가입하면 된다.이남의 기자 namy85@mt.co.kr
<저작권자 ⓒ '성공을 꿈꾸는 사람들의 경제 뉴스' 머니S, 무단전재 및 재배포 금지>",/news/news_read.nhn?article_id=0000530613&office_id=417&mode=search&query=SK텔레콤&page=1
,"Sh수협은행은 13일 SK텔레콤과 손잡고 SKT패스(PASS) 가입고객 대상 전용상품인 '높이다, 패스(PASS) 정기적금'을 출시한다고 밝혔다.'높이다, PASS정기적금'은 6개월 만기 정액적립식 예금으로 월 최대 20만원까지 적립이 가능하다. 우대조건에 따라 최대 연 2.8%의 금리를 제공한다.'높이다, PASS정기적금'은 SKT PASS 앱의 '내자산' 페이지에서만 가입 가능하다. 상품 가입 전 수협은행의 입출금계좌를 보유하고 있거나 SKT PASS 앱에서 수협은행의 '잇(it)딴주머니통장'을 개설해야 가입이 가능하다.한편 수협은행과 SK텔레콤은 업무제휴 및 신상품 기간한정 출시를 기념해 총 1만 명의 고객에게 연 4.2% 상당의 PASS축하금을 만기 지급하는 ‘SKT SUPER PASS WEEK’ 이벤트를 진행한다.데일리안 이충재 기자 (cj5128@empal.com)ⓒ (주)데일리안 - 무단전재, 변형, 무단배포 금지",/news/news_read.nhn?article_id=0002395758&office_id=119&mode=search&query=SK텔레콤&page=1
반등장 승자는 낙폭과대주60% 이상 하락했던 한화생명SK이노 등 60~80% 반등낙폭 적었던 넷마블·SK텔 등은한자릿수 상승하는데 그쳐,"개인투자자는 올 들어 삼성전자를 8조원어치 넘게 순매수했다. 올초 주당 6만2400원까지 올랐던 만큼 4만~5만원대에서 사면 손쉽게 수익을 낼 수 있으리라 판단했다. 하지만 삼성전자는 ‘개미들’의 기대만큼 반등하지 못하고 있다. 그사이 한화생명, SK이노베이션 등 종목은 60~80%씩 반등했다. ‘골이 깊은 만큼 산이 높다’는 말이 이번 반등장에서 되풀이된 셈이다. 하지만 전문가들은 낙폭 과대주의 반등이 마무리된 뒤에는 다시 삼성전자 등 실적 개선주에 매수세가 몰릴 것으로 보고 있다. ‘삼성전자의 배신’을 말하기엔 이르다는 얘기다.국내 증시 반등은 지난달 19일 코스피지수가 1457.64로 바닥을 찍은 뒤 시작됐다. 이후 코스피지수는 저점 대비 25.3% 올랐다. 하지만 모든 종목이 크게 반등하진 못했다. 동학개미라 불리는 개인투자자가 많이 산 종목들이 특히 부진했다. 삼성전자는 이 기간 12.5% 반등하는 데 그쳤다. 개인들이 올 들어 1조원어치 순매수한 SK하이닉스도 18.0%로 기대에 못 미쳤다. 이 외에 한온시스템(-3.4%) 넷마블(4.7%) LG생활건강(9.1%) SK텔레콤(9.8%) 이마트(9.9%) 네이버(15.3%) 카카오(17.5%) 등도 반등이 시원치 않았다.반면 한화생명은 지난달 19일 후 반등장에서 87.6% 올라 코스피100지수에 편입된 대형주 가운데 가장 높은 상승률을 기록했다. SK이노베이션(68.1%) SK(63.6%) 두산밥캣(62.0%) 한국가스공사(61.5%) 삼성엔지니어링(61.2%) 등도 큰 폭으로 올랐다.전문가들은 ‘시장의 비관’이 줄면서 그동안 많이 떨어졌던 종목을 중심으로 강한 반등이 나오고 있다고 분석했다. 이진우 메리츠증권 연구원은 “미국 중앙은행(Fed)이 부실채권까지 사들이겠다고 하는 등 세계 각국이 기업 연쇄 도산을 막겠다는 의지를 보이면서 낙폭 과대주에 저가 매수세가 유입됐다”고 설명했다.최근 많이 오른 종목을 보면 대부분 그동안 최대 60% 이상 떨어진 종목들이다. 한화생명은 올 들어 지난달 19일까지 60.3% 하락했다. SK이노베이션(-61.8%) SK(-59.2%) 두산밥캣(-60.1%) 삼성엔지니어링(-63.2%) 등도 투자자 사이에서 ‘회사가 망하는 것이냐’는 말이 나올 정도로 떨어졌다.반면 한온시스템(-18.4%) 넷마블(-1.8%) LG생활건강(-13.0%) 오리온(-3.8%) 삼성전자(-23.0%) 네이버(-22.8%) 등은 상대적으로 낙폭이 크지 않아 반등폭도 작다는 설명이다. 한 운용사 펀드매니저는 “삼성전자는 코로나19 이전 외국인이 많이 들고 있던 종목”이라며 “외국인이 반등장에서도 계속 팔아 오르기 쉽지 않았다”고 말했다.낙폭 과대주가 올라 ‘키 맞추기’가 끝난 뒤에는 다시 재무가 튼튼하고 실적이 개선될 종목 중심의 장세가 펼쳐질 것이란 전망이 많다. 윤지호 이베스트투자증권 리서치센터장은 “코로나19에 따른 실물경제 충격이 본격화되고 있어 코스피지수가 지금까지처럼 빠르게 오르긴 힘들다”며 “이제는 숲이 아니라 나무를 봐야 할 시기”라고 말했다. 길게 보고 투자할 종목을 찾아야 한다는 얘기다.전문가들 사이에서도 삼성전자는 첫손에 꼽힌다. 이재만 하나금융투자 연구원은 “삼성전자 분기 이익이 적자가 아니라면 지금 주가 수준은 과도하다”며 “외국인 매도세가 진정되고 나면 반등폭이 클 수 있다”고 말했다. 금융정보업체 에프앤가이드에 따르면 삼성전자의 올해 영업이익 전망치는 34조4612억원으로 작년보다 24.1% 늘어날 것으로 예상된다.SK하이닉스(147.5%) 삼성SDI(59.6%) 네이버(36.3%) 등도 올해 이익 증가폭이 클 것으로 전망된다.유승민 삼성증권 투자전략팀장은 “투자자들의 위험 회피 성향이 누그러지면서 코로나19 취약 업종의 반등이 강하게 나타났지만 아직 사태가 끝난 게 아닌 만큼 다시 충격받을 가능성이 있다”며 “코로나19 영향이 덜한 종목인 삼성전자와 삼성바이오로직스, 현금 흐름이 탄탄한 KT&G와 고려아연, 비대면 확대에 혜택을 받을 수 있는 네이버와 엔씨소프트 등이 유망해 보인다”고 말했다.임근호 기자 eigen@hankyung.com▶ ▶
 ▶
ⓒ 한국경제 & , 무단전재 및 재배포 금지",/news/news_read.nhn?article_id=0004323611&office_id=015&mode=search&query=SK텔레콤&page=1
