head,text,url
,"[아시아경제 장효원 기자] 이미지센서 패키징 전문기업 아이에이네트웍스가 SK텔레콤 투자회사인 세계 1위 양자암호통신 기업 ‘ID Quantique’과 초소형 QRNG(양자난수생성기) 양산 개발을 위한 업무협약(MOU)를 체결했다고 2일 밝혔다.QRNG는 5G시대 최고의 보안 기술로 알려진 양자암호통신에서 가장 중요한 핵심기술이다. 해킹이 원천적으로 불가능한 암호키를 만들기 위해 불규칙한 난수 패턴을 생성하는 칩 솔루션이다.아이에이네트웍스는 QRNG 칩을 초소형으로 패키징할 수 있는 특허기술을 보유하고 있다. 2017년부터 현재까지 통신보안 암호화 센서에 적합한 소형 모듈 디자인 연구개발을 진행해왔으며 최근 ID Quantique과 양산 제품에 대한 기술 검증을 마쳤다.ID Quantique은 2018년 2월 SK텔레콤이 투자한 스위스의 양자암호통신 전문기업이다. 양자암호통신 관련 매출 및 특허 보유 세계 1위 업체다. 유럽연합의 양자암호 시험망 구축사업에 QKD(양자키분배기) 최대 공급사로 참여하는 등 QKD, QRNG를 중심으로 양자암호통신 핵심 기술을 고도화하고 있다.아이에이네트웍스와 ID Quantique 양사는 이번 MOU를 시작으로 아이에이네트웍스의 특허기술인 ‘NeoPAC 3D Thin 모듈’을 이용한 QRNG 개발 및 위탁생산에 대한 포괄적 협력을 구체화하기로 했다.ID Quantique은 아이에이네트웍스의 패키징 기술을 적용한 QRNG 신제품을 개발하고 적극적으로 시장 개척에 나설 예정이며, 아이에이네트웍스는 해당제품의 성공적인 상용화를 위해 대량 생산에 나설 계획이다.아이에이네트웍스 관계자는 “3년간의 선제적인 연구개발을 통해 초소형 QRNG 칩 개발을 위한 기술력과 요구사양(사이즈 및 신뢰성 기준)을 갖췄기 때문에 ID Quantique과 적시에 사업 협력을 진행할 수 있었다”며 “양사의 기술 협력을 통해 현존 가장 작은 크기의 QRNG 칩을 양산 및 상용화할 수 있을 것으로 기대한다”고 말했다.이어 “사업에 속도를 내기 위해 ID Quantique과 TF팀(태스크포스)을 구성해 지속적인 논의를 진행하고 있다”며 “양자암호통신 시장이 연평균 40%씩 크게 성장하고 QRNG 칩이 스마트폰 외에도 자율주행차 등 다양한 커넥티드 디바이스에 폭넓게 적용됨에 따라 시장 성장에 따른 관련 사업에 대한 기대가 높다”고 덧붙였다.장효원 기자 specialjhw@asiae.co.kr <ⓒ경제를 보는 눈, 세계를 보는 창 아시아경제 무단전재 배포금지>",/news/news_read.nhn?article_id=0004634324&office_id=277&mode=search&query=SK텔레콤&page=2
"▶ 헉! 소리나는 스!토리 뉴스 [헉스]▶ 클릭해, 뉴스 들어간다 [뉴스쿨]","[파이낸셜뉴스] 이미지센서 패키징 전문기업 아이에이네트웍스가 SK텔레콤 투자회사인 세계 1위 양자암호통신 기업 ID Quantique(ID 퀀티크)와 초소형 QRNG(양자난수생성기) 양산 개발을 위한 업무협약(MOU)를 체결했다고 2일 밝혔다.
 QRNG는 5G시대 최고의 보안 기술로 알려진 양자암호통신에서 가장 중요한 핵심기술이다. 해킹이 원천적으로 불가능한 암호키를 만들기 위해 불규칙한 난수 패턴을 생성하는 칩 솔루션이다.
 아이에이네트웍스는 QRNG 칩을 초소형으로 패키징할 수 있는 특허기술을 보유하고 있다. 2017년부터 현재까지 통신보안 암호화 센서에 적합한 소형 모듈 디자인 연구개발을 진행해왔으며 최근 ID 퀀티크와 양산 제품에 대한 기술 검증을 마쳤다.
 ID 퀀티크는 2018년 2월 SK텔레콤이 투자한 스위스의 양자암호통신 전문기업이다. 양자암호통신 관련 매출 및 특허 보유 세계 1위 업체다. 유럽연합의 양자암호 시험망 구축사업에 QKD(양자키분배기) 최대 공급사로 참여하는 등 QKD, QRNG를 중심으로 양자암호통신 핵심 기술을 고도화하고 있다.
 양사는 이번 MOU를 시작으로 아이에이네트웍스의 특허기술인 ‘NeoPAC 3D Thin 모듈’을 이용한 QRNG 개발 및 위탁생산에 대한 포괄적 협력을 구체화하기로 했다. ID 퀀티크는 아이에이네트웍스의 패키징 기술을 적용한 QRNG 신제품을 개발하고 적극적으로 시장 개척에 나설 예정이며, 아이에이네트웍스는 해당제품의 성공적인 상용화를 위해 대량 생산에 나설 계획이다.
 아이에이네트웍스 관계자는 “3년간의 선제적인 연구개발을 통해 초소형 QRNG 칩 개발을 위한 기술력과 요구사양(사이즈 및 신뢰성 기준)을 갖췄기 때문에 적시에 사업 협력을 진행할 수 있었다”며 “양사의 기술 협력을 통해 현존 가장 작은 크기의 QRNG 칩을 양산 및 상용화할 수 있을 것으로 기대한다”고 말했다.
 이어 “사업에 속도를 내기 위해 ID 퀀티크와 태스크포스를 구성해 지속적인 논의를 진행하고 있다”며 “양자암호통신 시장이 연평균 40%씩 크게 성장하고 QRNG 칩이 스마트폰 외에도 자율주행차 등 다양한 커넥티드 디바이스에 폭넓게 적용됨에 따라 시장 성장에 따른 관련 사업에 대한 기대가 높다”고 덧붙였다.



 ※ 저작권자 ⓒ 파이낸셜뉴스. 무단 전재-재배포 금지",/news/news_read.nhn?article_id=0004381679&office_id=014&mode=search&query=SK텔레콤&page=2
스위스 ID Quantique사와…세계 1위 양자암호통신 기업,"[아이뉴스24 문병언 기자] QRNG는 5G시대 최고의 보안 기술로 알려진 양자암호통신에서 가장 중요한 핵심기술이다. 해킹이 원천적으로 불가능한 암호키를 만들기 위해 불규칙한 난수 패턴을 생성하는 칩 솔루션이다.아이에이네트웍스는 QRNG 칩을 초소형으로 패키징할 수 있는 특허기술을 보유하고 있다. 2017년부터 현재까지 통신보안 암호화 센서에 적합한 소형 모듈 디자인 연구개발을 진행해왔으며 최근 ID Quantique과 양산 제품에 대한 기술 검증을 마쳤다.ID Quantique은 2018년 2월 SK텔레콤이 투자한 스위스의 양자암호통신 전문기업이다. 양자암호통신 관련 매출 및 특허 보유 세계 1위 업체다. 유럽연합의 양자암호 시험망 구축사업에 QKD(양자키분배기) 최대 공급사로 참여하는 등 QKD, QRNG를 중심으로 양자암호통신 핵심 기술을 고도화하고 있다.아이에이네트웍스와 ID Quantique 양사는 이번 MOU를 시작으로 아이에이네트웍스의 특허기술인 ‘NeoPAC 3D Thin 모듈’을 이용한 QRNG 개발 및 위탁생산에 대한 포괄적 협력을 구체화하기로 했다.ID Quantique는 아이에이네트웍스의 패키징 기술을 적용한 QRNG 신제품을 개발하고 적극적으로 시장개척에 나설 예정이며, 아이에이네트웍스는 해당제품의 성공적인 상용화를 위해 대량생산에 나설 계획이다.아이에이네트웍스 관계자는 “3년간의 선제적인 연구개발을 통해 초소형 QRNG 칩 개발을 위한 기술력과 요구사양을 갖췄다”며 “양사의 기술협력을 통해 현존 가장 작은 크기의 QRNG 칩을 양산 및 상용화할 수 있을 것으로 기대한다”고 말했다. moonnuri@inews24.com [ⓒ 아이뉴스24 무단전재 및 재배포 금지]",/news/news_read.nhn?article_id=0000527629&office_id=031&mode=search&query=SK텔레콤&page=2
,"이미지센서 패키징 전문기업 아이에이네트웍스는 SK텔레콤 투자사인 세계 1위 양자암호통신 기업 ID Quantique과 초소형 QRNG(양자난수생성기) 양산 개발을 위한 업무협약(MOU)를 체결했다고 2일 밝혔다.QRNG는 5G시대 최고의 보안 기술로 알려진 양자암호통신에서 가장 중요한 핵심기술이다. 해킹이 원천적으로 불가능한 암호키를 만들기 위해 불규칙한 난수 패턴을 생성하는 칩 솔루션이다.아이에이네트웍스는 QRNG 칩을 초소형으로 패키징할 수 있는 특허기술을 보유하고 있다. 2017년부터 현재까지 통신보안 암호화 센서에 적합한 소형 모듈 디자인 연구개발을 진행해왔으며 최근 ID Quantique과 양산 제품에 대한 기술 검증을 마쳤다.ID Quantique은 2018년 2월 SK텔레콤이 투자한 스위스의 양자암호통신 전문기업이다. 양자암호통신 관련 매출 및 특허 보유 세계 1위 업체다. 유럽연합의 양자암호 시험망 구축사업에 QKD(양자키분배기) 최대 공급사로 참여하는 등 QKD, QRNG를 중심으로 양자암호통신 핵심 기술을 고도화하고 있다.아이에이네트웍스와 ID Quantique 양사는 이번 MOU를 시작으로 아이에이네트웍스의 특허기술인 'NeoPAC 3D Thin 모듈'을 이용한 QRNG 개발 및 위탁생산에 대한 포괄적 협력을 구체화하기로 했다. ID Quantique은 아이에이네트웍스의 패키징 기술을 적용한 QRNG 신제품을 개발하고 적극적으로 시장 개척에 나설 예정이며, 아이에이네트웍스는 해당제품의 성공적인 상용화를 위해 대량 생산에 나설 계획이다.아이에이네트웍스 관계자는 ""3년간의 선제적인 연구개발을 통해 초소형 QRNG 칩 개발을 위한 기술력과 요구사양(사이즈 및 신뢰성 기준)을 갖췄기 때문에 ID Quantique과 적시에 사업 협력을 진행할 수 있었다""며 ""양사의 기술 협력을 통해 현존 가장 작은 크기의 QRNG 칩을 양산 및 상용화할 수 있을 것으로 기대한다""고 말했다.이어 ""사업에 속도를 내기 위해 ID Quantique과 TF팀(태스크포스)을 구성해 지속적인 논의를 진행하고 있다""며 ""양자암호통신 시장이 연평균 40%씩 크게 성장하고 QRNG 칩이 스마트폰 외에도 자율주행차 등 다양한 커넥티드 디바이스에 폭넓게 적용됨에 따라 시장 성장에 따른 관련 사업에 대한 기대가 높다""고 덧붙였다.[디지털뉴스국 김경택 기자] [ⓒ 매일경제 & mk.co.kr, 무단전재 및 재배포 금지]",/news/news_read.nhn?article_id=0004527798&office_id=009&mode=search&query=SK텔레콤&page=2
,[이데일리 박태진 기자] 아이에이네트웍스(123010)가 SK텔레콤 투자회사인 세계 1위 양자암호통신 기업 ID Quantique과 협업에 들어간다는 소식에 상승세다.마켓포인트에 따르면 2일 오전 9시 12분 현재 아이에이네트웍스는 전 거래일 대비 4.19% 오른 4600원에 거래되고 있다.아이에이네트웍스는 ID Quantique와 초소형 QRNG(양자난수생성기) 양산 개발을 위한 업무협약(MOU)를 체결했다고 이날 밝혔다. QRNG는 5G시대 최고의 보안 기술로 알려진 양자암호통신에서 가장 중요한 핵심기술이다. 해킹이 원천적으로 불가능한 암호키를 만들기 위해 불규칙한 난수 패턴을 생성하는 칩 솔루션이다.아이에이네트웍스와 ID Quantique 양사는 아이에이네트웍스의 특허기술인 ‘NeoPAC 3D Thin 모듈’을 이용한 QRNG 개발 및 위탁생산에 대한 포괄적 협력을 구체화하기로 했다. ID Quantique은 아이에이네트웍스의 패키징 기술을 적용한 QRNG 신제품을 개발하고 적극적으로 시장 개척에 나설 예정이다. 또 아이에이네트웍스는 해당제품의 성공적인 상용화를 위해 대량 생산에 나선다는 계획이다.박태진 (tjpark@edaily.co.kr) | ＜ⓒ종합 경제정보 미디어 이데일리 - 무단전재 & 재배포 금지＞,/news/news_read.nhn?article_id=0004587435&office_id=018&mode=search&query=SK텔레콤&page=2
,"신종 코로나바이러스 감염증(코로나19) 공포에 지난 주 8.1% 폭락한 코스피지수가 상승 출발했다. 지난 달 25일 이후 4거래일만이다. 저가매수세가 유입되고 있는 것으로 풀이된다.2일 오전 9시5분 현재 코스피지수는 전거래일보다 11.15포인트(0.56%) 오른 1998.16에 거래되고 있다. 이날 1997.03에 상승 출발한 지수는 개장 이후 등락을 거듭하고 있다. 외국인은 900억원의 순매도고, 개인과 기관은 각각 564억원과 323억원의 매수 우위다.시가총액 상위권 종목들 모두 상승세다. 삼성전자 SK하이닉스 삼성바이오로직스 네이버 LG화학 셀트리온 LG생활건강 등이 오르고 있다. SK하이닉스의 경우 2%대 상승세를 기록 중이다. 현대모비스 SK텔레콤의 전거래일 보다 각각 4.76%, 0.24% 내려 거래되고 있다.코스닥지수 역시 오르고 있다. 같은 시간 코스닥지수는 전날보다 8.91포인트(1.46%) 상승한 619.64에 거래되고 있다. 외국인과 기관이 각각 164억원, 402억원 사들이고 있다. 개인은 217억원 팔고 있다.원·달러 환율은 하락 중이다. 서울외환시장에서 원·달러 환율은 전날보다 9.5원 내린 1204.2원에 거래되고 있다.윤진우 한경닷컴 기자 jiinwoo@hankyung.com▶ ▶
 ▶
ⓒ 한국경제 & , 무단전재 및 재배포 금지",/news/news_read.nhn?article_id=0004299224&office_id=015&mode=search&query=SK텔레콤&page=2
ㆍ5G이동통신·전기차에 쓰이는 전력반도체용 웨이퍼 생산 위해,"SK실트론이 전기자동차와 5세대(5G) 이동통신 등에 활용되는 전력반도체용 웨이퍼 생산을 위해 미국 듀폰의 유관 사업부서를 인수했다.SK실트론은 듀폰의 ‘실리콘 카바이드 웨이퍼(SiC 웨이퍼) 사업부’를 4억5000만달러(약 5400억원)에 인수했다고 2일 밝혔다. SK실트론은 경북 구미시에 본사를 두고 있는 국내 유일의 반도체 실리콘 웨이퍼 제조 업체다.SiC 웨이퍼는 고경도·내전압·내열의 특성을 갖고 있어 에너지 효율이 중요한 전기차와 5G 네트워크 등에 사용되는 전력반도체용으로 각광받고 있다. 최근 자동차업체가 전기차 시장에 앞다퉈 진출하는 데다 통신업체의 5G 보급이 확대되면서 전력반도체 수요도 빠르게 증가하는 추세다.SK실트론은 이번 인수를 통해 듀폰이 보유한 생산 역량과 기존 주력 사업 간 시너지를 극대화할 수 있을 것으로 내다봤다. SK그룹 관계자는 “SK하이닉스뿐 아니라 비메모리 반도체를 생산 중인 다른 기업들과도 웨이퍼 비즈니스를 다변화하는 측면이 있을 것”이라고 말했다.글로벌 5대 웨이퍼 제조사 중 하나인 SK실트론의 지난해 연간 매출은 1조5429억원을 기록했다. 전 세계 실리콘 웨이퍼 판매량의 17%를 차지하는 SK실리콘은 미국·일본·중국·유럽·대만 등 5곳에 해외법인도 두고 있다. 2001년에 설립된 미국 법인에서는 인텔·마이크론 등 8개 고객사를 대상으로 실리콘 웨이퍼를 판매 중이다.최근 3년간 SK그룹의 대미 투자액은 50억달러(약 5조9850억원)에 달한다. 에너지·화학과 정보통신기술(ICT)은 물론 배터리, 제약, 바이오, 소재 분야에 전방위적으로 투자한 결과다. 지난해 SK(주)는 미국 캘리포니아주 새크라멘토에 의약품위탁생산(CMO) 사업 통합법인 SK팜테코를 설립했다. SK텔레콤은 미국 최대 지상파 방송사 싱클레어와 5G 기반의 방송 솔루션을 개발 중에 있다.SK실트론 관계자는 “SiC 웨이퍼 생산량 증대와 함께 미국 내 고용 창출도 예상된다”고 말했다.구교형 기자
wassup01@kyunghyang.com©경향신문(www.khan.co.kr), 무단전재 및 재배포 금지",/news/news_read.nhn?article_id=0002995129&office_id=032&mode=search&query=SK텔레콤&page=2
,"[이데일리 경계영 기자] SK텔레콤(017670)은 윤성은 SK텔레콤 CR혁신실장과 하성호 센터장, 성석함 실장이 각각 보통주 200주, 500주, 115주를 매입했다고 2일 공시했다.경계영 (kyung@edaily.co.kr) | ＜ⓒ종합 경제정보 미디어 이데일리 - 무단전재 & 재배포 금지＞",/news/news_read.nhn?article_id=0004587528&office_id=018&mode=search&query=SK텔레콤&page=1
-통신3사 올해 첫 5G 성적표 보니,"[헤럴드경제=정태일 기자] KT가 5세대(5G)통신 시장에서 ‘샌드위치 신세’가 됐다. 1위 사업자 SK텔레콤과의 격차는 더욱 벌어지고 있고, LG유플러스는 KT를 턱밑까지 추격 중이다.특히 5G 상용화 첫달인 지난해 4월 대비 올해 1월 순증 기준 가입자가 가장 많이 줄어든 통신사는 KT인 것으로 나타났다. 반면 SK텔레콤은 같은 기간 가입자를 40% 가까이 늘렸고, LG유플러스는 초기 수준을 유지했다.2일 과학기술정보통신부 ‘무선 통신서비스 통계 현황’에 따르면 올해 1월 통신 3사의 5G 순증 가입자는 SK텔레콤 13만1284명, KT 8만7852명, LG유플러스 7만1109명으로 집계됐다.지난해 4월 5G 가입자가 9만5265명이었던 SK텔레콤은 올해 1월 순증 가입자를 38% 늘렸다. LG유플러스는 7만1725명에서 올 1월 0.86% 소폭 줄었지만 사실상 첫달 가입자 수준을 확보했다.하지만 KT는 상용화 첫달 10만4696명으로 3사 중 가장 많은 가입자를 확보했지만, 올해 1월 순증 가입자는 16% 이상 감소해 첫달 대비 가입자 성적은 가장 저조했다.KT는 지난해 6월 순증 가입자에서 LG유플러스보다 6700명 이상 밀리며 한때 3위로 추락하기도 했다. 이후 역전에 성공하며 지난해 8월에는 LG유플러스와의 격차를 8만7000명까지 벌렸다.이후 양사 격차는 2~3만명 수준으로 좁혀진 뒤 올해 1월 들어 1만6700명 수준으로 더욱 줄어들었다.상용화 첫달 SK텔레콤에도 앞섰던 KT는 지난해 8월 순증 가입자로 SK텔레콤에 16만명 이상 뒤쳐졌다. 이후 격차를 지속 좁히고 있지만 올해 1월 양사 격차는 4만3000명 이상 보이고 있다.KT 내부에서도 5G 시장에서 SK텔레콤을 바짝 추격하고 LG유플러스를 따돌리는 목표를 세웠지만 갈수록 ‘낀 신세’가 굳어지는 것에 대한 우려 목소리가 나오고 있다.KT 고위 관계자는 “점유율로 보면 5%포인트 가량 차이는 아직 유지하고 있지만 LG유플러스가 상당한 수준까지 추격해온 것은 맞다”고 밝혔다.올해 1월 누적 기준 5G 시장에서 3사 점유율은 SK텔레콤 45%, KT 30%, LG유플러스 25%다.통신업계 관계자는 “갤럭시 S20 시리즈 출시 이후 3사 간 가입자 유치 경쟁이 과열되고 5G 중저가폰이 늘어날 경우 점유율 변동이 일어날 가능성이 있다”고 말했다.killpass@heraldcorp.com
- Copyrights ⓒ 헤럴드경제 & heraldbiz.com, 무단 전재 및 재배포 금지 -",/news/news_read.nhn?article_id=0001642588&office_id=016&mode=search&query=SK텔레콤&page=1
"KT·LG유플러스, 75억 원 규모 지원…SK텔레콤 내부 검토 중","[더팩트│최수진 기자] 통신업계가 '신종 코로나바이러스 감염증(코로나19)' 장기화로 어려움을 겪는 소상공인 지원을 위해 팔을 걷어붙였다.2일 업계에 따르면 KT와 LG유플러스 등이 대리점 상생안을 발표했다. 대리점 월세 지원 등을 통해 부담을 덜겠다는 취지다.우선, KT는 2월 한 달간 전국의 매장을 대상으로 월세를 지원하며, 피해가 심한 대구·경북 지역은 50%, 나머지 지역은 30%를 지원한다. 또, 코로나19로 인한 판매 감소에 따른 유통망의 어려움을 지원하기 위해 2월 초부터 2회에 걸쳐 대리점 채권 여신기한 연장, 상생 지원책 강화 등 영업 정책 지원을 시행하고 있다.전국에 소재한 KT 대리점의 매장은 2500여 개이며 이번에 지원하는 월세 및 정책 지원 금액은 2월 초부터 시행한 지원과 합쳐 총 50억 원 수준이다.KT는 ""코로나19로 고통받는 유통망과 상생하고 힘을 합쳐 위기를 극복하기 위해 전 지역의 대리점에 실질적인 도움을 줄 수 있는 방안을 마련했다""며 ""매장 내 방역 용품 제공도 한층 강화해 방문 고객과 유통망 종사원의 안전을 지킬 수 있도록 최선을 다할 것""이라고 밝혔다.LG유플러스도 마찬가지다. 코로나19가 장기화 국면으로 접어들자 영업에 어려움을 겪는 대구·경북 지역을 비롯해 전국 2000개 대리점 매장을 돕기 위해 2월 매장 운영자금 25억 원을 긴급 지원했다.전국 LG유플러스 대리점 매장은 대구·경북 100개 포함 약 2000개이다. 지원 자금은 매장 운영 시 발생하는 인건비, 월세 등 비용 부담 경감에 이용된다. '코로나19' 확산으로 인한 영업 현장 어려움을 함께 극복하기 위해 운영자금을 지원하기로 결정했다.LG유플러스 관계자는 ""어려움에 처한 대리점에 보탬이 되고자 2월 매장 운영자금으로 지원하기로 했다""며 ""코로나19를 한마음으로 극복하기 위해 통신사가 할 수 있는 최선의 지원책을 앞으로도 지속 고민할 것""이라고 말했다.SK텔레콤 역시 대리점 지원 방안에 대해 내부적으로 논의하고 있는 상황이다. SK텔레콤 관계자는 ""관련 내용을 검토하고 있지만 아직까진 정해진 게 없다""고 밝혔다.jinny0618@tf.co.kr저작권자 ⓒ 특종에 강한 더팩트 & tf.co.kr 무단 전재 및 재배포 금지",/news/news_read.nhn?article_id=0000017389&office_id=629&mode=search&query=SK텔레콤&page=1
"‘주총 시즌’ 주요 안건 미리보기삼성전자, 전자투표제 활용방안 이목LG전자, 권봉석 단독사장 체제 안착SKT 사명변경·자회사 상장 언급 관심","3월 정기 주주총회 시즌이 돌아왔다. 때마침 전자투표제를 도입한 기업들도 늘고 있어 소액 주주의 권리를 행사하기에 어느 때보다 좋은 상황이다. 이번 주총에서 결정된 안건에 따라 기업의 1년 향방이 정해지는 만큼 눈여겨볼 만한 기업별 주총 안건을 정리했다.3월 주주총회 중 업계의 이목이 집중된 건 단연 25일로 예정된 한진칼 주총이다. 조현아 전 대한항공 부사장-KCGI-반도건설의 3자 주주연합과 조원태 한진그룹 회장이 치열한 지분확보 경쟁을 벌이면서, 한진그룹 지주회사인 한진칼 주가는 지난 21일부터 28일까지 코스피 하락세와 무관하게 계속해서 우상향했다.이번 주총 관전 포인트는 캐스팅보트 역할을 할 국민연금과 소액주주의 향방이다. 국민연금이 보유한 한진칼 지분은 5% 미만(2.9%)이지만, 양 진영 간의 지분율 차이가 근소해 2.9% 지분도 상당한 영향력을 가질 전망이다. KGCI는 지난 13일 한진칼에 주총 전자투표제를 도입할 것을 제안한 바 있다.18일로 예정됐던 삼성전자 정기 주주총회에서는 올해 처음으로 도입한 전자투표제 활용 방안에 이목이 쏠린다. 이번 주총부터 주총 장소로 직접 가지 않고 온라인 전자투표만으로도 의결권을 행사할 수 있게 되면서, 주식을 소액만 들고 있는 주주들도 투표에 쉽사리 참여할 수 있게 됐다. 삼성전자 측은 코로나19 확산 여파로 인해 2월 말일까지 주총 장소를 대관하지 않은 것으로 알려져 주총 일정 변경 가능성이 열려있다.이달 26일 열리는 LG전자 주총에서는 CEO로 취임한 권봉석 LG전자 사장을 주목할만하다. 권 사장은 지난해 말 사장단 인사에서 조성진 LG전자 부회장이 물러난 후 최고경영자 자리에 앉았다. 권 사장처럼 대표 1명의 단독체제가 시행된 것은 6년 만의 일인 만큼, 구광모 LG그룹 회장 체제 하에서 보다 핵심적인 역할을 수행할 권 사장의 발언이 그만큼 중요해졌다.같은 날로 예정된 SK텔레콤 주총에서는 이번 주총에선 박정호 사장과 조대식 SK수펙스추구협의회 의장의 재선임, 사외이사·감사위원 선임 등의 안건이 오를 예정이다. 박 사장의 연임이 유력시되는 분위기 속에 그가 언급했던 사명 변경, 자회사 상장 등과 관련한 추가 설명이 있을지 이목이 쏠린다. SK텔레콤은 통신기업의 유전자를 ICT기업으로 탈바꿈하겠다는 목표로, 지난 조직개편에서 조직을 이동통신(MNO) 부문과 신사업(New Biz)으로 부문으로 분리한 바 있다. 김유진 기자
- Copyrights ⓒ 헤럴드경제 & heraldbiz.com, 무단 전재 및 재배포 금지 -",/news/news_read.nhn?article_id=0001642686&office_id=016&mode=search&query=SK텔레콤&page=1
