head,text,url
"SKT, 블루 모델로 3040세대 공략KT 온라인 첫날 절반이 레드 선택LGU+ 핑크, 판매량의 41% 차지","삼성전자의 플래그십 스마트폰 갤럭시S20이 신종 코로나바이러스 감염증(코로나19) 여파로 고전하는 가운데, SK텔레콤 KT LG유플러스 등 이동통신 3사가 ‘컬러 마케팅’을 앞세워 반전을 노리고 있다. 통산 3사는 자사에서만 구입이 가능한 블루(SK텔레콤), 레드(KT), 핑크(LG유플러스) 색깔의 전용폰을 각각 출시해 호응을 얻고 있다.
SK텔레콤은 지난해 갤럭시노트10에 이어 갤럭시S20까지 2년째 ‘블루’를 전면에 내세워 30, 40대를 공략하고 있다. 갤럭시S20 사전예약 고객 중 약 40%가 블루 모델을 선택했는데, 이는 지난해 갤럭시노트10 당시(약 35%)보다 ‘블루’ 선호가 늘어난 것이다. 특히 30, 40대는 50%가 블루를 골랐다.
SK텔레콤은 출시 전 삼성전자와 협의 과정에서 글로벌 색채전문 기업 팬톤이 ‘올해의 색’으로 선정한 블루를 채택해줄 것을 적극 요구한 것으로 전해졌다. SK텔레콤 관계자는 “한국 경제의 젊은 축인 30, 40대가 블루의 진취적인 이미지에 반응하고 있다”며 “컬러 마케팅이 코로나19라는 악재 극복의 촉매제가 되길 기대한다”고 말했다. KT는 레드 모델을 통해 20, 30대 고객 확대를 노리고 있다. KT에 따르면 사전개통 첫날인 27일 KT 공식 온라인몰 KT숍에서 갤럭시S20을 개통한 고객의 55%가 ‘레드’를 택했다. 특히 KT의 레드 전용 모델을 선택한 고객의 82%가 2030세대였다. KT는 2030세대에 인기가 높은 가수 제니(블랙핑크)를 모델로 내세웠고, 제니의 광고영상은 공개 10일 만에 누적 조회수 1000만 뷰를 돌파하는 등 호응을 얻고 있다. KT는 레드가 여성뿐 아니라 남성 고객 확장에도 효과적이라고 보고 있다. 개통 첫날 레드 모델 구입자의 60%가 남성이었을 정도다. KT관계자는 “한국 사람에게 레드는 성별을 넘어 보편적인 열정을 드러내는 색”이라고 설명했다.
LG유플러스는 올해 처음 ‘핑크’ 전용폰을 도입했다. 갤럭시S20 사전계약 단계에서 36.1%를 차지했던 ‘핑크’ 모델은 개통 첫날 판매량의 41%를 차지하며 인기를 이어갔다. 지난해 갤럭시S10 당시 가장 많이 팔린 실버(39%)를 넘어선 것이다. LG유플러스가 도입한 핑크는 미국의 IT전문매체인 안드로이드센트럴로부터 갤럭시 S20시리즈 중 ‘최고의 색상’으로 평가받기도 했다.
특히 LG유플러스는 디지털전문 광고대행사인 펜타클과 함께 핑크 알리기에 적극 나서고 있다. LG유플러스 관계자는 “스마트폰 시장에서 찾아보기 어려운 핑크 컬러처럼, LG유플러스를 선택하면 ‘선을 넘는 혜택과 기능’이 있다는 점을 강조하고 있다”고 말했다.유근형 기자 noel@donga.comⓒ 동아일보 & donga.com, 무단 전재 및 재배포 금지",/news/news_read.nhn?article_id=0003272789&office_id=020&mode=search&query=SK텔레콤&page=2
전산망·보안 수준따라 희비 갈려,"신종 코로나바이러스감염증(코로나19) 확산으로 다수 기업이 재택근무를 실시하는 가운데 ‘스마트 오피스’ 수준에 따라 희비가 엇갈리고 있다. 정보통신기술(ICT)을 적극 도입한 SK텔레콤 등은 업무가 큰 무리 없이 진행되고 있다는 목소리가 들리지만 그렇지 않은 다수 기업은 업무 차질이 빚어지고 있다. SK텔레콤은 지난 25일부터 전 직원을 대상으로 시행했던 재택근무를 8일까지 전격 연장키로 했다. 박정호 사장을 포함한 임원 100여명은 지난 28일 이번 결정을 위한 전사 임원 회의를 원격으로 실시했다. 임원들은 최대 100명까지 통화 가능한 ‘T그룹 통화’를 이용해 1시간30분가량 회의를 했다. 박 사장은 통화에서 “100명이 함께 그룹 통화로 회의하기는 처음이다. 우리 모두가 대단한 경험을 하고 있다”며 “재택근무와 온라인 업무 방식이 이번을 계기로 앞으로 더 퍼지고, 발전할 것”이라고 말했다. SK텔레콤은 이처럼 업무 회의, 협업 플랫폼, 클라우드 환경, 마이크로소프트 협업 메신저 ‘팀즈(Teams)’ 등 재택근무에 필요한 인프라를 대부분 갖추고 있다. 2015년부터 운영해 온 ‘가상 데스크톱 인프라(VDI)’ 마이데스크(Mydesk) 시스템은 인터넷이 되는 곳이라면 어디서든 본인 확인 후 회사 클라우드에 접속해 근무할 수 있다. 직원들의 만족도도 높다. 이태훈 SK텔레콤 커뮤니케이션센터 매니저는 1일 “평소 회의가 20분 안팎이 걸린다면 T그룹 통화 회의는 10분 정도로 훨씬 압축적으로 진행돼 좋다”며 “집에서 조용히 혼자 일을 하니까 보고서를 작성할 때도 더 집중하게 된다”고 했다. 지난 27일부터 원격근무 체제로 전환한 네이버와 카카오는 각각 ‘라인웍스’와 ‘아지트’라는 자체 개발 프로그램을 활용한다. 재택근무 ‘실험’이 근무 형태 혁신의 계기가 될 수 있다는 기대감도 감지된다. 업계 관계자는 “출근과 원격근무 일수를 필요에 따라 조정할 수도 있고, 워킹맘은 아예 재택근무를 하면서 출퇴근 시간을 줄이고 자녀양육에 에너지를 더 쓸 수 있지 않겠느냐”며 “인프라를 갖춘 기업은 이번 일을 계기로 업무방식을 바꿀 수 있을 것”이라고 내다봤다. 하지만 인프라를 충분히 갖추지 못한 기업들은 재택근무를 아예 실시하지 못하거나 실시하더라도 업무가 제대로 이뤄지지 않고 있다. 시중은행도 지난 25일부터 필수 인력에 대한 재택근무를 실시했다. 그러나 은행 전산망 접속이 원활하지 않아 일을 못 하는 직원이 나오고 있다. 은행에 근무하는 A씨는 “재택근무 지시가 떨어졌는데 막상 일을 하려니 접속이 안 돼 일손을 놓고 있다”고 했다. 대기업 IT계열사에 근무하는 B팀장은 재택근무를 하고 싶어도 할 수가 없다. 그는 “회사의 공식 방침은 ‘가급적’ 재택근무다. 나의 경우 외부 업체와 협업 프로젝트를 진행 중인데, 보안을 유지하면서도 외부인에게 회사망에 접속할 권한을 주는 인프라가 없다”고 했다. B팀장은 “사옥에 코로나19 확진자가 나오지 않기만을 바라며 하루하루 초조하게 보내고 있다”고 토로했다.강주화 임세정 기자 rula@kmib.co.kr GoodNews paper ⓒ , 무단전재 및 재배포금지",/news/news_read.nhn?article_id=0001294102&office_id=005&mode=search&query=SK텔레콤&page=2
,"‘7만대 vs 14만대’지난달 27일, 삼성전자 올해 전략 스마트폰인 ‘갤럭시S20’ 개통 첫날 가입 대수는 전작인 ‘갤럭시S10’의 절반에 그쳤다. 신종 코로나바이러스 감염증(코로나19) 여파로 외출을 꺼리는 소비자들이 많아진 가운데 사전 예약 물량도 실제 개통까지 이어지지 않고 있어서다. 현재 통신시장의 유일한 신작인 갤럭시S20 판매 부진에, 삼성전자와 이동통신 3사는 사은품 지급 기한을 늘리고 방문 개통 서비스 등을 진행하면서 소비 촉진에 나서고 있다.코로나19로 소비 심리가 잔뜩 얼어붙으면서 기업들도 경기 불씨 살리기에 안간힘이다. 가격 할인에서부터 온라인 창구를 적극 활용한 비대면 판매 강화와 더불어 현금 지원 정책 카드까지 꺼내 들었다.1일 이동통신업계에 따르면 지난달 27일 갤럭시S20 개통량은 7만800여대로 추산된다. 20~26일 예약 구매를 한 건수 36만여대의 20%만 개통됐다. 보통 예약 물량의 50%가 개통 첫날에 몰리는 점을 감안하면 저조한 수준이다. 갤럭시S10(14만여대), ‘갤럭시노트10’(22만여대) 첫날 개통량과 비교해도 기대 이하다. 삼성전자 관계자는 “따로 개통할 필요 없이 원래 쓰던 스마트폰의 유심만 옮겨 꼽으면 되는 자급제 판매 건수를 합치더라도 S10 대비 감소폭이 20% 정도”라고 전했다.저조한 개통 건수는 발길이 뚝 끊긴 오프라인 매장의 상황과 무관하지 않다. 이동통신사들이 최대한 온라인 판매와 찾아가는 개통 서비스로 구매를 유도하는 이유다. LG유플러스의 경우 코로나19 사태가 심각한 대구와 경북 지역에서 갤럭시S20을 고객 집으로 배송해 주는 ‘온라인 개통 택배 배송 서비스’를 한시적으로 시행 중이다. SK텔레콤은 온라인 주문 고객에게 근거리무선통신(블루투스) 이어폰 등 사은품을 지급하고 있다. 고객이 원하는 시간과 장소를 선택하면 전문 상담사가 방문해 개통 작업과 더불어 번호, 사진 등을 옮겨 주는 ‘오늘도착’ 서비스도 제공한다. KT에선 지난달 26일 최초로 유튜브 생중계를 활용한 비대면 론칭 행사를 열고 접속 시청자들에게 노트북PC 등 경품을 지급했다. 매장 살리기를 위한 긴급 자금 지원도 이어지고 있다. KT는 한달 동안 매장당 최고 한도 300만원 내에서 전국 2,500개 매장의 월세를 지원한다. 대구·경북 지역은 기존 월세의 50%, 나머지 지역은 30%까지 KT로부터 지원받을 수 있다. 대리점 채권 여신기한 연장 등 2월 초부터 시행 중인 지원까지 합치면 KT의 대리점 지원 자금은 총 50억원이다. LG유플러스도 전국 2,000개 매장을 대상으로 운영자금 25억원을 지원하기로 결정했고, SK텔레콤은 월세 지원 등을 포함한 영업망 지원 대책을 검토 중이다.자동차 업계 또한 소비 활성화에 시동을 걸고 나섰다. 최근 정부가 경기 부양을 위해 부활시킨 개별소비세 인하 정책으로 차값 인하에 들어갔다. 정부는 3월부터 6월까지 한시적으로 승용차 개소세를 5%에서 1.5%로 70% 이상 감면하기로 결정한 가운데 완성차 업계에선 쌍용차가 개소세 인하분을 가장 먼저 반영했다. 쌍용차는 G4렉스턴, 코란도, 티볼리 등의 차량 가격을 최소 73만원부터 143만원까지 낮췄다. 르노삼성차도 최대 143만원까지 차량 구매 비용을 낮췄다. 이달 출시 예정인 신차 ‘XM3’도 책정가격에서 70만원 정도 가격 인하가 예상된다. 한국GM은 모델별로 77만∼143만원의 가격 인하를 실시했다. 최근 출시한 신차 ‘트레일블레이저’는 시작가가 1,995만원에서 1,910만원으로 떨어졌다. 현대·기아차의 경우엔 전 차종에 걸쳐 최대 143만원의 개소세 인하 효과에, 추가 인하까지 계획하고 있다. 현대·기아차 관계자는 “개소세 70% 인하와 함께 2일 회의에서 결정하는 3월 판매조건 혜택까지 더하면 소비자들의 혜택은 더 많아질 것”이라고 말했다.유통업계에선 생필품 할인으로 소비자들에게 다가가고 있다. 기존 대형마트와 온라인 쇼핑몰을 시작으로 편의점 업계까지 줄줄이 먹거리와 생필품 할인 행사에 동참하는 모습이다.편의점 이마트24는 3월 한달 간 라면과 간편식 같은 먹거리, 휴지와 위생용품 등의 생활필수품 총 440종을 대상으로 할인 혜택을 제공한다고 1일 밝혔다. 이는 이마트24의 역대 행사 품목 가운데 최대 규모다. 안혜선 이마트24 마케팅담당 상무는 “모두가 힘든 시기에 생필품을 가까운 거리에서 편하고 빠르게 구매할 수 있도록 행사를 준비했다”며 “가맹점에 원활하게 상품이 공급될 수 있도록 재고 확보에 만전을 기할 계획”이라고 말했다. 맹하경 기자 hkm07@hankookilbo.com임소형 기자 precare@hankookilbo.com류종은 기자 rje312@hankookilbo.com",/news/news_read.nhn?article_id=0000472547&office_id=469&mode=search&query=SK텔레콤&page=2
이달 말께 주총 승인 거쳐 공식 취임5G·유료방송 합산규제·K-뱅크 숙제,"이달 말 열리는 KT 제38기 정기주주총회의 최대 이슈는 KT 최고경영자(CEO) 내정자인 구현모 사장의 선임이다. 이번 주총에서 CEO 선임 건이 최종 확정되면 ‘구현모 호(號) KT'가 정식 출범하게 된다.‘정통 KT맨’인 구 사장은 선임 과정에서부터 이전 CEO들과 다른 모습을 보여줬다. 낙하산, 외풍 논란에 휩싸여온 KT가 구 사장을 필두로 경영 혁신을 이루고 진정한 ‘국민기업’으로 거듭날지 주목된다.2일 업계에 따르면 KT는 이달 말 주총을 열고 구 사장 선임 안건 등을 의결한다. 아직 구체적인 주총 날짜는 공시되지 않았지만, 근무일인 오는 26~27일 혹은 30~31이 될 것으로 예상된다. 지난해 제37기 주총의 경우 3월 29일에 개최됐다.구 사장은 이 자리에서 승인을 거쳐 KT CEO로 공식 취임할 예정이다. 앞서 KT 이사회는 지난해 말 전원합의로 그를 차기 회장 후보로 확정했다.구 사장은 1987년 KT에 입사해 올해로 무려 34년 동안 KT에서 일했다. 전문성에는 의심할 여지가 없다는 게 업계의 평가다. 그는 회사 내 다양한 업무를 담당하며 직원들과 거리낌 없이 소통해온 것으로 알려졌다. 구 사장은 KT T&C부문 T&C운영총괄, 비서실장, 경영지원총괄, 경영기획부문장을 거쳐 커스터머&미디어부문장(사장)을 역임했다.KT 이사회는 ‘회장’이라는 직급이 국민기업인 KT에 적합하지 않다는 의견을 반영해 ‘대표이사 회장’ 제도를 ‘대표이사 사장’ 제도로 변경하고 급여 등의 처우도 이사회가 정하는 수준으로 낮추기로 했다.그만큼 국민기업의 면모를 갖추겠다는 게 구 사장의 의지다. 올해 KT의 인사 키워드도 ‘고객 중심’이었다. 구 사장은 “고객들에게 더 밀착하고 우리 안에서 고객들이 원하는 것을 아주 빠르고 민첩하게 제공할 수 있는 조직”이 돼야 한다고 역설하기도 했다.새로 출범하는 구현모 號 KT의 앞날이 순탄한 것만은 아니다. 먼저 이동통신(MNO)에서는 5세대 이동통신(5G) 점유율 확대가 시급하다. 지난해 4월 5G 상용화와 동시에 KT는 약 39% 5G 가입자 점유율을 기록하며 SK텔레콤을 제치고 1위에 올라섰다.하지만 초반의 기세를 이어가지 못하고 바로 다음달 점유율이 6.5% 감소한 32.1%를 기록하며 2위로 떨어졌다. 현재는 기존 롱텀에볼루션(LTE) 시장과 비슷한 수준으로 SK텔레콤과의 격차가 다시 벌어진 상태다. 그 뒤를 LG유플러스가 무서운 기세로 뒤쫓고 있다.5G 특화 콘텐츠 확보도 숙제다. 지난해 KT는 가상현실(VR)·증강현실(AR) 등 다양한 5G 콘텐츠를 선보였지만, 특별히 성공하거나 기억에 남는 서비스가 없다는 게 시장의 평가다.지난해 경쟁사인 SK텔레콤과 LG유플러스가 성공적으로 마무리 지은 유료방송 인수합병(M&A)도 KT에는 부담이다. KT는 그간 유료방송 시장 1위 자리를 공고히 해왔지만, 순식간에 점유율 격차가 좁혀졌다.현재 1위는 점유율 31%의 KT-KT스카이라이프다. 이어 LG유플러스-CJ헬로가 유료방송 시장에서 가입자 800만명, 점유율 24.5%로 2위를 차지하게 된다. 3위는 SK텔레콤이다. SK브로드밴드와 티브로드 합병 후 SK텔레콤은 유료방송 가입자 약 777만명, 점유율 약 23.9%로 몸집이 커진다.이 때문에 업계에서는 KT가 1위 자리를 지키기 위해 ‘딜라이브’를 인수할 것이라는 관측이 계속해서 제기됐다. 하지만 국회의 유료방송 합산규제 사후규제 논의가 장기화하면서 KT의 딜라이브 인수는 추진 동력을 상실한 상태다.합산규제는 케이블TV와 위성방송, IPTV 사업자가 특수 관계자인 타 유료방송 사업자를 합산해 전체 유료방송 가입자 수 3분의 1을 넘지 못한다는 내용으로, 작년 6월 27일 일몰됐다. KT의 경우 딜라이브 등 다른 유료방송 기업을 인수하면 점유율 33%를 넘게 돼 합산규제 영향을 받는다. 구 사장이 이 문제를 어떻게 풀어낼지가 유료방송 업계의 관심사다.K-뱅크 대주주 전환도 숙제다. KT는 금융당국 K뱅크 대주주 적격성 심사에서 계속 탈락하며 일반 주주에 머물고 있다. 안정적인 은행 사업을 하기 위해서는 대주주 지위를 획득하는 것이 중요하다.업계 관계자는 “이전 외부 출신 KT CEO들이 특정한 본인의 업적을 남기고자 했다면, 구 사장은 겉으로 보이는 모습보다 업무 효율과 결과물을 가장 중요시하는 인물”이라며 “구 사장이 올해 KT에 산적한 현안을 어떻게 풀어갈지 주목된다”고 말했다.데일리안 김은경 기자 (ek@dailian.co.kr)ⓒ (주)데일리안 - 무단전재, 변형, 무단배포 금지",/news/news_read.nhn?article_id=0002386011&office_id=119&mode=search&query=SK텔레콤&page=2
,"[머니투데이 우경희 기자, 안정준 기자, 유영호 기자, 최민경 기자] [[코로나에도 멈추지 않는 기업들]②]""기업의 불이 절대 꺼지지 않도록 해야합니다"" 기업들이 '컨틴전시 플랜(위기시 비상대응 계획)'을 속속 가동하며 최악의 위기를 피해 '차선책'을 택하고 있다. 코로나19
우려 속에 무리하게 '직장 근무'를 고집하다 확진자가 나와 낭패를 당하는 것보다 업무효율은 떨어지지만 '재택 근무'로 길게 보면서 업무를 지속한다는 포석이다. ☞관련기사: [르포]코로나19도 꺼뜨리지 못한 산업현장의 '불빛'코로나19 직면한 기업들 ""운전자금난·대형마트 규제 해결해달라""단 한번 멈춰도 10조원 날아간다…이 사업장 어디길래?하루만 멈춰도 3600억 증발..'꺼지지 않는 불꽃' 정유공장의 심장은?1일 관련 업계에 따르면 주요 기업들이 '인력자원 보호' 차원에서 컨틴전시 플랜으로 업무를 대전환하고 있다. SK그룹은 국내 그룹 중 최초로 코로나19 감염 방지 차원에서 지난달 25일부터 전사적 재택근무에 돌입했다. 필수인력 30%를 뺀 나머지 70% 사원들은 비교적 안전한 집에서 일하고 있다. 반면 LG전자는 출퇴근 시간을 탄력적으로 운영하며 전사적 재택 근무의 전 단계로 필요한 시스템을 점검하고 있다. 업무용 클라우드의 원활한 접속을 돕기 위해 네트워크 시스템에 만전을 기하고 있다. 시스템 차원에서 코로나19에 긴급 대응하며 업무 중단을 최소화하려는 노력도 엿보인다. 삼성전자는 이미 '코로나19 비상 TF(태스크포스)팀'을 전면 가동했다. 재택근무를 확대하는 한편 자체 방역을 강화해 확진자 발생 사업장은 곧바로 폐쇄하고 긴급 방역을 하는 시스템을 갖췄다. 현대차도 '업무 중단' 사태를 막기 위해 울산공장에 컨트롤타워로 '코로나 상황실'을 만들었다. 또 개별 사업장 단위로 매일 방역을 실시하고, 사업장 출입시 1:1 체온 측정으로 미열이 있는 직원이라도 즉시 귀가 조치하고 있다. 생산 라인이 아닌 서울 양재동 본사 직원들은 선택적으로 재택 근무를 하도록 했다. 계열사인 현대제철은 사업장 밖에 '임시사무실'을 만들어 비상 사태 시 필수 인원이 따로 근무할 수 있게 했다. 이번 코로나 사태로 국내 기업들의 위기 대응 수준이 한 단계 높아졌다는 교훈도 들린다. 특히 확진자에 대한 직접적 차단 못지 않게 사원들의 근무 지원 체계 같은 간접지원 수준이 돋보인다는 진단이다. 단적으로 SK그룹이 가장 빠른 재택 근무에 나설 수 있었던 것은 평상시 '자율좌석제'를 통한 스마트오피스 경험을 충분히 쌓았기 때문이라는 평가다. 이 때문에 SK텔레콤 을지로 사옥에서 확진자가 발생했지만 선제적으로 재택 근무를 하고 있는 상황이어서 피해가 적을 수 있었다. 일부 기업들은 재택 근무 효율성을 높이기 위해 IT시스템을 장애를 해결할 전담 직원의 비상연락망을 수립하는 등 만전을 기하고 있다. 포스코는 전무후무한 예비근무조 편성 노하우를 숙련시키고 있다. 이는 확진자가 발생할 경우 해당 근무조 전원을 업무에서 빼고, 예비 근무조에게 무균복을 입혀 비상 조업에 투입하는 것이다. 포스코는 24시간 비상상황실도 운영하며 만약의 사태에 대비하는 모습이다. 최재욱 의사협회 과학검증위원장은 ""재택 근무나 직장 폐쇄를 결정한 기업들은 코로나19 전파를 차단하는데 매우 중요한 역할을 하고 있다""며 ""증상이나 발열이 있으면 언제든 진단을 받고, 재택 근무 여건을 만들어주는 것이 사태 진정에도 중요하다""고 말했다. 코로나19 위기 상황에서도 협력업체들을 챙기려는 모습도 '기업의 불'을 꺼뜨리지 않으려는 노력으로 읽힌다. 삼성은 자금난에 빠진 협력사를 위해 2조6000억원 규모의 자금 지원책을 발표했는데 이중 1조원은 운영자금을 아예 무이자나 저금리로 빌려주는 것이다. 현대차도 부품 협력업체 350여곳을 위해 1조원 규모의 긴급 자금 지원을 약속했다. 이중 경영자금 무이자 지원은 3080억원, 납품대금 및 부품 양산 투자비 조기 결제는 6920억원 규모에 달한다. 기업의 사회적 역할을 다하기 위해 기부금을 쾌척한 것도 눈에 띈다. 삼성그룹이 300억원을 기부한 것을 필두로 현대차 50억원, SK그룹 54억원, LG그룹 50억원, 포스코 50억원 등 위기를 함께 극복하려는 진정성이 깔려있다. 재계 관계자는 ""국내외의 수많은 재난 중 코로나19처럼 공장 가동과 부품 수급, 본사 운영에 전 방위적 악영향을 미친 사례는 없었다""며 ""이번 사례에도 기업의 업무 활동을 지속할 수 있다면 어떤 상황에도 살아남을 수 있는 반면교사가 될 것""이라고 말했다. 우경희 기자 cheerup@mt.co.kr, 안정준 기자 7up@mt.co.kr, 유영호 기자 yhryu@mt.co.kr, 최민경 기자 eyes00@mt.co.kr
<저작권자 ⓒ '돈이 보이는 리얼타임 뉴스' 머니투데이, 무단전재 및 재배포 금지>",/news/news_read.nhn?article_id=0004367131&office_id=008&mode=search&query=SK텔레콤&page=2
