head,text,url
,"인공지능(AI) 음성인식 서비스가 탑재된 19만원대 피처폰(스마트폰이 아닌 단말기)이 나왔다. 스마트폰이 아닌 피처폰에 AI 음성인식 기능이 달린 것은 처음이다. SK텔레콤과 KT는 17일부터 LG전자의 LTE(4G) 피처폰 ‘LG폴더2’를 전국 매장과 온라인 매장에 판매한다고 이날 밝혔다. LG폴더2의 가격은 19만8000원이다. SK텔레콤에 따르면, 이전 모델인 ‘LG폴더’를 사용하는 고객 중 60대 이상의 비율이 70.5%였다. LG폴더2에는 SK텔레콤과 KT의 음성인식 서비스인 ‘누구’와 ‘기가지니’가 탑재됐다. AI음성인식 버튼을 누른 뒤 “오늘의 뉴스 들려줘”라거나 “OOO트로트 가수의 나이가 몇살이야” 등의 질문을 하는 식이다.LG폴더2에는 위급한 상황에 처했을 때 바로 보호자와 통화를 할 수 있는 ‘SOS’기능이 탑재됐다. 단말기 뒷면에 있는 ‘SOS’버튼을 빠르게 3번 누르면, 5초 뒤에 사전에 등록된 보호자 번호로 자동 통화 연결이 된다. 위치 정보도 함께 보호자에게 전송된다. 또 휴대전화를 열어보지 않고도, 시간과 전화 문자 수신여부가 확인 가능하도록 외부 알림창 기능이 있다. 데이터 사용 없이도 FM라디오를 들을 수 있는 기능과 인터넷을 사용할 때 비밀번호를 눌러야 하는 데이터 안심 잠금 기능도 있다. 업계 관계자는 “노인층에도 AI 음성인식에 대한 수요가 있어 이를 반영한 제품”이라며 “AI 음성인식 서비스가 전 연령대로 확대될 수 있다”고 말했다.곽희양 기자 huiyang@kyunghyang.com©경향신문(www.khan.co.kr), 무단전재 및 재배포 금지",/news/news_read.nhn?article_id=0003004266&office_id=032&mode=search&query=SK텔레콤&page=1
"반도체 분야 언택트 수혜주로 SK하이닉스 거론돼 통신·네트워크 장비 수혜주, SK텔레콤·케이엠더블유","[서울=뉴시스] 김동현 기자 = 신종 코로나바이러스 감염증(코로나19)의 글로벌 확산으로 비대면(언택트) 소비 문화가 확산되면서 새로운 생태계가 조성되고 있다. 국내 증권가에서도 언택트 산업 성장성을 주목하며 반도체, 통신·네트워크장비, 인터넷게임, 유통, 음식료, 동영상 스트리밍 업체에 대한 관심을 높일 필요가 있다고 조언했다. ◇언택트 개념 확대中…관련 산업 성장성 '주목'코로나19 이전까지 언택트의 개념은 무인 서비스를 함축하는 뜻으로 통용됐지만 최근에는 비대면으로 이뤄지는 모든 산업으로 확장되고 있는 중이다. 코로나19 여파가 글로벌 주식 시장을 패닉 상황으로 만들고 경기 침체 우려도 나오고 있지만 인터넷, 클라우드컴퓨팅, 이커머스 등 언택트 산업은 오히려 성장성이 부각되고 있다. 2008년 리먼 사태 당시에도 국내 기업 중에서 플러스 수익률을 기록한 기업들이 있었다. 셀트리온, 엔씨소프트, 한샘 등이 대표적이다. 이들 기업들이 과거 위기에 살아남는 기업이 시장을 이끄는 주도주가 된 것 처럼 이번에도 언택트 관련 종목이 코로나19 이후 새로운 트랜드를 이끌 것이라는 관측이 나온다. ◇반도체 분야 언택트 수혜주로 SK하이닉스 거론국내 기업 중 반도체 분야에서의 언택트 수혜주로는 SK하이닉스가 가장 먼저 거론된다. 코로나19 이후 재택근무, 화상회의 등이 확대됨에 따라 신규 서버 증설 수요가 늘어날 수 있기 때문이다. 실제로 SK하이닉스는 서버와 PC용 D램 출하 비중이 49% 수준으로 모바일 D램보다 높게 형성돼 있다. 서버 증설 수요에 따른 실적 상승이 예상되는 이유다.
특히 서버, PC, 게임기는 코로나19로 수요가 둔화될 가능성이 낮고 향후 발전 가능성이 높은 산업군으로 분류된다는 점은 SK하이닉스의 투자 매력을 높이는 요소다. 공급은 한정돼 있는데 수요가 폭발적으로 늘어나며 D램 가격이 지속적으로 상승세를 보일 수 있어서다. 평균판매단가(ASP) 상승에 따른 실적 향상, 이에 따른 주가 반등이 기대된다.◇통신·네트워크 장비 수혜주, SK텔레콤·케이엠더블유 SK텔레콤은 구독형 수익모델을 가지고 있어 안정성 면에서는 다른 종목을 압도한다. 통신서비스는 한번 가입하고 나면 해지하기 전까지는 판매한 구독형 수익모델이 매출로 인식돼 지속적으로 수익이 발생하기 때문이다. 통신주는 단기적으로 코로나19 여파로 대리점 내방 고객수 감소에 따라 실적 악화 현상을 보일 수 있지만 장기적으로는 서버에 전송되는 데이터의 양(트래픽) 증가에 따른 수혜가 예상된다. 글로벌 휴대폰 제조업체들과 협력 관계를 구축하고 있는 케이엠더블유는 언택트 활성화로 글로벌 5G 투자 가속화될 경우 수혜를 입을 수 있는 종목으로 분류된다.국내에서는 경기부양책의 일환으로 5G 투자가 상반기에만 4조원이 집행될 예정이며 일본을 비롯한 해외 주요 국가에서도 5G 투자가 본격화될 수 있어 매력적인 종목으로 꼽힌다. ◇카카오·엔씨소프트 등도 수혜주로 분류코로나19 여파로 우리나라에서 진행된 사회적 거리두기 정책은 온라인·모바일 플랫폼에 기반한 게임 서비스 활성화에 기여한 모습니다. 카카오는 코로나19 영향으로 인한 부정적 영향이 적고 카카오페이지, 카카오페이, 카카오M 등 주요 자회사의 평가 가치 상승이 분기마다 이뤄질 것으로 예상된다. 엔씨소프트도 코로나19로 인한 부정적인 영향이 전혀 없는 종목이다. 리니지2M과 리니지M의 1분기 평균 일매출은 각각 38억원과 21억원으로 견조한 상황이다. 오히려 코로나19 이후 리니지2M과 리니지M의 일간 활성 이용자 수와 최고 동접자수는 지속적으로 상승하고 있어 언택트 효과를 톡톡히 보고 있다는 평가를 받는다. ◇이마트·CJ제일제당, 집콕족 증가로 매출 껑충이마트의 경우 풀필먼트와 후레쉬센터, 오프라인 점포 등 독보적인 식품 온라인 인프라를 구축했으며 올해 2월 김포 제2 물류센터를 가동하며 대규모 배송 능력을 키웠다. 이마트는 코로나19 사태 이후 온라인 매출이 급성장한 것으로 파악되며 오프라인 매장 매출도 회복세를 보이고 있어 식품 온라인 시장에서 주목받을 것으로 예상된다. CJ제일제당은 코로나19 확산이 본격화된 이후 간편식 시장을 주도하는 모습을 보였다. 햇반은 코로나19 확산이 본격화된 2월말부터 비축물량 수요가 급증해 3월까지 평월 대비 평균 10%가량 증가한 것으로 알려졌다. 비비고도 주력상품인 만두와 국물요리 등의 수요가 늘면서 3월 한 달 매출이 전년 동기보다 20% 이상 증가하며 언택트 수혜주로 이름을 올렸다.김경민 하나금융투자 연구원은 ""최근 코로나19 사태로 언택트 관련 종목에 대한 관심이 높아지고 있다. 코로나19로 인해 대다수 업종에서 큰 피해를 입을 것으로 예상되는 가운데 비대면 관련주는 주식시자에서 소나기를 피할 수 있는 대안으로 부각되고 있다""고 밝혔다. 그는 이어 ""과거에도 위기에 살아남은 기업은 시장을 이끄는 주도주가 된 바 있다""며 ""이런 역사는 반복될 가능성이 충분히 존재한다. 이중 가장 유력한 후보군은 비대면 관련주다. 5G, 네트워크장비, 인터넷, 반도체, 유통, 음식료 업체들에 대한 관심을 높일 필요가 있다""고 조언했다. oj1001@newsis.com<ⓒ 공감언론 뉴시스통신사. 무단전재-재배포 금지>",/news/news_read.nhn?article_id=0009821769&office_id=003&mode=search&query=SK텔레콤&page=1
"LGU+, 넷플릭스와 독점계약 후 웃음꽃 만발SKB, 망 이용료 분쟁 소송전으로 번지며 갈등KT는 일단 관망세…넷플릭스와 협상 여지 남겨","'글로벌 콘텐츠 공룡' 넷플릭스를 두고 국내 통신업계 희비가 극명하게 엇갈렸다. 넷플릭스와 콘텐츠 공급 독점계약을 맺은 LG유플러스가 활짝 웃은 반면 망 이용료 갈등을 빚던 SK브로드밴드는 끝내 넷플릭스와의 소송전으로 치달았다.17일 통신업계에 따르면 LG유플러스는 2018년 11월 중순부터 IPTV에서 넷플릭스 콘텐츠를 독점 제공하고 있다. 비밀유지 계약에 따라 계약 기간은 공개되지 않았지만 업계는 올 하반기 계약이 종료될 것으로 보고 있다.넷플릭스 독점 공급으로 쏠쏠한 재미를 본 만큼 LG유플러스가 계약 연장에 공을 들이고 있다는 후문이다.지난해 LG유플러스의 IPTV 매출은 전년 대비 16.6% 증가해 사상 처음 1조원을 돌파했다. 가입자 증가세도 가팔랐다. 작년 한 해만 45만8000명(11.4%) 늘어 447만7000명을 기록했다. 넷플릭스와 손잡고 콘텐츠를 강화한 것이 실적에 주효하게 작용했다.회사 측은 ""넷플릭스가 가입자 확보와 서비스 해지 방어에 긍정적 영향을 주고 있다. 특히 2030세대의 호응이 높다""고 설명했다.넷플릭스 효과를 확인한 LG유플러스는 일찌감치 IPTV 매출 1조원 달성을 자신했다. 작년 8월 하현회 부회장은 ""IPTV 연매출 1조원에 도전하겠다""면서 넷플릭스와 공동 마케팅을 추진하는 등 협력을 강화하겠다고 밝혔다. 웃음꽃이 핀 LG유플러스와 달리 SK브로드밴드는 침통한 표정이다. 넷플릭스와의 망 이용료 갈등이 끝내 법정 다툼으로 번졌다.넷플릭스 한국법인은 최근 SK브로드밴드 상대로 서울지방법원에 민사소송을 제기했다. 넷플릭스가 인터넷 망 운영·증설·이용에 대한 대가를 SK브로드밴드에 지급할 의무가 없다는 주장을 담은 '채무부존재 확인' 소송이다. 넷플릭스와 SK브로드밴드는 망 이용료 문제를 놓고 첨예한 갈등을 빚어왔다.SK브로드밴드는 주로 폭증하는 넷플릭스 트래픽 대응을 위해 지난해 3차례, 올해 들어서만 4차례 해외망을 증설했다. 이를 근거로 망 품질을 일정하게 유지하려면 넷플릭스가 망 이용료를 내야 한다고 주장해왔다.넷플릭스는 망 이용료를 내지 않고 대신 캐시서버(OCA)를 무상 설치하겠다는 입장을 고수 중이다. 소비자들이 자주 찾는 영상 콘텐츠를 새벽시간대 캐시서버에 저장하면 트래픽을 효율적으로 관리할 수 있다는 설명이다. 현재 LG유플러스, LG헬로, 딜라이브가 이같은 방식을 취하고 있다. 넷플릭스는 이들 업체에 캐시서버 설치 비용만 부담할 뿐 별도 망 사용료를 내진 않는다. 넷플릭스는 ""LG유플러스 등의 협력 사례와 마찬가지로 수차례에 걸쳐 SK브로드밴드에 협력을 제안했다""며 ""부득이 소송을 진행하게 됐지만 SK브로드밴드와 공동의 소비자를 위한 노력을 계속할 것이며 협력 방안도 지속 제안할 것""이라고 말했다.LG유플러스, SK텔레콤(SK브로드밴드)과 함께 유료방송시장 3강 체제를 형성한 KT는 망 이용료 공방에선 한발 물러나 있다. 통신3사 중 해외망 이용에 가장 여유가 있는 데다 향후 넷플릭스와의 협업을 위해서도 분쟁에 나서지 않는 편이 낫다고 판단한 것으로 풀이된다. 한 통신업계 관계자는 ""넷플릭스의 국내 시장 장악력을 고려하면 통신사가 '을'일 수밖에 없다. SK브로드밴드와 넷플릭스의 분쟁에 다른 통신사들이 참여하지 않는 것도 같은 이유""라며 ""소송 제기로 방송통신위원회도 이번 분쟁에서 빠지게 됐다. 소송 결과에 따라 통신사들의 희비가 갈릴 것""이라고 예상했다.작년 11월 SK브로드밴드는 넷플릭스 상대로 망 이용료 협상과 관련해 방통위에 중재 신청을 접수했다. 하지만 넷플릭스의 이번 소송 제기로 SK브로드밴드가 신청한 재정 절차는 모두 중단됐다. 전기통신사업법에 따르면 방통위는 재정 절차 진행 중에 한쪽 당사자가 소를 제기한 경우 재정 절차를 중지하도록 돼 있다.김은지 한경닷컴 기자 eunin11@hankyung.com기사제보 및 보도자료 open@hankyung.com▶ ▶
 ▶
ⓒ 한국경제 & , 무단전재 및 재배포 금지",/news/news_read.nhn?article_id=0004326066&office_id=015&mode=search&query=SK텔레콤&page=1
폴더형 휴대폰 최초로 인공지능 서비스 탑재LG유플러스는 인공지능 서비스 없어,"[서울=뉴시스] 오동현 기자 = 이동통신 3사가 LG전자의 LTE 피처폰 'LG Folder 2'를 판매한다.SK텔레콤과 KT는 17일부터 인공지능 서비스를 탑재한 'LG폴더2'를 판매한다. 폴더형 휴대폰에 인공지능 서비스가 탑재되는 것은 이번이 최초다.LG유플러스는 다음주부터 'LG폴더2'를 판매한다. 단, 인공지능 서비스는 탑재하지 않는다.전용 AI 핫키를 통해 ▲날씨 ▲뉴스 ▲지역정보 ▲라디오 ▲팟캐스트 등 다양한 정보를 확인할 수 있다. 후면에는 SOS 전용키가 탑재돼 위급상황 시 전화 연결과 위치정보를 담은 문자 발송 기능을 제공한다.'LG폴더2'의 인공지능 서비스는 통신사 출시 단말 별로 ▲SK텔레콤 '누구' ▲KT '기가지니' ▲LG유플러스 '구글 어시스턴트'가 탑재된다. 'LG폴더2'는 폴더 형태로 ▲뉴플래티넘 그레이 ▲화이트 두 가지 색상으로 구성됐다. 출고가는 19만 8000원(VAT 포함)이다.SK텔레콤은 'LG폴더2' 출시를 맞아 이날부터 7월 31일까지 총 3개월 간 전 고객을 대상으로 인공지능 서비스 '누구' 이용 시 소요되는 데이터를 무료로 제공하는 프로모션을 진행한다.KT도 'LG폴더2'에 기가지니 서비스를 탑재한 기념으로 데이터 무료 제공 프로모션을 진행한다. 6월 30일까지 'LG폴더2' 를 구매하는 고객에게는 데이터 500MB가 무료로 제공한다. 고객이 신청하는 절차 없이 가입한 다음날 바로 적용된다. odong85@newsis.com<ⓒ 공감언론 뉴시스통신사. 무단전재-재배포 금지>",/news/news_read.nhn?article_id=0009821946&office_id=003&mode=search&query=SK텔레콤&page=1
"LG 권영수 지목받은 네이버 한성숙 대표, GS칼텍스 허세홍 대표 지목","[더팩트 | 서재근 기자] 국내 주요 기업 최고경영자(CEO)들의 '향기로운 지원'이 한 달 넘게 이어지고 있다.17일 네이버는 한성숙 대표가 네이버 스마트 플레이스에서 '스마트주문' 서비스를 이용하는 전국 100명의 오프라인 소상공인에게 장미꽃을 선물했다고 밝혔다.한성숙 대표는 꽃과 함께 동봉한 편지에서 ""재난 속에서도 희망을 잃지 않고 새로운 성장의 돌파구를 만들고 계신 전국 사장님들과 코로나19 확산에 마음의 상처가 크신 대구·경북 지역 사장님들께 깊은 감사와 응원의 마음을 담아 꽃을 보내드린다""라며 감사와 격려의 메시지를 전했다.그러면서 ""네이버는 코로나19로 인한 어려움을 함께하고, 사장님들께서 더 크게 사업을 만들어가실 수 있도록 노력하겠다""라고 덧붙였다.이번 기부는 코로나19 사태로 졸업식과 입학식, 경조사를 비롯해 각종 행사나 모임이 취소되면서 직격탄을 맞은 화훼 농가를 돕기 위해 꽃을 선물하는 릴레이 캠페인에 동참하면서 이뤄진 것이다.앞서 캠페인에 참여한 권영수 LG그룹 부회장의 지목을 받은 한 대표는 다음 주자로 허세홍 GS칼텍스 대표를 지목했다.소비 절벽에 맞닥뜨린 화훼농가를 돕기 위한 릴레이 캠페인은 지난달 김태영 은행연합회 회장의 지명을 받은 김정태 하나금융회장의 동참을 시발점으로 재계 전반으로 확산했다.당시 코로나19 사태로 지친 임직원들에게 꽃을 선물한 김 회장은 다음 주자로 박정호 SK텔레콤 사장을 지목한 것을 기점으로 바통은 고동진 삼성전자 IM부문장(사장)과 황각규 롯데지주 부회장, 권영수 LG그룹 부회장을 거쳐 한성숙 대표까지 이어졌다.캠페인에 참여한 재계 인사들의 지원 방식도 눈길을 끌었다. 박정호 사장은 사회생활에 첫발을 내디딘 SK텔레콤 신입 구성원들에게 환영의 뜻을 담아 꽃다발을 선물했고, 고동진 사장은 삼성전자 임직원들이 자원봉사 활동으로 참여하는 '꿈을 키우는 집', '보훈공단보훈원' 등에 꽃을 전달했다.황각규 부회장은 남대문 꽃시장에서 구매한 꽃다발을 코로나19 방역을 위해 현장에서 노력한 롯데월드타워 위생·방역 담당 파트너사 직원들에게 전달했다. 권영수 부회장은 지난 2015년부터 운영하는 'LG의인상' 역대 120명의 수상자들에게 반려 식물을 선물하며 의미를 더했다.likehyo85@tf.co.kr저작권자 ⓒ 특종에 강한 더팩트 & tf.co.kr 무단 전재 및 재배포 금지",/news/news_read.nhn?article_id=0000023304&office_id=629&mode=search&query=SK텔레콤&page=1
,"SK텔레콤과 KT가 LG전자의 피처폰 'LG폴더2'에 인공지능 서비스를 탑재했다. 폴더형 휴대폰에 인공지능 서비스가 추가된 건 이번이 처음이다.



17일 SK텔레콤과 KT는 실버세대가 주로 이용하는 폴더폰에 인공지능 기능을 추가해 정보 접근성을 높였다고 밝혔다. 폴더폰 통화 버튼 상단에 마이크 심볼이 새겨진 'AI 핫키' 버튼을 누르면 AI 기능이 실행된다.



 SK텔레콤은 음성인식 인공지능인 '누구'를 탑재했다. 핫키 버튼을 누르면 ""제가 도울 일을 말해주세요""라는 음성 메시지가 나오고, 사용자가 궁금한 내용을 얘기하면 텍스트와 음성으로 답변해준다. 날씨나 계산기, 백과사전식 질문뿐 아니라 ""나 외로워"" 같은 감성 대화도 가능하다. KT는 인공지능 기가지니를 넣었다. 핫키를 눌러 음성으로 대화하는 방법 등은 동일하다.



위급 상황에 대비해 SOS 기능도 추가했다. 긴급한 상황에 단말기 뒷면에 SOS 전용 키를 빠르게 세번 누르면 5초 뒤에 보호자의 휴대전화로 위치 정보를 담은 문자가 발송되고 자동으로 통화 연결된다.


폴더를 열지 않고도 외부창을 통해 시간이나 문자 등을 확인할 수 있고, FM라디오는 데이터 소모 없이 청취할 수 있다. 인터넷을 사용하려면 비밀번호를 눌러야 하는
데이터 안심 잠금 기능 등도 탑재됐다.




LG폴더2의 출고가는 19만8000원이다. KT는 6월말까지 구매자에게 데이터 500MB를 무료로 제공하는 프로모션도 진행한다.



문갑인 SK텔레콤 스마트디바이스본부장은 “폴더폰 고객의 의견을 반영해 ‘LG폴더2’에 인공지능 서비스를 추가했다”면서 “앞으로도 고객의 사용 편의성을 고려해 합리적인 가격과 기능을 갖춘 휴대전화를 지속적으로 출시하겠다”고 말했다.


박형수 기자 hspark97@joongang.co.kr
▶ ▶
/ ⓒ중앙일보(https://joongang.co.kr), 무단 전재 및 재배포 금지",/news/news_read.nhn?article_id=0002993768&office_id=025&mode=search&query=SK텔레콤&page=1
외인 기관 동반 매수..한달만에 1900선 넘어서전기전자 업종 강세경영권 분쟁 재점화?..한진칼 대한항공 급등,"[이데일리 유현욱 기자] 17일 코스피 지수가 3% 이상 오르면서 1910선을 회복했다. 약 한 달여만에 돌아온 외국인이 지수 급등을 견인했다. 외국인이 매수가 집중된 전기전자 업종 역시 강세를 보였다.마켓포인트에 따르면 코스피 지수는 전일 대비 57.46포인트(3.09%) 오른 1914.53에 장을 마감했다. 지수는 1%대 상승 출발해 줄곧 상승 흐름을 유지했다. 장중 한때 1926.02까지 오르기도 했다. 장중 1900선을 넘은 것은 지난달 11일(장중 고가 1967.70) 이후 한 달여 만이다.투자자별로 보면 외국인과 기관이 3226억원과 2378억원 순매수했다. 외국인은 지난 5일 이후 거래일 기준 31일 만에 팔자에서 사자로 포지션을 전환했다. 이는 역대 최장인 2008년 6월 9일~7월 23일 33거래일 연속 순매도에 이어 역대 두 번째 길다.노동길 NH투자증권 연구원은 “경제 활동 재개 외에 신종 코로나 바이러스 감염증(코로나19) 치료제 개발 가능성은 코로나19 공포를 완화시킬 수 있는 가장 중요한 재료”라며 “3000억원대 외국인 순매수 규모 및 전기전자 업종 집중은 외국인 귀환의 전조”라고 분석했다. 기관 중에는 금융투자(1129억원) 연기금(865억원) 투신(321억원) 순으로 순매수 규모가 컸다. 프로그램은 차익(-226억원)과 비차익(1641억원)을 합쳐 1415억원 매수 우위를 보였다.음식료품(-0.25%)을 제외한 전 업종이 오른 가운데 운수창고 업종이 9%대 증권 전기전자 4%대 화학 제조업 섬유의복이 3%대 올랐다. 유통업 서비스업 운수장비 건설업 은행이 2%대 상승했다.셀트리온(068270)(-1.86%) 포스코(005490)(0.00%)를 뺀 시가총액 상위종목은 일제히 올랐다. 시총 1~5위인 삼성전자(005930)(4.90%) SK하이닉스(000660)(3.44%) 삼성바이오로직스(207940)(4.81%) 삼성전자우(005935)(4.14%) 네이버(035420)(4.99%)는 상승했다. 이어 LG화학(051910)(5.59%) 현대차(005380)(1.41%) 삼성SDI(006400)(5.72%) LG생활건강(4.87%) 삼성물산(028260)(2.02%) 현대모비스(012330)(2.87%) SK텔레콤(017670)(1.27%)도 상승했다.이 밖에 경영권 분쟁 재점화 기대감에 한진칼(180640)은 28.82% 오른 10만9500원을 기록했다. 10만원 고지도 처음으로 넘어섰을 뿐만 아니라 장중 11만500원으로 사상 최고가를 새로 썼다. 한진칼우(18064K)(24.86%) 대한항공우(003495)(13.43%) 역시 초강세를 보였다.이날 코스피 거래량은 16억4391만8000주, 거래대금은 13조9366억원을 기록했다. 상하한가 없이 719종목이 올랐고, 144종목은 내렸다. 39종목은 보합권에 머물렀다.유현욱 (fourleaf@edaily.co.kr)＜ⓒ종합 경제정보 미디어 이데일리 - 무단전재 & 재배포 금지＞",/news/news_read.nhn?article_id=0004622326&office_id=018&mode=search&query=SK텔레콤&page=1
