head,text,url
"농식품부, 꽃 생활화 추진·직거래 장터 운영","[CBS노컷뉴스 곽영식 기자]농림축산식품부는 코로나19 영향으로
감소한 화훼소비를 활성화하기 위해 추진해온 공공부문 화훼 구매를 정부‧지자체‧공기업 등 전 공공부문으로 확대할 계획이라고 13일 밝혔다.농식품부는 코로나 사태가 장기화되고 있고 5월은 화훼 성출하기로 공공부문 꽃 소비 활성화 노력이 더욱 중요해짐에 따라 범부처와 공공기관까지 참여하여 화훼 소비를 활성화할 방침이다.특히 농식품부 및 소속‧관계기관 뿐만 아니라 중앙부처 및 공기업도 화훼구매에 나서도록 할 계획이다.또 지방자치단체도 사무실 꽃 생활화는 물론 직거래 장터 등을 통해 화훼소비 활성화를 위해 노력 중이고 지방공기업 및 지방교육청까지 화훼구매에 적극 동참하도록 할 예정이다. 또한 공공부문의 화훼구매와는 별도로 장애인·노인 거주 사회복지시설을 대상으로 꽃바구니를 지원함으로써 화훼를 통해 사회배려층의 심리적 안정을 도모하고 개학 후 특수학교를 대상으로 1교실 1꽃병도 지원할 계획이다.이에 앞서 농식품부, 농협 등 21개 기관은 지난 2월부터 9일 현재까지 380만 송이의 꽃을 구매했고 지방자치단체도 지역 내 생산되는 화훼류의 소비 확대를 위해 140만 송이의 꽃을 구매했다.또 화훼소비 활성화 분위기는 민간부문에도 확산되어 삼성전자, SK텔레콤, LG CNS 등 대기업이 화훼구매에 나섰고 은행연합회에서도 꽃 10만개 구매를 통해 사회배려층에 기부를 하기도 했다.또한 공공기관장·기업체 대표 등의 꽃 소비 릴레이와 함께 지난 3월 말부터 농식품부에서 진행한 유명 유튜버의 화훼농가 돕기 꽃 부케 챌린지가 방송계 스타들의 동참으로 이어지면서 소비자들의 착한 소비를 이끌고 있다.농식품부는 ""화훼산업의 발전을 위해서는 꽃 소비의 일상 생활화가 중요하다고 보고 이번의 꽃소비 활성화가 일반 가정에서의 꽃 생활문화로 이어질 수 있도록 지속적인 노력을 기울일 계획""이라고 밝혔다.kys@cbs.co.kr저작권자 © CBS 노컷뉴스 무단전재 및 재배포 금지",/news/news_read.nhn?article_id=0003348461&office_id=079&mode=search&query=SK텔레콤&page=2
▶ '아는 척'하고 싶은 당신을 위한 [두유노우]▶ 한눈에 보는 [4·15총선 NEWS MAP],"[파이낸셜뉴스] 코로나19로 침체된 화훼업계 지원을 위한 소비 촉진 운동이 모든 공공기관으로 확대된다.
 농림축산식품부는 공공부문 화훼 구매를 농식품부 중심에서 정부, 지자체, 공기업 등 전 공공부문으로 확대할 계획이라고 13일 밝혔다.
 농식품부는 ""코로나 사태가 장기화되고 있고 5월은 화훼 성출하기로 공공부문 꽃 소비 활성화 노력이 더욱 중요해진데 따른 조치""라고 설명했다.
 농식품부는 코로나19 발생 이후 화훼소비를 촉진하기 위해 소속·유관기관과 화훼 구매에 우선적으로 나섰고, 지자체와 민간기업에 꽃 소비 활성화 분위기가 확산되도록 노력해 왔다.
 농식품부, 농협 등 21개 기관은 지난 2월부터 지난 9일 현재까지 380만송이의 꽃을 구매했고, 지자체도 지역 내 생산되는 화훼류의 소비 확대를 위해 140만송이의 꽃을 구매했다.
 화훼소비 활성화는 민간 부문에도 확산돼 삼성전자, SK텔레콤, LG CNS 등 대기업이 화훼구매에 나섰고 은행연합회도 꽃 구매(10만개)를 통해 사회배려층에 기부를 하기도 했다.
 공공기관장·기업체 대표 등의 꽃 소비 릴레이와 함께 지난 3월 말부터 농식품부가 진행한 유명 유튜버의 화훼농가 돕기 '꽃 부케 챌린지'가 방송계 스타들의 동참으로 이어지면서 소비자들의 착한 소비를 이끌고 있다.
 농식품부는 공공부문의 화훼구매와는 별도로 장애인·노인 거주 사회복지시설을 대상으로 '꽃바구니'를 지원하고, 개학 후 특수학교를 대상으로 '1교실 1꽃병'도 전달할 계획이다.


 ※ 저작권자 ⓒ 파이낸셜뉴스. 무단 전재-재배포 금지",/news/news_read.nhn?article_id=0004407421&office_id=014&mode=search&query=SK텔레콤&page=2
"5월 화훼 성출하기, 코로나19 피해 회복 지원범부처·공공기관, 화훼 구매…사회배려층 공급","[세종=이데일리 이명철 기자] 코로나19 영향으로 어려움을 겪는 화훼농가 지원을 위한 소비 활성화 대책을 전 공공부문으로 확대한다.식목일인 지난 5일 대구 동구 불로동 화훼단지에서 고객들이 화분을 구경하고 있다. 연합뉴스 제공농림축산식품부는 공공부문 화훼 구매를 농식품부 중심에서 정부·지자체·공기업 등으로 넓힌다고 13일 밝혔다.농식품부는 코로나19 사태로 위축한 화훼 소비를 촉진하기 위해 소속·유관기관과 우선 구매에 나섰다.농식품부와 농협 등 21개 기관은 지난 2월부터 이달 9일 현재까지 꽃 380만송이를 구매했다. 지방자치단체도 지역에서 생산하는 140만송이의 꽃을 사들였다. 화훼소비는 삼성전자(005930), SK텔레콤(017670), LG(003550) CNS 등 대기업과 은행연합회 등 민간으로 번졌다.공공기관장과 기업체 대표 등은 꽃 소비 릴레이를 진행했다. 지난달말부터 농식품부가 진행한 유명 유튜버(쯔양·재열·김숙 등)의 화훼농가 돕기 ‘꽃 부케 챌린지’는 방송계 송은이, 이원일 셰프, 도티, 이휘재·문정원 부부 등으로 이어졌다.코로나19 사태가 장기화하고 5월 화훼 성출하기가 다가옴에 따라 범부처와 공공기관이 화훼 소비 독려에 나설 계획이다. 지난 3년간(2017~2019년) 월별 출하량을 보면 5월이 12%로 4월(10%), 6월(8%)보다 많다.농식품부는 공공부문 화훼 구매와 별도로 장애인·노인 거주 사회복지시설에 ‘꽃바구니’를 지원해 사회배려층의 심리 안정을 돕고 개학 후 특수학교에 ‘1교실 1꽃병’을 지원할 예정이다.농식품부 원예경영과 관계자는 “화훼산업의 발전을 위해 꽃 소비의 일상 생활화가 중요하다”며 “꽃소비 활성화가 일반 가정에서의 꽃 생활문화로 이어지도록 지속 노력하겠다”고 말했다.이명철 (twomc@edaily.co.kr)＜ⓒ종합 경제정보 미디어 이데일리 - 무단전재 & 재배포 금지＞",/news/news_read.nhn?article_id=0004618800&office_id=018&mode=search&query=SK텔레콤&page=2
LG의인상 수상자들에 '반려식물' 선물다음 주자로 한성숙 네이버 대표 지목,"[서울=뉴시스] 고은결 기자 = 권영수 LG 부회장이 신종 코로나바이러스 감염증(코로나19) 사태로 타격을 입은 화훼농가 돕기 캠페인에 참여했다.권 부회장은 13일 LG 페이스북 홈페이지를 통해 ""코로나19로 어려움을 겪고 있는 화훼농가를 돕기 위한 릴레이 캠페인에 동참할 수 있게 돼 뜻깊게 생각한다""라며 ""의미있는 행사에 함께할 수 있도록 추천해준 롯데그룹 황각규 부회장님 감사하다""라고 밝혔다.권 부회장은 ""사람들의 정서적 안정감을 높여준다고 가까이에 두고 기르는 식물을 '반려식물'이라고 부른다""라며 ""서로에 대한 격려와 응원이 필요한 이 시기에 저도 기회를 빌려 역대 120명에 달하는 'LG의인상' 수상자분들께 건강과 안녕을 기원하는 뜻에서 반려식물을 전해드리고자 한다""라고 했다.권 부회장은 이어 ""'LG의인상'은 '국가와 사회정의를 위해 희생한 의인에게 기업이 사회적 책임으로 보답해야 한다'는 고(故) 구본무 LG 회장님의 뜻을 반영해 2015년 만들어져 운영되고 있다""라고 설명했다.그는 ""'LG의인상' 수상자분들이 우리 사회에 따뜻한 온기를 불어넣었듯이 이번 릴레이 캠페인이 화훼농가에 조금이나마 도움이 되기를 바란다""라며 캠페인 다음 주자로 네이버 한성숙 대표를 추천했다. 한편, 박원순 서울 시장의 제안으로 시작된 화훼농가 돕기 릴레이 캠페인에는 지금까지 김정태 하나금융그룹 회장, 박정호 SK텔레콤 사장, 고동진 삼성전자 사장, 황각규 부회장 등 주요 기업인들이 참여했다. keg@newsis.com<ⓒ 공감언론 뉴시스통신사. 무단전재-재배포 금지>",/news/news_read.nhn?article_id=0009812523&office_id=003&mode=search&query=SK텔레콤&page=2
,"역대 LG의인상 수상자 120명에게 꽃 선물(서울=연합뉴스) 김영신 기자 = 권영수 LG그룹 부회장이 신종 코로나바이러스 감염증(코로나19)으로 어려움을 겪는 화훼농가를 돕는 릴레이 캠페인에 참여했다.

13일 LG 페이스북에 따르면 권 부회장은 황각규 롯데그룹 부회장의 지명을 받고 릴레이 캠페인에 참여, 구입한 꽃들을 역대 'LG 의인상' 수상자들에게 전달한다고 알렸다.

LG 의인상은 LG그룹이 '국가와 사회를 위해 희생한 의인에게 기업이 사회적 책임으로 보답해야 한다'는 고(故) 구본무 회장의 뜻에 따라 2015년부터 운영하는 수상이다.

권 부회장은 ""LG 의인상 수상자분들이 사회에 따뜻한 온기를 불어넣었듯이 이번 릴레이 캠페인이 화훼농가에 조금이나마 도움이 되길 바란다""며 다음 주자로 한성숙 네이버 대표를 지명했다.

재계에서 화훼농가 돕기 릴레이 캠페인은 김정태 하나금융그룹 회장의 지명을 받은 박정호 SK텔레콤 사장이 지난달 말 참여하며 본격 확대했다.

지금까지 박 사장, 고동진 삼성전자 사장, 이석희 SK하이닉스 사장, 황각규 롯데 부회장, 전영현 삼성SDI 사장 등 주요 그룹 최고경영자(CEO)들이 일제히 참여했다.

shiny@yna.co.kr",/news/news_read.nhn?article_id=0011544061&office_id=001&mode=search&query=SK텔레콤&page=2
코로나19에 홈트족 늘자 MAU 38% 증가기존 LGU+→이통 3사로 서비스 확대,"[서울경제] VX는 자사의 ‘스마트홈트 바이 카카오VX(이하 스마트홈트)’ 애플리케이션을 SK텔레콤, KT, LG 유플러스 통신 3사로 확대해 서비스한다고 13일 밝혔다.‘스마트홈트’는 체계적인 피트니스 커리큘럼에 인공지능(AI) 코칭을 접목한 홈트레이닝 앱으로, 지난해 10월 출시 후 LGU+ 5세대 이동통신(5G) 이용 고객 대상으로 서비스됐다. 이후 시장 수요가 많아지자 이용 대상을 통신 3사로 넓히게 됐다.최근 신종 코로나바이러스 감염증(코로나19)으로 집에서 운동하는 ‘홈트족(홈 트레이닝족)’이 늘어나면서 지난 3월 기준 스마트홈트 앱에서 운동 프로그램을 실행한 수치는 지난 1월 대비 111% 늘어났다. 또 월 평균 이용자 수(MAU)도 지난 1월 대비 38%로 지속적으로 증가하고 있다.카카오 VX 관계자는 “스마트홈트를 보다 많은 고객들이 이용할 수 있도록 서비스 영역을 확장하게 됐다”며 “집에서도 간편하게 할 수 있는 다양한 홈트 프로그램과 전문 코칭을 통해 꾸준히 건강을 관리해나가는 데 도움이 되길 바란다”고 전했다. /백주원기자 jwpaik@sedaily.com저작권자 ⓒ 서울경제, 무단 전재 및 재배포 금지",/news/news_read.nhn?article_id=0003723736&office_id=011&mode=search&query=SK텔레콤&page=2
,"SK텔레콤과 넥슨이 지식재산권(IP), e스포츠, 가상현실(VR) 및 클라우드 게임 등 다양한 분야에서 협력한다. SK텔레콤은 넥슨과 전략적 제휴를 통한 공동 마케팅 및 사업추진 협력을 목적으로 양해각서(MOU)를 체결했다고 13일 밝혔다. 양사는 보유 콘텐츠와 상품 서비스, 신작 게임에 대한 공동 마케팅을 진행하고 넥슨 IP를 활용한 VR게임의 성공적인 출시 준비에 협력하기로 했다. 이어 e스포츠 사업 및 리그 스폰서십을 함께 추진하고 VR 및 클라우드 게임 분야의 신규 콘텐츠 발굴과 투자도 공동 진행한다.협력의 첫 시작으로 신작 게임 ‘카트라이더 러쉬플러스’ 마케팅을 공동으로 진행할 계획이다. 카트라이더 러쉬플러스는 넥슨의 인기 IP ‘카트라이더’ 재미를 모바일에서도 즐길 수 있도록 최신 트렌드에 맞춰 제작한 모바일 레이싱게임이다. 올해 상반기 한국을 포함한 전 세계(중국·일본·베트남 제외)에 서비스할 예정이다.경기 성남시 판교 넥슨 사옥에서 열린 체결식에는 전진수 SK텔레콤 5GX서비스사업본부장, 김현 넥슨 사업총괄 부사장 등이 참석했다. 전 본부장은 “VR 게임과 클라우드 게임의 등장으로 게임 분야는 새로운 전환점을 맞고 있다”며 “1등 게임사 넥슨과 SK텔레콤의 기술, 마케팅 협력으로 글로벌 게임 시장을 향한 도전과 성과를 기대한다”고 말했다. 이승주 기자[Copyrightⓒmunhwa.com '대한민국 오후를 여는 유일석간 문화일보' 무단 전재 및 재배포 금지()]",/news/news_read.nhn?article_id=0002424337&office_id=021&mode=search&query=SK텔레콤&page=2
,"농림축산식품부는 코로나19 영향으로 크게 감소한 화훼소비를 활성화하기 위해 공공부문 화훼 구매를 농식품부 중심에서 정부‧지자체‧공기업 등 전 공공부문으로 확대한다고 13일 밝혔다.그동안 농식품부는 꽃소비를 활성화하기 위해 화훼구매에 우선적으로 나섰고 지자체와 민간기업에도 꽃 소비 활성화 분위기가 확산되도록 노력해 왔다.이에 따라 농식품부와 농협, 농어촌공사, 마사회 등 21개 기관은 지난 2월부터 4월 9일 현재까지 380만송이의 꽃을 구매했고 지자체도 지역 내에서 생산된 140만송이의 꽃을 구매했다.이같은 분위기는 민간부문에도 확산돼 삼성전자 SK텔레콤 LGCNS 등 대기업이 화훼구매에 나섰고 은행연합회에서도 꽃 구매(10만개)를 통해 사회배려층에 기부했다.또 공공기관장･기업체 대표 등의 꽃 소비 릴레이와 함께 지난 3월 말부터 농식품부에서 진행한 유명 유튜버(쯔양·재열·김숙 참여)의 화훼농가 돕기 ‘꽃 부케 챌린지’가 방송계 스타들의 동참으로 이어지기도 했다.그러나 코로나 사태가 장기화되고 있고 특히 5월은 화훼 성출하기로 공공부문 꽃 소비 활성화 노력이 더욱 중요해짐에 따라 범부처와 공공기관까지 참여하도록 했다.이에 따라 각 중앙부처와 공기업도 화훼구매에 나서고 지자체도 사무실 꽃 생활화는 물론 직거래 장터 등을 통해 화훼소비에 더욱 적극적으로 나서 줄 것을 독려했다. 아울러 지방공기업과 지방교육청까지 화훼구매에 적극 동참할 계획이다.농식품부는 공공부문의 화훼구매와는 별도로 장애인·노인 거주 사회복지시설을 대상으로 ‘꽃바구니’를 제공하고 개학 후 특수학교를 대상으로 ‘1교실 1꽃병’도 지원한다는 계획이다.김덕준 기자 casiopea@busan.com",/news/news_read.nhn?article_id=0000995741&office_id=082&mode=search&query=SK텔레콤&page=1
,"SK스토아(대표 윤석암)는14일 SK텔레콤 갤럭시 S20을 가입하면 가입자 선착순 300명에게 갤럭시 버즈 플러스 스토브리그 에디션을 증정한다고 13일 밝혔다.이 패키지는 SKT 인사이트와 SK스토아 모바일 애플리케이션(앱) 기획전 링크 페이지를 통해 선보이며, 행사기간 동안 갤럭시S20 시리즈를 개통한 고객에 한해 선착순으로 제공된다.해당 기획전 페이지 가입하기 버튼을 통해 주문하면 다양한 경품 이벤트에도 자동으로 참여가 진행된다. 가입자 중 추첨을 통해 70명(스토브리그 드림즈 인형 15명, 스토브리그 드림즈 원정 유니폼 5명, 스타벅스 아메리카노 키프티콘 50명)에게 푸짐한 선물을 증정할 예정이다. 당첨자는 5월 15일 SKT 인사이트 페이지 안내 후, 개별 발송할 예정이다.이번에 선착순 300명에게만 한정으로 증정하는 갤럭시 버즈 플러스 '스토브리그' 에디션에는 클래식 드림즈 로고가 반영됐으며, SK텔레콤 최신상 5G 스마트폰 갤럭시 S20 전 기종 모든 컬러 구매가 가능하다.이는 종영된 드라마를 추억하는 팬덤 시청자뿐만 아니라 5월초 프로야구 개막을 기다리는 야구팬에게도 단순한 스마트폰 구매 경험을 넘어 설렘과 즐거움을 동시에 제공할 수 있을 것으로 예상된다.김형준 SK스토아 커머스사업2그룹장은 “이번 'SK텔레콤 갤럭시 S20×스토브리그 버즈 플러스'컬래버 이벤트는 특화된 한정판 패키지로 고객의 즐거움을 극대화할 수 있을 것”이라고 전했다.김정희기자 jhakim@etnews.com",/news/news_read.nhn?article_id=0002877789&office_id=030&mode=search&query=SK텔레콤&page=1
,"권영수 LG그룹 부회장이 ‘화훼농가 돕기 릴레이 캠페인’에 동참했다.13일 LG그룹은 페이스북을 통해 황각규 롯데그룹 부회장의 지명을 받은 권 부회장이 꽃을 구입해 역대 ‘LG의인상’ 수상자 120명에게 전달하기로 했다고 밝혔다. LG 의인상은 LG그룹이 ‘국가와 사회를 위해 희생한 의인에게 기업이 사회적 책임으로 보답해야 한다’는 고(故) 구본무 전 LG그룹 회장의 뜻에 따라 2015년부터 운영하는 상이다.권 부회장은 “의인상 수상자분들이 사회에 따뜻한 온기를 불어넣었듯이 이번 릴레이 캠페인이 화훼농가에 조금이나마 도움이 되길 바란다”며 다음 주자로 한성숙 네이버 대표를 지명했다.재계에서는 지난달 말부터 화훼농가 돕기 릴레이 캠페인이 확산하고 있다. 김정태 하나금융그룹 회장의 지명을 받은 박정호 SK텔레콤 사장이 지난달 말 참여했고 고동진 삼성전자 사장, 이석희 SK하이닉스 사장을 지명해 두 사람 모두 나란히 참여했다. 이후 황각규 롯데그룹 부회장, 허인 KB국민은행장 등이 참여했다.[김강한 기자 kimstrong@chosun.com] 		▶
		▶ 		▶
	- Copyrights ⓒ 조선일보 & chosun.com, 무단 전재 및 재배포 금지 -",/news/news_read.nhn?article_id=0003523186&office_id=023&mode=search&query=SK텔레콤&page=1
,"[디지털타임스 박정일 기자] 권영수 LG그룹 부회장이 코로나19으로 어려움을 겪는 화훼농가를 돕는 릴레이 캠페인에 동참했다. 권 부회장은 13일 LG 페이스북에 글을 올리고 황각규 롯데그룹 부회장의 지명을 받아 릴레이 캠페인에 참여, 구매한 꽃들을 120여명의 역대 'LG 의인상' 수상자들에게 전달한다고 밝혔다. LG 의인상은 LG그룹이 '국가와 사회를 위해 희생한 의인에게 기업이 사회적 책임으로 보답해야 한다'는 고(故) 구본무 회장의 뜻에 따라 2015년부터 운영하는 상이다.권 부회장은 ""LG 의인상 수상자분들이 사회에 따뜻한 온기를 불어넣었듯이 이번 릴레이 캠페인이 화훼농가에 조금이나마 도움이 되길 바란다""며, 다음 주자로 한성숙 네이버 대표를 지명했다.재계에서 화훼농가 돕기 릴레이 캠페인은 김정태 하나금융그룹 회장의 지명을 받은 박정호 SK텔레콤 사장이 지난달 말 참여하며 본격 확대했다. 지금까지 박 사장, 고동진 삼성전자 사장, 이석희 SK하이닉스 사장, 황각규 롯데 부회장, 전영현 삼성SDI 사장 등 주요 그룹 최고경영자(CEO)들이 일제히 참여했다. 박정일기자 comja77@dt.co.kr 디지털타임스
/",/news/news_read.nhn?article_id=0002593415&office_id=029&mode=search&query=SK텔레콤&page=1
"재계 화훼농가 돕기 릴레이 계속…권영수 LG그룹 부회장, 한성숙 네이버 대표 지목","[더팩트ㅣ이성락 기자] 권영수 LG그룹 부회장이 신종 코로나바이러스 감염증(코로나19)으로 인해 어려움을 겪는 화훼농가를 돕기 위한 릴레이 캠페인에 참여했다.권영수 부회장은 13일 LG그룹 사회관계망서비스(SNS) 페이스북을 통해 화훼농가 돕기 캠페인 동참 소식을 알리며 ""서로에 대한 격려와 응원이 필요한 이 시기에 저도 기회를 빌려 역대 120명에 달하는 LG의인상 수상자분들께 건강과 안녕을 기원하는 뜻에서 반려식물을 전해드리고자 한다""고 밝혔다.LG의인상은 '국가와 사회정의를 위해 희생한 의인에게 기업이 사회적 책임으로 보답해야 한다'는 고(故) 구본무 LG그룹 회장님의 뜻을 반영해 지난 2015년 만들어져 운영되고 있다.권영수 부회장은 황각규 롯데그룹 부회장의 추천으로 이번 캠페인에 참여하게 됐다. 황각규 부회장은 고동진 삼성전자 대표이사 사장으로부터 추천을 받았다. 이외에도 박정호 SK텔레콤 사장, 이석희 SK하이닉스 사장, 전영현 삼성SDI 사장 등 재계 주요 CEO들이 이번 릴레이 캠페인에 참여했다.권영수 부회장은 한성숙 네이버 대표를 다음 주자로 지목했다.권영수 부회장은 ""LG의인상 수상자분들이 우리 사회에 따뜻한 온기를 불어넣었듯이 이번 릴레이 캠페인이 화훼농가에 조금이나마 도움이 되기를 바란다""며 ""다음 주자로 한성숙 대표님께서 동참해주시길 부탁드린다""고 말했다.rocky@tf.co.kr저작권자 ⓒ 특종에 강한 더팩트 & tf.co.kr 무단 전재 및 재배포 금지",/news/news_read.nhn?article_id=0000022653&office_id=629&mode=search&query=SK텔레콤&page=1
,"-신작 공동마케팅…VR게임 출시 준비도 넥슨은 SK텔레콤과 게임 사업 관련 전략적 양해각서(MOU)를 체결했다. 양사는 콘텐츠와 상품, 신작 게임의 공동 마케팅을 진행하고, 넥슨의 지적재산권(IP)을 활용한 가상현실(VR)게임의 출시 준비에 협력하기로 했다. 또 e스포츠 사업과 리그 스폰서십을 함께 추진하고, VR 및 클라우드 게임 분야의 신규 콘텐츠 발굴과 투자도 공동 진행한다. 협력의 첫 시작으로 넥슨의 새 게임 ‘카트라이더 러쉬플러스’ 공동 마케팅에 힘을 합칠 계획이다. 넥슨의 인기 IP ‘카트라이더’를 기반으로 한 모바일 레이싱게임으로, 상반기에 한국을 포함해 글로벌 서비스 예정이다.김현 넥슨 사업총괄 부사장은 “SK텔레콤과의 파트너십은 넥슨의 경쟁력을 높이고 ‘초격차’ 만들기에 힘을 보탤 기회라는 점에서 의미가 있다”며 “양사가 긴밀히 협력해 이용자에게 새로운 재미와 경험을 제공해드릴 수 있도록 노력하겠다”고 말했다.전진수 SK텔레콤 5GX서비스사업본부장은 “VR게임과 클라우드 게임의 등장으로 게임분야는 새로운 전환점을 맞고 있다”며 “1등 게임사 넥슨과 SK텔레콤의 기술, 마케팅 협력으로 글로벌 게임시장을 향한 도전과 성과를 기대한다”고 말했다.김명근 기자 dionys@donga.com
/ - Copyrights ⓒ
무단 전재 및 재배포 금지 -",/news/news_read.nhn?article_id=0000812861&office_id=382&mode=search&query=SK텔레콤&page=1
