head,text,url
"코스피, 24.47p 상승 1994.60 마감…카카오·네이버·엔씨 신고가 코스닥, 11.31p 오른 719.89 마감…환율, 7.2원↑ 1244.2원","(서울=뉴스1) 권혜정 기자 = 25일 코스피 지수가 1%대 이상 오르며 1990선으로 마감했다. 코스닥 지수도 1.6% 오르며 720선을 눈앞에 뒀다. 미중간 갈등 격화 우려에도 주요국 경제활동 재개에 대한 기대감이 작용한 것으로 풀이된다. 시간 외 뉴욕 증시선물도 상승했다. 이날 코스피 지수는 전 거래일 대비 24.47p(1.24%) 오른 1994.60에 마감했다.개인과 기관이 각각 933억, 376억 순매수한 가운데 외국인 1421억원 순매도했다.시가총액 상위 10개 종목은 셀트리온(-0.46%)을 제외하고 모두 상승했다. 특히 카카오(8.50%), 네이버(4.56%)는 종가 기준 또다시 52주 신고가를 경신했다. 카카오는 LG생활건강 마저 제치며 시가총액 8위(우선주 제외)로 한단계 더 올랐다. 이밖에 삼성SDI(3.57%), LG화학(3.32%), 삼성바이오로직스(2.27%) 등도 상승했다. 엔씨소프트(2.78%)도 이날 52주 신고가를 기록하며 현대모비스(1.36%)를 제치고 시가총액 12위에 올랐다.코스닥도 전 거래일 대비 11.31p(1.60%) 오른 719.89에 거래를 마쳤다.개인과 기관이 각각 871억, 61억원을 순매도한 가운데 외국인은 984억원을 순매수했다.시가총액 상위 10위 종목 중 케이엠더블유(0.51%)를 제외하고 모두 상승했다. 에코프로비엠(13.50%), 씨젠(4.28%), 알테오젠(3.15%), 에이치엘비(2.15%), 셀트리온제약(2.09%) 순으로 상승폭이 컸다. 업종별로는 양방향미디어와 서비스(5.97%), IT서비스(5.77%), 소프트웨어(5.35%) 순으로 오름세를 보였다. 노동길 NH투자증권 연구원은 ""오늘 국내 주식시장은 장 초반 미국과 중국 마찰 우려를 반영했다""며 ""미중 상황은 냉전을 언급하기 시작하는 등 당분간 마찰은 계속될 듯 하다""고 분석했다. 다만 그는 ""홍콩 주식시장이 낙폭을 만회하고 있다는 점은 국내 주식시장에 우호적""이라며 ""미중이 마찰을 지속해도 지금처럼 1단계 무역협정 수호 의지를 피력할 경우 경제 여파를 최소화할 수 있다""고 밝혔다. 서울외환시장에서 달러/원 환율은 7.2원 오른 1244.2원에 마감했다.jung9079@news1.kr© 뉴스1코리아(), 무단 전재 및 재배포 금지",/news/news_read.nhn?article_id=0004657005&office_id=421&mode=search&query=삼성바이오로직스&page=1
,"[서울=뉴시스]신항섭 기자 = 미국과 중국의 갈등으로 1970선까지 밀렸던 코스피가 다시 1990선을 회복했다. 주요 2개국(G2)의 갈등이 아직 지난해 수준이 아니라는 분석이 긍정적 영향을 준 것으로 풀이된다. 여기에 문재인 대통령이 적극적인 확대 재정의 필요성을 언급한 것이 지수의 폭을 키웠다.25일 코스피지수는 전 거래일(1970.13)보다 24.47포인트(1.24%) 오른 1994.60에 마감했다. 코스피는 10.38포인트(0.53%) 오른 1980.51로 출발해 한때 하락하기도 했으나 오후 들어 상승 폭을 크게 키웠다.유가증권시장에서 개인이 932억원, 기관이 376억원 순매수했고, 외국인은 1406억원 순매도했다.업종별로는 대부분이 올랐다. 서비스업(3.86%)이 가장 크게 올랐고, 운수장비(1.83%), 증권(1.62%), 비금속광물(1.46%), 음식료품(1.40%) 등이 상승했다. 보험(-0.29%)과 철강금속(-0.20%)은 소폭 하락했다.시가총액 상위 종목 역시 대부분이 상승했다. 대장주 삼성전자는 전 거래일 대비 100원(0.21%) 오른 4만8850원에 거래를 마쳤다. 카카오가 8.50% 급등하며 신고가를 다시 썼고, 네이버(4.56%), 삼성SDI(3.57%), LG화학(3.32%), 삼성바이오로직스(2.27%) 등이 강세를 기록했다. 반면 셀트리온(-0.46%) 나홀로 내렸다.증권가는 지수의 상승이 1단계 관세 협정 의지가 남았기 때문이라고 해석했다. 지난해 수준의 갈등이 아니라는 해석이 아시아증시 전반에 긍정적 영향을 줬다는 분석이다. 실제로 이날 일본 니케이 지수도 1.73% 올라 장을 마쳤고, 홍콩 지수도 상승세를 보였다.노동길 NH투자증권 연구원은 ""미중이 마찰을 지속해도 지금처럼 1단계 무역협정 수호 의직를 피력할 경우, 경제 여파를 최소화 할 수 있다""면서 ""현재 미중 마찰은 말싸움에 가깝다. 지난해 수준은 아니다""고 말했다.여기에 문 대통령의 발언이 지수의 상승 폭을 키운 것으로 보인다. 이날 문 대통령은 청와대에서 주재한 '2020 국가재정전략회의'에서 ""고용·수출 등 실물경제의 위축이 본격화 하고 있어 더 과감한 재정의 역할이 필요하다""며 ""1, 2차 추가경정예산(추경)을 뛰어넘는 3차 추경안을 신속하게 준비해주기 바란다""고 주문했다.코스닥지수는 전 거래일(708.58)보다 11.31포인트(1.60%) 높아진 719.89에 마감했다. 지수는 4.30포인트(0.61%) 오른 712.88에 개장해 상승 폭을 키워나가는 모습을 보였다.코스닥시장에서 외국인이 999억원 순매수했고, 개인과 기관은 886억원, 65억원 순매도했다.코스닥 시총 상위 종목 대부분이 오른 가운데 에코프로비엠(13.50%)이 가장 크게 급등했다. 이어 씨젠(4.28%), 알테오젠(3.15%), 에이치엘비(2.15%), 셀트리온제약(2.09%) 등이 강세를 보였다. 반면 케이엠더블유(-0.51%)은 나홀로 하락했다. hangseob@newsis.com<ⓒ 공감언론 뉴시스통신사. 무단전재-재배포 금지>",/news/news_read.nhn?article_id=0009879892&office_id=003&mode=search&query=삼성바이오로직스&page=1
,"25일 코스피지수가 24.47포인트(1.24%) 오른 1994.60에 마감했다. 와 등 언택트(untact·비대면) 관련 소비기업의 주가가 고공행진하면서 코스피지수를 끌어올렸다. 유가증권시장에서 개인과 기관이 각각 933억원, 375억원을 순매수했고 외국인은 1406억원을 순매도했다. 외국인은 코스피200지수 선물에서는 2400억원을 순매수했다. 장 초반 코스피지수는 소폭 상승 후 보합권에서 움직였다. 홍콩 국가보안법 제정을 둘러싸고 미·중 갈등이 격화될 조짐이 나타나면서 상승이 제한됐다. 이후 카카오와 NAVER 등 언택트 관련 소비주의 주가가 급등하면서 코스피지수가 상승하기 시작했다. 카카오는 전날보다 8.5% 오른 26만8000원에 마감하며 을 제치고 시총 8위에 올랐다. 장 중 27만원까지 오르며 52주 신고가를 기록하기도 했다. NAVER는 전날보다 4.56% 오른 24만1000원으로 52주 신고가로 마감했다. 언택트 수혜주로 꼽히는 도 전날보다 2.78% 오른 81만2000원을 기록했다. 장 중에는 83만2000원으로 52주 신고가를 기록했다. 와 는 0.21%, 0.12%로 소폭 올랐고, 는 2.27% 상승했다. 업종별로 카카오와 NAVER가 포함된 서비스업이 4% 가까이 오르며 강세를 보였다. 운송장비와 증권, 금융업, 음식료도 1% 넘게 올랐다. 운송장비는 LNG선 수주 기대감에 이 8% 넘게 올랐고, 한국조선해양이 4.88% 상승했다. 코스닥지수는 전날보다 11.31포인트(1.6%) 오른 719.89에 마감했다. 코스닥시장에서 외국인이 999억원을 순매수했고 개인과 기관은 각각 866억원, 65억원을 순매도했다. 코스닥시장에서도 비대면 관련 업종이 강세를 보였다. 인터넷과 소프트웨어가 5% 넘게 올랐고, IT 소프트웨어와 서비스도 3% 넘게 상승했다. [이경민 기자 sea_through@chosunbiz.com]	[]	[] 	chosunbiz.com",/news/news_read.nhn?article_id=0000528306&office_id=366&mode=search&query=삼성바이오로직스&page=1
코스피 강세…1.24% 오른 1994.60 마감,"[더팩트ㅣ박경현 기자] 25일 미국과 중국의 갈등이 지속되는 외부 환경 속 국내증시는 강세 마감했다. 코스피는 전장에서 1970선까지 후퇴했다가 이날 다시 2000선 턱끝까지 올라왔다.코스피는 이날 전장 대비 24.47포인트(+1.24%) 오른 1994.60에 장을 마쳤다. 기관의 매수세 전환에 개인과 기관은 각각 957억 원, 354억 원을 사들였다. 반면 외국인은 홀로 1421억 원을 순매도했다.시가총액 상위종목은 대부분 올랐다. 삼성전자(+0.21%), SK하이닉스(+0.12%), 삼성바이오로직스(+2.27%), 네이버(+4.56%), 삼성전자우(+1.77%), LG화학(+3.32%), 삼성SDI(+3.57%), 카카오(+8.50%), LG생활건강(+0.21%)이 줄줄이 오른 가운데 셀트리온(-0.46%)은 소폭 내렸다. 이날 장중 카카오는 LG생활건강의 시가총액을 앞서며 시총 8위(우선주 제외)에 안착했다.업종은 양방향미디어와 서비스, IT서비스, 소프트웨어, 담배, 전기제품이 4~6%가량 올랐다. 반면 항공사, 생명보험, 사무용전자제품이 1%가량 내렸다.코스닥은 전장대비 11.31포인트(+1.60%) 오른 719.89에 장을 마쳤다.코스닥에서는 외국인 홀로 985억 원을 사들인 가운데 개인과 기관이 각각 867억 원, 65억 원을 팔아치웠다.이날 코스닥 시가총액 상위종목 역시 대부분 올랐다. 셀트리온헬스케어(+0.33%), 에이치엘비(+2.15%), 셀트리온제약(+2.09%), 씨젠(+4.28%), 알테오젠(+3.15%), CJ ENM(+0.25%), 에코프로비엠(+13.50%), 스튜디오드래곤(+0.92%)이 오른 가운데 케이엠더블유(-0.51%)는 하락하며 장을 마쳤다.pkh@tf.co.kr저작권자 ⓒ 특종에 강한 더팩트 & tf.co.kr 무단 전재 및 재배포 금지",/news/news_read.nhn?article_id=0000026978&office_id=629&mode=search&query=삼성바이오로직스&page=1
,"국내 인터넷 포털 '양대산맥'인 네이버와 카카오 주가가 연일 최고가를 갈아치우며 닮은꼴 고공행진을 하고 있다. 네이버는 시가총액 40조원에 육박하며 시총 3위인 삼성바이오로직스를 턱밑까지 추격했고, 카카오는 현대차에 이어 LG생활건강을 제치고 8위에 올라섰다. 두 기업이 코스피 시총의 판도를 뒤흔드는 형국이다. 시가총액은 주가에 주식 수를 곱한 것으로, 기업 가치를 평가하는 주요 척도로 쓰인다.




 25일 네이버 주가는 전 거래일보다 1만500원(4.56%) 오른 24만1000원을 기록했다. 4거래일 연속 상승하며 최고가를 갈아치웠다. 올해 들어서만 29.2% 뛰었다. 시가총액은 39조5875억원으로 불어나 시총 3위인 삼성바이오로직스와의 격차를 2조원대로 좁혔다. 카카오의 주가 상승세는 더 매섭다. 이날 8.5% 오른 26만8000원에 마감, 최고가를 또 새로 썼다. 올해 주가 상승률은 74.6%에 달한다. 이달 초만 해도 해도 시총 순위가 10위 밖이었으나, 주가 급등으로 시총이 23조3347억원으로 커지며 단숨에 8위(삼성전자 우선주 제외)까지 뛰어올랐다. 7위인 삼성SDI와의 격차는 5950억원가량인데, 주가 흐름을 고려하면 조만간 역전도 가능할 전망이다.


 두 기업의 주가 급등세는 신종 코로나바이러스 감염증(코로나19) 사태를 계기로 '언택트(비대면)' 문화가 퍼질 것이란 기대 때문이다. 실제 코로나19로 사람들이 외부 활동을 자제하고, 포털사이트나 애플리케이션을 통한 온라인 쇼핑과 결제가 활성화되는 추세다. 이동륜 KB증권 연구원은 ""코로나19 이후 커머스·콘텐트·결제 등 비대면 서비스의 확산 속도가 빨라지고 있다""며 ""플랫폼 기업의 코로나19 수혜가 부각된다""고 말했다.



금융정보업체 에프앤가이드에 따르면 증권가는 네이버와 카카오의 올해 영업이익(연결 기준)이 각각 9829억원, 4158억원에 이를 것으로 본다. 지난해보다 각각 38.4%, 101.1% 늘어난 수치다. 이에 따라 증권사들은 두 기업의 목표 주가를 잇달아 올려잡고 있다. 이베스트투자증권은 네이버 목표 주가를 29만원으로, 카카오는 30만원으로 높였다. NH투자증권도 네이버와 카카오 목표 주가를 각각 28만원, 27만원으로 상향 조정했다. 성종화 이베스트투자증권 연구원은 ""언택트 시대의 가속화로 네이버의 기존 주력 사업뿐 아니라 네이버페이, 네이버웹툰 같은 자회사 가치도 오를 것""이라며 ""카카오 역시 페이와 뱅크, 페이지, 커머스 등이 우호적인 사업 환경을 맞고 있다""고 말했다.





 코스피 주도 업종이 바뀔 것이란 전망도 나온다. 김예은 IBK투자증권 연구원은 ""4차 산업시대와 코로나19로 인한 비대면이 '뉴노멀(새로운 기준)'이 되면서 IT 소프트웨어(SW)의 성장은 지속될 것""이라며 ""현재 시총 1, 2위인 삼성전자·SK하이닉스 등 반도체 중심의 시장이 네이버·카카오 등 IT SW 중심 시장으로 재편될 시점이 머지않았다""고 전망했다.


황의영 기자 apex@joongang.co.kr
▶ ▶ ▶ ⓒ중앙일보(https://joongang.co.kr), 무단 전재 및 재배포 금지",/news/news_read.nhn?article_id=0003003426&office_id=025&mode=search&query=삼성바이오로직스&page=1
,"[머니투데이 강민수 기자] [[내일의 전략]]코로나19(COVID-19)로 부상한 언택트(비대면) 관련주가 국내 증시의 판도를 뒤집고 있다. 소프트웨어 업종의 선전으로 코스피 시가총액 10위권 내 전통적인 제조업 및 소재 업체를 찾기가 힘들어졌다. 소프트웨어, 바이오, 2차전지 업종의 선전으로 코스피는 1990선까지 회복했다. 25일 코스피 지수는 전일 대비 24.47포인트(1.24%) 상승한 1994.60에 마감했다. 상승 출발한 지수는 장중 1970선까지 내려앉았으나, 개인 매수세에 힘입어 1990선까지 회복했다. 이날 코스피시장에서 개인과 기관은 각각 958억원, 352억원을 사들였고, 기관은 1406억원어치를 순매도했다. 다만 외국인은 주식선물을 239억원 순매수했다. 업종은 철강·금속(-0.20%)과 보험(-0.29%)을 제외한 대부분이 빨간 불을 켠 가운데 서비스업이 3% 넘게 올라 가장 상승 폭이 높았고, 증권, 운송장비, 통신업 등도 1% 강세였다. 코스피 시가총액 상위주는 약보합세였던 셀트리온을 빼고 모두 올랐다. 특히 카카오(8.50%), NAVER(4.56%), 엔씨소프트(2.78%) 등이 언택트 수혜주가 증시 상승을 주도했다. LG화학, 삼성SDI 등 2차전지주도 3% 넘게 올랐고, SK 또한 자회사 SK바이오팜 상장을 앞두고 8% 가까이 올랐다. 코스닥 지수는 전일 대비 11.31포인트(1.60%) 오른 719.89로 거래를 마쳤다. 710선에서 출발한 지수는 외인 매수세에 꾸준히 올라 720선에 근접했다. 코스닥시장에서는 개인과 기관은 866억원, 65억원을 순매도했고, 외국인은 999억원을 사들였다.코스닥에서도 정보기기(-0.15%)와 기타제조(-3.60%), 운송(-0.43%)를 제외한 대부분 업종이 오른 가운데 소프트웨어, 인터넷, 일반전기전자 등이 4~5%가량 상승했다. 비금속, 금융 등도 2% 강세였다.코스닥 시총 가운데는 케이엠더블유(-0.51%)를 뺀 대부분이 올랐다. 특히 씨젠, 알테오젠, 에이치엘비 등 제약·바이오주가 2% 넘게 올랐고, 2차전지 소재업체인 에코프로비엠은 무려 13.5% 올랐다. 이날 서울 외환시장에서 원/달러 환율은 전 거래일보다 7.2원 오른 1244.2원에 거래를 마쳤다. 이는 지난 3월 24일(1265.0원) 이후 두 달여 만에 종가 기준 최고점을 기록한 것이다.이날 증시는 코로나19 사태가 국내 증시 지형도에 미친 영향을 여실히 드러냈다. 삼성전자, SK하이닉스 등 기존 주도주인 반도체주는 보합권에서 등락을 반복했으나, 코스피는 1% 넘게 반등했다. 이날 소프트웨어, 2차전지, 제약·바이오 업종이 증시 상승을 견인한 덕분이다.실제로 이날 언택트(비대면) 수혜주로 꼽히는 카카오, NAVER, 엔씨소프트 등은 나란히 52주 신고가를 경신했다. 삼성SDI, LG화학 등 2차전지주와 삼성바이오로직스 등도 2~3% 올랐다. 이날 급등세에 카카오는 현대차에 이어 LG생활건강까지 제치고 코스피 시총 8위에 올랐다. 지난 13일 사상 처음으로 시총 10위권에 진입한 지 12일 만이다. 25일 기준 코스피 시총 상위주를 살펴보면 삼성전자(1위), SK하이닉스(2위) 등 반도체, 삼성바이오로직스(3위), 셀트리온(5위) 등 제약·바이오주, LG화학(6위), 삼성SDI(7위) 등 전기차 배터리, NAVER(4위), 카카오(8위) 등 인터넷 업종이 자리하게 됐다. 시총 1~8위 종목 가운데 과거 전통 제조업, 소재·산업재 업체가 사라진 것이다. 이경민 대신증권 연구원은 ""코로나19로 인해 4차산업 성장속도가 빨라지는 데다, 사회적 변화에 순응하기 위해 정보통신기술(ICT) 투자가 필수적인 상황에서 해외 주요국들은 5G·서버·데이터센터 투자에 정책을 집중하고 있다""며 ""4차산업혁명이라는 글로벌 트렌드가 한국 증시까지 영향을 미치고 있다""고 분석했다. 이러한 상황에서 오히려 가치주는 손을 못 쓰고 있다. 삼성증권 리서치센터는 ""주식시장의 변동성이 확대되는 국면에서 가치 투자가 적합하다는 투자 상식이 통하지 않는 상황""이라며 ""코로나 사태가 의외로 길게 가면서 언택트 관련 새로운 성장동력들이 지속적으로 출현하게 됐다""고 진단했다. IT 업종이 주도하는 상승장세는 당분간 지속될 것으로 보인다. 이경민 연구원은 ""앞으로도 정보기술(IT)가 글로벌 증시 분위기 반전과 추세 반전을 주도할 가능성이 높다""며 ""IT 중심으로 펀더멘털(기초체력) 동력을 확보한 한국 증시의 매력은 더 부각될 수밖에 없다""고 강조했다. 강민수 기자 fullwater7@mt.co.kr
<저작권자 ⓒ '돈이 보이는 리얼타임 뉴스' 머니투데이, 무단전재 및 재배포 금지>",/news/news_read.nhn?article_id=0004414343&office_id=008&mode=search&query=삼성바이오로직스&page=1
삼성전자 1085억 원 매도·삼성바이오로직스 342억 원 매수,"[더팩트ㅣ박경현 기자] 25일 코스피는 기관의 매수세 전향에 개인과 기관이 '사자'를 유지하며 강세 마감했다. 이날 개인과 기관은 각각 957억 원, 354억 원을 사들인 반면 외국인은 홀로 1421억 원을 순매도했다. 코스닥에서는 외국인 홀로 1000억 원가량 사들이며 1%대 상승마감했다.외국인투자자의 코스피시장 기업 최대매수는 삼성바이오로직스로 향했다. 외인은 이날 삼성바이오로직스 342억 원, 삼성전자우 310억 원, 현대차 177억 원, DB하이텍 173억 원, LG화학 146억 원 순으로 순매수했다.반면 삼성전자는 1085억 원 팔았다. 이어 SK하이닉스 653억 원, 네이버(NAVER) 221억 원, 케이티앤지(KT&G) 128억 원, 삼성SDI 71억원을 순매도했다.코스닥 시장에서는 에코프로비엠(140억 원), 씨젠(121억 원), NHN한국사이버결제(87억 원)를 사들인 반면 에스앤에스텍(83억 원), 메디톡스(45억 원), 아프리카TV(43억 원)는 팔았다.이날 기관투자자는 삼성SDI에 334억 원 가량을 매수했다. 이어 케이티앤지(KT&G) 326억 원, LG화학 293억 원, 삼성전자 111억 원을 사들였다.반면 카카오는 897억 원가량을 팔았다. 이어 삼성전자우 204억 원, SK하이닉스 182억 원 호텔신라 87억 원 순으로 매도했다.이날 시가총액 상위종목은 대부분 올랐다. 삼성전자(+0.21%), SK하이닉스(+0.12%), 삼성바이오로직스(+2.27%), 네이버(+4.56%), 삼성전자우(+1.77%), LG화학(+3.32%), 삼성SDI(+3.57%), 카카오(+8.50%), LG생활건강(+0.21%)이 줄줄이 오른 가운데 셀트리온(-0.46%)은 소폭 내리며 장을 마쳤다.pkh@tf.co.kr저작권자 ⓒ 특종에 강한 더팩트 & tf.co.kr 무단 전재 및 재배포 금지",/news/news_read.nhn?article_id=0000026989&office_id=629&mode=search&query=삼성바이오로직스&page=1
"해외주식 '직구' 열풍성장주 찾아 태평양 건너는 원정 개미들""한국은 산업 역동성 떨어져""올들어 해외주식 6조 순매수","해외 주식 투자가 급속히 늘고 있다. 올 들어 이달 중순까지 해외 주식 거래금액은 작년 1년치(410억달러)를 훌쩍 넘어섰다. 순매수 금액만 6조원에 이른다. 해외 거래 계좌는 급증하고 있다. 이런 흐름으로 가면 올해 ‘해외 주식 거래 1000억달러(약 120조원) 시대’를 맞게 될 것으로 보인다. 투자자들은 지난 10년간 높은 수익률을 기록한 미국 등 해외 주식이 미래 성장성도 높다고 판단, 매수에 나서고 있다. 국내에서 새로운 성장산업(투자처)을 찾지 못해 자금이 해외로 흘러나가고 있다는 지적도 나온다.한국예탁결제원에 따르면 지난 21일 기준 올해 외화증권 거래액(외화증권예탁 결제 처리금액)은 487억달러에 달했다. 매달 100억달러어치 이상 해외 주식을 거래한 셈이다. 올해 순매수액은 이미 50억달러(약 6조원)를 넘어섰다.이는 해외 주식에 눈을 돌리는 ‘개미’들이 급증한 영향이다. 미래에셋대우의 해외 주식 거래 투자자는 지난해 3만765명에서 올 5월까지 4만4717명으로 늘었다. 키움증권 해외 주식 계좌는 작년 1만2000개에서 올해 14만4000 개로 12배 증가했다. 증권사 관계자는 “안정성이 높고 많은 수익을 올릴 수 있다는 점 때문에 젊은 층은 물론 해외 주식 투자에 보수적이던 중장년층까지 나섰다”고 했다.개미들이 지루한 한국 시장 대신 빠르게 성장하는 미국으로 눈을 돌렸다는 게 증권업계의 분석이다. 지난 10년(2010년 5월 21일~2020년 5월 22일)간 코스피지수는 23% 올랐다. 같은 기간 나스닥지수는 318%, 다우지수는 140% 급등했다.또 최근 국내 주식시장에서 고공행진하고 있는 삼성바이오로직스 네이버 카카오와 같은 성장주가 미국 증시에 대거 포진하고 있다는 판단도 해외 주식 거래 급증으로 이어졌다. 유승민 삼성증권 글로벌투자전략팀장은 “성장주가 많은 미국 증시에 단타족은 물론 3년 이상 장기투자자들이 성장성을 보고 몰려들고 있다”고 설명했다.박재원/전범진 기자 wonderful@hankyung.com▶ ▶
 ▶
ⓒ 한국경제 & , 무단전재 및 재배포 금지",/news/news_read.nhn?article_id=0004347124&office_id=015&mode=search&query=삼성바이오로직스&page=1
,"외국인 투자자는 25일 거래소에서 삼성바이오로직스, 삼성전자우, 현대차 등을 중점적으로 사들인 것으로 나타났다.외국인 투자자의 순매수 상위 20개 종목은 삼성바이오로직스, 삼성전자우, 현대차, DB하이텍, LG화학, 한국조선해양, KODEX 레버리지, 오리온, KODEX 코스닥150 레버리지, 삼성중공업등이다.이중에 운수장비 업종에 속한 종목이 4개 포함되어 있다.삼성바이오로직스, 삼성전자우, 현대차 등은 전일 대비 주가가 상승했고, 롯데지주 등은 주가가 하락했다.한경로보뉴스이 기사는 한국경제신문과 금융 AI 전문기업 씽크풀이 공동 개발한 기사 자동생성 알고리즘에 의해 실시간으로 작성된 것입니다.▶ ▶
 ▶
ⓒ 한국경제 & , 무단전재 및 재배포 금지",/news/news_read.nhn?article_id=0004347200&office_id=015&mode=search&query=삼성바이오로직스&page=1
,"기관 투자자는 25일 거래소에서 KODEX 레버리지, 삼성SDI, KT&G 등을 중점적으로 사들인 것으로 나타났다.기관 투자자의 순매수 상위 20개 종목은 KODEX 레버리지, 삼성SDI, KT&G, LG화학, KODEX 코스닥150 레버리지, KODEX WTI원유선물(H), 삼성에스디에스, 삼성전자, GS리테일, 삼성바이오로직스등이다.이중에 서비스업 업종에 속한 종목이 4개 포함되어 있다.이날 기관 투자자가 순매수한 종목들 중에 KODEX 레버리지, 삼성SDI, KT&G 등은 전일 대비 주가가 상승했다.한경로보뉴스이 기사는 한국경제신문과 금융 AI 전문기업 씽크풀이 공동 개발한 기사 자동생성 알고리즘에 의해 실시간으로 작성된 것입니다.▶ ▶
 ▶
ⓒ 한국경제 & , 무단전재 및 재배포 금지",/news/news_read.nhn?article_id=0004347201&office_id=015&mode=search&query=삼성바이오로직스&page=1
