head,text,url
,"[머니투데이 조준영 기자] 올해 '동학개미운동'이라는 신조어가 만들어질 정도로 개인투자자들의 거침없는 주식매수세가 이어졌지만, 극단의 변동장에서 높은 수익률을 올린 것은 외국인이었다.지난 3월 9일 코스피지수는 코로나19(COVID-19) 직격탄을 맞으며 2000선이 깨지고 단 9거래 일만인 19일 약 30% 폭락하며 1400대로 주저앉았다. 그리고 두 달 반만인 지난 21일 장중 2000선을 넘어서는 등 약 3개월 동안 60%가 넘는 지수 변동성을 보였다. 개인들은 폭락장에서 삼성전자, SK하이닉스 등 저가로 떨어진 우량주 매수에 열을 올렸고 외국인들은 셀트리온, 삼성바이오로직스 등 코로나19(COVID-19) 관련 수혜가 예상된 바이오주를 사들이며 각자 다른 길을 걸었다. 결과적으로 외국인이 매수한 종목들은 올랐고 개인들이 매도한 종목들은 더 오른 것으로 나타났다. 유럽과 미국에 코로나19가 본격 확산된 지난 3월 2일부터 5월 22일까지 약 3개월간 개인과 외국인의 평균 매수·도가(거래액 기준 상위 100종목) 대비 주가상승률을 분석한 결과다. 개인들이 순매수한 종목들은 분석기간 동안 평균 3.34% 오른 데 비해 외국인의 경우 15.62%나 오르며 개인보다 평균 4배 이상 차이가 났다. 거래액 상위 10개 종목으로 좁혀보면 외국인이 산 주식이 개인의 10배나 오르며 격차가 더 벌어졌다.개인이 6조원 넘게 순매수한 삼성전자의 평균 매수가는 여전히 현재가의 -0.45%에 그쳐 손익분기점을 넘지 못했다. 국내 증시 하락에 2배 베팅한 'KODEX 200선물인버스2X'는 빠른 증시반등으로 -19.82% 손실을 기록하며 평균수익률을 크게 깎았다. 반면 외국인은 셀트리온(+13.56%), 삼성바이오로직스(+20.55%), 셀트리온제약(+33.39%) 등 제약·바이오 종목들에서 큰 수익률을 올렸고 'TIGER MSCI Korea TR'(+18.13%), 'KODEX 코스닥 150'(+17.49%) 같은 지수상승 ETF(상장지수펀드)에서도 고수익을 기록했다.같은 기간 개미들이 팔아치운 종목들은 평균 +16.51%로 외국인(9.08%)의 1.5배 이상 올랐다. 상위 10개 종목으로 좁히면 개인이 판 주식은 외국인의 2배 이상 오른 것으로 나타났다. 순매도액 4662억원으로 개인들이 가장 많이 판 'KODEX 코스닥150 레버리지'의 경우 평균매도가 대비 42.73%나 올랐다. 개인들이 예상한 것보다 훨씬 빠르게 증시가 반등한 결과로 풀이된다. 이 밖에도 삼성바이오로직스(+16.64%), 한샘(+26.5%), 펄어비스(+10.68%) 등 매도액 상위 종목들 대부분이 크게 올랐다.외국인이 가장 많이 팔아치운 종목은 삼성전자와 SK하이닉스로 각각 5조7598억원, 1조4520억원 어치 팔아치웠지만, 개인과 달리 두 종목 모두 1.39%, 1.67% 하락했다. 현대차(+3.81%), 신한지주(+2.48%), 기아차(+5.49%) 등 상위 매도 종목들은 소폭 상승하는 데 그쳤다. 무릎에서 판 종목도 있었다. 최근 언택트 관련주로 급성장한 NAVER와 카카오의 경우 각각 28.09%, 44.57% 올랐고 삼성SDI와 SK도 각각 27.75%, 35.17% 크게 상승한 것으로 나타났다.과거에도 비슷한 결과가 나왔을까. 오히려 극심한 변동장에서 개인들은 그나마 나은 수익률을 올린 것으로 나타났다. 코스피가 2300선까지 넘보며 호황을 누리던 지난해 12월부터 올해 2월까지 개인들이 산 주식은 평균 -7.40% 수익률을 기록하며 외국인(+0.54%)과 차이가 컸다. 상위 10개 순매수 종목으로 비교하면 개인이 순매수한 종목들은 16%나 폭락해 외국인(+4.48%)과의 차이가 극단적으로 벌어졌다. 순매도 종목에서도 결과는 크게 엇갈렸다. 개인들이 순매도한 상위 10개 종목은 평균 17.53% 오른데 비해 외국인이 팔아치운 종목들은 평균 14.22%나 떨어졌다. 특히 개인들이 판 카카오(+47.73%), 엔씨소프트(+34.73%), SK하이닉스(+70.62%), NHN한국사이버결제(+95.58%) 등은 고공행진을 이어갔다.조준영 기자 cho@mt.co.kr
<저작권자 ⓒ '돈이 보이는 리얼타임 뉴스' 머니투데이, 무단전재 및 재배포 금지>",/news/news_read.nhn?article_id=0004414158&office_id=008&mode=search&query=삼성바이오로직스&page=1
"코스피 1%대로 오름폭 키우며 1,990대 육박외인, 코스피선 순매도 코스닥선 순매수 나서","[서울경제] 주요국 경제활동 재개 기대감에 25일 코스피와 코스닥이 나란히 강세다.이날 오후 2시 30분 현재
코스피 지수는 전일보다 1.00%(19.69포인트) 상승한 1,989.82를 나타내고 있다. 지수는 전 거래일보다 10.38포인트(0.53%) 오른 1,980.51로 출발해 오전 잠깐 하락전환하기도 했으나 이내 오름세를 타기 시작한 뒤 오름폭을 확대하고 있다.백신 조기 개발과 주요국의 경제활동 재개 기대감이 증시에 온기를 불어넣고 있는 것을 풀이된다.다우존스30 산업평균지수는 전장보다 8.96포인트(0.04%) 하락한 24,465.16에 거래를 마쳤으나, 스탠더드앤드푸어스(S&P) 500 지수와 나스닥 지수는 각각 0.24%, 0.43% 올랐다.앤서니 파우치 미국 국립보건원 산하 국립알레르기·전염병연구소(NIAID) 소장은 지난주 미국 바이오기업 모더나가 개발 중인 백신에 대해 ‘희망적’이라고 평가했다. 그는 연말까지 백신이 마련될 수 있다는 낙관적 견해도 밝혔다. 다만 지속되는 미중간 긴장은 증시에 핵심 변수로 작용할 전망이다.서상영 키움증권 연구원은 “홍콩보안법을 둘러싸고 미중이 더 강하게 맞부딪힐 수 있는 데다 차익실현 욕구도 커지고 있는 만큼 매도 심리가 만만치 않은 상황”이라고 말했다유가증권시장에서는 외국인이 1,145억원을 순매도했으나 개인과 기관이 각각 967억원, 160억원을 순매수했다. 시가 총액 상위 종목 중에는 삼성바이오로직스(2.27%)와 네이버(3.69%), LG화학(2.79%), 삼성SDI(3.42%), 카카오(8.50%) 등이 올랐고, 삼성전자(-0.10%), SK하이닉스(-0.62%), 셀트리온(-0.46%)은 하락세다.같은 시각 코스닥 지수는 전일 대비 1.37%(9.69포인트) 오른 718.27포인트를 기록하고 있다. 지수는 전장보다 4.30포인트(0.61%) 오른 712.88로 개장해 상승하고 있다. 코스닥 시장에서는 유가증권 시장과는 반대로 개인과 기관이 각각 579억원, 100억원을 순매도했으나 외국인이 741억원을 순매수했다. 시가총액 상위 종목중에는 셀트리온헬스케어(0.33%)와 에이치엘비(2.54%), 셀트리온제약(1.74%), 씨젠(3.74%), 알테오젠(3.45%), 펄어비스(0.82%), 에코프로비엠(11.80%), 스튜디오드래곤(1.05%) 등 대부분 종목이 올랐고, CJ ENM(-0.08%)과 케이엠더블유(-1.01%) 만 내렸다. 한편 이날 오후 2시 38분 현재 서울 외환시장에서 원달러 환율은 전일 대비 2.9원 오른 1,243.4원을 기록했다. /양사록기자 sarok@sedaily.com저작권자 ⓒ 서울경제, 무단 전재 및 재배포 금지",/news/news_read.nhn?article_id=0003742360&office_id=011&mode=search&query=삼성바이오로직스&page=1
,"성장성을 중심으로 다양한 종목이 각개 약진할 것세계 경제가 실업의 공포에서 벗어나지 못하고 있다. 그 영향으로 하반기에 경제가 강하게 V자 반등을 할 거란 기대도 후퇴했다. V자 반등을 하기는 하는데 그 강도가 약하고 반등 후 지지부진한 옆 걸음에서 벗어나지 못할 거란 전망이 새롭게 대두됐다.
미국의 4월 비농업부문 고용이 시장 예상대로 전월 대비 2000만명 넘게 감소했다. 코로나19 확산 방지를 위한 봉쇄조치가 반영된 수치로 서비스업과 제조업, 건설업 모두에서 고용이 크게 줄었다. 코로나19로 인한 대면 서비스 중단으로 도소매와 레저 등 서비스업의 고용 부진이 특히 심했다. 실업률이 2차 세계대전 이후 최고 수준인 14.7%로 상승했다. 한국 역시 4월 고용지표가 좋지 않았다. 계절조정 실업률이 3.8%로 전월과 같은 수준이었지만 취업자 수는 전년동기대비 47만명 감소했다. 업종별로는 숙박음식, 교육서비스, 도소매를 중심으로 감소했는데 이들 역시 코로나19의 타격을 가장 크게 받는 대면 서비스업종이다.성장성이 높은 코스닥 시장이 코스피를 압도악화된 고용지표에도 불구하고 주중 주가가 크게 상승했다. 주가를 움직이는 동력이 달랐기 때문인데 현재 시장은 경제 펀드멘털보다 코로나19 백신 개발이라는 이벤트와 미래에 대한 기대에 의해 만들어지고 있다. 국내 증시에서는 코스닥 상승이 돋보였다. 주요국 주가 중에서 유일하게 코로나19 확산 이전의 고점을 회복했기 때문이다. 나스닥이 비슷한 흐름을 보이고 있지만 아직 고점보다 7% 정도 낮은 상태다. 다우지수를 비롯해 유럽 시장은 이미 4월초에 상승을 끝내고 한 달 넘게 오랜 횡보조정을 계속하고 있다. 코스피와 스탠다드앤푸어스(S&P)500이 나스닥과 유럽시장 사이에 위치해 있지만 5월 들어 뚜렷한 상승 흐름을 보이지 못하고 있다. 여러 시장과 비교해 코스닥이 얼마나 강한지 알 수 있다.
코스닥이 오른다고 해서 세계적으로 중소형주 강세가 나타나고 있는 건 아니다. 미국에서 나스닥이 선전하고 있지만 중소형주 강세는 아닌 것은 미국의 대형주지수인 S&P500이 중소형주 지수인 러셀2000보다 월등히 높은 상승률을 기록하고 있는 걸 보면 알 수 있다. 우리나라도 코스닥으로 표면화됐을 뿐 성장성이 높은 섹터를 중심으로 주가가 오르고 있다. 국내에서는 바이오와 언텍트 등 코로나19관련 부문이 성장이 높은 쪽으로 분류돼 있는데 코스닥시장에서 이들이 차지하는 비중이 높다 보니 자연히 코스닥 상승이 두드러져 보인 것이다. 미국은 IT소프트웨어와 플랫폼 기업이 그 자리를 차지하고 있다.
정부 정책도 코스닥 강세에 한 몫을 하고 있다. 정부가 한국판 뉴딜 정책을 통해 전국에 5G망을 구축해 금융, 의료, 교통분야에서 데이터를 수집해 이를 비즈니스에 활용하겠다고 선언했다. 이와 함께 교육, 의료영역에서 비대면 서비스를 확대해 해당 부문이 우리 경제의 중심이 되도록 할 계획이다. 디지털 전환 및 비대면이 다양한 산업으로 확대되는 것이다. 이 발표로 코스닥에서 관련주가 상승했다.
과거 사례를 보면 중소형주에서 테마가 만들어지고 적용 기업이 늘어나는데 정부 정책이 결정적 역할을 하는 경우가 많았다. 정부가 특정 섹터를 핵심 육성 부문으로 지정할 경우 해당 부분에 예산 배정이 늘어 기업이 기술을 개발하고 운용 자금을 쉽게 확보할 수 있기 때문이다. 2000년이 대표적인 경우다. 대기업이 외환위기를 초래한 주범으로 낙인찍히자 경제를 끌고 갈 새로운 주체가 필요했다. 이때 선택된 게 벤처였다. 1999년 정부가 벤처 살리기 일환으로 코스닥 등록 요건을 완화했는데 때마침 주식시장이 활황을 보여 코스닥시장이 급등했다.국내 산업구조 변화도 주가에 반영코로나19 확산으로 급락했던 주가가 대부분 회복됐다. 이제는 낮은 가격만으로는 주가를 움직일 수 없는 상태가 된 건데 그 틈을 성장이 뚫고 들어왔다. 당분간 성장성 있는 섹터와 보통 기업 간에 주가 차이가 계속 벌어질 걸로 보인다. 이런 일시적 재료 외에 우리 시장의 구조적 변화도 중소형주 강세에 힘을 보태주고 있다.
지난 10년 사이 포스코, 현대차, 한전, KT 같은 대표 기업의 주가가 최고치 대비 50~70% 넘게 하락했다. 실적은 주가만큼 나쁘지 않았다. 포스코의 영업이익이 10년 전과 비슷한 5조원대이고, LG전자도 3조원 가량이다. 현대차를 제외하고 이익이 안정적이었음에도 불구하고 주가가 하락한 것이다. 이런 현상은 지난 10년 사이 재벌 계열 대기업에 대한 시장의 평가가 달라졌기 때문에 나왔다. 시장에서는 이들이 일정 수준의 매출과 이익을 유지할 뿐 성장을 기대하긴 힘든 존재가 됐다고 보고 있다. 그래서 기업의 본질적 가치는 괜찮음에도 불구하고 미래 가치가 낮아 주가가 떨어진 것이다.
재벌 계열 대기업의 역할이 줄어든 대신 새로운 산업의 힘은 강해졌다. 지난 10년간 네이버 주가가 4배 올라 시가총액 4위가 됐다. 10년 전에는 주식시장에 존재하지 않았던 삼성바이오로직스와 셀트리온도 시가총액 3위와 6위로 올라섰다. 세 곳 모두 성장성으로 주목 받고 있는 플랫폼과 바이오에 속해 있는 기업들이다. 이런 흐름은 미국시장에서도 나타났다. 애플, 아마존, 구글 등 플랫폼 사업을 영위하는 기업의 주가는 계속 상승한 반면 자동차를 비롯해 전통적 산업은 힘을 쓰지 못했다. 수익을 내는 형태가 다양해져 기업에 대한 평가가 달라진 것이다.
10년 전에 미국 스탠다드앤푸어스(S&P)500지수에서 플랫폼 기업이 차지하는 비중이 2%에 밖에 되지 않았다. 2020년이 돼도 해당 비중이 5%를 넘지 않을 거란 예상이 대다수였지만 이미 애플과 아마존 두 회사의 시가총액만이 전체의 8%를 넘었다. 그래서 지금은 2040년에 미국 상장기업의 이익에서 플랫폼 기업들이 차지하는 비중이 50%를 넘을 거란 전망이 이상하게 들리지 않는다. 지난 10년간 S&P500지수 내에 있는 플랫폼 기업의 이익이 330% 증가했는데 앞으로 그 절반만 늘어도 예상 수치를 맞출 수 있기 때문이다.
이러 흐름은 우리나라에서도 진행 중이다. 액면가 5천원으로 환산할 경우 네이버 주가가 1000만원을 넘었다. 다음카카오도 현대차와 시가총액 10위 자리를 놓고 경쟁 중이다. 과거에는 생각도 할 수 없었던 일이 벌어지고 있는 건데 이는 우리 경제의 구조적 변화를 반영한 결과다. 당분간 성장성을 중심으로 다양한 종목이 각개 약진하는 상황이 벌어질 걸로 보인다. 시장의 관심이 성장성으로 쏠린 이상 앞으로 주가 차별화가 더 심해질 수밖에 없다. 한쪽에서는 상상도 할 수 없었던 가격이, 다른 쪽에서는 생각지도 못했던 주가 하락이 동시에 나타날 텐데 늦더라도 상승 쪽에 몸을 싣는 게 좋다. 지금은 마음 편한 투자가 좋은 투자가 아니라는 점을 명심해야 한다.- 이종우 증시칼럼니스트 				[ⓒ 이코노미스트() 무단 전재 및 재배포 금지]",/news/news_read.nhn?article_id=0000010147&office_id=243&mode=search&query=삼성바이오로직스&page=1
,"코스피가 장 막판 반등을 시도하며 지속 상승했지만 지수 2000 회복은 실패했다. 하지만 미중 무역갈등 고조 불안에도 불구 미국의 경제재개라는 외부적요인과 언택트를 비롯한 시장 주도주 관심에 증시는 장 막판 1% 이상 상승세를 탔다.코스피는 25일 전 거래일 대비 1.24%(24.47포인트) 상승한 1994.60에 거래를 마쳤다. 개인과 기관이 매수를 이끌었고 외국인은 파는 것에 초점이 맞춰졌다. 개인과 기관은 각각 933억원, 376억원 순매수했고 외국인은 1421억원 순매도했다.코스피 시가총액 10개 상위종목은 셀트리온(-0.46%)을 제외하고 모두 상승 마감했다. 시총 1,2위 삼성전자와 SK하이닉스는 0.21%, 0.12% 소폭 상승했다. 삼성바이오로직스, 네이버, 삼성전자우, LG화학, 삼성SDI 등은 3~4%의 높은 상승률을 보였다. 시총 9위까지 오른 카카오는 이날 8.50%까지 올랐다.코스닥은 전 거래일 대비 1.60%(11.31포인트) 오른 719.89에 거래를 마쳤다. 코스닥의 개인과 외국인의 거래는 코스피와 정반대의 모습을 보였다. 개인은 871억원 순매도했고, 외국인은 984억원 순매수했다. 기관은 61억원 순매도했다.코스닥 시가총액 10개 상위종목 중에서도 케이엠더블유(-0.51%)를 제외하고는 모두 상승을 나타내는 빨간등이 켜졌다. 셀트리온헬스케어(0.33%), 에이치엘비(2.15%), 씨젠(4.28%), 셀트리온제약(2.09%), 펄어비스(0.82%), CJ ENM(0.25%)은 소폭 상승했다. 에코프로비엠은 13.50% 상승으로 마감해 눈길을 끌었다.이날 증시는 장 막판 상승세를 타며 코스피 2000 돌파를 기대하게 만들었다. 하지만 미중 갈등 우려 속 상승폭은 제한됐다.그러나 미중 정면 충돌 양상으로 전개되지 않을 것이라는 분석이 제기되면서 매수세가 유입됐다. 또한 미국이 10만명 이상 대규모 코로나19 백신 임상 진행 계획과 함께 경제 재개 검토 발언까지 나오면서 증시 상승에 영향을 줬다는 분석이다.한편 이날 달러/원 환율은 7.20원(0.58%) 인상된 1244.20원으로 거래를 마쳤다.송창범 기자
 <저작권자 ⓒ '성공을 꿈꾸는 사람들의 경제 뉴스' 머니S, 무단전재 및 재배포 금지>",/news/news_read.nhn?article_id=0000546678&office_id=417&mode=search&query=삼성바이오로직스&page=1
카카오 8.5% 등 대형주 대부분 오름세코스닥도 외인 매수세에 오름세 이어가,"[서울경제] 25일 코스피가 상승해 1,990선 위로 다시 올라섰다.이날 코스피는 전 거래일보다 1.24%(24.47포인트) 오른 1,994.60으로 마감했다.지수는 전장보다 0.53%(10.38포인트) 오른 1,980.51로 출발해 오전 한때 상승 폭을 줄였다가 다시 오름세를 보였다. 홍콩 국가보안법(홍콩보안법)을 둘러싸고 미·중 긴장이 재부상했지만, 주요국의 경제활동 재개와 백신 조기 개발 기대가 투자심리에 긍정적으로 작용했다.유가증권 시장에서는 외국인이 1,421억원을 순매도했으나, 개인과 기관이 각각 952억원과 357억원을 순매수했다.시가총액 상위종목 중에는 삼성전자(0.21%)와 SK하이닉스(0.12%), 삼성바이오로직스(2.27%), 네이버(4.56%), LG화학(3.32%), 삼성SDI(3.57%), 카카오(8.50%), LG생활건강(0.21%) 등이 올랐고, 셀트리온(-0.46%)만 내렸다. 코스닥지수는 전 거래일보다 1.60%(11.31포인트) 오른 719.89포인트로 상승해 720선에 근접했다. 이는 지난해 6월 21일(722.64) 이후 11개월 만에 최고치다.지수는 전장보다 4.30포인트(0.61%) 오른 712.88로 개장해 장중 상승 흐름을 지속하다 고가로 장을 마감했다.코스닥 시장에서는 개인과 기관이 각각 867억원과 65억원을 순매도했으나, 외국인이 985억원을 순매수했다. 한편 이날 서울 외환시장에서 원/달러 환율은 전일 대비 7.2원 오른 1,244.2원에 장을 마쳤다. /양사록기자 sarok@sedaily.com저작권자 ⓒ 서울경제, 무단 전재 및 재배포 금지",/news/news_read.nhn?article_id=0003742432&office_id=011&mode=search&query=삼성바이오로직스&page=1
"24.47포인트 오른 1994.60 마감개인·기관 동반 매수…""미중 갈등 말싸움""카카오 8.5% 급등…시총 8위로 껑충","그래픽=마켓포인트[이데일리 김윤지 기자] 25일 코스피 지수가 1%대 상승했다. 장 초반 미·중 관계 악화와 홍콩 리스크 확대 우려로 주춤하는 모양새를 보였지만 코로나19 진정 이후 점진적인 경재 재개와 회복 기대감이 더 크게 작용했다. 결국 2거래일 만에 1990선을 회복했다.마켓포인트에 따르면 이날 코스피지수는 전 거래일 대비 24.47포인트(1.24%) 오른 1994.60에 마감했다. 상승 출발한 후 1967선까지 미끄러졌지만 홍콩 주식시장이 오후 들어 낙폭을 만회하는 등 과거와 다른 양상을 보여주면서 상승 전환에 성공해 1994선까지 올라갔다. 노동길 NH투자증권 연구원은 “미·중 관계는 당분간 마찰이 계속될 듯 하다”면서도 “지금처럼 1단계 무역협정 수호 의지를 피력하면 경제 여파를 최소화할 수 있어 ‘말싸움(레토릭)’에 가깝다”고 말했다. 지난해 수준은 아직 아니라는 분석이다. 유가증권시장에서 개인은 933억원, 연기금 등이 617억원을 사들이는 등 기관은 376억원 순매수했다. 외국인은 1407억원을 순매도했다. 프로그램
매매는 차익과 비차익을 합쳐 533억원 순매도 우위를 기록했다.전 업종별로는 상승 우위를 보였다. 이날 큰 폭으로 상승한 IT기업을 포함한 서비스업이 3.86%로 가장 크게 올랐고, 운수장비, 증권, 비금속광물, 음식료품, 금융업, 통신업, 화학 등이 1% 넘게 상승했다. 철강및금속과 보험이 1% 미만으로 소폭 하락했다. 시가총액 상위 종목도 대부분 상승했다. 신종 코로나 바이러스(코로나19) 확산으로 비대면 관련 업종이 투자자의 관심을 끌면서 카카오(035720)는 8.5% 급등해 52주 최고가를 경신했다. 시가총액 23조3347억원으로 LG생활건강(051900)(시가총액 21조8655억원)을 제치고 코스피 시가총액 8위로 올라섰다. NAVER(035420)도 4.56% 올랐다. 대장주인 삼성전자(005930)와 SK하이닉스(000660)가 1% 미만으로 소폭 상승했으며 삼성바이오로직스(207940)와 LG(003550)화헉, 삼성SDI(006400) 등도 3% 안팎으로 올랐다. 셀트리온(068270)은 1% 미만 빠졌다. 종목별로는 비대면 관련주가 돋보였다. 카카오(035720) 외에도 NAVER(035420), 엔씨소프트(036570) 모두 이날 장중 52주 최고가를 기록했다. 클라우딩 관련주인 효성ITX(094280)도 9.38%, 삼성에스디에스(018260)가 6.59%, 더존비즈온(012510)이 6.44% 올랐다. 국보(001140)가 29.92%로 상한가를 기록했다. 국내 파운드리(반도체 위탁생산) 전문 업체 DB하이텍(000990)은 1분기 실적을 바탕으로 17%대 상승했다. 이날 거래량은 6억3009만주, 거래대금은 7조8421억원으로 집계됐다. 상한가 1개 종목을 포함해 517개 종목이 상승했고 하한가 종목 없이 303개 종목이 하락했다. 83개 종목은 보합권에서 거래를 마쳤다.김윤지 (jay3@edaily.co.kr)＜ⓒ종합 경제정보 미디어 이데일리 - 무단전재 & 재배포 금지＞",/news/news_read.nhn?article_id=0004648070&office_id=018&mode=search&query=삼성바이오로직스&page=1
코스닥도 1.6% 올라…720선 '눈 앞',"[아시아경제 이민우 기자] 2000선이 무너진 뒤 1960대까지 떨어졌던 코스피가 다시금 상승세로 돌아서며 1990대로 장을 마쳤다. 코스닥은 상승세를 이어가며 720선을 눈 앞에 두고 있다.25일 한국거래소에 따르면 코스피는 전장보다 1.24%(24.47포인트) 오른 1994.60에 마감했다. 이날 1980.51로 상승 개장한 뒤 오전 한 때 1967까지 밀렸지만 이내 다시 오름세를 회복했다. 전 거래일 당시 2000대로 출발했지만 1960 초반대로 주저앉았던 것과 상반된 분위기다.유가증권시장에서는 외국인의 매도세를 개인과 기관이 떠받치는 형국이었다. 외국인은 1421억원을 순매도한 반면 개인과 기관은 각각 955억원, 355억원을 순매수했다.거의 모든 업종이 상승세를 보였다. 서비스업의 상승폭이 3.86%로 가장 컸다. 이어 운수장비(1.83%), 증권(1.62%), 비금속광물(1.46%) 등의 순이었다. 반보험과 철강·금속 업종만이 각각 0.29%, 0.20% 하락했다.0.4% 떨어진 셀트리온을 제외한 시가총액 상위 10위 종목들이 올랐다. 전장 대비 8.5% 오른 카카오의 상승세가 단연 돋보였다. 이날 카카오는 27만원까지 오르며 신고가를 경신했다. 이어 NAVER(4.5%), 삼성SDI(3.5%), LG화학(3.3%), 삼성바이오로직스(2.2%), 삼성전자(0.2%) 등의 순이었다.같은 날 코스닥은 전장보다 1.60%(11.31포인트) 오른 719.89에 장을 마쳤다. 올해 들어 가장 높은 수치로 720선을 눈 앞에 두고 있다. 코스닥 지수가 720을 넘어선 것은 지난해 6월25일이 마지막이다.코스닥시장에서는 외국인의 매수세가 강세였다. 985억원을 순매수한 반면 개인과 기관은 각각 867억원, 65억원을 순매도했다.역시 대부분의 업종이 상승세였다. 인터넷(5.41%)과 소프트웨어(5.22%)의 경우 5% 넘게 상승했다. 이어 일반전기전자(4.37%), 통신서비스(3.27%) 등의 순이었다. 반면 기타제조의 경우 3.60% 떨어졌다. 운송과 정보기기 등도 각각 0.43%, 0.15% 하락했다.시가총액 상위 10위 종목 대부분이 올랐다. 에코프로비엠의 경우 13.5%로 상승폭이 가장 컸다. 이어 씨젠(4.2%), 알테오젠(3.1%), 에이치엘비(2.1%) 등의 순이었다. 케이엠더블유만이 0.5% 떨어졌다.이민우 기자 letzwin@asiae.co.kr <ⓒ경제를 보는 눈, 세계를 보는 창 아시아경제 무단전재 배포금지>",/news/news_read.nhn?article_id=0004685001&office_id=277&mode=search&query=삼성바이오로직스&page=1
