title,url,press,summary,date
코로나19 확산에 주총 '비상'…임기제한에 사외이사도 구인난,/news/news_read.nhn?article_id=0004508733&office_id=421&mode=search&query=삼성SDI&page=1,뉴스1,"셀트리온의 경우 6명의 사외이사를 바꿔야 하며, 만도·삼성SDI·삼성에스디에스 등은 각각 4명의 사외이사를 새로 구해야 한다. 3명을 교체해야 ...",2020-03-08 06:18
"신동빈 롯데 회장, 주전공 '화학' 키운다...M&A로 사업 다각화 시도",/news/news_read.nhn?article_id=0000483280&office_id=366&mode=search&query=삼성SDI&page=1,조선비즈,사업은 삼성SDI에 남아 해당 사업 분야는 확보하지 못했다. 롯데케미칼은 지난해 전기차 배터리 핵심소재인 음극재 분야 사업과 반도체 소재 기술을...,2020-03-08 08:01
"화학 키우는 롯데… 신동빈 회장 ""美 추가 투자, 日 기업 인수 추진""",/news/news_read.nhn?article_id=0003513224&office_id=023&mode=search&query=삼성SDI&page=1,조선일보,사업은 삼성SDI에 남아 해당 사업 분야는 확보하지 못했다. 롯데케미칼은 지난해 전기차 배터리 핵심소재인 음극재 분야 사업과 반도체 소재 기술을...,2020-03-08 08:02
"中은 보조금 폐지했는데, 韓은 中기업에 360억 지원",/news/news_read.nhn?article_id=0004385812&office_id=014&mode=search&query=삼성SDI&page=1,파이낸셜뉴스,"LG화학·SK이노베이션·삼성SDI 등 국내 배터리기업의 대중국 수출물량은 정부 규제에 막혀 줄어가는 가운데, 중국 기업들은 오히려 한국에서의 영...",2020-03-08 17:37
"외국인이 던진 삼성전자, 개미 '4兆 싹쓸이'",/news/news_read.nhn?article_id=0004303068&office_id=015&mode=search&query=삼성SDI&page=1,한국경제,"삼성SDI(11.64% 상승)를 제외하면 삼성전자, SK하이닉스, 한국전력 등 모든 대량 매입 종목이 하락 곡선을 그리고 있다. 같은 기간 코스...",2020-03-08 17:41
