head,text,url
,"현대자동차그룹이 공개한 그룹의 역사를 되돌아보는 영상이 3일만에 100만뷰 이상의 조회수를 기록해 눈길을 끈다.현대차그룹은 지난 3월 16일 한국 공식 유튜브 계정을 통해 '내일을 향합니다(넥스트 어웨이츠, Next Awaits)'라는 브랜드 캠페인 영상(국문)을 공개했다.이 영상은 약 2분 길이로 현대차그룹의 현재부터 과거까지 역사를 조명하고 있다.'내일을 향합니다'라는 영상의 제목과는 달리 영상 속 시간은 스마트 모빌리티로 채워진 미래가 아닌 과거를 향하고 있다.영상에서는 현재를 기점으로 그룹의 성장 과정에 주목하고 창업 시점까지 거슬러 올라가 역사적 순간들을 상기하며 '진보하는 기업은 우연이 아니라 역사를 통해 힘을 길러왔음'에 초점을 맞추고 있다.현대차그룹 관계자는 ""새로운 시대를 준비하는 현대차가 주목한 것은 '더 나은 가치'를 만들고자 했던 열망과 끝없는 도전을 통해 진보해온 그룹의 역사""라며 ""이는 현대차그룹의 경영 철학과 브랜드 헤리티지로 이어져 오고 있다""고 말했다.이 영상은 지난해 9월 현대차 유럽권역본부가 기획 후 제작해 유럽에서 최초로 공개했으며 현지에서 꾸준한 조회수를 기록함에 따라 지난해 12월 말 글로벌 지역으로 공개를 확대했다.제작을 맡은 영화감독 '단테 아리올라(Dante Ariola)'는 창업주 고 정주영 명예회장의 영문 평전 'Made in Korea : Chung Ju-Yung and the Rise Of Hyundai'의 내용을 바탕으로 스토리를 구성했고 시간을 거슬러 올라가는 리와인드 기법과 컴퓨터 그래픽(CG)을 동원해 '내일을 향합니다'를 완성했다.영상은 현대차의 수소전기차 넥쏘가 횡단보도 앞에 멈추는 장면에서 시작해 시간을 거슬러 올라가 투싼, 티뷰론, 스텔라 등 과거 차량의 모습을 차례대로 비추며 1974년 토리노 모터쇼에서 포니를 공개하는 장면으로 넘어간다.특히 포니는 한국 최초의 고유 모델로서 국민들에게 '우리도 할 수 있다'는 자긍심을 갖게 한 기념비적인 자동차이며 에콰도르를 시작으로 해외에 수출돼 한국을 자동차 수출국 반열에 올려놓는 등 상징성이 높은 차종이다.이 후 영상은 포니가 컨테이너 안으로 들어가면서 무역선이 건조되는 장면으로 전환되는 가운데 내레이션은 ""우리는 전 세계에 직접 만든 차를 실어 나르기 위해 배를 건조했다""고 말하며 1960년대 한국 조선업의 시작과 현대차그룹의 인연을 언급하기도 한다.또한 영상 속 다리 건설 현장과 뜨거운 용광로에서 철을 생산하는 장면, 도로 건설을 지휘하는 창업주의 뒷모습 등은 총 13개의 한강 다리와 경부고속도로를 비롯한 주요 도로를 건설하며 한국 경제가 빠르게 발전할 수 있도록 힘을 보탠 정주명 명예회장을 반추해 볼 수 있는 대목이다.현대차그룹 관계자는 ""단순히 신차를 노출해 브랜드 인지도를 끌어올리는 기존 마케팅 방식에서 벗어나 유럽인들에게 브랜드의 기원을 알리고 오늘날 현대차가 어떻게 성장했는지와 브랜드 핵심가치인 '인류를 위한 진보(Progress for Humanity)'를 어떻게 구현해 왔는지에 대해서 표현하고자 노력했다""고 밝혔다.한국적인 역사와 현대차그룹의 브랜드 헤리티지가 인류의 지속가능성을 높이는 친환경차 기술로 진보했다는 이야기는 유럽을 넘어 전 세계인들에게 확산되고 있다. 이정혁 기자 jjangga@sportschosun.com- Copyrightsⓒ , 무단 전재 및 재배포 금지",/news/news_read.nhn?article_id=0003545028&office_id=076&mode=search&query=현대차&page=2
,"[머니투데이 조준영 기자] [①코로나19 장기화 전망…레버리지보다 보수적인 투자관점 권고]코로나19(COVID-19) 여파로 전세계가 국경을 걸어잠그고 있다. 경기침체가 심화 될 것이라는 두려움에 시장은 달러 확보에 사활을 건다. 코로나19 사태가 장기화 될 것을 대비한 현금사수 전략이다. 채권과 금 같은 안전자산도 맥을 못춘다. 위험자산인 주식시장은 그야말로 초토화됐다. 증권업계 전문가들도 '이번 폭락은 2008년 금융위기 때보다 더하다'며 혀를 내두른다. 코스피를 떠받쳤던 우량주들의 하락세는 두드러진다. 삼성전자는 지난달 21일부터 이달 20일까지 한 달간 주가가 23.3% 빠졌고 △SK하이닉스(27.3%) △네이버(18.7%) △현대차(44.4%) 등도 폭탄을 맞았다. 미래가 극도로 불투명한 시장이지만 개인들은 너도나도 주식투자에 나선다. 주가가 곤두박질치면서 '지금이 저가매수의 기회'라는 판단에서다. 코스피지수도 최근 한 달간 30% 가까이 폭락하면서 이 지수를 정방향 또는 역방향으로 추종하는 ETF(상장지수펀드)에는 매일 수천억 원의 자금이 유입되고 있다. 여의도 증권가는 패닉 상태다. '예측이 의미 없다'는 말이 나올 정도다. 몸을 잔뜩 움츠린 채 폭풍이 지나가길 기다리자는 분위기가 지배적이다. 극도의 불확실성이 지배하는 지금, '멘탈'을 지킬 수 있는 증권업계 관계자들의 조언을 정리해봤다.증권업계 전문가들은 주가가 펀더멘털에 비해 지나치게 저평가됐다고 인정하면서도 과도한 투자에 지속적인 경고음을 내고 있다. 특히 신용·미수거래 등 레버리지(차입)를 활용한 투자는 지금처럼 변동성이 큰 장에서 상당한 손실을 입을 수 있다고 지적한다.신용주식거래는 개인이 주식을 사기 위해 해당 주식을 담보로 증권사에 일정 기간(통상 90일) 부족한 금액을 빌려 투자하는 방법이다. 미수거래도 이와 유사하되 차입 만기가 3거래일로 기간이 훨씬 짧다.실제 주가가 큰 폭으로 떨어지던 2월 말부터 3월 중순까지 신용융자잔고는 10조원대로 크게 늘었다. 지난 13일 9조원대로 내려앉은 잔고는 19일에는 7조 원대로 하락했다. 증권업계는 이 같은 큰 폭의 잔고 감소를 반대매매의 영향으로 보고 있다. 투자자가 기간 내 돈을 갚지 못한 경우 증권사는 해당 주식을 하한가에 강제매도해 자금을 회수할 수 있기 때문이다.코스피지수가 하루에도 종목주가처럼 크게 변동하는 장에서 레버리지를 일으킨 투자는 큰 손실로 돌아올 가능성이 높다. 증권업계 관계자는 ""최근 '아차' 싶은 투자자들이 많을 것""이라며 ""신용이나 미수 거래를 하기보다 차분히 시장이 진정될 때까지 기다리는 것이 필요하다""고 밝혔다.하루에도 자산가치가 크게 출렁이면서 업계 전문가들은 '현금 총알'을 든든히 확보하라고 권고한다. 코로나19 사태의 장기화가 예측되는 가운데 투자기회는 아직 충분하다는 이유다.한 대형증권사의 반포지역 담당PB(프라이빗 뱅커)는 ""고객들에게 당분간은 시장을 예의주시 해야 하는 상황이지, 주식에 투자해야 할 때는 아니라고 말하고 있다""며 ""지금은 현금을 확보하고 1분기 기업실적이 나온 이후 보수적으로 투자하기를 권고 드린다""고 밝혔다.또한 코로나19 확진자가 전세계로 확산되는 추세이므로 섣불리 증시바닥을 논하기도 어렵다. 전문가들은 만약 지금이 바닥이라 하더라도 폭락장에서는 대체로 V자보다 W자로 증시가 회복하는 만큼 충분한 기간을 두고 시장을 '확인'해야 한다고 조언한다.잦은 매매를 지양할 필요도 있다. 주식 거래창에 뜨는 두 자릿수의 마이너스 수익률과 퍼렇게 물든 투자종목들에 '멘탈'이 흔들리는 것은 자연스럽다. 하지만 이를 만회하기 위해 단기간 내 매매를 반복할 경우 손실은 걷잡을 수 없이 커질 수 있다.수 천명이 모여 주식 종목을 토론하는 한 모바일 메신저방에는 최근 '손절(주식 처분)한 다음날 반등하더라', '조금 덜 손해 보려고 오를 때를 기다렸다. 내일 대체 어떻게 빠져나가냐' 등 답답함을 드러내는 글들이 다수였다. '투자한 종목이 올라갈 자신 있다면 끝까지 들고, 자신이 없으면 팔고 빠져야 한다' 등 각자의 투자원칙을 소개하는 내용도 눈길을 끌었다.전문가들은 폭락장에서는 무엇보다 '마인드 컨트롤'이 중요하다고 강조한다. 한 금투업계 관계자는 ""주식 창에 뜨는 손실액은 '평가액'일 뿐 '확정액'이 아니다""라며 ""팔지 않으면 손실이 아니다. 마음을 편하게 먹고 시장을 관망하는 자세가 필요하다""고 말했다. 그러면서 ""지난 금융위기 때도 주식을 매도하지 않고 장기투자한 사람들이 승리했다""며 ""지금은 충분한 시간을 투자해야 하는 시기""라고 강조했다.조준영 기자 cho@mt.co.kr
<저작권자 ⓒ '돈이 보이는 리얼타임 뉴스' 머니투데이, 무단전재 및 재배포 금지>",/news/news_read.nhn?article_id=0004380658&office_id=008&mode=search&query=현대차&page=2
,"[머니투데이 이건희 기자]
""이미 어려운 걸 많이 아실 텐데. 이제 더 이야기하고 싶지 않네요."" 국내 완성차업체에 부품을 공급 중인 한 2차 협력업체 대표의 말이다. 그는 어려움을 겪는 업계 이야기를 듣고 싶다는 기자의 질문에 답하기를 정중히 거절하며 이처럼 말했다. 코로나19가 일으킨 경제 태풍이 완성차업체에 이어 1·2·3차 협력업체를 '더 이상 말하기 힘들 만큼' 강하게 덮쳤다. 지난달 국내 완성차 공장들을 전부 멈춰 세운 데 이어 미국·유럽 완성차 공장까지 줄줄이 가동 중단에 들어가면서다. 완성차 공장과 호흡을 같이 하는 협력업체의 어려움은 숫자로도 확인된다. 특히 2·3차 협력업체의 불안이 원청사나 1차 협력업체보다 크게 두드러진다. '코로나19 기업 애로지원센터'를 운영 중인 한국자동차산업연합회에 따르면 이달 2·3차 부품업체의 공장 가동률이 60~70% 수준에 머물렀다. 1차 협력업체만 해도 가동률이 90% 이상을 유지하고 있는 것과 상황이 사뭇 다르다. 무엇보다 힘든 건 어려움을 호소하기 쉽지 않은 분위기라는 하소연이다. 익명을 요구한 업계 관계자는 ""2·3차 협력업체는 신규 대출을 받기 어려운 유동성 위기로 고사할 수 있다는 걱정이 많다""며 ""그렇다고 매출액 급감을 대외적으로 호소하면 자금 상환 압박이 들어오는 경우도 있어 애만 태우는 상황""이라고 말했다. 자금력이 있는 1차 협력업체라고 안전한 건 아니다. 이들도 살얼음판을 걷는 듯 경영 활동을 이어간다. 자동차 부품업체 2위의 만도는 희망퇴직을 추진 중이다. 정몽원 만도 대표이사 회장이 직접 노동조합을 만나 유휴 인력 때문에 자발적 희망퇴직을 피할 수 없다고 설득했다.지난달 코로나19 확진 직원이 발생해 공장 문을 잠시 닫았던 현대차의 1차 협력업체 서진산업은 조심스럽게 가동을 이어가고 있다. 서진산업 관계자는 ""지난달 상황 이후 특이사항은 없었지만 코로나19 장기화가 우려된다""며 ""그나마 단기적으로는 국내에서 생산 속도를 내는 현대차에 발을 맞추는 상황""이라고 전했다. 업계에서는 이참에 생산차질 우려가 나오는 미국·유럽 공장을 대신해 국내 생산을 늘리자는 역발생도 나온다. 현대차 주요 공장이 위치한 울산에선 울산 북구 협력업체 38개 업체 대표들이 지난 20일 현대차 노사에 주 60시간 특별연장근로를 하자는 내용의 '완성차 특별연장근로 시행을 위한 탄원서'를 전달했다. 울산 부품업체 대표들은 ""코로나19로 발생한 8만대의 납품 손실분이 협력사 경영에 어려움을 초래하고 있다""며 ""이를 만회하기 위해 완성차의 가동률이 높아지면 협력사의 가동률도 함께 올라갈 것""이라고 말했다. 코로나19 이후를 위해 협력업체의 생존을 지원해야 한다는 주장도 나온다. 자동차산업연합회 관계자는 ""수요 절벽 시기에는 세금 감면과 납부 유예, 부품업체 긴급운영자금 지원 등의 방안을 마련하고 수요 폭증기에는 주당 근로시간 연장 등의 대책을 시행할 필요가 있다""고 말했다.이건희 기자 kunheelee@mt.co.kr
<저작권자 ⓒ '돈이 보이는 리얼타임 뉴스' 머니투데이, 무단전재 및 재배포 금지>",/news/news_read.nhn?article_id=0004380663&office_id=008&mode=search&query=현대차&page=2
"현대차 ""코로나 확산 대응""","[서울경제] 현대자동차 미국 앨라배마공장(HMMA)의 가동 중단이 이달 31일까지 연장된다. 22일 는 신종 코로나바이러스 감염증(코로나19) 확산에 대응하기 위해 이같이 결정했다고 밝혔다. HMMA 가동 중단 기간은 영업일 기준 7일 연장된 것이다. 앞서 HMMA는 엔진 생산라인 근무자 1명이 코로나19 양성 반응을 보이면서 22일까지 공장 문을 닫기로 했었다. 이번 조치로 HMMA의 생산량이 1만대가량 줄어들 것으로 전망된다. HMMA 관계자는 “조업 중단에도 모든 직원이 적정한 보상을 받게 될 것”이라고 전했다. 이 공장 직원은 3,000여명이다. 앨라배마 공장에서 엔진을 공급받는
조지아 공장도 재가동이 불투명하다. 지난 19일부터 조업 중단에 들어간 조지아 공장도 이달 말까지 일손을 놓아야 할 상황인 것으로 전해졌다. 현대·기아차의 생산에 차질이 생기면서 현지에 함께 진출한 현대모비스·현대제철 등 계열사 및 협력사의 연쇄 타격이 우려되고 있다. /서종갑기자 gap@sedaily.com저작권자 ⓒ 서울경제, 무단 전재 및 재배포 금지",/news/news_read.nhn?article_id=0003713160&office_id=011&mode=search&query=현대차&page=1
"폭스바겐, 비대면 자동차 금융앱 V-Click 선보여재규어랜드로버, 지프 온라인 구매 웹페이지 개설인피니티 비대면 출고시 개소세 1.5% 추가 지원","[헤럴드경제 원호연 기자]현대차가 아반떼의 월드 프리미어 이벤트를 온라인으로 생중계 하는 등 코로나19를 극복하기 위한 자동차 업계의 온라인 마케팅이 강화되고 있다. 수입차 역시 비대면 마케팅을 강화하고 있다. 폭스바겐코리아는 SUV 티구안 프리미엄을 계약하는 고객 중 자사의 비대면 자동차 금융 서비스 앱인 ‘브이-클릭(V-Click)’ 을 이용할 경우 5만원 상당의 모바일 주유권과 고급 담요, 캠핑의자 등을 추가로 제공한다. '브이-클릭' 앱은 전시장 방문 없이도 금융 신청부터 금융 계약까지 가능한 비대면 서비스다. 재규어랜드로버코리아는 최근 코로나19 확산에 외출을 자제하는 소비자가 늘어남에 따라 직접 전시장을 방문하는 재규어 랜드로버 공식 홈페이지 내 ‘온라인 구매하기’ 채널을 통해 계약하도록 유도하고 있다. 내달 8일 까지 재규어 랜드로버 ‘온라인 구매하기’ 사이트를 통해 차량 견적을 받아 저장한 고객 200명에게 백화점 상품권 1만원권을 추첨하여 증정한다. 또한, 랜드로버 뉴 디스커버리 스포츠, 올 뉴 레인지로버 이보크 및 재규어 F-PACE 모델 대상으로 견적을 받고 출고까지 진행한 고객 중 4명을 추첨해 100만원 상당의 다이슨 공기청정기를 제공한다.재규어랜드로버코리아에서 2017년에 선보인 ‘온라인 구매하기’ 사이트는 온라인상에서 선호 전시장 및 지불 방식까지 선택할 수 있어 보다 쉽고 빠른 구매가 가능하다. 공식 홈페이지에 마련된 ‘온라인 구매하기’ 기능을 활용하면 원하는 차종 및 색상의 재고 여부를 확인할 수 있다.재규어랜드로버코이라 측은 ""전국적인 코로나19 확산에 대응해, 고객의 안전성과 편의성 높은 온라인 채널을 통한 비대면 구매 상담 서비스를 제공하기 위해 이같은 이벤트를 마련했다""고 밝혔다. 지(JEEP) 역시 홈페이지에 비대면 구매 전용 채널을 개설했다. 온라인을 통해 구매상담, 시승신청, 게약서 작성, 차량 탁송 등 서비스를 제공한다. 이달 비대면 구매를 통해 계약 및 출고하면 최대 1290만원의 할인을 제공한다. 한편 인피니티 코리아는 3월 한 달간 비대면 상담 및 출고 고객들에게는 개별소비세 1.5%를 추가 지원한다.
- Copyrights ⓒ 헤럴드경제 & heraldbiz.com, 무단 전재 및 재배포 금지 -",/news/news_read.nhn?article_id=0001651777&office_id=016&mode=search&query=현대차&page=1
애초 22일에서 생산 중단 기간 연장기아차 조지아공장은 내부 논의중,"[이데일리 이소현 기자]
현대자동차(005380)는 미국 앨라배마공장(HMMA)이 신종 코로나바이러스 감염증(코로나19) 확산에 대응해 오는 31일까지 차량 생산 중단을 연장한다고 22일 밝혔다.현대차 공장 가동 중단은 엔진 생산라인에서 근무하던 직원 한 명이 코로나19 양성 반응을 보이면서 18일 오전 10시 30분(현지시간)부터
시작했다.앞서 현대차 앨라배마 공장은 22일까지 문을 닫기로 했다고 밝혔다. 이번 연장 조치로 현대차 앨라배마 공장은 영업일 기준 7일간 추가로 라인 가동을 중단하게 됐다. 이에 1만대가량 생산량이 줄어들 것으로 관측된다. 이 공장에서는 쏘나타와 엘란트라(아반떼), 싼타페를 생산한다.현대차는 조업 중단 시기에 미국 앨라배마공장 3000여명 직원들에 적정 수준으로 보상할 것으로 알려졌다.현대차 앨라배마공장은 성명서를 통해 “급속히 퍼지는 코로나19는 현대차가 예측 가능한 시장 수요에 맞춰 생산을 조정하기 위해 제조업을 세심하게 관리하도록 요구하고 있다”며 “계속 상황을 주시해 적절한 조처를 할 것”이라고 설명했다.아울러 현대차에서 생산하는 엔진을 공급받는 기아차 조지아공장(KMMG)도 영향을 받을 전망이다. 이 공장은 쏘렌토와 K5, 텔루라이드 등을 생산한다. 회사 관계자는 “기아차 조지아공장은 내부 논의 중”이라고 말했다.현대차 미국 앨라배마공장 전경(사진=현대차)이소현 (atoz@edaily.co.kr)＜ⓒ종합 경제정보 미디어 이데일리 - 무단전재 & 재배포 금지＞",/news/news_read.nhn?article_id=0004602701&office_id=018&mode=search&query=현대차&page=1
,"현대자동차가 신종 코로나바이러스 감염증(코로나19) 확산으로 미국 앨라바마공장(HMMA) 가동 중단 기간을 연장한다.현대차 미국 판매법인(HMA)은 20일(현지시간) 코로나19 확산으로 인한 시장 수요 감소로 미국 앨라바마 가동 중단 기간을 기존 22일에서 오는 31일까지 7일 연장한다고 밝혔다. 이번 조치로 7일간 약 1만대의 차량 생산이 줄어들 전망이다.앞서 현대차는 미국 앨리바마주 공장 직원 1명이 코로나19 양성 판정을 보여 18일부터 22일까지 공장 가동을 중단하기로 했었다.현대차 미국 판매법인은 다만 앨라바마공장 모든 직원들이 조업 중단 시기에 적정한 보상을 받게 될 것이라고 설명했다. 이 공장직원은 3000여 명이다.HMA는 ""급속히 퍼지는 코로나19는 현대차가 예측 가능한 시장 수요에 맞춰 생산을 조정하기 위해 제조업을 세심하게 관리하도록 요구하고 있다""면서 ""우리는 계속 상황을 모니터링하고 적시에 적절한 조치를 취할 것""이라고 말했다.현대차 앨라바마공장 가동 중단 연장으로 기아자동차 조지아공장(KMMG)도 영향을 받을 것으로 보인다.조지아공장은 부품공급을 이유로 22일까지 문을 닫고 23일부터 공장을 가동하겠다고 밝힌 바 있다. 그러나 코로나19 확산세로 조지아공장도 이달 말까지 일손을 놓게될 것으로 보인다.현대·기아차의 생산 차질로 현대모비스, 현대제철 등 계열사들의 연쇄 타격이 우려된다.데일리안 조인영 기자 (ciy8100@dailian.co.kr)ⓒ (주)데일리안 - 무단전재, 변형, 무단배포 금지",/news/news_read.nhn?article_id=0002390631&office_id=119&mode=search&query=현대차&page=1
,"[아시아경제 송화정 기자]외국인이 지난 주에도 매도 공세를 이어가며 국내 증시에서 6주 연속 '팔자'세를 지속했다.22일 한국거래소에 따르면 외국인은 지난 16일부터까지 20일까지 한 주 동안 국내 주식시장에서 약 3조320억원을 순매도했다. 유가증권시장에서 3조3973억원을 팔아치운 반면 코스닥시장에서는 3652억원을 사들였다.외국인이 지난 주 가장 많이 사들인 종목은 셀트리온헬스케어였다. 외국인은 지난 주 셀트리온헬스케어를 658억원 순매수했다. 뒤이어 삼성바이오로직스를 533억원 사들였다. 이밖에 넷마블(503억원), LG디스플레이(300억원), 셀트리온(289억원), 펄어비스(250억원), 에이치엘비(211억원), 케이엠더블유(207억원), 젬백스(189억원), 헬릭스미스(121억원) 등을 순매수했다.지난 주 외국인이 가장 많이 판 종목은 삼성전자였다. 외국인은 지난 주 삼성전자를 1조3104억원 순매도했다. 이어 SK하이닉스를 2922억원 팔았다. 이밖에 현대차(2306억원), 삼성전자우(1724억원), LG화학(1557억원), 엔씨소프트(1369억원), SK이노베이션(1212억원), 삼성SDI(1164억원), LG생활건강(1148억원), NAVER(1021억원) 등이 외국인 순매도 상위에 올랐다.외국인은 여전히 추가 매도 여력이 있다는 분석이다. 노동길 NH투자증권 연구원은 ""외국인은 원·달러 환율 하락 및 주식시장 반등에도 불구하고 지난 20일까지 12거래일 연속 코스피 매도를 지속했다""면서 ""금융시장에 내재한 유동성 경색 우려는 현재 진행형으로, 외국인의 국내 주식시장 및 채권시장 현물 순매수 추이는 금융위기와 비교했을 때 추가 매도 여력을 갖고 있다""고 말했다.송화정 기자 pancake@asiae.co.kr <ⓒ경제를 보는 눈, 세계를 보는 창 아시아경제 무단전재 배포금지>",/news/news_read.nhn?article_id=0004647137&office_id=277&mode=search&query=현대차&page=1
현대차 재택 중단,"국내 주요 기업들이 신종 코로나바이러스감염증(코로나19) 확산 방지를 위해 시행한 재택근무를 중단하고 정상근무 체제로 속속 복귀하고 있다. 사태 초기엔 국내 사업장 정상가동을 최우선으로 했으나 미국과 유럽 사업장 ‘셧다운’(가동중지)이 속출하는 등 예측하기 힘든 글로벌 경제 위기에 신속히 대응해야 할 상황에 직면했기 때문이다.현대·기아자동차는 코로나19에 대응하기 위해 지난달 27일부터 실시했던 자율 재택근무를 중단한다고 22일 밝혔다.
임산부나 지병이 있는 직원을 제외한 일반 직원들은 23일부터 모두 정상 출근하게 된다. 다만 현대차는 출퇴근 시간을 최대한 분산해서 직원 간 접촉을 줄인다는 방침이다. 직원들에게는 하루에 5시간 이상, 주 40시간 이상만 근무하면 된다는 지침을 내렸다. 단체 회식과 대면 회의는 계속 자제해줄 것을 권고했다. 현대차는 “부문별 협업 강화를 통해 사업운영에 생길 수 있는 차질을 예방하겠다”고 말했다.현대차는 코로나19 초기부터 종합상황실을 운영해왔다. 초기에는 중국발 부품 공급망 중심으로 대응했지만 최근에는 미주와 유럽까지 권역별 상황을 파악해 대응해야 하는 실정이다. 현대차는 코로나19 확진자 발생으로 앨라배마와 조지아 공장의 생산을 18일부터 중단했고 체코 공장과 슬로바키아 공장은 23일부터 2주간 문을 닫을 예정이다.현대엔지니어링도 지난주까지 진행했던 재택근무를 중단했다. 현대엔지니어링 관계자는 “23일부터 임산부나 기저질환자 등 일부 직원만 빼고 모두 정상출근할 예정”이라고 했다.최태원 SK 회장은 이번 주 초반 주요 계열사들이 참여하는 코로나19 대응과 관련한 경영 회의를 준비시킨 것으로 알려졌다. 주력 계열사인 SK이노베이션은 휘발유를 만들면 만들수록 손해를 보는 실정이며 국제유가 폭락에 따라 재고자산 평가손실이 막대한 상황이다.SK이노베이션은 31일까지 재택근무를 연장했지만, 책임자들과 필수 인력들은 정상 출근하고 있다. 재택근무자들도 근무시간을 연장하며 비상 상황에 대응하고 있다.박구인 강주화 김성훈 기자 rula@kmib.co.krGoodNews paper ⓒ , 무단전재 및 재배포금지",/news/news_read.nhn?article_id=0001302169&office_id=005&mode=search&query=현대차&page=1
