head,text,url
삼성 구미2사업장 주말 폐쇄LG이노텍 구미공장 2일까지 닫아  현대차 울산공장도 주말 멈춰,"삼성전자 구미공장에서 신종 코로나바이러스 감염증(코로나19) 확진자가 추가로 발생해 사업장을 또다시 임시 폐쇄했다. LG디스플레이와 LG이노텍 구미사업장 안에서도 확진자가 처음 나왔다.1일 삼성과 구미시에 따르면 삼성전자 구미2사업장에서 근무하는 무선사업부 직원 한 명이 지난달 29일 코로나19 검사에서 확진 판정을 받았다. 삼성전자는 구미2사업장을 1일 오후까지 이틀간 폐쇄하고 방역 작업을 했다. 확진 판정을 받은 직원이 근무한 층은 3일 오전 10시까지 폐쇄하고 소독할 예정이다.삼성전자 구미2사업장은 삼성전자가 최근 출시한 ‘갤럭시 Z 플립’ 등 폴더블 스마트폰과 갤럭시S20 일부 물량을 생산하는 곳이다. 지난달 22일에도 확진자가 나와 사흘간 생산시설을 폐쇄했다. 업계에선 삼성전자의 최신 스마트폰 생산 차질을 우려하는 목소리가 나온다. 삼성전자 관계자는 “주말 동안만 임시 폐쇄했기 때문에 큰 차질이 발생한 것은 아니다”며 “다음주에 재가동하면 제품 공급에는 문제가 없다”고 말했다.LG디스플레이도 2일까지 구미사업장 1단지 내 복지동과 모듈공장을 폐쇄하고 방역을 실시한다. 지난달 29일 복지동에서 근무하는 은행 직원이 코로나19 확진 판정을 받았기 때문이다. 구미사업장 1단지에선 스마트폰이나 차 계기판에 들어가는 LCD(액정표시장치)·OLED(유기발광다이오드) 패널을 생산한다.카메라모듈을 생산하는 LG이노텍 구미1A공장에서도 확진자가 나와 2일까지 문을 닫는다.지난달 28일 현대자동차 울산2공장 도장공장에서도 확진자가 나왔다. 울산공장은 스포츠유틸리티차량(SUV) 팰리세이드와 제네시스 GV80를 생산하는 곳이다. 현대차는 방역을 마치고 2일부터 공장을 정상 가동할 계획이다.황정수 기자 hjs@hankyung.com▶ ▶
 ▶
ⓒ 한국경제 & , 무단전재 및 재배포 금지",/news/news_read.nhn?article_id=0004298964&office_id=015&mode=search&query=현대차&page=1
,"[머니투데이 박소연 기자] [재계 ""76개국 입국 후 14일 격리 가혹, 패스트트랙 절실""…산업부 ""외교부와 협의해 대책 마련""]전세계 78개국이 코로나19(COVID-19) 확산 방지를 위해 한국인 입국 제한 조치를 시행하면서 재계가 산업 인력에 대한 예외조치 마련을 요구하고 나섰다.1일 관련업계에 따르면 국내 반도체·디스플레이업계는 최근 산업통상자원부에 국내 산업인력이 해외에 입국할 때 14일 격리 등의 조치를 예외적으로 완화해주는 방안을 각국 정부와 협의해 마련해 달라고 건의했다.출국 전 국내 공인의료기관에서 건강에 이상이 없다는 보건증을 사전에 발급받은 산업인력에 대해 해외 입국장에서 체온 측정 등 간단한 검사를 통과하면 격리 조치를 유예해주는 '프리패스' 조치가 가능하도록 각국 정부와 협의해달라는 것이다. 기업들은 이를 위해서라면 자사의 코로나19 방역 체계와 해외 사업장의 위생 관리 실태, 인력 관리에 대한 해외 정부의 점검도 받아들이겠다는 입장이다.기업들이 정부에 이런 조치를 요청하고 나선 것은 한국인 입국 제한 조치를 시행하는 국가가 빠르게 늘면서 해외사업장 관리와 시장 개척에 차질이 빚어질 우려가 커졌기 때문이다. 국내 기업들의 현지 생산라인이 가장 많은 중국이 대표적이다. 지난달 말부터 중국 산둥성·랴오닝성·지린성·헤이룽장성·광둥성·푸젠성·상하이시·산시성·쓰촨성 등 지방정부가 한국발 입국자를 14일 동안 격리 조치하고 있다.중국에는 삼성전자 반도체공장과 LG디스플레이 OLED(유기발광다이오드) 공장을 비롯해 현대차, LG전자 등이 현지 생산라인을 운영하고 있다.베트남도 지난달 말부터 최근 14일 이내 대구·경북 지역을 방문한 외국인의 입국을 금지하기 시작했다. 대구·경북을 방문하지 않았더라도 한국을 경유한 입국자는 입국장에서부터 14일 동안 격리 조치한다.베트남 정부가 한국∼하노이 노선에 대해 하노이공항 대신 하노이에서 차량으로 3시간가량 떨어진 꽝닌성 번돈공항을 이용하도록 한 방침을 늦장 통보하면서 지난달 29일엔 승객 40명을 태우고 인천에서 출발한 아시아나항공 여객기가 이륙 40분만에 인천공항으로 회항하는 일까지 벌어졌다.해외에 제조공장을 둔 기업 입장에선 생산설비 구축 등을 위한 본사 인력 투입이 차질을 빚을 경우 손실이 불가피하다. LG디스플레이는 올 2분기 중국 광저우공장의 OLED(유기발광다이오드) 양산을 앞두고 연구개발 인력 투입이 늦어지면서 애를 태우고 있다. 특히 OLED 같은 첨단기술 제품의 경우 생산 안정화 초기 단계에서 각종 테스트를 진행하고 노하우를 전수할 국내 인력 투입이 시급하다는 설명이다.베트남 하노이 인근 박닌과 타이응우옌에서 스마트폰 공장 2곳을 운영하는 삼성전자도 입국 제한 조치가 장기화할 경우 현지 공장 운영에 문제가 생길까 노심초사하고 있다.LG전자 역시 지난해 베트남으로 이전한 평택 스마트폰 생산라인이 이제 막 현지화 과정을 거치고 있다는 점에서 베트남 정부의 입국 제한 조치가 부담이다.정부는 외교부 차원에서 해당국가와 협의한다는 입장이다. 다만 한국인 입국 제한 조치가 70여개국에 달하는 만큼 단기 해결은 쉽지 않을 것이라는 관측이 나온다.정일 대한상공회의소 북경사무소장은 ""한시가 급한 기업 입장에서 14일 격리 조치는 사실상 출장을 오지 말라는 것과 같다""며 ""현지 한국 대기업뿐 아니라 중소기업들도 정부가 나서줄 것을 호소하고 있지만 대다수의 중국 지방정부가 입국제한 조치를 하고 있어 설득하기가 쉽진 않을 것""이라고 말했다. 박소연 기자 soyunp@mt.co.kr
<저작권자 ⓒ '돈이 보이는 리얼타임 뉴스' 머니투데이, 무단전재 및 재배포 금지>",/news/news_read.nhn?article_id=0004367043&office_id=008&mode=search&query=현대차&page=1
코로나 여파에 정상개최 불투명감사보고서 등 작성 늦어져 차질소집기피로 의결정족수 미달 우려전자투표제 도입 기업들 잇달아국민연금 5%룰 완화 개정으로주주권 강화 움직임에 바짝 긴장‘경영권 분쟁’ 한진 최대 관심이사회 대거 세대교체 바람도,"3월 주총 시즌이 돌아온 가운데 주요 대기업들은 코로나19 여파와 국민연금의 의결권 강화 등으로 주총 불확실성이 최고조에 달하고 있다. 기업들은 코로나19 장기화에 대비해 정기주총 연기나 최소화 방안을 검토하기 시작했고, 스튜어드십코드(기관투자자의 의결권 행사지침)와 자본시장법 개정안 시행에 따른 국민연금의 주주권 강화 움직임에도 바짝 긴장하는 분위기다.
 아울러 올해 주총은 한진그룹의 남매 간 경영권 분쟁이 최대 하이라이트로 부각된 가운데 삼성, 현대차, SK, LG 등 4대 그룹을 중심으로 새 얼굴들이 대거 사내이사 후보로 오르면서 이사회의 세대교체 바람도 뜨거워질 전망이다.
 ■주총 파행 우려…전자투표제 확산 조짐
 1일 재계에 따르면 주요 대기업들이 이달 중순부터 올해 정기주총 랠리를 앞두고 있지만 코로나19 확산세가 지속되면서 정상개최가 불투명해지고 있다. 4대 그룹 관계자는 ""돌발악재인 코로나19가 조기수습이 어려워져 중국 종속회사 결산이나 외부감사 지연으로 재무제표, 감사보고서, 사업보고서 작성 등이 늦어지고 있다""며 ""더욱이 밀집장소에 대규모 인원이 몰리는 주총을 열 경우 감염 우려가 높지만 대안이 마땅치 않다""고 털어놨다. 오는 18일 주총을 개최하는 삼성전자의 경우 주총장을 서울 서초대로 서초사옥이 아닌 2000명 이상 수용 가능한 경기 수원 컨벤션센터로 변경했는데 열화상카메라 설치, 마스크 지급 등 방역 강화에 만반의 준비를 하고 있다.
 실제로 상장사협의회에 따르면 코스피 상장사 15곳이 기한 내 사업보고서 제출 등이 어려워 주총 정상개최가 불투명한 상황이다. 다만 코로나19의 영향으로 3월 주총에서 재무제표 승인 등이 어려울 경우 사유를 금융당국에 입증하면 4월 이후 주총 연기도 가능하다.
 유명무실하던 전자투표제가 올해 주총에선 빛을 발할 것으로도 점쳐졌다. 지난해 국내 상장사의 전자투표 의결권 행사 비율은 5%도 채 안됐다. 올해는 삼성전자, 현대차 등 주요 기업들이 전자투표 도입에 동참한 가운데 기업들이 코로나19로 의결정족수 미달을 우려해 적극적인 홍보에 나서고 있다.
 10대 기업 관계자는 ""주주들에게 주총소집통지서를 보내면서 전자투표 활용법을 별도로 안내하고 있다""며 ""자칫 주총을 열고도 정족수 부족으로 부결되는 파행까지 걱정할 판""이라고 말했다.

 ■한진사태 이목집중, 연금 경영개입 비상
 재계가 올해 정기주총에서 가장 주목하는 이슈는 단연 한진그룹이다. 그룹 지주사인 한진칼의 조원태 회장 사내이사 연임안을 둘러싸고 남매간 대립구도가 강하게 형성되고 있다.
 조 회장의 누나인 조현아 전 대한항공 부사장은 KCGI, 반도건설 등과 3자연합을 맺고 조 회장의 사내이사 연임을 반대하고 있다. 주주명부폐쇄일 기준 조원태 회장 측 지분이 33.45%로 3자연합(31.98%)과 격차가 작아 연임안 처리를 예단할 수 없는 상황이다.
 다만 그룹 내부 여론은 조 회장 연임 쪽으로 무게가 실리는 양상이다. 현재 대한항공, 한진칼, 한국공항 등 한진그룹 계열사 노조와 퇴직임원회 등은 조 회장에게 힘을 보태겠다는 입장이다. 한진 사태를 중심으로 국민연금의 의결권 강화도 올해 정기주총의 최대 관심사다. 국민연금은 스튜어드십코드 도입과 올해 시행된 자본시장법 시행령 개정을 통해 투자기업의 경영에 적극적인 목소리를 낼 것이라는 관측이다.
 특히 자본시장법 시행령이 개정돼 국민연금은 이른바 '5% 룰'(5% 이상 지분 보유 투자자가 적극적 주주활동시 보유목적을 경영권 참여라고 명시) 제약 없이 '일반투자' 목적으로 이사해임이나 정관개정을 요구할 수 있게 됐다. 한국경제연구원 고위관계자는 ""국민연금은 의결권을 보유한 716개사 가운데 40%(273개사) 정도가 주요 주주 지위""라며 ""국민연금 등 주요 기관투자자가 올 주총에서 주주권 강화를 앞세워 특정 사내이사 선임이나 정관변경을 요구할 가능성이 있다""고 봤다.
 ■이사진 대거교체 바람
 올 정기주총은 주요 그룹들의 사내이사 교체가 많은 것도 특징이다. 삼성전자는 이번 주총에서 5명의 사내이사 중 2명이 바뀐다. 이재용 부회장이 지난해 10월 임기만료로 퇴임했고, 노조 와해 의혹으로 구속된 이상훈 이사회 의장이 중도퇴진해 공백을 메워야 한다. 신규 사내이사에는 TV사업을 총괄하는 한종희 사장과 올해 경영지원실장(CFO)에 취임한 최윤호 사장이 나란히 이름을 올렸다.
 현대차는 21년 만에 정몽구 회장이 등기이사에서 퇴진하면서 오는 19일 주총에서 김상현 재경본부장(전무)을 새 사내이사에 선임한다. 김 전무가 선임되면 현대차 사내이사는 정의선 수석부회장과 이원희 사장, 하언태 사장, 알버트 비어만 사장까지 5명으로 구성된다.
 SK는 핵심 전문경영인들인 장동현 ㈜SK사장과 김준 SK이노베이션 총괄사장의 재선임안을 처리한다. LG도 지주사의 살림을 책임진 권영수 부회장 재선임과 LG전자의 새 사령탑인 권봉석 최고경영자(CEO)의 사내이사 선임안이 올라갔다. 한화는 김승연 회장의 장남인 김동관 부사장이 책임경영 차원에서 한화솔루션 사내이사에 오른다.


 ※ 저작권자 ⓒ 파이낸셜뉴스. 무단 전재-재배포 금지",/news/news_read.nhn?article_id=0004381525&office_id=014&mode=search&query=현대차&page=1
'제네바 국제 모터쇼' 공식 취소자동차업계 홍보·출시 등 초비상현대차 전기콘셉트카 공개 연기4세대 쏘렌토 마케팅도 차질예상폭스바겐·BMW 신차 일정 재검토,"[서울경제] 글로벌 완성차 업체들이 올해의 신차와 미래 콘셉트카를 발표하며 힘을 싣는 세계 최대 모터쇼인 ‘제네바 국제 모터쇼’가 신종 코로나바이러스 감염증(코로나19) 확산으로 공식 취소됐다. 디트로이트 모터쇼가 힘이 빠지며 6월로 개최 시기를 옮기면서 최고의 모터쇼로 꼽히는 제네바 모터쇼의 취소는 단순하게 행사 취소로 볼 수 없다. 글로벌 완성차 업체들이 올해 생산, 판매전략을 전면 수정해야 하는 신호탄이다. 코로나19가 완성차 업체의 글로벌 공급망을 무너뜨린 데 이어 수요의 시발점마저 주저앉혔다.1일 자동차 업계에 따르면 제네바 모터쇼 사무국은 지난달 28일(현지시간) “참가자 건강이 가장 중요하다”며 “제90회 제네바 모터쇼를 취소한다”고 발표했다. 제네바 모터쇼 사무국은 코로나19 확산에도 마지막까지 정상 개최를 하기 위해 노력했지만 결국 사전 언론 공개 행사를 사흘 앞두고 전격적으로 행사를 취소했다.제네바 모터쇼는 글로벌 완성차들이 세계 최초로 신차들을 발표(월드 프리미어)하며 위상을 더욱 높여가고 있는 세계 최고 모터쇼 중 하나다. 매해 1월 열리던 디트로이트 모터쇼는 북미 메이커들의 전통적 신차 출시 행사처럼 진행돼 의미가 예년만 못하다는 평가를 받고 있다. 올해부터는 국제가전박람회(CES·1월 개최)와 겹치지 않도록 6월로 개최 시기를 바꿨다.이 때문에 올해 제네바 모터쇼에서는 많은 글로벌 완성차 기업이 신차와 콘셉트카, 미래 비전을 최초로 발표하고 홍보에 나설 예정이었다. 세계 최대 자동차 업체인 폭스바겐은 세계 최초로 8세대 신형 골프 GTI·GTD 모델을 공개한 뒤 하반기부터 전 세계에 출시한다는 계획을 세웠지만 홍보·출시 일정을 다시 잡아야 할 상황이다. 자사의 고성능 브랜드 폭스바겐 R의 첫 번째 하이브리드 모델 투아렉 R도 마찬가지다.BMW도 제네바 모터쇼에 뉴 330e 투어링 등 4종의 플러그인하이브리드차량(PHEV) 모델을 내놓고 그룹 최대 목표인 전기화 비전을 적극적으로 홍보할 계획이었다. 고성능 M 퍼포먼스 모델인 뉴 M340d xDrive 세단과 뉴 M340d xDrive 투어링도 세계 최초 공개할 예정이었지만 모든 일정을 재고하게 됐다. 콤팩트 캠퍼 밴 마르코 폴로의 월드 프리미어 공개를 계획하던 메르세데스벤츠도 같은 상황이다.각각 전기 콘셉트카 프로페시(Prophecy)와 4세대 신형 쏘렌토를 공개할 예정이던 현대·기아차도 난처한 상황에 처했다. 자동차 업계의 한 관계자는 “전기차 본고장인 유럽에서 프로페시를 선보여 전기차 선도 업체로 자리매김하려던 계획이 다소 어그러졌다”며 “출시가 임박한 신형 쏘렌토의 경우 글로벌 홍보에도 영향이 있을 수 있다”고 말했다.코로나 19 확산세가 계속되면 유럽 지역 자동차 판매와 생산도 영향을 받을 가능성도 제기된다. 일본계 글로벌 부품사 덴소와 후지쓰의 스페인 공장은 중국산 부품 공급 부족으로 오는 16일부터 일부 부품 생산라인 가동을 중단할 계획이다. 유지웅 이베스트증권 애널리스트는 “유럽산 전장 핵심부품의 조달이 끊기면 와이어링 하네스 공급 부족보다 파급이 클 수 있다”며 “현대·기아차 유럽 공장도 영향을 받을 가능성을 염두에 둬야 한다”고 말했다.이탈리아를 중심으로 유럽 전체로 코로나19가 확산하면서 판매에도 영향을 줄 우려도 있다. 이항구 산업연구원 선임연구위원은 “세계 자동차 판매가 올해 9,000만대 아래로 떨어질 것으로 보인다”며 “이렇게 되면 현대·기아차도 경쟁력 있는 신차가 줄줄이 나오는 ‘골든 사이클’ 효과를 기대하기 어렵다”고 전망했다./박한신기자 hspark@sedaily.com저작권자 ⓒ 서울경제, 무단 전재 및 재배포 금지",/news/news_read.nhn?article_id=0003702678&office_id=011&mode=search&query=현대차&page=1
"각국 韓입국제한 확대에 출장·영업·R&D교류까지 타격베트남, 韓 다녀온 주재원까지 격리···영업 차질 불가피대구·경북中企 수출박람회 참가 무산 판로개척 '빨간불'中은 전역서 한국發 입국통제···美도 입국제한 배제못해","[서울경제] 국내 신종 코로나바이러스 감염증(코로나19) 감염자가 급격히 늘며 기업들의 해외 비즈니스 활동에도 ‘빨간 불’이 켜졌다. 전 세계에 ‘코리아 포비아’가 확산하며 주요 교류국들이 빗장을 걸어 잠금에 따라 출장은 물론 연구개발(R&D) 교류, 부품 수급 등에도 차질을 빚고 있다. 당장 삼성전자 하노이 R&D센터 기공식이 취소되고 중소기업들의 베트남 진출을 위한 수출박람회도 무기한 연기됐다. 1일 업계에 따르면 해외 주요국들이 국내 출장자들의 입국을 금지하거나 입국 절차를 강화하는 추세가 번지며 국내 기업들은 발만 동동 구르고 있다. 특히 업계에서는 교류가 많은 미국과 베트남에 대해 우려하고 있다. 미국은 지난달 29일(현지시간) 자국 내 첫 코로나19 사망자가 발생한 후 대구 지역을 여행금지를 권고하는 4단계 경보지역으로 특정했다. 현재 다른 지역의 한국발 입국자에 대해서는 검역이나 제한 조치를 취하지 않았지만 자국 확진자 증가세가 계속될 경우 절차 강화에 나설 가능성이 크다. 미국은 삼성전자·LG전자·현대차 등 국내 주요 기업의 최대 시장인 만큼 국내 대기업은 상반기 영업활동 계획에 차질이 생길까 전전긍긍하고 있다. 향후 미국이 대구 방문자 등에 대해 입국절차를 강화한다면 영업활동 등에 차질이 빚어질 가능성도 배제할 수 없다. 업계의 한 관계자는 “출장자가 미국 입국 뒤 격리 조치나 방역강화 등으로 현지에 발이 묶일 가능성을 염두에 두고 출장계획을 미루거나 취소하고 있다”고 우려했다. 이밖에 업계에서는 중국 못지않게 한국 기업들이 많이 진출한 베트남에 대해서도 현지 영업활동 및 생산 타격을 걱정하고 있다. 베트남은 지난달 29일자로 한국발 비행기의 하노이·호찌민 공항 착륙을 불허한 상황이다. 여행객들은 물론 한국 출장을 다녀온 주재원들도 일정 기간 격리를 원칙으로 하며 현지 비즈니스 활동에 직접적인 차질을 빚고 있다. 베트남에는 삼성전자 스마트폰, TV, 생활가전 공장과 LG전자 스마트폰 공장 등이 있다.대구·경북에 위치한 중소기업들은 코리아 포비아의 직격탄을 맞고 있다. 대구의 한 생활용품 업체 임원은 “대구에 바이러스 환자가 집중되기 전에도 예정돼 있던 바이어 방문이 취소돼 당혹스러웠는데 이제는 우리가 밖으로 나가는 것조차 불가능한 상황이 됐다”고 난감해했다. 베트남 수출박람회에 참석할 예정이었던 한 기계제조 업체도 “제품을 보내놓고 입국이 안 된다는 연락을 받았다”고 호소했다. 중국도 한국발 입국자 통제·제한 조치가 사실상 전역으로 확대되고 있다. 베이징과 상하이를 비롯해 동북3성(랴오닝·헤이룽장·지린)과 산둥성 옌타이, 칭다오에 이어 지난 2월27일에는 산시성 시안도 비슷한 조치에 들어갔다. 중국 내 거주지가 없는 출장자가 해당 지역들을 방문할 경우 호텔 등에 강제격리 조치를 당할 수 있어 사실상 출장길이 막힌 상황이다.
한편 기업들은 대구·경북지역을 중심으로 주요 기업의 생산시설 내 확진자 발생 최소화 및 생산차질 방지에 촉각을 곤두세우고 있다. 삼성전자는 지난달 29일 국내 사업장에서 총 3명의 확진자가 발생했다. 경북 구미 스마트폰·네트워크사업부 직원 각 1명씩, 그리고 기흥 반도체사업장의 구내식당 협력사 직원 1명이 확진 판정을 받았다. 삼성전자는 스마트폰사업부 내 확진자가 발생한 직후 방역을 위해 구미2사업장 전체를 1일 오후7시까지 폐쇄했다. 해당 사업장은 지난달 22∼24일에도 첫 확진자가 발생해 폐쇄된 바 있다. 삼성전자는 확진자가 근무한 층은 3일 오전까지 폐쇄한 후 생산을 재개한다. 해당 사업장은 신모델인 ‘갤럭시 Z플립’이 생산되고 있지만 다음주 초 생산재개 시 공급에는 큰 영향이 없을 것으로 보인다. 기흥 반도체사업장도 확진자가 생산직이 아니라 반도체 생산라인을 정상 가동하고 있다. LG도 지난 주말 구미사업장에서 확진자가 2명 발생했다. LG디스플레이는 사업장 내 은행 직원이 지난달 29일 확진 판정을 받아 공장 일부를 폐쇄했고 LG이노텍은 1일 카메라모듈을 생산하는 1A공장 직원 1명이 확진 판정을 받으며 공장 전체를 폐쇄했다. 두 곳 모두 방역 조치 뒤 오는 3일 정상 가동할 예정이다. /변수연·양종곤기자 diver@sedaily.com 저작권자 ⓒ 서울경제, 무단 전재 및 재배포 금지",/news/news_read.nhn?article_id=0003702723&office_id=011&mode=search&query=현대차&page=1
