head,text,url
소니픽처스와 전략적 파트너십‘스파이더맨3’ 등 영화 5편에신차·플라잉카 등장 시키기로,"현대차가 소니 픽처스 엔터테인먼트와 전략적 파트너십을 체결했다. 현대차의 신차와 각종 모빌리티 비전, 다양한 신기술이 소니 픽처스의 영화와 애니메이션, 디지털 콘텐트에 등장하는 것이다. 소니 픽처스가 과거 단발성으로 자동차 회사와 계약을 맺은 적은 있지만, 장기간 여러 매체를 아우르는 폭넓은 파트너십은 이번이 처음이다.


미국 LA 컬버시티에 있는 소니 픽처스 스튜디오에서 열린 협약식엔 현대차 고객경험본부장인 조원홍 부사장, 소니 픽처스 엔터테인먼트 글로벌 파트너십 담당 제프리 갓식 부사장 등이 참석했다고 현대차 측이 28일 밝혔다.


우선 소니 픽처스가 내년 7월 개봉 예정인 영화 ‘언차티드’, 내년 11월 예정인 ‘스파이더맨3’와 애니메이션 ‘스파이더맨: 뉴 유니버스’ 후속작(2022년 10월 예정) 및 향후 두 편의 소니 픽처스 작품에 현대차의 모빌리티 비전과 신차 및 신기술이 등장할 예정이다.


특히 올해 1월 미국 소비자가전쇼(CES)에서 선보인 도심 항공 모빌리티(UAM), 승객의 라이프 스타일에 맞춘 목적 기반 모빌리티(PBV), 미래도시 전역에 산재한 모빌리티 환승 거점(Hub)을 체험할 수 있는 콘텐트를 작품 안에 구현할 방침이다. 현대차의 신개념 모빌리티 솔루션은 UAM과 PBV, Hub가 연결돼 하나의 모빌리티 생태계를 구축하는 것이다.


현대차는 또 소니 픽처스와 함께 차량 내 엔터테인먼트를 강화할 수 있는 다양한 협업 콘텐트를 추진할 예정이다. 현대차는 개인 맞춤형 고객 경험 전략인 ‘스타일 셋 프리’를 준비하고 있다. ‘스타일 셋 프리’는 전기차·자율주행차 시대에 탑승자가 차량 내부에서 운전 외에 다른 활동을 할 수 있게 하는 사용자 경험 콘셉트다.


소니 픽처스의 갓식 부사장은 “이번에 체결한 전략적 파트너십은 진정한 의미의 파트너십이 어떤 것인지를 보여주는 모범 사례가 될 것”이라며 “현대차와 소니 픽처스는 파트너십을 통해 전 세계의 이목을 집중시킬 수 있는 획기적인 콘텐트를 함께 선보일 것”이라고 말했다. 현대차 관계자는 “이번 파트너십 체결을 통해 현대차의 인간 중심 미래 모빌리티 비전을 고객들이 쉽게 이해할 기회가 되길 바란다”며 “앞으로도 고객들에게 현대차만의 미래 모빌리티 비전에 대한 경험과 가치를 알리기 위해 다방면으로 노력할 것”이라고 말했다.


박성우 기자 blast@joongang.co.kr
▶ ▶ ▶ ⓒ중앙일보(https://joongang.co.kr), 무단 전재 및 재배포 금지",/news/news_read.nhn?article_id=0003004745&office_id=025&mode=search&query=현대차&page=3
소니픽처스와 ‘전략적 협업’ 체결… 영화-애니 등에 미래車 기술 담기로,"이르면 내년 11월 개봉하는 영화 ‘스파이더맨3’에는 출연진이 개인용 비행체(PAV)를 타고 빠르게 이동한 뒤 도심 환승거점(HUB)에서 공유형 전동킥보드를 타고 목적지에 도착하는 장면이 들어갈지도 모른다. 현대자동차가 그리는 미래 모빌리티 전략이 영화에 담기는 것이다. 현대차는 소니픽처스엔터테인먼트와 전략적 협업관계를 갖기로 했다고 28일 밝혔다. 현대차가 준비하는 미래 모빌리티 청사진과 신차 기술 관련 내용을 관객이 간접적으로 체험할 수 있도록 소니픽처스의 영화, 애니메이션 등 콘텐츠에 반영한다. 우선 내년에 개봉할 예정인 영화 언차티드와 스파이더맨3를 시작으로 2022년 10월 개봉을 준비 중인 애니메이션 스파이더맨 후속작과 이후 선보일 추가 신작 2편에서도 관련 내용이 담길 예정이다. 이번 협업은 ‘간접광고(PPL)’와는 다르다. 현대차의 상표와 제품을 직접 노출하는 PPL과 달리 현대차의 청사진을 극 중 이야기 전개 과정에 반영해 관객이 자연스레 받아들이도록 하는 것이다. 현대차는 도심항공모빌리티(UAM), 친환경 이동 수단을 활용한 목적기반모빌리티(PBV), 미래 도시 전역에 위치한 모빌리티 환승거점을 하나의 모빌리티 생태계로 묶는 미래 모빌리티 생태계 구축을 추진 중이다. 두 회사는 운전자가 자신의 생활 모습에 맞게 차량의 내장과 부품, 좌석 수 등을 마음대로 고를 수 있는 현대차의 개인 맞춤형 전략 ‘스타일 셋 프리’를 구현하기 위해 차내 인포테인먼트 시스템을 활용한 협업 콘텐츠 제작, 탑재도 추진하기로 했다. 현대차 관계자는 “이번 협업관계 구축을 통해 다양한 콘텐츠로 현대차의 인간 중심 미래 모빌리티 청사진을 고객들이 쉽게 이해할 수 있는 기회가 되기 바란다”고 말했다.서형석 기자 skytree08@donga.comⓒ 동아일보 & donga.com, 무단 전재 및 재배포 금지",/news/news_read.nhn?article_id=0003288904&office_id=020&mode=search&query=현대차&page=3
,"가 내년부터 2년간 최대 9종의 신형 전기차 모델을 국내 출시할 계획인 것으로 28일 확인됐다. 모두 순수 전기차(EV)로, 현대·기아차가 2011년부터 10년간 국내에서 출시해 온 EV 모델 전체 차종 수(7종)보다 많다. 현대차그룹은 2021년을 전기차 도약의 분기점으로 삼겠다는 전략이다.이날 현대차그룹 관계자는 ""내년 5~6종의 신형 전기차를 출시하고 후년에는 전기차 2~3종을 추가할 예정""이라고 밝혔다. 새롭게 선보이는 전기차의 절반 가량은 현대차그룹이 자체 개발한 전기차 전용 플랫폼(차체 틀)을 기반으로 제작한다. 현대차는 내년 1분기 SUV와 세단의 중간 단계인 준중형 크로스오버 차량 전기차 NE(개발코드명)를 먼저 출시할 예정이다. 이어 기존에 볼 수 없던 전기차 전용 후속 모델을 내놓을 것으로 전해졌다.전기차 배터리는 에서 공급한다. 2022년 출시되는 모델 중 하나에는
배터리가 탑재될 예정이다.현대·기아차의 전기차 판매량은 이미 세계 4위 수준이다. 전기차 전문 매체 EV세일즈에 따르면 올해 1분기 현대·기아차의 전기차 판매는 2만4116대로 (8만8400대), (3만9355대)(3만3846대) 다음이다.[안상현 기자 insula@chosun.com] 		▶
		▶ 		▶
	- Copyrights ⓒ 조선일보 & chosun.com, 무단 전재 및 재배포 금지 -",/news/news_read.nhn?article_id=0003534803&office_id=023&mode=search&query=현대차&page=3
,"가 미국에서 보급형 전기차 '모델3'의 가격을 지난 27일(현지 시각) 2000달러(약 250만원) 인하했다. 그러나 한국에서는 가격을 내리지 않아 논란이 일고 있다. '모델3'는 한국에서 팔리는 테슬라의 96%를 차지하는 차종으로, 전 세계에 '테슬라 신드롬'을 일으켰다. 테슬라가 정부 보조금을 받을 수 없는 미국에서는 공격적으로 가격을 낮추면서 보조금이 많은 한국에선 고가 정책을 고수하는 것 아니냐는 비판이 제기되고 있다.				테슬라는 27일 차량 가격을 전반적으로 인하했다. 현재 테슬라 미국 홈페이지에서 모델3의 시작 가격은 3만7990달러(약 4701만원)로 기존가보다 2000달러 낮아졌다. 반면, 국내 테슬라 홈페이지에선 모델3 시작 가격이 5369만원으로 기존과 변동이 없다. 이에 따라 한국 판매가가 미국보다 700만원 가까이 비싸졌다.테슬라는 앞서 국내에서 모델3 가격을 오히려 더 올린 바 있다. 지난해 8월 출시 당시 판매 가격은 5239만원이었지만, 어떠한 예고나 통보도 없이 5369만원으로 130만원 올린 것이다.테슬라는 최근 중국에서도 모델3 가격을 획기적으로 낮췄다. 올 초 중국 정부가 친환경차 보조금 지급 기준을 30만위안(약 5180만원) 이하 차로 한정하자, 32만위안대였던 차 값을 29만위안대로 10% 내렸다.이 같은 테슬라의 가격 정책은 한국의 전기차 보조금을 악용한 한국 소비자 차별이라는 비판이 나온다. 전기차 보급 활성화를 위해 정부가 책정한 보조금을, 기업이 '이익 남기기용'으로 악용한다는 것이다. 한국에선 전기차를 살 때 정부 보조금 800만원과 지자체 보조금(450만~1000만원)까지 최대 1800만원을 받을 수 있다. 이런 혜택 때문에 실제 모델3의 구매자가 지불하는 금액은 서울 기준(보조금 1250만원)으로, 4119만원이다.반면, 미국에서 테슬라는 전기차 보조금을 받지 못한다. 미국 정부는 제조사별로 20만대까지 전기차 보조금(대당 7500달러)을 지원하는데, 테슬라는 2018년 이미 20만대 판매를 돌파해 2019년부터 테슬라 구매자는 보조금을 받지 못하고 있다. 이 때문에 가격은 한국이 미국보다 약 670만원가량 더 비싼데도, 소비자가 실제 지불하는 금액은 약 580만원 더 적다.지난 1분기에 전기차 약 4000대를 국내에서 판매한 테슬라는 한국 전기차 시장을 독식하고 있다. 이런 속도대로 올해 국내에서 1만6000대를 판매한다고 했을 때 최소 2000억원의 보조금 혜택을 누릴 것이란 전망이 나온다.테슬라의 지난 1분기 국내 전기 승용차 시장 점유율은 60%에 달했다. 4월에는 코로나 사태로 미국 공장 가동이 중단되면서 판매량이 5대로 급감했지만, 지난 11일 공장을 다시 돌리기 시작하면서 밀린 주문을 빠르게 소화할 것으로 보인다. 반면, 를 비롯한 국내 완성차 업체들은 올해까지 차세대 전기차 신차를 내놓지 못할 것으로 보인다. 현대차는 내년 전기차 전용 플랫폼을 적용한 신차를 본격 출시한다는 계획이다. 이 때문에 올해 정부가 지급할 전기차 보조금의 절반 정도는 결국 테슬라가 가져갈 것이란 전망이 나온다.이에 대해 테슬라 측은 ""유연한 가격 정책""이라는 입장이다. 테슬라는 전 세계에서 수시로 가격을 인상하거나 인하하고 있다는 것이다. 실제 27일 국내에서도 시작 가격이 1억원이 넘는 모델X와 모델 S 등 고가 모델 차종 가격이 561만원씩 인하됐다. 이번 대규모 가격 인하는 코로나 바이러스 사태로 인한 수요 위축에 대응하기 위한 것으로 풀이된다. 그러나 소비자는 언제, 왜 인하되는지 알 수가 없어 '복불복 구매'를 하는 수밖에 없다는 지적이 나온다.테슬라코리아 측은 ""본사에서 결정하는 사항이라 개별 가격에 대한 이유는 알 수 없다""며 ""테슬라는 딜러마다 가격이 다른 자동차 업체와 달리, 온라인에서 하나의 가격(원 프라이스)을 제시하는 투명한 가격 정책을 실시하고 있다""고 밝혔다. 김필수 대림대 교수는 ""수요·공급 원칙에 맞게 가격 변동은 있을 수 있지만, 지역별로 현격한 차이가 나는 가격은 소비자에게 우롱당한다는 느낌을 줄 수 있다""며 ""전기차 활성화라는 취지로 도입한 보조금을 기업이 이익 챙기기에 악용한다면 이는 신뢰성을 훼손하는 일""이라고 말했다.[류정 기자 well@chosun.com] 		▶
		▶ 		▶
	- Copyrights ⓒ 조선일보 & chosun.com, 무단 전재 및 재배포 금지 -",/news/news_read.nhn?article_id=0003534806&office_id=023&mode=search&query=현대차&page=3
,"내년 말 개봉 예정인 할리우드 영화 ‘스파이더맨3’에 현대차의 개인용 비행체(PAV)가 등장할 전망이다.
현대차는 세계적 엔터테인먼트 그룹 소니 픽처스 엔터테인먼트와 전략적 파트너십을 체결했다고 28일 밝혔다. 미국 로스앤젤레스(LA) 컬버시티의 소니 픽처스 스튜디오에서 열린 협약식에는 현대차 고객경험본부장 조원홍 부사장, 소니 픽처스 엔터테인먼트 글로벌 파트너십 담당 제프리 고드식 부사장 등이 참석했다. 이번 파트너십을 통해 현대차는 영화와 애니메이션, 디지털 콘텐츠 등 소니 픽처스의 다양한 플랫폼을 통해 미래 모빌리티 비전과 신차 등 다양한 신기술들을 선보일 계획이다.

우선 내년 7월 개봉 예정인 영화 ‘언차티드’와 이후 개봉하는 ‘스파이더맨3’를 비롯해 2022년엔 애니메이션 ‘스파이더맨: 뉴 유니버스’ 후속편 외 향후 제작되는 두 편의 소니 픽처스 작품에 현대차의 신기술이 등장하게 된다. 현대차는 지난 1월 CES에서 선보인 PAV를 비롯해 목적 기반 모빌리티(PBV), 모빌리티 환승 거점(Hub) 등 현대차의 미래 비전을 제시한 도심항공 모빌리티(UAM)를 관객들이 간접적으로 경험할 수 있는 콘텐츠를 작품에 구현할 계획이다.
세계적인 팬덤을 보유한 히어로 영화 스파이더맨과 이에 걸맞은 현대차의 교통 신기술을 미디어 콘텐츠와 접목하면서 국내는 물론 해외에도 현대차의 미래 비전을 여실히 보여줄 것으로 기대되고 있다.
이와 더불어 현대차는 전동화 기반의 개인 맞춤형 고객 경험 전략 ‘스타일 셋 프리(STYLE SET FREE)’를 선보이기 위해 소니 픽처스와 함께 차량 내 엔터테인먼트를 강화할 다양한 협업 콘텐츠를 추진할 예정이다.
제프리 고드식 부사장은 “현대차와 소니 픽처스는 파트너십을 통해 전 세계의 이목을 집중시킬 획기적인 콘텐츠를 함께 선보일 것”이라고 밝혔다.
 이정우 기자 woolee@segye.comⓒ 세상을 보는 눈,",/news/news_read.nhn?article_id=0003469770&office_id=022&mode=search&query=현대차&page=3
,"◆ 코로나 상생 경영 ◆
현대자동차그룹은 미래 모빌리티 시대에 선제적으로 대응하기 위해 개방형 혁신을 가속화하고 있다. 국내 다수의 스타트업, 중소·중견기업들과 손잡고 다양한 형태의 미래 모빌리티 서비스를 보편화하고 산업 생태계를 조성하기 위해서다.현대차그룹은 지난해 10월 경기도 화성시에 위치한 현대·기아차 기술연구소에서 미래 모빌리티 협업 생태계 전략의 일환으로 차량 데이터 오픈 플랫폼의 개발자 포털인 '현대 디벨로퍼스(Hyundai Developers)' 출범을 공식화했다. 수백만 대의 커넥티드카와 정비망을 통해 수집된 차량 제원, 상태, 운행 등과 관련된 데이터를 외부에 개방해 스타트업 등이 미래 모빌리티 시대에 맞춘 고객 서비스와 상품을 개발할 수 있는 신규 비즈니스 환경을 만들 수 있도록 했다.현대차는 차량 오픈 데이터 시장의 초기 붐 조성을 위해 마중물 역할을 수행할 대표 협력 스타트업들과 양해각서(MOU)를 체결했다. 현대차와 MOU를 체결한 스타트업은 팀와이퍼, 마카롱팩토리, 오윈, 미스터픽 등 4곳이다. 팀와이퍼는 위치 정보 및 원격 제어를 통한 출장 세차 서비스를 제공하며 마카롱팩토리는 차량 데이터 입력이 자동화된 차계부 서비스를, 오윈은 위치 정보를 활용한 식음료의 픽업(Pick-up) 서비스를, 미스터픽은 차량 데이터로 신뢰도 높은 중고차 평가·거래를 지원하는 서비스를 각각 제공한다.'현대 디벨로퍼스'는 현대차 고객과 스타트업을 비롯한 제3의 서비스 업체를 연결하는 일종의 플랫폼으로, 차량 오픈 데이터를 활용한 다양한 대고객 서비스·상품 개발이 가능하다. 스타트업 등이 제공하는 서비스 가입자 중 현대 커넥티드카 고객은 기존 현대차 계정 연동만으로 다양한 서비스를 받을 수 있다. 고객의 '카 라이프'와 연계한 다양하고 창의적인 애플리케이션을 개발할 수 있는 토대를 구축함으로써 고객의 삶을 보다 풍요롭게 만들고 새로운 가치를 창출하는 것은 물론 국내 소프트웨어 산업 발전에도 크게 기여할 것으로 기대된다.현대차그룹 관계자는 ""모든 데이터 공유의 목적은 고객 가치 제공에 있고, 고객이 동의하는 경우에 한해 데이터를 공유한다""며 ""앞선 두 목적에 부합할 경우에는 데이터 개방에 있어서도 대상을 제한하지 않을 것""이라고 밝혔다.현대차그룹은 올 들어서 기아자동차와 제네시스 차량 데이터를 잇달아 외부에 공개하기로 해 주목을 받고 있다. 지난 4월 기아자동차 차량 데이터 오픈 플랫폼 '기아 디벨로퍼스(KIA Developers)', 5월 제네시스 차량 데이터 오픈 플랫폼 '제네시스 디벨로퍼스(Genesis Developers)'를 연이어 선보였다. 현대차그룹은 현대 디벨로퍼스와 기아 디벨로퍼스, 제네시스 디벨로퍼스를 통해 미래 커넥티드카 시장을 선도해나간다는 계획이다.기아 디벨로퍼스는 기아 커넥티드카로부터 수집한 운행·제원 정보, 주행 거리, 운전 습관 등의 데이터를 애플리케이션 프로그램 인터페이스(API) 형식으로 가공해 개인과 법인사업자에 제공하는 플랫폼이다. 모든 데이터 공유의 목적은 고객 가치 제공에 있고 고객이 동의하는 경우에 한해 데이터를 공유하는 것이 원칙이다.제네시스 디벨로퍼스는 제네시스 커넥티드 서비스를 이용하는 차량으로부터 수집한 운행·제원 정보, 주행 거리, 운전 습관 등의 데이터를 API 형식으로 가공해 개인과 법인사업자에 제공하는 플랫폼이다.[기획취재팀 = 이호승 기자 / 김기정 기자 / 서동철 기자 / 김태성 기자 / 임영신 기자 / 원호섭 기자 / 황순민 기자 / 박윤구 기자 / 임형준 기자 / 최근도 기자] [ⓒ 매일경제 & mk.co.kr, 무단전재 및 재배포 금지]",/news/news_read.nhn?article_id=0004584647&office_id=009&mode=search&query=현대차&page=3
코로나發 경제위기 본격 확산상생협력 통해 경쟁력 유지 총력삼성전자 사내벤처 프로그램 운영현대차 모빌리티 협업생태계 구축SK하이닉스 납품대금 지급 앞당기고LG는 협력사 스마트팩토리 지원,"코로나19 확산으로 실물경제가 위기에 처했다. 한국은행에 따르면 올해 1분기 국내총생산(GDP)은 전 분기 대비 1.4% 하락했다. 금융위기 당시 2008년 4분기에 -3.3%를 기록한 이후 가장 낮은 수준이다. 민간소비는 -6.4%를 기록하며 외환위기 당시인 1998년 1분기(-13.8%) 이후 22년 만에 최저치를 나타냈다. 결국 1분기 수출도 -2.0%로 마이너스로 돌아섰다. 2분기부터 코로나19 충격이 본격적으로 영향을 미치고 있는 만큼 올해 성장률 자체가 마이너스를 기록할지도 모른다는 우려가 커지고 있다.코로나19로 경영환경이 여전히 불확실한 상황 속에서 대·중소기업 간 '상생'이 산업계 화두로 재조명되고 있다. 코로나19 이전에는 4차 산업혁명이라는 파고를 함께 넘기 위해 힘을 합쳤다면 지금은 위기를 기회로 만들기 위해 대기업과 중소기업 간 상생협력을 통해 제조 경쟁력을 유지하는 데 총력을 기울이고 있다. 우리 기업들은 스타트업 지원에서 나아가 협력사 대출 및 교육프로그램 지원, 학자금 대출 등 다방면에서 지원을 아끼지 않으면서 상생경영에 힘쓰고 있다. 삼성전자는 다양한 사내외 프로그램을 통해 스타트업 생태계 확산에 애쓰고 있다. 사내 벤처프로그램 C랩의 독립을 지원해 임직원의 기업가 정신을 키우고 있다. 삼성 임직원들은 사회공헌을 비롯해 자율주행 등 다양한 분야를 주제로 매년 1000개 이상의 아이디어를 제출하고 있으며 현재 33개 과제가 수행 중에 있다. 280개 과제 중 101개는 사내에서 활용됐고, 45개는 회사에서 독립해 나가서 스타트업으로 창업했다. 삼성전자는 이와 함께 국내 유망 스타트업을 지원하는 외부 스타트업 육성 프로그램인 'C랩 아웃사이드'도 운영 중이다. 현대자동차그룹은 국내 다수의 스타트업, 중소·중견기업과 함께 미래 모빌리티 생태계 조성에 적극 나서고 있다. 모빌리티 협업 생태계 전략의 일환으로 차량 데이터 오픈 플랫폼 개발자 포털인 '현대 디벨로퍼스'를 출범시킨 것이 대표적인 사례다. 현대차그룹은 올해 들어 기아자동차와 제네시스 차량 데이터를 잇달아 외부에 공개하기로 하면서 생태계 확장에 앞장서고 있다.
 SK하이닉스는 코로나19로 어려움을 겪고 있는 중소협력사 지원을 위해 다음달부터 월 6000억원에 달하는 중소 협력사에 대한 납품 대금 지급을 월 3회에서 월 4회로 확대한다. 대금 지급 주기가 단축되면 1차 협력사를 비롯해 2~3차 협력사의 자금 회전에도 도움을 줄 수 있기 때문이다. SK건설은 지난 4월 '행복날개협의회 공정거래 협약식'을 맺고 공정거래를 통해 협력사와의 동반성장을 약속했다. LG는 협력사 금융 지원과 스마트 팩토리 구축을 통해 상생에 나서고 있다. LG전자는 2018년부터 국내외 협력사가 생산라인을 자동화하고 정보화 시스템을 구축할 수 있도록 지원하고 있으며 올해는 2차 협력사까지 확대한다는 계획이다. LG화학은 코로나19 확산 장기화로 자금난을 겪고 있는 협력사를 대상으로 1000억원 규모의 상생 펀드 및 혁신성장 펀드 등 금융지원을 조기 집행하기로 했다. 포스코는 스타트업 발굴 육성에 앞장서고 있다. 특히 '포유드림'이라는 프로그램을 통해 5년간 5500명의 청년인재 육성과 취업, 창업 지원에 나선다는 계획이다. 한화그룹은 중소협력사 해외 진출을 도우며 상생 경영을 이어가고 있다. 또한 계열사의 준법경영과 상생경영을 지원하기 위해 컴플라이언스위원회를 출범해 대기업과 중소기업의 상생경영, 기업의 지속가능한 동반성장 기반을 구축하기 위한 자율준수 가이드라인을 만들고 있다. 한화건설은 지난해 동반성장위원회가 발표한 동반성장지수 평가에서 3년 연속 '우수' 기업으로 선정되기도 했다. GS그룹은 업종별로 협력사에 대한 지원을 특화시켜 나가고 있다. GS칼텍스는 협력사와 함께하는 지속가능한 성장을 위해 자금 지원, 기술개발 지원, 교육 및 훈련 등의 다양한 상생 프로그램을 운영하고 있으며 GS건설 또한 환경, 경제, 사회 세 분야로 나눠 분야별로 지속적이고 다양한 경영 활동을 추진 및 실천하고 있다. GS홈쇼핑은 말레이시아, 중국, 태국, 인도네시아 등에 진출한 해외 네트워크를 기반으로 독자적으로 해외 진출이 어려운 중소 협력사에 해외 판로 개척을 돕고 있다.효성그룹은 기술 컨설팅과 설비 개선 지원, 전시회 동반 참가 통한 글로벌 판로 개척 프로그램 등을 통해 협력사와 다양한 상생활동을 펼치고 있다. 협력업체의 품질 개선을 위한 관리 시스템과 스마트 공장 구축 지원을 통해 협력사의 경쟁력을 높일 수 있는 방안도 실행하고 있다. 현대백화점그룹은 공식 온라인몰인 더현대닷컴에서 소셜벤처의 상품을 판매하는 '소셜 임팩트'를 오픈해 소셜벤처와 신진 디자이너의 판로 개척을 도우며 상생을 이어나가고 있다. 이마트는 자체 브랜드(PB) '노브랜드' 매장을 전통시장에 접목한 상생스토어를 통해 주문진 수산시장을 원스톱 쇼핑이 가능한 공간으로 탈바꿈시켜 관광객 쇼핑 편의를 높였다. 롯데쇼핑은 소비심리 악화로 어려움을 겪고 있는 패션 부문 중소기업을 위해 주요 점포에서 상생 나눔 박람회를 열고 있다. 최근 전국 주요 6개점에서 진행한 행사에서는 중소 패션기업의 올해 봄여름 신상품과 최대 80%의 할인율을 자랑하는 이월상품을 주력으로 선보여 약 20억원의 매출을 올리기도 했다. CJ그룹은 인프라스트럭처를 활용해 중소기업 및 스타트업의 성장을 위해 기술·사업모델을 실현하는 '오벤터스'와 제품의 판로 개척, 마케팅 콘텐츠를 지원하는 '오프로덕트어스' 등 다양한 오픈 이노베이션을 진행하고 있다. LS그룹은 특히 주요 계열사별로 협력사에 대한 금융 지원을 하고 있다. LS전선은 하나은행과 200억원씩 출자한 상생협력 펀드를 조성해 협력사를 대상으로 대출을 해주고 있으며 LS일렉트릭도 우리은행과 '상생파트너론'을 조성했다.[기획취재팀 = 이호승 기자 / 김기정 기자 / 서동철 기자 / 김태성 기자 / 임영신 기자 / 원호섭 기자 / 황순민 기자 / 박윤구 기자 / 임형준 기자 / 최근도 기자] [ⓒ 매일경제 & mk.co.kr, 무단전재 및 재배포 금지]",/news/news_read.nhn?article_id=0004584660&office_id=009&mode=search&query=현대차&page=3
