head,text,url
투자의견 '매수'·목표주가 8만원으로 상향,"[아이뉴스24 류은혁 기자] 현대차증권은 29일 LG하우시스에 대해 원자재 가격 하락이 투자 포인트로 꼽힌다면서 투자의견은 '매수'를 유지했고, 목표주가는 6만6천원에서 8만원으로 21.21% 상향 조정했다.LG하우시스는 올해 1분기 매출액 7천240억원, 영업이익 210억원으로 호실적을 기록했다. 성정환 현대차증권 연구원은 ""하반기 건자재 출하량 감소 폭이 축소되고 내년과 내후년 증가 기대감이 커짐에 따라 저유가 시기 원자재 가격 하락이 투자 포인트로 작용할 수 있다""고 설명했다.특히 코로나19 사태로 인테리어, 리모델링 수요가 늘어나면서 수혜가 예상된다는 분석이다. 이 밖에 자동차·소재 사업부 매각도 투자 포인트로 꼽힌다. 구체적 매각 금액은 미정이지만 적자가 지속되는 사업부의 매각이 완료될 경우 실질적 손익 개선 효과가 나타날 것이라는 예상이 나온다.성 연구원은 ""최근 1분기 실적 호조에 힘입어 주가 회복세가 두드러졌으나 여전히 과거 수준에 비하면 낮은 주가 수준""이라며 ""향후 건자재사업부의 견조한 실적 회복과 동반한 추가 밸류에이션 회복이 전망된다""고 강조했다. ehryu@inews24.com [ⓒ 아이뉴스24 무단전재 및 재배포 금지]",/news/news_read.nhn?article_id=0000540520&office_id=031&mode=search&query=현대차&page=2
,"[머니투데이 김태현 기자] 현대차증권은 종근당에 대해 6월 연구개발(R&D) 임상 결과에 주목해야 한다고 설명했다. 투자 의견은 매수, 목표 주가는 11만1000원에서 12만원으로 상향 조정했다.박병국 현대차증권 연구원은 ""주요 R&D 파이프라인인 CKD-702(c-MET/EGFR 이중항체)는 식품의약품안전처로부터 임상 1상이 승인돼 개시가 된 상태""라며 ""전임상 결과는 오는 6월 AACR 학회를 통해 공개될 예정""이라고 설명했다.유럽 2a상이 종료된 CKD-506은 6월 말에 결과보고서가 나오고 하반기에 류마티즘 학회에서 데이터가 공개될 것으로 기대된다.종근당은 1분기 코로나19(COVID-19) 사태에도 탄탄한 본업 역량을 바탕으로 호실적을 기록했다. 개별기준 매출액은 전년동기 대비 25%, 영업이익은 56% 성장했다.박 연구원은 ""회사에서는 연구개발비 단에서 기존 가이던스인 1600억 원을 계획대로 집행하려는 의도를 보이지만 코로나 사태로 인해 연구개발에 차질이 생길 수 있다""며 ""이로 인해 역설적으로 이익이 지속적으로 개선될 여지가 있다""고 전망했다.김태현 기자 thkim124@mt.co.kr
<저작권자 ⓒ '돈이 보이는 리얼타임 뉴스' 머니투데이, 무단전재 및 재배포 금지>",/news/news_read.nhn?article_id=0004416655&office_id=008&mode=search&query=현대차&page=2
,"[아시아경제 유현석 기자] 엘브이엠씨홀딩스가 신종 코로나바이러스감염증에서도 라오스뿐 아니라 미얀마, 캄보디아 등 해외사업이 선전하며 매출과 이익이 동반 성장하는 실적을 올렸다.28일 엘브이엠씨홀딩스의 1분기 실적은 연결기준 매출액 1095억(미화 9164만달러), 영업이익 24억원(미화 198만달러)로 전년 1분기 대비 매출액 58.1%, 영업이익 150.5% 증가했다. 또 매출총이익은 130억원으로 전년동기 대비 100% 증가했다.엘브이엠씨홀딩스는 2015년 5.5.5 전략을 선포하며 인구 7백만의 라오스에 매출이 집중되어 있는 것을 탈피하여 5년 내, 50%이상의 매출을 인근국가의 해외사업에서 달성한다는 목표를 제시했다. 그 동안 베트남, 캄보디아, 미얀마에 자동차 공장을 설립하고 사명을 코라오홀딩스에서 ‘엘브이엠씨홀딩스(LVMC)’로 변경하는 등 노력을 기울인 결과 국가별 고른 성장을 이뤘다.이번 엘브이엠씨홀딩스의 1분기 실적은 이런 효과가 반영되어 해외매출이 421억원으로 전체 매출의 38.7%를 기록했다. 특히 미얀마 시장은 작년 현대자동차 조립공장을 세운 것과 맞물려 1분기에만 952대의 판매대수로 매출이 전년동기대비 373% 성장률을 보였다.미얀마에서 현대차는 작년 하반기부터 시장점유율을 꾸준히 높여 일본의 도요타와 엎치락뒤치락 순위다툼을 하였다. 1분기 실적에서 자동차 등록사업소 통계기준 근소한 차이로 3위에 머물던 현대차가, 3월 기준으로는 391대를 판매하여 현대차 16.1%, 도요타 12.3%로 격차를 벌리며 2위를 하였다. 현재 미얀마 시장의 1위는 5년전 생산공장을 설립하여 구형모델의 저가차량 위주로 판매를 하고 있는 일본의 스즈키(SUZUKI)가 차지하고 있으나, 엘브이엠씨홀딩스의 공격적인 마케팅으로 시장점유율이 계속 하락하고 있는 상태다. 금년부터는 지방 딜러 추가 확대를 추진하고 하반기에 엑센트PE, 크레타 후속모델, H-1(스타렉스) 모델이 런칭됨에 따라 판매는 더욱 가속이 붙을 전망이다.엘브이엠씨홀딩스 주사업장인 인도차이나반도는 국경이 중국과 접하고 있어서 코로나 사태에 대한 우려가 높았으나, 정부의 선제대응으로 인한 사회적 거리두기 및 출입국제한, 공공장소 집합금지 등 다양한 정책들을 조기에 시행하여 코로나를 잠재우는 것에 성공했다. 현재 금일 기준 코로나 확진자는 라오스(인구700만) 19명, 베트남(인구 9,800만) 327명, 캄보디아(인구1,700만) 124명, 미얀마(인구 5,500만) 206명이다.엘브이엠씨홀딩스 관계자는 ""언택트(비대면)문화 확산에 따른 소비성향을 파악하고 기존 오프라인 전국적 유통망을 거점으로 한 온라인 채널을 강화해 고객이 주문시 전국 어디든 직접 차량을 집까지 배송하는 비대면 영업을 강화했다""며 ""애프터서비스는 정비소에 방문하지 않고 온라인 진단을 통한 후 직접 정비사가 찾아가서 서비스를 제공하는 등 타경쟁사와 차별화로 인한 반사이익을 더욱 누리는 효과를 가져왔다""고 말했다.또 국가적 재난을 함께 타개하기 위해 마스크, 열감지 측정기 등 방역물품 기부와 회사 연수원을 재난방지처의 격리조치에 사용할 수 있도록 제공하고, 정부와 함께 사회적 거리두기 홍보활동을 강화하는 등 국민과 함께하는 기업의 사회적 책임을 보여주며 정부와 국민들로부터 더 큰 신뢰와 호응을 불러일으켰다.회사 관계자는 “포스트코로나 시대에 준비해야 할 상황으로 위기와 도전이 기다리고 있지만, 당분간 자국산업에 대한 보호가 강화되고 집회와 이동이 제한되는 상황이 계속될수록 인도차이나반도 내에서 경쟁하는 글로벌 자동차 기업들 중 유일하게 각 국가별 생산 공장과 온오프라인 유통망 및 딜리버리 시스템을 갖춘 엘브이엠씨홀딩스에게는 오히려 기회”라고 말했다.이 관계자는 “더구나 전세계가 코로나 사태로 인해 불확실성이 높아지는 상황에서 상장 후 11년만에 처음으로 실시하는 유상증자를 통한 충분한 자금이 확보됐다""며 ""자본건전성은 물론이고 유동성관리, 온타임 생산체계구축, 안정적인 부품공급을 위한 SCM관리, 전략적 재고 및 판매 인센티브 운영, 장기할부금융 서비스 등 고객편의성을 도모해 시장점유율을 견고히 할 것""이라고 강조했다. 그는 “온라인 거래 플랫폼구축 확대 및 비대면 판매채널 활성화와 토탈솔루션 물류사업 등 미래를 위한 핵심투자 또한 지속하여 인도차이나 반도의 리딩(leading)기업으로서 위치를 공고히 하며 성장을 이어갈 것""이라고 설명했다.유현석 기자 guspower@asiae.co.kr <ⓒ경제를 보는 눈, 세계를 보는 창 아시아경제 무단전재 배포금지>",/news/news_read.nhn?article_id=0004687690&office_id=277&mode=search&query=현대차&page=2
투자의견 매수,"[서울=뉴시스] 김제이 기자 = 현대차증권은 29일 LIG넥스원(079550)에 대해 올해 신규 수주가 2조원이상 달성 가능할 것으로 보인다며 투자의견 매수와 목표주가 4만2000원을 유지했다.LIG넥스원의 올해 1분기 매출은 3522억원, 영업이익 268억원을 기록해 시장전망치(컨센서스)를 웃도는 호실적을 기록했다. 배세진 현대차증권 연구원은 ""컨센서스 상회는 원달러 환율 상승 효과 반영, 원가 절감 노력으로 인해 예정 원가율이 하락했고, 매출 증가에 따른 고정비 부담 감소 때문""이라고 말했다.배 연구원은 ""1분기 수주금액 3700억원 기록해 LIG넥스원의 수주가 연말에 집중되어 있는 특징을 감안할 때 올해 연간 수주는 2조원 이상 기록할 것으로 보이고 연말 수주잔고는 6조 후반대로 전망해 수주잔고 증가로 2021년 이후 실적 성장세가 유효할 것""이라고 분석했다.올해 LIG넥스원의 실적으로 매출 1조6836억원, 영업이익 613억원으로 현대차증권은 예상했다. 내년 매출은 1조8708억원, 영업이익 831억원으로 전망했다. 배 연구원은 ""올해 이후 수익성 개선은 매출 증가에 따른 고정비 부담 감소로 수출비중 증가 때문인 것으로 판단한다""고 덧붙였다. jey@newsis.com<ⓒ 공감언론 뉴시스통신사. 무단전재-재배포 금지>",/news/news_read.nhn?article_id=0009887219&office_id=003&mode=search&query=현대차&page=2
,"[아이뉴스24 한수연 기자] 현대차증권은 29일 유한양행에 대해 올해 1분기에는 코로나19 여파로 실적이 역성장했지만, 하반기 레이저티닙과 얀센 이중항체 병용 파이프라인에 대한 단기 모멘텀으로 개선이 기대된다며 목표주가를 기존 5만5천원에서 6만원으로 상향했다. 투자의견은 '매수'를 유지했다.유한양행의 올해 1분기 매출액은 전년 동기 대비 9% 감소한 3천133억원, 영업이익은 82% 급감한 11억원을 기록했다.박병국 현대차증권 애널리스트는 ""코로나19로 1분기 연결기준 매출액은 전년 동기보다 9% 줄고 영업이익은 82% 급감했다""면서도 ""그러나 하반기에 개시될 가능성이 큰 레이저티닙과 얀센 이중항체의 병용 2/3상 디자인에 주목해야 한다""고 짚었다.박 애널리스트는 ""지난 13일 공개된 ASCO 초록 데이터를 통해 레이저티닙은 3세대 TKi로서의 가능성을 다시 한 번 확인했다""며 ""공개된 데이터는 주로 T790M 변이가 일어난 환자에 2차 치료제 목적으로 투약됐으며 레이저티닙 240mg은 EGFR 변이 비소세포폐암 시장을 주도하고 있는 타그리소(80mg)의 AURA 2상 pooled data와 유사한 데이터를 보이며 '단독' 가능성을 보였다""고 설명했다.이어 ""이달 말 포스터에서 공개될 가능성이 있는 160mg, 240mg 용량에서의 데이터를 주목해야 하고, 1차 치료제 목적으로 하는 글로벌 3상 단독 요법에서 160mg, 240mg도 임상을 진행하고 있다""며 ""특히 비임상 독성시험을 완료한 YH-25724의 임상개시 시점은 이르면 하반기가 될 가능성이 있고, 그에 따른 1000만 달러 규모의 마일스톤 수령도 바라볼 수 있다""고 기대했다. papyrus@inews24.com [ⓒ 아이뉴스24 무단전재 및 재배포 금지]",/news/news_read.nhn?article_id=0000540526&office_id=031&mode=search&query=현대차&page=2
,"[이데일리 전재욱 기자] 현대차증권(001500)은 29일 종근당(185750)의 목표주가를 이전 11만1000원에서 12만원으로 8.1%(9000원) 올려 제시했다. 투자의견도 매수를 유지했다.박병국 현대차증권 연구원은 보고서에서 “종근당 1분기 실적은 개별기준 매출액 연간 25%, 영업이익 연간 56% 성장하며 코로나 영향이 없는 것을 확인했다”며 이같이 권유했다.박 연구원은 “1분기 실적은 개별기준 매출액 2,928억 원(연간 25%), 영업이익 261억 원(연간 56%)를 기록해 코로나 19 사태에도 불구하고 탄탄한 본업 역량을 보였다”고 평가했다.그는 “영업이익에서 큰 폭의 성장을 견인한 원인은 작년에 신규 도입한 케이캡이 130억 원의 매출을 달성한 것이 컸다”고 설명했다. 이어 “연간 가이던스가 1600억 원이던 연구개발비 중 1분기에 300억 원 사용에 그치면서 판관비 절감이 주요했다”고 밝혔다.박 연구원은 “다만 매년 증가하는 상품 매출의 비중으로 1분기 매출원가율은 64.5%를 기록했다”며 “2분기에는 1분기에 활용하지 못한 연구개발비 활용이 확대될 것으로 전망되며 이로써 영업이익은 200억 수준(분기 대비 -23%)을 달성할 것”이라고 전망했다.그는 “주요 R&D 파이프라인인 CKD-702(c-MET/EGFR 이중항체)는 식약처로부터 임상 1상이 승인돼 개시된 상태이며, 전임상 결과는 오는 6월 AACR 학회를 통해 공개될 예정”이라고 전했다. 이어 “유럽 2a상이 종료된 CKD-506은 6월 말에 결과보고서가 나오고 하반기에 류마티즘 학회에서 데이터가 공개될 전망”이라고 기대했다.그는 “회사에서는 연구개발비 단에서 기존 가이던스인 1600억 원을 계획대로 집행하려는 의도를 보이지만 코로나 사태로 연구개발에 차질이 생길 수 있다”고 했다. 이어 “역설적으로 이익이 지속적으로 개선될 여지가 존재한다”며 “결국 제약 및 바이오 기업의 주가를 움직이는 것은 R&D 성과이며, CKD-702와 CKD-506의 결과가 주목된다”고 덧붙였다.전재욱 (imfew@edaily.co.kr)＜ⓒ종합 경제정보 미디어 이데일리 - 무단전재 & 재배포 금지＞",/news/news_read.nhn?article_id=0004651324&office_id=018&mode=search&query=현대차&page=2
,"[이데일리 문승관 기자] 현대차증권은 29일 동부건설(005960)에 대해 회생절차 종료 후 수주한 현장 공정이 양호한 마진율을 나타내면서 본격적으로 진행됐다며 앞으로도 안정적인 이익 개선을 기대한다고 밝혔다. 이에 따라 목표주가를 기존 1만1000원에서 1만2000원으로 상향 조정했다. 투자의견은 ‘매수’를 유지했다.성정환 현대차증권 연구원은 “동부건설의 1분기 연결 매출액은 지난해보다 44% 증가한 3020억원을, 영업이익은 522% 늘어난 170억원 기록해 호실적을 나타냈다”며 “지난해보다 실적이 큰 폭으로 개선한 주요 원인은 별도의 원가율 개선으로 풀이된다”고 말했다.지난해 1분기 6.8%에 불과했던 별도 원가율은 올해 1분기 9.7%까지 큰 폭으로 상승했다. 마진율이 지나치게 낮았던 주택·토목 현장이 종료되고 회생절차 종료 후 수주한 양호한 마진율의 현장 공정이 본격적으로 진행됐기 때문으로 분석했다.성 연구원은 “현재 투자자와 소통이 부족한 것은 아쉬운 요소이나 이익 창출력 면에서는 견고한 모습을 보이고 있다”며 “현재 주가가 낮아 밸류에이션 매력이 존재하고 있다”고 설명했다.이어 “앞으로도 회생절차 종료 후 수주한 주택 현장 분양과 착공이 이어지겠다”며 “별도 매출에서 차지하는 주택 매출의 비중이 증가하면서 복합적인 마진 개선과 점진적인 이익률 상승, 장기 이익 증가로 이어질 것으로 판단한다”고 언급했다.지난해 주당 배당금(DPS) 700원 수준의 배당을 했으나 배당 정책 관련 투자자와의 소통 부족으로 올해 DPS는 300원이 될 것으로 가정했다.성 연구원은 “최근 양호한 분기 실적에 힘입어 주가는 상승 추세를 이어나갈 것”이라며 “앞으로도 꾸준한 이익 증가를 확인하면서 추가 상승을 예상한다”고 말했다.이에 따라 이익 추정치를 상향 조정하고 목표 주당순자산가치(BPS)의 기준을 올해 연말 변경할 것으로 고려해 목표주가를 올렸다고 설명했다.문승관 (ms7306@edaily.co.kr)＜ⓒ종합 경제정보 미디어 이데일리 - 무단전재 & 재배포 금지＞",/news/news_read.nhn?article_id=0004651337&office_id=018&mode=search&query=현대차&page=2
,"현대차 정몽구 재단과 세종문화회관은 28일에 세종문화회관에서 양 기관 관계자들이 참석한 가운데 문화예술 사업 활성화 위한 업무협약을 체결했다.이번 협약을 통해 양 기관은 시민 문화향유 기회 확대를 위한 문화예술 협력 사업을 공동으로 추진한다. 우선 두 기관은 28일 세종문화회관 M씨어터에서 명인 김덕수의 일대기를 다룬 음악극 <김덕수전傳>을 공동주최했고, 29일에는 네이버 V라이브를 통해서 오후 7시 30분부터 생중계될 예정이다. 본 공연은 사물놀이 창시자인 김덕수의 무대인생 63주년을 맞아 제작한 음악극으로, 제작총괄/극본의 한국예술종합학교 이동연 교수, 연출가 박근형이 제작진으로 참여했다. 특히, 이번 공연은 현대차 정몽구 재단이 추구하는 '일상 속 문화 확산' 목적의 사회공헌 사업인 '예술세상 마을 프로젝트'와 연계하여, 사전에 예매한 관객에게 전석 무료로 제공되었다.앞으로도 두 기관은 문화예술 인재 양성 사업에 협력, 문화예술 활성화를 위한 다양한 콘텐츠를 공동으로 주최하고, 세종문화회관의 공간을 활용한 활발한 교류 사업을 추진할 계획이다.현대차 정몽구 재단 권오규 이사장은 ""현대차 정몽구 재단은 문화예술 활성화와 나눔정신 확산을 통해 문화 생태계를 발전시켜 대국민 문화향유에 앞장서도록 세종문화회관과 함께 최선을 다하겠다.""라고 밝혔으며, 세종문화회관 김성규 사장은 ""현대차 정몽구 재단과의 업무협약을 계기로 양 기관이 가지고 있는 다양한 역량을 모아 예술가와 시민이 보다 행복할 수 있는 문화예술 사업에 지속 협력해나가겠다.""고 말했다.이정혁 기자 jjangga@sportschosun.com- Copyrightsⓒ , 무단 전재 및 재배포 금지",/news/news_read.nhn?article_id=0003575666&office_id=076&mode=search&query=현대차&page=2
,"[서울=뉴시스] 이종희 기자 = 현대차 정몽구 재단과 세종문화회관은 28일에 세종문화회관에서 양 기관 관계자들이 참석한 가운데 문화예술 사업 활성화 위한 업무협약을 체결했다고 29일 밝혔다. 이번 협약을 통해 양 기관은 시민 문화향유 기회 확대를 위한 문화예술 협력 사업을 공동으로 추진한다. 우선 두 기관은 28일 세종문화회관 M씨어터에서 명인 김덕수의 일대기를 다룬 음악극 '김덕수전傳'을 공동주최했고, 29일에는 네이버 V라이브를 통해서 오후 7시30분부터 생중계될 예정이다. 본 공연은 사물놀이 창시자인 김덕수의 무대인생 63주년을 맞아 제작한 음악극으로, 제작총괄·극본의 한국예술종합학교 이동연 교수, 연출가 박근형이 제작진으로 참여했다. 이번 공연은 현대차 정몽구 재단이 추구하는 '일상 속 문화 확산' 목적의 사회공헌 사업인 '예술세상 마을 프로젝트'와 연계해 사전에 예매한 관객에게 전석 무료로 제공됐다.앞으로도 두 기관은 문화예술 인재 양성 사업에 협력, 문화예술 활성화를 위한 다양한 콘텐츠를 공동으로 주최하고, 세종문화회관의 공간을 활용한 활발한 교류 사업을 추진할 계획이다.권오규 현대차 정몽구 재단 이사장은 ""현대차 정몽구 재단은 문화예술 활성화와 나눔정신 확산을 통해 문화 생태계를 발전시켜 대국민 문화향유에 앞장서도록 세종문화회관과 함께 최선을 다하겠다""고 말했다. 김성규 세종문화회관 사장은 ""현대차 정몽구 재단과의 업무협약을 계기로 양 기관이 가지고 있는 다양한 역량을 모아 예술가와 시민이 보다 행복할 수 있는 문화예술 사업에 지속 협력해나가겠다""고 말했다. 2papers@newsis.com<ⓒ 공감언론 뉴시스통신사. 무단전재-재배포 금지>",/news/news_read.nhn?article_id=0009887321&office_id=003&mode=search&query=현대차&page=2
,"[아시아경제 우수연 기자]현대차 정몽구 재단과 세종문화회관이 시민들이 누릴 수 있는 문화 예술의 저변을 확대하기 위해 맞손을 잡았다.현대차 정몽구 재단은 지난 28일 세종문화회관에서 문화 예술 사업 활성화를 위한 업무 협약을 체결했다고 29일 밝혔다. 이번 협약을 통해 양 기관은 시민들이 문화예술 공연을 접할 기회를 늘리기 위한 협력사업을 공동으로 추진한다.우선 지난 28일 세종문화회관 M씨어터에서 명인 김덕수의 일대기를 다룬 음악극 '김덕수전(傳)'을 공동 주최했고, 이날 오후 7시30분부터 네이버 V라이브를 통해 해당 음악극을 중계할 예정이다.본 공연은 사물놀이 창시자인 김덕수의 무대인생 63주년을 맞아 제작한 음악극으로 이동연 한국예술종합학교 교수가 제작총괄 및 극본을 맡았으며 박근형 연출가가 제작진으로 참여했다. 특히 이번 공연은 현대차 정몽구 재단이 추구하는 '일상 속 문화 확산' 목적의 사회공헌 사업인 예술세상 마을 프로젝트와 연계해 사전에 예매한 관객에게 전석 무료로 제공되었다.앞으로도 두 기관은 문화예술 인재 양성 사업에 협력, 문화예술 활성화를 위한 다양한 콘텐츠를 공동으로 주최하고, 세종문화회관의 공간을 활용한 활발한 교류 사업을 추진할 계획이다.권오규 현대차 정몽구 재단 이사장은 ""현대차 정몽구 재단은 문화예술 활성화와 나눔정신 확산을 통해 문화 생태계를 발전시켜 대국민 문화향유에 앞장서도록 세종문화회관과 함께 최선을 다하겠다""고 말했다.김성규 세종문화회관 사장도 ""현대차 정몽구 재단과의 업무협약을 계기로 양 기관이 가지고 있는 다양한 역량을 모아 예술가와 시민이 보다 행복할 수 있는 문화예술 사업에 지속 협력해나가겠다""고 화답했다.우수연 기자 yesim@asiae.co.kr <ⓒ경제를 보는 눈, 세계를 보는 창 아시아경제 무단전재 배포금지>",/news/news_read.nhn?article_id=0004687766&office_id=277&mode=search&query=현대차&page=2
,"[머니투데이 조준영 기자] 현대차증권이 29일 한국가스공사에 대해 장기적인 저점을 확인했지만 불확실성이 확인되는 손상차손 인식 이후에 매수해도 늦지 않을 것으로 판단된다고 밝혔다. 이에 투자의견 '매수', 목표주가 3만7000원을 제시했다.강동진 현대차증권 연구원은 ""주요 광구 영업이익 합산 영업이익은 535억원으로 전년 862억원 대비 대폭 감소했다""며 ""동사는 장기유가 전망이 변경될 경우 GLNG 등 프로젝트에 대한 재평가를 실시한다. 최근 장기유가전망이 크게 하락하고 있는 것을 감안하면 향후 평가손실이 발생할 가능성이 높고 이는 배당에 부정적이 영향을 미친다""고 설명했다.강 연구원은 ""장기적으로는 수소경제 핵심주체로 각광받게 될 전망이나 아직은 이른 단계""라며 ""최근 미국 가스가격 상승 가능성이 높아졌고 아시아 장기계약 가격 대비 경쟁력이 낮아질 것으로 전망돼 직도입과 관련된 우려는 점차 낮아질 것""이라고 밝혔다.조준영 기자 cho@mt.co.kr
<저작권자 ⓒ '돈이 보이는 리얼타임 뉴스' 머니투데이, 무단전재 및 재배포 금지>",/news/news_read.nhn?article_id=0004416694&office_id=008&mode=search&query=현대차&page=2
