head,text,url
"현대·기아차 이어 삼성전자도 슬로바키아 공장 23일부터 가동 중단반도체·가전·자동차·배터리 업종 매출 타격… ""가까스로 버틴다""","(서울=뉴스1) 류정민 기자,권구용 기자 = 신종 코로나바이러스 감염증(코로나19)이 유럽과 미주에서 빠르게 확산하면서 한국 기업들의 공장 셧다운도 속출할 것으로 예상된다.이탈리아, 스페인, 독일, 프랑스 등 서유럽 국가들에 이어 미국의 확진자 수가 빠르게 늘어나고 있고, 동유럽 국가들의 확진자 수도 대부분 세자릿수를 넘고 있다.미국과 유럽은 반도체, 가전, 자동차, 배터리 등 한국의 주력 수출 업종 공장이 자리한 지역이어서 한국 산업 전반에 심각한 타격이 예상된다.22일 세계보건기구(WHO)에 따르면 20일 0시(스위스 현지시간) 집계 기준 전 세계 누적 확진자는 전날 대비 2만4247명이 증가한 23만4073명에 달했다. 신규 확진자 수 2만4247명은 전날 집계된 신규 확진자 1만6556명보다 46.4%나 늘어난 것으로 코로나19의 확산세는 날로 커지고 있다. 누적 사망자는 전날보다 1061명이 증가한 9840명에 달했다.코로나19는 특히 유럽과 미국에서 들불처럼 빠르게 퍼지고 있다. 유럽에서만 신규 확진자의 72%에 달하는 1만7506명의 확진자가 추가됐고, 누적 사망자도 전체의 49.8%인 4899명에 달했다. 미국은 하루 사이 이탈리아, 스페인 다음으로 많은 3355명의 확진자가 새로 발생, 누적 확진자가 1만명을 넘어선 1만442명으로 집계됐다. 캐나다는 167명 늘어난 736명, 브라질은 137명 늘어난 428명이다.유럽과 미국에서의 코로나19 확산으로 한국 기업들의 생산차질은 이미 현실이 되고 있다.이미 현대자동차가 18일(현지시간) 확진자 1명이 발생한 미국 앨라배마 공장에 이어, 앨라배마에서 엔진을 공급받는 기아차가 조지아 공장을 19일(현지시간)부터 가동을 중단했다. 또 현대차 체코공장과 기아차 슬로바키아 공장도 23일(현지시간)부터 2주간 문을 닫는다. 현대기아차는 유럽에서는 이번에 가동을 중단한 체코, 슬로바키아 외에 터키(현대차)와 러시아(현대차)에 생산법인을 두고 있다. 또 브라질(현대차)에서도 생산공장을 가동한다.삼성전자도 23일(현지시간)부터 1주일간 TV와 모니터를 생산하는 슬로바키아 공장의 가동을 중단한다. 삼성전자는 헝가리에도 TV 생산공장을 두고 있고, 폴란드에는 냉장고 등 가전공장을 가동하고 있다. 미국에는 샌디에이고에 TV 생산공장을, 오스틴에 반도체, 사우스캐롤라이나에 가전 공장을 운영하고 있다. 삼성전자는 멕시코에 TV공장을, 브라질에서는 TV와 스마트폰 공장을 각각 운영하고 있다.기업들이 현지 생산법인의 판단을 존중하고 있는 만큼 앞으로 가동 중단은 속출할 예정이다. 삼성전자 관계자는 ""현재 가동 중단을 결정한 슬로바키아 외에 폴란드 가전공장과 헝가리 TV 공장은 정상 운영하며, 미국 반도체와 가전공장도 정상적으로 가동하고 있다""며 ""23일부터 가동을 중단하기로 한 슬로바키아의 경우 현지에서 그만큼 분위기가 심각하다고 판단한 때문""이라고 설명했다.LG전자는 폴란드에 가전생산 공장을 두고 있다. 미국에서는 테네시에 세탁기 공장을, 앨라배마와 헌츠빌에서는 태양광 모듈 생산 공장을 운영한다. LG전자 관계자는 ""유럽과 미국에서는 아직 생산중단은 없다. 생산 차질이 발생하지 않도록 최선을 다하는 중""이라고 말했다.삼성, 현대차, LG 등 한국 주요 기업들의 매출에도 적잖은 타격이 예상된다. 금융감독원 전자공시에 따르면 지난해 삼성전자의 매출 230조원 중 유럽은 미주가 73조8000억원으로 32.0%, 유럽은 42조7000억원으로 18.5%를 차지하는 등 두 지역 매출 비중이 전체의 50.5%에 달했다. 현대차는 지난해 105조7000억원의 매출 중 북미가 35조9000억원, 유럽은 18조7000억원으로 두 지역의 매출 비중이 절반이 넘는 51.7%를 차지했다.LG전자는 지난해 61조8370억원의 매출 중 북미가 23.4%인 14조9889억원을 차지했고, 유럽은 14%인 8조6827억원에 달했다.LG화학, 삼성SDI, SK이노베이션 등 전기차 배터리 업체들도 코로나19로 생산차질을 우려하고 있다.LG화학은 미국 미시간과 폴란드, 삼성SDI는 미국과 헝가리 오스트리아에, SK이노베이션은 헝가리에서 전기차용 배터리 셀 생산 공장을 운영하지만 미국과 유럽의 완성차 업체들이 줄줄이 공장을 폐쇄하면서 공장가동 중단이 예상된다. 외신 등에 따르면 폭스바겐이 오는 23일(현지시간)부터 2~3주간 독일을 포함해 유럽 내 모든 생산을 중단하는 것을 비롯해 BMW, 메르세데스-벤츠, 르노, 푸조, 피아트 등이 업체별로 짧게는 2주, 길게는 무기한 공장 간동을 중단한다.미국에서는 제너럴모터스(GM), 포드, FCA 등 '빅3' 자동차 회사가 북미 지역의 공장을 일시적으로 폐쇄한다. 포드는 지난 19일(현지시간) 저녁부터 30일까지 미국과 멕시코, 캐나다 공장 가동을 중단한다. GM도 최소한 30일까지 모든 북미 공장 문을 닫는다. FCA도 미국공장을 폐쇄할 것으로 전해졌다.LG화학 관계자는 ""코로나로 인해 각국의 국가지침이 강화되면서 감염 확산을 막기 위해 임직원 출장 금지를 강화하고 있다""며 ""미국과 폴란드의 경우 정상 가동 중으로 미국 공장의 경우 물류에 차질이 없어 영향은 제한적이지만 만일의 사태에 대비해 상황을 예의주시하고 있다""고 밝혔다.SK이노베이션 관계자는 ""상황이 어렵지만, 공장이 셧다운 되지 않도록 최선을 다하고 있다""고 말했다.ryupd01@new1.kr© 뉴스1코리아(), 무단 전재 및 재배포 금지",/news/news_read.nhn?article_id=0004535693&office_id=421&mode=search&query=현대차&page=3
"지배구조·이해상충 방지 부족 문제점""하나의 참고자료…최종 책임은 기관""인력 부족, 낮은 단가…저품질 양산돼","[서울=뉴시스] 류병화 기자 = 의결권자문사들이 상장사들의 슈퍼 주주총회 위크를 맞아 다수의 의결권 행사 리포트를 내고 있는 가운데 보고서의 공정성과 품질을 놓고 다양한 지적이 나오고 있다.의결권자문사의 지배구조나 이해상충 방지 체계 부족에 따라 리포트 신뢰도가 떨어진다는 의견이 있는 반면 자문사의 권고는 하나의 참고자료로, 최종적인 책임은 기관투자자에 있다는 주장도 제기된다.22일 한국예탁결제원에 따르면 12월 결산 상장법인 2302개사 가운데 3월 넷째 주에 정기주총을 개최하는 회사는 1523곳에 달한다. 시장별로는 유가증권시장에서 한진칼, 네이버 등 484개사, 코스닥시장에서 셀트리온헬스케어 등 966개사 등이다. 넷째주 주주총회가 몰리는 '슈퍼 주총데이'는 24일(356개사), 27일(670개사)이다.상장사 '슈퍼 주총 위크'를 맞으면서 치열한 표싸움이 예상되는 상장사의 경우 의결권자문사의 권고에 관심이 몰리고 있다. 의결권자문사는 주주총회에서 논의될 안건을 분석해 기관투자자에 수수료를 받고 의사 결정을 내리도록 찬성, 반대를 권고하는 컨설팅 회사다.현재 국내에서는 기업지배구조원, 대신지배구조연구소, 서스틴베스트 등과 외국계인 ISS, 글래스루이스 등이 의결권자문사로 활동하고 있다. 전체 상장사 가운데 의결권자문사의 보고서가 작성되는 곳은 약 600곳으로 추산된다. 문제는 이들 의결권자문사의 권고안이 얼마나 공정성과 품질을 담보하고 있는지다. 자문사들은 각기 다른 내규로 상장사와 이해상충 문제를 해결하고 있다. 이해상충 문제를 명확히 해결하지 않을 경우 상장사로부터 찬성 의견을 권고해달라는 '딜'이 발생할 수 있다.또 의결권자문사의 지배구조상 공정한 의안 분석으로 평가받기 어려운 측면도 있다. 기업지배구조원은 거래소 등 유관기관의 공동 출자로 설립됐으며 대신지배구조연구소는 대신증권이 출자해 만들어졌다.앞서 의결권자문사들의 한진칼 의안분석 보고서를 놓고 조원태 한진그룹 회장과 '3자 주주연합'이 공방에 나서기도 했다. 자문사간에 조원태 한진그룹 회장의 한진칼 사내이사 선임에 대한 찬반이 엇갈리자 양측은 자신들의 입장과 상반된 분석을 내놓은 의결권자문사에 신뢰할 수 없다고 주장했다.조현아 전 대한항공 부사장이 포함된 3자 주주연합은 조원태 회장, 하은용 대한항공 재무부문 부사장의 사내이사 선임안을 찬성한 의결권자문사들의 신뢰성에 문제가 있다고 지적했다.반면 한진그룹은 조 회장의 사내이사 연임안을 기업가치 훼손 이력을 이유로 '반대'를 권고한 국내 의결권자문사 서스틴베스트에 ""명확히 3자 주주연합 쪽으로 기울어진 일방적 결정을 내리고 있어 신뢰하기 어렵다""고 평가했다.의결권자문사의 적은 인력과 업계의 낮은 수수료 단가로 인한 보고서의 품질 문제도 문제로 여겨진다. 국민연금은 한국기업지배구조원과 오는 11월까지 약 1억원 규모의 정기주총 의안분석 자문 계약을 맺었다. 기업지배구조원은 약 600여곳의 분석을 맡아야 할 예정이다. 산술적으로 건당 16만원 수준에 불과하다. 운용사들도 비슷한 수준을 수수료로 지급하고 보고서를 제공받는 것으로 알려졌다.의결권자문사의 의안 분석 인력도 부족한 형편이다. 기업지배구조원은 전체 40여명 인력 가운데 1차 의안 분석 리포트를 작성하는 인원은 10명 남짓에 불과하다. 서스틴베스트도 비슷한 규모로 알려졌으며 대신지배구조연구소도 전산, 백업 등 인력을 모두 포함해 27명가량이 근무하고 있다. 주총 시즌을 맞아 바쁘게 리포트를 내게 돼 '졸속 작성'을 하게 될 우려가 나온다.일각에서는 증권사 리포트에 따라 투자를 하더라도 최종 책임은 투자자에 있는 것과 같이 의결권자문사의 리포트는 권고에 불과하다는 반박도 있다. 의결권 행사의 최종적인 책임은 기관에 있어 품질이나 공정성 문제를 의결권자문사에만 떠안게 하기 어렵다는 것이다.한 의결권자문사 관계자는 ""삼성물산과 제일모직의 합병, 현대차와 엘리엇 등으로 의결권 자문업에 대한 관심이 커지기 시작했지만 업력이 그리 길지 않아 이제 태동기""라며 ""기관투자자들이 점차 리포트를 분석하는 눈이 높아지게 되면 싼 단가만으로 업력을 유지하는 곳들이 점차 정화될 수 있을 것으로 본다""고 전했다. hwahwa@newsis.com<ⓒ 공감언론 뉴시스통신사. 무단전재-재배포 금지>",/news/news_read.nhn?article_id=0009769693&office_id=003&mode=search&query=현대차&page=3
글로벌 판매 계획 수정 '불가피'…1분기 이어 2분기도 실적 타격 전망,"현대·기아자동차가 신종 코로나 바이러스 감염증(코로나19) 영향으로 미국과 유럽 공장 가동을 잇달아 중단하면서 올해 상반기 해외 판매에 제동이 걸릴 것으로 보인다.부진했던 중국 시장 대신 판매가 양호한 미국과 유럽 시장에 공을 들여왔던 양사는 공장 가동률 하락으로 올해 글로벌 판매 계획 수정은 물론, 실적 악화도 불가피할 것으로 예상된다.22일 업계에 따르면 현대·기아차는 23일부터 내달 3일까지 2주간 현대차 체코 공장과 기아차 슬로바키아 공장 가동을 중단한다. 유럽 지역 자동차업체들이 줄줄이 가동 중단에 들어가면서 현대·기아차도 유럽 공장 문을 닫기로 한 것이다.이들 공장에는 확진자 발생 등 문제가 불거지진 않았으나 체코와 슬로바키아 정부의 코로나19 확산 방지 정책 동참과 직원들의 안전, 국경 폐쇄로 인한 물류 영향 등을 고려한 결정이라고 회사측은 설명했다.현대·기아차는 앞서 현대차 앨라바마 공장과 기아차 조지아 공장을 주말인 22일까지 닫기로 했으며 재개 시점은 미정이라고 밝힌 바 있다.앨라배마 공장은 직원 1명이 코로나19 양성반응을 보여 18일(현지시간) 가동을 중단했다. 앨라배마 공장에서 엔진을 공급받는 조지아 공장도 19일부터 가동을 멈췄다.이처럼 주요 시장인 미국·유럽 지역 판매에 모두 제동이 걸리면서 양사의 사업계획 조정이 불가피할 전망이다. 지난해 현대차는 전체 판매량 중 미국과 유럽 판매 비중이 33.0%였고, 기아차도 두 지역 비중이 40.9%로 적지 않은 수준이다.두 지역에 대한 양사의 매출 의존도가 상당한 만큼 코로나19 여파로 올해 상반기 동안 악영향이 예상된다. 특히 유럽은 다른 완성차들이 잇달아 무기한 중단을 발표하면서 생산재개 시점이 늦춰질 가능성이 있다.현대·기아차는 아반떼, 쏘렌토 등 올해 주력 모델들이 풀체인지(완전변경)되는 신차 사이클에 힘입어 글로벌 판매량을 늘리겠다는 목표를 세웠으나 코로나19 확산으로 생산 자체를 걱정하는 상황이 됐다.지난해 마이너스 성장이었던 중국 시장 역시 올해에도 턴어라운드를 기대하기 힘들고, 그 외 신흥국도 코로나19에 따른 수요 악화가 예상된다.이러한 불확실성이 가중되면서 양사의 1분기 실적도 하향 조정됐다. 현대차의 1분기 연결 기준 영업이익 평균 컨센서스(추정치)는 전년 동기 대비 12.3% 증가한 9264억원이나 이 보다 낮은 7000억~8000억원대를 전망하는 곳도 있다.기아차의 1분기 영업익 컨센서스는 4436억원으로 전년 동기 보다 25.3% 떨어질 것으로 추정됐다. 코로나19에 대한 예측이 어려운 만큼 2분기에도 추가적으로 영향을 받을 것이라는 전망이다.현대·기아차는 우선적으로 밀린 물량을 소화하는 등 내수 시장 정상화에 힘을 쏟고 있다. 아반떼, 쏘렌토 등 신차 출시 행사는 온라인 생중계로 전환하는 등 비대면 마케팅을 강화하고 있다.현대차는 또 코로나19 사태로 줄어든 생산량을 만회하기 위해 노조에 최대 주 60시간 근무에 대한 실무협의를 제안했다. 기존 주 48시간에서 특근으로 최대 12시간을 더 늘리자는 내용이다. 노조가 동의하고 고용부가 인가하면 현대차는 1~3개월간 한시적으로 생산량을 늘릴 수 있다.업계 관계자는 ""미국·유럽 생산 제동으로 현대·기아차 뿐 아니라 계열사인 현대글로비스, 현대제철 등의 도미노 타격이 우려된다""면서 ""코로나19를 예측할 수 없는 만큼 각사들은 한동안 비상경영체제를 유지할 것으로 보인다""라고 말했다.데일리안 조인영 기자 (ciy8100@dailian.co.kr)ⓒ (주)데일리안 - 무단전재, 변형, 무단배포 금지",/news/news_read.nhn?article_id=0002390584&office_id=119&mode=search&query=현대차&page=3
,"[서울=뉴시스] 이종희 기자 = 정의선 현대자동차그룹 수석부회장이 올해 주주총회에서 현대차 이사회 의장 자리에 오르며 그룹 경영 전면에 나선 가운데 모빌리티 기업으로의 전환에도 속도를 낼 것으로 보인다. 정 수석부회장은 그동안 현대차를 2025년까지 전통적인 자동차 제조사에서 '스마트 모빌리티 솔루션 프로바이더'로 체질을 개선하겠다는 야심찬 포부를 밝혀왔다. 이에 미래 모빌리티 사업을 선점하기 위한 움직임 구체화될 전망이다. 현대차는 19일 서울 양재동에서 열린 주주총회에서 사업목적의 '각종차량과 동 부분품의 제조판매업'을 '각종차량 및 기타 이동수단과 동 부분품의 제조판매업'으로 변경했다. 또 '전동화 차량 등 각종 차량 충전 사업 및 기타 관련 사업'을 사업목적에 추가했다. 현대차는 사업목적 변경을 통해 라스트마일, 개인용비행체(PAV) 등 다양한 미래 이동수단과 관련한 신규사업을 추진할 계획이다. 앞서 현대차는 미래경쟁력 확보를 위해 2025년까지 61조1000억원 규모의 투자를 단행, 현행 '제품'에서 '제품+서비스'로 사업구조를 변경, 스마트모빌리티솔루션기업으로 도약하겠다는 방침을 밝혔다.
현대차는 ""올 한해를 '스마트 모빌리티 솔루션 프로바이더'를 향한 2025 전략 실행의 출발점으로 삼고, 미래시장 리더십 확보 및 주주가치 제고를 지속적으로 추진하겠다""며 ""이를 위해 성공적 신차 론칭과 과감하고 근본적인 원가구조 혁신을 통해 수익성을 강화하고, 전동화 및 모빌리티서비스 등 미래사업 실행을 본격화할 계획""이라고 말했다. 미래 모빌리티 분야를 선점하기 위한 현대차의 발걸음도 빨라지고 있다. 현대차는 올해 '국제가전박람회(CES) 2020'에서 2040년 1조5000억 달러(약 1700조원) 규모로 성장할 것으로 예상되는 PAV(개인용 비행체) 기반 UAM(도심 항공 모빌리티) 시장에 뛰어들겠다고 선언했다. 이를 위해 UAM을 비롯, PBV(목적 기반 모빌리티), Hub(모빌리티 환승 거점) 간의 긴밀한 연결성에 기반한 인간중심의 미래 모빌리티 비전을 공개하고 앞으로 인류가 경험할 혁신적 이동성과 이에 기반한 미래도시의 변화를 제시했다.정 수석부회장은 ""우리는 도시와 인류의 삶에서 무엇이 중요한지 깊이 생각했다""며 ""UAM과 PBV, Hub의 긴밀한 연결을 통해 끊김 없는 이동의 자유를 제공하는 현대자동차의 새로운 스마트 모빌리티 솔루션은 사회에 활기를 불어넣고 '인류를 위한 진보'를 이어 나가게 할 것""이라고 말했다.또한 우버(Uber)와 PAV(개인용 비행체)를 기반으로 한 UAM(도심 항공 모빌리티) 사업 분야 전략적 파트너십을 맺고 본격적인 개인용 비행체 개발에 돌입했다. 현대차는 자동차를 넘어 UAM을 미래 핵심 사업으로 육성, 반세기 넘게 펼쳐온 도로 위에서의 도전을 이제 하늘 길로 확장하겠다는 강한 의지를 내비치고 있다.지난해 9월에는 도심 항공 모빌리티 핵심기술 개발과 사업추진을 전담하는 'UAM사업부'를 신설하고, 사업부장으로 미 항공우주국(NASA) 출신 신재원 박사를 영입했다.현대차는 우버와 협력을 기반으로 한 세계 최고의 PAV 개발과 도심 항공 모빌리티 서비스 등을 통합해 향후 'UAM 사업'으로 발전시킨다는 구상이다.현대차가 CES에서 전세계에 첫 선을 보인 PAV(개인용 비행체) 'S-A1'은 날개 15m, 전장 10.7m의 'S-A1'은 조종사 포함 총 5명 탑승이 가능하다. 활주로 없이도 비행이 가능한 전기 추진 수직이착륙(eVTOL) 기능을 탑재한 타입으로, 총 8개의 프로펠러를 장착하고 있으며 최대 약 100km를 비행할 수 있다. 최고 비행 속력은 290km/h에 달하고, 이착륙 장소에서 승객이 타고 내리는 5분여 동안 재비행을 위한 고속 배터리 충전이 가능하다. 상용화 초기에는 조종사가 직접 조종하지만, 자동비행기술이 안정화 된 이후부터는 자율비행이 가능하도록 개발될 예정이다. 현대차는 PAV의 상용화 시점을 2028년으로 보고 있다. 정 수석부회장은 상용화 시점에 대해 ""2028년으로 생각한다""고 말했다. 2papers@newsis.com<ⓒ 공감언론 뉴시스통신사. 무단전재-재배포 금지>",/news/news_read.nhn?article_id=0009769725&office_id=003&mode=search&query=현대차&page=3
,"(서울=연합뉴스) 옥철 기자 = 현대자동차 미국 앨라배마공장(HMMA)이 신종 코로나바이러스 감염증(코로나19) 확산에 대응해 오는 31일까지 차량 생산 중단을 연장한다고 21일(현지시간) 밝혔다.

현대차 앨라배마 법인 보도자료에 따르면 HMMA는 모든 직원들이 조업 중단 시기에 적정한 보상을 받게 될 것이라고 말했다. 이 공장 직원은 3천여 명이다.

현대차 공장 가동 중단은 엔진 생산라인에서 근무하던 직원 한 명이 코로나19 양성 반응을 보이면서 시작됐다.

 앞서 현대차 앨라배마 공장은 22일까지 문을 닫기로 했다고 밝힌 바 있다.

이번 조치로 HMMA는 영업일 기준 7일간 라인 가동을 더 중단하게 됐으며, 약 1만 대의 생산량이 감축된다.

HMMA는 성명서에서 ""급속히 퍼지는 코로나19는 현대차가 예측 가능한 시장 수요에 맞춰 생산을 조정하기 위해 제조업을 세심하게 관리하도록 요구하고 있다. 계속 상황을 주시해 적절한 조치를 취할 것""이라고 말했다.

현대차에서 생산되는 엔진을 조립해야 하는 기아자동차 조지아공장(KMMG)도 영향을 받을 전망이다.

oakchul@yna.co.kr",/news/news_read.nhn?article_id=0011489262&office_id=001&mode=search&query=현대차&page=2
