head,text,url
,"유럽산 부품부족으로 생산차질 빚어질까…글로벌 판매부진 우려 신차 출시도 차질…개소세 70% 인하 효과에 작은 기대(서울=연합뉴스) 최윤정 김동규 기자 = 신종 코로나바이러스 감염증(코로나19)이 아시아를 넘어 중동, 유럽 등지로 퍼지면서 국내 자동차 업계에 긴장감이 더욱 고조되고 있다.

1일 업계에 따르면 코로나19가 세계적으로 확산하면서 자동차산업은 글로벌 생산차질과 판매감소 우려가 커지고 있다.

중국산 부품 한 개가 없어서 공장을 세웠던 국내 완성차 업체들이 유럽산 부품 때문에 생산을 중단하거나 해외 공장이 확진자 한 명으로 인해 멈추는 상황을 겪을 수 있다.

코로나19 사태가 계속되며 주요국 경기가 가라앉으면 자동차 업체들은 불과 몇달 전에 잡은 판매목표를 줄줄이 낮춰야 할 것으로 보인다.◇ 완성차 생산차질 이어져…중국산 부품부족에서 국내 직원 감염까지

 자동차산업은 코로나19 사태 초기부터 직접 피해를 입고 있다.

처음엔 중국 내 완성차 공장가동 중단이나 중국산 부품 공급부족으로 인한 국내 생산차질 정도였는데 이제는 직원 중에 확진자가 나와서 국내공장을 닫는 일이 벌어졌다.

지난달 국내 완성차 업체들은 중국산 와이어링 하니스(배선 뭉치) 부족으로 공장 라인 가동 속도를 늦추다가 며칠씩은 아예 세워버렸다.

대기가 몇달씩 밀린 팰리세이드, GV80 등 인기차종을 생산하는 현대차 울산2공장도 지난달 7일과 10일, 21일 문을 닫았다.

중국 내 부품공장들이 조업을 재개하며 상황이 마무리되나 했는데 곧 국내에서 일이 터졌다.

 한 부품업체가 코로나19 관련으로 가동을 중단하며 현대차 포터 생산도 하루 멈췄다.

이어 28일엔 현대차 울산 2공장이 직원이 코로나19 양성 확진을 받은 여파로 멈췄다.

완성차 공장에선 직원들이 컨베이어 벨트 앞에 나란히 서서 일하기 때문에 전염이 빠르게 발생할 수 있다.

또 와이어링 하니스 사례에서 봤듯이 수많은 부품 중에 하나라도 빠지면 생산이 불가능하다.

완성차와 부품사들이 서로 영향을 받아 멈추는 악순환이 벌어질 수 있는 구조다.◇ 유럽서 확진 증가…유럽산 부품 공급차질·해외공장 중단 우려

중국과 한국에 한정됐던 완성차 생산차질 우려는 이제 세계적인 문제가 되고 있다.

이탈리아 등 유럽에서도 코로나19 확진자가 빠르게 늘어나고 있기 때문이다.

 국내 완성차·부품 업체도 해외 공장이 문을 닫거나, 유럽 등지에서 생산하는 부품의 공급이 원활치 않을 가능성이 커졌다.

유럽 완성차업체들도 피해가 코 앞으로 다가왔다. 피아트 크라이슬러 등에 납품하는 자동차 부품업체 MTA는 이탈리아 롬바르디아에 있는 공장이 폐쇄됐다.

 중국 코로나 여파도 뒤늦게 나타나는 것으로 보인다. 그동안 쌓아둔 재고가 소진돼가고 중국에서 다시 가져오는 데는 여러 주가 걸리기 때문이다.

 덴소와 후지쓰의 스페인 공장이 16일부터 자동차 오디오 부품 조립 생산라인 가동을 중단할 계획이다. 중국산 부품 부족 때문이다.

이베스트증권 유지웅 애널리스트는 ""유럽산 전장 핵심부품 조달이 끊기면 와이어링 하니스 때 보다 파급이 훨씬 클 수 있다""며 ""현대·기아차 유럽 공장이 코로나 영향을 받을 가능성도 염두에 둬야한다""고 말했다.

그는 ""자동차 부품사 중에도 이탈리아 등 유럽에 공장이 있거나 유럽 매출이 많은 업체들이 타격을 입을 우려가 있다""고 덧붙였다.◇ 코로나19 세계경제에 충격…국내외 판매감소 전망

코로나19로 인해 세계 경기가 고꾸라지면 가뜩이나 감소세인 자동차 판매가 더 쪼그라들 수 있다.

중국에서는 지난달 중순까지 승용차 판매가 90% 이상 추락했다.

국내에도 확진자가 늘어나며 영업점을 찾는 발걸음이 뚝 끊겼다. 2일 발표될 완성차 업체들의 판매 실적이 상당히 저조할 것으로 전망된다.

그동안에는 국내에서 잠시 부진해도 유럽과 미국에서 만회하면 된다는 분위기였는데 이제는 어디도 영향을 피할 곳이 없어 보인다.

유럽은 당장 5일부터 개최 예정이던 제네바 국제 모터쇼가 취소될 정도다. 미디어 행사가 열리기 불과 사흘전에 내려진 결정이다.

 국내에서도 업체들이 신차를 내놓고도 대대적으로 홍보를 하지 못하고 있다.

르노삼성차는 3∼4일 예정했던 XM3 출시 관련 미디어 행사를 취소했다.

 현대·기아차와 제네시스도 쏘렌토, G80, 아반떼 신차 출시 행사를 두고 고심 중이다.

이항구 산업연구원 선임연구위원은 ""세계 자동차 판매가 올해 9천만대 아래로 떨어질 것으로 보이고, 이렇게 되면 현대기아차도 경쟁력 있는 신차가 줄줄이 나오는 '골든 사이클' 효과를 기대하기 어렵다""고 말했다.

이항구 위원은 ""5년 이상 어려운 시기를 지나온 부품업계는 추가 구조조정이 불가피할 것""이라며 ""중소기업은 영업이익률이 지난해 조금 개선돼서 2%대인데 올해는 마이너스인 경우가 수두룩할 것으로 예상된다""고 말했다.

그나마 국내 업체들은 승용차 개별소비세 70% 인하 조치에 작은 기대를 걸고 있다. 정부는 코로나19로 인한 내수 충격이 커지자 작년 말로 종료했던 개소세 인하를 다시 꺼냈다.

merciel@yna.co.kr dkkim@yna.co.kr",/news/news_read.nhn?article_id=0011438181&office_id=001&mode=search&query=현대차&page=2
,"코로나19가 아시아를 넘어 중동, 유럽 등지로 퍼지면서 국내 자동차 업계에 긴장감이 더욱 고조되고 있다.1일 자동차업계에 따르면 코로나19가 세계적으로 확산하면서 자동차산업은 글로벌 생산차질과 판매감소 우려가 커지고 있다.자동차산업은 코로나19 사태 초기부터 직접 피해를 입고 있다.처음엔 중국 내 완성차 공장가동 중단이나 중국산 부품 공급부족으로 인한 국내 생산차질 정도였는데 이제는 직원 중에 확진자가 나와서 국내공장을 닫는 일이 벌어졌다. 지난달 국내 완성차 업체들은 중국산 와이어링 하니스(배선 뭉치) 부족으로 공장 라인 가동 속도를 늦추다가 며칠씩은 아예 세워버렸다.대기가 몇달씩 밀린 팰리세이드, GV80 등 인기차종을 생산하는 현대차 울산2공장도 지난달 7일과 10일, 21일 문을 닫았다.중국 내 부품공장들이 조업을 재개하며 상황이 마무리되나 했는데 곧 국내에서 일이 터졌다. 한 부품업체가 코로나19 관련으로 가동을 중단하며 현대차 포터 생산도 하루 멈췄다.이어 28일엔 현대차 울산 2공장이 직원이 코로나19 양성 확진을 받은 여파로 멈췄다.중국과 한국에 한정됐던 완성차 생산차질 우려는 이제 세계적인 문제가 되고 있다.이탈리아 등 유럽에서도 코로나19 확진자가 빠르게 늘어나고 있기 때문이다. 국내 완성차·부품 업체도 해외 공장이 문을 닫거나, 유럽 등지에서 생산하는 부품의 공급이 원활치 않을 가능성이 커졌다.유럽 완성차업체들도 피해가 코 앞으로 다가왔다. 피아트 크라이슬러 등에 납품하는 자동차 부품업체 MTA는 이탈리아 롬바르디아에 있는 공장이 폐쇄됐다. 코로나19로 인해 세계 경기가 고꾸라지면 가뜩이나 감소세인 자동차 판매가 더 쪼그라들 수 있다.중국에서는 지난달 중순까지 승용차 판매가 90% 이상 추락했다.국내에도 확진자가 늘어나며 영업점을 찾는 발걸음이 뚝 끊겼다. 2일 발표될 완성차 업체들의 판매 실적이 상당히 저조할 것으로 전망된다.유럽은 당장 5일부터 개최 예정이던 제네바 국제 모터쇼가 취소될 정도다. 미디어 행사가 열리기 불과 사흘전에 내려진 결정이다. 국내에서도 업체들이 신차를 내놓고도 대대적으로 홍보를 하지 못하고 있다.르노삼성차는 3∼4일 예정했던 XM3 출시 관련 미디어 행사를 취소했다. 현대·기아차와 제네시스도 쏘렌토, G80, 아반떼 신차 출시 행사를 두고 고심 중이다.[디지털뉴스국] [ⓒ 매일경제 & mk.co.kr, 무단전재 및 재배포 금지]",/news/news_read.nhn?article_id=0004527367&office_id=009&mode=search&query=현대차&page=2
,"실적·업황 호조 기대…LGU+는 한 달 내내 순매수(서울=연합뉴스) 김아람 기자 = 최근 코스피에서 '매도 폭탄'을 이어가는 외국인이 실적 전망이 좋거나 호재가 있는 일부 종목은 꾸준히 사들이고 있다.

1일 한국거래소에 따르면 지난 2월 17일부터 28일까지 10거래일간 유가증권시장에서 외국인은 총 3조8천919억원어치를 순매도했다.

외국인은 코스피 대장주 삼성전자를 1조9천954억원어치 팔아치웠다. 또 SK하이닉스(-3천513억원), 현대차(-1천7억원), SK이노베이션(-973억원), 호텔신라(-919억원) 등에 외국인 매수세가 몰렸다.

반면 이 기간 외국인은 카카오, 삼성전기, LG유플러스, 한진칼 등에 대해서는 '사자' 행진을 이어갔다.

지난 10거래일간 외국인이 유가증권시장에서 가장 많이 사들인 종목은 카카오로 1천291억원어치를 순매수했다.

외국인 매수세에 힘입어 카카오는 지난달 19일과 20일 이틀 연속 장중 52주 신고가를 기록하기도 했다. 2월 25일부터 28일까지는 나흘째 순매수를 지속했다.

이달 초 금융당국 인가를 받고 카카오페이증권이 정식 출범해 호재로 작용했으며 올해 실적 전망도 밝은 편이다.

이민아 대신증권 연구원은 ""카카오는 톡보드 매출 증가와 카카오페이 실적 개선에 힘입어 올해 분기 영업이익이 계단식으로 증가할 전망""이라며 ""카카오페이의 금융 서비스 확대, 카카오페이지와 카카오뱅크의 상장 계획 구체화 등 주가 동력도 풍부하다""고 설명했다.

카카오에 이어 같은 기간 외국인 순매수 금액이 큰 종목은 삼성전기다. 984억원어치를 사들였다.

삼성전기는 스마트폰과 TV 등 전자제품에 들어가는 핵심 부품인 적층세라믹커패시터(MLCC)를 생산한다. MLCC가 전기차에도 들어가서 전기차 시장 확대에 따른 수혜주로도 꼽힌다.

MLCC 업황 회복과 스마트폰 수요 개선 기대 등에 힘입어 삼성전기는 지난달 중순에는 52주 신고가 행진을 이어갔다. 또 2월 17∼28일 기간에 26일 하루만 제외하고 순매수 기조를 유지했다.

같은 기간 외국인의 LG유플러스 순매수 금액은 838억원이다. LG유플러스는 작년 4분기 영업이익이 시장 예상을 웃돌며 이동통신 3사 중 1위를 차지했으며, 올해도 5G 가입자 증가 등을 발판으로 실적 호조가 기대되고 있다.

 LG유플러스는 지난 1월 31일부터 2월 28일까지 21거래일 연속 외국인이 순매수를 이어갔다.

최근 10거래일간 외국인이 611억원어치 사들인 한진칼은 한진그룹 경영권 분쟁 격화에 역대 최고가를 연일 새로 쓰고 있다. 코스피가 3% 이상 급락한 지난달 28일에도 장중 7만1천100원까지 오르며 최고가를 경신했다.

아울러 삼성물산(503억원), 엔씨소프트(357억원), 일진머티리얼즈(241억원), 한온시스템(208억원), 한솔케미칼(171억원) 등이 코스피 외국인 순매수 상위 종목에 이름을 올렸다.[표] 최근 10거래일간 코스피 외국인 순매수 금액 상위 종목(단위: 백만원)(자료=한국거래소)

rice@yna.co.kr",/news/news_read.nhn?article_id=0011438263&office_id=001&mode=search&query=현대차&page=2
,"[아시아경제 이기민 기자] 친환경·친인간이 신산업의 화두로 떠오르며 두산, 현대, 한화 등 국내 주요 업계도 이에 걸맞는 신산업 찾기에 몰두하고 있다.국내에서는 석탄연료를 대체할 수 있는 수소동력이 주목을 받으면서 완성차 업계 뿐만 아니라 기계업계에도 수소동력을 장착한 모빌리티 개발과 출시에 업계의 관심이 모이고 있다. 또한 업계는 고령화로 인한 노동인구 감소, 산업의 첨단화와 세밀화가 진행되면서 효율성·안전성·편의성을 모두 갖춘 협동로봇에도 박차를 가하고 있다.최근 현대차 등 완성차 업계가 수소자동차를 내놓는 분위기에서 기계 업계도 수소 동력을 이용한 모빌리티를 개발·출시하고 있다. 우선 두산그룹의 자회사 두산모빌리티이노베이션(DMI)는 수소연료전지팩이 장착된 드론을 출시해 시장의 호응을 받고 있다. 앞서 두산은 2016년 12월 DMI을 설립하고 2년여간 연구·개발을 진행한 후 2018년 9월 미국 라스베이거스에서 열린 '인터드론(Inter Drone)' 전시회에서 드론용 수소연료전지팩을 처음 공개한 바 있다. DMI의 수소드론은 1회 충전으로 2시간 비행이 가능해 전기기반 배터리를 사용하는 드론보다 성능이 크게 뛰어나다는 평가를 받는다. DMI는 수소드론을 활용한 산업을 개척하기 위해 통신·소프트웨어 회사와도 업무협약을 맺고 있다. 올해 1월 세계최대 IT·가전 전시회인 CES 2020에서 마이크로소프트(MS) 등 ‘수소연료전지 드론 솔루션 개발’ 협약을 체결한 바 있다. 수소드론의 장시간 비행능력과 MS의 소프트웨어를 접목해 설비관리, 병충해와 자연재해 모니터링 긴급 운반 교통 조사 등 각종 정보수집에 탁월한 드론을 생산하는 게 목표다. 두산은 올해 드론분야에서 매출 100억원을 기대하고 있다.현대건설기계는 현대자동차·현대모비스 등과 함께 수소지게차 및 중대형 수소굴삭기 개발에 나섰다. 현대차와 현대모비스가 파워팩을 포함한 수소연료전지의 시스템을 설계·제작하면 현대건설기계는 이를 지게차와 굴삭기에 적용해 2023년부터 관련 제품을 양산한다는 계획이다. 이는 글로벌 친환경 기조에 발맞춰 글로벌 수소 건설장비 시장을 선점해 경쟁력을 확보하기 위한 차원이다.생산성 증대와 부족한 노동력 해소가 숙제로 놓인 제조업계의 새로운 대안인 협동로봇 분야도 각광을 받고 있다. 기존 산업로봇은 인간이 직접 하기에는 과도하게 위험한 작업, 단순하고 지루한 작업 등을 대체하는 역할을 주로 했다. 반면 협동로봇은 0.1mm 단위의 미세한 조정이 가능해 인간과 작업영역을 공유한다. 또한 기존 로봇의 안전 펜스가 필요 없어 안전성도 확보돼 업무효율성을 높이는 역할을 한다. 협동로봇 시장도 꾸준히 성장할 것이라는 전망도 나온다. 글로벌 시장조사기관 마켓앤마켓(Markets&Markets)에 딸면 글로벌 협동로봇 시장 규모를 2025년까지 연평균 50.3% 성장해 123억300만달러에 이를 전망이다.협동로봇산업에 뛰어든 국내 주요기업으로는 두산로보틱스, 한화정밀기계가 꼽힌다. 2014년 협동로봇 사업에 진출할 뜻을 밝힌 두산은 로봇 관련 자회사인 두산로보틱스를 2015년 설립했다. 2017년 이후 M0609·0617(가반하중 6kg), M1013(10kg), M1509(15kg) 8개 모델을 자체 개발했다. 두산로보틱스는 현재 20개국에 판매망을 보유하고 있다. 지난해 말 중국 둥관(東莞)에서 열린 '둥관 3C(컴퓨터, 통신, 소비자가전) 전자산업 스마트제조 콘퍼런스'에서 '광동송경지능과기지분유한공사(이하 송칭)' 중국 내 협동로봇 공급을 위한 대리점 계약을 체결한 바 있다. 또한 일본 ‘아이렉스(iREX) 2019’,
CES 2020 등에 참가해 제품들을 선보였다.한화정밀기계는 국내 대기업 가운데 최초로 2017년 3월 협동로봇 제품을 내놨다. 한화정밀기계의 주력상품은 HCR-3(가반하중 3kg), HCR-5(5kg), HCR-12(12kg) 등 HCR 시리즈다. HCR은 안정성 이외에도 가볍고 운영 소프트웨어가 쉬워 비전문가도 로봇을 운용할 수 있다는 게 장점이다. 한화정밀기계는 2018년 유럽대리점 6개사와 협동로봇 공급계약을 체결하며 유럽시장에 진출했다. 이후 중국, 인도 등 20여개국에 판매망을 구축해 사업을 확장하고 있다. 올해 6월에는 독일 뮌헨에서 열리는 '오토마티카 2020' 전시회에 참가해 마케팅활동을 진행할 예정이다.이 밖에도 현대중공업그룹이 지난해 말 로봇사업부문을 분사해 현대로보틱스를 설립했다. 현대로보틱스도 물류로봇 자동차조립 로봇 등에 이어 협동로봇 사업부분에서 이목을 끌고 있다. 현대로보틱스는 지난해 협동로봇 YL012로 세계 3대 디자인 공모전인 '레드닷 디자인 어워드(Red Dot Design Award)'에서 최우수상을 차지한 바 있다.이기민 기자 victor.lee@asiae.co.kr <ⓒ경제를 보는 눈, 세계를 보는 창 아시아경제 무단전재 배포금지>",/news/news_read.nhn?article_id=0004634002&office_id=277&mode=search&query=현대차&page=1
"삼성전자, 코스피 시가총액 비중 24%","2만5000원. 삼성전자의 2013년 주가다. 지금은 대략 6만원 정도다. 7년 사이에 약 140% 오른 셈이다. 당시 코스피 지수는 1970. 2020년 지금은 2150으로 9% 상승하는 데 그쳤다. 시가총액 1위 기업의 주가가 배 넘게 오르는 동안 전체 지수는 해당 종목의 15분의 1밖에 오르지 못했다. 이 말은 삼성전자를 제외한 다른 종목은 주가가 크게 하락했다는 의미다. 이런 상황은 업종에도 적용된다. 2013년 이후 주가지수보다 많이 오른 업종은 IT(정보기술)와 바이오 등 손에 꼽을 정도다. 과거에는 10개 업종 중 3~4개가 그 대상이었다면 지금은 1~2개로 줄어들었다. 이런 사실에서 얻을 수 있는 교훈은 뭘까? 지난 7년간 투자는 '분산'이 아니라 '집중'이 답이었다는 교훈이다. 사정이 이렇다 보니 쏠림 현상이 심해졌다. 삼성전자가 코스피 시가총액에서 차지하는 비중이 24%로 높아졌다. SK하이닉스까지 더하면 반도체 2개사의 시가총액 합이 코스피의 30%에 달한다. 2015년 초 20%에 비해 10%포인트 늘어난 건데 특정 종목이 시장에서 차지하는 위치가 이렇게 높았던 전례가 없다. 여기에 배터리를 재료로 주가가 오르고 있는 LG화학과 삼성SDI의 시가총액 비중 3.6%를 더하면 반도체와 전기차 관련 4개사의 시가총액은 전체의 33%로 올라간다. 금융위기 직후 현대자동차가 큰 이익을 낼 때 삼성전자와 현대차의 영업이익 합이 전체 영업이익에서 차지하는 비중이 43%까지 올라간 적이 있다. 그때도 두 회사의 시가총액 합이 전체의 25%를 넘지 않았다. 지금 IT를 중심으로 한 쏠림 현상이 얼마나 강하게 진행되고 있는지 알 수 있다. 그다음으로 쏠림 현상이 강한 곳이 바이오다. 과거에는 삼성바이오로직스와 셀트리온 등처럼 영업 상황이 안정적이고 신약 개발이 일정 궤도에 들어와 있는 기업과 그렇지 못한 중소기업 사이의 쏠림 현상만 있었는데 지금은 우량 바이오 기업 사이에도 층이 나눠져 있다. 삼성바이오로직스 주가가 50만원을 넘어 사상 최고치 행진을 계속하는 동안 셀트리온은 여전히 20만원을 회복하지 못하고 있다. 상승 종목이 세분화되면서 힘이 한쪽으로 쏠리고 있는 것이다. 미국도 사정이 비슷하다. 시가총액 1위 기업이 S&P 500 지수에서 차지하는 비중이 5%를 넘었다. 과거에는 단일 기업의 시가총액이 시장 전체의 5%를 넘은 적이 한 번도 없었다. 2000년 IT 버블 때 마이크로소프트(MS)가 그 직전까지 갔다가 실패했고, 애플 역시 2012년 아이폰 열풍에도 불구하고 시가총액 비중이 5%를 넘지 못했다. 그래서 과거에는 1위 기업의 시가총액 비중이 5%에 근접하는 걸 시장이 바뀌는 신호로 여겼다. 지금은 사정이 다르다. 이미 MS와 애플 두 종목 모두 5%를 넘었다. 여기에 시가총액 4%를 차지하고 있는 아마존을 더하면 세 종목이 미국 시장에서 차지하는 비중이 14%가 된다. 미국 시장 내 종목별 움직임이 구조적으로 달라졌다는 의미가 되는데 이런 변화로 인해 과거에 썼던 투자법이 지금도 유효한지에 대한 의문이 제기됐다.그동안 시장에서는 분산투자를 가장 좋은 투자방법으로 생각해 왔다. 앞으로 어떤 일이 벌어질지 알 수 없으므로 주식을 가능한 한 많은 곳에 분산투자해 위험에 대비해야 한다는 전략이었다. 문제는 수익률이다. 쏠림 현상이 심해지면서 분산투자의 수익률이 코스피 상승률과 유사해졌다. 한국 시장처럼 몇몇 종목과 다른 종목 사이에 수익률 격차가 큰 경우 분산투자의 성적은 더 나쁘다. 2013년 이후 7년 동안 투자 종목을 많이 분산한 경우 연간 투자 수익률이 1.5%에 지나지 않았는데 이는 해당 기간 채권 투자 수익률의 절반 정도다. 그렇다면 굳이 분산투자를 할 필요가 없다. 종목 여러 개를 매수하는 것보다 코스피를 복제한 ETF(지수연동형펀드)에 투자하는 게 매매의 용이성이나 비용 면에서 유리하기 때문이다. 종목 투자는 성장성이 있는 기업에 집중하는 것이 좋다. 과거에는 성장성을 규모가 작은 기업만의 전유물로 여겼지만 지금은 그렇지 않다. 삼성전자나 미국의 사례에서 보듯 기업 자체의 성장성보다 해당 기업이 가지고 있는 사업부문이 미래 지향적이냐 아니냐에 보다 많은 힘이 실리고 있다. 미국 'FAANG(페이스북, 애플, 아마존, 넷플릭스, 구글) 기업'의 주가가 20년간 많게는 80배, 적어도 20배 이상 주가가 오른 거나 30년 동안 삼성전자 주가가 100배 넘게 상승한 것 모두 규모가 큰 기업임에도 불구하고 사업 부문의 성장성이 높았던 결과다.성장성은 우리 시장에서 특히 중요시되고 있다. 지난 10년간 기업 규모가 크고 국민 경제에서 중요한 역할을 하는 기업조차 성장성이 낮을 경우 주가가 힘을 쓰지 못했다. 포스코와 한국전력을 포함해 자동차, 조선, 화학, 철강 업종 주가가 이를 잘 보여주는데 지금 주가가 사상 최고치의 절반을 넘는 곳이 많지 않을 정도다. 지난 2~3년간 '조선업이 오랜 불황을 끝냈다'느니, '자동차의 구조조정이 마무리됐다' 등등의 이야기가 많았지만 주가가 오르지 않았다. 2000년대 중반에 해당 업종 경기가 최고점을 지나 앞으로는 경기가 괜찮아져도 10년 전 수준에 미치지 못할 거라는 생각 때문에 나온 반응이다. 주식시장에서는 성장의 끝이 보이지 않을 때 평가가 후해지는 반면 한계가 보이면 평가가 박해진다. 그러면 해당 종목의 주가는 틀에 갇혀 버린다. 앞으로 우리나라 많은 산업의 주가가 가격이 싸졌을 때 이를 일정 수준까지 끌어올리는 것 말고 뚜렷한 상승 동력을 찾기 힘들어 성장성의 중요성이 더더욱 높아질 것이다.우리 시장에서 가장 성장성이 높다고 꼽히는 부문은 IT와 배터리를 포함한 2차 전지 쪽이다. 여기에 기간이 짧기는 하지만 5G(5세대)를 기반으로 한 스마트폰 부품과 반도체 장비와 소재 관련 업체들도 주목을 받고 있다. 5G 스마트폰은 작년에 우리나라가 처음 망을 구축한 이후 올해는 주요국 대부분이 투자에 참여할 걸로 보인다. 그 덕분에 관련 폰의 전 세계 판매 규모가 작년보다 30배 이상 늘어날 가능성이 있다. 새로운 유행이 시작되는 초기에 해당하므로 해당 종목에 집중 투자를 생각해 볼 필요가 있다. 경제가 성숙해 성장동력이 약해질수록 성장 산업에 높은 프리미엄을 줘 주가를 끌어올리기 때문이다.   이종우 이코노미스트(전 IBK투자증권 리서치센터장) sisa@sisajournal.com<저작권자 ⓒ 시사저널, 무단 전재 및 재배포 금지>",/news/news_read.nhn?article_id=0000011974&office_id=586&mode=search&query=현대차&page=1
