head,text,url
,"도심형 헬리콥터와 자율주행 미니밴, 이 같은 이동수단을 사람들이 타고 내릴 수 있는 환승거점…. 현대차가 그리는 ‘미래 모빌리티’의 모습이다. 이런 모빌리티 시스템이 구축된 스마트 도시의 축소 모형이 현대차 본사 로비에 등장했다. 현대차는 지난 1월 미국 라스베이거스에서 열린 ‘CES 2020’에서 공개했던 ‘스마트 모빌리티’ 관련 축소 모형물을 양재 본사 사옥 1층 로비에 설치했다고 17일 밝혔다. ‘스마트 모빌리티 솔루션 기업으로 거듭나겠다’고 밝힌 현대차가 내부 구성원들이나 비즈니스 파트너들에게 미래 모빌리티 비전을 직관적으로 보여주기 위한 것이다. 현대차 로비에 주력 신차나 콘셉트카가 아닌 미래 모빌리티 모형이 전시된 것은 이번이 처음이다.정의선 현대차그룹 수석부회장은 올해 CES에 직접 참석, 현대차의 스마트 모빌리티 계획을 소개했다. 프로펠러가 달린 도심형 헬리콥터는 ‘도심항공모빌리티(UAM)’다. 수직 이착륙이 가능한 비행체로, 이를 활용하면 도심 내 교통 혼잡을 피해 빠르게 이동할 수 있을 전망이다. 지상 위를 돌아다니는 자율주행 미니밴은 ‘목적기반 모빌리티(PBV)’이다. 실내 공간 설계가 자유로워, 카페·병원처럼 활용할 수 있다. UAM과 PBV는 중앙의 원형 구조물인 ‘환승거점(Hub)’에서 이용할 수 있다. Hub엔 UAM 이·착륙장과 PBV 도킹 스테이션이 마련돼있다. 당시 정 수석부회장은 “UAM과 PBV, Hub의 긴밀한 연결을 통해 끊김 없는 이동의 자유를 제공할 수 있다”며 “역동적인 인간 중심의 미래 도시 구현에 기여할 것”이라고 강조했다. 전시 모형은 실물을 1:8 비율로 축소한 것이다. Hub위엔 8개 프로펠러가 돌아가는 UAM이 떠 있고, 지상엔 7대의 PBV가 실제 도로를 달리는 모습을 보여준다. PBV는 Hub 주변을 돌다가, 종종 Hub의 도킹 스테이션에 연결되는 모습도 연출했다. UAM사업부를 총괄하는 신재원 부사장은 “현대차그룹은 지난 수십 년 동안 사람들의 꿈이던 도심항공모빌리티를 현실로 만들기 위해 UAM 사업부를 신설했다”며 “이번에 전시한 UAM 기체는 우버(Uber)와 협업한 것으로 UAM 실현 의지를 보여주는 상징”이라고 말했다.이번 전시는 다음달 12일까지 이어지며, 이후엔 글로벌 행사 등에 출품해 현대차 미래 비전을 알리는 데 활용할 예정이다.[윤형준 기자 bro@chosun.com] 		▶
		▶ 		▶
	- Copyrights ⓒ 조선일보 & chosun.com, 무단 전재 및 재배포 금지 -",/news/news_read.nhn?article_id=0003531726&office_id=023&mode=search&query=현대차&page=2
본사 로비에 1대 8 크기 축소 모형 전시내달 12일까지 전시후 글로벌 행사에 공개,"[서울경제] 현대자동차가 그리는 미래도시가 모습을 드러냈다.는 지난 1월 미국 라스베이거에서 열린 세계 최대 전자·정보기술전시회(CES)에서 공개했던 ‘스마트 모빌리티 솔루션’의 축소 모형물을 서울 양재동 본사 1층 로비에 설치했다고 17일 밝혔다. 1층 로비에 주로 신차나 콘셉트카를 전시해 온 현대차가 미래 모빌리티의 비전 모형물을 전시한 것은 이번이 처음이다.실물의 1대8 크기로 제작된 전시물은 107㎡ 공간 내에 설치됐다. 모형은 △UAM(도심항공모빌리티) △PBV(목적기반모빌리티) △Hub(모빌리티 환승 거점)가 유기적으로 연결된 모습을 표현했다. UAM은 하늘을 새로운 이동통로로 이용할 수 있는 솔루션이며 PBV는 지상에서 목적지까지 이동하는 시간 동안 탑승객에게 필요한 맞춤형 서비스를 제공하는 친환경 이동 솔루션이다. Hub는 UAM과 PBV를 연결하는 공간으로 사람들이 다양한 방식으로 교류하고 공감대를 형성하는 신개념 솔루션이다.전시는 다음달 12일까지 이어진 후 주요 글로벌 행사 등에 전시될 계획이다. 현대차는 또 벽면에 설치한 대형 디스플레이를 통해 스마트 모빌리티 솔루션이 변화시킬 미래도시 영상도 상영하고 있다. 이상엽 현대디자인담당 전무는 “새로운 형태의 개인 모빌리티라는 현대디자인센터가 지금까지 가보지 않은 디자인영역을 연구하고자 UAM 디자인 조직 신설 및 전문인력을 확충했고 유관 부서 간 열린 구조의 협업에 적극 참여하고 있다”고 말했다.앞서 올 초 열린 CES에서 정의선 현대차그룹 수석부회장은 “UAM과 PBV·Hub의 긴밀한 연결을 통해 끊김 없는 이동의 자유를 제공하는 현대자동차의 새로운 스마트 모빌리티 솔루션은 사회에 활기를 불어넣고 ‘인류를 위한 진보’를 이어 나가게 할 것”이라며 “현대차는 이동 시간의 혁신적 단축으로 도시 간 경계를 허물고 의미 있는 시간 활용으로 사람들이 보다 효율적으로 목표를 이루며 새로운 커뮤니티를 통해 사람들이 함께 모일 수 있는 역동적인 인간 중심의 미래도시 구현에 기여할 것”이라고 말했다./서종갑기자 gap@sedaily.com저작권자 ⓒ 서울경제, 무단 전재 및 재배포 금지",/news/news_read.nhn?article_id=0003738369&office_id=011&mode=search&query=현대차&page=2
UAM·PBV·Hub 등 CES서 발표한 '미래도시' 축소물실물 8분의1 크기로 제작,"현대자동차가 서울 양재동 본사 1층에 도심항공 모빌리티(UAM)와 목적기반 모빌리티(PBV), 모빌리티 환승거점(Hub) 등 미래 모빌리티(이동수단) 모형물을 설치했다고 17일 발표했다.현대차가 지난 1월 미국 라스베이거스에서 열린 세계 최대 전자쇼 'CES 2020'에 공개했던 스마트 모빌리티 솔루션 축소 모형이다. 정의선 현대차그룹 수석부회장은 올해 CES에서 '인류를 위한 진보'를 이어갈 방안으로 현대차의 스마트 모빌리티 솔루션을 소개했다.UAM은 수직 이착륙하는 개인용 비행체(PAV)로 활주로 없이 도심에서 비행해 대도시 교통 혼잡을 피하는 방안이다. PBV는 지상에서 목적지까지 이동하는 시간에 탑승자에게 맞춤형 서비스를 제공하는 이동수단이다. Hub는 UAM 이·착륙장과 PBV 도킹 스테이션을 통해 이들을 연결하는 구심점이다.107㎡ 공간에 실물을 8분의 1 비율로 축소한 모형은 UAM과 PBV, Hub가 유기적으로 연결돼 현대차의 미래 이동성 개념을 알기 쉽게 표현했다. Hub 위에 설치된 이·착륙장에는 하늘을 나는 UAM이 있고 지상에는 7가지 개인 용도로 제작된 PBV가 도로를 달리는 모습을 나타냈다.이번 전시는 다음 달 12일까지 이어지며 이후에는 글로벌 행사 등에 출품해 현대차 미래 비전을 알리는 데 활용된다.미국 항공우주국(NASA) 항공연구총괄본부장 출신인 신재원 현대차 UAM 사업부 부사장은 ""인류의 삶을 보다 가치 있게 만들고, 고객에게 이동의 자유로움과 차별화된 경험을 제공하겠다는 의지를 담아 냈다""고 말했다.김보형 기자 kph21c@hankyung.com▶ ▶
 ▶
ⓒ 한국경제 & , 무단전재 및 재배포 금지",/news/news_read.nhn?article_id=0004341912&office_id=015&mode=search&query=현대차&page=2
1월 CES 발표 ‘미래도시’ 축소물…6월12일까지 전시,"현대자동차 양재동 본사 로비에 도심항공모빌리티(UAM), 목적기반 모빌리티(PBV), 모빌리티 환승거점(Hub) 등 현대차가 그리는 미래 모빌리티 모형이 전시된다.현대차는 올해 1월 미국 라스베이거스에서 열린 ‘CES 2020’에서 공개했던 ‘스마트 모빌리티 솔루션’ 축소 모형물을 양재 본사 사옥 1층 로비에 설치했다고 17일 밝혔다. 이번 전시에서 107㎡ 공간에 실물을 1대 8 비율로 축소한 크기로 놓인 모형은 UAM과 PBV, Hub가 유기적으로 연결돼 현대차의 미래 이동성 개념을 알기 쉽게 표현했다. Hub 위에 설치된 이·착륙장에는 하늘을 나는 UAM이 있고, 지상에는 7가지 개인용도로 제작된 PBV가 도로를 달리는 모습을 나타냈다. PBV 모형은 실제로 Hub 주변을 돌다가 Hub의 도킹 스테이션에 연결돼 건물의 일부가 되는 모습을 연출했다. UAM은 8개의 프로펠러가 이·착륙 시에는 수직으로, 전진 시에는 수평으로 전환되는 틸팅(tilting) 기능을 선보이며 생동감 있는 비행 상황을 보여준다. 천장에는 거울을 설치해 다양한 각도에서 전시물을 관람할 수 있도록 했고, 벽면에 대형 디스플레이를 설치해 미래 모빌리티가 실현될 미래 도시의 영상도 상영한다. 전시는 다음 달 12일까지 이어지며 이후에는 글로벌 행사 등에 출품해 현대차 미래 비전을 알리는 데 활용한다. 현대차는 “임직원들에게 미래 모빌리티 비전을 보다 직관적으로 보여줘 현대차가 ‘스마트 모빌리티 솔루션 기업’으로 거듭나겠다는 의지를 고취하기 위한 차원”이라고 설명했다. 현대차그룹은 정의선 수석부회장이 올해 CES에 직접 참석해 ‘인류를 위한 진보’를 이어갈 방안으로 현대차의 스마트 모빌리티 솔루션을 소개한 바 있다. 조계완 기자 kyewan@hani.co.kr[ⓒ한겨레신문 : 무단전재 및 재배포 금지]",/news/news_read.nhn?article_id=0002497500&office_id=028&mode=search&query=현대차&page=2
,"소형 스포츠유틸리티차(SUV)의 인기가 판매 실적에서도 나타나고 있다.17일 국내 완성차 업체 5곳의 판매 실적을 종합하면 올해 4월까지 국내에서 가장 많이 판매된 차급은 소형 SUV로 집계됐다.소형 SUV는 전체 판매 46만7910대 가운데 15.5%인 7만2416대가 팔리며 1위에 올랐다. 6만5107대(13.9%)가 팔린 준대형 승용차를 제친 것.이는 최근 레저활동 증가와 넉넉한 적재공간에 대한 기대가 높아지면서 저렴한 가격으로 이를 만족시키는 소형 SUV 판매에 대한 소비자 선호가 커졌기 때문으로 분석된다. 특히 생애 첫차를 고르는 젊은 층과 여성들로부터 높은 선택을 받았다.소형 SUV는 전체 SUV 내에서도 판매의 38.1%를 차지하며 인기몰이를 했다. 이어 중형 SUV 27.5%(5만2303대), 대형 SUV 24.5%(4만6602대), 준중형 SUV 4.0%(1만8607대) 순이었다.소형 SUV 모델 중에는 기아차 셀토스가 1만8009대로 가장 많이 판매됐다. 현대차 코나(1만2588대), 르노삼성차 XM3(1만1914대) 등이 뒤를 이었다.소형 SUV 차급은 꾸준한 신차 출시로 올해 연간 판매에서도 차급 1위에 오를 가능성이 높아 보인다. 셀토스를 비롯해 올해 출시한 한국지엠(GM) 트레일블레이저, XM3 등의 인기가 이어지고 있고 이달에도 르노 캡처가 출시되는 등 현재 판매 중인 소형 SUV 모델만 11개에 달한다.2018년 소형 SUV 판매량은 15만541대로 당시 1위인 중형 SUV(22만7705대)와 7만2664대 차이났으나 작년에는 판매 격차를 2만1067대로 크게 줄였다.이런 가운데 소형 SUV의 1위 탈환 여부는 인접 차급인 준중형 SUV와 판매 저력을 갖춘 중형 SUV의 실적이 가를 것으로 보인다. 준중형 SUV는 4월까지 전체 SUV 판매의 4.0%에 그쳤지만, 올해 하반기 현대차가 4세대 투싼을 투입하고 제네시스가 신차 GV70를 선보이는 등 반등을 노리고 있다.중형 SUV 역시 싼타페와 쏘렌토 등 신차로 승부를 건다. 기아차는 올해 쏘렌토 내수 판매 목표를 6만2000대로 잡았는데, 이미 누적 대수가 3만대를 넘겨 목표 달성이 무난해 보인다. 싼타페 페이스리프트 모델도 상반기 출시 예정이다. 싼타페는 2018년(10만7202대)과 2019년(8만6198대) 2년 연속으로 최다 판매 SUV에 오른 전통의 강호다.이처럼 올해 SUV 신차가 대거 출시되면서 SUV 내, 차급 간 판매 경쟁이 더욱 치열해질 전망이다. 이정혁 기자 jjangga@sportschosun.com- Copyrightsⓒ , 무단 전재 및 재배포 금지",/news/news_read.nhn?article_id=0003568836&office_id=076&mode=search&query=현대차&page=2
"현대차, CES 2020서 발표한 '미래도시' 본사로 옮겼다","[더팩트 | 서재근 기자] 올해 초 미국 '국제가전박람회(CES)'에서 글로벌 자동차 업계의 이목을 집중시켰던 현대자동차그룹(현대차그룹)의 '미래 모빌리티 도시' 전시관이 서울 양재동 본사로 고스란히 옮겨졌다.현대차는 지난 1월 미국 CES에서 공개했던 '도심 항공 모빌리티(UAM)'와 '목적 기반 모빌리티(PBV)', '모빌리티 환승 거점(Hub)' 등 역동적 미래도시 구현을 위한 '스마트 모빌리티 솔루션'의 축소 모형물을 본사 1층 로비에 설치했다고 17일 밝혔다.그동안 현대차는 본사 1층 로비에 주력 신차와 콘셉트카를 전시, 임직원은 물론 고객들이 자유롭게 관람을 할 수 있도록 했다. 이번 전시물 설치 전까지는 북미 시장에서 흥행 중인 기아자동차의 대형 스포츠유틸리티차량(SUV) '텔루라이드'를 비롯한 신차를 전시했다. 신차가 아닌 미래 모빌리티 비전을 구체화한 것은 이번이 처음이다.현대차 관계자는 ""이번 전시는 구성원들에게 그룹이 추진하는 미래 모빌리티 비전을 더욱 직관적으로 보여줌으로써 '스마트 모빌리티 솔루션 기업'으로 거듭나기 위한 의지를 고취하기 위해 기획됐다""고 설명했다.전시는 다음 달 12일까지 이어질 예정이며, 이후에는 주요 글로벌 행사 등에 전시해 글로벌 고객들에게도 관람 기회를 제공한다는 계획이다.전시물은 107㎡ 규모로 실물 1대 8 크기의 입체적이고 사실적인 디테일을 강조해 제작됐으며, UAM과 PBV, Hub가 유기적으로 연결돼 현대차가 실현할 미래 이동성의 개념을 알기 쉽게 표현한 것이 특징이다.PBV 모형은 실제로 Hub 주변을 돌아다니다가 Hub의 도킹 스테이션에 연결돼 건물의 일부가 되는 과정을 연출한다. 또한, UAM은 8개의 프로펠러가 틸팅(이착륙 시에는 수직으로, 전진 비행 시에는 수평으로 전환되는 기능) 및 회전하며 생동감 있게 비행하는 상황을 보여준다.전시공간 천장에 거울을 설치해 다양한 각도로 몰입감 있게 전시물을 관람할 수 있도록 한 것은 물론 전시공간의 벽면과 기둥, 천장에는 폐현수막을 재활용한 친환경 마감재를 적용했다.신재원 현대차그룹 UAM사업부 부사장은 ""현대차그룹은 지난 수십 년 동안 사람들의 꿈이었던 '도심항공모빌리티'를 현실로 만드는 혁신적인 기술개발과 시장개척을 위해서 UAM 사업부를 신설했다""며 ""이번에 전시된 UAM 기체, 'S-A1'은 UAM 사업부가 우버와 협업을 통해 디자인한 것으로 인류의 더 나은 삶과 더 좋은 환경을 위해 도심항공모빌리티를 실현하겠다는 강한 의지를 보여주는 상징""이라고 말했다.현대차그룹은 앞서 지난 1월 CES를 통해 미래 모빌리티 비전 구현을 위해 신개념 모빌리티 솔루션 UAM과 PBV, Hub를 제시한 바 있다.당시 현대차그룹은 날개 크기만 15m, 전장 10.7m 크기로 7200ft²(약 202평) 규모의 현대차 전시 부스 절반을 차지한 웅장한 실물 크기의 PAV 콘셉트 'S-A1'을 세계 최초로 공개했다. 특히, 현대차그룹은 글로벌 자동차 업계 최초로 우버와 UAM 파트너십을 체결하며 업계의 이목을 집중시켰다.'S-A1' 앞에서 파트너십 체결식을 치른 정의선 현대차그룹 총괄 수석부회장은 ""우버와 협력을 토대로 인간의 이동을 자유롭게 할 새로운 기술 개발과 사업을 적극적으로 추진하겠다""며 ""현대차그룹은 이동 시간의 혁신적 단축으로 도시 간 경계를 허물고, 의미 있는 시간 활용으로 사람들이 더 효율적으로 목표를 이루며, 새로운 커뮤니티를 통해 사람들이 함께 모일 수 있는 역동적인 인간 중심의 미래 도시 구현에 이바지할 것""이라고 강조한 바 있다.한편, 현대차는 최근 현대디자인이노베이션실 내 UAM 디자인을 전문적으로 연구하는 조직을 구성하는 등 자동차 디자인뿐만 아니라 미래 모빌리티에 대한 디자인으로 업무 영역을 확대했다. 아울러 스마트 모빌리티 솔루션의 현실화를 위해 전략기술본부, UAM사업부, 현대디자인센터 등 유관 부분 간 개방형 협업 시스템을 구축해 운영하고 있다.likehyo85@tf.co.kr저작권자 ⓒ 특종에 강한 더팩트 & tf.co.kr 무단 전재 및 재배포 금지",/news/news_read.nhn?article_id=0000025978&office_id=629&mode=search&query=현대차&page=1
올 1~4월 전체 車판매의 15% 차지준대형 승용차 제치고 판매 1위,"[서울경제] 소형 스포츠유틸리티차량(SUV)의 인기가 고공행진 중이다. 17일 업계에 따르면 올 1~4월 국내 완성차업체 5곳의 소형 SUV 판매량은 7만2,416대로 전체 자동차 판매량(46만7,910대)의 15.5%를 차지했다. 소형 SUV가 준대형 승용차 판매량(6만5,107대)을 제치고 1위 자리에 등극한 것이다.지난 2018년만 해도 소형 SUV의 판매량은 15만541대로 1위였던 중형 SUV(22만7,705대)보다 7만2,664대 적게 팔렸지만 지난해에는 판매 격차가 2만1,067대로 좁혀졌다. 소형 SUV는 전체 SUV 판매량의 38.1%를 기록했다. 이어 중형 SUV 27.5%, 대형 SUV 24.5%, 준중형 SUV 4% 순이었다.소형 SUV 모델 중
셀토스가 1만8,009대로 가장 많이 판매됐다.
코나(1만2,588대), 르노삼성차 XM3(1만1,914대)가 뒤를 이었다.소형 SUV 시장은
티볼리가 시장을 개척한 후 각 완성차 업체에서 신차가 쏟아지며 현재 춘추전국시대를 방불하게 하고 있다. 올해 출시된 소형 SUV는 한국지엠(GM)의 트레일블레이저, 르노삼성의 XM3가 있고 캡처 출시도 예정돼 있다./서종갑기자 gap@sedaily.com저작권자 ⓒ 서울경제, 무단 전재 및 재배포 금지",/news/news_read.nhn?article_id=0003738408&office_id=011&mode=search&query=현대차&page=1
"문 대통령 투자 유치 위해 과감한 전략 추진공장 총량제 완화, 세제·자금 지원 확대 등 예상","[세종=이데일리 이명철 기자] 코로나19로 민간 부문의 경제 활동이 크게 위축하면서 해외에 나가 있는 우리 기업들의 공장을 국내로 되돌아오게 하는 ‘리쇼어링’을 위한 정부의 수도권 공장 입지 규제 완화 등의 필요성이 제기되고 있다.이미지투데이 제공문재인 대통령은 지난 10일 취임 3주년 특별연설에서 “한국 기업의 유턴은 물론 해외의 첨단산업과 투자를 유치하기 위해 과감한 전략을 추진하겠다”고 밝혔다. 홍남기 경제부총리 겸 기획재정부 장관도 13일 “글로벌가치사슬(GVC)이 크게 훼손된 상황에서 리쇼어링 등에 속도를 낼 것”이라고 말했다.국내 복귀와 투자를 위한 기업들의 규제 완화 요구도 커지고 있다. 지난 15일 홍 부총리를 만난 삼성·현대차·LG·SK·롯데 5개 그룹 전문경영인들은 리쇼어링을 위한 지원 확대와 투자 활성화 지원 및 규제 개혁 등을 요구하기도 했다.수도권 규제는 경기 침체 시마다 기업들이 요구하던 대표 사안이다. 이중 공장 총량제의 경우 서울·인천·경기에 3년 단위로 일정 면적을 정하고 해당 범위 내 연면적 500㎡ 이상 공장 신·증설을 허용하는 방안이다. 총량제에 따라 수도권에 공장이 있는 기업들은 추가 증설이 쉽지 않아 외부 시설을 임대하거나 먼 거리에 공장을 지어야 하는 불편함을 겪고 있다.산업단지 공업 물량은 전국의 20%를 넘지 않도록 제한하고 있다. 상수원 보호구역이나 개발제한구역(그린벨트) 등 환경 규제에 묶인 곳도 많고 경기 북부와 강원 등은 접경지역으로 공업 부지 개발도 제한적이다.‘유턴법’으로 불리는 해외 진출기업의 국내복귀 지원에 관한 법률에서도 수도권 외 지역으로 공장을 이전했을 때만 지원하고 있다.이에 작년에는 경기도가 양평·가평·김포·파주·연천·양주·동두천·포천 등을 수도권에서 제외해달라는 건의안을 낸 바 있다. 수도권으로 분류되면서 각종 규제를 받아 고용 창출과 투자 유치가 어렵다는 이유에서다.최근 인천상공회의소는 정부에게 국내 복귀 기업 전용 산단 조성 및 공장총량제 등 규제 완화와 해외 진출 대기업의 수도권 복귀 지원 등을 촉구하는 방안을 건의하기도 했다.수도권 규제 완화가 이뤄지면 기업들은 인력 수급과 판매가 쉬운 수도권 지역에 자리를 잡을 수 있고 지자체는 기업 투자를 유치한다는 장점이 있지만 국토균형개발이라는 취지에 어긋날 수 있다는 점은 우려 사항이다. 수도권 규제 관련 기관인 국토교통부 등과의 협의도 필요하다.국내 복귀기업에 지원하는 토지·공장 매입비와 설비 투자금액, 고용보조금 확대도 검토되고 있다. 현재 토지 분양가나 임대료 등 공장 이전비용의 경우 기업별로 최대 40%(최대 5억원), 설비투자 최대 22%를 보조하고 있다.중소 유턴 기업에 지급하는 2년간 1인당 월 60만원의 고용보조금도 금액 확대 또는 지원 기간을 늘리는 방안이 논의될 것으로 예상되고 있다.이에 대해 기재부는 “리쇼어링을 지원하기 위한 방안과 관련해 현시점에서 수도권정비계획법상 공장입지 규제 완화는 검토된 바 없고 그 외 방안도 확정된 바 없다”고 설명했다.이명철 (twomc@edaily.co.kr)＜ⓒ종합 경제정보 미디어 이데일리 - 무단전재 & 재배포 금지＞",/news/news_read.nhn?article_id=0004642350&office_id=018&mode=search&query=현대차&page=1
