head,text,url
,"[아시아경제 전필수 기자]“공부는 안 하니?”하루 종일 집에만 있던 아들이 가장 많은 시간을 보내는 곳은 PC 앞이었다. PC 앞을 떠나면 스마트폰을 보고 있었다. 어릴 때는 놀아야 한다는 지론을 갖고 있었지만 영 불편했다. ‘이 치열한 경쟁 세상에서 저러고 살아갈 수 있을까?’ 하는 걱정은 잔소리로 이어졌다. 어쩌다 일찍 들어오는 아빠의 잔소리에 아들은 대화 거부라는 방식으로 반발했다.이렇게 집안의 냉전이 이어지는 동안 주식시장은 뜨겁게 움직였다. 카카오톡으로 우리 일상을 점령한 카카오가 국내 최대 자동차업체 현대차를 추월했다. 오랜 방학 끝의 개학을 하루 앞둔 지난 26일 카카오는 시가총액 23조5000억원을 기록하며 현대차를 넘어섰다.지난 1분기 카카오의 영업이익은 882억원으로 현대차(8638억원)의 1/10 수준에 불과하다. 하지만 전년 동기 대비 영업이익 증가율은 218.9%나 된다. 현대차는 4.7% 증가에 그쳤다. 그나마 원화 약세에 따른 환율 효과 덕을 봤다. 환율 효과를 제외하면 판매 대수는 오히려 줄었다. 2분기는 신종코로나바이러스감염증(코로나19) 영향으로 더 악화될 가능성이 높다고 한다. 반면 카카오는 ‘언택트’ 시대 최고의 수혜주로 각광 받으며 투자자들이 몰리고 있다. 올 들어 카카오의 주가상승률은 70%나 된다. 같은 기간 현대차는 18% 이상, 코스피는 7% 넘게 하락했다.아이들이 가장 관심 있어 하는 온라인 게임쪽은 성장세 뿐 아니라 이익 규모도 여느 대기업 못지않다. 국내 대표 게임업체 엔씨소프트의 지난 1분기 영업이익은 2414억원이나 된다. 지난해 1분기 799억원보다 203.6%나 이익이 늘었다. 올 1분기 엔씨소프트보다 영업이익이 많은 상장사는 채 스무 곳이 되지 않는다. LG화학, 현대글로비스, 삼성SDS, GS건설, 현대건설 등 국내 굴지의 대기업들이 엔씨소프트보다 영업이익이 적었다.코로나19로 가속화되기는 했지만 대한민국의 산업지형, 부(富)의 지형이 바뀐 것은 어제 오늘의 일은 아니다. 엔씨소프트와 게임업계의 양대산맥인 넥슨의 김정주 대표는 10조원대 주식가치로 이건희 회장 다음 자리를 다툰다. 김 대표와 2위 자리를 놓고 경합을 하는 이는 바이오시밀러 업체 셀트리온의 서정진 회장이다. 현대차를 제친 카카오 창업자 김범수 의장의 지분 가치는 현대차그룹의 정몽구 회장과 정의선 부회장을 합친 것보다 많다.불과 10년 전인 2010년 시총 상위 10개 종목 중 자리를 지키고 있는 곳은 3곳뿐이다. 부동의 1위 삼성전자를 제외하면 LG화학과 현대차 정도만 남아있다. 현대차는 그날의 등락에 따라 10위권에서 탈락하기도 한다. 대신 삼성바이오로직스, 네이버, 셀트리온, 카카오 같은 바이오와 인터넷 업체들이 그 자리를 차지했다. 게임 대장주 엔씨소프트도 14위로 호시탐탐 10위권 진입을 노리고 있다.이렇게 바뀐 시장을 보고 있노라니 주식투자 전도사를 자처하는 존리 메리츠자산운용 사장의 말이 떠올랐다. “아이가 공부는 안 하고 스마트폰만 보고 있어서 고민”이라는 한 어머니에게 존리 사장은 이렇게 답했다고 한다. “아이들이 살아갈 세상은 스마트폰 안에 있을 수 있다. 부모가 과거의 경험에만 의지해 아이들을 재단하면 안 된다.” 세상은 카톡이 자동차보다 비싼 곳으로 변하고 있다. 전필수 기자 philsu@asiae.co.kr <ⓒ경제를 보는 눈, 세계를 보는 창 아시아경제 무단전재 배포금지>",/news/news_read.nhn?article_id=0004687962&office_id=277&mode=search&query=현대차&page=1
최근 인버스 2X ETF 순매수 금액 다시 몰려원유·인버스·레버리지→우량주→인버스 이동시장 상황 적극적 대응 긍정적 시각 속지루한 우량주 투자에 싫증 목소리도,"[서울경제] 박스장이 계속되면서 우량주로 관심을 돌렸던 개인투자자들이 다시 ‘곱버스’에 기웃하고 있다. 시장 상황에 민첩하게 대응하고 있다는 긍정적인 시각도 있는 반면 ‘한방’을 노리는 단기투자 행보를 버리지 못했다는 지적도 나온다. 29일 한국거래소에 따르면 이번 주 들어 28일까지 유가증권시장에서 개인들은 ‘코덱스 200 선물 인버스 2X 상장지수펀드’를 2,228억원 어치를 매수해 순매수 종목 3위에 이름을 올렸다. 카카오 주식을 2,865억원어치 사들여 가장 많았으며 삼성SDI(2,330억원)가 그 뒤를 이었다. ‘곱버스’로 불리는 코덱스 200 선물 인버스 2X ETF에 개인 매수세가 몰린 것은 코스피 지수가 3개월여 만에 2,000포인트를 돌파함에 따라 조정 가능성이 크다고 판단했기 때문으로 보인다. 때마침 코스피 지수의 단기 급등 논란이 벌어짐에 따라 개인들이 지수 하락에 베팅했다는 설명이다. 반면 그동안 꾸준히 사모았던
주식은 주가가 5만원을 넘어서면서 대거 내다 팔고 있다. 대신증권에 따르면 최근 한 달간 개인들이 순매수한 삼성전자의 평균 매수가격은 4만9,000원으로 28일 기준 주가(5만400원)가 손익 분기점을 넘어섰다. 사실 개인 투자자들은 이달 초만 해도 삼성전자 주식을 사는 분위기였다. 전달 원유와 인버스·레버리지 상품에 손을 댔다가 예상과 다른 상황이 전개되면서 손실을 보거나 자금이 묶인 개인들이 다시 장기 투자에 유리한 대형 우량주로 눈을 돌렸다. 하지만 다시 2주 남짓 지나면서 개인들의 투자형태가 급변한 셈이다. 올해 개인들은 시장 상황에 따라 투자 전략을 수시로 바꿔왔다. 3월 급락장까지는 삼성전자와 , 현대차 등 우량주를 중심으로 매수했다. 삼성전자는 1월부터 3월까지 7조8,362억원을 순매수했고 SK하이닉스도 9,245억원을 매집했다. 하지만 4월 들어서는 ‘한방’을 노릴 수 있는 변동성 상품 투자 비중이 높았다. 코덱스 WTI 원유 선물 ETF에 1조2,763억원을 쏟아부었고 곱버스에도 1조1,248억원을 집중했다. 일각에서는 이 같은 개인투자자들의 변심이 시장 상황에 맞게 능수능란하게 대응하는 것이라고 좋게 보기도 하지만 또 다른 한켠에서는 개인들이 ‘대박’의 유혹을 이기지 못하고 분위기에 휩쓸리고 있다는 지적도 나온다. 한 증권사 관계자는 “개인들의 투자 행태가 올 초와는 다소 다르게 나타나고 있는 것이 사실”이라며 “3월 급락장에 투자한 개인들이 최근 상당한 차익 실현을 맛보면서 지루한 우량주 투자에 싫증을 내는 것일 수 있다”고 말했다. /박성호기자 junpark@sedaily.com저작권자 ⓒ 서울경제, 무단 전재 및 재배포 금지",/news/news_read.nhn?article_id=0003745730&office_id=011&mode=search&query=현대차&page=1
국내 매수 상위 7개 수익률 4.73%해외직구는 17.84%…4배 차이,"[아시아경제 오주연 기자] 신종 코로나바이러스감염증(코로나19) 이후의 반등장에서 해외 증시로 눈을 돌린 '주식 직구족(해외주식을 직접 구입하는 개인 투자자)'의 수익률이 국내 증시에 투자한 개인 투자자의 수익률을 크게 앞선 것으로 나타났다.국내외 증시에서 개인이 사들인 순매수 상위 종목 7개의 수익률을 비교한 결과, 평균 수익률이 4배 가까이 차이가 났다. 국내 증시에서는 원유나 코스피지수와 연동해 움직이는 상장지수펀드(ETF)를 대거 사들였는데, 개인들은 거꾸로 투자하면서 평균 수익률을 갉아먹었다. 반면 직구족은 ETF보다 우량 기업을 타깃으로 접근, 순매수 상위 종목 모두 플러스(+) 수익을 기록했다.29일 한국예탁결제원에 따르면 지난달 1일부터 이달 28일까지 개인이 국내 유가증권시장서 가장 많이 매수한 상위 7개 종목의 평균 수익률은 4.73%인 것으로 집계됐다. 같은 기간 해외주식 순매수 상위 7개의 평균 수익률은 17.84%로, 4배가량 높았다.국내 증시에서 개인 순매수 1위와 3위는 'KODEX200선물인버스2X'와 'KODEX WTI원유선물(H)' ETF로 각각 1조2757억원, 1조483억원어치를 사들였다. KODEX200선물인버스2X는 지수가 하락해야 수익이 나고, KODEX WTI원유선물(H)은 국제유가 상승과 연관이 있다. 하지만 2차 하락없이 지속적으로 상승한 코스피는 지난달 1일 1685.46에서 이달 28일 2028.54로 20.36%나 올랐다. 결국 KODEX200선물인버스2X는 -31.88%의 손실을 냈다. 국제유가 반등에 베팅했던 KODEX WTI원유선물(H) 투자자들도 '마이너스 유가'라는 초유의 사태를 겪으며 지난 4월 한 달 수익률이 반토막 났다. 이달 소폭 만회하긴 했지만 4~5월 수익률은 -22.85%다.그나마 개인 순매수 2, 4, 5위인 삼성전자(1조1249억원)와 SK하이닉스(4363억원), 현대차(3523억원)가 각각 10.04%, 7.02%, 15.03%씩 올랐지만 코스피 상승률을 밑도는 수준이다. 순매수 상위 6위인 네이버(NAVER)는 47.55% 급등하면서 체면을 세웠다. 그러나 순매수 규모가 3274억원에 그쳐 다른 순매수 상위 종목에 비해 규모가 크진 않았다.반면 해외주식에 투자한 개인들의 선택은 달랐다. 같은 기간 직구족은 해즈브로(4775억), 마이크로소프트(2318억원), 알파벳(1956억원), 애플(1520억원), 델타항공(1446억원), 월트디즈니(1128억원) 등 우량 종목에 투자했다. 이들 종목은 코로나 이후가 주목되는 ITㆍ소프트웨어, 항공주 등이 대부분을 차지했다. 특히 순매수 1위에 오른 해즈브로가 눈길을 끈다. 해즈브로는 미국의 대표 완구업체로, 코로나 사태로 외부활동이 제한되자 장난감 수요가 증가할 것이라는 기대감에 자금이 몰린 것으로 풀이된다. 이들 종목의 수익률은 모두 플러스를 기록했다. 마이크로소프트는 지난달 1일 155.26달러에서 이달 28일 182.29달러로 19.84% 상승했고, 알파벳과 애플 역시 각각 28.69%, 32.58%씩 올랐다. 워런버핏마저 버린 항공주에서도 개인은 SK하이닉스만큼의 수익을 냈다. 델타항공 수익률은 7.54%였다.개인 손실이 큰 인버스와 원유ETF를 제외해도 국내 투자 수익률이 해외 투자 수익률을 앞지르진 못했다. 국내외 개인 순매수 상위 종목 중 ETF를 각각 제외했을 때 수익률은 국내 17.57%, 해외 19.47%로 2%포인트 정도 차이가 났다.개인들의 해외주식에 대한 관심은 앞으로 더욱 높아질 것으로 보인다. 특히 4차산업 혁신기업들이 많이 상장된 미국과 중국 주식시장을 눈여겨 봐야한다는 분석이 나온다. 김지산 키움증권 리서치센터장은 ""미국은 전세계에서 가장 많은 산업별 1등주를 보유하고 있는 국가로, 혁신산업군 내에서 가장 공격적인 투자가 이뤄지고 높은 시장 점유율을 보유하고 있다""며 ""코로나19 이후에도 시장지배력을 더 강화해나가고 있다""고 분석했다. 그는 이어 ""연말 미국 대선도 있어 경제 회복에 대한 공격적인 지원책과 자국기업 보호가 지속될 전망""이라면서 ""미국과 미국외 지역 간 차별화가 확대될 수 있어 미국 증시의 매력이 부각된다""고 진단했다.정연우 대신증권 리서치센터장은 ""코로나19 충격이 큰 상황이지만, 이에 버금가는 통화ㆍ금융ㆍ재정정책이 줄줄이 쏟아지고 있어 회복도 빠르게 이어갈 수 있을 것""이라면서 ""비대면(언택트) 문화 활성화, IT인프라 구축 등으로 4차산업혁명 진행 속도가 빨라질 것이라는 점을 감안할 때 이미 글로벌 영역에서 주목받고 시장을 선점하고 있는 기업들이 지속적으로 주목받을 것""이라고 기대했다.오주연 기자 moon170@asiae.co.kr <ⓒ경제를 보는 눈, 세계를 보는 창 아시아경제 무단전재 배포금지>",/news/news_read.nhn?article_id=0004687997&office_id=277&mode=search&query=현대차&page=1
▶ 네이버 홈에서 [한국경제TV] 채널 구독하기 [생방송보기]▶ 대한민국 재테크 총집결! - [증권 / 주식상담 / 부동산],"[한국경제TV 김정필 IT벤처팀장]<앵커>4차 산업혁명 시대에 따른 자동화설비 수요 확대, 여기에 코로나19까지 더해지면서 비대면·언택트 생산이 제조업 전반에 뜨거운 화두가 되고 있습니다.국내외 공장들이 ‘셧 다운’을 거듭하는 상황에서 중소강소기업의 스마트팩토리 기술력과 장비가 주목받고 있습니다. 보도에 김정필 기자입니다.<기자>종합 자동화 장비기업 제일에프에이가 미국 앱티브의 요청을 받아 제작한 터미널 커팅 벤딩 금형입니다.수원 산업단지의 이 기업에 글로벌 자율주행 기업 앱티브의 제안이 날아든 건 딱 10년 전.차 부품 생산라인중 커넥터에 필수인 금형을 먼저 봤으면 한다는 요구에 35년 업력의 이 기업은 모든 노하우를 동원해 제작해 보냈고, 앱티브의 반응은 대만족이었습니다.금형에서 시작된 협업은 7개월 뒤 납품으로 이어졌고, 현재 최종 검수가 한창인 온두라스향 장비를 포함해 앱티브 글로벌 체인 공정의 한 켠은 늘 제일에프에이의 차지였습니다.공정에 최소 15명을 투입해야 하지만 설비가 구축되면 관리자 2명만 필요할 뿐, 제조라인에는 오로지 기계들만 분주히 움직이며 가뿐히 작업을 소화해 냅니다.이전에는 5%대였던 불량률도 획기적 수준인 1%대로 줄어드는 등 인건비 절감에 더해 품질, 효율성까지 세 마리 토끼를 잡은 것입니다.현대차와 5조원 규모 자율주행 합작법인을 세운 앱티브의 글로벌 장비투자 계획을 감안하면 제일에프에이의 사업 역시 청신호가 켜진 셈입니다.<인터뷰> 고왕식 / 제일에프에이 대표이사“앱티브와 현대차 그룹이 투자해 미국에 공장 설립하고 거기에 소요되는 전기부분, 센서 부분에 우리가 기여하는 부분 있어서 수혜 기대하고 있습니다”헬스케어 공정 역시 콘텍트렌즈 기업 인터로조에 십 수년째 납품하며 평택 1, 2 공장 검증 완료, 3공장 증축에 따른 스마트팩토리 최적화 진행 등 기술력을 인정받고 있습니다.올해 수주 증가로 200~250억 원 매출이 무난하고 내년 300억 원 돌파, 스마트팩토리가 궤도에 오를 2030년 매출 1000억 원을 목표로 자동화 시대를 대비중 입니다.코로나에 따른 제조공장들의 연이은 셧 다운으로 관련 니즈가 고조되는 사이 공정자동화의 최종 방점인 S/W·솔루션 자체 개발에도 속도를 내며 가시권에 들고 있습니다.<인터뷰> 고왕식 / 제일에프에이 대표이사“소프트웨어 기반으로 그 부분 강화 위해 연구 쪽이나 소프트웨어 쪽 보강을 하고 있습니다. 2~3년 정도면 갖추지 않을 까 싶습니다”‘기계는 거짓말을 하지 않는다’사내 안팎에 새겨 진 문구를 신념으로, 장비 불모지에서 세계로 향하고 있는 기업의 수장은 2년 뒤 기업공개를 기점으로 글로벌 장비메이커 도약이라는 또 다른 35년을 구상중입니다.<인터뷰> 고왕식 / 제일에프에이 대표이사“IPO 통해 안정적인 회사 만들고 세계적인 글로벌 회사로 도약하는 것이 저의 목표입니다.”한국경제TV 김정필입니다.김정필 IT벤처팀장 jpkim@wowtv.co.krⓒ 한국경제TV, 무단 전재 및 재배포 금지",/news/news_read.nhn?article_id=0000874467&office_id=215&mode=search&query=현대차&page=1
수소연료전지차 스택용 금속분리판 수주 확정 및 연말부터 납품 계획,"세종공업이 자회사 세종이브이를 설립하고 충주첨단산업단지 내 수소연료전지차 연료전지 스택(stack)용 금속분리판 생산 시설에 투자하는 등 본격적인 신규 사업에 나선다.세종이브이와 충주시는 29일 충주시청 중앙탑 회의실에서 투자 협약식을 열고 투자를 위한 구체적인 논의에 들어가기로 했다. 행사에는 김기홍 세종공업 대표, 문형규 세종이브이 대표, 조길형 충주시장 등 그룹 주요 임원과 관련 공무원 등 관계 인사들이 자리했다.세종공업은 현대차로부터 수소연료전지차 스택용 금속분리판을 수주했으며, 이번 투자로 세종이브이를 통해 연말부터 본격 생산해 납품할 계획이다. 현대모비스가 오는 2022년까지 연간 4만대 수준의 수소연료전지차용 스택을 생산하는 계획에 대응하는 차원이다. 세종이브이는 충주첨단산업단지 안에 3만9000㎡ 규모의 부지와 6250㎡의 공장시설을 확보함으로써 약 250명의 신규 고용 효과를 창출하게 된다. 이미 수소차 핵심 부품인 수소센서와 압력센서 독점 기술로 친환경 자동차 부품의 기술력을 보유한 세종공업은 수소차 부품 외에도 아센텍, 모비어스앤밸류체인 등의 우량한 자회사를 바탕으로 자율주행 솔루션 등 다양한 분야에서 신성장동력 확보에 나서고 있다. 김기홍 대표는 ""충주시의 수소연료전지차 산업 육성을 위한 적극적인 유치 노력과 우리 세종공업의 신규 사업 시너지 등을 고려해 충주첨단산업단지에 성장 기반을 다지기 위한 투자를 결정했다""며 ""지역의 일자리 창출로 인한 고용 효과를 포함해 친환경 자동차 산업의 중장기 성장을 위해 충주시와 함께 협력해 나갈 것""이라고 말했다.[김경택 기자 kissmaycry@mkinternet.com] [ⓒ 매일경제 & mk.co.kr, 무단전재 및 재배포 금지]",/news/news_read.nhn?article_id=0004584964&office_id=009&mode=search&query=현대차&page=1
보호대상 아동·부상공무원 등 3000명에게 산림치유서비스,"[대전=뉴시스] 김양수 기자 = 산림청 한국산림복지진흥원은 현대차 정몽구 재단과 국립산림치유원 등 산림복지시설 5곳에서 산림복지서비스가 필요한 취약계층을 상대로 '온드림 숲 속 힐링교실'을 운영한다고 29일 밝혔다.대상은 보호대상아동, 교통사고 피해가정과 순직·부상을 당한 소방관·경찰관 가정 등 3000여명이다.힐링교실은 29일부터 10월 25일까지 국립산림치유원(경북 영주·예천), 국립횡성숲체원(강원 횡성), 국립칠곡숲체원(경북 칠곡), 국립장성숲체원 (전남 장성), 국립대전숲체원(대전 유성) 등에서 모두 19차례에 걸쳐 진행된다.특히 보호대상아동은 건강한 사회인으로 발돋움할 수 있도록 금융· 학업·진로 관련 전문교육을, 취약계층 가정은 미래 설정 및 긍정적 사고 향상을 위한 비전 설계 교육과 부모자녀 관계 개선 전문 프로그램 등이 선보인다.이번 캠프는 진흥원이 현대차 정몽구 재단, 한국아동복지협회와 지난 1월 체결한 '보호대상아동 및 취약계층 대상 산림치유를 위한 업무협약'의 후속조치다.복지진흥원 이창재 원장은 ""현대차 정몽구 재단과 협력해 보호대상아동 힐링교실을 운영한지 벌써 만 6년이 됐다""며 ""앞으로도 공익재단과 협업을 통해 산림복지 소외계층에게 맞춤형 산림복지서비스를 지속 제공할 계획""이라고 말했다. kys0505@newsis.com<ⓒ 공감언론 뉴시스통신사. 무단전재-재배포 금지>",/news/news_read.nhn?article_id=0009887940&office_id=003&mode=search&query=현대차&page=1
,"(세종=연합뉴스) 정수연 기자 = 권구훈 북방경제협력위원장은 29일 ""유라시안 경제 회원국(EAEU)과 자유무역협정(FTA) 협상을 올해 안에 개시하는 방안을 추진하겠다""고 밝혔다.

EAEU는 러시아·카자흐스탄·벨라루스·아르메니아· 키르기스스탄 등 구소련 국가들이 참여하는 경제 공동체다.

 권 위원장은 이날 한국외대에서 '신북방정책 한-중앙아시아 협력 성과와 발전 방안'이라는 세미나에서 이같이 밝혔다.

그는 또 ""개발도상국 상황에 맞는 FTA 모델을 구축해 올해 안에 우즈베키스탄과의 FTA 협상을 시작할 것""이라고도 했다.

그는 ""풍부한 천연자원을 보유한 중앙아시아는 한국과의 교역 규모는 작지만, 성장 잠재력을 고려하면 앞으로 교역·투자가 빠르게 커질 여지가 많다""며 ""중앙아시아 국가들이 추진하는 디지털 산업발전전략과 연계한 협력을 확대할 것""이라고 덧붙였다.

대표적으로 투르크메니스탄은 천연가스, 우즈베키스탄은 금, 카자흐스탄은 원유·우라늄을 보유하고 있다.

한국과 중앙아시아 국가들 사이의 교류도 점차 늘어나고 있다. 우즈베키스탄에서는 지난해 한국 병원이 개원했고, 현대차는 카자흐스탄에서 공장을 돌리고 있다.

이날 세미나에서는 신종 코로나바이러스 감염증(코로나19) 이후 한국·중앙아시아 경제협력 과제, 문화교류 발전방안 등에 관한 토론 및 발표가 진행됐다.

jsy@yna.co.kr",/news/news_read.nhn?article_id=0011642973&office_id=001&mode=search&query=현대차&page=1
충주첨단산업단지 내 3만9000㎡ 부지 확보연말부터 생산 및 납품 계획,"[이데일리 박태진 기자] 세종공업(033530)이 자회사 세종이브이를 설립하고 충주첨단산업단지 내 수소연료전지차 연료전지 스택(stack)용 금속분리판 생산 시설에 투자하는 등 본격적인 신규 사업에 나선다.세종이브이와 충주시는 29일 충주시청 중앙탑 회의실에서 투자 협약식을 열고 투자를 위한 구체적인 논의에 들어가기로 했다. 이번 행사에는 세종공업 김기홍 대표, 세종이브이 문형규 대표, 조길형 충주시장 등 그룹 주요 임원과 관련 공무원 등 관계 인사들이 대거 자리했다.세종공업은 현대차(005380)로부터 수소연료전지차 스택용 금속분리판을 수주했으며, 이번 투자로 세종이브이를 통해 연말부터 본격 생산해 납품할 계획이다.현대모비스(012330)가 오는 2022년까지 연간 4만대 수준의 수소연료전지차용 스택을 생산하는 계획에 대응하는 차원이다. 세종이브이는 충주첨단산업단지 안에 3만9000㎡ 규모의 부지와 6250㎡의 공장시설을 확보함으로써 약 250명의 신규 고용 효과를 창출하게 된다. 이미 수소차 핵심 부품인 수소센서와 압력센서 독점 기술로 친환경 자동차 부품의 기술력을 보유한 세종공업은 수소차 부품 외에도 아센텍, 모비어스앤밸류체인 등의 우량한 자회사를 바탕으로 자율주행 솔루션 등 다양한 분야에서 신성장동력 확보에 나서고 있다. 김기홍 세종공업 대표는 “충주시의 수소연료전지차 산업 육성을 위한 적극적인 유치 노력과 우리 세종공업의 신규 사업 시너지 등을 고려해 충주첨단산업단지에 성장 기반을 다지기 위한 투자를 결정했다”며 “지역의 일자리 창출로 인한 고용 효과를 포함해 친환경 자동차 산업의 중장기 성장을 위해 충주시와 함께 협력해 나갈 것”이라고 말했다.조길형 충주시장도 “충주시에 대규모 투자를 결정한 세종공업에 감사하고, 충주시가 수소연료전지차 산업의 메카로 자리매김할 수 있도록 적극적으로 지원하겠다”고 강조했다.박태진 (tjpark@edaily.co.kr)＜ⓒ종합 경제정보 미디어 이데일리 - 무단전재 & 재배포 금지＞",/news/news_read.nhn?article_id=0004651644&office_id=018&mode=search&query=현대차&page=1
