head,text,url
,"[디지털타임스 박정일 기자] 재계가 코로나19 비상체제를 '확산 방지'에서 '경제위기 대응'으로 전환하고 있다. 유럽과 미주의 상황 악화로 글로벌 경제위기 가능성이 높아지자, 이제는 기업 생존을 걱정해야 할 상황에 처했기 때문이다.재계는 특히 실적악화에 자금시장 위축까지 겹치면 유동성에 심각한 문제가 발생할 것을 우려하고 있다. ◇코로나19 '감염 방지'서 '글로벌 경제위기 대응'으로…재택근무 등 최소화= 22일 재계에 따르면 주요 기업들은 코로나19가 팬데믹(세계적 대유행) 상황으로 커지면서 재택근무 등 감염 확산 방지 조치를 최소한으로 유지하면서, 생산차질을 최소화 하는 방향으로 비상경영 체제를 전환하고 있다. 이는 미주와 유럽을 중심으로 한 글로벌 밸류체인에서 심각한 문제가 발생할 수 있다는 우려에서다. 실제로 현대차와 기아차는 코로나19 확진자가 나오면서 미국의 앨라배마와 조지아 공장의 생산을 18일부터 중단했으며, 체코 공장과 슬로바키아 공장은 23일부터 2주간 문을 닫는다.이에 따른 생산 차질을 최소화 하기 위해 현대·기아차는 지난달 27일부터 시작한 국내 현장의 자율 재택근무를 23일부터 중단하기로 했다. 다만, 코로나19 예방을 위해 출근 시간 범위를 오전 8∼10시에서 오전 8∼오후 1시로 넓히고, 필수근무시간(오전 10시∼오후 4시)을 없애는 확대된 유연근무로 전환한다.현대차는 부문별 협업을 강화해서 사업운영 차질을 예방하는 동시에 출퇴근 시간을 최대한 분산해서 직원 접촉을 최소화할 방침이라고 말했다. 코로나19로 자동차 산업이 직격탄을 맞아 비상이 걸린 가운데 효율성을 높여야 할 상황이라고 판단한 것으로 보인다. 현대·기아차는 코로나19 초기부터 종합상황실을 운영해왔다. 초기에는 중국발 부품 공급망 중심으로 대응했지만, 최근에는 미주와 유럽까지 권역별 상황을 파악해서 신속 대응해야 하는 실정이다.SK텔레콤도 지난달 24일부터 시작한 전 직원 재택근무를 23일부터 중단한다. 임신부 등 재택근무가 필요한 일부로 대상을 제한하는 자율적 재택근무로 전환한다. SK이노베이션은 31일까지 재택근무를 연장했지만, 책임자들과 필수 인력들은 정상 출근하고 있으며 재택근무자들도 근무시간을 연장하며 비상 상황에 대응하고 있다.SK하이닉스는 반도체업종 특성에 따라 재택근무를 하지 않았으며 코로나TF를 가동해 주6일 회의 체제를 운영하고 있다. 삼성, LG는 '전사 출근' 체제이지만 임산부나 면역이 취약한 직원들 위주로 재택근무가 이뤄지고 있다. 다만 양 사는 '코로나19 태스크포스(TF)'를 꾸려 전 세계 주요 사업장의 상황과 대응방안 등을 점검하고 있다. ◇회사채 위축 등 '돈 줄 막힐까' 노심초사…정부에 SOS도= 아울러 국내 기업들은 CP와 회사채 시장을 중심으로 신용경색 우려가 나와 자금상황도 긴급 점검에 들어갔다. 최근 CP금리가 치솟으면서 신용경색 조짐이 나타나자 금융위원회는 20일 국내 증권사들과 함께 CP시장 긴급 점검회의를 개최한 바 있다.익명을 요구한 모 대기업 자금 담당자는 ""CP시장 불안이 커지자 현금흐름이 좋은 기업들도 만약을 대비해 CP 발행 여건을 알아보는 태핑(사전 수요조사)에 나선다는 얘기들도 나온다""며 시장이 불안한 상황이라고 전했다.회사채 발행이 위축될 조짐을 보이자 정부는 19일 제1차 비상경제회의에서 채권시장안정펀드를 조성한다는 계획도 밝혔다. 홍남기 부총리는 브리핑에서 ""금융시장이 얼어붙으면 회사채와 주식을 발행해 자금을 조달해야 하는 기업이 돈을 구하지 못하는 '돈맥경화'가 나타난다""면서 ""어려운 시장 상황에서는 누군가 채권을 사서 돈을 순환시키는 역할이 필요하다""고 말했다.앞서 포스코그룹 계열사인 포스파워의 신용등급이 AA-로 우량하지만, 17일 기관투자자를 대상으로 진행한 수요예측에서 발행 목표액을 채우지 못했다. 코로나19 충격이 가장 큰 항공업계는 19일 국적 항공사들이 모여 경영자금 지원 건의안을 정부에 제출하기로 했다. 건의안에는 항공사가 자체 신용으로는 회사채를 발행하기 어렵기 때문에 국책은행의 지급 보증이 선행돼야 한다는 내용이 담겼다.◇이재용 등 총수들도 잰걸음…사기진작+대책회의 분주= 주요 그룹 총수들도 글로벌 경기침체 우려가 커지면서 발걸음이 빨라졌다. 이재용 삼성전자 부회장은 지난 19일 삼성디스플레이 아산사업장을 방문해 생산라인을 점검하고 핵심 투자 분야인 퀀텀닷(QD) 디스플레이 사업을 점검했다.이 부회장은 ""잠시도 멈추면 안 된다. 위기 이후를 내다보는 지혜가 필요하다""며 코로나19 위기 대응과 함께 새로운 성장동력 육성을 강조했다. 이 부회장은 앞서 지난 3일에도 경북 구미사업장을 찾아 스마트폰 생산라인을 점검하는 등 코로나19 사태에 따른 직원들의 동요를 막기 위해 동분서주하고 있다.정의선 현대차그룹 수석부회장과 최태원 SK그룹 회장, 구광모 LG 회장 등도 월례회의와 화상회의 등으로 계열사 별 코로나19 대응상황을 수시로 점검하고 있는 것으로 전해졌다. 아울러 코로나19 치료를 위해 회사 시설을 제공하고 자가격리 중인 임직원에게 건강용품과 응원편지를 보내는 등 직원들 사기 진작을 위해 각별히 신경쓰고 있다. 주요 그룹 총수들은 지난달 13일 서울 세종대로 대한상의에서 열린 '코로나19 경제계 대응 간담회'에도 참석해 문재인 대통령에게 적극적인 지원과 규제 개선 등을 건의했다. 박정일기자 comja77@dt.co.kr 디지털타임스
/",/news/news_read.nhn?article_id=0002589842&office_id=029&mode=search&query=현대차&page=1
,"코로나 19 확산에 따라 재택근무를 했던 대기업들이 글로벌 경제위기 대응을 위해 재택근무를 속속 중단하고 있습니다. 현대·기아차는 지난달 27일부터 시작한 자율 재택근무를 내일(23일)부터 중단하기로 했습니다. 현대차는 다만, 감염 예방을 위해 출근 시간 범위를 오전 8∼10시에서 오전 8∼오후 1시로 넓히고, 필수근무시간(오전 10시∼오후 4시)을 없애는 확대된 유연 근무를 하기로 했습니다. 현대,기아차는 지난 18일부터 미국 앨라바마와 조지아 공장의 생산을 중단한 데 이어 내일부터 2주간 체코공장과 슬로바키아 공장의 문도 닫는 등 해외 공장의 차질이 확대되고 있습니다.
SK텔레콤도 지난달 24일부터 시작한 전 직원 재택근무를 내일부터 중단합니다. 임신부 등 재택근무가 필요한 일부로 대상을 제한하는 자율적 재택근무로 전환하는 것입니다. SK텔레콤은 코로나19 국면의 장기화에 대비해 차별적 서비스 발굴 등을 위해 일부 인력의 재택근무를 중단한다고 밝혔습니다. 아울러 국내 기업들은 CP와 회사채 시장을 중심으로 신용경색 우려가 나와 자금상황도 긴급 점검에 들어갔습니다. 최근 CP 금리가 치솟으면서 신용경색 조짐이 나타나자 금융위원회는 20일 국내 증권사들과 함께 CP 시장 긴급 점검회의를 개최한 바 있습니다.[사진 출처 : 게티이미지]▶ ‘ 코로나19 확산 우려’ 최신 기사 보기http://news.kbs.co.kr/news/list.do?icd=19588▶ ‘코로나19 팩트체크’ 제대로 알아야 이긴다 바로가기http://news.kbs.co.kr/issue/IssueView.do?icd=19589▶ 우리동네에서 무슨일이? KBS지역뉴스 바로가기http://news.kbs.co.kr/local/main.do박대기 기자 (waiting@kbs.co.kr)",/news/news_read.nhn?article_id=0010807405&office_id=056&mode=search&query=현대차&page=1
,"국내외 완성차 업체들이 ‘신차 효과’에 큰 기대를 걸고 있다. 부품 수급과 공장 셧다운 등 코로나19 확산이 몰고온 위기 상황을 신차 판매를 통해 극복하겠다는 것이다. 다만 신차 출시가 판매량을 반짝 올려주는 임시방편에 그칠 수 있어 코로나19 사태 장기화에 제대로 대비해야 한다는 의견도 나온다.22일 국내차 업계를 보면 일단 현대·기아자동차가 신차 출시에 가장 공격적인 행보를 보이고 있다. 주력 모델이 될 신차들의 경우 기존 형식이 아닌 대대적인 온라인 홍보와 출시로 대체하고 있다.현대차는 오는 25일부터 사전계약에 돌입하는 준중형 세단 아반떼의 신형 모델을 지난 18일 공개했다. 마치 스포츠카와 같은 파격적인 디자인이 호평을 받고 있어 기대가 크다. 기아차가 지난 17일 출시한 스포츠유틸리티차량(SUV) 쏘렌토는 사전계약만 2만6000대를 넘기며 인기몰이 중이다. 이밖에 고급 브랜드인 제네시스는 오는 30일 대형 세단 G80을 온라인 출시한다.르노삼성자동차는 국내 첫 쿠페형 SUV로 이름을 알린 XM3가 흥행을 이어가고 있다. 지난 9일 출시한 XM3는 사전계약으로만 8542대를 팔았고, 이날 현재 판매량은 약 1만5000대를 기록했다. 한국지엠은 지난 1월 내놓은 SUV 트레일블레이저에 대한 기대가 크다. 한국GM이 직접 개발부터 생산까지 도맡아 글로벌 신차로 출시했는데, 현재까지 사전계약만 6000대를 넘은 것으로 알려졌다.수입차 업계도 꾸준히 신차를 내놓고 있다. 폭스바겐은 이달 초 티구안 신형 모델을, BMW가 320i와 530e M 스포츠팩을 출시했다. 캐딜락은 지난 16일 대형 SUV인 XT6에 이어 상반기 2~3개의 신차를 추가로 출시할 계획이다.자동차 시장에서 얼어붙은 소비자의 구매심리를 그나마 자극할 수 있는 것은 결국 새 상품인 ‘신차’를 내놓은 것이다. 업계 한 관계자는 “최근 공개된 차량들은 출시와 함께 큰 관심을 받고 있으며, 실제 판매로도 이어지고 있다”며 “신차 출시가 코로나19로 주요 공장들이 멈추는 어려운 상황을 이겨내는데 도움을 줄 것”이라고 말했다.다만 신차 효과는 그 기간이 짧다는 게 한계다. 특히 경쟁 모델이 출시될 경우 일시적인 판매 증가 현상이 멈추는 경우도 많다. 이 관계자는 “생산에 차질을 줄 수 있는 해외 자동차 공장의 가동 여부와 주력시장의 상황을 예의주시하면서 비대면 마케팅을 강화하는 방안을 구상하고 있다”고 밝혔다.박구인 기자 captain@kmib.co.krGoodNews paper ⓒ , 무단전재 및 재배포금지",/news/news_read.nhn?article_id=0001302225&office_id=005&mode=search&query=현대차&page=1
"車 생산 급감 연쇄도산 위기에""손실 메꾸려 연장근로 불가피""울산시 시도協에 제안했지만`노조 눈치` 일부 지자체 외면""재난기본소득 도입에만 관심위기산업 살리기 무관심"" 비판","코로나19 사태가 확산하면서 연쇄적 부실·도산 위기에 처한 자동차 부품 업계를 지원하기 위해 울산시가 '주 52시간 근무제 한시 유예'를 추진했으나 일부 지방자치단체 반대로 무산됐다. 일각에서는 지자체들이 현금성 복지 정책인 재난기본소득 도입에 적극적인 목소리를 내는 데 비해 위기에 처한 산업체 지원엔 무관심하다고 지적한다. 울산시는 최근 코로나19로 인해 발생한 생산 차질을 만회하기 위해 '근로시간 연장이 필요하다'는 자동차·자동차 부품 업계 요구를 받아들여 '자동차업종 주 52시간 근무제 한시적 유예 방안' 시행을 추진했다. 울산시는 이 방안을 17개 시도지사 공동 명의로 정부에 건의하기 위해 시도지사협의회에 대정부 안건 채택을 제안하고 의견 조율에 나섰다.
시도지사협의회는 17개 시도에 공문을 보내 해당 안건에 대한 의견을 조회했으나 반대 의견이 나와 울산시 계획에 제동이 걸렸다. 협의회 안건은 만장일치로 찬성해야 채택하는 시스템 때문이다. 울산시는 수정안 제출 등 후속 조치를 검토 중이지만 사실상 시도 차원에서 추진은 쉽지 않을 전망이다.협의회 소식에 정통한 관계자에 따르면 이번 안건을 제안한 울산시를 포함해 지자체 13곳은 동의했고, 3곳은 노사 합의 요구 등 조건부로 동의했다. 하지만 경기도가 동의하지 않는다는 입장을 내면서 '만장일치' 방식에 따라 안건 채택이 무산된 것으로 전해졌다. 이재명 경기도지사는 코로나19로 인한 경제위기 극복을 위해 재난기본소득 도입에는 적극 찬성하는 입장이다.울산시 제안은 산업계에서 호응을 얻었으나 현 정부의 핵심 노동 정책에 반하는 데다 노동계 반발이 예상돼 애초부터 회의적인 시각이 적지 않았다. 민주노총 울산본부는 ""잘 팔리는 몇몇 모델 생산을 위해 자동차 산업 전체로 '주 52시간 유예'를 확대하겠다는 것은 '주 52시간 제도' 무력화를 위한 꼼수""라고 주장했다.자동차 업계는 근로시간 연장과 관련해 정부는 물론 지방정부의 지원을 받는 것도 불가능해지자 기업별로 '특별연장근로' 인가 절차를 밟는 등 자구책 마련에 나섰다. 현대차 울산공장이 있는 울산 북구의 자동차 부품 업체 38곳 대표는 지난 20일 이동권 울산 북구청장을 통해 고용노동부와 현대차에 '완성차 특별연장근로 시행을 위한 탄원서'를 전달했다.자동차 부품 업체들은 ""현대차 울산공장이 코로나19로 세 차례나 가동을 중단하면서 8만대분의 부품을 납품하지 못했다""며 ""납품 손실분을 만회하기 위해선 완성차뿐 아니라 부품사 가동률도 높여야 하는데 현재 주 52시간 근무제로는 불가능하다""고 토로했다.앞서 지난 18일 현대차는 최근 현대차 노조에 최대 주 60시간 근무 도입을 제안했고, 현대차 노사는 실무협의를 진행 중이다. 현대차는 코로나19 사태로 공장 가동이 중단돼 10만대에 이르는 생산 손실을 본 것으로 알려졌다. 2월 생산량이 절반으로 급감하면서 그랜저와 GV80 등 현대차 인기 차종은 4개월을 기다려야 신차를 받을 수 있다.이제 공은 노동당국으로 넘어갔다. 고용부가 특별연장근로를 인가해주면 기업은 최대 4주까지 근로시간을 연장할 수 있다. 다만 특별연장근로는 근로자 개개인의 동의를 구해야 하고, 같은 업종이라도 업체마다 개별적으로 인가를 받아야 하는 게 난점이다. 특정 업종의 모든 기업에 일괄 적용하는 '주 52시간 한시 유예 방안'과도 차이가 있다.[울산 = 서대현 기자] [ⓒ 매일경제 & mk.co.kr, 무단전재 및 재배포 금지]",/news/news_read.nhn?article_id=0004541407&office_id=009&mode=search&query=현대차&page=1
현대차 美 앨라배마 공장가동중단 이달말까지 연장,"이스타항공이 국적 항공사 중 처음으로 '셧다운' 한다. 22일 항공업계에 따르면 이스타항공은 3월 24일부터 4월 25일까지 김포·청주·군산∼제주 노선의 운항을 중단하기로 했다. 코로나19 확산에 따른 일본 정부의 입국 강화 조치로 지난 9일부터 일본 노선의 운항을 접으며 국제선 운항을 중단한 데 이어 남아 있던 국내선까지 운항을 중단하기로 한 것이다. 국적 항공사 중 코로나19 여파로 국제선과 국내선 운항을 모두 접고 셧다운에 들어가는 것은 이스타항공이 처음이다. 이스타항공 관계자는 ""여객 수요가 급감해 비행기를 띄울수록 손해""라며 ""피해를 최소화하기 위해 한 달간 셧다운하는 게 낫다고 판단했다""고 설명했다. 이스타항공은 예약한 승객 중 항공편 이용을 희망하는 승객을 위해 인수기업인 제주항공의 항공편을 대체편으로 마련하기로 했다. 북미에서 코로나19 감염이 급증하고 현지 공장에서도 확진자가 1명 발생한 가운데 현대자동차가 미국 앨라배마공장(HMMA)의 조업 중단(셧다운) 기간을 이달 말까지 연장하기로 했다. HMMA는 21일(현지시간) 성명에서 이같이 밝히며 공장이 다음달 1일 생산을 재개한다고 발표했다. HMMA는 엔진 생산라인에서 근무하던 직원 한 명이 코로나19 양성 반응을 보이자 지난 18일부터 22일까지 셧다운하기로 했다. 하지만 상황이 악화하고 앨라배마주 정부가 학교와 탁아소를 닫기로 하자 감염 확산을 방지하고 근로자들의 원활한 가사와 육아를 돕기 위해 23일부터 31일까지 추가 셧다운을 결정했다.
[원호섭 기자 / 이종혁 기자] [ⓒ 매일경제 & mk.co.kr, 무단전재 및 재배포 금지]",/news/news_read.nhn?article_id=0004541420&office_id=009&mode=search&query=현대차&page=1
,"현대자동차그룹은 최근 국내 공식 유튜브 계정을 통해 공개한 브랜드 캠페인 영상 ‘내일을 향합니다’(Next Awaits)가 조회 수 100만 건을 넘겼다고 22일 밝혔다.이 영상은 약 2분 길이로, 현대차그룹의 역사를 현재에서 과거로 역순으로 조명하고 있다. 수소 전기차 넥쏘가 횡단보도 앞에 멈추는 장면에서 시작, 시간을 거슬러 투싼, 티뷰론, 스텔라 등 과거 차종을 차례대로 비추고 1974년 토리노 모터쇼에서 포니를 공개하는 장면에 도달한다. 포니는 한국 최초의 승용차 고유 모델이며, 에콰도르를 시작으로 해외에 수출돼 한국을 자동차 수출국 반열에 올려놓은 차다.이후 영상은 포니가 컨테이너 안으로 들어가면서 무역선이 건조되는 장면으로 넘어간다. 자동차를 수출하기 위해 배를 만들면서 한국 조선업이 발전했음을 보여주는 장면이다. 또 영상 속 다리 건설 현장과 뜨거운 용광로에서 철을 생산하는 장면, 도로 건설을 지휘하는 창업주의 뒷모습 등은 한국 경제가 빠르게 발전할 수 있도록 힘을 보탠 고 정주명 명예회장을 반추해 볼 수 있는 대목이라고 현대차는 밝혔다.현대차에 따르면 이 영상은 지난해 9월 현대차 유럽권역 본부가 기획·제작, 유럽에서 처음 공개됐고 지난해 말 다른 지역으로 공개를 확대하기 시작했다. 제작을 맡은 영화감독 단테 아리올라는 정 명예회장의 영문 평전을 바탕으로 스토리를 구성했다.현대차그룹 관계자는 “단순히 신차를 노출해 브랜드 인지도를 높이는 기존 마케팅 방식에서 벗어나, 유럽에 현대차그룹의 기원과 성장 과정을 알리고 ‘인류를 위한 진보’라는 브랜드 핵심가치를 소개하려 노력했다”고 말했다. 김성훈 기자[Copyrightⓒmunhwa.com '대한민국 오후를 여는 유일석간 문화일보' 무단 전재 및 재배포 금지()]",/news/news_read.nhn?article_id=0002421689&office_id=021&mode=search&query=현대차&page=1
현대·기아차는 재택근무 중단,"기업들이 신종 코로나바이러스 감염증(코로나19) 사태로 도입했던 재택근무를 속속 중단하고 있다. 그동안 임직원 안전과 국내 사업장 셧다운(일시 가동 중단) 방지를 최우선 순위에 두고 대응해왔지만, 글로벌 경제위기가 눈앞에 닥쳐오면서 재택근무로는 대처에 한계가 있다고 판단했기 때문이다.22일 산업계에 따르면 현대·기아자동차는 지난달 27일부터 시작한 자율 재택근무제를 23일부터 중단하기로 했다. 그 대신 코로나19 예방을 위해 출근시간 범위를 오전 8∼10시에서 오전 8시∼오후 1시로 넓힌다. 필수 근무시간(오전 10시~오후 4시)도 없애 근무시간을 유연하게 조정할 방침이다. 현대차 관계자는 “부문별 협업을 강화해 사업 운영 차질을 막는 동시에 출퇴근 시간을 최대한 분산해 직원 접촉을 최소화할 것”이라고 말했다.SK그룹은 핵심 계열사들이 어려운 상황에 처하자 위기 경영 체제를 강화하기로 했다. 최태원 회장은 이번주 초 주요 계열사가 참여하는 그룹 경영대책회의를 준비하도록 지시한 것으로 전해졌다. SK이노베이션은 국제 유가 폭락으로 원유 재고평가손실이 커지면서 1분기(1~3월)에 대규모 적자를 낼 가능성이 높아지자 바짝 긴장하고 있다. 배터리 부문도 글로벌 완성차 업체들의 생산 차질로 여건이 녹록지 않은 상황이다.삼성전자는 국내 사업장 안전을 중심에 뒀던 ‘코로나19 태스크포스(TF)’의 역할을 해외 사업장까지 확대하고 글로벌 경제위기 대응 방안도 마련 중인 것으로 알려졌다.최만수/홍윤정 기자 bebop@hankyung.com▶ ▶
 ▶
ⓒ 한국경제 & , 무단전재 및 재배포 금지",/news/news_read.nhn?article_id=0004311254&office_id=015&mode=search&query=현대차&page=1
