title,url,press,summary,date
"DB손보, ‘가족사랑 우체통’ 및 인스타그램 이벤트",/news/news_read.nhn?article_id=0004597041&office_id=018&mode=search&query=카카오&page=1,이데일리,"참여 방법은 DB손해보험 가족사랑 사이트에 접속한 뒤 가족사랑 우체통에서 보내고 싶은 가족들에게 카카오톡, 페이스북, 이메일의 3가지 전송방법을...",2020-03-13 17:25
"한국기업지배구조원 ""한진칼 조원태 회장 연임 찬성""",/news/news_read.nhn?article_id=0004306113&office_id=015&mode=search&query=카카오&page=1,한국경제,"00%), 카카오(1.00%) 등이 보유한 33.45%다. 양측이 확보한 지분율이 거의 비슷하다.... 9%를 추가하며 맞불을 놨다. 카카오도 ...",2020-03-13 17:25
"인테리어베이, 화이트데이 맞아 `해피 화이트데이` 진행…스타벅스 기프티콘 증정",/news/news_read.nhn?article_id=0002588634&office_id=029&mode=search&query=카카오&page=1,디지털타임스,"후, 카카오톡 검색창에 '@인테리어베이'를 검색해 채널을 추가해야 한다. 채널 내... 선착순 기준은 3월 14일 자정부터 카카오톡 인증 오는 ...",2020-03-13 17:58
접속만해도 고급 아이템이 팡팡팡..게임업계 화이트데이 이벤트 풍성,/news/news_read.nhn?article_id=0004389636&office_id=014&mode=search&query=카카오&page=1,파이낸셜뉴스,카카오게임즈 모바일 MMORPG '테라 클래식'에서는 오는 25일까지 화이트데이 이벤트를 진행한다. 누적 출석 일수에 따라 '고급 펫 성장 지원...,2020-03-13 18:04
"13일, 기관 거래소에서 삼성전자(-1.67%), SK하이닉스(-0.36%) 등 ...",/news/news_read.nhn?article_id=0004306170&office_id=015&mode=search&query=카카오&page=1,한국경제,"코스닥150선물인버스, 카카오, 삼성전기등이다. 이중에 전기,전자 업종에 속한 종목이 5개 포함되어 있다. KODEX 200선물인버스2X, KO...",2020-03-13 18:36
"DB손보, '가족사랑 우체통' 이벤트…""고마운 마음 전하세요""",/news/news_read.nhn?article_id=0004642493&office_id=277&mode=search&query=카카오&page=1,아시아경제,"참여 방법은 DB손해보험 가족사랑 사이트에 접속한 뒤 가족사랑 우체통에서 보내고 싶은 가족들에게 카카오톡, 페이스북, 이메일의 3가지 전송방법을...",2020-03-13 18:43
"지배구조원 ""한진칼 경영진 교체 부적절, 반면 3자연합은...""",/news/news_read.nhn?article_id=0004375683&office_id=008&mode=search&query=카카오&page=1,머니투데이,"━ 팽팽한 양측 지분율, 지분매집 경쟁 지속 중 ━ 현재 조 회장 측은 이명희 정석기업 고문과 조현민 한진칼 전무 등 총수일가의 지분 22.45...",2020-03-13 19:30
조원태 손들어준 국민연금 의결권 자문사 한진 회장 연임 찬성,/news/news_read.nhn?article_id=0000485991&office_id=366&mode=search&query=카카오&page=1,조선비즈,"00%), 카카오(1.00%) 등 총 33.45%다. 양 측의 지분이 팽팽히 맞서고 있는 상황에서... 이에 대항해 조 회장의 우군으로 분류되는...",2020-03-13 19:44
"한국기업지배구조원 ""조원태 재선임에 찬성표 던져라""",/news/news_read.nhn?article_id=0001648361&office_id=016&mode=search&query=카카오&page=1,헤럴드경제,"조 회장 측 우호지분은 조 회장(지분율 6.52%), 어머니인 이명희 정석기업 고문(5.31%), 동생 조현민 한진칼 전무(6.47%), 특수관...",2020-03-13 19:50
"한국예탁결제원, 카카오 등 477개사 3월 셋째 주 전자투표 이용",/news/news_read.nhn?article_id=0004642508&office_id=277&mode=search&query=카카오&page=1,아시아경제,"오는 15일 카카오, 신세계, 한화 등이 전자투표 시스템을 열고, 16일부터는 신한금융지주, SK이노베이션 등이 전자투표 이용을 시작한다. 또 ...",2020-03-13 20:25
카카오·신세계·신한금융 등 477개사 다음주 전자투표 실시,/news/news_read.nhn?article_id=0001648366&office_id=016&mode=search&query=카카오&page=1,헤럴드경제,"카카오·신세계·한화·현대백화점 등은 15일부터, 신한지주·SK이노베이션 등은 16일부터 전자투표와 전자위임장 이용을 개시한다. 17일부터는 한국...",2020-03-13 20:34
카카오 등 477곳 3월 셋째주 전자투표 이용,/news/news_read.nhn?article_id=0002388974&office_id=119&mode=search&query=카카오&page=1,데일리안,"오는 15일 카카오, 신세계, 한화, 현대백화점 등이 전자투표 시스템을 열고, 16일부터는 신한금융지주, SK이노베이션 등이 전자투표 이용을 시...",2020-03-13 20:48
"국민연금 의결권 자문사, ""조원태 한진 회장 연임 찬성""",/news/news_read.nhn?article_id=0004389667&office_id=014&mode=search&query=카카오&page=1,파이낸셜뉴스,"00%), 카카오(1.00%) 등 총 33.45%다. 이에 맞서 3자 연합 측은 KCGI 17.29%, 반도건설 8.28... 9%까지 늘렸고 ...",2020-03-13 22:23
