title,url,press,summary,date
"""집 밖은 위험해"" 코로나19가 바꾼 소비…언택트 마케팅 속도내는 카드사",/news/news_read.nhn?article_id=0000018767&office_id=629&mode=search&query=카카오&page=4,더팩트,"디지털 러버는 삼성페이와 네이버페이, 카카오페이, SSG페이, 스마일페이, 쿠페이에서 사용할 경우 결제금액의 5%를 매월 1만 원까지 할인하는 ...",2020-03-13 00:00
줄잇는 #기부-기브티콘… ‘2020년판 金 모으기’,/news/news_read.nhn?article_id=0003275051&office_id=020&mode=search&query=카카오&page=4,동아일보,○ 카톡 이모티콘 판매 기부금 2억 넘어 국내 최대 정보기술(IT) 플랫폼인 네이버와 카카오를 통한 소액 기부도 이어지고 있다. 카카오가 이모티...,2020-03-13 03:04
[유가증권 메모] (13일) 보통주추가상장=카카오(전환),/news/news_read.nhn?article_id=0004305689&office_id=015&mode=search&query=카카오&page=4,한국경제,◇보통주추가상장=카카오(전환) 카카오(스톡옵션행사),2020-03-13 03:41
3월 주총에 올인한다지만...조원태 vs 조현아 장기전 가나,/news/news_read.nhn?article_id=0002388752&office_id=119&mode=search&query=카카오&page=4,데일리안,"이로써 조 회장측은 조 전 부사장을 제외한 총수 일가 지분(22.45%), 델타항공(14.9%), 카카오(2%), 대한항공 자가보험·사우회·우리...",2020-03-13 05:00
"'이커머스 공룡' 이베이… 몸값만 '5조', 누가 먹을까",/news/news_read.nhn?article_id=0000517224&office_id=417&mode=search&query=카카오&page=4,머니S,"이베이코리아 매각설이 나오면서 기존 유통업체(롯데쇼핑, 신세계, 이마트, 현대백화점)뿐 아니라 네이버, 카카오와 같은 인터넷 기업군, 최근 전자...",2020-03-13 05:18
'하필 데뷔때 코로나19가'…새내기주 혹독한 신고식,/news/news_read.nhn?article_id=0004596474&office_id=018&mode=search&query=카카오&page=4,이데일리,"IPO대어로 꼽히는 SK바이오팜, 호텔롯데, 카카오뱅크, 현대카드, 빅히트엔터테인먼트 등의 상장이 미뤄지는 것 아니냐는 우려도 나온다. 한 코스...",2020-03-13 06:01
"[클릭 e종목] 1분기 숨고른 카카오, 2분기부터 또 달린다",/news/news_read.nhn?article_id=0004641947&office_id=277&mode=search&query=카카오&page=4,아시아경제,카카오의 올해 1분기 실적이 전 분기 대비 소폭 줄었다. 하지만 이는 일시적인... 2분기부터는 카카오페이의 증권업 확대 등 각 분야에서 다시 ...,2020-03-13 08:12
"신한금투 ""선데이토즈, 신규 게임 론칭 주목""",/news/news_read.nhn?article_id=0009754569&office_id=003&mode=search&query=카카오&page=4,뉴시스,"오강호 신한금융투자 연구원은 ""선데이토즈는 카카오 플랫폼을 활용해 모바일 게임 서비스를 제공하고 있다""며 ""주요 콘텐츠로는 '애니팡', '위베어...",2020-03-13 08:33
"[Hot-Line] ""카카오, 1분기 숨고르기 예상""…목표가↓",/news/news_read.nhn?article_id=0004535672&office_id=009&mode=search&query=카카오&page=4,매일경제,이베스트투자증권은 13일 카카오에 대해 1분기 실적이 시장추정치를 밑돌 것으로 전망했다. 투자의견은 '매수'를 유지하나 목표주가는 기존 23만원...,2020-03-13 08:58
[생활 경제] 병원방문 멈칫하자 가정상비약 특수,/news/news_read.nhn?article_id=0000027499&office_id=037&mode=search&query=카카오&page=4,주간동아,"2월 말에는 카카오톡 상에서 코로나19 대비 상비약 리스트가 돌았는데, 여기에는 진료소에 갔다가 감염되는 사례가 늘어나는 상황에서 집에 상비약을...",2020-03-13 09:02
코로나19.... '이재용 부회장' 리더십 빛났다,/news/news_read.nhn?article_id=0003446761&office_id=022&mode=search&query=카카오&page=4,세계일보,13일 글로벌빅데이터연구소는 뉴스·커뮤니티·블로그·카페·유튜브·트위터·인스타그램·페이스북·카카오스토리·지식인·기업·조직·정부·공공 등 12개 채...,2020-03-13 09:31
SNS서 '한진그룹 지키기' 운동이 활발해진 이유는,/news/news_read.nhn?article_id=0000529514&office_id=031&mode=search&query=카카오&page=4,아이뉴스24,13일 업계에 따르면 지난 3일 '한진을 지지하는 사람들의 모임' 제목으로 개설된 카카오톡 오픈 채팅방은 현재까지 110여 명이 넘는 참석자들이...,2020-03-13 09:32
한진칼 주총 앞두고 SNS서 한진그룹 지키기 운동 활발,/news/news_read.nhn?article_id=0002388802&office_id=119&mode=search&query=카카오&page=4,데일리안,13일 한진그룹에 따르면 지난 3일 ‘한진을 지지하는 사람들의 모임’ 제목으로 개설된 카카오톡 오픈 채팅방은 이날 현재 110여명이 넘게 참석하...,2020-03-13 09:34
"뮤 테누토, 화이트데이 맞이 이벤트 진행… 오스트리아 비엔나월드 정품 에코백 및 ...",/news/news_read.nhn?article_id=0000517321&office_id=417&mode=search&query=카카오&page=4,머니S,뮤 테누토는 쇼팽의 곡에서 영감을 받은 베르쇠즈 모이스처라이징 자장가 케어 라인을 체험할 수 있는 체험 샘플과 뮤 테누토 카카오톡 플러스 친구를...,2020-03-13 09:49
"코핀 커뮤니케이션즈, 인기 웹소설 ‘아이딘’ OSMU 추진",/news/news_read.nhn?article_id=0004305793&office_id=015&mode=search&query=카카오&page=4,한국경제,"네이버 시리즈 로판(로맨스 판타지) 부문에서 1위를 기록하였으며, 카카오페이지... 올해에만 카카오페이지, 네이버, 봄툰 등 여러 웹툰 플랫폼에...",2020-03-13 09:52
"후지필름, 카카오톡 채널 오픈 기념 이벤트 실시",/news/news_read.nhn?article_id=0004520143&office_id=421&mode=search&query=카카오&page=4,뉴스1,공식 카카오톡 채널을 오픈을 기념해 '우리 친구해요!' 이벤트를 실시하고 구독자들에게 경품을 증정한다고 13일 밝혔다. 한국후지필름은 이달 31...,2020-03-13 09:56
한진칼 주총 앞두고 SNS에서는 한진그룹 지키기 운동 만들어져,/news/news_read.nhn?article_id=0000636047&office_id=468&mode=search&query=카카오&page=4,스포츠서울,지난 3월 3일 ‘한진을 지지하는 사람들의 모임’ 제목으로 개설된 카카오톡 오픈 채팅방은 13일 현재 110여 명이 넘는 참석자들이 ‘조현아 3...,2020-03-13 09:59
"5대 그룹 총수들, 코로나19 위기 극복 동참...'이재용 부회장' 리더십 빛났다",/news/news_read.nhn?article_id=0009754866&office_id=003&mode=search&query=카카오&page=4,뉴시스,13일 글로벌빅데이터연구소(소장 김다솜)는 뉴스·커뮤니티·블로그·카페·유튜브·트위터·인스타그램·페이스북·카카오스토리·지식인·기업/조직·정부/공공...,2020-03-13 10:17
"한진 전현직 임직원 등 '한진그룹 지키기' 운동, SNS에서 활발",/news/news_read.nhn?article_id=0009754895&office_id=003&mode=search&query=카카오&page=3,뉴시스,지난 3월 3일 ‘한진을 지지하는 사람들의 모임’ 제목으로 개설된 카카오톡 오픈 채팅방은 13일 현재 110여 명이 넘는 참석자들이 ‘조현아 3...,2020-03-13 10:24
"빙그레, 대세 '유산슬·펭수' 잡고 시장 1위 롯데제과 제친다",/news/news_read.nhn?article_id=0000529536&office_id=031&mode=search&query=카카오&page=3,아이뉴스24,'카카오톡 선물하기'를 통해 판매한 펭수 스페셜 패키지 세트는 3일간 선물하기 베스트 1위에 오르기도 했다. 펭수가 등장한 온라인 광고 영상도 ...,2020-03-13 10:27
[5스타전략] 코로나19 팬데믹 충격 발 국내증시 급락,/news/news_read.nhn?article_id=0000207149&office_id=374&mode=search&query=카카오&page=3,SBS CNBC,5STAR 회원 가입 후 MTS 서비스인 종목 추천 & 투자전략을 일주일간 무료체험 받을 수 있는 카카오톡 플러스친구 이벤트 진행 중입니다. 자...,2020-03-13 10:37
"한진 임직원들 주총 앞두고 SNS서 ""우리 회사 지키자"" 아이디어 공유",/news/news_read.nhn?article_id=0004389312&office_id=014&mode=search&query=카카오&page=3,파이낸셜뉴스,13일 업계에 따르면 지난 3일 '한진을 지지하는 사람들의 모임'이란 제목으로 개설된 카카오톡 오픈 채팅방에는 현재 110여명이 넘는 참석자들이...,2020-03-13 10:40
"'경영권 분쟁' 한진칼, 주총 앞두고 임직원 똘똘 뭉쳤다",/news/news_read.nhn?article_id=0004596720&office_id=018&mode=search&query=카카오&page=3,이데일리,‘한진을 지지하는 사람들의 모임’ 카카오톡 오픈 채팅방[이데일리 이승현 기자]... 지난 3일 ‘한진을 지지하는 사람들의 모임’ 제목으로 개설된...,2020-03-13 10:49
"세종청사 초유의 '3교대 재택근무'…""어떻게든 정책 이어가야죠""",/news/news_read.nhn?article_id=0011470233&office_id=001&mode=search&query=카카오&page=3,연합뉴스,사무실 자리 전화는 휴대전화로 착신전환해놓고 카카오톡 등으로 부서원간 업무 연락을 하며 사무실과 같은 근무 환경을 만들려 하지만 공무원들은 다들...,2020-03-13 10:59
"""한진칼 10주라도 사자"" 한진 전현직 임직원 SNS서 '한진 지키기' 운동 확산",/news/news_read.nhn?article_id=0000018822&office_id=629&mode=search&query=카카오&page=3,더팩트,13일 업계와 한진그룹에 따르면 지난 3일 '한진을 지지하는 사람들의 모임'이라는 제목으로 개설된 카카오톡 오픈 채팅방은 이날 기준 참석자 수가...,2020-03-13 11:04
"""조원태 지지"" SNS서 '한진그룹 지키기 운동' 활발",/news/news_read.nhn?article_id=0004520435&office_id=421&mode=search&query=카카오&page=3,뉴스1,"13일 관련 업계에 따르면, 지난 3일 '한진을 지지하는 사람들의 모임' 제목으로 개설된 카카오톡 오픈 채팅방은 이날 현재 110여 명이 넘는 ...",2020-03-13 11:07
"""한진그룹을 지키자""…카카오톡에 퍼지는 조원태 지지 목소리",/news/news_read.nhn?article_id=0001648082&office_id=016&mode=search&query=카카오&page=3,헤럴드경제,13일 항공업계에 따르면 이달 3일 카카오톡에는 ‘한진을 지지하는 사람들의 모임’ 제목으로 오픈 채팅방이 개설됐다. 대화명 '첫사랑'이 개설한 ...,2020-03-13 11:09
"세종청사 초유의 '3교대 재택근무'…""어떻게든 정책 이어가야죠""",/news/news_read.nhn?article_id=0000800063&office_id=055&mode=search&query=카카오&page=3,SBS,사무실 자리 전화는 휴대전화로 착신전환해놓고 카카오톡 등으로 부서원간 업무 연락을 하며 사무실과 같은 근무 환경을 만들려 하지만 공무원들은 다들...,2020-03-13 11:15
"액션스퀘어, 감사보고서 ‘적정’ 받아 ""글로벌 게임 출시로 실적 개선 기대""",/news/news_read.nhn?article_id=0004375307&office_id=008&mode=search&query=카카오&page=3,머니투데이,“올해는 카카오에서 서비스하고 있는 ‘블레이드2 for kakao’의 IP(지적재산권) 사용료가 매출로 인식되고 ‘삼국블레이드’의 글로벌 출시가 예정돼 있어 실적...,2020-03-13 11:19
"캐롯손보, 성장 주도할 핵심 인재 영입 박차",/news/news_read.nhn?article_id=0001648139&office_id=016&mode=search&query=카카오&page=3,헤럴드경제,13일 캐롯손보에 따르면 카카오 초대 커머스-페이먼트 총괄 사업부장을 역임한 박관수 상무가 최근 카카오 인베스트먼트에서 퇴사하면서 캐롯손해보험....,2020-03-13 11:25
한진그룹 경영권 분쟁에…임직원 SNS서 '한진 지키기 운동',/news/news_read.nhn?article_id=0004642202&office_id=277&mode=search&query=카카오&page=3,아시아경제,13일 업계에 따르면 지난 3일 카카오톡엔 '한진을 지지하는 사람들의 모임'이라는 제목의 오픈 채팅방이 개설됐다. 해당 채팅방엔 현재까지 약 1...,2020-03-13 11:30
YBM B&C ‘일상티콘 레벨 UP! 파워퍼프걸!’ 카카오톡 이모티콘 출시,/news/news_read.nhn?article_id=0004520594&office_id=421&mode=search&query=카카오&page=3,뉴스1,Girls)’의 카카오톡 이모티콘을 출시한다. 이번에 출시된 ‘일상티콘 레벨 UP!... ‘정말?’ ‘울지 않아!’ ‘감사합니다’ 등 카카오톡 ...,2020-03-13 11:48
"""회사 지키자"" SNS서 뭉친 한진 직원들",/news/news_read.nhn?article_id=0003709185&office_id=011&mode=search&query=카카오&page=3,서울경제,13일 한진그룹에 따르면 지난 3일 ‘한진을 지지하는 사람들의 모임’ 제목으로 개설된 카카오톡 오픈 채팅방에 110여명이 넘는 참석자들이 조현아...,2020-03-13 11:58
"식품업계 온라인, 배달로 화이트데이 사랑 전해요",/news/news_read.nhn?article_id=0003446827&office_id=022&mode=search&query=카카오&page=3,세계일보,카카오페이와의 제휴를 통한 프로모션도 진행한다. 오는 15일까지 카카오 페이머니를 통해 구매하는 소비자들은 최대 1만원의 혜택을 받을 수 있다. 1만원 이상 결제...,2020-03-13 12:01
국내증시 '대폭락' 검은 금요일 장…장중 8% 급락세,/news/news_read.nhn?article_id=0001022476&office_id=214&mode=search&query=카카오&page=3,MBC,"시가총액 상위 종목 살펴보면 거의 모든 종목이 내리고 있는 가운데 1분기 실적 부진 전망에 카카오와 롯데 하이마트가 3거래일째 하락하고 있고, ...",2020-03-13 12:17
[금융핫스팟] 감자탕 더 많이 파는 비법까지 전수…동네사장님 '든든한 빽' 생겼다,/news/news_read.nhn?article_id=0000529559&office_id=031&mode=search&query=카카오&page=3,아이뉴스24,"포털 사이트 인터넷 예약 활용 방법이나 네이버스마트스토어, 카카오메이커스 등 플랫폼 입점 방법 같은 실질적인 노하우가 특히 호응이 좋다는 설명이...",2020-03-13 13:51
"SBA, 서울미래 혁신성장펀드 온라인 출자 설명회 개최",/news/news_read.nhn?article_id=0000207171&office_id=374&mode=search&query=카카오&page=3,SBS CNBC,참여를 희망하는 운용사는 오늘(13일) 14:00시부터 16:00시까지 카카오톡 오픈채팅에서 '서울미래 혁신성장펀드'를 검색·접속하면 금번 출자...,2020-03-13 13:54
"카카오페이지, '이태원클라쓰' 이어 윤태호 신작 21일 공개",/news/news_read.nhn?article_id=0003709243&office_id=011&mode=search&query=카카오&page=3,서울경제,카카오(035720)페이지가 ‘슈퍼 웹툰 프로젝트’ 두 번째 작품으로 윤태호 작가의 신작 ‘어린’을 선정하고 오는 21일 첫 화를 공개한다. 카...,2020-03-13 14:08
"화이트데이, 사탕보다 게임 아이템",/news/news_read.nhn?article_id=0004389444&office_id=014&mode=search&query=카카오&page=2,파이낸셜뉴스,카카오게임즈 모바일 MMORPG '테라 클래식'에서는 오는 25일까지 화이트데이... 아이템을 선물한다. #넥슨 #넷마블 #사탕대신 게임 #카카...,2020-03-13 14:11
"DB손보, '가족사랑 우체통' 및 인스타그램 이벤트 실시",/news/news_read.nhn?article_id=0004389451&office_id=014&mode=search&query=카카오&page=2,파이낸셜뉴스,"이벤트 참여 방법은 DB손보 가족사랑 사이트에 접속한 뒤 가족사랑 우체통에서 보내고 싶은 가족들에게 카카오톡, 페이스북, 이메일의 3가지 전송방...",2020-03-13 14:17
"네이버, 전 직원 원격근무 3월 20일까지로 또 연장",/news/news_read.nhn?article_id=0009755678&office_id=003&mode=search&query=카카오&page=2,뉴시스,한편 카카오도 지난달 26일부터 전 직원 원격근무를 시행하고 있다. 카카오는 네이버와 달리 원격근무 종료 시점을 정하지 않았으며 사태 추이에 따...,2020-03-13 14:19
[팩트체크] 약국 마스크 사면 中에 개인정보 유출?,/news/news_read.nhn?article_id=0004642323&office_id=277&mode=search&query=카카오&page=2,아시아경제,' 출생연도에 따라 마스크를 구매하는 '마스크 5부제'가 시행된 가운데 최근 SNS 메신저 카카오톡을 중심으로 공적 마스크를 구입하면 중국에 개...,2020-03-13 14:25
'핀테크 증권사 경쟁시대' 여는 토스…과제는 자본금 확충,/news/news_read.nhn?article_id=0000018853&office_id=629&mode=search&query=카카오&page=2,더팩트,"""100억 원대 자본으로는 영향력 크지 않을 것"" 토스증권(가명)이 카카오페이증권에... 이로써 카카오페이증권에 이은 두 번째 핀테크 (Fina...",2020-03-13 14:43
"대한항공 사우회 ""3자 연합이 의결권 권리 침해""",/news/news_read.nhn?article_id=0011471062&office_id=001&mode=search&query=카카오&page=2,연합뉴스,다만 '한진을 지지하는 사람들의 모임' '한진그룹 살리기' 등의 카카오톡 오픈채팅방이 개설되는 등 이미 사내에는 조원태 한진그룹 회장에게 힘을 ...,2020-03-13 14:57
"DB손해보험 ""가족에게 사랑 전하고 경품 받으세요""",/news/news_read.nhn?article_id=0000517590&office_id=417&mode=search&query=카카오&page=2,머니S,"이벤트에 참여하려면 DB손해보험 가족사랑 사이트에 접속한 뒤 가족사랑 우체통에서 보내고 싶은 가족들에게 카카오톡, 페이스북, 이메일의 3가지 전...",2020-03-13 15:00
"대한항공 사우회 ""3자 연합이 의결권 권리 침해""",/news/news_read.nhn?article_id=0001431935&office_id=057&mode=search&query=카카오&page=2,MBN,다만 '한진을 지지하는 사람들의 모임' '한진그룹 살리기' 등의 카카오톡 오픈채팅방이 개설되는 등 이미 사내에는 조원태 한진그룹 회장에게 힘을 실어주는 분위기가...,2020-03-13 15:06
"대한항공 사우회, 한진칼 주총 의결권 행사 위해 전자투표",/news/news_read.nhn?article_id=0004389488&office_id=014&mode=search&query=카카오&page=2,파이낸셜뉴스,특히 SNS상에선 카카오톡 오픈채팅방을 통해 ‘조현아 3자 주주연합’으로부터 회사를 지켜낼 수 있는 아이디어와 정보를 활발히 공유하고 있다. 이...,2020-03-13 15:10
[코로나19 '극복'] 5대 그룹 총수 관심도…이재용 삼성 부회장 빛났다,/news/news_read.nhn?article_id=0000018867&office_id=629&mode=search&query=카카오&page=2,더팩트,13일 글로벌빅데이터연구소에 따르면 뉴스·커뮤니티·블로그·카페·유튜브·트위터·인스타그램·페이스북·카카오스토리·지식인·기업/조직·정부/공공 등 1...,2020-03-13 15:12
"에이치케이시스템, 벤더스터와 협약 통해 마스크 자판기 보급화 실시",/news/news_read.nhn?article_id=0002588610&office_id=029&mode=search&query=카카오&page=2,디지털타임스,"현금은 물론 간편결제가 대중화되는 요즘 추세에 발맞춰 카카오페이, 신용카드 결제도 가능하다. 이 관계자는 ""코로나19가 진정 국면에 접어들더라도...",2020-03-13 15:22
주총 전 소액주주 표심 잡아라…한진 경영권 분쟁 여론전 격화,/news/news_read.nhn?article_id=0004596923&office_id=018&mode=search&query=카카오&page=2,이데일리,지난 3일 한진을 지지하는 사람들의 모임’ 제목으로 개설된 카카오톡 오픈 채팅방은 이날 기준 110여명이 넘는 참석자들이 주주연합으로부터 회사를...,2020-03-13 15:23
"DB손해보험, 봄맞이 '가족사랑 우체통' 이벤트 진행",/news/news_read.nhn?article_id=0002872533&office_id=030&mode=search&query=카카오&page=2,전자신문,"참여 방법은 이달 31일까지 DB손해보험 가족사랑 사이트에 접속한 뒤 가족사랑 우체통에서 보내고 싶은 가족들에게 카카오톡, 페이스북, 이메일 3...",2020-03-13 15:27
"DB손해보험, 봄 맞이 가족사랑 캠페인 진행",/news/news_read.nhn?article_id=0000529591&office_id=031&mode=search&query=카카오&page=2,아이뉴스24,"참여 방법은 DB손보 가족사랑 사이트에 접속한 뒤 가족사랑 우체통에서 보내고 싶은 가족들에게 카카오톡, 페이스북, 이메일의 3가지 전송방법을 선...",2020-03-13 15:29
한진칼 주총 D-14…조원태 vs '조현아 연합' 표심 잡기 여론전 계속,/news/news_read.nhn?article_id=0004306049&office_id=015&mode=search&query=카카오&page=2,한국경제,한진그룹 현직 뿐 아니라 퇴직 임직원 및 소개로 참여한 일반인 등이 카카오톡 오픈 채팅방을 열고 '한진칼 10주 사기 운동' 등 3자 주주연합에...,2020-03-13 15:38
"[마켓인사이트]'폭락은 기회다' ... KCGI, 한진칼 0.56% 추가매집",/news/news_read.nhn?article_id=0004306057&office_id=015&mode=search&query=카카오&page=2,한국경제,"조 회장(6.52%), 이명희 정석기업 고문(5.31%), 조현민 한진칼 전무(6.47%), 특수관계인(4.15%), 델타항공 14.9%, 카카...",2020-03-13 15:52
대한항공 사우회 3자 주주연합 의결권 권리 침해,/news/news_read.nhn?article_id=0001648300&office_id=016&mode=search&query=카카오&page=2,헤럴드경제,"재계는 ‘한진을 지지하는 사람들의 모임’, ‘한진그룹 살리기’ 등 카카오톡 오픈채팅방이 개설되는 등 조원태 한진그룹 회장에게 힘을 실어주는 사내...",2020-03-13 15:58
"폭락장서 IT·대형주 쓸어담았다…연기금, 12년여만에 최대 순매수",/news/news_read.nhn?article_id=0004375548&office_id=008&mode=search&query=카카오&page=2,머니투데이,이외에 NAVER(+276억원) 엔씨소프트(+173억원) 카카오(+148억원) SK텔레콤(+147억원) 삼성SDI(+143억원) LG화학(+14...,2020-03-13 16:16
세종청사 초유의 '3교대 재택근무'…‘정책공백 최소화’ 총력,/news/news_read.nhn?article_id=0000988488&office_id=082&mode=search&query=카카오&page=2,부산일보,사무실 자리 전화는 휴대전화로 착신전환해놓고 카카오톡 등으로 부서원간 업무 연락을 하며 사무실과 같은 근무 환경을 만들려 하지만 공무원들은 다들...,2020-03-13 16:30
한진그룹 직원들 SNS서도 '회사 지키기' 활발,/news/news_read.nhn?article_id=0004375592&office_id=008&mode=search&query=카카오&page=2,머니투데이,13일 한진그룹에 따르면 지난 3일 ‘한진을 지지하는 사람들의 모임’이라는 제목으로 카카오톡 오픈 채팅방이 개설됐다. 이 채팅방은 현재 110여...,2020-03-13 16:45
"공적 마스크 재고, 카카오톡으로 확인할 수 있어",/news/news_read.nhn?article_id=0004536126&office_id=009&mode=search&query=카카오&page=1,매일경제,"'마스크왔다'는 카카오톡으로 공적 마스크 재고를 알려주는 챗봇서비스로, 홈페이지 접속이나 별도의 어플리케이션 다운로드 없이 카카오톡 친구추가만 하면 공적...",2020-03-13 17:01
"페르소나시스템, 카톡에서 쉽게 마스크 재고와 위치 파악해주는 AI챗봇 개발",/news/news_read.nhn?article_id=0002588626&office_id=029&mode=search&query=카카오&page=1,디지털타임스,대화형AI기술을 보유한 페르소나시스템은 13일 인공지능 챗봇을 통해 카카오톡에... 사용하던 카카오톡에서 쉽게 대화형으로 서비스 받을 수 있도록...,2020-03-13 17:04
"퍼플망고, 아이폰X, 갤럭시노트9, 갤럭시S9 최대 100% 할인 행사 진행",/news/news_read.nhn?article_id=0002588628&office_id=029&mode=search&query=카카오&page=1,디지털타임스,"또한 연기된 입학식 전까지 별도의 키즈폰 프로모션을 진행해 LG X2 ZEM, 카카오리틀프렌즈폰3, 아키폰, 무민키즈폰, 쿠키즈미니 등 통신3사...",2020-03-13 17:09
[장외주식] 에스아이플렉스 소폭 상승,/news/news_read.nhn?article_id=0004375620&office_id=008&mode=search&query=카카오&page=1,머니투데이,카카오게임즈는 1.44% 내린 2만500원의 호가로 사흘 연속 하락했고 포스코건설은 3.60% 하락한 2만1450원의 호가로 최저가를 재차 경신...,2020-03-13 17:12
"봉덕2차 화성파크드림, 사이버 견본주택 3월 20일 오픈…1순위 청약 24일",/news/news_read.nhn?article_id=0004642454&office_id=277&mode=search&query=카카오&page=1,아시아경제,"또한, 고객들에게 보다 많은 정보를 제공하고 청약을 돕기 위하여 상담전화도 최대한 많은 회선을 구비하고 카카오톡 채널을 통해서도 일대일 맞춤형 ...",2020-03-13 17:14
"[단독 마켓인사이트]한진칼, 의결권 자문사 첫 권고안은 ""조원태 연임 찬성""",/news/news_read.nhn?article_id=0004306098&office_id=015&mode=search&query=카카오&page=1,한국경제,"00%), 카카오(1.00%) 등 총 33.45%를 확보하고 있다. 이외에 대한항공 자가보험 및... 카카오도 1%를 더 산 것으로 알려져 있다...",2020-03-13 17:14
"빛나는MC 아카데미, 홈페이지 개편…""행사전문MC 꿈나무 모여라!""",/news/news_read.nhn?article_id=0004375622&office_id=008&mode=search&query=카카오&page=1,머니투데이,"홈페이지 우측의 상담신청 버튼을 클릭하거나 카카오톡 아이콘을 클릭하면 보다... 인스타그램, 카카오 등 다양한 채널을 통해 소통의 길을 열 것”...",2020-03-13 17:17
