head,text,url
"삼성, 멕시코 티후아나 TV 공장 13~17일 셧다운…LG 폴란드 브로츠와프 가전 공장 13~24일 셧다운","[더팩트│최수진 기자] 삼성전자와 LG전자가 정상 운영하던 해외 생산라인의 가동을 중단하기로 결정했다. 신종 코로나바이러스 감염증(코로나19) 사태가 확산되자 현지 임직원들의 건강과 안전을 우려한 결정이다.10일 업계에 따르면 삼성전자는 멕시코에 있는 티후아나 TV 공장을 오는 13일부터 17일까지 가동 중단한다. 멕시코 정부의 코로나19 대응 방침에 따라 내린 결론이다.앞서 LG전자 역시 북미용 TV를 생산하는 멕시코 레이노사 공장을 지난 8일 셧다운한 바 있으며, 오는 13일에도 가동을 중단할 예정이다. 또, 현지 내수용 TV를 생산하는 멕시칼리 공장은 오는 13일부터 24일까지 12일간 가동 중단한다.아울러 오는 19일까지 폴란드 가전공장의 가동을 중단하는 삼성전자에 이어 LG전자도 최근 폴란드 브로츠와프의 생활가전 공장을 오는 13일부터 24일까지 셧다운하기로 결정했다.한편, 이외에도 삼성전자는 △미국 사우스캐롤라이나주 뉴베리 카운티 세탁기 공장 △ 러시아 칼루가 TV 공장 △인도 노이다 공장 △인도 첸나이 공장 등을 셧다운한 상태며, LG전자도 △러시아 루자 가전 공장 △미국 테네시주 클락스빌 세탁기 공장 △인도 노이다 공장 △인도 푸네 공장 등의 가동을 중단했다.jinny0618@tf.co.kr저작권자 ⓒ 특종에 강한 더팩트 & tf.co.kr 무단 전재 및 재배포 금지",/news/news_read.nhn?article_id=0000022404&office_id=629&mode=search&query=삼성전자&page=3
,"무노조 경영을 표방해온 삼성그룹 산하 삼성SDI에 노조가 설립됐습니다.
한국노총 전국금속노동조합연맹 삼성SDI노조는 오늘(9일) 울주군청에서 노동조합 설립필증을 받았다고 밝혔습니다. 삼성계열사 노조에 한국노총 산하 노조가 결성된 것은 이번이 6번째입니다. 삼성SDI노조는 연봉제 폐지와 호봉제 부활, 임금피크제와 특별휴가 등 취업규직 불이익 변경 무효화 등을 주요사업으로 내걸었습니다. 삼성SDI는 울산 2천 명, 천안 4천 명 등 전국단위 노동자가 1만 명에 이르는 사업장입니다.앞서 삼성전자, 삼성디스플레이, 삼성웰스토리, 삼성화재, 삼성애니카손해보험 등에 한국노총 산하 노동조합이 잇따라 설립됐습니다.변진석 기자 (lamer@kbs.co.kr)",/news/news_read.nhn?article_id=0010817682&office_id=056&mode=search&query=삼성전자&page=2
장중 60만원 돌파계약금액 4400억원…매출액의 63%,"삼성바이오로직스가 신종 코로나바이러스 감염증(코로나19) 치료 후보 물질을 위탁생산한다는 소식에 급등했다. 10일 삼성바이오로직스는 전날보다 8만500원(16.82%) 오른 55만9000원에 장을 마쳤다. 미국 제약사와 코로나19 치료제 위탁 생산 계약을 맺었다는 소식이 주가를 밀어올렸다. 주가는 장중 60만3000원까지 치솟으며 신고가를 새로 썼다. 주가 급등과 함께 몸집도 불었다. 시가총액 규모는 36조9862억원으로 늘어나 삼성전자우(우선주)를 제치고 코스피 시총 3위에 등극했다.이날 삼성바이오로직스는 미국의 비어 바이오테크놀로지(Vir Biotechnology)가 개발 중인 신종 코로나바이러스 감염증(코로나19) 치료 후보물질을 위탁 생산하는 확정의향서(Binding LOI)를 체결했다고 밝혔다. 계약금액은 3억6224만달러(약 4400억원) 규모로, 최근 사업연도 매출액의 63%에 해당한다.비어사는 미국 샌프란시스코에 위치한 감염성 질환 예방 및 치료제 개발 전문 생명과학기업으로, 코로나19와 유사한 중증급성호흡기증후군(SARS)으로부터 완치된 사람의 항체를 분리해 코로나19 치료제를 개발 중이다. 현재 미국 식품의약품국(FDA)에서 패스트트랙(Fast Track)으로 승인됐지만, 아직 치료제로는 허가받지 못했다.이번 계약으로 삼성바이오로직스는 코로나19 중화항체 제품에 대한 임상 및 상업 물량 생산을 진행할 예정이다.채선희 한경닷컴 기자 csun00@hankyung.com▶ ▶
 ▶
ⓒ 한국경제 & , 무단전재 및 재배포 금지",/news/news_read.nhn?article_id=0004322325&office_id=015&mode=search&query=삼성전자&page=2
▶ 네이버 홈에서 [한국경제TV] 채널 구독하기 [생방송보기]▶ 대한민국 재테크 총집결! - [증권 / 주식상담 / 부동산],"[한국경제TV 신동호 기자]삼성전자와 LG전자 해외 생산공장이 코로나19 여파로 인한 가동 중단 사태가 이어지고 있다.10일 업계에 따르면, 삼성전자 멕시코 티후아나 TV공장은 오는 13~17일까지 가동을 일시 중단한다.이번 가동 중단은 현지 정부 권고와 함께 임직원들의 안전과 건강을 위해서라고 삼성전자는 설명했다. 현지 부활절 연휴 기간에 맞춰 공장 가동을 셧다운(일시폐쇄)하기로 결정했다.멕시코 산후안 델리오에 위치한 LG이노텍 자동차 부품공장도 이달 말까지 주정부의 지침에 따라 가동을 중단한다. 멕시코의 코로나19 확진자 수는 3000명을 넘어선 상태다.LG전자 폴란드 브로츠와프에 있는 세탁기·냉장고 공장은 13일부터 24일까지 가동을 중단하고 폴란드 므와바 가전생산 공장은 생산량 조절에 돌입했다.신동호기자 dhshin@wowtv.co.krⓒ 한국경제TV, 무단 전재 및 재배포 금지",/news/news_read.nhn?article_id=0000863368&office_id=215&mode=search&query=삼성전자&page=2
,"삼성SDI에 노조가 들어섰다. 삼성그룹 계열사에 노조가 설립된 것은 이번이 여섯번째다.10일 한국노동조합총연맹(이하 한노총)에 따르면 삼성SDI 노조는 지난 9일 경북 울주군청으로부터 노동조합 설립필증을 전달받았다. 삼성SDI노조는 지난 8일 한국노총 울산지역본부 회의실에서 설립총회를 개최했다.이번 노조설립으로 삼성그룹 계열사에는 총 여섯번째 노조가 설립됐다. 지금까지 설립된 삼성그룹의 노조는 ▲삼성웰스토리 ▲삼성화재애니카손해사정 ▲삼성전자 제4노조 ▲삼성화재 ▲삼성디스플레이다.삼성SDI 측은 “기존에 울산에 노조가 있었기 때문에 이번이 처음은 아니다”며 “회사 노조 설립에 대해 딱히 할말은 없다”고 말했다.다만 삼성SDI는 최근 임금인상안을 도출한 만큼 이번 노조설립이 임금인상률에 영향을 미치지는 않을 것으로 예상된다. 삼성SDI는 “최근 임금인상률에 합의했다. 정확한 수준은 밝히기 어렵지만 삼성전자와 비슷한 수준”이라고 말했다.박흥순 기자 soonn@mt.co.kr
<저작권자 ⓒ '성공을 꿈꾸는 사람들의 경제 뉴스' 머니S, 무단전재 및 재배포 금지>",/news/news_read.nhn?article_id=0000529733&office_id=417&mode=search&query=삼성전자&page=2
,"미국 연방준비제도이사회(Fed)가 파격적인 유동성 정책을 내놓자 코스피가 강세를 보이며 한달여 만에 1860선을 회복했다. 10일 코스피는 전일 대비 24.49포인트(1.33%) 오른 1860.70에 거래를 마쳤다. 코스피는 코로나19가 미국, 유럽 등으로 확산하자 지난달 19일 1430선까지 하락했다. 하지만 최근 한달여동안 가파른 회복세를 보이면서 이날 1860선을 회복했다. 코스피가 1860선을 넘긴 것은 지난달 11일 이후 한달여 만이다. 지난밤 미 연준은 최대 2조3000억 달러의 유동성을 시중에 공급할 수 있는 조치를 발표했다. 일부 투기등급 회사채(정크본드)와 상업용 주택저당증권(CMBS), 대출채권담보부증권(CLO)까지 매입하기로 해 파격적이라는 평가가 나오고 있다. 코로나 19 사태로 인해 신용경색 리스크 경고등이 켜진 기업, 가계 및 지방정부를 지원하기 위해 연준이 전격적으로 지원을 결정한 것이다. 특히 코로나 19 사태 이후 금융위기를 촉발시킬 수 있는 시한폭탄으로 지목되었던 대출채권담보부증권(CLO)마저 매입하기로 한 것은 미 연준의 금융 시스템 리스크를 선제적으로 차단하기 위한 목적으로 해석해 볼 수 있다.회원국 간 이견으로 지연되던 EU 경기부양 패키지도 합의에 도달했다. 패키지 규모는 5000억 달러로 주요 내용은 수개월 내 역내 기업들에게 추가 유동성을 제공하고, 정부의 고용 프로그램에 자금을 지원하며, 금융시장 접근이 어려운 유럽 정부에 비교적 유리한 조건으로 신용 라인을 제공하는 것이다. OPEC+(석유수출국기구인 OPEC과 10개 주요 산유국의 연대체)는 9일(현지시간) 긴급 화상 회의에서 하루 1000만 배럴 규모의 감산안을 논의했으나 멕시코의 수용 거부로 합의 없이 회의를 끝냈다. 회의 초반에는 사우디아라비아와 러시아 주도로 잠정적인 합의가 이뤄졌으나 멕시코가 동참을 거부하고 회의에서 이탈하면서 합의안이 불발 위기에 처했다.이번 OPEC+ 긴급회의가 시작되자 국제 유가는 10% 이상 상승했지만 회의 도중 감산량이 하루 1000만 배럴이라는 소식이 전해지면서 서부 텍사스산 원유(WTI)는 9.3%나 급락했다. 시장에서는 코로나19 우려에 기인한 글로벌 원유수요 감소분이 더욱 크기 때문에 이번 감산합의가 큰 효과를 발휘하지는 못할 것이란 평가가 나온다. 글로벌 원유수요 감소분은 약 2000만~2700만 배럴 규모인 것으로 추정된다.김병연 NH투자증권 연구원은 ""하락분의 50% 되돌림점인 1850포인트는 잠시 쉬어가는 구간으로 신용경색 우려, 우한 이동 재개와 라마단 등으로 인해 코로나19 재확산에 대한 경계감이 여전하다""라며 ""증안펀드 집행 미국 4차 재정정책 논의, OPEC+ 감산 합의 등 기대감도 높아 조정이 나타나더라도 하락분의 33% 되돌림점인 1700선 초반이 지지선으로 작용할 전망""이라고 말했다.업종별로 보험, 의약품, 철강·금속 등이 4~8% 급등했고 종이·목재, 음식료품, 의료정밀 등은 떨어졌다. 매매주체별로 외국인과 기관이 각각 553억원, 2086억원을 순매도했고 개인은 2541억원을 순매수했다. 프로그램 매매는 3159억원 매도 우위를 나타냈다. 시가총액 상위 종목들은 혼조세를 나타냈다. 삼성바이오로직스가 16%나 급등했고 삼성전자, 현대차, 삼성물산도 상승했다. 반면 SK하이닉스, NAVER, 셀트리온, LG화학 등은 떨어졌다. 이날 유가증권시장에서는 466개 종목이 상승했고 386개 종목이 하락했다.코스닥은 전일 대비 4.69포인트(0.76%) 내린 611.26에 마감했다.[디지털뉴스국 고득관 기자] [ⓒ 매일경제 & mk.co.kr, 무단전재 및 재배포 금지]",/news/news_read.nhn?article_id=0004554912&office_id=009&mode=search&query=삼성전자&page=2
,"[아시아경제 우수연 기자]직영중고차 기업 K Car(케이카)는 24시간 온라인 중고차 쇼핑을 위한 '맞춤형 즉시 결제 시스템' 출시를 기념해 오는 30일까지 다양한 고객 참여 이벤트를 진행한다고 10일 밝혔다.먼저 케이카는 공식 모바일 앱을 다운로드한 고객을 대상으로 '앱 리뷰 이벤트'를 진행한다. 응모를 원하는 경우, 케이카 앱을 설치하고 리뷰를 3줄 이상 작성한 뒤 해당 리뷰 화면을 캡처해 케이카 공식 홈페이지나 페이스북, 또는 블로그을 통해 참여하면 된다. 응모자 중 1명을 추첨해 삼성전자 갤럭시 버즈 플러스 무선 이어폰을 증정하며, 50명에게는 스타벅스 아메리카노 기프티콘을 제공한다.이와 함께 케이카에서 차량을 구매하거나 타던 차를 판매한 고객을 대상으로 '베스트 후기왕' 이벤트를 연다. 케이카 온라인 구매 서비스인 내차사기 홈서비스를 맞춤형 즉시 결제로 신청한 고객은 물론 온라인 매입 서비스인 내차팔기 홈서비스 이용 고객, 케이카 전국 직영점 방문 구매 고객 모두 이벤트에 참여할 수 있다.개인 블로그나 카페, 커뮤니티 등 온라인 채널에 자신의 케이카 서비스 이용 소감 및 후기를 작성하고 해당 URL을 제출하면 참여가 완료된다. 응모자 전원에게 1만원 주유권을 증정하며, 이 중에서 우수 후기를 작성한 고객 6명을 별도 선정해 10만원 주유권을 제공한다.앞서 케이카는 24시간 원활한 온라인 중고차 쇼핑을 위해 업계 최초로 현금, 카드, K Car 할부 등 원하는 결제 방식을 선택해 바로 결제하는 ‘맞춤형 즉시 결제’ 시스템을 도입했다. 이를 통해 소비자는 언제 어디서나 PC 및 모바일을 통해 직영중고차를 보다 빠르고 편리하게 구매할 수 있게 됐다.정인국 케이카 대표는 ""중고차 업계 내 비대면 서비스가 확대되고 있는 가운데, 보다 많은 고객들이 케이카 서비스만의 강점을 경험하길 바라는 마음으로 이번 이벤트를 준비했다""라며 ""비대면 구매 홈서비스, 3일 책임 환불제에 이어 맞춤형 즉시 결제 시스템까지 성공적으로 도입한 만큼 앞으로도 서비스 혁신을 통해 중고차 시장을 지속 선도해 나갈 것""이라고 말했다.우수연 기자 yesim@asiae.co.kr <ⓒ경제를 보는 눈, 세계를 보는 창 아시아경제 무단전재 배포금지>",/news/news_read.nhn?article_id=0004659619&office_id=277&mode=search&query=삼성전자&page=2
美 2천800조 유동성 투입 소식에 강세,"[아이뉴스24 류은혁 기자] 국내 증시가 개인의 사자 행렬에 1860선을 회복했다.10일 코스피지수는 미국 연방준비제도(Fed·연준)가 코로나19로 타격을 입은 실물경기를 되살리기 위해 2조3천억 달러(약 2천800조원)의 유동성을 투입한다는 소식에 전날보다 24.49포인트(1.33%) 상승한 1860.70에 마감했다.이날 개인은 2천5438억원 순매수 한 반면 외국인과 기관은 각각 553억원과 2천86억원을 순매도 했다.이날 시가총액 상위 10종목은 혼조세를 보였다. SK하이닉스(-1.06%), NAVER(-0.60%), 셀트리온(-0.48%)이 하락세를 보인 반면 삼성전자(0.31%), 삼성바이오로직스(16.82%), 삼성전자우(0.36%) 등은 상승했다.업종별로도 혼조세를 나타냈다. 건축제품(-4.36%), 생명과학도구 및 서비스(-3.40%), 문구류(-3.09%)는 하락한 반면 생명보험(14.63%), 철강(6.90%), 방송과 엔터테인먼트(5.58%), 제약(4.65%)은 상승했다.이날 상한가·하한가 종목은 없었다.코스닥지수는 전 거래일 대비 4.69포인트(0.76%) 하락한 611.26에 장을 끝냈다.개인은 2천495억원 순매수 했고, 외국인과 기관은 각각 1천375억원과 1천87억원을 순매도 했다.시가총액 상위 10종목에서는 혼조세가 나타났다. 셀트리온헬스케어(-1.12%), 에이치엘비(-2.01), 펄어비스(-1.01%)는 내렸으나 CJ ENM 5.47%, 셀트리온제약 1.06%, 스튜디오드래곤 4.31%의 상승률을 보였다.이날 상한가 종목은 테라젠이텍스, 초록뱀 등 5종목이었고 하한가 종목은 없었다.한편 이날 서울외환시장에서 원/달러 환율은 전 거래일 대비 10.7원 내린 1208.8원에 마감됐다. ehryu@inews24.com [ⓒ 아이뉴스24 무단전재 및 재배포 금지]",/news/news_read.nhn?article_id=0000533844&office_id=031&mode=search&query=삼성전자&page=2
"개인 홀로 ‘사자’…의약품, 철강·금속↑시가총액 상위주 '혼조'…치료제 생산 수주 '삼바', 16.8%↑","[이데일리 고준혁 기자] 10일 코스피 지수가 상승 마감했다. 미국 연방준비제도(Fed·연준)가 유례가 없는 정크본드 매입 방안을 내놓는 등으로 미국 증시가 상승 마감한 등의 영향을 받은 것으로 풀이된다. 외국인, 기관의 ‘팔자’ 강세에도 개인이 순매수에 나서며 상승장을 이끌었다. 마켓포인트에 따르면 코스피 지수는 전일 대비 24.49포인트(1.33%) 오른 1860.70에 마감했다. 코스피는 보합권에서 출발했다가 오전 11시 10분부터 약 1시간 정도 하락 전환했었다가 꾸준히 우상향 곡선을 그리면서 마감됐다. 장중 하락 전환은 OPEC+(석유수출국기구인 OPEC과 10개 주요 산유국의 연대체)가 긴급 화상 회의에서 하루 1천만 배럴 규모의 감산안을 논의했으나 멕시코의 수용 거부로 합의 없이 끝났다는 소식 때문으로 보인다. 최유준 신한투자증권 연구원은 “악재가 나올만한 재료는 없는 편인데 굳이 찾자면 OPEC+회의가 합의없이 끝난 것이 잠시 영향을 준 것일 수 있다”고 전했다. 수급주체별로 보면 개인이 2537억원 순매수했다. 외국인과 기관은 각각 553억원, 2085억원 순매도 했다. 프로그램별로 보면 차익과 비차익을 합쳐 3159억원 매도 우위를 보였다. 업종별로는 보험이 8.8% 크게 올랐다. 이어 의약품, 철강·금속, 전기가스업, 은행, 금융업, 증권, 운송장비, 비금속광물, 유통업, 운수창고, 제조업 순으로 상승 마감했다. 종이·목재, 음식료품, 의료정밀, 전기·전자, 통신업은 하락했다. 시가총액 상위 10개 종목은 혼조세를 보였다. 대장주인 삼성전자(005930), 현대차(005380), 삼성물산(028260) 등은 상승 마감했다. 특히 삼성바이오로직스(207940)는 16.8% 크게 올랐다. 미국 비어바이오테크놀로지사의 신종 코로나 바이러스 감염증(코로나19) 치료제 위탁생산 수주에 대한 확정의향서(LOI)를 체결했다는 소식이 상승에 영향을 끼쳤다. SK하이닉스(000660), 네이버(035420), 셀트리온(068270), LG화학(051910), 삼성SDI(006400)는 하락했다. 개별 종목별로는 케이씨씨글라스(344820), 한화생명(088350), 남양유업우(003925), 신풍제약(019170), 디피씨(026890), 삼성생명(032830), 한국화장품제조(003350) 등이 크게 올랐다. 매각설이 도는 두산솔루스(336370), 두산솔루스2우B(33637L)와 두산 계열사 두산퓨얼셀2우B(33626L)는 크게 내렸다. 이날 거래량은 9억811만9400주, 거래대금은 11조8514억4300만원으로 집계됐다. 상한가 없이 456개 종목이 상승했고 하한가 없이 총 386개 종목이 하락했다. 46개 종목은 보합권에서 거래를 마쳤다.고준혁 (kotaeng@edaily.co.kr)＜ⓒ종합 경제정보 미디어 이데일리 - 무단전재 & 재배포 금지＞",/news/news_read.nhn?article_id=0004617724&office_id=018&mode=search&query=삼성전자&page=2
,"[서울=뉴시스]신항섭 기자 = 코스피가 외국인 투자자와 기관 투자자의 '팔자'에도 강보합을 유지하며 1860선 안착에 성공했다.10일 코스피는 전 거래일(1836.21)보다 24.49포인트(1.33%) 오른 1860.70에 마감했다. 이날 지수는 전 거래일보다 0.45포인트(0.04%) 내린 1835.76로 출발 후 등락을 반복하다 오후 들어 강세로 전환해 상승폭을 키우는 모습을 보였다.이날 유가증권시장에서는 개인 투자자들이 2541억원을 순매수하며 증시 상승을 이끌었다. 반면 기관 투자자는 2086억원 순매도했고, 외국인도 553억원 매도우위로 나타났다.업종별로는 보험(8.79%)이 가장 크게 올랐고, 의약품(6.01%), 철강금속(4.30%), 전기가스업(4.24%), 은행(4.14%), 금융업(3.49%), 증권(2.45%), 운수장비(2.14%), 비금속광물(1.78%), 유통업(1.75%) 등이 강세를 보였다. 반면 종이목재(-2.47%), 음식료품(-1.28%), 의료정밀(0.76%), 전기전자(-0.07%), 통신업(-0.02%) 등은 하락했다.시가총액 상위 10개 종목들 가운데에서는 삼성바이오로직스가 미국 코로나19 치료 후보물질 위탁생산 소식에 힘입어 전 거래일 대비 16.82% 급등한 55만9000원에 거래를 마쳤다. 그 뒤를 이어 삼성물산(5.96%), 현대차(2.68%) 등이 강세를 보였고 대장주인 삼성전자(0.31%)는 소폭 올랐다. LG생활건강(-3.19%), SK하이닉스(-1.06%), 삼성SDI(-0.99%), 네이버(-0.60%), 셀트리온(-0.48%) 등은 주가 하락이 나타났다.전문가들은 이날 증시가 개인의 수급에 가장 큰 영향을 받았다고 분석했다. 개인들의 대형주 매매가 코스피 상승으로 이어졌다는 것이다.서상영 키움증권 연구원은 ""부활절 연휴로 외국인의 매매가 감소한 가운데 개인들의 매매동향에 따라 등락이 나타났다""면서 ""다만 기관의 프로그램 매물이 출회된 것이 일부 영향을 준 것으로 추정된다""고 말했다.이날 코스닥지수는 전 거래일(615.95)보다 1.80포인트(0.29%) 오른 617.75에 출발한 뒤 4.69포인트(0.76%) 내린 611.26에 마감했다. 코스닥시장에서는 외국인과 기관이 1371억원, 1086억원 각각 순매도했고, 개인이 2497억원 순매수했다.시가총액 상위 종목 가운데에서는 CJ ENM이 5.5% 오르며 가장 높은 상승률을 보였고, 스튜디오드래곤도 4.3% 동반 상승했다. 그 뒤로 헬릭스미스(2.40%), 셀트리온제약(1.06%) 등이 올랐다. 반면 씨젠(-3.44%), 에이치엘비(-2.01%), 셀트리온헬스케어(-1.12%), 펄어비스(-1.01%), 케이엠더블유(-0.65%) 등은 하락했다.지난밤 뉴욕증시는 연방준비제도(Fed·연준)가 사상 처음으로 정크본드(투기등급 회사채)를 매입한다는 소식에 강세를 보였다.9일(현지 시각) 뉴욕증권거래소(NYSE)에서 다우존스30산업평균지수는 전날보다 285.80포인트(1.22%) 상승한 2만3719.37에 거래를 마쳤다. 스탠더드앤드푸어스(S&P)500지수도 전날보다 39.84포인트(1.45%) 오른 2789.82에, 기술주 중심의 나스닥은 62.67포인트(0.77%) 상승한 8153.58에 장을 마감했다. hangseob@newsis.com<ⓒ 공감언론 뉴시스통신사. 무단전재-재배포 금지>",/news/news_read.nhn?article_id=0009809360&office_id=003&mode=search&query=삼성전자&page=2
