head,text,url
[경제 365],"시장조사업체 카운터포인트리서치는 올해 국내에서 840만 대의 5G 스마트폰이 판매될 것이라는 전망 보고서를 내놨습니다.5G 스마트폰 840만 대는 스마트폰 전체 예상 판매량의 48%로 지난해 5G 스마트폰 판매 비중인 28%에서 20% 포인트나 증가한 수치입니다.삼성전자와 LG전자가 새롭게 출시하는 전략 모델이 모두 5G인 데다 중저가폰 라인업으로까지 5G를 확대할 계획이고 하반기에는 애플이 처음으로 5G 모델을 출시할 예정입니다.---현대자동차가 제작한 코로나19 극복 기원 캠페인 영상이 5일 만에 시청 300만 뷰를 넘어서는 등 눈길을 끌고 있습니다.현대차는 지난 6일 글로벌 브랜드 웹사이트와 유튜브 등에 '지금의 우리: 디스 이스 어스'라는 제목의 1분 30초 길이 영상을 올렸습니다.캠페인 영상은 격리 생활 중 베개로 장난치듯 운동하는 모습, 유리벽을 사이에 둔 빙고 게임 등 코로나19로 인한 어려움을 공감하고 극복을 위해 노력하는 모습을 담았습니다.---스타벅스커피 코리아는 지난해 커피 음료 판매 빅데이터를 분석한 결과, 전체 판매량의 64%가 아이스커피 제품이었다고 밝혔습니다.2015년만 해도 아이스커피와 따뜻한 커피의 비중은 각각 51%와 49%로 비슷했지만, 4년 만에 아이스커피 비중이 뜨거운 커피의 약 2배로 커진 것입니다.스타벅스는 아이스커피를 선호하는 트렌드와 함께 아이스 전용 제품인 콜드 브루의 인기에 따른 결과라고 분석했습니다.   임상범 기자(doongle@sbs.co.kr) ※ ⓒ SBS & SBS Digital News Lab. : 무단복제 및 재배포 금지",/news/news_read.nhn?article_id=0000807051&office_id=055&mode=search&query=삼성전자&page=3
,"[아시아경제 이민우 기자] 엑시콘은 삼성전자와 46억원 규모의 반도체 검사장비 공급 계약을 체결했다고 10일 공시했다.이민우 기자 letzwin@asiae.co.kr <ⓒ경제를 보는 눈, 세계를 보는 창 아시아경제 무단전재 배포금지>",/news/news_read.nhn?article_id=0004659470&office_id=277&mode=search&query=삼성전자&page=3
국내 공식 홈페이지 통해 응원…각국 홈페이지에도 메시지 전달,"[서울=뉴시스] 고은결 기자 = 삼성전자가 신종 코로나바이러스 감염증(코로나19) 사태 극복을 위한 전 세계 온라인 캠페인을 진행한다.삼성전자는 10일 국내 공식 홈페이지 메인에 ""우리는 늘 이겨냈고, 이번에도 함께 이겨낼 것입니다. 힘든 시기를 헤쳐 나가는 모든 분들을 삼성전자 임직원 모두는 마음을 다해 응원합니다""라는 메시지를 띄웠다.삼성전자는 미국, 영국, 멕시코, 브라질 등 국가의 공식 사이트에도 코로나19를 함께 극복하자는 내용의 메시지를 실었다.삼성전자는 페이스북, 인스타그램 등 소셜네트워크서비스(SNS) 계정을 통해서도 응원 메시지를 전할 예정이다.앞서 삼성은 이달 초 글로벌 뉴스룸을 통해서도 코로나19 사태 극복을 위해 국내외에서 고객과 파트너, 지역사회, 임직원에 대한 지원을 지속 중이라고 밝혔다.실제로 삼성은 국내에서 경북 영덕연수원을 치료센터 시설로 운영하도록 제공하고, 마스크 제조사들의 생산량 증대 지원하는 한편 해외에서 확보한 마스크 33만개를 기부했다.또한 구호물품과 성금 등 300억원을 긴급 지원했고, 온누리상품권 300억원어치를 구입해 협력사에 지급했다. 코로나19 사태로 타격을 입은 화훼농가 지원을 위해 '꽃 소비 늘리기'에도 동참했다. 1조원 규모의 펀드를 조성해 협력사 운영자금 지원하고, 협력사 물품 대금 1조6000억원을 조기 지급하기도 했다. 고객을 위해서는 삼성닷컴에서 24시간 고객 서비스를 제공 중이며, 코로나19로 이동이 제한된 상황에서 제품 보증기간이 만료된 경우 수리 기간을 1개월 연장키로 했다.이 밖에도 직원들을 위해서는 각 지역 대응팀을 구성해 당국의 최신 지침을 제공하고, 출장 제한, 재택근무 권고 및 필요한 경우 사회적 노력을 지원하기 위해 일부 시설과 상점을 폐쇄했다. 중요한 사업장과 시설에는 출입 전에 건강 검진과 체온 점검을 의무화하고 정기적인 방역을 실시 중이다. keg@newsis.com<ⓒ 공감언론 뉴시스통신사. 무단전재-재배포 금지>",/news/news_read.nhn?article_id=0009808658&office_id=003&mode=search&query=삼성전자&page=3
,"[아시아경제 이민우 기자] 삼성에스디에스(SDS)는 최대주주인 삼성전자와 6874억원 규모의 2020년 정보기술 아웃소싱 서비스 계약을 맺었다고 10일 공시했다.이민우 기자 letzwin@asiae.co.kr <ⓒ경제를 보는 눈, 세계를 보는 창 아시아경제 무단전재 배포금지>",/news/news_read.nhn?article_id=0004659476&office_id=277&mode=search&query=삼성전자&page=3
"삼성·LG, 보급형 모델 출시 잇따라…애플도 4년 만에 준비","[아이뉴스24 서민지 기자] 신종 코로나바이러스 감염증(코로나19) 확산으로 스마트폰 시장이 얼어붙으면서 스마트폰 제조업체들이 보급형 모델을 앞세워 시장 공략에 나선다. 위축된 스마트폰 시장을 '착한 가격'으로 뚫겠다는 전략이다.10일 업계에 따르면 삼성전자와 LG전자, 애플 등 주요 스마트폰 제조사들은 보급형 모델 출시 준비에 한창이다.가장 눈에 띄는 건 애플의 변화다. 그동안 '프리미엄 전략'을 고수해온 애플은 4년 만에 보급형 모델을 내놓는다. 애플이 보급형 모델을 출시하는 것은 지난 2016년 아이폰SE 이후 처음이다.보급형 모델의 명칭은 아이폰SE와 아이폰9 등이 언급되고 있지만, 미국과 중국 스마트폰 액세서리 사이트에 아이폰SE 임시 페이지가 신설되는 등 아이폰SE에 무게가 실리고 있다. 신제품은 아이폰8과 비슷한 디자인이 될 것으로 보인다.업계에서는 오는 15일 공개, 22일 출시를 유력하게 보고 있다. 한국의 경우 1차 출시국에 포함되지 않아 5월에 출시될 것이라는 전망이 지배적이다.애플이 또다시 보급형 모델을 고민하는 데는 코로나19에 따른 영향을 최소화하겠다는 전략으로 풀이된다. 시장조사업체 스트래티지 애널리틱스(SA)에 따르면 2월 애플의 스마트폰 판매량은 1천20만 대로 전월(1천600만 대) 대비 36% 감소했다. 같은 기간 삼성전자가 9.5% 감소세를 나타낸 것과 비교하면 타격이 상당한 것이다.특히 2분기에 코로나19에 따른 영향이 본격화될 것으로 예상되는 만큼 애플 입장에서는 돌파구 마련이 시급한 상황이다. 당초 9월 출시 예정이었던 전략 스마트폰 아이폰12의 출시가 미뤄지면서 반등 기회가 더욱 늦어지고 있기도 하다.삼성전자는 'A시리즈' 2종을 출시하며, 보급형 5G 스마트폰 시장 선점에 나선다. 다음 달 출시될 것으로 예상되는 A51과 A71은 40만~50만 원대에 가격이 형성될 전망이다. 지난해 처음 선보인 보급형 5G 스마트폰 갤럭시A90의 출고가가 89만9천800원이었는데, 문턱이 더욱 낮춰진 것이다.삼성전자는 ""새로운 10년의 시작""을 공언하며, 지난달 6일 출시한 전략 스마트폰 갤럭시S20이 저조한 성적을 내고 있는 만큼 중저가에 더욱 힘을 싣는 분위기다. 고동진 삼성전자 IM(인터넷·모바일) 부문장 사장은 지난 8일 제3차 범부처 민관 합동 5G+전략위원회에서 ""연말까지 보급형 5G폰을 2~3개 낼 것""이라고 밝혔다.A51과 A71은 저렴한 가격에도 고성능을 갖춰 수요를 최대한 이끌 것으로 전망된다. 두 제품 모두 전면 카메라를 제외하고 모두 화면으로 채운 인피니티-O 디스플레이가 적용됐다. 후면에 4개의 카메라를 탑재했고, 4K 동영상 촬영도 가능하다. A51은 4천800만 화소 메인카메라와 1천200만 화소 초광각, 500만 화소 매크로·심도 카메라 등을 탑재했으며, A71은 6천400만 화소 메인카메라와 1천200만 화소 초광각, 500만 화소 매크로·심도 카메라로 구성됐다.A51은 4~5월 중 한국과 미국, 유럽 등에 선보일 예정이다. A71은 중국을 시작으로 한국, 미국, 유럽, 중동, 동남아 등에 순차적으로 출시될 전망이다.김연정 삼성전자 무선사업부 혁신제품기획그룹 상무는 ""갤럭시A 시리즈는 다양한 가격대로 출시되지만 기능으로 타협하지 않는 혁신을 제공한다""며 ""보다 접근성 있는 가격으로 5G 스마트폰 포트폴리오를 구축할 것""이라고 전했다.LG전자는 일찍이 '가성비'를 내세우며 전략을 수정한 바 있다. 국내에서는 실속형 모델과 '매스 프리미엄' 모델을 중심으로, 해외에서는 프리미엄 플래그십 모델을 앞세우는 이원화 전략을 펼치고 있다.이에 따라 V60 씽큐는 국내를 제외한 북미, 유럽, 일본 등에서만 출시됐고, 국내 시장에서는 실속형 스마트폰인 Q51을 선보였다. Q51의 출고가는 31만9천 원으로 국내에 판매되는 스마트폰 중 최저가다. 그럼에도 6.5인치 대화면 디스플레이, 프리미엄급 스테레오 스피커, 4천mAh 대용량 배터리, 전후면 4개의 카메라를 탑재하며 최고의 가성비를 갖췄다는 평가를 받는다.아울러 다음 달에는 매스 프리미엄폰을 내놓을 예정이다. 'G' 브랜드를 버리고 새롭게 선보이는 제품이다. 공개된 디자인을 살펴보면 신제품은 후면 카메라 3개와 플래시가 물방울이 떨어지는 듯 세로로 배치돼 있다. 메인 카메라는 가장 큰 물방울 형태로 약간 돌출돼 있으며, 나머지 2개 카메라는 후면 글라스 안쪽에 배치된 형태다.가격대는 80만 원대로 예상된다. 기존에 5G 스마트폰이 100만 원 이상을 호가했던 것과 비교하면 가격대를 상당히 낮춘 것이다.차용덕 LG전자 MC디자인연구소 연구소장은 ""한 눈에 보아도 정갈하고, 손에 닿는 순간 매끈한 디자인의 매력에 빠지는 세련된 느낌을 추구했다""며 ""향후 출시되는 제품마다 디자인에 확실한 주제를 부여해 LG스마트폰의 차별화 포인트를 강조할 것""이라고 말했다. jisseo@inews24.com [ⓒ 아이뉴스24 무단전재 및 재배포 금지]",/news/news_read.nhn?article_id=0000533808&office_id=031&mode=search&query=삼성전자&page=3
"한국 비롯해 미국, 러시아 등 주요 국가 홈페이지에 응원 메시지","[아이뉴스24 윤선훈 기자] 삼성전자가 전세계 공식 홈페이지를 통해 코로나19에 신음하고 있는 전세계에 응원의 메시지를 전달했다.10일 삼성전자에 따르면, 한국을 비롯해 미국·영국·이탈리아·브라질·러시아 등 삼성전자 주요 국가 홈페이지 메인에 코로나19에 대한 응원 메시지를 각국의 언어로 내걸었다.국내 홈페이지에는 ""우리는 늘 이겨냈고, 이번에도 함께 이겨낼 것""이라며 ""힘든 시기를 헤쳐나가는 모든 분을 삼성 임직원 모두는 마음을 다해 응원한다""고 적었다.기존 삼성 홈페이지 메인에는 갤럭시 시리즈, TV 등 주로 신제품을 홍보하는 이미지나 각종 이벤트 공지 등이 실렸다. 그러나 이번에 이례적으로 코로나19에 대한 온라인 캠페인을 위해 메인 페이지를 이용했다.삼성전자에 따르면 홈페이지뿐만 아니라 SNS 등에도 메시지를 전파할 계획이다. krel@inews24.com [ⓒ 아이뉴스24 무단전재 및 재배포 금지]",/news/news_read.nhn?article_id=0000533809&office_id=031&mode=search&query=삼성전자&page=3
,"삼성증권은 엘(L)자형 장세를 예측하는 투자자를 위해 ELS 24274회를 14일까지 모집한다고 밝혔다.ELS 24274회는 가입 후 3, 6, 9개월 시점에 돌아오는 조기상환 평가일에, 기초자산인 삼성전자의 종가 최초 기준가에서 2% 이상만 상승하면 연 18.72%(세전) 수익을 받을 수 있다.1년 후 만기시까지 조기상환되지 않으면 만기시점 상승분만큼 이익이 발생한다. 하락했을 경우 하락한 만큼 손실이 발생하지만 최소 원금의 80%는 지급된다.삼성전자 주가의 나이키형 회복을 예상하는 투자자를 위한 ELS 24275회는 가입 후 1년 뒤 기초자산인 삼성전자 주가가 기준가격보다 상승한 경우 상승분의 50%(세전)를 수익으로 받는다. 하락해도 최소 원금의 80%는 지급된다.배옥진기자 withok@etnews.com",/news/news_read.nhn?article_id=0002877506&office_id=030&mode=search&query=삼성전자&page=3
"IC인사이츠, 올초 8% 성장 전망서전년동기比 4% 감소로 돌아서메모리 위주인 韓업체 타격 우려","[서울경제] 글로벌 반도체 시장 규모가 신종 코로나바이러스 감염증(코로나19) 확산 여파로 전년 동기 대비 4%가량 줄어들 것이라는 전망이 제기됐다. 반도체 의존도가 높은 국내 경제에 부정적인 소식이다. 10일 시장조사업체 IC인사이츠에 따르면 올해 메모리와 비메모리를 합친 반도체 시장 규모는 3,458억달러 규모로 전년 동기 대비 4%가량 감소할 것으로 전망했다.
IC인사이츠는 올 초까지만 해도 올해 글로벌 반도체 시장 규모를 전년 대비 8%가량 증가한 3,848억달러로 예상했지만 코로나19 확산이 본격화되기 직전인 지난달 전망치를 3,706억달러로 낮췄다. IC인사이츠 측은 지난달 세계보건기구(WHO)가 ‘코로나 팬데믹(세계적 대유행)’을 선언한 후 코로나19 확산세가 커지자 이달 또다시 전망치를 떨어트렸다. 코로나 19 발생으로 올해 반도체 시장 규모가 연초 예상치 대비 390억달러가량 줄어든 셈이다. D램과 낸드플래시 등 메모리반도체가 주력인 와
또한 타격이 불가피할 것으로 보인다. 중앙처리장치(CPU) 등 시스템반도체 수요 감소는 자연스레 메모리반도체 수요 감소로 이어지기 때문이다.
부정적 전망도 잇따른다. 시장 조사기관 스트래티지애널리틱스(SA)가 올해 글로벌 스마트폰 판매량이 전년 대비 10% 이상 줄어들 것으로 보는 등 전체 D램 시장의 40%가량을 차지하는 모바일용 D램 수요 감소가 예상된다. 공급 부족 우려로 오름세를 지속하던 PC용 D램(DDR4 8Gb) 현물 가격 또한 지난 7일 이후부터 하락세로 전환했다. 국내 반도체 업체들은 서버용 메모리반도체 수요에 기대를 걸고 있다. 최근 코로나19 확산에 따른 재택근무 확대 및 ‘언택트’ 소비 확산으로 클라우드 시장 급성장이 예상되기 때문이다. DDR4 32GB 기준 서버용 D램 가격은 지난해 말 106달러에서 지난달 121.3달러로 오르는 등 수요가 늘고 있다. 다만 코로나19에 따른 각국의 외국인 입국제한이 장기화할 경우 클라우드 센터 증설 등의 일정에도 차질이 불가피해 올 하반기부터 서버용 반도체 수요가 줄어들 수 있다는 우려도 나온다. /양철민기자 chopin@sedaily.com저작권자 ⓒ 서울경제, 무단 전재 및 재배포 금지",/news/news_read.nhn?article_id=0003722850&office_id=011&mode=search&query=삼성전자&page=3
,"코아시아가 삼성전자 파운드리 디자인 솔루션 파트너(DSP)로 등록된 가운데 지난해 인수한 넥셀(Nexell)이 삼성전자 엑시노스(Exynos)와 아틱(ARTIK) 개발 레퍼런스를 보유하고 있는 것으로 알려졌다.10일 코아시아에 따르면 넥셀은 삼성전자 애플리케이션 프로세서(AP)인 엑시노스와 사물인터넷(IoT) 모듈인 아틱 등 개발과제에 참여했다. 현재 글로벌 완성차·전기차 생산기업들의 과제를 수행 중이다. 회사는 넥셀과 자사 글로벌 디자인 센터를 활용해 삼성전자의 메인 DSP로 올라선다는 계획이다. 앞서 코아시아는 지난 7일 삼성전자 파운드리 홈페이지 내 DSP 리스트에 등록된 바 있다.코아시아는 지난해 홍콩 자회사 코아시아세미(CoAsia SEMI)를 설립하고 시스템반도체 설계전문기업 쎄미하우(Semihow)와 넥셀에 투자했다. 국내를 비롯해 중국, 대만, 베트남 등에 디자인센터 설립을 완료하고 글로벌 인력도 충원했다. 이로써 글로벌 고객 발굴에서부터 납품까지 시스템반도체의 전영역에 이르는 DSP 역량을 확보했다.삼성전자가 오는 2030년까지 총 133조원을 투자해 시스템반도체 글로벌 1위로 올라서겠다는 '반도체 비전 2030' 등 우호적 시장 환경이 조성된 점도 긍정적이다. 미세공정 및 AP 플랫폼 기반 기술력을 바탕으로 인공지능(AI), 전장용, 5G, IoT, 고성능컴퓨팅(HPC) 분야 관련 최고 수준의 과제를 추진한다는 전략이다. 회사 관계자는 ""DSP 선정 기준이 새롭게 정립된 이후 파트너사로 단독 등록된 점이 큰 의미가 있다""며 ""시스템 반도체 설계 능력을 바탕으로 기존의 대만 중국 시장에 이어 미국의 플랫폼 개발 시장에 적극적으로 진출할 예정""이라고 말했다.[디지털뉴스국 김경택 기자] [ⓒ 매일경제 & mk.co.kr, 무단전재 및 재배포 금지]",/news/news_read.nhn?article_id=0004554734&office_id=009&mode=search&query=삼성전자&page=3
,"코로나19 여파로 올해 글로벌 반도체 시장이 4% 역성장할 것이란 전망이 나왔다.반도체 시장조사업체 IC인사이츠는 올해 글로벌 반도체(IC·집적회로) 시장 규모가 3458억달러(약 419조6000억원)로 전년 대비 4% 감소할 것으로 전망된다고 10일 밝혔다. 지난 1월 올해 반도체 시장이 8% 성장할 것이라고 전망했던 IC인사이츠는 지난달 전망치를 3%로 낮췄다가 이번에는 아예 마이너스 성장을 예상한 것이다.지난달 전망치 발표 당시만해도 코로나19 영향이 중국을 비롯해 아시아 지역으로 한정돼 있었다. 그러나 최근 북미와 유럽 지역으로 병세가 확산되면서 전망치 하향 조정이 불가피했다고 IC인사이츠는 설명했다. 미국에서 코로나19 환자는 지난 9일 기준 45만명을 넘어섰다. 지난달 19일 대비 45배 이상 증가한 수치다. 유럽 역시 환자가 75만명에 육박한다.다만 업계에서는 온라인 트래픽 급증으로 서버용 메모리 반도체 수요는 지속 성장할 것으로 보고 있어 다른 업종보다는 상대적으로 코로나19의 영향이 적을 것이란 예측이 나온다. 지난 7일 삼성전자의 1분기 실적 발표에서도 반도체 사업은 가전이나 스마트폰 등 다른 부문에 비해 선방했다는 평가가 나왔다.구교형 기자 wassup01@kyunghyang.com©경향신문(www.khan.co.kr), 무단전재 및 재배포 금지",/news/news_read.nhn?article_id=0003003004&office_id=032&mode=search&query=삼성전자&page=3
"달러/원 환율, 8.4원 내린 1211.1원","(서울=뉴스1) 전민 기자 = 10일 코스피 지수가 상승세를 보이며 1850선까지 올랐다. 반면 코스닥은 1%대 하락세를 보이고 있다. 달러/원 환율은 연준의 추가 부양 대책에 따른 달러약세로 하락세를 보이고 있다.(원화가치 강세)이날 오후 1시40분 기준으로 코스피 지수는 전날보다 14.52p(0.79%) 오른 1850.73에 거래 중이다. 0.45p(0.02%) 내린 1835.76으로 출발했으나 상승 전환했다.현재까지 개인이 3279억원 순매수했다. 외국인과 기관은 각각 395억원, 2962억원 순매도했다.시가 총액 상위 10개 종목 중 삼성바이오로직스, 현대차, 삼성물산 등이 상승했다. 삼성전자, SK하이닉스, NAVER, 셀트리온, LG화학, LG생활건강은 하락했다.코스닥 지수는 8.09p(1.31%) 내린 607.86을 보이고 있다. 개인이 2343억원 순매수했고, 외국인과 기관은 각각 1215억원, 1074억원 팔았다.시가총액 상위 10개 종목 중 셀트리온헬스케어, 에이치엘비, 펄어비스, 씨젠, 케이엠더블유, 스튜디오드래곤, 헬릭스미스가 하락했다. CJ ENM, 셀트리온제약, 제넥시은 주가가 올랐다.전날 미국 증시는 연방준비제도(연준)의 공격적 부양정책 발표에 일제히 상승했다. 연준은 정크본드(투자부적격 채권)까지 매입하며 2조5000억달러에 달하는 자금을 투입하는 초강수 대책을 내놓았다. 이에 다우(1.2%), S&P500(1.45%), 나스닥(0.77%) 지수가 모두 상승했다.달러/원 환율은 8.4원 내린 1211.1원에 거래 중이다. 연준의 부양책 발표로 달러화가 약세를 보인 영향이다.min785@news1.kr© 뉴스1코리아(), 무단 전재 및 재배포 금지",/news/news_read.nhn?article_id=0004578318&office_id=421&mode=search&query=삼성전자&page=3
,"[머니투데이 이정혁 기자] 삼성전자가 코로나19 사태 극복을 위한 글로벌 온라인 캠페인을 진행한다.삼성전자는 10일 국내 홈페이지에 ""우리는 늘 이겨냈고, 이번에도 함께 이겨낼 것""이라며 ""힘든 시기를 헤쳐나가는 모든 분을 삼성 임직원 모두는 마음을 다해 응원한다""는 메시지를 띄웠다.미국과 영국, 멕시코, 브라질 등 국가의 공식 사이트에도 코로나19를 함께 이겨내자는 내용의 문구를 내걸었다. 삼성전자는 페이스북, 인스타그램 등 SNS(소셜네트워크서비스) 계정을 통해서도 응원 메시지를 전할 예정이다.앞서 삼성은 경북 영덕연수원을 코로나19 생활치료센터로 운영하도록 제공했다. 마스크 제조사들의 생산량 증대를 지원하는 동시에 해외에서 확보한 마스크 33만개도 기부했다.특히 구호물품과 성금 등 300억원을 긴급 지원했고, 온누리상품권 300억원어치를 구입해 협력사에 지급했다. 코로나19 사태로 직격탄을 입은 화훼농가 지원을 위해 '꽃 소비 늘리기'에도 동참하고 있다.이정혁 기자 utopia@mt.co.kr
<저작권자 ⓒ '돈이 보이는 리얼타임 뉴스' 머니투데이, 무단전재 및 재배포 금지>",/news/news_read.nhn?article_id=0004392639&office_id=008&mode=search&query=삼성전자&page=3
