head,text,url
▶ '아는 척'하고 싶은 당신을 위한 [두유노우]▶ 한눈에 보는 [4·15총선 NEWS MAP],"[파이낸셜뉴스] 삼성증권은 슈팅업 주가연계증권(ELS) 시리즈를 출시한다고 10일 밝혔다.
 L자형 장세를 예측하는 투자자들을 위해 ELS 24274회를 14일까지 모집한다. ELS 24274회는 가입 후 3, 6, 9개월 시점에 돌아오는 조기상환 평가일에, 기초자산인 삼성전자의 종가 최초 기준가의 2% 이상만 상승하면 연 18.72%(세전) 의 수익을 받을 수 있다.
 1년 후 만기시까지 조기상환되지 않을 경우는 만기시점에 상승한 상승분 만큼 이익이 발생한다. 하지만 하락했을 경우라면, 하락한 만큼 손실이 발생하게 되지만, 최소 원금의 80%는 지급되도록 설계해 손실에 대한 걱정을 줄였다.
 삼성전자 주가의 나이키형 회복을 예상하는 투자자를 위해 마련한 ELS 24275회는 가입 후 1년 뒤 기초자산인 삼성전자의 주가가 기준가격보다 상승한 경우, 상승분의 50%(세전)를 수익으로 받게 된다. 반대로 삼성전자의 주가가 최초 기준가보다 하락했을 경우에는 하락분 만큼 손실이 발생하지만 이 경우도 최소 원금의 80%는 지급되도록 설계했다.
 김성봉 삼성증권 상품지원담당은 ""실물경제와 관련된 부정적 지표 등이 나오기 시작하면 추가적으로 시장에 변동성이 커지거나 회복기간이 길어질 수도 있을 것으로 예상하는 투자자들도 상당수 있다""며 ""이런 전망을 갖고 계신 투자자들의 경우 손실은 일정수준으로 제한하면서 수익을 추구할 수 있는 슈팅업 ELS가 적합하다고 판단되어 향후 지속적으로 상품을 출시할 계획""이라고 말했다.
 한편, 삼성증권은 ELS를 포함해 금융투자상품을 온라인으로 매월 일정 금액 이상, 일정 횟수만큼 거래하면 최대 5만원을 추가로 받을 수 있는 '혜택을 THE 받다' 이벤트를 12월 31일까지 진행하고 있다.



 ※ 저작권자 ⓒ 파이낸셜뉴스. 무단 전재-재배포 금지",/news/news_read.nhn?article_id=0004406118&office_id=014&mode=search&query=삼성전자&page=6
,"[서울경제] 전일 상승세를 보였던 코스피가
기관의 '팔자' 기조에 하락 전환했다.10일 오전 9시 6분 현재 코스피는 전일 대비 0.45p(-0.02%) 내린 1835.76로, 52(매도):48(매수)의 매도우위를 기록 중이다.투자자별 동향을 살펴보면, 개인과 외국인 동반 매수세를 보이고 있으나,
기관의 '팔자' 기조에 밀리고 있다. 개인은 613억, 외국인은 32억을 순매수 중이며, 기관은 633억을 순매도하고 있다.업종별로는 (-1.12%), (-0.59%), (-0.29%) 등이 하락세를 보이고 있는 반면, (+3.02%), (+0.81%), (+0.78%) 등은 상승했다.종목별로는 삼성전자가 0.31% 내린 4만 8950원에 거래되는 가운데, (-9.48%), (-8.78%), (-7.55%)도 내림세를 보이고 있다. 반면 (+15.17%), (+12.77%), (+11.75%) 등은 상승 출발했다.현재 하락종목은 344개, 상승종목은 421개를 기록하고 있다.[이 기사는 증시분석 전문기자 서경뉴스봇(newsbot@sedaily.com)이 실시간으로 작성했습니다.]/서경뉴스봇 newsbot@sedaily.com저작권자 ⓒ 서울경제, 무단 전재 및 재배포 금지",/news/news_read.nhn?article_id=0003722626&office_id=011&mode=search&query=삼성전자&page=6
,"삼성증권은 슈팅업 주가연계증권(ELS) 시리즈를 출시한다고 10일 밝혔다.L자형 장세를 예측하는 투자자들을 위해 ELS 24274회를 14일까지 모집한다. ELS 24274회는 가입 후 3·6·9개월 시점에 돌아오는 조기상환 평가일에, 기초자산인 삼성전자의 종가 최초 기준가의 2% 이상만 상승하면 연 18.72%(세전) 의 수익을 받을 수 있다.1년 후 만기시까지 조기상환되지 않으면 만기시점에 상승한 상승분 만큼 이익이 발생한다. 다만 하락하면 하락한 만큼 손실이 발생하지만 최소 원금의 80%는 지급되도록 설계해 손실 우려를 줄였다고 삼성증권은 설명했다.ELS 24275회 삼성전자 주가의 ‘나이키형’ 회복을 예상하는 투자자를 위해 마련한 상품이다. 이 상품은 가입 후 1년 뒤 기초자산인 삼성전자의 주가가 기준가격보다 상승하면 상승분의 50%(세전)를 수익으로 받게 된다. 반대로 삼성전자의 주가가 최초 기준가보다 하락했을 경우에는 하락분 만큼 손실이 발생한다. 이 경우에도 최소 원금의 80%는 지급되도록 설계했다.김성봉 삼성증권 상품지원담당은 ""손실은 일정수준으로 제한하면서 수익을 추구할 수 있는 슈팅업 ELS가 적합하다고 판단되어 향후 지속적으로 상품을 출시할 계획""이라고 했다.삼성증권은 또 ELS를 포함해 금융투자상품을 온라인으로 매월 일정 금액 이상, 일정 횟수만큼 거래하면 최대 5만원을 추가로 받을 수 있는 ‘혜택을 THE 받다’ 이벤트를 12월 31일까지 진행하고 있다.[이다비 기자 dabee@chosunbiz.com]	[]	[] 	chosunbiz.com",/news/news_read.nhn?article_id=0000507732&office_id=366&mode=search&query=삼성전자&page=6
,"미국 연방준비제도이사회(Fed)가 파격적인 유동성 정책을 내놓았지만 국제 유가가 재차 급락하면서 코스피가 보합권에 머물고 있다. 10일 오전 9시 5분 현재 코스피는 전일 대비 2.71포인트(0.15%) 오른 1838.92를 기록하고 있다.코스피는 코로나19가 미국, 유럽 등으로 확산하자 지난달 19일 1430선까지 하락했다. 하지만 최근 한달여동안 가파른 회복세를 보이면서 1850선 회복에 다가서고 있다. 연준은 최대 2조3000억 달러의 유동성을 시중에 공급할 수 있는 조치를 발표했다. 일부 투기등급 회사채(정크본드)와 상업용 주택저당증권(CMBS), 대출채권담보부증권(CLO)까지 매입하기로 해 파격적이라는 평가가 나오고 있다. 코로나 19 사태로 인해 신용경색 리스크 경고등이 켜진 기업, 가계 및 지방정부를 지원하기 위해 연준이 전격적으로 지원을 결정한 것이다. 특히 코로나 19 사태 이후 금융위기를 촉발시킬 수 있는 시한폭탄으로 지목되었던 대출채권담보부증권(CLO)마저 매입하기로 한 것은 미 연준의 금융 시스템 리스크를 선제적으로 차단하기 위한 목적으로 해석해 볼 수 있다. 또한 코로나 19 이후 신용등급이 정크본드로 강등된 기업들에 대해서도 구제의 손길을 던져주었다는 점은 미 정부와 연준의 기업 도산 방어 의지를 읽을 수 있는 부분이라고 평가받고 있다. 회원국 간 이견으로 지연되던 EU 경기부양 패키지도 합의에 도달했다. 패키지 규모는 5000억 달러로 주요 내용은 수개월 내 역내 기업들에게 추가 유동성을 제공하고, 정부의 고용 프로그램에 자금을 지원하며, 금융시장 접근이 어려운 유럽 정부에 비교적 유리한 조건으로 신용 라인을 제공하는 것이다. OPEC+는 5월1일부터 6월30일까지 두 달간 현재보다 하루 1000만 배럴의 원유를 감산하기로 합의했다. 이후 7월1일부터 올해 말까지 하루 800만 배럴, 내년 1월부터 2022년 4월까지는 하루 600만 배럴을 단계적으로 감산할 예정이다.감산이 확실시된 이번 OPEC+ 긴급회의가 시작되자 국제 유가는 10% 이상 상승했지만 회의 도중 감산량이 하루 1000만 배럴이라는 소식이 전해지면서 서부 텍사스산 원유(WTI)는 9.3%나 급락했다. 시장에서는 코로나19 우려에 기인한 글로벌 원유수요 감소분이 더욱 크기 때문에 이번 감산합의가 큰 효과를 발휘하지는 못할 것이란 평가가 나온다. 글로벌 원유수요 감소분은 약 2000만~2700만 배럴 규모인 것으로 추정된다.김병연 NH투자증권 연구원은 ""하락분의 50% 되돌림점인 1850포인트는 잠시 쉬어가는 구간으로 신용경색 우려, 우한 이동 재개와 라마단 등으로 인해 코로나19 재확산에 대한 경계감이 여전하다""라며 ""증안펀드 집행 미국 4차 재정정책 논의, OPEC+ 감산 합의 등 기대감도 높아 조정이 나타나더라도 하락분의 33% 되돌림점인 1700선 초반이 지지선으로 작용할 전망""이라고 말했다.업종별로 의약품, 철강·금속, 운송장비 등이 1~2% 오르고 있고 화학, 음식료품, 유통업 등은 떨어지고 있다.매매주체별로 개인과 외국인이 각각 559억원, 4억원을 순매수하고 있고 기관은 554억원을 순매도하고 있다. 프로그램 매매는 558억원 매도 우위다.시가총액 상위 종목들은 혼조세다. 삼성전자, SK하이닉스, NAVER, LG생활건강 등은 떨어지고 있고 삼성바이오로직스, 셀트리온, LG화학, 현대차 등은 오르고 있다.이날 유가증권시장에서는 416개 종목이 상승하고 있고 356개 종목이 하락하고 있다.코스닥은 전일 대비 1.32포인트(0.21%) 오른 617.27을 기록 중이다.[디지털뉴스국 고득관 기자] [ⓒ 매일경제 & mk.co.kr, 무단전재 및 재배포 금지]",/news/news_read.nhn?article_id=0004554509&office_id=009&mode=search&query=삼성전자&page=6
,"삼성전자의 차기 태블릿 ‘갤럭시탭S6 라이트’가 20일을 전후해 국내에 출시될 전망이다.10일 복수의 유통업체는 갤럭시탭S6 라이트를 판매 목록에 올리고 4월20일부터 순차 배송한다고 밝혔다. 출고가는 53만9000원으로 책정됐다. 다만 현재는 판매목록에서 제품이 사라진 상태다.박흥순 기자 soonn@mt.co.kr
<저작권자 ⓒ '성공을 꿈꾸는 사람들의 경제 뉴스' 머니S, 무단전재 및 재배포 금지>",/news/news_read.nhn?article_id=0000529426&office_id=417&mode=search&query=삼성전자&page=6
,"[머니투데이 한정수 기자] 코스피 지수가 소폭 하락세를 보이고 있다. 미국 증시가 이틀째 상승세를 보인 가운데 코스피는 아직까지 전날의 상승세를 이어가지는 못하고 있는 모습이다.10일 오전 9시13분 현재 코스피 지수는 전 거래일 대비 4.07포인트(0.22%) 하락한 1832.14를 나타내고 있다. 장 초반 개인이 1250억원을 순매수하고 있으나 외국인과 기관은 각각 83억원, 1178억원 매도 우위다. 대다수의 업종이 보합권에서 움직이고 있다. 철강·금속만 2%대 강세다. 의약품과 운송장비 등은 1%대 상승세다. 음식료품과 화학 등은 1% 하락세를 보이고 있다. 시가총액 상위 10개 종목 중에서는 삼성바이오로직스가 약 4%대 강세다. 삼성전자와 SK하이닉스는 하락세를 타고 있다. 셀트리온과 현대차를 제외하고는 모두 내림세다. 코스닥 지수도 전 거래일보다 2.03포인트(0.33%) 떨어진 613.92를 기록 중이다. 개인이 725억원 매수 우위를 보인다. 외국인과 기관은 각각 298억원, 325억원어치 순매도하고 있다. 코스닥도 모든 업종이 보합권에서 움직인다. 통신서비스, 유통 등이 강보합권, 음식료, 금융, 운송 등은 약보합권에 자리하고 있다. 코스닥 시가총액 상위 10개 종목들도 대체로 보합권에 머물고 있다. 제넥신만 전날보다 8200원(12.73%) 오른 7만2600원에 거래되고 있다. 셀트리온헬스케어, 셀트리온제약, 스튜디오드래곤이 강보합권이고 나머지는 소폭 하락세다. 한정수 기자 jeongsuhan@mt.co.kr
<저작권자 ⓒ '돈이 보이는 리얼타임 뉴스' 머니투데이, 무단전재 및 재배포 금지>",/news/news_read.nhn?article_id=0004392419&office_id=008&mode=search&query=삼성전자&page=6
"개인 '사자', 외국인·기관 '팔자'…의약품 2%대 상승시가총액 상위주 '혼조세'…美회사 위탁계약에 '삼바' 4%↑","[이데일리 고준혁 기자] 10일 코스피는 장 초반 보합권에서 등락을 반복하고 있다. 최근 신종 코로나 바이러스 감염증(코로나19)이 정점을 통과하고 있단 전망이 조심스럽게 나오면서 최근 주가는 점차 오르는 흐름이었으나, 국제유가의 하락이 상승에 압력을 가하고 있는 것으로 보인다. 마켓포인트에 따르면 오전 9시 12분 코스피 지수는 전 거래일 대비 5.94포인트(0.32%) 내린 1830.27을 기록했다. 0.45포인트(0.02%) 내린 1835.76으로 개장한 뒤 등락을 반복, 1830선을 아슬아슬하게 유지하고 있다.
9일(현지시간) 석유수출국기구(OPEC)와 러시아 등으로 구성된 10개국 석유수출 협의체인 OPEC+는 회의를 열고 5월부터 두 달간 하루 1000만 배럴을 감산하는 데 합의했다. OPEC+는 오는 7~12월 기간엔 하루 800만 배럴을 감산하고 2021년1월부터 2022년4월에는 하루 600만 배럴을 감산하겠다고 밝혔다.이러한 감산 합의에도 국제유가는 하락했다. 이날 뉴욕상업거래소(NYMEX)에서 5월 인도분 서부 텍사스산 원유(WTI)는 배럴당 9.3%(2.33달러) 하락한 22.76달러에 거래를 마쳤다. 백영찬 KB증권 연구원은 “원유 감산에도 유가가 하락한 것은 이번 감산이 이미 WTI 가격상승에 반영돼 있었기 때문”이라며 “하루 1000만 배럴 감산 규모는 대규모 수요 축소를 고려할 때 여전히 부족하단 의미로 해석된다”고 설명했다.수급주체별로는 개인이 481억원 매수하고 있다. 외국인과 기관은 각각 69억원, 412억원 순매도 중이다. 프로그램별로는 차익과 비차익을 합쳐 580억원 매도 우위를 점하고 있다. 업종별로는 대부분이 오르고 있다. 의약품이 2%대 상승 중이다. 이어 철강·금속, 은행, 운수창고, 보험, 통신업, 금융업 전기가스업도 등 순으로 오르고 있다. 음식료품은 1%대 하락 중이고 화학, 종이·목재, 전기·전자, 유통업, 서비스업 등은 내리고 있다. 시가총액 상위주는 혼조세다. 대장주인 삼성전자(005930), SK하이닉스(000660), 네이버(035420), LG생활건강(051900)은 하락 중이다. 미국 소재 제약회사와 4418억원 규모의 바이오의약품 위탁생산계약 의향서를 체결했다고 공시한 삼성바이오로직스(207940)는 4%대 크게 오르고 있다. 셀트리온(068270), LG화학(051910), 현대차(005380), 삼성SDI(006400), 현대모비스(012330)도 상승 중이다.고준혁 (kotaeng@edaily.co.kr)＜ⓒ종합 경제정보 미디어 이데일리 - 무단전재 & 재배포 금지＞",/news/news_read.nhn?article_id=0004617284&office_id=018&mode=search&query=삼성전자&page=6
외국인·기관 순매도 중…코스닥도 하락세,"[아이뉴스24 류은혁 기자] 코스피는 간밤 주요 산유국들의 원유 감산 소식에도 기대했던 수준에 미치지 못한 데 따른 유가 급락과 지속되는 코로나19 확산 공포로 약보합세로 출발했다.간밤 사우디아라비아와 러시아 등 산유국들은 코로나19로 인한 원유 수요 감소에 대응해 하루 원유 생산량을 1천만 배럴을 줄이는 데 합의했다.로이터통신 등 외신에 따르면 OPEC를 비롯한 주요 산유국들은 5월과 6월에 하루 1천만 배럴의 감산에 원칙적으로 합의했다. 이후 7월 1일부터 올해 말까지 하루 800만 배럴, 내년 1월부터 2022년 4월까지는 하루 600만 배럴을 단계적으로 감산할 예정이다.10일 코스피지수는 전 거래일보다 0.45포인트(0.02%) 내린 1835.76에 거래를 시작해 오전 9시8분 기준 0.74포인트 오른 1836.95다. 현재 개인은 1천161억원 순매수 중이며 외국인과 기관은 각각 80억원과 1천85억원을 순매도 중이다.이날 코스피에서 시가총액 상위 10종목은 혼조세 보이고 있다. 삼성전자(-0.61%), SK하이닉스(-2.12%), 삼성전자우(-0.12%)는 하락세를 보이는 반면 삼성바이오로직스 4.28%, 현대차 2.57%, 현대모비스 2.25%의 상승세를 보이고 있다.같은 시각 코스닥지수는 전 거래일보다 1.80포인트(0.29%) 오른 617.75에 장을 시작해 하락세로 전환했다. 지수는 오전 9시 15분 기준 0.48% 내린 612.98을 기록 중이다.개인은 664억원 순매수 중인 반면 외국인과 기관은 각각 331억원, 312억원을 순매도 하고 있다.시가총액 상위 10종목은 혼조세다. 에이치엘비(-1.00%), 펄어비스(-0.56%), 씨젠(-1.87%)이 내림세를 보이고 있는 반면 셀트리온헬스케어 0.50%, 셀트리온제약 1.81%, 스튜디오드래곤 0.54%의 상승세를 보이고 있다. ehryu@inews24.com [ⓒ 아이뉴스24 무단전재 및 재배포 금지]",/news/news_read.nhn?article_id=0000533756&office_id=031&mode=search&query=삼성전자&page=6
,"[서울=뉴시스] 김종민 기자 = 삼성전자 베트남이 코로나19 영향에 따라 올해 수출액이 11%이나 감소할 것이란 전망이 나왔다. 10일 베트남 정부 보고서를 인용한 현지언론에 따르면, 삼성전자 베트남의 2020년 수출액은 지난해 비해 11%나 감소한 455억달러에 그칠 것으로 보인다.코로나19에 따른 미국과 유럽의 수요 감소가 큰 원인으로 지목됐다. 베트남 스마트폰 수출에서 EU가 24%, 미국이 17%로 삼성 베트남 수출의 절반을 함께 차지하고 있다.베트남은 삼성 스마트폰과 TV·세탁기 등 세트 사업의 핵심 생산 기지가 있는 곳으로 베트남 박닌성과 타이응우옌성, 호찌민에 생산법인을 두고 있다. 하노이 북부에 위치한 박닌과 타이응우옌성 법인은 스마트폰을, 호찌민은 가전 제품을 생산한다. 한편 베트남 지난해 수출은 2640억 달러로 스마트폰, 컴퓨터 및 전자제품 분야가 3분의 1을 차지했다. jmkim@newsis.com<ⓒ 공감언론 뉴시스통신사. 무단전재-재배포 금지>",/news/news_read.nhn?article_id=0009807732&office_id=003&mode=search&query=삼성전자&page=6
Fed 2.3조달러 부양책에 美 증시 상승 OPEC+ 감산 합의 실망 부정적 영향,"코스피지수가 상승 전환한 후 1840선을 회복했다. 미국 중앙은행(Fed)이 대규모 부양책을 발표한 점이 투자심리에 긍정적인 영향을 미쳤다.10일 오전 9시32분 현재 코스피지수는 전 거래일보다 9.72포인트(0.53%) 오른 1845.93에 거래되고 있다. 이날 코스피는 0.45포인트(0.02%) 하락한 1835.76에 출발한 후 상승 전환했다.간밤 미국 증시는 Fed의 대규모 부양책 발표에 상승했다. Fed는 기업 지원인 메인스트리트 대출을 포함하는 2조3000억달러 규모 실물 경제 지원 방안을 발표했다. 사실상 주식을 제외한 모든 유가증권의 매입에 나서는 것이다. 이에 따라 9일(현지시각) 뉴욕증권거래소(NYSE)에서 다우존스30 산업평균지수는 전 거래일보다 1.22% 상승했다. 스탠더드앤드푸어스(S&P)500 지수와 나스닥지수도 각각 1.45%, 0.77% 올랐다.서상영 키움증권 투자전략팀장은 ""Fed의 대규모 부양책에 대한 기대로 미국 증시가 오르고 그 영향이 국내 증시에 미칠 것""이라며 ""다만 원유 감산 합의에 대한 실망이 국제 유가의 변동성을 키우면서 증시에 부정적으로 작용할 수 있다""고 했다.9일(현지시간) 뉴욕상업거래소에서 5월 인도분 서부 텍사스산 원유(WTI)는 전 거래일 대비 배럴당 9.29% 하락했다. OPEC+(석유수출국기구인 OPEC과 10개 주요 산유국의 연대체)가 감산에 합의했지만 시장 기대치(2000만 배럴 감산)에 미치지 못한 점이 유가 하락을 이끌었다. OPEC+는 5월부터 두 달간 하루 1000만 배럴의 원유를 감산하기로 뜻을 모았지만 멕시코 등의 반대로 최종 합의에 실패한 것으로 알려졌다.외국인은 장중 사자로 돌아서 163억원 순매수 중이다. 개인도 1470억원 매수 우위다. 기관은 홀로 1637억원 순매도세다.시가총액 상위 종목 대부분은 혼조세다. 삼성바이오로직스(4.39%) 셀트리온(0.71%) 현대차(3.50%) 등이 오르고 있다. 반면 삼성전자(0.71%) SK하이닉스(1.65%) 네이버(0.90%) 등은 내림세다.같은 시간 코스닥지수도 상승 중이다. 전날보다 0.92포인트(0.15%) 오른 616.87에 거래되고 있다. 개인이 615억원 사고 있다. 외국인과 기관은 각각 304억원, 283억원 팔고 있다.원·달러 환율은 하락(원화 강세)하고 있다. 서울외환시장에서 오전 9시33분 현재 원·달러 환율은 전날보다 5.6원 내린 1213.9원에 거래되고 있다.윤진우 한경닷컴 기자 jiinwoo@hankyung.com▶ ▶
 ▶
ⓒ 한국경제 & , 무단전재 및 재배포 금지",/news/news_read.nhn?article_id=0004322022&office_id=015&mode=search&query=삼성전자&page=5
,"삼성증권은 최근 변동성이 높은 L자형 시장에 대응하는 '슈팅업 ELS 시리즈'를 출시했다고 10일 밝혔다.지수가 아닌 종목 ELS는 주식 직접 투자할 경우에는 기초자산가격의 상승할 때에는 이익만큼, 하락할 경우는 손실이 발생할 수 있어 직접 주식투자매매 대안책으로 부상하는 투자법이다.회사는 ELS 24274회를 오는 14일까지 모집한다. ELS 24274회는 가입 후 3, 6, 9개월 시점에 돌아오는 조기상환 평가일에, 기초자산인 삼성전자의 종가 최초 기준가의 2% 이상만 상승하면 연 18.72%(세전) 의 수익을 받을 수 있다.만약, 1년 후 만기시까지 조기상환되지 않을 경우는 만기시점에 상승한 상승분 만큼 이익이 발생한다. 하지만 하락했을 경우라면, 하락한 만큼 손실이 발생하게 되지만, 최소 원금의 80%는 지급되도록 설계해 손실에 대한 걱정을 줄였다.또한. 삼성전자 주가의 나이키형 회복을 예상하는 투자자를 위해 마련한 ELS 24275회는 가입 후 1년 뒤 기초자산인 삼성전자의 주가가 기준가격보다 상승한 경우, 상승분의 50%(세전)를 수익으로 받게 된다. 반대로 삼성전자의 주가가 최초 기준가보다 하락했을 경우에는 하락분 만큼 손실이 발생하지만 이 경우도 최소 원금의 80%는 지급되도록 설계했다.김성봉 삼성증권 상품지원담당은 ""실물경제와 관련된 부정적 지표 등이 나오기 시작하면 추가적으로 시장에 변동성이 커지거나 회복기간이 길어질 수도 있을 것으로 예상하는 투자자들도 상당수 있다""며 ""손실은 일정수준으로 제한하면서 수익을 추구할 수 있는 슈팅업 ELS가 적합하다고 판단되어 향후 지속적으로 상품을 출시할 계획""이라고 말했다.[디지털뉴스국 김규리 기자] [ⓒ 매일경제 & mk.co.kr, 무단전재 및 재배포 금지]",/news/news_read.nhn?article_id=0004554537&office_id=009&mode=search&query=삼성전자&page=5
