head,text,url
"CXO연구소, 국내 100大 그룹 재벌가 부인 90명 주식평가액 조사 삼성 홍라희 前 리움 관장 2조 6860억원 1위…종근당 정재정 · 동서 문혜영 여사 TOP 3 올라 노소영 아트센터 나비 관장 주식재산 22억 원 수준…90명 중 40명은 상장사 주식 미보유로 파악","[서울=뉴시스] 김종민 기자 = SK 최태원 회장과 노소영 아트센터 나비 관장 간 이혼 소송이 본격적으로 시작됐다. 이를 계기로 재벌가 부인들의 주식재산이 어느 정도 되는지도 세간의 관심사로 떠올랐다. 국내 주요 재벌가 부인 90명 중 10명은 주식재산이 100억 원 이상 되는 것으로 나타났다. 반면 40명은 상장사 주식을 단 1주도 보유하지 않은 것으로 파악됐다. 재벌가 안주인라고 해도 주식재산에 대해서만큼은 큰 차이를 보였다. 이 같은 결과는 기업분석 전문 한국CXO연구소(소장 오일선)가 ‘국내 주요 100대 그룹 재벌가 부인 주식재산 현황 조사’ 결과에서 도출됐다고 9일 밝혔다. 조사 대상은 공정거래위원회가 관리하는 59개 대기업집단을 포함해 총 100개 그룹을 대상으로 조사가 이뤄졌다. 조사 대상자는 오너가 부인 성함 파악이 가능한 90명이다. 오너 부인 성함은 공정위 공시 자료와 언론 기사 및 각종 인물 검색 등을 통해 파악했다. 주식 재산은 금융감독원에 보고된 주식 중 보통주 기준(우선주 제외)으로 조사가 이뤄졌고, 7일 종가를 곱해 주식평가액을 산정했다. 비상장사 주식가치는 이번 조사에서 제외했다. 또 여성 자신이 그룹 총수 내지 경영자로 활동하거나, 배우자가 고인(故人)이 된 경우 등은 조사에는 포함시켰으나 주식평가액 순위에는 제외했다.조사 결과 국내 주요 재벌가 안방마님 90명 중 주식부자 1위는 이건희 삼성전자 회장의 부인 홍라희 전(前) 리움미술관 관장인 것으로 나타났다. 홍 전 관장은 삼성전자 보통주 주식 5415만 3600주(0.91%)를 보유해 이달 7일 기준 주식재산 가치만 2조 6860억 원에 달했다.종근당그룹 이장한 회장의 부인 정재정 여사는 409억 원으로 넘버2를 차지했다. 정 여사는 종근당홀딩스 주식을 29만 1575주 보유하고 있는데, 7일 종가 10만 8000원으로 곱한 주식평가액만 해도 310억 원을 훌쩍 넘겼다. 94억 원 상당의 경보제약 주식도 함께 보유하고 있는 것으로 파악됐다. 커피 재벌로 유명한 동서그룹 김석수 회장의 부인 문혜영 여사는 336억 원으로 오너가 안방마님 주식부자 클럽 TOP 3에 이름을 올렸다. 문 여사는 (주)동서 주식을 200만 5935주(2.01%)를 갖고 있다. 농심그룹 신춘호 회장의 부인 김낙양, 한미약품그룹 임성기 회장의 부인 송영숙 여사는 200억 원대 주식평가액을 보유하며 다섯 손가락 안에 이름을 올렸다. 김낙양 여사는 율촌화학(145억 원), 농심홀딩스(98억 원), 농심(7억9000만 원) 세 곳의 주식종목에서 251억 원 상당의 주식평가액을 보였다. 송영숙 여사는 한미사이언스에서 231억 원 상당의 주식재산을 갖고 있는 것으로 확인됐다. 이어 6위 이병무 아세아그룹
회장 부인 이정자 여사 187억 원, 7위 김승연 한화그룹 회장 부인 서영민 여사 183억 원, 8위 김홍국 하림그룹 회장 부인 오수정 맥시칸 대표이사 170억 원, 9위 조석래 효성그룹 명예회장 부인 송광자 여사 156억 원, 10위 김상범 이수그룹 회장 부인 김선정 광주비엔날레 대표이사가 120억 원으로 100억 원대 주식재산을 보유하고 있는 것으로 조사됐다. 앞서 100억 원 이상 주식재산을 보유한 그룹 오너 부인 중 5% 이상 지분을 보유한 경우도 있었다. 2019년 사업보고서 기준 종근당홀딩스(5.82%)와 경보제약(5.42%) 주식을 보유한 정 여사와 이수페타시스(6.54%) 지분을 보유한 김 대표이사가 그 주인공이다. 여성이 그룹 총수내지 경영자이면서 100억 원 넘는 주식재산을 가진 이도 많다. 이명희 신세계 회장이 대표적이다. 이 회장은 7일 기준 이마트(5740억 원)와 신세계(4099억 원)에서 보유한 주식가치를 더하면 9840억 원 상당의 주식재산을 보유하고 있는 것으로 나타났다. 이화경 오리온 부회장은 오리온홀딩스(2677억 원)와 오리온(1928억 원) 주식을 더해 4605억 원의 주식평가액을 보였다. 현정은 현대 회장(1214억 원)과 장영신 애경 회장(202억 원)도 100억 원 넘는 것으로 조사됐다. 그룹 총수가 사별하면서 주식재산이 늘어난 사례도 있다. 고(故) 구본무 LG그룹 회장의 부인 김영식 여사가 대표적이다. 김 여사의 주식가치는 7일 기준 4475억 원으로 평가됐다. 김 여사는 LG 주식을 725만 3100주(4.2%) 보유 중이다. 고(故) 조양호 한진그룹 회장의 부인 이명희 정석기업 고문의 주식가치도 2705억 원으로 나타났다. 이 고문은 한진그룹의 지배격 회사인 한진칼 주식 지분을 5.31% 보유하고 있다. 이번 조사 대상 100대 그룹 재벌가 부인 중 주식재산이 10억 원 이상은 모두 33명으로 조사됐다. 이중에는 아직 법적 부부를 유지하고 있는 최태원 SK 회장의 부인 노소영 아트센터 나비 관장도 7일 기준 22억 원의 주식재산을 보유하고 있었다. 90명 중 40명의 재벌가 안방마님은 상장사 주식을 단 한 주도 갖고 있지 않은 것으로 조사됐다. 아직까지 상당수의 국내 그룹 총수 등은 회사 경영에 중요한 의미를 가지는 ‘주식 지분’에 대해서만큼은 부부 사이라도 매우 엄격하게 구분하고 있다는 것을 보여주는 방증으로 풀이된다.
 이번 조사와 관련해 오일선 소장은 “그룹 총수 배우자는 상황에 따라서는 그룹 전면에 나서거나 지분 등으로 경영에 깊이 관여해야 할 여지가 높은 특수관계자”라며 “특히 그룹 승계와 관련해 판도를 바꿀 수 있기 때문에 시장에서 그룹 총수 부인의 지분 동향에 관심이 높다”고 말했다. jmkim@newsis.com<ⓒ 공감언론 뉴시스통신사. 무단전재-재배포 금지>",/news/news_read.nhn?article_id=0009807373&office_id=003&mode=search&query=삼성전자&page=8
"CXO연구소, 국내 100大 그룹 재벌가 부인 90명 주식평가액 조사 삼성 홍라희 前 리움 관장 2조 6860억원 1위…종근당 정재정 · 동서 문혜영 여사 TOP 3 올라 노소영 아트센터 나비 관장 주식재산 22억 원 수준…90명 중 40명은 상장사 주식 미보유로 파악","[서울=뉴시스] 김종민 기자 = SK 최태원 회장과 노소영 아트센터 나비 관장 간 이혼 소송이 본격적으로 시작됐다. 이를 계기로 재벌가 부인들의 주식재산이 어느 정도 되는지도 세간의 관심사로 떠올랐다. 국내 주요 재벌가 부인 90명 중 10명은 주식재산이 100억 원 이상 되는 것으로 나타났다. 반면 40명은 상장사 주식을 단 1주도 보유하지 않은 것으로 파악됐다. 재벌가 안주인라고 해도 주식재산에 대해서만큼은 큰 차이를 보였다. 이 같은 결과는 기업분석 전문 한국CXO연구소(소장 오일선)가 ‘국내 주요 100대 그룹 재벌가 부인 주식재산 현황 조사’ 결과에서 도출됐다고 9일 밝혔다. 조사 대상은 공정거래위원회가 관리하는 59개 대기업집단을 포함해 총 100개 그룹을 대상으로 조사가 이뤄졌다. 조사 대상자는 오너가 부인 성함 파악이 가능한 90명이다. 오너 부인 성함은 공정위 공시 자료와 언론 기사 및 각종 인물 검색 등을 통해 파악했다. 주식 재산은 금융감독원에 보고된 주식 중 보통주 기준(우선주 제외)으로 조사가 이뤄졌고, 7일 종가를 곱해 주식평가액을 산정했다. 비상장사 주식가치는 이번 조사에서 제외했다. 또 여성 자신이 그룹 총수 내지 경영자로 활동하거나, 배우자가 고인(故人)이 된 경우 등은 조사에는 포함시켰으나 주식평가액 순위에는 제외했다.조사 결과 국내 주요 재벌가 안방마님 90명 중 주식부자 1위는 이건희 삼성전자 회장의 부인 홍라희 전(前) 리움미술관 관장인 것으로 나타났다. 홍 전 관장은 삼성전자 보통주 주식 5415만 3600주(0.91%)를 보유해 이달 7일 기준 주식재산 가치만 2조 6860억 원에 달했다.종근당그룹 이장한 회장의 부인 정재정 여사는 409억 원으로 넘버2를 차지했다. 정 여사는 종근당홀딩스 주식을 29만 1575주 보유하고 있는데, 7일 종가 10만 8000원으로 곱한 주식평가액만 해도 310억 원을 훌쩍 넘겼다. 94억 원 상당의 경보제약 주식도 함께 보유하고 있는 것으로 파악됐다. 커피 재벌로 유명한 동서그룹 김석수 회장의 부인 문혜영 여사는 336억 원으로 오너가 안방마님 주식부자 클럽 TOP 3에 이름을 올렸다. 문 여사는 (주)동서 주식을 200만 5935주(2.01%)를 갖고 있다. 농심그룹 신춘호 회장의 부인 김낙양, 한미약품그룹 임성기 회장의 부인 송영숙 여사는 200억 원대 주식평가액을 보유하며 다섯 손가락 안에 이름을 올렸다. 김낙양 여사는 율촌화학(145억 원), 농심홀딩스(98억 원), 농심(7억9000만 원) 세 곳의 주식종목에서 251억 원 상당의 주식평가액을 보였다. 송영숙 여사는 한미사이언스에서 231억 원 상당의 주식재산을 갖고 있는 것으로 확인됐다. 이어 6위 이병무 아세아그룹
회장 부인 이정자 여사 187억 원, 7위 김승연 한화그룹 회장 부인 서영민 여사 183억 원, 8위 김홍국 하림그룹 회장 부인 오수정 맥시칸 대표이사 170억 원, 9위 조석래 효성그룹 명예회장 부인 송광자 여사 156억 원, 10위 김상범 이수그룹 회장 부인 김선정 광주비엔날레 대표이사가 120억 원으로 100억 원대 주식재산을 보유하고 있는 것으로 조사됐다. 앞서 100억 원 이상 주식재산을 보유한 그룹 오너 부인 중 5% 이상 지분을 보유한 경우도 있었다. 2019년 사업보고서 기준 종근당홀딩스(5.82%)와 경보제약(5.42%) 주식을 보유한 정 여사와 이수페타시스(6.54%) 지분을 보유한 김 대표이사가 그 주인공이다. 여성이 그룹 총수내지 경영자이면서 100억 원 넘는 주식재산을 가진 이도 많다. 이명희 신세계 회장이 대표적이다. 이 회장은 7일 기준 이마트(5740억 원)와 신세계(4099억 원)에서 보유한 주식가치를 더하면 9840억 원 상당의 주식재산을 보유하고 있는 것으로 나타났다. 이화경 오리온 부회장은 오리온홀딩스(2677억 원)와 오리온(1928억 원) 주식을 더해 4605억 원의 주식평가액을 보였다. 현정은 현대 회장(1214억 원)과 장영신 애경 회장(202억 원)도 100억 원 넘는 것으로 조사됐다. 그룹 총수가 사별하면서 주식재산이 늘어난 사례도 있다. 고(故) 구본무 LG그룹 회장의 부인 김영식 여사가 대표적이다. 김 여사의 주식가치는 7일 기준 4475억 원으로 평가됐다. 김 여사는 LG 주식을 725만 3100주(4.2%) 보유 중이다. 고(故) 조양호 한진그룹 회장의 부인 이명희 정석기업 고문의 주식가치도 2705억 원으로 나타났다. 이 고문은 한진그룹의 지배격 회사인 한진칼 주식 지분을 5.31% 보유하고 있다. 이번 조사 대상 100대 그룹 재벌가 부인 중 주식재산이 10억 원 이상은 모두 33명으로 조사됐다. 이중에는 아직 법적 부부를 유지하고 있는 최태원 SK 회장의 부인 노소영 아트센터 나비 관장도 7일 기준 22억 원의 주식재산을 보유하고 있었다. 90명 중 40명의 재벌가 안방마님은 상장사 주식을 단 한 주도 갖고 있지 않은 것으로 조사됐다. 아직까지 상당수의 국내 그룹 총수 등은 회사 경영에 중요한 의미를 가지는 ‘주식 지분’에 대해서만큼은 부부 사이라도 매우 엄격하게 구분하고 있다는 것을 보여주는 방증으로 풀이된다.
 이번 조사와 관련해 오일선 소장은 “그룹 총수 배우자는 상황에 따라서는 그룹 전면에 나서거나 지분 등으로 경영에 깊이 관여해야 할 여지가 높은 특수관계자”라며 “특히 그룹 승계와 관련해 판도를 바꿀 수 있기 때문에 시장에서 그룹 총수 부인의 지분 동향에 관심이 높다”고 말했다. jmkim@newsis.com<ⓒ 공감언론 뉴시스통신사. 무단전재-재배포 금지>",/news/news_read.nhn?article_id=0009807373&office_id=003&mode=search&query=삼성전자&page=7
"◇ 연기금 등, 코스피서 지난달부터 3.3조 순매수","[이데일리 최정희 기자] 연기금이 지난달 증시 급락장에서 3조원 가량을 순매수하면서 본격적인 매수세로 전환됐다. 개인투자자들이 11조1900억원 매수세를 보인 것에 비해선 미약하지만 장기투자자란 관점에서 연기금 매수세를 주목할 필요가 있다.
연기금은 ,
등 신종 코로나 바이러스 감염증(코로나19)에도 실적이 나오는 종목을 중심으로 매수세를 보인 반면 적자 가능성이 높은 , ,
등은 팔았다. 특히 경영권 분쟁이 붙은 에 대해선 연초 이후 보유 지분 전량을 매도했을 가능성이 제기된다.
9일 마켓포인트에 따르면 연기금 및 우정사업본부 등은 1~2월만 해도 코스피 시장에서 3000억원도 채 안 되는 순매수를 보였으나 3월에만 3조280억원 가량을 사들이며 ‘매수’에 본격적으로 가담하기 시작했다. 이달 들어서(1~9일)도 2700억원 가량의 순매수를 보이고 있다. 연기금이 주로 사들이는 종목을 살펴보면 코로나19 확산에도 실적을 내고 있는 종목들로 모아진다. 지난 달 이후 이달 9일까지 연기금은 삼성전자를 1조488억원 가량 순매수해 가장 많이 담았다. 도 5001억원의 매수세를 보여 삼성전자에 이어 두 번째로 많은 매수를 기록했다. 삼성전자는 1분기 잠정 영업이익이 6조4000억원을 기록, 코로나19 속에서도 반도체 업황이 견고함을 보여줬다. 이에 에 대한 실적 기대감도 올라간 상태다. ,
등 코로나19에 영향을 덜 받는 인터넷, 게임 업종도 대거 매수했다. NAVER는 1355억원을, 엔씨소프트는 935억원의 순매수를 기록했다. 김동희 메리츠증권 연구원은 “계절적 비수기인데다 코로나19로 대형광고주의 마케팅 집행이 축소됐음에도 네이버, 카카오는 쇼핑(커머스), 웹툰, 페이, 모빌리티 등 다양한 사업 포트폴리오로 안정적인 방어가 가능하다”며 “엔씨소프트의 경우도 2~3월 게임 이용시간과 데이터 사용량이 작년 말보다 25~40%가량 증가해 ‘리니지2M’과 같은 이용자 충성도 높은 컨텐츠가 수혜를 누렸다”고 밝혔다. 코로나19로 치료제에 대한 관심이 높아지면서 바이오주가 급등세를 보였는데 연기금은 바이오주 중에서도 대형주에 집중했다. 와 을 각각 1032억원, 1054억원 순매수했다. 특히 셀트리온은 코로나19 항체 후보군 300종을 확보했다며 7월 말까진 제품을 개발해 임상에 들어가겠다고 밝힌 상태다. 이에 셀트리온은 지난달에만 34.7% 올랐다. 삼성바이오는 바이오 업황이 개선된 데다 CMO(위탁생산) 가동률이 높아지면서 영업이익이 작년보다 두 배 증가할 것이란 전망이 나온다. 이밖에 , 도 각각 1287억원, 1060억원 가량 순매수했다. LG생활건강은 중국 판매 위축이 불가피하지만 화장품 부문 내에서 후, 숨, 오휘 등 럭셔리 브랜드 매출 비중이 71%에 달해 하반기 수요 회복시 수혜를 볼 것으로 예측되고 있다. 코로나19로 인해 인당 데이터 트래픽 증가와 마케팅 비용 축소에 통신주도 코로나 악재를 빗겨갔단 평가가 제기된다. 연기금은 2년 연속 적자가 예상되거나 코로나 악재를 정통으로 맞은 종목들은 대거 매도했다. 특히 한진칼은 지난 달 이후 467억원을 내다팔았다. 연초 이후로 보면 173만4300주 내다팔았다. 지분율로 보면 2.93% 수준이다. 시장이 예측하는 작년 말 국민연금 보유지분과 유사하다. 한진칼은 2년 연속 적자를 낸 데다 자회사
이익 악화 우려가 커졌다. 이에 비해 경영권 분쟁으로 주가가 높아진 상황이라 차익실현 욕구가 커졌을 것으로 분석된다. 한진칼 주가는 올 들어서만 111% 급등했다. 연기금은 대한항공에 대해서도 245억원 가량 매도했다. 이밖에 , , 에 대해서도 340억~370억원 가량 매도했다. LG디스플레이와 삼성중공업은 올해 적자가 예상되고 SK이노베이션은 국제유가가 연초 대비 반토막 이상 난 상황이라 정제마진이 감소하면서 영업이익이 반토막 날 것으로 예측되고 있다. 사실상 구조조정에 돌입한 에 대해서도 218억원 매도세가 나왔다. 최정희 (jhid0201@edaily.co.kr)＜ⓒ종합 경제정보 미디어 이데일리 - 무단전재 & 재배포 금지＞",/news/news_read.nhn?article_id=0004617097&office_id=018&mode=search&query=삼성전자&page=7
,"대림산업이 주거 브랜드 ‘아크로’(ACRO)의 비전과 주거 철학을 담아낸 콘셉트하우스 ‘2020 ACRO 갤러리-컬렉터의 집’을 공개했다.
대림의 하이엔드 주거 브랜드 아크로는 남다른 철학과 기준으로 기존의 고급 주거와는 차별화된 주거 문화를 구현하며 새로운 시도를 이어오고 있다. 최상위 고객들의 라이프스타일과 거주환경에 대한 분석을 토대로 끊임없이 새로운 상품을 개발하며 진화를 거듭하고 있는 것이다.
9일 대림에 따르면 이번 컬렉션은 ‘컬렉터의 집’이란 주제로 상위 0.1%의 개성 있는 라이프스타일을 반영해 최상의 주거 공간으로 구성됐다. 이를 통해서 모두가 꿈꾸는 ‘하이엔드 주거의 정점’을 구현했다는 설명이다.

 ‘컬렉터의 집’ 정원의 모습. 대림산업 제공

특히 국내에서는 쉽게 경험하기 어려운 주거 타입인 펜트하우스 2개를 마련해 아파트의 범주를 넘어선 새로운 주거 형태를 통해 ACRO가 지향하는 가치를 전달할 예정이다. 그래서 첫번째 집이 ‘웰니스’(wellness)를 추구하고 예술적 취향을 지닌 부부의 라이프스타일을 담은 313㎡의 펜트하우스다. 통창으로 들어오는 채광이 가득 찬 거실, 테라스와 외부 조경을 연계해 개방감을 극대화한 다이닝룸이 눈에 띈다. 이 외에도 사우나, 필라테스 룸 등 건강을 생각한 공간도 마련됐다. 세계적 디자이너 디터람스의 컬렉션을 만날 수 있는 컬렉터의 방도 구현했다. 직접 식물을 재배할 수 있는 스마트팜 기기가 갖춰진 주방, 집안에서도 자연을 즐길 수 있는 중정 등 세계적인 주거 트렌드인 친환경 라이프스타일을 반영한 공간을 만날 수 있다.
두번째 집은 다양한 취미를 지닌 가족의 일상을 반영했다. 높은 층고(8.1m)가 특징인 515㎡ 규모의 복층형 펜트하우스로 꾸며졌다. 가족 공용공간인 1층과 침실을 중심으로 개인적인 공간으로 구성된 2층으로 나누어 동선을 분리한 게 특징이다.

 ‘컬렉터의 집’ 거실의 모습. 대림산업 제공

대형 드레스룸과 분리형 욕실, 전용 풀을 갖추어 고급 리조트같이 연출됐다. 와인 셀러와 무비스튜디오, 티룸 등 개성이 뚜렷한 최상위층의 주거 공간을 경험할 수 있다.
이번 주거 컬렉션에는 공간과 어우러지는 예술 작품을 감상하는 묘미를 더했다. 프랭크 스텔라, 사라 모리스, 장 뒤비페, 파올로 라엘리, 스튜디오 로소, 이우환, 이강소 등 국내외 현대미술을 대표하는 세계적인 예술가들의 작품을 함께 만날 수 있다. 더불어, 아카데미 수상으로 화제가 된 영화 ‘기생충’의 박사장 집 주방으로 주목받은 키친 리노를 비롯해 전 세계적으로 주목받고 있는 글로벌 톱 브랜드가 함께했다. 삼성전자의 프리미엄 라인, 북미 프리미엄 빌트인 가전 브랜드 데이코(dacor), LG전자의 시그니처 키친 스위트와 오브제, 사운드 플랫폼 ODE 등 다양한 생활 명품 브랜드와 협업해 하이엔드 주거공간을 완성했다.
대림산업 관계자는 “아크로는 개성 있는 하이엔드 라이프와 예술적 감성이 조화된 주거 공간, 희소성이 느껴지는 삶의 가치를 바탕으로 최상의 주거 기준을 제시해 아파트를 넘어 주거의 경계를 허무는 브랜드로 확장해 나갈 것”이라고 말했다.
 나기천 기자 na@segye.comⓒ 세상을 보는 눈,",/news/news_read.nhn?article_id=0003455202&office_id=022&mode=search&query=삼성전자&page=7
,"가 코로나 바이러스 감염증 장기화로 육아 부담을 느끼는 직원들을 위해 주 40시간을 채우는 조건으로 주 4일 근무가 가능하도록 했다.9일 삼성전자는 직원들에게 전체 공지 이메일을 보내 하루 최소 근무 시간을 5월까지 한시적으로 폐지한다고 밝혔다. 삼성전자는 하루 최소 4시간, 1주일 최소 40시간, 한 달 최소 160시간을 기본으로 하는 주 5일 근무제를 시행 중이다. 코로나 바이러스 감염증 확산 이후 전면적인 재택근무를 실시한 대기업도 있지만, 삼성은 모두 출근하고 임산부만 재택근무를 하고 있었다.하지만 코로나 바이러스 감염증이 확산되면서 육아 부담을 느끼는 직원이 많아지자 이를 해소하기 위해 하루 최소 근무 시간을 한시적으로 폐지한 것이다. 예를 들어 월요일부터 목요일까지 주 40시간 이상을 일한 직원은 부서장 승인을 받으면 금요일 하루는 쉴 수 있다. 삼성전자는 ""기본적인 주 5일 근무제는 유지하지만, 필요한 경우 부서장 승인을 받아 하루 정도 휴무할 수 있도록 직원들을 배려한 것""이라고 밝혔다.[김성민 기자 dori2381@chosun.com] 		▶
		▶ 		▶
	- Copyrights ⓒ 조선일보 & chosun.com, 무단 전재 및 재배포 금지 -",/news/news_read.nhn?article_id=0003522426&office_id=023&mode=search&query=삼성전자&page=7
