head,text,url
,"국내 시리얼 시장의 대표주자 포스트(Post)의 그래놀라 제품군이 성장을 거듭하며 지난해 매출액 340억원을 돌파했다. 동서식품은 현재 ‘포스트 그래놀라’와 ‘포스트 골든 그래놀라’ 등 두 가지 제품군을 중심으로 다양한 맛의 그래놀라 제품을 출시하고 있다. 포스트 그래놀라는 콘프레이크에 오트(귀리) 등 몸에 좋은 통곡물을 바삭하게 구워 만든 그래놀라와 상큼한 건과일을 곁들인 제품이다. 탄수화물은 물론 비타민과 칼슘 등 영양성분도 풍부하다. 맛은 크랜베리 아몬드, 블루베리, 카카오호두 등 3가지로 구성됐다. ‘포스트 그래놀라 크랜베리 아몬드’는 통곡물로 만든 그래놀라(30%)에 아몬드와 크랜베리를 더해 고소하면서도 새콤달콤하다. ‘포스트 그래놀라 블루베리’는 세계 10대 장수식품으로 불리는 블루베리를 함유했다. 블루베리에 들어 있는 안토시아닌 성분은 시력 강화에도 도움을 준다고 알려졌다. ‘포스트 그래놀라 카카오호두’는 바삭하게 구운 콘프레이크에 항산화 열매라 불리는 카카오, 불포화지방산이 함유된 호두를 첨가해 평소 건강을 위해 견과류를 챙기는 소비자에게 일석이조인 제품이다. 동서식품은 그래놀라 시장의 성장세에 발맞춰 포스트 그래놀라 출시 8년 만인 지난 2016년 기존 그래놀라 시리얼에 고급 견과류와 과일을 더해 한층 건강하게 즐길 수 있는 프리미엄 그래놀라인 ‘포스트 골든 그래놀라’를 선보였다. 이 제품은 개인 취향에 따라 크런치, 후르츠, 아몬드빈 등 다양하게 선택해 즐길 수 있다. ‘포스트 골든 그래놀라 크런치’는 슈퍼곡물인 귀리, 쌀, 옥수수, 보리, 밀을 최적의 배합비로 구워 만든 오곡 그래놀라(82.8%)에 고급 견과류 아몬드와 피칸을 더한 제품이다. 곡물과 견과류가 만들어내는 고소함과 바삭한 식감이 특징이다. ‘포스트 골든 그래놀라 후르츠’는 딸기, 사과, 크랜베리 등 다양한 말린 과일을 넣은 제품으로 바삭하게 씹히는 골든 그래놀라와 새콤달콤한 과일 맛이 어우러져 우유는 물론 요거트에 곁들여 상큼하게 즐기기 좋다. ‘포스트 골든 그래놀라 아몬드빈’은 오곡 그래놀라(82.8%)에 단백질, 칼슘, 인 등 영양소가 풍부한 국내산 검은콩과 흰콩, 슬라이스한 아몬드를 바삭하게 구워 넣었다. 골든 그래놀라를 국내산 콩 분말가루로 코팅해 입안 가득 퍼지는 고소한 풍미가 특징이다.한편 동서식품은 포스트 그래놀라 제품군에 편의성과 환경을 고려한 패키지인 ‘센서리 지퍼백(Sensory zipper bag)’을 적용하고 있다. 제품 입구에 지퍼를 적용한 파우치 형태로 언제든지 손쉽게 밀봉이 가능해 제품을 신선하게 보관할 수 있다. 기존 테이프 부착 방식보다 습기를 막는 기능이 뛰어나 개봉 후에도 오래도록 바삭하고 신선한 시리얼을 즐길 수 있다. 또한 종이 케이스와 내부 포장으로 구성된 기존 제품과 달리 단일 포장 방식으로 포장재 규격을 축소해 환경 보호까지 고려했으며 제품 밑면의 면적은 입구 대비 넓게 만들어 소비자들이 어느 공간에나 제품을 안정적으로 세워 보관할 수 있도록 했다. 최근 한끼 식사를 간편하게 해결할 수 있는 간편대용식(CMR·Convenient Meal Replacement)을 찾는 소비자들이 증가하면서, 그래놀라 제품에 대한 소비자들의 관심도 높아지고 있다. 시장조사 전문기관 닐슨에 따르면 지난해 국내 그래놀라 제품 시장은 약 600억원 규모까지 성장했다. 김종후 동서식품 마케팅 매니저는 “포스트 그래놀라 시리즈는 건강한 삶과 균형 잡힌 영양에 관심 많은 소비자들에게 맛과 건강은 물론 편의성까지 갖춘 제품으로 큰 사랑을 받고 있는 제품”이라며 “최근 간편대용식 수요가 증가하는 추세인 만큼 앞으로도 포스트 그래놀라 라인업을 강화해 소비자들의 선택 폭을 넓힐 것”이라고 말했다. 정희경 기자 ahyun04@hani.co.kr/기획콘텐츠팀[ⓒ한겨레신문 : 무단전재 및 재배포 금지]",/news/news_read.nhn?article_id=0002491389&office_id=028&mode=search&query=카카오&page=4
,"[디지털타임스 차현정 기자] 한국투자증권은 30일 '온라인 금융상품권' 출시를 기념해 내달 15일까지 온라인 금융상품권 10% 할인 이벤트를 진행한다고 밝혔다. 이벤트 기간 동안 카카오톡 폴랫폼 내 선물하기 메뉴를 통해 한국투자증권 온라인 금융상품권을 구매하는 선착순 5000명에게 10% 할인된 금액으로 상품권을 구입할 기회가 주어진다. 내달 16일부터 30일까지는 온라인 금융상품권을 등록한 고객 중 선착순 5000명을 대상으로 금리 10% 특판 발행어음에 가입할 수 있는 이벤트도 진행할 예정이다. 한국투자증권 앱에 온라인 금융상품권을 등록한 후 이벤트를 신청한 고객을 대상으로 입금, 주식거래, 펀드 거래시 각각 스타벅스 아메리카노 1잔을 지급하는 미션 레이스 이벤트도 진행한다. 4월 30일까지 3가지 미션을 완료한 고객에게는 추첨을 통해 에어팟프로, 아이폰11 등을 지급한다. 한국투자증권 금융상품권은 주식과 펀드, 발행어음 등 다양한 금융투자상품에 투자할 수 있는 온라인 상품권 서비스다. 카카오톡 '선물하기' 플랫폼을 통해 커피쿠폰처럼 쉽게 구매해 선물하고, 받은 상품권을 모바일 앱에 등록해 해당되는 금액만큼 금융상품을 골라 투자할 수 있다. 상품권은 5만원권이며, 1인당 1주일에 최대 2장(10만원)까지 구매할 수 있다. 한국투자증권은 금융상품권 서비스가 금융투자 저변 확대 및 시장 활성화 효과를 낼 수 있을 것으로 기대하고 있다. 최서룡 e비즈본부장은 ""모바일기기에 친숙하면서도 투자에 관심있는 젊은 소비자가 손쉽게 다양한 금융투자와 자산관리 서비스를 접하는 기회를 제공할 것""이라고 말했다. 자세한 사항은 한국투자증권 고객센터에서 확인할 수 있다. 차현정기자 hjcha@dt.co.kr 디지털타임스
/",/news/news_read.nhn?article_id=0002591083&office_id=029&mode=search&query=카카오&page=4
,"버드와이저가 '코로나19' 사태로 힘든 시기를 보내고 있는 젊은 예술가들을 응원하는 '스테이 스트롱(Stay Strong)' 기부 캠페인을 벌인다고 30일 밝혔다. 이번 캠페인은 소비자들이 '착한 소비'를 통해 위기 속에서 '함께 맞서는 가치'를 실현하자는 취지로 기획됐다.버드와이저는 창작집단 '스튜디오 콘크리트'와 협업을 통해 한정판 티셔츠를 제작, 내달 30일까지 카카오 선물하기를 통해 판매한다.'스테이 스트롱' 캠페인의 취지에 공감하는 소비자들은 티셔츠의 값을 지불하는 동시에 코로나19로 형편이 어려워진 예술가들을 돕는 '함께 맞서는 가치'를 실현할 수 있다. 버드와이저는 스테이 스트롱 티셔츠 '선물하기'를 통해 모은 판매금 전액과 추가로 동일한 모금액을 '매칭그랜트' 방식으로 서울문화재단에 기부, '코로나19 관련 예술인 문화활동지원' 계획으로 생활고에 시달리는 젊은 예술가들을 지원할 예정이다. 모바일 카카오 선물하기 검색창에서 'Stay Strong'을 입력한 후 해당 배너를 클릭하면 캠페인에 동참할 수 있다.실제 현장의 많은 예술가는 생계 유지 등에 직접적인 어려움을 겪고 있는 것으로 알려졌다. 한국예술문화단체총연합회가 최근 발표한 보고서에 따르면, 올해 코로나19로 취소, 연기된 현장 예술행사는 2500여건으로 피해 규모가 약 600억원에 이른다. 또 예술인 10명 중 9명은 전년대비 수입이 감소해 복지적 차원의 생활 자금 지원 등 긴급 조치가 시급한 것으로 나타났다.버드와이저 브랜드 담당자는 “버드와이저는 청년 거리예술가에게 공연 기회를 제공하는 등 한국 문화예술의 미래를 이끌어갈 주역들이 더 나은 환경에서 꿈을 펼칠 수 있도록 힘써왔다”며 “도전적이고 자기주도적인 삶을 응원하는 브랜드의 정체성에 걸맞게 위기에도 좌절하지 않는 젊은 예술가들에게 힘을 적극 보태고자 이번 캠페인을 기획했다”고 밝혔다.이주현기자 jhjh13@etnews.com",/news/news_read.nhn?article_id=0002875170&office_id=030&mode=search&query=카카오&page=3
-SKT 통신업계 최초 언택트 채용 도입-네이버·카카오 등도 경력직 화상면접-게임·IT서비스·SW업계로도 언택트 채용 확산-하반기 대규모 공채에도 적용 가능성,"[헤럴드경제=정태일·김민지 기자]“ 온라인 생중계로 채용 설명회 보고, 면접은 영상 통화로…’IT업계를 중심으로 언택트(비대면) 채용 문화가 확산되고 있다. 코로나19의 영향으로 기업들의 채용 방식에도 큰 변화가 일고 있다.SK텔레콤은 30일 올해 첫 ‘2021년 신입 채용 공고’를 내고, 통신업계 최초로 언택트 채용을 도입한다고 밝혔다.허준 HR2그룹장은 “코로나19 상황에서 지원자들의 안전을 최우선으로 하고자 홍보, 면접 등 채용 절차를 비대면 온라인으로 진행하기로 했다”고 설명했다.SK텔레콤은 온라인 채용 설명회 ‘T커리어 캐스트(T-Careers Cast)’를 다음달 4일 13시부터 SK그룹 유튜브 채널에서 중계할 예정이다. 채용 전형과 직무를 소개하고 지원자들과 실시간 채팅을 통해 질의응답을 진행하는 방식이다.SK텔레콤 채용 홈페이지도 언택트 방식에 맞춰 새롭게 단장했다.지원자들은 채용 홈페이지에서 실제 업무를 담당하고 있는 구성원의 인터뷰 영상을 통해 관련 직무에 대해 생생한 정보를 얻을 수 있다.또 최근 코로나19에 대응한 재택근무를 포함해 선택근무제, ‘님’ 호칭 등과 같은 SK텔레콤 조직 문화와 다양한 복지 혜택도 손쉽게 확인 가능하다.이와 함께 SK텔레콤은 언택트 채용의 제한적인 환경을 극복하기 위해 면접관 대상 교육도 더욱 강화할 방침이다. 면접관은 언택트 채용 관련 교육 과정을 수료해야만 면접에 참여할 수 있다.언택트 채용은 향후 두 달간 진행될 예정이다. SK텔레콤은 이번 신입 공채를 시작으로 향후 진행할 채용에도 코로나19 진행 상황을 고려해 언택트 방식을 지속 적용할 계획이다.네이버와 카카오, 넷마블 등 인터넷· 게입업체들도 언택트 채용을 진행 중이다. 네이버, 카카오는 현재 상시 경력 채용에 화상면접 등 언택트 방식을 도입했다. 코로나19가 지속될 경우 하반기 대규모 기술직(개발자)채용에도 비대면 채용 방식을 도입할 계획이다. 넷마블도 수시 채용을 대면면접 대신 화상면접으로 대체했다. 하반기 신입 공채에도 온라인 채용 방식을 적용할지 검토중이다.네이버 자회사 라인플러스는 올해 신입 개발자 채용 접수부터 면접까지 모든 전형에 ‘100%온라인 활용 언택트’ 방식을 도입했다. 기존 오프라인으로 진행되던 테스트는 '온라인 코딩 테스트 및 서류전형'으로 대체하고, 모든 면접 역시 화상회의 시스템을 활용해 원격으로 진행한다.삼성SDS, LG CNS, SK C&C 등 IT서비스 기업들도 경력 채용에 화상면접을 전면 도입했다. 그동안 해외 인재 채용시, 화상면접을 주로 진행했지만 코로나19 확산에 적용 대상을 국내로까지 확대했다.이밖에 우아한형제들도 신입과 경력 수시채용 대부분의 면접을 화상으로 진행하고 있다.이스트소프트도 상반기 공개채용 시 서류 접수부터 1·2차 면접 전형까지 전 과정을 온라인으로 진행할 방침이다.업계 한 관계자는 “IT업계가 경쟁적으로 언택트 채용 방식을 도입하면서 하반기 있을 대규모 정기공채에도 비대면 방식의 채용 문화가 비중 있게 적용될 것”이라고 말했다.killpass@heraldcorp.com
- Copyrights ⓒ 헤럴드경제 & heraldbiz.com, 무단 전재 및 재배포 금지 -",/news/news_read.nhn?article_id=0001655260&office_id=016&mode=search&query=카카오&page=3
"스위스 블록체인 핀테크 기업 리케(Lykke) 2억원 투자 가상자산 거래소·지갑 사업 주력…자체코인 발행키도한화, 전사적 블록체인 사업 확장…블록체인 금융 '속도'","[파이낸셜뉴스] 한화시스템이 스위스의 블록체인 핀테크 전문기업 리케에 투자했다. 한화시스템이 블록체인·가상자산 관련 기업에 독자적으로 투자를 단행한 것은 이번이 처음이다.



30일 한화시스템은 리케(Lykke Corp) 거래소에 약 2억원을 투자했다고 밝혔다. 한화시스템은 이번 투자를 통해 블록체인 사업의 해외 진출을 가속화하고, 글로벌 유수 블록체인 기업들과 협업을 강화해 나간다는 계획이다.
 리케는 지난 2015년 설립된 블록체인 핀테크 기업으로, 주요 사업으로 가상자산 거래 플랫폼과 지갑 서비스를 제공하고 있다. 현재 비트코인과 이더리움, 리플, 온톨로지 등 총 25개 가상자산이 리케 거래소에서 거래되고 있으며, 각각 iOS와 안드로이드 버전의 가상자산 지갑 애플리케이션(앱)도 서비스 중이다.
 특히 리케는 지난 2016년 자체적으로 발행한 3000만개 리케 코인(LKK)을 가상자산공개(ICO)를 통해 대중에 판매하는 등 가상자산 관련 서비스를 폭넓게 지원하고 있다. 30일 현재 리케 코인 시가총액은 31억원 규모로 추산된다.
 한화시스템은 지난 2018년 서울옥션블루의 관계사 위빌(현 블루인덱스)에 10억원을 투자하며 블록체인 사업을 본격화했다. 블루인덱스와 함께 예술품 데이터의 신뢰를 강화하고 유통을 촉진할 수 있는 블록체인 기반 예술품 데이터 거래 플랫폼을 공동 개발한 것. 현재 해당 서비스는 카카오 블록체인 플랫폼 클레이튼에 탑재됐다.
 한화시스템은 자체적으로 개발한 기업용 블록체인 플랫폼 에이치체인(H-Chain)을 통해 블록체인 엔터프라이즈 시장을 적극 공략하고 있다. 지난 2018년 출시한 최초 1.0 버전을 시작으로 올 하반기 블록체인 탈중앙 금융 플랫폼 스텔라와 연동을 지원하는 3.0 버전을 출시할 예정이다.

 한화그룹은 주요 계열사를 중심으로 블록체인 사업을 활발히 전개하고 있는 국내 대표 기업 중 하나다.
 한화손해보험은 지난 2018년 업계 최초로 가상자산 거래소 해킹 피해를 보장하는 사이버보험을 출시했다. 지난해 10월 한화손해보험과 SK텔레콤, 현대자동차 등이 합작해 설립한 캐롯손해보험도 블록체인 기반 모바일 신원증명(DID, Decentralized ID) 서비스를 준비 중인 '이니셜 DID' 연합에 일찌감치 합류했다.
 한화자산운용과 한화투자증권 등 주요 금융 계열사 또한 블록체인 기업 투자 포트폴리오를 공격적으로 확대하고 있다.
 한화자산운용은 올초 싱가포르 증권형토큰(STO) 발행 플랫폼 아이스탁스(iSTOX)에 500만달러(약 58억원) 규모 투자를 완료했다. 한화투자증권은 각각 싱가포르 블록체인 기업 원익스체인지 운영사인 캡브릿지그룹과 태국 블록체인 기업 라이트넷에 투자를 단행했다.
 특히 원익스체인지는 지난해 7월 현지 블록체인 기업 중 최초로 싱가포르 금융청(Monetary Authority of Singapore, MAS)으로부터 블록체인 기반 디지털 자산 발행 영업 허가를 받는 등 전세계적으로 유망한 블록체인 기업 중 하나로 꼽힌다.
 한화시스템 측은 ""향후 블록체인 기반 '자산 유동화 서비스 사업(ABT, Asset Backed Token)' 확대 일환으로 해외 수출 레퍼런스를 보완하기 위한 목적으로 리케에 투자했다""며 ""단순히 가상자산 분야에만 초점을 두는 것이 아니라 블록체인 금융·핀테크 사업을 폭넓게 고려하고 있다""고 말했다.
#블록체인 #한화시스템 #가상자산 #리케



※ 저작권자 ⓒ 파이낸셜뉴스. 무단 전재-재배포 금지",/news/news_read.nhn?article_id=0004398667&office_id=014&mode=search&query=카카오&page=3
"""주요 지자체/지역 생산자 10여곳과 손잡고 지원""""카톡 쇼핑하기·장보기·톡딜 등 활용해 판매 촉진""","[서울=뉴시스] 이진영 기자 = 카카오커머스는 오는 31일까지 나흘간 전국 10여개 주요 지방자치단체 및 지역 생산자·유통사와 손잡고 농수산물 특별 기획전을 진행한다고 30일 밝혔다. 코로나19의 영향으로 판매가 위축된 농축수산업 생산자들을 지원하기 위함이다. 코로나19로 인해 대구·경상북도 지역을 비롯한 전국 농어촌에서는 농수산물 판매에 난항을 겪고 있다. 특히 수출용 농수산물과 급식 납품용 식재료 등은 대규모 폐기 위험에 처해 있는 상황이다. 대형마트·재래시장을 주 판로로 삼았던 일반 농가들 역시 판매 어려움에 직면했다. 이에 카카오커머스는 주요 지자체와 우정사업본부, 지역 생산자 및 유통사 등과 손잡아 다양한 신선식품의 판촉을 지원하기로 결정했다. 충청북도, 전라남도, 해남군, 경상북도, 대구경북능금농협, 우정사업본부, 전라남도생산자협동조합 등 10여곳이 함께 한다.이번 특별 기획전은 카카오톡 더보기 탭에 있는 ‘카카오톡 쇼핑하기’를 비롯해 ‘카카오장보기’, ‘카카오파머’ 톡채널 등을 통해 진행된다. 채소 꾸러미, 사과, 청경채, 두부, 콩나물, 감자, 쌀, 우럭, 양파, 대파 등 14개 내외의 상품을 판매중이다. 상품 대부분을 산지에서 생산자가 직접 보냄으로써 중간 유통 단계를 줄여 생산자와 소비자 모두가 더 많은 혜택을 누릴 수 있다. 단기간 내 판매를 촉진하기 위해 카카오커머스만의 공동구매·할인 기능 ‘톡딜’을 적용했다. 지난해 6월 출시한 2인 공동 구매 서비스 ‘톡딜’ 은 2명만 모이면 할인가에 상품을 구매할 수 있고, 단기간에 폭발적인 판매 촉진과 재고 소진이 가능해 효과적인 마케팅 채널로 호평받고 있다. 실제 고객 간의 상품 공유가 활발하다는 특성을 감안, 판매가 시급한 농어촌의 현상황을 알리고 소비를 촉진하기에 적합하다고 판단했다.카카오커머스 관계자는 ""지난해 진행했던 태풍 피해 농가를 위한 판매 지원에 이어 이번에도 어려움을 겪고 있는 농어촌 생산자를 지원코자 했다""며 ""앞으로도 톡딜 등 카카오커머스만의 강점과 특성을 활용해 판매에 어려움을 겪고 있는 상품들을 쉽게 알리고 판매할 수 있도록 지자체 및 생산자와 협업을 확대해나갈 계획이다""라고 말했다. 한편 카카오커머스는 지난 19일 코로나19 피해 극복 및 의료 지원을 위해 손소독제 12만개(5억원 상당)를 전국재해구호협회에 전달하고 ‘카카오톡 선물하기’에서 8개 제조회사와 손잡고 코로나 19 기부 캠페인을 진행한 바 있다.지난 24일까지 일주일간 진행한 기부 캠페인에는 총 2만여명이 참여해 6만여개의 물품을 기부했으며 이 물품들은 전국재해구호협회를 비롯한 다양한 기부처에 전달될 예정이다. 기부자들이 남긴 7만4000여개의 따듯한 응원 메시지는 카카오톡 선물하기 첫 화면의 '기부 후기' 섹션에서 확인할 수 있다. mint@newsis.com<ⓒ 공감언론 뉴시스통신사. 무단전재-재배포 금지>",/news/news_read.nhn?article_id=0009784307&office_id=003&mode=search&query=카카오&page=3
,"한국투자증권은 30일 ‘온라인 금융상품권’ 출시를 기념해 4월 15일까지 온라인 금융상품권 10% 할인 이벤트를 진행한다고 밝혔다.이벤트 기간 동안 카카오톡 폴랫폼 내 선물하기 메뉴를 통해 한국투자증권 온라인 금융상품권을 구매하는 선착순 5천명에게 10% 할인된 금액으로 상품권을 구입할 기회가 주어진다. 4월 16~30일에는 온라인 금융상품권을 등록한 고객 중 선착순 5000명을 대상으로 금리 10% 특판 발행어음에 가입할 수 있는 이벤트도 진행할 예정이다.한국투자증권 앱에 온라인 금융상품권을 등록한 후 이벤트를 신청한 고객을 대상으로 입금, 주식거래, 펀드 거래시 각각 스타벅스 아메리카노 1잔을 지급하는 미션 레이스 이벤트도 진행한다. 4월 30일까지 3가지 미션을 완료한 고객에게는 추첨을 통해 에어팟프로, 아이폰11 등을 지급한다.한국투자증권 금융상품권은 주식∙ 펀드∙ 발행어음 등 다양한 금융투자상품에 투자할 수 있는 온라인 상품권 서비스다. 카카오톡 ‘선물하기’ 플랫폼을 통해 커피쿠폰처럼 쉽게 구매∙ 선물하고, 받은 상품권을 모바일 앱에 등록해 해당되는 금액만큼 금융상품을 골라 투자할 수 있다. 상품권은 5만원권이며 1인당 1주일에 최대 2장(10만원)까지 구매할 수 있다.한국투자증권은 금융상품권 서비스가 금융투자 저변 확대 및 시장 활성화 효과를 낼 수 있을 것으로 기대하고 있다. 최서룡 e비즈본부장은 ""모바일기기에 친숙하면서도 투자에 관심있는 젊은 소비자가 손쉽게 다양한 금융투자와 자산관리 서비스를 접하는 기회를 제공할 것”이라고 말했다.자세한 사항은 한국투자증권 고객센터에서 확인할 수 있다.데일리안 백서원 기자 (sw100@dailian.co.kr)ⓒ (주)데일리안 - 무단전재, 변형, 무단배포 금지",/news/news_read.nhn?article_id=0002392212&office_id=119&mode=search&query=카카오&page=3
"협력사 서비스도 잇따라 중단카카오 ""원인 파악 중""","[헤럴드경제=채상우 기자] 카카오 자회사 '그라운드X'의 블록체인 플랫폼 '클레이튼'에 장애가 발생해 협력사 서비스가 잇따라 중단됐다.30일 그라운드X는 소셜미디어를 통해 신규 블록이 생성되지 않는 오류가 발생했다고 밝혔다. 그라운드X는 ""지난 29일 오후 11시 32분 생성된 #24002379번째 블록 이후 블록생성이 되지 않는 현상이 발생했다""며 ""지난해 6월 사이프레스 출시 이후 처음 발생한 장애에 대해 정확한 현상을 파악하고 최대한 빠른 대응을 위해 노력 중이다""고 설명했다.메인넷의 블록 생성이 되지 않으면 데이터가 만들어지지 않아 암호화폐(토큰) 등이 전송되지 않는 현상이 나타난다. 사이프레스는 클레이튼의 메인넷으로 블록체인 서비스를 정식 출시하고 구동하기 위한 블록체인 네트워크를 의미한다.이에 따라 클레이튼을 이용하는 협력사들의 서비스도 중단됐다. 현재 클레이튼에는 거버넌스 카운슬(기술·사업 등 주요 의사 결정에 참여하는 협의체) 29개사를 비롯한 여러 협력 업체가 참여하고 있다.그라운드X 관계자는 ""현재 정확한 장애 현상을 파악하고 최대한 빠른 대응을 위해 노력 중""이라고 밝혔다.그라운드X는 올 상반기 내 카카오톡 메신저와 연동된 모바일 가상자산 지갑 '클립'을 출시할 계획이다.123@heraldcorp.com
- Copyrights ⓒ 헤럴드경제 & heraldbiz.com, 무단 전재 및 재배포 금지 -",/news/news_read.nhn?article_id=0001655293&office_id=016&mode=search&query=카카오&page=3
,"(서울=연합뉴스) 이태수 기자 = 농림축산식품부는 신종 코로나바이러스 감염증(코로나19) 장기화에 따른 소비위축으로 어려움을 겪는 중소식품업체를 위해 온라인 특별기획전을 연다고 30일 밝혔다.

우선 우체국쇼핑몰(mall.epost.go.kr)에서는 우수 중소식품업체를 중심으로 관련 협회의 추천을 받아 31일부터 다음 달 13일까지 2주간 특별기획전 행사를 연다.

또 5∼7월 매월 첫 2주 동안 옥션·G마켓 등 다양한 판매 채널에서 특별기획전이 열린다.

행사 기간 배너 광고, 앱 푸시, 카카오톡 메시지 발송 등으로 특별기획전을 홍보하고, 할인 쿠폰 등을 제공해 우수한 제품을 싸게 살 수 있도록 돕는다.

농식품부는 온라인 미입점 업체에 대해서는 상품 설명을 위한 상세 페이지 제작을 무료로 지원할 계획이다.

tsl@yna.co.kr",/news/news_read.nhn?article_id=0011508152&office_id=001&mode=search&query=카카오&page=3
