head,text,url
"카카오, 커머스·웹툰·게임·모바일금융 등 언택트 산업 주도주코로나19로 데이터센터 수요 늘어…SK하이닉스 추천","[이데일리 이광수 기자] 신종 코로나 바이러스 감염증(코로나19) 사태 장기화로 언택트(Untact·비대면) 서비스 수요가 늘면서 관련 종목들이 이번 주(3월 30일~4월 3일) 증권사 추천주에 이름을 올렸다. 특히 반도체의 경우에는 소비자들의 언택트 수요에 고객사들의 데이터 센터 구축이 활발해지고 있어 코로나19 영향이 제한적이라는 전망에 긍정적인 평가를 받고 있다. 29일 유안타증권은 카카오(035720)와 SK하이닉스(000660)를 추천 종목으로 제시했다. 유안타증권은 카카오에 대해 “커머스(선물하기)와 웹툰, 게임, 모바일 금융 등 언택트 산업 지속성장의 주도주”라며 “사용자 4000만명의 메가트래픽을 활용한 카카오톡 광고 고성장도 기대된다”고 말했다. 경기가 회복하면 실적 급반등도 가능하다는 전망이다. (자료=각 사)유안타증권은 SK하이닉스에 대해서는 “코로나19 영향으로 글로벌 고객사들의 데이터 센터 구축은 오히려 활발해지고 있다”며 “코로나19로 인해 SK하이닉스의 주가는 예상 순자산가치(BPS)기준 주가순자산비율(PBR) 0.9배 수준으로 코로나19 영향을 상당부분 선 반영한 것으로 해석된다”고 말했다. 이어 “스마트폰과 PC를 중심으로 수요 둔화 우려가 지배적이지만 메모리반도체 가격 저점 인식이 강하기 때문에 메모리반도체 가격 인상은 예상대로 진행되고 있다”고 덧붙였다. 코로나19 사태에도 실적을 방어한 종목도 추천주에 이름을 올렸다. 하나금융투자는 이마트(139480)를 추천하며 “온라인 매출 비중 확대로 시장점유율이 상승했다”며 “막강한 재고 역량은 긍정적”이라고 설명했다. 코로나19 사태에도 지난 1~2월 이마트 할인점 기존점 매출은 전년 동기 대비 마이너스(-)1%수준에 그쳐 선방했다는 게 하나금투의 평가다.낙폭 과대주에 대한 추천도 이어졌다. 하나금투는 하나금융지주(086790)를 추천하며 “연초 대비 주가는 30% 이상 하락한 상황”이라며 “예상배당수익률은 8.84%로 9%에 육박한다”고 설명했다. 금리가 급락해도 파생결합펀드(DLF) 추가 손실 인식 가능성은 없다는 점에서 주가 반응 지나치게 과도하다는 설명이다.
SK증권은 5세대 이동통신(5G) 관련 종목을 추천했다. SK증권은 케이엠더블유(032500)를 추천하며 “주파수 필터의 압도적 경쟁력은 여전히 유효하다”며 “주요 거래처는 삼성전자와 노키아, ZTE 등 글로벌 핵심 통신 장비사로 5G 확산 시 직접적인 수혜가 가능하다”고 말했다.이광수 (gs88@edaily.co.kr)＜ⓒ종합 경제정보 미디어 이데일리 - 무단전재 & 재배포 금지＞",/news/news_read.nhn?article_id=0004607982&office_id=018&mode=search&query=카카오&page=1
,"[머니투데이 고석용 기자] 소상공인들이 긴급자금을 대출받기 위해 장사진을 이룬 소상공인시장진흥공단(이하 소진공)에서 들린 소리가 아니다. 같은 날 전화 속 카카오뱅크와 OK저축은행 고객센터 직원의 말이다. 두 금융회사 직원들은 소상공인 대출 절차와 시간에 이같이 답했다.중소벤처기업부가 코로나19 긴급경영자금 신청을 받은 지 1개월 2주가 지난 27일, 소진공 서울서부센터 입구 앞에는 여전히 대출을 기다리는 소상공인들이 빼곡했다. 정부가 앞서 25일부터 1000만원 대출에 한해 소진공 센터에서 직접대출을 시작하면서 이전보다 소상공인들은 더욱 많아졌다. 센터 직원들은 복잡한 구조를 이해하지 못한 소상공인들에게 연신 둘의 차이를 설명했다.사람이 몰리면서 '거리두기'는 자연스럽게 무너졌다. 긴 줄로 대기자들 간 거리는 50cm도 채 되지 않았다. 대기시간도 기약이 없었다. 오랜 시간이 걸린다는 얘기에 옷가게를 한다는 대기 소상공인은 ""오늘 하루는 아예 문을 닫았다""고 전했다. 또 다른 소상공인도 ""오후 장사는 아르바이트하는 이모에게 맡겼다""고 말했다.정부는 이날 과도한 줄서기와 대기시간 문제를 해결하기 위해 직접대출의 △'홀짝제'(홀수 날짜에는 홀수년생 소상공인, 짝수 날짜에는 짝수년생 소상공인만 가능) △'서류간소화'(9종→3종)를 시행해 혼선을 줄이겠다고 발표했다. 이날부터 시행한 온라인 사전예약시스템도 확대 운영하기로 했다.하지만 현장에서는 여전히 미흡하다는 지적이 나온다. 모바일은행인 카카오뱅크는 물론 저축은행들은 소상공인 대출을 '줄서기 없이' 앱이나 전화로 시행한다. 대출까지 걸리는 시간도 이틀에서 일주일이면 가능하다. 대출금액도 조건에 따라 차이가 있었지만 최대 2000만원까지 받을 수 있다. 고객센터 직원은 ""사업자등록증명서 등은 국세청에 등록된 공인인증서 인증으로 가능하다""며 ""종이로 제출할 것은 하나도 없다""고 강조했다.뒷북대책이라는 지적도 나온다. 더 많은 소상공인이 대출을 받을 수 있도록 한도를 낮춰 직접대출제도를 신설한 만큼 소진공 센터에 소상공인들이 몰리는 것은 예견된 결과였다는 지적이다. 앞서 중기부는 긴급경영안정자금 대리대출 병목현상이 심각해지자 긴급경영안정자금 시행 한 달 만에야 시중은행 위탁방안을 발표했다.중기부는 ""다음달 1일까지는 시범운영 중이기 때문에 미흡한 점이 많다""며 ""다음달 1일부터 정식으로 직접대출이 시행되면 혼란을 최소화할 것""이라는 입장이다. 하지만 중기부가 시범운영을 진행하는 동안 전국 62개 소진공 센터에는 매일 임시로 가게 문을 닫은 수 천명의 소상공인들이 자격미달, 접수마감 등으로 발걸음을 돌린다. 고석용 기자 gohsyng@mt.co.kr
<저작권자 ⓒ '돈이 보이는 리얼타임 뉴스' 머니투데이, 무단전재 및 재배포 금지>",/news/news_read.nhn?article_id=0004385117&office_id=008&mode=search&query=카카오&page=1
"주주제안 상정조차 안 된 2018년주주연합 결성해 위협했지만 곳곳서 구멍의결권 지분 28.78%, 올해 43.62%으로 증가""주주연합 구축 후 대비 철저""…반전 가능성도","[헤럴드경제=최준선 기자] ""코스피 기업을 상대로 한 국내 펀드 최초의 적대적 인수합병(M&A)이 시도되고 있다.""국내 한 중견 사모펀드(PEF) 임원은 행동주의펀드 KCGI 등 주주연합이 한진칼을 상대로 벌이고 있는 경영권 분쟁을 이같이 평가했다. 하지만 최근 열린 정기 주주총회에서 주주연합이 추천한 사내·외 이사 전원이 이사회 진입에 실패했다. 주주제안 상정 단계에서부터 실패를 맛봤던 작년 주총에 이어 2년 연속 한진칼에 패배한 것이다. 끝내 주주연합의 속내에 대한 시장의 의구심을 떨치지 못해 '전문 경영인 체제 도입'이라는 명분이 힘을 얻지 못했다는 분석이다.지난 27일 서울 남대문로 한진빌딩에서 열린 제7기 한진칼 정기 주주총회 결과, 조원태 한진칼 대표이사 회장의 사내이사 연임 안건이 출석 주주의 찬성 56.67%(반대 43.27%, 기권 0.06%)로 통과됐다. 조 회장 측 사내이사 후보였던 하은용 대한항공 부사장 또한 56.95%의 찬성률로 무난히 선임됐다. 반면 주주연합 측이 제안한 6명의 사내·외이사 선임 건은 모두 부결됐다. 한진칼의 경영 위기를 극복한 전문경영인 체제와 독립적 이사회가 필요하다며 한진칼과 대립하던 주주연합의 완패였다.이같은 결과는 3자연합이 지난 3일 제출한 ""반도건설이 보유한 8.2% 주식에 대해 의결권을 주총에서 행사하게 해달라""는 가처분 신청에 대해, 서울지방법원이 최근 기각 결정을 내린 점이 주효했다는 평가다.반도건설은 지난해 10월 한진칼 지분 5.06%를 취득할 당시 보유목적을 '단순투자'라고 밝혔고, 주주명부 폐쇄일(12월 26일) 기준 8.2% 지분을 확보한 뒤 지난 1월에서야 보유 목적을 '경영참가'로 변경했다. 하지만 법원은 권홍사 반도건설 회장이 지난해 말 조원태 회장과 만나 그룹 명예회장직 등을 요구했다는 한진칼 주장을 받아들였고, 결국 반도건설의 공시가 허위였다고 판단해 의결권을 제5.0%로 제한했다. 주주연합은 그간 ""경영 일선에 나서지 않고 전문경영인체제를 도입하겠다""고 강조해왔지만, 이같은 명분을 뒷받침하기에는 앞선 과정이 투명하지 못했던 셈이다.M&A 업계의 한 관계자는 ""반도건설과 KCGI가 먼저 손을 잡고, 그다음 조현아 부사장이 합류하는 과정이었다는 소문이 파다했다""며 ""결국 올해의 주주갈등은 반도건설의 적대적 M&A 시도의 일환이라는 시각인데, 이같은 의심을 결국 해결하지 못했다""고 말했다.실제 국민연금의 중요 의결권 행사 방향을 결정하는 수탁자책임전문위원회도 법원의 기각 결정을 중요하게 고려한 것으로 전해진다. 수탁자책임위는 조 회장의 사내이사 선임 건과 함께 그외 한진칼이 추천한 사내·외이사 6명에 대해서도 모두 찬성 의결권을 행사하겠다고 밝혔다. 반면 주주연합 측이 제안한 사내·외이사에 대해서는 6명 중 4명에 반대 의견을 냈다. 수탁자책임위는 ""적정한 이사회 규모 등을 고려할 때 장기적으로 주주가치 증대에 적합하다고 보기 어렵다""며 반대 이유를 설명했지만, 업계에서는 ""규모만이 문제였다면 이처럼 조 회장 측 손을 들어주진 않았을 것""이라는 평가가 나왔다.KCGI는 이번 주총 패배로 2년 연속 고배를 마시게 됐다. KCGI가 한진칼과의 분쟁에 나서기 시작한 것은 지난 2018년 10월. 경영참여를 선언한 이후 지분을 10.81%까지 끌어올렸고, 2019년 주총에 앞서 감사 및 이사 선임과 이사 보수 한도 제한 등을 주총 안건으로 제안했다. 조원태 회장의 측근인 석태수 대표이사 사장의 사내이사 재선임 건에 대해 공개적으로 반대 의사를 밝히기도 했다. 하지만 주주제안은 지분 보유 기간이 6개월이 되지 않아 주주제안 자격조차 없다는 법원 판단을 받았고, 석 대표도 주총에서 사내이사 자리를 지켰다. 이후 1년 간 지분을 꾸준히 확대하고, 조현아 전 대한항공 부사장 및 반도건설과 연합전선까지 구축했으나 결국 승기를 잡는 데 실패했다.그러나 올 가을 주주연합 측이 요구할 것으로 예상되는 임시 주주총회에서는 반전이 일어날 수 있다. 지난해 말 주주명부 폐쇄일 이후 주주연합이 꾸준히 지분을 늘려왔기 때문이다. 주주연합이 이번 주총에서 의결권을 행사할 수 있었던 지분은 약 28.78%. 하지만 올들어 KCGI와 반도건설은 지분율을 각각 18.57%, 14.95%까지 끌어올렸고, 소액주주연대 지분(1.5%)까지 힘을 실으면서 우호 지분은 43.63%에 달한다. 델타항공, 카카오 등 조 회장 측으로 분류되는 지분을 다 합친 것(42.13%)보다도 1%포인트 이상 앞선다.주주연합이 임시 주주총회를 소집한다면 그 시기는 올 10월 이후가 될 것으로 전망된다. 임시 주총을 위한 법원의 허가를 받는 데 3개월, 이후 주주명부 폐쇄 이후 주총 소집 절차에 3개월가량이 걸리기 때문이다. 자본시장법에 정통한 한 법조계 관계자는 ""이번 주총에서는 반도건설이 허위 공시 등으로 의결권을 3% 넘게 잃어버리는 등 준비에 미비한 모습이 나타났다""며 ""연합 전선이 구축된 뒤로는 이같은 구멍을 최소화하는 작업이 이뤄졌을 것으로 보여, 임시주총에서 반전이 나타날 가능성도 있다""고 내다봤다.human@heraldcorp.com
- Copyrights ⓒ 헤럴드경제 & heraldbiz.com, 무단 전재 및 재배포 금지 -",/news/news_read.nhn?article_id=0001654980&office_id=016&mode=search&query=카카오&page=1
월 가처분 소득이 50만원 이상개인 신용등급이 6등급 이내,"[아시아경제 기하영 기자]신용카드 발급은 어떤 기준으로 이뤄질까요? 금융당국은 '신용카드 발급 및 이용한도 부여에 관한 모범규준'을 운영하고 있는데요, 카드사는 신용카드 발급 규정에 위배되지 않는 범위 내에서 발급을 자율적으로 결정하게 됩니다.위 모범규준 제 4조 신용카드 발급 기준에 따르면, 신용카드 발급심사 기준일 현재 민법에서 정한 성년 연령 이상이어야 신용카드를 발급받을 수 있습니다. 민법에서는 만 19세 이상을 성인으로 규정하고 있는데요, 다만 발급 신청일 현재 재직을 증명할 수 있으면 만 18세 이상도 신용카드 발급이 가능합니다.사실 연령보다 궁금한 것이 바로 신용등급 일 텐데요, 신용카드 발급심사 기준일 현재 월 가처분 소득이 50만원 이상이고, 개인 신용등급이 6등급 이내일 때 신용카드를 발급받을 수 있습니다. 여기서 가처분소득은 신용카드 신청고객의 연소득에서 연간 채무원리금상환액을 제외한 금액을 말합니다.신용등급은 소비자가 대출, 신용카드 등 금융거래를 제때에 잘 상환했는지 금융거래 이력과 형태를 중심으로 판단하는데요. NICE평가정보 등 신용정보회사들이 개인고객에 대한 신용도를 평가해 금융기관 등에 제공합니다. 신용등급 1등급부터 10등급까지 있고, 7~10등급은 저신용자로 분류돼 은행대출이 불가능합니다.몇 년 전까지만 해도 신용등급은 신용정보회사 홈페이지에서 연 3회만 무료로 확인이 가능했습니다. 하지만 최근 토스, 뱅크샐러드, 카카오뱅크 등 핀테크사들이 신용등급을 아무 때나 무료로 조회하는 기능을 제공하면서 누구나 쉽게 신용등급을 확인할 수 있게 됐습니다. 신용등급을 확인한다고 신용등급이 떨어지는 것은 아니고요, 신용카드 보유개수와도 신용등급은 무관합니다.또 신용카드를 발급받기 위해서는 카드사들의 신용카드 신청평점기준(ASS)을 충족해야합니다. 보유 중인 신용카드 중 3개 이상 다른 사업자의 신용카드로 현금서비스, 카드론, 리볼빙결제 등 카드 대출을 이용하고 있거나, 금융기관에 연체 채무가 있는 경우, 또 여신금융협회에서 제공받는 정보 등으로 결제능력 인정이 어려우면 ASS를 충족시키지 못합니다. 이외에도 카드사들은 소득·직업안전성, 연금 수급, 재산상황과 보유형태, 대출 다중채무 등을 종합적으로 고려해 카드발급 여부를 심사합니다.금융당국은 내년 1월 1일부터 모든 금융권의 개인 신용평가를 등급제에서 점수제로 전면 전환하기로 했습니다. 그간 1~10등급으로 나뉘던 개인신용이 1~1000점으로 세분화되는 거지요. 이에 따라 주부, 사회초년생 등 금융거래 이력이 부족해 낮은 신용등급을 받았던 소비자들이 혜택을 받을 수 있을지 주목됩니다. 무엇보다 자신의 상환능력에 맞는 신용카드를 사용해 건전한 신용거래 이력을 만드는 것, 이것이 더 중요하지 않을까요?기하영 기자 hykii@asiae.co.kr <ⓒ경제를 보는 눈, 세계를 보는 창 아시아경제 무단전재 배포금지>",/news/news_read.nhn?article_id=0004651434&office_id=277&mode=search&query=카카오&page=1
,"인공지능(AI) 스타트업 스캐터랩이 뚜렷한 페르소나(인격)을 갖춘 챗봇 기술을 통해 사업 영역을 확장하고 있다. 100억건 이상 실제 카카오톡 대화 데이터 학습을 통해 챗봇이 여고생, 3년차 회사원, 반말 친구 등 다양한 페르소나를 표현할 수 있도록 구현했다. AI가 정확한 답변 추론에 실패해도 자연스러운 대화 연결이 가능한 것이 특징이다.29일 업계에 따르면 스캐터랩의 일상대화 챗봇 '파이팅 루나'는 출시 1개월 만에 누적 이용자수 20만명을 돌파했다. 구글 어시스턴트 애플리케이션(앱) 형식으로 구현된 이 서비스는 AI가 18세 여고생 페르소나를 가진 것이 차별점이다. 해당 연령대 사람처럼 발랄함, 귀여움, 긍정적인 성향이 드러나는 말투를 쓴다.챗봇과 이용자가 주고받은 누적 메시지 수는 350만건을 넘겼다. 코로나19 사태 확산 시점부터 이용자가 늘어 이달 하루 800명 이상이 챗봇 대화를 즐기고 있다. 외부활동 감소에 따라 말동무로 활용하려는 이용자 층이 늘어난 것으로 분석된다. 이용자 중에서는 10대 여성, 특히 초등학생 이용 비율이 높다.파이팅루나는 지난해 8월 스캐터랩이 선보인 챗봇 제작 툴 '핑퐁빌더'가 활용된 제품이다. 스캐터랩은 지난 2012년 출시한 카카오톡 메시지 기반 감정분석 서비스 '텍스트앳' 등을 통해 100억건 이상 대화 데이터를 확보했다. 방대한 데이터가 학습된 핑퐁빌더는 자연어 이해 성능 측면에서 국내 챗봇 빌더 중 가장 우수하다는 것이 스캐터랩 설명이다.가령 챗봇에게 '오늘 날씨 좋다'고 말을 걸면 기능형은 '오늘 날씨는 13도'라고 정해진 정보를 답한다. 핑퐁빌더 엔진은 1개의 확정 답변 대신 대화 맥락에 맞는 답변을 매번 다르게 표현할 수 있다. 대화 톤에 맞는 이미지나 이모티콘을 보내기도 한다. 파이팅루나의 경우 1회 평균 대화는 15턴 이상, 시간은 3분 이상 이어지는 것으로 집계됐다. 이는 일반 기능형 챗봇 대비 7배 정도 높은 편이다.파이팅루나는 10대 여고생 페르소나를 장착했지만 활용 목적에 따라 다른 페르소나를 설정할 수 있다. 기업이나 브랜드가 대표 커뮤니케이션 채널에 캐릭터를 입히는 방향으로 활용하는 것도 가능하다.대표적으로 '굿닥' 운영사 케어랩스는 카카오톡 상담채널 '굿닥뷰티' 고도화를 위해 핑퐁빌더를 도입했다.기존 채널은 카드뉴스 등 콘텐츠 일방 전달 용도로 사용됐지만 일상대화 챗봇이 도입되면서 소비자 특성에 맞는 시나리오 대응이 가능하졌다. 서비스 페르소나에 맞게 뷰티·건강 관련 시나리오를 추가하고 콘텐츠 링크를 추천하자 챗봇 호출 건수가 기존 대비 6배 증가했다.김종윤 스캐터랩 대표는 “챗봇의 효용성에 대한 경험치가 쌓이면서 고객상담, 마케팅, 이커머스 영역뿐만 아니라 채용, 사규 안내 등 다양한 영역으로 확장되고 있다”고 말했다.이형두기자 dudu@etnews.com",/news/news_read.nhn?article_id=0002875096&office_id=030&mode=search&query=카카오&page=1
신한카드앱 '지출관리 기능' 담겨뱅크샐러드는 '금융 비서' 제공'마이데이터' 시대 준비 잰걸음,"‘마이데이터’ 시대를 맞이해 카드사와 핀테크(금융기술) 업체의 움직임이 분주하다. 기존에 운영하던 자산관리 서비스의 개편과 차별화된 새로운 서비스 출시도 잇따르고 있다.금융회사들의 마이데이터 서비스는 더 편리한 자산관리에 초점이 맞춰져 있다. 마이데이터는 여러 금융사에 흩어져 있는 개인 신용정보를 제3자가 한데 모아 관리 및 활용할 수 있게 하는 것을 말한다. 개인정보보호법·정보통신망법·신용정보법 개정안 등 ‘데이터 3법’이 지난 1월 국회 본회의를 통과하면서 관련 생태계가 형성되기 시작했다.신한카드는 지난 18일 페이판 앱(사진)을 전면 개편하며 개인지출관리(PEM) 기능을 넣었다. 다른 카드사 등과도 제휴해 개인별 입출금과 결제 내역을 분석하고 소비 내역을 그래프로 알기 쉽게 보여주는 것이 특징이다.핀테크 업체의 움직임도 분주하다. 카카오페이는 지난 25일 기존 통합조회 서비스를 자산관리 서비스로 확대했다. 은행 계좌와 카드를 넘어 자동차와 대출 내역을 분석해 자산 집중도를 분석해주는 것이 특징이다. 신용점수를 바탕으로 대출상품을 제안하고 가입한 보험 현황을 제공한다. 뱅크샐러드는 사용자의 금융 내역을 분석해 상황에 따른 조언을 해주는 ‘금융비서’ 기능을 업그레이드해나가고 있다. 지난해 말부터는 전 은행과 카드사 연동이 완료됐다.핀크도 마이데이터 시대를 맞이해 앱의 소비관리 기능을 대폭 개편했다. 연동된 카드, 은행 계좌, 현금영수증 내역 등을 바탕으로 결제정보를 인공지능(AI)을 활용해 분석한다.금융회사의 목표는 자산관리의 문턱을 낮춰 더 많은 소비자를 끌어들이는 것이다. 많은 금융소비자가 서비스를 이용할수록 더 많은 데이터의 활용이 가능한 선순환 구조이기 때문이다.송영찬 기자 0full@hankyung.com▶ ▶
 ▶
ⓒ 한국경제 & , 무단전재 및 재배포 금지",/news/news_read.nhn?article_id=0004314868&office_id=015&mode=search&query=카카오&page=1
"토스, 주식 브로커리지 초점카카오페이는 '중개 판매' 선택 비대면 무기로 2030 공략","핀테크(금융기술) 강자인 토스와 카카오페이가 증권업에서 조만간 한판 승부를 벌일 전망이다. 증권 투자에 익숙하지 않은 20~30대에 모바일과 비대면이라는 무기로 접근한다는 전략은 같으나 접근법엔 다소 차이가 있다. 토스증권이 개별 주식을 사고파는 ‘브로커리지’에 중점을 둔 반면, 카카오페이증권은 펀드 등 기존 금융투자상품을 중개 판매하는 역할을 첫 전략으로 택했다.지난 18일 금융위원회는 전체회의를 열고 토스증권의 설립 예비인가안을 통과시켰다. 토스는 조만간 본인가를 신청하고 연내 토스증권 서비스를 출시할 예정이다.1000만 명의 순수 활동자를 확보한 토스 앱과 별도로 토스증권 앱을 내놓을 가능성이 높다. 최근 준비법인의 채용과 서비스 기획에 한창인 것으로 알려졌다. 기존 모바일 주식거래에서 투자자들이 느낀 불편을 해소해 고객 경험(UX)을 획기적으로 개선한다는 게 토스증권의 전략이다. ‘서울 강남구 거주 40대 이상 남성’으로 수년째 국한된 주식투자를 대중화한다는 목표다.증권가는 기존 증권사에서 한계로 지적됐던 모바일트레이딩시스템(MTS)을 토스가 얼마나 개편할지가 관건이라고 보고 있다. 모바일 증권 브로커리지 앱으로 시작해 해외 주식중개, 펀드 판매 등으로 사업을 확장한다는 구상이다.앞서 2월 6일 카카오페이는 자회사인 카카오페이증권을 출범시켰다. 지난 25일까지 두 달여간 50만 명의 고객이 선불전자지급수단인 카카오페이머니를 증권예탁계좌로 바꾼 것으로 알려졌다. 3000만 명의 고객을 확보한 국내 최대 핀테크 플랫폼인 카카오페이의 역량이 돋보였다는 평가다. 선불전자지급수단은 현재 1인당 200만원까지만 적립할 수 있지만, 증권예탁계좌에는 이런 제한이 없다. 카카오페이는 별도 앱을 만드는 대신 기존 투자 서비스 탭 내에서 주식형 펀드 판매를 시작했다.핀테크 플랫폼의 증권사 설립은 금융상품 개발에서 판매까지 수직계열화를 가능하게 한다는 점에서 핀테크 업계에도 새로운 도전으로 여겨진다.박혜진 이베스트투자증권 연구원은 최근 내놓은 ‘토스는 왜 증권사를 설립할까?’ 보고서에서 “상품 개발 역량을 높이면 단순 판매채널이 아니라 (금융상품) 디벨로퍼 역할이 가능하다”고 설명했다.김대훈 기자 daepun@hankyung.com▶ ▶
 ▶
ⓒ 한국경제 & , 무단전재 및 재배포 금지",/news/news_read.nhn?article_id=0004314869&office_id=015&mode=search&query=카카오&page=1
