head,text,url
,"정부가 코로나19로 어려움을 겪고 있는 우수 중소식품기업의 상품을 대상으로 온라인에서 특별 판매행사를 갖는다.농림축산식품부는 코로나19 사태 장기화에 따른 소비위축으로 오프라인 판매에 어려움을 겪고 있는 중소식품업체를 위해 온라인을 통한 특별 판매행사를 추진한다고 30일 밝혔다.이번 행사는 개학연기 등으로 대체 판로 확보가 어려운 학교급식업체와 코로나19로 매출이 감소하는 등 어려움을 겪고 있는 전통식품 제조업체·농공상기업을 포함한 중소식품업체의 온라인 소비촉진의 일환으로 기획됐다.먼저 31일부터 4월 13일까지 2주간 우체국쇼핑몰에서에서 우수 중소식품업체를 중심으로 대한민국김치협회와 전통가공식품협회, 전통민속주협회 등 협회의 추천을 받아 ‘힘내라 중소식품’ 행사를 추진한다.또 5~7월 매월 첫 2주 동안 우체국 쇼핑몰뿐만 아니라 옥션·G마켓 등 다양한 판매 채널로 확대해 특별기획전을 진행할 계획이다.행사기간 동안 배너광고·앱푸시·카카오톡 메시지 발송 등을 통해 적극적으로 홍보하는 한편, 할인 쿠폰(10%)을 제공해 우수한 제품을 저렴한 가격으로 이용할 수 있게 했다.아울러 온라인 미입점 업체에 대해서는 상품 설명을 위한 상세페이지 제작을 무료로 지원할 계획이다. 지원대상은 △개학연기 등으로 대체 판로 확보가 어려운 학교급식업체 △전년 동기대비 매출액이 10% 이상 감소한 기업으로, 식품명인, 전통식품인증기업, 술품질인증기업, 농공상기업 등 우수 품질인증업체들은 우선해서 지원할 예정이다.특별기획전 참가 및 상세페이지 제작 신청은 한국농수산식품유통공사(aT) 식품기업지원센터를 통해 신청하면 된다.농식품부 박병홍 식품산업정책실장은 “소비자들이 우리 전통식품과 국산 농산물로 만든 우수 가공식품을 합리적인 가격에 구매할 수 있는 좋은 기회가 될 것으로 기대하며 코로나19로 어려움에 처한 중소식품기업을 위해 우수 제품개발 및 판로확대를 지속적으로 지원할 계획”이라고 밝혔다.김덕준 기자 casiopea@busan.com",/news/news_read.nhn?article_id=0000992350&office_id=082&mode=search&query=카카오&page=3
,"코로나19가 장기화되면서 이른바 '코로나 블루(코로나19와 우울함(Blue)을 합성한 신조어)'를 호소하는 사람들이 늘고 있다. 외부 활동 제한과 감염 불안, 경제적인 영향 등으로 인해 불안감과 우울감, 스트레스를 느끼고 있는 것.정신건강 헬스케어 전문 기업 옴니씨앤에스는 코로나19 극복을 위한 캠페인으로 '마음 방역 7계명'을 발표했다. 이에 따라 코로나19 스트레스를 대처하기 위해서는 ▲감염병 치료·관리 방침 등을 이해하고 코로나19에 관한 팩트를 선별할 것 ▲가족과 친구, 동료와 소통하기 ▲규칙적인 수면습관 갖기 ▲규칙적으로 운동하기 ▲나의 일상과 건강을 돌아보기 ▲스트레스에서 벗어나도록 마음챙김 명상하기 ▲긍정적인 마음을 유지할 것 등을 당부했다.전문가들 역시 이럴 때 일수록 좋아하는 음악 듣기, 명상하며 마음을 다스리기 등을 통해 심리적으로 부정적인 감정을 미리 예방하고 치료하는 '심리 방역'의 중요성을 강조하고 있다. 관련 무료 서비스들 또한 늘어나고 있다. 먼저 SK텔레콤은 코로나19에 지친 사람을 위해 인공지능(AI) 스피커 '누구(NUGU)' 전용 명상 서비스 '누구 마음보기'를 무료 제공하고 있다. 누구 마음보기는아침·저녁 명상 2종과 호흡 명상 20종, 자애명상 11종 등으로 구성돼 있다. 코로나19 관련 명상 콘텐츠 8종도 포함됐다. 이용방법은 이용자가 AI 스피커 누구에 대고 ""마음보기에서 힐링 명상 들려줘""라는 식으로 말하면, 누구가 카데고리별 또는 시간별로 5~15분 분량의 명상 콘텐츠를 자동으로 추천해 들려준다.명상심리 어플리케이션(앱) 코끼리 또한 요즘 주목받고 있다. 론칭 6개월 만에 누적 가입자 20만명을 돌파했다. 코끼리 명상 앱은 어려운 시기를 함께 이겨내고자 불안한 마음을 다루는 'S.O.S 긴급 힐링 명상' 등 일부 콘텐츠를 무료로 제공하고 있다. 카카오 역시 사회공헌 플랫폼 '카카오같이가치'를 통해 명상 콘텐츠를 제공하고 있다. 해당 콘텐츠는 '자가격리 중에 하는 명상', '마음의 면역력을 높이는 명상', '코로나19를 이기는 시' 등 10분 내외 분량의 명상 8개로 구성돼 있다. 한편 집에 머무는 시간이 길어지면서 '달고나 커피 만들기', '아무놀이 챌린지' 등 독특한 방법으로 지루함을 떨쳐내는 사람들이 눈길을 끌고 있다.특히 추억의 글라스테코부터 다이어리나 폴라로이드 꾸미기 등 집에서 즐길 수 있는 다양한 취미 활동이 주목받고 있다. G마켓에 따르면 최근 한달간 마스킹테이프 등 다이어리 꾸미기 용품이 포함된 문구·사무용품의 매출이 71%가량 증가했다.
온라인을 통한 취미 클래스의 수요도 늘어나는 추세다. 온라인 취미 클래스 서비스 '클래스 101'에 따르면 가장 큰 폭으로 상승한 분야는 미니어처나 소품을 직접 만드는 DIY 제품 만들기 강의다. 클래스 101은 해당 강의가 코로나19 확산 전보다 약 290%에 달하는 판매 증가율을 보였다고 전했다.이미선 기자 already@sportschosun.com- Copyrightsⓒ , 무단 전재 및 재배포 금지",/news/news_read.nhn?article_id=0003548211&office_id=076&mode=search&query=카카오&page=3
"농식품부, 우체국쇼핑몰·이베이 등과 행사 추진10% 할인 쿠폰 제공, 상품설명 상세페이지 지원","김현수(왼쪽 첫번째) 농림축산식품부 장관과 이성희(가운데) 농협중앙회 회장이 지난 19일 서울 서초구 농협 하나로마트 양재점에서 열린 ‘친환경 농산물 특별판매전’을 둘러보고 있다. 농협 제공[세종=이데일리 이명철 기자] 코로나19 확산으로 판매에 어려움을 겪는 중소식품기업 대상으로 정부가 온라인을 통한 판매 촉진을 실시한다. 농림축산식품부는 오는 7월까지 4차례에 걸쳐 우체국 쇼핑몰, 이베이 등과 함께 온라인 특별 판매행사를 추진한다고 30일 밝혔다.이번 온라인 판촉 지원 대상은 개학연기 등으로 대체 판로 확보가 어려운 학교 급식업체와 매출액이 전년동기대비 10% 이상 감소한 기업이다. 식품명인, 전통식품인증기업, 술품질인증기업, 농공상기업 등 우수 품질인증업체들은 우선 지원한다.우선 이달 31일부터 내달 13일까지 우체국쇼핑몰에서는 우수 중소식품업체 중심으로 대한민국김치협회, 한국전통가공식품협회, 한국전통민속주협회 등 관련 협회 추천을 받아 특별기획전을 연다.5~7월 매월 첫 2주 동안 우체국쇼핑몰과 이베이(옥션·G마켓) 등에서도 특별기획전을 진행할 예정이다.행사기간 배너광고·앱푸시·카카오톡 메시지 발송 등으로 홍보하고 10% 할인 쿠폰(소진 시 조기 종료)을 제공한다. 온라인에 입점하지 않은 업체의 상품 설명을 위한 상세페이지 제작을 무료로 지원한다.특별기획전 참가와 상세페이지 제작 신청은 한국농수산식품유통공사(aT) 식품기업지원센터로 하면 된다.박병홍 농식품부 식품산업정책실장은 “소비자들이 우리 전통식품과 국산 농산물로 만든 우수 가공식품을 합리적인 가격에 구매할 좋은 기회”라며 “코로나19로 어려움에 처한 중소식품기업을 위해 우수 제품 개발과 판로확대를 지속 지원할 계획”이라고 말했다.이명철 (twomc@edaily.co.kr)＜ⓒ종합 경제정보 미디어 이데일리 - 무단전재 & 재배포 금지＞",/news/news_read.nhn?article_id=0004608634&office_id=018&mode=search&query=카카오&page=2
,"(서울=연합뉴스) 홍지인 기자 = 카카오커머스는 신종 코로나바이러스 감염증(코로나19) 확산으로 피해를 본 농어촌을 돕고자 농수산물 특별 기획전을 진행한다고 30일 밝혔다.

전국 10여개 지방자치단체 및 지역 생산·유통사와 함께 진행하는 이번 기획전에서는 현재 농수산물 14종을 판매하고 있다.

단기간 내 판매를 촉진하기 위해 공동구매 할인 기능 '톡딜'을 적용했다.

 기획전은 카카오톡 더보기 탭에 있는 '카카오톡 쇼핑하기'와 '카카오장보기', '카카오파머' 톡채널 등에서 이용할 수 있다.

회사 관계자는 ""앞으로도 톡딜 등을 활용해 판매에 어려움을 겪고 있는 상품들을 쉽게 알리고 판매할 수 있도록 지자체 및 생산자와 협업을 확대해나갈 계획""이라고 밝혔다.

ljungberg@yna.co.kr",/news/news_read.nhn?article_id=0011508592&office_id=001&mode=search&query=카카오&page=2
"수수료 없이 결제·송금·환전 가능정부 '사업자 라이선스' 도입핀테크 기업 우위 점할 가능성은행·카드사, ICT기업과 협업","정부 데이터 3법 시행령 개정안 발표로 마이데이터 산업과 함께 마이페이먼트 산업이 금융시장 개편을 예고했다.은행은 물론 카드, 보험 등 대형 금융사들이 마이페이먼트 시장 진입 작업에 착수했다. 대형 핀테크 기업 상당수도 간편결제 시장 외연 확대를 위해 마이페이먼트 시장 선점을 위해 물밑 작업을 추진 중이다.마이페이먼트(MyPayment)는 결제자금이 없어도 거래정보만으로 결제하는 '지급지시 서비스업'이다. 이 서비스가 도입되면 개인이 로그인 한 번만으로 모든 계좌를 활용해 결제, 송금이 가능해진다. 종전 전통 금융사에 높은 수수료를 내지 않아도 다양한 결제, 송금 서비스 등을 이용할 수 있다.특히 환전과 송금, 결제 서비스가 모바일 기반으로 가능해져 종전 금융사가 제공하던 다양한 수수료 체계가 붕괴될 가능성도 배제할 수 없다. 한국 금융 인프라를 완전히 뒤엎는 지급결제 2막이 예고된 셈이다.마이데이터산업이 이종 영역간 데이터 융합을 통한 컨버전스 사업이라면, 마이페이먼트는 지급결제 인프라를 혁신한 간편결제사업 확대 버전이다. 대형 은행과 전통 금융사는 물론 정보통신기술(ICT) 기반 핀테크 기업이 유관 시장에 뛰어들 태세다.정부는 올 하반기 마이페이먼트 사업 확대를 위해 지급결제개시서비스 사업자(PISP) 라이선스 제도를 전격 도입한다. 핀테크 산업 전반 '게임 체인저'가 탄생할 가능성이 높다. 이 시장 선점을 누가 하느냐에 따라 막대한 금융 소비자 정보와 플랫폼 장악력을 쥘 수 있다.은행과 카드사 등 대형 금융사는 물론 핀테크 기업까지 마이페이먼트 사업에 큰 관심을 보이며 컨설팅 용역을 맡기는 등 사업 진입 작업에 착수했다.한 카드사 고위 관계자는 “결제 구조 인프라를 송두리째 바꿀 수 있는 마이페이먼트 시장에 진입하지 못하면 카드사는 물론 종전 금융사는 존립 위기에 처할 수 있다는 위기감이 고조되고 있다”고 분위기를 전했다. 대형 핀테크 기업 대표는 “중장기로 마이페이먼트와 마이데이터를 결합하면 그간 선보일 수 없었던 혁신적인 금융 서비스를 창출할 수 있기 때문에 전자금융사업자는 물론 다양한 지급결제 사업자들이 유관 시장에 뛰어들 기세”라고 설명했다.PISP 사업자 지정제가 도입될 경우 전통 금융사보다는 ICT 기반 핀테크 기업이 유관 시장에서 우위를 점할 가능성이 높다.소비자가 이용 중인 결제나 송금, 환전 서비스 등은 금융사 망을 이용해 상당한 수수료를 지급하며 이뤄졌다. 반면에 PISP가 도입되면 마이페이먼트 사업자는 은행 등과 제휴 없이 독자적으로 계좌를 발급, 관리할 가능성이 높아진다. 중장기로는 각종 금융정보 조회, 투자, 자산관리 서비스까지 PISP 사업자가 선점하게 된다.각종 수수료로 큰 돈을 벌었던 은행과 카드사 등은 위기에 봉착할 수 있다.이 때문에 PISP 협력체제를 구축하려는 움직임도 있다. 일부 대형 금융사는 유력 ICT 기업과 손잡고 새로운 금융 통합 플랫폼을 검토한다.이미 간편결제 시장에 안착한 네이버, 카카오, 핀크 등 대형 ICT 사업자 약진이 예상된다.김용덕 기술보증기금 미래혁신연구소 박사는 “PISP가 시행되면 은행 등 전통 금융사 입지가 약화될 가능성이 높다”며 “마이페이먼트가 도입될 경우 금융권은 엄청난 경쟁에 직면하게 될 것”이라고 밝혔다.길재식기자 osolgil@etnews.com",/news/news_read.nhn?article_id=0002875208&office_id=030&mode=search&query=카카오&page=2
"주택도시보증공사(HUG)전세금 보증 확대, 보증료 할인 등 서민 임차인 보호 제도 개선 노력복잡한 기금대출 절차 간소화로 은행 안가고 웹-모바일 신청 가능노후주택 개보수, 도시놀이터 조성 주택 중심 사회공헌 사업도 활발","주택도시보증공사(HUG, 사장 이재광·사진)는 주거복지 증진과 도시재생 활성화를 목표로 각종 보증업무, 정부정책 지원 사업을 수행하고 주택도시기금을 효율적으로 관리·운용해 국민주거 안정을 이끌어 가는 공기업이다. HUG는 지난해 어려운 여건 속에서도 많은 노력으로 그에 따른 성과가 있었다. 첫째, 서민 임차인 보호를 위한 전세금보증 공급을 대폭 확대했다. 임차인 지원 강화를 위해 전세금보증 가입요건을 완화하였고 보증료 할인 대상을 확대하였으며 모바일 전세금보증 서비스를 도입하는 등 제도를 개선했다. 이러한 지속적인 제도개선 노력으로 전세금보증 실적은 47조 원으로 2018년 30조 원 대비 급증하며 역대 최대실적을 달성했다.
특히 카카오페이와 연계한 모바일 전세금보증 서비스는 보증신청부터 서류 제출 및 보증료결제까지 전 과정을 모바일로 처리해 고객의 편의성을 극대화했다. 한편 주말·공휴일에도 임차인이 전세금을 돌려받고 이사할 수 있도록 비영업일 전세금보증 이행서비스를 도입했는데 이는 적극 행정 우수사례로 인사혁신처장 표창(우수상)을 수상했다. 둘째, 주택시장 안정화를 위한 정부정책을 최일선에서 지원했다. 미분양으로 인한 주택시장 침체 및 보증사고 발생 리스크를 선제적으로 관리하기 위해 미분양관리지역을 운영한 결과 미분양관리지역 내 미분양이 감소되는 성과를 거뒀다. 셋째, 도시재생 뉴딜의 가시적 성과를 창출했다. 핵심 국정과제인 ‘도시재생 뉴딜’ 정책지원을 위해 권역별 영업망을 구축하고 新금융기법을 도입했으며 지자체의 기금활용을 의무화하도록 하는 한편 금융지원 활성화를 위해 자산관리회사(AMC) 겸영인가를 받았다. 이런 노력의 결과로 도시재생 예산을 5400억 원 집행하며 도시재생사업 금융지원을 활발히 수행했다. 넷째, 복잡한 서류 제출 및 은행 방문 없이도 인터넷·모바일을 통해 간편하게 기금 대출을 신청할 수 있는 비대면 기금대출(기금e든든) 시스템 출시를 통해 기금대출 절차를 혁신했다. 마지막으로 다양한 사회공헌을 수행했다. 주택분야에 특화된 업무역량을 활용한 HUG 셰어하우스, 노후주택 개보수 사회공헌 사업 등을 통해 취약계층의 열악한 주거환경 개선에 기여하였고, 도시놀이터 프로젝트, 꽃피는 경로당 등의 사업을 통하여 구도심 정주여건을 개선함으로써 도시에 활력을 불어넣는 데 기여했다. 또 사회복지기관 차량 기증 등 지역사회 취약계층을 위한 기부, 재해·재난 발생시 구호를 위한 기부 등을 수행했다.
한편 HUG는 공사 업역인 주택 및 도시와 관련된 진로체험 프로그램을 운영하고 멘토링을 통한 학습 성장을 지원하는 등 미래의 주역인 아동, 청소년 및 대학생들의 꿈을 응원함으로써 사회공헌의 선순환 고리를 창출하고자 노력하고 있다.
HUG는 사회적 책임을 충실히 실천해온 공로를 인정받아 보건복지부 ‘2019년 대한민국 나눔국민대상’에서 ‘장관 표창’을 받았고, 보건복지부 주관 ‘2019 지역사회공헌 인정기관’‘우수기업’에 선정됐으며 혁신도시 공공기관 지역교육과정(오픈캠퍼스)을 선도적으로 운영해 우수한 지역인재를 양성함으로써 지역발전에 기여한 공로로 ‘국토교통부 장관상’을 수상하기도 했다. 올해에도 HUG는 대내외 경영환경과 정부정책 방향 등을 종합적으로 고려해 경제활력 제고, 주거복지 향상 등 사회적 가치 중심의 경영활동에 지속적으로 매진할 예정이다. 작년에 이어 HUG의 지향점인 ‘포용적 주거복지 향상 및 도시재생 성과창출’에 지속적으로 정진하기 위해 4대 전략방향을 설정해 사업을 추진할 예정이다.
사회통합형 주거복지 실현을 위해 노력한다. 모바일 전세금보증 서비스를 성공적으로 안착시키는 등 서민·실수요자 중심으로 금융지원 체감도를 높이고, 보증심사 강화를 통한 주택시장 안정화와 공적 임대주택 공급기반을 확대할 것이다.
지역상생형 도시재생 활성화에 기여한다. 도시재생 사업 활성화 기반 구축을 위해 다양한 사업 발굴을 추진하고, 도시재생 경제 선순환 체계를 마련해 뉴딜사업 금융지원을 내실화하고 관계기관 협업과 거버넌스를 확대해 도시재생의 지원성과를 창출할 것이다.
지속가능 성장 및 경영체계 혁신에 힘쓴다. 리스크관리체계를 더욱 공고히 하고, 국제교류를 활성화하는 한편, 주택도시금융 R&D 역량을 강화해 미래를 대비한 사업 토대를 튼튼히 다질 것이다. 사회적 가치 실현에 앞장설 것이다. 도시재생과 연계한 청년 일자리 등 좋은 일자리를 많이 창출하고, 청렴하고 공정한 조직문화를 지속적으로 조성하는 동시에 사회공헌 확대 등 지역사회 발전을 위해 노력할 것이다.박지원 기자 jwpark@donga.comⓒ 동아일보 & donga.com, 무단 전재 및 재배포 금지",/news/news_read.nhn?article_id=0003278119&office_id=020&mode=search&query=카카오&page=2
,"라오스에 거주하거나 체류해 온 교민들이 민간기업의 주도로 귀국길에 오른다.라오스 정부의 국경 폐쇄로 발이 묶였던 라오스 교민들과 여행객, 해외봉사단원 등 한국인 약 200 여명이 발이 묶인 가운데 한국-라오스 민간기업 올리브트리글로벌이 라오스 국적항공사 라오항공과 빠른 협의 끝에 임시 전세기를 마련했다. 우리 교민들은 4월 3일, 5일 두 편의 전세기 항공편으로 인천공항에 도착한다.올리브트리글로벌 측은 지난 3월 23일 라오스 교민들과 여행객, 부상자 및 해외봉사단원 등을 대상으로 귀국 희망자들을 파악하기 위해 카카오톡 단톡방(라오스 한국 전세기편 라오항공)을 만들었다. 순식간에 단톡방 참여자가 378명이 되었으며, 희망자 스스로 비용을 부담하는 참여 투표를 실시해 200여명이 한국 귀국을 희망한 것으로 집계됐다.라오항공은 코로나19로 인해 한국과 라오스 간의 모든 항공편이 운항 중단되면서 비엔티안뿐만 아니라 루앙프라방, 방비엥, 팍세 등 라오스 전 지역에 발이 묶인 한국 교민들과 부상자 등에 대해 어려운 상황을 듣고 운항을 결정했다.라오스 국적항공사가 한국 교민 수송을 위해 전세기 취항을 결정한 것은 이번이 처음이다. 전세기 항공편은 각각 4월 3일, 5일 오전 7시 30분 비엔티안을 출발해 오후 2시 인천국제공항에 도착하게 되며, 200여명 이상의 교민이 탑승할 예정이다.라오항공은 이코노미 클래스 성인 USD 600, 만 12세 이하 USD 450와 비즈니스 클래스 USD 1,100 로 요금을 책정했다. 항공요금과 지불방법은 라오항공 비엔티안 본사 방문과 티켓라오를 통해서만 구입 가능하다.전세기 탑승 예정인 여행객 박모 씨는 “15일간 줄곧 한인 게스트하우스에서 지내며 생필품을 사야 할 때만 마스크를 착용하고 외출을 최소화 했다”며 “이번 전세기편 마련을 위해  제일 앞장서서 애써주신 단톡방 운영자 올리브트리글로벌 조민성 대표와 운영진 여러분께 감사드린다”고 밝혔다.현재 라오스 내 해외대사관 담당자들은 자국민들이 이번 전세기를 이용하여 한국을 경유해 자국으로 갈 수 있는 방법을 모색하며 올리브트리글로벌 조민성 대표에게 문의가 쇄도하고 있는 것으로 전해졌다.올리브트리글로벌 조민성 대표는 “현지 교민들이 비자 만료와 모든 국제선 항공편의 운항 중단에 따른 불안과 교통사고 부상자도 발생해 심각한 상황에 처해 있다는 소식을 듣고 전세기 항공편 투입을 이끌어냈다”며 “주 라오스 대사관과 영사관 관계자, 라오항공 관계자 그리고 티켓라오의 협조가 없었다면 불가능했다”며 감사의 뜻을 전했다.
- Copyrights ⓒ 헤럴드경제 & heraldbiz.com, 무단 전재 및 재배포 금지 -",/news/news_read.nhn?article_id=0001655476&office_id=016&mode=search&query=카카오&page=2
▶ 헉! 소리나는 스!토리 뉴스 [헉스]▶ '아는 척'하고 싶은 당신을 위한 [두유노우]▶ 한눈에 보는 [4·15총선 NEWS MAP],"[파이낸셜뉴스] 오비맥주는 버드와이저가 코로나19 사태로 힘든 시기를 보내고 있는 젊은 예술가들을 응원하는 ‘스테이 스트롱’ 기부 캠페인을 한다고 30일 밝혔다.
 이번 캠페인은 소비자들이 ‘착한 소비’를 통해 위기 속에서 ‘함께 맞서는 가치’를 실현하자는 취지로 기획됐다.
 버드와이저는 창작집단 스튜디오 콘크리트와 협업을 통해 한정판 티셔츠를 제작, 다음달 30일까지 카카오 선물하기를 통해 판매한다.
 캠페인 취지에 공감하는 소비자들은 티셔츠의 값을 지불하는 동시에 코로나19로 형편이 어려워진 예술가들을 도울 수 있다. 버드와이저는 판매수익금 전액과 추가로 동일한 모금액을 ‘매칭그랜트’ 방식으로 서울문화재단에 기부한다. 이를 통해 생활고에 시달리는 젊은 예술가들을 지원할 예정이다.
 한편, 한국예술문화단체총연합회가 최근 발표한 보고서에 따르면, 올해 코로나19로 취소, 연기된 현장 예술행사는 2500여건으로 피해 규모가 약 600억원에 이른다. 예술인 10명 중 9명은 전년대비 수입이 감소했다.



 ※ 저작권자 ⓒ 파이낸셜뉴스. 무단 전재-재배포 금지",/news/news_read.nhn?article_id=0004398844&office_id=014&mode=search&query=카카오&page=2
