head,text,url
"한화시스템, 리케 거래소에 투자자체 코인 등 총 25개 자산 거래예술품 데이터 거래 등에도 진출한화손보도 해킹 보상 보험 출시싱가포르 토큰 등 해외사업 가속","한화시스템이 스위스의 블록체인 핀테크 전문기업 리케에 투자했다. 한화시스템이 블록체인·가상자산 관련 기업에 독자적으로 투자를 단행한 것은 이번이 처음이다.
 ■가상자산 기업 첫 투자
 30일 한화시스템은 리케(Lykke Corp) 거래소에 약 2억원을 투자했다고 밝혔다. 한화시스템은 이번 투자를 통해 블록체인 사업의 해외 진출을 가속화하고, 글로벌 유수 블록체인 기업들과 협업을 강화해 나간다는 계획이다.
 리케는 지난 2015년 설립된 블록체인 핀테크 기업으로, 주요 사업으로 가상자산 거래 플랫폼과 지갑 서비스를 제공하고 있다.
 현재 비트코인과 이더리움, 리플, 온톨로지 등 총 25개 가상자산이 리케 거래소에서 거래되고 있으며, 각각 iOS와 안드로이드 버전의 가상자산 지갑 애플리케이션(앱)도 서비스 중이다.
 특히 리케는 지난 2016년 자체적으로 발행한 3000만개 리케 코인(LKK)을 가상자산공개(ICO)를 통해 대중에 판매하는 등 가상자산 관련 서비스를 폭넓게 지원하고 있다. 30일 현재 리케 코인 시가총액은 31억원 규모로 추산된다.
 한화시스템은 지난 2018년 서울옥션블루의 관계사 위빌(현 블루인덱스)에 10억원을 투자하며 블록체인 사업을 본격화했다. 블루인덱스와 함께 예술품 데이터의 신뢰를 강화하고 유통을 촉진할 수 있는 블록체인 기반 예술품 데이터 거래 플랫폼을 공동 개발한 것. 현재 해당 서비스는 카카오 블록체인 플랫폼 클레이튼에 탑재됐다.
 한화시스템은 자체적으로 개발한 기업용 블록체인 플랫폼 에이치체인(H-Chain)을 통해 블록체인 엔터프라이즈 시장을 적극 공략하고 있다. 지난 2018년 출시한 최초 1.0 버전을 시작으로 올 하반기 블록체인 탈중앙 금융 플랫폼 스텔라와 연동을 지원하는 3.0 버전을 출시할 예정이다.
 ■한화그룹, 전사적 블록체인 사업 확대
 한화그룹은 주요 계열사를 중심으로 블록체인 사업을 활발히 전개하고 있는 국내 대표 기업 중 하나다.
 한화손해보험은 지난 2018년 업계 최초로 가상자산 거래소 해킹 피해를 보장하는 사이버보험을 출시했다. 지난해 10월 한화손해보험과 SK텔레콤, 현대자동차 등이 합작해 설립한 캐롯손해보험도 블록체인 기반 모바일 신원증명(DID, Decentralized ID) 서비스를 준비 중인 '이니셜 DID' 연합에 일찌감치 합류했다.
 한화자산운용과 한화투자증권 등 주요 금융 계열사 또한 블록체인 기업 투자 포트폴리오를 공격적으로 확대하고 있다.
 한화자산운용은 올초 싱가포르 증권형토큰(STO) 발행 플랫폼 아이스탁스(iSTOX)에 500만달러(약 58억원) 규모 투자를 완료했다. 한화투자증권은 각각 싱가포르 블록체인 기업 원익스체인지 운영사인 캡브릿지그룹과 태국 블록체인 기업 라이트넷에 투자를 단행했다.
 특히 원익스체인지는 지난해 7월 현지 블록체인 기업 중 최초로 싱가포르 금융청(Monetary Authority of Singapore, MAS)으로부터 블록체인 기반 디지털 자산 발행 영업 허가를 받는 등 전세계적으로 유망한 블록체인 기업 중 하나로 꼽힌다.
 한화시스템 측은 ""향후 블록체인 기반 '자산 유동화 서비스 사업(ABT, Asset Backed Token)' 확대 일환으로 해외 수출 레퍼런스를 보완하기 위한 목적으로 리케에 투자했다""며 ""단순히 가상자산 분야에만 초점을 두는 것이 아니라 블록체인 금융·핀테크 사업을 폭넓게 고려하고 있다""고 말했다.


 ※ 저작권자 ⓒ 파이낸셜뉴스. 무단 전재-재배포 금지",/news/news_read.nhn?article_id=0004399064&office_id=014&mode=search&query=카카오&page=2
"모바일 탈모 관리 PT 서비스생활습관 개선, 탈모·두피 관리","[서울=뉴시스] 김정환 기자 = 모바일 탈모 관리 퍼스널 트레이닝(PT) 서비스가
신종 코로나바이러스 감염증(코로나19) 사태가 장기화하면서 '비대면(언택트) 서비스' 중 하나로 인기를 끌고 있다. 탈모·두피 케어 브랜드 '자올'은 '탈모 PT' 서비스인 '자올 링커'가 최근 큰 호응을 얻고 있다고 30일 밝혔다. 자올 링커는 자올의 정기 구독 상품 '먼슬리 자올' 고객에게 지난해 8월부터 제공되고 있다. 혼자 관리하기 어려운 탈모 특성을 고려해 운동 PT처럼 개인 맞춤형이다. 자올 링커는 카카오톡 '먼슬리 자올 플러스친구'를 통해 이뤄진다. 먼슬리 자올 최초 구매 시 두피 타입, 탈모 부위와 진행 시점, 가족력 등을 체크한다. 제품과 현미경 사용법, 밤푸(밤에 샴푸 하기) 관리 등 올바른 제품 사용법을 안내한다. 이후 매주 변화 체크, 고객 맞춤 가이드, 맞춤 콘텐츠 제공 등 1 대 1 코칭으로 고객 생활 습관 개선과 탈모·두피 관리를 돕는다. 자올 링커는 탈모 경험자·진행자를 대상으로 지난 2~3일 두잇서베이에서 진행한 '탈모 제품 및 관리 실태 만족도' 관련 설문 조사에서 응답자의 35%가 ""탈모·두피 관리 PT를 받으면 탈모 개선을 위한 지구력 증진 차원에서 많은 도움이 될 것 같다""고 긍정적으로 답한 데서 볼 수 있듯 의미 있는 서비스다.주목할 만한 것은 '생활 습관 개선'을 챙긴다는 사실이다. 실제 같은 설문 조사에서 응답자의 44%가 ""탈모 제품 사용과 생활 습관 개선을 병행해야 효과적일 것이다""고 답했다. 탈모 PT 필요성을 못 느끼는 응답자 중에도 생활 습관 개선 필요성을 느끼는 경우가 많다는 사실이 드러나는 대목이다.자올 관계자는 ""생활 습관 개선이나 꾸준한 탈모 관리가 어려운 고객을 위해 먼슬리 자올에 링커 시스템을 도입했다""며 ""두피 클리닉 센터에 가지 않아도 모바일로 개인 상태에 걸맞은 상담과 관리가 가능해 최근 고객 만족도가 더욱더 높아지고 있다""고 전했다. 자세한 사항은 먼슬리 자올 홈페이지 참조. ace@newsis.com<ⓒ 공감언론 뉴시스통신사. 무단전재-재배포 금지>",/news/news_read.nhn?article_id=0009785881&office_id=003&mode=search&query=카카오&page=2
"키움, 비대면 계좌 4만원 지급한투, '금융상품권' 10% 할인KB·신한금투, 수수료 면제","최근 주식 투자에 대한 관심이 폭발적으로 증가하는 가운데 첫 거래에 나서는 개인투자자를 일컫는 ‘주린이(주식과 어린이의 합성어)’를 유치하기 위해 증권사들이 치열한 경쟁을 펼치고 있다. 주식 투자에 눈을 뜬 2030세대가 증권사 신규 계좌 개설에 나서면서 증권사들은 신규 계좌 개설 시 현금을 지급하거나 거래 수수료를 면제하는 등 다양한 혜택을 제공하는 이벤트를 앞다퉈 진행 중이다.키움증권은 신규 비대면 계좌를 개설한 고객에게 현금을 증정하는 이벤트를 한다고 30일 밝혔다. 5월 28일까지 상장지수펀드(ETF)와 상장지수채권(ETN)을 포함한 국내 주식을 1만원 이상 거래한 고객에게 현금 1만원을, 100만원 이상 거래한 고객에게 추가로 3만원을 지급한다. 다른 증권사 주식을 키움증권으로 옮겨오거나 금 현물, 미국 주식을 처음 거래하는 경우에도 현금을 준다.한국투자증권은 주식, 펀드, 발행어음 등을 살 수 있는 온라인 금융상품권을 10% 할인 판매해 고객을 유치한다. 카카오톡 내 선물하기 메뉴에서 구매할 수 있으며 기간은 4월 15일까지다.KB증권과 신한금융투자는 6월 30일까지 신규 고객을 대상으로 국내 주식 위탁수수료를 평생 면제해주기로 했다. 유진투자증권은 온라인 신규 고객의 예수금을 따져 연 5% 이율로 현금을 환급해주는 이벤트를 마련했다.이 같은 이벤트 효과는 쏠쏠한 편이다. NH투자증권이 지난달 25일 카카오뱅크 앱을 통해 증권 계좌를 개설한 고객에게 평생 수수료를 면제해주고 개설 축하금 1만원을 지급하는 이벤트를 벌인 이후 약 한 달간 늘어난 계좌 수만 31만7000개에 달한 것으로 전해졌다.한경제 기자 hankyung@hankyung.com▶ ▶
 ▶
ⓒ 한국경제 & , 무단전재 및 재배포 금지",/news/news_read.nhn?article_id=0004315663&office_id=015&mode=search&query=카카오&page=1
"삼성전자·카카오·삼성바이오로직스삼성證, 국내 유망 주식 3개 꼽아""위기 이후 승자 독식 강화될 것""","코스피지수가 1700선까지 반등하자 증권사들이 코로나19 사태 이후 유망 종목을 전망하는 보고서를 속속 내놓고 있다. 코로나19 사태로 화두가 된 ‘비대면(언택트)’ 외에도 ‘초격차 기술력’과 ‘풍부한 현금’ 등이 증시를 주도할 핵심 키워드로 제시됐다.유승민 삼성증권 투자전략팀장은 30일 “위기 이후 승자 독식 현상이 더 강해질 가능성이 높기 때문에 탁월한 기술력과 경쟁력을 갖춘 글로벌 기업에 주목해야 한다”고 말했다. 불황을 잘 견디려면 부채가 적고 현금 보유가 많은 기업이 유리하다고도 했다. 이어 “비대면 환경에 탄력적으로 적응할 수 있는지도 중요하다”고 강조했다.삼성증권은 이런 기준에 따라 삼성전자, 카카오, 삼성바이오로직스를 코로나19 사태 이후 유망주로 꼽았다. 최근 일부 증권사가 반도체 최선호주를 삼성전자에서 SK하이닉스로 변경했지만 삼성증권은 기존 입장을 유지했다. 삼성전자가 초격차 기술력이 있는 데다 100조원이 넘는 현금을 보유하고 있다는 점을 이유로 들었다.카카오는 대장주 네이버를 제치고 관련 언택트 비즈니스와 관련해 가장 유망한 종목으로 꼽혔다. 카카오는 계열사가 90개에 달할 정도로 관련 사업을 적극 개척하고 있다. 바이오 분야에서는 삼성바이오로직스를 추천했다. 현재 영업이익은 셀트리온이 더 내지만 삼성바이오로직스가 하는 원료의약품 수탁생산(CMO) 사업이 유망하다는 이유에서다.하이투자증권은 삼성SDS에 관심을 가져야 한다는 보고서를 냈다. 클라우드 및 스마트팩토리 체제 구축 사업이 유망하다는 근거를 들었다. 이상헌 하이투자증권 연구원은 “코로나19 사태 이후에는 생산과 소비 측면에서 디지털 전환이 가속화할 전망”이라며 “기존 시스템을 클라우드 서비스에 연계하는 수요가 폭발적으로 증가할 것”이라고 분석했다.채상욱 하나금융투자 연구원은 “리츠(REITs·부동산투자회사) 가운데서도 비대면과 연관 있는 5세대(5G) 통신 인프라 시설, 데이터센터, 온라인 유통 관련 시설, 바이오산업 시설용 부동산에 투자하는 상품에 투자해야 한다”고 설명했다.양병훈 기자 hun@hankyung.com▶ ▶
 ▶
ⓒ 한국경제 & , 무단전재 및 재배포 금지",/news/news_read.nhn?article_id=0004315660&office_id=015&mode=search&query=카카오&page=1
코로나 등 대내외 불확실성 증가고금리 수신상품 찾기 힘들어져카뱅 1.45%보다 낮은곳 수두룩,"[서울경제] 통상 시중은행보다 두 배가량 높았던 저축은행의 예금 금리가 역마진 우려로 수개월째 급락하고 있다. 지난해부터 계속되고 있는 한국은행의 기준금리 인하로 저축은행들이 수신상품의 금리를 추가 조정하면서 1년짜리 정기예금 금리는 1%대 후반대까지 후퇴했다. 그럼에도 자금이 몰려들자 1%대 중반대 상품까지 등장하는 진풍경이 연출되고 있다. 이는 인터넷전문은행인 카카오뱅크나 케이뱅크금리보다 더 낮은 수준이다. 30일 금융권에 따르면 지난 24일 79개 저축은행의 12개월 만기 기준 평균 정기예금 금리는 1.88%를 기록했다. 올 들어 최저 수준이다. 타 업계보다 상대적으로 고금리 혜택을 제공했던 저축은행들의 정기예금 금리 하락세는 점점 빨라지고 있다. 이날 평균 정기예금 금리는 1.89%로 소폭 올랐지만 여전히 1.8%대를 유지하고 있다. 1년 전(2.62%)과 비교하면 무려 0.73%포인트 차이가 난다. 저축은행 평균 정기예금 금리는 지난해 11월 말 2.18%, 지난해 말 2.1%에서 올해 1월 1.97%로 떨어진 데 이어 2월 1.92%까지 낮아졌다. 일부 저축은행 상품의 정기예금 금리는 인터넷전문은행보다 낮았다. 대구에 위치한 A 저축은행은 23일 정기예금 상품 3종의 금리를 1.4%로 일괄 조정했다. 2월10일 해당 상품의 금리를 1.6%, 지난 8일 1.5%로 내린 지 2주 만에 수신금리를 또 추가 조정한 것이다. 현재 카카오뱅크와 케이뱅크의 12개월 기준 정기예금 금리는 1.45%로 이들 상품보다 높다. 일각에서는 저축은행들의 고금리 수신상품을 더 이상 찾아보기 힘들 것이라는 분석이 많다. 대내외 불확실성이 커지는데다 기준금리도 잇따라 낮아지면서 저축은행들도 예금 상품의 역마진을 신경 쓰고 있기 때문이다. 또 올해부터 강화된 신예대율 기준을 맞추기 위해 지난해부터 서둘러 예수금을 충분히 확보한 상태여서 굳이 자산 운용이 어려운 고금리 예금을 내놓을 가능성도 적어졌다. 저축은행 관계자는 “시중은행들이 0%대 정기예금을 내놓는 상황에서도 2% 중반대의 고금리 상품을 제공했던 저축은행들이 최근 신종 코로나바이러스 감염증(코로나19) 변수로 불확실성이 커지자 수신금리를 보수적으로 조정하고 있다”고 설명했다. /이지윤기자 lucy@sedaily.com저작권자 ⓒ 서울경제, 무단 전재 및 재배포 금지",/news/news_read.nhn?article_id=0003717075&office_id=011&mode=search&query=카카오&page=1
취임10돌 김정남 DB손보 사장신계약가치 중심 상품혁신 주문,"[서울경제] 올해로 취임 10돌을 맞은 김정남(사진)
사장이 ‘지속가능경영 구현’을 목표로 내세우고 하반기 재도약을 위한 수익구조 개혁에 속도를 내고 있다.30일 보험업계에 따르면 김 사장은 신종 코로나바이러스 감염증(코로나19) 사태에 따른 경영상황 점검을 위해 마련한 임원회의에서 “위기 국면일수록 지속가능경영의 기틀을 만드는 데 과감하게 투자해야 한다”며 “상반기 투자를 발판 삼아 하반기부터는 실적 반등의 커브를 만들어내자”고 당부했다.코로나19 사태로 신계약 영업이 빠르게 위축되고 있지만 연초 설정한 △신계약가치 중심의 상품 포트폴리오 혁신 △한계채널 정리 등 채널효율 개선 △사업비 효율화 등의 세부과제를 지속적으로 추진하자는 주문이다.지난해 업황 악화로 DB손보를 포함한 손보사들의 당기순이익이 평균 30% 이상 줄어든 가운데서도 김 사장은 채널 효율성 개선을 위한 인슈어테크 투자를 게을리하지 않았다. 전염병 확산에 취약한 콜센터 업무 환경이 문제가 됐을 당시 10년 전 김 사장 취임 직후 특허까지 취득한 ‘재택업무 비즈니스 모델’이 화제를 모은 게 단적인 예다. 특히 최근 2달간 상당수 보험사가 대면 서비스 운영에 어려움을 겪을 때도 DB손보는 영상통화 현장출동 및 피해물입회시스템 등을 잇따라 오픈하며 차별화에 성공했다. 업계 관계자는 “당장 수익을 내기 어려운 정보기술(IT) 투자는 단기 성과에 연연하지 않는 장수 최고경영자(CEO)만 할 수 있는 프로젝트”라며 “데이터3법 시행으로 올해부터 이종산업 간 경계가 빠르게 허물어질 것이라는 전망이 나오는 만큼 앞선 투자와 준비 수준에 따라 회사의 명운이 갈릴 것”이라고 내다봤다.현대차그룹·SK텔레콤·카카오·네이버 등의 보험업 진출이 가시화된데다 인공지능(AI)을 결합한 디지털 신기술이 보험업과 연계되며 영업 환경도 빠르게 변할 것으로 전망된다. 올 초 김 사장이 업무 자동화와 빅데이터 분석시스템 고도화, 인슈어테크 스타트업과의 오픈 이노베이션 내재화, 디지털 고객경험 혁신 등을 디지털 부문 주요 경영과제로 설정한 것도 이 때문이다.외형 확대가 아닌 손익 관리 중심의 경영 전략을 통해 중장기 수익구조 안정화에도 주력하고 있다. DB손보 관계자는 “올 들어 424만주 규모의 자사주 매입에 나선 것은 책임경영을 통한 주주가치 제고와 지속가능경영에 대한 자신감을 보여주는 것”이라며 “올해 조직 개편을 통해 장기상품리스크TF를 출범하는 등 손해율과 사업비를 집중 관리하고 있는 만큼 하반기부터 빠른 속도로 수익성도 회복할 것”이라고 전망했다./서은영기자 supia927@sedaily.com저작권자 ⓒ 서울경제, 무단 전재 및 재배포 금지",/news/news_read.nhn?article_id=0003717079&office_id=011&mode=search&query=카카오&page=1
,"[서울경제] 캐릭터빵의 명가 SPC삼립이 EBS의 인기 크리에이터 ‘펭수’를 모델로 한 ‘펭수 빵’ 5종을 출시하며 ‘제2의 국진이빵’ 탄생을 예고했다. SPC삼립은 1999년 ‘국찐이 빵’을 출시하여 캐릭터 빵 열풍을 일으켰고 포켓몬스터, 케로로, 원피스, 카카오프렌즈, 오버액션토끼 등을 적용한 캐릭터 빵을 지속적으로 선보여 왔다펭수 빵은 유튜브 채널 ‘자이언트 펭TV’의 펭수 유행어인 ‘대빵’을 콘셉트로 한 빅(big) 사이즈의 제품이다.부드러운 우유시트에 달콤한 연유크림이 넣은 ‘러블리 우유롤롤’, 겹겹이 쌓아올린 페스트리와 설탕 시럽이 조화로운 ‘스위뜨 페스츄리’, 꽈배기 도넛에 초콜릿과 초코크런키를 올린 ‘엣헴엣헴 초코꽈배기’, 부드러운 식빵안 고소한 땅콩크림을 듬뿍 넣은 ‘터질듯한 땅콩미니샌드’, 새콤달콤한 피자소스에 소시지를 가득 토핑한 ‘하이!하이!피자빵’ 등이다. 3월 중으로 냉장디저트 2종도 추가로 출시될 예정이다. 제품 안에는 ‘펭수’의 명언과 이미지를 담은 ‘펭수 띠부띠부씰(띠고 붙이고 띠고 붙이는 스티커)’ 71종 중 하나가 들어 있어 재미를 더했다.
‘펭수 띠부띠부씰’은 명언 씰 23종과 3월 중 적용 예정인 일러스트 씰 48종으로 구성되어 있다.SPC삼립은 ‘펭수 빵’ 출시를 기념해 오는 5월까지 총 네 번의 ‘펭수 띠부띠부씰 인증샷 이벤트’를 진행해 추첨을 통해 한정판 ‘대빵 큰 펭수 띠부띠부씰’과 ‘펭수 띠부씰 북’ 등을 증정한다. SPC삼립 마케팅 관계자는 “인기 크리에이터로 떠오른 ‘펭수’와의 협업을 통해 소비자들에게 재미와 즐거움을 줄 것”이라며, “앞으로도 ‘펭수’를 활용한 다양한 제품과 프로모션을 선보일 예정이다”라고 말했다./박형윤기자 manis@sedaily.com저작권자 ⓒ 서울경제, 무단 전재 및 재배포 금지",/news/news_read.nhn?article_id=0003717087&office_id=011&mode=search&query=카카오&page=1
,"신종 코로나바이러스 감염증(코로나19) 사태로 인해, 서울 소비자들이 체감하는 경기가 급격히 얼어붙었다. 서울시 시정연구기관인 서울연구원이 지난달 말 조사해 23일 발표한 보고서에 따르면, 소비자태도지수는 일사분기 82.8로 전분기 대비 10.5가 하락한 수치다.소비자태도지수는 서울 소비자들이 체감하는 현재 경기 상황으로 100을 넘으면 긍정적 경제 전망, 100보다 낮으면 부정적 경제 전망을 뜻한다.강동완 기자 enterfn@mt.co.kr
<저작권자 ⓒ '성공을 꿈꾸는 사람들의 경제 뉴스' 머니S, 무단전재 및 재배포 금지>",/news/news_read.nhn?article_id=0000524511&office_id=417&mode=search&query=카카오&page=1
지점장·부장 등 10~20억원성과급 힘입어 고액연봉 대열'라임 연루' 임 前본부장도 15억,"[서울경제] 지난해 사상 최대의 실적을 낸 증권업계에서는 거액의 인센티브를 받아 최고경영자(CEO)를 뛰어넘는 초고액 연봉을 받은 임직원들이 속속 등장했다.

31일 금융감독원 전자공시시스템에 따르면 최모 한화투자증권 사업부장은 지난해 총 13억5,900만원을 보수로 받았다. 이는 권희백 한화투자증권 대표의 보수(5억2,900만원)보다 두 배 이상 많은 것이다. 김모 한화투자증권 팀장도 총 5억8,100만원을 받아 권 대표를 앞질렀다. 직원이 ‘사장님’보다 더 많은 돈을 벌 수 있었던 것은 성과급 때문이다. 권 대표의 급여는 총 5억1,800만원으로 최 부장(2억1,500만원)이나 김 팀장(1억원)보다 많다. 그러나 최 부장은 상여금으로 총 11억4,100만원을 받았고 김 팀장도 4억7,800만원을 상여금으로 수령했다.신한금융투자에서는 라임자산운용 무역금융펀드 사태로 구속된 임모 전 신한금융투자 프라임브로커리지서비스(PBS)본부장이 총 15억4,100만원을 벌어들이며 사내 연봉 1위를 기록했다. 이는 최근 사의를 표한 김병철 전 대표이사의 연봉(6억8,400만원)은 물론 최석종 KTB투자증권 사장(14억2,200만원) 등 여타 증권사 CEO보다도 높은 액수다. 심지어는 모(母)회사인 신한금융지주의 조용병 회장(12억6,000만원)보다 더 많은 돈을 손에 쥐었다. 상여금으로 총 11억2,600만원을 받은 영향이 컸다. 임 전 본부장은 지난 27일 펀드 가입자들을 속여 480억원을 편취한 혐의 등으로 구속됐다.유진투자증권에서는 김철은 부사장이 총 18억9,700만원을 벌어들이며 유창수 대표(20억5,000만원)와 비슷한 연봉을 받았다. 기본 급여는 1억7,000만원이지만 투자은행(IB)본부 총괄 임원으로 근무하면서 성과급으로 총 17억2,700만원을 챙겼다. 삼성증권에서도 강모 영업지점장이 20억2,100만원을 벌어들이며 같은 회사 장석훈 대표(13억7,400만원)보다 더 많은 봉급을 받았다.증권사 자산총액 1위 업체인 미래에셋대우에서는 김연추 에쿼티파생본부장(상무보)이 16억5,800만원을 벌어들였다. 김 상무보는 2018년까지 한국투자증권에서 금융공학부 차장으로 일했는데 당해 상반기에만 오너인 김남구 회장(13억1,100만원)보다 더 많은 보수(22억3,000만원)를 받아 화제를 모았다. 김 상무보는 급여로만 16억5,700만원을 받았으며 추가 성과급은 받지 못했다. 미래에셋대우에서는 최현만 수석부회장이 총 28억9,200만원을 벌며 사내 1위에 올랐다. 한국금융지주에서는 올해 초 카카오페이증권으로 자리를 옮긴 김주원 전 부회장이 가장 많은 보수를 받았다. 김 전 부회장은 지난해 퇴직금 43억553만원을 포함해 총 54억4,681만원을 수령했다. 퇴직금을 제외하더라도 김남구 회장(5억9,000만여원)보다 더 많은 연봉을 받는 셈이다.
교보증권에서도 임직원들이 CEO보다 보수를 많이 받았다. 김해준 교보증권 대표이사는 지난해 11억2,459만원을 수령했지만 이이남 DCM본부장은 13억6,534만원, 임정규 구조화투자금융부문장은 11억8,237만원 등으로 김 대표보다 연봉이 높았다./심우일·이승배기자 vita@sedaily.com저작권자 ⓒ 서울경제, 무단 전재 및 재배포 금지",/news/news_read.nhn?article_id=0003717130&office_id=011&mode=search&query=카카오&page=1
,"카카오는 2019년 연결기준으로 매출액 3조 701억원, 영업이익 2068억원, 당기순손실 3419억원을 기록했다고 3월 30일 발표했다. 2018년 대비 매출액은 6531억원 증가, 영업이익은 1339억원 증가, 당기순이익은 3578억원 감소했다.2019년 영업이익률은 6.74%로 나타났으며, 2018년 영업이익률 3.02%보다 3.72%p 증가했다. 2019년 부채비율은 52.21%로 2018년 부채비율 41.45%보다 10.76%p 증가했다.한편, 카카오는 장 마감 이후 해당 기업공시를 발표했으며 오늘 종가가 153,000원, 거래량은 631,883주로, 직전 거래일 대비 500원(+0.33%) 상승했다.공시 전문으로 이동스톡봇 기자※ 이 기사는 국민일보와 엠로보가 개발한 증권뉴스 전용 인공지능 로봇 ‘스톡봇’이 금융감독원 전자공시시스템(DART)과 한국거래소(KRX) 데이터를 토대로 작성한 것입니다. 지속적인 업그레이드를 통해 더욱 풍부하고 정확한 내용을 담아 가겠습니다.GoodNews paper ⓒ , 무단전재 및 재배포금지",/news/news_read.nhn?article_id=0001305810&office_id=005&mode=search&query=카카오&page=1
