head,text,url
,"최근 연임에 성공한 한성숙 네이버 대표와 여민수·조수용 카카오 대표가 '금융, 인공지능(AI), 글로벌'을 2기 경영 화두로 꼽았다.포털과 메신저를 넘어 금융, 물류, 쇼핑, 인공지능(AI), 콘텐츠, 클라우드 등 사실상 인터넷이 관여하는 전 영역으로 사업을 확장한다.네이버는 지난해 네이버파이낸셜을 분사시키며 금융시장 공략을 시작했다. 미래에셋과 협력한다. 네이버페이를 중심으로 연내 증권, 보험 등 금융서비스를 내놓을 방침이다. 올해 네이버통장도 개설, 금융서비스와 연결한다. 네이버 이용자가 네이버통장을 통해 증권, 보험 등에 가입할 수 있게 하는 것이다.네이버 금융서비스 핵심 축인 네이버페이는 쇼핑과도 밀접하다. 네이버는 스마트스토어 등 자체 쇼핑 플랫폼을 확장했다. 중소상공인 위주인 스마트스토어를 지원하기 위해 풀필먼트(물류) 업체에 연달아 투자했다. 스마트스토어 입점사는 상품만 있으면 결제·물류를 네이버에서 한꺼번에 해결할 수 있을 전망이다.AI는 네이버가 글로벌 무대로 나아가는 첨병 역할을 수행한다. 네이버는 지난해 아시아와 유럽을 잇는 AI연구벨트 구상을 발표했다. 프랑스, 한국, 일본, 베트남이 거점이다.AI벨트는 코로나19로 세계 전역에서 비대면 문화가 확산되는 만큼 새로운 사업 기회를 잡을 것으로 보인다. 네이버는 3월부터 경기도 성남시 등 국내 지방자치단체에 AI케어콜 등 능동감시 체계를 구축했다. 연구개발(R&D)과 실증사업을 동시에 진행한다. 한 대표는 29일 “전대미문의 글로벌 위기를 맞아 인터넷 플랫폼 서비스의 중요성은 그 어느 때보다 커 보인다”면서 “그동안 축적해 온 기술과 플랫폼 역량을 기반으로 사회가 요구하는 시대 역할에 성실히 임하면서 새로운 혁신을 통해 글로벌 경쟁에서 성장을 이루겠다”고 각오를 밝혔다.카카오 역시 여민수·조수용 대표 체제를 재신임했다. 카카오는 올해 카카오톡 10주년을 맞았다. 김범수 카카오 의장은 “카카오 시즌2를 준비해야 한다”고 말했다. 카카오는 이번 주총에서 1990년생인 박새롬 사외이사(성신여대 융합보안공학과 조교수)를 선임하며 파격을 예고했다.카카오는 지난해 카카오톡 안에 광고를 노출하는 톡보드를 선보이며 최대 약점으로 지목돼 온 영업이익을 끌어올렸다. 금융은 인터넷은행 1위 카카오뱅크를 앞세워 진격에 나섰다. 예·적금, 대출, 증권 등 사실상 종합금융사로 거듭났다.기업간거래(B2B) 사업을 담당하는 카카오엔터프라이즈는 카카오의 신사업과 글로벌 진출에 앞장선다. 지난해 말에 출범한 카카오엔터프라이즈는 현대차, LG전자 등 글로벌 기업과 연달아 파트너십을 체결했다. 이들 기업의 AI, 디지털 사업을 돕는 과정에서 자연스럽게 글로벌로 나갈 것으로 기대된다.카카오 엔터테인먼트 사업도 주목된다. 카카오는 자회사 카카오페이지·카카오M을 통해 만화, 드라마 등 콘텐츠 사업을 진행하고 있다. 픽코마를 통해 일본에서 성공 가능성을 입증했다.카카오는 올해 중 카카오톡 안에 별도의 동영상 서비스를 추가할 계획인 것으로 알려졌다. 한국판 '넷플릭스' '디즈니'에 도전하는 셈이다.여민수 대표는 “새로운 10년을 위해 도약하는 길목에서 일상의 불편함을 해소하고 쉼 없이 혁신과 진화를 이끌어 가는 것이 미션”이라고 역설했다. 조수용 대표는 “사람, 기술을 통해 더 나은 세상을 만드는데 카카오가 일조할 수 있도록 고민할 것”이라고 말했다.김시소기자 siso@etnews.com",/news/news_read.nhn?article_id=0002875029&office_id=030&mode=search&query=카카오&page=2
,"[서울=뉴시스] 김제이 기자 = '동학개미운동'이라는 키워드가 최근 온라인 커뮤니티를 뜨겁게 달구고 있다. 코로나19로 인한 증시 하락세가 거세지자 이를 투자의 기회로 삼고 주식에 입문하는 젊은 세대가 늘어났기 때문이다.동학개미운동은 신종 코로나 바이러 감염증(코로나19)이 장기화 되면서 주식시장에 등장한 신조어다. 이는 코로나19로 증시 폭락이 거듭되는 가운데 개인 투자자들의 대규모 매수세와 외국인 투자자들의 대규모 매도세가 맞물리는 상황을 1894년에 일어난 동학농민운동에 빗댄 것이다.20·30대 청년층들은 주로 온라인에서 주식 정보를 공유하면서 여느 때보다 주식 투자에 높은 관심을 보이고 있다. 포털 사이트 네이버 카페 서비스에서 이달 1일부터 27일 동안 '주식'이 포함된 게시글은 11만1290건으로 집계됐다. 지난해 같은 기간(3만8267건)과 비교 시 65.6% 대폭 증가했다. 20·30대 젊은 직장인들이 이용하는 직장인 익명 커뮤니티 애플리케이션 '블라인드'에서도 재테크 게시판에 주식 관련 글이 최근 눈에 띄게 증가했다.이들은 종목에 대한 이야기뿐 아니라 국내 증시 전망에 대한 질문뿐 아니라 국제유가와 미국 선물 지수, '공포지수'로 대변되는 코스피 변동성지수(VKOSPI), 환율, 투자자별 매매 추이 등 다양한 지표를 가지고 주식에 대해 토론하며 정보를 공유하고 있었다.최근 두 번째 직장에 입사한 배모(28)씨도 이런 분위기에 공감했다. 그는 ""최근에 친구들과 대화를 하면 무조건 주식 얘기가 빠지지 않는다""라면서 ""돈을 모으고는 싶은데 은행 금리는 너무 낮아 생각도 못하다가 최근 증시가 많이 떨어져서 장기 투자처로 생각하고 주식 투자를 하게 됐다""고 말했다. 배씨는 이전 직장의 퇴직금을 이용해 삼성전자의 주식을 사들였다.기존 증권사뿐 아니라 카카오도 증권 사업에 뛰어들면서 비대면 계좌 개설이 쉬워진 것도 젊은층의 '주린이'('주식'과 '어린이'의 합성어로 주식 초보자, 입문자를 뜻한다) 입성에 힘을 보탰다.실제로 3월 들어 지난 27일까지 코스피 기준으로 개인 투자자들은 8조8281억원을 순매수했다. 반면 외국인들은 10조949억원을 순매도했다. 이렇듯 개인들의 매수세가 급증하면서 거래량뿐 아니라 계좌개설도 대폭 늘어났다.지난 27일 기준 금융투자협회에 따르면 주식활동 거래 계좌 수는 총 3059만3754개로 집계됐다. 이달 들어 26일까지 주식거래활동 계좌 숫자는 72만7153개가 증가했다.기성세대가 높은 금리와 부동산 투자로만 재산 증식의 기회를 가졌다면 그들의 자녀인 2030세대들은 높아져 버린 부동산가격과 제로에 가까운 금리로 인해 마땅한 투자처를 찾지 못하고 있었다. 이후 2018년 비트코인을 비롯한 암호화폐 투자 붐이 일어나면서 재테크에 관심을 가졌던 이들이 폭락장으로 계기로 코인보다 안전하고 장래성 있는 주식투자에 관심을 두게 된 것이다.증권업계 관계자 강모(26)씨는 ""요즘 들어 주변 지인들에게 삼성전자 주식을 사도 되냐는 질문을 많이 받고 있다""며 ""중장년층보다 종잣돈이 적은 또래 세대들이 암호화폐보다 안전하고 은행 예금보다 기대 이율이 높은 주식에 많은 관심을 보이는 것 같다""고 말했다.사회 초년생 천모(27)씨는 ""예전부터 주식에 관심은 조금 있어서 삼성전자와 코스피, 코스닥 상장지수펀드(ETF)를 소액을 투자했었는데, 이번 코로나19 사태 초반에 투자 규모를 6배 정도 늘렸다""며 ""다만, 변동성이 워낙 크다 보니 자주 주식 시세를 확인하며 수익률을 점검하고 있다""고 말했다. jey@newsis.com<ⓒ 공감언론 뉴시스통신사. 무단전재-재배포 금지>",/news/news_read.nhn?article_id=0009782791&office_id=003&mode=search&query=카카오&page=2
,"[머니투데이 강상규 소장] [편집자주] 투자자들의 비이성적 행태를 알면 초과수익을 얻을 수 있다고 합니다.[[행동재무학]<301>금리인하, 양적양화(QE)로 정말로 시중에 돈이 넘쳐날까?] 코로나19 사태 장기화로 경기침체 우려가 커지자 한국은행은 지난 16일 임시 회의를 열어 기준금리를 0.75%로 낮췄다. 이로써 사상 첫 0%대 기준금리 시대가 도래했다. 여기에 정부는 19일 1차 비상경제회의에서 코로나19 피해가 심한 중소기업, 소상공인과 자영업자에게 1.5% 수준의 초저금리로 긴급경영자금 12조원을 공급하는 지원책을 내놨고, 24일 2차 비상경제회의에서 그 규모를 2배로 늘렸다. 이로써 1%대 초저금리 신규 대출 24조원이 시중에 풀리게 됐다.그리고 26일 한국은행은 코로나19 확산에 따른 금융시장 불안을 해소하기 위해 3개월간 금융회사에 유동성을 무제한 공급한다고 발표했다. 한은은 매주 RP(환매조건부채권) 매입(91일 만기)을 통해 입찰금리 0.85%(기준금리+10bp) 상한으로 금융기관이 필요한 유동성 수요 전액을 제한없이 공급할 방침이다. 한국판 양적완화(QE)다. 나아가 RP매매 대상증권에 한국전력 등 8개 공기업 특수채를 추가하고 공개시장운영 대상기관에 11개 증권사를 추가했다. 한마디로 한은이 국내 주요 금융기관에 모두 무제한으로 돈을 풀겠다는 것이다.또한 현재 정치권과 여러 지자체들이 앞다퉈 코로나19 사태에 따른 생계지원 명목으로 국민들에게 선별적 혹은 전면적인 긴급재난지원금을 지급하는 것을 추진 중이다. 만약 재난수당이 전 국민에게 지급된다면 최대 50조원의 현금이 시중에 풀리게 된다. 재난기본소득은 대출이 아니기에 상환의무가 없다.기준금리는 0%대로 낮아져 초저금리시대에 접어들었고, 정부는 1% 초저금리 신규 대출 24조원을 시중에 풀겠다고 하고, 한국은행은 국내 주요 금융기관에 무제한으로 유동성을 공급하겠다고 한다. 게다가 최소 10조원 이상의 재난기본소득이 빠른 시일 내에 지급될 가능성이 높다.위에서 말한 게 모두 실현된다면 조만간 시중에 돈이 넘쳐날 게 틀림없다. 역사상 한 번도 보지 못한 규모의 돈이 말이다. 그런데 과연 그럴까?한은이 기준금리를 역대 최저 수준인 0%대로 낮춰 돈을 무제한 공급해도 시중은행이 그 돈을 쓰지 않으면 돈은 돌지 않는다. 한은이 유동성을 아무리 풍부하게 공급해도 실제로 대출 리스크를 짊어지는 은행 등 민간 금융기관이 가계와 기업 등 실물부문에 자금공급을 원활하게 하지 않으면 실물경제에서의 소위 돈맥경화 현상은 해소되지 않는다. 실물경제는 완전 별개다.한은이 무제한 RP 매입을 통해 금융기관이 필요한 유동성 수요 전액을 제한없이 공급하면, ELS(주가연계증권), PF(프로젝트파이낸싱) 지급보증 문제가 터져 유동성 부족 문제를 겪고 있는 증권사는 도움이 되겠지만 은행은 달라지는 게 없다. 애초 은행은 유동성 문제가 없기 때문이다. 오히려 은행은 코로나19 사태로 부도위험이 높다고 생각하면 대출을 늘리지 않고 늘어난 유동성을 그대로 초과지준으로 넣어버릴 수 있다. 그렇게 되면 돈은 실물부문으로 흘러가지 않고 은행에 그대로 쌓이게 된다. 결국 한은이 기준금리를 낮추고 민간 금융기관을 통해 유동성을 무제한 공급하려 해도 이는 금융기관을 대상으로 한 유동성 공급에 그칠 뿐 가계와 기업 등 실물부문에 대한 자금공급으로 이어지지 않을 우려가 높다. 실제로 코로나19로 부도위험이 높아진 상황에서 민간 금융기관 창구에서 리스크를 책임지고 선뜻 자금을 빌려주기가 어려울 게 불을 보듯 뻔하다.실제로 직장인이 주로 이용하는 시중은행 신용대출 금리는 한은이 기준금리를 0%대로 낮춘 이후에 하락하기는커녕 오히려 오름세로 돌아섰다. 신용대출 금리가 오르면 직장인들의 대출 수요는 자연스레 억제될 수밖에 없다.하나은행의 신용대출 상품 ‘하나원큐신용대출’은 한은이 기준금리를 0.75%로 내리기 전인 16일 최저금리가 연 2.688%였으나 2주일이 지난 27일 현재 연 2.720%로 0.032%포인트 올랐다. 이는 지난달 27일 신용대출 금리 2.566%보다 0.154%포인트나 높은 수준이다. 하나은행의 신용대출 금리는 한은의 기준금리 인하 직후 소폭 내림세를 보이다가 차츰 오름세로 전환됐다.인터넷은행인 카카오뱅크의 신용대출 금리도 하나은행 신용대출과 비슷한 추이를 보이고 있다. 카뱅의 신용대출 최저금리는 27일 현재 연 2.66%로 한은의 기준금리 인하 직전 연 2.63%보다 높다. KB국민은행의 신용대출 상품 ‘KB Star 신용대출’은 한은의 금리인하 이후에도 최저금리가 2.74%(기준금리 금융채 12개월 기준)으로 불변이다.시중은행의 신용대출 금리가 한은의 역사적인 기준금리 인하 발표 이후에도 하락하기는커녕 오히려 오르는 현상만 놓고 봐도 과연 민간 금융기관이 시중에 자금공급을 원활히 할지 의문이 들게 만든다. 우리나라 국민 가운데 대출리스크가 가장 낮은 직장인한테도 대출금리를 올려 대출수요를 억제하는 판에 다른 직종은 더 말할 필요가 없다.그럼 아파트 담보대출은 어떨까? 아파트 담보대출은 이미 강도 높은 대출규제로 꽁꽁 묶여 있는 상태다. 최대 한도가 1억원으로 제한돼 있는데다 사용처도 생활자금으로 국한돼 있다. 아파트 담보대출을 받을 때 사용처에 대한 서약서를 써야 한다. 금리인하와 유동성 무제한 공급 이후에 아파트 담보대출이 늘어나기를 바라는 것은 언강생심이다.물론 한은이 기준금리를 인하해도 신규 대출금리가 따라서 곧장 내리지는 않는다. 먼저 대출 기준금리가 단기냐 장기냐에 따라 한은의 기준금리 조정의 영향이 달라진다. CD 금리와 같은 단기 시장금리는 한은의 기준금리 조정 영향을 많이 받는 편이지만, 중장기 시장금리(금융채 3년물, 5년물 금리 등)는 경기동향, 향후 물가전망 등 다양한 외적 요인의 영향도 있기 때문에 한은의 기준금리 조정 영향이 상대적으로 적다.또한 한은의 기준금리 조정이 대출 기준금리의 변동에 반영되는 시차에도 차이가 있다. 일 단위로 고시되는 CD 금리 또는 금융채 금리 등에는 한은 기준금리 변동이 비교적 신속히 반영되지만, 주간 혹은 월간 단위로 고시되는 COFIX 등에는 한은 기준금리 변동이 반영되는데 한 달 이상의 기간이 소요될 수 있다. 게다가 잔액기준 COFIX의 경우 시장금리에 비해 변동성이 낮은 특성이 있어 한은 기준금리가 변동하더라도 이 효과가 충분히 반영되는 데는 더욱 긴 시간이 소요될 수 있다.현재 국내 시중은행의 대출금리는 상당부분이 금융채 금리, COFIX 등의 시장금리에 연동해 산정되는데, 3~6개월의 금리산정주기가 도래하면 기준금리 및 시장금리 변동에 따라 대출금리에 반영된다. 따라서 기준금리 인하분이 대출금리에 반영되기까지 일정기간 시차가 발생한다.그렇다면 이러한 점을 십분 감안해서 한 달 정도 지난 후에는 시중에 돈이 넘쳐나는 걸 기대해도 될까? 과거 사례를 보면 여전히 회의적이다.지난 2008~2009년 미국 서브프라임 모기지 사태가 발생해 글로벌 금융위기가 닥쳤을 때 미국 중앙은행인 연방준비제도(연준)는 기준금리를 제로금리로 떨어뜨리고 대규모 양적완화(QE) 조치를 시행했다. 이 덕택에 유동성 부족에 몰렸던 미국 금융기관들은 파산위기에서 벗어날 수 있었다. 나중에야 깨닫게 됐지만 미국 연준의 기준금리 인하와 과감한 양적완화(QE) 조치는 월가의 금융기관을 위한 구제책에 그치고 말았다. 가계나 기업 등 메인스트리트 구제책으로 이어지지 않았다는 비판이 아직도 거세다.결국 코로나19 피해 대책으로 한은이 기준금리를 0%대로 낮추고 금융기관에 대해 무제한 유동성을 공급한다고 해도 앞으로 시중에 돈이 넘쳐날 것으로 기대하는 건 착각이다. 시중에 돈이 넘쳐나기보다 단기자금 경색이 빈번해지는 등 돈맥경화가 심해질 이유가 더 많다. 당장 91일 만기 CP 금리는 27일 현재 2.05%까지 급등했다. 3개월 물 CP 금리가 2%를 넘기는 2015년 3월 이후 5년 만에 처음이다. 유동성 증가는 ‘개뿔’이다.다만 민간 금융기관을 거치지 않고 국민에게 직접 지급되는 재난기본소득은 시중에 곧바로 돈이 돌게 할 수 있어 단기자금 경색이 약간은 해소될 수 있다. 4월부터 도민 1인당 10만원의 재난기본소득 지급을 발표한 이재명 경기도지사는 26일 밤 ‘재난기본소득 경제침체 위기 극복 방안’을 주제로 진행된 MBC 100분토론에 참석해 ""정책을 집중할 방향은 (시중에) 돈을 돌게 하는 것""이라고 강력하게 주장했다. 이 지사의 말대로 지금은 시중에 돈이 실질적으로 돌 수 있도록 해야 한다.강상규 소장 mtsqkang33@
<저작권자 ⓒ '돈이 보이는 리얼타임 뉴스' 머니투데이, 무단전재 및 재배포 금지>",/news/news_read.nhn?article_id=0004384995&office_id=008&mode=search&query=카카오&page=1
,"정부가 소상공인을 위한 대책을 잇달아 내놓고 있지만, 현장의 긴박함을 따라가지 못하는 형국이다. 그만큼 신종 코로나바이러스 감염증(코로나19)으로 인한 소상공인·자영업자의 어려움 해소가 쉽지 않다는 방증이다.


 기획재정부·중소벤처기업부 등은 27일 소상공인 금융지원 신속집행 방안을 발표했다. 대출 병목현상 해갈을 위해 소상공인진흥기금을 통한 1000만원 대출은 출생연도에 따라 '홀짝제'로 운영한다는 게 골자다. 홀수 날짜(1·3·5·7·9)는 생년 홀수, 짝수 날짜(2·4·6·8·0)는 짝수인 사람이 신청하는 방식이다.


소상공인 단체는 일단 환영 의사를 밝혔다. 소상공인연합회는 ""병목현상 해결에 도움이 될 것으로 보인다""며 ""더불어 긴급구호 생계비 등 지자체별 직접지원 확대와 세제 감면 조치 등도 뒤따르기를 기대한다""고 밝혔다.



 반면 현장에선 ""아직도 대출은 먼 길""이라는 반응이다. 서울 중구에서 한식당을 운영하는 김형순 씨는 ""오전에 종로 소상공인센터에 갔더니 (사람이 밀려) 오후에 다시 오라고 하더라. 일해야 하는데 대출 신청에 하루가 다 가버렸다""며 ""동사무소에서 (대출) 일을 볼 수 있으면 좋겠다""고 말했다. 김 씨는 당장 이번 달 내야 할 월세가 가장 큰 걱정이라고 했다. ""착한 임대인(건물주의 자발적 임대료 인하) 운동이 절실하다. 전기세·도시가스비도 내려줬으면 좋겠다""고 했다.


 엄해성 소상공인연합회 서울 동작구 지회장은 ""시중 은행 창구에서도 대출이 가능하다니 기대가 되지만, 기다리는 사람이 워낙 많아 병목 현상이 얼마나 풀릴지는 의문""이라며 ""정부에서 정책을 쏟아내다 보니 제대로 아는 사람이 많지 않다. 지원 정책에 대한 자세한 설명도 필요하다""고 말했다.


대출 지원 창구를 현장으로 옮겨달라는 목소리는 시장 상인을 중심으로 나오고 있다. 이충환 수원 못골시장상인회장은 ""하루 벌어 하루 먹고 사는 사람들이라 오전 6시에 갔다가 줄만 서고 서류신청도 못 한 채 다시 장사하러 오는 사람이 많다""며 ""밀집한 상가나 시장의 경우 현장에 임시 (대출) 센터를 마련해주면 좋겠다""고 말했다. 이 회장은 ""당장 돈이 급한 상인은 대부업 대출을 쓰는 경우가 생기고 있다. 이자가 일수만큼 높지만, 신청하면 바로 나오기 때문""이라고 덧붙였다.


 중소벤처기업부 등도 급한 불을 끄기 위해 다양한 정책 대안을 마련 중이다. 중기부 산하 각 지방청 소속의 세무사·경영지도사 등 대출 업무 전문가를 현장에 파견해 서류 준비를 돕는 방안도 검토 중이다.


 김중현 중기부 대변인은 ""소상공인들은 대부분 비대면·비접촉 등 온라인을 통한 금융 수단에 익숙지 않은 사람이 많다. 오프라인 대출을 강화를 해 나갈 것""이라고 말했다.



또 서류를 현장에서 바로 발급받을 수 있도록 무인 민원서류 발급기를 도입할 계획이다. 김 대변인은 “적은 인원으로 장사를 하시는 분들은 대출 절차를 위해 오랜 시간 자리를 비우는 것이 문제""라며 ""유선 전화는 물론 카카오 친구 맺기 등을 통한 예약 상담 등을 통해 소상공인분들이 최대한 빠르게 접수와 신청을 마치고 생업으로 돌아가실 수 있게 할 것""이라고 강조했다.


고질점으로 지적된 제출서류 간소화도 추진한다. 사업자등록증명ㆍ임대차계약서ㆍ통장사본 서류만 준비하도록 했다.



중기부 조사에 따르면 지금까지의 소상공인 대출 신청 병목 현상은 소상공인진흥공단 62개 센터에 대출이 집중됐기 때문이었다. 하준경 한양대 경제학부 교수는 ""당장 생계가 어렵지 않은데도 긴급 대출을 받으려는 사람까지 몰리면서 꼭 필요한 사람의 대출까지 밀렸다""며 ""일단 시장 금리로 대출해준 뒤 나중에 조건에 맞는 소상공인은 1.5% 저금리 대출로 전환하는 '선 대출, 후 심사' 형태도 고려해야 한다""고 말했다.


김영주·이소아·강기헌 기자 humanest@joongang.co.kr
 ▶ ▶
/ ⓒ중앙일보(https://joongang.co.kr), 무단 전재 및 재배포 금지",/news/news_read.nhn?article_id=0002988279&office_id=025&mode=search&query=카카오&page=1
