head,text,url
"""정책 테마주부터 포스트 코로나까지 대비 해야""","[더팩트ㅣ박경현 기자] 정부가 발표한 '한국판 뉴딜' 정책으로 5G(5세대) 이동통신, 데이터, AI(인공지능) 등과 관련된 테마주가 시장 내 급부상하고 있다. 시장에서는 향후 수혜주들이 얼마나 장기적으로 상승세를 유지할지에 관심이 쏠리고 있다.정부는 '한국판 뉴딜' 정책의 밑그림을 지난 7일 내놨다. 정부는 빅데이터 수집과 활용 인프라를 강화하고 5G 통신의 전국망을 조기 구축한다는 계획이다. 또한 AI 인프라 확충 및 융합확산 등 '디지털 인프라 구축'에 속도를 내겠다는 내용이 골자다.주식시장에서 곧바로 반응이 나타났다. 한국거래소에 따르면 정부의 한국판 뉴딜 정책관련 발표 후인 7일과 8일에 5G 이동통신, 데이터, AI 관련주 주가가 뛰었다.5G관련주 중에서도 5G 장비·부품 대장주로 꼽히는 케이엠더블유는 이날 정책발표 전날인 6일대비 1.65% 오른 6만1700원에 장을 마감했다. 8일 역시 상승을 지속해 1.62% 올랐다. 에이스테크는 7일과 8일 각각 전일대비 0.24%, 4.46%씩 올랐고, RFHIC는 이틀 동안 0.91%, 1.03% 올랐다.AI관련주인 미래컴퍼니는 정책발표 당일에 전날보다 11.56% 급등한 3만400원까지 올랐다. 가온미디어는 이날 전일 보다 5.22% 상승한 6250원이었다.'개인 데이터를 모아 활용 한다'는 의미의 마이데이터 산업 관련주 역시 주목 받았다. 마이데이터산업 관련주 수혜기업으로 꼽힌 카카오는 7일 3.26% 상승한 20만6000원에 마감했다. 또한 8일 역시 20만9500원까지 주가가 상승해 52주 신고가를 경신했다. NICE평가정보는 이틀 동안 각각 2.33%, 3.98% 상승했다.이같은 정책 테마주들의 상승은 지난 7일 코스피시장의 약세 속에도 코스닥지수 견인 역할을 톡톡히 했다. 이날 글로벌 경기침체 가능성과 미중 무역갈등 여파로 코스피지수가 하락세를 탔지만 코스닥은 정책 기대감을 얻은 관련주 덕에 외인과 기관 매수세가 유입됐다.업계 전문가들은 이번에 주목받은 정책 테마주들의 상승이 당분간은 지속 될 것이라고 내다보고 있다.이상헌 하이투자증권 연구원은 ""한국판 뉴딜은 포스트 코로나 시대 대비 정책과 경제회복을 위한 정책으로 구별될 것""이라며 ""포스트 코로나 시대에 대비하기 위한 정책으로 비대면 산업 인프라 육성, 디지털 기반 대형 IT 프로젝트 추진이, 경제 회복을 위한 정책으로는 디지털 뉴딜의 연장선상에 있는 스마트시티, 기존 SOC(사회간접자본) 사업에 디지털을 적용하는 프로젝트를 추진할 것""이라고 전망했다.이어 ""코로나19로 인한 변화들이 단기로 끝나는 것이 아니라 라이프 스타일 변화로 지속될 것으로 예상됨에 따라 포스트 코로나 시대에 관련된 종목들의 성장성 역시 향후에도 부각될 수 있을 것""이라고 예상했다.pkh@tf.co.kr저작권자 ⓒ 특종에 강한 더팩트 & tf.co.kr 무단 전재 및 재배포 금지",/news/news_read.nhn?article_id=0000025247&office_id=629&mode=search&query=카카오&page=6
,"코로나19 재확산 조짐에 당초 오늘(11일)부터 정상 출근 체제로 전환하려던 네이버와 카카오의 계획에 차질이 생겼습니다.네이버 관계자는 주 2회 회사로 출근하는 현재의 전환근무 체제를 당분간 연장하기로 했다고 밝혔습니다.네이버는 2월 말부터 전원 원격근무를 하다가 지난달 말 주 2회 회사로 출근하는 전환근무 체제를 도입한 데 이어, 오늘부터는 완전히 정상화할 계획이었지만, 최근 이태원 클럽에서 시작된 코로나19 재확산 조짐에 일정을 미뤘습니다.판교에 있는 카카오 역시 오늘 정상 출근 방침을 접고 주 1회 출근하는 현행 순환근무제를 1주일 연장하기로 했습니다.반면 오늘 정상 근무 체제로 전환하기로 한 NHN과 넷마블은 일단 계획대로 시행할 예정입니다.박병한 [bhpark@ytn.co.kr][저작권자(c) YTN & YTN PLUS 무단전재 및 재배포 금지]",/news/news_read.nhn?article_id=0001438339&office_id=052&mode=search&query=카카오&page=6
이태원 클럽발 코로나19 감염 늘자 기업들도 '긴장',"[더팩트ㅣ이성락 기자] 서울 용산 이태원 클럽발 신종 코로나바이러스 감염증(코로나19) 재확산의 불똥이 기업으로 튀고 있다. LG유플러스는 본사 직원이 확진 판정을 받아 사옥 폐쇄 결정을 내렸고, 네이버·카카오는 감염 확산 우려에 정상 출근 체제로의 전환을 미뤘다. 상황이 심각해진다면 다른 기업들 역시 재차 위기 대응에 나설 것으로 보인다.11일 업계에 따르면 LG유플러스는 이날부터 오는 13일까지 용산 사옥을 폐쇄하고 전 직원 재택근무를 시행하기로 했다. 이는 용산 본사에서 근무 중인 직원이 전날(10일) 코로나19 확진 판정을 받은 데 따른 조치다. 해당 직원은 지난 2일 이태원 주점을 방문한 뒤 무증상 상태로 지내면서 6~8일 정상 출근했다. 이후 지난 9일 코로나19 검사를 받았다.LG유플러스 용산 사옥 근무자는 2000여 명에 달한다. 회사는 직원과 밀접 접촉한 다른 직원 등을 파악해 자가격리 조치를 시행할 방침이다. 하지만 확진자가 이틀 동안 정상적으로 출근했다는 점에서 추가 감염 발생 가능성이 크다는 관측이 나온다. 이미 이태원 클럽 관련 2차 감염 사례가 보고되고 있는 상황에서 최악을 고려해 대응 수위를 높여야 할 시점이다.네이버는 이태원 클럽 관련 확진자가 늘어나자 정상 출근 연기를 결정했다. 회사는 2월 말 전원 재택근무를 실시하다 지난달 말부터 주 2회 회사에서 근무하는 전환근무 체제를 유지해왔다. 그리고 이날부터 완전한 정상 출근을 계획하고 있었지만, 코로나19 확산세를 고려해 이를 철회한 것이다. 당분간 네이버는 전환근무제를 유지할 방침이다.카카오 역시 11일 정상 출근 계획을 접었다. 주 1회 출근하는 현행 순환근무제를 일주일 연장하고 사태 추이를 지켜볼 예정이다. 상황이 악화된다면 추가 연장 가능성도 열려 있다. 카카오는 2월 말부터 전 직원 재택근무를 시행하다가 지난달 9일부터 순환근무제를 시행하고 있다.이처럼 네이버와 카카오가 선제 대응에 나선 건 이태원 클럽발 코로나19 확산세가 심상치 않기 때문이다. 실제로 이태원 클럽 관련 코로나19 지역 감염이 전국으로 급속하게 확산되고 있다. 10일 오후 기준 이태원 클럽 관련 확진자 수는 모두 54명이다. 정은경 중앙방역대책본부장은 ""1일 첫 발병 이후 일주일 정도 지났지만 벌써 54명의 확진자가 확인됐다""며 ""7명의 확진자가 지역 사회에서 가족, 지인 등을 전염 시켜 11명의 2차 전파 사례가 보고될 만큼 전파 속도가 굉장히 빠르고 전염력이 높은 특성을 보여준다""고 우려했다.정상 복귀 수순을 밟고 있던 다른 기업들도 재확산 우려에 대응력을 강화할 것으로 예상된다. 특히 네이버·카카오와 마찬가지로 용인 66·67번 확진자가 재직 중인 티맥스소프트 본사에서 가까운 경기 성남 판교 IT 기업들의 움직임이 바빠질 전망이다. 이날부터 정상 출근 예정인 NHN과 넷마블 등은 우선 계획대로 근무 전환에 나선다는 방침이다.IT 업계 관계자는 ""이태원 클럽 관련 확진자가 더 늘어날 것이라는 예상에 따라 여러 기업이 서둘러 대책 논의를 진행할 것으로 보인다""며 ""당장 재택근무로 돌아가진 않더라도 상황의 심각성을 고려해 회사 내부적으로 이태원 방문 여부 등을 다시 조사할 수도 있다""고 설명했다.rocky@tf.co.kr저작권자 ⓒ 특종에 강한 더팩트 & tf.co.kr 무단 전재 및 재배포 금지",/news/news_read.nhn?article_id=0000025250&office_id=629&mode=search&query=카카오&page=6
"개정안, 자칫 ‘사적 검열’ 논란 유발… 해외에 서버 둔 업체엔 규제 미지수","일명 ‘n번방 방지법’이 국회 상임위원회를 통과하자 정보기술(IT) 업계가 반발하고 있다. 불법 영상물을 모니터링하는 과정에서 ‘검열 논란’이 발생할 것이고, 이는 곧 제2의 ‘사이버 망명’으로 이어질 수 있다는 우려다.국회 과학기술정보방송통신위원회는 지난 7일 전체회의를 열고 ‘n번방 사태’ 재발 방지 방안을 담은 전기통신사업법 일부개정법률안과 정보통신망 이용촉진 및 정보보호 등에 관한 법률 일부개정법률안(정보통신망법 개정안)을 가결했다. 법안에는 인터넷 사업자에 불법 촬영물 삭제·접속차단 등 유통방지 조치 의무와 기술적·관리적 조치 의무를 부과하는 조항이 담겼다. 개정안에 따르면 인터넷 사업자는 방송통신위원회에 매년 투명성 보고서를 제출해야 하고, 국외 사업자도 ‘역외규정’에 따라 법 적용을 받아야 한다.IT 업계는 법안 체계·자구 심사를 담당하는 국회 법제사법위원회 개의를 앞두고 디지털 성범죄 방지에 사업자도 노력해야 한다는 데 공감하면서도 개정안이 자칫 ‘사적 검열’ 논란을 일으킬 수 있다고 보고 있다. 인공지능(AI)을 활용해 음란물 필터링 기술을 개발하는 등 자정 노력을 기울이고 있지만, 최종 판단은 결국 책임자의 수작업을 거쳐야 하는 만큼 ‘대화방 감시’라는 오해를 살 수 있기 때문이다.과거 카카오톡 사용자들이 텔레그램 메신저로 옮겨갔던 ‘사이버 망명’ 사태가 재현될 것이라는 우려도 제기된다. 2014년 ‘카카오톡 감청 논란’과 2016년 테러방지법 처리를 앞두고 발생한 이 현상은 국내 플랫폼을 사용할 경우 대화 내용이 감시받을 수 있다는 불안감이 확산하면서 유행했다. 이로 인해 카카오톡뿐만 아니라 네이버 라인, 네이트온 등 플랫폼 업계는 월간활성이용자(MAU) 수가 눈에 띄게 줄면서 피해를 감수해야 했다. 업계 관계자는 10일 “충분한 논의를 거치지 않은 법안이 통과될 경우 문제가 된 텔레그램으로 사용자가 다시 유입되는 ‘아이러니’가 벌어질 것”이라고 말했다.개정안 내용의 실효성에 대한 의문도 제기된다. 국내법을 바꾸더라도 해외 사업자에게 이를 집행하는 데는 어려움이 따르기 때문이다. 이번 ‘n번방 사태’에서도 한국 경찰이 수사에 강한 의지를 보이고 있지만 텔레그램 측은 협조 요청에 응하지 않고 있다. 법안에 역외규정·대리인 제도를 두지만 국내 법인이 없는 텔레그램을 비롯해 해외에 서버를 둔 업체들을 규제·감독할 수 있을지는 미지수다. 지난해 국정감사 당시에도 구글·페이스북의 국내 지사 대표가 의원들의 질의에 두루뭉술한 답변으로 일관하면서 답답한 모습을 연출하기도 했다.개정안이 통과될 경우 오히려 사법기관에 협조해온 국내 사업자에 규제 강도가 높아져 역차별로 작용할 것이란 우려도 있다. 한국인터넷기업협회는 과방위에서 법안이 통과되자 “인터넷 사업자 책임 강화 방안은 국내 사업자 규제 강화 정책으로 실효성이 없다는 것은 전문가들의 공통된 입장”이라고 비판했다. 여야는 마지막 임시국회 회기 종료일인 오는 15일 이전 법안을 처리할 것으로 보인다.김성훈 기자 hunhun@kmib.co.krGoodNews paper ⓒ , 무단전재 및 재배포금지",/news/news_read.nhn?article_id=0001319651&office_id=005&mode=search&query=카카오&page=6
,"“시세보다 싸게 나와서 전화해보니 경매 물건이었다”“동과 층만 슬쩍 바꿔 마치 다른 매물인 것처럼 속였다”한 부동산 온라인 카페에 올라온 허위 매물 피해 사례다. 정부가 부동산 시장 교란 행위로 규정하고 엄벌을 강조했지만, 실제로 존재하지 않거나 당장 팔 수 없는 ‘허위 매물’을 미끼로 고객을 현혹하는 부동산중개업소의 불법 영업이 갈수록 활개를 치고 있는 것으로 나타났다. 특히 지난해 12ㆍ16 대책 이후 ‘규제 풍선효과’로 최근 가격 상승률이 높았던 경기 용인과 수원, 화성 등에서 허위 매물 신고가 집중되고 있다. 정부는 온라인 부동산 허위매물 모니터링 전담 기관을 지정해 허위매물 단속을 강화할 방침이다.10일 네이버와 카카오 등 인터넷 사업자 자율기구인 한국인터넷자율정책기구(KISO)에 접수된 올해 1분기(1~3월) 부동산 허위매물 신고는 3만8,875건으로, 전년 같은 분기 1만7,195건과 비교하면 126.1%나 늘었다.월별로 보면 △1월 1만5,385건 △2월 1만4,984건 △3월 8,506건 △4월6,149건으로 감소하는 추세지만, 신종 코로나바이러스 감염증(코로나19)에 따른 거래 침체가 맞물린 결과라 허위매물 영업이 근절됐다고 보기 어렵다는 지적이 나온다.특히 가격 급등 지역일수록 미끼 매물을 악용한 편법 상술이 기승을 부리고 있다. 올해 1분기 허위매물 신고가 가장 많았던 시ㆍ군ㆍ구는 경기 용인시와 수원시로 각각 5,373건과 2,317건이 접수됐다. 한국감정원에 따르면 이들 지역의 올해 1분기 아파트값 평균 상승률은 각각 6.98%와 12.55%로, 수원권선(14.59%), 수원팔달(13.89%), 수원영통(12.75%), 용인수지(9.16%) 등을 중심으로 급격한 매매가격 상승세가 나타났다.이어 경기 화성시(2,147건), 경기 고양시(1,893건), 경기 성남시(1,515건) 등 순으로 많았다. 서울에서는 강남구(1,202건), 동대문구(1,025건) 등에서 허위 매물 피해를 호소하는 수요자들의 불만이 많았던 것으로 조사됐다.온라인 허위매물 신고가 많은 지역은 집값 담합 사례도 적지 않다. 국토교통부는 올해 2~3월 중 한국감정원 부동산거래질서교란행위 신고센터에 접수된 집값 담합 의심 사례 364건 중 범죄혐의가 확인돼 형사 입건된 11건은 대부분이 최근 ‘규제 풍선효과’로 집값이 오른 수원, 인천, 군포 등 수도권 지역이었다.이에 따라 정부는 부동산 중개업소들의 허위매물을 잡아내기 위한 전담 기관을 지정할 계획이다. 국토부는 지난달 말 인터넷 부동산 광고 모니터링 업무위탁 기관을 지정하는 근거를 담은 공인중개사법 시행령 개정안을 입법 예고했다. 국토부는 공공기관과 정부출연 연구기관, 비영리법인 중에 전담 기관을 지정해 오는 8월21일부터는 연 최소 4회 이상 시장 모니터를 실시하기로 하고, 법 위반이 의심되는 경우 언제든 불시 조사에 나설 방침이다. 국토부 관계자는 “그 동안 허위매물 모니터링은 민간 자율 규제에만 맡겨져 처벌 등을 강제하기 어려운 점이 있었다”면서 “허위매물이 적발된 중개업소엔 건당 최대 500만원의 과태료가 부과된다”고 말했다.김기중기자 k2j@hankookilbo.com",/news/news_read.nhn?article_id=0000494971&office_id=469&mode=search&query=카카오&page=6
,"[앵커]직원이 이태원 클럽 관련으로 코로나 19 확진 판정을 받아 휴점했던 롯데백화점 본점과 현대백화점 충청점이 하루 만에 영업을 재개했습니다.직원 가족이 코로나 확진 판정을 받은 금융감독원은 서울 여의도 본원 건물 일부를 폐쇄했습니다.차유정 기자가 보도합니다.[기자]직원이 코로나 19 확진 판정을 받아 하루 휴점했던 롯데백화점 본점이 다시 문을 열었습니다.명품 매장 직원이었는데 이 매장은 다른 점포에서 온 직원들로 전부 대체됐습니다.[해당 매장 직원 : 원래 직원분들은 다 검사받으러 가셨고요.]해당 직원은 이태원 클럽을 다녀온 사람과 밀접 접촉한 뒤 그제(9일) 확진 판정을 받았습니다.지난 7~8일은 매장서 근무하지 않았고 그전에도 마스크는 쓰고 근무한 것으로 전해졌습니다.백화점 측은 사실이 알려진 당일 본점 문을 닫고 방역 작업을 마쳤다고 밝혔습니다.다행히 현재까지 추가 확진 판정을 받은 직원은 없는 것으로 알려졌습니다.이태원 클럽에 다녀온 직원이 확진 판정을 받아 마찬가지로 하루 문을 닫았던 현대백화점 충청점도 영업을 재개했습니다.화장품 매장서 근무하던 직원으로, 이 직원도 근무 때나 이동할 때 모두 마스크를 착용한 것으로 전해졌는데 주변 불안감은 여전히 높습니다.[이영호 / 청주시 사창동 : 청주에는 확진 자가 많이 없었는데 갑자기 최근 서울 갔다 오면서…, 이번에 연휴가 워낙 길어서 걱정했었는데 그대로 확진자가 늘어나니까….]직원 확진 판정으로 사업장을 폐쇄한 카카오뱅크 콜센터는 사태가 진정될 때까지 전원 원격 근무하기로 했습니다.콜센터는 서울 당산동에 있는 코레일유통 건물에 입주해 있었는데 같은 층에서 근무한 직원만 70명에 달하는 것으로 전해졌습니다.[황은재 / 카카오뱅크 홍보팀장 : 코로나 관련 상황이 안정될 때까지 현재로써 재택·원격 근무 조치를 취할 예정입니다.]회사 측은 70명 모두 코로나 진단 검사를 받도록 조치해 결과를 기다리고 있다고 밝혔습니다.또 직원 가족이 확진 판정을 받은 금융감독원은 서울 여의도 본원 건물 일부를 폐쇄했습니다.금감원은 해당 직원이 근무하는 층과 공용공간을 폐쇄한 뒤 방역 조치할 거고, 해당 직원도 따로 검사받아 결과가 곧 나올 거라고 밝혔습니다.YTN 차유정입니다.[저작권자(c) YTN & YTN PLUS 무단전재 및 재배포 금지]",/news/news_read.nhn?article_id=0001438354&office_id=052&mode=search&query=카카오&page=6
,"‘이태원 클럽발(發)’ 신종 코로나바이러스 감염증(코로나19) 재확산 여파로 기업들이 정상근무 체제로의 전환을 연기하는 등 선제적 조치에 나서고 있다. 네이버는 11일 정상근무제로 복귀하려던 계획을 취소하고, 현행 전환근무제(주 2회 출근, 나머지 원격 근무)를 당분간 유지하기로 10일 결정했다. 경기 성남시 분당구의 네이버 본사 건물이 이태원 클럽과 연관된 확진자가 재직 중인 티맥스소프트 본사와 약 3km 거리인 점을 고려한 것이다. 두 회사의 건물은 지하철 분당선으로 한 정거장 거리라 임직원들의 출퇴근 동선이 겹친다. 네이버 관계자는 “지역사회 2차 감염 확산을 막기 위한 조치”라며 “정상근무 체제로의 전환은 별도의 공지가 있을 때까지 무기한 연기한다”고 밝혔다. 경기 성남시 판교에 사옥이 있는 카카오도 11일 계획했던 정상근무 체제로의 전환을 무기한 연기하고, 순환근무제(주 1회 출근)를 1주일 더 연장하기로 했다. 카카오의 자회사인 카카오뱅크는 9일 서울 영등포구의 위탁 콜센터에서 근무하는 직원이 확진 판정을 받아 직장을 폐쇄하고 콜센터 직원 270명을 전원 재택근무로 전환하기도 했다. 서울 여의도, 용산 등 직장인 밀집 지역도 다시 긴장하는 분위기다. 금융감독원은 10일 “서울 여의도 본원 6층 근무자의 가족이 코로나19 확진을 받았다”며 “해당 층과 공용공간을 폐쇄한다”고 긴급 공지했다. LG유플러스도 이날 서울 용산 사옥 근무자가 확진되면서 사옥을 폐쇄하고 11일부터 3일 동안 전 직원 재택근무를 시행한다.유근형 기자 noel@donga.com ⓒ 동아일보 & donga.com, 무단 전재 및 재배포 금지",/news/news_read.nhn?article_id=0003285295&office_id=020&mode=search&query=카카오&page=6
,"◆ 가정의 달 금융상품 ◆
신한은행은 5월 가정의 달을 맞아 선물로 금융상품을 주고받을 수 있는 모바일 서비스 '쏠 기프팅(SOL Gifting)' 서비스를 새롭게 선보였다. 상대방의 휴대전화 번호와 이름만 알면 적금, 환전, 골드바를 선물할 수 있는 간편 서비스다. 감사·축하 등의 마음을 담은 메시지도 함께 전달할 수 있다.앞서 신한은행은 2018년 '쏠편한 선물하는 적금'을 통해 은행권 최초로 선물하는 콘셉트의 금융상품을 도입한 데 이어, 이번 기프팅 서비스 출시로 선물 플랫폼을 환전과 골드바로 확장했다. 선물할 수 있는 적금 상품군도 기존의 선물하는 적금 외에 △마이홈플랜 청약종합저축 △쏠편한 작심3일 적금 △신한 첫급여드림(DREAM) 적금 등을 추가했다.주고받는 절차는 어렵지 않다. 신한은행 모바일 앱 '쏠'에서 보내는 사람 연락처를 입력하면 카카오톡이나 문자메시지로 선물 메시지 연결 주소(URL)가 전송된다. 받는 사람은 스마트폰에서 URL을 눌러 쏠에 접속한 후 안내에 따라 금융상품에 가입하게 된다. 일반택배의 발송을 조회하듯 쏠에서도 선물 메시지 발송 후 진행 상황을 실시간으로 확인할 수 있다. 또 3일 안에 받는 사람이 수령 절차를 밟지 않으면 자동으로 취소되게 해 혹시 모를 배달 사고 위험도 줄였다.신한은행은 '쏠 기프팅' 출시를 기념해 5월 말까지 적금 상품을 선물한 고객 선착순 4만명에게 추첨을 통해 치킨, 보드게임, 커피 쿠폰 등의 경품을 제공한다. 또 '선물 조르기'를 이용한 고객 중 매일 선착순 300명에겐 카카오톡 이모티콘을 증정한다.이 밖에 자녀를 위한 저축 상품과 이벤트도 고객을 기다리고 있다. '신한 My주니어 적금'은 만 18세 이하 1인당 1계좌를 가입할 수 있는 1년 만기 저축 상품으로, 1년 만기 이후 최대 3회 재예치도 가능하다. 분기(3개월)별 적립 한도 100만원 이내에서 자유롭게 저축하는 상품이다. 가입 고객에게는 금리 외에도 빈폴키드 상품 10% 할인, 안심보험 무료 가입 등의 추가 혜택도 제공된다.금리는 연 최고 2.5%가 적용된다. 기본 이율 1.5%에 우대요건 충족 시 최대 1.0%포인트가 더 붙는다. 우대 요건은 △신한은행 주택청약종합저축을 적금 만기일까지 보유(연 0.5%포인트) △신한은행 입출금통장에서 월납입액 자동이체 6회 이상(연 0.5%포인트) △신한은행 계좌로 아동수당 수급(연 0.3%포인트) △신한은행 체크카드 결제 실적(연 0.3%포인트) △만기 후 재예치(연 0.1%포인트) 등이다.이 적금은 또 아이행복바우처 사업 대상이어서 가입 시 축하금 1만원을 받게 된다. 아이행복바우처란 초록우산어린이재단과 신한은행이 함께하는 협약 사업이다. 만 5세 이하(2015년 1월 1일 이후 출생) 영유아 고객이 바우처를 발급받고 이 적금이나 주택청약종합저축에 가입할 때마다 1000원이 아동학대 예방기금에 적립된다. 특히 가정의 달을 기념해 아이행복바우처를 통해 적금 또는 주택청약에 가입한 선착순 500명에겐 '아이보리'의 쇼핑몰 상품권 1만원권 증정 이벤트도 6월 말까지 진행된다.어린아이뿐 아니라 청소년을 대상으로 한 행복바우처 사업도 있다. 적금이나 주택청약에 가입하면 축하금 1만원을 주는 것은 물론이고 재택 봉사활동 참여 기회를 주는 이벤트도 진행 중이다. 코로나19 확산 대응 차원에서 이달 말까지 중·고등학생은 마스크를 제작하는 봉사활동 참여 기회를 받을 수 있다. 코로나19로 대면 접촉이 어려운 상황에서 재택 봉사활동을 통해 자원봉사 시간 2시간도 인정받을 수 있다.통장을 개설하고자 하는 만 14세 이상 청소년은 본인이 방문할 경우 △학생증(생년월일 포함)과 주민등록초본 △청소년증 △여권 중 하나를 지참해 야 한다. 부모나 법정대리인이 방문한다면 대리인 실명확인증표, 발급일 3개월 이내의 가족관계 증빙 서류(주민등록등본 또는 가족관계증명서), 도장 등이 필요하다. [정주원 기자] [ⓒ 매일경제 & mk.co.kr, 무단전재 및 재배포 금지]",/news/news_read.nhn?article_id=0004571974&office_id=009&mode=search&query=카카오&page=6
