head,text,url
,"소중한 사람에게 감사의 마음을 선물하세요.한편, 과거 간식으로만 취급되던 샌드위치는 이제 건강한 식사로 사람들에게 각광받고 있는 외식 아이템이 됐다. 햄버거보다 건강한 이미지를 가지고 있는 샌드위치는 간편하게 먹을 수 있고 기호에 맞게 속재료를 선택할 수도 있어서 다이어트나 건강 관리에 적합한 음식이기도 하다.강동완 기자 enterfn@mt.co.kr
<저작권자 ⓒ '성공을 꿈꾸는 사람들의 경제 뉴스' 머니S, 무단전재 및 재배포 금지>",/news/news_read.nhn?article_id=0000521987&office_id=417&mode=search&query=카카오&page=2
▶ 헉! 소리나는 스!토리 뉴스 [헉스]▶ '아는 척'하고 싶은 당신을 위한 [두유노우]▶ 한눈에 보는 [4·15총선 NEWS MAP],"[파이낸셜뉴스]
 전국민주노동조합총연맹은 24일 성명서를 통해 텔레그램 N번방 성폭력 사건에 대해 ""텔레그렘 N번방을 비롯해 다양한 성범죄를 기억할 것""이라고 밝혔다.
 민주노총은 성명서에서 그간 우리사회에서 문제가 된 성범죄 사건을 언급하며 강하게 비판했다. 소라넷 운영자와 이용자, 카카오톡 단톡방에서 여성 사진 등을 공유한 정준영, 웹하드 카르텔로 디지털 성폭력의 장을 만든 양진호, 아동성폭력 제작과 유포로 부를 축전한 다크웹 운영자 손정우 등을 직접 거론했다.
 민주노총은 ""나는 아니라고, 일부 남성이라고, 나를 매도하지 말라고 이 강간문화를 고착시켜온 남성들 우리는 이들의 범죄를 기억합니다""라고 했다.
 반면 성폭력 피해자를 지원하고 디지털 성폭력을 세상에 알린 디지털성폭력아웃(DSO)에 적극 나선 사람들은 역사가 기억할 것이라고 했다.
 민주노총은 미투 운동과 함께한 30만 여성, 한국사이버폭력대응센터, 텔레그램 성착취 연속 보도를 쓴 한겨례 기자 등을 언급했다.
 민주노총은 ""여성노동자들이 겪었던 일터에서의 성폭력과 일상에서의 단톡방 성폭력, 2차 문화 등을 없애기 위한 조직문화 혁신에 함께 나설 것""이라고 했다.



 ※ 저작권자 ⓒ 파이낸셜뉴스. 무단 전재-재배포 금지",/news/news_read.nhn?article_id=0004395646&office_id=014&mode=search&query=카카오&page=2
반도건설 의결권 5%로 제한3자연합 가처분 신청들 기각한진칼 주가 '폭락',"'남매의 분쟁'으로 불리며 오는 27일 정기주주총회에서 주요 안건을 놓고 표대결을 벌일 예정이던 한진칼의 주가가 24일 폭락했다. 한진칼은 이날 장중 한때 9%대 상승률을 보였지만 장막판 법원으로부터 들려온 소식에 하락 반전, 종가 기준으로 전날보다 26.93% 빠진 채 거래를 끝냈다. 고점 대비로는 35% 이상 미끄러졌다.
주총을 불과 3일 앞두고 이렇게 주가가 빠진 이유는 법원에서 '주가 악재'가 터졌기 때문이다. 한진그룹과 경영권 다툼을 예고했던 3자주주연합(조현아 전 대한항공 부사장·KCGI·반도건설)이 주총 시 의결권 행사 범위와 관련해 요청한 가처분 신청이 모두 기각된 것이다. 법원은 또 반도건설이 보유 중인 지분 8.2% 가운데 3.2%에 대해서는 ""의결권 행사가 허용될 수 없다""고 했다. 표대결에서 3자연합이 우위를 점하기 어려워졌다는 이야기다. 법조계에 따르면 서울중앙지법 민사합의50부(이승련 부장판사)는 반도건설 측이 한진칼을 상대로 ""주주총회에서 의결권 행사를 허용해달라""고 낸 가처분 신청을 받아들이지 않았다. 재판부는 ""반도건설은 늦어도 권홍사 회장이 조원태 회장에게 임원 선임을 마지막으로 요구한 작년 12월16일부터는 경영 참가 목적으로 주식을 보유하게 됐음이 미뤄 판단된다""며 ""그로부터 5일 이내에 보유 목적의 변경 보고를 할 의무가 있는데도 (반도건설은) 고의나 중과실로 보고를 하지 않았다""고 부연했다. 이어 ""반도건설이 보유한 주식 중 의결권 있는 발행주식 총수의 5%를 초과하는 부분에 대해선 의결권을 행사할 수 없다""고 했다. 3자주주연합은 당초 조 전 부사장(6.49%) KCGI(17.29%) 반도건설(8.20%)의 지분을 합해 31.98%를 확보했었다. 하지만 법원의 결정으로 인해 이들 지분은 28.78%로 내려앉게 됐다.KCGI의 투자목적회사인 그레이스홀딩스가 한진칼을 상대로 ""대한항공 자가보험과 사우회 등의 의결권(3.79%) 행사를 금지해달라""고 낸 가처분 신청에 대해서도 법원은 기각 사유를 내놨다. 조원태 회장과 특수관계인 또는 공동보유자에 해당한다는 3자연합의 주장과 소명이 부족하다고 판단한 것이다. 대한항공 자가보험은 한진칼 주주총회 안건에 대한 의결권 찬반을 임직원이 직접 선택하도록 하는 '불통일행사'를 실시하겠다는 입장을 내놨고, 사우회 역시 전자투표 시스템을 통해 주총 안건별로 찬반 의견을 투표하도록 한 상태다. 다만 사내에서 조 회장을 지지하는 분위기가 형성된 만큼 사실상 자가보험과 사우회의 의결권 3.79%는 조 회장을 지지할 가능성이 크다.현재 조 회장 측은 특수관계인을 포함한 지분은 22.45%인데 여기에 델타항공 보유지분(10.00%) 카카오(1.00%) 대한항공 자가보험과 사우회 등 지분(3.79%) 등 백기사 지분을 합하면 총 37.49%로 집계된다. 이로써 국민연금의 의결권 행사 향방도 중요해졌다. 국민연금은 한진칼의 지분 2.9%를 보유하고 있다. 한경닷컴 뉴스룸 open@hankyung.com▶ ▶
 ▶
ⓒ 한국경제 & , 무단전재 및 재배포 금지",/news/news_read.nhn?article_id=0004312438&office_id=015&mode=search&query=카카오&page=2
지분 변동 커져 새 분쟁 불씨로7.22%P 차이로 조 회장 측 유리연임 결정되면 해임 사실상 어려워,"조원태 한진그룹 회장과 뺏으려는 조현아 3자 연합 간 한진그룹 경영권 분쟁이 27일 한진칼 정기주주총회를 기점으로 더욱 치열해질 전망이다.일반적으로 경영권 분쟁은 주총을 통해 사태가 완료되지만, 한진그룹의 경우 정기주총 의결권 지분과 현재 지분에 변동이 커 임시주총 등 새로운 분쟁으로 이어질 가능성이 크다.양 진영 지분율을 고려하면 정기주총에선 조 회장이 조현아 3자 연합보다 유리한 상황이지만, 현재 지분구조는 조현아 3자 연합이 역전한 것으로 알려졌다.정기주총의 경우 지난해 12월 26일 기준 주주명부를 기준으로 의결권이 부여되지만, 이후 지분율이 크게 요동쳤다. 임시주총이 열리면 정반대의 상황이 벌어질 수 있는 상황이다.정기주총 이후에도 임시주총 소집 등으로 사태가 이어지며, 분쟁이 장기전으로 돌입할 것으로 예상된다.◇정기주총, 조원태 회장 우세한진칼 정기주총에서 의결권 행사가 가능한 지분은 주주명부를 폐쇄하기 전 보유한 지분으로 한정된다. 기준일은 지난해 12월 26일이다.정기주총 지분율은 조 회장 진영이 우위에 있다. 잠재적 우호지분까지 포함해 조 회장 진영은 37.5%, 조현아 3자 연합은 30.28%로 격차는 7.22% 포인트(P)다.조 회장 진영 지분은 조현아 전 대한항공 부사장을 제외한 오너일가 및 한진그룹 재단(22.45%), 대한항공과 협력관계에 있는 델타항공(10%)이 보유한 32.45%다. 이외 대한항공 자가보험 및 사우회(3.8%), 카카오(1.0%), GS칼텍스(0.25%) 등도 잠재적 우호지분으로 이를 합산하면 37.5%다.조현아 3자 연합이 대한항공 자가보험 및 사우회 의결권 행사 가처분 신청을 냈지만 받아들여지지 않았다.조현아 3자 연합 지분은 조 전 부사장(6.49%), KCGI(17.29%), 반도그룹(8.20%)로 구성된다. 그러나 반도그룹 보유 지분 중 8.20% 중 3.20%에 대한 의결권은 한진칼 정기주총에서 행사할 수 없다. 법원이 반도그룹이 제기한 의결권행사 허용 가처분 신청을 기각했기 때문이다.알려진 우호 지분은 지분 1.5%를 보유한 한진칼 소액주주연대다. KCGI는 이달 11일부터 위임장을 받아 확보한 지분율에 대해선 밝히지 않았다.◇핵심 안건은 조원태 연임주주총회 핵심 안건은 조 회장 한진칼 사내이사 연임이다.캐스팅보트로 꼽히는 국민연금(2.90%)을 비롯한 기관투자자, 외국인투자자 등이 참고하는 의결권 자문사는 엇갈린 의견을 내놨다.세계 최대 의결권 자문사 ISS(Institutional Shareholder Services)와 국내 최대 의결권 자문사 한국기업지배구조원(KCGS), 대신지배구조연구원 등은 조 회장 연임 안건에 찬성을 권고했다.반면에 또 다른 국내 의결권 자문사 서스틴베스트와 좋은기업지배구조연구소(CGCG)는 조 회장 연임을 반대했다.조 회장 연임을 찬성한 의결권 자문사는 17년 항공·물류 경력이 회사 경영에 긍정적이라고 평가했고, 반대한 자문사는 조 회장이 이사 재임 시절 있었던 규제당국의 계열사 제재 등에 대한 책임이 있다고 판단했다.한진칼 이사회 구성원은 지난 23일 임기가 만료된 조 회장 등 2명을 제외하면 4명(사내 1명·사외 3명)이사이다.조 회장 진영은 이사후보로 7명을, 조현아 3자 연합은 6명을 각각 추천했다. 이는 이사회 과반수를 확보하기 위한 조치다. 상법에 따른 회사기회유용금지, 자기거래금지에 해당하지 않는 사안은 이사회 결의가 이사 과반수 출석과 출석이사 과반수 결의로 이뤄지기 때문이다.조현아 3자 연합이 장기전을 예고했지만 조 회장이 연임에 성공하면 사실상 해임이 쉽지 않다. 임시주총 출석주주 3분의 2의 찬성을 받아야 하고 찬성 주식수가 발행주식수 3분의 1 이상이어야 한다.◇경영권 분쟁, 한진에 '약'됐다한진그룹 경영권 분쟁은 조 회장과 조 전 부사장 간 경영권 싸움으로 그려지지만 사실 경영권을 지키려는 오너가와 행동주의 사모펀드 KCGI 간의 싸움이다. 조 전 부사장은 KCGI, 반도그룹 간 계약에 따라 한진그룹 경영에 직접 나설 수 없다.KCGI는 2018년 11월 한진칼 경영 참여 의사를 밝히면서 목소리를 내기 시작했다. 유휴자산 매각과 부채비율을 낮춰야 한다고 주장했다. 하지만 한진그룹에 받아들여지지 않았다. 단일 최대주주에 오른 뒤에도 최고경영자(CEO)와 면담신청이 거절됐다.변화의 바람이 분 계기는 올해 1월에 있었다. 고 조양호 한진그룹 선대회장이 사망에 따른 재산상속으로 지분이 늘어난 조 전 부사장이 KCGI와 손을 잡은 것이다. 반도그룹까지 가세하면서 KCGI 목소리에 힘이 실렸다.이에 한진그룹은 2월 경영투명성과 재무구조 개선안을 발표, 대응에 나선다. 지난해 발표한 '비전 2023'에 대한 구체적 실행에 착수하겠다고 밝혔다.우선 대표이사와 이사회 의장직을 분리하고, 사외이사후보추천위원회를 전원 사외이사로 구성해 독립성을 제고하기로 했다. 재무구조 개선을 위한 호텔·레저 등 비주력 사업을 매각하고 저수익 자산도 정리하기로 방침을 정했다.이는 외국인투자자, 기관투자자 등으로부터 지지를 받으려는 전략적 조치로 해석된다. 조 회장이 경영권 방어를 위해 충분한 지분이 없어 급히 주주친화적 정책을 내놓은 것이다.수익실현을 목표로 하는 KCGI를 투기자본으로 바라보는 시각도 있지만 긍정적 효과도 적지 않다는 평가다.KCGI는 현 경영진에 대한 경영실패를 지적하며 조 회장의 사퇴를 요구한다. 조 회장 진영은 항공산업이 위기에 직면했기에 전문가로 이뤄진 현 경영진이 회사를 이끌어야 한다며 맞서고 있다.최남곤 유안타증권 연구원은 “최근까지도 최대주주의 '경영실패'에 책임을 묻는 사례가 극히 드물었으나, 한진칼 사례를 계기로 '최대주주=경영자'라는 한국 투자자의 고정관념이 깨질 수 있는 계기가 마련될 것”이라고 평가했다.박진형기자 jin@etnews.com",/news/news_read.nhn?article_id=0002874334&office_id=030&mode=search&query=카카오&page=2
"2019년중 옴부즈만 통해 개선과제 총 40건 심의, 개선방안 18건 마련","[아시아경제 조강욱 기자] #. A씨는 보험계약 당시 보험금 수익자에 대한 설명을 제대로 듣지 못해 수익자를 지정하지 않은 상태로 생명보험을 가입했다. 이후 불의의 사고로 A씨가 사망하자 민법상 상속순위에 따라 A씨와 함께 살고 있던 친동생 B씨가 아닌, 수십년동안 인연을 끊고 살아온 A씨의 생부에게 보험금이 지급됐다.보험금의 제3자 지급에 따른 소비자 피해를 예방하기 위해 보험계약시 보험금 수익자에 대한 설명이 의무화된다. A씨의 경우처럼 보험 계약자가 수익자를 미지정한 경우 의도하지 않은 자에게 보험금이 지급되는 문제가 개선된 것이다.금융위원회는 지난해 옴부즈만 제도를 통해 보험금 수익자에 대한 설명을 의무화하는 등 총 40건의 개선과제를 심의하고 18건의 개선방안을 이끌어냈다고 24일 밝혔다.제도개선이 추진되거나 완료된 주요 과제를 살펴보면 앞으로 보험 계약자가 보험금 수익자를 명시적으로 지정해 계약을 체결할 수 있도록 설명의무가 한층 강화된다. 이는 이달 시행 예정인 '금융소비자보호법' 시행령 개정 시 반영될 예정이다. 또 시각장애인을 위한 음성전환이 가능한 약관 및 설명서 제공 등 취약계층을 위한 소비자 보호방안도 함께 추진된다.핀테크 등 변화된 금융 환경을 반영하지 못한 아날로그적 행정규제도 합리적으로 개선된다.일례로 현재 200만원(기프트카드 등 무기명의 경우 50만원)인 모바일상품권, 쿠폰, 티머니교통카드 등 선불적 전자지급수단의 충전한도가 확대되고 SMSㆍ카카오 알림톡 등 다양한 전자적 방식으로 보험계약서를 교부받을수 있도록 관련규제가 개선된다. 또 금융위는 카드사의 간편결제 App 이용시 생체정보 등 다양한 본인인증수단이 허용될 수 있도록 카드업계와 협의 중이라고 설명했다. 현재는 결제서비스 외에 카드론 신청시에는 ID/PW 및 공인전자서명으로 제한된다.실손보험의 중복가입ㆍ보상을 막기 위한 제도개선이 추진된다. 현재 민간 보험회사의 경우, 회사간 정보공유를 통해 고객의 실손보험의 중복가입 여부를 확인하고 있으나, 일부 공제(건설공제·교직원공제)에게는 정보가 공유되지 않아 보험금 중복 지급 우려가 있었다. 이에 실손보험 가입ㆍ청구정보를 보험회사외에도 실손보험을 취급하는 공제회까지 확대해 나가기로 했다.보이스피싱 예방조치로 발생한 민원에 대한 감독상 예외가 인정된다. 종래에는 금융회사의 보이스피싱 사고 예방 조치로 인해 불가피하게 발생한 민원도 금융소비자보호 평가시 금융회사에 감점요인이 됐다. 실제로 B은행 직원인 C씨는 보이스피싱 사고예방을 위한 감독당국의 지침에 따라 업무를 처리하던 중 고객 D씨로부터 자신의 금융거래 목적을 왜 물어보냐는 항의를 받게됐다. 이후 D씨는 금감원에 민원을 제기했으며, 유사한 민원사례가 많이 발생한 B은행은 금감원으로부터 고객민원이 많다는 지적을 받게 됐었다. 하지만 앞으로는 해당민원에 대해서는 실태평가시 제외할 수 있도록 기준을 개선해 업계에 안내할 예정이다.충분한 의견수렴이 필요하거나, 법개정 등의 절차가 요구되는 과제에 대해서는 중장기적 관점에서 제도개선 여부를 검토할 예정이다. 금융위는 경미한 교통사고에 대한 과도한 보험금 지급 관행을 막기위해 진료비ㆍ합의금 기준을 마련해야 한다는 제안도 있었으나 교통사고 피해자의 진료권 침해소지가 있는 만큼 충분한 의견수렴을 거쳐 제도개선 여부를 검토하기로 했다고 설명했다.금융위는 ""제2기 옴부즈만은 이달 임기가 만료됨에 따라 제3기 옴부즈만을 신규 위촉해 활동을 지속할 것""이라며 ""향후에도 옴부즈만은 금융규제 상시 점검 및 금융소비자보호를 위한 제도개선 자문기구로서 역할을 충실히 수행할 계획""이라고 밝혔다.조강욱 기자 jomarok@asiae.co.kr <ⓒ경제를 보는 눈, 세계를 보는 창 아시아경제 무단전재 배포금지>",/news/news_read.nhn?article_id=0004648617&office_id=277&mode=search&query=카카오&page=2
"과기정통부, ICT 서비스 안정성 점검 회의","코로나19 사태 확산 이후 인터넷 트래픽이 증가했지만, 서비스 제공에는 문제가 없는 것으로 나타났다.과학기술정보통신부는 24일 '인터넷 트래픽 등 ICT(정보통신기술) 서비스 안정성 점검 회의'를 열어 이같이 논의했다. 이 회의는 코로나19 확산을 막기 위해 비대면 영상회의 형태로 개최했다.이날 회의는 해외에서 인터넷 사용량이 폭증하고 일부 국가에서 서비스가 다운되는 등의 문제가 발생하고 있는 만큼 우리나라의 인터넷 트래픽을 점검하고 ICT 서비스 장애 발생시 대책을 논의하기 위해 열렸다.회의에는 SK텔레콤, KT, LG유플러스, SK브로드밴드 등 통신사업자와 네이버, 카카오, 구글, 한국MS, 아마존 등 검색포털이나 메신저, 클라우드 서비스 사업자 등이 참여했다.통신사업자들은 이 자리에서 스트리밍 서비스 이용 증가로 3월 인터넷 트래픽이 1월 대비 약 13% 증가했다고 밝혔다. 다만 이용량 최고치는 아직 사업자들이 보유한 용량의 45∼60% 수준이라고 밝혔다.검색포털·메신저·클라우드 사업자들은 이용량이 증가하기는 했지만, 이용량 최고치가 높아지기보다는 이용 시간이 늘었기 때문이라며 트래픽이 증가해도 서비스 제공에 문제가 없을 것이라고 말했다.그러면서 그동안 주로 저녁 시간이나 주말에 이용량이 최고치를 보였지만, 이제는 이용 시간이 하루 전체나 주중까지 확장됐다고 이들 업체는 설명했다.이날 회의에서는 재택근무, 사이버 강의 증가로 어려움을 겪고 있는 중소기업이나 대학 등을 지원하는 방안에 대한 논의도 이뤄졌다.아마존웹서비스는 코로나19 대응을 위해 정보기술(IT) 솔루션 지원이 필요한 공공기관이 있으면 지원할 예정이라고 밝혔다.또 KT·네이버·구글은 화상회의 솔루션을, SK브로드밴드·KT·한국MS는 재택근무 솔루션을 무료로 제공한다고 설명했다.이와 함께 네이버비즈니스플랫폼(NBP)는 3∼4월 중소기업 대상 서버 비용 30∼40% 인하를, 카카오는 카카오페이 결제수수료 전액 지원 등을 추진하고 있다.KT는 자사 회선을 이용하고 있는 대학을 대상으로 온라인 강의를 위한 인터넷 회선 무료 증설과 기술지원을 하고 있고, 한국MS는 학교 대상 온라인 강의 가이드라인을 제공하고 있다고 밝혔다.송현수 기자 songh@busan.com",/news/news_read.nhn?article_id=0000991006&office_id=082&mode=search&query=카카오&page=2
,"한국은행이 기준금리를 0.5%포인트 내리자 굳건하던 은행 대출금리가 하락세를 보인다. 신용대출 금리의 기준이 되는 금융채AAA등급 금리가 내려가면서 지난달 시중은행의 신용대출 금리는 2%대를 기록했다.   KB국민·우리·NH농협은행은 지난 17일부터 적용되는 신규취급액 코픽스 기준 변동형 주택대출 금리를 일제히 전날보다 0.11%포인트 내렸다. 국민은행은 2.64∼4.14%로 우리은행은 2.83∼3.83%, 농협은행은 2.57∼4.18%로 각각 조정했다.신 잔액 기준 코픽스 연계 주택대출 금리도 0.03%포인트씩 내렸다. 국민은행은 2.80~4.30%, 우리은행은 2.84∼3.84%, 농협은행 2.58~4.19%로 인하됐다. 신한은행은 코픽스 연계 변동형 주택대출 금리가 2.55~3.81%로 전날과 변함이 없다.한은이 지난해 기준금리를 두번이나 내린 데 이어 최근 코로나19로 결국 제로금리 시대가 현실이 되면서 앞으로 대출 이자율은 추가 하락이 불가피할 전망이다. 한은은 지난해 7월 1.75%에서 1.50%로, 같은 해 10월에는 1.50%에서 1.25%로 기준금리를 내렸다. 지난 16일에는 임시 금융통화위원회를 열고 기준금리를 0.75%로 0.50%포인트 인하했다. 우리나라 기준금리가 0%대로 들어선 것은 이번이 처음이다.은행 관계자는 ""제로금리 영향이 본격화되면서 금융채 6개월에 가산금리를 더한 고정금리 주담대가 2%대까지 떨어졌다""며 ""금융채 금리 하락이 계속되고 시장 변동성이 너무 크다 보니 연 1%대 주담대 등장도 배제할 수 없다""고 말했다. 이남의 기자 namy85@mt.co.kr
<저작권자 ⓒ '성공을 꿈꾸는 사람들의 경제 뉴스' 머니S, 무단전재 및 재배포 금지>",/news/news_read.nhn?article_id=0000522007&office_id=417&mode=search&query=카카오&page=2
"법원, 3자 연합측 가처분 신청 모두 기각… 반도건설 의결권 5%로 제한","한진그룹 경영권을 두고 조현아 전 대한항공 부사장, 사모펀드 KCGI, 반도건설 등 3자 연합과 맞서고 있는 조원태 한진그룹 회장이 오는 27일 예정된 한진칼 정기 주주총회에서 유리한 고지에 서게 됐다. 3자 연합 측이 법원에 요청한 가처분 소송이 모두 기각되면서 주총 때 행사 가능한 의결권이 줄어들었기 때문이다. 24일 법조계에 따르면 서울중앙지법 민사합의50부(재판장 이승련)는 이날 반도건설 측이 한진칼을 상대로 ""주주총회에서 한진칼 지분 8.2%에 대해 의결권 행사를 허용해달라""고 낸 가처분 신청을 기각했다. 또 대한항공 자가보험과 사우회가 보유한 한진칼 지분 약 3.8%에 대해 의결권 행사를 금지해달라는 3자 연합 측의 소송도 기각했다.이번 법원 판단에 따라 이번주 한진칼 주총에서 반도건설은 보유 지분 8.2% 중 3.2%에 대해서는 의결권 행사를 하지 못하게 됐다. 이로써 이번 주총에서 의결권이 유효한 지분 기준으로 3자 연합은 당초 조 전 부사장 6.49%, KCGI 17.29%, 반도건설 8.20% 등 총 31.98%를 확보했으나, 결국 28.78%로 내려앉았다. 이에 대항하는 조 회장 측은 특수관계인을 포함한 지분 22.45%와 그룹 우군인 델타항공의 지분 10%를 확보했고, 다시 백기사 역할을 선언한 카카오 지분 1%와 대한항공 자가보험과 사우회 등이 보유한 지분 3.79%, GS칼텍스가 보유한 것으로 알려진 0.25%까지 더하면 총 37.49%를 확보한 것으로 추산된다. 이로써 양측의 지분율 격차가 8.71%p로 벌어지면서 재계 안팎에서는 조 회장 측이 이번 주총에서 승기를 잡았다는 분석이 나왔다. 3자 연합은 법원에 이번 가처분 기각 결정에 대해 효력정지 가처분을 신청하는 방안 등을 놓고 대책 마련에 나섰다. 3자 연합 측은 ""향후 본안 소송 등을 통해 계속 부당한 부분을 다툴 것""이라며 ""비록 예상과 다른 결과가 나왔지만 이미 최악의 법원 결정까지 고려해 이번 주총을 준비해왔으며 주총 이후에도 끝까지 한진그룹의 정상화를 위해 매진할 것""이라고 말했다. 그러면서 ""이번 법원의 가처분 결정이나 이번 주총에서의 결과가 그룹의 정상화 여부의 끝이 되리라고는 생각하지 않는다""며 ""3자 연합은 긴 안목과 호흡으로 한진그룹을 위기에서 벗어나도록 하고 정상화의 궤도에 올려 놓기 위해 모든 노력을 다하겠다""고 말했다. 3자 연합이 ‘긴 안목과 호흡’을 강조한 만큼, 주총 이후에도 한진그룹 경영권을 두고 양 측의 분쟁은 이어질 것으로 보인다. 조현아 전 대한항공 부사장과 KCGI, 반도건설이 맺은 주식 공동보유 계약기간은 5년이다. 실제 3자 연합 측과 조원태 회장 측은 주총 이후 전개될 경영권 분쟁에 대비해 지분을 꾸준히 추가 매입하고 있다. 현재까지 KCGI와 반도건설은 지분율을 각각 18.68%, 14.95%까지 끌어올렸고, 조 회장 측도 우군 델타항공이 꾸준히 주식을 매입하면서 지분율을 14.9%로 늘렸다. 의결권이 없는 지분까지 포함하면 3자 연합 측의 지분율은 40.12%, 조 회장 측의 지분율은 41.4%에 이르는 것으로 추산된다. [최지희 기자 hee@chosunbiz.com]	[]	[]	[] 	chosunbiz.com",/news/news_read.nhn?article_id=0000494317&office_id=366&mode=search&query=카카오&page=2
