head,text,url
▶ 헉! 소리나는 스!토리 뉴스 [헉스]▶ '아는 척'하고 싶은 당신을 위한 [두유노우]▶ 한눈에 보는 [4·15총선 NEWS MAP],"[파이낸셜뉴스] 기준금리가 0%대(연 0.75%)에 진입하면서 은행에서 판매하는 1년 만기 정기예금 기본금리가 줄줄이 0%대에 진입했다. 이에 따라 연 0.7% 금리를 제공하는 1년 만기 정기예금에 1000만원을 가입하면 실제 수령 이자가 약 6만원에 불과하다.
 29일 금융권에 따르면 시중은행과 지방은행, 인터넷전문은행 등 은행권에서 예금금리를 빠르게 인하하고 있다. 한국은행이 기준금리 ‘빅컷’(0.5%포인트 인하)에 나서면서 은행들도 후속 조치에 나선 것이다.
 은행의 대표적 예금 상품인 정기예금 금리가 0%대로 떨어지면서 상품 매력도는 크게 떨어질 것으로 보인다. 예를 들어 연 0.7% 금리를 주는 1년 만기 정기예금에 1000만원을 넣으면 세전 이자는 7만원이다. 여기에 이자소득세 15.4%를 제외하면 1년 후 실제 수령하는 이자는 5만9220원에 그친다.
 다만 최근 코로나19 사태 등 금융시장이 혼란스런 모습을 보이고 있는 만큼 만기가 3~6개월 단기 정기예금 수요는 꾸준히 이어질 것이란 관측도 있다. 은행권 관계자는 ""예금금리가 최근 하락하고 있는 가운데 코로나19 여파로 대기성 자금이 늘고 있어 만기가 1년 이상인 정기예금 보다는 3~6개월 단기 정기예금을 찾는 수요가 늘었다""고 전했다.
 KB국민은행은 지난 25일 예금금리를 인하했다. 이에 따라 1년 만기 일반정기예금 금리는 기존 연 1.00%에서 연 0.80%로 0.20%포인트 하락했다. 1년 만기 국민수퍼정기예금 금리도 연 1.05%에서 연 0.90%로 낮췄다. NH농협은행도 25일부터 연 1.00%의 금리를 주던 일반정기예금 금리를 연 0.70%로 0.30%포인트 인하했다. 큰만족실세예금(개인)의 금리는 연 0.75%로 하락했다. IBK기업은행은 수신금리를 최대 0.40%포인트 인하했다. 이에 따라 정기예금 금리는 연 1.20%에서 연 0.80%로 떨어졌다.
 우리은행도 일부 정기예금에 대한 추가 금리 인하에 나섰다. 신한은행과 하나은행도 ""기준금리 하락에 따라 수신금리 인하를 검토 중""이라며 시기를 저울질 하고 있다. 내달 중순 변동형 주택담보대출 금리의 기준이 되는 코픽스(COFIX·자금조달비용지수)가 하락할 것으로 보이는 만큼 예금금리 인하를 더 이상 미루기 어렵기 때문이다.
 아울러 지방은행과 외국계은행도 0%대로 정기예금 금리를 낮췄다. BNK부산은행은 26일부터 기준금리 인하분을 반영해 수신상품 금리를 0.10~0.50%포인트 인하했다. DGB대구은행도 수신금리를 0.20~0.60%포인트 낮췄다. 씨티은행의 정기예금 금리는 연 1.00%에서 연 0.70%로 낮아졌다. 인터넷전문은행도 수신상품 금리를 내렸다. 카카오뱅크는 21일부터 세이프박스 금리를 연 1.00%에서 연 0.70%로 인하했다.




 ※ 저작권자 ⓒ 파이낸셜뉴스. 무단 전재-재배포 금지",/news/news_read.nhn?article_id=0004398307&office_id=014&mode=search&query=카카오&page=1
,"[머니투데이 이민하 기자] [편집자주] 정부가 코로나19(신종 코로나바이러스 감염증) 확산을 막기 위해 한시적으로 원격의료를 허용한 지 한 달여가 지났다. 환자와 병원, 약국을 연결해 비대면으로 진료하는 것은 물론 약 처방도 가능하다. 원격의료에 참여한 의사와 환자의 반응은 대체로 긍정적이다. 특히 병원 내 감염 우려는 물론 의료 사각지대를 해소하는데 큰 역할을 하고 있다는 평가다. 코로나19를 계기로 원격의료에 대한 전면적인 도입 요구가 더욱 거세질 것으로 전망된다.[[코로나發 원격의료시대]] ""여보세요. 00병원입니다. 원격의료 접수한 이민하씨 맞나요? 몸 상태는 어떠세요? 코로나19 의심증상이 있으세요?""직접 병원을 가지 않고 의사한테 진료를 받는다. 내복약 처방도 받고, 약도 택배나 대리인을 통해 수령할 수 있다. 국내에서 사실상 처음 시도되는 '비대면 원격의료 서비스'다. 정부가 '코로나19'(신종 코로나바이러스 감염증) 확산을 막기 위해 전화 진료 등 원격의료를 한시적으로 허용하면서다.'코로나19는 아닐까'. 며칠 새 두통과 콧물 같은 감기 기운이 느껴졌다. '선별진료소 갔다가 오히려 옮아오면 어떡하지?' 집에 아이가 있으니 병원에 가기 불안했던 차에 모바일 원격의료를 신청했다. 열, 기침, 호흡 등 코로나19 감염과 관련한 문진과 간단한 일반 증상까지 진료, 처방을 받을 수 있었다. 먼저 코로나19 의심증상 관련 문진표부터 작성했다. 이 과정에서 코로나19 의심증상이 심각하면 1339 콜센터로 안내를 받게 된다.접수 완료 후 'OO가정의원'이라며 '카카오톡'으로 메시지가 왔다. 본인 확인과 약을 받을 약국을 지정해달라는 요청을 받았다. 몇 분 뒤 의사한테서 전화가 왔다. 증상이나 약 부작용 여부에 대해 이것저것 물었다. 전화로 진료를 받는 과정은 생소했다. 묻고 답하는 통화가 10분가량 이어졌다. 대면 진료 때보다 시간이 길게 느껴졌다.직접 안 봐도 괜찮은 거냐고 묻자 ""직접 진찰을 하는 게 가장 정확하겠지만, 경증은 전화 상담으로도 충분하다""며 ""처방약은 쉽게 구할 수 있고, 부작용 우려도 적은 가장 보편적인 약들로만 처방한다""고 답했다.통화가 끝나자 진료비 6000원과 계좌번호가 메시지로 왔다. 결제를 하고 약국에 가니 처방약이 이미 준비돼 있었다. 다음날 오전에 담당 의사한테 다시 연락이 왔다. '오늘 상태는 어떠냐'며 경과를 물어왔다. 그는 ""코로나19 우려에 병원을 직접 방문하는 게 망설여질 수 있다""면서 ""그래도 상태가 나빠지면 병원을 방문해서 정밀 진단을 받아야 한다""고 조언했다.29일 관련업계에 따르면 국내 헬스케어 스타트업(초기 벤처기업) 오닥터, 메디히어, 굿닥, 똑닥 등이 이달 들어 원격의료·처방 서비스를 운영하고 있다. 치과 온라인 상담·예약서비스를 운영하던 오닥터가 이달 10일께 시작한 '코로나119' 원격의료의 누적 상담 신청 수는 2061건이다. 굿닥과 메디히어, 똑닥 등까지 더하면 누적 진료 수는 5000건 이상으로 추산된다. 현재 이들 스타트업과 연계해 원격의료 가능한 1차 병원 수는 150여곳이다. 정부는 지난달 24일부터 한시적으로 환자와 병원, 약국을 연결해 원격의료∙처방을 받을 수 있도록 했다. 처방약은 가까운 약국을 지정하면 원격의료를 받은 병원에서 처방전을 약국으로 발송해준다. 직접 수령하거나 택백, 대리수령이 가능하다.원격의료가 코로나19 확산 등 감염병을 막는 데 긍정적인 역할을 하고 있다는 게 대체적인 전문가들의 의견이다. 병원 내 집단감염을 막고, 상대적으로 적은 의료 인력·설비로도 많은 환자를 치료·관리할 수 있어서다.국내 5대 대형병원인 삼성서울병원·서울대병원·서울성모병원·서울아산병원·세브란스병원에서도 원격의료를 부분적으로 시행하고 있다. 현재 수도권 내 병원에서 원격의료 서비스 중인 의사는 ""기저질환이 있는 고위험군 등의 외부 이동을 최소화하고, 경증환자들의 불필요한 병원 방문을 줄이는 효과가 있다""며 ""의료진들도 병원 내 감염 우려나 업무부담을 덜 수 있어서 대체로 만족스럽다""고 말했다.코로나19 이후 전면적인 원격의료 허용에 대해서는 여전히 의견이 엇갈린다. 대한의사협회 등은 기존 1,2,3차 병원의 의료전달체계를 무너트릴 수 있다는 이유 등으로 부정적인 입장이다. 김탁 순천향대 감염내과 교수는 ""1차 병원을 중심으로 감염병 관련 의료체계를 재정비할 수 있는 점은 긍정적일 수 있지만, 정확한 진단이 필요한 상급병원까지 적용하기엔 오진 위험성 등 부작용 우려가 크다""고 말했다.이민하 기자 minhari@mt.co.kr
<저작권자 ⓒ '돈이 보이는 리얼타임 뉴스' 머니투데이, 무단전재 및 재배포 금지>",/news/news_read.nhn?article_id=0004385238&office_id=008&mode=search&query=카카오&page=1
'언택트 시대' 디지털이 돌파구<상>증권사 사활 건 승부,"의 올해 들어 새로 개설된 비대면 증권 계좌는 작년 말과 비교해 5배 이상 늘었다. 특히 이달 들어서는 22만5,000건(24일 기준)이 급증했다. 이는 다른 증권사들도 비슷하다. 29일 서울경제신문이 미래에셋대우와 NH투자증권, 한국투자증권, , 신한금융투자, 하나금융투자, 메리츠종금증권, DB투자금융, IBK투자증권, , 유진투자증권, 대신증권, 이베스트증권, KTB증권 등 13개 국내 증권사의 비대면 계좌 신규 개설 증가율을 조사한 결과 올해 1·4분기(3월 24일 기준) 비대면 계좌의 증감률은 월평균 32.9%에 달한 것으로 나타났다. 지난해 10~11월 월평균 증감률 20.52%보다 50% 이상 늘어난 수치다. 비대면 계좌의 급증은 증권의 디지털화가 이전보다 더 가파르게 진행되고 있음을 보여준다. 특히 올해는 ‘신종코로나바이러스(코로나 19)’ 확산으로 언택트(비대면) 문화가 확산되는 한편 카카오페이의 바로투자증권 인수, 토스의 증권사 설립 등 ‘테크핀’을 장점으로 하는 후발 주자들이 대거 등장하면서 기존 증권사들에 디지털 혁신은 선택이 아니라 필수가 됐다. 이 때문에 디지털 혁신이라는 화두는 올 초 증권사 CEO들의 신년사에서도 가장 앞자리를 차지했다. 증권사들의 디지털 혁신은 조직 변화에서부터 시작하고 있다. 디지털 혁신을 전담하고 주도할 조직을 설립하고 이를 통해 다양한 사업을 모색하겠다는 의도다. 일례로 NH투자증권은 2018년 디지털 전략총괄 사업부와 자산관리 사업을 지원하기 위한 디지털 솔루션 본부·디지털 영업본부를 설립했고 지난해에는 디지털 혁신본부를 신설해 속도를 이행 속도와 추진력을 한층 강화했다. 디지털 전략총괄 사업부에서는 지금까지 21개의 관련 프로젝트를 제안했으며 현재 관련 부서와 사업을 추진하고 있는 것으로 알려졌다. 한국투자증권도 지난해 말 디지털 트랜스포메이션(DT) 본부를 설립하고 신규 비지니스 모델을 개발하고 있다. 특히 올해는 각 엉업점의 정보기술(IT) 인프라와 업무 프로세스를 개선하는데 중점을 둬, 영업점 업무보고를 자동화하는 ‘로봇프로세스자동화(RPA)’를 개발하고 이를 전사에 단계적으로 적용할 예정이다. 의 디지털 혁신을 이끄는 조직은 디지털금융사업부다. SK증권은 올해를 디지털 금융 플랫폼으로의 혁신 원년으로 삼고 빅데이터 기반의 개인화 플랫폼, 산업의 경계를 뛰어넘는 협업을 통한 사업확장, 신기술 도입을 통한 지능형 상품과 서비스 개발 등을 추진하겠다는 의지다. 경쟁자로 등장한 카카오페이증권이나 토스 증권이 가진 플랫폼 파워에 대응하기 위해 고객들과의 접점을 높일 수 있는 다양한 디지털 플랫폼과 서비스 개발에도 한창이다. 미래에셋대우는 앱 하나로 은행(20개)·증권(12개)·보험(35개)·카드사(16개)의 자산과 거래 정보뿐만 아니라 국세청 현금영수증 등록 내역, 부동산 실거래가격까지 조회할 수 있는 금융 플랫폼 ‘엠올’을 선보였다. 한국투자증권은 카카오뱅크와 손잡고 기존 카카오뱅크 고객이면 별다른 추가 정보 없이 주식 계좌를 개설할 수 있는 서비스를 선보였으며 이외에도 해외주식 소수단위 투자 서비스, 온라인쇼핑 금융투자 상품권 등 다양한 디지털 혁신 금융 서비스도 차례차례 선보이고 있다. 신한금융투자도 해외주식 수수점 주식 구매 서비스와 함께 디지털 부동산 수익증권 유통 플랫폼인 카사코리아, 개인투자간 주식대차 플랫폼 디렉셔널 등 혁신금융 서비스를 제공하는 기업들과 업무협약을 맺고 사업을 추진하고 있다. 아울러 KB증권은 비대면 증권 계좌 개설 서비스의 보안성과 효율성을 더 높이기 위해 안면인식기술을 활용한 비대면 계좌개설 서비스를 하반기에 도입할 계획이며 삼성증권은 IRP(개인형 퇴직연금) 계좌도 비대면으로 개설할 수 있는 시스템을 출시했다. 증권사 한 관계자는 “수백만명 이상 수백만 명 플랫폼을 앞세운 신규 디지털 증권사들과 본격적으로 경쟁하게 되면 현재로서는 기존 증권사들이 도태될 수밖에 없다는 위기감을 심각하게 느끼고 있다”며 “디지털 혁신은 증권사의 사활을 건 승부일 수 있다”고 지적했다. /박성호기자 junpark@sedaily.com저작권자 ⓒ 서울경제, 무단 전재 및 재배포 금지",/news/news_read.nhn?article_id=0003716458&office_id=011&mode=search&query=카카오&page=1
작품 이용현황 자료 제공에블로그 예상수익 파악까지,"[서울경제] “내가 쓴 글을 누가 얼마나 재밌게 읽었을까? 책으로 내놓는다면 과연 잘 팔릴까?” 창작자라면 블로그에 쓴 여행기나 브런치에 쓴 수필이 과연 독자에게 얼마나 읽혔는지 궁금했던 순간들이 있을 것이다. 하지만 이제 플랫폼에서 맞춤형으로 데이터 분석 자료를 제공해주는 덕분에 이러한 궁금증을 해결할 수 있게 됐다.29일 정보통신기술(ICT)업계에 따르면 최근 포털 업체들을 중심으로 창작자의 작품 이용 현황을 이용자 데이터 기반으로 분석해주는 서비스들이 속속 등장하고 있다.는 성별·연령별로 독자들의 완독 현황을 분석해주는 ‘브런치북 인사이트 리포트’를 제공하고 있다. 카카오 관계자는 “단순 조회수가 아니라 독자가 콘텐츠 하나하나를 끝까지 읽는 경험이 중요하다”면서 “작가는 해당 데이터를 통해 작품의 시장에서의 잠재성을 가늠할 수 있고, 부족한 부분은 다음 작품을 준비하는 과정에서 도움이 될 수 있다”고 설명했다.이 같은 서비스 덕분에 브런치는 2015년 6월 출시 후 이용자 층을 폭넓게 확장했고, 현재 등록된 작가 수만 3만1,000여명, 출간된 도서는 2,400여권에 이른다.앞으로 브런치는 이 같은 데이터 경험을 바탕으로 신진 작가를 발굴하고 성장시키는 데 집중할 계획이다. 카카오 관계자는 “브런치는 작가 개인의 개성과 창의성을 더욱 발휘할 수 있는 플랫폼으로 거듭나고 있다”며 “작가와 독자의 접점을 늘려 비슷한 환경에서 먼저 고민했던 작가들의 인사이트를 접할 수 있는 서비스로 성장할 것”이라고 밝혔다.네이버도 블로그, 포스트 등에서 활동하는 창작자들을 대상으로 서비스 채널의 실시간 현황을 한눈에 볼 수 있는 ‘크리에이터 어드바이저’를 운영하고 있다. 조회수, 동영상 재생 수는 물론 예상수익까지 확인 가능하다. 또 네이버 검색을 통해 이용자들이 얼마나 창작자의 채널로 유입되었는지, 다른 채널에 비해서는 이용 비율이 어떤지 등을 종합적으로 파악할 수 있다.이뿐만 아니라 각종 음원 서비스들도 이용자별 음악 소비 패턴을 분석해 창작 활동을 지원하고 있다. 멜론의 경우 ‘파트너센터’를 통해 이용자 각각의 가수와 음악 장르 선호도를 분석하고, 이를 기반으로 잠재 고객을 추출해 기획사와 아티스트에게 제공하고 있다.포털 업계의 한 관계자는 “콘텐츠 데이터 분석 서비스는 창작자들이 여러 장르적 성격이나 이용자 특성 등을 종합적으로 고려할 수 있게 해준다”면서 “빠르게 변하는 트렌드에 맞춰 창작자들이 효율적으로 콘텐츠를 생산할 수 있게 할 것”이라고 말했다. /백주원기자 jwpaik@sedaily.com저작권자 ⓒ 서울경제, 무단 전재 및 재배포 금지",/news/news_read.nhn?article_id=0003716475&office_id=011&mode=search&query=카카오&page=1
"""코로나로 경제상황 참혹할 것""실효성 있는 생계비 지원 당부황교안 40조 긴급채권 제안에靑 내부선 ""현실성 부족"" 평가","◆ 긴급생활지원금 도입 초읽기 ◆
코로나19 대응 국면에서 큰 관심을 모았던 재난기본소득 지급 방안은 문재인 대통령이 30일 청와대에서 주재하는 제3차 비상경제회의에서 최종 결정된다. 4·15 총선이 불과 17일 앞으로 다가온 가운데 재난기본소득은 경제 활성화 논란은 물론이고 여야 정치권에도 민감하게 영향을 줄 것으로 보인다.문 대통령은 이번 지원대책의 명칭과 관련해서 면밀하게 검토할 것을 강조한 것으로 전해졌다. 참모들로부터 관련 보고를 받을 때 '재난기본소득' '재난수당' 같은 명칭보다는 '생계비' '생계지원금' 같은 표현이 낫다는 의견을 피력한 것으로 전해졌다. 청와대 관계자는 ""소득, 수당이라는 용어는 자칫 위기 시마다 지속적으로 지급되는 것으로 오인될 수 있다""고 말했다. 문 대통령은 지난 24일 제2차 비상경제회의를 주재한 자리에서도 생계 지원이라는 점을 강조했다. 당시 문 대통령은 ""실효성 있는 '생계 지원' 방안에 대해 재정 소요를 종합 고려해 신속한 결론을 내려달라""고 주문했다. 문 대통령은 코로나19 사태로 인한 경제적 피해와 관련해 ""무엇보다 신속하게 결정하고 과감하게 행동하라""고 여러 차례 강조했다. 문 대통령은 사태 초기부터 경제에 미칠 영향이 전례 없이 클 수 있다는 점을 우려하며 이런 점을 강조했다고 한다. 문 대통령은 ""코로나19로 경제 상황이 참혹할 것""이라며 ""그에 맞는 경제 대책을 세워야 한다""고 말한 것으로 알려졌다. 지난주 제2차 비상경제회의에서 예상을 뛰어넘은 100조원의 지원책이 나온 것은 이런 분위기가 반영된 것이다. 청와대는 국민이 이번 정책을 좀 더 쉽게 받아들일 수 있는 작명도 고민한 것으로 알려졌다. 이런 차원에서 '코로나페이' 등이 하나의 안으로 보고된 것으로 전해졌다. '제로페이' '카카오페이' 등이 국민에게 익숙하다는 점에서 이런 안이 제시됐다.한편 문 대통령은 황교안 미래통합당 대표가 40조원 규모 긴급구호자금 투입을 위한 채권 발행을 제안한 것과 관련해 ""우리 정부는 야당이라도 좋은 제안을 해오면 검토할 것""이라고 밝혔다고 강민석 청와대 대변인이 전했다. 지난 26일 황 대표 제안에 대해 ""(황 대표 측이) 구체적인 방안을 제시하면 검토해보겠다""고 밝힌 데 이어 또다시 부연 설명을 한 것이다. 문 대통령이 이같이 두 차례 반응을 보인 것을 두고 황 대표 제안을 받아들인 것 아니냐는 해석이 나왔다. 하지만 청와대 내부에서는 현실성이 없다는 분석이 더 우세한 것으로 알려졌다. 청와대는 아직까지 황 대표 측으로부터 구체적인 안을 전달받은 것이 없다고 밝혔다. 이와 관련해 청와대 관계자는 ""누구든 좋은 제안을 해올 때 검토하겠다는 원론적인 입장을 표한 것""이라고 말했다. 황 대표가 구체적인 안을 제시하지 않으면서 정치적 공세를 펴는 것에 대해 선을 그은 의미도 있다는 설명이다.
[박용범 기자] [ⓒ 매일경제 & mk.co.kr, 무단전재 및 재배포 금지]",/news/news_read.nhn?article_id=0004546358&office_id=009&mode=search&query=카카오&page=1
,"[서울경제] 이번 주 증권사들은 신종 코로나바이러스 감염증(코로나19) 확산에도 실적 방어력이 높을 것으로 예상되는 ·카카오 등을 추천주로 꼽았다. · 등 최근 주가 낙폭이 과도하다고 판단된 종목들도 추천주 명단에 넣었다. 29일 유안타증권은 엔씨소프트·카카오·SK하이닉스를 주간 추천주로 제시했다. 엔씨소프트는 리니지2M 흥행과 리니지M 매출 유지에 힘입은 실적개선 가능성이 추천 이유로 꼽혔다. 카카오에 대해선 “카카오플랫폼에 기반한 모빌리티·카카오페이(증권)·카카오뱅크 실적 개선이 나타날 것”이라며 “커머스·웹툰·게임·모바일금융 등 언택트 사업 지속성장의 주도주”라고 평가했다.아울러 유안타증권은 SK하이닉스 주가가 저평가돼 있다는 해석을 내놓았다. 예상 주당순자산(BPS) 기준 주가순자산비율(PBR)이 0.9배 수준으로 지난 10년 메모리반도체 다운사이클 당시 최저점(0.9배)과 같은 수준이기 때문이다. 스마트폰·PC를 중심으로 수요둔화 우려가 크지만 메모리반도체 가격이 꾸준히 오르고 있는데다 글로벌 고객사의 데이터 센터 구축이 오히려 활발해지고 있어 메모리반도체 실적 감소가 제한적일 것이라는 분석도 덧붙였다.하나금융투자는 하나금융지주를 추천주 명단에 올렸다. 연초보다 주가가 30% 이상 하락하면서 배당 매력이 높아졌다는 이유에서다. 하나금융투자에 따르면 하나금융지주의 예상배당수익률이 8.84%에 달한다. SK증권은 과 를 추천했다. 우선 코아스템에 대해선 “자가 골수 유래 중간엽 줄기세포를 이용한 난치성 질환 의약품 개발 전문기업”이라며 “2014년 세계 최초로 루게릭병 치료제인 ‘뉴로나타-알’ 개발 및 판매를 시작했다”고 소개했다. 아울러 SK증권은 케이엠더블유에 대해 “주파수 필터의 압도적 경쟁력은 여전히 유효하다”며 “5세대(5G) 통신 확산 시 직접적 수혜가 가능하다”고 설명했다./심우일기자 vita@sedaily.com저작권자 ⓒ 서울경제, 무단 전재 및 재배포 금지",/news/news_read.nhn?article_id=0003716520&office_id=011&mode=search&query=카카오&page=1
