head,text,url
"마스크앱 출시 전 마스크 완판 약국 비율 67.9%출시 후 2만1537개 중 1만8616개 약국이 완판정부, 포털 등 100개 이상 서비스 통해 정보 제공NIA, 국가별 출입국 상황 등 2차 데이터 개방 예정","[서울=뉴시스] 이재은 기자 = 정부가 지난 10일 마스크 재고 현황을 알려주는 애플리케이션(앱) 서비스를 지원하면서 구매자들의 구입 편의성이 높아진 것으로 나타났다.23일 과학기술정보통신부에 따르면 공적 마스크를 모두 판매한 약국의 비율이 서비스 제공 이전인 10일에는 67.9%였으나, 제공 이후에는 재고가 있는 약국을 찾아가 구매하는 사람이 많아져 21일에는 86.4%로 크게 증가했다.즉, 서비스 지원 이후 공적 마스크를 판매한 약국 2만1537개 중 1만8616개 약국이 모두 판매한 것이다.앞서 정부는 지난 10일 마스크 재고 현황을 알려주는 앱 서비스 지원을 위해 민간에 공적 마스크 판매 데이터를 개방했다. 이에 네이버와 다음 등 주요 포털과 마스크알리미, 마스크스캐너, 마스크사자 등 민간 앱 개발사들은 11일 오전부터 공적 마스크 재고현황 서비스를 제공하고 있다.과기정통부는 관계기관 및 민간과 협력해 공적마스크 판매데이터를 공개한 이후 현재까지 100개를 상회하는 다양한 서비스를 통해 판매정보가 제공되고 있다고 밝혔다.학생·일반인 등 시민참여 개발자, 스타트업 등이 초기 기획단계에서부터 참여하여 정보서비스를 신속히 개발했고, 국내 포털사인 네이버, 카카오와 클라우드 기업 KT, NHN, 코스콤, NBP 등도 지도데이터, 개발도구 등 필요한 자원을 무상지원하고 있다.아울러 부산광역시·경상남도를 비롯한 18개 지자체에서도 지역 주민을 위해 마스크 판매정보 서비스를 제공하고 있다.한편 마스크앱이 점차 안정화되는 상황에서 정부는 이번주 중 코로나19 관련 2차 데이터 개방을 할 예정이다.앞서 문용식 한국정보화진흥원장은 지난 17일 ""마스크 맵이 안정화되는 대로 코로나19 관련 2차 데이터 개방 작업에 들어갈 것이다. 확진자 통계, 목록, 방역대상 장소, 선별진료소 목록, 국민안심병원, 방호용구 배포처 등 코로나 대응상황을 종합적으로 파악하는 데에 도움이 되는 데이터를 추가로 개방하겠다""고 밝힌 바 있다. 이에 한국정보화진흥원(NIA)은 이번주 중에 코로나 대응상황을 종합적으로 파악하는 데이터를 추가로 개방하겠다고 밝혔다.NIA 관계자는 ""현재 행안부, 관계기관과 협의하고 있다. 이번주에 구체화될 것으로 보인다""며 ""시민개발자들이 국민들이 퇴원자 통계, 국가별 출입국 허용 상황 등 코로나 정보를 한눈에 볼 수 있게끔 개발될 것 같다""고 설명했다. lje@newsis.com<ⓒ 공감언론 뉴시스통신사. 무단전재-재배포 금지>",/news/news_read.nhn?article_id=0009772834&office_id=003&mode=search&query=카카오&page=6
,"최근 국내의 많은 기업들이 해외 진출하면서 외국 기업들과 분쟁에 휘말리는 경우가 종종 있다. 국내에서 소송을 해도 어려운데 외국간 분쟁은 더 복잡하고 어려운 절차들이 따르게 마련이다. 특히 영미권 국가의 기업들과 분쟁에서는 이디스커버리(eDiscovery, 전자증거개시)를 준비해야 한다. 이디스커버리는 미국 등 영미권 국가의 소송 제도로, 상대방이나 제3자로부터 소송에 관련된 정보를 얻거나 사실을 밝혀내기 위해 변론기일 전에 진행되는 사실 확인 및 증거수집 절차인 증거개시 제도로 전자문서를 포함한다. 해외 진출 기업이 분쟁에 휘말렸을 때 필수적으로 수행해야 하는 절차이다. 그런데 생소한 제도를 이해하는 것부터, 실제 규정에 맞게 데이터를 처리하고 분석해 최종적으로 법정에 제출하는 단계까지 복잡하고 어려운 일들이 많다.국내 기업이 이디스커버리에 대응 시 가장 곤란함을 느끼는 부분은 ▲ 데이터를 수집, 분석하고 때로는 번역하는데 소요되는 막대한 비용 부담 ▲데이터 처리 시 한국어로 된 문서 및 hwp, 카카오톡 메신저 파일 등 국내 전용 확장자 분석에 대한 오류 ▲데이터 준비 과정에서 발생할 수 있는 기업 기밀 유출 위험 ▲한국 – 미국간 거리와 시차 등으로 인한 즉각적인 대응의 어려움 등이다.그러나 이디스커버리 전문 파트너와 함께 하면 어려움을 해결할 수 있다. 여러 기업 중 프론테오는 이디스커버리 및 데이터분석 소프트웨어 개발사이자 서비스 제공사로, 전 세계 5개국에 13개의 오피스를 운영하고 있어 기업들에 주목받고 있다. 126건이 넘는 인공지능 및 데이터 분석 특허 기반의 전문 소프트웨어 및 서비스 역량을 바탕으로 이디스커버리, 내부조사, 사법조사 등의 법률조사 분야에서 15년간 9300건 이상의 프로젝트 수행 경험이 있다. 한국에서만 500건이 넘는 소송 및 조사를 지원했다.프론테오는 다양한 프로젝트 수행 경험을 통해 축적한 전문 기술 및 서비스 역량이 녹아든 원스톱 솔루션이다. 독자 개발한 인공지능 기반의 소프트웨어를 활용해 시간과 비용을 절감하고 한국어 등 2byte 언어 처리에 특화된 소프트웨어 사용으로 데이터 처리의 정확도를 높이고, 국내 전용 확장자도 오류 없이 분석할 수 있다.특히 인공지능을 활용한 소프트웨어가 증거와의 연관성이 높은 문서만 선별한 후 기준 이하의 자료는 없애고 대상문서의 수를 줄여 시간과 비용을 절감하면서도 퀄리티와 적법성은 유지한다. 국내 보안인증 ISO27001을 획득한 국내 전용 데이터 센터 운영으로 정보 유출을 최소화하고 한국-미국 듀얼 PM 지원으로 24/7 즉각적인 업무 대응이 가능하다.이향선 전자신문인터넷기자 hyangseon.lee@nextdaily.co.kr",/news/news_read.nhn?article_id=0002874135&office_id=030&mode=search&query=카카오&page=6
,"◆ 창간 54 혁신금융 ◆
현대해상이 올해 디지털 신기술을 활용한 업무 효율성 강화와 신성장 동력 확보 전략 등을 추진한다. 디지털 전담 부서를 본부로 승격해 금융산업 전반에 걸친 디지털 환경 변화에 대해 적극 대응에 나선다.
현대해상은 디지털 기술을 활용한 업무 자동화와 손해율 절감을 통해 가시적 성과를 내고 있다. 로봇 프로세스 자동화(RPA·Robotic Process Automation), 음성 텍스트 변환(STT·Speech To Text), 스크래핑 등 디지털 신기술을 활용한 업무 자동화를 통해 업무 효율성을 높였다. 업무 자동화 기술인 RPA 도입으로 월 4600시간을 절감했으며, 이를 통해 담당자는 다른 업무를 수행하도록 지원하고 있다. 현재 사내 혁신 제도를 활용해 현대해상과 소속 자회사에 적용 중이다. 또 현대해상은 AI·빅데이터를 활용한 업무 대체와 손해율 절감을 위해 노력하고 있다. 지정대리인제도를 통해 업계 최초로 상담사 수준의 인공지능(AI) 음성봇을 통해 한번에 보험계약 대출과 완전판매 모니터링 서비스를 제공할 예정이다. 이 밖에도 AI를 활용해 장기보험 지급 업무를 효율화하고 보험업 핵심 업무에 도입한다. 특히 자사 플랫폼 개발을 통해 맞춤형 건강관리 서비스 '하이헬스챌린지'를 자사의 모든 건강보험 상품 신규 가입자에게 제공하고 있다. 이 서비스는 글로벌 건강관리 전문기업 '눔'과 제휴해 고객에게 건강관리 코치를 1대1로 배정하고 자체 애플리케이션을 통해 채팅 형태로 건강관리 상담을 해주는 것이다. 현대해상은 디지털 생태계를 활용함으로써 신성장 동력 토대를 마련하고 있다. 네이버, 카카오 등 정보통신기술(ICT) 관련 기업과 협업해 AI, 빅데이터, 헬스케어 등 디지털 신기술의 보험업 접목 가능성을 적극적으로 검토하고 있다. 현대해상은 네이버와 업무협약을 체결해 자사 모바일 건강관리 서비스 '하이헬스챌린지'를 네이버 AI 플랫폼 '클로바'와 연계해 고객이 쉽게 이용할 수 있도록 제공할 계획이다. 현대해상은 플랫폼 사업을 추진 중인 다양한 스타트업과 제휴·협업을 통해 사업 영역을 확대한다. [한상헌 기자] [ⓒ 매일경제 & mk.co.kr, 무단전재 및 재배포 금지]",/news/news_read.nhn?article_id=0004542443&office_id=009&mode=search&query=카카오&page=6
,"◆ 창간 54 혁신금융 ◆
JB금융그룹은 혁신 금융 활성화를 위해 디지털 금융에 앞장서고 있다. JB금융은 계열사인 광주은행과 전북은행을 중심으로 '오픈뱅킹'을 추진하고 해외 진출을 확대할 계획이다.
광주은행과 전북은행은 비대면 채널 고도화와 자동화 로봇 기능(RPA), 로보어드바이저, 챗봇 등 디지털 사업을 강화하고 있다. 특히 광주은행은 해외 송금 제휴 서비스를, 전북은행은 개인 간 거래(P2P) 제휴 서비스를 진행하고 있다. JB금융은 카카오뱅크에 코어뱅킹 시스템을 제공하고 핀테크 기업들과 공동 사업모델을 개발하는 등 디지털 금융 사업을 확장하고 있다. 지난해 7월 핀테크 기업 더존비즈온과 JB금융은 중소·중견기업 맞춤형 디지털 금융서비스를 제공하는 양해각서를 맺었다. 두 회사는 더존비즈온의 '위하고' 플랫폼으로 맞춤형 뱅킹·금융 서비스를 제공할 계획이다. 위하고를 이용하는 기업은 기존 거래 은행의 뱅킹 서비스 없이 주요 금융 거래를 할 수 있게 된다. 위하고에서 기업들이 각종 대금 지급을 하도록 펌뱅킹과 가상계좌 서비스도 제공한다. JB금융은 위하고 이용 기업뿐만 아니라 각 기업 임직원을 대상으로 금융 편의 서비스를 제공하는 사이버 지점도 선보일 예정이다.광주은행은 지난해 9월 토스와 함께 '대출 금리 비교 서비스'를 선보였다. 대출 신청 고객은 시간을 줄이고, 보다 저렴한 금리의 대출 상품을 이용할 수 있다.[이새하 기자] [ⓒ 매일경제 & mk.co.kr, 무단전재 및 재배포 금지]",/news/news_read.nhn?article_id=0004542436&office_id=009&mode=search&query=카카오&page=6
,"◆ 창간 54 혁신금융 ◆
DB손해보험은 올해 전문 영상상담 서비스와 모바일을 통해 혁신금융 흐름을 선도한다는 계획이다.DB손해보험은 업계 최초로 직접 면담하지 않고 고객, 정비업체와 고화질 영상전화 통화망으로 상담할 수 있는 서비스를 출시했다. DB손해보험은 사고현장 출동요청 서비스의 주요 불만 사항 중 하나였던 '지연 출동' 문제를 해소하고, 요청 시 보상전문가가 즉시 고객을 응대하고 상담할 수 있는 서비스를 제공해 고객만족도를 향상하는 데 중점을 뒀다. 이번 영상상담 서비스 구축 프로젝트는 '다드림아이앤에스'와 협력해 추진했다. 이 회사는 통신사와 직접 연동해 LTE·5G 기반의 고화질 영상통화 기능을 제공하는 시스템 전문업체다.
이번 영상통화 시스템은 단순한 사고임에도 사고 현장 출동을 요청하는 고객을 대상으로 사고처리 전문가인 보상직원이 직접 상담과 안내를 제공한다. 이를 통해 현장 정보 수집과 초기 조치에 소요되는 시간을 획기적으로 단축하고 사고로 인한 교통 혼잡을 해소하는 것에도 도움이 된다는 설명이다. 수리를 위해 입고된 피해 차량 확인에도 활용이 가능해 파손부위 확인 등을 위해 소요되는 업무의 효율을 높이며 동시에 수리기간 단축에도 기여할 것으로 예상된다. 직접 면담하지 않고도 영상통화를 활용해 양질의 서비스를 제공한다는 점에서 최근 코로나19 사태로 인한 사고처리 고객들의 불안감도 해소할 수 있을 것으로 보인다. 이 서비스는 산업통상자원부 주관 전국품질분임조 경진대회에서 혁신제품에 주어지는 대통령상 금상을 수상한 바 있다. DB손보는 지난해부터 다이렉트로 자동차보험에 가입하는 고객들의 편의를 위해 국내 최대 사용자를 가진 모바일 플랫폼인 카카오톡을 통해 다이렉트 자동차보험에 가입하는 'DB다이렉트 톡' 서비스를 제공해왔다. DB다이렉트 톡은 업계 최초로 선보였던 상담 서비스다. 고객들은 DB다이렉트 톡 '카카오톡 플러스친구' 채팅창을 통해 다이렉트 자동차보험의 신규 가입이나 갱신 가입을 편리하게 이용할 수 있다.
[한상헌 기자] [ⓒ 매일경제 & mk.co.kr, 무단전재 및 재배포 금지]",/news/news_read.nhn?article_id=0004542444&office_id=009&mode=search&query=카카오&page=6
,"◆ 창간 54 혁신금융 ◆
한국투자증권은 급변하는 금융환경 속에서 혁신을 거듭하며 디지털 금융 지원에 전사 역량을 집중하고 있다. 이를 달성하기 위한 경영 전략으로 '디지털 트랜스포메이션(DT)'을 제시했다. 혁신 금융을 통해 새로운 10년을 위한 초석과 기틀을 단단히 다져나가기 위해서다. 한국투자증권은 미래 먹거리 발굴과 혁신 금융 서비스 개발을 위해 지난해 말 전사 디지털 혁신 가속을 위한 DT본부를 신설했다. DT본부는 빅테이터 기반 인공지능(AI) 산업에 대비해 새로운 비즈니스 모델을 개발하고 사용자 중심의 첨단 금융서비스를 선보일 계획이다. 이와 함께 내부적으로 디지털 시대에 맞춘 업무 프로세스 혁신 업무도 담당한다. 취임 초부터 계열사 간 시너지와 디지털금융 경쟁력 제고를 추진해온 정일문 한국투자증권 사장은 올해 신년사에서도 ""밀레니얼 세대가 본격적으로 금융 소비자층으로 유입되는 것에 대비해야 한다""며 ""리테일그룹과 DT본부, IT본부를 중심으로 관련 상품 및 플랫폼 개발에 역량을 집중해야 한다""고 강조했다. 실제 한국투자증권은 지난해부터 디지털 플랫폼과의 가시적인 시너지 성과를 내고 있다. 인터넷전문은행 카카오뱅크와 손잡고 선보인 주식 계좌 개설 서비스는 단기간에 100만계좌를 돌파했다. 카카오뱅크 연계 계좌는 소셜네트워크서비스(SNS) 플랫폼의 영향력을 활용하는 한편, 기존 고객 정보만으로 주식 계좌 개설이 가능해 고객 편의성을 극대화한 것이 특징이다.
지난해에는 금융위원회가 선정하는 혁신 금융서비스에 10월과 11월 2차례 연속 지정되는 쾌거를 거뒀다. 혁신 금융서비스는 정보기술의 접목, 이종 산업과의 융합을 통해 차별성과 시장성을 갖추고 있다고 평가되는 새로운 금융서비스다. 금융 혁신 지원 특별법인 일명 '금융규제 샌드박스'에 따라 금융위 혁신심사위의 심사를 거쳐 지정되며 규제를 받지 않고 일정 기간 해당 서비스를 영위할 수 있는 특례가 주어진다. 한국투자증권의 '혁신 금융서비스'인 '해외 주식 소수 단위 투자 서비스'와 '온라인쇼핑 금융투자상품권'은 상반기 중 출시를 앞두고 있다. 해외 주식 소수 단위 투자 서비스는 그동안 1주 단위로만 구매할 수 있었던 해외 주식을 소수 여섯째 자리까지 나눠서 사고팔 수 있는 서비스다. 금융투자상품권 서비스를 통해서는 주식·펀드 등 금융상품을 살 수 있는 상품권을 SNS나 오픈마켓 등 온라인 플랫폼에서 쉽게 주고받을 수 있다. [김기철 기자] [ⓒ 매일경제 & mk.co.kr, 무단전재 및 재배포 금지]",/news/news_read.nhn?article_id=0004542462&office_id=009&mode=search&query=카카오&page=6
,"◆ 창간 54 다시 뛰는 기업 ◆
올해로 카카오톡 메신저 출시 10주년을 맞는 카카오는 메신저 기반 서비스를 넘어 모빌리티, 금융, 콘텐츠 등 맞춤형 생활밀착 서비스를 제공하는 종합 플랫폼으로 진화하고 있다. 특히 올해는 누적 가입자 3000만명을 보유한 '카카오페이'를 기반으로 은행·주식·보험 등 금융 전 분야에 걸친 서비스 확대로 국내 대표 테크핀(TechFin) 기업으로 도약한다는 계획이다.김범수 카카오 의장은 지난 18일 카카오톡 출시 10주년을 맞아 미래 구상에 대한 뜻을 밝혔다. 김 의장은 ""(지난 10년은) 시스템이 아닌 문화가 일을 한다는 믿음을 가지고 자기 주도적으로 일할 수 있는 환경이 구축될 수 있도록 많은 공을 들였다""고 소회했다. 김 의장은 '사회문제 해결'이라는 화두를 들고 나왔다. 그는 ""사회문제를 해결하는 가장 효율적인 조직이 '기업'이라고 생각한다""며 ""급격히 발전하고 있는 기술과 우리만의 문제 해결 방식으로 사람들이 어려움을 겪고 있는 많은 사회문제를 카카오 시즌2에 하나씩 해결해 나가자""고 강조했다.'사회문제 해결'은 이미 코로나19 사태에서 빛을 발하고 있다. 카카오는 카카오톡 #탭과 포털 다음을 통해 '코로나19 현황판'을 운영하고 있다. 13년 차 온라인 기부 플랫폼(포털 '다음 희망모금'이 전신)인 '카카오같이가치'도 지난 19일 기준 코로나19 관련 22개 모금함에 77만명이 참여하며 기부금 22억여 원이 모인 상태다. 분야를 세부적으로 살펴보면 '생활밀착형' 서비스로 자리매김한 모빌리티는 '전기자전거 시범 사업' '11인승 승합차 택시 서비스' 등을 연내 안착시켜 간다는 계획이다. 카카오모빌리티는 현재 자회사 티제이파트너스를 통해 진화택시 등 법인택시들을 인수했다. 890여 개 면허를 기반으로 11인승 승합차 택시 서비스 '벤티' 사업을 연내 본격 확대할 전망이다.
 전기자전거 시범 서비스도 시작했다. 카카오T바이크 서비스를 신설하고 인천 연수구와 경기도 성남시에 전기자전거 3000대를 운행 중이다. 또 한국철도공사와 손잡고 카카오 T앱에서 KTX 등 기차표에 대해 실시간 예매 가능 현황을 확인하고 구매, 결제, 발권까지 원스톱으로 가능하게 할 예정이다. 둘째로, 콘텐츠 분야에서는 카카오페이지·카카오M으로 이어지는 지식재산권(IP)과 제작 선순환을 이뤄내고 있다는 평가다. 카카오M은 상반기에 '톡tv'를 내놓으며 영상 콘텐츠에도 주력할 계획이다. 카카오페이지는 작년 4분기 국내 거래액이 700억원을 돌파하며 역대 최대 거래액을 기록했다. 2018년 웹툰·웹 소설 회사 삼양씨앤씨·다온크리에이티브·제이코믹스를 인수했고, 인도네시아 콘텐츠 기업 네오바자르를 인수하면서 동남아시아 시장에 진출했다. 올해는 대만, 태국, 중국까지 사업 확장을 준비해 K콘텐츠를 글로벌로 확대하겠다는 포부다. 카카오는 공연제작사 '쇼노트'를 인수했고, 20분 내외의 쇼트 폼(short-form) 콘텐츠를 주력으로 하는 모바일 방송을 선보일 예정이다. 실시간 방송, 모바일 드라마, 모바일 예능을 핵심 상품으로 다룬다.
무엇보다 카카오는 올해 '금융 분야'에서 생활금융 플랫폼을 만드는 데 가장 사활을 걸 전망이다. 2017년 인터넷전문은행인 카카오뱅크 출범 이후 올해는 카카오페이가 인수한 바로투자증권이 카카오페이증권으로 첫발을 내디뎠다. 지난달 출범한 카카오페이증권은 카카오페이와 연동해 '카카오페이 투자' 서비스에 펀드 상품을 오픈하는 등 상품 포트폴리오를 다각화할 예정이다. 로보어드바이저를 활용한 비대면 기반 자산관리 서비스와 함께 카카오페이의 빅데이터·인공지능(AI) 기술 기반으로 투자 경험이 부족한 사용자들도 쉽게 수익을 얻을 수 있도록 투자 서비스를 내놓는다는 계획이다. 소수에 편중돼 있던 자산관리 서비스도 누구나 경험할 수 있도록 '투자·자산관리 대중화'를 이끌어간다는 방침이다.카카오페이는 삼성화재와 함께 디지털 손해보험사 설립을 위한 막바지 작업도 진행하고 있다. 이달 중 금융위원회에 예비인가가 예고돼 있다. 카카오의 정보기술(IT)과 삼성화재의 보험사업 역량을 결합해 디지털 보험 컨소시엄을 추진하는 것이다. 이 같은 보험업 진출의 일환으로 카카오페이는 작년에 인슈어테크 플랫폼 스타트업 '인바이유'를 인수하고 '카카오페이 간편보험'을 출시했다.[홍성용 기자] [ⓒ 매일경제 & mk.co.kr, 무단전재 및 재배포 금지]",/news/news_read.nhn?article_id=0004542514&office_id=009&mode=search&query=카카오&page=6
