head,text,url
"앱애니, '2020년 상위 퍼블리셔 어워드' 자료 발표","[서울=뉴시스] 이진영 기자 = 작년 전세계에서 가장 높은 수익을 낸 52개의 모바일 앱 퍼블리셔 52곳 가운데 국내 기업은 4곳이 이름을 올렸다. 넷마블(6위), 엔씨소프트(20위), 게임빌(39위), 카카오(48위) 등 순이다.
모바일 데이터 및 분석 플랫폼인 앱애니는 24일 ‘2020년 상위 퍼블리셔 어워드' 자료를 통해 이같이 발표했다. 앱애니에 따르면 1위는 중국의 텐센트로 집계됐다. 이어 2위 넷이즈(중국), 3위 액티비전 블리자드(미국), 4위 슈퍼셀(핀란드), 5위 반다이남코(일본) 등 순이다. 올해 6위를 차지한 한국의 게임사 넷마블은 2015년부터 5년 연속 상위 10권 내에 들었다. 단 지난해 5위보다는 순위가 한 계단 하락했다. 넷마블 이승원 대표는 ""지난해 일곱개의 대죄: 그랜드 크로스, 더 킹 오브 파이터즈 올스타, 쿵야 캐치마인드, BTS월드 등 다양한 장르의 신작이 차별화된 게임성으로 글로벌 시장에서 긍정적 성과를 거뒀다""며 ""올해는 A3: 스틸얼라이브, 세븐나이츠 레볼루션, 제2의 나라: 크로스월즈, 스톤에이지M(가제) 등 자사 및 글로벌 유명 IP 기반의 다양한 대작으로 글로벌 경쟁력 강화에 더욱 집중할 것""이라고 말했다. 지난해 모바일 게임의 전세계 매출은 860억 달러로 전체 모바일 앱 매출의 72%를 차지했다. 실제 이번 순위에도 1위부터 9위까지 게임사가 차지했다. 게임 외 소셜 네트워크와 비디오 스트리밍 서비스를 제공하는 퍼블리셔들의 성장도 눈에 띈다. 작년 비게임 앱 중 소비자 지출 1위를 차지한 데이팅 앱 ‘틴더(Tinder)’의 모회사인 IAC(InterActiveCorp)가 2018년보다 2단계 상승한 10위를 기록했다.
중국판 넷플릭스로 불리는 비디오 스트리밍 플랫폼 ‘아이치이(iQiyi)’가 계열사로 있는 중국 최대 검색 업체 바이두(Baidu)는 18위로 조사됐다. 넷플릭스(Netflex)는 24위를 차지했다. mint@newsis.com<ⓒ 공감언론 뉴시스통신사. 무단전재-재배포 금지>",/news/news_read.nhn?article_id=0009773941&office_id=003&mode=search&query=카카오&page=4
,"[정오뉴스]어제는 양 시장의 매도 사이드카가 발동됐었지만 오늘은 양 시장이 폭등하면서 오전 장에 매수 사이드카가 발동되기도 했습니다.코스피, 코스닥 모두 미 연준의 무제한 양적 완화 소식에 힘입어 급반등하는 화요일 장입니다.이 시각 현재 코스피는 어제보다 92.40포인트 상승한 1574.86포인트로, 코스닥은 25.97포인트 오른 469.73포인트로 움직이고 있습니다.투자주체별 매매 동향을 보면 거래소 시장에서는 약 한 달 반 만에 외국인과 기관의 동반 매수세가 들어오고 있습니다.지난밤 뉴욕 증시는 연준의 무제한 양적 완화에도 미국 정부의 부양책에 대한 불확실성이 지속되면서 하락마감했습니다.시가총액 상위 종목 살펴보면 90위 종목까지 모든 종목이 오르고 있는 가운데 대장주인 삼성전자가 외국인과 기관 매수에 힘입어 7% 넘게 오르고 있고, 카카오가 금융 플랫폼 업체로 발돋움할 것이라는 분석에 힘입어 강세를 보이고 있습니다.업종별로는 전 업종이 상승하고 있고 전기전자업종은 9% 가까운 가장 큰 수익률을 기록 중에 있습니다.이 시각 현재 중국 증시는 상승하고 있고 일본 증시 또한 오르고 있습니다.지금까지 삼성증권이었습니다.김민재/삼성증권 기자 [저작권자(c) MBC (https://imnews.imbc.com) 무단복제-재배포 금지]Copyright(c) Since 1996, & All rights reserved.",/news/news_read.nhn?article_id=0001025315&office_id=214&mode=search&query=카카오&page=4
온라인쇼핑 증가로 지급결제대행 규모 지난해도 성장간편송금서비스 하루 평균 2184억원,"[서울신문]코로나19 영향으로 언택트(비대면) 소비가 주목받는 가운데 지난해에도 온라인쇼핑의 증가로 전자지급결제대행서비스 규모가 커진 것으로 나타났다. 또 토스, 카카오페이 등 스마트폰을 이용한 간편송금 서비스의 하루평균 이용금액은 1년 만에 두 배 넘게 늘었다.한국은행이 24일 발표한 ‘2019년중 전자지급서비스 이용 현황’에 따르면 지난해 전자지급결제대행(PG) 서비스 이용금액은 하루 평균 5467억원으로 1년 전보다 26.2% 증가했다. 이용 건수는 39.3% 늘어난 1200만건으로 집계됐다. PG는 전자상거래에서 구매자에게 받은 대금이 판매자에게 지급될 수 있도록 지급결제 정보를 송수신하는 서비스다. 온라인쇼핑이 늘어나면 PG 서비스 이용 규모도 커진다.스마트폰에 충전한 선불금을 전화번호나 소셜네트워크서비스(SNS) 등을 활용해 송금하는 간편송금 서비스는 이용금액이 하루 평균 2346억원으로 집계됐다. 1년 전보다 124.4% 증가한 수치다. 이용 건수는 249만건으로 76.7% 늘었다. 토스, 네이버페이, 카카오페이 등 전자금융업자가 제공하는 간편송금 서비스의 이용금액 2184억원으로 전체의 90% 이상을 차지했다.아울러 공인인증서 없이도 비밀번호 등을 이용해 결제하는 간편결제 서비스도 성장세가 지속됐다. 카카오페이, 네이버페이 등 정보·통신 분야뿐 아니라 SSG 페이 등 유통·제조 분야 간편결제 서비스도 이용건수와 금액이 모두 증가한 것으로 나타났다. 지난해 전체 간편결제 이용금액은 하루 평균 1745억원으로 전년보다 56.6% 늘었다. 하루 평균 이용 건수는 44.0% 증가한 602만건으로 조사됐다.홍인기 기자 ikik@seoul.co.kr▶
▶
▶ⓒ 서울신문(www.seoul.co.kr), 무단전재 및 재배포금지",/news/news_read.nhn?article_id=0003076416&office_id=081&mode=search&query=카카오&page=4
▶ 헉! 소리나는 스!토리 뉴스 [헉스]▶ '아는 척'하고 싶은 당신을 위한 [두유노우]▶ 한눈에 보는 [4·15총선 NEWS MAP],"[파이낸셜뉴스]
토스와 카카오페이등의 인기가 높아지면서 지난해 간편송금서비스 일평균 이용금액이 2300억원을 넘으며 전년대비 124%의 성장률을 나타냈다.
 24일 한국은행이 발표한 '2019년중 간편결제·간편송금서비스 이용 현황'에 따르면 지난해 간편송금서비스 이용실적은 일평균 249만건, 2346억원으로 전년대비 각각 76.7%, 124.4% 증가했다.
 이는 토스, 카카오페이를 비롯한 시장 점유율이 높은 대형 전자금융업자의 서비스 이용 규모 확대가 영향을 미쳤기 때문이다.
 간편결제서비스 일평균 이용실적도 602만건, 1745억원으로 전년 대비 각각 56.6%, 44.0% 증가했다.
 부문별로 보면 삼성이나 롯데 등 유통·제조기업이 제공하는 각 페이(간편결제) 일평균 이용 건수는 490만건으로 55.1%, 이용금액은 1389억원으로 43.3% 증가했다. 네이버나 카카오 등 정보·통신기업이 제공하는 페이 이용 건수도 120만건으로 63.0%, 이용금액은 357억원으로 47.0% 각각 늘었다.
 온라인 쇼핑의 확대로 전자지급결제대행서비스(PG) 역시 일평균 이용 건수와 금액은 1204만건, 5467억원으로 전년 대비 각각 39.3%, 26.2% 증가했다.
 미리 충전한 선불금으로 교통요금, 상거래 대금을 지급하거나 송금할 수 있도록 선불금을 발행하고 관리하는 선불전자지급서비스는 일평균 1890만건, 2979억원으로 각각 15.8%, 108.9% 증가했다.
 한편 시장이 확대되면서 지난해말 기준 전자지급서비스 제공회사는 총 158개로 늘었다. 이중 전자금융업자는 132개, 금융기관은 26개로 조사된 가운데 전자금융업자는 2019년 중 32개 업체가 신규로 등록하고 2개 업체가 말소돼 전년말 대비 30개 증가했다.



 ※ 저작권자 ⓒ 파이낸셜뉴스. 무단 전재-재배포 금지",/news/news_read.nhn?article_id=0004395465&office_id=014&mode=search&query=카카오&page=3
코로나19發 대출사기 '주의보'…앱 설치 금물금감원·금융소비자연맹 잇따라 보이스피싱 주의보,"(서울=뉴스1) 김도엽 기자 = #1. A씨는 지난 22일 평소 잘 알고 지내던 지인 B씨로부터 '링크 클릭하고 마스크 10장 구매하면 돼'라는 문구와 함께 마스크를 대량 구매할 수 있는 기회라며 애플리케이션(앱) 설치 링크를 카카오톡 메시지로 받았다. A씨는 의심없이 들어가보려던 찰나 B씨가 친구 등록이 돼있지 않은 사용자임을 확인하고 사기임을 직감했다. 이후 전화로 B씨에게 물어보니 해킹을 당한 뒤였고 최근 접속 IP도 중국에서 발생한 상태였다.#2. C씨는 최근 한 금융그룹을 사칭한 곳으로부터 '함께 이겨내요! 코로나19'라는 대출안내 문자를 받았다. 최대 2억3000만원까지 2.8%부터 고정금리로 대출해준다는 안내였다. 저축은행에서 고금리 대출을 받고 있던 C씨는 이에 혹해 저금리 대출로 대환하고자 연락을 취했다가 5000만원 상당의 사기 피해는 물론 개인정보 유출까지 당했다.신종 코로나바이러스 감염증(코로나19) 여파가 장기화되며 코로나19를 이용한 대출사기와 보이스피싱이 횡행하고 있다.시민단체 금융소비자연맹(금소연)은 지난 23일 코로나19로 인한 소비자들의 경제적 어려움에 편승해 사기범들의 대출사기가 기승을 부리고 있어 소비자주의보를 발령한다고 밝혔다.사기범들은 주로 코로나19에 편승해 저금리 대환 대출, 마스크 결제 문자를 가장한 개인정보 유출, 마스크 구매자금 부족을 사유로 지인에게 자금 이체 요구 등의 수법을 쓴다.일례로 사기범은 ""OOO님, 00만원 승인되었습니다. KF94마스크 출고 예정""이란 가짜 문자를 보낸다. 이를 본 피해자가 사기임을 직감하고 문의 전화를 하면 명의가 도용 또는 범죄에 연루됐다고 속이는 방식이다. 이후 경찰을 사칭한 또 다른 사기범이 계좌번호, 주민번호, 핸드폰 번호 등 개인정보를 요구하고 피해자 명의의 예금을 편취한다.코로나19 여파로 급전이 필요한 저신용자·자영업자·소상공인 대상 사기도 기승을 부리고 있다. ""함께 이겨내요! 코로나19"" 방식으로 정부 특별 지원 대출을 가장하는 방식이다. 사기범들은 해당 문구와 함께 악성 앱 설치를 요구해 자금 편취는 물론 대포통장, 대포폰 등 2차 피해까지 발생할 우려가 크다.금융감독원도 코로나19 확산에 따른 국민 불안감을 악용해 마스크·손소독제 긴급 구매 등을 사유로 한 보이스피싱 피해사례가 실제로 발생하고 있어 소비자경보 '주의'를 지난 11일부터 발령 중이다.금소연은 출처가 불분명한 대출 문자나 대출 조건으로 앱 설치 유도는 100% 사기이므로 문자를 삭제하고 앱 설치에 응하지 말아야 한다고 당부했다. 만약 대출 앱을 설치했다면 즉시 삭제하고 핸드폰을 초기화하는 것이 바람직하다고 했다.개인정보가 유출된 경우에는 2차 피해를 막기 위해 경찰청(112), 금융감독원(1332), 금융소비자 정보포털사이트 '파인' 등에 신고하고 금전적 피해를 입었다면 해당 금융사에 즉시 지급중지 신청을 하고 금감원·경찰에 신고해야 한다.강형구 금융소비자연맹 사무처장은 ""출처가 불명확한 문자는 삭제하고 앱 설치를 해서는 안되며 시간이 소요되더라도 거래 상대방의 신원과 자격 여부를 확인해야 한다""고 했다.dyeop@news1.kr© 뉴스1코리아(), 무단 전재 및 재배포 금지",/news/news_read.nhn?article_id=0004540012&office_id=421&mode=search&query=카카오&page=3
,"[머니투데이 중기&창업팀 홍보경 기자] 글로벌 메이크업 아티스트 브랜드 슈에무라(shu uemura)가 ‘언리미티드 파운데이션’ 출시 1주년을 맞아 ‘언리미티드’ 라인 신제품 2종을 출시했다.언리미티드 파운데이션은 플루이드 형태의 스트롱웨어 파운데이션으로, 극강의 초밀착 텍스처가 피부에 가볍게 밀착돼 하루 종일 보송한 피부를 유지시켜 주는 것이 특징이다. 슈에무라는 브랜드의 새로운 히어로 아이템인 ‘언리미티드 파운데이션’ 1주년을 기념하기 위해 3월 20일부터 ‘언리미티드 파운데이션’ 구매 고객 대상으로 프로모션을 실시한다. 전국 슈에무라 온·오프라인 매장에서 ‘언리미티드 파운데이션’을 구매한 모든 고객에게 27,000원 상당의 정품 스킨 퍼펙터 미스트를 한정 수량으로 증정한다. 한편, 새롭게 선보인 신제품은 언리미티드 스틱 파운데이션(Unlimited Stick Foundation)과 언리미티드 래스팅 메이크업 픽스 미스트(Unlimited Lasting Make-up Fix Mist) 2종으로, 슈에무라의 언리미티드 메이크업 라인을 강화했다. 신제품 ‘언리미티드 스틱 파운데이션’은 언리미티드 파운데이션의 장점인 지속력과 밀착력을 그대로 담은 스틱 형태의 파운데이션으로, 휴대성과 편의성을 높여 더욱 쉽고 간편하게 스트롱웨어 메이크업을 완성시켜준다. 언리미티드 스틱 파운데이션은 크리미한 제형이 피부에 자연스럽게 밀착되어 끈적이지 않는 파우더리한 마무리감을 느낄 수 있다. 또한 총 12가지 쉐이드로 구성돼 색상에 따라 하이라이터와 섀딩용으로 다양하게 활용할 수 있다.‘언리미티드 래스팅 메이크업 픽스 미스트’는 파우더보다 미세한 수분 미스트가 고루 분사되어 메이크업을 오랜 시간 유지시켜 주는 탑코트 미스트다. 메이크업 마무리 단계에서 얼굴 전체에 분사해주면 수분은 채워주고 메이크업 지속력은 높여줘, 첫 화장 그대로 수정 없이 보송한 피부를 유지시켜준다. 해당 제품은 강한 지속력을 자랑하는 언리미티드 파운데이션과 함께 사용하면 더욱 강력한 스트롱웨어 메이크업이 가능하다.슈에무라 언리미티드 파운데이션을 비롯해 ‘언리미티드 스틱 파운데이션’과 ‘언리미티드 래스팅 메이크업 픽스 미스트’는 전국 슈에무라 백화점 매장 및 시코르, 올리브영, 세포라 등 헬스앤뷰티 스토어와 카카오톡 선물하기를 포함한 주요 온라인몰에서 만나볼 수 있다.중기&창업팀 홍보경 기자 bkhong@
<저작권자 ⓒ '돈이 보이는 리얼타임 뉴스' 머니투데이, 무단전재 및 재배포 금지>",/news/news_read.nhn?article_id=0004382096&office_id=008&mode=search&query=카카오&page=3
,"[머니투데이 이학렬 기자] [금융위, 제2기 옴부즈만 개선과제 40건 중 18건 개선방안 마련] 앞으로 보험계약할 때 보험금 수익자에 대한 설명이 의무화된다. 키우지도 않은 부모가 보험금을 받는 피해를 막기 위해서다. 자식을 버린 부모에게 상속 등이 되지 않도록 하는 일명 '구하라법'과 같은 맥락이다. 금융위원회는 제2기 옴부즈만이 지난해 한해동간 총 40건의 개선과제를 심의해, 18건의 개선방안을 마련했다고 24일 밝혔다. 금융소비자 관련 제도개선 과제는 32건 중 15건을, 금융회사 고충민원·규제개선 과제는 8건 중 3건에 대해 개선방안을 이끌었다. 개선방안 중에는 보험금의 제3자 지급에 따른 소비자 피해를 예방하기 위한 보험금 수익자 설명 의무화가 포함돼 있다. 지금까지는 보험금 수익자는 설명의무 대상이 아니어서 보험 계약자가 수익자를 지정하지 않은 경우 의도하지 않은 사람에게 보험금이 지급되는 문제가 있었다. 예컨대 A씨는 수익자를 지정하지 않은 상태로 생명보험에 가입했는데 A씨가 사망하자 민법상 상속순위에 따라 A씨와 함께 살고 있는 친동생 B씨가 아닌, 수십년동안 인연을 끊고 살아온 A씨의 생부에게 보험금이 지급됐다. 이밖에 시각장애인을 위한 음성전환이 가능한 약관과 설명서도 제공된다. 모바일상품권, 쿠폰, 티머니교통카드 등 선불전자지급수단 충전한도가 200만원에서 상향 조정되는 것도 옴부즈만에서 마련한 개선방안이다. 보험계약서는 SMS(문자), 카카오 알림톡 등으로 받을 수 있게 되고 카드사의 간편결제 앱 이용때 생체정보 등 다양한 본인인증수단이 허용된다. 지금은 결제서비스 외 카드론 신청할 때는 ID/PW와 공인인증서가 필요하다. 실손보험의 중복청구를 방지하기 위한 제도개선도 추진된다. 민간 보험회사는 실손보험 중복가입 여부를 확인하고 있으나 건설공제‧교직원공제 등 일부 공제에는 정보가 공유되지 않아 중복 지급 우려가 있었다. 보이스피싱 예방조치를 하다가 발생한 민원에 대해서는 감독상 예외를 인정하기로 했다. 예컨대 은행 직원 A씨는 보이스피싱 사고예방을 위한 금융당국의 지침에 따라 고객 B씨에게 금융거래 목적을 물어봤다가 항의를 받았고 B씨는 금융감독원에 민원을 제기해 해당 은행은 고객민원이 많다는 지적을 받았다. 이밖에 경미한 교통사고에 대한 과도한 보험금 지급 관행을 막기위해 진료비·합의금 기준을 마련해야 한다는 제안은 교통사고 피해자의 진료권 침해소지가 있는 만큼 충분한 의견수렴을 거쳐 제도개선 여부를 검토하기로 했다. 금융위는 제2기 옴부즈만이 3월 임기가 만료됨에 따라 제3기 옴부즈만을 신규 위촉할 예정이다.이학렬 기자 tootsie@
<저작권자 ⓒ '돈이 보이는 리얼타임 뉴스' 머니투데이, 무단전재 및 재배포 금지>",/news/news_read.nhn?article_id=0004382100&office_id=008&mode=search&query=카카오&page=3
,"보험계약자가 보험금 수익자를 지정할 수 있도록 설명 의무를 강화하는 방안이 추진된다. 의도하지 않은 사람에게 보험금이 지급되는 것을 방지하기 위해서다.24일 금융위원회는 지난해 옴부즈만 제도를 통해 총 40건의 개선과제를 심의하고 이 가운데 18건의 개선방안을 끌어냈다고 밝혔다.우선, 보험금 수익자를 지정해 계약을 체결할 수 있도록 설명의무를 부과한다. 그간 보험금 수익자는 설명 의무 대상이 아니었다. 이 때문에 별도 수익자를 지정하지 않은 경우, 의도하지 않은 법정 상속인에게 돈이 지급돼 갈등이 빚어지는 경우가 발생했다. 김정훈 기자 kjhnpce1@mt.co.kr
<저작권자 ⓒ '성공을 꿈꾸는 사람들의 경제 뉴스' 머니S, 무단전재 및 재배포 금지>",/news/news_read.nhn?article_id=0000521848&office_id=417&mode=search&query=카카오&page=3
간편결제·송금 이용금액 일평균 4091억원,"[서울=뉴시스] 조현아 기자 = 지난해 카카오페이, 토스 등 '○○페이'와 같은 간편송금·결제 서비스가 급성장했다. 스마트폰을 이용해 돈을 이체하는 간편송금서비스의 일평균 이용금액이 124% 급증하면서 2300억원을 돌파했다. 전체 간편송금·결제 이용금액은 4000억원을 넘어섰다.24일 한국은행이 발표한 '2019년중 전자지급서비스 이용 현황'에 따르면 지난해 간편송금 이용금액은 일평균 2346억원, 건수는 249만건으로 전년대비 각 124.4%, 76.7% 증가했다. 간편결제 이용금액(1745억원) 전년대비 44% 늘었고, 건수(602만건)도 56.5% 증가했다. 간편송금은 모바일에서 계좌이체 등으로 선불금을 충전한 뒤 전화번호나 SNS(소셜네트워크서비스) 등을 활용해 돈을 보내는 서비스다. 간편결제는 신용카드를 모바일에 저장해두고 비밀번호를 입력하거나 단말기에 접촉해 결제하는 서비스다. 토스(토스페이), 네이버페이, 카카오페이, 페이코 등이 대표적인 간편송금결제업체다. 간편송금과 결제 이용액을 합한 전체 실적은 4091억원으로 1년 전(2258억원)보다 81%(1833억원) 급증했다. 온라인 쇼핑 증가 등으로 전자지급결제대행(PG) 이용금액도 일평균 5467억원으로 전년대비 26.2% 증가했다. 이용건수도 39.3% 늘어난 1204만건으로 집계됐다. PG는 구매자로부터 받은 대금을 판매자에게 지급하기 위해 결제 정보를 송·수신해주거나 대가에 대한 정산 대행 등을 제공하는 서비스다. 일정액을 미리 충전한 뒤 교통요금과 상거래 대금을 송금할 수 있도록 한 선불전자지급도 이용금액이 2979억원으로 전년대비 108.9% 뛰었다. 간편송금서비스 이용이 큰 폭 증가한 영향이다. 결제대금예치서비스의 이용건수와 이용금액도 각 15.6%, 12.9% 늘었다. 온라인 판매 중개업체를 중심으로 증가세를 지속했다. 아파트 관리비 등 고지서 대금 정산을 대행하는 전자고지결제 이용액은전년대비 17.7% 늘어난 317억원으로 집계됐다. 스마트폰 기반 인증 절차로 편의점 등 가맹점 이용시 자금이체를 중개하는 직불전자지급 이용건수와 금액도 각 101.8%, 84.8% 증가했다. hacho@newsis.com<ⓒ 공감언론 뉴시스통신사. 무단전재-재배포 금지>",/news/news_read.nhn?article_id=0009774020&office_id=003&mode=search&query=카카오&page=3
"네이버 출판업, 카카오 부동산임대업 '신사업' 추가","국내 양대 포털 네이버와 카카오가 이번주 나란히 정기 주주총회를 열고 대표이사 연임을 결정한다. 확실한 성장세를 보이는 만큼 두 회사 모두 대표이사 연임이 유력하다. 각자 신사업 진출과 사옥 마련을 위한 정관 변경도 무난히 통과될 전망이다.24일 업계에 따르면 네이버는 오는 27일 경기 성남 네이버 그린팩토리에서 주총을 개최한다. 한성숙 대표의 연임 안건이 핵심이다. 앞서 지난달 26일 이사회에서 한 대표의 재선임안을 의결한 만큼 연임이 확실시된다.2017년 한 대표 취임 후 네이버는 눈에 띄는 외형 성장을 일궜다. 연 매출이 2016년 4조원에서 지난해 사상 처음 6조원을 넘었다. 네이버웹툰·네이버파이낸셜 등 신사업을 앞세워 올해도 고성장이 예상된다.이번 주총에서는 변대규 네이버 이사회 의장 재선임 건도 다뤄진다. 임직원 3084명에게 주당 행사 가격 18만6000원에 주식매수선택권(스톡옵션) 106만9869주를 지급하는 안건도 논의된다.아울러 네이버는 신사업 진출을 위해 정관을 변경한다. 오디오북 등 출판 사업을 위해 '출판업 및 영상, 오디오 기록물 제작 및 배급업'을 신사업 목록에 올렸다.카카오는 이에 앞서 오는 25일 제주 본사에서 주총을 연다. 김범수 의장과 여민수·조수용 공동대표 재선임 건이 주요 안건이다. 이들 역시 연임이 유력하다.2018년 취임한 두 공동대표는 재임 기간 회사 경영 실적을 크게 개선하며 연임에 청신호를 밝혔다. 2017년 연 2조원에 못 미치던 카카오의 매출은 지난해 3조원을 돌파했다. 영업이익도 2000억원을 넘어서 2년 전보다 25%가량 늘었다. 국민 메신저로 자리한 카카오톡에 광고를 넣은 승부수가 주효했다는 평가를 받았다.여민수·조수용 공동대표가 연임에 성공할 경우 카카오가 2014년 다음과 합병한 이후 첫 대표이사 연임 케이스가 된다. 사외이사 선임도 눈에 띈다. 카카오의 3대 주주인 중국 텐센트 측을 대표하는 피아오얀리 텐센트게임즈 부사장을 포함해 사외이사 4명 중 3명이 교체된다. 새로 선임되는 사외이사는 윤석 윤앤코 대표이사, 최세정 고려대 미디어학부 교수, 박새롬 성신여대 융합보안공학과 교수다.카카오는 회사 정관의 사업 목적에 '부동산 임대업, 개발 및 공급업'을 추가한다. 사옥 마련을 위한 목적이 크다. 현재 카카오는 본사가 있는 제주 사옥 외엔 주요 계열사들이 사무실을 임대해 쓰고 있다. 서울 등 수도권에는 사옥을 마련하지 못했다.카카오는 ""부동산 관련 정관 변경은 회사의 공동체 공간 마련 등 장기적 계획에 따라 사전적으로 진행하는 조처""라며 ""아직 구체적 방안이 나온 것은 아니다""라고 설명했다. 네이버와 카카오는 신종 코로나바이러스 감염증(코로나19) 예방을 위해 주총장 방역 작업을 진행하고 참석자들의 마스크 착용 등을 의무화했다.김은지 한경닷컴 기자 eunin11@hankyung.com기사제보 및 보도자료 open@hankyung.com▶ ▶
 ▶
ⓒ 한국경제 & , 무단전재 및 재배포 금지",/news/news_read.nhn?article_id=0004312279&office_id=015&mode=search&query=카카오&page=3
