head,text,url
[커버스토리=기업 발목 잡는 지뢰밭 규제 걷어 내자],"[한경비즈니스=이정흔 기자]“지금은 모든 것을 원점에서 완전히 새로운 방식으로 새 틀을 만들어야 할 시기입니다. 낡은 규제를 과감히 버리고 새로운 길을 터줄 수 있는 제도를 마련해야 합니다.”허창수 전국경제인연합회(전경련) 회장이 2020년을 시작하며 가장 먼저 강조한 내용이다. 기업들의 경영 환경이 어려워지는 상황에서 위기를 극복하고 기업의 성장을 이뤄내기 위해서는 ‘기업가 정신’을 되살리는 게 무엇보다 중요하다는 것이다. 절실함을 담아 ‘기업가 정신의 부활’을 외친 이는 허 회장뿐만이 아니다. 손경식 한국경영자총협회(경총) 회장은 “민간 실물 경제가 부진한 데는 국내 정책이 기업에 부담을 주는 방향으로 가면서 기업의 심리가 위축된 영향이 있다”면서 “기업의 활력을 높이는 방향으로 정책 기조를 전환해야 한다”며 기업들이 자유롭게 혁신을 시도하고 투자할 수 있는 환경을 조성할 필요가 있다고 강조했다. 또 강호갑 중견기업연합회 회장은 “한국 기업인에게는 최단기간에 민주화와 산업화를 이뤄낸 역량과 가능성의 DNA가 있다”며 “한국적 기업가 정신을 살려야 한다”고 말했다. 이처럼 국내 주요 경제단체장들이 한목소리로 ‘기업가 정신의 부활’을 외치고 나선 데는 그만큼 불필요한 규제들이 국내 기업들의 혁신과 도전을 가로막고 있다는 절박함이 밑바탕에 깔려 있다. 기업가 정신의 부활을 위해서는 스타트업과 중소기업이 중견기업으로, 또 중견기업이 대기업으로 자연스럽게 올라설 수 있는 ‘성장 사다리’를 탄탄하게 구축하는 게 가장 중요하다. 하지만 국내의 현실은 정반대다. 중소벤처기업부는 지난해 11월 ‘기업 단위 중소기업 기본 통계’를 첫 발표했다. 이에 따르면 2017년 말을 기준으로 국내 약 630만 개 기업 가운데 중소기업의 비율은 전체 기업의 99.9%에 달한다. 소상공인(93.7%)과 소기업(4.8%), 중기업(1.5%)을 뺀 중견·대기업 수는 전체의 0.1%(4801개)에 불과하다. 지난 20년간 대기업군(자산 규모 10조원 이상)에 진입한 중견기업은 네이버·카카오·하림 등 3개에 불과하다. 국내 기업들의 ‘성장 사다리’가 끊어져 있다는 분석이 나오는 이유다. 기업에 성장은 숙명이다. 하지만 국내 기업들이 제때 중견기업으로 올라서지 못하고 성장이 정체돼 있는 데는 ‘규제’가 거대한 장벽으로 작용하고 있기 때문이다. 한국경제연구원(한경연)이 지난해 9월 발표한 자료에 따르면 현행 법령상 기업의 규모를 기준으로 적용하는 ‘대기업 차별 규제’는 47개 법령에 총 188개에 달한다. 법률별로는 금융지주사법(41개, 21.8%)과 공정거래법(36개·19.1%)에 많았고 내용별로는 소유·지배 구조 규제가 65개(34.6%)로 가장 많고 그 뒤를 이어 영업 규제가 46개(24.5%), 고용 규제가 26개(13.8%), 진입 규제가 20개(10.6%)로 나타났다.한경연의 분석에 따르면 결과적으로 중소기업이 대기업 집단 중에서도 최상단에 자리한 상호출자제한기업집단으로 성장하기까지는 모두 9단계의 규제 장벽을 넘어야 한다. 특히 이와 같은 규제 허들이 높아지는 시기가 기업의 자산 총액 5000억원을 기준으로 하는 ‘중견기업’이다. 자산 총액 5000억원 미만의 기업에는 30개의 규제가 적용되지만 ‘중견기업’에 속하게 되면 81개 증가한 111개의 규제를 적용받게 된다. 공정거래법과 금융지주사법상 대기업 규제가 자산 총액 5000억원을 기준으로 삼은 때문이다. 기업들이 성장을 거부하고 중소기업에 머무르고 싶어 하는 ‘피터팬 증후군’이 나타나는 것은 바로 이 때문이다. 유환익 한경연 혁신성장실장은 “이와 같은 규제의 대부분은 과거 폐쇄적 경제 체제를 전제로 도입된 것이 대부분인데 이미 20년이 지나 글로벌 업체들과 경쟁해야 하는 상황에서도 그대로 유지하는 것은 문제가 있다”며 “글로벌 기준에 맞게 제도를 개선하고 신산업을 활성화하기 위해서는 제로 베이스에서 이와 같은 규제들을 전면 재검토해야 한다”고 말했다.
중소·중견기업의 원활한 가업 승계 규제 완화 또한 ‘기업가 정신의 부활’을 위해 손봐야 할 대표적인 규제로 거론된다. IBK경제연구소가 지난해 5월 발간한 ‘우리나라 가업 승계 현황 분석’에 따르면 창업자가 최고경영자(CEO)인 중견·중소기업 5만1256개 중 잠재적인 가업 승계 기업으로 볼 수 있는 CEO가 60세 이상인 기업은 1만7201개로 약 3곳 중 1곳(33.2%)꼴로 나타났다. 1970~1990년대 설립된 상당수의 중소·중견기업들이 세대교체기를 맞고 있지만 정작 가업 승계를 회피하려는 기업들이 적지 않다. 산업통상자원부와 한국중견기업연합회(FOMEK)가 지난 2월 설문 조사해 발표한 ‘2019년 중견기업 실태 조사’에 따르면 중견기업 1400곳 중 가업 승계 예정인 기업은 10.3%에 그쳤고 82.9%는 가업 승계 계획이 없다고 응답했다. 상속·증여세 등 과도한 규제의 영향이다. 국내 상속세의 최고 세율은 50%에 이른다. 일종의 경영권 프리미엄인 최대 주주 할증률까지 더하면 세율은 65%까지 오른다. 경제협력개발기구(OECD) 평균(26.6%)의 2배가 넘는 세계 최고 수준이다.‘가업 상속 공제’나 ‘증여세 과세 특례’ 등을 활용하는 것도 가능하지만 이 역시 사후 관리 기간 등 까다로운 조건이 걸려 있어 무용지물이나 마찬가지라는 비판이다. 실제로 지난해 중소기업중앙회가 업력 10년 이상 중소기업 대표와 가업 승계 후계자 500명을 대상으로 실시한 ‘2019 중소기업 가업 승계 실태 조사’에 따르면 가업 승계 계획이 있는 기업 넷 중 하나는 정부의 가업 상속 공제 제도를 활용할 계획이 없다고 답했다. 가업 상속 공제는 피상속인이 10년 이상 영위한 중소기업을 상속인에게 승계하는 경우 가업 상속 재산가액 중 업력에 따라 최대 500억원까지 공제해 주는 제도다. 하지만 공제받기 위해서는 연매출 3000억원 미만 기업이라는 기준에 맞아야 한다. 또 상속 후 10년 동안 지분·자산·업종·고용 등에 대한 사후 관리를 받도록 돼 있었다. 그러다 보니 ‘상속세 부담 완화’라는 취지에서 불구하고 가업 상속 공제 건수는 지난 7년간 연평균 68건에 그칠 정도로 이용 실적이 거의 없었다. 이에 따라 세법 개정을 통해 올해부터 사후 관리 기간을 10년에서 7년으로 단축하는 등 규제를 완화했지만 여전히 미흡하다는 지적이 많았다. 경총은 개편안이 발표된 직후 “기업들의 요구 사항에 비해 내용이 미흡해 규제 완화 효과를 체감하기에는 어려운 수준”이라고 실망감을 보이기도 했다. ‘가업 승계’에 이처럼 높은 세율이 매겨지게 된 데는 이를 ‘부의 대물림’으로 보는 인식이 깔려 있기 때문이다. 이 때문에 원활한 가업 승계를 위한 제도 개선을 위해서는 가업 승계를 ‘기업의 기술과 경영 노하우를 전수하고 이를 통해 지속적인 성장’을 위한 제도라는 인식의 전환이 필요하다고 전문가들은 말한다.이성봉 서울여대 경영학과 교수는 “글로벌 시장에서 한국과 경쟁하고 있는 독일과 일본 같은 나라들은 이와 같은 ‘기업의 영속성’ 관점에서 바라보고 있다”며 “정부가 적극적으로 상속증여세 개편을 시행하는 등 기업의 승계를 지원하고 있다”고 강조했다. 가업 승계를 위한 공제 제도를 ‘기업의 경영권 안정화를 위한 차원’에서 다룰 필요가 있다는 주장이다. 한국과 달리 일본과 독일 등 해외 선진국들은 가업 승계를 국가 경쟁력 차원에서 접근하며 장수 기업을 육성하기 위해 법·세제, 금융 지원 등을 아우르는 종합 대책을 마련해 시행하고 있다. 일본은 2008년 ‘중소기업 경영 승계 원활화에 관한 법’을 제정했고 2009년 산업활력법에 중소기업 승계 사업 지원 계획을 신설했다. 2018년부터 향후 10년간 ‘사업 승계 실시 집중 기간’으로 정하고 정책적 지원을 강화하고 있다. 독일은 2006년 중소기업 육성 정책의 일환으로 기업 승계 조세 감면 법안을 마련했고 유럽 전역이 경기 침체에 허덕이던 2009년을 기점으로 상속세 개혁법과 경제 성장 촉진법이 시행되면서 상속 공제 제도를 강화했다. 임동원 한경연 부연구위원은 “지금과 같은 높은 상속 세율과 까다로운 가업 상속 공제 제도로는 상속 재산 감소와 경영권 승계가 불확실해지면서 기업가 정신이 약화될 우려가 있다”며 “선진국처럼 상속 세율을 대폭 낮추거나 상속세 폐지를 고려할 필요가 있다”고 말했다.[본 기사는 한경비즈니스 제 1269호(2020.03.23 ~ 2020.03.29) 기사입니다.][] [] []
당사의 허락 없이 본 글과 사진의 무단 전재 및 재배포를 금합니다.",/news/news_read.nhn?article_id=0000053053&office_id=050&mode=search&query=카카오&page=5
▶ 네이버 홈에서 [한국경제TV] 채널 구독하기 [생방송보기]▶ 대한민국 재테크 총집결! - [증권 / 주식상담 / 부동산],"[한국경제TV 라이온봇 기자]오전부터 국내 최대의 모바일 커뮤니케이션 플랫폼 업체인 카카오(035720)가 강세를 보이고 있다.4.88% 상승출발한 주가는 장중 한 때, 14만7000원(2.44%)까지 하락하였지만 다시 회복하여 현재는 5.23% 상승한 15만1000원을 기록하고 있다.차트를 살펴보면 5일, 20일, 60일 이동평균선이 역배열 상태로 하락 추세를 이어오다가 주가가 반등하는 모습이다.거래량은 39만2388주로 전거래일 대비 25.0% 수준이다.이는 카카오 전체 주식수의 0.45%에 해당하는 물량이다.이 시각 거래소에서 카카오 이외에도 오션브릿지(5.87%), 초록뱀(6.03%), 씨에스베어링(8.94%), 삼지전자(9.38%), 현대일렉트릭(5.0%) 등이 상승세를 보이고 있다.※ 본 기사는 한국경제TV와 `금융 AI 전문기업 씽크풀`이 실시간으로 작성한 기사입니다.라이온봇기자 ⓒ 한국경제TV, 무단 전재 및 재배포 금지",/news/news_read.nhn?article_id=0000858526&office_id=215&mode=search&query=카카오&page=5
"-김범수 카카오 의장 10주년 기념 메시지 ""가장 중요한 고민은 기업 문화""","카카오를 창업한 김범수 이사회 의장이 카카오톡 출시 10주년을 기념해 직원들에게 메시지를 남겼다. 김 의장은 3월 18일 카카오 전 직원에게 보낸 카톡·메시지에서
“모바일 생활 플랫폼을 넘어 또 다른 변화의 파고에 대응해야 한다”고 밝혔다.그는 “지난 10년은 카카오의 시즌1이라고 생각하며 우리는 이제 시즌2를 위한 다음 10년을 준비해야 한다”며 이같이 전했다.그는 “글로벌 선도 업체들을 보면 우리를 압도하는 정도의 규모여서 엄청난 공포감이 느껴지기도 한다”며 “기회와 위기가 공존하는 또 다른 10년 앞에서 우리의 길을 찾아야 한다”고 강조했다.김 의장은 메시지를 통해 ‘문화의 중요성’을 강조했다. 그는 “사람이나 시스템이 일하는 게 아니고 ‘문화가 일을 한다’라는 말을 굉장히 믿는다”며 “커진 규모에서의 기업 문화라는 게 또 어떻게 변하고 진화해야 할지도 시즌2의 중요한 고민거리”라고 밝혔다.이어 밀레니얼 세대가 행동하는 방식을 이해하고 판단할 수 있는 사람이 의사 결정을 하는 구조가 돼야 한다고 강조했다. 카카오는 그동안 다방면에서 신사업을 추진해 왔다. 김 의장은 “우리는 커머스·콘텐츠·캐릭터·모빌리티·금융·블록체인·인공지능(AI)·B2B까지 무수히 많은 가보지 않은 길을 걸어왔다”면서 “성공만 있었던 것은 아니지만 도전을 두려워하지 않았다. 불편하고 복잡한 일상에서 문제의 본질을 찾아나갔고 해결책을 제시했다”고 회고했다.그러면서 “가장 기분 좋았을 때가 카카오를 쓰면서 ‘세상 참 좋아졌네’라는 말을 듣는 것”이라고 전했다.김 의장은 현재 자신의 역할에 대해 “지금은 약간 미래의 이니셔티브(주도권)를 찾는, 미래의 성장 동력을 찾는 쪽의 역할을 주로 하고 있다”며 “계속 호기심이 많고 그걸 상상하고 그 상상의 뭔가를 이루려고 하는 사람, 꿈을 꾸는 사람, 이런 게 제일 듣고 싶은 포인트”라고 덧붙였다.김영은 기자 kye0218@hankyung.com I 사진 한국경제신문[본 기사는 한경비즈니스 제 1269호(2020.03.23 ~ 2020.03.29) 기사입니다.][] [] []
당사의 허락 없이 본 글과 사진의 무단 전재 및 재배포를 금합니다.",/news/news_read.nhn?article_id=0000053127&office_id=050&mode=search&query=카카오&page=5
,"[헤럴드경제=신동윤 기자] 넷마블이 지난해 국내 앱 가운데 가장 높은 수익을 낸 것으로 조사됐다.24일 모바일 데이터 분석 플랫폼 앱애니가 공개한 ‘2020년 상위 퍼블리셔 어워드(TPA 2020)’에 따르면 넷마블은 지난해 전세계에서 가장 높은 수익을 낸 52개 모바일 앱 퍼블리셔 가운데 6위를 차지, 국내에서 가장 높은 순위를 기록했다.넷마블을 비롯해 국내 기업으로는 엔씨소프트(20위), 게임빌(39위), 카카오(48위)가 이름을 올렸다.이승원 넷마블 대표는 “지난해 ‘일곱개의 대죄: 그랜드 크로스’, ‘더 킹 오브 파이터즈 올스타’, ‘쿵야 캐치마인드’, ‘BTS월드’ 등 다양한 장르의 신작이 글로벌 시장에서 긍정적 성과를 거뒀다”며 “올해는 ‘A3: 스틸얼라이브’, ‘세븐나이츠 레볼루션’, ‘제2의 나라: 크로스월즈’, ‘스톤에이지M(가제)’ 등 자사 및 글로벌 유명 지적재산권(IP) 기반의 다양한 대작으로 글로벌 경쟁력 강화에 더욱 집중할 것”이라고 말했다.지난해 모바일 게임의 전세계 소비자 지출은 860억 달러(약 108조원)로 전체 소비자 지출의 72%를 차지하며 매출을 견인했다. 퍼블리셔 역시 1위부터 9위까지 모두 게임사가 차지하며 게임은 여전히 모바일 시장에서 가장 큰 매출을 올렸다.상위 10위를 살펴보면 중국의 ‘텐센트(Tencent)’가 4년 연속으로 1위 자리를 유지했으며, 중국의 ‘넷이즈(NetEase)’가 2위, 미국의 ‘액티비전 블리자드(Activision Blizzard)’가 3위로 작년과 동일한 순위를 기록했다. 작년 브롤스타즈로 한국을 포함해 전세계에서 흥행을 거둔 ‘슈퍼셀’은 3단계 오른 4위를 차지했다.일본의 ‘반다이남코’는 1단계 하락한 5위를 차지했으며, 아일랜드의 ‘플레이릭스(Playrix)’가 2단계 상승한 7위, 일본의 ‘소니’가 8위에 올랐다. 세계 최대의 소셜카지노 게임사인 이스라엘의 ‘플레이티카(Playtika)’가 9위를 차지하며 최초로 10위권에 진입했다.이번 순위에서는 게임 외 소셜 네트워크와 비디오 스트리밍 서비스를 제공하는 퍼블리셔들의 성장이 가장 눈에 띄었다.지난해 비게임 앱 중 소비자 지출 1위를 차지한 ‘틴더(Tinder)’의 모회사인 IAC(InterActiveCorp)가 전년 대비 2단계 상승한 10위를 기록했으며, 중국판 넷플릭스로 불리는 비디오 스트리밍 플랫폼 ‘아이치이(iQiyi)’가 계열사로 있는 중국 최대 검색 업체 바이두(Baidu)는 18위를 기록했다. 넷플릭스(Netflex)는 24위를 차지했다.realbighead@heraldcorp.com
- Copyrights ⓒ 헤럴드경제 & heraldbiz.com, 무단 전재 및 재배포 금지 -",/news/news_read.nhn?article_id=0001652644&office_id=016&mode=search&query=카카오&page=5
언리미티드 파운데이션 구매 고객에 정품 스킨 퍼펙터 미스트 한정 증정,"글로벌 메이크업 아티스트 브랜드 슈에무라(shu uemura)가 ‘언리미티드 파운데이션’ 출시 1주년을 맞아 신제품 2종을 출시하며, 언리미티드 라인을 더욱 강화했다.신제품 ‘언리미티드 스틱 파운데이션(Unlimited Stick Foundation)’은 언리미티드 파운데이션의 장점인 지속력과 밀착력을 그대로 담아냈으며, 스틱형으로 휴대성과 편의성을 높여 더욱 쉽고 간편하게 스트롱웨어 메이크업을 완성할 수 있다. 또한 총 12가지 쉐이드로 구성돼 색상에 따라 하이라이터와 섀딩용으로 다양하게 활용할 수 있고, 아시아인의 이목구비에 맞춰 설계된 물방울 모양의 어플리케이터로 얼굴의 굴곡진 곳까지 정교한 피부 표현이 가능하다. 제품 텍스쳐는 크리미한 제형으로 피부에 자연스럽게 밀착되어 끈적이지 않는 파우더리한 마무리감을 느낄 수 있다는 설명이다. 언리미티드 스틱 파운데이션 제품과 함께 사용하기 좋은 ‘언리미티드 래스팅 메이크업 픽스 미스트(Unlimited Lasting Make-up Fix Mist)’도 눈여겨볼 만하다. 메이크업을 오랜 시간 유지시켜 주는 탑코트 미스트 제품으로, 메이크업 마무리 단계에서 얼굴 전체에 분사해 주면 파우더보다 미세한 수분 미스트가 고루 분사되어 수분은 채워주고 메이크업 지속력은 높여준다. 한편 슈에무라는 ‘언리미티드 파운데이션’ 1주년을 기념하기 위해 3월 20일부터 전국 슈에무라 온·오프라인 매장에서 ‘언리미티드 파운데이션’을 구매한 모든 고객에게 27,000원 상당의 정품 스킨 퍼펙터 미스트를 한정 수량으로 증정하는 특별한 프로모션을 진행한다.언리미티드 파운데이션은 플루이드 형태의 파운데이션으로, 슈에무라의 베스트셀러 제품이다. 특히 이 제품은 롱웨어(long-wear)를 넘어 스트롱웨어(strong-wear)라 표현될 정도로 강력한 지속력을 자랑하는 파운데이션으로, 극강의 초밀착 텍스처가 피부에 가볍게 밀착돼 하루 종일 보송한 피부를 선사한다.슈에무라 언리미티드 파운데이션을 비롯해 ‘언리미티드 스틱 파운데이션’과 ‘언리미티드 래스팅 메이크업 픽스 미스트’는 전국 슈에무라 백화점 매장 및 시코르, 올리브영, 세포라 등 헬스앤뷰티 스토어와 카카오톡 선물하기를 포함한 주요 온라인몰에서 만나볼 수 있다.[매경닷컴] [ⓒ 매일경제 & mk.co.kr, 무단전재 및 재배포 금지]",/news/news_read.nhn?article_id=0004542755&office_id=009&mode=search&query=카카오&page=5
,"[서울=뉴시스] 표주연 기자 = 이벤트 전문 스타트업 ‘세모파이'는 2030 직장인 싱글 남녀를 위한 이색 마스크 미팅, ‘마스크팅’을 진행한다고 24일 밝혔다.4월5일 오후 2시부터 5시까지 진행되는 마스크팅에는 신원 확인이 완료 된 서울지역 싱글 직장인 10명(남녀 각 5명)이 참석할 예정이다.이번 행사는 참가자들이 한 장소에 모이지 않고, 주최 측이 준비한 소독된 차량(기사포함)을 이용한 ‘드라이브 스루 로테이션’ 방식으로 진행된다. 2명의 남녀가 1대의 차량에 탑승해 대화를 나누며, 각 미션 존에 도착할 때마다 대화 상대가 바뀐다. 참가자들은 약 2시간30분 동안 5명의 이성과 대화 및 미션 게임 등을 수행한다.모든 참가자는 행사 중 마스크를 벗어서는 안 된다. 참가비는 2만원, 문의는 카카오톡 오픈채팅방 '마스크팅' 또는 세모파이 홈페이지를 통해 가능하다.
이명길 세모파이 대표는 “코로나19로 인해 어쩔 수 없이 착용하는 마스크가 오히려 '썸' 성공률을 높일 수도 있다는 아이디어에서 기획했다”고 말했다. pyo000@newsis.com<ⓒ 공감언론 뉴시스통신사. 무단전재-재배포 금지>",/news/news_read.nhn?article_id=0009773566&office_id=003&mode=search&query=카카오&page=5
,"[서울경제] 코로나19로 공채가 늦어진 기업들이 상반기 언택트 채용에 박차를 가하고 있다. LG, CJ, 카카오는 직군별 화상면접을, SK와 삼성은 온라인으로 채용설명회를 진행할 계획이라고 밝혔다. LINE과 이스트소프트는 전체 채용전형의 100%를 온라인으로 실시한다. 한국전파진흥원, 한국수자원공사, 호반건설, 라인건설, 인천성모병원, 한양대구리병원 등은 AI역량검사로 채용을 진행한다.언택트 채용이 대규모로 확산되면서, 기업 인사담당자들은 반기는 분위기다. 인크루트와 알바콜의 설문조사 결과, 인사담당자 10명 중 7명은 도입을 찬성하는 것으로 확인됐다. AI역량검사 도입기업도 2019년 말 기준 200개 기업에서 올해 상반기 3개월 동안만 100개 기업이 추가됐다. 총 300개의 기업이 AI역량검사를 통해 언택트 인적성검사와 화상면접을 진행하게 된 것이다. 언택트 채용의 대표격인 ‘AI역량검사’로 채용을 진행중인 기업의 사례를 살펴보면, 온라인 역량검사를 통해 지원자의 직무역량을 분석 및 확인하고, 화상면접 단계에서는 역량검사의 결과 데이터를 활용하기 때문에 더 정확하고 공정한 채용이 가능해졌다는 평이다. AI역량검사로 채용을 진행중인 관계자에 따르면, “기존의 인적성검사를 AI역량검사로 대체할 수 있고, 최종면접에서 가이드라인으로 활용할 수 있어서 회사나 지원자 모두에게 이로운 것 같다”고 밝혔다.KCA(한국전파통신진흥원)의 경우에는 학력과 스펙에 대한 차별을 없애기 위해, 서류를 제출한 모든 지원자에게 기본 요건만 충족하면 AI역량검사를 응시할 기회를 주고 있는 것으로 알려졌다.향후 전망에 대한 설문조사에서도 인사담당자의 77.9%가 “언택트 채용은 코로나19 이후에도 확산될 것”이라는 의견이 지배적이다. 마이다스아이티 계열 마이다스인 이종백 그룹장은 “AI역량검사는 뇌신경과학을 기반으로 기업문화와 직무역량의 적합도를 확인하는 솔루션”이라며, “언택트 채용으로 코로나 감염우려도 줄일 수 있지만, 무엇보다 직무적합도를 향상시킨 채용으로 인해 향후 입사자의 성과평가나 이직률 측면에서 긍정적인 영향을 기대할 수 있을 것”이라고 밝혔다. /김동호 기자 dongho@sedaily.com저작권자 ⓒ 서울경제, 무단 전재 및 재배포 금지",/news/news_read.nhn?article_id=0003714112&office_id=011&mode=search&query=카카오&page=5
