head,text,url
,"[머니투데이 김소연 기자] 코스피 지수가 개인 매수세에 상승세다. 잦아드는 듯 했던 코로나19(COVID-19)가 이태원 클럽 사태로 인해 재창궐하는 분위기지만, 투자심리는 크게 훼손되지 않은 분위기다. 11일 오전 9시10분 코스피 지수는 전일대비 7.08포인트(0.36%) 상승한 1952.90을 기록 중이다. 개인이 430억원 매수 우위고, 외국인과 기관이 각각 2억원, 439억원 매도 우위를 나타내고 있다. 업종별로는 대부분이 상승하고 있다. 의료정밀과 서비스업, 의약품이 1% 안팎 강보합세를 나타내고 있고, 섬유의복, 건설업, 유통업은 약보합세다. 시가총액 상위종목들도 대부분 강보합세를 나타내는 가운데, 셀트리온과 카카오만 1%대 상승세다. SK하이닉스는 홀로 약보합세다. 코스닥 지수는 전일대비 2.48포인트(0.36%) 오른 684.78을 기록 중이다. 개인이 547억원 순매수하면서 코스피보다 더 많은 금액을 투자하고 있고 외국인, 기관은 각각 421억원, 99억원 순매도하고 있다. 업종별로는 혼조세가 나타나고 있다. 소프트웨어, 출판매체복제, 유통, 제약은 1%대 강세고 비금속, 오락문화, 방송서비스 등은 1%대 약세다.시가총액 상위종목 중에서는 셀트리온헬스케어, 씨젠이 각각 2%, 4%대 강세다. CJ ENM과 스튜디오드래곤, SK머티리얼즈는 1%대 안팎 약세다. 김소연 기자 nicksy@
<저작권자 ⓒ '돈이 보이는 리얼타임 뉴스' 머니투데이, 무단전재 및 재배포 금지>",/news/news_read.nhn?article_id=0004406508&office_id=008&mode=search&query=카카오&page=4
네이버 지분 12.27→12.54%…지금 되팔면 21% 수익 카카오 예상수익 24.16% 달해‘5G 수혜’ KT도 15% 이상 수익 예상,"[헤럴드경제=강승연 기자] 국민연금이 지난달 코로나19로 각광 받게 된 언택트(비대면) 수혜주 투자를 늘린 것으로 나타났다. 특히 네이버, 카카오 등 언택트 대장주로는 20% 넘는 짭짤한 수익이 예상된다.11일 금융감독원 전자공시시스템에 따르면 국민연금은 언택트 주도주로 꼽히는 네이버 지분율을 3월 말 12.27%에서 4월 말 12.54%로 확대했다고 지난 8일 공시했다. 4월 한 달 간 73만2175주를 1291억원을 들여 추가 매수한 결과다.이를 통해 지난달 국민연금이 네이버 주식을 사들일 때 든 평균 매수단가는 17만6349원이라는 계산이 나온다. 공시 당일 네이버 주가(21만4000원)로 4월에 산 주식을 되팔 경우 예상 수익률은 약 21.35% 정도로 추정된다. 3월 말 대비 10.90% 상승한 코스피지수를 2배 웃도는 수익이다.국민연금은 또 언택트 덕에 주가 상승 가도를 달리는 카카오 지분을 한 달 새 10.00%에서 10.08%로 늘렸다. 위와 같은 방식으로 계산하면 국민연금은 카카오 주식을 평균 16만5912원에 매수한 것으로 보인다. 공시일 주가인 20만6000원을 기준으로 예상되는 수익률은 24.16%에 달한다. 카카오는 앞으로도 사상 최고가 기록 행진을 이어갈 것으로 보이는 만큼 국민연금의 수익 폭은 더 커질 것으로 기대된다.언택트 활성화와 정책적 지원 수혜가 기대되는 5세대 이동통신(5G) 투자도 눈에 띈다. 국민연금은 SK텔레콤 지분을 11.20%(3월 31일)에서 11.60%(4월 29일)로 늘리고, KT(13.71%→13.87%)와 LG유플러스(10.92%→11.90%)도 지분을 확대했다. 이 가운데 매수물량의 기대 수익률이 가장 높은 곳은 KT로, 공시일 주가가 평단가 대비 15.53% 뛴 것으로 나타났다.게임주 중에서는 유일하게 엔씨소프트 지분이 11.76%에서 11.82%로 늘었다. 이 과정에서 국민연금은 엔씨소프트를 평단가 64만6811원에 매수했다. 공시일 기준 예상 수익률은 4.98% 수준이다. 다만 최근 주가가 70만원선을 넘나들며 3월에 기록한 역대 최고가를 경신할 가능성이 있는 만큼 그 이상의 수익을 기대할 만하다는 관측이다.비대면 확산에 따른 서버용 반도체 수요 성장이 예상되는 삼성전자와 SK하이닉스도 투자 확대 대상이었다. 지난달 삼성전자 지분은 9.92%에서 10.01%로, SK하이닉스는 11.08%에서 11.20%로 늘어났다. 그러나 두 회사의 매수물량에 대한 기대 수익률은 –0.14%, 2.64%로 미미한 편이었다. 스마트폰 등 완제품 수요 둔화가 불가피해지며 주가 상승에 탄력을 받지 못하고 있어서다.spa@heraldcorp.com
- Copyrights ⓒ 헤럴드경제 & heraldbiz.com, 무단 전재 및 재배포 금지 -",/news/news_read.nhn?article_id=0001671597&office_id=016&mode=search&query=카카오&page=4
AI 활용 재난방송 시스템 구현도 진행키로,"[이데일리 한광범 기자] 카카오(035720)엔터프라이즈는 KBS와 인공지능(AI) 기술을 활용한 미디어 인프라 및 재난방송 시스템 구현을 위한 업무 협약(MOU)을 체결했다고 11일 밝혔다. 가전, 문화, 레저, 헬스케어, 금융 등 다양한 산업 분야에 AI 기술을 더하고 있는 카카오엔터프라이즈가 방송 콘텐츠 분야에 AI와 클라우드를 접목한 것이다.양사는 이번 협약을 통해 방송 콘텐츠 인프라는 물론이고, 국민 안전을 위한 재난방송 분야에서 협력할 예정이다.KBS 이창형 기술본부장, 카카오엔터프라이즈 최진민 부사장(왼쪽부터)이 지난 8일 KBS 여의도 사옥에서 MOU를 체결하고 있다. (사진=카카오)먼저 KBS 재난 방송에 자동으로 스크립트를 읽어주는 ‘AI 아나운서’를 연내 선보인다. KBS는 재난방송 주관사로 기상청에서 재난 정보를 받아 속보로 내보내는 시스템을 운영하고 있다. 국민의 안전과 직결된 재난방송은 심야, 주말, 공휴일에 관계없이 재난 발생 시 방송이 가능한 상시적 인력과 리소스가 필요하다는 어려움이 있었다.카카오엔터프라이즈는 여기에 AI 기술을 활용해 빠르고 효율적인 재난 방송 시스템 구축을 돕는다. 먼저 자연어처리기술을 적용, 더 빠르고 정교하게 스크립트를 만들 수 있게 한다. 이후 TTS(text to speech) 음성 합성 기술을 활용, 스크립트를 KBS 아나운서 목소리로 자동 변환해 방송을 송출하는 방식이다. 카카오엔터프라이즈는 소량의 녹음 데이터로도 음성 합성을 빠르게 할 수 있는 ‘딥보이스 기술’을 보유하고 있어 음성 합성의 속도 문제를 해결하고 재난 방송에 빠른 대처가 가능할 것으로 보인다.카카오엔터프라이즈는 통합 AI 플랫폼 ‘카카오 i’의 시각 엔진 기술을 활용해 KBS의 영상 콘텐츠의 편집, 검색, 관리 시스템 혁신도 지원한다. 시각 엔진을 활용하면 드라마, 예능, 뉴스, 교양/시사/다큐 등 다양한 영상에서 인물, 주제, 키워드 등의 중요 데이터를 자동으로 추출, 분류할 수 있다. 예를 들어 한 방송에 출연한 출연자들이 누구인지, 방송에서 무엇을 하고 어디에 갔는지 등에 대한 데이터를 추출하고 분석해, 동일한 출연자가 나오거나 특정 장소가 배경이 된 영상들을 한번에 검색하고 분류하여 콘텐츠 검색을 통한 편집 등이 가능해질 수 있다.이밖에도, ‘카카오i’의 다양한 AI 기술들이 KBS의 방송 콘텐츠 분야에 활용되도록 지원할 예정이다.또 KBS가 보유한 다양한 형태의 미디어콘텐츠를 더 높은 성능과 효율적인 비용으로 관리할 수 있는 카카오엔터프라이즈 자체 분산 스토리지 기술과 동영상을 여러 포맷으로 변환할 수 있는 미디어 트랜스코딩 기술 등 AI 플랫폼을 지원하는 클라우드 인프라 서비스도 함께 제공할 예정이다.카카오엔터프라이즈 측은 “AI와 클라우드 기술로 KBS의 방송 시스템과 미디어 인프라 구축을 전격 지원하고 방송제작 환경을 혁신하기 위해 힘쓸 것이다. 또 대국민 재난방송 고도화에 적극 협력함으로써 국민의 안전과 보호를 위해 KBS와 노력할 것“이라며 “앞으로도 AI 비즈니스로 이용자에게 좀 더 가치 있는 서비스와 편의를 제공할 수 있도록 다양한 방안을 모색해 나갈 것”이라고 밝혔다.한광범 (totoro@edaily.co.kr)＜ⓒ종합 경제정보 미디어 이데일리 - 무단전재 & 재배포 금지＞",/news/news_read.nhn?article_id=0004637005&office_id=018&mode=search&query=카카오&page=4
,"가정의 달을 맞아 가족, 친지, 연인이 한자리에서 함께 모여 즐거운 시간을 보내기에 알맞은 캐릭터 컬래버레이션 상품을 출시했다.GS리테일이 운영하는 편의점 GS25는 전세계 동시 개봉하는 애니메이션 대작 ‘트롤:월드투어’와 제휴를 통해 전용 상품 및 프로모션을 선보인다. 강동완 기자 enterfn@mt.co.kr
<저작권자 ⓒ '성공을 꿈꾸는 사람들의 경제 뉴스' 머니S, 무단전재 및 재배포 금지>",/news/news_read.nhn?article_id=0000540638&office_id=417&mode=search&query=카카오&page=4
자연어처리기술 활용해 재난 방송 지원카카오i로 영상 편집·검색 시스템 혁신,"[서울경제] 앞으로 인공지능(AI) 아나운서가 자동으로 재난방송으로 실시간으로 송출하는 시대가 열린다. 엔터프라이즈는 KBS와 지난 8일 서울 영등포구 여의도 KBS 사옥에서 인공지능(AI) 기술을 활용한 미디어 인프라 및 재난방송 시스템 구현을 위한 업무 협약(MOU)을 체결했다고 11일 밝혔다. 양사는 이번 협약을 통해 방송 콘텐츠 인프라는 물론, 국민 안전을 위한 재난방송 분야에서 협력한다.먼저 KBS 재난 방송에 자동으로 스크립트를 읽어주는 ‘AI 아나운서’를 연내 선보인다. 카카오엔터프라이즈의 자연어처리기술을 적용해 더 빠르고 정교하게 스크립트를 제작하고, TTS(텍스트 음성 변환) 기술을 활용해 스크립트를 KBS 아나운서 목소리로 자동 변환해 송출하는 것이다. 카카오엔터프라이즈 측은 “소량의 녹음 데이터로도 음성 합성을 빠르게 할 수 있는 ‘딥보이스 기술’을 보유하고 있다”며 “음성 합성의 속도 문제를 해결하고 재난 방송에 빠른 대처가 가능할 것”이라고 설명했다.카카오엔터프라이즈는 통합 AI 플랫폼 ‘카카오 i’의 시각 엔진 기술을 활용해 KBS의 영상 콘텐츠의 편집·검색·관리 시스템 혁신도 지원한다. 예를 들어 한 방송에 출연한 출연자들이 누구인지, 방송에서 무엇을 하고 어디에 갔는지 등에 대한 데이터를 추출하고 분석해 동일한 출연자가 나오거나 특정 장소가 배경이 된 영상들을 한번에 검색해 분류하는 것이다. 또 KBS가 보유한 다양한 형태의 미디어콘텐츠를 더 높은 성능과 효율적인 비용으로 관리할 수 있도록 한다. 카카오엔터프라이즈 자체 분산 스토리지 기술과 동영상을 여러 포맷으로 변환할 수 있는 미디어 트랜스코딩 기술 등 AI 플랫폼을 지원하는 클라우드 인프라 서비스도 함께 제공한다.카카오엔터프라이즈 측은 “AI와 클라우드 기술로 KBS의 방송 시스템과 미디어 인프라 구축을 전격 지원하고 방송제작 환경을 혁신하기 위해 힘쓸 것”이라며 “앞으로도 AI 비즈니스로 이용자에게 좀 더 가치있는 서비스와 편의를 제공할 수 있도록 다양한 방안을 모색해나갈 것”이라고 전했다. /백주원기자 jwpaik@sedaily.com저작권자 ⓒ 서울경제, 무단 전재 및 재배포 금지",/news/news_read.nhn?article_id=0003735209&office_id=011&mode=search&query=카카오&page=4
"평균목표주가 카카오 24만3833원 > 네이버 23만3909원1분기 어닝서프라이즈…18개 증권사, 23만5000~28만원으로 상향향후 2~3년 성장세 지속…고점 논하기 일러, 업종 최선호","[헤럴드경제=김현경 기자] 증권가에서 카카오의 목표주가를 언택트(비대면) 대장주인 네이버(NAVER)보다 높여잡았다. 시장을 선도해온 네이버보다 최근 급속도로 성장하고 있는 카카오의 가능성에 더 주목하고 있는 것이다.금융정보업체 에프앤가이드에 따르면 11일 현재 카카오의 목표주가 컨센서스(증권사 전망치 평균)는 24만3833원으로 네이버의 목표주가 컨센서스 23만3909원보다 9924원 높다.카카오의 목표주가 컨센서스는 1개월 전 대비 2만9333원(+13.68%) 올랐으며 1년 전과 비교하면 9만4690원(+63.49%)이나 뛰었다.이에 비해 네이버의 목표주가 컨센서스는 1개월 전 대비 8431원(+3.74%) 오르는 데 그쳤다. 1년 전 대비 증가폭도 7만4859원(+47.07%)으로 카카오보다 적다.이는 카카오가 네이버보다 시장 기대치를 훨씬 웃도는 1분기 깜짝 실적을 발표했기 때문으로 분석된다.카카오는 7일 공시한 올해 1분기 잠정 실적에서 매출액이 전년동기 대비 22.9%, 영업이익이 218.9% 늘고 순이익은 354.9% 증가했다고 밝혔다.반면 지난달 23일 발표된 네이버의 1분기 잠정 실적은 매출액 14.6%, 영업이익 7.4%, 순이익 54.0% 증가로 카카오보다 성장폭이 낮았다.이에 증권사들은 카카오의 목표주가를 일제히 상향 조정했다. 7~8일 이틀간 18곳의 증권사가 적게는 9.09%에서 많게는 28.57%까지 목표주가를 올렸다. 카카오의 8일 종가는 20만6000원인데 증권사들은 23만5000~28만원까지 주가가 상승할 것으로 전망했다.올해 연간 영업이익 컨센서스도 4150억원으로 1개월 전 3949억원보다 더 높여잡았다.이와 달리 네이버가 실적을 발표한 후 이틀간 목표주가를 상향한 증권사는 8곳에 그쳤다. 목표주가 범위도 22만5000원에서 25만원 수준이었다.실제로 올해 들어 주가수익률도 카카오가 네이버보다 배 이상 높다. 카카오는 연초 이후 8일까지 주가가 5만2500원(+34.20%) 상승한 반면, 네이버는 2만7500원(+14.75%) 올랐다. 카카오는 11일도 전거래일 대비 0.49% 오른 20만7000원에 거래를 시작, 장 초반 21만원까지 고점을 높였다.카카오는 특히 광고, 전자상거래 등 톡비즈부문과 모빌리티, 페이 등 신사업부문 성장이 주목받고 있다.미래에셋대우는 “지난 수년간 진행해오던 여러 신규 사업들의 확고한 성장 흐름이 확인되면서 의미 있는 외형 성장세가 향후 2~3년간 지속될 가능성이 높아졌다”며 2021년으로 갈수록 실적 개선폭이 확대될 것으로 내다봤다.김창권 미래에셋대우 연구원도 “카카오뱅크, 카카오페이증권, 카카오모빌리티 등 자회사 기업공개(IPO) 모멘텀이 마무리될 때까지는 카카오 주가의 우상향 흐름이 기대된다”면서 목표주가를 8일 종가 대비 36% 높은 28만원으로 잡았다.NH투자증권과 하이투자증권은 목표주가를 27만원으로 상향했다. 각각 이전보다 20.00%, 28.57% 높인 수치다. 이밖에 한국투자증권, 신한금융투자, KB증권, 대신증권, SK증권, KTB투자증권 등도 목표주가를 올려잡았다.이민아 대신증권 연구원은 “카카오의 실적에 놀라기도, 고점을 논하기도 이르다”며 “업종 최선호(Top-pick) 의견을 유지한다”고 말했다.pink@heraldcorp.com
- Copyrights ⓒ 헤럴드경제 & heraldbiz.com, 무단 전재 및 재배포 금지 -",/news/news_read.nhn?article_id=0001671641&office_id=016&mode=search&query=카카오&page=4
,"위메프오가 ‘할인티켓’ 서비스에 신규 입점하는 파트너사들의 부담을 낮춰주기 위해 올해 말까지 ‘중개수수료 0% 정책’을 시행한다고 11일 밝혔다.

위메프오는 ‘배달픽업’ 서비스와 ‘할인티켓’ 서비스를 운영하고 있다. 할인티켓 서비스는 내 주변의 맛집과 뷔페, 뷰티, 레저?키즈, 생활?여가, 해외 입장권, 제주 이용권 등 다양한 분야의 매장 티켓을 판매하는 플랫폼이다.
 이번 중개수수료 0% 정책은 매장을 운영하는 업주가 고객을 유치하기 위해 여러가지 프로모션을 진행할 수 있도록 플랫폼(위메프오)을 무료로 제공하자는 취지로 기획했다.

파트너사는 위메프오 할인티켓 서비스에 신규 입점해 정가의 5% 이상 할인된 가격으로 상품을 판매하면 중개수수료 0% 혜택을 받을 수 있다. 업주는 플랫폼에서 매장 홍보, 특정메뉴 및 특정시간 할인, 전메뉴 할인 등 다양한 프로모션도 진행할 수 있다.
 위메프오에서는 파트너사들의 판매 촉진을 위해 티켓 구매자들에게 구매금액의 5% 적립 혜택을제공한다. 포인트는 신용카드, 유료 포인트로 결제 시 적립된다. 적립된 포인트는 위메프오에서 여행?뷰티?레저 등 O2O 티켓을 비롯해 배달?픽업 메뉴 구매 시 현금처럼 사용할 수 있다. 포인트 적립 비용은 전액 위메프오가 부담한다.
 이에 따라 위메프오 할인티켓을 사용하는 고객들은 기본 5% 할인과 위메프오의 5% 적립금으로 총 10% 상당의 가격 혜택을 받게 된다.
 한편 위메프오 내에서 픽업?배달 매장을 운영 중인 파트너사는 위메프오 카카오채널을 통해 티켓서비스에서도 간편하게 등록, 판매할 수 있다.
 위메프오 관계자는 “소셜커머스 초기부터 쌓아온 지역 딜 서비스의 역량을 바탕으로 위메프오 앱내에서 할인티켓 서비스를 운영 중”이라며 “중개수수료 0% 혜택과 소비자 적립 혜택 제공이 사장님들의 매출 활성화로 이어질 것으로 기대한다”고 말했다.
 김현주 기자 hjk@segye.com

ⓒ 세상을 보는 눈,",/news/news_read.nhn?article_id=0003463863&office_id=022&mode=search&query=카카오&page=4
"-카카오엔터프라이즈, KBS와 업무협약 체결-영상 콘텐츠에 시각 엔진 기술도 결합","[헤럴드경제=유동현 기자] 자동으로 재난 방송을 전달하는 인공지능(AI) 아나운서가 연내 등장한다.카카오엔터프라이즈는 AI 기술을 활용한 미디어 인프라 및 재난방송 시스템 구현을 위해 KBS와 업무협약(MOU)을 맺었다고 11일 밝혔다.이번 협약을 통해 양사는 재난 방송 AI 아나운서를 연내에 선보이기로 했다. KBS는 재난방송 주관사로 기상청에서 재난 정보를 받아 속보로 내보내는 시스템을 운영하고 있다. 여기에 AI 아나운서가 도입되면 심야, 주말, 공휴일에도 효율적인 재난 방송이 가능해진다.재난 방송 시스템 구축을 위해 카카오엔터프라이즈의 AI 기술이 활용됐다. 카카오엔터프라이즈의 자연언어 처리기술을 적용해 빠르고 정교하게 원고를 만들도록 돕는다.이후 텍스트 음성변환 기술(Text To Speech, TTS)을 활용해 원고를 KBS 아나운서 목소리로 자동 변환해 방송을 송출한다. 소량의 녹음 데이터로도 빠르게 음성 합성하는 ‘딥보이스 기술’을 통해 음성 합성 속도 문제를 해결하고 빠른 재난 방송 대처가 가능하다고 카카오엔터프라이즈 측은 설명했다.이와 함께 통합 AI 플랫폼 ‘카카오i’의 시각 엔진 기술을 활용해 KBS 영상 콘텐츠의 편집, 검색, 관리 시스템 혁신도 지원한다.시각 엔진을 활용하면 드라마, 예능, 뉴스, 교양시사다큐 등 다양한 영상에서 인물, 주제, 키워드 등 중요 데이터를 자동으로 추출 및 분류할 수 있다.자체 분산 저장(스토리지) 기술과 동영상을 여러 포맷으로 변환할 수 있는 미디어 트랜스코딩 기술 등 AI 플랫폼을 지원하는 클라우드 인프라 서비스도 함께 제공할 예정이다.카카오엔터프라이즈 측은 “AI와 클라우드 기술로 KBS의 방송 시스템과 미디어 인프라 구축을 전격 지원하고 방송제작 환경을 혁신하기 위해 힘쓸 것”이라며 “앞으로도 AI 비즈니스로 이용자에게 더 가치 있는 서비스와 편의를 제공할 수 있도록 다양한 방안을 모색할 것”이라고 말했다.dingdong@heraldcorp.com
- Copyrights ⓒ 헤럴드경제 & heraldbiz.com, 무단 전재 및 재배포 금지 -",/news/news_read.nhn?article_id=0001671694&office_id=016&mode=search&query=카카오&page=4
,"[머니투데이 이재은 기자] 위메프오가 ‘할인티켓’ 서비스에 신규 입점하는 파트너사들의 부담을 낮춰주기 위해 올해 말까지 ‘중개수수료 0% 정책’을 시행한다고 11일 밝혔다.위메프오는 ‘배달픽업’ 서비스와 ‘할인티켓’ 서비스를 운영하고 있다. 할인티켓 서비스는 내 주변의 맛집과 뷔페, 뷰티, 레저·키즈, 생활·여가, 해외 입장권, 제주 이용권 등 다양한 분야의 매장 티켓을 판매하는 플랫폼이다.이번 중개수수료 0% 정책은 매장을 운영하는 업주가 고객을 유치하기 위해 여러가지 프로모션을 진행할 수 있도록 플랫폼(위메프오)을 무료로 제공하자는 취지로 기획했다.파트너사는 위메프오 할인티켓 서비스에 신규 입점해 정가의 5% 이상 할인된 가격으로 상품을 판매하면 중개수수료 0% 혜택을 받을 수 있다. 업주는 플랫폼에서 매장 홍보, 특정메뉴 및 특정시간 할인, 전메뉴 할인 등 다양한 프로모션도 진행할 수 있다.위메프오에서는 파트너사들의 판매 촉진을 위해 티켓 구매자들에게 구매금액의 5% 적립 혜택을제공한다. 포인트는 신용카드, 유료 포인트로 결제 시 적립된다. 적립된 포인트는 위메프오에서 여행∙뷰티∙레저 등 O2O 티켓을 비롯해 배달∙픽업 메뉴 구매 시 현금처럼 사용할 수 있다. 포인트 적립 비용은 전액 위메프오가 부담한다.이에 따라 위메프오 할인티켓을 사용하는 고객들은 기본 5% 할인과 위메프오의 5% 적립금으로 총 10% 상당의 가격 혜택을 받게 된다.한편 위메프오 내에서 픽업·배달 매장을 운영 중인 파트너사는 위메프오 카카오채널을 통해 티켓서비스에서도 간편하게 등록, 판매할 수 있다.이재은 기자 jennylee11@mt.co.kr
<저작권자 ⓒ '돈이 보이는 리얼타임 뉴스' 머니투데이, 무단전재 및 재배포 금지>",/news/news_read.nhn?article_id=0004406615&office_id=008&mode=search&query=카카오&page=4
