head,text,url
,"올 뉴 쏘렌토 주행사진.  제공 | 기아차[스포츠서울 이상훈 기자] 지난 26일 국회의사당 인근 서울마리나에서 ‘올 뉴 쏘렌토’를 시승했다. 첫인상부터 세련됨과 견고함을 두루 갖춘 SUV라는 느낌이 와닿았다. 기아차의 패밀리룩을 따랐지만 셀토스 정도의 크기에서는 다소 어색했던 모습이 덩지를 키운 쏘렌토에서는 잘 맞아 떨어졌다. 선이 굵은 남성미 넘치는 앞모습이다.시승 코스는 서울마리나에서 경기도 양주에 위치한 반환점까지 간 후 다시 돌아오는 약 100㎞에 달하는 거리였다. 초반에는 도로가 막혀 천천히 달렸는데 그동안 차량 내부의 이것저것을 꼼꼼하게 살펴볼 수 있었다. 스마트스트림 D2.2 디젤 엔진과 스마트스트림 습식 8단 DCT와 각종 첨단 사양이 적용된 최상위 모델이었기에 운전하는 내내 즐거움을 만끽할 수 있었다.올 뉴 쏘렌토의 콕피트 인테리어.  이상훈 기자 party@sportsseoul.com내부에는 12.3인치 클러스터, 10.25인치 UVO 내비게이션이 큼직하게 장착돼 있다. 속도를 서서히 높이며 후방 교차 충돌방지 보조(RCCA), 후측방 모니터(BVM) 등의 기능을 경험했다. 주변에 차량이 다가와 충돌 가능성이 높아지면 경고를 해준다. 차선 변경을 하려고 방향지시등을 켜면 클러스터 화면에 옆 차선 영상이 제공돼 아웃사이드 미러보다 빠르게 옆 차선 정보를 확인할 수 있었다. 차로유지 보조기능, 스마트 크루즈 컨트롤, 고속도로 주행보조 같은 기능을 활용하니 코너를 돌 때도 차선을 스스로 잘 유지해 줬다. 핸들에서 손을 떼면 경고등이 켜져서 잡고 있어야 했지만 스스로 속도도 잘 조절하고 간격도 유지했다. 차선 변경까지 알아서 하지는 않지만 운전하는 전 과정에서 시스템이 서포트해 주니 확실히 운전하기 편했다. 고속도로에서 잠깐 시속 150㎞까지 속력을 높였다. 힘이 좋아 가속도 매끄럽다. 시속 120㎞쯤에서 살짝 변속하는 느낌이 들었지만 그 뒤로 무리 없는 가속력을 자랑했다.GV80보다 보기 편했던 올 뉴 쏘렌토의 HUD. 이상훈 기자  party@sportsseou.com무엇보다 마음에 드는 것은 과속방지턱을 넘을 때 흔들림이 매우 적었던 부분이다. 전반적으로 SUV답지 않은 정숙성을 자랑했다. HUD도 꽤 선명해 전방만을 주시할 수 있어 좋았다. 다만 기대했던 카카오 연동 음성인식 기능은 몇몇 문장을 제대로 인식하지 못했다. “목적지까지 얼마나 남았어?”라고 3번에 걸쳐 질문했지만 인식하지 못했다. 레그룸 높이가 낮아 성인이 앉기 힘든 3열 좌석은 아쉬웠다.  이상훈 기자 party@sportsseoul.com특이하게도 2열은 독립시트로 꾸며졌다. 옵션에 따라 2열 가운데가 연결된 7인승을 선택할 수 있지만 5명 꽉 채워 탑승할 일이 별로 없는 환경에서는 좌석 간격이 넓고 팔걸이가 있는 2열 독립시트가 참 편해 보였다. 또 곳곳에 USB 충전 단자와 컵홀더가 마련돼 있어 패밀리카로 매우 유용할 듯했다. 3열 시트를 접으면 수납공간이 넉넉한데 사실상 3열은 레그룸 높이가 지나치게 낮아 성인은 물론 초등학생도 고학년이면 탑승하기 어려울 정도였다. 5인승을 선택하는 게 나아보였다. 짧은 첫 주행을 마친 뒤 쏘렌토는 ‘패밀리카가 갖춰야 할 여러 요소들을 모두 포함한, 운전의 피로를 줄여주는 차량’이라는 생각을 했다. LG전자가 곧 출시할 자사 스마트폰을 가리켜 ‘매스 프리미엄(대중적인 명품)’이라고 지칭하는데 딱 그 느낌이다. GV80을 탔던 느낌과 비교해봐도 큰 차이를 느끼기 어려웠다. 디자인, 넓은 내부 공간, 첨단 주행기능 등 충분히 프리미엄 차량이라 부를 만했다. 합리적인 가격과 프리미엄 성능을 적절히 섞어 ‘매스 프리미엄’이라 부르기 손색 없어 보인다.굳이 흠을 잡는다면 역시 실제 탑승 활용도가 떨어지는 3열 시트, 아쉬운 음성인식 기능, 그리고 콕피트 곳곳에 굵게 자리한 에어컨 송풍구의 회색 테두리 정도가 불만족스러웠다. 타고 나니 갖고 싶어지는 그런 차량이었다.party@sportsseoul.com[기사제보 news@sportsseoul.com]
Copyright ⓒ 스포츠서울&",/news/news_read.nhn?article_id=0000642119&office_id=468&mode=search&query=카카오&page=1
기준금리 ‘빅컷’ 이후 후속 조치은행 간판상품 매력 떨어지지만3~6개월 예금 수요는 꾸준할 듯,"기준금리가 0%대(연 0.75%)에 진입하면서 은행에서 판매하는 1년 만기 정기예금 기본금리가 줄줄이 0%대에 진입했다. 이에 따라 연 0.7% 금리를 제공하는 1년 만기 정기예금에 1000만원을 가입하면 실제 수령 이자가 약 6만원에 불과하다.
 29일 금융권에 따르면 시중은행과 지방은행, 인터넷전문은행 등 은행권에서 예금금리를 빠르게 인하하고 있다. 한국은행이 기준금리 '빅컷'(0.5%포인트 인하)에 나서면서 은행들도 후속 조치에 나선 것이다.
 은행의 대표적 예금 상품인 정기예금 금리가 0%대로 떨어지면서 상품 매력도는 크게 떨어질 것으로 보인다. 예를 들어 연 0.7% 금리를 주는 1년 만기 정기예금에 1000만원을 넣으면 세전 이자는 7만원이다. 여기에 이자소득세 15.4%를 제외하면 1년 후 실제 수령하는 이자는 5만9220원에 그친다.
 다만 최근 코로나19 사태 등 금융시장이 혼란스런 모습을 보이고 있는 만큼 만기가 3~6개월 단기 정기예금 수요는 꾸준히 이어질 것이란 관측도 있다. 은행권 관계자는 ""예금금리가 최근 하락하고 있는 가운데 코로나19 여파로 대기성 자금이 늘고 있어 만기가 1년 이상인 정기예금 보다는 3~6개월 단기 정기예금을 찾는 수요가 늘었다""고 전했다.
 KB국민은행은 지난 25일 예금금리를 인하했다. 이에 따라 1년 만기 일반정기예금 금리는 기존 연 1.00%에서 연 0.80%로 0.20%포인트 하락했다. 1년 만기 국민수퍼정기예금 금리도 연 1.05%에서 연 0.90%로 낮췄다. NH농협은행도 25일부터 연 1.00%의 금리를 주던 일반정기예금 금리를 연 0.70%로 0.30%포인트 인하했다. 큰만족실세예금(개인)의 금리는 연 0.75%로 하락했다. IBK기업은행은 수신금리를 최대 0.40%포인트 인하했다. 이에 따라 정기예금 금리는 연 1.20%에서 연 0.80%로 떨어졌다.
 우리은행도 일부 정기예금에 대한 추가 금리 인하에 나섰다. 신한은행과 하나은행도 ""기준금리 하락에 따라 수신금리 인하를 검토 중""이라며 시기를 저울질 하고 있다. 내달 중순 변동형 주택담보대출 금리의 기준이 되는 코픽스(COFIX·자금조달비용지수)가 하락할 것으로 보이는 만큼 예금금리 인하를 더 이상 미루기 어렵기 때문이다.
 아울러 지방은행과 외국계은행도 0%대로 정기예금 금리를 낮췄다. BNK부산은행은 26일부터 기준금리 인하분을 반영해 수신상품 금리를 0.10~0.50%포인트 인하했다. DGB대구은행도 수신금리를 0.20~0.60%포인트 낮췄다. 씨티은행의 정기예금 금리는 연 1.00%에서 연 0.70%로 낮아졌다. 인터넷전문은행도 수신상품 금리를 내렸다. 카카오뱅크는 21일부터 세이프박스 금리를 연 1.00%에서 연 0.70%로 인하했다.


 ※ 저작권자 ⓒ 파이낸셜뉴스. 무단 전재-재배포 금지",/news/news_read.nhn?article_id=0004398393&office_id=014&mode=search&query=카카오&page=1
코로나사태 속 美증시로 본 성장주 투자전략코로나發 성장주 옥석 가리기폭락장서 아마존 등 주가선방비대면 쇼핑·콘텐츠·서버…입지탄탄한 IT 기업 피해적어만년적자 성장주 테슬라·우버현금보유량 우려에 주가 급락해외직구족 수익률 희비교차韓 클라우드·온라인결제 주목,"◆ 제로금리시대 생존재테크 ② ◆
# 아마존 주가는 나스닥이 최고점을 찍던 2월 19일 이후 코로나19로 인한 급락장에서도 지금까지 12.4% 하락에 그쳤다. 사람들이 외부 활동을 자제하면서 오히려 배송 주문은 늘어났고 '언택트'와 재택근무로 인한 데이터 처리 급증으로 클라우드산업 성장세가 더 빨라질 것으로 기대하는 덕분이다. 반면 아마존처럼 해외직구족의 순매수가 집중된 테슬라는 주가가 지난달 19일 이후 43.9%나 빠졌다. 밸류에이션 거품이 빠지면서 만년 적자 상태인 불안정한 재무구조가 투자자들을 불안하게 했기 때문이다. 저금리 시대에는 성장주가 가치주보다 떠오를 수밖에 없다. 이자율이라는 것은 미래가치를 할인하는 것에 쓰이는데 고금리 상황에서는 성장기업이 미래에 벌 돈이 많이 할인돼 현재의 기업가치가 떨어진다. 그러나 제로금리 시대에는 사실상 할인율이라는 게 없어 제로금리 시대에는 1년 후 받을 100원은 지금 가지고 있는 100원이나 마찬가지다. 그러니 현재 자산이 많은 기업보다는 미래 가치가 높은 기업이 더 각광받는다. 그러나 이번 코로나19가 휩쓸고 간 미국 증시에서 성장주 간에도 희비는 엇갈렸다. 이미 시장 지배력이 확고하고 이익을 계속 창출해 온 성장기업은 주가가 덜 빠지고 지난주 반등장에서도 회복 속도가 빨랐지만 성장에 대한 기대만으로 높은 밸류에이션을 받았던 기업은 고전하고 있다.
 미국 주식을 보면 애플, 마이크로소프트, 구글 등 처럼 계속 높은 실적을 내놓으며 시장 지배력을 과시했던 대형 기술주는 지수가 30% 빠지는 상황에서도 주가가 상대적으로 덜 빠지고 반등 속도도 빨랐다. 특히 아마존이나 넷플릭스(고점 대비 7.5% 하락)는 '언택트' 트렌드의 수혜로 주가 조정이 별로 없었다. 반면 테슬라가 43.9%, 우버가 33.5% 빠지는 등 흑자를 내지 못하는 성장주는 오히려 지수보다 주가가 더 큰 폭으로 하락했다. 테슬라는 전기차 시장에 대한 기대감으로 주가가 연초부터 2월 중순까지 두 배나 올랐으나 그만큼 하락세도 가팔랐다. 적자로 2018년에는 현금이 아예 고갈될 위기에 처했던 기업인지라 요즘처럼 현금 보유량이 기업의 생존을 좌우하는 시기에 성장성보다는 재무구조에 방점이 찍힌 것이다. 강방천 에셋플러스자산운용 회장은 ""성장기업이라고 하더라도 현재 적자가 미래 시장 독식을 보증한다는 것이 명확해야 기업가치가 계속 유지될 수 있을 것""이라고 말했다. 또 그는 ""이번 코로나19 사태가 아니더라도 언택트 관련주나 플랫폼 기업 성장세는 탄탄했는데 이번에 더욱 FAANG(페이스북·애플·아마존·넷플릭스·구글) 기업처럼 혁신기업의 시장 지배력이 더욱 공고해진 것""이라며 ""빅데이터, 인공지능, 클라우드 등 미래 산업 생태계를 바꿀 수 있는 일등 기업의 승자독식 현상이 일어날 수 있다""고 덧붙였다.코로나19가 바꾼 생활 방식 변화가 '언택트'와 '사회적 거리 두기'라는 점을 감안하면 앞으로도 재무 상태와 이익 전망이 탄탄한 정보기술(IT) 업종의 성장세는 계속될 수도 있다. 유동원 유안타증권 글로벌인베스트먼트본부장은 ""G20 정상들도 영상회의를 하듯이 이번에 기업문화를 비롯해 사회문화도 온라인 소통이 늘어나는 방향으로 바뀔 것""이라며 ""동영상 기술 활용이 크게 늘어나면서 5G, 서버, DRAM 반도체 등 기술에 대한 수요가 늘어날 것""이라고 전망했다. 박희찬 미래에셋대우 글로벌자산배분팀장 역시 ""아마존의 경우 창고를 더 사고 인력을 10만명 더 늘려야 된다고 얘기했을 만큼 이번 사태 때문에 큰 타격을 입지는 않은 것으로 보인다""며 ""앞으로 이런 트렌드가 더 익숙해지는 계기가 될 수 있기 때문에 IT 관련주의 장기 고성장세에 힘을 실어줄 수 있다는 입장""이라고 말했다. 미래에셋대우에 따르면, IT 소프트웨어·서비스는 S&P500지수가 최고치를 기록하던 지난달 19일에 비해 27일 기준 19.5% 하락했지만 금융업은 30.4%, 에너지는 43.4% 하락할 정도로 가치주가 부진을 면하지 못했다. 대신증권에 따르면 최근 3개월간 주당순이익(EPS) 전망치 변동을 살펴보면 IT·유틸리티 업종은 각각 0.7%, 0.1% 증가했다.
헬스케어 부문도 -0.2%로 선방한 편이다. 반면 에너지업종은 41.1% 하락하고 산업재 14.8% 하락, 소재 10.4% 하락 등 전통적인 경기순환업종 타격이 컸다.
이 같은 현상은 미국뿐만 아니라 한국에서도 그대로 재현될 것으로 보인다. 코로나19로 인해 코스피 증시가 급락하던 시기에도 상대적으로 선방한 종목은 네이버, 카카오 등 플랫폼 기업, 엔씨소프트 같은 엔터테인먼트, 더존비즈온 등 클라우드 관련 종목이었다. 대부분 현금 보유나 재무 상태도 우량한 IT 기업들이라 향후 전체 증시와 상승폭에서 더 큰 차이를 낳을 것으로 보인다. 이나예 한국투자증권 연구원은 ""초기 언택트 서비스는 '소비자의 원치 않는 접촉 회피'로 이용됐지만 그 편의성을 인식하게 된 기업과 개인들에 의해 저변이 점점 확대될 것""이라며 ""클라우드 부문 삼성SDS나 온라인 결제 시장의 수혜를 받을 NHN한국사이버결제 등도 언택트 수혜를 받을 것""이라고 말했다. [김제림 기자 / 문가영 기자] [ⓒ 매일경제 & mk.co.kr, 무단전재 및 재배포 금지]",/news/news_read.nhn?article_id=0004546404&office_id=009&mode=search&query=카카오&page=1
,"미국 뉴욕주에 사는 라이언 정 씨(34)는 최근 넷플릭스에 접속하면 버벅거리거나 프리뷰(미리보기)가 늦게 떠 답답할 때가 많다. 신종 코로나바이러스 감염증(코로나19) 확산에 따른 각국 정부의 이동제한 조치로 동영상 스트리밍 서비스 이용이 급증해 인터넷 트래픽에 과부하가 걸린 탓이다. 정 씨는 “지역마다 차이는 있겠지만 지인들이 접속지연과 같은 오류를 한 번쯤은 경험하고 있다”고 말했다.
최근 북미와 유럽을 중심으로 동영상 스트리밍, 게임, 채팅, 배달 등 다양한 온라인 서비스의 연결 오류, 접속 지연, 로그인 실패가 속출하고 있다. 코로나19 여파로 집에 머물게 된 사람들이 온라인 서비스로 몰리고 있기 때문이다.
29일 인터넷서비스 접속 장애 모니터링 업체 다운디텍터에 따르면 이날 현재 북미와 유럽을 중심으로 넷플릭스, 디즈니플러스, 퍼니메이션 등 동영상 스트리밍과 오리진(일렉트로닉아츠·EA의 온라인 게임 서비스), 엑스박스라이브(마이크로소프트의 온라인 게임 서비스), 콜오브듀티 등 게임 서비스에 문제가 있다는 보고가 나타났다.
 특히 스냅챗(메신저), 엑스박스라이브, 콜오브듀티는 최근 3주(3월 9~29일) 연속으로 오류 보고 상위 10위권에 포함됐다. 넷플릭스는 이달 12일부터 매일 서비스 이상 현상이 보고 되고 있다. 실제로 많은 이용자들이 소셜네트워크서비스(SNS)에 “넷플릭스 오류(NSEZ-403) 메시지가 떴다”, “엑스박스라이브 연결에 문제가 있다”, “오리진 서버가 다운됐다”는 글을 올리고 있다.
 이에 엑스박스 측은 공식 트위터에 “이용자들이 MS 스토어를 탐색하고 콘텐츠를 구입하는데 문제를 겪고 있음을 인식하고 이를 들여다보고 있다”며 진화에 나섰고, EA 측도 트위터에 “오리진 게임 목록을 띄울 수 없다는 이용자들의 리포트를 조사하고 있다”고 밝혔다.
하지만 폭증하는 트래픽을 소화하려면 결국 ‘고속도로’ 격인 통신 네트워크 인프라 증설이 이뤄져야 해 단기간에 문제 해결은 어려운 상태다.
 이 때문에 유럽연합(EU)은 최근 글로벌 플랫폼 업체에 차라리 화질을 낮춰달라고 권고하기도 했다. 네트워크망 안정성을 우려한 것이다. EU의 권고로 넷플릭스, 유튜브, 아마존, 디즈니 등 동영상 스트리밍 서비스 업체들은 유럽에서 영상의 스트리밍 전송률(비트 레이트)를 낮추기로 했다. 페이스북과 게임회사 소니인터렉티브엔터테인먼트도 동참했다. 유튜브는 한국에서도 기본 화질을 고화질(HD)에서 저화질(SD)로 낮췄다.
국내 인터넷 트래픽도 증가하는 추세다. 과학기술정보통신부에 따르면 국내 통신사업자의 3월 인터넷 트래픽은 1월 대비 약 13% 늘었다. 하지만 한국은 북미나 유럽처럼 대규모 서비스 오류로 이어지고 있지는 않다. 이달 들어 세 차례에 걸쳐 카카오톡 메시지 전송 오류, 카톡 내 선물하기, 쇼핑하기 접속 및 주문 오류 등 문제가 발생했지만 카카오 측은 “장비 오류일 뿐 코로나19로 인한 트래픽 증가와 무관하다”고 해명했다.
 한국은 통신 네트워크 인프라를 담당하는 통신사의 트래픽 이용량 최고치가 보유 용량의 45~60% 정도로 여유가 있다는 게 통신업계의 설명이다. 그럼에도 국내 통신사들은 코로나19 장기화에 따른 트래픽 증가에 대비해 통신장비업체들과 망증설과 관련한 협의를 진행하고 있다. 한 통신사 관계자는 “트래픽 추이를 토대로 증설 계획을 수립해 진행할 예정”이라고 전했다. 신무경 기자 yes@donga.comⓒ 동아일보 & donga.com, 무단 전재 및 재배포 금지",/news/news_read.nhn?article_id=0003277931&office_id=020&mode=search&query=카카오&page=1
,"[앵커]코로나19로 몇몇 기업에서 재택근무를 시작한 지도 한 달이 넘어갑니다. 효과적인 사회적 거리 두기라며 좋은 평가도 나오는데, 중소기업들은 인프라가 부족해 재택근무를 시도조차 하기 힘든 곳도 많습니다.송지혜 기자입니다.[기자]네이버와 넷마블은 다음 달 3일까지 재택근무 기간을 늘리기로 했습니다.카카오는 아예 기한을 정하지 않았습니다.마냥 재택근무를 할 수 없는 일부 제조업체들은 유연근무 등으로 돌렸지만, IT나 게임업계에는 그대로 재택근무를 연장한 곳이 많습니다.그러나 중소기업에겐 쉽지 않은 일입니다.한 조사에 따르면 재택근무를 시행할 계획이 없다고 답한 기업의 25%가 '관련 인프라 부족'을 이유로 꼽았습니다.그러자 원격업무나 화상회의에 필요한 서비스를 무료로 지원하는 업체도 늘고 있습니다.사회적 거리 두기에 힘을 싣기 위해서입니다.NHN은 협업이 가능한 클라우드 서비스를 석 달 간 제공하는데, 지금까지 450여 중소기업이 무상 지원을 받았습니다.코로나19가 확산되면서 기업들이 가장 많이 하게 된 것 중 하나가 화상회의입니다.화상회의 등 재택근무에 필요한 프로그램들 패키지를 지원하는 기업도 있습니다.[송호철/더존비즈온 상무 : (중소기업이) 비디오 콘퍼런스, 화상회의 같은 것을 모바일과 웹을 통해서 하는 이런 것들을 굉장히 잘 쓰고 있습니다.](영상디자인 : 최석헌)송지혜 기자 (song.jihye@jtbc.co.kr) [영상취재: 김진광 / 영상편집: 김영선]Copyright by JTBC(http://jtbc.joins.com) All Rights Reserved. 무단 전재 및 재배포 금지",/news/news_read.nhn?article_id=0000234727&office_id=437&mode=search&query=카카오&page=1
