head,text,url
,"[서울=뉴시스] 김동현 기자 = NH투자증권은 4일 현대오토에버(307950)에 대해 ""신종 코로나바이러스 감염증(코로나19) 확산으로 상반기까지는 신규 시스템 인티그레이션(SI) 프로젝트 집행 지연이 예상되지만 매출액의 과반은 경상적 IT 아웃소싱 매출로 실적 가시성이 높다. 디지털 전환 가속화에 따른 전략사업의 중장기 성장 가능성은 유효하다""며 투자의견을 매수 유지, 목표주가로 5만5000원을 제시했다. 김동양 NH투자증권 연구원은 ""1분기 실적은 매출액 3290억원, 영업이익 114억원을 기록했다. 매출액은 전년동기대비 7% 증가했지만 영업이익은 3% 감소하며 시장 기대치를 소폭 하회했다""며 ""SI부문은 전년대비 3% 감소한 1468억원의 실적을 기록했다. 코로나19로 인한 중국 SI 프로젝트 지연으로 외형이 축소됐다""고 분석했다. 이어 "" IT아웃소싱은 전년대비 17% 증가한 1823억원의 실적을 올렸다""며 ""현대모비스 인력 통합과 인도 기아차 신공장 시스템 운영 증가로 실적이 큰 폭으로 성장하며 SI 부문 부진 상쇄한 것으로 분석된다""고 설명했다.
2분기 전망에 대해서는 ""코로나19 확산에 따른 SI 부문 역신장을 국내외 계열사 IT인원 통합 통한 IT아웃소싱 부문 강세로 상쇄하며 전년대비 3% 감소한 영업이익 222억원을 전망한다""고 예상했다. 김 연구원은 ""코로나19 확산에 따른 비대면 경제 인프라 구축(디지털전환) 가속화에 대한 기대가 커지고 있다""며 ""삼성에 이어 LG, SK도 향후 2년 이내 그룹 차원의 클라우드 전환 완료를 목표로 제시했다. 현대오토에버는 글로벌 One-IT, 스마트팩토리 등 전략 사업의 매출 비중 확대 통한 중장기 성장 강화 및 수익성 개선이 전망된다""고 의견을 밝혔다. oj1001@newsis.com<ⓒ 공감언론 뉴시스통신사. 무단전재-재배포 금지>",/news/news_read.nhn?article_id=0009844703&office_id=003&mode=search&query=현대모비스&page=1
▶ 네이버 홈에서 [한국경제TV] 채널 구독하기 [생방송보기]▶ 대한민국 재테크 총집결! - [증권 / 주식상담 / 부동산],"분양시장 경쟁이 치열해지면서 지역 특색을 반영한 특화 설계로 승부수를 던지는 건설사들이 늘고 있다. 산과 바다, 호수 등 주변 환경을 활용한 특화 커뮤니티나 지역민의 니즈를 고려한 맞춤 설계를 선보이는 등 상품성의 차별화를 통해 경쟁력 확보에 나서고 있는 모습이다.예컨대 지난 10월 경남 거제시 고현동에 분양한 ‘e편한세상 거제 유로아일랜드’는 바다와 인접한 지리적 이점을 활용해 각 동 상층부에 바다 조망이 가능한 피트니스 시설, 노천탕 등의 커뮤니티 시설을 마련해 수요자들의 이목을 끌었다. 한국감정원 청약홈 자료를 보면 이 단지는 1순위 청약에서 1,803명이 접수하며 2015년 이후 약 4년 만에 가장 많은 청약자가 몰렸다.지난해 5월 서울 성북구 길음동에 공급된 '롯데캐슬 클라시아'는 주변으로 고려대, 성신여대, 동덕여대 등 대학교가 인접한 입지적 특성을 고려해 임대수익 창출이 가능한 부분임대형 설계를 적용했다. 이 단지는 특별공급을 제외한 375가구 모집에 무려 1만2,241명이 몰리면서 평균 32.64대 1의 경쟁률로 1순위 마감에 성공했다.같은 달 경기 하남시 학암동에 선보인 ‘위례신도시 우미린 1차’는 764가구(특별공급 제외) 모집에 3만2,880명이 접수하면서 평균 43.04대 1의 경쟁률을 보였다. 이 단지는 위례신도시 주민들이 중대형 평형을 선호한다는 점을 고려해 100% 중대형(전용 102~114㎡)으로 상품을 구성해 수요자들의 높은 호응을 얻었다.한 부동산 전문가는 “분양시장이 실수요자 위주로 재편되면서 자연환경이나 지역정서 등이 반영된 아파트 설계가 등장하고 있다”며 “어디서나 볼 수 있는 획일적인 설계보다는 지역민들의 특성을 파악해 선호하는 주택형이나 특화 평면, 부대시설 등을 조성하는 새로운 마케팅 전략인 셈이다”라고 설명했다.㈜신영도 지역민의 니즈를 반영한 맞춤형 설계를 선보여 눈길을 사로잡고 있다. 오는 5월 울산 동구 서부동 일원에 공급되는 '울산 지웰시티 자이'는 단지 내부로 오토바이 주차장을 도입한다. 단지 바로 맞은 편에 위치한 현대중공업 직원들이 오토바이를 타고 출퇴근하는 것을 고려한 맞춤형 설계다.이 뿐 아니라 공간활용성을 높인 다양한 특화 설계도 적용된다. 세대 내 알파룸, 팬트리, 현관창고, 드레스룸, 침실팬트리 등 다양한 수납공간이 제공돼 보다 넓은 실사용 공간을 확보했다. 또한 계절용품이나 부피가 큰 물건 등을 따로 보관할 수 있도록 지하주차장의 빈 공간을 활용해 세대별 계절창고도 제공한다.신영만의 실용성 높은 평면 구조도 선보인다. 4Bay 판상형 맞통풍 위주 설계로 채광 및 통풍을 극대화했으며 거실-식당-주방으로 이어지는 LDK 구조로 개방감을 높였다. 특히 전용 84㎡A와 전용 107㎡는 식당에 통창 설계를 적용해 통풍 및 환기가 용이하고 식사를 하면서 외부 조망도 가능하도록 했다.입지 여건도 우수하다. 서부초, 녹수초, 현대중, 현대청운중, 현대고, 현대청운고 등의 학교시설을 도보로 이용할 수 있고 울산동부도서관, 학원가 등도 인접해 있다. 여기에 현대백화점(울산동구점), 울산대학교병원 등 생활 편의시설을 비롯해 주변으로 염포산, 큰마을저수지, 명덕저수지, 현대예술공원 등 녹지공간도 풍부해 쾌적한 주거환경을 누릴 수 있다.교통 여건도 양호하다. 2016년 울산대교가 개통되면서 울산 시내로의 이동이 한층 편리해졌다. 이뿐 아니라 단지 인근으로 방어진순환도로, 봉수로, 염포로, 염포산터널 등을 통해 울산 동구 및 타 지역으로 쉽게 이동할 수 있다.주요 산업단지와 접근성이 좋다. 현대중공업이 단지 바로 맞은 편에 있는 것을 비롯해 현대미포조선, 현대자동차, 현대제철 울산공장, KCC울산공장, 현대모비스 울산염포동공장 등 대규모 산업단지 내 주요기업체들까지 차량으로 20분 이내에 이동할 수 있어 직주근접 주거지로 손색이 없다.한편, 울산 지웰시티 자이는 총 2개 단지로 지하 5층~지상 최고 37층, 18개동, 59~107㎡ 총 2,687가구 규모로 조성된다. 견본주택은 울산 남구 달동 번영사거리 인근에 5월 중 개관할 예정이다. 입주는 2023년 4월 예정이다.디지털전략부ⓒ 한국경제TV, 무단 전재 및 재배포 금지",/news/news_read.nhn?article_id=0000868271&office_id=215&mode=search&query=현대모비스&page=1
"""정몽구 회장, 지배력 여전""…회사측 '세대교체론'  선 그어","[아이뉴스24 이연춘 기자] 정의선 현대차그룹 수석부회장이 현대차 이사회 의장직을 물려받으며 세대교체가 공식화됐다. 앞서 지난 3월 현대차는 주총 직후 열린 이사회에서 정 수석부회장을 이사회 의장으로 선임하며 '정의선 체제'를 공고히 했다.다만 매년 5월 초 이뤄졌던 공정거래위원회(이하 공정위)의 대기업집단(자산총액 10조원 이상 상호출자제한기업집단·5조원 이상 공시대상기업집단) 및 대기업집단 '총수(동일인)' 지정에 현대차의 총수 변화가 감지됐지만 정몽구 회장으로 유지됐다.재계 일각에선 정 회장의 건강이 악화해 정 수석부회장이 경영 전면에 나서며 사실상 세대교체를 이룬 것으로 알려졌다. 그러나 공정위는 정 회장의 지배력이 여전하다고 판단했다.4일 공정위에 따르면 정 수석부회장이 현대차그룹의 동일인(총수)으로 변경되지 않은 근거로 정 회장의 건강상태에 이상이 없다는 것을 확인했기 때문이다. 정 회장의 건강상태에 대한 의사의 건강소견서 등도 고려해 현대차의 동일인을 유지했다는 설명이다.지난 2018년 공정위는 삼성과 롯데의 총수를 직권으로 변경했다. 당시 두 그룹의 총수가 변경된 이유로 공정위는 ""지분율과 지배적 영향력 요건에서 중대·명백한 사정 변경이 있었기 때문""이라고 설명했다.정 회장은 현대차 미등기 임원으로서 회장직을 유지하고 있다. 80대 고령인 정 회장은 1999년 3월부터 현대차 이사회 의장을 맡아 현대차그룹을 세계적인 자동차 회사로 키워냈지만 지난 2018년부터 이사회에 참석하지 않고 공식석상에도 거의 모습을 드러내지 않았다.실제 현대차는 정 회장에 이어 정 수석부회장에게 현대차그룹 지휘봉을 넘기는 움직임은 이미 상당 부분 진행됐다. 정 회장이 21년 만에 의장직을 내려놓기로 하면서 정 수석부회장의 승계는 당연한 수순으로 여겨져 왔다. 정 수석부회장은 2018년 9월엔 수석부회장으로 승진하며 경영 전면에 본격 나서기 시작했다. 지난해 주총에서 현대차와 현대모비스 대표이사를 맡으며 책임경영을 강화했다.사실상 '정의선 시대'가 이미 시작됐다는 분석이 적지않다. 정 수석부회장은 현대차그룹 조직문화를 바꾸고 첨단 모빌리티 솔루션 지원업체로 방향을 세웠다.정 회장이 '책임경영'의 상징인 등기임원에서는 물러났지만 회장 역할은 지속적으로 맡아 그룹 경영의 주요 사안에 대한 최종 결정을 담당한다고 현대차그룹 측은 강조했다. 현대차 관계자는 ""정몽구 회장은 미등기임원, 회장으로서 역할을 지속하게 된다""며 일각에서 불거진 '세대교체론'에 대해서는 선을 그었다.공정위는 매년 5월 초 이른바 '총수'라고 불리는 대기업집단의 동일인을 지정한다. 동일인을 지정하는 이유는 기업집단에 어느 계열사까지 포함할지 결정하기 위한 것이다. 동일인은 그룹을 실질적으로 지배하는 기업인으로, 이 동일인이 바뀌면 특수관계인의 범위가 바뀌고 그에 따라 기업집단의 범위도 변동이 생긴다. 동일인 지정은 해당 그룹이 신청하면 공정위가 주식 지분과 그룹 경영에 대한 실질적 지배력 등을 종합적으로 검토해 수용 여부를 결정한다.하지만 대기업 집단과 총수를 정부가 공식인증하는 것 자체가 '낡은 제도'라는 비판이 만만찮다. 특히 새로운 지배구조를 가진 정보기술(IT) 기업들이 등장하면서 1986년부터 이어온 과거의 제도를 손질해야 한다는 목소리가 잇따르고 있다. staykit@inews24.com [ⓒ 아이뉴스24 무단전재 및 재배포 금지]",/news/news_read.nhn?article_id=0000536722&office_id=031&mode=search&query=현대모비스&page=1
,"여성이 일하기 좋은 회사는 월급만 많이 주는 회사가 아니다. 일을 더 잘하고 싶은 욕구와 현실과 싸우는 일을 수행 중인 여성에게 좋은 회사란 몇 가지 지표가 있다. ▲평등한 기회와 보상 제공 ▲일과 가정을 양립 ▲성별로 인한 제약 없는 승진 ▲성평등에 공감해 사회 공헌 등을 실천하는 회사다. 여성신문은 여성의 성장을 돕고 여성이 근무하기 좋은 일터를 소개하고자 한다.<편집자>'리니지 레볼루션', '블레이드&소울 레볼루션', '배틀로얄' 등 국내 대표 게임 개발 및 서비스 기업 넷마블이 직장과 가정 생활에 행복을 증진시킬 수 있는 행복한 일터 만들기에 노력하고 있다.넷마블은 지난해 매출 2조1755억원, 영업이익 2017억원을 기록했다. 업계서 시장 점유율 2~3위를 유지하는 회사다.넷마블은 직급 제도를 폐지하고 성과 중심 인사체계를 운영, 성별에 관계없이 업부 성과로 리더를 발탁하고 있다. 취업포털 인쿠르트가 지난해 사업보고서를 공시한 시가총액 상위 30대 기업(그룹사 포함)의 남녀 임금 현황을 분석한 결과, 국내 30대 기업의 임원 중 여성 비율은 약 4%인 것으로 나타났다. 총 임원수 3457명 중 여성 임원이 153명에 불과해 무려 남성과 여성 성비가 96:4에 달했다. 조직 내부에서 여전히 존재하는 유리천장의 단면을 보여주는 결과다.그런데 기업별로 보면 넷마블이 여성 임원의 비율이 높은 아모레퍼시픽(21%)에 이어 14%를 차지해 네이버(14%)와 여성 임원 비중이 같았다. 이어 LG생활건강(12%), 삼성SDS(11%) 등이 상위권을 형성했다. 여성 임원 비율이 0%대였던 SK하이닉스와 삼성바이오로직스, 신한금융지주, 현대모비스, 기아자동차 등과 비교하면 상반된다. 내부 여성 임원 배출이나 여성 임원을 영입 계획을 세워 여성 임원 배출에 노력이 반영된 것으로 풀이된다.또한 넷마블은 여성 직원이 남성 직원보다 평균적으로 근무를 오래 했다. 금융감독원 전자공시에 따르면, 넷마블은 지난해 말 기준 여성 직원이 4.3년으로 남성 직원(4.2년)보다 평균 근속연수보다 길었다. '월화수목금금금' 야근이 일상이라고 생각되는 프로그래머 업무 특성상 억지로 직원의 업무량을 늘리기보다는 업무효율은 중시하면서도 개인 생활 역시 존중하는 사내 문화가 바탕이 되었던 것으로 보인다.넷마블은 지난해 12월 여성가족부로부터 가족친화기업 인증을 받았다. 생활의 균형을 지원하는 기업에 대해 심사를 거쳐 인증을 부여하고 있다. 가족친화인증은 여성가족부가 지난 2008년 근로자의 일과 제도 실행 및 가족친화경영에 대한 직원들의 만족도 등이 심사 기준이 반영됐다.넷마블은 지난 2017년 2월부터 건강한 조직문화 정착의 일환으로 야근과 주말근무를 금지하고 탄력 근무제를 도입하는 '일하는 문화 개선안'을 시행해 오고 있다. 야근이 많은 게임업계에서 공식적으로 근무문화 개선을 선언한 것은 업계서 처음으로 한 시도다. 임직원의 일과 삶의 균형 향상 및 행복한 일터 만들기의 연장선상으로 지난해 3월 '선택적 근로시간제'도 도입하기도 했다.선택적 근로시간제는 임직원이 월 기본 근로시간 내에서 직원들간 업무 협업을 위한 코어타임(오전 10시~오후 4시)을 제외하고 나머지 업무 시간을 자율적으로 선택해 근무시간을 조절할 수 있다. 본인이 원한다면 일주일 동안 평일 기준 매일 5시간을 일한 뒤 오후 4시에 퇴근하는 것도 가능하다. 사전 연장근로 신청을 한 경우를 제외하고 야간 시간인 오후 10시부터 다음날 오전 8시까지, 휴일은 물론 월 기본 근로시간을 초과하는 연장근무도 일체 금지했다.넷마블은 '시간연차' 제도도 운영하고 있다. 시간 연차는 1일 단위로 사용할 수 있는 연차를 시간 단위로 분리해 사용하실 수 있도록 설계한 제도다. 임직원들의 시간 사용 효율을 극대화를 하기 위한 취지다.넷마블은 임직원의 여가시간을 효율적 활용을 위해 복지제도를 늘리고 있다. 연봉 외 연 250만원 상당 복지 포인트를 제공하며 근속 5년마다 휴가 및 휴가비를 지원하고 있다. 전 직원의 배우자 종합건강검진 및 의료비 지원 등을 통해 임직원의 건강을 살피고 있으며 명절 효도비, 출산선물 등을 제공해 임직원들의 호응을 얻고 있다.특히 육아 중이거나 임신한 직원들은 현행법보다 확대된 임신 전 기간 근로시간 단축제를 사용하고 있다. 최대 35시간까지 원하는 시간대에 근무하는 방식이다. 현행법은 임신 초기 12주 이내 및 임신 후기 36주 이후의 기간에 대해 일 2시간 단축 근무를 허용하고 있지만 넷마블은 이 제도를 확대 적용해 임신 전 기간 근로시간 2시간 단축제를 일괄 적용했다. 휴식이 필요하거나 병원 진료 등 임신한 직원이 모성보호시간을 갖도록 보장하기 위함이다. 근로시간 단축을 선택한 직원은 시간에 비례해 육아휴직수당에 더해 근무수당도 받는다.넷마블은 남성이 비교적 많은 게임업계에서 보건관리사가 상주하는 복지시설인 '힐링센터'를 새단장했다. 다양한 운동기구는 물론 AI/콘솔게임, 에어 하키/테이블 축구게임 등 다양한 게임기가 준비돼 있다. 임신한 직원들은 마사지 등을 더 넓은 공간에서 이용하며 건강하게 휴식을 취할 수 있는 공간이다. 2018년 4월 오픈한 헬스케어는 넷마블 사옥 B1층 힐링센터 내에 위치했다. 맞춤 클리닉이 필요한 넷마블 임직원이라면 언제든지 자유롭게 이용할 수 있다. 기초 건강관리 및 상담, 가벼운 질환/상처관리, 통증완화 물리치료, 금연 클리닉 등 증상별 1:1 맞춤 보건서비스를 제공 중이다. 직원들은 어깨가 뭉치거나, 허리, 손목에 통증이 있을 때는 저주파·초음파 마사지, 파라핀 왁스, 따끈한 찜질팩 마사지 등 증상별 마사지 치료를 받을 수 있다. 손가락/손목 통증에는 파라핀 왁스를, 어깨/목/허리/무릎 통증에는 저주파·초음파·찜질팩을 이용하는 등 언제든지 헬스케어에서 치료를 받을 수 있어서 인기를 얻고 있다.앞서 넷마블은 2017년 본사에서 견학프로그램의 일환인 'K-Girls Day'를 진행했다. 산업통상자원부가 주최하고 한국산업기술진흥원이 주관하는 K-Girls Day는 이공계 여대생 및 마이스터고 여학생들에게 현장 체험 기회를 제공하고 진학을 장려하는 교육 프로그램이다. 넷마블이 2013년부터 매 방학마다 개최한 '청소년 직업체험 교실'과 맥을 같이 한다.넷마블은 총 55명의 이공계 여학생을 초청해 게임산업의 특징과 진로의 유망성에 대해 특강은 물론, 게임 직무에 대한 실습 시간 등 실무 위주로 프로그램을 진행해 참가자들의 호평을 받았다. 학생들은 여성 임직원들과 직무 멘토링과 질의응답 시간을 가져 직업과 직무에 대해 궁금증을 해소하는 기회가 되기도 했다. 견학에 참가한 김홍주 충남대 학생은 ""게임으로만 만난 넷마블이라는 회사에 와서 이 게임들이 어떻게 만들어지는지 알게 되고 회사에 대해 구체적으로 알게 된 것 같다""며 ""친구들에게 게임 회사에 취업하고 싶다고 얘기하고 다닐 정도로 게임 회사에 대한 이미지가 좋아졌다""고 말했다.회사 관계자는 ""여성인재 육성을 적극적으로 추진하고 있는 기업의 방향성과 행사의 취지가 잘 부합됐고 이번 경험을 토대로 여성 인재들이 더욱 늘어나길 바란다""고 밝힌 바 있다.조혜승 기자 chohs1021@womennews.co.kr<Copyright ⓒ 여성신문. 무단전재 및 재배포 금지>",/news/news_read.nhn?article_id=0000078232&office_id=310&mode=search&query=현대모비스&page=1
,"외국인 투자자는 04일 거래소에서 KODEX 200, TIGER TOP10, NAVER 등을 중점적으로 사들인 것으로 나타났다.외국인 투자자의 순매수 상위 20개 종목은 KODEX 200, TIGER TOP10, NAVER, 카카오, LG전자, LG생활건강, 부광약품, KODEX 200선물인버스2X, 현대모비스, 더존비즈온등이다.이중에 서비스업 업종에 속한 종목이 3개 포함되어 있다.NAVER, 카카오, LG전자 등은 전일 대비 주가가 상승했고, KODEX 200, TIGER TOP10, LG생활건강 등은 주가가 하락했다.한경로보뉴스이 기사는 한국경제신문과 금융 AI 전문기업 씽크풀이 공동 개발한 기사 자동생성 알고리즘에 의해 실시간으로 작성된 것입니다.▶ ▶
 ▶
ⓒ 한국경제 & , 무단전재 및 재배포 금지",/news/news_read.nhn?article_id=0004334732&office_id=015&mode=search&query=현대모비스&page=1
