head,text,url
"자동차 미래 먹거리 쟁탈전전기차 협력 논의 삼성·현대차 총수전장 사업 시너지에도 깊은 관심LG도 전장 R&D에 6293억 투자올해 세계 전장시장 규모 377조디지털 콕핏, 2025년 40조 예상해외기업도 기술 확보·선점 경쟁","재계 1·2위 기업을 이끄는 이재용 삼성전자 부회장과 정의선 현대자동차그룹 부회장이 지난 13일 만났다. 충남 천안의 삼성SDI 사업장에서다. 두 사람이 사업 목적으로 따로 만난 것은 처음이었다. 이날 이들은 한 번 충전에 800㎞를 달리는 삼성SDI의 전고체 배터리(리튬이온이 이동하는 전해질을 고체로 만든 차세대 배터리) 기술을 살피고 3시간가량 전기차 분야 협력 방안을 논의한 것으로 알려졌다.

표면상 두 총수의 눈이 향한 곳은 전기차지만, 실제 이들은 반도체·스마트폰을 이을 한국의 ‘미래 먹거리’ 자동차 전자장비(전장) 분야 협력에도 깊은 관심을 가진 것으로 분석된다. 재계 고위 관계자는 “현대차그룹은 이미 LG화학·SK이노베이션과 전기차 배터리 분야에서 긴밀한 협력 관계라 삼성SDI가 여기 추가돼도 특별할 게 없다”라며 “미래차 시대에 핵심이 될 자동차 전장 분야 협력에도 (두 사람이) 교감한 것으로 안다”고 전했다. 세계 1위를 다투는 정보통신기술(ICT) 기업과 5위 완성차 기업이 자동차 전장으로 손잡으면 파급 효과가 전기차에서 협력할 때보다 훨씬 더 크다. 특히 ‘전장의 꽃’이라 불리는 디지털 콕핏(Digital Cockpit) 분야에서 시너지 효과를 낼 수 있다.





 디지털 콕핏은 사물인터넷(IoT) 등 ICT로 작동하는 자동차 조종석을 가리킨다. 터치 패널로 운전자가 주행 방식을 제어할 수 있어 다양한 맞춤형 운전이 가능해 자율주행 시대 핵심 기술이 집약된 곳이다. 또 뉴스·날씨 등 실시간 정보 검색, 음악·영화 감상까지 가능하게 한다. 삼성전자는 디지털 콕핏 시장을 선도할 만한 기술력을 쌓고 있다. 삼성전자는 2017년 약 9조원에 디지털 콕핏 제조가 장기인 세계 최대 자동차 전장 기업, 미국의 하만을 인수했다. 하만은 지난 1월 미국 라스베이거스에서 열린 ICT 박람회 ‘CES 2020’에서 삼성전자와 공동 개발한 5세대(5G) 이동통신 기반 디지털 콕핏을 선보였다. 내년에 양산되는 독일 BMW의 전기차에 탑재된다. 삼성전자는 자동차용 반도체 사업에도 대규모 투자를 계획하고 있다.


현대차그룹은 그룹 내 전장 부품 연구·개발(R&D)을 맡은 현대모비스가 디지털 콕핏을 지능화하는 데 집중하고 있다. 운전자의 건강 이상, 졸음 등 정상 운전이 불가능한 경우 자율주행 모드로 자동 전환해 안전한 곳으로 이동하는 DDREM(Departed Driver Rescue and Exit Maneuver) 시스템을 개발 중이다. 내년 상용화 예정이다.


삼성전자와 현대차가 손잡는 것과 별개로 국내 자동차 전장 산업은 미래가 밝은 것으로 평가된다. LG전자도 삼성전자와 현대차그룹 못잖게 자동차 전장 사업에 힘쓰고 있다. LG전자는 지난해 자동차 부품 솔루션 사업본부의 전장 분야 등 R&D와 상용화에 6293억원을 투자했다. 그 결과 미국 제너럴모터스(GM)의 프리미엄 브랜드 캐딜락에 초고해상도 플라스틱 유기발광다이오드(P-OLED) 디스플레이 기반 디지털 콕핏 시스템을 올해부터 공급하기로 했다. 메르세데스-벤츠의 모기업인 독일 다임러AG에는 자동차용 터치스크린 등을 공급하고 있다. 삼성전자가 5G와 반도체를 앞세웠다면, LG전자는 디스플레이라는 장기를 살리고 있다.





 시장 조사 업체들에 따르면 세계 자동차 전장 부품 시장 규모는 2015년 2390억 달러에서 올해 3033억 달러(약 377조원), 디지털 콕핏 시장 규모는 2018년 139억 달러에서 2025년 323억 달러(약 40조원)로 각각 커질 전망이다. 이에 해외 기업들도 기술 확보와 시장 선점에 열을 올리고 있다. 2014년 세계 최초로 디지털 콕핏을 상용화한 독일의 폴크스바겐은 아우디·스코다·람보르기니 등의 최신 차량에도 디지털 콕핏을 적용 중이다. 후발주자인 중국은 전기차 제조 기업 바이톤이 48인치 디스플레이의 초대형 디지털 콕핏을 제조하고 있다. 전기차 M-바이트에 탑재할 예정이다. 이 밖에 일본도 소니가 CES 2020에서 콘셉트 전기차(비전 S)를 공개해 전장 부품 사업 진출을 눈앞에 뒀다는 분석이다. 이를 위해 소니는 엔비디아와 퀄컴 등 미국 ICT 기업들과 협력 관계를 구축했다.

박철완 서정대 자동차학과 교수는 “자동차의 패러다임이 내연기관 중심에서 전장 중심으로 급격히 바뀌고 있어 기업들이 R&D와 상용화에 더 속도를 내야 하는 상황”이라며 “이를 위해 ICT 기업과 자동차 기업 간 협력 강화가 중요해졌다”고 분석했다. 신종 코로나바이러스 감염증(코로나19) 확산으로 세계 자동차 산업의 불확실성이 커진 만큼, 전장을 통한 새로운 성장동력 창출도 한층 중요해졌다는 분석이다.



다만 일각에선 대기업 간 협력뿐만 아니라 중소·중견기업 육성과 동반성장 노력도 절실해진 시점이라는 지적이 나온다. 윤병섭 서울벤처대학원대 융합산업학과 교수는 “규모는 작지만 기술이 뛰어난 강소기업들의 각종 전장 부품을 앞세워 미래차 시대에 선제 대응하고 있는 독일의 사례를 참고해야 한다”고 지적했다.



이창균 기자 smilee@joongang.co.kr▶ 중앙SUNDAY ▶
ⓒ중앙SUNDAY and 중앙일보 무단 전재 및 재배포 금지",/news/news_read.nhn?article_id=0000036992&office_id=353&mode=search&query=현대모비스&page=1
▶ 헉! 소리나는 스!토리 뉴스 [헉스]▶ '아는 척'하고 싶은 당신을 위한 [두유노우],※ 저작권자 ⓒ 파이낸셜뉴스. 무단 전재-재배포 금지,/news/news_read.nhn?article_id=0004434004&office_id=014&mode=search&query=현대모비스&page=1
,"[아시아경제 문채석 기자]""법 위반 정도와 효과를 종합적으로 분석한 결정이다. 공정위가 '느슨한 법 집행'으로 기조를 변경한 건 아니다.""조성욱 공정거래위원장은 미래에셋그룹의 일감 몰아주기 제재와 관련해 박현주 그룹 회장을 검찰 고발하지 않은 결정에 대해 이렇게 설명했다. 공정위가 일감 몰아주기로 제재를 한 한진·효성·대림(대림산업)·태광 등의 다른 그룹 총수는 검찰에 고발된 만큼 '박현주만 봐준 것 아니냐'는 의구심이 일각에서 제기된다.공정위는 지난 27일 미래에셋그룹의 계열사들이 합리적 고려·비교 없이 미래에셋컨설팅과 상당한 규모로 거래해 특수관계인(총수와 친족)에 부당 이익을 귀속시켰다며 미래에셋컨설팅 등 10개 계열사에 과징금 43억9100만원을 부과했다. 미래에셋컨설팅은 박현주 미래에셋 그룹 회장 특수관계인이 지분 91.86%(박현주 48.63%, 배우자·자녀 34.81%, 기타 친족 8.43%)를 보유한 비상장기업이다. 미래에셋컨설팅은 미래에셋캐피탈과 미래에셋자산운용을, 미래에셋캐피탈이 미래에셋대우와 미래에셋생명을 지배하는 식으로 그룹의 지배구조가 짜여 있다.공정위에 따르면 미래에셋그룹의 계열사는 미래에셋컨설팅이 운영하는 블루마운틴CC, 포시즌스호텔과 합리적 고려나 다른 사업자와 비교 없이 '상당한 규모'(430억원)로 거래했다. 공정위는 고객 접대 등 일반거래 시 블루마운틴CC, 포시즌스호텔 등만 이용하는 원칙을 고수했는데, 이는 명백한 '일감 몰아주기'라고 판단했다.미래에셋그룹 측은 공정위 전원회의(조 위원장 등 9인의 위원이 모여 진행. 법원의 판결격)에서 해당 골프장·호텔과의 거래는 총수 일가에 이익을 몰아주기 위한 게 아니라고 주장했다. '계열사 간 단순 거래'고, 계열사별로 떼놓고 보면 '상당한 규모'도 아니라고 해명했다. 이 중 '계열사 간 단순 거래' 주장은 전원회의에서 받아들여진 셈이다.미래에셋 관계자는 ""골프장, 호텔의 소유주는 미래에셋자산운용 펀드지만, 법령상 제약으로 미래에셋컨설팅이 불가피하게 운영을 하고 있다""며 ""공정위 조사기간인 2015년부터 3년간 미래에셋 내부거래 430억원 발생했지만, 미래에셋컨설팅은 같은 기간 3년간 318억원 적자가 발생했는데, 원인은 매출연동이 아닌 고정 임대료 방식으로 책정했기 때문""이라고 설명했다.공정위는 그룹을 행정조치하면서도 박 회장을 검찰에 고발하지 않았다. 그 이유로 ▲구체적 지시 물증을 포착하지 못했고 ▲독점규제 및 공정거래에 관한 법률(공정거래법) 제71조에 적힌 검찰고발 사유인 '객관적으로 명백하고 중대해 경쟁질서를 현저히 저해한다고 인정하는 경우'가 아니라고 봤으며 ▲과거 일감 몰아주기로 제재한 다른 총수 그룹 대비 계열사 매출 비중이 작았다는 점 등을 들었다.지난 27일 정부세종청사에서 브리핑을 한 정진욱 공정위 기업결합국장은 ""동일인 박현주가 사업 초기엔 블루마운틴CC의 영업방향, 수익상황, 블루마운틴CC와 포시즌스의 장점 등을 언급하고 있지만 직접적 사용 지시는 없다고 봤다""며 ""이 언급조차 사업 초기에만 행해졌다""고 경위를 설명했다.정 국장은 ""미래에셋그룹이 계열사에 일감을 몰아준 게 사실이지만 뜬금없이 새로운 거래를 창출한 게 아니라 거래처만 바꾼 것이기 때문에 법 위반성 정도가 (공정거래법 제71조 대비) 적다고 본 것""이라며 ""내부거래에 따른 매출 비중도 23.7%로, 태광의 54.24%보다 훨씬 작았던 점을 고려해 '명백하고 중대하게' 법을 위반한 것은 아니라고 판단했다""고 밝혔다.공정위의 설명에도 불구하고 시민단체 등은 비판을 쏟아냈다. 경제개혁연대는 28일 공정위의 미래에셋그룹 제재에 관해 ""사익편취행위 제재와 관련해 조원태 한진 회장·조현준 효성 회장·이해욱 대림 회장·이호진 태광 전 회장 등을 고발했던 공정위가 박 회장 일가와 주요 법인을 고발하지 않은 것은 형평성을 잃은 것이며, 사실상 '봐주기 제재'라 비판하지 않을 수 없다""고 꼬집었다.경제개혁연대는 검찰 고발 및 향후 수사를 통해 박 회장 일가의 개입여부를 밝혀내야 한다고 주장했으며 금융 당국에까지 ""발행어음 인가에 신중하라""고 주문했다.금융 당국과 미래에셋 측은 신중한 반응을 나타냈다. 금융 당국은 27일 공정위 제재로 박 회장이 자본시장법상 '대주주 적격성을 채우지 못한 인물'이란 이유로 미래에셋그룹의 발행어음업 등의 인가를 불허할 명분이 약해졌다. 미래에셋 측은 의결서 전문을 보고 난 뒤에 공정위 행정소송 여부를 결정할 것이란 입장이지만, 가능성은 크지 않다는 게 금융투자업계의 중론이다.금융투자업계에선 앞서 지난 2018년 11월14일 삼성바이오로직스가 '분식회계' 혐의로 과징금을 부과한 금융위원회 증권선물위원회를 제재 발표 직후 행정소송(1·2심 모두 삼성바이오 승소)을 건 사례가 있지만, 미래에셋 건은 이와 다르게 본다. 발행어음업 등 주요 사업에 대한 금융 당국의 인허가 문제가 걸려 있는 마당에 검찰고발을 피한 상황에서 굳이 공정위에 소를 걸어 경쟁 당국과 금융 당극을 자극할 이유가 없다는 게 일반적인 반응이다.공정위는 전임 김상조 위원장 재임시절엔 형사 고발을 확대하는 방향으로 법을 집행했다. 위법 행위를 한 임원뿐만 아니라 직원도 고발했다. 하지만 사건 상당수가 검찰 조사 단계에서 무혐의 판정을 받아 기소조차 이뤄지지 않은 사례가 많았다. 공정위가 대리점에 부품 구매를 강요했다는 이유로 회사 법인과 임원을 형사 고발한 현대모비스사건은 지난 2018년 11월 검찰이 '혐의 없음'으로 불기소 처분했다. 아파트 관리비 외부 감사 보수를 담합했다는 이유로 한국공인회계사회를 고발한 사건도 무혐의 판정을 받았다. 금융위 관계자는 ""이제 (인허가에 대한) 변수 하나가 없어진 것이고, 다시 승인 절차에 착수할 것""이라고 밝혔다. 미래에셋 관계자는 ""공정위 의결서 전문을 본 뒤 행정소송 여부 등 대응 방안을 결정하겠다""며 ""향후 공정위에서 지적한 프로세스와 사회적 책임에 대해 더욱 면밀히 검토해 보다 엄격한 준법경영문화를 정착시키고, 초대형 투자은행(IB) 사업에 매진해 자본시장 활성화에 기여하도록 노력할 예정""이라고 전했다.세종=문채석 기자 chaeso@asiae.co.kr <ⓒ경제를 보는 눈, 세계를 보는 창 아시아경제 무단전재 배포금지>",/news/news_read.nhn?article_id=0004688466&office_id=277&mode=search&query=현대모비스&page=1
